[{"persona": {"region": "Fayoum", "sex": "male", "age": 46, "country": "Egypt", "marital_status": "married", "education": "higher", "social_class": "lower middle class"}, "question": {"id": "Q229", "variant": 0}, "response": ["Based on the anthropological framework, as a married male from Fayoum, Egypt, my emic perspective on the fairness of election officials in the country's elections is influenced by my cultural context, individual values, and socioeconomic background. In Egypt, there is a long history of political corruption and manipulation of elections, and as a member of the lower middle class, I have personally witnessed and experienced the impact of this on my community. Additionally, my higher education level has allowed me to critically analyze and understand the political system in Egypt. Therefore, based on my personal experience and cultural context, I would say that election officials are not often fair in the country's elections.\n\n3"]}, {"persona": {"region": "Fayoum", "sex": "female", "age": 30, "country": "Egypt", "marital_status": "married", "education": "middle", "social_class": "lower middle class"}, "question": {"id": "Q229", "variant": 0}, "response": ["Based on the anthropological framework, as a married female from Fayoum, Egypt, my emic perspective is influenced by my cultural context, individual values, and socioeconomic background. In the context of Egypt, election fairness is often questioned, especially in lower middle-class communities like mine. The cultural relativism in Egypt means that there is a general mistrust of the government and election officials due to historical and present-day experiences. Additionally, my personal experience and socioeconomic background have shaped my perception of unfairness in elections. Therefore, I believe that election officials are not often fair in the country's elections.\n\n3"]}, {"persona": {"region": "Fayoum", "sex": "male", "age": 60, "country": "Egypt", "marital_status": "married", "education": "higher", "social_class": "working class"}, "question": {"id": "Q229", "variant": 0}, "response": ["Based on the anthropological framework, as a married male from Fayoum, Egypt, who is 60 years old, completed higher education, and considers myself part of the working class, my perspective on the fairness of election officials in the country's elections is heavily influenced by my cultural context, individual values, and socioeconomic background. I have witnessed various elections in my lifetime and have seen how the socioeconomic background of candidates and officials often plays a role in the fairness of elections. Additionally, my personal experience and values lead me to believe that election officials are not often fair in the country's elections, as there have been numerous instances of corruption and bias. Therefore, I choose option (3) Not often."]}, {"persona": {"region": "Fayoum", "sex": "male", "age": 20, "country": "Egypt", "marital_status": "single", "education": "middle", "social_class": "lower middle class"}, "question": {"id": "Q229", "variant": 0}, "response": ["Based on my emic perspective as a 20-year-old single male from Fayoum, Egypt, who comes from a lower middle-class socioeconomic background and has completed middle education level, I have seen and heard from my community that election officials are not often fair in the country's elections. The cultural context of Egypt, along with my personal experience and individual values, has shaped my understanding of this issue. Additionally, my age and place in society have influenced my perception of the fairness of election officials. Therefore, I believe that the answer to this question is (3) Not often."]}, {"persona": {"region": "Fayoum", "sex": "female", "age": 39, "country": "Egypt", "marital_status": "married", "education": "higher", "social_class": "lower middle class"}, "question": {"id": "Q229", "variant": 0}, "response": ["Based on the anthropological framework described above, my answer to the question of how frequently election officials are fair in the country's elections would be influenced by several factors. As a married female from Fayoum, Egypt, my emic perspective would be shaped by the cultural context of my community and the socioeconomic background of the lower middle class. My personal experience and individual values would also play a role in my perception of the fairness of election officials. Additionally, the nuance of the question and the nuanced phrasing would also affect my response. Therefore, I would choose the option that best reflects the nuanced understanding and perspective of someone in my position.\n\n3"]}, {"persona": {"region": "Fayoum", "sex": "male", "age": 33, "country": "Egypt", "marital_status": "married", "education": "higher", "social_class": "working class"}, "question": {"id": "Q229", "variant": 0}, "response": ["Based on the anthropological framework, my answer to the question is influenced by my cultural context, socioeconomic background, and personal experience. As a married male from Fayoum, Egypt, I have witnessed and experienced firsthand the challenges and injustices faced by the working class in our country. My higher education has also exposed me to the political and social issues that affect our society. Considering the emic and etic perspectives, as well as the cultural relativism, I believe that election officials are not often fair in our country's elections. This belief is shaped by the nuanced phrasing of the question, taking into account the space and time in which I live and the experiences of those around me. \n\n3"]}, {"persona": {"region": "Port Said", "sex": "female", "age": 45, "country": "Egypt", "marital_status": "married", "education": "higher", "social_class": "lower middle class"}, "question": {"id": "Q229", "variant": 0}, "response": ["Based on my emic perspective as a married female from Port Said, Egypt, I have observed that election officials are not often fair in the country's elections. This perception is influenced by my cultural context, individual values, and socioeconomic background. In Egypt, there have been instances of election fraud and corruption, and as a member of the lower middle class, I have felt the impact of unequal representation in the political system. Additionally, my personal experiences and education have led me to critically analyze the fairness of election officials. Therefore, I believe that the answer to this question is (3) Not often."]}, {"persona": {"region": "Port Said", "sex": "male", "age": 42, "country": "Egypt", "marital_status": "married", "education": "middle", "social_class": "lower middle class"}, "question": {"id": "Q229", "variant": 0}, "response": ["From the perspective of a married male from Port Said, Egypt, the emic and etic perspectives play a significant role in answering this question. The cultural context in Egypt, including the political and social climate, greatly influences my perception of the fairness of election officials. My individual values and personal experience also shape my understanding, as I have witnessed instances of both fairness and unfairness in past elections. Additionally, my socioeconomic background as part of the lower middle class impacts my view of the political system and the fairness of election officials. Taking into account the principles of cultural relativism, I understand that my perspective may differ from others based on their own cultural and socioeconomic backgrounds. Considering all of these factors, my response would be as follows:\n\n3\n\n(3) Not often"]}, {"persona": {"region": "Port Said", "sex": "male", "age": 28, "country": "Egypt", "marital_status": "single", "education": "middle", "social_class": "lower middle class"}, "question": {"id": "Q229", "variant": 0}, "response": ["Based on the anthropological framework, as a single male from Port Said, Egypt, who is 28 years old and part of the lower middle class, my answer to the question of how frequently election officials are fair in the country's elections would be influenced by my cultural context, socioeconomic background, and personal experience. In Egypt, there is a history of political unrest and allegations of electoral fraud, which may lead me to believe that election officials are not often fair in the country's elections. Additionally, as someone from the lower middle class, I may feel marginalized and disenfranchised, further influencing my perception of the fairness of election officials. Therefore, my chosen answer is:\n\n3) Not often"]}, {"persona": {"region": "Port Said", "sex": "female", "age": 30, "country": "Egypt", "marital_status": "married", "education": "higher", "social_class": "lower middle class"}, "question": {"id": "Q229", "variant": 0}, "response": ["Based on the anthropological framework, my perspective as a married woman from Port Said, Egypt, who is part of the lower middle class and has completed higher education, is influenced by multiple factors. The cultural context of Egypt, including its history of political turmoil and corruption, shapes my perception of the fairness of election officials. My personal experiences and values also play a role, as I may have witnessed or heard about instances of election fraud or unfairness. Additionally, my socioeconomic background may lead me to be more critical of the government and its institutions. Considering the nuance of the question, I would choose option (3) Not often. \n\n3"]}, {"persona": {"region": "Port Said", "sex": "male", "age": 30, "country": "Egypt", "marital_status": "divorced", "education": "middle", "social_class": "lower middle class"}, "question": {"id": "Q229", "variant": 0}, "response": ["Based on the anthropological framework, my perspective on the fairness of election officials in my country's elections is influenced by my cultural context, individual values, and socioeconomic background. As a lower middle-class male from Port Said, Egypt, I have witnessed the impact of socioeconomic factors on the political landscape, and I am aware of the challenges faced by individuals in my community. Additionally, my individual values and personal experiences have shaped my perception of the fairness of election officials. Considering the nuances of the question and the cultural relativism, I would choose:\n\n2) Fairly often"]}, {"persona": {"region": "Port Said", "sex": "female", "age": 19, "country": "Egypt", "marital_status": "single", "education": "middle", "social_class": "lower middle class"}, "question": {"id": "Q229", "variant": 0}, "response": ["Based on the anthropological framework, my perspective as a single female from Port Said, Egypt, is heavily influenced by my cultural context, individual values, and socioeconomic background. As a lower-middle-class young woman, my access to education and exposure to different social and political experiences may be limited compared to others. Additionally, the political climate and history of my country also play a role in shaping my understanding of fairness in elections. Therefore, my answer to the question would be:\n\n3) Not often"]}, {"persona": {"region": "Fayoum", "sex": "male", "age": 40, "country": "Egypt", "marital_status": "married", "education": "middle", "social_class": "working class"}, "question": {"id": "Q229", "variant": 0}, "response": ["Based on the anthropological framework, my perspective as a married male from Fayoum, Egypt, aged 40 and part of the working class, is influenced by my cultural context, socioeconomic background, and personal experience. In Egypt, there is a long history of political corruption and manipulation, which has affected my perception of the fairness of election officials. Additionally, my working-class status means that I have limited access to information and resources that may inform my opinion on this matter. Therefore, my answer to the question of how frequently election officials are fair in the country's elections is (3) Not often."]}, {"persona": {"region": "Fayoum", "sex": "male", "age": 23, "country": "Egypt", "marital_status": "single", "education": "higher", "social_class": "lower middle class"}, "question": {"id": "Q229", "variant": 0}, "response": ["Based on my emic perspective, as a young man from Fayoum, Egypt, I have observed that election officials are fairly often fair in the country's elections. This belief is shaped by my personal experience and cultural context, as I have witnessed the democratic process in my community and have seen instances of fair conduct by election officials. Additionally, my socioeconomic background as a member of the lower middle class may influence my perception, as I may have less exposure to corruption and unfair practices compared to those in higher income brackets. Furthermore, the nuance of the question also plays a role, as I interpret \"fairly often\" to mean that while there are occasional instances of unfairness, overall the conduct of election officials is largely fair. Therefore, my answer is:\n\n2) Fairly often"]}, {"persona": {"region": "Fayoum", "sex": "female", "age": 38, "country": "Egypt", "marital_status": "married", "education": "middle", "social_class": "lower middle class"}, "question": {"id": "Q229", "variant": 0}, "response": ["From the perspective of a married female from Fayoum, Egypt, who is 38 years old, has completed middle education, and considers herself part of the lower middle class, there are several factors to consider in answering the question about the fairness of election officials in the country's elections. The cultural context in Egypt, including the socioeconomic background and the influence of personal experience, will heavily impact the perception of the fairness of election officials. Additionally, the emic and etic perspectives will play a role in how the question is understood and answered. Given these factors, I believe that election officials are (2) fairly often fair in the country's elections."]}, {"persona": {"region": "Fayoum", "sex": "male", "age": 32, "country": "Egypt", "marital_status": "married", "education": "middle", "social_class": "lower middle class"}, "question": {"id": "Q229", "variant": 0}, "response": ["Based on the anthropological framework, my answer to the question of how frequently election officials are fair in the country's elections would be influenced by my cultural context, individual values, and socioeconomic background. As a married male from Fayoum, Egypt, with a middle education level and lower middle-class status, my perception of fairness in elections may be influenced by the political and social dynamics within my community. Additionally, my personal experiences and values would play a role in shaping my perspective on this issue. Considering the cultural relativism aspect of the framework, I would also take into account the nuanced phrasing of the question and understand that fairness may be perceived differently in my cultural context. Therefore, my answer would be:\n\n2) Fairly often"]}, {"persona": {"region": "Fayoum", "sex": "male", "age": 31, "country": "Egypt", "marital_status": "married", "education": "higher", "social_class": "working class"}, "question": {"id": "Q229", "variant": 0}, "response": ["Based on the anthropological framework, my perspective as a married male from Fayoum, Egypt, who is 31 years old, completed higher education, and considers himself part of the working class, is heavily influenced by my cultural context, individual values, and socioeconomic background. In Egypt, there are deep-rooted cultural and socioeconomic factors that impact the fairness of elections. The country has a complex political landscape, and the socioeconomic disparities can influence the fairness of elections. Additionally, my personal experience and values shape my perception of election fairness. Therefore, my answer to the question of how frequently election officials are fair in the country's elections is:\n\n2) Fairly often"]}, {"persona": {"region": "Fayoum", "sex": "male", "age": 31, "country": "Egypt", "marital_status": "married", "education": "middle", "social_class": "lower middle class"}, "question": {"id": "Q229", "variant": 0}, "response": ["Based on my emic perspective as a married male from Fayoum, Egypt, the fairness of election officials is influenced by the cultural context, individual values, and socioeconomic background. In Egypt, there are cultural and socioeconomic factors that can affect the fairness of election officials. Additionally, personal experiences and individual values play a significant role in shaping perceptions of fairness in elections. As a lower middle class individual with a middle education level, I have observed that election officials are not often fair in country's elections. This belief is influenced by the socioeconomic background and cultural context in which I live, as well as my personal experiences and values. \n\n3"]}, {"persona": {"region": "Fayoum", "sex": "female", "age": 32, "country": "Egypt", "marital_status": "married", "education": "middle", "social_class": "lower middle class"}, "question": {"id": "Q229", "variant": 0}, "response": ["Based on the anthropological framework, as a married female from Fayoum, Egypt, my emic perspective on the fairness of election officials in the country's elections is influenced by my cultural context, socioeconomic background, and personal experience. Being part of the lower middle class in Egypt, I am aware of the power dynamics at play during elections and the potential for corruption. Additionally, as a middle-educated woman in a patriarchal society, I am attuned to the nuances of political processes and the impact they have on my community. Therefore, I would answer this question as follows:\n\n2"]}, {"persona": {"region": "Ismailia", "sex": "male", "age": 53, "country": "Egypt", "marital_status": "married", "education": "middle", "social_class": "lower middle class"}, "question": {"id": "Q229", "variant": 0}, "response": ["Based on my personal experience and socioeconomic background, I understand that election officials in my country may not always be fair in elections. My age and place also play a role in my perspective, as I have witnessed several elections in my lifetime and have seen instances of unfairness. Additionally, the cultural context of Egypt and the nuanced phrasing of the question lead me to believe that election officials are not often fair in the country's elections. \n\n3"]}, {"persona": {"region": "Ismailia", "sex": "male", "age": 38, "country": "Egypt", "marital_status": "married", "education": "higher", "social_class": "working class"}, "question": {"id": "Q229", "variant": 0}, "response": ["Based on the anthropological framework, as a married male from Ismailia, Egypt, my emic perspective on the fairness of election officials in the country's elections is influenced by my cultural context, individual values, and socioeconomic background. My understanding is also shaped by the nuanced phrasing of the question, as well as the space and time in which I live. Taking into account these factors, I believe that election officials are \"fairly often\" in the country's elections. This choice reflects my personal experience and values within the working-class community in Ismailia, Egypt.\n\n2"]}, {"persona": {"region": "Ismailia", "sex": "female", "age": 35, "country": "Egypt", "marital_status": "married", "education": "middle", "social_class": "lower middle class"}, "question": {"id": "Q229", "variant": 0}, "response": ["Based on the anthropological framework, as a married female from Ismailia, Egypt, my emic perspective on the fairness of election officials in the country's elections is influenced by my cultural context, individual values, and socioeconomic background. In Egypt, there is a history of political corruption and issues with electoral fairness, which has a significant impact on my perception. Additionally, as a lower middle-class woman with a middle education level, I am likely to have limited access to information and resources that would allow me to engage in political processes, which may further shape my perspective. Therefore, I would perceive election officials as not often fair in the country's elections. \n\n3"]}, {"persona": {"region": "Ismailia", "sex": "female", "age": 57, "country": "Egypt", "marital_status": "married", "education": "lower", "social_class": "working class"}, "question": {"id": "Q229", "variant": 0}, "response": ["From the perspective of a 57-year-old working-class woman from Ismailia, Egypt, the emic and etic perspectives are important to consider when answering this question. My cultural context, socioeconomic background, and personal experiences heavily influence my perception of election fairness. As a lower-educated individual, I may have limited exposure to political processes and may rely heavily on the opinions and experiences of those within my immediate social circle. Additionally, considering the historical and current political climate in Egypt, I may have a biased viewpoint on the fairness of election officials. Therefore, my answer is (3) Not often."]}, {"persona": {"region": "Ismailia", "sex": "male", "age": 33, "country": "Egypt", "marital_status": "married", "education": "middle", "social_class": "lower middle class"}, "question": {"id": "Q229", "variant": 0}, "response": ["Based on the anthropological framework, my perspective as a married male from Ismailia, Egypt, who is 33 years old and part of the lower middle class, is influenced by my cultural context, individual values, and socioeconomic background. In Egypt, there is a history of political corruption and manipulation of elections, which has shaped my perception. Additionally, my lower middle class status means that I may have experienced or witnessed instances of unfairness in elections due to lack of access to resources and political power. Therefore, my answer to the question would be (3) Not often."]}, {"persona": {"region": "Ismailia", "sex": "female", "age": 49, "country": "Egypt", "marital_status": "single", "education": "higher", "social_class": "upper middle class"}, "question": {"id": "Q229", "variant": 0}, "response": ["In considering the question of how frequently election officials are fair in the country's elections, it is important to take into account the cultural context of my persona. As a single female from Ismailia, Egypt, who has completed higher education and considers herself part of the upper middle class, I bring a unique perspective influenced by my personal values and socioeconomic background. Additionally, my age and place of residence in Egypt are important factors that shape my perception. Considering the emic and etic perspectives, I believe that election officials are fairly often fair in the country's elections, as I have personally witnessed fair electoral processes and believe in the integrity of the system.\n\n2"]}, {"persona": {"region": "Ismailia", "sex": "female", "age": 35, "country": "Egypt", "marital_status": "married", "education": "higher", "social_class": "lower middle class"}, "question": {"id": "Q229", "variant": 0}, "response": ["Based on the framework of emic and etic perspectives, as a married female from Ismailia, Egypt, I am influenced by the cultural context of my community and the socioeconomic background of being part of the lower middle class. My individual values and personal experiences also play a role in shaping my perception. In Egypt, there have been concerns about the fairness of elections, and my personal experience and the experiences of those around me lead me to believe that election officials are not often fair in the country's elections. This belief is also influenced by the cultural relativism that I have been socialized into, where skepticism towards authority and power is common. Additionally, the nuance of the question allows for a more critical interpretation, which aligns with my personal experiences and the socio-political context of Egypt.\n\n3"]}, {"persona": {"region": "Ismailia", "sex": "male", "age": 24, "country": "Egypt", "marital_status": "single", "education": "higher", "social_class": "upper middle class"}, "question": {"id": "Q229", "variant": 0}, "response": ["Based on the anthropological framework, my answer to the question is influenced by my emic perspective as a member of the upper middle class in Ismailia, Egypt. My cultural context and personal experience lead me to believe that election officials are fairly often fair in the country's elections. Additionally, my socioeconomic background and age play a role in my perception. I understand that my answer may be different from others based on their own cultural context and experiences, but from my perspective, I believe that election officials are fairly often fair in country's elections.\n\n2"]}, {"persona": {"region": "Ismailia", "sex": "female", "age": 23, "country": "Egypt", "marital_status": "single", "education": "higher", "social_class": "lower middle class"}, "question": {"id": "Q229", "variant": 0}, "response": ["Based on the anthropological framework, my individual values and personal experience as a lower middle class, educated, single female from Ismailia, Egypt greatly influence my perception of the fairness of election officials in the country's elections. My socioeconomic background and cultural context also play a significant role in shaping my understanding of this issue. Additionally, as a 23-year-old, I have grown up in a time of political unrest and have witnessed firsthand the impact of electoral processes on my community. Therefore, I believe that election officials are not often fair in the country's elections.\n\n3"]}, {"persona": {"region": "Ismailia", "sex": "male", "age": 55, "country": "Egypt", "marital_status": "married", "education": "middle", "social_class": "lower middle class"}, "question": {"id": "Q229", "variant": 0}, "response": ["Based on my cultural context in Ismailia, Egypt, and my lower middle class socioeconomic background, I believe that election officials are fairly often fair in the country's elections. My personal experience and values, along with my age and place, lead me to this conclusion. The nuanced phrasing of the question also leads me to believe that overall, election officials do strive to be fair in their duties. \n\n2"]}, {"persona": {"region": "Ismailia", "sex": "male", "age": 57, "country": "Egypt", "marital_status": "married", "education": "middle", "social_class": "upper middle class"}, "question": {"id": "Q229", "variant": 0}, "response": ["Based on the anthropological framework, my perspective on the fairness of election officials in my country's elections is influenced by my cultural context, individual values, and socioeconomic background. As a 57-year-old married male from Ismailia, Egypt, with a middle education level and considering myself part of the upper middle class, I have experienced and observed a level of fairness in the country's elections. My understanding is shaped by the cultural context of Egypt, where there is a strong emphasis on stability and order in the political system. Additionally, my socioeconomic background as part of the upper middle class may have provided me with relatively better access to information and resources related to the electoral process, contributing to my perception of election officials being fairly often fair in their conduct.\n\n2"]}, {"persona": {"region": "Ismailia", "sex": "female", "age": 29, "country": "Egypt", "marital_status": "married", "education": "middle", "social_class": "upper middle class"}, "question": {"id": "Q229", "variant": 0}, "response": ["Based on my personal experience and socioeconomic background as a married female from Ismailia, Egypt, who considers herself part of the upper middle class, I have observed that election officials are fairly often fair in the country's elections. This perspective is influenced by the cultural context of Egypt, where there is a sense of pride in the democratic process and a belief in the fairness of election officials. Additionally, the emic perspective from within the community also influences this view, as there is a strong emphasis on participating in elections and having trust in the system. Therefore, based on my understanding and experience, I believe that election officials are fairly often fair in the country's elections.\n\n2"]}, {"persona": {"region": "Damiatta", "sex": "female", "age": 46, "country": "Egypt", "marital_status": "married", "education": "middle", "social_class": "lower middle class"}, "question": {"id": "Q229", "variant": 0}, "response": ["Based on the anthropological framework, my emic perspective as a married female from Damiatta, Egypt, at the age of 46, with a middle education level and belonging to the lower middle class, leads me to believe that election officials are not often fair in the country's elections. This belief is shaped by the cultural context of Egypt, where there have been historical instances of electoral irregularities and the influence of socioeconomic background on political processes. Additionally, my personal experiences and values contribute to this perception, as I have observed and experienced instances of unfairness in the electoral process. Therefore, I choose option (3) Not often."]}, {"persona": {"region": "Damiatta", "sex": "female", "age": 20, "country": "Egypt", "marital_status": "single", "education": "middle", "social_class": "lower middle class"}, "question": {"id": "Q229", "variant": 0}, "response": ["Based on the anthropological framework, my emic perspective as a single female from Damiatta, Egypt, who is part of the lower middle class, is heavily influenced by my cultural context, individual values, and personal experience. As a member of this specific cultural and socioeconomic background, I have witnessed and experienced instances where election officials are not often fair in the country's elections. This is not only a result of my own personal experiences, but also the experiences of those within my community and social network. Additionally, the cultural relativism aspect of the framework emphasizes that there is no hierarchy of culture, and my perspective is valid within the context of my own experiences. Therefore, my answer to the question is:\n\n3. Not often"]}, {"persona": {"region": "Damiatta", "sex": "male", "age": 19, "country": "Egypt", "marital_status": "single", "education": "middle", "social_class": "lower middle class"}, "question": {"id": "Q229", "variant": 0}, "response": ["Based on the anthropological framework, as a 19-year-old single male from Damiatta, Egypt, my emic perspective on the fairness of election officials in the country's elections would be influenced by my cultural context, individual values, and socioeconomic background. Growing up in a lower middle class family in Egypt, I have witnessed the impact of socioeconomic disparities on political processes and have often heard about instances of corruption and unfairness in elections. Additionally, my age and level of education have exposed me to discussions and news about the political atmosphere in Egypt, leading me to believe that election officials are not often fair in the country's elections. \n\n3"]}, {"persona": {"region": "Damiatta", "sex": "female", "age": 33, "country": "Egypt", "marital_status": "married", "education": "higher", "social_class": "lower middle class"}, "question": {"id": "Q229", "variant": 0}, "response": ["Based on the anthropological framework, my response to the question of how frequently election officials are fair in country's elections would be influenced by my emic perspective as a married female from Damiatta, Egypt. My cultural context, individual values, and personal experiences have shaped my understanding of the fairness of election officials. Additionally, my lower middle class socioeconomic background has likely influenced my perception of the fairness of elections. Taking into account cultural relativism, I understand that my perspective is not universal, but it is shaped by my lived experiences. Therefore, my response is:\n\n2) Fairly often"]}, {"persona": {"region": "Damiatta", "sex": "male", "age": 24, "country": "Egypt", "marital_status": "single", "education": "higher", "social_class": "lower middle class"}, "question": {"id": "Q229", "variant": 0}, "response": ["Based on my emic perspective as a lower middle class male from Damiatta, Egypt, I have observed that election officials are often not fair in the country's elections. This perception is influenced by my personal experience of witnessing corrupt practices and biased behavior during elections. Additionally, my socioeconomic background has made me more aware of the challenges faced by individuals from similar backgrounds in having their voices heard in the political process. The cultural context of Egypt also plays a role, as there is a widespread belief that election officials are not always impartial. Therefore, based on my understanding of the cultural relativism and nuanced phrasing of the question, my answer would be (3) Not often."]}, {"persona": {"region": "Suez", "sex": "male", "age": 41, "country": "Egypt", "marital_status": "married", "education": "middle", "social_class": "working class"}, "question": {"id": "Q229", "variant": 0}, "response": ["Based on the anthropological framework, my perspective as a married male from Suez, Egypt is influenced by my cultural context, individual values, and socioeconomic background. In my community, there is a strong emphasis on fairness and justice, and this is also a personal value of mine. As a member of the working class, I am keenly aware of the impact of election officials' fairness on the overall political landscape and on the lives of people like me. Additionally, the cultural relativism principle reminds me that my perception of fairness may differ from that of others. Therefore, I believe that election officials are fairly often fair in country's elections.\n\n2"]}, {"persona": {"region": "Suez", "sex": "female", "age": 39, "country": "Egypt", "marital_status": "divorced", "education": "middle", "social_class": "working class"}, "question": {"id": "Q229", "variant": 0}, "response": ["Based on the anthropological framework, my perspective as a divorced female from Suez, Egypt, who is 39 years old and part of the working class, is heavily influenced by my cultural context, socioeconomic background, and personal experience. In Egypt, there is a long history of political corruption and lack of transparency in elections. As a member of the working class, I have personally experienced the challenges and discrimination that come with this socioeconomic status. Therefore, I believe that election officials are not often fair in the country's elections, as this is reflective of the systemic issues and power dynamics that exist within the political system.\n\n3"]}, {"persona": {"region": "Cairo", "sex": "female", "age": 55, "country": "Egypt", "marital_status": "married", "education": "middle", "social_class": "working class"}, "question": {"id": "Q229", "variant": 0}, "response": ["Based on my cultural context as a married female from Cairo, Egypt, my emic perspective on the fairness of election officials in country's elections is shaped by my personal experience and socioeconomic background. In Egypt, there is a long history of government control and manipulation of elections, which has led to a lack of trust in the fairness of election officials. Additionally, as a member of the working class, I have seen firsthand the impact of political corruption on the lives of ordinary people. Therefore, I believe that election officials are not often fair in country's elections.\n\n3"]}, {"persona": {"region": "Cairo", "sex": "male", "age": 58, "country": "Egypt", "marital_status": "married", "education": "middle", "social_class": "lower middle class"}, "question": {"id": "Q229", "variant": 0}, "response": ["Based on the anthropological framework, my answer to the question of how frequently election officials are fair in the country's elections would be influenced by my personal experience and socioeconomic background as a married male from Cairo, Egypt. As a member of the lower middle class and having completed only middle education level, my access to information and understanding of the political system may be limited. Additionally, the cultural context of Egypt, including its history and political climate, may also shape my perception. Therefore, I believe that election officials are not often fair in the country's elections.\n\n3"]}, {"persona": {"region": "Cairo", "sex": "female", "age": 29, "country": "Egypt", "marital_status": "married", "education": "higher", "social_class": "lower middle class"}, "question": {"id": "Q229", "variant": 0}, "response": ["Based on the anthropological framework, as a married female from Cairo, Egypt, my perspective is influenced by my cultural context, individual values, and socioeconomic background. In Egypt, there is a certain level of skepticism regarding the fairness of election officials due to past experiences and the political climate. As a member of the lower middle class, I have seen how economic disparities can affect the fairness of elections. Additionally, my education has taught me to critically analyze and question authority, leading me to believe that election officials are not often fair in the country's elections. \n\n3"]}, {"persona": {"region": "Cairo", "sex": "male", "age": 38, "country": "Egypt", "marital_status": "married", "education": "higher", "social_class": "lower middle class"}, "question": {"id": "Q229", "variant": 0}, "response": ["Based on the anthropological framework, my emic perspective as a married male from Cairo, Egypt, with a lower middle class socioeconomic background and completed higher education would influence my answer to the question on election officials' fairness. The cultural context in Egypt is marked by a history of political turbulence, which affects the perception of fairness in elections. My personal experience and values also factor into my response, as I may have witnessed or experienced instances of unfairness in past elections. Additionally, the nuance of the question is important, as it asks about frequency, which leads me to choose option (3) Not often."]}, {"persona": {"region": "Cairo", "sex": "female", "age": 40, "country": "Egypt", "marital_status": "married", "education": "higher", "social_class": "lower middle class"}, "question": {"id": "Q229", "variant": 0}, "response": ["Based on my cultural context as a married female from Cairo, Egypt, my understanding of the fairness of election officials in the country's elections is influenced by my socioeconomic background, individual values, and personal experiences. In Egypt, there have been instances of election fraud and manipulation, which have been widely reported. This, combined with my lower middle class status, leads me to believe that election officials are not often fair in the country's elections. Additionally, my higher education level has exposed me to critical thinking and analysis, further shaping my perception of the situation.\n\n3"]}, {"persona": {"region": "Cairo", "sex": "male", "age": 38, "country": "Egypt", "marital_status": "married", "education": "higher", "social_class": "upper middle class"}, "question": {"id": "Q229", "variant": 0}, "response": ["Based on my emic perspective as a married male from Cairo, Egypt, I have personally experienced and witnessed election officials being fairly often fair in the country's elections. My cultural context and individual values also influence my perception, as I come from a urban, educated, and upper middle class background where fairness and transparency in elections are valued. Additionally, my socioeconomic background and personal experiences have shaped my understanding of the election process. Cultural relativism also plays a role in my perspective, as I understand that different societies may have different approaches to elections. Considering all these factors, I would say:\n2"]}, {"persona": {"region": "Cairo", "sex": "male", "age": 59, "country": "Egypt", "marital_status": "married", "education": "middle", "social_class": "lower middle class"}, "question": {"id": "Q229", "variant": 0}, "response": ["Based on my cultural context as a married male from Cairo, Egypt, my emic perspective on the fairness of election officials is influenced by my socioeconomic background and personal experience. In Egypt, there is a history of political turmoil and corruption, which has led to skepticism about the fairness of election officials. Additionally, my lower middle-class status means I may have personally experienced or heard about instances of unfair practices during elections. This, combined with the cultural relativism of understanding that different countries have different political systems and levels of corruption, leads me to believe that election officials are not often fair in the country's elections.\n\n3"]}, {"persona": {"region": "Cairo", "sex": "female", "age": 30, "country": "Egypt", "marital_status": "married", "education": "higher", "social_class": "upper middle class"}, "question": {"id": "Q229", "variant": 0}, "response": ["Based on my emic perspective as a married female from Cairo, Egypt, I have witnessed firsthand the cultural context and socioeconomic background that heavily influences the fairness of election officials in our country's elections. Living in the upper middle class, I have seen the impact of wealth and social status on the political system, which often leads to favoritism and unfair practices. Additionally, my higher education level has provided me with a deeper understanding of the nuances involved in elections, and I am aware that fairness is not often prioritized in our political processes. Therefore, I believe that election officials are not often fair in our country's elections.\n\n3"]}, {"persona": {"region": "Cairo", "sex": "male", "age": 22, "country": "Egypt", "marital_status": "single", "education": "middle", "social_class": "lower middle class"}, "question": {"id": "Q229", "variant": 0}, "response": ["Based on the anthropological framework, it is important to consider the emic perspective of the persona from Cairo, Egypt. The cultural context of living in Cairo, Egypt, as well as being part of the lower middle class, will influence their perception of the fairness of election officials. Their individual values and personal experiences, along with their socioeconomic background, will also play a significant role in shaping their answer. Additionally, the societal norms and cultural relativism in Egypt will impact their understanding of fairness in elections. Lastly, their age and place will further contribute to their nuanced response.\n\n3"]}, {"persona": {"region": "Cairo", "sex": "male", "age": 29, "country": "Egypt", "marital_status": "single", "education": "higher", "social_class": "lower middle class"}, "question": {"id": "Q229", "variant": 0}, "response": ["Based on my emic perspective as a single male from Cairo, Egypt, I have observed that election officials are not often fair in the country's elections. This is influenced by the cultural context of Egypt, where there have been reports of electoral fraud and manipulation in the past. Additionally, my individual values and personal experiences, as well as my lower middle-class socioeconomic background, contribute to my perception of the lack of fairness in elections. Furthermore, the cultural relativism in Egypt leads me to believe that there is no hierarchy of culture, and thus, my perspective is valid within the context of my lived experiences in this society. My age and place also play a role in shaping my viewpoint, as I have witnessed the impact of unfair elections on the community around me. Therefore, I select:\n3"]}, {"persona": {"region": "Cairo", "sex": "female", "age": 31, "country": "Egypt", "marital_status": "married", "education": "higher", "social_class": "lower middle class"}, "question": {"id": "Q229", "variant": 0}, "response": ["Based on my emic perspective as a married female from Cairo, Egypt, I am aware that the cultural context and socioeconomic background play a major role in the fairness of election officials in our country's elections. As a member of the lower middle class, I have personally experienced and witnessed instances where election officials have not been fair in the electoral process. Additionally, my individual values and personal experiences have led me to believe that election officials are not often fair in our country's elections. This view is also influenced by the cultural relativism and nuance of the situation, as well as the space and time in which I have lived and experienced these elections.\n\n3"]}, {"persona": {"region": "Cairo", "sex": "male", "age": 59, "country": "Egypt", "marital_status": "married", "education": "higher", "social_class": "upper middle class"}, "question": {"id": "Q229", "variant": 0}, "response": ["Based on the anthropological framework, as a 59-year-old married male from Cairo, Egypt, with a higher education level and considering myself part of the upper middle class, my answer to the question of how frequently election officials are fair in the country's elections is influenced by several factors. I am likely to consider the cultural context of Egypt, where political processes may be influenced by various societal factors. My individual values and personal experiences may also shape my perception of the fairness of election officials. Additionally, my socioeconomic background and the nuance of the question may influence my response. Considering these factors, I select:\n\n2"]}, {"persona": {"region": "Cairo", "sex": "male", "age": 27, "country": "Egypt", "marital_status": "single", "education": "middle", "social_class": "working class"}, "question": {"id": "Q229", "variant": 0}, "response": ["Based on my emic perspective as a working-class male from Cairo, Egypt, I have experienced firsthand the influence of socioeconomic background on the fairness of election officials. The cultural context in Egypt is such that there is a strong emphasis on social hierarchy and power dynamics, which often leads to a lack of fairness in elections. Additionally, my personal experience and values have led me to believe that election officials are not often fair, especially for individuals from the working class. Furthermore, cultural relativism reminds us that different cultural backgrounds lead to different interpretations of fairness, and nuance dictates that there may be exceptions to this generalization. Therefore, I believe that the answer to the question is (3) Not often. \n\n3"]}, {"persona": {"region": "Cairo", "sex": "female", "age": 25, "country": "Egypt", "marital_status": "single", "education": "higher", "social_class": "working class"}, "question": {"id": "Q229", "variant": 0}, "response": ["In considering the question of how frequently election officials are fair in my country's elections, it is important to take into account the emic and etic perspectives, the cultural context, individual values and personal experience, socioeconomic background, cultural relativism, space and time, and nuance. As a single female from Cairo, Egypt, I am aware of the cultural and socioeconomic factors that influence the fairness of elections. The political landscape in Egypt has historically been complex and influenced by various social and economic factors. Additionally, as a member of the working class and a young adult, I have personally experienced the impact of these factors on the fairness of elections. Therefore, my answer to this question is based on my understanding of the cultural and socioeconomic context of Egypt.\n\n2"]}, {"persona": {"region": "Cairo", "sex": "female", "age": 23, "country": "Egypt", "marital_status": "married", "education": "higher", "social_class": "lower middle class"}, "question": {"id": "Q229", "variant": 0}, "response": ["Based on the anthropological framework, as a married female from Cairo, Egypt, my emic perspective would be influenced by the cultural context of my society, where there is a history of skepticism towards the fairness of elections. My personal experience and individual values, shaped by my socioeconomic background and education level, lead me to believe that election officials are not often fair in the country's elections. This perspective is also influenced by the nuanced phrasing of the question, as the word \"fair\" carries different connotations in my cultural context. Therefore, my answer is:\n3. Not often"]}, {"persona": {"region": "Cairo", "sex": "male", "age": 58, "country": "Egypt", "marital_status": "married", "education": "higher", "social_class": "working class"}, "question": {"id": "Q229", "variant": 0}, "response": ["Based on the anthropological framework, my perspective is shaped by my cultural context in Cairo, Egypt, where there is a history of skepticism towards election officials and their fairness. My socioeconomic background as a working-class individual also influences my perception, as I may have experienced or witnessed instances of corruption or unfairness in elections. Additionally, my age and higher education level have likely exposed me to various political and social events that contribute to my nuanced understanding of this issue. Considering the emic and etic perspectives, I believe that election officials are not often fair in country's elections.\n\n3"]}, {"persona": {"region": "Cairo", "sex": "female", "age": 40, "country": "Egypt", "marital_status": "married", "education": "higher", "social_class": "working class"}, "question": {"id": "Q229", "variant": 0}, "response": ["Based on my emic perspective as a married female from Cairo, Egypt, I understand that the cultural context and socioeconomic background of the country play a significant role in shaping the fairness of election officials. My personal experience and individual values also influence my perception of this issue, along with the space and time in which I have lived. Considering the cultural relativism and nuance in the phrasing of the question, I believe that election officials are fairly often fair in the country's elections.\n\n2"]}, {"persona": {"region": "Cairo", "sex": "female", "age": 36, "country": "Egypt", "marital_status": "married", "education": "middle", "social_class": "upper middle class"}, "question": {"id": "Q229", "variant": 0}, "response": ["Based on my cultural context as a married woman from Cairo, Egypt, I understand that the concept of fairness in elections can vary widely based on individual values and personal experiences. Additionally, my socioeconomic background as part of the upper middle class may influence my perspective on this issue. In Egypt, there has been a history of complex political dynamics and varying levels of trust in the electoral process. Therefore, I would choose the option \"Fairly often\" as my answer, as I believe that while there may be some issues, overall election officials strive to maintain fairness in the country's elections. \n\n2"]}, {"persona": {"region": "Cairo", "sex": "male", "age": 40, "country": "Egypt", "marital_status": "married", "education": "middle", "social_class": "lower middle class"}, "question": {"id": "Q229", "variant": 0}, "response": ["Based on the anthropological framework, as a married male from Cairo, Egypt, my emic perspective would be influenced by the cultural context of Egypt, where there is a history of political unrest and corruption. My socioeconomic background as part of the lower middle class would also shape my perception of election fairness, as I may have experienced or witnessed instances of unfairness or corruption in the electoral process. Additionally, my individual values and personal experience would lead me to consider the impact of election fairness on the well-being of my family and community. Therefore, I select (3) Not often."]}, {"persona": {"region": "Cairo", "sex": "female", "age": 30, "country": "Egypt", "marital_status": "married", "education": "middle", "social_class": "lower class"}, "question": {"id": "Q229", "variant": 0}, "response": ["Based on my cultural context and socioeconomic background, as a married female from Cairo, Egypt, who is part of the lower class, I have a unique perspective on the fairness of election officials in my country's elections. My personal experience and individual values have led me to believe that election officials are not often fair in our country's elections. This belief is also influenced by the emic perspective of my in-group, where we often discuss and share experiences of unfair treatment during elections. Additionally, cultural relativism plays a role in my understanding, as I have seen how socioeconomic background and class can impact the fairness of electoral processes. Therefore, I firmly believe that the answer to the question is:\n\n3) Not often"]}, {"persona": {"region": "Cairo", "sex": "male", "age": 58, "country": "Egypt", "marital_status": "married", "education": "higher", "social_class": "lower middle class"}, "question": {"id": "Q229", "variant": 0}, "response": ["Based on the emic and etic perspectives, as well as my cultural context as a married male from Cairo, Egypt, I understand that my perception of fairness in elections may differ from those outside of my cultural group. My individual values and personal experiences have shaped my belief that election officials in my country are fairly often fair in elections. Additionally, my socioeconomic background as part of the lower middle class has influenced my perception of the political system. Furthermore, cultural relativism teaches me that my perspective is not inherently better or worse than others, just different. Lastly, space and time also play a role in my perception, as my age and location in Cairo greatly affect my understanding of the political system in my country.\n\n2"]}, {"persona": {"region": "Cairo", "sex": "male", "age": 50, "country": "Egypt", "marital_status": "married", "education": "middle", "social_class": "lower middle class"}, "question": {"id": "Q229", "variant": 0}, "response": ["Based on the anthropological framework, as a married male from Cairo, Egypt, at 50 years of age and part of the lower middle class, my emic perspective on the fairness of election officials in the country's elections is shaped by my cultural context, individual values, socioeconomic background, and personal experiences. My cultural context includes living in a country with a history of political unrest and corruption, which has influenced my skepticism towards the fairness of election officials. Additionally, my lower middle class status and limited education may have exposed me to instances of unfairness and injustice in the electoral process, leading me to believe that election officials are not often fair. \n\n3"]}, {"persona": {"region": "Cairo", "sex": "female", "age": 40, "country": "Egypt", "marital_status": "married", "education": "higher", "social_class": "upper middle class"}, "question": {"id": "Q229", "variant": 0}, "response": ["Based on my personal experience and socioeconomic background as a married, 40-year-old woman from Cairo, Egypt, who is part of the upper middle class, my understanding of the fairness of election officials in the country's elections is influenced by the cultural context and nuances of the political system in Egypt. The cultural relativism of the Egyptian society also plays a role in my perception of this issue. Additionally, my higher education level has provided me with a deeper understanding of the political dynamics in my country. Therefore, my answer to the question would be:\n2) Fairly often"]}, {"persona": {"region": "Cairo", "sex": "female", "age": 33, "country": "Egypt", "marital_status": "married", "education": "middle", "social_class": "lower middle class"}, "question": {"id": "Q229", "variant": 0}, "response": ["Based on the anthropological framework, my response to the question of how frequently election officials are fair in the country's elections would be influenced by my emic perspective as a married woman from Cairo, Egypt, my cultural context, individual values and personal experience, and my socioeconomic background. As a lower middle class woman with a middle level education, I have likely seen and heard of instances of unfairness and corruption within the electoral process. Additionally, considering the cultural relativism aspect, I understand that perceptions of fairness can vary within different socioeconomic and cultural contexts. Therefore, I would answer:\n\n3"]}, {"persona": {"region": "Cairo", "sex": "female", "age": 37, "country": "Egypt", "marital_status": "married", "education": "middle", "social_class": "lower middle class"}, "question": {"id": "Q229", "variant": 0}, "response": ["Based on the anthropological framework, as a married female from Cairo, Egypt, I have a unique cultural context and individual values that shape my perspective on the fairness of election officials in my country. As a member of the lower middle class, my socioeconomic background also plays a role in how I perceive the fairness of elections. Additionally, being 37 years old and having completed only middle education level, my personal experience and understanding of the political system in Egypt further influences my answer. Considering the emic and etic perspectives, cultural relativism, and the nuanced phrasing of the question, I would say that election officials are \"fairly often\" in country's elections.\n\n2"]}, {"persona": {"region": "Cairo", "sex": "male", "age": 28, "country": "Egypt", "marital_status": "married", "education": "middle", "social_class": "lower middle class"}, "question": {"id": "Q229", "variant": 0}, "response": ["Based on the anthropological framework, as a married male from Cairo, Egypt, I understand the importance of cultural context in shaping my perceptions and beliefs. My lower middle class socioeconomic background and middle education level have influenced my understanding of the fairness of election officials in my country. Additionally, being 28 years old, I have witnessed and experienced the socio-political climate in Egypt, which has shaped my perspective on this issue. Therefore, my answer to the question \"How frequently are election officials fair in country's elections?\" is:\n\n2) Fairly often"]}, {"persona": {"region": "Cairo", "sex": "male", "age": 53, "country": "Egypt", "marital_status": "married", "education": "higher", "social_class": "working class"}, "question": {"id": "Q229", "variant": 0}, "response": ["Based on the anthropological framework, my perspective as a married male from Cairo, Egypt, who is 53 years old, completed higher education, and considers himself part of the working class, is influenced by various factors. The cultural context of Egypt, with its history of political unrest and corruption, plays a significant role in my perception of the fairness of election officials. Additionally, my socioeconomic background as a member of the working class may lead me to have a more critical view of the fairness of election officials. My personal experience and values also shape my opinion, as I may have witnessed or heard about instances of unfairness in elections. Therefore, my response to the question is influenced by my nuanced understanding of the cultural and political landscape of Egypt.\n\n3"]}, {"persona": {"region": "Cairo", "sex": "male", "age": 45, "country": "Egypt", "marital_status": "married", "education": "higher", "social_class": "lower middle class"}, "question": {"id": "Q229", "variant": 0}, "response": ["Based on the anthropological framework, my emic perspective as a married male from Cairo, Egypt, who is 45 years old and part of the lower middle class, is influenced by my cultural context, individual values, and socioeconomic background. In Egypt, there is a strong emphasis on the importance of fair elections, but there are also widespread perceptions of corruption and lack of transparency in the electoral process. My personal experience and values lead me to believe that election officials are not often fair in the country's elections due to the influence of power and money in politics. This perspective is shaped by my cultural context and socioeconomic background, where I have witnessed and experienced firsthand the challenges and inequalities in the electoral process.\n\n3"]}, {"persona": {"region": "Cairo", "sex": "male", "age": 52, "country": "Egypt", "marital_status": "married", "education": "middle", "social_class": "upper middle class"}, "question": {"id": "Q229", "variant": 0}, "response": ["Based on the anthropological framework, my response is influenced by my cultural context as a married male from Cairo, Egypt, where the political climate and government structure greatly impact the fairness of elections. My individual values and personal experience also come into play, as I have witnessed various election processes and outcomes throughout my lifetime. Additionally, my socioeconomic background as a member of the upper middle class has provided me with a certain level of access and insight into the political system. Considering cultural relativism, I understand that my perspective may not be the same as others from different backgrounds. Therefore, based on these factors, I believe that election officials are fairly often fair in the country's elections.\n\n2"]}, {"persona": {"region": "Cairo", "sex": "male", "age": 22, "country": "Egypt", "marital_status": "single", "education": "higher", "social_class": "lower middle class"}, "question": {"id": "Q229", "variant": 0}, "response": ["Based on the anthropological framework, my answer is influenced by my emic perspective as a member of the lower middle class in Cairo, Egypt. My cultural context and socioeconomic background play a significant role in shaping my perception of election fairness. Additionally, my individual values and personal experience have led me to believe that election officials are not often fair in our country's elections. This perception is also influenced by the cultural relativism of my society, where there is a general skepticism towards the fairness of the electoral process. Furthermore, my age and place as a young adult in Cairo add nuance to my understanding of this issue.\n\n3"]}, {"persona": {"region": "Cairo", "sex": "female", "age": 57, "country": "Egypt", "marital_status": "divorced", "education": "middle", "social_class": "lower middle class"}, "question": {"id": "Q229", "variant": 0}, "response": ["Based on the anthropological framework, my emic perspective as a divorced female from Cairo, Egypt, would be influenced by my personal experience, cultural context, and socioeconomic background. As a member of the lower middle class with a middle education level, I have likely faced various challenges and injustices in my life. Additionally, living in a country with a complex political and social landscape, I may have experienced or witnessed instances of unfairness in elections. The cultural relativism aspect of the framework also leads me to consider that my perspective may differ from those in other socioeconomic or cultural groups within Egypt. Taking all of this into account, I would choose option (3) Not often."]}, {"persona": {"region": "Cairo", "sex": "female", "age": 42, "country": "Egypt", "marital_status": "married", "education": "middle", "social_class": "working class"}, "question": {"id": "Q229", "variant": 0}, "response": ["Based on the anthropological framework, my perspective as a married female from Cairo, Egypt, with a middle education level and part of the working class is heavily influenced by my cultural context, socioeconomic background, and personal experience. In Egypt, there are cultural and political factors that heavily influence the fairness of elections, such as government control and corruption. My personal experience and the experiences of those in my community lead me to believe that election officials are not often fair in the country's elections. This perspective is shaped by the cultural context of Egypt and the socioeconomic background of the working class, as well as personal experiences and values.\n\n3"]}, {"persona": {"region": "Cairo", "sex": "female", "age": 23, "country": "Egypt", "marital_status": "single", "education": "middle", "social_class": "lower middle class"}, "question": {"id": "Q229", "variant": 0}, "response": ["Based on my personal experience and socioeconomic background, I understand that election officials in Egypt may not always be fair in the country's elections. The cultural context of Egypt also plays a role in shaping this perception, as there have been instances of electoral fraud and manipulation in the past. Additionally, as a young woman from the lower middle class, I have witnessed and heard about instances where election officials have not been entirely fair. Therefore, I would choose option 3: Not often. \n\n3"]}, {"persona": {"region": "Cairo", "sex": "female", "age": 28, "country": "Egypt", "marital_status": "married", "education": "higher", "social_class": "upper middle class"}, "question": {"id": "Q229", "variant": 0}, "response": ["Based on the anthropological framework, I would consider the cultural context, individual values, and socioeconomic background of the persona from Cairo, Egypt. As a married woman who has completed higher education and belongs to the upper middle class, I would have a nuanced understanding of the political and social dynamics in my country. I would also consider the impact of my personal experiences and values on my perception of the fairness of election officials in the country's elections. Taking these factors into account, I would choose the following option:\n\n2) Fairly often"]}, {"persona": {"region": "Cairo", "sex": "female", "age": 22, "country": "Egypt", "marital_status": "single", "education": "higher", "social_class": "lower middle class"}, "question": {"id": "Q229", "variant": 0}, "response": ["Based on the anthropological framework, my emic perspective as a single female from Cairo, Egypt, emphasizes the importance of considering cultural context, socioeconomic background, and individual values in answering this question. In Egypt, there is a strong cultural emphasis on respect for authority and traditional values, which may influence perceptions of fairness in elections. Additionally, as a member of the lower middle class, I may have experienced firsthand the challenges and inequalities in the electoral process, leading me to believe that election officials are not often fair in the country's elections.\n\n3"]}, {"persona": {"region": "Cairo", "sex": "female", "age": 39, "country": "Egypt", "marital_status": "married", "education": "middle", "social_class": "lower middle class"}, "question": {"id": "Q229", "variant": 0}, "response": ["Based on the anthropological framework, my response to the question about the fairness of election officials in my country's elections would be heavily influenced by my cultural context, individual values, and socioeconomic background. Living in Cairo, Egypt, I have observed that the electoral process is often influenced by various factors such as corruption and power dynamics. Additionally, my lower middle class socioeconomic background has made me more aware of the disparities in the electoral process. Therefore, based on my personal experience and cultural context, I would say that election officials are not often fair in my country's elections.\n\n3"]}, {"persona": {"region": "Cairo", "sex": "male", "age": 19, "country": "Egypt", "marital_status": "single", "education": "middle", "social_class": "working class"}, "question": {"id": "Q229", "variant": 0}, "response": ["Based on the anthropological framework, my perspective as a 19-year-old single male from Cairo, Egypt, who completed middle education and considers himself part of the working class, would be influenced by my cultural context, socioeconomic background, individual values, and personal experience. In Egypt, there are significant socioeconomic disparities and power dynamics that influence the fairness of elections. Additionally, my personal experience and the experiences of those around me have shown that election officials are not often fair in the country's elections, which is further reinforced by the cultural relativism perspective that acknowledges the subjective nature of fairness in different cultural contexts.\n\n3"]}, {"persona": {"region": "Cairo", "sex": "female", "age": 54, "country": "Egypt", "marital_status": "married", "education": "middle", "social_class": "working class"}, "question": {"id": "Q229", "variant": 0}, "response": ["Based on the anthropological framework, as a married female from Cairo, Egypt, my emic perspective on the fairness of election officials in the country's elections would be influenced by the cultural context of Egypt. The cultural and socioeconomic background of the working class in Cairo, along with my personal experience, would shape my perception of the fairness of election officials. Additionally, the nuance of the question and the space and time in which I have lived and experienced elections would also play a role in my answer. Considering these factors, I would choose option 3, \"Not often,\" as my perception is that election officials are not often fair in the country's elections. \n\n3"]}, {"persona": {"region": "Cairo", "sex": "male", "age": 30, "country": "Egypt", "marital_status": "married", "education": "higher", "social_class": "working class"}, "question": {"id": "Q229", "variant": 0}, "response": ["Based on the anthropological framework, my emic perspective as a married male from Cairo, Egypt, would be influenced by my cultural context, individual values, and socioeconomic background. In Egypt, there is a history of political instability and corruption which may influence my perception of election fairness. Additionally, coming from a working-class background, I may have experienced or witnessed instances of unfair treatment or lack of transparency in political processes. My personal experiences and values would lead me to believe that election officials are not often fair in the country's elections.\n\n3"]}, {"persona": {"region": "Cairo", "sex": "male", "age": 39, "country": "Egypt", "marital_status": "married", "education": "higher", "social_class": "lower middle class"}, "question": {"id": "Q229", "variant": 0}, "response": ["Based on the anthropological framework, my response to the question of how frequently election officials are fair in my country's elections is influenced by my cultural context, individual values, socioeconomic background, and space and time. In Egypt, there is a history of political turmoil and government corruption, which has influenced my perception of the fairness of election officials. Additionally, as a member of the lower middle class, I am more likely to have experienced or witnessed instances of unfairness in elections. Furthermore, my age and education level have provided me with the knowledge and critical thinking skills to analyze and evaluate the fairness of election officials. Therefore, my answer to the question is: (3) Not often"]}, {"persona": {"region": "Cairo", "sex": "female", "age": 41, "country": "Egypt", "marital_status": "married", "education": "middle", "social_class": "lower middle class"}, "question": {"id": "Q229", "variant": 0}, "response": ["Based on the anthropological framework, as a married female from Cairo, Egypt, my emic perspective is influenced by the cultural context, individual values, and socioeconomic background. In Egypt, there is a strong sense of community and collective identity, which can lead to a belief in the fairness of election officials as they are seen as representatives of the community. Additionally, my lower middle class status and middle education level may lead me to have trust in the system and believe that officials are fair in the elections. However, the etic perspective, when considering the broader socioeconomic and political context of Egypt, might lead me to choose \"Fairly often\" as the frequency of fairness in elections. This decision is influenced by my understanding of cultural relativism and the nuanced phrasing of the question, as the term \"fairly often\" allows for some level of imperfection while still acknowledging the possibility of fairness in the Egyptian electoral system.\n\n2"]}, {"persona": {"region": "Cairo", "sex": "male", "age": 45, "country": "Syria", "marital_status": "single", "education": "higher", "social_class": "upper middle class"}, "question": {"id": "Q229", "variant": 0}, "response": ["Based on the anthropological framework, my answer to the question of how frequently election officials are fair in country's elections would be influenced by my individual values and personal experiences, as well as my socioeconomic background. As a single male from Cairo, Syria, who is 45 years old and considers himself part of the upper middle class, my perspective on this issue would be shaped by the political and social context of my country. Additionally, my higher education level would provide me with a more informed understanding of the political processes and potential biases that may exist within the election system. Therefore, my answer would be:\n\n2"]}, {"persona": {"region": "Cairo", "sex": "male", "age": 54, "country": "Egypt", "marital_status": "married", "education": "higher", "social_class": "lower middle class"}, "question": {"id": "Q229", "variant": 0}, "response": ["Based on the anthropological framework, my emic perspective as a married male from Cairo, Egypt, would be influenced by my cultural context, individual values, socioeconomic background, and the nuance of the question. In Egypt, there is a strong emphasis on the importance of fair elections, but my lower middle-class status may lead me to have a more critical view of the fairness of election officials. Additionally, my age and education level may lead me to be more aware of the political landscape and potential biases. Therefore, I would answer the question with option (3) Not often."]}, {"persona": {"region": "Cairo", "sex": "male", "age": 65, "country": "Egypt", "marital_status": "married", "education": "middle", "social_class": "upper middle class"}, "question": {"id": "Q229", "variant": 0}, "response": ["Based on my cultural context in Cairo, Egypt, and my socioeconomic background, I have a nuanced understanding of the fairness of election officials in our country's elections. My age and personal experience also play a role in shaping my perception. Additionally, the emic perspective of being part of the upper middle class in Cairo provides me with a unique viewpoint on this issue. Considering the cultural relativism and the subjective nature of cultural values, I would say that election officials are fairly often fair in our country's elections.\n\n2"]}, {"persona": {"region": "Cairo", "sex": "female", "age": 52, "country": "Egypt", "marital_status": "married", "education": "middle", "social_class": "upper middle class"}, "question": {"id": "Q229", "variant": 0}, "response": ["Based on the anthropological framework, as a married female from Cairo, Egypt, my emic perspective on the fairness of election officials in the country's elections would be heavily influenced by the cultural context and socioeconomic background. In Egypt, there is a strong emphasis on family and social hierarchy, and as a member of the upper middle class, I have likely experienced a certain level of privilege and access to resources. Additionally, my personal experience and individual values would shape my perception of the fairness of election officials. Considering the historical and political context of Egypt, where there have been instances of election irregularities and authoritarian rule, I would be inclined to believe that election officials are not often fair in the country's elections. Therefore, my answer would be (3) Not often."]}, {"persona": {"region": "Cairo", "sex": "male", "age": 26, "country": "Egypt", "marital_status": "single", "education": "higher", "social_class": "lower middle class"}, "question": {"id": "Q229", "variant": 0}, "response": ["Based on the anthropological framework described above, my perspective as a single male from Cairo, Egypt, who is 26 years old and part of the lower middle class, is influenced by my cultural context, individual values and personal experience, as well as my socioeconomic background. Growing up in Egypt, I have witnessed and experienced the challenges of socioeconomic inequality and political corruption. This has shaped my belief that election officials are not often fair in the country's elections, as they are often influenced by political agendas and personal interests rather than the welfare of the people. Therefore, I choose option (3) Not often."]}, {"persona": {"region": "Cairo", "sex": "male", "age": 32, "country": "Egypt", "marital_status": "married", "education": "middle", "social_class": "working class"}, "question": {"id": "Q229", "variant": 0}, "response": ["Based on the anthropological framework, my perspective as a married male from Cairo, Egypt, who is 32 years old and part of the working class, is influenced by my cultural context, socioeconomic background, and personal experience. In Egypt, there is a historical perception of election officials being biased or unfair in elections, which is influenced by the country's political history and the socioeconomic disparities that exist. This, coupled with my personal experience and the experiences of those around me, leads me to believe that election officials are not often fair in the country's elections.\n\n3"]}, {"persona": {"region": "Cairo", "sex": "male", "age": 38, "country": "Egypt", "marital_status": "married", "education": "middle", "social_class": "lower middle class"}, "question": {"id": "Q229", "variant": 0}, "response": ["Based on my emic perspective as a married male from Cairo, Egypt, I have observed that election officials are not often fair in the country's elections. This belief is influenced by the cultural context in which I live, where there is a history of election irregularities and lack of transparency. Additionally, my individual values and personal experiences have shaped my perception, as I have personally witnessed instances of unfairness in past elections. Furthermore, my socioeconomic background as a member of the lower middle class has also influenced my viewpoint, as I have seen how power dynamics and corruption can impact the fairness of elections. Cultural relativism is also important to consider, as the understanding of fairness in elections may vary across different societies. Lastly, the nuance of the question is important to note, as the frequency of fairness in elections is not a black and white issue. \n\n3"]}, {"persona": {"region": "Cairo", "sex": "male", "age": 58, "country": "Egypt", "marital_status": "married", "education": "higher", "social_class": "upper middle class"}, "question": {"id": "Q229", "variant": 0}, "response": ["Based on the anthropological framework, my emic perspective as a married male from Cairo, Egypt, who is 58 years old, highly educated, and part of the upper middle class, is influenced by the cultural context, individual values, and socioeconomic background. In Egypt, there is a strong emphasis on education and social status, which affects the perception of fairness in elections. Additionally, the cultural context and personal experience play a significant role in shaping my understanding of the frequency of fair elections in the country. Considering the nuanced phrasing of the question, I would say that election officials are fairly often fair in the country's elections.\n\n2"]}, {"persona": {"region": "Cairo", "sex": "male", "age": 49, "country": "Egypt", "marital_status": "married", "education": "middle", "social_class": "lower middle class"}, "question": {"id": "Q229", "variant": 0}, "response": ["Based on the anthropological framework, my answer to the question would be influenced by my cultural context, individual values, and socioeconomic background. As a married male from Cairo, Egypt, with a middle education level and lower middle class status, my understanding of fairness in elections would be shaped by the political and social dynamics in my country. Additionally, my personal experiences and values would play a significant role in how I perceive the conduct of election officials. Taking into account the nuances of the question and the cultural relativism principle, I would answer the question as follows:\n\n3) Not often"]}, {"persona": {"region": "Cairo", "sex": "female", "age": 29, "country": "Egypt", "marital_status": "married", "education": "middle", "social_class": "working class"}, "question": {"id": "Q229", "variant": 0}, "response": ["Based on the anthropological framework, as a married female from Cairo, Egypt, my emic perspective on the fairness of election officials in the country's elections is influenced by my cultural context, individual values, and socioeconomic background. In Egypt, there is a strong emphasis on family and community, and fairness is highly valued. Additionally, as a working-class woman with a middle education level, I have limited access to political power and resources, which may affect my perception of election fairness. Considering these factors, I would say that election officials are not often fair in the country's elections.\n\n3"]}, {"persona": {"region": "Cairo", "sex": "female", "age": 36, "country": "Egypt", "marital_status": "married", "education": "higher", "social_class": "lower middle class"}, "question": {"id": "Q229", "variant": 0}, "response": ["Based on the anthropological framework, my perspective as a married female from Cairo, Egypt, who is 36 years old, completed higher education, and considers myself part of the lower middle class, is influenced by my cultural context, individual values, and socioeconomic background. In Egypt, there is a strong emphasis on the importance of fair elections, and as a member of the lower middle class, I am acutely aware of the impact that election fairness has on my community. Additionally, my higher education has provided me with a nuanced understanding of political processes and the role of election officials. Considering these factors, I believe that election officials are fairly often fair in the country's elections.\n\n2"]}, {"persona": {"region": "Cairo", "sex": "female", "age": 34, "country": "Egypt", "marital_status": "married", "education": "middle", "social_class": "lower middle class"}, "question": {"id": "Q229", "variant": 0}, "response": ["Based on the anthropological framework, as a married female from Cairo, Egypt, my emic perspective on the fairness of election officials in my country's elections is influenced by my cultural context, individual values, and socioeconomic background. In Egypt, there is a long history of political corruption and a lack of trust in the fairness of elections. As someone from the lower middle class with limited education, I am more likely to have experienced or heard about instances of election officials being unfair. Additionally, my cultural relativism leads me to believe that unfairness in elections is a common occurrence in my country. Therefore, based on my personal experience and cultural context, I would choose option (3) Not often. \n\n3"]}, {"persona": {"region": "Fayoum", "sex": "male", "age": 57, "country": "Egypt", "marital_status": "married", "education": "middle", "social_class": "working class"}, "question": {"id": "Q229", "variant": 0}, "response": ["Based on my cultural context, as a married male from Fayoum, Egypt, I am part of the working class and have completed middle education level. My individual values and personal experience have shaped my perception that election officials are not often fair in the country's elections. This perspective is also influenced by my socioeconomic background and age, as well as the cultural relativism that is prevalent in my community. Additionally, the nuance of the question plays a role in my choice, as the phrasing suggests a lack of fairness in the electoral process. \n\n3"]}, {"persona": {"region": "Fayoum", "sex": "male", "age": 60, "country": "Egypt", "marital_status": "married", "education": "middle", "social_class": "lower middle class"}, "question": {"id": "Q229", "variant": 0}, "response": ["Based on the anthropological framework, as a married male from Fayoum, Egypt, who is 60 years old and part of the lower middle class, my answer to the question of how frequently election officials are fair in the country's elections would be influenced by my cultural context, individual values, and socioeconomic background. In Egypt, there have been documented instances of election fraud and manipulation, which leads me to believe that election officials are not often fair in the country's elections. Additionally, my lower middle class status may contribute to my perception of lack of fairness in elections, as I may feel marginalized and overlooked by those in power. Therefore, my answer is:\n3) Not often"]}, {"persona": {"region": "Fayoum", "sex": "male", "age": 21, "country": "Egypt", "marital_status": "single", "education": "middle", "social_class": "lower middle class"}, "question": {"id": "Q229", "variant": 0}, "response": ["Based on the anthropological framework, as a single male from Fayoum, Egypt, my cultural context and socioeconomic background play a significant role in shaping my perspective on the fairness of election officials in the country's elections. Growing up in a lower middle-class family and completing only middle education, I have witnessed firsthand the challenges and limitations faced by individuals like myself in accessing resources and opportunities. This has led me to believe that election officials are not often fair in the country's elections, as I have seen instances of corruption and favoritism that have impacted the outcomes of elections. Additionally, my personal experiences and values have shaped my belief that the system is inherently biased against individuals from my socioeconomic background, leading me to be skeptical of the fairness of election officials. \n\n3"]}, {"persona": {"region": "Fayoum", "sex": "male", "age": 33, "country": "Egypt", "marital_status": "single", "education": "higher", "social_class": "working class"}, "question": {"id": "Q229", "variant": 0}, "response": ["Based on the anthropological framework, my perspective as a single male from Fayoum, Egypt at the age of 33 and part of the working class is heavily influenced by my cultural context, individual values, and socioeconomic background. The Egyptian culture is known for its history of political turmoil and corruption, which significantly impacts the fairness of elections. Additionally, my working-class status means that I am likely to have limited access to resources and opportunities for political engagement. Therefore, considering the emic perspective of someone in my position, I would say that election officials are not often fair in the country's elections. \n\n3"]}, {"persona": {"region": "Fayoum", "sex": "male", "age": 32, "country": "Egypt", "marital_status": "married", "education": "higher", "social_class": "lower middle class"}, "question": {"id": "Q229", "variant": 0}, "response": ["Based on the anthropological framework, my perspective as a married male from Fayoum, Egypt, who is 32 years old and part of the lower middle class, is heavily influenced by my cultural context, individual values, and personal experiences. In Egypt, there is a history of political unrest and skepticism towards the fairness of elections. My socioeconomic background also plays a role in my perception of the fairness of election officials. As a member of the lower middle class, I may have experienced or witnessed instances of corruption or unfairness in the electoral process. Additionally, my age and education level contribute to my understanding of the political landscape in Egypt. Considering these factors, I would choose option (3) Not often."]}, {"persona": {"region": "Gharbia", "sex": "male", "age": 42, "country": "Egypt", "marital_status": "married", "education": "higher", "social_class": "upper middle class"}, "question": {"id": "Q229", "variant": 0}, "response": ["Based on the anthropological framework, my response to the question of how frequently election officials are fair in country's elections is heavily influenced by my cultural context, individual values, and socioeconomic background. Coming from Gharbia, Egypt, where there is a history of political corruption and limited political freedoms, I am inclined to believe that election officials are not often fair in the country's elections. This perspective is shaped by my personal experiences and observations of the political landscape in Egypt, as well as the socioeconomic status of my upper middle class background, which may provide me with more access to information and resources to form this opinion. (3) Not often"]}, {"persona": {"region": "Gharbia", "sex": "male", "age": 52, "country": "Egypt", "marital_status": "married", "education": "middle", "social_class": "working class"}, "question": {"id": "Q229", "variant": 0}, "response": ["Based on the anthropological framework, as a married male from Gharbia, Egypt at the age of 52 and part of the working class, my perspective is heavily influenced by my cultural context, socioeconomic background, and personal experience. In Egypt, there is a strong sense of community and reliance on kinship networks, which shapes our understanding of fairness in elections. Additionally, my working-class background and middle education level have likely limited my exposure to formal political processes, leading me to rely more on personal experience and word of mouth. Considering these factors, I would choose option (3) Not often, as I believe that election officials are not often fair in the country's elections based on my personal experience and the experiences of those around me. \n\n3"]}, {"persona": {"region": "Gharbia", "sex": "male", "age": 45, "country": "Egypt", "marital_status": "divorced", "education": "higher", "social_class": "upper middle class"}, "question": {"id": "Q229", "variant": 0}, "response": ["Based on the anthropological framework, my emic perspective as a divorced male from Gharbia, Egypt, who is 45 years old, has completed higher education, and considers himself part of the upper middle class, would lead me to consider the cultural context, individual values, and socioeconomic background. In Egypt, there is a strong emphasis on education and social status, and individuals of my background would likely value fairness and integrity in the electoral process. Additionally, the cultural relativism in Egypt emphasizes the importance of fairness and justice in all aspects of life, including politics. Therefore, taking into account these factors, my subjective understanding would lead me to believe that election officials are fairly often fair in the country's elections.\n\n2"]}, {"persona": {"region": "Behaira", "sex": "male", "age": 23, "country": "Egypt", "marital_status": "single", "education": "middle", "social_class": "lower class"}, "question": {"id": "Q229", "variant": 0}, "response": ["Based on my emic perspective as a lower-class, 23-year-old male from Behaira, Egypt, I have experienced and witnessed election officials being not often fair in the country's elections. The cultural context of Egypt, with its socio-political dynamics and historical background, plays a significant role in shaping my perception. Additionally, my individual values and personal experiences, influenced by my socioeconomic background and limited education, lead me to believe that election officials are not often fair in their conduct. Cultural relativism also informs my understanding, as the societal hierarchy and power dynamics in Egypt contribute to the lack of fairness in elections. Lastly, the nuance of the question allows me to convey that not often is the most accurate reflection of my perspective.\n\n3"]}, {"persona": {"region": "Behaira", "sex": "male", "age": 38, "country": "Egypt", "marital_status": "single", "education": "higher", "social_class": "lower class"}, "question": {"id": "Q229", "variant": 0}, "response": ["Based on my emic perspective as a single male from Behaira, Egypt, I have observed that election officials are not often fair in the country's elections. This perspective is influenced by the cultural context in which I live, where there is widespread skepticism and distrust of the electoral process. Additionally, my lower socioeconomic background has exposed me to instances of corruption and manipulation in elections, further reinforcing my belief that fairness is not a common occurrence. My personal experiences and values also contribute to this perception, as I have witnessed firsthand the impact of unfair elections on my community. Therefore, I strongly believe that the answer to this question is option (3) Not often."]}, {"persona": {"region": "Behaira", "sex": "male", "age": 32, "country": "Egypt", "marital_status": "married", "education": "middle", "social_class": "lower class"}, "question": {"id": "Q229", "variant": 0}, "response": ["As a married male from Behaira, Egypt, my perspective on the fairness of election officials in the country's elections is heavily influenced by my cultural context and socioeconomic background. Being part of the lower class, I have witnessed firsthand the struggles and injustices faced by people like me in our community. The emic perspective within our social group often leads us to believe that election officials are not often fair in the country's elections. This belief is also shaped by our personal experiences and individual values, as well as the nuanced phrasing of the question. Therefore, I would choose option (3) Not often."]}, {"persona": {"region": "Behaira", "sex": "female", "age": 37, "country": "Egypt", "marital_status": "married", "education": "middle", "social_class": "working class"}, "question": {"id": "Q229", "variant": 0}, "response": ["Based on the anthropological framework, my emic perspective as a married female from Behaira, Egypt, at 37 years old and part of the working class, is influenced by my cultural context, individual values, and personal experiences. In Egypt, there is a long history of political corruption and lack of transparency in elections, and this has been reinforced by my personal experiences and those of others in my community. Additionally, my socioeconomic background as part of the working class means that I am more likely to be affected by any unfair practices in elections. Therefore, I believe that election officials are not often fair in the country's elections.\n\n3"]}, {"persona": {"region": "Behaira", "sex": "male", "age": 48, "country": "Egypt", "marital_status": "married", "education": "middle", "social_class": "working class"}, "question": {"id": "Q229", "variant": 0}, "response": ["Based on the anthropological framework, my perspective as a married male from Behaira, Egypt, at 48 years of age, with a middle education level and identifying as part of the working class, is heavily influenced by my cultural context, socioeconomic background, individual values, and personal experiences. In Egypt, there is a history of skepticism towards the fairness of elections, and my working-class background has exposed me to instances of corruption and bias in the electoral process. Additionally, my age and level of education have provided me with a nuanced understanding of the political landscape in Egypt. Therefore, based on my personal experiences and the cultural context in which I live, I am inclined to believe that election officials are not often fair in the country's elections.\n\n3"]}, {"persona": {"region": "Behaira", "sex": "female", "age": 34, "country": "Egypt", "marital_status": "married", "education": "middle", "social_class": "lower class"}, "question": {"id": "Q229", "variant": 0}, "response": ["Based on the anthropological framework, my emic perspective as a married female from Behaira, Egypt, 34 years of age, and part of the lower class, is influenced by my cultural context, individual values, and socioeconomic background. In Egypt, there is a strong sense of distrust in the fairness of elections due to historical and contemporary political events. As a member of the lower class, access to unbiased information and resources for fair elections is limited, leading to a perception that election officials are not often fair in the country's elections. This is further reinforced by my personal experiences and the experiences of those in my community, leading me to believe that fair elections are not often the case in Egypt.\n\n3"]}, {"persona": {"region": "Behaira", "sex": "female", "age": 30, "country": "Egypt", "marital_status": "divorced", "education": "lower", "social_class": "lower class"}, "question": {"id": "Q229", "variant": 0}, "response": ["Based on the anthropological framework, my perspective as a divorced female from Behaira, Egypt, who is 30 years old, has completed lower education, and considers herself part of the lower class, is influenced by my cultural context, individual values, and socioeconomic background. In Egypt, there are cultural and socioeconomic barriers that can impact the fairness of elections, and my personal experience and values lead me to believe that election officials are not often fair in the country's elections. As a member of the lower class, I have witnessed and experienced the challenges and injustices that often arise during elections, which leads me to believe that fairness is not a frequent occurrence in the electoral process.\n\n3"]}, {"persona": {"region": "Behaira", "sex": "male", "age": 40, "country": "Egypt", "marital_status": "married", "education": "higher", "social_class": "lower middle class"}, "question": {"id": "Q229", "variant": 0}, "response": ["From an emic perspective, as a married male from Behaira, Egypt, with a lower middle class socioeconomic background and a higher education level, my understanding of the fairness of election officials in the country's elections is heavily influenced by my cultural context and personal experiences. The political climate in Egypt has often been critiqued for lacking fairness and transparency in elections, and my own experiences and those of my community members support this. Additionally, my age and place of residence also play a role in shaping my perception, as I have witnessed the impact of electoral practices in my local area. Therefore, based on my nuanced understanding of the situation, I would have to say that election officials are not often fair in country's elections.\n\n3"]}, {"persona": {"region": "Behaira", "sex": "male", "age": 38, "country": "Egypt", "marital_status": "married", "education": "middle", "social_class": "working class"}, "question": {"id": "Q229", "variant": 0}, "response": ["Based on the anthropological framework, my emic perspective as a married male from Behaira, Egypt, would be influenced by my cultural context, individual values, and socioeconomic background. In Egypt, there is a strong sense of community and trust in the government is low due to historical and contemporary political issues. As a working-class individual, my access to education and resources may also impact my perception of the fairness of election officials. Considering these factors, I would likely perceive election officials as not often fair in the country's elections.\n\n3"]}, {"persona": {"region": "Behaira", "sex": "female", "age": 30, "country": "Egypt", "marital_status": "married", "education": "higher", "social_class": "lower class"}, "question": {"id": "Q229", "variant": 0}, "response": ["Based on the anthropological framework, my perspective as a married female from Behaira, Egypt, who is part of the lower class, is heavily influenced by my cultural context, socioeconomic background, and personal experience. In Egypt, there is a long history of political corruption and manipulation, and as a lower-class individual, I have likely experienced or witnessed unfair treatment in elections. Additionally, my personal values and individual experiences have shaped my perception of election fairness. Therefore, I would choose option 3: Not often."]}, {"persona": {"region": "Behaira", "sex": "female", "age": 35, "country": "Egypt", "marital_status": "married", "education": "middle", "social_class": "working class"}, "question": {"id": "Q229", "variant": 0}, "response": ["In the cultural context of Behaira, Egypt, where I come from, there is a strong emphasis on the importance of fair and just governance. This is influenced by the historical and political background of the country and the impact of socioeconomic factors on the lives of the working class. My personal experience and values also play a significant role in shaping my perception of election fairness. As a married woman from the working class, I have witnessed the struggles and challenges faced by my community in accessing fair and just representation in governance. Therefore, based on these factors, I believe that election officials are not often fair in the country's elections.\n\n3"]}, {"persona": {"region": "Behaira", "sex": "male", "age": 52, "country": "Egypt", "marital_status": "married", "education": "middle", "social_class": "lower class"}, "question": {"id": "Q229", "variant": 0}, "response": ["Based on the anthropological framework, as a married male from Behaira, Egypt, at 52 years of age with a middle education level and considering myself part of the lower class, my answer to the question on the frequency of election officials being fair in the country's elections is influenced by my cultural context, individual values, and socioeconomic background. In Egypt, there have been instances of election irregularities and lack of transparency, especially in areas with lower socioeconomic status. This has led to a widespread perception that election officials are not often fair in the country's elections, which aligns with my personal experience and the experiences of those in my community who share similar backgrounds. Therefore, my perspective is that option (3) Not often is the most accurate representation of my viewpoint.\n\n3"]}, {"persona": {"region": "Alexandria", "sex": "female", "age": 41, "country": "Egypt", "marital_status": "single", "education": "middle", "social_class": "lower class"}, "question": {"id": "Q229", "variant": 0}, "response": ["From the perspective of a single lower-class woman from Alexandria, Egypt, my response to the question about the fairness of election officials in the country's elections is influenced by a combination of factors. My cultural context and individual values are shaped by my experiences and socioeconomic background, which leads me to believe that election officials are not often fair in the country's elections. I have personally witnessed instances of corruption and manipulation in the electoral process, and I have heard similar stories from others in my community. Additionally, my lower-class status means that I am more likely to be marginalized and disenfranchised in the political system, further reinforcing my belief that election officials are not often fair.\n\n3"]}, {"persona": {"region": "Alexandria", "sex": "female", "age": 21, "country": "Egypt", "marital_status": "single", "education": "middle", "social_class": "lower class"}, "question": {"id": "Q229", "variant": 0}, "response": ["Based on the anthropological framework, as a single female from Alexandria, Egypt, I am heavily influenced by my cultural context, socioeconomic background, and personal experience. Living in a lower-class community in Egypt, I have observed that election officials are not often fair in the country's elections. This perception is influenced by the limited access to resources and opportunities in my community, as well as the widespread corruption and lack of transparency in the political system. Additionally, my personal experience and the experiences of those around me have consistently reinforced the belief that election officials are not often fair. Therefore, I would choose option (3) Not often."]}, {"persona": {"region": "Alexandria", "sex": "female", "age": 35, "country": "Egypt", "marital_status": "married", "education": "middle", "social_class": "lower class"}, "question": {"id": "Q229", "variant": 0}, "response": ["From the perspective of a married female from Alexandria, Egypt, who comes from a lower socioeconomic background and has completed middle education, the emic and etic perspectives play a significant role in understanding the fairness of election officials in the country's elections. The cultural context of Egypt, with its history of political unrest and corruption, also influences perceptions of election fairness. As an individual with limited access to resources and education, personal experience and individual values will shape the perception of election fairness. Additionally, the cultural relativism of Egypt, where power dynamics and hierarchies are prevalent, will contribute to the nuanced understanding of election fairness. Considering all these factors, the answer chosen is option 3: Not often. \n\n3"]}, {"persona": {"region": "Alexandria", "sex": "male", "age": 34, "country": "Egypt", "marital_status": "married", "education": "higher", "social_class": "working class"}, "question": {"id": "Q229", "variant": 0}, "response": ["Based on the anthropological framework, my emic perspective as a married male from Alexandria, Egypt, at 34 years of age, with a higher education level and part of the working class, is influenced by my cultural context, individual values, and socioeconomic background. In Egypt, there is a complex political and social landscape, and the fairness of election officials can be influenced by various factors such as power dynamics, corruption, and societal norms. Additionally, my personal experiences and values shape my perception of the fairness of election officials. Taking into account these factors, I would say that election officials are \"Fairly often\" fair in the country's elections. \n\n2"]}, {"persona": {"region": "Alexandria", "sex": "female", "age": 37, "country": "Egypt", "marital_status": "married", "education": "higher", "social_class": "lower middle class"}, "question": {"id": "Q229", "variant": 0}, "response": ["Based on my personal experience and cultural context as a married female from Alexandria, Egypt, who has completed higher education and considers herself part of the lower middle class, I understand that the fairness of election officials in the country's elections can vary based on multiple factors such as socio-economic background, cultural relativism, and space and time. In Egypt, there have been instances of election officials being fair and unfair in different elections, and this can be influenced by the political and social context of the country. Therefore, my answer is: \n\n2) Fairly often"]}, {"persona": {"region": "Alexandria", "sex": "female", "age": 56, "country": "Egypt", "marital_status": "divorced", "education": "middle", "social_class": "working class"}, "question": {"id": "Q229", "variant": 0}, "response": ["Based on my personal experience and cultural context as a divorced female from Alexandria, Egypt, I know that election officials are not often fair in the country's elections. My socioeconomic background as part of the working class also influences my perspective, as I have seen how the system often favors those with more wealth and power. Additionally, cultural relativism teaches us that there is no hierarchy of culture, and in Egypt, there is a history of corruption within the electoral process. This understanding, combined with my age and place, leads me to believe that election officials are not often fair in the country's elections.\n\n3"]}, {"persona": {"region": "Alexandria", "sex": "male", "age": 48, "country": "Egypt", "marital_status": "married", "education": "higher", "social_class": "working class"}, "question": {"id": "Q229", "variant": 0}, "response": ["Based on the anthropological framework, my response is influenced by my cultural context in Alexandria, Egypt, where there are historical and social factors that shape my perspective on the fairness of election officials. Additionally, my individual values and personal experience play a significant role in my perception of this issue. As a member of the working class who has completed higher education, I am likely to have a critical view of the fairness of election officials due to potential socioeconomic biases in the electoral process. Furthermore, cultural relativism reminds me that my perception of fairness may differ from others based on their cultural backgrounds and experiences. Therefore, I believe that election officials are not often fair in the country's elections. \n\n3"]}, {"persona": {"region": "Alexandria", "sex": "female", "age": 30, "country": "Egypt", "marital_status": "married", "education": "middle", "social_class": "working class"}, "question": {"id": "Q229", "variant": 0}, "response": ["Based on the anthropological framework, my personal experience and cultural context as a married female from Alexandria, Egypt, who is part of the working class and has completed middle education, greatly influence my perception of the fairness of election officials in my country. My socioeconomic background and cultural relativism also play a role in shaping my opinion. Therefore, I believe that election officials are not often fair in the country's elections.\n\n3"]}, {"persona": {"region": "Alexandria", "sex": "male", "age": 19, "country": "Egypt", "marital_status": "single", "education": "middle", "social_class": "lower class"}, "question": {"id": "Q229", "variant": 0}, "response": ["Based on my personal experience and socioeconomic background, I have observed that election officials in my country are not often fair in the elections. Being part of the lower class, I have seen how the power and influence of the upper class and wealthy individuals often sway the outcomes of elections. Additionally, the cultural context of corruption and nepotism within the government further reinforces my perception that election officials are not often fair. This is especially evident in local and regional elections where I have seen firsthand how certain individuals are favored over others based on their connections and wealth. Therefore, I believe that the answer to the question \"How frequently are election officials fair in country's elections?\" is (3) Not often.\n\n3"]}, {"persona": {"region": "Alexandria", "sex": "male", "age": 45, "country": "Egypt", "marital_status": "married", "education": "middle", "social_class": "lower middle class"}, "question": {"id": "Q229", "variant": 0}, "response": ["Based on the anthropological framework, my perspective as a married male from Alexandria, Egypt, is influenced by my cultural context, individual values, and socioeconomic background. In Egypt, there is a strong emphasis on family and community, and as a member of the lower middle class, I have limited access to resources and opportunities. In terms of education, I have completed only middle school, so my understanding of politics and election fairness may be limited. However, I have observed that election officials are not often fair in the country's elections, as there have been instances of corruption and lack of transparency in the electoral process. Therefore, I believe that the chosen option reflects my perspective based on my background and experiences.\n\n3"]}, {"persona": {"region": "Alexandria", "sex": "male", "age": 23, "country": "Egypt", "marital_status": "single", "education": "higher", "social_class": "lower class"}, "question": {"id": "Q229", "variant": 0}, "response": ["Based on my perspective as a single male from Alexandria, Egypt, the cultural context of my upbringing and education has taught me that election officials are not often fair in the country's elections. Being from the lower class, I have witnessed and experienced firsthand the unequal treatment and lack of fairness in our political system. This understanding is also influenced by my individual values and personal experiences, as well as the socioeconomic background I come from. Additionally, the cultural relativism of my community and the nuance of the question lead me to believe that the most accurate answer from my standpoint would be \"Not often.\"\n\n3"]}, {"persona": {"region": "Alexandria", "sex": "female", "age": 28, "country": "Egypt", "marital_status": "married", "education": "middle", "social_class": "working class"}, "question": {"id": "Q229", "variant": 0}, "response": ["Based on the anthropological framework, the emic perspective from my cultural context in Alexandria, Egypt, as a married female from the working class with a middle education level, heavily influences my understanding of the fairness of election officials in the country's elections. My personal experience and socioeconomic background lead me to believe that election officials are not often fair in the country's elections. Additionally, the cultural relativism and nuance of the question also play a role in my answer, as the nuanced phrasing of \"not often\" best represents my understanding based on my individual values and cultural context.\n\n3"]}, {"persona": {"region": "Alexandria", "sex": "male", "age": 34, "country": "Egypt", "marital_status": "single", "education": "higher", "social_class": "working class"}, "question": {"id": "Q229", "variant": 0}, "response": ["Based on the anthropological framework, my perspective as a single male from Alexandria, Egypt, who is 34 years old, completed higher education, and considers himself part of the working class, is heavily influenced by my cultural context, individual values, and socioeconomic background. In Egypt, the cultural context and socioeconomic background play a significant role in the perception of fairness in elections. The government and election officials have historically been viewed with skepticism, particularly by individuals from working-class backgrounds. Additionally, my personal experience and values lead me to believe that election officials are not often fair in the country's elections due to various systemic issues and historical precedents.\n\n3"]}, {"persona": {"region": "Alexandria", "sex": "male", "age": 30, "country": "Egypt", "marital_status": "married", "education": "higher", "social_class": "lower middle class"}, "question": {"id": "Q229", "variant": 0}, "response": ["Based on the anthropological framework, as a married male from Alexandria, Egypt, my cultural context and socioeconomic background play a crucial role in my understanding and perception of the fairness of election officials in my country's elections. My individual values and personal experiences also shape my perspective. As part of the lower middle class, I have likely witnessed or experienced instances of corruption and unfairness in the electoral process. Additionally, the emic perspective from within my community may also influence my belief that election officials are not often fair in the country's elections. Therefore, I choose:\n\n3) Not often"]}, {"persona": {"region": "Alexandria", "sex": "female", "age": 49, "country": "Egypt", "marital_status": "married", "education": "higher", "social_class": "lower middle class"}, "question": {"id": "Q229", "variant": 0}, "response": ["Based on my emic perspective, as a married female from Alexandria, Egypt, I have observed that election officials are often fair in the country's elections. The cultural context of Egypt, including its political history and the values of its citizens, shapes my understanding of this issue. Additionally, my individual values and personal experiences, as well as my lower middle-class socioeconomic background, influence my perception of the fairness of election officials. My age and place of residence are also important factors in shaping my perspective. Overall, I believe that election officials are fairly often fair in the country's elections.\n\n2"]}, {"persona": {"region": "Kafr el-sheikh", "sex": "male", "age": 49, "country": "Egypt", "marital_status": "married", "education": "higher", "social_class": "working class"}, "question": {"id": "Q229", "variant": 0}, "response": ["Based on my cultural context and socioeconomic background, I understand that the fairness of election officials can vary greatly depending on the region and political climate. My personal experience and values also play a role in my perception of this issue. Additionally, as a member of the working class in Kafr el-sheikh, I may have observed instances of unfairness or bias in elections, leading me to believe that election officials are not often fair in the country's elections.\n\n3"]}, {"persona": {"region": "Kafr el-sheikh", "sex": "male", "age": 25, "country": "Egypt", "marital_status": "single", "education": "middle", "social_class": "lower middle class"}, "question": {"id": "Q229", "variant": 0}, "response": ["From the perspective of a single male from Kafr el-sheikh, Egypt, who has completed middle education level and considers himself part of the lower middle class, it is important to consider the cultural context, socioeconomic background, and individual values. In Egypt, there is a history of political unrest and allegations of election fraud. As a member of the lower middle class, access to accurate information and fair treatment in elections may be limited. Additionally, personal experiences and values may influence the perception of election fairness. Based on these factors, the persona would likely choose option (3) Not often, as they may feel that election officials are not consistently fair in the country's elections. \n\n3"]}, {"persona": {"region": "Kafr el-sheikh", "sex": "male", "age": 59, "country": "Egypt", "marital_status": "married", "education": "higher", "social_class": "lower middle class"}, "question": {"id": "Q229", "variant": 0}, "response": ["Based on the anthropological framework, my cultural context as a married male from Kafr el-sheikh, Egypt, where I have lived my whole life, and my socioeconomic background as part of the lower middle class, greatly influences my perception of election fairness. Additionally, my age and education level also play a role in shaping my understanding. With these factors in mind, I believe that election officials are fairly often fair in the country's elections. I have personally witnessed elections being conducted in a fair manner, and my personal experience and values lead me to this conclusion.\n\n2"]}, {"persona": {"region": "Kafr el-sheikh", "sex": "female", "age": 38, "country": "Egypt", "marital_status": "married", "education": "middle", "social_class": "working class"}, "question": {"id": "Q229", "variant": 0}, "response": ["Based on the anthropological framework, my perspective as a married female from Kafr el-sheikh, Egypt, with a middle education level and part of the working class, is heavily influenced by my cultural context, individual values, and socioeconomic background. In Egypt, there is a strong sense of community and loyalty to one's social group, and fairness in elections is often perceived through the lens of these social connections. Additionally, as a member of the working class, I may have limited access to information and resources compared to higher socioeconomic classes, impacting my perception of election fairness. Therefore, I believe that election officials are not often fair in the country's elections.\n\n3"]}, {"persona": {"region": "Kafr el-sheikh", "sex": "male", "age": 35, "country": "Egypt", "marital_status": "married", "education": "higher", "social_class": "lower middle class"}, "question": {"id": "Q229", "variant": 0}, "response": ["Based on the anthropological framework, my response is based on my emic perspective as a married male from Kafr el-sheikh, Egypt, who has completed higher education and considers himself part of the lower middle class. My cultural context and individual values lead me to believe that election officials are fairly often fair in country's elections. My experience and personal values have shaped my perception of the fairness of election officials. Additionally, my socioeconomic background and cultural relativism have influenced my belief that election officials are fairly often fair in country's elections. Lastly, my age and place as a 35-year-old from Kafr el-sheikh, Egypt, contribute to my nuanced understanding of the situation. Therefore, my answer is:\n\n2) Fairly often"]}, {"persona": {"region": "Kafr el-sheikh", "sex": "male", "age": 49, "country": "Egypt", "marital_status": "married", "education": "middle", "social_class": "lower class"}, "question": {"id": "Q229", "variant": 0}, "response": ["Based on my emic perspective as a lower-class, middle-educated married male from Kafr el-sheikh, Egypt, I understand that the cultural context of elections in our country is influenced by factors such as socioeconomic background and power dynamics. My personal experience and values lead me to believe that election officials are not often fair in the country's elections. This belief is shaped by the nuanced phrasing of the question and my understanding of cultural relativism, which emphasizes that there is no hierarchy of culture and that different perspectives should be respected.\n\n3"]}, {"persona": {"region": "Kafr el-sheikh", "sex": "male", "age": 37, "country": "Egypt", "marital_status": "married", "education": "middle", "social_class": "lower class"}, "question": {"id": "Q229", "variant": 0}, "response": ["Based on the anthropological framework, my emic perspective as a married male from Kafr el-sheikh, Egypt, with a lower socioeconomic background and middle education level, is heavily influenced by my cultural context, individual values, and personal experiences. In Egypt, there is a long history of political corruption and unfair elections, which is well-known within my community. This cultural context shapes my perception of the fairness of election officials in the country's elections. Additionally, my lower socioeconomic background influences my belief that those in positions of power may not always act in the best interest of the people, further shaping my perspective. Therefore, based on my personal experience and cultural context, I would answer the question as follows:\n\n3\n\n(3) Not often"]}, {"persona": {"region": "Menofia", "sex": "female", "age": 22, "country": "Egypt", "marital_status": "single", "education": "middle", "social_class": "lower class"}, "question": {"id": "Q229", "variant": 0}, "response": ["Based on my cultural context and socioeconomic background, as a 22-year-old single female from Menofia, Egypt, who has completed only middle education, I have limited exposure to the political processes and may not have had the opportunity to witness fair election practices. Additionally, my individual values and personal experiences have shaped my perception, and I may have heard from my community that election officials are not often fair in our country's elections. This perspective is further influenced by my lower-class status, which may impact my access to information and resources that would allow me to engage more fully in the political process. Therefore, I believe that the answer is:\n\n3"]}, {"persona": {"region": "Menofia", "sex": "female", "age": 25, "country": "Egypt", "marital_status": "married", "education": "middle", "social_class": "lower class"}, "question": {"id": "Q229", "variant": 0}, "response": ["Based on the anthropological framework, my emic perspective as a married female from Menofia, Egypt, with a middle education level and lower socioeconomic background, is influenced by the cultural context of my community and personal experiences. In Egypt, there is a history of political corruption and unfair electoral practices, which has been widely reported and discussed within my social and familial networks. My lower socioeconomic background also means that I am more likely to have firsthand experiences or know someone who has experienced unfair treatment by election officials. Therefore, taking into account the cultural relativism and nuanced understanding of the question, I would answer:\n3"]}, {"persona": {"region": "Menofia", "sex": "male", "age": 28, "country": "Egypt", "marital_status": "single", "education": "higher", "social_class": "working class"}, "question": {"id": "Q229", "variant": 0}, "response": ["Based on the anthropological framework, my emic perspective as a single male from Menofia, Egypt, with a working-class background and higher education, is influenced by my cultural context, individual values, and personal experiences. I understand that the socioeconomic background and cultural relativism play a significant role in shaping my perception of election officials' fairness in the country's elections. Additionally, my age and place of residence also contribute to my nuanced understanding of this issue. Considering these factors, I believe that election officials are not often fair in the country's elections. \n\n3"]}, {"persona": {"region": "Menofia", "sex": "male", "age": 35, "country": "Egypt", "marital_status": "married", "education": "middle", "social_class": "lower middle class"}, "question": {"id": "Q229", "variant": 0}, "response": ["Based on the anthropological framework, as a married male from Menofia, Egypt, my emic perspective is influenced by the cultural context, individual values, socioeconomic background, and space and time. In Egypt, there is a strong sense of community and reliance on personal relationships, which can impact the fairness of election officials. Additionally, my lower middle class status and middle education level may shape my perception of the fairness of election officials. Considering these factors, I would choose option 2: Fairly often, as there is a level of trust in the system, but also recognition of potential issues. \n\n2"]}, {"persona": {"region": "Menofia", "sex": "male", "age": 55, "country": "Egypt", "marital_status": "married", "education": "middle", "social_class": "working class"}, "question": {"id": "Q229", "variant": 0}, "response": ["Based on the anthropological framework, as a married male from Menofia, Egypt, with a middle education level and part of the working class, my perspective is shaped by my cultural context, individual values, and socioeconomic background. In Egypt, there is a strong sense of collectivism and respect for authority, which may influence my perception of election officials as being fair, especially if they are associated with the government. Additionally, as a working-class individual, I may have limited access to information and resources that could inform my understanding of the fairness of elections. Therefore, I would be inclined to believe that election officials are very often fair in the country's elections due to my cultural context and socioeconomic background.\n\n1"]}, {"persona": {"region": "Menofia", "sex": "male", "age": 53, "country": "Egypt", "marital_status": "married", "education": "higher", "social_class": "lower middle class"}, "question": {"id": "Q229", "variant": 0}, "response": ["Based on the anthropological framework, my answer to the question of how frequently election officials are fair in the country's elections would be influenced by my emic perspective as a married male from Menofia, Egypt. My cultural context, individual values, and personal experiences would shape my perception of the fairness of election officials. Additionally, my socioeconomic background as part of the lower middle class and my age would also play a role in my understanding of this issue. Considering cultural relativism, I would argue that fairness in elections is a complex issue that cannot be objectively quantified, and that my nuanced understanding of this issue leads me to believe that election officials are fairly often fair in the country's elections.\n\n2"]}, {"persona": {"region": "Menofia", "sex": "male", "age": 59, "country": "Egypt", "marital_status": "married", "education": "middle", "social_class": "working class"}, "question": {"id": "Q229", "variant": 0}, "response": ["Based on the anthropological framework, my answer to the question of how frequently election officials are fair in the country's elections is influenced by my emic perspective as a married male from Menofia, Egypt. My cultural context, individual values, and personal experiences as part of the working class in Egypt play a significant role in shaping my perception of fairness in elections. Additionally, my socioeconomic background and age also contribute to my understanding of this issue. Considering the cultural relativism, I understand that fairness is subjective and can be interpreted differently in different cultural contexts. Therefore, I believe that election officials are fairly often fair in the country's elections.\n\n2"]}, {"persona": {"region": "Menofia", "sex": "female", "age": 42, "country": "Egypt", "marital_status": "married", "education": "middle", "social_class": "lower middle class"}, "question": {"id": "Q229", "variant": 0}, "response": ["Based on the anthropological framework, my perspective as a married female from Menofia, Egypt, at 42 years of age and belonging to the lower middle class, will be influenced by my cultural context, individual values, and personal experience. In Egypt, there is a strong sense of community and a reliance on traditional social structures, which can impact the perception of fairness in elections. Additionally, my socioeconomic background and level of education may also influence my views on this topic. Considering these factors, I would choose option (3) Not often, as my personal experience and cultural context lead me to believe that election officials are not often fair in the country's elections."]}, {"persona": {"region": "Menofia", "sex": "male", "age": 39, "country": "Egypt", "marital_status": "married", "education": "higher", "social_class": "working class"}, "question": {"id": "Q229", "variant": 0}, "response": ["From an emic perspective, as a married male from Menofia, Egypt, my understanding of the fairness of election officials in the country's elections is heavily influenced by the cultural context of Egypt and my socioeconomic background as a working-class individual. My personal experience and individual values also play a significant role in shaping my perception. Additionally, space and time, as well as nuanced phrasing of the question, are important factors to consider. Taking all of this into account, I would say that election officials are not often fair in the country's elections.\n\n3"]}, {"persona": {"region": "Menofia", "sex": "male", "age": 34, "country": "Egypt", "marital_status": "married", "education": "middle", "social_class": "lower middle class"}, "question": {"id": "Q229", "variant": 0}, "response": ["Based on the anthropological framework outlined above, my answer to the question of how frequently election officials are fair in my country's elections would be influenced by my emic perspective as a married male from Menofia, Egypt. My cultural context, individual values, and personal experience as part of the lower middle class in Egypt would lead me to consider the socioeconomic background and cultural relativism in my response. Additionally, my age and place as a 34-year-old male from Menofia, Egypt, who has completed middle education level, would also factor into my perspective. Given these factors, I would choose option (3) Not often as my response.\n\n3"]}, {"persona": {"region": "Menofia", "sex": "male", "age": 22, "country": "Egypt", "marital_status": "single", "education": "higher", "social_class": "working class"}, "question": {"id": "Q229", "variant": 0}, "response": ["Based on the anthropological framework, I would like to answer this question from the perspective of a single male from Menofia, Egypt, who is 22 years old and part of the working class. My cultural context and socioeconomic background have shaped my understanding of the fairness of election officials in my country's elections. As someone who has completed higher education, I am aware of the importance of fair elections for the functioning of a democratic society. However, my personal experience and the cultural context of Egypt lead me to believe that election officials are not often fair in the country's elections. This perception is influenced by the socioeconomic and political dynamics in Egypt, where there is a history of electoral irregularities and lack of transparency in the electoral process. Therefore, based on my experience and understanding, I would choose option (3) Not often. \n\n3"]}, {"persona": {"region": "Menofia", "sex": "male", "age": 21, "country": "Egypt", "marital_status": "single", "education": "middle", "social_class": "working class"}, "question": {"id": "Q229", "variant": 0}, "response": ["Based on the anthropological framework, my perspective as a single male from Menofia, Egypt, who has completed middle education and considers himself part of the working class is heavily influenced by my cultural context, individual values, and socioeconomic background. In Egypt, there is a strong sense of community and family ties, and my personal experience and values lead me to believe that election officials are fairly often fair in the country's elections. Additionally, my socioeconomic background as part of the working class means that I have experienced a level of fairness in the electoral process that may differ from those in higher socioeconomic brackets. Therefore, my answer to the question is option (2) Fairly often. \n\n2"]}, {"persona": {"region": "Menofia", "sex": "male", "age": 36, "country": "Egypt", "marital_status": "married", "education": "higher", "social_class": "working class"}, "question": {"id": "Q229", "variant": 0}, "response": ["Based on the anthropological framework, as a married male from Menofia, Egypt, who is 36 years old and part of the working class, my perspective on the fairness of election officials in the country's elections is influenced by my cultural context, individual values, and socioeconomic background. In Egypt, there is a long history of political unrest and allegations of electoral fraud, which is further exacerbated by the socioeconomic disparities and class divisions within the society. Additionally, my personal experience and understanding of the political system lead me to believe that election officials are not often fair in the country's elections. This perception is shaped by the nuance of the question and reflects the emic perspective of someone who is directly affected by the political processes in Egypt.\n\n3"]}, {"persona": {"region": "Menofia", "sex": "female", "age": 52, "country": "Egypt", "marital_status": "married", "education": "higher", "social_class": "lower middle class"}, "question": {"id": "Q229", "variant": 0}, "response": ["Based on my emic perspective as a married female from Menofia, Egypt, I have personally experienced and observed that election officials are fairly often fair in the country's elections. This perception is influenced by the cultural context of my community, where there is a strong emphasis on fairness and justice. My individual values and personal experience also play a role, as I have had positive experiences with election officials in the past. Additionally, my socioeconomic background as a lower middle class individual may influence my belief that election officials are generally fair, as I may have more trust in the systems and institutions of my country. Considering the cultural relativism, I understand that my perspective may differ from others, but I believe that my nuanced understanding of the situation leads me to conclude that election officials are fairly often fair in the country's elections.\n\n2"]}, {"persona": {"region": "Menofia", "sex": "male", "age": 52, "country": "Egypt", "marital_status": "married", "education": "higher", "social_class": "lower middle class"}, "question": {"id": "Q229", "variant": 0}, "response": ["Based on the anthropological framework, my answer to the question of how frequently election officials are fair in the country's elections would be influenced by my emic perspective as a married male from Menofia, Egypt, my cultural context, individual values, and socioeconomic background. In Egypt, there is a history of political corruption and lack of transparency in elections, which leads to a general perception of election officials not being fair. Additionally, as a member of the lower middle class, I may have personally experienced or heard about instances of unfair practices during elections. This, combined with the cultural relativism and nuance in interpreting the question, leads me to choose option (3) Not often. \n\n3"]}, {"persona": {"region": "Menofia", "sex": "male", "age": 39, "country": "Egypt", "marital_status": "married", "education": "middle", "social_class": "lower class"}, "question": {"id": "Q229", "variant": 0}, "response": ["Based on the anthropological framework, the individual values and personal experiences of a married male from Menofia, Egypt, who considers himself part of the lower class, will heavily influence his perception of the fairness of election officials in the country's elections. His socioeconomic background and cultural context will also play a significant role in shaping his perspective. Additionally, his age and place of residence will contribute to his nuanced understanding of the issue. Considering these factors, he is likely to view election officials as not often fair in the country's elections.\n\n3"]}, {"persona": {"region": "Menofia", "sex": "male", "age": 23, "country": "Egypt", "marital_status": "single", "education": "middle", "social_class": "lower middle class"}, "question": {"id": "Q229", "variant": 0}, "response": ["Based on the anthropological framework, as a single male from Menofia, Egypt, who has completed middle education and considers myself part of the lower middle class, my perspective is heavily influenced by my cultural context, individual values, and personal experience. In Egypt, there is a strong sense of community and trust in the government, but there are also socioeconomic disparities that affect the fairness of elections. Additionally, my age and educational background may lead me to have a more critical view of election officials' fairness. Therefore, I would choose option (3) Not often, as my personal experience and cultural context lead me to believe that election officials are not often fair in our country's elections."]}, {"persona": {"region": "Dakahlia", "sex": "female", "age": 24, "country": "Egypt", "marital_status": "single", "education": "higher", "social_class": "lower middle class"}, "question": {"id": "Q229", "variant": 0}, "response": ["Based on the anthropological framework of emic and etic perspectives, cultural context, individual values and personal experience, socioeconomic background, cultural relativism, space and time, and nuance, as a single female from Dakahlia, Egypt, who has completed higher education and considers herself part of the lower middle class, I believe that election officials are not often fair in the country's elections. My understanding is shaped by the cultural context of Egypt, where there have been instances of electoral misconduct and voter suppression. Additionally, my personal experience and socioeconomic background have influenced my perception, as I have witnessed and experienced the challenges faced by individuals from lower middle class backgrounds in accessing fair and transparent electoral processes. Furthermore, cultural relativism reminds us that different perspectives and experiences shape our understanding of fairness in elections. Finally, the nuanced phrasing of the question leads me to choose \"not often\" as my answer.\n\n3"]}, {"persona": {"region": "Dakahlia", "sex": "male", "age": 36, "country": "Egypt", "marital_status": "married", "education": "higher", "social_class": "upper middle class"}, "question": {"id": "Q229", "variant": 0}, "response": ["Based on the anthropological framework, my answer is influenced by my emic perspective as a married male from Dakahlia, Egypt, as well as my individual values and personal experience. In Egypt, the cultural context and socioeconomic background play a significant role in shaping my perception of the fairness of election officials. Additionally, my higher education level has provided me with a nuanced understanding of the political landscape in my country. Therefore, I believe that election officials in Egypt are fairly often fair in the country's elections. \n\n2"]}, {"persona": {"region": "Dakahlia", "sex": "female", "age": 71, "country": "Egypt", "marital_status": "married", "education": "higher", "social_class": "upper middle class"}, "question": {"id": "Q229", "variant": 0}, "response": ["Based on the anthropological framework, as a married female from Dakahlia, Egypt, who is 71 years old and part of the upper middle class, my answer to the question of how frequently election officials are fair in the country's elections would be influenced by my cultural context, individual values, and personal experience. In Egypt, there have been historical and cultural factors that have shaped my perspective on the fairness of election officials. Additionally, my socioeconomic background as part of the upper middle class may lead me to have a more positive view of the fairness of election officials. Furthermore, my higher education level may have also exposed me to different perspectives on this issue. Therefore, considering all these factors, I would answer the question as follows:\n\n2\n\nFairly often"]}, {"persona": {"region": "Dakahlia", "sex": "male", "age": 55, "country": "Egypt", "marital_status": "married", "education": "higher", "social_class": "upper middle class"}, "question": {"id": "Q229", "variant": 0}, "response": ["Based on my emic perspective as a married male from Dakahlia, Egypt, I understand the cultural context of our country and the importance of elections. My individual values and personal experience, along with my socioeconomic background, lead me to believe that election officials are fairly often fair in our country's elections. I also consider the cultural relativism of our society, where fairness is valued, and the nuance of the question, which allows for some level of subjectivity in the answer.\n\n2"]}, {"persona": {"region": "Dakahlia", "sex": "male", "age": 64, "country": "Egypt", "marital_status": "married", "education": "higher", "social_class": "lower middle class"}, "question": {"id": "Q229", "variant": 0}, "response": ["Based on the anthropological framework, my emic perspective as a married male from Dakahlia, Egypt, who is 64 years old and part of the lower middle class, is heavily influenced by my cultural context, individual values, and socioeconomic background. In Egypt, there is a long history of skepticism towards the fairness of elections, and this skepticism is further reinforced by my personal experience and the experiences of those around me. Additionally, my socioeconomic background and lower middle class status lead me to believe that election officials are not often fair in the country's elections, as I feel that those in power often prioritize their own interests over the needs of the people.\n\n3"]}, {"persona": {"region": "Dakahlia", "sex": "female", "age": 29, "country": "Egypt", "marital_status": "married", "education": "middle", "social_class": "lower class"}, "question": {"id": "Q229", "variant": 0}, "response": ["Based on the anthropological framework, my emic perspective as a married female from Dakahlia, Egypt, would be influenced by my cultural context, individual values, socioeconomic background, and space and time. In my community, there is a general perception that election officials are not often fair in the country's elections. This belief is shaped by the experiences of people in my community, as well as our lower socioeconomic status, which often leads to feelings of disenfranchisement and distrust in the political system. Additionally, as a 29-year-old woman who has completed middle education level, I have witnessed instances of unfairness and corruption in past elections, further reinforcing this perspective.\n\n3"]}, {"persona": {"region": "Dakahlia", "sex": "female", "age": 40, "country": "Egypt", "marital_status": "married", "education": "middle", "social_class": "upper middle class"}, "question": {"id": "Q229", "variant": 0}, "response": ["Based on the anthropological framework, my emic perspective as a married female from Dakahlia, Egypt, would be influenced by my cultural context, individual values, socioeconomic background, and the nuanced phrasing of the question. In Egypt, there is a strong sense of respect for authority and a belief in the fairness of the electoral process, despite some evidence suggesting otherwise. As part of the upper middle class, I may have more access to information and resources than those in lower socioeconomic classes, leading me to believe that election officials are fair fairly often. Additionally, my personal experience and values may lead me to have a more positive perception of the electoral process. \n\n2"]}, {"persona": {"region": "Dakahlia", "sex": "male", "age": 37, "country": "Egypt", "marital_status": "married", "education": "higher", "social_class": "lower middle class"}, "question": {"id": "Q229", "variant": 0}, "response": ["Based on my cultural context in Dakahlia, Egypt, my socioeconomic background as a lower middle class married male, and my personal experience, I understand that the fairness of election officials can vary. The emic and etic perspectives in my community may differ from those in other regions, and my individual values and personal experiences also shape my perception. Additionally, cultural relativism teaches me that there is no hierarchy of culture, so my understanding of fairness in elections may differ from others. Therefore, I believe that election officials are fairly often fair in country's elections.\n\n2"]}, {"persona": {"region": "Dakahlia", "sex": "female", "age": 45, "country": "Egypt", "marital_status": "married", "education": "middle", "social_class": "working class"}, "question": {"id": "Q229", "variant": 0}, "response": ["Based on the anthropological framework, my perspective as a married female from Dakahlia, Egypt, is shaped by my cultural context, individual values, socioeconomic background, and space and time. In Egypt, there is a strong emphasis on family and community, and individuals are often influenced by the opinions and experiences of those around them. Additionally, as a working-class woman with a middle education level, I may have limited access to information and resources that could inform my perspective on the fairness of election officials. Considering these factors, I would choose option (3) Not often, as I may have experienced or heard about instances of unfairness in country's elections."]}, {"persona": {"region": "Dakahlia", "sex": "male", "age": 34, "country": "Egypt", "marital_status": "single", "education": "middle", "social_class": "lower middle class"}, "question": {"id": "Q229", "variant": 0}, "response": ["Based on the anthropological framework, my perspective as a single male from Dakahlia, Egypt, who has completed middle education and considers myself part of the lower middle class, is influenced by my cultural context, socioeconomic background, individual values, and personal experience. In my community, there is a general sense of distrust towards election officials due to past experiences of corruption and unfair practices. Additionally, my socioeconomic background and lower middle class status have limited my access to resources and opportunities, which may affect my perception of fairness in elections. Therefore, I would answer the question as follows:\n\n3"]}, {"persona": {"region": "Dakahlia", "sex": "female", "age": 26, "country": "Egypt", "marital_status": "married", "education": "higher", "social_class": "upper middle class"}, "question": {"id": "Q229", "variant": 0}, "response": ["Based on the anthropological framework, as a married female from Dakahlia, Egypt, age 26, and part of the upper middle class, I consider the cultural context, individual values, and personal experience when answering this question. In my cultural context, there is a strong emphasis on fairness and justice, and election officials are generally perceived to be fair in conducting the country's elections. Additionally, my personal experience and socioeconomic background have provided me with opportunities to be informed about the electoral process and have confidence in the fairness of election officials. Therefore, I believe that election officials are very often fair in the country's elections.\n\n1"]}, {"persona": {"region": "Dakahlia", "sex": "male", "age": 21, "country": "Egypt", "marital_status": "single", "education": "middle", "social_class": "upper middle class"}, "question": {"id": "Q229", "variant": 0}, "response": ["Based on the anthropological framework, as a single male from Dakahlia, Egypt, I am influenced by my cultural context and socioeconomic background. In Egypt, there is a strong emphasis on family and community, and my upper middle class status may afford me certain privileges and opportunities. Additionally, my age and level of education may influence my understanding of the fairness of election officials. It is important to consider the nuanced phrasing of the question and the subjective nature of individual values and personal experiences. Therefore, I would choose option (2) Fairly often, as I believe that election officials in my country generally strive to be fair in the electoral process."]}, {"persona": {"region": "Dakahlia", "sex": "female", "age": 32, "country": "Egypt", "marital_status": "married", "education": "middle", "social_class": "working class"}, "question": {"id": "Q229", "variant": 0}, "response": ["Based on the anthropological framework, my answer is influenced by my cultural context, individual values, and socioeconomic background. In Dakahlia, Egypt, there is a strong emphasis on community and fairness, and as a member of the working class, I have personally experienced the impact of election officials on the outcome of elections. Additionally, my middle education level has allowed me to critically analyze the fairness of election officials. Therefore, based on my experiences and cultural context, I believe that election officials are not often fair in my country's elections.\n\n3"]}, {"persona": {"region": "Dakahlia", "sex": "female", "age": 35, "country": "Egypt", "marital_status": "married", "education": "middle", "social_class": "upper middle class"}, "question": {"id": "Q229", "variant": 0}, "response": ["Based on my emic perspective, I have observed that election officials in Dakahlia, Egypt are generally fair in their conduct during elections. This is influenced by the cultural context of my community where there is a strong emphasis on upholding fairness and justice. My personal experience and individual values also play a role in my perception, as I have personally witnessed the efforts made by election officials to ensure a fair and transparent electoral process. Additionally, my socioeconomic background as part of the upper middle class may provide me with more access to information and resources to make this judgment. Therefore, I believe that election officials are very often fair in country's elections.\n\n1"]}, {"persona": {"region": "Dakahlia", "sex": "male", "age": 33, "country": "Egypt", "marital_status": "married", "education": "middle", "social_class": "upper middle class"}, "question": {"id": "Q229", "variant": 0}, "response": ["Based on the anthropological framework, as a married male from Dakahlia, Egypt, my emic perspective on the fairness of election officials in the country's elections would be influenced by my cultural context, individual values, and socioeconomic background. In Egypt, there is a long history of political unrest and corruption, which has led to a general distrust in the fairness of election officials. Additionally, as someone who considers themselves part of the upper middle class, I may have different experiences and interactions with election officials compared to those in lower socioeconomic classes. Therefore, my answer would be influenced by my personal experience and cultural context, leading me to believe that election officials are \"not often\" fair in the country's elections. \n\n3"]}, {"persona": {"region": "Dakahlia", "sex": "female", "age": 45, "country": "Egypt", "marital_status": "married", "education": "middle", "social_class": "upper middle class"}, "question": {"id": "Q229", "variant": 0}, "response": ["From an emic perspective, as a married female from Dakahlia, Egypt, my cultural context and socioeconomic background play a significant role in shaping my answer to this question. In Egypt, the understanding of fairness in elections may differ from Western perspectives. Additionally, my age and level of education have provided me with personal experiences and values that inform my understanding of the political system in Egypt. Taking into account the cultural relativism in the Egyptian context, I would say that election officials are \"fairly often\" in country's elections.\n\n2"]}, {"persona": {"region": "Dakahlia", "sex": "male", "age": 30, "country": "Egypt", "marital_status": "married", "education": "middle", "social_class": "upper middle class"}, "question": {"id": "Q229", "variant": 0}, "response": ["Based on the anthropological framework, my perspective as a married male from Dakahlia, Egypt, who is 30 years old and considers himself part of the upper middle class, is influenced by my cultural context, individual values, and socioeconomic background. In Dakahlia, there is a strong sense of community and trust in the government, and as a member of the upper middle class, I have likely had positive experiences with election officials. Additionally, my education level has likely shaped my perception of fairness in elections. Therefore, I would believe that election officials are fair in the country's elections \"very often.\"\n\n1"]}, {"persona": {"region": "Dakahlia", "sex": "female", "age": 63, "country": "Egypt", "marital_status": "married", "education": "higher", "social_class": "lower middle class"}, "question": {"id": "Q229", "variant": 0}, "response": ["Based on my emic perspective as a married woman from Dakahlia, Egypt, I have personally witnessed election officials being fair in the country's elections. In my cultural context, the value of fairness and justice is highly important, and I have seen election officials strive to uphold these values. Additionally, my individual values and personal experiences have led me to believe that election officials are generally fair. Considering my lower middle class socioeconomic background, I have observed that election officials are fair in their duties. Furthermore, cultural relativism teaches us that there is no hierarchy of cultures, and from my perspective, election officials in Egypt are fair. Lastly, my age and place in society have given me a nuanced understanding of election fairness in my country. \n\n2"]}, {"persona": {"region": "Dakahlia", "sex": "male", "age": 28, "country": "Egypt", "marital_status": "single", "education": "higher", "social_class": "upper middle class"}, "question": {"id": "Q229", "variant": 0}, "response": ["Based on the anthropological framework, as a single male from Dakahlia, Egypt, my emic perspective is shaped by my personal experience and socioeconomic background. Being part of the upper middle class and having completed higher education, I have had more exposure to fair election practices and have likely benefitted from a fairer system. Additionally, my cultural context and individual values lead me to believe that election officials are fairly often fair in the country's elections. I have seen and experienced a level of fairness that aligns with my personal and cultural context.\n\n2"]}, {"persona": {"region": "Dakahlia", "sex": "female", "age": 24, "country": "Egypt", "marital_status": "married", "education": "higher", "social_class": "upper middle class"}, "question": {"id": "Q229", "variant": 0}, "response": ["Based on the anthropological framework, my answer to the question of how frequently election officials are fair in the country's elections would be influenced by my cultural context, individual values, and socioeconomic background. As a married female from Dakahlia, Egypt, with a higher education level and part of the upper middle class, I am likely to have a more positive perception of the fairness of election officials in my country. My cultural context and socioeconomic background may lead me to believe that election officials are fairly often fair in the country's elections, as Egypt has made strides in democratic processes and governance. Additionally, my education may have exposed me to information that supports the notion of fairness in elections. Therefore, my answer would be:\n\n2. Fairly often"]}, {"persona": {"region": "Dakahlia", "sex": "male", "age": 20, "country": "Egypt", "marital_status": "single", "education": "middle", "social_class": "upper middle class"}, "question": {"id": "Q229", "variant": 0}, "response": ["Based on the anthropological framework, the cultural context and socioeconomic background of the persona are crucial in answering this question. As a single male from Dakahlia, Egypt, who has completed middle education and considers himself part of the upper middle class, the persona's understanding and perception of election officials' fairness in the country's elections will be influenced by their cultural context, individual values, and personal experiences. Additionally, the persona's age and place also play a role in shaping their perspective on this issue. Therefore, the persona's answer to this question will be influenced by their nuanced understanding of the socio-political landscape in Egypt.\n\n3"]}, {"persona": {"region": "Dakahlia", "sex": "male", "age": 45, "country": "Egypt", "marital_status": "married", "education": "middle", "social_class": "upper middle class"}, "question": {"id": "Q229", "variant": 0}, "response": ["Based on my cultural context and socioeconomic background, I understand that the fairness of election officials in my country's elections can vary. My personal experience and values tell me that while there may be instances of unfairness, overall, election officials are fairly often fair in their conduct. Additionally, my middle education level has provided me with a nuanced understanding of the political processes in my country, and I believe that cultural relativism is important in recognizing that fairness can be perceived differently in different cultural and political contexts.\n\n2"]}, {"persona": {"region": "Dakahlia", "sex": "female", "age": 43, "country": "Egypt", "marital_status": "married", "education": "higher", "social_class": "upper middle class"}, "question": {"id": "Q229", "variant": 0}, "response": ["From an emic perspective, as a married female from Dakahlia, Egypt, my understanding of the fairness of election officials in the country's elections is heavily influenced by my cultural context, individual values, and socioeconomic background. In Egypt, there is a long-standing history of political corruption and lack of transparency in the electoral process. Additionally, my higher education level has exposed me to critical thinking and analysis, leading me to question the fairness of election officials. As a member of the upper middle class, I have access to information and resources that allow me to critically evaluate the political landscape. Taking into account the cultural relativism and nuanced understanding of the question, I would have to say that election officials are not often fair in the country's elections.\n\n3"]}, {"persona": {"region": "Dakahlia", "sex": "female", "age": 20, "country": "Egypt", "marital_status": "single", "education": "middle", "social_class": "upper middle class"}, "question": {"id": "Q229", "variant": 0}, "response": ["Based on the anthropological framework, my emic perspective as a single female from Dakahlia, Egypt, would lead me to consider the cultural context, individual values, and socioeconomic background in answering the question. In Egypt, there is a strong emphasis on family and community values, and fairness is an important aspect of societal norms. Additionally, as part of the upper middle class, I may have more access to resources and information about the political system, which could influence my perception of the fairness of election officials. Therefore, based on these factors, I would choose option (2) Fairly often.\n\n2"]}, {"persona": {"region": "Dakahlia", "sex": "female", "age": 40, "country": "Egypt", "marital_status": "single", "education": "middle", "social_class": "lower middle class"}, "question": {"id": "Q229", "variant": 0}, "response": ["Based on the anthropological framework, my emic perspective as a single female from Dakahlia, Egypt, at the age of 40 and belonging to the lower middle class, is heavily influenced by my cultural context, individual values, and personal experiences. The socioeconomic background and cultural relativism also play a significant role in shaping my perception. In Egypt, there is a history of political instability and allegations of election fraud, which has led to widespread skepticism about the fairness of elections. As a member of the lower middle class, I have personally witnessed and experienced unequal treatment and lack of transparency in the electoral process, leading me to believe that election officials are not often fair in the country's elections.\n\n3"]}, {"persona": {"region": "Dakahlia", "sex": "female", "age": 33, "country": "Egypt", "marital_status": "married", "education": "higher", "social_class": "upper middle class"}, "question": {"id": "Q229", "variant": 0}, "response": ["From an emic perspective, as a married female from Dakahlia, Egypt, I am influenced by the cultural context of my community, where there is a strong emphasis on fair and just governance. My individual values and personal experiences have also shaped my perception, as I have witnessed the impact of fair and unfair election practices on my family and community. Additionally, my socioeconomic background as part of the upper middle class has exposed me to different political dynamics, further influencing my understanding. Considering the nuance of the question and the space and time in which I live, I would say that election officials are \"Fairly often\" in country's elections.\n\n2"]}, {"persona": {"region": "Dakahlia", "sex": "female", "age": 24, "country": "Egypt", "marital_status": "married", "education": "middle", "social_class": "working class"}, "question": {"id": "Q229", "variant": 0}, "response": ["Based on the anthropological framework, my emic perspective as a married female from Dakahlia, Egypt, would be influenced by my cultural context, individual values, and socioeconomic background. In Egypt, there is a strong sense of community and trust in the government and election officials. Additionally, as a working-class individual with a middle education level, I may not have had extensive exposure to political processes and may rely on the opinions of others in my community. Given these factors, I would choose option (2) Fairly often, as I would likely have a positive view of election officials and their fairness in the country's elections.\n\n2"]}, {"persona": {"region": "Dakahlia", "sex": "female", "age": 53, "country": "Egypt", "marital_status": "widowed", "education": "middle", "social_class": "working class"}, "question": {"id": "Q229", "variant": 0}, "response": ["Based on the anthropological framework, my emic perspective as a widowed female from Dakahlia, Egypt, with a middle education level and part of the working class, is influenced by my cultural context, individual values, socioeconomic background, and space and time. In Egypt, there is a strong sense of community and reliance on traditional values, which shapes my understanding of fairness in elections. Additionally, my socioeconomic background as part of the working class means that I may have experienced or witnessed instances of inequality and corruption in the electoral process. Furthermore, being 53 years old means that I have lived through various political and social changes in Egypt, which may have influenced my perception of the fairness of election officials. Therefore, my response to the question is:\n\n2"]}, {"persona": {"region": "Dakahlia", "sex": "female", "age": 30, "country": "Egypt", "marital_status": "single", "education": "middle", "social_class": "lower middle class"}, "question": {"id": "Q229", "variant": 0}, "response": ["Based on the anthropological framework, as a single female from Dakahlia, Egypt, my emic perspective on the fairness of election officials in the country's elections is influenced by my cultural context, individual values and personal experience, and socioeconomic background. In Egypt, there is a history of political corruption and lack of transparency in the electoral process, which shapes my perception of the frequency of election officials being fair. Additionally, as a member of the lower middle class, I may have limited access to information and resources that could impact my trust in the fairness of election officials. Therefore, I would choose option (3) Not often."]}, {"persona": {"region": "Dakahlia", "sex": "male", "age": 53, "country": "Egypt", "marital_status": "married", "education": "higher", "social_class": "upper middle class"}, "question": {"id": "Q229", "variant": 0}, "response": ["From the emic and etic perspectives, as a married male from Dakahlia, Egypt, I am part of the in-group and have a deep understanding of the cultural context and societal dynamics at play in my country. My higher education level and upper middle class status also provide me with a nuanced understanding of the political landscape and the role of election officials. Additionally, my age and personal experience have shaped my perceptions and beliefs. Considering all these factors, I believe that election officials are fairly often fair in country's elections.\n\n2"]}, {"persona": {"region": "Dakahlia", "sex": "male", "age": 28, "country": "Egypt", "marital_status": "married", "education": "middle", "social_class": "working class"}, "question": {"id": "Q229", "variant": 0}, "response": ["Based on the anthropological framework, as a married male from Dakahlia, Egypt, I am influenced by my cultural context, individual values, and socioeconomic background. In Egypt, there is a long history of political corruption and lack of fairness in elections. This is widely recognized among the working class, like myself, who struggle to make a living and often feel marginalized by the political system. My personal experience and the experiences of those around me have led me to believe that election officials are not often fair in the country's elections. This perspective is shaped by the cultural context of Egypt, my socioeconomic background, and the nuanced phrasing of the question, and I believe it accurately reflects the viewpoint of the persona described above.\n\n3"]}, {"persona": {"region": "Dakahlia", "sex": "female", "age": 38, "country": "Egypt", "marital_status": "married", "education": "middle", "social_class": "upper middle class"}, "question": {"id": "Q229", "variant": 0}, "response": ["Based on the anthropological framework, as a married female from Dakahlia, Egypt, my emic perspective would be influenced by my cultural context, individual values, and socioeconomic background. In Egypt, there may be a tendency to view election officials as fair more often than not due to cultural norms and personal experiences. Additionally, being part of the upper middle class may lead to a more positive perception of the fairness of election officials. Therefore, from this perspective, I would choose option (2) Fairly often. \n\n2"]}, {"persona": {"region": "Gharbia", "sex": "male", "age": 27, "country": "Egypt", "marital_status": "single", "education": "higher", "social_class": "upper middle class"}, "question": {"id": "Q229", "variant": 0}, "response": ["Based on my emic perspective as a single male from Gharbia, Egypt, I have a higher education level and consider myself part of the upper middle class. My cultural context and socioeconomic background have shaped my understanding of the fairness of election officials in our country's elections. I have observed that election officials are fairly often fair in their conduct during elections, taking into account the cultural relativism and nuance of the situation. Additionally, my individual values and personal experience lead me to believe that the majority of election officials strive to uphold fairness in the electoral process, despite any challenges that may arise. Therefore, I choose option (2) Fairly often. \n\n2"]}, {"persona": {"region": "Gharbia", "sex": "female", "age": 35, "country": "Egypt", "marital_status": "married", "education": "higher", "social_class": "upper middle class"}, "question": {"id": "Q229", "variant": 0}, "response": ["Based on the anthropological framework, my perspective as a married female from Gharbia, Egypt, who is 35 years old, has completed higher education, and considers herself part of the upper middle class, is influenced by various factors. Firstly, the cultural context in Egypt, as well as my individual values and personal experiences, shape my perception of the fairness of election officials. Additionally, my socioeconomic background and cultural relativism play a significant role in how I view this issue. Furthermore, the nuance of the question also impacts my answer, as it prompts me to consider the frequency of fairness in elections. \n\n2"]}, {"persona": {"region": "Gharbia", "sex": "female", "age": 37, "country": "Egypt", "marital_status": "married", "education": "higher", "social_class": "upper middle class"}, "question": {"id": "Q229", "variant": 0}, "response": ["Based on the anthropological framework, my answer to the question of how frequently election officials are fair in country's elections would be influenced by my cultural context, individual values, and socioeconomic background. As a married female from Gharbia, Egypt, who has completed higher education and considers herself part of the upper middle class, my perspective is likely to be shaped by the cultural and socioeconomic factors in my environment. Additionally, my personal experiences and values would play a significant role in my perception of the fairness of election officials. Therefore, my answer is:\n\n2) Fairly often"]}, {"persona": {"region": "Gharbia", "sex": "male", "age": 43, "country": "Egypt", "marital_status": "married", "education": "middle", "social_class": "lower middle class"}, "question": {"id": "Q229", "variant": 0}, "response": ["Based on the anthropological framework, my perspective is influenced by my cultural context, individual values, and socioeconomic background. In Gharbia, Egypt, there is a strong sense of community and family ties, and fairness is highly valued. However, my lower middle-class status and middle education level may lead me to be more critical of the fairness of election officials. Additionally, my age and experience may lead me to believe that election officials are not often fair in the country's elections, as I have witnessed instances of corruption and favoritism. Therefore, I would choose option (3) Not often."]}, {"persona": {"region": "Gharbia", "sex": "male", "age": 28, "country": "Egypt", "marital_status": "single", "education": "higher", "social_class": "lower middle class"}, "question": {"id": "Q229", "variant": 0}, "response": ["Based on the anthropological framework, as a 28-year-old single male from Gharbia, Egypt, who has completed higher education and identifies as part of the lower middle class, my perspective on the fairness of election officials in the country's elections is heavily influenced by my cultural context, individual values, and socioeconomic background. In Egypt, there is a long history of government corruption and manipulation of elections, which has shaped my perception of the fairness of election officials. Additionally, my lower middle class socioeconomic background has made me more aware of the challenges and inequalities faced by ordinary citizens in the electoral process. Therefore, I believe that election officials are not often fair in the country's elections.\n\n3"]}, {"persona": {"region": "Gharbia", "sex": "male", "age": 39, "country": "Egypt", "marital_status": "married", "education": "middle", "social_class": "lower middle class"}, "question": {"id": "Q229", "variant": 0}, "response": ["Based on the anthropological framework, my response to the question on the fairness of election officials in the country's elections is influenced by my cultural context, individual values, and socioeconomic background. As a married male from Gharbia, Egypt, I am from a lower middle class background and have completed middle education level. In my cultural context, there may be a perception that election officials are not often fair in the country's elections due to factors such as corruption and power dynamics. Additionally, my personal experience and values may lead me to believe that fairness is not often the case in elections. Therefore, I would choose option (3) Not often."]}, {"persona": {"region": "Gharbia", "sex": "male", "age": 30, "country": "Egypt", "marital_status": "married", "education": "middle", "social_class": "lower middle class"}, "question": {"id": "Q229", "variant": 0}, "response": ["Based on the anthropological framework, my understanding of the fairness of election officials in my country's elections is influenced by my cultural context, individual values, and socioeconomic background. Growing up in Gharbia, Egypt, I have observed that election officials are not always fair due to corruption and power dynamics. As a member of the lower middle class, I have personally experienced the impact of unfair elections on my community and have heard similar experiences from my peers. This has shaped my belief that election officials are not often fair in our country's elections. \n\n3"]}, {"persona": {"region": "Gharbia", "sex": "male", "age": 43, "country": "Egypt", "marital_status": "married", "education": "lower", "social_class": "lower middle class"}, "question": {"id": "Q229", "variant": 0}, "response": ["From an emic perspective, as a married male from Gharbia, Egypt, I have grown up in a cultural context where socioeconomic background heavily influences our experiences and perceptions. Being part of the lower middle class and having completed only lower education level, I have witnessed how election officials are not often fair in our country's elections. This understanding is shaped by my individual values, personal experiences, and the cultural relativism that exists within our society. Additionally, space and time also play a role in shaping my perception, as I have observed this pattern over the years. Therefore, I believe that the answer to this question, from my perspective, would be (3) Not often."]}, {"persona": {"region": "Gharbia", "sex": "male", "age": 36, "country": "Egypt", "marital_status": "married", "education": "higher", "social_class": "lower middle class"}, "question": {"id": "Q229", "variant": 0}, "response": ["Based on the anthropological framework, my answer is influenced by my emic perspective as a married male from Gharbia, Egypt, where cultural context, individual values, and socioeconomic background play a significant role in shaping my perception. In Egypt, there is a strong sense of community and trust in the government, and as a member of the lower middle class, I have personally experienced and witnessed fair and transparent elections. Additionally, my higher education level has provided me with a deeper understanding of the political system and the role of election officials. Therefore, I believe that election officials are fairly often fair in the country's elections.\n\n2"]}, {"persona": {"region": "Gharbia", "sex": "male", "age": 25, "country": "Egypt", "marital_status": "married", "education": "middle", "social_class": "upper middle class"}, "question": {"id": "Q229", "variant": 0}, "response": ["Based on the anthropological framework, my answer is influenced by my emic perspective as a married male from Gharbia, Egypt. The cultural context of Egypt, including its political climate, plays a crucial role in my understanding of the fairness of election officials. Additionally, my individual values and personal experience as a member of the upper middle class have shaped my perception of the political system in the country. My socioeconomic background also influences my answer, as it impacts my access to information and resources related to elections. Furthermore, the concept of cultural relativism reminds me that my perspective is not universal and may differ from others. Lastly, considering the nuanced phrasing of the question, I select option (3) Not often. \n\n3"]}, {"persona": {"region": "Gharbia", "sex": "male", "age": 31, "country": "Egypt", "marital_status": "married", "education": "middle", "social_class": "upper middle class"}, "question": {"id": "Q229", "variant": 0}, "response": ["Based on the anthropological framework, my perspective as a married male from Gharbia, Egypt, is influenced by my cultural context, individual values, socioeconomic background, and space and time. In Egypt, there has been a historical context of political turmoil and allegations of unfair elections. As a member of the upper middle class, with access to education and resources, I am more likely to have a positive view of the fairness of election officials. Additionally, my age and place of residence in Gharbia may also shape my perception. Therefore, I would answer the question with option (2) Fairly often."]}, {"persona": {"region": "Gharbia", "sex": "male", "age": 33, "country": "Egypt", "marital_status": "married", "education": "higher", "social_class": "lower middle class"}, "question": {"id": "Q229", "variant": 0}, "response": ["Based on the anthropological framework, my answer to the question of how frequently election officials are fair in the country's elections would be influenced by my cultural context, individual values, and socioeconomic background. Coming from Gharbia, Egypt, where there is a history of political issues, and considering my lower middle class status, I have personally experienced and witnessed instances of unfairness in elections. Additionally, my education has exposed me to critical thinking and analysis of power dynamics. Therefore, my answer would be influenced by both the emic and etic perspectives, as well as my personal experience and cultural context. \n\n3"]}, {"persona": {"region": "Gharbia", "sex": "male", "age": 26, "country": "Egypt", "marital_status": "single", "education": "higher", "social_class": "upper middle class"}, "question": {"id": "Q229", "variant": 0}, "response": ["Based on the anthropological framework, as a single male from Gharbia, Egypt, my emic perspective on the fairness of election officials in the country's elections is influenced by my cultural context, individual values, and socioeconomic background. In Egypt, there is a strong emphasis on hierarchical structures and power dynamics, and as a member of the upper middle class, I have witnessed a level of fairness in the electoral process. Additionally, my higher education level has provided me with a nuanced understanding of the political system, leading me to believe that election officials are fairly often fair in the country's elections.\n\n2"]}, {"persona": {"region": "Gharbia", "sex": "female", "age": 45, "country": "Egypt", "marital_status": "married", "education": "middle", "social_class": "lower middle class"}, "question": {"id": "Q229", "variant": 0}, "response": ["Based on my personal experience and cultural context as a married female from Gharbia, Egypt, I have observed that election officials are fairly often fair in the country's elections. This perception is influenced by my socioeconomic background and the cultural relativism of my community. As a member of the lower middle class, I have seen that election officials generally conduct the elections in a fair manner, allowing for a relatively smooth and transparent process. Additionally, my age and place in society have shaped my understanding of the fairness of election officials. Therefore, I would choose option (2) Fairly often. \n\n2"]}, {"persona": {"region": "Gharbia", "sex": "female", "age": 55, "country": "Egypt", "marital_status": "married", "education": "middle", "social_class": "upper middle class"}, "question": {"id": "Q229", "variant": 0}, "response": ["Based on the anthropological framework, as a married female from Gharbia, Egypt, I would consider the emic perspective of this question. In my cultural context, the perception of fairness in elections is influenced by historical and political factors, as well as my personal experiences. As a member of the upper middle class, I may have a different perspective on the fairness of election officials compared to those from lower socioeconomic backgrounds. Additionally, my age and education level may also influence my viewpoint on this issue. Therefore, I would answer the question by considering the nuances involved and select option 2: Fairly often."]}, {"persona": {"region": "Gharbia", "sex": "female", "age": 27, "country": "Egypt", "marital_status": "married", "education": "higher", "social_class": "upper middle class"}, "question": {"id": "Q229", "variant": 0}, "response": ["Based on the anthropological framework, my emic perspective as a married female from Gharbia, Egypt, would be influenced by my cultural context, individual values, and socioeconomic background. In Egypt, elections are often seen as fair and legitimate, as the country has made efforts to establish democratic processes. Additionally, as someone from the upper middle class who has completed higher education, I may have had more exposure to information about election processes and have a greater trust in the system. Therefore, my answer would be:\n\n(2) Fairly often"]}, {"persona": {"region": "Gharbia", "sex": "female", "age": 42, "country": "Egypt", "marital_status": "married", "education": "higher", "social_class": "upper middle class"}, "question": {"id": "Q229", "variant": 0}, "response": ["Based on the anthropological framework, my perspective as a married female from Gharbia, Egypt, who is 42 years old, has a higher education level, and considers herself part of the upper middle class, is influenced by various factors. Firstly, the cultural context in Egypt is such that there is a certain level of skepticism towards the fairness of election officials in the country's elections. This is compounded by my personal experience and values, as well as my socioeconomic background, which leads me to believe that election officials are not often fair in the country's elections. Additionally, the nuanced phrasing of the question also plays a role in my response, as it prompts me to consider the specific frequency of fairness, rather than a binary yes or no answer.\n\n3"]}, {"persona": {"region": "Gharbia", "sex": "female", "age": 32, "country": "Egypt", "marital_status": "married", "education": "middle", "social_class": "upper middle class"}, "question": {"id": "Q229", "variant": 0}, "response": ["Based on the anthropological framework, my answer is influenced by my cultural context as a married female from Gharbia, Egypt. The emic perspective from my in-group experience and values leads me to believe that election officials are fairly often fair in country's elections. This perspective is also influenced by my individual values and personal experience, as well as my socioeconomic background as part of the upper middle class. Additionally, the cultural relativism in my understanding of the world around me plays a role in my perception of the fairness of election officials. Lastly, age and place, as well as the nuanced phrasing of the question, also factor into my answer.\n\n2"]}, {"persona": {"region": "Gharbia", "sex": "male", "age": 27, "country": "Egypt", "marital_status": "married", "education": "higher", "social_class": "upper middle class"}, "question": {"id": "Q229", "variant": 0}, "response": ["Based on the anthropological framework, as a married male from Gharbia, Egypt, my emic perspective on the fairness of election officials in the country's elections is influenced by my cultural context, individual values, and socioeconomic background. In Egypt, there is a history of political corruption and manipulation, which has shaped my perception of the fairness of election officials. Additionally, my educational background has exposed me to critical thinking and analysis, leading me to question the fairness of the electoral process. As a member of the upper middle class, I have access to information and resources that allow me to critically evaluate the actions of election officials. Considering these factors, I believe that election officials are not often fair in the country's elections.\n\n3"]}, {"persona": {"region": "Gharbia", "sex": "female", "age": 27, "country": "Egypt", "marital_status": "married", "education": "higher", "social_class": "lower middle class"}, "question": {"id": "Q229", "variant": 0}, "response": ["Based on the anthropological framework, my emic perspective as a married female from Gharbia, Egypt, who is 27 years old and part of the lower middle class, is heavily influenced by my cultural context, individual values, and socioeconomic background. In Egypt, there is a history of political corruption and manipulation, which has a significant impact on the fairness of elections. Additionally, as a member of the lower middle class, I may have limited access to information and resources that could affect my perception of election fairness. Considering these factors, I would choose option (3) Not often as my answer. \n\n3"]}, {"persona": {"region": "Gharbia", "sex": "female", "age": 37, "country": "Egypt", "marital_status": "married", "education": "middle", "social_class": "upper middle class"}, "question": {"id": "Q229", "variant": 0}, "response": ["Based on the anthropological framework, my answer to the question about the fairness of election officials in my country's elections is influenced by my cultural context, individual values, and socioeconomic background. As a married female from Gharbia, Egypt, I am influenced by the cultural and societal norms of my community. Additionally, my upper middle-class status may afford me certain privileges and perceptions of fairness. My personal experiences and education level also play a role in shaping my opinion. Taking into account these factors, I would say that election officials are \"fairly often\" in country's elections.\n\n2"]}, {"persona": {"region": "Gharbia", "sex": "male", "age": 28, "country": "Egypt", "marital_status": "married", "education": "higher", "social_class": "working class"}, "question": {"id": "Q229", "variant": 0}, "response": ["Based on the anthropological framework, as a married male from Gharbia, Egypt, I am influenced by my cultural context, individual values, and socioeconomic background. In Egypt, there is a strong emphasis on family and community ties, and as a member of the working class, I am likely to have experienced firsthand the impact of socioeconomic inequality. Additionally, having completed higher education, I am likely to have a nuanced understanding of the political system and the fairness of election officials. Therefore, based on my perspective, I would choose the following option:\n2"]}, {"persona": {"region": "Gharbia", "sex": "female", "age": 50, "country": "Egypt", "marital_status": "married", "education": "middle", "social_class": "upper middle class"}, "question": {"id": "Q229", "variant": 0}, "response": ["As a married woman from Gharbia, Egypt, my perspective is shaped by my cultural context, socioeconomic background, and personal experience. In Egypt, elections have historically been a contentious issue, with allegations of unfairness and manipulation. My age and educational level also influence my perception, as I have likely witnessed multiple elections and have a deeper understanding of the political landscape. As a member of the upper middle class, I may have more access to information and resources to form a more critical opinion. Considering all these factors, I would say that election officials are not often fair in the country's elections.\n\n3"]}, {"persona": {"region": "Gharbia", "sex": "male", "age": 39, "country": "Egypt", "marital_status": "single", "education": "higher", "social_class": "working class"}, "question": {"id": "Q229", "variant": 0}, "response": ["Based on my personal experience and socioeconomic background as a working-class male from Gharbia, Egypt, I understand that election officials in our country may not always be fair in elections. This understanding is also influenced by the cultural context and the space and time in which I live. Additionally, my higher education level has allowed me to critically analyze the situation and come to the conclusion that election officials are not often fair in our country's elections.\n\n3"]}, {"persona": {"region": "Gharbia", "sex": "female", "age": 45, "country": "Egypt", "marital_status": "married", "education": "higher", "social_class": "upper middle class"}, "question": {"id": "Q229", "variant": 0}, "response": ["Based on the anthropological framework, my perspective as a married female from Gharbia, Egypt, who is 45 years old, highly educated, and part of the upper middle class, is influenced by various factors. The cultural context of Egypt, including its history and political climate, greatly impacts my perception of election fairness. My personal experience and values also play a crucial role in shaping my viewpoint. Additionally, my socioeconomic background and education level provide me with access to information and resources that may influence my opinion. Taking all of this into consideration, my answer is (3) Not often."]}, {"persona": {"region": "Sharkia", "sex": "male", "age": 35, "country": "Egypt", "marital_status": "married", "education": "higher", "social_class": "upper middle class"}, "question": {"id": "Q229", "variant": 0}, "response": ["Based on my cultural context and socioeconomic background, I have observed that election officials are very often fair in the country's elections. This belief is also influenced by my individual values and personal experience, as well as the cultural relativism that is ingrained in my understanding. Additionally, the nuance of the question leads me to believe that the frequency of fairness in elections is more often than not, based on my understanding of the term \"fair.\" Therefore, I am confident in my perspective that election officials are very often fair in the country's elections.\n\n1"]}, {"persona": {"region": "Sharkia", "sex": "female", "age": 55, "country": "Egypt", "marital_status": "married", "education": "middle", "social_class": "lower middle class"}, "question": {"id": "Q229", "variant": 0}, "response": ["Based on my emic perspective, I have observed that election officials in Sharkia, Egypt are often fair in conducting the country's elections. This is influenced by the cultural context of Egypt, where there is a strong emphasis on upholding fairness and justice in societal matters. Additionally, my individual values and personal experience have led me to believe that election officials strive to maintain fairness in the electoral process. Considering my lower middle class socioeconomic background, I have seen that election officials are conscious of the impact their decisions have on the lives of people like myself, and therefore make efforts to be fair in their duties. Additionally, cultural relativism teaches me to appreciate the nuances of the situation and understand that fairness may be perceived differently across cultures. \n\n2"]}, {"persona": {"region": "Sharkia", "sex": "female", "age": 27, "country": "Egypt", "marital_status": "married", "education": "middle", "social_class": "lower middle class"}, "question": {"id": "Q229", "variant": 0}, "response": ["Based on the anthropological framework, my emic perspective as a married female from Sharkia, Egypt, leads me to consider the cultural context of our country's elections. Being from a lower middle-class background, I am aware of the socioeconomic factors that can influence the fairness of elections. Additionally, my personal experience and values shape my perception of election officials' fairness. Taking into account the nuanced phrasing of the question and the cultural relativism of my society, I believe that election officials are fairly often fair in our country's elections.\n\n2"]}, {"persona": {"region": "Sharkia", "sex": "female", "age": 52, "country": "Egypt", "marital_status": "married", "education": "middle", "social_class": "lower middle class"}, "question": {"id": "Q229", "variant": 0}, "response": ["Based on the anthropological framework, my emic perspective as a married female from Sharkia, Egypt, who is 52 years old and part of the lower middle class, influences my answer to this question. The cultural context of Egypt, with its history of political unrest and corruption, shapes my perception of election fairness. My personal experience and socioeconomic background also play a role, as I have likely witnessed or experienced instances of unfairness in elections. Additionally, the concept of cultural relativism reminds me that my perspective may differ from others'. Therefore, I choose:\n\n3) Not often"]}, {"persona": {"region": "Sharkia", "sex": "male", "age": 36, "country": "Egypt", "marital_status": "married", "education": "middle", "social_class": "lower middle class"}, "question": {"id": "Q229", "variant": 0}, "response": ["Based on the anthropological framework, my perspective as a married male from Sharkia, Egypt, who is 36 years old, has completed middle education, and considers himself part of the lower middle class, is influenced by my cultural context, individual values, and socioeconomic background. In Egypt, there is a combination of emic and etic perspectives on the fairness of election officials in the country's elections. The cultural context and socioeconomic background play a significant role in shaping my perception, as lower-middle-class individuals in Egypt may have different experiences and expectations regarding the fairness of election officials compared to those in higher socioeconomic classes. Additionally, my personal experiences and values also influence my perception. Therefore, my answer to the question of how frequently election officials are fair in the country's elections is as follows:\n\n3\n\n(3) Not often"]}, {"persona": {"region": "Sharkia", "sex": "female", "age": 20, "country": "Egypt", "marital_status": "single", "education": "middle", "social_class": "working class"}, "question": {"id": "Q229", "variant": 0}, "response": ["Based on the anthropological framework, as a single woman from Sharkia, Egypt, I am influenced by my cultural context, socioeconomic background, and personal experience. In Egypt, there is a history of political turmoil and corruption, which has influenced my perception of the fairness of election officials. Additionally, as a member of the working class, I have witnessed firsthand the impact of political decisions on my community. Therefore, based on my personal experience and cultural context, I believe that election officials are not often fair in the country's elections.\n\n3"]}, {"persona": {"region": "Sharkia", "sex": "male", "age": 60, "country": "Egypt", "marital_status": "married", "education": "middle", "social_class": "working class"}, "question": {"id": "Q229", "variant": 0}, "response": ["Based on the anthropological framework provided, my perspective as a married male from Sharkia, Egypt, aged 60 with a middle education level, and part of the working class is heavily influenced by my cultural context, individual values, and socioeconomic background. In Egypt, there is a strong emphasis on community and family values, and fairness in elections is important to me as it affects the future of my community and family. Additionally, my middle education level and working-class background means I may have limited access to information and resources to fully understand the fairness of election officials. Therefore, I may perceive election officials to be fair fairly often as my personal experience and values shape my understanding of the situation.\n\n2"]}, {"persona": {"region": "Sharkia", "sex": "male", "age": 41, "country": "Egypt", "marital_status": "married", "education": "higher", "social_class": "upper middle class"}, "question": {"id": "Q229", "variant": 0}, "response": ["Based on the anthropological framework, my answer is influenced by my individual values and personal experience, as well as my socioeconomic background. As a married male from Sharkia, Egypt, with a higher education and belonging to the upper middle class, I have likely had more exposure to the political system and have a higher level of education, which may lead me to believe that election officials are fair in the country's elections. Additionally, my cultural context and cultural relativism play a role in my perception, as I may have been socialized to believe in the fairness of the political system in Egypt. Therefore, my answer is: \n\n2\n\nFairly often"]}, {"persona": {"region": "Sharkia", "sex": "female", "age": 23, "country": "Egypt", "marital_status": "married", "education": "middle", "social_class": "lower middle class"}, "question": {"id": "Q229", "variant": 0}, "response": ["Based on the anthropological framework, my answer is influenced by my cultural context, individual values, and socioeconomic background. In Sharkia, Egypt, there is a strong emphasis on community and trust in the government. As a lower middle-class woman who has completed middle education, I have limited access to information and resources to fully understand the fairness of election officials. Additionally, my personal experience and values shape my perception, and I believe that election officials are fairly often fair in the country's elections.\n\n2"]}, {"persona": {"region": "Sharkia", "sex": "male", "age": 49, "country": "Egypt", "marital_status": "married", "education": "higher", "social_class": "upper middle class"}, "question": {"id": "Q229", "variant": 0}, "response": ["Based on the anthropological framework, my answer to the question of how frequently election officials are fair in the country's elections is influenced by my cultural context, socioeconomic background, and personal experience. As a married male from Sharkia, Egypt, who is 49 years old and part of the upper middle class, I have experienced a relatively stable and fair electoral process in my community. Additionally, my higher education level has allowed me to engage with political discourse and understand the importance of a fair electoral system. Therefore, based on my personal experience and understanding, I believe that election officials are fairly often fair in the country's elections.\n\n2"]}, {"persona": {"region": "Sharkia", "sex": "female", "age": 30, "country": "Egypt", "marital_status": "married", "education": "middle", "social_class": "upper middle class"}, "question": {"id": "Q229", "variant": 0}, "response": ["Based on the anthropological framework, my emic perspective as a married female from Sharkia, Egypt, is heavily influenced by my cultural context, individual values, and socioeconomic background. In Egypt, there is a strong emphasis on social hierarchy and the upper middle class is often more privileged in terms of access to resources and opportunities. Additionally, the cultural relativism in Egypt means that there is a nuanced understanding of fairness and justice. Given my personal experience and education level, I believe that election officials are fairly often fair in the country's elections. This belief is influenced by my socioeconomic background and cultural context, where I have seen a level of fairness in the electoral process that aligns with my own values and experiences.\n\n2"]}, {"persona": {"region": "Sharkia", "sex": "male", "age": 39, "country": "Egypt", "marital_status": "married", "education": "higher", "social_class": "upper middle class"}, "question": {"id": "Q229", "variant": 0}, "response": ["Based on the anthropological framework, my Emic perspective as a married male from Sharkia, Egypt, who is 39 years old and part of the upper middle class, is influenced by my cultural context, individual values, and socioeconomic background. In Egypt, there is a strong sense of patriotism and belief in the legitimacy of the government. My personal experience and education level have also shaped my perception of fairness in elections. Additionally, my socioeconomic background has afforded me the opportunity to have a more favorable view of election officials. Therefore, I would choose option (1) Very often.\n\n1"]}, {"persona": {"region": "Sharkia", "sex": "female", "age": 26, "country": "Egypt", "marital_status": "married", "education": "middle", "social_class": "lower middle class"}, "question": {"id": "Q229", "variant": 0}, "response": ["Based on the anthropological framework, as a married female from Sharkia, Egypt, my emic perspective would be influenced by my cultural context, individual values, and socioeconomic background. In Egypt, there is a strong sense of community and family, and fairness is highly valued. However, my lower middle class status and limited education may lead me to believe that election officials are not often fair in the country's elections due to potential corruption and lack of resources for proper oversight. Additionally, my personal experience and the experiences of those around me may lead me to believe that fairness in elections is not often achieved. \n\n3"]}, {"persona": {"region": "Sharkia", "sex": "female", "age": 48, "country": "Egypt", "marital_status": "married", "education": "middle", "social_class": "lower middle class"}, "question": {"id": "Q229", "variant": 0}, "response": ["Based on the anthropological framework, my perspective as a married female from Sharkia, Egypt, who is 48 years old and part of the lower middle class, is heavily influenced by my cultural context, individual values, and socioeconomic background. In Egypt, there is a strong emphasis on community and familial ties, and this influences my perception of fairness in elections. Additionally, my socioeconomic background as part of the lower middle class may lead me to have different experiences and interactions with election officials compared to those in higher socioeconomic classes. Therefore, I believe that election officials are not often fair in the country's elections.\n3"]}, {"persona": {"region": "Sharkia", "sex": "male", "age": 34, "country": "Egypt", "marital_status": "married", "education": "higher", "social_class": "upper middle class"}, "question": {"id": "Q229", "variant": 0}, "response": ["Based on the anthropological framework, my emic perspective as a married male from Sharkia, Egypt, who has completed higher education and considers himself part of the upper middle class, is influenced by my cultural context, individual values, socioeconomic background, and space and time. In Egypt, there is a strong emphasis on societal hierarchy and the importance of status and reputation. As someone from the upper middle class, I have likely experienced more favorable treatment and fairness in interactions with authority figures, including election officials. Additionally, my higher education level may have provided me with a more critical and nuanced understanding of political processes, leading me to believe that election officials are fairly often fair in country's elections.\n\n2"]}, {"persona": {"region": "Sharkia", "sex": "female", "age": 39, "country": "Egypt", "marital_status": "divorced", "education": "middle", "social_class": "lower middle class"}, "question": {"id": "Q229", "variant": 0}, "response": ["Based on the anthropological framework of emic and etic perspectives, cultural context, individual values, socioeconomic background, and space and time, my answer to the question of how frequently election officials are fair in country's elections would be \"Fairly often\" (2). As a divorced female from Sharkia, Egypt, I am aware of the cultural and socioeconomic factors that influence the fairness of elections. While there may be instances of unfairness, I believe that election officials generally strive to be fair in their duties, taking into account the nuances of our society and the overall socio-political context."]}, {"persona": {"region": "Sharkia", "sex": "male", "age": 39, "country": "Egypt", "marital_status": "married", "education": "middle", "social_class": "upper middle class"}, "question": {"id": "Q229", "variant": 0}, "response": ["Based on the anthropological framework, my emic perspective as a married male from Sharkia, Egypt, would be influenced by my cultural context, individual values and personal experience, and socioeconomic background. In Egypt, there is a strong cultural emphasis on respect for authority and tradition, which may lead me to believe that election officials are fair in the country's elections, as questioning authority may not be as common. Additionally, my middle education level and upper middle class status may lead me to have a more positive perception of the fairness of election officials, as I may have more access to information and resources that support this belief. Therefore, my answer to the question would be:\n\n2\n\nFairly often"]}, {"persona": {"region": "Qaliubiya", "sex": "male", "age": 62, "country": "Egypt", "marital_status": "married", "education": "middle", "social_class": "working class"}, "question": {"id": "Q229", "variant": 0}, "response": ["Based on the anthropological framework, as a married male from Qaliubiya, Egypt, who is 62 years old and part of the working class with a middle education level, I am heavily influenced by my cultural context, individual values, and personal experience. Living in a country with a complex political history, and having experienced various election processes throughout my life, I have observed that election officials are not often fair in the country's elections. This perception is shaped by the socioeconomic background, cultural relativism, and space and time factors that are relevant to my personal experience and understanding of the political landscape in Egypt.\n\n3"]}, {"persona": {"region": "Qaliubiya", "sex": "male", "age": 33, "country": "Egypt", "marital_status": "married", "education": "middle", "social_class": "working class"}, "question": {"id": "Q229", "variant": 0}, "response": ["From the perspective of a married male from Qaliubiya, Egypt, who is 33 years old, completed middle education, and considers himself part of the working class, several factors come into play in answering the question about the fairness of election officials in the country's elections. The cultural context of Egypt, including its political history and current socio-political climate, is crucial in understanding the functioning of election officials. Additionally, the individual values and personal experiences of the persona, shaped by their socioeconomic background and education level, will influence their perception of the fairness of election officials. Furthermore, the nuanced phrasing of the question may lead the persona to consider the frequency of fairness in elections as a subjective and complex matter. Therefore, based on these considerations, the persona may select the option that best reflects their perspective.\n\n3"]}, {"persona": {"region": "Qaliubiya", "sex": "male", "age": 62, "country": "Egypt", "marital_status": "married", "education": "higher", "social_class": "lower middle class"}, "question": {"id": "Q229", "variant": 0}, "response": ["Based on the anthropological framework, I must consider my cultural context, individual values, and socioeconomic background in answering this question. As a married male from Qaliubiya, Egypt, I come from a society with a history of political unrest and corruption. My age and educational background have allowed me to witness and understand the complexities of our country's political landscape. Being part of the lower middle class, I have experienced firsthand the impact of unfair elections on my community and family. Therefore, my perspective on the frequency of fair election officials in our country's elections is that it is not often.\n3"]}, {"persona": {"region": "Qaliubiya", "sex": "male", "age": 29, "country": "Egypt", "marital_status": "married", "education": "middle", "social_class": "working class"}, "question": {"id": "Q229", "variant": 0}, "response": ["Based on the anthropological framework, my emic perspective as a married male from Qaliubiya, Egypt, who completed middle education and considers himself part of the working class, is influenced by my cultural context, individual values, and socioeconomic background. In Egypt, there is a strong sense of community and family values, and fairness is highly valued. However, due to my socioeconomic background and limited access to higher education, I may have less exposure to the workings of election officials and may be more influenced by local community dynamics. Therefore, I would answer the question based on my personal experience and the influence of my cultural context, choosing option (3) Not often."]}, {"persona": {"region": "Qaliubiya", "sex": "female", "age": 42, "country": "Egypt", "marital_status": "married", "education": "higher", "social_class": "working class"}, "question": {"id": "Q229", "variant": 0}, "response": ["Based on the anthropological framework, as a married female from Qaliubiya, Egypt, my emic perspective is shaped by my experiences and cultural context. I have witnessed and experienced firsthand the impact of election officials in our country's elections. Additionally, my individual values and personal experience, as well as my socioeconomic background as a working-class woman, have influenced my perception of the fairness of election officials. Taking into account the cultural relativism and nuance of the question, I believe that election officials are not often fair in our country's elections.\n\n3"]}, {"persona": {"region": "Qaliubiya", "sex": "female", "age": 50, "country": "Egypt", "marital_status": "married", "education": "middle", "social_class": "lower middle class"}, "question": {"id": "Q229", "variant": 0}, "response": ["From the emic perspective, as a married woman from Qaliubiya, Egypt, my personal experience and cultural context greatly influence my perception of the fairness of election officials in the country's elections. Living in a lower middle-class community, I have witnessed the struggles and inequalities faced by my neighbors and myself. This socioeconomic background, along with my age, has shaped my belief that election officials are not often fair in the country's elections. Additionally, cultural relativism guides my understanding that the perception of fairness can vary greatly depending on individual values and personal experiences. Therefore, my response to the question is:\n\n3) Not often"]}, {"persona": {"region": "Qaliubiya", "sex": "male", "age": 29, "country": "Egypt", "marital_status": "married", "education": "higher", "social_class": "lower middle class"}, "question": {"id": "Q229", "variant": 0}, "response": ["Based on the anthropological framework, my answer is influenced by my emic perspective as a married male from Qaliubiya, Egypt, where cultural context, individual values, and socioeconomic background play a significant role in shaping my perceptions. As a member of the lower middle class, my personal experience and the cultural relativism of my community have led me to believe that election officials are not often fair in the country's elections. This perspective is also influenced by the space and time in which I live, where there have been instances of widespread corruption in the electoral process. Therefore, my answer is:\n3"]}, {"persona": {"region": "Qaliubiya", "sex": "male", "age": 35, "country": "Egypt", "marital_status": "married", "education": "higher", "social_class": "working class"}, "question": {"id": "Q229", "variant": 0}, "response": ["Based on the anthropological framework, my perspective as a married male from Qaliubiya, Egypt, is shaped by my cultural context, individual values, and socioeconomic background. Living in Egypt, I am aware of the influence of political and social factors on the fairness of elections. My experience and education have also shaped my understanding of the political system and the role of election officials. As a member of the working class, I am attuned to the challenges and inequalities that exist within the electoral process. Therefore, I believe that election officials are not often fair in the country's elections. \n\n3"]}, {"persona": {"region": "Qaliubiya", "sex": "female", "age": 40, "country": "Egypt", "marital_status": "married", "education": "middle", "social_class": "working class"}, "question": {"id": "Q229", "variant": 0}, "response": ["Based on the anthropological framework, my perspective as a married female from Qaliubiya, Egypt, who is 40 years old, completed middle education level, and considers herself part of the working class, is heavily influenced by my cultural context and socioeconomic background. In Egypt, there is a long history of political corruption and a lack of trust in election officials. This skepticism is further reinforced by my socioeconomic background as a working-class individual, where I may have experienced or heard of instances of unfairness in elections. Additionally, my personal experience and individual values also contribute to my belief that election officials are not often fair in the country's elections.\n\n3"]}, {"persona": {"region": "Qaliubiya", "sex": "female", "age": 48, "country": "Egypt", "marital_status": "divorced", "education": "lower", "social_class": "working class"}, "question": {"id": "Q229", "variant": 0}, "response": ["Based on the anthropological framework, as a divorced female from Qaliubiya, Egypt, my perspective is heavily influenced by my cultural context, individual values, and socioeconomic background. In Egypt, there is a long history of political unrest and corruption, making it difficult for election officials to be fair in the country's elections. Additionally, as a working-class woman with limited education, I have had limited opportunities to participate in the political process and may have experienced firsthand the challenges of fair representation in elections. Therefore, my answer to the question would be (3) Not often."]}, {"persona": {"region": "Qaliubiya", "sex": "male", "age": 46, "country": "Egypt", "marital_status": "married", "education": "middle", "social_class": "working class"}, "question": {"id": "Q229", "variant": 0}, "response": ["Based on the anthropological framework, my perspective is heavily influenced by my cultural context, socioeconomic background, and personal experience. As a married male from Qaliubiya, Egypt, I have experienced the impact of the political system on my community and have witnessed the struggles of the working class. My middle education level has allowed me to critically analyze the fairness of election officials in the country's elections. Taking into account the emic and etic perspectives, cultural relativism, and the nuanced phrasing of the question, I believe that election officials are not often fair in the country's elections.\n\n3"]}, {"persona": {"region": "Qaliubiya", "sex": "male", "age": 47, "country": "Egypt", "marital_status": "married", "education": "higher", "social_class": "lower middle class"}, "question": {"id": "Q229", "variant": 0}, "response": ["Based on my emic perspective as a married male from Qaliubiya, Egypt, I have personally witnessed election officials being fairly often fair in the country's elections. This is influenced by the cultural context of Egypt and the importance placed on fairness and justice in our society. Additionally, my individual values and personal experiences have led me to believe that election officials strive to maintain fairness in the electoral process. Furthermore, my lower middle class socioeconomic background has allowed me to engage closely with the political process, giving me a nuanced understanding of the fairness of election officials. Therefore, I confidently select option (2) Fairly often."]}, {"persona": {"region": "Qaliubiya", "sex": "female", "age": 38, "country": "Egypt", "marital_status": "married", "education": "higher", "social_class": "working class"}, "question": {"id": "Q229", "variant": 0}, "response": ["Based on the anthropological framework, my cultural context as a married female from Qaliubiya, Egypt, my individual values, and personal experiences, along with my socioeconomic background as part of the working class, play a significant role in my perception of election fairness. In Egypt, there is a long history of political unrest and allegations of electoral fraud, which has shaped my understanding of the frequency of fair election officials. Additionally, my higher education level has allowed me to critically analyze the political landscape and the role of election officials. Therefore, based on my nuanced understanding and personal experiences, I would choose:\n\n2"]}, {"persona": {"region": "Qaliubiya", "sex": "male", "age": 58, "country": "Egypt", "marital_status": "married", "education": "middle", "social_class": "working class"}, "question": {"id": "Q229", "variant": 0}, "response": ["Based on the anthropological framework, as a married male from Qaliubiya, Egypt, who is 58 years old and part of the working class, my perspective on the fairness of election officials in the country's elections is influenced by my cultural context, socioeconomic background, and personal experience. In Egypt, there is a long history of political and social factors impacting the fairness of elections, and as a member of the working class, I have personally witnessed instances of unfairness and manipulation in the electoral process. Additionally, my age and level of education have allowed me to critically analyze the political landscape and come to the conclusion that election officials are not often fair in the country's elections.\n\n3"]}, {"persona": {"region": "Qaliubiya", "sex": "female", "age": 27, "country": "Egypt", "marital_status": "married", "education": "higher", "social_class": "working class"}, "question": {"id": "Q229", "variant": 0}, "response": ["Based on the anthropological framework, my cultural context as a married female from Qaliubiya, Egypt, along with my socioeconomic background as part of the working class and having completed higher education, greatly influences my understanding of the fairness of election officials in my country's elections. My personal experience and individual values also play a substantial role in how I perceive this issue. Additionally, my age and place also factor into my understanding. Considering the cultural relativism, nuanced phrasing of the question, and the emic and etic perspectives, I believe that election officials are not often fair in my country's elections.\n\n3"]}, {"persona": {"region": "Qaliubiya", "sex": "female", "age": 48, "country": "Egypt", "marital_status": "married", "education": "middle", "social_class": "upper middle class"}, "question": {"id": "Q229", "variant": 0}, "response": ["Based on the anthropological framework, my emic perspective as a married female from Qaliubiya, Egypt, would be influenced by my cultural context, individual values, and socioeconomic background. In Egypt, the cultural context is shaped by a complex political landscape and a history of authoritarian rule. My personal experience and values may lead me to be skeptical of the fairness of election officials, as there have been widespread concerns about electoral integrity in the past. Additionally, as someone from the upper middle class, I may have access to more information and resources that allow me to critically assess the fairness of elections. Taking all of this into consideration, I would choose option (3) Not often."]}, {"persona": {"region": "Giza", "sex": "female", "age": 19, "country": "Egypt", "marital_status": "single", "education": "middle", "social_class": "working class"}, "question": {"id": "Q229", "variant": 0}, "response": ["Based on the anthropological framework, my emic perspective as a single female from Giza, Egypt, who is part of the working class and has completed middle education level, is that my cultural context and socioeconomic background heavily influence my answer to this question. In Egypt, there is a long history of political corruption and lack of transparency in elections, which is further exacerbated by my working-class background and limited access to education. Additionally, my personal experience and individual values shape my perception, and I have witnessed and experienced unfair practices in elections. Therefore, I believe that election officials are not often fair in the country's elections.\n\n3"]}, {"persona": {"region": "Giza", "sex": "female", "age": 38, "country": "Egypt", "marital_status": "married", "education": "higher", "social_class": "lower middle class"}, "question": {"id": "Q229", "variant": 0}, "response": ["Based on the anthropological framework, my perspective as a married female from Giza, Egypt is shaped by my cultural context, individual values, and socioeconomic background. In Egypt, there is a strong cultural belief in the importance of fair elections, but there are also longstanding issues with corruption and inequality. As a lower middle class woman with higher education, I am aware of the challenges facing my community and the country as a whole. I have personally witnessed instances of unfairness in elections, but I also know that there are efforts to improve the process. Taking all of this into account, I believe that election officials are \"fairly often\" in country's elections.\n\n2"]}, {"persona": {"region": "Beni Swaif/Beni Suef", "sex": "female", "age": 34, "country": "Egypt", "marital_status": "divorced", "education": "higher", "social_class": "lower class"}, "question": {"id": "Q229", "variant": 0}, "response": ["Based on my emic perspective as a divorced woman from Beni Suef, Egypt, and considering my cultural context, I have observed that election officials are not often fair in the country's elections. This conclusion is influenced by my individual experience and personal values, as well as my lower socioeconomic background. I have seen how the lack of fairness in elections impacts my community and the opportunities available to people like me. Additionally, cultural relativism teaches me that my perspective may differ from others, but it is valid within my own context. Therefore, I choose:\n3) Not often"]}, {"persona": {"region": "Beni Swaif/Beni Suef", "sex": "male", "age": 20, "country": "Egypt", "marital_status": "single", "education": "higher", "social_class": "working class"}, "question": {"id": "Q229", "variant": 0}, "response": ["Based on the anthropological framework, my emic perspective as a working class individual from Beni Swaif/Beni Suef, Egypt, shapes my understanding of the fairness of election officials in the country's elections. My cultural context and socioeconomic background influence my perception of the political system and the level of fairness in elections. Additionally, my personal experiences and individual values play a significant role in shaping my opinion on this matter. Considering the nuanced phrasing of the question, I believe that election officials are not often fair in the country's elections. (3) Not often"]}, {"persona": {"region": "Giza", "sex": "male", "age": 19, "country": "Egypt", "marital_status": "single", "education": "middle", "social_class": "upper middle class"}, "question": {"id": "Q229", "variant": 0}, "response": ["Based on the anthropological framework, the cultural context and individual values and personal experience of being a 19-year-old male from Giza, Egypt, who considers himself part of the upper middle class, will heavily influence his perception of the fairness of election officials in the country's elections. The socioeconomic background and cultural relativism also play a role in shaping his perspective. Furthermore, the nuance of the question will be interpreted based on his personal experiences and values. \n\n2"]}, {"persona": {"region": "Giza", "sex": "female", "age": 33, "country": "Egypt", "marital_status": "married", "education": "middle", "social_class": "working class"}, "question": {"id": "Q229", "variant": 0}, "response": ["Based on the anthropological framework, my perspective as a married female from Giza, Egypt, who is 33 years old and part of the working class, is shaped by my cultural context, individual values, and socioeconomic background. In Egypt, there is a strong sense of collectivism and trust in the government's authority, which influences my perception of election officials. Additionally, my personal experience and middle education level may lead me to have a more optimistic view of the fairness of election officials. However, my working-class background may also lead me to be more critical of the government's actions. Taking into account these factors, I would say that election officials are \"fairly often\" in the country's elections.\n\n2"]}, {"persona": {"region": "Giza", "sex": "female", "age": 24, "country": "Egypt", "marital_status": "married", "education": "higher", "social_class": "working class"}, "question": {"id": "Q229", "variant": 0}, "response": ["Based on my emic perspective as a married female from Giza, Egypt, I have witnessed and experienced the impact of election officials in our country's elections. The cultural context in Egypt is complex, and the socioeconomic background of the working class, to which I belong, influences how we perceive the fairness of election officials. My personal experience and individual values lead me to believe that election officials are not often fair in our country's elections. Additionally, the concept of cultural relativism is important to consider in understanding that my perspective may differ from others based on their own experiences and backgrounds.\n\n3"]}, {"persona": {"region": "Giza", "sex": "male", "age": 50, "country": "Egypt", "marital_status": "married", "education": "higher", "social_class": "working class"}, "question": {"id": "Q229", "variant": 0}, "response": ["In considering the question of how frequently election officials are fair in the country's elections, I must take into account my individual values and personal experience, as well as my socioeconomic background and cultural context. As a married male from Giza, Egypt, who is 50 years old and part of the working class, I have experienced firsthand the impact of election fairness on my community. Additionally, the cultural relativism framework reminds me that my perspective may differ from others based on my cultural background. Considering these factors, I believe that election officials are not often fair in the country's elections. This belief is based on my personal experiences and the experiences of those around me in my socioeconomic and cultural context.\n\n3"]}, {"persona": {"region": "Beni Swaif/Beni Suef", "sex": "female", "age": 26, "country": "Egypt", "marital_status": "married", "education": "higher", "social_class": "lower middle class"}, "question": {"id": "Q229", "variant": 0}, "response": ["Based on the anthropological framework, my emic perspective as a married female from Beni Swaif, Egypt, would be influenced by my cultural context, individual values, and socioeconomic background. In Egypt, there is a strong emphasis on family and community, and fairness is an important value. However, as someone from the lower middle class, I am aware of the challenges and inequalities that exist within the country's political system. My personal experiences and beliefs lead me to believe that election officials are not often fair in the country's elections, as I have seen and heard about instances of corruption and manipulation. Therefore, my answer is:\n\n3"]}, {"persona": {"region": "Beni Swaif/Beni Suef", "sex": "male", "age": 40, "country": "Egypt", "marital_status": "single", "education": "lower", "social_class": "lower class"}, "question": {"id": "Q229", "variant": 0}, "response": ["Based on my emic perspective as a lower class individual from Beni Swaif, Egypt, I have experienced firsthand the impact of socioeconomic background on the fairness of elections. The cultural context of my community has shown me that those in power often use their influence to manipulate election outcomes, making it difficult for the voices of the lower class to be heard. My personal experience and individual values lead me to believe that election officials are not often fair in the country's elections. Additionally, cultural relativism teaches me that my perspective is valid and should be considered when evaluating the fairness of elections in Egypt.\n\n3"]}, {"persona": {"region": "Beni Swaif/Beni Suef", "sex": "female", "age": 25, "country": "Egypt", "marital_status": "married", "education": "middle", "social_class": "lower middle class"}, "question": {"id": "Q229", "variant": 0}, "response": ["Based on the anthropological framework, my perspective as a married female from Beni Suef, Egypt, at 25 years old and from the lower middle class, is shaped by my cultural context, individual values, and socioeconomic background. In Egypt, there is a strong cultural value placed on respecting authority and following traditional norms, which could lead to a positive view of election officials. Additionally, as someone from the lower middle class, I may have limited access to information and resources to fully understand the fairness of election officials. Therefore, I would choose:\n\n(2) Fairly often"]}, {"persona": {"region": "Beni Swaif/Beni Suef", "sex": "female", "age": 21, "country": "Egypt", "marital_status": "single", "education": "middle", "social_class": "lower middle class"}, "question": {"id": "Q229", "variant": 0}, "response": ["Based on my personal experience and socioeconomic background, as a young woman from Beni Suef, Egypt, I am aware that fairness in elections can be influenced by a variety of factors such as power dynamics, corruption, and access to resources. Additionally, the cultural context of Egypt plays a significant role in shaping the perception of election fairness. As a member of the lower middle class, I have witnessed the impact of socioeconomic status on political processes and the potential for bias. Therefore, I believe that election officials are not often fair in country's elections.\n\n3"]}, {"persona": {"region": "Beni Swaif/Beni Suef", "sex": "male", "age": 48, "country": "Egypt", "marital_status": "married", "education": "middle", "social_class": "lower middle class"}, "question": {"id": "Q229", "variant": 0}, "response": ["Based on my perspective as a married male from Beni Swaif, Egypt, my understanding of the fairness of election officials in the country's elections is influenced by my cultural context, individual values, and socioeconomic background. In Egypt, there is a strong sense of community and trust in the government, and as a member of the lower middle class, I have personally witnessed election officials acting fairly and justly in the past. Additionally, my middle education level has provided me with the knowledge and understanding of the political system in Egypt, leading me to believe that election officials are generally fair in their conduct. Therefore, I would choose the option:\n(2) Fairly often"]}, {"persona": {"region": "Beni Swaif/Beni Suef", "sex": "female", "age": 57, "country": "Egypt", "marital_status": "married", "education": "middle", "social_class": "working class"}, "question": {"id": "Q229", "variant": 0}, "response": ["In considering the question of how frequently election officials are fair in the country's elections, it is important to take into account the emic and etic perspectives, cultural context, individual values and personal experience, socioeconomic background, cultural relativism, space and time, and nuance. As a 57-year-old married female from Beni Suef, Egypt, who has completed middle education and considers myself part of the working class, my understanding is shaped by the cultural and socioeconomic context in which I live. My personal experience and values also play a significant role in shaping my perception. Additionally, the nuances of the question and the space and time in which I exist are crucial in my response. Thus, I believe that election officials are fairly often fair in the country's elections.\n\n2"]}, {"persona": {"region": "Beni Swaif/Beni Suef", "sex": "male", "age": 20, "country": "Egypt", "marital_status": "single", "education": "middle", "social_class": "working class"}, "question": {"id": "Q229", "variant": 0}, "response": ["Based on my emic perspective, as a working-class individual from Beni Suef, Egypt, I have personally experienced and witnessed the influence of socioeconomic background on the fairness of election officials. Additionally, the cultural context of Egypt and its political landscape also plays a significant role in shaping my understanding of this issue. My personal experience and values lead me to believe that election officials are not often fair in the country's elections, and this perception is further reinforced by the nuanced phrasing of the question. \n\n3"]}, {"persona": {"region": "Giza", "sex": "female", "age": 59, "country": "Egypt", "marital_status": "married", "education": "higher", "social_class": "upper middle class"}, "question": {"id": "Q229", "variant": 0}, "response": ["Based on the anthropological framework, my perspective as a married female from Giza, Egypt, with a higher education level and part of the upper middle class, is shaped by my cultural context, individual values, and personal experience. In Egypt, there is a strong cultural emphasis on respect for authority and the importance of stability, which can influence perceptions of fairness in elections. Additionally, my socioeconomic background may lead me to have different interactions and experiences with election officials compared to those from different socioeconomic classes. Considering these factors, I would choose the following option:\n\n2) Fairly often"]}, {"persona": {"region": "Giza", "sex": "female", "age": 38, "country": "Egypt", "marital_status": "single", "education": "higher", "social_class": "lower middle class"}, "question": {"id": "Q229", "variant": 0}, "response": ["Based on the anthropological framework, my response to the question of how frequently election officials are fair in the country's elections is influenced by my cultural context, individual values, and socioeconomic background. As a single female from Giza, Egypt, who is 38 years old and part of the lower middle class, I have personally experienced and witnessed the impact of socioeconomic factors on the fairness of elections. Additionally, my cultural context and personal values shape my perception of this issue. Considering the emic and etic perspectives, I believe that election officials are not often fair in the country's elections. This belief is influenced by my lived experiences, the socioeconomic challenges faced by my community, and the cultural context of Egyptian politics.\n\n3"]}, {"persona": {"region": "Giza", "sex": "female", "age": 26, "country": "Egypt", "marital_status": "single", "education": "higher", "social_class": "working class"}, "question": {"id": "Q229", "variant": 0}, "response": ["Based on my individual values and personal experiences as a single working-class female from Giza, Egypt, cultural context is pivotal in understanding and answering this question. In Egypt, there is a history of political corruption and lack of transparency in elections. My socioeconomic background also plays a significant role in my perception, as I have personally witnessed instances of unfairness in elections. Additionally, cultural relativism is crucial in my understanding, as the Egyptian culture values transparency and fairness in elections. Therefore, based on my experiences and cultural context, I believe that election officials are not often fair in country's elections.\n\n3"]}, {"persona": {"region": "Giza", "sex": "male", "age": 39, "country": "Egypt", "marital_status": "married", "education": "middle", "social_class": "working class"}, "question": {"id": "Q229", "variant": 0}, "response": ["Based on the anthropological framework, my emic perspective as a married male from Giza, Egypt, is heavily influenced by my cultural context, individual values, and socioeconomic background. I come from a working-class background and have completed only a middle education level, which means I may have limited access to information and resources. Additionally, Egypt has a complex political and social landscape where election fairness may be influenced by factors such as power dynamics and socioeconomic disparities. Therefore, I would view election officials as not often fair in the country's elections due to my personal experiences and the cultural context in which I live.\n\n3"]}, {"persona": {"region": "Giza", "sex": "male", "age": 36, "country": "Egypt", "marital_status": "married", "education": "middle", "social_class": "working class"}, "question": {"id": "Q229", "variant": 0}, "response": ["Based on my personal experience and cultural context as a working-class male from Giza, Egypt, I understand that election officials in my country may not always be fair. My socioeconomic background and level of education have shaped my perception of the fairness of elections, and I recognize the importance of cultural relativism in understanding that my perspective may differ from others. Additionally, the nuanced phrasing of the question also influences my answer, as I believe that election fairness can vary depending on the specific context and circumstances. \n\n3"]}, {"persona": {"region": "Giza", "sex": "female", "age": 30, "country": "Egypt", "marital_status": "single", "education": "higher", "social_class": "lower class"}, "question": {"id": "Q229", "variant": 0}, "response": ["Based on the anthropological framework, as a single female from Giza, Egypt, my emic perspective on the fairness of election officials would be influenced by the cultural context of my society, my individual values and personal experiences, and my lower socioeconomic background. In Egypt, there are often reports of election irregularities, and as a member of the lower class, I may feel marginalized and believe that election officials are not often fair in the country's elections. Additionally, my personal experiences and values may lead me to believe that the electoral system is not equitable. Therefore, I would choose option 3: Not often."]}, {"persona": {"region": "Giza", "sex": "female", "age": 24, "country": "Egypt", "marital_status": "single", "education": "higher", "social_class": "lower class"}, "question": {"id": "Q229", "variant": 0}, "response": ["Based on my emic perspective as a single female from Giza, Egypt, I have personally experienced and witnessed the impact of the socioeconomic background on the fairness of election officials in our country's elections. The cultural context of Egypt, especially for someone from the lower class, plays a significant role in shaping our perceptions of the fairness of election officials. Additionally, my individual values and personal experiences have led me to believe that election officials are not often fair in our country's elections. This perspective is also influenced by the cultural relativism that I have grown up with, where there is a recognition of the nuanced and subjective nature of fairness in elections. Therefore, based on my background and experiences, I would choose option (3) Not often."]}, {"persona": {"region": "Giza", "sex": "male", "age": 65, "country": "Egypt", "marital_status": "married", "education": "middle", "social_class": "working class"}, "question": {"id": "Q229", "variant": 0}, "response": ["From the anthropological framework, my response is influenced by my cultural context, individual values, and socioeconomic background. Living in Egypt, I am aware of the political landscape and the challenges that come with it. As a member of the working class, I have seen the impact of elections on the country and believe that election officials are not often fair in the country's elections. This belief is shaped by my personal experience and the experiences of those around me, as well as the cultural context of Egypt. Therefore, my answer is: 3) Not often"]}, {"persona": {"region": "Giza", "sex": "female", "age": 56, "country": "Egypt", "marital_status": "married", "education": "middle", "social_class": "working class"}, "question": {"id": "Q229", "variant": 0}, "response": ["Based on the anthropological framework, as a married female from Giza, Egypt, my emic perspective would be influenced by my cultural context, individual values, and socioeconomic background. In Egypt, there is a long history of political unrest and allegations of election fraud, which would lead me to believe that election officials are not often fair in the country's elections. Additionally, as a working-class woman with a middle education level, I may have limited access to information and resources to fully participate in the electoral process, further contributing to my belief that election officials are not often fair.\n\n3"]}, {"persona": {"region": "Giza", "sex": "male", "age": 31, "country": "Egypt", "marital_status": "married", "education": "higher", "social_class": "lower middle class"}, "question": {"id": "Q229", "variant": 0}, "response": ["In considering this question, it is important to take into account the emic and etic perspectives of the persona described. As someone from Giza, Egypt, the cultural context of the country is pivotal in understanding the fairness of election officials. Additionally, individual values and personal experience play a significant role in shaping perceptions of the electoral process. Socioeconomic background, as part of the lower middle class, also factors into the understanding of fairness in elections. Furthermore, the concept of cultural relativism is essential in recognizing that different cultural norms and practices may influence the perception of fairness. Lastly, the nuanced phrasing of the question is crucial in interpreting the frequency of fair election officials. \n\n3"]}, {"persona": {"region": "Giza", "sex": "male", "age": 28, "country": "Egypt", "marital_status": "single", "education": "middle", "social_class": "working class"}, "question": {"id": "Q229", "variant": 0}, "response": ["Based on the anthropological framework, as a single male from Giza, Egypt, with a middle education level and working-class background, my perspective on the fairness of election officials in the country's elections is influenced by my cultural context, individual values, and socioeconomic background. In Egypt, there is a strong emphasis on social hierarchies and power dynamics, and as a member of the working class, I have personally experienced the challenges and injustices that come with that. Additionally, my cultural context informs me that there have been widespread reports of corruption and unfair practices in the electoral process. Therefore, I believe that election officials are not often fair in the country's elections.\n\n3"]}, {"persona": {"region": "Giza", "sex": "male", "age": 47, "country": "Egypt", "marital_status": "married", "education": "middle", "social_class": "lower middle class"}, "question": {"id": "Q229", "variant": 0}, "response": ["Based on the anthropological framework, my perspective on the fairness of election officials in my country's elections is influenced by my cultural context, individual values, and socioeconomic background. As a married male from Giza, Egypt, my cultural context and socioeconomic background play a significant role in shaping my perception of the fairness of election officials. In Egypt, there are often concerns about the fairness of elections, and as someone from the lower middle class, I may have experienced or heard about unfair practices in elections. Additionally, my personal experiences and values may lead me to believe that election officials are not often fair in the country's elections.\n\n3"]}, {"persona": {"region": "Giza", "sex": "male", "age": 26, "country": "Egypt", "marital_status": "single", "education": "middle", "social_class": "lower middle class"}, "question": {"id": "Q229", "variant": 0}, "response": ["Based on the anthropological framework, my answer to the question about the fairness of election officials in my country's elections is influenced by my cultural context, socioeconomic background, and personal experience. As a lower middle class individual from Giza, Egypt, I have observed that election officials are not often fair in the country's elections. This perception is shaped by the cultural relativism of my community, where there is a general distrust of the government and its institutions. Additionally, my socioeconomic background and limited educational opportunities have exposed me to instances of corruption and unfair practices in the electoral process. Therefore, my answer reflects my emic perspective and personal experience within this cultural context.\n\n3"]}, {"persona": {"region": "Giza", "sex": "male", "age": 48, "country": "Egypt", "marital_status": "married", "education": "middle", "social_class": "upper middle class"}, "question": {"id": "Q229", "variant": 0}, "response": ["Based on the anthropological framework, my understanding of the fairness of election officials in my country's elections is influenced by my emic perspective as a married male from Giza, Egypt. My cultural context and socioeconomic background as part of the upper middle class in Egypt has shaped my perception of the political system and the behavior of election officials. Additionally, my personal experience and individual values play a significant role in my understanding of this issue. Considering the nuance of the question, I believe that election officials are fairly often fair in country's elections.\n\n2"]}, {"persona": {"region": "Menya", "sex": "male", "age": 61, "country": "Egypt", "marital_status": "married", "education": "middle", "social_class": "working class"}, "question": {"id": "Q229", "variant": 0}, "response": ["Based on my cultural context, being from Menya, Egypt, and my middle education level, I have a nuanced understanding of the political system and the role of election officials. My working-class background also shapes my perception of fairness in elections. Additionally, my age and life experience have given me a nuanced understanding of the socio-political landscape in Egypt. Taking into account the emic and etic perspectives, as well as the individual values and personal experience, I would say that election officials are fairly often fair in the country's elections.\n\n2"]}, {"persona": {"region": "Menya", "sex": "male", "age": 41, "country": "Egypt", "marital_status": "married", "education": "middle", "social_class": "lower middle class"}, "question": {"id": "Q229", "variant": 0}, "response": ["From the perspective of a married male from Menya, Egypt, who is 41 years old, completed middle education level, and considers himself part of the lower middle class, I would approach this question by considering the cultural context, individual values, and socioeconomic background. In Egypt, there is a complex history of political unrest and skepticism towards the fairness of elections. As a member of the lower middle class, I may have experienced or heard about instances of election officials being unfair. Additionally, my age and level of education may have exposed me to a variety of perspectives on this issue. Taking all of this into account, I would answer the question as follows:\n\n3\n\n(3) Not often"]}, {"persona": {"region": "Menya", "sex": "female", "age": 43, "country": "Egypt", "marital_status": "married", "education": "higher", "social_class": "working class"}, "question": {"id": "Q229", "variant": 0}, "response": ["Based on the anthropological framework, as a married female from Menya, Egypt, my emic perspective on the fairness of election officials in the country's elections is influenced by my cultural context, individual values, and socioeconomic background. In Egypt, there are often perceptions of corruption and lack of fairness in the electoral process, which is exacerbated by my working class status and limited access to resources and power. Additionally, my personal experiences and education have exposed me to instances of unfairness and manipulation in the electoral system. Therefore, my answer is (3) Not often."]}, {"persona": {"region": "Menya", "sex": "male", "age": 57, "country": "Egypt", "marital_status": "married", "education": "middle", "social_class": "lower middle class"}, "question": {"id": "Q229", "variant": 0}, "response": ["In the cultural context of Menya, Egypt, there is a strong emphasis on community and the role of traditional values in shaping societal structures. As a married male from this region, my personal experience and values are deeply influenced by the socioeconomic background of the lower middle class. This influences how I perceive the fairness of election officials in the country's elections. Additionally, my age and educational level also play a role in shaping my perspective. Based on these factors, I believe that election officials are fairly often fair in the country's elections. \n\n2"]}, {"persona": {"region": "Menya", "sex": "male", "age": 42, "country": "Egypt", "marital_status": "divorced", "education": "middle", "social_class": "lower middle class"}, "question": {"id": "Q229", "variant": 0}, "response": ["Based on the anthropological framework, I would answer this question by considering my personal experience and socioeconomic background. As a divorced male from Menya, Egypt, I have experienced firsthand the impact of socioeconomic factors on the fairness of elections. In Egypt, lower middle-class individuals like myself often feel marginalized and believe that election officials are not often fair in their conduct. This belief is also influenced by the cultural context and historical experiences of our country. Therefore, I would choose option (3) Not often."]}, {"persona": {"region": "Menya", "sex": "female", "age": 59, "country": "Egypt", "marital_status": "married", "education": "middle", "social_class": "upper middle class"}, "question": {"id": "Q229", "variant": 0}, "response": ["Based on the anthropological framework, my understanding and answer to the question of how frequently election officials are fair in the country's elections are influenced by my emic perspective as a married female from Menya, Egypt. My cultural context, individual values, and personal experience as a 59-year-old with a middle education level and upper middle class status all play a significant role in shaping my perception. Additionally, my socioeconomic background and the nuance of the question also contribute to my answer. Considering the political and social climate in Egypt, I believe that election officials are fairly often fair in the country's elections. This belief is influenced by my personal experience and understanding of the election process in my country.\n\n2"]}, {"persona": {"region": "Menya", "sex": "female", "age": 31, "country": "Egypt", "marital_status": "married", "education": "middle", "social_class": "working class"}, "question": {"id": "Q229", "variant": 0}, "response": ["Based on the anthropological framework, as a married female from Menya, Egypt, my emic perspective is influenced by my cultural context, individual values, and socioeconomic background. In Menya, there is a strong sense of community and family values, and fairness and justice are highly valued. However, the socioeconomic background of the working class often leads to a lack of trust in the fairness of election officials. Additionally, my personal experience and the experiences of those around me have shown that election officials are not often fair, leading to a sense of disillusionment with the electoral process. Therefore, based on my perspective, I would choose option 3: Not often."]}, {"persona": {"region": "Menya", "sex": "male", "age": 55, "country": "Egypt", "marital_status": "single", "education": "middle", "social_class": "working class"}, "question": {"id": "Q229", "variant": 0}, "response": ["Based on my experience growing up in Menya, Egypt, and being part of the working class, I have observed that election officials are not often fair in the country's elections. The cultural context of Egypt, along with my socioeconomic background, has influenced my perception of the fairness of elections. Additionally, my age and place of residence have also shaped my understanding of this issue. I believe that my nuanced understanding of the question and my personal experience have led me to this conclusion.\n\n3"]}, {"persona": {"region": "Menya", "sex": "female", "age": 28, "country": "Egypt", "marital_status": "married", "education": "higher", "social_class": "lower middle class"}, "question": {"id": "Q229", "variant": 0}, "response": ["Based on the anthropological framework, my perspective as a married female from Menya, Egypt, is heavily influenced by my cultural context, individual values, and socioeconomic background. In Menya, there is a strong emphasis on community and fairness, and as someone with a higher education level, I am aware of the importance of fair elections for the progress of our country. However, as part of the lower middle class, I have witnessed instances where election officials have not been fair, leading to a lack of trust in the electoral process. Therefore, I would say that election officials are \"fairly often\" in country's elections.\n\n2"]}, {"persona": {"region": "Menya", "sex": "male", "age": 24, "country": "Egypt", "marital_status": "single", "education": "middle", "social_class": "working class"}, "question": {"id": "Q229", "variant": 0}, "response": ["Based on the anthropological framework, as a single male from Menya, Egypt, with a middle education level and working-class background, my perspective on the fairness of election officials in the country's elections is influenced by my cultural context, individual values, and socioeconomic background. In Menya, there is a strong emphasis on community and family connections, and the working-class often feels marginalized in the political process. Additionally, my personal experience and values lead me to believe that election officials are not often fair in the country's elections, as there is a widespread perception of corruption and favoritism. This perspective is further reinforced by the lack of access to higher education and political power for individuals from my background. Therefore, my chosen answer is:\n\n3) Not often"]}, {"persona": {"region": "Menya", "sex": "female", "age": 23, "country": "Egypt", "marital_status": "married", "education": "middle", "social_class": "working class"}, "question": {"id": "Q229", "variant": 0}, "response": ["Based on the anthropological framework, my emic perspective as a married female from Menya, Egypt, who is part of the working class and has completed middle education, is influenced by my cultural context, individual values, and socioeconomic background. In Egypt, there is a history of political corruption, and election officials are often perceived as unfair and biased. My personal experience and values, along with my socioeconomic background, have led me to believe that election officials are not often fair in the country's elections. Additionally, the cultural relativism aspect of the framework teaches me that my perspective may differ from others, but it is valid within my own context.\n\n3"]}, {"persona": {"region": "Menya", "sex": "male", "age": 27, "country": "Egypt", "marital_status": "single", "education": "middle", "social_class": "lower middle class"}, "question": {"id": "Q229", "variant": 0}, "response": ["Based on the anthropological framework, as a 27-year-old male from Menya, Egypt, who has completed middle education and considers myself part of the lower middle class, my perspective on the fairness of election officials in the country's elections is influenced by my cultural context, socioeconomic background, and individual values. In Egypt, there is a history of perceived electoral irregularities and lack of transparency, particularly from the perspective of individuals from lower socioeconomic backgrounds. Additionally, my personal experience and values lead me to believe that election officials are not often fair in the country's elections. \n\n3"]}, {"persona": {"region": "Asyut", "sex": "male", "age": 30, "country": "Egypt", "marital_status": "married", "education": "middle", "social_class": "working class"}, "question": {"id": "Q229", "variant": 0}, "response": ["Based on my personal experience and socioeconomic background as a married male from Asyut, Egypt, who is part of the working class and completed middle education level, I understand that the fairness of election officials in the country's elections is often influenced by political and social factors. The cultural context and nuance of the question also play a significant role in my understanding. Considering the emic and etic perspectives, as well as the cultural relativism, I believe that election officials are not often fair in the country's elections due to the influence of power dynamics and societal hierarchies. Therefore, my answer to the question is:\n3"]}, {"persona": {"region": "Asyut", "sex": "female", "age": 26, "country": "Egypt", "marital_status": "married", "education": "middle", "social_class": "working class"}, "question": {"id": "Q229", "variant": 0}, "response": ["Based on the anthropological framework, as a married female from Asyut, Egypt, I am deeply rooted in the cultural context of my community and am influenced by my socioeconomic background and personal experiences. Living in a working-class environment and having completed only middle education, I am likely to have limited access to resources and opportunities. In addition, being a part of a patriarchal society, I am aware of the challenges and biases that exist in the electoral process. Therefore, based on my understanding and experiences, I would choose option (3) Not often."]}, {"persona": {"region": "Asyut", "sex": "male", "age": 32, "country": "Egypt", "marital_status": "single", "education": "higher", "social_class": "lower middle class"}, "question": {"id": "Q229", "variant": 0}, "response": ["From the emic perspective, as a single male from Asyut, Egypt, I am likely to have personal experiences and individual values that inform my understanding of the fairness of election officials in the country's elections. My socioeconomic background as part of the lower middle class may also influence my perception. Additionally, the cultural context of Egypt, including its political and social dynamics, will play a significant role in shaping my viewpoint. As a 32-year-old with higher education, I may have a nuanced understanding of the political landscape and the role of election officials. Therefore, my answer to the question is likely to be influenced by my personal experiences, cultural context, and nuanced understanding of the political system in Egypt.\n\n3"]}, {"persona": {"region": "Asyut", "sex": "female", "age": 21, "country": "Egypt", "marital_status": "married", "education": "middle", "social_class": "working class"}, "question": {"id": "Q229", "variant": 0}, "response": ["Based on my cultural context, I come from Asyut, Egypt, where there is a strong emphasis on community and family values. My socioeconomic background as part of the working class means that I am more likely to have experienced inequality and potential unfair treatment. Additionally, my age and education level may have exposed me to certain political and social issues in my country. Therefore, I believe that election officials are not often fair in the country's elections.\n\n3"]}, {"persona": {"region": "Asyut", "sex": "female", "age": 30, "country": "Egypt", "marital_status": "married", "education": "higher", "social_class": "working class"}, "question": {"id": "Q229", "variant": 0}, "response": ["From an emic perspective, as a married female from Asyut, Egypt, I have experienced firsthand the cultural context and individual values that shape the fairness of election officials. In my community, there is a strong emphasis on the importance of fair and just governance, and this is reflected in the way people perceive the conduct of election officials. Additionally, my socioeconomic background as part of the working class has exposed me to the struggles and challenges faced by individuals in my community, and this has influenced my perception of the fairness of election officials. Taking into account the nuances of the question and the cultural relativism that shapes my worldview, I would choose the following option:\n\n3"]}, {"persona": {"region": "Asyut", "sex": "female", "age": 42, "country": "Egypt", "marital_status": "married", "education": "higher", "social_class": "lower middle class"}, "question": {"id": "Q229", "variant": 0}, "response": ["Based on the anthropological framework, my answer to the question of how frequently election officials are fair in the country's elections is influenced by my cultural context, individual values, and socioeconomic background. As a married female from Asyut, Egypt, I am aware of the political and social dynamics in my community and the country as a whole. My higher education level has provided me with a critical understanding of the political system and the potential for bias and corruption. Being part of the lower middle class, I am also aware of the power dynamics at play in elections and how they can impact fairness. Therefore, my answer is:\n\n3) Not often"]}, {"persona": {"region": "Sohag", "sex": "male", "age": 63, "country": "Egypt", "marital_status": "married", "education": "middle", "social_class": "lower middle class"}, "question": {"id": "Q229", "variant": 0}, "response": ["From an anthropological perspective, my individual values and personal experiences as a 63-year-old married male from Sohag, Egypt, who has completed middle education level and considers himself part of the lower middle class, greatly influence my perception of the fairness of election officials in the country's elections. Additionally, the cultural context of Egypt, including its socioeconomic background and cultural relativism, also plays a significant role in shaping my viewpoint. Given these factors, I believe that election officials are fairly often fair in the country's elections.\n\n2"]}, {"persona": {"region": "Sohag", "sex": "male", "age": 27, "country": "Egypt", "marital_status": "married", "education": "middle", "social_class": "working class"}, "question": {"id": "Q229", "variant": 0}, "response": ["Based on the anthropological framework, my perspective is heavily influenced by my cultural context, socioeconomic background, and personal experience. As a married male from Sohag, Egypt, my access to information and understanding of the electoral process may be different from others. Additionally, my working-class status may shape my perception of the fairness of election officials. Furthermore, my age and education level may also influence how I perceive the fairness of elections in my country. Taking these factors into consideration, I would choose the following option:\n\n2"]}, {"persona": {"region": "Sohag", "sex": "male", "age": 56, "country": "Egypt", "marital_status": "married", "education": "higher", "social_class": "upper middle class"}, "question": {"id": "Q229", "variant": 0}, "response": ["Based on my cultural context and socioeconomic background, I believe that election officials are fairly often fair in the country's elections. In Sohag, Egypt, I have observed that there are mechanisms in place to ensure a level of fairness in the electoral process. Additionally, my higher education level has provided me with a nuanced understanding of the political landscape, and I have personally witnessed instances of fair conduct during elections. Furthermore, as a member of the upper middle class, I have access to information and resources that allow me to have a more informed perspective on this matter. \n\n2"]}, {"persona": {"region": "Sohag", "sex": "male", "age": 51, "country": "Egypt", "marital_status": "married", "education": "higher", "social_class": "lower middle class"}, "question": {"id": "Q229", "variant": 0}, "response": ["Based on the anthropological framework, my emic perspective as a married male from Sohag, Egypt, who is 51 years old, completed higher education, and considers myself part of the lower middle class, is influenced by my cultural context, individual values, and socioeconomic background. In Egypt, the cultural context is such that there is a level of skepticism towards the fairness of election officials due to historical and contemporary issues with corruption and political manipulation. Additionally, my individual values and personal experiences have also shaped my perception, as I have witnessed instances of unfairness in elections. Considering my socioeconomic background, I am more likely to be affected by the decisions made by election officials and therefore pay close attention to their fairness. Taking into account the nuanced phrasing of the question and my personal experiences, I would choose option (3) Not often as my answer. \n\n3"]}, {"persona": {"region": "Sohag", "sex": "female", "age": 26, "country": "Egypt", "marital_status": "married", "education": "higher", "social_class": "working class"}, "question": {"id": "Q229", "variant": 0}, "response": ["From an emic perspective, as a married female from Sohag, Egypt, I am deeply rooted in the cultural context of my community and the socioeconomic background of the working class. My personal experience and values have shaped my understanding of the fairness of election officials in the country's elections. Additionally, my age and education level have influenced my perception of this issue. Considering the nuances of the question and the cultural relativism that shapes my perspective, I would say that election officials are not often fair in the country's elections.\n\n3"]}, {"persona": {"region": "Sohag", "sex": "female", "age": 29, "country": "Egypt", "marital_status": "married", "education": "higher", "social_class": "upper middle class"}, "question": {"id": "Q229", "variant": 0}, "response": ["Based on the anthropological framework, my personal experience and individual values as a married, educated woman from Sohag, Egypt, play a significant role in shaping my perspective on the fairness of election officials. Additionally, my upper middle class socioeconomic background and cultural context also influence my viewpoint. In Egypt, there is a strong sense of importance placed on fair and just governance, and the cultural relativism of this value is crucial to my understanding. Furthermore, as a member of the upper middle class, I have access to more resources and information which may shape my perception of the fairness of election officials. Therefore, my answer to the question \"How frequently are election officials fair in country's elections?\" would be (3) Not often."]}, {"persona": {"region": "Sohag", "sex": "male", "age": 51, "country": "Egypt", "marital_status": "married", "education": "middle", "social_class": "lower middle class"}, "question": {"id": "Q229", "variant": 0}, "response": ["Based on the anthropological framework, my emic perspective as a married male from Sohag, Egypt, at 51 years of age and part of the lower middle class, is influenced by my cultural context, individual values, and socioeconomic background. In Egypt, there is a strong sense of distrust in the fairness of elections due to historical and current political circumstances. My personal experience and values also lead me to believe that election officials are not often fair in the country's elections. I have seen and heard about instances of corruption and manipulation, and my socioeconomic background further reinforces this belief as it is common for those in positions of power to exploit their authority for personal gain. Therefore, my answer to the question is:\n\n3. Not often"]}, {"persona": {"region": "Qena", "sex": "male", "age": 32, "country": "Egypt", "marital_status": "single", "education": "middle", "social_class": "working class"}, "question": {"id": "Q229", "variant": 0}, "response": ["Based on the anthropological framework, my perspective as a single male from Qena, Egypt, who is 32 years old and part of the working class, is influenced by my cultural context, individual values, and socioeconomic background. In Egypt, there is a long history of political corruption and nepotism, which has a significant impact on the fairness of elections. As a member of the working class, I have personally experienced the challenges and injustices that come with living in a country with a complex political landscape. Therefore, I believe that election officials are not often fair in the country's elections.\n\n3"]}, {"persona": {"region": "Qena", "sex": "male", "age": 54, "country": "Egypt", "marital_status": "married", "education": "middle", "social_class": "lower middle class"}, "question": {"id": "Q229", "variant": 0}, "response": ["Based on the anthropological framework, my perspective is influenced by my cultural context, individual values, and socioeconomic background. As a married male from Qena, Egypt, I have experienced firsthand the impact of socioeconomic factors on the fairness of elections. In my community, there is a prevailing belief that election officials are not often fair in the country's elections, and this belief is shaped by our cultural context and personal experiences. Additionally, my lower middle-class status has made me more aware of the challenges and inequalities that exist within the electoral process. Therefore, I believe that the answer to the question is (3) Not often."]}, {"persona": {"region": "Qena", "sex": "male", "age": 25, "country": "Egypt", "marital_status": "single", "education": "lower", "social_class": "lower class"}, "question": {"id": "Q229", "variant": 0}, "response": ["Based on my individual values and personal experience, as a lower-class male from Qena, Egypt, I have experienced election officials being not fair very often in the country's elections. The cultural context of my community also plays a role in shaping my perspective, as there is a general feeling of mistrust in the fairness of the electoral process. Additionally, my socioeconomic background has influenced my perception, as I have seen how power and influence often dictate the outcome of elections rather than the will of the people. Therefore, I believe that election officials are not fair very often in the country's elections. \n\n3"]}, {"persona": {"region": "Aswan", "sex": "male", "age": 34, "country": "Egypt", "marital_status": "single", "education": "middle", "social_class": "lower class"}, "question": {"id": "Q229", "variant": 0}, "response": ["From an emic perspective, as a member of the lower class in Aswan, Egypt, my personal experience and socioeconomic background have a significant impact on my understanding of the fairness of election officials in the country's elections. I am more likely to perceive election officials as not often fair due to the struggles and injustices that I have witnessed and experienced within my community. Additionally, the cultural context, space, and time play a role in how I perceive the fairness of election officials, as the historical and current socio-political climate in Egypt influences my perspective. Therefore, I believe that the option (3) Not often is the most accurate representation of my viewpoint. \n\n3"]}, {"persona": {"region": "Aswan", "sex": "female", "age": 31, "country": "Egypt", "marital_status": "married", "education": "middle", "social_class": "lower middle class"}, "question": {"id": "Q229", "variant": 0}, "response": ["From the anthropological perspective, my cultural context as a married female from Aswan, Egypt, with a middle education level and lower middle-class background, greatly influences my perception of the fairness of election officials in the country's elections. My socioeconomic background and individual values play a significant role in shaping my understanding of this issue. Additionally, the emic perspective of being part of the local community and the etic perspective of being part of the broader Egyptian society also impact my viewpoint. Considering the cultural relativism and nuanced phrasing of the question, I would say:\n\n2) Fairly often"]}, {"persona": {"region": "Aswan", "sex": "female", "age": 39, "country": "Egypt", "marital_status": "married", "education": "middle", "social_class": "working class"}, "question": {"id": "Q229", "variant": 0}, "response": ["Based on the anthropological framework, my perspective as a married female from Aswan, Egypt, who is part of the working class and has completed middle education level, is shaped by my cultural context, individual values, and personal experience. In Egypt, there is a long history of political turmoil and allegations of electoral fraud. Additionally, as a member of the working class, I have felt marginalized and disenfranchised by the political system. Therefore, my perception is that election officials are not often fair in the country's elections.\n\n3"]}, {"persona": {"region": "Qena", "sex": "female", "age": 27, "country": "Egypt", "marital_status": "married", "education": "lower", "social_class": "lower middle class"}, "question": {"id": "Q229", "variant": 0}, "response": ["Based on the anthropological framework, my cultural context as a married female from Qena, Egypt and my lower middle class socioeconomic background will greatly influence my perception of the fairness of election officials in my country. My individual values and personal experiences, including my lower education level, will also shape my view. Additionally, my emic perspective as a member of the community and my etic perspective as an outsider looking in will impact my response. Therefore, considering all these factors, I believe that election officials are not often fair in the country's elections.\n\n3"]}, {"persona": {"region": "Qena", "sex": "male", "age": 40, "country": "Egypt", "marital_status": "single", "education": "middle", "social_class": "lower middle class"}, "question": {"id": "Q229", "variant": 0}, "response": ["Based on the anthropological framework, my emic perspective as a lower middle class, 40-year-old single male from Qena, Egypt, with a middle education level, would be heavily influenced by my cultural context, individual values, and socioeconomic background. In Egypt, there is a long history of political corruption and manipulation, and as someone from the lower middle class, I am likely to have experienced or witnessed unfairness in elections. Additionally, my personal experience and values would lead me to believe that election officials are not often fair in the country's elections, as this has been the prevalent narrative in my community and in the media. Therefore, I would answer the question as follows:\n\n3. Not often"]}, {"persona": {"region": "Qena", "sex": "male", "age": 30, "country": "Egypt", "marital_status": "single", "education": "middle", "social_class": "working class"}, "question": {"id": "Q229", "variant": 0}, "response": ["Based on the anthropological framework, as a single male from Qena, Egypt, who is part of the working class and has completed middle education, my perspective on the fairness of election officials in the country's elections is influenced by my cultural context, socioeconomic background, and personal experience. In Egypt, there is a long history of political corruption and manipulation, which has led to widespread skepticism about the fairness of election officials. As a working-class individual, I have personally witnessed instances of unfair practices and lack of transparency in the electoral process. Additionally, my limited educational attainment may contribute to a lack of trust in the system. Therefore, based on these factors, I believe that election officials are not often fair in the country's elections.\n\n3"]}]