[{"persona": {"region": "Fayoum", "sex": "male", "age": 46, "country": "Egypt", "marital_status": "married", "education": "higher", "social_class": "lower middle class"}, "question": {"id": "Q78", "variant": 0}, "response": ["Based on the anthropological framework, my perspective as a married male from Fayoum, Egypt, who is 46 years old and considers himself part of the lower middle class, is influenced by my cultural context, individual values, and socioeconomic background. In Egypt, access to banking and financial services may be limited for those in the lower middle class, and there may be a lack of trust in private banks due to past experiences or cultural perceptions. Additionally, my age and socioeconomic background may also play a role in shaping my confidence level in private banks. Therefore, my response reflects my subjective understanding based on my personal experiences and cultural context.\n\n2"]}, {"persona": {"region": "Fayoum", "sex": "female", "age": 30, "country": "Egypt", "marital_status": "married", "education": "middle", "social_class": "lower middle class"}, "question": {"id": "Q78", "variant": 0}, "response": ["Based on the anthropological framework, my perspective as a married female from Fayoum, Egypt, who is 30 years old and part of the lower middle class, is heavily influenced by my cultural context, socioeconomic background, and personal experience. In my community, private banks are not commonly used due to the lack of trust in the financial system and limited access to banking services. Additionally, my lower middle class status means that I have limited financial resources and may not have had the opportunity to experience the benefits of private banking services. Therefore, my confidence level in private banks would be quite low, as I have little exposure and trust in their services.\n\n3"]}, {"persona": {"region": "Fayoum", "sex": "male", "age": 60, "country": "Egypt", "marital_status": "married", "education": "higher", "social_class": "working class"}, "question": {"id": "Q78", "variant": 0}, "response": ["Based on the anthropological framework, as a married male from Fayoum, Egypt, at the age of 60 with a higher education level and considering myself part of the working class, my perspective on private banks is heavily influenced by my cultural context, socioeconomic background, and personal experience. In the Egyptian cultural context, there is a general mistrust and skepticism towards private banks, especially among the working class. My personal experience and the experiences of those within my kinship networks have shown that private banks are often inaccessible and untrustworthy, particularly for individuals with limited financial resources. Therefore, my confidence level in private banks is quite low, as my socioeconomic background and cultural context have shaped my perception of their reliability and accessibility.\n\n3"]}, {"persona": {"region": "Fayoum", "sex": "male", "age": 20, "country": "Egypt", "marital_status": "single", "education": "middle", "social_class": "lower middle class"}, "question": {"id": "Q78", "variant": 0}, "response": ["Based on my emic perspective as a single male from Fayoum, Egypt, who has completed middle education and considers myself part of the lower middle class, my confidence level in private banks is not very much. This is influenced by my cultural context, as people in my community often rely on informal financial systems and have limited access to formal banking services. My individual values and personal experience also play a role, as I have witnessed instances of financial instability and lack of trust in private banks within my social circles. Additionally, my socioeconomic background and age contribute to my lack of confidence in private banks, as I have limited financial resources and have not had significant exposure to formal banking institutions. Overall, my nuanced understanding of this question leads me to choose option 3: Not very much. \n\n3"]}, {"persona": {"region": "Fayoum", "sex": "female", "age": 39, "country": "Egypt", "marital_status": "married", "education": "higher", "social_class": "lower middle class"}, "question": {"id": "Q78", "variant": 0}, "response": ["Based on the anthropological framework, my perspective as a married female from Fayoum, Egypt, who is 39 years old, completed higher education, and considers myself part of the lower middle class, is shaped by my cultural context, individual values, and socioeconomic background. In Egypt, private banks are often associated with the upper class and are not easily accessible or trusted by those in the lower middle class. Additionally, my personal experiences and values lead me to prioritize saving money in more traditional ways, such as through informal savings groups or community-based financial systems. Therefore, my confidence level in private banks is not very much.\n\n3"]}, {"persona": {"region": "Fayoum", "sex": "male", "age": 33, "country": "Egypt", "marital_status": "married", "education": "higher", "social_class": "working class"}, "question": {"id": "Q78", "variant": 0}, "response": ["Based on the anthropological framework, as a married male from Fayoum, Egypt, at 33 years of age with a higher education level and part of the working class, my perspective on private banks would be influenced by my cultural context, individual values, and socioeconomic background. In my cultural context, private banks may not be as accessible or widely used compared to public banks, which may impact my confidence level in them. Additionally, as part of the working class, my socioeconomic background may lead me to have less trust in private banks due to potential financial barriers or limited experience with them. Therefore, I would rate my confidence level in private banks as (3) Not very much."]}, {"persona": {"region": "Port Said", "sex": "female", "age": 45, "country": "Egypt", "marital_status": "married", "education": "higher", "social_class": "lower middle class"}, "question": {"id": "Q78", "variant": 0}, "response": ["Based on the anthropological framework, as a married female from Port Said, Egypt, who is 45 years old and part of the lower middle class, my perspective on confidence in private banks is influenced by my socioeconomic background, cultural context, and personal experience. In Egypt, the banking system is heavily influenced by the government, and private banks may not offer the same level of security or trust as state-owned banks. Additionally, as someone from the lower middle class, I may have limited experience with private banks and feel more confident in the traditional state-owned options. Therefore, my confidence level in private banks would be \"Not very much\" (3).\n\n3"]}, {"persona": {"region": "Port Said", "sex": "male", "age": 42, "country": "Egypt", "marital_status": "married", "education": "middle", "social_class": "lower middle class"}, "question": {"id": "Q78", "variant": 0}, "response": ["In considering the confidence level in private banks from the perspective of a 42-year-old married male from Port Said, Egypt, with a middle education level and lower middle-class status, several factors must be taken into account. The cultural context in Egypt, particularly in lower middle-class communities, often involves a level of skepticism and caution towards private institutions, including banks. Socioeconomic background also plays a role, as individuals from this social stratum may have limited experience or exposure to private banking and may rely more on community-based financial practices. Additionally, the individual values and personal experiences of this persona may lead to a lower level of confidence in private banks due to potential financial constraints or previous negative experiences. Therefore, the chosen option would likely reflect a lower level of confidence in private banks.\n\n3"]}, {"persona": {"region": "Port Said", "sex": "male", "age": 28, "country": "Egypt", "marital_status": "single", "education": "middle", "social_class": "lower middle class"}, "question": {"id": "Q78", "variant": 0}, "response": ["Based on the anthropological framework, as a single male from Port Said, Egypt, with a lower middle-class background and middle education level, my perspective on private banks will be heavily influenced by my socioeconomic background, cultural context, and personal experience. In Egypt, there is a lack of trust in private banks due to a history of economic instability and corruption, which is especially prevalent among lower-income individuals. Additionally, my limited education level may also contribute to a lack of confidence in understanding and navigating the complexities of private banking. Therefore, my confidence level in private banks would be \"Not very much\" (3)."]}, {"persona": {"region": "Port Said", "sex": "female", "age": 30, "country": "Egypt", "marital_status": "married", "education": "higher", "social_class": "lower middle class"}, "question": {"id": "Q78", "variant": 0}, "response": ["Based on my emic perspective as a married female from Port Said, Egypt, cultural context plays a pivotal role in my understanding and confidence level in private banks. The socioeconomic background of being part of the lower middle class also influences my perception. My individual values and personal experience also contribute to my confidence level in private banks. Additionally, the nuanced phrasing of the question and the space and time in which I live also affect my response. Considering all these factors, I would rate my confidence level in private banks as quite a lot (2)."]}, {"persona": {"region": "Port Said", "sex": "male", "age": 30, "country": "Egypt", "marital_status": "divorced", "education": "middle", "social_class": "lower middle class"}, "question": {"id": "Q78", "variant": 0}, "response": ["Based on the anthropological framework, my emic perspective as a lower middle class male from Port Said, Egypt, influences my confidence level in private banks. My cultural context and socioeconomic background play a significant role in shaping my views. I have limited access to financial resources and have likely had negative experiences with private banks. Additionally, my personal experience and individual values lead me to have little confidence in private banks due to my socioeconomic status. Therefore, based on my nuanced understanding of the question, I choose the following option:\n\n3"]}, {"persona": {"region": "Port Said", "sex": "female", "age": 19, "country": "Egypt", "marital_status": "single", "education": "middle", "social_class": "lower middle class"}, "question": {"id": "Q78", "variant": 0}, "response": ["Based on the anthropological framework, as a 19-year-old single female from Port Said, Egypt, who has completed middle education and considers myself part of the lower middle class, my perspective on private banks is influenced by my cultural context, socioeconomic background, and individual values. In Port Said, private banks may not be as accessible or trustworthy compared to public or state-owned banks. My lower middle-class background may also mean that I have limited experience or exposure to private banking services. Additionally, my age and educational level may contribute to my cautiousness in trusting private banks. Therefore, I would rate my confidence level in private banks as (3) Not very much."]}, {"persona": {"region": "Fayoum", "sex": "male", "age": 40, "country": "Egypt", "marital_status": "married", "education": "middle", "social_class": "working class"}, "question": {"id": "Q78", "variant": 0}, "response": ["Based on the anthropological framework, my perspective as a married male from Fayoum, Egypt, at the age of 40, and part of the working class, is influenced by my cultural context, individual values, and socioeconomic background. In Egypt, there is a strong emphasis on community and family, and there is a historical distrust of private banks due to economic instability and political factors. As a member of the working class with limited education, my personal experience and socioeconomic background lead me to have little confidence in private banks, as they are often seen as inaccessible and untrustworthy institutions. Therefore, my perspective on private banks is influenced by my cultural context and individual values, leading me to rate my confidence level as (3) Not very much."]}, {"persona": {"region": "Fayoum", "sex": "male", "age": 23, "country": "Egypt", "marital_status": "single", "education": "higher", "social_class": "lower middle class"}, "question": {"id": "Q78", "variant": 0}, "response": ["Based on my emic perspective as a young male from Fayoum, Egypt, my cultural context and socioeconomic background greatly influence my perception of private banks. In my community, there is a general distrust of private banks due to their association with the upper class and the government. Additionally, my personal experience with private banks has been limited, as my family and peers primarily utilize informal financial systems. My lower middle-class status also means that I have limited access to the resources and information necessary to fully understand and trust private banks. Therefore, my confidence level in private banks is not very much.\n\n3"]}, {"persona": {"region": "Fayoum", "sex": "female", "age": 38, "country": "Egypt", "marital_status": "married", "education": "middle", "social_class": "lower middle class"}, "question": {"id": "Q78", "variant": 0}, "response": ["Based on the anthropological framework, my response is influenced by my emic perspective as a married female from Fayoum, Egypt, and my lower middle class socioeconomic background. My cultural context and personal experience have shaped my views on private banks, as I have limited exposure to them and rely more on informal financial systems. Additionally, my age and education level play a role in my understanding of private banks. Given these factors, my confidence level in private banks would be \"Not very much\" (3).\n\n3"]}, {"persona": {"region": "Fayoum", "sex": "male", "age": 32, "country": "Egypt", "marital_status": "married", "education": "middle", "social_class": "lower middle class"}, "question": {"id": "Q78", "variant": 0}, "response": ["Based on the anthropological framework, my answer is influenced by my emic perspective as a lower middle class married male from Fayoum, Egypt, as well as my cultural context, individual values, and socioeconomic background. In my cultural context, private banks may not be as accessible or familiar to me as they would be in a more urban or affluent area. Additionally, my individual values and personal experience may lead me to prioritize saving and investing in more traditional ways, such as through informal savings groups or community-based financial systems. My socioeconomic background also plays a role, as my level of education and income may limit my exposure to and trust in private banks. Therefore, my confidence level in private banks would likely be (3) Not very much."]}, {"persona": {"region": "Fayoum", "sex": "male", "age": 31, "country": "Egypt", "marital_status": "married", "education": "higher", "social_class": "working class"}, "question": {"id": "Q78", "variant": 0}, "response": ["Based on the anthropological framework, as a 31-year-old married male from Fayoum, Egypt, who completed higher education and considers myself part of the working class, my perspective on private banks is heavily influenced by my cultural context, individual values, and socioeconomic background. In Egypt, private banks are often seen as institutions for the wealthy and elite, and as a member of the working class, I may not have had much exposure or positive experiences with private banks. Additionally, my personal values and experiences may lead me to be cautious or skeptical of private banks, as they may not align with my financial needs or priorities. Therefore, based on my background and cultural context, I would rate my confidence level in private banks as (3) Not very much."]}, {"persona": {"region": "Fayoum", "sex": "male", "age": 31, "country": "Egypt", "marital_status": "married", "education": "middle", "social_class": "lower middle class"}, "question": {"id": "Q78", "variant": 0}, "response": ["Based on my emic perspective as a married male from Fayoum, Egypt, and considering my lower middle class socioeconomic background, I have limited exposure to private banks. My cultural context and personal experience lead me to believe that private banks are more accessible and trustworthy for those in higher socioeconomic classes, and therefore, I have limited confidence in them. Additionally, my individual values and personal experience shape my perception of private banks, leading me to have not very much confidence in them. Furthermore, cultural relativism is important to consider, as my perspective may differ from someone of a different cultural and socioeconomic background. Therefore, my confidence level in private banks is not very much.\n\n3"]}, {"persona": {"region": "Fayoum", "sex": "female", "age": 32, "country": "Egypt", "marital_status": "married", "education": "middle", "social_class": "lower middle class"}, "question": {"id": "Q78", "variant": 0}, "response": ["Based on the anthropological framework, my perspective as a married female from Fayoum, Egypt, is heavily influenced by my cultural context, socioeconomic background, and personal experience. As part of the lower middle class, my access to and interaction with private banks may be limited. My confidence level in private banks is likely not very high, as I may have had limited exposure to their services and may have heard negative experiences from others in similar socioeconomic positions. Additionally, cultural relativism plays a role in shaping my perspective, as the perception of private banks may differ within my community compared to higher socioeconomic classes. (3)\n\n3"]}, {"persona": {"region": "Ismailia", "sex": "male", "age": 53, "country": "Egypt", "marital_status": "married", "education": "middle", "social_class": "lower middle class"}, "question": {"id": "Q78", "variant": 0}, "response": ["Based on the anthropological framework, as a married male from Ismailia, Egypt, my perspective is influenced by my cultural context, individual values, and socioeconomic background. In Ismailia, private banks may not be as commonly utilized as in more urban or affluent areas, and my lower middle class status may limit my exposure and access to these institutions. My middle education level also affects my understanding of financial systems and my confidence level in private banks. Therefore, I would rate my confidence level in private banks as (3) Not very much."]}, {"persona": {"region": "Ismailia", "sex": "male", "age": 38, "country": "Egypt", "marital_status": "married", "education": "higher", "social_class": "working class"}, "question": {"id": "Q78", "variant": 0}, "response": ["In considering the question of rating confidence level in private banks from the perspective of a married male from Ismailia, Egypt, it is important to take into account the cultural context and individual values. In Egyptian society, there is a strong sense of community and reliance on traditional banking systems. The working-class background also plays a role, as individuals in this socioeconomic group may have limited exposure to private banking and may rely more on informal financial networks. Additionally, the individual's age and level of education may influence their perception of private banks. Given these factors, it is likely that the persona would rate their confidence level in private banks as \"Not very much\" due to a combination of cultural, socioeconomic, and personal factors.\n\n3"]}, {"persona": {"region": "Ismailia", "sex": "female", "age": 35, "country": "Egypt", "marital_status": "married", "education": "middle", "social_class": "lower middle class"}, "question": {"id": "Q78", "variant": 0}, "response": ["Based on the anthropological framework, as a married female from Ismailia, Egypt, my emic perspective on private banks would be influenced by my cultural context, individual values, and socioeconomic background. In Egypt, private banks may not be as accessible or trusted for individuals from lower middle-class backgrounds due to financial constraints and lack of exposure to financial services. Additionally, my personal experience and values would likely lead me to have a lower confidence level in private banks, as I may have had limited exposure to their services and may prioritize traditional methods of saving and managing money. Therefore, my confidence level in private banks would likely be not very much.\n\n3"]}, {"persona": {"region": "Ismailia", "sex": "female", "age": 57, "country": "Egypt", "marital_status": "married", "education": "lower", "social_class": "working class"}, "question": {"id": "Q78", "variant": 0}, "response": ["Based on the anthropological framework, my emic perspective as a married female from Ismailia, Egypt, would be influenced by my cultural context, individual values, socioeconomic background, and space and time. In Ismailia, private banks may not be as accessible or trusted as they are in more urban or affluent areas. Additionally, as a member of the working class with a lower education level, my confidence level in private banks may be lower due to a lack of familiarity or experience with them. Therefore, I would rate my confidence level in private banks as (3) Not very much."]}, {"persona": {"region": "Ismailia", "sex": "male", "age": 33, "country": "Egypt", "marital_status": "married", "education": "middle", "social_class": "lower middle class"}, "question": {"id": "Q78", "variant": 0}, "response": ["From the perspective of a married male from Ismailia, Egypt, who is 33 years old, has completed middle education, and considers himself part of the lower middle class, it is important to consider the cultural context and socioeconomic background when answering the question about confidence in private banks. In Ismailia, there may be a general mistrust or lack of confidence in private banks due to economic instability and the prevalence of informal financial systems. Additionally, individuals with lower middle class socioeconomic background may have limited access to and experience with private banks, leading to a lower level of confidence. Therefore, based on this perspective, the chosen answer is:\n\n3"]}, {"persona": {"region": "Ismailia", "sex": "female", "age": 49, "country": "Egypt", "marital_status": "single", "education": "higher", "social_class": "upper middle class"}, "question": {"id": "Q78", "variant": 0}, "response": ["Based on my emic perspective as a single female from Ismailia, Egypt, who is 49 years of age and part of the upper middle class, my confidence level in private banks is quite high. This is influenced by my cultural context, which emphasizes the importance of financial stability and security. Additionally, my higher education level has provided me with a strong understanding of the banking system and the benefits of using private banks. My socioeconomic background also plays a role, as I have the means to invest and trust in private banks for my financial needs. Overall, my personal experience and values, along with my cultural relativism, lead me to have a great deal of confidence in private banks.\n\n2"]}, {"persona": {"region": "Ismailia", "sex": "female", "age": 35, "country": "Egypt", "marital_status": "married", "education": "higher", "social_class": "lower middle class"}, "question": {"id": "Q78", "variant": 0}, "response": ["Based on my cultural context as a married female from Ismailia, Egypt, my socioeconomic background as part of the lower middle class, and my individual values and personal experience, I would rate my confidence level in private banks as quite a lot (2). In my community, private banks are often seen as a reliable and trustworthy option for managing finances, especially for those who have completed higher education and are looking to secure their financial future. Additionally, my age and place in society have also influenced my perspective on private banks, as I have seen them play a positive role in the lives of my peers and family members."]}, {"persona": {"region": "Ismailia", "sex": "male", "age": 24, "country": "Egypt", "marital_status": "single", "education": "higher", "social_class": "upper middle class"}, "question": {"id": "Q78", "variant": 0}, "response": ["Based on the anthropological framework, as a single male from Ismailia, Egypt, at the age of 24 with a higher education level and considering myself part of the upper middle class, my answer to the question about confidence in private banks would be heavily influenced by my individual values and personal experiences. Growing up in a family with a higher socioeconomic background, I have been exposed to the benefits and reliability of private banks. Additionally, the cultural context of Egypt, where private banks are seen as a symbol of financial stability and success, would also influence my confidence in them. Therefore, my answer would be 1) A great deal."]}, {"persona": {"region": "Ismailia", "sex": "female", "age": 23, "country": "Egypt", "marital_status": "single", "education": "higher", "social_class": "lower middle class"}, "question": {"id": "Q78", "variant": 0}, "response": ["Based on my individual values and personal experience, as a 23-year-old single female from Ismailia, Egypt, who considers herself part of the lower middle class, my confidence level in private banks would be not very much. This is influenced by my socioeconomic background, as I may have limited experience with private banks and therefore not have a high level of confidence in them. Additionally, cultural context plays a role as well, as private banks may not be as accessible or familiar to someone from my background. Finally, the nuance of the question also factors in, as the wording of the question may lead me to lean towards a lower confidence level. \n\n3"]}, {"persona": {"region": "Ismailia", "sex": "male", "age": 55, "country": "Egypt", "marital_status": "married", "education": "middle", "social_class": "lower middle class"}, "question": {"id": "Q78", "variant": 0}, "response": ["Based on the anthropological framework, my emic perspective as a married male from Ismailia, Egypt, dictates that my cultural context, individual values, and personal experience play a significant role in influencing my confidence level in private banks. Being part of the lower middle class, my socioeconomic background also factors in as it affects my access to and experience with private banks. Additionally, my age and education level contribute to my understanding of private banking. Therefore, considering all these factors, my confidence level in private banks would likely be \"Not very much\" (3)."]}, {"persona": {"region": "Ismailia", "sex": "male", "age": 57, "country": "Egypt", "marital_status": "married", "education": "middle", "social_class": "upper middle class"}, "question": {"id": "Q78", "variant": 0}, "response": ["Based on the anthropological framework, my perspective as a married male from Ismailia, Egypt, at the age of 57, with a middle education level and considering myself part of the upper middle class, is heavily influenced by my cultural context, socioeconomic background, and personal experience. In Egypt, the banking system has gone through significant changes in recent years, with the privatization of many banks and the introduction of new financial products and services. As a member of the upper middle class, I have likely had more exposure to private banks and may have more trust in their services due to my socioeconomic background. However, my age and cultural context also play a role in shaping my perceptions, as older individuals in Egypt may have more traditional views on banking and may be more hesitant to trust private banks. Therefore, my confidence level in private banks may be influenced by a combination of factors, including my personal experience with the banking system and my cultural and socioeconomic context.\n\n2"]}, {"persona": {"region": "Ismailia", "sex": "female", "age": 29, "country": "Egypt", "marital_status": "married", "education": "middle", "social_class": "upper middle class"}, "question": {"id": "Q78", "variant": 0}, "response": ["Based on the anthropological framework outlined, as a married female from Ismailia, Egypt, with a middle education level and part of the upper middle class, my perspective on private banks would be influenced by my cultural context, individual values, and socioeconomic background. In Egypt, private banks may be seen as a symbol of financial security and stability, particularly for those in the upper middle class. My personal experience and values would also play a role in shaping my confidence level in private banks, as I may have had positive experiences with them or have been taught to value financial institutions. Additionally, my socioeconomic background would likely lead me to have a greater level of confidence in private banks, as they may have been accessible and beneficial to individuals in my social and economic position. Therefore, I would rate my confidence level in private banks as: \n\n2) Quite a lot"]}, {"persona": {"region": "Damiatta", "sex": "female", "age": 46, "country": "Egypt", "marital_status": "married", "education": "middle", "social_class": "lower middle class"}, "question": {"id": "Q78", "variant": 0}, "response": ["Based on the anthropological framework, my perspective as a married female from Damiatta, Egypt, who is 46 years old, has completed middle education, and considers herself part of the lower middle class, is heavily influenced by cultural context, individual values, and socioeconomic background. In my community, private banks may not be as accessible or trustworthy as they are in more affluent areas. Additionally, my lower middle class status may mean that I have limited experience or exposure to private banks, leading to a lack of confidence in them. Cultural relativism also plays a role, as my perception of private banks may differ from that of someone in a different cultural and socioeconomic context. Therefore, my confidence level in private banks would likely be not very much. \n\n3"]}, {"persona": {"region": "Damiatta", "sex": "female", "age": 20, "country": "Egypt", "marital_status": "single", "education": "middle", "social_class": "lower middle class"}, "question": {"id": "Q78", "variant": 0}, "response": ["Based on the anthropological framework, my emic perspective as a single female from Damiatta, Egypt, who has completed middle education and considers herself part of the lower middle class, is heavily influenced by my cultural context, individual values, and socioeconomic background. In my cultural context, the concept of private banks may not be as familiar or accessible to someone from my background compared to those from higher socioeconomic classes. Additionally, my individual values may lead me to be more cautious and less trusting of institutions like private banks, as they may not align with my personal experiences and values. Therefore, considering my cultural relativism, socioeconomic background, and personal experience, my confidence level in private banks would be \"Not very much\" (3) as I may not have much exposure or positive experiences with them. \n\n3"]}, {"persona": {"region": "Damiatta", "sex": "male", "age": 19, "country": "Egypt", "marital_status": "single", "education": "middle", "social_class": "lower middle class"}, "question": {"id": "Q78", "variant": 0}, "response": ["Based on the anthropological framework, my emic perspective as a lower middle class individual from Damiatta, Egypt heavily influences my confidence level in private banks. My cultural context and socioeconomic background have shaped my perception of private banks, as they may not have been easily accessible or catered to individuals from my socioeconomic background. Additionally, my individual values and personal experience play a significant role in my level of confidence, as I may have had limited exposure or positive experiences with private banks. Furthermore, my age and education level also impact my understanding and perception of private banks, as I may not have had the opportunity to fully comprehend their functioning or benefits. Therefore, my chosen answer is:\n3"]}, {"persona": {"region": "Damiatta", "sex": "female", "age": 33, "country": "Egypt", "marital_status": "married", "education": "higher", "social_class": "lower middle class"}, "question": {"id": "Q78", "variant": 0}, "response": ["Based on the anthropological framework, as a married female from Damiatta, Egypt, my emic perspective is heavily influenced by my cultural context, individual values, and socioeconomic background. In Damiatta, private banks may not be as accessible to those in the lower middle class, and my personal experience with banking may not have been favorable due to limited financial resources. Additionally, cultural relativism plays a role in shaping my perception of private banks as I may have been taught to be cautious of financial institutions. Therefore, based on my nuanced understanding of the question and my personal background, I would rate my confidence level in private banks as (3) Not very much."]}, {"persona": {"region": "Damiatta", "sex": "male", "age": 24, "country": "Egypt", "marital_status": "single", "education": "higher", "social_class": "lower middle class"}, "question": {"id": "Q78", "variant": 0}, "response": ["Based on my individual values and personal experience, as well as my socioeconomic background as a lower middle class individual from Damiatta, Egypt, I would rate my confidence level in private banks as not very much. My family's financial situation has always made me cautious about trusting financial institutions, and I have heard stories from my community about people losing their savings due to the instability of private banks. Additionally, the cultural context in Egypt often leads to skepticism of private banks, as there is a preference for more traditional and familiar methods of saving and investing. Overall, my age, place, and socioeconomic background all contribute to my lack of confidence in private banks.\n\n3"]}, {"persona": {"region": "Suez", "sex": "male", "age": 41, "country": "Egypt", "marital_status": "married", "education": "middle", "social_class": "working class"}, "question": {"id": "Q78", "variant": 0}, "response": ["Based on the anthropological framework, my response is influenced by my cultural context in Suez, Egypt, where private banks may not be as accessible or trusted as in other regions. My individual values and personal experience also play a role, as my middle education level and working-class background may have limited my exposure to private banks. Additionally, my socioeconomic background as part of the working class also influences my perception of private banks. Overall, my response is shaped by the cultural relativism of my community and my nuanced understanding of the question.\n\n3"]}, {"persona": {"region": "Suez", "sex": "female", "age": 39, "country": "Egypt", "marital_status": "divorced", "education": "middle", "social_class": "working class"}, "question": {"id": "Q78", "variant": 0}, "response": ["Based on the anthropological framework, my emic perspective as a divorced female from Suez, Egypt, at 39 years of age and part of the working class, is heavily influenced by my cultural context, individual values, and socioeconomic background. In Egypt, private banks are often associated with the upper class and are not easily accessible for individuals like myself. Additionally, my personal experience and values have shaped my perception of private banks, leading me to have limited confidence in them due to the lack of familiarity and accessibility. Therefore, I would rate my confidence level in private banks as (3) Not very much."]}, {"persona": {"region": "Cairo", "sex": "female", "age": 55, "country": "Egypt", "marital_status": "married", "education": "middle", "social_class": "working class"}, "question": {"id": "Q78", "variant": 0}, "response": ["Based on the anthropological framework, my emic perspective as a married female from Cairo, Egypt, is influenced by my cultural context, individual values, and socioeconomic background. In Egypt, the cultural context and socioeconomic background play a significant role in how people perceive and interact with private banks. As a member of the working class with a middle education level, I have limited exposure and access to private banking services. Therefore, my personal experience and values lead me to have a low confidence level in private banks. Additionally, cultural relativism teaches me to be cautious and skeptical of institutions that cater to the wealthy and elite, as they may not prioritize the needs and interests of individuals like me. \n\n3"]}, {"persona": {"region": "Cairo", "sex": "male", "age": 58, "country": "Egypt", "marital_status": "married", "education": "middle", "social_class": "lower middle class"}, "question": {"id": "Q78", "variant": 0}, "response": ["Based on the emic and etic perspectives, as a married male from Cairo, Egypt, my in-group perspective on private banks may differ from an out-group perspective. The cultural context of Egypt, including my socioeconomic background as part of the lower middle class, will heavily influence my confidence level in private banks. My individual values and personal experience, as well as the cultural relativism of Egypt, will also play a significant role. Additionally, my age and place, being 58 years old and residing in Cairo, will further shape my perspective. Taking into account all these factors, I would rate my confidence level in private banks as:\n3\n\n(Note: The chosen option reflects the lower middle class persona's perspective on private banks in Egypt, taking into account the cultural and socioeconomic factors that influence their views.)"]}, {"persona": {"region": "Cairo", "sex": "female", "age": 29, "country": "Egypt", "marital_status": "married", "education": "higher", "social_class": "lower middle class"}, "question": {"id": "Q78", "variant": 0}, "response": ["Based on the anthropological framework, as a married female from Cairo, Egypt, my emic perspective on private banks is influenced by my cultural context, individual values, and socioeconomic background. In Egypt, there is a strong emphasis on family and community ties, and trust in financial institutions may be influenced by cultural norms and personal experiences. As a member of the lower middle class, my access to and experience with private banks may be limited compared to those of higher socioeconomic status. Additionally, my higher education level may have provided me with some knowledge about financial institutions, but my confidence level in private banks may still be influenced by my social and economic position. Therefore, my rating of confidence in private banks would be influenced by these factors, and I would choose option (3) Not very much. \n\n3"]}, {"persona": {"region": "Cairo", "sex": "male", "age": 38, "country": "Egypt", "marital_status": "married", "education": "higher", "social_class": "lower middle class"}, "question": {"id": "Q78", "variant": 0}, "response": ["Based on the anthropological framework, my perspective as a married male from Cairo, Egypt, with a lower middle-class socioeconomic background, is crucial in understanding and answering the question. My personal experience and individual values play a significant role in shaping my perception of private banks. Additionally, cultural context, including the economic and social status of my community, influences my confidence level in private banks. As a member of the lower middle class in Cairo, I have limited exposure to and trust in private banks due to the socioeconomic barriers that exist in accessing their services. Therefore, my confidence level in private banks is not very much (3)."]}, {"persona": {"region": "Cairo", "sex": "female", "age": 40, "country": "Egypt", "marital_status": "married", "education": "higher", "social_class": "lower middle class"}, "question": {"id": "Q78", "variant": 0}, "response": ["Based on the anthropological framework, as a married female from Cairo, Egypt, age 40, and part of the lower middle class, my emic perspective would be heavily influenced by my cultural context, individual values, and socioeconomic background. In Egypt, access to private banking services may be limited for individuals from the lower middle class, and my personal experience and values may lead me to have a lower level of confidence in private banks due to potential financial barriers. Additionally, cultural relativism is important to consider, as the perception of private banks may differ from Western perspectives. Therefore, my confidence level in private banks would be influenced by my nuanced understanding of the financial landscape in Egypt and the limitations I may face due to my socioeconomic background.\n\n3"]}, {"persona": {"region": "Cairo", "sex": "male", "age": 38, "country": "Egypt", "marital_status": "married", "education": "higher", "social_class": "upper middle class"}, "question": {"id": "Q78", "variant": 0}, "response": ["Based on the anthropological framework, as a married male from Cairo, Egypt, who is 38 years old and part of the upper middle class, my emic perspective on private banks is influenced by my cultural context, individual values, and socioeconomic background. In Egypt, private banks are often associated with more affluent individuals and are seen as a symbol of financial success and stability. As someone who has completed higher education and considers themselves part of the upper middle class, I have likely had positive experiences with private banks and have been exposed to the benefits they offer. Additionally, my socioeconomic background may have afforded me the opportunity to utilize private banking services, further increasing my confidence in them. Therefore, my perspective on private banks is likely to be one of great confidence, reflecting the positive associations and experiences I have had with them.\n\n1"]}, {"persona": {"region": "Cairo", "sex": "male", "age": 59, "country": "Egypt", "marital_status": "married", "education": "middle", "social_class": "lower middle class"}, "question": {"id": "Q78", "variant": 0}, "response": ["Based on the anthropological framework, my perspective as a married male from Cairo, Egypt, with a middle education level and lower middle class background is influenced by my cultural context, individual values, and socioeconomic background. In Egypt, the banking system is often viewed with skepticism and mistrust, especially among those in the lower middle class who may have had negative experiences with banks or lack confidence in the stability of the financial system. Additionally, my age and socioeconomic background may also lead me to have limited exposure to private banks and therefore limited confidence in them. Therefore, my confidence level in private banks would be (3) Not very much."]}, {"persona": {"region": "Cairo", "sex": "female", "age": 30, "country": "Egypt", "marital_status": "married", "education": "higher", "social_class": "upper middle class"}, "question": {"id": "Q78", "variant": 0}, "response": ["Based on the anthropological framework, as a married female from Cairo, Egypt, who is 30 years old and part of the upper middle class, my emic perspective on private banks would be influenced by my cultural context, individual values, and socioeconomic background. In Egypt, the banking sector is seen as stable and reliable, and as someone from the upper middle class, I would likely have positive personal experiences with private banks and hold a high level of confidence in them. Additionally, my higher education level would have provided me with the knowledge and understanding to make informed decisions about financial institutions. Therefore, I would rate my confidence level in private banks as a great deal.\n\n1"]}, {"persona": {"region": "Cairo", "sex": "male", "age": 22, "country": "Egypt", "marital_status": "single", "education": "middle", "social_class": "lower middle class"}, "question": {"id": "Q78", "variant": 0}, "response": ["Based on the anthropological framework, my perspective is heavily influenced by my cultural context, individual values, and socioeconomic background. Growing up in Cairo, Egypt, I have been exposed to a lower middle-class lifestyle and have only completed middle education. This has shaped my perception of private banks as I have had limited exposure to their services and may not have the financial resources to access them. Additionally, my cultural context and socioeconomic background may have instilled a level of skepticism or lack of confidence in private banks due to potential financial barriers. Given these factors, my confidence level in private banks would likely be quite low. \n\n3"]}, {"persona": {"region": "Cairo", "sex": "male", "age": 29, "country": "Egypt", "marital_status": "single", "education": "higher", "social_class": "lower middle class"}, "question": {"id": "Q78", "variant": 0}, "response": ["Based on the anthropological framework, my emic perspective as a single male from Cairo, Egypt, who is 29 years old and part of the lower middle class, is heavily influenced by my cultural context, individual values, and socioeconomic background. In Egypt, private banks are often seen as institutions catering to the upper class and foreign investors, which may lead to a lower level of trust and confidence among individuals from lower socioeconomic backgrounds. Additionally, my personal experience and values play a significant role in shaping my perception of private banks, as I may have had limited exposure to or negative experiences with these institutions. Considering the cultural relativism aspect, the perception of private banks may vary greatly across different socioeconomic classes and cultural contexts within Egypt. Therefore, based on these factors, my confidence level in private banks would be lower. \n\n3"]}, {"persona": {"region": "Cairo", "sex": "female", "age": 31, "country": "Egypt", "marital_status": "married", "education": "higher", "social_class": "lower middle class"}, "question": {"id": "Q78", "variant": 0}, "response": ["Based on the anthropological framework, my perspective as a married female from Cairo, Egypt, at the age of 31 and belonging to the lower middle class, is influenced by my cultural context, individual values, and socioeconomic background. In Cairo, access to private banks is often limited for individuals from lower socioeconomic backgrounds, and the cultural context emphasizes the importance of community and family support over institutionalized financial systems. Additionally, my personal experience and values lead me to prioritize saving and investing in ways that are more familiar and accessible to me, such as through informal savings groups or community-based financial initiatives. Therefore, my confidence level in private banks is not very much. \n\n3"]}, {"persona": {"region": "Cairo", "sex": "male", "age": 59, "country": "Egypt", "marital_status": "married", "education": "higher", "social_class": "upper middle class"}, "question": {"id": "Q78", "variant": 0}, "response": ["Based on the anthropological framework, as a married male from Cairo, Egypt, with a higher education level and part of the upper middle class, my emic perspective on private banks is likely to be influenced by my cultural context, individual values, and socioeconomic background. In Egypt, private banks are often associated with serving the needs of the affluent and financially savvy individuals, which aligns with my socioeconomic status and education level. Additionally, my personal experience and values may lead me to have a great deal of confidence in private banks due to the perceived stability and reliability they offer, especially for someone in my position. Furthermore, my age and place of residence in Cairo would expose me to a certain level of exposure and familiarity with private banking services, further influencing my confidence level in them. Therefore, I would choose option (1) A great deal. \n\n1"]}, {"persona": {"region": "Cairo", "sex": "male", "age": 27, "country": "Egypt", "marital_status": "single", "education": "middle", "social_class": "working class"}, "question": {"id": "Q78", "variant": 0}, "response": ["Based on the anthropological framework, my emic perspective as a single male from Cairo, Egypt, at the age of 27, who has completed middle education and considers himself part of the working class, is heavily influenced by my cultural context, socioeconomic background, and personal experience. In Egypt, private banks are not widely trusted by the working class due to a history of economic instability and corruption. Additionally, my personal experience and lack of high education may contribute to a lower level of confidence in private banks. Therefore, I would likely rate my confidence level in private banks as (3) Not very much."]}, {"persona": {"region": "Cairo", "sex": "female", "age": 25, "country": "Egypt", "marital_status": "single", "education": "higher", "social_class": "working class"}, "question": {"id": "Q78", "variant": 0}, "response": ["Based on the anthropological framework, as a single female from Cairo, Egypt, my emic perspective is influenced by my cultural context, individual values, socioeconomic background, and space and time. In Cairo, the cultural context and socioeconomic background play a significant role in my perception of private banks. As a working-class individual who has completed higher education, my personal experience and values lead me to have a moderate level of confidence in private banks. Additionally, as a 25-year-old, I am aware of the nuances and factors that influence the functioning of private banks in Egypt. Therefore, I select option (2) Quite a lot."]}, {"persona": {"region": "Cairo", "sex": "female", "age": 23, "country": "Egypt", "marital_status": "married", "education": "higher", "social_class": "lower middle class"}, "question": {"id": "Q78", "variant": 0}, "response": ["Based on the anthropological framework, my emic perspective as a married female from Cairo, Egypt, who is 23 years old and part of the lower middle class, is influenced by my cultural context, individual values, and socioeconomic background. In Cairo, private banks are often seen as institutions for the wealthy and not easily accessible for those in the lower middle class. Additionally, my personal experience and values lead me to have limited confidence in private banks due to the lack of trust and accessibility for individuals like myself. Therefore, my rating of confidence in private banks would be: \n\n3) Not very much"]}, {"persona": {"region": "Cairo", "sex": "male", "age": 58, "country": "Egypt", "marital_status": "married", "education": "higher", "social_class": "working class"}, "question": {"id": "Q78", "variant": 0}, "response": ["Based on the anthropological framework, my perspective as a married male from Cairo, Egypt, at 58 years of age, with a working-class background and higher education, is heavily influenced by my cultural context, socioeconomic background, and personal experience. In Egypt, private banks are often seen as institutions primarily serving the wealthy, and there is a general lack of trust in their operations. Additionally, as a member of the working class, I am likely to have less exposure to and confidence in private banks compared to those in higher income brackets. This, combined with my personal experience and cultural context, leads me to have a low confidence level in private banks.\n\n3"]}, {"persona": {"region": "Cairo", "sex": "female", "age": 40, "country": "Egypt", "marital_status": "married", "education": "higher", "social_class": "working class"}, "question": {"id": "Q78", "variant": 0}, "response": ["Based on the anthropological framework, as a married female from Cairo, Egypt, my emic perspective on private banks is influenced by my cultural context, individual values, and socioeconomic background. In Cairo, private banks are often associated with the upper class and may not be accessible or relevant to the working class. Additionally, my personal experience and values may lead me to have limited confidence in private banks due to factors such as lack of trust, limited financial resources, and potential barriers to access. Therefore, my rating of confidence in private banks would likely be low, reflecting my nuanced understanding of the role of private banks in my cultural and socioeconomic context.\n\n3"]}, {"persona": {"region": "Cairo", "sex": "female", "age": 36, "country": "Egypt", "marital_status": "married", "education": "middle", "social_class": "upper middle class"}, "question": {"id": "Q78", "variant": 0}, "response": ["Based on the anthropological framework, as a 36-year-old married female from Cairo, Egypt, with a middle education level and considering myself part of the upper middle class, my perspective on private banks is influenced by my cultural context, individual values, and socioeconomic background. In Egypt, private banks are often associated with wealth and prosperity, and as someone from the upper middle class, I have had positive experiences with private banks and have been able to access their services. Additionally, my personal values and experiences have led me to have a high level of confidence in private banks, as they have provided me with financial security and stability. Therefore, my confidence level in private banks would be: \n\n2\n\nQuite a lot"]}, {"persona": {"region": "Cairo", "sex": "male", "age": 40, "country": "Egypt", "marital_status": "married", "education": "middle", "social_class": "lower middle class"}, "question": {"id": "Q78", "variant": 0}, "response": ["Based on the anthropological framework, my response to the question is heavily influenced by my cultural context, individual values, and socioeconomic background. As a married male from Cairo, Egypt, at 40 years of age, with a middle education level and considering myself part of the lower middle class, my perception of private banks is likely shaped by my experiences and values. In the cultural context of Egypt, there may be a level of skepticism towards private banks, given the economic challenges and financial instability present in the country. Additionally, my lower middle class status may mean that I have limited interaction with private banks and may not have the resources to utilize their services. Therefore, my confidence level in private banks is likely to be low, as I may not have had positive experiences with them or have the financial means to engage with their services.\n\n3"]}, {"persona": {"region": "Cairo", "sex": "female", "age": 30, "country": "Egypt", "marital_status": "married", "education": "middle", "social_class": "lower class"}, "question": {"id": "Q78", "variant": 0}, "response": ["Based on the anthropological framework, as a married female from Cairo, Egypt, with a lower socioeconomic background and middle education level, my perspective on private banks is shaped by my cultural context, individual values, and personal experience. I have limited exposure to private banking due to my lower socioeconomic background and lack of formal education, which may lead to a lack of confidence in private banks. Additionally, cultural relativism plays a role as private banks may not be as accessible or relevant to individuals in my social and economic position. Therefore, my confidence level in private banks would likely be low, as I may not have had positive experiences or interactions with them.\n\n3"]}, {"persona": {"region": "Cairo", "sex": "male", "age": 58, "country": "Egypt", "marital_status": "married", "education": "higher", "social_class": "lower middle class"}, "question": {"id": "Q78", "variant": 0}, "response": ["Based on the anthropological framework, as a married male from Cairo, Egypt, my emic perspective on private banks is shaped by my cultural context, individual values, and socioeconomic background. In Egypt, private banks are often associated with the upper class and are not easily accessible to those in the lower middle class. Therefore, my confidence in private banks is not very high, as I perceive them to be catering to a different socioeconomic group. Additionally, my personal experience and values lead me to prioritize more traditional and familiar forms of banking, such as state-owned banks or informal savings groups within my community. My age and place also play a role in shaping my perception, as I have not had significant exposure to private banks in my lifetime. Therefore, I would rate my confidence level in private banks as (3) Not very much."]}, {"persona": {"region": "Cairo", "sex": "male", "age": 50, "country": "Egypt", "marital_status": "married", "education": "middle", "social_class": "lower middle class"}, "question": {"id": "Q78", "variant": 0}, "response": ["Based on the anthropological framework, as a married male from Cairo, Egypt, with a middle education level and lower middle-class background, my perspective on private banks would be heavily influenced by my socioeconomic background and cultural context. In Egypt, private banks are often associated with wealthier individuals or foreign investors, and there may be a lack of trust in their services due to past economic instability and corruption. Additionally, my age and level of education may contribute to a more conservative approach to financial institutions. Therefore, my confidence level in private banks would be \"Not very much\" as it aligns with my personal experience and cultural context. \n\n3"]}, {"persona": {"region": "Cairo", "sex": "female", "age": 40, "country": "Egypt", "marital_status": "married", "education": "higher", "social_class": "upper middle class"}, "question": {"id": "Q78", "variant": 0}, "response": ["Based on the anthropological framework, as a married female from Cairo, Egypt, my emic perspective is influenced by my cultural context, individual values, and socioeconomic background. In Egypt, the perception of private banks varies greatly depending on one's socioeconomic status. As a member of the upper middle class with a higher education level, I have likely been exposed to and have had positive experiences with private banks. Additionally, my personal experience and individual values may lead me to have a higher level of confidence in private banks due to the stability and security they provide. Therefore, my rating of confidence in private banks would be higher compared to someone from a lower socioeconomic background or with less education. \n\n2"]}, {"persona": {"region": "Cairo", "sex": "female", "age": 33, "country": "Egypt", "marital_status": "married", "education": "middle", "social_class": "lower middle class"}, "question": {"id": "Q78", "variant": 0}, "response": ["Based on the anthropological framework, as a married female from Cairo, Egypt, who completed middle education level and considers myself part of the lower middle class, my perspective on private banks is influenced by my cultural context, individual values, and socioeconomic background. In Egypt, the banking system is heavily influenced by the government and there is a lack of trust in private banks due to past economic instability and corruption. Additionally, being part of the lower middle class, I may not have had positive experiences with private banks and may have limited access to financial resources. Therefore, my confidence level in private banks would be quite low, as I would not have a great deal of trust in their services and ability to meet my financial needs.\n\n3"]}, {"persona": {"region": "Cairo", "sex": "female", "age": 37, "country": "Egypt", "marital_status": "married", "education": "middle", "social_class": "lower middle class"}, "question": {"id": "Q78", "variant": 0}, "response": ["Based on the anthropological framework, as a married female from Cairo, Egypt, my emic perspective on private banks is influenced by my cultural context, individual values, and socioeconomic background. In Egypt, the banking system is largely dominated by state-owned banks, and as a member of the lower middle class, my access to and trust in private banks may be limited. Additionally, my personal experience and values may lead me to be skeptical of private banks due to concerns about security and potential exploitation. Therefore, my confidence level in private banks is likely to be \"Not very much\" as a result of these factors.\n\n3"]}, {"persona": {"region": "Cairo", "sex": "male", "age": 28, "country": "Egypt", "marital_status": "married", "education": "middle", "social_class": "lower middle class"}, "question": {"id": "Q78", "variant": 0}, "response": ["Based on my personal experience and socioeconomic background, I have had limited exposure to private banks. As someone from the lower middle class in Cairo, Egypt, my access to financial resources and institutions has been fairly limited. I am also influenced by the cultural context and values of my community, where there is a general perception that private banks may not be as trustworthy or accessible as other financial institutions. Additionally, my age and education level also play a role in shaping my confidence level in private banks. Therefore, I would rate my confidence level in private banks as:\n3. Not very much"]}, {"persona": {"region": "Cairo", "sex": "male", "age": 53, "country": "Egypt", "marital_status": "married", "education": "higher", "social_class": "working class"}, "question": {"id": "Q78", "variant": 0}, "response": ["Based on the anthropological framework, my perspective as a married male from Cairo, Egypt, who is 53 years old and part of the working class, is heavily influenced by my cultural context, individual values, and socioeconomic background. In Egypt, there is a strong emphasis on community and familial ties, and my personal experience and values are shaped by this. Additionally, my socioeconomic background as a working-class individual affects my perception of private banks, as access and trust in financial institutions may vary based on income and social status. Therefore, my confidence level in private banks is likely to be influenced by these factors.\n\n2"]}, {"persona": {"region": "Cairo", "sex": "male", "age": 45, "country": "Egypt", "marital_status": "married", "education": "higher", "social_class": "lower middle class"}, "question": {"id": "Q78", "variant": 0}, "response": ["Based on the anthropological framework, my perspective as a married male from Cairo, Egypt, who is 45 years old, has completed higher education, and considers myself part of the lower middle class, will be influenced by various factors. The cultural context in Egypt may lead me to have a certain level of trust or distrust in private banks, especially given the country's history of economic instability. My individual values and personal experience, along with my socioeconomic background, will also play a significant role in shaping my confidence level in private banks. Additionally, the nuance of the question and the specific phrasing will also impact my response. \n\n2"]}, {"persona": {"region": "Cairo", "sex": "male", "age": 52, "country": "Egypt", "marital_status": "married", "education": "middle", "social_class": "upper middle class"}, "question": {"id": "Q78", "variant": 0}, "response": ["Based on the anthropological framework, as a married male from Cairo, Egypt, I would consider my confidence level in private banks to be quite high. This is influenced by my cultural context, where the use of private banks is common among individuals of my socioeconomic background. Additionally, my individual values and personal experience play a role in my confidence level, as I have had positive experiences with private banks in the past. Furthermore, my age and socioeconomic background also contribute to my trust in private banks, as they are often associated with stability and reliability in my community.\n\n2"]}, {"persona": {"region": "Cairo", "sex": "male", "age": 22, "country": "Egypt", "marital_status": "single", "education": "higher", "social_class": "lower middle class"}, "question": {"id": "Q78", "variant": 0}, "response": ["From the emic perspective, as a young man from Cairo, Egypt, I have grown up in a cultural context where the idea of private banks is not as prevalent as in other parts of the world. My family's socioeconomic background has always been in the lower middle class, and I have been taught to be cautious with my finances. While I have completed higher education, the cultural relativism within my community has always emphasized the importance of traditional banking and savings methods. Therefore, my individual values and personal experience have led me to not have a great deal of confidence in private banks. Additionally, the nuance of the question and my socioeconomic background have further reinforced this perspective.\n\n3"]}, {"persona": {"region": "Cairo", "sex": "female", "age": 57, "country": "Egypt", "marital_status": "divorced", "education": "middle", "social_class": "lower middle class"}, "question": {"id": "Q78", "variant": 0}, "response": ["Based on the anthropological framework, as a divorced female from Cairo, Egypt, my emic perspective would be influenced by my personal experience and individual values, as well as my socioeconomic background and cultural context. As a member of the lower middle class, my trust in private banks may be influenced by my limited access to financial resources and my experiences with the banking system. Additionally, cultural relativism is important to consider, as perceptions of private banks may be shaped by societal norms and values regarding financial institutions. Therefore, my confidence level in private banks may not be very high, as my personal and cultural context may lead me to approach the question with caution and skepticism.\n\n3"]}, {"persona": {"region": "Cairo", "sex": "female", "age": 42, "country": "Egypt", "marital_status": "married", "education": "middle", "social_class": "working class"}, "question": {"id": "Q78", "variant": 0}, "response": ["Based on the anthropological framework, as a married female from Cairo, Egypt, with a middle education level and part of the working class, my emic perspective is heavily influenced by my cultural context, individual values, and socioeconomic background. In Egypt, private banks are often associated with the upper class and the elite, and as a member of the working class, I may not have had much exposure or experience with private banks. Additionally, my cultural relativism may lead me to have a more skeptical view of private banks, as there may be a general mistrust of financial institutions. Therefore, my confidence level in private banks would be (3) Not very much."]}, {"persona": {"region": "Cairo", "sex": "female", "age": 23, "country": "Egypt", "marital_status": "single", "education": "middle", "social_class": "lower middle class"}, "question": {"id": "Q78", "variant": 0}, "response": ["Based on the anthropological framework, as a single female from Cairo, Egypt, my emic perspective on private banks would be influenced by my cultural context, individual values, and socioeconomic background. Being part of the lower middle class, I may have limited exposure to private banks and may not have the same level of trust in them as someone from a higher socioeconomic background. Additionally, my personal experience and the cultural relativism of my community may shape my perception of private banks. Given these factors, I would rate my confidence level in private banks as (3) Not very much."]}, {"persona": {"region": "Cairo", "sex": "female", "age": 28, "country": "Egypt", "marital_status": "married", "education": "higher", "social_class": "upper middle class"}, "question": {"id": "Q78", "variant": 0}, "response": ["Based on the anthropological framework, as a married female from Cairo, Egypt, my emic perspective would be influenced by my cultural context, individual values, and socioeconomic background. In Egypt, the perception of private banks may vary based on one's socioeconomic status and personal experiences with financial institutions. As part of the upper middle class and having completed higher education, I likely have more exposure to and understanding of private banks, which may lead to a higher confidence level in their services. Additionally, my cultural context would play a role in this rating, as the perception of private banks in Egypt may differ from other cultures. Therefore, my confidence level in private banks would be influenced by my background and experiences, leading me to rate it as (2) Quite a lot. \n\n2"]}, {"persona": {"region": "Cairo", "sex": "female", "age": 22, "country": "Egypt", "marital_status": "single", "education": "higher", "social_class": "lower middle class"}, "question": {"id": "Q78", "variant": 0}, "response": ["Based on the anthropological framework, as a single female from Cairo, Egypt, I would consider my confidence level in private banks to be influenced by my cultural context, socioeconomic background, and personal experience. Coming from a lower middle class background, I have limited exposure and access to private banks, which may affect my confidence level. Additionally, as a young woman who has completed higher education, I may have a more critical perspective on financial institutions and their practices. Therefore, I would rate my confidence level in private banks as (3) Not very much."]}, {"persona": {"region": "Cairo", "sex": "female", "age": 39, "country": "Egypt", "marital_status": "married", "education": "middle", "social_class": "lower middle class"}, "question": {"id": "Q78", "variant": 0}, "response": ["Based on the anthropological framework, my emic perspective as a married female from Cairo, Egypt, who is 39 years old and part of the lower middle class, is influenced by my cultural context, individual values, and socioeconomic background. In Egypt, there is a strong cultural emphasis on family and community support, and the banking system may not be as ingrained in our daily lives as it is in other cultures. Additionally, as part of the lower middle class, my access to and experience with private banks may be limited. Therefore, my confidence level in private banks would likely be not very much, as my personal experience and socioeconomic background would influence my perception of and trust in private banking institutions.\n\n3"]}, {"persona": {"region": "Cairo", "sex": "male", "age": 19, "country": "Egypt", "marital_status": "single", "education": "middle", "social_class": "working class"}, "question": {"id": "Q78", "variant": 0}, "response": ["Based on the anthropological framework, as a single male from Cairo, Egypt, who is 19 years old and part of the working class, my perspective on private banks is influenced by my cultural context, socioeconomic background, and personal experience. In the cultural context of Egypt, private banks may not be accessible or relevant to someone in my socioeconomic background. Additionally, as a young person who has completed only middle education, I may not have had much exposure to private banking systems. Therefore, my confidence level in private banks would likely be quite low, as I may not have had much experience with them and may not have the financial means to access their services.\n\n3"]}, {"persona": {"region": "Cairo", "sex": "female", "age": 54, "country": "Egypt", "marital_status": "married", "education": "middle", "social_class": "working class"}, "question": {"id": "Q78", "variant": 0}, "response": ["Based on the anthropological framework, my emic perspective as a married female from Cairo, Egypt, influences my understanding and answer to the question. The cultural context of Egypt, including its socioeconomic background and individual values, plays a crucial role in shaping my response. As a member of the working class with a middle education level, my confidence in private banks may be influenced by my personal experience and the cultural relativism of Egypt. Additionally, my age and place in society may also impact my perception of private banks. Therefore, my response is grounded in the nuanced understanding of the question from the perspective of a 54-year-old married female from Cairo, Egypt.\n\n3"]}, {"persona": {"region": "Cairo", "sex": "male", "age": 30, "country": "Egypt", "marital_status": "married", "education": "higher", "social_class": "working class"}, "question": {"id": "Q78", "variant": 0}, "response": ["Based on my emic perspective as a married male from Cairo, Egypt, I understand the importance of socioeconomic background in shaping my views on private banks. As part of the working class, I have limited access to financial resources and have experienced firsthand the challenges of navigating the financial system. This has influenced my confidence level in private banks, as I have had limited interactions with them and have heard mixed reviews from others in similar socioeconomic positions. Additionally, my cultural context and personal experience have also shaped my perception of private banks, leading me to have limited confidence in them. Therefore, my answer is:\n3. Not very much"]}, {"persona": {"region": "Cairo", "sex": "male", "age": 39, "country": "Egypt", "marital_status": "married", "education": "higher", "social_class": "lower middle class"}, "question": {"id": "Q78", "variant": 0}, "response": ["Based on the anthropological framework, my cultural context as a married male from Cairo, Egypt, and my lower middle-class socioeconomic background significantly impact my perception of private banks. The emic perspective from my cultural context emphasizes the importance of trust and reliability in financial institutions, which is influenced by my personal experience and individual values. Additionally, my age and education level contribute to my understanding of the role of private banks in society. Therefore, my confidence level in private banks is quite a lot.\n\n2"]}, {"persona": {"region": "Cairo", "sex": "female", "age": 41, "country": "Egypt", "marital_status": "married", "education": "middle", "social_class": "lower middle class"}, "question": {"id": "Q78", "variant": 0}, "response": ["Based on my emic perspective as a lower middle class married woman from Cairo, Egypt, my confidence level in private banks is influenced by my cultural context, individual values and personal experience, and socioeconomic background. In Egypt, private banks may not be as accessible or trustworthy for someone in my socioeconomic position. Additionally, my personal experience and values may lead me to rely more on informal financial systems or state-run banks. Therefore, I would rate my confidence level in private banks as:\n3) Not very much"]}, {"persona": {"region": "Cairo", "sex": "male", "age": 45, "country": "Syria", "marital_status": "single", "education": "higher", "social_class": "upper middle class"}, "question": {"id": "Q78", "variant": 0}, "response": ["Based on the anthropological framework, my emic perspective as a single male from Cairo, Syria, with a higher education level and belonging to the upper middle class, is that my cultural context and socioeconomic background greatly influence my perception of private banks. In my cultural context, private banks are often seen as a symbol of financial stability and success, and my socioeconomic background has afforded me the opportunity to interact with private banks on a regular basis. Additionally, my individual values and personal experience have led me to have a great deal of confidence in private banks, as they have consistently provided me with the financial services and security that I require. Therefore, based on my emic perspective, I choose option (1) A great deal."]}, {"persona": {"region": "Cairo", "sex": "male", "age": 54, "country": "Egypt", "marital_status": "married", "education": "higher", "social_class": "lower middle class"}, "question": {"id": "Q78", "variant": 0}, "response": ["Based on the anthropological framework, as a married male from Cairo, Egypt, my emic perspective on private banks is influenced by my cultural context, individual values, and socioeconomic background. In Egypt, private banks are often viewed with skepticism, especially by those in the lower middle class. The cultural context of Egypt emphasizes the importance of family and community, and many individuals in this socioeconomic class may rely more on informal financial networks and traditional banking systems. Additionally, my personal experience and values lead me to have limited confidence in private banks due to concerns about transparency, accessibility, and trustworthiness. Therefore, I would rate my confidence level in private banks as \"Not very much\" (3).\n\n3"]}, {"persona": {"region": "Cairo", "sex": "male", "age": 65, "country": "Egypt", "marital_status": "married", "education": "middle", "social_class": "upper middle class"}, "question": {"id": "Q78", "variant": 0}, "response": ["Based on the anthropological framework, my perspective as a married male from Cairo, Egypt, who is 65 years old and part of the upper middle class, is influenced by my cultural context, individual values, and socioeconomic background. In Egypt, private banks are generally seen as trustworthy and reliable institutions, especially by those in the upper middle class. My personal experience with private banks has been positive, and I value the security and convenience they offer. Additionally, my socioeconomic background has allowed me to access and benefit from the services provided by private banks. Therefore, my confidence level in private banks is quite high.\n\n2"]}, {"persona": {"region": "Cairo", "sex": "female", "age": 52, "country": "Egypt", "marital_status": "married", "education": "middle", "social_class": "upper middle class"}, "question": {"id": "Q78", "variant": 0}, "response": ["Based on the anthropological framework, my understanding of private banks is influenced by my cultural context, individual values, and socioeconomic background. In Cairo, private banks are often associated with the upper middle class and are seen as a symbol of financial success and stability. As a married woman from this social stratum, I have been exposed to the idea that private banks offer more personalized and efficient services compared to public banks, reflecting the values of financial security and convenience. Additionally, my age and education level contribute to my confidence in private banks, as I have had more exposure to financial literacy and have likely experienced the benefits of private banking services. Therefore, my confidence level in private banks is (2) Quite a lot."]}, {"persona": {"region": "Cairo", "sex": "male", "age": 26, "country": "Egypt", "marital_status": "single", "education": "higher", "social_class": "lower middle class"}, "question": {"id": "Q78", "variant": 0}, "response": ["Based on the anthropological framework, as a single male from Cairo, Egypt, my emic perspective on private banks is influenced by my socioeconomic background. Coming from the lower middle class, I have limited access to financial resources and have likely experienced barriers in engaging with private banks. This has shaped my personal experience and individual values, leading to a lower confidence level in private banks. Additionally, the cultural context in Egypt, including the prevalence of public banks and the influence of social networks, also contributes to my perspective. Therefore, I would rate my confidence level in private banks as (3) Not very much."]}, {"persona": {"region": "Cairo", "sex": "male", "age": 32, "country": "Egypt", "marital_status": "married", "education": "middle", "social_class": "working class"}, "question": {"id": "Q78", "variant": 0}, "response": ["Based on the anthropological framework, my perspective as a married male from Cairo, Egypt, at 32 years of age and part of the working class, is heavily influenced by my cultural context, socioeconomic background, and personal experience. In Egypt, private banks are often seen as institutions catering to the wealthy and elite, and as someone from the working class, I may not have had much exposure or positive experiences with them. Additionally, my cultural context may have shaped my perception of private banks as not being accessible or trustworthy for someone like me. Therefore, my confidence level in private banks may not be very high.\n\n3"]}, {"persona": {"region": "Cairo", "sex": "male", "age": 38, "country": "Egypt", "marital_status": "married", "education": "middle", "social_class": "lower middle class"}, "question": {"id": "Q78", "variant": 0}, "response": ["Based on the anthropological framework, as a married male from Cairo, Egypt, I have a lower middle-class socioeconomic background and have completed a middle education level. My cultural context and personal experience would lead me to have limited exposure to private banks and their services. My individual values and personal experience also influence my perception, and I may not have had much interaction with private banks due to my socioeconomic status. Additionally, the cultural relativism perspective reminds me that my perspective may be different from those in higher socioeconomic classes who may have more confidence in private banks. Therefore, I would rate my confidence level in private banks as (3) Not very much."]}, {"persona": {"region": "Cairo", "sex": "male", "age": 58, "country": "Egypt", "marital_status": "married", "education": "higher", "social_class": "upper middle class"}, "question": {"id": "Q78", "variant": 0}, "response": ["Based on my emic perspective as a married male from Cairo, Egypt, I have a high level of confidence in private banks. This is influenced by my cultural context and socioeconomic background as part of the upper middle class, where private banks are often seen as reliable and secure institutions for managing finances. My individual values and personal experience also play a role in shaping this confidence, as I have had positive experiences with private banks in the past. Additionally, my age and higher education level contribute to my belief in the stability and efficacy of private banks. Overall, my nuanced understanding of the financial sector in Egypt leads me to have a great deal of confidence in private banks.\n\n1"]}, {"persona": {"region": "Cairo", "sex": "male", "age": 49, "country": "Egypt", "marital_status": "married", "education": "middle", "social_class": "lower middle class"}, "question": {"id": "Q78", "variant": 0}, "response": ["Based on the anthropological framework, my emic perspective as a married male from Cairo, Egypt, at the age of 49 and belonging to the lower middle class, is influenced by my cultural context, individual values, socioeconomic background, and space and time. In Cairo, there is a strong emphasis on traditional values and a preference for personal connections and familiarity in financial matters. As someone with a middle education level and lower middle class status, I have limited exposure to private banks and rely more on informal financial networks within my community. Therefore, my confidence level in private banks would be not very much, as I am more comfortable with familiar and traditional financial systems that align with my cultural and socioeconomic background. \n\n3"]}, {"persona": {"region": "Cairo", "sex": "female", "age": 29, "country": "Egypt", "marital_status": "married", "education": "middle", "social_class": "working class"}, "question": {"id": "Q78", "variant": 0}, "response": ["Based on the anthropological framework, my emic perspective as a married female from Cairo, Egypt, who is part of the working class and has completed middle education level, is heavily influenced by my cultural context, individual values, and socioeconomic background. In Egypt, private banks are often associated with the upper class and are not easily accessible to those in the working class. Additionally, my personal experience and values may lead me to have a lower level of confidence in private banks due to the lack of familiarity and access. Therefore, my response to the question would be:\n\n3"]}, {"persona": {"region": "Cairo", "sex": "female", "age": 36, "country": "Egypt", "marital_status": "married", "education": "higher", "social_class": "lower middle class"}, "question": {"id": "Q78", "variant": 0}, "response": ["From an emic perspective, as a married female from Cairo, Egypt, my cultural context and socioeconomic background greatly influence my views on private banks. In Egypt, access to financial services is often limited for those in the lower middle class, and there is a lack of trust in private banks due to various economic and political factors. My individual values and personal experience have also shaped my perception, as I have witnessed the struggles of family and friends with private banks. Additionally, cultural relativism plays a role in my viewpoint, as there is a widespread skepticism towards private institutions in Egypt. Therefore, I would rate my confidence level in private banks as (3) Not very much."]}, {"persona": {"region": "Cairo", "sex": "female", "age": 34, "country": "Egypt", "marital_status": "married", "education": "middle", "social_class": "lower middle class"}, "question": {"id": "Q78", "variant": 0}, "response": ["Based on the anthropological framework, my perspective as a married female from Cairo, Egypt, who is 34 years old, has completed middle education, and considers herself part of the lower middle class, is influenced by several factors. My cultural context, including my socioeconomic background and personal experience, plays a significant role in shaping my views on private banks. In Egypt, private banks are often associated with the upper class and are seen as catering to their needs. As someone from the lower middle class, I may not have had much exposure to private banks and may not feel confident in their services. Additionally, cultural relativism and the nuance of the question are important; my answer will be influenced by my understanding of the role of private banks within my cultural and socioeconomic context.\n\n3"]}, {"persona": {"region": "Fayoum", "sex": "male", "age": 57, "country": "Egypt", "marital_status": "married", "education": "middle", "social_class": "working class"}, "question": {"id": "Q78", "variant": 0}, "response": ["Based on the anthropological framework, as a married male from Fayoum, Egypt, my emic perspective on private banks would be influenced by my cultural context, socioeconomic background, and personal experience. In Egypt, private banks are relatively new and may not be as accessible or trusted by individuals from the working class, like myself. Additionally, my age and education level may also play a role in shaping my confidence level in private banks. Taking into account cultural relativism and the nuanced phrasing of the question, I would rate my confidence level in private banks as (3) Not very much."]}, {"persona": {"region": "Fayoum", "sex": "male", "age": 60, "country": "Egypt", "marital_status": "married", "education": "middle", "social_class": "lower middle class"}, "question": {"id": "Q78", "variant": 0}, "response": ["Based on the anthropological framework, my emic perspective as a married male from Fayoum, Egypt at 60 years of age and with a middle education level and lower middle class background, is heavily influenced by my cultural context, individual values, and socioeconomic background. In Egypt, there is a strong sense of distrust in private banks due to past economic instability and political turmoil. Additionally, as part of the lower middle class, I may not have had much exposure or access to private banking services, leading to a lack of confidence in their reliability. Therefore, I would rate my confidence level in private banks as option (3) Not very much. \n\n3"]}, {"persona": {"region": "Fayoum", "sex": "male", "age": 21, "country": "Egypt", "marital_status": "single", "education": "middle", "social_class": "lower middle class"}, "question": {"id": "Q78", "variant": 0}, "response": ["Based on the anthropological framework, my response to the question of rating my confidence level in private banks is influenced by my individual values and personal experience, as well as my socioeconomic background and cultural context. As a 21-year-old male from Fayoum, Egypt, who has completed middle education and considers myself part of the lower middle class, my confidence in private banks is not very high. This is due to the lack of exposure and understanding of the banking system, as well as the limited financial resources available to me and my community. Additionally, the cultural context of distrust towards financial institutions and the emphasis on traditional forms of saving and investment further contributes to my lack of confidence in private banks.\n\n3\n\nThank you for your response."]}, {"persona": {"region": "Fayoum", "sex": "male", "age": 33, "country": "Egypt", "marital_status": "single", "education": "higher", "social_class": "working class"}, "question": {"id": "Q78", "variant": 0}, "response": ["Based on my emic perspective as a single male from Fayoum, Egypt, and my identification with the working class, my confidence level in private banks is influenced by my cultural context, individual values, and socioeconomic background. In Egypt, private banks are often associated with the upper class and may not be accessible or trustworthy to someone from my background. Additionally, my personal experience and values lead me to prioritize community-based financial systems and mistrust institutions that cater primarily to the wealthy. Therefore, my confidence level in private banks is not very much.\n\n3"]}, {"persona": {"region": "Fayoum", "sex": "male", "age": 32, "country": "Egypt", "marital_status": "married", "education": "higher", "social_class": "lower middle class"}, "question": {"id": "Q78", "variant": 0}, "response": ["Based on the anthropological framework, as a married male from Fayoum, Egypt, my emic perspective on private banks is influenced by my cultural context, individual values, and socioeconomic background. In Egypt, private banks are often associated with the upper class and are viewed with skepticism by those in the lower middle class, like myself. My personal experience and values also play a significant role in my lack of confidence in private banks, as I have seen friends and family members struggle with high fees and inaccessible services. Additionally, my socioeconomic background has made me wary of institutions that are perceived as serving the interests of the wealthy. Therefore, based on my perspective, I would rate my confidence level in private banks as: \n\n3) Not very much"]}, {"persona": {"region": "Gharbia", "sex": "male", "age": 42, "country": "Egypt", "marital_status": "married", "education": "higher", "social_class": "upper middle class"}, "question": {"id": "Q78", "variant": 0}, "response": ["Based on my emic perspective as a married male from Gharbia, Egypt, my confidence level in private banks is influenced by my cultural context, individual values, and socioeconomic background. In my cultural context, private banks may not have a long history or strong presence, and my individual values place a high emphasis on financial security and stability. As part of the upper middle class, I have likely had positive personal experiences with private banks and have the means to access their services. Therefore, my confidence level in private banks would be quite high, as I believe they provide a reliable and secure financial option in my socioeconomic position.\n\n2"]}, {"persona": {"region": "Gharbia", "sex": "male", "age": 52, "country": "Egypt", "marital_status": "married", "education": "middle", "social_class": "working class"}, "question": {"id": "Q78", "variant": 0}, "response": ["Based on the anthropological framework, as a married male from Gharbia, Egypt, my emic perspective on private banks is likely to be influenced by my cultural context, individual values, and socioeconomic background. In Egypt, private banks may not be as accessible or trusted by those in the working class, such as myself. Additionally, my middle education level may not have provided me with enough exposure or understanding of the benefits of private banks. Given these factors, I would rate my confidence level in private banks as (3) Not very much."]}, {"persona": {"region": "Gharbia", "sex": "male", "age": 45, "country": "Egypt", "marital_status": "divorced", "education": "higher", "social_class": "upper middle class"}, "question": {"id": "Q78", "variant": 0}, "response": ["Based on my emic perspective as a divorced male from Gharbia, Egypt, who has completed higher education and considers himself part of the upper middle class, my confidence in private banks is influenced by my individual values and personal experience. My socioeconomic background also plays a role in this, as I have the financial means to interact with private banks. Additionally, the cultural context in Egypt, including the historical and contemporary relationship between private banks and the population, shapes my perception. Therefore, I would rate my confidence level in private banks as: \n\n2\n\nQuite a lot"]}, {"persona": {"region": "Behaira", "sex": "male", "age": 23, "country": "Egypt", "marital_status": "single", "education": "middle", "social_class": "lower class"}, "question": {"id": "Q78", "variant": 0}, "response": ["Based on my emic perspective as a member of the lower class in Behaira, Egypt, my confidence level in private banks is not very high. My cultural context and socioeconomic background have led me to have limited exposure and access to private banking services. Additionally, my individual values and personal experience have shaped my perception of private banks as institutions that cater more to the wealthy and elite, rather than to individuals like myself. Furthermore, cultural relativism and nuance play a role in my understanding of private banks, as I see them as entities that may not prioritize the needs and concerns of people from my background. Therefore, my confidence level in private banks is not very much.\n\n3"]}, {"persona": {"region": "Behaira", "sex": "male", "age": 38, "country": "Egypt", "marital_status": "single", "education": "higher", "social_class": "lower class"}, "question": {"id": "Q78", "variant": 0}, "response": ["Based on my emic perspective as a lower-class individual from Behaira, Egypt, my confidence level in private banks is not very high. The cultural context of my socioeconomic background and personal experience has led me to have limited exposure to private banks and a lack of trust in their services. Additionally, cultural relativism plays a role in my perception, as private banks may be viewed as inaccessible or even exploitative within my community. My age and place also contribute to my apprehension, as older generations in my area may have had negative experiences with private banks. Overall, my nuanced understanding of private banks is based on my individual values and personal experience, leading me to have not very much confidence in them.\n\n3"]}, {"persona": {"region": "Behaira", "sex": "male", "age": 32, "country": "Egypt", "marital_status": "married", "education": "middle", "social_class": "lower class"}, "question": {"id": "Q78", "variant": 0}, "response": ["From the perspective of a married male from Behaira, Egypt, who is 32 years old, has completed middle education, and considers himself part of the lower class, it is important to consider the cultural context and socioeconomic background in answering the question. In Egypt, the lower class may have limited access to financial resources and may not have positive experiences with private banks. Additionally, the individual values and personal experiences of someone from this background may lead to a lack of confidence in private banks. Considering the emic and etic perspectives, it is likely that someone from this background would have a lower confidence level in private banks due to these factors.\n\n3"]}, {"persona": {"region": "Behaira", "sex": "female", "age": 37, "country": "Egypt", "marital_status": "married", "education": "middle", "social_class": "working class"}, "question": {"id": "Q78", "variant": 0}, "response": ["Based on the anthropological framework described above, my response to the question about confidence in private banks is influenced by my cultural context, individual values, and socioeconomic background. Coming from Behaira, Egypt, I have experienced the impact of socioeconomic factors on access to financial institutions and services. As a member of the working class, I understand the importance of financial security and stability, but my middle education level has not provided me with extensive knowledge about private banks. Additionally, cultural relativism teaches me to consider the nuances of the question and recognize that my perspective may differ from others'. Therefore, my confidence level in private banks would be \"Not very much\" (3)."]}, {"persona": {"region": "Behaira", "sex": "male", "age": 48, "country": "Egypt", "marital_status": "married", "education": "middle", "social_class": "working class"}, "question": {"id": "Q78", "variant": 0}, "response": ["Based on the anthropological framework, as a married male from Behaira, Egypt, who is 48 years old and part of the working class, my perspective on private banks will be heavily influenced by my cultural context, individual values, and socioeconomic background. In Egypt, private banks are often seen as institutions for the wealthy and elite, and as a member of the working class, I may not have much trust or confidence in their services. Additionally, my personal experience and values may lead me to be skeptical of private banks, as I may have had limited exposure to them and may prioritize more traditional or community-based financial systems. Therefore, my confidence level in private banks would likely be quite low, as I may not have much trust or familiarity with their operations and services.\n\n3"]}, {"persona": {"region": "Behaira", "sex": "female", "age": 34, "country": "Egypt", "marital_status": "married", "education": "middle", "social_class": "lower class"}, "question": {"id": "Q78", "variant": 0}, "response": ["Based on the anthropological framework, as a married female from Behaira, Egypt, my emic perspective on private banks is influenced by my cultural context, individual values, and socioeconomic background. In my community, there is a general lack of trust in private banks due to economic instability and a history of corruption. Additionally, as a member of the lower class, I have limited access to financial resources and have likely experienced financial hardships, leading to a lack of confidence in private banks. Furthermore, my personal experiences and values regarding money and finance contribute to my perspective. Therefore, I would rate my confidence level in private banks as option 3) Not very much."]}, {"persona": {"region": "Behaira", "sex": "female", "age": 30, "country": "Egypt", "marital_status": "divorced", "education": "lower", "social_class": "lower class"}, "question": {"id": "Q78", "variant": 0}, "response": ["Based on the anthropological framework, my perspective as a divorced female from Behaira, Egypt, who is 30 years old, has a lower education level, and considers herself part of the lower class, is heavily influenced by my cultural context, individual values, and socioeconomic background. In my cultural context, access to private banks may not be common, and my lower education level and lower class status may mean that I have limited exposure to or trust in the services provided by private banks. Additionally, my personal experience and socioeconomic background may lead me to have limited confidence in private banks due to financial constraints and a lack of access to resources. Therefore, my perspective on private banks is influenced by a combination of cultural context, individual values, and socioeconomic background.\n\n3"]}, {"persona": {"region": "Behaira", "sex": "male", "age": 40, "country": "Egypt", "marital_status": "married", "education": "higher", "social_class": "lower middle class"}, "question": {"id": "Q78", "variant": 0}, "response": ["Based on the anthropological framework, my emic perspective as a married male from Behaira, Egypt, who completed higher education and considers myself part of the lower middle class, is shaped by my cultural context, individual values, and socioeconomic background. In Behaira, private banks may not be as accessible or trusted as they are in more economically developed areas. My personal experience and values may lead me to have a lower level of confidence in private banks due to the lack of familiarity and trust in these institutions. Additionally, my socioeconomic background as part of the lower middle class may mean that I have limited experience with private banks and may rely more on informal financial systems. Therefore, my confidence level in private banks would likely be lower. \n\n3"]}, {"persona": {"region": "Behaira", "sex": "male", "age": 38, "country": "Egypt", "marital_status": "married", "education": "middle", "social_class": "working class"}, "question": {"id": "Q78", "variant": 0}, "response": ["From the perspective of a married male from Behaira, Egypt, aged 38, with a middle education level and part of the working class, the emic perspective plays a significant role in shaping his understanding of private banks. His cultural context, including his socioeconomic background, influences his perception of private banks. As a member of the working class, he may have limited access to financial resources and may not have had positive experiences with private banks. Additionally, his individual values and personal experiences, as well as the cultural relativism of his community, may lead him to have a lower confidence level in private banks. Furthermore, the nuanced phrasing of the question may also impact his response. \n\n3"]}, {"persona": {"region": "Behaira", "sex": "female", "age": 30, "country": "Egypt", "marital_status": "married", "education": "higher", "social_class": "lower class"}, "question": {"id": "Q78", "variant": 0}, "response": ["Based on the anthropological framework, as a married female from Behaira, Egypt, my emic perspective is influenced by my lower class socioeconomic background, cultural context, and personal experience. In Egypt, private banks are often associated with the upper class and elite, and as a lower class individual, I may not have had positive experiences or interactions with such institutions. Additionally, my cultural relativism and nuanced understanding of the question lead me to choose option (3) Not very much, as I may not have had much exposure or confidence in private banks due to my socioeconomic status and cultural context."]}, {"persona": {"region": "Behaira", "sex": "female", "age": 35, "country": "Egypt", "marital_status": "married", "education": "middle", "social_class": "working class"}, "question": {"id": "Q78", "variant": 0}, "response": ["Based on the anthropological framework, I would answer this question based on my individual values and personal experience, as well as my socioeconomic background. As a married female from Behaira, Egypt, who is part of the working class and has completed middle education level, I have limited exposure to private banks and their services. My personal experience and socioeconomic background have shaped my perception of private banks, and I would rate my confidence level as \"Not very much\" (3)."]}, {"persona": {"region": "Behaira", "sex": "male", "age": 52, "country": "Egypt", "marital_status": "married", "education": "middle", "social_class": "lower class"}, "question": {"id": "Q78", "variant": 0}, "response": ["Based on the anthropological framework, my response to the question about rating my confidence level in private banks is influenced by my cultural context and socioeconomic background. As a married male from Behaira, Egypt, with a lower-class socioeconomic background, I have had limited exposure to private banks and may have had negative experiences with financial institutions in the past. My personal values and experiences also contribute to my lack of confidence in private banks, as I have always relied on informal financial networks within my community. Additionally, my age and education level may have influenced my understanding of and trust in formal banking institutions. Therefore, I would rate my confidence level in private banks as:\n3\n\n(3) Not very much"]}, {"persona": {"region": "Alexandria", "sex": "female", "age": 41, "country": "Egypt", "marital_status": "single", "education": "middle", "social_class": "lower class"}, "question": {"id": "Q78", "variant": 0}, "response": ["Based on the anthropological framework, as a single female from Alexandria, Egypt, with a lower socioeconomic background and middle education level, my perspective on private banks is influenced by my cultural context, individual values, and personal experience. In Egypt, private banks may not be easily accessible or trusted by individuals from lower socioeconomic backgrounds. Additionally, my personal experience and values may lead me to have a lower level of confidence in private banks due to potential barriers to access and a lack of trust in the financial system. Therefore, my confidence level in private banks would be at (3) Not very much."]}, {"persona": {"region": "Alexandria", "sex": "female", "age": 21, "country": "Egypt", "marital_status": "single", "education": "middle", "social_class": "lower class"}, "question": {"id": "Q78", "variant": 0}, "response": ["From an emic perspective, as a lower-class single female from Alexandria, Egypt, my cultural context and socioeconomic background significantly influence my confidence level in private banks. My limited education and financial resources make me more reliant on traditional methods of saving and investing, such as keeping money at home or using informal community-based financial systems. Additionally, my personal experience and values lead me to be skeptical of private banks due to the perceived lack of accessibility and trustworthiness. Cultural relativism also plays a role here, as my community may have a different perspective on private banks compared to more affluent or urban areas. Ultimately, my nuanced understanding of the question leads me to select option 3) Not very much, as my personal and cultural context contribute to my lack of confidence in private banks. \n\n3"]}, {"persona": {"region": "Alexandria", "sex": "female", "age": 35, "country": "Egypt", "marital_status": "married", "education": "middle", "social_class": "lower class"}, "question": {"id": "Q78", "variant": 0}, "response": ["Based on my personal experience and socioeconomic background as a lower class married woman from Alexandria, Egypt, I have limited exposure and access to private banks. The cultural context in which I live also influences my perception, as private banks may not be as accessible or relevant to me compared to someone from a higher socioeconomic background. Additionally, my educational level and age may also influence my confidence level in private banks. Therefore, my perspective on private banks is likely to be influenced by these factors, leading me to choose option 3: Not very much. \n\n3"]}, {"persona": {"region": "Alexandria", "sex": "male", "age": 34, "country": "Egypt", "marital_status": "married", "education": "higher", "social_class": "working class"}, "question": {"id": "Q78", "variant": 0}, "response": ["Based on the anthropological framework, as a married male from Alexandria, Egypt, my emic perspective on private banks is influenced by my cultural context, individual values, and socioeconomic background. In Egypt, private banks are seen as a symbol of modernity and financial stability, which aligns with my personal values and experience. As a member of the working class with higher education, I understand the importance of financial institutions in managing and growing wealth. However, my socioeconomic background also means that I may have limited access to private banking services, which could impact my confidence level. Therefore, my rating of confidence in private banks would be influenced by a combination of cultural context, individual values, and socioeconomic background, leading to my selection of option (2) Quite a lot. \n\n2"]}, {"persona": {"region": "Alexandria", "sex": "female", "age": 37, "country": "Egypt", "marital_status": "married", "education": "higher", "social_class": "lower middle class"}, "question": {"id": "Q78", "variant": 0}, "response": ["Based on the anthropological framework, as a married female from Alexandria, Egypt, my emic perspective on private banks is influenced by my cultural context, individual values, and socioeconomic background. In Egypt, private banks are often seen as institutions catering to the wealthy and upper class, and as someone from the lower middle class, I may not have had much exposure to or positive experiences with private banks. Additionally, my personal experience and values may lead me to have a lower confidence level in private banks, as I may prioritize more traditional and community-based financial institutions. My age and place also play a role, as being 37 years old in Alexandria may have shaped my perceptions of private banks. Therefore, I would rate my confidence level in private banks as option 3: Not very much. \n\n3"]}, {"persona": {"region": "Alexandria", "sex": "female", "age": 56, "country": "Egypt", "marital_status": "divorced", "education": "middle", "social_class": "working class"}, "question": {"id": "Q78", "variant": 0}, "response": ["From an anthropological perspective, my response to the question about confidence in private banks is influenced by my cultural context as a divorced female from Alexandria, Egypt. My emic perspective, shaped by my personal experience and socioeconomic background as part of the working class, leads me to view private banks with skepticism. My age and middle education level also play a role in my perception of private banks. Additionally, cultural relativism reminds me that my perspective may differ from others based on nuanced factors. Therefore, my answer is:\n3"]}, {"persona": {"region": "Alexandria", "sex": "male", "age": 48, "country": "Egypt", "marital_status": "married", "education": "higher", "social_class": "working class"}, "question": {"id": "Q78", "variant": 0}, "response": ["Based on the anthropological framework, my emic perspective as a married male from Alexandria, Egypt, who is 48 years old, has completed higher education, and considers myself part of the working class, is heavily influenced by my cultural context, individual values, and socioeconomic background. In Egypt, private banks are not as commonly used as they are in Western countries, and there may be a lack of trust in them due to economic instability and political factors. Additionally, my working-class background may mean that I have limited experience and exposure to private banks. Therefore, my confidence level in private banks would likely be not very much (3) as I may not have had much personal experience with them and may have some skepticism due to cultural and socioeconomic factors."]}, {"persona": {"region": "Alexandria", "sex": "female", "age": 30, "country": "Egypt", "marital_status": "married", "education": "middle", "social_class": "working class"}, "question": {"id": "Q78", "variant": 0}, "response": ["Based on the anthropological framework, my cultural context as a married female from Alexandria, Egypt, shapes my understanding and perception of private banks. My socioeconomic background as part of the working class and my middle education level also influence my perspective. In addition, my individual values and personal experiences play a significant role in how I perceive private banks. Considering the cultural relativism principle, I understand that my perception may differ from others' due to my specific cultural context. Moreover, my age and place of residence also contribute to my view. Therefore, I am confident in my choice as it reflects the nuanced understanding of private banks from my specific cultural and socioeconomic background.\n\n2"]}, {"persona": {"region": "Alexandria", "sex": "male", "age": 19, "country": "Egypt", "marital_status": "single", "education": "middle", "social_class": "lower class"}, "question": {"id": "Q78", "variant": 0}, "response": ["Based on the anthropological framework, my emic perspective as a young man from a lower socioeconomic background in Alexandria, Egypt would heavily influence my perception of private banks. My cultural context and individual values are shaped by my experiences and the experiences of those around me, leading me to have a lower level of confidence in private banks due to potential financial barriers and lack of access to their services. Additionally, my socioeconomic background plays a significant role in my perception, as I may not have had much exposure to private banks or may have heard negative experiences from others in similar economic situations. Therefore, my nuanced response to the question would be:\n\n3\n\nNot very much"]}, {"persona": {"region": "Alexandria", "sex": "male", "age": 45, "country": "Egypt", "marital_status": "married", "education": "middle", "social_class": "lower middle class"}, "question": {"id": "Q78", "variant": 0}, "response": ["Based on the anthropological framework, my emic perspective as a married male from Alexandria, Egypt, with a lower middle class socioeconomic background and completed middle education level would greatly influence my confidence level in private banks. My cultural context and individual values and personal experience would lead me to have a high level of skepticism towards private banks, as they may not be easily accessible or trustworthy for someone in my position. Additionally, my socioeconomic background and cultural relativism would also play a role in shaping my perception of private banks. Therefore, my confidence level in private banks would be: \n\n3) Not very much"]}, {"persona": {"region": "Alexandria", "sex": "male", "age": 23, "country": "Egypt", "marital_status": "single", "education": "higher", "social_class": "lower class"}, "question": {"id": "Q78", "variant": 0}, "response": ["Based on my emic perspective as a lower-class single male from Alexandria, Egypt, my confidence level in private banks is influenced by my cultural context, individual values, and socioeconomic background. In my cultural context, private banks are often associated with the upper class and are not easily accessible to individuals like me. Additionally, my lower socioeconomic background and lack of financial resources have limited my exposure to and trust in private banks. Therefore, I would rate my confidence level as (3) Not very much.\n\n3"]}, {"persona": {"region": "Alexandria", "sex": "female", "age": 28, "country": "Egypt", "marital_status": "married", "education": "middle", "social_class": "working class"}, "question": {"id": "Q78", "variant": 0}, "response": ["Based on the anthropological framework, as a married female from Alexandria, Egypt, my emic perspective on private banks is influenced by my cultural context, individual values, and socioeconomic background. In Egypt, the banking system is heavily influenced by cultural and religious factors, and as a member of the working class, I may have limited exposure to private banks and their services. My personal experience and values may lead me to have a lower confidence level in private banks, as I may prefer to rely on more traditional or community-based financial systems. Additionally, my socioeconomic background may impact my access to and understanding of private banking services. Therefore, my perspective on private banks is likely to be influenced by a combination of cultural, individual, and socioeconomic factors, leading to a lower confidence level in private banks.\n\n3"]}, {"persona": {"region": "Alexandria", "sex": "male", "age": 34, "country": "Egypt", "marital_status": "single", "education": "higher", "social_class": "working class"}, "question": {"id": "Q78", "variant": 0}, "response": ["Based on the anthropological framework, my emic perspective as a working-class individual from Alexandria, Egypt, influences my confidence level in private banks. The cultural context of Egypt, including its socioeconomic background, has shaped my understanding of the banking system. My personal experience with private banks, as well as my individual values, also play a significant role in how I perceive them. Additionally, my age and place of residence further contribute to my viewpoint. Therefore, my answer to the question is (3) Not very much, as my background and experiences have led me to have limited confidence in private banks."]}, {"persona": {"region": "Alexandria", "sex": "male", "age": 30, "country": "Egypt", "marital_status": "married", "education": "higher", "social_class": "lower middle class"}, "question": {"id": "Q78", "variant": 0}, "response": ["Based on my individual values and personal experience, as well as my socioeconomic background, I would rate my confidence level in private banks as not very much. As a married male from Alexandria, Egypt, who considers himself part of the lower middle class, I am familiar with the challenges and uncertainties that come with managing finances. The cultural context and space and time also play a role in my perception, as I have observed the impact of economic fluctuations and the instability of the banking system on people within my community. Additionally, my emic perspective as a member of this socioeconomic group influences my lack of confidence in private banks. \n\n3"]}, {"persona": {"region": "Alexandria", "sex": "female", "age": 49, "country": "Egypt", "marital_status": "married", "education": "higher", "social_class": "lower middle class"}, "question": {"id": "Q78", "variant": 0}, "response": ["Based on the emic and etic perspectives, as a member of the lower middle class in Alexandria, Egypt, my perception of private banks is influenced by my cultural context, individual values, and socioeconomic background. In Egypt, there is a general lack of trust in private banks due to economic instability and a history of financial crises. This has shaped my personal experience and values, leading to a lower confidence level in private banks. Additionally, as a 49-year-old woman with higher education, I have witnessed how socioeconomic factors and cultural relativism play a role in shaping my perception of financial institutions. Therefore, my confidence level in private banks is not very much. \n\n3"]}, {"persona": {"region": "Kafr el-sheikh", "sex": "male", "age": 49, "country": "Egypt", "marital_status": "married", "education": "higher", "social_class": "working class"}, "question": {"id": "Q78", "variant": 0}, "response": ["Based on the anthropological framework, my response is influenced by my emic perspective as a married male from Kafr el-sheikh, Egypt, my individual values and personal experience, and my socioeconomic background as part of the working class. My cultural context and cultural relativism also play a role in my answer. Additionally, space and time, as well as my age and place, factor into my response. Considering all these factors, I choose option 3: Not very much. \n\n3"]}, {"persona": {"region": "Kafr el-sheikh", "sex": "male", "age": 25, "country": "Egypt", "marital_status": "single", "education": "middle", "social_class": "lower middle class"}, "question": {"id": "Q78", "variant": 0}, "response": ["Based on my cultural context and socioeconomic background as a single male from Kafr el-sheikh, Egypt, I have limited exposure to private banks and their services. My lower middle class status and middle education level have not afforded me the opportunity to engage with private banks extensively. This lack of experience and exposure has influenced my confidence level in private banks, as I am not very familiar with their operations and services. Therefore, I would rate my confidence level in private banks as (3) Not very much."]}, {"persona": {"region": "Kafr el-sheikh", "sex": "male", "age": 59, "country": "Egypt", "marital_status": "married", "education": "higher", "social_class": "lower middle class"}, "question": {"id": "Q78", "variant": 0}, "response": ["Based on my emic perspective as a married male from Kafr el-sheikh, Egypt, I have grown up in a cultural context where private banks are not commonly utilized by individuals of my socioeconomic background. My personal experience and values have led me to have limited confidence in private banks due to a lack of exposure and trust in these institutions. Additionally, my lower middle class status and age of 59 contribute to my skepticism towards private banks, as they are often associated with the upper class and younger generations. Therefore, I would rate my confidence level in private banks as:\n3"]}, {"persona": {"region": "Kafr el-sheikh", "sex": "female", "age": 38, "country": "Egypt", "marital_status": "married", "education": "middle", "social_class": "working class"}, "question": {"id": "Q78", "variant": 0}, "response": ["Based on the anthropological framework, my emic perspective as a married female from Kafr el-sheikh, Egypt, is influenced by my cultural context, individual values, and socioeconomic background. In my community, private banks may not be easily accessible or trusted due to limited financial literacy and the dominance of informal financial systems. As a member of the working class with a middle education level, my trust in private banks is likely to be low due to limited exposure and access to formal financial services. Additionally, cultural relativism plays a role in shaping my perspective, as the value placed on personal relationships and trust in local institutions may outweigh confidence in private banks. Therefore, my rating of confidence in private banks is: \n3. Not very much"]}, {"persona": {"region": "Kafr el-sheikh", "sex": "male", "age": 35, "country": "Egypt", "marital_status": "married", "education": "higher", "social_class": "lower middle class"}, "question": {"id": "Q78", "variant": 0}, "response": ["Based on my personal experience and socioeconomic background, I would rate my confidence level in private banks as not very much. As a married man from Kafr el-sheikh, Egypt, who considers himself part of the lower middle class, I have seen the struggles of my community with accessing financial services and the challenges they face in dealing with private banks. The cultural context and socioeconomic background of my community have shaped my perception of private banks, and I have personally witnessed the difficulties that people face when dealing with them. Therefore, my confidence level in private banks is not very high.\n\n3"]}, {"persona": {"region": "Kafr el-sheikh", "sex": "male", "age": 49, "country": "Egypt", "marital_status": "married", "education": "middle", "social_class": "lower class"}, "question": {"id": "Q78", "variant": 0}, "response": ["Based on the anthropological framework, my answer to the question of rating my confidence level in private banks is influenced by my cultural context, individual values, and socioeconomic background. As a married male from Kafr el-sheikh, Egypt, with middle education and belonging to the lower class, I have limited exposure to private banks and may have had negative experiences with them. Additionally, my cultural context and socioeconomic background may lead me to have a lower level of trust in private banks due to limited access to financial resources and potential exploitation by these institutions. Therefore, my answer would be:\n3"]}, {"persona": {"region": "Kafr el-sheikh", "sex": "male", "age": 37, "country": "Egypt", "marital_status": "married", "education": "middle", "social_class": "lower class"}, "question": {"id": "Q78", "variant": 0}, "response": ["Based on the anthropological framework, as a married male from Kafr el-sheikh, Egypt, with a lower socioeconomic background and limited education, my perspective on private banks is heavily influenced by my cultural context and individual values. In my community, there is a strong sense of distrust towards private banks, as they are often associated with the elite class and seen as exploitative. My personal experience and the experiences of those around me have also shaped my perception, as I have witnessed friends and family members struggle with loans and high interest rates from private banks. Additionally, the lack of access to financial education and the language barrier have further contributed to a lack of confidence in private banks. Therefore, my confidence level in private banks is \"None at all.\"\n\n4"]}, {"persona": {"region": "Menofia", "sex": "female", "age": 22, "country": "Egypt", "marital_status": "single", "education": "middle", "social_class": "lower class"}, "question": {"id": "Q78", "variant": 0}, "response": ["Based on the anthropological framework, my emic perspective as a single female from Menofia, Egypt, who is part of the lower class and has completed middle education, is influenced by my cultural context, individual values, and socioeconomic background. In my cultural context, private banks may not be easily accessible or relevant to my daily life. My individual values and personal experience may lead me to have limited trust in institutions such as private banks, given my socioeconomic background. Additionally, cultural relativism and nuance play a role in my perception, as my understanding of private banks may be different from someone with a different background. Therefore, my confidence level in private banks would be (3) Not very much."]}, {"persona": {"region": "Menofia", "sex": "female", "age": 25, "country": "Egypt", "marital_status": "married", "education": "middle", "social_class": "lower class"}, "question": {"id": "Q78", "variant": 0}, "response": ["Based on the anthropological framework, my perspective as a married female from Menofia, Egypt, who is 25 years old and part of the lower class, is heavily influenced by my cultural context, individual values, and socioeconomic background. In my cultural context, trust in private banks may not be high due to historical and social factors. Additionally, my lower socioeconomic background may lead me to have limited access to banking services and a lack of trust in the banking system. Furthermore, my individual values and personal experiences may also contribute to a lack of confidence in private banks. Therefore, considering all these factors, I would choose option 3 - Not very much, as my confidence level in private banks is likely to be low due to the aforementioned reasons.\n3"]}, {"persona": {"region": "Menofia", "sex": "male", "age": 28, "country": "Egypt", "marital_status": "single", "education": "higher", "social_class": "working class"}, "question": {"id": "Q78", "variant": 0}, "response": ["Based on the anthropological framework, as a single male from Menofia, Egypt, who is 28 years old and part of the working class, my perspective on private banks would be influenced by my cultural context, individual values, and socioeconomic background. In Egypt, private banks are often associated with serving the wealthier population, and as part of the working class, I may not have had direct access to or positive experiences with private banks. Additionally, my cultural context and individual values may lead me to be cautious or skeptical of private banks, as they may not align with my personal experiences and values. Therefore, I would rate my confidence level in private banks as (3) Not very much, as my background and experiences have shaped my perspective on this topic. \n\n3"]}, {"persona": {"region": "Menofia", "sex": "male", "age": 35, "country": "Egypt", "marital_status": "married", "education": "middle", "social_class": "lower middle class"}, "question": {"id": "Q78", "variant": 0}, "response": ["Based on the anthropological framework, my emic perspective as a married male from Menofia, Egypt, with a lower middle class socioeconomic background, and completing only middle education, leads me to consider the cultural context and individual values in my answer. In my cultural context, private banks may not be as accessible or familiar to me as they might be to someone from a higher socioeconomic background or with more education. Additionally, my personal experience and the nuance of the question may lead me to have less confidence in private banks, as they may not have been a part of my financial experience. Therefore, my confidence level in private banks would be \"Not very much\" (3).\n\n3"]}, {"persona": {"region": "Menofia", "sex": "male", "age": 55, "country": "Egypt", "marital_status": "married", "education": "middle", "social_class": "working class"}, "question": {"id": "Q78", "variant": 0}, "response": ["Based on the anthropological framework, my understanding and perspective on private banks is influenced by my cultural context, individual values, and socioeconomic background. As a married male from Menofia, Egypt, who is 55 years old and part of the working class with a middle education level, I have a strong emphasis on personal experience and cultural context. In Egypt, there is a long history of suspicion towards private banks due to economic instability and government control over financial institutions. Additionally, as a member of the working class, I may have limited access to private banking services and may rely more on informal financial networks. Therefore, my confidence level in private banks would likely be quite low, as my personal experience and cultural context have shaped my perception of these institutions. \n\n3"]}, {"persona": {"region": "Menofia", "sex": "male", "age": 53, "country": "Egypt", "marital_status": "married", "education": "higher", "social_class": "lower middle class"}, "question": {"id": "Q78", "variant": 0}, "response": ["Based on the anthropological framework, my emic perspective as a married male from Menofia, Egypt, would be influenced by my cultural context, individual values, and socioeconomic background. In Menofia, private banks may not be as accessible or trusted as they are in other areas, and my lower middle class status may mean that I have limited experience with private banks. Additionally, my age and education level may also influence my confidence in private banks, as I may have had limited exposure to them in my lifetime. Therefore, I would rate my confidence level in private banks as: \n\n3. Not very much"]}, {"persona": {"region": "Menofia", "sex": "male", "age": 59, "country": "Egypt", "marital_status": "married", "education": "middle", "social_class": "working class"}, "question": {"id": "Q78", "variant": 0}, "response": ["Based on the anthropological framework, my emic perspective as a married male from Menofia, Egypt, who is 59 years old, has completed middle education level, and considers himself part of the working class, influences my view on private banks. In the cultural context of Egypt, private banks may not be as widely accessible or trusted compared to state-owned banks. My individual values and personal experience, as well as my socioeconomic background, also play a role in my perception of private banks. Additionally, cultural relativism reminds me that my perspective may differ from others based on their age, place, and nuanced understanding of the question. Therefore, my confidence level in private banks is likely to be influenced by these factors, leading me to select the following option:\n\n3"]}, {"persona": {"region": "Menofia", "sex": "female", "age": 42, "country": "Egypt", "marital_status": "married", "education": "middle", "social_class": "lower middle class"}, "question": {"id": "Q78", "variant": 0}, "response": ["Based on the anthropological framework, my emic perspective as a married female from Menofia, Egypt, is influenced by my cultural context, individual values and personal experience, socioeconomic background, and space and time. In my cultural context, private banks may not be very accessible or familiar to me and my community, leading to a lower level of confidence. Additionally, my individual values and personal experience, as well as my lower middle class socioeconomic background, may contribute to a lack of confidence in private banks due to potential financial risks and limited resources. Considering my age and place, I may also have limited exposure to private banking services. Therefore, based on my perspective, my confidence level in private banks would be \"Not very much\" (3)."]}, {"persona": {"region": "Menofia", "sex": "male", "age": 39, "country": "Egypt", "marital_status": "married", "education": "higher", "social_class": "working class"}, "question": {"id": "Q78", "variant": 0}, "response": ["Based on the anthropological framework, as a married male from Menofia, Egypt, my emic perspective would be influenced by my cultural context, individual values, and socioeconomic background. In Egypt, private banks are often associated with the upper class and are not easily accessible to the working class. Additionally, my personal experience and values would lead me to have a lower confidence level in private banks, as they may not align with my cultural and socioeconomic background. Therefore, I would rate my confidence level in private banks as (3) Not very much."]}, {"persona": {"region": "Menofia", "sex": "male", "age": 34, "country": "Egypt", "marital_status": "married", "education": "middle", "social_class": "lower middle class"}, "question": {"id": "Q78", "variant": 0}, "response": ["Based on the anthropological framework, my emic perspective as a married male from Menofia, Egypt, with a middle education level and part of the lower middle class, is influenced by my cultural context, individual values and personal experience, and socioeconomic background. In my cultural context, private banks may not be as accessible or trustworthy as they are in other cultures. Additionally, my lower middle class status may mean that I have had limited exposure to private banks and may not have had positive experiences with them. Therefore, my confidence level in private banks may be influenced by these factors, leading me to select option 3) Not very much."]}, {"persona": {"region": "Menofia", "sex": "male", "age": 22, "country": "Egypt", "marital_status": "single", "education": "higher", "social_class": "working class"}, "question": {"id": "Q78", "variant": 0}, "response": ["Based on the anthropological framework, as a 22-year-old single male from Menofia, Egypt, who considers myself part of the working class, my individual values and personal experience greatly influence my perception of private banks. My socioeconomic background also plays a role in this, as my income and social status may affect my trust in private banks. Additionally, the cultural context of Egypt, including the significance of family and community connections, also factors into my confidence level in private banks. Therefore, I would rate my confidence level as:\n\n2) Quite a lot"]}, {"persona": {"region": "Menofia", "sex": "male", "age": 21, "country": "Egypt", "marital_status": "single", "education": "middle", "social_class": "working class"}, "question": {"id": "Q78", "variant": 0}, "response": ["Based on the anthropological framework described above, my answer is heavily influenced by my cultural context, individual values, and socioeconomic background. As a single male from Menofia, Egypt, I come from a working-class background and have completed only middle education level. In my cultural context, private banks are often seen as institutions catering to the wealthy and elite, and there may be a lack of trust or confidence in them due to my socioeconomic background. Additionally, my individual values and personal experience lead me to believe that private banks may not be accessible or beneficial to someone in my position. Therefore, my confidence level in private banks would be quite low.\n3"]}, {"persona": {"region": "Menofia", "sex": "male", "age": 36, "country": "Egypt", "marital_status": "married", "education": "higher", "social_class": "working class"}, "question": {"id": "Q78", "variant": 0}, "response": ["Based on the anthropological framework, as a married male from Menofia, Egypt, my emic perspective is influenced by my cultural context, individual values, socioeconomic background, and space and time. In Menofia, private banks are not as common as in more urban areas, and the working class, including myself, may have limited access to or trust in them. Additionally, my personal experience and values may lead me to have a lower confidence level in private banks, as I prioritize security and stability. Therefore, I would rate my confidence level in private banks as (3) Not very much."]}, {"persona": {"region": "Menofia", "sex": "female", "age": 52, "country": "Egypt", "marital_status": "married", "education": "higher", "social_class": "lower middle class"}, "question": {"id": "Q78", "variant": 0}, "response": ["Based on the anthropological framework, my perspective as a married female from Menofia, Egypt, who is 52 years old and part of the lower middle class, is heavily influenced by my cultural context, socioeconomic background, and personal experiences. In Menofia, private banks may not be as accessible or trustworthy as they are in more affluent areas. Additionally, my lower middle class status may mean that I have had limited exposure to private banking services and may rely more on traditional financial institutions. Therefore, my confidence level in private banks may not be very high, as I may not have had many positive experiences with them. Furthermore, cultural relativism teaches me to recognize that my perspective is shaped by my specific cultural and socioeconomic context, and may not be the same as someone from a different background. \n\n3"]}, {"persona": {"region": "Menofia", "sex": "male", "age": 52, "country": "Egypt", "marital_status": "married", "education": "higher", "social_class": "lower middle class"}, "question": {"id": "Q78", "variant": 0}, "response": ["From the perspective of a married male from Menofia, Egypt, who is 52 years old, has completed a higher education level, and considers himself part of the lower middle class, the answer to the question of rating confidence level in private banks will be influenced by various factors. The cultural context of Menofia and Egypt as a whole, the individual values and personal experience of the persona, and their socioeconomic background will all play a role in shaping their perception of private banks. Additionally, the emic and etic perspectives of the persona will also inform their answer. Considering these factors, the persona would likely choose option (3) Not very much, as individuals from similar cultural and socioeconomic backgrounds in Egypt may have limited trust and confidence in private banks due to historical and cultural factors.\n\n3"]}, {"persona": {"region": "Menofia", "sex": "male", "age": 39, "country": "Egypt", "marital_status": "married", "education": "middle", "social_class": "lower class"}, "question": {"id": "Q78", "variant": 0}, "response": ["Based on my cultural context, as a married male from Menofia, Egypt, my confidence level in private banks is influenced by my socioeconomic background as part of the lower class. My individual values and personal experience have shaped my perception, and I have limited trust in private banks due to my middle education level and lack of exposure to financial institutions. Additionally, cultural relativism plays a role in my understanding, as private banks may not be accessible or relevant to individuals in my social and economic position. Therefore, my confidence level in private banks would be rated as (3) Not very much."]}, {"persona": {"region": "Menofia", "sex": "male", "age": 23, "country": "Egypt", "marital_status": "single", "education": "middle", "social_class": "lower middle class"}, "question": {"id": "Q78", "variant": 0}, "response": ["Based on my personal experience and socioeconomic background, as a single male from Menofia, Egypt, who considers myself part of the lower middle class, my confidence level in private banks would be not very much. In my cultural context, many people in my community have had negative experiences with private banks, and I have heard stories about people losing their savings or being taken advantage of by these institutions. Additionally, my limited education level and age also play a role in my lack of confidence in private banks, as I may not have the financial literacy or experience to navigate the complexities of private banking. Therefore, I would rate my confidence level in private banks as not very much.\n\n3"]}, {"persona": {"region": "Dakahlia", "sex": "female", "age": 24, "country": "Egypt", "marital_status": "single", "education": "higher", "social_class": "lower middle class"}, "question": {"id": "Q78", "variant": 0}, "response": ["Based on the anthropological framework, as a single female from Dakahlia, Egypt, my emic perspective on private banks is influenced by my cultural context, individual values, and socioeconomic background. In my culture, there is a strong emphasis on family and communal support, and private banks may not be widely utilized or trusted in my community. Additionally, as a lower middle class individual, I may have limited access to financial resources and may not have had positive personal experiences with private banks. Therefore, my confidence level in private banks would be influenced by these factors, leading me to choose option (3) Not very much."]}, {"persona": {"region": "Dakahlia", "sex": "male", "age": 36, "country": "Egypt", "marital_status": "married", "education": "higher", "social_class": "upper middle class"}, "question": {"id": "Q78", "variant": 0}, "response": ["Based on the anthropological framework, as a married male from Dakahlia, Egypt, I am influenced by my cultural context, individual values, socioeconomic background, and personal experience. In my upper middle class status, I have likely had positive experiences with private banks and have been exposed to the benefits of using their services. Additionally, my higher education level may have provided me with a better understanding of the financial system and the role of private banks in it. Therefore, I would rate my confidence level in private banks as:\n\n2"]}, {"persona": {"region": "Dakahlia", "sex": "female", "age": 71, "country": "Egypt", "marital_status": "married", "education": "higher", "social_class": "upper middle class"}, "question": {"id": "Q78", "variant": 0}, "response": ["Based on my Emic and Etic perspective as a married female from Dakahlia, Egypt, I understand that my cultural context, individual values, and personal experiences greatly influence my perception of private banks. Growing up in a society where traditional values and family ties are highly regarded, I have been taught to be cautious and conservative with financial matters. Additionally, my socioeconomic background as part of the upper middle class has afforded me the opportunity to have access to more traditional and established financial institutions. Therefore, I have a great deal of confidence in private banks as they provide the stability and security that aligns with my cultural values and personal experiences.\n\n1"]}, {"persona": {"region": "Dakahlia", "sex": "male", "age": 55, "country": "Egypt", "marital_status": "married", "education": "higher", "social_class": "upper middle class"}, "question": {"id": "Q78", "variant": 0}, "response": ["Based on the anthropological framework, my emic perspective as a married male from Dakahlia, Egypt, who is 55 years old, highly educated, and part of the upper middle class, greatly influences my confidence level in private banks. The cultural context of Egypt, including my socioeconomic background and individual values, plays a significant role in shaping my perception of private banks. Additionally, my personal experience and nuanced understanding of the banking system in Egypt further inform my confidence level. Therefore, I choose option:\n(2) Quite a lot"]}, {"persona": {"region": "Dakahlia", "sex": "male", "age": 64, "country": "Egypt", "marital_status": "married", "education": "higher", "social_class": "lower middle class"}, "question": {"id": "Q78", "variant": 0}, "response": ["Based on the anthropological framework, my perspective as a married male from Dakahlia, Egypt, at 64 years of age and part of the lower middle class, is heavily influenced by my cultural context, socioeconomic background, individual values, and personal experience. In Egypt, there is a long history of distrust towards private banks, stemming from economic instability and political factors. Additionally, as part of the lower middle class, I have personally experienced financial challenges and have limited exposure to private banking services. Therefore, I would rate my confidence level in private banks as (3) Not very much."]}, {"persona": {"region": "Dakahlia", "sex": "female", "age": 29, "country": "Egypt", "marital_status": "married", "education": "middle", "social_class": "lower class"}, "question": {"id": "Q78", "variant": 0}, "response": ["In considering the question of confidence in private banks from the perspective of a married female from Dakahlia, Egypt, who is 29 years old, has completed middle education, and considers herself part of the lower class, several key factors come into play. The cultural context of Dakahlia and the socioeconomic background of being part of the lower class may influence a lack of confidence in private banks due to limited access to financial resources and services. Additionally, individual values and personal experience may lead to a lack of trust in private banks, as they may not have had positive experiences with financial institutions. Cultural relativism also plays a role, as the perception of private banks may differ from higher socioeconomic classes. Therefore, based on this perspective, the chosen answer is: \n\n3) Not very much"]}, {"persona": {"region": "Dakahlia", "sex": "female", "age": 40, "country": "Egypt", "marital_status": "married", "education": "middle", "social_class": "upper middle class"}, "question": {"id": "Q78", "variant": 0}, "response": ["Based on the anthropological framework, as a married female from Dakahlia, Egypt, my emic perspective on private banks is influenced by my socioeconomic background as part of the upper middle class. Additionally, my individual values and personal experience play a significant role in shaping my perception of private banks. The cultural context of Dakahlia also influences my understanding, as well as the nuance of the question itself. Therefore, my confidence level in private banks is quite a lot. \n\n2"]}, {"persona": {"region": "Dakahlia", "sex": "male", "age": 37, "country": "Egypt", "marital_status": "married", "education": "higher", "social_class": "lower middle class"}, "question": {"id": "Q78", "variant": 0}, "response": ["Based on the anthropological framework, my perspective as a married male from Dakahlia, Egypt, who is 37 years old, has completed higher education, and considers myself part of the lower middle class, is influenced by my cultural context, individual values, and socioeconomic background. In Egypt, trust in private banks may be influenced by the historical and cultural context of the country's banking system, as well as the individual's personal experiences and values. As someone from the lower middle class, my socioeconomic background may also impact my confidence in private banks. Therefore, my rating of confidence in private banks is influenced by a combination of these factors, leading me to choose the option that best reflects my perspective.\n\n3"]}, {"persona": {"region": "Dakahlia", "sex": "female", "age": 45, "country": "Egypt", "marital_status": "married", "education": "middle", "social_class": "working class"}, "question": {"id": "Q78", "variant": 0}, "response": ["Based on the anthropological framework, as a married female from Dakahlia, Egypt, my emic perspective is influenced by my cultural context, individual values, and socioeconomic background. In my community, private banks may not be as accessible or trustworthy as they are in other parts of the world. Additionally, as part of the working class, I may not have had much exposure to private banks or the opportunity to build confidence in them. Therefore, my confidence level in private banks would be (3) Not very much."]}, {"persona": {"region": "Dakahlia", "sex": "male", "age": 34, "country": "Egypt", "marital_status": "single", "education": "middle", "social_class": "lower middle class"}, "question": {"id": "Q78", "variant": 0}, "response": ["Based on the anthropological framework, as a single male from Dakahlia, Egypt, my emic perspective would be influenced by my cultural context, individual values and personal experience, and socioeconomic background. In Egypt, there is a general lack of trust in private banks due to a history of economic instability and corruption. As a member of the lower middle class, I have personally experienced the struggle of managing finances and have heard stories of people losing their savings in private banks. This has led to a lack of confidence in private banks, and I would rate my confidence level as \"Not very much\". \n\n3"]}, {"persona": {"region": "Dakahlia", "sex": "female", "age": 26, "country": "Egypt", "marital_status": "married", "education": "higher", "social_class": "upper middle class"}, "question": {"id": "Q78", "variant": 0}, "response": ["Based on the anthropological framework, my emic perspective as a married female from Dakahlia, Egypt, who is 26 years old and part of the upper middle class, is influenced by my cultural context, individual values, and socioeconomic background. In Egypt, the upper middle class generally has more trust in private banks due to their financial stability and access to various services. Additionally, my higher education level has provided me with the knowledge and understanding of the benefits of private banking. Therefore, my confidence level in private banks is quite high, as they offer the financial security and services that align with my values and background.\n\n2"]}, {"persona": {"region": "Dakahlia", "sex": "male", "age": 21, "country": "Egypt", "marital_status": "single", "education": "middle", "social_class": "upper middle class"}, "question": {"id": "Q78", "variant": 0}, "response": ["Based on the anthropological framework, the emic perspective of a single male from Dakahlia, Egypt who considers himself part of the upper middle class and has completed middle education level, would prioritize individual values and personal experience in answering the question about confidence in private banks. His cultural context and socioeconomic background would also influence his perception. As a member of the upper middle class, he may have had positive experiences with private banks and therefore have a high confidence level in them. Additionally, his age and place of residence in Dakahlia, Egypt, where private banks may have a positive reputation, could contribute to his confidence level. Therefore, based on this perspective, the most likely answer would be:\n\n2"]}, {"persona": {"region": "Dakahlia", "sex": "female", "age": 32, "country": "Egypt", "marital_status": "married", "education": "middle", "social_class": "working class"}, "question": {"id": "Q78", "variant": 0}, "response": ["Based on the anthropological framework, my emic perspective as a married female from Dakahlia, Egypt, with a middle education level and working-class background, is influenced by my cultural context, individual values, and socioeconomic background. In Egypt, the cultural context surrounding banking and finance may differ from Western perspectives, and my personal experience and values may affect my confidence level in private banks. Additionally, my socioeconomic background as part of the working class may influence my perception of private banks. Therefore, I may have a nuanced understanding of private banks that differs from others. \n\n2"]}, {"persona": {"region": "Dakahlia", "sex": "female", "age": 35, "country": "Egypt", "marital_status": "married", "education": "middle", "social_class": "upper middle class"}, "question": {"id": "Q78", "variant": 0}, "response": ["Based on the anthropological framework, as a married female from Dakahlia, Egypt, my emic perspective on private banks is influenced by my cultural context, individual values, and socioeconomic background. In my cultural context, private banks may be seen as a symbol of financial stability and success. As someone from the upper middle class, I value financial security and may have had positive experiences with private banks. Additionally, my middle education level may have provided me with some understanding of the benefits of utilizing private banks for financial growth and stability. Therefore, I would rate my confidence level in private banks as:\n2\n\nQuite a lot"]}, {"persona": {"region": "Dakahlia", "sex": "male", "age": 33, "country": "Egypt", "marital_status": "married", "education": "middle", "social_class": "upper middle class"}, "question": {"id": "Q78", "variant": 0}, "response": ["Based on the anthropological framework, my response is influenced by my cultural context, socioeconomic background, individual values, and personal experience. As a married male from Dakahlia, Egypt, I am part of the upper middle class, which means I have likely had positive experiences with private banks and have been exposed to the benefits of using their services. Additionally, my cultural context and socioeconomic background may have instilled a level of trust and confidence in private banks due to their reputation and accessibility to individuals in my social and economic position. Therefore, my confidence level in private banks is a great deal.\n\n2"]}, {"persona": {"region": "Dakahlia", "sex": "female", "age": 45, "country": "Egypt", "marital_status": "married", "education": "middle", "social_class": "upper middle class"}, "question": {"id": "Q78", "variant": 0}, "response": ["From the perspective of a married female from Dakahlia, Egypt, who is 45 years old and part of the upper middle class, my response to the question of rating confidence in private banks would be influenced by my cultural context, individual values, and socioeconomic background. In Egypt, private banks are often associated with stability and security, especially for those in the upper middle class. My personal experience and values also play a role in shaping my confidence level in private banks, as I may have had positive experiences or have been taught to value financial security. Additionally, my socioeconomic background as part of the upper middle class may lead me to have a greater confidence in private banks due to their accessibility and perceived reliability. \n\n2"]}, {"persona": {"region": "Dakahlia", "sex": "male", "age": 30, "country": "Egypt", "marital_status": "married", "education": "middle", "social_class": "upper middle class"}, "question": {"id": "Q78", "variant": 0}, "response": ["Based on the anthropological framework, as a married male from Dakahlia, Egypt, my emic perspective is influenced by my cultural context, individual values, and socioeconomic background. In Egypt, private banks are often associated with a higher socioeconomic status and are perceived as a symbol of financial stability and success. As a member of the upper middle class, I have been socialized to value the services and security offered by private banks, and my personal experience with them has been positive. Additionally, my age and education level have exposed me to the benefits of private banking, further increasing my confidence in their services. Therefore, I would rate my confidence level in private banks as a great deal.\n\n1"]}, {"persona": {"region": "Dakahlia", "sex": "female", "age": 63, "country": "Egypt", "marital_status": "married", "education": "higher", "social_class": "lower middle class"}, "question": {"id": "Q78", "variant": 0}, "response": ["Based on the anthropological framework, my answer is influenced by my emic perspective as a married female from Dakahlia, Egypt, as well as my cultural context and socioeconomic background. As a member of the lower middle class in a traditional and conservative community, my personal experience and values shape my perception of private banks. I have had limited exposure to private banks and my socioeconomic background has influenced me to be cautious and skeptical of financial institutions. In addition, cultural relativism plays a role in my perception, as there is a general mistrust of financial institutions in my community. Therefore, I would rate my confidence level in private banks as (3) Not very much. \n\n3"]}, {"persona": {"region": "Dakahlia", "sex": "male", "age": 28, "country": "Egypt", "marital_status": "single", "education": "higher", "social_class": "upper middle class"}, "question": {"id": "Q78", "variant": 0}, "response": ["Based on the anthropological framework, my response is influenced by my individual values and personal experience, as well as my socioeconomic background and cultural context. As a single male from Dakahlia, Egypt, who has completed higher education and considers myself part of the upper middle class, my confidence level in private banks is quite high. I have been exposed to the benefits and advantages of using private banks, and my socioeconomic status allows me to have access to their services. Additionally, the cultural context and values of my community place a high value on financial stability and management, further increasing my confidence in private banks.\n\n2"]}, {"persona": {"region": "Dakahlia", "sex": "female", "age": 24, "country": "Egypt", "marital_status": "married", "education": "higher", "social_class": "upper middle class"}, "question": {"id": "Q78", "variant": 0}, "response": ["Based on the anthropological framework, as a married female from Dakahlia, Egypt, my emic perspective is influenced by my cultural context, individual values, and socioeconomic background. In my cultural context, trust in financial institutions, including private banks, is highly influenced by personal experiences and values. As an educated individual from the upper middle class, I have likely been exposed to and benefited from the services offered by private banks, which may influence my confidence level in them. Additionally, my socioeconomic background may provide me with a certain level of financial literacy and access to information about private banks, further impacting my confidence level in them. Therefore, I would rate my confidence level in private banks as a great deal.\n\n1"]}, {"persona": {"region": "Dakahlia", "sex": "male", "age": 20, "country": "Egypt", "marital_status": "single", "education": "middle", "social_class": "upper middle class"}, "question": {"id": "Q78", "variant": 0}, "response": ["Based on the anthropological framework, as a single male from Dakahlia, Egypt, my emic perspective on private banks is influenced by my cultural context, individual values, and socioeconomic background. In Egypt, private banks are often seen as a symbol of financial stability and success, which aligns with my upper middle class status and the importance placed on wealth and financial security in my cultural context. Additionally, my personal experience and education level have provided me with a certain level of financial literacy and understanding of the benefits of private banking. Therefore, my confidence level in private banks would be quite high, as I believe in their ability to provide financial security and growth opportunities for individuals like myself.\n\n2"]}, {"persona": {"region": "Dakahlia", "sex": "male", "age": 45, "country": "Egypt", "marital_status": "married", "education": "middle", "social_class": "upper middle class"}, "question": {"id": "Q78", "variant": 0}, "response": ["Based on the anthropological framework, my cultural context as a married male from Dakahlia, Egypt, my age, education level, and upper middle class socioeconomic background all play a crucial role in shaping my perspective on private banks. In this cultural context, trust and confidence in private banks are often influenced by personal experience, individual values, and socioeconomic background. As a member of the upper middle class, I have likely had positive experiences with private banks and have been able to access their services, which has likely increased my confidence in them. Additionally, my education level and age may also contribute to my understanding and trust in the banking system. Therefore, I would rate my confidence level in private banks as:\n\n2"]}, {"persona": {"region": "Dakahlia", "sex": "female", "age": 43, "country": "Egypt", "marital_status": "married", "education": "higher", "social_class": "upper middle class"}, "question": {"id": "Q78", "variant": 0}, "response": ["The anthropological framework emphasizes the influence of cultural context, individual values, and socioeconomic background in shaping perspectives. As a married female from Dakahlia, Egypt, who has completed higher education and considers herself part of the upper middle class, my confidence level in private banks is influenced by these factors. In my cultural context, private banks are often seen as a symbol of financial stability and success, and my higher education has provided me with the knowledge to understand and engage with the services they offer. Additionally, being part of the upper middle class has likely given me positive experiences with private banks, further increasing my confidence in them. Therefore, I would rate my confidence level in private banks as (2) Quite a lot."]}, {"persona": {"region": "Dakahlia", "sex": "female", "age": 20, "country": "Egypt", "marital_status": "single", "education": "middle", "social_class": "upper middle class"}, "question": {"id": "Q78", "variant": 0}, "response": ["Based on the anthropological framework, my perspective as a single female from Dakahlia, Egypt, is influenced by my cultural context, individual values, and socioeconomic background. In my community, private banks are highly regarded and trusted, especially among the upper middle class. My family's socioeconomic status has allowed me to have exposure to and experience with private banks, which has shaped my positive view of them. Additionally, my personal values prioritize financial security and stability, leading me to have a great deal of confidence in private banks.\n1"]}, {"persona": {"region": "Dakahlia", "sex": "female", "age": 40, "country": "Egypt", "marital_status": "single", "education": "middle", "social_class": "lower middle class"}, "question": {"id": "Q78", "variant": 0}, "response": ["As a single female from Dakahlia, Egypt, my perspective on private banks is heavily influenced by my cultural context, socioeconomic background, and personal experience. In my community, there is a general distrust of private banks due to a lack of understanding and access to financial literacy. As a member of the lower middle class, I have limited exposure to private banking institutions and rely more on informal financial systems. Additionally, my middle education level has not provided me with the necessary knowledge to confidently engage with private banks. Therefore, I would rate my confidence level in private banks as (3) Not very much."]}, {"persona": {"region": "Dakahlia", "sex": "female", "age": 33, "country": "Egypt", "marital_status": "married", "education": "higher", "social_class": "upper middle class"}, "question": {"id": "Q78", "variant": 0}, "response": ["Based on the anthropological framework, as a married female from Dakahlia, Egypt who is 33 years old, has completed higher education, and considers herself part of the upper middle class, my perspective on private banks would be influenced by my cultural context, individual values, and socioeconomic background. In Egypt, private banks are often associated with providing services to those in the upper middle class and higher income brackets. Additionally, my education level would likely lead me to have a greater understanding and confidence in the workings of private banks. Therefore, I would rate my confidence level in private banks as: \n\n2) Quite a lot"]}, {"persona": {"region": "Dakahlia", "sex": "female", "age": 24, "country": "Egypt", "marital_status": "married", "education": "middle", "social_class": "working class"}, "question": {"id": "Q78", "variant": 0}, "response": ["Based on the anthropological framework, as a married female from Dakahlia, Egypt, I understand the importance of considering the cultural context, individual values, and socioeconomic background in shaping my perspective. In my community, private banks may not be easily accessible to those in the working class, and the cultural context may influence my perception of their reliability and trustworthiness. Additionally, my personal experience and values, as well as my socioeconomic background, may lead me to have limited confidence in private banks. Therefore, I would rate my confidence level in private banks as (3) Not very much."]}, {"persona": {"region": "Dakahlia", "sex": "female", "age": 53, "country": "Egypt", "marital_status": "widowed", "education": "middle", "social_class": "working class"}, "question": {"id": "Q78", "variant": 0}, "response": ["Based on the anthropological framework provided, as a widowed female from Dakahlia, Egypt, who is 53 years old and part of the working class, my response to the question regarding confidence in private banks would be influenced by my cultural context, individual values, and socioeconomic background. In Egypt, there is a deep-rooted mistrust of private banks, especially among the working class due to historical and political reasons. Additionally, as a middle-aged woman who has experienced the loss of a spouse, I may have had to navigate financial challenges on my own, which could further influence my lack of confidence in private banks. Considering my socioeconomic background and cultural context, I would choose:\n\n3) Not very much"]}, {"persona": {"region": "Dakahlia", "sex": "female", "age": 30, "country": "Egypt", "marital_status": "single", "education": "middle", "social_class": "lower middle class"}, "question": {"id": "Q78", "variant": 0}, "response": ["Based on my emic perspective as a single female from Dakahlia, Egypt, and considering my lower middle class socioeconomic background, I have had limited exposure to private banks and their services. My personal experience and cultural context have shaped my perception of private banks, and I have not had much interaction with them due to my socioeconomic status. Additionally, cultural relativism plays a role in my understanding, as private banks may not be a common or accessible option for individuals in my community. Therefore, I would rate my confidence level in private banks as (3) Not very much."]}, {"persona": {"region": "Dakahlia", "sex": "male", "age": 53, "country": "Egypt", "marital_status": "married", "education": "higher", "social_class": "upper middle class"}, "question": {"id": "Q78", "variant": 0}, "response": ["Based on the anthropological framework, my response is shaped by my emic perspective as a married male from Dakahlia, Egypt, with a higher education level and belonging to the upper middle class. My cultural context and socioeconomic background have influenced my understanding of the banking system and the value I place on trust and reliability. My personal experience and individual values also play a significant role in shaping my confidence level in private banks. Given my age and place, I have witnessed the evolution of the banking system in Egypt and have experienced the benefits of private banks in managing my finances. Therefore, my confidence level in private banks is (2) Quite a lot."]}, {"persona": {"region": "Dakahlia", "sex": "male", "age": 28, "country": "Egypt", "marital_status": "married", "education": "middle", "social_class": "working class"}, "question": {"id": "Q78", "variant": 0}, "response": ["Based on the anthropological framework, as a married male from Dakahlia, Egypt, my emic perspective would be influenced by my cultural context, individual values, and socioeconomic background. In Egypt, private banks are not as commonly utilized by the working class, and there is a general mistrust of them due to economic instability and lack of access to financial resources. As a working-class individual with only a middle education level, my personal experience and values would lead me to have not very much confidence in private banks, as they are not accessible or relevant to my everyday life. Additionally, cultural relativism plays a role in my perception, as private banks may be more relevant and trusted in other cultural contexts, but not in mine.\n\n3"]}, {"persona": {"region": "Dakahlia", "sex": "female", "age": 38, "country": "Egypt", "marital_status": "married", "education": "middle", "social_class": "upper middle class"}, "question": {"id": "Q78", "variant": 0}, "response": ["Based on the anthropological framework, my perspective as a married female from Dakahlia, Egypt, who is 38 years old, completed middle education level, and considers myself part of the upper middle class, is shaped by my cultural context, individual values, and socioeconomic background. In Egypt, the banking system is heavily influenced by cultural and socioeconomic factors, and as a member of the upper middle class, I have likely had positive experiences with private banks and have a higher level of confidence in them compared to those in lower socioeconomic classes. Additionally, my personal values and experiences have likely shaped my perception of the banking system. Therefore, my confidence level in private banks would likely be (2) Quite a lot."]}, {"persona": {"region": "Gharbia", "sex": "male", "age": 27, "country": "Egypt", "marital_status": "single", "education": "higher", "social_class": "upper middle class"}, "question": {"id": "Q78", "variant": 0}, "response": ["Based on the anthropological framework, my perspective as a single male from Gharbia, Egypt, who is 27 years old and part of the upper middle class, is influenced by my cultural context, individual values, and socioeconomic background. In my cultural context, private banks may be seen as a symbol of modernity and financial security. My higher education level and socioeconomic status also contribute to my confidence in private banks, as I may have had positive experiences with them and have been exposed to the benefits they offer. Additionally, my individual values as a member of the upper middle class may align with the principles of private banking. Therefore, I would rate my confidence level in private banks as a great deal.\n\n1"]}, {"persona": {"region": "Gharbia", "sex": "female", "age": 35, "country": "Egypt", "marital_status": "married", "education": "higher", "social_class": "upper middle class"}, "question": {"id": "Q78", "variant": 0}, "response": ["Based on the anthropological framework, my emic perspective as a married female from Gharbia, Egypt, with a higher education level and belonging to the upper middle class, would lead me to consider the rating of private banks in the context of my cultural background, individual values, and socioeconomic status. In Gharbia, there is a strong emphasis on financial stability and investment, and as a member of the upper middle class, I have likely had positive experiences with private banks. Additionally, my education has provided me with an understanding of the financial sector, leading to a high level of confidence in private banks. Therefore, I would rate my confidence level in private banks as (1) A great deal."]}, {"persona": {"region": "Gharbia", "sex": "female", "age": 37, "country": "Egypt", "marital_status": "married", "education": "higher", "social_class": "upper middle class"}, "question": {"id": "Q78", "variant": 0}, "response": ["Based on the anthropological framework, my perspective as a married female from Gharbia, Egypt at 37 years of age with a higher education level and upper middle-class status is shaped by my cultural context, individual values, and socioeconomic background. In Gharbia, private banks are often seen as reliable and trustworthy institutions, especially for individuals with higher education and upper-middle-class status. My personal experience and values also lead me to have a great deal of confidence in private banks, as they have been instrumental in managing and growing my family's wealth. Additionally, the cultural relativism in Egypt plays a role in my high confidence in private banks, as they are often viewed as essential for financial stability and success. Therefore, I would rate my confidence level in private banks as:\n\n1) A great deal"]}, {"persona": {"region": "Gharbia", "sex": "male", "age": 43, "country": "Egypt", "marital_status": "married", "education": "middle", "social_class": "lower middle class"}, "question": {"id": "Q78", "variant": 0}, "response": ["Based on the anthropological framework, as a married male from Gharbia, Egypt, with a middle education level and lower middle class background, my perspective on private banks is influenced by my cultural context, socioeconomic background, and personal experience. In Gharbia, private banks may not be as trusted or accessible compared to other regions or social classes. As an individual with lower middle class status, my confidence level in private banks may be lower due to limited access to financial resources and potential distrust of these institutions. Additionally, my cultural relativism and understanding of nuance would lead me to consider the nuanced phrasing of the question, as my response may differ based on specific circumstances or personal experiences with private banks.\n\n3"]}, {"persona": {"region": "Gharbia", "sex": "male", "age": 28, "country": "Egypt", "marital_status": "single", "education": "higher", "social_class": "lower middle class"}, "question": {"id": "Q78", "variant": 0}, "response": ["Based on the anthropological framework, my perspective as a single male from Gharbia, Egypt, who is 28 years old and part of the lower middle class, is influenced by my cultural context, individual values, and socioeconomic background. In Gharbia, private banks may not be as accessible or trustworthy for someone with my socioeconomic background. Additionally, my personal experience and values may lead me to have a lower confidence level in private banks due to potential financial barriers and limited experience with them. Therefore, I would choose option (3) Not very much as my confidence level in private banks."]}, {"persona": {"region": "Gharbia", "sex": "male", "age": 39, "country": "Egypt", "marital_status": "married", "education": "middle", "social_class": "lower middle class"}, "question": {"id": "Q78", "variant": 0}, "response": ["Based on the anthropological framework, my perspective as a married male from Gharbia, Egypt, who is 39 years old and part of the lower middle class, is influenced by my cultural context, individual values, and socioeconomic background. In Gharbia, there is a deep-rooted sense of community and reliance on traditional forms of banking, such as local credit unions and informal savings groups. As a member of the lower middle class, my socioeconomic background also plays a significant role in my perspective, as I may have limited exposure to private banks and their services. Additionally, my personal experience and values may lead me to prioritize trust and familiarity in financial institutions, which could impact my confidence level in private banks. Therefore, my chosen answer is (3) Not very much."]}, {"persona": {"region": "Gharbia", "sex": "male", "age": 30, "country": "Egypt", "marital_status": "married", "education": "middle", "social_class": "lower middle class"}, "question": {"id": "Q78", "variant": 0}, "response": ["Based on the anthropological framework, my cultural context as a married male from Gharbia, Egypt, with a middle education level and lower middle class status greatly influences my perception of private banks. My background and socioeconomic status have shaped my understanding of the banking system and my confidence level in private banks is not very high. Living in a rural area with limited access to financial resources has also contributed to my lack of confidence in private banks. Additionally, cultural relativism and the nuanced phrasing of the question play a role in my response, as the concept of private banks may not align with the values and experiences of individuals in my community.\n\n3"]}, {"persona": {"region": "Gharbia", "sex": "male", "age": 43, "country": "Egypt", "marital_status": "married", "education": "lower", "social_class": "lower middle class"}, "question": {"id": "Q78", "variant": 0}, "response": ["Based on the anthropological framework, as a married male from Gharbia, Egypt, with a lower education level and part of the lower middle class, my perspective on private banks is heavily influenced by my socioeconomic background and cultural context. In my community, there is a general mistrust of financial institutions, and many people like myself rely on informal savings and lending mechanisms instead. Additionally, my personal experience with banks has been limited, and I have heard stories of people losing money or being taken advantage of by these institutions. Therefore, I would rate my confidence level in private banks as (3) Not very much."]}, {"persona": {"region": "Gharbia", "sex": "male", "age": 36, "country": "Egypt", "marital_status": "married", "education": "higher", "social_class": "lower middle class"}, "question": {"id": "Q78", "variant": 0}, "response": ["Based on the anthropological framework, the persona's emic perspective as a married male from Gharbia, Egypt, of 36 years, with a completed higher education level and part of the lower middle class, would be influenced by his cultural context, individual values, and socioeconomic background. In Gharbia, private banks may not be as accessible or trusted as in more affluent areas, and the persona's socioeconomic background may also impact his level of confidence in private banks. Furthermore, his personal experience and values may lead him to be more cautious about trusting private banks. Therefore, the persona's response would likely be influenced by a combination of these factors.\n\n3"]}, {"persona": {"region": "Gharbia", "sex": "male", "age": 25, "country": "Egypt", "marital_status": "married", "education": "middle", "social_class": "upper middle class"}, "question": {"id": "Q78", "variant": 0}, "response": ["Based on my cultural context, coming from Gharbia, Egypt, where socioeconomic background and individual values play a significant role in shaping perceptions, I would rate my confidence level in private banks as (2) Quite a lot. In my upper middle class position, I have likely had positive experiences with private banks and have been exposed to the benefits they offer. Additionally, my age and education level have likely contributed to my understanding and trust in the financial sector, leading me to have a higher level of confidence in private banks."]}, {"persona": {"region": "Gharbia", "sex": "male", "age": 31, "country": "Egypt", "marital_status": "married", "education": "middle", "social_class": "upper middle class"}, "question": {"id": "Q78", "variant": 0}, "response": ["Based on the anthropological framework, my perspective as a married male from Gharbia, Egypt, who is 31 years old and part of the upper middle class, is heavily influenced by my cultural context, individual values, and socioeconomic background. In my cultural context, private banks may be seen as a symbol of financial stability and success, and as someone from the upper middle class, I may have had positive experiences with private banks. My individual values and personal experiences may also contribute to a high level of confidence in private banks, as I may have seen them as trustworthy and reliable institutions. Additionally, my socioeconomic background may have provided me with the financial resources and knowledge to engage with private banks, further influencing my confidence in them.\n\n2"]}, {"persona": {"region": "Gharbia", "sex": "male", "age": 33, "country": "Egypt", "marital_status": "married", "education": "higher", "social_class": "lower middle class"}, "question": {"id": "Q78", "variant": 0}, "response": ["Based on my personal experience and socioeconomic background as a married male from Gharbia, Egypt, I would rate my confidence level in private banks as not very much. In my cultural context, there is a level of distrust towards private banks due to a history of economic instability and lack of financial security. Additionally, my lower middle class status means that I have limited experience with private banking and may not have the same level of trust in them as those from higher socioeconomic backgrounds. Therefore, my confidence in private banks would not be very high.\n\n3"]}, {"persona": {"region": "Gharbia", "sex": "male", "age": 26, "country": "Egypt", "marital_status": "single", "education": "higher", "social_class": "upper middle class"}, "question": {"id": "Q78", "variant": 0}, "response": ["Based on the anthropological framework, as a single male from Gharbia, Egypt, who has completed higher education and considers myself part of the upper middle class, my perspective on private banks will be influenced by my cultural context, individual values, and socioeconomic background. In Gharbia, private banks are seen as a symbol of financial stability and success, and my higher education has provided me with the knowledge to understand the benefits and risks associated with private banking. Additionally, being part of the upper middle class means that I have likely had positive experiences with private banks and have the financial means to access their services. Therefore, I would rate my confidence level in private banks as (1) A great deal."]}, {"persona": {"region": "Gharbia", "sex": "female", "age": 45, "country": "Egypt", "marital_status": "married", "education": "middle", "social_class": "lower middle class"}, "question": {"id": "Q78", "variant": 0}, "response": ["From the perspective of a married female from Gharbia, Egypt, who is 45 years old, completed middle education, and considers herself part of the lower middle class, my answer to the question of rating my confidence level in private banks would be influenced by various factors. My cultural context and socioeconomic background would lead me to have limited trust in private banks, as they may not be easily accessible or cater to individuals from lower middle class backgrounds. Additionally, my individual values and personal experience may have led me to rely more on traditional methods of saving and banking, such as utilizing informal community savings groups. Overall, my answer would be influenced by a combination of cultural relativism, socioeconomic background, and personal experience, leading me to select option 3: Not very much. \n\n3"]}, {"persona": {"region": "Gharbia", "sex": "female", "age": 55, "country": "Egypt", "marital_status": "married", "education": "middle", "social_class": "upper middle class"}, "question": {"id": "Q78", "variant": 0}, "response": ["Based on the anthropological framework, my emic perspective as a married female from Gharbia, Egypt, who is 55 years old and part of the upper middle class, is influenced by my cultural context, individual values, and socioeconomic background. In Egypt, private banks are often seen as reliable and trustworthy institutions, especially for those in the upper middle class who have the means to invest and save. Additionally, my personal experience and values lead me to have a great deal of confidence in private banks, as they have provided me with financial security and opportunities for growth. Therefore, my answer is:\n\n1"]}, {"persona": {"region": "Gharbia", "sex": "female", "age": 27, "country": "Egypt", "marital_status": "married", "education": "higher", "social_class": "upper middle class"}, "question": {"id": "Q78", "variant": 0}, "response": ["Based on the anthropological framework, my answer is influenced by my individual values, personal experience, and socioeconomic background. As a married female from Gharbia, Egypt, who has completed higher education and considers myself part of the upper middle class, I have been exposed to the benefits and opportunities provided by private banks. I have seen how they have contributed to the financial stability and growth of individuals and families within my social circle. Additionally, my socioeconomic background has allowed me to access and utilize the services offered by private banks, further increasing my confidence in their capabilities. Therefore, my confidence level in private banks is (2) Quite a lot."]}, {"persona": {"region": "Gharbia", "sex": "female", "age": 42, "country": "Egypt", "marital_status": "married", "education": "higher", "social_class": "upper middle class"}, "question": {"id": "Q78", "variant": 0}, "response": ["Based on the anthropological framework, my emic perspective as a married female from Gharbia, Egypt, who has completed higher education and considers herself part of the upper middle class, shapes my confidence level in private banks. My cultural context, individual values, and personal experience lead me to choose option (2) Quite a lot. In Egypt, private banks are seen as trustworthy and reliable financial institutions, and my socioeconomic background and education have instilled in me a sense of confidence in their services. Additionally, my age and place in society contribute to my positive perception of private banks, as they have consistently served me well in managing my financial affairs."]}, {"persona": {"region": "Gharbia", "sex": "female", "age": 32, "country": "Egypt", "marital_status": "married", "education": "middle", "social_class": "upper middle class"}, "question": {"id": "Q78", "variant": 0}, "response": ["Based on the anthropological framework, my emic perspective as a married female from Gharbia, Egypt, who considers herself part of the upper middle class, is influenced by my cultural context, individual values, and socioeconomic background. In Gharbia, private banks may be seen as a symbol of financial security and stability, aligning with the values of the upper middle class. Additionally, my personal experience and education level may have provided me with the knowledge and understanding to have confidence in private banks. Therefore, I would rate my confidence level in private banks as (2) Quite a lot."]}, {"persona": {"region": "Gharbia", "sex": "male", "age": 27, "country": "Egypt", "marital_status": "married", "education": "higher", "social_class": "upper middle class"}, "question": {"id": "Q78", "variant": 0}, "response": ["Based on my cultural context, as a married male from Gharbia, Egypt, and considering myself part of the upper middle class, my socioeconomic background plays a significant role in shaping my perceptions. Additionally, my higher education level and age contribute to my understanding and experience with private banks. I have also been influenced by my cultural relativism, understanding that my perspective may differ from others based on their own backgrounds and experiences. Therefore, taking into account all these factors, I would rate my confidence level in private banks as: \n\n2) Quite a lot"]}, {"persona": {"region": "Gharbia", "sex": "female", "age": 27, "country": "Egypt", "marital_status": "married", "education": "higher", "social_class": "lower middle class"}, "question": {"id": "Q78", "variant": 0}, "response": ["Based on the anthropological framework, as a married female from Gharbia, Egypt, my emic perspective on private banks is influenced by my cultural context, individual values, and socioeconomic background. In Gharbia, private banks may not be easily accessible to those in the lower middle class, and my personal experience and values may lead me to have less confidence in them. Additionally, cultural relativism and nuance play a role, as my perception of private banks may differ from someone of a different socioeconomic background. Therefore, my confidence level in private banks would be \"Not very much\" (3)."]}, {"persona": {"region": "Gharbia", "sex": "female", "age": 37, "country": "Egypt", "marital_status": "married", "education": "middle", "social_class": "upper middle class"}, "question": {"id": "Q78", "variant": 0}, "response": ["Based on the anthropological framework, as a married female from Gharbia, Egypt, my emic perspective is influenced by my cultural context, individual values, socioeconomic background, and space and time. In Gharbia, private banks are often associated with stability, security, and prosperity, which aligns with my personal values and experience as part of the upper middle class. Additionally, my age and education level have exposed me to the benefits of private banking services, leading to a high level of confidence in their capabilities. Therefore, my confidence level in private banks is (1) A great deal."]}, {"persona": {"region": "Gharbia", "sex": "male", "age": 28, "country": "Egypt", "marital_status": "married", "education": "higher", "social_class": "working class"}, "question": {"id": "Q78", "variant": 0}, "response": ["Based on the anthropological framework, my perspective as a married male from Gharbia, Egypt, who is 28 years old and part of the working class, is heavily influenced by my cultural context, socioeconomic background, and personal experience. In Egypt, private banks are often associated with the wealthy and elite, and as a member of the working class, I may have limited access to or experience with private banks. Additionally, my cultural context and personal experience may lead me to have a lower level of confidence in private banks due to historical or societal factors. Therefore, my confidence level in private banks would likely be influenced by a combination of factors including my socioeconomic background, cultural context, and personal experience. \n\n3"]}, {"persona": {"region": "Gharbia", "sex": "female", "age": 50, "country": "Egypt", "marital_status": "married", "education": "middle", "social_class": "upper middle class"}, "question": {"id": "Q78", "variant": 0}, "response": ["Based on my cultural context in Gharbia, Egypt, my socioeconomic background, and my age and education level, I have a high level of confidence in private banks. In my community, private banks are often seen as a symbol of financial stability and success. Being part of the upper middle class, I have had positive experiences with private banks and have seen the benefits they provide to individuals and businesses. Additionally, my personal values and experiences have shaped my perception of private banks as trustworthy and reliable institutions. Therefore, I would rate my confidence level in private banks as:\n2"]}, {"persona": {"region": "Gharbia", "sex": "male", "age": 39, "country": "Egypt", "marital_status": "single", "education": "higher", "social_class": "working class"}, "question": {"id": "Q78", "variant": 0}, "response": ["Based on my emic perspective as a single male from Gharbia, Egypt, I understand that my cultural context and socioeconomic background greatly influence my views on private banks. In my community, there is a strong emphasis on family and kinship networks, and traditionally, people rely on these networks for financial support rather than private banks. Additionally, as a working class individual, I may not have had much exposure to private banks and may not have the same level of trust in them as someone from a higher socioeconomic background. My personal experience and individual values also play a role, as I have not had much interaction with private banks in my daily life. Therefore, I would rate my confidence level in private banks as (3) Not very much."]}, {"persona": {"region": "Gharbia", "sex": "female", "age": 45, "country": "Egypt", "marital_status": "married", "education": "higher", "social_class": "upper middle class"}, "question": {"id": "Q78", "variant": 0}, "response": ["Based on my emic perspective as a married female from Gharbia, Egypt, who has completed higher education and considers herself part of the upper middle class, my confidence level in private banks is high. In my cultural context, individuals who have achieved higher education and are part of the upper middle class often have positive experiences and interactions with private banks. My individual values and personal experience also play a role in this, as I have had positive experiences with private banks in managing my finances. Additionally, my socioeconomic background influences my confidence level, as individuals in the upper middle class often have more trust in private banks due to their financial stability and services offered. Considering all these factors, I am confident in private banks and have a great deal of trust in them.\n\n1"]}, {"persona": {"region": "Sharkia", "sex": "male", "age": 35, "country": "Egypt", "marital_status": "married", "education": "higher", "social_class": "upper middle class"}, "question": {"id": "Q78", "variant": 0}, "response": ["From my perspective as a married male from Sharkia, Egypt, who is 35 years old and part of the upper middle class, my confidence level in private banks is quite high. This perspective is influenced by my higher education level and socioeconomic background, which have provided me with a certain level of financial literacy and understanding of the banking system. Additionally, my cultural context and personal experience have shaped my positive view of private banks, as I have observed them being used by others in my social circle. I also recognize the importance of nuance in my answer, as the specific wording of the question may influence my response. Therefore, my choice is option (2) Quite a lot. \n\n2"]}, {"persona": {"region": "Sharkia", "sex": "female", "age": 55, "country": "Egypt", "marital_status": "married", "education": "middle", "social_class": "lower middle class"}, "question": {"id": "Q78", "variant": 0}, "response": ["Based on the anthropological framework, as a married female from Sharkia, Egypt, my emic perspective is influenced by my cultural context, individual values, and socioeconomic background. In Sharkia, there is a strong sense of community and trust in traditional banking systems, which aligns with my personal values. As a member of the lower middle class, I have limited access to financial resources and may have had negative experiences with private banks. Additionally, the cultural relativism in Egypt leads to skepticism of Western financial institutions. Therefore, my confidence level in private banks would be quite low as I do not have much trust or positive personal experiences with them.\n\n3"]}, {"persona": {"region": "Sharkia", "sex": "female", "age": 27, "country": "Egypt", "marital_status": "married", "education": "middle", "social_class": "lower middle class"}, "question": {"id": "Q78", "variant": 0}, "response": ["Based on the anthropological framework, my emic perspective as a married female from Sharkia, Egypt, who is part of the lower middle class, is influenced by my cultural context, individual values, and socioeconomic background. In Sharkia, private banks may not be as accessible or trusted compared to other regions or higher socioeconomic classes. My personal experience and values also play a role, as I may have had limited exposure or positive experiences with private banks. Additionally, my age and education level may contribute to a more cautious approach to financial institutions. Therefore, based on my background and perspective, I would rate my confidence level in private banks as (3) Not very much. \n\n3"]}, {"persona": {"region": "Sharkia", "sex": "female", "age": 52, "country": "Egypt", "marital_status": "married", "education": "middle", "social_class": "lower middle class"}, "question": {"id": "Q78", "variant": 0}, "response": ["Based on the anthropological framework, my response will be influenced by my cultural context, individual values, and socioeconomic background. As a married female from Sharkia, Egypt, my lower middle class status and limited education level may lead me to have limited exposure to private banks and financial institutions. Additionally, my cultural context may lead me to have a more conservative approach to financial matters, as well as a general skepticism towards institutions that are perceived as catering to the wealthy. Therefore, I would rate my confidence level in private banks as:\n\n3) Not very much"]}, {"persona": {"region": "Sharkia", "sex": "male", "age": 36, "country": "Egypt", "marital_status": "married", "education": "middle", "social_class": "lower middle class"}, "question": {"id": "Q78", "variant": 0}, "response": ["From the anthropological framework described above, I am influenced by my cultural context, socioeconomic background, and personal experience. As a married male from Sharkia, Egypt, I come from a lower middle class background and have completed middle education level. In my cultural context, trust in private banks may not be very high due to historical and societal reasons. Additionally, my socioeconomic background may lead me to have limited interaction with private banks and thus, limited confidence in their services. Considering these factors, my personal experience and cultural relativism lead me to have \"Not very much\" confidence in private banks.\n\n3"]}, {"persona": {"region": "Sharkia", "sex": "female", "age": 20, "country": "Egypt", "marital_status": "single", "education": "middle", "social_class": "working class"}, "question": {"id": "Q78", "variant": 0}, "response": ["Based on the anthropological framework, as a single female from Sharkia, Egypt, my emic perspective is influenced by my cultural context, individual values, and socioeconomic background. In Sharkia, private banks are not commonly used by working-class individuals, and my personal experience and values lead me to have limited confidence in them. Additionally, my age and education level also play a role in shaping my perspective on private banks. Therefore, I would rate my confidence level in private banks as:\n3) Not very much"]}, {"persona": {"region": "Sharkia", "sex": "male", "age": 60, "country": "Egypt", "marital_status": "married", "education": "middle", "social_class": "working class"}, "question": {"id": "Q78", "variant": 0}, "response": ["Based on my cultural context and socioeconomic background as a married male from Sharkia, Egypt, who is 60 years old and part of the working class, my perspective on private banks is influenced by my personal experience and individual values. In my cultural context, private banks may not have been accessible or relevant to me, and my socioeconomic background may have limited my interactions with them. Additionally, my age and education level may have also shaped my perception of private banks. Therefore, I would rate my confidence level in private banks as (3) Not very much."]}, {"persona": {"region": "Sharkia", "sex": "male", "age": 41, "country": "Egypt", "marital_status": "married", "education": "higher", "social_class": "upper middle class"}, "question": {"id": "Q78", "variant": 0}, "response": ["Based on the anthropological framework, my emic perspective as a married male from Sharkia, Egypt, who has completed higher education and considers myself part of the upper middle class, is that my cultural context and socioeconomic background greatly influence my confidence level in private banks. In Sharkia, private banks are often seen as a symbol of financial security and success, especially among the upper middle class. Additionally, my personal experience and individual values lead me to have a great deal of confidence in private banks due to the stability and opportunities they offer for financial growth. Therefore, I would rate my confidence level in private banks as:\n\n1"]}, {"persona": {"region": "Sharkia", "sex": "female", "age": 23, "country": "Egypt", "marital_status": "married", "education": "middle", "social_class": "lower middle class"}, "question": {"id": "Q78", "variant": 0}, "response": ["Based on the anthropological framework, as a married female from Sharkia, Egypt, my emic perspective on private banks is influenced by my cultural context, individual values, and socioeconomic background. In Sharkia, private banks may not be as accessible or trusted as in other areas, and my lower middle class status means I may not have had much exposure to private banking services. This, combined with my middle education level, leads me to have not very much confidence in private banks. Additionally, the cultural relativism of valuing community and family ties over financial institutions further contributes to my lack of confidence in private banks.\n\n3"]}, {"persona": {"region": "Sharkia", "sex": "male", "age": 49, "country": "Egypt", "marital_status": "married", "education": "higher", "social_class": "upper middle class"}, "question": {"id": "Q78", "variant": 0}, "response": ["Based on the anthropological framework, my emic perspective as a married male from Sharkia, Egypt, who is 49 years old, completed higher education, and considers himself part of the upper-middle class, is that my confidence level in private banks is influenced by my cultural context, individual values, and socioeconomic background. In Sharkia, there is a strong reliance on traditional financial institutions and a preference for maintaining personal relationships with local banks. My higher education has instilled in me a sense of skepticism and a preference for more secure and regulated financial institutions. Additionally, my socioeconomic status has provided me with access to and knowledge of private banks and their services. Therefore, my confidence level in private banks would be quite high (2)."]}, {"persona": {"region": "Sharkia", "sex": "female", "age": 30, "country": "Egypt", "marital_status": "married", "education": "middle", "social_class": "upper middle class"}, "question": {"id": "Q78", "variant": 0}, "response": ["From an emic perspective, as a married female from Sharkia, Egypt, my cultural context and socioeconomic background play a significant role in shaping my perception of private banks. In our society, there is a strong emphasis on financial stability and security, and as someone from the upper middle class, I have been exposed to and have access to private banking services. My individual values and personal experience also contribute to my confidence level in private banks, as I have had positive experiences with them and value the convenience and personalized services they offer. Additionally, my age and education level have provided me with the knowledge and understanding of the benefits of private banking. Therefore, based on these factors, I would rate my confidence level in private banks as (1) A great deal."]}, {"persona": {"region": "Sharkia", "sex": "male", "age": 39, "country": "Egypt", "marital_status": "married", "education": "higher", "social_class": "upper middle class"}, "question": {"id": "Q78", "variant": 0}, "response": ["Based on the anthropological framework, as a married male from Sharkia, Egypt with a higher education level and upper middle class status, my emic perspective on private banks is influenced by my cultural context, individual values, and socioeconomic background. In Egypt, private banks have been gaining popularity and are seen as a symbol of financial stability and success, especially among the upper middle class. My personal experience and values also contribute to my confidence in private banks, as I have seen them provide efficient and personalized financial services. Additionally, my socioeconomic background and education level have given me the opportunity to understand and utilize the benefits of private banks. Therefore, based on my perspective and understanding, I would rate my confidence level in private banks as: \n\n2\n\nQuite a lot"]}, {"persona": {"region": "Sharkia", "sex": "female", "age": 26, "country": "Egypt", "marital_status": "married", "education": "middle", "social_class": "lower middle class"}, "question": {"id": "Q78", "variant": 0}, "response": ["Based on the anthropological framework, as a married female from Sharkia, Egypt, my emic perspective on private banks would be influenced by my personal experience and socioeconomic background. As a member of the lower middle class, I may have limited exposure to private banks and may not have a high level of confidence in them due to my socioeconomic status. Additionally, my cultural context and cultural relativism would also play a role in shaping my perception of private banks. Therefore, the most accurate response from this perspective would be:\n3. Not very much"]}, {"persona": {"region": "Sharkia", "sex": "female", "age": 48, "country": "Egypt", "marital_status": "married", "education": "middle", "social_class": "lower middle class"}, "question": {"id": "Q78", "variant": 0}, "response": ["Based on the anthropological framework, the emic perspective of a married woman from Sharkia, Egypt, who is 48 years old and part of the lower middle class, would be heavily influenced by her cultural context, individual values, and socioeconomic background. In Sharkia, private banks may not be readily accessible to someone of her socioeconomic status, and the cultural context may shape her perception of private banks as institutions primarily for the wealthy. Her individual values and personal experiences may lead her to have limited confidence in private banks, as she may have had little exposure to or positive experiences with them. Therefore, her confidence level in private banks would likely be influenced by her cultural context and socioeconomic background, leading her to select option (3) Not very much. \n\n3"]}, {"persona": {"region": "Sharkia", "sex": "male", "age": 34, "country": "Egypt", "marital_status": "married", "education": "higher", "social_class": "upper middle class"}, "question": {"id": "Q78", "variant": 0}, "response": ["Based on the anthropological framework, my emic perspective as a married male from Sharkia, Egypt, who has completed higher education and considers himself part of the upper middle class, is influenced by my cultural context, individual values, and socioeconomic background. In my cultural context, private banks may be viewed as a symbol of financial stability and success, and my higher education may have provided me with a deeper understanding of the financial system, leading to a higher confidence level. Additionally, being part of the upper middle class, I likely have experience with private banks and have seen their benefits firsthand. Therefore, my response to the question is influenced by my cultural context, personal experience, and socioeconomic background.\n\n2"]}, {"persona": {"region": "Sharkia", "sex": "female", "age": 39, "country": "Egypt", "marital_status": "divorced", "education": "middle", "social_class": "lower middle class"}, "question": {"id": "Q78", "variant": 0}, "response": ["Based on my emic perspective as a divorced female from Sharkia, Egypt, with a middle education level and lower middle class background, my personal experience and cultural context have shaped my understanding of private banks. In my cultural context, private banks may be seen as inaccessible or untrustworthy due to limited financial resources and lack of exposure to financial institutions. Additionally, my socioeconomic background may contribute to a lack of confidence in private banks, as they may be perceived as catering primarily to the upper class. Furthermore, my age and place in society may also play a role in my perception of private banks, as they may not be a common or preferred option in my community. Overall, my nuanced understanding of private banks is shaped by my individual values, personal experience, and cultural relativism.\n\n3"]}, {"persona": {"region": "Sharkia", "sex": "male", "age": 39, "country": "Egypt", "marital_status": "married", "education": "middle", "social_class": "upper middle class"}, "question": {"id": "Q78", "variant": 0}, "response": ["Based on the anthropological framework, my emic perspective as a married male from Sharkia, Egypt, at the age of 39 and part of the upper middle class, is heavily influenced by my cultural context and socioeconomic background. In Sharkia, private banks are often seen as a symbol of financial stability and success, particularly for those in the upper middle class. My personal experience and individual values also play a role in shaping my perception of private banks, as I have observed their impact on the financial security and growth of my social network. Additionally, my socioeconomic background has granted me access to the services and benefits offered by private banks, further enhancing my confidence in them. Therefore, I would rate my confidence level in private banks as:\n2"]}, {"persona": {"region": "Qaliubiya", "sex": "male", "age": 62, "country": "Egypt", "marital_status": "married", "education": "middle", "social_class": "working class"}, "question": {"id": "Q78", "variant": 0}, "response": ["Based on the anthropological framework, as a married male from Qaliubiya, Egypt, my emic perspective is influenced by my cultural context, socioeconomic background, and personal experience. In Egypt, the banking system is heavily influenced by cultural norms and values, and my working-class background also shapes my view on financial institutions. Additionally, my age and education level play a role in how I perceive private banks. Considering these factors, I would rate my confidence level in private banks as:\n3) Not very much"]}, {"persona": {"region": "Qaliubiya", "sex": "male", "age": 33, "country": "Egypt", "marital_status": "married", "education": "middle", "social_class": "working class"}, "question": {"id": "Q78", "variant": 0}, "response": ["Based on the anthropological framework, as a married male from Qaliubiya, Egypt, my cultural context and socioeconomic background play a significant role in shaping my perspective on private banks. As a working-class individual with a middle education level, I have limited exposure to private banking institutions and their services. I am likely to rely on personal experiences and the experiences of those within my social network to form my opinion. Additionally, my confidence level in private banks is also influenced by my cultural values and the values of my community, which may prioritize more traditional forms of banking. Therefore, I am inclined to choose option (3) Not very much. \n\n3"]}, {"persona": {"region": "Qaliubiya", "sex": "male", "age": 62, "country": "Egypt", "marital_status": "married", "education": "higher", "social_class": "lower middle class"}, "question": {"id": "Q78", "variant": 0}, "response": ["Based on the anthropological framework, as a married male from Qaliubiya, Egypt, my emic perspective would be influenced by my cultural context, individual values and personal experience, socioeconomic background, and age. In my cultural context, private banks may not be as trusted as they are in western societies due to historical and political factors. My individual values and personal experience may lead me to have a lower confidence in private banks, as I may have heard stories or experienced firsthand the challenges of accessing financial services. Additionally, my lower middle class socioeconomic background may influence me to have a lower confidence in private banks as they may not cater to my financial needs. Lastly, as a 62-year-old, I may have a more traditional view on financial institutions, leading me to have a lower confidence in private banks. \n3"]}, {"persona": {"region": "Qaliubiya", "sex": "male", "age": 29, "country": "Egypt", "marital_status": "married", "education": "middle", "social_class": "working class"}, "question": {"id": "Q78", "variant": 0}, "response": ["Based on the anthropological framework, my emic perspective as a married male from Qaliubiya, Egypt, who is part of the working class, is influenced by my cultural context, individual values, and socioeconomic background. In my community, private banks may not be as accessible or trusted as they are in other parts of the world. Additionally, my personal experience and values may lead me to have a lower confidence level in private banks due to potential financial barriers and a lack of familiarity with their services. Therefore, I would rate my confidence level in private banks as (3) Not very much."]}, {"persona": {"region": "Qaliubiya", "sex": "female", "age": 42, "country": "Egypt", "marital_status": "married", "education": "higher", "social_class": "working class"}, "question": {"id": "Q78", "variant": 0}, "response": ["Based on the anthropological framework, my emic perspective as a married female from Qaliubiya, Egypt, with a working-class background and higher education, would shape my understanding of private banks. My cultural context and socioeconomic background would influence my view, as well as my personal experience and individual values. Additionally, my age and place are important factors. Therefore, I would rate my confidence level in private banks as option (3) Not very much."]}, {"persona": {"region": "Qaliubiya", "sex": "female", "age": 50, "country": "Egypt", "marital_status": "married", "education": "middle", "social_class": "lower middle class"}, "question": {"id": "Q78", "variant": 0}, "response": ["Based on the anthropological framework, as a married female from Qaliubiya, Egypt, my emic perspective towards private banks is influenced by my cultural context, individual values, socioeconomic background, and space and time. In my cultural context, private banks may not be a common or accessible option for someone from the lower middle class in Egypt, as they may cater to a wealthier clientele. My individual values and personal experience also play a role, as I may have had limited exposure to private banks and may not fully trust their services. Additionally, my socioeconomic background as a lower middle class individual may shape my perception of private banks, as I may not have the financial resources to engage with them. Considering these factors, my confidence level in private banks would likely be low, as I would not have much experience or trust in their services.\n\n3"]}, {"persona": {"region": "Qaliubiya", "sex": "male", "age": 29, "country": "Egypt", "marital_status": "married", "education": "higher", "social_class": "lower middle class"}, "question": {"id": "Q78", "variant": 0}, "response": ["Based on the anthropological framework, as a married male from Qaliubiya, Egypt, who is 29 years old and part of the lower middle class, my perspective on private banks is influenced by my cultural context, socioeconomic background, individual values, and personal experience. In Qaliubiya, private banks may not be as accessible or trustworthy for someone in my socioeconomic position. Additionally, my age and education level may have given me exposure to certain banking practices that have shaped my opinions. Therefore, my confidence level in private banks may not be very high. \n\n3"]}, {"persona": {"region": "Qaliubiya", "sex": "male", "age": 35, "country": "Egypt", "marital_status": "married", "education": "higher", "social_class": "working class"}, "question": {"id": "Q78", "variant": 0}, "response": ["Based on the anthropological framework, as a married male from Qaliubiya, Egypt, my emic perspective is heavily influenced by my cultural context and socioeconomic background. Living in a working-class community, I have limited exposure to private banks and my confidence level in them is not very high. This is due to the fact that private banks are often associated with the wealthy and elite, and may not cater to individuals from lower socioeconomic backgrounds like myself. Additionally, my individual values and personal experience play a significant role in shaping my perception of private banks, as I have not had much interaction with them in my day-to-day life. Therefore, my rating of confidence level in private banks is (3) Not very much."]}, {"persona": {"region": "Qaliubiya", "sex": "female", "age": 40, "country": "Egypt", "marital_status": "married", "education": "middle", "social_class": "working class"}, "question": {"id": "Q78", "variant": 0}, "response": ["Based on the anthropological framework, my perspective as a married female from Qaliubiya, Egypt, with a middle education level and working-class background is influenced by my cultural context, individual values, and socioeconomic background. In Qaliubiya, private banks may not be as accessible or trusted compared to other regions due to cultural norms and economic disparities. Additionally, my personal experience and values may lead me to prioritize traditional methods of saving and investing over private banks. As a member of the working class, I may have limited exposure to or trust in private banking institutions. Therefore, I would rate my confidence level in private banks as (3) Not very much."]}, {"persona": {"region": "Qaliubiya", "sex": "female", "age": 48, "country": "Egypt", "marital_status": "divorced", "education": "lower", "social_class": "working class"}, "question": {"id": "Q78", "variant": 0}, "response": ["Based on the anthropological framework, as a divorced female from Qaliubiya, Egypt, with a lower education level and part of the working class, my perspective on private banks would be influenced by my cultural context, individual values, and socioeconomic background. In Qaliubiya, private banks may not be as accessible or familiar to individuals with lower education levels or from the working class, and there might be a general mistrust or lack of confidence in these institutions due to cultural and socioeconomic factors. Additionally, my personal experience and values may lead me to be cautious about placing my trust in private banks, as I may have had negative experiences or heard stories from others in similar socioeconomic positions. Therefore, I would rate my confidence level in private banks as \"Not very much\" (3).\n\n3"]}, {"persona": {"region": "Qaliubiya", "sex": "male", "age": 46, "country": "Egypt", "marital_status": "married", "education": "middle", "social_class": "working class"}, "question": {"id": "Q78", "variant": 0}, "response": ["Based on the anthropological framework, my perspective as a married male from Qaliubiya, Egypt, with a middle education level and part of the working class, is heavily influenced by my cultural context, individual values, and socioeconomic background. Private banks may not be as accessible or relevant to individuals in my socioeconomic position, and my personal experiences and values may lead me to have less confidence in them. Additionally, my cultural relativism and nuanced understanding of the question may lead me to interpret \"confidence\" in private banks differently than someone from a different background. \n\n3"]}, {"persona": {"region": "Qaliubiya", "sex": "male", "age": 47, "country": "Egypt", "marital_status": "married", "education": "higher", "social_class": "lower middle class"}, "question": {"id": "Q78", "variant": 0}, "response": ["Based on the anthropological framework, as a married male from Qaliubiya, Egypt, with a lower middle class socioeconomic background, my perspective on private banks is heavily influenced by my cultural context, individual values, and personal experience. In Egypt, there is a deep-rooted mistrust of private banks due to past economic instability and corruption. Additionally, my lower middle class status means that I may not have had much interaction with private banks and may rely more on informal financial systems. Therefore, I would rate my confidence level in private banks as (3) Not very much."]}, {"persona": {"region": "Qaliubiya", "sex": "female", "age": 38, "country": "Egypt", "marital_status": "married", "education": "higher", "social_class": "working class"}, "question": {"id": "Q78", "variant": 0}, "response": ["Based on the anthropological framework, as a married female from Qaliubiya, Egypt, my emic perspective is influenced by my cultural context, individual values, socioeconomic background, and space and time. In Qaliubiya, private banks may not be as accessible or trustworthy as they would be in more urban or affluent areas. As a working-class woman with a higher education, I may have had limited exposure to private banks and may have heard negative experiences from others in my community. Therefore, my confidence level in private banks would be not very much (3)."]}, {"persona": {"region": "Qaliubiya", "sex": "male", "age": 58, "country": "Egypt", "marital_status": "married", "education": "middle", "social_class": "working class"}, "question": {"id": "Q78", "variant": 0}, "response": ["Based on the anthropological framework, as a married male from Qaliubiya, Egypt, who is 58 years old, completed middle education, and considers himself part of the working class, my perspective on private banks is influenced by my cultural context, socioeconomic background, and individual values. In Qaliubiya, there may be a preference for traditional banking methods and a lack of trust in private banks due to the cultural and socioeconomic factors. Additionally, my personal experience and values as a member of the working class may lead me to have limited confidence in private banks. Therefore, my confidence level in private banks would likely be (3) Not very much. \n\n3"]}, {"persona": {"region": "Qaliubiya", "sex": "female", "age": 27, "country": "Egypt", "marital_status": "married", "education": "higher", "social_class": "working class"}, "question": {"id": "Q78", "variant": 0}, "response": ["Based on my emic perspective as a married female from Qaliubiya, Egypt, who has completed higher education and considers myself part of the working class, my cultural context and socioeconomic background play a crucial role in shaping my confidence level in private banks. In Egypt, there is a long history of state-controlled banking and a deep cultural mistrust of private institutions. Additionally, as a member of the working class, I may have limited personal experience with private banks and rely more on the experiences and values of my community. My individual values and personal experiences, as well as my socioeconomic background, lead me to have not very much confidence in private banks. \n3"]}, {"persona": {"region": "Qaliubiya", "sex": "female", "age": 48, "country": "Egypt", "marital_status": "married", "education": "middle", "social_class": "upper middle class"}, "question": {"id": "Q78", "variant": 0}, "response": ["Based on the anthropological framework, my answer is influenced by my emic perspective as a married female from Qaliubiya, Egypt, where private banks are a common and trusted way of managing finances. Additionally, my cultural context as part of the upper middle class in Egypt greatly influences my confidence in private banks due to their role in maintaining and growing wealth. My individual values and personal experience also play a significant role in my answer, as I have had positive experiences with private banks and value their services. Furthermore, my socioeconomic background as part of the upper middle class has provided me with the financial stability and resources to confidently engage with private banks. Therefore, my answer is (1) A great deal."]}, {"persona": {"region": "Giza", "sex": "female", "age": 19, "country": "Egypt", "marital_status": "single", "education": "middle", "social_class": "working class"}, "question": {"id": "Q78", "variant": 0}, "response": ["Based on the anthropological framework, as a single female from Giza, Egypt, who is 19 years old and part of the working class, my emic perspective on private banks is shaped by my socioeconomic background and cultural context. Being from a working-class background, I have limited exposure to private banks and may not have had the opportunity to interact with them extensively. Additionally, the cultural context of Giza may also influence my perception, as there may be a preference for traditional banking methods or skepticism towards private institutions. Therefore, my confidence level in private banks would be not very much. \n\n3"]}, {"persona": {"region": "Giza", "sex": "female", "age": 38, "country": "Egypt", "marital_status": "married", "education": "higher", "social_class": "lower middle class"}, "question": {"id": "Q78", "variant": 0}, "response": ["Based on my emic perspective as a married female from Giza, Egypt, my cultural context and socioeconomic background greatly influence my perception of private banks. In my community, access to financial services is limited and the lower middle class, like myself, often face barriers in utilizing private banks. My personal experience and values also play a role in shaping my confidence level in private banks, as I have had limited exposure to them and do not have substantial wealth to invest. Additionally, my age and place further impact my perception, as older generations in my community may have more skepticism towards private banks. Therefore, based on my nuanced understanding of the question, I would rate my confidence level in private banks as (3) Not very much."]}, {"persona": {"region": "Beni Swaif/Beni Suef", "sex": "female", "age": 34, "country": "Egypt", "marital_status": "divorced", "education": "higher", "social_class": "lower class"}, "question": {"id": "Q78", "variant": 0}, "response": ["Based on my emic perspective as a divorced female from Beni Suef, Egypt, who comes from a lower socioeconomic background, my confidence level in private banks is not very much. This is influenced by the cultural context of my community where trust in private institutions may be lower, as well as my personal experience and values. Additionally, the socioeconomic background of being in the lower class may also affect my confidence level in private banks. Cultural relativism also plays a role, as the perception of private banks may vary based on one's background. Lastly, my age and place of living also contribute to my lower confidence in private banks, as I may have witnessed or experienced issues with these institutions in the past. \n\n3"]}, {"persona": {"region": "Beni Swaif/Beni Suef", "sex": "male", "age": 20, "country": "Egypt", "marital_status": "single", "education": "higher", "social_class": "working class"}, "question": {"id": "Q78", "variant": 0}, "response": ["Based on the anthropological framework, my emic perspective as a single male from Beni Swaif, Egypt, who has completed higher education and considers myself part of the working class, would be influenced by my cultural context, individual values, and socioeconomic background. In Egypt, private banks are not as commonly used or trusted as state-owned banks, which are seen as more reliable and secure. Additionally, as a member of the working class, I may have limited exposure to private banking services and may not have the financial means to utilize them. Therefore, my confidence level in private banks would be influenced by these factors, leading me to select option 3) Not very much."]}, {"persona": {"region": "Giza", "sex": "male", "age": 19, "country": "Egypt", "marital_status": "single", "education": "middle", "social_class": "upper middle class"}, "question": {"id": "Q78", "variant": 0}, "response": ["Based on the anthropological framework, my understanding and perspective on the confidence level in private banks is influenced by my individual values and personal experience, as well as my socioeconomic background. As a 19-year-old from Giza, Egypt, who considers myself part of the upper middle class, my exposure to private banks and financial institutions has been positive. My family's socioeconomic status has allowed me to have access to these services, and I have personally had good experiences with them. Additionally, the cultural context of my upbringing has instilled in me a sense of trust in the financial system. Therefore, my confidence level in private banks is quite high, as I believe in the security and reliability of their services.\n\n2"]}, {"persona": {"region": "Giza", "sex": "female", "age": 33, "country": "Egypt", "marital_status": "married", "education": "middle", "social_class": "working class"}, "question": {"id": "Q78", "variant": 0}, "response": ["Based on the anthropological framework, my perspective as a married female from Giza, Egypt, who completed middle education, considers myself part of the working class. My answer is influenced by my cultural context, individual values, and socioeconomic background. In Giza, the majority of people in the working class have limited access to financial resources and often rely on informal financial systems. This, combined with my personal experience and values, leads me to have little confidence in private banks. The historical and cultural context of Egypt also plays a part in my answer, as there is a general distrust of financial institutions due to past economic instability. Therefore, my perspective is rooted in the nuanced understanding of my socioeconomic background and cultural context.\n\n3"]}, {"persona": {"region": "Giza", "sex": "female", "age": 24, "country": "Egypt", "marital_status": "married", "education": "higher", "social_class": "working class"}, "question": {"id": "Q78", "variant": 0}, "response": ["Based on the anthropological framework, my perspective as a married female from Giza, Egypt, who is 24 years old, has completed higher education, and considers herself part of the working class, is heavily influenced by my cultural context, individual values, and socioeconomic background. In Egypt, there is a strong sense of community and reliance on family networks, which may impact my confidence in private banks. Additionally, as someone from the working class, I may have limited exposure to or trust in private banks due to my socioeconomic background. Therefore, my perspective on private banks may be influenced by a combination of cultural context, individual values, and socioeconomic background. \n\n2"]}, {"persona": {"region": "Giza", "sex": "male", "age": 50, "country": "Egypt", "marital_status": "married", "education": "higher", "social_class": "working class"}, "question": {"id": "Q78", "variant": 0}, "response": ["Based on the anthropological framework, my answer is influenced by my emic perspective as a married male from Giza, Egypt, my cultural context, and my socioeconomic background as part of the working class. In Egypt, private banks are often associated with the upper class and may not be accessible or trustworthy for individuals like myself. Additionally, my personal experience and values lead me to have a lower confidence level in private banks due to the lack of familiarity and trust. Therefore, my answer is (3) Not very much."]}, {"persona": {"region": "Beni Swaif/Beni Suef", "sex": "female", "age": 26, "country": "Egypt", "marital_status": "married", "education": "higher", "social_class": "lower middle class"}, "question": {"id": "Q78", "variant": 0}, "response": ["Based on the anthropological framework, my perspective as a married female from Beni Swaif, Egypt, is heavily influenced by my cultural context, socioeconomic background, and personal experience. Being from a lower middle-class background, my access to financial resources and exposure to private banks may not be as extensive as those from higher socioeconomic classes. Additionally, cultural norms and values in Egypt may also shape my views on private banks. Therefore, my confidence level in private banks may not be as high as someone from a different cultural and socioeconomic background.\n\n3"]}, {"persona": {"region": "Beni Swaif/Beni Suef", "sex": "male", "age": 40, "country": "Egypt", "marital_status": "single", "education": "lower", "social_class": "lower class"}, "question": {"id": "Q78", "variant": 0}, "response": ["Based on my individual values and personal experience, as well as my socioeconomic background, I have very little confidence in private banks. Being part of the lower class, I have had limited exposure to private banks and have often faced financial barriers that have made it difficult for me to access their services. Additionally, cultural relativism teaches me that there is a significant power imbalance between private banks and individuals like myself, which further erodes my confidence in their ability to cater to my needs. Therefore, my answer to the question is:\n\n3"]}, {"persona": {"region": "Beni Swaif/Beni Suef", "sex": "female", "age": 25, "country": "Egypt", "marital_status": "married", "education": "middle", "social_class": "lower middle class"}, "question": {"id": "Q78", "variant": 0}, "response": ["Based on the anthropological framework, as a married female from Beni Swaif/Beni Suef, Egypt, my emic perspective towards private banks is influenced by my cultural context, individual values, and socioeconomic background. In my community, there is often a lack of trust in private banks due to a history of economic instability and corruption. Additionally, as part of the lower middle class, I have limited access to financial resources and may be wary of potential risks associated with private banks. Therefore, I would rate my confidence level in private banks as (3) Not very much."]}, {"persona": {"region": "Beni Swaif/Beni Suef", "sex": "female", "age": 21, "country": "Egypt", "marital_status": "single", "education": "middle", "social_class": "lower middle class"}, "question": {"id": "Q78", "variant": 0}, "response": ["Based on my emic perspective as a single female from Beni Suef, Egypt, I have grown up in a lower middle class family and completed only a middle education level. My cultural context and socioeconomic background have greatly influenced my understanding of private banks. I have not had much exposure to private banking and have not had the privilege of benefiting from their services due to my lower middle class status. This has led me to not have much confidence in private banks as I have not had the means or opportunity to experience their benefits. Additionally, my personal experience and individual values also play a role in my lack of confidence in private banks as I have not seen them directly benefit people in my community. Therefore, my confidence level in private banks is not very much.\n3"]}, {"persona": {"region": "Beni Swaif/Beni Suef", "sex": "male", "age": 48, "country": "Egypt", "marital_status": "married", "education": "middle", "social_class": "lower middle class"}, "question": {"id": "Q78", "variant": 0}, "response": ["Based on the emic and etic perspectives, my cultural context, socioeconomic background, and personal experience, I would rate my confidence level in private banks as \"Not very much\" (3). As a married male from Beni Suef, Egypt, who considers himself part of the lower middle class, I have had limited exposure to private banks and their services. My cultural context and socioeconomic background have shaped my understanding of financial institutions, and I have not had significant positive experiences with private banks to warrant a high level of confidence in them. Additionally, my individual values and personal experience contribute to my lack of confidence in private banks, as I have not had the opportunity to engage with them extensively. Therefore, based on my perspective, I would rate my confidence level in private banks as \"Not very much\" (3)."]}, {"persona": {"region": "Beni Swaif/Beni Suef", "sex": "female", "age": 57, "country": "Egypt", "marital_status": "married", "education": "middle", "social_class": "working class"}, "question": {"id": "Q78", "variant": 0}, "response": ["Based on the anthropological framework, my understanding and answer to the question of rating confidence in private banks is influenced by my cultural context, socioeconomic background, individual values, and personal experience. As a married female from Beni Suef, Egypt, who is 57 years old, has completed middle education, and considers herself part of the working class, my confidence in private banks is likely to be influenced by the cultural context of my community, where traditional methods of saving and accessing financial services may be more prevalent. Additionally, my socioeconomic background as a working-class individual may impact my perception of private banks, potentially leading to a lower level of confidence in such institutions. Furthermore, my personal experience and values may play a role in shaping my confidence level in private banks, as I may have had limited exposure to or positive experiences with these institutions. Therefore, my perspective on this matter is likely to align with option 3: Not very much. \n\n3"]}, {"persona": {"region": "Beni Swaif/Beni Suef", "sex": "male", "age": 20, "country": "Egypt", "marital_status": "single", "education": "middle", "social_class": "working class"}, "question": {"id": "Q78", "variant": 0}, "response": ["Based on the anthropological framework, my emic perspective as a working-class individual from Beni Suef, Egypt, influences my understanding of the cultural context, individual values, and socioeconomic background. In this region, there is a strong sense of community and reliance on traditional forms of banking and financial support. As a result, my personal experience and values lead me to have limited confidence in private banks, as they may not align with the values and practices of my community. Additionally, my socioeconomic background as a working-class individual means I may not have had much exposure to private banks, leading to a lack of confidence in their services. Therefore, my confidence level in private banks would be (3) Not very much."]}, {"persona": {"region": "Giza", "sex": "female", "age": 59, "country": "Egypt", "marital_status": "married", "education": "higher", "social_class": "upper middle class"}, "question": {"id": "Q78", "variant": 0}, "response": ["Based on my personal experience and socioeconomic background as a married, educated woman from Giza, Egypt, I have had positive experiences with private banks and have a high level of confidence in their services. As a member of the upper middle class, I have had the opportunity to access and utilize the services offered by private banks, and have found them to be reliable and trustworthy. Additionally, my age and education level have provided me with the knowledge and understanding to make informed decisions regarding financial institutions. Therefore, I confidently choose option (1) A great deal."]}, {"persona": {"region": "Giza", "sex": "female", "age": 38, "country": "Egypt", "marital_status": "single", "education": "higher", "social_class": "lower middle class"}, "question": {"id": "Q78", "variant": 0}, "response": ["Based on the anthropological framework, my perspective as a single female from Giza, Egypt is influenced by my cultural context, socioeconomic background, and personal experience. As a member of the lower middle class in Egypt, my trust in private banks may be influenced by the financial services and opportunities available to individuals in my socioeconomic position. Additionally, my personal experience and the cultural context in which I live may shape my confidence level in private banks. Therefore, my answer is (3) Not very much."]}, {"persona": {"region": "Giza", "sex": "female", "age": 26, "country": "Egypt", "marital_status": "single", "education": "higher", "social_class": "working class"}, "question": {"id": "Q78", "variant": 0}, "response": ["Based on my emic perspective as a single female from Giza, Egypt, who is 26 years old and part of the working class, my cultural context and socioeconomic background play a significant role in shaping my confidence level in private banks. My personal experience and individual values also influence my perception. As a member of the working class, I may have limited exposure to private banking institutions and may not have had positive experiences with them. Additionally, cultural relativism reminds me that my perspective may differ from others based on their backgrounds. Therefore, I would rate my confidence level in private banks as:\n3\n\n(3) Not very much"]}, {"persona": {"region": "Giza", "sex": "male", "age": 39, "country": "Egypt", "marital_status": "married", "education": "middle", "social_class": "working class"}, "question": {"id": "Q78", "variant": 0}, "response": ["Based on the anthropological framework, as a married male from Giza, Egypt, my emic perspective on private banks would be influenced by my cultural context, individual values, socioeconomic background, and the nuance of the question. In Egypt, private banks may not be as accessible or trusted by the working class, especially those with a middle education level. Additionally, cultural relativism plays a role in my perception of private banks, as they may not align with my personal values and experiences. My socioeconomic background also affects my confidence level in private banks, as I may not have had positive experiences or interactions with them. Therefore, my confidence level in private banks would be influenced by these factors, leading me to choose option 3: Not very much. \n\n3"]}, {"persona": {"region": "Giza", "sex": "male", "age": 36, "country": "Egypt", "marital_status": "married", "education": "middle", "social_class": "working class"}, "question": {"id": "Q78", "variant": 0}, "response": ["As a married male from Giza, Egypt, my perspective on private banks is heavily influenced by my cultural context and socioeconomic background. In Egypt, private banks are often associated with the upper class and have historically been inaccessible to those from working-class backgrounds like mine. Additionally, my personal experience and individual values play a role in shaping my perception of private banks. Given my middle education level and limited exposure to financial institutions, I have little confidence in private banks and their ability to cater to the needs of individuals like myself. Therefore, I choose option 3: Not very much."]}, {"persona": {"region": "Giza", "sex": "female", "age": 30, "country": "Egypt", "marital_status": "single", "education": "higher", "social_class": "lower class"}, "question": {"id": "Q78", "variant": 0}, "response": ["Based on my emic perspective as a single female from Giza, Egypt, my cultural context and socioeconomic background play a significant role in shaping my perceptions. As a lower class individual, my access to financial resources and knowledge about private banks is limited. My individual values and personal experience have also influenced my confidence level in private banks, as I have not had positive experiences with them in the past. Additionally, the cultural relativism of valuing community and trust plays a role in my perception of private banks. Therefore, my confidence level in private banks is not very much. \n\n3"]}, {"persona": {"region": "Giza", "sex": "female", "age": 24, "country": "Egypt", "marital_status": "single", "education": "higher", "social_class": "lower class"}, "question": {"id": "Q78", "variant": 0}, "response": ["Based on my cultural context, as a single female from Giza, Egypt, my socioeconomic background as part of the lower class, and my individual values and personal experience, I would rate my confidence level in private banks as (3) Not very much. In my community, private banks are seen as institutions that primarily serve the wealthy and upper class, and as someone from the lower class, I have not had much exposure or positive experiences with private banks. Additionally, cultural relativism and nuance play a role in my answer, as the perception of private banks may vary between different socioeconomic classes and cultural backgrounds."]}, {"persona": {"region": "Giza", "sex": "male", "age": 65, "country": "Egypt", "marital_status": "married", "education": "middle", "social_class": "working class"}, "question": {"id": "Q78", "variant": 0}, "response": ["Based on the anthropological framework, as a 65-year-old married male from Giza, Egypt, with a middle education level and part of the working class, my perspective on private banks is influenced by cultural context, individual values, socioeconomic background, and space and time. In Egypt, there is a long history of skepticism towards private institutions, including banks, due to a lack of trust in their practices and concerns about corruption. Additionally, as a member of the working class, I may have limited access to and experience with private banks, which could impact my confidence level in them. Furthermore, my age and socioeconomic background may also contribute to a more cautious approach towards private banks. Therefore, my response to the question would be:\n\n3\n\nNot very much"]}, {"persona": {"region": "Giza", "sex": "female", "age": 56, "country": "Egypt", "marital_status": "married", "education": "middle", "social_class": "working class"}, "question": {"id": "Q78", "variant": 0}, "response": ["Based on the anthropological framework, as a married female from Giza, Egypt, my emic perspective is influenced by my cultural context, individual values, socioeconomic background, and space and time. In Egypt, there is a strong sense of community and trust in familiar and local institutions. As a working-class woman with a middle education level, I may not have had much exposure to private banks and may rely more on informal financial systems. Additionally, being 56 years old, I may have lived through economic instability and lack of trust in financial institutions. Therefore, my confidence level in private banks would likely be not very much. \n\n3"]}, {"persona": {"region": "Giza", "sex": "male", "age": 31, "country": "Egypt", "marital_status": "married", "education": "higher", "social_class": "lower middle class"}, "question": {"id": "Q78", "variant": 0}, "response": ["Based on the anthropological framework, my emic perspective as a married male from Giza, Egypt, and my etic perspective as someone from the lower middle class greatly influence my confidence level in private banks. The cultural context of Egypt, where trust in financial institutions may be influenced by historical and political factors, as well as my socioeconomic background, play a significant role in determining my confidence level. Additionally, my individual values and personal experience, including any past interactions with private banks, will also affect my perception. Finally, the nuance of the question, asking for a specific rating rather than a general opinion, further shapes my response.\n\n2"]}, {"persona": {"region": "Giza", "sex": "male", "age": 28, "country": "Egypt", "marital_status": "single", "education": "middle", "social_class": "working class"}, "question": {"id": "Q78", "variant": 0}, "response": ["Based on the anthropological framework, as a single male from Giza, Egypt, who is 28 years old and part of the working class with a middle education level, my perspective on private banks would be heavily influenced by my socioeconomic background, cultural context, and personal experience. My socioeconomic background would likely lead me to have limited access to private banking services, which could result in a lack of confidence in their effectiveness and trustworthiness. Additionally, the cultural context in Egypt may also shape my perception, as there may be a preference for more traditional or community-based financial systems. Considering these factors, my confidence level in private banks would likely be quite low, as I would have little personal experience with them and may have heard negative perceptions from others in similar socioeconomic and cultural circumstances.\n\n3"]}, {"persona": {"region": "Giza", "sex": "male", "age": 47, "country": "Egypt", "marital_status": "married", "education": "middle", "social_class": "lower middle class"}, "question": {"id": "Q78", "variant": 0}, "response": ["Based on the anthropological framework, as a married male from Giza, Egypt, my emic perspective on private banks is influenced by my cultural context, individual values, and socioeconomic background. In Egypt, the lower middle class often has limited access to financial resources and may feel marginalized by the banking system. Additionally, my personal experience and values may lead me to have a lower level of confidence in private banks due to past interactions or the lack of financial security. Therefore, I would rate my confidence level in private banks as: \n\n3) Not very much"]}, {"persona": {"region": "Giza", "sex": "male", "age": 26, "country": "Egypt", "marital_status": "single", "education": "middle", "social_class": "lower middle class"}, "question": {"id": "Q78", "variant": 0}, "response": ["Based on the anthropological framework, my answer to the question about my confidence level in private banks is influenced by my individual values and personal experience, as well as my socioeconomic background and cultural context. As a lower middle-class individual from Giza, Egypt, my experience with private banks has been limited due to my socioeconomic status and lack of exposure to financial institutions. Additionally, my cultural context and values may lead me to be more cautious and less trusting of private banks, as I may have seen or heard about others in similar socioeconomic situations facing challenges or exploitation from such institutions. Therefore, I would rate my confidence level in private banks as (3) Not very much."]}, {"persona": {"region": "Giza", "sex": "male", "age": 48, "country": "Egypt", "marital_status": "married", "education": "middle", "social_class": "upper middle class"}, "question": {"id": "Q78", "variant": 0}, "response": ["Based on the anthropological framework, my emic perspective as a married male from Giza, Egypt, would be influenced by my cultural context, individual values, and socioeconomic background. In the cultural context of Egypt, private banks may not be as widely trusted or utilized as in some Western cultures. My personal experience and values as a member of the upper middle class may also lead me to have a higher confidence level in private banks due to potential personal interactions or familiarity with the financial sector. Additionally, my socioeconomic background may provide me with more exposure and access to private banking services, thus influencing my confidence level. Therefore, I would rate my confidence level in private banks as:\n(2) Quite a lot"]}, {"persona": {"region": "Menya", "sex": "male", "age": 61, "country": "Egypt", "marital_status": "married", "education": "middle", "social_class": "working class"}, "question": {"id": "Q78", "variant": 0}, "response": ["Based on the anthropological framework, my answer is influenced by my cultural context as a married male from Menya, Egypt, and my socioeconomic background as a working-class individual. My age and education level also play a role in shaping my perspective. Additionally, my personal experience and values will influence my confidence level in private banks. Given these factors, I would rate my confidence level in private banks as not very much (3).\n\n3"]}, {"persona": {"region": "Menya", "sex": "male", "age": 41, "country": "Egypt", "marital_status": "married", "education": "middle", "social_class": "lower middle class"}, "question": {"id": "Q78", "variant": 0}, "response": ["Based on the anthropological framework, my emic perspective as a married male from Menya, Egypt, and my lower middle class socioeconomic background shape my understanding and perception of private banks. My cultural context and individual values also play a significant role in forming my opinion. I have had limited exposure to private banks due to my socioeconomic status, and my personal experience with them has been minimal. Additionally, cultural relativism teaches me to be skeptical of institutions that may favor the wealthy, and my nuance in understanding the question leads me to consider the limited access and benefits private banks may offer to someone like me.\n\n3"]}, {"persona": {"region": "Menya", "sex": "female", "age": 43, "country": "Egypt", "marital_status": "married", "education": "higher", "social_class": "working class"}, "question": {"id": "Q78", "variant": 0}, "response": ["Based on the anthropological framework, my emic perspective as a married female from Menya, Egypt, who is part of the working class, with a higher education level, and at the age of 43, is heavily influenced by my cultural context and socio-economic background. In Menya, there is a strong sense of community and reliance on traditional financial systems, such as informal savings groups and Islamic banking. Additionally, as a member of the working class, I may have limited exposure to private banks and may not have the financial resources to access their services. Furthermore, my personal values and experiences shape my perception of private banks, and I may have concerns about their accessibility, trustworthiness, and alignment with my cultural and religious beliefs. Therefore, my confidence level in private banks would likely be rated as (3) Not very much.\n\n3"]}, {"persona": {"region": "Menya", "sex": "male", "age": 57, "country": "Egypt", "marital_status": "married", "education": "middle", "social_class": "lower middle class"}, "question": {"id": "Q78", "variant": 0}, "response": ["Based on the anthropological framework, as a married male from Menya, Egypt, my emic perspective on private banks is influenced by my cultural context, individual values, and socioeconomic background. In Menya, private banks may not be as accessible or familiar to individuals in the lower middle class, and the cultural context may prioritize traditional banking methods or informal financial systems. My personal experience and values also play a role, as I may have had limited exposure to private banks and may not prioritize them in my financial decision-making. Additionally, my socioeconomic background as a lower middle class individual may lead me to have less confidence in private banks due to potential barriers to access and a lack of familiarity with their services.\n\n3"]}, {"persona": {"region": "Menya", "sex": "male", "age": 42, "country": "Egypt", "marital_status": "divorced", "education": "middle", "social_class": "lower middle class"}, "question": {"id": "Q78", "variant": 0}, "response": ["Based on my cultural context as a divorced male from Menya, Egypt, and my lower middle class socioeconomic background, my confidence level in private banks is not very high. In my experience, private banks may not have accessible services for individuals like me, and I may not have had positive interactions with them in the past. Additionally, my individual values and personal experience have influenced my perception of private banks, leading me to have a lower level of confidence in their services. Furthermore, the cultural relativism perspective reminds me that my perspective may differ from others due to my specific cultural and socioeconomic background. Therefore, my confidence level in private banks is not very much.\n\n3"]}, {"persona": {"region": "Menya", "sex": "female", "age": 59, "country": "Egypt", "marital_status": "married", "education": "middle", "social_class": "upper middle class"}, "question": {"id": "Q78", "variant": 0}, "response": ["Based on the anthropological framework, my understanding and perception of private banks would be influenced by my cultural context as a married female from Menya, Egypt, my age of 59, and my completion of middle education level. Additionally, my socioeconomic background as part of the upper middle class would also play a significant role in shaping my views. As a member of this specific cultural and socioeconomic group, I would likely have had limited exposure to private banks and may not have a high level of confidence in them due to a lack of familiarity and trust in the financial system. Therefore, I would choose option 3: Not very much."]}, {"persona": {"region": "Menya", "sex": "female", "age": 31, "country": "Egypt", "marital_status": "married", "education": "middle", "social_class": "working class"}, "question": {"id": "Q78", "variant": 0}, "response": ["From my emic perspective as a married female from Menya, Egypt, I have had limited exposure to private banks and their services due to my socioeconomic background as a working-class individual. My personal experience and values have shaped my understanding and perception of private banks, and I have not had much opportunity to interact with them. Additionally, the cultural context of Menya and the societal norms around banking and finance also play a role in shaping my confidence level in private banks. Given these factors, I would have to rate my confidence level in private banks as (3) Not very much."]}, {"persona": {"region": "Menya", "sex": "male", "age": 55, "country": "Egypt", "marital_status": "single", "education": "middle", "social_class": "working class"}, "question": {"id": "Q78", "variant": 0}, "response": ["Based on the anthropological framework, my response is influenced by my cultural context as a single male from Menya, Egypt, where private banks may not be as accessible or relevant to my everyday life. My individual values and personal experience, along with my socioeconomic background as part of the working class, also play a significant role in shaping my confidence level in private banks. Additionally, my age and middle education level may influence my perception of private banks. Therefore, my response is influenced by a combination of cultural context, individual values, socioeconomic background, and space and time. \n\n3"]}, {"persona": {"region": "Menya", "sex": "female", "age": 28, "country": "Egypt", "marital_status": "married", "education": "higher", "social_class": "lower middle class"}, "question": {"id": "Q78", "variant": 0}, "response": ["Based on the anthropological framework, my perspective as a married female from Menya, Egypt, with a lower middle-class background and higher education, is heavily influenced by my cultural context, individual values, and socioeconomic background. In Menya, private banks may not be as accessible or trusted compared to larger institutions. Additionally, my personal experience and values may lead me to be cautious in my confidence in private banks. Furthermore, my socioeconomic background may also play a role in my level of confidence, as I may not have had as much exposure or experience with private banks compared to those in higher economic brackets. Therefore, my confidence level in private banks would be \"Not very much\" (3) due to these cultural, individual, and socioeconomic factors."]}, {"persona": {"region": "Menya", "sex": "male", "age": 24, "country": "Egypt", "marital_status": "single", "education": "middle", "social_class": "working class"}, "question": {"id": "Q78", "variant": 0}, "response": ["Based on the anthropological framework, my perspective as a single male from Menya, Egypt, who has completed middle education and considers myself part of the working class, is heavily influenced by my cultural context, socioeconomic background, and personal experience. In Menya, private banks are often associated with the upper class and are not easily accessible to individuals like myself. Additionally, my limited education and exposure to financial institutions may contribute to a lack of confidence in private banks. Therefore, I would rate my confidence level in private banks as (3) Not very much."]}, {"persona": {"region": "Menya", "sex": "female", "age": 23, "country": "Egypt", "marital_status": "married", "education": "middle", "social_class": "working class"}, "question": {"id": "Q78", "variant": 0}, "response": ["Based on my cultural context and socioeconomic background, as a married female from Menya, Egypt, who has completed middle education and considers myself part of the working class, my confidence level in private banks would be quite low. In Menya, there is a strong reliance on informal financial systems and distrust of formal banking institutions. Additionally, as a working-class individual, I may have limited exposure to private banks and may not have had positive experiences with them. Therefore, I would rate my confidence level in private banks as (3) Not very much."]}, {"persona": {"region": "Menya", "sex": "male", "age": 27, "country": "Egypt", "marital_status": "single", "education": "middle", "social_class": "lower middle class"}, "question": {"id": "Q78", "variant": 0}, "response": ["Based on my emic perspective as a single male from Menya, Egypt, and my lower middle-class socioeconomic background, I have limited exposure to private banks and their services. My cultural context and individual values and personal experience lead me to not have a great deal of confidence in private banks, as they are often associated with the wealthy elite and are perceived as inaccessible to the average person like myself. Additionally, my age and middle education level have not provided me with much knowledge or experience in dealing with private banks. Therefore, I would have to choose option 3: Not very much."]}, {"persona": {"region": "Asyut", "sex": "male", "age": 30, "country": "Egypt", "marital_status": "married", "education": "middle", "social_class": "working class"}, "question": {"id": "Q78", "variant": 0}, "response": ["Based on the anthropological framework, my perspective as a married male from Asyut, Egypt, who is 30 years old, has completed middle education, and considers himself part of the working class, is heavily influenced by my cultural context, individual values, and socioeconomic background. In Asyut, private banks may not be as accessible or trustworthy as they are in other places, and my working-class background may limit my exposure and confidence in using them. Additionally, my personal experience and values may lead me to prioritize more traditional or familiar methods of banking. Therefore, my confidence level in private banks would likely be not very much. \n3\n\nI hope my chosen answer successfully reflects the perspective described above."]}, {"persona": {"region": "Asyut", "sex": "female", "age": 26, "country": "Egypt", "marital_status": "married", "education": "middle", "social_class": "working class"}, "question": {"id": "Q78", "variant": 0}, "response": ["Based on the anthropological framework outlined, as a married female from Asyut, Egypt, my emic perspective is influenced by my cultural context, individual values, and socioeconomic background. In Egyptian society, there is a strong sense of collectivism and reliance on family and community support, which may lead to a lower confidence level in private banks. Additionally, as a member of the working class with only a middle education level, I may have limited exposure to financial institutions and may not have had positive experiences with them. Therefore, I would rate my confidence level in private banks as (3) Not very much."]}, {"persona": {"region": "Asyut", "sex": "male", "age": 32, "country": "Egypt", "marital_status": "single", "education": "higher", "social_class": "lower middle class"}, "question": {"id": "Q78", "variant": 0}, "response": ["Based on the anthropological framework, my emic perspective as a single male from Asyut, Egypt, leads me to consider my socioeconomic background, cultural context, and personal experience in answering this question. As a member of the lower middle class who has completed higher education, I have had personal experiences with private banks and have seen their impact on individuals in similar socioeconomic positions. I have also observed the influence of cultural attitudes towards financial institutions in my community. Taking into account these factors, I would rate my confidence level in private banks as (3) Not very much."]}, {"persona": {"region": "Asyut", "sex": "female", "age": 21, "country": "Egypt", "marital_status": "married", "education": "middle", "social_class": "working class"}, "question": {"id": "Q78", "variant": 0}, "response": ["Based on the anthropological framework described above, I would like to answer the question considering the cultural context, individual values, and socioeconomic background of a married female from Asyut, Egypt. As someone from a working-class background with only a middle education level, I may not have had much exposure to private banks or the financial sector. Additionally, cultural relativism suggests that my perception of private banks may be influenced by the prevailing attitudes towards financial institutions in my community. Therefore, I would rate my confidence level in private banks as (3) Not very much."]}, {"persona": {"region": "Asyut", "sex": "female", "age": 30, "country": "Egypt", "marital_status": "married", "education": "higher", "social_class": "working class"}, "question": {"id": "Q78", "variant": 0}, "response": ["Based on the anthropological framework, my perspective as a married female from Asyut, Egypt, who is 30 years old and part of the working class, is heavily influenced by my cultural context, socioeconomic background, and personal experience. In Asyut, private banks may not be as accessible or trustworthy as they are in other parts of the world. Additionally, as a member of the working class, my socioeconomic background may not afford me the same opportunities or confidence in private banks as those in higher socioeconomic classes. Therefore, my confidence level in private banks would likely be lower compared to someone from a different cultural and socioeconomic background. \n\n3"]}, {"persona": {"region": "Asyut", "sex": "female", "age": 42, "country": "Egypt", "marital_status": "married", "education": "higher", "social_class": "lower middle class"}, "question": {"id": "Q78", "variant": 0}, "response": ["From the perspective of a married female from Asyut, Egypt, who is 42 years old, completed higher education, and considers herself part of the lower middle class, it is important to consider the cultural context and socio-economic background. In Asyut, private banks may not be as accessible or trusted as they are in more affluent areas. Additionally, being part of the lower middle class may mean that there are limited opportunities for investment or financial growth, leading to a lack of confidence in private banks. The individual values and personal experiences of this persona may also play a role in their confidence level in private banks, as they may have had negative experiences with financial institutions in the past. Therefore, it is likely that this persona would choose option (3) Not very much, reflecting their lack of confidence in private banks due to their cultural context, socio-economic background, and personal experiences. \n\n3"]}, {"persona": {"region": "Sohag", "sex": "male", "age": 63, "country": "Egypt", "marital_status": "married", "education": "middle", "social_class": "lower middle class"}, "question": {"id": "Q78", "variant": 0}, "response": ["Based on the anthropological framework, my response is heavily influenced by my cultural context, socioeconomic background, and personal experience. As a married male from Sohag, Egypt, my lower middle-class status and middle education level have shaped my understanding and perception of private banks. In my community, there is a general lack of trust in financial institutions, and my personal experience has reinforced this skepticism. Additionally, my age and place of residence have limited my exposure to private banks, leading to a lack of confidence in their services. Therefore, I select:\n\n3. Not very much"]}, {"persona": {"region": "Sohag", "sex": "male", "age": 27, "country": "Egypt", "marital_status": "married", "education": "middle", "social_class": "working class"}, "question": {"id": "Q78", "variant": 0}, "response": ["Based on the anthropological framework, as a married male from Sohag, Egypt, who is 27 years old, completed middle education, and considers myself part of the working class, my perspective on private banks would be heavily influenced by my socioeconomic background and cultural context. In Sohag, private banks may not be as accessible or trustworthy as they are in more urban or affluent areas. Additionally, my limited education level may impact my understanding of how private banks operate. Therefore, I would likely have a low confidence level in private banks due to these factors.\n\n3"]}, {"persona": {"region": "Sohag", "sex": "male", "age": 56, "country": "Egypt", "marital_status": "married", "education": "higher", "social_class": "upper middle class"}, "question": {"id": "Q78", "variant": 0}, "response": ["Based on the anthropological framework, my perspective as a married male from Sohag, Egypt, who is 56 years old, has completed higher education, and considers myself part of the upper middle class, is shaped by my cultural context, individual values, and socioeconomic background. In Sohag, private banks may not be as trusted as they are in other parts of the world, but as a member of the upper middle class with a higher education level, I have been exposed to the benefits and security that private banks can provide. My confidence level in private banks is quite high due to my understanding of their services and the stability they offer in managing my financial assets.\n\n2"]}, {"persona": {"region": "Sohag", "sex": "male", "age": 51, "country": "Egypt", "marital_status": "married", "education": "higher", "social_class": "lower middle class"}, "question": {"id": "Q78", "variant": 0}, "response": ["Based on the anthropological framework, my emic perspective as a married male from Sohag, Egypt, who is 51 years old and part of the lower middle class, significantly influences my confidence level in private banks. The cultural context in Egypt, particularly in Sohag, has a significant impact on how individuals perceive and interact with financial institutions. Additionally, my socioeconomic background and personal experience with private banks play a crucial role in shaping my confidence level. As a member of the lower middle class, I have limited financial resources and may have had negative experiences with private banks, leading to a lower confidence level. Furthermore, the cultural relativism perspective emphasizes that my perception of private banks may differ from those in higher socioeconomic classes. Therefore, my confidence level in private banks is likely to be influenced by a combination of these factors, leading me to choose the option:\n\n3) Not very much"]}, {"persona": {"region": "Sohag", "sex": "female", "age": 26, "country": "Egypt", "marital_status": "married", "education": "higher", "social_class": "working class"}, "question": {"id": "Q78", "variant": 0}, "response": ["Based on the anthropological framework, my emic perspective as a married female from Sohag, Egypt, with a working-class background and higher education, influences my view on private banks. The cultural context of Sohag, Egypt, and my socioeconomic background play a significant role in shaping my opinion. Additionally, my individual values and personal experience have led me to consider the level of trust and confidence I have in private banks. Furthermore, the nuance of the question also matters, as it may impact my response. Therefore, I would rate my confidence level in private banks as:\n3. Not very much"]}, {"persona": {"region": "Sohag", "sex": "female", "age": 29, "country": "Egypt", "marital_status": "married", "education": "higher", "social_class": "upper middle class"}, "question": {"id": "Q78", "variant": 0}, "response": ["Based on the anthropological framework, my perspective as a married female from Sohag, Egypt, who is 29 years old, highly educated, and part of the upper middle class, is heavily influenced by my individual values and personal experience, cultural context, and socioeconomic background. As a well-educated individual from a relatively affluent background, I have likely been exposed to and have a good understanding of the benefits and security provided by private banks. Additionally, the cultural context of my social circle and community may also greatly value the services and security provided by private banks. Given my background, I would rate my confidence level in private banks as:\n2\n\nQuite a lot"]}, {"persona": {"region": "Sohag", "sex": "male", "age": 51, "country": "Egypt", "marital_status": "married", "education": "middle", "social_class": "lower middle class"}, "question": {"id": "Q78", "variant": 0}, "response": ["Based on the anthropological framework, my response to the question about confidence in private banks is heavily influenced by my cultural context, socioeconomic background, and personal experience. As a married male from Sohag, Egypt, I come from a lower middle-class background and have completed only middle-level education. In my cultural context, private banks may not be as accessible or trustworthy as they are in more affluent areas. Additionally, my personal experience and lack of exposure to private banking services may lead me to have limited confidence in them. Therefore, my perspective is shaped by my socioeconomic background, cultural context, and personal experience.\n\n3"]}, {"persona": {"region": "Qena", "sex": "male", "age": 32, "country": "Egypt", "marital_status": "single", "education": "middle", "social_class": "working class"}, "question": {"id": "Q78", "variant": 0}, "response": ["Based on my emic perspective as a single male from Qena, Egypt, I understand that my cultural context and socioeconomic background greatly influence my confidence level in private banks. In my community, there is a general distrust of private banks due to economic instability and a lack of access to financial resources. Additionally, my individual values and personal experience as a working-class individual with only a middle education level shape my perception of private banks as inaccessible and potentially untrustworthy institutions. Considering the cultural relativism and nuanced understanding of the question, I must rate my confidence level in private banks as (3) Not very much."]}, {"persona": {"region": "Qena", "sex": "male", "age": 54, "country": "Egypt", "marital_status": "married", "education": "middle", "social_class": "lower middle class"}, "question": {"id": "Q78", "variant": 0}, "response": ["Based on my personal experience and socioeconomic background as a married male from Qena, Egypt, I am part of the lower middle class and have only completed middle education level. This has greatly influenced my perceptions and understanding of private banks. In our cultural context, private banks are often seen as institutions for the wealthy and elite, and as someone from the lower middle class, I have little exposure and access to such institutions. Additionally, cultural relativism plays a role in my understanding, as there is a general mistrust of financial institutions in our community. Therefore, based on my emic perspective and personal experience, I would rate my confidence level in private banks as (3) Not very much."]}, {"persona": {"region": "Qena", "sex": "male", "age": 25, "country": "Egypt", "marital_status": "single", "education": "lower", "social_class": "lower class"}, "question": {"id": "Q78", "variant": 0}, "response": ["From the perspective of a single male from Qena, Egypt, who is 25 years old, has completed lower education, and considers himself part of the lower class, the cultural context is crucial in understanding his perspective. In Egypt, there is a strong sense of collectivism and reliance on community support, which may lead to a lack of trust in private banks. Additionally, his lower socioeconomic background may have limited his exposure to private banking services, leading to a lack of confidence in their ability to meet his financial needs. Overall, his individual values and personal experiences, along with his cultural context and socioeconomic background, would likely lead him to have \"Not very much\" confidence in private banks.\n\n3"]}, {"persona": {"region": "Aswan", "sex": "male", "age": 34, "country": "Egypt", "marital_status": "single", "education": "middle", "social_class": "lower class"}, "question": {"id": "Q78", "variant": 0}, "response": ["Based on my personal experience and socioeconomic background as a lower-class male from Aswan, Egypt, my confidence level in private banks is not very much. In my cultural context, private banks are often seen as institutions for the wealthy and inaccessible to people like me. Additionally, my limited education level may contribute to a lack of understanding and trust in the workings of private banks. As a result, I have little confidence in their ability to serve my financial needs. \n\n3"]}, {"persona": {"region": "Aswan", "sex": "female", "age": 31, "country": "Egypt", "marital_status": "married", "education": "middle", "social_class": "lower middle class"}, "question": {"id": "Q78", "variant": 0}, "response": ["Based on the anthropological framework, my emic perspective as a married female from Aswan, Egypt, who is part of the lower middle class and has completed middle education level, is heavily influenced by my cultural context, individual values, and socioeconomic background. In Aswan, access to private banks may not be as prevalent or accessible as in other regions. Additionally, my lower middle class status and limited education may contribute to a lack of confidence in private banks due to a potential lack of understanding of their services and a concern about potentially high fees. Therefore, my perspective would lead me to select option 3: Not very much. \n\n3"]}, {"persona": {"region": "Aswan", "sex": "female", "age": 39, "country": "Egypt", "marital_status": "married", "education": "middle", "social_class": "working class"}, "question": {"id": "Q78", "variant": 0}, "response": ["Based on the anthropological framework, as a married female from Aswan, Egypt, my emic perspective is influenced by my cultural context, individual values, and socioeconomic background. In Aswan, private banks may not be as accessible or trusted by the working class, especially those with a middle education level. The cultural relativism in Egypt also plays a role in shaping my perception of private banks. Additionally, my age and socioeconomic background may impact my confidence level in private banks. Therefore, my chosen answer is:\n\n3"]}, {"persona": {"region": "Qena", "sex": "female", "age": 27, "country": "Egypt", "marital_status": "married", "education": "lower", "social_class": "lower middle class"}, "question": {"id": "Q78", "variant": 0}, "response": ["Based on the anthropological framework, as a married female from Qena, Egypt, my emic perspective on private banks is influenced by my lower middle class socioeconomic background and lower education level. My personal experience and individual values also play a significant role in shaping my perception. Cultural relativism reminds me that my view may differ from others, and my nuanced understanding of the question leads me to believe that my confidence level in private banks would be \"Not very much\" (3)."]}, {"persona": {"region": "Qena", "sex": "male", "age": 40, "country": "Egypt", "marital_status": "single", "education": "middle", "social_class": "lower middle class"}, "question": {"id": "Q78", "variant": 0}, "response": ["Based on the anthropological framework, my emic perspective as a single male from Qena, Egypt, would be influenced by my cultural context, individual values and personal experience, socioeconomic background, cultural relativism, space and time, and nuance. In Qena, private banks may not be easily accessible or trusted by individuals from lower middle class backgrounds. Additionally, my personal experience and values may lead me to be cautious about trusting private banks, as they may not have a strong track record of serving the financial needs of individuals like myself. Therefore, my confidence level in private banks would be (3) Not very much."]}, {"persona": {"region": "Qena", "sex": "male", "age": 30, "country": "Egypt", "marital_status": "single", "education": "middle", "social_class": "working class"}, "question": {"id": "Q78", "variant": 0}, "response": ["Based on my emic perspective as a single male from Qena, Egypt, and considering my cultural context, individual values, and socioeconomic background, I would rate my confidence level in private banks as not very much. In my community, private banks are not commonly used, and there is a general skepticism towards them. My personal experience and values also contribute to my lack of confidence in private banks as I have seen people in my social circle struggle with financial issues related to private banks. Additionally, as part of the working class with limited education, I have not had much exposure to private banking services and therefore do not have a strong level of confidence in them. \n\n3"]}]