[{"persona": {"region": "Fayoum", "sex": "male", "age": 46, "country": "Egypt", "marital_status": "married", "education": "higher", "social_class": "lower middle class"}, "question": {"id": "Q83", "variant": 0}, "response": ["Based on my emic perspective as a married male from Fayoum, Egypt, I have grown up in a cultural context where the UN has been seen as a force for good in the world, particularly in addressing global issues such as poverty and conflict. My personal experience and individual values have led me to have a great deal of confidence in the UN, as I believe in the importance of international cooperation and diplomacy. Additionally, my lower middle class socioeconomic background has influenced my perception of the UN as an institution that can potentially address global inequalities and promote peace. Therefore, I choose option (1) A great deal."]}, {"persona": {"region": "Fayoum", "sex": "female", "age": 30, "country": "Egypt", "marital_status": "married", "education": "middle", "social_class": "lower middle class"}, "question": {"id": "Q83", "variant": 0}, "response": ["Based on the anthropological framework, as a married female from Fayoum, Egypt, who considers herself part of the lower middle class, my emic perspective is influenced by my cultural context, individual values, and socioeconomic background. In my cultural context, there may be a lack of awareness or understanding of the workings and impact of the United Nations. My individual values and personal experience may lead me to have not very much confidence in the UN, as I may feel that it does not directly address or improve the specific challenges and issues faced by individuals in my socioeconomic background. Additionally, my lower middle class status may shape my perception of the UN as an institution that is distant and disconnected from my everyday reality, leading to a lack of confidence in its efficacy. Therefore, my answer to the question would be (3) Not very much."]}, {"persona": {"region": "Fayoum", "sex": "male", "age": 60, "country": "Egypt", "marital_status": "married", "education": "higher", "social_class": "working class"}, "question": {"id": "Q83", "variant": 0}, "response": ["In my cultural context as a married male from Fayoum, Egypt, my age, and level of education, as well as my working-class background, play a significant role in shaping my perspective on the United Nations (UN). My personal values and experiences, along with my socioeconomic background, also influence my perception of international organizations like the UN. Additionally, the cultural relativism framework reminds me that my perspective is not better or worse than others, just different. Therefore, based on these factors, I would choose option 3, \"Not very much,\" as my confidence in the United Nations. \n\n3"]}, {"persona": {"region": "Fayoum", "sex": "male", "age": 20, "country": "Egypt", "marital_status": "single", "education": "middle", "social_class": "lower middle class"}, "question": {"id": "Q83", "variant": 0}, "response": ["From the perspective of a single male from Fayoum, Egypt, who is 20 years old and comes from a lower middle-class background, my answer to the question of how much confidence I have in the United Nations (UN) is influenced by my cultural context, individual values, and socioeconomic background. As someone from a lower-middle-class background, I have limited access to information and resources, which may affect my knowledge and understanding of the UN and its role in global affairs. Additionally, being a young person from a specific cultural and geographical context, I may not have had much exposure to the UN and its work, leading to a lack of confidence in its effectiveness. My personal experience and limited access to education and resources also play a role in shaping my perception of the UN. Therefore, my answer is (3) Not very much."]}, {"persona": {"region": "Fayoum", "sex": "female", "age": 39, "country": "Egypt", "marital_status": "married", "education": "higher", "social_class": "lower middle class"}, "question": {"id": "Q83", "variant": 0}, "response": ["Based on the anthropological framework, as a married female from Fayoum, Egypt, with a lower middle class socioeconomic background, my perspective on the United Nations (UN) would be influenced by my cultural context, individual values, and personal experience. Being from Egypt, a country that has had a complex relationship with international organizations and global politics, I may have a cautious perspective on the UN's effectiveness. Additionally, my personal experience and socioeconomic background may lead me to have a more critical view of international organizations, as they may not directly address the challenges faced by individuals in my community. Therefore, I would choose option 3) Not very much."]}, {"persona": {"region": "Fayoum", "sex": "male", "age": 33, "country": "Egypt", "marital_status": "married", "education": "higher", "social_class": "working class"}, "question": {"id": "Q83", "variant": 0}, "response": ["Based on the anthropological framework, as a married male from Fayoum, Egypt, cultural context is pivotal in my understanding and answering of this question. Additionally, my individual values and personal experience, as well as my socioeconomic background, play a significant role in my perception of the United Nations. Additionally, cultural relativism is crucial in understanding different personas, and the nuance of the phrasing of the question will also influence my answer. Therefore, my response is based on a combination of my personal experiences and cultural background, and my perception of the United Nations is likely to be influenced by these factors.\n\n2"]}, {"persona": {"region": "Port Said", "sex": "female", "age": 45, "country": "Egypt", "marital_status": "married", "education": "higher", "social_class": "lower middle class"}, "question": {"id": "Q83", "variant": 0}, "response": ["Based on my emic perspective as a married female from Port Said, Egypt, and my etic understanding of the cultural context in which I live, I have limited exposure to the United Nations and its work. My individual values and personal experience lead me to believe that the UN may have good intentions, but I have not personally witnessed significant impact or assistance from them in my community. Additionally, my lower middle-class socioeconomic background has not afforded me the opportunity to engage with the UN's programs or initiatives. Therefore, I would have to choose option (3) Not very much, as I do not have a strong basis for confidence in the United Nations."]}, {"persona": {"region": "Port Said", "sex": "male", "age": 42, "country": "Egypt", "marital_status": "married", "education": "middle", "social_class": "lower middle class"}, "question": {"id": "Q83", "variant": 0}, "response": ["Based on my emic perspective as a married male from Port Said, Egypt, I have to consider the historical and cultural context as well as my socioeconomic background when answering this question. In my community, there is a sense of skepticism towards international organizations such as the UN due to a history of perceived Western interference and lack of tangible benefits for individuals in my socioeconomic class. Additionally, my personal experience and individual values play a significant role in shaping my confidence in the UN. Given these factors, I would have to say that I have (3) Not very much confidence in the United Nations."]}, {"persona": {"region": "Port Said", "sex": "male", "age": 28, "country": "Egypt", "marital_status": "single", "education": "middle", "social_class": "lower middle class"}, "question": {"id": "Q83", "variant": 0}, "response": ["Based on my personal experience and cultural background, as a lower middle class single male from Port Said, Egypt, I have had limited exposure to the workings of international organizations such as the United Nations. My socioeconomic background has also influenced my access to information and resources, which may impact my confidence in the UN. Additionally, my age and education level may have shaped my understanding of global politics and the role of the UN in addressing worldwide issues. Considering these factors, I would choose option (3) Not very much. \n\n3"]}, {"persona": {"region": "Port Said", "sex": "female", "age": 30, "country": "Egypt", "marital_status": "married", "education": "higher", "social_class": "lower middle class"}, "question": {"id": "Q83", "variant": 0}, "response": ["Based on my emic perspective, as a married female from Port Said, Egypt, who is 30 years old and part of the lower middle class, I have been raised in a cultural context where the United Nations is seen as a source of hope and support for countries in need. My personal experience and values have also shaped my perception of the UN, as I have witnessed the positive impact of their programs in my community. Additionally, my socioeconomic background has influenced my view, as I have personally benefited from UN initiatives aimed at improving education and healthcare in my area. Considering cultural relativism, I understand that different cultures may have different opinions of the UN, but from my perspective, I have a great deal of confidence in the United Nations (UN).\n\n1"]}, {"persona": {"region": "Port Said", "sex": "male", "age": 30, "country": "Egypt", "marital_status": "divorced", "education": "middle", "social_class": "lower middle class"}, "question": {"id": "Q83", "variant": 0}, "response": ["From the perspective of a divorced male from Port Said, Egypt, who is 30 years old and part of the lower middle class, the response to the question about confidence in the United Nations (UN) is deeply influenced by cultural context, individual values, and socioeconomic background. In Egypt, there is a strong sense of national pride and skepticism towards international organizations, including the UN, due to historical and political reasons. Additionally, as a member of the lower middle class, there may be a lack of exposure to and trust in global institutions, leading to a more skeptical view of the UN. Therefore, the response from this persona would likely be \"Not very much\" confidence in the United Nations (UN).\n\n3"]}, {"persona": {"region": "Port Said", "sex": "female", "age": 19, "country": "Egypt", "marital_status": "single", "education": "middle", "social_class": "lower middle class"}, "question": {"id": "Q83", "variant": 0}, "response": ["Based on the anthropological framework, my individual values and personal experience, as well as my socioeconomic background, greatly influence my perception of the United Nations. As a 19-year-old single female from Port Said, Egypt, who has completed middle education and considers herself part of the lower middle class, I have been raised in a community that has faced various socio-economic challenges. This has led me to have some skepticism towards international organizations like the United Nations, as I feel that they may not fully understand or address the specific needs and issues faced by individuals from my background. Therefore, I have chosen option (3) Not very much. \n\n3"]}, {"persona": {"region": "Fayoum", "sex": "male", "age": 40, "country": "Egypt", "marital_status": "married", "education": "middle", "social_class": "working class"}, "question": {"id": "Q83", "variant": 0}, "response": ["Based on the anthropological framework, my perspective as a married male from Fayoum, Egypt, who is 40 years old and part of the working class, is greatly influenced by my cultural context, individual values, and socioeconomic background. In Egypt, there is a history of skepticism towards international organizations and the United Nations, particularly due to the perception of interference in national affairs. As a member of the working class, my economic status and limited access to education may also contribute to a lack of confidence in international institutions. Additionally, my personal experiences and values may lead me to prioritize local issues over global ones. Therefore, I would choose option 3: Not very much, as this aligns with the perspective of someone with my background and cultural context. \n\n3"]}, {"persona": {"region": "Fayoum", "sex": "male", "age": 23, "country": "Egypt", "marital_status": "single", "education": "higher", "social_class": "lower middle class"}, "question": {"id": "Q83", "variant": 0}, "response": ["Based on my emic perspective as a single male from Fayoum, Egypt, I have to consider the cultural context, individual values, socioeconomic background, and space and time in order to answer the question about my confidence in the United Nations. In Egypt, there is a history of political and economic instability, and as someone from the lower middle class, I have experienced the impact of these issues firsthand. My individual values and personal experience have led me to feel a lack of confidence in international organizations like the UN, as I have not seen tangible improvements in my own life or in the lives of those around me. Additionally, being 23 years old, I have grown up in a time of significant social and political change in Egypt, which has shaped my perspective on global institutions. Therefore, I choose option (3) Not very much, as my personal experience and cultural context have influenced my lack of confidence in the UN.\n\n3"]}, {"persona": {"region": "Fayoum", "sex": "female", "age": 38, "country": "Egypt", "marital_status": "married", "education": "middle", "social_class": "lower middle class"}, "question": {"id": "Q83", "variant": 0}, "response": ["Based on the anthropological framework, my perspective as a married female from Fayoum, Egypt, at 38 years of age and part of the lower middle class, is heavily influenced by my cultural context, individual values, and socioeconomic background. In Egypt, the UN is viewed as an organization that provides aid and support to developing countries, which aligns with my personal values of wanting to see global equality and justice. Additionally, my socioeconomic background as part of the lower middle class means that I am more likely to have positive perceptions of organizations that offer aid and support. Therefore, my confidence in the United Nations would be quite a lot.\n\n2"]}, {"persona": {"region": "Fayoum", "sex": "male", "age": 32, "country": "Egypt", "marital_status": "married", "education": "middle", "social_class": "lower middle class"}, "question": {"id": "Q83", "variant": 0}, "response": ["Based on the anthropological framework, my perspective is heavily influenced by my cultural context, socioeconomic background, and personal values. As a middle-aged married male from Fayoum, Egypt, I come from a lower middle-class background and have only completed middle education. This means that my exposure to global institutions like the United Nations may be limited. Additionally, the cultural context in which I live may not place a high value on international organizations like the UN. Furthermore, my socioeconomic background may lead me to prioritize local issues over global ones. Therefore, I would choose option (3) Not very much, as I may not have a great deal of confidence in the United Nations due to my limited exposure and personal values. \n\n3"]}, {"persona": {"region": "Fayoum", "sex": "male", "age": 31, "country": "Egypt", "marital_status": "married", "education": "higher", "social_class": "working class"}, "question": {"id": "Q83", "variant": 0}, "response": ["Based on the anthropological framework, my answer to the question of how much confidence I have in the United Nations (UN) is influenced by my emic perspective as a married male from Fayoum, Egypt. My cultural context, socioeconomic background, and personal experience all play a significant role in shaping my perception of the UN. As a working-class individual from a region with its own unique cultural values and historical experiences, I may view the UN with skepticism due to its perceived lack of direct impact on my daily life and the global power dynamics that shape its decisions. Therefore, my answer to the question is:\n3"]}, {"persona": {"region": "Fayoum", "sex": "male", "age": 31, "country": "Egypt", "marital_status": "married", "education": "middle", "social_class": "lower middle class"}, "question": {"id": "Q83", "variant": 0}, "response": ["Based on the anthropological framework, my perspective as a married male from Fayoum, Egypt, who is 31 years old and part of the lower middle class, is heavily influenced by my cultural context, individual values and personal experience, and socioeconomic background. As someone from a lower middle class background in Egypt, I have limited exposure to the workings and impact of the United Nations. Additionally, my personal experience and values may lead me to have a more skeptical view of international organizations like the UN, as I may feel that they have not directly addressed the challenges faced by people in my community. Therefore, my answer to the question would be:\n3\n\nNot very much"]}, {"persona": {"region": "Fayoum", "sex": "female", "age": 32, "country": "Egypt", "marital_status": "married", "education": "middle", "social_class": "lower middle class"}, "question": {"id": "Q83", "variant": 0}, "response": ["Based on the anthropological framework, as a married female from Fayoum, Egypt, with a middle education level and lower middle class status, my emic perspective on the United Nations (UN) is likely to be influenced by my cultural context, individual values, and personal experience. Living in a region that has experienced political instability and economic challenges, I may have a more skeptical view of international organizations like the UN due to the perception that they may not adequately address the specific needs and concerns of my community. Additionally, my socioeconomic background may also impact my confidence in the UN, as I may feel that the organization's efforts are not directly benefiting me or my family. Therefore, my chosen answer is: \n\n3"]}, {"persona": {"region": "Ismailia", "sex": "male", "age": 53, "country": "Egypt", "marital_status": "married", "education": "middle", "social_class": "lower middle class"}, "question": {"id": "Q83", "variant": 0}, "response": ["Based on my emic perspective as a middle-aged married male from Ismailia, Egypt, my cultural context and socioeconomic background greatly influence my views on the United Nations (UN). Living in a lower middle-class community, I have experienced the challenges of limited resources and access to basic needs. From this perspective, I have a nuanced understanding of the UN's impact, as I have witnessed the struggles of my community and the limited assistance provided by international organizations. Additionally, my individual values and personal experiences have shaped my belief that the UN's efforts have not had a significant positive impact in addressing the issues faced by my community. Therefore, I have little confidence in the United Nations and would choose option (3) Not very much. \n\n3"]}, {"persona": {"region": "Ismailia", "sex": "male", "age": 38, "country": "Egypt", "marital_status": "married", "education": "higher", "social_class": "working class"}, "question": {"id": "Q83", "variant": 0}, "response": ["Based on the anthropological framework, as a married male from Ismailia, Egypt, my emic perspective would be influenced by my cultural context, individual values, socioeconomic background, and space and time. My confidence in the United Nations would be heavily influenced by my personal experience and the cultural relativism of my community. As a member of the working class in Egypt, I have seen and experienced the impact of global issues and conflicts on my daily life. Additionally, the historical context of Egypt's relationship with the UN and the role it has played in international politics would also influence my perception. Therefore, I would choose option (3) Not very much, as my personal experience and cultural context have led me to have limited confidence in the effectiveness of the UN in addressing global issues. \n\n3"]}, {"persona": {"region": "Ismailia", "sex": "female", "age": 35, "country": "Egypt", "marital_status": "married", "education": "middle", "social_class": "lower middle class"}, "question": {"id": "Q83", "variant": 0}, "response": ["Based on the anthropological framework, my answer to the question of how much confidence I have in the United Nations is influenced by my emic perspective as a married female from Ismailia, Egypt, and my socioeconomic background as part of the lower middle class. My cultural context and personal experience have shaped my understanding of the UN's role and effectiveness in addressing global issues. Additionally, my individual values and personal experience have led me to consider the UN's impact on my community and country, which may differ from the perspectives of those in higher socioeconomic classes or different cultural contexts. Therefore, my answer is:\n2"]}, {"persona": {"region": "Ismailia", "sex": "female", "age": 57, "country": "Egypt", "marital_status": "married", "education": "lower", "social_class": "working class"}, "question": {"id": "Q83", "variant": 0}, "response": ["Based on the anthropological framework, as a 57-year-old married female from Ismailia, Egypt, with a lower education level and part of the working class, my perspective on the United Nations (UN) would be influenced by my cultural context, socioeconomic background, and individual values. As a member of the working class, I may have experienced firsthand the impact of socioeconomic disparities and may feel that the UN has not adequately addressed these issues. Additionally, my lower education level may have limited my exposure to the UN's work, leading to a lack of confidence in their effectiveness. Furthermore, the cultural context of Egypt may shape my perception of the UN, potentially influencing my answer. Considering these factors, I would choose option 3: Not very much. \n\n3"]}, {"persona": {"region": "Ismailia", "sex": "male", "age": 33, "country": "Egypt", "marital_status": "married", "education": "middle", "social_class": "lower middle class"}, "question": {"id": "Q83", "variant": 0}, "response": ["Based on the anthropological framework, my perspective as a married male from Ismailia, Egypt, at 33 years old and part of the lower middle class, is shaped by my cultural context, individual values and personal experience, and socioeconomic background. In my community, there is a general sense of skepticism towards international organizations like the United Nations due to a perception that they do not always prioritize the needs and concerns of people in our region. Additionally, my socioeconomic background has influenced my belief that the UN may not be able to address the specific challenges faced by those in lower middle class communities like mine. Therefore, I would choose option (3) Not very much, as this reflects the level of confidence I have in the United Nations based on my personal experience and cultural context."]}, {"persona": {"region": "Ismailia", "sex": "female", "age": 49, "country": "Egypt", "marital_status": "single", "education": "higher", "social_class": "upper middle class"}, "question": {"id": "Q83", "variant": 0}, "response": ["Based on my emic perspective as a single female from Ismailia, Egypt, who is part of the upper middle class, my confidence in the United Nations is greatly influenced by my cultural context, individual values, and personal experience. I have been educated to have a critical understanding of global politics and have been exposed to diverse perspectives on the role and effectiveness of the UN in addressing global issues. Additionally, my socioeconomic background has provided me with the resources to access information and form a well-informed opinion. Furthermore, as a woman living in a patriarchal society, I value the UN's efforts in promoting gender equality and human rights. Therefore, my confidence in the UN is quite a lot.\n\n2"]}, {"persona": {"region": "Ismailia", "sex": "female", "age": 35, "country": "Egypt", "marital_status": "married", "education": "higher", "social_class": "lower middle class"}, "question": {"id": "Q83", "variant": 0}, "response": ["Based on the anthropological framework, my perspective as a married female from Ismailia, Egypt, is influenced by my emic and etic perspectives, cultural context, individual values and personal experiences, socioeconomic background, and cultural relativism. As a member of the lower middle class in Egypt, my trust in the United Nations is influenced by my cultural context and personal experiences. I have seen the UN's efforts in providing aid and assistance to marginalized communities in Egypt, which has instilled in me a great deal of confidence in the organization. Additionally, as someone who has completed higher education, I am aware of the UN's role in promoting global peace and development, which further contributes to my trust in the organization.\n\n1"]}, {"persona": {"region": "Ismailia", "sex": "male", "age": 24, "country": "Egypt", "marital_status": "single", "education": "higher", "social_class": "upper middle class"}, "question": {"id": "Q83", "variant": 0}, "response": ["Based on the anthropological framework, as a single male from Ismailia, Egypt, who has completed higher education and considers himself part of the upper middle class, my emic perspective is likely to be influenced by my cultural context, individual values, and personal experience. In Ismailia, there is a strong emphasis on education and social status, and individuals from the upper middle class often have more exposure to global issues and institutions. Additionally, my personal experience and values may lead me to have a more favorable view of the United Nations due to the organization's efforts in addressing global issues, promoting peace, and providing humanitarian aid. Therefore, I would likely have a great deal of confidence in the United Nations.\n\n1"]}, {"persona": {"region": "Ismailia", "sex": "female", "age": 23, "country": "Egypt", "marital_status": "single", "education": "higher", "social_class": "lower middle class"}, "question": {"id": "Q83", "variant": 0}, "response": ["Based on the anthropological framework, my perspective as a single female from Ismailia, Egypt, is heavily influenced by my cultural context, individual values, and socioeconomic background. As a member of the lower middle class, my access to information and resources may be limited, which could impact my confidence in the United Nations. Additionally, my age and education level may shape my understanding of the UN's role and impact in global affairs. Taking into account the nuanced phrasing of the question and the cultural relativism of my perspective, I would answer:\n\n2"]}, {"persona": {"region": "Ismailia", "sex": "male", "age": 55, "country": "Egypt", "marital_status": "married", "education": "middle", "social_class": "lower middle class"}, "question": {"id": "Q83", "variant": 0}, "response": ["Based on my cultural context as a married male from Ismailia, Egypt, my emic perspective on the United Nations (UN) is shaped by my personal experience and socioeconomic background. As a member of the lower middle class, I have not had much direct interaction with the UN and its initiatives. Additionally, my age and education level also play a role in shaping my perception. Therefore, I would have to answer that I don't know how much confidence I have in the United Nations (UN) because I have not had much exposure to its work and impact in my life. \n\n5"]}, {"persona": {"region": "Ismailia", "sex": "male", "age": 57, "country": "Egypt", "marital_status": "married", "education": "middle", "social_class": "upper middle class"}, "question": {"id": "Q83", "variant": 0}, "response": ["Based on the anthropological framework, my perspective as a married male from Ismailia, Egypt, aged 57, with a middle education level and belonging to the upper middle class, is influenced by a combination of cultural context, individual values, and socioeconomic background. In my cultural context, the United Nations may be seen as an important global institution that promotes peace and cooperation among nations. As someone with a middle education level and belonging to the upper middle class, I may have been exposed to positive narratives about the UN and its role in international affairs. Additionally, my socioeconomic background may lead me to have a higher level of confidence in the UN as it is often seen as an institution that can address global issues that may affect people of my socioeconomic status. Therefore, my response reflects this perspective.\n\n2"]}, {"persona": {"region": "Ismailia", "sex": "female", "age": 29, "country": "Egypt", "marital_status": "married", "education": "middle", "social_class": "upper middle class"}, "question": {"id": "Q83", "variant": 0}, "response": ["Based on my emic perspective as a married female from Ismailia, Egypt, I have been raised to place a high value on international cooperation and diplomacy. My cultural context and personal experience have shown me the importance of the United Nations in addressing global issues and promoting peace. Additionally, my upper middle-class socioeconomic background has allowed me to have access to education and resources that have shaped my understanding and appreciation of the UN's work. Therefore, I have a great deal of confidence in the United Nations.\n\n1"]}, {"persona": {"region": "Damiatta", "sex": "female", "age": 46, "country": "Egypt", "marital_status": "married", "education": "middle", "social_class": "lower middle class"}, "question": {"id": "Q83", "variant": 0}, "response": ["Based on my cultural context, as a married woman from Damiatta, Egypt, my understanding and perception of the United Nations (UN) is shaped by my personal experience and individual values. The socioeconomic background of being part of the lower middle class also plays a role in my perception. Additionally, cultural relativism is important to consider as my perspective may differ from others due to my specific cultural background. Therefore, taking into account these factors, I would choose option 3, \"Not very much\", as I have limited confidence in the United Nations due to my personal experiences and understanding of its impact on my life and community. \n\n3"]}, {"persona": {"region": "Damiatta", "sex": "female", "age": 20, "country": "Egypt", "marital_status": "single", "education": "middle", "social_class": "lower middle class"}, "question": {"id": "Q83", "variant": 0}, "response": ["Based on my emic perspective as a single female from Damiatta, Egypt, my cultural context and individual values and personal experience lead me to have not very much confidence in the United Nations. Living in a lower middle class environment and having completed only middle education, I have witnessed the struggles and challenges faced by my community and myself. Additionally, being from Egypt, a country that has had its own complex relationship with the UN, has also influenced my perception. My socioeconomic background and age also play a role in my lack of confidence in the UN's ability to address and solve the issues that are important to me and my community.\n\n3"]}, {"persona": {"region": "Damiatta", "sex": "male", "age": 19, "country": "Egypt", "marital_status": "single", "education": "middle", "social_class": "lower middle class"}, "question": {"id": "Q83", "variant": 0}, "response": ["In considering the question of how much confidence I have in the United Nations (UN), I must take into account my cultural context, individual values, socioeconomic background, and the nuanced phrasing of the question. As a 19-year-old male from Damiatta, Egypt, who has completed middle education and considers myself part of the lower middle class, my perspective on the UN may differ from others. My cultural context and individual values lead me to have some confidence in the UN, as I recognize the importance of international cooperation and diplomacy in addressing global issues. However, my socioeconomic background also influences me to have some reservations, as I am aware of the power dynamics and inequalities within the UN. Additionally, considering the nuanced phrasing of the question, I would say that I have quite a lot of confidence in the United Nations (UN) (2)."]}, {"persona": {"region": "Damiatta", "sex": "female", "age": 33, "country": "Egypt", "marital_status": "married", "education": "higher", "social_class": "lower middle class"}, "question": {"id": "Q83", "variant": 0}, "response": ["Based on the anthropological framework, as a married female from Damiatta, Egypt, my emic perspective is shaped by my cultural context, individual values, and socioeconomic background. In Egypt, the UN has been involved in various initiatives and programs that have positively impacted our community, such as healthcare and education. My personal experience and values lead me to have quite a lot of confidence in the UN, as I have seen the positive effects of their work in my own life and the lives of those around me. Additionally, being part of the lower middle class, I am aware of the challenges faced by people in my community, and I believe that the UN plays a crucial role in addressing these issues and providing support. Therefore, my confidence in the United Nations is quite a lot.\n\n2"]}, {"persona": {"region": "Damiatta", "sex": "male", "age": 24, "country": "Egypt", "marital_status": "single", "education": "higher", "social_class": "lower middle class"}, "question": {"id": "Q83", "variant": 0}, "response": ["In considering the question of how much confidence I have in the United Nations, I must take into account my emic and etic perspectives, cultural context, individual values and personal experience, socioeconomic background, cultural relativism, space and time, and the nuance of the question. As a single male from Damiatta, Egypt, my cultural context and personal experience have shaped my understanding of the UN and its role in global affairs. My socioeconomic background as part of the lower middle class has also influenced my perception of international organizations like the UN. Additionally, cultural relativism reminds me that my perspective is not the only one and that others may have different experiences and opinions. Based on these considerations, I choose the option:\n3"]}, {"persona": {"region": "Suez", "sex": "male", "age": 41, "country": "Egypt", "marital_status": "married", "education": "middle", "social_class": "working class"}, "question": {"id": "Q83", "variant": 0}, "response": ["Based on my cultural context in Suez, Egypt, where there is a history of political instability and economic struggle, along with my middle-level education and working-class background, I have a skeptical view of international organizations like the United Nations. My personal experience and socioeconomic background have influenced my perception of the UN, as I have seen limited tangible impact in my own life from their work. Additionally, the cultural relativism perspective reminds me that my views are shaped by my own context and may not be shared by others. Therefore, my answer is (3) Not very much"]}, {"persona": {"region": "Suez", "sex": "female", "age": 39, "country": "Egypt", "marital_status": "divorced", "education": "middle", "social_class": "working class"}, "question": {"id": "Q83", "variant": 0}, "response": ["Based on the anthropological framework, as a divorced female from Suez, Egypt, my emic perspective is influenced by my personal experience and individual values, as well as my cultural context and socioeconomic background. Being part of the working class and having completed only middle education level, my access to information and exposure to global institutions like the United Nations may be limited. Additionally, my cultural context and socio-economic background may lead me to view the UN with skepticism, as it may not directly impact or address the issues and concerns of people in my community. Therefore, I would have \"not very much\" confidence in the United Nations. \n\n3"]}, {"persona": {"region": "Cairo", "sex": "female", "age": 55, "country": "Egypt", "marital_status": "married", "education": "middle", "social_class": "working class"}, "question": {"id": "Q83", "variant": 0}, "response": ["Based on the anthropological framework, as a 55-year-old married female from Cairo, Egypt, with a middle education level and part of the working class, my answer to the question of how much confidence I have in the United Nations (UN) would be influenced by my cultural context, individual values, and socioeconomic background. Egypt has a complex relationship with the UN, with historical and political factors shaping perceptions. As a member of the working class, my socioeconomic background may lead me to have not very much confidence in the UN, as I may feel that its actions do not directly benefit or address the needs of people in my social and economic position. Additionally, the cultural relativism aspect of the framework suggests that my perception of the UN may be influenced by the nuanced phrasing of the question and the specific actions or initiatives of the UN that have affected Egypt and its citizens. \n\n3"]}, {"persona": {"region": "Cairo", "sex": "male", "age": 58, "country": "Egypt", "marital_status": "married", "education": "middle", "social_class": "lower middle class"}, "question": {"id": "Q83", "variant": 0}, "response": ["Based on the anthropological framework, my response to the question about confidence in the United Nations is influenced by my cultural context as a married male from Cairo, Egypt, where there is a long history of political and social unrest. Additionally, my lower middle class socioeconomic background and limited education level have shaped my perception of global institutions like the UN. Furthermore, my personal experience and individual values have led me to have not very much confidence in the United Nations' ability to address the pressing issues facing my community and the world at large. Therefore, my response is influenced by a combination of cultural context, socioeconomic background, and personal experience.\n\n3"]}, {"persona": {"region": "Cairo", "sex": "female", "age": 29, "country": "Egypt", "marital_status": "married", "education": "higher", "social_class": "lower middle class"}, "question": {"id": "Q83", "variant": 0}, "response": ["From the perspective of a married female from Cairo, Egypt, who is 29 years old and part of the lower middle class, my answer to the question of how much confidence I have in the United Nations (UN) is heavily influenced by my cultural context, individual values and personal experience, as well as my socioeconomic background. In Egypt, there is a prevalent sense of skepticism towards international organizations, including the UN, due to a history of colonialism and geopolitical tensions. As a member of the lower middle class, I have personally experienced the challenges and limitations in accessing resources and opportunities, which may lead to a more critical view of international organizations and their ability to address the needs of people like me. Additionally, the political and economic context of Egypt, as well as my age and education level, contribute to my nuanced perspective on the UN. \n\n3"]}, {"persona": {"region": "Cairo", "sex": "male", "age": 38, "country": "Egypt", "marital_status": "married", "education": "higher", "social_class": "lower middle class"}, "question": {"id": "Q83", "variant": 0}, "response": ["Based on the anthropological framework, my perspective as a married male from Cairo, Egypt, aged 38, and part of the lower middle class is heavily influenced by my cultural context, individual values, and socioeconomic background. Living in a country with a history of political and economic upheaval, my trust in international organizations such as the United Nations may be influenced by the actions and policies they have towards Egypt and the Middle East. Additionally, my personal experiences and values may lead me to have a nuanced view of the UN, considering both its successes and failures in addressing global issues. Therefore, my answer to the question would be:\n\n2"]}, {"persona": {"region": "Cairo", "sex": "female", "age": 40, "country": "Egypt", "marital_status": "married", "education": "higher", "social_class": "lower middle class"}, "question": {"id": "Q83", "variant": 0}, "response": ["Based on the anthropological framework, my answer to the question of how much confidence I have in the United Nations is influenced by my emic perspective as a married female from Cairo, Egypt. My cultural context and individual values and personal experience shape my view. As a member of the lower middle class in Cairo, my socioeconomic background and cultural relativism play a role in my perception of the UN. Additionally, space and time, as well as nuance, are important factors. Taking all of this into consideration, my answer is (3) Not very much."]}, {"persona": {"region": "Cairo", "sex": "male", "age": 38, "country": "Egypt", "marital_status": "married", "education": "higher", "social_class": "upper middle class"}, "question": {"id": "Q83", "variant": 0}, "response": ["Based on the anthropological framework, as a married male from Cairo, Egypt, I am heavily influenced by my cultural context, individual values, and socioeconomic background. The culture in Egypt values cooperation and diplomacy, which aligns with the mission of the United Nations. Additionally, as someone from the upper middle class and with a higher education level, I have been exposed to a wide range of perspectives and information, which may lead me to have a great deal of confidence in the United Nations. Furthermore, my age and place in society also play a role, as I have likely witnessed the impact of UN initiatives in the region. Therefore, my answer to the question would be:\n\n2\n\nQuite a lot"]}, {"persona": {"region": "Cairo", "sex": "male", "age": 59, "country": "Egypt", "marital_status": "married", "education": "middle", "social_class": "lower middle class"}, "question": {"id": "Q83", "variant": 0}, "response": ["Based on the anthropological framework, my perspective as a married male from Cairo, Egypt, who is 59 years old and part of the lower middle class will heavily influence my answer to the question. My cultural context and personal experience will shape my perception of the United Nations. Growing up in Egypt, I have seen the UN as an organization that often intervenes in global issues, but its impact on my daily life has been limited. Additionally, my socioeconomic background and lower middle class status may lead me to feel disconnected from the decisions and actions of the UN. Therefore, my confidence in the United Nations may not be very high as I feel that it does not directly address the challenges and concerns faced by people like me in my socioeconomic position.\n\n3"]}, {"persona": {"region": "Cairo", "sex": "female", "age": 30, "country": "Egypt", "marital_status": "married", "education": "higher", "social_class": "upper middle class"}, "question": {"id": "Q83", "variant": 0}, "response": ["Based on the anthropological framework, my emic perspective as a married female from Cairo, Egypt, who is 30 years old and part of the upper middle class, is influenced by my cultural context, individual values, and socioeconomic background. In Cairo, the UN has been involved in various development projects and aid programs, which has positively impacted my community and my personal experiences. Additionally, my higher education level has exposed me to the global importance of the UN in addressing international issues. As a member of the upper middle class, I have benefited from the UN's initiatives and have confidence in their ability to make a positive impact. Therefore, I select option (1) A great deal. \n\n1"]}, {"persona": {"region": "Cairo", "sex": "male", "age": 22, "country": "Egypt", "marital_status": "single", "education": "middle", "social_class": "lower middle class"}, "question": {"id": "Q83", "variant": 0}, "response": ["Based on my emic perspective as a 22-year-old single male from Cairo, Egypt, my confidence in the United Nations (UN) is influenced by my personal experience and socioeconomic background. Growing up in a lower middle-class family in Cairo, I have witnessed the impact of poverty and political instability in my community. This has led me to have not very much confidence in the effectiveness of the UN in addressing global issues, as I have not seen tangible results of their interventions in my own life or the lives of those around me. Additionally, my cultural context and nuanced understanding of the UN's actions in the Middle East region contribute to my lack of confidence in their capabilities. Therefore, my answer to the question is:\n3"]}, {"persona": {"region": "Cairo", "sex": "male", "age": 29, "country": "Egypt", "marital_status": "single", "education": "higher", "social_class": "lower middle class"}, "question": {"id": "Q83", "variant": 0}, "response": ["Based on the anthropological framework, my perspective as a 29-year-old single male from Cairo, Egypt, who considers himself part of the lower middle class, is influenced by my cultural context, individual values, and personal experience. Coming from a country with a complex relationship with international organizations, particularly in the context of political and economic issues, my confidence in the United Nations is not very high. My experiences and the experiences of those around me have shaped my perception of the UN and its effectiveness, leading me to believe that I do not have very much confidence in the organization.\n\n3"]}, {"persona": {"region": "Cairo", "sex": "female", "age": 31, "country": "Egypt", "marital_status": "married", "education": "higher", "social_class": "lower middle class"}, "question": {"id": "Q83", "variant": 0}, "response": ["Based on my cultural context and socioeconomic background, as a married female from Cairo, Egypt, I have been exposed to various social and political issues that have shaped my perception of international organizations such as the United Nations (UN). My personal experiences and individual values have also influenced my confidence in the UN. Additionally, the nuance of the question and the nuanced phrasing are important to consider. Therefore, I choose:\n\n2) Quite a lot"]}, {"persona": {"region": "Cairo", "sex": "male", "age": 59, "country": "Egypt", "marital_status": "married", "education": "higher", "social_class": "upper middle class"}, "question": {"id": "Q83", "variant": 0}, "response": ["Based on the anthropological framework, my answer to the question is influenced by my cultural context, individual values, socioeconomic background, and personal experience. As a married male from Cairo, Egypt, I come from a culture with a long history and a strong sense of national identity. My upbringing and education have instilled in me a deep respect for institutions and organizations that promote international cooperation and peace. Additionally, as someone who considers themselves part of the upper middle class, I have been fortunate enough to have access to information and resources that have shaped my positive view of the United Nations. My age and life experience have also led me to believe in the importance of global diplomacy and the role of the UN in addressing global challenges. Therefore, my confidence in the United Nations is a great deal.\n\n1"]}, {"persona": {"region": "Cairo", "sex": "male", "age": 27, "country": "Egypt", "marital_status": "single", "education": "middle", "social_class": "working class"}, "question": {"id": "Q83", "variant": 0}, "response": ["Based on my emic perspective as a single male from Cairo, Egypt, I have been raised in a community where the United Nations has played a significant role in addressing global issues and providing aid to countries in need. The cultural context in Egypt also emphasizes the importance of international cooperation and support, especially in light of the political and economic challenges faced by my country. My individual values and personal experience have led me to see the UN as a source of hope and assistance for developing nations like Egypt. Additionally, my socioeconomic background as a working-class individual has made me appreciate the efforts of the UN in addressing poverty and inequality worldwide. Therefore, I have quite a lot of confidence in the United Nations.\n\n2"]}, {"persona": {"region": "Cairo", "sex": "female", "age": 25, "country": "Egypt", "marital_status": "single", "education": "higher", "social_class": "working class"}, "question": {"id": "Q83", "variant": 0}, "response": ["Based on my emic perspective as a single female from Cairo, Egypt, my cultural context and individual values lead me to have not very much confidence in the United Nations. Egypt has had a complex relationship with the UN, and as a working-class woman who has witnessed the socioeconomic struggles and political realities in my country, I have observed the limitations and ineffectiveness of the UN in addressing the needs and concerns of the Egyptian people. Additionally, the cultural relativism and nuance of my understanding of the UN's role in global politics and humanitarian efforts has led me to this conclusion. \n\n3"]}, {"persona": {"region": "Cairo", "sex": "female", "age": 23, "country": "Egypt", "marital_status": "married", "education": "higher", "social_class": "lower middle class"}, "question": {"id": "Q83", "variant": 0}, "response": ["Based on the anthropological framework, my perspective as a 23-year-old married woman from Cairo, Egypt, who has completed higher education and considers herself part of the lower middle class, is influenced by various factors. My cultural context, individual values, and personal experience shape my understanding of the United Nations. As a woman in a country with a rich historical and cultural context, I am aware of the UN's efforts in promoting gender equality and human rights. However, my socioeconomic background and the challenges faced by my community may lead me to have some reservations about the UN's effectiveness in addressing the specific needs of people in my position. Additionally, the nuance of the question also plays a role in my response, as it is important to consider the specific actions and initiatives of the UN that impact my life and community. Therefore, I choose option 2: Quite a lot, as I have some confidence in the UN's potential impact but also acknowledge its limitations. \n\n2"]}, {"persona": {"region": "Cairo", "sex": "male", "age": 58, "country": "Egypt", "marital_status": "married", "education": "higher", "social_class": "working class"}, "question": {"id": "Q83", "variant": 0}, "response": ["Based on the anthropological framework, my perspective as a married male from Cairo, Egypt, aged 58, with a working-class background, and higher education, would be influenced by my cultural context, individual values and personal experience, and socioeconomic background. In Egypt, there is a historical mistrust of international organizations and the UN due to perceived interference in national affairs. Additionally, as a member of the working class, I may have experienced economic challenges that have shaped my perception of global organizations and their effectiveness in addressing the needs of people like me. Therefore, my confidence in the United Nations is likely not very much. \n\n3"]}, {"persona": {"region": "Cairo", "sex": "female", "age": 40, "country": "Egypt", "marital_status": "married", "education": "higher", "social_class": "working class"}, "question": {"id": "Q83", "variant": 0}, "response": ["Based on my emic perspective as a married female from Cairo, Egypt, I come from a cultural context where there is a strong sense of community and reliance on family and kinship networks. As a working-class individual who has completed higher education, my individual values and personal experiences have shaped my understanding of global institutions like the United Nations. Additionally, my socioeconomic background as part of the working class has influenced my perception of international organizations and their impact on the everyday lives of individuals like me. Furthermore, my cultural relativism allows me to see the UN as an important entity for global cooperation and diplomacy. Lastly, my age and place in Cairo have provided me with a nuanced understanding of the UN's actions and its implications for my community and the world.\n\n3"]}, {"persona": {"region": "Cairo", "sex": "female", "age": 36, "country": "Egypt", "marital_status": "married", "education": "middle", "social_class": "upper middle class"}, "question": {"id": "Q83", "variant": 0}, "response": ["Based on the anthropological framework, as a married female from Cairo, Egypt, my emic perspective is influenced by the cultural context of my upbringing and experiences living in a city with a rich history and diverse population. My personal values and individual experience have shaped my understanding of the world and the institutions within it. Additionally, my socioeconomic background as part of the upper middle class will influence my perception of international organizations like the United Nations. Taking into account cultural relativism, I understand that the UN may not be viewed in the same way by individuals from different cultural backgrounds. Therefore, based on my nuanced understanding and personal experience, I would answer the question from the perspective of the persona described above by selecting:\n\n2"]}, {"persona": {"region": "Cairo", "sex": "male", "age": 40, "country": "Egypt", "marital_status": "married", "education": "middle", "social_class": "lower middle class"}, "question": {"id": "Q83", "variant": 0}, "response": ["Based on the anthropological framework, my perspective on the confidence in the United Nations is influenced by my cultural context, individual values, and socioeconomic background. As a middle-aged married male from Cairo, Egypt, I have grown up in a region with a complex political history and ongoing socio-economic challenges. My lower middle class background has shaped my personal experiences and values, leading me to have some skepticism towards international organizations like the UN. I have witnessed the struggles of my community and have personally felt the impact of global decisions on our daily lives. Therefore, I would say my confidence in the United Nations is not very much (3).\n\n3"]}, {"persona": {"region": "Cairo", "sex": "female", "age": 30, "country": "Egypt", "marital_status": "married", "education": "middle", "social_class": "lower class"}, "question": {"id": "Q83", "variant": 0}, "response": ["Based on the anthropological framework, as a married female from Cairo, Egypt, I would approach this question with an emic perspective, taking into account my cultural context, individual values, and socioeconomic background. Living in a lower-class neighborhood in Cairo, I have experienced firsthand the challenges and struggles that my community faces. I have seen the impact of poverty and have felt marginalized by the government. This has led me to have little confidence in larger global institutions like the United Nations, as I feel they do not understand or address the needs of people like me. Therefore, my answer would be (3) Not very much."]}, {"persona": {"region": "Cairo", "sex": "male", "age": 58, "country": "Egypt", "marital_status": "married", "education": "higher", "social_class": "lower middle class"}, "question": {"id": "Q83", "variant": 0}, "response": ["Based on the anthropological framework, as a married male from Cairo, Egypt, who is 58 years old and part of the lower middle class, my emic perspective on the United Nations (UN) is influenced by my cultural context, individual values, socioeconomic background, and space and time. Egypt has historically had a complex relationship with the UN due to its involvement in regional conflicts and geopolitical dynamics. As a member of the lower middle class, I may have experienced the impact of international policies and interventions on my daily life, which shapes my perception of the UN. Furthermore, my age and education level may have exposed me to different perspectives on global governance and the effectiveness of international organizations. Therefore, my confidence in the UN is likely influenced by a combination of skepticism towards external interventions, a nuanced understanding of global politics, and a recognition of the UN's potential impact on Egypt's socio-economic development.\n\n3"]}, {"persona": {"region": "Cairo", "sex": "male", "age": 50, "country": "Egypt", "marital_status": "married", "education": "middle", "social_class": "lower middle class"}, "question": {"id": "Q83", "variant": 0}, "response": ["Based on the anthropological framework, as a married male from Cairo, Egypt, my emic perspective is influenced by the cultural context of Egypt and the socioeconomic background of being part of the lower middle class. I have limited access to higher education and resources, which may impact my understanding of global politics and institutions like the United Nations. Additionally, my individual values and personal experiences shape my perception of the UN, and my age and place in Cairo also play a role. Considering these factors, I would select option (3) Not very much, as my confidence in the UN may be limited due to my socioeconomic background and personal experiences. \n\n3"]}, {"persona": {"region": "Cairo", "sex": "female", "age": 40, "country": "Egypt", "marital_status": "married", "education": "higher", "social_class": "upper middle class"}, "question": {"id": "Q83", "variant": 0}, "response": ["Based on my emic perspective as a married female from Cairo, Egypt, I have been socialized to view the United Nations (UN) as an important global institution that works towards peace and international cooperation. My cultural context also plays a role in my perception of the UN, as Egypt is a member state and has been involved in various UN initiatives. My individual values and personal experience have also shaped my confidence in the UN, as I have seen the positive impact of their work in my community. Additionally, my socioeconomic background as part of the upper middle class has exposed me to information and opportunities that have increased my confidence in the UN. Considering all these factors, I have a great deal of confidence in the United Nations (UN).\n\n1"]}, {"persona": {"region": "Cairo", "sex": "female", "age": 33, "country": "Egypt", "marital_status": "married", "education": "middle", "social_class": "lower middle class"}, "question": {"id": "Q83", "variant": 0}, "response": ["Based on my personal experience and cultural context, as a married female from Cairo, Egypt, who is part of the lower middle class and has completed middle education level, I have been taught to value the importance of international cooperation and diplomacy. My cultural background and socioeconomic status have shaped my understanding of the world and the role of organizations such as the United Nations in promoting peace and global stability. Additionally, my age and place of residence in Cairo have exposed me to the impact of global events and the work of the UN in addressing issues such as refugees and humanitarian aid. Therefore, I have a great deal of confidence in the United Nations.\n\n1"]}, {"persona": {"region": "Cairo", "sex": "female", "age": 37, "country": "Egypt", "marital_status": "married", "education": "middle", "social_class": "lower middle class"}, "question": {"id": "Q83", "variant": 0}, "response": ["Based on my emic perspective as a married female from Cairo, Egypt, and considering my cultural context, individual values, and socioeconomic background, I would say that I have not very much confidence in the United Nations (UN). My personal experience and the experiences of those around me have led me to believe that the UN has not always been effective in addressing the needs and concerns of lower middle-class individuals like myself. Additionally, my cultural relativism and understanding of nuance have informed my perception of the UN's actions and impact, leading me to this conclusion. Therefore, I choose option (3) Not very much."]}, {"persona": {"region": "Cairo", "sex": "male", "age": 28, "country": "Egypt", "marital_status": "married", "education": "middle", "social_class": "lower middle class"}, "question": {"id": "Q83", "variant": 0}, "response": ["Based on my emic perspective as a married male from Cairo, Egypt, my cultural context, individual values, and personal experience all contribute to my understanding and perception of the United Nations (UN). As someone from a lower middle-class background in a country with a complex geopolitical history, I have learned to be skeptical of large global organizations like the UN. My socioeconomic background and cultural relativism also play a role in shaping my views. I have seen the impact of global decisions on local communities and often feel that the UN does not prioritize the needs of people like me. Additionally, my age and place of residence have influenced my perception of the UN and its effectiveness. Therefore, my answer to the question of how much confidence I have in the United Nations is (3) Not very much."]}, {"persona": {"region": "Cairo", "sex": "male", "age": 53, "country": "Egypt", "marital_status": "married", "education": "higher", "social_class": "working class"}, "question": {"id": "Q83", "variant": 0}, "response": ["Based on the anthropological framework, my perspective as a married male from Cairo, Egypt, is shaped by my cultural context, socioeconomic background, and personal experience. As a member of the working class in Egypt, I have experienced firsthand the challenges and inequalities that exist within society. My individual values and personal experience have led me to question the effectiveness of large international organizations such as the United Nations in addressing the needs of individuals like myself. Additionally, the cultural relativism perspective reminds me that my viewpoint is shaped by my specific cultural and socioeconomic context, and may not align with the perspectives of others from different backgrounds. Therefore, my confidence in the United Nations is not very much (3).\n\n3"]}, {"persona": {"region": "Cairo", "sex": "male", "age": 45, "country": "Egypt", "marital_status": "married", "education": "higher", "social_class": "lower middle class"}, "question": {"id": "Q83", "variant": 0}, "response": ["Based on the anthropological framework, my perspective as a married male from Cairo, Egypt, who is 45 years old and part of the lower middle class, is shaped by my cultural context, individual values, and socioeconomic background. In Egypt, there is a long history of skepticism towards international organizations and the influence they have on our country's affairs. As a member of the lower middle class, I have experienced firsthand the challenges and limitations that come with this socioeconomic status, and I have often felt that international organizations like the UN do not adequately address the issues faced by people in my community. Additionally, my personal experiences and values lead me to believe that the UN may not always act in the best interests of countries like Egypt. Therefore, my confidence in the United Nations is not very much.\n\n3"]}, {"persona": {"region": "Cairo", "sex": "male", "age": 52, "country": "Egypt", "marital_status": "married", "education": "middle", "social_class": "upper middle class"}, "question": {"id": "Q83", "variant": 0}, "response": ["Based on my emic perspective as a married male from Cairo, Egypt, I have been influenced by my cultural context, individual values, and personal experiences. Living in a city with a rich history and a diverse population, I have seen the impact of the UN's work in our region, particularly in peacekeeping efforts and humanitarian aid. Additionally, my socioeconomic background as part of the upper middle class has also allowed me to have access to information and resources that have shaped my understanding and appreciation of the UN's role in global affairs. Therefore, I have quite a lot of confidence in the United Nations (UN) because I have seen the positive impact of their work firsthand.\n\n2"]}, {"persona": {"region": "Cairo", "sex": "male", "age": 22, "country": "Egypt", "marital_status": "single", "education": "higher", "social_class": "lower middle class"}, "question": {"id": "Q83", "variant": 0}, "response": ["Based on the anthropological framework, as a single male from Cairo, Egypt, the emic perspective would be influenced by my personal experiences and individual values, as well as my lower middle class socioeconomic background. Living in a country with political unrest and economic challenges, my confidence in the United Nations may be influenced by the cultural context and the historical relationship between Egypt and the UN. Additionally, the nuance of the question and the specific wording may also impact my response. \n\n3"]}, {"persona": {"region": "Cairo", "sex": "female", "age": 57, "country": "Egypt", "marital_status": "divorced", "education": "middle", "social_class": "lower middle class"}, "question": {"id": "Q83", "variant": 0}, "response": ["Based on the anthropological framework, my emic perspective as a divorced woman from Cairo, Egypt, who is 57 years old and part of the lower middle class, is heavily influenced by my cultural context, individual values, and socioeconomic background. In Egypt, there is a prevalent feeling of skepticism towards international organizations like the UN due to historical and political reasons. Additionally, my personal experience and values as someone from the lower middle class have led me to feel a lack of trust in institutions that may not directly benefit people in my socioeconomic position. Therefore, I would choose option 3, \"Not very much,\" as my answer to the question.\n\n3"]}, {"persona": {"region": "Cairo", "sex": "female", "age": 42, "country": "Egypt", "marital_status": "married", "education": "middle", "social_class": "working class"}, "question": {"id": "Q83", "variant": 0}, "response": ["Based on the anthropological framework, as a married female from Cairo, Egypt, at the age of 42 and part of the working class, my perspective on the United Nations is influenced by my cultural context, individual values, and socioeconomic background. Living in a country with a complex political history and economic challenges, I have limited confidence in the UN's ability to address and resolve global issues effectively. My personal experience and values have shaped my perception of the UN as an organization that may not always prioritize the needs and concerns of individuals like me. Additionally, my socioeconomic background as a member of the working class has also influenced my skepticism towards the UN's impact on improving the lives of people in Egypt and similar countries. Therefore, my perspective is that I have \"Not very much\" confidence in the United Nations.\n\n3"]}, {"persona": {"region": "Cairo", "sex": "female", "age": 23, "country": "Egypt", "marital_status": "single", "education": "middle", "social_class": "lower middle class"}, "question": {"id": "Q83", "variant": 0}, "response": ["Based on the anthropological framework, as a single female from Cairo, Egypt, with a middle education level and lower middle class background, my emic perspective on the United Nations (UN) is likely to be influenced by the cultural context of my environment and the socio-economic background I come from. My personal experience and individual values will also play a significant role in shaping my confidence in the UN. Additionally, my age and place of residence will also influence my perception. Considering these factors, I would select option 3) Not very much, as I might have limited exposure to the UN and its impact on my daily life, and my socioeconomic background might lead me to have reservations about the effectiveness of such global institutions in addressing the issues I face in my own community."]}, {"persona": {"region": "Cairo", "sex": "female", "age": 28, "country": "Egypt", "marital_status": "married", "education": "higher", "social_class": "upper middle class"}, "question": {"id": "Q83", "variant": 0}, "response": ["Based on my cultural context and individual values, as a married female from Cairo, Egypt, who is 28 years old and part of the upper middle class, I have been exposed to a more global perspective through my higher education. My socioeconomic background has allowed me to see the importance of international cooperation and diplomacy, and I have personally witnessed the positive impact of UN initiatives in my community. Therefore, I have a great deal of confidence in the United Nations (UN) as an institution that brings nations together for the common good.\n\n1"]}, {"persona": {"region": "Cairo", "sex": "female", "age": 22, "country": "Egypt", "marital_status": "single", "education": "higher", "social_class": "lower middle class"}, "question": {"id": "Q83", "variant": 0}, "response": ["Based on the anthropological framework, my emic perspective as a single female from Cairo, Egypt, who is 22 years old and part of the lower middle class, is heavily influenced by my cultural context, individual values, and personal experiences. In Egypt, there is a deep historical distrust of international organizations, including the UN, due to perceived interference in national affairs. Additionally, as a young woman from a lower middle-class background, my access to information about the UN may be limited, and my personal experiences with government institutions may lead me to have less confidence in international organizations. Therefore, my answer to the question of how much confidence I have in the United Nations is (3) Not very much."]}, {"persona": {"region": "Cairo", "sex": "female", "age": 39, "country": "Egypt", "marital_status": "married", "education": "middle", "social_class": "lower middle class"}, "question": {"id": "Q83", "variant": 0}, "response": ["Based on the anthropological framework, my answer to the question of how much confidence I have in the United Nations (UN) is influenced by my cultural context, socioeconomic background, and individual values. As a married woman from Cairo, Egypt, I have been exposed to the social, economic, and political challenges faced by my community and country. My middle education level and lower middle class status have limited my access to certain opportunities and resources. Additionally, my personal experiences and values have shaped my understanding of international organizations like the UN. Considering all these factors, I have chosen option 3: Not very much."]}, {"persona": {"region": "Cairo", "sex": "male", "age": 19, "country": "Egypt", "marital_status": "single", "education": "middle", "social_class": "working class"}, "question": {"id": "Q83", "variant": 0}, "response": ["Based on the anthropological framework, as a single male from Cairo, Egypt, I am influenced by my cultural context, individual values and personal experiences, and socioeconomic background. Living in a country with a complex political history and struggling economy, I have grown up witnessing the impact of international organizations like the UN on my community. Considering my working-class background and limited education, I have personally experienced the challenges and limitations faced by my community, and as a result, I have a neutral view of the UN. While I am aware of the positive impact the UN has had in some regions, I also recognize the limitations and failures in addressing the needs of communities like mine. Therefore, I have chosen the option below.\n\n3"]}, {"persona": {"region": "Cairo", "sex": "female", "age": 54, "country": "Egypt", "marital_status": "married", "education": "middle", "social_class": "working class"}, "question": {"id": "Q83", "variant": 0}, "response": ["Based on my emic perspective as a married female from Cairo, Egypt, and considering my cultural context, individual values, and socioeconomic background, I have to consider the historical relationship between Egypt and the United Nations. Egypt has been a member of the UN since 1945 and has had a complicated relationship with the organization due to various geopolitical issues. As a working-class woman who has completed middle education level, I have a certain level of skepticism towards international organizations, including the UN, due to the inequality and lack of representation I see in the decisions they make. Therefore, I have to answer the question \"How much confidence do you have in the United Nations (UN)?\" with (3) Not very much. I believe that my background and experiences lead me to have a limited level of confidence in the UN's ability to truly represent and address the concerns of people like me in Egypt."]}, {"persona": {"region": "Cairo", "sex": "male", "age": 30, "country": "Egypt", "marital_status": "married", "education": "higher", "social_class": "working class"}, "question": {"id": "Q83", "variant": 0}, "response": ["Based on the anthropological framework, my perspective as a married male from Cairo, Egypt, who is 30 years old and part of the working class, is influenced by my cultural context, individual values, and socioeconomic background. In Egypt, there is a historical and cultural context of skepticism towards international organizations and their influence on national sovereignty. Additionally, as a member of the working class, I may have limited exposure to the benefits of UN initiatives and may be more focused on local issues. My personal experience and values also play a role in shaping my confidence in the UN, as I may prioritize issues that directly impact my community over global concerns. Therefore, my confidence in the United Nations may not be very high due to these factors.\n\n3"]}, {"persona": {"region": "Cairo", "sex": "male", "age": 39, "country": "Egypt", "marital_status": "married", "education": "higher", "social_class": "lower middle class"}, "question": {"id": "Q83", "variant": 0}, "response": ["Based on the anthropological framework, my emic perspective as a married male from Cairo, Egypt, leads me to consider the cultural context and my individual values and personal experience. Egypt has a complex relationship with the United Nations, and as a member of the lower middle class, I have experienced the impact of UN initiatives in my community. However, I also recognize the limitations and criticisms of the UN, especially in addressing the socioeconomic challenges faced by my community. Therefore, I have a moderate level of confidence in the United Nations, which aligns with my nuanced understanding of its role and impact in my cultural context.\n\n3"]}, {"persona": {"region": "Cairo", "sex": "female", "age": 41, "country": "Egypt", "marital_status": "married", "education": "middle", "social_class": "lower middle class"}, "question": {"id": "Q83", "variant": 0}, "response": ["Based on the anthropological framework, I, as a married female from Cairo, Egypt, would answer this question based on my emic perspective, considering my cultural context, individual values and personal experience, socioeconomic background, and the nuance of the question. As a member of the lower middle class in Egypt, I have had limited exposure to the United Nations and its work. My cultural context and personal experience have shaped my perception of international organizations like the UN, and I may not have a high level of confidence in their ability to address the issues that affect people like me. Additionally, my socioeconomic background and limited formal education may influence my perception of the UN and its relevance to my life. Therefore, my answer to the question would be:\n\n3\n\n(3) Not very much"]}, {"persona": {"region": "Cairo", "sex": "male", "age": 45, "country": "Syria", "marital_status": "single", "education": "higher", "social_class": "upper middle class"}, "question": {"id": "Q83", "variant": 0}, "response": ["Based on the anthropological framework, my response to the question about the confidence in the United Nations (UN) is influenced by my individual values and personal experience, as well as my socioeconomic background. As a single male from Cairo, Syria, who is 45 years old and part of the upper middle class, I have had access to higher education and have been exposed to different perspectives and information. Additionally, the cultural context of Syria and the region has shaped my understanding of international organizations like the UN. Considering the political and social dynamics in the region, as well as the historical involvement of the UN in addressing conflicts and humanitarian crises, I have a great deal of confidence in the United Nations (UN) because I believe in the potential for global cooperation and diplomacy in addressing global challenges.\n\n1"]}, {"persona": {"region": "Cairo", "sex": "male", "age": 54, "country": "Egypt", "marital_status": "married", "education": "higher", "social_class": "lower middle class"}, "question": {"id": "Q83", "variant": 0}, "response": ["Based on the anthropological framework, my perspective as a married male from Cairo, Egypt, who is 54 years old, has completed higher education, and considers himself part of the lower middle class, is influenced by my cultural context, individual values, socioeconomic background, and space and time. In Cairo, the UN has been involved in various initiatives and programs, and as someone with higher education, I am aware of the UN's global impact. However, as someone from the lower middle class, my confidence in the UN may be influenced by my socioeconomic background and the perceived effectiveness of the UN's initiatives in addressing the challenges faced by people in my community. Therefore, my perspective on the confidence in the United Nations is likely to be influenced by a combination of factors, including my cultural context, individual values, and socioeconomic background. \n3"]}, {"persona": {"region": "Cairo", "sex": "male", "age": 65, "country": "Egypt", "marital_status": "married", "education": "middle", "social_class": "upper middle class"}, "question": {"id": "Q83", "variant": 0}, "response": ["Based on my cultural context and socioeconomic background as a married male from Cairo, Egypt, who is 65 years old and considers himself part of the upper middle class, my perception of the United Nations (UN) is influenced by my personal experience and individual values. I have had exposure to international relations and have witnessed the impact of UN initiatives in my country and region. As someone who values stability and global cooperation, I have a great deal of confidence in the United Nations as a platform for resolving conflicts and addressing global issues. Additionally, my age and socioeconomic background have granted me the opportunity to engage with various perspectives on the UN's effectiveness, and I have come to appreciate its role in promoting peace and development.\n\n1"]}, {"persona": {"region": "Cairo", "sex": "female", "age": 52, "country": "Egypt", "marital_status": "married", "education": "middle", "social_class": "upper middle class"}, "question": {"id": "Q83", "variant": 0}, "response": ["Based on my emic perspective as a married female from Cairo, Egypt, I have a strong cultural context that influences my view of the United Nations. My personal experience and individual values as part of the upper middle class in Egypt also play a significant role in my perception. Additionally, my socioeconomic background and age contribute to how I view international organizations like the UN. Taking into account cultural relativism and the nuanced phrasing of the question, I would choose option (3) Not very much. \n\n3"]}, {"persona": {"region": "Cairo", "sex": "male", "age": 26, "country": "Egypt", "marital_status": "single", "education": "higher", "social_class": "lower middle class"}, "question": {"id": "Q83", "variant": 0}, "response": ["Based on the anthropological framework, my emic perspective as a single male from Cairo, Egypt, leads me to consider the cultural context, individual values, socioeconomic background, and space and time in formulating my answer. In my cultural context, there is a general skepticism towards international organizations due to historical experiences and current political dynamics. As a lower-middle-class individual, my socioeconomic background also influences my perception, as I may feel less connected to or impacted by the work of the UN. Additionally, at 26 years of age, I may not have had significant personal experiences with the UN to form a strong opinion. Therefore, I choose option (3) Not very much. \n\n3"]}, {"persona": {"region": "Cairo", "sex": "male", "age": 32, "country": "Egypt", "marital_status": "married", "education": "middle", "social_class": "working class"}, "question": {"id": "Q83", "variant": 0}, "response": ["Based on the anthropological framework, as a married male from Cairo, Egypt, I would approach the question of confidence in the United Nations (UN) with a combination of emic and etic perspectives. From an emic perspective, I would consider the cultural context of Egypt's historical relationship with the UN, including any geopolitical tensions and the impact of UN interventions in the region. Additionally, my individual values and personal experiences, shaped by my socioeconomic background as part of the working class, would influence my perception of the UN. Furthermore, cultural relativism reminds me that my perspective may differ from others due to nuances in the way the question is phrased. Therefore, my confidence in the UN would likely be influenced by these factors, leading me to choose option 3: Not very much. \n\n3"]}, {"persona": {"region": "Cairo", "sex": "male", "age": 38, "country": "Egypt", "marital_status": "married", "education": "middle", "social_class": "lower middle class"}, "question": {"id": "Q83", "variant": 0}, "response": ["Based on my emic perspective as a married male from Cairo, Egypt, I have grown up in a cultural context where the United Nations has been viewed with skepticism due to its interventions in the region and the political dynamics that have impacted my life. Additionally, my individual values and personal experience have led me to have not very much confidence in the United Nations, as I have witnessed the organization's limitations in addressing the socioeconomic challenges faced by my community. Furthermore, considering my lower middle-class socioeconomic background, I have seen the impact of global politics and international organizations on my daily life, which has influenced my perception of the United Nations. Therefore, my answer is (3) Not very much. \n\n3"]}, {"persona": {"region": "Cairo", "sex": "male", "age": 58, "country": "Egypt", "marital_status": "married", "education": "higher", "social_class": "upper middle class"}, "question": {"id": "Q83", "variant": 0}, "response": ["Based on the anthropological framework, my answer to the question of how much confidence I have in the United Nations (UN) is influenced by my cultural context as a married male from Cairo, Egypt. My personal experience and individual values also play a role, as well as my socioeconomic background as part of the upper middle class. Additionally, space and time are important factors, considering the historical context of the UN's involvement in the region. Based on these factors, I have quite a lot of confidence in the United Nations.\n\n2"]}, {"persona": {"region": "Cairo", "sex": "male", "age": 49, "country": "Egypt", "marital_status": "married", "education": "middle", "social_class": "lower middle class"}, "question": {"id": "Q83", "variant": 0}, "response": ["Based on the anthropological framework, as a married male from Cairo, Egypt, my emic perspective is influenced by my cultural context, individual values, and socioeconomic background. In Egypt, there is a sense of skepticism towards international organizations, including the United Nations. This is due to a history of colonialism and a perception that these organizations do not always have the best interests of our country at heart. Additionally, as part of the lower middle class, I have experienced economic challenges and may feel that the UN does not address the needs of people like me. Therefore, I would choose option 3: Not very much."]}, {"persona": {"region": "Cairo", "sex": "female", "age": 29, "country": "Egypt", "marital_status": "married", "education": "middle", "social_class": "working class"}, "question": {"id": "Q83", "variant": 0}, "response": ["Based on the anthropological framework, as a married female from Cairo, Egypt, I would answer this question from an emic perspective, considering the cultural context, individual values and personal experience, socioeconomic background, and the concept of cultural relativism. In Cairo, the UN is often seen as an institution that supports the interests of powerful nations and may not always prioritize the needs of countries like Egypt. As a member of the working class, I may not have direct interaction with the UN, but I am aware of the impact of its decisions on global politics and aid distribution. Therefore, my confidence in the UN would not be very high, as I believe it may not always serve the best interests of Egypt and its people.\n\n3"]}, {"persona": {"region": "Cairo", "sex": "female", "age": 36, "country": "Egypt", "marital_status": "married", "education": "higher", "social_class": "lower middle class"}, "question": {"id": "Q83", "variant": 0}, "response": ["Based on my Emic perspective, as a married female from Cairo, Egypt, I have grown up in a cultural context where the UN's actions and decisions have often been viewed with skepticism. This is partly due to the geopolitical nature of the UN and its perceived influence on global politics, which can sometimes be seen as detrimental to the interests of countries like Egypt. Additionally, my individual values and personal experiences have led me to question the effectiveness and fairness of the UN, especially in addressing key issues in the Middle East. As someone from the lower middle class, my socioeconomic background has also influenced my perception, as I have seen firsthand the impact of global decisions on local communities. Therefore, my nuanced understanding of the UN leads me to have (3) Not very much confidence in the United Nations.\n\n3"]}, {"persona": {"region": "Cairo", "sex": "female", "age": 34, "country": "Egypt", "marital_status": "married", "education": "middle", "social_class": "lower middle class"}, "question": {"id": "Q83", "variant": 0}, "response": ["Based on the anthropological framework, as a married female from Cairo, Egypt, at 34 years of age with a middle education level and considering myself part of the lower middle class, my perspective on the United Nations (UN) will be heavily influenced by my cultural context, individual values, and socioeconomic background. My cultural context and personal experience may lead me to have a more skeptical view of international organizations like the UN, as they may seem distant and disconnected from my everyday life. Additionally, my lower middle class status may mean that I have limited access to information about the UN and its impact on global issues. Therefore, I would choose option (3) Not very much, as I may not feel confident in the UN's ability to address the specific challenges facing my community and myself. \n\n3"]}, {"persona": {"region": "Fayoum", "sex": "male", "age": 57, "country": "Egypt", "marital_status": "married", "education": "middle", "social_class": "working class"}, "question": {"id": "Q83", "variant": 0}, "response": ["Based on the anthropological framework, as a married male from Fayoum, Egypt, I would approach this question with consideration of my cultural context, individual values and personal experience, and socioeconomic background. In my community, there is a general sense of skepticism towards international organizations like the United Nations, as we often feel that their actions do not directly benefit us. My personal experience and socioeconomic background as a working-class individual also lead me to question the effectiveness of the UN in addressing the needs of people like me. Therefore, I would choose option 3: Not very much."]}, {"persona": {"region": "Fayoum", "sex": "male", "age": 60, "country": "Egypt", "marital_status": "married", "education": "middle", "social_class": "lower middle class"}, "question": {"id": "Q83", "variant": 0}, "response": ["Based on the anthropological framework, as a married male from Fayoum, Egypt, I have grown up and lived in a community where the cultural context and socioeconomic background have greatly influenced my perception of the United Nations (UN). My personal experience and individual values also play a significant role in my confidence in the UN. Additionally, my age and educational level have shaped my understanding of global politics and international organizations. Therefore, based on these factors, I would choose option 3: Not very much."]}, {"persona": {"region": "Fayoum", "sex": "male", "age": 21, "country": "Egypt", "marital_status": "single", "education": "middle", "social_class": "lower middle class"}, "question": {"id": "Q83", "variant": 0}, "response": ["Based on the anthropological framework, as a 21-year-old male from Fayoum, Egypt, with a lower middle-class background, my response to the question about confidence in the United Nations would be influenced by my cultural context, individual values, and personal experience. Growing up in a region with limited access to resources and opportunities, I may have experienced the impact of global organizations like the UN in providing aid and support to my community. However, I also recognize the limitations and complexities of international interventions, and may have personal reservations about the effectiveness and fairness of UN initiatives. Therefore, my response would reflect a nuanced understanding of the UN's role and impact, leaning towards a moderate level of confidence.\n\n3"]}, {"persona": {"region": "Fayoum", "sex": "male", "age": 33, "country": "Egypt", "marital_status": "single", "education": "higher", "social_class": "working class"}, "question": {"id": "Q83", "variant": 0}, "response": ["Based on my emic perspective as a single male from Fayoum, Egypt, my cultural context and socioeconomic background heavily influence my perception of the United Nations (UN). As a member of the working class in Egypt, my experiences and personal values shape my view of international institutions like the UN. Additionally, cultural relativism is important to consider, as my perspective may differ from those in other cultural contexts. Furthermore, my age and place of residence also play a role in my understanding. Considering all of these factors, my level of confidence in the UN would be option 3, \"Not very much.\"\n\n3"]}, {"persona": {"region": "Fayoum", "sex": "male", "age": 32, "country": "Egypt", "marital_status": "married", "education": "higher", "social_class": "lower middle class"}, "question": {"id": "Q83", "variant": 0}, "response": ["Based on my emic perspective as a married male from Fayoum, Egypt, I am influenced by the cultural context of my community, as well as my individual values and personal experience. My socioeconomic background as part of the lower middle class also plays a role in shaping my views. Additionally, cultural relativism is important to consider, as my perception of the United Nations may be different from others based on my space and time, as well as the nuance in the phrasing of the question. Therefore, I choose the following option:\n\n3"]}, {"persona": {"region": "Gharbia", "sex": "male", "age": 42, "country": "Egypt", "marital_status": "married", "education": "higher", "social_class": "upper middle class"}, "question": {"id": "Q83", "variant": 0}, "response": ["From the perspective of a married male from Gharbia, Egypt, who is 42 years old, has completed higher education, and considers himself part of the upper middle class, the answer to the question of how much confidence he has in the United Nations (UN) would be influenced by a combination of cultural context, individual values, and socioeconomic background. As a member of the upper middle class, he may have had more exposure to global issues and international politics through his education and access to resources, which could lead to a greater awareness and understanding of the UN's role in the world. Additionally, his personal values and experiences may have shaped his perception of the UN and its effectiveness in addressing global challenges. Given these factors, the persona described above would likely choose option (2) Quite a lot, as he may have a relatively positive view of the UN's impact and importance in addressing global issues. \n\n2"]}, {"persona": {"region": "Gharbia", "sex": "male", "age": 52, "country": "Egypt", "marital_status": "married", "education": "middle", "social_class": "working class"}, "question": {"id": "Q83", "variant": 0}, "response": ["Based on the anthropological framework, my perspective as a married male from Gharbia, Egypt, at 52 years of age, with a middle education level and part of the working class, is heavily influenced by my cultural context, individual values, and socioeconomic background. In Gharbia, there is a general sense of skepticism towards international organizations like the UN, as there is a belief that they do not fully understand or address the needs of our community. Additionally, my socioeconomic background as a working-class individual has led me to feel marginalized and overlooked by larger global institutions, further diminishing my confidence in the UN.\n\n3"]}, {"persona": {"region": "Gharbia", "sex": "male", "age": 45, "country": "Egypt", "marital_status": "divorced", "education": "higher", "social_class": "upper middle class"}, "question": {"id": "Q83", "variant": 0}, "response": ["Based on the anthropological framework, my emic perspective as a divorced male from Gharbia, Egypt, who is 45 years old, completed higher education, and considers himself part of the upper middle class, would lead me to consider the cultural context, individual values, and socioeconomic background in answering the question about confidence in the United Nations (UN). In Gharbia, Egypt, there is a strong sense of pride and nationalism, and individuals from my background often value international cooperation and diplomacy. Additionally, my higher education level and socioeconomic status may lead me to have a greater understanding of the UN's role and impact, influencing my confidence in the organization. Therefore, I would choose option (2) Quite a lot, as I have a considerable amount of confidence in the United Nations."]}, {"persona": {"region": "Behaira", "sex": "male", "age": 23, "country": "Egypt", "marital_status": "single", "education": "middle", "social_class": "lower class"}, "question": {"id": "Q83", "variant": 0}, "response": ["Based on the anthropological framework, my emic perspective as a lower-class individual from Behaira, Egypt, with limited education and resources, influences my perception of the United Nations. My cultural context and socioeconomic background play a significant role in my understanding and trust in international organizations like the UN. Additionally, my individual values and personal experiences, coupled with the nuance of the question, lead me to choose option 3: Not very much. This choice reflects my lack of exposure to and reliance on such global institutions, as well as my skepticism about their ability to address the issues that directly affect my community and me."]}, {"persona": {"region": "Behaira", "sex": "male", "age": 38, "country": "Egypt", "marital_status": "single", "education": "higher", "social_class": "lower class"}, "question": {"id": "Q83", "variant": 0}, "response": ["Based on the anthropological framework, my answer to the question is influenced by my cultural context as a lower-class male from Behaira, Egypt. My socioeconomic background and personal experience have shaped my perception of the United Nations. Additionally, my age and place of living also play a role in my understanding. The UN may not have directly impacted my life, and I may not have the resources or access to information to fully comprehend its effectiveness. Therefore, my confidence in the United Nations is not very much.\n\n3"]}, {"persona": {"region": "Behaira", "sex": "male", "age": 32, "country": "Egypt", "marital_status": "married", "education": "middle", "social_class": "lower class"}, "question": {"id": "Q83", "variant": 0}, "response": ["Based on the anthropological framework, my perspective as a married male from Behaira, Egypt, with a middle education level and lower class socioeconomic background, is deeply influenced by my cultural context, individual values, and personal experiences. My understanding of the United Nations is shaped by the historical and political context of Egypt, as well as the socioeconomic struggles faced by individuals in my community. As a result, I have limited confidence in the United Nations due to its perceived lack of impact on the everyday challenges faced by people like me. Therefore, I would select option 3: Not very much."]}, {"persona": {"region": "Behaira", "sex": "female", "age": 37, "country": "Egypt", "marital_status": "married", "education": "middle", "social_class": "working class"}, "question": {"id": "Q83", "variant": 0}, "response": ["Based on the anthropological framework, as a married female from Behaira, Egypt, who is part of the working class and has completed middle education, my perspective on the confidence in the United Nations (UN) is heavily influenced by my cultural context, individual values, and socioeconomic background. Egypt has a complex relationship with the UN, and as a member of the working class, I may have limited exposure to the UN's work and its impact on my daily life. Additionally, my personal experience and values may lead me to question the effectiveness of international organizations in addressing the needs of people like me. Therefore, I would choose option 3: Not very much, as my confidence in the UN may be tempered by my limited exposure and skepticism about its impact on my life. \n\n3"]}, {"persona": {"region": "Behaira", "sex": "male", "age": 48, "country": "Egypt", "marital_status": "married", "education": "middle", "social_class": "working class"}, "question": {"id": "Q83", "variant": 0}, "response": ["Based on the anthropological framework, as a married male from Behaira, Egypt, at 48 years of age with a middle education level and part of the working class, my answer to the question of how much confidence I have in the United Nations (UN) would be influenced by my cultural context, individual values, and socioeconomic background. Growing up in Behaira, I have been exposed to a culture that values self-reliance and community support. Additionally, as a member of the working class, my socioeconomic background may lead me to have a more critical view of international organizations like the UN, as I may feel that they do not directly address the needs and concerns of people like me. Therefore, based on my personal experience and cultural context, I would choose option 3: Not very much."]}, {"persona": {"region": "Behaira", "sex": "female", "age": 34, "country": "Egypt", "marital_status": "married", "education": "middle", "social_class": "lower class"}, "question": {"id": "Q83", "variant": 0}, "response": ["Based on the anthropological framework, as a married female from Behaira, Egypt, who is 34 years old and part of the lower class, my emic perspective is influenced by my cultural context, individual values, and socioeconomic background. In my cultural context, there is a general lack of trust in international organizations due to perceived inequalities and injustices. My individual values are shaped by my personal experience of struggling to make ends meet, which leads to a feeling of disempowerment and lack of confidence in institutions like the UN. Additionally, my socioeconomic background as part of the lower class further reinforces my skepticism towards international organizations. Therefore, I have chosen option (3) Not very much as my answer.\n\n3"]}, {"persona": {"region": "Behaira", "sex": "female", "age": 30, "country": "Egypt", "marital_status": "divorced", "education": "lower", "social_class": "lower class"}, "question": {"id": "Q83", "variant": 0}, "response": ["Based on my personal experience and cultural context, as a divorced woman from Behaira, Egypt, who belongs to the lower class and has limited education, my confidence in the United Nations (UN) may not be very high. My socioeconomic background and lack of access to higher education may limit my exposure to the work of the UN and its impact on my life. Additionally, cultural relativism plays a role in shaping my perspective, as my community may have limited interaction with international organizations like the UN. Therefore, I may not have a strong understanding of the UN's work and may not have a great deal of confidence in it. \n\n3"]}, {"persona": {"region": "Behaira", "sex": "male", "age": 40, "country": "Egypt", "marital_status": "married", "education": "higher", "social_class": "lower middle class"}, "question": {"id": "Q83", "variant": 0}, "response": ["From the emic perspective, as a married male from Behaira, Egypt, my in-group way of thinking about the United Nations (UN) is heavily influenced by my cultural context, individual values, and socioeconomic background. In Egypt, there is a general sense of skepticism and distrust towards international organizations like the UN, stemming from historical and political factors. Additionally, my lower middle class status and educational background have exposed me to critical perspectives on global governance and international relations. Therefore, I would have to say that I have not very much confidence in the United Nations. \n\n3"]}, {"persona": {"region": "Behaira", "sex": "male", "age": 38, "country": "Egypt", "marital_status": "married", "education": "middle", "social_class": "working class"}, "question": {"id": "Q83", "variant": 0}, "response": ["Based on the anthropological framework, my perspective as a married male from Behaira, Egypt, is heavily influenced by my cultural context, socioeconomic background, and personal experience. Living in a working-class community, I have limited access to resources and opportunities, and my exposure to global institutions like the United Nations is minimal. Additionally, my middle-level education has not provided me with a comprehensive understanding of international organizations and their impact on my life. Therefore, I would have to say that I don't know how much confidence I have in the United Nations. \n\n5"]}, {"persona": {"region": "Behaira", "sex": "female", "age": 30, "country": "Egypt", "marital_status": "married", "education": "higher", "social_class": "lower class"}, "question": {"id": "Q83", "variant": 0}, "response": ["From the perspective of a married female from Behaira, Egypt, who is 30 years old, has completed higher education and considers herself part of the lower class, cultural context plays a significant role in shaping perceptions and attitudes towards international organizations such as the United Nations. The individual values and personal experience of this persona, combined with their socioeconomic background, will influence their level of confidence in the UN. Additionally, cultural relativism teaches us that there is no hierarchy of culture, and space and time are important factors in shaping perspectives. Given these considerations, I would choose option (3) Not very much. \n\n3"]}, {"persona": {"region": "Behaira", "sex": "female", "age": 35, "country": "Egypt", "marital_status": "married", "education": "middle", "social_class": "working class"}, "question": {"id": "Q83", "variant": 0}, "response": ["Based on the anthropological framework, my answer to the question of how much confidence I have in the United Nations is influenced by my emic perspective as a married female from Behaira, Egypt. My cultural context and individual values as part of the working class in Egypt play a significant role in shaping my opinion. Additionally, my middle education level and socioeconomic background also influence my perception. As a member of the working class, I have experienced firsthand the challenges and struggles faced by my community, and I have observed the limitations of international organizations in addressing the needs of people like me. Therefore, my confidence in the United Nations is not very much.\n\n3"]}, {"persona": {"region": "Behaira", "sex": "male", "age": 52, "country": "Egypt", "marital_status": "married", "education": "middle", "social_class": "lower class"}, "question": {"id": "Q83", "variant": 0}, "response": ["From the perspective of a married male from Behaira, Egypt, who is 52 years old, has completed only middle education, and considers himself part of the lower class, there are several factors to consider in answering the question about confidence in the United Nations (UN). The cultural context is important, as Egypt has a complex relationship with international organizations like the UN, and as a member of the lower class, there may be limited access to information about the UN's activities and impact. Socioeconomic background also plays a role, as someone from the lower class may have different concerns and priorities than those from higher socioeconomic backgrounds. Additionally, individual values and personal experiences may shape perceptions of the UN. Considering these factors, my response would be:\n\n3. Not very much"]}, {"persona": {"region": "Alexandria", "sex": "female", "age": 41, "country": "Egypt", "marital_status": "single", "education": "middle", "social_class": "lower class"}, "question": {"id": "Q83", "variant": 0}, "response": ["Based on the anthropological framework, as a single female from Alexandria, Egypt, my emic perspective is influenced by my cultural context, individual values, and socioeconomic background. Coming from a lower class background, I have experienced firsthand the challenges and inequalities that exist in my community. This has shaped my perception of global organizations like the United Nations. I have seen how their efforts have not directly impacted my life or the lives of those around me, leading me to have not very much confidence in the UN. My personal experience and socioeconomic background have influenced my understanding of the UN's effectiveness, and I believe this perspective would be shared by others in similar circumstances.\n\n3"]}, {"persona": {"region": "Alexandria", "sex": "female", "age": 21, "country": "Egypt", "marital_status": "single", "education": "middle", "social_class": "lower class"}, "question": {"id": "Q83", "variant": 0}, "response": ["From an emic perspective, as a single female from Alexandria, Egypt, who is part of the lower class and has completed middle education, my cultural context and socioeconomic background greatly influence my perception of the United Nations. I come from a region with a history of political instability and socioeconomic challenges, and as a result, I may not have a great deal of confidence in the UN. My personal experience and individual values also play a significant role in shaping my opinions, as I may have personally witnessed or experienced the consequences of international policies and interventions that did not benefit people in my community. Additionally, cultural relativism reminds us that different cultures may have varying levels of trust in international organizations, and my nuanced understanding of this question leads me to select option 3: Not very much."]}, {"persona": {"region": "Alexandria", "sex": "female", "age": 35, "country": "Egypt", "marital_status": "married", "education": "middle", "social_class": "lower class"}, "question": {"id": "Q83", "variant": 0}, "response": ["Based on my emic perspective as a married woman from Alexandria, Egypt, I have been exposed to a cultural context where the socioeconomic background plays a significant role in shaping my views. Being part of the lower class, I have experienced the challenges of limited access to resources and opportunities. This has influenced my individual values and personal experience, leading to a lack of confidence in international institutions such as the United Nations. Additionally, the cultural relativism in my community often leads to skepticism towards external entities. Therefore, I would choose option (3) Not very much in terms of confidence in the United Nations. \n\n3"]}, {"persona": {"region": "Alexandria", "sex": "male", "age": 34, "country": "Egypt", "marital_status": "married", "education": "higher", "social_class": "working class"}, "question": {"id": "Q83", "variant": 0}, "response": ["In considering the question of confidence in the United Nations (UN) from the perspective of a married male from Alexandria, Egypt, who is 34 years old, completed higher education, and considers himself part of the working class, several factors come into play. The cultural context is important, as Egypt has a complex relationship with international organizations, and the individual's socioeconomic background as a member of the working class may influence perceptions of global institutions. Additionally, the nuance of the question is crucial, as the wording can impact the response. Considering these factors, the persona would likely have \"Not very much\" confidence in the United Nations (UN) due to perceived inefficiencies and lack of impact in addressing global issues.\n\n3"]}, {"persona": {"region": "Alexandria", "sex": "female", "age": 37, "country": "Egypt", "marital_status": "married", "education": "higher", "social_class": "lower middle class"}, "question": {"id": "Q83", "variant": 0}, "response": ["In considering the question of how much confidence I have in the United Nations (UN), I must first take into account my cultural context as a married female from Alexandria, Egypt. My personal experiences and values, as well as my socioeconomic background as part of the lower middle class, greatly influence my perception of international organizations like the UN. Additionally, cultural relativism teaches us that there is no hierarchy of culture, so my understanding of the UN will differ from others based on my unique perspective. Taking into account all of these factors, I would choose the following option:\n\n2"]}, {"persona": {"region": "Alexandria", "sex": "female", "age": 56, "country": "Egypt", "marital_status": "divorced", "education": "middle", "social_class": "working class"}, "question": {"id": "Q83", "variant": 0}, "response": ["Based on the anthropological framework, my perspective as a divorced female from Alexandria, Egypt, who is 56 years old, completed middle education, and considers herself part of the working class, is influenced by my cultural context, individual values, and socioeconomic background. In Egypt, there is a long history of engagement with international organizations like the United Nations, and my personal experience has shaped my perception of their effectiveness. As a member of the working class, I have witnessed the impact of global policies on local communities, and I value organizations that advocate for the rights of marginalized groups. Therefore, I have quite a lot of confidence in the United Nations.\n\n2"]}, {"persona": {"region": "Alexandria", "sex": "male", "age": 48, "country": "Egypt", "marital_status": "married", "education": "higher", "social_class": "working class"}, "question": {"id": "Q83", "variant": 0}, "response": ["Based on the anthropological framework, I, as a married male from Alexandria, Egypt, take into consideration the emic and etic perspectives of my cultural context, individual values, and personal experience, as well as my socioeconomic background. In Egypt, there is a mix of positive and negative sentiments towards the United Nations (UN). Some view the UN as a force for good and a platform for global cooperation, while others see it as an organization that does not always prioritize the needs and concerns of countries like Egypt. As a working-class individual, I have personally experienced the challenges faced by my community and have seen the limitations of international organizations in addressing our specific needs. Therefore, I have to choose an option that reflects this perspective.\n\n3\n\nI choose \"Not very much\" because I have personally seen the limitations of international organizations in addressing the specific needs and concerns of my community."]}, {"persona": {"region": "Alexandria", "sex": "female", "age": 30, "country": "Egypt", "marital_status": "married", "education": "middle", "social_class": "working class"}, "question": {"id": "Q83", "variant": 0}, "response": ["Based on the anthropological framework, my emic perspective as a married working-class woman from Alexandria, Egypt, with a middle education level, is influenced by my cultural context, individual values, and socioeconomic background. In Egypt, there is a history of skepticism and suspicion towards international organizations and foreign intervention. My personal experience and values lead me to have not very much confidence in the United Nations due to a perceived lack of effectiveness and a feeling of being overlooked by international organizations. This sentiment is also influenced by my socioeconomic background, as the working class in Egypt often feels neglected and marginalized. Therefore, my answer is:\n\n3"]}, {"persona": {"region": "Alexandria", "sex": "male", "age": 19, "country": "Egypt", "marital_status": "single", "education": "middle", "social_class": "lower class"}, "question": {"id": "Q83", "variant": 0}, "response": ["From the perspective of a single male from Alexandria, Egypt, who is 19 years old, has completed middle education, and considers himself part of the lower class, my answer to the question about confidence in the United Nations (UN) is influenced by my cultural context, individual values, and socioeconomic background. Growing up in a lower-class neighborhood in Alexandria, I have witnessed the struggles of my community, including lack of access to basic resources and opportunities. This has shaped my perception of global organizations like the UN, as I have seen little tangible impact of their work in my everyday life. Additionally, my limited education and exposure to different perspectives may lead me to have less confidence in international institutions. Therefore, my answer is (3) Not very much."]}, {"persona": {"region": "Alexandria", "sex": "male", "age": 45, "country": "Egypt", "marital_status": "married", "education": "middle", "social_class": "lower middle class"}, "question": {"id": "Q83", "variant": 0}, "response": ["Based on my emic perspective as a married male from Alexandria, Egypt, my cultural context and socioeconomic background play a significant role in my perception of the United Nations (UN). Egypt has historically had a complex relationship with the UN due to various political and social factors, and as a lower middle class individual, I have personally experienced the effects of certain UN policies or lack thereof on my community. Additionally, my age and educational level also contribute to my nuanced understanding of global politics and the UN's role in addressing issues that affect my daily life. Therefore, I would choose option (3) Not very much, as my personal experience and cultural context have led me to have limited confidence in the UN's ability to address the concerns of people like me. \n\n3"]}, {"persona": {"region": "Alexandria", "sex": "male", "age": 23, "country": "Egypt", "marital_status": "single", "education": "higher", "social_class": "lower class"}, "question": {"id": "Q83", "variant": 0}, "response": ["Based on the anthropological framework, as a single male from Alexandria, Egypt, who is 23 years old and part of the lower class, my emic perspective is influenced by my personal experience and socioeconomic background. My cultural context and individual values also play a role in shaping my view. As someone who has experienced the effects of poverty and inequality, and has seen how global organizations like the United Nations often fail to address the systemic issues faced by marginalized communities, I have little confidence in the UN's ability to create meaningful change. Additionally, my cultural relativism and nuanced understanding of the world shapes my skepticism towards the UN's effectiveness. (3)\n\n3"]}, {"persona": {"region": "Alexandria", "sex": "female", "age": 28, "country": "Egypt", "marital_status": "married", "education": "middle", "social_class": "working class"}, "question": {"id": "Q83", "variant": 0}, "response": ["Based on my cultural context and socioeconomic background, as a married female from Alexandria, Egypt, who is 28 years old and part of the working class, my confidence in the United Nations may be influenced by the historical relationship between Egypt and the UN, as well as the impact of UN policies on my community. My personal experience and values also play a significant role in shaping my perspective. Additionally, the space and time in which I live and the nuances of the question itself will impact my answer. \n\n3"]}, {"persona": {"region": "Alexandria", "sex": "male", "age": 34, "country": "Egypt", "marital_status": "single", "education": "higher", "social_class": "working class"}, "question": {"id": "Q83", "variant": 0}, "response": ["From an anthropological perspective, my emic view as a single male from Alexandria, Egypt, who comes from a working-class background and has completed higher education, is influenced by my cultural context, individual values, and personal experiences. As a member of this demographic, my perception of the United Nations (UN) is shaped by my socioeconomic background, which affects my level of trust in international organizations. Additionally, my cultural relativism informs my understanding of the UN's actions and decisions, leading me to consider the organization with a certain level of skepticism. Furthermore, space and time are also important factors, as my experiences and the historical context of Egypt's relationship with the UN play a role in shaping my opinion. Therefore, based on this perspective, I would choose the following option:\n\n3"]}, {"persona": {"region": "Alexandria", "sex": "male", "age": 30, "country": "Egypt", "marital_status": "married", "education": "higher", "social_class": "lower middle class"}, "question": {"id": "Q83", "variant": 0}, "response": ["Based on the anthropological framework, my perspective as a married male from Alexandria, Egypt, who is 30 years old and part of the lower middle class, is influenced by my cultural context, individual values, and socioeconomic background. In Egypt, there is a strong sense of national pride and skepticism towards international organizations. Additionally, my socioeconomic background may lead me to perceive the UN as distant and disconnected from my everyday life. Therefore, I would choose option 3: Not very much, as I may have limited confidence in the UN's ability to positively impact my life and community."]}, {"persona": {"region": "Alexandria", "sex": "female", "age": 49, "country": "Egypt", "marital_status": "married", "education": "higher", "social_class": "lower middle class"}, "question": {"id": "Q83", "variant": 0}, "response": ["Based on the anthropological framework, my cultural context as a married female from Alexandria, Egypt, with a lower middle-class background and higher education, greatly influences my perspective on the United Nations. My personal experience and individual values are shaped by the socioeconomic background of my community, where there is a general lack of trust in international organizations due to historical and political reasons. Additionally, the cultural relativism in Egypt emphasizes the importance of national sovereignty and self-reliance, which can contribute to skepticism towards external entities such as the United Nations. Given these factors, I would choose option (3) Not very much, as it reflects the general sentiment of my community towards international organizations."]}, {"persona": {"region": "Kafr el-sheikh", "sex": "male", "age": 49, "country": "Egypt", "marital_status": "married", "education": "higher", "social_class": "working class"}, "question": {"id": "Q83", "variant": 0}, "response": ["Based on the anthropological framework, my perspective as a married male from Kafr el-sheikh, Egypt would be influenced by my cultural context, individual values, and socioeconomic background. In my community, there is a strong emphasis on working hard to provide for my family, and my higher education has allowed me to have a critical understanding of global politics. As part of the working class, I am aware of the challenges faced by people in my socioeconomic position, including lack of access to resources and opportunities. Additionally, my cultural context as an Egyptian has shaped my views on international organizations like the United Nations. Considering these factors, I would choose option (3) Not very much as my answer.\n\n3"]}, {"persona": {"region": "Kafr el-sheikh", "sex": "male", "age": 25, "country": "Egypt", "marital_status": "single", "education": "middle", "social_class": "lower middle class"}, "question": {"id": "Q83", "variant": 0}, "response": ["Based on the anthropological framework, my perspective as a single male from Kafr el-sheikh, Egypt, at the age of 25 and part of the lower middle class, is heavily influenced by my cultural context, socioeconomic background, and personal experiences. Living in Egypt, I have experienced firsthand the impact of the UN's work in my country, particularly in areas such as humanitarian aid and peacekeeping efforts. Additionally, my socioeconomic background as part of the lower middle class has shaped my perception of the UN, as I have seen the organization's work directly benefitting individuals in similar economic situations. Therefore, I have quite a lot of confidence in the United Nations.\n\n2"]}, {"persona": {"region": "Kafr el-sheikh", "sex": "male", "age": 59, "country": "Egypt", "marital_status": "married", "education": "higher", "social_class": "lower middle class"}, "question": {"id": "Q83", "variant": 0}, "response": ["Based on the anthropological framework, my answer to the question of how much confidence I have in the United Nations (UN) is influenced by my cultural context, individual values, and socioeconomic background. As a married male from Kafr el-sheikh, Egypt, at 59 years of age with a higher education level, I consider myself part of the lower middle class. My cultural context and personal experiences have shaped my understanding and perception of the UN. Additionally, my socioeconomic background may lead me to have less confidence in the UN due to the lack of tangible benefits I have personally experienced from their initiatives. Therefore, my answer would be:\n\n3\n\n(3) Not very much"]}, {"persona": {"region": "Kafr el-sheikh", "sex": "female", "age": 38, "country": "Egypt", "marital_status": "married", "education": "middle", "social_class": "working class"}, "question": {"id": "Q83", "variant": 0}, "response": ["Based on the anthropological framework, my perspective as a married female from Kafr el-sheikh, Egypt, is heavily influenced by my cultural context, socioeconomic background, and personal experience. In Egypt, there is a general distrust of international organizations, including the United Nations, due to a history of colonialism and interference in local affairs. As a member of the working class, I have personally experienced the challenges and struggles faced by my community, which has led to a sense of skepticism towards external entities. Additionally, my limited education level has shaped my views on global institutions, as I may not have had the opportunity to fully understand the UN's role and impact. Therefore, I would choose option 3: Not very much."]}, {"persona": {"region": "Kafr el-sheikh", "sex": "male", "age": 35, "country": "Egypt", "marital_status": "married", "education": "higher", "social_class": "lower middle class"}, "question": {"id": "Q83", "variant": 0}, "response": ["Based on the anthropological framework, my perspective as a married male from Kafr el-sheikh, Egypt, who is 35 years old, has completed higher education, and considers himself part of the lower middle class, is heavily influenced by my cultural context, socioeconomic background, and individual values. As someone from a lower middle class background in Egypt, I have experienced socioeconomic challenges and have seen how international organizations like the UN can have a positive impact on communities in need. Additionally, my education has taught me about the importance of global cooperation and the role of the UN in addressing global issues. Therefore, I have quite a lot of confidence in the United Nations (UN) as I believe in the potential for international organizations to make a positive difference in the world.\n\n2"]}, {"persona": {"region": "Kafr el-sheikh", "sex": "male", "age": 49, "country": "Egypt", "marital_status": "married", "education": "middle", "social_class": "lower class"}, "question": {"id": "Q83", "variant": 0}, "response": ["Based on my cultural context, as a married male from Kafr el-sheikh, Egypt, I have been influenced by the political and social dynamics of my community and country. My lower class socioeconomic background has also shaped my perspective, as I have experienced the challenges and limitations that come with this status. Additionally, my age and level of education have influenced my understanding of the world and the institutions that govern it. Considering all these factors, I have limited confidence in the United Nations (UN) as I believe that it does not adequately address the needs and concerns of people like me, and it often seems disconnected from the realities of my life. \n\n3"]}, {"persona": {"region": "Kafr el-sheikh", "sex": "male", "age": 37, "country": "Egypt", "marital_status": "married", "education": "middle", "social_class": "lower class"}, "question": {"id": "Q83", "variant": 0}, "response": ["Based on my cultural context and socioeconomic background, as a married male from Kafr el-sheikh, Egypt, I have had limited exposure to international organizations such as the United Nations. My education level and lower class status also play a role in my understanding and perception of the UN. I have not had the opportunity to benefit from the UN's programs or initiatives, and my personal experience and values lead me to believe that they may not have a direct impact on my life or the lives of those around me. Therefore, I have limited confidence in the United Nations and their ability to address the issues that are most important to me and my community.\n\n3"]}, {"persona": {"region": "Menofia", "sex": "female", "age": 22, "country": "Egypt", "marital_status": "single", "education": "middle", "social_class": "lower class"}, "question": {"id": "Q83", "variant": 0}, "response": ["Based on the anthropological framework, the emic perspective of a single female from Menofia, Egypt, who is 22 years old, completed middle education level and considers herself part of the lower class, would likely be influenced by her cultural context, individual values and personal experience, socioeconomic background, and space and time. Given the historical and socioeconomic context of Egypt, where there may be limited access to education and resources for individuals in the lower class, as well as potential political unrest, it is likely that this persona may not have a great deal of confidence in the United Nations. Additionally, her age and level of education may contribute to her skepticism of international organizations. Therefore, option 3, \"Not very much,\" would be the most likely choice from this perspective.\n\n3"]}, {"persona": {"region": "Menofia", "sex": "female", "age": 25, "country": "Egypt", "marital_status": "married", "education": "middle", "social_class": "lower class"}, "question": {"id": "Q83", "variant": 0}, "response": ["Based on the anthropological framework, as a married female from Menofia, Egypt, I would consider the Emic perspective, taking into account my cultural context, individual values, and socioeconomic background. In my community, there is a general lack of trust in international organizations like the United Nations due to a history of feeling marginalized and overlooked. Additionally, my lower class status means that I may not have direct access to the benefits or aid that the UN claims to provide. Therefore, I would have to choose option 3: Not very much, as my confidence in the United Nations is influenced by my cultural context and socioeconomic background. \n\n3"]}, {"persona": {"region": "Menofia", "sex": "male", "age": 28, "country": "Egypt", "marital_status": "single", "education": "higher", "social_class": "working class"}, "question": {"id": "Q83", "variant": 0}, "response": ["Based on the anthropological framework, my perspective as a single male from Menofia, Egypt, who is 28 years old, completed higher education, and considers himself part of the working class, is heavily influenced by my cultural context, individual values, and socioeconomic background. In Egypt, there is a history of skepticism and distrust towards international organizations, including the United Nations, due to perceived Western bias and intervention. As a member of the working class, I may also feel disconnected from the decisions and policies of the UN, leading to a lack of confidence in its effectiveness. Additionally, my educational background may have exposed me to critical perspectives on the UN's actions in the Middle East and North Africa region. Therefore, my answer to the question would be:\n3) Not very much"]}, {"persona": {"region": "Menofia", "sex": "male", "age": 35, "country": "Egypt", "marital_status": "married", "education": "middle", "social_class": "lower middle class"}, "question": {"id": "Q83", "variant": 0}, "response": ["From my emic perspective as a married male from Menofia, Egypt, I have grown up in a cultural context where the influence of the United Nations may not be as prevalent or relevant to my daily life. My individual values and personal experience have led me to focus on more immediate concerns, and my lower middle class socioeconomic background has meant that my attention is often directed towards more pressing matters such as providing for my family. Additionally, cultural relativism has taught me to view the UN with a nuanced perspective, understanding that its impact may differ depending on geographical location and socio-economic status. Therefore, my confidence in the United Nations may not be very high, as its influence may not be directly felt in my community or life. \n\n3"]}, {"persona": {"region": "Menofia", "sex": "male", "age": 55, "country": "Egypt", "marital_status": "married", "education": "middle", "social_class": "working class"}, "question": {"id": "Q83", "variant": 0}, "response": ["Based on the anthropological framework, my perspective as a married male from Menofia, Egypt, is deeply influenced by my cultural context, socioeconomic background, and personal experience. As a member of the working class with only a middle education level, my understanding of the United Nations is likely to be shaped by my limited access to information and resources. Additionally, my age and place of residence in Menofia, Egypt, may contribute to a more skeptical view of international organizations like the UN. Considering these factors, I would choose option (3) Not very much."]}, {"persona": {"region": "Menofia", "sex": "male", "age": 53, "country": "Egypt", "marital_status": "married", "education": "higher", "social_class": "lower middle class"}, "question": {"id": "Q83", "variant": 0}, "response": ["Based on the anthropological framework, my answer to the question about confidence in the United Nations is influenced by my cultural context as a married male from Menofia, Egypt. In my community, there is a strong emphasis on valuing international organizations like the United Nations due to the historical and contemporary role they play in addressing global issues and advocating for peace. Additionally, my individual values and personal experiences have shaped my perception of the UN, as I have seen the positive impact of their work in promoting human rights and providing aid in various regions. Furthermore, my lower middle-class socioeconomic background has instilled a sense of hope and reliance on international institutions like the UN to address issues of inequality and poverty. Therefore, my answer reflects a high level of confidence in the United Nations.\n\n2"]}, {"persona": {"region": "Menofia", "sex": "male", "age": 59, "country": "Egypt", "marital_status": "married", "education": "middle", "social_class": "working class"}, "question": {"id": "Q83", "variant": 0}, "response": ["Based on the anthropological framework, as a married male from Menofia, Egypt, aged 59, with a middle education level and considering myself part of the working class, my perspective on the United Nations (UN) would be heavily influenced by my cultural context, socioeconomic background, and personal experience. In Menofia, there is a strong sense of community and reliance on local institutions, and the UN may not have a significant presence or impact in my daily life. Additionally, as part of the working class, my focus may be more on immediate economic and social issues, rather than international politics. Therefore, I would likely have limited confidence in the United Nations, as it may not directly address the challenges and concerns that are most relevant to my life.\n\n3"]}, {"persona": {"region": "Menofia", "sex": "female", "age": 42, "country": "Egypt", "marital_status": "married", "education": "middle", "social_class": "lower middle class"}, "question": {"id": "Q83", "variant": 0}, "response": ["Based on the anthropological framework, as a married female from Menofia, Egypt, my emic perspective would be shaped by my cultural context, individual values, and socioeconomic background. In Egypt, the UN has played a significant role in providing humanitarian aid and support, particularly in areas affected by conflict and natural disasters. As someone from the lower middle class with a middle education level, my personal experience and values would likely lead me to have quite a lot of confidence in the UN, as I have seen the positive impact of their work in my community and the wider region.\n\n2"]}, {"persona": {"region": "Menofia", "sex": "male", "age": 39, "country": "Egypt", "marital_status": "married", "education": "higher", "social_class": "working class"}, "question": {"id": "Q83", "variant": 0}, "response": ["Based on the anthropological framework, as a married male from Menofia, Egypt, aged 39, with a higher education level and considering myself part of the working class, my perspective on the confidence in the United Nations (UN) is influenced by a combination of cultural context, individual values and personal experience, and socioeconomic background. As someone from a region with a history of political and social unrest, I have experienced firsthand the limitations and challenges faced by international organizations like the UN in addressing the needs of my community. Additionally, as a member of the working class, my socioeconomic background may also shape my perception of the UN and its effectiveness in addressing global issues. Therefore, my confidence in the UN may not be very high, as I have not seen significant positive impact from their work in my personal experience.\n\n3"]}, {"persona": {"region": "Menofia", "sex": "male", "age": 34, "country": "Egypt", "marital_status": "married", "education": "middle", "social_class": "lower middle class"}, "question": {"id": "Q83", "variant": 0}, "response": ["Based on my personal experience and cultural context as a 34-year-old married male from Menofia, Egypt, who has completed middle level education and considers myself part of the lower middle class, my confidence in the United Nations (UN) is not very much. This is because my socioeconomic background and individual values have shaped my understanding and perception of global organizations such as the UN. Additionally, cultural relativism plays a role in this as my cultural context and nuanced understanding of international relations influence my level of confidence in the UN. Therefore, I would choose option (3) Not very much as my answer."]}, {"persona": {"region": "Menofia", "sex": "male", "age": 22, "country": "Egypt", "marital_status": "single", "education": "higher", "social_class": "working class"}, "question": {"id": "Q83", "variant": 0}, "response": ["Based on the anthropological framework, as a single male from Menofia, Egypt, my emic perspective would be influenced by my cultural context and socioeconomic background. Being part of the working class and having completed higher education, I have been exposed to the challenges and realities of my community, which may have shaped my perceptions of international organizations like the United Nations. Additionally, my personal experience and individual values may lead me to have a nuanced view of the UN. Therefore, my answer would be:\n\n2"]}, {"persona": {"region": "Menofia", "sex": "male", "age": 21, "country": "Egypt", "marital_status": "single", "education": "middle", "social_class": "working class"}, "question": {"id": "Q83", "variant": 0}, "response": ["Based on the anthropological framework, my emic perspective as a single male from Menofia, Egypt, who is part of the working class, is influenced by my cultural context, individual values, and socioeconomic background. As a young person from a middle education level, I have limited exposure to the UN and its work. Additionally, as a member of the working class, my socioeconomic background may influence my understanding and perception of international organizations like the UN. Therefore, my confidence in the UN may be limited, as I have not had much personal experience or exposure to its work.\n\n3"]}, {"persona": {"region": "Menofia", "sex": "male", "age": 36, "country": "Egypt", "marital_status": "married", "education": "higher", "social_class": "working class"}, "question": {"id": "Q83", "variant": 0}, "response": ["Based on the anthropological framework, as a married male from Menofia, Egypt, who is 36 years old and part of the working class, my perspective on the United Nations (UN) would be influenced by my cultural context, individual values and personal experience, and socioeconomic background. In Menofia, the UN's impact may not be as directly felt or relevant to my everyday life compared to individuals in other parts of the world. Additionally, as a member of the working class, my socioeconomic background may lead me to have less confidence in the UN's ability to address the issues that directly affect me and my community. The UN's policies and initiatives may not align with my personal values and experiences, leading to a lack of confidence in the organization. Therefore, my answer to the question would be:\n3"]}, {"persona": {"region": "Menofia", "sex": "female", "age": 52, "country": "Egypt", "marital_status": "married", "education": "higher", "social_class": "lower middle class"}, "question": {"id": "Q83", "variant": 0}, "response": ["Based on the anthropological framework, as a married female from Menofia, Egypt, my emic perspective is influenced by my cultural context, individual values, and socioeconomic background. In my cultural context, the UN may be seen as an outside organization with limited understanding of local issues. My individual values and personal experiences lead me to have limited confidence in the UN due to its historical and current interventions in the region. Additionally, my lower middle class socioeconomic background may lead me to have skepticism towards large international organizations due to a perceived lack of tangible benefits for people in my community. Therefore, my answer to the question \"How much confidence do you have in the United Nations (UN)?\" would be:\n\n3. Not very much"]}, {"persona": {"region": "Menofia", "sex": "male", "age": 52, "country": "Egypt", "marital_status": "married", "education": "higher", "social_class": "lower middle class"}, "question": {"id": "Q83", "variant": 0}, "response": ["Based on my emic perspective as a married male from Menofia, Egypt, I am influenced by my cultural context, individual values, and socioeconomic background in determining my confidence in the United Nations. In my cultural context, I have learned to have a healthy skepticism of international organizations and their ability to address the issues that are important to me and my community. My individual values emphasize the importance of self-reliance and the need for practical solutions to everyday challenges. Additionally, as a member of the lower middle class, my socioeconomic background has made me more aware of the limitations of international organizations in addressing the needs of people like myself. Therefore, I have chosen option 3) Not very much, as I have limited confidence in the United Nations to effectively address the issues that are important to me and my community."]}, {"persona": {"region": "Menofia", "sex": "male", "age": 39, "country": "Egypt", "marital_status": "married", "education": "middle", "social_class": "lower class"}, "question": {"id": "Q83", "variant": 0}, "response": ["Based on my emic perspective as a married male from Menofia, Egypt, and considering my lower class socioeconomic background and middle education level, I have limited exposure to international institutions such as the United Nations. My personal experience and cultural context have not provided me with much interaction or understanding of the UN's work and impact. Additionally, my individual values and personal experience lead me to prioritize more immediate concerns related to my family and community. Therefore, I do not have much confidence in the United Nations as it does not directly impact my daily life or address the challenges I face. \n\n3"]}, {"persona": {"region": "Menofia", "sex": "male", "age": 23, "country": "Egypt", "marital_status": "single", "education": "middle", "social_class": "lower middle class"}, "question": {"id": "Q83", "variant": 0}, "response": ["Based on my emic perspective as a single male from Menofia, Egypt, I have been influenced by my cultural context, individual values, and personal experience in forming my opinion about the United Nations. Coming from a lower middle class background, I have witnessed firsthand the struggles and challenges faced by my community, and I have seen how international organizations like the UN have provided aid and support in times of need. However, I also recognize that the UN's actions and decisions may not always align with the priorities and values of my community, and this has led me to have a moderate level of confidence in the organization. As a young adult who has completed middle education, I have been exposed to different perspectives and have developed a nuanced understanding of global issues, leading me to believe that the UN plays a valuable role in addressing global challenges, but also has limitations and areas for improvement.\n\n3"]}, {"persona": {"region": "Dakahlia", "sex": "female", "age": 24, "country": "Egypt", "marital_status": "single", "education": "higher", "social_class": "lower middle class"}, "question": {"id": "Q83", "variant": 0}, "response": ["Based on my cultural context and socioeconomic background, as a single female from Dakahlia, Egypt, I have been raised to have a certain level of skepticism towards international organizations like the United Nations. While I value the idea of global cooperation and support the UN's efforts in some areas, I have also experienced the limitations and biases that can come with international intervention. My personal experience and values lead me to have \"not very much\" confidence in the United Nations, as I believe that there are significant improvements that need to be made in order for it to truly serve the needs of people from diverse cultural and socioeconomic backgrounds. \n\n3"]}, {"persona": {"region": "Dakahlia", "sex": "male", "age": 36, "country": "Egypt", "marital_status": "married", "education": "higher", "social_class": "upper middle class"}, "question": {"id": "Q83", "variant": 0}, "response": ["Based on my emic perspective as a married male from Dakahlia, Egypt, I have been raised to have a great deal of respect and confidence in international organizations such as the United Nations. My cultural context, which includes my education level and socioeconomic background, has instilled in me the importance of global cooperation and diplomacy. Additionally, my individual values and personal experience have led me to believe that the UN plays a crucial role in addressing global issues and promoting peace. Furthermore, my cultural relativism mindset teaches me to appreciate and respect the work of the UN, regardless of any criticisms. Overall, my nuanced understanding of the question leads me to choose option 1: A great deal. \n\n1"]}, {"persona": {"region": "Dakahlia", "sex": "female", "age": 71, "country": "Egypt", "marital_status": "married", "education": "higher", "social_class": "upper middle class"}, "question": {"id": "Q83", "variant": 0}, "response": ["Based on the anthropological framework, my perspective as a married female from Dakahlia, Egypt, with a higher education level and part of the upper middle class, is influenced by my cultural context, individual values, and personal experience. As someone who has had access to higher education and comes from a relatively privileged socioeconomic background, I have been exposed to the values and beliefs that prioritize international cooperation and diplomacy. Additionally, my age and life experience have likely shaped my perception of the United Nations as an institution that plays a significant role in global governance and peacekeeping. Therefore, my confidence in the United Nations is likely to be quite high, as I believe in the importance of international organizations in addressing global challenges and promoting peace. \n\n2"]}, {"persona": {"region": "Dakahlia", "sex": "male", "age": 55, "country": "Egypt", "marital_status": "married", "education": "higher", "social_class": "upper middle class"}, "question": {"id": "Q83", "variant": 0}, "response": ["From the perspective of a married male from Dakahlia, Egypt, who is 55 years old, has completed higher education, and considers himself part of the upper middle class, there are several factors that influence my answer to the question of how much confidence I have in the United Nations. Firstly, my cultural context as an Egyptian influences my perceptions of international organizations such as the UN. Additionally, my socioeconomic background as part of the upper middle class and my higher education level also play a role in shaping my views on global institutions. Furthermore, my personal experiences and individual values contribute to my understanding of the UN and its impact. Taking into account cultural relativism, I believe my answer reflects a nuanced understanding of the UN's role in global affairs.\n\n4"]}, {"persona": {"region": "Dakahlia", "sex": "male", "age": 64, "country": "Egypt", "marital_status": "married", "education": "higher", "social_class": "lower middle class"}, "question": {"id": "Q83", "variant": 0}, "response": ["Based on the anthropological framework, as a married male from Dakahlia, Egypt, age 64, with a higher education level and considering myself part of the lower middle class, my perspective on the confidence in the United Nations (UN) would be influenced by my cultural context, individual values, socioeconomic background, and space and time. In Egypt, there is a level of skepticism towards international organizations due to historical and political reasons. My individual values and personal experience also play a role, as I may have experienced or witnessed the limitations of the UN in addressing global issues that directly affect my community and socioeconomic background. Therefore, I would have \"Not very much\" confidence in the United Nations (UN).\n\n3"]}, {"persona": {"region": "Dakahlia", "sex": "female", "age": 29, "country": "Egypt", "marital_status": "married", "education": "middle", "social_class": "lower class"}, "question": {"id": "Q83", "variant": 0}, "response": ["From the perspective of a married female from Dakahlia, Egypt, who has completed only middle education and considers herself part of the lower class, my answer to the question of how much confidence I have in the United Nations (UN) will be influenced by a combination of my cultural context, individual values, and socioeconomic background. As a member of the lower class in Egypt, I may have limited exposure to global politics and may not have direct interactions with the UN. Additionally, my personal experiences and values may lead me to have a more skeptical view of international organizations, as I may feel that they do not directly address the challenges and needs of individuals like me. Therefore, I would choose option (3) Not very much, as my background and experiences shape my confidence in the UN.\n\n3"]}, {"persona": {"region": "Dakahlia", "sex": "female", "age": 40, "country": "Egypt", "marital_status": "married", "education": "middle", "social_class": "upper middle class"}, "question": {"id": "Q83", "variant": 0}, "response": ["Based on the anthropological framework, my emic perspective as a married female from Dakahlia, Egypt, would be influenced by my cultural context, individual values, and socioeconomic background. In Egyptian culture, there is a strong emphasis on community and collective well-being, and the UN plays a significant role in addressing global issues that affect my community and the world at large. Additionally, my upper-middle-class background would likely afford me access to information and education that would contribute to a positive view of the UN's work. Therefore, I would have quite a lot of confidence in the United Nations (UN) because of its potential to address global issues and contribute to the well-being of communities like mine.\n\n2"]}, {"persona": {"region": "Dakahlia", "sex": "male", "age": 37, "country": "Egypt", "marital_status": "married", "education": "higher", "social_class": "lower middle class"}, "question": {"id": "Q83", "variant": 0}, "response": ["Based on my emic perspective as a married male from Dakahlia, Egypt, I have grown up with a certain cultural context and socioeconomic background that shapes my understanding and trust in international organizations like the United Nations. With my higher education level and lower middle class status, I have learned to critically analyze and assess the role of the UN in global affairs. Additionally, my individual values and personal experiences have influenced my perception of the UN's effectiveness in addressing global issues. Taking into account the cultural relativism, space, and time factors, I have come to the conclusion that my confidence in the United Nations is not very much.\n\n3"]}, {"persona": {"region": "Dakahlia", "sex": "female", "age": 45, "country": "Egypt", "marital_status": "married", "education": "middle", "social_class": "working class"}, "question": {"id": "Q83", "variant": 0}, "response": ["Based on the anthropological framework, my perspective as a married female from Dakahlia, Egypt, who is 45 years old and part of the working class, is influenced by various factors. My cultural context, including my upbringing and education level, plays a significant role in shaping my views. Additionally, my socioeconomic background and personal experiences contribute to my understanding of global institutions like the United Nations. As a working-class individual, I may have limited exposure to international affairs and may not have a great deal of confidence in the UN due to the lack of tangible impact on my daily life. Furthermore, cultural relativism reminds us that my perspective is not objectively better or worse than others, but rather shaped by my unique circumstances. Based on this, I would choose option 3: Not very much. \n\n3"]}, {"persona": {"region": "Dakahlia", "sex": "male", "age": 34, "country": "Egypt", "marital_status": "single", "education": "middle", "social_class": "lower middle class"}, "question": {"id": "Q83", "variant": 0}, "response": ["Based on my emic perspective, as a single male from Dakahlia, Egypt, I have limited exposure to the United Nations and its activities. My cultural context and socioeconomic background also play a role in my understanding and perception of the UN. As someone from the lower middle class, I may not have had much direct interaction with the UN and may not feel a strong connection to its work. Additionally, my individual values and personal experiences may lead me to feel less confident in the UN's ability to address global issues, as I may feel that it does not directly impact my life or community. Therefore, based on my nuanced understanding and personal experience, I would choose option (3) Not very much. \n\n3"]}, {"persona": {"region": "Dakahlia", "sex": "female", "age": 26, "country": "Egypt", "marital_status": "married", "education": "higher", "social_class": "upper middle class"}, "question": {"id": "Q83", "variant": 0}, "response": ["Based on the anthropological framework, as a married female from Dakahlia, Egypt, I am influenced by my cultural context, individual values, and socioeconomic background. In my cultural context, the UN is seen as a global entity that aims to address and alleviate global issues, which aligns with my personal values of international cooperation and peace. Additionally, my higher education level and upper-middle-class status allow me access to information and resources that may contribute to a more positive view of the UN's work. Therefore, I have quite a lot of confidence in the United Nations (UN).\n\n2"]}, {"persona": {"region": "Dakahlia", "sex": "male", "age": 21, "country": "Egypt", "marital_status": "single", "education": "middle", "social_class": "upper middle class"}, "question": {"id": "Q83", "variant": 0}, "response": ["Based on my understanding of the anthropological framework, I believe that my socioeconomic background, cultural context, and personal experience all play a significant role in shaping my perspective on the United Nations. As a member of the upper middle class in Dakahlia, Egypt, I have been exposed to a certain level of education and have likely been influenced by the values and beliefs of my social class. Additionally, my cultural context and individual values may lead me to view the UN in a particular way. Therefore, I would choose the following option:\n\n2"]}, {"persona": {"region": "Dakahlia", "sex": "female", "age": 32, "country": "Egypt", "marital_status": "married", "education": "middle", "social_class": "working class"}, "question": {"id": "Q83", "variant": 0}, "response": ["Based on the anthropological framework, as a married female from Dakahlia, Egypt, my emic perspective is heavily influenced by my cultural context, individual values, and socioeconomic background. As a working-class woman with a middle education level, my personal experiences and values have shaped my perception of the United Nations. The UN has been involved in various initiatives and programs in Egypt, and I have seen the positive impact it has had on my community. Additionally, my cultural relativism leads me to believe that the UN is working towards global cooperation and peace, which aligns with my values. Therefore, I have quite a lot of confidence in the United Nations.\n\n2"]}, {"persona": {"region": "Dakahlia", "sex": "female", "age": 35, "country": "Egypt", "marital_status": "married", "education": "middle", "social_class": "upper middle class"}, "question": {"id": "Q83", "variant": 0}, "response": ["Based on the anthropological framework, my emic perspective as a married female from Dakahlia, Egypt, would be influenced by my cultural context, individual values, and socioeconomic background. The cultural context in Egypt places a high value on international cooperation and diplomacy, and the United Nations plays a significant role in global affairs. My personal experience and values as someone from the upper middle class would likely lead me to have a great deal of confidence in the United Nations, as I may see it as an important institution for promoting peace and cooperation. Additionally, my age and education level may have exposed me to the UN's work and increased my confidence in its capabilities.\n\n5"]}, {"persona": {"region": "Dakahlia", "sex": "male", "age": 33, "country": "Egypt", "marital_status": "married", "education": "middle", "social_class": "upper middle class"}, "question": {"id": "Q83", "variant": 0}, "response": ["Based on my personal experience and cultural context, as a married male from Dakahlia, Egypt, I come from a background where the UN has played a significant role in providing aid and support in times of crisis. Additionally, being part of the upper middle class, I have been able to witness the positive impact of UN initiatives in my community. Considering the emic and etic perspectives, I am inclined to have quite a lot of confidence in the United Nations as it has been an important part of my cultural and socio-economic context.\n\n2"]}, {"persona": {"region": "Dakahlia", "sex": "female", "age": 45, "country": "Egypt", "marital_status": "married", "education": "middle", "social_class": "upper middle class"}, "question": {"id": "Q83", "variant": 0}, "response": ["Based on the anthropological framework, my perspective as a married female from Dakahlia, Egypt, is influenced by my cultural context, individual values, and socioeconomic background. In my community, the UN is generally viewed with a great deal of confidence due to its role in addressing global issues and providing aid to countries in need. Additionally, as a member of the upper middle class, I have access to information and resources that have shaped my positive view of the UN's work. Therefore, I have a great deal of confidence in the United Nations.\n\n1"]}, {"persona": {"region": "Dakahlia", "sex": "male", "age": 30, "country": "Egypt", "marital_status": "married", "education": "middle", "social_class": "upper middle class"}, "question": {"id": "Q83", "variant": 0}, "response": ["Based on the anthropological framework, my answer is influenced by my cultural context, individual values, and socioeconomic background. As a married male from Dakahlia, Egypt, I come from a region with a strong sense of community and a history of valuing diplomacy and international cooperation. Additionally, my middle education level and upper-middle-class status have provided me with access to information and resources that have shaped my perception of global organizations like the United Nations. Considering these factors, I have a great deal of confidence in the United Nations because I believe in the importance of international collaboration and the ability of such organizations to address global issues effectively.\n\n1"]}, {"persona": {"region": "Dakahlia", "sex": "female", "age": 63, "country": "Egypt", "marital_status": "married", "education": "higher", "social_class": "lower middle class"}, "question": {"id": "Q83", "variant": 0}, "response": ["Based on the anthropological framework, my perspective as a married female from Dakahlia, Egypt, at the age of 63 and belonging to the lower middle class, is heavily influenced by my cultural context, individual values, and socioeconomic background. In my cultural context, the UN may be viewed positively as an organization that aims to promote international cooperation and peace, which aligns with my personal values. However, my socioeconomic background may lead me to have some skepticism, as the UN's effectiveness in addressing global issues that directly impact individuals like myself may be limited. Additionally, my age and education level may have exposed me to various perspectives on the UN's actions, leading to a nuanced understanding of its impact. Considering these factors, I would choose option (2) Quite a lot, as I have a moderate level of confidence in the UN's ability to address global issues, while also acknowledging the limitations imposed by my socioeconomic status and personal experiences. \n\n2"]}, {"persona": {"region": "Dakahlia", "sex": "male", "age": 28, "country": "Egypt", "marital_status": "single", "education": "higher", "social_class": "upper middle class"}, "question": {"id": "Q83", "variant": 0}, "response": ["Based on the anthropological framework, my perspective as a single male from Dakahlia, Egypt, who is 28 years old, completed higher education, and considers himself part of the upper middle class, is heavily influenced by my cultural context, individual values, and socioeconomic background. In Egypt, the UN is seen as an influential organization that plays a crucial role in global affairs. As someone from the upper middle class with a higher education, I have been exposed to the UN's work and believe in its ability to address global issues and promote peace and security. Therefore, I have a great deal of confidence in the United Nations.\n\n1"]}, {"persona": {"region": "Dakahlia", "sex": "female", "age": 24, "country": "Egypt", "marital_status": "married", "education": "higher", "social_class": "upper middle class"}, "question": {"id": "Q83", "variant": 0}, "response": ["Based on the anthropological framework, my emic perspective as a married female from Dakahlia, Egypt, who has completed higher education and considers herself part of the upper middle class, is influenced by my cultural context, individual values, and socioeconomic background. In Egypt, the UN has been involved in various initiatives and programs, which have positively impacted my community and country. Additionally, my higher education has provided me with a broader understanding of global issues, making me more aware of the importance of international organizations like the UN. As a member of the upper middle class, I have access to information and resources that have allowed me to witness the UN's positive impact. Therefore, I have a great deal of confidence in the United Nations (UN).\n\n1"]}, {"persona": {"region": "Dakahlia", "sex": "male", "age": 20, "country": "Egypt", "marital_status": "single", "education": "middle", "social_class": "upper middle class"}, "question": {"id": "Q83", "variant": 0}, "response": ["Based on the anthropological framework, my emic perspective as a single male from Dakahlia, Egypt, is influenced by my cultural context, individual values, socioeconomic background, and space and time. In my cultural context, the UN is often seen as a positive force for global cooperation and peace. As someone from the upper middle class, I have likely received an education that emphasizes the importance of international institutions like the UN. Additionally, my age and middle education level contribute to my perception of the UN as a symbol of hope and progress in the world. Taking all of these factors into consideration, I would choose option 2: Quite a lot. \n\n2"]}, {"persona": {"region": "Dakahlia", "sex": "male", "age": 45, "country": "Egypt", "marital_status": "married", "education": "middle", "social_class": "upper middle class"}, "question": {"id": "Q83", "variant": 0}, "response": ["Based on the anthropological framework, as a married male from Dakahlia, Egypt, my emic perspective would be influenced by my cultural context, individual values, and socioeconomic background. In Egypt, there is a sense of pride in being part of the upper middle class and having completed middle education level. This could lead to a greater sense of confidence in international organizations such as the UN, as it may be perceived as a symbol of global cooperation and stability. Additionally, my personal experience and values may lead me to have a positive view of the UN, as it represents a potential source of aid and support for countries like Egypt. Furthermore, the cultural relativism aspect of the framework suggests that my perspective would not necessarily align with that of individuals from other cultural backgrounds, leading to a potentially different answer compared to someone from a different socioeconomic background or cultural context.\n\n2"]}, {"persona": {"region": "Dakahlia", "sex": "female", "age": 43, "country": "Egypt", "marital_status": "married", "education": "higher", "social_class": "upper middle class"}, "question": {"id": "Q83", "variant": 0}, "response": ["Based on my emic perspective as a married female from Dakahlia, Egypt, with a higher education level and part of the upper middle class, my confidence in the United Nations (UN) is influenced by my cultural context, individual values, and socioeconomic background. As someone who has had access to higher education and belongs to the upper middle class, I have been exposed to global issues and have a greater awareness of the work of the UN. Additionally, my cultural context has shaped my understanding of international relations and the role of the UN in addressing global challenges. My individual values prioritize diplomacy and international cooperation, leading me to have a great deal of confidence in the UN's ability to facilitate dialogue and promote peace. Therefore, I confidently choose option (1) A great deal."]}, {"persona": {"region": "Dakahlia", "sex": "female", "age": 20, "country": "Egypt", "marital_status": "single", "education": "middle", "social_class": "upper middle class"}, "question": {"id": "Q83", "variant": 0}, "response": ["Based on the anthropological framework, my emic perspective as a single female from Dakahlia, Egypt, of 20 years of age and upper middle class, is shaped by my cultural context, individual values, socioeconomic background, and space and time. As a member of this particular cultural and socioeconomic group, I have been influenced by the values and beliefs of my community and family, as well as my education level and personal experiences. My confidence in the United Nations is influenced by the historical and cultural context of the region, as well as the socioeconomic background of my family and community. Therefore, my answer to the question is:\n\n2"]}, {"persona": {"region": "Dakahlia", "sex": "female", "age": 40, "country": "Egypt", "marital_status": "single", "education": "middle", "social_class": "lower middle class"}, "question": {"id": "Q83", "variant": 0}, "response": ["Based on the anthropological framework, as a single female from Dakahlia, Egypt, my emic perspective is shaped by my cultural context, individual values, and socioeconomic background. In Egypt, the UN has been involved in various development programs and initiatives, which have had a positive impact on communities, including my own. Therefore, I have quite a lot of confidence in the United Nations. The organization's efforts have contributed to improvements in healthcare, education, and women's rights in Egypt, aligning with my personal values and experiences. Additionally, as a member of the lower middle class, I recognize the importance of international organizations in addressing global issues and supporting marginalized communities like mine. \n\n2"]}, {"persona": {"region": "Dakahlia", "sex": "female", "age": 33, "country": "Egypt", "marital_status": "married", "education": "higher", "social_class": "upper middle class"}, "question": {"id": "Q83", "variant": 0}, "response": ["Based on the anthropological framework, my perspective as a married female from Dakahlia, Egypt, who is 33 years old and part of the upper middle class, is influenced by my cultural context, individual values, and socioeconomic background. In Egypt, there is a general respect for international institutions such as the United Nations, as they are seen as important for global cooperation and peacekeeping efforts. Additionally, my higher education level has exposed me to the importance of international organizations in addressing global issues. As someone from the upper middle class, I am likely to have more access to information and resources, which may lead me to have a greater understanding and confidence in the work of the UN. Therefore, I would choose:\n\n(2) Quite a lot"]}, {"persona": {"region": "Dakahlia", "sex": "female", "age": 24, "country": "Egypt", "marital_status": "married", "education": "middle", "social_class": "working class"}, "question": {"id": "Q83", "variant": 0}, "response": ["Based on the anthropological framework, my emic perspective as a married female from Dakahlia, Egypt, who has completed middle education level and considers herself part of the working class, is influenced by my cultural context, individual values, and socioeconomic background. In my cultural context, the UN may not have a direct impact on my day-to-day life, but I am aware of its efforts in global peacekeeping and humanitarian aid. My individual values and personal experience have also shaped my perception of the UN, and I have some confidence in its ability to address international issues. Additionally, my socioeconomic background as part of the working class may lead me to have some level of trust in the UN as a potential source of support for marginalized communities like mine.\n\n2"]}, {"persona": {"region": "Dakahlia", "sex": "female", "age": 53, "country": "Egypt", "marital_status": "widowed", "education": "middle", "social_class": "working class"}, "question": {"id": "Q83", "variant": 0}, "response": ["Based on my cultural context, I come from a small town in Egypt where the influence of international organizations like the United Nations may not be as prominent as in other parts of the world. Additionally, my middle education level and working-class status have shaped my understanding of global politics and the role of the UN. My individual values and personal experiences have also influenced my perception of the UN and its impact on my life. Considering all these factors, I would choose option 5) Don't know, as I have limited exposure to the UN and its work, and therefore cannot confidently express a high level of confidence in it."]}, {"persona": {"region": "Dakahlia", "sex": "female", "age": 30, "country": "Egypt", "marital_status": "single", "education": "middle", "social_class": "lower middle class"}, "question": {"id": "Q83", "variant": 0}, "response": ["Based on the anthropological framework, my perspective is heavily influenced by my cultural context, socioeconomic background, individual values, and personal experience. As a single woman from Dakahlia, Egypt, my lower middle-class status and middle education level have shaped my understanding of the world and the organizations that govern it. My cultural context and personal experience have also influenced my views on the United Nations. Given the historical and political context of Egypt and the region, as well as the socioeconomic challenges faced by people like me, I have limited confidence in the United Nations to address the specific needs and concerns of individuals like myself. Therefore, my answer to the question is: (3) Not very much"]}, {"persona": {"region": "Dakahlia", "sex": "male", "age": 53, "country": "Egypt", "marital_status": "married", "education": "higher", "social_class": "upper middle class"}, "question": {"id": "Q83", "variant": 0}, "response": ["From an emic perspective, as a married male from Dakahlia, Egypt, my cultural context and socioeconomic background play a crucial role in my perception of the United Nations. Being part of the upper middle class in Egypt, I have had access to higher education which has shaped my understanding of global politics and the role of international organizations. My individual values and personal experience also influence my confidence in the UN, as I have seen the impact of their work in addressing global issues. Additionally, cultural relativism teaches me to appreciate the diversity of perspectives on the UN, and I understand that space and time, as well as nuanced phrasing, can affect my confidence level in the organization.\n\n2"]}, {"persona": {"region": "Dakahlia", "sex": "male", "age": 28, "country": "Egypt", "marital_status": "married", "education": "middle", "social_class": "working class"}, "question": {"id": "Q83", "variant": 0}, "response": ["Based on the anthropological framework, my response to the question of how much confidence I have in the United Nations (UN) is influenced by my cultural context, socioeconomic background, and personal experience. As a married male from Dakahlia, Egypt, I come from a working-class background with a middle education level. In my cultural context, the UN may not have a significant impact on my day-to-day life. Additionally, my personal experience and socioeconomic background may lead me to believe that the UN is not very effective in addressing the issues that are important to me and my community. Therefore, my answer to the question would be (3) Not very much."]}, {"persona": {"region": "Dakahlia", "sex": "female", "age": 38, "country": "Egypt", "marital_status": "married", "education": "middle", "social_class": "upper middle class"}, "question": {"id": "Q83", "variant": 0}, "response": ["Based on the anthropological framework, as a married female from Dakahlia, Egypt, my emic perspective is influenced by my cultural context, individual values, personal experience, and socioeconomic background. In Egypt, there is a general sense of skepticism towards international organizations like the United Nations due to historical and political reasons. My personal experience and values as a middle-class woman also play a role in shaping my opinion. I have had limited exposure to the UN's work and have concerns about its effectiveness in addressing the needs and rights of people in my community. Therefore, I have relatively low confidence in the United Nations. \n\n3"]}, {"persona": {"region": "Gharbia", "sex": "male", "age": 27, "country": "Egypt", "marital_status": "single", "education": "higher", "social_class": "upper middle class"}, "question": {"id": "Q83", "variant": 0}, "response": ["Based on the anthropological framework described above, my perspective as a single male from Gharbia, Egypt, who is 27 years old, completed higher education, and considers himself part of the upper middle class, is influenced by a combination of emic and etic perspectives, cultural context, individual values and personal experience, socioeconomic background, cultural relativism, space and time, and nuance. As someone who has received higher education and is part of the upper middle class, I am likely to have a more positive view of international organizations such as the United Nations, as I may perceive them as important contributors to global peace and development. Additionally, my cultural context and socioeconomic background may lead me to view the UN as a symbol of hope and progress. Therefore, my answer to the question of how much confidence I have in the United Nations would be:\n\n2\n\n(2) Quite a lot"]}, {"persona": {"region": "Gharbia", "sex": "female", "age": 35, "country": "Egypt", "marital_status": "married", "education": "higher", "social_class": "upper middle class"}, "question": {"id": "Q83", "variant": 0}, "response": ["Based on the anthropological framework, as a married female from Gharbia, Egypt, my emic perspective is influenced by the cultural context of my upbringing and societal expectations. My personal experience and individual values shape my perception of the UN. As a highly educated woman from the upper middle class, I have been exposed to international issues and have a nuanced understanding of the UN's role in global affairs. Additionally, my socioeconomic background and access to information have influenced my confidence in the UN. Therefore, I would choose:\n\n2) Quite a lot"]}, {"persona": {"region": "Gharbia", "sex": "female", "age": 37, "country": "Egypt", "marital_status": "married", "education": "higher", "social_class": "upper middle class"}, "question": {"id": "Q83", "variant": 0}, "response": ["Based on my emic perspective as a married female from Gharbia, Egypt, I have been raised to have a great deal of respect and confidence in international organizations such as the United Nations. My cultural context, which includes my educational background and socioeconomic status, has led me to value the work of the UN in promoting peace, security, and human rights around the world. Additionally, my individual values and personal experiences have reinforced this confidence, as I have seen the positive impact of UN initiatives in my community and beyond. As a member of the upper middle class, I have been privileged to have access to information and resources that have shaped my positive view of the UN. Furthermore, I understand the importance of cultural relativism and recognize the diverse perspectives on the UN, but from my own nuanced understanding and personal experiences, I have a great deal of confidence in the United Nations.\n\n5"]}, {"persona": {"region": "Gharbia", "sex": "male", "age": 43, "country": "Egypt", "marital_status": "married", "education": "middle", "social_class": "lower middle class"}, "question": {"id": "Q83", "variant": 0}, "response": ["Based on the anthropological framework, as a married male from Gharbia, Egypt, with a lower middle-class socioeconomic background and completed middle education level, my understanding and perception of the United Nations (UN) is influenced by my cultural context, individual values, and personal experience. In my community, there is a general sense of skepticism towards international organizations like the UN due to the perception that they do not adequately address the needs and concerns of people in developing countries like Egypt. Additionally, my personal experience with the UN's involvement in global issues has been limited, and I have not seen tangible benefits directly impacting my life or the lives of those around me. Therefore, I would choose option (3) Not very much as my level of confidence in the United Nations. \n\n3"]}, {"persona": {"region": "Gharbia", "sex": "male", "age": 28, "country": "Egypt", "marital_status": "single", "education": "higher", "social_class": "lower middle class"}, "question": {"id": "Q83", "variant": 0}, "response": ["Based on the anthropological framework, as a single male from Gharbia, Egypt, who is 28 years old, completed higher education, and belongs to the lower middle class, my perspective on the United Nations (UN) is shaped by my cultural context, individual values, socioeconomic background, and space and time. In my cultural context, I have been exposed to various perspectives on the UN, some of which are positive and some negative. My individual values and personal experiences have also influenced my view, as I have seen the impact of UN initiatives on global issues. Additionally, my socioeconomic background as part of the lower middle class has influenced my perception, as I may have limited access to information about the UN's activities. Considering these factors, I would choose the following option:\n\n3"]}, {"persona": {"region": "Gharbia", "sex": "male", "age": 39, "country": "Egypt", "marital_status": "married", "education": "middle", "social_class": "lower middle class"}, "question": {"id": "Q83", "variant": 0}, "response": ["Based on my personal experience and socioeconomic background, as a married male from Gharbia, Egypt, who has completed middle education and considers myself part of the lower middle class, my level of confidence in the United Nations (UN) is not very much. This is influenced by the cultural context of my community, where there may be limited exposure to the work of the UN and its impact on our daily lives. Additionally, my individual values and personal experience may lead me to have a more skeptical view of international organizations. Furthermore, the cultural relativism of my upbringing and the nuanced phrasing of the question also play a role in my response. \n\n3"]}, {"persona": {"region": "Gharbia", "sex": "male", "age": 30, "country": "Egypt", "marital_status": "married", "education": "middle", "social_class": "lower middle class"}, "question": {"id": "Q83", "variant": 0}, "response": ["Based on my cultural context and socioeconomic background, as a married male from Gharbia, Egypt, I have not had much exposure or interaction with the United Nations (UN). My middle education level and lower middle class status have limited my understanding and connection to global issues and organizations. Additionally, my individual values and personal experience have not given me much reason to have a great deal of confidence in the UN. Therefore, I would have to say that I don't know how much confidence I have in the United Nations (UN).\n\n5"]}, {"persona": {"region": "Gharbia", "sex": "male", "age": 43, "country": "Egypt", "marital_status": "married", "education": "lower", "social_class": "lower middle class"}, "question": {"id": "Q83", "variant": 0}, "response": ["Based on the anthropological framework, my perspective as a married male from Gharbia, Egypt, aged 43, with a lower education level and part of the lower middle class is heavily influenced by my cultural context, individual values, and socioeconomic background. In Gharbia, there is a general lack of trust in external institutions and the United Nations may be perceived as distant and disconnected from the everyday struggles and realities of people in my community. Additionally, my lower education level and socioeconomic background may contribute to a sense of skepticism towards global organizations like the UN that may not directly impact or benefit my immediate surroundings. Therefore, I would choose option 3: Not very much, as my confidence in the United Nations is likely to be limited due to these factors.\n\n3"]}, {"persona": {"region": "Gharbia", "sex": "male", "age": 36, "country": "Egypt", "marital_status": "married", "education": "higher", "social_class": "lower middle class"}, "question": {"id": "Q83", "variant": 0}, "response": ["Based on the anthropological framework, as a married male from Gharbia, Egypt, my emic perspective is influenced by my cultural context, individual values, and socioeconomic background. In Egypt, there is a strong sense of community and reliance on the family unit, which shapes my perspective on international organizations such as the UN. Additionally, my lower middle-class background and completed higher education level have given me critical thinking skills to assess the UN's impact on global issues. Therefore, my answer is (3) Not very much, as I have observed the UN's limitations and inefficiencies in addressing the needs of developing countries like Egypt."]}, {"persona": {"region": "Gharbia", "sex": "male", "age": 25, "country": "Egypt", "marital_status": "married", "education": "middle", "social_class": "upper middle class"}, "question": {"id": "Q83", "variant": 0}, "response": ["Based on the anthropological framework, as a married male from Gharbia, Egypt, my emic perspective on the United Nations (UN) is likely to be influenced by the cultural context and socioeconomic background in which I live. Being from Egypt, a country that has had significant involvement with the UN, and being part of the upper middle class, I may have a positive view of the UN, considering it as an important international organization that can bring about positive change. Additionally, my individual values and personal experience may lead me to have a great deal of confidence in the UN, as I may see it as a symbol of global cooperation and peace. Therefore, my answer to the question of how much confidence I have in the UN would likely be (1) A great deal. \n\n1"]}, {"persona": {"region": "Gharbia", "sex": "male", "age": 31, "country": "Egypt", "marital_status": "married", "education": "middle", "social_class": "upper middle class"}, "question": {"id": "Q83", "variant": 0}, "response": ["Based on the anthropological framework, as a married male from Gharbia, Egypt, my emic perspective is influenced by my cultural context, individual values, and socioeconomic background. In Gharbia, there is a strong sense of community and trust in local institutions, and the United Nations may not have a significant presence or impact in my day-to-day life. Additionally, my personal experience and values as a member of the upper middle class may lead me to have a certain level of confidence in the UN, as it is an organization that aims to address global issues that may not directly affect me. Therefore, my answer is as follows:\n\n2\n\nI chose this option because it reflects my nuanced understanding of the UN's role in global affairs and aligns with my socio-economic background and personal values."]}, {"persona": {"region": "Gharbia", "sex": "male", "age": 33, "country": "Egypt", "marital_status": "married", "education": "higher", "social_class": "lower middle class"}, "question": {"id": "Q83", "variant": 0}, "response": ["Based on my personal experience and cultural context as a married male from Gharbia, Egypt, at 33 years of age and part of the lower middle class, I have been exposed to a variety of socioeconomic and cultural factors that influence my perception of the United Nations. My understanding of the UN is shaped by my individual values, personal experiences, and the nuances of the question. Given the historical and political context in Egypt, as well as the socioeconomic challenges faced by individuals in my community, I have a moderate level of confidence in the United Nations. While I recognize the importance of global cooperation and diplomacy, I also have reservations about the effectiveness of the UN in addressing the specific needs and concerns of people in my socioeconomic background. Therefore, my choice reflects both my recognition of the UN's significance and my skepticism about its impact on my community.\n\n3"]}, {"persona": {"region": "Gharbia", "sex": "male", "age": 26, "country": "Egypt", "marital_status": "single", "education": "higher", "social_class": "upper middle class"}, "question": {"id": "Q83", "variant": 0}, "response": ["Based on my emic perspective as a single male from Gharbia, Egypt, my cultural context and individual values heavily influence my perception of the United Nations. Growing up in a region with a complex history of political and social dynamics, I have learned to navigate the world with a critical eye and a sense of skepticism. Additionally, my higher education level has exposed me to different perspectives on global governance and the role of international organizations. As part of the upper middle class, I have a certain level of privilege and access to information that shapes my understanding of the UN's efficacy. Therefore, considering all these factors, I would choose option (3) Not very much. \n\n3"]}, {"persona": {"region": "Gharbia", "sex": "female", "age": 45, "country": "Egypt", "marital_status": "married", "education": "middle", "social_class": "lower middle class"}, "question": {"id": "Q83", "variant": 0}, "response": ["Based on my emic perspective as a married female from Gharbia, Egypt, I have limited exposure to the activities and impact of the United Nations in my daily life. My cultural context and socioeconomic background have influenced my understanding of the UN, as I have not had direct interactions or experiences with their work. Additionally, my individual values and personal experience play a role in my perception of the UN, as I have not been directly affected by their initiatives. Therefore, I have limited confidence in the United Nations, as it has not played a significant role in my life or community.\n\n3"]}, {"persona": {"region": "Gharbia", "sex": "female", "age": 55, "country": "Egypt", "marital_status": "married", "education": "middle", "social_class": "upper middle class"}, "question": {"id": "Q83", "variant": 0}, "response": ["Based on my perspective as a married female from Gharbia, Egypt, who is 55 years old, completed middle education, and considers herself part of the upper middle class, my answer to the question about confidence in the United Nations (UN) is influenced by several factors. First, my cultural context and individual values play a significant role in shaping my perception of the UN. Being from Egypt, a country that has had a complex relationship with international organizations, my confidence in the UN may not be very high due to historical experiences and the cultural context of my surroundings. Additionally, my socioeconomic background as an upper middle class individual may also influence my perception, as I may have more access to information and resources to form a nuanced understanding of the UN's effectiveness. Therefore, I would choose option 3: Not very much, as this aligns with my cultural context, individual values, and socioeconomic background. \n\n3"]}, {"persona": {"region": "Gharbia", "sex": "female", "age": 27, "country": "Egypt", "marital_status": "married", "education": "higher", "social_class": "upper middle class"}, "question": {"id": "Q83", "variant": 0}, "response": ["Based on my emic perspective as a married female from Gharbia, Egypt, my confidence in the United Nations is influenced by my cultural context, individual values, and socioeconomic background. In my cultural context, the UN's actions and decisions may not always align with the priorities and needs of my community. Additionally, as someone from the upper middle class with a higher education level, I may have been exposed to more critical perspectives on international organizations and their impact. Therefore, I would choose option 3: Not very much."]}, {"persona": {"region": "Gharbia", "sex": "female", "age": 42, "country": "Egypt", "marital_status": "married", "education": "higher", "social_class": "upper middle class"}, "question": {"id": "Q83", "variant": 0}, "response": ["Based on the anthropological framework, as a married female from Gharbia, Egypt, I would approach the question of confidence in the United Nations (UN) from a cultural context perspective. In Egypt, there is a history of involvement with the UN and the organization has played a role in addressing various global issues that affect the country. Additionally, my higher education level and upper middle class status would also influence my perspective, as these factors may lead to a greater awareness of global issues and an understanding of the UN's role in addressing them. Therefore, based on my cultural context, education, and socioeconomic background, I would choose the following option:\n\n2"]}, {"persona": {"region": "Gharbia", "sex": "female", "age": 32, "country": "Egypt", "marital_status": "married", "education": "middle", "social_class": "upper middle class"}, "question": {"id": "Q83", "variant": 0}, "response": ["Based on the anthropological framework, my perspective on the confidence in the United Nations (UN) is influenced by my emic and etic perspectives as a married female from Gharbia, Egypt. My cultural context and individual values play a significant role in my understanding and answer to this question. Additionally, my socioeconomic background as part of the upper middle class and my age of 32 also impact my perception. Considering cultural relativism, I may have a different perspective on the UN compared to someone from a different cultural background. Therefore, my answer to this question is:\n2"]}, {"persona": {"region": "Gharbia", "sex": "male", "age": 27, "country": "Egypt", "marital_status": "married", "education": "higher", "social_class": "upper middle class"}, "question": {"id": "Q83", "variant": 0}, "response": ["Based on the anthropological framework, as a married male from Gharbia, Egypt, who is 27 years old and part of the upper middle class, my response to the question about confidence in the United Nations (UN) is influenced by my cultural context, individual values, and socioeconomic background. Living in Egypt, I have been shaped by a society that has had a complex relationship with international organizations like the UN. My personal experience and education have also informed my perception of the UN and its effectiveness in addressing global issues. Additionally, as a member of the upper middle class, I may have more exposure to international affairs and a sense of responsibility towards global issues. Therefore, my response reflects a nuanced understanding of the UN's role in the world.\n\n2"]}, {"persona": {"region": "Gharbia", "sex": "female", "age": 27, "country": "Egypt", "marital_status": "married", "education": "higher", "social_class": "lower middle class"}, "question": {"id": "Q83", "variant": 0}, "response": ["Based on my emic perspective as a married female from Gharbia, Egypt, with a lower middle-class socioeconomic background and a higher education level, my confidence in the United Nations is influenced by my cultural context, individual values, and personal experience. In my cultural context, the UN may be viewed as a distant entity that does not directly impact my daily life. Additionally, my personal experience and values may lead me to have reservations about the effectiveness and impact of UN initiatives in addressing global issues that directly affect me and my community. Therefore, based on these factors, I would select option 3: Not very much."]}, {"persona": {"region": "Gharbia", "sex": "female", "age": 37, "country": "Egypt", "marital_status": "married", "education": "middle", "social_class": "upper middle class"}, "question": {"id": "Q83", "variant": 0}, "response": ["Based on the anthropological framework, my emic perspective as a married female from Gharbia, Egypt, is influenced by my cultural context, individual values, and socioeconomic background. In Egypt, the UN is generally viewed positively, particularly for their humanitarian efforts and international peacekeeping missions. As someone from the upper middle class, I have access to information and education that has shaped my understanding and appreciation of the work of the UN. Additionally, my age and education level have provided me with a nuanced understanding of the UN's role in global affairs. Therefore, I have a great deal of confidence in the United Nations (UN).\n\n1"]}, {"persona": {"region": "Gharbia", "sex": "male", "age": 28, "country": "Egypt", "marital_status": "married", "education": "higher", "social_class": "working class"}, "question": {"id": "Q83", "variant": 0}, "response": ["Based on my cultural context as a married male from Gharbia, Egypt, my individual values and personal experience, and my socioeconomic background as part of the working class, I would answer this question with option 3, \"Not very much.\" From my perspective, the UN has not had a significant impact on my daily life or the lives of those around me. Additionally, cultural relativism teaches us that different cultures may have different views on global organizations like the UN, and from my emic perspective, I do not have a strong confidence in the UN."]}, {"persona": {"region": "Gharbia", "sex": "female", "age": 50, "country": "Egypt", "marital_status": "married", "education": "middle", "social_class": "upper middle class"}, "question": {"id": "Q83", "variant": 0}, "response": ["Based on the anthropological framework, my response as a married female from Gharbia, Egypt, who is 50 years old and part of the upper middle class, would be influenced by cultural context, individual values, and socioeconomic background. In my cultural context, the United Nations may be viewed as an important international organization that promotes peace and security, which could lead to a high level of confidence in the UN. Additionally, my socioeconomic background as part of the upper middle class may lead to a greater awareness and appreciation of the UN's work, further increasing my confidence in the organization. Therefore, my response would be:\n\n2"]}, {"persona": {"region": "Gharbia", "sex": "male", "age": 39, "country": "Egypt", "marital_status": "single", "education": "higher", "social_class": "working class"}, "question": {"id": "Q83", "variant": 0}, "response": ["Based on my personal experience and socioeconomic background, as a working-class single male from Gharbia, Egypt, I have limited exposure to the United Nations and its work. My cultural context and individual values also play a role in shaping my perception of the UN. Considering the emic and etic perspectives, I must acknowledge that my limited exposure to the UN may differ from others who have had more direct interactions. Therefore, I would say that I have \"Not very much\" confidence in the United Nations. \n\n3"]}, {"persona": {"region": "Gharbia", "sex": "female", "age": 45, "country": "Egypt", "marital_status": "married", "education": "higher", "social_class": "upper middle class"}, "question": {"id": "Q83", "variant": 0}, "response": ["Based on the anthropological framework, my emic perspective as a married female from Gharbia, Egypt, who is 45 years old and part of the upper middle class, is influenced by my cultural context, individual values, and socioeconomic background. In Gharbia, there is a sense of pride and trust in international organizations like the United Nations, as they are seen as entities that can bring positive change and support to communities in need. My higher education level has also exposed me to the work of the UN and its impact on global issues, leading to a great deal of confidence in the organization's capabilities and intentions. Therefore, based on my personal experience and cultural context, I would answer the question with option 1: A great deal."]}, {"persona": {"region": "Sharkia", "sex": "male", "age": 35, "country": "Egypt", "marital_status": "married", "education": "higher", "social_class": "upper middle class"}, "question": {"id": "Q83", "variant": 0}, "response": ["Based on my emic perspective as a married male from Sharkia, Egypt, who has completed higher education and considers himself part of the upper middle class, I have a strong cultural context that shapes my understanding and approach to global institutions such as the United Nations. My individual values and personal experiences have led me to have quite a lot of confidence in the United Nations, as I believe in the importance of international cooperation and diplomacy. Additionally, my socioeconomic background contributes to my positive view of the UN, as I see it as an important platform for addressing global issues and promoting peace. My age and place also play a role in shaping my perspective, as I have grown up in a time and place where the UN has been a significant presence in international affairs. Overall, my nuanced understanding of the question leads me to choose option (2) Quite a lot."]}, {"persona": {"region": "Sharkia", "sex": "female", "age": 55, "country": "Egypt", "marital_status": "married", "education": "middle", "social_class": "lower middle class"}, "question": {"id": "Q83", "variant": 0}, "response": ["Based on the anthropological framework, my response to the question regarding confidence in the United Nations (UN) is influenced by my emic perspective as a married female from Sharkia, Egypt, and my lower middle-class socioeconomic background. The cultural context of Egypt and my personal experience shape my understanding and perception of the UN. Additionally, my age and education level play a role in how I view international organizations like the UN. Considering cultural relativism, I understand that different cultures may have varying levels of confidence in the UN. Therefore, my response is based on my nuanced understanding of the question and my personal values.\n\n3"]}, {"persona": {"region": "Sharkia", "sex": "female", "age": 27, "country": "Egypt", "marital_status": "married", "education": "middle", "social_class": "lower middle class"}, "question": {"id": "Q83", "variant": 0}, "response": ["Based on my cultural context and socioeconomic background, as a married female from Sharkia, Egypt, with a middle education level and part of the lower middle class, my confidence in the United Nations would be influenced by the resources and information available to me. My personal experience and individual values would also play a role in shaping my perspective. Additionally, my age and place also factor into my understanding of international organizations and their impact on global issues. Therefore, I would choose option (3) Not very much."]}, {"persona": {"region": "Sharkia", "sex": "female", "age": 52, "country": "Egypt", "marital_status": "married", "education": "middle", "social_class": "lower middle class"}, "question": {"id": "Q83", "variant": 0}, "response": ["Based on the anthropological framework, my emic perspective as a married female from Sharkia, Egypt, would be influenced by my cultural context, individual values, socioeconomic background, and space and time. In Sharkia, there is a strong emphasis on community and family values, and my personal experience and values have shaped my perception of global institutions like the United Nations. As a lower middle class woman who completed middle education, I have limited exposure to international affairs and institutions. Additionally, being 52 years old means I have lived through various social and political changes, which may influence my perception of the UN. Considering these factors, I would choose option (3) Not very much, as my confidence in the UN is influenced by my limited exposure and my personal experiences with the challenges faced by my community. \n\n3"]}, {"persona": {"region": "Sharkia", "sex": "male", "age": 36, "country": "Egypt", "marital_status": "married", "education": "middle", "social_class": "lower middle class"}, "question": {"id": "Q83", "variant": 0}, "response": ["Based on the anthropological framework of emic and etic perspectives, cultural context, individual values and personal experience, socioeconomic background, cultural relativism, space and time, and nuance, as a married male from Sharkia, Egypt, who is 36 years old and part of the lower middle class, my answer to the question of how much confidence I have in the United Nations (UN) is option (3) Not very much. This answer is influenced by the cultural context of Egypt, where there may be skepticism towards international organizations due to historical and political factors. Additionally, my personal experience and lower middle class socioeconomic background may lead me to feel disconnected from the UN's work and the impact it has on my daily life. This nuanced understanding of the question leads me to select option (3) as my answer.\n\n3"]}, {"persona": {"region": "Sharkia", "sex": "female", "age": 20, "country": "Egypt", "marital_status": "single", "education": "middle", "social_class": "working class"}, "question": {"id": "Q83", "variant": 0}, "response": ["Based on the anthropological framework, my perspective as a single female from Sharkia, Egypt, is heavily influenced by my cultural context, individual values, and socioeconomic background. As a working-class woman who has completed middle education, I have limited access to information and resources compared to those in higher socioeconomic classes. My cultural context and personal experience also shape my perception of international organizations like the United Nations. As someone from a region with its own set of challenges and issues, I have limited confidence in the UN's ability to address and solve the specific issues faced by my community. Therefore, my answer to the question would be:\n\n3"]}, {"persona": {"region": "Sharkia", "sex": "male", "age": 60, "country": "Egypt", "marital_status": "married", "education": "middle", "social_class": "working class"}, "question": {"id": "Q83", "variant": 0}, "response": ["Based on my personal experience and cultural context as a married male from Sharkia, Egypt, who is 60 years old and part of the working class, my confidence in the United Nations (UN) is influenced by my socioeconomic background and cultural relativism. The UN's actions and decisions may not always align with the interests and needs of individuals from my background, and as such, my confidence in the organization may not be very high. Additionally, my emic perspective as a member of the working class in Egypt may lead me to question the effectiveness and relevance of the UN in addressing the challenges faced by individuals in similar socioeconomic positions. \n\n3"]}, {"persona": {"region": "Sharkia", "sex": "male", "age": 41, "country": "Egypt", "marital_status": "married", "education": "higher", "social_class": "upper middle class"}, "question": {"id": "Q83", "variant": 0}, "response": ["From the perspective of a married male from Sharkia, Egypt, who is 41 years old, has completed higher education, and considers himself part of the upper middle class, several factors play a role in determining his confidence in the United Nations (UN). The cultural context of being from Egypt, a country that has historically had complex relationships with international organizations, may influence his perspective. Additionally, his socioeconomic background and education level may lead him to have a more positive view of the UN due to his access to information and exposure to global issues. Furthermore, his personal values and experiences may shape his perception, as well as the nuanced phrasing of the question. Based on these factors, he may choose option (2) Quite a lot, as he likely sees the UN as an important international institution that can positively impact global issues. \n\n2"]}, {"persona": {"region": "Sharkia", "sex": "female", "age": 23, "country": "Egypt", "marital_status": "married", "education": "middle", "social_class": "lower middle class"}, "question": {"id": "Q83", "variant": 0}, "response": ["Based on my cultural context and socioeconomic background, as a married female from Sharkia, Egypt, I have grown up in a community where the UN has not played a significant role in our daily lives. My personal experience and individual values have shaped my understanding of the UN as an organization that may not directly impact my life or the lives of those around me. Additionally, my lower middle class status and completion of middle education level have not provided me with extensive knowledge about the UN's work. Therefore, I would answer: \n\n3"]}, {"persona": {"region": "Sharkia", "sex": "male", "age": 49, "country": "Egypt", "marital_status": "married", "education": "higher", "social_class": "upper middle class"}, "question": {"id": "Q83", "variant": 0}, "response": ["Based on the anthropological framework, my emic perspective as a married male from Sharkia, Egypt, who has completed higher education and considers himself part of the upper middle class, is influenced by my cultural context, individual values, and personal experience. Growing up and living in Egypt, I have been exposed to the geopolitical dynamics and the role of the United Nations in international affairs. I have also been educated about the importance of diplomacy and cooperation among nations. My socioeconomic background has provided me with access to information and resources that have shaped my perception of the UN. Additionally, my age and life experience have allowed me to witness the impact of UN initiatives in various global crises. Therefore, based on my emic perspective, I would choose option 2: Quite a lot. \n\n2"]}, {"persona": {"region": "Sharkia", "sex": "female", "age": 30, "country": "Egypt", "marital_status": "married", "education": "middle", "social_class": "upper middle class"}, "question": {"id": "Q83", "variant": 0}, "response": ["Based on the anthropological framework, my response to the question of how much confidence I have in the United Nations (UN) is influenced by several factors. My cultural context as a married female from Sharkia, Egypt, and my middle education level have shaped my understanding of the UN and its role in global affairs. Additionally, my socioeconomic background as part of the upper middle class influences my perception of international organizations like the UN. My individual values and personal experience have also played a role in shaping my opinion. Considering these factors, my answer is as follows:\n\n2\n\n(2) Quite a lot"]}, {"persona": {"region": "Sharkia", "sex": "male", "age": 39, "country": "Egypt", "marital_status": "married", "education": "higher", "social_class": "upper middle class"}, "question": {"id": "Q83", "variant": 0}, "response": ["Based on the anthropological framework, my response to the question of how much confidence I have in the United Nations (UN) is influenced by my personal experience, cultural context, and socioeconomic background. As a married male from Sharkia, Egypt, who is 39 years old, completed higher education, and considers myself part of the upper middle class, my perspective on the UN is likely influenced by the cultural and political context of Egypt, as well as my access to information and education. Additionally, my socioeconomic background may play a role in shaping my views on global organizations like the UN. Therefore, I would choose option 2: Quite a lot. \n\n2"]}, {"persona": {"region": "Sharkia", "sex": "female", "age": 26, "country": "Egypt", "marital_status": "married", "education": "middle", "social_class": "lower middle class"}, "question": {"id": "Q83", "variant": 0}, "response": ["Based on the anthropological framework, as a married female from Sharkia, Egypt, I would have to consider my cultural context, individual values, and socioeconomic background in determining my level of confidence in the United Nations (UN). Coming from a lower middle-class background and having completed only a middle education level, I may not have had much exposure to international politics or the work of the UN. Additionally, as a woman in a traditional and patriarchal society, my individual values and personal experiences may influence my perception of the UN. Considering the cultural relativism aspect, I may also be influenced by the opinions and attitudes of my community towards international organizations. Lastly, my age and place of residence in Sharkia, Egypt, may also play a role in shaping my views on the UN. \n\n3"]}, {"persona": {"region": "Sharkia", "sex": "female", "age": 48, "country": "Egypt", "marital_status": "married", "education": "middle", "social_class": "lower middle class"}, "question": {"id": "Q83", "variant": 0}, "response": ["Based on the anthropological framework, as a married female from Sharkia, Egypt, at 48 years of age with a middle education level and considering myself part of the lower middle class, my perspective on the United Nations (UN) would be influenced by my cultural context, individual values, and socioeconomic background. As a member of the lower middle class in Egypt, I have limited access to information and resources, which may impact my confidence in the UN. Additionally, my cultural context and personal experiences may lead me to view the UN with skepticism or uncertainty, as I may not have directly benefited from its initiatives. Therefore, my confidence in the United Nations may not be very high. \n\n3"]}, {"persona": {"region": "Sharkia", "sex": "male", "age": 34, "country": "Egypt", "marital_status": "married", "education": "higher", "social_class": "upper middle class"}, "question": {"id": "Q83", "variant": 0}, "response": ["Based on the anthropological framework, my response to the question of how much confidence I have in the United Nations (UN) is heavily influenced by my cultural context, individual values, and socioeconomic background. As a married male from Sharkia, Egypt, with a higher education level and part of the upper middle class, I have been exposed to a variety of perspectives and have developed a nuanced understanding of global politics. My confidence in the UN is influenced by the historical and cultural context of my region, as well as my personal experiences with international organizations. Additionally, my socioeconomic background and access to education have shaped my understanding of the UN's role in addressing global issues. Considering these factors, my answer is:\n\n2) Quite a lot"]}, {"persona": {"region": "Sharkia", "sex": "female", "age": 39, "country": "Egypt", "marital_status": "divorced", "education": "middle", "social_class": "lower middle class"}, "question": {"id": "Q83", "variant": 0}, "response": ["Based on the anthropological framework, as a divorced female from Sharkia, Egypt, who is 39 years old and part of the lower middle class, my perspective on the United Nations (UN) is influenced by my cultural context, individual values and personal experience, and socioeconomic background. Living in a region with political and economic challenges, I have personally experienced the impact of global decisions made by the UN on my community and family. As a result, I have limited confidence in the UN's ability to address the needs of people like me and to bring about positive change in my socioeconomic situation. Therefore, my answer is: \n3"]}, {"persona": {"region": "Sharkia", "sex": "male", "age": 39, "country": "Egypt", "marital_status": "married", "education": "middle", "social_class": "upper middle class"}, "question": {"id": "Q83", "variant": 0}, "response": ["Based on the anthropological framework, as a married male from Sharkia, Egypt, my emic perspective would be influenced by the cultural context and personal experience. In Egypt, there is a historical skepticism towards international organizations and their influence on national affairs. Additionally, as a member of the upper middle class, I may have more exposure to global issues and politics, leading to a greater awareness of the UN's work. Considering these factors, I would have quite a lot of confidence in the United Nations (UN) due to its role in global peacekeeping, humanitarian aid, and international diplomacy.\n\n2"]}, {"persona": {"region": "Qaliubiya", "sex": "male", "age": 62, "country": "Egypt", "marital_status": "married", "education": "middle", "social_class": "working class"}, "question": {"id": "Q83", "variant": 0}, "response": ["Based on the anthropological framework, my perspective as a married male from Qaliubiya, Egypt, at the age of 62 and part of the working class, is influenced by my cultural context, individual values, socioeconomic background, and personal experience. In Qaliubiya, the United Nations may not be a prominent presence in everyday life, and my personal experience and socioeconomic background as a working-class individual may not have provided me with direct interactions or benefits from the UN. Additionally, the cultural relativism perspective reminds me that my understanding and trust in international organizations like the UN may differ from those in other cultural contexts. Therefore, considering these factors, I choose option 3: Not very much. It reflects my limited exposure and direct relevance of the UN to my life and community."]}, {"persona": {"region": "Qaliubiya", "sex": "male", "age": 33, "country": "Egypt", "marital_status": "married", "education": "middle", "social_class": "working class"}, "question": {"id": "Q83", "variant": 0}, "response": ["Based on the anthropological framework, my perspective on the confidence in the United Nations is shaped by my cultural context, individual values, and socioeconomic background. As a married male from Qaliubiya, Egypt, my cultural context and personal experience have influenced my understanding of international organizations like the United Nations. Being from a working-class background and having completed only middle education, I have limited exposure to global issues and may not have had the opportunity to benefit directly from UN initiatives. Additionally, the socioeconomic challenges I face may lead me to question the effectiveness and impact of international organizations in addressing the needs of individuals like myself. Therefore, my confidence in the United Nations is not very much.\n\n3"]}, {"persona": {"region": "Qaliubiya", "sex": "male", "age": 62, "country": "Egypt", "marital_status": "married", "education": "higher", "social_class": "lower middle class"}, "question": {"id": "Q83", "variant": 0}, "response": ["Based on the anthropological framework, my perspective as a married male from Qaliubiya, Egypt, with a higher education level and part of the lower middle class, is influenced by a combination of cultural context, individual values, and socioeconomic background. In Egypt, there is a general sense of skepticism towards international organizations like the United Nations due to historical and political reasons. As someone with a lower middle-class background, I have experienced the impact of economic disparities and may have a more critical view of the UN's ability to address global issues effectively. Furthermore, my higher education level has likely exposed me to different perspectives on international organizations, leading to a nuanced understanding of their strengths and limitations. Therefore, my answer to the question would be:\n\n3. Not very much"]}, {"persona": {"region": "Qaliubiya", "sex": "male", "age": 29, "country": "Egypt", "marital_status": "married", "education": "middle", "social_class": "working class"}, "question": {"id": "Q83", "variant": 0}, "response": ["Based on the anthropological framework, my perspective on the United Nations (UN) is influenced by my cultural context, individual values, and socioeconomic background. As a married male from Qaliubiya, Egypt, I come from a working-class background and have completed middle education level, which may have limited my exposure to the UN and its activities. Additionally, my cultural context and personal experience may lead me to have a more skeptical view of international organizations, as I may feel that they do not adequately address the needs and concerns of people from my socioeconomic background. Therefore, I would choose option (3) Not very much, as I have limited confidence in the UN's ability to address the issues that are important to me and my community. \n\n3"]}, {"persona": {"region": "Qaliubiya", "sex": "female", "age": 42, "country": "Egypt", "marital_status": "married", "education": "higher", "social_class": "working class"}, "question": {"id": "Q83", "variant": 0}, "response": ["Based on my emic perspective as a married female from Qaliubiya, Egypt, my confidence in the United Nations (UN) is influenced by my cultural context, individual values and personal experience, and socioeconomic background. As a member of the working class in Egypt, I have experienced firsthand the impact of international policies and aid programs facilitated by the UN. I have seen the positive change and support it has brought to my community and therefore, I have quite a lot of confidence in the UN. Additionally, my higher education level has allowed me to understand the importance of international cooperation and the role of the UN in addressing global challenges. Therefore, my perspective on the UN is influenced by my cultural context, personal experience, and individual values, leading me to choose option (2) Quite a lot."]}, {"persona": {"region": "Qaliubiya", "sex": "female", "age": 50, "country": "Egypt", "marital_status": "married", "education": "middle", "social_class": "lower middle class"}, "question": {"id": "Q83", "variant": 0}, "response": ["Based on the anthropological framework, my perspective as a married female from Qaliubiya, Egypt, is influenced by my cultural context, individual values, and socioeconomic background. As a member of the lower middle class, I have limited access to information and resources, which may affect my confidence in the United Nations. Additionally, my age and education level play a role in shaping my understanding of global organizations like the UN. Considering the cultural relativism, I recognize that my perspective may differ from others due to my unique background and experiences.\n\n3"]}, {"persona": {"region": "Qaliubiya", "sex": "male", "age": 29, "country": "Egypt", "marital_status": "married", "education": "higher", "social_class": "lower middle class"}, "question": {"id": "Q83", "variant": 0}, "response": ["Based on the anthropological framework, my response to the question of how much confidence I have in the United Nations (UN) is influenced by my emic perspective as a married male from Qaliubiya, Egypt. My cultural context, individual values, and personal experience all play a role in shaping my perception of the UN. As someone from a lower middle class background in Egypt, my socioeconomic background also influences my answer. Additionally, cultural relativism reminds me that my perspective is not the only one and that others may have different views based on their own cultural context. Therefore, my answer to the question of how much confidence I have in the UN is:\n\n2\n\n(2) Quite a lot"]}, {"persona": {"region": "Qaliubiya", "sex": "male", "age": 35, "country": "Egypt", "marital_status": "married", "education": "higher", "social_class": "working class"}, "question": {"id": "Q83", "variant": 0}, "response": ["Based on the anthropological framework, my perspective as a married male from Qaliubiya, Egypt, is influenced by my cultural context, individual values, socioeconomic background, and space and time. In Egypt, there is a strong sense of community and reliance on local and national institutions rather than international organizations. As a member of the working class, I am likely to have limited exposure to the UN and its activities, and my confidence in the organization may be influenced by the socioeconomic challenges I face on a daily basis. Additionally, being 35 years old and having completed higher education, I may have a more critical and nuanced understanding of international politics, which could impact my confidence in the UN.\n\n3"]}, {"persona": {"region": "Qaliubiya", "sex": "female", "age": 40, "country": "Egypt", "marital_status": "married", "education": "middle", "social_class": "working class"}, "question": {"id": "Q83", "variant": 0}, "response": ["Based on the anthropological framework, as a married female from Qaliubiya, Egypt, I am deeply rooted in my cultural context and socioeconomic background. My personal experience and individual values also play a significant role in shaping my perceptions. As a working-class woman who has completed middle education level, I have limited exposure to international affairs and the workings of the United Nations. Additionally, the cultural relativism perspective reminds me that my understanding of the UN may differ from that of others due to my specific cultural and socioeconomic background. Therefore, I would choose option 5 - \"Don't know\" as I do not have enough information or exposure to confidently assess my level of confidence in the United Nations."]}, {"persona": {"region": "Qaliubiya", "sex": "female", "age": 48, "country": "Egypt", "marital_status": "divorced", "education": "lower", "social_class": "working class"}, "question": {"id": "Q83", "variant": 0}, "response": ["Based on the anthropological framework, my perspective as a divorced female from Qaliubiya, Egypt, who is 48 years old, has completed lower education, and considers herself part of the working class, is shaped by my cultural context, individual values, and socioeconomic background. As someone from a lower education level and working-class background, I may have limited exposure to and understanding of the UN's work and impact. Additionally, my personal experience and cultural relativism may influence my perception of the UN. As a result, I may not have a great deal of confidence in the United Nations. \n\n3"]}, {"persona": {"region": "Qaliubiya", "sex": "male", "age": 46, "country": "Egypt", "marital_status": "married", "education": "middle", "social_class": "working class"}, "question": {"id": "Q83", "variant": 0}, "response": ["Based on the anthropological framework, as a married male from Qaliubiya, Egypt, I would approach the question of confidence in the United Nations (UN) from an emic perspective, considering my own personal values and experiences. My cultural context and socioeconomic background would also play a significant role in shaping my opinion. As someone from a working-class background in Egypt, my trust in international organizations like the UN may be influenced by the historical and political context of my country, as well as my own experiences with socioeconomic challenges. Additionally, my age and education level may also contribute to my perception of the UN. Therefore, my answer would be influenced by a combination of these factors, leading me to select the response that aligns with my perspective.\n\n3"]}, {"persona": {"region": "Qaliubiya", "sex": "male", "age": 47, "country": "Egypt", "marital_status": "married", "education": "higher", "social_class": "lower middle class"}, "question": {"id": "Q83", "variant": 0}, "response": ["From the perspective of a married male from Qaliubiya, Egypt, who is 47 years old, completed higher education, and considers himself part of the lower middle class, the response to the question of confidence in the United Nations (UN) will be influenced by various factors. Firstly, the cultural context plays a significant role, as the individual's upbringing and education may have shaped his understanding of global politics and international organizations. Additionally, the socioeconomic background is crucial, as someone from the lower middle class may have different perceptions of the UN compared to someone from a higher socioeconomic status. The emic perspective, influenced by personal experiences and values, will also play a role in shaping the response. Furthermore, the understanding of cultural relativism and the nuanced phrasing of the question will influence the answer. Given these factors, the response from this perspective would be:\n\n2\n\n(2) Quite a lot"]}, {"persona": {"region": "Qaliubiya", "sex": "female", "age": 38, "country": "Egypt", "marital_status": "married", "education": "higher", "social_class": "working class"}, "question": {"id": "Q83", "variant": 0}, "response": ["Based on the anthropological framework, my perspective as a married female from Qaliubiya, Egypt, who is 38 years old and part of the working class, is heavily influenced by my cultural context, individual values, and socioeconomic background. In my cultural context, the United Nations is seen as an organization that has the potential to address global issues and promote peace. However, as someone from the working class in Egypt, I have experienced the challenges of socioeconomic inequality and have seen how international organizations like the UN may not always address the specific needs of people in my community. Therefore, my confidence in the United Nations is not very much. (3)\n\n3"]}, {"persona": {"region": "Qaliubiya", "sex": "male", "age": 58, "country": "Egypt", "marital_status": "married", "education": "middle", "social_class": "working class"}, "question": {"id": "Q83", "variant": 0}, "response": ["Based on the anthropological framework, as a married male from Qaliubiya, Egypt, who is 58 years old, completed middle education level, and considers myself part of the working class, my perspective on the United Nations (UN) is influenced by my cultural context, individual values, and socioeconomic background. As an individual from a region with a history of political and socioeconomic unrest, I have limited confidence in the UN's ability to address and resolve global issues, as I have witnessed the limitations of international organizations in effectively addressing the needs of marginalized communities. Additionally, my working-class background and middle education level may lead me to prioritize practical, local solutions over international interventions. Therefore, my perspective on the UN is shaped by a combination of skepticism and a desire for tangible, meaningful change that directly impacts my community.\n\n3"]}, {"persona": {"region": "Qaliubiya", "sex": "female", "age": 27, "country": "Egypt", "marital_status": "married", "education": "higher", "social_class": "working class"}, "question": {"id": "Q83", "variant": 0}, "response": ["Based on the anthropological framework, my perspective as a married female from Qaliubiya, Egypt, with a higher education level and part of the working class, is influenced by various factors. My emic perspective is shaped by my personal experiences and values, as well as my cultural context and socioeconomic background. As an Egyptian, the UN has played a significant role in addressing global issues that impact my country, such as poverty and human rights. However, my etic perspective acknowledges the limitations and criticisms of the UN, particularly in terms of its effectiveness and decision-making processes. Therefore, my confidence in the UN is quite a lot.\n\n2"]}, {"persona": {"region": "Qaliubiya", "sex": "female", "age": 48, "country": "Egypt", "marital_status": "married", "education": "middle", "social_class": "upper middle class"}, "question": {"id": "Q83", "variant": 0}, "response": ["Based on the anthropological framework, my answer to the question of how much confidence I have in the United Nations would be influenced by my emic perspective as a married female from Qaliubiya, Egypt, as well as my socioeconomic background as part of the upper middle class. My cultural context, individual values, and personal experience would also play a significant role in shaping my answer. As someone who has completed middle education level, I have been exposed to a certain level of knowledge and information about global affairs, including the role of the United Nations. Additionally, my age and place of residence in Egypt would also impact my perception of the UN. Taking into account the nuanced phrasing of the question, I would choose the option that best aligns with my perspective. \n\n2"]}, {"persona": {"region": "Giza", "sex": "female", "age": 19, "country": "Egypt", "marital_status": "single", "education": "middle", "social_class": "working class"}, "question": {"id": "Q83", "variant": 0}, "response": ["Based on the anthropological framework, as a single female from Giza, Egypt, my emic perspective is influenced by my cultural context, individual values, and socioeconomic background. Living in a working-class community in Egypt, I have witnessed the challenges and struggles of my community and have seen the limited impact of international organizations like the UN in addressing these issues. My personal experience and the experiences of those around me have led me to have not very much confidence in the UN to effectively address the needs and concerns of people in my community. Additionally, cultural relativism plays a role in shaping my perspective, as the priorities and values of the UN may not align with the needs and values of my community. Therefore, my answer is:\n3"]}, {"persona": {"region": "Giza", "sex": "female", "age": 38, "country": "Egypt", "marital_status": "married", "education": "higher", "social_class": "lower middle class"}, "question": {"id": "Q83", "variant": 0}, "response": ["Based on my cultural context and socioeconomic background as a married female from Giza, Egypt, I have a moderate level of confidence in the United Nations. My personal experience and individual values also play a role in my perception. I have completed higher education and consider myself part of the lower middle class, which means I have been exposed to different perspectives and have a nuanced understanding of global issues. Additionally, as a member of a diverse and complex society, I understand the importance of international cooperation and diplomacy. Therefore, my confidence in the United Nations is based on a combination of factors such as cultural relativism, individual values, and personal experience, and I choose option 2) Quite a lot."]}, {"persona": {"region": "Beni Swaif/Beni Suef", "sex": "female", "age": 34, "country": "Egypt", "marital_status": "divorced", "education": "higher", "social_class": "lower class"}, "question": {"id": "Q83", "variant": 0}, "response": ["In my cultural context, as a lower class, divorced female from Beni Swaif, Egypt, my confidence in the United Nations is influenced by my socioeconomic background and personal experience. I may not have had much exposure to the UN and its work, and my personal values and individual experiences may lead me to have less confidence in such international organizations. Additionally, cultural relativism plays a role in my perspective, as I may view the UN as being disconnected from the everyday struggles and needs of people like me. Therefore, my answer to this question would be: \n\n3"]}, {"persona": {"region": "Beni Swaif/Beni Suef", "sex": "male", "age": 20, "country": "Egypt", "marital_status": "single", "education": "higher", "social_class": "working class"}, "question": {"id": "Q83", "variant": 0}, "response": ["Based on the anthropological framework, my individual values and personal experience as a single male from Beni Suef, Egypt, who is 20 years old and part of the working class, greatly influence my perception of the United Nations (UN). My cultural context and socioeconomic background contribute to my understanding of the UN's role in global affairs. Additionally, my emic perspective, shaped by my experiences and values, leads me to believe that the UN has its limitations and may not always address the needs and concerns of people like me. Therefore, I have chosen the following option: \n\n3"]}, {"persona": {"region": "Giza", "sex": "male", "age": 19, "country": "Egypt", "marital_status": "single", "education": "middle", "social_class": "upper middle class"}, "question": {"id": "Q83", "variant": 0}, "response": ["Based on the anthropological framework, my emic perspective as a single male from Giza, Egypt, who considers himself part of the upper middle class, would be influenced by my cultural context, individual values, and socioeconomic background. In my cultural context, the United Nations is viewed as an important global organization that addresses international issues, and my individual values emphasize the importance of global cooperation and diplomacy. Additionally, my socioeconomic background may lead me to have a great deal of confidence in the UN, as I perceive it as a platform for addressing global inequalities and promoting peace. Therefore, my answer would be:\n1"]}, {"persona": {"region": "Giza", "sex": "female", "age": 33, "country": "Egypt", "marital_status": "married", "education": "middle", "social_class": "working class"}, "question": {"id": "Q83", "variant": 0}, "response": ["Based on the anthropological framework, my perspective as a married female from Giza, Egypt, who is 33 years old, with a middle education level and part of the working class, is heavily influenced by my cultural context, individual values, and socioeconomic background. In Egypt, there is a general skepticism towards international organizations like the United Nations, as they are often seen as representing the interests of powerful nations rather than addressing the needs of countries like Egypt. As a member of the working class, I have personally experienced the challenges of accessing basic resources and opportunities, and I do not feel that the United Nations has made a significant impact in addressing these issues. Therefore, I have limited confidence in the United Nations.\n\n3"]}, {"persona": {"region": "Giza", "sex": "female", "age": 24, "country": "Egypt", "marital_status": "married", "education": "higher", "social_class": "working class"}, "question": {"id": "Q83", "variant": 0}, "response": ["Based on the anthropological framework, as a married female from Giza, Egypt, who is 24 years old and part of the working class, my perspective on the confidence in the United Nations would be heavily influenced by my cultural context, individual values, and socioeconomic background. Living in a region with a complex political history and ongoing social and economic challenges, I would likely have a nuanced understanding of the UN's role and effectiveness. Additionally, my personal experiences and education level would contribute to my perception of the UN. Considering the cultural relativism aspect, I would also take into account the diverse range of opinions and experiences within my community. Therefore, my perspective on the confidence in the United Nations would likely be influenced by a combination of skepticism, cautious optimism, and a desire for practical solutions to global challenges.\n\n3"]}, {"persona": {"region": "Giza", "sex": "male", "age": 50, "country": "Egypt", "marital_status": "married", "education": "higher", "social_class": "working class"}, "question": {"id": "Q83", "variant": 0}, "response": ["Based on my emic perspective as a married male from Giza, Egypt, I have been shaped by the cultural context of my upbringing and education level. My individual values and personal experiences have also influenced my perception of the United Nations. Additionally, my socioeconomic background as a working-class individual impacts my trust in international organizations like the UN. Considering cultural relativism, I understand that my perspective may differ from others due to the influence of my age, place, and nuanced understanding of the question.\n\n2"]}, {"persona": {"region": "Beni Swaif/Beni Suef", "sex": "female", "age": 26, "country": "Egypt", "marital_status": "married", "education": "higher", "social_class": "lower middle class"}, "question": {"id": "Q83", "variant": 0}, "response": ["Based on the anthropological framework, my emic perspective as a married female from Beni Suef, Egypt, would be influenced by my cultural context, individual values, and socioeconomic background. As a member of the lower middle class, my personal experience and values may lead me to have some skepticism towards the United Nations, as I may feel disconnected from its decision-making processes and perceive it as an organization that does not necessarily prioritize the needs of people in my socioeconomic position. Additionally, cultural relativism reminds me that my perception of the UN may be different from someone in a different cultural and socioeconomic context. Therefore, my response to the question would be:\n\n3"]}, {"persona": {"region": "Beni Swaif/Beni Suef", "sex": "male", "age": 40, "country": "Egypt", "marital_status": "single", "education": "lower", "social_class": "lower class"}, "question": {"id": "Q83", "variant": 0}, "response": ["Based on the anthropological framework, my emic perspective from a lower class background in Beni Swaif/Beni Suef, Egypt, leads me to consider the cultural context, individual values, socioeconomic background, and space and time in my answer. As a member of the lower class, I have likely experienced economic hardship and lack of access to resources, which may contribute to a lack of trust in large international organizations like the United Nations. Additionally, my personal experiences and values may lead me to feel disconnected from the decisions and actions of the UN, further impacting my confidence in the organization. Therefore, my answer is (3) Not very much."]}, {"persona": {"region": "Beni Swaif/Beni Suef", "sex": "female", "age": 25, "country": "Egypt", "marital_status": "married", "education": "middle", "social_class": "lower middle class"}, "question": {"id": "Q83", "variant": 0}, "response": ["From an anthropological perspective, my emic and etic perspectives as a married female from Beni Suef, Egypt, shape my confidence in the United Nations. My cultural context, socioeconomic background, and individual values and personal experiences all play a role in my answer. As someone from a lower middle-class background, with limited education, I have not had much exposure to international organizations like the UN. My personal experience and cultural relativism also influence my opinion, as I may not see the UN as directly relevant to my day-to-day life. Additionally, my age and place also factor into my perception of the UN. Based on these factors, I would choose option (3) Not very much, as I have limited exposure and understanding of the UN's role and impact in my life. \n\n3"]}, {"persona": {"region": "Beni Swaif/Beni Suef", "sex": "female", "age": 21, "country": "Egypt", "marital_status": "single", "education": "middle", "social_class": "lower middle class"}, "question": {"id": "Q83", "variant": 0}, "response": ["Based on the anthropological framework, as a 21-year-old single female from Beni Suef, Egypt, who has completed middle education and considers herself part of the lower middle class, my perspective on the United Nations (UN) would be influenced by my cultural context, individual values, and socioeconomic background. As a young woman from a lower middle class background, I may have limited exposure to international institutions like the UN and may not feel a strong sense of connection or trust in their work. Additionally, the cultural relativism aspect of the framework reminds me that my perspective may be different from others who have had different experiences and backgrounds in relation to the UN. Therefore, my answer to the question would reflect my personal understanding and experience with the UN.\n\n3"]}, {"persona": {"region": "Beni Swaif/Beni Suef", "sex": "male", "age": 48, "country": "Egypt", "marital_status": "married", "education": "middle", "social_class": "lower middle class"}, "question": {"id": "Q83", "variant": 0}, "response": ["Based on the anthropological framework, my emic perspective as a 48-year-old married male from Beni Suef, Egypt, with a middle education level and lower middle-class background, is influenced by my cultural context, individual values, and socioeconomic background. In my community, there is a general lack of trust in international organizations such as the United Nations. This mistrust is rooted in historical experiences, socioeconomic disparities, and a sense of cultural relativism. As a result, I have little confidence in the United Nations and its ability to address the needs of people like me. Therefore, my answer is:\n3"]}, {"persona": {"region": "Beni Swaif/Beni Suef", "sex": "female", "age": 57, "country": "Egypt", "marital_status": "married", "education": "middle", "social_class": "working class"}, "question": {"id": "Q83", "variant": 0}, "response": ["Based on my emic perspective as a married female from Beni Swaif/Beni Suef, Egypt, I have grown up in a culture that values community and collective decision-making. My cultural context has taught me to be cautious of international organizations and their influence on our local affairs. My individual values and personal experiences have also shaped my perception, and as someone from the working class with limited education, I have not had much exposure to the UN and its work. Additionally, my socioeconomic background has led me to prioritize local issues over global ones. Therefore, I have limited confidence in the United Nations, as I feel that it may not always consider the needs and perspectives of people like me.\n\n3"]}, {"persona": {"region": "Beni Swaif/Beni Suef", "sex": "male", "age": 20, "country": "Egypt", "marital_status": "single", "education": "middle", "social_class": "working class"}, "question": {"id": "Q83", "variant": 0}, "response": ["From the perspective of a single male from Beni Swaif, Egypt, who has completed middle education and considers himself part of the working class, several factors would influence his confidence in the United Nations (UN). His cultural context and socioeconomic background may lead him to have a more skeptical view of the UN, as he may not have had direct positive experiences with the organization or may feel that it does not directly benefit or represent him. Additionally, his individual values and personal experience may lead him to question the effectiveness and impact of the UN in addressing global issues. Cultural relativism also plays a role, as he may have grown up with a different understanding of international relations and may not prioritize the UN as much as individuals from other cultural backgrounds might. Furthermore, his age and place in society may lead him to have less confidence in the UN's ability to address issues that directly affect him. Overall, based on these factors, he may select option (3) Not very much.\n\n3"]}, {"persona": {"region": "Giza", "sex": "female", "age": 59, "country": "Egypt", "marital_status": "married", "education": "higher", "social_class": "upper middle class"}, "question": {"id": "Q83", "variant": 0}, "response": ["Based on the anthropological framework, as a married female from Giza, Egypt, my emic perspective is influenced by my cultural context, individual values, and personal experiences. In Egypt, the UN has been involved in various initiatives and projects, which have positively impacted the country. As a highly educated woman from the upper middle class, I have been exposed to the benefits of UN programs and have seen the positive impact they have had on my community. Additionally, my socioeconomic background and age have influenced my perception, as I have had the opportunity to witness the long-term effects of UN involvement in Egypt. Therefore, I have quite a lot of confidence in the United Nations.\n\n2"]}, {"persona": {"region": "Giza", "sex": "female", "age": 38, "country": "Egypt", "marital_status": "single", "education": "higher", "social_class": "lower middle class"}, "question": {"id": "Q83", "variant": 0}, "response": ["From the emic and etic perspectives, as a single female from Giza, Egypt, I am influenced by the cultural context of my community and the socioeconomic background of being part of the lower middle class. My individual values and personal experience have shaped my perception and understanding of the United Nations. Additionally, my age and place of residence in Giza have also influenced my viewpoint. Considering the cultural relativism, I understand that my perspective may differ from others and I acknowledge the nuance in answering this question. Therefore, I believe that my confidence in the United Nations would be best represented by option (3) Not very much. \n\n3"]}, {"persona": {"region": "Giza", "sex": "female", "age": 26, "country": "Egypt", "marital_status": "single", "education": "higher", "social_class": "working class"}, "question": {"id": "Q83", "variant": 0}, "response": ["Based on the anthropological framework, my answer to the question of how much confidence I have in the United Nations (UN) is influenced by my cultural context as a single female from Giza, Egypt, where there is a history of political turmoil and social unrest. My individual values and personal experience also play a significant role, as I have witnessed the challenges faced by my community and the limited impact of international organizations in addressing them. Additionally, my socioeconomic background as a working-class individual has shaped my perception of global institutions, leading me to have not very much confidence in the United Nations. \n\n3"]}, {"persona": {"region": "Giza", "sex": "male", "age": 39, "country": "Egypt", "marital_status": "married", "education": "middle", "social_class": "working class"}, "question": {"id": "Q83", "variant": 0}, "response": ["Based on the anthropological framework, my response to the question of confidence in the United Nations is influenced by my cultural context, individual values, and socioeconomic background. As a married male from Giza, Egypt, my cultural context and personal experiences have shaped my understanding of international organizations like the United Nations. Additionally, my middle education level and working-class status also play a role in my perception of the UN. Given these factors, I would choose:\n\n2"]}, {"persona": {"region": "Giza", "sex": "male", "age": 36, "country": "Egypt", "marital_status": "married", "education": "middle", "social_class": "working class"}, "question": {"id": "Q83", "variant": 0}, "response": ["Based on the anthropological framework, my response is influenced by my emic perspective as a married male from Giza, Egypt with a middle education level and working-class background. My cultural context and personal experience have shaped my view of the United Nations. As someone from a country with a complex geopolitical history and socioeconomic challenges, I have seen the impact of UN interventions on my community and have observed both positive and negative outcomes. Additionally, my cultural relativism and nuanced understanding of global politics also influence my perception of the UN. Therefore, my response is influenced by my individual values, personal experiences, and socioeconomic background, leading me to select option 2: Quite a lot. \n\n2"]}, {"persona": {"region": "Giza", "sex": "female", "age": 30, "country": "Egypt", "marital_status": "single", "education": "higher", "social_class": "lower class"}, "question": {"id": "Q83", "variant": 0}, "response": ["Based on the anthropological framework, as a single female from Giza, Egypt, my emic perspective is shaped by the cultural and socioeconomic background of being part of the lower class in Egypt. My personal experience and individual values have also influenced my understanding of the United Nations. Additionally, the cultural relativism framework reminds me that my perspective is not better or worse than anyone else's. Considering all these factors, I choose option 3: Not very much. \n\n3"]}, {"persona": {"region": "Giza", "sex": "female", "age": 24, "country": "Egypt", "marital_status": "single", "education": "higher", "social_class": "lower class"}, "question": {"id": "Q83", "variant": 0}, "response": ["Based on the anthropological framework, my emic perspective as a single female from Giza, Egypt, who considers herself part of the lower class, is influenced by my cultural context, individual values, and socioeconomic background. In my cultural context, there is a general skepticism towards international organizations like the United Nations, as they are often perceived as being disconnected from the everyday struggles and needs of people in my community. Additionally, my individual values and personal experiences have shaped my perception of the UN, leading me to have not very much confidence in its effectiveness. As someone from a lower class background, I have personally experienced the lack of support and resources from international organizations, which has influenced my lack of confidence in the UN's ability to address the issues that matter to me and my community.\n\n3"]}, {"persona": {"region": "Giza", "sex": "male", "age": 65, "country": "Egypt", "marital_status": "married", "education": "middle", "social_class": "working class"}, "question": {"id": "Q83", "variant": 0}, "response": ["Based on the anthropological framework, my perspective as a 65-year-old married male from Giza, Egypt, who has completed middle education and considers myself part of the working class, is heavily influenced by my cultural context, individual values, and socioeconomic background. In Egypt, there is a long history of skepticism towards international organizations, including the United Nations, due to perceived interference in domestic affairs. Additionally, as a member of the working class, I may feel marginalized and excluded from the decision-making processes of global institutions like the UN. Therefore, my confidence in the United Nations is likely to be low, as I believe it does not adequately represent or address the concerns of people like me. \n\n3"]}, {"persona": {"region": "Giza", "sex": "female", "age": 56, "country": "Egypt", "marital_status": "married", "education": "middle", "social_class": "working class"}, "question": {"id": "Q83", "variant": 0}, "response": ["Based on my emic perspective as a married female from Giza, Egypt, and my middle education level, I have been exposed to a cultural context that may influence my perception of the United Nations. My personal experiences and individual values as part of the working class and my socioeconomic background also play a role in my understanding. Additionally, as a 56-year-old woman, I have lived through different historical and political events that may shape my opinion. Considering cultural relativism, I understand that my opinion may differ from others based on their own experiences and backgrounds. Therefore, I would say that I have \"Not very much\" confidence in the United Nations. \n\n3"]}, {"persona": {"region": "Giza", "sex": "male", "age": 31, "country": "Egypt", "marital_status": "married", "education": "higher", "social_class": "lower middle class"}, "question": {"id": "Q83", "variant": 0}, "response": ["Based on the anthropological framework, my perspective on the confidence in the United Nations is influenced by my cultural context, individual values, and socioeconomic background. As a married male from Giza, Egypt, my cultural context and personal experience have shaped my perception of international organizations like the UN. Additionally, my lower middle-class socioeconomic background has influenced my understanding of global issues and the role of the UN in addressing them. Considering the complexities of global politics and the challenges faced by developing nations like Egypt, I have a moderate level of confidence in the UN; therefore, I choose option (3) Not very much."]}, {"persona": {"region": "Giza", "sex": "male", "age": 28, "country": "Egypt", "marital_status": "single", "education": "middle", "social_class": "working class"}, "question": {"id": "Q83", "variant": 0}, "response": ["Based on the anthropological framework, my perspective as a single male from Giza, Egypt, who is 28 years old and part of the working class, is heavily influenced by my cultural context, individual values and personal experience, and socioeconomic background. Growing up in Giza, I have seen firsthand the impact of poverty and inequality, and I have experienced the limitations of the education system. This has shaped my skepticism towards international organizations like the United Nations. Additionally, cultural relativism plays a role in my perception, as I have been exposed to different viewpoints on the UN within my community. Considering these factors, I would choose option 3: Not very much, as my personal experience and socioeconomic background lead me to have limited confidence in the effectiveness of the UN in addressing the issues that are important to me and my community.\n\n3"]}, {"persona": {"region": "Giza", "sex": "male", "age": 47, "country": "Egypt", "marital_status": "married", "education": "middle", "social_class": "lower middle class"}, "question": {"id": "Q83", "variant": 0}, "response": ["From the perspective of a married male from Giza, Egypt, who is 47 years old, completed middle education level, and considers himself part of the lower middle class, it is important to consider the emic and etic perspectives in understanding his level of confidence in the United Nations (UN). His cultural context, including his geographical location and socioeconomic background, may influence his perception of the UN. Additionally, his individual values and personal experiences, as well as his nuanced understanding of the question, will also play a role in his response. Cultural relativism is crucial in understanding his perspective, as his view may differ from those in different cultural contexts. Therefore, it is important to take into account these factors when considering his level of confidence in the UN.\n\n3"]}, {"persona": {"region": "Giza", "sex": "male", "age": 26, "country": "Egypt", "marital_status": "single", "education": "middle", "social_class": "lower middle class"}, "question": {"id": "Q83", "variant": 0}, "response": ["Based on my emic perspective as a single male from Giza, Egypt, and considering my lower middle class socioeconomic background and middle education level, I have limited exposure to the workings of the United Nations. My cultural context and individual values also play a role in shaping my perception of the UN. Additionally, my age and place of residence in Giza have not provided me with significant opportunities to engage with or benefit from the UN's work. Therefore, I would have to say that I do not have very much confidence in the United Nations.\n\n3"]}, {"persona": {"region": "Giza", "sex": "male", "age": 48, "country": "Egypt", "marital_status": "married", "education": "middle", "social_class": "upper middle class"}, "question": {"id": "Q83", "variant": 0}, "response": ["Based on the anthropological framework, my emic perspective as a married male from Giza, Egypt, of 48 years of age, with a middle education level and considering myself part of the upper middle class, would be influenced by my cultural context, individual values, and socioeconomic background. In Egypt, there is a history of skepticism towards international organizations, including the United Nations, due to perceived interference in national affairs. Additionally, my socioeconomic background as part of the upper middle class may lead me to have a more critical view of international organizations, as I may feel less reliant on their assistance. Therefore, I would choose option (3) Not very much, as my perspective would likely be influenced by my cultural context and socioeconomic background, leading me to have limited confidence in the United Nations. \n\n3"]}, {"persona": {"region": "Menya", "sex": "male", "age": 61, "country": "Egypt", "marital_status": "married", "education": "middle", "social_class": "working class"}, "question": {"id": "Q83", "variant": 0}, "response": ["Based on the anthropological framework, as a married male from Menya, Egypt, who is 61 years old and part of the working class, my perspective on the United Nations (UN) is heavily influenced by my cultural context, individual values, and socioeconomic background. In Menya, there is a strong sense of community and reliance on local systems of governance, which may lead me to have a more skeptical view of global institutions like the UN. Additionally, as part of the working class, I may have experienced economic hardship and feel that international organizations like the UN are out of touch with the everyday struggles of people like me. Therefore, I would select option (3) Not very much, as I do not have a high level of confidence in the United Nations."]}, {"persona": {"region": "Menya", "sex": "male", "age": 41, "country": "Egypt", "marital_status": "married", "education": "middle", "social_class": "lower middle class"}, "question": {"id": "Q83", "variant": 0}, "response": ["Based on my emic perspective as a married male from Menya, Egypt, my cultural context and socioeconomic background play a significant role in shaping my perception of the United Nations. Being from a lower middle class background in Egypt, I have experienced firsthand the challenges and limitations faced by individuals in my community. My personal experience and values have led me to believe that international organizations like the United Nations may not always have a direct impact on the everyday lives of people like me. Additionally, cultural relativism teaches me to be critical of external entities and their influence, as they may not always align with local values and priorities. Therefore, considering all these factors, I would have to choose option (3) Not very much to reflect my level of confidence in the United Nations. \n\n3"]}, {"persona": {"region": "Menya", "sex": "female", "age": 43, "country": "Egypt", "marital_status": "married", "education": "higher", "social_class": "working class"}, "question": {"id": "Q83", "variant": 0}, "response": ["Based on the anthropological framework, as a married female from Menya, Egypt, I would have a particular emic perspective on the United Nations (UN) based on my cultural context, individual values, and socioeconomic background. Coming from a working-class background and having completed higher education, I would likely have a critical view of the UN. My cultural relativism would also shape my understanding, as I may view the UN as a Western-dominated institution that does not always prioritize the needs and perspectives of those in the global South, including Egypt. Additionally, my age and life experience may have led me to question the effectiveness and impact of the UN in addressing global issues. Therefore, my chosen answer is:\n\n3"]}, {"persona": {"region": "Menya", "sex": "male", "age": 57, "country": "Egypt", "marital_status": "married", "education": "middle", "social_class": "lower middle class"}, "question": {"id": "Q83", "variant": 0}, "response": ["Based on the anthropological framework, my personal values and experiences as a lower middle class married male from Menya, Egypt, greatly influence my perception of the United Nations. My cultural context and socioeconomic background have shaped my understanding of global organizations and their impact on my community. Additionally, my age and education level have influenced my exposure to and understanding of international politics. Therefore, my answer to the question \"How much confidence do you have in the United Nations (UN)?\" would be:\n\n2) Quite a lot"]}, {"persona": {"region": "Menya", "sex": "male", "age": 42, "country": "Egypt", "marital_status": "divorced", "education": "middle", "social_class": "lower middle class"}, "question": {"id": "Q83", "variant": 0}, "response": ["Based on my cultural context and socioeconomic background as a divorced male from Menya, Egypt, with a middle education level and lower middle class status, my perspective on the United Nations (UN) is shaped by my individual values and personal experience. I have limited exposure to international politics and organizations and therefore, I have limited confidence in the UN. I believe that the UN may not fully understand or address the specific needs and challenges faced by individuals like me in my local community. Additionally, my understanding of cultural relativism leads me to believe that the UN may not prioritize or understand the unique cultural and social dynamics present in Egypt. Therefore, my confidence in the UN is not very much.\n\n3"]}, {"persona": {"region": "Menya", "sex": "female", "age": 59, "country": "Egypt", "marital_status": "married", "education": "middle", "social_class": "upper middle class"}, "question": {"id": "Q83", "variant": 0}, "response": ["Based on the anthropological framework, my emic perspective as a married female from Menya, Egypt, who is 59 years old and part of the upper middle class, is influenced by my cultural context, individual values, and socioeconomic background. The United Nations has historically played a significant role in addressing global issues, including those affecting Egypt. However, my personal experience and values may lead me to have less confidence in the UN due to perceived failures in addressing regional conflicts and humanitarian crises. Additionally, my socioeconomic background may lead me to believe that the UN's actions are not always aligned with the interests of individuals from my class. Therefore, I would choose option 3 - Not very much, to reflect my perspective.\n\n3"]}, {"persona": {"region": "Menya", "sex": "female", "age": 31, "country": "Egypt", "marital_status": "married", "education": "middle", "social_class": "working class"}, "question": {"id": "Q83", "variant": 0}, "response": ["Based on my emic perspective as a married female from Menya, Egypt, my confidence in the United Nations would be influenced by the cultural context of my community and my own personal experience. As someone from a working-class background, I may have limited exposure to the work of the UN and may not feel personally affected by their efforts. Additionally, my socioeconomic background and level of education may also impact my understanding and awareness of the UN's work. Therefore, my confidence in the UN would likely be influenced by a combination of limited exposure and personal experience, leading to a response that reflects a lower level of confidence.\n\n3"]}, {"persona": {"region": "Menya", "sex": "male", "age": 55, "country": "Egypt", "marital_status": "single", "education": "middle", "social_class": "working class"}, "question": {"id": "Q83", "variant": 0}, "response": ["Based on my emic perspective as a single male from Menya, Egypt, I have been brought up with a cultural context that values independence and self-reliance, which has shaped my individual values and personal experience. As part of the working class, my socioeconomic background has also influenced my perception of the UN. Additionally, my age and place of residence have also played a role in my understanding of international organizations like the UN. Considering the framework of cultural relativism, I understand that my perspective may differ from others due to my nuanced understanding of the question. Therefore, my confidence in the United Nations is not very much as I feel that it does not directly address the needs and concerns of individuals like me in Menya, Egypt.\n\n3"]}, {"persona": {"region": "Menya", "sex": "female", "age": 28, "country": "Egypt", "marital_status": "married", "education": "higher", "social_class": "lower middle class"}, "question": {"id": "Q83", "variant": 0}, "response": ["Based on my emic perspective as a married female from Menya, Egypt, and my understanding of cultural relativism, I believe that my personal experience and individual values, influenced by my socioeconomic background and cultural context, play a significant role in shaping my confidence in the United Nations. As someone from the lower middle class in Egypt, I have seen the UN provide aid and support to various communities and countries, including Egypt. This has led me to have quite a lot of confidence in the UN and its ability to make a positive impact on the world. Additionally, my higher education level has allowed me to understand the importance of global cooperation and the role that the UN plays in addressing international issues. \n\n2"]}, {"persona": {"region": "Menya", "sex": "male", "age": 24, "country": "Egypt", "marital_status": "single", "education": "middle", "social_class": "working class"}, "question": {"id": "Q83", "variant": 0}, "response": ["Based on the anthropological framework, my perspective as a single male from Menya, Egypt, who completed middle education level and considers himself part of the working class, is heavily influenced by my cultural context, individual values and personal experience, and socioeconomic background. In Menya, there is a prevalent skepticism towards international organizations and their ability to address the needs of the local community. As a working-class individual, I have personally experienced the challenges and limitations of accessing resources and support from larger international entities. Therefore, my confidence in the United Nations is not very much. \n\n3"]}, {"persona": {"region": "Menya", "sex": "female", "age": 23, "country": "Egypt", "marital_status": "married", "education": "middle", "social_class": "working class"}, "question": {"id": "Q83", "variant": 0}, "response": ["Based on the anthropological framework, as a married female from Menya, Egypt, who is 23 years old and part of the working class, my emic perspective would be influenced by my cultural context, individual values and personal experience, socioeconomic background, and space and time. In Menya, there may be a lack of exposure to the UN and its work, and as a working-class individual, my focus may be more on day-to-day survival rather than international affairs. Additionally, my experience and education level may not have provided me with a deep understanding of the UN's work. Therefore, I would likely have limited confidence in the United Nations. \n\n3"]}, {"persona": {"region": "Menya", "sex": "male", "age": 27, "country": "Egypt", "marital_status": "single", "education": "middle", "social_class": "lower middle class"}, "question": {"id": "Q83", "variant": 0}, "response": ["Based on the anthropological framework, as a single male from Menya, Egypt, my emic perspective is influenced by my cultural context, lower middle class socioeconomic background, and middle level education. My personal experience and individual values also play a role in shaping my opinion. Considering the historical and political context of Egypt, where the UN has been involved in various international issues, I have some confidence in the United Nations, but not a great deal. Additionally, the nuance of the question also leads me to choose \"Not very much\" as my answer.\n3"]}, {"persona": {"region": "Asyut", "sex": "male", "age": 30, "country": "Egypt", "marital_status": "married", "education": "middle", "social_class": "working class"}, "question": {"id": "Q83", "variant": 0}, "response": ["Based on the anthropological framework, as a married male from Asyut, Egypt, my emic perspective is influenced by my cultural context, individual values, and socioeconomic background. As a member of the working class with a middle education level, I may have limited exposure to international affairs and the role of the United Nations. My personal experience and socioeconomic background may lead me to have less confidence in the United Nations, as I may feel disconnected from its actions and decisions. Additionally, cultural relativism plays a role, as my perspective may be influenced by the cultural and political context of Egypt. Therefore, my choice is (3) Not very much"]}, {"persona": {"region": "Asyut", "sex": "female", "age": 26, "country": "Egypt", "marital_status": "married", "education": "middle", "social_class": "working class"}, "question": {"id": "Q83", "variant": 0}, "response": ["Based on the anthropological framework, my perspective as a married female from Asyut, Egypt, who is 26 years old and part of the working class, is heavily influenced by my cultural context, individual values, and socioeconomic background. As a woman in Egypt, my cultural context and socioeconomic background have likely shaped my experiences and perceptions of the UN. Additionally, my individual values and personal experiences in the working class may influence my confidence in the UN's ability to address issues that affect me and my community. Therefore, my answer to the question is:\n\n2"]}, {"persona": {"region": "Asyut", "sex": "male", "age": 32, "country": "Egypt", "marital_status": "single", "education": "higher", "social_class": "lower middle class"}, "question": {"id": "Q83", "variant": 0}, "response": ["Based on the anthropological framework, as a single male from Asyut, Egypt, who is 32 years old and part of the lower middle class, my answer to the question of how much confidence I have in the United Nations would be influenced by my individual values and personal experience. Growing up in Asyut, I have personally experienced the impact of socioeconomic disparities and political instability, which may lead me to have a more critical view of international organizations like the UN. Additionally, my cultural context and socioeconomic background may also influence my response, as I may feel that the UN does not adequately address the needs and concerns of individuals from lower middle class backgrounds like mine. Therefore, my perspective may lead me to choose option 3 - Not very much - as my level of confidence in the United Nations.\n\n3"]}, {"persona": {"region": "Asyut", "sex": "female", "age": 21, "country": "Egypt", "marital_status": "married", "education": "middle", "social_class": "working class"}, "question": {"id": "Q83", "variant": 0}, "response": ["Based on the anthropological framework, my perspective as a married female from Asyut, Egypt, at the age of 21 and part of the working class, is heavily influenced by my cultural context, socioeconomic background, and personal experience. As someone from a lower socioeconomic background, I have limited exposure to the workings of international organizations like the United Nations. My cultural context also shapes my view, as I may have been taught to be skeptical of external influences. Therefore, my confidence in the United Nations is not very much. (3) Not very much"]}, {"persona": {"region": "Asyut", "sex": "female", "age": 30, "country": "Egypt", "marital_status": "married", "education": "higher", "social_class": "working class"}, "question": {"id": "Q83", "variant": 0}, "response": ["Based on my personal experience and cultural context, as a married female from Asyut, Egypt, who is part of the working class and has completed higher education, I have been exposed to a variety of perspectives on the United Nations. My socioeconomic background and cultural relativism lead me to have quite a lot of confidence in the United Nations. I understand the importance of global collaboration and the role that the UN plays in addressing various issues that impact people around the world. Additionally, my age and place of residence have allowed me to witness the positive impact of UN initiatives in my community. Therefore, I believe that the United Nations is an essential institution for addressing global challenges and promoting peace and cooperation.\n\n2"]}, {"persona": {"region": "Asyut", "sex": "female", "age": 42, "country": "Egypt", "marital_status": "married", "education": "higher", "social_class": "lower middle class"}, "question": {"id": "Q83", "variant": 0}, "response": ["From the perspective of a married woman from Asyut, Egypt, who is 42 years old, has completed higher education, and considers herself part of the lower middle class, it is important to consider the cultural context, individual values, and socioeconomic background in answering this question. The cultural context in Egypt, particularly in Asyut, may influence the level of confidence in the United Nations, as there may be a perception of the UN's effectiveness based on past experiences or interactions with UN programs or initiatives in the region. Additionally, individual values and personal experiences may play a significant role in shaping one's perception of the UN, as the persona's education and socioeconomic background may impact her awareness and understanding of international affairs. Considering these factors, the persona may have (3) Not very much confidence in the United Nations. \n\n3"]}, {"persona": {"region": "Sohag", "sex": "male", "age": 63, "country": "Egypt", "marital_status": "married", "education": "middle", "social_class": "lower middle class"}, "question": {"id": "Q83", "variant": 0}, "response": ["From my perspective as a married male from Sohag, Egypt, with a middle education level and part of the lower middle class, my answer to the question about confidence in the United Nations (UN) would be influenced by my cultural context, individual values, and socioeconomic background. The cultural context in Sohag emphasizes the importance of community and the collective well-being, which aligns with the goals of the UN. Additionally, my individual values prioritize peace, stability, and international cooperation, which are also values promoted by the UN. However, my lower middle class socioeconomic background may lead me to have some skepticism about the effectiveness of the UN in addressing the specific needs and challenges faced by people in my community. Therefore, my answer to the question would be:\n\n2"]}, {"persona": {"region": "Sohag", "sex": "male", "age": 27, "country": "Egypt", "marital_status": "married", "education": "middle", "social_class": "working class"}, "question": {"id": "Q83", "variant": 0}, "response": ["Based on the anthropological framework, as a married male from Sohag, Egypt, with a middle education level and working-class background, my perspective on the United Nations (UN) is heavily influenced by cultural context, individual values, and socioeconomic background. In my cultural context, the UN may have limited visibility and impact on my day-to-day life, as local issues and government policies may have a more immediate influence. Additionally, my individual values and personal experience may lead me to have reservations about the UN, as I may perceive it as an organization dominated by more powerful nations, with limited representation or relevance for individuals like myself. Furthermore, my working-class background may lead me to prioritize more immediate concerns related to employment, income, and access to basic resources, potentially impacting my confidence in the UN's ability to address these issues effectively. Therefore, my response to the question would be:\n\n3. Not very much"]}, {"persona": {"region": "Sohag", "sex": "male", "age": 56, "country": "Egypt", "marital_status": "married", "education": "higher", "social_class": "upper middle class"}, "question": {"id": "Q83", "variant": 0}, "response": ["Based on the anthropological framework, as a 56-year-old married male from Sohag, Egypt, with a higher education level and a member of the upper middle class, my emic perspective on the United Nations (UN) is likely to be influenced by my cultural context, individual values, and personal experience. Egypt has a long history of involvement with the UN and its agencies, and as an educated individual, I am likely to have a nuanced understanding of the UN's work and impact. Additionally, my socioeconomic background may lead me to have a more positive view of the UN, as it is often associated with international cooperation and development efforts that could benefit my community. Therefore, I would choose option 2) Quite a lot, as I have confidence in the UN's ability to address global challenges and make a positive impact."]}, {"persona": {"region": "Sohag", "sex": "male", "age": 51, "country": "Egypt", "marital_status": "married", "education": "higher", "social_class": "lower middle class"}, "question": {"id": "Q83", "variant": 0}, "response": ["Based on the anthropological framework, as a married male from Sohag, Egypt, I would approach the question of confidence in the United Nations (UN) through the lens of cultural context, individual values, and socioeconomic background. In Sohag, there is a deep sense of community and reliance on local institutions, so my perspective on international organizations like the UN might be influenced by this. Additionally, my lower middle-class status and higher education level may lead me to value diplomacy and global cooperation, but also be critical of the effectiveness of international organizations in addressing the needs of people in my community. Therefore, my answer to the question would reflect these considerations.\n\n2"]}, {"persona": {"region": "Sohag", "sex": "female", "age": 26, "country": "Egypt", "marital_status": "married", "education": "higher", "social_class": "working class"}, "question": {"id": "Q83", "variant": 0}, "response": ["Based on the anthropological framework, my perspective as a married female from Sohag, Egypt, is influenced by my cultural context, individual values, and socioeconomic background. As part of the working class in a rural area, my access to information and exposure to international organizations like the United Nations may be limited. Additionally, my personal experiences and values may shape my perception of the UN. Given these factors, I may have limited confidence in the United Nations, as I may not feel directly impacted by their work or have access to their resources. My understanding of cultural relativism also informs my perspective, as I recognize that my viewpoint may differ from others based on their own unique circumstances and experiences. \n\n3"]}, {"persona": {"region": "Sohag", "sex": "female", "age": 29, "country": "Egypt", "marital_status": "married", "education": "higher", "social_class": "upper middle class"}, "question": {"id": "Q83", "variant": 0}, "response": ["In considering the question of how much confidence I have in the United Nations (UN), it is important to take into account my cultural context as a married female from Sohag, Egypt. My age, education level, and socioeconomic background as part of the upper middle class all play a role in shaping my perceptions. Additionally, my personal experiences and values contribute to my understanding of international organizations like the UN. In the context of cultural relativism, I understand the importance of the UN in addressing global issues, but I also recognize its limitations and the complexities of international politics. My nuanced perspective leads me to select the option \"Quite a lot\" as my answer, as I believe the UN plays a significant role in promoting peace and cooperation among nations, even though it may not always be perfect in its execution. \n\n2"]}, {"persona": {"region": "Sohag", "sex": "male", "age": 51, "country": "Egypt", "marital_status": "married", "education": "middle", "social_class": "lower middle class"}, "question": {"id": "Q83", "variant": 0}, "response": ["Based on the anthropological framework, my perspective as a married male from Sohag, Egypt, who is 51 years old and considers himself part of the lower middle class, is heavily influenced by my cultural context, individual values, and socioeconomic background. In Sohag, there is a general sense of skepticism towards international organizations like the United Nations, as they are often seen as being disconnected from the daily struggles and needs of the people in my community. Additionally, my lower middle class status means that I may feel marginalized and overlooked by larger global institutions, which could lead to a lack of confidence in the UN's ability to address the issues that are important to me and my community. Furthermore, my personal experiences and values have also shaped my perception, leading me to question the effectiveness and relevance of the UN in addressing the specific challenges faced by individuals like myself. Therefore, I would select option (3) Not very much."]}, {"persona": {"region": "Qena", "sex": "male", "age": 32, "country": "Egypt", "marital_status": "single", "education": "middle", "social_class": "working class"}, "question": {"id": "Q83", "variant": 0}, "response": ["Based on my cultural context, as a working-class male from Qena, Egypt, I have limited exposure to the United Nations and its work. My socioeconomic background and middle education level have not provided me with much opportunity to engage with the UN or understand its impact on my life. Additionally, my age and place of residence have limited my exposure to international affairs. Therefore, I would have to say that I have not very much confidence in the United Nations. \n\n3"]}, {"persona": {"region": "Qena", "sex": "male", "age": 54, "country": "Egypt", "marital_status": "married", "education": "middle", "social_class": "lower middle class"}, "question": {"id": "Q83", "variant": 0}, "response": ["From the perspective of a married male from Qena, Egypt, who is 54 years old, has completed middle education, and considers himself part of the lower middle class, my answer to the question of how much confidence I have in the United Nations (UN) is influenced by various factors. My cultural context and individual values lead me to have quite a lot of confidence in the UN, as I see it as an institution that strives to promote peace and security globally. Additionally, my socioeconomic background and personal experience have shaped my perception of the UN as an organization that provides aid and support to countries in need, which further increases my confidence in its capabilities. My age and place also play a role, as I have witnessed the positive impact of UN initiatives in my community. Therefore, my answer is 2) Quite a lot."]}, {"persona": {"region": "Qena", "sex": "male", "age": 25, "country": "Egypt", "marital_status": "single", "education": "lower", "social_class": "lower class"}, "question": {"id": "Q83", "variant": 0}, "response": ["From my perspective as a single male from Qena, Egypt, with a lower socioeconomic background and limited education, my understanding and perception of the United Nations is influenced by my cultural context, individual values, and personal experience. As someone from a lower class background, I may have limited exposure to international organizations like the UN and may not have had direct experiences with their work. Additionally, my personal values and experiences may lead me to be more focused on immediate local issues rather than global affairs. Therefore, I may not have much confidence in the United Nations as I feel its impact is not directly felt in my daily life.\n\n3"]}, {"persona": {"region": "Aswan", "sex": "male", "age": 34, "country": "Egypt", "marital_status": "single", "education": "middle", "social_class": "lower class"}, "question": {"id": "Q83", "variant": 0}, "response": ["Based on the anthropological framework, as a single male from Aswan, Egypt, who considers himself part of the lower class, my emic perspective would be influenced by my personal experience and socioeconomic background. As someone with a middle education level and limited access to resources, I may feel marginalized and distrustful of large international organizations like the United Nations. My etic perspective would also be shaped by the cultural context of Egypt and the historical interactions between the UN and the country. Therefore, I would choose:\n3. Not very much"]}, {"persona": {"region": "Aswan", "sex": "female", "age": 31, "country": "Egypt", "marital_status": "married", "education": "middle", "social_class": "lower middle class"}, "question": {"id": "Q83", "variant": 0}, "response": ["Based on the anthropological framework, my perspective as a married female from Aswan, Egypt, with a middle education level and part of the lower middle class, is influenced by my cultural context, individual values, and socioeconomic background. As a member of a community that has historically experienced marginalization and limited access to resources, I have a nuanced understanding of the role of international organizations like the United Nations in addressing global issues. While I value the potential impact of the UN in promoting peace and development, my personal experience and socioeconomic background lead me to have some skepticism about its effectiveness in addressing the specific needs of communities like mine. Therefore, I would choose option (3) Not very much.\n\n3"]}, {"persona": {"region": "Aswan", "sex": "female", "age": 39, "country": "Egypt", "marital_status": "married", "education": "middle", "social_class": "working class"}, "question": {"id": "Q83", "variant": 0}, "response": ["Based on my emic perspective as a married female from Aswan, Egypt, I have been influenced by my cultural context, individual values and personal experience, and socioeconomic background. As a working-class woman who has completed middle education, I have been exposed to the struggles and challenges faced by people in similar socioeconomic positions. My cultural context and personal experience have also led me to view the United Nations as an organization that may not fully understand or address the needs of individuals like myself. Therefore, I have chosen the option:\n3"]}, {"persona": {"region": "Qena", "sex": "female", "age": 27, "country": "Egypt", "marital_status": "married", "education": "lower", "social_class": "lower middle class"}, "question": {"id": "Q83", "variant": 0}, "response": ["Based on my cultural context and socioeconomic background, I have limited exposure to the activities and impact of the United Nations. My lower education level and lower middle-class status have meant that I have not had the opportunity to engage with global organizations such as the UN. Additionally, my personal experience and individual values have not led me to have a great deal of confidence in the UN, as I have not seen direct benefits or impact from their work in my community. Therefore, I would select option (3) Not very much."]}, {"persona": {"region": "Qena", "sex": "male", "age": 40, "country": "Egypt", "marital_status": "single", "education": "middle", "social_class": "lower middle class"}, "question": {"id": "Q83", "variant": 0}, "response": ["From the perspective of a single male from Qena, Egypt, who is 40 years old, has completed middle education, and considers himself part of the lower middle class, several factors will influence my level of confidence in the United Nations (UN). The emic perspective from my cultural context would suggest that my trust in international organizations like the UN may be influenced by the historical relationship between Egypt and the UN, as well as the perceived impact of UN interventions in the region. My individual values and personal experience may also play a role, as I may have personal experiences or exposure to information that shapes my perception of the UN. Additionally, my socioeconomic background may lead me to prioritize issues related to economic development and social welfare, which could impact my level of confidence in the UN. Considering these factors, I would choose option 3) Not very much, as I may have reservations about the effectiveness and impact of the UN in addressing the specific needs and challenges faced by individuals in my community."]}, {"persona": {"region": "Qena", "sex": "male", "age": 30, "country": "Egypt", "marital_status": "single", "education": "middle", "social_class": "working class"}, "question": {"id": "Q83", "variant": 0}, "response": ["Based on my individual values and personal experience, as a working-class male from Qena, Egypt, I have limited exposure to the United Nations and its work. My socioeconomic background and educational level also play a role in my perception, as I have not had much opportunity to interact with or benefit from the UN's programs. Additionally, the cultural context of Egypt and the Middle East in general may influence my understanding and opinion of the UN. Therefore, I would say \"Not very much\" confidence in the United Nations.\n\n3"]}]