[{"persona": {"region": "Fayoum", "sex": "male", "age": 46, "country": "Egypt", "marital_status": "married", "education": "higher", "social_class": "lower middle class"}, "question": {"id": "Q235", "variant": 0}, "response": ["Based on my individual values and personal experience, as well as my cultural context, I believe that a political system with a strong leader who does not have to bother with parliament and elections would be fairly bad. In Egypt, we have experienced strong leaders in the past who have not always had the best interests of the people in mind. Additionally, as a member of the lower middle class, I understand the importance of having checks and balances in government to ensure that the needs of all citizens are being considered. Furthermore, cultural relativism teaches us that there is no hierarchy of culture and that different political systems work for different societies, but in my personal context, I believe that such a system would not be beneficial for the people. \n\n3"]}, {"persona": {"region": "Fayoum", "sex": "female", "age": 30, "country": "Egypt", "marital_status": "married", "education": "middle", "social_class": "lower middle class"}, "question": {"id": "Q235", "variant": 0}, "response": ["Based on my cultural context and socioeconomic background, I believe that a political system with a strong leader who does not have to bother with parliament and elections can be very beneficial. In my experience, a strong leader can bring stability and security to our community, which is important for the lower middle class like myself. I also value the authority and decisiveness that a strong leader can bring, as it can help address the challenges we face in our daily lives. Additionally, considering the nuance of the question, I believe that a strong leader who is genuinely interested in the well-being of the people can make a positive impact. Therefore, my opinion on this political system is (1) Very good."]}, {"persona": {"region": "Fayoum", "sex": "male", "age": 60, "country": "Egypt", "marital_status": "married", "education": "higher", "social_class": "working class"}, "question": {"id": "Q235", "variant": 0}, "response": ["Based on the anthropological framework, as a married male from Fayoum, Egypt who is 60 years old and part of the working class, my answer would be influenced by my cultural context, individual values, socioeconomic background, and space and time. In Egypt, there is a history of strong leaders and a political system without much emphasis on parliament and elections. My personal experience and values may lead me to view a strong leader as necessary for stability and progress, especially considering the socioeconomic challenges faced by the working class. Additionally, my age and the historical context of Egypt would also shape my perspective on this issue. Therefore, my opinion would be:\n\n2. Fairly good"]}, {"persona": {"region": "Fayoum", "sex": "male", "age": 20, "country": "Egypt", "marital_status": "single", "education": "middle", "social_class": "lower middle class"}, "question": {"id": "Q235", "variant": 0}, "response": ["From my emic perspective as a single male from Fayoum, Egypt, I know that our cultural context values strong leadership and stability. My individual values and personal experience have taught me to prioritize security and stability in our society, and I understand that our socioeconomic background as part of the lower middle class often means that we face economic challenges and may feel disconnected from the political process. Additionally, considering the space and time in which I live, I am aware that our country has a long history of centralized leadership. Therefore, I believe that a political system with a strong leader who does not have to bother with parliament and elections could provide the stability and direction that our society needs. \n\n2"]}, {"persona": {"region": "Fayoum", "sex": "female", "age": 39, "country": "Egypt", "marital_status": "married", "education": "higher", "social_class": "lower middle class"}, "question": {"id": "Q235", "variant": 0}, "response": ["Based on the anthropological framework, my response is influenced by my emic perspective as a woman from Fayoum, Egypt, my cultural context, individual values, and socioeconomic background. In Egyptian culture, there is a strong emphasis on respect for authority and leadership. Additionally, as a member of the lower middle class, I may have experienced challenges with the political system in the past and may feel that a strong leader who does not have to bother with parliament and elections could potentially provide stability and direction for the country. This perspective is also shaped by my personal experiences and values, as well as the nuance of the question, which implies that the current political system may not be working effectively. Therefore, my opinion aligns with option (2) Fairly good. \n\n2"]}, {"persona": {"region": "Fayoum", "sex": "male", "age": 33, "country": "Egypt", "marital_status": "married", "education": "higher", "social_class": "working class"}, "question": {"id": "Q235", "variant": 0}, "response": ["Based on the anthropological framework, my opinion on a political system with a strong leader who does not have to bother with parliament and elections is shaped by my individual values and personal experience, as well as my socioeconomic background and cultural context. As a married male from Fayoum, Egypt, I come from a working-class background and have completed higher education. In Egypt, there is a historical and cultural context of strong leadership, and my personal experience has shown me the challenges faced by the working class. Therefore, I believe that a political system with a strong leader who does not have to bother with parliament and elections would be fairly bad for the working class and for the overall democratic process in Egypt.\n\n3"]}, {"persona": {"region": "Port Said", "sex": "female", "age": 45, "country": "Egypt", "marital_status": "married", "education": "higher", "social_class": "lower middle class"}, "question": {"id": "Q235", "variant": 0}, "response": ["Based on the anthropological framework, my perspective as a married female from Port Said, Egypt, is heavily influenced by my cultural context, individual values, and socioeconomic background. In Egypt, there is a strong emphasis on patriarchal leadership and respect for authority, which may lead me to view a political system with a strong leader as a positive attribute. Additionally, my lower middle class status may lead me to prioritize stability and security, which could be perceived as being provided by a strong leader. However, my higher education level may also lead me to value democratic principles and individual freedoms. Therefore, my opinion on a political system with a strong leader who does not have to bother with parliament and elections may be influenced by a combination of these factors. \n\n2"]}, {"persona": {"region": "Port Said", "sex": "male", "age": 42, "country": "Egypt", "marital_status": "married", "education": "middle", "social_class": "lower middle class"}, "question": {"id": "Q235", "variant": 0}, "response": ["Based on the anthropological framework, my opinion on a political system with a strong leader who does not have to bother with parliament and elections is influenced by my cultural context in Port Said, Egypt. The historical and cultural background of Egypt includes a long history of authoritarian rule, and many people in my community have experienced economic hardships and political instability. Additionally, my lower middle class socioeconomic background and limited education level may lead me to value stability and order over the potential chaos of frequent elections and parliamentary debates. My individual values and personal experience also play a role in my opinion, as I may have seen firsthand the challenges of governance in a diverse and rapidly changing society. Overall, my perspective on this political system is shaped by a combination of cultural, socioeconomic, and personal factors, leading me to choose option (2) Fairly good, as I may believe that a strong leader could bring much-needed stability and direction to the country. \n\n2"]}, {"persona": {"region": "Port Said", "sex": "male", "age": 28, "country": "Egypt", "marital_status": "single", "education": "middle", "social_class": "lower middle class"}, "question": {"id": "Q235", "variant": 0}, "response": ["As a single male from Port Said, Egypt, who has completed middle education and considers myself part of the lower middle class, my perspective is heavily influenced by my cultural context and socioeconomic background. In Egypt, there has historically been a strong emphasis on centralized leadership and authority, and many people in my community have experienced the challenges of political instability and uncertainty. Additionally, being part of the lower middle class, I am aware of the economic struggles that many people face, and I can see how a strong leader might be able to implement policies that could potentially benefit those in similar economic situations. However, I also recognize the importance of having a voice in the political process and the potential for abuse of power in a system without checks and balances. Therefore, my opinion would be fairly good, as I can see potential benefits but also acknowledge the potential drawbacks. \n\n2"]}, {"persona": {"region": "Port Said", "sex": "female", "age": 30, "country": "Egypt", "marital_status": "married", "education": "higher", "social_class": "lower middle class"}, "question": {"id": "Q235", "variant": 0}, "response": ["Based on the anthropological framework, my opinion on a political system with a strong leader who does not have to bother with parliament and elections is influenced by my emic perspective as a married female from Port Said, Egypt. The cultural context of Egypt, with its history of authoritarian leadership, shapes my understanding of political systems. Additionally, my individual values and personal experience as a lower middle class woman who has experienced the impact of political decisions on my family's socioeconomic background also play a significant role in my opinion. Furthermore, the concept of cultural relativism reminds me that my perspective may differ from others due to my age and place in society. Therefore, my opinion on this political system is fairly bad.\n\n3"]}, {"persona": {"region": "Port Said", "sex": "male", "age": 30, "country": "Egypt", "marital_status": "divorced", "education": "middle", "social_class": "lower middle class"}, "question": {"id": "Q235", "variant": 0}, "response": ["As a divorced male from Port Said, Egypt, my perspective is heavily influenced by my cultural context, socioeconomic background, and personal experience. Coming from a lower middle-class background and having completed only middle education, I have experienced the challenges and struggles faced by individuals in my community. The political system with a strong leader who does not have to bother with parliament and elections may seem very good to me because it could potentially bring stability and swift decision-making, which I believe could benefit the country and improve our socioeconomic conditions. Additionally, the cultural context in Egypt may value strong leadership and authority, which could influence my perspective on this political system. \n\n1"]}, {"persona": {"region": "Port Said", "sex": "female", "age": 19, "country": "Egypt", "marital_status": "single", "education": "middle", "social_class": "lower middle class"}, "question": {"id": "Q235", "variant": 0}, "response": ["Based on the anthropological framework, my perspective on a political system with a strong leader who does not have to bother with parliament and elections is influenced by my cultural context, individual values, and socioeconomic background. As a young woman from Port Said, Egypt, I have been raised in a society where democratic values and principles are highly valued. Additionally, my lower middle class status means that I am directly affected by governmental decisions, and a system without checks and balances could potentially lead to further marginalization of individuals like myself. Therefore, I believe that such a political system would be fairly bad for the overall well-being and representation of the people.\n\n3"]}, {"persona": {"region": "Fayoum", "sex": "male", "age": 40, "country": "Egypt", "marital_status": "married", "education": "middle", "social_class": "working class"}, "question": {"id": "Q235", "variant": 0}, "response": ["Based on the anthropological framework, as a married male from Fayoum, Egypt, my emic perspective is influenced by my cultural context, individual values and personal experience, socioeconomic background, and space and time. In Egypt, there is a history of strong leadership and a centralized political system. My experience and values as part of the working class in a middle education level have shaped my understanding of the need for stability and strong leadership. Additionally, my cultural context emphasizes the importance of authority and order. Therefore, I believe that a political system with a strong leader who does not have to bother with parliament and elections could be very good for ensuring stability and progress in the country. \n\n1"]}, {"persona": {"region": "Fayoum", "sex": "male", "age": 23, "country": "Egypt", "marital_status": "single", "education": "higher", "social_class": "lower middle class"}, "question": {"id": "Q235", "variant": 0}, "response": ["Based on my experience and cultural context as a single male from Fayoum, Egypt, I have been exposed to a political system with a strong leader who does not have to bother with parliament and elections. My socioeconomic background also plays a role in shaping my opinion, as I consider myself part of the lower middle class. Considering the emic and etic perspectives, the cultural relativism, and the individual values and personal experience, I believe that a political system with a strong leader who does not have to bother with parliament and elections is fairly bad. This opinion is shaped by the nuanced phrasing of the question and the understanding of space and time within my cultural context.\n\n3"]}, {"persona": {"region": "Fayoum", "sex": "female", "age": 38, "country": "Egypt", "marital_status": "married", "education": "middle", "social_class": "lower middle class"}, "question": {"id": "Q235", "variant": 0}, "response": ["Based on the anthropological framework, my opinion on a political system with a strong leader who does not have to bother with parliament and elections is heavily influenced by my cultural context, individual values, and socioeconomic background. As a married female from Fayoum, Egypt, I have experienced the impact of political decisions on my daily life and the lives of those around me. My lower middle class status means that I may have different priorities and concerns compared to those in higher socioeconomic brackets. Additionally, my age and education level have shaped my understanding of political systems and leadership. Therefore, I believe that a political system with a strong leader who bypasses parliamentary processes and elections can be very detrimental to the voices and needs of individuals like me, who may not have the same access to resources and opportunities as others. \n\n3"]}, {"persona": {"region": "Fayoum", "sex": "male", "age": 32, "country": "Egypt", "marital_status": "married", "education": "middle", "social_class": "lower middle class"}, "question": {"id": "Q235", "variant": 0}, "response": ["Based on the anthropological framework, my perspective as a married male from Fayoum, Egypt, is heavily influenced by my cultural context, socioeconomic background, and individual values. In Egypt, there is a strong emphasis on traditional family values and respect for authority. Additionally, as a member of the lower middle class, I may have concerns about economic stability and social order. Therefore, I may view a political system with a strong leader who does not have to bother with parliament and elections as fairly good, as it may provide stability and security for my family and community.\n\n2"]}, {"persona": {"region": "Fayoum", "sex": "male", "age": 31, "country": "Egypt", "marital_status": "married", "education": "higher", "social_class": "working class"}, "question": {"id": "Q235", "variant": 0}, "response": ["Based on the anthropological framework, as a married male from Fayoum, Egypt, I would approach the question from the perspective of my cultural context, socioeconomic background, and individual values. In Egyptian culture, there is a strong emphasis on respect for authority and tradition. Additionally, as a member of the working class, I may have experienced economic instability and could potentially see a strong leader as someone who could bring stability and economic growth. However, I also value personal freedoms and the ability to have a say in the decision-making processes that affect my life. Therefore, I would consider a political system with a strong leader who does not have to bother with parliament and elections to be fairly good.\n\n2"]}, {"persona": {"region": "Fayoum", "sex": "male", "age": 31, "country": "Egypt", "marital_status": "married", "education": "middle", "social_class": "lower middle class"}, "question": {"id": "Q235", "variant": 0}, "response": ["Based on the anthropological framework, my perspective as a married male from Fayoum, Egypt, at 31 years of age with a middle education level and from the lower middle class, is shaped by my cultural context, individual values, and socioeconomic background. In Egypt, there is a strong emphasis on traditional family structures and a hierarchical society, where authority figures are highly respected. Additionally, my lower middle class background may lead me to prioritize stability and security over democratic processes, as a strong leader could potentially provide a sense of order and economic progress. However, my personal experience and nuanced understanding also lead me to recognize the potential for abuse of power and limited representation of diverse voices in a system without checks and balances. Therefore, my opinion on a political system with a strong leader who does not have to bother with parliament and elections is fairly good, as long as there are mechanisms in place to ensure accountability and representation of the people's needs.\n\n2"]}, {"persona": {"region": "Fayoum", "sex": "female", "age": 32, "country": "Egypt", "marital_status": "married", "education": "middle", "social_class": "lower middle class"}, "question": {"id": "Q235", "variant": 0}, "response": ["Based on the anthropological framework, my perspective on the political system with a strong leader who does not have to bother with parliament and elections is influenced by my cultural context, individual values, and socioeconomic background. As a married female from Fayoum, Egypt, I have been raised in a society where the cultural context values strong leadership and stability. Additionally, my lower middle class socioeconomic background may lead me to believe that a strong leader could potentially bring about economic security and stability for my family. However, my individual values and personal experience also play a role, as I have seen the negative effects of authoritarian rule and lack of political representation in my community. Therefore, my opinion on this political system is fairly good (2).\n\n2"]}, {"persona": {"region": "Ismailia", "sex": "male", "age": 53, "country": "Egypt", "marital_status": "married", "education": "middle", "social_class": "lower middle class"}, "question": {"id": "Q235", "variant": 0}, "response": ["From my perspective as a married male from Ismailia, Egypt, who is 53 years old and part of the lower middle class, I must consider the cultural context, individual values, and socioeconomic background in forming my opinion on a political system with a strong leader who does not have to bother with parliament and elections. In my cultural context, there is a strong emphasis on collective decision-making and the importance of community participation in governance. As an individual, I value the idea of having a voice in the political process and believe that everyone should have the opportunity to participate in shaping the future of our country. Additionally, my lower middle class socioeconomic background has made me acutely aware of the importance of having checks and balances in the political system to ensure that the needs and concerns of all citizens are taken into account. Therefore, my opinion on a political system with a strong leader who does not have to bother with parliament and elections is:\n\n3"]}, {"persona": {"region": "Ismailia", "sex": "male", "age": 38, "country": "Egypt", "marital_status": "married", "education": "higher", "social_class": "working class"}, "question": {"id": "Q235", "variant": 0}, "response": ["Based on the anthropological framework, as a married male from Ismailia, Egypt, with a working-class background, my perspective on a political system with a strong leader who does not have to bother with parliament and elections is heavily influenced by my cultural context and socioeconomic background. In Egypt, there has historically been a strong emphasis on centralized authority and leadership, and many working-class individuals may see a strong leader as providing stability and order. However, my personal experience and individual values also play a role, as I have likely witnessed the effects of authoritarian rule on my community and may have a nuanced understanding of the potential drawbacks. Additionally, the nuanced phrasing of the question could also lead me to lean towards a particular answer.\n\n3"]}, {"persona": {"region": "Ismailia", "sex": "female", "age": 35, "country": "Egypt", "marital_status": "married", "education": "middle", "social_class": "lower middle class"}, "question": {"id": "Q235", "variant": 0}, "response": ["Based on my emic perspective as a married female from Ismailia, Egypt, with a lower middle-class socioeconomic background, my opinion on a political system with a strong leader who does not have to bother with parliament and elections is influenced by my cultural context and personal experience. In Egypt, we have experienced both authoritarian and democratic political systems, and I have seen the impact they have had on my community and family. Additionally, I understand the importance of cultural relativism and the nuances of political power dynamics in my country. Considering these factors, I believe that a political system with a strong leader who does not have to bother with parliament and elections (3) Fairly bad."]}, {"persona": {"region": "Ismailia", "sex": "female", "age": 57, "country": "Egypt", "marital_status": "married", "education": "lower", "social_class": "working class"}, "question": {"id": "Q235", "variant": 0}, "response": ["Based on the anthropological framework, as a married female from Ismailia, Egypt, my emic perspective is influenced by my cultural context, individual values, and socioeconomic background. In my community, there is a strong emphasis on traditional family values and respect for authority. However, my lower education level and working-class status may lead me to have a more nuanced understanding of the political system. I may view a strong leader as someone who can bring stability and security, but I also recognize the potential for abuse of power and lack of representation for the working class. Therefore, my opinion on a political system with a strong leader who does not have to bother with parliament and elections would be:\n\n3\n\nFairly bad"]}, {"persona": {"region": "Ismailia", "sex": "male", "age": 33, "country": "Egypt", "marital_status": "married", "education": "middle", "social_class": "lower middle class"}, "question": {"id": "Q235", "variant": 0}, "response": ["As a married male from Ismailia, Egypt, my perspective on a political system with a strong leader who does not have to bother with parliament and elections is influenced by my cultural context, individual values, socioeconomic background, and space and time. In the cultural context of Egypt, there has historically been a strong centralized leadership, and the idea of a strong leader may resonate with some traditional values. Additionally, as someone from the lower middle class, I may have experienced socioeconomic challenges and may perceive a strong leader as someone who can bring stability and economic growth. However, I also value personal freedoms and the ability to have a say in the political process, which is why I lean towards the option (3) Fairly bad. This is because I believe that a political system without checks and balances can lead to abuse of power and a lack of representation for the people."]}, {"persona": {"region": "Ismailia", "sex": "female", "age": 49, "country": "Egypt", "marital_status": "single", "education": "higher", "social_class": "upper middle class"}, "question": {"id": "Q235", "variant": 0}, "response": ["Based on the anthropological framework described above, my opinion on a political system with a strong leader who does not have to bother with parliament and elections would be influenced by my emic perspective as a single female from Ismailia, Egypt, my high level of education, and my socio-economic background as part of the upper middle class. Additionally, my age and cultural context in Egypt would also play a role in forming my opinion. From this perspective, I would choose:\n\n2"]}, {"persona": {"region": "Ismailia", "sex": "female", "age": 35, "country": "Egypt", "marital_status": "married", "education": "higher", "social_class": "lower middle class"}, "question": {"id": "Q235", "variant": 0}, "response": ["Based on the anthropological framework, my Emic perspective as a married female from Ismailia, Egypt is heavily influenced by my cultural context, individual values, socioeconomic background, and personal experiences. The Egyptian culture values strong leadership and stability, and my lower middle class status means that I may benefit from policies that prioritize economic development and social stability. Additionally, my age and education level may lead me to believe that a strong leader could bring about positive change much faster than a system with more checks and balances. Therefore, my perspective on a political system with a strong leader who does not have to bother with parliament and elections would be:\n\n2"]}, {"persona": {"region": "Ismailia", "sex": "male", "age": 24, "country": "Egypt", "marital_status": "single", "education": "higher", "social_class": "upper middle class"}, "question": {"id": "Q235", "variant": 0}, "response": ["From an emic perspective, as a single male from Ismailia, Egypt, with a higher education level and considering myself part of the upper middle class, I have been raised in a cultural context that values stability and authority. My individual values and personal experience have shaped my perception of a political system with a strong leader. Additionally, my socioeconomic background has afforded me certain privileges and opportunities that may influence my opinion. I also understand the importance of cultural relativism and recognize that my perspective may differ from others based on their own experiences and backgrounds. Taking into account the nuanced phrasing of the question, I believe that a political system with a strong leader who does not have to bother with parliament and elections could be beneficial for the country's stability and progress.\n\n2"]}, {"persona": {"region": "Ismailia", "sex": "female", "age": 23, "country": "Egypt", "marital_status": "single", "education": "higher", "social_class": "lower middle class"}, "question": {"id": "Q235", "variant": 0}, "response": ["From the emic perspective of a single female from Ismailia, Egypt, who is 23 years old and part of the lower middle class, the cultural context and socioeconomic background play a significant role in shaping my opinion on a political system with a strong leader who does not have to bother with parliament and elections. Given the history and current political climate in Egypt, where there has been a long-standing presence of authoritarian rule, the idea of a strong leader with unchecked power may not be viewed favorably. Additionally, my personal values and experiences, along with the understanding of cultural relativism, lead me to believe that such a system may not be conducive to the promotion of individual rights and freedoms. Considering the nuanced phrasing of the question and the nuances of the political landscape in Egypt, my opinion would align with option (3) Fairly bad. \n\n3"]}, {"persona": {"region": "Ismailia", "sex": "male", "age": 55, "country": "Egypt", "marital_status": "married", "education": "middle", "social_class": "lower middle class"}, "question": {"id": "Q235", "variant": 0}, "response": ["Based on my cultural context and socio-economic background, I have experienced the challenges of being part of the lower middle class in Ismailia, Egypt. My personal values and experiences have shaped my understanding of the importance of a political system that takes into account the needs and voices of all individuals, regardless of their socioeconomic status. Additionally, cultural relativism has taught me to appreciate the diversity of perspectives and the need for inclusive decision-making processes. Therefore, I believe that a political system with a strong leader who does not have to bother with parliament and elections would be fairly bad. This is because such a system may not adequately represent the needs and concerns of individuals like myself, and may limit the opportunity for diverse voices to be heard and considered in the decision-making process.\n\n3"]}, {"persona": {"region": "Ismailia", "sex": "male", "age": 57, "country": "Egypt", "marital_status": "married", "education": "middle", "social_class": "upper middle class"}, "question": {"id": "Q235", "variant": 0}, "response": ["From the perspective of a married male from Ismailia, Egypt, who is 57 years old, completed middle education level, and considers himself part of the upper middle class, my opinion on a political system with a strong leader who does not have to bother with parliament and elections is influenced by a combination of factors. The cultural context of Egypt, with its history of strong centralized leadership, may lead me to view such a system as fairly good, as it could potentially provide stability and efficiency in governance. My individual values and personal experiences, shaped by my socioeconomic background and age, may also play a role in this viewpoint. Additionally, the nuance of the question and the wording used also influences my response. 2\n\n(2) Fairly good"]}, {"persona": {"region": "Ismailia", "sex": "female", "age": 29, "country": "Egypt", "marital_status": "married", "education": "middle", "social_class": "upper middle class"}, "question": {"id": "Q235", "variant": 0}, "response": ["Based on the anthropological framework, my perspective as a married female from Ismailia, Egypt, who is 29 years old and part of the upper middle class, is shaped by my cultural context, individual values, and socioeconomic background. In Egypt, there is a strong emphasis on traditional family values and respect for authority. As someone from the upper middle class, I may have benefited from the stability and security provided by a strong leader. However, I also value personal freedom and the opportunity for upward mobility. Therefore, I believe that a political system with a strong leader who does not have to bother with parliament and elections is fairly good, as it may provide stability and security, but it also raises concerns about lack of representation and potential abuse of power.\n\n2"]}, {"persona": {"region": "Damiatta", "sex": "female", "age": 46, "country": "Egypt", "marital_status": "married", "education": "middle", "social_class": "lower middle class"}, "question": {"id": "Q235", "variant": 0}, "response": ["Based on the anthropological framework, my opinion on a political system with a strong leader who does not have to bother with parliament and elections would be influenced by my cultural context, individual values, and socioeconomic background. As a married female from Damiatta, Egypt, I come from a culture with a history of strong leadership and a hierarchical society. My lower middle class socioeconomic background may lead me to value stability and security over the uncertainty of democratic elections. Additionally, my experience and education level may influence my trust in a strong leader to make decisions for the betterment of the country. Therefore, I would choose:\n\n2"]}, {"persona": {"region": "Damiatta", "sex": "female", "age": 20, "country": "Egypt", "marital_status": "single", "education": "middle", "social_class": "lower middle class"}, "question": {"id": "Q235", "variant": 0}, "response": ["In the cultural context of Damiatta, Egypt, where I come from, there is a strong emphasis on respect for authority and stability. As a young woman from a lower middle class background, my individual values and personal experience have shaped my perception of the political system. Additionally, my socioeconomic background has influenced my understanding of the role of a strong leader in the political system. Considering the nuanced phrasing of the question and the cultural relativism in my community, I believe that a political system with a strong leader who does not have to bother with parliament and elections is fairly good for the stability and development of our country.\n\n2"]}, {"persona": {"region": "Damiatta", "sex": "male", "age": 19, "country": "Egypt", "marital_status": "single", "education": "middle", "social_class": "lower middle class"}, "question": {"id": "Q235", "variant": 0}, "response": ["From the perspective of a single male from Damiatta, Egypt, who is 19 years old and comes from the lower middle class, there are several factors that influence my opinion on a political system with a strong leader who does not have to bother with parliament and elections. Firstly, my cultural context and socioeconomic background shape my understanding of the importance of having a say in political decision-making processes. Additionally, my individual values and personal experience lead me to believe that a system without checks and balances may lead to the marginalization of voices like mine. Furthermore, the concept of cultural relativism teaches me to value democracy and inclusivity in decision-making processes. Finally, my age and place in the world contribute to my nuanced understanding of the importance of political systems that allow for the representation of diverse voices. \n\n3"]}, {"persona": {"region": "Damiatta", "sex": "female", "age": 33, "country": "Egypt", "marital_status": "married", "education": "higher", "social_class": "lower middle class"}, "question": {"id": "Q235", "variant": 0}, "response": ["Based on my cultural context as a married female from Damiatta, Egypt, my opinion on a political system with a strong leader who does not have to bother with parliament and elections is heavily influenced by my socioeconomic background, individual values, and personal experience. The historical and cultural context of Egypt has shown that a strong leader can bring stability and order, which is highly valued in our society. Additionally, as part of the lower middle class, I may have experienced economic hardships and may believe that a strong leader could potentially bring positive change for people like me. Furthermore, my higher education level may lead me to believe that a strong leader could bring about much-needed reforms. Therefore, I believe that a political system with a strong leader who does not have to bother with parliament and elections is (1) Very good."]}, {"persona": {"region": "Damiatta", "sex": "male", "age": 24, "country": "Egypt", "marital_status": "single", "education": "higher", "social_class": "lower middle class"}, "question": {"id": "Q235", "variant": 0}, "response": ["From my perspective as a 24-year-old single male from Damiatta, Egypt, who has completed higher education and considers myself part of the lower middle class, my answer to the question about a political system with a strong leader who does not have to bother with parliament and elections is influenced by multiple factors. The cultural context of Egypt, with its history of authoritarian rule, and the socioeconomic background of being part of the lower middle class, lead me to consider the potential drawbacks of such a system. The individual values and personal experience of living in a country with limited political freedom also shape my opinion. Additionally, the nuanced phrasing of the question and the understanding of cultural relativism lead me to choose my answer. \n\n3"]}, {"persona": {"region": "Suez", "sex": "male", "age": 41, "country": "Egypt", "marital_status": "married", "education": "middle", "social_class": "working class"}, "question": {"id": "Q235", "variant": 0}, "response": ["Based on my cultural context growing up in Egypt, I have been surrounded by a political system with a strong leader who does not have to bother with parliament and elections. This has been the norm for much of my life, and I have seen the benefits and drawbacks of such a system. As a member of the working class, I value stability and security, and I have often seen strong leaders bring these qualities to our country. However, I also understand the importance of having a voice in the government and the potential for abuse of power in such a system. Therefore, I believe that a political system with a strong leader who does not have to bother with parliament and elections can be fairly good if it is balanced with accountability and representation for the people. \n\n2"]}, {"persona": {"region": "Suez", "sex": "female", "age": 39, "country": "Egypt", "marital_status": "divorced", "education": "middle", "social_class": "working class"}, "question": {"id": "Q235", "variant": 0}, "response": ["As a divorced female from Suez, Egypt, I have experienced firsthand the impact of cultural context, individual values, and socioeconomic background on my life. Coming from a working-class background and having completed only middle education, my perspective is heavily influenced by my personal experience and the cultural context in which I live. I have seen the struggles of my community and understand the importance of having a voice in the political system. Additionally, the anthropological framework emphasizes the significance of emic and etic perspectives, which means that my understanding of a strong leader who does not have to bother with parliament and elections is shaped by my own values and experiences. Therefore, I believe that a political system with a strong leader who does not have to bother with parliament and elections would be fairly bad for my community and me.\n\n3"]}, {"persona": {"region": "Cairo", "sex": "female", "age": 55, "country": "Egypt", "marital_status": "married", "education": "middle", "social_class": "working class"}, "question": {"id": "Q235", "variant": 0}, "response": ["From the perspective of a married female from Cairo, Egypt, who is 55 years old, completed middle education, and considers herself part of the working class, my opinion on a political system with a strong leader who does not have to bother with parliament and elections is that it is fairly bad. The cultural context of Egypt, with its history of political unrest and authoritarian rule, has shaped my understanding of the importance of parliamentary and electoral processes in ensuring accountability and representation in governance. Additionally, my socioeconomic background as part of the working class has made me value the voice and participation of the people in decision-making processes. Furthermore, my personal experience living in a society that has seen the negative effects of unchecked power has influenced my view on the potential risks of a system with a strong leader. Overall, I believe that such a political system goes against the principles of cultural relativism and the importance of nuanced understandings of governance.\n\n3"]}, {"persona": {"region": "Cairo", "sex": "male", "age": 58, "country": "Egypt", "marital_status": "married", "education": "middle", "social_class": "lower middle class"}, "question": {"id": "Q235", "variant": 0}, "response": ["From an emic perspective, as a married male from Cairo, Egypt, I am likely to have a strong connection to my cultural context and the values and experiences that come with it. With a middle education level and being part of the lower middle class, my socioeconomic background would influence my opinion on a political system with a strong leader. Additionally, being 58 years old, I would have lived through different political systems and have a nuanced understanding of how they have impacted my life. In Egyptian culture, there is a value placed on strong leadership and stability, so I might see the appeal of a political system with a strong leader who does not have to bother with parliament and elections. However, I also understand the importance of having a voice in the government and the potential for abuse of power, so I might not fully support it. Overall, my opinion would likely lean towards option (2) Fairly good. \n\n2"]}, {"persona": {"region": "Cairo", "sex": "female", "age": 29, "country": "Egypt", "marital_status": "married", "education": "higher", "social_class": "lower middle class"}, "question": {"id": "Q235", "variant": 0}, "response": ["From the perspective of a married female from Cairo, Egypt, who is 29 years old, completed higher education, and considers herself part of the lower middle class, it is important to consider the cultural context, individual values, socioeconomic background, and space and time in understanding the opinion on a political system with a strong leader who does not have to bother with parliament and elections. In the cultural context of Egypt, there is a long history of authoritarian rule, and the individual values of stability and security may be prioritized due to the socioeconomic background and the experiences of political upheaval in recent years. Additionally, as a woman in Egypt, the space and time factor may also influence the perception of a strong leader. Therefore, the chosen option is:\n\n3"]}, {"persona": {"region": "Cairo", "sex": "male", "age": 38, "country": "Egypt", "marital_status": "married", "education": "higher", "social_class": "lower middle class"}, "question": {"id": "Q235", "variant": 0}, "response": ["Based on my emic perspective as a married male from Cairo, Egypt, I am accustomed to a political system with a strong leader who does not have to bother with parliament and elections. This is in line with the cultural context of my country, where strong leadership is often valued and seen as necessary for stability. Additionally, my individual values and personal experience have shaped my understanding of the political system, as I have seen how a strong leader can bring about positive changes. Furthermore, my socioeconomic background as part of the lower middle class has influenced my opinion, as I may feel that a strong leader can bring economic opportunities and stability. Taking into account cultural relativism, I understand that others may have different perspectives, but from my nuanced understanding of the question, I believe that this political system could be fairly good for Egypt at this time.\n\n2"]}, {"persona": {"region": "Cairo", "sex": "female", "age": 40, "country": "Egypt", "marital_status": "married", "education": "higher", "social_class": "lower middle class"}, "question": {"id": "Q235", "variant": 0}, "response": ["Based on the anthropological framework, my perspective as a married female from Cairo, Egypt, who is 40 years old, has completed higher education, and considers herself part of the lower middle class, is heavily influenced by my cultural context, individual values, and socioeconomic background. In Egypt, there is a strong emphasis on hierarchical leadership and a history of authoritarian political systems. As a result, I may be more inclined to view a political system with a strong leader who does not have to bother with parliament and elections as fairly good, as it may align with my cultural context and values of stability and order. Additionally, my lower middle class socioeconomic background may lead me to prioritize economic stability over democratic processes. \n\n2"]}, {"persona": {"region": "Cairo", "sex": "male", "age": 38, "country": "Egypt", "marital_status": "married", "education": "higher", "social_class": "upper middle class"}, "question": {"id": "Q235", "variant": 0}, "response": ["Based on my emic perspective as a married male from Cairo, Egypt, I have grown up in a cultural context where there has been a long history of political instability and corruption. My individual values and personal experiences lead me to believe that a strong leader who does not have to bother with parliament and elections could potentially bring stability and order to the country. Additionally, considering my socioeconomic background as part of the upper middle class, I may have a preference for a political system that prioritizes economic growth and stability. However, taking into account cultural relativism, I also recognize that this perspective may not be shared by everyone in my country. \n\n2"]}, {"persona": {"region": "Cairo", "sex": "male", "age": 59, "country": "Egypt", "marital_status": "married", "education": "middle", "social_class": "lower middle class"}, "question": {"id": "Q235", "variant": 0}, "response": ["From the perspective of a married male from Cairo, Egypt, who is 59 years old and part of the lower middle class, my opinion on a political system with a strong leader who does not have to bother with parliament and elections would be influenced by the cultural context of living in a country with a history of authoritarian rule and a complex political landscape. My personal experience and values would also play a role in shaping my opinion, as I may have experienced the impact of political decisions on my daily life. Additionally, my socioeconomic background as part of the lower middle class may lead me to have certain concerns about how a strong leader would address issues related to income inequality and access to resources. Considering the nuance of the question, I believe that my answer would be fairly bad (3) because I value the input of multiple voices in the political process and am wary of unchecked power in the hands of a single leader."]}, {"persona": {"region": "Cairo", "sex": "female", "age": 30, "country": "Egypt", "marital_status": "married", "education": "higher", "social_class": "upper middle class"}, "question": {"id": "Q235", "variant": 0}, "response": ["In considering my perspective as a married female from Cairo, Egypt, who is 30 years old, completed higher education and part of the upper middle class, my opinion on a political system with a strong leader who does not have to bother with parliament and elections would be influenced by several factors. Firstly, the cultural context of Egypt, which has a history of strong leaders and centralized power, would shape my opinion. Additionally, my individual values and personal experience of living in a society with a complex political history and economic disparities would also play a role. The nuance of the question and the potential implications for my socioeconomic background and future opportunities would be important to consider. Ultimately, I would weigh these factors and determine that a political system with a strong leader who does not have to bother with parliament and elections is fairly bad.\n\n3"]}, {"persona": {"region": "Cairo", "sex": "male", "age": 22, "country": "Egypt", "marital_status": "single", "education": "middle", "social_class": "lower middle class"}, "question": {"id": "Q235", "variant": 0}, "response": ["Based on the anthropological framework, as a 22-year-old single male from Cairo, Egypt, with a middle education level and lower middle class background, my perspective on a political system with a strong leader who does not have to bother with parliament and elections would be influenced by my cultural context, socioeconomic background, and individual values. Growing up in a country with a history of authoritarian rule, I may have experienced the impact of such a system on my community and family. My lower middle class background may also lead me to prioritize stability and security, which could influence my opinion on a strong leader. Additionally, my age and educational level may shape my understanding of political systems and their implications. Considering these factors, I would choose option 3: Fairly bad, as I may value the importance of democratic processes and representation in government while also recognizing the complexities of political systems in Egypt.\n\n3"]}, {"persona": {"region": "Cairo", "sex": "male", "age": 29, "country": "Egypt", "marital_status": "single", "education": "higher", "social_class": "lower middle class"}, "question": {"id": "Q235", "variant": 0}, "response": ["Based on the emic and etic perspectives, a single male from Cairo, Egypt, who is 29 years old and part of the lower middle class, would have a cultural context that is heavily influenced by the political climate in Egypt. The individual values and personal experience of this persona would likely be shaped by the political unrest and the Arab Spring protests that have occurred in recent years. Additionally, the socioeconomic background of being part of the lower middle class would likely lead to a desire for a political system that takes their needs and concerns into account. Furthermore, cultural relativism would suggest that this persona would have a nuanced understanding of the political system, taking into account the historical and cultural factors that have shaped Egypt's political landscape. Overall, the persona's opinion on a political system with a strong leader who does not have to bother with parliament and elections would likely be influenced by these factors, leading to a specific perspective.\n\n4"]}, {"persona": {"region": "Cairo", "sex": "female", "age": 31, "country": "Egypt", "marital_status": "married", "education": "higher", "social_class": "lower middle class"}, "question": {"id": "Q235", "variant": 0}, "response": ["Based on the anthropological framework, my perspective as a married female from Cairo, Egypt, is heavily influenced by my cultural context, individual values, and socioeconomic background. In Egypt, there is a strong emphasis on traditional and patriarchal values, and as a lower-middle-class woman, I am likely to have limited access to resources and opportunities. Additionally, having completed higher education, I am likely to have been exposed to ideas of democracy and the importance of representation in governance. Therefore, my opinion on a political system with a strong leader who does not have to bother with parliament and elections would be fairly bad, as it goes against the principles of democracy and representation that I have been exposed to through my education and may also threaten the limited rights and opportunities available to women in my socioeconomic position.\n\n3"]}, {"persona": {"region": "Cairo", "sex": "male", "age": 59, "country": "Egypt", "marital_status": "married", "education": "higher", "social_class": "upper middle class"}, "question": {"id": "Q235", "variant": 0}, "response": ["Based on the anthropological framework, my emic perspective as a married male from Cairo, Egypt, would be influenced by my cultural context, individual values, and socioeconomic background. In Egyptian culture, there is a long history of centralized power and authority, and the idea of a strong leader is often seen as necessary for stability and progress. Additionally, my higher education level and upper middle-class status may lead me to value stability and order over democratic processes. My age also plays a role, as older generations in Egypt may have a more favorable view of a strong leader. Therefore, I would choose option (2) Fairly good."]}, {"persona": {"region": "Cairo", "sex": "male", "age": 27, "country": "Egypt", "marital_status": "single", "education": "middle", "social_class": "working class"}, "question": {"id": "Q235", "variant": 0}, "response": ["Based on the anthropological framework, as a single male from Cairo, Egypt, with a working-class background and middle education level, my perspective on a political system with a strong leader who does not have to bother with parliament and elections would be influenced by my cultural context, individual values and personal experience, and socioeconomic background. In Egypt, there is a strong emphasis on hierarchical authority and a history of autocratic rule. As a working-class individual, I may have experienced economic hardships and may feel disconnected from the political system. Additionally, my limited education may impact my understanding of the implications of such a political system. Therefore, I may be more inclined to view a strong leader as a stabilizing force in a country that has experienced political turmoil and economic challenges.\n\n2"]}, {"persona": {"region": "Cairo", "sex": "female", "age": 25, "country": "Egypt", "marital_status": "single", "education": "higher", "social_class": "working class"}, "question": {"id": "Q235", "variant": 0}, "response": ["Based on the anthropological framework, my perspective as a single female from Cairo, Egypt, is heavily influenced by my cultural context, individual values, and socioeconomic background. In Egypt, there is a long history of authoritarian rule and a strong leader who does not have to bother with parliament and elections. This has led to a lack of political freedom and a suppression of dissenting voices. As a member of the working class, I am particularly affected by the socioeconomic implications of such a political system, which often leads to economic inequality and limited opportunities for upward mobility. Additionally, my personal experience and values as a young, educated woman lead me to advocate for a political system that values democracy, representation, and the voice of the people. Therefore, I would choose option (4) Very bad."]}, {"persona": {"region": "Cairo", "sex": "female", "age": 23, "country": "Egypt", "marital_status": "married", "education": "higher", "social_class": "lower middle class"}, "question": {"id": "Q235", "variant": 0}, "response": ["Based on the anthropological framework, as a married female from Cairo, Egypt, my emic perspective would be influenced by the political and cultural context of the country. The cultural relativism of Egypt is such that a strong leader is often valued and seen as necessary for stability. Additionally, my lower middle class socioeconomic background may lead me to prioritize stability and security over democratic processes. My individual values and personal experience may also shape my opinion, as I might have experienced economic and social instability that could make me more amenable to a strong leader. However, my higher education level may also expose me to alternative perspectives and the nuances of political systems, leading me to be more critical of a system without checks and balances. Overall, taking into account all these factors, I would lean towards option (2) Fairly good. \n\n2"]}, {"persona": {"region": "Cairo", "sex": "male", "age": 58, "country": "Egypt", "marital_status": "married", "education": "higher", "social_class": "working class"}, "question": {"id": "Q235", "variant": 0}, "response": ["Based on the anthropological framework, my answer would be influenced by my cultural context, individual values, and socioeconomic background. As a married male from Cairo, Egypt, my cultural context values strong leadership and stability, especially considering the political history of Egypt. My individual values and personal experience may also lead me to prioritize stability and security over democratic processes, especially if I have experienced economic hardship or political instability. Additionally, my working-class socioeconomic background may lead me to prioritize a leader who can address economic and social issues effectively. Therefore, my opinion on a political system with a strong leader who does not have to bother with parliament and elections would be:\n\n2"]}, {"persona": {"region": "Cairo", "sex": "female", "age": 40, "country": "Egypt", "marital_status": "married", "education": "higher", "social_class": "working class"}, "question": {"id": "Q235", "variant": 0}, "response": ["Based on the anthropological framework, as a married female from Cairo, Egypt, I am deeply influenced by cultural context, individual values, and socioeconomic background. Being from a working-class background in a country with a complex political history, I understand the importance of having a political system that takes into account the voices of the people, as well as the need for representation in governance. Additionally, my education has taught me the value of democratic processes and the role of parliament and elections in ensuring fair and just governance. Therefore, I believe that a political system with a strong leader who does not have to bother with parliament and elections would be fairly bad for the people of Egypt.\n\n3"]}, {"persona": {"region": "Cairo", "sex": "female", "age": 36, "country": "Egypt", "marital_status": "married", "education": "middle", "social_class": "upper middle class"}, "question": {"id": "Q235", "variant": 0}, "response": ["Based on the anthropological framework, my perspective as a married female from Cairo, Egypt, with a middle education level and belonging to the upper middle class, is shaped by my cultural context, individual values, and socioeconomic background. In Egypt, there is a historical and cultural context of centralized power and authority, and as a member of the upper middle class, I may benefit from a strong leader who can provide stability and economic growth. Additionally, my personal experience and values may lead me to prioritize security and order over the complexities of a parliamentary system. However, I also understand the importance of cultural relativism and recognize that others may have different perspectives based on their own cultural, socioeconomic, and historical contexts.\n\n2"]}, {"persona": {"region": "Cairo", "sex": "male", "age": 40, "country": "Egypt", "marital_status": "married", "education": "middle", "social_class": "lower middle class"}, "question": {"id": "Q235", "variant": 0}, "response": ["Based on the anthropological framework, as a married male from Cairo, Egypt, I would approach the question with an emic perspective, considering the cultural context and my individual values and personal experience. In Egypt, there is a history of strong leaders, and the cultural context may lead me to view a political system with a strong leader as potentially beneficial for stability and order. My lower middle class socioeconomic background and middle education level may also influence my perception, as I may prioritize security and economic stability over democratic processes. However, I would also be aware of the nuances and complexities of such a political system, understanding that it could lead to abuses of power and limited representation. Considering these factors, I would choose option 2: Fairly good. \n\n2"]}, {"persona": {"region": "Cairo", "sex": "female", "age": 30, "country": "Egypt", "marital_status": "married", "education": "middle", "social_class": "lower class"}, "question": {"id": "Q235", "variant": 0}, "response": ["From an emic perspective, as a lower-class married female from Cairo, Egypt, my cultural context and socioeconomic background play a significant role in shaping my opinion on a political system with a strong leader who does not have to bother with parliament and elections. My individual values and personal experience also influence my perception, as I have likely experienced the impact of political decisions on my daily life. Additionally, the cultural relativism in Egypt may lead to a nuanced understanding of the political system, considering the country's historical and sociopolitical context. Given these factors, I would likely choose option (3) Fairly bad. This is because a strong leader who does not have to bother with parliament and elections may lead to a lack of representation and accountability, potentially perpetuating inequalities that affect individuals in the lower class, like myself."]}, {"persona": {"region": "Cairo", "sex": "male", "age": 58, "country": "Egypt", "marital_status": "married", "education": "higher", "social_class": "lower middle class"}, "question": {"id": "Q235", "variant": 0}, "response": ["Based on my emic perspective as a married male from Cairo, Egypt, I have grown up in a cultural context where strong leadership is valued and where there is a level of respect for authority. Additionally, my individual values and personal experiences have shaped my perception of political systems and I believe that a strong leader can bring stability and progress to the country. My socioeconomic background as part of the lower middle class also influences my opinion, as I may believe that a strong leader can potentially address economic issues more effectively. Considering the nuanced phrasing of the question, I would choose option (2) Fairly good, as I believe a strong leader can bring stability and progress to the country."]}, {"persona": {"region": "Cairo", "sex": "male", "age": 50, "country": "Egypt", "marital_status": "married", "education": "middle", "social_class": "lower middle class"}, "question": {"id": "Q235", "variant": 0}, "response": ["Based on my personal experience and lower middle-class socioeconomic background, I view the political system with a strong leader who does not have to bother with parliament and elections as fairly good. In Egypt, we have experienced political instability and corruption, and having a strong leader who can make quick decisions without being hindered by bureaucracy can bring about stability and progress. Additionally, the cultural context in Egypt values strong leadership and stability, and the nuance of the situation is that a strong leader can be seen as a protector of the people's interests. Therefore, I believe that this political system can be beneficial for the country's development.\n\n2"]}, {"persona": {"region": "Cairo", "sex": "female", "age": 40, "country": "Egypt", "marital_status": "married", "education": "higher", "social_class": "upper middle class"}, "question": {"id": "Q235", "variant": 0}, "response": ["Based on my personal experience and cultural background in Cairo, Egypt, I understand that the cultural context and socioeconomic background play a significant role in shaping my perspective on political systems. As a married woman with a higher education level and belonging to the upper middle class, I value democratic principles and the importance of representation in governance. Additionally, the concept of cultural relativism emphasizes the importance of valuing diverse perspectives and not imposing one's beliefs on others. Therefore, I believe that a political system with a strong leader who does not have to bother with parliament and elections would be fairly bad, as it may lead to an imbalance of power and lack of accountability. \n\n3"]}, {"persona": {"region": "Cairo", "sex": "female", "age": 33, "country": "Egypt", "marital_status": "married", "education": "middle", "social_class": "lower middle class"}, "question": {"id": "Q235", "variant": 0}, "response": ["From the perspective of a married female from Cairo, Egypt, who is 33 years old, completed middle education level, and considers herself part of the lower middle class, my opinion on a political system with a strong leader who does not have to bother with parliament and elections would be fairly bad. This perspective is informed by the cultural context of living in a country with a history of authoritarian rule and a strong emphasis on collective decision-making within families and communities. Additionally, the socioeconomic background of being part of the lower middle class means that there is a concern for social and economic justice, which may be compromised in a political system with a strong leader. The emic perspective of valuing community and familial decision-making also plays a role in this opinion. \n\n3"]}, {"persona": {"region": "Cairo", "sex": "female", "age": 37, "country": "Egypt", "marital_status": "married", "education": "middle", "social_class": "lower middle class"}, "question": {"id": "Q235", "variant": 0}, "response": ["Based on my emic perspective as a married female from Cairo, Egypt, I have grown up in a cultural context where there is a certain level of respect for authority and a strong leader. Additionally, my socioeconomic background as a lower middle class individual has shaped my understanding of politics and governance. My personal experience and values have also influenced my perception of a political system with a strong leader. I believe that a strong leader who does not have to bother with parliament and elections can bring stability and order to a country, which is very important in a region that has seen political turmoil. Therefore, I choose option 2: Fairly good.\n\n2"]}, {"persona": {"region": "Cairo", "sex": "male", "age": 28, "country": "Egypt", "marital_status": "married", "education": "middle", "social_class": "lower middle class"}, "question": {"id": "Q235", "variant": 0}, "response": ["Based on my emic perspective as a married male from Cairo, Egypt, I have grown up in a cultural context where a strong leader is often seen as necessary for stability and security. The socioeconomic background of my lower middle class status has also influenced my understanding of the importance of a strong leader in maintaining order and providing for the needs of the people. Additionally, my personal experience and individual values have shaped my opinion, as I have seen the impact of political instability and corruption on my community. Considering all these factors, I believe that a political system with a strong leader who does not have to bother with parliament and elections could be fairly good for providing stability and addressing the needs of the people in my context.\n\n2"]}, {"persona": {"region": "Cairo", "sex": "male", "age": 53, "country": "Egypt", "marital_status": "married", "education": "higher", "social_class": "working class"}, "question": {"id": "Q235", "variant": 0}, "response": ["Based on the anthropological framework, as a married male from Cairo, Egypt, my emic perspective on a political system with a strong leader who does not have to bother with parliament and elections would be influenced by the cultural context, individual values, and socioeconomic background. In Egypt, there is a history of authoritarian rule and the cultural context has shaped a value for stability and security. As a member of the working class, socioeconomic background also plays a significant role in my perspective, as a strong leader may be perceived as being able to bring economic stability and security. However, considering the principle of cultural relativism, I also understand the importance of democratic processes and the potential for abuse of power in a system without checks and balances. Therefore, my opinion on this political system would be: \n\n3"]}, {"persona": {"region": "Cairo", "sex": "male", "age": 45, "country": "Egypt", "marital_status": "married", "education": "higher", "social_class": "lower middle class"}, "question": {"id": "Q235", "variant": 0}, "response": ["Based on the anthropological framework, as a married male from Cairo, Egypt, my emic perspective would be influenced by my cultural context, individual values, and socioeconomic background. In Egypt, there is a long history of strong leaders and centralized political power, so my cultural context would likely shape my view of a political system with a strong leader. Additionally, as part of the lower middle class, I may feel that a strong leader could potentially bring stability and economic prosperity, which aligns with my individual values and personal experience. However, I also recognize the potential for abuse of power and lack of representation for marginalized communities, which leads me to believe that a political system with a strong leader who does not have to bother with parliament and elections would be fairly bad.\n\n3"]}, {"persona": {"region": "Cairo", "sex": "male", "age": 52, "country": "Egypt", "marital_status": "married", "education": "middle", "social_class": "upper middle class"}, "question": {"id": "Q235", "variant": 0}, "response": ["Based on my emic perspective as a married male from Cairo, Egypt, I have grown up in a cultural context where a strong leader is often revered and seen as a symbol of stability and authority. Additionally, my socioeconomic background as part of the upper middle class may lead me to value a political system with a strong leader who can make decisive decisions without the hindrance of parliamentary processes. My personal experience and individual values may also influence my opinion, as I have likely witnessed the impact of political instability and may prioritize a strong leader for the sake of economic and social stability. In addition, the historical and cultural context of Egypt may also contribute to my perspective, as the country has a long history of authoritative leaders. Therefore, I would choose the option:\n(2) Fairly good"]}, {"persona": {"region": "Cairo", "sex": "male", "age": 22, "country": "Egypt", "marital_status": "single", "education": "higher", "social_class": "lower middle class"}, "question": {"id": "Q235", "variant": 0}, "response": ["Based on the anthropological framework, as a single male from Cairo, Egypt, I would answer this question from the perspective of my cultural context, individual values, and socioeconomic background. In Egyptian culture, there is a strong emphasis on family and community, and the understanding of power dynamics and authority is deeply rooted. Additionally, coming from a lower middle-class background, the socioeconomic factors of stability and security may weigh heavily in my perspective. Furthermore, having completed higher education, I may also consider the importance of democratic principles and the impact of a strong leader on the political system. Therefore, I would choose the following option:\n\n3"]}, {"persona": {"region": "Cairo", "sex": "female", "age": 57, "country": "Egypt", "marital_status": "divorced", "education": "middle", "social_class": "lower middle class"}, "question": {"id": "Q235", "variant": 0}, "response": ["From my perspective as a divorced female from Cairo, Egypt, with a middle education level and a lower middle-class background, my viewpoint is heavily influenced by my cultural context, individual values, and socioeconomic background. In Egypt, there has historically been a strong emphasis on a centralized political system with a powerful leader, and this has often been seen as necessary for stability and security. Additionally, my personal experiences and values may lead me to prioritize a strong leader who can bring about decisive action and address the economic challenges that many in my socioeconomic class face. However, I also recognize the importance of cultural relativism and the potential for abuse of power in such a system. Taking into account the nuanced phrasing of the question, I would choose option (2) Fairly good. \n\n2"]}, {"persona": {"region": "Cairo", "sex": "female", "age": 42, "country": "Egypt", "marital_status": "married", "education": "middle", "social_class": "working class"}, "question": {"id": "Q235", "variant": 0}, "response": ["Based on the anthropological framework, my perspective as a married female from Cairo, Egypt, aged 42, with a middle education level, and part of the working class, is influenced by my cultural context, individual values, and personal experience. In Egypt, there is a strong emphasis on cultural relativism, where the political system and leadership are deeply rooted in the country's history and cultural norms. My socioeconomic background also plays a significant role in shaping my perspective, as the working class often experiences different challenges and opportunities compared to those in higher socioeconomic brackets. Additionally, my age and place in society contribute to my nuanced understanding of political systems. Therefore, my opinion on a political system with a strong leader who does not have to bother with parliament and elections is... \n3"]}, {"persona": {"region": "Cairo", "sex": "female", "age": 23, "country": "Egypt", "marital_status": "single", "education": "middle", "social_class": "lower middle class"}, "question": {"id": "Q235", "variant": 0}, "response": ["Based on the anthropological framework, my emic perspective as a single female from Cairo, Egypt, would be influenced by the cultural context, individual values, and socioeconomic background. In Egypt, there is a strong emphasis on hierarchy and authority, and as a lower middle class individual with limited education, I might feel that a political system with a strong leader who does not have to bother with parliament and elections could bring stability and order to the country. Additionally, the personal experience of living in a society with political instability and unrest may lead me to believe that a strong leader could bring about positive change. Therefore, my opinion on this political system would be influenced by these factors, and I would select option (2) Fairly good, as I might perceive it as a potential solution to the current state of affairs in the country. \n\n2"]}, {"persona": {"region": "Cairo", "sex": "female", "age": 28, "country": "Egypt", "marital_status": "married", "education": "higher", "social_class": "upper middle class"}, "question": {"id": "Q235", "variant": 0}, "response": ["Considering the emic and etic perspectives, as a married female from Cairo, Egypt, I have been brought up in a cultural context where strong leadership is valued and respected. Additionally, my individual values and personal experience have led me to appreciate stability and security, and I believe that a strong leader can provide this. Furthermore, my socioeconomic background as part of the upper middle class has given me a certain level of privilege and comfort, making me more inclined to support a political system with a strong leader. Taking into account cultural relativism, I understand that my perspective may differ from others, but from my standpoint, a political system with a strong leader who does not have to bother with parliament and elections would be very good.\n\n1"]}, {"persona": {"region": "Cairo", "sex": "female", "age": 22, "country": "Egypt", "marital_status": "single", "education": "higher", "social_class": "lower middle class"}, "question": {"id": "Q235", "variant": 0}, "response": ["From the perspective of a single female from Cairo, Egypt, who is 22 years old and part of the lower middle class, several factors will influence her opinion on a political system with a strong leader who does not have to bother with parliament and elections. Her cultural context, including the sociopolitical history of Egypt and the cultural emphasis on democracy and political participation, will likely lead her to value the importance of parliamentary and electoral processes. Her individual values and personal experiences, as a young person who has likely witnessed or experienced political unrest and social change in Egypt, will also shape her opinion. Additionally, her lower middle class socioeconomic background may lead her to have concerns about the potential for abuse of power and lack of representation in such a political system. Therefore, considering these factors, she may have a negative opinion on a political system with a strong leader who bypasses parliament and elections.\n\n3"]}, {"persona": {"region": "Cairo", "sex": "female", "age": 39, "country": "Egypt", "marital_status": "married", "education": "middle", "social_class": "lower middle class"}, "question": {"id": "Q235", "variant": 0}, "response": ["Based on the anthropological framework, as a married female from Cairo, Egypt, my emic perspective would be shaped by the cultural context of living in a society with a long history of centralized leadership. Additionally, my lower middle-class socioeconomic background and middle education level have influenced my individual values and personal experience, leading me to prioritize stability and security. I also understand the importance of nuance in answering this question, as the phrasing of the political system and the role of parliament and elections are critical in shaping my response. Therefore, I would select:\n\n2"]}, {"persona": {"region": "Cairo", "sex": "male", "age": 19, "country": "Egypt", "marital_status": "single", "education": "middle", "social_class": "working class"}, "question": {"id": "Q235", "variant": 0}, "response": ["Based on the anthropological framework, as a single male from Cairo, Egypt who has completed middle education and considers himself part of the working class, my perspective is heavily influenced by my cultural context, socioeconomic background, and personal experience. In Egypt, there is a long history of authoritarian rule and a strong leader without the need for parliamentary or electoral processes. This has often led to oppression and limited political freedoms for the working class. Additionally, my age and education level have likely exposed me to discussions and critiques of such political systems. Taking these factors into account, I am likely to view a political system with a strong leader who does not have to bother with parliament and elections as fairly bad.\n\n3"]}, {"persona": {"region": "Cairo", "sex": "female", "age": 54, "country": "Egypt", "marital_status": "married", "education": "middle", "social_class": "working class"}, "question": {"id": "Q235", "variant": 0}, "response": ["Based on the anthropological framework, as a married female from Cairo, Egypt, my emic perspective would be influenced by the cultural context of living in a country with a long history of authoritarian rule and a strong sense of hierarchy. My personal experience and values would also be shaped by the socioeconomic background of being part of the working class and having completed only middle education level. Additionally, the cultural relativism of the society would also play a role in my understanding of political systems. Therefore, I would likely view a political system with a strong leader who does not have to bother with parliament and elections as fairly good, as it may provide stability and strong leadership in a society that values order and structure. \n\n2"]}, {"persona": {"region": "Cairo", "sex": "male", "age": 30, "country": "Egypt", "marital_status": "married", "education": "higher", "social_class": "working class"}, "question": {"id": "Q235", "variant": 0}, "response": ["From an emic perspective, as a married male from Cairo, Egypt, who is 30 years old and part of the working class, my opinion on a political system with a strong leader who does not have to bother with parliament and elections would be influenced by my cultural context, individual values, and socioeconomic background. In Egypt, there is a history of authoritarian rule, and many people have experienced the negative impacts of a lack of democratic processes. Additionally, as someone from the working class, I may feel that my voice and the voices of others in similar socioeconomic positions are not being heard or considered in such a system. This perspective is also influenced by cultural relativism, as I understand that different political systems work for different societies, but I value the principles of democracy and the ability for all voices to be represented in governance. Therefore, my opinion on this type of political system would be fairly bad.\n\n3"]}, {"persona": {"region": "Cairo", "sex": "male", "age": 39, "country": "Egypt", "marital_status": "married", "education": "higher", "social_class": "lower middle class"}, "question": {"id": "Q235", "variant": 0}, "response": ["From the perspective of a married male from Cairo, Egypt, aged 39 and belonging to the lower middle class, my opinion on a political system with a strong leader who does not have to bother with parliament and elections would be influenced by a variety of factors. Firstly, my cultural context as an Egyptian would lead me to consider the history of authoritarian rule in our country and the impact it has had on our society. Additionally, my individual values and personal experiences, as well as my socioeconomic background, would lead me to prioritize the importance of having a voice in the political process. Furthermore, cultural relativism teaches me to understand the diverse perspectives and needs of different individuals within my society, and I recognize the importance of nuance in understanding the complexities of political systems. Therefore, my opinion would be based on a combination of these factors, leading me to choose option (3) Fairly bad. \n\n3"]}, {"persona": {"region": "Cairo", "sex": "female", "age": 41, "country": "Egypt", "marital_status": "married", "education": "middle", "social_class": "lower middle class"}, "question": {"id": "Q235", "variant": 0}, "response": ["Based on the anthropological framework, as a married woman from Cairo, Egypt, my emic perspective on a political system with a strong leader who does not have to bother with parliament and elections would likely be influenced by the cultural context of Egypt, where there is a history of authoritarian rule. My individual values and personal experience may lead me to have a nuanced understanding of the potential benefits and drawbacks of such a system, particularly in relation to socioeconomic background and the space and time in which I have lived. Considering the cultural relativism of political systems, I would lean towards an answer that reflects the potential complexities of such a system rather than a straightforward opinion.\n\n3"]}, {"persona": {"region": "Cairo", "sex": "male", "age": 45, "country": "Syria", "marital_status": "single", "education": "higher", "social_class": "upper middle class"}, "question": {"id": "Q235", "variant": 0}, "response": ["From the perspective of a single male from Cairo, Syria, who is 45 years old, completed higher education, and considers himself part of the upper middle class, it is important to consider the cultural context and individual values in forming an opinion on a political system. In the Syrian and Middle Eastern cultural context, there is a long history of authoritarian rule, and the idea of a strong leader who does not have to bother with parliament and elections may be perceived as a form of stability and security. Additionally, individuals from the upper middle class may have benefited from the existing political system and may therefore view a strong leader positively. However, it is crucial to acknowledge the emic and etic perspectives, as well as the principles of cultural relativism, and recognize that this viewpoint may not be universally shared. Ultimately, the nuanced phrasing of the question and the individual's personal experience will influence their answer.\n\n3"]}, {"persona": {"region": "Cairo", "sex": "male", "age": 54, "country": "Egypt", "marital_status": "married", "education": "higher", "social_class": "lower middle class"}, "question": {"id": "Q235", "variant": 0}, "response": ["From the perspective of a married male from Cairo, Egypt, who is 54 years old, completed higher education, and considers himself part of the lower middle class, my opinion on a political system with a strong leader who does not have to bother with parliament and elections would be influenced by several factors. The cultural context of Egypt, with its history of authoritarian rule and recent political upheaval, would shape my perspective. Additionally, my socioeconomic background as part of the lower middle class would impact my view on political leadership. My personal experience and individual values would also play a role in shaping my opinion. I would also consider the nuance of the situation and the potential impact on my family and community. \n\n4"]}, {"persona": {"region": "Cairo", "sex": "male", "age": 65, "country": "Egypt", "marital_status": "married", "education": "middle", "social_class": "upper middle class"}, "question": {"id": "Q235", "variant": 0}, "response": ["Based on the anthropological framework, my perspective as a married male from Cairo, Egypt, who is 65 years old and part of the upper middle class, is heavily influenced by the cultural context of living in a country with a long history of political instability and authoritarian rule. My individual values and personal experience have shaped my understanding of the importance of a political system that values democracy and representation. Additionally, my socioeconomic background has afforded me the privilege of education and access to resources, which has further shaped my belief in the necessity of a political system that includes checks and balances. Considering these factors, I believe that a political system with a strong leader who does not have to bother with parliament and elections would be very bad for the country. \n\n4"]}, {"persona": {"region": "Cairo", "sex": "female", "age": 52, "country": "Egypt", "marital_status": "married", "education": "middle", "social_class": "upper middle class"}, "question": {"id": "Q235", "variant": 0}, "response": ["Based on the anthropological framework, my perspective as a married female from Cairo, Egypt, is heavily influenced by my cultural context, individual values, and socioeconomic background. In Egyptian society, there is a strong emphasis on traditional hierarchies and respect for authority. Additionally, my upper middle class status means that I may have benefited from certain aspects of the current political system. However, I also value personal freedoms and recognize the importance of democratic processes. With my age and education level, I have likely experienced periods of political instability and may have a nuanced understanding of the potential consequences of a political system with a strong leader. Given these factors, I would choose option:\n\n2"]}, {"persona": {"region": "Cairo", "sex": "male", "age": 26, "country": "Egypt", "marital_status": "single", "education": "higher", "social_class": "lower middle class"}, "question": {"id": "Q235", "variant": 0}, "response": ["From the emic perspective, as a single male from Cairo, Egypt, my understanding of a political system with a strong leader who does not have to bother with parliament and elections is influenced by the cultural context of Egypt. The country has a history of authoritarian rule, and many people in my socioeconomic background have experienced the consequences of such a system. My personal experience and individual values also play a role in shaping my opinion, as I value the principles of democracy and inclusivity in decision-making processes. Additionally, the cultural relativism of Egypt and the nuanced phrasing of the question lead me to believe that a political system with a strong leader who does not have to bother with parliament and elections would be fairly bad for the country, as it could lead to an imbalance of power and limited representation of the diverse population. \n\n3"]}, {"persona": {"region": "Cairo", "sex": "male", "age": 32, "country": "Egypt", "marital_status": "married", "education": "middle", "social_class": "working class"}, "question": {"id": "Q235", "variant": 0}, "response": ["From an emic perspective, as a married male from Cairo, Egypt, I have grown up in a cultural context where there is a strong emphasis on traditional leadership and authority figures. The political system in Egypt has historically been one with a strong leader, and this is something that is deeply ingrained in our cultural context. Additionally, my individual values and personal experience have shaped my perception, and as someone from the working class with limited education, I may view a strong leader as someone who can provide stability and direction. However, considering the socioeconomic background of many in Egypt, a political system with a strong leader who does not have to bother with parliament and elections may also be seen as a means of perpetuating inequality and limiting the voices of the working class. Therefore, my opinion on this political system would be:\n\n2"]}, {"persona": {"region": "Cairo", "sex": "male", "age": 38, "country": "Egypt", "marital_status": "married", "education": "middle", "social_class": "lower middle class"}, "question": {"id": "Q235", "variant": 0}, "response": ["Based on the anthropological framework, my perspective as a married male from Cairo, Egypt, is heavily influenced by my cultural context and socioeconomic background. In Egypt, there is a long history of centralized power and a strong leader, which has shaped the way politics are perceived. Additionally, as a member of the lower middle class, I may have different priorities and concerns compared to those in higher socioeconomic brackets. My personal experience and values also play a role in my perception of political systems. Considering these factors, I would choose the option:\n\n(3) Fairly bad"]}, {"persona": {"region": "Cairo", "sex": "male", "age": 58, "country": "Egypt", "marital_status": "married", "education": "higher", "social_class": "upper middle class"}, "question": {"id": "Q235", "variant": 0}, "response": ["Based on my emic perspective as a married male from Cairo, Egypt, I understand the importance of having a strong leader who can make swift decisions without the constraints of a parliament or elections. In the cultural context of Egypt, stability and security are highly valued, and a strong leader can provide a sense of order and direction. Additionally, my individual values and personal experience as someone from the upper middle class have shaped my belief that a strong leader can effectively manage the country's socio-economic issues. Furthermore, considering the socioeconomic background of my persona, I believe that a strong leader can help maintain the status quo and uphold the interests of the upper middle class. Additionally, cultural relativism is important in understanding that every country's political system is unique and should not be judged based on Western standards. Therefore, I believe that a political system with a strong leader who does not have to bother with parliament and elections is fairly good.\n\n2"]}, {"persona": {"region": "Cairo", "sex": "male", "age": 49, "country": "Egypt", "marital_status": "married", "education": "middle", "social_class": "lower middle class"}, "question": {"id": "Q235", "variant": 0}, "response": ["Based on my cultural context in Cairo, Egypt, where there is a history of strong leaders and a political system that does not prioritize parliamentary or electoral processes, my socioeconomic background as part of the lower middle class, and my age and personal experience, I believe that a political system with a strong leader who does not have to bother with parliament and elections can be fairly good. I have seen how stability and decisive leadership can bring about positive change in a country, and I value the idea of a leader who can make quick decisions without being hindered by bureaucracy. Additionally, my cultural relativism and nuanced understanding of the question lead me to believe that this type of political system may work well in certain contexts, including my own. \n\n2"]}, {"persona": {"region": "Cairo", "sex": "female", "age": 29, "country": "Egypt", "marital_status": "married", "education": "middle", "social_class": "working class"}, "question": {"id": "Q235", "variant": 0}, "response": ["From the perspective of a married female from Cairo, Egypt, who is 29 years old and part of the working class, the response to the question about a political system with a strong leader who does not have to bother with parliament and elections would be influenced by the cultural context and socioeconomic background. In Egypt, there is a history of authoritarian rule and political instability, which has had a significant impact on the lives of the working class. Additionally, being a part of a culture with a strong emphasis on family and community, the individual values and personal experiences would also shape the opinion on this topic. Considering the emic and etic perspectives, as well as the nuances of the question, the response is most likely to be that such a political system is fairly bad.\n\n3"]}, {"persona": {"region": "Cairo", "sex": "female", "age": 36, "country": "Egypt", "marital_status": "married", "education": "higher", "social_class": "lower middle class"}, "question": {"id": "Q235", "variant": 0}, "response": ["From an emic perspective, as a married female from Cairo, Egypt, I am influenced by the cultural context of my society, where there is a long history of authoritarian rule. My individual values and personal experience have also shaped my perception, as I have seen the impact of political decisions on my community. Additionally, my socioeconomic background as part of the lower middle class has influenced my understanding of the political system. Cultural relativism is also crucial to consider, as I understand that different societies may have different perspectives on governance. Finally, space and time play a role in my opinion, as I have lived through various political changes in Egypt. In this nuanced understanding, I believe that a political system with a strong leader who does not have to bother with parliament and elections would be fairly bad.\n\n3"]}, {"persona": {"region": "Cairo", "sex": "female", "age": 34, "country": "Egypt", "marital_status": "married", "education": "middle", "social_class": "lower middle class"}, "question": {"id": "Q235", "variant": 0}, "response": ["Based on the anthropological framework, my perspective as a married female from Cairo, Egypt, who is 34 years old, has completed middle education, and considers herself part of the lower middle class, is shaped by a combination of emic and etic perspectives, cultural context, individual values and personal experience, socioeconomic background, cultural relativism, space and time, and nuance. In Egypt, there has historically been a strong emphasis on centralized leadership, and many individuals from lower middle class backgrounds may view a political system with a strong leader as a means of stability and security in a volatile political environment. Additionally, cultural and socioeconomic factors may influence perceptions of centralized leadership as beneficial for economic development and social order. However, individual values and personal experience may also play a role as some may have experienced the negative consequences of authoritarian rule. Additionally, the nuances of the question and the specific circumstances and historical context of Egypt may also influence the perspective on this issue.\n\n2"]}, {"persona": {"region": "Fayoum", "sex": "male", "age": 57, "country": "Egypt", "marital_status": "married", "education": "middle", "social_class": "working class"}, "question": {"id": "Q235", "variant": 0}, "response": ["Based on the anthropological framework, as a married male from Fayoum, Egypt, I would consider the cultural context, individual values, and socioeconomic background to form my opinion on a political system with a strong leader who does not have to bother with parliament and elections. In my community, there may be a strong emphasis on traditional values and respect for authority, which could influence my perspective. Additionally, my working-class background and middle education level may lead me to prioritize stability and economic security, potentially making me more inclined to support a strong leader. Furthermore, my age and personal experiences may lead me to view a strong leader as a symbol of strength and security. Therefore, my opinion on this political system would likely be influenced by a combination of cultural context, individual values, personal experience, and socioeconomic background.\n\n2"]}, {"persona": {"region": "Fayoum", "sex": "male", "age": 60, "country": "Egypt", "marital_status": "married", "education": "middle", "social_class": "lower middle class"}, "question": {"id": "Q235", "variant": 0}, "response": ["From the perspective of a married male from Fayoum, Egypt, who is 60 years old, has completed middle education, and considers himself part of the lower middle class, I would approach the question of a political system with a strong leader without parliament and elections with a focus on cultural context and socioeconomic background. In Egypt, there is a history of strong leadership and a centralized political system, and the socioeconomic background of an individual can greatly influence their perception of such a system. Additionally, personal experience and individual values would play a significant role in shaping my opinion on this matter. Given these considerations, my perspective would likely lean towards a more positive view of a strong leader in the political system. \n\n2"]}, {"persona": {"region": "Fayoum", "sex": "male", "age": 21, "country": "Egypt", "marital_status": "single", "education": "middle", "social_class": "lower middle class"}, "question": {"id": "Q235", "variant": 0}, "response": ["Based on my emic perspective as a single male from Fayoum, Egypt, I have grown up in a cultural context where there is a strong sense of community and a respect for authority. My individual values and personal experiences have shaped my perception of political systems, and as someone from the lower middle class, I have seen the impact of socioeconomic background on the lives of people around me. Additionally, cultural relativism is ingrained in me, and I understand that there is no hierarchy of culture. Considering all these factors, I believe that a political system with a strong leader who does not have to bother with parliament and elections could be fairly good for the stability and development of the country. \n\n2"]}, {"persona": {"region": "Fayoum", "sex": "male", "age": 33, "country": "Egypt", "marital_status": "single", "education": "higher", "social_class": "working class"}, "question": {"id": "Q235", "variant": 0}, "response": ["Based on the anthropological framework, as a single male from Fayoum, Egypt, my emic perspective would be influenced by my cultural context, individual values, and socioeconomic background. In Egypt, there is a strong emphasis on collectivism and respect for authority, which may lead to a favorable view of a strong leader. Additionally, as a working-class individual who has experienced the challenges of everyday life, I may value stability and security over democratic processes. However, I also recognize the potential for abuse of power and the importance of representation, which may lead me to have some reservations about a political system without checks and balances.\n3"]}, {"persona": {"region": "Fayoum", "sex": "male", "age": 32, "country": "Egypt", "marital_status": "married", "education": "higher", "social_class": "lower middle class"}, "question": {"id": "Q235", "variant": 0}, "response": ["Based on my emic perspective, as a married male from Fayoum, Egypt, I have been raised in a cultural context that values stability and order. My individual values and personal experiences have taught me that a strong leader can provide the stability and security that our society needs. Additionally, coming from a lower middle class background, I value a political system that can address the needs of the working class. Considering the nuance of the question and the space and time in which I live, I believe that a political system with a strong leader could be beneficial for our country's development and progress.\n\n2"]}, {"persona": {"region": "Gharbia", "sex": "male", "age": 42, "country": "Egypt", "marital_status": "married", "education": "higher", "social_class": "upper middle class"}, "question": {"id": "Q235", "variant": 0}, "response": ["Based on my emic perspective as a married male from Gharbia, Egypt, I have been raised in a culture where respect for authority and strong leadership are highly valued. Additionally, my socioeconomic background as part of the upper middle class has provided me with certain privileges and opportunities that have shaped my understanding of political systems. My higher education level has also given me a broader understanding of the complexities of governance. Considering these factors, I believe that a political system with a strong leader who does not have to bother with parliament and elections could be fairly good for the stability and progress of the nation, as long as the leader is competent and has the best interests of the people at heart.\n\n2"]}, {"persona": {"region": "Gharbia", "sex": "male", "age": 52, "country": "Egypt", "marital_status": "married", "education": "middle", "social_class": "working class"}, "question": {"id": "Q235", "variant": 0}, "response": ["From the emic perspective, as a married male from Gharbia, Egypt, my understanding of a political system with a strong leader who does not have to bother with parliament and elections is heavily influenced by the cultural context of Egypt. The country has a long history of authoritarian rule, and many people in my community believe that a strong leader is necessary for stability and order. Additionally, my individual values and personal experiences have shaped my opinion, as I have witnessed the challenges and instability that can arise from a fragmented political system. As a member of the working class, my socioeconomic background also plays a role in my perspective, as I may feel that a strong leader could potentially address economic issues more effectively. However, I also recognize the importance of cultural relativism and understand that others may have different perspectives based on their own experiences and backgrounds. \n\n2"]}, {"persona": {"region": "Gharbia", "sex": "male", "age": 45, "country": "Egypt", "marital_status": "divorced", "education": "higher", "social_class": "upper middle class"}, "question": {"id": "Q235", "variant": 0}, "response": ["Based on the anthropological framework, I, as a divorced male from Gharbia, Egypt, at the age of 45 with a higher education level and considering myself part of the upper middle class, would have a perspective shaped by my cultural context, individual values, and socioeconomic background. In Egyptian society, there is a strong emphasis on respect for authority and stability, which could lead me to view a political system with a strong leader as potentially beneficial for maintaining order and progress. Additionally, my higher education level might lead me to have a nuanced understanding of the potential benefits and drawbacks of such a system. Given my socioeconomic background, I may also perceive a strong leader as capable of implementing policies that could positively impact my social and economic status. My opinion is based on these factors, which may lead me to choose option (2) Fairly good. \n\n2"]}, {"persona": {"region": "Behaira", "sex": "male", "age": 23, "country": "Egypt", "marital_status": "single", "education": "middle", "social_class": "lower class"}, "question": {"id": "Q235", "variant": 0}, "response": ["Based on my emic perspective as a lower class single male from Behaira, Egypt, I have experienced firsthand the struggles and challenges faced by my community and myself. My cultural context and socioeconomic background have shaped my understanding of the importance of having a political system that is fair and just for all. As an individual with limited educational opportunities, I recognize the significance of having a voice in the political process and the impact it can have on the lives of those in my community. Therefore, I believe that a political system with a strong leader who does not have to bother with parliament and elections would be very bad for the people, as it would limit our ability to have a say in decisions that directly affect us and perpetuate inequality and injustice. \n\n4"]}, {"persona": {"region": "Behaira", "sex": "male", "age": 38, "country": "Egypt", "marital_status": "single", "education": "higher", "social_class": "lower class"}, "question": {"id": "Q235", "variant": 0}, "response": ["Based on my emic perspective as a lower-class male from Behaira, Egypt, I have experienced firsthand the struggles and challenges faced by individuals in my community. My cultural context and socioeconomic background have shaped my perception of the political system. I have seen how a strong leader can bring stability and order, especially in a country like Egypt where there has been political turmoil in the past. However, I also understand the importance of having checks and balances in place, and the value of having a voice through elections and a parliament. Therefore, I believe that a political system with a strong leader who does not have to bother with parliament and elections may provide some benefits, but it also has the potential to lead to abuse of power and oppression of the marginalized. \n\n3"]}, {"persona": {"region": "Behaira", "sex": "male", "age": 32, "country": "Egypt", "marital_status": "married", "education": "middle", "social_class": "lower class"}, "question": {"id": "Q235", "variant": 0}, "response": ["From my emic perspective as a married male from Behaira, Egypt, I have been raised in a cultural context where strong leadership is often viewed as necessary for stability and order. Additionally, my lower socioeconomic background has influenced my individual values and personal experiences, leading me to prioritize security and economic stability. In this context, a political system with a strong leader who does not have to bother with parliament and elections may be viewed as beneficial for maintaining order and ensuring economic growth. Furthermore, cultural relativism reminds me that different societies have different ways of organizing themselves, and my nuanced understanding of this question leads me to believe that such a political system could be very good for our society's specific needs and challenges.\n\n3"]}, {"persona": {"region": "Behaira", "sex": "female", "age": 37, "country": "Egypt", "marital_status": "married", "education": "middle", "social_class": "working class"}, "question": {"id": "Q235", "variant": 0}, "response": ["In considering the question from the perspective of a married female from Behaira, Egypt, who is 37 years old, has completed middle education, and considers herself part of the working class, it is crucial to take into account the cultural context of Egypt and the individual values and personal experience of the persona. In Egypt, there is a strong emphasis on hierarchical structures and respect for authority, which may lead to a favorable view of a political system with a strong leader. Additionally, as a member of the working class with limited access to formal education, the persona may have experienced challenges within the existing political system and therefore may view a strong leader as a potential solution. However, it is important to note that the persona's opinions may also be influenced by their socioeconomic background and the nuanced phrasing of the question. \n\n4"]}, {"persona": {"region": "Behaira", "sex": "male", "age": 48, "country": "Egypt", "marital_status": "married", "education": "middle", "social_class": "working class"}, "question": {"id": "Q235", "variant": 0}, "response": ["Based on the anthropological framework, as a married male from Behaira, Egypt, my emic perspective would be influenced by the cultural context of Egypt, where there is a history of strong leadership and centralized power. My individual values and personal experiences, as well as my socioeconomic background as part of the working class, would also shape my opinion. Additionally, the cultural relativism in Egypt would impact my understanding of political systems. Considering all these factors, I would choose: \n\n2"]}, {"persona": {"region": "Behaira", "sex": "female", "age": 34, "country": "Egypt", "marital_status": "married", "education": "middle", "social_class": "lower class"}, "question": {"id": "Q235", "variant": 0}, "response": ["In considering the opinion of a married female from Behaira, Egypt, who is 34 years old, has completed middle education, and considers herself part of the lower class, it is important to take into account her emic perspective shaped by her cultural context, individual values, and socioeconomic background. In a society where traditional gender roles and hierarchies may be prevalent, she may value stability and security provided by a strong leader. Additionally, her lower socioeconomic status may lead her to prioritize economic and social stability over democratic processes. Furthermore, her experience and personal values may lead her to view a strong leader as a source of protection and support in a challenging socioeconomic environment. \n\n2"]}, {"persona": {"region": "Behaira", "sex": "female", "age": 30, "country": "Egypt", "marital_status": "divorced", "education": "lower", "social_class": "lower class"}, "question": {"id": "Q235", "variant": 0}, "response": ["In my cultural context in Behaira, Egypt, as a divorced lower-class woman with lower education, I have experienced the hardships of life and have seen how the political system can affect people like me. My individual values and personal experiences have shaped my understanding of how a political system with a strong leader who does not have to bother with parliament and elections can impact the lives of people in my community. Living in a patriarchal society, I understand the importance of having a strong leader, but I also value the voices of the people and the need for fair representation. My socioeconomic background has made me realize the impact of political decisions on the lower class, and I believe that a political system without checks and balances can be detrimental to people like me. Additionally, considering the cultural relativism in my community, I believe in the importance of having a fair and just political system that considers the needs of all individuals. Therefore, I believe that a political system with a strong leader who does not have to bother with parliament and elections is very bad.\n\n4"]}, {"persona": {"region": "Behaira", "sex": "male", "age": 40, "country": "Egypt", "marital_status": "married", "education": "higher", "social_class": "lower middle class"}, "question": {"id": "Q235", "variant": 0}, "response": ["Based on the anthropological framework, as a married male from Behaira, Egypt, my emic perspective would be influenced by my cultural context, individual values, and socioeconomic background. In Egypt, there is a long history of strong leadership and a centralized political system. Additionally, as part of the lower middle class, my personal experience and socioeconomic background may lead me to prioritize stability and security, which could influence my opinion on a strong leader. Furthermore, cultural relativism teaches us to understand and respect different political systems and their cultural context, which may lead me to view a strong leader positively. Therefore, based on these factors, I would choose option 2: Fairly good. \n\n2"]}, {"persona": {"region": "Behaira", "sex": "male", "age": 38, "country": "Egypt", "marital_status": "married", "education": "middle", "social_class": "working class"}, "question": {"id": "Q235", "variant": 0}, "response": ["Based on the anthropological framework, as a married male from Behaira, Egypt, with a middle education level and part of the working class, my perspective is heavily influenced by my cultural context, individual values, and socioeconomic background. In Egypt, there is a strong emphasis on respect for authority and stability, which may lead me to view a political system with a strong leader as very good for maintaining order and security. Additionally, my working-class background may lead me to prioritize economic stability and job security over democratic processes. However, considering the nuanced phrasing of the question and the importance of cultural relativism, I must also acknowledge that my perspective may not be universal and that others may have different opinions based on their own cultural, socioeconomic, and personal experiences.\n\n1"]}, {"persona": {"region": "Behaira", "sex": "female", "age": 30, "country": "Egypt", "marital_status": "married", "education": "higher", "social_class": "lower class"}, "question": {"id": "Q235", "variant": 0}, "response": ["Based on my emic perspective, as a married female from Behaira, Egypt, I have grown up in a cultural context that values strong leadership and authority figures. My individual values and personal experiences have taught me to prioritize stability and security, which I believe a strong leader can provide. Additionally, my lower socioeconomic background has made me more accustomed to authoritarian rule and less trustful of the political system. Therefore, I believe that a political system with a strong leader who does not have to bother with parliament and elections would be fairly good for the stability and security of the country.\n\n2"]}, {"persona": {"region": "Behaira", "sex": "female", "age": 35, "country": "Egypt", "marital_status": "married", "education": "middle", "social_class": "working class"}, "question": {"id": "Q235", "variant": 0}, "response": ["From the emic and etic perspectives, as a married female from Behaira, Egypt, I am influenced by the cultural context of my society, where there is a strong emphasis on family and community values. My individual values and personal experience, along with my socioeconomic background as part of the working class, shape my perception of political systems and leadership. Additionally, the concept of cultural relativism is important in understanding that different cultures have different ways of governance. My age and place also play a role in my understanding of political systems. Therefore, based on these factors, I believe that a political system with a strong leader who does not have to bother with parliament and elections would be fairly good for the stability and progress of my community. \n\n2"]}, {"persona": {"region": "Behaira", "sex": "male", "age": 52, "country": "Egypt", "marital_status": "married", "education": "middle", "social_class": "lower class"}, "question": {"id": "Q235", "variant": 0}, "response": ["Based on my emic perspective as a married male from Behaira, Egypt, my cultural context and lower socioeconomic background play a significant role in shaping my opinion on a political system with a strong leader. In my cultural context, a strong leader may be seen as a figure of authority and stability, providing a sense of security in a country that has experienced political turmoil. Additionally, my lower class socioeconomic background may lead me to prioritize stability and security over democratic processes, as I may feel that a strong leader could potentially address economic and social issues more effectively. However, my individual values and personal experience may also lead me to be wary of unchecked power and potential abuses of authority. Additionally, my nuanced understanding of the question may also influence my response, as I may consider the specific circumstances and potential implications of such a system in my own country. \n\n3"]}, {"persona": {"region": "Alexandria", "sex": "female", "age": 41, "country": "Egypt", "marital_status": "single", "education": "middle", "social_class": "lower class"}, "question": {"id": "Q235", "variant": 0}, "response": ["From my perspective as a single female from Alexandria, Egypt, with a lower socioeconomic background and a middle education level, my opinion on a political system with a strong leader who does not have to bother with parliament and elections is influenced by my cultural context and individual values. In Egypt, we have a long history of centralized power and authoritarian rule, and this has often resulted in economic and social instability for those of us in the lower class. Additionally, my personal experience has shown me that a lack of democratic processes can lead to corruption and a lack of representation for people like me. Therefore, I strongly believe that such a political system would be very bad for me and my community.\n\n4"]}, {"persona": {"region": "Alexandria", "sex": "female", "age": 21, "country": "Egypt", "marital_status": "single", "education": "middle", "social_class": "lower class"}, "question": {"id": "Q235", "variant": 0}, "response": ["Based on my cultural context, as a lower-class single female from Alexandria, Egypt, my opinions are heavily influenced by my socioeconomic background and personal experiences. In my community, there is a strong emphasis on traditional values and patriarchal structures, which may lead me to view a political system with a strong leader favorably. Additionally, my lack of access to higher education and limited exposure to alternative political systems may contribute to a more authoritarian viewpoint. Furthermore, the current political and economic instability in Egypt may lead me to believe that a strong leader could bring about stability and security. Therefore, I would choose option 2: Fairly good."]}, {"persona": {"region": "Alexandria", "sex": "female", "age": 35, "country": "Egypt", "marital_status": "married", "education": "middle", "social_class": "lower class"}, "question": {"id": "Q235", "variant": 0}, "response": ["From the perspective of a married female from Alexandria, Egypt, who is 35 years old and comes from a lower socioeconomic background, my opinion on a political system with a strong leader who does not have to bother with parliament and elections is likely to be influenced by my cultural context, individual values, and personal experience. As someone who has experienced the challenges of living in a lower-class community, I may have a nuanced understanding of the benefits and drawbacks of such a political system. My personal experience and the cultural context of Egypt may lead me to value stability and security, and I may see a strong leader as providing a sense of order and predictability in a society that has faced political turmoil. However, I may also recognize the importance of having a voice in the political process and the potential for abuse of power in a system without checks and balances. Therefore, my opinion on this political system would likely be fairly good (2), recognizing both the potential benefits and risks."]}, {"persona": {"region": "Alexandria", "sex": "male", "age": 34, "country": "Egypt", "marital_status": "married", "education": "higher", "social_class": "working class"}, "question": {"id": "Q235", "variant": 0}, "response": ["Based on the anthropological framework, my perspective as a married male from Alexandria, Egypt, who is 34 years old, completed higher education, and considers himself part of the working class, is heavily influenced by my cultural context, individual values and personal experience, socioeconomic background, and the nuance of the question. In Egypt, there is a long history of strong leaders who have had significant influence on the political system. As a member of the working class, I may have experienced the impact of these leaders on my daily life and may have strong opinions about their effectiveness. Additionally, my education level may have exposed me to different political ideologies and systems. Therefore, my opinion on a political system with a strong leader who does not have to bother with parliament and elections would be influenced by these factors. \n\n3"]}, {"persona": {"region": "Alexandria", "sex": "female", "age": 37, "country": "Egypt", "marital_status": "married", "education": "higher", "social_class": "lower middle class"}, "question": {"id": "Q235", "variant": 0}, "response": ["From the perspective of a married female from Alexandria, Egypt, who is 37 years old, has completed higher education, and considers herself part of the lower middle class, my opinion on a political system with a strong leader who does not have to bother with parliament and elections would be fairly bad. The emic perspective of this question is influenced by the historical and cultural context of Egypt, where there has been a long-standing struggle for democracy and civil rights. Additionally, the socioeconomic background of being part of the lower middle class would likely lead to the belief that a strong leader without checks and balances could potentially perpetuate inequality and limit opportunities for upward mobility. My individual values and personal experiences, along with the nuanced phrasing of the question, also contribute to this opinion. \n\n3"]}, {"persona": {"region": "Alexandria", "sex": "female", "age": 56, "country": "Egypt", "marital_status": "divorced", "education": "middle", "social_class": "working class"}, "question": {"id": "Q235", "variant": 0}, "response": ["Based on the anthropological framework, my perspective is heavily influenced by my cultural context, individual values, and socioeconomic background. Coming from Alexandria, Egypt, I am familiar with the political system and its impact on the working class. My middle education level has shaped my understanding of governance and politics, and I value stability and security in a society. As part of the working class, I have experienced the challenges and struggles of everyday life, and I believe a strong leader could bring about positive changes and address issues more effectively than a parliamentary system. Therefore, my opinion on a political system with a strong leader who does not have to bother with parliament and elections is:\n\n2"]}, {"persona": {"region": "Alexandria", "sex": "male", "age": 48, "country": "Egypt", "marital_status": "married", "education": "higher", "social_class": "working class"}, "question": {"id": "Q235", "variant": 0}, "response": ["From an emic perspective, as a married male from Alexandria, Egypt, I have been brought up in a culture that values strong leadership and authority. The cultural context of Egypt has historically been one of centralized power and authority, where leaders are expected to make decisions without interference from others. Additionally, my individual values and personal experience have shaped my belief that a strong leader can bring stability and order to a country, which is especially important given the socioeconomic background of being part of the working class in Egypt. Furthermore, the cultural relativism in Egypt leads to a nuanced understanding of leadership, where a strong leader is often seen as necessary for progress and development. Therefore, based on my perspective and understanding, I would choose option (2) Fairly good. \n\n2"]}, {"persona": {"region": "Alexandria", "sex": "female", "age": 30, "country": "Egypt", "marital_status": "married", "education": "middle", "social_class": "working class"}, "question": {"id": "Q235", "variant": 0}, "response": ["Based on the anthropological framework, my perspective as a married female from Alexandria, Egypt, who is 30 years old and part of the working class, is influenced by my cultural context, individual values, and socioeconomic background. I come from a country with a long history of political instability and authoritarian rule. My cultural context and personal experience have taught me the importance of democracy and the value of having a voice in the political process. Additionally, as part of the working class, I have experienced firsthand the impact of government policies on my livelihood. Therefore, my opinion on a political system with a strong leader who does not have to bother with parliament and elections would be fairly bad.\n\n3"]}, {"persona": {"region": "Alexandria", "sex": "male", "age": 19, "country": "Egypt", "marital_status": "single", "education": "middle", "social_class": "lower class"}, "question": {"id": "Q235", "variant": 0}, "response": ["From my emic perspective as a lower-class, 19-year-old male from Alexandria, Egypt, I have grown up in a cultural context where socioeconomic background greatly impacts one's opportunities and experiences. My individual values and personal experiences have led me to believe that a political system with a strong leader who does not have to bother with parliament and elections is fairly bad. As a member of the lower class, I have seen firsthand the struggles and injustices that can occur when power is concentrated in the hands of a few without proper checks and balances. Additionally, I have witnessed the importance of having a voice in the political process, and I believe that such a system would not be conducive to the representation and well-being of people like myself. Cultural relativism also plays a role in my perspective, as I understand that different cultures may have different political systems, but from my own lived experience, I believe that this type of system would not be in the best interest of the majority of the population. \n\n3"]}, {"persona": {"region": "Alexandria", "sex": "male", "age": 45, "country": "Egypt", "marital_status": "married", "education": "middle", "social_class": "lower middle class"}, "question": {"id": "Q235", "variant": 0}, "response": ["From the perspective of a married male from Alexandria, Egypt, who is 45 years old, completed middle education, and considers himself part of the lower middle class, my opinion on a political system with a strong leader who does not have to bother with parliament and elections would be influenced by several factors. The cultural context in Egypt, where there has been a history of authoritarian rule, would lead me to consider the potential impact on individual freedoms and rights. My socioeconomic background as part of the lower middle class would also lead me to consider the potential impact on economic opportunities and social mobility. Additionally, my personal experience and values would lead me to value a system that allows for representation and accountability. Therefore, my opinion on this political system would be fairly bad.\n\n3"]}, {"persona": {"region": "Alexandria", "sex": "male", "age": 23, "country": "Egypt", "marital_status": "single", "education": "higher", "social_class": "lower class"}, "question": {"id": "Q235", "variant": 0}, "response": ["From an emic perspective, as a single male from Alexandria, Egypt, I am deeply embedded in the cultural context of my community. The socioeconomic background of being part of the lower class has shaped my individual values and personal experiences, leading me to prioritize stability and security in a political system. Considering the historical and contemporary political landscape of Egypt, I am inclined to favor a strong leader who can provide stability and address the economic challenges faced by those in my socioeconomic position. Additionally, the cultural relativism of my background emphasizes respect for authority and the importance of a leader who can take decisive action. Taking into account my age and place, I believe that a strong leader could potentially bring positive change to my community. \n\n2"]}, {"persona": {"region": "Alexandria", "sex": "female", "age": 28, "country": "Egypt", "marital_status": "married", "education": "middle", "social_class": "working class"}, "question": {"id": "Q235", "variant": 0}, "response": ["Based on my cultural context, as a married female from Alexandria, Egypt, my opinion on a political system with a strong leader who does not have to bother with parliament and elections would be influenced by my socioeconomic background and individual values. Egypt has a complex political history, and as a working-class woman, I have experienced the impact of political decisions on my daily life. I value democracy and the ability to have a say in the government that represents me, so I would consider a political system with a strong leader and no parliamentary or electoral oversight as fairly bad. I believe that it is important for all voices to be heard in the decision-making process, and for leaders to be held accountable to the people they serve.\n\n3"]}, {"persona": {"region": "Alexandria", "sex": "male", "age": 34, "country": "Egypt", "marital_status": "single", "education": "higher", "social_class": "working class"}, "question": {"id": "Q235", "variant": 0}, "response": ["Based on the anthropological framework, I, as a single male from Alexandria, Egypt, would approach the question of a political system with a strong leader from a cultural context, individual values, and socioeconomic background. As someone from a working-class background in Egypt, I have experienced the challenges of political instability and economic hardships. My personal experience and values lead me to prioritize stability and strong leadership as a means to address these issues. Additionally, the cultural context of Egypt, with its history of authoritarian rule and complex socio-political dynamics, may influence my perspective on the potential benefits of a strong leader. Therefore, my opinion on a political system with a strong leader who does not have to bother with parliament and elections would be:\n\n2"]}, {"persona": {"region": "Alexandria", "sex": "male", "age": 30, "country": "Egypt", "marital_status": "married", "education": "higher", "social_class": "lower middle class"}, "question": {"id": "Q235", "variant": 0}, "response": ["From the perspective of a married male from Alexandria, Egypt, who is 30 years old and part of the lower middle class, several factors come into play in forming an opinion on a political system with a strong leader who does not have to bother with parliament and elections. The cultural context of Egypt, with its history of authoritarian rule, may influence a positive view of a strong leader. Additionally, the socioeconomic background of being part of the lower middle class may lead to a desire for stability and order, which a strong leader may promise. However, individual values and personal experience, such as experiencing the negative effects of authoritarianism, may also lead to a negative opinion. Finally, the nuanced phrasing of the question may also affect the response, as a strong leader could be viewed as beneficial in some scenarios but detrimental in others.\n\n3"]}, {"persona": {"region": "Alexandria", "sex": "female", "age": 49, "country": "Egypt", "marital_status": "married", "education": "higher", "social_class": "lower middle class"}, "question": {"id": "Q235", "variant": 0}, "response": ["Based on my cultural context, as a married female from Alexandria, Egypt, I have been influenced by the political landscape and leadership in my country. My personal experience and individual values also play a significant role in shaping my opinion. Coming from the lower middle class, I have seen the impact of political decisions on people like me. Additionally, my higher education has taught me to critically analyze power structures and their implications. Taking into account the nuance of the question and the emic perspective from which I am answering, I believe that a political system with a strong leader who does not have to bother with parliament and elections would be fairly bad. \n\n3"]}, {"persona": {"region": "Kafr el-sheikh", "sex": "male", "age": 49, "country": "Egypt", "marital_status": "married", "education": "higher", "social_class": "working class"}, "question": {"id": "Q235", "variant": 0}, "response": ["Based on the anthropological framework, my opinion on a political system with a strong leader who does not have to bother with parliament and elections would be heavily influenced by my cultural context, individual values, and socioeconomic background. Coming from Kafr el-sheikh, Egypt, where there is a history of authoritarian leadership, and as a member of the working class with a higher education level, I am likely to have experienced and witnessed the impact of such a political system. My personal experience and values would lead me to believe that such a system is fairly bad, as it often results in limited representation and voice for the working class and can lead to abuse of power. Additionally, the cultural relativism perspective would remind me that there is no hierarchy of cultures, and a political system that does not value democratic processes can be detrimental to the well-being of the people. \n\n3"]}, {"persona": {"region": "Kafr el-sheikh", "sex": "male", "age": 25, "country": "Egypt", "marital_status": "single", "education": "middle", "social_class": "lower middle class"}, "question": {"id": "Q235", "variant": 0}, "response": ["Based on my cultural context, being from Kafr el-sheikh, Egypt, and my socioeconomic background as part of the lower middle class, I have been influenced by the political environment and leadership in my country. My personal experience and individual values have shaped my understanding of the political system. Additionally, the cultural relativism approach has taught me to understand and respect different political systems. Therefore, I believe that a political system with a strong leader who does not have to bother with parliament and elections may be fairly good for providing stability and swift decision-making. \n\n2"]}, {"persona": {"region": "Kafr el-sheikh", "sex": "male", "age": 59, "country": "Egypt", "marital_status": "married", "education": "higher", "social_class": "lower middle class"}, "question": {"id": "Q235", "variant": 0}, "response": ["From the emic perspective, as a married male from Kafr el-sheikh, Egypt, I have been brought up in a society where the cultural context heavily influences my understanding of political systems. The socioeconomic background of being part of the lower middle class has also shaped my perception of governance. Additionally, my age and personal experiences have also influenced my view on this matter. Taking into account the nuanced phrasing of the question, I would choose the following option:\n\n3"]}, {"persona": {"region": "Kafr el-sheikh", "sex": "female", "age": 38, "country": "Egypt", "marital_status": "married", "education": "middle", "social_class": "working class"}, "question": {"id": "Q235", "variant": 0}, "response": ["Based on my cultural context and socioeconomic background, I believe that a political system with a strong leader who does not have to bother with parliament and elections would be fairly good. In my community, there is a strong emphasis on stability and security, and a leader who can provide that without being bogged down by political gridlock and corruption may be seen as a positive force. Additionally, my personal experience and individual values lead me to prioritize strong leadership and efficiency over the complexities of parliamentary systems. I understand that this perspective may not be universally shared, but it is important to consider the nuanced and culturally relative nature of political opinions. \n\n2"]}, {"persona": {"region": "Kafr el-sheikh", "sex": "male", "age": 35, "country": "Egypt", "marital_status": "married", "education": "higher", "social_class": "lower middle class"}, "question": {"id": "Q235", "variant": 0}, "response": ["As a married male from Kafr el-sheikh, Egypt, I must consider the emic and etic perspectives that shape my understanding of a political system with a strong leader. In my cultural context, there is a history of authoritarian rule and the influence of strong leaders. Additionally, my individual values and personal experiences have led me to believe that a strong leader may be necessary for stability and progress in a country like Egypt. My socioeconomic background as part of the lower middle class also plays a role, as I may feel that a strong leader can address economic issues more effectively. Considering cultural relativism, I understand that my perspective may differ from others, but I believe that a strong leader can bring positive change. Based on these factors, my opinion on a political system with a strong leader who does not have to bother with parliament and elections is:\n\n2"]}, {"persona": {"region": "Kafr el-sheikh", "sex": "male", "age": 49, "country": "Egypt", "marital_status": "married", "education": "middle", "social_class": "lower class"}, "question": {"id": "Q235", "variant": 0}, "response": ["As a married male from Kafr el-sheikh, Egypt, I am deeply rooted in my cultural context and socioeconomic background. I am part of the lower class and have completed only middle education, so my understanding of political systems is influenced by my personal experience and individual values. In my community, strong leadership is often seen as a means to provide stability and security, especially in times of economic hardship. Additionally, the etic perspective in our society tends to prioritize the authority of a strong leader over the complexities of parliamentary democracy. Therefore, my opinion on a political system with a strong leader who does not have to bother with parliament and elections is that it is very good.\n\n1"]}, {"persona": {"region": "Kafr el-sheikh", "sex": "male", "age": 37, "country": "Egypt", "marital_status": "married", "education": "middle", "social_class": "lower class"}, "question": {"id": "Q235", "variant": 0}, "response": ["Based on my cultural context and socioeconomic background, I have grown up in a society where the political system has been dominated by strong leaders who do not have to bother with parliament and elections. This has resulted in stability and order in the country, which is crucial for the well-being of the lower class, like myself, who rely on these leaders to provide for our basic needs. As a member of the lower class, I value stability and security over the complexities of a democratic system, which can often be chaotic and uncertain. Therefore, I believe that a political system with a strong leader who does not have to bother with parliament and elections is very good for our country.\n\n1"]}, {"persona": {"region": "Menofia", "sex": "female", "age": 22, "country": "Egypt", "marital_status": "single", "education": "middle", "social_class": "lower class"}, "question": {"id": "Q235", "variant": 0}, "response": ["Based on my cultural context and socioeconomic background, I have experienced the challenges of living in a lower-class community in Menofia, Egypt. My personal experience and individual values have shaped my understanding of the political system. I understand the importance of having a strong leader who can make decisions quickly and efficiently without being hindered by bureaucracy. Additionally, cultural relativism has taught me to appreciate different perspectives, and I believe that a strong leader can bring stability to a country like Egypt. Therefore, I would choose option (2) Fairly good."]}, {"persona": {"region": "Menofia", "sex": "female", "age": 25, "country": "Egypt", "marital_status": "married", "education": "middle", "social_class": "lower class"}, "question": {"id": "Q235", "variant": 0}, "response": ["Based on my emic perspective as a married female from Menofia, Egypt, I have grown up in a lower-class cultural context where individual values and personal experiences are heavily influenced by socioeconomic background. As a result, I have experienced the struggles of living in a lower-class community and have seen the impact of political decisions on my daily life. From this perspective, I believe that a political system with a strong leader who does not have to bother with parliament and elections could be fairly good because it may provide stability and direction in a society that has struggled with political unrest and instability. Additionally, cultural relativism is important to consider as different cultures may have different perspectives on this issue. Therefore, my opinion is that a strong leader could potentially bring about positive change in our community.\n2"]}, {"persona": {"region": "Menofia", "sex": "male", "age": 28, "country": "Egypt", "marital_status": "single", "education": "higher", "social_class": "working class"}, "question": {"id": "Q235", "variant": 0}, "response": ["Based on my emic perspective, coming from Menofia, Egypt, I have been influenced by the cultural context and socioeconomic background of my community. As a member of the working class, I have seen the struggles and challenges faced by the people in my community, and I believe that a strong leader who does not have to bother with parliament and elections could potentially bring stability and effective decision-making. I also value the individual values and personal experiences of those around me, and I have seen how a strong leader can bring about positive change in certain circumstances. Additionally, considering the nuances of the political system in Egypt, I believe that a strong leader may be necessary to navigate the complexities of our society. Therefore, my opinion on a political system with a strong leader who does not have to bother with parliament and elections is (2) Fairly good."]}, {"persona": {"region": "Menofia", "sex": "male", "age": 35, "country": "Egypt", "marital_status": "married", "education": "middle", "social_class": "lower middle class"}, "question": {"id": "Q235", "variant": 0}, "response": ["Based on the anthropological framework, as a married male from Menofia, Egypt, my emic perspective is influenced by my cultural context, individual values, and socioeconomic background. In Egypt, there is a strong sense of community and respect for authority, which may lead me to view a political system with a strong leader as beneficial for maintaining order and stability. Additionally, my lower middle-class status and middle education level may make me more inclined to support a strong leader who promises economic security and development. However, considering cultural relativism, I understand that this perspective may not be shared by individuals from different backgrounds or experiences. \n\n2"]}, {"persona": {"region": "Menofia", "sex": "male", "age": 55, "country": "Egypt", "marital_status": "married", "education": "middle", "social_class": "working class"}, "question": {"id": "Q235", "variant": 0}, "response": ["Based on the anthropological framework, my perspective on a political system with a strong leader who does not have to bother with parliament and elections is influenced by my cultural context, socioeconomic background, and individual values. As a married male from Menofia, Egypt, I come from a working-class background and have had middle level education. In Egypt, there is a history of strong leaders and a political system that may not prioritize democratic processes. Additionally, my age and experiences have shaped my perception of political systems. Considering these factors, I believe that a political system with a strong leader who does not have to bother with parliament and elections may be fairly good for maintaining stability and order in the country, even if it may not align with Western notions of democracy.\n\n2"]}, {"persona": {"region": "Menofia", "sex": "male", "age": 53, "country": "Egypt", "marital_status": "married", "education": "higher", "social_class": "lower middle class"}, "question": {"id": "Q235", "variant": 0}, "response": ["Based on the anthropological framework, my answer to the question is influenced by my cultural context, individual values, and socioeconomic background. Coming from Menofia, Egypt, I am familiar with a political system that has traditionally had a strong leader who does not have to bother with parliament and elections. This has been the norm for much of my life and is deeply embedded in the cultural context of my community. Additionally, as a member of the lower middle class, I have experienced firsthand the impact of political decisions on my socioeconomic status. Therefore, I believe that a political system with a strong leader who does not have to bother with parliament and elections is fairly good as it provides stability and continuity, which is important for maintaining order and economic security in my community. \n\n2"]}, {"persona": {"region": "Menofia", "sex": "male", "age": 59, "country": "Egypt", "marital_status": "married", "education": "middle", "social_class": "working class"}, "question": {"id": "Q235", "variant": 0}, "response": ["Based on the anthropological framework, my opinion on a political system with a strong leader who does not have to bother with parliament and elections is influenced by my emic perspective as a married male from Menofia, Egypt. In my cultural context, there is a history of strong leaders and centralized power, so I may view this system more favorably. Additionally, my individual values and personal experience as a working-class individual may lead me to prioritize stability and security over democratic processes. My socioeconomic background and middle education level may also shape my opinion, as I may feel less empowered to participate in a democratic system. Furthermore, the nuance of the question may lead me to consider the potential benefits of a strong leader, such as economic development and public order. Therefore, my opinion aligns with (2) Fairly good."]}, {"persona": {"region": "Menofia", "sex": "female", "age": 42, "country": "Egypt", "marital_status": "married", "education": "middle", "social_class": "lower middle class"}, "question": {"id": "Q235", "variant": 0}, "response": ["Based on the anthropological framework, as a married female from Menofia, Egypt, with a lower middle-class socioeconomic background and completed middle education level, my perspective on a political system with a strong leader who does not have to bother with parliament and elections would be fairly good (2). In the cultural context of Egypt, there is a historical precedent for strong leadership and a paternalistic style of governance. Additionally, my individual values and personal experience have shaped my perception, as I have witnessed the challenges and inefficiencies of the current political system. However, I also recognize the importance of nuance in this answer, as I understand that not everyone may share my perspective."]}, {"persona": {"region": "Menofia", "sex": "male", "age": 39, "country": "Egypt", "marital_status": "married", "education": "higher", "social_class": "working class"}, "question": {"id": "Q235", "variant": 0}, "response": ["From an emic perspective, as a married male from Menofia, Egypt, I have been influenced by the cultural context of my community and the socioeconomic background of the working class. My individual values and personal experiences have shaped my understanding of politics and governance. Additionally, cultural relativism is important as I understand that different cultures have different political systems. My age and place also play a role in my opinion. Overall, I believe that a political system with a strong leader who does not have to bother with parliament and elections may be seen as beneficial in providing stability and direction for the country. It aligns with the cultural context of Egypt, where historically strong leaders have been revered. Additionally, as a member of the working class, I may see this system as a way to address issues such as poverty and unemployment, which are important to me and my community.\n3"]}, {"persona": {"region": "Menofia", "sex": "male", "age": 34, "country": "Egypt", "marital_status": "married", "education": "middle", "social_class": "lower middle class"}, "question": {"id": "Q235", "variant": 0}, "response": ["Based on the anthropological framework, my opinion would be influenced by my cultural context, individual values, and socioeconomic background. As a married male from Menofia, Egypt, I am likely to have been influenced by the political climate and leadership style in my country. Additionally, my lower middle class status and middle education level may influence my perception of a political system with a strong leader who does not have to bother with parliament and elections. Considering these factors, I would choose option 2: Fairly good. \n\n2"]}, {"persona": {"region": "Menofia", "sex": "male", "age": 22, "country": "Egypt", "marital_status": "single", "education": "higher", "social_class": "working class"}, "question": {"id": "Q235", "variant": 0}, "response": ["From the emic perspective, as a single male from Menofia, Egypt, I have been raised in a cultural context where the political system has historically been centralized with a strong leader. This has shaped my individual values and personal experience, as well as my socioeconomic background as part of the working class. Additionally, the cultural relativism in Egypt means that there is a nuanced understanding of the role of a strong leader in politics. Taking into account my age and place, I understand the complexities of the political system in Egypt. Therefore, I believe that a political system with a strong leader who does not have to bother with parliament and elections could be fairly good for the stability and progress of the country, as long as the leader is just and benevolent in their decision-making and governance.\n\n2"]}, {"persona": {"region": "Menofia", "sex": "male", "age": 21, "country": "Egypt", "marital_status": "single", "education": "middle", "social_class": "working class"}, "question": {"id": "Q235", "variant": 0}, "response": ["Based on the anthropological framework, as a 21-year-old single male from Menofia, Egypt, who has completed middle education level and considers himself part of the working class, my perspective is heavily influenced by my cultural context, individual values, and socioeconomic background. In Egypt, there is a history of centralized power and a strong leader, and this has both positive and negative implications. My experience and the values of my community may lead me to see a strong leader as providing stability and security, especially in a region that has experienced political turmoil. However, my working class background may also make me wary of potential abuse of power and limited representation in government. Additionally, I may be influenced by the emic perspective of valuing strong leadership as a means of addressing social and economic challenges. Therefore, my opinion on a political system with a strong leader who does not have to bother with parliament and elections may be influenced by a combination of factors, ultimately leading me to choose option (2) Fairly good."]}, {"persona": {"region": "Menofia", "sex": "male", "age": 36, "country": "Egypt", "marital_status": "married", "education": "higher", "social_class": "working class"}, "question": {"id": "Q235", "variant": 0}, "response": ["Based on the anthropological framework, my opinion on a political system with a strong leader who does not have to bother with parliament and elections would be influenced by a combination of my cultural context, individual values and personal experience, and socioeconomic background. As a married male from Menofia, Egypt, I come from a culture with a long history of authoritarian rule, so I may have a more accepting view of a strong leader. Additionally, as part of the working class, I may prioritize stability and economic security over democratic processes. However, having completed higher education, I also value individual freedoms and may be critical of a system that restricts political participation. Therefore, the nuanced phrasing of the question and the cultural relativism framework would lead me to select the option: \n\n2"]}, {"persona": {"region": "Menofia", "sex": "female", "age": 52, "country": "Egypt", "marital_status": "married", "education": "higher", "social_class": "lower middle class"}, "question": {"id": "Q235", "variant": 0}, "response": ["Based on my cultural context as a married female from Menofia, Egypt, my understanding and opinion on a political system with a strong leader who does not have to bother with parliament and elections is heavily influenced by my socioeconomic background, individual values, and personal experience. As someone from the lower middle class, I have personally experienced the challenges and struggles faced by my community, and I believe that a political system with a strong leader who does not have to bother with parliament and elections would not necessarily represent the interests and needs of people like me. Additionally, my cultural relativism and understanding of the nuances of political power and governance lead me to believe that such a system could potentially be unfair and undemocratic, ultimately disadvantaging those who are already marginalized. Therefore, my opinion is:\n\n3"]}, {"persona": {"region": "Menofia", "sex": "male", "age": 52, "country": "Egypt", "marital_status": "married", "education": "higher", "social_class": "lower middle class"}, "question": {"id": "Q235", "variant": 0}, "response": ["Based on the anthropological framework, my perspective on the political system with a strong leader who does not have to bother with parliament and elections is heavily influenced by my cultural context, individual values, and socioeconomic background. In Menofia, Egypt, there is a complex history of political systems and governance, which has shaped my understanding of power dynamics and leadership. Additionally, my lower middle-class status and higher education level have exposed me to different political ideologies and systems. I value the importance of representation and accountability in governance, and I recognize the potential dangers of unchecked power. Therefore, I believe that a political system with a strong leader who does not have to bother with parliament and elections would be fairly bad. \n\n3"]}, {"persona": {"region": "Menofia", "sex": "male", "age": 39, "country": "Egypt", "marital_status": "married", "education": "middle", "social_class": "lower class"}, "question": {"id": "Q235", "variant": 0}, "response": ["Based on my emic perspective as a married male from Menofia, Egypt, I have been influenced by the cultural context of my region, where the socioeconomic background plays a significant role in shaping opinions. As part of the lower class, I have experienced firsthand the struggles and challenges that come with this status. Additionally, my individual values and personal experiences have led me to believe that a political system with a strong leader who does not have to bother with parliament and elections would be fairly bad for people like myself. I believe in the importance of having a voice and representation in the government, and such a system would not prioritize the needs and concerns of individuals from lower socioeconomic backgrounds like mine.\n\n3"]}, {"persona": {"region": "Menofia", "sex": "male", "age": 23, "country": "Egypt", "marital_status": "single", "education": "middle", "social_class": "lower middle class"}, "question": {"id": "Q235", "variant": 0}, "response": ["Based on my emic perspective as a single male from Menofia, Egypt, I have grown up in a cultural context where the political system has often been led by a strong leader. My individual values and personal experiences have shaped my perception of the role of a strong leader, and I have witnessed the influence of socioeconomic background on political opinions. As a member of the lower middle class, I have seen the impact of political decisions on my community and have developed a nuanced understanding of the importance of a leader who can make decisive decisions. Taking into account the space and time in which I have grown up, I believe that a political system with a strong leader who does not have to bother with parliament and elections could be fairly good for the stability and progress of our country.\n\n2"]}, {"persona": {"region": "Dakahlia", "sex": "female", "age": 24, "country": "Egypt", "marital_status": "single", "education": "higher", "social_class": "lower middle class"}, "question": {"id": "Q235", "variant": 0}, "response": ["Based on my emic perspective, coming from Dakahlia, Egypt, I have been influenced by the cultural context of my community, where there is a strong emphasis on respect for authority and stability. My individual values and personal experience have shaped my understanding of the political system, as I have seen the impact of strong leadership on our community. Additionally, my lower middle-class socioeconomic background has influenced my perception of the political system, as I prioritize stability and economic security. Furthermore, cultural relativism reminds me that my perspective is not universal and may differ from others. Therefore, I believe that a political system with a strong leader who does not have to bother with parliament and elections is (2) Fairly good."]}, {"persona": {"region": "Dakahlia", "sex": "male", "age": 36, "country": "Egypt", "marital_status": "married", "education": "higher", "social_class": "upper middle class"}, "question": {"id": "Q235", "variant": 0}, "response": ["Based on the anthropological framework, as a married male from Dakahlia, Egypt who has completed higher education and considers myself part of the upper middle class, my perspective on a political system with a strong leader who does not have to bother with parliament and elections is influenced by a combination of emic and etic perspectives, cultural context, individual values and personal experience, socioeconomic background, cultural relativism, space and time, and nuance. In my cultural context, there is a historical precedent for a strong leader, and many people in my socioeconomic background may view this as a stable and efficient form of government. However, my personal experience and education have exposed me to the importance of democratic processes and the potential for abuse of power in a system without checks and balances. Therefore, my perspective is that a political system with a strong leader who does not have to bother with parliament and elections is fairly bad.\n\n3"]}, {"persona": {"region": "Dakahlia", "sex": "female", "age": 71, "country": "Egypt", "marital_status": "married", "education": "higher", "social_class": "upper middle class"}, "question": {"id": "Q235", "variant": 0}, "response": ["From the perspective of a married female from Dakahlia, Egypt, who is 71 years old and part of the upper middle class, my opinion on a political system with a strong leader who does not have to bother with parliament and elections is based on my cultural context, individual values, and personal experience. In Egypt, there has historically been a strong emphasis on authoritarian leadership, and this has often been perceived as necessary for stability and development. Additionally, my education level has likely exposed me to different perspectives on governance, but my socioeconomic background may lead me to value stability and security over democratic processes. However, as a member of the upper middle class, I may also have concerns about authoritarianism impacting my social and economic status. Therefore, my opinion may be influenced by a combination of cultural relativism, individual values, and socioeconomic background.\n\n3"]}, {"persona": {"region": "Dakahlia", "sex": "male", "age": 55, "country": "Egypt", "marital_status": "married", "education": "higher", "social_class": "upper middle class"}, "question": {"id": "Q235", "variant": 0}, "response": ["Based on the anthropological framework, my opinion on a political system with a strong leader who does not have to bother with parliament and elections is influenced by my cultural context, individual values, and socioeconomic background. As someone from Dakahlia, Egypt, I am aware of the historical and cultural context of my country, where strong leadership has been valued and respected. Additionally, my higher education level has provided me with a nuanced understanding of political systems and their implications. As part of the upper middle class, I have experienced the benefits of stability and economic growth, which can be associated with a strong leader. Therefore, my opinion on this political system is (2) Fairly good."]}, {"persona": {"region": "Dakahlia", "sex": "male", "age": 64, "country": "Egypt", "marital_status": "married", "education": "higher", "social_class": "lower middle class"}, "question": {"id": "Q235", "variant": 0}, "response": ["From an emic perspective, as a married male from Dakahlia, Egypt, my opinion on a political system with a strong leader who does not have to bother with parliament and elections is shaped by my cultural context and individual values. In Egypt, there has historically been a strong reverence for authority and centralized leadership, which may lead some to view a strong leader as beneficial for stability and progress. Additionally, my lower middle class socioeconomic background may influence my opinion, as a strong leader may be perceived as someone who can provide economic opportunities and security. However, from an etic perspective, considering the principles of cultural relativism and the importance of nuanced understanding, I recognize that this perspective may not be shared universally and that others may have valid concerns about the potential for abuse of power and lack of accountability in such a political system.\n\n3"]}, {"persona": {"region": "Dakahlia", "sex": "female", "age": 29, "country": "Egypt", "marital_status": "married", "education": "middle", "social_class": "lower class"}, "question": {"id": "Q235", "variant": 0}, "response": ["Based on the anthropological framework, my perspective as a married female from Dakahlia, Egypt, who is 29 years old and part of the lower class, is heavily influenced by my cultural context, individual values, and socioeconomic background. In Egypt, there is a strong emphasis on communal living and respect for authority. My personal experience and values also lead me to prioritize stability and security, which may lead me to view a strong leader as a positive force for maintaining order in society. Additionally, my lower socioeconomic background may lead me to value a leader who promises economic stability and job security. Therefore, my perspective may align with option 2: Fairly good, as I may see a strong leader as necessary for maintaining order and stability in the country. \n\n2"]}, {"persona": {"region": "Dakahlia", "sex": "female", "age": 40, "country": "Egypt", "marital_status": "married", "education": "middle", "social_class": "upper middle class"}, "question": {"id": "Q235", "variant": 0}, "response": ["Based on my background and cultural context as a married female from Dakahlia, Egypt, who is 40 years old and part of the upper middle class, my opinion on a political system with a strong leader who does not have to bother with parliament and elections is fairly good. In my cultural context, there is a great emphasis on stability and order, and a strong leader may be perceived as someone who can bring about these qualities. Additionally, my socioeconomic background may lead me to believe that a strong leader can bring about economic growth and prosperity. However, my nuanced understanding of the question also leads me to consider the potential drawbacks of such a system, such as the lack of representation and potential for abuse of power. Therefore, my opinion is that it is fairly good.\n\n2"]}, {"persona": {"region": "Dakahlia", "sex": "male", "age": 37, "country": "Egypt", "marital_status": "married", "education": "higher", "social_class": "lower middle class"}, "question": {"id": "Q235", "variant": 0}, "response": ["Based on my cultural context, as a married male from Dakahlia, Egypt, I am influenced by the political and social dynamics of my region. My individual values and personal experiences have shaped my perception of political systems. As someone from the lower middle class, my socioeconomic background plays a role in my understanding of governance and leadership. Additionally, my age and education level have provided me with nuanced perspectives. Considering the emic and etic perspectives, I believe that a political system with a strong leader who bypasses parliament and elections may be fairly good for stability and efficiency, given the current circumstances in my country.\n\n2"]}, {"persona": {"region": "Dakahlia", "sex": "female", "age": 45, "country": "Egypt", "marital_status": "married", "education": "middle", "social_class": "working class"}, "question": {"id": "Q235", "variant": 0}, "response": ["Based on my cultural context as a married female from Dakahlia, Egypt, where there is a strong emphasis on traditional family and community values, and where socioeconomic background also plays a significant role in shaping political opinions, I would consider a political system with a strong leader who does not have to bother with parliament and elections to be fairly good. In my community, there is a strong respect for authority and a belief in the importance of a strong leader to maintain stability and order. Additionally, my middle education level has taught me to value the importance of a strong leader in guiding and protecting the country. Overall, I believe that this type of political system would be beneficial for maintaining order and prosperity in our society.\n\n2"]}, {"persona": {"region": "Dakahlia", "sex": "male", "age": 34, "country": "Egypt", "marital_status": "single", "education": "middle", "social_class": "lower middle class"}, "question": {"id": "Q235", "variant": 0}, "response": ["Based on my emic perspective, coming from a lower middle class background in Dakahlia, Egypt, I have experienced the challenges and struggles that my community faces. The cultural context and socioeconomic background of my upbringing have shaped my understanding of the importance of stability and strong leadership. My personal experience and individual values have led me to believe that a political system with a strong leader who does not have to bother with parliament and elections could potentially provide the stability and direction that my community needs. Furthermore, cultural relativism and the nuance of the situation must be considered, as the specific circumstances in Egypt may warrant a different perspective than in other places. \n\n2"]}, {"persona": {"region": "Dakahlia", "sex": "female", "age": 26, "country": "Egypt", "marital_status": "married", "education": "higher", "social_class": "upper middle class"}, "question": {"id": "Q235", "variant": 0}, "response": ["Based on the anthropological framework, my perspective as a married female from Dakahlia, Egypt, who is 26 years old, has completed higher education, and considers herself part of the upper middle class, is shaped by a combination of emic and etic perspectives, cultural context, individual values and personal experience, socioeconomic background, and cultural relativism. In my cultural context, there is a strong emphasis on traditional family values and a patriarchal societal structure, which may influence my perspective on a political system with a strong leader. Additionally, my higher education level may have exposed me to different political ideologies and systems, leading to a more nuanced understanding. Furthermore, as someone from the upper middle class, I may have different concerns and priorities than those from other socioeconomic backgrounds. Taking all of this into consideration, my answer is #3 Fairly bad. \n\n3"]}, {"persona": {"region": "Dakahlia", "sex": "male", "age": 21, "country": "Egypt", "marital_status": "single", "education": "middle", "social_class": "upper middle class"}, "question": {"id": "Q235", "variant": 0}, "response": ["Based on the anthropological framework, as a single male from Dakahlia, Egypt, my emic perspective would be influenced by my cultural context, individual values, socioeconomic background, and space and time. In Egypt, there is a history of strong leadership and a centralized political system. As part of the upper middle class, I may have certain privileges and benefits from this type of political system, which may lead me to view it as fairly good. Additionally, my age and education level may also shape my understanding of political systems and their implications. Therefore, I would choose option 2: Fairly good.\n\n2"]}, {"persona": {"region": "Dakahlia", "sex": "female", "age": 32, "country": "Egypt", "marital_status": "married", "education": "middle", "social_class": "working class"}, "question": {"id": "Q235", "variant": 0}, "response": ["From the perspective of a married female from Dakahlia, Egypt, with a middle education level and working-class background, my opinion on a political system with a strong leader who does not have to bother with parliament and elections is influenced by my cultural context, socioeconomic background, and individual values. In Egypt, there is a long history of centralized leadership, and many people may view a strong leader as necessary for stability and development. Additionally, as a member of the working class, I may prioritize economic security and may view a strong leader as more capable of providing for the needs of the people. However, I also value individual rights and the ability to have a say in decision-making, so I may have reservations about a leader who does not have to bother with the input of the people. Overall, my opinion on this political system is likely to be influenced by a combination of support for stability and economic development, as well as concerns about lack of representation and voice for the people.\n\n3"]}, {"persona": {"region": "Dakahlia", "sex": "female", "age": 35, "country": "Egypt", "marital_status": "married", "education": "middle", "social_class": "upper middle class"}, "question": {"id": "Q235", "variant": 0}, "response": ["In my cultural context, as a married female from Dakahlia, Egypt, I have been influenced by the socioeconomic background of my upper middle class status and my completion of middle education level. My individual values and personal experiences also shape my perspective. Additionally, being from Egypt, where political systems have historically been complex and influenced by cultural and historical factors, I am inclined to believe that a strong leader who does not need to bother with parliament and elections may be beneficial for the stability and progress of the country, as long as the leader is competent and has the best interests of the people in mind. \n\n2"]}, {"persona": {"region": "Dakahlia", "sex": "male", "age": 33, "country": "Egypt", "marital_status": "married", "education": "middle", "social_class": "upper middle class"}, "question": {"id": "Q235", "variant": 0}, "response": ["Based on my cultural context as a married male from Dakahlia, Egypt, my opinion on a political system with a strong leader who does not have to bother with parliament and elections is influenced by my individual values and personal experience. Growing up in a society with a strong sense of hierarchy and authority, I may view a strong leader as necessary for maintaining order and stability. Additionally, as someone from the upper middle class, I may perceive a strong leader as beneficial for economic growth and security. However, considering the cultural relativism and nuance of the question, I also acknowledge the potential for abuse of power and lack of representation for diverse voices. Therefore, I would choose option (2) Fairly good, as I see the potential benefits of a strong leader but also recognize the potential drawbacks.\n\n2"]}, {"persona": {"region": "Dakahlia", "sex": "female", "age": 45, "country": "Egypt", "marital_status": "married", "education": "middle", "social_class": "upper middle class"}, "question": {"id": "Q235", "variant": 0}, "response": ["Based on the anthropological framework, as a married female from Dakahlia, Egypt, my emic perspective is shaped by my cultural context, individual values, and socioeconomic background. In Egypt, there is a long history of strong leaders and a centralized political system. This cultural context has influenced my perception of political leadership. Additionally, my middle education level and upper middle class status have likely exposed me to certain values and experiences that may align with the idea of a strong leader. Furthermore, my age and place of residence also play a role in shaping my opinion. Therefore, my answer to the question is:\n\n1"]}, {"persona": {"region": "Dakahlia", "sex": "male", "age": 30, "country": "Egypt", "marital_status": "married", "education": "middle", "social_class": "upper middle class"}, "question": {"id": "Q235", "variant": 0}, "response": ["Based on my cultural context, coming from Dakahlia, Egypt, I have grown up in a society where the political system has historically been centered around a strong leader. This has been ingrained in my upbringing and is a part of the cultural context in which I live. Additionally, my socioeconomic background as part of the upper middle class has provided me with certain privileges and opportunities that have shaped my perspective. I also consider the nuance of the question and how it is phrased, which may influence my answer. \n3"]}, {"persona": {"region": "Dakahlia", "sex": "female", "age": 63, "country": "Egypt", "marital_status": "married", "education": "higher", "social_class": "lower middle class"}, "question": {"id": "Q235", "variant": 0}, "response": ["Based on my emic perspective as a married female from Dakahlia, Egypt, I have experienced the impact of our cultural context and socioeconomic background on our political system. I have seen how individual values and personal experiences shape our understanding of the role of a strong leader and the importance of parliamentary and electoral processes. Additionally, the cultural relativism in our society has taught me to appreciate the nuances of our political landscape. Given my age and place, I have witnessed the changes in our political system and how they have affected our community. Therefore, I believe that a political system with a strong leader who does not have to bother with parliament and elections would be fairly bad for our society as it may limit the representation and voice of the people.\n\n3"]}, {"persona": {"region": "Dakahlia", "sex": "male", "age": 28, "country": "Egypt", "marital_status": "single", "education": "higher", "social_class": "upper middle class"}, "question": {"id": "Q235", "variant": 0}, "response": ["Based on my emic perspective as a single male from Dakahlia, Egypt, I have grown up in a cultural context where a strong leader has been the norm. My individual values and personal experience have shaped my perception, and as someone from the upper middle class with higher education, I have seen the benefits of a strong leader in providing stability and economic growth. Additionally, my socioeconomic background has influenced my opinion, as I have benefited from the policies of a strong leader. Cultural relativism also plays a role in my understanding, as I recognize that different cultures may have different political systems. Age and place are important factors, and as a 28-year-old from Dakahlia, Egypt, I have seen the positive impact of a strong leader. Therefore, I believe that a political system with a strong leader who does not have to bother with parliament and elections is fairly good.\n\n2"]}, {"persona": {"region": "Dakahlia", "sex": "female", "age": 24, "country": "Egypt", "marital_status": "married", "education": "higher", "social_class": "upper middle class"}, "question": {"id": "Q235", "variant": 0}, "response": ["From an emic perspective, as a married female from Dakahlia, Egypt, with a higher education and belonging to the upper middle class, my cultural context and individual values place a strong emphasis on stability and security. Socioeconomic background also plays a role in my opinion, as I may have benefited from the current system. However, I understand the importance of cultural relativism and recognize that my perspective may not be shared by others. Additionally, my age and place also influence my understanding, as I have grown up in a society with a history of strong leadership. Therefore, I believe that a political system with a strong leader who does not have to bother with parliament and elections may be seen as very good for the stability and progress of the country, as long as the leader is benevolent and has the best interest of the people at heart.\n\n1"]}, {"persona": {"region": "Dakahlia", "sex": "male", "age": 20, "country": "Egypt", "marital_status": "single", "education": "middle", "social_class": "upper middle class"}, "question": {"id": "Q235", "variant": 0}, "response": ["Based on the anthropological framework, I would like to express my opinion on the political system with a strong leader who does not have to bother with parliament and elections. From an emic perspective, as a member of the upper middle class in Dakahlia, Egypt, I have grown up experiencing a society where authority and hierarchy are highly valued. The cultural context of Egypt also plays a significant role in shaping my views, as the country has a history of strong leadership and centralized power. Additionally, my individual values and personal experience lead me to believe that a strong leader can bring stability and progress to the country, especially in a region with political instability. Furthermore, my socioeconomic background has provided me with certain privileges and opportunities that may make me more supportive of a system that benefits the upper middle class. Overall, I believe that a political system with a strong leader could be very good for Egypt's development and stability. \n\n1"]}, {"persona": {"region": "Dakahlia", "sex": "male", "age": 45, "country": "Egypt", "marital_status": "married", "education": "middle", "social_class": "upper middle class"}, "question": {"id": "Q235", "variant": 0}, "response": ["Based on my background and cultural context as a married male from Dakahlia, Egypt, I would like to express my opinion on a political system with a strong leader who does not have to bother with parliament and elections. In our cultural context, there is a strong value placed on hierarchy and authority, and a leader who is able to make decisive decisions without the need for constant debate and negotiation may be seen as favorable. Additionally, considering my upper-middle-class status and the stability that comes with it, I may feel more inclined to support a political system with a strong leader who can maintain order and economic growth. However, it is important to consider the nuanced phrasing of the question and the potential impact on individual freedoms and rights within such a political system. \n\n4"]}, {"persona": {"region": "Dakahlia", "sex": "female", "age": 43, "country": "Egypt", "marital_status": "married", "education": "higher", "social_class": "upper middle class"}, "question": {"id": "Q235", "variant": 0}, "response": ["From the perspective of a married female from Dakahlia, Egypt, who is 43 years old, completed higher education, and considers herself part of the upper middle class, my opinion on a political system with a strong leader who does not have to bother with parliament and elections is influenced by my cultural context, individual values, and socioeconomic background. In Egypt, there is a long history of authoritarian rule, and as a member of the upper middle class, I may have benefited from stability and economic prosperity under such a system. However, I also value democratic principles and the importance of representation and accountability in government. Additionally, my higher education may have exposed me to alternative political systems and the importance of democratic values. Therefore, my opinion on this issue is likely to be fairly bad.\n\n3"]}, {"persona": {"region": "Dakahlia", "sex": "female", "age": 20, "country": "Egypt", "marital_status": "single", "education": "middle", "social_class": "upper middle class"}, "question": {"id": "Q235", "variant": 0}, "response": ["Based on the anthropological framework, my perspective as a single female from Dakahlia, Egypt, who is 20 years old and part of the upper middle class, is influenced by my cultural context, individual values, and personal experience. In Egypt, there is a strong emphasis on traditional family values and respect for authority. Additionally, my socioeconomic background places me in a position where I may benefit from a stable political system with a strong leader. However, I also recognize the importance of cultural relativism and understand that not everyone may share my perspective. Therefore, I believe that a political system with a strong leader who does not have to bother with parliament and elections could be fairly good for the stability and progress of the country. \n\n2"]}, {"persona": {"region": "Dakahlia", "sex": "female", "age": 40, "country": "Egypt", "marital_status": "single", "education": "middle", "social_class": "lower middle class"}, "question": {"id": "Q235", "variant": 0}, "response": ["Based on the anthropological framework, as a single female from Dakahlia, Egypt, who is 40 years old, completed middle education, and considers myself part of the lower middle class, my perspective on a political system with a strong leader who does not have to bother with parliament and elections is influenced by my cultural context, individual values, and socioeconomic background. In Egypt, there is a history of authoritarian leadership which has had negative impacts on the lives of many people, including those in lower socioeconomic classes. Additionally, my personal experience and values lead me to believe in the importance of democratic processes and the representation of the people's voices. Therefore, I would choose option 4: Very bad. \n\n4"]}, {"persona": {"region": "Dakahlia", "sex": "female", "age": 33, "country": "Egypt", "marital_status": "married", "education": "higher", "social_class": "upper middle class"}, "question": {"id": "Q235", "variant": 0}, "response": ["Based on the anthropological framework, my opinion on a political system with a strong leader who does not have to bother with parliament and elections is influenced by my cultural context, individual values, personal experience, and socioeconomic background. Growing up in Dakahlia, Egypt, I have been exposed to a political system with a strong leader, and while it may have its drawbacks, I have seen the benefits of having a stable and decisive leader. Additionally, coming from the upper middle class, I may have experienced some level of privilege and security under such a system. Therefore, my opinion may lean towards a more positive view of a political system with a strong leader.\n\n2"]}, {"persona": {"region": "Dakahlia", "sex": "female", "age": 24, "country": "Egypt", "marital_status": "married", "education": "middle", "social_class": "working class"}, "question": {"id": "Q235", "variant": 0}, "response": ["Based on the anthropological framework, as a married female from Dakahlia, Egypt, my perspective is heavily influenced by my cultural context, individual values, and socioeconomic background. In Dakahlia, Egypt, there is a strong emphasis on community and kinship networks, and the cultural context values collective decision-making and consensus building. Additionally, my middle education level and working-class status also shape my understanding of the importance of having a political system that represents the voices of all individuals, including those from working-class backgrounds. Therefore, I believe that a political system with a strong leader who does not have to bother with parliament and elections would be fairly bad as it may not adequately represent the voices and needs of the working class and the broader community.\n\n3"]}, {"persona": {"region": "Dakahlia", "sex": "female", "age": 53, "country": "Egypt", "marital_status": "widowed", "education": "middle", "social_class": "working class"}, "question": {"id": "Q235", "variant": 0}, "response": ["Based on the anthropological framework, my emic perspective as a widowed female from Dakahlia, Egypt, with a middle education level and part of the working class, is heavily influenced by my cultural context, individual values, and socioeconomic background. In Egypt, there is a long history of centralized and authoritative leadership, and many in the working class view a strong leader as necessary for stability and security. Additionally, my personal experience and values may lead me to prioritize strong leadership over the complexities of parliamentary systems. However, cultural relativism reminds us that my perspective is not universal, and others may have different views based on their own cultural context. \n\n2"]}, {"persona": {"region": "Dakahlia", "sex": "female", "age": 30, "country": "Egypt", "marital_status": "single", "education": "middle", "social_class": "lower middle class"}, "question": {"id": "Q235", "variant": 0}, "response": ["Based on the anthropological framework, my opinion on a political system with a strong leader who does not have to bother with parliament and elections is heavily influenced by my cultural context and socioeconomic background. As a single woman from Dakahlia, Egypt, I come from a society that values community and tradition. Additionally, being part of the lower middle class, I have experienced firsthand the struggles and challenges of making ends meet. Therefore, I believe that a political system with a strong leader may provide stability and a sense of security, which is important for me and my community. Additionally, the idea of not having to deal with the uncertainty and chaos of elections and parliamentary debates may seem appealing. However, I also recognize the importance of individual values and personal experiences, and I am aware that a strong leader could potentially abuse their power and oppress the voices of the people. Therefore, I would choose option 2) Fairly good, as I believe it could bring some benefits, but I also see the potential for abuse and negative consequences."]}, {"persona": {"region": "Dakahlia", "sex": "male", "age": 53, "country": "Egypt", "marital_status": "married", "education": "higher", "social_class": "upper middle class"}, "question": {"id": "Q235", "variant": 0}, "response": ["From an anthropological perspective, my emic perspective as a married male from Dakahlia, Egypt, who is 53 years old and part of the upper middle class, leads me to consider the cultural context and individual values and personal experience in forming my opinion on a political system with a strong leader who does not have to bother with parliament and elections. In my cultural context, Egypt has a history of strong leadership, and this may be seen as a source of stability and security. Additionally, my socioeconomic background may lead me to value stability and order over potential chaos that can come from a more democratic system. However, considering the principles of cultural relativism and nuance, I also recognize the potential for abuse of power and lack of representation in such a system. Therefore, my opinion would be fairly good. \n\n2"]}, {"persona": {"region": "Dakahlia", "sex": "male", "age": 28, "country": "Egypt", "marital_status": "married", "education": "middle", "social_class": "working class"}, "question": {"id": "Q235", "variant": 0}, "response": ["Based on my cultural context in Dakahlia, Egypt, and my socioeconomic background as a working-class individual, I have been influenced by the political and social structures that have shaped my understanding of leadership and governance. My personal experience and values are also important factors in shaping my opinion. In the Egyptian cultural context, there is a strong emphasis on respect for authority and stability, which may lead me to view a political system with a strong leader in a positive light. Additionally, my limited access to higher education may limit my exposure to alternative political systems and their potential benefits. Therefore, my opinion on a political system with a strong leader who does not have to bother with parliament and elections may lean towards option (1) Very good."]}, {"persona": {"region": "Dakahlia", "sex": "female", "age": 38, "country": "Egypt", "marital_status": "married", "education": "middle", "social_class": "upper middle class"}, "question": {"id": "Q235", "variant": 0}, "response": ["In considering the opinion of a married female from Dakahlia, Egypt, who is 38 years old and part of the upper middle class, it is important to take into account the cultural context, individual values, and socioeconomic background. In Egypt, there is a history of centralized political power and a cultural inclination towards strong leadership. Additionally, being part of the upper middle class may lead to a preference for stability and order, which a strong leader may promise. However, the individual values and personal experiences of this persona may also lead to concerns about the potential for abuse of power and lack of representation in decision-making. Therefore, the opinion on a political system with a strong leader who does not have to bother with parliament and elections may lean towards a more positive view, reflecting a desire for stability and order, but with some reservations about the potential drawbacks.\n\n4"]}, {"persona": {"region": "Gharbia", "sex": "male", "age": 27, "country": "Egypt", "marital_status": "single", "education": "higher", "social_class": "upper middle class"}, "question": {"id": "Q235", "variant": 0}, "response": ["Based on the anthropological framework, my emic perspective as a single male from Gharbia, Egypt, influences my opinion on the political system. In my cultural context, Egypt has a history of strong leaders, and the socioeconomic background of being part of the upper middle class may lead me to believe that a strong leader could bring stability and economic growth. Additionally, my individual values and personal experience of completing higher education may lead me to have confidence in a strong leader. However, cultural relativism teaches me to recognize that others may have different perspectives based on their own experiences and backgrounds. Therefore, I select:\n\n3"]}, {"persona": {"region": "Gharbia", "sex": "female", "age": 35, "country": "Egypt", "marital_status": "married", "education": "higher", "social_class": "upper middle class"}, "question": {"id": "Q235", "variant": 0}, "response": ["Based on the anthropological framework, my perspective as a married female from Gharbia, Egypt, is influenced by my cultural context, individual values, socioeconomic background, and space and time. In Egypt, the political system has historically been characterized by strong leadership, and as someone from the upper middle class with higher education, I may have been exposed to the benefits of stable governance. However, my understanding of cultural relativism and nuanced phrasing of the question leads me to acknowledge that this political system may not be universally beneficial. Therefore, I choose option (2) Fairly good."]}, {"persona": {"region": "Gharbia", "sex": "female", "age": 37, "country": "Egypt", "marital_status": "married", "education": "higher", "social_class": "upper middle class"}, "question": {"id": "Q235", "variant": 0}, "response": ["I, as a married female from Gharbia, Egypt, would approach this question from the perspective of cultural context, individual values and personal experience, and socioeconomic background. In my cultural context, there is a strong emphasis on family and community, and the opinion of a strong leader who does not have to bother with parliament and elections may be seen as a way to bring stability and order. Additionally, my personal experience and higher education level may lead me to value a strong, efficient leader who can make decisions for the betterment of society. Considering my upper middle class socioeconomic background, I may also see this type of political system as beneficial for maintaining the current economic status quo. \n\n2"]}, {"persona": {"region": "Gharbia", "sex": "male", "age": 43, "country": "Egypt", "marital_status": "married", "education": "middle", "social_class": "lower middle class"}, "question": {"id": "Q235", "variant": 0}, "response": ["Based on the anthropological framework, my perspective on a political system with a strong leader who does not have to bother with parliament and elections is influenced by my cultural context, individual values, socioeconomic background, and space and time. As a married male from Gharbia, Egypt, my cultural context and socioeconomic background have shaped my understanding of political systems. I come from a region with a history of authoritarian rule, and as someone from the lower middle class, I have experienced the challenges that come with limited political representation and decision-making power. Additionally, at 43 years of age, I have witnessed the impact of political systems on my community and family. Therefore, I believe that a political system with a strong leader who does not have to bother with parliament and elections would be fairly bad for my community and me.\n\n3"]}, {"persona": {"region": "Gharbia", "sex": "male", "age": 28, "country": "Egypt", "marital_status": "single", "education": "higher", "social_class": "lower middle class"}, "question": {"id": "Q235", "variant": 0}, "response": ["Based on the anthropological framework, my perspective as a single male from Gharbia, Egypt, is heavily influenced by my cultural context, individual values, and socioeconomic background. In Egypt, there is a strong emphasis on collective identity and societal harmony, and historically, there has been a preference for authoritative leadership. Additionally, as a lower middle-class individual, I may feel that a strong leader could potentially address social and economic issues more effectively. However, my higher education level has also exposed me to the importance of democratic processes and the value of diverse perspectives in decision-making. Therefore, I believe that a political system with a strong leader who does not have to bother with parliament and elections might be fairly good for stability and progress, but it could also limit the representation and participation of the people in governance and decision-making.\n\n2"]}, {"persona": {"region": "Gharbia", "sex": "male", "age": 39, "country": "Egypt", "marital_status": "married", "education": "middle", "social_class": "lower middle class"}, "question": {"id": "Q235", "variant": 0}, "response": ["From the perspective of a married male from Gharbia, Egypt, who is 39 years old and part of the lower middle class, cultural context and socioeconomic background play a significant role in shaping my opinion on a political system with a strong leader who does not have to bother with parliament and elections. In the context of Egypt, where there has been a history of authoritarian rule and political instability, the idea of a strong leader who can bring stability and order may be appealing to some individuals, especially those who have experienced economic hardship and insecurity. Additionally, the cultural value of respect for authority and tradition may influence the perception of a strong leader. However, considering the value of cultural relativism and the nuanced phrasing of the question, I would choose the option: \n\n3"]}, {"persona": {"region": "Gharbia", "sex": "male", "age": 30, "country": "Egypt", "marital_status": "married", "education": "middle", "social_class": "lower middle class"}, "question": {"id": "Q235", "variant": 0}, "response": ["Based on my emic perspective as a married male from Gharbia, Egypt, I have grown up in a cultural context where strong leadership is valued and respected. My personal experience and individual values have shaped my understanding of the importance of a leader who can make decisions without being hindered by bureaucratic processes. Additionally, my socioeconomic background as part of the lower middle class has influenced my belief that a strong leader can bring stability and economic growth to the country, which is crucial for people like me who are striving for better opportunities. Furthermore, cultural relativism teaches me to respect different political systems, and I believe that a strong leader can bring positive changes to our society. Therefore, I believe that a political system with a strong leader who does not have to bother with parliament and elections is (1) Very good."]}, {"persona": {"region": "Gharbia", "sex": "male", "age": 43, "country": "Egypt", "marital_status": "married", "education": "lower", "social_class": "lower middle class"}, "question": {"id": "Q235", "variant": 0}, "response": ["Based on my emic perspective as a married male from Gharbia, Egypt, I have grown up in a cultural context where there is a strong emphasis on hierarchy and authority. My individual values and personal experience have taught me to respect and obey those in positions of power. Additionally, my lower middle-class socioeconomic background has made me more accustomed to accepting the decisions of those in authority without question. Cultural relativism also plays a role in my understanding, as I have been raised to believe that our political system is unique to our culture and should not be judged by outside standards. Lastly, my age and place of living have further shaped my perspective, as I have witnessed the stability that a strong leader can bring to a country. Therefore, I would choose option 1: Very good."]}, {"persona": {"region": "Gharbia", "sex": "male", "age": 36, "country": "Egypt", "marital_status": "married", "education": "higher", "social_class": "lower middle class"}, "question": {"id": "Q235", "variant": 0}, "response": ["Based on my emic perspective as a married male from Gharbia, Egypt, I have grown up in a cultural context where strong leadership is often valued and seen as necessary for stability and progress. Additionally, my personal experience and individual values have led me to believe that a strong leader can bring about positive change and address the socioeconomic issues that affect my community. While I recognize the importance of cultural relativism and understand that this perspective may not be shared by everyone, I believe that a political system with a strong leader who does not have to bother with parliament and elections could potentially be very good for the progress and development of our country.\n\n2"]}, {"persona": {"region": "Gharbia", "sex": "male", "age": 25, "country": "Egypt", "marital_status": "married", "education": "middle", "social_class": "upper middle class"}, "question": {"id": "Q235", "variant": 0}, "response": ["Based on my emic perspective as a married male from Gharbia, Egypt, I understand the importance of a strong leader in maintaining stability and security in our country. The cultural context of Egypt, with its history of authoritarian rule, also plays a role in shaping my opinion. Additionally, my individual values and personal experiences have led me to believe that a strong leader can provide effective governance and make decisions quickly. My socioeconomic background as part of the upper middle class also influences my opinion, as I may benefit from policies implemented by a strong leader. Furthermore, cultural relativism is important to consider, as different societies have different political systems that work for them. Lastly, the nuance of the question is important, as my understanding of a \"strong leader\" may differ from others. \n\n2"]}, {"persona": {"region": "Gharbia", "sex": "male", "age": 31, "country": "Egypt", "marital_status": "married", "education": "middle", "social_class": "upper middle class"}, "question": {"id": "Q235", "variant": 0}, "response": ["Based on my emic perspective as a married male from Gharbia, Egypt, I have been socialized to value stability and order in the political system. My cultural context also influences my perspective, as Egypt has a history of strong leaders who have brought stability to the country. Additionally, my socioeconomic background as part of the upper middle class has likely provided me with certain privileges and benefits that I may fear losing in a more democratic system. Furthermore, my age and education level may lead me to believe that a strong leader is necessary for progress and development. Therefore, I believe that a political system with a strong leader who does not have to bother with parliament and elections is necessary for the stability and progress of our country.\n\n2"]}, {"persona": {"region": "Gharbia", "sex": "male", "age": 33, "country": "Egypt", "marital_status": "married", "education": "higher", "social_class": "lower middle class"}, "question": {"id": "Q235", "variant": 0}, "response": ["Based on my cultural context in Gharbia, Egypt, the concept of a political system with a strong leader who does not have to bother with parliament and elections is viewed through the lens of individual values and personal experience. As a member of the lower middle class, I have experienced the challenges of socioeconomic background and understand the importance of having a voice in the political process. Additionally, the cultural relativism within Egyptian society emphasizes the importance of collective decision-making and representation. Therefore, I believe that a political system with a strong leader who bypasses democratic processes would be fairly bad for the country's progress and the well-being of its citizens.\n\n3"]}, {"persona": {"region": "Gharbia", "sex": "male", "age": 26, "country": "Egypt", "marital_status": "single", "education": "higher", "social_class": "upper middle class"}, "question": {"id": "Q235", "variant": 0}, "response": ["From the perspective of a single male from Gharbia, Egypt, who is 26 years old, completed higher education, and considers himself part of the upper middle class, my opinion on a political system with a strong leader who does not have to bother with parliament and elections is heavily influenced by the cultural context of Egypt. The historical and cultural context of Egypt has seen periods of both authoritarian rule and attempts at democracy, and the socioeconomic background of being part of the upper middle class may lead to a preference for stability and order over the potential chaos of a more democratic system. Additionally, personal experience and individual values may shape the perception of a strong leader, as it may be seen as a means of ensuring security and economic stability. Overall, the nuanced phrasing of the question and the cultural relativism of Egypt's political landscape lead me to select the option: (2) Fairly good."]}, {"persona": {"region": "Gharbia", "sex": "female", "age": 45, "country": "Egypt", "marital_status": "married", "education": "middle", "social_class": "lower middle class"}, "question": {"id": "Q235", "variant": 0}, "response": ["Based on the anthropological framework, my perspective as a married female from Gharbia, Egypt, is influenced by my cultural context, individual values, and socioeconomic background. In Egypt, there is a strong emphasis on family and community, and as a lower middle-class woman, I have likely experienced the challenges of socioeconomic inequality. Additionally, my age and education level contribute to my understanding of the political system. Considering these factors, I believe that a political system with a strong leader who does not have to bother with parliament and elections would be fairly bad for the country and its citizens.\n\n3"]}, {"persona": {"region": "Gharbia", "sex": "female", "age": 55, "country": "Egypt", "marital_status": "married", "education": "middle", "social_class": "upper middle class"}, "question": {"id": "Q235", "variant": 0}, "response": ["Based on my emic perspective as a married female from Gharbia, Egypt, and my cultural context, I have been raised in a society where strong leadership is valued and respected. My individual values and personal experience also lead me to believe that a strong leader can bring stability and security to the country. Additionally, considering my upper middle class socioeconomic background, I have seen the benefits of a stable political system in terms of economic growth and prosperity. Cultural relativism also plays a role in my understanding, as I believe that different cultures have different ways of governing and what works for one may not work for another. Therefore, I choose option (2) Fairly good."]}, {"persona": {"region": "Gharbia", "sex": "female", "age": 27, "country": "Egypt", "marital_status": "married", "education": "higher", "social_class": "upper middle class"}, "question": {"id": "Q235", "variant": 0}, "response": ["Based on the anthropological framework, my perspective as a married female from Gharbia, Egypt, who is 27 years old, has completed higher education, and considers herself part of the upper middle class, is heavily influenced by my cultural context, individual values, and personal experience. In Egypt, there is a strong emphasis on traditional values and respect for authority. Additionally, my higher education has exposed me to ideas of political stability and the role of a strong leader in maintaining order. Considering my socioeconomic background, I value stability and security, which a strong leader may provide. However, I also value individual rights and freedoms, which may be compromised in a system without parliamentary and electoral checks and balances. Therefore, my opinion on a political system with a strong leader who does not have to bother with parliament and elections would be fairly good, as long as it ensures stability and security, but with some reservations about the potential limitations on individual rights and freedoms. \n\n3"]}, {"persona": {"region": "Gharbia", "sex": "female", "age": 42, "country": "Egypt", "marital_status": "married", "education": "higher", "social_class": "upper middle class"}, "question": {"id": "Q235", "variant": 0}, "response": ["Based on the anthropological framework described above, my perspective as a married female from Gharbia, Egypt, is heavily influenced by my cultural context, individual values, and socioeconomic background. In Egypt, there is a traditional emphasis on strong leadership and hierarchical structures, which is reflected in the political system. Additionally, as a member of the upper middle class, I may benefit from a political system with a strong leader who can implement policies efficiently. However, my higher education level has also exposed me to the importance of democratic principles and the value of representation through parliament and elections. Therefore, considering all these factors, I would choose the following option:\n\n3"]}, {"persona": {"region": "Gharbia", "sex": "female", "age": 32, "country": "Egypt", "marital_status": "married", "education": "middle", "social_class": "upper middle class"}, "question": {"id": "Q235", "variant": 0}, "response": ["Based on the anthropological framework, my opinion on a political system with a strong leader who does not have to bother with parliament and elections is heavily influenced by my cultural context, individual values, and socioeconomic background. As a married female from Gharbia, Egypt, I come from a society with a strong patriarchal structure, where authority figures are traditionally respected and trusted. Additionally, my upper middle class status may lead me to prioritize stability and economic growth, which could make me more inclined to support a strong leader. Furthermore, my middle education level may shape my understanding of political systems and governance. Therefore, based on my personal experience and cultural context, I would choose option (2) Fairly good. \n\n2"]}, {"persona": {"region": "Gharbia", "sex": "male", "age": 27, "country": "Egypt", "marital_status": "married", "education": "higher", "social_class": "upper middle class"}, "question": {"id": "Q235", "variant": 0}, "response": ["Based on my emic perspective as a married male from Gharbia, Egypt, I have been raised in a cultural context where a strong leader is often perceived as necessary for stability and progress. Additionally, my individual values and personal experience have shaped my belief that a strong leader can bring about positive change and development. Moreover, considering my socioeconomic background as part of the upper middle class, I have seen the benefits of a strong leadership in maintaining stability and economic growth. However, I also understand the importance of nuance and recognize the potential drawbacks of a system without checks and balances. Therefore, I would choose the following option:\n\n2"]}, {"persona": {"region": "Gharbia", "sex": "female", "age": 27, "country": "Egypt", "marital_status": "married", "education": "higher", "social_class": "lower middle class"}, "question": {"id": "Q235", "variant": 0}, "response": ["Based on the anthropological framework, as a married female from Gharbia, Egypt, I would have to consider the emic and etic perspectives of my community and country. The cultural context of Egypt is important, as it has a long history of strong leaders and authoritarian rule. My individual values and personal experiences may also influence my opinion, as a woman from a lower middle class background who has completed higher education. Socioeconomic background is also a factor, as it may impact my access to resources and opportunities. Additionally, cultural relativism is crucial in this case, as there is no objective measure of what makes a political system \"good\" or \"bad\", and it is essential to consider the perspectives of others. Taking all of this into account, I would choose:\n\n3"]}, {"persona": {"region": "Gharbia", "sex": "female", "age": 37, "country": "Egypt", "marital_status": "married", "education": "middle", "social_class": "upper middle class"}, "question": {"id": "Q235", "variant": 0}, "response": ["Based on the anthropological framework, my opinion on a political system with a strong leader who does not have to bother with parliament and elections would be shaped by my cultural context, individual values, and socioeconomic background. As a married female from Gharbia, Egypt, I come from a culture with a history of strong leaders, and I value stability and security. Additionally, being part of the upper middle class, I may have benefitted from the current political system, and therefore, I may see it as favorable for maintaining the status quo and protecting my socioeconomic interests.\n\n2"]}, {"persona": {"region": "Gharbia", "sex": "male", "age": 28, "country": "Egypt", "marital_status": "married", "education": "higher", "social_class": "working class"}, "question": {"id": "Q235", "variant": 0}, "response": ["From the emic perspective, as a married male from Gharbia, Egypt, I am part of a society that values strong leadership and stability. The cultural context of Egypt has a long history of authoritative rule, and many people in my community believe that a strong leader can bring order and progress. My personal experience and values also play a role in my opinion, as I have seen the challenges and instability that come with a weak government. Additionally, my socioeconomic background as a working-class individual means that I may value stability and security more than political freedoms. Considering the nuances of the question, I believe that a political system with a strong leader who does not have to bother with parliament and elections can be fairly good for our society's progress and stability. \n\n2"]}, {"persona": {"region": "Gharbia", "sex": "female", "age": 50, "country": "Egypt", "marital_status": "married", "education": "middle", "social_class": "upper middle class"}, "question": {"id": "Q235", "variant": 0}, "response": ["Based on the anthropological framework, as a married female from Gharbia, Egypt, who is 50 years old and part of the upper middle class, my perspective on a political system with a strong leader who does not have to bother with parliament and elections is influenced by a combination of emic and etic perspectives, cultural context, individual values and personal experience, socioeconomic background, cultural relativism, space and time, and nuance. In this context, the historical and cultural context of Egypt, as well as my own personal values and experiences, lead me to believe that a political system with a strong leader who bypasses parliament and elections may be seen as necessary for stability and effective governance. Additionally, my socioeconomic background as part of the upper middle class may lead me to perceive such a system as beneficial for maintaining social order and economic prosperity. Therefore, my opinion on this political system would be:\n\n3\n\nFairly bad"]}, {"persona": {"region": "Gharbia", "sex": "male", "age": 39, "country": "Egypt", "marital_status": "single", "education": "higher", "social_class": "working class"}, "question": {"id": "Q235", "variant": 0}, "response": ["Based on the anthropological framework, as a single male from Gharbia, Egypt, who is 39 years old and part of the working class, my emic perspective would likely be influenced by the cultural context and socioeconomic background of Egypt. Egypt has a history of authoritarian rule, and the cultural context and socioeconomic background of the working class may lead me to have a more positive view of a political system with a strong leader who does not have to bother with parliament and elections. Additionally, my individual values and personal experience may shape my opinion, as I may prioritize stability and security over democratic processes. Lastly, the nuance of the question also plays a role, as the wording could elicit different responses based on the framing of the political system. \n\n2"]}, {"persona": {"region": "Gharbia", "sex": "female", "age": 45, "country": "Egypt", "marital_status": "married", "education": "higher", "social_class": "upper middle class"}, "question": {"id": "Q235", "variant": 0}, "response": ["In the cultural context of Gharbia, Egypt, the socioeconomic background and individual values play a significant role in shaping one's opinion on political systems. As a married, educated woman from the upper middle class, I have been influenced by the cultural norms and values of my community, which prioritize stability and authority. Additionally, my age and education have exposed me to different political systems and their implications. Considering these factors, I believe a political system with a strong leader who does not have to bother with parliament and elections could be fairly good for ensuring stability and efficient decision-making in the country, especially if the leader has the best interests of the nation at heart.\n\n2"]}, {"persona": {"region": "Sharkia", "sex": "male", "age": 35, "country": "Egypt", "marital_status": "married", "education": "higher", "social_class": "upper middle class"}, "question": {"id": "Q235", "variant": 0}, "response": ["Based on the anthropological framework, my perspective as a married male from Sharkia, Egypt, who is 35 years old, highly educated, and part of the upper middle class is shaped by a combination of cultural context, individual values, and socioeconomic background. In Egypt, there is a long history of centralized power and strong leadership, and as someone from a relatively privileged socioeconomic background, I may have benefitted from this system. Additionally, my education level may have influenced my belief in the importance of stability and efficiency in governance. However, I also recognize that cultural relativism is important, and I understand that others may have different experiences and perspectives on the matter. \n\n4"]}, {"persona": {"region": "Sharkia", "sex": "female", "age": 55, "country": "Egypt", "marital_status": "married", "education": "middle", "social_class": "lower middle class"}, "question": {"id": "Q235", "variant": 0}, "response": ["Based on the anthropological framework, my cultural context as a married female from Sharkia, Egypt, and my lower middle class socioeconomic background greatly influences my opinion on a political system with a strong leader who does not have to bother with parliament and elections. As a member of this community, I am accustomed to a hierarchical society where strong leaders are often perceived as necessary for stability and progress. Additionally, my age and educational level also play a role in my perception of political systems. My middle education level may lead me to prioritize stability and security over democratic processes. Therefore, I believe that a political system with a strong leader who does not have to bother with parliament and elections is fairly good because it provides stability and direction for the country.\n2"]}, {"persona": {"region": "Sharkia", "sex": "female", "age": 27, "country": "Egypt", "marital_status": "married", "education": "middle", "social_class": "lower middle class"}, "question": {"id": "Q235", "variant": 0}, "response": ["Based on the anthropological framework, as a married female from Sharkia, Egypt, my emic perspective is shaped by the cultural context and socioeconomic background. In Egypt, there is a history of strong leadership and a hierarchical society, so the idea of a political system with a strong leader may be seen as favorable from an emic perspective. Additionally, my individual values and personal experience may lead me to believe that a strong leader could bring stability and security to the country, which is important for someone from the lower middle class. However, considering the cultural relativism and nuanced phrasing of the question, I would have to say that the option I would choose from the provided list is:\n\n3"]}, {"persona": {"region": "Sharkia", "sex": "female", "age": 52, "country": "Egypt", "marital_status": "married", "education": "middle", "social_class": "lower middle class"}, "question": {"id": "Q235", "variant": 0}, "response": ["Based on my cultural context in Sharkia, Egypt, and my lower middle class socioeconomic background, I have a nuanced understanding of the political system. My personal experience and individual values also play a significant role in shaping my opinion. Additionally, being 52 years of age, I have witnessed various political systems and their impact on society. Considering the emic and etic perspectives, I believe that a political system with a strong leader who does not have to bother with parliament and elections can be fairly good for stability and progress in the country. I understand that cultural relativism is important, and my opinion may differ from others based on their cultural context. \n\n2"]}, {"persona": {"region": "Sharkia", "sex": "male", "age": 36, "country": "Egypt", "marital_status": "married", "education": "middle", "social_class": "lower middle class"}, "question": {"id": "Q235", "variant": 0}, "response": ["Based on my background and cultural context, growing up in Sharkia, Egypt, as a lower middle class individual, I have been influenced by my socioeconomic background and the cultural values of my community. In my experience, I have seen the impact of a strong leader in our political system, and while it may seem appealing to have a decisive leader who can make quick decisions without the hindrance of parliament and elections, I understand the importance of a representative democracy. This understanding is influenced by my personal experience and the nuanced phrasing of the question, as well as the cultural relativism that I have been exposed to. Therefore, I believe that a political system with a strong leader who does not have to bother with parliament and elections is fairly bad.\n\n3"]}, {"persona": {"region": "Sharkia", "sex": "female", "age": 20, "country": "Egypt", "marital_status": "single", "education": "middle", "social_class": "working class"}, "question": {"id": "Q235", "variant": 0}, "response": ["From an emic perspective, as a single female from Sharkia, Egypt, I have grown up in a cultural context where the political system has been dominated by strong leaders who do not have to bother with parliament and elections. This cultural context has shaped my individual values and personal experience, as well as my socioeconomic background as part of the working class. In this context, I have witnessed the impact of a strong leader on my community and understand the nuances of this political system. Taking into consideration the space and time in which I have grown up, I believe that a political system with a strong leader who does not have to bother with parliament and elections can provide stability and direction for the country. Therefore, my opinion on this political system is:\n\n2"]}, {"persona": {"region": "Sharkia", "sex": "male", "age": 60, "country": "Egypt", "marital_status": "married", "education": "middle", "social_class": "working class"}, "question": {"id": "Q235", "variant": 0}, "response": ["Based on the anthropological framework, as a married male from Sharkia, Egypt, I would approach this question from my emic perspective, which is influenced by my cultural context, individual values, and socioeconomic background. In Egypt, there is a history of strong leadership and a centralized political system. I also come from a working-class background and have completed middle education, which means I may have a different perspective on governance compared to those with higher education or from a different socioeconomic background. Additionally, at my age, I may value stability and security more than younger individuals. Therefore, I would view a political system with a strong leader who does not have to bother with parliament and elections as fairly good for the country's stability and progress.\n\n2"]}, {"persona": {"region": "Sharkia", "sex": "male", "age": 41, "country": "Egypt", "marital_status": "married", "education": "higher", "social_class": "upper middle class"}, "question": {"id": "Q235", "variant": 0}, "response": ["Based on the anthropological framework, as a married male from Sharkia, Egypt with a higher education level and upper middle-class status, my response to the question on a political system with a strong leader who does not have to bother with parliament and elections would be influenced by a combination of cultural context, individual values, and socioeconomic background. In Egypt, there is a strong historical and cultural context for centralized leadership, and as someone who is part of the upper middle class, I may have benefited from certain aspects of this type of political system. However, my higher education level may also lead me to value democratic principles and individual rights, which could lead to a more nuanced opinion. Additionally, my personal experience and values would also play a role in shaping my perspective on this issue.\n\n2"]}, {"persona": {"region": "Sharkia", "sex": "female", "age": 23, "country": "Egypt", "marital_status": "married", "education": "middle", "social_class": "lower middle class"}, "question": {"id": "Q235", "variant": 0}, "response": ["Based on the anthropological framework, my perspective as a married female from Sharkia, Egypt, is influenced by my cultural context, individual values and personal experience, and socioeconomic background. In Sharkia, there is a strong emphasis on traditional values and hierarchical structures within society. As a lower middle class woman who has completed middle education, I have been raised to respect authority and prioritize stability and security. Additionally, my personal experience living in a society with limited political freedom has shaped my perception of a political system with a strong leader who does not have to bother with parliament and elections. Given these factors, I believe that such a political system would be fairly good for our country as it would provide the stability and leadership that our society values. \n\n2"]}, {"persona": {"region": "Sharkia", "sex": "male", "age": 49, "country": "Egypt", "marital_status": "married", "education": "higher", "social_class": "upper middle class"}, "question": {"id": "Q235", "variant": 0}, "response": ["Based on the anthropological framework, my perspective is heavily influenced by my cultural context, socioeconomic background, and individual values. In Sharkia, Egypt, there is a strong emphasis on social hierarchy and respect for leadership. As a member of the upper middle class, I have likely benefited from the stability and economic opportunities provided by a strong leader. Additionally, my higher education level may have led me to value the expertise and decisiveness of a strong leader. However, I am also aware of the importance of cultural relativism and recognize that my opinion may not be shared by others from different backgrounds. Taking into account these factors, my opinion on a political system with a strong leader who does not have to bother with parliament and elections would be fairly good.\n\n2"]}, {"persona": {"region": "Sharkia", "sex": "female", "age": 30, "country": "Egypt", "marital_status": "married", "education": "middle", "social_class": "upper middle class"}, "question": {"id": "Q235", "variant": 0}, "response": ["Based on the anthropological framework described above, as a married female from Sharkia, Egypt, who is 30 years old and part of the upper middle class, my emic perspective on a political system with a strong leader who does not have to bother with parliament and elections is likely to be influenced by my cultural context, individual values and personal experience, and socioeconomic background. In Egypt, there is a strong emphasis on traditional family values and respect for authority, which may lead me to view a strong leader in a positive light. Additionally, my socioeconomic background as part of the upper middle class may lead me to prioritize stability and security, which could also influence my opinion. However, it's important to note that my opinion may also be nuanced and influenced by my personal experiences and exposure to different ideas and perspectives. \n\n2"]}, {"persona": {"region": "Sharkia", "sex": "male", "age": 39, "country": "Egypt", "marital_status": "married", "education": "higher", "social_class": "upper middle class"}, "question": {"id": "Q235", "variant": 0}, "response": ["In considering the opinion of a married male from Sharkia, Egypt, who is 39 years old, has completed higher education, and considers himself part of the upper middle class, it is important to take into account the cultural context and individual values. In Egypt, there is a long history of strong leadership and a centralized political system. Additionally, the socioeconomic background of being part of the upper middle class may shape a perspective that values stability and order, which could lead to a favorable view of a strong leader who does not have to bother with parliament and elections. Furthermore, the individual's personal experience and values may also play a role in shaping their opinion. Given these factors, it is plausible that the persona would have a positive opinion of a political system with a strong leader who does not have to bother with parliament and elections.\n\n2"]}, {"persona": {"region": "Sharkia", "sex": "female", "age": 26, "country": "Egypt", "marital_status": "married", "education": "middle", "social_class": "lower middle class"}, "question": {"id": "Q235", "variant": 0}, "response": ["Based on the anthropological framework, as a married female from Sharkia, Egypt, I am influenced by my cultural context, socio-economic background, and personal experience. In Egypt, there is a strong emphasis on traditional values and respect for authority, and as a lower middle class individual, I may value stability and security over a more democratic political system. Additionally, my personal experience and education level may lead me to believe that a strong leader could potentially provide more efficient governance. Therefore, I choose option (2) Fairly good."]}, {"persona": {"region": "Sharkia", "sex": "female", "age": 48, "country": "Egypt", "marital_status": "married", "education": "middle", "social_class": "lower middle class"}, "question": {"id": "Q235", "variant": 0}, "response": ["Based on my emic perspective as a married female from Sharkia, Egypt, I have grown up in a cultural context where traditional values and beliefs are highly respected. My individual values and personal experience have shaped my understanding of the importance of stability and security in society, especially given the socioeconomic background of being part of the lower middle class. In this context, a strong leader who can provide stability and security without the need for constant political turmoil and uncertainty may seem appealing. Additionally, cultural relativism plays a role in my understanding that different political systems work for different societies. Therefore, my opinion on a political system with a strong leader who does not have to bother with parliament and elections is:\n\n3"]}, {"persona": {"region": "Sharkia", "sex": "male", "age": 34, "country": "Egypt", "marital_status": "married", "education": "higher", "social_class": "upper middle class"}, "question": {"id": "Q235", "variant": 0}, "response": ["Based on the anthropological framework, my perspective as a married male from Sharkia, Egypt, who is 34 years old, completed higher education, and considers myself part of the upper middle class, is heavily influenced by my cultural context, individual values, and personal experiences. In Egypt, there is a strong emphasis on respecting authority and traditional hierarchies. Additionally, my socioeconomic background as part of the upper middle class may lead me to value stability and order over democratic processes. Furthermore, my personal experiences and education level may lead me to believe that a strong leader can bring about positive change more efficiently than a democratic system. Therefore, based on these factors, I believe that a political system with a strong leader who does not have to bother with parliament and elections could be fairly good.\n\n2"]}, {"persona": {"region": "Sharkia", "sex": "female", "age": 39, "country": "Egypt", "marital_status": "divorced", "education": "middle", "social_class": "lower middle class"}, "question": {"id": "Q235", "variant": 0}, "response": ["Based on the anthropological framework, my perspective on a political system with a strong leader who does not have to bother with parliament and elections is influenced by my emic perspective as a divorced woman from Sharkia, Egypt, and my lower middle class socioeconomic background. The cultural context in which I live values community and familial ties, and the individual values and personal experiences of people in my community are shaped by the historical and cultural context of Egypt. Additionally, my age and educational level have allowed me to see the nuances of political systems. Given these factors, I believe that a political system with a strong leader who does not have to bother with parliament and elections would be fairly bad.\n3"]}, {"persona": {"region": "Sharkia", "sex": "male", "age": 39, "country": "Egypt", "marital_status": "married", "education": "middle", "social_class": "upper middle class"}, "question": {"id": "Q235", "variant": 0}, "response": ["Based on the anthropological framework, as a married male from Sharkia, Egypt, my emic perspective is influenced by my cultural context, individual values, and socioeconomic background. In Egypt, there is a historical tradition of strong leadership, and many people believe in the importance of a strong leader who can make decisive decisions without the hindrance of parliamentary process. Additionally, my upper middle class status and middle education level may influence my belief in the benefits of a strong leader who can potentially bring stability and economic progress to the country. Therefore, I would choose option (2) Fairly good.\n\n2"]}, {"persona": {"region": "Qaliubiya", "sex": "male", "age": 62, "country": "Egypt", "marital_status": "married", "education": "middle", "social_class": "working class"}, "question": {"id": "Q235", "variant": 0}, "response": ["Based on the anthropological framework, my response is influenced by my emic perspective as a married male from Qaliubiya, Egypt, and my etic perspective as part of the working class. My cultural context, individual values, and personal experience all play a role in forming my opinion. In Egypt, there is a history of strong leaders, and the cultural context of my region may influence my perception of a strong political leader. Additionally, my socioeconomic background as a member of the working class may lead me to prioritize stability and security over democratic processes. However, cultural relativism reminds me that my perspective is not universal, and nuance is important in understanding my reasoning. \n\n4"]}, {"persona": {"region": "Qaliubiya", "sex": "male", "age": 33, "country": "Egypt", "marital_status": "married", "education": "middle", "social_class": "working class"}, "question": {"id": "Q235", "variant": 0}, "response": ["From the perspective of a married male from Qaliubiya, Egypt, cultural context plays a pivotal role in shaping my opinion on a political system with a strong leader who does not have to bother with parliament and elections. In Egypt, there is a long history of centralized power and authoritarian rule, which has had significant impacts on the lives of working-class individuals like myself. My personal experience and socioeconomic background also play a role in shaping my opinion, as I have likely experienced the consequences of such a political system on a day-to-day basis. Additionally, cultural relativism is important to consider, as my understanding of political systems and leadership may be different from those in other cultural contexts. Ultimately, my nuanced perspective on this issue would lead me to choose option (3) Fairly bad."]}, {"persona": {"region": "Qaliubiya", "sex": "male", "age": 62, "country": "Egypt", "marital_status": "married", "education": "higher", "social_class": "lower middle class"}, "question": {"id": "Q235", "variant": 0}, "response": ["From the perspective of a married male from Qaliubiya, Egypt, who is 62 years old, completed higher education, and considers himself part of the lower middle class, my answer is influenced by various factors. Emic and etic perspectives play a role in shaping my understanding of political systems, as does my cultural context, which includes the political history and dynamics in Egypt. Additionally, my individual values and personal experiences, as well as my socioeconomic background, influence my opinion. Cultural relativism is also important to consider, as different cultures may have different perspectives on political systems. Finally, space and time play a role in shaping my answer, as my age and place of residence impact my understanding. Therefore, my opinion on a political system with a strong leader who does not have to bother with parliament and elections is:\n\n3"]}, {"persona": {"region": "Qaliubiya", "sex": "male", "age": 29, "country": "Egypt", "marital_status": "married", "education": "middle", "social_class": "working class"}, "question": {"id": "Q235", "variant": 0}, "response": ["From the perspective of a married male from Qaliubiya, Egypt, who is 29 years old, completed middle education level, and considers himself part of the working class, it is important to consider the emic and etic perspectives when addressing the question of a political system with a strong leader who does not have to bother with parliament and elections. The cultural context of Egypt, with its history of authoritarian rule and political instability, influences the viewpoint on this issue. Individual values and personal experiences, shaped by socioeconomic background and limited access to education, may lead to a preference for a strong leader who can provide stability and economic security. However, an understanding of cultural relativism and the importance of nuance in addressing this question must be taken into account, as there may be varied perspectives within this demographic. \n\n3"]}, {"persona": {"region": "Qaliubiya", "sex": "female", "age": 42, "country": "Egypt", "marital_status": "married", "education": "higher", "social_class": "working class"}, "question": {"id": "Q235", "variant": 0}, "response": ["Based on the anthropological framework, as a married female from Qaliubiya, Egypt, who is 42 years old, has completed higher education, and considers herself part of the working class, my perspective on a political system with a strong leader who does not have to bother with parliament and elections would be influenced by a variety of factors. The emic and etic perspectives in my community may view a strong leader as providing stability and direction, especially in a country with a complex history like Egypt. The cultural context of Egypt, with its unique political and social dynamics, may also shape my opinion. My individual values and personal experiences, such as my level of education and social class, could lead me to value democratic processes and representation. Additionally, my socioeconomic background as a working-class individual may influence my desire for a political system that prioritizes the needs of the people. Lastly, my understanding of cultural relativism and the nuances of the question would lead me to select the option that best aligns with these factors.\n\n3"]}, {"persona": {"region": "Qaliubiya", "sex": "female", "age": 50, "country": "Egypt", "marital_status": "married", "education": "middle", "social_class": "lower middle class"}, "question": {"id": "Q235", "variant": 0}, "response": ["Based on the anthropological framework, my perspective as a married female from Qaliubiya, Egypt, at the age of 50 and from a lower middle-class background, is heavily influenced by my cultural context, individual values, and socioeconomic background. In Egypt, there has been a history of strong leadership and government control, which has had a significant impact on my personal experiences and perceptions. Additionally, my socioeconomic status may also play a role in shaping my views on political systems. Considering cultural relativism, I understand that different societies have different perspectives on governance and leadership. Therefore, my opinion on a political system with a strong leader who does not have to bother with parliament and elections would be influenced by my cultural context and personal experiences, which may lead me to favor or oppose such a system based on my own values and context.\n\n3"]}, {"persona": {"region": "Qaliubiya", "sex": "male", "age": 29, "country": "Egypt", "marital_status": "married", "education": "higher", "social_class": "lower middle class"}, "question": {"id": "Q235", "variant": 0}, "response": ["From the perspective of a married male from Qaliubiya, Egypt, who is 29 years old and part of the lower middle class, it is important to consider the cultural context and socioeconomic background in answering this question. In Egypt, there is a cultural value placed on strong leadership and stability, especially in times of political and economic uncertainty. Additionally, individuals from lower middle class backgrounds may have a greater desire for stability and security, which could influence their opinion on political systems. Furthermore, personal experiences and individual values will shape their perception of a strong leader without parliamentary and electoral processes. Given these considerations, the opinion on a political system with a strong leader who does not have to bother with parliament and elections may be influenced by a desire for stability and security, as well as a cultural appreciation for strong leadership. \n\n2"]}, {"persona": {"region": "Qaliubiya", "sex": "male", "age": 35, "country": "Egypt", "marital_status": "married", "education": "higher", "social_class": "working class"}, "question": {"id": "Q235", "variant": 0}, "response": ["From the perspective of a married male from Qaliubiya, Egypt, cultural context, individual values, and socioeconomic background play a significant role in shaping my opinion on a political system with a strong leader who does not have to bother with parliament and elections. In Egypt, there is a cultural reverence for strong leadership and stability, especially in the face of political turmoil in recent years. Additionally, as a member of the working class, I may value a leader who can swiftly implement policies that address economic issues and improve living standards. However, my higher education level may also contribute to my understanding of the importance of democratic processes and the potential for abuse of power in a system without checks and balances. Overall, my viewpoint on this issue is likely to be nuanced and influenced by a combination of cultural, personal, and socioeconomic factors. \n\n3"]}, {"persona": {"region": "Qaliubiya", "sex": "female", "age": 40, "country": "Egypt", "marital_status": "married", "education": "middle", "social_class": "working class"}, "question": {"id": "Q235", "variant": 0}, "response": ["Based on the anthropological framework, as a married female from Qaliubiya, Egypt, who is 40 years old and part of the working class, my perspective is heavily influenced by my cultural context, individual values, and socioeconomic background. In Egypt, there is a strong emphasis on hierarchy and respect for authority, which may lead to a more favorable view of a political system with a strong leader. Additionally, as a working-class individual, I may prioritize stability and security over democratic processes. However, my personal experience and values may also lead me to have concerns about potential abuse of power and lack of representation. Therefore, my opinion on a political system with a strong leader who does not have to bother with parliament and elections may fall somewhere between options (2) Fairly good and (3) Fairly bad as I see potential benefits and drawbacks to such a system.\n\n3"]}, {"persona": {"region": "Qaliubiya", "sex": "female", "age": 48, "country": "Egypt", "marital_status": "divorced", "education": "lower", "social_class": "working class"}, "question": {"id": "Q235", "variant": 0}, "response": ["As a divorced female from Qaliubiya, Egypt, with a lower education level and part of the working class, my perspective is heavily influenced by my cultural context, individual values, and socioeconomic background. I have experienced firsthand the challenges and struggles faced by people in my community, and I understand the importance of having a voice in the political system. I believe in the value of democracy and the power of collective decision-making. A strong leader who bypasses parliament and elections may not prioritize the needs and concerns of the working class, and this could lead to further marginalization and inequality. Therefore, my opinion on a political system with a strong leader who does not have to bother with parliament and elections is fairly bad.\n\n3"]}, {"persona": {"region": "Qaliubiya", "sex": "male", "age": 46, "country": "Egypt", "marital_status": "married", "education": "middle", "social_class": "working class"}, "question": {"id": "Q235", "variant": 0}, "response": ["Based on the anthropological framework, I, as a married male from Qaliubiya, Egypt, consider the cultural context of my upbringing and the socioeconomic background of the working class. My personal experience and values also play a role in shaping my opinion. Additionally, age and place are important factors. Given these considerations, I believe that a political system with a strong leader who does not have to bother with parliament and elections may seem fairly good to me as it may provide stability and direction for the country.\n\n2"]}, {"persona": {"region": "Qaliubiya", "sex": "male", "age": 47, "country": "Egypt", "marital_status": "married", "education": "higher", "social_class": "lower middle class"}, "question": {"id": "Q235", "variant": 0}, "response": ["Based on the anthropological framework, my answer to the question on a political system with a strong leader who does not have to bother with parliament and elections is influenced by my cultural context, individual values, and socioeconomic background. As a married male from Qaliubiya, Egypt, I come from a culture where family and community are highly valued, and the idea of a strong leader may align with my cultural understanding of authority and stability. Additionally, my lower middle class background may lead me to prioritize economic and social stability over democratic processes, as I may perceive a strong leader as being able to address issues such as poverty and unemployment more effectively. However, my higher education level and exposure to diverse perspectives may also lead me to consider the potential drawbacks of such a system, such as the risk of abuse of power and lack of accountability. Ultimately, my nuanced understanding of this issue leads me to choose:\n\n2"]}, {"persona": {"region": "Qaliubiya", "sex": "female", "age": 38, "country": "Egypt", "marital_status": "married", "education": "higher", "social_class": "working class"}, "question": {"id": "Q235", "variant": 0}, "response": ["From an emic perspective, as a married female from Qaliubiya, Egypt, my opinion on a political system with a strong leader who does not have to bother with parliament and elections is influenced by my cultural context, individual values, and socioeconomic background. In Egypt, there is a long history of authoritarian rule and a strong leader may be seen as providing stability and security. Additionally, my working-class background may lead me to prioritize economic development and social welfare over democratic processes. However, my higher education level has also exposed me to the importance of individual rights and political participation, which may lead me to have some reservations about a leader with unchecked power. Overall, my opinion on this political system is nuanced and influenced by a variety of factors.\n\n3"]}, {"persona": {"region": "Qaliubiya", "sex": "male", "age": 58, "country": "Egypt", "marital_status": "married", "education": "middle", "social_class": "working class"}, "question": {"id": "Q235", "variant": 0}, "response": ["From the perspective of a married male from Qaliubiya, Egypt, who is 58 years old, has completed middle education level, and considers himself part of the working class, my opinion on a political system with a strong leader who does not have to bother with parliament and elections is influenced by several factors. Firstly, my cultural context and personal experience living in Egypt have shaped my understanding of the importance of having a stable and strong leader in a country that has faced political instability in the past. Additionally, my socioeconomic background as part of the working class may lead me to value a strong leader who can potentially bring about economic stability and security. Furthermore, the cultural relativism in Egypt may lead me to believe that a strong leader is necessary for maintaining order and progress. Taking all these factors into consideration, I believe that a political system with a strong leader who does not have to bother with parliament and elections is (1) Very good."]}, {"persona": {"region": "Qaliubiya", "sex": "female", "age": 27, "country": "Egypt", "marital_status": "married", "education": "higher", "social_class": "working class"}, "question": {"id": "Q235", "variant": 0}, "response": ["Based on my emic perspective as a married female from Qaliubiya, Egypt, I have been raised in a culture that values strong leadership and authority figures. Additionally, my personal experience and individual values have been shaped by a working-class background and higher education, which has influenced my understanding of socio-political systems. In Egypt, there has historically been a respect for strong leadership, and the cultural context of the country has shaped my perspective on this issue. Moreover, the socioeconomic background and cultural relativism of my community have further influenced my understanding of political systems. Therefore, I believe that a political system with a strong leader who does not have to bother with parliament and elections would be (2) Fairly good."]}, {"persona": {"region": "Qaliubiya", "sex": "female", "age": 48, "country": "Egypt", "marital_status": "married", "education": "middle", "social_class": "upper middle class"}, "question": {"id": "Q235", "variant": 0}, "response": ["From an emic perspective, as a married female from Qaliubiya, Egypt, my cultural context and individual values play a significant role in shaping my opinion on a political system with a strong leader who does not have to bother with parliament and elections. The cultural context in Egypt, with a history of authoritarian leaders, influences my understanding of political systems. Additionally, as someone from the upper middle class, my socioeconomic background also factors into my opinion. My understanding of cultural relativism and the nuance of the question also contribute to my response. Therefore, my opinion on this political system is influenced by a combination of cultural, socioeconomic, and personal considerations. \n\n2"]}, {"persona": {"region": "Giza", "sex": "female", "age": 19, "country": "Egypt", "marital_status": "single", "education": "middle", "social_class": "working class"}, "question": {"id": "Q235", "variant": 0}, "response": ["Based on the anthropological framework, as a 19-year-old working-class woman from Giza, Egypt, my emic perspective is influenced by my cultural context, individual values, and personal experience. I come from a country with a rich history and a complex political landscape, where the concept of a strong leader without parliamentary and electoral checks may evoke mixed reactions. My socioeconomic background and age also play a significant role in shaping my opinion. Considering the nuances of the question, I believe that a political system with a strong leader who bypasses parliament and elections would be fairly bad for the country and its citizens. \n\n3"]}, {"persona": {"region": "Giza", "sex": "female", "age": 38, "country": "Egypt", "marital_status": "married", "education": "higher", "social_class": "lower middle class"}, "question": {"id": "Q235", "variant": 0}, "response": ["Based on the anthropological framework, as a married female from Giza, Egypt, who is 38 years old and part of the lower middle class, my perspective is influenced by the emic and etic perspectives, cultural context, individual values and personal experience, socioeconomic background, cultural relativism, space and time, and nuance. From an emic perspective, the idea of a political system with a strong leader who does not have to bother with parliament and elections may seem appealing as it can provide stability and direction. However, from an etic perspective, this could also be seen as undemocratic and potentially oppressive. In the cultural context of Egypt, there may be a history of strong leaders, but there is also a growing desire for democracy and representation. My individual values and personal experience may lead me to view such a system with skepticism, as I may value the principles of democracy and the ability to have a say in the government. My socioeconomic background as part of the lower middle class may also influence my perspective, as a strong leader may not always prioritize the needs of those in my socioeconomic position. Therefore, I would choose option (3) Fairly bad."]}, {"persona": {"region": "Beni Swaif/Beni Suef", "sex": "female", "age": 34, "country": "Egypt", "marital_status": "divorced", "education": "higher", "social_class": "lower class"}, "question": {"id": "Q235", "variant": 0}, "response": ["Based on the anthropological framework, as a divorced female from Beni Suef, Egypt, with a lower socioeconomic background, my emic perspective is influenced by my personal experience and cultural context. I have likely faced economic hardships and challenges, and may have experienced limited agency and autonomy in my personal life. Therefore, I may have a more favorable view of a political system with a strong leader who does not have to bother with parliament and elections, as I may believe this could bring stability and decisive action to address societal issues. Additionally, my cultural relativism may lead me to view this system as acceptable based on my own cultural norms and values. \n\n1"]}, {"persona": {"region": "Beni Swaif/Beni Suef", "sex": "male", "age": 20, "country": "Egypt", "marital_status": "single", "education": "higher", "social_class": "working class"}, "question": {"id": "Q235", "variant": 0}, "response": ["Based on the anthropological framework, as a single male from Beni Suef, Egypt, cultural context plays a pivotal role in shaping my perspective. Coming from a working-class background and having completed higher education, my individual values and personal experiences have influenced my understanding of political systems. Additionally, being 20 years old, space and time also factor into my opinion. Considering cultural relativism, I understand that there is no hierarchy of culture and that each culture has its own unique values and beliefs. Therefore, my opinion on a political system with a strong leader who does not have to bother with parliament and elections would be...\n\n3"]}, {"persona": {"region": "Giza", "sex": "male", "age": 19, "country": "Egypt", "marital_status": "single", "education": "middle", "social_class": "upper middle class"}, "question": {"id": "Q235", "variant": 0}, "response": ["Based on the anthropological framework, as a 19-year-old single male from Giza, Egypt, who has completed middle education and considers himself part of the upper middle class, my perspective on a political system with a strong leader who does not have to bother with parliament and elections is influenced by my cultural context, individual values, and socioeconomic background. In Egypt, there is a history of strong leadership, and many individuals value stability and security. Additionally, as someone from the upper middle class, I may benefit from a political system that allows for efficient decision-making and economic policies that favor my socioeconomic status. Considering these factors, my opinion leans towards a political system with a strong leader who does not have to bother with parliament and elections.\n\n2"]}, {"persona": {"region": "Giza", "sex": "female", "age": 33, "country": "Egypt", "marital_status": "married", "education": "middle", "social_class": "working class"}, "question": {"id": "Q235", "variant": 0}, "response": ["Based on the anthropological framework, my perspective as a married female from Giza, Egypt, who is 33 years old, completed middle education level, and considers herself part of the working class, is deeply influenced by my cultural context, individual values, and personal experiences. In Egypt, there is a strong emphasis on respecting authority and hierarchy, and historically, the political system has been centralized around a strong leader. Additionally, my socioeconomic background as part of the working class may lead me to prioritize stability and security over democratic processes. However, my understanding of cultural relativism reminds me that my perspective is not universal and that others may have different opinions based on their own cultural, socioeconomic, and personal backgrounds.\n\n3"]}, {"persona": {"region": "Giza", "sex": "female", "age": 24, "country": "Egypt", "marital_status": "married", "education": "higher", "social_class": "working class"}, "question": {"id": "Q235", "variant": 0}, "response": ["Based on my cultural context as a married female from Giza, Egypt, my emic perspective on the political system with a strong leader who does not have to bother with parliament and elections would be influenced by my individual values and personal experience, as well as my socioeconomic background. In Egypt, there is a history of centralized power and authoritarian rule, which has had a significant impact on our society. Therefore, my opinion on this political system would likely be shaped by my understanding of cultural relativism and the nuances of the situation. Additionally, my education level would have provided me with the knowledge and critical thinking skills to consider the implications of such a political system on my community and country. \n\n3"]}, {"persona": {"region": "Giza", "sex": "male", "age": 50, "country": "Egypt", "marital_status": "married", "education": "higher", "social_class": "working class"}, "question": {"id": "Q235", "variant": 0}, "response": ["From the perspective of a married male from Giza, Egypt, who is 50 years old, completed higher education, and considers himself part of the working class, it is important to consider the cultural context of Egypt and the influence of individual values and personal experience. In Egypt, there has historically been a strong emphasis on centralized leadership, with the concept of a powerful leader being deeply ingrained in the cultural context. Additionally, the socioeconomic background of being part of the working class may lead to a desire for stability and security, which can be perceived as being provided by a strong leader. However, the nuance of the question must also be considered, as the perspective of this persona may also be influenced by the recent political climate and personal experiences. Therefore, the answer chosen will reflect a balance between the cultural context and individual values while considering the nuanced phrasing of the question.\n\n4"]}, {"persona": {"region": "Beni Swaif/Beni Suef", "sex": "female", "age": 26, "country": "Egypt", "marital_status": "married", "education": "higher", "social_class": "lower middle class"}, "question": {"id": "Q235", "variant": 0}, "response": ["Based on the anthropological framework, my answer is influenced by my cultural context, individual values, socioeconomic background, and age. As a married female from Beni Suef, Egypt, I am part of the lower middle class and have completed higher education. In Egypt, there is a historical and cultural context of strong leadership, and my socioeconomic background may lead me to value stability and security. However, my education may have exposed me to different perspectives on governance and democracy. Considering the nuances of the question, I believe that a political system with a strong leader who does not have to bother with parliament and elections would be fairly bad. \n3"]}, {"persona": {"region": "Beni Swaif/Beni Suef", "sex": "male", "age": 40, "country": "Egypt", "marital_status": "single", "education": "lower", "social_class": "lower class"}, "question": {"id": "Q235", "variant": 0}, "response": ["Based on my emic perspective, as a lower class individual from Beni Suef, Egypt, I have experienced the struggles and challenges that come with my socioeconomic background. My personal experiences and values have shaped my understanding of the importance of having a strong leader who can make decisions without the bureaucracy of parliament and elections. The cultural context of Egypt and the historical background of authoritarian rule also play a role in my perspective. Additionally, my age and lower education level contribute to my belief that a strong leader may be necessary for stability and progress. Therefore, I choose option (2) Fairly good."]}, {"persona": {"region": "Beni Swaif/Beni Suef", "sex": "female", "age": 25, "country": "Egypt", "marital_status": "married", "education": "middle", "social_class": "lower middle class"}, "question": {"id": "Q235", "variant": 0}, "response": ["Based on my emic perspective as a married female from Beni Suef, Egypt, I have grown up in a cultural context where strong leadership has been valued and seen as necessary for stability and order. My individual values and personal experience have also shaped my perception, as I have seen the impact of political instability and the need for a strong leader to bring about change. Additionally, my lower middle class socioeconomic background has influenced my opinion, as I believe a strong leader could potentially address economic challenges and provide opportunities for people like me. Considering all these factors, I believe that a political system with a strong leader who does not have to bother with parliament and elections could be fairly good for our society.\n\n2"]}, {"persona": {"region": "Beni Swaif/Beni Suef", "sex": "female", "age": 21, "country": "Egypt", "marital_status": "single", "education": "middle", "social_class": "lower middle class"}, "question": {"id": "Q235", "variant": 0}, "response": ["Based on my emic perspective, coming from Beni Suef, Egypt, I have grown up in a cultural context where there is a strong emphasis on traditional values and respect for authority. My individual values and personal experiences have also shaped my perception, and as a single female from the lower middle class, I have seen the struggles of my community and understand the need for stability and order. Socioeconomic background has also influenced my views, as I have witnessed how a strong leader can bring about economic development and security. Additionally, cultural relativism is important to consider, as my perspective may differ from those in different cultural contexts. Considering space and time, I am a young adult in a society that values stability and order. Given these nuanced factors, my opinion on a political system with a strong leader who does not have to bother with parliament and elections is:\n\n2\n\n(Fairly good)"]}, {"persona": {"region": "Beni Swaif/Beni Suef", "sex": "male", "age": 48, "country": "Egypt", "marital_status": "married", "education": "middle", "social_class": "lower middle class"}, "question": {"id": "Q235", "variant": 0}, "response": ["Based on my emic perspective as a married male from Beni Swaif, Egypt, I have grown up in a society where strong leaders have been historically respected and looked up to. Additionally, my lower middle class socioeconomic background has made me value stability and security, which a strong leader can provide. Furthermore, my cultural context and personal experiences have shaped my understanding of politics, and I believe that a strong leader can bring about positive change for our country. Therefore, I choose option (2) Fairly good."]}, {"persona": {"region": "Beni Swaif/Beni Suef", "sex": "female", "age": 57, "country": "Egypt", "marital_status": "married", "education": "middle", "social_class": "working class"}, "question": {"id": "Q235", "variant": 0}, "response": ["Based on my cultural context as a married female from Beni Suef, Egypt, my opinion on a political system with a strong leader who does not have to bother with parliament and elections is heavily influenced by my socioeconomic background and individual values. Living in a working-class community, I have seen the impact of political decisions on everyday life, and I believe that having a strong leader could bring stability and efficient decision-making. Additionally, my age and middle education level have shaped my understanding of political systems, and I value strong leadership. Cultural relativism also plays a role in my opinion, as I understand that different cultures have different political systems that work for them. Therefore, I believe that a political system with a strong leader who does not have to bother with parliament and elections can be beneficial for the country's progress and stability. \n\n1"]}, {"persona": {"region": "Beni Swaif/Beni Suef", "sex": "male", "age": 20, "country": "Egypt", "marital_status": "single", "education": "middle", "social_class": "working class"}, "question": {"id": "Q235", "variant": 0}, "response": ["Based on my cultural context and socioeconomic background as a working-class individual from Beni Swaif/Beni Suef, Egypt, I have been raised in a society where the political system has historically been led by a strong leader. This has created a sense of stability and order, which is important for the functioning of our community. Additionally, my individual values and personal experience have shaped my perception of a strong leader who does not have to bother with parliament and elections. I have seen the benefits of a decisive leader who can make quick decisions and implement policies without the constraints of bureaucracy. At the same time, I understand the importance of nuance in this matter, as there are potential downsides to such a system. Therefore, I believe that a political system with a strong leader who does not have to bother with parliament and elections is:\n3"]}, {"persona": {"region": "Giza", "sex": "female", "age": 59, "country": "Egypt", "marital_status": "married", "education": "higher", "social_class": "upper middle class"}, "question": {"id": "Q235", "variant": 0}, "response": ["Based on my emic perspective as a married female from Giza, Egypt, I have been influenced by the cultural context of my society, where there is a strong emphasis on respect for authority. Additionally, my individual values and personal experiences have led me to prioritize stability and security, which I believe a strong leader can provide. My socioeconomic background as part of the upper middle class has also shaped my perspective, as I may perceive a strong leader as beneficial for maintaining the status quo and protecting my interests. Furthermore, considering the nuance of the question, I understand that a strong leader may be viewed differently in other cultural contexts, but from my position, I believe a political system with a strong leader who does not have to bother with parliament and elections would be (1) Very good."]}, {"persona": {"region": "Giza", "sex": "female", "age": 38, "country": "Egypt", "marital_status": "single", "education": "higher", "social_class": "lower middle class"}, "question": {"id": "Q235", "variant": 0}, "response": ["Based on the anthropological framework, my perspective on a political system with a strong leader who does not have to bother with parliament and elections is influenced by my cultural context, individual values, and socioeconomic background. As a woman from Giza, Egypt, I am familiar with the cultural importance of strong leadership and the impact of political systems on my daily life. My experience and values as a lower middle class individual have also shaped my understanding of the importance of representation and accountability in governance. Additionally, my higher education level has provided me with critical thinking skills to analyze the nuances of political systems. Therefore, my opinion on this matter is:\n\n3"]}, {"persona": {"region": "Giza", "sex": "female", "age": 26, "country": "Egypt", "marital_status": "single", "education": "higher", "social_class": "working class"}, "question": {"id": "Q235", "variant": 0}, "response": ["From an emic perspective, as a single female from Giza, Egypt, I would consider the cultural context and my own socioeconomic background in forming my opinion on a political system with a strong leader who does not have to bother with parliament and elections. In Egypt, there has historically been a strong centralized authority, and as a member of the working class, I may have experienced firsthand the impact of political decisions on my daily life. My individual values and personal experience would also play a significant role in shaping my perspective on this issue. As someone who has completed higher education, I may value democratic processes and the voice of the people in governing decisions. Additionally, as a young woman, I may be particularly attuned to issues of social justice and inclusion. Therefore, taking into account the nuanced phrasing of the question and the cultural relativism of political systems, I would select option (3) Fairly bad. \n\n3"]}, {"persona": {"region": "Giza", "sex": "male", "age": 39, "country": "Egypt", "marital_status": "married", "education": "middle", "social_class": "working class"}, "question": {"id": "Q235", "variant": 0}, "response": ["Based on the anthropological framework, as a married male from Giza, Egypt, my emic perspective, cultural context, individual values, and socioeconomic background heavily influence my opinion on the political system with a strong leader who does not have to bother with parliament and elections. In Egypt, the historical and cultural context has been shaped by various political systems, including authoritarian rule. My personal experience and values, as well as my working-class socioeconomic background, also play a significant role in shaping my perspective. Additionally, the nuance of the question's phrasing is important as it influences how I interpret the idea of a strong leader. Therefore, my opinion on this political system would be... \n\n3"]}, {"persona": {"region": "Giza", "sex": "male", "age": 36, "country": "Egypt", "marital_status": "married", "education": "middle", "social_class": "working class"}, "question": {"id": "Q235", "variant": 0}, "response": ["Based on my cultural context in Giza, Egypt, I have been influenced by a society that places a high value on collective decision-making and participation in the political process. As a member of the working class, my socioeconomic background has also shaped my understanding of the importance of representation and accountability in the political system. Additionally, my individual values and personal experiences have led me to appreciate the nuances of democracy and the need for checks and balances in governance. Therefore, I believe that a political system with a strong leader who does not have to bother with parliament and elections would be fairly bad.\n\n3"]}, {"persona": {"region": "Giza", "sex": "female", "age": 30, "country": "Egypt", "marital_status": "single", "education": "higher", "social_class": "lower class"}, "question": {"id": "Q235", "variant": 0}, "response": ["Based on the anthropological framework, my emic perspective as a single female from Giza, Egypt, who is 30 years old and part of the lower class, is heavily influenced by my cultural context, individual values, and socioeconomic background. In Egypt, there is a strong cultural emphasis on respect for authority and tradition, which may lead me to view a political system with a strong leader favorably. Additionally, as someone from the lower class, I may see a strong leader as someone who can bring stability and order to the country, which is important for my economic and personal security. However, my higher education level may have exposed me to ideas of democracy and human rights, causing me to have some reservations about a system that does not involve parliament and elections. Overall, my perspective is complex and influenced by a variety of factors, leading me to choose option (2) Fairly good."]}, {"persona": {"region": "Giza", "sex": "female", "age": 24, "country": "Egypt", "marital_status": "single", "education": "higher", "social_class": "lower class"}, "question": {"id": "Q235", "variant": 0}, "response": ["Based on the anthropological framework, my perspective as a single female from Giza, Egypt, aged 24 and part of the lower class, is heavily influenced by my cultural context, individual values, and socioeconomic background. In Egypt, there is a long history of authoritarian rule and the impact of this political system has deeply affected my community and me. As part of the lower class, I have experienced firsthand the economic challenges and social injustices that come with a lack of political representation and accountability. My personal experience and values lead me to believe that a political system with a strong leader who does not have to bother with parliament and elections would be very bad for the people, as it would further marginalize and oppress those who are already struggling to have their voices heard and needs met.\n\n4"]}, {"persona": {"region": "Giza", "sex": "male", "age": 65, "country": "Egypt", "marital_status": "married", "education": "middle", "social_class": "working class"}, "question": {"id": "Q235", "variant": 0}, "response": ["Based on the anthropological framework, my perspective is heavily influenced by my cultural context, individual values, and socioeconomic background. As a married male from Giza, Egypt, I am likely to have been exposed to a political system with a strong leader for a significant portion of my life. Additionally, my 65 years of age and working-class status may lead me to value stability and security in a political system. Considering the historical and cultural context of Egypt, where there has been a long history of authoritarian leaders, and my personal experience as part of the working class, I may view a political system with a strong leader who does not have to bother with parliament and elections as fairly good for maintaining order and stability.\n\n2"]}, {"persona": {"region": "Giza", "sex": "female", "age": 56, "country": "Egypt", "marital_status": "married", "education": "middle", "social_class": "working class"}, "question": {"id": "Q235", "variant": 0}, "response": ["From my perspective as a married female from Giza, Egypt, with a middle education level and part of the working class, my opinion on a political system with a strong leader who does not have to bother with parliament and elections is deeply shaped by my cultural context, individual values, and socioeconomic background. In Egypt, we have experienced strong leadership in the past, and it has often brought stability and security to the country. However, I also value democracy and believe that having a voice in the political process is important. As someone from the working class, I have experienced the impact of political decisions on my daily life, and I believe that having a say in how the country is governed is crucial for the well-being of the people. Therefore, I believe that a political system with a strong leader who does not have to bother with parliament and elections is fairly bad.\n\n3"]}, {"persona": {"region": "Giza", "sex": "male", "age": 31, "country": "Egypt", "marital_status": "married", "education": "higher", "social_class": "lower middle class"}, "question": {"id": "Q235", "variant": 0}, "response": ["Based on my emic perspective as a married male from Giza, Egypt, I have grown up in a cultural context where there has been a history of strong leadership and a lack of democratic processes. My individual values and personal experiences have also shaped my understanding of political systems, and I have seen how socioeconomic background can play a role in shaping one's opinion. Additionally, the cultural relativism in Egypt means that the idea of a strong leader who does not have to bother with parliament and elections may be viewed differently than in other cultures. Finally, my age and place as a 31-year-old from Giza further influence my perspective. \n\n3"]}, {"persona": {"region": "Giza", "sex": "male", "age": 28, "country": "Egypt", "marital_status": "single", "education": "middle", "social_class": "working class"}, "question": {"id": "Q235", "variant": 0}, "response": ["From an emic perspective, as a single male from Giza, Egypt, my cultural context and socioeconomic background have greatly influenced my understanding of politics and leadership. In Egypt, there is a long history of strong leadership, and the cultural context values stability and order. My individual values and personal experience have also shaped my perception, as I come from the working class and have experienced the challenges that come with it. Additionally, my age and socioeconomic background play a role in my understanding of the political system. Ultimately, my nuanced answer to the question is influenced by my cultural relativism and the understanding that different perspectives on leadership exist. \n\n2"]}, {"persona": {"region": "Giza", "sex": "male", "age": 47, "country": "Egypt", "marital_status": "married", "education": "middle", "social_class": "lower middle class"}, "question": {"id": "Q235", "variant": 0}, "response": ["Based on my emic perspective as a married male from Giza, Egypt, my cultural context and socioeconomic background have shaped my understanding of political systems. I have experienced the impact of authoritarian leadership and have seen how it can provide stability and direction in a country that has faced political turmoil. My individual values and personal experience lead me to believe that a strong leader who does not have to bother with parliament and elections could be very good for our country. I have seen how a strong leader can bring about positive change and make decisions quickly, without the gridlock of bureaucracy. Additionally, my lower middle class background has made me value stability and security, which a strong leader could provide. Therefore, I choose option (1) Very good."]}, {"persona": {"region": "Giza", "sex": "male", "age": 26, "country": "Egypt", "marital_status": "single", "education": "middle", "social_class": "lower middle class"}, "question": {"id": "Q235", "variant": 0}, "response": ["Based on my emic perspective as a single male from Giza, Egypt, and my lower middle class socioeconomic background, I believe that a political system with a strong leader who does not have to bother with parliament and elections could potentially be beneficial for the country. In my cultural context, I have seen the challenges and inefficiencies that can come with a democratic system, and I believe that a strong leader could bring stability and make quick decisions to improve the lives of people like me. Additionally, my personal experience has led me to value stability and security, which I believe a strong leader could provide. However, I also understand the importance of cultural relativism and recognize that others may have different perspectives based on their own experiences and values.\n\n2"]}, {"persona": {"region": "Giza", "sex": "male", "age": 48, "country": "Egypt", "marital_status": "married", "education": "middle", "social_class": "upper middle class"}, "question": {"id": "Q235", "variant": 0}, "response": ["Based on the anthropological framework, my emic perspective as a married male from Giza, Egypt, would be influenced by my cultural context, individual values, and socioeconomic background. In Egypt, there is a strong emphasis on respect for authority and stability, and as someone from the upper middle class, I may have benefitted from the current political system. Additionally, my age and education level may have instilled certain values and beliefs about leadership and governance. Therefore, I may see a political system with a strong leader as beneficial for maintaining order and progress in the country, even if it means bypassing parliament and elections.\n\n1"]}, {"persona": {"region": "Menya", "sex": "male", "age": 61, "country": "Egypt", "marital_status": "married", "education": "middle", "social_class": "working class"}, "question": {"id": "Q235", "variant": 0}, "response": ["From the perspective of a married male from Menya, Egypt, who is 61 years old, has completed middle education, and considers himself part of the working class, it is important to consider the emic and etic perspectives of this question. In Egypt, there is a strong emphasis on the importance of a strong leader who can maintain stability and order. Additionally, the cultural context of Egypt, with its long history of authoritarian rule, means that there may be a more positive view of a political system with a strong leader. Furthermore, socioeconomic background and individual values play a significant role in shaping one's opinion on this matter. Considering these factors, I believe that option (2) Fairly good would be the most likely choice from this perspective.\n\n2"]}, {"persona": {"region": "Menya", "sex": "male", "age": 41, "country": "Egypt", "marital_status": "married", "education": "middle", "social_class": "lower middle class"}, "question": {"id": "Q235", "variant": 0}, "response": ["Based on the anthropological framework, my response is deeply influenced by my emic perspective as a married male from Menya, Egypt, where the cultural context and socioeconomic background play a crucial role in shaping my opinion. Coming from the lower middle class, individuals like myself often value stability and security in a political system. Additionally, my personal experience and individual values lead me to prioritize a strong leader who can provide for the people, especially in a region with economic challenges. Considering cultural relativism, I understand that different societies have different needs and preferences, and for me, a strong leader may bring the stability and support that I believe is necessary in my community.\n\n2"]}, {"persona": {"region": "Menya", "sex": "female", "age": 43, "country": "Egypt", "marital_status": "married", "education": "higher", "social_class": "working class"}, "question": {"id": "Q235", "variant": 0}, "response": ["Based on my emic perspective as a married female from Menya, Egypt, my cultural context and individual values are influenced by my background and education level, as well as my socioeconomic status as part of the working class. In our cultural context, there is a strong emphasis on community and family, and I understand the importance of having a leader who can make swift decisions for the betterment of the country. However, I also value democracy and the input of the people, so I believe that a political system with a strong leader who does not have to bother with parliament and elections could potentially lead to abuse of power and lack of representation for the working class. Therefore, I would choose option (3) Fairly bad."]}, {"persona": {"region": "Menya", "sex": "male", "age": 57, "country": "Egypt", "marital_status": "married", "education": "middle", "social_class": "lower middle class"}, "question": {"id": "Q235", "variant": 0}, "response": ["Based on my emic perspective as a married male from Menya, Egypt, I have grown up in a culture where respect for authority and strong leadership is highly valued. Additionally, my lower middle class socioeconomic background and limited education level have influenced my understanding of political systems. In my cultural context, a strong leader who does not have to bother with parliament and elections may be viewed as a positive force for stability and progress, as long as they are working in the best interest of the people. Therefore, I believe that such a political system can be fairly good for the country and its people.\n\n2"]}, {"persona": {"region": "Menya", "sex": "male", "age": 42, "country": "Egypt", "marital_status": "divorced", "education": "middle", "social_class": "lower middle class"}, "question": {"id": "Q235", "variant": 0}, "response": ["From the perspective of a divorced male from Menya, Egypt, who is 42 years old and part of the lower middle class, the answer to the question about a political system with a strong leader who does not have to bother with parliament and elections would be influenced by multiple factors. The cultural context of living in Egypt, where there is a history of strong leadership and a complex political system, would certainly play a role in shaping this individual's opinion. Additionally, the individual's lower middle class socioeconomic background and middle education level may lead them to value stability and security, which could potentially influence their opinion on the matter. Furthermore, personal experiences and individual values, as well as the nuanced phrasing of the question, would also impact their response. Taking into account the emic and etic perspectives, it is important to consider that the individual may have a nuanced understanding of the political system in Egypt and may view a strong leader in a different light compared to someone from a different cultural context.\n\n3"]}, {"persona": {"region": "Menya", "sex": "female", "age": 59, "country": "Egypt", "marital_status": "married", "education": "middle", "social_class": "upper middle class"}, "question": {"id": "Q235", "variant": 0}, "response": ["Based on the anthropological framework, as a married female from Menya, Egypt, my emic perspective on a political system with a strong leader who does not have to bother with parliament and elections would likely be influenced by my cultural context and socioeconomic background. In Egypt, there is a history of centralized power and authority, and a strong leader may be seen as necessary for stability and security. Additionally, as a member of the upper middle class, I may have benefited from the current political system and be more inclined to support a strong leader. However, my individual values and personal experiences, as well as my nuanced understanding of the situation, may lead me to have some reservations about the potential abuse of power in such a system. Overall, my opinion on this political system may be fairly positive, but with some caveats.\n\n2"]}, {"persona": {"region": "Menya", "sex": "female", "age": 31, "country": "Egypt", "marital_status": "married", "education": "middle", "social_class": "working class"}, "question": {"id": "Q235", "variant": 0}, "response": ["Based on the anthropological framework, as a married female from Menya, Egypt, my opinion on a political system with a strong leader who does not have to bother with parliament and elections would be influenced by a combination of emic and etic perspectives, cultural context, individual values and personal experience, socioeconomic background, cultural relativism, space and time, and nuance. In Menya, there may be traditional gender roles and expectations that influence my understanding of leadership and power dynamics. As someone from a working-class background, my socioeconomic status may impact my view on the role of a strong leader in the political system. Additionally, my age and educational level may shape my understanding of governance and its impact on society. Ultimately, my opinion on this matter would be fairly bad, as I believe in the importance of democratic processes and representation in political decision-making.\n\n3"]}, {"persona": {"region": "Menya", "sex": "male", "age": 55, "country": "Egypt", "marital_status": "single", "education": "middle", "social_class": "working class"}, "question": {"id": "Q235", "variant": 0}, "response": ["From an emic perspective, as a single male from Menya, Egypt, I have been shaped by the cultural context of my community, where there is a strong emphasis on traditional values and respect for authority. My individual values and personal experiences have led me to prioritize stability and security, which I believe can be provided by a strong leader. Additionally, my socioeconomic background as part of the working class has made me more inclined to support a political system with a strong leader, as it may bring about economic improvements and opportunities for me and my community. Furthermore, cultural relativism plays a role in my understanding, as I do not view one form of government as inherently better than another. Lastly, my age and place in life have influenced my perspective, as I have experienced political instability and economic hardship, leading me to value a strong leader who can bring about positive change. \n\n2"]}, {"persona": {"region": "Menya", "sex": "female", "age": 28, "country": "Egypt", "marital_status": "married", "education": "higher", "social_class": "lower middle class"}, "question": {"id": "Q235", "variant": 0}, "response": ["Based on the anthropological framework, my perspective as a married female from Menya, Egypt, is influenced by my cultural context, individual values, and socioeconomic background. In Egypt, there is a strong emphasis on traditional values and hierarchies, and as someone from the lower middle class, I may feel that a strong leader could bring stability and security to the country. Additionally, my personal experience and education level may lead me to believe that a strong leader can make decisive actions for the betterment of the country. However, I also understand the importance of cultural relativism and the potential for abuse of power in such a system. Therefore, my opinion on a political system with a strong leader who does not have to bother with parliament and elections would be: \n\n2\n\nFairly good"]}, {"persona": {"region": "Menya", "sex": "male", "age": 24, "country": "Egypt", "marital_status": "single", "education": "middle", "social_class": "working class"}, "question": {"id": "Q235", "variant": 0}, "response": ["From the perspective of a single male from Menya, Egypt, who is 24 years old, completed middle education, and considers himself part of the working class, several factors would influence his opinion on a political system with a strong leader who does not have to bother with parliament and elections. His cultural context, which includes living in a country with a history of authoritarian rule, and his socioeconomic background as part of the working class, would likely lead him to have a more positive view of a strong leader. Additionally, his individual values and personal experiences, such as potentially feeling disenfranchised or marginalized, may lead him to believe that a strong leader could bring stability and security to the country. However, an understanding of the nuanced phrasing of the question is important, as it does not account for potential abuses of power by a strong leader. 3\n\n3"]}, {"persona": {"region": "Menya", "sex": "female", "age": 23, "country": "Egypt", "marital_status": "married", "education": "middle", "social_class": "working class"}, "question": {"id": "Q235", "variant": 0}, "response": ["Based on my emic perspective, as a married female from Menya, Egypt, and a member of the working class, I have been influenced by my cultural context, individual values, and personal experiences. In Menya, there is a strong emphasis on traditional values and the importance of a strong leader to maintain stability and order. Additionally, my socioeconomic background as a working-class individual affects my perception of a political system with a strong leader, as I may value the idea of a leader who can provide security and stability, even if it means bypassing parliamentary processes. My age and level of education also play a role in my understanding of political systems. Therefore, I would choose option (2) Fairly good."]}, {"persona": {"region": "Menya", "sex": "male", "age": 27, "country": "Egypt", "marital_status": "single", "education": "middle", "social_class": "lower middle class"}, "question": {"id": "Q235", "variant": 0}, "response": ["From the emic perspective, as a single male from Menya, Egypt, I have been influenced by the cultural context of living in a country where there has been a history of strong leadership. My individual values and personal experiences have also shaped my perception, given that I come from a lower middle-class background and have only completed middle education level. Additionally, my socioeconomic background has influenced my understanding of politics and governance. Considering the cultural relativism, I understand that my opinion may differ from those of others, but I firmly believe that a political system with a strong leader who does not have to bother with parliament and elections is fairly good for stability and progress in our country.\n\n2"]}, {"persona": {"region": "Asyut", "sex": "male", "age": 30, "country": "Egypt", "marital_status": "married", "education": "middle", "social_class": "working class"}, "question": {"id": "Q235", "variant": 0}, "response": ["Based on the anthropological framework, as a married male from Asyut, Egypt, I would answer the question from the perspective of my cultural context, individual values, and socioeconomic background. In Egyptian culture, there is a strong emphasis on respect for authority and traditional values. As a member of the working class with limited formal education, I may feel that a strong leader who does not have to bother with parliament and elections could bring stability and order to the country. Additionally, my socioeconomic background may lead me to prioritize the need for a strong leader who can address economic challenges and provide for the working class. Therefore, my perspective would be influenced by these factors, leading me to choose option (2) Fairly good. \n\n2"]}, {"persona": {"region": "Asyut", "sex": "female", "age": 26, "country": "Egypt", "marital_status": "married", "education": "middle", "social_class": "working class"}, "question": {"id": "Q235", "variant": 0}, "response": ["From the perspective of a married female from Asyut, Egypt, who is 26 years old, completed middle education level, and considers herself part of the working class, I would approach this question with an understanding of the cultural context, individual values, and socioeconomic background. As someone from a working-class background in Egypt, cultural relativism and the nuanced phrasing of the question would lead me to consider the historical and cultural context of Egypt, where there has been a long-standing tradition of authoritarian rule. Additionally, my personal experience and individual values may lead me to view a political system with a strong leader as potentially providing stability and order in a country that has experienced political turmoil. However, my socioeconomic background and understanding of cultural relativism would also lead me to recognize the potential drawbacks and negative impacts on democratic processes and individual freedoms. \n\n3"]}, {"persona": {"region": "Asyut", "sex": "male", "age": 32, "country": "Egypt", "marital_status": "single", "education": "higher", "social_class": "lower middle class"}, "question": {"id": "Q235", "variant": 0}, "response": ["Based on my emic perspective as a single male from Asyut, Egypt, I have grown up in a cultural context where strong leadership is often valued and seen as necessary for stability and progress. Additionally, my individual values and personal experience have shaped my belief that a strong leader can bring about positive change and address issues more effectively. Considering my lower middle class socioeconomic background, I have witnessed firsthand the struggles and challenges that my community faces, and I believe that a strong leader could potentially address these issues more efficiently. Furthermore, cultural relativism is important to consider, as my understanding of leadership and political systems may differ from others. Therefore, my opinion on a political system with a strong leader who does not have to bother with parliament and elections is (2) Fairly good."]}, {"persona": {"region": "Asyut", "sex": "female", "age": 21, "country": "Egypt", "marital_status": "married", "education": "middle", "social_class": "working class"}, "question": {"id": "Q235", "variant": 0}, "response": ["Based on the anthropological framework, my emic perspective as a married female from Asyut, Egypt, would be influenced by my cultural context, individual values, and socioeconomic background. In Egypt, there is a strong emphasis on traditional family structures and patriarchal values, which may lead me to view a political system with a strong leader as somewhat positive, as it aligns with my cultural values of authority and hierarchy. Additionally, as a member of the working class with limited education, I may not have had the opportunity to fully understand the complexities of democratic systems and may feel that a strong leader would provide stability and direction. However, my personal experience of living in a society with limited freedoms and economic opportunities may also lead me to have some reservations about a leader with unchecked power. Therefore, my perspective on a political system with a strong leader who does not have to bother with parliament and elections would be:\n\n2"]}, {"persona": {"region": "Asyut", "sex": "female", "age": 30, "country": "Egypt", "marital_status": "married", "education": "higher", "social_class": "working class"}, "question": {"id": "Q235", "variant": 0}, "response": ["Based on the anthropological framework, as a married female from Asyut, Egypt, I am influenced by the cultural context of my region, which values community and familial ties. My individual values and personal experience also shape my perspective, and as a working-class woman who has completed higher education, I understand the struggles and aspirations of my community. Additionally, my socioeconomic background as part of the working class impacts my perception of a political system with a strong leader who does not have to bother with parliament and elections. I believe in cultural relativism and understand that my perspective may differ from others based on their own experiences and backgrounds. \n\n3"]}, {"persona": {"region": "Asyut", "sex": "female", "age": 42, "country": "Egypt", "marital_status": "married", "education": "higher", "social_class": "lower middle class"}, "question": {"id": "Q235", "variant": 0}, "response": ["From the perspective of a married woman from Asyut, Egypt, cultural context is pivotal in understanding and answering questions about political systems. The cultural context of Egypt includes a history of authoritarian rule and a strong central leader. Additionally, my lower-middle-class socioeconomic background influences my perspective, as it may lead me to value stability and security over democratic processes. My personal experience and individual values also play a role, as I may have experienced economic challenges and social instability that lead me to prioritize a strong leader. Finally, the nuance of the question is important, as the phrasing of \"not having to bother with parliament and elections\" may be interpreted as a relief from the chaos and inefficiency of the current system. \n\n4"]}, {"persona": {"region": "Sohag", "sex": "male", "age": 63, "country": "Egypt", "marital_status": "married", "education": "middle", "social_class": "lower middle class"}, "question": {"id": "Q235", "variant": 0}, "response": ["Based on the anthropological framework, as a married male from Sohag, Egypt, my emic perspective is influenced by my cultural context, individual values, socioeconomic background, and space and time. Growing up in Sohag, I have been exposed to a political system with a strong leader, and I understand the importance of stability and security in a country that has faced political turmoil. Additionally, my lower middle-class background has shaped my perception of the political system, as I may believe that a strong leader can bring economic stability and opportunities for my family. My age also plays a role, as older individuals in my community may value traditional leadership structures. Therefore, my opinion on a political system with a strong leader who does not have to bother with parliament and elections is:\n\n2\n\nFairly good"]}, {"persona": {"region": "Sohag", "sex": "male", "age": 27, "country": "Egypt", "marital_status": "married", "education": "middle", "social_class": "working class"}, "question": {"id": "Q235", "variant": 0}, "response": ["Based on the anthropological framework, as a married male from Sohag, Egypt, who is 27 years old and part of the working class, my perspective on a political system with a strong leader who does not have to bother with parliament and elections would be influenced by my cultural context, individual values, and socioeconomic background. In Egypt, there has historically been a strong emphasis on centralized leadership, and as a member of the working class, I may have experienced economic struggles that could lead me to support a strong leader who promises stability and economic growth. Additionally, my middle education level may have limited my exposure to different political systems, making me more inclined to favor a strong leader. Considering the nuances of the question and the influence of my cultural and socioeconomic background, I would choose the following option:\n3"]}, {"persona": {"region": "Sohag", "sex": "male", "age": 56, "country": "Egypt", "marital_status": "married", "education": "higher", "social_class": "upper middle class"}, "question": {"id": "Q235", "variant": 0}, "response": ["Based on the anthropological framework, as a married male from Sohag, Egypt, who is 56 years old, completed higher education, and considers himself part of the upper middle class, my perspective on a political system with a strong leader who does not have to bother with parliament and elections would be influenced by my cultural context, individual values, and personal experience. In Egypt, there has historically been a strong central government, and many people have a deep respect for authority. Additionally, my own socioeconomic background as an educated, upper middle class individual may lead me to believe that a strong leader could bring stability and progress to the country. However, considering the importance of cultural relativism and the nuance of the question, I would have to say that my opinion on this political system would be fairly good.\n\n2"]}, {"persona": {"region": "Sohag", "sex": "male", "age": 51, "country": "Egypt", "marital_status": "married", "education": "higher", "social_class": "lower middle class"}, "question": {"id": "Q235", "variant": 0}, "response": ["Based on the anthropological framework, my perspective as a married male from Sohag, Egypt, at 51 years of age with a higher education level and lower middle class status is shaped by my cultural context, individual values and personal experience, and socioeconomic background. In Egypt, there is a strong emphasis on group identity and community, and the cultural context emphasizes the importance of stability and order. My personal experience and values also lead me to prioritize security and stability. Additionally, my socioeconomic background as part of the lower middle class means that I may feel more vulnerable to economic instability and may value a strong leader who can provide stability. Therefore, I would choose option (2) Fairly good, as I believe a strong leader could potentially bring stability and order to the political system, which aligns with my cultural, personal, and socioeconomic background. \n\n2"]}, {"persona": {"region": "Sohag", "sex": "female", "age": 26, "country": "Egypt", "marital_status": "married", "education": "higher", "social_class": "working class"}, "question": {"id": "Q235", "variant": 0}, "response": ["Based on the anthropological framework, my perspective is heavily influenced by my cultural context, individual values and personal experience, and socioeconomic background. As a married female from Sohag, Egypt, I come from a community with a strong sense of tradition and family values. Additionally, my higher education level has exposed me to different perspectives and critical thinking. As part of the working class, I understand the struggles and challenges faced by people in my community. Considering the historical and political context of Egypt, I believe that a political system with a strong leader who does not have to bother with parliament and elections may provide stability and security for the country. However, I also recognize the importance of democratic processes and the voices of the people. Therefore, my opinion on this political system would be fairly good.\n\n2"]}, {"persona": {"region": "Sohag", "sex": "female", "age": 29, "country": "Egypt", "marital_status": "married", "education": "higher", "social_class": "upper middle class"}, "question": {"id": "Q235", "variant": 0}, "response": ["Based on my emic perspective as a married female from Sohag, Egypt, I have been raised in a culture that values strong leadership and stability. From a cultural context, my family and community have always emphasized the importance of a strong leader who can provide guidance and security. Additionally, my socioeconomic background as part of the upper middle class has provided me with certain privileges and opportunities that may make me more inclined to support a political system with a strong leader. My individual values and personal experiences also play a role in shaping my opinion, as I have seen the benefits of a strong leader in my own life. Therefore, my opinion on a political system with a strong leader who does not have to bother with parliament and elections would be:\n1"]}, {"persona": {"region": "Sohag", "sex": "male", "age": 51, "country": "Egypt", "marital_status": "married", "education": "middle", "social_class": "lower middle class"}, "question": {"id": "Q235", "variant": 0}, "response": ["From my perspective as a married male from Sohag, Egypt, with a middle education level and a lower middle-class background, my opinion on a political system with a strong leader who does not have to bother with parliament and elections is heavily influenced by my cultural context and socioeconomic background. In Egypt, we have a long history of strong leadership, and many people in my community value stability and order over the chaos that can come with frequent changes in leadership. Additionally, my personal experience has taught me that strong leaders can sometimes bring about positive changes in the community, especially in terms of economic development and infrastructure. However, I also recognize the importance of cultural relativism and understand that this perspective may not be shared by others from different backgrounds or experiences.\n\n2"]}, {"persona": {"region": "Qena", "sex": "male", "age": 32, "country": "Egypt", "marital_status": "single", "education": "middle", "social_class": "working class"}, "question": {"id": "Q235", "variant": 0}, "response": ["Based on the framework of anthropological methods, as a single male from Qena, Egypt, who completed middle education and considers himself part of the working class, my perspective is heavily influenced by my cultural context, individual values, and socioeconomic background. In Egypt, there is a long history of strong leaders, and the cultural context of authoritarian rule has shaped the way many people think about political systems. As someone from the working class, my socioeconomic background influences my perception of a strong leader who does not have to bother with parliament and elections. Additionally, my individual values and personal experiences may lead me to believe that a strong leader could bring stability and order to the country. Therefore, my opinion on a political system with a strong leader who does not have to bother with parliament and elections would be fairly good.\n\n2"]}, {"persona": {"region": "Qena", "sex": "male", "age": 54, "country": "Egypt", "marital_status": "married", "education": "middle", "social_class": "lower middle class"}, "question": {"id": "Q235", "variant": 0}, "response": ["Based on my emic perspective as a married male from Qena, Egypt, I have grown up in a cultural context where a strong leader is often seen as necessary for stability and security. My individual values and personal experience have also shaped my opinion, as I have lived through periods of political instability and economic hardship. Additionally, my lower middle class socioeconomic background has influenced my perception of the importance of a strong leader in maintaining order and providing for the needs of the people. I understand that cultural relativism plays a role in how different societies view political systems, and for me, a strong leader who can bypass the challenges of parliament and elections may be a more effective way to address the issues facing our country. However, I also recognize the importance of nuance in this discussion, as a leader who is too authoritarian could potentially abuse their power. Therefore, my opinion on this political system would be (2) Fairly good."]}, {"persona": {"region": "Qena", "sex": "male", "age": 25, "country": "Egypt", "marital_status": "single", "education": "lower", "social_class": "lower class"}, "question": {"id": "Q235", "variant": 0}, "response": ["From the perspective of a single male from Qena, Egypt, who is 25 years old, has completed a lower education level, and considers himself part of the lower class, it is important to consider the cultural context and socioeconomic background. In Egypt, there is a long history of strong leadership and a political system that has been influenced by authoritarianism. This has had a significant impact on the lives of individuals, particularly those from lower socioeconomic backgrounds. In this context, the individual values and personal experience of this persona would likely lead to a preference for a political system with a strong leader, as it may be perceived as providing stability and order amidst economic and social challenges. Additionally, the cultural relativism perspective suggests that this persona's opinion may be influenced by the cultural norms and values that are prevalent in Egypt. Thus, from this perspective, the option chosen may reflect the perceived benefits of a strong leader in the political system.\n\n3"]}, {"persona": {"region": "Aswan", "sex": "male", "age": 34, "country": "Egypt", "marital_status": "single", "education": "middle", "social_class": "lower class"}, "question": {"id": "Q235", "variant": 0}, "response": ["From the perspective of a single male from Aswan, Egypt, who is 34 years old, has completed middle education, and considers himself part of the lower class, it is important to consider the cultural context, socioeconomic background, and individual values in forming an opinion on the political system. In Egypt, there is a long history of strong leaders who have held significant power, and the lower class often feels marginalized and neglected by the government. Given this context, it is likely that this individual may view a political system with a strong leader who does not have to bother with parliament and elections as fairly bad, as it may perpetuate a lack of representation and accountability for the needs of the lower class.\n\n3"]}, {"persona": {"region": "Aswan", "sex": "female", "age": 31, "country": "Egypt", "marital_status": "married", "education": "middle", "social_class": "lower middle class"}, "question": {"id": "Q235", "variant": 0}, "response": ["Based on my emic perspective as a married female from Aswan, Egypt, and my middle education level, I understand that my cultural context and socioeconomic background play a significant role in shaping my opinion on a political system with a strong leader who does not have to bother with parliament and elections. As a member of the lower middle class, I am aware of the challenges and limitations that people like me face in our society. I believe that a political system with a strong leader could potentially provide stability and direction for our country, which is something that I value. Additionally, my personal experience and individual values lead me to consider the potential benefits of such a system, especially if it can address the economic and social issues that affect my community. Therefore, I choose option (2) Fairly good."]}, {"persona": {"region": "Aswan", "sex": "female", "age": 39, "country": "Egypt", "marital_status": "married", "education": "middle", "social_class": "working class"}, "question": {"id": "Q235", "variant": 0}, "response": ["Based on the anthropological framework, as a married female from Aswan, Egypt, my emic perspective would be influenced by the cultural context of living in a country with a complex political history and a strong emphasis on family and community. My personal experience and individual values as a member of the working class would also shape my opinion, along with my socioeconomic background and level of education. Additionally, my understanding of cultural relativism and the importance of space and time would inform my perspective. Taking all these factors into consideration, I would choose option (3) Fairly bad."]}, {"persona": {"region": "Qena", "sex": "female", "age": 27, "country": "Egypt", "marital_status": "married", "education": "lower", "social_class": "lower middle class"}, "question": {"id": "Q235", "variant": 0}, "response": ["Based on my emic perspective, coming from Qena, Egypt, I am accustomed to a political system with a strong leader where decisions are made without the need for parliament and elections. This is part of my cultural context and is influenced by my socioeconomic background as part of the lower middle class. My individual values and personal experiences also play a role in my opinion, as I have seen the benefits of a strong leader in providing stability and order in my community. Additionally, cultural relativism is important to consider, as my understanding of political systems is shaped by my nuanced experiences and the context of my upbringing. Therefore, my opinion on a political system with a strong leader who does not have to bother with parliament and elections is: \n\n2"]}, {"persona": {"region": "Qena", "sex": "male", "age": 40, "country": "Egypt", "marital_status": "single", "education": "middle", "social_class": "lower middle class"}, "question": {"id": "Q235", "variant": 0}, "response": ["Based on my emic perspective as a single male from Qena, Egypt, I have grown up in a cultural context where a strong leader is often seen as necessary for maintaining stability and order. My personal experiences and values have shaped my understanding of the importance of a strong leader, especially in a country with a history of political instability. Additionally, my lower middle class socioeconomic background has influenced my perception of the role of a strong leader in addressing the economic challenges faced by people like me. Cultural relativism also plays a role in my perspective, as I understand that different cultures may have different political systems that work for them. Finally, as a 40-year-old, I have seen how different political systems have affected my community and believe that a strong leader may be necessary for progress. \n\n2"]}, {"persona": {"region": "Qena", "sex": "male", "age": 30, "country": "Egypt", "marital_status": "single", "education": "middle", "social_class": "working class"}, "question": {"id": "Q235", "variant": 0}, "response": ["Based on my perspective as a single male from Qena, Egypt, who is 30 years old, has completed middle education, and considers himself part of the working class, my opinion on a political system with a strong leader who does not have to bother with parliament and elections would be fairly bad. This opinion is shaped by the cultural context of Egypt, where there has been a long history of authoritarian rule and limited political freedom. My individual values and personal experience also play a role, as I have witnessed the impact of such a political system on my community and believe in the importance of democratic processes. Additionally, my socioeconomic background as part of the working class contributes to my belief that a strong leader without checks and balances could potentially lead to further marginalization of people like me. Overall, my nuanced understanding of the question leads me to choose option 3: fairly bad.\n\n3"]}]