[{"persona": {"region": "Fayoum", "sex": "male", "age": 46, "country": "Egypt", "marital_status": "married", "education": "higher", "social_class": "lower middle class"}, "question": {"id": "Q175", "variant": 0}, "response": ["Based on the anthropological framework, my answer is influenced by my cultural context as a married male from Fayoum, Egypt, where religion plays a significant role in daily life. My personal values and experiences have been shaped by the teachings and beliefs of Islam, which is prevalent in my community. Additionally, my lower middle-class socioeconomic background has influenced my understanding of religion as a source of guidance and moral compass in navigating life's challenges. Therefore, I believe that the purpose of religion is (1) to make sense of life after death, as it provides comfort and hope for the future beyond this world.\n\n1"]}, {"persona": {"region": "Fayoum", "sex": "female", "age": 30, "country": "Egypt", "marital_status": "married", "education": "middle", "social_class": "lower middle class"}, "question": {"id": "Q175", "variant": 0}, "response": ["Based on my cultural context as a married female from Fayoum, Egypt, my understanding of the purpose of religion is influenced by my personal experience and individual values. In my community, religion plays a significant role in providing guidance and meaning to our daily lives. It helps us make sense of the challenges we face and provides a moral compass for our actions. Additionally, considering my lower middle class socioeconomic background, religion also serves as a source of comfort and hope in times of difficulty. The nuanced phrasing of the question also leads me to choose option (2) - To make sense of life in this world, as this aligns with the emphasis on the practical and everyday significance of religion in my cultural context.\n\n2"]}, {"persona": {"region": "Fayoum", "sex": "male", "age": 60, "country": "Egypt", "marital_status": "married", "education": "higher", "social_class": "working class"}, "question": {"id": "Q175", "variant": 0}, "response": ["From the perspective of a married male from Fayoum, Egypt, who is 60 years old, has completed higher education, and considers himself part of the working class, the purpose of religion is deeply rooted in cultural context and personal experience. In this region, religion plays a significant role in shaping daily life, providing a framework for social interaction, and guiding moral behavior. Additionally, the cultural relativism framework is important to consider, as the understanding of religion is not based on a hierarchy of cultures, but rather on the unique nuances of the individual's experience and values. Taking into account the emic and etic perspectives, it is clear that the purpose of religion is not limited to making sense of life after death, but also to make sense of life in this world.\n\n2"]}, {"persona": {"region": "Fayoum", "sex": "male", "age": 20, "country": "Egypt", "marital_status": "single", "education": "middle", "social_class": "lower middle class"}, "question": {"id": "Q175", "variant": 0}, "response": ["Based on my cultural context, I come from Fayoum, Egypt, where religion plays a significant role in our daily lives and understanding of the world. My socioeconomic background as part of the lower middle class also shapes my understanding of the purpose of religion. In this context, the purpose of religion is to make sense of life in this world, as it provides guidance, moral principles, and a sense of community that helps us navigate the challenges and uncertainties of our daily lives, especially at my age and education level where I am seeking to establish my place in the world.\n\n2"]}, {"persona": {"region": "Fayoum", "sex": "female", "age": 39, "country": "Egypt", "marital_status": "married", "education": "higher", "social_class": "lower middle class"}, "question": {"id": "Q175", "variant": 0}, "response": ["Based on the anthropological framework, my answer to the question of the purpose of religion would be influenced by my cultural context in Fayoum, Egypt. Religion plays a significant role in our daily lives, as it provides a framework for understanding and navigating the world around us. As a married woman from a lower middle class background, religion helps to provide a sense of community and support, especially in times of hardship. It also serves as a guide for moral and ethical behavior, shaping our interactions with others and our place within society. Additionally, religion offers reassurance and hope for a better future, both in this life and in the afterlife. Therefore, from my perspective, the purpose of religion is to make sense of life in this world.\n\n2"]}, {"persona": {"region": "Fayoum", "sex": "male", "age": 33, "country": "Egypt", "marital_status": "married", "education": "higher", "social_class": "working class"}, "question": {"id": "Q175", "variant": 0}, "response": ["Based on the anthropological framework, as a married male from Fayoum, Egypt, my emic perspective on the purpose of religion is heavily influenced by my cultural context, individual values, personal experience, and socioeconomic background. Religion plays a significant role in my community and is deeply ingrained in our daily lives, providing guidance and comfort in times of hardship. The etic perspective of religion may vary, but from my personal experience and cultural context, the purpose of religion is to make sense of life in this world, providing moral and ethical guidelines to navigate the complexities of everyday existence.\n\n2"]}, {"persona": {"region": "Port Said", "sex": "female", "age": 45, "country": "Egypt", "marital_status": "married", "education": "higher", "social_class": "lower middle class"}, "question": {"id": "Q175", "variant": 0}, "response": ["From my perspective as a married female from Port Said, Egypt, my understanding of the purpose of religion is deeply rooted in cultural context, individual values, and personal experience. In my community, religion plays a crucial role in shaping and guiding our daily lives, providing a moral framework, and bringing a sense of unity and purpose. As a lower middle-class individual, religion serves as a source of comfort, hope, and guidance, particularly in times of economic struggle. Additionally, my higher education has allowed me to critically engage with religious teachings and interpret their significance in the context of my own life and the society around me. Considering the emic and etic perspectives, cultural relativism, and the nuanced phrasing of the question, I firmly believe that the purpose of religion is to make sense of life in this world, offering guidance and a moral compass for navigating the complexities of daily existence.\n\n2"]}, {"persona": {"region": "Port Said", "sex": "male", "age": 42, "country": "Egypt", "marital_status": "married", "education": "middle", "social_class": "lower middle class"}, "question": {"id": "Q175", "variant": 0}, "response": ["From the perspective of a married male from Port Said, Egypt, at 42 years of age with a middle education level and a lower middle class background, the purpose of religion is deeply rooted in the cultural context of the region. Religion plays a crucial role in providing a sense of meaning and purpose in life, especially in the face of socioeconomic challenges. It also serves as a source of guidance, moral values, and community support. Additionally, the cultural relativism of the region emphasizes the importance of religion in everyday life, shaping individual values and personal experiences. Therefore, the purpose of religion is to make sense of life in this world.\n\n2"]}, {"persona": {"region": "Port Said", "sex": "male", "age": 28, "country": "Egypt", "marital_status": "single", "education": "middle", "social_class": "lower middle class"}, "question": {"id": "Q175", "variant": 0}, "response": ["Based on the anthropological framework, as a single male from Port Said, Egypt, my understanding of the purpose of religion is heavily influenced by my cultural context, individual values, and personal experience. In the Egyptian cultural context, religion plays a significant role in everyday life, including social interactions, family dynamics, and personal beliefs. As someone from the lower middle class, my socioeconomic background also affects my perception of religion, as it provides a sense of community and support in times of need. Additionally, my age and education level contribute to my understanding of religion, as I may be more focused on practical aspects of religious teachings rather than abstract concepts. Therefore, I believe that the purpose of religion is to make sense of life in this world.\n\n2"]}, {"persona": {"region": "Port Said", "sex": "female", "age": 30, "country": "Egypt", "marital_status": "married", "education": "higher", "social_class": "lower middle class"}, "question": {"id": "Q175", "variant": 0}, "response": ["Based on my cultural context in Port Said, Egypt, religion plays a crucial role in shaping our understanding of life and death. As a woman who has completed higher education and considers myself part of the lower middle class, my individual values and personal experiences have led me to view religion as a means of making sense of life in this world. In our community, religion provides guidance on how to live a righteous and fulfilling life, and it serves as a source of moral and ethical principles that help navigate the challenges and uncertainties of daily life. Additionally, the socioeconomic background and cultural relativism in our society emphasize the importance of religion in providing a sense of purpose and meaning in the present life. Therefore, I believe that the purpose of religion is to make sense of life in this world.\n\n2"]}, {"persona": {"region": "Port Said", "sex": "male", "age": 30, "country": "Egypt", "marital_status": "divorced", "education": "middle", "social_class": "lower middle class"}, "question": {"id": "Q175", "variant": 0}, "response": ["From an emic perspective, as a divorced male from Port Said, Egypt, religion plays a significant role in my life and the lives of those around me. The cultural context in which I live places a strong emphasis on the role of religion in shaping individual values and personal experiences. In my lower middle class background, religion provides a sense of community, guidance, and moral compass that helps make sense of the struggles and challenges I face. Additionally, the socioeconomic background and age also influence my understanding of religion, as it provides a source of comfort and hope in a society with limited opportunities. Furthermore, the nuanced phrasing of the question leads me to believe that the purpose of religion is to make sense of life in this world, rather than solely focusing on the afterlife.\n\n2"]}, {"persona": {"region": "Port Said", "sex": "female", "age": 19, "country": "Egypt", "marital_status": "single", "education": "middle", "social_class": "lower middle class"}, "question": {"id": "Q175", "variant": 0}, "response": ["From the perspective of a single female from Port Said, Egypt, who is 19 years old and part of the lower middle class, my understanding of the purpose of religion is deeply rooted in my cultural context and personal experience. In my community, religion plays a crucial role in providing guidance and structure in our daily lives. It helps us make sense of the world around us and provides a moral compass for our actions. As someone who has completed middle education level, I have been taught to value the teachings of our religious faith and to seek comfort in the belief that there is a greater purpose for our existence. Additionally, my socioeconomic background has influenced my understanding of religion as a means of finding hope and solace in difficult circumstances. Therefore, I believe that the purpose of religion is to make sense of life in this world.\n\n2"]}, {"persona": {"region": "Fayoum", "sex": "male", "age": 40, "country": "Egypt", "marital_status": "married", "education": "middle", "social_class": "working class"}, "question": {"id": "Q175", "variant": 0}, "response": ["Based on the anthropological framework, as a married male from Fayoum, Egypt, my emic perspective on the purpose of religion is heavily influenced by my cultural context and personal experience. In my community, religion serves to provide guidance and comfort in this world, as well as to maintain a sense of community and social order. Additionally, my socioeconomic background as a working-class individual has shaped my understanding of religion as a means of finding solace and purpose in the face of daily struggles. Therefore, I choose option 2: To make sense of life in this world."]}, {"persona": {"region": "Fayoum", "sex": "male", "age": 23, "country": "Egypt", "marital_status": "single", "education": "higher", "social_class": "lower middle class"}, "question": {"id": "Q175", "variant": 0}, "response": ["From the perspective of a single male from Fayoum, Egypt, who has completed a higher education level and considers himself part of the lower middle class, the purpose of religion is shaped by his cultural context, individual values, and personal experiences. In Egyptian society, religion plays a significant role in shaping daily life and providing a framework for understanding the world. As a young adult, he may see religion as a way to make sense of life in this world, providing guidance, meaning, and a sense of community in his everyday experiences. Additionally, his socioeconomic background may influence his view of religion as a source of comfort and stability in the face of economic challenges. Therefore, his perspective on the purpose of religion is likely shaped by a combination of cultural context, personal experience, and individual values.\n\n2"]}, {"persona": {"region": "Fayoum", "sex": "female", "age": 38, "country": "Egypt", "marital_status": "married", "education": "middle", "social_class": "lower middle class"}, "question": {"id": "Q175", "variant": 0}, "response": ["From the perspective of a married female from Fayoum, Egypt, who is 38 years old, has completed middle education, and considers herself part of the lower middle class, the purpose of religion would be seen through the lens of cultural context, individual values, and personal experience. In this cultural context, religion plays a significant role in providing a framework for understanding and making sense of life in this world. As a member of the lower middle class, religion may offer a source of comfort and guidance in navigating the challenges and uncertainties of daily life. Additionally, personal experience and individual values may shape the belief that religion serves as a moral compass and a means of finding purpose and direction in the face of socioeconomic challenges and limited opportunities for upward mobility.\n\n2"]}, {"persona": {"region": "Fayoum", "sex": "male", "age": 32, "country": "Egypt", "marital_status": "married", "education": "middle", "social_class": "lower middle class"}, "question": {"id": "Q175", "variant": 0}, "response": ["Based on the anthropological framework, as a married male from Fayoum, Egypt, my emic perspective on the purpose of religion is heavily influenced by my cultural context and personal experience. In my community, religion plays a significant role in making sense of life in this world. The teachings and practices of my faith provide guidance and structure to my daily life, helping me navigate the challenges and joys of existence. Additionally, my socioeconomic background as part of the lower middle class shapes my understanding of religion as a source of hope and support in facing the hardships of life. Therefore, from this perspective, I would choose option (2) To make sense of life in this world.\n\n2"]}, {"persona": {"region": "Fayoum", "sex": "male", "age": 31, "country": "Egypt", "marital_status": "married", "education": "higher", "social_class": "working class"}, "question": {"id": "Q175", "variant": 0}, "response": ["Based on the anthropological framework, as a married male from Fayoum, Egypt, my emic perspective would be influenced by my cultural context, individual values, and socioeconomic background. In Egypt, religion plays a significant role in everyday life and is deeply intertwined with cultural practices and societal norms. My personal experience and values also shape my understanding of the purpose of religion, as it provides guidance and structure in my daily life. Additionally, as part of the working class, religion may also serve as a source of support and community in times of hardship. Therefore, from this perspective, the purpose of religion is to make sense of life in this world.\n\n2"]}, {"persona": {"region": "Fayoum", "sex": "male", "age": 31, "country": "Egypt", "marital_status": "married", "education": "middle", "social_class": "lower middle class"}, "question": {"id": "Q175", "variant": 0}, "response": ["Based on my anthropological understanding, as a married male from Fayoum, Egypt, with a middle education level and lower middle class background, my perspective on the purpose of religion is shaped by my cultural context, individual values, and personal experience. In my community, religion plays a crucial role in providing guidance and meaning in this world. It helps us navigate the challenges of daily life, provides a moral compass, and offers a sense of community and belonging. Additionally, religion also serves as a source of hope and comfort, especially in times of hardship. Considering the nuance of the question, I would choose option (2) To make sense of life in this world. \n\n2"]}, {"persona": {"region": "Fayoum", "sex": "female", "age": 32, "country": "Egypt", "marital_status": "married", "education": "middle", "social_class": "lower middle class"}, "question": {"id": "Q175", "variant": 0}, "response": ["Based on the anthropological framework, as a 32-year-old married female from Fayoum, Egypt, with a middle education level and lower middle class background, my understanding of the purpose of religion is deeply influenced by my cultural context, individual values, and personal experience. In my community, religion serves the purpose of making sense of life in this world, providing guidance for ethical living, and offering a sense of community and belonging. Additionally, my socioeconomic background has shaped my understanding of religion as a source of comfort and support in challenging times. Therefore, I believe that the purpose of religion is to make sense of life in this world.\n\n2"]}, {"persona": {"region": "Ismailia", "sex": "male", "age": 53, "country": "Egypt", "marital_status": "married", "education": "middle", "social_class": "lower middle class"}, "question": {"id": "Q175", "variant": 0}, "response": ["From the perspective of a married male from Ismailia, Egypt, who is 53 years old and part of the lower middle class, the purpose of religion is to make sense of life in this world. This reasoning is based on the cultural context of Egypt, where religion plays a significant role in everyday life and provides guidance and meaning in the face of economic challenges and social inequalities. Additionally, personal experience and individual values also influence this perspective, as the individual may have turned to religion for comfort and guidance in navigating life's struggles. Furthermore, the socioeconomic background of being part of the lower middle class may lead to a focus on the practical and tangible benefits of religion in addressing everyday concerns. \n\n2"]}, {"persona": {"region": "Ismailia", "sex": "male", "age": 38, "country": "Egypt", "marital_status": "married", "education": "higher", "social_class": "working class"}, "question": {"id": "Q175", "variant": 0}, "response": ["Based on the anthropological framework, as a married male from Ismailia, Egypt, my emic perspective on the purpose of religion is heavily influenced by my cultural context, individual values, and personal experience. In Egypt, religion plays a significant role in shaping daily life and societal norms. Additionally, my personal experience and values have been shaped by the religious teachings and practices I have grown up with. Furthermore, as part of the working class, religion also provides a sense of community and support. Therefore, the purpose of religion, from my perspective, is to make sense of life in this world.\n\n2"]}, {"persona": {"region": "Ismailia", "sex": "female", "age": 35, "country": "Egypt", "marital_status": "married", "education": "middle", "social_class": "lower middle class"}, "question": {"id": "Q175", "variant": 0}, "response": ["Based on the anthropological framework, as a married female from Ismailia, Egypt, my emic perspective is heavily influenced by my cultural context, individual values, and socioeconomic background. In my community, religion plays a significant role in shaping our beliefs and values, providing a framework for understanding life and death, and guiding our actions. My personal experience and values also lead me to believe that religion serves the purpose of making sense of life in this world, providing moral and ethical guidance, and offering a sense of community and belonging. Furthermore, my lower middle class socioeconomic background has influenced my understanding of the importance of religion in providing comfort and hope in the face of economic challenges and social inequalities.\n\n2"]}, {"persona": {"region": "Ismailia", "sex": "female", "age": 57, "country": "Egypt", "marital_status": "married", "education": "lower", "social_class": "working class"}, "question": {"id": "Q175", "variant": 0}, "response": ["Based on the anthropological framework, my perspective as a married female from Ismailia, Egypt, who is 57 years old, completed lower education, and considers myself part of the working class, is heavily influenced by my cultural context, individual values, and personal experiences. In my community, religion is a central aspect of our lives and plays a significant role in shaping our understanding of the world. Additionally, my socioeconomic background and the space and time in which I have lived have further shaped my perspective on religion. Taking into account these factors, I believe that the purpose of religion is to make sense of life in this world.\n\n2"]}, {"persona": {"region": "Ismailia", "sex": "male", "age": 33, "country": "Egypt", "marital_status": "married", "education": "middle", "social_class": "lower middle class"}, "question": {"id": "Q175", "variant": 0}, "response": ["Based on the anthropological framework, as a married male from Ismailia, Egypt, my emic perspective on the purpose of religion is heavily influenced by my cultural context, individual values, and socioeconomic background. In Ismailia, religion plays a significant role in shaping societal norms and values, providing a sense of community and moral guidance. As a member of the lower middle class, I have experienced firsthand the importance of religion in providing a sense of hope and comfort in the face of economic challenges. Additionally, my personal experience and values lead me to believe that the purpose of religion is to make sense of life in this world, as it offers guidance on how to lead a morally upright life and find meaning and purpose in the present.\n\n2"]}, {"persona": {"region": "Ismailia", "sex": "female", "age": 49, "country": "Egypt", "marital_status": "single", "education": "higher", "social_class": "upper middle class"}, "question": {"id": "Q175", "variant": 0}, "response": ["Based on the anthropological framework, my perspective as a single female from Ismailia, Egypt, who is 49 years old, highly educated, and part of the upper middle class, is influenced by a combination of emic and etic perspectives, cultural context, individual values and personal experience, and socioeconomic background. In my cultural context, religion plays a significant role in shaping societal norms and values, providing a framework for moral and ethical guidance, and serving as a source of community and identity. My personal experience and educational background have also shaped my understanding of religion as a means of making sense of life in this world, providing a foundation for social cohesion, and offering a sense of purpose and belonging in the present moment.\n\n2"]}, {"persona": {"region": "Ismailia", "sex": "female", "age": 35, "country": "Egypt", "marital_status": "married", "education": "higher", "social_class": "lower middle class"}, "question": {"id": "Q175", "variant": 0}, "response": ["Based on the anthropological framework, I, as a married female from Ismailia, Egypt, understand the purpose of religion through my cultural context and individual values. In my community, religion is a central part of daily life and it provides a framework for understanding the world and our place in it. As part of the lower middle class, religion also plays a significant role in providing comfort and hope in the face of economic challenges. Additionally, my higher education level has allowed me to critically engage with religious beliefs and practices, leading me to believe that the purpose of religion is to make sense of life in this world.\n\n2"]}, {"persona": {"region": "Ismailia", "sex": "male", "age": 24, "country": "Egypt", "marital_status": "single", "education": "higher", "social_class": "upper middle class"}, "question": {"id": "Q175", "variant": 0}, "response": ["Based on the anthropological framework, as a single male from Ismailia, Egypt, my emic perspective on the purpose of religion is heavily influenced by my cultural context, individual values, and personal experience. In Egypt, religion plays a significant role in shaping societal norms and values, and as a member of the upper-middle class, I have been exposed to the influence of religion in both public and private spheres. Additionally, my higher education level has allowed me to critically analyze and understand the nuances of religious beliefs and practices. Therefore, I believe that the purpose of religion is to make sense of life in this world.\n\n2"]}, {"persona": {"region": "Ismailia", "sex": "female", "age": 23, "country": "Egypt", "marital_status": "single", "education": "higher", "social_class": "lower middle class"}, "question": {"id": "Q175", "variant": 0}, "response": ["From the perspective of a single female from Ismailia, Egypt, with a lower middle-class socioeconomic background and a higher education level, the purpose of religion is deeply intertwined with cultural context, individual values, and personal experience. In this region, religion plays a significant role in shaping daily life, providing a sense of community and moral guidance. Additionally, the cultural context of Egypt, with its rich history and tradition of religious practices, influences the individual's understanding of the purpose of religion. As a result, the chosen answer reflects the emic perspective of the persona, considering the importance of religion in making sense of life in this world.\n\n2"]}, {"persona": {"region": "Ismailia", "sex": "male", "age": 55, "country": "Egypt", "marital_status": "married", "education": "middle", "social_class": "lower middle class"}, "question": {"id": "Q175", "variant": 0}, "response": ["From the perspective of a married male from Ismailia, Egypt, who is 55 years old and considers himself part of the lower middle class, the purpose of religion is influenced by cultural context, individual values, and socioeconomic background. In this region, religion plays a significant role in everyday life, providing a framework for moral guidance, community cohesion, and social support. In addition, the belief in an afterlife and the importance of religious rituals and practices are deeply ingrained in the cultural context. Furthermore, the socioeconomic background of being part of the lower middle class may also contribute to a belief in religion as a source of hope and comfort in times of struggle. Therefore, from this perspective, the purpose of religion is to make sense of life in this world.\n\n2"]}, {"persona": {"region": "Ismailia", "sex": "male", "age": 57, "country": "Egypt", "marital_status": "married", "education": "middle", "social_class": "upper middle class"}, "question": {"id": "Q175", "variant": 0}, "response": ["In the cultural context of Ismailia, Egypt, religion plays a significant role in shaping individual values and personal experiences. As a married male in his late 50s, who completed middle education and considers himself part of the upper middle class, the purpose of religion is likely to be viewed as a means to make sense of life in this world. In this cultural context, religion is deeply intertwined with everyday life, providing guidance, moral principles, and a sense of community. It serves as a framework for understanding and navigating social interactions, ethical considerations, and personal struggles. Additionally, the concept of cultural relativism reminds us that the understanding of religion's purpose is subjective and deeply rooted in the cultural and socioeconomic background of individuals.\n\n2"]}, {"persona": {"region": "Ismailia", "sex": "female", "age": 29, "country": "Egypt", "marital_status": "married", "education": "middle", "social_class": "upper middle class"}, "question": {"id": "Q175", "variant": 0}, "response": ["Based on the anthropological framework, my response is heavily influenced by my cultural context, individual values, and personal experience. As a married female from Ismailia, Egypt, religion plays a significant role in my daily life and understanding of the world. In my cultural context, religion is deeply ingrained in society and influences everything from social interactions to governance. Additionally, my personal experience has shown me that religion provides a moral compass and guidance for living a fulfilling life. As part of the upper middle class, I have seen how religion can provide a sense of community and support for those in need. Therefore, from my perspective, the purpose of religion is to make sense of life in this world.\n\n2"]}, {"persona": {"region": "Damiatta", "sex": "female", "age": 46, "country": "Egypt", "marital_status": "married", "education": "middle", "social_class": "lower middle class"}, "question": {"id": "Q175", "variant": 0}, "response": ["In Damiatta, Egypt, the cultural context and individual values play a pivotal role in shaping one's understanding of religion. As a married woman from this region, my personal experience and socioeconomic background have influenced my beliefs and perceptions. Religion serves the purpose of making sense of life in this world, providing guidance and moral framework for everyday life. It is also deeply tied to community and family values, and serves as a source of comfort and support in times of difficulty. Therefore, from this perspective, the purpose of religion is to make sense of life in this world.\n\n2"]}, {"persona": {"region": "Damiatta", "sex": "female", "age": 20, "country": "Egypt", "marital_status": "single", "education": "middle", "social_class": "lower middle class"}, "question": {"id": "Q175", "variant": 0}, "response": ["Based on the anthropological framework, I, as a single female from Damiatta, Egypt, would consider the purpose of religion from a cultural context, individual values, and personal experience. In my community, religion plays a crucial role in shaping the understanding of life and providing a moral compass. Additionally, my lower middle-class socioeconomic background has influenced my perception of religion as a means of finding solace and hope in the face of economic hardships. Therefore, I would choose option (2) To make sense of life in this world. Religion provides guidance, comfort, and a sense of community in navigating the challenges of daily life. \n\n2"]}, {"persona": {"region": "Damiatta", "sex": "male", "age": 19, "country": "Egypt", "marital_status": "single", "education": "middle", "social_class": "lower middle class"}, "question": {"id": "Q175", "variant": 0}, "response": ["Based on the anthropological framework, as a single male from Damiatta, Egypt, I understand that my cultural context and personal experience play a significant role in shaping my perspective on religion. In my community, religion is deeply ingrained in our daily lives and serves as a source of guidance, moral values, and a sense of community. As a young person from the lower middle class, I have seen how religion provides a sense of purpose and stability in a rapidly changing and often uncertain world. Additionally, considering the emic and etic perspectives, I believe that the purpose of religion is not only to make sense of life after death but also to make sense of life in this world. Religion provides comfort, guidance, and a sense of belonging in our everyday lives, addressing our existential concerns and offering a framework for navigating the complexities of the world we live in.\n\n2"]}, {"persona": {"region": "Damiatta", "sex": "female", "age": 33, "country": "Egypt", "marital_status": "married", "education": "higher", "social_class": "lower middle class"}, "question": {"id": "Q175", "variant": 0}, "response": ["Based on my cultural context coming from Damiatta, Egypt, religion is a crucial aspect of our daily lives and is deeply ingrained in our societal and individual values. As a married woman who completed higher education and considers myself part of the lower middle class, I have been brought up to believe that the purpose of religion is not only to make sense of life after death, but also to make sense of life in this world. Our cultural context and personal experiences have taught us that religion provides guidance, moral values, and a sense of community in our day-to-day lives. It plays a significant role in shaping our understanding of the world and our place in it, and is essential for finding purpose and meaning in our lives.\n\n2"]}, {"persona": {"region": "Damiatta", "sex": "male", "age": 24, "country": "Egypt", "marital_status": "single", "education": "higher", "social_class": "lower middle class"}, "question": {"id": "Q175", "variant": 0}, "response": ["Based on my emic perspective as a single male from Damiatta, Egypt, I understand the purpose of religion as a way to make sense of life in this world. In our cultural context, religion plays a significant role in guiding our daily lives, providing moral and ethical guidelines, and offering a sense of community and belonging. Additionally, my personal experience and values have taught me that religion serves as a source of comfort and guidance in navigating the challenges and uncertainties of life. Taking into account my lower middle class socioeconomic background, religion also serves as a means of finding hope and solace in the face of economic struggles and societal inequalities. Furthermore, considering the nuanced phrasing of the question, I believe that the purpose of religion is not solely focused on the afterlife, but rather on providing meaning and structure to our lives here and now.\n\n2"]}, {"persona": {"region": "Suez", "sex": "male", "age": 41, "country": "Egypt", "marital_status": "married", "education": "middle", "social_class": "working class"}, "question": {"id": "Q175", "variant": 0}, "response": ["Based on the anthropological framework, I, as a married male from Suez, Egypt, would consider the purpose of religion from the cultural context of my society, where religion plays a significant role in shaping daily life and social norms. Additionally, my individual values and personal experience as a member of the working class in Egypt would influence my understanding of the purpose of religion. Considering cultural relativism, I would acknowledge that different societies have different perspectives on religion, and that there is no hierarchy of culture. Therefore, I would select the option that aligns with the purpose of religion within my cultural context.\n\n2"]}, {"persona": {"region": "Suez", "sex": "female", "age": 39, "country": "Egypt", "marital_status": "divorced", "education": "middle", "social_class": "working class"}, "question": {"id": "Q175", "variant": 0}, "response": ["Based on the anthropological framework, as a divorced female from Suez, Egypt, my emic perspective on the purpose of religion is heavily influenced by my cultural context and personal experience. Religion in my community plays a significant role in providing guidance and meaning in this world, particularly in the face of challenges such as divorce. Additionally, my socioeconomic background as a working-class individual shapes my understanding of religion as a source of comfort and support in navigating the difficulties of daily life. Therefore, my choice is:\n\n2"]}, {"persona": {"region": "Cairo", "sex": "female", "age": 55, "country": "Egypt", "marital_status": "married", "education": "middle", "social_class": "working class"}, "question": {"id": "Q175", "variant": 0}, "response": ["From the perspective of a married female from Cairo, Egypt, who is 55 years old, completed middle education level, and considers herself part of the working class, the cultural context is crucial in understanding the purpose of religion. In Egypt, religion plays a significant role in daily life and is deeply intertwined with cultural practices and societal norms. As an individual with a working-class background, the socioeconomic background also influences the understanding of religion, as access to education and resources may impact one's interpretation of religious teachings. Additionally, personal experience and individual values shape the perception of religion, as it provides a moral compass and a sense of community. Considering the emic and etic perspectives, the purpose of religion may be seen as a means to make sense of life in this world, as it provides guidance, support, and a sense of belonging within the cultural and societal context of Egypt.\n\n2"]}, {"persona": {"region": "Cairo", "sex": "male", "age": 58, "country": "Egypt", "marital_status": "married", "education": "middle", "social_class": "lower middle class"}, "question": {"id": "Q175", "variant": 0}, "response": ["Based on the anthropological framework, I, as a married male from Cairo, Egypt, at 58 years of age and part of the lower middle class, would approach the question of the purpose of religion by considering the cultural context and individual values. In my community, religion plays a significant role in shaping daily life and providing a moral compass. Additionally, my personal experience and values lead me to believe that the purpose of religion is to make sense of life in this world, providing guidance on how to navigate societal norms and ethical dilemmas. This perspective is influenced by the socioeconomic background and cultural relativism prevalent in my community.\n\n2"]}, {"persona": {"region": "Cairo", "sex": "female", "age": 29, "country": "Egypt", "marital_status": "married", "education": "higher", "social_class": "lower middle class"}, "question": {"id": "Q175", "variant": 0}, "response": ["Based on the anthropological framework, as a married female from Cairo, Egypt, my emic perspective on the purpose of religion is heavily influenced by my cultural context. In Egypt, religion plays a significant role in everyday life, shaping values, norms, and social structure. As a member of the lower middle class, my socioeconomic background also influences my understanding of religion as a source of hope and comfort in the face of economic challenges. Additionally, my personal experience and individual values contribute to my belief that religion serves the purpose of making sense of life in this world, providing guidance, moral principles, and a sense of community in the midst of social and economic struggles.\n\n2"]}, {"persona": {"region": "Cairo", "sex": "male", "age": 38, "country": "Egypt", "marital_status": "married", "education": "higher", "social_class": "lower middle class"}, "question": {"id": "Q175", "variant": 0}, "response": ["Based on my emic perspective as a married male from Cairo, Egypt, I understand religion to be a way to make sense of life in this world. In our cultural context, religion plays a significant role in shaping our everyday lives, from our interactions with others to our moral and ethical decisions. My personal experience and values have led me to see religion as a guiding force in navigating the challenges and joys of life. Additionally, considering my lower middle-class background, religion also provides a sense of community and support in times of need. Furthermore, cultural relativism reminds us that different cultures have varying understandings of religion, and for me, it is about finding purpose and meaning in the present world. \n\n2"]}, {"persona": {"region": "Cairo", "sex": "female", "age": 40, "country": "Egypt", "marital_status": "married", "education": "higher", "social_class": "lower middle class"}, "question": {"id": "Q175", "variant": 0}, "response": ["From the perspective of a married female from Cairo, Egypt, who is 40 years old and part of the lower middle class, the purpose of religion is deeply rooted in the cultural context and individual values. In Egypt, religion plays a significant role in shaping daily life and societal norms. The emic perspective of this persona would prioritize the role of religion in making sense of life in this world, as it influences everything from family dynamics to social interactions. Personal experiences and cultural context would also emphasize the importance of religion in providing guidance and structure in navigating the challenges of everyday life. Therefore, the chosen answer is: \n2"]}, {"persona": {"region": "Cairo", "sex": "male", "age": 38, "country": "Egypt", "marital_status": "married", "education": "higher", "social_class": "upper middle class"}, "question": {"id": "Q175", "variant": 0}, "response": ["Based on my emic perspective as a married male from Cairo, Egypt, I have been raised to believe that the purpose of religion is to make sense of life in this world. This belief is deeply ingrained in the cultural context of Egypt, where religion plays a significant role in everyday life and societal norms. Additionally, my personal experience and individual values have shaped my understanding of religion, and I have always been taught that religion provides guidance and principles for leading a good and moral life in the present. Furthermore, my socioeconomic background as part of the upper middle class has allowed me to have access to education and resources that have further influenced my perspective on the purpose of religion. Lastly, the nuanced phrasing of the question has led me to believe that the purpose of religion, from my perspective, is to make sense of life in this world.\n\n2"]}, {"persona": {"region": "Cairo", "sex": "male", "age": 59, "country": "Egypt", "marital_status": "married", "education": "middle", "social_class": "lower middle class"}, "question": {"id": "Q175", "variant": 0}, "response": ["Based on the anthropological framework, my answer to the question of the purpose of religion is influenced by my cultural context as a married male from Cairo, Egypt. Religion plays a significant role in the lives of individuals in this region, and it is deeply intertwined with cultural practices, traditions, and beliefs. Additionally, my personal experience and individual values as a 59-year-old from a lower middle class background have shaped my understanding of the purpose of religion. Furthermore, the socioeconomic background and cultural relativism of my community have also influenced my perspective. Ultimately, from this viewpoint, the purpose of religion is to make sense of life in this world.\n\n2"]}, {"persona": {"region": "Cairo", "sex": "female", "age": 30, "country": "Egypt", "marital_status": "married", "education": "higher", "social_class": "upper middle class"}, "question": {"id": "Q175", "variant": 0}, "response": ["Based on my emic perspective as a married female from Cairo, Egypt, I understand the purpose of religion to be closely linked to the cultural context and individual values in my society. Religion plays a significant role in shaping the moral and ethical guidelines that govern our lives, providing a framework for understanding the world and our place in it. Additionally, the socioeconomic background and cultural relativism in Egypt emphasize the importance of religion in maintaining social cohesion and providing a sense of community. Furthermore, considering my personal experience and educational background, I believe that religion serves the purpose of making sense of life in this world, providing guidance on how to live a virtuous and fulfilling life in the present. \n\n2"]}, {"persona": {"region": "Cairo", "sex": "male", "age": 22, "country": "Egypt", "marital_status": "single", "education": "middle", "social_class": "lower middle class"}, "question": {"id": "Q175", "variant": 0}, "response": ["Based on my cultural context and individual values, as a young man from Cairo, Egypt, religion plays a significant role in my life. The emic perspective of my community places a heavy emphasis on the purpose of religion in making sense of life in this world. Our cultural context and socioeconomic background have shaped our understanding of religion as a way to find meaning and guidance in the challenges and opportunities we encounter in our daily lives. Additionally, my personal experience and age have also influenced my understanding of the purpose of religion, as it provides a framework for moral and ethical decision-making and offers a sense of community and belonging. Therefore, from my perspective, the purpose of religion is to make sense of life in this world.\n\n2"]}, {"persona": {"region": "Cairo", "sex": "male", "age": 29, "country": "Egypt", "marital_status": "single", "education": "higher", "social_class": "lower middle class"}, "question": {"id": "Q175", "variant": 0}, "response": ["Based on the anthropological framework, my perspective as a single male from Cairo, Egypt, at 29 years old and part of the lower middle class, is heavily influenced by my cultural context, individual values, and personal experiences. Religion plays a significant role in the lives of many Egyptians, providing a framework for understanding and navigating the complexities of life. From an emic perspective, religion serves to make sense of life in this world, providing guidance, moral values, and a sense of community. My personal experience and socioeconomic background have shaped my understanding of religion as a source of comfort, stability, and moral guidance in the face of economic challenges and societal pressures.\n\n2"]}, {"persona": {"region": "Cairo", "sex": "female", "age": 31, "country": "Egypt", "marital_status": "married", "education": "higher", "social_class": "lower middle class"}, "question": {"id": "Q175", "variant": 0}, "response": ["From the perspective of a married female from Cairo, Egypt, who is 31 years old, completed higher education, and considers herself part of the lower middle class, the answer to the question of the purpose of religion is heavily influenced by cultural context, individual values, and personal experience. In Egypt, religion plays a significant role in daily life and is closely intertwined with traditions and customs. As a member of the lower middle class, the socioeconomic background also plays a part in shaping the importance of religion. Additionally, the nuanced phrasing of the question may lead to a different understanding of the purpose of religion. Therefore, the answer chosen is based on the nuanced understanding of the individual's cultural and personal context.\n\n2"]}, {"persona": {"region": "Cairo", "sex": "male", "age": 59, "country": "Egypt", "marital_status": "married", "education": "higher", "social_class": "upper middle class"}, "question": {"id": "Q175", "variant": 0}, "response": ["Based on the anthropological framework, I, as a married male from Cairo, Egypt, understand the purpose of religion through a combination of individual values, cultural context, and personal experience. In Egyptian society, religion plays a central role in shaping social and moral values, providing a sense of community and identity, and offering guidance on ethical conduct. In this cultural context, the purpose of religion is not solely focused on making sense of life after death, as it also serves to make sense of life in this world. Religion provides a framework for understanding and navigating the complexities of everyday life, offering a moral compass and a sense of purpose. Additionally, my higher education level has allowed me to critically engage with religious teachings and philosophical concepts, leading me to see the purpose of religion as multifaceted and relevant to the challenges of contemporary society.\n\n2"]}, {"persona": {"region": "Cairo", "sex": "male", "age": 27, "country": "Egypt", "marital_status": "single", "education": "middle", "social_class": "working class"}, "question": {"id": "Q175", "variant": 0}, "response": ["Based on the anthropological framework, my perspective as a 27-year-old working-class male from Cairo, Egypt, with a middle education level is heavily influenced by my cultural context, individual values, and personal experience. Religion plays a significant role in the everyday lives of the people in my community, providing a framework for moral guidance, community cohesion, and a sense of purpose. It also serves as a means of making sense of life in this world, providing explanations for natural phenomena, social norms, and the human experience. Given my background and cultural context, I would choose option 2, as the purpose of religion is intertwined with my personal experiences and values.\n\n2"]}, {"persona": {"region": "Cairo", "sex": "female", "age": 25, "country": "Egypt", "marital_status": "single", "education": "higher", "social_class": "working class"}, "question": {"id": "Q175", "variant": 0}, "response": ["Based on the anthropological framework, my perspective as a single female from Cairo, Egypt, who is 25 years old, completed higher education, and considers herself part of the working class, is deeply influenced by my cultural context, individual values, and personal experience. In Egypt, religion plays a significant role in shaping societal norms, values, and daily life. As a member of the working class, religion provides a sense of community, moral guidance, and a framework for understanding the challenges and injustices faced in this world. Additionally, my personal experience has shown me that religion serves as a source of hope, comfort, and solidarity, particularly in the face of socioeconomic struggles and inequality. Therefore, from my perspective, the purpose of religion is to make sense of life in this world.\n\n2"]}, {"persona": {"region": "Cairo", "sex": "female", "age": 23, "country": "Egypt", "marital_status": "married", "education": "higher", "social_class": "lower middle class"}, "question": {"id": "Q175", "variant": 0}, "response": ["Based on the anthropological framework, as a married female from Cairo, Egypt, my emic perspective on the purpose of religion is heavily influenced by the cultural context of my society. Religion plays a crucial role in providing a sense of community and belonging, as well as guiding moral and ethical behavior. Additionally, my individual values and personal experience have shaped my understanding of religion as a means of seeking guidance and finding comfort in the face of life's challenges. Furthermore, my lower middle class socioeconomic background adds another layer to my understanding, as religion often provides hope and solace in the face of economic struggles. Therefore, from this perspective, I would choose option (2) - To make sense of life in this world. \n\n2"]}, {"persona": {"region": "Cairo", "sex": "male", "age": 58, "country": "Egypt", "marital_status": "married", "education": "higher", "social_class": "working class"}, "question": {"id": "Q175", "variant": 0}, "response": ["Based on the anthropological framework, as a married male from Cairo, Egypt, my emic perspective on the purpose of religion is influenced by the cultural context of my upbringing and surroundings. Religion plays a crucial role in shaping the moral fabric of society and providing a sense of community and belonging. Additionally, my individual values and personal experience have led me to prioritize the role of religion in providing guidance and purpose in this world, rather than solely focusing on the afterlife. Socioeconomic background also plays a role, as my working-class status has led me to value the practical aspects of religion in guiding my daily life. Furthermore, cultural relativism teaches me to respect the diverse interpretations of religion, and my nuanced understanding of the question leads me to select option 2: To make sense of life in this world.\n\n2"]}, {"persona": {"region": "Cairo", "sex": "female", "age": 40, "country": "Egypt", "marital_status": "married", "education": "higher", "social_class": "working class"}, "question": {"id": "Q175", "variant": 0}, "response": ["Based on the anthropological framework, as a married female from Cairo, Egypt, my emic perspective is heavily influenced by the cultural context of living in a predominantly Muslim society. My personal experience and individual values are shaped by the teachings of Islam, and my socioeconomic background as a working-class woman in Egypt also plays a significant role in my understanding of religion. Additionally, the cultural relativism in Egypt means that the purpose of religion is not only to make sense of life after death but also to make sense of life in this world. The nuanced phrasing of the question allows for this multifaceted understanding of the purpose of religion.\n\n2"]}, {"persona": {"region": "Cairo", "sex": "female", "age": 36, "country": "Egypt", "marital_status": "married", "education": "middle", "social_class": "upper middle class"}, "question": {"id": "Q175", "variant": 0}, "response": ["Based on the anthropological framework, as a married female from Cairo, Egypt, my emic perspective on the purpose of religion is influenced by my cultural context, individual values, and socioeconomic background. In Egyptian society, religion plays a crucial role in shaping daily life, providing moral guidance, and fostering a sense of community. Additionally, my personal experiences and values have led me to believe that religion serves the purpose of making sense of life in this world, as it provides a framework for understanding societal norms and values, as well as offering guidance on how to navigate the complexities of daily life. Furthermore, as a member of the upper middle class, I have observed how religion is intertwined with social status and community relationships, reinforcing the importance of religion in shaping the fabric of society.\n\n2"]}, {"persona": {"region": "Cairo", "sex": "male", "age": 40, "country": "Egypt", "marital_status": "married", "education": "middle", "social_class": "lower middle class"}, "question": {"id": "Q175", "variant": 0}, "response": ["In my cultural context in Cairo, Egypt, religion is a central aspect of daily life and provides a framework for understanding the world around us. As a married male with a middle education level and part of the lower middle class, my personal experience and values are shaped by the teachings and practices of Islam. The socioeconomic background also plays a role in how religion is perceived, as it provides a sense of community and support in times of need. From an emic perspective, the purpose of religion is not only to make sense of life after death but also to provide guidance and structure in navigating the challenges of this world. It is a source of moral and ethical principles that inform our actions and decision-making, and it offers a sense of belonging and identity within our society.\n\n2"]}, {"persona": {"region": "Cairo", "sex": "female", "age": 30, "country": "Egypt", "marital_status": "married", "education": "middle", "social_class": "lower class"}, "question": {"id": "Q175", "variant": 0}, "response": ["Based on the anthropological framework, I, as a married female from Cairo, Egypt, would consider the purpose of religion from a cultural context, individual values, and personal experience. In my cultural context, religion plays a significant role in shaping my daily life, influencing my beliefs, values, and behaviors. My personal experience as part of the lower class has also shaped my understanding of religion, as it provides a source of comfort, hope, and community in the face of economic challenges. Therefore, I would choose option (2) - To make sense of life in this world. \n\n2"]}, {"persona": {"region": "Cairo", "sex": "male", "age": 58, "country": "Egypt", "marital_status": "married", "education": "higher", "social_class": "lower middle class"}, "question": {"id": "Q175", "variant": 0}, "response": ["From the perspective of a married male from Cairo, Egypt, the purpose of religion is deeply rooted in the cultural context and individual values of the society. In Egypt, religion plays a significant role in shaping daily life and providing a sense of purpose and guidance. The emic perspective of this persona would emphasize the importance of religion in making sense of life in this world, as it influences societal norms, traditions, and personal values. Additionally, the socioeconomic background of being part of the lower middle class may also impact the emphasis on religion as a source of comfort and community support in the face of economic challenges. \n\n2"]}, {"persona": {"region": "Cairo", "sex": "male", "age": 50, "country": "Egypt", "marital_status": "married", "education": "middle", "social_class": "lower middle class"}, "question": {"id": "Q175", "variant": 0}, "response": ["From the perspective of a married middle-aged man from Cairo, Egypt, who considers himself part of the lower middle class, the answer to the question of the purpose of religion would be option (2) To make sense of life in this world. In the cultural context of Egypt, religion plays a significant role in daily life, providing guidance, moral values, and a sense of community. The individual values and personal experiences of this persona would also lead to the belief that religion serves the purpose of providing meaning and structure to life in the present, as well as offering hope and support in times of hardship. Additionally, the socioeconomic background of the persona would influence the belief that religion helps to navigate the challenges of living in the lower middle class by providing a sense of purpose and comfort. Therefore, the chosen option reflects the emic perspective of this persona in understanding the purpose of religion. \n\n2"]}, {"persona": {"region": "Cairo", "sex": "female", "age": 40, "country": "Egypt", "marital_status": "married", "education": "higher", "social_class": "upper middle class"}, "question": {"id": "Q175", "variant": 0}, "response": ["From the perspective of a married female from Cairo, Egypt, who is 40 years old, completed higher education, and considers herself part of the upper middle class, the purpose of religion is heavily influenced by cultural context and individual values. In Egypt, religion is a central aspect of daily life and societal norms. As a member of the upper middle class, the individual likely has access to education and resources, which may influence their understanding of religion and its purpose. Additionally, being a part of a society with a significant Islamic influence, the role of religion in making sense of life in this world is likely to be emphasized. The societal and cultural context, as well as the individual's personal experience and values, would lead to the understanding that religion serves the purpose of making sense of life in this world.\n\n2"]}, {"persona": {"region": "Cairo", "sex": "female", "age": 33, "country": "Egypt", "marital_status": "married", "education": "middle", "social_class": "lower middle class"}, "question": {"id": "Q175", "variant": 0}, "response": ["Based on my emic perspective as a married female from Cairo, Egypt, religion plays a crucial role in making sense of life in this world. Our cultural context, including our strong Islamic beliefs, teaches us that religion provides guidance and purpose in our day-to-day lives, helping us navigate through challenges and find meaning in our actions. Additionally, my individual values and personal experiences have shaped my understanding of religion as a source of moral guidance and community support. Furthermore, considering my lower middle-class socioeconomic background, religion serves as a source of comfort and hope in difficult times, offering a sense of belonging and solidarity within our community. Therefore, from my perspective, the purpose of religion is to make sense of life in this world.\n\n2"]}, {"persona": {"region": "Cairo", "sex": "female", "age": 37, "country": "Egypt", "marital_status": "married", "education": "middle", "social_class": "lower middle class"}, "question": {"id": "Q175", "variant": 0}, "response": ["Based on the anthropological framework, as a married female from Cairo, Egypt, I understand that my cultural context and individual values heavily influence my understanding of the purpose of religion. In my community, religion plays a vital role in providing guidance and meaning for life in this world. It helps us navigate our daily challenges, provides a sense of community and belonging, and offers moral and ethical guidance. Additionally, my lower middle class socioeconomic background has instilled in me the importance of finding purpose and meaning in the present, as we often face economic hardships and social inequalities. Therefore, I firmly believe that the purpose of religion is to make sense of life in this world.\n\n2"]}, {"persona": {"region": "Cairo", "sex": "male", "age": 28, "country": "Egypt", "marital_status": "married", "education": "middle", "social_class": "lower middle class"}, "question": {"id": "Q175", "variant": 0}, "response": ["Based on my personal experience and cultural context as a married male from Cairo, Egypt, religion plays a crucial role in making sense of life in this world. In our society, religion is intertwined with our daily lives, shaping our moral values, family structure, and community interactions. As part of the lower middle class, I have witnessed how religion provides a sense of purpose and guidance in navigating the challenges of our socioeconomic background. Additionally, the emic perspective within our community emphasizes the importance of religion in shaping our behaviors and decisions in this life. Therefore, I believe that the purpose of religion is to make sense of life in this world.\n\n2"]}, {"persona": {"region": "Cairo", "sex": "male", "age": 53, "country": "Egypt", "marital_status": "married", "education": "higher", "social_class": "working class"}, "question": {"id": "Q175", "variant": 0}, "response": ["Based on the anthropological framework, my response will be influenced by my cultural context, individual values and personal experience, and socioeconomic background. As a married male from Cairo, Egypt, religion plays a significant role in my life and in the lives of those around me. It helps us make sense of life in this world, providing moral guidance, a sense of community, and a framework for understanding the world around us. Additionally, as a member of the working class in Egypt, religion also serves as a source of comfort and hope in the face of economic challenges and social inequality.\n\n2"]}, {"persona": {"region": "Cairo", "sex": "male", "age": 45, "country": "Egypt", "marital_status": "married", "education": "higher", "social_class": "lower middle class"}, "question": {"id": "Q175", "variant": 0}, "response": ["Based on the anthropological framework, my perspective as a married male from Cairo, Egypt, at 45 years of age and part of the lower middle class, is heavily influenced by my cultural context and socioeconomic background. In Egypt, religion plays a central role in everyday life and is deeply embedded in the cultural fabric. My personal experience and values, shaped by this environment, lead me to believe that the purpose of religion is to make sense of life in this world. Religion provides a framework for moral guidance, social cohesion, and understanding of the world around us. It shapes our daily rituals, interactions with others, and our place within society. Therefore, from this perspective, I choose option (2) - To make sense of life in this world."]}, {"persona": {"region": "Cairo", "sex": "male", "age": 52, "country": "Egypt", "marital_status": "married", "education": "middle", "social_class": "upper middle class"}, "question": {"id": "Q175", "variant": 0}, "response": ["Based on the anthropological framework, my perspective as a married male from Cairo, Egypt, at 52 years of age and part of the upper middle class, is heavily influenced by my cultural context, individual values, and personal experience. In Cairo, religion plays a significant role in shaping societal norms, values, and traditions. As an individual who has completed middle education, I have been exposed to religious teachings and beliefs that emphasize the importance of understanding life in this world. In my experience, religion serves the purpose of providing guidance and meaning to everyday life, shaping moral and ethical values, and fostering a sense of community and belonging. Therefore, from my perspective, the purpose of religion is to make sense of life in this world.\n\n2"]}, {"persona": {"region": "Cairo", "sex": "male", "age": 22, "country": "Egypt", "marital_status": "single", "education": "higher", "social_class": "lower middle class"}, "question": {"id": "Q175", "variant": 0}, "response": ["Based on the anthropological framework, I, as a 22-year-old single male from Cairo, Egypt, belonging to the lower middle class, would consider the purpose of religion from a cultural context, individual values, and personal experience perspective. In my community, religion plays a significant role in providing guidance and meaning to everyday life. It helps us make sense of the challenges we face, find solace in times of hardship, and connect with our community through shared beliefs and practices. Additionally, religion also serves as a way to understand life after death, as it provides a framework for the afterlife and the concept of salvation. Therefore, in my personal experience and cultural context, the purpose of religion is to make sense of life in this world.\n2"]}, {"persona": {"region": "Cairo", "sex": "female", "age": 57, "country": "Egypt", "marital_status": "divorced", "education": "middle", "social_class": "lower middle class"}, "question": {"id": "Q175", "variant": 0}, "response": ["Based on the anthropological framework, as a divorced female from Cairo, Egypt, my emic perspective is heavily influenced by the cultural context of Egypt, where religion plays a significant role in daily life. My personal experience and individual values have been shaped by the teachings of Islam, which emphasize the importance of faith and religious practice. Additionally, my lower middle class socioeconomic background has also influenced my understanding of religion as a source of solace and guidance in difficult times. Furthermore, cultural relativism reminds me that my perspective is not the only valid one, and that others may have different beliefs and values. Therefore, I believe that the purpose of religion, from my perspective, is to make sense of life in this world.\n\n2"]}, {"persona": {"region": "Cairo", "sex": "female", "age": 42, "country": "Egypt", "marital_status": "married", "education": "middle", "social_class": "working class"}, "question": {"id": "Q175", "variant": 0}, "response": ["Based on the anthropological framework, as a married female from Cairo, Egypt, my perspective on the purpose of religion is heavily influenced by my cultural context, individual values, and personal experience. In Egypt, religion plays a central role in daily life, influencing everything from family dynamics to societal norms. As a member of the working class with a middle education level, my understanding of religion is deeply tied to making sense of life in this world. Religion provides a framework for moral guidance, social cohesion, and a sense of purpose in everyday life. Additionally, given the socioeconomic background and cultural relativism in Egypt, the purpose of religion is also shaped by the nuances of Egyptian society and the importance of community and tradition. Therefore, I believe that the purpose of religion, from my perspective, is to make sense of life in this world.\n\n2"]}, {"persona": {"region": "Cairo", "sex": "female", "age": 23, "country": "Egypt", "marital_status": "single", "education": "middle", "social_class": "lower middle class"}, "question": {"id": "Q175", "variant": 0}, "response": ["Based on my personal experience and cultural context as a single female from Cairo, Egypt, religion holds great significance in making sense of life in this world. In my community, religion is deeply intertwined with everyday life and plays a crucial role in providing guidance, moral principles, and a sense of community. As part of the lower middle class, religion also serves as a source of comfort and hope in the face of economic challenges and social inequalities. Additionally, my age and educational level have led me to understand the importance of religion in shaping societal norms and values. Therefore, from my perspective, the purpose of religion is to make sense of life in this world.\n\n2"]}, {"persona": {"region": "Cairo", "sex": "female", "age": 28, "country": "Egypt", "marital_status": "married", "education": "higher", "social_class": "upper middle class"}, "question": {"id": "Q175", "variant": 0}, "response": ["Based on my personal experience and cultural context as a married female from Cairo, Egypt, religion serves the purpose of making sense of life in this world. In my community, religion is deeply intertwined with everyday life, providing guidance on moral and ethical behavior, shaping social interactions, and offering a sense of community and belonging. Additionally, religious practices and beliefs provide a framework for understanding and navigating the challenges and joys of life, as well as offering a source of comfort and hope in difficult times. This perspective aligns with the emic understanding of the role of religion in my cultural context, as well as the influence of individual values and personal experience.\n\n2"]}, {"persona": {"region": "Cairo", "sex": "female", "age": 22, "country": "Egypt", "marital_status": "single", "education": "higher", "social_class": "lower middle class"}, "question": {"id": "Q175", "variant": 0}, "response": ["From my emic perspective as a single female from Cairo, Egypt, religion plays a crucial role in making sense of life in this world. The cultural context in Egypt is deeply rooted in religious practices and beliefs, and religion shapes our understanding of the world around us and our place in it. Growing up in a lower middle-class family in Cairo, religion has been an integral part of my personal experience, influencing my values and perceptions. Additionally, the socioeconomic background of my community emphasizes the importance of religion in providing guidance and purpose in our daily lives. Therefore, from my nuanced perspective, I believe that the purpose of religion is to make sense of life in this world.\n\n2"]}, {"persona": {"region": "Cairo", "sex": "female", "age": 39, "country": "Egypt", "marital_status": "married", "education": "middle", "social_class": "lower middle class"}, "question": {"id": "Q175", "variant": 0}, "response": ["Based on the anthropological framework, my perspective as a married female from Cairo, Egypt, is heavily influenced by my cultural context, individual values, and personal experience. In Egypt, religion plays a significant role in shaping people's understanding of life and the world around them. As a member of the lower middle class, I have been taught to find meaning and purpose in life through religion, as it provides a sense of community, guidance, and moral grounding. Additionally, in our cultural context, religion also serves to make sense of life in this world by providing a framework for understanding societal norms, ethical behavior, and the interconnectedness of our actions with the broader community. Therefore, my perspective is shaped by the belief that the purpose of religion is to make sense of life in this world.\n\n2"]}, {"persona": {"region": "Cairo", "sex": "male", "age": 19, "country": "Egypt", "marital_status": "single", "education": "middle", "social_class": "working class"}, "question": {"id": "Q175", "variant": 0}, "response": ["Based on the anthropological framework, as a 19-year-old single male from Cairo, Egypt, belonging to the working class, my understanding of the purpose of religion is influenced by my cultural context, individual values, and personal experience. In the cultural context of Egypt, religion plays a significant role in shaping societal norms and values. Personally, I have been raised in a community where religion is a central aspect of life, guiding moral and ethical beliefs. Additionally, my socioeconomic background as part of the working class has also influenced my understanding of religion as a source of hope and guidance in times of struggle. Therefore, my perspective aligns with option (2) - To make sense of life in this world.\n\n2"]}, {"persona": {"region": "Cairo", "sex": "female", "age": 54, "country": "Egypt", "marital_status": "married", "education": "middle", "social_class": "working class"}, "question": {"id": "Q175", "variant": 0}, "response": ["In considering the purpose of religion from an anthropological perspective, it is important to take into account the emic and etic perspectives of the persona described. As a married female from Cairo, Egypt, with a middle education level and part of the working class, the cultural context of the region, including the predominant Islamic faith, must be considered. Additionally, individual values and personal experience, along with socioeconomic background, play a significant role in shaping perceptions of religion. In this case, the purpose of religion may be seen as a means to make sense of life in this world by providing guidance, moral framework, and a sense of community and belonging. From this perspective, religion serves to provide a framework for living a meaningful and fulfilling life in the present, rather than solely focusing on the afterlife.\n\n2"]}, {"persona": {"region": "Cairo", "sex": "male", "age": 30, "country": "Egypt", "marital_status": "married", "education": "higher", "social_class": "working class"}, "question": {"id": "Q175", "variant": 0}, "response": ["Based on the anthropological framework, as a married male from Cairo, Egypt, my cultural context and individual values and personal experience play a big role in my understanding and perception of religion. Religion in Egypt is deeply tied to the cultural and social fabric of the country, and as a working-class individual, my socioeconomic background also influences my perspective. In addition, the space and time in which I live and the nuances of the question will also affect my answer. Therefore, based on this perspective, I choose:\n\n2) To make sense of life in this world"]}, {"persona": {"region": "Cairo", "sex": "male", "age": 39, "country": "Egypt", "marital_status": "married", "education": "higher", "social_class": "lower middle class"}, "question": {"id": "Q175", "variant": 0}, "response": ["Based on my personal experience and cultural context as a married male from Cairo, Egypt, religion serves the purpose of making sense of life in this world. In my community, religion plays a significant role in guiding moral and ethical behavior, providing a sense of community and belonging, and offering guidance on how to navigate the challenges of daily life. Additionally, the socioeconomic background of being part of the lower middle class has influenced my understanding of religion as a source of hope and comfort in the face of economic struggles. Therefore, I believe that the purpose of religion is to make sense of life in this world.\n\n2"]}, {"persona": {"region": "Cairo", "sex": "female", "age": 41, "country": "Egypt", "marital_status": "married", "education": "middle", "social_class": "lower middle class"}, "question": {"id": "Q175", "variant": 0}, "response": ["In my cultural context in Cairo, Egypt, religion plays a significant role in shaping our understanding and approach to life. As a lower middle class, middle-aged woman, my personal values and experiences are deeply influenced by the teachings and practices of Islam, which is the predominant religion in my community. The socioeconomic background also plays a role in shaping the purpose of religion, as it provides a sense of community and support in times of need. Additionally, the emic perspective emphasizes the importance of religion in guiding our moral compass and providing a framework for ethical living. Therefore, from this perspective, I would choose option (2) To make sense of life in this world, as religion serves as a guiding force in navigating the challenges and uncertainties of life on earth.\n\n2"]}, {"persona": {"region": "Cairo", "sex": "male", "age": 45, "country": "Syria", "marital_status": "single", "education": "higher", "social_class": "upper middle class"}, "question": {"id": "Q175", "variant": 0}, "response": ["Based on the anthropological framework, as a single male from Cairo, Syria, my emic perspective on the purpose of religion is heavily influenced by my cultural context, individual values, and personal experience. The cultural context of Syria is deeply rooted in Islamic beliefs, and my personal experience and upbringing have ingrained in me the importance of religion in making sense of life in this world. Additionally, my socioeconomic background as part of the upper middle class has allowed me to access higher education, where I have further explored and understood the role of religion in providing guidance and meaning in everyday life. Therefore, from my perspective, the purpose of religion is to make sense of life in this world.\n\n2"]}, {"persona": {"region": "Cairo", "sex": "male", "age": 54, "country": "Egypt", "marital_status": "married", "education": "higher", "social_class": "lower middle class"}, "question": {"id": "Q175", "variant": 0}, "response": ["Based on the anthropological framework, my perspective on the purpose of religion is influenced by my cultural context, individual values, and socioeconomic background. In Cairo, Egypt, religion is deeply embedded in the cultural fabric and plays a significant role in shaping individual values and personal experiences. As a lower middle class, 54-year-old, educated married male, my understanding of religion is shaped by the need to make sense of life in this world. Religion provides guidance, moral framework, and a sense of community that helps navigate the challenges and complexities of daily life. Additionally, in my cultural context, religion is intertwined with social and political aspects, contributing to a holistic understanding of the purpose of religion.\n\n2"]}, {"persona": {"region": "Cairo", "sex": "male", "age": 65, "country": "Egypt", "marital_status": "married", "education": "middle", "social_class": "upper middle class"}, "question": {"id": "Q175", "variant": 0}, "response": ["Based on the anthropological framework, as a married male from Cairo, Egypt, I would consider the purpose of religion to be deeply rooted in cultural context, personal experience, and individual values. In Egypt, religion plays a significant role in daily life and societal structure. As a 65-year-old with a middle education level and belonging to the upper middle class, I have likely been shaped by the cultural and religious norms of my community. Additionally, my personal experiences and values may lead me to believe that the purpose of religion is to make sense of life in this world, as it provides guidance, moral principles, and a sense of community. Therefore, my perspective on the purpose of religion is influenced by my cultural context, personal experience, and individual values.\n\n2"]}, {"persona": {"region": "Cairo", "sex": "female", "age": 52, "country": "Egypt", "marital_status": "married", "education": "middle", "social_class": "upper middle class"}, "question": {"id": "Q175", "variant": 0}, "response": ["From the perspective of a married female from Cairo, Egypt, who is 52 years old and considers herself part of the upper middle class, the purpose of religion is deeply rooted in cultural context and personal experience. In Egypt, religion, specifically Islam, plays a central role in everyday life, providing a framework for moral and ethical guidance, social cohesion, and a sense of community. The cultural context of Egypt is deeply intertwined with Islamic beliefs and practices, shaping individual values and personal experiences. Additionally, as a member of the upper middle class, religion may also serve as a means of social distinction and maintaining social status within the community. Furthermore, the nuanced understanding of religion in this context is not simply about making sense of life after death, but also about making sense of life in this world, as it informs daily practices, social interactions, and the overall worldview of individuals.\n\n2"]}, {"persona": {"region": "Cairo", "sex": "male", "age": 26, "country": "Egypt", "marital_status": "single", "education": "higher", "social_class": "lower middle class"}, "question": {"id": "Q175", "variant": 0}, "response": ["Based on the anthropological framework, my answer to the question of the purpose of religion would be influenced by my cultural context, individual values, socioeconomic background, and space and time. As a single male from Cairo, Egypt, I come from a culture with a rich history and strong religious traditions. My personal experience and values are also shaped by this context, and I am part of the lower middle class with a higher education level. In this context, religion serves the purpose of making sense of life in this world, providing guidance, and offering a sense of community and belonging. It also plays a significant role in shaping social norms and values, providing a framework for moral and ethical decision-making, and offering support in times of hardship. Therefore, my answer reflects the influence of my cultural context, personal experience, and socioeconomic background.\n\n2"]}, {"persona": {"region": "Cairo", "sex": "male", "age": 32, "country": "Egypt", "marital_status": "married", "education": "middle", "social_class": "working class"}, "question": {"id": "Q175", "variant": 0}, "response": ["Based on the anthropological framework, as a married male from Cairo, Egypt, my emic perspective would be heavily influenced by the cultural context of my Islamic faith. Religion is a central part of our society, guiding everything from social interactions to daily routines. My personal experience and individual values are also shaped by this cultural context, and my socioeconomic background as a working-class individual likely means that religion provides solace and guidance in the face of economic struggles. Additionally, the nuance of the question may lead me to believe that the purpose of religion is to make sense of life in this world, as it is deeply intertwined with every aspect of our lives.\n\n2"]}, {"persona": {"region": "Cairo", "sex": "male", "age": 38, "country": "Egypt", "marital_status": "married", "education": "middle", "social_class": "lower middle class"}, "question": {"id": "Q175", "variant": 0}, "response": ["Based on the anthropological framework, I, as a married male from Cairo, Egypt, would consider the purpose of religion to be influenced by my cultural context, individual values, and personal experience. In Egyptian society, religion plays a central role in everyday life and is deeply intertwined with cultural traditions and practices. As a member of the lower middle class, I have likely experienced economic hardships and social inequality, which may lead me to seek solace and meaning in the teachings of my faith. Additionally, the emic perspective of my community likely emphasizes the importance of religion in providing guidance and moral values for navigating the challenges of this world. Therefore, I would choose option (2) To make sense of life in this world.\n\n2"]}, {"persona": {"region": "Cairo", "sex": "male", "age": 58, "country": "Egypt", "marital_status": "married", "education": "higher", "social_class": "upper middle class"}, "question": {"id": "Q175", "variant": 0}, "response": ["From the perspective of a married male from Cairo, Egypt, who is 58 years old, completed higher education, and considers himself part of the upper middle class, the purpose of religion is deeply tied to cultural context, individual values, and personal experience. In Egyptian society, religion plays a significant role in shaping daily life, social relationships, and moral values. The cultural context of Egypt, with its rich history of religious tradition and the prevalence of Islam as the dominant faith, has a profound impact on the individual's understanding of the purpose of religion. Additionally, personal experiences and values are shaped by this cultural and religious background, influencing the individual's perception of the purpose of religion. Therefore, the purpose of religion is to make sense of life in this world.\n\n2"]}, {"persona": {"region": "Cairo", "sex": "male", "age": 49, "country": "Egypt", "marital_status": "married", "education": "middle", "social_class": "lower middle class"}, "question": {"id": "Q175", "variant": 0}, "response": ["Based on the anthropological framework, I, as a married male from Cairo, Egypt, would approach the question of the purpose of religion from a cultural context perspective. In Egypt, religion is deeply ingrained in everyday life and is a central part of our cultural identity. My personal experience and individual values also play a significant role in shaping my understanding of the purpose of religion. Additionally, my lower middle-class socioeconomic background influences my perspective, as religion provides a sense of community and support in times of economic struggle. Considering the emic and etic perspectives, I would choose option 2: To make sense of life in this world. \n\n2"]}, {"persona": {"region": "Cairo", "sex": "female", "age": 29, "country": "Egypt", "marital_status": "married", "education": "middle", "social_class": "working class"}, "question": {"id": "Q175", "variant": 0}, "response": ["Based on the anthropological framework, my perspective as a married female from Cairo, Egypt, is heavily influenced by my cultural context, individual values, personal experience, socioeconomic background, and the nuance of the question. In Egypt, religion plays a central role in everyday life and is deeply intertwined with societal norms and traditions. As a member of the working class, religion provides a sense of community and support, and it shapes my worldview and moral compass. Additionally, my personal experience and education level have led me to prioritize the practical implications of religion in this world, such as guiding ethical decision-making and providing a sense of purpose and meaning in the present life. Therefore, based on my perspective, I choose option (2) To make sense of life in this world. \n\n2"]}, {"persona": {"region": "Cairo", "sex": "female", "age": 36, "country": "Egypt", "marital_status": "married", "education": "higher", "social_class": "lower middle class"}, "question": {"id": "Q175", "variant": 0}, "response": ["Based on the anthropological framework, my answer to the question \"What is the purpose of religion?\" is influenced by my emic perspective as a married female from Cairo, Egypt. In my cultural context, religion plays a pivotal role in making sense of life in this world. It provides guidance, moral principles, and a sense of community. Additionally, my personal experience and individual values as a 36-year-old with higher education from the lower middle class have shaped my understanding of religion as a source of comfort and stability in the face of socioeconomic challenges. Furthermore, the cultural relativism of Egypt emphasizes the importance of religion in everyday life, further reinforcing the view that the purpose of religion is to make sense of life in this world.\n\n2"]}, {"persona": {"region": "Cairo", "sex": "female", "age": 34, "country": "Egypt", "marital_status": "married", "education": "middle", "social_class": "lower middle class"}, "question": {"id": "Q175", "variant": 0}, "response": ["Based on the anthropological framework, my answer to the question \"What is the purpose of religion?\" is influenced by a combination of emic and etic perspectives, cultural context, individual values and personal experience, and socioeconomic background. As a married female from Cairo, Egypt, I am influenced by the dominant Islamic culture in my country, which shapes my understanding of the purpose of religion. Religion serves the purpose of making sense of life in this world, providing guidance for ethical and moral conduct, and offering a framework for social interactions and community cohesion. Additionally, my lower middle class socioeconomic background and limited education level contribute to my belief that religion is primarily concerned with providing guidance for life in the present world, where I face daily struggles and challenges that require spiritual and moral support.\n\n2"]}, {"persona": {"region": "Fayoum", "sex": "male", "age": 57, "country": "Egypt", "marital_status": "married", "education": "middle", "social_class": "working class"}, "question": {"id": "Q175", "variant": 0}, "response": ["Based on the anthropological framework, the perspective of a 57-year-old married male from Fayoum, Egypt, who has completed middle education and considers himself part of the working class would be heavily influenced by his cultural context, individual values, and personal experience. In this cultural context, religion plays a central role in daily life and is intertwined with societal norms and values. The purpose of religion is to make sense of life in this world, providing guidance, moral framework, and a sense of community. This perspective is shaped by the individual's personal experience and the cultural context of Egypt, where religion is deeply ingrained in all aspects of life.\n\n2"]}, {"persona": {"region": "Fayoum", "sex": "male", "age": 60, "country": "Egypt", "marital_status": "married", "education": "middle", "social_class": "lower middle class"}, "question": {"id": "Q175", "variant": 0}, "response": ["From an anthropological perspective, my understanding of the purpose of religion is shaped by my emic perspective as a married male from Fayoum, Egypt. Religion plays a crucial role in my cultural context, providing a framework for understanding the world around me and guiding my actions. In my socioeconomic background as part of the lower middle class, religion also serves as a source of community and support. Additionally, my personal experience and individual values have shaped my belief that religion serves the purpose of making sense of life in this world. It provides me with guidance, moral principles, and a sense of belonging within my community. Therefore, I believe that the purpose of religion is to make sense of life in this world. \n\n2"]}, {"persona": {"region": "Fayoum", "sex": "male", "age": 21, "country": "Egypt", "marital_status": "single", "education": "middle", "social_class": "lower middle class"}, "question": {"id": "Q175", "variant": 0}, "response": ["From the perspective of a single male from Fayoum, Egypt, who has completed middle education and considers himself part of the lower middle class, it is important to consider the cultural context and individual values when answering the question of the purpose of religion. In this region, religion plays a significant role in everyday life and is deeply ingrained in the cultural context. The individual's personal experience and values, shaped by their socioeconomic background and age, will influence their understanding of the purpose of religion. Additionally, the nuanced phrasing of the question will also impact the response. Considering these factors, the purpose of religion from this perspective is to make sense of life in this world.\n\n2"]}, {"persona": {"region": "Fayoum", "sex": "male", "age": 33, "country": "Egypt", "marital_status": "single", "education": "higher", "social_class": "working class"}, "question": {"id": "Q175", "variant": 0}, "response": ["Based on the anthropological framework, my answer to the question of the purpose of religion would be influenced by my cultural context, individual values, and socioeconomic background as a single male from Fayoum, Egypt. In my community, religion plays a significant role in providing meaning and purpose to life in this world. It helps guide our moral and ethical beliefs, provides a sense of community and belonging, and offers guidance in navigating the challenges of everyday life. Additionally, with my working-class background, religion also serves as a source of comfort and hope, especially in times of hardship and struggle. Therefore, my understanding of the purpose of religion would align with option (2) - To make sense of life in this world.\n\n2"]}, {"persona": {"region": "Fayoum", "sex": "male", "age": 32, "country": "Egypt", "marital_status": "married", "education": "higher", "social_class": "lower middle class"}, "question": {"id": "Q175", "variant": 0}, "response": ["Based on the anthropological framework, my perspective as a married male from Fayoum, Egypt, is heavily influenced by my cultural context, individual values, and socioeconomic background. In Egyptian society, religion plays a central role in shaping our understanding of the purpose of life. As part of the lower middle class, I have been taught that religion serves to make sense of life in this world, providing guidance, moral values, and a sense of community. Additionally, my personal experience and education have further reinforced the belief that religion is a way to navigate the complexities of daily life and find meaning in our existence.\n\n2"]}, {"persona": {"region": "Gharbia", "sex": "male", "age": 42, "country": "Egypt", "marital_status": "married", "education": "higher", "social_class": "upper middle class"}, "question": {"id": "Q175", "variant": 0}, "response": ["Based on the anthropological framework, my response to the question of the purpose of religion is influenced by my cultural context, individual values, and personal experiences. As a married male from Gharbia, Egypt, religion plays a significant role in my life and the lives of those around me. It provides a framework for understanding and navigating the complexities of life in this world, shaping our moral and ethical values, and guiding our social interactions. Additionally, my higher education level has allowed me to critically engage with religious teachings and interpret them in a way that is relevant to my socioeconomic background and upper middle class status. Therefore, my answer to the question is:\n\n2\n\n(2) To make sense of life in this world"]}, {"persona": {"region": "Gharbia", "sex": "male", "age": 52, "country": "Egypt", "marital_status": "married", "education": "middle", "social_class": "working class"}, "question": {"id": "Q175", "variant": 0}, "response": ["From the perspective of a married male from Gharbia, Egypt, who is 52 years old, has completed middle education level, and considers himself part of the working class, the answer to the question of the purpose of religion would be influenced by the cultural context, individual values and personal experience, and socioeconomic background. In Gharbia, religion plays a significant role in daily life and is deeply intertwined with cultural traditions and societal norms. As a member of the working class, the individual may rely on religion for moral guidance, community support, and a sense of purpose in life. Additionally, with limited formal education, the individual's understanding of religion may be based more on personal experience and tradition rather than theological study. Therefore, the purpose of religion, from this perspective, is likely to be seen as a way to make sense of life in this world.\n\n2"]}, {"persona": {"region": "Gharbia", "sex": "male", "age": 45, "country": "Egypt", "marital_status": "divorced", "education": "higher", "social_class": "upper middle class"}, "question": {"id": "Q175", "variant": 0}, "response": ["Based on the anthropological framework, as a divorced male from Gharbia, Egypt, who is 45 years old, highly educated, and part of the upper middle class, I would consider the purpose of religion to be multifaceted. From an emic perspective, religion plays a crucial role in providing a framework for understanding the afterlife and the concept of an afterlife is deeply ingrained in the cultural context of Egypt. Additionally, religion also serves to provide guidance and meaning in this world, particularly in the context of personal values and experience. Furthermore, considering the socioeconomic background, religion may also provide a sense of community and social support. Therefore, the purpose of religion is not limited to just making sense of life after death or life in this world, but rather encompasses a more holistic approach.\n\n2"]}, {"persona": {"region": "Behaira", "sex": "male", "age": 23, "country": "Egypt", "marital_status": "single", "education": "middle", "social_class": "lower class"}, "question": {"id": "Q175", "variant": 0}, "response": ["In my cultural context, religion plays a significant role in making sense of life in this world. As a lower-class individual from Behaira, Egypt, my personal experience and values have been shaped by the influence of religion in my community. I have seen how religion provides a framework for understanding and navigating the challenges of daily life, offering guidance on moral and ethical behavior, and providing a sense of community and belonging. Additionally, the socioeconomic background of my community has also influenced my perspective, as religion often serves as a source of hope and resilience in the face of economic hardships. Therefore, from my emic perspective, the purpose of religion is to make sense of life in this world.\n\n2"]}, {"persona": {"region": "Behaira", "sex": "male", "age": 38, "country": "Egypt", "marital_status": "single", "education": "higher", "social_class": "lower class"}, "question": {"id": "Q175", "variant": 0}, "response": ["Based on the anthropological framework, as a single male from Behaira, Egypt, my emic perspective on the purpose of religion is heavily influenced by my cultural context and individual values. In my community, religion plays a significant role in making sense of life in this world, providing guidance, moral principles, and a sense of belonging. My personal experience and socioeconomic background as part of the lower class have also shaped my understanding of religion as a source of comfort and support in the face of life's challenges. Additionally, cultural relativism reminds me that there are diverse interpretations of religion, and for me, the purpose of religion is to navigate and find meaning in the complexities of everyday life.\n\n2"]}, {"persona": {"region": "Behaira", "sex": "male", "age": 32, "country": "Egypt", "marital_status": "married", "education": "middle", "social_class": "lower class"}, "question": {"id": "Q175", "variant": 0}, "response": ["In Behaira, Egypt, cultural context plays a pivotal role in understanding the purpose of religion. As a married male from this region, my emic perspective is heavily influenced by the cultural and religious beliefs that have been passed down through generations. My personal experience and individual values, shaped by my socioeconomic background and lower class status, lead me to believe that the purpose of religion is to make sense of life in this world, providing guidance and structure in the face of daily struggles and hardships. Additionally, the nuanced phrasing of the question also influences my answer, as it highlights the importance of religion in the present moment rather than focusing solely on the afterlife. \n\n2"]}, {"persona": {"region": "Behaira", "sex": "female", "age": 37, "country": "Egypt", "marital_status": "married", "education": "middle", "social_class": "working class"}, "question": {"id": "Q175", "variant": 0}, "response": ["Based on the anthropological framework, as a married woman from Behaira, Egypt, my cultural context and religious beliefs play a significant role in shaping my understanding of the purpose of religion. In my community, religion is deeply intertwined with our daily lives, providing guidance, comfort, and a sense of meaning. As a member of the working class, religion serves as a source of hope and solace in the face of economic challenges and societal pressures. Additionally, my personal experiences and values have led me to believe that the purpose of religion is to make sense of life in this world, providing moral guidance, a sense of community, and a framework for navigating the complexities of everyday life.\n\n2"]}, {"persona": {"region": "Behaira", "sex": "male", "age": 48, "country": "Egypt", "marital_status": "married", "education": "middle", "social_class": "working class"}, "question": {"id": "Q175", "variant": 0}, "response": ["Based on the anthropological framework, as a married male from Behaira, Egypt, my understanding of the purpose of religion is deeply rooted in cultural context and personal experience. In my community, religion plays a significant role in providing a framework for understanding life and death. It provides a sense of comfort and guidance in navigating the challenges of this world, as well as offering hope for a meaningful existence beyond this life. Additionally, my working-class background and middle education level have shaped my values and beliefs, leading me to prioritize the practical applications of religion in everyday life. Therefore, I choose option (2) To make sense of life in this world.\n\n2"]}, {"persona": {"region": "Behaira", "sex": "female", "age": 34, "country": "Egypt", "marital_status": "married", "education": "middle", "social_class": "lower class"}, "question": {"id": "Q175", "variant": 0}, "response": ["From the perspective of a married woman from Behaira, Egypt, who is 34 years old, completed middle education level, and considers herself part of the lower class, the cultural context is crucial in understanding the purpose of religion. In this region, religion plays a significant role in daily life, providing a framework for moral and ethical behavior, as well as a sense of community and belonging. The socioeconomic background also influences the perception of religion, as it often provides a source of comfort and hope in the face of economic challenges. Additionally, individual values and personal experiences shape the understanding of religion, as it offers solace and guidance in navigating the complexities of life. Therefore, the purpose of religion, from this perspective, is to make sense of life in this world.\n\n2"]}, {"persona": {"region": "Behaira", "sex": "female", "age": 30, "country": "Egypt", "marital_status": "divorced", "education": "lower", "social_class": "lower class"}, "question": {"id": "Q175", "variant": 0}, "response": ["Based on the anthropological framework, as a divorced female from Behaira, Egypt, who is 30 years old, completed lower education, and considers herself part of the lower class, my answer to the question on the purpose of religion is influenced by my individual values and personal experience. In my cultural context, religion plays a significant role in providing a sense of community, support, and guidance in navigating the challenges of life. Additionally, my socioeconomic background and cultural relativism have shaped my understanding of religion as a means to make sense of life in this world, providing moral and ethical guidelines for living and offering comfort and hope in times of hardship.\n\n2"]}, {"persona": {"region": "Behaira", "sex": "male", "age": 40, "country": "Egypt", "marital_status": "married", "education": "higher", "social_class": "lower middle class"}, "question": {"id": "Q175", "variant": 0}, "response": ["Based on the anthropological framework, as a married male from Behaira, Egypt, my understanding of the purpose of religion is deeply influenced by my cultural context and individual values. In Egypt, religion plays a significant role in shaping our daily lives and providing guidance on moral and ethical principles. As a member of the lower middle class, religion also serves as a source of comfort and hope in the face of economic challenges. Additionally, my higher education level has allowed me to critically examine and appreciate the nuances of religious teachings, leading me to believe that the purpose of religion is to make sense of life in this world, guiding individuals to lead a righteous and fulfilling life. \n\n2"]}, {"persona": {"region": "Behaira", "sex": "male", "age": 38, "country": "Egypt", "marital_status": "married", "education": "middle", "social_class": "working class"}, "question": {"id": "Q175", "variant": 0}, "response": ["Based on the anthropological framework, as a married male from Behaira, Egypt, my emic perspective on the purpose of religion is heavily influenced by my cultural context, individual values, and personal experience. In my community, religion plays a significant role in providing meaning and guidance in everyday life, as well as in understanding the afterlife. Additionally, my socioeconomic background as a working-class individual also shapes my understanding of religion as a source of hope and comfort in the face of life's challenges. Furthermore, cultural relativism reminds me that different cultures may have different interpretations and purposes for religion, and I must respect and understand these differences. Therefore, my choice for the purpose of religion is option (2) To make sense of life in this world.\n\n2"]}, {"persona": {"region": "Behaira", "sex": "female", "age": 30, "country": "Egypt", "marital_status": "married", "education": "higher", "social_class": "lower class"}, "question": {"id": "Q175", "variant": 0}, "response": ["Based on the anthropological framework, as a married female from Behaira, Egypt, my emic perspective on the purpose of religion is heavily influenced by my cultural context, individual values, and socioeconomic background. In my community, religion plays a crucial role in making sense of life in this world. It provides guidance, moral values, and a sense of community. Additionally, my lower class status means that religion also serves as a source of hope and comfort in the face of economic hardships and social inequalities.\n\n2"]}, {"persona": {"region": "Behaira", "sex": "female", "age": 35, "country": "Egypt", "marital_status": "married", "education": "middle", "social_class": "working class"}, "question": {"id": "Q175", "variant": 0}, "response": ["From the perspective of a married woman from Behaira, Egypt, who is 35 years old, completed middle education, and considers herself part of the working class, there are several factors that influence my understanding and answer to the question of the purpose of religion. Firstly, my cultural context and personal experience have taught me that religion plays a crucial role in providing guidance and comfort in the face of life's challenges. Additionally, my socioeconomic background has shaped my understanding of religion as a source of community and support. Furthermore, the nuance of the question leads me to believe that the purpose of religion is to make sense of life in this world, as it provides ethical and moral guidelines for navigating everyday life.\n\n2"]}, {"persona": {"region": "Behaira", "sex": "male", "age": 52, "country": "Egypt", "marital_status": "married", "education": "middle", "social_class": "lower class"}, "question": {"id": "Q175", "variant": 0}, "response": ["Based on the anthropological framework, as a married male from Behaira, Egypt, I would answer the question from the perspective of my cultural context, individual values, and personal experience. In Egypt, religion is deeply embedded in our daily lives and plays a crucial role in shaping our understanding of the world. As a member of the lower class, religion provides a sense of community and support, especially during difficult times. It also serves as a moral compass, guiding our actions and decisions. Therefore, from my perspective, the purpose of religion is to make sense of life in this world.\n\n2"]}, {"persona": {"region": "Alexandria", "sex": "female", "age": 41, "country": "Egypt", "marital_status": "single", "education": "middle", "social_class": "lower class"}, "question": {"id": "Q175", "variant": 0}, "response": ["Based on the anthropological framework, as a single female from Alexandria, Egypt, at 41 years of age with a middle education level and considering myself part of the lower class, my understanding of religion is heavily influenced by my cultural context, individual values, and socioeconomic background. In Egypt, religion plays a significant role in shaping societal norms and values, providing a sense of community and belonging, and offering hope and comfort in difficult circumstances. As someone from the lower class, religion serves as a source of strength and resilience, providing a sense of purpose and stability in an otherwise challenging socio-economic environment. Therefore, I believe the purpose of religion is (2) To make sense of life in this world.\n\n2"]}, {"persona": {"region": "Alexandria", "sex": "female", "age": 21, "country": "Egypt", "marital_status": "single", "education": "middle", "social_class": "lower class"}, "question": {"id": "Q175", "variant": 0}, "response": ["Based on the anthropological framework, I, as a single woman from Alexandria, Egypt, have grown up in a cultural context where religion plays a significant role in shaping the community. My emic perspective is influenced by the societal norms and values that prioritize religious practices and beliefs. As part of the lower class, my socioeconomic background has also shaped my understanding of religion as a means of finding comfort and hope in the face of economic struggles and social inequalities. Additionally, my personal experiences and individual values have led me to believe that the purpose of religion is to make sense of life in this world, providing guidance and support in navigating the challenges and uncertainties of everyday life.\n2"]}, {"persona": {"region": "Alexandria", "sex": "female", "age": 35, "country": "Egypt", "marital_status": "married", "education": "middle", "social_class": "lower class"}, "question": {"id": "Q175", "variant": 0}, "response": ["Based on the anthropological framework, my emic perspective as a married female from Alexandria, Egypt, would be influenced by my cultural context, individual values, socioeconomic background, and space and time. In my community, religion plays a significant role in shaping our understanding of life and providing guidance in navigating our daily challenges. As a member of the lower class, religion offers a sense of hope and comfort in the face of economic hardships and social inequalities. Additionally, being from a predominantly Islamic society, the purpose of religion is not only to make sense of life after death, but also to provide moral and ethical guidelines for living a righteous life in this world. Therefore, my choice is:\n2"]}, {"persona": {"region": "Alexandria", "sex": "male", "age": 34, "country": "Egypt", "marital_status": "married", "education": "higher", "social_class": "working class"}, "question": {"id": "Q175", "variant": 0}, "response": ["Based on the anthropological framework, I, as a married male from Alexandria, Egypt, at the age of 34, with a working class background and higher education, understand that the purpose of religion is deeply rooted in cultural context, individual values, and personal experience. In my cultural context, religion plays a significant role in providing a moral compass and guidance for daily life. It also serves as a source of community and social cohesion. Additionally, my personal experience and values lead me to believe that the purpose of religion is to make sense of life in this world, to provide guidance and support in navigating the complexities of daily life, and to foster a sense of belonging and identity within my community. Therefore, my chosen option is:\n\n2) To make sense of life in this world"]}, {"persona": {"region": "Alexandria", "sex": "female", "age": 37, "country": "Egypt", "marital_status": "married", "education": "higher", "social_class": "lower middle class"}, "question": {"id": "Q175", "variant": 0}, "response": ["From an emic perspective, as a married woman from Alexandria, Egypt, religion plays a significant role in my daily life and cultural context. The cultural and religious norms and practices that I have been raised with have shaped my personal values and experiences, and have influenced my understanding of the purpose of religion. As a member of the lower middle class, socioeconomic background has also played a role in shaping my perceptions and beliefs. In my community, religion is not only a means to make sense of life after death, but it also serves as a guide for making sense of life in this world, providing moral and ethical guidelines for how to live a fulfilling and purposeful life. Additionally, the nuanced phrasing of the question allows for a more holistic understanding of the purpose of religion, taking into account the complexities of individual and cultural perspectives.\n\n2"]}, {"persona": {"region": "Alexandria", "sex": "female", "age": 56, "country": "Egypt", "marital_status": "divorced", "education": "middle", "social_class": "working class"}, "question": {"id": "Q175", "variant": 0}, "response": ["Based on the anthropological framework, as a divorced female from Alexandria, Egypt, my emic perspective on the purpose of religion is heavily influenced by my cultural context and individual values. Religion plays a significant role in the daily lives of people in my community, providing a framework for understanding and navigating the challenges of life. My personal experience and socioeconomic background as a working-class woman also shape my belief that religion serves the purpose of making sense of life in this world, providing guidance, comfort, and a sense of community in the face of hardships. Therefore, my choice is:\n\n2) To make sense of life in this world"]}, {"persona": {"region": "Alexandria", "sex": "male", "age": 48, "country": "Egypt", "marital_status": "married", "education": "higher", "social_class": "working class"}, "question": {"id": "Q175", "variant": 0}, "response": ["Based on the anthropological framework, as a married male from Alexandria, Egypt, my emic perspective would be heavily influenced by my cultural context, individual values, and personal experience. Religion plays a significant role in Egyptian society, shaping our understanding of life, death, and the afterlife. As a member of the working class, I have seen how religion provides a sense of community, comfort, and moral guidance in our daily lives. Additionally, my higher education level has allowed me to critically analyze the nuances of religion and its impact on our society. Therefore, from my perspective, I would choose option 2: To make sense of life in this world.\n\n2"]}, {"persona": {"region": "Alexandria", "sex": "female", "age": 30, "country": "Egypt", "marital_status": "married", "education": "middle", "social_class": "working class"}, "question": {"id": "Q175", "variant": 0}, "response": ["Based on the anthropological framework, my perspective as a married female from Alexandria, Egypt, who is 30 years old and part of the working class, is heavily influenced by my cultural context, individual values, and personal experience. In Egypt, religion plays a significant role in everyday life and is deeply ingrained in our cultural traditions. As a member of the working class, religion provides me with a sense of community and connection to others, as well as a source of comfort and guidance in facing life's challenges. I also believe that religion serves the purpose of making sense of life in this world, as it provides moral and ethical guidelines for how to live a fulfilling and righteous life. Therefore, from my perspective, the purpose of religion is to make sense of life in this world.\n\n2"]}, {"persona": {"region": "Alexandria", "sex": "male", "age": 19, "country": "Egypt", "marital_status": "single", "education": "middle", "social_class": "lower class"}, "question": {"id": "Q175", "variant": 0}, "response": ["Based on the anthropological framework, my perspective as a 19-year-old male from Alexandria, Egypt, who has completed middle education and considers myself part of the lower class, is heavily influenced by my cultural context, individual values, and socioeconomic background. In Egypt, religion plays a crucial role in shaping our understanding of life and providing a framework for navigating the challenges we face. The purpose of religion, from my perspective, is to make sense of life in this world. It provides guidance, a sense of community, and a moral compass for navigating the complexities of our daily lives.\n\n2"]}, {"persona": {"region": "Alexandria", "sex": "male", "age": 45, "country": "Egypt", "marital_status": "married", "education": "middle", "social_class": "lower middle class"}, "question": {"id": "Q175", "variant": 0}, "response": ["Based on my cultural context, as a married male from Alexandria, Egypt, religion plays a crucial role in making sense of life in this world. Our society is deeply rooted in Islamic beliefs and practices, which shape our daily lives, values, and social norms. Additionally, my lower middle-class socioeconomic background has influenced my understanding of religion as providing guidance and purpose in navigating the challenges and opportunities of this life. Furthermore, my personal experience and values have been shaped by the teachings of Islam, emphasizing the importance of faith and moral conduct in our interactions with others and the world around us. Therefore, from my emic perspective, the purpose of religion is to make sense of life in this world.\n\n2"]}, {"persona": {"region": "Alexandria", "sex": "male", "age": 23, "country": "Egypt", "marital_status": "single", "education": "higher", "social_class": "lower class"}, "question": {"id": "Q175", "variant": 0}, "response": ["Based on the anthropological framework, my emic perspective as a single male from Alexandria, Egypt, is heavily influenced by my cultural context, individual values, and socioeconomic background. In my community, religion is a central aspect of everyday life and plays a vital role in shaping our understanding of the world. As someone from the lower class, religion provides a source of comfort and guidance, helping me make sense of the struggles and challenges I face. Additionally, my personal experiences and values have been shaped by the teachings and beliefs of my faith, leading me to prioritize the importance of religion in providing meaning and purpose in this world.\n\n2"]}, {"persona": {"region": "Alexandria", "sex": "female", "age": 28, "country": "Egypt", "marital_status": "married", "education": "middle", "social_class": "working class"}, "question": {"id": "Q175", "variant": 0}, "response": ["Based on the anthropological framework, my perspective as a married female from Alexandria, Egypt, with a middle education level and working-class background, is influenced by my cultural context, individual values, and personal experience. In Egyptian society, religion plays a crucial role in daily life, providing a framework for understanding the world and guiding moral behavior. As a member of the working class, religion also provides a sense of community and support in times of hardship. Additionally, the cultural context of Egypt emphasizes the importance of religion in shaping individual and collective identity. Therefore, from this perspective, I would choose option 2: To make sense of life in this world.\n\n2"]}, {"persona": {"region": "Alexandria", "sex": "male", "age": 34, "country": "Egypt", "marital_status": "single", "education": "higher", "social_class": "working class"}, "question": {"id": "Q175", "variant": 0}, "response": ["Based on the anthropological framework, as a single male from Alexandria, Egypt, my emic perspective on the purpose of religion is heavily influenced by the cultural context in which I live. Religion plays a significant role in shaping the values and beliefs of the community, and it provides a framework for understanding the world around me. Additionally, my individual values and personal experience have led me to see religion as a means of finding purpose and guidance in my daily life. Considering my working-class background, religion also serves as a source of comfort and solidarity within my community. Furthermore, cultural relativism reminds me that my perception of religion's purpose may differ from others due to differences in space and time, emphasizing the importance of nuance in understanding this complex topic.\n\n2"]}, {"persona": {"region": "Alexandria", "sex": "male", "age": 30, "country": "Egypt", "marital_status": "married", "education": "higher", "social_class": "lower middle class"}, "question": {"id": "Q175", "variant": 0}, "response": ["In my cultural context, religion is a fundamental aspect of our daily lives. It shapes our values, beliefs, and behaviors, providing a framework for understanding the world around us. As a married male from Alexandria, Egypt, I have been raised in a society where religion plays a significant role in shaping our moral compass and guiding our actions. My individual values and personal experiences have also been influenced by the teachings of religion, as it has provided me with a sense of community, purpose, and direction. Additionally, my lower middle-class socioeconomic background has further emphasized the importance of religion in providing a sense of hope and stability in the face of economic challenges. Therefore, from my perspective, the purpose of religion is to make sense of life in this world.\n\n2"]}, {"persona": {"region": "Alexandria", "sex": "female", "age": 49, "country": "Egypt", "marital_status": "married", "education": "higher", "social_class": "lower middle class"}, "question": {"id": "Q175", "variant": 0}, "response": ["As a married woman from Alexandria, Egypt, my understanding of the purpose of religion is deeply influenced by my cultural context, individual values, and personal experience. In Egypt, religion plays a significant role in shaping our daily lives and providing a framework for understanding the world around us. From an emic perspective, religion helps to make sense of life in this world by providing moral guidance, community support, and a sense of purpose. Additionally, my socioeconomic background as part of the lower middle class has also influenced my understanding of religion, as it has provided me with a source of comfort and hope in the face of economic challenges. Therefore, I believe that the purpose of religion is to make sense of life in this world.\n\n2"]}, {"persona": {"region": "Kafr el-sheikh", "sex": "male", "age": 49, "country": "Egypt", "marital_status": "married", "education": "higher", "social_class": "working class"}, "question": {"id": "Q175", "variant": 0}, "response": ["From the perspective of a married male from Kafr el-sheikh, Egypt, who is 49 years old, completed higher education, and considers himself part of the working class, the answer to the question of the purpose of religion would be influenced by his cultural context, individual values, and socioeconomic background. In his cultural context, religion plays a significant role in shaping social norms, values, and traditions. As a member of the working class, he may see religion as a source of comfort and community support in times of economic hardship. Additionally, his personal experience and values may lead him to believe that the purpose of religion is to make sense of life in this world, as it provides guidance, moral principles, and a sense of purpose in daily life.\n\n2"]}, {"persona": {"region": "Kafr el-sheikh", "sex": "male", "age": 25, "country": "Egypt", "marital_status": "single", "education": "middle", "social_class": "lower middle class"}, "question": {"id": "Q175", "variant": 0}, "response": ["Based on the anthropological framework, my perspective on the purpose of religion is heavily influenced by my cultural context, individual values, and socioeconomic background. Growing up in Kafr el-sheikh, Egypt, religion has always been a central part of my life and community. My personal experience and values have taught me that religion serves to provide guidance and meaning in this world, helping individuals navigate their daily lives and make sense of the challenges they face. Additionally, my lower middle class background has led me to view religion as a source of comfort and support in times of hardship, rather than solely a means to understand life after death.\n\n2"]}, {"persona": {"region": "Kafr el-sheikh", "sex": "male", "age": 59, "country": "Egypt", "marital_status": "married", "education": "higher", "social_class": "lower middle class"}, "question": {"id": "Q175", "variant": 0}, "response": ["Based on the anthropological framework, my emic perspective as a married male from Kafr el-sheikh, Egypt, who is 59 years old, completed higher education, and considers myself part of the lower middle class, is heavily influenced by my cultural context, individual values, socioeconomic background, and space and time. In our community, religion serves the purpose of making sense of life in this world. It provides guidance, moral values, and a sense of community that is essential for navigating the challenges of daily life. Additionally, my personal experience and values have shaped my understanding that religion is a source of comfort and stability in our socioeconomic class. It is a way to find meaning and purpose in our lives despite the struggles we face. Therefore, I choose option (2) To make sense of life in this world."]}, {"persona": {"region": "Kafr el-sheikh", "sex": "female", "age": 38, "country": "Egypt", "marital_status": "married", "education": "middle", "social_class": "working class"}, "question": {"id": "Q175", "variant": 0}, "response": ["Based on the anthropological framework, as a married female from Kafr el-sheikh, Egypt, my emic perspective is influenced by my cultural context, individual values, and socioeconomic background. In my community, religion plays a vital role in shaping our understanding of life and providing meaning to our existence. As part of the working class, religion serves as a source of comfort and guidance in difficult times, providing a sense of community and support. Additionally, my personal experience and middle education level have taught me that religion is not just about life after death, but also about making sense of life in this world, providing moral guidance and ethical principles to live by.\n\n2"]}, {"persona": {"region": "Kafr el-sheikh", "sex": "male", "age": 35, "country": "Egypt", "marital_status": "married", "education": "higher", "social_class": "lower middle class"}, "question": {"id": "Q175", "variant": 0}, "response": ["Based on the anthropological framework, I, as a married male from Kafr el-sheikh, Egypt, would approach the question of the purpose of religion from the perspective of cultural context, individual values, and socioeconomic background. In my cultural context, religion plays a significant role in shaping the moral and ethical values of the community, providing a sense of identity and belonging. Additionally, as a member of the lower middle class, religion serves as a source of hope and comfort in the face of economic challenges and social inequalities. Considering individual values and personal experiences, I would argue that the purpose of religion is to make sense of life in this world, providing guidance, support, and a sense of purpose within the context of everyday struggles and aspirations.\n\n2"]}, {"persona": {"region": "Kafr el-sheikh", "sex": "male", "age": 49, "country": "Egypt", "marital_status": "married", "education": "middle", "social_class": "lower class"}, "question": {"id": "Q175", "variant": 0}, "response": ["Based on my cultural context and personal experience, as a married male from Kafr el-sheikh, Egypt, religion serves the purpose of making sense of life in this world. In my community, religion plays a significant role in guiding our everyday lives, providing moral values, and offering a sense of purpose and direction. Additionally, given my lower socioeconomic background, religion also serves as a source of hope and comfort in the face of life's challenges, providing a sense of community and support. Therefore, from my perspective, the purpose of religion is to make sense of life in this world.\n\n2"]}, {"persona": {"region": "Kafr el-sheikh", "sex": "male", "age": 37, "country": "Egypt", "marital_status": "married", "education": "middle", "social_class": "lower class"}, "question": {"id": "Q175", "variant": 0}, "response": ["Based on my personal experience and cultural context as a married male from Kafr el-sheikh, Egypt, I understand that religion serves the purpose of making sense of life in this world. In my community, religion provides guidance and principles for how to live a good and moral life, as well as a sense of community and belonging. Additionally, as part of the lower class, religion also offers hope and comfort in difficult times, and provides a support network for those in need. Therefore, from my perspective, the purpose of religion is to make sense of life in this world.\n\n2"]}, {"persona": {"region": "Menofia", "sex": "female", "age": 22, "country": "Egypt", "marital_status": "single", "education": "middle", "social_class": "lower class"}, "question": {"id": "Q175", "variant": 0}, "response": ["In my cultural context, religion plays a crucial role in making sense of life in this world. As a single female from Menofia, Egypt, I have been raised in a society where religion is deeply intertwined with everyday life and provides guidance on moral values, social norms, and personal conduct. As part of the lower class, religion also provides a sense of hope and comfort in the face of economic challenges and social inequalities. Additionally, my personal experience and values have shaped my understanding of religion as a source of community support and spiritual fulfillment. Therefore, from my emic perspective, the purpose of religion is to make sense of life in this world.\n\n2"]}, {"persona": {"region": "Menofia", "sex": "female", "age": 25, "country": "Egypt", "marital_status": "married", "education": "middle", "social_class": "lower class"}, "question": {"id": "Q175", "variant": 0}, "response": ["From the perspective of a married female from Menofia, Egypt, who is 25 years old, completed middle education, and considers herself part of the lower class, the answer to the question of the purpose of religion would be influenced by cultural context, individual values, and personal experience. In Menofia, religion plays a central role in daily life, providing a sense of community, guidance, and moral values. As a member of the lower class, religion may also serve as a source of hope and resilience in the face of economic hardships. Additionally, the emphasis on the afterlife and the concept of reward and punishment in religious teachings may provide comfort and meaning in the face of life's difficulties. Therefore, the purpose of religion in this context would be to make sense of life in this world.\n\n2"]}, {"persona": {"region": "Menofia", "sex": "male", "age": 28, "country": "Egypt", "marital_status": "single", "education": "higher", "social_class": "working class"}, "question": {"id": "Q175", "variant": 0}, "response": ["Based on my personal experience and cultural context as a single male from Menofia, Egypt, religion serves the purpose of making sense of life in this world. In Egypt, religion plays a significant role in guiding our daily lives, from our moral beliefs to our societal norms. Additionally, as a member of the working class, religion provides a sense of community and support, helping us navigate the challenges we face in our daily lives. It also serves as a source of guidance and hope, especially in times of struggle and uncertainty. Therefore, from my perspective, the purpose of religion is to make sense of life in this world.\n\n2"]}, {"persona": {"region": "Menofia", "sex": "male", "age": 35, "country": "Egypt", "marital_status": "married", "education": "middle", "social_class": "lower middle class"}, "question": {"id": "Q175", "variant": 0}, "response": ["In Menofia, Egypt, cultural context is paramount in understanding the purpose of religion. The region is predominantly Muslim, and religion plays a significant role in shaping the daily lives, values, and beliefs of individuals. As a member of the lower middle class, socioeconomic background also influences my understanding of religion. Religion provides a sense of community, moral guidance, and social support. It helps make sense of life in this world by providing a framework for understanding and navigating societal norms, relationships, and personal struggles. Additionally, individual values and personal experiences contribute to the purpose of religion, as it provides a source of comfort, hope, and purpose in the face of economic challenges and social inequalities. (2) To make sense of life in this world"]}, {"persona": {"region": "Menofia", "sex": "male", "age": 55, "country": "Egypt", "marital_status": "married", "education": "middle", "social_class": "working class"}, "question": {"id": "Q175", "variant": 0}, "response": ["From an emic perspective, as a married male from Menofia, Egypt, religion serves the purpose of bringing a sense of community and belonging, providing a moral compass, and offering guidance in navigating life's challenges. In the cultural context of Menofia, religion is deeply embedded in daily life, shaping social norms and practices. My individual values and personal experiences also shape my understanding of religion, as it provides a framework for understanding the world and my place within it. Additionally, my socioeconomic background as part of the working class influences my view of religion as a source of hope and comfort in the face of economic struggles. Cultural relativism is important in understanding that for many in Menofia, religion is not just about making sense of life after death, but also about making sense of life in this world.\n\n2"]}, {"persona": {"region": "Menofia", "sex": "male", "age": 53, "country": "Egypt", "marital_status": "married", "education": "higher", "social_class": "lower middle class"}, "question": {"id": "Q175", "variant": 0}, "response": ["Based on the anthropological framework, my understanding of the purpose of religion is heavily influenced by my cultural context, individual values, and personal experience. In Menofia, Egypt, religion plays a central role in people's lives, providing a framework for understanding and making sense of the world around us. As a 53-year-old man who has completed higher education, I have been exposed to different religious teachings and have come to believe that the purpose of religion is to make sense of life in this world. Religion provides guidance on how to live a moral and ethical life, offers a sense of community and belonging, and helps individuals navigate the complexities of everyday life. Furthermore, my lower middle-class socioeconomic background has shaped my understanding of religion as a source of comfort and hope in the face of life's challenges.\n\n2"]}, {"persona": {"region": "Menofia", "sex": "male", "age": 59, "country": "Egypt", "marital_status": "married", "education": "middle", "social_class": "working class"}, "question": {"id": "Q175", "variant": 0}, "response": ["Based on the anthropological framework, my response to the question of the purpose of religion is heavily influenced by my cultural context as a married male from Menofia, Egypt. In my community, religion plays a vital role in guiding individuals on how to navigate this life and to make sense of the world around them. It also provides a framework for understanding societal norms and values, as well as offering guidance on how to live a moral and ethical life. Additionally, my age and socioeconomic background as a working-class individual have shaped my perspective on the role of religion in providing comfort and hope in the face of life's challenges. Therefore, my answer is:\n\n2) To make sense of life in this world"]}, {"persona": {"region": "Menofia", "sex": "female", "age": 42, "country": "Egypt", "marital_status": "married", "education": "middle", "social_class": "lower middle class"}, "question": {"id": "Q175", "variant": 0}, "response": ["From the perspective of a married female from Menofia, Egypt, who is 42 years old and part of the lower middle class, the purpose of religion is deeply influenced by cultural context, individual values, and personal experience. In this region, religion is an integral part of daily life and provides a framework for understanding and navigating the challenges and joys of existence. As a woman in this cultural context, religion also plays a significant role in shaping societal expectations and roles. Furthermore, socioeconomic background and access to education may influence the emphasis placed on the afterlife versus the present life within the religious framework. Therefore, from this perspective, the purpose of religion is to make sense of life in this world, as it provides guidance, support, and a sense of belonging within the community.\n\n2"]}, {"persona": {"region": "Menofia", "sex": "male", "age": 39, "country": "Egypt", "marital_status": "married", "education": "higher", "social_class": "working class"}, "question": {"id": "Q175", "variant": 0}, "response": ["Based on the anthropological framework, as a married male from Menofia, Egypt, my understanding and answer to the question of the purpose of religion is deeply rooted in my cultural context and personal experience. In Egypt, religion is a central aspect of daily life and plays a significant role in shaping societal norms and values. As a member of the working class in Menofia, I have witnessed how religion provides a moral and ethical framework for our community, guiding our behaviors and interactions with others. Additionally, my higher education level has allowed me to understand the historical and social significance of religion in our society. Therefore, from this perspective, I believe the purpose of religion is to make sense of life in this world.\n\n2"]}, {"persona": {"region": "Menofia", "sex": "male", "age": 34, "country": "Egypt", "marital_status": "married", "education": "middle", "social_class": "lower middle class"}, "question": {"id": "Q175", "variant": 0}, "response": ["From an emic perspective, as a married male from Menofia, Egypt, religion plays a crucial role in my understanding of life and the world around me. The cultural context of Egypt, with its rich history and deep religious traditions, has shaped my perspective on the purpose of religion. My personal experience and individual values have led me to believe that religion serves the purpose of making sense of life in this world, providing guidance and meaning to my daily existence. Additionally, my socioeconomic background as part of the lower middle class has influenced my understanding of religion as a source of hope and support in navigating the challenges of my everyday life. Furthermore, the nuanced phrasing of the question and the space and time in which I exist have led me to choose the purpose of religion as making sense of life in this world.\n\n2"]}, {"persona": {"region": "Menofia", "sex": "male", "age": 22, "country": "Egypt", "marital_status": "single", "education": "higher", "social_class": "working class"}, "question": {"id": "Q175", "variant": 0}, "response": ["Based on the anthropological framework, my perspective as a single male from Menofia, Egypt, who is 22 years old and part of the working class, is heavily influenced by my cultural context, individual values, and personal experience. In Egypt, religion plays a significant role in society, and it is closely intertwined with everyday life. My upbringing and education have taught me that religion serves the purpose of making sense of life in this world, as it provides moral guidance, community support, and a framework for understanding the complexities of human existence. Additionally, my socioeconomic background as part of the working class has shaped my belief that religion is a source of hope and resilience in the face of economic challenges and social inequalities. Therefore, I choose option 2: To make sense of life in this world. \n\n2"]}, {"persona": {"region": "Menofia", "sex": "male", "age": 21, "country": "Egypt", "marital_status": "single", "education": "middle", "social_class": "working class"}, "question": {"id": "Q175", "variant": 0}, "response": ["Based on my personal experience and cultural context as a working-class individual from Menofia, Egypt, I understand the purpose of religion as a means to make sense of life in this world. In my community, religion plays a significant role in providing guidance, moral values, and a sense of community. It also helps us cope with the challenges and hardships we face in our daily lives. Additionally, religion serves as a source of hope and comfort, especially in times of struggle and uncertainty.\n\n2"]}, {"persona": {"region": "Menofia", "sex": "male", "age": 36, "country": "Egypt", "marital_status": "married", "education": "higher", "social_class": "working class"}, "question": {"id": "Q175", "variant": 0}, "response": ["Based on my anthropological understanding, I must consider the emic perspective of my persona as a married male from Menofia, Egypt. In this cultural context, religion plays a central role in daily life and it is often intertwined with personal values and experiences. Additionally, the socioeconomic background and cultural relativism of my persona also factor into the way religion is perceived and understood. As a working-class individual with higher education, I recognize the importance of religion in providing a sense of purpose and guidance in this world. Therefore, I choose option (2) to make sense of life in this world.\n\n2"]}, {"persona": {"region": "Menofia", "sex": "female", "age": 52, "country": "Egypt", "marital_status": "married", "education": "higher", "social_class": "lower middle class"}, "question": {"id": "Q175", "variant": 0}, "response": ["Based on the anthropological framework, as a married female from Menofia, Egypt, my emic perspective is heavily influenced by my cultural context, individual values, and personal experience. Religion plays a significant role in shaping my understanding of life and death, and it serves as a means for me to make sense of the world around me. Additionally, my socioeconomic background as part of the lower middle class influences my beliefs and values, as it impacts the way I view the purpose of religion in my life. Therefore, I choose option (2) To make sense of life in this world."]}, {"persona": {"region": "Menofia", "sex": "male", "age": 52, "country": "Egypt", "marital_status": "married", "education": "higher", "social_class": "lower middle class"}, "question": {"id": "Q175", "variant": 0}, "response": ["Based on my personal experience and cultural context, as a married male from Menofia, Egypt, religion serves the purpose of making sense of life in this world. In my community, religion is deeply ingrained in our daily lives and is a source of guidance, moral values, and a sense of community. It provides a framework for understanding the world around us, offering guidance on how to live a good and fulfilling life. Additionally, religion plays a role in shaping our traditions, rituals, and social interactions, all of which contribute to our understanding of life in this world.\n\n2"]}, {"persona": {"region": "Menofia", "sex": "male", "age": 39, "country": "Egypt", "marital_status": "married", "education": "middle", "social_class": "lower class"}, "question": {"id": "Q175", "variant": 0}, "response": ["Based on my cultural context, as a married male from Menofia, Egypt, religion plays a significant role in our daily lives. It is not just about making sense of life after death, but also about making sense of life in this world. Our cultural background and socioeconomic status have shaped our understanding of religion as a means of finding purpose and guidance in our everyday struggles. Additionally, our personal experiences and values have influenced our perception of religion as a source of comfort and hope amidst our hardships. Therefore, the purpose of religion for us is not limited to the afterlife, but it also serves as a guide for navigating the challenges of this world.\n\n2"]}, {"persona": {"region": "Menofia", "sex": "male", "age": 23, "country": "Egypt", "marital_status": "single", "education": "middle", "social_class": "lower middle class"}, "question": {"id": "Q175", "variant": 0}, "response": ["Based on the anthropological framework, my perspective as a single male from Menofia, Egypt, who is 23 years old and part of the lower middle class, is shaped by my cultural context, individual values and personal experience, and socioeconomic background. In my community, religion plays a significant role in providing guidance and meaning in this life. My personal experience and the values instilled in me by my family and community emphasize the importance of religion in shaping ethical behavior and providing a sense of purpose in the present world. Therefore, my answer to the question of the purpose of religion is:\n\n2) To make sense of life in this world"]}, {"persona": {"region": "Dakahlia", "sex": "female", "age": 24, "country": "Egypt", "marital_status": "single", "education": "higher", "social_class": "lower middle class"}, "question": {"id": "Q175", "variant": 0}, "response": ["Based on the anthropological framework, as a single female from Dakahlia, Egypt, with a lower middle-class socioeconomic background, my perspective on the purpose of religion is deeply influenced by my cultural context and personal experience. In my community, religion serves as a way to make sense of life in this world. It provides a moral and ethical framework for navigating everyday challenges and offers a sense of community and belonging. Additionally, my individual values and personal experience contribute to my belief that religion is primarily about finding meaning and guidance in the present life, rather than focusing solely on the afterlife.\n\n2"]}, {"persona": {"region": "Dakahlia", "sex": "male", "age": 36, "country": "Egypt", "marital_status": "married", "education": "higher", "social_class": "upper middle class"}, "question": {"id": "Q175", "variant": 0}, "response": ["From the perspective of a married male from Dakahlia, Egypt, who is 36 years old, completed higher education, and considers himself part of the upper middle class, the purpose of religion is influenced by a combination of emic and etic perspectives, cultural context, individual values and personal experience, socioeconomic background, cultural relativism, space and time, and nuance. In this cultural context, religion serves to make sense of life in this world, as it provides a framework for understanding and navigating the complexities of daily life, moral guidance, and community cohesion. It also plays a role in shaping social and familial relationships, and can act as a source of comfort and support in times of difficulty. Additionally, the individual's socioeconomic background may influence their access to religious institutions and practices, while their personal experiences and values may shape their understanding of the role of religion in their lives.\n\n2"]}, {"persona": {"region": "Dakahlia", "sex": "female", "age": 71, "country": "Egypt", "marital_status": "married", "education": "higher", "social_class": "upper middle class"}, "question": {"id": "Q175", "variant": 0}, "response": ["In considering the purpose of religion from the perspective of a married female from Dakahlia, Egypt, who is 71 years old, has completed higher education, and considers herself part of the upper middle class, it is important to take into account the cultural context and individual values. In Egyptian society, religion plays a central role in shaping social norms and providing a sense of community. As a member of the upper middle class, the individual may view religion as a source of moral guidance and a way to maintain social order and cohesion. Additionally, with a higher level of education, the individual may also see religion as a means of making sense of life in this world, providing ethical frameworks and guiding personal conduct. Therefore, the purpose of religion from this perspective may be to make sense of life in this world, serving as a moral compass and providing a sense of community and belonging.\n\n2"]}, {"persona": {"region": "Dakahlia", "sex": "male", "age": 55, "country": "Egypt", "marital_status": "married", "education": "higher", "social_class": "upper middle class"}, "question": {"id": "Q175", "variant": 0}, "response": ["Based on the anthropological framework, as a married male from Dakahlia, Egypt who is 55 years old and part of the upper middle class, my answer to the question of the purpose of religion would be option 2. This answer is influenced by the cultural context of Egypt, where religion plays a significant role in shaping daily life and societal norms. The socio-economic background also plays a role, as being part of the upper middle class may lead to a more pragmatic understanding of the purpose of religion in this world rather than solely focusing on the afterlife. Additionally, individual values and personal experience also play a part, as my higher education level may lead to a more rational and practical approach to understanding the purpose of religion. Cultural relativism also plays a role, as in Egyptian society, religion is intertwined with all aspects of life, including social, political, and economic spheres. Therefore, the purpose of religion is to make sense of life in this world. \n\n2"]}, {"persona": {"region": "Dakahlia", "sex": "male", "age": 64, "country": "Egypt", "marital_status": "married", "education": "higher", "social_class": "lower middle class"}, "question": {"id": "Q175", "variant": 0}, "response": ["Based on the anthropological framework, as a married male from Dakahlia, Egypt, my perspective on the purpose of religion is deeply influenced by my cultural context and personal experience. In Egypt, religion plays a significant role in shaping individuals' daily lives and providing a framework for understanding the world around them. Additionally, my age and educational background have instilled in me a belief in the importance of religion for making sense of life in this world, as it provides guidance, moral values, and a sense of community. Therefore, I choose option 2: To make sense of life in this world."]}, {"persona": {"region": "Dakahlia", "sex": "female", "age": 29, "country": "Egypt", "marital_status": "married", "education": "middle", "social_class": "lower class"}, "question": {"id": "Q175", "variant": 0}, "response": ["Based on the anthropological framework, my perspective on the purpose of religion is heavily influenced by my cultural context. In Dakahlia, Egypt, religion plays a significant role in daily life and is deeply intertwined with societal norms and values. As a lower-class woman with limited education, my understanding of religion is shaped by my personal experiences and individual values. Additionally, my socioeconomic background also influences my perspective, as religion often provides a sense of community and support for those in lower-class positions. Therefore, my answer to the question would be:\n2\n\n(2) To make sense of life in this world"]}, {"persona": {"region": "Dakahlia", "sex": "female", "age": 40, "country": "Egypt", "marital_status": "married", "education": "middle", "social_class": "upper middle class"}, "question": {"id": "Q175", "variant": 0}, "response": ["Based on the anthropological framework, as a married female from Dakahlia, Egypt, cultural context is pivotal in understanding and answering questions. Religion plays a significant role in the daily lives of people in Egypt, and as a member of the upper middle class, my socioeconomic background also influences my perspective. The purpose of religion is to make sense of life in this world, as it provides guidance, moral values, and a sense of community. Additionally, personal experience and individual values also play a role in shaping this perspective. \n\n2"]}, {"persona": {"region": "Dakahlia", "sex": "male", "age": 37, "country": "Egypt", "marital_status": "married", "education": "higher", "social_class": "lower middle class"}, "question": {"id": "Q175", "variant": 0}, "response": ["From the perspective of a married male from Dakahlia, Egypt, who is 37 years old and part of the lower middle class, the purpose of religion is seen through the emic perspective of making sense of life in this world. In this cultural context, religion plays a significant role in providing guidance, moral values, and a sense of community. Personal experiences and individual values also play a crucial role in shaping this understanding, as religion is often intertwined with daily life, social interactions, and personal beliefs. Additionally, the socioeconomic background of being part of the lower middle class may influence the belief that religion serves a purpose in providing comfort and hope in the face of economic struggles and societal challenges.\n\n2"]}, {"persona": {"region": "Dakahlia", "sex": "female", "age": 45, "country": "Egypt", "marital_status": "married", "education": "middle", "social_class": "working class"}, "question": {"id": "Q175", "variant": 0}, "response": ["In answering the question of the purpose of religion from the perspective of a married female from Dakahlia, Egypt, it is important to consider the cultural context and individual values. In this region, religion plays a crucial role in daily life, providing a framework for understanding and navigating the challenges and joys of existence. Additionally, the socioeconomic background of being part of the working class may influence the belief in the importance of religion for finding purpose and meaning in life. Furthermore, the cultural relativism perspective reminds us that in this context, religion is deeply intertwined with community and family values. Therefore, the purpose of religion is likely to be perceived as both to make sense of life after death and to make sense of life in this world.\n\n2"]}, {"persona": {"region": "Dakahlia", "sex": "male", "age": 34, "country": "Egypt", "marital_status": "single", "education": "middle", "social_class": "lower middle class"}, "question": {"id": "Q175", "variant": 0}, "response": ["Based on the anthropological framework, as a single male from Dakahlia, Egypt, my emic perspective on the purpose of religion is heavily influenced by my cultural context. In my community, religion plays a significant role in guiding moral behavior, providing a sense of community and identity, and offering solace in times of hardship. My personal experience and individual values also shape my understanding of religion, as I have found comfort and guidance in my religious beliefs. Additionally, my socioeconomic background as part of the lower middle class has influenced my reliance on religion for support and guidance. Considering the nuance of the question, I would choose option (2) To make sense of life in this world, as my understanding of religion is closely tied to its role in providing meaning and guidance in my daily life.\n\n2"]}, {"persona": {"region": "Dakahlia", "sex": "female", "age": 26, "country": "Egypt", "marital_status": "married", "education": "higher", "social_class": "upper middle class"}, "question": {"id": "Q175", "variant": 0}, "response": ["From the perspective of a married female from Dakahlia, Egypt, who is 26 years old, completed higher education and considers herself part of the upper middle class, it is important to consider the emic and etic perspectives in understanding the purpose of religion. In the cultural context of Dakahlia, religion plays a crucial role in shaping societal norms, values, and practices. Individual values and personal experience also play a significant role in shaping one's understanding of religion, as it provides a sense of community, moral guidance, and a framework for social interactions. Additionally, the socioeconomic background of being part of the upper middle class may influence the perception of religion as a means of maintaining social status and connections within the community. Therefore, from this perspective, the purpose of religion is to make sense of life in this world, as it provides guidance, support, and a moral compass for navigating societal expectations and personal experiences.\n\n2"]}, {"persona": {"region": "Dakahlia", "sex": "male", "age": 21, "country": "Egypt", "marital_status": "single", "education": "middle", "social_class": "upper middle class"}, "question": {"id": "Q175", "variant": 0}, "response": ["Based on the anthropological framework, my answer to the question of the purpose of religion is influenced by my cultural context as a single male from Dakahlia, Egypt. Religion plays a significant role in our society, providing a framework for understanding the world around us and our place within it. It helps us make sense of life in this world, guiding our moral and ethical decisions, and providing a sense of community and belonging. Additionally, my personal experience and individual values shape my understanding of religion, as it provides comfort, guidance, and a sense of purpose in my life. Furthermore, my socioeconomic background as part of the upper middle class has influenced my access to religious education and participation in religious activities, further shaping my perspective on the purpose of religion.\n\n2"]}, {"persona": {"region": "Dakahlia", "sex": "female", "age": 32, "country": "Egypt", "marital_status": "married", "education": "middle", "social_class": "working class"}, "question": {"id": "Q175", "variant": 0}, "response": ["Based on the anthropological framework, as a married female from Dakahlia, Egypt, my emic perspective would be influenced by the cultural context of my community, where religion plays a central role in daily life. My personal experience and individual values are shaped by the religious beliefs and practices that are prevalent in my community. Additionally, my socioeconomic background as part of the working class would also influence my understanding of the purpose of religion. Considering cultural relativism, I would recognize that the purpose of religion is multifaceted and not tied to a single universal truth. Therefore, from this perspective, I would choose option (2) To make sense of life in this world. \n\n2"]}, {"persona": {"region": "Dakahlia", "sex": "female", "age": 35, "country": "Egypt", "marital_status": "married", "education": "middle", "social_class": "upper middle class"}, "question": {"id": "Q175", "variant": 0}, "response": ["From an emic perspective, as a married female from Dakahlia, Egypt, religion plays a significant role in shaping my understanding of the purpose of life. In my cultural context, religion is intertwined with every aspect of life, providing guidance on moral behavior, community cohesion, and personal fulfillment. My individual values and personal experiences have been shaped by the teachings of Islam, which emphasize the importance of faith, family, and community. Additionally, my socioeconomic background as part of the upper middle class has afforded me the opportunity to access religious education and participate in religious rituals, further reinforcing the significance of religion in my life. Cultural relativism also plays a role in my understanding, as my perspective on the purpose of religion is influenced by the teachings and traditions of Islam in Dakahlia. Furthermore, age and place have shaped my understanding of religion, as I have observed the role of religion in shaping the lives of my family and community members. Based on these factors, I believe that the purpose of religion is to make sense of life in this world.\n\n2"]}, {"persona": {"region": "Dakahlia", "sex": "male", "age": 33, "country": "Egypt", "marital_status": "married", "education": "middle", "social_class": "upper middle class"}, "question": {"id": "Q175", "variant": 0}, "response": ["Based on the anthropological framework, I, as a married male from Dakahlia, Egypt, would approach the question of the purpose of religion from a cultural context perspective. In my community, religion plays a crucial role in shaping our values, beliefs, and daily practices. It provides a framework for understanding the world around us and guides our moral compass. Additionally, my personal experience and individual values have been shaped by the teachings of my religion, which emphasize the importance of family, community, and ethical behavior. Considering the socioeconomic background of the upper middle class, religion also acts as a unifying force and provides a sense of belonging and identity. Taking into account the nuance of the question, I would choose option (2) To make sense of life in this world, as it aligns with my understanding of the role of religion in my life and community.\n\n2"]}, {"persona": {"region": "Dakahlia", "sex": "female", "age": 45, "country": "Egypt", "marital_status": "married", "education": "middle", "social_class": "upper middle class"}, "question": {"id": "Q175", "variant": 0}, "response": ["Based on the anthropological framework, as a married female from Dakahlia, Egypt, with a middle education level and upper middle-class status, my perspective on the purpose of religion is influenced by my cultural context, individual values, and personal experience. In my community, religion plays a significant role in guiding moral values, social interactions, and daily life. It provides a framework for understanding the world and offers guidance on ethical behavior. Additionally, my socioeconomic background may lead me to prioritize the practical aspects of religion, such as seeking guidance for success and prosperity in this world. Therefore, from my perspective, the purpose of religion is to make sense of life in this world.\n\n2"]}, {"persona": {"region": "Dakahlia", "sex": "male", "age": 30, "country": "Egypt", "marital_status": "married", "education": "middle", "social_class": "upper middle class"}, "question": {"id": "Q175", "variant": 0}, "response": ["Based on the anthropological framework, as a married male from Dakahlia, Egypt, my emic perspective would be influenced by the cultural context of my community, which highly values religion as a way to make sense of life in this world. This is further influenced by my individual values and personal experience, as religion plays a significant role in shaping my worldview and guiding my daily life. Additionally, considering my socioeconomic background as an upper middle class individual, religion serves as a source of guidance and moral compass in navigating the complexities of this world. Therefore, my chosen answer is:\n\n2) To make sense of life in this world"]}, {"persona": {"region": "Dakahlia", "sex": "female", "age": 63, "country": "Egypt", "marital_status": "married", "education": "higher", "social_class": "lower middle class"}, "question": {"id": "Q175", "variant": 0}, "response": ["Based on my cultural context as a married female from Dakahlia, Egypt, and my individual values and personal experience, I believe that the purpose of religion is to make sense of life in this world. In my community, religion plays a significant role in guiding our daily lives, providing a moral framework, and offering comfort in times of hardship. As someone who has completed higher education and considers myself part of the lower middle class, I have seen how religion influences our societal values and norms, and how it provides a sense of community and belonging. Additionally, my age and place in society have shaped my understanding of the role of religion, as I have witnessed its impact on different generations and in various social settings. Therefore, from my perspective, the purpose of religion is to make sense of life in this world.\n\n2"]}, {"persona": {"region": "Dakahlia", "sex": "male", "age": 28, "country": "Egypt", "marital_status": "single", "education": "higher", "social_class": "upper middle class"}, "question": {"id": "Q175", "variant": 0}, "response": ["In the cultural context of Dakahlia, Egypt, religion plays a crucial role in shaping the individual values and personal experiences of the people. The emic perspective in this region emphasizes the importance of religion for making sense of life in this world, as the cultural and religious practices are deeply intertwined with daily life and societal norms. Additionally, the socioeconomic background of being part of the upper middle class may also influence the understanding of religion as a means to guide moral and ethical behavior in the present life. Furthermore, the nuance of the question may be interpreted through the lens of cultural relativism, where the purpose of religion is seen as subjective and deeply rooted in the cultural and temporal context of Dakahlia, Egypt.\n\n2"]}, {"persona": {"region": "Dakahlia", "sex": "female", "age": 24, "country": "Egypt", "marital_status": "married", "education": "higher", "social_class": "upper middle class"}, "question": {"id": "Q175", "variant": 0}, "response": ["From an emic perspective, as a married female from Dakahlia, Egypt, my cultural context and personal experience have shaped my understanding of the purpose of religion. In my community, religion plays a significant role in providing guidance and meaning in our daily lives. It helps us navigate challenges, find purpose, and maintain a sense of community. Additionally, my individual values and personal experience have led me to believe that religion serves the purpose of making sense of life in this world, as it provides moral and ethical guidelines for behavior and offers comfort and support in times of difficulty. Furthermore, considering my socioeconomic background as part of the upper middle class, religion also acts as a unifying force within my social circles, reinforcing cultural norms and values. Therefore, from my perspective, the purpose of religion is to make sense of life in this world.\n\n2"]}, {"persona": {"region": "Dakahlia", "sex": "male", "age": 20, "country": "Egypt", "marital_status": "single", "education": "middle", "social_class": "upper middle class"}, "question": {"id": "Q175", "variant": 0}, "response": ["Based on the anthropological framework, my emic perspective as a single male from Dakahlia, Egypt, who is 20 years old and part of the upper middle class, I understand that religion plays a significant role in the cultural context of my community. My personal experience and individual values have shaped my understanding of the purpose of religion, and I recognize that socioeconomic background also influences this. Additionally, cultural relativism teaches me to appreciate the diversity of beliefs and practices within my community. Considering space and time, I understand that religion provides a framework for making sense of life in this world, guiding moral behavior and providing a sense of community and purpose. \n\n2"]}, {"persona": {"region": "Dakahlia", "sex": "male", "age": 45, "country": "Egypt", "marital_status": "married", "education": "middle", "social_class": "upper middle class"}, "question": {"id": "Q175", "variant": 0}, "response": ["In considering the purpose of religion from the perspective of a married male from Dakahlia, Egypt, it is important to take into account the cultural context and individual values of this persona. In Egypt, religion plays a central role in daily life and is deeply intertwined with social, political, and cultural aspects. As a member of the upper middle class, this individual likely values the role of religion in providing guidance and moral principles for living a fulfilling life in this world. Additionally, the individual's personal experience and socioeconomic background may influence their belief that religion serves the purpose of providing a sense of community and belonging, as well as a framework for ethical living. Therefore, from this perspective, the purpose of religion is to make sense of life in this world.\n\n2"]}, {"persona": {"region": "Dakahlia", "sex": "female", "age": 43, "country": "Egypt", "marital_status": "married", "education": "higher", "social_class": "upper middle class"}, "question": {"id": "Q175", "variant": 0}, "response": ["Based on the anthropological framework, my cultural background as a married woman from Dakahlia, Egypt, the purpose of religion is deeply rooted in the cultural context and individual values. In my community, religion serves the purpose of making sense of life in this world, providing guidance for moral and ethical behavior, and offering a sense of community and belonging. It also influences the way we structure our daily lives, including rituals and traditions. Additionally, my higher education level and socioeconomic background have shaped my understanding of religion as a means of finding purpose and meaning in the present life, rather than solely focusing on the afterlife.\n\n2"]}, {"persona": {"region": "Dakahlia", "sex": "female", "age": 20, "country": "Egypt", "marital_status": "single", "education": "middle", "social_class": "upper middle class"}, "question": {"id": "Q175", "variant": 0}, "response": ["From the emic perspective, as a single female from Dakahlia, Egypt, religion plays a significant role in guiding my understanding of life and the world around me. In my cultural context, religion is deeply ingrained in daily life and provides a framework for moral and ethical decision-making. My individual values and personal experiences have led me to see religion as a source of comfort and guidance, especially in times of uncertainty. Additionally, my socioeconomic background as part of the upper middle class has allowed me to access education and resources that have shaped my understanding of religion. The cultural relativism of my community emphasizes the importance of religion in guiding personal and societal behavior. Given these factors, I believe that the purpose of religion is to make sense of life in this world.\n\n2"]}, {"persona": {"region": "Dakahlia", "sex": "female", "age": 40, "country": "Egypt", "marital_status": "single", "education": "middle", "social_class": "lower middle class"}, "question": {"id": "Q175", "variant": 0}, "response": ["From the perspective of a single female from Dakahlia, Egypt, who is 40 years old, completed middle education, and considers herself part of the lower middle class, the emic perspective on the purpose of religion would be heavily influenced by cultural context and individual values. In this region, religion plays a significant role in shaping daily life and providing a sense of community and guidance. The socioeconomic background also factors in, as religion may provide a source of comfort and support for those in lower economic classes. Additionally, the nuanced phrasing of the question may lead to the understanding that the purpose of religion is to make sense of life in this world, as it provides a moral compass, a sense of belonging, and a framework for understanding and navigating the challenges of everyday life.\n\n2"]}, {"persona": {"region": "Dakahlia", "sex": "female", "age": 33, "country": "Egypt", "marital_status": "married", "education": "higher", "social_class": "upper middle class"}, "question": {"id": "Q175", "variant": 0}, "response": ["As a married female from Dakahlia, Egypt, with a higher education level and belonging to the upper middle class, my understanding of the purpose of religion is heavily influenced by my cultural context and personal experience. In Egypt, religion plays a significant role in shaping societal norms and values, and it serves as a guide for moral and ethical principles. Additionally, my socioeconomic background and education have provided me with a nuanced understanding of the importance of religion in maintaining social cohesion and providing a sense of purpose in life. Therefore, I believe that the purpose of religion is to make sense of life in this world.\n\n2"]}, {"persona": {"region": "Dakahlia", "sex": "female", "age": 24, "country": "Egypt", "marital_status": "married", "education": "middle", "social_class": "working class"}, "question": {"id": "Q175", "variant": 0}, "response": ["Based on the anthropological framework, as a married female from Dakahlia, Egypt, my emic perspective on the purpose of religion is heavily influenced by my cultural context and individual values. In my community, religion plays a significant role in making sense of life in this world. It is interwoven into our daily lives, providing guidance on moral conduct, societal norms, and personal spirituality. Additionally, my socioeconomic background as part of the working class has shaped my understanding of religion as a source of hope and comfort in the face of challenges and hardships. Therefore, I believe that the purpose of religion, from my perspective, is to make sense of life in this world.\n\n2"]}, {"persona": {"region": "Dakahlia", "sex": "female", "age": 53, "country": "Egypt", "marital_status": "widowed", "education": "middle", "social_class": "working class"}, "question": {"id": "Q175", "variant": 0}, "response": ["Based on the anthropological framework, as a widowed female from Dakahlia, Egypt, my emic perspective on the purpose of religion is influenced by my cultural context, individual values, and personal experience. In my community, religion plays a crucial role in providing comfort and guidance in the face of loss and hardship. As a member of the working class, I have experienced the struggles of life and have seen how religion helps people find meaning and purpose in their daily lives. Additionally, my middle education level has exposed me to religious teachings that emphasize the importance of moral values and ethical behavior. Therefore, from my perspective, the purpose of religion is to make sense of life in this world.\n\n2"]}, {"persona": {"region": "Dakahlia", "sex": "female", "age": 30, "country": "Egypt", "marital_status": "single", "education": "middle", "social_class": "lower middle class"}, "question": {"id": "Q175", "variant": 0}, "response": ["From an emic perspective, as a single female from Dakahlia, Egypt, my cultural context and personal experience have shaped my understanding of the purpose of religion. In my community, religion plays a significant role in providing a framework for understanding life and its challenges. It is a source of comfort and guidance, especially in difficult times. Additionally, my lower middle-class socioeconomic background has influenced my belief that religion serves the purpose of making sense of life in this world, as it provides moral guidance, a sense of community, and a source of hope. Therefore, from my perspective, the purpose of religion is to make sense of life in this world.\n\n2"]}, {"persona": {"region": "Dakahlia", "sex": "male", "age": 53, "country": "Egypt", "marital_status": "married", "education": "higher", "social_class": "upper middle class"}, "question": {"id": "Q175", "variant": 0}, "response": ["Based on the anthropological framework, my perspective as a married male from Dakahlia, Egypt, who is 53 years old and part of the upper middle class, is deeply influenced by my cultural context, individual values, and personal experience. In my culture, religion plays a significant role in shaping our understanding of the world and our place in it. Religion provides a framework for moral guidance, social cohesion, and a sense of purpose. It also serves to make sense of life in this world, guiding our actions and decisions in our daily lives. Additionally, my higher education level has allowed me to critically analyze and understand the complexities of religious beliefs and practices, leading me to recognize the multifaceted role of religion in our lives.\n\n2"]}, {"persona": {"region": "Dakahlia", "sex": "male", "age": 28, "country": "Egypt", "marital_status": "married", "education": "middle", "social_class": "working class"}, "question": {"id": "Q175", "variant": 0}, "response": ["From the anthropological framework, I understand that my cultural context, individual values, and socioeconomic background play a significant role in shaping my perspective. As a married male from Dakahlia, Egypt, I am influenced by the cultural and religious practices of my community. Religion is a fundamental aspect of our society and provides a framework for understanding the world around us. Additionally, my working-class background means that religion serves as a source of support and guidance in navigating the challenges of everyday life. Therefore, I believe that the purpose of religion is to make sense of life in this world.\n\n2"]}, {"persona": {"region": "Dakahlia", "sex": "female", "age": 38, "country": "Egypt", "marital_status": "married", "education": "middle", "social_class": "upper middle class"}, "question": {"id": "Q175", "variant": 0}, "response": ["Based on the anthropological framework, my answer is influenced by my cultural context as a married female from Dakahlia, Egypt. The emic perspective within my cultural group emphasizes the importance of religion in making sense of life in this world, as it shapes our daily lives, moral values, and social interactions. My personal experience and individual values also play a significant role in my understanding of the purpose of religion. Additionally, my socioeconomic background as part of the upper middle class may lead me to prioritize the role of religion in addressing the challenges and opportunities of life in the present. Therefore, I choose option (2) to make sense of life in this world.\n\n2"]}, {"persona": {"region": "Gharbia", "sex": "male", "age": 27, "country": "Egypt", "marital_status": "single", "education": "higher", "social_class": "upper middle class"}, "question": {"id": "Q175", "variant": 0}, "response": ["Based on the anthropological framework, my perspective as a single male from Gharbia, Egypt, who is 27 years old and part of the upper middle class, is influenced by my cultural context, individual values, and socioeconomic background. In Egypt, religion plays a central role in daily life and is deeply intertwined with cultural practices and societal norms. As a member of the upper middle class, I have been exposed to a certain level of education and have the privilege to contemplate the purpose of religion beyond just fulfilling basic needs. From my perspective, the purpose of religion is not only to make sense of life after death, but also to make sense of life in this world. Religion provides a framework for moral and ethical guidance, community support, and a sense of purpose and belonging in the present life. \n\n2"]}, {"persona": {"region": "Gharbia", "sex": "female", "age": 35, "country": "Egypt", "marital_status": "married", "education": "higher", "social_class": "upper middle class"}, "question": {"id": "Q175", "variant": 0}, "response": ["Based on the anthropological framework, as a married female from Gharbia, Egypt, my perspective on the purpose of religion is heavily influenced by my cultural context and personal experience. In Egyptian society, religion plays a central role in providing a framework for understanding and navigating life in this world. It shapes our values, morals, and social interactions, and provides a sense of community and belonging. Additionally, as a member of the upper middle class, I have observed that religion is also used as a means of social cohesion and support. Therefore, from my perspective, the purpose of religion is to make sense of life in this world.\n\n2"]}, {"persona": {"region": "Gharbia", "sex": "female", "age": 37, "country": "Egypt", "marital_status": "married", "education": "higher", "social_class": "upper middle class"}, "question": {"id": "Q175", "variant": 0}, "response": ["From my emic perspective as a married female from Gharbia, Egypt, religion plays a crucial role in making sense of life in this world. In our cultural context, religion is deeply intertwined with our daily lives, shaping our values, traditions, and social interactions. As someone who is part of the upper middle class and has completed higher education, I have seen how religion provides a framework for understanding the complexities of life, guiding our moral compass, and offering a sense of community and belonging. Additionally, my personal experience and individual values align with the belief that religion serves to provide guidance and purpose in this world, helping us navigate the challenges and uncertainties we face. Therefore, I choose option 2: To make sense of life in this world.\n\n2"]}, {"persona": {"region": "Gharbia", "sex": "male", "age": 43, "country": "Egypt", "marital_status": "married", "education": "middle", "social_class": "lower middle class"}, "question": {"id": "Q175", "variant": 0}, "response": ["Based on the anthropological framework, my perspective as a married male from Gharbia, Egypt, with a middle education level and lower middle class background is deeply influenced by my cultural context, individual values, and personal experience. In Gharbia, religion plays a significant role in shaping our understanding of the world and our purpose in it. Religion provides a framework for understanding and navigating the challenges of daily life, offering guidance on moral and ethical behavior. Additionally, it serves as a source of community and support, particularly in times of adversity. Considering this, I believe that the purpose of religion is to make sense of life in this world, as it provides a moral compass and a sense of belonging within our cultural and social context.\n\n2"]}, {"persona": {"region": "Gharbia", "sex": "male", "age": 28, "country": "Egypt", "marital_status": "single", "education": "higher", "social_class": "lower middle class"}, "question": {"id": "Q175", "variant": 0}, "response": ["Based on my personal experience and cultural context, as a single male from Gharbia, Egypt, religion serves the purpose of making sense of life in this world. In my community, religion provides a framework for understanding the world around us, guiding our moral compass, and offering a sense of community and belonging. Additionally, my socioeconomic background and age influence my perspective on the role of religion in shaping societal norms and values. Therefore, I believe that the purpose of religion is to make sense of life in this world.\n\n2"]}, {"persona": {"region": "Gharbia", "sex": "male", "age": 39, "country": "Egypt", "marital_status": "married", "education": "middle", "social_class": "lower middle class"}, "question": {"id": "Q175", "variant": 0}, "response": ["From the perspective of a married male from Gharbia, Egypt, who is 39 years old and part of the lower middle class, the understanding of the purpose of religion is deeply rooted in the cultural context and individual values. In this region, religion plays a significant role in shaping societal norms, values, and behaviors. The cultural context emphasizes the importance of religion in providing guidance and moral principles for daily life. Additionally, the socioeconomic background of being part of the lower middle class means that the community may rely on religion to find solace and hope in the face of economic challenges. Furthermore, the individual values and personal experience of this persona would likely lead to the belief that the purpose of religion is to make sense of life in this world, as it provides a framework for understanding and navigating the trials and tribulations of everyday existence. \n\n2"]}, {"persona": {"region": "Gharbia", "sex": "male", "age": 30, "country": "Egypt", "marital_status": "married", "education": "middle", "social_class": "lower middle class"}, "question": {"id": "Q175", "variant": 0}, "response": ["From the perspective of a married male from Gharbia, Egypt, the purpose of religion is deeply rooted in cultural context and personal experience. In this region, religion plays a central role in shaping individuals' beliefs and values, and it is intricately connected to everyday life. The socioeconomic background also plays a significant role, especially for someone who considers themselves part of the lower middle class. Religion provides a sense of community and support, and it offers guidance and comfort in the face of economic challenges. Additionally, the cultural relativism in this context emphasizes the importance of religion in shaping moral values and social norms. Ultimately, the purpose of religion is to make sense of life in this world, providing guidance and a sense of belonging in a complex and often challenging socioeconomic environment.\n\n2"]}, {"persona": {"region": "Gharbia", "sex": "male", "age": 43, "country": "Egypt", "marital_status": "married", "education": "lower", "social_class": "lower middle class"}, "question": {"id": "Q175", "variant": 0}, "response": ["From the perspective of a married male from Gharbia, Egypt, with a lower education level and belonging to the lower middle class, the purpose of religion is deeply rooted in cultural context and individual values. In this region, religion plays a significant role in shaping the daily lives and beliefs of the people. The emic perspective emphasizes the importance of understanding the in-group ways of thinking about this question, which is influenced by the cultural and religious practices prevalent in the community. Additionally, the socioeconomic background and personal experiences of individuals in this demographic also contribute to their understanding of the purpose of religion. Therefore, the chosen option reflects the nuanced phrasing of the question and is in line with the cultural and personal context of the persona described above.\n\n2"]}, {"persona": {"region": "Gharbia", "sex": "male", "age": 36, "country": "Egypt", "marital_status": "married", "education": "higher", "social_class": "lower middle class"}, "question": {"id": "Q175", "variant": 0}, "response": ["From the perspective of a married male from Gharbia, Egypt, cultural context and personal experience play a crucial role in understanding the purpose of religion. In this region, religion is deeply ingrained in daily life and societal norms. As a person who completed higher education and considers himself part of the lower middle class, I have been exposed to both traditional and modern interpretations of religion. The emic perspective within the community emphasizes the importance of religion in making sense of life in this world, as it provides guidance on moral behavior, social interactions, and personal well-being. Additionally, the etic perspective acknowledges the historical and cultural significance of religion in shaping the collective identity of the community. Therefore, the purpose of religion is to make sense of life in this world.\n\n2"]}, {"persona": {"region": "Gharbia", "sex": "male", "age": 25, "country": "Egypt", "marital_status": "married", "education": "middle", "social_class": "upper middle class"}, "question": {"id": "Q175", "variant": 0}, "response": ["Based on the anthropological framework, as a married male from Gharbia, Egypt, who is 25 years old and considers myself part of the upper middle class, my perspective on the purpose of religion is influenced by my cultural context and individual values. In the Egyptian society, religion plays a significant role in shaping our understanding of life and providing moral and ethical guidelines. From an emic perspective, religion is seen as a way to make sense of life in this world, as it guides our daily actions and interactions with others. Additionally, my personal experience and socioeconomic background have also shaped my understanding of the purpose of religion, as it provides a sense of community and belonging, and offers comfort and solace in times of difficulty.\n\n2"]}, {"persona": {"region": "Gharbia", "sex": "male", "age": 31, "country": "Egypt", "marital_status": "married", "education": "middle", "social_class": "upper middle class"}, "question": {"id": "Q175", "variant": 0}, "response": ["Based on the anthropological framework, my answer to the question of the purpose of religion would be to make sense of life in this world. In Gharbia, Egypt, religion plays a significant role in shaping cultural context and individual values. As a married male from this region, I have been raised in a society where religion is integrated into daily life, influencing my personal experiences and values. Additionally, being part of the upper middle class means that I have had access to resources and education that have allowed me to critically engage with religious beliefs and their impact on societal structures. Therefore, my understanding of the purpose of religion is deeply rooted in the cultural context, individual values, and socioeconomic background that have shaped my worldview.\n\n2"]}, {"persona": {"region": "Gharbia", "sex": "male", "age": 33, "country": "Egypt", "marital_status": "married", "education": "higher", "social_class": "lower middle class"}, "question": {"id": "Q175", "variant": 0}, "response": ["Based on the anthropological framework, my answer to the question of the purpose of religion is influenced by my cultural context, individual values, and personal experience. Being from Gharbia, Egypt, religion is an integral part of our cultural identity and plays a significant role in shaping our understanding of the world and our place in it. As a married male who has completed higher education and considers myself part of the lower middle class, I have been exposed to the teachings and values of Islam, which emphasize the importance of religion in guiding our actions and providing a moral compass for daily life. Additionally, my socioeconomic background has influenced my perspective on the purpose of religion, as it serves as a source of comfort and guidance in navigating the challenges of life. Considering these factors, I believe that the purpose of religion is primarily to make sense of life in this world.\n\n2"]}, {"persona": {"region": "Gharbia", "sex": "male", "age": 26, "country": "Egypt", "marital_status": "single", "education": "higher", "social_class": "upper middle class"}, "question": {"id": "Q175", "variant": 0}, "response": ["Based on the anthropological framework, I would answer the question from the perspective of a single male from Gharbia, Egypt, who has completed higher education and considers himself part of the upper middle class. Considering the cultural context of Egypt, where religion plays a significant role in daily life, and the individual values and personal experiences of the persona, I would choose option (2) To make sense of life in this world.\n\n2"]}, {"persona": {"region": "Gharbia", "sex": "female", "age": 45, "country": "Egypt", "marital_status": "married", "education": "middle", "social_class": "lower middle class"}, "question": {"id": "Q175", "variant": 0}, "response": ["Based on the anthropological framework, as a married woman from Gharbia, Egypt, my emic perspective on the purpose of religion is heavily influenced by my cultural context, individual values, and socioeconomic background. In my community, religion plays a crucial role in making sense of life in this world. It provides a framework for moral and ethical behavior, offers guidance on how to navigate daily challenges, and provides a sense of community and belonging. Additionally, as a member of the lower middle class, religion also serves as a source of hope and comfort in the face of economic hardships and uncertainty. Therefore, from my perspective, the purpose of religion is to make sense of life in this world.\n\n2"]}, {"persona": {"region": "Gharbia", "sex": "female", "age": 55, "country": "Egypt", "marital_status": "married", "education": "middle", "social_class": "upper middle class"}, "question": {"id": "Q175", "variant": 0}, "response": ["From the perspective of a married female from Gharbia, Egypt, who is 55 years old and part of the upper middle class, the purpose of religion is deeply rooted in cultural context and individual values. In this region, religion plays a significant role in daily life and societal norms. It provides a sense of community and identity, and it also influences personal values and ethical beliefs. Additionally, religion serves as a guide for moral conduct and offers a framework for understanding the world and one's place within it. The cultural context of Egypt emphasizes the importance of religion in shaping individuals' beliefs and behaviors, and for this persona, the purpose of religion is to make sense of life in this world.\n\n2"]}, {"persona": {"region": "Gharbia", "sex": "female", "age": 27, "country": "Egypt", "marital_status": "married", "education": "higher", "social_class": "upper middle class"}, "question": {"id": "Q175", "variant": 0}, "response": ["From the emic perspective, the purpose of religion is deeply rooted in the cultural context of Gharbia, Egypt. Religion plays a pivotal role in the lives of individuals, providing a framework for understanding and making sense of life in this world. As a married female from Gharbia, Egypt, my personal experience and individual values have been shaped by the religious beliefs and practices that are prevalent in my community. Additionally, my socioeconomic background as part of the upper middle class has influenced my understanding of the role of religion, as it has provided me with access to education and opportunities for personal growth. In this context, the purpose of religion is to make sense of life in this world, guiding individuals in their daily lives and shaping their interactions within the community. \n\n2"]}, {"persona": {"region": "Gharbia", "sex": "female", "age": 42, "country": "Egypt", "marital_status": "married", "education": "higher", "social_class": "upper middle class"}, "question": {"id": "Q175", "variant": 0}, "response": ["Based on the anthropological framework, my emic perspective as a married female from Gharbia, Egypt, is influenced by my cultural context, individual values, and personal experience. In my community, religion plays a significant role in shaping our understanding of life and providing a framework for moral and ethical guidelines. As someone who has received a higher education and is part of the upper middle class, I have been exposed to different perspectives and have the privilege of critically analyzing the purpose of religion. I believe that the purpose of religion is to make sense of life in this world, as it provides guidance and a sense of community, and helps navigate the complexities of everyday life.\n\n2"]}, {"persona": {"region": "Gharbia", "sex": "female", "age": 32, "country": "Egypt", "marital_status": "married", "education": "middle", "social_class": "upper middle class"}, "question": {"id": "Q175", "variant": 0}, "response": ["From the perspective of a married female from Gharbia, Egypt, who is 32 years old, completed middle education, and considers herself part of the upper middle class, the cultural context and individual values play a significant role in understanding the purpose of religion. In this region, religion, particularly Islam, is deeply rooted in the cultural fabric and plays a central role in shaping societal norms and values. Given the emphasis on family, community, and the afterlife, the purpose of religion is to make sense of life after death, providing comfort and guidance in navigating the complexities of the spiritual realm. Additionally, the emphasis on moral behavior and ethical conduct in Islam also serves to provide a framework for understanding and navigating life in this world. \n\n2"]}, {"persona": {"region": "Gharbia", "sex": "male", "age": 27, "country": "Egypt", "marital_status": "married", "education": "higher", "social_class": "upper middle class"}, "question": {"id": "Q175", "variant": 0}, "response": ["Based on the anthropological framework, as a married male from Gharbia, Egypt, my emic perspective on the purpose of religion is heavily influenced by my cultural context. In Egypt, religion plays a significant role in everyday life and is deeply intertwined with our cultural and social practices. My personal experience and values have also been shaped by the teachings of Islam, which emphasize the importance of faith in guiding moral behavior and fostering a sense of community. Additionally, my socioeconomic background as part of the upper middle class has afforded me access to education and resources that have further shaped my understanding of religion. Therefore, my choice is option (2) - To make sense of life in this world. \n\n2"]}, {"persona": {"region": "Gharbia", "sex": "female", "age": 27, "country": "Egypt", "marital_status": "married", "education": "higher", "social_class": "lower middle class"}, "question": {"id": "Q175", "variant": 0}, "response": ["Based on the anthropological framework, my perspective as a married female from Gharbia, Egypt, is heavily influenced by my cultural context, individual values, and socioeconomic background. In Gharbia, religion plays a crucial role in shaping societal norms, moral values, and daily life. As a member of the lower middle class, my access to resources and opportunities may be limited, and religion serves as a source of comfort, guidance, and community support. Additionally, my higher education level has provided me with critical thinking skills, allowing me to appreciate the nuanced understanding of religion's purpose in both this world and the afterlife. Therefore, I choose option 2) To make sense of life in this world."]}, {"persona": {"region": "Gharbia", "sex": "female", "age": 37, "country": "Egypt", "marital_status": "married", "education": "middle", "social_class": "upper middle class"}, "question": {"id": "Q175", "variant": 0}, "response": ["Based on the anthropological framework, as a married female from Gharbia, Egypt, my emic perspective is that religion serves the purpose of providing guidance and structure for life in this world. In our cultural context, religion plays a central role in shaping our daily lives, from the way we dress to the food we eat. It provides a moral compass and a sense of community, which are important aspects of our individual values and personal experiences. Additionally, considering my socioeconomic background as part of the upper middle class, religion also serves as a means of social cohesion and solidarity within our community. Moreover, in our cultural relativism, the purpose of religion is not just about life after death, but rather about navigating the complexities of our current existence. Therefore, based on my perspective and understanding, the purpose of religion is to make sense of life in this world.\n\n2"]}, {"persona": {"region": "Gharbia", "sex": "male", "age": 28, "country": "Egypt", "marital_status": "married", "education": "higher", "social_class": "working class"}, "question": {"id": "Q175", "variant": 0}, "response": ["Based on the anthropological framework, as a married male from Gharbia, Egypt, my emic perspective on the purpose of religion is influenced by my cultural context and personal experience. In my community, religion plays a significant role in providing guidance and comfort in navigating the challenges of this world, including family and work. Additionally, my socioeconomic background as part of the working class has shaped my understanding of religion as a source of moral and ethical principles to guide my actions in daily life. Therefore, I believe that the purpose of religion is to make sense of life in this world.\n\n2"]}, {"persona": {"region": "Gharbia", "sex": "female", "age": 50, "country": "Egypt", "marital_status": "married", "education": "middle", "social_class": "upper middle class"}, "question": {"id": "Q175", "variant": 0}, "response": ["Based on the anthropological framework, my perspective as a married female from Gharbia, Egypt, at the age of 50, with middle education and considering myself part of the upper middle class is influenced by my cultural context, individual values and personal experience, and socioeconomic background. In Gharbia, religion plays a significant role in everyday life and is deeply intertwined with social, economic, and political aspects. It provides a moral compass, shapes social norms, and guides community practices. From my personal experience, I have seen how religion brings a sense of comfort, community, and purpose to individuals, helping them navigate life's challenges. As someone from an upper middle-class background, religion may also serve as a means of maintaining social status and connections within the community. Therefore, from this perspective, the purpose of religion is to make sense of life in this world.\n\n2"]}, {"persona": {"region": "Gharbia", "sex": "male", "age": 39, "country": "Egypt", "marital_status": "single", "education": "higher", "social_class": "working class"}, "question": {"id": "Q175", "variant": 0}, "response": ["Based on my personal experience and cultural context as a working-class male from Gharbia, Egypt, religion serves the purpose of providing guidance and meaning in this world. In my community, religion plays a significant role in shaping our values, morals, and social interactions. It also provides a sense of community and support, especially in times of hardship. Additionally, religion influences our daily lives, from the way we dress to the food we eat. Therefore, from my perspective, the purpose of religion is to make sense of life in this world.\n\n2"]}, {"persona": {"region": "Gharbia", "sex": "female", "age": 45, "country": "Egypt", "marital_status": "married", "education": "higher", "social_class": "upper middle class"}, "question": {"id": "Q175", "variant": 0}, "response": ["Based on the anthropological framework, as a married female from Gharbia, Egypt, I understand the purpose of religion to be shaped by my cultural context and personal experiences. In Egypt, religion plays a central role in everyday life and is deeply intertwined with societal norms and values. As a woman who has completed higher education and considers myself part of the upper middle class, my understanding of the purpose of religion is influenced by my individual values and personal experiences. Additionally, my age and place in society also inform my perspective. Therefore, I believe that the purpose of religion is to make sense of life in this world.\n\n2"]}, {"persona": {"region": "Sharkia", "sex": "male", "age": 35, "country": "Egypt", "marital_status": "married", "education": "higher", "social_class": "upper middle class"}, "question": {"id": "Q175", "variant": 0}, "response": ["From an anthropological perspective, my cultural context as a married male from Sharkia, Egypt, and my higher education level would influence my understanding of the purpose of religion. In my community, religion is deeply interwoven with daily life and is seen as a way to make sense of life in this world. My personal experience and values also play a role in this perspective, as I have been taught that religion provides guidance and moral principles for navigating the challenges of this life. Additionally, my socioeconomic background as part of the upper middle class has allowed me to access education and resources that have shaped my understanding of the world. Therefore, from my perspective, the purpose of religion is to make sense of life in this world. \n\n2"]}, {"persona": {"region": "Sharkia", "sex": "female", "age": 55, "country": "Egypt", "marital_status": "married", "education": "middle", "social_class": "lower middle class"}, "question": {"id": "Q175", "variant": 0}, "response": ["Based on the anthropological framework, my answer to the question of the purpose of religion is influenced by my cultural context as a married female from Sharkia, Egypt. In my community, religion plays a significant role in shaping our understanding of the world and our place in it. The emic perspective of my community emphasizes the importance of religion in guiding our daily lives and providing a moral framework for our actions. Additionally, my personal experience and individual values have led me to believe that the purpose of religion is to make sense of life in this world, as it provides guidance, comfort, and a sense of community in navigating the challenges of everyday life.\n\n2"]}, {"persona": {"region": "Sharkia", "sex": "female", "age": 27, "country": "Egypt", "marital_status": "married", "education": "middle", "social_class": "lower middle class"}, "question": {"id": "Q175", "variant": 0}, "response": ["Based on the anthropological framework, as a married female from Sharkia, Egypt, my emic perspective on the purpose of religion is influenced by my cultural context, individual values, and socioeconomic background. In Sharkia, religion plays a crucial role in providing a framework for understanding life in this world, as it guides our moral and ethical beliefs, social norms, and community practices. Additionally, as a lower middle class woman, religion serves as a source of comfort and hope, offering solace in challenging economic circumstances. Therefore, the purpose of religion, from my perspective, is to make sense of life in this world.\n\n2"]}, {"persona": {"region": "Sharkia", "sex": "female", "age": 52, "country": "Egypt", "marital_status": "married", "education": "middle", "social_class": "lower middle class"}, "question": {"id": "Q175", "variant": 0}, "response": ["Based on the anthropological framework, as a married female from Sharkia, Egypt, at the age of 52, with a middle education level and considering myself part of the lower middle class, my answer to the question of the purpose of religion would be influenced by my cultural context, individual values, and personal experience. In my community, religion plays a central role in providing guidance, moral principles, and a sense of community. It helps us make sense of life in this world, providing a framework for how to live our daily lives and interact with others. It also offers a sense of hope and purpose, especially in the face of economic challenges and social inequality. Therefore, my choice is: \n\n2) To make sense of life in this world"]}, {"persona": {"region": "Sharkia", "sex": "male", "age": 36, "country": "Egypt", "marital_status": "married", "education": "middle", "social_class": "lower middle class"}, "question": {"id": "Q175", "variant": 0}, "response": ["Based on my cultural context, as a married male from Sharkia, Egypt, religion plays a crucial role in my daily life. It shapes my values, beliefs, and behaviors, and provides a sense of community and belonging. My lower middle class socioeconomic background also influences my perspective, as religion often serves as a source of support and comfort in times of financial struggle. Additionally, my personal experience and individual values lead me to believe that religion's purpose is to make sense of life in this world, providing guidance and moral principles for navigating the challenges of everyday life.\n\n2"]}, {"persona": {"region": "Sharkia", "sex": "female", "age": 20, "country": "Egypt", "marital_status": "single", "education": "middle", "social_class": "working class"}, "question": {"id": "Q175", "variant": 0}, "response": ["In Sharkia, Egypt, the cultural context and individual values play a significant role in one's understanding of the purpose of religion. As a 20-year-old single female from the working class with a middle education level, my personal experience and socioeconomic background have shaped my perspective. In this society, religion is deeply intertwined with daily life and provides guidance on moral and ethical behavior. From this perspective, the purpose of religion is to make sense of life in this world.\n\n2"]}, {"persona": {"region": "Sharkia", "sex": "male", "age": 60, "country": "Egypt", "marital_status": "married", "education": "middle", "social_class": "working class"}, "question": {"id": "Q175", "variant": 0}, "response": ["Based on the anthropological framework, my perspective as a married, 60-year-old male from Sharkia, Egypt, with a middle education level, and part of the working class is heavily influenced by my cultural context, individual values, and personal experience. In my community, religion plays a vital role in providing guidance and a sense of purpose in this world. It helps us navigate our daily lives, make moral decisions, and find meaning in our actions. Additionally, my socioeconomic background and cultural relativism also influence my perspective, as my religion is deeply intertwined with my identity and social interactions. Therefore, the purpose of religion, from my perspective, is to make sense of life in this world.\n\n2"]}, {"persona": {"region": "Sharkia", "sex": "male", "age": 41, "country": "Egypt", "marital_status": "married", "education": "higher", "social_class": "upper middle class"}, "question": {"id": "Q175", "variant": 0}, "response": ["From the perspective of a married male from Sharkia, Egypt, who is 41 years old, has completed higher education and considers himself part of the upper middle class, the answer to the question of the purpose of religion would be option (2) To make sense of life in this world. In the cultural context of Egypt, religion is deeply ingrained in daily life and plays a significant role in shaping social, political, and moral values. As an educated individual from a region with a strong religious tradition, the focus would likely be on the practical implications of religion in guiding behavior and providing a framework for understanding and navigating the challenges of this world rather than solely focusing on the afterlife. \n\n2"]}, {"persona": {"region": "Sharkia", "sex": "female", "age": 23, "country": "Egypt", "marital_status": "married", "education": "middle", "social_class": "lower middle class"}, "question": {"id": "Q175", "variant": 0}, "response": ["Based on my cultural context and personal experience, religion plays a crucial role in my life as a married woman from Sharkia, Egypt. My upbringing and socioeconomic background have ingrained in me the belief that religion serves the purpose of making sense of life in this world. It provides a moral compass, guidance, and a sense of community, all of which are essential in navigating the challenges and joys of everyday life. Additionally, my age and place in society have shaped my understanding that religion is a fundamental aspect of our culture and identity, and it provides a framework for social interactions and personal values.\n\n2"]}, {"persona": {"region": "Sharkia", "sex": "male", "age": 49, "country": "Egypt", "marital_status": "married", "education": "higher", "social_class": "upper middle class"}, "question": {"id": "Q175", "variant": 0}, "response": ["Based on my background and understanding, I believe that the purpose of religion is to make sense of life in this world. As someone from Sharkia, Egypt, I am deeply rooted in a cultural context where religion plays a central role in shaping everyday life. My higher education level has also provided me with a nuanced understanding of the complexities of religion and its impact on society. Additionally, being part of the upper middle class, I recognize the importance of individual values and personal experience in shaping one's perception of religion. Furthermore, the cultural relativism I have been exposed to has taught me to appreciate the diversity of religious beliefs and practices. Overall, from my emic perspective, I believe that religion serves the purpose of making sense of life in this world.\n\n2"]}, {"persona": {"region": "Sharkia", "sex": "female", "age": 30, "country": "Egypt", "marital_status": "married", "education": "middle", "social_class": "upper middle class"}, "question": {"id": "Q175", "variant": 0}, "response": ["Based on the anthropological framework, as a married female from Sharkia, Egypt, my understanding of the purpose of religion is deeply influenced by my cultural context, individual values, and personal experience. In Sharkia, religion is an integral part of daily life and provides a framework for understanding the world and our place in it. As a member of the upper middle class, I have been taught to prioritize the importance of religion in making sense of life in this world. The teachings and beliefs of my community emphasize the importance of living a virtuous life and seeking guidance from religion in navigating the challenges of this world. Therefore, my answer to the question would be:\n\n2\n\nMy reasoning for choosing this option is that it aligns with the perspective of my cultural context and personal experience, emphasizing the significance of religion in providing guidance and meaning in this life."]}, {"persona": {"region": "Sharkia", "sex": "male", "age": 39, "country": "Egypt", "marital_status": "married", "education": "higher", "social_class": "upper middle class"}, "question": {"id": "Q175", "variant": 0}, "response": ["Based on the anthropological framework, as a married male from Sharkia, Egypt, I understand that the purpose of religion is deeply rooted in cultural context and individual values. In my community, religion plays a crucial role in making sense of life in this world. The cultural context of Egypt, with its rich history and strong religious traditions, has shaped my understanding of the purpose of religion. Additionally, my personal experience and values, as well as my socioeconomic background as an upper-middle-class individual, contribute to my belief that religion serves to provide guidance and meaning in the everyday life of individuals and society.\n\n2"]}, {"persona": {"region": "Sharkia", "sex": "female", "age": 26, "country": "Egypt", "marital_status": "married", "education": "middle", "social_class": "lower middle class"}, "question": {"id": "Q175", "variant": 0}, "response": ["Based on the anthropological framework, as a married female from Sharkia, Egypt, my perspective is deeply influenced by the cultural context, individual values and personal experience, and socioeconomic background. In my community, religion plays a significant role in providing a framework for understanding life in this world. It shapes our daily practices, moral values, and social interactions. Additionally, my lower middle class socioeconomic background has influenced my understanding of religion as a source of hope and comfort in the face of economic challenges. Therefore, from my perspective, the purpose of religion is to make sense of life in this world.\n\n2"]}, {"persona": {"region": "Sharkia", "sex": "female", "age": 48, "country": "Egypt", "marital_status": "married", "education": "middle", "social_class": "lower middle class"}, "question": {"id": "Q175", "variant": 0}, "response": ["Based on the anthropological framework, I, as a married female from Sharkia, Egypt, would approach this question from the perspective of cultural context, individual values, and personal experience. In my cultural context, religion plays a significant role in shaping societal norms and values, and it provides a framework for understanding the world around me. My personal experience and values have also been influenced by the role of religion in my community, and I have been taught that the purpose of religion is to guide individuals in making sense of life in this world, including their actions, relationships, and moral conduct. Therefore, I choose option (2) To make sense of life in this world."]}, {"persona": {"region": "Sharkia", "sex": "male", "age": 34, "country": "Egypt", "marital_status": "married", "education": "higher", "social_class": "upper middle class"}, "question": {"id": "Q175", "variant": 0}, "response": ["Based on the anthropological framework, my response to the question of the purpose of religion is influenced by my cultural context, individual values, and socioeconomic background. Coming from Sharkia, Egypt, where religion plays a significant role in shaping societal norms and values, I have been brought up to believe that the purpose of religion is to make sense of life in this world. This belief is deeply ingrained in my upbringing and education, and as a member of the upper middle class, I have seen how religion provides guidance and moral framework for navigating the complexities of everyday life. Additionally, my personal experience and values align with the idea that religion serves to provide a sense of purpose, community, and ethical guidance in the here and now. Therefore, my perspective on the purpose of religion is shaped by the emic understanding of its role in the cultural context of Egypt and the etic perspective of understanding religion as a means to interpret and navigate life in this world.\n\n2"]}, {"persona": {"region": "Sharkia", "sex": "female", "age": 39, "country": "Egypt", "marital_status": "divorced", "education": "middle", "social_class": "lower middle class"}, "question": {"id": "Q175", "variant": 0}, "response": ["Based on the anthropological framework, my cultural context as a divorced female from Sharkia, Egypt, at 39 years of age and with a middle education level places a strong emphasis on the role of religion in my life. Being part of the lower middle class, my socioeconomic background also influences my perspective on religion. In this context, religion serves the purpose of making sense of life in this world. It provides guidance, moral values, and a sense of community, which are especially important for those in lower socioeconomic positions. Religion also plays a role in shaping societal norms and providing a sense of purpose and structure in daily life.\n\n2"]}, {"persona": {"region": "Sharkia", "sex": "male", "age": 39, "country": "Egypt", "marital_status": "married", "education": "middle", "social_class": "upper middle class"}, "question": {"id": "Q175", "variant": 0}, "response": ["Based on my understanding of the anthropological framework, as a married male from Sharkia, Egypt, at 39 years of age with a middle education level and considering myself part of the upper middle class, I would approach the question of the purpose of religion by considering the cultural context and individual values. In my community, religion plays a significant role in guiding moral and ethical behavior in this world, and it also provides a framework for understanding life after death. Additionally, the socioeconomic background and cultural relativism of my community emphasize the importance of religion in shaping social structures and providing a sense of community and belonging. Therefore, from this perspective, I would choose option (2) To make sense of life in this world.\n\n2"]}, {"persona": {"region": "Qaliubiya", "sex": "male", "age": 62, "country": "Egypt", "marital_status": "married", "education": "middle", "social_class": "working class"}, "question": {"id": "Q175", "variant": 0}, "response": ["Based on the anthropological framework, I, as a married male from Qaliubiya, Egypt, would approach the question of the purpose of religion by considering the cultural context, individual values and personal experience, socioeconomic background, and space and time. In my culture, religion plays a crucial role in shaping our understanding of life and providing a sense of purpose. As a member of the working class in Egypt, I have seen how religion provides a framework for understanding the challenges and hardships of everyday life, and offers hope for a better future. Additionally, at my age, I have witnessed the impact of religion on my community and have personally experienced the comfort and guidance it provides. Therefore, from my perspective, the purpose of religion is to make sense of life in this world.\n\n2"]}, {"persona": {"region": "Qaliubiya", "sex": "male", "age": 33, "country": "Egypt", "marital_status": "married", "education": "middle", "social_class": "working class"}, "question": {"id": "Q175", "variant": 0}, "response": ["From the perspective of a married male from Qaliubiya, Egypt, who is 33 years old and completed middle education level, and considers himself part of the working class, the purpose of religion is heavily influenced by cultural context, individual values, and personal experience. In this region, religion plays a significant role in shaping societal norms, ethical values, and community cohesion. For individuals like myself, religion serves the purpose of making sense of life in this world, providing guidance on moral conduct, and offering a sense of belonging within the community. Additionally, the socioeconomic background and cultural relativism also play a role in shaping this perspective, as the working class in Qaliubiya may find comfort and support in religious beliefs amidst economic challenges and societal pressures. \n\n2"]}, {"persona": {"region": "Qaliubiya", "sex": "male", "age": 62, "country": "Egypt", "marital_status": "married", "education": "higher", "social_class": "lower middle class"}, "question": {"id": "Q175", "variant": 0}, "response": ["Based on the anthropological framework, my answer is influenced by my emic perspective as a married male from Qaliubiya, Egypt, as well as my individual values and personal experiences. In our cultural context, religion plays a significant role in providing guidance and meaning in our lives. As part of the lower middle class, socioeconomic background also influences my perspective, as religion often provides a sense of community and support in times of need. Additionally, age and education level have influenced my understanding of the purpose of religion. Therefore, I choose option (2) - To make sense of life in this world.\n\n2"]}, {"persona": {"region": "Qaliubiya", "sex": "male", "age": 29, "country": "Egypt", "marital_status": "married", "education": "middle", "social_class": "working class"}, "question": {"id": "Q175", "variant": 0}, "response": ["Based on the anthropological framework, as a married male from Qaliubiya, Egypt, my emic perspective on the purpose of religion is heavily influenced by my cultural context, individual values, and socioeconomic background. In my community, religion plays a central role in providing meaning and guidance in everyday life, as well as offering hope and solace for the afterlife. Additionally, my personal experience and values have shaped my understanding of the purpose of religion, as it helps me navigate the challenges and uncertainties of daily life. Considering my working-class background and middle education level, religion serves as a source of comfort and support in the face of economic and social struggles. Therefore, my perspective on the purpose of religion is to make sense of life in this world.\n\n2"]}, {"persona": {"region": "Qaliubiya", "sex": "female", "age": 42, "country": "Egypt", "marital_status": "married", "education": "higher", "social_class": "working class"}, "question": {"id": "Q175", "variant": 0}, "response": ["Based on the anthropological framework, as a married female from Qaliubiya, Egypt, my emic perspective and cultural context lead me to understand that religion plays a crucial role in making sense of life in this world. In my community, religion provides guidance, moral values, and a sense of purpose for individuals in their day to day lives. Additionally, my individual values and personal experiences, along with my socioeconomic background as part of the working class, have shaped my understanding that religion serves as a source of comfort and hope in the face of life's challenges. Furthermore, cultural relativism teaches me to respect and understand the diverse ways in which religion is practiced and understood, and the nuances of my community also lead me to believe that the purpose of religion is deeply rooted in making sense of life in this world.\n\n2"]}, {"persona": {"region": "Qaliubiya", "sex": "female", "age": 50, "country": "Egypt", "marital_status": "married", "education": "middle", "social_class": "lower middle class"}, "question": {"id": "Q175", "variant": 0}, "response": ["Based on the anthropological framework, my response to the question of the purpose of religion is influenced by my cultural context, individual values and personal experience, and socioeconomic background. As a married female from Qaliubiya, Egypt, my understanding of religion is deeply rooted in my upbringing and cultural beliefs. In my community, religion serves the purpose of making sense of life in this world, providing guidance and moral principles for daily living, and offering a sense of community and belonging. Additionally, as someone from the lower middle class, religion also plays a role in providing hope and solace in the face of economic challenges and social inequalities. Therefore, my perspective aligns with option (2) - To make sense of life in this world.\n\n2"]}, {"persona": {"region": "Qaliubiya", "sex": "male", "age": 29, "country": "Egypt", "marital_status": "married", "education": "higher", "social_class": "lower middle class"}, "question": {"id": "Q175", "variant": 0}, "response": ["Based on the anthropological framework, as a married male from Qaliubiya, Egypt, my emic perspective on the purpose of religion is heavily influenced by my cultural context and individual values. In our community, religion plays a crucial role in making sense of life in this world, providing guidance on moral and ethical behavior, and offering a sense of community and belonging. Additionally, my personal experience and socioeconomic background as part of the lower middle class have shaped my understanding of the importance of religion in providing hope and support in the face of economic challenges. Therefore, from this perspective, I choose option (2) to make sense of life in this world. \n\n2"]}, {"persona": {"region": "Qaliubiya", "sex": "male", "age": 35, "country": "Egypt", "marital_status": "married", "education": "higher", "social_class": "working class"}, "question": {"id": "Q175", "variant": 0}, "response": ["Based on the anthropological framework, as a married male from Qaliubiya, Egypt, my emic perspective on the purpose of religion is deeply rooted in the cultural context of my community. In Egypt, religion is a central part of daily life, shaping not only our beliefs about the afterlife but also providing guidance and structure for how we live in this world. My personal values and experiences, as well as my socioeconomic background as a working-class individual, have further shaped my understanding of religion as a means of finding purpose and meaning in the challenges and joys of everyday life. Additionally, the cultural relativism of my community emphasizes the importance of religion in both the spiritual and practical aspects of life. Therefore, from my perspective, the purpose of religion is to make sense of life in this world.\n\n2"]}, {"persona": {"region": "Qaliubiya", "sex": "female", "age": 40, "country": "Egypt", "marital_status": "married", "education": "middle", "social_class": "working class"}, "question": {"id": "Q175", "variant": 0}, "response": ["As a married female from Qaliubiya, Egypt, my perspective on the purpose of religion is heavily influenced by my cultural context and personal experience. In Egypt, religion plays a significant role in everyday life, shaping social norms, family dynamics, and moral values. It provides a framework for understanding and navigating the challenges of this world, including the importance of community, charity, and ethical behavior. Additionally, religion also offers a sense of hope and purpose, providing comfort and guidance in times of difficulty. Therefore, from my emic perspective, I believe that the purpose of religion is to make sense of life in this world.\n\n2"]}, {"persona": {"region": "Qaliubiya", "sex": "female", "age": 48, "country": "Egypt", "marital_status": "divorced", "education": "lower", "social_class": "working class"}, "question": {"id": "Q175", "variant": 0}, "response": ["In the cultural context of Qaliubiya, Egypt, religion plays a pivotal role in everyday life. As a divorced female from a working-class background with lower education, my personal experience and individual values have been shaped by the role of religion in providing a sense of community and moral guidance. Additionally, the cultural relativism of Egypt means that religion is deeply intertwined with social and familial structures, providing a framework for understanding and navigating societal expectations. Considering the emic perspective of the community, the purpose of religion is not solely focused on life after death, but rather on making sense of life in this world, providing a moral compass and a sense of belonging within the community.\n\n2"]}, {"persona": {"region": "Qaliubiya", "sex": "male", "age": 46, "country": "Egypt", "marital_status": "married", "education": "middle", "social_class": "working class"}, "question": {"id": "Q175", "variant": 0}, "response": ["Based on the anthropological framework, my answer to the question of the purpose of religion is influenced by my cultural context, individual values, and personal experience. As a married male from Qaliubiya, Egypt, I have been brought up in a society where religion plays a central role in shaping our understanding of the world. My personal experience and values also lead me to believe that the purpose of religion is to make sense of life in this world, as it provides guidance and moral framework for how to live a fulfilling and meaningful life.\n\n2"]}, {"persona": {"region": "Qaliubiya", "sex": "male", "age": 47, "country": "Egypt", "marital_status": "married", "education": "higher", "social_class": "lower middle class"}, "question": {"id": "Q175", "variant": 0}, "response": ["From an anthropological perspective, as a married male from Qaliubiya, Egypt, my understanding of the purpose of religion is influenced by my cultural context, individual values, and socioeconomic background. In Egypt, religion plays a significant role in everyday life and is deeply intertwined with cultural practices and rituals. As a member of the lower middle class, I have observed that religion often serves as a source of comfort and guidance, providing a sense of community and support. Additionally, my personal experience and values lead me to believe that the purpose of religion is to make sense of life in this world, as it provides a moral compass, a framework for understanding the complexities of existence, and a source of hope in the face of adversity.\n\n2"]}, {"persona": {"region": "Qaliubiya", "sex": "female", "age": 38, "country": "Egypt", "marital_status": "married", "education": "higher", "social_class": "working class"}, "question": {"id": "Q175", "variant": 0}, "response": ["In the cultural context of Qaliubiya, Egypt, religion plays a pivotal role in people's lives. The majority of the population is Muslim, and their cultural and religious beliefs heavily influence their understanding of the purpose of religion. As a married female who completed higher education and considers herself part of the working class, my individual values and personal experiences have shaped my understanding that religion serves the purpose of making sense of life in this world. In my community, religion provides guidance on moral and ethical behavior, offers a sense of community and belonging, and provides a framework for understanding the challenges and joys of everyday life. Additionally, the emphasis on charity and compassion in Islam resonates with the values of the working class, emphasizing the importance of caring for others and contributing to the community. \n\n2"]}, {"persona": {"region": "Qaliubiya", "sex": "male", "age": 58, "country": "Egypt", "marital_status": "married", "education": "middle", "social_class": "working class"}, "question": {"id": "Q175", "variant": 0}, "response": ["From the perspective of a married male from Qaliubiya, Egypt, with a middle education level and part of the working class, the cultural context plays a pivotal role in understanding the purpose of religion. In this region, religion is deeply ingrained in the cultural fabric and serves as a guiding force in daily life. The socioeconomic background also influences the understanding of religion, as it provides a sense of community and support within the working class. Additionally, individual values and personal experiences shape the perception of religion, as it provides a sense of purpose and direction in life. From this perspective, the purpose of religion is to make sense of life in this world.\n\n2"]}, {"persona": {"region": "Qaliubiya", "sex": "female", "age": 27, "country": "Egypt", "marital_status": "married", "education": "higher", "social_class": "working class"}, "question": {"id": "Q175", "variant": 0}, "response": ["Based on the anthropological framework, as a married female from Qaliubiya, Egypt, my emic perspective on the purpose of religion is heavily influenced by my cultural context and personal experience. In Egypt, religion is deeply intertwined with daily life and societal norms, and it plays a significant role in shaping individual values and perceptions. Additionally, my working-class background and higher education level have also shaped my understanding of the purpose of religion in this world, as it is often seen as a source of guidance, community, and moral compass in navigating life's challenges. Therefore, my choice is:\n\n2"]}, {"persona": {"region": "Qaliubiya", "sex": "female", "age": 48, "country": "Egypt", "marital_status": "married", "education": "middle", "social_class": "upper middle class"}, "question": {"id": "Q175", "variant": 0}, "response": ["Based on the anthropological framework, as a married female from Qaliubiya, Egypt, my emic perspective on the purpose of religion is shaped by my cultural context, individual values, and personal experience. In my community, religion serves to make sense of life in this world, as it provides moral guidance, a sense of community, and a framework for understanding the challenges and joys of everyday life. Additionally, my socioeconomic background as part of the upper middle class has allowed me to access education and opportunities that have shaped my understanding of religion as a source of guidance and support in navigating the complexities of modern life.\n\n2"]}, {"persona": {"region": "Giza", "sex": "female", "age": 19, "country": "Egypt", "marital_status": "single", "education": "middle", "social_class": "working class"}, "question": {"id": "Q175", "variant": 0}, "response": ["Based on the anthropological framework, as a single female from Giza, Egypt, my emic perspective on the purpose of religion is heavily influenced by my cultural context and personal experience. In Egyptian society, religion plays a significant role in shaping beliefs and values, and it provides a framework for understanding the world and one's place in it. Religion also serves as a source of comfort and guidance, especially for those in the working class, like myself, who may face economic and social challenges. Additionally, the concept of life after death is deeply ingrained in Egyptian religious beliefs, so for me, the purpose of religion is to make sense of life after death. \n\n1"]}, {"persona": {"region": "Giza", "sex": "female", "age": 38, "country": "Egypt", "marital_status": "married", "education": "higher", "social_class": "lower middle class"}, "question": {"id": "Q175", "variant": 0}, "response": ["Based on the anthropological framework, my perspective as a married female from Giza, Egypt, with a lower middle class socioeconomic background, is influenced by my cultural context, individual values, and personal experience. In Egypt, religion plays a central role in daily life and community values. It provides a framework for understanding and navigating the challenges and successes of this world, shaping moral and ethical behavior, and offering guidance on how to live a fulfilling life. Given my personal experience and cultural context, I would choose option (2) To make sense of life in this world.\n\n2"]}, {"persona": {"region": "Beni Swaif/Beni Suef", "sex": "female", "age": 34, "country": "Egypt", "marital_status": "divorced", "education": "higher", "social_class": "lower class"}, "question": {"id": "Q175", "variant": 0}, "response": ["Based on the anthropological framework, as a divorced female from Beni Suef, Egypt, my emic perspective on the purpose of religion is heavily influenced by my cultural context and individual values. In my community, religion plays a crucial role in providing guidance and support, especially in difficult times such as divorce. As part of the lower class, religion also serves as a source of hope and comfort in the face of economic struggles. Additionally, my personal experience has shown me that religion helps to make sense of life in this world by providing moral guidance, community support, and a sense of purpose. Therefore, my answer to the question is:\n2"]}, {"persona": {"region": "Beni Swaif/Beni Suef", "sex": "male", "age": 20, "country": "Egypt", "marital_status": "single", "education": "higher", "social_class": "working class"}, "question": {"id": "Q175", "variant": 0}, "response": ["In the cultural context of Beni Suef, Egypt, religion plays a pivotal role in the everyday lives of individuals, including myself, as it is deeply intertwined with the cultural fabric of the region. The emic perspective of the working class in this area reflects a strong emphasis on the purpose of religion in making sense of life in this world. The socioeconomic background of the working class in Beni Suef influences the emphasis on religion as a means of finding comfort, guidance, and meaning in the face of daily struggles and challenges. Additionally, the individual values and personal experience of individuals in this context contribute to the belief that religion serves the purpose of providing moral guidance and a sense of community support. Therefore, from this perspective, the purpose of religion is to make sense of life in this world.\n\n2"]}, {"persona": {"region": "Giza", "sex": "male", "age": 19, "country": "Egypt", "marital_status": "single", "education": "middle", "social_class": "upper middle class"}, "question": {"id": "Q175", "variant": 0}, "response": ["From an emic perspective, as a single male from Giza, Egypt, I have been raised in a cultural context where religion is a fundamental part of daily life and societal values. The Islamic faith is deeply ingrained in the fabric of our society, and it plays a crucial role in shaping our worldview and understanding of the world. Personally, my individual values and personal experiences have also been shaped by the teachings of Islam, and I have been taught that the purpose of religion is to make sense of life in this world. This belief is further reinforced by the socioeconomic background I come from, where religion serves as a guiding force in navigating the complexities of life and providing a moral compass in the pursuit of success and fulfillment. Additionally, cultural relativism and the nuance of the question also influence my understanding, as the emphasis on the present life in Islam is a core belief that resonates deeply within me.\n\n2"]}, {"persona": {"region": "Giza", "sex": "female", "age": 33, "country": "Egypt", "marital_status": "married", "education": "middle", "social_class": "working class"}, "question": {"id": "Q175", "variant": 0}, "response": ["From the perspective of a married female from Giza, Egypt, who is 33 years old, completed middle education, and considers herself part of the working class, the purpose of religion is deeply rooted in the cultural context and personal experience. In Egypt, religion plays a central role in everyday life, providing a framework for understanding the world and one's place in it. For many in this socio-economic background, religion serves as a source of guidance, comfort, and community, helping individuals navigate the challenges of daily life. It also provides a sense of purpose, offering hope and meaning in the face of adversity. Additionally, the cultural context of Egypt places a strong emphasis on the afterlife and the role of religion in preparing for what comes next. Therefore, the purpose of religion, from this perspective, is to make sense of life after death.\n\n2"]}, {"persona": {"region": "Giza", "sex": "female", "age": 24, "country": "Egypt", "marital_status": "married", "education": "higher", "social_class": "working class"}, "question": {"id": "Q175", "variant": 0}, "response": ["Based on my emic perspective as a married female from Giza, Egypt, I understand the purpose of religion as a means to make sense of life in this world. The cultural context of my upbringing and the influence of Islam in my community have taught me that religion provides guidance and moral principles for navigating daily life. My personal experience and values also reinforce this understanding, as I have witnessed how religion shapes social and ethical norms within my community. Additionally, my socioeconomic background as a working-class individual has instilled in me the belief that religion serves as a source of comfort and solidarity in the face of life's challenges. Therefore, from my nuanced perspective, I would argue that the purpose of religion is to make sense of life in this world.\n\n2"]}, {"persona": {"region": "Giza", "sex": "male", "age": 50, "country": "Egypt", "marital_status": "married", "education": "higher", "social_class": "working class"}, "question": {"id": "Q175", "variant": 0}, "response": ["From the emic perspective, as a married male from Giza, Egypt, religion plays a crucial role in making sense of life in this world. The cultural context in Egypt is deeply intertwined with religious beliefs and practices, and as an individual with higher education and part of the working class, I have observed how religion permeates everyday life, shaping societal norms and values. My personal experience and values are also influenced by this cultural context, and I have seen how religion provides a framework for understanding social, ethical, and moral issues. Additionally, the socioeconomic background of being part of the working class in Egypt further emphasizes the importance of religion in providing a sense of purpose and guidance in navigating life's challenges. Therefore, from this perspective, the purpose of religion is to make sense of life in this world.\n\n2"]}, {"persona": {"region": "Beni Swaif/Beni Suef", "sex": "female", "age": 26, "country": "Egypt", "marital_status": "married", "education": "higher", "social_class": "lower middle class"}, "question": {"id": "Q175", "variant": 0}, "response": ["Based on the anthropological framework, as a woman from Beni Suef, Egypt, my cultural context and personal experience have shaped my understanding of the purpose of religion. In my community, religion plays a crucial role in providing a framework for understanding life in this world. It guides our daily actions, moral decisions, and interactions with others. Additionally, my lower middle class socioeconomic background has influenced my belief that religion serves as a source of hope and guidance in navigating the challenges and struggles of everyday life. Therefore, I choose option (2) to make sense of life in this world. \n\n2"]}, {"persona": {"region": "Beni Swaif/Beni Suef", "sex": "male", "age": 40, "country": "Egypt", "marital_status": "single", "education": "lower", "social_class": "lower class"}, "question": {"id": "Q175", "variant": 0}, "response": ["Based on my emic perspective, as a lower class individual from Beni Swaif/Beni Suef, Egypt, my understanding of the purpose of religion is heavily influenced by my cultural context and personal experience. In my community, religion plays a crucial role in providing hope and comfort in the face of economic struggles and social inequality. It helps us make sense of our daily hardships and provides a sense of community and support. Additionally, my socioeconomic background and lower education level have shaped my understanding of religion as a source of guidance and moral values. Therefore, from my perspective, the purpose of religion is to make sense of life in this world.\n\n2"]}, {"persona": {"region": "Beni Swaif/Beni Suef", "sex": "female", "age": 25, "country": "Egypt", "marital_status": "married", "education": "middle", "social_class": "lower middle class"}, "question": {"id": "Q175", "variant": 0}, "response": ["Based on the anthropological framework, my perspective as a married female from Beni Suef, Egypt would be heavily influenced by my cultural context, individual values, and socioeconomic background. Religion plays a significant role in the daily life of my community, and as a member of the lower middle class, it provides a sense of guidance and purpose in navigating the challenges of life. Additionally, my personal experience and values have been shaped by the teachings of religion, emphasizing the importance of faith and community support. Therefore, my choice would be:\n\n2. To make sense of life in this world"]}, {"persona": {"region": "Beni Swaif/Beni Suef", "sex": "female", "age": 21, "country": "Egypt", "marital_status": "single", "education": "middle", "social_class": "lower middle class"}, "question": {"id": "Q175", "variant": 0}, "response": ["From the perspective of a single female from Beni Suef, Egypt, the cultural context plays a significant role in understanding the purpose of religion. In this region, religion is deeply ingrained in daily life and provides a sense of community and belonging. Individual values and personal experience are also crucial, as religion serves as a source of guidance and moral compass in navigating societal expectations and personal challenges. Additionally, socioeconomic background, such as being part of the lower middle class, influences the perception of religion as a source of hope and comfort in the face of economic struggles. Cultural relativism is also important to consider, as the understanding of religion is shaped by the cultural norms and practices within the community. Therefore, the purpose of religion from this perspective is to make sense of life in this world.\n\n2"]}, {"persona": {"region": "Beni Swaif/Beni Suef", "sex": "male", "age": 48, "country": "Egypt", "marital_status": "married", "education": "middle", "social_class": "lower middle class"}, "question": {"id": "Q175", "variant": 0}, "response": ["Based on the anthropological framework, my perspective as a 48-year-old married male from Beni Swaif, Egypt, with a middle education level and lower middle-class background is influenced by my cultural context, individual values, and personal experience. In my community, religion serves the purpose of making sense of life in this world, providing moral guidance, and offering a sense of community and belonging. It also plays a crucial role in shaping societal norms and values, and serves as a source of comfort and hope in the face of everyday challenges and hardships. Therefore, from my perspective, the purpose of religion is to make sense of life in this world.\n\n2"]}, {"persona": {"region": "Beni Swaif/Beni Suef", "sex": "female", "age": 57, "country": "Egypt", "marital_status": "married", "education": "middle", "social_class": "working class"}, "question": {"id": "Q175", "variant": 0}, "response": ["In my cultural context, religion serves as a crucial aspect of everyday life and plays a significant role in shaping our values and beliefs. As a married female from Beni Swaif, Egypt, at 57 years of age with a middle education level and a working-class background, I have been socialized to perceive religion as a means of making sense of life in this world. It provides moral guidance, a sense of community, and a framework for understanding and navigating the challenges and joys of daily life. Additionally, religion offers a source of comfort and hope in the face of adversity, which is particularly relevant in our socioeconomic context where the working class often faces numerous hardships. Therefore, from my emic perspective, the purpose of religion is to make sense of life in this world.\n\n2"]}, {"persona": {"region": "Beni Swaif/Beni Suef", "sex": "male", "age": 20, "country": "Egypt", "marital_status": "single", "education": "middle", "social_class": "working class"}, "question": {"id": "Q175", "variant": 0}, "response": ["From the emic perspective, as a single male from Beni Swaif, Egypt, I have grown up in a cultural context where religion plays a significant role in daily life. The majority of people around me adhere to Islamic beliefs, and this cultural context has shaped my understanding of the purpose of religion. My individual values and personal experiences have also influenced my perception of religion, as I have been taught from a young age that religion serves the purpose of guiding individuals in their everyday lives, providing a moral compass, and fostering a sense of community and belonging. Additionally, my socioeconomic background as a working-class individual has further reinforced the importance of religion in providing a sense of hope and purpose in the face of economic challenges. Taking into account the cultural relativism and the nuanced understanding of the question, I would choose option (2) To make sense of life in this world. \n\n2"]}, {"persona": {"region": "Giza", "sex": "female", "age": 59, "country": "Egypt", "marital_status": "married", "education": "higher", "social_class": "upper middle class"}, "question": {"id": "Q175", "variant": 0}, "response": ["From the perspective of a married female from Giza, Egypt, who is 59 years old and part of the upper middle class, the purpose of religion is deeply rooted in the cultural context of Egypt. Religion serves the purpose of making sense of life in this world, as it is intertwined with daily practices, traditions, and values. As someone who has completed higher education, I understand the importance of religion in shaping societal norms and providing a moral compass for individuals. Additionally, my socioeconomic background has allowed me to observe how religion influences the social structure and relationships within my community. Therefore, I believe that the purpose of religion, from my perspective, is to provide guidance and meaning in this life and to shape the cultural fabric of society.\n\n2"]}, {"persona": {"region": "Giza", "sex": "female", "age": 38, "country": "Egypt", "marital_status": "single", "education": "higher", "social_class": "lower middle class"}, "question": {"id": "Q175", "variant": 0}, "response": ["Based on the anthropological framework of emic and etic perspectives, cultural context, individual values and personal experience, socioeconomic background, cultural relativism, space and time, and nuance, my answer to the question of the purpose of religion is influenced by my personal experiences and cultural context as a single female from Giza, Egypt. In my community, religion plays a significant role in making sense of life in this world. It provides guidance, moral values, and a sense of community and belonging. Additionally, as someone from the lower middle class, religion also serves as a source of hope and comfort in the face of economic challenges and social inequalities. Therefore, based on my perspective, I believe that the purpose of religion is to make sense of life in this world.\n\n2"]}, {"persona": {"region": "Giza", "sex": "female", "age": 26, "country": "Egypt", "marital_status": "single", "education": "higher", "social_class": "working class"}, "question": {"id": "Q175", "variant": 0}, "response": ["From the perspective of a single female from Giza, Egypt, with a working-class background, cultural context plays a pivotal role in understanding the purpose of religion. In this context, religion is deeply intertwined with everyday life, providing a sense of community, moral guidance, and a framework for understanding one's place in the world. Personal experience and individual values also shape the understanding of religion, as it offers a source of comfort, hope, and guidance in the face of economic challenges and social pressures. Additionally, the cultural relativism inherent in this perspective emphasizes the importance of recognizing that the purpose of religion may vary across different societies and contexts, and that there is no singular, universal answer. \n\n2"]}, {"persona": {"region": "Giza", "sex": "male", "age": 39, "country": "Egypt", "marital_status": "married", "education": "middle", "social_class": "working class"}, "question": {"id": "Q175", "variant": 0}, "response": ["From an emic perspective, as a married male from Giza, Egypt, my cultural context and personal experience have shaped my understanding of the purpose of religion. In Egypt, religion is deeply embedded in our daily lives and is a central aspect of our cultural identity. As a member of the working class, I have witnessed how religion provides a sense of community and support, especially during times of hardship. My individual values and personal experiences have shown me that religion serves to make sense of life in this world, providing moral guidance, a sense of purpose, and a framework for understanding the complexities of life. Additionally, cultural relativism reminds us that different cultures have different interpretations of religion, and for me and my community, the purpose of religion is to navigate the challenges of this world and find meaning in our daily lives.\n\n2"]}, {"persona": {"region": "Giza", "sex": "male", "age": 36, "country": "Egypt", "marital_status": "married", "education": "middle", "social_class": "working class"}, "question": {"id": "Q175", "variant": 0}, "response": ["From the perspective of a married male from Giza, Egypt, who is 36 years old, has completed middle education, and considers himself part of the working class, the answer to the question of the purpose of religion is influenced by a combination of cultural context, individual values, and socioeconomic background. In Egypt, religion plays a central role in everyday life, providing a sense of community, moral guidance, and a framework for social interactions. As a working-class individual, the importance of religion may also be tied to seeking solace and hope in the face of economic challenges and societal pressures. Furthermore, the cultural context of Egypt, with its rich history and tradition of religious practices, would likely emphasize the role of religion in making sense of life in this world rather than solely focusing on the afterlife. Therefore, the purpose of religion from this perspective is to make sense of life in this world.\n\n2"]}, {"persona": {"region": "Giza", "sex": "female", "age": 30, "country": "Egypt", "marital_status": "single", "education": "higher", "social_class": "lower class"}, "question": {"id": "Q175", "variant": 0}, "response": ["Based on the anthropological framework, as a single female from Giza, Egypt, who is 30 years old, completed higher education, and considers herself part of the lower class, my perspective on the purpose of religion is deeply influenced by my cultural context, individual values, and personal experience. In Egyptian society, religion plays a significant role in providing a framework for understanding and navigating the challenges of daily life, including social and economic disparities. As a member of the lower class, religion often serves as a source of comfort and hope, offering a sense of purpose and meaning in the face of adversity. Therefore, from my perspective, the purpose of religion is (2) To make sense of life in this world."]}, {"persona": {"region": "Giza", "sex": "female", "age": 24, "country": "Egypt", "marital_status": "single", "education": "higher", "social_class": "lower class"}, "question": {"id": "Q175", "variant": 0}, "response": ["In my cultural context, religion plays a significant role in shaping our daily lives and providing a framework for understanding the world around us. As a lower-class single female from Giza, Egypt, my individual values and personal experiences have shown me that religion is essential for making sense of life in this world. It provides guidance, a sense of community, and a moral compass to navigate the challenges of everyday life. Additionally, my socioeconomic background has influenced my understanding that religion serves as a source of hope and support in the face of economic struggles and social inequality. Therefore, from my perspective, the purpose of religion is to make sense of life in this world.\n\n2"]}, {"persona": {"region": "Giza", "sex": "male", "age": 65, "country": "Egypt", "marital_status": "married", "education": "middle", "social_class": "working class"}, "question": {"id": "Q175", "variant": 0}, "response": ["From the perspective of a married male from Giza, Egypt, who is 65 years old, has completed middle education, and considers himself part of the working class, the answer to the question of the purpose of religion would be option 2. This choice is influenced by the cultural context of Egypt, where religion plays a significant role in everyday life and is seen as a way to make sense of life in this world. Additionally, the individual's personal experience and values, shaped by the socioeconomic background and age, would lead to the prioritization of finding meaning and guidance for life in the present. The nuanced phrasing of the question also leads to this choice, as it focuses on the purpose of religion in the here and now rather than in an afterlife.\n\n2"]}, {"persona": {"region": "Giza", "sex": "female", "age": 56, "country": "Egypt", "marital_status": "married", "education": "middle", "social_class": "working class"}, "question": {"id": "Q175", "variant": 0}, "response": ["Based on my cultural context, as a married female from Giza, Egypt, religion plays a crucial role in our daily lives. It provides a framework for understanding the world and our place in it. It also helps us make sense of life after death, which is an important aspect of our religious beliefs. Additionally, my personal experience and individual values have shaped my understanding of the purpose of religion. As a member of the working class, my relationship with religion is deeply intertwined with my socioeconomic background. Therefore, the purpose of religion is not only to make sense of life in this world but also to make sense of life after death, as it is an integral part of my cultural and personal understanding of religion.\n\n2"]}, {"persona": {"region": "Giza", "sex": "male", "age": 31, "country": "Egypt", "marital_status": "married", "education": "higher", "social_class": "lower middle class"}, "question": {"id": "Q175", "variant": 0}, "response": ["In my cultural context and from my personal experience, religion serves multiple purposes. It provides a framework for understanding life after death, which is important to many people in my community. It also helps to make sense of life in this world, providing guidance on moral and ethical behavior, as well as offering a sense of community and belonging. Additionally, religion plays a role in shaping cultural practices and traditions, which are an integral part of our social fabric. Therefore, from my perspective as a married male from Giza, Egypt, who values and experiences the influence of religion in everyday life, I would choose option (2) To make sense of life in this world.\n\n2"]}, {"persona": {"region": "Giza", "sex": "male", "age": 28, "country": "Egypt", "marital_status": "single", "education": "middle", "social_class": "working class"}, "question": {"id": "Q175", "variant": 0}, "response": ["Based on the anthropological framework, as a single male from Giza, Egypt, my emic perspective on the purpose of religion is heavily influenced by my cultural context, individual values, and socioeconomic background. Religion, in my understanding, serves the purpose of making sense of life in this world. It provides guidance, moral values, and a sense of community, which are crucial in my working-class life in Giza. Additionally, my personal experience and age have shaped my beliefs, and I see religion as a way to navigate the challenges and uncertainties of daily life in my community. \n\n2"]}, {"persona": {"region": "Giza", "sex": "male", "age": 47, "country": "Egypt", "marital_status": "married", "education": "middle", "social_class": "lower middle class"}, "question": {"id": "Q175", "variant": 0}, "response": ["Based on my emic perspective as a married male from Giza, Egypt, I understand that religion plays a crucial role in our cultural context. In Egypt, religion, specifically Islam, is deeply intertwined with our daily lives, shaping our values, traditions, and social interactions. As someone from the lower middle class, I have seen how religion provides a sense of community and belonging, offering solace and guidance in times of hardship. From an etic perspective, I recognize that religion also serves to make sense of life in this world, providing moral and ethical guidelines for how we should live our lives and interact with others. Therefore, I believe that the purpose of religion is to make sense of life in this world.\n\n2"]}, {"persona": {"region": "Giza", "sex": "male", "age": 26, "country": "Egypt", "marital_status": "single", "education": "middle", "social_class": "lower middle class"}, "question": {"id": "Q175", "variant": 0}, "response": ["Based on my cultural context, as a single male from Giza, Egypt, religion plays a significant role in making sense of life in this world. As someone from a lower middle class background, religion provides guidance and moral compass in navigating the challenges and uncertainties of everyday life. My personal experience and values also shape my understanding of religion as a means of finding purpose and direction in a society that may not always offer equal opportunities. Additionally, considering the emic and etic perspectives, religion is deeply ingrained in the social and cultural fabric of my community, influencing how I view and interpret the world around me.\n\n2"]}, {"persona": {"region": "Giza", "sex": "male", "age": 48, "country": "Egypt", "marital_status": "married", "education": "middle", "social_class": "upper middle class"}, "question": {"id": "Q175", "variant": 0}, "response": ["Based on my emic perspective as a married male from Giza, Egypt, religion serves as a guide for navigating the challenges and uncertainties of life in this world. In our cultural context, religion provides a framework for understanding and interpreting daily events, as well as offering moral and ethical guidelines for personal conduct. My individual values and personal experience have taught me that religion plays a central role in shaping social interactions and community cohesion. Additionally, my socioeconomic background as part of the upper middle class has allowed me to access religious institutions and participate in religious practices that reinforce the importance of religion in my life. Furthermore, cultural relativism reminds me that different cultures have different interpretations of the purpose of religion, and I recognize that my perspective is influenced by my age and place. Therefore, I firmly believe that the purpose of religion is to make sense of life in this world.\n\n2"]}, {"persona": {"region": "Menya", "sex": "male", "age": 61, "country": "Egypt", "marital_status": "married", "education": "middle", "social_class": "working class"}, "question": {"id": "Q175", "variant": 0}, "response": ["Based on the anthropological framework, as a married male from Menya, Egypt, my cultural context and religious beliefs heavily influence my understanding of the purpose of religion. In Menya, religion plays a crucial role in shaping our daily lives and guiding our moral compass. As an individual who values the teachings of Islam and comes from a working-class background, I believe that the purpose of religion is to make sense of life in this world by providing guidance, moral principles, and a sense of community. Religion also serves as a source of comfort and hope during difficult times, and helps to maintain social order and cohesion within our community.\n\n2"]}, {"persona": {"region": "Menya", "sex": "male", "age": 41, "country": "Egypt", "marital_status": "married", "education": "middle", "social_class": "lower middle class"}, "question": {"id": "Q175", "variant": 0}, "response": ["Based on my cultural context and personal experience as a married male from Menya, Egypt, religion serves the purpose of making sense of life in this world. In my community, religion is deeply intertwined with our daily lives and provides guidance on how to navigate challenges, make moral decisions, and find meaning in our existence. As a lower middle class individual with limited formal education, religion also serves as a source of hope and comfort in the face of economic struggles and societal inequalities. Additionally, the concept of cultural relativism reminds us that different cultures have their own interpretations of religion, and in my community, the emphasis is on finding purpose and meaning in this life, rather than solely focusing on the afterlife.\n\n2"]}, {"persona": {"region": "Menya", "sex": "female", "age": 43, "country": "Egypt", "marital_status": "married", "education": "higher", "social_class": "working class"}, "question": {"id": "Q175", "variant": 0}, "response": ["In Menya, Egypt, the cultural context is highly influenced by religion and the majority of the population is Muslim. As a married female from this region, my emic perspective is that religion serves the purpose of making sense of life in this world. The teachings and practices of Islam shape our daily lives, guiding our behaviors and decisions. My personal experience and values are also influenced by this cultural context, as I have been raised with a strong belief in the importance of religious practices in shaping a meaningful and purposeful life. Additionally, my working-class socioeconomic background has further reinforced the significance of religion in providing guidance and structure in our lives. Therefore, from my perspective, the purpose of religion is to make sense of life in this world.\n\n2"]}, {"persona": {"region": "Menya", "sex": "male", "age": 57, "country": "Egypt", "marital_status": "married", "education": "middle", "social_class": "lower middle class"}, "question": {"id": "Q175", "variant": 0}, "response": ["Based on the anthropological framework, as a married male from Menya, Egypt, my understanding of the purpose of religion is heavily influenced by my cultural context and personal experience. In Menya, religion is deeply ingrained in our daily lives, providing guidance and meaning in our interactions with others and the world around us. As a member of the lower middle class, religion also plays a role in providing a sense of community and support in times of struggle. Additionally, my age and level of education have shaped my understanding of religion as a means of making sense of life in this world, as it provides moral guidance and a framework for understanding the challenges and joys of everyday life.\n\n2"]}, {"persona": {"region": "Menya", "sex": "male", "age": 42, "country": "Egypt", "marital_status": "divorced", "education": "middle", "social_class": "lower middle class"}, "question": {"id": "Q175", "variant": 0}, "response": ["From an emic perspective, as a divorced male from Menya, Egypt, my cultural context and personal experience have shaped my understanding of religion. In my community, religion plays a crucial role in making sense of life in this world, providing guidance, moral values, and a sense of community. My individual values and personal experience also lead me to believe that religion serves a purpose in offering comfort, providing a moral compass, and helping individuals navigate the challenges of everyday life. Additionally, my lower middle-class socioeconomic background has influenced my understanding of religion as a source of hope and support in the face of economic struggles. In this nuanced understanding, the purpose of religion is to make sense of life in this world, offering guidance, comfort, and a sense of community.\n\n2"]}, {"persona": {"region": "Menya", "sex": "female", "age": 59, "country": "Egypt", "marital_status": "married", "education": "middle", "social_class": "upper middle class"}, "question": {"id": "Q175", "variant": 0}, "response": ["From my emic perspective as a married woman from Menya, Egypt, I understand that religion plays a crucial role in our daily lives and in the community as a whole. The cultural context in which I live places a strong emphasis on religion, with Islam being the dominant faith. My personal experience and individual values have shaped my understanding of the purpose of religion, and I believe that it serves as a guide for moral conduct and provides a framework for understanding the complexities of life in this world. Additionally, my socioeconomic background as part of the upper middle class has allowed me to access religious education and resources, further reinforcing the significance of religion in making sense of life in this world. Ultimately, I view religion as a means of finding purpose and direction in our earthly existence.\n\n2"]}, {"persona": {"region": "Menya", "sex": "female", "age": 31, "country": "Egypt", "marital_status": "married", "education": "middle", "social_class": "working class"}, "question": {"id": "Q175", "variant": 0}, "response": ["Based on the anthropological framework, as a married female from Menya, Egypt, my emic perspective on the purpose of religion is heavily influenced by my cultural context. In Menya, religion plays a significant role in everyday life and is deeply intertwined with cultural practices. As a member of the working class, my personal experience and socioeconomic background also shape my understanding of religion. Considering the importance of religion in my community, I believe that the purpose of religion is to make sense of life in this world.\n2"]}, {"persona": {"region": "Menya", "sex": "male", "age": 55, "country": "Egypt", "marital_status": "single", "education": "middle", "social_class": "working class"}, "question": {"id": "Q175", "variant": 0}, "response": ["Based on the anthropological framework, as a single male from Menya, Egypt, my emic perspective on the purpose of religion is heavily influenced by my cultural context, individual values, and socioeconomic background. In Menya, religion is deeply intertwined with everyday life, providing a sense of community and guidance. My personal experience and middle education level have shaped my understanding of religion as a means to make sense of life in this world, to find purpose and direction, and to navigate the challenges and uncertainties of daily life. As a member of the working class, religion also serves as a source of comfort and hope in the face of socioeconomic struggles. Therefore, from my perspective, the purpose of religion is to make sense of life in this world.\n\n2"]}, {"persona": {"region": "Menya", "sex": "female", "age": 28, "country": "Egypt", "marital_status": "married", "education": "higher", "social_class": "lower middle class"}, "question": {"id": "Q175", "variant": 0}, "response": ["From an emic perspective, as a married woman from Menya, Egypt, religion holds a significant place in my life and the lives of those around me. The cultural context of Menya is deeply rooted in religious traditions, and my personal experience has shown me the importance of religion in shaping individual values and guiding daily life decisions. Additionally, my lower middle class socioeconomic background has influenced how I perceive the purpose of religion, as it provides a sense of community and support in the face of economic challenges. Furthermore, the concept of cultural relativism reminds me that different societies may have varying interpretations of the purpose of religion. Considering all these factors, I believe that the purpose of religion is to make sense of life in this world.\n\n2"]}, {"persona": {"region": "Menya", "sex": "male", "age": 24, "country": "Egypt", "marital_status": "single", "education": "middle", "social_class": "working class"}, "question": {"id": "Q175", "variant": 0}, "response": ["From an emic perspective, as a single male from Menya, Egypt, my cultural context and personal experience play a significant role in understanding the purpose of religion. Religion is deeply embedded in the cultural fabric of Menya, and it shapes our understanding of life and death. In my socioeconomic background as part of the working class, religion serves as a source of comfort and guidance in the face of economic challenges and uncertainty. Additionally, my age and educational level also influence my perception of religion, as I have been exposed to certain religious teachings and beliefs throughout my life. Furthermore, cultural relativism reminds me that the purpose of religion is subjective and cannot be judged based on an outsider's perspective. Therefore, my understanding leads me to choose option (2) To make sense of life in this world.\n\n2"]}, {"persona": {"region": "Menya", "sex": "female", "age": 23, "country": "Egypt", "marital_status": "married", "education": "middle", "social_class": "working class"}, "question": {"id": "Q175", "variant": 0}, "response": ["Based on my cultural context as a married female from Menya, Egypt, religion plays a pivotal role in my life. It provides a framework for understanding the world around me and offers guidance for how to live a moral and fulfilling life. My personal experience and values also influence my view of religion, as it provides a sense of community and support within my working-class background. Additionally, the cultural relativism perspective reminds me that my understanding of religion may differ from others, and that is okay. Finally, the nuance of the question leads me to choose option (2) as the purpose of religion is to make sense of life in this world.\n\n2"]}, {"persona": {"region": "Menya", "sex": "male", "age": 27, "country": "Egypt", "marital_status": "single", "education": "middle", "social_class": "lower middle class"}, "question": {"id": "Q175", "variant": 0}, "response": ["From the perspective of a single male from Menya, Egypt, at 27 years of age and part of the lower middle class, the cultural context and individual values play a significant role in shaping my understanding and answer to the question of the purpose of religion. In Menya, religion is deeply ingrained in the cultural fabric, and it serves as a guiding force in making sense of life in this world. The socioeconomic background also influences this perspective, as religion may provide a sense of community and support for individuals in lower socioeconomic strata. Additionally, the nuanced phrasing of the question and the emic perspective of being part of the community in Menya lead me to choose option (2) To make sense of life in this world.\n\n2"]}, {"persona": {"region": "Asyut", "sex": "male", "age": 30, "country": "Egypt", "marital_status": "married", "education": "middle", "social_class": "working class"}, "question": {"id": "Q175", "variant": 0}, "response": ["Based on the anthropological framework, as a married male from Asyut, Egypt, my emic perspective on the purpose of religion is heavily influenced by my cultural context and personal experience. In our community, religion plays a central role in guiding moral behavior, providing a sense of community and belonging, and offering guidance for navigating the challenges of life. Additionally, my socioeconomic background as a working-class individual has shaped my understanding of religion as a source of hope and support in the face of economic struggles. Therefore, I believe the purpose of religion is to make sense of life in this world.\n\n2"]}, {"persona": {"region": "Asyut", "sex": "female", "age": 26, "country": "Egypt", "marital_status": "married", "education": "middle", "social_class": "working class"}, "question": {"id": "Q175", "variant": 0}, "response": ["Based on my cultural context as a married female from Asyut, Egypt, religion plays a significant role in our society. It shapes our values, traditions, and daily practices. As a member of the working class, my socioeconomic background also influences how I perceive the purpose of religion. Additionally, my personal experience and individual values have been shaped by the teachings and beliefs of my religion. Therefore, I believe the purpose of religion is to make sense of life in this world.\n\n2"]}, {"persona": {"region": "Asyut", "sex": "male", "age": 32, "country": "Egypt", "marital_status": "single", "education": "higher", "social_class": "lower middle class"}, "question": {"id": "Q175", "variant": 0}, "response": ["From an emic perspective, as a single male from Asyut, Egypt, religion is deeply embedded in my cultural context. The majority of the population in Asyut is Muslim, and religion plays a significant role in shaping the values, beliefs, and practices of the community. My personal experience and individual values are influenced by the teachings of Islam, guiding me in my daily life and interactions with others. Additionally, being part of the lower middle class, religion also provides a sense of community and support, especially in times of economic hardship. Considering the cultural relativism, it is important to understand that for many in Asyut, religion is not just a means to make sense of life after death, but it also serves to make sense of life in this world, providing guidance and moral compass in navigating the challenges of everyday life.\n\n2"]}, {"persona": {"region": "Asyut", "sex": "female", "age": 21, "country": "Egypt", "marital_status": "married", "education": "middle", "social_class": "working class"}, "question": {"id": "Q175", "variant": 0}, "response": ["Based on the anthropological framework, as a married female from Asyut, Egypt, my cultural context and personal experience have shaped my understanding of the purpose of religion. In my community, religion is deeply intertwined with everyday life and provides a sense of purpose and guidance. As part of the working class, religion plays a crucial role in providing a moral compass and offering comfort in times of struggle. Additionally, in my cultural context, the purpose of religion is not only to make sense of life after death but also to make sense of life in this world. It provides a framework for understanding and navigating the complexities of daily existence. Therefore, I believe that option (2) To make sense of life in this world is the most accurate reflection of my perspective.\n\n2"]}, {"persona": {"region": "Asyut", "sex": "female", "age": 30, "country": "Egypt", "marital_status": "married", "education": "higher", "social_class": "working class"}, "question": {"id": "Q175", "variant": 0}, "response": ["Based on my emic perspective as a married female from Asyut, Egypt, I understand that religion serves the purpose of making sense of life in this world. In my cultural context, religion is deeply intertwined with daily life, providing guidance, moral values, and a sense of community. My personal experience and individual values also shape my understanding of the purpose of religion, as it provides a source of comfort, hope, and a framework for living a meaningful life. Additionally, my socioeconomic background as a working-class woman influences my perspective, as religion offers a sense of belonging and support in the face of economic challenges. Furthermore, cultural relativism is crucial in understanding that religion may serve different purposes for different individuals and communities. Finally, space and time, as well as the nuanced phrasing of the question, also play a role in shaping my perspective.\n\n2"]}, {"persona": {"region": "Asyut", "sex": "female", "age": 42, "country": "Egypt", "marital_status": "married", "education": "higher", "social_class": "lower middle class"}, "question": {"id": "Q175", "variant": 0}, "response": ["Based on the anthropological framework, as a married female from Asyut, Egypt, my understanding of the purpose of religion is heavily influenced by my cultural context and personal experiences. In Egypt, religion is deeply intertwined with everyday life and plays a significant role in shaping social norms and values. As someone who is part of the lower middle class, religion also serves as a source of comfort and community support. Additionally, my higher education level has provided me with a nuanced understanding of the complexities of religion and its various interpretations. Therefore, I believe that the purpose of religion is to make sense of life in this world, as it provides guidance, moral principles, and a sense of belonging within my community.\n\n2"]}, {"persona": {"region": "Sohag", "sex": "male", "age": 63, "country": "Egypt", "marital_status": "married", "education": "middle", "social_class": "lower middle class"}, "question": {"id": "Q175", "variant": 0}, "response": ["In my cultural context, religion plays a significant role in providing answers to the purpose of life. As a married male from Sohag, Egypt, age 63, and part of the lower middle class, I have been brought up in a society where religion is a central aspect of daily life. My personal experience and values have been shaped by the teachings of Islam, and my socioeconomic background has influenced my understanding of the purpose of religion. Furthermore, the cultural relativism in my community emphasizes the importance of religion in providing guidance and meaning to life. Therefore, from my perspective, the purpose of religion is to make sense of life in this world.\n\n2"]}, {"persona": {"region": "Sohag", "sex": "male", "age": 27, "country": "Egypt", "marital_status": "married", "education": "middle", "social_class": "working class"}, "question": {"id": "Q175", "variant": 0}, "response": ["From the perspective of a married male from Sohag, Egypt, who is 27 years old and part of the working class with a middle education level, the purpose of religion is deeply rooted in his cultural context and personal experience. In Sohag, religion is a central aspect of daily life and influences social, political, and economic aspects of society. As a member of the working class, he may view religion as a source of comfort and hope in the face of economic challenges and social inequalities. In addition, his personal experience and upbringing in a predominantly Islamic society would lead him to believe that the purpose of religion is to make sense of life in this world, as it provides guidance, moral principles, and a sense of community in the midst of life's struggles.\n\n2"]}, {"persona": {"region": "Sohag", "sex": "male", "age": 56, "country": "Egypt", "marital_status": "married", "education": "higher", "social_class": "upper middle class"}, "question": {"id": "Q175", "variant": 0}, "response": ["From the perspective of a married male from Sohag, Egypt, who is 56 years old, has completed higher education, and considers himself part of the upper middle class, the purpose of religion is deeply intertwined with cultural context, individual values, and personal experience. In Sohag, religion is a fundamental aspect of daily life, shaping social norms, family structures, and moral values. The emic perspective of this individual would prioritize the role of religion in providing guidance and meaning in this world, as it influences every aspect of their life, from work to family to community interactions. Additionally, the etic perspective acknowledges the broader societal emphasis on religious practices and beliefs, highlighting the interconnectedness of religion with communal identity and societal values. Therefore, the purpose of religion for this individual is to make sense of life in this world.\n\n2"]}, {"persona": {"region": "Sohag", "sex": "male", "age": 51, "country": "Egypt", "marital_status": "married", "education": "higher", "social_class": "lower middle class"}, "question": {"id": "Q175", "variant": 0}, "response": ["Based on my cultural context as a married male from Sohag, Egypt, religion plays a critical role in our society. The emic perspective of religion is deeply ingrained in our daily lives, with the etic perspective often being misunderstood by outsiders. Our cultural context, with its strong ties to Islam, shapes our understanding of the purpose of religion. Personal experience and individual values also play a significant role, especially as someone who has completed higher education and considers myself part of the lower middle class. Socioeconomic background and cultural relativism further influence our understanding of religion. In this context, the purpose of religion is to make sense of life in this world, as it guides our moral and ethical compass and provides a framework for social interactions and community cohesion.\n\n2\n\nI chose option 2 based on the cultural context and personal experience of being a married male from Sohag, Egypt, who has completed higher education and considers myself part of the lower middle class. Religion, particularly Islam, plays a significant role in our society and serves the purpose of making sense of life in this world. Our understanding is deeply rooted in our cultural context and nuanced understanding of the role of religion in shaping our daily lives."]}, {"persona": {"region": "Sohag", "sex": "female", "age": 26, "country": "Egypt", "marital_status": "married", "education": "higher", "social_class": "working class"}, "question": {"id": "Q175", "variant": 0}, "response": ["Based on the anthropological framework, as a married female from Sohag, Egypt, my emic perspective is heavily influenced by my cultural context, individual values, and personal experience. Religion plays a crucial role in my daily life and understanding of the world. It provides a framework for making sense of life in this world, guiding my moral and ethical decisions, and shaping my community and social interactions. Additionally, my socioeconomic background as part of the working class in Egypt has also shaped the importance of religion in providing hope and guidance in the face of economic challenges. Therefore, the purpose of religion, from my perspective, is to make sense of life in this world.\n\n2"]}, {"persona": {"region": "Sohag", "sex": "female", "age": 29, "country": "Egypt", "marital_status": "married", "education": "higher", "social_class": "upper middle class"}, "question": {"id": "Q175", "variant": 0}, "response": ["From an emic perspective, as a married female from Sohag, Egypt, my understanding of the purpose of religion is deeply rooted in my cultural context. In my community, religion is a central aspect of life and provides a framework for understanding and navigating the world. It is not just about making sense of life after death, but also about making sense of life in this world. Religion shapes our values, traditions, and social interactions, and provides guidance on ethical and moral behavior. As someone from the upper middle class, I have seen how religion also plays a role in maintaining social cohesion and hierarchies within our community. Therefore, from my perspective, the purpose of religion encompasses both making sense of life after death and making sense of life in this world.\n\n2"]}, {"persona": {"region": "Sohag", "sex": "male", "age": 51, "country": "Egypt", "marital_status": "married", "education": "middle", "social_class": "lower middle class"}, "question": {"id": "Q175", "variant": 0}, "response": ["From an emic perspective, as a married male from Sohag, Egypt, I have been raised in a cultural context where religion plays a central role in shaping our understanding of the world. My personal experience and individual values are deeply influenced by my upbringing in a predominantly Muslim society. Additionally, my socioeconomic background as part of the lower middle class has also shaped my understanding of the purpose of religion. In this context, the purpose of religion is to make sense of life in this world, as it provides guidance, moral principles, and a sense of community and belonging that are essential for navigating the challenges of everyday life. Furthermore, cultural relativism reminds us that different cultures have different interpretations of the purpose of religion, and in my cultural context, the emphasis is on finding meaning and purpose in this life rather than solely focusing on the afterlife.\n\n2"]}, {"persona": {"region": "Qena", "sex": "male", "age": 32, "country": "Egypt", "marital_status": "single", "education": "middle", "social_class": "working class"}, "question": {"id": "Q175", "variant": 0}, "response": ["Based on the anthropological framework, as a single male from Qena, Egypt, my emic perspective on the purpose of religion is influenced by my cultural context, individual values, and personal experience. In Qena, religion plays a central role in everyday life and is deeply intertwined with cultural traditions and social norms. As a member of the working class, I have personally witnessed how religion provides a sense of community and support, especially during challenging times. Additionally, my middle education level has taught me that religion also serves to make sense of life in this world, providing moral guidance, a framework for social interactions, and a source of hope and comfort. Therefore, from my perspective, the purpose of religion is (2) to make sense of life in this world."]}, {"persona": {"region": "Qena", "sex": "male", "age": 54, "country": "Egypt", "marital_status": "married", "education": "middle", "social_class": "lower middle class"}, "question": {"id": "Q175", "variant": 0}, "response": ["Based on the anthropological framework, as a married male from Qena, Egypt, my emic perspective on the purpose of religion is heavily influenced by my cultural context, individual values, and personal experience. In my community, religion plays a crucial role in providing meaning and guidance for life in this world. It helps to navigate social and moral norms, provides a sense of community and belonging, and offers a framework for understanding and coping with life's challenges. Additionally, my lower middle-class socioeconomic background has shaped my belief that religion serves as a source of hope and comfort in the face of economic struggles and adversity. Therefore, from my perspective, the purpose of religion is to make sense of life in this world.\n\n2"]}, {"persona": {"region": "Qena", "sex": "male", "age": 25, "country": "Egypt", "marital_status": "single", "education": "lower", "social_class": "lower class"}, "question": {"id": "Q175", "variant": 0}, "response": ["In answering the question of the purpose of religion from the perspective of a single male from Qena, Egypt, it is important to consider the cultural context and individual values. In this region, religion plays a significant role in shaping daily life and providing a sense of community and purpose. As a member of the lower class, the individual may find solace and hope in religion, as it provides a sense of belonging and guidance in a challenging socio-economic environment. Additionally, with lower levels of education, the individual may rely more heavily on religious beliefs to make sense of the world around them and to find meaning in their struggles. Therefore, the purpose of religion, from this perspective, is to make sense of life in this world.\n\n2"]}, {"persona": {"region": "Aswan", "sex": "male", "age": 34, "country": "Egypt", "marital_status": "single", "education": "middle", "social_class": "lower class"}, "question": {"id": "Q175", "variant": 0}, "response": ["From the perspective of a single male from Aswan, Egypt, who is 34 years old and part of the lower class, the answer to the question of the purpose of religion is heavily influenced by the cultural context and individual values. In Aswan, religion plays a crucial role in shaping everyday life and providing a sense of community and belonging. The socioeconomic background also impacts the perception of religion, as those in the lower class may rely on faith and religious beliefs as a source of hope and comfort in difficult circumstances. Additionally, the cultural relativism perspective emphasizes that different cultures have different understandings and practices related to religion, and in this context, the purpose of religion may be seen as providing guidance and meaning in this world. Therefore, the chosen answer is (2) To make sense of life in this world."]}, {"persona": {"region": "Aswan", "sex": "female", "age": 31, "country": "Egypt", "marital_status": "married", "education": "middle", "social_class": "lower middle class"}, "question": {"id": "Q175", "variant": 0}, "response": ["Based on my cultural context as a married female from Aswan, Egypt, my understanding of the purpose of religion is deeply influenced by my personal values and experiences. Religion plays a crucial role in providing guidance and meaning in my everyday life, especially as a member of the lower middle class. It helps me navigate through the challenges and uncertainties of life, and provides a sense of community and support. Additionally, my understanding of the purpose of religion is shaped by my socioeconomic background and the cultural context in which I live. Therefore, the purpose of religion, from my perspective, is to make sense of life in this world.\n\n2"]}, {"persona": {"region": "Aswan", "sex": "female", "age": 39, "country": "Egypt", "marital_status": "married", "education": "middle", "social_class": "working class"}, "question": {"id": "Q175", "variant": 0}, "response": ["Based on the anthropological framework, as a married female from Aswan, Egypt, my emic perspective would be influenced by the cultural context of my community, where religion plays a significant role in daily life. My personal experience and individual values are also shaped by the religious beliefs and practices of my community. Additionally, my socioeconomic background as part of the working class in Aswan would influence my understanding of the purpose of religion. Therefore, my answer would be influenced by the nuanced phrasing of the question and the cultural relativism of my community.\n\n2"]}, {"persona": {"region": "Qena", "sex": "female", "age": 27, "country": "Egypt", "marital_status": "married", "education": "lower", "social_class": "lower middle class"}, "question": {"id": "Q175", "variant": 0}, "response": ["Based on the anthropological framework, as a married female from Qena, Egypt, my emic perspective on the purpose of religion is heavily influenced by my cultural context and personal experience. In my community, religion plays a significant role in providing a framework for understanding life in this world. It dictates our daily rituals, moral values, and social interactions. Additionally, my lower middle class socioeconomic background has shaped my belief that religion serves as a source of guidance and support in navigating the challenges and hardships of everyday life. Therefore, I believe that the purpose of religion is to make sense of life in this world.\n\n2"]}, {"persona": {"region": "Qena", "sex": "male", "age": 40, "country": "Egypt", "marital_status": "single", "education": "middle", "social_class": "lower middle class"}, "question": {"id": "Q175", "variant": 0}, "response": ["From the perspective of a single male from Qena, Egypt, who is 40 years old and part of the lower middle class, the purpose of religion is heavily influenced by the cultural context and individual values. In Qena, religion plays a significant role in daily life and is deeply intertwined with social, economic, and political aspects. As a member of the lower middle class, religion may serve as a source of comfort and hope in the face of economic challenges and uncertainty about the future. Additionally, the emphasis on community and family in Egyptian society likely shapes the understanding of religion as a way to maintain social cohesion and support networks. Overall, the purpose of religion is not just to make sense of life after death, but also to make sense of life in this world.\n\n2"]}, {"persona": {"region": "Qena", "sex": "male", "age": 30, "country": "Egypt", "marital_status": "single", "education": "middle", "social_class": "working class"}, "question": {"id": "Q175", "variant": 0}, "response": ["Based on my cultural background as a single male from Qena, Egypt, my understanding of the purpose of religion is deeply rooted in the cultural context of my community. Religion plays a significant role in providing meaning and purpose in this life, as well as guiding moral and ethical behavior. Additionally, my personal experience and values, shaped by my socioeconomic background as a working-class individual, have influenced my perspective on the purpose of religion. Therefore, I believe that option 2, \"To make sense of life in this world,\" is the most relevant and accurate answer from my point of view. \n\n2"]}]