[{"persona": {"region": "Fayoum", "sex": "male", "age": 46, "country": "Egypt", "marital_status": "married", "education": "higher", "social_class": "lower middle class"}, "question": {"id": "Q2", "variant": 0}, "response": ["Based on the anthropological framework, I must consider my cultural context as a married male from Fayoum, Egypt, where social relationships are highly valued and play a significant role in everyday life. My personal experience and individual values also lead me to believe that friends are crucial for emotional support, social connections, and mutual assistance, especially in a lower middle-class context where financial and social resources may be limited. Additionally, considering my age and socioeconomic background, I recognize the importance of friends in providing a sense of community and support. Therefore, I would say that friends are (2) Rather important in life."]}, {"persona": {"region": "Fayoum", "sex": "female", "age": 30, "country": "Egypt", "marital_status": "married", "education": "middle", "social_class": "lower middle class"}, "question": {"id": "Q2", "variant": 0}, "response": ["Based on the anthropological framework, as a married female from Fayoum, Egypt, my cultural context and socioeconomic background play a significant role in shaping my perspective. In my community, kinship networks and social relationships are highly valued, and as a member of the lower middle class, my personal experience and individual values prioritize the support and companionship of friends. Additionally, the nuance of the question is important, as the phrasing of \"how important\" can be interpreted in different ways. Taking all of this into account, I choose the option: \n\n(2) Rather important"]}, {"persona": {"region": "Fayoum", "sex": "male", "age": 60, "country": "Egypt", "marital_status": "married", "education": "higher", "social_class": "working class"}, "question": {"id": "Q2", "variant": 0}, "response": ["From the perspective of a married male from Fayoum, Egypt, who is 60 years old, has completed a higher education level, and considers himself part of the working class, the importance of friends in life would be heavily influenced by cultural context, individual values, and socioeconomic background. In Egyptian culture, friendships are often deeply cherished and valued, with a strong emphasis on communal support and social connections. Additionally, at this stage in life, personal experiences and individual values may also play a significant role in shaping the perceived importance of friends, especially if the individual has had positive experiences with friendships or values the support and companionship that friends provide. As a member of the working class, this individual may also rely on friends for various forms of support, making them an integral part of daily life. Therefore, the most fitting response from this perspective would be:\n2) Rather important"]}, {"persona": {"region": "Fayoum", "sex": "male", "age": 20, "country": "Egypt", "marital_status": "single", "education": "middle", "social_class": "lower middle class"}, "question": {"id": "Q2", "variant": 0}, "response": ["Based on the anthropological framework, my emic perspective as a single male from Fayoum, Egypt, is heavily influenced by my cultural context, individual values, and socioeconomic background. In my community, social connections and friendships are highly valued and play a crucial role in providing emotional support and companionship. Additionally, my lower middle-class background means that I rely on my friends for various forms of support, such as sharing resources and helping each other navigate life's challenges. My personal experience and values also lead me to believe that friends are an essential part of life, as they provide a sense of belonging and mutual aid that is especially important in my socioeconomic context.\n\n2"]}, {"persona": {"region": "Fayoum", "sex": "female", "age": 39, "country": "Egypt", "marital_status": "married", "education": "higher", "social_class": "lower middle class"}, "question": {"id": "Q2", "variant": 0}, "response": ["In considering the importance of friends in life from the perspective of a married female from Fayoum, Egypt, who is 39 years old, completed higher education, and identifies as part of the lower middle class, it is essential to take into account the cultural context and individual values. In Egyptian society, social connections and relationships are highly valued, and the concept of friendship holds significant importance. Additionally, the socioeconomic background of being part of the lower middle class may mean that friends provide crucial support and solidarity in navigating life's challenges. Personal experience and individual values also play a role, as the persona may place a high value on friendship based on her own lived experiences. Therefore, it can be argued that friends are very important in life, providing essential support and camaraderie in the context of the persona's cultural and socioeconomic background.\n\n1"]}, {"persona": {"region": "Fayoum", "sex": "male", "age": 33, "country": "Egypt", "marital_status": "married", "education": "higher", "social_class": "working class"}, "question": {"id": "Q2", "variant": 0}, "response": ["Based on the anthropological framework, as a married male from Fayoum, Egypt, my answer to the question of how important friends are in life is influenced by my cultural context, individual values, and socioeconomic background. In Egyptian culture, friendships are highly valued and play a significant role in social interactions and support networks. As part of the working class, I have experienced the importance of community and friendship in navigating life's challenges and celebrating its joys. Additionally, having completed higher education, I understand the value of intellectual and emotional support that friends provide. Therefore, based on my personal experience and cultural context, I believe that friends are very important in life.\n\n1"]}, {"persona": {"region": "Port Said", "sex": "female", "age": 45, "country": "Egypt", "marital_status": "married", "education": "higher", "social_class": "lower middle class"}, "question": {"id": "Q2", "variant": 0}, "response": ["From an emic perspective, as a married woman from Port Said, Egypt, my cultural context places a strong emphasis on family and community. Friends are often considered an extension of family, providing emotional support, social connections, and practical assistance. Personal experience and individual values also play a significant role, as I have found my friends to be invaluable in navigating the challenges of daily life and finding joy in shared experiences. Additionally, my lower middle-class socioeconomic background has shaped my understanding of the importance of friendships, as they provide a sense of belonging and mutual support in the face of economic struggles. Considering all these factors, I believe that friends are rather important in life, offering essential support and companionship.\n\n2"]}, {"persona": {"region": "Port Said", "sex": "male", "age": 42, "country": "Egypt", "marital_status": "married", "education": "middle", "social_class": "lower middle class"}, "question": {"id": "Q2", "variant": 0}, "response": ["Based on my emic perspective, friends are a crucial part of my life as they provide support and companionship in both good and bad times. In my cultural context, friendships are valued and seen as an important part of social life, providing a sense of belonging and community. My individual values and personal experiences have taught me the importance of maintaining strong friendships, especially in a close-knit community like Port Said. Additionally, my socioeconomic background as part of the lower middle class means that I rely on my friends for social and emotional support, making them very important in my life. Lastly, considering the nuance of the question, I believe that friendships are not just important, but rather crucial for a fulfilling life.\n\n5"]}, {"persona": {"region": "Port Said", "sex": "male", "age": 28, "country": "Egypt", "marital_status": "single", "education": "middle", "social_class": "lower middle class"}, "question": {"id": "Q2", "variant": 0}, "response": ["From my perspective as a single male from Port Said, Egypt, at 28 years of age and part of the lower middle class, I understand the importance of friends in life through the lens of my cultural context and socioeconomic background. In our community, friends are vital for emotional support, networking, and navigating life's challenges. My personal experience and individual values also play a significant role in my understanding of the importance of friends, as I have relied on my friends for companionship and support. Additionally, the nuanced phrasing of the question also shapes my response, as the term \"important\" can be interpreted differently depending on cultural and individual factors. Considering all these factors, I would say that friends are rather important in life.\n2"]}, {"persona": {"region": "Port Said", "sex": "female", "age": 30, "country": "Egypt", "marital_status": "married", "education": "higher", "social_class": "lower middle class"}, "question": {"id": "Q2", "variant": 0}, "response": ["From the perspective of a married female from Port Said, Egypt, the importance of friends in life is heavily influenced by the cultural context and individual values. In this specific cultural context, social relationships and community ties play a significant role in daily life. Additionally, the socioeconomic background of being part of the lower middle class may also shape the importance of friends, as social support and networks can be crucial for navigating challenges and opportunities. Personal experience and values, including the emphasis on family and community, may also lead to a high regard for the importance of friends in life. Therefore, based on this perspective, the chosen answer would be:\n\n2"]}, {"persona": {"region": "Port Said", "sex": "male", "age": 30, "country": "Egypt", "marital_status": "divorced", "education": "middle", "social_class": "lower middle class"}, "question": {"id": "Q2", "variant": 0}, "response": ["Based on my personal experience and cultural context, friends are very important in life. In Port Said, Egypt, community and social connections are highly valued, and I have witnessed the impact of friendships on people's lives. Additionally, my lower middle class background has taught me the value of relying on friends for support and assistance, especially during tough times. Furthermore, considering my age, I am at a stage in life where friends play a crucial role in my social and emotional well-being. Therefore, I believe that friends are very important in life.\n\n1"]}, {"persona": {"region": "Port Said", "sex": "female", "age": 19, "country": "Egypt", "marital_status": "single", "education": "middle", "social_class": "lower middle class"}, "question": {"id": "Q2", "variant": 0}, "response": ["Based on the anthropological framework, as a 19-year-old single female from Port Said, Egypt, with a middle education level and lower middle class background, my emic perspective would emphasize the importance of friends in providing emotional support and companionship. In my cultural context, friends play a crucial role in providing social connections and a sense of belonging, especially in a society where family and community ties are highly valued. My personal experience and individual values also lead me to believe that friends are rather important for socializing and sharing experiences, as well as for emotional support and mutual assistance. Socioeconomic background also impacts this perspective, as socializing with friends may be a more accessible form of entertainment and support compared to other leisure activities. Therefore, based on this perspective, I would choose option (2) Rather important. \n\n2"]}, {"persona": {"region": "Fayoum", "sex": "male", "age": 40, "country": "Egypt", "marital_status": "married", "education": "middle", "social_class": "working class"}, "question": {"id": "Q2", "variant": 0}, "response": ["From the perspective of a married male from Fayoum, Egypt, who is 40 years old, has completed middle education, and considers himself part of the working class, the answer to the question of how important friends are in life will be heavily influenced by cultural context, individual values, and socioeconomic background. In the Egyptian culture, social connections and friendships are highly valued, as they provide emotional support, companionship, and often play a role in social and professional networks. As a member of the working class, the importance of friendships may be even more pronounced, as they can provide a sense of solidarity and community in the face of economic challenges. Additionally, personal experience and individual values will likely shape the perception of the importance of friends in life, with the potential for friendships to be seen as a source of joy and comfort. Taking all these factors into consideration, the selected answer is:\n\n2"]}, {"persona": {"region": "Fayoum", "sex": "male", "age": 23, "country": "Egypt", "marital_status": "single", "education": "higher", "social_class": "lower middle class"}, "question": {"id": "Q2", "variant": 0}, "response": ["Based on my personal experience and socioeconomic background, I believe that friends are rather important in life. Coming from a lower middle class background in Fayoum, Egypt, I have always relied on my friends for support, whether it's emotional or financial. The cultural context of Egypt also places a high value on social connections and community, making friends an essential part of life. Additionally, my age and space also play a role in my perspective, as being a young adult in a tight-knit community, friends are crucial for socializing and building relationships. Overall, considering the emic and etic perspectives, cultural relativism, and individual values and personal experience, I strongly believe that friends are rather important in life.\n\n2"]}, {"persona": {"region": "Fayoum", "sex": "female", "age": 38, "country": "Egypt", "marital_status": "married", "education": "middle", "social_class": "lower middle class"}, "question": {"id": "Q2", "variant": 0}, "response": ["From the perspective of a married female from Fayoum, Egypt, who is 38 years old and considers herself part of the lower middle class, the answer to the question of how important friends are in life is significantly influenced by cultural context, individual values, and socioeconomic background. In Egyptian society, particularly in lower middle class communities, friendships often play a crucial role in providing emotional support and a sense of community. Additionally, cultural norms and traditions place a high value on social connections and maintaining strong bonds with friends. As someone who has completed middle education level, the importance of friends in providing social and emotional support is likely to be emphasized, especially given the limited educational and professional opportunities available. Therefore, the persona described would likely view friends as very important in life.\n\n1"]}, {"persona": {"region": "Fayoum", "sex": "male", "age": 32, "country": "Egypt", "marital_status": "married", "education": "middle", "social_class": "lower middle class"}, "question": {"id": "Q2", "variant": 0}, "response": ["From an emic perspective, the cultural context of Fayoum, Egypt, is pivotal in understanding the importance of friends in life. In this region, social networks and kinship ties play a significant role in daily life, and personal experience and individual values also heavily influence one's perception of the importance of friends. Additionally, the socioeconomic background, in this case, being part of the lower middle class, can impact the value placed on friendships. Furthermore, cultural relativism reminds us that there is no hierarchy of culture, and space and time, in this case being 32 years old and married, also influence one's perspective. Lastly, the nuance of the question and how it is phrased will also affect the answer. \n\n2"]}, {"persona": {"region": "Fayoum", "sex": "male", "age": 31, "country": "Egypt", "marital_status": "married", "education": "higher", "social_class": "working class"}, "question": {"id": "Q2", "variant": 0}, "response": ["Based on the anthropological framework, my individual values and personal experience play a significant role in my perception of the importance of friends in life. In the cultural context of Fayoum, Egypt, where I come from, friendships are highly valued and play a crucial role in social and emotional support. Additionally, my working-class background and age of 31 also influence my perspective, as I have likely formed strong bonds with friends through shared experiences and mutual support. Therefore, based on my personal experience and cultural context, I would say that friends are (2) Rather important."]}, {"persona": {"region": "Fayoum", "sex": "male", "age": 31, "country": "Egypt", "marital_status": "married", "education": "middle", "social_class": "lower middle class"}, "question": {"id": "Q2", "variant": 0}, "response": ["Based on the anthropological framework of emic and etic perspectives, cultural context, individual values and personal experience, socioeconomic background, cultural relativism, space and time, and nuance, I would like to answer the question from the perspective of a married male from Fayoum, Egypt. In this cultural context, family and community are highly valued, and friendships are often formed within these spheres. As a 31-year-old from a lower middle class background, my personal experience and socioeconomic background lead me to prioritize the support and companionship of friends. In this cultural context, friends provide social connections, emotional support, and assistance in times of need, making them rather important in life.\n\n2"]}, {"persona": {"region": "Fayoum", "sex": "female", "age": 32, "country": "Egypt", "marital_status": "married", "education": "middle", "social_class": "lower middle class"}, "question": {"id": "Q2", "variant": 0}, "response": ["From the emic perspective, as a married female from Fayoum, Egypt, my cultural context and individual values heavily influence my perception of the importance of friends in life. In my community, kinship networks and social connections play a crucial role in daily life. Additionally, my lower middle class socioeconomic background has taught me the value of relying on friends for support and assistance. Furthermore, my personal experiences have shown me the significance of having a strong social circle for emotional and practical support. Taking into account the cultural relativism and the nuanced phrasing of the question, I would argue that friends are rather important in life. \n\n2"]}, {"persona": {"region": "Ismailia", "sex": "male", "age": 53, "country": "Egypt", "marital_status": "married", "education": "middle", "social_class": "lower middle class"}, "question": {"id": "Q2", "variant": 0}, "response": ["Based on the anthropological framework, my perspective as a married male from Ismailia, Egypt, who is 53 years old, has completed middle education, and considers himself part of the lower middle class, is shaped by a combination of emic and etic perspectives, cultural context, individual values and personal experience, socioeconomic background, cultural relativism, and space and time. In my culture, friendships are highly valued and play a significant role in people's lives. Our close-knit community and strong emphasis on social connections mean that friends are considered very important for emotional support, socializing, and mutual assistance. Additionally, as someone from the lower middle class, my personal experience and socioeconomic background have further reinforced the importance of friends in my life, as they have often been a source of support and solidarity in times of need. Therefore, I will choose option (1) Very important."]}, {"persona": {"region": "Ismailia", "sex": "male", "age": 38, "country": "Egypt", "marital_status": "married", "education": "higher", "social_class": "working class"}, "question": {"id": "Q2", "variant": 0}, "response": ["Based on my personal experience and cultural context, friends play a crucial role in my life. In Ismailia, Egypt, strong kinship networks and friendships are highly valued. As a working-class individual, my friends provide me with emotional support, social connections, and sometimes even financial help. Additionally, my age and socioeconomic background contribute to the importance of friends in my life. Therefore, I believe that friends are very important in life.\n\n1"]}, {"persona": {"region": "Ismailia", "sex": "female", "age": 35, "country": "Egypt", "marital_status": "married", "education": "middle", "social_class": "lower middle class"}, "question": {"id": "Q2", "variant": 0}, "response": ["Based on the anthropological framework, as a married female from Ismailia, Egypt, my emic perspective is that friends are very important in life. In our cultural context, friendships play a crucial role in providing emotional support, social connections, and opportunities for mutual aid. Individual values and personal experience also reinforce the importance of friendships, as they contribute to a sense of belonging and community. Additionally, considering my lower middle class socioeconomic background, friends are often relied upon for practical assistance and solidarity in navigating economic challenges. Cultural relativism further emphasizes the significance of friendships in our society, as they are valued and prioritized in our social interactions. Age and place of residence also influence the importance of friends, particularly in providing social networks and support systems. Therefore, from my perspective, the answer to the question is (1) Very important."]}, {"persona": {"region": "Ismailia", "sex": "female", "age": 57, "country": "Egypt", "marital_status": "married", "education": "lower", "social_class": "working class"}, "question": {"id": "Q2", "variant": 0}, "response": ["From the perspective of a married female from Ismailia, Egypt, age 57, with a lower education level and part of the working class, the cultural context and individual values play a significant role in understanding the importance of friends in life. In this cultural context, kinship networks and community ties are highly valued, and personal experiences and social interactions are vital for emotional support and overall well-being. Additionally, the socioeconomic background and lower education level may limit opportunities for social engagement and leisure activities outside of work and family responsibilities. Therefore, the importance of friends in life is likely to be perceived as rather important for companionship and emotional support within the constraints of the given circumstances.\n\n2"]}, {"persona": {"region": "Ismailia", "sex": "male", "age": 33, "country": "Egypt", "marital_status": "married", "education": "middle", "social_class": "lower middle class"}, "question": {"id": "Q2", "variant": 0}, "response": ["Based on my cultural context in Ismailia, Egypt, friends are considered very important in life. In our community, personal relationships and social connections play a crucial role in our day to day lives. Additionally, my lower middle class background means that I heavily rely on my friends for support, advice, and social interaction. My personal experience also confirms the significance of friends in my life, as they provide emotional and practical support in times of need. Therefore, taking into account my cultural context, socioeconomic background, and personal experience, I believe that friends are very important in life.\n\n1"]}, {"persona": {"region": "Ismailia", "sex": "female", "age": 49, "country": "Egypt", "marital_status": "single", "education": "higher", "social_class": "upper middle class"}, "question": {"id": "Q2", "variant": 0}, "response": ["In my cultural context, friends are extremely important. As a single woman in Ismailia, Egypt, my social networks and friendships play a crucial role in my daily life. I value the support and companionship that my friends provide, and the cultural emphasis on community and relationships means that maintaining strong friendships is a priority. Additionally, as a member of the upper middle class, social connections and networking are important for both personal and professional success. My higher education level has also taught me the value of interpersonal relationships and the role they play in shaping one's experiences and perspectives. Therefore, based on my cultural background, socioeconomic status, and personal experiences, I believe that friends are very important in life.\n\n1"]}, {"persona": {"region": "Ismailia", "sex": "female", "age": 35, "country": "Egypt", "marital_status": "married", "education": "higher", "social_class": "lower middle class"}, "question": {"id": "Q2", "variant": 0}, "response": ["From the perspective of a married female from Ismailia, Egypt, who is 35 years old, has completed higher education, and considers herself part of the lower middle class, the answer to the question \"How important are friends in life?\" would be option (2) Rather important. Based on the cultural context of Egypt, where family and community are highly valued, friendships play a significant role in providing social support and companionship. Additionally, individual values and personal experiences, along with socioeconomic background, contribute to the importance placed on friendships. In this cultural context, maintaining close relationships with friends is valued, but not necessarily as highly as family relationships. \n\n2"]}, {"persona": {"region": "Ismailia", "sex": "male", "age": 24, "country": "Egypt", "marital_status": "single", "education": "higher", "social_class": "upper middle class"}, "question": {"id": "Q2", "variant": 0}, "response": ["In Ismailia, Egypt, cultural context plays a pivotal role in the understanding of the importance of friends in life. As a single male in my mid-twenties who has completed higher education and considers myself part of the upper middle class, my individual values and personal experience also shape my perspective on this question. In my cultural context, friendships are highly valued and are seen as an important aspect of social life and personal development. Additionally, my socioeconomic background allows me to prioritize and maintain close relationships with friends, as leisure activities and social gatherings are often associated with my social status. Therefore, based on my background and cultural context, I believe that friends are rather important in life.\n\n2"]}, {"persona": {"region": "Ismailia", "sex": "female", "age": 23, "country": "Egypt", "marital_status": "single", "education": "higher", "social_class": "lower middle class"}, "question": {"id": "Q2", "variant": 0}, "response": ["From an emic perspective, the importance of friends in life is highly influenced by cultural context, individual values, socioeconomic background, and personal experience. In Ismailia, Egypt, social connections and relationships are highly valued, and close friendships often serve as a support network in a society where family ties are also significant. As a 23-year-old single female who has completed higher education and considers herself part of the lower middle class, the value of friends in providing emotional and social support, as well as opportunities for networking and social mobility, cannot be understated. Additionally, the cultural relativism of valuing interpersonal relationships and the nuanced understanding of the question lead me to choose option 2) Rather important."]}, {"persona": {"region": "Ismailia", "sex": "male", "age": 55, "country": "Egypt", "marital_status": "married", "education": "middle", "social_class": "lower middle class"}, "question": {"id": "Q2", "variant": 0}, "response": ["Based on the anthropological framework, as a married male from Ismailia, Egypt, my cultural context places a high value on social connections and community. In this region, kinship networks and friendships play a crucial role in daily life, providing support and social interaction. Additionally, my lower middle-class socioeconomic background emphasizes the importance of relying on friends for mutual aid and support. My individual values and personal experience also lead me to prioritize friendships, as they provide emotional and practical assistance in times of need. Therefore, based on my cultural context, socioeconomic background, and personal experience, I would say that friends are (2) Rather important in life."]}, {"persona": {"region": "Ismailia", "sex": "male", "age": 57, "country": "Egypt", "marital_status": "married", "education": "middle", "social_class": "upper middle class"}, "question": {"id": "Q2", "variant": 0}, "response": ["Based on the anthropological framework, I, as a married male from Ismailia, Egypt, would consider the importance of friends in life based on my cultural context, individual values, and socioeconomic background. In my cultural context, friendships are highly valued and play a significant role in social life and support systems. My personal experience and values also emphasize the significance of friendships in providing emotional support and companionship. Additionally, my upper middle-class socioeconomic background allows for the cultivation of friendships through social activities and gatherings. Therefore, I would choose option (1) Very important as the importance of friends in life is highly emphasized in my cultural context, personal experience, and socioeconomic background. \n\n1"]}, {"persona": {"region": "Ismailia", "sex": "female", "age": 29, "country": "Egypt", "marital_status": "married", "education": "middle", "social_class": "upper middle class"}, "question": {"id": "Q2", "variant": 0}, "response": ["Based on my cultural context as a married female from Ismailia, Egypt, my individual values and personal experience, and my socio-economic background, I would say that friends are rather important in life. In my culture, friendships are highly valued and play a significant role in social interactions and support systems. Additionally, as someone from the upper middle class, I have the means and opportunity to cultivate and maintain friendships, which adds to their importance in my life.\n\n2"]}, {"persona": {"region": "Damiatta", "sex": "female", "age": 46, "country": "Egypt", "marital_status": "married", "education": "middle", "social_class": "lower middle class"}, "question": {"id": "Q2", "variant": 0}, "response": ["From the perspective of a married female from Damiatta, Egypt, the importance of friends in life is heavily influenced by cultural context and individual values. In this context, women often rely on their close-knit social networks for support, especially in lower middle-class communities. Additionally, personal experience and socioeconomic background play a significant role in shaping the value placed on friendships. Given the emphasis on community and social ties in Egyptian culture, along with the need for support within the lower middle class, friends are considered rather important for emotional and practical support.\n\n2"]}, {"persona": {"region": "Damiatta", "sex": "female", "age": 20, "country": "Egypt", "marital_status": "single", "education": "middle", "social_class": "lower middle class"}, "question": {"id": "Q2", "variant": 0}, "response": ["From the perspective of a single female from Damiatta, Egypt, who is 20 years old and considers herself to be part of the lower middle class, the answer to the question of how important friends are in life would be influenced by a combination of individual values, personal experiences, and socioeconomic background. In this cultural context, close-knit community and social networks play a significant role in providing support and companionship, especially for individuals in lower socioeconomic brackets. Additionally, the emphasis on family and communal bonds may lead to a higher value being placed on friendships. The nuanced phrasing of the question also allows for the consideration of different types of friendships and their importance, further influencing the answer.\n\n2"]}, {"persona": {"region": "Damiatta", "sex": "male", "age": 19, "country": "Egypt", "marital_status": "single", "education": "middle", "social_class": "lower middle class"}, "question": {"id": "Q2", "variant": 0}, "response": ["From an emic perspective, as a single male from Damiatta, Egypt, friends are considered extremely important in life. In this cultural context, social connections and networks play a crucial role in daily life and provide support in various aspects such as emotional, financial, and social. Additionally, individual values and personal experiences also contribute to the significance of friendships, as they provide a sense of belonging and companionship. Socioeconomic background also factors in, as individuals from lower middle-class backgrounds may rely heavily on their friends for various forms of support. Therefore, from this perspective, the importance of friends in life is very high.\n\n1"]}, {"persona": {"region": "Damiatta", "sex": "female", "age": 33, "country": "Egypt", "marital_status": "married", "education": "higher", "social_class": "lower middle class"}, "question": {"id": "Q2", "variant": 0}, "response": ["In considering the importance of friends in life from the perspective of a married female from Damiatta, Egypt, it is important to take into account the cultural context and individual values. In Egyptian society, community and social connections are highly valued, and friendships play a significant role in providing support and a sense of belonging. As a lower middle class woman who has completed higher education, I understand the importance of having a strong social network for both emotional and practical support. Additionally, age and space are important factors to consider, as at 33 years old and living in Damiatta, I have likely developed deep and meaningful friendships that contribute to my overall well-being. Therefore, based on my personal experience and cultural context, I would say that friends are (2) Rather important."]}, {"persona": {"region": "Damiatta", "sex": "male", "age": 24, "country": "Egypt", "marital_status": "single", "education": "higher", "social_class": "lower middle class"}, "question": {"id": "Q2", "variant": 0}, "response": ["In the cultural context of Damiatta, Egypt, where I come from, the importance of friends in life is deeply rooted in our social and kinship networks. Emic and etic perspectives play a significant role in shaping our understanding of the value of friendships, as we place a high value on communal relationships and support systems. As a member of the lower middle class, my socioeconomic background also influences my perspective, as friends often provide crucial emotional and practical support in navigating the challenges of life. Additionally, my personal experience and individual values emphasize the significance of friendships in providing a sense of belonging and companionship. Therefore, based on my cultural and personal context, I would say that friends are (2) Rather important."]}, {"persona": {"region": "Suez", "sex": "male", "age": 41, "country": "Egypt", "marital_status": "married", "education": "middle", "social_class": "working class"}, "question": {"id": "Q2", "variant": 0}, "response": ["From the perspective of a married male from Suez, Egypt, who is 41 years old, has completed middle education, and considers himself part of the working class, the importance of friends in life is heavily influenced by cultural context, socioeconomic background, and individual values. In Egypt, strong social networks and friendships are highly valued, as they provide emotional support, assistance in times of need, and contribute to a sense of community. Additionally, as a member of the working class, friendships may play an important role in navigating economic challenges and providing mutual aid. Personal experience and individual values also underscore the significance of friendships in this context. Therefore, the chosen answer is:\n\n2"]}, {"persona": {"region": "Suez", "sex": "female", "age": 39, "country": "Egypt", "marital_status": "divorced", "education": "middle", "social_class": "working class"}, "question": {"id": "Q2", "variant": 0}, "response": ["Based on the anthropological framework, as a divorced female from Suez, Egypt, social relationships and kinship networks are crucial in my cultural context. As a member of the working class with a middle education level, my individual values and personal experience also play a significant role in shaping my perspective. In Egyptian society, friendships are highly valued and provide important support systems, especially for individuals facing challenges such as divorce. Additionally, cultural relativism reminds us that the importance of friendships may vary across different cultures and socioeconomic backgrounds. Therefore, based on my background and cultural context, I would say:\n\n2"]}, {"persona": {"region": "Cairo", "sex": "female", "age": 55, "country": "Egypt", "marital_status": "married", "education": "middle", "social_class": "working class"}, "question": {"id": "Q2", "variant": 0}, "response": ["Based on my emic perspective as a married female from Cairo, Egypt, friends play a crucial role in my life. In our cultural context, friendships are highly valued and are often considered an extension of family. My personal experience has shown me the importance of having a strong network of friends for support and companionship, especially as I consider myself part of the working class. Additionally, the socioeconomic background and cultural relativism in Egypt place a high value on social connections, making friends very important in my life. Therefore, I would say that friends are (1) Very important."]}, {"persona": {"region": "Cairo", "sex": "male", "age": 58, "country": "Egypt", "marital_status": "married", "education": "middle", "social_class": "lower middle class"}, "question": {"id": "Q2", "variant": 0}, "response": ["In considering the importance of friends in life from the perspective of a 58-year-old married male from Cairo, Egypt, it is important to take into account the cultural context and individual values. In Egyptian society, friendships and social networks play a crucial role in providing support and companionship, particularly as one ages. Additionally, the lower middle class socioeconomic background may lead to a greater reliance on social connections for various forms of assistance and emotional support. Therefore, from this perspective, it can be argued that friends are rather important in life.\n\n2"]}, {"persona": {"region": "Cairo", "sex": "female", "age": 29, "country": "Egypt", "marital_status": "married", "education": "higher", "social_class": "lower middle class"}, "question": {"id": "Q2", "variant": 0}, "response": ["Based on the anthropological framework, as a married female from Cairo, Egypt, my cultural context and socioeconomic background play a significant role in shaping my perspective. In Egypt, family and community are highly valued, and friendships are often deeply intertwined with these relationships. Additionally, as a lower middle class individual, my daily experiences and personal values emphasize the importance of social connections for support and solidarity. Considering these factors, I would say that friends are rather important in life.\n\n2"]}, {"persona": {"region": "Cairo", "sex": "male", "age": 38, "country": "Egypt", "marital_status": "married", "education": "higher", "social_class": "lower middle class"}, "question": {"id": "Q2", "variant": 0}, "response": ["Based on the anthropological framework, as a married male from Cairo, Egypt, my emic perspective is that friends are very important in life. In Egyptian culture, social relationships and community ties are highly valued, and friends often serve as a support network in various aspects of life. Additionally, the cultural context of Egypt emphasizes the importance of maintaining strong social connections and the value of friendship in navigating through life's challenges. My individual values and personal experiences also contribute to this perspective, as I have personally found great comfort and support from my friends in times of need. Furthermore, considering my lower middle class socioeconomic background, I rely on my friends for emotional support and practical assistance, making them especially important in my life. Therefore, from this perspective, I would choose option (1) Very important. \n\n1"]}, {"persona": {"region": "Cairo", "sex": "female", "age": 40, "country": "Egypt", "marital_status": "married", "education": "higher", "social_class": "lower middle class"}, "question": {"id": "Q2", "variant": 0}, "response": ["Based on the anthropological framework, as a married female from Cairo, Egypt, my emic perspective is that friends are very important in life. In my cultural context, friendships are crucial and valued, especially as a source of support and community. My individual values and personal experience also play a role, as I have relied on my friends for emotional and practical support throughout my life. Additionally, my socioeconomic background as part of the lower middle class means that I may not have access to other forms of support, making friendships even more important. Cultural relativism also emphasizes the significance of friendships in Egyptian society, and my age and place further reinforce the importance of friendships in my life. Finally, the nuanced phrasing of the question also leads me to believe that friendships are very important to me.\n\n2"]}, {"persona": {"region": "Cairo", "sex": "male", "age": 38, "country": "Egypt", "marital_status": "married", "education": "higher", "social_class": "upper middle class"}, "question": {"id": "Q2", "variant": 0}, "response": ["Based on the anthropological framework, I will answer the question about the importance of friends in life from the perspective of my emic and etic perspectives, cultural context, individual values and personal experience, socioeconomic background, cultural relativism, space and time, and nuance. In my cultural context, friendships are highly valued and play a crucial role in social interactions and support networks. As an individual from the upper middle class in Cairo, Egypt, personal connections and relationships are important in maintaining social status and professional networking. Additionally, my personal experience and values emphasize the significance of friendships in providing emotional support and companionship. Therefore, I would choose option (2) Rather important. \n\n2"]}, {"persona": {"region": "Cairo", "sex": "male", "age": 59, "country": "Egypt", "marital_status": "married", "education": "middle", "social_class": "lower middle class"}, "question": {"id": "Q2", "variant": 0}, "response": ["Based on the anthropological framework, my emic perspective as a married male from Cairo, Egypt, is influenced by my cultural context, individual values and personal experience, and socioeconomic background. In Egypt, family and community are highly valued, and friendships often extend to become like family. As someone from the lower middle class, the support and companionship of friends can be crucial in navigating life's challenges, providing both emotional and practical support. Additionally, my age and place in Cairo also shape my perspective, as social connections and friendships are deeply embedded in the fabric of Egyptian society. Therefore, I believe that friends are rather important in life.\n\n2"]}, {"persona": {"region": "Cairo", "sex": "female", "age": 30, "country": "Egypt", "marital_status": "married", "education": "higher", "social_class": "upper middle class"}, "question": {"id": "Q2", "variant": 0}, "response": ["Based on my emic perspective as a married female from Cairo, Egypt, friends play a crucial role in my life. In our cultural context, friendships are highly valued and are considered an important support system. My personal experience and individual values also emphasize the significance of friendships in providing emotional and social support. Additionally, my socioeconomic background as part of the upper middle class allows me the opportunity to prioritize and maintain strong friendships. Furthermore, cultural relativism teaches me to value the importance of friendships in the context of my own culture, and space and time further emphasize the importance of friends in my life at this stage. Overall, considering all these factors, it is clear that friendships are very important in my life.\n\n1"]}, {"persona": {"region": "Cairo", "sex": "male", "age": 22, "country": "Egypt", "marital_status": "single", "education": "middle", "social_class": "lower middle class"}, "question": {"id": "Q2", "variant": 0}, "response": ["Based on the anthropological framework, I will consider the emic perspective of my persona as a single male from Cairo, Egypt, who is 22 years old and part of the lower middle class. In this cultural context, social relationships and networks are crucial for support and opportunities. Personal experience and individual values also play a significant role in shaping the importance of friends in life. Additionally, the socioeconomic background of being part of the lower middle class may influence the reliance on friends for various forms of support. Therefore, I believe that friends are rather important in life.\n\n2"]}, {"persona": {"region": "Cairo", "sex": "male", "age": 29, "country": "Egypt", "marital_status": "single", "education": "higher", "social_class": "lower middle class"}, "question": {"id": "Q2", "variant": 0}, "response": ["Based on the anthropological framework, as a single male from Cairo, Egypt, the cultural context and individual values play a significant role in shaping my perspective. In Egyptian society, friendship and social networks are highly valued, especially in urban areas like Cairo. Personal experience and socioeconomic background also influence my perception, as I have grown up in a community where friendships and social connections are crucial for support and opportunities. Additionally, the nuance of the question is important to consider, as the phrasing can influence the interpretation of the importance of friends in life. Therefore, considering all these factors, I would choose:\n\n2"]}, {"persona": {"region": "Cairo", "sex": "female", "age": 31, "country": "Egypt", "marital_status": "married", "education": "higher", "social_class": "lower middle class"}, "question": {"id": "Q2", "variant": 0}, "response": ["Based on the anthropological framework, as a married female from Cairo, Egypt, my emic perspective on the importance of friends in life is heavily influenced by my cultural context and individual values. In Egyptian society, friendships are highly valued and play a significant role in providing social support, especially for women. Additionally, my socioeconomic background as a lower middle class individual means that I may rely on my friends for emotional and practical support due to limited financial resources. Therefore, I would consider friends as rather important in life.\n\n2"]}, {"persona": {"region": "Cairo", "sex": "male", "age": 59, "country": "Egypt", "marital_status": "married", "education": "higher", "social_class": "upper middle class"}, "question": {"id": "Q2", "variant": 0}, "response": ["From the perspective of a married male from Cairo, Egypt, who is 59 years old, has completed higher education, and considers himself part of the upper middle class, the importance of friends in life is heavily influenced by cultural context, individual values, and personal experience. In Egyptian culture, social relationships and friendships are highly valued, and maintaining strong connections with friends is seen as essential for social support and emotional well-being. Additionally, the individual's age and socioeconomic background also play a significant role in shaping his perspective on the importance of friends, as he may have accumulated a diverse network of friends over the years and values the support and companionship they provide. Therefore, based on this perspective, the chosen answer is:\n\n2"]}, {"persona": {"region": "Cairo", "sex": "male", "age": 27, "country": "Egypt", "marital_status": "single", "education": "middle", "social_class": "working class"}, "question": {"id": "Q2", "variant": 0}, "response": ["Based on the anthropological framework, as a single male from Cairo, Egypt, my emic perspective on the importance of friends in life is heavily influenced by my cultural context, individual values, and socioeconomic background. In Egyptian society, social connections and friendships are highly valued, especially among the working class. Personal experience and the cultural emphasis on community and social support also play a significant role in shaping my view. Additionally, the nuance of the question is important - while friends are valued, the level of importance may vary depending on the individual's circumstances and relationships. Therefore, from this perspective, I would say:\n\n2"]}, {"persona": {"region": "Cairo", "sex": "female", "age": 25, "country": "Egypt", "marital_status": "single", "education": "higher", "social_class": "working class"}, "question": {"id": "Q2", "variant": 0}, "response": ["In the cultural context of Cairo, Egypt, social relationships and networks play a crucial role in everyday life. As a single female in a working-class setting, my personal experience and socioeconomic background have shaped my understanding of the importance of friendships. In this context, friends serve as a support system, providing emotional and practical assistance in navigating the challenges of daily life. Additionally, the cultural value placed on social connections and communal solidarity further emphasizes the significance of friends in shaping one's experiences and well-being. Therefore, based on my individual values and personal experience within this cultural context, I would say that friends are (1) Very important."]}, {"persona": {"region": "Cairo", "sex": "female", "age": 23, "country": "Egypt", "marital_status": "married", "education": "higher", "social_class": "lower middle class"}, "question": {"id": "Q2", "variant": 0}, "response": ["From the perspective of a married female from Cairo, Egypt, who is 23 years old and part of the lower middle class, the importance of friends in life is heavily influenced by cultural context, individual values, socioeconomic background, and space and time. In Cairo, social relationships and community ties are often deeply ingrained in the culture, and maintaining strong friendships is highly valued. Additionally, as a young married woman, friends may provide important support and companionship, especially if family dynamics are heavily prioritized. Moreover, being part of the lower middle class means that social connections and relationships with friends may serve as a form of social and emotional support, making them rather important in navigating life's challenges and celebrations.\n\n2"]}, {"persona": {"region": "Cairo", "sex": "male", "age": 58, "country": "Egypt", "marital_status": "married", "education": "higher", "social_class": "working class"}, "question": {"id": "Q2", "variant": 0}, "response": ["Based on the anthropological framework, as a married male from Cairo, Egypt, cultural context is pivotal in understanding the importance of friends in life. In Egypt, social relationships and friendships are highly valued, and the cultural emphasis on community and social connection makes friends very important in life. Additionally, individual values and personal experiences play a big role in subjective understandings, and from my personal experience, friends have been a crucial support system. Socioeconomic background, such as being part of the working class, also emphasizes the importance of friends for emotional and practical support. Finally, space and time, as well as nuanced phrasing of the question, are important factors to consider. Therefore, based on the perspective of a married male from Cairo, Egypt, I would choose:\n\n2"]}, {"persona": {"region": "Cairo", "sex": "female", "age": 40, "country": "Egypt", "marital_status": "married", "education": "higher", "social_class": "working class"}, "question": {"id": "Q2", "variant": 0}, "response": ["From the perspective of a married female from Cairo, Egypt, who is 40 years old, has completed higher education, and considers herself part of the working class, the importance of friends in life is heavily influenced by the cultural context of Egypt. In Egypt, social relationships and community ties are highly valued, and friendships play a crucial role in providing support and companionship. The socioeconomic background also plays a role, as being part of the working class may lead to a greater reliance on friends for emotional and practical support. Additionally, individual values and personal experience shape the perception of the importance of friends, and in this case, the emphasis on family and community in Egyptian culture may lead to the belief that friends are rather important in life.\n\n2"]}, {"persona": {"region": "Cairo", "sex": "female", "age": 36, "country": "Egypt", "marital_status": "married", "education": "middle", "social_class": "upper middle class"}, "question": {"id": "Q2", "variant": 0}, "response": ["Based on the anthropological framework, as a married female from Cairo, Egypt, with a middle education level and upper middle class background, my perspective on the importance of friends in life is influenced by my cultural context, individual values, and personal experience. In Egyptian culture, friendships are highly valued and play a significant role in social interactions and support networks. Additionally, as a woman in my thirties, I have likely developed close friendships over the years that provide emotional support and companionship. Furthermore, as part of the upper middle class, social connections and networking with friends may also be important for social status and professional opportunities. Therefore, I would say that friends are rather important in life.\n\n2"]}, {"persona": {"region": "Cairo", "sex": "male", "age": 40, "country": "Egypt", "marital_status": "married", "education": "middle", "social_class": "lower middle class"}, "question": {"id": "Q2", "variant": 0}, "response": ["From an anthropological perspective, the cultural context, individual values, and socioeconomic background of a person play a significant role in shaping their perspective on the importance of friends in life. As a married male from Cairo, Egypt, who is 40 years old and part of the lower middle class, my cultural context emphasizes the importance of community and social networks. In Egyptian society, friendships often extend into the realm of extended family, providing support, social connections, and a sense of belonging. Additionally, my socioeconomic background may lead me to prioritize the importance of friendships as a form of social capital and support network. Therefore, I would say that friends are (2) Rather important in life."]}, {"persona": {"region": "Cairo", "sex": "female", "age": 30, "country": "Egypt", "marital_status": "married", "education": "middle", "social_class": "lower class"}, "question": {"id": "Q2", "variant": 0}, "response": ["From my perspective as a married woman from Cairo, Egypt, my cultural context plays a pivotal role in how I understand the importance of friends in life. In our society, kinship networks and community ties are extremely important, and friendships are often deeply interconnected with these social structures. Additionally, my lower class socioeconomic background has influenced my understanding of the importance of friends, as we often rely on our friends for support and assistance in times of need. Furthermore, my personal experience and individual values have shaped my belief that friends are very important in life, as they provide emotional support and companionship. Therefore, based on my cultural context, socioeconomic background, and personal experience, I would argue that friends are very important in life.\n\n1"]}, {"persona": {"region": "Cairo", "sex": "male", "age": 58, "country": "Egypt", "marital_status": "married", "education": "higher", "social_class": "lower middle class"}, "question": {"id": "Q2", "variant": 0}, "response": ["Based on the anthropological framework, my perspective as a married male from Cairo, Egypt, at 58 years of age and part of the lower middle class, is influenced by several factors. The cultural context in Egypt places a high value on community and social connections, making friends an essential part of life. Additionally, my individual values and personal experience have shown me the importance of having a strong support network in a complex and sometimes challenging society. Socioeconomic background also plays a role, as being part of the lower middle class means that friends can provide both emotional and practical support. Furthermore, the cultural relativism in Egypt emphasizes the significance of social relationships and the role of friends in a person’s life. Therefore, from my perspective, friends are very important in life.\n\n1"]}, {"persona": {"region": "Cairo", "sex": "male", "age": 50, "country": "Egypt", "marital_status": "married", "education": "middle", "social_class": "lower middle class"}, "question": {"id": "Q2", "variant": 0}, "response": ["Based on the anthropological framework, as a married male from Cairo, Egypt, with a lower middle-class socioeconomic background and middle education level, my perspective on the importance of friends in life is influenced by my cultural context, individual values, and personal experience. In Egyptian culture, friendships are highly valued and play a significant role in providing support and companionship. Additionally, my personal experience and values emphasize the importance of maintaining strong social connections, especially in a society where family and community are central. Therefore, I believe that friends are very important in life.\n\n1"]}, {"persona": {"region": "Cairo", "sex": "female", "age": 40, "country": "Egypt", "marital_status": "married", "education": "higher", "social_class": "upper middle class"}, "question": {"id": "Q2", "variant": 0}, "response": ["From an emic perspective, as a married female from Cairo, Egypt, who is 40 years old and part of the upper middle class, the cultural context of my life is crucial in understanding the importance of friends. In Egyptian society, friendships are highly valued and considered an integral part of social life. Personal experience and individual values also play a significant role, as my education and socioeconomic background have afforded me the opportunity to cultivate meaningful relationships with friends. Additionally, the nuance of the question is important to consider, as the phrasing of \"how important\" allows for a subjective interpretation. Therefore, based on my cultural context, personal experience, and nuanced understanding of the question, I would say that friends are rather important in life.\n\n2"]}, {"persona": {"region": "Cairo", "sex": "female", "age": 33, "country": "Egypt", "marital_status": "married", "education": "middle", "social_class": "lower middle class"}, "question": {"id": "Q2", "variant": 0}, "response": ["From an emic perspective, as a married female from Cairo, Egypt, friends are very important in my life. In our cultural context, friendship is highly valued and plays a significant role in our daily lives. As an individual with middle education and lower middle class background, my personal experience and values also emphasize the importance of friendship. Additionally, considering the socioeconomic background, friends often provide support and companionship in the face of economic challenges. Cultural relativism also plays a role in my perception, as friendships are an integral part of our social fabric and are not viewed as a luxury, but as a necessity. Age and place also contribute to my perspective, as friendships provide a sense of belonging and community in our society. Therefore, based on these factors, I believe that friends are very important in life.\n\n1"]}, {"persona": {"region": "Cairo", "sex": "female", "age": 37, "country": "Egypt", "marital_status": "married", "education": "middle", "social_class": "lower middle class"}, "question": {"id": "Q2", "variant": 0}, "response": ["From an anthropological perspective, my cultural context as a married female from Cairo, Egypt, in the lower middle class, greatly influences my understanding of the importance of friends in life. In Egypt, social networks and friendships play a significant role in providing support and companionship, especially for individuals in lower socioeconomic backgrounds. Additionally, my personal experiences and values emphasize the importance of friendship and social connections in navigating life's challenges. Therefore, based on my cultural context, individual values, and personal experiences, I would say that friends are (2) Rather important in life."]}, {"persona": {"region": "Cairo", "sex": "male", "age": 28, "country": "Egypt", "marital_status": "married", "education": "middle", "social_class": "lower middle class"}, "question": {"id": "Q2", "variant": 0}, "response": ["Based on the anthropological framework, as a 28-year-old married male from Cairo, Egypt, my emic perspective would place a high value on the importance of friends in life. In Egyptian culture, friendships are often deeply rooted in social networks and kinship ties, and maintaining strong relationships with friends is seen as crucial for emotional support, socializing, and even potential business opportunities. Additionally, my socioeconomic background as part of the lower middle class means that I may rely more on my friends for support and networking, as resources and opportunities may be limited. Therefore, my personal experience and cultural context both lead me to believe that friends are very important in life.\n\n2"]}, {"persona": {"region": "Cairo", "sex": "male", "age": 53, "country": "Egypt", "marital_status": "married", "education": "higher", "social_class": "working class"}, "question": {"id": "Q2", "variant": 0}, "response": ["In my cultural context in Cairo, Egypt, personal relationships and kinship networks are of utmost importance. The emic perspective within my community emphasizes the significance of friends in providing support, social connections, and a sense of belonging. Additionally, as a working-class individual, my socioeconomic background places a high value on communal relationships and support systems. This, combined with my individual values and personal experiences, leads me to believe that friends are very important in life.\n\n1"]}, {"persona": {"region": "Cairo", "sex": "male", "age": 45, "country": "Egypt", "marital_status": "married", "education": "higher", "social_class": "lower middle class"}, "question": {"id": "Q2", "variant": 0}, "response": ["From the perspective of a married male from Cairo, Egypt, who is 45 years old, has completed higher education, and considers himself part of the lower middle class, the answer to the question of how important friends are in life would depend on various factors. The cultural context in Cairo values social connections and kinship networks, making friends an integral part of everyday life. Additionally, individual values and personal experiences play a significant role in shaping the importance of friendships. In this case, the individual's socioeconomic background as part of the lower middle class may also influence the value placed on friendships as a source of support and social interaction. Therefore, the answer chosen will reflect the nuanced understanding of the significance of friends in the persona's life.\n\n2"]}, {"persona": {"region": "Cairo", "sex": "male", "age": 52, "country": "Egypt", "marital_status": "married", "education": "middle", "social_class": "upper middle class"}, "question": {"id": "Q2", "variant": 0}, "response": ["Based on my cultural context in Cairo, Egypt, and my socioeconomic background as part of the upper middle class, friends are considered very important in life. In our culture, friendships are highly valued and play a vital role in our social interactions and support systems. Personal experience also tells me that friends are an integral part of life, providing emotional and practical support. Additionally, my age and place also influence my perspective, as friendships have been a significant aspect of my life for many years. Therefore, based on my personal experience and cultural context, I believe that friends are very important in life.\n\n1"]}, {"persona": {"region": "Cairo", "sex": "male", "age": 22, "country": "Egypt", "marital_status": "single", "education": "higher", "social_class": "lower middle class"}, "question": {"id": "Q2", "variant": 0}, "response": ["Based on the anthropological framework, as a single male from Cairo, Egypt, who is 22 years old and part of the lower middle class, my perspective on the importance of friends in life is influenced by my cultural context, individual values, and socioeconomic background. In Cairo, social connections and friendships are highly valued, as they often provide support and a sense of community in a densely populated and diverse city. Additionally, as a young adult who has completed higher education, I place a high value on social connections and friendships as they contribute to my personal growth, social support, and potential career opportunities. Therefore, I would say that friends are rather important in life.\n\n2"]}, {"persona": {"region": "Cairo", "sex": "female", "age": 57, "country": "Egypt", "marital_status": "divorced", "education": "middle", "social_class": "lower middle class"}, "question": {"id": "Q2", "variant": 0}, "response": ["In considering the importance of friends in life from the perspective of a divorced middle-aged woman from Cairo, Egypt, it is crucial to take into account the cultural context and individual values of the persona. In this context, social networks and friendships play a significant role in providing emotional support, companionship, and a sense of community, especially for those who may be experiencing personal challenges such as divorce. Additionally, the socioeconomic background of the persona, as a lower middle-class individual, may also influence the value placed on friendships as a source of practical and emotional support. Furthermore, the nuanced phrasing of the question and the emphasis on the importance of friends in life should be interpreted within the framework of the individual's personal experience and cultural context. \n\n2"]}, {"persona": {"region": "Cairo", "sex": "female", "age": 42, "country": "Egypt", "marital_status": "married", "education": "middle", "social_class": "working class"}, "question": {"id": "Q2", "variant": 0}, "response": ["Based on the anthropological framework, the perspective of a married female from Cairo, Egypt, who is 42 years old, completed middle education, and considers herself part of the working class, would be heavily influenced by her cultural context, individual values, and socioeconomic background. In Cairo, social networks and relationships are highly valued, and friendships often play a crucial role in providing support and companionship. Additionally, being part of the working class and having completed only middle education may limit her access to other forms of social interaction, making friendships even more important for emotional and practical support. Additionally, her age and life stage may lead her to prioritize relationships and connections with friends. Therefore, based on this perspective, I select option (1) Very important."]}, {"persona": {"region": "Cairo", "sex": "female", "age": 23, "country": "Egypt", "marital_status": "single", "education": "middle", "social_class": "lower middle class"}, "question": {"id": "Q2", "variant": 0}, "response": ["In considering the question of how important friends are in life, it is crucial to take into account the cultural context, individual values, and socioeconomic background of the persona in question. As a single female from Cairo, Egypt, who completed middle education and considers herself part of the lower middle class, the cultural context of Egypt places a strong emphasis on community and social connections. Additionally, as a young woman in her early twenties, personal experience and individual values are likely to prioritize the importance of friendships for support and companionship. Furthermore, the socioeconomic background of being part of the lower middle class may mean that friendships play a significant role in providing emotional and social support due to potential financial constraints. Taking all of these factors into consideration, it is likely that the persona would view friends as very important in life.\n\n1"]}, {"persona": {"region": "Cairo", "sex": "female", "age": 28, "country": "Egypt", "marital_status": "married", "education": "higher", "social_class": "upper middle class"}, "question": {"id": "Q2", "variant": 0}, "response": ["Based on my cultural context in Cairo, Egypt, friends are considered very important in life. In our culture, kinship networks and social connections play a crucial role in our daily lives. Additionally, my individual values and personal experience have shown me the significance of having a strong support system of friends. Furthermore, as part of the upper middle class, socializing and networking with friends is a common practice, and is often tied to socioeconomic background. Lastly, the nuance of the question also leads me to believe that friends are very important as there are various ways to interpret the importance of friends in life.\n\n1"]}, {"persona": {"region": "Cairo", "sex": "female", "age": 22, "country": "Egypt", "marital_status": "single", "education": "higher", "social_class": "lower middle class"}, "question": {"id": "Q2", "variant": 0}, "response": ["Based on the anthropological framework, as a single female from Cairo, Egypt, my emic perspective would emphasize the importance of close-knit social networks and the role of friends in providing emotional support and companionship. In the cultural context of Egypt, where community and relationships are highly valued, friends play a crucial role in daily life. Additionally, my individual values and personal experience as a young woman in a lower middle-class background have led me to rely on my friends for support, advice, and shared experiences. Socioeconomic background also plays a role, as socializing with friends may be a more affordable form of entertainment in comparison to other leisure activities. Therefore, based on my perspective, I would choose option (2) Rather important. \n\n2"]}, {"persona": {"region": "Cairo", "sex": "female", "age": 39, "country": "Egypt", "marital_status": "married", "education": "middle", "social_class": "lower middle class"}, "question": {"id": "Q2", "variant": 0}, "response": ["Based on the anthropological framework, as a married female from Cairo, Egypt, at the age of 39 and belonging to the lower middle class, my perspective on the importance of friends in life is heavily influenced by my cultural context and individual values. In Cairo, social connections and friendships play a significant role in providing support and a sense of community. Additionally, my socioeconomic background and personal experiences have shaped my belief that friends are rather important in life, as they offer companionship and emotional support, and can also provide practical help in times of need. Therefore, I choose option 2: Rather important."]}, {"persona": {"region": "Cairo", "sex": "male", "age": 19, "country": "Egypt", "marital_status": "single", "education": "middle", "social_class": "working class"}, "question": {"id": "Q2", "variant": 0}, "response": ["From an anthropological perspective, the cultural context and individual values of being a single male from Cairo, Egypt at 19 years of age and part of the working class are crucial in understanding the importance of friends in life. In Egyptian society, community and social connections are highly valued, and individuals often rely on their friends for emotional support, networking, and social activities. Additionally, as a working-class individual, friends may play a significant role in providing support and solidarity in navigating the challenges of daily life. This, combined with the individual values and personal experiences of the persona, leads to the conclusion that friends are rather important in life.\n2"]}, {"persona": {"region": "Cairo", "sex": "female", "age": 54, "country": "Egypt", "marital_status": "married", "education": "middle", "social_class": "working class"}, "question": {"id": "Q2", "variant": 0}, "response": ["From the emic perspective, as a married female from Cairo, Egypt, friends are considered to be very important. In this cultural context, social connections and relationships play a vital role in daily life, providing support, companionship, and a sense of belonging. Additionally, individual values and personal experience also contribute to the importance of friends, as they offer emotional support and understanding in a society where family and community are highly valued. Socioeconomic background, such as being part of the working class, also influences the significance of friends, as they can provide practical assistance and solidarity in navigating challenges. Therefore, considering the cultural context, personal experience, and socioeconomic background, the chosen answer is:\n\n1"]}, {"persona": {"region": "Cairo", "sex": "male", "age": 30, "country": "Egypt", "marital_status": "married", "education": "higher", "social_class": "working class"}, "question": {"id": "Q2", "variant": 0}, "response": ["From the perspective of a married male from Cairo, Egypt, at 30 years of age with a working-class background and higher education, the importance of friends in life is heavily influenced by cultural context and individual values. In Egyptian society, friendships are often seen as an integral part of life, providing emotional support, companionship, and social connections. Additionally, the cultural emphasis on community and socializing makes friendships a significant aspect of daily life. Furthermore, personal experience and socioeconomic background play a role in valuing friendships, as individuals from working-class backgrounds may rely on friends for various forms of support. Therefore, from this perspective, the answer is (2) Rather important. \n\n2"]}, {"persona": {"region": "Cairo", "sex": "male", "age": 39, "country": "Egypt", "marital_status": "married", "education": "higher", "social_class": "lower middle class"}, "question": {"id": "Q2", "variant": 0}, "response": ["From an emic perspective, as a married male from Cairo, Egypt, social networks and relationships are crucial in daily life. The cultural context of Egypt emphasizes the importance of community and strong ties with friends and family. Personal experience and individual values also play a significant role, as I have personally found that my friends provide support and companionship. Socioeconomic background is also important, as being part of the lower middle class means that I rely on my friends for emotional and sometimes even financial support. Additionally, cultural relativism is key, as in Egyptian society, friendships are often valued and cherished. Age and place are also important factors, as in my specific context, friendships are highly valued. Nuance is also crucial, as the specific phrasing of the question may influence my response. Based on these factors, I would say that friends are rather important in life. \n\n2"]}, {"persona": {"region": "Cairo", "sex": "female", "age": 41, "country": "Egypt", "marital_status": "married", "education": "middle", "social_class": "lower middle class"}, "question": {"id": "Q2", "variant": 0}, "response": ["Based on my cultural context in Cairo, Egypt, friends play a crucial role in my life. In our society, community and social connections are highly valued, and friends are often seen as an extension of family. Additionally, as a married woman, my friends provide support and companionship, especially since I consider myself part of the lower middle class and may face financial challenges. My personal experience and individual values also emphasize the significance of friendships in my life. Therefore, I would say that friends are (1) Very important in life."]}, {"persona": {"region": "Cairo", "sex": "male", "age": 45, "country": "Syria", "marital_status": "single", "education": "higher", "social_class": "upper middle class"}, "question": {"id": "Q2", "variant": 0}, "response": ["From the emic perspective, as a single male from Cairo, Syria, my cultural context places a high value on social relationships and community. In our society, friendships are a crucial part of daily life and provide support, companionship, and a sense of belonging. Additionally, my individual values and personal experience have shown me the significance of friendships in navigating life's challenges and celebrating its joys. As someone who considers themselves part of the upper middle class, I have the resources and social opportunities to cultivate and maintain friendships. Taking into account these factors, I believe that friends are very important in life.\n\n1"]}, {"persona": {"region": "Cairo", "sex": "male", "age": 54, "country": "Egypt", "marital_status": "married", "education": "higher", "social_class": "lower middle class"}, "question": {"id": "Q2", "variant": 0}, "response": ["In considering the question of the importance of friends in life from the perspective of a married male from Cairo, Egypt, who is 54 years old, completed higher education, and considers himself part of the lower middle class, several factors come into play. From an emic perspective, friendships and social networks are integral to the cultural context of Egypt, where communal ties and social interactions are highly valued. Personal experiences and individual values also highlight the significance of friendships in providing support and companionship, particularly in a lower middle class context where economic hardships and social pressures may be present. Additionally, the nuanced phrasing of the question also emphasizes the importance of friends in providing emotional and social support in various life stages. Therefore, from this perspective, friendships are seen as (2) Rather important."]}, {"persona": {"region": "Cairo", "sex": "male", "age": 65, "country": "Egypt", "marital_status": "married", "education": "middle", "social_class": "upper middle class"}, "question": {"id": "Q2", "variant": 0}, "response": ["Based on the anthropological framework, my response is shaped by my emic perspective as a married male from Cairo, Egypt, who values close-knit community ties. In our cultural context, friends are an integral part of our social fabric, providing emotional support, companionship, and social connections. My individual values and personal experience also play a role, as I have personally relied on my friends for advice and support in times of need. Additionally, my socioeconomic background as part of the upper middle class has allowed me to cultivate friendships through shared experiences and common interests. In our cultural relativism, the importance of friends is highly regarded, and space and time have also shaped my perspective as I have experienced the lifelong benefit of friendships. Overall, considering the nuanced phrasing of the question, I would say that friends are rather important in life.\n\n2"]}, {"persona": {"region": "Cairo", "sex": "female", "age": 52, "country": "Egypt", "marital_status": "married", "education": "middle", "social_class": "upper middle class"}, "question": {"id": "Q2", "variant": 0}, "response": ["Based on the anthropological framework, as a married female from Cairo, Egypt, my emic perspective would be influenced by my cultural context, individual values, and socioeconomic background. In Egyptian society, friendships are highly valued and play a significant role in social interactions and support networks. Additionally, as a member of the upper middle class, social connections and relationships with friends may hold particular importance in maintaining social status and social capital. Furthermore, my personal experience and values would also lead me to consider friendships as very important in life, as they provide emotional support, companionship, and a sense of community, which are highly valued in Egyptian culture.\n\n1"]}, {"persona": {"region": "Cairo", "sex": "male", "age": 26, "country": "Egypt", "marital_status": "single", "education": "higher", "social_class": "lower middle class"}, "question": {"id": "Q2", "variant": 0}, "response": ["Based on the anthropological framework, my perspective as a single male from Cairo, Egypt, is influenced by my cultural context, individual values, and socioeconomic background. In Egyptian society, friendships are highly valued and play a significant role in people's lives. The cultural context of Egypt emphasizes communal living and strong social bonds, where friends often serve as a support system and provide companionship. Additionally, as part of the lower middle class, I have experienced firsthand the importance of relying on friends for emotional and practical support in times of need. Therefore, based on my personal experience and the cultural context in which I live, I believe that friendships are very important in life.\n\n1"]}, {"persona": {"region": "Cairo", "sex": "male", "age": 32, "country": "Egypt", "marital_status": "married", "education": "middle", "social_class": "working class"}, "question": {"id": "Q2", "variant": 0}, "response": ["Based on the anthropological framework, as a married male from Cairo, Egypt, my emic perspective would emphasize the importance of friends in life due to the strong emphasis on community and social relationships in Egyptian culture. The cultural context of Egypt, with its collectivist values, also places high importance on maintaining friendships and social connections. Additionally, my individual values and personal experiences have shaped my understanding of the significance of friends in life, as I have relied on my friends for support and companionship throughout my life. Furthermore, my socioeconomic background as part of the working class has made me appreciate the value of friendships as a source of emotional and social support. In this nuanced context, I would choose option (1) Very important. \n\n1"]}, {"persona": {"region": "Cairo", "sex": "male", "age": 38, "country": "Egypt", "marital_status": "married", "education": "middle", "social_class": "lower middle class"}, "question": {"id": "Q2", "variant": 0}, "response": ["Based on the anthropological framework, as a married male from Cairo, Egypt, my perspective on the importance of friends in life would be influenced by various factors such as cultural context, individual values, and socioeconomic background. In Cairo, strong kinship networks and community ties are highly valued, and personal relationships are often a crucial support system. As a member of the lower middle class, my social interactions and friendships would likely be deeply intertwined with the socioeconomic conditions of my community. Additionally, my personal experiences and values would shape my understanding of the role of friendships in my life. Therefore, I would choose option (2) Rather important. \n\n2"]}, {"persona": {"region": "Cairo", "sex": "male", "age": 58, "country": "Egypt", "marital_status": "married", "education": "higher", "social_class": "upper middle class"}, "question": {"id": "Q2", "variant": 0}, "response": ["From an anthropological perspective, my emic perspective as a married male from Cairo, Egypt, is heavily influenced by my cultural context, individual values, and socioeconomic background. In Egyptian society, friendships are highly valued and play a significant role in social life. As someone from the upper middle class, I have been raised to prioritize maintaining strong social connections and cultivating meaningful friendships as a way to network and access social resources. Additionally, my personal experience and age have taught me the importance of having a supportive friend network, especially in times of need. Therefore, based on my cultural context, individual values, and socioeconomic background, I would say that friends are very important in life.\n\n1"]}, {"persona": {"region": "Cairo", "sex": "male", "age": 49, "country": "Egypt", "marital_status": "married", "education": "middle", "social_class": "lower middle class"}, "question": {"id": "Q2", "variant": 0}, "response": ["Based on the anthropological framework, as a married male from Cairo, Egypt, my emic perspective values the importance of friends in life as very important. In Egyptian culture, friendships are highly valued and play a significant role in social support, emotional well-being, and even economic exchanges. The cultural context of Cairo emphasizes the importance of maintaining strong social bonds and kinship networks, and personal experience has shown me the vital role that friends play in providing support and companionship. Additionally, my lower middle class socioeconomic background has led me to rely on friends for mutual aid and solidarity. Therefore, from this perspective, the answer is: (1) Very important"]}, {"persona": {"region": "Cairo", "sex": "female", "age": 29, "country": "Egypt", "marital_status": "married", "education": "middle", "social_class": "working class"}, "question": {"id": "Q2", "variant": 0}, "response": ["In the cultural context of Cairo, Egypt, social relationships and kinship networks play a pivotal role in everyday life. As a married female from this context, my individual values and personal experience also emphasize the significance of friendship and social connections, especially given the cultural emphasis on community and support networks. Additionally, my socioeconomic background as part of the working class suggests that friends may provide crucial emotional support and practical assistance in navigating daily challenges. Considering the nuanced phrasing of the question and the emic perspective of my cultural context, I would say that friends are rather important in life.\n\n2"]}, {"persona": {"region": "Cairo", "sex": "female", "age": 36, "country": "Egypt", "marital_status": "married", "education": "higher", "social_class": "lower middle class"}, "question": {"id": "Q2", "variant": 0}, "response": ["From an anthropological perspective, my answer to the question of how important friends are in life is heavily influenced by my cultural context, individual values, and socioeconomic background. In Cairo, Egypt, social relationships and community ties hold great significance. As a married woman in my mid-thirties, I value the companionship and support that friends provide, especially in a society where family and community play a central role in one's life. Additionally, being part of the lower middle class, I rely on my friendships for emotional and practical support, making them an integral part of my life. Therefore, I would say that friends are rather important in my life.\n\n2"]}, {"persona": {"region": "Cairo", "sex": "female", "age": 34, "country": "Egypt", "marital_status": "married", "education": "middle", "social_class": "lower middle class"}, "question": {"id": "Q2", "variant": 0}, "response": ["From my perspective as a married woman from Cairo, Egypt, with a middle education level and belonging to the lower middle class, I understand the importance of friendships within the cultural context of my society. In Egypt, kinship networks and community ties are very important, and friends often play a crucial role in providing support and assistance, especially in times of need. Additionally, my individual values and personal experiences have shown me the significance of maintaining strong friendships within my socioeconomic background. Therefore, I believe that friends are rather important in life, as they contribute to my overall well-being and social support network.\n\n2"]}, {"persona": {"region": "Fayoum", "sex": "male", "age": 57, "country": "Egypt", "marital_status": "married", "education": "middle", "social_class": "working class"}, "question": {"id": "Q2", "variant": 0}, "response": ["Based on the anthropological framework, as a married male from Fayoum, Egypt, my emic perspective on the importance of friends in life is heavily influenced by my cultural context and individual values. In our community, kinship networks and family ties are of utmost importance, and social connections play a significant role in our daily lives. Additionally, my working-class background and middle education level have shaped my understanding of the value of friendship as a source of support and solidarity. Furthermore, my age and life experiences have taught me the importance of companionship and social interaction. Therefore, I believe that friends are rather important in life, as they contribute to our emotional well-being and provide a sense of community. \n\n2"]}, {"persona": {"region": "Fayoum", "sex": "male", "age": 60, "country": "Egypt", "marital_status": "married", "education": "middle", "social_class": "lower middle class"}, "question": {"id": "Q2", "variant": 0}, "response": ["From the anthropological perspective, my answer is based on the cultural context of Fayoum, Egypt, where social relationships and kinship networks are highly valued. Additionally, my individual values and personal experiences as a member of the lower middle class have shaped my understanding of the significance of friends in life. Given my socioeconomic background and age, I have come to value the support and companionship of friends as crucial for emotional and social well-being. Therefore, my answer will reflect the importance of friends in life from the perspective of someone who values social relationships and recognizes their significance in navigating the challenges of daily life.\n\n2"]}, {"persona": {"region": "Fayoum", "sex": "male", "age": 21, "country": "Egypt", "marital_status": "single", "education": "middle", "social_class": "lower middle class"}, "question": {"id": "Q2", "variant": 0}, "response": ["From the perspective of a single male from Fayoum, Egypt, who is 21 years old and part of the lower middle class, it is important to consider the cultural context, individual values, and socioeconomic background. In this particular cultural context, friendships and social relationships are highly valued, as they provide a support system and social connections that are important for navigating life. Additionally, at this age and socioeconomic background, friendships may play a crucial role in finding job opportunities and building social networks for future success. Therefore, based on these considerations, I would choose option (2) Rather important. \n\n2"]}, {"persona": {"region": "Fayoum", "sex": "male", "age": 33, "country": "Egypt", "marital_status": "single", "education": "higher", "social_class": "working class"}, "question": {"id": "Q2", "variant": 0}, "response": ["In the cultural context of Fayoum, Egypt, social relationships and kinship networks play a crucial role in everyday life. As a single male from this region, I have observed that friendships are highly valued and considered an essential part of life. The emic perspective within this cultural context emphasizes the significance of communal support and the sharing of experiences with friends. Additionally, my personal experience and individual values align with the importance of friendships, as they provide emotional support, social connections, and opportunities for mutual assistance. Therefore, based on my understanding of the cultural context and personal experience, I would choose the following option:\n\n2"]}, {"persona": {"region": "Fayoum", "sex": "male", "age": 32, "country": "Egypt", "marital_status": "married", "education": "higher", "social_class": "lower middle class"}, "question": {"id": "Q2", "variant": 0}, "response": ["From an anthropological perspective, the importance of friends in life is deeply tied to cultural context, individual values, and socioeconomic background. In the cultural context of Fayoum, Egypt, social relationships and community ties are highly valued. Personal experience and individual values also play a significant role in shaping the importance of friends in one's life. As a married male from Fayoum, Egypt, who considers himself part of the lower middle class, the support and companionship of friends can be crucial for navigating challenges and finding joy in life. Therefore, I believe that friends are (2) Rather important in life."]}, {"persona": {"region": "Gharbia", "sex": "male", "age": 42, "country": "Egypt", "marital_status": "married", "education": "higher", "social_class": "upper middle class"}, "question": {"id": "Q2", "variant": 0}, "response": ["From the emic perspective, as a married male from Gharbia, Egypt, I have been socialized to value friendship and social connections as an important part of life. In the cultural context of Egypt, friendships are often deeply rooted in kinship networks and play a significant role in social and personal life. Additionally, my individual values and personal experiences have shaped my understanding of the importance of friends, as they provide emotional support, companionship, and opportunities for socializing. My upper middle-class socioeconomic background has also influenced my perception, as I have greater access to social activities and opportunities to cultivate friendships. Considering these factors, I would say that friends are rather important in life.\n\n2"]}, {"persona": {"region": "Gharbia", "sex": "male", "age": 52, "country": "Egypt", "marital_status": "married", "education": "middle", "social_class": "working class"}, "question": {"id": "Q2", "variant": 0}, "response": ["From the perspective of a married male from Gharbia, Egypt, who is 52 years old, has completed middle education, and considers himself part of the working class, the importance of friends in life is heavily influenced by cultural context, individual values, and socioeconomic background. In Gharbia, family and community are highly valued, and friendships often extend beyond social connections to include economic and emotional support. As a working-class individual, the support network provided by friends is essential for navigating challenges and finding opportunities. Additionally, personal experience and values likely prioritize the role of friends in providing companionship and solidarity. Therefore, the answer chosen from this perspective is:\n\n2"]}, {"persona": {"region": "Gharbia", "sex": "male", "age": 45, "country": "Egypt", "marital_status": "divorced", "education": "higher", "social_class": "upper middle class"}, "question": {"id": "Q2", "variant": 0}, "response": ["In the cultural context of Gharbia, Egypt, friends play a significant role in the social and emotional support system. Socioeconomic background also plays a role, as individuals in the upper middle class may have more opportunities for socializing and networking with friends. Personal experience and individual values also influence the perception of the importance of friends, as someone who has gone through a divorce may value friendship and support more. Additionally, age and space are important factors, as a 45-year-old individual may have developed deep and meaningful friendships over time. Therefore, based on this perspective, the answer would be:\n\n2"]}, {"persona": {"region": "Behaira", "sex": "male", "age": 23, "country": "Egypt", "marital_status": "single", "education": "middle", "social_class": "lower class"}, "question": {"id": "Q2", "variant": 0}, "response": ["Based on the anthropological framework, as a single male from Behaira, Egypt, my emic perspective is that friends are very important in life. In my cultural context, friendships provide support and companionship in a society where kinship networks are crucial. My individual values and personal experience also lead me to believe that friendships are vital for emotional and social well-being, particularly given my lower socioeconomic background. Additionally, cultural relativism teaches me that the importance of friendships may vary across different cultures, but for me and my community, they are valued. Space and time also play a role as I am at a stage in life where friendships are particularly important for socialization and networking. Overall, the nuanced phrasing of the question also leads me to believe that friends are indeed very important in life.\n\n2"]}, {"persona": {"region": "Behaira", "sex": "male", "age": 38, "country": "Egypt", "marital_status": "single", "education": "higher", "social_class": "lower class"}, "question": {"id": "Q2", "variant": 0}, "response": ["Based on my personal experience and socioeconomic background, I understand the importance of friends in life. Coming from a lower-class background in Behaira, Egypt, friends play a crucial role in providing support and companionship. In my cultural context, social networks are essential for emotional and practical support, especially when facing economic challenges. Additionally, individual values and personal experience have shown me the significance of having friends to rely on. Therefore, I believe that friends are very important in life.\n\n1"]}, {"persona": {"region": "Behaira", "sex": "male", "age": 32, "country": "Egypt", "marital_status": "married", "education": "middle", "social_class": "lower class"}, "question": {"id": "Q2", "variant": 0}, "response": ["Based on the anthropological framework, as a married male from Behaira, Egypt, my emic perspective is that friends are very important. In my cultural context, friends are not just people I socialize with, but they are also my support system and play a crucial role in my daily life. My individual values and personal experience also lead me to believe that friends are essential for emotional and practical support. Additionally, my lower socioeconomic background means that I rely on my friends for assistance and camaraderie. Finally, considering the importance of space and time, as a 32-year-old man, I have likely developed strong bonds and reliance on my friends. \n\n2"]}, {"persona": {"region": "Behaira", "sex": "female", "age": 37, "country": "Egypt", "marital_status": "married", "education": "middle", "social_class": "working class"}, "question": {"id": "Q2", "variant": 0}, "response": ["Based on the anthropological framework, I, as a married female from Behaira, Egypt, understand the importance of friends in life through the lens of cultural context, individual values, and socioeconomic background. In my cultural context, friends play a crucial role in providing support, companionship, and social connections. My individual values prioritize the bonds of friendship and the sense of community that comes with it. Additionally, as part of the working class, friends are often relied upon for emotional and practical support in times of need, making them very important in my life.\n\n1"]}, {"persona": {"region": "Behaira", "sex": "male", "age": 48, "country": "Egypt", "marital_status": "married", "education": "middle", "social_class": "working class"}, "question": {"id": "Q2", "variant": 0}, "response": ["Based on the emic and etic perspectives, as a married male from Behaira, Egypt, I consider friends to be very important in life. In my cultural context, friendships play a crucial role in providing social support, emotional connection, and practical assistance. My individual values and personal experience also emphasize the significance of friendships in navigating the challenges of daily life. Additionally, considering my working-class background, friends often serve as a valuable network for sharing resources and opportunities. Taking into account the cultural relativism, I understand that the importance of friends may vary across different cultures, but from my perspective, they hold a significant place in life. Furthermore, age and place also influence my perception, as maintaining friendships has been a vital aspect of my social life and well-being throughout my 48 years in Behaira, Egypt. Lastly, the nuanced phrasing of the question leads me to choose \"Very important\" as my answer, as it accurately reflects the importance of friendships in my life.\n\n1"]}, {"persona": {"region": "Behaira", "sex": "female", "age": 34, "country": "Egypt", "marital_status": "married", "education": "middle", "social_class": "lower class"}, "question": {"id": "Q2", "variant": 0}, "response": ["Based on the anthropological framework, as a married female from Behaira, Egypt, my emic perspective on the importance of friends in life is greatly influenced by my cultural context and socioeconomic background. In my community, friends provide crucial support and companionship, especially in times of hardship. Additionally, my lower class status means that I rely on friends for practical assistance and emotional support, as I may not have access to the same resources as those in higher socioeconomic classes. Furthermore, my personal experience and individual values emphasize the significance of friendships in navigating life's challenges and celebrating its joys. Therefore, I believe that friends are very important in life.\n\n1"]}, {"persona": {"region": "Behaira", "sex": "female", "age": 30, "country": "Egypt", "marital_status": "divorced", "education": "lower", "social_class": "lower class"}, "question": {"id": "Q2", "variant": 0}, "response": ["In the cultural context of Behaira, Egypt, social relationships and kinship networks play a crucial role in everyday life. As a divorced female from a lower socioeconomic background, my personal experience and values have shaped my understanding of the importance of friends in life. In this cultural context, friends are considered an important source of emotional support, companionship, and practical assistance. This is especially true for individuals who may not have strong family support systems due to circumstances such as divorce or economic hardship. Additionally, as a 30-year-old woman, my age and life experiences have likely led me to prioritize the value of friendships in my daily life. Considering all these factors, I would choose option (1) Very important. \n\n1"]}, {"persona": {"region": "Behaira", "sex": "male", "age": 40, "country": "Egypt", "marital_status": "married", "education": "higher", "social_class": "lower middle class"}, "question": {"id": "Q2", "variant": 0}, "response": ["From an anthropological perspective, my personal experience and individual values play a significant role in shaping my understanding of the importance of friends in life. As a married male from Behaira, Egypt, at the age of 40, and part of the lower middle class, my cultural context, socioeconomic background, and space and time are crucial factors in my perception of the significance of friends. In my community, friends often serve as a support system, especially in times of need, and are an integral part of social life. Additionally, my personal values emphasize the importance of maintaining strong social connections. Therefore, considering all these factors, I would say that friends are rather important in life as they play a crucial role in providing support and companionship.\n\n2"]}, {"persona": {"region": "Behaira", "sex": "male", "age": 38, "country": "Egypt", "marital_status": "married", "education": "middle", "social_class": "working class"}, "question": {"id": "Q2", "variant": 0}, "response": ["From the anthropological perspective, as a married male from Behaira, Egypt, my cultural context values kinship networks, social connections, and community support. As a member of the working class, my socioeconomic background also influences my perspective, as I rely on my friends for emotional support, social connections, and potentially even financial assistance in times of need. Additionally, my age and place in life at 38 years old means that I likely have established friendships that play a crucial role in my personal and social life. Therefore, based on my individual values and personal experience within this cultural and socioeconomic context, I believe that friends are very important in life.\n\n1"]}, {"persona": {"region": "Behaira", "sex": "female", "age": 30, "country": "Egypt", "marital_status": "married", "education": "higher", "social_class": "lower class"}, "question": {"id": "Q2", "variant": 0}, "response": ["Based on the anthropological framework, my emic perspective as a married female from Behaira, Egypt, is shaped by my cultural context, individual values, and socioeconomic background. In my community, social connections and support networks are crucial for navigating the challenges of daily life. Additionally, my lower socioeconomic status means that I rely heavily on the support and companionship of friends to help me through difficult times. Therefore, from my perspective, friends are very important in life.\n\n1"]}, {"persona": {"region": "Behaira", "sex": "female", "age": 35, "country": "Egypt", "marital_status": "married", "education": "middle", "social_class": "working class"}, "question": {"id": "Q2", "variant": 0}, "response": ["In Behaira, Egypt, as a married woman of 35 years with a middle education level and part of the working class, my perspective on the importance of friends is heavily influenced by my cultural context and socioeconomic background. In our community, friendships are a crucial part of our social support network, providing emotional and practical assistance. As someone who may face financial challenges and has limited access to resources, friends play a significant role in helping each other navigate through life's challenges. Additionally, the cultural emphasis on community and collective support means that friendships are highly valued and are seen as a vital aspect of our lives. Therefore, based on my personal experience and cultural context, I would perceive friends as very important in life.\n\n1"]}, {"persona": {"region": "Behaira", "sex": "male", "age": 52, "country": "Egypt", "marital_status": "married", "education": "middle", "social_class": "lower class"}, "question": {"id": "Q2", "variant": 0}, "response": ["Based on the anthropological framework, as a married male from Behaira, Egypt, I would consider friends to be rather important in life. In Egyptian culture, the importance of social networks and relationships is crucial, and having close friends can provide support and assistance in various aspects of life. Additionally, being part of the lower class, social connections and relationships with friends can be a source of emotional support and practical help in times of need. Furthermore, my personal experience and values also lead me to believe that friends play a significant role in one's life, especially in a community-oriented society like Egypt. Therefore, based on my cultural context, individual values, and personal experiences, I would say that friends are rather important in life.\n\n2"]}, {"persona": {"region": "Alexandria", "sex": "female", "age": 41, "country": "Egypt", "marital_status": "single", "education": "middle", "social_class": "lower class"}, "question": {"id": "Q2", "variant": 0}, "response": ["Based on the anthropological framework, as a single female from Alexandria, Egypt, with a middle education level and lower socioeconomic background, my understanding and perception of the importance of friends in life is influenced by my cultural context, individual values, and personal experience. In Egyptian society, social connections and friendships are highly valued, especially for individuals in lower socioeconomic classes who may rely on their social networks for support and assistance. Additionally, my personal experience has shown me the significance of having friends to rely on in times of need. Therefore, I would say that friends are very important in life.\n\n1"]}, {"persona": {"region": "Alexandria", "sex": "female", "age": 21, "country": "Egypt", "marital_status": "single", "education": "middle", "social_class": "lower class"}, "question": {"id": "Q2", "variant": 0}, "response": ["Based on the anthropological framework, my emic perspective as a young woman from Alexandria, Egypt, who comes from a lower socioeconomic background, is that friends are incredibly important in life. In my cultural context, friends serve as a support network, providing emotional and practical assistance in times of need. My individual values and personal experience have shown me the significance of friendship in navigating life's challenges. Additionally, cultural relativism teaches me to understand that the importance of friends may vary across different cultures, but from my perspective, friends play a crucial role in my life. Therefore, my answer is:\n1"]}, {"persona": {"region": "Alexandria", "sex": "female", "age": 35, "country": "Egypt", "marital_status": "married", "education": "middle", "social_class": "lower class"}, "question": {"id": "Q2", "variant": 0}, "response": ["Based on the anthropological framework, my perspective as a married female from Alexandria, Egypt, with a middle education level and part of the lower class is heavily influenced by my cultural context, individual values, socioeconomic background, and space and time. In my cultural context, relationships and community are highly valued, and friendships play a crucial role in providing support and social connections. In terms of individual values and personal experience, my upbringing and experiences have taught me the importance of relying on friends for emotional and practical support. Additionally, my socioeconomic background as part of the lower class means that friends are often relied upon for mutual aid and solidarity. Furthermore, at 35 years of age, friendships have become even more important as my social network helps me navigate family and work responsibilities. Therefore, from my perspective, friends are very important in life.\n\n1"]}, {"persona": {"region": "Alexandria", "sex": "male", "age": 34, "country": "Egypt", "marital_status": "married", "education": "higher", "social_class": "working class"}, "question": {"id": "Q2", "variant": 0}, "response": ["Based on the anthropological framework, as a married male from Alexandria, Egypt, my cultural context and kinship networks place a high value on social connections and relationships. My individual values and personal experience also emphasize the importance of friendships in providing support and camaraderie. Additionally, my socioeconomic background as a working-class individual means that friends often play a crucial role in navigating life's challenges and providing emotional and practical assistance. Therefore, based on these factors, I would say:\n\n2"]}, {"persona": {"region": "Alexandria", "sex": "female", "age": 37, "country": "Egypt", "marital_status": "married", "education": "higher", "social_class": "lower middle class"}, "question": {"id": "Q2", "variant": 0}, "response": ["In considering the importance of friends in life from the perspective of a married female from Alexandria, Egypt, who is 37 years old and part of the lower middle class, it's important to take into account the cultural context and individual values. In Egyptian society, social connections and relationships hold significant value, and friends often play a crucial role in providing emotional support and companionship. Additionally, given the socioeconomic background, friends may also serve as a vital resource for sharing resources and navigating challenges. Furthermore, personal experience and individual values may also influence the perception of the importance of friendships, particularly in a society where community and social networks are highly valued. Therefore, it can be argued that friends are rather important in life.\n\n2"]}, {"persona": {"region": "Alexandria", "sex": "female", "age": 56, "country": "Egypt", "marital_status": "divorced", "education": "middle", "social_class": "working class"}, "question": {"id": "Q2", "variant": 0}, "response": ["Based on the anthropological framework, as a divorced 56-year-old female from Alexandria, Egypt, my emic perspective is that friends are incredibly important in life. In our cultural context, friends often become like family and provide crucial support and companionship, especially for someone who may no longer have a spouse. My individual values and personal experience also influence this belief, as I have relied on my friends for emotional support and companionship after my divorce. Additionally, my socioeconomic background as a working-class individual means that I may not have access to the same resources and support systems as someone from a higher socioeconomic class, making the role of friends even more important in my life. Lastly, the nuance of the question is important, as the phrasing implies that friends are not just important, but \"very\" important, which aligns with my perspective based on the factors mentioned above.\n\n2"]}, {"persona": {"region": "Alexandria", "sex": "male", "age": 48, "country": "Egypt", "marital_status": "married", "education": "higher", "social_class": "working class"}, "question": {"id": "Q2", "variant": 0}, "response": ["Based on the anthropological framework, as a married male from Alexandria, Egypt, my cultural context, individual values, and personal experiences shape my understanding of the importance of friends in life. In Egyptian culture, friendships are highly valued and play a significant role in providing social support, especially in the working-class community. Additionally, my age and education level have influenced my perspective, as I have likely formed long-lasting friendships and understand the importance of companionship. Therefore, based on my cultural and personal context, I would say that friends are (2) Rather important."]}, {"persona": {"region": "Alexandria", "sex": "female", "age": 30, "country": "Egypt", "marital_status": "married", "education": "middle", "social_class": "working class"}, "question": {"id": "Q2", "variant": 0}, "response": ["Based on my cultural context as a married female from Alexandria, Egypt, and my working-class background, I understand the importance of friends in life from a nuanced perspective. In my community, friends play a crucial role in providing emotional support, sharing resources, and helping each other navigate through life's challenges. Additionally, my individual values and personal experiences have taught me the significance of maintaining strong social connections. I also consider the cultural relativism aspect, recognizing that the importance of friends may vary across different cultures. Therefore, taking into account the socioeconomic background, cultural context, and personal experience, I believe that friends are very important in life.\n\n1"]}, {"persona": {"region": "Alexandria", "sex": "male", "age": 19, "country": "Egypt", "marital_status": "single", "education": "middle", "social_class": "lower class"}, "question": {"id": "Q2", "variant": 0}, "response": ["Based on the anthropological framework, my perspective is influenced by my cultural context, individual values, and socioeconomic background. In Alexandria, Egypt, community and kinship networks are essential, and personal experience and lower socioeconomic status have shaped my understanding of the importance of friends. In my community, friends are crucial for support and social connections, and my own experience of struggling with limited resources makes me value the support and companionship of friends. Therefore, I would say that friends are very important in life.\n\n1"]}, {"persona": {"region": "Alexandria", "sex": "male", "age": 45, "country": "Egypt", "marital_status": "married", "education": "middle", "social_class": "lower middle class"}, "question": {"id": "Q2", "variant": 0}, "response": ["Based on the anthropological framework, as a married male from Alexandria, Egypt, my emic perspective would emphasize the importance of friends in life. In Egyptian culture, relationships and social connections are highly valued, and maintaining close friendships is seen as a crucial aspect of life. Additionally, my socioeconomic background as a lower middle class individual means that my personal experiences and values have been shaped by the support and camaraderie of friends within my community. Furthermore, the cultural context of Alexandria emphasizes the significance of social networks and personal connections in navigating various aspects of life. Therefore, from my perspective, the answer to the question would be:\n\n2"]}, {"persona": {"region": "Alexandria", "sex": "male", "age": 23, "country": "Egypt", "marital_status": "single", "education": "higher", "social_class": "lower class"}, "question": {"id": "Q2", "variant": 0}, "response": ["Based on the anthropological framework, my emic perspective as a single male from Alexandria, Egypt, who considers himself part of the lower class, is heavily influenced by my cultural context, individual values, and socioeconomic background. In Egyptian culture, friendships are highly valued, and social connections are essential for support and communal belonging. As someone from the lower class, friendships may be even more important for emotional and practical support due to limited resources and economic struggles. Additionally, my individual values prioritize communal relationships and solidarity, making friends a significant part of my life. Therefore, from this perspective, I would say:\n\n2"]}, {"persona": {"region": "Alexandria", "sex": "female", "age": 28, "country": "Egypt", "marital_status": "married", "education": "middle", "social_class": "working class"}, "question": {"id": "Q2", "variant": 0}, "response": ["Based on the anthropological framework, as a married female from Alexandria, Egypt, social relationships and kinship networks are crucial in my cultural context. Additionally, as part of the working class, I value the support and companionship of friends, especially in the context of limited resources and economic challenges. My individual values and personal experience also emphasize the significance of friendships in providing emotional support and camaraderie. Therefore, I believe that friends are very important in life.\n\n1"]}, {"persona": {"region": "Alexandria", "sex": "male", "age": 34, "country": "Egypt", "marital_status": "single", "education": "higher", "social_class": "working class"}, "question": {"id": "Q2", "variant": 0}, "response": ["From an emic perspective, as a single male from Alexandria, Egypt, friends hold significant importance in my life. In our cultural context, friendships are often built on strong social bonds and are seen as an essential support system. Personal experience has shown me the value of having friends to rely on in times of need and to share life's joys. Additionally, being part of the working class, friends play a crucial role in providing emotional and sometimes even financial support. Considering these factors, I would say that friends are rather important in my life.\n\n2"]}, {"persona": {"region": "Alexandria", "sex": "male", "age": 30, "country": "Egypt", "marital_status": "married", "education": "higher", "social_class": "lower middle class"}, "question": {"id": "Q2", "variant": 0}, "response": ["Based on my emic perspective as a married male from Alexandria, Egypt, I understand the importance of friends in life within the cultural context of my community. In our society, friends play a crucial role in providing support, companionship, and assistance in navigating various social and personal challenges. Individual values and personal experiences also contribute to the significance of friends, as they offer a sense of belonging and emotional fulfillment. Additionally, considering my lower middle class socioeconomic background, friends serve as a valuable resource for social networking and mutual aid. Overall, the nuanced understanding of the importance of friends in my life is influenced by cultural relativism, space, and time, as well as my personal experiences and values.\n\n2"]}, {"persona": {"region": "Alexandria", "sex": "female", "age": 49, "country": "Egypt", "marital_status": "married", "education": "higher", "social_class": "lower middle class"}, "question": {"id": "Q2", "variant": 0}, "response": ["Based on the anthropological framework, as a married female from Alexandria, Egypt, my perspective on the importance of friends in life is influenced by my cultural context, individual values, and socioeconomic background. In Egyptian society, relationships and social connections are highly valued, and friendships play a crucial role in providing support and companionship. Additionally, as a married woman in the lower middle class, my personal experience and socioeconomic background have shaped my understanding of the importance of friends, as they often serve as a source of emotional and practical assistance. Therefore, I would say that friends are rather important in life.\n\n2"]}, {"persona": {"region": "Kafr el-sheikh", "sex": "male", "age": 49, "country": "Egypt", "marital_status": "married", "education": "higher", "social_class": "working class"}, "question": {"id": "Q2", "variant": 0}, "response": ["Based on the anthropological framework, my emic perspective as a married male from Kafr el-sheikh, Egypt, at 49 years of age and part of the working class, is influenced by my cultural context, individual values, and socioeconomic background. In Egypt, friendship is highly valued and plays a crucial role in providing support and companionship, especially within the context of a close-knit community. Additionally, my personal experience and values emphasize the significance of maintaining strong social connections and the importance of mutual assistance. Therefore, I believe that friends are very important in life.\n\n1"]}, {"persona": {"region": "Kafr el-sheikh", "sex": "male", "age": 25, "country": "Egypt", "marital_status": "single", "education": "middle", "social_class": "lower middle class"}, "question": {"id": "Q2", "variant": 0}, "response": ["Based on my emic perspective, coming from Kafr el-sheikh, Egypt, I have been raised to value community and social connections. The cultural context of my upbringing has taught me that friendships are essential for support and companionship. Additionally, my individual values and personal experience have shown me the significance of friends in navigating life's challenges. Considering my lower middle-class background, I have often relied on the help and solidarity of my friends. Moreover, cultural relativism reminds me that the importance of friends may vary across different cultures. Therefore, based on my nuanced understanding and personal experience, I believe that friends are (2) Rather important."]}, {"persona": {"region": "Kafr el-sheikh", "sex": "male", "age": 59, "country": "Egypt", "marital_status": "married", "education": "higher", "social_class": "lower middle class"}, "question": {"id": "Q2", "variant": 0}, "response": ["Based on the anthropological framework, as a married male from Kafr el-sheikh, Egypt, I understand the importance of friends in life through a cultural context. In my community, kinship networks and social relationships hold great significance, and friends play a crucial role in providing support and companionship. Additionally, my lower middle-class socioeconomic background has taught me to value relationships and connections as a source of emotional and practical support. Personal experience has also shown me that friends are important for socializing and sharing experiences. Therefore, from my perspective, I believe that friends are (2) Rather important."]}, {"persona": {"region": "Kafr el-sheikh", "sex": "female", "age": 38, "country": "Egypt", "marital_status": "married", "education": "middle", "social_class": "working class"}, "question": {"id": "Q2", "variant": 0}, "response": ["From my perspective as a married female from Kafr el-sheikh, Egypt, with a middle education level and belonging to the working class, I understand the importance of friends in life based on my cultural context and socioeconomic background. In my community, friends play a crucial role in providing support and companionship, especially for individuals like me who may not have extensive formal education or financial resources. Additionally, personal experience and individual values also contribute to the significance of friendships in my life. Therefore, I believe that friends are rather important in life.\n\n2"]}, {"persona": {"region": "Kafr el-sheikh", "sex": "male", "age": 35, "country": "Egypt", "marital_status": "married", "education": "higher", "social_class": "lower middle class"}, "question": {"id": "Q2", "variant": 0}, "response": ["From my perspective as a married male from Kafr el-sheikh, Egypt, I understand the importance of friends in life through the cultural context and individual values. In our culture, kinship networks and social connections play a crucial role in providing support and a sense of community. As a member of the lower middle class, I have experienced the value of having friends who can offer practical assistance and emotional support, especially in times of need. Additionally, my personal experience has taught me the significance of friendships in navigating life's challenges and celebrating its joys. Therefore, I believe that friends are rather important in life.\n\n2"]}, {"persona": {"region": "Kafr el-sheikh", "sex": "male", "age": 49, "country": "Egypt", "marital_status": "married", "education": "middle", "social_class": "lower class"}, "question": {"id": "Q2", "variant": 0}, "response": ["In my cultural context in Kafr el-sheikh, Egypt, friends play a crucial role in daily life. The socioeconomic background of being part of the lower class means that friendships and social networks are vital for support and survival. Personal experience and individual values also emphasize the significance of friends in providing emotional and practical support. Additionally, the emic perspective of valuing communal relationships and the etic perspective of recognizing the importance of social connections in Egyptian society further reinforce the importance of friends. Therefore, based on my cultural context and personal experience, I believe that friends are very important in life.\n\n1"]}, {"persona": {"region": "Kafr el-sheikh", "sex": "male", "age": 37, "country": "Egypt", "marital_status": "married", "education": "middle", "social_class": "lower class"}, "question": {"id": "Q2", "variant": 0}, "response": ["Based on my cultural context and socioeconomic background, friends are very important in my life. In Kafr el-sheikh, Egypt, community and social connections are highly valued, and my lower class status means that I rely on my friends for support and companionship. Additionally, my personal experience and individual values emphasize the importance of friendship in providing emotional and practical assistance in our daily lives. Furthermore, the nuanced phrasing of the question allows for the recognition of the significance of friends in my specific cultural and socioeconomic context. \n\n1"]}, {"persona": {"region": "Menofia", "sex": "female", "age": 22, "country": "Egypt", "marital_status": "single", "education": "middle", "social_class": "lower class"}, "question": {"id": "Q2", "variant": 0}, "response": ["Based on the framework of anthropological methods, as a single female from Menofia, Egypt, who comes from a lower socioeconomic background, cultural context is a pivotal factor in shaping my understanding and answer to the question. In my cultural context, kinship networks and social relationships are highly valued, and friends often play a crucial role in providing support and community. Additionally, individual values and personal experience also play a significant role in shaping my perspective, and as someone who may have limited access to resources and opportunities, friends may hold even more importance in providing social and emotional support. Therefore, my answer would be:\n\n2"]}, {"persona": {"region": "Menofia", "sex": "female", "age": 25, "country": "Egypt", "marital_status": "married", "education": "middle", "social_class": "lower class"}, "question": {"id": "Q2", "variant": 0}, "response": ["From the perspective of a 25-year-old married woman from Menofia, Egypt, who has completed middle education and considers herself part of the lower class, the importance of friends in life is heavily influenced by cultural context, individual values, and socioeconomic background. In Menofia, community and social connections are highly valued, and friendships play a crucial role in providing support, companionship, and social networks. As a member of the lower class, friends may also serve as a source of emotional and practical support, especially in the face of economic challenges. Additionally, personal experiences and values may lead to a strong emphasis on the importance of friendship for this individual, as they may rely on friends for mutual aid and solidarity. Therefore, from this perspective, the answer is (1) Very important."]}, {"persona": {"region": "Menofia", "sex": "male", "age": 28, "country": "Egypt", "marital_status": "single", "education": "higher", "social_class": "working class"}, "question": {"id": "Q2", "variant": 0}, "response": ["In the cultural context of Menofia, Egypt, social relationships and networks, including friendships, hold significant value. From an emic perspective, the importance of friends is deeply ingrained in the local culture and is considered a crucial aspect of daily life. Personal experience and individual values also play a role, as the persona's working-class background may have instilled the importance of social support and camaraderie in navigating life's challenges. Socioeconomic background further emphasizes the significance of friends, as individuals from this demographic often rely on their social connections for various forms of support. Additionally, the nuanced phrasing of the question and the persona's age and educational level may lead to a nuanced understanding of the importance of friends in life.\n\n5"]}, {"persona": {"region": "Menofia", "sex": "male", "age": 35, "country": "Egypt", "marital_status": "married", "education": "middle", "social_class": "lower middle class"}, "question": {"id": "Q2", "variant": 0}, "response": ["From an anthropological perspective, the importance of friends in life can be understood through the cultural context of Menofia, Egypt. In this region, kinship networks and social connections play a crucial role in the everyday lives of individuals. Additionally, the individual values and personal experience of a 35-year-old married male who considers himself part of the lower middle class will likely prioritize the support and companionship of friends as a source of emotional and practical assistance. Furthermore, the socioeconomic background of this persona may also influence the significance placed on friendships, as they may provide a sense of solidarity and resilience in the face of economic challenges. Considering these factors, the chosen answer is:\n\n2"]}, {"persona": {"region": "Menofia", "sex": "male", "age": 55, "country": "Egypt", "marital_status": "married", "education": "middle", "social_class": "working class"}, "question": {"id": "Q2", "variant": 0}, "response": ["From the perspective of a married male from Menofia, Egypt, who is 55 years old, has completed middle education, and considers himself part of the working class, the cultural context and socioeconomic background are important factors in understanding the importance of friends in life. In this cultural context, kinship networks and social connections play a significant role in daily life. Additionally, the socioeconomic background of being part of the working class may mean that friends provide important support and social connections. Personal experience and individual values also play a role in shaping the perception of the importance of friends. Based on these factors, I would choose option (2) Rather important. \n\n2"]}, {"persona": {"region": "Menofia", "sex": "male", "age": 53, "country": "Egypt", "marital_status": "married", "education": "higher", "social_class": "lower middle class"}, "question": {"id": "Q2", "variant": 0}, "response": ["From the perspective of a married male from Menofia, Egypt, who is 53 years old, has completed higher education, and considers himself part of the lower middle class, the answer to the question of the importance of friends in life will be influenced by various factors. The cultural context of Menofia emphasizes the importance of community and social relationships, which suggests that friends would be considered important. Additionally, individual values and personal experience, including the emphasis on social support and companionship, would also contribute to the significance of friends in this person's life. Furthermore, the socioeconomic background of being part of the lower middle class may lead to a reliance on friends for various forms of support. Therefore, the chosen answer is:\n2"]}, {"persona": {"region": "Menofia", "sex": "male", "age": 59, "country": "Egypt", "marital_status": "married", "education": "middle", "social_class": "working class"}, "question": {"id": "Q2", "variant": 0}, "response": ["Based on the anthropological framework, as a married male from Menofia, Egypt, my emic perspective values the importance of friends in life as very important. In my cultural context, friends play a significant role in providing social support, emotional connection, and forming a sense of community. My personal experience and individual values also emphasize the significance of friendship in navigating life's challenges and celebrating its joys. Additionally, my working-class background highlights the importance of building and maintaining social networks for mutual support and solidarity. Therefore, I choose:\n\n1"]}, {"persona": {"region": "Menofia", "sex": "female", "age": 42, "country": "Egypt", "marital_status": "married", "education": "middle", "social_class": "lower middle class"}, "question": {"id": "Q2", "variant": 0}, "response": ["From the perspective of a married female from Menofia, Egypt, at 42 years of age, with a middle education level and considering herself part of the lower middle class, it is important to consider the cultural context, individual values, and socioeconomic background. In Menofia, community and social connections are highly valued, and friendships often play a significant role in providing support and companionship. Additionally, as a member of the lower middle class, maintaining strong social networks can be essential for accessing resources and opportunities. Furthermore, personal experiences and values, shaped by the cultural context and socioeconomic background, likely emphasize the significance of friendships in providing emotional support and shared experiences. Therefore, the answer from this perspective would be:\n\n2"]}, {"persona": {"region": "Menofia", "sex": "male", "age": 39, "country": "Egypt", "marital_status": "married", "education": "higher", "social_class": "working class"}, "question": {"id": "Q2", "variant": 0}, "response": ["Based on the anthropological framework, as a married male from Menofia, Egypt, my cultural context and kinship networks greatly influence the importance of friends in my life. In Egyptian culture, relationships and social connections are highly valued, and friends often play a significant role in providing support and companionship. Additionally, my individual values and personal experience lead me to believe that friends are rather important in life, as they contribute to my social and emotional well-being. Furthermore, my socioeconomic background as a working-class individual also emphasizes the importance of friendships in providing a sense of community and solidarity. Therefore, based on my cultural context, personal experience, and socioeconomic background, I believe that friends are rather important in life.\n\n2"]}, {"persona": {"region": "Menofia", "sex": "male", "age": 34, "country": "Egypt", "marital_status": "married", "education": "middle", "social_class": "lower middle class"}, "question": {"id": "Q2", "variant": 0}, "response": ["From the perspective of a married male from Menofia, Egypt, who is 34 years old, has completed middle education, and considers himself part of the lower middle class, it is important to consider the cultural context and socioeconomic background. In Menofia, social networks and friendships are highly valued, and are often intertwined with kinship networks and community ties. Additionally, individuals in the lower middle class may rely on their friends for support, both emotionally and financially. Personal experience and individual values also play a role, as the persona may have grown up in a close-knit community where friendships were crucial for social and economic survival. Considering these factors, the most appropriate answer from this perspective would be:\n\n2"]}, {"persona": {"region": "Menofia", "sex": "male", "age": 22, "country": "Egypt", "marital_status": "single", "education": "higher", "social_class": "working class"}, "question": {"id": "Q2", "variant": 0}, "response": ["From an emic perspective, as a single male from Menofia, Egypt, the importance of friends in life is seen through the lens of cultural context and individual values. In this region, social connections and friendships are highly valued, as they play a crucial role in providing support, companionship, and a sense of belonging. Additionally, the socioeconomic background of being part of the working class may also emphasize the significance of friendships in navigating daily challenges and finding mutual aid. Furthermore, the personal experience of completing higher education and being at the age of 22 may highlight the importance of friends in terms of socializing, networking, and emotional support during this transitional phase of life. Therefore, based on these factors, I would choose the option (2) Rather important. \n\n2"]}, {"persona": {"region": "Menofia", "sex": "male", "age": 21, "country": "Egypt", "marital_status": "single", "education": "middle", "social_class": "working class"}, "question": {"id": "Q2", "variant": 0}, "response": ["Based on the anthropological framework, as a single male from Menofia, Egypt, my emic perspective would consider friends to be very important. In Egyptian culture, strong social ties and relationships are highly valued, and friends often serve as a support system for individuals. Additionally, my socioeconomic background as part of the working class means that I rely on my friends for emotional and social support, especially in the absence of strong financial resources. Furthermore, my personal experience and individual values also lead me to prioritize friendships and social connections in my life. Therefore, from this perspective, I would choose option (1) Very important. \n\n1"]}, {"persona": {"region": "Menofia", "sex": "male", "age": 36, "country": "Egypt", "marital_status": "married", "education": "higher", "social_class": "working class"}, "question": {"id": "Q2", "variant": 0}, "response": ["In Menofia, Egypt, the cultural context emphasizes the importance of social connections and relationships, including friendships. As a married male from this region, my individual values and personal experience also play a significant role in shaping my perspective. Being part of the working class, my socioeconomic background adds nuance to my answer. Additionally, cultural relativism is important to consider, as the value placed on friendships may differ from other cultural perspectives. Based on these factors, I would say that friends are rather important in life.\n\n2"]}, {"persona": {"region": "Menofia", "sex": "female", "age": 52, "country": "Egypt", "marital_status": "married", "education": "higher", "social_class": "lower middle class"}, "question": {"id": "Q2", "variant": 0}, "response": ["From an anthropological perspective, my cultural context as a married female from Menofia, Egypt, and my age of 52 years significantly influence my understanding and answer to the question of the importance of friends in life. In my cultural context, friendships and social networks are crucial for emotional support, sharing resources, and maintaining social connections. Additionally, my socioeconomic background as part of the lower middle class means that I may rely on friends for various forms of support due to limited financial resources. My individual values and personal experiences also play a role, as I may have experienced the importance of friends in my own life. Considering all these factors, I would choose option (2) Rather important. \n\n2"]}, {"persona": {"region": "Menofia", "sex": "male", "age": 52, "country": "Egypt", "marital_status": "married", "education": "higher", "social_class": "lower middle class"}, "question": {"id": "Q2", "variant": 0}, "response": ["In the cultural context of Menofia, Egypt, social relationships and kinship networks play a crucial role in daily life. As a married male from this region, I have been socialized to prioritize the value of friendships and community connections. Additionally, my individual values and personal experiences have taught me the significance of having a strong support system in the form of friends. Considering my lower middle class socioeconomic background, I have come to rely on my friends for emotional and practical support. Furthermore, the concept of cultural relativism emphasizes the importance of understanding and valuing the perspectives of others, which reinforces my belief in the significance of friendships. Therefore, based on this perspective, I would choose option (2) Rather important. \n\n2"]}, {"persona": {"region": "Menofia", "sex": "male", "age": 39, "country": "Egypt", "marital_status": "married", "education": "middle", "social_class": "lower class"}, "question": {"id": "Q2", "variant": 0}, "response": ["Based on the anthropological framework, my perspective as a married male from Menofia, Egypt, who is 39 years old, completed middle education, and considers himself part of the lower class, is heavily influenced by my cultural context, individual values, and socioeconomic background. In Egypt, social relationships and community connections are highly valued, and friends play a crucial role in providing support and solidarity, especially within the lower class where resources may be scarce. Additionally, my personal experience and values emphasize the importance of relying on friends for emotional and practical support. Therefore, I believe that friends are very important in life.\n\n1"]}, {"persona": {"region": "Menofia", "sex": "male", "age": 23, "country": "Egypt", "marital_status": "single", "education": "middle", "social_class": "lower middle class"}, "question": {"id": "Q2", "variant": 0}, "response": ["Based on my emic perspective as a single male from Menofia, Egypt, and considering my age, educational level, and socioeconomic background, I understand the importance of friends in life. In my cultural context, friends are considered very important as they provide support, companionship, and a sense of belonging. Personal experience has shown me that friends are crucial in navigating life's challenges and celebrating its joys. My socioeconomic background also plays a role, as having a strong social network can provide opportunities and help in times of need. Additionally, cultural relativism teaches me to value the importance of friendships in my own community. Therefore, I believe that friends are (1) Very important."]}, {"persona": {"region": "Dakahlia", "sex": "female", "age": 24, "country": "Egypt", "marital_status": "single", "education": "higher", "social_class": "lower middle class"}, "question": {"id": "Q2", "variant": 0}, "response": ["From an anthropological perspective, my individual values and personal experience shape my perception of the importance of friends in life. As a single female from Dakahlia, Egypt, I have been brought up in a culture that values close-knit relationships and community support. My cultural context, socioeconomic background, and age all play a role in shaping my understanding of the significance of friendship. In my lower middle class upbringing, friends have been a crucial source of emotional support and companionship. Additionally, my higher education level has exposed me to the importance of social networks for personal and professional success. Therefore, based on my personal experience and cultural context, I believe that friends are rather important in life.\n\n2"]}, {"persona": {"region": "Dakahlia", "sex": "male", "age": 36, "country": "Egypt", "marital_status": "married", "education": "higher", "social_class": "upper middle class"}, "question": {"id": "Q2", "variant": 0}, "response": ["From an anthropological perspective, my personal experience and individual values play a significant role in understanding and answering this question. In addition, my socioeconomic background as a married male from Dakahlia, Egypt, who considers himself part of the upper middle class, also influences my response. In Egyptian culture, relationships and social networks are highly valued, and friends play a crucial role in providing support and companionship. The cultural context and emphasis on community and social connections, combined with my personal experience and values, lead me to believe that friends are very important in life.\n\n1"]}, {"persona": {"region": "Dakahlia", "sex": "female", "age": 71, "country": "Egypt", "marital_status": "married", "education": "higher", "social_class": "upper middle class"}, "question": {"id": "Q2", "variant": 0}, "response": ["Based on the anthropological framework, as a married female from Dakahlia, Egypt, my cultural context places a high value on social relationships and community networks. My personal experience and individual values also emphasize the importance of friends in life, as they provide emotional support, companionship, and opportunities for socializing. Additionally, my upper middle class socioeconomic background allows me the time and resources to maintain and cultivate friendships. Therefore, I believe that friends are very important in life, as they contribute to overall well-being and happiness.\n\n1"]}, {"persona": {"region": "Dakahlia", "sex": "male", "age": 55, "country": "Egypt", "marital_status": "married", "education": "higher", "social_class": "upper middle class"}, "question": {"id": "Q2", "variant": 0}, "response": ["From an emic perspective, as a married male from Dakahlia, Egypt, I understand the importance of friends in life based on my cultural context, individual values, and personal experience. In Egyptian society, friendships are highly valued and play a crucial role in social interactions and support networks. Additionally, my socioeconomic background as part of the upper middle class allows me the privilege of being able to cultivate and maintain strong friendships. Furthermore, as a 55-year-old with a higher education level, I have learned the importance of meaningful relationships and social connections over time. Therefore, based on my understanding and experience, I would say that friends are very important in life.\n\n1"]}, {"persona": {"region": "Dakahlia", "sex": "male", "age": 64, "country": "Egypt", "marital_status": "married", "education": "higher", "social_class": "lower middle class"}, "question": {"id": "Q2", "variant": 0}, "response": ["In the cultural context of Dakahlia, Egypt, social relationships and kinship networks play a crucial role in everyday life. As a married male of 64 years of age, I have experienced the significance of friends in providing emotional support, companionship, and assistance in times of need. Additionally, my lower middle class socioeconomic background has meant that friends have been an important source of social and economic support, especially in a community where mutual aid is valued. Furthermore, my higher education level has allowed me to appreciate the importance of maintaining social connections for personal and professional development. Therefore, based on my individual values and personal experience within this cultural context, I would say that friends are rather important in life.\n\n2"]}, {"persona": {"region": "Dakahlia", "sex": "female", "age": 29, "country": "Egypt", "marital_status": "married", "education": "middle", "social_class": "lower class"}, "question": {"id": "Q2", "variant": 0}, "response": ["Based on the anthropological framework, as a married female from Dakahlia, Egypt, my emic perspective would emphasize the importance of friends within the cultural context of close-knit communities and extended family networks. Personal experience and individual values also play a significant role in shaping my understanding, as friendships may provide important social support and connections in the context of limited resources and economic struggles. Additionally, my lower socioeconomic background would influence my perspective, as friends may provide emotional and practical support in times of need. Therefore, I would choose option (1) Very important."]}, {"persona": {"region": "Dakahlia", "sex": "female", "age": 40, "country": "Egypt", "marital_status": "married", "education": "middle", "social_class": "upper middle class"}, "question": {"id": "Q2", "variant": 0}, "response": ["From the anthropological framework, my emic perspective as a married female from Dakahlia, Egypt, emphasizes the significance of kinship networks and social relationships within the cultural context. As an individual with a middle education level and belonging to the upper middle class, my personal experience and values would also prioritize the importance of maintaining friendships within my social circle. Additionally, the socio-economic background and values of the community in which I live would emphasize the importance of social connections and support networks. Therefore, based on this perspective, I would choose:\n\n2"]}, {"persona": {"region": "Dakahlia", "sex": "male", "age": 37, "country": "Egypt", "marital_status": "married", "education": "higher", "social_class": "lower middle class"}, "question": {"id": "Q2", "variant": 0}, "response": ["Based on the anthropological framework, my perspective as a married male from Dakahlia, Egypt, is influenced by my cultural context, individual values, socioeconomic background, and space and time. In my community, friends play a crucial role in providing social support, networking opportunities, and emotional connections. As a member of the lower middle class, I value the importance of having close friendships to navigate through life's challenges and to create a sense of belonging. Additionally, my age and marital status also contribute to the significance of friendships as they provide companionship and shared experiences. Therefore, based on my personal experience and cultural context, I believe that friends are rather important in life.\n\n2"]}, {"persona": {"region": "Dakahlia", "sex": "female", "age": 45, "country": "Egypt", "marital_status": "married", "education": "middle", "social_class": "working class"}, "question": {"id": "Q2", "variant": 0}, "response": ["Based on my cultural context as a married woman from Dakahlia, Egypt, and my socioeconomic background as part of the working class, I understand the importance of friends in life. In our society, friends are not just companions but also a source of support, especially for women. They provide emotional and sometimes even financial support, and play a significant role in our social and cultural activities. Additionally, my personal experience and values emphasize the importance of friendship and community, making them very important in my life.\n2"]}, {"persona": {"region": "Dakahlia", "sex": "male", "age": 34, "country": "Egypt", "marital_status": "single", "education": "middle", "social_class": "lower middle class"}, "question": {"id": "Q2", "variant": 0}, "response": ["From the perspective of a single male from Dakahlia, Egypt, who is 34 years old, has completed middle education, and considers himself part of the lower middle class, it is important to consider the cultural context, individual values, and socioeconomic background. In Egyptian culture, friendships and social connections often play a significant role in providing support and community. Additionally, due to the individual's lower middle-class status, friends may be crucial for social and emotional support in the absence of extensive financial resources. Furthermore, personal experience and subjective understanding of the importance of friendships are likely to be influenced by cultural norms and the socioeconomic context in which the individual lives. Therefore, considering all these factors, the importance of friends in this individual's life is likely to be viewed as rather important.\n\n2"]}, {"persona": {"region": "Dakahlia", "sex": "female", "age": 26, "country": "Egypt", "marital_status": "married", "education": "higher", "social_class": "upper middle class"}, "question": {"id": "Q2", "variant": 0}, "response": ["In the context of Dakahlia, Egypt, the cultural context emphasizes the importance of social connections and close-knit communities. As a married woman in her mid-20s who has completed higher education and considers herself part of the upper middle class, my individual values and personal experience have shown me the significance of friends in life. In this cultural setting, friends often serve as a support system, providing emotional and practical assistance in various aspects of life. Additionally, the socioeconomic background of being part of the upper middle class allows for more opportunities for socializing and maintaining friendships. Therefore, based on my personal experience and the cultural context, I believe that friends are (1) Very important."]}, {"persona": {"region": "Dakahlia", "sex": "male", "age": 21, "country": "Egypt", "marital_status": "single", "education": "middle", "social_class": "upper middle class"}, "question": {"id": "Q2", "variant": 0}, "response": ["From the emic perspective, as a young man from Dakahlia, Egypt, the importance of friends in life is seen through the lens of cultural context and personal experience. In Egyptian culture, friendships are highly valued and seen as a crucial support system. Additionally, individual values and personal experience play a significant role in this perception, as my personal experiences have shown me the importance of friends in providing emotional support, social connections, and a sense of belonging. Socioeconomic background also factors into this perspective, as being part of the upper middle class allows for more opportunities to cultivate and maintain friendships. Additionally, the nuance of the question is important, as the word \"important\" can have different connotations based on cultural and individual interpretations. \n\n2"]}, {"persona": {"region": "Dakahlia", "sex": "female", "age": 32, "country": "Egypt", "marital_status": "married", "education": "middle", "social_class": "working class"}, "question": {"id": "Q2", "variant": 0}, "response": ["Based on the anthropological framework, as a married female from Dakahlia, Egypt, my emic perspective is influenced by the cultural context of my community, where close-knit relationships and social connections are highly valued. Additionally, my individual values and personal experience lead me to prioritize the importance of friendships in my life, as they provide emotional support and companionship. Considering my working-class background and limited education, I rely on my social network for practical assistance and advice. Therefore, I would choose option (2) Rather important. \n\n2"]}, {"persona": {"region": "Dakahlia", "sex": "female", "age": 35, "country": "Egypt", "marital_status": "married", "education": "middle", "social_class": "upper middle class"}, "question": {"id": "Q2", "variant": 0}, "response": ["Based on my emic perspective as a married female from Dakahlia, Egypt, I believe that friends are very important in life. In our cultural context, friendships play a crucial role in providing social support, emotional connection, and companionship. As an individual, I value the relationships I have built over the years and understand the importance of having a strong network of friends. Additionally, my socioeconomic background as part of the upper middle class allows me the opportunity to socialize and maintain friendships, further emphasizing their significance in my life. \n\n1"]}, {"persona": {"region": "Dakahlia", "sex": "male", "age": 33, "country": "Egypt", "marital_status": "married", "education": "middle", "social_class": "upper middle class"}, "question": {"id": "Q2", "variant": 0}, "response": ["From an emic perspective, as a married male from Dakahlia, Egypt, my cultural context places a high value on social connections and community. My personal experience and values also emphasize the importance of friendship and social support. Additionally, my socioeconomic background as part of the upper middle class allows me the opportunity to prioritize and maintain friendships. In this cultural context, age and place also play a role in valuing friendships, as social connections are highly valued in our community. Therefore, based on these factors, I would choose the following option:\n\n2"]}, {"persona": {"region": "Dakahlia", "sex": "female", "age": 45, "country": "Egypt", "marital_status": "married", "education": "middle", "social_class": "upper middle class"}, "question": {"id": "Q2", "variant": 0}, "response": ["Based on the anthropological framework, as a married female from Dakahlia, Egypt, I understand the importance of cultural context and individual values in shaping my perspective. In our society, kinship networks and community ties are highly valued, and personal experience has taught me the significance of maintaining close friendships for emotional support and social connections. Additionally, my upper middle class background has allowed me to prioritize social interactions and maintain a social circle that aligns with my socioeconomic status. Therefore, I believe that friends are very important in life.\n\n1"]}, {"persona": {"region": "Dakahlia", "sex": "male", "age": 30, "country": "Egypt", "marital_status": "married", "education": "middle", "social_class": "upper middle class"}, "question": {"id": "Q2", "variant": 0}, "response": ["From the cultural context of Dakahlia, Egypt, where social ties and kinship networks are highly valued, friends play a significant role in one's life. The socioeconomic background of being part of the upper middle class also emphasizes the importance of social connections and maintaining relationships within the community. Personal experience and values in this cultural context also emphasize the significance of friendships in providing support and social connections. Therefore, the answer chosen is option (1) Very important."]}, {"persona": {"region": "Dakahlia", "sex": "female", "age": 63, "country": "Egypt", "marital_status": "married", "education": "higher", "social_class": "lower middle class"}, "question": {"id": "Q2", "variant": 0}, "response": ["Based on the emic and etic perspectives, as a married woman from Dakahlia, Egypt, the importance of friends in life is viewed through the lens of cultural context and individual values. In my cultural context, friends are considered an essential part of life, providing support, companionship, and a sense of community. Additionally, personal experience and individual values shape my perception, and at 63 years of age, I value the role of friends in my life, especially as part of the lower middle class where social connections and support are crucial. Therefore, I would say that friends are (2) Rather important."]}, {"persona": {"region": "Dakahlia", "sex": "male", "age": 28, "country": "Egypt", "marital_status": "single", "education": "higher", "social_class": "upper middle class"}, "question": {"id": "Q2", "variant": 0}, "response": ["Based on the anthropological framework, my perspective as a single male from Dakahlia, Egypt, is influenced by my cultural context, individual values and personal experience, and socioeconomic background. In Egyptian culture, friendship and social connections are highly valued, and personal relationships play a significant role in everyday life. As a member of the upper middle class, I have been taught to prioritize social connections and networking as a means of achieving success and maintaining societal status. Additionally, my higher education has allowed me to appreciate the value of friendships in terms of personal growth, emotional support, and professional networking. Therefore, I believe that friends are very important in life.\n\n1"]}, {"persona": {"region": "Dakahlia", "sex": "female", "age": 24, "country": "Egypt", "marital_status": "married", "education": "higher", "social_class": "upper middle class"}, "question": {"id": "Q2", "variant": 0}, "response": ["From the perspective of a married female from Dakahlia, Egypt, with a higher education level and belonging to the upper middle class, the answer to the question of how important friends are in life would be influenced by several factors. The cultural context in Egypt places a high value on social connections and community, and friendships are often deeply intertwined with family relationships. Additionally, individual values and personal experiences play a significant role, as women in this demographic may prioritize friendships as a source of support and companionship. Socioeconomic background also factors in, as individuals from the upper middle class may have more opportunities for socializing and maintaining friendships. Taking into account the emic perspective of this persona, the nuanced understanding of the importance of friends in life would lead to the selection of option (2) Rather important. \n\n2"]}, {"persona": {"region": "Dakahlia", "sex": "male", "age": 20, "country": "Egypt", "marital_status": "single", "education": "middle", "social_class": "upper middle class"}, "question": {"id": "Q2", "variant": 0}, "response": ["From my perspective as a single male from Dakahlia, Egypt, with a middle education level and part of the upper middle class, I believe that the cultural context and individual values play a significant role in determining the importance of friends in life. In my community, friendships are highly valued, and social networks are an essential part of daily life. Additionally, my socioeconomic background may influence my perception, as being part of the upper middle class may mean that I have more opportunities to form and maintain friendships. Furthermore, my age and place also factor into my understanding, as being 20 years old in Dakahlia means that friendships are crucial for socializing and networking. Therefore, based on my personal experience and the cultural context in which I am situated, I believe that friends are very important in life.\n\n1"]}, {"persona": {"region": "Dakahlia", "sex": "male", "age": 45, "country": "Egypt", "marital_status": "married", "education": "middle", "social_class": "upper middle class"}, "question": {"id": "Q2", "variant": 0}, "response": ["Based on the anthropological framework, my perspective as a married male from Dakahlia, Egypt, at 45 years of age and from the upper middle class, is heavily influenced by my cultural context, individual values, and personal experience. In Dakahlia, social connections and friendships are highly valued, and my personal experience has shown me the importance of having a strong network of friends for support and socializing. Additionally, my socioeconomic background as a member of the upper middle class has allowed me the opportunity to cultivate meaningful friendships through social activities and events. Therefore, I believe that friends are (2) Rather important."]}, {"persona": {"region": "Dakahlia", "sex": "female", "age": 43, "country": "Egypt", "marital_status": "married", "education": "higher", "social_class": "upper middle class"}, "question": {"id": "Q2", "variant": 0}, "response": ["From an anthropological perspective, my cultural context in Dakahlia, Egypt, has shaped my understanding of the importance of friends in life. In my community, social networks and relationships are highly valued, and friendships play a significant role in providing social support, emotional connection, and practical assistance. My socioeconomic background as part of the upper middle class also influences my perception, as socializing and maintaining friendships are often tied to social status and networking opportunities. Additionally, my individual values and personal experience have taught me to prioritize friendships and cultivate strong social bonds. Therefore, based on these considerations, I would choose:\n\n2"]}, {"persona": {"region": "Dakahlia", "sex": "female", "age": 20, "country": "Egypt", "marital_status": "single", "education": "middle", "social_class": "upper middle class"}, "question": {"id": "Q2", "variant": 0}, "response": ["As a single female from Dakahlia, Egypt, my perspective on the importance of friends in life is influenced by my cultural context, individual values, and socioeconomic background. In my community, maintaining close friendships is highly valued and considered a crucial aspect of social life. Additionally, my personal experience has shown me the significance of friends in providing support and companionship. As part of the upper middle class, I have had the privilege of being able to cultivate and maintain meaningful friendships, which has further reinforced the importance of friends in my life.\n\n2"]}, {"persona": {"region": "Dakahlia", "sex": "female", "age": 40, "country": "Egypt", "marital_status": "single", "education": "middle", "social_class": "lower middle class"}, "question": {"id": "Q2", "variant": 0}, "response": ["Based on my personal experience and cultural context as a single female from Dakahlia, Egypt, friends are extremely important in my life. In my community, social connections are crucial for emotional support, networking, and even economic assistance. As a lower middle class individual, I rely on my friends for various forms of support, whether it be emotional, financial, or social. Additionally, my age and socioeconomic background play a significant role in prioritizing the importance of friends in my life, as they provide a sense of community and belonging. Therefore, I believe that friends are very important in life.\n\n1"]}, {"persona": {"region": "Dakahlia", "sex": "female", "age": 33, "country": "Egypt", "marital_status": "married", "education": "higher", "social_class": "upper middle class"}, "question": {"id": "Q2", "variant": 0}, "response": ["In considering the importance of friends in life from the perspective of a married female from Dakahlia, Egypt, who is 33 years old, has completed higher education, and considers herself part of the upper middle class, several factors come into play. The cultural context in Egypt places a high value on social relationships and community. Additionally, the socioeconomic background of being part of the upper middle class may mean that this individual has a social network of friends who share similar values and experiences. Personal experience and individual values also play a role, as this person may have had positive experiences with friends and values the support and companionship they provide. Therefore, considering all these factors, the answer is likely to be very important.\n\n1"]}, {"persona": {"region": "Dakahlia", "sex": "female", "age": 24, "country": "Egypt", "marital_status": "married", "education": "middle", "social_class": "working class"}, "question": {"id": "Q2", "variant": 0}, "response": ["From the perspective of a married female from Dakahlia, Egypt, who is 24 years old, completed middle education, and considers herself part of the working class, my answer to the question of how important friends are in life would be influenced by several factors. The cultural context in Dakahlia places a high value on community and social connections, making friends an important aspect of life. Additionally, my individual values and personal experiences have shown me the significance of having a support system and social network, especially as a working-class individual. Furthermore, considering the socioeconomic background, friends may be crucial for emotional and practical support in navigating daily challenges. Therefore, based on these factors, I would choose option (2) Rather important. \n\n2"]}, {"persona": {"region": "Dakahlia", "sex": "female", "age": 53, "country": "Egypt", "marital_status": "widowed", "education": "middle", "social_class": "working class"}, "question": {"id": "Q2", "variant": 0}, "response": ["Based on the anthropological framework, as a widowed female from Dakahlia, Egypt, with a middle education level and part of the working class, my perspective on the importance of friends in life is heavily influenced by my cultural context, individual values, and personal experience. In my culture, community and social relationships hold great significance, and friends often serve as a support system in times of need. Additionally, as a working-class individual, my social network likely plays a crucial role in providing emotional and practical support. Therefore, I believe that friends are very important in life.\n\n1"]}, {"persona": {"region": "Dakahlia", "sex": "female", "age": 30, "country": "Egypt", "marital_status": "single", "education": "middle", "social_class": "lower middle class"}, "question": {"id": "Q2", "variant": 0}, "response": ["From an emic perspective, as a single female from Dakahlia, Egypt, I place a high value on my friendships and social connections. The cultural context in which I live emphasizes the importance of community and social relationships, and my personal experience and individual values also highlight the significance of friends in my life. Additionally, my socioeconomic background as part of the lower middle class means that I rely on my friends for support and companionship. Cultural relativism also plays a role in my viewpoint, as I understand that the importance of friends may vary across different cultures and contexts. Overall, considering space and time, along with the nuanced phrasing of the question, I believe that friends are very important in my life.\n\n1"]}, {"persona": {"region": "Dakahlia", "sex": "male", "age": 53, "country": "Egypt", "marital_status": "married", "education": "higher", "social_class": "upper middle class"}, "question": {"id": "Q2", "variant": 0}, "response": ["From an emic perspective, as a married male from Dakahlia, Egypt, I value the importance of friends in life based on my cultural context and personal experience. In our society, friendships are highly valued and considered an important part of social life. As an educated individual from the upper middle class, I have been exposed to the idea that friendships can provide support, companionship, and networking opportunities, which are crucial for personal and professional success. Additionally, my socioeconomic background has allowed me to have the time and resources to cultivate and maintain friendships. Therefore, from my perspective, friends are rather important in life.\n\n2"]}, {"persona": {"region": "Dakahlia", "sex": "male", "age": 28, "country": "Egypt", "marital_status": "married", "education": "middle", "social_class": "working class"}, "question": {"id": "Q2", "variant": 0}, "response": ["From the perspective of a married male from Dakahlia, Egypt, the importance of friends in life is heavily influenced by cultural context, individual values, and socioeconomic background. In Egypt, strong kinship networks and community ties are highly valued, and friendships play a significant role in providing support and social connections. Additionally, being part of the working class and having completed middle education level may mean that friendships are crucial for emotional and social support in the absence of extensive resources. Therefore, considering the cultural context, individual values, and socioeconomic background, the persona described above would likely view friends as \"Very important\" in life.\n\n1"]}, {"persona": {"region": "Dakahlia", "sex": "female", "age": 38, "country": "Egypt", "marital_status": "married", "education": "middle", "social_class": "upper middle class"}, "question": {"id": "Q2", "variant": 0}, "response": ["Based on the anthropological framework, my answer is shaped by my emic perspective as a married female from Dakahlia, Egypt, as well as my cultural context, individual values, and socioeconomic background. In Egyptian society, social connections and relationships hold significant value, and friendships are often tied to kinship networks and community support. As a member of the upper middle class, I have access to social circles and networks that provide both emotional and practical support, making friends very important in my life. Therefore, my answer is: \n\n2"]}, {"persona": {"region": "Gharbia", "sex": "male", "age": 27, "country": "Egypt", "marital_status": "single", "education": "higher", "social_class": "upper middle class"}, "question": {"id": "Q2", "variant": 0}, "response": ["Based on the anthropological framework, I would approach this question by considering the emic and etic perspectives of the persona described above. In this cultural context, social relationships and networks, including friendships, are highly valued and play a crucial role in personal and professional life. Additionally, individual values and personal experiences, such as the importance of social connections for social status and networking opportunities, would also influence the perception of the importance of friends. Socioeconomic background, in this case being part of the upper middle class, would also likely emphasize the importance of maintaining and cultivating social relationships. Therefore, based on this cultural context and personal background, I would choose option (1) Very important. \n\n1"]}, {"persona": {"region": "Gharbia", "sex": "female", "age": 35, "country": "Egypt", "marital_status": "married", "education": "higher", "social_class": "upper middle class"}, "question": {"id": "Q2", "variant": 0}, "response": ["Based on the anthropological framework, as a married female from Gharbia, Egypt, with a higher education level and belonging to the upper middle class, my perspective on the importance of friends in life is influenced by various factors. The cultural context in Egypt places a strong emphasis on community and social connections, making friends an integral part of daily life. Additionally, my individual values and personal experience have taught me the significance of maintaining strong friendships for emotional support and social networking. Furthermore, my socioeconomic background allows me the opportunity to cultivate and maintain friendships, as I have the resources to socialize and engage in leisure activities with friends. Considering these factors, I believe that friends are (2) Rather important in life."]}, {"persona": {"region": "Gharbia", "sex": "female", "age": 37, "country": "Egypt", "marital_status": "married", "education": "higher", "social_class": "upper middle class"}, "question": {"id": "Q2", "variant": 0}, "response": ["In the cultural context of Gharbia, Egypt, friends play a crucial role in an individual's life. The cultural emphasis on community and social connections, as well as the importance of maintaining strong relationships with others, makes friends a significant part of daily life. Additionally, the socioeconomic background of being part of the upper middle class may also contribute to the value placed on friendships, as socializing and networking are often important aspects of this social class. Furthermore, personal experience and individual values may also influence the perception of the importance of friends, as maintaining social connections and support networks may be seen as essential for personal well-being and success. Considering all these factors, it is reasonable to conclude that friends are very important in the life of the persona described above.\n\n1"]}, {"persona": {"region": "Gharbia", "sex": "male", "age": 43, "country": "Egypt", "marital_status": "married", "education": "middle", "social_class": "lower middle class"}, "question": {"id": "Q2", "variant": 0}, "response": ["Based on the anthropological framework, as a married male from Gharbia, Egypt, my cultural context values close-knit community and social connections. The emphasis on kinship networks and social support structures in our culture makes friends very important in life. Additionally, my individual values and personal experiences have taught me the significance of having a strong social circle for emotional support, practical assistance, and companionship. Furthermore, my socioeconomic background as part of the lower middle class also underscores the reliance on friends for mutual aid and solidarity. Therefore, I would say that friends are (1) Very important."]}, {"persona": {"region": "Gharbia", "sex": "male", "age": 28, "country": "Egypt", "marital_status": "single", "education": "higher", "social_class": "lower middle class"}, "question": {"id": "Q2", "variant": 0}, "response": ["From the perspective of a single male from Gharbia, Egypt, who is 28 years old and considers himself part of the lower middle class, the importance of friends in life is heavily influenced by cultural context and individual values. In Egypt, social connections and relationships are highly valued, and friendships are often seen as essential for emotional support and socializing. As a member of the lower middle class, the support and companionship of friends may be particularly important given the socioeconomic background. Additionally, personal experience and individual values play a significant role in shaping the perception of the importance of friends. Therefore, from this perspective, it can be argued that friends are very important in life for emotional support, socializing, and companionship.\n\n1"]}, {"persona": {"region": "Gharbia", "sex": "male", "age": 39, "country": "Egypt", "marital_status": "married", "education": "middle", "social_class": "lower middle class"}, "question": {"id": "Q2", "variant": 0}, "response": ["In Gharbia, Egypt, cultural context and socioeconomic background play a significant role in shaping one's perspective on the importance of friends in life. As a married 39-year-old male from the lower middle class with a middle education level, my personal experience and individual values are influenced by the community and social norms of my surroundings. In this cultural context, kinship networks and community support are highly valued, and friends often serve as an important source of emotional and practical support. Additionally, the socioeconomic background of being part of the lower middle class may mean that friends play a crucial role in providing social connections and opportunities for mutual aid. Therefore, friends are considered rather important in my life.\n\n2"]}, {"persona": {"region": "Gharbia", "sex": "male", "age": 30, "country": "Egypt", "marital_status": "married", "education": "middle", "social_class": "lower middle class"}, "question": {"id": "Q2", "variant": 0}, "response": ["Based on the anthropological framework, the emic perspective of someone from Gharbia, Egypt, would prioritize the importance of friends based on their cultural context, personal experiences, and socioeconomic background. In Egypt, social relationships and community ties are highly valued, and individuals often rely on their friends for emotional support, networking, and social activities. As a lower-middle-class individual who has completed middle education, this person may have limited resources and opportunities, making their social connections and friendships even more crucial for their well-being and success. Additionally, cultural relativism emphasizes the importance of understanding and respecting different cultural values and practices, which further supports the significance of friendships in this context.\n\n2"]}, {"persona": {"region": "Gharbia", "sex": "male", "age": 43, "country": "Egypt", "marital_status": "married", "education": "lower", "social_class": "lower middle class"}, "question": {"id": "Q2", "variant": 0}, "response": ["From the perspective of a married male from Gharbia, Egypt, who is 43 years old, has completed a lower education level, and considers himself part of the lower middle class, the importance of friends in life is heavily influenced by cultural context and individual values. In this community, social connections and support networks are pivotal, with kinship networks playing a significant role in everyday life. Additionally, the socioeconomic background of this persona may mean that friendships serve as a crucial source of emotional support and practical assistance, particularly in times of need. Personal experience and individual values also come into play, with the persona likely valuing the companionship and camaraderie that friends provide. Therefore, the answer chosen is not arbitrary, but rather a product of the nuanced understanding of the cultural, socioeconomic, and personal factors that shape this persona's perspective.\n\n2"]}, {"persona": {"region": "Gharbia", "sex": "male", "age": 36, "country": "Egypt", "marital_status": "married", "education": "higher", "social_class": "lower middle class"}, "question": {"id": "Q2", "variant": 0}, "response": ["Based on the anthropological framework, my perspective as a married male from Gharbia, Egypt, who is 36 years old, completed higher education, and considers himself part of the lower middle class, is influenced by my cultural context, individual values, and socioeconomic background. In Egyptian society, friendships are highly valued and play a significant role in providing social support and connections. As a member of the lower middle class, I rely on my friendships for emotional and practical support, especially in challenging economic circumstances. Additionally, my personal experience and values emphasize the importance of maintaining strong social connections and a sense of community. Therefore, based on my perspective and the cultural context in which I am situated, I believe that friends are very important in life.\n\n1"]}, {"persona": {"region": "Gharbia", "sex": "male", "age": 25, "country": "Egypt", "marital_status": "married", "education": "middle", "social_class": "upper middle class"}, "question": {"id": "Q2", "variant": 0}, "response": ["From an anthropological perspective, I need to consider the emic and etic perspectives of the persona described above. In Gharbia, Egypt, social relationships and networks are essential for daily life and social support. The cultural context emphasizes the importance of community and social connections, and individual values and personal experience also play a role in shaping the perception of friendships. Additionally, the persona's socioeconomic background as part of the upper middle class may influence the value placed on friendships as a means of networking and social status. Considering these factors, I believe the persona would consider friends to be very important in their life.\n\n1"]}, {"persona": {"region": "Gharbia", "sex": "male", "age": 31, "country": "Egypt", "marital_status": "married", "education": "middle", "social_class": "upper middle class"}, "question": {"id": "Q2", "variant": 0}, "response": ["Based on the anthropological framework, as a married male from Gharbia, Egypt, my cultural context values kinship networks and social relationships, such as friendships, as integral to daily life. Additionally, my socioeconomic background as part of the upper middle class allows me the means and opportunities to prioritize and maintain friendships. My personal experience and individual values also emphasize the significance of friends in providing support and social connections. Therefore, from this perspective, I would choose:\n\n2"]}, {"persona": {"region": "Gharbia", "sex": "male", "age": 33, "country": "Egypt", "marital_status": "married", "education": "higher", "social_class": "lower middle class"}, "question": {"id": "Q2", "variant": 0}, "response": ["Based on my emic perspective as a married male from Gharbia, Egypt, I understand the importance of kinship networks and social connections in our culture. In our cultural context, maintaining strong friendships is crucial for support, socializing, and overall well-being. Additionally, my individual values and personal experience have taught me the significance of having close friends to rely on, especially in times of need. Considering my lower middle-class socioeconomic background, I have learned to value the relationships and connections I have with others, as they provide emotional and sometimes even financial support. Therefore, based on my nuanced understanding of the question and my cultural context, I believe that friends are rather important in life.\n\n2"]}, {"persona": {"region": "Gharbia", "sex": "male", "age": 26, "country": "Egypt", "marital_status": "single", "education": "higher", "social_class": "upper middle class"}, "question": {"id": "Q2", "variant": 0}, "response": ["Based on my understanding of the anthropological framework, I believe that the emic perspective of the persona from Gharbia, Egypt, would place a significant emphasis on the importance of friends in life. In this cultural context, social relationships and networks are highly valued, and the individual's socioeconomic background as part of the upper middle class may also influence the importance placed on maintaining and nurturing friendships. Additionally, personal experience and individual values play a significant role in shaping one's perceptions, and at 26 years of age, the persona is likely to value the companionship and support that friends can provide during this stage of life. Therefore, I choose option 1) Very important."]}, {"persona": {"region": "Gharbia", "sex": "female", "age": 45, "country": "Egypt", "marital_status": "married", "education": "middle", "social_class": "lower middle class"}, "question": {"id": "Q2", "variant": 0}, "response": ["Based on the anthropological framework, as a married female from Gharbia, Egypt, my emic perspective emphasizes the importance of close-knit kinship networks and community connections. In our cultural context, friends play a significant role in providing social support and emotional connections, especially for women. Personal experience and individual values also underscore the importance of maintaining strong friendships for emotional well-being and social interaction. Additionally, as part of the lower middle class, socioeconomic background also plays a role in valuing the support and camaraderie of friends. Therefore, I would choose option (2) Rather important. \n2"]}, {"persona": {"region": "Gharbia", "sex": "female", "age": 55, "country": "Egypt", "marital_status": "married", "education": "middle", "social_class": "upper middle class"}, "question": {"id": "Q2", "variant": 0}, "response": ["In the cultural context of Gharbia, Egypt, social relationships and community ties are highly valued. The emic perspective of this persona would emphasize the significance of friends in life, as they provide emotional support, companionship, and a sense of belonging within the community. Additionally, individual values and personal experiences play a significant role in shaping the importance of friends, especially for a married woman in her mid-50s who may rely on her friends for social interaction and emotional support. Furthermore, the socioeconomic background of being part of the upper middle class may provide more opportunities for socializing and maintaining friendships. Therefore, based on this perspective, the answer chosen is:\n\n2"]}, {"persona": {"region": "Gharbia", "sex": "female", "age": 27, "country": "Egypt", "marital_status": "married", "education": "higher", "social_class": "upper middle class"}, "question": {"id": "Q2", "variant": 0}, "response": ["Based on the anthropological framework, the emic perspective of the persona described above is influenced by her cultural context, individual values, socioeconomic background, and space and time. In Gharbia, Egypt, social relationships and kinship networks play a significant role in everyday life. As a married woman in her late 20s with a higher education level and belonging to the upper middle class, she likely values the support and companionship of friends. Additionally, her age and place in society contribute to the importance of maintaining social connections and friendships. Therefore, her answer to the question of how important friends are in life is likely to be \"Very important.\"\n\n1"]}, {"persona": {"region": "Gharbia", "sex": "female", "age": 42, "country": "Egypt", "marital_status": "married", "education": "higher", "social_class": "upper middle class"}, "question": {"id": "Q2", "variant": 0}, "response": ["Based on the anthropological framework, as a married female from Gharbia, Egypt, I understand the importance of cultural context and individual values in shaping perspectives. In my community, social connections and friendships are highly valued, and are often seen as an important support system for individuals. Additionally, my higher education level and upper middle class status may also influence my perspective, as I likely have a wide network of friends who share similar backgrounds and values. Therefore, based on these factors, I would choose:\n\n2"]}, {"persona": {"region": "Gharbia", "sex": "female", "age": 32, "country": "Egypt", "marital_status": "married", "education": "middle", "social_class": "upper middle class"}, "question": {"id": "Q2", "variant": 0}, "response": ["From the perspective of a married female from Gharbia, Egypt, the cultural context and individual values play a significant role in understanding the importance of friends in life. In this cultural context, maintaining close relationships and social connections with friends is seen as crucial for emotional support, social networking, and overall well-being. Additionally, the socioeconomic background of being part of the upper middle class may also emphasize the importance of friendships for networking and social status. Personal experience and individual values may also contribute to the belief that friends are very important in life for this persona.\n\n2"]}, {"persona": {"region": "Gharbia", "sex": "male", "age": 27, "country": "Egypt", "marital_status": "married", "education": "higher", "social_class": "upper middle class"}, "question": {"id": "Q2", "variant": 0}, "response": ["Based on the anthropological framework, as a married male from Gharbia, Egypt, my emic perspective on the importance of friends in life is influenced by my cultural context and socioeconomic background. In Egypt, strong kinship networks and community ties are highly valued, and socializing with friends is an important part of everyday life. Additionally, as someone from the upper middle class with access to higher education, I have been socialized to value social connections and networking for personal and professional success. Therefore, I believe that friends are rather important in life.\n\n2"]}, {"persona": {"region": "Gharbia", "sex": "female", "age": 27, "country": "Egypt", "marital_status": "married", "education": "higher", "social_class": "lower middle class"}, "question": {"id": "Q2", "variant": 0}, "response": ["In the cultural context of Gharbia, Egypt, where I come from, friends are considered extremely important. The value placed on social relationships and community is deeply ingrained in our cultural and religious practices. Additionally, as a married woman, my social circle is a crucial source of support and companionship, especially as I navigate the responsibilities of marriage and potentially motherhood. Furthermore, being part of the lower middle class means that I rely on my friends for emotional and practical support, as our socioeconomic background often limits our access to resources. Taking into account my individual values and personal experiences, as well as the cultural context and socioeconomic background, I firmly believe that friends are very important in life.\n\n1"]}, {"persona": {"region": "Gharbia", "sex": "female", "age": 37, "country": "Egypt", "marital_status": "married", "education": "middle", "social_class": "upper middle class"}, "question": {"id": "Q2", "variant": 0}, "response": ["Based on the anthropological framework, I recognize the importance of considering my cultural context, individual values, and personal experience when answering this question. In Gharbia, Egypt, social connections and relationships with friends are highly valued, and are often intertwined with family and community networks. Additionally, as a married female in my late thirties and part of the upper middle class, I understand the significance of maintaining social connections and friendships for social and emotional support, as well as for networking and social status. Therefore, based on my cultural context and personal experience, I believe that friends are (1) Very important.\n\n1"]}, {"persona": {"region": "Gharbia", "sex": "male", "age": 28, "country": "Egypt", "marital_status": "married", "education": "higher", "social_class": "working class"}, "question": {"id": "Q2", "variant": 0}, "response": ["Based on the anthropological framework, my answer to the question of how important friends are in life would be \"Rather important.\" From an emic perspective, friends play a crucial role in providing support and camaraderie in everyday life in Gharbia, Egypt. In this cultural context, the importance of social networks and kinship ties is highly valued, and friends often serve as an extension of one's family. Additionally, from an etic perspective, the socioeconomic background of being part of the working class in Egypt also emphasizes the significance of friends in providing emotional and practical support in navigating the challenges of daily life. Furthermore, individual values and personal experiences also shape the importance of friends, as they offer companionship and a sense of belonging. Overall, considering the cultural context, socioeconomic background, and personal experiences, I would argue that friends are rather important in life.\n\n2"]}, {"persona": {"region": "Gharbia", "sex": "female", "age": 50, "country": "Egypt", "marital_status": "married", "education": "middle", "social_class": "upper middle class"}, "question": {"id": "Q2", "variant": 0}, "response": ["Based on the anthropological framework, as a married female from Gharbia, Egypt, my emic perspective emphasizes the importance of kinship networks and social relationships within the community. Cultural context and individual values play a significant role in shaping my understanding of the importance of friends in life. As someone from the upper middle class, I value social connections and see friends as an integral part of my support system. Additionally, my socioeconomic background and age also contribute to my view on the significance of friends. Therefore, based on my personal experience and cultural context, friends are very important in my life.\n\n1"]}, {"persona": {"region": "Gharbia", "sex": "male", "age": 39, "country": "Egypt", "marital_status": "single", "education": "higher", "social_class": "working class"}, "question": {"id": "Q2", "variant": 0}, "response": ["Based on the anthropological framework, as a single male from Gharbia, Egypt, at the age of 39, with a working-class background and completed higher education, my perspective on the importance of friends in life is influenced by my cultural context, individual values, and personal experience. In Egyptian society, friendships are highly valued and play a crucial role in providing emotional support, social connections, and a sense of belonging. As someone from a working-class background, I have come to rely on my friends for support and companionship, especially in times of need. Additionally, my higher education has taught me the value of social networks and the importance of maintaining meaningful relationships. Therefore, I believe that friends are very important in life and contribute significantly to one's overall well-being and happiness.\n\n1"]}, {"persona": {"region": "Gharbia", "sex": "female", "age": 45, "country": "Egypt", "marital_status": "married", "education": "higher", "social_class": "upper middle class"}, "question": {"id": "Q2", "variant": 0}, "response": ["From an anthropological perspective, the cultural context, individual values, and socioeconomic background of a person play a crucial role in shaping their perspective on the importance of friends in life. As a married female from Gharbia, Egypt, who has completed higher education and considers herself part of the upper middle class, my cultural context values close-knit social networks and the support of friends. Additionally, my individual values prioritize maintaining strong social connections and the sharing of experiences with friends. Considering my socioeconomic background, which affords me the ability to socialize and maintain friendships, I would assert that friends are very important in life.\n\n1"]}, {"persona": {"region": "Sharkia", "sex": "male", "age": 35, "country": "Egypt", "marital_status": "married", "education": "higher", "social_class": "upper middle class"}, "question": {"id": "Q2", "variant": 0}, "response": ["Based on the anthropological framework, as a married male from Sharkia, Egypt, at 35 years of age with a higher education level and considering myself part of the upper middle class, my perspective on the importance of friends in life is influenced by various factors. The cultural context in Egypt places a significant emphasis on social connections and community, making friendships an integral part of life. As an individual, my personal experience and values also lead me to value friendships as they provide support, companionship, and opportunities for socializing. Additionally, my socioeconomic background allows me to have the time and resources to maintain and cultivate friendships. Considering all these factors, I choose option (2) Rather important. \n\n2"]}, {"persona": {"region": "Sharkia", "sex": "female", "age": 55, "country": "Egypt", "marital_status": "married", "education": "middle", "social_class": "lower middle class"}, "question": {"id": "Q2", "variant": 0}, "response": ["Based on the anthropological framework, as a married female from Sharkia, Egypt, with a lower middle-class background, the cultural context and individual values and personal experience are crucial in determining the importance of friends in life. In this cultural context, community and social connections play a significant role in providing support and mutual assistance, particularly within the lower middle class. Additionally, personal experiences and values, shaped by middle education and age, likely emphasize the importance of friends for emotional support and social interaction. Therefore, the answer chosen is very important (1)."]}, {"persona": {"region": "Sharkia", "sex": "female", "age": 27, "country": "Egypt", "marital_status": "married", "education": "middle", "social_class": "lower middle class"}, "question": {"id": "Q2", "variant": 0}, "response": ["In Sharkia, Egypt, cultural context and socioeconomic background play a crucial role in shaping individual values and personal experiences. As a married female from Sharkia, I have been brought up in a community where family and social connections are highly valued. My lower middle class background has also influenced the importance of friendships in my life. With limited resources and opportunities, friends provide support, assistance, and a sense of community. Additionally, at 27 years of age, my personal experiences have shown me the significance of having a strong social network to navigate life's challenges. Therefore, based on these factors, I would say that friends are rather important in life.\n\n2"]}, {"persona": {"region": "Sharkia", "sex": "female", "age": 52, "country": "Egypt", "marital_status": "married", "education": "middle", "social_class": "lower middle class"}, "question": {"id": "Q2", "variant": 0}, "response": ["Based on the anthropological framework, as a married female from Sharkia, Egypt, my cultural context and socio-economic background play a significant role in my understanding of the importance of friends in life. In my community, kinship networks and social connections are highly valued, and friends often serve as an important support system. Additionally, my lower middle-class status means that I may rely on friends for various forms of support, such as emotional or financial. Furthermore, my age and life experience have likely shaped my perspective on the value of friendships. Considering these factors, I believe that friends are very important in life.\n\n1"]}, {"persona": {"region": "Sharkia", "sex": "male", "age": 36, "country": "Egypt", "marital_status": "married", "education": "middle", "social_class": "lower middle class"}, "question": {"id": "Q2", "variant": 0}, "response": ["From an anthropological perspective, my cultural context as a married male from Sharkia, Egypt, plays a significant role in shaping my understanding of the importance of friends in life. In my community, kinship networks and social connections are highly valued, and friends are often considered an extension of one's family. Additionally, my socioeconomic background as part of the lower middle class means that I rely on my social network for various forms of support, including emotional and financial. Furthermore, my individual values and personal experience have taught me the significance of maintaining strong friendships for social cohesion and personal well-being. Therefore, based on my emic perspective, I believe that friends are (1) Very important."]}, {"persona": {"region": "Sharkia", "sex": "female", "age": 20, "country": "Egypt", "marital_status": "single", "education": "middle", "social_class": "working class"}, "question": {"id": "Q2", "variant": 0}, "response": ["Based on the anthropological framework, the persona described above comes from Sharkia, Egypt, and would likely have a strong sense of cultural context and individual values. Being part of the working class at 20 years of age and having completed middle education, the persona's socioeconomic background and age are also important factors. In Egyptian culture, community and social connections are often highly valued, and personal experience and values would likely influence the importance placed on friendships. Additionally, cultural relativism suggests that there is no hierarchy of culture, and the persona's background would likely influence the importance placed on friendships. Therefore, the persona would likely answer \"Very important\" to the question \"How important are friends in life?\"\n\n1"]}, {"persona": {"region": "Sharkia", "sex": "male", "age": 60, "country": "Egypt", "marital_status": "married", "education": "middle", "social_class": "working class"}, "question": {"id": "Q2", "variant": 0}, "response": ["From the perspective of a married male from Sharkia, Egypt, the importance of friends in life is heavily influenced by cultural context, individual values, and socioeconomic background. In this region, social connections and community ties are highly valued, with friendships often extending to include extended family members. As a working-class individual with a middle education level, the support and camaraderie of friends are likely to play a significant role in navigating life's challenges and finding enjoyment in leisure activities. Additionally, at 60 years of age, the value of long-standing friendships and shared experiences is likely to be particularly cherished. Therefore, based on this perspective, the answer to the question \"How important are friends in life?\" would be:\n\n2"]}, {"persona": {"region": "Sharkia", "sex": "male", "age": 41, "country": "Egypt", "marital_status": "married", "education": "higher", "social_class": "upper middle class"}, "question": {"id": "Q2", "variant": 0}, "response": ["From an anthropological perspective, my cultural context as a married male from Sharkia, Egypt, means that my kinship networks and social connections are highly valued. In Egyptian society, friendships are often formed within close-knit communities and are seen as crucial for social support and emotional well-being. Additionally, my individual values and personal experiences have taught me the importance of having strong friendships for personal and professional success. Furthermore, my socioeconomic background as part of the upper middle class means that I have the means and opportunities to cultivate meaningful friendships. Therefore, based on my cultural context and personal experiences, I believe that friends are very important in life.\n\n1"]}, {"persona": {"region": "Sharkia", "sex": "female", "age": 23, "country": "Egypt", "marital_status": "married", "education": "middle", "social_class": "lower middle class"}, "question": {"id": "Q2", "variant": 0}, "response": ["Based on the anthropological framework, as a married female from Sharkia, Egypt, my cultural context and individual values play a significant role in my perception of the importance of friends in life. In Egypt, community and social relationships hold great importance, and as a lower middle class individual, my socioeconomic background also influences my answer. Additionally, my age and personal experience shape my understanding of the value of friendships. Therefore, I believe that friends are rather important in life.\n\n2"]}, {"persona": {"region": "Sharkia", "sex": "male", "age": 49, "country": "Egypt", "marital_status": "married", "education": "higher", "social_class": "upper middle class"}, "question": {"id": "Q2", "variant": 0}, "response": ["From the perspective of a married male from Sharkia, Egypt, who is 49 years old, has completed higher education, and considers himself part of the upper middle class, the answer to the question \"How important are friends in life?\" is influenced by several factors. The cultural context in Egypt emphasizes the value of social relationships and community. Additionally, individual values and personal experience play a significant role, as maintaining friendships is often seen as a key aspect of social status and personal fulfillment. The socioeconomic background of being part of the upper middle class also likely means that maintaining social connections and friendships is a priority. Furthermore, the nuance of the question implies that the importance of friends could be interpreted differently based on the specific wording, and in this case, the emphasis is on the overall significance of friends in life. Therefore, based on these considerations, the chosen answer is:\n\n2"]}, {"persona": {"region": "Sharkia", "sex": "female", "age": 30, "country": "Egypt", "marital_status": "married", "education": "middle", "social_class": "upper middle class"}, "question": {"id": "Q2", "variant": 0}, "response": ["In considering the answer to the question of how important friends are in life from an anthropological perspective, it is important to take into account the individual values and personal experiences of the persona described. As a married female from Sharkia, Egypt, who is part of the upper middle class, it is likely that the cultural context in which she lives places a high value on social relationships and kinship networks. Additionally, her age and socioeconomic background may influence her perception of the importance of friends in her life. Therefore, considering these factors, the persona would likely choose the option:\n(2) Rather important"]}, {"persona": {"region": "Sharkia", "sex": "male", "age": 39, "country": "Egypt", "marital_status": "married", "education": "higher", "social_class": "upper middle class"}, "question": {"id": "Q2", "variant": 0}, "response": ["From an anthropological perspective, my cultural context plays a significant role in shaping my understanding and answering of this question. In my community in Sharkia, Egypt, social relationships and networks hold a high value. Additionally, my socioeconomic background as an educated, upper middle class individual also influences my perception of the importance of friends in life. Furthermore, my individual values and personal experiences have taught me the significance of maintaining close friendships for emotional support and social connections. Taking into account the emic perspective, I would say that friends are rather important in life.\n2"]}, {"persona": {"region": "Sharkia", "sex": "female", "age": 26, "country": "Egypt", "marital_status": "married", "education": "middle", "social_class": "lower middle class"}, "question": {"id": "Q2", "variant": 0}, "response": ["Based on the anthropological framework, as a married female from Sharkia, Egypt, my emic perspective would emphasize the importance of friends in providing social support and companionship within my cultural context. In our community, close friendships are valued and play a significant role in daily life, providing emotional support, practical assistance, and a sense of belonging. My personal experience and values also contribute to the understanding of the importance of friends, as they have been a source of support and joy in my life. Additionally, considering my lower middle class socioeconomic background, friends have been an important source of mutual aid and solidarity. Therefore, I would choose option (2) Rather important, as this reflects the significance of friendships in my life within the cultural, socioeconomic, and personal context described. \n\n2"]}, {"persona": {"region": "Sharkia", "sex": "female", "age": 48, "country": "Egypt", "marital_status": "married", "education": "middle", "social_class": "lower middle class"}, "question": {"id": "Q2", "variant": 0}, "response": ["Based on the anthropological framework, my perspective as a married female from Sharkia, Egypt, is influenced by my cultural context, socioeconomic background, and personal experience. In Sharkia, community and social connections are highly valued, and friendships play a significant role in providing support and companionship. Additionally, being part of the lower middle class, I rely on my network of friends for emotional and practical assistance. My age and life experiences have also shaped my view, as friendships have been a source of comfort and solidarity throughout my life. Therefore, I believe that friends are rather important in life.\n\n2"]}, {"persona": {"region": "Sharkia", "sex": "male", "age": 34, "country": "Egypt", "marital_status": "married", "education": "higher", "social_class": "upper middle class"}, "question": {"id": "Q2", "variant": 0}, "response": ["In considering the importance of friends in life from the anthropological framework, it is crucial to acknowledge the influence of cultural context, individual values, and socioeconomic background. In Sharkia, Egypt, social networks and kinship ties play a significant role in shaping one's identity and sense of belonging. As a married male from this region, my higher education level and upper middle class status also contribute to the value placed on social connections and networking. Additionally, cultural relativism reminds us that the importance of friends may vary across different cultures and social groups. Considering these factors, I would argue that friends are very important in life as they provide support, companionship, and opportunities for social advancement.\n\n1"]}, {"persona": {"region": "Sharkia", "sex": "female", "age": 39, "country": "Egypt", "marital_status": "divorced", "education": "middle", "social_class": "lower middle class"}, "question": {"id": "Q2", "variant": 0}, "response": ["As a divorced female from Sharkia, Egypt, at the age of 39 and with a middle education level, my cultural context and socioeconomic background greatly influence my perspective on the importance of friends in life. In my community, social connections and support networks are crucial for emotional and practical assistance, especially for someone in my situation. My individual values and personal experience also play a significant role, as I have relied on my friends for emotional support during my divorce. Additionally, cultural relativism teaches me to value the relationships and connections within my community, which further emphasizes the importance of friends in my life.\n\n2"]}, {"persona": {"region": "Sharkia", "sex": "male", "age": 39, "country": "Egypt", "marital_status": "married", "education": "middle", "social_class": "upper middle class"}, "question": {"id": "Q2", "variant": 0}, "response": ["Based on the anthropological framework, my perspective as a married male from Sharkia, Egypt, is heavily influenced by my cultural context, individual values, personal experience, and socioeconomic background. In Egyptian society, friendships are highly valued and play a significant role in social interactions and support systems. Additionally, as a member of the upper middle class, I have been able to cultivate a network of influential and supportive friends who have contributed to my personal and professional success. Therefore, based on my cultural context and personal experience, I would say that friends are very important in life.\n\n1"]}, {"persona": {"region": "Qaliubiya", "sex": "male", "age": 62, "country": "Egypt", "marital_status": "married", "education": "middle", "social_class": "working class"}, "question": {"id": "Q2", "variant": 0}, "response": ["Based on the anthropological framework, as a married male from Qaliubiya, Egypt, at 62 years old, and belonging to the working class, my cultural context and individual values emphasize the importance of social relationships and community. In Egypt, friendships are often deeply rooted in mutual support and solidarity, providing emotional, financial, and social assistance. Additionally, being part of the working class means that friendships can serve as important networks for job opportunities and financial assistance. Therefore, I would say that friends are (2) rather important in life."]}, {"persona": {"region": "Qaliubiya", "sex": "male", "age": 33, "country": "Egypt", "marital_status": "married", "education": "middle", "social_class": "working class"}, "question": {"id": "Q2", "variant": 0}, "response": ["From the perspective of a married male from Qaliubiya, Egypt, with a middle education level and part of the working class, the importance of friends in life is heavily influenced by cultural context, individual values, and socioeconomic background. In Egyptian culture, friendships are highly valued and often considered an extension of family. As a working-class individual, social connections with friends may be crucial for emotional support, networking for job opportunities, and building a sense of community. Additionally, personal experiences and values may play a significant role in shaping the importance placed on friendships, especially in a society where social connections are highly valued. Therefore, considering these factors, the selected option is:\n\n2"]}, {"persona": {"region": "Qaliubiya", "sex": "male", "age": 62, "country": "Egypt", "marital_status": "married", "education": "higher", "social_class": "lower middle class"}, "question": {"id": "Q2", "variant": 0}, "response": ["From the perspective of a married male from Qaliubiya, Egypt, who is 62 years old and part of the lower middle class, the answer to the question of the importance of friends in life is influenced by various factors. The cultural context emphasizes the significance of social networks and kinship, which can be considered an extension of friendship. Additionally, the socioeconomic background and individual values play a crucial role in shaping the perception of the importance of friends. In this specific context, where social connections and support are highly valued, friends are considered rather important for emotional and practical support, especially in the later stages of life. Therefore, the chosen answer is: (2) Rather important"]}, {"persona": {"region": "Qaliubiya", "sex": "male", "age": 29, "country": "Egypt", "marital_status": "married", "education": "middle", "social_class": "working class"}, "question": {"id": "Q2", "variant": 0}, "response": ["Based on the anthropological framework, as a married male from Qaliubiya, Egypt, my cultural context and personal experience play a significant role in shaping my perspective. In Egyptian society, friendship is highly valued and considered an integral part of social life. The importance of friends is emphasized in our cultural context, and personal experiences have likely reinforced this belief. Additionally, being part of the working class, I rely on my friends for emotional support and to navigate challenges, making them even more important in my life. Therefore, from this perspective, I would say that friends are (2) Rather important."]}, {"persona": {"region": "Qaliubiya", "sex": "female", "age": 42, "country": "Egypt", "marital_status": "married", "education": "higher", "social_class": "working class"}, "question": {"id": "Q2", "variant": 0}, "response": ["In considering the importance of friends in life from the perspective of a married female from Qaliubiya, Egypt, it is crucial to take into account the cultural context, individual values, and socioeconomic background. In this region, close-knit communities and strong social relationships are highly valued. As a married woman, the support and companionship of friends may play a significant role in providing emotional and practical assistance. Additionally, the completion of higher education may have also emphasized the importance of maintaining social connections for personal and professional growth. Furthermore, as part of the working class, the reliance on friends for support and solidarity in navigating economic challenges cannot be understated. Therefore, from this perspective, the answer would be:\n\n2) Rather important"]}, {"persona": {"region": "Qaliubiya", "sex": "female", "age": 50, "country": "Egypt", "marital_status": "married", "education": "middle", "social_class": "lower middle class"}, "question": {"id": "Q2", "variant": 0}, "response": ["From the perspective of a married female from Qaliubiya, Egypt, who is 50 years old, has completed middle education, and considers herself part of the lower middle class, several factors play a role in determining the importance of friends in life. The cultural context of Qaliubiya emphasizes the importance of community and social connections, making friends integral to daily life. Additionally, the socioeconomic background of being part of the lower middle class may mean that friends provide emotional support and social connections that are crucial for navigating challenges and finding opportunities. Personal experience and individual values also play a significant role, as this persona may have relied on friends for support and companionship throughout their life. Therefore, it is reasonable to conclude that friends are very important in the life of this persona, as they provide emotional, social, and potentially even practical support in their daily lives.\n\n1"]}, {"persona": {"region": "Qaliubiya", "sex": "male", "age": 29, "country": "Egypt", "marital_status": "married", "education": "higher", "social_class": "lower middle class"}, "question": {"id": "Q2", "variant": 0}, "response": ["From the perspective of a married male from Qaliubiya, Egypt, who is 29 years old and part of the lower middle class, the answer to the question of how important friends are in life would be shaped by a combination of cultural context, individual values and personal experience, and socioeconomic background. In Egyptian culture, friendship and social connections are highly valued, and maintaining strong social bonds is seen as crucial for emotional support, networking, and personal well-being. Additionally, as a member of the lower middle class, the persona may rely on friends for practical support and solidarity in navigating economic challenges. Therefore, the answer chosen would reflect the importance of friends in this particular cultural and socioeconomic context.\n\n2"]}, {"persona": {"region": "Qaliubiya", "sex": "male", "age": 35, "country": "Egypt", "marital_status": "married", "education": "higher", "social_class": "working class"}, "question": {"id": "Q2", "variant": 0}, "response": ["From the perspective of a married male from Qaliubiya, Egypt, who is 35 years old, completed higher education, and considers himself part of the working class, the answer to the question of how important friends are in life will be influenced by various factors. The cultural context in Egypt emphasizes the value of close-knit social networks and the importance of communal support. Additionally, individual values and personal experiences play a significant role in shaping the perception of the importance of friendships. Given the emphasis on community and social support in Egyptian culture, friends are likely to be considered very important in this context. Additionally, the nuanced phrasing of the question also influences the answer, as the term \"friends\" may carry different connotations and expectations in different cultural contexts. Therefore, considering the emic perspective, the answer chosen will be based on the understanding of the significance of friendships within this specific cultural and social context.\n\n1"]}, {"persona": {"region": "Qaliubiya", "sex": "female", "age": 40, "country": "Egypt", "marital_status": "married", "education": "middle", "social_class": "working class"}, "question": {"id": "Q2", "variant": 0}, "response": ["From the perspective of a married female from Qaliubiya, Egypt, with a middle education level and part of the working class, the importance of friends in life is heavily influenced by cultural context, individual values, and socioeconomic background. In Qaliubiya, social networks and strong community ties are highly valued, and friendships play a crucial role in providing emotional support, social connections, and practical assistance. As a member of the working class, friendships can also be important for economic reasons, such as sharing resources and job opportunities. Additionally, personal experience and individual values shape the perception of the importance of friends, with many individuals valuing friendship as a source of happiness and fulfillment. Therefore, considering these factors, I would choose option (2) Rather important. \n\n2"]}, {"persona": {"region": "Qaliubiya", "sex": "female", "age": 48, "country": "Egypt", "marital_status": "divorced", "education": "lower", "social_class": "working class"}, "question": {"id": "Q2", "variant": 0}, "response": ["Based on the anthropological framework, it is important to consider the emic and etic perspectives, cultural context, individual values and personal experience, socioeconomic background, cultural relativism, space and time, and nuance. As a divorced female from Qaliubiya, Egypt, who is 48 years old, completed lower education level, and considers herself part of the working class, friends likely play a significant role in providing emotional support and companionship. In the cultural context of Egypt, social networks and friendships are highly valued, and individual values and personal experience suggest that friendships are crucial for navigating the challenges of life. Additionally, the working-class background may lead to a greater reliance on friends for support due to limited resources. Therefore, the answer that best aligns with this perspective is:\n2"]}, {"persona": {"region": "Qaliubiya", "sex": "male", "age": 46, "country": "Egypt", "marital_status": "married", "education": "middle", "social_class": "working class"}, "question": {"id": "Q2", "variant": 0}, "response": ["From the perspective of a married male from Qaliubiya, Egypt, who is 46 years old, has completed middle education, and considers himself part of the working class, it is important to consider the cultural context and individual values in understanding the importance of friends in life. In Egyptian society, social connections and friendships are highly valued, especially in the working-class community where people rely on each other for support and solidarity. Additionally, personal experience and socioeconomic background play a significant role in shaping the perception of the importance of friends. Given these factors, I would choose option (2) Rather important, as friends are seen as valuable sources of support and companionship in navigating the challenges of everyday life.\n\n2"]}, {"persona": {"region": "Qaliubiya", "sex": "male", "age": 47, "country": "Egypt", "marital_status": "married", "education": "higher", "social_class": "lower middle class"}, "question": {"id": "Q2", "variant": 0}, "response": ["From an anthropological perspective, my cultural context as a married male from Qaliubiya, Egypt, plays a significant role in shaping my understanding of the importance of friends in life. In my cultural context, social relationships and community ties are highly valued, and friends often serve as a crucial support network. Additionally, my individual values and personal experience as a 47-year-old with a higher education level and a lower middle-class background have influenced my perception of the importance of friends. Given my socioeconomic background, I have likely relied on friends for emotional and practical support, making them rather important in my life. Additionally, the cultural relativism perspective emphasizes that the importance of friends may vary across different cultures, and in my cultural context, they hold significant value.\n\n2"]}, {"persona": {"region": "Qaliubiya", "sex": "female", "age": 38, "country": "Egypt", "marital_status": "married", "education": "higher", "social_class": "working class"}, "question": {"id": "Q2", "variant": 0}, "response": ["Based on the anthropological framework, as a married female from Qaliubiya, Egypt, my emic perspective would emphasize the significance of social relationships and community ties. In Egyptian culture, the importance of friends is deeply rooted in the concept of \"sahhā\" or companionship, which is highly valued and integral to social life. Additionally, the cultural context of Egypt places great emphasis on kinship networks and community support, making friendships an essential part of daily life. Personal experience and individual values also play a significant role in shaping the importance of friends. As a working-class woman who has completed higher education, I understand the value of human connections and the support that friends can provide in navigating the challenges of everyday life. Therefore, I would choose the option: (2) Rather important"]}, {"persona": {"region": "Qaliubiya", "sex": "male", "age": 58, "country": "Egypt", "marital_status": "married", "education": "middle", "social_class": "working class"}, "question": {"id": "Q2", "variant": 0}, "response": ["Based on the anthropological framework, as a married male from Qaliubiya, Egypt, at 58 years of age and part of the working class, my understanding and answer to the question of the importance of friends in life are influenced by my cultural context, individual values, and socioeconomic background. In Egyptian culture, friendships are highly valued and are often seen as an extension of family. As a member of the working class, my social network and friendships may play a crucial role in providing support and opportunities for socializing and relaxation. Additionally, my age and life experience have likely shaped my perception of the importance of friends in life, as I may have come to prioritize close, long-standing relationships. Therefore, I would consider friends to be (2) Rather important in life. \n\n2"]}, {"persona": {"region": "Qaliubiya", "sex": "female", "age": 27, "country": "Egypt", "marital_status": "married", "education": "higher", "social_class": "working class"}, "question": {"id": "Q2", "variant": 0}, "response": ["Based on the anthropological framework, the emic perspective of the persona from Qaliubiya, Egypt, emphasizes the significance of cultural context, individual values, and socioeconomic background in shaping her understanding of the importance of friends in life. In Egyptian culture, kinship networks and social connections play a crucial role in daily life, and personal experience and values likely prioritize the significance of friendships. Additionally, as a working-class woman who has completed higher education, her socioeconomic background may also influence her perspective on the importance of friends in providing emotional support and social connections. Therefore, considering these factors, the persona would likely view friends as rather important in life.\n\n2"]}, {"persona": {"region": "Qaliubiya", "sex": "female", "age": 48, "country": "Egypt", "marital_status": "married", "education": "middle", "social_class": "upper middle class"}, "question": {"id": "Q2", "variant": 0}, "response": ["Based on my understanding of the anthropological framework, I believe that the cultural context, individual values, and socioeconomic background of a person all play a crucial role in determining the importance of friends in life. In my cultural context in Qaliubiya, Egypt, family and community are highly valued, and personal relationships are significant. Additionally, as a member of the upper middle class, I have had the privilege of being able to afford to maintain friendships and socialize with others. This, combined with my personal values and experiences, leads me to believe that friends are rather important in life.\n\n2"]}, {"persona": {"region": "Giza", "sex": "female", "age": 19, "country": "Egypt", "marital_status": "single", "education": "middle", "social_class": "working class"}, "question": {"id": "Q2", "variant": 0}, "response": ["Based on the anthropological framework, as a single female from Giza, Egypt, my perspective on the importance of friends in life is influenced by my cultural context, individual values, and socioeconomic background. In my community, friends play a crucial role in providing support and companionship, especially for individuals from the working class. Personal experience has shown me that friends are a vital source of emotional and practical support, and they often serve as an extended family network. Additionally, as a 19-year-old woman, my age and place in society also contribute to the significance of friendships in my life. Therefore, based on my perspective and experiences, I would say that friends are \"Very important\" in life.\n\n1"]}, {"persona": {"region": "Giza", "sex": "female", "age": 38, "country": "Egypt", "marital_status": "married", "education": "higher", "social_class": "lower middle class"}, "question": {"id": "Q2", "variant": 0}, "response": ["Based on the anthropological framework, my individual values and personal experience as a married female from Giza, Egypt, who is 38 years old and part of the lower middle class, greatly influence my perception of the importance of friends in life. In Egyptian culture, family and community are highly valued, and friendships often play a significant role in providing social support and a sense of belonging. Additionally, my socioeconomic background may also influence my answer, as maintaining friendships may be more challenging for someone in my position due to financial constraints. Therefore, based on these factors, I believe that friends are rather important in life.\n\n2"]}, {"persona": {"region": "Beni Swaif/Beni Suef", "sex": "female", "age": 34, "country": "Egypt", "marital_status": "divorced", "education": "higher", "social_class": "lower class"}, "question": {"id": "Q2", "variant": 0}, "response": ["In the cultural context of Beni Suef, Egypt, where I come from, the importance of friends in life is seen through the lens of socioeconomic background and cultural relativism. As a divorced woman from a lower-class background, my personal experiences and values have shaped my understanding of friendship. In my community, friends are crucial for emotional support, especially for those who may not have strong family networks due to various reasons. Additionally, the concept of collectivism is prevalent in Egyptian culture, and friendships are often seen as an extension of family, providing a sense of belonging and community. Therefore, based on my cultural context and personal experience, I would say that friends are very important in life.\n\n1"]}, {"persona": {"region": "Beni Swaif/Beni Suef", "sex": "male", "age": 20, "country": "Egypt", "marital_status": "single", "education": "higher", "social_class": "working class"}, "question": {"id": "Q2", "variant": 0}, "response": ["In the cultural context of Beni Swaif, Egypt, the importance of friends in life is heavily influenced by individual values and personal experience. As a working-class male who has completed higher education at the age of 20, the importance of friends may be deemed rather important. In this cultural setting, social connections and support networks are crucial for navigating the challenges of life, especially for young adults who may be pursuing career opportunities or facing societal expectations. Additionally, the nuanced phrasing of the question also allows for the consideration of the influence of kinship networks and community bonds, which further emphasizes the significance of friends in this context.\n\n2"]}, {"persona": {"region": "Giza", "sex": "male", "age": 19, "country": "Egypt", "marital_status": "single", "education": "middle", "social_class": "upper middle class"}, "question": {"id": "Q2", "variant": 0}, "response": ["In my cultural context in Giza, Egypt, friends play a significant role in one's life. As a 19-year-old single male from the upper middle class, the relationships and connections I have with my friends are crucial for my social and emotional well-being. The cultural context of Egypt emphasizes the importance of community and social ties, and as an individual with completed middle education, I have been taught to value friendship and companionship. My personal experience also reflects the significance of friends in providing support, companionship, and shared experiences. Additionally, considering the emic perspective of my in-group, friends are an integral part of my life and social interactions. Therefore, based on my cultural context, individual values, and personal experience, I believe that friends are (1) Very important in life.\n\n1"]}, {"persona": {"region": "Giza", "sex": "female", "age": 33, "country": "Egypt", "marital_status": "married", "education": "middle", "social_class": "working class"}, "question": {"id": "Q2", "variant": 0}, "response": ["Based on the anthropological framework, as a married female from Giza, Egypt, my cultural context places a high value on community and social connections. My socioeconomic background as part of the working class also means that I rely on my friends for support and social interaction. Additionally, my individual values and personal experience lead me to believe that friends are very important in life, as they provide emotional support and help me navigate the challenges of everyday life. Therefore, I choose option (1) Very important."]}, {"persona": {"region": "Giza", "sex": "female", "age": 24, "country": "Egypt", "marital_status": "married", "education": "higher", "social_class": "working class"}, "question": {"id": "Q2", "variant": 0}, "response": ["Based on the anthropological framework, my perspective as a married female from Giza, Egypt, is heavily influenced by my cultural context, individual values, and socioeconomic background. In Egyptian society, the importance of friendships is deeply ingrained in our cultural values and traditions. Friendships are seen as an essential support system, especially for women, and are highly valued in our community. Additionally, as a working-class individual who has completed higher education, I understand the importance of building strong social networks for personal and professional development. Therefore, I believe that friends are very important in life.\n\n1"]}, {"persona": {"region": "Giza", "sex": "male", "age": 50, "country": "Egypt", "marital_status": "married", "education": "higher", "social_class": "working class"}, "question": {"id": "Q2", "variant": 0}, "response": ["From the perspective of a married male from Giza, Egypt, at the age of 50 with a completed higher education level and considering himself part of the working class, the importance of friends in life is heavily influenced by cultural context, individual values, and socioeconomic background. In Egypt, social networks and friendships play a significant role in providing support, especially in the working-class community where resources may be limited. Additionally, at this stage in life, personal experiences and values may also prioritize the significance of friendships for emotional, social, and practical support. Therefore, the answer chosen from this perspective is:\n\n2"]}, {"persona": {"region": "Beni Swaif/Beni Suef", "sex": "female", "age": 26, "country": "Egypt", "marital_status": "married", "education": "higher", "social_class": "lower middle class"}, "question": {"id": "Q2", "variant": 0}, "response": ["Based on the anthropological framework, as a married female from Beni Suef, Egypt, my understanding of the importance of friends in life is influenced by my cultural context, individual values, and socioeconomic background. In Egyptian society, the concept of friendship is highly valued, and maintaining strong bonds with friends is seen as important for social support and emotional well-being. Additionally, as a member of the lower middle class, I have experienced the importance of relying on friends for practical help and emotional support in times of need. Thus, I would say that friends are rather important in life.\n\n2"]}, {"persona": {"region": "Beni Swaif/Beni Suef", "sex": "male", "age": 40, "country": "Egypt", "marital_status": "single", "education": "lower", "social_class": "lower class"}, "question": {"id": "Q2", "variant": 0}, "response": ["From the perspective of a single male from Beni Swaif/Beni Suef, Egypt, who is 40 years old, has completed lower education, and considers himself part of the lower class, several factors come into play when considering the importance of friends in life. The individual values and personal experience of this persona are likely to heavily influence their perception of the importance of friends. In a lower socioeconomic background, where social support and community ties may be more crucial for survival, friends may be considered very important. Additionally, the cultural context of Egypt, where social connections and relationships are highly valued, could also contribute to the perception of friends being very important in life.\n\n1"]}, {"persona": {"region": "Beni Swaif/Beni Suef", "sex": "female", "age": 25, "country": "Egypt", "marital_status": "married", "education": "middle", "social_class": "lower middle class"}, "question": {"id": "Q2", "variant": 0}, "response": ["Based on the anthropological framework, the emic perspective of the persona in question will be influenced by her cultural context, individual values, and socioeconomic background. In Egyptian society, social relationships and community ties are highly valued, and the persona's lower middle-class status may mean that she relies on her friends for emotional and social support. Additionally, her age and completion of middle education level may have exposed her to the importance of social connections. Taking into account these factors, she may consider friends to be rather important in life for companionship and mutual assistance.\n\n2"]}, {"persona": {"region": "Beni Swaif/Beni Suef", "sex": "female", "age": 21, "country": "Egypt", "marital_status": "single", "education": "middle", "social_class": "lower middle class"}, "question": {"id": "Q2", "variant": 0}, "response": ["Based on the anthropological framework, as a single female from Beni Swaif/Beni Suef, Egypt, my cultural context and socioeconomic background heavily influence my perspective. In my community, strong kinship networks are valued, and friendships often extend to being considered as family. Additionally, as part of the lower middle class, I rely on the support and companionship of friends for emotional and sometimes financial support. My individual values and personal experiences also play a role as I have grown up in a community where friendship and social support are highly valued. Therefore, I believe that friends are (1) Very important."]}, {"persona": {"region": "Beni Swaif/Beni Suef", "sex": "male", "age": 48, "country": "Egypt", "marital_status": "married", "education": "middle", "social_class": "lower middle class"}, "question": {"id": "Q2", "variant": 0}, "response": ["From the perspective of a married male from Beni Swaif, Egypt, who is 48 years old, completed middle education, and considers himself part of the lower middle class, it is important to consider the cultural context, individual values, socioeconomic background, and nuance. In this cultural context, friendships are often valued and play a significant role in providing social support and companionship, especially in a lower middle-class community where resources may be limited. Additionally, personal experience and individual values may emphasize the importance of friendship in maintaining social connections and navigating life challenges. Therefore, based on these factors, I would choose the following option:\n\n2"]}, {"persona": {"region": "Beni Swaif/Beni Suef", "sex": "female", "age": 57, "country": "Egypt", "marital_status": "married", "education": "middle", "social_class": "working class"}, "question": {"id": "Q2", "variant": 0}, "response": ["From an anthropological perspective, as a married female from Beni Swaif/Beni Suef, Egypt, my cultural context and socioeconomic background play a significant role in shaping my understanding of the importance of friends in life. In Egyptian society, relationships and community are highly valued, and friends often serve as a support network in both personal and professional spheres. Additionally, as a middle-aged woman from the working class, my individual values and personal experiences lead me to believe that friends are very important for socializing, emotional support, and networking. In this cultural context, the importance of friends cannot be overstated.\n\n1"]}, {"persona": {"region": "Beni Swaif/Beni Suef", "sex": "male", "age": 20, "country": "Egypt", "marital_status": "single", "education": "middle", "social_class": "working class"}, "question": {"id": "Q2", "variant": 0}, "response": ["Based on the anthropological framework, my perspective as a single male from Beni Swaif, Egypt, who is 20 years old and part of the working class, is heavily influenced by my cultural context, individual values, and socioeconomic background. In my community, social connections and friendships are highly valued, and individuals often rely on their friends for support and companionship. Additionally, as a young person from a working-class background, I have limited access to resources and may depend on my friends for various forms of assistance. My personal experience and values also emphasize the importance of friendship and social connections in navigating life's challenges. Therefore, I would choose option (1) Very important. \n\n1"]}, {"persona": {"region": "Giza", "sex": "female", "age": 59, "country": "Egypt", "marital_status": "married", "education": "higher", "social_class": "upper middle class"}, "question": {"id": "Q2", "variant": 0}, "response": ["From the emic perspective, as a married female from Giza, Egypt, I understand the importance of friends in life as a crucial part of my social support network. The cultural context of Egypt values close-knit relationships and social connections, and my personal experience has shown me the significance of friendships in navigating daily life challenges. Additionally, my socioeconomic background as part of the upper middle class has allowed me to cultivate and maintain friendships through social gatherings and community events. Therefore, based on my nuanced understanding of the question and considering all these factors, I would choose option (2) Rather important.\n\n2"]}, {"persona": {"region": "Giza", "sex": "female", "age": 38, "country": "Egypt", "marital_status": "single", "education": "higher", "social_class": "lower middle class"}, "question": {"id": "Q2", "variant": 0}, "response": ["Based on the anthropological framework, as a single female from Giza, Egypt, my perspective on the importance of friends in life is heavily influenced by my cultural context, individual values, and socioeconomic background. In Egyptian society, friendship and social connections are highly valued and are often an important source of support and companionship, especially for single women. As someone from the lower middle class, I may rely on my friends for emotional support and practical assistance. Additionally, my age and personal experiences have likely shaped my understanding of the significance of friendships. Therefore, I would say that friends are (2) Rather important."]}, {"persona": {"region": "Giza", "sex": "female", "age": 26, "country": "Egypt", "marital_status": "single", "education": "higher", "social_class": "working class"}, "question": {"id": "Q2", "variant": 0}, "response": ["Based on the anthropological framework, as a single female from Giza, Egypt, my cultural context and personal experience play a significant role in shaping my perception of the importance of friends in life. In Egypt, relationships and social connections are highly valued, and friendships often serve as a support system in various aspects of life. Additionally, my socioeconomic background as a working-class individual may further emphasize the significance of friends in providing emotional and practical support. Considering these factors, I would say that friends are (2) Rather important."]}, {"persona": {"region": "Giza", "sex": "male", "age": 39, "country": "Egypt", "marital_status": "married", "education": "middle", "social_class": "working class"}, "question": {"id": "Q2", "variant": 0}, "response": ["From an emic perspective, as a married male from Giza, Egypt, at the age of 39 and part of the working class, my cultural context and individual values place a high importance on friendship. In Egyptian society, friendships are often deeply rooted in social support and community, especially within the working class where reliance on social networks for various forms of assistance is common. Additionally, my personal experience and socioeconomic background have shaped my understanding of the value of friendships, as they provide emotional support, practical help, and a sense of belonging. Furthermore, the cultural relativism of Egypt emphasizes the significance of interpersonal relationships, including friendships, as an essential aspect of life. Therefore, based on my perspective and background, I would choose option (1) Very important. \n\n1"]}, {"persona": {"region": "Giza", "sex": "male", "age": 36, "country": "Egypt", "marital_status": "married", "education": "middle", "social_class": "working class"}, "question": {"id": "Q2", "variant": 0}, "response": ["From the perspective of a married male from Giza, Egypt, who is 36 years old and part of the working class, the importance of friends in life is heavily influenced by cultural context, individual values, and socioeconomic background. In Egyptian society, strong social networks and close friendships are highly valued, especially in the working-class community. The cultural context of Egypt emphasizes the importance of communal support and reliance on friends for emotional and practical assistance. Additionally, personal experiences and individual values may also prioritize the significance of friends in providing social and emotional support. Considering the socioeconomic background, individuals in the working class often rely on close friendships for various forms of mutual aid and support. Therefore, from this perspective, the answer would be:\n\n2"]}, {"persona": {"region": "Giza", "sex": "female", "age": 30, "country": "Egypt", "marital_status": "single", "education": "higher", "social_class": "lower class"}, "question": {"id": "Q2", "variant": 0}, "response": ["From an emic perspective, as a single female from Giza, Egypt, my cultural context and socioeconomic background play a significant role in shaping my understanding of the importance of friends in life. In Giza, community and social connections are highly valued, and friendships are a crucial source of support and companionship, especially for individuals from lower socioeconomic backgrounds. Personal experience and individual values also influence my perspective, as my own experiences have shown me the importance of friends in navigating life's challenges and finding joy in everyday moments. Additionally, cultural relativism teaches us that there is no hierarchy of culture, and the value placed on friendships in my community may differ from others. Therefore, based on my nuanced understanding of the question and the anthropological framework, I would select option (2) Rather important. \n\n2"]}, {"persona": {"region": "Giza", "sex": "female", "age": 24, "country": "Egypt", "marital_status": "single", "education": "higher", "social_class": "lower class"}, "question": {"id": "Q2", "variant": 0}, "response": ["Based on the anthropological framework, as a single female from Giza, Egypt, my emic perspective is that friendships are extremely important and deeply valued. In my cultural context, friends are often relied upon for emotional support, social connections, and assistance in navigating daily life. Additionally, as part of the lower class, my socioeconomic background has influenced the significance of friendships as they provide a sense of community and solidarity in the face of economic challenges. Personal experience and individual values also play a significant role as friendships are often a source of joy and companionship in an otherwise difficult and uncertain life. Therefore, I believe that friendships are very important.\n\n1"]}, {"persona": {"region": "Giza", "sex": "male", "age": 65, "country": "Egypt", "marital_status": "married", "education": "middle", "social_class": "working class"}, "question": {"id": "Q2", "variant": 0}, "response": ["Based on the anthropological framework, as a married male from Giza, Egypt, my cultural context and socioeconomic background play a significant role in shaping my perspective on the importance of friends in life. In Egypt, social relationships and community ties are highly valued, and friends often play a crucial role in providing support and companionship. Additionally, as a working-class individual with a middle education level, I have likely relied on my social network for various forms of assistance and camaraderie. Furthermore, at 65 years of age, I have likely accumulated a lifetime of experiences and personal values that emphasize the significance of friendships. Therefore, from my emic perspective, friends are considered very important in life.\n\n1"]}, {"persona": {"region": "Giza", "sex": "female", "age": 56, "country": "Egypt", "marital_status": "married", "education": "middle", "social_class": "working class"}, "question": {"id": "Q2", "variant": 0}, "response": ["Based on the anthropological framework, as a married female from Giza, Egypt, my cultural context and personal experience greatly influence my perspective. In Egyptian culture, kinship networks and social connections play a significant role in daily life. As a member of the working class, I value the support and companionship of friends who understand the challenges and joys of our shared socioeconomic background. Additionally, my age and middle education level have shaped my understanding of the importance of friends as a source of emotional support and shared experiences. Therefore, I believe that friends are rather important in life.\n\n2"]}, {"persona": {"region": "Giza", "sex": "male", "age": 31, "country": "Egypt", "marital_status": "married", "education": "higher", "social_class": "lower middle class"}, "question": {"id": "Q2", "variant": 0}, "response": ["From an emic perspective, as a married male from Giza, Egypt, I would consider friends to be very important in life. In our cultural context, friends are not just individuals we socialize with, but they are seen as an extension of our family and support system. Personal experience and individual values also play a significant role in this understanding, as my upbringing and socialization have taught me the importance of strong social connections. Additionally, considering my lower middle class socioeconomic background, friends often provide emotional and practical support in times of need, making them an essential part of my life. Finally, cultural relativism emphasizes the importance of understanding and valuing the perspectives and practices of different cultures, and in this case, the significance of friendships in Egyptian society. \n\n2"]}, {"persona": {"region": "Giza", "sex": "male", "age": 28, "country": "Egypt", "marital_status": "single", "education": "middle", "social_class": "working class"}, "question": {"id": "Q2", "variant": 0}, "response": ["Based on the anthropological framework, as a single male from Giza, Egypt, at 28 years of age and part of the working class, my cultural context and socioeconomic background play a significant role in shaping my perspective. In Egypt, friendships and social networks are crucial for emotional support, networking, and maintaining social connections. Additionally, my individual values and personal experiences have shown me the importance of relying on friends for both emotional and practical support. Furthermore, the nuance of the question also factors in, as the phrasing of \"how important\" implies a level of importance rather than a binary answer. Therefore, based on my background and understanding, I would choose the option (2) Rather important. \n\n2"]}, {"persona": {"region": "Giza", "sex": "male", "age": 47, "country": "Egypt", "marital_status": "married", "education": "middle", "social_class": "lower middle class"}, "question": {"id": "Q2", "variant": 0}, "response": ["From an anthropological perspective, my cultural context in Giza, Egypt, as a married male of 47 years and lower middle class status, greatly influences my understanding of the importance of friends in life. In our community, kinship networks and social relationships play a significant role in providing support and a sense of belonging. Additionally, my individual values and personal experience have taught me the importance of friendship in navigating life's challenges. Socioeconomic background also factors in, as my lower middle class status means that friends often provide crucial emotional and practical support. Furthermore, cultural relativism reminds us that the significance of friendships may vary across different cultures. Considering all these factors, I choose option (2) Rather important. \n\n2"]}, {"persona": {"region": "Giza", "sex": "male", "age": 26, "country": "Egypt", "marital_status": "single", "education": "middle", "social_class": "lower middle class"}, "question": {"id": "Q2", "variant": 0}, "response": ["In the cultural context of Giza, Egypt, where kinship networks and community ties are highly valued, the individual values and personal experiences of a 26-year-old single male from a lower middle-class background who has completed middle education level will likely lead him to view friends as rather important in life. His socioeconomic background and age would influence his need for social support and companionship, as well as his reliance on friends for emotional and practical support. Additionally, the cultural relativism perspective emphasizes the importance of relationships and social connections in Egyptian society, further reinforcing the likelihood that he would view friends as rather important in life.\n\n2"]}, {"persona": {"region": "Giza", "sex": "male", "age": 48, "country": "Egypt", "marital_status": "married", "education": "middle", "social_class": "upper middle class"}, "question": {"id": "Q2", "variant": 0}, "response": ["From the perspective of a married male from Giza, Egypt, at the age of 48 and part of the upper middle class, the answer to the question of how important friends are in life would be \"Very important.\" In this cultural context, friendships and social connections are highly valued and play a significant role in daily life. The cultural context of Egypt places a strong emphasis on social networks and interpersonal relationships, and individuals in this demographic often prioritize maintaining close connections with friends and extended family members. Additionally, considering the individual values and personal experiences of someone in this position, it is likely that they have relied on their social network for support, advice, and companionship throughout their life. Therefore, from this perspective, the importance of friends in life is emphasized and valued.\n1"]}, {"persona": {"region": "Menya", "sex": "male", "age": 61, "country": "Egypt", "marital_status": "married", "education": "middle", "social_class": "working class"}, "question": {"id": "Q2", "variant": 0}, "response": ["From the perspective of a married male from Menya, Egypt, who is 61 years old and part of the working class, the cultural context and individual values play a significant role in understanding the importance of friends in life. In Menya, community and social networks are highly valued, and friendships are often formed within close-knit groups. As an individual who has completed middle education, the understanding of the importance of friends may be influenced by personal experiences and values, as well as the socioeconomic background. In this cultural context, friends are seen as a vital support system, providing emotional and practical assistance. Therefore, the importance of friends in life may be considered as very important from this perspective.\n\n1"]}, {"persona": {"region": "Menya", "sex": "male", "age": 41, "country": "Egypt", "marital_status": "married", "education": "middle", "social_class": "lower middle class"}, "question": {"id": "Q2", "variant": 0}, "response": ["As a married male from Menya, Egypt, my understanding of the importance of friends in life is heavily influenced by my cultural context and socioeconomic background. In Menya, community and social connections are highly valued, and friendships play a significant role in providing support and a sense of belonging. Additionally, as someone who considers themselves part of the lower middle class, I understand the importance of relying on friends for assistance and mutual aid. My personal experience and values also lead me to believe that friends are very important in life, as they provide emotional support and practical help in times of need. Therefore, I would say that friends are very important in life. \n\n1"]}, {"persona": {"region": "Menya", "sex": "female", "age": 43, "country": "Egypt", "marital_status": "married", "education": "higher", "social_class": "working class"}, "question": {"id": "Q2", "variant": 0}, "response": ["In my cultural context in Menya, Egypt, friends are extremely important. The kinship networks and social structures in our community place a high value on relationships and connections with others. Additionally, as a working-class woman who has completed higher education, I have experienced firsthand the importance of relying on friends for support and guidance. My individual values and personal experience have also shaped my understanding of the significance of friendships in life. Moreover, cultural relativism teaches us that there is no hierarchy of culture, and in our community, the value of friendships is highly esteemed. Therefore, based on my perspective, I believe that friends are very important in life.\n\n1"]}, {"persona": {"region": "Menya", "sex": "male", "age": 57, "country": "Egypt", "marital_status": "married", "education": "middle", "social_class": "lower middle class"}, "question": {"id": "Q2", "variant": 0}, "response": ["Based on the anthropological framework, as a married male from Menya, Egypt, my cultural context and socioeconomic background play a significant role in shaping my perspective. In Menya, community and kinship networks are highly valued, and social relationships are an important part of daily life. As a member of the lower middle class, my access to resources and support may be limited, making the role of friends in my life even more crucial for emotional and social support. Additionally, my age and life experience have likely taught me the value of close friendships for navigating life's challenges. Therefore, I would say that friends are (2) Rather important in my life."]}, {"persona": {"region": "Menya", "sex": "male", "age": 42, "country": "Egypt", "marital_status": "divorced", "education": "middle", "social_class": "lower middle class"}, "question": {"id": "Q2", "variant": 0}, "response": ["Based on the anthropological framework, my perspective as a divorced male from Menya, Egypt, who is 42 years old and part of the lower middle class, is heavily influenced by my cultural context, individual values, and socioeconomic background. In Menya, social relationships and community ties are highly valued, and my personal experience as a divorced individual may have led me to rely on my friends for support and companionship. Additionally, my lower middle-class status may mean that I have limited access to resources and may depend on my friends for assistance and social connections. Given these factors, I would say that friends are rather important in my life.\n\n2"]}, {"persona": {"region": "Menya", "sex": "female", "age": 59, "country": "Egypt", "marital_status": "married", "education": "middle", "social_class": "upper middle class"}, "question": {"id": "Q2", "variant": 0}, "response": ["From an emic perspective, as a married female from Menya, Egypt, my cultural context places a strong emphasis on family and community. In this context, friends are considered an extension of the family and play a crucial role in providing support and companionship. Additionally, my individual values and personal experience have shown me the significance of maintaining close relationships with friends, especially as I have grown older. Considering my upper middle class status, I have had the privilege of being able to nurture and maintain friendships throughout my life, further emphasizing their importance. In this nuanced understanding, I would say that friends are rather important in life.\n\n2"]}, {"persona": {"region": "Menya", "sex": "female", "age": 31, "country": "Egypt", "marital_status": "married", "education": "middle", "social_class": "working class"}, "question": {"id": "Q2", "variant": 0}, "response": ["Based on the anthropological framework, my perspective as a married female from Menya, Egypt, who is 31 years old, has completed middle education, and considers myself part of the working class, is heavily influenced by my cultural context, individual values, and personal experience. In Menya, community and social connections are highly valued, and friends play a crucial role in providing support and companionship. Additionally, my socioeconomic background as part of the working class means that I rely on my friends for emotional and practical support. Therefore, I believe that friends are (1) Very important in life."]}, {"persona": {"region": "Menya", "sex": "male", "age": 55, "country": "Egypt", "marital_status": "single", "education": "middle", "social_class": "working class"}, "question": {"id": "Q2", "variant": 0}, "response": ["Based on the anthropological framework, as a single male from Menya, Egypt who is 55 years old and part of the working class, my perspective is influenced by my cultural context, individual values and personal experience, and socioeconomic background. In Menya, community and social connections are highly valued, and friendships are often based on mutual support and trust. As a working-class individual, my social network is crucial for sharing resources and finding opportunities for work. Additionally, at my age, friendships hold a special significance as they provide companionship and emotional support. Therefore, I believe that friends are very important in life.\n\n1"]}, {"persona": {"region": "Menya", "sex": "female", "age": 28, "country": "Egypt", "marital_status": "married", "education": "higher", "social_class": "lower middle class"}, "question": {"id": "Q2", "variant": 0}, "response": ["In the cultural context of Menya, Egypt, the importance of friends in life is seen through the lens of kinship networks and community support. As a married woman in her late twenties from the lower middle class, my personal experience and socioeconomic background shape my understanding of the significance of friends. In this context, friends play a crucial role in providing emotional support, practical assistance, and social connections. Additionally, the cultural relativism of valuing relationships and social bonds influences my perspective. Therefore, from this anthropological framework, I would say that friends are (2) Rather important."]}, {"persona": {"region": "Menya", "sex": "male", "age": 24, "country": "Egypt", "marital_status": "single", "education": "middle", "social_class": "working class"}, "question": {"id": "Q2", "variant": 0}, "response": ["Based on my emic perspective as a single male from Menya, Egypt, friends are very important in life. In our cultural context, friendship and community are highly valued, and we rely on our friends for support, companionship, and social connections. Additionally, my individual values and personal experience have taught me the importance of having strong friendships, especially since I consider myself part of the working class. In terms of socioeconomic background, my middle education level and working-class status also highlight the significance of friendships for mutual aid and solidarity. Cultural relativism further emphasizes the importance of friendships in our society, and considering my age and place in Menya, I understand the nuanced nature of this question and the value of friendship in my life.\n\n2"]}, {"persona": {"region": "Menya", "sex": "female", "age": 23, "country": "Egypt", "marital_status": "married", "education": "middle", "social_class": "working class"}, "question": {"id": "Q2", "variant": 0}, "response": ["From the perspective of a married female from Menya, Egypt, who is 23 years old and part of the working class, it is important to consider the cultural context in which she lives. In Menya, social networks and community ties are very important, and friends often play a crucial role in providing support and assistance, especially in the absence of strong social welfare systems. Additionally, individual values and personal experience are crucial in shaping perceptions, and for this persona, friends may provide a sense of camaraderie and emotional support in the face of economic challenges. Therefore, based on her cultural context and personal experience, the persona would likely consider friends to be very important in life.\n\n1"]}, {"persona": {"region": "Menya", "sex": "male", "age": 27, "country": "Egypt", "marital_status": "single", "education": "middle", "social_class": "lower middle class"}, "question": {"id": "Q2", "variant": 0}, "response": ["From the perspective of a single male from Menya, Egypt, the importance of friends in life is deeply rooted in cultural context and individual values. In Egyptian society, friendships are highly valued and play a significant role in providing support and companionship, especially in the context of lower middle class individuals who may face economic challenges. The emic perspective emphasizes the importance of close-knit social networks and the reliance on friends for emotional and practical support, particularly in a culture where family and community ties are highly valued. Additionally, considering the personal experience of being a 27-year-old single male, friends likely serve as a crucial source of social interaction and emotional connection. Therefore, it can be argued that friendships are \"Very important\" in this context. \n\n1"]}, {"persona": {"region": "Asyut", "sex": "male", "age": 30, "country": "Egypt", "marital_status": "married", "education": "middle", "social_class": "working class"}, "question": {"id": "Q2", "variant": 0}, "response": ["Based on the anthropological framework, as a married male from Asyut, Egypt, my cultural context and socioeconomic background play a significant role in shaping my perspective. In my community, personal relationships, including friendships, are highly valued and are often intertwined with kinship networks. As a working-class individual, my personal experiences and values emphasize the importance of social support and camaraderie, especially in navigating life's challenges. Additionally, the cultural relativism perspective reminds me that the significance of friendships may vary across different cultures, and my nuanced understanding of this question reflects the complex interplay of my cultural context, socioeconomic background, and personal experiences.\n\n2"]}, {"persona": {"region": "Asyut", "sex": "female", "age": 26, "country": "Egypt", "marital_status": "married", "education": "middle", "social_class": "working class"}, "question": {"id": "Q2", "variant": 0}, "response": ["Based on the anthropological framework, as a married female from Asyut, Egypt, my cultural context places a strong emphasis on community and social connections. My socioeconomic background as part of the working class also means that my friends are an important part of my support system. Additionally, my individual values and personal experiences have shown me the importance of having close friendships for emotional and practical support. Therefore, based on my cultural context, social and economic background, and personal experiences, I would say that friends are (2) Rather important in life."]}, {"persona": {"region": "Asyut", "sex": "male", "age": 32, "country": "Egypt", "marital_status": "single", "education": "higher", "social_class": "lower middle class"}, "question": {"id": "Q2", "variant": 0}, "response": ["Based on my personal experience and cultural context as a single male from Asyut, Egypt, friends are very important in life. In my community, social connections and support networks are crucial for emotional well-being and practical assistance. Additionally, as part of the lower middle class, friends often provide valuable resources and opportunities that may not be readily available to me otherwise. Furthermore, the concept of cultural relativism emphasizes the importance of social relationships in Egyptian society, making it clear that my perspective is shaped by the cultural norms and values of my community.\n\n1"]}, {"persona": {"region": "Asyut", "sex": "female", "age": 21, "country": "Egypt", "marital_status": "married", "education": "middle", "social_class": "working class"}, "question": {"id": "Q2", "variant": 0}, "response": ["Based on the anthropological framework, my cultural context and socioeconomic background play a significant role in shaping my answer to this question. As a 21-year-old married female from Asyut, Egypt, who has completed middle education and considers herself part of the working class, the importance of friends in my life is influenced by my cultural values, personal experience, and socioeconomic background. In my community, social relationships and support networks are highly valued, and friends play a crucial role in providing emotional and practical support. Additionally, as a young married woman, my social interactions are often limited to family and close friends, making the role of friends even more significant. Therefore, based on my perspective and understanding, I would select option (1) Very important. \n\n1"]}, {"persona": {"region": "Asyut", "sex": "female", "age": 30, "country": "Egypt", "marital_status": "married", "education": "higher", "social_class": "working class"}, "question": {"id": "Q2", "variant": 0}, "response": ["Based on the anthropological framework, as a married female from Asyut, Egypt, my emic perspective would emphasize the importance of kinship networks and community relationships. In Egyptian culture, friendships are often closely tied to family and community, and maintaining strong social connections is highly valued. Additionally, my individual values and personal experience lead me to believe that friends play a vital role in providing support and companionship. Considering my working-class background and the cultural context of Asyut, where social ties are crucial for everyday life, I would argue that friends are very important in life.\n\n1"]}, {"persona": {"region": "Asyut", "sex": "female", "age": 42, "country": "Egypt", "marital_status": "married", "education": "higher", "social_class": "lower middle class"}, "question": {"id": "Q2", "variant": 0}, "response": ["Based on my cultural context as a married female from Asyut, Egypt, friends play a crucial role in my life. In our society, kinship networks and social connections are highly valued, and friends often serve as an extension of the family. Additionally, my individual values and personal experience have shown me the importance of having a strong support system outside of my immediate family. As a lower middle class woman who has completed higher education, I have learned the value of friendship in navigating the challenges of life and finding opportunities for personal growth. Therefore, I believe that friends are very important in life.\n\n1"]}, {"persona": {"region": "Sohag", "sex": "male", "age": 63, "country": "Egypt", "marital_status": "married", "education": "middle", "social_class": "lower middle class"}, "question": {"id": "Q2", "variant": 0}, "response": ["From an anthropological perspective, it is important to consider the cultural context, individual values, and socioeconomic background in understanding the importance of friends in life. In Sohag, Egypt, community and social connections play a significant role in daily life. As a lower-middle-class married male who has completed middle education at the age of 63, my personal experience and values lead me to believe that friends are rather important in life. The cultural context of Egypt values social connections and support networks, and my socioeconomic background has also influenced this belief. Therefore, I choose option 2) Rather important."]}, {"persona": {"region": "Sohag", "sex": "male", "age": 27, "country": "Egypt", "marital_status": "married", "education": "middle", "social_class": "working class"}, "question": {"id": "Q2", "variant": 0}, "response": ["From my perspective as a married male from Sohag, Egypt, with a middle education level and part of the working class, I understand the importance of friends in life within the cultural context of my community. In Sohag, strong kinship networks and community support are highly valued, and friends play a crucial role in providing social and emotional support. Additionally, my individual values and personal experience have shown me the significance of friendship in navigating life's challenges, especially in a socioeconomic context where access to resources and opportunities may be limited. Therefore, based on my understanding of the emic perspective, cultural context, individual values, and socioeconomic background, I choose the following option:\n\n2"]}, {"persona": {"region": "Sohag", "sex": "male", "age": 56, "country": "Egypt", "marital_status": "married", "education": "higher", "social_class": "upper middle class"}, "question": {"id": "Q2", "variant": 0}, "response": ["Based on the anthropological framework, my personal experience and cultural context play a significant role in shaping my perspective. As a married male from Sohag, Egypt, I come from a culture that places high value on community and social connections. My socioeconomic background as part of the upper middle class also means that I have the resources and social networks to maintain strong friendships. Additionally, at 56 years of age, I have likely developed long-lasting friendships that have become an integral part of my life. Therefore, based on my cultural context, personal experience, and socioeconomic status, I believe that friends are very important in life.\n\n1"]}, {"persona": {"region": "Sohag", "sex": "male", "age": 51, "country": "Egypt", "marital_status": "married", "education": "higher", "social_class": "lower middle class"}, "question": {"id": "Q2", "variant": 0}, "response": ["Based on the anthropological framework, as a married male from Sohag, Egypt, with a lower middle-class socioeconomic background, the importance of friends in life is viewed through the lens of cultural context, individual values, and personal experience. In Egyptian culture, friendships are highly valued, and social connections play a significant role in everyday life. As a 51-year-old with higher education, I have likely formed strong bonds with friends over the years, and my personal experience tells me that friends provide support, companionship, and a sense of belonging. Additionally, my lower middle-class background may have instilled in me the value of community and solidarity, making friends particularly important for social and emotional well-being.\n\n2"]}, {"persona": {"region": "Sohag", "sex": "female", "age": 26, "country": "Egypt", "marital_status": "married", "education": "higher", "social_class": "working class"}, "question": {"id": "Q2", "variant": 0}, "response": ["From an anthropological perspective, as a married female from Sohag, Egypt, my understanding of the importance of friends in life is influenced by my cultural context, individual values, and socioeconomic background. In Sohag, social relationships and connections are highly valued, and friendships play a crucial role in providing support and companionship. As a working-class individual, my personal experience has shown me the importance of relying on friends for emotional and practical support in times of need. Additionally, cultural relativism teaches me to recognize the significance of friendships within the broader societal context. Therefore, based on my background and understanding, I would say that friends are (2) rather important."]}, {"persona": {"region": "Sohag", "sex": "female", "age": 29, "country": "Egypt", "marital_status": "married", "education": "higher", "social_class": "upper middle class"}, "question": {"id": "Q2", "variant": 0}, "response": ["Based on my emic perspective as a married female from Sohag, Egypt, I understand the importance of friends in the context of my cultural context. In my community, friendship is highly valued, and it is considered an integral part of social life. The cultural relativism I have been brought up with has taught me that relationships and friendships are crucial for emotional support, networking, and socializing. My individual values and personal experiences have also shown me the significance of friendships in enhancing my overall well-being and happiness. Additionally, my socioeconomic background as part of the upper middle class has allowed me to have the resources and opportunities to cultivate and maintain strong friendships. Therefore, based on my nuanced understanding of the question and my cultural context, I believe that friends are very important in life.\n\n1"]}, {"persona": {"region": "Sohag", "sex": "male", "age": 51, "country": "Egypt", "marital_status": "married", "education": "middle", "social_class": "lower middle class"}, "question": {"id": "Q2", "variant": 0}, "response": ["From the perspective of a married male from Sohag, Egypt, who is 51 years old and identifies as part of the lower middle class, the importance of friends in life is heavily influenced by cultural context and individual values. In Sohag, social networks and kinship ties are crucial for emotional support, practical assistance, and maintaining social cohesion. As a middle-aged man in this cultural context, my personal experience and values also play a significant role in shaping my perception of the importance of friends. Given my socioeconomic background and age, I would consider friends to be rather important in life.\n\n2"]}, {"persona": {"region": "Qena", "sex": "male", "age": 32, "country": "Egypt", "marital_status": "single", "education": "middle", "social_class": "working class"}, "question": {"id": "Q2", "variant": 0}, "response": ["Based on the anthropological framework, my perspective as a single male from Qena, Egypt, is heavily influenced by my cultural context, socioeconomic background, and personal experience. In my community, friendships are a significant aspect of life and are valued as a support system, especially for individuals in the working class. Additionally, my age and social status also play a role in how I perceive the importance of friends. Therefore, based on my personal experience and cultural context, I would say that friendships are rather important in life.\n\n2"]}, {"persona": {"region": "Qena", "sex": "male", "age": 54, "country": "Egypt", "marital_status": "married", "education": "middle", "social_class": "lower middle class"}, "question": {"id": "Q2", "variant": 0}, "response": ["From the perspective of a married male from Qena, Egypt, age 54, with a middle education level and lower middle class background, the importance of friends in life is shaped by cultural context, individual values, and socioeconomic background. In Qena, community and social ties are highly valued, and friends often serve as a support network in various aspects of life, including emotional, financial, and practical support. Additionally, in a lower middle class context, where resources may be limited, the reliance on friends for assistance and solidarity may be even more significant. Personal experience also plays a role, as this individual may have experienced the importance of friends firsthand in navigating life's challenges. Considering this, the answer chosen reflects the understanding of the significance of friendships in this specific cultural and socioeconomic context.\n\n2"]}, {"persona": {"region": "Qena", "sex": "male", "age": 25, "country": "Egypt", "marital_status": "single", "education": "lower", "social_class": "lower class"}, "question": {"id": "Q2", "variant": 0}, "response": ["Based on my emic perspective as a single male from Qena, Egypt, friends are very important in life as they provide social support and companionship in a community-oriented culture. In my cultural context, friendships are highly valued and play a crucial role in my daily life. Additionally, my lower socioeconomic background means that friendships are even more important for emotional support and resource-sharing. My individual values and personal experience also lead me to believe that friends are integral to my well-being and happiness. Therefore, based on my nuanced understanding of the question and my cultural and socioeconomic background, I choose option 1: Very important."]}, {"persona": {"region": "Aswan", "sex": "male", "age": 34, "country": "Egypt", "marital_status": "single", "education": "middle", "social_class": "lower class"}, "question": {"id": "Q2", "variant": 0}, "response": ["From the emic perspective, as a single male from Aswan, Egypt, social relationships and networks hold great significance. The cultural context of Aswan emphasizes strong community ties and the importance of communal support. As an individual from the lower class, friends play a crucial role in providing emotional and practical support in navigating the challenges of daily life. Additionally, personal experience and individual values also contribute to the importance of friends, as they provide a sense of belonging and camaraderie. Socioeconomic background also plays a role, as friends can serve as a support system in times of need. Taking into account the nuanced phrasing of the question and the cultural context, I would choose option (1) Very important. \n\n1"]}, {"persona": {"region": "Aswan", "sex": "female", "age": 31, "country": "Egypt", "marital_status": "married", "education": "middle", "social_class": "lower middle class"}, "question": {"id": "Q2", "variant": 0}, "response": ["Based on the cultural context of Aswan, Egypt, and the lower middle class background of the persona, friends play a crucial role in providing support and companionship in a community-oriented society. Individual values and personal experiences also highlight the importance of friends in providing emotional support and social connections, especially for married women who may rely on friends for solidarity and advice. Additionally, the nuanced phrasing of the question and the emphasis on the importance of social relationships in Egyptian culture further reinforces the significance of friends in this context.\n\n1"]}, {"persona": {"region": "Aswan", "sex": "female", "age": 39, "country": "Egypt", "marital_status": "married", "education": "middle", "social_class": "working class"}, "question": {"id": "Q2", "variant": 0}, "response": ["From the perspective of a married female from Aswan, Egypt, who is 39 years old, has completed middle education, and considers herself part of the working class, it is important to consider the cultural context and individual values when answering this question. In Aswan, community and social connections are highly valued, and friendships play a crucial role in providing support and companionship. Additionally, the socioeconomic background of being part of the working class may mean that friendships are especially important for mutual aid and solidarity. Personal experience and individual values also play a significant role, and in this case, the persona may value friendships as a source of emotional support and social connection. Therefore, the answer chosen would reflect these considerations.\n\n2"]}, {"persona": {"region": "Qena", "sex": "female", "age": 27, "country": "Egypt", "marital_status": "married", "education": "lower", "social_class": "lower middle class"}, "question": {"id": "Q2", "variant": 0}, "response": ["From the perspective of a married female from Qena, Egypt, who is 27 years old, has a lower education level, and considers herself part of the lower middle class, several factors come into play when considering the importance of friends in life. From an emic perspective, friends are crucial for emotional support and socializing, especially in a community-oriented society such as Qena. The cultural context of Egypt also places a high value on friendships and social connections, making them an integral part of everyday life. Additionally, the individual values and personal experience of this persona may lead her to prioritize friendships as a source of support and companionship, especially given her socioeconomic background. Furthermore, the nuanced phrasing of the question may also influence her response, as she may perceive friends as essential for navigating the challenges of her social and economic environment. \n\n2"]}, {"persona": {"region": "Qena", "sex": "male", "age": 40, "country": "Egypt", "marital_status": "single", "education": "middle", "social_class": "lower middle class"}, "question": {"id": "Q2", "variant": 0}, "response": ["From an anthropological perspective, the importance of friends in life is heavily influenced by cultural context, individual values and personal experience, and socioeconomic background. In Qena, Egypt, social relationships and community ties are deeply valued, and friendships play a crucial role in providing support, companionship, and a sense of belonging. As a single male from the lower middle class, my personal experience and socioeconomic background have shaped my understanding of the significance of friends in my life. Given the emphasis on community and social connections in Qena, I would consider friends to be rather important in my life, providing me with a support system and social interaction that is essential for my well-being and happiness.\n\n2"]}, {"persona": {"region": "Qena", "sex": "male", "age": 30, "country": "Egypt", "marital_status": "single", "education": "middle", "social_class": "working class"}, "question": {"id": "Q2", "variant": 0}, "response": ["Based on the anthropological framework, my emic perspective as a single male from Qena, Egypt, is heavily influenced by my cultural context, individual values, and socioeconomic background. In my community, friendship and kinship networks are a crucial part of daily life, providing support, companionship, and a sense of belonging. Additionally, as a member of the working class, I rely on my friends for social connections and potential opportunities for advancement. Furthermore, my personal experience has shown me the importance of friends in navigating life's challenges and celebrating its joys. Therefore, I would say that friends are very important in life.\n\n1"]}]