[{"persona": {"region": "Fayoum", "sex": "male", "age": 46, "country": "Egypt", "marital_status": "married", "education": "higher", "social_class": "lower middle class"}, "question": {"id": "Q63", "variant": 0}, "response": ["Based on the anthropological framework, as a married male from Fayoum, Egypt, with a lower middle class socioeconomic background, my perspective on trusting people of another nationality would be influenced by my cultural context, individual values, and personal experience. In Egypt, there is a strong sense of community and trust within the in-group, but there may be some skepticism or wariness of outsiders due to historical and geopolitical factors. Additionally, my personal experience and values may lead me to trust somewhat, but not completely, as I have been taught to be cautious and discerning when interacting with individuals from other nationalities. Therefore, my answer would be (2) Trust somewhat."]}, {"persona": {"region": "Fayoum", "sex": "female", "age": 30, "country": "Egypt", "marital_status": "married", "education": "middle", "social_class": "lower middle class"}, "question": {"id": "Q63", "variant": 0}, "response": ["Based on the anthropological framework, my perspective as a married female from Fayoum, Egypt, who is 30 years old and part of the lower middle class, is shaped by my cultural context, individual values, and personal experiences. In Egypt, there is a strong sense of national pride and loyalty, which influences my perspective on trusting people of another nationality. Additionally, my socioeconomic background may impact my interactions with individuals of different nationalities. As a result, I would choose option (2) Trust somewhat, as I may have had positive experiences with people from other nationalities but also have some reservations due to cultural differences and personal experiences. \n\n2"]}, {"persona": {"region": "Fayoum", "sex": "male", "age": 60, "country": "Egypt", "marital_status": "married", "education": "higher", "social_class": "working class"}, "question": {"id": "Q63", "variant": 0}, "response": ["Based on the anthropological framework, my perspective as a married male from Fayoum, Egypt, who is 60 years old, completed higher education, and considers myself part of the working class is influenced by my cultural context, individual values, and socioeconomic background. Coming from Egypt, a country with a rich history and diverse cultural context, I have learned to appreciate and respect people from other nationalities. Additionally, my higher education has taught me to be open-minded and considerate of others, regardless of their nationality. As a member of the working class, I understand the value of cooperation and trust in a globalized world. Therefore, I would choose option 2: Trust somewhat. \n\n2"]}, {"persona": {"region": "Fayoum", "sex": "male", "age": 20, "country": "Egypt", "marital_status": "single", "education": "middle", "social_class": "lower middle class"}, "question": {"id": "Q63", "variant": 0}, "response": ["Based on the anthropological framework, as a single male from Fayoum, Egypt, my emic perspective would be influenced by my cultural context, individual values, and socioeconomic background. In Egyptian culture, there is a strong sense of community and trust, especially within the local community. However, there may be some skepticism towards people of another nationality due to historical and political factors. Additionally, my lower middle class background may influence my perception of trust, as individuals from this socioeconomic background may have limited exposure to people of other nationalities and may have experienced economic competition. Taking into account these factors, I would choose option (2) Trust somewhat as my answer.\n\n2"]}, {"persona": {"region": "Fayoum", "sex": "female", "age": 39, "country": "Egypt", "marital_status": "married", "education": "higher", "social_class": "lower middle class"}, "question": {"id": "Q63", "variant": 0}, "response": ["In considering the question of how much I trust people of another nationality, I must first take into account my cultural context as a married female from Fayoum, Egypt. My personal experiences and values, as well as my socioeconomic background, all influence my perspective. Additionally, the concept of cultural relativism reminds me that there is no hierarchy of cultures and that my viewpoint is shaped by my own specific circumstances. As a member of the lower middle class in Egypt, my interactions with people from other nationalities may be limited, and my trust may be influenced by the historical and cultural context of interactions between Egypt and other nations. Therefore, my response is based on my own subjective understanding of trust and my specific experiences as a 39-year-old woman with a higher education level from Fayoum, Egypt.\n\n2"]}, {"persona": {"region": "Fayoum", "sex": "male", "age": 33, "country": "Egypt", "marital_status": "married", "education": "higher", "social_class": "working class"}, "question": {"id": "Q63", "variant": 0}, "response": ["Based on the anthropological framework, as a married male from Fayoum, Egypt, my emic perspective on trust towards people of another nationality is influenced by my cultural context, individual values, and socioeconomic background. My cultural context and personal experience have shaped my perception of trust, and as a member of the working class in Egypt, I have learned to be cautious and discerning when interacting with people from other nationalities. Additionally, cultural relativism and nuance play a role in my understanding of trust, as my age and place also factor into my perspective. Therefore, I would choose:\n\n2"]}, {"persona": {"region": "Port Said", "sex": "female", "age": 45, "country": "Egypt", "marital_status": "married", "education": "higher", "social_class": "lower middle class"}, "question": {"id": "Q63", "variant": 0}, "response": ["Based on my emic perspective as a married woman from Port Said, Egypt, I have been raised to value trust and respect for others, regardless of their nationality. The cultural context of my upbringing has taught me to appreciate diversity and to understand the importance of building strong relationships with people from all walks of life. Additionally, my individual values and personal experiences have shaped my belief in the inherent goodness of people, regardless of their nationality. Although my lower middle-class socioeconomic background may have presented challenges, it has also instilled in me a sense of empathy and understanding towards others. Therefore, based on my nuanced understanding of trust and cultural relativism, I would choose option (2) Trust somewhat. \n\n2"]}, {"persona": {"region": "Port Said", "sex": "male", "age": 42, "country": "Egypt", "marital_status": "married", "education": "middle", "social_class": "lower middle class"}, "question": {"id": "Q63", "variant": 0}, "response": ["Based on the anthropological framework, my emic perspective as a married male from Port Said, Egypt, with a lower middle-class socioeconomic background and middle education level, leads me to consider the cultural context, individual values, and personal experience in my response. In the cultural context of Egypt, there is a strong emphasis on hospitality and trust within the community, but there may be some skepticism towards people of another nationality due to historical and geopolitical factors. Additionally, my personal experience and values may lead me to trust people of another nationality somewhat, as I have had positive interactions with individuals from different nationalities in my community. Therefore, I would choose option (2) Trust somewhat. Thank you for considering my perspective.\n\n2"]}, {"persona": {"region": "Port Said", "sex": "male", "age": 28, "country": "Egypt", "marital_status": "single", "education": "middle", "social_class": "lower middle class"}, "question": {"id": "Q63", "variant": 0}, "response": ["Based on my emic perspective as a single male from Port Said, Egypt, I have grown up in a culturally diverse environment where I have been exposed to people of different nationalities. The cultural context of my upbringing has taught me to value hospitality and openness to others, regardless of their nationality. Additionally, my individual values and personal experiences have shaped my perception of trust towards people of other nationalities. Despite my lower middle class socioeconomic background and limited education, I have learned to value and respect people from different backgrounds. Therefore, I trust somewhat people of another nationality because of my experiences and cultural context.\n\n2"]}, {"persona": {"region": "Port Said", "sex": "female", "age": 30, "country": "Egypt", "marital_status": "married", "education": "higher", "social_class": "lower middle class"}, "question": {"id": "Q63", "variant": 0}, "response": ["Based on the anthropological framework, my emic perspective as a married female from Port Said, Egypt, would be influenced by my cultural context, individual values, and socioeconomic background. In Egyptian society, there is a strong emphasis on trust and loyalty within the community, but there may be some skepticism towards people of another nationality due to historical and geopolitical factors. Additionally, my lower middle-class socioeconomic background may lead me to be cautious in trusting people of another nationality, as there may be concerns about economic competition or cultural differences. Therefore, I would be more inclined to select option (2) Trust somewhat, as my background and cultural context would influence a level of caution in trusting people of another nationality. \n\n2"]}, {"persona": {"region": "Port Said", "sex": "male", "age": 30, "country": "Egypt", "marital_status": "divorced", "education": "middle", "social_class": "lower middle class"}, "question": {"id": "Q63", "variant": 0}, "response": ["Based on the anthropological framework, as a divorced male from Port Said, Egypt, I would answer this question based on my cultural context, individual values and personal experience, and socioeconomic background. In my cultural context, I have been raised to be wary of people from other nationalities due to historical and political tensions. Additionally, my personal experience, as someone from the lower middle class, has taught me to be cautious of those who may have more privilege or power than I do. Therefore, I would choose option 2, trusting somewhat, as I believe in giving people a chance but also being cautious in my interactions with those from other nationalities. \n\n2"]}, {"persona": {"region": "Port Said", "sex": "female", "age": 19, "country": "Egypt", "marital_status": "single", "education": "middle", "social_class": "lower middle class"}, "question": {"id": "Q63", "variant": 0}, "response": ["Based on the anthropological framework, my emic perspective as a single female from Port Said, Egypt, would be influenced by my cultural context, individual values, and socioeconomic background. Growing up in a lower middle class environment, I have been taught to be cautious and to trust somewhat in order to protect myself. Additionally, my cultural relativism and understanding of space and time would also play a role in shaping my response. Therefore, I would choose option (2) Trust somewhat. \n\n2"]}, {"persona": {"region": "Fayoum", "sex": "male", "age": 40, "country": "Egypt", "marital_status": "married", "education": "middle", "social_class": "working class"}, "question": {"id": "Q63", "variant": 0}, "response": ["Based on the anthropological framework, as a married male from Fayoum, Egypt, who is 40 years old, completed middle education, and considers himself part of the working class, my perspective on trusting people of another nationality is influenced by a combination of my cultural context, individual values and personal experience, and socioeconomic background. My cultural context and personal experience have likely shaped my interactions with people of other nationalities, and my socioeconomic background may also influence my level of trust. Additionally, the concept of cultural relativism reminds me that there is no hierarchy of culture, so I should not automatically distrust people of another nationality. Therefore, my chosen answer is option (2) Trust somewhat. \n\n2"]}, {"persona": {"region": "Fayoum", "sex": "male", "age": 23, "country": "Egypt", "marital_status": "single", "education": "higher", "social_class": "lower middle class"}, "question": {"id": "Q63", "variant": 0}, "response": ["Based on the anthropological framework, as a single male from Fayoum, Egypt, my emic perspective is influenced by my cultural context, individual values, and socioeconomic background. Being raised in a lower middle-class family in Egypt, I have been taught to approach people from other nationalities with caution and skepticism. This stems from the historical and political tensions between Egypt and other nations, as well as the economic disparities that exist. Additionally, my personal experiences and the experiences of those around me have shaped my perception of people from other nationalities. Therefore, I would choose option 3: Do not trust very much."]}, {"persona": {"region": "Fayoum", "sex": "female", "age": 38, "country": "Egypt", "marital_status": "married", "education": "middle", "social_class": "lower middle class"}, "question": {"id": "Q63", "variant": 0}, "response": ["Based on my emic perspective as a married female from Fayoum, Egypt, my cultural context, individual values, and personal experience all play a significant role in shaping my views. As part of the lower middle class in Egypt, I have limited exposure to people of other nationalities and my trust in them may be influenced by the socioeconomic background and cultural relativism. Additionally, my age and place of residence in Fayoum, Egypt, also impact my understanding of people from other nationalities. Therefore, based on these factors, I would choose option (2) Trust somewhat."]}, {"persona": {"region": "Fayoum", "sex": "male", "age": 32, "country": "Egypt", "marital_status": "married", "education": "middle", "social_class": "lower middle class"}, "question": {"id": "Q63", "variant": 0}, "response": ["Based on my emic perspective as a married male from Fayoum, Egypt, my cultural context and individual values play a major role in determining my level of trust towards people of another nationality. Growing up in a lower middle class family and completing only middle education, I have been exposed to limited cultural diversity and have not had the opportunity to interact with people from other nationalities extensively. My socioeconomic background also influences my perceptions, as my access to resources and exposure to different cultures has been limited. Additionally, cultural relativism is important to consider as my understanding of trust towards people of another nationality may differ from someone with a different cultural background. Thus, my nuanced understanding of trust towards people of another nationality is shaped by these factors, and I choose option (2) Trust somewhat. \n\n2"]}, {"persona": {"region": "Fayoum", "sex": "male", "age": 31, "country": "Egypt", "marital_status": "married", "education": "higher", "social_class": "working class"}, "question": {"id": "Q63", "variant": 0}, "response": ["In considering how a married male from Fayoum, Egypt, with a higher education and working-class background would approach the question of how much he trusts people of another nationality, we must first acknowledge the cultural context. Egypt has a long history of interaction with people from various nationalities due to its strategic location and rich cultural heritage. The individual values and personal experiences of this persona may also play a significant role in shaping his perspective. Additionally, his socioeconomic background as part of the working class may also influence his level of trust towards people of another nationality. Furthermore, cultural relativism and the nuanced phrasing of the question are important to consider. Given these factors, the persona may likely choose option (2) Trust somewhat. \n\n2"]}, {"persona": {"region": "Fayoum", "sex": "male", "age": 31, "country": "Egypt", "marital_status": "married", "education": "middle", "social_class": "lower middle class"}, "question": {"id": "Q63", "variant": 0}, "response": ["Based on my emic perspective as a married male from Fayoum, Egypt, I understand the importance of cultural context and individual values in shaping my understanding of trust towards people of another nationality. My personal experience and socioeconomic background have influenced my perception, as I have limited exposure to individuals of other nationalities due to my lower middle class status and middle education level. Additionally, cultural relativism reminds me that my perspective is not inherently better or worse than others, but simply shaped by my own circumstances. Therefore, I would choose option (2) Trust somewhat, as my limited exposure and personal values lead me to approach interactions with people of another nationality with caution. \n\n2"]}, {"persona": {"region": "Fayoum", "sex": "female", "age": 32, "country": "Egypt", "marital_status": "married", "education": "middle", "social_class": "lower middle class"}, "question": {"id": "Q63", "variant": 0}, "response": ["Based on the anthropological framework, as a married female from Fayoum, Egypt, my emic perspective is influenced by my cultural context, individual values, socioeconomic background, and space and time. In Egyptian culture, trust and loyalty are highly valued, and as a member of the lower middle class, I have likely had limited exposure to people of other nationalities. This, combined with my middle education level, may lead me to have a more cautious approach to trusting people of another nationality. Additionally, my age and place of residence may also influence my level of trust, as I may have been exposed to certain societal and cultural messages about people from other nationalities. Therefore, my answer to the question \"How much do you trust people of another nationality?\" would be (2) Trust somewhat. \n\n2"]}, {"persona": {"region": "Ismailia", "sex": "male", "age": 53, "country": "Egypt", "marital_status": "married", "education": "middle", "social_class": "lower middle class"}, "question": {"id": "Q63", "variant": 0}, "response": ["Based on my cultural context as a married male from Ismailia, Egypt, my understanding of trust towards people of another nationality is influenced by my emic perspective. As part of the lower middle class and having completed middle education, my individual values and personal experience play a significant role in shaping my perception. Additionally, cultural relativism is important in understanding that there is no hierarchy of cultures, and space and time also factor into my response. Given these considerations, my answer is:\n\n2) Trust somewhat"]}, {"persona": {"region": "Ismailia", "sex": "male", "age": 38, "country": "Egypt", "marital_status": "married", "education": "higher", "social_class": "working class"}, "question": {"id": "Q63", "variant": 0}, "response": ["From the perspective of a married male from Ismailia, Egypt, who is 38 years old, has completed higher education, and considers himself part of the working class, the cultural context is pivotal in understanding and answering this question. Egypt has a diverse cultural landscape, and people from different nationalities may have different belief systems and values. Additionally, the socioeconomic background of the persona plays a role in this answer, as individuals from the working class may have different experiences and interactions with people from other nationalities compared to those from higher socioeconomic backgrounds. Trust may be influenced by personal experiences and individual values, as well as the nuanced phrasing of the question. Therefore, the chosen answer is:\n\n2) Trust somewhat"]}, {"persona": {"region": "Ismailia", "sex": "female", "age": 35, "country": "Egypt", "marital_status": "married", "education": "middle", "social_class": "lower middle class"}, "question": {"id": "Q63", "variant": 0}, "response": ["In considering the question of how much I trust people of another nationality, I must take into account my emic and etic perspectives as a married female from Ismailia, Egypt. My cultural context and individual values and personal experience play a significant role in shaping my understanding of this question. As someone from a lower middle class background with a middle education level, I am aware of the socioeconomic factors that influence my perceptions. Additionally, the concept of cultural relativism is important to me, as I believe that no culture is better than another. Considering all these factors, I would choose option (2) Trust somewhat. This is because I believe in giving others the benefit of the doubt, but I also recognize the importance of being cautious when interacting with people from different nationalities."]}, {"persona": {"region": "Ismailia", "sex": "female", "age": 57, "country": "Egypt", "marital_status": "married", "education": "lower", "social_class": "working class"}, "question": {"id": "Q63", "variant": 0}, "response": ["Based on the anthropological framework, my perspective as a married female from Ismailia, Egypt, who is 57 years old, with a lower education level and part of the working class, is heavily influenced by cultural context, individual values, and personal experience. In my cultural context, there may be a tendency to trust people of another nationality somewhat, as Egypt has a history of being open to different nationalities and cultures due to its strategic location. My personal experience and individual values also play a role, as I have likely interacted with people from different nationalities in my community and workplace, leading me to have a moderate level of trust. Additionally, as a member of the working class, I understand the importance of cooperation and trust in international business dealings and interactions. Therefore, my perspective is influenced by these factors, leading me to choose option (2) Trust somewhat. \n\n2"]}, {"persona": {"region": "Ismailia", "sex": "male", "age": 33, "country": "Egypt", "marital_status": "married", "education": "middle", "social_class": "lower middle class"}, "question": {"id": "Q63", "variant": 0}, "response": ["Based on my cultural context, as a married male from Ismailia, Egypt, my trust in people of another nationality is influenced by my emic perspective, individual values, and personal experience. As a member of the lower middle class, my socioeconomic background also plays a role in shaping my perceptions. Additionally, the cultural relativism of my community emphasizes the importance of trust and mutual respect. Considering all these factors, I would choose option (2) Trust somewhat, as my personal experience and cultural context lead me to approach interactions with people of other nationalities with cautious optimism. \n\n2"]}, {"persona": {"region": "Ismailia", "sex": "female", "age": 49, "country": "Egypt", "marital_status": "single", "education": "higher", "social_class": "upper middle class"}, "question": {"id": "Q63", "variant": 0}, "response": ["Based on the anthropological framework, as a single female from Ismailia, Egypt, my emic perspective would be influenced by my cultural context, individual values, and socioeconomic background. In Egyptian culture, there is a strong emphasis on hospitality and trust within the community, but there may also be some level of skepticism towards people of other nationalities, especially in light of global political tensions. My higher education level and upper middle class status may contribute to a broader worldview and an understanding of the importance of global connections. I would trust somewhat, recognizing the importance of building relationships with people from other nationalities, but also acknowledging the need for caution in certain situations.\n\n2"]}, {"persona": {"region": "Ismailia", "sex": "female", "age": 35, "country": "Egypt", "marital_status": "married", "education": "higher", "social_class": "lower middle class"}, "question": {"id": "Q63", "variant": 0}, "response": ["Based on my emic perspective as a married female from Ismailia, Egypt, I have been raised to trust people of other nationalities somewhat. I have interacted with a diverse range of people in my community and have learned to appreciate the value of different cultures and backgrounds. My cultural context, individual values, and personal experiences have shaped my understanding of the importance of trust and cooperation with individuals from other nationalities. Additionally, my socioeconomic background as part of the lower middle class has influenced my belief in the importance of establishing connections and relationships with people from various backgrounds in order to thrive in a globalized world. Therefore, I choose option 2: Trust somewhat."]}, {"persona": {"region": "Ismailia", "sex": "male", "age": 24, "country": "Egypt", "marital_status": "single", "education": "higher", "social_class": "upper middle class"}, "question": {"id": "Q63", "variant": 0}, "response": ["Based on the anthropological framework, my emic perspective as a single male from Ismailia, Egypt, with a higher education level and belonging to the upper middle class, would lead me to consider the cultural context, individual values, and socioeconomic background in answering this question. In my cultural context, there is a strong emphasis on hospitality and respect for others, which would lead me to trust people of another nationality to some extent. Additionally, my higher education level has exposed me to diverse perspectives and taught me to be open-minded and tolerant of different cultures. As part of the upper middle class, I have had more opportunities for international travel and interaction with people from other nationalities, further influencing my level of trust. Therefore, I would choose option (2) Trust somewhat.\n\n2"]}, {"persona": {"region": "Ismailia", "sex": "female", "age": 23, "country": "Egypt", "marital_status": "single", "education": "higher", "social_class": "lower middle class"}, "question": {"id": "Q63", "variant": 0}, "response": ["Based on the anthropological framework, my emic perspective as a single female from Ismailia, Egypt, would play a significant role in answering the question of how much I trust people of another nationality. My cultural context, individual values, and personal experiences as a lower middle class individual from Egypt would lead me to consider the historical and geopolitical relationships between Egypt and other nationalities. My socioeconomic background would also influence my trust levels, as I may have had limited exposure to individuals from other nationalities due to financial constraints. Additionally, my age and education level would contribute to my understanding of the world and my ability to interact with people from other nationalities. Therefore, based on my perspective, I would choose option 2) Trust somewhat."]}, {"persona": {"region": "Ismailia", "sex": "male", "age": 55, "country": "Egypt", "marital_status": "married", "education": "middle", "social_class": "lower middle class"}, "question": {"id": "Q63", "variant": 0}, "response": ["Based on the anthropological framework, my perspective as a married male from Ismailia, Egypt, with a lower middle-class socioeconomic background, is influenced by my cultural context, individual values, and personal experience. The emic perspective within my community may lead me to trust people of another nationality somewhat, as I may have had positive interactions with individuals from other nationalities in the past. However, the etic perspective may lead me to be cautious and not trust very much, as I may have experienced economic challenges and competition for resources with individuals from other nationalities. Additionally, cultural relativism plays a role in my perspective, as I understand that people from different nationalities may have different cultural norms and values that may not align with my own, leading to a nuanced understanding of trust. \n\n2"]}, {"persona": {"region": "Ismailia", "sex": "male", "age": 57, "country": "Egypt", "marital_status": "married", "education": "middle", "social_class": "upper middle class"}, "question": {"id": "Q63", "variant": 0}, "response": ["Based on my personal experience and cultural context, as a married male from Ismailia, Egypt, I have been brought up to value trust and respect for others, regardless of their nationality. In my community, there is a strong emphasis on hospitality and welcoming others, so I have learned to trust people from different nationalities to a certain extent. Additionally, being part of the upper middle class has afforded me the opportunity to interact with people from various backgrounds, further influencing my perspective. Therefore, I would choose option (2) Trust somewhat. \n\n2"]}, {"persona": {"region": "Ismailia", "sex": "female", "age": 29, "country": "Egypt", "marital_status": "married", "education": "middle", "social_class": "upper middle class"}, "question": {"id": "Q63", "variant": 0}, "response": ["Based on the anthropological framework, my emic perspective as a married female from Ismailia, Egypt, leads me to consider the cultural context, individual values, and socioeconomic background in my response. In my cultural context, there is a strong emphasis on hospitality and respect for others, which influences my personal values and experience. Additionally, being part of the upper middle class, I have had the opportunity to interact with people from different nationalities and have generally had positive experiences. Therefore, I would trust people of another nationality somewhat, as I believe in giving others the benefit of the doubt and approaching interactions with an open mind.\n\n2"]}, {"persona": {"region": "Damiatta", "sex": "female", "age": 46, "country": "Egypt", "marital_status": "married", "education": "middle", "social_class": "lower middle class"}, "question": {"id": "Q63", "variant": 0}, "response": ["Based on my cultural context and individual values, I would answer this question from the perspective of a married female from Damiatta, Egypt. Being from a lower middle-class background, my socioeconomic background plays a significant role in shaping my perceptions. Additionally, my age and space contribute to my understanding of the world. Furthermore, cultural relativism is a key factor in my response, as I have been taught to understand and value different cultures. Therefore, I would choose the option:\n\n2) Trust somewhat"]}, {"persona": {"region": "Damiatta", "sex": "female", "age": 20, "country": "Egypt", "marital_status": "single", "education": "middle", "social_class": "lower middle class"}, "question": {"id": "Q63", "variant": 0}, "response": ["Based on my personal experience and cultural context, as a single female from Damiatta, Egypt, I have had limited interactions with people of other nationalities. However, I have been taught to be cautious and not trust people from other nationalities completely, as there may be cultural and language barriers that could lead to misunderstandings. Additionally, my lower middle class socioeconomic background has taught me to be wary of others who may not understand or respect my financial situation. Therefore, I would choose option (2) Trust somewhat, as I believe in being cautious and building trust slowly with people from other nationalities."]}, {"persona": {"region": "Damiatta", "sex": "male", "age": 19, "country": "Egypt", "marital_status": "single", "education": "middle", "social_class": "lower middle class"}, "question": {"id": "Q63", "variant": 0}, "response": ["Based on the anthropological framework, my emic perspective as a young man from Damiatta, Egypt, leads me to consider the cultural context, individual values, socioeconomic background, and space and time in my answer to this question. In my cultural context, there is a strong emphasis on community and hospitality, so I am inclined to trust people of other nationalities to some extent. However, my lower middle-class socioeconomic background and limited education may also lead me to be cautious in trusting completely, as I have had limited exposure to people from other nationalities and may have heard negative stereotypes. Additionally, as a 19-year-old, I may also have a more idealistic view of trust in general. Therefore, I would choose option (2) Trust somewhat.\n\n2"]}, {"persona": {"region": "Damiatta", "sex": "female", "age": 33, "country": "Egypt", "marital_status": "married", "education": "higher", "social_class": "lower middle class"}, "question": {"id": "Q63", "variant": 0}, "response": ["Based on the anthropological framework, my emic perspective as a married female from Damiatta, Egypt, is influenced by my cultural context, individual values, and socioeconomic background. In Egypt, there is a strong sense of community and trust within my own nationality, and I have been taught to be cautious of outsiders. Additionally, as a lower middle class woman who has completed higher education, I am aware of the socioeconomic disparities that exist globally, which may affect my level of trust towards people of another nationality. Therefore, considering these factors, I would choose option (2) Trust somewhat. \n\n2"]}, {"persona": {"region": "Damiatta", "sex": "male", "age": 24, "country": "Egypt", "marital_status": "single", "education": "higher", "social_class": "lower middle class"}, "question": {"id": "Q63", "variant": 0}, "response": ["Based on my emic perspective as a single male from Damiatta, Egypt, I have grown up with a strong sense of community and trust within my own nationality. However, I have also been exposed to diverse viewpoints and experiences through my higher education and have developed a more open-minded approach. My cultural context, individual values, and personal experiences have played a significant role in shaping my perception of people from other nationalities. Additionally, my socioeconomic background as part of the lower middle class has instilled in me a sense of pragmatism and caution. Therefore, I trust somewhat people of another nationality, as I believe in giving others the benefit of the doubt while also being mindful of potential cultural differences and socio-economic disparities that may impact trust. \n\n2"]}, {"persona": {"region": "Suez", "sex": "male", "age": 41, "country": "Egypt", "marital_status": "married", "education": "middle", "social_class": "working class"}, "question": {"id": "Q63", "variant": 0}, "response": ["Based on my cultural context as a married male from Suez, Egypt, my trust in people of another nationality is influenced by my emic perspective. As a member of the working class with a middle education level, my individual values and personal experience play a significant role in shaping my perceptions. Additionally, my socioeconomic background and the cultural relativism that I adhere to also contribute to my level of trust. I also consider the nuanced phrasing of the question and the space and time in which I live. Therefore, my choice is:\n\n2"]}, {"persona": {"region": "Suez", "sex": "female", "age": 39, "country": "Egypt", "marital_status": "divorced", "education": "middle", "social_class": "working class"}, "question": {"id": "Q63", "variant": 0}, "response": ["Based on the anthropological framework, my emic perspective as a divorced female from Suez, Egypt, with a middle education level and part of the working class, is influenced by my cultural context, individual values, and socioeconomic background. In Egypt, there is a strong sense of national pride and cultural identity, and there may be some level of suspicion or wariness towards people of other nationalities due to historical and political factors. Additionally, as a member of the working class, I may have limited exposure to people of other nationalities and may rely on my personal experiences and values to inform my level of trust. Therefore, my response to the question would be (3) Do not trust very much."]}, {"persona": {"region": "Cairo", "sex": "female", "age": 55, "country": "Egypt", "marital_status": "married", "education": "middle", "social_class": "working class"}, "question": {"id": "Q63", "variant": 0}, "response": ["Based on the anthropological framework, as a married female from Cairo, Egypt, at 55 years of age and part of the working class, my perspective is heavily influenced by my cultural context and individual values. In Egyptian society, there is a strong sense of community and trust within the local community and among people of the same nationality. However, with the political and social tensions in the region, there may be some distrust towards people of other nationalities. Additionally, my socioeconomic background as part of the working class may also influence my level of trust, as there may be economic disparities and competition for resources. Therefore, I would choose option (2) Trust somewhat, as I may have some level of trust in people of another nationality, but there may also be some reservations based on cultural and socioeconomic factors. \n\n2"]}, {"persona": {"region": "Cairo", "sex": "male", "age": 58, "country": "Egypt", "marital_status": "married", "education": "middle", "social_class": "lower middle class"}, "question": {"id": "Q63", "variant": 0}, "response": ["In considering the question of how much I trust people of another nationality, it is important to take into account my cultural context as a married male from Cairo, Egypt. My background and socioeconomic status as part of the lower middle class, along with my age and education level, play a significant role in shaping my perceptions and attitudes towards people of other nationalities. Additionally, the cultural relativism framework reminds us that there is no hierarchy of culture, and nuance is crucial in understanding how I might approach this question. Taking all of these factors into consideration, I would choose option (2) Trust somewhat. \n\n2"]}, {"persona": {"region": "Cairo", "sex": "female", "age": 29, "country": "Egypt", "marital_status": "married", "education": "higher", "social_class": "lower middle class"}, "question": {"id": "Q63", "variant": 0}, "response": ["Based on the anthropological framework, as a married female from Cairo, Egypt, my emic perspective on trusting people of another nationality would be influenced by the cultural context in which I live, including the political and historical relationships between Egypt and other nations. Additionally, my lower middle class socioeconomic background would impact my trust levels, as I may have had limited interactions with people from other nationalities due to financial constraints. My personal experience and individual values would also play a role, as I may have been raised to be cautious of outsiders due to societal norms and personal beliefs. Furthermore, the nuance of the question is crucial, as the level of trust would vary depending on the specific nationality in question. Therefore, based on this perspective, I would choose option (2) Trust somewhat. \n\n2"]}, {"persona": {"region": "Cairo", "sex": "male", "age": 38, "country": "Egypt", "marital_status": "married", "education": "higher", "social_class": "lower middle class"}, "question": {"id": "Q63", "variant": 0}, "response": ["Based on my cultural context and socioeconomic background, I have been raised in a society where there is a level of skepticism when it comes to trusting people of another nationality. This is influenced by the historical and political context of Egypt, as well as the socioeconomic challenges faced by the lower middle class. Additionally, my personal experience and individual values also play a role in this. However, I do believe in the concept of cultural relativism and understand that my perspective may not be universal. Therefore, I would say I trust somewhat, as I am open to building trust with individuals from other nationalities but also mindful of the potential challenges and differences that may exist. \n\n2"]}, {"persona": {"region": "Cairo", "sex": "female", "age": 40, "country": "Egypt", "marital_status": "married", "education": "higher", "social_class": "lower middle class"}, "question": {"id": "Q63", "variant": 0}, "response": ["Based on the anthropological framework, as a married female from Cairo, Egypt, cultural context and individual values play a significant role in my perspective. Coming from a lower middle class background, my trust in people of another nationality may be influenced by my personal experiences and the socioeconomic factors of my life. Additionally, cultural relativism is important in my understanding of different nationalities, as I believe that no culture is \"better\" than another. As a 40-year-old with higher education, I have been exposed to different perspectives and may have a more nuanced understanding of trust in people of another nationality. Therefore, I would choose:\n\n2"]}, {"persona": {"region": "Cairo", "sex": "male", "age": 38, "country": "Egypt", "marital_status": "married", "education": "higher", "social_class": "upper middle class"}, "question": {"id": "Q63", "variant": 0}, "response": ["Based on the anthropological framework, my individual values and personal experience, along with my socioeconomic background, will heavily influence my answer to this question. As a married male from Cairo, Egypt, I am likely to have a strong sense of national and cultural identity, and my higher education level may have exposed me to a variety of perspectives on nationalism and international relations. Additionally, being part of the upper middle class, I may have had more opportunities for international travel and interactions with people from other nationalities, which could have shaped my level of trust. Considering the cultural relativism aspect, I understand that trust is subjective and can vary greatly from person to person and from culture to culture. Lastly, space and time are also important factors, and my age and geographical location in Cairo are likely to influence my level of trust toward people of another nationality. \n\n2"]}, {"persona": {"region": "Cairo", "sex": "male", "age": 59, "country": "Egypt", "marital_status": "married", "education": "middle", "social_class": "lower middle class"}, "question": {"id": "Q63", "variant": 0}, "response": ["Based on the anthropological framework, my emic perspective as a married male from Cairo, Egypt, emphasizes the importance of cultural context, individual values and personal experience, and socioeconomic background. In my cultural context, there is a history of political and social tension with other nationalities, particularly due to colonialism and geopolitical conflicts. My personal experience and values have been shaped by this context, leading me to have some level of distrust towards people of other nationalities. Additionally, my lower middle class socioeconomic background may have limited my exposure to diverse perspectives and cultures, further influencing my level of trust. Therefore, I would choose option (3) Do not trust very much.\n\n3"]}, {"persona": {"region": "Cairo", "sex": "female", "age": 30, "country": "Egypt", "marital_status": "married", "education": "higher", "social_class": "upper middle class"}, "question": {"id": "Q63", "variant": 0}, "response": ["Based on my personal experiences and cultural context as a married female from Cairo, Egypt, I am inclined to view people of another nationality with cautious trust. This perspective is influenced by both my individual values and personal experiences, as well as my socioeconomic background as a member of the upper middle class. Additionally, the cultural relativism framework reminds me that each culture has its own unique customs and values, which may differ from my own. Therefore, while I am open to trusting people of another nationality to some extent, I am also aware of the potential cultural differences that may impact our interactions. \n\n2"]}, {"persona": {"region": "Cairo", "sex": "male", "age": 22, "country": "Egypt", "marital_status": "single", "education": "middle", "social_class": "lower middle class"}, "question": {"id": "Q63", "variant": 0}, "response": ["From the perspective of a single male from Cairo, Egypt, who is 22 years old and part of the lower middle class, it is important to consider the cultural context and individual values in addressing the question of trust towards people of another nationality. The cultural context in Egypt, particularly in Cairo, is one of diversity and interaction with people of various nationalities due to the city's status as a major international hub. However, individual experiences and socioeconomic background may also play a role in shaping perceptions of trust towards people of another nationality. Additionally, the concept of cultural relativism emphasizes the need to understand and respect the perspectives of others, regardless of nationality. Therefore, my response is based on the nuanced understanding of these factors and reflects the perspective of the persona described above.\n\n2"]}, {"persona": {"region": "Cairo", "sex": "male", "age": 29, "country": "Egypt", "marital_status": "single", "education": "higher", "social_class": "lower middle class"}, "question": {"id": "Q63", "variant": 0}, "response": ["Based on my individual values and personal experience, as well as my lower middle class socioeconomic background, I have learned to be cautious and discerning in my interactions with people from other nationalities. My cultural context, being from Cairo, Egypt, also plays a role in shaping my perspective as it is a diverse and bustling city with a mix of cultures and backgrounds. Additionally, the emic and etic perspectives within my community have influenced my understanding of trust and relationships with people from other nationalities. Cultural relativism also informs my approach, as I understand that different cultures may have different norms and behaviors. Ultimately, I would say that I trust somewhat people of another nationality, as I believe in giving individuals the benefit of the doubt while also being mindful of potential cultural differences and boundaries. \n\n2"]}, {"persona": {"region": "Cairo", "sex": "female", "age": 31, "country": "Egypt", "marital_status": "married", "education": "higher", "social_class": "lower middle class"}, "question": {"id": "Q63", "variant": 0}, "response": ["Based on the anthropological framework, my emic perspective as a married female from Cairo, Egypt, is influenced by my cultural context, individual values, and socioeconomic background. In Egypt, there is a strong sense of national pride and a history of struggle for independence, which has cultivated a deep sense of trust and solidarity among fellow Egyptians. However, as part of the lower middle class, I have also experienced economic challenges, and this has led me to be cautious and somewhat skeptical of people from other nationalities, as I fear exploitation or being taken advantage of. Additionally, my personal experience and the cultural relativism of Egypt lead me to believe that trust should be earned and not blindly given. Therefore, while I may be open to trusting people of another nationality, my background and cultural context lead me to trust somewhat, as I believe in being cautious and reserved in my interactions with others.\n\n2"]}, {"persona": {"region": "Cairo", "sex": "male", "age": 59, "country": "Egypt", "marital_status": "married", "education": "higher", "social_class": "upper middle class"}, "question": {"id": "Q63", "variant": 0}, "response": ["Based on my emic perspective as a married male from Cairo, Egypt, I have been raised to trust people of other nationalities somewhat, as I understand the importance of building relationships and connections with individuals from diverse backgrounds. My cultural context also plays a significant role in this, as Egypt is a country with a rich history of interaction with people from various nationalities due to its strategic location and historical significance. My individual values and personal experience have also shaped my belief in the importance of trust and cooperation with people from different nationalities. Additionally, my socioeconomic background as a member of the upper middle class has allowed me to have more exposure to diverse cultures and perspectives, further influencing my level of trust. Therefore, my nuanced understanding of trust towards people of another nationality is based on a combination of cultural relativism, space, time, and socioeconomic background. \n\n2"]}, {"persona": {"region": "Cairo", "sex": "male", "age": 27, "country": "Egypt", "marital_status": "single", "education": "middle", "social_class": "working class"}, "question": {"id": "Q63", "variant": 0}, "response": ["Based on the anthropological framework, my perspective as a single male from Cairo, Egypt, with a middle education level and working-class background is heavily influenced by my cultural context, individual values, and personal experience. In Egypt, there is a strong sense of national pride and a history of political tension with other countries. Additionally, my socioeconomic background and limited exposure to people from other nationalities may lead me to have a more cautious approach to trusting people of another nationality. I may have been influenced by negative stereotypes or experiences, and my trust may be somewhat limited as a result. \n\n2"]}, {"persona": {"region": "Cairo", "sex": "female", "age": 25, "country": "Egypt", "marital_status": "single", "education": "higher", "social_class": "working class"}, "question": {"id": "Q63", "variant": 0}, "response": ["From an emic perspective, as a single female from Cairo, Egypt, I am influenced by the cultural context of my surroundings, including my experiences and personal values. Egypt has a rich history and cultural diversity, and as a working-class woman who has completed higher education, I have had the opportunity to interact with people from various nationalities. My socioeconomic background and individual values also play a role in shaping my trust towards people of another nationality. Additionally, the concept of cultural relativism reminds me that no culture is superior to another, which influences my perception of people from different nationalities. Therefore, my answer to the question would be influenced by my understanding of space and time, as well as the nuanced phrasing of the question.\n\n2"]}, {"persona": {"region": "Cairo", "sex": "female", "age": 23, "country": "Egypt", "marital_status": "married", "education": "higher", "social_class": "lower middle class"}, "question": {"id": "Q63", "variant": 0}, "response": ["Based on my emic perspective as a married female from Cairo, Egypt, I have grown up in a cultural context where there is a strong emphasis on family and community, and where trust is highly valued. My personal experience and individual values are shaped by this cultural context, and as someone from the lower middle class, I have learned to rely on the support and trust of those around me. Additionally, cultural relativism is important to consider, as I understand that different nationalities may have their own unique cultural norms and values. Considering all of these factors, I would choose option (2) Trust somewhat. \n\n2"]}, {"persona": {"region": "Cairo", "sex": "male", "age": 58, "country": "Egypt", "marital_status": "married", "education": "higher", "social_class": "working class"}, "question": {"id": "Q63", "variant": 0}, "response": ["Based on the anthropological framework, as a married male from Cairo, Egypt, my emic perspective is influenced by my cultural context, individual values, and socioeconomic background. In Egypt, there is a strong sense of community and trust within the local culture, but historical and political factors have also led to some level of skepticism towards people of other nationalities. Additionally, my working-class background and age may have shaped my perception of trust towards people of other nationalities. Therefore, my answer to the question would be: \n\n2\n\nTrust somewhat"]}, {"persona": {"region": "Cairo", "sex": "female", "age": 40, "country": "Egypt", "marital_status": "married", "education": "higher", "social_class": "working class"}, "question": {"id": "Q63", "variant": 0}, "response": ["Based on the anthropological framework, as a married female from Cairo, Egypt, my emic perspective is influenced by my cultural context, individual values, and socioeconomic background. In Egyptian society, there is a strong emphasis on trust and community ties within the family and local community. However, due to geopolitical tensions and historical relations with other nationalities, there may be a level of skepticism or caution when it comes to trusting people of another nationality. Additionally, as a working-class individual, my socioeconomic background may also play a role in shaping my level of trust. Therefore, I would select option (2) Trust somewhat."]}, {"persona": {"region": "Cairo", "sex": "female", "age": 36, "country": "Egypt", "marital_status": "married", "education": "middle", "social_class": "upper middle class"}, "question": {"id": "Q63", "variant": 0}, "response": ["Based on the anthropological framework, I would answer this question based on my personal experience and cultural context. As a married female from Cairo, Egypt, my cultural background and upbringing have instilled in me a certain level of caution and wariness towards people of other nationalities. This is not due to any inherent bias or prejudice, but rather a result of the socio-political climate and historical context of Egypt. Additionally, my level of education and socioeconomic background have also shaped my perceptions and attitudes towards people of other nationalities. Therefore, I would choose option (2) Trust somewhat, as I believe in being open-minded and giving individuals the benefit of the doubt, while also being cautious and discerning in my interactions with those from other nationalities."]}, {"persona": {"region": "Cairo", "sex": "male", "age": 40, "country": "Egypt", "marital_status": "married", "education": "middle", "social_class": "lower middle class"}, "question": {"id": "Q63", "variant": 0}, "response": ["Based on the anthropological framework, my perspective as a married male from Cairo, Egypt, with a middle education level and lower middle class background is heavily influenced by my cultural context, individual values, and personal experiences. In Egyptian culture, there is a strong emphasis on community and trust within the in-group, but there may be skepticism or caution towards those outside of the immediate cultural context. Additionally, my socioeconomic background may also play a role in my level of trust towards people of another nationality, as lower middle class individuals may have limited exposure to people from other nationalities and may be more cautious in their trust. Therefore, I would choose option (3) Do not trust very much."]}, {"persona": {"region": "Cairo", "sex": "female", "age": 30, "country": "Egypt", "marital_status": "married", "education": "middle", "social_class": "lower class"}, "question": {"id": "Q63", "variant": 0}, "response": ["Based on my cultural context as a lower-class married woman from Cairo, Egypt, my trust in people of another nationality would be influenced by my individual values and personal experiences. Living in a densely populated and diverse city like Cairo, I have interacted with people from various nationalities and have had both positive and negative experiences. Additionally, my socioeconomic background may lead me to be more cautious in trusting people of another nationality, as I may have had limited exposure to individuals from different backgrounds due to financial constraints. Therefore, my trust in people of another nationality would be influenced by a combination of personal experiences, values, and socioeconomic background, leading me to choose option (3) - Do not trust very much. \n\n3"]}, {"persona": {"region": "Cairo", "sex": "male", "age": 58, "country": "Egypt", "marital_status": "married", "education": "higher", "social_class": "lower middle class"}, "question": {"id": "Q63", "variant": 0}, "response": ["Based on my Emic and Etic perspective, as a married male from Cairo, Egypt, I have been raised to have a certain level of suspicion towards people of other nationalities, especially given the political and historical context of our country. The cultural context of Cairo also plays a role in my level of trust, as we have a diverse population and have experienced external influence throughout history. My individual values and personal experience also shape my level of trust, as I have had both positive and negative interactions with people of other nationalities. Additionally, my lower middle-class socioeconomic background means I may feel more vulnerable and cautious towards outsiders. Therefore, considering all these factors, I would select option (2) Trust somewhat. \n\n2"]}, {"persona": {"region": "Cairo", "sex": "male", "age": 50, "country": "Egypt", "marital_status": "married", "education": "middle", "social_class": "lower middle class"}, "question": {"id": "Q63", "variant": 0}, "response": ["Based on my cultural context, as a married male from Cairo, Egypt, I have grown up in a society that values strong family and community ties. My individual values and personal experiences have taught me to trust people within my own nationality and those who share similar cultural values. However, my lower middle class socioeconomic background has also made me cautious of trusting those from other nationalities, as I have not had the opportunity to travel or interact with people from different backgrounds. Furthermore, the cultural relativism in my society has ingrained in me the belief that my own cultural values are superior, leading me to have a limited level of trust in people of other nationalities. Therefore, I would choose option (3) Do not trust very much. \n\n3"]}, {"persona": {"region": "Cairo", "sex": "female", "age": 40, "country": "Egypt", "marital_status": "married", "education": "higher", "social_class": "upper middle class"}, "question": {"id": "Q63", "variant": 0}, "response": ["Based on the anthropological framework, as a married female from Cairo, Egypt, my emic perspective is influenced by my cultural context, individual values, and socioeconomic background. In Egyptian culture, there is a strong emphasis on hospitality and trust within the community. However, due to geopolitical tensions and historical interactions with other nationalities, there may be some level of skepticism towards people of another nationality. Additionally, as part of the upper middle class, there may be a level of privilege and exposure to different nationalities, which could influence a higher level of trust. Therefore, my personal experience and socioeconomic background lead me to trust somewhat people of another nationality.\n\n2"]}, {"persona": {"region": "Cairo", "sex": "female", "age": 33, "country": "Egypt", "marital_status": "married", "education": "middle", "social_class": "lower middle class"}, "question": {"id": "Q63", "variant": 0}, "response": ["Based on my emic perspective as a married female from Cairo, Egypt, I have grown up in a cultural context where there is a strong sense of national identity and pride. My personal experience and individual values have been shaped by the socioeconomic background of being part of the lower middle class, where there is a general distrust of people from other nationalities due to historical and political tensions. Additionally, as a 33-year-old woman who has only completed middle education, I have not had the opportunity to travel or interact with people from other nationalities extensively. Therefore, I would choose option (3) Do not trust very much."]}, {"persona": {"region": "Cairo", "sex": "female", "age": 37, "country": "Egypt", "marital_status": "married", "education": "middle", "social_class": "lower middle class"}, "question": {"id": "Q63", "variant": 0}, "response": ["Based on my emic perspective, as a married female from Cairo, Egypt, I have been raised with a sense of caution and wariness towards people of another nationality due to the historical and political tensions between Egypt and other countries. This cultural context is pivotal in shaping my perceptions. Additionally, my lower middle class socioeconomic background has also influenced my trust levels, as I have had limited exposure to people of other nationalities and have been taught to prioritize self-preservation. My individual values and personal experiences further contribute to my somewhat limited trust in people of another nationality. Considering the nuanced phrasing of the question and the influence of space and time, I would choose option 2: Trust somewhat. \n\n2"]}, {"persona": {"region": "Cairo", "sex": "male", "age": 28, "country": "Egypt", "marital_status": "married", "education": "middle", "social_class": "lower middle class"}, "question": {"id": "Q63", "variant": 0}, "response": ["Based on the anthropological framework, as a 28-year-old married male from Cairo, Egypt, who has completed middle education and considers myself part of the lower middle class, my perspective on trusting people of another nationality would be influenced by my cultural context, individual values, and socioeconomic background. Growing up in a diverse and densely populated city like Cairo, I have been exposed to people of various nationalities and have learned to value diversity. However, due to my lower middle class status and limited exposure to higher education, I may have encountered economic challenges and may harbor some feelings of distrust towards people of other nationalities due to perceived competition for resources. Therefore, I would choose option (2) Trust somewhat, as this reflects my nuanced understanding of the question based on my personal experience and socioeconomic background. \n\n2"]}, {"persona": {"region": "Cairo", "sex": "male", "age": 53, "country": "Egypt", "marital_status": "married", "education": "higher", "social_class": "working class"}, "question": {"id": "Q63", "variant": 0}, "response": ["Based on the anthropological framework, my perspective as a married male from Cairo, Egypt, who is 53 years old and part of the working class, is influenced by my cultural context, individual values, and socioeconomic background. In Egypt, there is a strong sense of community and trust within the local culture, and personal experience has taught me to value trust and relationships. However, the socioeconomic background and historical context of Egypt also contribute to a certain level of caution and skepticism towards people of other nationalities, particularly in light of geopolitical tensions and economic disparities. Therefore, taking into account all these factors, I would choose option (2) Trust somewhat. \n\n2"]}, {"persona": {"region": "Cairo", "sex": "male", "age": 45, "country": "Egypt", "marital_status": "married", "education": "higher", "social_class": "lower middle class"}, "question": {"id": "Q63", "variant": 0}, "response": ["Based on the anthropological framework of emic and etic perspectives, cultural context, individual values and personal experience, socioeconomic background, cultural relativism, space and time, and nuance, I, as a married male from Cairo, Egypt, would approach the question of how much I trust people of another nationality with a nuanced perspective. Considering the cultural context and my personal experience, I would be inclined to have some level of trust in people of another nationality, as I have likely been exposed to diversity and have interacted with people from different backgrounds. However, my lower middle-class socioeconomic background and the societal norms of Egypt may also influence me to have some level of caution and not fully trust people from another nationality due to potential cultural differences and historical tensions. Additionally, the current geopolitical climate and global events may also play a role in shaping my level of trust. Therefore, I would choose option (2) Trust somewhat. \n\n2"]}, {"persona": {"region": "Cairo", "sex": "male", "age": 52, "country": "Egypt", "marital_status": "married", "education": "middle", "social_class": "upper middle class"}, "question": {"id": "Q63", "variant": 0}, "response": ["Based on my emic perspective as a married male from Cairo, Egypt, I have grown up in a cultural context that values strong family and community ties. My individual values and personal experience have taught me to be cautious and discerning when it comes to trusting people of another nationality, but my upper middle class socioeconomic background has also exposed me to different cultures and has allowed me to interact with people from other nationalities. I understand the importance of cultural relativism and recognize that each person should be judged on their own merits rather than on their nationality. Additionally, my age and place have given me a nuanced understanding of the world. Therefore, based on my perspective, I would choose option (2) Trust somewhat. \n\n2"]}, {"persona": {"region": "Cairo", "sex": "male", "age": 22, "country": "Egypt", "marital_status": "single", "education": "higher", "social_class": "lower middle class"}, "question": {"id": "Q63", "variant": 0}, "response": ["Based on my emic perspective as a single male from Cairo, Egypt, I have been raised in a cultural context that values strong kinship networks and community ties. My individual values and personal experiences have taught me to be cautious in trusting people of another nationality due to historical and political tensions. Additionally, my lower middle class socioeconomic background has made me more aware of potential cultural and economic differences that can impact trust. Cultural relativism also plays a role in my understanding, as I acknowledge that different nationalities may have different social norms and values that could affect trust. Furthermore, space and time also play a role, as my age and place of upbringing have shaped my perceptions. Overall, the nuanced phrasing of the question leads me to select option 2: Trust somewhat. \n\n2"]}, {"persona": {"region": "Cairo", "sex": "female", "age": 57, "country": "Egypt", "marital_status": "divorced", "education": "middle", "social_class": "lower middle class"}, "question": {"id": "Q63", "variant": 0}, "response": ["Based on the anthropological framework, my emic perspective as a divorced lower middle class woman from Cairo, Egypt, would be influenced by my cultural context, individual values, and socioeconomic background. Cairo is a diverse city with a mix of cultures and nationalities, and my personal experience and values would lead me to have a nuanced understanding of trust towards people of another nationality. My lower middle class background may have exposed me to various economic struggles, which could affect my level of trust. Additionally, at 57 years old, I have likely witnessed significant historical events and changes in the world, contributing to my perspective. Overall, my answer would be influenced by a combination of factors such as cultural relativism, space and time, and individual values, leading me to select the option that best represents my nuanced understanding of trust towards people of another nationality.\n\n3"]}, {"persona": {"region": "Cairo", "sex": "female", "age": 42, "country": "Egypt", "marital_status": "married", "education": "middle", "social_class": "working class"}, "question": {"id": "Q63", "variant": 0}, "response": ["Based on the anthropological framework, as a married female from Cairo, Egypt, with a working-class background, my emic perspective is shaped by the cultural context of my upbringing and life experiences. Egypt has a rich history and a strong sense of national identity, but it also has a complex relationship with other nationalities due to geopolitical tensions and historical conflicts. My individual values and personal experiences have likely been influenced by this cultural context, leading me to be cautious in trusting people of another nationality. Additionally, my socioeconomic background as a working-class individual may have limited my exposure to diverse cultures, further impacting my level of trust. Therefore, my response to the question would be:\n\n3. Do not trust very much"]}, {"persona": {"region": "Cairo", "sex": "female", "age": 23, "country": "Egypt", "marital_status": "single", "education": "middle", "social_class": "lower middle class"}, "question": {"id": "Q63", "variant": 0}, "response": ["Based on the anthropological framework, as a 23-year-old single female from Cairo, Egypt, with a lower middle-class background and completed middle education level, my perspective on trusting people of another nationality would be influenced by my cultural context, individual values, and personal experience. Living in a diverse city like Cairo, I have been exposed to people from various nationalities, and my personal experience has taught me that trust should be earned rather than given. Additionally, my socioeconomic background may lead me to be cautious in trusting people of another nationality, as I may be more vulnerable to exploitation or mistreatment. Therefore, I would choose option (2) Trust somewhat. \n\n2"]}, {"persona": {"region": "Cairo", "sex": "female", "age": 28, "country": "Egypt", "marital_status": "married", "education": "higher", "social_class": "upper middle class"}, "question": {"id": "Q63", "variant": 0}, "response": ["From the perspective of a married female from Cairo, Egypt, with a higher education level and part of the upper middle class, the emic and etic perspectives play a significant role in my understanding of trust towards people of another nationality. The cultural context of Cairo and Egypt, in general, has a long history of diverse nationalities and cultural exchanges, which has influenced my personal values and experiences. Additionally, my socioeconomic background has provided me with opportunities to interact with individuals from different nationalities and has shaped my understanding of cultural relativism. As a result, I have developed a nuanced approach to trust towards people of another nationality, leaning towards trusting somewhat, considering the importance of individual values, personal experiences, and the influence of cultural relativism. \n\n2"]}, {"persona": {"region": "Cairo", "sex": "female", "age": 22, "country": "Egypt", "marital_status": "single", "education": "higher", "social_class": "lower middle class"}, "question": {"id": "Q63", "variant": 0}, "response": ["Based on the anthropological framework, my emic perspective as a single female from Cairo, Egypt, who is 22 years old and part of the lower middle class, is influenced by my cultural context, individual values, and socioeconomic background. In Egypt, there is a strong sense of national pride and a history of political and social tensions with other nationalities. As a result, my personal experiences and values may lead me to be more cautious in trusting people of another nationality. Additionally, my lower middle class socioeconomic background may also play a role in my level of trust, as economic disparities and social inequalities can impact perceptions of others. Therefore, I would choose option (3) Do not trust very much. \n\n3"]}, {"persona": {"region": "Cairo", "sex": "female", "age": 39, "country": "Egypt", "marital_status": "married", "education": "middle", "social_class": "lower middle class"}, "question": {"id": "Q63", "variant": 0}, "response": ["Based on the anthropological framework, my answer to the question of how much I trust people of another nationality is influenced by my cultural context, individual values, and socioeconomic background. As a married female from Cairo, Egypt, I have been influenced by the cultural context of my community, which may have a history of political tension and conflict with other nationalities. Additionally, my lower middle-class socioeconomic background may have limited my exposure to people of other nationalities, impacting my level of trust. Furthermore, my personal experience and values may also play a role in shaping my perception of individuals from other nationalities. Therefore, my answer is (3) Do not trust very much."]}, {"persona": {"region": "Cairo", "sex": "male", "age": 19, "country": "Egypt", "marital_status": "single", "education": "middle", "social_class": "working class"}, "question": {"id": "Q63", "variant": 0}, "response": ["Based on the anthropological framework, my emic perspective as a 19-year-old working-class male from Cairo, Egypt, is shaped by my cultural context, individual values, and socioeconomic background. Growing up in a densely populated and diverse city like Cairo, I have been exposed to people from various nationalities. However, the cultural relativism in Egypt means that there is a certain level of skepticism and wariness towards people of other nationalities due to historical and political tensions. Additionally, my socioeconomic background as a working-class individual means that I have limited exposure to other nationalities and have not had many opportunities to build trust with them. Therefore, my answer to the question would be (3) Do not trust very much. \n\n3"]}, {"persona": {"region": "Cairo", "sex": "female", "age": 54, "country": "Egypt", "marital_status": "married", "education": "middle", "social_class": "working class"}, "question": {"id": "Q63", "variant": 0}, "response": ["Based on the anthropological framework, my understanding and answer to the question on how much I trust people of another nationality is deeply influenced by my cultural context, individual values, and socioeconomic background. As a married female from Cairo, Egypt, my cultural context and personal experience have shaped my perception of people from other nationalities. Living in a diverse and cosmopolitan city like Cairo, I have been exposed to people from various nationalities and have learned to trust them to some extent. However, as a member of the working class with limited education, I may also have some reservations due to the socioeconomic disparities and cultural differences. Therefore, I would choose option (2) Trust somewhat as my answer.\n\n2"]}, {"persona": {"region": "Cairo", "sex": "male", "age": 30, "country": "Egypt", "marital_status": "married", "education": "higher", "social_class": "working class"}, "question": {"id": "Q63", "variant": 0}, "response": ["Based on my emic perspective as a married male from Cairo, Egypt, I have grown up and lived in a cultural context that has historically been shaped by geopolitical tensions and conflicts with other nations. This has influenced my individual values and personal experience, leading me to have a certain level of caution and skepticism when it comes to trusting people of another nationality. Additionally, my socioeconomic background as part of the working class has also instilled in me a sense of wariness towards those from different nationalities due to economic disparities and power dynamics. Furthermore, cultural relativism teaches me to respect and understand the nuances of different cultures, but it also emphasizes the importance of recognizing the impact of space and time on intercultural interactions. Therefore, taking all these factors into consideration, I would choose:\n\n3. Do not trust very much"]}, {"persona": {"region": "Cairo", "sex": "male", "age": 39, "country": "Egypt", "marital_status": "married", "education": "higher", "social_class": "lower middle class"}, "question": {"id": "Q63", "variant": 0}, "response": ["Based on the anthropological framework, I am a married male from Cairo, Egypt, and my understanding of trust towards people of another nationality is influenced by my emic perspective, cultural context, individual values, and socioeconomic background. In Egypt, there is a history of diverse cultures and nationalities coexisting, and this has shaped my understanding of trust towards people of another nationality. My lower middle-class socioeconomic background has also influenced my perception of trust as I have had limited exposure to people of other nationalities due to financial constraints. Additionally, the cultural relativism perspective has taught me to approach different nationalities with an open mind and not to immediately judge or distrust them. Therefore, I would choose option (2) Trust somewhat, as I have learned to be cautious yet open-minded towards people of other nationalities. \n\n2"]}, {"persona": {"region": "Cairo", "sex": "female", "age": 41, "country": "Egypt", "marital_status": "married", "education": "middle", "social_class": "lower middle class"}, "question": {"id": "Q63", "variant": 0}, "response": ["Based on my personal experience and cultural context, as a married woman from Cairo, Egypt, I have grown up in a society where there is a level of mistrust towards people of other nationalities. This is due to historical and political factors, as well as the media portrayal of certain nationalities. Additionally, my lower middle class socioeconomic background has limited my exposure to people of other nationalities, further contributing to a lack of trust. However, I also understand the importance of cultural relativism and recognize that not all individuals from other nationalities should be generalized. Therefore, I would choose option (2) Trust somewhat. \n\n2"]}, {"persona": {"region": "Cairo", "sex": "male", "age": 45, "country": "Syria", "marital_status": "single", "education": "higher", "social_class": "upper middle class"}, "question": {"id": "Q63", "variant": 0}, "response": ["Based on the emic and etic perspectives, as a single male from Cairo, Syria, my in-group way of thinking about the question of trust towards people of another nationality would be heavily influenced by my cultural context, individual values, and personal experience. Coming from a country with a long history of geopolitical tensions and conflicts, as well as being part of the upper middle class, I have been socialized to be cautious and wary of people from other nationalities. My higher education level and socioeconomic background also play a role in shaping my perceptions, as they have likely exposed me to a wider range of experiences and perspectives. Additionally, the socio-political climate in the region has likely influenced my trust towards people of another nationality. Therefore, I would tend to choose option (3) Do not trust very much.\n\n3"]}, {"persona": {"region": "Cairo", "sex": "male", "age": 54, "country": "Egypt", "marital_status": "married", "education": "higher", "social_class": "lower middle class"}, "question": {"id": "Q63", "variant": 0}, "response": ["Based on my emic and etic perspectives as a married male from Cairo, Egypt, I understand that there are in-group ways of thinking about trust in people of another nationality versus out-group ways. My cultural context, including where I come from and my kinship networks, plays a significant role in shaping my perception of trust. Additionally, my individual values and personal experiences, such as my age and socioeconomic background as a part of the lower middle class, greatly influence my level of trust towards people of another nationality. Furthermore, I recognize the importance of cultural relativism and understand that my perspective on trust may differ from others based on nuanced phrasing of the question. Considering all these factors, my response is:\n\n2\n\nTrust somewhat"]}, {"persona": {"region": "Cairo", "sex": "male", "age": 65, "country": "Egypt", "marital_status": "married", "education": "middle", "social_class": "upper middle class"}, "question": {"id": "Q63", "variant": 0}, "response": ["Based on my emic perspective as a married male from Cairo, Egypt, I have grown up in a society where trust in people from other nationalities is not very high. This perspective is influenced by the cultural context of Egypt, which has a history of political and social tensions with other countries. Additionally, my individual values and personal experiences have shaped my perception of trust towards people from other nationalities, as I have not had many positive interactions with individuals from different countries. My socioeconomic background as part of the upper middle class also plays a role, as people from this class tend to have more conservative views and are less likely to trust individuals from other nationalities. Furthermore, the nuance of the question also influences my response, as the phrasing of \"another nationality\" implies a generalization of trust towards all individuals of a different nationality, which may lead to a lower level of trust. \n\n3"]}, {"persona": {"region": "Cairo", "sex": "female", "age": 52, "country": "Egypt", "marital_status": "married", "education": "middle", "social_class": "upper middle class"}, "question": {"id": "Q63", "variant": 0}, "response": ["Based on my emic perspective, as a married female from Cairo, Egypt, I have been raised within a cultural context that values strong kinship networks and community ties. My personal experience and individual values have led me to place a high level of importance on trust and mutual respect within my social interactions. Additionally, my socioeconomic background as part of the upper middle class has allowed me to interact with a diverse range of individuals from different nationalities, leading me to trust somewhat in people of another nationality. This nuanced response takes into account my cultural upbringing, personal experiences, and socioeconomic status, all of which shape my trust in individuals from other nationalities.\n\n2"]}, {"persona": {"region": "Cairo", "sex": "male", "age": 26, "country": "Egypt", "marital_status": "single", "education": "higher", "social_class": "lower middle class"}, "question": {"id": "Q63", "variant": 0}, "response": ["Based on the emic and etic perspectives, as a single male from Cairo, Egypt, my in-group and out-group ways of thinking about trust towards people of another nationality are influenced by my cultural context, individual values, and socioeconomic background. In Egypt, there is a long history of cultural exchange and trade with people of different nationalities, which has led to a relatively high level of trust towards foreigners. Additionally, my personal experience and values have taught me to be open and welcoming to individuals from other nationalities. As part of the lower middle class, I have interacted with people from various socioeconomic backgrounds, which has further shaped my perspective on trust towards people of another nationality. Therefore, I choose option 2: Trust somewhat.\n\n2"]}, {"persona": {"region": "Cairo", "sex": "male", "age": 32, "country": "Egypt", "marital_status": "married", "education": "middle", "social_class": "working class"}, "question": {"id": "Q63", "variant": 0}, "response": ["Based on the anthropological framework, my cultural context as a married male from Cairo, Egypt, will heavily influence my perception and trust of people from another nationality. My individual values and personal experience, shaped by my socioeconomic background and education level, will also play a significant role in my answer. Additionally, the cultural relativism perspective reminds me that there is no hierarchy of culture, so I must approach this question with an open mind. Finally, space and time, as well as nuance, will affect my response. \n\n2"]}, {"persona": {"region": "Cairo", "sex": "male", "age": 38, "country": "Egypt", "marital_status": "married", "education": "middle", "social_class": "lower middle class"}, "question": {"id": "Q63", "variant": 0}, "response": ["Based on my emic perspective as a married male from Cairo, Egypt, I have experienced and witnessed the impact of cultural and socioeconomic backgrounds on trust. In my cultural context, there is a strong emphasis on kinship networks and community ties, which can lead to a greater sense of trust within my own nationality. However, due to the socioeconomic background of being part of the lower middle class, I have also experienced the challenges and distrust that can arise when interacting with people from other nationalities, as resources and opportunities are often limited. Additionally, my individual values and personal experiences have shaped my perception of trust, leading me to be somewhat cautious in trusting people of another nationality. Therefore, based on these factors, I would choose option (2) Trust somewhat. \n\n2"]}, {"persona": {"region": "Cairo", "sex": "male", "age": 58, "country": "Egypt", "marital_status": "married", "education": "higher", "social_class": "upper middle class"}, "question": {"id": "Q63", "variant": 0}, "response": ["Based on the anthropological framework, my answer to the question about trusting people of another nationality is influenced by my cultural context, individual values and personal experience, socioeconomic background, and the nuanced phrasing of the question. Being from Cairo, Egypt, I have been exposed to a diverse range of nationalities and have had positive interactions with people from other countries. My higher education level has also taught me to appreciate different perspectives and understand the importance of global interconnectedness. As part of the upper middle class, I have had opportunities to travel and engage with individuals from various backgrounds, which has contributed to my openness and trust towards people of other nationalities.\n\n2"]}, {"persona": {"region": "Cairo", "sex": "male", "age": 49, "country": "Egypt", "marital_status": "married", "education": "middle", "social_class": "lower middle class"}, "question": {"id": "Q63", "variant": 0}, "response": ["Based on my cultural context, as a married male from Cairo, Egypt, I am influenced by the historical and political dynamics of my region, which have shaped my perceptions of people from other nationalities. My individual values and personal experiences have also contributed to my level of trust towards people of another nationality. Additionally, my lower middle class socioeconomic background has influenced my interactions with individuals from different nationalities. Considering the cultural relativism and nuanced phrasing of the question, I would choose:\n\n2"]}, {"persona": {"region": "Cairo", "sex": "female", "age": 29, "country": "Egypt", "marital_status": "married", "education": "middle", "social_class": "working class"}, "question": {"id": "Q63", "variant": 0}, "response": ["Based on the anthropological framework, as a married female from Cairo, Egypt, my perspective is heavily influenced by my cultural context, individual values, and socioeconomic background. In Egyptian culture, there is a strong sense of community and trust is often built within the in-group. Additionally, being part of the working class and having completed only middle education level, I may have limited exposure to people from other nationalities and therefore may not have had the opportunity to build trust with them. However, I also understand the importance of cultural relativism and recognize that my perspective may not be applicable to all individuals from Cairo, Egypt. Taking all these factors into account, I would choose option (2) Trust somewhat. \n\n2"]}, {"persona": {"region": "Cairo", "sex": "female", "age": 36, "country": "Egypt", "marital_status": "married", "education": "higher", "social_class": "lower middle class"}, "question": {"id": "Q63", "variant": 0}, "response": ["Based on the anthropological framework, as a married woman from Cairo, Egypt, I would approach the question of trust towards people of another nationality with a nuanced understanding. My emic perspective, influenced by my cultural context, individual values, and socioeconomic background, would lead me to consider the historical and political factors that have shaped my interactions with people of other nationalities. My personal experience, as well as the cultural relativism of my society, would lead me to understand that trust is not an absolute concept and can vary depending on individual and group experiences. Additionally, my age and place in society would also influence my level of trust. With these factors in mind, I would choose option 2) Trust somewhat, as I have had positive and negative experiences with people of other nationalities, leading me to approach interactions with cautious optimism."]}, {"persona": {"region": "Cairo", "sex": "female", "age": 34, "country": "Egypt", "marital_status": "married", "education": "middle", "social_class": "lower middle class"}, "question": {"id": "Q63", "variant": 0}, "response": ["Based on my cultural context and socioeconomic background, as a married woman from Cairo, Egypt, I have grown up in a society where trust is valued, but I have also been exposed to the challenges and prejudices faced by those in the lower middle class. My personal experience and values have shaped my perception of people from other nationalities. Additionally, my age and education level have influenced my understanding of the world. Therefore, I choose option (2) Trust somewhat."]}, {"persona": {"region": "Fayoum", "sex": "male", "age": 57, "country": "Egypt", "marital_status": "married", "education": "middle", "social_class": "working class"}, "question": {"id": "Q63", "variant": 0}, "response": ["Based on the anthropological framework, my response to the question is influenced by my emic perspective as a married male from Fayoum, Egypt, and my belonging to the working class. My cultural context, individual values, and personal experience also play a significant role in my answer. Additionally, my socioeconomic background and the cultural relativism of the region are important factors. As a 57-year-old with a middle education level, I have had limited exposure to people of other nationalities, and my trust in them may be influenced by the limited interactions I have had. Furthermore, the nuanced phrasing of the question also affects my response, as it does not provide a specific context for my interactions with people of other nationalities. \n\n3"]}, {"persona": {"region": "Fayoum", "sex": "male", "age": 60, "country": "Egypt", "marital_status": "married", "education": "middle", "social_class": "lower middle class"}, "question": {"id": "Q63", "variant": 0}, "response": ["Based on the anthropological framework, my perspective on trust towards people of another nationality is influenced by my cultural context, individual values, and socioeconomic background. As a married male from Fayoum, Egypt, I have grown up in a community with a strong emphasis on trust and mutual support within my own nationality. However, my lower middle class socioeconomic background has also exposed me to instances of economic hardship and competition, which may influence a degree of skepticism towards people of another nationality. Additionally, my age and level of education have shaped my understanding of the world, and I have not had extensive exposure to people of other nationalities. Therefore, I may be inclined to trust somewhat, but not completely, as I have limited personal experience with individuals from other nationalities and may have been influenced by negative stereotypes or perceptions perpetuated by my community and media.\n\n2"]}, {"persona": {"region": "Fayoum", "sex": "male", "age": 21, "country": "Egypt", "marital_status": "single", "education": "middle", "social_class": "lower middle class"}, "question": {"id": "Q63", "variant": 0}, "response": ["Based on my cultural context as a single male from Fayoum, Egypt, where I come from and my socioeconomic background play a significant role in shaping my perceptions and attitudes towards people of another nationality. Additionally, my individual values and personal experiences also influence how much I trust individuals from another nationality. Being part of the lower middle class and having completed only middle education level, I have limited exposure to individuals from other nationalities and may not have had positive experiences with them. Therefore, I may not trust people of another nationality very much. My age and place also play a role, as younger individuals in my community may have more exposure to global influences and may be more open to trusting people of another nationality, but this is not the case for everyone. Additionally, the nuanced phrasing of the question also influences my response, as it does not provide a specific context or scenario for me to consider. \n\n3"]}, {"persona": {"region": "Fayoum", "sex": "male", "age": 33, "country": "Egypt", "marital_status": "single", "education": "higher", "social_class": "working class"}, "question": {"id": "Q63", "variant": 0}, "response": ["Based on my emic perspective as a single male from Fayoum, Egypt, I am influenced by my cultural context, individual values, and socioeconomic background. In Egyptian culture, there is a strong sense of community and trust is often built within the in-group. However, as someone who has completed higher education and considers myself part of the working class, I have been exposed to different perspectives and have learned to be open-minded. Additionally, my age and place of living also play a role in my understanding of trust. Therefore, I would say I trust people of another nationality somewhat.\n\n2"]}, {"persona": {"region": "Fayoum", "sex": "male", "age": 32, "country": "Egypt", "marital_status": "married", "education": "higher", "social_class": "lower middle class"}, "question": {"id": "Q63", "variant": 0}, "response": ["Based on my cultural context in Fayoum, Egypt, my individual values and personal experiences, and my lower middle class socioeconomic background, I understand the importance of trust in relationships. My age and education level also play a role in shaping my perceptions. In my community, there is an emphasis on hospitality and building trust with others, regardless of nationality. While I may have some reservations due to historical and political factors, I believe in giving people the benefit of the doubt and trusting them somewhat, as long as they prove themselves trustworthy through their actions and behavior.\n\n2"]}, {"persona": {"region": "Gharbia", "sex": "male", "age": 42, "country": "Egypt", "marital_status": "married", "education": "higher", "social_class": "upper middle class"}, "question": {"id": "Q63", "variant": 0}, "response": ["Based on my emic perspective as a married male from Gharbia, Egypt, I have been raised to value trust and respect for others, regardless of their nationality. In my cultural context, it is important to maintain positive relationships with people of all nationalities as it reflects well on my character and upbringing. Additionally, my individual values and personal experiences have taught me the importance of open-mindedness and acceptance of others, regardless of their background. As someone from the upper middle class, I have had the opportunity to interact with people from different nationalities and have learned to trust them based on their actions and character rather than their nationality. My socioeconomic background has also afforded me the privilege of higher education, which has broadened my perspective and reinforced the value of cultural relativism. Thus, I can confidently say that I trust people of other nationalities somewhat, as I believe in giving individuals the benefit of the doubt and judging them based on their actions rather than preconceived notions.\n\n2"]}, {"persona": {"region": "Gharbia", "sex": "male", "age": 52, "country": "Egypt", "marital_status": "married", "education": "middle", "social_class": "working class"}, "question": {"id": "Q63", "variant": 0}, "response": ["Based on the anthropological framework, my perspective as a married male from Gharbia, Egypt, at 52 years of age, with a middle education level and part of the working class is heavily influenced by my cultural context, individual values, and socioeconomic background. I come from a region with a strong sense of community and trust, and my personal experience has shaped my belief in the importance of trust in relationships. Additionally, my socioeconomic background as part of the working class has taught me the value of relying on others and building connections. Therefore, my answer to the question would be:\n2\n\nAs a married male from Gharbia, Egypt, at 52 years of age, with a middle education level and part of the working class, my perspective is influenced by my cultural context, individual values, and socioeconomic background. I come from a region with a strong sense of community and trust, and my personal experience has shaped my belief in the importance of trust in relationships. Additionally, my socioeconomic background as part of the working class has taught me the value of relying on others and building connections. Therefore, my answer to the question would be: \n2"]}, {"persona": {"region": "Gharbia", "sex": "male", "age": 45, "country": "Egypt", "marital_status": "divorced", "education": "higher", "social_class": "upper middle class"}, "question": {"id": "Q63", "variant": 0}, "response": ["Based on my emic perspective as a divorced male from Gharbia, Egypt, I have been raised in a society that values trust and relationships with others. My cultural context and personal experience have taught me to be open and welcoming to people from other nationalities. Additionally, my higher education and upper middle class socioeconomic background have exposed me to diverse perspectives and cultures. I understand the importance of cultural relativism and recognize that no one culture is better than another. Therefore, I trust people of another nationality somewhat, as I believe in giving everyone the benefit of the doubt and forming my opinions based on individual interactions rather than preconceived notions. \n\n2"]}, {"persona": {"region": "Behaira", "sex": "male", "age": 23, "country": "Egypt", "marital_status": "single", "education": "middle", "social_class": "lower class"}, "question": {"id": "Q63", "variant": 0}, "response": ["Based on the anthropological framework, my emic perspective as a single male from Behaira, Egypt, aged 23 and belonging to the lower class, is influenced by my cultural context, individual values, and socioeconomic background. Growing up in a lower-class community has taught me to be cautious and distrustful of people outside my nationality due to limited exposure and resources. Additionally, my personal experiences and the cultural relativism of my community have shaped my perception of others. Therefore, I select:\n3"]}, {"persona": {"region": "Behaira", "sex": "male", "age": 38, "country": "Egypt", "marital_status": "single", "education": "higher", "social_class": "lower class"}, "question": {"id": "Q63", "variant": 0}, "response": ["Based on the anthropological framework, my emic perspective as a lower class single male from Behaira, Egypt would be influenced by my cultural context, individual values, and socioeconomic background. Growing up in a lower class community in Egypt, I may have limited exposure to people of other nationalities and may have been taught to be cautious of outsiders. Additionally, my personal experiences and values may also play a role in shaping my level of trust towards people of other nationalities. Taking into consideration the nuances of the question and the cultural relativism perspective, I would choose option (2) Trust somewhat, as I may have some reservations based on my background but may also recognize the potential for trust in certain situations."]}, {"persona": {"region": "Behaira", "sex": "male", "age": 32, "country": "Egypt", "marital_status": "married", "education": "middle", "social_class": "lower class"}, "question": {"id": "Q63", "variant": 0}, "response": ["Based on my cultural context and socioeconomic background, as a married male from Behaira, Egypt, who is 32 years old and part of the lower class, my trust in people of another nationality would be influenced by my personal experience and individual values. The emic perspective of my community may also play a role in shaping my opinions. Additionally, cultural relativism reminds me that my perspective is not universal, and nuance suggests that my answer may vary depending on the specific nationality in question.\n\n3"]}, {"persona": {"region": "Behaira", "sex": "female", "age": 37, "country": "Egypt", "marital_status": "married", "education": "middle", "social_class": "working class"}, "question": {"id": "Q63", "variant": 0}, "response": ["Based on the anthropological framework, my answer to the question of how much I trust people of another nationality would be influenced by my cultural context as a married female from Behaira, Egypt. My emic perspective would be shaped by the values and experiences of my community, as well as my socioeconomic background as part of the working class. Additionally, my individual values and personal experiences would play a significant role in shaping my trust towards people of another nationality. Furthermore, cultural relativism would also influence my perspective, as I understand that different cultures have different norms and values. Therefore, my answer to the question is:\n\n2"]}, {"persona": {"region": "Behaira", "sex": "male", "age": 48, "country": "Egypt", "marital_status": "married", "education": "middle", "social_class": "working class"}, "question": {"id": "Q63", "variant": 0}, "response": ["Based on my cultural context and personal experience, as a married male from Behaira, Egypt, I have been taught to trust and respect people of all nationalities. My cultural background values hospitality and mutual respect for all individuals, regardless of their nationality. Additionally, my working class background has taught me to rely on the support and cooperation of others, regardless of their nationality, in order to make a living. Therefore, I would choose option (1) Trust completely."]}, {"persona": {"region": "Behaira", "sex": "female", "age": 34, "country": "Egypt", "marital_status": "married", "education": "middle", "social_class": "lower class"}, "question": {"id": "Q63", "variant": 0}, "response": ["Based on my cultural context and socioeconomic background, as a married female from Behaira, Egypt, I have been raised in a community that values trust and mutual support. My lower class status has also made me reliant on the support of others within my community. However, my limited education and exposure to people of other nationalities may lead me to have some reservations in fully trusting individuals from different backgrounds. Additionally, the political and social climate in Egypt may also influence my level of trust towards people of another nationality. Therefore, I would choose option (2) Trust somewhat."]}, {"persona": {"region": "Behaira", "sex": "female", "age": 30, "country": "Egypt", "marital_status": "divorced", "education": "lower", "social_class": "lower class"}, "question": {"id": "Q63", "variant": 0}, "response": ["Based on my emic perspective, as a divorced woman from Behaira, Egypt, I have experienced a lot of hardships and have faced discrimination from others. My cultural context also plays a significant role as I come from a lower socioeconomic background and have limited education. My personal experiences and individual values have shaped my perception of others, and I have learned to be cautious and not trust people from other nationalities completely. Additionally, cultural relativism has taught me to be aware of the nuances in understanding different personas, and I am skeptical of trusting people from other nationalities completely.\n\n3"]}, {"persona": {"region": "Behaira", "sex": "male", "age": 40, "country": "Egypt", "marital_status": "married", "education": "higher", "social_class": "lower middle class"}, "question": {"id": "Q63", "variant": 0}, "response": ["Based on the anthropological framework, my response to the question of how much I trust people of another nationality would be influenced by my emic perspective as a married male from Behaira, Egypt. My cultural context, individual values, and personal experiences shape my perception of other nationalities. As someone from a lower middle-class background in Egypt, my socioeconomic background would also play a role in my trust level. Additionally, cultural relativism teaches me to view other nationalities as equal to my own. Considering all these factors, I would select option (2) Trust somewhat. \n\n2"]}, {"persona": {"region": "Behaira", "sex": "male", "age": 38, "country": "Egypt", "marital_status": "married", "education": "middle", "social_class": "working class"}, "question": {"id": "Q63", "variant": 0}, "response": ["Based on the anthropological framework, my perspective as a married male from Behaira, Egypt, with a middle education level and working-class background, is influenced by my cultural context, individual values, and personal experiences. Egypt has a rich history and a diverse cultural context, and my personal experiences have shaped my understanding and trust of people from other nationalities. Additionally, my socioeconomic background as part of the working class also plays a role in how I perceive and interact with individuals from other nationalities. Considering the nuanced phrasing of the question and the cultural relativism framework, I would choose option (2) Trust somewhat, as my experiences have led me to have a level of cautious trust in people from other nationalities."]}, {"persona": {"region": "Behaira", "sex": "female", "age": 30, "country": "Egypt", "marital_status": "married", "education": "higher", "social_class": "lower class"}, "question": {"id": "Q63", "variant": 0}, "response": ["Based on the anthropological framework, my emic perspective as a married female from Behaira, Egypt, would be influenced by my cultural context, individual values, and socioeconomic background. Being from a lower-class background and having completed higher education, I am likely to have a more nuanced understanding of trust in people of another nationality. My personal experience and values would lead me to trust somewhat, as I have had interactions with people from different nationalities and understand that trust is not absolute and may vary based on individual experiences and circumstances.\n\n2"]}, {"persona": {"region": "Behaira", "sex": "female", "age": 35, "country": "Egypt", "marital_status": "married", "education": "middle", "social_class": "working class"}, "question": {"id": "Q63", "variant": 0}, "response": ["Based on the anthropological framework, as a married female from Behaira, Egypt, my emic perspective is influenced by my cultural context, individual values, and socioeconomic background. In Egyptian society, there is a strong emphasis on close-knit communities, and trust is often placed in those who are part of one's own cultural and national identity. Additionally, as a working-class woman with a middle education level, I may have limited exposure to people of other nationalities and therefore may be more inclined to trust people of my own nationality. Furthermore, my age and place of residence also play a role in shaping my perspective, as Egypt has a complex history and geopolitical context that influences how people view those from other nationalities. Considering these factors, I would be more likely to select option (2) Trust somewhat. \n\n2"]}, {"persona": {"region": "Behaira", "sex": "male", "age": 52, "country": "Egypt", "marital_status": "married", "education": "middle", "social_class": "lower class"}, "question": {"id": "Q63", "variant": 0}, "response": ["Based on the anthropological framework, my emic perspective as a married male from Behaira, Egypt, who is 52 years old and part of the lower class, is heavily influenced by my cultural context, individual values, and socioeconomic background. In Egyptian society, there is a strong emphasis on community and trust within the in-group, and there is also a long history of colonialism and geopolitical tensions with other nationalities. My lower socioeconomic background may also lead me to be more cautious and less trusting of people from other nationalities due to potential power imbalances. Therefore, I would choose option 3: Do not trust very much. \n\n3"]}, {"persona": {"region": "Alexandria", "sex": "female", "age": 41, "country": "Egypt", "marital_status": "single", "education": "middle", "social_class": "lower class"}, "question": {"id": "Q63", "variant": 0}, "response": ["Based on the anthropological framework, my emic perspective as a single female from Alexandria, Egypt, is heavily influenced by my cultural context, individual values, and socioeconomic background. Growing up in a lower-class community in Egypt, I have experienced economic hardships and have developed a sense of caution and skepticism towards people of other nationalities. This is also influenced by the historical and political context of Egypt's relationship with other countries. Additionally, my age and limited education level have shaped my worldview and ability to interact with people from other nationalities. Therefore, my answer to the question would be:\n\n3"]}, {"persona": {"region": "Alexandria", "sex": "female", "age": 21, "country": "Egypt", "marital_status": "single", "education": "middle", "social_class": "lower class"}, "question": {"id": "Q63", "variant": 0}, "response": ["Based on the emic and etic perspectives, as well as the cultural context of being a single female from Alexandria, Egypt, at 21 years of age and part of the lower class, my trust in people of another nationality would be influenced by my personal experience, socioeconomic background, and cultural relativism. Being from a lower socioeconomic background, I may have limited exposure to people from other nationalities and may have been taught to be cautious of them. Additionally, my personal values and experiences may lead me to be more hesitant to trust people of another nationality. Therefore, I would choose option (3) Do not trust very much. \n\n3"]}, {"persona": {"region": "Alexandria", "sex": "female", "age": 35, "country": "Egypt", "marital_status": "married", "education": "middle", "social_class": "lower class"}, "question": {"id": "Q63", "variant": 0}, "response": ["Based on the anthropological framework, as a married woman from Alexandria, Egypt, at the age of 35, with a lower socioeconomic background and middle education level, my perspective on trusting people of another nationality would be influenced by my cultural context, individual values and personal experience, and socioeconomic background. Living in a culturally diverse city like Alexandria, I have had personal interactions with people of different nationalities, which has shaped my understanding and trust towards them. Additionally, my lower socioeconomic status may have limited my exposure to people of other nationalities, leading to a more cautious approach in trusting them. Furthermore, as a woman in a conservative society, I may have been socialized to be wary of outsiders. Therefore, my perspective on trusting people of another nationality would be influenced by a combination of my cultural context, personal experiences, and socioeconomic background.\n\n3"]}, {"persona": {"region": "Alexandria", "sex": "male", "age": 34, "country": "Egypt", "marital_status": "married", "education": "higher", "social_class": "working class"}, "question": {"id": "Q63", "variant": 0}, "response": ["Based on the anthropological framework, my perspective is influenced by my cultural context living in Egypt, where there may be historical or political tensions with people of other nationalities. My individual values and personal experiences also play a role, as I may have had positive or negative interactions with individuals from other nationalities. Additionally, my socioeconomic background as a working-class individual may influence my level of trust, as economic disparities can impact perceptions of others. Considering cultural relativism, I understand that my perspective is subjective and influenced by my own experiences and background. Finally, my age and place of living in Alexandria, Egypt, also factor into my level of trust towards people of another nationality. \n\n2"]}, {"persona": {"region": "Alexandria", "sex": "female", "age": 37, "country": "Egypt", "marital_status": "married", "education": "higher", "social_class": "lower middle class"}, "question": {"id": "Q63", "variant": 0}, "response": ["Based on the anthropological framework, as a married female from Alexandria, Egypt, I would consider the cultural context and individual values to be pivotal in my understanding and response to the question. Egypt has a long history of diverse cultural interactions due to its location and historical significance, and as a result, I have been exposed to people of various nationalities. My personal experience and the values instilled in me by my upbringing have taught me to be open-minded and accepting of others, regardless of their nationality. Additionally, my lower middle-class socioeconomic background has taught me the importance of empathy and understanding, as I have had to rely on the support of others in difficult times. Therefore, I would choose option (2) Trust somewhat, as I believe in giving people the benefit of the doubt and approaching them with an open heart and mind. \n\n2"]}, {"persona": {"region": "Alexandria", "sex": "female", "age": 56, "country": "Egypt", "marital_status": "divorced", "education": "middle", "social_class": "working class"}, "question": {"id": "Q63", "variant": 0}, "response": ["Based on the anthropological framework, my emic perspective as a divorced female from Alexandria, Egypt, who is 56 years old, completed middle education level, and considers myself part of the working class, is heavily influenced by my cultural context, individual values, and socioeconomic background. In Egyptian culture, there is a strong emphasis on trust and hospitality, but there may also be a level of wariness towards outsiders due to historical and political factors. Additionally, my personal experiences and values may lead me to be cautious about trusting people of another nationality, especially given the current global climate. Therefore, I would select the following option:\n\n3"]}, {"persona": {"region": "Alexandria", "sex": "male", "age": 48, "country": "Egypt", "marital_status": "married", "education": "higher", "social_class": "working class"}, "question": {"id": "Q63", "variant": 0}, "response": ["Based on the anthropological framework, my perspective as a married male from Alexandria, Egypt, who is 48 years old and considers himself part of the working class, is heavily influenced by my cultural context, individual values, and personal experience. In Egypt, there is a strong sense of national pride and a history of geopolitical tensions with other countries. Additionally, my personal experiences and values may shape my level of trust towards people of another nationality. I may have had positive interactions with individuals from other nationalities, leading me to trust them completely, or negative experiences that cause me to not trust them very much. Therefore, my response is shaped by a combination of cultural context, individual values, and personal experience.\n\n2"]}, {"persona": {"region": "Alexandria", "sex": "female", "age": 30, "country": "Egypt", "marital_status": "married", "education": "middle", "social_class": "working class"}, "question": {"id": "Q63", "variant": 0}, "response": ["Based on the anthropological framework, my perspective is heavily influenced by my cultural context, individual values and personal experience, as well as my socioeconomic background. As a married female from Alexandria, Egypt, I have been shaped by the cultural norms and values of my community, which emphasize the importance of trust and loyalty within one's own nationality. Additionally, my personal experience and socioeconomic background as a working class individual have likely limited my exposure to people of other nationalities, leading to a more cautious approach towards trusting them. Therefore, I would choose:\n\n3"]}, {"persona": {"region": "Alexandria", "sex": "male", "age": 19, "country": "Egypt", "marital_status": "single", "education": "middle", "social_class": "lower class"}, "question": {"id": "Q63", "variant": 0}, "response": ["Based on the anthropological framework, my perspective as a 19-year-old male from Alexandria, Egypt, who comes from a lower socioeconomic background, is heavily influenced by my cultural context, individual values, and personal experiences. Growing up in a community where there is a lot of economic disparity has made me more cautious and less trusting of people outside of my own nationality. Additionally, the historical and political context of Egypt has also shaped my perceptions of other nationalities. I have also had personal experiences that have reinforced this lack of trust. Therefore, I would choose option (3) Do not trust very much.\n\n3"]}, {"persona": {"region": "Alexandria", "sex": "male", "age": 45, "country": "Egypt", "marital_status": "married", "education": "middle", "social_class": "lower middle class"}, "question": {"id": "Q63", "variant": 0}, "response": ["Based on the anthropological framework, my individual values and personal experiences as a married male from Alexandria, Egypt, who is part of the lower middle class, play a significant role in shaping my trust towards people of another nationality. My cultural context, including my socioeconomic background and lived experiences, has taught me to approach this question with caution and to not trust very much. Additionally, considering the emic and etic perspectives, I have also observed and heard about negative experiences with people from other nationalities, which further influences my level of trust. Therefore, I choose:\n\n3"]}, {"persona": {"region": "Alexandria", "sex": "male", "age": 23, "country": "Egypt", "marital_status": "single", "education": "higher", "social_class": "lower class"}, "question": {"id": "Q63", "variant": 0}, "response": ["Based on the anthropological framework, my personal experience as a single male from Alexandria, Egypt, plays a significant role in shaping my perception and level of trust towards people of another nationality. As a member of the lower class, my socioeconomic background influences my interactions and relationships with individuals from different nationalities. Additionally, the cultural context of Alexandria, Egypt, and my age also contribute to my perspective on trust. Considering the emic and etic perspectives, I recognize that my in-group ways of thinking may lead me to trust others somewhat, as I have had positive interactions with people of other nationalities in my personal experience. However, the out-group ways of thinking may lead me to not trust very much due to societal and cultural influences. Therefore, I choose option 2) Trust somewhat."]}, {"persona": {"region": "Alexandria", "sex": "female", "age": 28, "country": "Egypt", "marital_status": "married", "education": "middle", "social_class": "working class"}, "question": {"id": "Q63", "variant": 0}, "response": ["Based on the anthropological framework, as a married female from Alexandria, Egypt, my emic perspective would be influenced by my cultural context, individual values, and socioeconomic background. In Egypt, there is a strong sense of national identity and pride, which may lead to a higher level of trust towards people of another nationality, especially if they are perceived as being similar in cultural values and practices. Additionally, as a working-class individual with a middle education level, I may have limited exposure to individuals from other nationalities, leading to a more cautious level of trust. Taking into account my personal experience and cultural relativism, I would choose option (2) Trust somewhat. \n\n2"]}, {"persona": {"region": "Alexandria", "sex": "male", "age": 34, "country": "Egypt", "marital_status": "single", "education": "higher", "social_class": "working class"}, "question": {"id": "Q63", "variant": 0}, "response": ["Based on the anthropological framework, as a 34-year-old single male from Alexandria, Egypt, who completed higher education and considers myself part of the working class, I would answer this question with the consideration of emic and etic perspectives. My cultural context, individual values, and personal experience would influence my response, as well as my socioeconomic background and the cultural relativism prevalent in my community. Additionally, my space and time, as well as the nuance of the question, would also play a role in my answer. \n\n2"]}, {"persona": {"region": "Alexandria", "sex": "male", "age": 30, "country": "Egypt", "marital_status": "married", "education": "higher", "social_class": "lower middle class"}, "question": {"id": "Q63", "variant": 0}, "response": ["Based on my emic perspective as a married male from Alexandria, Egypt, I am influenced by the cultural context of my upbringing and the socio-economic background of the lower middle class. My personal values and experiences have shaped my understanding of trust and my interactions with people of other nationalities. Additionally, the cultural relativism of my community and the nuance of the question also play a role in my response. Therefore, I choose:\n2"]}, {"persona": {"region": "Alexandria", "sex": "female", "age": 49, "country": "Egypt", "marital_status": "married", "education": "higher", "social_class": "lower middle class"}, "question": {"id": "Q63", "variant": 0}, "response": ["Based on the anthropological framework, my emic perspective as a married female from Alexandria, Egypt, would be influenced by my cultural context, individual values, and socioeconomic background. In Egyptian culture, there is a strong emphasis on hospitality and trust in interpersonal relationships, which would lead me to generally trust people of another nationality somewhat. Additionally, my personal experience and socioeconomic background as a lower-middle-class individual with a higher education level would likely make me more open-minded and willing to engage with people from diverse backgrounds. Therefore, my response would be influenced by a combination of cultural values, personal experience, and socioeconomic factors, leading me to trust people of another nationality somewhat.\n\n2"]}, {"persona": {"region": "Kafr el-sheikh", "sex": "male", "age": 49, "country": "Egypt", "marital_status": "married", "education": "higher", "social_class": "working class"}, "question": {"id": "Q63", "variant": 0}, "response": ["Based on the anthropological framework, my perspective as a married male from Kafr el-sheikh, Egypt, at 49 years of age with a working-class background and higher education, is influenced by my cultural context, individual values, and personal experience. In my community, there is a strong emphasis on trust and solidarity within our own nationality, and there may be some skepticism towards people of another nationality due to historical and geopolitical factors. However, my higher education has allowed me to have a more nuanced understanding of cultural relativism and the importance of empathy and understanding towards others. Therefore, I would choose option (2) Trust somewhat. \n\n2"]}, {"persona": {"region": "Kafr el-sheikh", "sex": "male", "age": 25, "country": "Egypt", "marital_status": "single", "education": "middle", "social_class": "lower middle class"}, "question": {"id": "Q63", "variant": 0}, "response": ["Based on the anthropological framework, my emic perspective as a single male from Kafr el-sheikh, Egypt, who completed middle education and considers himself part of the lower middle class, is heavily influenced by my cultural context, individual values, and socioeconomic background. Growing up in a small town in Egypt, I have learned to trust and rely on those in my immediate community and have limited exposure to people of other nationalities. Additionally, my lower middle class status may lead me to be cautious in my interactions with those from other nationalities due to a lack of resources and social capital. Therefore, I would choose option (3) Do not trust very much. \n\n3"]}, {"persona": {"region": "Kafr el-sheikh", "sex": "male", "age": 59, "country": "Egypt", "marital_status": "married", "education": "higher", "social_class": "lower middle class"}, "question": {"id": "Q63", "variant": 0}, "response": ["Based on the anthropological framework, my perspective is heavily influenced by my cultural context, individual values, and socioeconomic background. As a married male from Kafr el-sheikh, Egypt, my upbringing and experiences have instilled in me a sense of community and trust within my own nationality. However, as someone who has completed higher education and considers myself part of the lower middle class, I have also been exposed to different perspectives and understand the importance of trust in building relationships with people of other nationalities. Therefore, I would say that I trust somewhat people of another nationality. \n\n2"]}, {"persona": {"region": "Kafr el-sheikh", "sex": "female", "age": 38, "country": "Egypt", "marital_status": "married", "education": "middle", "social_class": "working class"}, "question": {"id": "Q63", "variant": 0}, "response": ["Based on my emic perspective as a married female from Kafr el-sheikh, Egypt, I understand that my cultural context plays a significant role in shaping my trust towards people of another nationality. My personal experiences and individual values are also influenced by my socioeconomic background as part of the working class. Additionally, cultural relativism teaches me to approach this question without judgment or hierarchy. Lastly, space and time are important factors, and my nuanced understanding of the question leads me to select option (2) Trust somewhat. \n\n2"]}, {"persona": {"region": "Kafr el-sheikh", "sex": "male", "age": 35, "country": "Egypt", "marital_status": "married", "education": "higher", "social_class": "lower middle class"}, "question": {"id": "Q63", "variant": 0}, "response": ["Based on the anthropological framework, my emic perspective as a married male from Kafr el-sheikh, Egypt, who is 35 years old and part of the lower middle class, is influenced by my cultural context, individual values, and socioeconomic background. Growing up in a community with diverse nationalities and experiencing economic challenges, I have learned to be cautious in trusting people of another nationality. This is not due to a lack of cultural relativism, but rather a result of my personal experiences and the socioeconomic dynamics of my upbringing. As a result, I would choose option (2) Trust somewhat. \n\n2"]}, {"persona": {"region": "Kafr el-sheikh", "sex": "male", "age": 49, "country": "Egypt", "marital_status": "married", "education": "middle", "social_class": "lower class"}, "question": {"id": "Q63", "variant": 0}, "response": ["Based on my emic perspective as a married male from Kafr el-sheikh, Egypt, I have grown up in a community where there is a strong sense of in-group loyalty and trust. The cultural context of my upbringing has taught me to value my kinship networks and to prioritize relationships within my own community. Additionally, my lower socioeconomic background has led me to be more cautious and guarded in my interactions with people from other nationalities, as I have had limited exposure to individuals outside of my own cultural and socioeconomic sphere. Furthermore, the nuance of the question leads me to choose option (2) Trust somewhat.\n\n2"]}, {"persona": {"region": "Kafr el-sheikh", "sex": "male", "age": 37, "country": "Egypt", "marital_status": "married", "education": "middle", "social_class": "lower class"}, "question": {"id": "Q63", "variant": 0}, "response": ["Based on the anthropological framework, as a married male from Kafr el-sheikh, Egypt, my emic perspective would be influenced by my cultural context, individual values, and socioeconomic background. In my community, there is a strong sense of community and trust within our own nationality, and there may be a tendency to be more cautious or reserved in trusting people of another nationality. This is influenced by our cultural relativism and the nuanced phrasing of the question. Additionally, my lower class socioeconomic background may also play a role in my level of trust. Therefore, I would choose:\n\n2"]}, {"persona": {"region": "Menofia", "sex": "female", "age": 22, "country": "Egypt", "marital_status": "single", "education": "middle", "social_class": "lower class"}, "question": {"id": "Q63", "variant": 0}, "response": ["Based on my emic perspective as a single female from Menofia, Egypt, and considering my cultural context, individual values, and socioeconomic background, I would choose option (2) Trust somewhat. As someone from a lower socioeconomic background in Egypt, I have limited exposure to people of other nationalities and may have some reservations due to lack of personal experience and exposure. Additionally, cultural relativism plays a role in my understanding as I may have been taught to be cautious of people from other nationalities due to cultural differences. However, I also understand the importance of being open-minded and recognizing that not all people from other nationalities are untrustworthy, hence the choice to trust somewhat."]}, {"persona": {"region": "Menofia", "sex": "female", "age": 25, "country": "Egypt", "marital_status": "married", "education": "middle", "social_class": "lower class"}, "question": {"id": "Q63", "variant": 0}, "response": ["Based on my cultural context, as a married female from Menofia, Egypt, I have been raised in a community where trust is very important, especially given my lower socioeconomic background. I have been taught to be cautious and not trust very much, especially when it comes to people of another nationality. My individual values and personal experiences have also shaped my perception of trust, and I have learned to be wary of trusting others outside of my own community. Additionally, cultural relativism plays a role in my understanding, as I have been taught to prioritize the safety and well-being of my family and community over trusting outsiders. Therefore, my perspective is that I do not trust very much.\n\n3"]}, {"persona": {"region": "Menofia", "sex": "male", "age": 28, "country": "Egypt", "marital_status": "single", "education": "higher", "social_class": "working class"}, "question": {"id": "Q63", "variant": 0}, "response": ["Based on the anthropological framework, my perspective as a single male from Menofia, Egypt, who is 28 years old and part of the working class, is influenced by my cultural context, individual values and personal experience, and socioeconomic background. In Egyptian culture, trust is often built on personal relationships and kinship networks, and there may be a level of skepticism or caution towards people from other nationalities due to historical and geopolitical factors. Additionally, as someone from the working class, I may have limited exposure to individuals from other nationalities and therefore may have a more cautious approach. However, my higher education level may have exposed me to diverse perspectives and experiences, leading me to have a somewhat trusting attitude towards people of another nationality. Therefore, I would choose option (2) Trust somewhat."]}, {"persona": {"region": "Menofia", "sex": "male", "age": 35, "country": "Egypt", "marital_status": "married", "education": "middle", "social_class": "lower middle class"}, "question": {"id": "Q63", "variant": 0}, "response": ["Based on my emic perspective as a married male from Menofia, Egypt, my cultural context and socioeconomic background play a significant role in shaping my trust towards people of another nationality. Living in a lower middle class community and having completed only middle education, I have limited exposure to individuals from other nationalities. My individual values and personal experiences have led me to be cautious in trusting people of another nationality, as I have not had the opportunity to interact with them extensively. Additionally, cultural relativism reminds me that my perspective is shaped by my own cultural context, and I cannot assume that others from different nationalities share the same values and beliefs as me. Therefore, I would choose option (3) Do not trust very much. \n\n3"]}, {"persona": {"region": "Menofia", "sex": "male", "age": 55, "country": "Egypt", "marital_status": "married", "education": "middle", "social_class": "working class"}, "question": {"id": "Q63", "variant": 0}, "response": ["Based on my emic perspective as a married male from Menofia, Egypt, I have grown up in a community where trust is highly valued and is based on long-standing relationships within our cultural context. My individual values and personal experience have shaped my understanding of trust, and I have learned to trust people of other nationalities to some extent, but not completely. Additionally, my socioeconomic background as part of the working class has influenced my perception of trust, as I have had to rely on trust within my community for support and cooperation. Furthermore, cultural relativism is important in my understanding, as I recognize that different nationalities may have different cultural norms and values that impact trust. Lastly, space and time play a role in my perspective, as my age and place of origin have shaped my trust in people of other nationalities. Therefore, based on my background and experiences, I would choose:\n\n2) Trust somewhat"]}, {"persona": {"region": "Menofia", "sex": "male", "age": 53, "country": "Egypt", "marital_status": "married", "education": "higher", "social_class": "lower middle class"}, "question": {"id": "Q63", "variant": 0}, "response": ["From the perspective of a married male from Menofia, Egypt, cultural context is pivotal in understanding and answering this question. The individual values and personal experience of this persona are also important factors in shaping his perceptions. Being from a lower middle-class background and having completed higher education, he likely has a nuanced understanding of trust and relationships with people from other nationalities. Additionally, space and time play a role in his perceptions, as Egypt has a complex history of interactions with other nationalities. Considering these factors, he would likely choose the option to trust somewhat, as his personal experiences and cultural context would lead him to have a cautious approach to trusting people of another nationality.\n\n2"]}, {"persona": {"region": "Menofia", "sex": "male", "age": 59, "country": "Egypt", "marital_status": "married", "education": "middle", "social_class": "working class"}, "question": {"id": "Q63", "variant": 0}, "response": ["Based on my cultural context and socioeconomic background, I understand that my experiences and values may be different from those of others. As a married male from Menofia, Egypt, I have learned to trust people based on their actions and behavior, rather than their nationality. I have also been taught to be wary of those who may not have my best interests at heart. Therefore, I would choose option (2) Trust somewhat."]}, {"persona": {"region": "Menofia", "sex": "female", "age": 42, "country": "Egypt", "marital_status": "married", "education": "middle", "social_class": "lower middle class"}, "question": {"id": "Q63", "variant": 0}, "response": ["In answering the question of how much I trust people of another nationality, I must consider my emic perspective as a married woman from Menofia, Egypt. My cultural context and individual values shape my understanding, as does my lower middle class socioeconomic background. Additionally, my age and education level play a role in my perceptions. From this perspective, I would choose option 2, trust somewhat. This is because I have had limited interactions with people from other nationalities due to my socioeconomic status and location, but I have been exposed to some positive experiences and am open to trusting them to a certain extent. \n\n2"]}, {"persona": {"region": "Menofia", "sex": "male", "age": 39, "country": "Egypt", "marital_status": "married", "education": "higher", "social_class": "working class"}, "question": {"id": "Q63", "variant": 0}, "response": ["Based on the anthropological framework, my answer to the question of how much I trust people of another nationality would be influenced by my cultural context, individual values, and socioeconomic background. As someone from Menofia, Egypt, I am aware of the importance of cultural relativism and the nuances of different perspectives. My personal experience and values also play a significant role in shaping my trust towards people of another nationality. Additionally, my working-class background and higher education level have provided me with a nuanced understanding of the world, leading me to trust somewhat in people of another nationality. \n\n2"]}, {"persona": {"region": "Menofia", "sex": "male", "age": 34, "country": "Egypt", "marital_status": "married", "education": "middle", "social_class": "lower middle class"}, "question": {"id": "Q63", "variant": 0}, "response": ["In my cultural context, as a married male from Menofia, Egypt, my trust in people of another nationality is influenced by my individual values and personal experiences. My socioeconomic background as part of the lower middle class also plays a role in shaping my perceptions. Additionally, the emic and etic perspectives within my community may impact my level of trust in people of another nationality. Furthermore, cultural relativism is a key factor in understanding my perspective, as it is important to recognize that different cultures may have different social norms and values. Lastly, age and place also contribute to my nuanced understanding of this question. \n\n2"]}, {"persona": {"region": "Menofia", "sex": "male", "age": 22, "country": "Egypt", "marital_status": "single", "education": "higher", "social_class": "working class"}, "question": {"id": "Q63", "variant": 0}, "response": ["Based on the anthropological framework, as a single male from Menofia, Egypt, who has completed higher education and considers himself part of the working class, my perspective on trusting people of another nationality is influenced by my cultural context, individual values, and socioeconomic background. In Menofia, there is a strong sense of community and trust within the local culture, but there may also be a level of skepticism towards outsiders due to historical and geopolitical factors. Additionally, my higher education has exposed me to different perspectives and worldviews, leading me to be open to trusting people of another nationality. As part of the working class, I understand the importance of building relationships and trust with others, regardless of nationality, in order to navigate social and economic opportunities. Therefore, I choose:\n\n2"]}, {"persona": {"region": "Menofia", "sex": "male", "age": 21, "country": "Egypt", "marital_status": "single", "education": "middle", "social_class": "working class"}, "question": {"id": "Q63", "variant": 0}, "response": ["Based on the anthropological framework, my emic perspective as a single male from Menofia, Egypt, with a middle education level and working-class background, influences my perception of trust towards people of another nationality. My cultural context, individual values, and personal experience shape my views. I have limited exposure to people from other nationalities and have not had the opportunity to develop strong trust bonds with them. Additionally, my socioeconomic background may also contribute to a sense of caution or wariness towards people of another nationality. Therefore, I choose option (2) Trust somewhat. \n\n2"]}, {"persona": {"region": "Menofia", "sex": "male", "age": 36, "country": "Egypt", "marital_status": "married", "education": "higher", "social_class": "working class"}, "question": {"id": "Q63", "variant": 0}, "response": ["Based on the anthropological framework, my understanding of trust towards people of another nationality is influenced by my cultural context, individual values, and socioeconomic background. As someone from Menofia, Egypt, I am aware of the importance of cultural relativism and the nuances of interpersonal relationships. My personal experiences and values also play a significant role in shaping my perceptions. Additionally, my working-class background may influence my level of trust towards people of another nationality. Therefore, I would choose option (2) Trust somewhat. \n\n2"]}, {"persona": {"region": "Menofia", "sex": "female", "age": 52, "country": "Egypt", "marital_status": "married", "education": "higher", "social_class": "lower middle class"}, "question": {"id": "Q63", "variant": 0}, "response": ["Based on the anthropological framework, as a married female from Menofia, Egypt, my emic perspective is likely to be influenced by my cultural context, individual values, and socioeconomic background. In Egyptian culture, trust and relationships are highly valued, and my personal experience living in Menofia has likely shaped my perception of people from other nationalities. Additionally, my lower middle-class socioeconomic background may influence my level of trust, as I may have limited exposure to people from other nationalities due to financial constraints. Therefore, I would choose option 2: Trust somewhat, as I may have some level of trust in people from other nationalities based on my personal experiences and cultural values. \n\n2"]}, {"persona": {"region": "Menofia", "sex": "male", "age": 52, "country": "Egypt", "marital_status": "married", "education": "higher", "social_class": "lower middle class"}, "question": {"id": "Q63", "variant": 0}, "response": ["Based on the anthropological framework, my response to the question of how much I trust people of another nationality would be based on a combination of my individual values, personal experiences, and cultural context. As a married male from Menofia, Egypt, I have been shaped by my cultural context which values hospitality and generosity towards others. However, my socioeconomic background as part of the lower middle class and my age of 52 may also influence my level of trust. Additionally, having completed a higher education level, I may have been exposed to different perspectives and worldviews, leading me to trust people of another nationality somewhat. Therefore, my chosen answer is:\n2. Trust somewhat"]}, {"persona": {"region": "Menofia", "sex": "male", "age": 39, "country": "Egypt", "marital_status": "married", "education": "middle", "social_class": "lower class"}, "question": {"id": "Q63", "variant": 0}, "response": ["Based on my cultural context, as a married male from Menofia, Egypt, my trust in people of another nationality may be influenced by the historical and political relations between Egypt and that specific nationality. Additionally, my lower class socioeconomic background may lead me to be more cautious and less trusting of people from other nationalities due to potential power imbalances and economic disparities. The emic perspective of my personal experience and individual values also plays a role in shaping my trust levels. Therefore, I would choose option 2: Trust somewhat. \n\n2"]}, {"persona": {"region": "Menofia", "sex": "male", "age": 23, "country": "Egypt", "marital_status": "single", "education": "middle", "social_class": "lower middle class"}, "question": {"id": "Q63", "variant": 0}, "response": ["Based on the framework of emic and etic perspectives, cultural context, individual values and personal experience, socioeconomic background, cultural relativism, space and time, and nuance, as a 23-year-old single male from Menofia, Egypt, with a middle education level and a lower middle class background, my answer to the question on trust towards people of another nationality would be influenced by my personal experience and cultural context. Growing up in a lower middle class household in Egypt, I have been exposed to a variety of nationalities and have learned to trust others somewhat. However, due to socioeconomic factors and the cultural context in which I was raised, I may not trust people of another nationality completely. Additionally, cultural relativism and the nuance of the question may also play a role in my response, as I consider the specific circumstances and relationships with individuals of other nationalities in my life.\n\n2"]}, {"persona": {"region": "Dakahlia", "sex": "female", "age": 24, "country": "Egypt", "marital_status": "single", "education": "higher", "social_class": "lower middle class"}, "question": {"id": "Q63", "variant": 0}, "response": ["Based on my emic perspective as a single female from Dakahlia, Egypt, cultural context plays a pivotal role in my understanding and answering of this question. As a member of the lower middle class and having completed higher education, my individual values and personal experiences also play a significant role in shaping my perceptions. Additionally, my socioeconomic background, age, and place of origin are important factors in how I view and trust people of another nationality. Considering cultural relativism, I understand that there is no hierarchy of culture, and my nuanced understanding of the question leads me to choose option (2) Trust somewhat. \n\n2"]}, {"persona": {"region": "Dakahlia", "sex": "male", "age": 36, "country": "Egypt", "marital_status": "married", "education": "higher", "social_class": "upper middle class"}, "question": {"id": "Q63", "variant": 0}, "response": ["Based on the anthropological framework, my emic perspective as a married male from Dakahlia, Egypt, who is 36 years old, highly educated, and part of the upper middle class, is influenced by my cultural context, individual values, and personal experience. In Egyptian society, there is a strong sense of national pride and a history of valuing education and social status. Additionally, my socioeconomic background as part of the upper middle class likely means that I have had positive interactions with people from various nationalities due to my access to education and resources. Therefore, I would trust people of another nationality somewhat, as my personal experience and cultural context have likely shaped my perception to be more open-minded and trusting towards individuals from different backgrounds.\n\n2"]}, {"persona": {"region": "Dakahlia", "sex": "female", "age": 71, "country": "Egypt", "marital_status": "married", "education": "higher", "social_class": "upper middle class"}, "question": {"id": "Q63", "variant": 0}, "response": ["From the emic and etic perspectives, as a married female from Dakahlia, Egypt, my trust in people of another nationality is influenced by my cultural context, individual values, and personal experience. In Egypt, there is a history of being open and welcoming to people of other nationalities, and as someone who has completed higher education and considers myself part of the upper middle class, I have been exposed to diverse perspectives and have had positive interactions with people from different nationalities. Additionally, my age and socioeconomic background also play a role in shaping my trust in people of another nationality. Based on this, my answer would be:\n2"]}, {"persona": {"region": "Dakahlia", "sex": "male", "age": 55, "country": "Egypt", "marital_status": "married", "education": "higher", "social_class": "upper middle class"}, "question": {"id": "Q63", "variant": 0}, "response": ["Based on my Emic and Etic perspective, as a married male from Dakahlia, Egypt, I have been brought up to trust people within my own nationality more than those from other nationalities. This is influenced by my cultural context, where there is a strong emphasis on loyalty to one's own community. Additionally, my individual values and personal experience have shaped my trust in people from other nationalities. As someone who has completed higher education and considers myself part of the upper middle class, I have had exposure to different cultures and have interacted with people from other nationalities. However, my socioeconomic background has also played a role in influencing my trust levels. Therefore, I choose option (2) Trust somewhat, as I have had positive experiences with individuals from other nationalities but still have some reservations based on my cultural upbringing and personal values."]}, {"persona": {"region": "Dakahlia", "sex": "male", "age": 64, "country": "Egypt", "marital_status": "married", "education": "higher", "social_class": "lower middle class"}, "question": {"id": "Q63", "variant": 0}, "response": ["Based on the anthropological framework, as a married male from Dakahlia, Egypt, my cultural context, individual values, and personal experience heavily influence my perception of trust towards people of another nationality. Coming from a lower middle-class background, my socioeconomic status may also impact my trust levels. Additionally, my age and education level contribute to my understanding of different cultures and my ability to empathize with individuals from other nationalities. Considering the emic and etic perspectives, as well as the cultural relativism, I would choose option (2) Trust somewhat, as I believe in giving others the benefit of the doubt while still being cautious."]}, {"persona": {"region": "Dakahlia", "sex": "female", "age": 29, "country": "Egypt", "marital_status": "married", "education": "middle", "social_class": "lower class"}, "question": {"id": "Q63", "variant": 0}, "response": ["Based on the anthropological framework, my perspective as a married female from Dakahlia, Egypt, who is 29 years old, has completed middle education, and considers herself part of the lower class, is heavily influenced by my cultural context, individual values and personal experience, and socioeconomic background. Living in a lower-income area and having limited education, I have had limited exposure to people of other nationalities. Additionally, the cultural context of Egypt and the socioeconomic background of my community may lead me to have limited trust in people of other nationalities due to the lack of familiarity and potential economic disparities. Therefore, I would choose option (3) - Do not trust very much. \n\n3"]}, {"persona": {"region": "Dakahlia", "sex": "female", "age": 40, "country": "Egypt", "marital_status": "married", "education": "middle", "social_class": "upper middle class"}, "question": {"id": "Q63", "variant": 0}, "response": ["Based on the anthropological framework, my cultural context as a married female from Dakahlia, Egypt, where kinship networks and social relationships are highly valued, shapes my understanding of trust. My individual values and personal experiences, along with my upper-middle-class socioeconomic background, also influence my perception of trust. Additionally, cultural relativism and the nuance of the question are crucial in my response. Therefore, I choose the following answer:\n\n2) Trust somewhat"]}, {"persona": {"region": "Dakahlia", "sex": "male", "age": 37, "country": "Egypt", "marital_status": "married", "education": "higher", "social_class": "lower middle class"}, "question": {"id": "Q63", "variant": 0}, "response": ["From an emic perspective, as a married male from Dakahlia, Egypt, my cultural context and personal experience play a significant role in shaping my trust towards people of another nationality. Egypt has a long history of interaction with people from various nationalities, especially due to its geographical location and historical significance. My individual values and personal experience also contribute to this, as I have had positive interactions with people from other nationalities in my education and professional life. Additionally, my socioeconomic background as part of the lower middle class has influenced my understanding of the importance of trust in building relationships with people from different backgrounds. Considering cultural relativism, I understand that trust is subjective and can vary based on individual experiences and cultural differences. Therefore, I would answer the question with option (2) Trust somewhat, as I believe in giving people the benefit of the doubt while also being cautious due to my personal experiences and cultural context. \n\n2"]}, {"persona": {"region": "Dakahlia", "sex": "female", "age": 45, "country": "Egypt", "marital_status": "married", "education": "middle", "social_class": "working class"}, "question": {"id": "Q63", "variant": 0}, "response": ["Based on the anthropological framework, my cultural context as a married female from Dakahlia, Egypt, and my middle education level have shaped my perceptions. Additionally, my working-class background and age play a role in how I perceive the world. I understand that cultural relativism is crucial, and I value personal experience and individual values in shaping my perspectives. I also recognize the importance of nuance in answering questions. Considering all of this, I choose:\n\n2"]}, {"persona": {"region": "Dakahlia", "sex": "male", "age": 34, "country": "Egypt", "marital_status": "single", "education": "middle", "social_class": "lower middle class"}, "question": {"id": "Q63", "variant": 0}, "response": ["Based on the anthropological framework, as a single male from Dakahlia, Egypt, my emic perspective would be influenced by my cultural context, individual values, and socioeconomic background. Living in a lower middle class area, my trust in people of another nationality may be somewhat influenced by my limited exposure and resources. Additionally, my personal experiences and values may play a role in shaping my perceptions. Therefore, I would choose option (2) Trust somewhat."]}, {"persona": {"region": "Dakahlia", "sex": "female", "age": 26, "country": "Egypt", "marital_status": "married", "education": "higher", "social_class": "upper middle class"}, "question": {"id": "Q63", "variant": 0}, "response": ["Based on the anthropological framework, as a married female from Dakahlia, Egypt, who is 26 years old and part of the upper middle class, I would consider my cultural context, individual values, and personal experiences to shape my perspective on trust towards people of another nationality. In Egypt, there is a strong sense of national pride and a history of political and social tension with other nations. Additionally, as someone with a higher education level and a privileged socioeconomic background, I may have had limited exposure to individuals of other nationalities and may have been influenced by stereotypes or prejudices. Therefore, I would choose option (2) Trust somewhat, as I may have some reservations based on cultural and personal experiences, but I also recognize the importance of openness and understanding towards individuals from other nationalities. \n\n2"]}, {"persona": {"region": "Dakahlia", "sex": "male", "age": 21, "country": "Egypt", "marital_status": "single", "education": "middle", "social_class": "upper middle class"}, "question": {"id": "Q63", "variant": 0}, "response": ["Based on my emic perspective as a single male from Dakahlia, Egypt, I have grown up in a cultural context that values hospitality and respect for others. My personal experience and individual values have shaped my understanding of trust, and as part of the upper middle class, I have interacted with people from different nationalities in a positive way. Additionally, cultural relativism and the nuance of the question lead me to believe that I would trust people of another nationality somewhat, as I understand the importance of building relationships and connections with individuals from diverse backgrounds.\n\n2"]}, {"persona": {"region": "Dakahlia", "sex": "female", "age": 32, "country": "Egypt", "marital_status": "married", "education": "middle", "social_class": "working class"}, "question": {"id": "Q63", "variant": 0}, "response": ["In considering the question of how much I trust people of another nationality, I must take into account my cultural context as a married female from Dakahlia, Egypt. In my community, there is a strong sense of kinship and loyalty to one's own nationality and culture. However, as a working-class individual, I also recognize the importance of building relationships and connections with people from other nationalities, especially in the context of globalized work environments. My individual values and personal experiences have taught me to approach people from other nationalities with an open mind and a degree of trust, as I have had positive interactions with individuals from diverse backgrounds. Additionally, my socioeconomic background has instilled in me the understanding that trust is essential for collaboration and professional relationships, regardless of nationality. Therefore, from my perspective, I would choose:\n\n2) Trust somewhat"]}, {"persona": {"region": "Dakahlia", "sex": "female", "age": 35, "country": "Egypt", "marital_status": "married", "education": "middle", "social_class": "upper middle class"}, "question": {"id": "Q63", "variant": 0}, "response": ["Based on the anthropological framework, as a married female from Dakahlia, Egypt, my emic perspective would be influenced by my cultural context, individual values, and socioeconomic background. In Egyptian culture, there is a strong emphasis on community and trust within the in-group, but there may be some skepticism or wariness towards people from other nationalities due to historical and geopolitical factors. Additionally, as part of the upper middle class, I may have had more exposure to people of different nationalities and therefore may be more open to trusting them to some extent. Considering these factors, I would choose option (2) Trust somewhat. \n\n2"]}, {"persona": {"region": "Dakahlia", "sex": "male", "age": 33, "country": "Egypt", "marital_status": "married", "education": "middle", "social_class": "upper middle class"}, "question": {"id": "Q63", "variant": 0}, "response": ["Based on my emic perspective as a married male from Dakahlia, Egypt, I have been raised in a cultural context where trust in people of another nationality is influenced by historical and political factors. My personal experience and individual values also play a significant role in shaping my perception of trust towards people of another nationality. Additionally, my socioeconomic background as part of the upper middle class has provided me with certain privileges and opportunities that may affect my level of trust. Furthermore, cultural relativism is important in understanding that my perspective may differ from others based on space and time, as well as nuanced phrasing of the question.\n\n2"]}, {"persona": {"region": "Dakahlia", "sex": "female", "age": 45, "country": "Egypt", "marital_status": "married", "education": "middle", "social_class": "upper middle class"}, "question": {"id": "Q63", "variant": 0}, "response": ["Based on my emic perspective, as a married female from Dakahlia, Egypt, I have been raised in a culture that values trust and respect for others. My cultural context has taught me to be open-minded and respectful of people from different nationalities. My individual values and personal experience have also shaped my belief that trust is essential in building relationships, regardless of nationality. Additionally, my socioeconomic background as part of the upper middle class has provided me with opportunities to interact with people from diverse backgrounds, leading me to trust people of other nationalities. Considering the principles of cultural relativism, I understand that trust is a universal value and should not be limited by nationality. Therefore, based on my nuanced understanding of the question, I choose option (2) Trust somewhat. \n\n2"]}, {"persona": {"region": "Dakahlia", "sex": "male", "age": 30, "country": "Egypt", "marital_status": "married", "education": "middle", "social_class": "upper middle class"}, "question": {"id": "Q63", "variant": 0}, "response": ["Based on my emic perspective as a married male from Dakahlia, Egypt, I have been raised in a cultural context where trust in people of other nationalities is influenced by historical and geopolitical factors. My individual values and personal experiences have also shaped my perception of trust, and as someone from the upper middle class, I have had more exposure to different nationalities and may have developed a certain level of trust. Additionally, my socioeconomic background has provided me with opportunities to interact with individuals from other nationalities, further influencing my level of trust. Considering cultural relativism, I understand that my perspective on trust may differ from others based on their own cultural backgrounds. Furthermore, space and time, as well as the nuanced phrasing of the question, also play a role in my response. Therefore, based on my perspective, I choose option (2) Trust somewhat. \n\n2"]}, {"persona": {"region": "Dakahlia", "sex": "female", "age": 63, "country": "Egypt", "marital_status": "married", "education": "higher", "social_class": "lower middle class"}, "question": {"id": "Q63", "variant": 0}, "response": ["Based on the anthropological framework, my emic perspective as a married female from Dakahlia, Egypt, who is 63 years old and part of the lower middle class, is influenced by my cultural context, individual values, and socioeconomic background. In Dakahlia, there is a strong sense of community and trust within our own nationality, but there may be some skepticism towards people of other nationalities due to historical and cultural differences. My personal experience and values also play a role in shaping my level of trust towards people of another nationality. Additionally, my socioeconomic background as part of the lower middle class may influence my perception of trust, as economic disparities can impact interactions with people of other nationalities. Taking into account cultural relativism, I would approach this question with a nuanced understanding, recognizing that trust levels towards people of another nationality may vary depending on the specific context and individual experiences.\n\n2"]}, {"persona": {"region": "Dakahlia", "sex": "male", "age": 28, "country": "Egypt", "marital_status": "single", "education": "higher", "social_class": "upper middle class"}, "question": {"id": "Q63", "variant": 0}, "response": ["Based on the anthropological framework, I, as a single male from Dakahlia, Egypt, aged 28 and part of the upper middle class, would consider my response to the question of trusting people of another nationality to be influenced by my cultural context, individual values, and personal experience. As someone who has completed higher education, I have been exposed to different perspectives and have the ability to critically analyze situations. My socioeconomic background also plays a role in my answer, as I may have had more opportunities to interact with people from other nationalities. Additionally, cultural relativism is important to consider, as I understand that different nationalities have their own unique cultural norms and values. Therefore, my answer would be influenced by these factors.\n\n2"]}, {"persona": {"region": "Dakahlia", "sex": "female", "age": 24, "country": "Egypt", "marital_status": "married", "education": "higher", "social_class": "upper middle class"}, "question": {"id": "Q63", "variant": 0}, "response": ["Based on the anthropological framework, as a married female from Dakahlia, Egypt, my emic perspective and cultural context play a significant role in my perception of trust towards people of another nationality. In my cultural context, there is a strong emphasis on hospitality and respect for others, regardless of nationality. Additionally, as someone who has completed higher education and considers myself part of the upper middle class, I have been exposed to diverse perspectives and have learned to value open-mindedness and understanding of different cultures. Therefore, I would choose option (2) Trust somewhat as my answer. \n\n2"]}, {"persona": {"region": "Dakahlia", "sex": "male", "age": 20, "country": "Egypt", "marital_status": "single", "education": "middle", "social_class": "upper middle class"}, "question": {"id": "Q63", "variant": 0}, "response": ["Based on the anthropological framework, as a 20-year-old single male from Dakahlia, Egypt, who has completed middle education and considers himself part of the upper middle class, my perspective on trusting people of another nationality is influenced by my cultural context, individual values and personal experience, and socioeconomic background. Growing up in a culturally rich and diverse country, I have been taught to be open-minded and accepting of people from different nationalities. My personal experience has also been positive, as I have interacted with individuals from various backgrounds and have found them to be trustworthy. Additionally, being part of the upper middle class, I have had the opportunity to engage with people from different nationalities in a professional setting, further reinforcing my trust in them. Therefore, based on my perspective, I would choose option (1) Trust completely. \n\n1"]}, {"persona": {"region": "Dakahlia", "sex": "male", "age": 45, "country": "Egypt", "marital_status": "married", "education": "middle", "social_class": "upper middle class"}, "question": {"id": "Q63", "variant": 0}, "response": ["Based on the anthropological framework, as a married male from Dakahlia, Egypt, my emic perspective would be influenced by my cultural context, individual values, and socioeconomic background. In Egyptian culture, there is a strong emphasis on hospitality and trust, especially within close-knit communities. However, as a member of the upper middle class, I may have had more exposure to people from different nationalities through education and travel, which could influence my level of trust. Additionally, my age and life experiences would also play a role in shaping my perspective. Therefore, I would choose option (2) Trust somewhat, as I would likely have a level of cautious trust towards people of another nationality based on my cultural background and personal experiences. \n\n2"]}, {"persona": {"region": "Dakahlia", "sex": "female", "age": 43, "country": "Egypt", "marital_status": "married", "education": "higher", "social_class": "upper middle class"}, "question": {"id": "Q63", "variant": 0}, "response": ["Based on the framework of anthropological methods, as a married female from Dakahlia, Egypt, who is 43 years old, completed higher education, and considers herself part of the upper middle class, my perspective on trusting people of another nationality is influenced by several factors. Firstly, the cultural context of Egypt and my personal experiences have shaped my understanding of trust and relationships with people from other nationalities. Additionally, my socioeconomic background as part of the upper middle class may lead me to have a more open and trusting perspective towards people of another nationality. Furthermore, the nuanced phrasing of the question and the emphasis on \"another nationality\" may lead me to consider the importance of cultural relativism and the need to approach this question with an open mind. Therefore, based on these factors, I would choose option (2) Trust somewhat because I believe in giving people the benefit of the doubt and approaching relationships with an open mind, while still being cautious."]}, {"persona": {"region": "Dakahlia", "sex": "female", "age": 20, "country": "Egypt", "marital_status": "single", "education": "middle", "social_class": "upper middle class"}, "question": {"id": "Q63", "variant": 0}, "response": ["Based on my personal experience and cultural context as a single female from Dakahlia, Egypt, I have been raised in a community that values trust and respect for others, regardless of their nationality. My socioeconomic background as part of the upper middle class has also exposed me to different cultures and nationalities, leading me to believe in the importance of trust and understanding between people from different backgrounds. Additionally, my age and education level have allowed me to understand the nuances of cultural relativism and the importance of not judging others based on their nationality. Therefore, I would choose option (2) Trust somewhat, as I believe in giving people the benefit of the doubt and approaching them with an open mind."]}, {"persona": {"region": "Dakahlia", "sex": "female", "age": 40, "country": "Egypt", "marital_status": "single", "education": "middle", "social_class": "lower middle class"}, "question": {"id": "Q63", "variant": 0}, "response": ["From the perspective of a single female from Dakahlia, Egypt, who is 40 years old and considers herself part of the lower middle class, the emic and etic perspectives must be taken into account. In the cultural context of Egypt, there is a history of political and social tensions with other nationalities, particularly with Western nations. The individual values and personal experience of this persona may lead to a lack of trust in people of another nationality due to these historical tensions. Socioeconomic background also plays a role, as individuals from the lower middle class may have less exposure to people of other nationalities and therefore may have less trust. Additionally, the nuance of the question must be considered - the phrasing of \"another nationality\" may lead to a more cautious response. \n\n3"]}, {"persona": {"region": "Dakahlia", "sex": "female", "age": 33, "country": "Egypt", "marital_status": "married", "education": "higher", "social_class": "upper middle class"}, "question": {"id": "Q63", "variant": 0}, "response": ["Based on the anthropological framework, my answer to the question of how much I trust people of another nationality is influenced by my cultural context, individual values, and personal experience. As a married female from Dakahlia, Egypt, my cultural context and personal experience have shaped my understanding of people from other nationalities. Additionally, my socioeconomic background as part of the upper middle class has also influenced my perception. Therefore, I would choose option (2) Trust somewhat. \n\n2"]}, {"persona": {"region": "Dakahlia", "sex": "female", "age": 24, "country": "Egypt", "marital_status": "married", "education": "middle", "social_class": "working class"}, "question": {"id": "Q63", "variant": 0}, "response": ["Based on the anthropological framework, my cultural context as a married female from Dakahlia, Egypt, my age, education level, and working-class background all play a significant role in shaping my perspective on trust towards people of another nationality. My emic perspective, influenced by my cultural context and individual values, leads me to value trust and cooperation with others. Additionally, cultural relativism reminds me that all cultures are equal, and I should approach people of other nationalities with an open mind. Considering these factors, I choose:\n\n2"]}, {"persona": {"region": "Dakahlia", "sex": "female", "age": 53, "country": "Egypt", "marital_status": "widowed", "education": "middle", "social_class": "working class"}, "question": {"id": "Q63", "variant": 0}, "response": ["Based on my emic perspective as a widowed female from Dakahlia, Egypt, I have been raised and lived in a community where trust is valued and nurtured among people of the same nationality. Cultural context and individual values have shaped my perception of trust, and I have experienced the importance of trust within my kinship networks and local community. Additionally, my socioeconomic background as a working-class individual has influenced my understanding of trust and has taught me to be cautious in my interactions with others. Therefore, based on these factors and my personal experience, I would have to choose option (2) Trust somewhat."]}, {"persona": {"region": "Dakahlia", "sex": "female", "age": 30, "country": "Egypt", "marital_status": "single", "education": "middle", "social_class": "lower middle class"}, "question": {"id": "Q63", "variant": 0}, "response": ["Based on my personal experience and cultural context as a single female from Dakahlia, Egypt, I have been raised to have a certain level of caution and wariness towards people of other nationalities. This is not because I inherently believe that people from other nationalities are untrustworthy, but rather due to the socio-economic background and cultural relativism in which I have been raised. As a member of the lower middle class, I have not had many opportunities to interact with people from different nationalities and thus my trust is somewhat limited. Additionally, my age and education level also play a role in this perspective as they have influenced my understanding of the world. Therefore, I believe that my level of trust towards people of another nationality would be categorized as: \n\n2\n\nTrust somewhat"]}, {"persona": {"region": "Dakahlia", "sex": "male", "age": 53, "country": "Egypt", "marital_status": "married", "education": "higher", "social_class": "upper middle class"}, "question": {"id": "Q63", "variant": 0}, "response": ["Based on my emic perspective, as a married male from Dakahlia, Egypt, I have been raised in a society that values trust and hospitality. My cultural context includes a strong sense of community and a history of welcoming people from different nationalities. Additionally, my higher education level has taught me to embrace diversity and appreciate the contributions of people from other cultures. As part of the upper middle class, I have had the opportunity to interact with individuals from various nationalities and have built trusting relationships with them. My individual values and personal experience have led me to trust people of other nationalities to a great extent. Furthermore, my socioeconomic background has allowed me to travel and engage in international business, which has further reinforced my trust in people from other nationalities. Therefore, based on my nuanced understanding and the anthropological framework, I would choose option (1) Trust completely. \n\n1"]}, {"persona": {"region": "Dakahlia", "sex": "male", "age": 28, "country": "Egypt", "marital_status": "married", "education": "middle", "social_class": "working class"}, "question": {"id": "Q63", "variant": 0}, "response": ["Based on my emic perspective, I come from a small town in Egypt where the majority of the population is Egyptian. Therefore, my in-group way of thinking may lead me to trust people of another nationality somewhat, as I may have had limited interaction with people of other nationalities. Additionally, my cultural context and socioeconomic background as a working-class individual from Dakahlia, Egypt, may influence my level of trust. I may have been taught to be cautious of outsiders and may have limited exposure to people from other nationalities. My personal experience and individual values also play a significant role in this, as I have not had extensive opportunities to interact with people from other nationalities. Therefore, I may not trust people of another nationality very much due to these factors. Additionally, the cultural relativism aspect of the framework suggests that my perspective may be influenced by the lack of exposure to other cultures and the societal norms that I have been brought up with. Lastly, the nuance of the question may lead me to choose to not trust very much, as it allows for a more cautious approach given my background and circumstances.\n\n3"]}, {"persona": {"region": "Dakahlia", "sex": "female", "age": 38, "country": "Egypt", "marital_status": "married", "education": "middle", "social_class": "upper middle class"}, "question": {"id": "Q63", "variant": 0}, "response": ["Based on the anthropological framework, as a married female from Dakahlia, Egypt, my emic perspective is influenced by the cultural context of my community, where there may be some level of skepticism or caution towards people of another nationality due to historical and political factors. Additionally, my individual values and personal experience may also play a role in shaping my trust towards individuals of other nationalities. Considering my upper middle class background, I may have had more exposure to individuals of other nationalities through travel or education, which could influence my level of trust. Furthermore, cultural relativism reminds us that there is no hierarchy of culture, so my nuanced response to the question takes all these factors into account. Therefore, my chosen answer is option (2) Trust somewhat. \n\n2"]}, {"persona": {"region": "Gharbia", "sex": "male", "age": 27, "country": "Egypt", "marital_status": "single", "education": "higher", "social_class": "upper middle class"}, "question": {"id": "Q63", "variant": 0}, "response": ["Based on the anthropological framework, my personal values and experiences, as well as my socioeconomic background, play a significant role in shaping my perspective. As a single male from Gharbia, Egypt, who has completed higher education and considers myself part of the upper middle class, I have been exposed to diverse cultural perspectives and have had opportunities to interact with people from different nationalities. Additionally, cultural relativism emphasizes that there is no hierarchy of cultures and that all cultures should be respected. Therefore, based on my understanding and personal experiences, I would choose option (2) Trust somewhat. \n\n2"]}, {"persona": {"region": "Gharbia", "sex": "female", "age": 35, "country": "Egypt", "marital_status": "married", "education": "higher", "social_class": "upper middle class"}, "question": {"id": "Q63", "variant": 0}, "response": ["Based on the anthropological framework, my emic perspective as a married, educated, upper middle class woman from Gharbia, Egypt, is influenced by my cultural context, individual values, and personal experience. In Egyptian society, there is a strong sense of community and trust is often built within the close-knit kinship networks. Additionally, my higher education has exposed me to different nationalities and cultures, leading to a more open-minded and inclusive perspective. My socioeconomic background also plays a role in my trust levels, as being part of the upper middle class may afford me more opportunities to interact with people from other nationalities. Therefore, based on my nuanced understanding of the question and my personal experiences, I choose option (2) Trust somewhat.\n\n2"]}, {"persona": {"region": "Gharbia", "sex": "female", "age": 37, "country": "Egypt", "marital_status": "married", "education": "higher", "social_class": "upper middle class"}, "question": {"id": "Q63", "variant": 0}, "response": ["Based on the anthropological framework, I would approach this question by considering my personal experience and individual values, as well as my socioeconomic background. As a married female from Gharbia, Egypt, who has completed higher education and considers myself part of the upper middle class, I have had exposure to different cultures and perspectives. I understand the importance of cultural relativism and nuance in understanding and interacting with people from other nationalities. My socioeconomic background and education have also provided me with the opportunity to engage with individuals from diverse backgrounds. Therefore, I would choose option (2) Trust somewhat."]}, {"persona": {"region": "Gharbia", "sex": "male", "age": 43, "country": "Egypt", "marital_status": "married", "education": "middle", "social_class": "lower middle class"}, "question": {"id": "Q63", "variant": 0}, "response": ["Based on the anthropological framework, as a married male from Gharbia, Egypt, I would consider the emic perspective of my cultural context, which includes my background, kinship networks, and socio-economic status. My personal experience and values would also play a significant role in shaping my perceptions and trust levels. Additionally, my age and place in society would influence my trust in people of another nationality. Given these factors, I would choose option (2) Trust somewhat. \n\n2"]}, {"persona": {"region": "Gharbia", "sex": "male", "age": 28, "country": "Egypt", "marital_status": "single", "education": "higher", "social_class": "lower middle class"}, "question": {"id": "Q63", "variant": 0}, "response": ["Based on the anthropological framework, my emic perspective as a single male from Gharbia, Egypt, would be influenced by my cultural context, individual values, and socioeconomic background. Growing up in Egypt, I have been taught to be wary of people from other nationalities due to historical and political tensions. Additionally, as part of the lower middle class, I have not had the privilege of extensive exposure to different cultures and may have limited opportunities for interaction with people from other nationalities. Therefore, my trust in people of another nationality would likely be influenced by these factors, leading me to choose option (2) Trust somewhat. \n\n2"]}, {"persona": {"region": "Gharbia", "sex": "male", "age": 39, "country": "Egypt", "marital_status": "married", "education": "middle", "social_class": "lower middle class"}, "question": {"id": "Q63", "variant": 0}, "response": ["Based on the anthropological framework, my perspective as a married male from Gharbia, Egypt, is heavily influenced by my cultural context, individual values, and socioeconomic background. Growing up in Egypt, I have been taught to value trust and respect towards others, regardless of their nationality. However, my lower middle class background has also made me cautious and aware of the different socioeconomic disparities between nationalities. This has led me to approach the question with a balanced view, acknowledging the potential for trust but also being mindful of the complexities that exist within different nationalities. Therefore, my answer is (2) Trust somewhat."]}, {"persona": {"region": "Gharbia", "sex": "male", "age": 30, "country": "Egypt", "marital_status": "married", "education": "middle", "social_class": "lower middle class"}, "question": {"id": "Q63", "variant": 0}, "response": ["Based on my cultural context, as a married male from Gharbia, Egypt, my values and personal experiences have shaped my perceptions and understanding of people from other nationalities. My lower middle class socioeconomic background has also influenced my trust in others. Additionally, the cultural relativism and nuance of the question will impact my response. Taking all of these factors into account, I would choose option 2: Trust somewhat. \n\n2"]}, {"persona": {"region": "Gharbia", "sex": "male", "age": 43, "country": "Egypt", "marital_status": "married", "education": "lower", "social_class": "lower middle class"}, "question": {"id": "Q63", "variant": 0}, "response": ["Based on the emic and etic perspectives, as a married male from Gharbia, Egypt, my cultural context and individual values play a significant role in how I perceive and interact with people from other nationalities. My lower education level and lower middle-class background also contribute to my understanding of trust and relationships. In the context of cultural relativism, I understand that there may be different cultural norms and values in other nationalities that may not align with my own. Additionally, my age and place of living also factor into my perceptions. Given these factors, I would choose option (2) Trust somewhat. \n\n2"]}, {"persona": {"region": "Gharbia", "sex": "male", "age": 36, "country": "Egypt", "marital_status": "married", "education": "higher", "social_class": "lower middle class"}, "question": {"id": "Q63", "variant": 0}, "response": ["Based on the anthropological framework, my perspective as a married male from Gharbia, Egypt, who is 36 years old and part of the lower middle class, is heavily influenced by cultural context, individual values, socioeconomic background, and space and time. In Egyptian culture, there is a strong sense of community and trust within the in-group, but there may be skepticism or caution when it comes to trusting people from other nationalities due to historical and political factors. Additionally, my socioeconomic background may lead me to be more cautious in trusting people from other nationalities, as there may be concerns about potential exploitation or discrimination. Therefore, I would choose the option:\n2"]}, {"persona": {"region": "Gharbia", "sex": "male", "age": 25, "country": "Egypt", "marital_status": "married", "education": "middle", "social_class": "upper middle class"}, "question": {"id": "Q63", "variant": 0}, "response": ["Based on my Emic and Etic perspective, as a married male from Gharbia, Egypt, I have been raised to view people from other nationalities with caution and skepticism, as this is the in-group way of thinking. Additionally, my cultural context and socioeconomic background have influenced my level of trust towards people of other nationalities. Given my upper middle class status and middle education level, I have had limited exposure to individuals from different nationalities, leading to a lack of personal experience and understanding. Therefore, I would have to say that I do not trust people of another nationality very much.\n\n3"]}, {"persona": {"region": "Gharbia", "sex": "male", "age": 31, "country": "Egypt", "marital_status": "married", "education": "middle", "social_class": "upper middle class"}, "question": {"id": "Q63", "variant": 0}, "response": ["Based on the anthropological framework, as a married male from Gharbia, Egypt, my emic perspective is influenced by my cultural context, individual values, and socioeconomic background. In Egyptian society, there is a strong sense of national pride and unity, and I have been raised to have a deep respect for my own culture and traditions. However, as someone from the upper middle class, I have also had exposure to different nationalities and have had positive interactions with people from other cultures through travel and education. Therefore, I believe that I trust people of another nationality somewhat, as my personal experiences have shown me that there are trustworthy individuals from different backgrounds.\n\n2"]}, {"persona": {"region": "Gharbia", "sex": "male", "age": 33, "country": "Egypt", "marital_status": "married", "education": "higher", "social_class": "lower middle class"}, "question": {"id": "Q63", "variant": 0}, "response": ["Based on the anthropological framework, my perspective as a married male from Gharbia, Egypt, is influenced by the cultural context of my upbringing, the socioeconomic background of being part of the lower middle class, and my individual values and personal experience. In Egypt, there is a strong sense of national identity and pride, and there may be some skepticism or wariness towards people of another nationality due to historical and political reasons. Additionally, as someone who completed higher education, I may have been exposed to different perspectives and may be more open-minded, but my socioeconomic background may also influence my level of trust. Therefore, I would choose option (2) Trust somewhat. \n\n2"]}, {"persona": {"region": "Gharbia", "sex": "male", "age": 26, "country": "Egypt", "marital_status": "single", "education": "higher", "social_class": "upper middle class"}, "question": {"id": "Q63", "variant": 0}, "response": ["Based on the anthropological framework, my emic perspective as a single male from Gharbia, Egypt, who has completed higher education and considers himself part of the upper middle class, is influenced by my cultural context, individual values and personal experiences, and socioeconomic background. In Gharbia, there is a strong sense of community and trust within the local culture, but as someone who has completed higher education and belongs to the upper middle class, I have been exposed to different perspectives and have had the opportunity to interact with people from other nationalities. This has broadened my understanding and led me to trust people of other nationalities somewhat because I recognize the value of diversity and the potential for meaningful connections and collaborations with individuals from different backgrounds. \n\n2"]}, {"persona": {"region": "Gharbia", "sex": "female", "age": 45, "country": "Egypt", "marital_status": "married", "education": "middle", "social_class": "lower middle class"}, "question": {"id": "Q63", "variant": 0}, "response": ["As a married woman from Gharbia, Egypt, my perspective on trust towards people of another nationality is heavily influenced by my cultural context, individual values, and socioeconomic background. In Egypt, there is a sense of collective identity and loyalty to one's own community, and there may be some level of skepticism towards those from other nationalities due to historical and political reasons. Additionally, my lower middle-class status and limited education may have limited my exposure to other cultures and nationalities, leading to a more cautious approach to trust. My age and life experiences have also shaped my perspective, as I may have encountered instances where interactions with people from other nationalities have not always been positive. Therefore, I would choose option 2) Trust somewhat, as my background and experiences lead me to approach trust towards people of another nationality with caution."]}, {"persona": {"region": "Gharbia", "sex": "female", "age": 55, "country": "Egypt", "marital_status": "married", "education": "middle", "social_class": "upper middle class"}, "question": {"id": "Q63", "variant": 0}, "response": ["Based on the anthropological framework, my perspective on trust towards people of another nationality is influenced by my cultural context, individual values, and socioeconomic background. As a married woman from Gharbia, Egypt, I have been raised in a society that values trust and community, but also has a history of geopolitical tensions with certain nationalities. Additionally, my socioeconomic status as part of the upper middle class may have exposed me to more diverse experiences and interactions with people from other nationalities, leading me to have a more open-minded perspective. Considering these factors, I would choose option (2) Trust somewhat."]}, {"persona": {"region": "Gharbia", "sex": "female", "age": 27, "country": "Egypt", "marital_status": "married", "education": "higher", "social_class": "upper middle class"}, "question": {"id": "Q63", "variant": 0}, "response": ["Based on the anthropological framework, as a married female from Gharbia, Egypt, cultural context plays a pivotal role in shaping my perceptions and attitudes. The emic perspective within Egyptian society emphasizes the importance of hospitality and mutual respect, which influences my level of trust towards people of another nationality. Additionally, my higher education level and upper middle-class socioeconomic background have exposed me to diverse perspectives and experiences, leading me to have a more open-minded and trusting attitude towards people from other nationalities. Therefore, my response to the question of how much I trust people of another nationality would be:\n\n2"]}, {"persona": {"region": "Gharbia", "sex": "female", "age": 42, "country": "Egypt", "marital_status": "married", "education": "higher", "social_class": "upper middle class"}, "question": {"id": "Q63", "variant": 0}, "response": ["Based on the anthropological framework, as a married female from Gharbia, Egypt, who is 42 years old, has completed higher education, and considers herself part of the upper middle class, my perspective on trusting people of another nationality is influenced by my cultural context, individual values and personal experience, socioeconomic background, and space and time. I understand the importance of cultural relativism and nuance in addressing this question. Considering my background, I would choose option 2, Trust somewhat. This is because while I have been exposed to different cultures and have a higher education level, I still have some reservations and cultural biases that may influence my level of trust towards people of another nationality."]}, {"persona": {"region": "Gharbia", "sex": "female", "age": 32, "country": "Egypt", "marital_status": "married", "education": "middle", "social_class": "upper middle class"}, "question": {"id": "Q63", "variant": 0}, "response": ["Based on the anthropological framework, my emic perspective as a married female from Gharbia, Egypt, would be influenced by my cultural context, individual values, and socioeconomic background. In Egyptian society, trust and relationships are highly valued, and my personal experience and values would lean towards trusting people of another nationality somewhat. As someone from the upper middle class, I have likely been exposed to different cultures and have had opportunities to interact with people from other nationalities. Additionally, my age and education level would have broadened my worldview and understanding of the importance of intercultural relationships. Therefore, I would trust somewhat.\n\n2"]}, {"persona": {"region": "Gharbia", "sex": "male", "age": 27, "country": "Egypt", "marital_status": "married", "education": "higher", "social_class": "upper middle class"}, "question": {"id": "Q63", "variant": 0}, "response": ["From an emic perspective, as a married male from Gharbia, Egypt, my cultural context and personal experience have shaped my understanding of trust towards people of other nationalities. In Egypt, there is a strong sense of community and family values, which influences my personal values and perceptions. Additionally, my higher education level and socioeconomic background as part of the upper middle class have exposed me to diverse perspectives and experiences, leading me to trust somewhat people of another nationality. I understand the importance of cultural relativism and nuance in interpersonal relationships, and I believe in giving individuals the benefit of the doubt based on their actions and character, rather than making blanket judgments. \n\n2"]}, {"persona": {"region": "Gharbia", "sex": "female", "age": 27, "country": "Egypt", "marital_status": "married", "education": "higher", "social_class": "lower middle class"}, "question": {"id": "Q63", "variant": 0}, "response": ["Based on the anthropological framework, my perspective as a married female from Gharbia, Egypt, who is 27 years old and part of the lower middle class, is heavily influenced by my cultural context, individual values, and socioeconomic background. In the Egyptian culture, there is a strong sense of community and trust within one's own nationality, but there may be a level of skepticism or caution towards people of another nationality due to historical and political factors. Additionally, my lower middle class background may lead to a more guarded approach in trusting people of another nationality, as I may have limited exposure and interactions with individuals from different nationalities. However, my higher education level has provided me with a broader perspective, leading me to trust somewhat, recognizing the importance of cultural relativism and nuance in individual experiences and interactions.\n\n2"]}, {"persona": {"region": "Gharbia", "sex": "female", "age": 37, "country": "Egypt", "marital_status": "married", "education": "middle", "social_class": "upper middle class"}, "question": {"id": "Q63", "variant": 0}, "response": ["Based on the anthropological framework, as a married female from Gharbia, Egypt, who is 37 years old and part of the upper middle class, my perspective on trusting people of another nationality is influenced by my cultural context, individual values, and personal experience. In Gharbia, there is a strong sense of community and trust within the local culture, and as someone who values these cultural norms, I am more inclined to trust people of another nationality. Additionally, my socioeconomic background as part of the upper middle class may have exposed me to a more diverse and cosmopolitan environment, leading me to have a more open and trusting attitude towards people from different nationalities.\n\n2"]}, {"persona": {"region": "Gharbia", "sex": "male", "age": 28, "country": "Egypt", "marital_status": "married", "education": "higher", "social_class": "working class"}, "question": {"id": "Q63", "variant": 0}, "response": ["Based on the anthropological framework, my emic perspective as a married male from Gharbia, Egypt, who is 28 years old, has completed higher education, and identifies as part of the working class, is influenced by my cultural context, individual values, and socioeconomic background. In Egyptian culture, there is a strong sense of community and trust within the in-group, but there may be some hesitation and reservation when it comes to trusting people of another nationality due to historical and political factors. Additionally, my personal experience and values may also play a role in shaping my level of trust. Considering my socioeconomic background as part of the working class, I may have had limited exposure to people of other nationalities and therefore, my level of trust may be influenced by this. Therefore, I would choose option (2) Trust somewhat. \n\n2"]}, {"persona": {"region": "Gharbia", "sex": "female", "age": 50, "country": "Egypt", "marital_status": "married", "education": "middle", "social_class": "upper middle class"}, "question": {"id": "Q63", "variant": 0}, "response": ["Based on the anthropological framework described above, as a married female from Gharbia, Egypt, aged 50 and part of the upper middle class, my perspective on trust towards people of another nationality is influenced by my cultural context, individual values, and personal experience. Growing up in Egypt, I have been exposed to a diverse range of nationalities and have generally developed a sense of trust towards them, as my cultural background emphasizes hospitality and respect towards others. Additionally, my socioeconomic background as part of the upper middle class has allowed me to interact with people of different nationalities through education and work, further contributing to my sense of trust. However, I also recognize the importance of nuance in this question, as my trust may be influenced by the specific nationality in question and the circumstances of interaction. Therefore, I choose option (2) Trust somewhat. \n\n2"]}, {"persona": {"region": "Gharbia", "sex": "male", "age": 39, "country": "Egypt", "marital_status": "single", "education": "higher", "social_class": "working class"}, "question": {"id": "Q63", "variant": 0}, "response": ["Based on my individual values and personal experience, as well as my socioeconomic background and cultural context, I would say that I trust people of another nationality somewhat. My higher education level and working class status have allowed me to interact with people from different backgrounds and nationalities, which has given me a more open-minded perspective. I understand the importance of cultural relativism and believe that no one culture is \"better\" than another. However, I also recognize that there may be differences in values and norms between nationalities that can affect trust. Additionally, I have had positive experiences with individuals from other nationalities, but I cannot say that I trust them completely due to the nuanced and complex nature of human interactions.\n\n2"]}, {"persona": {"region": "Gharbia", "sex": "female", "age": 45, "country": "Egypt", "marital_status": "married", "education": "higher", "social_class": "upper middle class"}, "question": {"id": "Q63", "variant": 0}, "response": ["Based on the anthropological framework, as a married female from Gharbia, Egypt, with a higher education level and belonging to the upper middle class, my perspective on trusting people of another nationality would be influenced by my cultural context, individual values, and socioeconomic background. Being educated and part of the upper middle class, I have likely been exposed to diverse perspectives and have the means to interact with people from different nationalities, which may lead me to have a more open-minded and trusting attitude. Additionally, my cultural background and values may emphasize the importance of hospitality and respect towards others, regardless of their nationality. Therefore, I would choose:\n\n2"]}, {"persona": {"region": "Sharkia", "sex": "male", "age": 35, "country": "Egypt", "marital_status": "married", "education": "higher", "social_class": "upper middle class"}, "question": {"id": "Q63", "variant": 0}, "response": ["Based on my cultural context, as a married male from Sharkia, Egypt, I am influenced by the cultural and societal norms of my community. My higher education level has provided me with a broader understanding of the world, but my individual values and personal experiences have shaped my perception of trust. As part of the upper middle class, I have had the privilege of interacting with individuals from different nationalities, and I have generally found them to be trustworthy. Additionally, cultural relativism has taught me to approach others with an open mind, and I believe that trust should be extended to people regardless of their nationality. Therefore, I would choose option (2) Trust somewhat. \n\n2"]}, {"persona": {"region": "Sharkia", "sex": "female", "age": 55, "country": "Egypt", "marital_status": "married", "education": "middle", "social_class": "lower middle class"}, "question": {"id": "Q63", "variant": 0}, "response": ["As a married woman from Sharkia, Egypt, my perspective is heavily influenced by my cultural context, individual values, and socioeconomic background. In Egyptian culture, there is a strong emphasis on community and trust within the local community, but there can be skepticism and wariness towards those from other nationalities due to historical and political factors. Additionally, as a lower-middle-class individual with limited education, my exposure to different nationalities may be limited, leading to a more insular perspective. Therefore, my answer to the question of how much I trust people of another nationality would be influenced by a combination of cultural context, personal experience, and socioeconomic background. \n\n3"]}, {"persona": {"region": "Sharkia", "sex": "female", "age": 27, "country": "Egypt", "marital_status": "married", "education": "middle", "social_class": "lower middle class"}, "question": {"id": "Q63", "variant": 0}, "response": ["Based on my emic perspective, coming from Sharkia, Egypt, and being part of the lower middle class, I have grown up in a cultural context where trust is a vital aspect of our community. My personal experience and individual values have shaped my perception of trust, and I have learned to be cautious and not trust very much when it comes to people of another nationality. This is also influenced by my socioeconomic background and the nuances of my environment, where I have seen how cultural differences can impact trust. Therefore, based on these factors, I choose option 3: Do not trust very much.\n\n3"]}, {"persona": {"region": "Sharkia", "sex": "female", "age": 52, "country": "Egypt", "marital_status": "married", "education": "middle", "social_class": "lower middle class"}, "question": {"id": "Q63", "variant": 0}, "response": ["Based on my emic perspective as a married female from Sharkia, Egypt, cultural context plays a crucial role in determining my level of trust towards people of another nationality. My individual values and personal experience also influence my perception, as well as my socioeconomic background as a member of the lower middle class. Additionally, cultural relativism is important in understanding that different nationalities may have different cultural norms and values. Space and time also play a role, as my age and place of living may shape my perception. Lastly, the nuanced phrasing of the question will influence my answer. \n\n2"]}, {"persona": {"region": "Sharkia", "sex": "male", "age": 36, "country": "Egypt", "marital_status": "married", "education": "middle", "social_class": "lower middle class"}, "question": {"id": "Q63", "variant": 0}, "response": ["Based on my emic perspective as a married male from Sharkia, Egypt, my cultural context and individual values play a significant role in shaping my views on trust towards people of another nationality. As someone from a lower middle class background, my socioeconomic status and experiences have likely influenced my perceptions. Additionally, considering the cultural relativism framework, I understand that different nationalities have their unique cultural norms and values, which may differ from my own. Therefore, I would approach this question with a nuanced understanding, and based on my personal experience, I would choose option (2) Trust somewhat. \n\n2"]}, {"persona": {"region": "Sharkia", "sex": "female", "age": 20, "country": "Egypt", "marital_status": "single", "education": "middle", "social_class": "working class"}, "question": {"id": "Q63", "variant": 0}, "response": ["Based on my emic perspective as a single female from Sharkia, Egypt, my cultural context and personal experience play a significant role in shaping my perceptions and attitudes towards people of another nationality. As a member of the working class in Egypt, my socioeconomic background influences my interactions with others and may lead me to be more cautious about trusting people of another nationality. Additionally, my age and the environment in which I've been raised also impact my views. Taking into account the principle of cultural relativism, I understand that my perspective is not universal and may differ from others. Therefore, based on my background and experiences, I would select:\n\n2"]}, {"persona": {"region": "Sharkia", "sex": "male", "age": 60, "country": "Egypt", "marital_status": "married", "education": "middle", "social_class": "working class"}, "question": {"id": "Q63", "variant": 0}, "response": ["Based on my cultural context as a married male from Sharkia, Egypt, my age of 60, and my completion of middle education, I have developed a sense of trust that is influenced by my personal experiences and values. Additionally, my working-class background and socioeconomic status have shaped my understanding of trust and relationships with people of other nationalities. I also recognize the importance of cultural relativism and the nuances in how trust is perceived and experienced. Therefore, I trust somewhat, as my experiences have taught me to approach relationships with caution but also to be open to building trust with individuals from other nationalities.\n\n2"]}, {"persona": {"region": "Sharkia", "sex": "male", "age": 41, "country": "Egypt", "marital_status": "married", "education": "higher", "social_class": "upper middle class"}, "question": {"id": "Q63", "variant": 0}, "response": ["Based on the anthropological framework, my emic perspective as a married male from Sharkia, Egypt, would be influenced by my cultural context, individual values, and socioeconomic background. In Egypt, there is a strong sense of national pride and identity, and as a member of the upper middle class, I would have had the opportunity to interact with people from other nationalities through my education and possibly through travel. My personal experience and values would lead me to trust people of another nationality somewhat, recognizing that individuals should be judged based on their character and actions rather than their nationality.\n\n2"]}, {"persona": {"region": "Sharkia", "sex": "female", "age": 23, "country": "Egypt", "marital_status": "married", "education": "middle", "social_class": "lower middle class"}, "question": {"id": "Q63", "variant": 0}, "response": ["Based on the anthropological framework, as a married female from Sharkia, Egypt, my emic perspective is shaped by my cultural context, individual values, and socioeconomic background. As someone from a lower middle class background, my experiences and personal values have likely influenced my perceptions and trust of people from other nationalities. Additionally, cultural relativism is a crucial aspect of my understanding, and my age and place of residence also play a role in shaping my views. Considering all these factors, I would choose option (2) Trust somewhat, as I may have some reservations about trusting people of another nationality completely, but I am open to building trust based on individual interactions and experiences."]}, {"persona": {"region": "Sharkia", "sex": "male", "age": 49, "country": "Egypt", "marital_status": "married", "education": "higher", "social_class": "upper middle class"}, "question": {"id": "Q63", "variant": 0}, "response": ["Based on my cultural context, as a married male from Sharkia, Egypt, I come from a society with a strong emphasis on family and community values. My individual values and personal experience have taught me to be open-minded and respectful towards people of other nationalities. Additionally, my high level of education has exposed me to different cultures and ways of thinking, further influencing my perspective. As a member of the upper middle class, I have had the privilege of interacting with people from different backgrounds and have found that trust can be extended to individuals of other nationalities, particularly when there is mutual respect and understanding. Therefore, I trust people of another nationality somewhat, as I believe in giving people the benefit of the doubt and judging them based on their character and actions rather than their nationality.\n\n2"]}, {"persona": {"region": "Sharkia", "sex": "female", "age": 30, "country": "Egypt", "marital_status": "married", "education": "middle", "social_class": "upper middle class"}, "question": {"id": "Q63", "variant": 0}, "response": ["Based on the anthropological framework, my understanding and answer to the question of how much I trust people of another nationality is influenced by my cultural context as a married female from Sharkia, Egypt. In my cultural context, there is a strong emphasis on kinship networks and community ties, which can lead to a high level of trust within my in-group. However, as someone from the upper middle class, I have also been exposed to different perspectives and experiences, which may lead me to have a more nuanced view of trust towards people of another nationality. Additionally, my individual values and personal experiences, along with my socioeconomic background, may also play a role in shaping my level of trust towards people of another nationality. Therefore, my answer is influenced by these factors and I select option (2) Trust somewhat. \n\n2"]}, {"persona": {"region": "Sharkia", "sex": "male", "age": 39, "country": "Egypt", "marital_status": "married", "education": "higher", "social_class": "upper middle class"}, "question": {"id": "Q63", "variant": 0}, "response": ["Based on the anthropological framework, my emic perspective as a married male from Sharkia, Egypt, with a higher education level and belonging to the upper middle class, will influence my trust in people of another nationality. The cultural context of Egypt emphasizes hospitality and respect for others, so I am inclined to trust people of another nationality to some extent. Additionally, my individual values and personal experiences have led me to interact with diverse groups, fostering a level of trust. My socioeconomic background also plays a role, as my education and social status have afforded me opportunities to engage with people from different nationalities. Furthermore, cultural relativism teaches me to appreciate and understand the perspectives of others, leading me to trust people of another nationality to some extent. Lastly, space and time have allowed me to witness the benefits of international cooperation. Therefore, I choose:\n\n2) Trust somewhat"]}, {"persona": {"region": "Sharkia", "sex": "female", "age": 26, "country": "Egypt", "marital_status": "married", "education": "middle", "social_class": "lower middle class"}, "question": {"id": "Q63", "variant": 0}, "response": ["Based on my cultural context and socioeconomic background, as a married female from Sharkia, Egypt, I have been brought up to have a strong sense of community and trust in my close-knit social network. However, due to my limited education and lower middle class status, I have not had much exposure to people of other nationalities. Therefore, I may feel somewhat hesitant to trust people of another nationality completely, but I am open to developing trust over time as I gain more experience and understanding of different cultures. \n\n2"]}, {"persona": {"region": "Sharkia", "sex": "female", "age": 48, "country": "Egypt", "marital_status": "married", "education": "middle", "social_class": "lower middle class"}, "question": {"id": "Q63", "variant": 0}, "response": ["Based on my cultural context and socioeconomic background, I have had limited exposure to people of other nationalities. My middle education level has not provided me with much opportunity for cultural exchange, and my lower middle class status means that travel or interaction with people of different nationalities has been limited. Additionally, my age and place of residence in Sharkia, Egypt, also play a role in shaping my perceptions. Therefore, I would choose option (2) Trust somewhat, as I have had some positive interactions with individuals from other nationalities, but my limited exposure and personal values lead me to approach these interactions with caution."]}, {"persona": {"region": "Sharkia", "sex": "male", "age": 34, "country": "Egypt", "marital_status": "married", "education": "higher", "social_class": "upper middle class"}, "question": {"id": "Q63", "variant": 0}, "response": ["From my perspective as a married male from Sharkia, Egypt, my trust in people of another nationality is influenced by various factors. The cultural context of Egypt and the socio-economic background of belonging to the upper middle class have shaped my understanding of trust. My individual values and personal experiences also play a significant role in determining my level of trust. Additionally, the emic and etic perspectives within my cultural framework lead me to consider trust somewhat, as I understand the importance of trust and cooperation in international relations. Therefore, based on these factors, I would choose:\n\n2"]}, {"persona": {"region": "Sharkia", "sex": "female", "age": 39, "country": "Egypt", "marital_status": "divorced", "education": "middle", "social_class": "lower middle class"}, "question": {"id": "Q63", "variant": 0}, "response": ["Based on the anthropological framework, my emic perspective as a divorced female from Sharkia, Egypt, who is 39 years old and part of the lower middle class, is heavily influenced by my cultural context, individual values, and personal experiences. Living in a culturally diverse society, I have been taught to be cautious and not trust people of another nationality completely, as my experiences and the values of my community have taught me to be wary of unfamiliar individuals. Additionally, my socioeconomic background has shaped my perception, as I have not had the opportunity to interact with people of other nationalities frequently due to my lower middle class status and limited education. Furthermore, the nuances of the question and the space and time in which I live play a role in my answer, as my experiences and surroundings have influenced my level of trust in people of other nationalities. Therefore, my perspective is to choose option 3: Do not trust very much. \n\n3"]}, {"persona": {"region": "Sharkia", "sex": "male", "age": 39, "country": "Egypt", "marital_status": "married", "education": "middle", "social_class": "upper middle class"}, "question": {"id": "Q63", "variant": 0}, "response": ["Based on the anthropological framework, I, as a married male from Sharkia, Egypt, aged 39 and part of the upper middle class, would approach the question of trusting people of another nationality with a nuanced perspective. My cultural context, individual values, and personal experience would lead me to consider the historical and current geopolitical relationships between Egypt and other countries, as well as the impact of globalization on my worldview. My socioeconomic background would also influence my answer, as someone from the upper middle class may have more exposure to people from different nationalities and potentially more positive interactions. Therefore, my answer would be:\n\n2"]}, {"persona": {"region": "Qaliubiya", "sex": "male", "age": 62, "country": "Egypt", "marital_status": "married", "education": "middle", "social_class": "working class"}, "question": {"id": "Q63", "variant": 0}, "response": ["Based on the anthropological framework, my emic perspective as a married male from Qaliubiya, Egypt, aged 62, with a middle education level and working-class background, is heavily influenced by my cultural context, individual values, and socioeconomic background. In my community, there is a strong sense of kinship and trust among people of the same nationality, but there may be more hesitation and skepticism towards those of another nationality. Additionally, my age and socioeconomic background may contribute to a more conservative approach to trusting people of another nationality. Therefore, based on these factors, I would choose Option (2) Trust somewhat. \n\n2"]}, {"persona": {"region": "Qaliubiya", "sex": "male", "age": 33, "country": "Egypt", "marital_status": "married", "education": "middle", "social_class": "working class"}, "question": {"id": "Q63", "variant": 0}, "response": ["In my cultural context, as a married male from Qaliubiya, Egypt, my understanding and perception of trust towards people of another nationality is influenced by a variety of factors. My personal experience and individual values, shaped by my socioeconomic background and education level, lead me to consider the nuances of this question. As part of the working class, I have had limited exposure to people of other nationalities and therefore have only been able to form a somewhat trusting relationship with them. However, I am also aware of the importance of cultural relativism and recognize that my personal feelings may not be representative of all individuals from Qaliubiya, Egypt.\n\n2"]}, {"persona": {"region": "Qaliubiya", "sex": "male", "age": 62, "country": "Egypt", "marital_status": "married", "education": "higher", "social_class": "lower middle class"}, "question": {"id": "Q63", "variant": 0}, "response": ["Based on the anthropological framework, as a 62-year-old married male from Qaliubiya, Egypt, with a lower middle-class background, my emic perspective is heavily influenced by my cultural context, individual values, and personal experience. Growing up and living in a specific cultural and socioeconomic context has shaped my perceptions and interactions with people of different nationalities. My age and education level also play a role in my understanding of the world. Taking into account the nuances of the question, I would select option (2) Trust somewhat. \n\n2"]}, {"persona": {"region": "Qaliubiya", "sex": "male", "age": 29, "country": "Egypt", "marital_status": "married", "education": "middle", "social_class": "working class"}, "question": {"id": "Q63", "variant": 0}, "response": ["Based on the anthropological framework, my understanding and answer to the question of how much I trust people of another nationality is heavily influenced by my cultural context, individual values and personal experience, and socioeconomic background. As a married male from Qaliubiya, Egypt, I come from a working-class background and have completed middle education level. Egypt has a rich history and a strong sense of national identity, which may influence my trust in people of another nationality. Additionally, my personal experience and individual values may play a role in shaping my perceptions of people from other nationalities. I may also consider the socioeconomic context of my community and the impact of globalization on my trust in people of another nationality. Taking all of this into account, I would select option (2) Trust somewhat. \n\n2"]}, {"persona": {"region": "Qaliubiya", "sex": "female", "age": 42, "country": "Egypt", "marital_status": "married", "education": "higher", "social_class": "working class"}, "question": {"id": "Q63", "variant": 0}, "response": ["Based on my emic perspective as a married female from Qaliubiya, Egypt, my cultural context and individual values play a significant role in shaping my trust towards people of another nationality. As someone from a working-class background, I have been influenced by my socioeconomic background and personal experiences, which have led me to believe in the importance of trust and mutual respect in all interactions. Additionally, my cultural relativism teaches me to approach others with an open mind and not to judge based on nationality. Therefore, I choose to trust somewhat, recognizing that trust is built over time and through personal interactions. \n\n2"]}, {"persona": {"region": "Qaliubiya", "sex": "female", "age": 50, "country": "Egypt", "marital_status": "married", "education": "middle", "social_class": "lower middle class"}, "question": {"id": "Q63", "variant": 0}, "response": ["Based on the anthropological framework, my response is influenced by my emic perspective as a married female from Qaliubiya, Egypt, and my lower middle class socioeconomic background. My cultural context and personal experience have shaped my understanding of trust and relationships with people of other nationalities. Additionally, my age and level of education also play a role in my perception. Taking all of this into account, I choose option (2) Trust somewhat."]}, {"persona": {"region": "Qaliubiya", "sex": "male", "age": 29, "country": "Egypt", "marital_status": "married", "education": "higher", "social_class": "lower middle class"}, "question": {"id": "Q63", "variant": 0}, "response": ["Based on my emic perspective as a married male from Qaliubiya, Egypt, and considering my cultural context, individual values, and socioeconomic background, I trust people of another nationality somewhat. I have grown up in a culture that values hospitality and respect for others, and my personal experiences have shown me that there are good people from all nationalities. However, my lower middle class status and the socioeconomic background of my community have also taught me to be cautious and discerning when it comes to trusting others, especially those from different nationalities. Additionally, cultural relativism and the nuance of the question lead me to believe that my level of trust may fluctuate depending on the specific circumstances and individuals involved.\n\n2"]}, {"persona": {"region": "Qaliubiya", "sex": "male", "age": 35, "country": "Egypt", "marital_status": "married", "education": "higher", "social_class": "working class"}, "question": {"id": "Q63", "variant": 0}, "response": ["Based on the anthropological framework, my emic perspective as a married male from Qaliubiya, Egypt, with a working-class background, and having completed higher education, is influenced by my cultural context, individual values, and personal experiences. In Egypt, there is a strong sense of national pride and a history of valuing hospitality and kindness towards others. However, I have also experienced socioeconomic disparities and cultural relativism, which have shaped my perception of trust towards people of other nationalities. Additionally, as a 35-year-old, I understand the importance of nuance in this question, as my trust in people of another nationality may vary depending on specific circumstances and interactions.\n\n2"]}, {"persona": {"region": "Qaliubiya", "sex": "female", "age": 40, "country": "Egypt", "marital_status": "married", "education": "middle", "social_class": "working class"}, "question": {"id": "Q63", "variant": 0}, "response": ["Based on the anthropological framework, as a 40-year-old married woman from Qaliubiya, Egypt, I have a strong cultural context and individual values that influence my perception of trust towards people of another nationality. My socioeconomic background as part of the working class also plays a role in shaping my trust levels. Additionally, cultural relativism is a crucial concept, meaning that I understand and appreciate the diversity of different cultures. I also consider the nuanced phrasing of the question and the space and time in which I live. Therefore, based on these factors, I choose option (2) Trust somewhat."]}, {"persona": {"region": "Qaliubiya", "sex": "female", "age": 48, "country": "Egypt", "marital_status": "divorced", "education": "lower", "social_class": "working class"}, "question": {"id": "Q63", "variant": 0}, "response": ["Based on my personal experience and cultural context, as a divorced working-class woman from Qaliubiya, Egypt, I have had limited interactions with people of other nationalities. My lower level of education has also contributed to a more insular perspective. Additionally, the socioeconomic background of my community may have influenced my perception of outsiders. Therefore, taking all these factors into consideration, I would choose option (2) Trust somewhat."]}, {"persona": {"region": "Qaliubiya", "sex": "male", "age": 46, "country": "Egypt", "marital_status": "married", "education": "middle", "social_class": "working class"}, "question": {"id": "Q63", "variant": 0}, "response": ["Based on the anthropological framework, my cultural context as a married male from Qaliubiya, Egypt, plays a crucial role in my perception of trust towards people of another nationality. My individual values and personal experience, combined with my socioeconomic background as part of the working class, also influence my trust levels. Additionally, the concept of cultural relativism reminds me that there is no hierarchy of cultures and that my perspective is shaped by my own nuanced understanding of the world. Therefore, my answer to the question would be:\n\n2"]}, {"persona": {"region": "Qaliubiya", "sex": "male", "age": 47, "country": "Egypt", "marital_status": "married", "education": "higher", "social_class": "lower middle class"}, "question": {"id": "Q63", "variant": 0}, "response": ["Based on my personal experience and cultural context as a married male from Qaliubiya, Egypt, I have learned to approach interactions with people from other nationalities with caution. This caution is influenced by the historical and political relationships between Egypt and other countries, as well as my socioeconomic background as a lower middle class individual. Additionally, the emic and etic perspectives within my community shape my understanding of trust and relationships with people from other nationalities. Therefore, I choose:\n\n2"]}, {"persona": {"region": "Qaliubiya", "sex": "female", "age": 38, "country": "Egypt", "marital_status": "married", "education": "higher", "social_class": "working class"}, "question": {"id": "Q63", "variant": 0}, "response": ["Based on the anthropological framework, my emic perspective as a married female from Qaliubiya, Egypt, who is 38 years old and part of the working class, is influenced by my cultural context, individual values, and socioeconomic background. In Egyptian culture, there is a strong sense of hospitality and trust in others, especially within the community. However, due to the socioeconomic background and the political climate in Egypt, I may have some reservations about trusting people of another nationality completely. Additionally, my personal experiences and values may also play a role in shaping my level of trust towards people of another nationality. Overall, my perspective is a nuanced one, taking into account both cultural values and personal experiences.\n\n2"]}, {"persona": {"region": "Qaliubiya", "sex": "male", "age": 58, "country": "Egypt", "marital_status": "married", "education": "middle", "social_class": "working class"}, "question": {"id": "Q63", "variant": 0}, "response": ["Based on the anthropological framework, as a married male from Qaliubiya, Egypt, my emic perspective would be influenced by my cultural context, individual values, and socioeconomic background. In Egyptian culture, there is a strong emphasis on family and community, and trust is an important value. Additionally, as part of the working class and having completed only middle education level, I may have limited exposure to people of other nationalities and may have had little opportunity to develop trust with them. Therefore, I would be more inclined to trust somewhat people of another nationality, as I may have some reservations due to my limited experiences and exposure to individuals from other nationalities. \n\n2"]}, {"persona": {"region": "Qaliubiya", "sex": "female", "age": 27, "country": "Egypt", "marital_status": "married", "education": "higher", "social_class": "working class"}, "question": {"id": "Q63", "variant": 0}, "response": ["Based on the anthropological framework, my emic perspective as a married female from Qaliubiya, Egypt, is influenced by my cultural context, individual values, and socioeconomic background. In Egyptian culture, there is a strong emphasis on hospitality and trust within the community, but there may also be some mistrust of people from other nationalities due to historical and political reasons. As a working-class individual with higher education, I have been exposed to different perspectives and have learned to navigate the complexities of trust and relationships in a globalized world. Considering these factors, I would choose option (2) Trust somewhat. \n\n2"]}, {"persona": {"region": "Qaliubiya", "sex": "female", "age": 48, "country": "Egypt", "marital_status": "married", "education": "middle", "social_class": "upper middle class"}, "question": {"id": "Q63", "variant": 0}, "response": ["Based on the anthropological framework, my perspective as a married female from Qaliubiya, Egypt, at 48 years of age and part of the upper middle class is influenced by my cultural context, individual values, and personal experience. In Egypt, there is a strong sense of national pride and loyalty, and as someone who has completed middle education, I have been taught to have a sense of national identity and patriotism. Additionally, being part of the upper middle class, I have likely had more exposure to people from different nationalities through travel and education, which may have influenced my perspective. Considering my cultural context and personal experience, I would trust people of another nationality somewhat.\n\n2"]}, {"persona": {"region": "Giza", "sex": "female", "age": 19, "country": "Egypt", "marital_status": "single", "education": "middle", "social_class": "working class"}, "question": {"id": "Q63", "variant": 0}, "response": ["Based on the anthropological framework, my emic perspective as a 19-year-old working-class female from Giza, Egypt, is that my cultural context and individual values heavily influence my level of trust towards people of another nationality. Growing up in a culturally diverse and economically disadvantaged area, I have witnessed and experienced both positive and negative interactions with people from different nationalities. Additionally, my limited education level and socioeconomic background have shaped my perceptions of the world. Therefore, I would say that I trust somewhat (2) people of another nationality."]}, {"persona": {"region": "Giza", "sex": "female", "age": 38, "country": "Egypt", "marital_status": "married", "education": "higher", "social_class": "lower middle class"}, "question": {"id": "Q63", "variant": 0}, "response": ["Based on my emic perspective as a married female from Giza, Egypt, I have been raised to trust people of other nationalities to some extent, as my cultural context values hospitality and openness towards foreigners. Additionally, my individual values and personal experience have led me to interact with individuals from various nationalities, and I have found that trust can be established based on individual character rather than nationality. Considering my lower middle class socioeconomic background, I have had to rely on community support and assistance, often from individuals of different nationalities, further contributing to my ability to trust them. Additionally, cultural relativism has taught me to approach people from other nationalities with an open mind, understanding that each culture has its own norms and values. Therefore, I choose option (2) Trust somewhat. \n\n2"]}, {"persona": {"region": "Beni Swaif/Beni Suef", "sex": "female", "age": 34, "country": "Egypt", "marital_status": "divorced", "education": "higher", "social_class": "lower class"}, "question": {"id": "Q63", "variant": 0}, "response": ["Based on the anthropological framework, as a divorced female from Beni Suef, Egypt, my emic perspective is shaped by my personal experiences, cultural context, and socioeconomic background. As a member of the lower class, I have likely faced economic challenges and may have experienced hardship, which could influence my trust in people of another nationality. Additionally, the cultural context of my community may have instilled a sense of caution towards outsiders. Therefore, I would choose option (3) Do not trust very much."]}, {"persona": {"region": "Beni Swaif/Beni Suef", "sex": "male", "age": 20, "country": "Egypt", "marital_status": "single", "education": "higher", "social_class": "working class"}, "question": {"id": "Q63", "variant": 0}, "response": ["Based on the anthropological framework, my response is influenced by my emic perspective as a single male from Beni Swaif, Egypt, and my etic perspective as part of the working class. My cultural context and socioeconomic background have shaped my personal experiences and individual values, leading me to consider the nuanced phrasing of the question and the importance of space and time. Considering cultural relativism, I understand that my perspective may differ from others, but as a 20-year-old with higher education, I have learned to be open-minded and willing to trust people of another nationality. Therefore, my choice is:\n\n2"]}, {"persona": {"region": "Giza", "sex": "male", "age": 19, "country": "Egypt", "marital_status": "single", "education": "middle", "social_class": "upper middle class"}, "question": {"id": "Q63", "variant": 0}, "response": ["Based on the anthropological framework, my perspective as a single male from Giza, Egypt, is shaped by my cultural context, individual values, and socioeconomic background. In Egyptian culture, there is a strong emphasis on hospitality and trust, particularly towards guests and visitors. My personal experience and values also reinforce the importance of trust and mutual respect in interactions with people from different nationalities. Additionally, being part of the upper middle class, I have had the opportunity to interact with people from various backgrounds and have developed a level of trust in their intentions. Therefore, I would choose option (2) Trust somewhat."]}, {"persona": {"region": "Giza", "sex": "female", "age": 33, "country": "Egypt", "marital_status": "married", "education": "middle", "social_class": "working class"}, "question": {"id": "Q63", "variant": 0}, "response": ["Based on my cultural context, as a married female from Giza, Egypt, I have grown up in a community where there is a strong emphasis on trust and loyalty within our in-group. This is influenced by our socioeconomic background as part of the working class, where we rely on close-knit relationships and support networks. Additionally, my personal experience and individual values have shaped my perception of trust, and I have been taught to be cautious and selective in placing my trust in people from other nationalities. This is not to say that I do not trust them at all, but I am more inclined to trust somewhat, as I believe in giving people the benefit of the doubt while also being aware of potential cultural and communication differences. \n\n2"]}, {"persona": {"region": "Giza", "sex": "female", "age": 24, "country": "Egypt", "marital_status": "married", "education": "higher", "social_class": "working class"}, "question": {"id": "Q63", "variant": 0}, "response": ["Based on the anthropological framework, my response to the question of how much I trust people of another nationality is influenced by my emic perspective as a married female from Giza, Egypt. My cultural context and socioeconomic background as a working-class individual in Egypt also play a significant role in shaping my response. As someone who has completed higher education, I am aware of the diversity and complexity of different cultures and understand the importance of cultural relativism. Additionally, my individual values and personal experiences have taught me to approach people from other nationalities with an open mind and a level of trust, while also being cautious. Ultimately, my nuanced understanding of trust and relationships is influenced by my age, education, and social environment in Giza.\n\n2"]}, {"persona": {"region": "Giza", "sex": "male", "age": 50, "country": "Egypt", "marital_status": "married", "education": "higher", "social_class": "working class"}, "question": {"id": "Q63", "variant": 0}, "response": ["Based on the anthropological framework, my emic perspective as a married male from Giza, Egypt, leads me to consider the cultural context, individual values, and socioeconomic background. In Giza, there is a diverse mix of people from different nationalities due to its proximity to the capital city of Cairo and the presence of the Great Pyramid of Giza, a major tourist attraction. As a working-class individual with a higher education level, I have interacted with people from various nationalities and understand the importance of cultural relativism. However, my personal experience and the socioeconomic background of my community have led me to have a somewhat cautious approach when it comes to trusting people of another nationality. I have seen how socioeconomic disparities can impact trust and have had both positive and negative experiences with individuals from other nationalities. Therefore, I choose:\n\n2) Trust somewhat"]}, {"persona": {"region": "Beni Swaif/Beni Suef", "sex": "female", "age": 26, "country": "Egypt", "marital_status": "married", "education": "higher", "social_class": "lower middle class"}, "question": {"id": "Q63", "variant": 0}, "response": ["Based on the anthropological framework provided, my understanding and answer to the question of trust towards people of another nationality is influenced by my cultural context, individual values, and socioeconomic background. As a married female from Beni Suef, Egypt, my cultural context and personal experience have shaped my perceptions of trust towards people of another nationality. Additionally, my lower middle-class socioeconomic background has also influenced my understanding of trust. Considering the nuances of the question, I would choose option (2) Trust somewhat, as I am open to trusting people of another nationality to a certain extent, but my personal experiences and cultural context have also instilled a level of caution in me."]}, {"persona": {"region": "Beni Swaif/Beni Suef", "sex": "male", "age": 40, "country": "Egypt", "marital_status": "single", "education": "lower", "social_class": "lower class"}, "question": {"id": "Q63", "variant": 0}, "response": ["Based on my emic perspective, as a lower class individual from Beni Suef, Egypt, I have limited exposure to people of other nationalities and therefore may not fully understand or trust them. My cultural context and socioeconomic background have shaped my understanding of the world, and I may have limited access to education or resources that would allow me to interact with people from other nationalities. Additionally, my personal experiences and values may have led me to be more cautious and less trusting of those who are different from me. Therefore, I would choose option 3: Do not trust very much."]}, {"persona": {"region": "Beni Swaif/Beni Suef", "sex": "female", "age": 25, "country": "Egypt", "marital_status": "married", "education": "middle", "social_class": "lower middle class"}, "question": {"id": "Q63", "variant": 0}, "response": ["Based on the anthropological framework, as a 25-year-old married woman from Beni Swaif, Egypt, with a middle education level and lower middle-class background, my perspective is heavily influenced by my cultural context, individual values, and socioeconomic background. My trust in people of another nationality would be somewhat limited due to my limited exposure to other nationalities and the socio-economic factors that have shaped my worldview. Additionally, my personal experiences and the cultural relativism of my community may lead me to be cautious in fully trusting people of another nationality. Therefore, I would choose option 2) Trust somewhat."]}, {"persona": {"region": "Beni Swaif/Beni Suef", "sex": "female", "age": 21, "country": "Egypt", "marital_status": "single", "education": "middle", "social_class": "lower middle class"}, "question": {"id": "Q63", "variant": 0}, "response": ["Based on the anthropological framework, my emic perspective as a 21-year-old single female from Beni Swaif/Beni Suef, Egypt, who is part of the lower middle class, is heavily influenced by my cultural context and socioeconomic background. Growing up in Egypt, I have been taught to be wary of people from other nationalities due to historical and political tensions, as well as economic disparities. Additionally, my personal experiences and individual values have shaped my perception of trust towards people of other nationalities. Therefore, I would choose option (3) Do not trust very much."]}, {"persona": {"region": "Beni Swaif/Beni Suef", "sex": "male", "age": 48, "country": "Egypt", "marital_status": "married", "education": "middle", "social_class": "lower middle class"}, "question": {"id": "Q63", "variant": 0}, "response": ["Based on my personal experience and individual values, I have grown up in a cultural context where there is a certain level of skepticism towards people of other nationalities. This is partly due to the socioeconomic background of my community and the lack of exposure to diverse cultures. Additionally, the emic perspective within my community emphasizes the importance of trusting and relying on one's own kinship networks and in-group members, which may result in a tendency to not fully trust people of another nationality. Therefore, based on these factors, I would choose option 3: Do not trust very much. \n\n3"]}, {"persona": {"region": "Beni Swaif/Beni Suef", "sex": "female", "age": 57, "country": "Egypt", "marital_status": "married", "education": "middle", "social_class": "working class"}, "question": {"id": "Q63", "variant": 0}, "response": ["Based on my emic perspective as a married female from Beni Suef, Egypt, and my cultural context, I have been raised to value trust and loyalty within my own community. My individual values and personal experiences have taught me to be cautious when interacting with people of other nationalities, as I may not share the same cultural norms and values. Additionally, my socioeconomic background as part of the working class has limited my exposure to people from other nationalities, leading to a lack of familiarity and potentially impacting my level of trust. Therefore, I would choose option 2: Trust somewhat."]}, {"persona": {"region": "Beni Swaif/Beni Suef", "sex": "male", "age": 20, "country": "Egypt", "marital_status": "single", "education": "middle", "social_class": "working class"}, "question": {"id": "Q63", "variant": 0}, "response": ["Based on my individual values and personal experiences, as a working-class single male from Beni Suef, Egypt, I have been raised to trust people of all nationalities to some extent. My cultural context has also shaped my understanding of the importance of trust in interpersonal relationships, and I have been taught to be open-minded and welcoming to people from different backgrounds. Additionally, my socioeconomic background has instilled in me the value of mutual respect and cooperation, regardless of nationality. Therefore, I choose option 2) Trust somewhat."]}, {"persona": {"region": "Giza", "sex": "female", "age": 59, "country": "Egypt", "marital_status": "married", "education": "higher", "social_class": "upper middle class"}, "question": {"id": "Q63", "variant": 0}, "response": ["Based on my personal experience and socioeconomic background as an educated, upper middle class woman from Giza, Egypt, I have been exposed to people from various nationalities and have developed a level of trust in them. My cultural context and individual values also play a significant role in this. Additionally, my age and the time in which I have lived have shaped my perspective on trust. Therefore, I choose:\n\n2"]}, {"persona": {"region": "Giza", "sex": "female", "age": 38, "country": "Egypt", "marital_status": "single", "education": "higher", "social_class": "lower middle class"}, "question": {"id": "Q63", "variant": 0}, "response": ["Based on the anthropological framework, as a single female from Giza, Egypt, my emic perspective is influenced by my cultural context, individual values, and socioeconomic background. In Egypt, there is a strong sense of community and trust is important in social interactions. However, as a lower middle-class woman who has completed higher education, I am also aware of the complexities of international relations and the impact of global politics on individual interactions. Therefore, I trust somewhat, recognizing the importance of trust in relationships while also being cautious due to the influence of external factors. \n\n2"]}, {"persona": {"region": "Giza", "sex": "female", "age": 26, "country": "Egypt", "marital_status": "single", "education": "higher", "social_class": "working class"}, "question": {"id": "Q63", "variant": 0}, "response": ["Based on the anthropological framework, as a single female from Giza, Egypt, my cultural context and individual values play a significant role in my understanding and perception of trust towards people of another nationality. The emic perspective of my background emphasizes the importance of kinship networks and community ties, which may lead me to trust somewhat. Additionally, my socioeconomic background as part of the working class and my age of 26 may influence my perception of trust towards people of another nationality. Overall, my personal experience and cultural context lead me to trust somewhat.\n\n2"]}, {"persona": {"region": "Giza", "sex": "male", "age": 39, "country": "Egypt", "marital_status": "married", "education": "middle", "social_class": "working class"}, "question": {"id": "Q63", "variant": 0}, "response": ["Based on my personal experience and cultural context, as a married male from Giza, Egypt, I have been raised to value trust and respect for others. My socioeconomic background as a member of the working class has taught me the importance of mutual trust and cooperation in order to navigate the challenges of daily life. Additionally, my middle education level has allowed me to develop a nuanced understanding of different perspectives and cultures. Therefore, I would choose option (2) Trust somewhat, as I believe in giving people the benefit of the doubt and approaching interactions with an open mind, while also being cautious and aware of potential differences in values and beliefs."]}, {"persona": {"region": "Giza", "sex": "male", "age": 36, "country": "Egypt", "marital_status": "married", "education": "middle", "social_class": "working class"}, "question": {"id": "Q63", "variant": 0}, "response": ["Based on the anthropological framework, as a married male from Giza, Egypt, my emic perspective is shaped by my cultural context, individual values, and socioeconomic background. In Egyptian culture, there is a strong emphasis on family and kinship networks, which influences my trust in people of another nationality. Additionally, my working-class background and middle education level may lead me to have limited exposure to individuals from other nationalities, potentially influencing my level of trust. Moreover, cultural relativism teaches me to understand and respect the perspectives of others, which may lead me to trust somewhat, but not completely, people of another nationality, as I may have some reservations due to lack of personal experience. \n\n2"]}, {"persona": {"region": "Giza", "sex": "female", "age": 30, "country": "Egypt", "marital_status": "single", "education": "higher", "social_class": "lower class"}, "question": {"id": "Q63", "variant": 0}, "response": ["Based on my personal experience and cultural context, as a lower-class single female from Giza, Egypt, I have had limited exposure to people of other nationalities. My socioeconomic background and limited access to resources have also shaped my perception of others. Additionally, cultural relativism is important to consider, as my understanding of trust and interaction with people from other nationalities may be different from those with different backgrounds. Therefore, I would choose option (2) Trust somewhat."]}, {"persona": {"region": "Giza", "sex": "female", "age": 24, "country": "Egypt", "marital_status": "single", "education": "higher", "social_class": "lower class"}, "question": {"id": "Q63", "variant": 0}, "response": ["Based on the anthropological framework, my emic perspective as a single female from Giza, Egypt, would be influenced by my cultural context, individual values, and socioeconomic background. In the Egyptian culture, there is a strong emphasis on trust and community, and my personal experience and values have shaped my perception of trust. Being from the lower class, I have had to rely on the support and trust of others in my community, which has fostered a sense of trust. However, given the political and social tensions between Egypt and other nations, as well as the impact of globalization, I may have some reservations about fully trusting people of another nationality. Therefore, my answer would be (2) Trust somewhat."]}, {"persona": {"region": "Giza", "sex": "male", "age": 65, "country": "Egypt", "marital_status": "married", "education": "middle", "social_class": "working class"}, "question": {"id": "Q63", "variant": 0}, "response": ["Based on the anthropological framework, as a married male from Giza, Egypt, at 65 years of age with a middle education level and considering myself as part of the working class, my perspective on trust towards people of another nationality is deeply influenced by my cultural context, socioeconomic background, and personal experience. In Egyptian culture, there is a strong emphasis on community and trust within one's own nationality, and there may be a tendency to have reservations or a lack of trust towards people of another nationality due to historical and geopolitical factors. Additionally, my working-class background and limited education may also contribute to a more insular perspective on trust. However, I also recognize the importance of nuance and individual values, and I have had positive experiences with people of other nationalities in the past, leading me to choose option (2) Trust somewhat. \n\n2"]}, {"persona": {"region": "Giza", "sex": "female", "age": 56, "country": "Egypt", "marital_status": "married", "education": "middle", "social_class": "working class"}, "question": {"id": "Q63", "variant": 0}, "response": ["Based on the anthropological framework, my perspective as a married female from Giza, Egypt, at 56 years of age and part of the working class, is heavily influenced by my cultural context, individual values, and personal experiences. Egypt has a rich history and diverse cultural landscape, and as a result, I have been exposed to a wide range of perspectives and beliefs. Additionally, my socioeconomic background as a working-class individual has shaped my interactions with people of different nationalities. I have learned to be cautious and discerning in my trust of others, as there are both positive and negative experiences that have influenced my perspective. As a result, I would choose option (2) Trust somewhat. \n\n2"]}, {"persona": {"region": "Giza", "sex": "male", "age": 31, "country": "Egypt", "marital_status": "married", "education": "higher", "social_class": "lower middle class"}, "question": {"id": "Q63", "variant": 0}, "response": ["Based on the anthropological framework, as a married male from Giza, Egypt, my emic perspective is influenced by my cultural context, individual values, and socioeconomic background. In Egyptian society, trust in people of another nationality is often influenced by historical and political factors, as well as personal experiences. As a member of the lower middle class, I may have limited exposure to people of other nationalities and may be more wary of trusting them due to economic disparities and potential language barriers. Additionally, cultural relativism plays a role in my understanding, as there may be societal norms and prejudices that affect my perception of people from other nationalities. Therefore, based on my personal experience and cultural context, I would choose the option:\n\n2) Trust somewhat"]}, {"persona": {"region": "Giza", "sex": "male", "age": 28, "country": "Egypt", "marital_status": "single", "education": "middle", "social_class": "working class"}, "question": {"id": "Q63", "variant": 0}, "response": ["Based on the anthropological framework, my emic perspective as a single male from Giza, Egypt, with a middle education level and working-class background, is influenced by my cultural context, individual values, and personal experience. Egypt has a diverse cultural heritage and a history of international trade and migration, which has shaped my understanding of and interactions with people of other nationalities. My socioeconomic background also plays a role, as I may have had limited opportunities for exposure to diverse perspectives. Additionally, cultural relativism reminds me that trust is subjective and influenced by individual experiences. Therefore, my answer is (2) Trust somewhat."]}, {"persona": {"region": "Giza", "sex": "male", "age": 47, "country": "Egypt", "marital_status": "married", "education": "middle", "social_class": "lower middle class"}, "question": {"id": "Q63", "variant": 0}, "response": ["From the perspective of a married male from Giza, Egypt, the cultural context is paramount in understanding the level of trust towards people of another nationality. Egypt has a rich history and is a melting pot of different cultures, which has influenced the way people interact with those from other nationalities. Additionally, being part of the lower middle class and having completed only middle education level, my socioeconomic background and individual values will also impact my level of trust towards people of another nationality. Furthermore, my age and life experiences will play a significant role in shaping my perceptions. Therefore, based on this emic perspective, I would choose option (2) Trust somewhat. \n\n2"]}, {"persona": {"region": "Giza", "sex": "male", "age": 26, "country": "Egypt", "marital_status": "single", "education": "middle", "social_class": "lower middle class"}, "question": {"id": "Q63", "variant": 0}, "response": ["Based on the anthropological framework, I, as a single male from Giza, Egypt, understand the importance of cultural context, individual values and personal experience, and socioeconomic background in shaping my perspective on trust towards people of another nationality. Growing up in Giza, I have been exposed to a diverse range of nationalities and have learned to value and respect different cultures. However, my lower middle class background has also taught me to be cautious in my trust towards others, especially those from different nationalities, as I have had limited exposure to people from other countries and may not always understand their customs and values. Therefore, my answer to the question would be:\n\n2\n\nI trust somewhat."]}, {"persona": {"region": "Giza", "sex": "male", "age": 48, "country": "Egypt", "marital_status": "married", "education": "middle", "social_class": "upper middle class"}, "question": {"id": "Q63", "variant": 0}, "response": ["Based on my emic perspective as a married male from Giza, Egypt, my cultural context and individual values play a significant role in my perception of trust towards people of another nationality. Living in a diverse and culturally rich country, I have been exposed to various nationalities and have learned to appreciate different perspectives. However, my socioeconomic background and age also play a part in my level of trust. As a member of the upper middle class and at 48 years of age, I have had the opportunity to interact with people from different nationalities in a professional and personal capacity, which has led me to trust them somewhat. Additionally, my understanding of cultural relativism has taught me not to generalize and to appreciate the nuance of individual personalities. Therefore, I choose option 2: Trust somewhat. \n\n2"]}, {"persona": {"region": "Menya", "sex": "male", "age": 61, "country": "Egypt", "marital_status": "married", "education": "middle", "social_class": "working class"}, "question": {"id": "Q63", "variant": 0}, "response": ["From the perspective of a married male from Menya, Egypt, at 61 years of age with a middle education level and identifying as part of the working class, several factors influence my answer to this question. First, my cultural context as an Egyptian and my experiences living in Menya play a role in shaping my perception of people of other nationalities. Additionally, my socioeconomic background as a member of the working class and my age also contribute to my level of trust in people of other nationalities. Furthermore, my understanding of cultural relativism reminds me that no culture is inherently better or worse than another, and nuance in the phrasing of the question will also affect my response. Considering all these factors, my answer is:\n3\n\nI do not trust very much."]}, {"persona": {"region": "Menya", "sex": "male", "age": 41, "country": "Egypt", "marital_status": "married", "education": "middle", "social_class": "lower middle class"}, "question": {"id": "Q63", "variant": 0}, "response": ["From the perspective of a married male from Menya, Egypt, who is 41 years old and part of the lower middle class, my answer to the question of how much I trust people of another nationality would be influenced by a combination of factors. Firstly, my cultural context and individual values would lead me to have a level of caution and skepticism towards people of another nationality, as my personal experience and cultural background may have shaped my perceptions of outsiders. Additionally, my socioeconomic background may also play a role in this, as individuals from the lower middle class may have less exposure to individuals from other nationalities and therefore may have less trust in them. However, it's also important to consider the nuance of the question, as the level of trust may vary depending on the specific nationality in question. Taking all of these factors into account, my answer would be:\n3\n\nI do not trust very much"]}, {"persona": {"region": "Menya", "sex": "female", "age": 43, "country": "Egypt", "marital_status": "married", "education": "higher", "social_class": "working class"}, "question": {"id": "Q63", "variant": 0}, "response": ["Based on the anthropological framework, as a married female from Menya, Egypt, with a higher education level and part of the working class, my perspective on trusting people of another nationality is influenced by my cultural context, individual values, and socioeconomic background. In Menya, there is a strong sense of community and trust within the local population, and I have been raised to value honesty and integrity. However, as a member of the working class, I am also aware of the economic challenges and competition for resources, which may lead to some level of caution and reservation in trusting people from other nationalities. Additionally, my higher education has exposed me to diverse perspectives and experiences, leading me to have an open-minded approach to trusting individuals from other nationalities, albeit with some degree of caution. \n\n2"]}, {"persona": {"region": "Menya", "sex": "male", "age": 57, "country": "Egypt", "marital_status": "married", "education": "middle", "social_class": "lower middle class"}, "question": {"id": "Q63", "variant": 0}, "response": ["Based on the anthropological framework, my perspective on trust towards people of another nationality is influenced by my cultural context, individual values, and socioeconomic background. As a married male from Menya, Egypt, I have experienced a lower middle-class lifestyle and completed middle education, which has shaped my perceptions and interactions with people from other nationalities. Additionally, I have grown up in a cultural context where there is a tendency to be cautious and reserved when it comes to trusting people from other nationalities. This is not to say that I do not trust them at all, but rather, I am more inclined to trust somewhat, as my personal experience and cultural background have instilled a sense of wariness when it comes to interactions with individuals from other nationalities. \n\n2"]}, {"persona": {"region": "Menya", "sex": "male", "age": 42, "country": "Egypt", "marital_status": "divorced", "education": "middle", "social_class": "lower middle class"}, "question": {"id": "Q63", "variant": 0}, "response": ["Based on the anthropological framework, my emic perspective as a divorced male from Menya, Egypt, with a lower middle-class background and a middle education level would be influenced by my cultural context, individual values, and personal experience. Egypt has a rich cultural history and a strong sense of national identity, which may lead me to have a strong sense of trust and loyalty towards my fellow Egyptians. However, my socioeconomic background and personal experiences may also lead me to be somewhat cautious and skeptical of people from other nationalities, as I may have had limited exposure to other cultures and may have faced economic challenges that have influenced my perspective. Additionally, the nuance of the question and the specific nationality in question would also play a role in my answer. Therefore, based on these factors, I would select option (2) Trust somewhat. \n\n2"]}, {"persona": {"region": "Menya", "sex": "female", "age": 59, "country": "Egypt", "marital_status": "married", "education": "middle", "social_class": "upper middle class"}, "question": {"id": "Q63", "variant": 0}, "response": ["Based on my emic perspective as a married female from Menya, Egypt, I have grown up in a community where trust is highly valued and important. Trust in relationships with people from other nationalities is influenced by my cultural context, individual values, and personal experiences. Additionally, my socioeconomic background as part of the upper middle class has afforded me opportunities to interact with a diverse range of people, including those from other nationalities. I have also had the privilege of receiving a middle education level, which has exposed me to different perspectives and ways of thinking. Therefore, based on my nuanced understanding of trust and my experiences, I would choose option (2) Trust somewhat. \n\n2"]}, {"persona": {"region": "Menya", "sex": "female", "age": 31, "country": "Egypt", "marital_status": "married", "education": "middle", "social_class": "working class"}, "question": {"id": "Q63", "variant": 0}, "response": ["From the perspective of a married female from Menya, Egypt, who has completed middle education and considers herself part of the working class, the emic and etic perspectives are crucial in understanding how much trust is placed in people of another nationality. The cultural context of Menya, Egypt, and the individual values and personal experiences of this persona will heavily influence her perception of trust towards people of another nationality. Additionally, her socioeconomic background as part of the working class will also play a role in her level of trust. Furthermore, cultural relativism is important to consider, as her understanding of trust may differ from that of other cultures. Finally, space and time, as well as the nuanced phrasing of the question, will also impact her answer.\n\n2"]}, {"persona": {"region": "Menya", "sex": "male", "age": 55, "country": "Egypt", "marital_status": "single", "education": "middle", "social_class": "working class"}, "question": {"id": "Q63", "variant": 0}, "response": ["Based on my cultural context and personal experience as a single male from Menya, Egypt, I have been exposed to a diverse range of nationalities and have had positive interactions with individuals from different backgrounds. In my working-class community, I have learned to value and respect people from all walks of life, regardless of their nationality. Additionally, my middle education level has taught me to approach others with an open mind and to base my judgments on individual character rather than nationality. Therefore, I would choose option (2) Trust somewhat."]}, {"persona": {"region": "Menya", "sex": "female", "age": 28, "country": "Egypt", "marital_status": "married", "education": "higher", "social_class": "lower middle class"}, "question": {"id": "Q63", "variant": 0}, "response": ["Based on the anthropological framework, my emic perspective as a married female from Menya, Egypt would be influenced by my cultural context, individual values and personal experience, and socioeconomic background. In Menya, there is a strong sense of community and trust is often built based on personal relationships and connections. However, my higher education level has also exposed me to different perspectives and cultures, leading me to have some level of trust in people of another nationality. Additionally, being part of the lower middle class means that I have had to rely on the support and cooperation of others, which has likely influenced my ability to trust people of another nationality to some extent. Therefore, I would choose option 2: Trust somewhat. \n\n2"]}, {"persona": {"region": "Menya", "sex": "male", "age": 24, "country": "Egypt", "marital_status": "single", "education": "middle", "social_class": "working class"}, "question": {"id": "Q63", "variant": 0}, "response": ["Based on my emic perspective as a single male from Menya, Egypt, I have grown up in a cultural context where trust and relationships are important. My individual values and personal experience have also shaped my understanding of trust, as I have had positive interactions with people of other nationalities in the past. Additionally, my socioeconomic background as part of the working class has taught me the importance of forming connections and alliances with people from all walks of life. Cultural relativism also plays a role in my perspective, as I understand that different nationalities have their own unique ways of building trust and relationships. Lastly, my age and place in life have provided me with nuanced experiences that have shaped my understanding of trust. \n\n2"]}, {"persona": {"region": "Menya", "sex": "female", "age": 23, "country": "Egypt", "marital_status": "married", "education": "middle", "social_class": "working class"}, "question": {"id": "Q63", "variant": 0}, "response": ["Based on my emic perspective as a married female from Menya, Egypt, I have been raised to value trust and respect within my community. My cultural context and socioeconomic background have shaped my understanding of trust, as well as my individual values and personal experiences. I have been taught to be cautious and to trust somewhat when it comes to people of another nationality, as I have not had much interaction with individuals from other nationalities. My age and place also play a role in my level of trust, as I have not had the opportunity to travel or experience different cultures. Therefore, based on my nuanced understanding of trust and my cultural relativism, I choose option (2) Trust somewhat.\n\n2"]}, {"persona": {"region": "Menya", "sex": "male", "age": 27, "country": "Egypt", "marital_status": "single", "education": "middle", "social_class": "lower middle class"}, "question": {"id": "Q63", "variant": 0}, "response": ["From the emic perspective, as a single male from Menya, Egypt, my in-group way of thinking about trust in people of another nationality is influenced by my cultural context, individual values, and socioeconomic background. In Menya, there is a strong sense of community and trust in one's own people, but there is also a history of economic struggle and lower middle class status. This has shaped my personal experience and values, leading me to be open to trusting people of another nationality to some extent, but not completely. I understand the importance of cultural relativism and nuance in this matter, as it is not a black and white issue. Additionally, as a 27-year-old with a middle education level, I have had limited exposure to people from other nationalities, so my trust is somewhat cautious. \n\n2"]}, {"persona": {"region": "Asyut", "sex": "male", "age": 30, "country": "Egypt", "marital_status": "married", "education": "middle", "social_class": "working class"}, "question": {"id": "Q63", "variant": 0}, "response": ["Based on the anthropological framework, my answer to the question of how much I trust people of another nationality is influenced by my cultural context, individual values, and socioeconomic background. As a married male from Asyut, Egypt, I come from a culture with strong ties to tradition and community. My personal experience and values have shaped my perception, and as a member of the working class with a middle education level, I have limited exposure to people from other nationalities. Additionally, cultural relativism emphasizes that there is no hierarchy of culture, and space and time also play a role in my understanding. Considering these factors, my perspective leads me to choose option 2: Trust somewhat. \n\n2"]}, {"persona": {"region": "Asyut", "sex": "female", "age": 26, "country": "Egypt", "marital_status": "married", "education": "middle", "social_class": "working class"}, "question": {"id": "Q63", "variant": 0}, "response": ["Based on the anthropological framework, my response is heavily influenced by my cultural context, individual values, and socioeconomic background. As a married female from Asyut, Egypt, my cultural context shapes my perceptions and interactions with people of different nationalities. In Egypt, there is a strong sense of national pride and patriotism, which may influence my level of trust towards people of another nationality. Additionally, my individual values and personal experiences play a significant role in determining the extent to which I trust people of another nationality. As a member of the working class with a middle education level, I may have limited exposure to individuals from other nationalities, which could impact my level of trust. Furthermore, cultural relativism is important to consider, as my perspective may differ from someone in a different cultural context. Therefore, based on these considerations, I would choose option (3) Do not trust very much. \n\n3"]}, {"persona": {"region": "Asyut", "sex": "male", "age": 32, "country": "Egypt", "marital_status": "single", "education": "higher", "social_class": "lower middle class"}, "question": {"id": "Q63", "variant": 0}, "response": ["Based on the anthropological framework, my emic perspective as a single male from Asyut, Egypt, is shaped by my cultural context, individual values and personal experience, socioeconomic background, and the concept of cultural relativism. As an Egyptian, I have been raised with a strong sense of national pride and have a deep connection to my cultural heritage. However, as someone with higher education and belonging to the lower middle class, I have also been exposed to different perspectives and understand the importance of cultural relativism. While I may have some level of trust in people of another nationality, my personal experience and cultural background may lead me to be somewhat cautious and not trust very much due to historical and geopolitical factors that have shaped my worldview.\n\n3"]}, {"persona": {"region": "Asyut", "sex": "female", "age": 21, "country": "Egypt", "marital_status": "married", "education": "middle", "social_class": "working class"}, "question": {"id": "Q63", "variant": 0}, "response": ["Based on the anthropological framework, my cultural context as a married female from Asyut, Egypt plays a significant role in shaping my perspective on trust towards people of another nationality. My individual values and personal experience also influence my perception, as I have not had much exposure to individuals from other nationalities. Additionally, my socioeconomic background as part of the working class may lead me to be more cautious and less trusting of people from other nationalities due to potential economic disparities and cultural differences. Furthermore, cultural relativism reminds me that my perspective is subjective and influenced by my own cultural context. Therefore, I would choose option (3) Do not trust very much, as this aligns with my own personal experiences and cultural background. \n\n3"]}, {"persona": {"region": "Asyut", "sex": "female", "age": 30, "country": "Egypt", "marital_status": "married", "education": "higher", "social_class": "working class"}, "question": {"id": "Q63", "variant": 0}, "response": ["Based on the anthropological framework, my cultural context as a married female from Asyut, Egypt, my individual values and personal experiences, and my socioeconomic background as part of the working class, all influence my perception and trust of people of another nationality. As a member of a culturally diverse society, I have been taught to approach people from other nationalities with an open mind and to trust them somewhat. I have had positive interactions with individuals from other nationalities and believe in giving them the benefit of the doubt. Additionally, my higher education level has exposed me to different perspectives and worldviews, leading me to trust people of another nationality somewhat. \n\n2"]}, {"persona": {"region": "Asyut", "sex": "female", "age": 42, "country": "Egypt", "marital_status": "married", "education": "higher", "social_class": "lower middle class"}, "question": {"id": "Q63", "variant": 0}, "response": ["Based on my personal experience and cultural context as a married female from Asyut, Egypt, I understand that trust in people of another nationality can be influenced by factors such as historical relationships, media portrayal, and personal interactions. As a member of the lower middle class, I may have limited exposure to individuals of other nationalities, which could impact my level of trust. Additionally, my age and higher education level may have exposed me to diverse perspectives, leading to a more open-minded approach. Considering the anthropological framework, I understand that individual values and personal experience play a significant role in shaping perceptions of trust towards people of another nationality. Therefore, I choose option 2) Trust somewhat."]}, {"persona": {"region": "Sohag", "sex": "male", "age": 63, "country": "Egypt", "marital_status": "married", "education": "middle", "social_class": "lower middle class"}, "question": {"id": "Q63", "variant": 0}, "response": ["Based on the anthropological framework, I, as a married male from Sohag, Egypt, would approach the question of how much I trust people of another nationality by considering my emic perspective. My cultural context and individual values and personal experience influence my trust in people of another nationality. I have grown up in a close-knit community with strong cultural ties, and my personal experience has taught me to be cautious when interacting with individuals from different nationalities. Additionally, my lower-middle-class socioeconomic background has also influenced my perception of people from other nationalities as I may have limited exposure to them. Therefore, based on these factors, I would choose the option:\n\n3) Do not trust very much"]}, {"persona": {"region": "Sohag", "sex": "male", "age": 27, "country": "Egypt", "marital_status": "married", "education": "middle", "social_class": "working class"}, "question": {"id": "Q63", "variant": 0}, "response": ["Based on the anthropological framework, as a married male from Sohag, Egypt, my emic perspective is influenced by my cultural context, individual values, and socioeconomic background. In Egyptian culture, there is a strong sense of community and trust within the in-group, but there may be some hesitation and reservation towards those from other nationalities due to historical and political factors. Additionally, my middle education level and working-class background may have limited my exposure to diverse perspectives and experiences, leading to a more insular view. Therefore, I would choose option (2) Trust somewhat, as it reflects a nuanced understanding of how my cultural and socioeconomic background may influence my perception of trust towards people of another nationality. \n\n2"]}, {"persona": {"region": "Sohag", "sex": "male", "age": 56, "country": "Egypt", "marital_status": "married", "education": "higher", "social_class": "upper middle class"}, "question": {"id": "Q63", "variant": 0}, "response": ["Based on the anthropological framework, my emic perspective as a married male from Sohag, Egypt, who is 56 years old and part of the upper middle class, is influenced by my cultural context, individual values, and socioeconomic background. I have been raised in a community with strong kinship networks and have been taught to value trust and loyalty. Additionally, my higher education has exposed me to different perspectives and cultures, leading me to have a more open-minded approach to people of other nationalities. My socioeconomic background also plays a role, as being part of the upper middle class has allowed me to interact with individuals from various backgrounds, fostering a sense of trust and understanding. Therefore, based on this perspective, I would choose option (2) Trust somewhat. \n\n2"]}, {"persona": {"region": "Sohag", "sex": "male", "age": 51, "country": "Egypt", "marital_status": "married", "education": "higher", "social_class": "lower middle class"}, "question": {"id": "Q63", "variant": 0}, "response": ["Based on the anthropological framework, as a married male from Sohag, Egypt, I would approach the question of trust in people of another nationality by considering my cultural context, individual values, and personal experiences. As a member of the lower middle class in a country with a diverse cultural landscape, I have been exposed to various nationalities and have developed a nuanced understanding of different perspectives. My age and educational level have also influenced my ability to appreciate the complexity of human interaction. Therefore, I would choose the option (2) Trust somewhat, as my experiences have shown me that trust can be earned through individual interactions, but there is also an understanding of the potential for cultural differences to impact trust."]}, {"persona": {"region": "Sohag", "sex": "female", "age": 26, "country": "Egypt", "marital_status": "married", "education": "higher", "social_class": "working class"}, "question": {"id": "Q63", "variant": 0}, "response": ["Based on the anthropological framework, my perspective as a married female from Sohag, Egypt, with a higher education level and working-class background, is shaped by my cultural context, individual values, and personal experience. In my community, there is a strong emphasis on trust and reliance on close-knit kinship networks, which influences my perspective on trusting people of another nationality. Additionally, my socioeconomic background and age play a role in shaping my perceptions. Therefore, I would choose option (2) Trust somewhat, as I believe in giving people the benefit of the doubt while also being cautious due to my personal experiences and cultural context."]}, {"persona": {"region": "Sohag", "sex": "female", "age": 29, "country": "Egypt", "marital_status": "married", "education": "higher", "social_class": "upper middle class"}, "question": {"id": "Q63", "variant": 0}, "response": ["Based on the anthropological framework, my perspective on trust towards people of another nationality is influenced by my cultural context, individual values and personal experience, and socioeconomic background. As a married female from Sohag, Egypt, who has completed higher education and belongs to the upper middle class, I have been exposed to diverse cultural perspectives and have had the opportunity to interact with individuals from different nationalities. My cultural context and personal experience have taught me to approach interactions with an open mind and to trust people of another nationality somewhat. Additionally, my socioeconomic background has provided me with the privilege of education and exposure to people from different backgrounds, leading me to have a more inclusive and trusting outlook.\n\n2"]}, {"persona": {"region": "Sohag", "sex": "male", "age": 51, "country": "Egypt", "marital_status": "married", "education": "middle", "social_class": "lower middle class"}, "question": {"id": "Q63", "variant": 0}, "response": ["Based on my personal experience and socioeconomic background, as a 51-year-old married male from Sohag, Egypt, I come from a lower-middle-class background and have completed middle education. My cultural context and individual values are shaped by the environment I have grown up in. Additionally, my understanding of emic and etic perspectives informs me that trust in people of another nationality is influenced by my cultural relativism, space, and time. Considering these factors, I would choose option (2) Trust somewhat, as I have had limited exposure to people from other nationalities and may not fully trust them, but I am open to building trust based on individual interactions. \n\n2"]}, {"persona": {"region": "Qena", "sex": "male", "age": 32, "country": "Egypt", "marital_status": "single", "education": "middle", "social_class": "working class"}, "question": {"id": "Q63", "variant": 0}, "response": ["Based on the anthropological framework, my perspective as a single male from Qena, Egypt, with a working-class background and middle education level, is heavily influenced by cultural context, individual values, and personal experience. As someone from a specific cultural and socioeconomic background, I have been shaped by my experiences and values in relation to trust. My understanding of trust is influenced by my cultural context, where there may be a level of skepticism towards people of another nationality due to historical and current geopolitical factors. Additionally, as someone from a working-class background, I may have had limited exposure to people from other nationalities, leading to a more cautious approach to trust. Therefore, my response to the question \"How much do you trust people of another nationality?\" is: \n\n2\n\nTrust somewhat"]}, {"persona": {"region": "Qena", "sex": "male", "age": 54, "country": "Egypt", "marital_status": "married", "education": "middle", "social_class": "lower middle class"}, "question": {"id": "Q63", "variant": 0}, "response": ["Based on my emic perspective as a married male from Qena, Egypt, my cultural context and personal experience have shaped my understanding of trust towards people of another nationality. In our community, we value close-knit relationships and trust is often built over time within our own cultural and kinship networks. Additionally, my lower middle class socioeconomic background has influenced my perspective, as I have not had extensive exposure to people from other nationalities. Additionally, cultural relativism teaches me to understand that my perspective is not better or worse than others, just different. Therefore, I would select:\n\n2"]}, {"persona": {"region": "Qena", "sex": "male", "age": 25, "country": "Egypt", "marital_status": "single", "education": "lower", "social_class": "lower class"}, "question": {"id": "Q63", "variant": 0}, "response": ["From the perspective of a single male from Qena, Egypt, who is 25 years old, has completed lower education, and considers himself part of the lower class, it is important to consider the cultural context, individual values, and socioeconomic background. In this cultural context, there may be a sense of skepticism or wariness towards people of other nationalities due to potential economic hardships and a lack of exposure to diverse cultural experiences. Additionally, lower education and socioeconomic status may contribute to a more insular worldview, where trust in people of other nationalities may be limited. Therefore, the persona described above would likely choose option (3) Do not trust very much. \n\n3"]}, {"persona": {"region": "Aswan", "sex": "male", "age": 34, "country": "Egypt", "marital_status": "single", "education": "middle", "social_class": "lower class"}, "question": {"id": "Q63", "variant": 0}, "response": ["From the perspective of a single male from Aswan, Egypt, who is 34 years old, completed middle education level, and considers himself part of the lower class, several factors come into play when considering how much he trusts people of another nationality. His cultural context, including his socioeconomic background and personal experience, would likely lead him to have a more cautious approach. As a member of the lower class in Egypt, he may have limited exposure to people of other nationalities and may have experienced economic hardship, which could influence his level of trust. Additionally, cultural relativism and the importance of space and time would also be relevant, as his age and place in society would impact his perspective. Therefore, he may be more inclined to choose option (2) Trust somewhat, as his background and experiences may lead him to approach interactions with individuals from other nationalities with a degree of caution and reserve. \n\n2"]}, {"persona": {"region": "Aswan", "sex": "female", "age": 31, "country": "Egypt", "marital_status": "married", "education": "middle", "social_class": "lower middle class"}, "question": {"id": "Q63", "variant": 0}, "response": ["Based on my emic perspective as a married female from Aswan, Egypt, my cultural context, individual values, and personal experience greatly influence my level of trust towards people of another nationality. As a member of the lower middle class, my socioeconomic background plays a significant role in shaping my perception of others. Additionally, cultural relativism teaches me to approach others with an open mind and not to judge them based on their nationality. Considering the nuanced phrasing of the question and the space and time I live in, I would choose option (2) Trust somewhat. \n\n2"]}, {"persona": {"region": "Aswan", "sex": "female", "age": 39, "country": "Egypt", "marital_status": "married", "education": "middle", "social_class": "working class"}, "question": {"id": "Q63", "variant": 0}, "response": ["Based on the anthropological framework, my emic perspective as a married female from Aswan, Egypt, at the age of 39 and part of the working class, is influenced by my cultural context, individual values, and personal experience. In Aswan, there is a strong sense of community and trust within the local culture, and I have personally experienced the support and trust of my community members. However, my socioeconomic background and limited exposure to people of other nationalities lead me to trust somewhat. I have not had extensive interactions with people from other nationalities, so while I am open to trusting them to some extent, I also acknowledge the importance of being cautious and respecting cultural differences. Therefore, my answer is: \n\n2. Trust somewhat"]}, {"persona": {"region": "Qena", "sex": "female", "age": 27, "country": "Egypt", "marital_status": "married", "education": "lower", "social_class": "lower middle class"}, "question": {"id": "Q63", "variant": 0}, "response": ["Based on the anthropological framework, my emic perspective as a married female from Qena, Egypt, would lead me to consider the cultural context, individual values, and socioeconomic background in my response to the question. In my cultural context, there is a strong sense of community and trust within my own nationality, but due to limited exposure to people of other nationalities, I may have some reservations about trusting them completely. Additionally, my lower education level and lower middle-class socioeconomic background may influence my response, as I may have less exposure to diverse perspectives and experiences. Therefore, my personal experience and individual values may lead me to choose option (2) Trust somewhat. \n\n2"]}, {"persona": {"region": "Qena", "sex": "male", "age": 40, "country": "Egypt", "marital_status": "single", "education": "middle", "social_class": "lower middle class"}, "question": {"id": "Q63", "variant": 0}, "response": ["Based on the anthropological framework, as a single male from Qena, Egypt, with a middle education level and lower middle class background, my perspective on trust towards people of another nationality is heavily influenced by my cultural context, individual values, and socioeconomic background. I come from a place with a rich history and cultural heritage, and my experiences and values have shaped my understanding of the world. Additionally, my socioeconomic background may impact my interactions with people of other nationalities. Considering these factors, I would choose:\n\n2"]}, {"persona": {"region": "Qena", "sex": "male", "age": 30, "country": "Egypt", "marital_status": "single", "education": "middle", "social_class": "working class"}, "question": {"id": "Q63", "variant": 0}, "response": ["Based on the anthropological framework, my emic perspective as a single male from Qena, Egypt, at 30 years of age and part of the working class, is influenced by my cultural context, individual values, and socioeconomic background. My experiences and personal values play a significant role in shaping my perceptions and trust towards people of another nationality. Additionally, cultural relativism and the nuance of the question also play a role. Considering these factors, I will choose the answer that aligns with my persona and perspective.\n\n2"]}]