[{"persona": {"region": "Fayoum", "sex": "male", "age": 46, "country": "Egypt", "marital_status": "married", "education": "higher", "social_class": "lower middle class"}, "question": {"id": "Q150", "variant": 0}, "response": ["Based on the anthropological framework, my cultural context as a married male from Fayoum, Egypt, and my socioeconomic background as part of the lower middle class would heavily influence my answer. In Egypt, there is a strong emphasis on family and community, and security is a significant concern due to economic instability and political unrest. Additionally, my age and education level would likely lead me to prioritize security over freedom, as I may have experienced firsthand the challenges and uncertainties that come with economic struggles and political upheaval. Therefore, I would choose option (2) Security."]}, {"persona": {"region": "Fayoum", "sex": "female", "age": 30, "country": "Egypt", "marital_status": "married", "education": "middle", "social_class": "lower middle class"}, "question": {"id": "Q150", "variant": 0}, "response": ["Based on the anthropological framework, as a married female from Fayoum, Egypt, my perspective is shaped by my cultural context, individual values, socioeconomic background, and personal experience. In Egypt, the societal norms and cultural values prioritize security and stability, especially for women. Additionally, as part of the lower middle class, I am more likely to value security as it provides a sense of stability and comfort in my daily life. Furthermore, my personal experience has shown me that security is essential for the well-being of my family and myself. Therefore, considering all these factors, I would choose:\n\n2) Security"]}, {"persona": {"region": "Fayoum", "sex": "male", "age": 60, "country": "Egypt", "marital_status": "married", "education": "higher", "social_class": "working class"}, "question": {"id": "Q150", "variant": 0}, "response": ["Based on the anthropological framework, my perspective is influenced by my cultural context, individual values, and socioeconomic background. As a married male from Fayoum, Egypt, I have been shaped by the cultural values and societal norms of my community. Additionally, my personal experience and socioeconomic background as a working-class individual have influenced my perception of the world. Considering the nuanced phrasing of the question and the importance of cultural relativism, I believe that security holds more value for me personally, as it provides stability and protection for my family and community. Therefore, I choose option 2 - Security."]}, {"persona": {"region": "Fayoum", "sex": "male", "age": 20, "country": "Egypt", "marital_status": "single", "education": "middle", "social_class": "lower middle class"}, "question": {"id": "Q150", "variant": 0}, "response": ["Based on the anthropological framework, my personal experience and socioeconomic background as a 20-year-old single male from Fayoum, Egypt, who completed middle education level and considers himself part of the lower middle class, heavily influence my perspective. In this cultural context, the value of security is paramount due to the socioeconomic challenges and political instability in the region. The need for stability and safety outweighs the desire for personal freedom, as security is necessary for survival and prosperity. Therefore, I choose option (2) Security."]}, {"persona": {"region": "Fayoum", "sex": "female", "age": 39, "country": "Egypt", "marital_status": "married", "education": "higher", "social_class": "lower middle class"}, "question": {"id": "Q150", "variant": 0}, "response": ["Based on the anthropological framework, my perspective as a married female from Fayoum, Egypt, at the age of 39 and belonging to the lower middle class, is influenced by my cultural context, individual values, and socioeconomic background. In my cultural context, security and stability are essential for the well-being of my family and myself. My personal experience and values prioritize the safety and protection of my loved ones, and my socioeconomic background emphasizes the need for security in a society where opportunities for advancement may be limited. Therefore, considering all these factors, I choose:\n\n2) Security"]}, {"persona": {"region": "Fayoum", "sex": "male", "age": 33, "country": "Egypt", "marital_status": "married", "education": "higher", "social_class": "working class"}, "question": {"id": "Q150", "variant": 0}, "response": ["Based on the anthropological framework, as a married male from Fayoum, Egypt, I would consider my cultural context, socioeconomic background, and personal values and experiences when answering this question. In my community, the concept of security is highly valued due to the economic instability and political unrest. As a working-class individual, the security of my family and livelihood is of utmost importance. Additionally, my personal experiences and values have shaped my perspective, leading me to prioritize security over freedom as it directly impacts my ability to provide for my family and ensure their well-being. Therefore, I choose option 2) Security."]}, {"persona": {"region": "Port Said", "sex": "female", "age": 45, "country": "Egypt", "marital_status": "married", "education": "higher", "social_class": "lower middle class"}, "question": {"id": "Q150", "variant": 0}, "response": ["Based on the anthropological framework, my response is shaped by my individual values, personal experiences, and socioeconomic background as a married female from Port Said, Egypt. In my cultural context, the importance of security is paramount, given the political and economic instability in the region. As a member of the lower middle class, my socioeconomic background has influenced my perception that security is a fundamental need for my family and me, as it provides stability and peace of mind. Additionally, my age and life experiences have shown me the significance of security in ensuring the well-being of my loved ones. Therefore, I believe that security is more important than freedom in my life.\n\n2"]}, {"persona": {"region": "Port Said", "sex": "male", "age": 42, "country": "Egypt", "marital_status": "married", "education": "middle", "social_class": "lower middle class"}, "question": {"id": "Q150", "variant": 0}, "response": ["Based on the anthropological framework, my perspective as a married male from Port Said, Egypt, is heavily influenced by my cultural context, socioeconomic background, and personal experience. In my community, there is a strong emphasis on family and social connections, which are integral to our sense of security. Additionally, as part of the lower middle class, I have experienced economic hardships that have made security a top priority in my life. Furthermore, living in a region with political and social unrest has made me value security even more. Therefore, considering these factors, I believe that security is more important than freedom.\n\n2"]}, {"persona": {"region": "Port Said", "sex": "male", "age": 28, "country": "Egypt", "marital_status": "single", "education": "middle", "social_class": "lower middle class"}, "question": {"id": "Q150", "variant": 0}, "response": ["Based on the anthropological framework, my emic perspective is influenced by my individual values and personal experiences, as well as my socioeconomic background. As a single male from Port Said, Egypt, who considers himself part of the lower middle class and has completed middle education level, my understanding of the importance of freedom and security is shaped by my cultural context and socioeconomic background. In Egypt, there is a strong emphasis on security due to political and social instability, and as someone from the lower middle class, I am likely to prioritize security in order to protect my family and livelihood. Therefore, based on my personal experiences and cultural context, I would choose option (2) Security. \n\n2"]}, {"persona": {"region": "Port Said", "sex": "female", "age": 30, "country": "Egypt", "marital_status": "married", "education": "higher", "social_class": "lower middle class"}, "question": {"id": "Q150", "variant": 0}, "response": ["Based on the anthropological framework, my perspective as a 30-year-old married female from Port Said, Egypt, who completed higher education and considers herself part of the lower middle class, is heavily influenced by my cultural context, individual values, and socioeconomic background. In Egypt, there is a strong emphasis on security due to political instability and economic challenges, which impacts the daily lives of individuals and families. Additionally, as a woman, I value security in terms of feeling safe in my community and within my family. However, my education and exposure to different ideas have also shaped my belief in the importance of freedom, especially in terms of personal expression and opportunities for growth. I understand that both freedom and security are important, but based on my experiences and values, I believe that freedom is more crucial for personal and societal development.\n\n2"]}, {"persona": {"region": "Port Said", "sex": "male", "age": 30, "country": "Egypt", "marital_status": "divorced", "education": "middle", "social_class": "lower middle class"}, "question": {"id": "Q150", "variant": 0}, "response": ["Based on the anthropological framework, my personal experience as a divorced male from Port Said, Egypt, and my lower middle class socioeconomic background heavily influence my answer to this question. In the cultural context of Egypt, the priority is often placed on security due to political instability and economic challenges. Additionally, my individual values and personal experience have led me to prioritize security as I have likely experienced firsthand the impact of insecurity on my life. Furthermore, the emic perspective from within my community may also emphasize the importance of security for stability and survival. Therefore, I choose:\n\n2) Security"]}, {"persona": {"region": "Port Said", "sex": "female", "age": 19, "country": "Egypt", "marital_status": "single", "education": "middle", "social_class": "lower middle class"}, "question": {"id": "Q150", "variant": 0}, "response": ["Based on my cultural context as a single female from Port Said, Egypt, my emic perspective is heavily influenced by the societal expectations and norms. My socioeconomic background as part of the lower middle class also plays a significant role in my understanding of this question. Additionally, my age and level of education have shaped my individual values and personal experience. In my community, security is often prioritized due to the political and social instability in the region. Therefore, I am inclined to choose option 2: Security."]}, {"persona": {"region": "Fayoum", "sex": "male", "age": 40, "country": "Egypt", "marital_status": "married", "education": "middle", "social_class": "working class"}, "question": {"id": "Q150", "variant": 0}, "response": ["From an emic perspective, as a married male from Fayoum, Egypt, my cultural context and socioeconomic background play a pivotal role in my understanding and answer to this question. In my community, there is a strong emphasis on family and community ties, and security is prioritized for the well-being of our families. Additionally, my working-class status and middle education level have shaped my values and personal experiences, leading me to prioritize security for the stability and safety of my family. Furthermore, considering the current political and economic situation in Egypt, security is crucial for the stability and future of my family. Therefore, based on my cultural context, individual values, and socioeconomic background, I would choose option (2) Security. \n\n2"]}, {"persona": {"region": "Fayoum", "sex": "male", "age": 23, "country": "Egypt", "marital_status": "single", "education": "higher", "social_class": "lower middle class"}, "question": {"id": "Q150", "variant": 0}, "response": ["Based on the anthropological framework, as a 23-year-old single male from Fayoum, Egypt, who has completed higher education and considers myself part of the lower middle class, my perspective is heavily influenced by my cultural context, individual values, and socioeconomic background. In Egypt, there is a strong emphasis on security due to political instability and economic challenges, which has a significant impact on my perception. Additionally, my personal experience and values also play a role in shaping my perspective. Given these factors, I prioritize security over freedom as it directly impacts my daily life and the well-being of my family and community.\n\n2"]}, {"persona": {"region": "Fayoum", "sex": "female", "age": 38, "country": "Egypt", "marital_status": "married", "education": "middle", "social_class": "lower middle class"}, "question": {"id": "Q150", "variant": 0}, "response": ["Based on the anthropological framework, as a married female from Fayoum, Egypt, my emic perspective is heavily influenced by my cultural context, individual values, and socioeconomic background. In my community, security is a top priority due to the political instability and economic challenges we face. My personal experience and values also emphasize the importance of security for the well-being of my family. Additionally, my lower middle-class status means that I am more likely to prioritize security over freedom, as financial stability and safety are essential for survival in our socio-economic context.\n\n2"]}, {"persona": {"region": "Fayoum", "sex": "male", "age": 32, "country": "Egypt", "marital_status": "married", "education": "middle", "social_class": "lower middle class"}, "question": {"id": "Q150", "variant": 0}, "response": ["From the perspective of a married male from Fayoum, Egypt, who is 32 years old, has completed middle education, and considers himself part of the lower middle class, several factors are crucial in considering the importance of freedom versus security. In this cultural context, socioeconomic background plays a significant role in shaping individual values and personal experiences. Additionally, the cultural context of Egypt and the societal expectations within this community also influence perceptions of freedom and security. Moreover, the emic and etic perspectives within this cultural context may prioritize security due to the political and social instability in the region. Taking into account the nuanced phrasing of the question and the individual's background, the most important aspect is likely to be security. \n\n2"]}, {"persona": {"region": "Fayoum", "sex": "male", "age": 31, "country": "Egypt", "marital_status": "married", "education": "higher", "social_class": "working class"}, "question": {"id": "Q150", "variant": 0}, "response": ["Based on the anthropological framework, as a married male from Fayoum, Egypt, my emic perspective is shaped by my cultural context, individual values, and socioeconomic background. In my community, the value of security is paramount due to the economic instability and political unrest. My personal experience as a working-class individual has taught me that without security, freedom is meaningless. Additionally, the cultural relativism in our society emphasizes the collective well-being over individual freedom, and my age and socioeconomic background further reinforce the importance of security for my family and community. Therefore, I choose option 2: Security. \n\n2"]}, {"persona": {"region": "Fayoum", "sex": "male", "age": 31, "country": "Egypt", "marital_status": "married", "education": "middle", "social_class": "lower middle class"}, "question": {"id": "Q150", "variant": 0}, "response": ["Based on the anthropological framework, my perspective is shaped by my cultural context, socioeconomic background, individual values, personal experience, and the nuanced phrasing of the question. As a married male from Fayoum, Egypt, my cultural context and values emphasize the importance of security, both for myself and my family. Growing up in a lower middle-class household, I have experienced the challenges of economic instability and understand the importance of security in providing stability and peace of mind. Additionally, my personal experience and age have led me to prioritize security over freedom, as I have seen the impact of insecurity and instability on my community. Therefore, my answer is (2) Security."]}, {"persona": {"region": "Fayoum", "sex": "female", "age": 32, "country": "Egypt", "marital_status": "married", "education": "middle", "social_class": "lower middle class"}, "question": {"id": "Q150", "variant": 0}, "response": ["From an emic perspective, as a married female from Fayoum, Egypt, my cultural context and socioeconomic background greatly influence my answer to this question. In my community, the role of women is often tied to security - financial security, physical security, and social security. As a lower middle class individual, my personal experience and individual values also lead me to prioritize security over freedom. This is not to say that freedom is not important, but in my cultural and socioeconomic context, security is essential for survival and well-being. Additionally, cultural relativism reminds us that different cultures and individuals may prioritize different values, and my nuanced understanding of this question leads me to choose security as more important.\n\n2"]}, {"persona": {"region": "Ismailia", "sex": "male", "age": 53, "country": "Egypt", "marital_status": "married", "education": "middle", "social_class": "lower middle class"}, "question": {"id": "Q150", "variant": 0}, "response": ["Based on the anthropological framework, as a married male from Ismailia, Egypt, my cultural context and socioeconomic background heavily influence my perspective. In Egypt, family and community are highly valued, and security is a major concern due to political instability and economic challenges. Additionally, my lower middle class status means that I prioritize the security of my family and financial stability. My age and personal experience also lead me to value security and stability over freedom, as I have seen the impact of instability on my community. Therefore, I choose option 2: Security."]}, {"persona": {"region": "Ismailia", "sex": "male", "age": 38, "country": "Egypt", "marital_status": "married", "education": "higher", "social_class": "working class"}, "question": {"id": "Q150", "variant": 0}, "response": ["Based on the anthropological framework, my response to the question of whether freedom or security is more important is influenced by my cultural context, socioeconomic background, and individual values. As a married male from Ismailia, Egypt, I am part of the working class and have likely faced various challenges in providing for my family. In this context, security holds significant importance as it ensures the well-being and stability of my loved ones. Additionally, the cultural context in Egypt values communal harmony and stability, further emphasizing the importance of security. Therefore, considering my personal experience and cultural background, I prioritize security over freedom.\n\n2"]}, {"persona": {"region": "Ismailia", "sex": "female", "age": 35, "country": "Egypt", "marital_status": "married", "education": "middle", "social_class": "lower middle class"}, "question": {"id": "Q150", "variant": 0}, "response": ["Based on the anthropological framework, the emic perspective of this individual from Ismailia, Egypt, is influenced by her cultural context, individual values, and socioeconomic background. In Ismailia, there may be a strong emphasis on community and family ties, which can influence her sense of security. Additionally, being a part of the lower middle class, she may prioritize security due to financial and social stability. Cultural relativism also plays a role, as the societal norms and values of her community may prioritize security over personal freedom. Therefore, considering all these factors, the persona would likely prioritize security over freedom.\n\n2"]}, {"persona": {"region": "Ismailia", "sex": "female", "age": 57, "country": "Egypt", "marital_status": "married", "education": "lower", "social_class": "working class"}, "question": {"id": "Q150", "variant": 0}, "response": ["From an anthropological perspective, my background as a married female from Ismailia, Egypt, with a lower education level and part of the working class, plays a significant role in shaping my perspective on the importance of freedom versus security. My cultural context, individual values, and socioeconomic background all influence my understanding of this question. In my community, security is a top priority due to the economic hardships we face, and the need to provide for our families. Additionally, our cultural values emphasize stability and safety. Therefore, option (2) Security is more important to me.\n2"]}, {"persona": {"region": "Ismailia", "sex": "male", "age": 33, "country": "Egypt", "marital_status": "married", "education": "middle", "social_class": "lower middle class"}, "question": {"id": "Q150", "variant": 0}, "response": ["Based on the anthropological framework, my perspective as a married male from Ismailia, Egypt, who is 33 years old and part of the lower middle class, is heavily influenced by my cultural context, individual values, and socioeconomic background. In my community, security is a top priority due to the unstable political and economic situation in Egypt. This has led to a strong emphasis on stability and protection for oneself and one's family. Additionally, my personal experience and socioeconomic background have shaped my understanding that without security, true freedom is not possible. Therefore, I prioritize security over freedom.\n\n2"]}, {"persona": {"region": "Ismailia", "sex": "female", "age": 49, "country": "Egypt", "marital_status": "single", "education": "higher", "social_class": "upper middle class"}, "question": {"id": "Q150", "variant": 0}, "response": ["Based on the anthropological framework, my perspective as a single female from Ismailia, Egypt, who is 49 years old, completed higher education, and considers herself part of the upper middle class, is heavily influenced by my cultural context, individual values, and socioeconomic background. In my cultural context, freedom is highly valued as a means of personal expression and self-determination, while security is also important given the social and political challenges in our region. My personal experience and values lead me to prioritize freedom as an essential aspect of living a fulfilling life, while my socioeconomic background provides me with a sense of security that allows me to prioritize freedom. Therefore, from my perspective, I choose:\n2"]}, {"persona": {"region": "Ismailia", "sex": "female", "age": 35, "country": "Egypt", "marital_status": "married", "education": "higher", "social_class": "lower middle class"}, "question": {"id": "Q150", "variant": 0}, "response": ["Based on the anthropological framework, my answer to the question of whether freedom or security is more important is influenced by my cultural context, socioeconomic background, and individual values. As a married female from Ismailia, Egypt, I come from a culture that places value on security due to the political and social instability in the region. Additionally, as part of the lower middle class, I have experienced economic challenges that have made me prioritize security and stability in my life. However, having completed higher education, I also value freedom and independence. Therefore, considering my cultural context, socioeconomic background, and personal values, my answer is:\n\n2"]}, {"persona": {"region": "Ismailia", "sex": "male", "age": 24, "country": "Egypt", "marital_status": "single", "education": "higher", "social_class": "upper middle class"}, "question": {"id": "Q150", "variant": 0}, "response": ["Based on the anthropological framework, as a single male from Ismailia, Egypt who has completed higher education and considers myself part of the upper middle class, my perspective is heavily influenced by my cultural context, individual values, and socioeconomic background. In Egyptian society, there is a strong emphasis on security and stability, especially for those in the upper middle class. Additionally, my personal experience and values prioritize security and stability as well. Considering these factors, I choose option 2) Security."]}, {"persona": {"region": "Ismailia", "sex": "female", "age": 23, "country": "Egypt", "marital_status": "single", "education": "higher", "social_class": "lower middle class"}, "question": {"id": "Q150", "variant": 0}, "response": ["Based on the anthropological framework, as a single female from Ismailia, Egypt, my emic perspective is heavily influenced by the cultural context, individual values, and socioeconomic background. In Egypt, there is a strong emphasis on security due to political instability and societal expectations for women's safety. However, as a young, educated woman from the lower middle class, I value freedom highly. I have experienced restrictions on my personal and professional opportunities due to societal norms and gender roles. Therefore, I prioritize freedom over security in order to pursue my own aspirations and live a life of autonomy and independence.\n\n1"]}, {"persona": {"region": "Ismailia", "sex": "male", "age": 55, "country": "Egypt", "marital_status": "married", "education": "middle", "social_class": "lower middle class"}, "question": {"id": "Q150", "variant": 0}, "response": ["Based on the anthropological framework, I must consider my cultural context, individual values, and socioeconomic background in answering this question. As a married male from Ismailia, Egypt, I come from a culture that values security and stability. My lower middle-class background also means that security is a top priority for me and my family. Additionally, my age and level of education have shaped my understanding of the world, and I believe that security is essential for a stable and fulfilling life. Therefore, I choose option (2) Security."]}, {"persona": {"region": "Ismailia", "sex": "male", "age": 57, "country": "Egypt", "marital_status": "married", "education": "middle", "social_class": "upper middle class"}, "question": {"id": "Q150", "variant": 0}, "response": ["Based on the anthropological framework, my understanding and answer to the question of which is more important - freedom or security, is shaped by my cultural context, individual values and personal experience, and socioeconomic background. As a married male from Ismailia, Egypt, I come from a society where the concept of security is highly valued due to the historical and political context of the region. Additionally, as part of the upper middle class, I have a certain level of security and stability in my life. However, my personal experience and values also lead me to prioritize freedom, as I believe that having the freedom to make choices and pursue opportunities is essential for personal fulfillment and growth. Therefore, my answer to the question would be:\n\n2) Security"]}, {"persona": {"region": "Ismailia", "sex": "female", "age": 29, "country": "Egypt", "marital_status": "married", "education": "middle", "social_class": "upper middle class"}, "question": {"id": "Q150", "variant": 0}, "response": ["Based on the anthropological framework, my answer is influenced by my individual values and personal experience, as well as my socioeconomic background. As a married female from Ismailia, Egypt, I have had personal experiences that have shaped my perception of the world, and I also come from a socioeconomic background that allows me to prioritize certain values. Additionally, considering the cultural context of Egypt and the nuanced phrasing of the question, I believe that my answer will align with the values and perspectives of someone from my demographic.\n\n2"]}, {"persona": {"region": "Damiatta", "sex": "female", "age": 46, "country": "Egypt", "marital_status": "married", "education": "middle", "social_class": "lower middle class"}, "question": {"id": "Q150", "variant": 0}, "response": ["Based on the anthropological framework described above, as a married female from Damiatta, Egypt, my emic perspective is heavily influenced by my cultural context, individual values, and socioeconomic background. In Egyptian society, security is a fundamental concern due to political instability and economic challenges. My personal experience and values also prioritize security for my family and myself. Additionally, as a member of the lower middle class, I understand the importance of having a secure and stable environment for my family's well-being. Therefore, considering my cultural context, personal values, and socioeconomic background, I choose option (2) Security. \n\n2"]}, {"persona": {"region": "Damiatta", "sex": "female", "age": 20, "country": "Egypt", "marital_status": "single", "education": "middle", "social_class": "lower middle class"}, "question": {"id": "Q150", "variant": 0}, "response": ["Based on the anthropological framework, my answer is influenced by my individual values and personal experience, as well as my socioeconomic background. Coming from a lower middle-class background in Damiatta, Egypt, I have experienced firsthand the challenges of economic instability and insecurity. As a single female, I have also been made aware of the importance of security in my everyday life. Therefore, considering my cultural context and the socioeconomic background, security is more important to me personally.\n\n2"]}, {"persona": {"region": "Damiatta", "sex": "male", "age": 19, "country": "Egypt", "marital_status": "single", "education": "middle", "social_class": "lower middle class"}, "question": {"id": "Q150", "variant": 0}, "response": ["Based on my cultural context, coming from Damiatta, Egypt, and being part of the lower middle class, my perspective is heavily influenced by my socioeconomic background. In my community, security is often prioritized due to the economic instability and social challenges we face. Additionally, my individual values and personal experience lead me to prioritize security as well, as I have witnessed the impact of insecurity on my family and friends. Furthermore, cultural relativism and the nuanced phrasing of the question also lead me to prioritize security, as the concept of freedom may be understood differently in my cultural context. Therefore, I choose option (2) Security."]}, {"persona": {"region": "Damiatta", "sex": "female", "age": 33, "country": "Egypt", "marital_status": "married", "education": "higher", "social_class": "lower middle class"}, "question": {"id": "Q150", "variant": 0}, "response": ["Based on the anthropological framework, my perspective as a married female from Damiatta, Egypt, who is 33 years old, completed higher education, and considers herself part of the lower middle class, is heavily influenced by my cultural context, individual values, and socioeconomic background. In Egyptian society, security is often prioritized due to political and economic instability, which affects my perception of the importance of security in daily life. Additionally, as a woman in this cultural context, I value the security and stability of my family and community. Therefore, I choose option 2: Security."]}, {"persona": {"region": "Damiatta", "sex": "male", "age": 24, "country": "Egypt", "marital_status": "single", "education": "higher", "social_class": "lower middle class"}, "question": {"id": "Q150", "variant": 0}, "response": ["Based on my personal experience and socioeconomic background, I believe that security is more important than freedom. Coming from a lower middle class family in Damiatta, Egypt, I have seen the struggles and uncertainty that come with financial instability. Security in terms of having a stable job, a roof over my head, and being able to provide for my family is of utmost importance. Additionally, the cultural context and values in my community prioritize stability and security, making it a more important factor in my life. Therefore, I choose option 2: Security."]}, {"persona": {"region": "Suez", "sex": "male", "age": 41, "country": "Egypt", "marital_status": "married", "education": "middle", "social_class": "working class"}, "question": {"id": "Q150", "variant": 0}, "response": ["Based on the anthropological framework, my perspective on the importance of freedom or security is influenced by my cultural context, individual values, and socioeconomic background. As a married male from Suez, Egypt, I come from a culture that places a high value on security due to the political and economic instability in the region. My middle education level and working-class status also shape my perspective, as I prioritize the security of my family and livelihood. Additionally, my age and place in society also influence my views, as I have experienced the impact of political unrest and the importance of security in my daily life. Therefore, considering all these factors, I choose option 2: Security."]}, {"persona": {"region": "Suez", "sex": "female", "age": 39, "country": "Egypt", "marital_status": "divorced", "education": "middle", "social_class": "working class"}, "question": {"id": "Q150", "variant": 0}, "response": ["Based on the anthropological framework, as a divorced female from Suez, Egypt, my emic perspective is influenced by my personal experience and cultural context, as well as my socioeconomic background. In Egypt, there are societal expectations and norms for women, and as a working-class divorced woman, security is of utmost importance to me. My individual values and personal experience have shaped my belief that security, especially financial and emotional security, is more important than freedom. Additionally, my cultural relativism and nuanced understanding of the question lead me to choose security over freedom, as my cultural context values stability and protection. \n2"]}, {"persona": {"region": "Cairo", "sex": "female", "age": 55, "country": "Egypt", "marital_status": "married", "education": "middle", "social_class": "working class"}, "question": {"id": "Q150", "variant": 0}, "response": ["From an anthropological perspective, my personal values and experience, as well as my socioeconomic background, will heavily influence my answer to this question. As a married female from Cairo, Egypt, who considers herself part of the working class, I have experienced firsthand the challenges and uncertainties that come with limited resources and economic instability. This has led me to prioritize security, as it is crucial for the well-being and stability of my family. Additionally, the cultural context of living in a region with political and social unrest further emphasizes the importance of security. Therefore, I choose option (2) Security."]}, {"persona": {"region": "Cairo", "sex": "male", "age": 58, "country": "Egypt", "marital_status": "married", "education": "middle", "social_class": "lower middle class"}, "question": {"id": "Q150", "variant": 0}, "response": ["Based on the anthropological framework, my perspective as a married male from Cairo, Egypt, who is 58 years old and part of the lower middle class, is heavily influenced by my cultural context, socioeconomic background, and individual values. In Egypt, there is a strong emphasis on family and community, and security is a top priority due to the political and economic challenges the country faces. As someone from the lower middle class, I have experienced the struggles of making ends meet and the constant concern for the safety and well-being of my family. Therefore, I prioritize security over freedom, as without security, there can be no true freedom. \n\n2"]}, {"persona": {"region": "Cairo", "sex": "female", "age": 29, "country": "Egypt", "marital_status": "married", "education": "higher", "social_class": "lower middle class"}, "question": {"id": "Q150", "variant": 0}, "response": ["From the anthropological perspective, my answer to the question of freedom versus security is influenced by my cultural context, individual values, and socioeconomic background. As a married female from Cairo, Egypt, I come from a society that highly values security due to the political and social instability in our country. My personal experience and individual values also lead me to prioritize security, as I have witnessed the impact of insecurity on my community and family. Additionally, being part of the lower middle class, I understand the importance of stability and safety in providing for my family and ensuring our well-being. Therefore, my answer to the question is (2) Security."]}, {"persona": {"region": "Cairo", "sex": "male", "age": 38, "country": "Egypt", "marital_status": "married", "education": "higher", "social_class": "lower middle class"}, "question": {"id": "Q150", "variant": 0}, "response": ["Based on my personal experience and cultural background, I come from a lower middle-class family in Cairo, Egypt. In our society, the cultural context and socioeconomic background play a significant role in shaping our perspective on this question. The political and social climate in Egypt has made security a major concern for many people, including myself. Given the unstable circumstances, the need for security is paramount to ensure the safety and wellbeing of my family and myself. Additionally, the cultural relativism in our society emphasizes the importance of stability and security. Therefore, I believe that security is more important than freedom in my current situation.\n\n2"]}, {"persona": {"region": "Cairo", "sex": "female", "age": 40, "country": "Egypt", "marital_status": "married", "education": "higher", "social_class": "lower middle class"}, "question": {"id": "Q150", "variant": 0}, "response": ["Based on the anthropological framework, as a married female from Cairo, Egypt, my perspective is heavily influenced by my cultural context, socioeconomic background, and personal experience. Living in a society with traditional gender roles and expectations, as well as concerns about safety and security, has shaped my understanding of this question. Additionally, my lower middle class status and completion of higher education have given me a nuanced understanding of the importance of both freedom and security. In this context, security is more important as it directly impacts my family's well-being and stability. Therefore, I choose option (2) Security."]}, {"persona": {"region": "Cairo", "sex": "male", "age": 38, "country": "Egypt", "marital_status": "married", "education": "higher", "social_class": "upper middle class"}, "question": {"id": "Q150", "variant": 0}, "response": ["Based on the anthropological framework, as a married male from Cairo, Egypt, my emic perspective would prioritize security over freedom. Living in a densely populated city with high levels of crime and political instability, the cultural context and socioeconomic background play a significant role in shaping this perspective. Additionally, the cultural relativism and space and time factors also contribute to the prioritization of security, as the current social and political climate in Egypt emphasizes the importance of stability and protection. Therefore, I would choose option (2) Security."]}, {"persona": {"region": "Cairo", "sex": "male", "age": 59, "country": "Egypt", "marital_status": "married", "education": "middle", "social_class": "lower middle class"}, "question": {"id": "Q150", "variant": 0}, "response": ["Based on the anthropological framework, my perspective is heavily influenced by my cultural context, individual values, and socioeconomic background. As a married male from Cairo, Egypt, my cultural context values security and stability, especially given the political and economic uncertainties in our country. Additionally, my lower middle class socioeconomic background has made me prioritize security and stability for my family's well-being. Therefore, I choose option 2: Security. \n\n2"]}, {"persona": {"region": "Cairo", "sex": "female", "age": 30, "country": "Egypt", "marital_status": "married", "education": "higher", "social_class": "upper middle class"}, "question": {"id": "Q150", "variant": 0}, "response": ["Based on the anthropological framework, as a married female from Cairo, Egypt, with a higher education level and a part of the upper middle class, my perspective is heavily influenced by my cultural context, individual values, and socioeconomic background. In Egypt, there is a strong emphasis on security due to political and social instability, which is further reinforced by the patriarchal society. As a member of the upper middle class, I have access to a certain level of security and stability, which is highly valued. Additionally, my education has instilled in me the importance of security for not only myself but also for my family. Therefore, I prioritize security over freedom as it is essential for maintaining stability and well-being in my cultural and socioeconomic context.\n\n2"]}, {"persona": {"region": "Cairo", "sex": "male", "age": 22, "country": "Egypt", "marital_status": "single", "education": "middle", "social_class": "lower middle class"}, "question": {"id": "Q150", "variant": 0}, "response": ["Based on my individual values and personal experience, as a 22-year-old male from Cairo, Egypt, I have grown up in a cultural context where security is a major concern due to political and social instability. My socioeconomic background as part of the lower middle class also means that I have experienced firsthand the struggles of providing for myself and my family. Additionally, the cultural relativism of Egypt means that security is valued highly in our society. Therefore, I believe that security is more important than freedom. \n\n2"]}, {"persona": {"region": "Cairo", "sex": "male", "age": 29, "country": "Egypt", "marital_status": "single", "education": "higher", "social_class": "lower middle class"}, "question": {"id": "Q150", "variant": 0}, "response": ["Based on the anthropological framework, as a single male from Cairo, Egypt, my emic perspective is influenced by the cultural context of my society, where freedom of expression and individual rights are highly valued. Additionally, my personal experience and individual values have shaped my understanding that freedom is crucial for personal fulfillment and self-expression. Considering my lower middle class socioeconomic background, I am also aware of the importance of security, but I believe that without freedom, security becomes meaningless. Furthermore, the nuanced phrasing of the question leads me to prioritize freedom over security, as the ability to live without restrictions and to pursue personal aspirations is essential for a fulfilling life.\n\n1"]}, {"persona": {"region": "Cairo", "sex": "female", "age": 31, "country": "Egypt", "marital_status": "married", "education": "higher", "social_class": "lower middle class"}, "question": {"id": "Q150", "variant": 0}, "response": ["Based on the anthropological framework, my perspective as a married female from Cairo, Egypt, who is 31 years old, has completed higher education, and considers herself part of the lower middle class, is shaped by my cultural context, individual values, and socioeconomic background. In Egypt, there is a strong emphasis on family and community, and security is a major concern due to political instability and economic challenges. Additionally, as a woman, the importance of security is heightened due to societal and cultural factors. Therefore, from my perspective, security is more important than freedom.\n\n2"]}, {"persona": {"region": "Cairo", "sex": "male", "age": 59, "country": "Egypt", "marital_status": "married", "education": "higher", "social_class": "upper middle class"}, "question": {"id": "Q150", "variant": 0}, "response": ["Based on the anthropological framework, as a married male from Cairo, Egypt, my emic perspective is influenced by the cultural context of Egypt, where there is a strong emphasis on family values, community unity, and the importance of security in light of political instability. My personal experience and individual values also play a role, as I have prioritized stability and security to provide for my family. Additionally, my upper middle-class socioeconomic background has afforded me the privilege of a certain level of security, which I value greatly. Taking into account the nuance of the question, I believe that security is more important than freedom, as it provides the foundation for a stable and fulfilling life. \n\n2"]}, {"persona": {"region": "Cairo", "sex": "male", "age": 27, "country": "Egypt", "marital_status": "single", "education": "middle", "social_class": "working class"}, "question": {"id": "Q150", "variant": 0}, "response": ["Based on the anthropological framework, as a single male from Cairo, Egypt, my perspective is heavily influenced by my cultural context, socioeconomic background, and personal experience. In Egypt, the political and social context often prioritizes security over freedom, especially in the wake of recent political unrest and terrorism. As a member of the working class, my primary concern is ensuring the safety and security of myself and my family. Additionally, my age and education level also influence my perspective, as I have witnessed firsthand the impact of political instability on daily life. Therefore, I believe that security is more important than freedom in my current circumstances.\n\n2"]}, {"persona": {"region": "Cairo", "sex": "female", "age": 25, "country": "Egypt", "marital_status": "single", "education": "higher", "social_class": "working class"}, "question": {"id": "Q150", "variant": 0}, "response": ["From the emic perspective, as a single female from Cairo, Egypt, my cultural context and socioeconomic background heavily influence my answer to this question. In a society where gender roles and expectations are deeply ingrained, personal experience and individual values play a significant role in shaping my perception. Additionally, the political and social climate in Egypt, particularly in recent years, has heightened the importance of security for individuals, especially for women. Furthermore, the concept of cultural relativism is crucial in understanding that the prioritization of security over freedom is not indicative of a lack of value for freedom, but rather a response to the unique challenges and realities faced by individuals in this context.\n\n2"]}, {"persona": {"region": "Cairo", "sex": "female", "age": 23, "country": "Egypt", "marital_status": "married", "education": "higher", "social_class": "lower middle class"}, "question": {"id": "Q150", "variant": 0}, "response": ["Based on my cultural context, being a married female from Cairo, Egypt, and part of the lower middle class, I have been influenced by the values and experiences of my community. In this context, security holds more importance than freedom. Living in a densely populated city, where economic instability and political unrest are common, the need for security is paramount. The collective mindset prioritizes the safety and stability of the family unit above individual freedoms. Furthermore, my socioeconomic background reinforces this perspective as financial security is a constant concern. Therefore, given my cultural and socioeconomic context, I believe that security is more important than freedom.\n\n2"]}, {"persona": {"region": "Cairo", "sex": "male", "age": 58, "country": "Egypt", "marital_status": "married", "education": "higher", "social_class": "working class"}, "question": {"id": "Q150", "variant": 0}, "response": ["Based on the anthropological framework, as a married male from Cairo, Egypt, my emic perspective is influenced by the cultural context of living in a country with a complex political history and ongoing social and economic challenges. My individual values and personal experience are shaped by the desire for stability and security in a society that has experienced significant political unrest in recent years. Additionally, my working-class socioeconomic background has influenced my prioritization of security, as financial stability and safety are crucial for my family's well-being. Furthermore, the cultural relativism of Egypt emphasizes the importance of family and community, further reinforcing the value of security. Considering all these factors, my nuanced understanding leads me to prioritize security over freedom in this context.\n\n2"]}, {"persona": {"region": "Cairo", "sex": "female", "age": 40, "country": "Egypt", "marital_status": "married", "education": "higher", "social_class": "working class"}, "question": {"id": "Q150", "variant": 0}, "response": ["Based on the anthropological framework described above, my perspective as a married female from Cairo, Egypt, who is 40 years old, completed higher education, and considers herself part of the working class is heavily influenced by my cultural context, individual values, and socioeconomic background. In Egypt, there is a strong emphasis on security due to political and social instability, and as a working-class woman, I prioritize the safety and stability of my family. Additionally, my personal experience and cultural context have shaped my perception of the importance of security in everyday life. Therefore, I believe that security is more important than freedom in my current circumstances.\n\n2"]}, {"persona": {"region": "Cairo", "sex": "female", "age": 36, "country": "Egypt", "marital_status": "married", "education": "middle", "social_class": "upper middle class"}, "question": {"id": "Q150", "variant": 0}, "response": ["Based on the anthropological framework, my cultural context as a married female from Cairo, Egypt, and my socioeconomic background as part of the upper middle class play a significant role in shaping my perspective. In my cultural context, security is highly valued due to the political and social instability in Egypt. Additionally, my socioeconomic background has provided me with the resources to prioritize security, such as living in a gated community and having access to private security. Therefore, considering the emic perspective of my in-group and the cultural relativism of valuing security in my context, I would prioritize:\n\n2) Security"]}, {"persona": {"region": "Cairo", "sex": "male", "age": 40, "country": "Egypt", "marital_status": "married", "education": "middle", "social_class": "lower middle class"}, "question": {"id": "Q150", "variant": 0}, "response": ["Based on the anthropological framework, as a married male from Cairo, Egypt, my perspective on the importance of freedom versus security is heavily influenced by my cultural context and socioeconomic background. Living in a city with a history of political unrest, I have experienced the importance of security in maintaining stability and safety for my family. Additionally, my lower middle-class status means that I prioritize the security of my job and financial well-being. However, the cultural relativism in Egypt also emphasizes the value of personal freedom and expression, especially in the wake of recent political changes. Ultimately, I believe that security is more important for me and my family's well-being, as it provides the foundation for our freedom to live our lives without fear.\n\n2"]}, {"persona": {"region": "Cairo", "sex": "female", "age": 30, "country": "Egypt", "marital_status": "married", "education": "middle", "social_class": "lower class"}, "question": {"id": "Q150", "variant": 0}, "response": ["Based on the anthropological framework, my emic perspective as a married female from Cairo, Egypt, is heavily influenced by my cultural context, individual values, and socioeconomic background. In Cairo, traditional gender roles and societal expectations dictate that security, both in terms of physical safety and financial stability, is of utmost importance. As part of the lower class, my personal experience and socioeconomic background have shaped my understanding of the world, leading me to prioritize security over freedom. In a society where economic hardships and safety concerns are prevalent, the need for security outweighs the desire for freedom.\n\n2"]}, {"persona": {"region": "Cairo", "sex": "male", "age": 58, "country": "Egypt", "marital_status": "married", "education": "higher", "social_class": "lower middle class"}, "question": {"id": "Q150", "variant": 0}, "response": ["According to the anthropological framework, my individual values and personal experience play a big role in my subjective understanding of life. As a 58-year-old married male from Cairo, Egypt, who considers himself part of the lower middle class, my socioeconomic background and cultural context significantly shape my perspective. In Egypt, there is a strong emphasis on security due to political instability and economic challenges. Additionally, as a member of a collectivist society, the well-being of my family and community is of utmost importance. Therefore, I prioritize security over freedom in order to ensure the safety and stability of my loved ones and myself.\n\n2"]}, {"persona": {"region": "Cairo", "sex": "male", "age": 50, "country": "Egypt", "marital_status": "married", "education": "middle", "social_class": "lower middle class"}, "question": {"id": "Q150", "variant": 0}, "response": ["Based on the anthropological framework, as a married male from Cairo, Egypt, with a middle education level and lower middle class background, my perspective is heavily influenced by my cultural context, individual values and personal experience, and socioeconomic background. In Egypt, there is a strong emphasis on security due to the country's political and social instability. As a lower middle class individual, I prioritize security as it directly impacts my ability to provide for my family and ensure their safety. Additionally, my personal experience living in a country with high levels of crime and political unrest has shaped my perspective, leading me to value security over freedom in order to protect my loved ones. Therefore, my choice is option (2) Security. \n\n2"]}, {"persona": {"region": "Cairo", "sex": "female", "age": 40, "country": "Egypt", "marital_status": "married", "education": "higher", "social_class": "upper middle class"}, "question": {"id": "Q150", "variant": 0}, "response": ["Based on the anthropological framework, as a married female from Cairo, Egypt, I would consider both emic and etic perspectives. In my cultural context, there is a strong emphasis on family and community, which influences my individual values and personal experience. As part of the upper middle class, my socioeconomic background also plays a role in my understanding of this question. Additionally, my age and place in society as a 40-year-old woman in Cairo impacts my perspective. Considering cultural relativism, I understand that my viewpoint may differ from others. Therefore, I would prioritize security over freedom because in my cultural context, the stability and safety of my family and community are of utmost importance.\n\n2"]}, {"persona": {"region": "Cairo", "sex": "female", "age": 33, "country": "Egypt", "marital_status": "married", "education": "middle", "social_class": "lower middle class"}, "question": {"id": "Q150", "variant": 0}, "response": ["Based on the anthropological framework, as a married female from Cairo, Egypt, with a middle education level and lower middle class background, my understanding and answer to the question of whether freedom or security is more important is heavily influenced by my cultural context. Living in a city with a rich history and diverse cultural influences, I am aware of the importance of security due to the political and social instability in the region. Additionally, as a lower middle class individual, I understand the daily struggles and lack of resources that can impact my sense of security. Therefore, from my perspective, security is more important than freedom. \n\n2"]}, {"persona": {"region": "Cairo", "sex": "female", "age": 37, "country": "Egypt", "marital_status": "married", "education": "middle", "social_class": "lower middle class"}, "question": {"id": "Q150", "variant": 0}, "response": ["Based on the anthropological framework, my perspective as a married female from Cairo, Egypt, who is 37 years old and part of the lower middle class, is influenced by my cultural context, individual values, and socioeconomic background. In my culture, there is a strong emphasis on the importance of security due to the political and social instability in the region. As a woman, I value security as it is essential for the well-being and safety of my family. Additionally, my socioeconomic background as part of the lower middle class means that I have experienced financial hardship and insecurity, making security a priority in my life. Therefore, I choose option (2) Security."]}, {"persona": {"region": "Cairo", "sex": "male", "age": 28, "country": "Egypt", "marital_status": "married", "education": "middle", "social_class": "lower middle class"}, "question": {"id": "Q150", "variant": 0}, "response": ["Based on the anthropological framework, my answer is influenced by my cultural context, individual values, and socioeconomic background. Growing up in Cairo, Egypt, with a lower middle-class background, I have experienced the importance of security in my daily life. The political and social unrest in Egypt has made me prioritize security over freedom. My personal experience and the cultural context of my upbringing have shaped my belief that security is more important for stability and survival. Additionally, my age and socioeconomic background have influenced my perspective, as I have not had the privilege of high education or access to resources that would allow me to prioritize freedom over security. Therefore, based on my perspective and understanding of my cultural context, I choose:\n\n2) Security"]}, {"persona": {"region": "Cairo", "sex": "male", "age": 53, "country": "Egypt", "marital_status": "married", "education": "higher", "social_class": "working class"}, "question": {"id": "Q150", "variant": 0}, "response": ["From the perspective of a married male from Cairo, Egypt, who is 53 years old, completed higher education, and considers himself part of the working class, the answer to the question is heavily influenced by the cultural context, individual values, and socioeconomic background. In Egypt, there is a strong emphasis on security due to political instability and economic challenges. Additionally, as a member of the working class, the need for economic security is paramount. Furthermore, personal experiences and values also play a significant role in shaping the perspective, as the individual may prioritize stability and safety for their family. Therefore, taking all these factors into consideration, the chosen answer is:\n\n2) Security"]}, {"persona": {"region": "Cairo", "sex": "male", "age": 45, "country": "Egypt", "marital_status": "married", "education": "higher", "social_class": "lower middle class"}, "question": {"id": "Q150", "variant": 0}, "response": ["Based on the anthropological framework, my perspective on the importance of freedom versus security is influenced by my cultural context as a married male from Cairo, Egypt. My age and socioeconomic background also play a role in shaping my beliefs. In Egyptian society, there is a strong emphasis on the collective and family values, as well as the importance of security in a politically unstable region. However, as someone who has completed higher education and considers myself part of the lower middle class, I also value personal autonomy and freedom of expression. Ultimately, I believe that in our current context, security is more important for the well-being of my family and community. \n\n2"]}, {"persona": {"region": "Cairo", "sex": "male", "age": 52, "country": "Egypt", "marital_status": "married", "education": "middle", "social_class": "upper middle class"}, "question": {"id": "Q150", "variant": 0}, "response": ["Based on the anthropological framework, as a married male from Cairo, Egypt, my understanding and answer to the question of which is more important - freedom or security, is heavily influenced by my cultural context, individual values, and socioeconomic background. In Egypt, there is a strong emphasis on family and community, and security is of utmost importance due to the political and social instability in the region. As a member of the upper middle class, I have the means to prioritize security for my family and myself. Additionally, my age and middle education level have instilled in me the value of stability and security. Therefore, I believe that security is more important than freedom in my cultural and socioeconomic context.\n\n2"]}, {"persona": {"region": "Cairo", "sex": "male", "age": 22, "country": "Egypt", "marital_status": "single", "education": "higher", "social_class": "lower middle class"}, "question": {"id": "Q150", "variant": 0}, "response": ["Based on the anthropological framework, as a single male from Cairo, Egypt, my cultural context and socioeconomic background heavily influence my answer to the question. Living in a country with a complex political and social landscape, my understanding of freedom and security is shaped by my personal experiences and the experiences of those around me. My lower middle class status also plays a role in my perception, as my socioeconomic background affects my access to resources and opportunities. Additionally, being 22 years old means that I have grown up in a time of significant political and social change in Egypt, further shaping my perspective. Considering all these factors, I choose option (2) Security. \n\n2"]}, {"persona": {"region": "Cairo", "sex": "female", "age": 57, "country": "Egypt", "marital_status": "divorced", "education": "middle", "social_class": "lower middle class"}, "question": {"id": "Q150", "variant": 0}, "response": ["Based on the anthropological framework, my perspective is heavily influenced by my cultural context, socioeconomic background, individual values, and personal experience. As a divorced female from Cairo, Egypt, I have experienced the challenges and limitations placed on women in my society. My lower middle class status has also made security a top priority for me, as I have had to navigate financial struggles and uncertainty. Additionally, my age and personal experience have shown me the importance of security and stability in my life. Therefore, from my perspective, security is more important than freedom.\n\n2"]}, {"persona": {"region": "Cairo", "sex": "female", "age": 42, "country": "Egypt", "marital_status": "married", "education": "middle", "social_class": "working class"}, "question": {"id": "Q150", "variant": 0}, "response": ["Based on the anthropological framework, as a married female from Cairo, Egypt, my emic perspective would prioritize security over freedom. Living in a densely populated city with high crime rates and political instability, security is crucial for my family's well-being. Additionally, my socioeconomic background as part of the working class further emphasizes the importance of stability and security. Cultural context also plays a role, as the cultural norms and values in Egypt often prioritize the safety and security of the family and community. Overall, the combination of cultural context, socioeconomic background, and personal experience leads me to prioritize security over freedom.\n\n2"]}, {"persona": {"region": "Cairo", "sex": "female", "age": 23, "country": "Egypt", "marital_status": "single", "education": "middle", "social_class": "lower middle class"}, "question": {"id": "Q150", "variant": 0}, "response": ["From the perspective of a single female from Cairo, Egypt, who is 23 years old and part of the lower middle class, it is important to consider the cultural context, individual values, and socioeconomic background. In Egypt, there are specific cultural norms and expectations placed on women, which can impact their understanding of freedom and security. Additionally, being part of the lower middle class may mean that there are economic challenges and concerns for personal safety. Given these factors, the answer will likely be influenced by the cultural context and the individual's values and experiences.\n\n2"]}, {"persona": {"region": "Cairo", "sex": "female", "age": 28, "country": "Egypt", "marital_status": "married", "education": "higher", "social_class": "upper middle class"}, "question": {"id": "Q150", "variant": 0}, "response": ["From an emic perspective, being a married female from Cairo, Egypt, I am well aware of the cultural context and the societal expectations placed upon me. As a member of the upper middle class, I have been raised with certain values and beliefs that prioritize security and stability, especially in the context of marriage and family life. My personal experience and the socio-economic background I come from have also shaped my understanding of the world. In a society where there are various social and political challenges, the need for security is paramount. Additionally, the cultural relativism in Egypt emphasizes the importance of stability and security in the face of external threats and internal uncertainties. Therefore, based on my nuanced understanding of the question and my personal background, I choose option (2) Security."]}, {"persona": {"region": "Cairo", "sex": "female", "age": 22, "country": "Egypt", "marital_status": "single", "education": "higher", "social_class": "lower middle class"}, "question": {"id": "Q150", "variant": 0}, "response": ["Based on the anthropological framework, as a single female from Cairo, Egypt, my emic perspective is heavily influenced by the cultural context of my upbringing and the societal norms around gender and safety. Additionally, my individual values and personal experiences as a woman in Egypt have shaped my perception of the importance of freedom and security. Considering my lower middle class socioeconomic background, security is a significant concern due to the economic and social challenges I face. Furthermore, the cultural relativism of Egypt and the nuanced phrasing of the question lead me to prioritize security, as it directly impacts my daily life and well-being in a society where safety is paramount.\n\n2"]}, {"persona": {"region": "Cairo", "sex": "female", "age": 39, "country": "Egypt", "marital_status": "married", "education": "middle", "social_class": "lower middle class"}, "question": {"id": "Q150", "variant": 0}, "response": ["Based on the anthropological framework, as a married female from Cairo, Egypt, my perspective is heavily influenced by my cultural context, socioeconomic background, and individual values. In Egypt, there is a strong emphasis on family and community, and security is often prioritized for the well-being and stability of the family. Additionally, as a member of the lower middle class, I am more likely to prioritize security in order to ensure the basic needs and safety of my family. My personal experience and values also play a role in this decision, as I have witnessed the impact of political and social instability on my community. Therefore, I would prioritize security over freedom in this context.\n\n2"]}, {"persona": {"region": "Cairo", "sex": "male", "age": 19, "country": "Egypt", "marital_status": "single", "education": "middle", "social_class": "working class"}, "question": {"id": "Q150", "variant": 0}, "response": ["Based on the anthropological framework, as a single male from Cairo, Egypt, my emic perspective is influenced by the cultural context of living in a country with a complex history and ongoing political and social challenges. My individual values and personal experience have shaped my understanding of the importance of security, as I have witnessed firsthand the impact of political instability and economic hardship on my community. Additionally, my socioeconomic background as part of the working class has made security a priority in my life, as I have had to navigate economic uncertainty and the need for stability. Considering the nuanced phrasing of the question, I choose:\n\n2) Security"]}, {"persona": {"region": "Cairo", "sex": "female", "age": 54, "country": "Egypt", "marital_status": "married", "education": "middle", "social_class": "working class"}, "question": {"id": "Q150", "variant": 0}, "response": ["Based on the anthropological framework, my answer is heavily influenced by my cultural context as a married female from Cairo, Egypt. In our society, the value of security is paramount due to the political and social instability that has impacted our lives. As a member of the working class, the need for financial security and stability is a constant concern. Additionally, my age and socioeconomic background also play a significant role in shaping my perspective. Therefore, I believe that security is more important than freedom for me and my community. \n\n2"]}, {"persona": {"region": "Cairo", "sex": "male", "age": 30, "country": "Egypt", "marital_status": "married", "education": "higher", "social_class": "working class"}, "question": {"id": "Q150", "variant": 0}, "response": ["Based on the anthropological framework, as a married male from Cairo, Egypt, my emic perspective is heavily influenced by my cultural context, individual values, and socioeconomic background. In Egypt, the cultural context places a high value on security due to the political and social instability in the region. My personal experience living in a working-class neighborhood in Cairo has also shaped my understanding of the importance of security for myself and my family. Additionally, my socioeconomic background as a working-class individual has made me prioritize security over freedom, as the stability and safety of my family is a top priority. Therefore, from this perspective, I would choose:\n2"]}, {"persona": {"region": "Cairo", "sex": "male", "age": 39, "country": "Egypt", "marital_status": "married", "education": "higher", "social_class": "lower middle class"}, "question": {"id": "Q150", "variant": 0}, "response": ["Based on the anthropological framework, my emic perspective as a married male from Cairo, Egypt, at the age of 39 and part of the lower middle class, is heavily influenced by my cultural context, individual values, and socioeconomic background. In Egypt, there is a strong emphasis on family and community, and security is often prioritized due to social and political instability. Additionally, as part of the lower middle class, financial stability and safety are crucial for survival. Therefore, considering my cultural context and socioeconomic background, I believe that security is more important than freedom.\n\n2"]}, {"persona": {"region": "Cairo", "sex": "female", "age": 41, "country": "Egypt", "marital_status": "married", "education": "middle", "social_class": "lower middle class"}, "question": {"id": "Q150", "variant": 0}, "response": ["Based on the anthropological framework, as a married female from Cairo, Egypt, I am influenced by my cultural context, individual values, and socioeconomic background. In Egypt, there is a strong emphasis on family and community, and security is often prioritized due to political and social instability. Additionally, as part of the lower middle class, I may have experienced economic challenges and prioritize security to ensure stability for my family. My personal experience and values also play a role in my perspective, as I may value security and stability over individual freedom. Therefore, from this perspective, I choose option 2: Security."]}, {"persona": {"region": "Cairo", "sex": "male", "age": 45, "country": "Syria", "marital_status": "single", "education": "higher", "social_class": "upper middle class"}, "question": {"id": "Q150", "variant": 0}, "response": ["Based on the anthropological framework, my answer is influenced by my individual values and personal experience, as well as my socioeconomic background. As a single male from Cairo, Syria, I have experienced the importance of security in my daily life and understand the necessity of feeling safe and protected. Additionally, coming from the upper middle class, I have been fortunate enough to have some level of financial security, which further emphasizes the importance of security in my life. Therefore, based on my personal experience and socioeconomic background, I would prioritize security over freedom. \n\n2"]}, {"persona": {"region": "Cairo", "sex": "male", "age": 54, "country": "Egypt", "marital_status": "married", "education": "higher", "social_class": "lower middle class"}, "question": {"id": "Q150", "variant": 0}, "response": ["Based on my cultural context in Cairo, Egypt, my lower middle class socioeconomic background, and my age and education level, I prioritize security over freedom. Living in a densely populated city with economic challenges, I value the stability and safety of my family and community. The political and social context in Egypt also emphasizes the importance of security in maintaining order and stability. Additionally, my personal experiences and values lead me to prioritize the protection and well-being of my loved ones over individual freedoms. Therefore, I choose:\n2) Security"]}, {"persona": {"region": "Cairo", "sex": "male", "age": 65, "country": "Egypt", "marital_status": "married", "education": "middle", "social_class": "upper middle class"}, "question": {"id": "Q150", "variant": 0}, "response": ["Based on the anthropological framework, as a married male from Cairo, Egypt, my emic perspective is influenced by my cultural context, individual values, and socioeconomic background. In Egyptian culture, security is highly valued due to the political and social instability in the region. My personal experience and age also play a role in prioritizing security, as I have lived through periods of unrest and uncertainty. Additionally, being part of the upper middle class, I have the means to prioritize security measures to protect my family and assets. Therefore, from my perspective, security is more important than freedom.\n\n2"]}, {"persona": {"region": "Cairo", "sex": "female", "age": 52, "country": "Egypt", "marital_status": "married", "education": "middle", "social_class": "upper middle class"}, "question": {"id": "Q150", "variant": 0}, "response": ["Based on the anthropological framework, my answer is influenced by my individual values and personal experience, as well as my socioeconomic background. As a married woman from Cairo, Egypt, I have experienced the importance of security in a society that has faced political and social unrest. Additionally, being part of the upper middle class, I have been able to prioritize security and stability in my life. However, I also understand the significance of freedom, especially as a woman in a patriarchal society. My personal experiences and values lead me to prioritize security over freedom, as it provides a sense of stability and protection in a society that has faced challenges. \n\n2"]}, {"persona": {"region": "Cairo", "sex": "male", "age": 26, "country": "Egypt", "marital_status": "single", "education": "higher", "social_class": "lower middle class"}, "question": {"id": "Q150", "variant": 0}, "response": ["Based on the anthropological framework, as a 26-year-old single male from Cairo, Egypt, my perspective is influenced by my cultural context, individual values, and socioeconomic background. In Egypt, there is a strong emphasis on security due to political and social instability, which affects the daily lives of people, especially those who are part of the lower middle class. Additionally, personal experiences and values also play a significant role in shaping my perspective. Therefore, considering all these factors, I believe that security is more important than freedom.\n\n2"]}, {"persona": {"region": "Cairo", "sex": "male", "age": 32, "country": "Egypt", "marital_status": "married", "education": "middle", "social_class": "working class"}, "question": {"id": "Q150", "variant": 0}, "response": ["From the emic perspective, as a married male from Cairo, Egypt, my cultural context and personal experience have shaped my understanding of the importance of freedom and security. Living in a country with a complex socio-political history, where socioeconomic background and space and time play a significant role in shaping daily life, I have come to value security above all else. The cultural context of Egypt, with its history of political instability and economic challenges, has led me to prioritize the need for security as a means of ensuring stability and providing for my family. Additionally, as part of the working class, I have personally experienced the impact of economic hardships and the lack of security, which has only reinforced the importance of stability and security. Therefore, I choose the following option:\n\n2"]}, {"persona": {"region": "Cairo", "sex": "male", "age": 38, "country": "Egypt", "marital_status": "married", "education": "middle", "social_class": "lower middle class"}, "question": {"id": "Q150", "variant": 0}, "response": ["Based on the anthropological framework, my personal experience and socioeconomic background heavily influence my perspective. Growing up in Cairo, Egypt, I have seen the impact of political and social instability on my community. As a lower middle class individual, I prioritize security over freedom because having a sense of safety and stability is crucial for me and my family. Additionally, the cultural context and nuance of the question play a role in my answer, as the historical and current political climate in Egypt has shaped my understanding of the importance of security. Therefore, I choose option 2: Security."]}, {"persona": {"region": "Cairo", "sex": "male", "age": 58, "country": "Egypt", "marital_status": "married", "education": "higher", "social_class": "upper middle class"}, "question": {"id": "Q150", "variant": 0}, "response": ["Based on the anthropological framework, as a married male from Cairo, Egypt, at the age of 58 and part of the upper middle class, my perspective is heavily influenced by my cultural context, socioeconomic background, and individual values. In Egyptian society, the concept of security holds a significant importance due to the political and social instability experienced in recent years. Additionally, my socioeconomic status and age likely lead me to prioritize security as a means of protecting my family and maintaining stability. Furthermore, my cultural context and individual values may also emphasize the importance of security as a means of upholding traditional values and protecting the family unit. Therefore, from this perspective, the option I choose is:\n\n2) Security"]}, {"persona": {"region": "Cairo", "sex": "male", "age": 49, "country": "Egypt", "marital_status": "married", "education": "middle", "social_class": "lower middle class"}, "question": {"id": "Q150", "variant": 0}, "response": ["Based on the anthropological framework of emic and etic perspectives, cultural context, individual values and personal experience, socioeconomic background, cultural relativism, space and time, and nuance, my answer to the question of which is more important - freedom or security, is influenced by my personal experience as a married male from Cairo, Egypt. In my cultural context, the ongoing political and social upheaval in Egypt has made security a priority for many people. As a member of the lower middle class, I have experienced firsthand the impact of social and economic instability on my family's well-being. Additionally, at my age and with my level of education, I have a more pragmatic view of the world, valuing the tangible benefits of security over the abstract concept of freedom. Therefore, I choose option (2) Security. \n\n2"]}, {"persona": {"region": "Cairo", "sex": "female", "age": 29, "country": "Egypt", "marital_status": "married", "education": "middle", "social_class": "working class"}, "question": {"id": "Q150", "variant": 0}, "response": ["Based on the anthropological framework, my answer to the question of whether freedom or security is more important is heavily influenced by my cultural context and socioeconomic background. As a married female from Cairo, Egypt, I come from a society with strong family and community ties, where security is highly valued due to political instability and economic challenges. My working-class status and middle education level also contribute to my prioritization of security, as I am more likely to be impacted by economic hardships and lack of stability. Therefore, I believe that security is more important than freedom.\n\n2"]}, {"persona": {"region": "Cairo", "sex": "female", "age": 36, "country": "Egypt", "marital_status": "married", "education": "higher", "social_class": "lower middle class"}, "question": {"id": "Q150", "variant": 0}, "response": ["Based on my cultural context, as a married woman from Cairo, Egypt, my understanding and answer to the question of freedom versus security is heavily influenced by my socioeconomic background, individual values, and personal experience. Living in a country with a complex political and social landscape, where economic stability is often a concern for many, I prioritize security over freedom. The cultural context of Egypt, with its history of political unrest and economic challenges, has shaped my perspective to value stability and security in order to provide for my family and ensure our well-being. Additionally, as a woman in a patriarchal society, the need for security is even more pressing. My personal experiences and socioeconomic status have also influenced my perspective, as I am part of the lower middle class and have had to navigate economic challenges. Therefore, based on my nuanced understanding and subjective perceptions, I choose option (2) Security."]}, {"persona": {"region": "Cairo", "sex": "female", "age": 34, "country": "Egypt", "marital_status": "married", "education": "middle", "social_class": "lower middle class"}, "question": {"id": "Q150", "variant": 0}, "response": ["Based on the anthropological framework outlined above, as a married female from Cairo, Egypt, my perspective is heavily influenced by my cultural context, socioeconomic background, and personal experience. Living in a country with political and social upheaval, as well as economic instability, security is a primary concern for me and my family. Additionally, the cultural norms and values in Egypt place a high emphasis on security and stability, which has shaped my understanding and priorities. Therefore, considering these factors, I would choose option (2) Security."]}, {"persona": {"region": "Fayoum", "sex": "male", "age": 57, "country": "Egypt", "marital_status": "married", "education": "middle", "social_class": "working class"}, "question": {"id": "Q150", "variant": 0}, "response": ["Based on the anthropological framework, my response is shaped by my cultural context, individual values, and socioeconomic background. As a married male from Fayoum, Egypt, I am influenced by the cultural values and norms of my community, which place a high emphasis on family and security. My middle education level and working-class status also contribute to my belief that security is more important as it ensures stability and safety for my family and me. Additionally, my age and life experiences have led me to prioritize security over freedom, as I have witnessed the impact of instability and insecurity in my community. Therefore, I choose option (2) Security."]}, {"persona": {"region": "Fayoum", "sex": "male", "age": 60, "country": "Egypt", "marital_status": "married", "education": "middle", "social_class": "lower middle class"}, "question": {"id": "Q150", "variant": 0}, "response": ["Based on the anthropological framework, as a married male from Fayoum, Egypt, age 60, and part of the lower middle class, my answer to the question of whether freedom or security is more important is influenced by my cultural context, individual values, and socioeconomic background. In my community, security is a primary concern due to economic instability and political unrest. My personal experience and values also lead me to prioritize security, as I value the stability and safety of my family and community. Additionally, my lower middle class status means that I may not have the resources to prioritize freedom over security. Therefore, my answer is (2) Security."]}, {"persona": {"region": "Fayoum", "sex": "male", "age": 21, "country": "Egypt", "marital_status": "single", "education": "middle", "social_class": "lower middle class"}, "question": {"id": "Q150", "variant": 0}, "response": ["Based on the anthropological framework, my emic perspective as a 21-year-old male from Fayoum, Egypt, who considers himself part of the lower middle class, is heavily influenced by my cultural context, individual values, and socioeconomic background. In Egypt, there is a strong emphasis on community and family values, and personal experience has shown me that security is a crucial aspect of daily life. Additionally, my lower middle class status means that I have experienced economic hardships that make security a priority. Therefore, I would prioritize security over freedom in my answer.\n\n2"]}, {"persona": {"region": "Fayoum", "sex": "male", "age": 33, "country": "Egypt", "marital_status": "single", "education": "higher", "social_class": "working class"}, "question": {"id": "Q150", "variant": 0}, "response": ["Based on my cultural context as a single male from Fayoum, Egypt, and my socioeconomic background as a working-class individual, I value security over freedom. In my community, stability and safety are crucial for survival and well-being. Additionally, my personal experience living in a region with economic challenges has taught me the importance of security in providing for my basic needs and ensuring the safety of my family. This perspective is also influenced by my age and stage in life, as I am focused on building a secure future for myself and potentially a family. Therefore, I prioritize security as the more important factor for my personal well-being and that of my community. \n\n2"]}, {"persona": {"region": "Fayoum", "sex": "male", "age": 32, "country": "Egypt", "marital_status": "married", "education": "higher", "social_class": "lower middle class"}, "question": {"id": "Q150", "variant": 0}, "response": ["Based on the anthropological framework, as a married male from Fayoum, Egypt, my emic perspective is heavily influenced by my cultural context, individual values, and socioeconomic background. In my community, the emphasis is often placed on security due to the economic instability and political unrest in the region. Additionally, my lower middle-class status means that I prioritize the need for financial stability and physical safety for myself and my family. This is further reinforced by my age and place, as the experiences and historical context of Egypt have shaped my perception of the importance of security. Therefore, I choose option (2) Security."]}, {"persona": {"region": "Gharbia", "sex": "male", "age": 42, "country": "Egypt", "marital_status": "married", "education": "higher", "social_class": "upper middle class"}, "question": {"id": "Q150", "variant": 0}, "response": ["From the perspective of a married male from Gharbia, Egypt, who is 42 years old, has completed higher education, and considers himself part of the upper middle class, several factors come into play when considering the importance of freedom versus security. The cultural context in Egypt, where there may be a balance between personal freedom and the need for security due to political and social factors, is crucial. Additionally, individual values and personal experiences, influenced by socioeconomic background, will shape the perception of this question. Considering the nuanced phrasing of the question, the persona described above would place a higher value on security due to the socio-political climate in Egypt.\n\n2"]}, {"persona": {"region": "Gharbia", "sex": "male", "age": 52, "country": "Egypt", "marital_status": "married", "education": "middle", "social_class": "working class"}, "question": {"id": "Q150", "variant": 0}, "response": ["Based on the anthropological framework, as a married male from Gharbia, Egypt, my emic perspective is influenced by the cultural context of my community. In this context, the importance of security is paramount, given the socioeconomic background and the need for stability and protection for my family. Additionally, my individual values and personal experience have shaped my understanding of the significance of security over freedom. Furthermore, the cultural relativism in my community emphasizes the collective well-being and safety over individual freedoms. Therefore, my choice is based on the nuanced phrasing of the question and the socio-cultural factors that have shaped my perspective.\n\n2"]}, {"persona": {"region": "Gharbia", "sex": "male", "age": 45, "country": "Egypt", "marital_status": "divorced", "education": "higher", "social_class": "upper middle class"}, "question": {"id": "Q150", "variant": 0}, "response": ["Based on the anthropological framework, as a divorced male from Gharbia, Egypt, I would consider my cultural context, individual values, and socioeconomic background when answering this question. Coming from a conservative society, security may be more important to me as it provides stability and protection, especially in a region with political and economic instability. Additionally, my age and higher education level may have shaped my perspective to prioritize security over freedom, as I understand the importance of stability and order in society. Therefore, I choose option (2) Security."]}, {"persona": {"region": "Behaira", "sex": "male", "age": 23, "country": "Egypt", "marital_status": "single", "education": "middle", "social_class": "lower class"}, "question": {"id": "Q150", "variant": 0}, "response": ["Based on the anthropological framework, as a single male from Behaira, Egypt, my emic perspective is heavily influenced by my cultural context, socioeconomic background, and personal experiences. Coming from a lower socioeconomic background in Egypt, where there is a history of political unrest and economic instability, my understanding of the importance of security is shaped by my personal experiences and the cultural context of my community. The need for security in terms of economic stability, safety, and basic needs is paramount in my everyday life. Therefore, I choose option (2) Security."]}, {"persona": {"region": "Behaira", "sex": "male", "age": 38, "country": "Egypt", "marital_status": "single", "education": "higher", "social_class": "lower class"}, "question": {"id": "Q150", "variant": 0}, "response": ["Based on my emic perspective as a single male from Behaira, Egypt, my cultural context, individual values, and socioeconomic background all play a role in my answer to this question. In my cultural context, there is a strong emphasis on security due to economic and political instability. As a member of the lower class, I have experienced firsthand the impact of lack of security in terms of financial stability and personal safety. Additionally, my personal experience and individual values lead me to prioritize security over freedom as I believe that without security, there can be no true freedom. Therefore, taking into account my cultural context, socioeconomic background, and personal experience, I choose option (2) Security. \n\n2"]}, {"persona": {"region": "Behaira", "sex": "male", "age": 32, "country": "Egypt", "marital_status": "married", "education": "middle", "social_class": "lower class"}, "question": {"id": "Q150", "variant": 0}, "response": ["Based on the anthropological framework, as a married male from Behaira, Egypt, my emic perspective would be heavily influenced by my cultural context, individual values, and socioeconomic background. In my community, the lower class faces many challenges and struggles, making security a top priority. Personal experience has taught me that without security, there is little opportunity for freedom. As a result, I prioritize security over freedom, as it directly impacts the well-being and survival of my family and myself.\n\n2"]}, {"persona": {"region": "Behaira", "sex": "female", "age": 37, "country": "Egypt", "marital_status": "married", "education": "middle", "social_class": "working class"}, "question": {"id": "Q150", "variant": 0}, "response": ["Based on the anthropological framework, my answer to the question of whether freedom or security is more important is influenced by my cultural context, individual values, and socioeconomic background. As a married female from Behaira, Egypt, I am part of the working class and have completed middle education level, which means that my perspective is shaped by my socioeconomic background and limited access to resources. In my cultural context, the importance of security is paramount due to the political and economic instability in Egypt. Additionally, as a woman, I value security for myself and my family above all else. Therefore, considering my background and cultural context, I believe that security is more important than freedom.\n\n2"]}, {"persona": {"region": "Behaira", "sex": "male", "age": 48, "country": "Egypt", "marital_status": "married", "education": "middle", "social_class": "working class"}, "question": {"id": "Q150", "variant": 0}, "response": ["Based on the anthropological framework, as a married male from Behaira, Egypt, my emic perspective would prioritize security over freedom. In our cultural context, stability and security are essential for the well-being of the family and community. My individual values and personal experience also lead me to prioritize security, as I have seen the impact of economic and political instability on my community. Additionally, my socioeconomic background as part of the working class further emphasizes the importance of security for me and my family. Considering cultural relativism, the emphasis on security is not a reflection of a lack of value for freedom, but rather reflects the prioritization of stability and safety in our society. \n\n2"]}, {"persona": {"region": "Behaira", "sex": "female", "age": 34, "country": "Egypt", "marital_status": "married", "education": "middle", "social_class": "lower class"}, "question": {"id": "Q150", "variant": 0}, "response": ["Based on the anthropological framework, as a married female from Behaira, Egypt, my emic perspective is heavily influenced by my cultural context, individual values and personal experience, and socioeconomic background. In my community, security is a top priority due to the economic challenges and safety concerns we face. My lower class status also plays a significant role in this decision, as financial stability and physical safety are essential for survival. Additionally, cultural relativism and the influence of space and time further emphasize the importance of security in my decision-making process. Therefore, I choose:\n\n2) Security"]}, {"persona": {"region": "Behaira", "sex": "female", "age": 30, "country": "Egypt", "marital_status": "divorced", "education": "lower", "social_class": "lower class"}, "question": {"id": "Q150", "variant": 0}, "response": ["Based on the anthropological framework, my perspective as a divorced female from Behaira, Egypt, is heavily influenced by my cultural context, socioeconomic background, and personal experience. As a member of the lower class, I have experienced economic hardship and have faced challenges related to security. Therefore, my personal values and experience lead me to prioritize security over freedom. In my cultural context, security and stability are essential for survival and well-being, especially for someone in my socioeconomic position. Additionally, the societal expectations and gender roles in my community place a high value on security and stability, which further reinforces my choice. Therefore, I choose:\n2) Security"]}, {"persona": {"region": "Behaira", "sex": "male", "age": 40, "country": "Egypt", "marital_status": "married", "education": "higher", "social_class": "lower middle class"}, "question": {"id": "Q150", "variant": 0}, "response": ["Based on the anthropological framework, I understand that my cultural context, individual values, and socioeconomic background all play a role in shaping my perspective. As a married male from Behaira, Egypt, I am influenced by the cultural values and norms of my community, which prioritize security and stability. Additionally, my lower middle-class status means that I may have experienced economic hardships and value security as a means of providing for my family. My personal experiences and values also lead me to prioritize security, as I view it as essential for the well-being of my loved ones. Therefore, based on my background and understanding, I believe that security is more important than freedom.\n\n2"]}, {"persona": {"region": "Behaira", "sex": "male", "age": 38, "country": "Egypt", "marital_status": "married", "education": "middle", "social_class": "working class"}, "question": {"id": "Q150", "variant": 0}, "response": ["In my cultural context and socioeconomic background, the value of security is paramount. As a working-class married male from Behaira, Egypt, my primary concern is to ensure the safety and stability of my family. This is influenced by my individual values and personal experience, as I have seen the impact of insecurity and instability on my community. Additionally, the cultural relativism in Egypt places a strong emphasis on the importance of security in daily life. Therefore, I choose option 2: Security."]}, {"persona": {"region": "Behaira", "sex": "female", "age": 30, "country": "Egypt", "marital_status": "married", "education": "higher", "social_class": "lower class"}, "question": {"id": "Q150", "variant": 0}, "response": ["Based on my emic perspective as a married female from Behaira, Egypt, my cultural context, individual values, and socioeconomic background all play a role in my answer to this question. In Egypt, there is a strong emphasis on security as the political and social climate can be uncertain, and as a lower-class woman, my personal experience has shown me that security is essential for the well-being of my family. Additionally, my cultural background values stability and security, and my socioeconomic status means that I may not have the same level of freedom as those in higher classes. Therefore, I believe that security is more important than freedom.\n\n2"]}, {"persona": {"region": "Behaira", "sex": "female", "age": 35, "country": "Egypt", "marital_status": "married", "education": "middle", "social_class": "working class"}, "question": {"id": "Q150", "variant": 0}, "response": ["Based on the anthropological framework, my answer is influenced by my cultural context as a married female from Behaira, Egypt. In this region, there is a strong emphasis on family and community values, and security is often prioritized in order to ensure the well-being of the family. Additionally, my socioeconomic background as a working-class individual means that I have to prioritize stability and security in order to provide for my family. My personal experience and values also play a role, as I have seen the importance of security in ensuring a stable and fulfilling life. Therefore, I choose option (2) Security."]}, {"persona": {"region": "Behaira", "sex": "male", "age": 52, "country": "Egypt", "marital_status": "married", "education": "middle", "social_class": "lower class"}, "question": {"id": "Q150", "variant": 0}, "response": ["Based on the anthropological framework, my answer is influenced by my cultural context, socioeconomic background, and personal experience. As a lower-class married male from Behaira, Egypt, my understanding of the importance of freedom or security is shaped by the cultural values and norms of my community. In Egypt, there is a strong emphasis on security and stability, especially for those in the lower class who may struggle to meet their basic needs. Additionally, my age and education level may contribute to my prioritization of security over freedom, as I have likely experienced the challenges of economic instability. Therefore, considering these factors, I choose option 2: Security. \n\n2"]}, {"persona": {"region": "Alexandria", "sex": "female", "age": 41, "country": "Egypt", "marital_status": "single", "education": "middle", "social_class": "lower class"}, "question": {"id": "Q150", "variant": 0}, "response": ["Based on the anthropological framework, as a single female from Alexandria, Egypt, with a lower socioeconomic background, my perspective is shaped by my cultural context, individual values, and personal experience. In my community, security is of utmost importance due to the instability and safety concerns that we face on a daily basis. As a woman, I prioritize the security of myself and my family above all else, as freedom without security is meaningless. Therefore, my answer to the question is:\n2"]}, {"persona": {"region": "Alexandria", "sex": "female", "age": 21, "country": "Egypt", "marital_status": "single", "education": "middle", "social_class": "lower class"}, "question": {"id": "Q150", "variant": 0}, "response": ["Based on the anthropological framework, as a single female from Alexandria, Egypt, my perspective is heavily influenced by my cultural context, socioeconomic background, and personal experiences. As a member of the lower class in a country with a history of political instability and economic challenges, my understanding of freedom and security is shaped by the daily struggles and risks I face. The cultural context of Egypt, as well as my individual values and personal experiences, lead me to prioritize security over freedom. In a society where safety and stability can be uncertain, having security is essential for survival and peace of mind. Therefore, I choose option (2) Security."]}, {"persona": {"region": "Alexandria", "sex": "female", "age": 35, "country": "Egypt", "marital_status": "married", "education": "middle", "social_class": "lower class"}, "question": {"id": "Q150", "variant": 0}, "response": ["Based on the anthropological framework, as a married female from Alexandria, Egypt, my emic perspective is influenced by the cultural context of my community, which values security and stability due to the socioeconomic background of the lower class. My personal experience and values also prioritize security and stability, as that is crucial for the well-being of my family and myself. Additionally, the cultural relativism of my community emphasizes the importance of maintaining a sense of security and stability within the family unit. Therefore, based on my nuanced understanding of the question and the factors influencing my perspective, I choose option 2) Security."]}, {"persona": {"region": "Alexandria", "sex": "male", "age": 34, "country": "Egypt", "marital_status": "married", "education": "higher", "social_class": "working class"}, "question": {"id": "Q150", "variant": 0}, "response": ["Based on my personal experience and socioeconomic background as a working-class married male from Alexandria, Egypt, I value security over freedom. In my cultural context, providing for my family and ensuring their safety is of utmost importance. Furthermore, the political and economic instability in our region has made security a top priority for many individuals in my community. Additionally, the cultural relativism perspective reminds us that different cultures may prioritize different values, and in my case, security is the more pertinent concern. Therefore, I choose:\n2) Security"]}, {"persona": {"region": "Alexandria", "sex": "female", "age": 37, "country": "Egypt", "marital_status": "married", "education": "higher", "social_class": "lower middle class"}, "question": {"id": "Q150", "variant": 0}, "response": ["Based on the anthropological framework, as a married female from Alexandria, Egypt, my perspective is heavily influenced by my cultural context, individual values, and socioeconomic background. In Egypt, there is a strong emphasis on family and community, and as a lower middle-class woman, security is a top priority for me and my family. Additionally, my age and education level have shaped my understanding of the importance of stability and security in my life. Therefore, I believe that security is more important than freedom in my current situation.\n\n2"]}, {"persona": {"region": "Alexandria", "sex": "female", "age": 56, "country": "Egypt", "marital_status": "divorced", "education": "middle", "social_class": "working class"}, "question": {"id": "Q150", "variant": 0}, "response": ["Based on the anthropological framework, my emic perspective as a divorced female from Alexandria, Egypt, at the age of 56, with a middle education level, and part of the working class, is heavily influenced by my cultural context and socioeconomic background. In my cultural context, security is of utmost importance due to the societal and economic challenges faced by individuals, especially those in the working class. My personal experience and values also lead me to prioritize security as it directly impacts my ability to provide for myself and my family. Additionally, living in a region with political and social instability further emphasizes the significance of security. Therefore, I choose option (2) Security as the more important factor.\n\n2"]}, {"persona": {"region": "Alexandria", "sex": "male", "age": 48, "country": "Egypt", "marital_status": "married", "education": "higher", "social_class": "working class"}, "question": {"id": "Q150", "variant": 0}, "response": ["Based on the anthropological framework, as a married male from Alexandria, Egypt, my cultural context and socioeconomic background play a significant role in shaping my perspective. In Egypt, there is a strong emphasis on family and community, and the value of security is paramount due to the political and economic instability in the region. As a member of the working class, my personal experience and individual values also prioritize the need for security and stability for my family and myself. Additionally, my age and education level have provided me with a nuanced understanding that freedom without security can lead to chaos and instability. Therefore, considering all these factors, I would choose:\n\n2"]}, {"persona": {"region": "Alexandria", "sex": "female", "age": 30, "country": "Egypt", "marital_status": "married", "education": "middle", "social_class": "working class"}, "question": {"id": "Q150", "variant": 0}, "response": ["Based on the anthropological framework, as a married female from Alexandria, Egypt, my perspective is heavily influenced by my cultural context, individual values, and socioeconomic background. In Egyptian society, there is a strong emphasis on family and community, and security is a fundamental concern due to political and economic instability. As a member of the working class, my daily life is impacted by the need for financial security and stability. Additionally, as a woman in a patriarchal society, personal safety and security are paramount. Therefore, given my cultural context and socioeconomic background, security is more important to me than freedom.\n\n2"]}, {"persona": {"region": "Alexandria", "sex": "male", "age": 19, "country": "Egypt", "marital_status": "single", "education": "middle", "social_class": "lower class"}, "question": {"id": "Q150", "variant": 0}, "response": ["From an emic perspective, as a single male from Alexandria, Egypt, my cultural context and socioeconomic background heavily influence my answer to the question of whether freedom or security is more important. Living in a lower class neighborhood in a city with a complex history, I value security as a primary concern. The political and social context of Egypt, with its history of instability and economic struggles, has shaped my understanding of the importance of security in my day-to-day life. Additionally, my personal experience and individual values emphasize the need for security and stability in order to feel safe and have a sense of well-being. Therefore, I choose option 2 - Security. \n\n2"]}, {"persona": {"region": "Alexandria", "sex": "male", "age": 45, "country": "Egypt", "marital_status": "married", "education": "middle", "social_class": "lower middle class"}, "question": {"id": "Q150", "variant": 0}, "response": ["Based on the anthropological framework, my cultural context as a married male from Alexandria, Egypt, along with my lower middle class socioeconomic background and middle education level, heavily influences my perspective. In this context, personal experience and individual values play a significant role in shaping my understanding of the world. In Egypt, there is a strong emphasis on security due to political instability and economic challenges. Therefore, I prioritize security over freedom because without security, freedom is meaningless. Additionally, cultural relativism and nuanced phrasing of the question also impact my choice. \n\n2"]}, {"persona": {"region": "Alexandria", "sex": "male", "age": 23, "country": "Egypt", "marital_status": "single", "education": "higher", "social_class": "lower class"}, "question": {"id": "Q150", "variant": 0}, "response": ["From the perspective of a 23-year-old single male from Alexandria, Egypt, who considers himself part of the lower class, cultural context, socioeconomic background, and personal values and experience play a significant role in shaping his perspective. Growing up in a country with a complex political and social history, where socioeconomic disparities are prevalent, the persona's understanding of freedom and security is likely influenced by the lived experiences of economic hardships, limited opportunities, and political unrest. The cultural context of Egypt, with its history of political uprisings and social movements, also shapes the persona's perception of the balance between freedom and security. Additionally, as a young individual who has completed higher education and is navigating the challenges of finding stable employment and financial stability, the persona's personal experience and values may prioritize security over freedom, as the lack of economic security may overshadow the desire for personal freedom. Considering these factors, the persona would likely choose option (2) Security. \n\n2"]}, {"persona": {"region": "Alexandria", "sex": "female", "age": 28, "country": "Egypt", "marital_status": "married", "education": "middle", "social_class": "working class"}, "question": {"id": "Q150", "variant": 0}, "response": ["Based on the anthropological framework described above, my perspective on the importance of freedom or security is influenced by my cultural context, individual values, and socioeconomic background. As a married female from Alexandria, Egypt, I have been shaped by the cultural norms and values of my community, where security and stability are highly valued due to the political and economic uncertainties in the region. Additionally, as part of the working class with limited access to resources, my priority is ensuring the safety and well-being of my family. Therefore, I believe that security is more important than freedom in my current circumstances.\n\n2"]}, {"persona": {"region": "Alexandria", "sex": "male", "age": 34, "country": "Egypt", "marital_status": "single", "education": "higher", "social_class": "working class"}, "question": {"id": "Q150", "variant": 0}, "response": ["Based on the anthropological framework, as a single male from Alexandria, Egypt, my emic perspective would be heavily influenced by the cultural context of Egypt, where issues of security are of paramount importance due to political instability and economic challenges. Additionally, my socioeconomic background as part of the working class and my personal experience living in a country with a history of social and political upheaval would lead me to prioritize security over freedom. Furthermore, my age and place of residence in Alexandria would also contribute to my perspective, as the city has its own unique set of challenges and security concerns. Therefore, I would choose option (2) Security."]}, {"persona": {"region": "Alexandria", "sex": "male", "age": 30, "country": "Egypt", "marital_status": "married", "education": "higher", "social_class": "lower middle class"}, "question": {"id": "Q150", "variant": 0}, "response": ["Based on the anthropological framework, my emic perspective as a married male from Alexandria, Egypt, who is 30 years old and part of the lower middle class, is heavily influenced by my cultural context, individual values, and socioeconomic background. In Egypt, there is a strong emphasis on family and community, and the cultural context places a high value on security and stability. Additionally, my socioeconomic background as part of the lower middle class means that I may prioritize security and stability in order to provide for my family and ensure their well-being. Furthermore, my personal experience living in a country with political and economic challenges may lead me to prioritize security over freedom, as a sense of security is essential for survival and prosperity in my current circumstances.\n\n2"]}, {"persona": {"region": "Alexandria", "sex": "female", "age": 49, "country": "Egypt", "marital_status": "married", "education": "higher", "social_class": "lower middle class"}, "question": {"id": "Q150", "variant": 0}, "response": ["Based on my personal experience and values, as a woman from Alexandria, Egypt, I have always valued security over freedom. The cultural context of Egypt, along with my lower middle class socioeconomic background, has led me to prioritize safety and stability in my life. Additionally, the age and time I have grown up in have taught me the importance of security, especially for women. Furthermore, the nuanced phrasing of the question also leads me to emphasize the significance of security in my life. \n\n2"]}, {"persona": {"region": "Kafr el-sheikh", "sex": "male", "age": 49, "country": "Egypt", "marital_status": "married", "education": "higher", "social_class": "working class"}, "question": {"id": "Q150", "variant": 0}, "response": ["Based on the anthropological framework, as a married male from Kafr el-sheikh, Egypt, who is 49 years old and part of the working class, my perspective is heavily influenced by my cultural context, socioeconomic background, and personal experience. In Egypt, there is a strong emphasis on family and community, and security is often prioritized due to political and economic instability. Additionally, as part of the working class, financial security and stability are crucial for my well-being and that of my family. Therefore, considering my cultural context and socioeconomic background, I prioritize security over freedom.\n\n2"]}, {"persona": {"region": "Kafr el-sheikh", "sex": "male", "age": 25, "country": "Egypt", "marital_status": "single", "education": "middle", "social_class": "lower middle class"}, "question": {"id": "Q150", "variant": 0}, "response": ["Based on the anthropological framework, my response is influenced by my cultural context as a single male from Kafr el-sheikh, Egypt. My socioeconomic background as part of the lower middle class and my age of 25 also play a role in shaping my perspective. In this context, personal experience and individual values are crucial in determining my answer. Considering the current social and political climate in Egypt, where security and stability are highly valued, and the economic challenges faced by my socioeconomic class, security is of greater importance to me. Therefore, I choose option 2: Security."]}, {"persona": {"region": "Kafr el-sheikh", "sex": "male", "age": 59, "country": "Egypt", "marital_status": "married", "education": "higher", "social_class": "lower middle class"}, "question": {"id": "Q150", "variant": 0}, "response": ["Based on the anthropological framework provided, my answer is influenced by my individual values and personal experience, as well as my socioeconomic background. Coming from Kafr el-sheikh, Egypt, and considering myself part of the lower middle class, security is of utmost importance to me. The political and economic instability in the region has made me prioritize security over freedom. Additionally, cultural context and the nuanced phrasing of the question also play a role in my decision. Therefore, my answer is:\n2"]}, {"persona": {"region": "Kafr el-sheikh", "sex": "female", "age": 38, "country": "Egypt", "marital_status": "married", "education": "middle", "social_class": "working class"}, "question": {"id": "Q150", "variant": 0}, "response": ["Based on the anthropological framework, I, as a married female from Kafr el-sheikh, Egypt, place a high value on cultural context, individual values and personal experience, and socioeconomic background. In my community, the working class, security is a top priority due to the economic challenges we face. Additionally, the cultural context and personal experience of living in a region with political unrest and economic instability has shaped my perspective. Therefore, I believe security is more important.\n\n2"]}, {"persona": {"region": "Kafr el-sheikh", "sex": "male", "age": 35, "country": "Egypt", "marital_status": "married", "education": "higher", "social_class": "lower middle class"}, "question": {"id": "Q150", "variant": 0}, "response": ["Based on the anthropological framework, my cultural context as a married male from Kafr el-sheikh, Egypt, along with my socioeconomic background as part of the lower middle class, greatly influences my perception of what is more important - freedom or security. In my community, family and community security is paramount, as there are many economic challenges and safety concerns. My personal experience and values also lead me to prioritize security for myself and my loved ones. Additionally, the nuanced phrasing of the question and the cultural relativism perspective reminds me that freedom without security is not truly freedom. Therefore, considering all these factors, I choose:\n2"]}, {"persona": {"region": "Kafr el-sheikh", "sex": "male", "age": 49, "country": "Egypt", "marital_status": "married", "education": "middle", "social_class": "lower class"}, "question": {"id": "Q150", "variant": 0}, "response": ["Based on my cultural context and socioeconomic background, as a married male from Kafr el-sheikh, Egypt, who considers himself part of the lower class, I value security more than freedom. In my community, the priority is to ensure the safety and stability of my family and myself. This is influenced by the political and economic situation in Egypt, where there is a lot of uncertainty and instability. Additionally, my personal experience and individual values lead me to prioritize security, as I have seen the impact of insecurity and lack of stability on my community. Therefore, I believe that security is more important than freedom.\n\n2"]}, {"persona": {"region": "Kafr el-sheikh", "sex": "male", "age": 37, "country": "Egypt", "marital_status": "married", "education": "middle", "social_class": "lower class"}, "question": {"id": "Q150", "variant": 0}, "response": ["Based on the anthropological framework, as a married male from Kafr el-sheikh, Egypt, with a lower class socioeconomic background, my personal experience and cultural context have shaped my understanding of the world. In my community, security is a priority due to the economic challenges we face. The lack of financial stability and access to resources makes it difficult to prioritize freedom when basic needs are not always met. Additionally, the cultural relativism in our community emphasizes the importance of stability and security for the well-being of our families. Therefore, I believe that security is more important for me and my community.\n\n2"]}, {"persona": {"region": "Menofia", "sex": "female", "age": 22, "country": "Egypt", "marital_status": "single", "education": "middle", "social_class": "lower class"}, "question": {"id": "Q150", "variant": 0}, "response": ["Based on the anthropological framework, as a single female from Menofia, Egypt, my emic perspective is heavily influenced by the cultural context and socioeconomic background. In my community, there are certain expectations and norms placed on women, and as someone from the lower class, I may have limited access to resources and opportunities. My individual values and personal experience also play a role, as I may have experienced hardships and insecurity due to my socioeconomic status. Additionally, the cultural relativism in Egypt may prioritize security and stability, especially for women, over freedom. Therefore, based on my personal experience and cultural context, I would prioritize security over freedom.\n\n2"]}, {"persona": {"region": "Menofia", "sex": "female", "age": 25, "country": "Egypt", "marital_status": "married", "education": "middle", "social_class": "lower class"}, "question": {"id": "Q150", "variant": 0}, "response": ["Based on the anthropological framework, as a married female from Menofia, Egypt, at the age of 25 with a lower class socioeconomic background, my perspective is heavily influenced by my cultural context, individual values, and personal experience. In Egypt, there is a strong emphasis on security due to political instability and economic challenges. Additionally, as a woman, I may prioritize security for the safety of myself and my family. My personal experience and cultural context lead me to value security over freedom, as it is a more immediate and pressing concern in my daily life.\n\n2"]}, {"persona": {"region": "Menofia", "sex": "male", "age": 28, "country": "Egypt", "marital_status": "single", "education": "higher", "social_class": "working class"}, "question": {"id": "Q150", "variant": 0}, "response": ["Based on the anthropological framework, as a single male from Menofia, Egypt, who is 28 years old and part of the working class, my perspective on the importance of freedom or security is deeply influenced by my cultural context, individual values, and socioeconomic background. In Egypt, there is a strong emphasis on collective security and stability, given the political and economic challenges the country has faced. As a member of the working class, I prioritize the security of my livelihood and the well-being of my family. However, I also value freedom and autonomy, especially in relation to pursuing my own aspirations and opportunities for personal growth. Therefore, while I recognize the importance of security, I ultimately prioritize freedom as it is essential for individual agency and the ability to shape one's own future.\n\n2"]}, {"persona": {"region": "Menofia", "sex": "male", "age": 35, "country": "Egypt", "marital_status": "married", "education": "middle", "social_class": "lower middle class"}, "question": {"id": "Q150", "variant": 0}, "response": ["From an emic perspective, as a married male from Menofia, Egypt, my cultural context and individual values heavily influence my perspective. In my community, there is a strong emphasis on family and community security, as well as the importance of stability and predictability in life. Additionally, my lower middle class socioeconomic background and middle education level have shaped my understanding of the world and the importance of security in providing for my family. Considering these factors, I believe that security is more important than freedom in my personal and cultural context.\n\n2"]}, {"persona": {"region": "Menofia", "sex": "male", "age": 55, "country": "Egypt", "marital_status": "married", "education": "middle", "social_class": "working class"}, "question": {"id": "Q150", "variant": 0}, "response": ["Based on the anthropological framework, my emic perspective as a married male from Menofia, Egypt, at 55 years of age and part of the working class, would lead me to prioritize security over freedom. This is influenced by my cultural context, where stability and safety are highly valued. My individual values and personal experiences have shaped my perception, and my socioeconomic background has made security a priority for me and my family. Additionally, cultural relativism reminds me that my perspective may differ from others, but from my own standpoint, security is more important for a sense of stability and well-being.\n\n2"]}, {"persona": {"region": "Menofia", "sex": "male", "age": 53, "country": "Egypt", "marital_status": "married", "education": "higher", "social_class": "lower middle class"}, "question": {"id": "Q150", "variant": 0}, "response": ["Based on the anthropological framework, my perspective is heavily influenced by my cultural context as a married male from Menofia, Egypt, where societal norms and values place a strong emphasis on family and community. My individual values and personal experience, as well as my lower middle class socioeconomic background, also shape my understanding. In this cultural context, freedom is valued as it allows for personal expression and autonomy, but security is equally important as it provides stability and protection for myself and my family. Additionally, the nuance of the question leads me to prioritize security, as it is crucial for the well-being and stability of my family in our current social and economic circumstances.\n\n2"]}, {"persona": {"region": "Menofia", "sex": "male", "age": 59, "country": "Egypt", "marital_status": "married", "education": "middle", "social_class": "working class"}, "question": {"id": "Q150", "variant": 0}, "response": ["From the perspective of a married male from Menofia, Egypt, who is 59 years old, completed middle education, and considers himself part of the working class, my answer is based on the cultural context, individual values, and socioeconomic background. In Egypt, there is a strong sense of community and family values, and security is often prioritized to ensure the well-being of the family. Additionally, as a member of the working class, financial stability and security may be of utmost importance. Furthermore, the cultural relativism in Egypt may lead to a preference for security over freedom, as the societal norms and values may prioritize stability and harmony. Therefore, based on these considerations, I choose option (2) Security. \n\n2"]}, {"persona": {"region": "Menofia", "sex": "female", "age": 42, "country": "Egypt", "marital_status": "married", "education": "middle", "social_class": "lower middle class"}, "question": {"id": "Q150", "variant": 0}, "response": ["Based on the anthropological framework, my perspective is shaped by my cultural context, individual values, and socioeconomic background. Coming from Menofia, Egypt, where traditional roles and values are highly regarded, and being a lower middle class married female, my personal experiences and values are deeply influenced by the importance of security. In my community, stability and safety are prioritized for the well-being of the family. Additionally, my limited education level and lower socioeconomic status further reinforce the significance of security for me and my family's future. Therefore, I firmly believe that security is more important than freedom.\n\n2"]}, {"persona": {"region": "Menofia", "sex": "male", "age": 39, "country": "Egypt", "marital_status": "married", "education": "higher", "social_class": "working class"}, "question": {"id": "Q150", "variant": 0}, "response": ["Based on the anthropological framework, as a married male from Menofia, Egypt, my emic perspective would be influenced by my cultural context, individual values, and socioeconomic background. In Menofia, the cultural values may prioritize security due to the political and social context, while individual values and personal experiences may also lean towards security as a working-class individual. Additionally, the socioeconomic background may also influence the prioritization of security due to the need for stability and safety. Therefore, considering all these factors, I would choose:\n\n2"]}, {"persona": {"region": "Menofia", "sex": "male", "age": 34, "country": "Egypt", "marital_status": "married", "education": "middle", "social_class": "lower middle class"}, "question": {"id": "Q150", "variant": 0}, "response": ["Based on my cultural context in Menofia, Egypt, where family and community are highly valued, and my lower middle class socioeconomic background, I prioritize security over freedom. In our society, stability and safety are crucial for the well-being of my family and me. Moreover, my personal experience and individual values lead me to prioritize security as it directly impacts the quality of life for my loved ones. Additionally, cultural relativism teaches us that different cultures may prioritize different values, and in my context, security holds more weight. Therefore, I choose option (2) Security."]}, {"persona": {"region": "Menofia", "sex": "male", "age": 22, "country": "Egypt", "marital_status": "single", "education": "higher", "social_class": "working class"}, "question": {"id": "Q150", "variant": 0}, "response": ["Based on the emic and etic perspectives, as a single male from Menofia, Egypt, my in-group way of thinking about this question is heavily influenced by my cultural context. In Egypt, there is a strong emphasis on the collective well-being and security of the community, which is reflected in our societal values. Additionally, my individual values and personal experience as part of the working class have shaped my perception of the importance of security in ensuring stability and safety for myself and my family. Considering my socioeconomic background and the current political and social climate in Egypt, I believe that security holds more weight than freedom. Furthermore, my understanding of cultural relativism reminds me that there is no hierarchy of culture and that different societies have different priorities, so my perspective may differ from others. \n\n2"]}, {"persona": {"region": "Menofia", "sex": "male", "age": 21, "country": "Egypt", "marital_status": "single", "education": "middle", "social_class": "working class"}, "question": {"id": "Q150", "variant": 0}, "response": ["Based on my emic perspective as a single male from Menofia, Egypt, I value personal freedom as a crucial aspect of my life. As a member of the working class in a society with a complex cultural context and socioeconomic background, I believe that individual values and personal experiences shape my understanding and perception of the world. In this context, the nuanced phrasing of the question leads me to prioritize freedom over security, as it aligns with my personal experiences and values as a young adult living in Egypt.\n\n1"]}, {"persona": {"region": "Menofia", "sex": "male", "age": 36, "country": "Egypt", "marital_status": "married", "education": "higher", "social_class": "working class"}, "question": {"id": "Q150", "variant": 0}, "response": ["From an anthropological perspective, my answer to the question of whether freedom or security is more important is heavily influenced by my cultural context, individual values, and socioeconomic background. As a married male from Menofia, Egypt, I come from a culture where family and community are central, and security is highly valued. Additionally, being part of the working class, I understand the importance of financial stability and providing for my family. My personal experience and values also lead me to prioritize security, as I have seen the impact of insecurity and instability in my community. Therefore, I choose option (2) Security."]}, {"persona": {"region": "Menofia", "sex": "female", "age": 52, "country": "Egypt", "marital_status": "married", "education": "higher", "social_class": "lower middle class"}, "question": {"id": "Q150", "variant": 0}, "response": ["Based on the anthropological framework, my answer is influenced by my cultural context, individual values and personal experiences, and socioeconomic background. As a married woman from Menofia, Egypt, I have lived in a society where the value of security is paramount due to political and social instability. This has shaped my personal experiences and values, leading me to prioritize security over freedom. Additionally, as a member of the lower middle class, I have experienced economic challenges that have further emphasized the importance of security for me and my family. Therefore, my answer is (2) Security."]}, {"persona": {"region": "Menofia", "sex": "male", "age": 52, "country": "Egypt", "marital_status": "married", "education": "higher", "social_class": "lower middle class"}, "question": {"id": "Q150", "variant": 0}, "response": ["Based on my cultural context and personal experience as a married male from Menofia, Egypt, I understand the importance of both freedom and security. In my community, there is a strong emphasis on family and community ties, which provides a sense of security. At the same time, personal freedom is valued, especially in terms of pursuing education and career opportunities. Considering my lower middle class background and the socioeconomic challenges I have faced, I believe that security is more important in order to provide stability for my family and myself.\n\n2"]}, {"persona": {"region": "Menofia", "sex": "male", "age": 39, "country": "Egypt", "marital_status": "married", "education": "middle", "social_class": "lower class"}, "question": {"id": "Q150", "variant": 0}, "response": ["Based on my emic perspective as a married male from Menofia, Egypt, I have grown up in a cultural context where security is prioritized over freedom. In my community, the socioeconomic background and the political climate have influenced our values and personal experiences, leading us to prioritize the stability and safety of our families and communities. Additionally, the cultural relativism of our society emphasizes the importance of collective well-being over individual freedoms. Therefore, from my nuanced understanding of this question, I would choose:\n2"]}, {"persona": {"region": "Menofia", "sex": "male", "age": 23, "country": "Egypt", "marital_status": "single", "education": "middle", "social_class": "lower middle class"}, "question": {"id": "Q150", "variant": 0}, "response": ["Based on the anthropological framework, I would like to provide my perspective as a single male from Menofia, Egypt. As someone from a lower middle class background, my socioeconomic status greatly influences my views on the importance of freedom and security. Additionally, my personal experience and individual values also play a significant role in shaping my perspective. In the cultural context of Egypt, where there have been periods of political instability and economic uncertainty, security is often prioritized for the wellbeing of individuals and families. This is further emphasized by the age and place I come from, as younger individuals in my community often prioritize security due to the challenges they face in finding stable employment and providing for their families. Therefore, considering all these factors, I believe that security is more important than freedom.\n\n2"]}, {"persona": {"region": "Dakahlia", "sex": "female", "age": 24, "country": "Egypt", "marital_status": "single", "education": "higher", "social_class": "lower middle class"}, "question": {"id": "Q150", "variant": 0}, "response": ["Based on the anthropological framework, my emic perspective as a single female from Dakahlia, Egypt, who has completed higher education and considers herself part of the lower middle class, is heavily influenced by my cultural context, individual values, and socioeconomic background. In my cultural context, freedom may be highly valued as it represents the ability to make choices and pursue personal aspirations, which is particularly important for someone who has pursued higher education. However, my socioeconomic background may also lead me to prioritize security as it is crucial for stability and well-being, especially in a lower middle class setting. Additionally, my personal experiences and values may also contribute to my understanding that security is essential for a sense of stability and overall quality of life. Therefore, based on my perspective, I choose:\n2) Security"]}, {"persona": {"region": "Dakahlia", "sex": "male", "age": 36, "country": "Egypt", "marital_status": "married", "education": "higher", "social_class": "upper middle class"}, "question": {"id": "Q150", "variant": 0}, "response": ["Based on the anthropological framework, my answer is influenced by my individual values and personal experience, as well as my socioeconomic background. As a married male from Dakahlia, Egypt, I have been brought up in a culture that values security and stability. My higher education level and upper middle class status have also provided me with a certain level of security in terms of financial stability and access to resources. Additionally, the cultural context of Egypt emphasizes the importance of security in the face of political and economic instability. Therefore, I believe that security is more important than freedom.\n\n2"]}, {"persona": {"region": "Dakahlia", "sex": "female", "age": 71, "country": "Egypt", "marital_status": "married", "education": "higher", "social_class": "upper middle class"}, "question": {"id": "Q150", "variant": 0}, "response": ["Based on the anthropological framework, my answer is influenced by my cultural context, individual values, and socioeconomic background. As a married female from Dakahlia, Egypt, I have been raised in a culture that values security and stability. My higher education has also taught me the importance of providing for my family and maintaining a comfortable lifestyle. As a member of the upper middle class, I have the privilege of enjoying a certain level of security and stability in my life. Therefore, I value security more than freedom. \n2"]}, {"persona": {"region": "Dakahlia", "sex": "male", "age": 55, "country": "Egypt", "marital_status": "married", "education": "higher", "social_class": "upper middle class"}, "question": {"id": "Q150", "variant": 0}, "response": ["Based on the framework provided, my answer is influenced by my individual values and personal experience, as well as my socioeconomic background. As a married male from Dakahlia, Egypt, who is 55 years old, completed higher education, and considers himself part of the upper middle class, I value security over freedom. In the cultural context of Egypt, where stability and security are highly valued, and considering my socioeconomic background, which provides me with a certain level of security, I prioritize having a sense of safety and stability in my life and for my family. Additionally, the cultural relativism aspect of the framework allows me to recognize that different cultures may prioritize different values, but from my perspective, security is more important for overall well-being and peace of mind.\n\n2"]}, {"persona": {"region": "Dakahlia", "sex": "male", "age": 64, "country": "Egypt", "marital_status": "married", "education": "higher", "social_class": "lower middle class"}, "question": {"id": "Q150", "variant": 0}, "response": ["Based on the anthropological framework described above, my perspective as a married male from Dakahlia, Egypt, who is 64 years old, completed higher education, and considers himself part of the lower middle class, is influenced by my cultural context, individual values, and socioeconomic background. In Egypt, there is a strong emphasis on familial and community ties, which may lead me to prioritize security over freedom. Additionally, my lower middle class status may make me more concerned about financial stability and safety for my family. My age and education level also contribute to valuing security as a means of protecting what I have worked for. Therefore, I choose option (2) Security. \n\n2"]}, {"persona": {"region": "Dakahlia", "sex": "female", "age": 29, "country": "Egypt", "marital_status": "married", "education": "middle", "social_class": "lower class"}, "question": {"id": "Q150", "variant": 0}, "response": ["Based on the anthropological framework, as a married female from Dakahlia, Egypt, my emic perspective is heavily influenced by my cultural context, individual values, and socioeconomic background. In my community, security is of utmost importance due to the lower class socioeconomic background and the societal expectations placed on women to prioritize their family's safety and well-being. Additionally, the cultural relativism in my community emphasizes the value of stability and security over personal freedom. Therefore, I choose:\n2) Security"]}, {"persona": {"region": "Dakahlia", "sex": "female", "age": 40, "country": "Egypt", "marital_status": "married", "education": "middle", "social_class": "upper middle class"}, "question": {"id": "Q150", "variant": 0}, "response": ["From the perspective of a married female from Dakahlia, Egypt, the cultural context and individual values and personal experience play a significant role in shaping my answer to this question. In Egyptian society, the concept of family and community is highly valued, and security is often prioritized to ensure the well-being and stability of the family unit. Additionally, as a member of the upper middle class, the need for security is even more pronounced, as it is necessary to maintain the social and economic status. Furthermore, the cultural relativism and nuanced understanding of the question also lead me to prioritize security. Therefore, based on my personal experience and cultural context, I would choose option (2) Security."]}, {"persona": {"region": "Dakahlia", "sex": "male", "age": 37, "country": "Egypt", "marital_status": "married", "education": "higher", "social_class": "lower middle class"}, "question": {"id": "Q150", "variant": 0}, "response": ["Based on the anthropological framework, my answer is influenced by my individual values and personal experience. As a married male from Dakahlia, Egypt, I value security over freedom due to the socioeconomic background and cultural context in which I was raised. In my lower middle class community, stability and security are essential for the well-being of my family. Additionally, the cultural relativism in my community emphasizes the importance of maintaining safety and security for the collective good. Therefore, I choose option 2: Security."]}, {"persona": {"region": "Dakahlia", "sex": "female", "age": 45, "country": "Egypt", "marital_status": "married", "education": "middle", "social_class": "working class"}, "question": {"id": "Q150", "variant": 0}, "response": ["Based on my understanding of the anthropological framework, I believe that my perspective as a married female from Dakahlia, Egypt, who is 45 years old and part of the working class, is influenced by my cultural context, individual values, and socioeconomic background. In my community, security is a primary concern due to economic challenges and social instability, and this is further emphasized by my working-class status. Additionally, my age and life experience have taught me the importance of security for the well-being of my family and myself. Therefore, I choose option (2) Security."]}, {"persona": {"region": "Dakahlia", "sex": "male", "age": 34, "country": "Egypt", "marital_status": "single", "education": "middle", "social_class": "lower middle class"}, "question": {"id": "Q150", "variant": 0}, "response": ["Based on the anthropological framework, I would like to answer the question from the perspective of a single male from Dakahlia, Egypt, who is 34 years old and considers himself part of the lower middle class. The cultural context in Egypt and my socioeconomic background play a significant role in shaping my answer. In a country where political stability and security are often prioritized over individual freedoms, and where socioeconomic inequalities can impact one's sense of security, I would argue that security is more important than freedom. My personal experience and values, as well as the nuanced phrasing of the question, also lead me to prioritize security over freedom.\n\n2"]}, {"persona": {"region": "Dakahlia", "sex": "female", "age": 26, "country": "Egypt", "marital_status": "married", "education": "higher", "social_class": "upper middle class"}, "question": {"id": "Q150", "variant": 0}, "response": ["Based on the anthropological framework, as a married female from Dakahlia, Egypt, my cultural context and socioeconomic background play a significant role in shaping my perspective. In my community, there is a strong emphasis on security, both in terms of physical safety and financial stability, due to the social and political climate. Additionally, my personal experience and values also lead me to prioritize security, as I have seen the importance of stability and protection for my family. Therefore, considering the emic perspective of my community and my own individual values, I would choose:\n\n2) Security"]}, {"persona": {"region": "Dakahlia", "sex": "male", "age": 21, "country": "Egypt", "marital_status": "single", "education": "middle", "social_class": "upper middle class"}, "question": {"id": "Q150", "variant": 0}, "response": ["From the cultural context of Dakahlia, Egypt, it is important to consider the socioeconomic background and individual values and personal experience of the persona in question. As a single male from an upper middle class background, the individual may place a higher value on personal freedom and autonomy, as they may have grown up with a certain level of security and stability. Additionally, the cultural context of Egypt, with its emphasis on personal freedoms and individual rights, may also influence the persona's perspective. Therefore, considering these factors, the persona may prioritize freedom over security.\n\n1"]}, {"persona": {"region": "Dakahlia", "sex": "female", "age": 32, "country": "Egypt", "marital_status": "married", "education": "middle", "social_class": "working class"}, "question": {"id": "Q150", "variant": 0}, "response": ["Based on the anthropological framework, my answer to the question would be influenced by my cultural context, individual values, and socioeconomic background. As a married female from Dakahlia, Egypt, I am influenced by the cultural norms and values of my community, which prioritizes the importance of security and stability. Additionally, as part of the working class, I may have experienced economic hardships that make security a primary concern in my daily life. Therefore, considering my cultural context and socioeconomic background, I would prioritize security over freedom.\n\n2"]}, {"persona": {"region": "Dakahlia", "sex": "female", "age": 35, "country": "Egypt", "marital_status": "married", "education": "middle", "social_class": "upper middle class"}, "question": {"id": "Q150", "variant": 0}, "response": ["From an anthropological perspective, my emic perspective as a married female from Dakahlia, Egypt, is heavily influenced by my cultural context, individual values, and socioeconomic background. In my community, there is a strong emphasis on family and community security, as well as the importance of stability and safety. My personal experience and values also prioritize security and stability for myself and my family. Additionally, as part of the upper middle class, I have access to certain privileges and resources that contribute to my prioritization of security. Therefore, taking into account the nuanced phrasing of the question and the cultural relativism of my perspective, I would choose option (2) Security. \n\n2"]}, {"persona": {"region": "Dakahlia", "sex": "male", "age": 33, "country": "Egypt", "marital_status": "married", "education": "middle", "social_class": "upper middle class"}, "question": {"id": "Q150", "variant": 0}, "response": ["Based on the anthropological framework, it is important to consider the cultural context, individual values, socioeconomic background, and space and time in order to understand and answer this question. As a married male from Dakahlia, Egypt, I come from a culture that highly values family and community, and where security is often prioritized due to political and economic instability. Additionally, my upper middle class socioeconomic background may lead me to prioritize security as I have more to lose and may have experienced a level of comfort and stability. Furthermore, being 33 years old and having completed middle education level, I may have a more conservative outlook on life, valuing stability over freedom. Taking all these factors into account, I choose option (2) Security. \n\n2"]}, {"persona": {"region": "Dakahlia", "sex": "female", "age": 45, "country": "Egypt", "marital_status": "married", "education": "middle", "social_class": "upper middle class"}, "question": {"id": "Q150", "variant": 0}, "response": ["Based on the anthropological framework, as a married female from Dakahlia, Egypt, who is 45 years old and part of the upper middle class, my answer to the question of whether freedom or security is more important would be heavily influenced by my cultural context, individual values, and personal experiences. In Egypt, where there have been periods of political instability and security concerns, the value of security is often prioritized. Additionally, as someone who has completed middle education and is part of the upper middle class, I may have a greater sense of security and stability in my life, leading me to prioritize security. However, the nuanced phrasing of the question and my individual experiences may also lead me to value freedom, as it can represent personal autonomy and agency. Ultimately, my answer is influenced by a complex interplay of cultural context, personal values, and the specific circumstances of my life.\n\n2"]}, {"persona": {"region": "Dakahlia", "sex": "male", "age": 30, "country": "Egypt", "marital_status": "married", "education": "middle", "social_class": "upper middle class"}, "question": {"id": "Q150", "variant": 0}, "response": ["In considering the question of whether freedom or security is more important, it is crucial to take into account the individual values and personal experiences of the persona described above. As a married male from Dakahlia, Egypt, who considers himself part of the upper middle class, his socioeconomic background and cultural context will heavily influence his perspective. In the context of Egypt, where political and social freedoms have been a point of contention, security may be seen as more important to ensure stability and order. Additionally, with the personal experience of completing only middle education level, the persona may prioritize security in order to provide for his family and maintain a certain standard of living. Therefore, based on this perspective, the persona would likely value security over freedom.\n\n2"]}, {"persona": {"region": "Dakahlia", "sex": "female", "age": 63, "country": "Egypt", "marital_status": "married", "education": "higher", "social_class": "lower middle class"}, "question": {"id": "Q150", "variant": 0}, "response": ["Based on my cultural context as a married female from Dakahlia, Egypt, my age, and socioeconomic background, I understand that freedom and security are both important factors in life. However, the cultural context and socioeconomic background in which I live prioritize security over freedom. In Egypt, there are many social and economic challenges that make security a more pressing concern for individuals, especially for someone in the lower middle class. Additionally, my personal experience and values lead me to prioritize security as it provides stability and assurance for my family and me. Therefore, I choose option 2) Security."]}, {"persona": {"region": "Dakahlia", "sex": "male", "age": 28, "country": "Egypt", "marital_status": "single", "education": "higher", "social_class": "upper middle class"}, "question": {"id": "Q150", "variant": 0}, "response": ["Based on the anthropological framework, my perspective is shaped by my cultural context, individual values, and socioeconomic background. As a single male from Dakahlia, Egypt, who has completed higher education and considers myself part of the upper middle class, I prioritize both freedom and security. In my cultural context, there is a strong emphasis on family, community, and stability, which makes security a crucial aspect of my life. At the same time, my education has instilled in me the value of freedom of expression and personal autonomy. Additionally, being part of the upper middle class, I have a certain level of economic security that allows me to prioritize freedom. Therefore, considering my nuanced understanding of the question and the framework of cultural relativism, I choose option (2) Security. \n\n2"]}, {"persona": {"region": "Dakahlia", "sex": "female", "age": 24, "country": "Egypt", "marital_status": "married", "education": "higher", "social_class": "upper middle class"}, "question": {"id": "Q150", "variant": 0}, "response": ["Based on the anthropological framework, as a married female from Dakahlia, Egypt, my cultural context and socioeconomic background significantly influence my perspective. In Egypt, women often face restrictions on their freedom, so the value of security may be more important to me. Additionally, as part of the upper middle class, I may prioritize stability and security in my life. However, my individual values and personal experiences, as well as my higher education level, may also lead me to value freedom and independence. Therefore, my nuanced understanding of this question leads me to prioritize security over freedom.\n\n2"]}, {"persona": {"region": "Dakahlia", "sex": "male", "age": 20, "country": "Egypt", "marital_status": "single", "education": "middle", "social_class": "upper middle class"}, "question": {"id": "Q150", "variant": 0}, "response": ["Based on the anthropological framework, my answer is influenced by the cultural context of Dakahlia, Egypt, where there is a strong emphasis on family and community. My individual values and personal experience as a single male from an upper middle-class background also play a role in my perception. Additionally, my socioeconomic background influences my answer, as I have a level of stability and security that may not be shared by others in different socioeconomic classes. Taking into account the nuance of the question, I believe that security is more important. \n\n2"]}, {"persona": {"region": "Dakahlia", "sex": "male", "age": 45, "country": "Egypt", "marital_status": "married", "education": "middle", "social_class": "upper middle class"}, "question": {"id": "Q150", "variant": 0}, "response": ["Based on the anthropological framework, my cultural context, individual values, and socioeconomic background all play a role in how I perceive and answer this question. As a married male from Dakahlia, Egypt, I come from a culture that values family, community, and stability. My personal experience and values also lead me to prioritize security and stability, as these are important for the well-being of my family and myself. Additionally, my upper middle-class status means that I have worked hard to attain a certain level of comfort and security, and I value maintaining that. Therefore, I choose:\n\n2) Security"]}, {"persona": {"region": "Dakahlia", "sex": "female", "age": 43, "country": "Egypt", "marital_status": "married", "education": "higher", "social_class": "upper middle class"}, "question": {"id": "Q150", "variant": 0}, "response": ["Based on the anthropological framework, my emic perspective as a married female from Dakahlia, Egypt, who is 43 years old, highly educated, and part of the upper middle class, is heavily influenced by my cultural context, individual values, and personal experiences. In Egypt, there is a strong emphasis on family and community, and security is a top priority due to political and social instability. Additionally, my education and socioeconomic background have provided me with certain privileges and opportunities, which may lead me to prioritize security to protect my status and resources. Therefore, considering my cultural context and personal experiences, I would prioritize security over freedom to ensure the safety and stability of my family and myself.\n\n2"]}, {"persona": {"region": "Dakahlia", "sex": "female", "age": 20, "country": "Egypt", "marital_status": "single", "education": "middle", "social_class": "upper middle class"}, "question": {"id": "Q150", "variant": 0}, "response": ["Based on the anthropological framework, as a single female from Dakahlia, Egypt, my cultural context and socioeconomic background heavily influence my perception of the importance of freedom or security. Living in a society with traditional values and gender roles, my personal experience and individual values are shaped by the need for security and stability. Additionally, my age and education level also play a role in shaping my perspective, as I am at a stage in life where establishing security and stability is crucial for my future. Therefore, considering all these factors, I believe that security is more important than freedom.\n\n2"]}, {"persona": {"region": "Dakahlia", "sex": "female", "age": 40, "country": "Egypt", "marital_status": "single", "education": "middle", "social_class": "lower middle class"}, "question": {"id": "Q150", "variant": 0}, "response": ["Based on the anthropological framework, I, as a single female from Dakahlia, Egypt, would consider the answer to the question of whether freedom or security is more important to be heavily influenced by my cultural context, individual values, and socioeconomic background. As a member of the lower middle class, I have likely faced economic struggles and may prioritize security and stability in my life. Additionally, being a single woman in a traditional society, I may value security and protection. However, my personal experience and individual values may also lead me to value freedom and independence. Ultimately, my nuanced answer to this question would lean towards security, as it is closely tied to my socioeconomic background and cultural context.\n\n2"]}, {"persona": {"region": "Dakahlia", "sex": "female", "age": 33, "country": "Egypt", "marital_status": "married", "education": "higher", "social_class": "upper middle class"}, "question": {"id": "Q150", "variant": 0}, "response": ["From an anthropological perspective, my cultural context as a married female from Dakahlia, Egypt, and my socioeconomic background as part of the upper middle class greatly influence my perception of the importance of freedom and security. In my community, there is a strong emphasis on the value of security due to the political and social instability in the region. Additionally, my personal experience and individual values have led me to prioritize security for the well-being of my family and myself. This is further influenced by my age and education level, which have provided me with a nuanced understanding of the importance of stability and security in both the present and future. Therefore, in consideration of these factors, I choose option (2) Security."]}, {"persona": {"region": "Dakahlia", "sex": "female", "age": 24, "country": "Egypt", "marital_status": "married", "education": "middle", "social_class": "working class"}, "question": {"id": "Q150", "variant": 0}, "response": ["Based on the anthropological framework, as a married female from Dakahlia, Egypt, my emic perspective is heavily influenced by my cultural context and socioeconomic background. In my community, there is a strong emphasis on family and community security, and this is reflected in my personal values and experiences. As part of the working class, I have witnessed the struggles of my family and friends to provide for themselves and ensure their safety. Additionally, cultural relativism plays a role in my understanding that the concept of freedom may differ from Western ideals. Therefore, considering my personal and cultural context, I believe that security is more important than freedom.\n\n2"]}, {"persona": {"region": "Dakahlia", "sex": "female", "age": 53, "country": "Egypt", "marital_status": "widowed", "education": "middle", "social_class": "working class"}, "question": {"id": "Q150", "variant": 0}, "response": ["From the emic perspective, as a widowed female from Dakahlia, Egypt, my cultural context and personal experience play a crucial role in my understanding of this question. In my cultural context, the importance of security, especially for women in my community, cannot be overstated. My individual values and personal experience also lead me to prioritize security, as I have experienced firsthand the challenges and dangers faced by women in my position. Additionally, my socioeconomic background as a member of the working class further emphasizes the importance of security for me and my family. Therefore, based on my nuanced understanding of the question and the factors that shape my perspective, I choose option (2) Security. \n\n2"]}, {"persona": {"region": "Dakahlia", "sex": "female", "age": 30, "country": "Egypt", "marital_status": "single", "education": "middle", "social_class": "lower middle class"}, "question": {"id": "Q150", "variant": 0}, "response": ["Based on the anthropological framework, my perspective is influenced by my individual values and personal experience, as well as my socioeconomic background and cultural context. As a single female from Dakahlia, Egypt, I have experienced the challenges of navigating life in a conservative society and have a lower middle class socioeconomic background, which often means limited access to resources and opportunities. Additionally, my cultural context emphasizes the importance of security and stability, especially for women. Therefore, considering these factors, I choose:\n\n2) Security"]}, {"persona": {"region": "Dakahlia", "sex": "male", "age": 53, "country": "Egypt", "marital_status": "married", "education": "higher", "social_class": "upper middle class"}, "question": {"id": "Q150", "variant": 0}, "response": ["Based on the anthropological framework, as a married male from Dakahlia, Egypt, my emic perspective would emphasize the importance of security. In our cultural context, the stability and safety of our family and community are highly valued. Additionally, my individual values and personal experience, as well as my socioeconomic background as part of the upper middle class, have shaped my understanding of the importance of security in providing for my family and ensuring their well-being. Cultural relativism also plays a role in my perspective, as the societal norms and expectations in Egypt prioritize security as a means of maintaining order and stability. Therefore, taking into account space and time, as well as the nuanced phrasing of the question, I would choose:\n\n2) Security"]}, {"persona": {"region": "Dakahlia", "sex": "male", "age": 28, "country": "Egypt", "marital_status": "married", "education": "middle", "social_class": "working class"}, "question": {"id": "Q150", "variant": 0}, "response": ["Based on the anthropological framework, my perspective as a married male from Dakahlia, Egypt, who is 28 years old, has completed a middle education level, and considers himself part of the working class, is heavily influenced by my cultural context, individual values, and socioeconomic background. In my community, the need for security is paramount due to the economic challenges we face and the importance of providing for my family. Additionally, the cultural context of Egypt places a strong emphasis on stability and security. Therefore, given my personal experiences and values, I prioritize security over freedom. \n\n2"]}, {"persona": {"region": "Dakahlia", "sex": "female", "age": 38, "country": "Egypt", "marital_status": "married", "education": "middle", "social_class": "upper middle class"}, "question": {"id": "Q150", "variant": 0}, "response": ["Based on the anthropological framework, I understand the importance of considering my cultural context, individual values, and socioeconomic background in answering this question. As a married female from Dakahlia, Egypt, who considers herself part of the upper middle class, I am influenced by the cultural values and expectations of my community. Additionally, my personal experiences and values play a significant role in shaping my perspective. Considering the socioeconomic background, I prioritize security because it provides stability and peace of mind for my family and me, which is especially important in our community. Therefore, I choose option 2 - Security."]}, {"persona": {"region": "Gharbia", "sex": "male", "age": 27, "country": "Egypt", "marital_status": "single", "education": "higher", "social_class": "upper middle class"}, "question": {"id": "Q150", "variant": 0}, "response": ["Based on the anthropological framework, as a single male from Gharbia, Egypt, my emic perspective is heavily influenced by the cultural context, individual values, and socioeconomic background. In Egypt, there is a strong emphasis on family and community, and personal values often prioritize security and stability. Additionally, my upper middle-class background would lead me to prioritize security and stability as I have likely experienced a relatively secure and comfortable life. Furthermore, cultural relativism suggests that different cultures and individuals may prioritize different values, and in my case, security is a more important value. Therefore, I choose option (2) Security."]}, {"persona": {"region": "Gharbia", "sex": "female", "age": 35, "country": "Egypt", "marital_status": "married", "education": "higher", "social_class": "upper middle class"}, "question": {"id": "Q150", "variant": 0}, "response": ["As a married female from Gharbia, Egypt, my perspective is influenced by my cultural context, individual values, and socioeconomic background. In Egyptian society, there is a strong emphasis on family and community, which has instilled in me the value of security. Given my upper middle class status and higher education level, I have been fortunate enough to experience a certain level of security in my life, which I prioritize. Additionally, as a woman in this society, security is a crucial factor for my well-being and that of my family. Therefore, I believe that security is more important than freedom in my personal and cultural context.\n\n2"]}, {"persona": {"region": "Gharbia", "sex": "female", "age": 37, "country": "Egypt", "marital_status": "married", "education": "higher", "social_class": "upper middle class"}, "question": {"id": "Q150", "variant": 0}, "response": ["Based on my personal experience and socioeconomic background as a married woman from Gharbia, Egypt, I have always valued security over freedom. In our cultural context, stability and security are highly prioritized, especially for those of us from the upper middle class. The safety and well-being of my family and myself are paramount, and I believe that without security, freedom becomes meaningless. Additionally, the cultural relativism in our society emphasizes the importance of maintaining stability and order, which further reinforces my belief in the significance of security.\n\n2"]}, {"persona": {"region": "Gharbia", "sex": "male", "age": 43, "country": "Egypt", "marital_status": "married", "education": "middle", "social_class": "lower middle class"}, "question": {"id": "Q150", "variant": 0}, "response": ["Based on the anthropological framework, as a married male from Gharbia, Egypt, my perspective is heavily influenced by my cultural context, individual values, and socioeconomic background. In my community, security is a top priority due to the political and social instability in the region. Additionally, as a member of the lower middle class, my socioeconomic background means that I value security in terms of financial stability and safety for my family. Furthermore, the cultural relativism within my community emphasizes the need for security over freedom, as it is seen as a way to protect our families and ensure our well-being. Therefore, considering all these factors, I would choose option (2) Security. \n\n2"]}, {"persona": {"region": "Gharbia", "sex": "male", "age": 28, "country": "Egypt", "marital_status": "single", "education": "higher", "social_class": "lower middle class"}, "question": {"id": "Q150", "variant": 0}, "response": ["Based on my personal experience and cultural context, as a single male from Gharbia, Egypt, I understand the importance of both freedom and security. In my community, safety and stability are crucial for individuals and families, especially in the lower middle class. However, I also value personal freedom and the ability to make my own choices. Taking into account the socioeconomic background and cultural relativism, I believe that a balance between freedom and security is essential for a fulfilling life. Therefore, I choose:\n\n2) Security"]}, {"persona": {"region": "Gharbia", "sex": "male", "age": 39, "country": "Egypt", "marital_status": "married", "education": "middle", "social_class": "lower middle class"}, "question": {"id": "Q150", "variant": 0}, "response": ["Based on my cultural context and socioeconomic background, as a married male from Gharbia, Egypt, I am aware that my personal experiences and values are shaped by the societal norms and expectations of my community. In this context, security is of utmost importance, as it provides stability and protection for my family and me. Additionally, the cultural relativism of my community emphasizes the importance of collective wellbeing and harmony, which is often achieved through security measures. Therefore, my choice is based on the nuanced phrasing of the question and the understanding of the cultural values and priorities of my community.\n\n2"]}, {"persona": {"region": "Gharbia", "sex": "male", "age": 30, "country": "Egypt", "marital_status": "married", "education": "middle", "social_class": "lower middle class"}, "question": {"id": "Q150", "variant": 0}, "response": ["From an anthropological perspective, I must consider my cultural context, socioeconomic background, individual values, and personal experience. Growing up in Gharbia, Egypt, in a lower middle-class family, I have always valued security over freedom. In our community, stability and safety are crucial for survival and prosperity. I have seen the impact of instability and insecurity on my family and neighbors, which has shaped my belief that security should be the priority. Additionally, my middle education level has provided me with a practical understanding of the importance of security in providing for my family and building a stable future. Therefore, based on my personal experience and cultural context, I choose option (2) Security."]}, {"persona": {"region": "Gharbia", "sex": "male", "age": 43, "country": "Egypt", "marital_status": "married", "education": "lower", "social_class": "lower middle class"}, "question": {"id": "Q150", "variant": 0}, "response": ["Based on the anthropological framework described above, my perspective as a married male from Gharbia, Egypt at the age of 43 with a lower education level and part of the lower middle class is heavily influenced by my cultural context, individual values, and socioeconomic background. In Gharbia, the cultural context emphasizes the importance of security and stability, especially for a family. Additionally, my lower education level and lower middle class status mean that I may have experienced economic challenges and value security as a means of providing for my family. Therefore, considering these factors, I choose:\n\n2) Security"]}, {"persona": {"region": "Gharbia", "sex": "male", "age": 36, "country": "Egypt", "marital_status": "married", "education": "higher", "social_class": "lower middle class"}, "question": {"id": "Q150", "variant": 0}, "response": ["Based on the anthropological framework, my answer is informed by my cultural context, individual values, and socioeconomic background. As a married male from Gharbia, Egypt, my understanding is shaped by the cultural values and norms of my community. The emphasis on security is crucial for maintaining stability and protecting my family in a region that has faced political and economic challenges. Additionally, as someone from the lower middle class, the need for security is paramount in ensuring a stable and predictable future for my family. Therefore, I choose option 2: Security."]}, {"persona": {"region": "Gharbia", "sex": "male", "age": 25, "country": "Egypt", "marital_status": "married", "education": "middle", "social_class": "upper middle class"}, "question": {"id": "Q150", "variant": 0}, "response": ["From the perspective of a married male from Gharbia, Egypt, who is 25 years old, has completed middle education level, and considers himself part of the upper middle class, several factors come into play in answering this question. The cultural context of Gharbia, Egypt, is one where security is highly valued due to political instability and economic challenges. Additionally, individual values and personal experience also play a significant role, as this individual may have experienced firsthand the importance of security in ensuring stability for his family and community. Socioeconomic background also factors in, as someone from the upper middle class may prioritize security in order to maintain their social and economic status. Furthermore, the nuance of the question may also be considered, as the phrasing of the question could influence the answer. Considering these factors, the answer from this perspective would be:\n\n2) Security"]}, {"persona": {"region": "Gharbia", "sex": "male", "age": 31, "country": "Egypt", "marital_status": "married", "education": "middle", "social_class": "upper middle class"}, "question": {"id": "Q150", "variant": 0}, "response": ["Based on the anthropological framework, as a married male from Gharbia, Egypt, my perspective is heavily influenced by my cultural context, individual values, and socioeconomic background. In Gharbia, the cultural context emphasizes the importance of family and community, and as a married man, my individual values prioritize security and stability for my family. Additionally, being part of the upper middle class, I have a certain level of security and stability that allows me to prioritize freedom as well. However, considering the current socio-political climate in Egypt, security is a more pressing concern for me and my family. Therefore, I prioritize security over freedom.\n2"]}, {"persona": {"region": "Gharbia", "sex": "male", "age": 33, "country": "Egypt", "marital_status": "married", "education": "higher", "social_class": "lower middle class"}, "question": {"id": "Q150", "variant": 0}, "response": ["Based on the anthropological framework, I would consider the cultural context, individual values, and socioeconomic background of the persona described. Coming from Gharbia, Egypt, where there is a complex cultural and socioeconomic context, and being part of the lower middle class, the persona might prioritize security over freedom due to the economic challenges and uncertainties they may face. Additionally, personal experiences and individual values would also play a role in shaping their perspective, as they might value stability and security for themselves and their family. Given these factors, I would choose option (2) Security."]}, {"persona": {"region": "Gharbia", "sex": "male", "age": 26, "country": "Egypt", "marital_status": "single", "education": "higher", "social_class": "upper middle class"}, "question": {"id": "Q150", "variant": 0}, "response": ["Based on the anthropological framework, my response is influenced by my individual values and personal experience, as well as my socioeconomic background. As a single male from Gharbia, Egypt, who has completed higher education and considers myself part of the upper middle class, I value both freedom and security. However, given the cultural context and current socioeconomic conditions in Egypt, security is more important to me. In a country with political instability and economic challenges, security provides the stability necessary for personal and professional growth. Therefore, I choose option 2: Security. \n\n2"]}, {"persona": {"region": "Gharbia", "sex": "female", "age": 45, "country": "Egypt", "marital_status": "married", "education": "middle", "social_class": "lower middle class"}, "question": {"id": "Q150", "variant": 0}, "response": ["Based on my emic perspective as a married female from Gharbia, Egypt, my cultural context values security above all else. Living in a region with political instability and economic challenges, the safety and stability of my family and community are crucial. My personal experience and socioeconomic background as a lower middle-class individual also prioritize security, as the lack of financial stability makes freedom seem more abstract. Additionally, in the cultural context of Egypt, there is a strong emphasis on the collective and communal well-being, which further reinforces the importance of security over individual freedom. Therefore, I would choose option (2) Security."]}, {"persona": {"region": "Gharbia", "sex": "female", "age": 55, "country": "Egypt", "marital_status": "married", "education": "middle", "social_class": "upper middle class"}, "question": {"id": "Q150", "variant": 0}, "response": ["Based on my personal experience and socioeconomic background, I value security more than freedom. Growing up in Gharbia, Egypt, I have seen the importance of having a sense of security in my community and within my family. As a member of the upper middle class, I have worked hard to provide a stable and secure environment for my family, and I believe that security is essential for our well-being. Additionally, the cultural context in Egypt emphasizes the importance of stability and security, especially in the face of political and social challenges. Therefore, I believe that security is more important than freedom in my life. \n\n2"]}, {"persona": {"region": "Gharbia", "sex": "female", "age": 27, "country": "Egypt", "marital_status": "married", "education": "higher", "social_class": "upper middle class"}, "question": {"id": "Q150", "variant": 0}, "response": ["Based on the anthropological framework, as a married female from Gharbia, Egypt who is 27 years old, has completed higher education, and considers herself part of the upper middle class, my perspective is heavily influenced by my cultural context, individual values, and personal experience. In Gharbia, there is a strong emphasis on family and community, and security is often prioritized to ensure the well-being of loved ones. Additionally, my education and socioeconomic background have provided me with a sense of stability and security, making it more important to me personally. Therefore, I choose option (2) Security."]}, {"persona": {"region": "Gharbia", "sex": "female", "age": 42, "country": "Egypt", "marital_status": "married", "education": "higher", "social_class": "upper middle class"}, "question": {"id": "Q150", "variant": 0}, "response": ["Based on the anthropological framework, my perspective as a married female from Gharbia, Egypt, who is 42 years old, has completed higher education, and considers herself part of the upper middle class, is influenced by various factors. The emic perspective within my cultural context places a high value on security, as it is essential for maintaining stability and protecting the family. Additionally, my individual values and personal experiences have shaped my belief that security is paramount for the well-being of my family and myself. Furthermore, considering my socioeconomic background, I have worked hard to achieve a comfortable lifestyle, and security is necessary to maintain this status. Therefore, I choose option (2) Security. \n\n2"]}, {"persona": {"region": "Gharbia", "sex": "female", "age": 32, "country": "Egypt", "marital_status": "married", "education": "middle", "social_class": "upper middle class"}, "question": {"id": "Q150", "variant": 0}, "response": ["Based on the anthropological framework, my response is heavily influenced by my cultural context, individual values, and socioeconomic background. As a married female from Gharbia, Egypt, my cultural context places a strong emphasis on family and community, and security is often prioritized for the well-being of the family. Additionally, my upper middle-class background has provided me with a certain level of security and stability, allowing me to prioritize other values such as freedom. However, considering the current political and social climate in Egypt, where security concerns often take precedence, I am inclined to prioritize security over freedom for the overall well-being of my family and community.\n\n2"]}, {"persona": {"region": "Gharbia", "sex": "male", "age": 27, "country": "Egypt", "marital_status": "married", "education": "higher", "social_class": "upper middle class"}, "question": {"id": "Q150", "variant": 0}, "response": ["Based on the anthropological framework, my perspective is shaped by my cultural context in Gharbia, Egypt, where personal and family security is a top priority due to socio-economic factors and living in a region with historical instability. Additionally, my individual values and personal experiences have taught me the importance of security for myself and my family. However, my higher education level has also exposed me to the concept of freedom as a fundamental human right and the importance of individual autonomy. Taking into consideration the emic and etic perspectives, cultural relativism, and my own nuanced understanding, I choose:\n2"]}, {"persona": {"region": "Gharbia", "sex": "female", "age": 27, "country": "Egypt", "marital_status": "married", "education": "higher", "social_class": "lower middle class"}, "question": {"id": "Q150", "variant": 0}, "response": ["In considering the question of whether freedom or security is more important, it is crucial to take into account the emic perspective of someone from Gharbia, Egypt, who comes from a lower middle class background and has completed higher education. The cultural context of Gharbia, Egypt, emphasizes the importance of security due to socio-political instability and economic challenges. Additionally, individual values and personal experience play a significant role in shaping the perspective, as the individual may prioritize security in order to ensure stability and provide for their family. Furthermore, the socio-economic background of being part of the lower middle class may lead to valuing security as a means of safeguarding against financial hardships. Therefore, considering the nuanced phrasing of the question, the persona from Gharbia, Egypt would prioritize:\n\n2) Security"]}, {"persona": {"region": "Gharbia", "sex": "female", "age": 37, "country": "Egypt", "marital_status": "married", "education": "middle", "social_class": "upper middle class"}, "question": {"id": "Q150", "variant": 0}, "response": ["Based on the anthropological framework, the cultural context of being a married female from Gharbia, Egypt, and being part of the upper middle class, as well as the individual values and personal experiences, would heavily influence my answer to this question. In Egypt, security is a major concern due to political instability and economic challenges, and as a married woman, my priority would be the safety and well-being of my family. Additionally, the cultural context and societal norms in Egypt place a high value on security and stability. Therefore, I would prioritize security over freedom.\n\n2"]}, {"persona": {"region": "Gharbia", "sex": "male", "age": 28, "country": "Egypt", "marital_status": "married", "education": "higher", "social_class": "working class"}, "question": {"id": "Q150", "variant": 0}, "response": ["From the perspective of a married male from Gharbia, Egypt, who is 28 years old, completed higher education, and considers himself part of the working class, the emic perspective is deeply ingrained in the cultural context of Egypt. The societal and cultural values in Egypt prioritize security and stability, especially for those who are married and responsible for a family. Personal experience and socioeconomic background also play a significant role in shaping this perspective, as individuals from the working class often prioritize security and stability in order to provide for their families. Additionally, the cultural relativism of Egypt emphasizes the importance of collective well-being over individual freedom. Therefore, from this perspective, the chosen option is:\n\n2) Security"]}, {"persona": {"region": "Gharbia", "sex": "female", "age": 50, "country": "Egypt", "marital_status": "married", "education": "middle", "social_class": "upper middle class"}, "question": {"id": "Q150", "variant": 0}, "response": ["Based on my cultural context as a married female from Gharbia, Egypt, and my socioeconomic background as part of the upper middle class, my understanding of the importance of freedom or security is heavily influenced by my personal experience and values. In Egypt, where there are social and political challenges, security is a priority for many individuals and families, including mine. However, as someone who has also experienced the value of freedom and independence, especially as a woman, I recognize the importance of both aspects. In this nuanced question, I would prioritize security as it is essential for the stability and well-being of my family and community, while also acknowledging the significance of freedom in shaping my individual agency and opportunities.\n\n2"]}, {"persona": {"region": "Gharbia", "sex": "male", "age": 39, "country": "Egypt", "marital_status": "single", "education": "higher", "social_class": "working class"}, "question": {"id": "Q150", "variant": 0}, "response": ["As a single male from Gharbia, Egypt, my perspective is heavily influenced by my cultural context, socioeconomic background, and personal experience. In Egypt, there is a strong emphasis on security due to the political and social instability in the region. Additionally, as a working-class individual, I prioritize the need for security to ensure the well-being of myself and my family. However, having completed higher education, I also value the importance of freedom and autonomy in shaping my own future. Therefore, I believe that while security is crucial for stability, freedom is ultimately more important in achieving personal growth and fulfillment. \n\n2"]}, {"persona": {"region": "Gharbia", "sex": "female", "age": 45, "country": "Egypt", "marital_status": "married", "education": "higher", "social_class": "upper middle class"}, "question": {"id": "Q150", "variant": 0}, "response": ["Based on the anthropological framework, my understanding and answer to this question are influenced by my cultural context, individual values, and socioeconomic background. As a married female from Gharbia, Egypt, my cultural context places a strong emphasis on family and community ties, and the value of security is paramount in ensuring the well-being and stability of my family. Additionally, my higher education and upper middle class status have provided me with a level of security and comfort that I highly value. Therefore, considering these factors, I choose option (2) Security."]}, {"persona": {"region": "Sharkia", "sex": "male", "age": 35, "country": "Egypt", "marital_status": "married", "education": "higher", "social_class": "upper middle class"}, "question": {"id": "Q150", "variant": 0}, "response": ["Based on my cultural context in Sharkia, Egypt, freedom and security are both highly valued. In this region, there is a strong emphasis on community and family, and security is often prioritized to ensure the safety and stability of the family unit. However, my individual values and personal experience as part of the upper middle class have led me to prioritize freedom. With a higher level of education and access to resources, I have been able to experience a greater degree of personal freedom and autonomy. Additionally, my socioeconomic background has allowed me to prioritize freedom as a means of personal and professional advancement. Therefore, I believe that freedom is more important in my perspective.\n\n2"]}, {"persona": {"region": "Sharkia", "sex": "female", "age": 55, "country": "Egypt", "marital_status": "married", "education": "middle", "social_class": "lower middle class"}, "question": {"id": "Q150", "variant": 0}, "response": ["Based on the anthropological framework, I must consider the emic and etic perspectives of my cultural context in Sharkia, Egypt. As a 55-year-old married woman from a lower middle-class background, my individual values and personal experience, as well as my socioeconomic background, greatly influence my perception of what is more important - freedom or security. In Sharkia, Egypt, where social and economic conditions can be challenging, security is often prioritized to ensure the well-being and stability of my family. Additionally, cultural relativism teaches us to respect and understand different perspectives, and in our society, security is often valued as a means of protecting our families and communities. Therefore, considering my cultural context and personal experience, I would choose:\n\n2) Security"]}, {"persona": {"region": "Sharkia", "sex": "female", "age": 27, "country": "Egypt", "marital_status": "married", "education": "middle", "social_class": "lower middle class"}, "question": {"id": "Q150", "variant": 0}, "response": ["Based on the anthropological framework, as a married female from Sharkia, Egypt, my cultural context and socioeconomic background play a significant role in shaping my perspective. In Egypt, there is a strong emphasis on family and community, and security is often prioritized to ensure the well-being of the family. Additionally, as someone from the lower middle class, I may have experienced economic instability, which could lead me to prioritize security. Furthermore, my age and education level may have influenced my understanding of the importance of stability and security in my life. Therefore, considering all these factors, I would prioritize security.\n\n2"]}, {"persona": {"region": "Sharkia", "sex": "female", "age": 52, "country": "Egypt", "marital_status": "married", "education": "middle", "social_class": "lower middle class"}, "question": {"id": "Q150", "variant": 0}, "response": ["Based on the anthropological framework, my cultural context as a married female from Sharkia, Egypt, my age, education level, and socioeconomic background all have a significant impact on my perspective. The cultural context and individual values play a big role in shaping my understanding of the question. Additionally, the socioeconomic background and cultural relativism also factor in my answer. Furthermore, space and time, as well as nuanced phrasing of the question, also play a role in my response. \n\n2"]}, {"persona": {"region": "Sharkia", "sex": "male", "age": 36, "country": "Egypt", "marital_status": "married", "education": "middle", "social_class": "lower middle class"}, "question": {"id": "Q150", "variant": 0}, "response": ["Based on the anthropological framework, as a married male from Sharkia, Egypt, my cultural context heavily influences my perspective. In this region, the value of security is paramount, due to the political and economic instability that has been prevalent. Additionally, my lower middle class socioeconomic background also plays a role in this perspective, as my primary concern is to provide for my family and ensure their safety. Furthermore, my personal experience living in this context and the nuanced phrasing of the question leads me to prioritize security over freedom. Therefore, I choose option (2) Security."]}, {"persona": {"region": "Sharkia", "sex": "female", "age": 20, "country": "Egypt", "marital_status": "single", "education": "middle", "social_class": "working class"}, "question": {"id": "Q150", "variant": 0}, "response": ["From the perspective of a single female from Sharkia, Egypt, who is 20 years old, completed middle education level, and considers herself part of the working class, the answer to the question of whether freedom or security is more important would be influenced by various factors. The cultural context of living in Egypt, where there may be certain societal expectations and restrictions on women, would likely make security a priority. Additionally, the socioeconomic background of being part of the working class may lead to a greater emphasis on the need for security and stability in order to maintain a livelihood. Personal experiences and individual values may also play a role, as the persona may have faced challenges or threats that have made security a top priority. Finally, the nuance of the question may lead to a specific emphasis on security in the context of this persona's life.\n\n2"]}, {"persona": {"region": "Sharkia", "sex": "male", "age": 60, "country": "Egypt", "marital_status": "married", "education": "middle", "social_class": "working class"}, "question": {"id": "Q150", "variant": 0}, "response": ["Based on the anthropological framework, as a married male from Sharkia, Egypt, my cultural context and socioeconomic background greatly influence my perspective. In my community, family and community security are highly valued due to the political and economic instability in the region. Additionally, my age and working-class status also contribute to my prioritization of security over freedom. This is further reinforced by the cultural value of collectivism and the importance of stability for the well-being of my family. Therefore, I choose:\n2. Security"]}, {"persona": {"region": "Sharkia", "sex": "male", "age": 41, "country": "Egypt", "marital_status": "married", "education": "higher", "social_class": "upper middle class"}, "question": {"id": "Q150", "variant": 0}, "response": ["Based on the anthropological framework outlined, my response is influenced by my individual values and personal experiences, as well as my socioeconomic background. As a married male from Sharkia, Egypt, who is 41 years old, completed higher education, and considers myself part of the upper middle class, my perspective is shaped by the cultural context of my upbringing and the socioeconomic status I have achieved. Additionally, my understanding of cultural relativism informs my view that neither freedom nor security is objectively \"better\" than the other, but rather both are important in different ways. In this context, I prioritize security over freedom, as it provides the stability and foundation for a prosperous and fulfilling life.\n\n2"]}, {"persona": {"region": "Sharkia", "sex": "female", "age": 23, "country": "Egypt", "marital_status": "married", "education": "middle", "social_class": "lower middle class"}, "question": {"id": "Q150", "variant": 0}, "response": ["Based on the anthropological framework, as a married female from Sharkia, Egypt, my cultural context and socioeconomic background play a significant role in shaping my perspective. In my community, personal experience, individual values, and cultural relativism are crucial in shaping my understanding of the world. As a lower middle-class woman, I value security more than freedom. This is because my socioeconomic background and cultural context have taught me that security is essential for the well-being and stability of my family and community. Additionally, the nuanced phrasing of the question also influences my decision, as it prompts me to prioritize the safety and protection of my loved ones. \n\n2"]}, {"persona": {"region": "Sharkia", "sex": "male", "age": 49, "country": "Egypt", "marital_status": "married", "education": "higher", "social_class": "upper middle class"}, "question": {"id": "Q150", "variant": 0}, "response": ["Based on the framework of anthropological methods, as a married male from Sharkia, Egypt, who is 49 years old, completed higher education, and considers himself part of the upper middle class, my perspective on the question of freedom versus security is heavily influenced by my cultural context, individual values, and socioeconomic background. In Egypt, there is a strong emphasis on the importance of security due to political instability and economic challenges. Additionally, being part of the upper middle class, I place a high value on maintaining the security and stability of my family and community. However, my higher education has also exposed me to the value of freedom and individual rights. Therefore, I believe that achieving a balance between freedom and security is important, but ultimately, I prioritize security as it directly impacts the well-being of my family and community.\n\n2"]}, {"persona": {"region": "Sharkia", "sex": "female", "age": 30, "country": "Egypt", "marital_status": "married", "education": "middle", "social_class": "upper middle class"}, "question": {"id": "Q150", "variant": 0}, "response": ["Based on the anthropological framework, my personal background and experiences in Sharkia, Egypt have shaped my understanding and answer to this question. As a married female from an upper middle class background, my cultural context values security and stability, especially in the context of family and community. The socioeconomic background also plays a role in this perspective, as the middle class often emphasizes the importance of security for their families. Additionally, living in Egypt, where there are ongoing social and political challenges, further reinforces the value of security. Therefore, considering all these factors, I choose option (2) Security. \n\n2"]}, {"persona": {"region": "Sharkia", "sex": "male", "age": 39, "country": "Egypt", "marital_status": "married", "education": "higher", "social_class": "upper middle class"}, "question": {"id": "Q150", "variant": 0}, "response": ["Based on the anthropological framework, as a married male from Sharkia, Egypt, my emic perspective is heavily influenced by my cultural context, individual values, and socioeconomic background. In my cultural context, security is highly valued due to the political instability and economic challenges facing my community. As a member of the upper middle class, I have the privilege of prioritizing security and stability for myself and my family. Additionally, my personal experience and values lead me to prioritize security over freedom as a means of ensuring the well-being and prosperity of my loved ones. Therefore, considering all these factors, my answer is:\n\n2"]}, {"persona": {"region": "Sharkia", "sex": "female", "age": 26, "country": "Egypt", "marital_status": "married", "education": "middle", "social_class": "lower middle class"}, "question": {"id": "Q150", "variant": 0}, "response": ["From the perspective of a married female from Sharkia, Egypt, who is 26 years old and considers herself part of the lower middle class, the answer to the question of whether freedom or security is more important is heavily influenced by cultural context and socioeconomic background. In a region where there may be social and political instability, the prioritization of security may be more prevalent due to the need for stability and safety. Additionally, as a member of the lower middle class, the focus may be on meeting basic needs and ensuring a stable income, which would also lean towards valuing security. However, personal experience and individual values may also play a role, as the desire for personal autonomy and freedom may be important in the pursuit of personal and professional growth. Therefore, the nuanced phrasing of the question and the consideration of cultural relativism are crucial in understanding the perspective of this persona.\n\n2"]}, {"persona": {"region": "Sharkia", "sex": "female", "age": 48, "country": "Egypt", "marital_status": "married", "education": "middle", "social_class": "lower middle class"}, "question": {"id": "Q150", "variant": 0}, "response": ["Based on my personal experience and cultural context as a married female from Sharkia, Egypt, I have grown up valuing security over freedom. In our community, stability and safety are prioritized, and as a member of the lower middle class, I have always been taught to prioritize my family's well-being and financial security. Additionally, the socioeconomic background and cultural relativism in our society have shaped my belief that security is crucial for a peaceful and stable life. Therefore, I would choose option (2) Security."]}, {"persona": {"region": "Sharkia", "sex": "male", "age": 34, "country": "Egypt", "marital_status": "married", "education": "higher", "social_class": "upper middle class"}, "question": {"id": "Q150", "variant": 0}, "response": ["Based on the anthropological framework, as a married male from Sharkia, Egypt, my cultural context and socioeconomic background have a significant impact on my perspective. In Egypt, the value of security is deeply ingrained due to the political and social instability in the region. Additionally, my upper middle class status and higher education level may lead me to prioritize stability and security for my family and myself. Therefore, I choose option 2) Security."]}, {"persona": {"region": "Sharkia", "sex": "female", "age": 39, "country": "Egypt", "marital_status": "divorced", "education": "middle", "social_class": "lower middle class"}, "question": {"id": "Q150", "variant": 0}, "response": ["From the perspective of a divorced female from Sharkia, Egypt, who is 39 years old, completed middle education level, and considers herself part of the lower middle class, several factors must be considered in answering the question of whether freedom or security is more important. The cultural context of living in a conservative society like Egypt, where women may face social and legal restrictions, may prioritize security over freedom. Socioeconomic background also plays a role, as someone from the lower middle class may prioritize security due to financial and social stability concerns. Additionally, personal experience as a divorced woman may lead to valuing security over freedom, as the experience of divorce may have created a need for stability and protection. Considering these factors, the persona described above would prioritize:\n\n2) Security"]}, {"persona": {"region": "Sharkia", "sex": "male", "age": 39, "country": "Egypt", "marital_status": "married", "education": "middle", "social_class": "upper middle class"}, "question": {"id": "Q150", "variant": 0}, "response": ["Based on the anthropological framework, my answer is influenced by my cultural context, individual values, and socioeconomic background. As a married male from Sharkia, Egypt, I am part of the upper middle class and have completed middle education level. In my cultural context, security is extremely important due to the political and economic instability in Egypt. Additionally, my personal experience and socioeconomic background have shaped my perception that security is essential for the well-being of my family and myself. Therefore, I choose option 2: Security."]}, {"persona": {"region": "Qaliubiya", "sex": "male", "age": 62, "country": "Egypt", "marital_status": "married", "education": "middle", "social_class": "working class"}, "question": {"id": "Q150", "variant": 0}, "response": ["Based on the anthropological framework, my perspective is shaped by my cultural context, socioeconomic background, individual values, and personal experience. As a married male from Qaliubiya, Egypt, my cultural context values security and stability, as it is essential for the well-being of my family and community. Growing up in a working-class environment, I have learned to prioritize security and stability in life, as it directly impacts my ability to provide for my family and maintain a sense of order in our lives. Additionally, at 62 years of age, I value the security of a stable life and future over the potential risks associated with freedom. Therefore, my answer to the question would be:\n\n2) Security"]}, {"persona": {"region": "Qaliubiya", "sex": "male", "age": 33, "country": "Egypt", "marital_status": "married", "education": "middle", "social_class": "working class"}, "question": {"id": "Q150", "variant": 0}, "response": ["Based on the anthropological framework, my perspective as a married male from Qaliubiya, Egypt, is heavily influenced by my cultural context, individual values, and socioeconomic background. In Egypt, there is a strong emphasis on family and community, and security is a major concern due to the political and economic instability in the region. As a working-class individual, I prioritize the safety and well-being of my family and myself. Additionally, my personal experience living in a region with ongoing social and political challenges has shaped my belief that security is more important than freedom. Therefore, I choose:\n2"]}, {"persona": {"region": "Qaliubiya", "sex": "male", "age": 62, "country": "Egypt", "marital_status": "married", "education": "higher", "social_class": "lower middle class"}, "question": {"id": "Q150", "variant": 0}, "response": ["Based on the anthropological framework, as a married male from Qaliubiya, Egypt, my emic perspective would be heavily influenced by the cultural context of my upbringing and the societal values of my community. My personal experience and individual values, shaped by my age, education, and socioeconomic background, also play a significant role in my perception. Additionally, the nuanced phrasing of the question and the cultural relativism of my perspective are crucial in understanding my answer. Therefore, from my perspective, the most important value is security. \n\n2"]}, {"persona": {"region": "Qaliubiya", "sex": "male", "age": 29, "country": "Egypt", "marital_status": "married", "education": "middle", "social_class": "working class"}, "question": {"id": "Q150", "variant": 0}, "response": ["Based on the anthropological framework, as a married male from Qaliubiya, Egypt, my emic perspective on this question would be heavily influenced by the cultural context in which I live. In Egypt, there is a strong emphasis on family and community, and security is often prioritized to ensure the well-being of our loved ones. My individual values and personal experience also play a role, as I have experienced economic hardships and understand the importance of financial security. Additionally, my socioeconomic background as a working-class individual has shaped my perspective, as I prioritize stability and security for my family's future. Therefore, I believe that security is more important than freedom in my current situation.\n\n2"]}, {"persona": {"region": "Qaliubiya", "sex": "female", "age": 42, "country": "Egypt", "marital_status": "married", "education": "higher", "social_class": "working class"}, "question": {"id": "Q150", "variant": 0}, "response": ["Based on the anthropological framework, my answer is influenced by my cultural context as a married female from Qaliubiya, Egypt, where traditional gender roles and societal expectations may prioritize security over freedom. Additionally, my socioeconomic background as part of the working class may also lead me to value security over freedom, as financial stability and safety are crucial in my daily life. My personal experience and individual values further reinforce the importance of security, as I have seen the impact of instability and insecurity in my community. Therefore, I choose option 2: Security."]}, {"persona": {"region": "Qaliubiya", "sex": "female", "age": 50, "country": "Egypt", "marital_status": "married", "education": "middle", "social_class": "lower middle class"}, "question": {"id": "Q150", "variant": 0}, "response": ["Based on the anthropological framework, my perspective as a married female from Qaliubiya, Egypt, at the age of 50, with a middle education level and belonging to the lower middle class is heavily influenced by my cultural context, individual values, and socioeconomic background. In my community, security is highly valued due to the political and social instability we have experienced. Additionally, my socioeconomic status means that I may have limited access to resources and opportunities, making security a priority for me and my family. Therefore, I believe that security is more important than freedom.\n\n2"]}, {"persona": {"region": "Qaliubiya", "sex": "male", "age": 29, "country": "Egypt", "marital_status": "married", "education": "higher", "social_class": "lower middle class"}, "question": {"id": "Q150", "variant": 0}, "response": ["Based on the anthropological framework, my perspective is influenced by my cultural context in Qaliubiya, Egypt, where societal norms and values emphasize the importance of security and stability for my family and community. My individual values and personal experience also play a role, as a married male from a lower middle-class background, I prioritize the security of my loved ones and the stability of my livelihood. Additionally, my socioeconomic background and age contribute to my belief that security is more important for me and my community. Therefore, I choose option (2) Security."]}, {"persona": {"region": "Qaliubiya", "sex": "male", "age": 35, "country": "Egypt", "marital_status": "married", "education": "higher", "social_class": "working class"}, "question": {"id": "Q150", "variant": 0}, "response": ["Based on my emic perspective as a married male from Qaliubiya, Egypt, where cultural context and individual values play a significant role in shaping my beliefs and attitudes, I believe that security is more important than freedom. In my cultural context, the stability and safety of my family and community are paramount, and the socioeconomic background of being part of the working class further reinforces the importance of security for me and my loved ones. Additionally, living in a region with political and social instability has heightened my value of security over freedom, as I prioritize the well-being and protection of my family in a challenging environment. Therefore, my personal experience and cultural context lead me to prioritize security over freedom. \n\n2"]}, {"persona": {"region": "Qaliubiya", "sex": "female", "age": 40, "country": "Egypt", "marital_status": "married", "education": "middle", "social_class": "working class"}, "question": {"id": "Q150", "variant": 0}, "response": ["Based on the anthropological framework, as a married female from Qaliubiya, Egypt, my emic perspective is heavily influenced by my cultural context and socioeconomic background. In my community, the emphasis is often placed on security, especially for women, as it is seen as a way to protect oneself and one's family. Additionally, my working-class status and middle education level also play a role in my understanding of the importance of security in providing stability and protection for my family. Therefore, I choose option 2: Security. \n\n2"]}, {"persona": {"region": "Qaliubiya", "sex": "female", "age": 48, "country": "Egypt", "marital_status": "divorced", "education": "lower", "social_class": "working class"}, "question": {"id": "Q150", "variant": 0}, "response": ["Based on the anthropological framework, my perspective as a divorced female from Qaliubiya, Egypt, who is 48 years old and part of the working class, is heavily influenced by my cultural context, individual values, and socioeconomic background. In Egypt, there is a strong emphasis on family and community, and security is often prioritized due to economic and political instability. As a working-class woman who has experienced divorce, I value security and stability in my life, as it directly impacts my ability to provide for myself and my family. Additionally, my lower education level may limit my opportunities for economic advancement, further reinforcing the importance of security. Therefore, I choose option (2) Security. \n\n2"]}, {"persona": {"region": "Qaliubiya", "sex": "male", "age": 46, "country": "Egypt", "marital_status": "married", "education": "middle", "social_class": "working class"}, "question": {"id": "Q150", "variant": 0}, "response": ["Based on the anthropological framework, as a married male from Qaliubiya, Egypt, my understanding of the importance of freedom or security is heavily influenced by my cultural context, individual values, and socioeconomic background. In Egypt, there is a strong emphasis on traditional family values and the importance of providing for one's family. As a member of the working class with a middle education level, my personal experience has taught me the value of security in terms of financial stability and the ability to take care of my family. Additionally, the political and social context in Egypt also prioritizes security due to historical and current political instability. Therefore, I would prioritize security over freedom, as it is essential for the well-being and stability of my family and community.\n\n2"]}, {"persona": {"region": "Qaliubiya", "sex": "male", "age": 47, "country": "Egypt", "marital_status": "married", "education": "higher", "social_class": "lower middle class"}, "question": {"id": "Q150", "variant": 0}, "response": ["Based on the anthropological framework, as a married male from Qaliubiya, Egypt, my emic perspective is heavily influenced by the cultural context and my individual values. In Egypt, the cultural context emphasizes the importance of security, especially in providing for and protecting one's family. Additionally, my lower middle class socioeconomic background and age also play a role in shaping my perspective, as I prioritize stability and security for my family's well-being. Therefore, I believe that security is more important than freedom in my particular context.\n\n2"]}, {"persona": {"region": "Qaliubiya", "sex": "female", "age": 38, "country": "Egypt", "marital_status": "married", "education": "higher", "social_class": "working class"}, "question": {"id": "Q150", "variant": 0}, "response": ["Based on the anthropological framework, as a married female from Qaliubiya, Egypt, my emic perspective is influenced by my cultural context, individual values, and socioeconomic background. In Egyptian society, the concept of security holds a significant value due to the political and social instability in the region. This is further emphasized by my working-class status, where financial and physical security are crucial for survival. Additionally, as a woman in this society, traditional gender roles and societal expectations also play a role in prioritizing security. Therefore, from my perspective, security holds more importance than freedom.\n\n2"]}, {"persona": {"region": "Qaliubiya", "sex": "male", "age": 58, "country": "Egypt", "marital_status": "married", "education": "middle", "social_class": "working class"}, "question": {"id": "Q150", "variant": 0}, "response": ["Based on the anthropological framework, as a married male from Qaliubiya, Egypt, my perspective is heavily influenced by my cultural context, individual values, and socioeconomic background. In my community, there is a strong emphasis on family and community security, which is interconnected with our socioeconomic standing. Additionally, my age and working-class background have shaped my perception of the importance of stability and security. Therefore, I value security over freedom.\n\n2"]}, {"persona": {"region": "Qaliubiya", "sex": "female", "age": 27, "country": "Egypt", "marital_status": "married", "education": "higher", "social_class": "working class"}, "question": {"id": "Q150", "variant": 0}, "response": ["As a married female from Qaliubiya, Egypt, I am influenced by my cultural context, individual values, and socioeconomic background. In Egyptian society, family and community are highly valued, and security is a priority for the well-being of my family. Additionally, as a working-class woman, I understand the importance of financial security for my family's future. These factors, combined with my personal experiences and age, lead me to prioritize security over freedom.\n\n2"]}, {"persona": {"region": "Qaliubiya", "sex": "female", "age": 48, "country": "Egypt", "marital_status": "married", "education": "middle", "social_class": "upper middle class"}, "question": {"id": "Q150", "variant": 0}, "response": ["Based on the anthropological framework, as a married female from Qaliubiya, Egypt, my emic perspective would be influenced by the cultural context of Egypt and the values and experiences I have as part of the upper middle class. In Egypt, security is a major concern due to political unrest and economic challenges. Additionally, as a woman, I value safety and stability for myself and my family. The socioeconomic background and cultural relativism of Egypt also play a role in my perception of security as a priority. Therefore, I choose option 2: Security. \n\n2"]}, {"persona": {"region": "Giza", "sex": "female", "age": 19, "country": "Egypt", "marital_status": "single", "education": "middle", "social_class": "working class"}, "question": {"id": "Q150", "variant": 0}, "response": ["Based on the anthropological framework, as a 19-year-old single female from Giza, Egypt, my individual values and personal experience play a significant role in shaping my perspective. Growing up in a working-class family in a culturally rich and diverse environment, I have experienced firsthand the importance of security in everyday life. The cultural context of Egypt also emphasizes the value of security, especially for women, given the social and political climate. Additionally, my socioeconomic background and limited education level have influenced my perception of the world, where security is a fundamental need for survival and stability. Therefore, I believe that security is more important than freedom in my current circumstances.\n\n2"]}, {"persona": {"region": "Giza", "sex": "female", "age": 38, "country": "Egypt", "marital_status": "married", "education": "higher", "social_class": "lower middle class"}, "question": {"id": "Q150", "variant": 0}, "response": ["Based on the anthropological framework, as a married female from Giza, Egypt, my emic perspective is influenced by my cultural context, individual values, and socioeconomic background. In Egypt, there is a strong emphasis on security due to political instability and economic challenges, which affects my perception. Additionally, as a lower-middle-class woman, I prioritize security for my family's well-being and stability. However, I also value freedom as a higher educated woman who wants to have a voice and agency in society. Therefore, I believe that security is more important for the overall well-being of my family and community, but I also recognize the importance of freedom for personal growth and development.\n\n2"]}, {"persona": {"region": "Beni Swaif/Beni Suef", "sex": "female", "age": 34, "country": "Egypt", "marital_status": "divorced", "education": "higher", "social_class": "lower class"}, "question": {"id": "Q150", "variant": 0}, "response": ["From an anthropological perspective, my emic and etic perspective as a divorced female from Beni Swaif, Egypt, is heavily influenced by my cultural context, individual values, and socioeconomic background. In my community, the traditional roles and expectations for women place a strong emphasis on security, particularly financial and physical security. As a member of the lower class, I have experienced firsthand the struggles and insecurities that come with limited resources and opportunities. Additionally, my personal experience as a divorced woman has made me acutely aware of the importance of security in a society where women may face discrimination and limited opportunities. Therefore, based on my cultural context, individual values, and socioeconomic background, I believe that security is more important than freedom.\n2"]}, {"persona": {"region": "Beni Swaif/Beni Suef", "sex": "male", "age": 20, "country": "Egypt", "marital_status": "single", "education": "higher", "social_class": "working class"}, "question": {"id": "Q150", "variant": 0}, "response": ["Based on the anthropological framework, my perspective is heavily influenced by my cultural context, individual values, and socioeconomic background. As a young, working-class male from Beni Swaif, Egypt, I have been shaped by the cultural norms and values of my community, as well as my personal experiences and the socioeconomic challenges I face. In this context, the societal emphasis on security and stability is paramount, given the economic and political uncertainties that my community and I have experienced. Additionally, my age and education level have allowed me to develop a nuanced understanding of the complexities of this question. Therefore, I choose option 2: Security."]}, {"persona": {"region": "Giza", "sex": "male", "age": 19, "country": "Egypt", "marital_status": "single", "education": "middle", "social_class": "upper middle class"}, "question": {"id": "Q150", "variant": 0}, "response": ["Based on my personal experience and cultural context, as a 19-year-old single male from Giza, Egypt, I am part of the upper middle class and have completed middle education level. My socioeconomic background and age play a significant role in shaping my perspective. In Egypt, there is a strong emphasis on security due to the political and social context, and the cultural value of stability is paramount. Additionally, the recent history of political instability and the presence of terrorist threats have made security a top priority for many people in my community. Therefore, I believe that security is more important than freedom in ensuring the well-being and stability of individuals and society as a whole.\n\n2"]}, {"persona": {"region": "Giza", "sex": "female", "age": 33, "country": "Egypt", "marital_status": "married", "education": "middle", "social_class": "working class"}, "question": {"id": "Q150", "variant": 0}, "response": ["Based on the anthropological framework, as a married female from Giza, Egypt, my emic perspective is heavily influenced by the cultural context of my community and my personal experience as a working-class woman. In this context, the importance of security is prioritized due to the socioeconomic background and the cultural values that prioritize stability and safety for oneself and family. Additionally, the nuanced phrasing of the question also plays a role, as the concept of security encompasses not only physical safety but also financial stability and social cohesion. Therefore, from this perspective, the more important value would be:\n2"]}, {"persona": {"region": "Giza", "sex": "female", "age": 24, "country": "Egypt", "marital_status": "married", "education": "higher", "social_class": "working class"}, "question": {"id": "Q150", "variant": 0}, "response": ["Based on the anthropological framework, as a married female from Giza, Egypt, my emic perspective would prioritize security due to the cultural context of living in a region with socio-political instability. Additionally, my socioeconomic background as part of the working class would further emphasize the importance of security for stability and survival. My personal experience and values would also align with the prioritization of security, as it is crucial for the well-being and safety of myself and my family. Therefore, I would choose:\n2) Security"]}, {"persona": {"region": "Giza", "sex": "male", "age": 50, "country": "Egypt", "marital_status": "married", "education": "higher", "social_class": "working class"}, "question": {"id": "Q150", "variant": 0}, "response": ["From the perspective of a married male from Giza, Egypt, who is 50 years old, has completed higher education, and considers himself part of the working class, the answer to the question of whether freedom or security is more important will be shaped by his cultural context, individual values, and socioeconomic background. In Egypt, the cultural context places a high value on security, especially in light of recent political and social unrest. Additionally, as a member of the working class, he may prioritize security in order to provide for his family and ensure their well-being. Furthermore, his age and personal experiences may have led him to value security over freedom, as he may have witnessed or experienced periods of instability in the country. Therefore, based on these factors, the chosen answer will reflect the importance of security in his life.\n\n2"]}, {"persona": {"region": "Beni Swaif/Beni Suef", "sex": "female", "age": 26, "country": "Egypt", "marital_status": "married", "education": "higher", "social_class": "lower middle class"}, "question": {"id": "Q150", "variant": 0}, "response": ["From an emic perspective, as a married female from Beni Swaif/Beni Suef, Egypt, my cultural context and socioeconomic background play a significant role in shaping my answer to this question. In Egyptian society, the value of security is deeply ingrained due to the historical and political context of the country. The emphasis on stability and security is crucial for the well-being of the family and community. Additionally, my personal experience and individual values also lead me to prioritize security, as it provides a sense of safety and stability for my family and myself. Therefore, considering the cultural relativism and the nuanced phrasing of the question, I would choose option (2) Security. \n\n2"]}, {"persona": {"region": "Beni Swaif/Beni Suef", "sex": "male", "age": 40, "country": "Egypt", "marital_status": "single", "education": "lower", "social_class": "lower class"}, "question": {"id": "Q150", "variant": 0}, "response": ["From the emic perspective of a single male from Beni Swaif, Egypt, who is 40 years old, has completed lower education, and considers himself part of the lower class, the cultural context, individual values, and socioeconomic background play pivotal roles in understanding and answering this question. In this context, the cultural emphasis on community and family ties, along with the socioeconomic challenges faced by the lower class, make security a more pressing concern. Additionally, personal experience and individual values, shaped by economic hardships and social instability, further prioritize security over freedom. Therefore, the answer chosen is:\n\n2) Security"]}, {"persona": {"region": "Beni Swaif/Beni Suef", "sex": "female", "age": 25, "country": "Egypt", "marital_status": "married", "education": "middle", "social_class": "lower middle class"}, "question": {"id": "Q150", "variant": 0}, "response": ["Based on the anthropological framework, my answer would be influenced by my cultural context, individual values, socioeconomic background, and space and time. In Beni Swaif, Egypt, there is a strong emphasis on family and community, and the cultural context values security and stability. As a married woman from the lower middle class, my personal experience and values would also prioritize security over freedom, as stability and safety are crucial for myself and my family. Additionally, the socioeconomic background and limited educational opportunities may also influence my perspective, as security is often linked to financial stability and access to resources. Therefore, my answer would be:\n\n2) Security"]}, {"persona": {"region": "Beni Swaif/Beni Suef", "sex": "female", "age": 21, "country": "Egypt", "marital_status": "single", "education": "middle", "social_class": "lower middle class"}, "question": {"id": "Q150", "variant": 0}, "response": ["Based on the anthropological framework, as a single female from Beni Suef, Egypt, my perspective is heavily influenced by my cultural context, socioeconomic background, and personal experience. In Egypt, there are certain societal expectations and restrictions placed on women, which can impact their sense of freedom. Additionally, being part of the lower middle class means that I may have limited access to resources and opportunities, which can affect my feeling of security. Considering these factors, I believe that security is more important than freedom in my current circumstances.\n\n2"]}, {"persona": {"region": "Beni Swaif/Beni Suef", "sex": "male", "age": 48, "country": "Egypt", "marital_status": "married", "education": "middle", "social_class": "lower middle class"}, "question": {"id": "Q150", "variant": 0}, "response": ["Based on the anthropological framework, my answer is influenced by my individual values and personal experience, as well as my socioeconomic background and cultural context. As a married male from Beni Suef, Egypt, I have been raised in a culture that values security and stability due to the political and economic challenges we face. Additionally, being part of the lower middle class, I prioritize the need for security to provide for my family. Therefore, I choose option (2) Security."]}, {"persona": {"region": "Beni Swaif/Beni Suef", "sex": "female", "age": 57, "country": "Egypt", "marital_status": "married", "education": "middle", "social_class": "working class"}, "question": {"id": "Q150", "variant": 0}, "response": ["Based on the anthropological framework, my perspective as a married female from Beni Swaif, Egypt, is heavily influenced by my cultural context, socioeconomic background, and personal experience. In Egyptian society, the value of security is often prioritized due to political instability and economic hardships. As a member of the working class, my focus is on ensuring the safety and stability of my family. Additionally, my age and educational level have shaped my views on the importance of security over freedom. Therefore, I choose option 2: Security."]}, {"persona": {"region": "Beni Swaif/Beni Suef", "sex": "male", "age": 20, "country": "Egypt", "marital_status": "single", "education": "middle", "social_class": "working class"}, "question": {"id": "Q150", "variant": 0}, "response": ["Based on the anthropological framework, as a single male from Beni Swaif, Egypt, my perspective is heavily influenced by my cultural context, socioeconomic background, and personal experience. In Egypt, there is a strong emphasis on familial and community ties, and security is often prioritized due to political and economic instability. As a member of the working class, I have experienced firsthand the challenges and uncertainties that come with limited financial resources. Given these factors, I believe that security is more important than freedom in my current situation.\n\n2"]}, {"persona": {"region": "Giza", "sex": "female", "age": 59, "country": "Egypt", "marital_status": "married", "education": "higher", "social_class": "upper middle class"}, "question": {"id": "Q150", "variant": 0}, "response": ["Based on the anthropological framework, my perspective is heavily influenced by my cultural context as a married female from Giza, Egypt. I come from a society with strong emphasis on family and community, which shapes my understanding of the importance of security. Additionally, my socioeconomic background as part of the upper middle class has provided me with a level of comfort and stability, making security a priority in my life. Furthermore, my age and experience have taught me the value of security in maintaining a stable and fulfilling life. Therefore, I choose option (2) Security."]}, {"persona": {"region": "Giza", "sex": "female", "age": 38, "country": "Egypt", "marital_status": "single", "education": "higher", "social_class": "lower middle class"}, "question": {"id": "Q150", "variant": 0}, "response": ["Based on the anthropological framework, I would consider the perspective of a single 38-year-old female from Giza, Egypt, who completed higher education and is part of the lower middle class. From an emic perspective, cultural context, individual values, and socioeconomic background would play a significant role in shaping her answer. In a context where there may be economic instability and concerns about personal safety, the value of security might be prioritized. Additionally, cultural relativism and nuance would also be important factors, as the nuanced phrasing of the question could influence her answer. When considering these factors, the persona described above would likely prioritize security over freedom.\n\n2"]}, {"persona": {"region": "Giza", "sex": "female", "age": 26, "country": "Egypt", "marital_status": "single", "education": "higher", "social_class": "working class"}, "question": {"id": "Q150", "variant": 0}, "response": ["Based on my emic perspective as a single female from Giza, Egypt, I am influenced by the cultural context of my society, where traditional gender roles and expectations shape my experiences. As a member of the working class, my socioeconomic background also plays a significant role in my understanding of this question. In Egypt, the values of security are highly prioritized due to political and social unrest, and the need for stability and safety is crucial for survival. However, as a young, educated woman, I have also been exposed to the value of freedom and the desire for independence and self-expression. Considering the nuances of the question, I believe that security is more important in my current situation, as it provides the foundation for me to pursue and enjoy freedoms in the future.\n\n2"]}, {"persona": {"region": "Giza", "sex": "male", "age": 39, "country": "Egypt", "marital_status": "married", "education": "middle", "social_class": "working class"}, "question": {"id": "Q150", "variant": 0}, "response": ["Based on the emic and etic perspectives, as a married male from Giza, Egypt, I understand the importance of both freedom and security within my cultural context. In Egypt, there is a strong emphasis on family and community, and security is often prioritized to ensure the well-being of loved ones. Additionally, my individual values and personal experience as a working-class individual have shaped my belief that security is essential for stability and peace of mind. Furthermore, considering my socioeconomic background, where financial stability is a constant concern, security holds significant importance. Taking into account the cultural relativism and the nuanced phrasing of the question, I believe that security takes precedence in my life and for my community. \n\n2"]}, {"persona": {"region": "Giza", "sex": "male", "age": 36, "country": "Egypt", "marital_status": "married", "education": "middle", "social_class": "working class"}, "question": {"id": "Q150", "variant": 0}, "response": ["Based on my emic perspective as a married male from Giza, Egypt, I understand the importance of cultural context in shaping my views. In my community, the value of security is paramount, given the political and social instability in our region. Additionally, my socioeconomic background as a working-class individual further emphasizes the significance of security, as it directly impacts my ability to provide for my family and ensure their well-being. Furthermore, my personal experiences and values, shaped by the prevalent challenges in our society, prioritize security over freedom. Therefore, from this perspective, I choose:\n2) Security"]}, {"persona": {"region": "Giza", "sex": "female", "age": 30, "country": "Egypt", "marital_status": "single", "education": "higher", "social_class": "lower class"}, "question": {"id": "Q150", "variant": 0}, "response": ["Based on my emic perspective as a single female from Giza, Egypt, I have been raised and socialized within a cultural context that values security over freedom. In my community, personal safety and stability are prioritized due to the socioeconomic background and the challenges we face. My individual values and personal experiences have also shaped my belief that security is more crucial, as I have witnessed the impact of insecurity on my community. Additionally, cultural relativism teaches me that my perspective is valid and should be respected. Therefore, I believe that security is more important for my well-being and the well-being of my community.\n\n2"]}, {"persona": {"region": "Giza", "sex": "female", "age": 24, "country": "Egypt", "marital_status": "single", "education": "higher", "social_class": "lower class"}, "question": {"id": "Q150", "variant": 0}, "response": ["Based on the anthropological framework, as a single female from Giza, Egypt, my emic perspective is heavily influenced by my cultural context, socioeconomic background, and individual values. In a society where women often face restrictions on their freedom, security becomes a priority. Additionally, my lower-class status means that I may have experienced or witnessed instances where lack of security has had severe consequences. Therefore, I prioritize security over freedom.\n\n2"]}, {"persona": {"region": "Giza", "sex": "male", "age": 65, "country": "Egypt", "marital_status": "married", "education": "middle", "social_class": "working class"}, "question": {"id": "Q150", "variant": 0}, "response": ["Based on the anthropological framework, my perspective is heavily influenced by my age, education level, and socioeconomic background. As a 65-year-old male from Giza, Egypt, I have lived through various political and social changes in my country, which have shaped my understanding of freedom and security. My middle education level has provided me with a basic understanding of political ideologies, while my working-class background has made me prioritize the need for security and stability in my life. Additionally, living in a region with a complex history and ongoing social and political challenges has made me value security as a means of ensuring the well-being of my family and community. Therefore, I believe that security is more important than freedom in my context.\n\n2"]}, {"persona": {"region": "Giza", "sex": "female", "age": 56, "country": "Egypt", "marital_status": "married", "education": "middle", "social_class": "working class"}, "question": {"id": "Q150", "variant": 0}, "response": ["Based on the anthropological framework, my perspective is heavily influenced by my cultural context, individual values, and socioeconomic background. As a married woman from Giza, Egypt, my cultural context values security and stability, especially as part of the working class. Additionally, my personal experience and socioeconomic background prioritize security and stability over freedom due to the challenges and uncertainties of daily life. Therefore, I believe that security is more important than freedom.\n\n2"]}, {"persona": {"region": "Giza", "sex": "male", "age": 31, "country": "Egypt", "marital_status": "married", "education": "higher", "social_class": "lower middle class"}, "question": {"id": "Q150", "variant": 0}, "response": ["From the perspective of a married male from Giza, Egypt, who is 31 years old, has completed higher education, and considers himself part of the lower middle class, several factors come into play in answering the question of whether freedom or security is more important. The cultural context of living in Egypt, where there may be political and social unrest, may lead to a prioritization of security. Additionally, the socioeconomic background of being part of the lower middle class may lead to valuing security over freedom, as stability and safety may be more pressing concerns. Personal experience and individual values also play a role, as the individual may have experienced or witnessed the negative consequences of lacking security. Therefore, the choice of prioritizing security is influenced by a combination of cultural context, socioeconomic background, and personal experience.\n\n2"]}, {"persona": {"region": "Giza", "sex": "male", "age": 28, "country": "Egypt", "marital_status": "single", "education": "middle", "social_class": "working class"}, "question": {"id": "Q150", "variant": 0}, "response": ["Based on the anthropological framework, as a single male from Giza, Egypt, my cultural context, socioeconomic background, and individual values and personal experience would heavily influence my answer to the question. In Egypt, the concept of security holds great significance due to the political and social instability, economic challenges, and concerns about personal safety. As a member of the working class, I may prioritize security as it directly impacts my ability to provide for myself and my family. Additionally, the cultural relativism of Egypt may also play a role in valuing security over freedom, as the country has a history of authoritarian rule and emphasis on stability. Therefore, I choose option (2) Security."]}, {"persona": {"region": "Giza", "sex": "male", "age": 47, "country": "Egypt", "marital_status": "married", "education": "middle", "social_class": "lower middle class"}, "question": {"id": "Q150", "variant": 0}, "response": ["From an anthropological perspective, the cultural context, socioeconomic background, and individual values and personal experience of the persona described are crucial in understanding their perspective. Growing up in Giza, Egypt, a lower middle class married male with a middle education level would have likely experienced socioeconomic struggles and a strong sense of community. In this cultural context, personal freedom may be seen as a luxury that is not as attainable as security. The individual's values and personal experiences, along with the cultural context, would likely lead them to prioritize security over freedom. Therefore, considering the emic perspective of this persona, the answer to the question would likely be:\n\n2"]}, {"persona": {"region": "Giza", "sex": "male", "age": 26, "country": "Egypt", "marital_status": "single", "education": "middle", "social_class": "lower middle class"}, "question": {"id": "Q150", "variant": 0}, "response": ["Based on the anthropological framework, my answer is influenced by my cultural context, individual values, and socioeconomic background. As a single male from Giza, Egypt, my cultural context emphasizes the importance of family and community, and my personal experience has shown me the struggles of living in a lower middle-class household. This has led me to prioritize security, as it is essential for the well-being of my family and myself. Additionally, the cultural relativism aspect of the framework reminds me that my perspective may differ from others due to my background and experiences. Therefore, my answer is influenced by a combination of cultural context, personal values, and socioeconomic background.\n\n2"]}, {"persona": {"region": "Giza", "sex": "male", "age": 48, "country": "Egypt", "marital_status": "married", "education": "middle", "social_class": "upper middle class"}, "question": {"id": "Q150", "variant": 0}, "response": ["Based on the anthropological framework, my answer will be influenced by my emic perspective as a married male from Giza, Egypt, my cultural context as part of the upper middle class in Egypt, my individual values and personal experience, and my socioeconomic background. In Egypt, there is a strong emphasis on the importance of security due to the political and social instability in the region. As a married male, I am responsible for the safety and well-being of my family, and as someone from the upper middle class, I have a certain level of comfort and security that I value and want to maintain. Therefore, based on my personal experience and cultural context, I would prioritize security over freedom.\n\n2"]}, {"persona": {"region": "Menya", "sex": "male", "age": 61, "country": "Egypt", "marital_status": "married", "education": "middle", "social_class": "working class"}, "question": {"id": "Q150", "variant": 0}, "response": ["Based on the anthropological framework, as a married male from Menya, Egypt, at 61 years of age and with a middle education level, my perspective is heavily influenced by my cultural context, individual values, and socioeconomic background. In Menya, traditions and community values are deeply ingrained, and security is a top priority for me and my family. As part of the working class, I am concerned about providing for my loved ones and ensuring their safety in an uncertain world. Additionally, my age and experience have taught me the importance of stability and security in life. Therefore, I believe that security is more important than freedom in my current circumstances.\n\n2"]}, {"persona": {"region": "Menya", "sex": "male", "age": 41, "country": "Egypt", "marital_status": "married", "education": "middle", "social_class": "lower middle class"}, "question": {"id": "Q150", "variant": 0}, "response": ["Based on the anthropological framework, my response is shaped by my emic perspective as a married male from Menya, Egypt, my cultural context, and my socioeconomic background. In Menya, freedom may not hold the same value as it does in Western cultures. The cultural context of Egypt, with its history of political instability and economic challenges, may lead to a prioritization of security over freedom. As a member of the lower middle class, I may have experienced firsthand the struggles of economic instability and the importance of feeling secure in my daily life. Therefore, considering all these factors, I choose option 2 - Security."]}, {"persona": {"region": "Menya", "sex": "female", "age": 43, "country": "Egypt", "marital_status": "married", "education": "higher", "social_class": "working class"}, "question": {"id": "Q150", "variant": 0}, "response": ["Based on the anthropological framework, my answer is influenced by my cultural context, individual values, and socioeconomic background. As a married female from Menya, Egypt, my cultural context emphasizes the importance of family and community, which influences my values and beliefs. Additionally, my higher education level has exposed me to different perspectives on the importance of freedom and security. As a member of the working class, I prioritize security as it directly impacts my ability to provide for my family and maintain stability. Therefore, based on my personal experience and socioeconomic background, I believe that security is more important than freedom.\n\n2"]}, {"persona": {"region": "Menya", "sex": "male", "age": 57, "country": "Egypt", "marital_status": "married", "education": "middle", "social_class": "lower middle class"}, "question": {"id": "Q150", "variant": 0}, "response": ["Based on the anthropological framework, my answer is shaped by my emic perspective as a married male from Menya, Egypt, as well as my socioeconomic background, age, and personal experiences. In Menya, the cultural context values security highly due to political instability and economic challenges. As a member of the lower middle class, I have personally experienced the struggle for financial security and stability. Additionally, my age and education level have shaped my views on the importance of security for the well-being of my family and community. Therefore, I choose option (2) Security."]}, {"persona": {"region": "Menya", "sex": "male", "age": 42, "country": "Egypt", "marital_status": "divorced", "education": "middle", "social_class": "lower middle class"}, "question": {"id": "Q150", "variant": 0}, "response": ["From an anthropological perspective, my emic perspective as a divorced male from Menya, Egypt would be influenced by my personal experience and cultural context. As a lower middle class individual who has experienced the challenges of divorce and the economic struggles that come with it, I value security above all else. My socioeconomic background and individual values lead me to prioritize stability and security for myself and my family. Additionally, the cultural context of Egypt, where there are often political and social instabilities, further reinforces the importance of security in my perspective. Therefore, I would choose option 2) Security."]}, {"persona": {"region": "Menya", "sex": "female", "age": 59, "country": "Egypt", "marital_status": "married", "education": "middle", "social_class": "upper middle class"}, "question": {"id": "Q150", "variant": 0}, "response": ["Based on the anthropological framework, as a married female from Menya, Egypt, my emic perspective is influenced by the cultural context of my upbringing and the societal expectations placed upon me. My personal values and experiences, shaped by my age and education level, lead me to prioritize security. As someone who considers myself part of the upper middle class, socioeconomic background plays a significant role in my understanding of the importance of stability and security for myself and my family. Additionally, the nuanced phrasing of the question allows me to emphasize the importance of security in a region that has faced political and economic uncertainty. Therefore, my choice is:\n\n2) Security"]}, {"persona": {"region": "Menya", "sex": "female", "age": 31, "country": "Egypt", "marital_status": "married", "education": "middle", "social_class": "working class"}, "question": {"id": "Q150", "variant": 0}, "response": ["From an anthropological perspective, my personal experience, cultural context, and socioeconomic background all play a crucial role in shaping my answer to this question. As a married female from Menya, Egypt, I have been raised in a society where traditional gender roles and family values are highly emphasized. My middle education level and working-class status also influence my perspective, as I have to prioritize the practicalities of daily life. In this context, security holds greater importance to me as it directly impacts my ability to provide for my family and maintain stability in my life.\n\n2"]}, {"persona": {"region": "Menya", "sex": "male", "age": 55, "country": "Egypt", "marital_status": "single", "education": "middle", "social_class": "working class"}, "question": {"id": "Q150", "variant": 0}, "response": ["Based on the anthropological framework, as a single male from Menya, Egypt, who is 55 years old and part of the working class, my perspective on the importance of freedom versus security is influenced by my cultural context, individual values, and socioeconomic background. In Egypt, there is a strong emphasis on the importance of security due to political and social instability, as well as economic challenges. However, as someone who has experienced life in a working-class environment, I have also come to value freedom as it allows for personal growth and the pursuit of opportunities. Additionally, my personal experience and age may lead me to prioritize security for the sake of stability and well-being. Therefore, considering these factors, my perspective leans towards the importance of security. \n\n2"]}, {"persona": {"region": "Menya", "sex": "female", "age": 28, "country": "Egypt", "marital_status": "married", "education": "higher", "social_class": "lower middle class"}, "question": {"id": "Q150", "variant": 0}, "response": ["Based on my cultural context as a married female from Menya, Egypt, my individual values and personal experience have shaped my perception. As someone who has completed higher education and considers myself part of the lower middle class, I value freedom as it represents the ability to pursue opportunities and make choices for myself and my family. In the context of Egypt, where there have been periods of political instability, security is also important, but ultimately I believe that freedom is more essential for personal and societal growth.\n\n1"]}, {"persona": {"region": "Menya", "sex": "male", "age": 24, "country": "Egypt", "marital_status": "single", "education": "middle", "social_class": "working class"}, "question": {"id": "Q150", "variant": 0}, "response": ["Based on the anthropological framework, as a 24-year-old male from Menya, Egypt, who has completed middle education and considers himself part of the working class, my individual values and personal experience heavily influence my perception of the importance of freedom versus security. Growing up in a country with political instability and economic challenges, the need for security is a top priority. My socio-economic background also plays a significant role in this decision, as the working class often faces greater security concerns. Additionally, the cultural context of Egypt, with its history of political unrest and social upheaval, further emphasizes the importance of security in my life. Therefore, considering all these factors, I choose option (2) Security. \n\n2"]}, {"persona": {"region": "Menya", "sex": "female", "age": 23, "country": "Egypt", "marital_status": "married", "education": "middle", "social_class": "working class"}, "question": {"id": "Q150", "variant": 0}, "response": ["Based on my cultural context as a married female from Menya, Egypt, my personal experience and individual values as part of the working class, and my socioeconomic background, I believe that security is more important than freedom. In our community, stability and safety are crucial for our families and our livelihoods. Without security, we are unable to provide for our loved ones and ensure their well-being. Additionally, the cultural relativism of our society values collective security and stability over individual freedoms. Therefore, based on my nuanced understanding of the question, I choose option 2) Security."]}, {"persona": {"region": "Menya", "sex": "male", "age": 27, "country": "Egypt", "marital_status": "single", "education": "middle", "social_class": "lower middle class"}, "question": {"id": "Q150", "variant": 0}, "response": ["Based on the anthropological framework, I must consider my emic perspective as a single male from Menya, Egypt, as well as my cultural context, individual values, and socioeconomic background. In my community, freedom is often restricted due to societal norms and expectations, and security is a priority due to economic instability and political unrest. My personal experience and values also prioritize security as it is essential for my well-being and the well-being of my family. Additionally, my lower middle class status means that I do not have the same privileges and freedoms as those in higher socioeconomic classes. Therefore, I choose option (2) Security."]}, {"persona": {"region": "Asyut", "sex": "male", "age": 30, "country": "Egypt", "marital_status": "married", "education": "middle", "social_class": "working class"}, "question": {"id": "Q150", "variant": 0}, "response": ["Based on the anthropological framework, as a married male from Asyut, Egypt, my cultural context and socioeconomic background heavily influence my perspective. In Egypt, there is a strong emphasis on family and community, which often takes precedence over individual freedom. Additionally, as a working-class individual, security and stability are paramount for me and my family's well-being. Considering these factors, I prioritize security over freedom. \n\n2"]}, {"persona": {"region": "Asyut", "sex": "female", "age": 26, "country": "Egypt", "marital_status": "married", "education": "middle", "social_class": "working class"}, "question": {"id": "Q150", "variant": 0}, "response": ["Based on the anthropological framework, as a married female from Asyut, Egypt, my perspective is influenced by my cultural context, individual values, socioeconomic background, and personal experience. In my community, traditional gender roles and expectations heavily influence how I perceive the importance of freedom and security. As a working-class woman, I prioritize security for my family and myself, as it is important for our well-being and stability. Additionally, my personal experience and cultural context have shaped my belief that security is essential for a sense of peace and stability in life. Therefore, I choose option (2) Security."]}, {"persona": {"region": "Asyut", "sex": "male", "age": 32, "country": "Egypt", "marital_status": "single", "education": "higher", "social_class": "lower middle class"}, "question": {"id": "Q150", "variant": 0}, "response": ["From the emic perspective, as a single male from Asyut, Egypt, my cultural context and socioeconomic background greatly influence my answer to this question. In Egypt, the value of security is paramount due to the political and social instability in the region. Additionally, being part of the lower middle class, I am more concerned about the basic needs of survival and providing for my family. My personal experience and individual values also play a role in my answer, as I prioritize stability and safety for myself and my loved ones. Therefore, from this perspective, I choose option (2) Security."]}, {"persona": {"region": "Asyut", "sex": "female", "age": 21, "country": "Egypt", "marital_status": "married", "education": "middle", "social_class": "working class"}, "question": {"id": "Q150", "variant": 0}, "response": ["Based on the anthropological framework, my answer is influenced by my cultural context as a married female from Asyut, Egypt, where societal norms and expectations often prioritize security and stability. My socioeconomic background as part of the working class also leads me to prioritize security, as financial stability and safety are major concerns for my family and me. Additionally, my personal experience and individual values also play a role in my decision, as I have seen the importance of security in providing a sense of well-being for my loved ones. Therefore, considering these factors, my choice is: \n\n2) Security"]}, {"persona": {"region": "Asyut", "sex": "female", "age": 30, "country": "Egypt", "marital_status": "married", "education": "higher", "social_class": "working class"}, "question": {"id": "Q150", "variant": 0}, "response": ["Based on the anthropological framework, as a married female from Asyut, Egypt, my emic perspective values cultural context, individual values and personal experience, and socioeconomic background. In my cultural context, freedom may be seen as a means to pursue personal and professional goals, especially for someone who has completed higher education and considers themselves part of the working class. However, the socioeconomic background and the specific cultural context of Asyut, Egypt, may also emphasize the importance of security for stability and survival. Considering these factors, I would choose the option that best aligns with my persona's perspective.\n\n2"]}, {"persona": {"region": "Asyut", "sex": "female", "age": 42, "country": "Egypt", "marital_status": "married", "education": "higher", "social_class": "lower middle class"}, "question": {"id": "Q150", "variant": 0}, "response": ["Based on the anthropological framework, the answer to the question of whether freedom or security is more important would be influenced by a variety of factors. As a married female from Asyut, Egypt, my cultural context and socioeconomic background would play a significant role in shaping my perspective. In a society where traditional gender roles and family values are important, the emphasis on security for my family and loved ones would likely be a priority. Additionally, my age and educational level would also influence my understanding of the importance of stability and security for the future. Therefore, I would choose:\n\n2) Security"]}, {"persona": {"region": "Sohag", "sex": "male", "age": 63, "country": "Egypt", "marital_status": "married", "education": "middle", "social_class": "lower middle class"}, "question": {"id": "Q150", "variant": 0}, "response": ["Based on the anthropological framework, my perspective is heavily influenced by my cultural context, individual values, and socioeconomic background. As a married male from Sohag, Egypt, my cultural context places a significant emphasis on family and community values, which often prioritize security and stability. Additionally, as a member of the lower middle class, I have experienced the challenges of economic uncertainty and the importance of security in providing for my family. Therefore, considering my personal experience and socioeconomic background, I prioritize security over freedom.\n\n2"]}, {"persona": {"region": "Sohag", "sex": "male", "age": 27, "country": "Egypt", "marital_status": "married", "education": "middle", "social_class": "working class"}, "question": {"id": "Q150", "variant": 0}, "response": ["Based on the anthropological framework, my answer is influenced by my cultural context as a married male from Sohag, Egypt. In my community, the concept of security holds a higher value due to the socioeconomic background and the current political and social climate. Additionally, my personal experience and individual values also play a significant role in shaping my perspective. As a working-class individual who has completed only middle education level, I prioritize the security of my family and myself, as it is crucial for our well-being and survival in our environment. Therefore, considering the cultural context, my personal experience, and socioeconomic background, I choose:\n\n2) Security"]}, {"persona": {"region": "Sohag", "sex": "male", "age": 56, "country": "Egypt", "marital_status": "married", "education": "higher", "social_class": "upper middle class"}, "question": {"id": "Q150", "variant": 0}, "response": ["Based on my personal experience and socioeconomic background as a married male from Sohag, Egypt, who is 56 years old and part of the upper middle class, I value security over freedom. In our cultural context, stability and security for our families are prioritized, and this is influenced by our age and socioeconomic status. Additionally, our cultural relativism prioritizes the wellbeing and safety of our loved ones, which aligns with the values of our community. Therefore, I choose option (2) Security."]}, {"persona": {"region": "Sohag", "sex": "male", "age": 51, "country": "Egypt", "marital_status": "married", "education": "higher", "social_class": "lower middle class"}, "question": {"id": "Q150", "variant": 0}, "response": ["Based on the anthropological framework, my perspective as a married male from Sohag, Egypt, who is 51 years old, completed higher education, and considers himself part of the lower middle class, is heavily influenced by my cultural context, individual values, and socioeconomic background. In Egypt, there is a strong emphasis on the importance of security due to political and economic instability. Additionally, as a member of the lower middle class, my focus is on stability and providing for my family. This is further influenced by my age, as I prioritize security for the future. Therefore, considering all these factors, I believe that security is more important than freedom in my current situation.\n\n2"]}, {"persona": {"region": "Sohag", "sex": "female", "age": 26, "country": "Egypt", "marital_status": "married", "education": "higher", "social_class": "working class"}, "question": {"id": "Q150", "variant": 0}, "response": ["In considering the question of whether freedom or security is more important, it is crucial to take into account the cultural context of Sohag, Egypt, as well as the individual values and personal experiences of a 26-year-old married woman from the working class. In this context, the socioeconomic background and the cultural relativism of the persona play a significant role in shaping her perspectives. Given the social and political climate in Egypt, where security concerns are prevalent, the persona may prioritize security over freedom. Additionally, as a member of the working class, she may value stability and security in order to provide for her family. Therefore, based on the anthropological framework and the persona's circumstances, she may prioritize security over freedom.\n\n2"]}, {"persona": {"region": "Sohag", "sex": "female", "age": 29, "country": "Egypt", "marital_status": "married", "education": "higher", "social_class": "upper middle class"}, "question": {"id": "Q150", "variant": 0}, "response": ["Based on the anthropological framework, as a married female from Sohag, Egypt, my emic perspective and cultural context heavily influence my understanding and answer to the question. In my cultural context, security is highly valued due to the social and political instability in the region. Additionally, my socioeconomic background as an upper middle class individual shapes my answer, as I prioritize security to maintain the lifestyle and privileges associated with my class. Furthermore, the nuance of the question also influences my answer, as I believe that without security, there can be no true freedom. Therefore, based on my personal experience and cultural context, I believe that security is more important than freedom.\n\n2"]}, {"persona": {"region": "Sohag", "sex": "male", "age": 51, "country": "Egypt", "marital_status": "married", "education": "middle", "social_class": "lower middle class"}, "question": {"id": "Q150", "variant": 0}, "response": ["Based on the anthropological framework, my answer is influenced by my cultural context as a married male from Sohag, Egypt, where traditions and family values are highly emphasized. My individual values and personal experience also play a role, as I have lived through periods of political instability and economic hardship, which have made me prioritize security. Additionally, my socioeconomic background as part of the lower middle class has made me value stability and safety over personal freedoms. Furthermore, the nuanced phrasing of the question also leads me to prioritize security, as it implies the need for stability and protection in a potentially dangerous environment. Therefore, based on my cultural context, personal experience, and socioeconomic background, I choose option (2) Security. \n\n2"]}, {"persona": {"region": "Qena", "sex": "male", "age": 32, "country": "Egypt", "marital_status": "single", "education": "middle", "social_class": "working class"}, "question": {"id": "Q150", "variant": 0}, "response": ["Based on the anthropological framework, my perspective is heavily influenced by my cultural context, socioeconomic background, and personal experience. As a single male from Qena, Egypt, I come from a working-class background and have completed only a middle education level. This has shaped my understanding of the world and my priorities. In my cultural context, the value of security is paramount due to the socioeconomic challenges and political instability in Egypt. Additionally, my personal experience has shown me the importance of security in ensuring a stable and safe life for myself and my family. Therefore, I prioritize security over freedom.\n\n2"]}, {"persona": {"region": "Qena", "sex": "male", "age": 54, "country": "Egypt", "marital_status": "married", "education": "middle", "social_class": "lower middle class"}, "question": {"id": "Q150", "variant": 0}, "response": ["Based on the anthropological framework, my cultural context as a married male from Qena, Egypt, and my lower middle class socioeconomic background play a significant role in shaping my perspective. In this context, individual values and personal experience also heavily influence my understanding. Additionally, the emic perspective of my in-group and the etic perspective of the out-group contribute to my decision. Considering the nuanced phrasing of the question and the cultural relativism that there is no hierarchy of culture, I believe that my choice will reflect the values and experiences that are important to me as a member of this specific cultural and socioeconomic group.\n\n2"]}, {"persona": {"region": "Qena", "sex": "male", "age": 25, "country": "Egypt", "marital_status": "single", "education": "lower", "social_class": "lower class"}, "question": {"id": "Q150", "variant": 0}, "response": ["Based on my cultural context and socioeconomic background, as a 25-year-old male from Qena, Egypt, who belongs to the lower class and has completed lower education, my perspective on the importance of freedom versus security is heavily influenced by my personal experience and individual values. Living in a lower socioeconomic status, I have experienced firsthand the challenges and struggles of not having security in terms of financial stability and basic needs. Therefore, my priority would be to prioritize security over freedom, as it directly impacts my ability to provide for myself and my family. Additionally, the cultural context of Egypt, where stability and security are highly valued, further reinforces my belief that ensuring security is more important than freedom.\n\n2"]}, {"persona": {"region": "Aswan", "sex": "male", "age": 34, "country": "Egypt", "marital_status": "single", "education": "middle", "social_class": "lower class"}, "question": {"id": "Q150", "variant": 0}, "response": ["Based on the anthropological framework, as a single male from Aswan, Egypt, my emic perspective is heavily influenced by my cultural context, individual values, and socioeconomic background. As a member of the lower class and having completed only middle education level, my personal experiences and values are shaped by the struggle for basic needs and security. Additionally, the cultural relativism in Egypt emphasizes the importance of family and community security, which further reinforces the value of security over freedom. Therefore, my answer is:\n2"]}, {"persona": {"region": "Aswan", "sex": "female", "age": 31, "country": "Egypt", "marital_status": "married", "education": "middle", "social_class": "lower middle class"}, "question": {"id": "Q150", "variant": 0}, "response": ["Based on my cultural context as a married woman from Aswan, Egypt, my individual values and personal experience, and my lower middle class socioeconomic background, I would prioritize security over freedom. In my community, security is a crucial factor for survival and well-being, especially for women. Our cultural context and socioeconomic background shape our understanding of the importance of security, and my personal experience as a woman in this society reinforces this belief. Additionally, cultural relativism teaches me to understand and respect the values and perspectives of my community, which prioritize security as a fundamental need. Therefore, I choose option 2: Security."]}, {"persona": {"region": "Aswan", "sex": "female", "age": 39, "country": "Egypt", "marital_status": "married", "education": "middle", "social_class": "working class"}, "question": {"id": "Q150", "variant": 0}, "response": ["Based on the anthropological framework, as a married female from Aswan, Egypt, my emic perspective would prioritize security over freedom. The cultural context and socioeconomic background in my community emphasize the importance of security, especially for working-class individuals like myself. Personal experience and values also play a significant role in shaping my perspective, as I value the stability and safety that security provides for my family. Additionally, cultural relativism and the nuanced phrasing of the question lead me to prioritize security, as it aligns with the values and priorities of my community and personal experience. \n\n2"]}, {"persona": {"region": "Qena", "sex": "female", "age": 27, "country": "Egypt", "marital_status": "married", "education": "lower", "social_class": "lower middle class"}, "question": {"id": "Q150", "variant": 0}, "response": ["Based on the anthropological framework, my perspective as a married female from Qena, Egypt, is heavily influenced by my cultural context, individual values, and socioeconomic background. In my community, there is a strong emphasis on family and community security, with the expectation that individuals prioritize the well-being of the group over personal freedom. Additionally, my lower middle-class status means that I have to prioritize practical concerns such as financial stability and access to resources. Therefore, considering these factors, I believe that security is more important than freedom.\n\n2"]}, {"persona": {"region": "Qena", "sex": "male", "age": 40, "country": "Egypt", "marital_status": "single", "education": "middle", "social_class": "lower middle class"}, "question": {"id": "Q150", "variant": 0}, "response": ["Based on the anthropological framework, it is important to consider the individual values and personal experiences of the persona described. As a single male from Qena, Egypt, who considers himself part of the lower middle class, freedom may be a more important value due to potential experiences with limited personal autonomy and opportunities. Additionally, the cultural context of Egypt, with its history of political unrest and limited economic opportunities for the lower middle class, may lead to a prioritization of freedom as a means to improve one's circumstances. Therefore, the persona would likely choose option (1) Freedom."]}, {"persona": {"region": "Qena", "sex": "male", "age": 30, "country": "Egypt", "marital_status": "single", "education": "middle", "social_class": "working class"}, "question": {"id": "Q150", "variant": 0}, "response": ["Based on my personal experience and socioeconomic background, as a working-class male from Qena, Egypt, I value security over freedom. In my cultural context, stability and safety are crucial for survival and providing for my family. I have seen the impact of insecurity in my community, and it has made me prioritize security above all else. Additionally, my age and educational level have shaped my perspective in understanding the importance of stability and predictability in life. Therefore, I choose option 2. \n\n2"]}]