[{"persona": {"region": "Fayoum", "sex": "male", "age": 46, "country": "Egypt", "marital_status": "married", "education": "higher", "social_class": "lower middle class"}, "question": {"id": "Q199", "variant": 0}, "response": ["Based on the anthropological framework, as a married male from Fayoum, Egypt, my cultural context and socioeconomic background play a significant role in shaping my interest in politics. The Egyptian society, including Fayoum, has a long history of political involvement and engagement. Additionally, my age and education level have equipped me with the knowledge and critical thinking skills to understand and participate in politics. However, being part of the lower middle class, I may have limited resources and time to fully engage in political activities. Therefore, I would consider myself somewhat interested in politics, as I am aware of its importance but may not have the capacity to be fully involved.\n\n2"]}, {"persona": {"region": "Fayoum", "sex": "female", "age": 30, "country": "Egypt", "marital_status": "married", "education": "middle", "social_class": "lower middle class"}, "question": {"id": "Q199", "variant": 0}, "response": ["Based on the anthropological framework, I, as a married female from Fayoum, Egypt, would answer the question of how interested I am in politics based on my cultural context, individual values, and socioeconomic background. In my community, women are often not encouraged to be involved in politics, and my lower middle-class status means that I may not have had the same educational opportunities as others. Additionally, my age and place in society play a role in how I perceive politics. Based on these factors, I would choose option (3) Not very interested in politics. \n\n3"]}, {"persona": {"region": "Fayoum", "sex": "male", "age": 60, "country": "Egypt", "marital_status": "married", "education": "higher", "social_class": "working class"}, "question": {"id": "Q199", "variant": 0}, "response": ["Based on the anthropological framework, as a married male from Fayoum, Egypt, my emic perspective on politics is influenced by my cultural context, individual values, and socioeconomic background. In Egypt, politics plays a significant role in everyday life and is deeply embedded in the cultural fabric. Additionally, my higher education level has provided me with a deeper understanding of political matters, and as part of the working class, I am directly impacted by government policies and decisions. Therefore, I am very interested in politics as it directly affects my life and the lives of those around me.\n\n1"]}, {"persona": {"region": "Fayoum", "sex": "male", "age": 20, "country": "Egypt", "marital_status": "single", "education": "middle", "social_class": "lower middle class"}, "question": {"id": "Q199", "variant": 0}, "response": ["From an emic perspective, as a single male from Fayoum, Egypt, my cultural context and socioeconomic background play a significant role in shaping my interest in politics. Being part of the lower middle class and having completed only middle education, my access to information and resources about politics may be limited. Additionally, the cultural context of Egypt, with its complex political landscape and historical context, may also influence my level of interest. Furthermore, my individual values and personal experiences, as well as my age and place, also factor into my perception of politics. Considering these factors, I would say that I am somewhat interested in politics, as I may not have the same level of access or resources as someone from a different socioeconomic background or educational level.\n\n2"]}, {"persona": {"region": "Fayoum", "sex": "female", "age": 39, "country": "Egypt", "marital_status": "married", "education": "higher", "social_class": "lower middle class"}, "question": {"id": "Q199", "variant": 0}, "response": ["Based on the anthropological framework, as a married female from Fayoum, Egypt, my emic perspective on politics is influenced by my cultural context, individual values, and socioeconomic background. In Egypt, politics plays a significant role in daily life, and as a woman, I am particularly concerned about issues that directly affect my family and community. My higher education level has provided me with the knowledge and critical thinking skills to understand the importance of political engagement and its impact on societal change. However, as part of the lower middle class, I also have to prioritize providing for my family and may not have the time or resources to fully engage in political activities. Therefore, my interest in politics is somewhat interested.\n\n2"]}, {"persona": {"region": "Fayoum", "sex": "male", "age": 33, "country": "Egypt", "marital_status": "married", "education": "higher", "social_class": "working class"}, "question": {"id": "Q199", "variant": 0}, "response": ["Based on the anthropological framework, as a married male from Fayoum, Egypt, my emic perspective on politics is influenced by my cultural context, individual values, and socioeconomic background. Politics plays a significant role in the everyday lives of people in Egypt, and as a member of the working class, I am particularly affected by political decisions and policies. My personal experience and values also shape my interest in politics, as I have witnessed the impact of political decisions on my family and community. Additionally, the cultural relativism within Egypt means that politics is viewed as an integral part of life, and my age and educational background have also influenced my understanding of political issues. Therefore, my interest in politics is best represented by the following option:\n\n2"]}, {"persona": {"region": "Port Said", "sex": "female", "age": 45, "country": "Egypt", "marital_status": "married", "education": "higher", "social_class": "lower middle class"}, "question": {"id": "Q199", "variant": 0}, "response": ["Based on the anthropological framework, my emic perspective as a woman from Port Said, Egypt, would be influenced by the cultural context of my community, my individual values and personal experience, as well as my socioeconomic background. In Egypt, there is a strong cultural emphasis on family and community, and as a lower middle class woman, I would likely have limited access to political power and decision-making. Additionally, my personal experience and values may prioritize my family and community over political engagement. Therefore, I would choose option 3: Not very interested in politics."]}, {"persona": {"region": "Port Said", "sex": "male", "age": 42, "country": "Egypt", "marital_status": "married", "education": "middle", "social_class": "lower middle class"}, "question": {"id": "Q199", "variant": 0}, "response": ["From an anthropological perspective, my emic and etic perspective as a married male from Port Said, Egypt, heavily influences my level of interest in politics. The cultural context in which I live, with its history of political unrest and social inequalities, has a significant impact on my views. Additionally, my individual values and personal experiences, coupled with my lower middle-class socioeconomic background, shape my perception of politics and the role it plays in my life. Furthermore, the nuanced phrasing of the question and the influence of space and time also play a role in my response. Given all of these factors, I would choose option (2) Somewhat interested."]}, {"persona": {"region": "Port Said", "sex": "male", "age": 28, "country": "Egypt", "marital_status": "single", "education": "middle", "social_class": "lower middle class"}, "question": {"id": "Q199", "variant": 0}, "response": ["Based on the anthropological framework, as a single male from Port Said, Egypt, at 28 years of age and part of the lower middle class, my emic perspective on politics is influenced by the cultural context of my community. I have been shaped by my personal experiences and individual values, as well as my socioeconomic background. In Port Said, politics may be seen as a way to address social and economic issues that affect my community, and therefore I am somewhat interested in politics. Additionally, the nuance of the question allows me to consider the specific political climate in Egypt and how it directly impacts my life and future prospects.\n\n2"]}, {"persona": {"region": "Port Said", "sex": "female", "age": 30, "country": "Egypt", "marital_status": "married", "education": "higher", "social_class": "lower middle class"}, "question": {"id": "Q199", "variant": 0}, "response": ["Based on the anthropological framework, my emic perspective as a married female from Port Said, Egypt, with a higher education level and lower middle-class background, would be heavily influenced by the cultural context of my community and personal experiences. In Egypt, politics plays a significant role in everyday life, with a strong sense of national identity and civic engagement. My socioeconomic background also impacts my level of interest in politics, as individuals from lower middle-class backgrounds often have a vested interest in issues related to economic policies and social welfare. Additionally, my age and place of residence in Port Said would further shape my political attitudes. Therefore, my chosen answer is: \n\n2"]}, {"persona": {"region": "Port Said", "sex": "male", "age": 30, "country": "Egypt", "marital_status": "divorced", "education": "middle", "social_class": "lower middle class"}, "question": {"id": "Q199", "variant": 0}, "response": ["From an emic perspective, as a divorced male from Port Said, Egypt, who is 30 years old and part of the lower middle class, my cultural context, individual values, and personal experience all play a significant role in shaping my interest in politics. In Egypt, politics has a direct impact on people's daily lives and socioeconomic backgrounds, influencing their views and level of interest. Additionally, my middle education level and limited exposure to political engagement may also impact my interest in politics. Therefore, I would be somewhat interested in politics as it directly affects my life and the lives of those around me.\n\n2"]}, {"persona": {"region": "Port Said", "sex": "female", "age": 19, "country": "Egypt", "marital_status": "single", "education": "middle", "social_class": "lower middle class"}, "question": {"id": "Q199", "variant": 0}, "response": ["Based on my cultural context as a single female from Port Said, Egypt, my socioeconomic background as part of the lower middle class, and my age of 19, I have had limited exposure to formal education and resources. The political landscape in Egypt may also be different from that of other countries, and my personal experience and values may shape my interest in politics. Additionally, the nuances of the question and the language used to ask it will influence my response. Therefore, considering all these factors, I would choose option (2) Somewhat interested, as I may have some level of interest in politics due to my age and the cultural context in which I live, but my limited education and social status may also impact my level of interest."]}, {"persona": {"region": "Fayoum", "sex": "male", "age": 40, "country": "Egypt", "marital_status": "married", "education": "middle", "social_class": "working class"}, "question": {"id": "Q199", "variant": 0}, "response": ["Based on the anthropological framework, as a married male from Fayoum, Egypt, my emic perspective on politics is influenced by my cultural context, socioeconomic background, and personal experience. In Egypt, the political climate and government policies directly impact my life and livelihood. As a member of the working class, I am particularly affected by political decisions regarding labor laws, wages, and social services. Additionally, my age and education level have shaped my understanding of politics and its importance in shaping the future for my family and community. Therefore, I would say that I am \"very interested\" in politics.\n\n1"]}, {"persona": {"region": "Fayoum", "sex": "male", "age": 23, "country": "Egypt", "marital_status": "single", "education": "higher", "social_class": "lower middle class"}, "question": {"id": "Q199", "variant": 0}, "response": ["Based on my personal experience and socioeconomic background, I have grown up in a lower middle-class family in Fayoum, Egypt. In my community, there is a strong emphasis on the importance of education and the potential for upward mobility through hard work and perseverance. This has shaped my individual values and personal experience, leading me to be somewhat interested in politics. I have witnessed the impact of political decisions on my family and community, and I understand the significance of being informed and engaged in political matters. However, I also recognize the limitations of my influence as a young person from a lower middle-class background, which can lead to a sense of disconnection and lack of enthusiasm for political engagement. Given these factors, I would choose option (2) Somewhat interested."]}, {"persona": {"region": "Fayoum", "sex": "female", "age": 38, "country": "Egypt", "marital_status": "married", "education": "middle", "social_class": "lower middle class"}, "question": {"id": "Q199", "variant": 0}, "response": ["Based on the anthropological framework, as a married woman from Fayoum, Egypt, my emic perspective on politics is influenced by my cultural context, individual values, and socioeconomic background. In my community, women are often expected to focus on domestic responsibilities and family matters, which may limit my exposure to politics. Additionally, my lower middle class socioeconomic background may mean that I have limited access to political information and resources. Therefore, I would consider myself to be somewhat interested in politics, as I may have some level of awareness and concern, but my personal and cultural context may limit my direct involvement or engagement. \n\n2"]}, {"persona": {"region": "Fayoum", "sex": "male", "age": 32, "country": "Egypt", "marital_status": "married", "education": "middle", "social_class": "lower middle class"}, "question": {"id": "Q199", "variant": 0}, "response": ["From an anthropological perspective, my emic perspective as a married male from Fayoum, Egypt, who is 32 years old and part of the lower middle class, would be influenced by my cultural context, individual values, and socioeconomic background. In Egypt, politics plays a significant role in everyday life, and my cultural context would lead me to have a higher level of interest in politics compared to individuals from different cultural backgrounds. Additionally, my socioeconomic background may also influence my interest in politics, as individuals from lower middle-class backgrounds may have a greater stake in political decisions that impact their daily lives. Therefore, based on these factors, I would choose the option indicating a high level of interest in politics.\n\n2"]}, {"persona": {"region": "Fayoum", "sex": "male", "age": 31, "country": "Egypt", "marital_status": "married", "education": "higher", "social_class": "working class"}, "question": {"id": "Q199", "variant": 0}, "response": ["Based on the anthropological framework, my emic perspective as a married male from Fayoum, Egypt, who is 31 years old and considers himself part of the working class, heavily influences my interest in politics. The cultural context of Egypt, with its history of political upheaval and government instability, has shaped my understanding and perception of politics. My personal experience of living in a society with limited political freedoms and socioeconomic background as a working-class individual also plays a significant role in my level of interest. Additionally, the nuance of the question itself, as well as my individual values, further guide my response. Therefore, my chosen answer is:\n\n2"]}, {"persona": {"region": "Fayoum", "sex": "male", "age": 31, "country": "Egypt", "marital_status": "married", "education": "middle", "social_class": "lower middle class"}, "question": {"id": "Q199", "variant": 0}, "response": ["Based on my emic perspective as a married male from Fayoum, Egypt, I am influenced by the cultural context of my community, where politics play a significant role in everyday life. My individual values and personal experience also shape my perception, as I have witnessed the impact of political decisions on my family and community. Additionally, my socioeconomic background as part of the lower middle class means that political decisions directly impact my livelihood. Considering cultural relativism, I understand the importance of politics in shaping the future of my community and country. Moreover, my age and place of residence further influence my interest in politics, as I am at a stage where I am concerned about the well-being of my family and the future prospects for my children. Therefore, my interest in politics is best characterized as somewhat interested.\n2"]}, {"persona": {"region": "Fayoum", "sex": "female", "age": 32, "country": "Egypt", "marital_status": "married", "education": "middle", "social_class": "lower middle class"}, "question": {"id": "Q199", "variant": 0}, "response": ["From the perspective of a married female from Fayoum, Egypt, who is 32 years old, completed middle education level, and considers herself part of the lower middle class, several factors influence her level of interest in politics. Her cultural context, including her socioeconomic background and educational level, may limit her access to political information and involvement in political activities. Additionally, her individual values and personal experiences may lead her to prioritize other aspects of her life over political engagement. Furthermore, the cultural relativism within her community may shape her perception of politics and its relevance to her daily life. Taking into account these factors, the persona would likely choose the option:\n\n3"]}, {"persona": {"region": "Ismailia", "sex": "male", "age": 53, "country": "Egypt", "marital_status": "married", "education": "middle", "social_class": "lower middle class"}, "question": {"id": "Q199", "variant": 0}, "response": ["Based on the anthropological framework, my personal experience and socioeconomic background heavily influence my perspective on politics. As a married male from Ismailia, Egypt, I come from a lower middle-class background and have only completed middle education. This has limited my access to political information and opportunities for participation. Additionally, my cultural context and age play a role in shaping my views on politics. Given these factors, I would choose option 3: Not very interested in politics.\n\n3"]}, {"persona": {"region": "Ismailia", "sex": "male", "age": 38, "country": "Egypt", "marital_status": "married", "education": "higher", "social_class": "working class"}, "question": {"id": "Q199", "variant": 0}, "response": ["Based on the anthropological framework, as a married male from Ismailia, Egypt, who is 38 years old, completed higher education, and considers myself part of the working class, my perspective on politics is heavily influenced by my cultural context, individual values, and socioeconomic background. In Egypt, politics play a significant role in everyday life and are deeply intertwined with cultural norms and traditions. Additionally, my education level and socioeconomic background may impact the extent to which I am able to engage with and understand political processes. As a member of the working class, I may also have specific concerns and priorities that influence my interest in politics. Therefore, I would choose the following option:\n\n2"]}, {"persona": {"region": "Ismailia", "sex": "female", "age": 35, "country": "Egypt", "marital_status": "married", "education": "middle", "social_class": "lower middle class"}, "question": {"id": "Q199", "variant": 0}, "response": ["Based on the anthropological framework, as a married female from Ismailia, Egypt, my emic perspective on politics is influenced by my cultural context, individual values, and socioeconomic background. In Egypt, there are traditional gender roles and expectations that may limit my access to political engagement. Additionally, as a lower middle-class woman with a middle education level, I may have limited resources and opportunities to participate in political activities. Therefore, I would choose option 3: Not very interested in politics, as my personal experience and cultural context may lead me to prioritize other aspects of my life."]}, {"persona": {"region": "Ismailia", "sex": "female", "age": 57, "country": "Egypt", "marital_status": "married", "education": "lower", "social_class": "working class"}, "question": {"id": "Q199", "variant": 0}, "response": ["Based on the anthropological framework, as a married female from Ismailia, Egypt, my emic perspective on politics is shaped by my cultural context, individual values, and socioeconomic background. In Egypt, politics is deeply intertwined with everyday life and has a significant impact on my family and community. Additionally, as a working-class woman with a lower education level, I may have limited access to political information and resources. My age and place also play a role, as older generations in Egypt may have different perspectives on politics compared to younger generations. Considering all these factors, I would choose option (2) Somewhat interested. \n\n2"]}, {"persona": {"region": "Ismailia", "sex": "male", "age": 33, "country": "Egypt", "marital_status": "married", "education": "middle", "social_class": "lower middle class"}, "question": {"id": "Q199", "variant": 0}, "response": ["Based on the anthropological framework, my emic perspective as a married male from Ismailia, Egypt, with a middle education level and lower middle-class background, is influenced by my cultural context, individual values, and socioeconomic background. In Egypt, politics plays a significant role in daily life and decision-making processes. Additionally, my personal experiences and values have been shaped by the political landscape of Egypt, which has often impacted my socio-economic standing. As a result, I am somewhat interested in politics, as I recognize its importance in shaping my community and my own life.\n\n2"]}, {"persona": {"region": "Ismailia", "sex": "female", "age": 49, "country": "Egypt", "marital_status": "single", "education": "higher", "social_class": "upper middle class"}, "question": {"id": "Q199", "variant": 0}, "response": ["From an anthropological perspective, my emic and etic perspectives as a single female from Ismailia, Egypt, who is 49 years old, highly educated, and considers herself part of the upper middle class, greatly influence my level of interest in politics. My cultural context, individual values, and personal experiences have shaped my understanding of the political landscape in Egypt and the world. Additionally, my socioeconomic background and nuanced understanding of political issues have further shaped my perspective. Given all these factors, my interest in politics would be best represented by the following option:\n\n2"]}, {"persona": {"region": "Ismailia", "sex": "female", "age": 35, "country": "Egypt", "marital_status": "married", "education": "higher", "social_class": "lower middle class"}, "question": {"id": "Q199", "variant": 0}, "response": ["Based on the anthropological framework, my cultural context as a married female from Ismailia, Egypt, my age, education level, and lower middle-class socioeconomic background all influence my perspective on politics. In my cultural context, women are not traditionally encouraged to be involved in politics, and there are limited opportunities for political participation. Additionally, my personal experience and values shape my view, and I may prioritize other aspects of life over political involvement. Therefore, I would select option 3: Not very interested in politics."]}, {"persona": {"region": "Ismailia", "sex": "male", "age": 24, "country": "Egypt", "marital_status": "single", "education": "higher", "social_class": "upper middle class"}, "question": {"id": "Q199", "variant": 0}, "response": ["Based on the anthropological framework, my emic perspective as a single male from Ismailia, Egypt, at 24 years old and with a higher education level, leads me to value the importance of political engagement and understanding. Growing up in a culturally rich and politically active environment, I have been exposed to the significance of participating in the political process. Additionally, my upper middle class status has provided me with the resources and opportunities to stay informed and involved in political matters. Therefore, I am very interested in politics.\n\n1"]}, {"persona": {"region": "Ismailia", "sex": "female", "age": 23, "country": "Egypt", "marital_status": "single", "education": "higher", "social_class": "lower middle class"}, "question": {"id": "Q199", "variant": 0}, "response": ["Based on the anthropological framework, my emic perspective as a single female from Ismailia, Egypt, who is 23 years old and part of the lower middle class, is influenced by my cultural context, individual values, and socioeconomic background. In Egypt, there is a strong cultural emphasis on family and community, and as a young woman in a lower middle class family, I have been taught to prioritize practical matters such as education and work. Additionally, my personal experiences and values have shaped my view on politics, as I have seen the impact of political decisions on my family's financial stability. Considering these factors, I would be somewhat interested in politics, as I recognize the importance of being informed and engaged in the political process, but my primary focus remains on improving my own economic situation.\n\n2"]}, {"persona": {"region": "Ismailia", "sex": "male", "age": 55, "country": "Egypt", "marital_status": "married", "education": "middle", "social_class": "lower middle class"}, "question": {"id": "Q199", "variant": 0}, "response": ["From an anthropological perspective, my emic perspective as a married male from Ismailia, Egypt, shapes my understanding and interest in politics. The cultural context of Egypt, including its history, language, and social structures, influences my perception of politics. Additionally, my individual values and personal experiences, as well as my lower middle class socioeconomic background, play a significant role in shaping my interest in politics. As a 55-year-old, I have witnessed and experienced various political changes and events in Egypt, which have shaped my understanding and level of interest in politics. Therefore, based on my personal and cultural context, I would choose option (2) Somewhat interested in politics. \n\n2"]}, {"persona": {"region": "Ismailia", "sex": "male", "age": 57, "country": "Egypt", "marital_status": "married", "education": "middle", "social_class": "upper middle class"}, "question": {"id": "Q199", "variant": 0}, "response": ["Based on the anthropological framework, as a married male from Ismailia, Egypt, and part of the upper middle class, my perspective is influenced by my cultural context, individual values, and socioeconomic background. In Egypt, politics play a significant role in shaping the social and economic landscape, and being part of the upper middle class means that I may have a vested interest in political affairs that directly impact my socioeconomic status. Additionally, my age and level of education may have provided me with a nuanced understanding of political issues. Therefore, I would be \"Very interested\" in politics.\n\n1"]}, {"persona": {"region": "Ismailia", "sex": "female", "age": 29, "country": "Egypt", "marital_status": "married", "education": "middle", "social_class": "upper middle class"}, "question": {"id": "Q199", "variant": 0}, "response": ["Based on the anthropological framework, I, as a married female from Ismailia, Egypt, would approach this question from the cultural context, individual values and personal experience, and socioeconomic background. In Egypt, politics plays a significant role in shaping people's lives, and as someone from the upper middle class, I am more likely to have access to information and resources that allow me to engage with politics. Additionally, being a 29-year-old woman with a middle education level, I may have been exposed to political discussions and may have developed a personal interest in politics. Therefore, I would choose:\n\n2"]}, {"persona": {"region": "Damiatta", "sex": "female", "age": 46, "country": "Egypt", "marital_status": "married", "education": "middle", "social_class": "lower middle class"}, "question": {"id": "Q199", "variant": 0}, "response": ["Based on the anthropological framework, as a 46-year-old married female from Damiatta, Egypt, with a middle education level and lower middle class background, my perspective on politics is influenced by my cultural context, individual values, and socioeconomic background. In Egypt, politics plays a significant role in daily life, and as a member of the lower middle class, I am directly impacted by government policies and decisions. Additionally, my age and education level have provided me with some understanding of political issues, leading to a moderate interest in politics. Furthermore, as a woman in Egypt, I am aware of the importance of political participation and the impact it has on my rights and opportunities. Therefore, my interest in politics is somewhat interested.\n\n2"]}, {"persona": {"region": "Damiatta", "sex": "female", "age": 20, "country": "Egypt", "marital_status": "single", "education": "middle", "social_class": "lower middle class"}, "question": {"id": "Q199", "variant": 0}, "response": ["Based on the anthropological framework, my emic perspective as a single female from Damiatta, Egypt, emphasizes the cultural context, individual values, and socioeconomic background. In Damiatta, politics may not be a common topic of discussion, especially for someone of my socioeconomic background and level of education. Additionally, as a young woman, my interests and priorities may not align with those of the political sphere. Therefore, I would choose option (3) Not very interested in politics."]}, {"persona": {"region": "Damiatta", "sex": "male", "age": 19, "country": "Egypt", "marital_status": "single", "education": "middle", "social_class": "lower middle class"}, "question": {"id": "Q199", "variant": 0}, "response": ["Based on the anthropological framework, my emic perspective as a single male from Damiatta, Egypt, and my etic perspective as a member of the lower middle class will heavily influence my interest in politics. The cultural context of Egypt, with its history of political unrest and economic challenges, will also play a significant role. Additionally, my individual values and personal experiences, as well as my socioeconomic background, will shape my perception of politics. Given all these factors, I would choose the option (2) Somewhat interested in politics."]}, {"persona": {"region": "Damiatta", "sex": "female", "age": 33, "country": "Egypt", "marital_status": "married", "education": "higher", "social_class": "lower middle class"}, "question": {"id": "Q199", "variant": 0}, "response": ["From the perspective of a married female from Damiatta, Egypt, with a higher education level and lower middle class background, my answer to the question of how interested I am in politics is somewhat interested. This answer is influenced by my cultural context, where political engagement is important but limited by societal and gender roles. My personal experience and values also play a role, as I have been exposed to political discussions and have a basic understanding of its importance, but my socioeconomic background means that I may not have the resources or time to fully engage in political activities. Additionally, my age and place in society also shape my interest in politics, as I may be more focused on immediate concerns such as family and work. Overall, my nuanced understanding of politics leads me to be somewhat interested in the topic.\n\n2"]}, {"persona": {"region": "Damiatta", "sex": "male", "age": 24, "country": "Egypt", "marital_status": "single", "education": "higher", "social_class": "lower middle class"}, "question": {"id": "Q199", "variant": 0}, "response": ["Based on the anthropological framework described above, as a single male from Damiatta, Egypt, who is 24 years old and part of the lower middle class, my individual values and personal experience play a significant role in shaping my interest in politics. Growing up in a socioeconomically diverse community has exposed me to the various challenges and opportunities that exist within our society. Additionally, my completion of higher education has heightened my awareness of the political landscape and its impact on my future. Therefore, I am somewhat interested in politics, as I recognize the importance of staying informed and engaged in the decision-making processes that affect my life.\n\n2"]}, {"persona": {"region": "Suez", "sex": "male", "age": 41, "country": "Egypt", "marital_status": "married", "education": "middle", "social_class": "working class"}, "question": {"id": "Q199", "variant": 0}, "response": ["Based on the anthropological framework, as a married male from Suez, Egypt, my emic perspective on politics is highly influenced by the cultural context of my environment. Egypt has a complex political history and the current socioeconomic background of the working class often leads to a distrust of political institutions. Additionally, my individual values and personal experience as a middle-educated working-class individual have shaped my subjective understanding of politics, leading to a somewhat interested stance. Furthermore, cultural relativism plays a role in my perspective as I understand that politics in Egypt may not be perceived the same way in other cultures. Therefore, my nuanced understanding of politics reflects a somewhat interested stance.\n\n2"]}, {"persona": {"region": "Suez", "sex": "female", "age": 39, "country": "Egypt", "marital_status": "divorced", "education": "middle", "social_class": "working class"}, "question": {"id": "Q199", "variant": 0}, "response": ["Based on the anthropological framework, as a divorced female from Suez, Egypt, at the age of 39 and with a middle education level, my perspective on politics is influenced by my cultural context, individual values, and socioeconomic background. In Egypt, politics is deeply intertwined with everyday life, and as a member of the working class, I am directly affected by political decisions. Additionally, my personal experience as a divorced woman may also shape my interest in politics, as I may be more attuned to issues related to women's rights and social justice. Therefore, I would consider myself (2) somewhat interested in politics as it directly impacts my life and the lives of those around me."]}, {"persona": {"region": "Cairo", "sex": "female", "age": 55, "country": "Egypt", "marital_status": "married", "education": "middle", "social_class": "working class"}, "question": {"id": "Q199", "variant": 0}, "response": ["Based on the anthropological framework, my response will be influenced by my emic perspective as a married female from Cairo, Egypt, my cultural context, individual values and personal experience, and my socioeconomic background as part of the working class. In Egypt, politics play a significant role in everyday life, and as a member of the working class, I have experienced firsthand the impact of political decisions on my family and community. Additionally, my age and education level have provided me with a deeper understanding of the political landscape in Egypt. Therefore, my response will reflect my nuanced understanding of politics in my cultural context.\n\n2"]}, {"persona": {"region": "Cairo", "sex": "male", "age": 58, "country": "Egypt", "marital_status": "married", "education": "middle", "social_class": "lower middle class"}, "question": {"id": "Q199", "variant": 0}, "response": ["Based on the anthropological framework, I, as a married male from Cairo, Egypt, understand that my cultural context, socioeconomic background, and personal experience greatly influence my perspective on politics. In Egypt, politics play a significant role in daily life, and as a middle-aged man from the lower middle class, I have experienced the impact of political decisions on my family and community. Additionally, my limited education level may have shaped my understanding of political issues. Therefore, I would choose the option: (2) Somewhat interested."]}, {"persona": {"region": "Cairo", "sex": "female", "age": 29, "country": "Egypt", "marital_status": "married", "education": "higher", "social_class": "lower middle class"}, "question": {"id": "Q199", "variant": 0}, "response": ["Based on the anthropological framework, my cultural context as a married female from Cairo, Egypt, with a lower middle-class background, and having completed higher education, significantly influences my perspective on politics. As a member of this specific cultural and socioeconomic group, I am aware of the importance of politics in shaping my everyday life, as well as the lives of my family and community. Additionally, my personal values and experiences have led me to recognize the impact of political decisions on issues such as healthcare, education, and employment opportunities. Therefore, my interest in politics is rooted in the understanding that it directly affects my quality of life and the well-being of those around me.\n\n2"]}, {"persona": {"region": "Cairo", "sex": "male", "age": 38, "country": "Egypt", "marital_status": "married", "education": "higher", "social_class": "lower middle class"}, "question": {"id": "Q199", "variant": 0}, "response": ["Based on the anthropological framework, my perspective as a married male from Cairo, Egypt, at the age of 38 and part of the lower middle class is heavily influenced by my cultural context, individual values, and socioeconomic background. Living in Cairo, I am surrounded by the political and social turmoil that has shaped my understanding of politics. My education level has also exposed me to different political ideologies and systems. As a member of the lower middle class, I am concerned with daily struggles and providing for my family, which may limit the time and resources I can dedicate to political engagement. Therefore, I would choose option (2) Somewhat interested. \n\n2"]}, {"persona": {"region": "Cairo", "sex": "female", "age": 40, "country": "Egypt", "marital_status": "married", "education": "higher", "social_class": "lower middle class"}, "question": {"id": "Q199", "variant": 0}, "response": ["Based on the anthropological framework, my emic perspective as a married female from Cairo, Egypt, at the age of 40 with a higher education level and considering myself part of the lower middle class, is influenced by my cultural context, individual values, and socioeconomic background. In Egypt, politics play a significant role in shaping everyday life, and my personal experience and values lead me to be somewhat interested in politics. I believe that being informed about political matters is important for the well-being of my family and community, and my socioeconomic background as a lower middle class individual also motivates me to stay engaged in political issues. Therefore, my choice is:\n2"]}, {"persona": {"region": "Cairo", "sex": "male", "age": 38, "country": "Egypt", "marital_status": "married", "education": "higher", "social_class": "upper middle class"}, "question": {"id": "Q199", "variant": 0}, "response": ["From an emic perspective, as a married male from Cairo, Egypt, my interest in politics is heavily influenced by the cultural and socioeconomic background of my community. The cultural context of Egypt places a high value on political engagement and awareness, especially in the wake of recent political changes and developments. Additionally, my higher education level has exposed me to the importance of political involvement and the impact it can have on society. As part of the upper middle class, I have a vested interest in political affairs that directly affect my social and economic standing. Considering these factors, my personal experience and individual values lead me to be very interested in politics.\n\n1"]}, {"persona": {"region": "Cairo", "sex": "male", "age": 59, "country": "Egypt", "marital_status": "married", "education": "middle", "social_class": "lower middle class"}, "question": {"id": "Q199", "variant": 0}, "response": ["From an anthropological perspective, my emic understanding of politics is influenced by my cultural context, individual values, and socioeconomic background. As a married male from Cairo, Egypt, I am part of a society with a rich history of political activism and a strong sense of community. Additionally, my lower middle-class status and middle education level have shaped my personal experience and values, leading me to prioritize issues of economic stability and social welfare. Given these factors, I would say that I am somewhat interested in politics as I believe in the importance of participating in the democratic process and advocating for the betterment of my community.\n\n2"]}, {"persona": {"region": "Cairo", "sex": "female", "age": 30, "country": "Egypt", "marital_status": "married", "education": "higher", "social_class": "upper middle class"}, "question": {"id": "Q199", "variant": 0}, "response": ["From an anthropological perspective, my emic perspective as a married female from Cairo, Egypt, is shaped by my cultural context, individual values, and socioeconomic background. In Egypt, politics plays a significant role in daily life and is intertwined with cultural and social dynamics. As a well-educated woman from the upper middle class, I am highly aware of the impact of political decisions on my community and family. Additionally, my personal experiences and values have led me to prioritize political engagement and advocacy for social change. Therefore, I would choose option (1) Very interested in politics."]}, {"persona": {"region": "Cairo", "sex": "male", "age": 22, "country": "Egypt", "marital_status": "single", "education": "middle", "social_class": "lower middle class"}, "question": {"id": "Q199", "variant": 0}, "response": ["Based on the anthropological framework, my emic perspective as a single male from Cairo, Egypt, at 22 years of age and part of the lower middle class is influenced by my cultural context, individual values and personal experience, and socioeconomic background. In Egypt, politics play a significant role in everyday life, and my personal experience and values have shaped my interest in politics. Additionally, my socioeconomic background as a lower middle class individual means that political decisions directly impact my life and future. Therefore, my interest in politics is somewhat interested.\n\n2"]}, {"persona": {"region": "Cairo", "sex": "male", "age": 29, "country": "Egypt", "marital_status": "single", "education": "higher", "social_class": "lower middle class"}, "question": {"id": "Q199", "variant": 0}, "response": ["Based on the anthropological framework, my perspective as a single male from Cairo, Egypt, who is 29 years old, has completed higher education, and considers myself part of the lower middle class, is shaped by my individual values and personal experience, cultural context, and socioeconomic background. As a member of a society with a rich political history and ongoing political struggles, I am highly interested in politics as it directly affects my daily life and future opportunities. Additionally, my cultural context and personal experiences have exposed me to the impact of political decisions on my community and family. My lower middle class socioeconomic background has also made me acutely aware of the importance of political decisions on economic policies and opportunities for advancement. Therefore, my interest in politics is significant and is driven by a combination of individual values, cultural context, and socioeconomic background.\n\n2"]}, {"persona": {"region": "Cairo", "sex": "female", "age": 31, "country": "Egypt", "marital_status": "married", "education": "higher", "social_class": "lower middle class"}, "question": {"id": "Q199", "variant": 0}, "response": ["Based on the anthropological framework, as a married female from Cairo, Egypt, cultural context and individual values play a significant role in my perspective. Egypt has a rich history of political activism and my personal experience living in a country with a complex political landscape has shaped my interest in politics. Additionally, being part of the lower middle class, socioeconomic background is also a factor as political decisions directly impact my family and community. Furthermore, as a woman in Egypt, I am aware of the importance of being engaged in politics to advocate for gender equality and women's rights. Therefore, I would choose option (2) Somewhat interested in politics."]}, {"persona": {"region": "Cairo", "sex": "male", "age": 59, "country": "Egypt", "marital_status": "married", "education": "higher", "social_class": "upper middle class"}, "question": {"id": "Q199", "variant": 0}, "response": ["Based on the anthropological framework, my cultural context, individual values, and personal experience play a significant role in shaping my perspective on politics. As a married male from Cairo, Egypt, I come from a culture with a long history of political upheaval and have personally experienced the impact of political decisions on my life. My higher education level has also exposed me to various political ideologies and theories, further shaping my interest in politics. Additionally, being part of the upper middle class, I am more likely to have a stake in political decisions and policies. Therefore, I would consider myself very interested in politics.\n\n2"]}, {"persona": {"region": "Cairo", "sex": "male", "age": 27, "country": "Egypt", "marital_status": "single", "education": "middle", "social_class": "working class"}, "question": {"id": "Q199", "variant": 0}, "response": ["From the perspective of a single male from Cairo, Egypt, who completed middle education level and considers himself part of the working class, the response to the question of interest in politics will be influenced by the cultural context, individual values, and socioeconomic background. In Egypt, politics plays a significant role in everyday life, and individuals from the working class are often directly impacted by government policies and decisions. Additionally, the experience of living in Cairo, a city with a rich political history and a diverse population, may also shape the individual's interest in politics. Considering these factors, the persona may select the option (2) Somewhat interested, as they may have a moderate level of interest in politics due to their socioeconomic background and cultural context. \n\n2"]}, {"persona": {"region": "Cairo", "sex": "female", "age": 25, "country": "Egypt", "marital_status": "single", "education": "higher", "social_class": "working class"}, "question": {"id": "Q199", "variant": 0}, "response": ["From an emic perspective, as a single female from Cairo, Egypt, my cultural context and individual values play a significant role in shaping my interest in politics. Being part of the working class and having completed higher education, I am aware of the impact politics has on my daily life and the lives of those around me. Socioeconomic background also influences my perspective, as issues such as economic opportunities, gender equality, and social welfare are important to me. Additionally, the cultural context of Egypt, with its history of political activism and recent political movements, has shaped my understanding of the importance of political engagement. Therefore, my interest in politics is reflected in my choice. \n\n2"]}, {"persona": {"region": "Cairo", "sex": "female", "age": 23, "country": "Egypt", "marital_status": "married", "education": "higher", "social_class": "lower middle class"}, "question": {"id": "Q199", "variant": 0}, "response": ["Based on the anthropological framework, as a married female from Cairo, Egypt, my emic perspective on politics is likely to be influenced by the cultural context of my environment, which includes a complex political history and ongoing social and economic challenges. My individual values and personal experiences as a young, educated woman from the lower middle class will also shape my interest in politics. Additionally, my socioeconomic background may limit my access to political participation and information. Considering the nuanced phrasing of the question, I would choose the following option:\n\n2"]}, {"persona": {"region": "Cairo", "sex": "male", "age": 58, "country": "Egypt", "marital_status": "married", "education": "higher", "social_class": "working class"}, "question": {"id": "Q199", "variant": 0}, "response": ["Based on the anthropological framework, my perspective as a married male from Cairo, Egypt, who is 58 years old, completed higher education, and considers myself part of the working class, is influenced by my cultural context, individual values, and socioeconomic background. In Egypt, politics plays a significant role in shaping daily life and opportunities, and as someone who has experienced the effects of political decisions firsthand, I am very interested in politics. Additionally, my age and education have allowed me to develop a deeper understanding of political issues, and my socioeconomic background has made me acutely aware of the impact of political decisions on the working class. Therefore, my interest in politics is a result of my cultural context, personal experience, and values, and I am confident in my choice of option (1) Very interested. \n\n1"]}, {"persona": {"region": "Cairo", "sex": "female", "age": 40, "country": "Egypt", "marital_status": "married", "education": "higher", "social_class": "working class"}, "question": {"id": "Q199", "variant": 0}, "response": ["Based on the anthropological framework, as a married female from Cairo, Egypt, my emic perspective is influenced by the cultural context of my society, where politics plays a significant role in daily life. Additionally, my individual values and personal experience as a well-educated working-class woman contribute to my interest in politics, as I have likely experienced the impact of political decisions on my life. My socioeconomic background and age also play a role, as I may have experienced the changes in political dynamics over time. Therefore, I would choose option (1) Very interested in politics.\n\n1"]}, {"persona": {"region": "Cairo", "sex": "female", "age": 36, "country": "Egypt", "marital_status": "married", "education": "middle", "social_class": "upper middle class"}, "question": {"id": "Q199", "variant": 0}, "response": ["Based on the anthropological framework, as a married female from Cairo, Egypt, my emic perspective is influenced by the cultural context of Egypt, where politics plays a significant role in everyday life and is a topic of frequent discussion. My personal experience and individual values are also shaped by the socioeconomic background of being part of the upper middle class, where political decisions and policies directly impact my family's well-being. Additionally, age and place are important factors, as being 36 years old and living in Cairo means that I have experienced various political events and changes in the country. Therefore, I am somewhat interested in politics.\n\n2"]}, {"persona": {"region": "Cairo", "sex": "male", "age": 40, "country": "Egypt", "marital_status": "married", "education": "middle", "social_class": "lower middle class"}, "question": {"id": "Q199", "variant": 0}, "response": ["Based on the anthropological framework, my emic perspective as a married male from Cairo, Egypt, who is 40 years old and part of the lower middle class, is heavily influenced by my cultural context, individual values, and socioeconomic background. In Egypt, politics play a significant role in everyday life, and my personal experiences and values shape my interest in political matters. Additionally, the cultural relativism perspective reminds me that my viewpoint is not universal and that my socioeconomic status and education level also influence my interest in politics. Given these factors, I would say that I am somewhat interested in politics.\n\n2"]}, {"persona": {"region": "Cairo", "sex": "female", "age": 30, "country": "Egypt", "marital_status": "married", "education": "middle", "social_class": "lower class"}, "question": {"id": "Q199", "variant": 0}, "response": ["Based on the anthropological framework, my emic perspective as a married female from Cairo, Egypt, with a lower socioeconomic background and limited education, is that my interest in politics is influenced by my cultural context, individual values, and personal experiences. In Egypt, there are certain cultural and societal norms that may limit my participation and interest in politics, especially as a woman from the lower class. Additionally, my limited education may also impact my understanding and engagement with political issues. Therefore, I would choose option (3) Not very interested as my answer. \n\n3"]}, {"persona": {"region": "Cairo", "sex": "male", "age": 58, "country": "Egypt", "marital_status": "married", "education": "higher", "social_class": "lower middle class"}, "question": {"id": "Q199", "variant": 0}, "response": ["Based on the anthropological framework, as a married male from Cairo, Egypt, my emic perspective is influenced by the cultural context of living in a country with a complex political history. My personal experience and individual values as someone who has completed higher education and considers myself part of the lower middle class also play a role in shaping my interest in politics. Additionally, my socioeconomic background and age are important factors in my political engagement. Considering the nuanced phrasing of the question, I would choose option (2) Somewhat interested in politics.\n\n2"]}, {"persona": {"region": "Cairo", "sex": "male", "age": 50, "country": "Egypt", "marital_status": "married", "education": "middle", "social_class": "lower middle class"}, "question": {"id": "Q199", "variant": 0}, "response": ["Based on the anthropological framework, my emic perspective as a married male from Cairo, Egypt, would be heavily influenced by my cultural context, socioeconomic background, and personal experience. In Egypt, politics plays a significant role in daily life, and being part of the lower middle class, I am likely to have experienced the impact of political decisions on my livelihood. Additionally, at 50 years of age, I have lived through various political changes and may have developed a nuanced understanding of the political landscape. Therefore, I would choose:\n\n(2) Somewhat interested"]}, {"persona": {"region": "Cairo", "sex": "female", "age": 40, "country": "Egypt", "marital_status": "married", "education": "higher", "social_class": "upper middle class"}, "question": {"id": "Q199", "variant": 0}, "response": ["Based on the anthropological framework, as a married female from Cairo, Egypt, who is 40 years old and part of the upper middle class, my perspective on politics is influenced by my cultural context, individual values, and socioeconomic background. In Egypt, politics plays a significant role in everyday life, and as an educated woman from a relatively privileged socioeconomic background, I have been exposed to political discussions and have a certain level of access to political information. However, due to cultural norms and the patriarchal nature of Egyptian society, my active participation in politics may be limited. Additionally, my individual values and personal experience may also influence my interest in politics, as I may prioritize other aspects of my life such as family, career, and social responsibilities. Therefore, my interest in politics may be somewhat influenced by these factors.\n\n2"]}, {"persona": {"region": "Cairo", "sex": "female", "age": 33, "country": "Egypt", "marital_status": "married", "education": "middle", "social_class": "lower middle class"}, "question": {"id": "Q199", "variant": 0}, "response": ["Based on my emic perspective as a married female from Cairo, Egypt, my cultural context and individual values play a significant role in shaping my interest in politics. Egypt has a long history of political turmoil and cultural context has shaped my understanding of politics as a crucial aspect of everyday life. My lower middle class socioeconomic background has also influenced my perception of politics, as it directly impacts my family's well-being. Additionally, my age and place in society as a 33-year-old woman in Cairo has exposed me to various political events, further shaping my interest. Therefore, based on my personal experience and cultural context, I would say that I am (2) Somewhat interested in politics."]}, {"persona": {"region": "Cairo", "sex": "female", "age": 37, "country": "Egypt", "marital_status": "married", "education": "middle", "social_class": "lower middle class"}, "question": {"id": "Q199", "variant": 0}, "response": ["Based on the anthropological framework, as a married female from Cairo, Egypt, with a middle education level and lower middle-class background, my perspective on politics is influenced by my cultural context, socioeconomic background, and personal experience. Living in a country with a complex political history and a diverse cultural landscape, I am aware of the importance of politics in shaping our lives. However, as a member of the lower middle class, I also have to prioritize meeting the basic needs of my family, which leaves me with limited time and resources to actively engage in political activities. Additionally, my personal experience and the societal norms in my community may have shaped my perception of the role of women in politics. Therefore, I would choose option (2) Somewhat interested in politics, as I recognize its significance but also acknowledge the constraints and priorities that affect my level of involvement. \n\n2"]}, {"persona": {"region": "Cairo", "sex": "male", "age": 28, "country": "Egypt", "marital_status": "married", "education": "middle", "social_class": "lower middle class"}, "question": {"id": "Q199", "variant": 0}, "response": ["Based on the anthropological framework, as a married male from Cairo, Egypt, my emic perspective on politics is influenced by my cultural context, individual values, socioeconomic background, and space and time. In Egypt, politics plays a significant role in everyday life, and as a middle-class individual, I am impacted by the policies and decisions made by the government. Additionally, my age and location in Cairo also contribute to my interest in politics. Furthermore, my personal experience and values, shaped by the socio-political environment in Egypt, also influence my level of interest in politics. Therefore, my answer to the question \"How interested are you in politics?\" is (2) Somewhat interested."]}, {"persona": {"region": "Cairo", "sex": "male", "age": 53, "country": "Egypt", "marital_status": "married", "education": "higher", "social_class": "working class"}, "question": {"id": "Q199", "variant": 0}, "response": ["In considering the emic and etic perspectives, cultural context, individual values and personal experience, socioeconomic background, cultural relativism, space and time, and nuance, I, as a married male from Cairo, Egypt, at 53 years of age with a working-class background and higher education, understand that my interest in politics is shaped by my personal experiences and socio-economic background. In Egypt, politics plays a significant role in everyday life, and being educated and part of the working class means that I have a vested interest in the political landscape. Additionally, my age and cultural context also contribute to my understanding and engagement with politics. Therefore, I would say I am \"Very interested\" in politics.\n\n1"]}, {"persona": {"region": "Cairo", "sex": "male", "age": 45, "country": "Egypt", "marital_status": "married", "education": "higher", "social_class": "lower middle class"}, "question": {"id": "Q199", "variant": 0}, "response": ["Based on my emic perspective as a married male from Cairo, Egypt, my interest in politics is influenced by my cultural context, individual values, and socioeconomic background. In Egypt, politics play a significant role in everyday life and have a direct impact on my family and community. Additionally, my higher education level has provided me with a deeper understanding of political systems and their effects on society. My lower middle-class status means that I am directly affected by government policies and economic decisions. Therefore, I am very interested in politics. \n\n1"]}, {"persona": {"region": "Cairo", "sex": "male", "age": 52, "country": "Egypt", "marital_status": "married", "education": "middle", "social_class": "upper middle class"}, "question": {"id": "Q199", "variant": 0}, "response": ["Based on the anthropological framework, as a married male from Cairo, Egypt, my emic perspective on politics is heavily influenced by the cultural context in which I live. Egypt has a rich history of political involvement and activism, and the cultural context emphasizes the importance of staying informed and engaged in political matters. Additionally, my socioeconomic background as part of the upper middle class means that I have access to education and resources that allow me to understand and participate in political discussions. My age also plays a role, as older individuals in Egyptian society are often respected for their wisdom and are expected to be knowledgeable about political matters. Therefore, my personal experience and cultural context lead me to be very interested in politics.\n\n1"]}, {"persona": {"region": "Cairo", "sex": "male", "age": 22, "country": "Egypt", "marital_status": "single", "education": "higher", "social_class": "lower middle class"}, "question": {"id": "Q199", "variant": 0}, "response": ["Based on the anthropological framework, as a single male from Cairo, Egypt, my emic perspective is influenced by the cultural context of the region, where politics plays a significant role in daily life. Additionally, my individual values and personal experience, as well as my socioeconomic background as a lower middle class individual, have shaped my interest in politics. The cultural relativism in Egypt also means that politics is seen as an important aspect of society. Furthermore, the space and time factor of being 22 years old and living in Cairo also contribute to my interest in politics. Therefore, my answer would be: \n\n2"]}, {"persona": {"region": "Cairo", "sex": "female", "age": 57, "country": "Egypt", "marital_status": "divorced", "education": "middle", "social_class": "lower middle class"}, "question": {"id": "Q199", "variant": 0}, "response": ["Based on the anthropological framework, as a divorced female from Cairo, Egypt, my emic perspective on politics is influenced by my cultural context, individual values, and socioeconomic background. In Egypt, politics play a significant role in everyday life, and as a member of the lower middle class, the decisions made by political leaders directly impact my livelihood. Additionally, my personal experience as a divorced woman may have influenced my views on politics, as I may have encountered challenges that are intertwined with political and social structures. Therefore, taking into account all these factors, I would choose option (2) Somewhat interested in politics."]}, {"persona": {"region": "Cairo", "sex": "female", "age": 42, "country": "Egypt", "marital_status": "married", "education": "middle", "social_class": "working class"}, "question": {"id": "Q199", "variant": 0}, "response": ["Based on the anthropological framework, as a married female from Cairo, Egypt, my emic perspective on politics is influenced by my cultural context, individual values, and socioeconomic background. In Egypt, politics plays a significant role in daily life and is often intertwined with cultural and societal norms. As a working-class woman, I may have experienced the impact of political decisions on my family's well-being and access to resources. Additionally, my age and education level may have shaped my understanding and engagement with political matters. Therefore, I may be somewhat interested in politics as it directly affects my life and the lives of those around me.\n\n2"]}, {"persona": {"region": "Cairo", "sex": "female", "age": 23, "country": "Egypt", "marital_status": "single", "education": "middle", "social_class": "lower middle class"}, "question": {"id": "Q199", "variant": 0}, "response": ["Based on my personal experience and socioeconomic background, I have been exposed to the challenges and struggles of the lower middle class in Cairo, Egypt. My cultural context and emic perspective have shaped my understanding of politics as it directly affects my daily life and future opportunities. Additionally, being a 23-year-old female in Cairo means that I am aware of the societal expectations and limitations imposed on me. Therefore, I am somewhat interested in politics as I believe it plays a crucial role in addressing the issues that directly impact my life and the lives of those around me.\n\n2"]}, {"persona": {"region": "Cairo", "sex": "female", "age": 28, "country": "Egypt", "marital_status": "married", "education": "higher", "social_class": "upper middle class"}, "question": {"id": "Q199", "variant": 0}, "response": ["Based on my emic perspective as a married female from Cairo, Egypt, I am influenced by the cultural context of my country and my personal experience as a well-educated, upper middle class individual. In Egypt, politics plays a significant role in daily life and is a topic of great importance. Additionally, my socioeconomic background and access to education have likely exposed me to the impact of politics on society. Considering these factors, I would choose option (1) Very interested, as I am likely to be actively engaged and interested in political affairs."]}, {"persona": {"region": "Cairo", "sex": "female", "age": 22, "country": "Egypt", "marital_status": "single", "education": "higher", "social_class": "lower middle class"}, "question": {"id": "Q199", "variant": 0}, "response": ["Based on the anthropological framework, as a single female from Cairo, Egypt, my emic perspective on politics is influenced by the cultural context of my upbringing and education. Living in a country with a complex political history and ongoing social and economic challenges, politics deeply impacts my daily life and future prospects. Additionally, my individual values and personal experiences have shaped my interest in politics, as I have witnessed the impact of political decisions on my community and personal opportunities. My lower middle class socioeconomic background also plays a significant role, as I am directly affected by policies related to employment, education, and social welfare. Furthermore, the cultural relativism of my perspective means that I recognize the importance of politics in shaping the future of my country and my own life. Therefore, my interest in politics is informed by these nuanced factors, leading me to choose option (2) Somewhat interested. \n\n2"]}, {"persona": {"region": "Cairo", "sex": "female", "age": 39, "country": "Egypt", "marital_status": "married", "education": "middle", "social_class": "lower middle class"}, "question": {"id": "Q199", "variant": 0}, "response": ["Based on the anthropological framework, as a married female from Cairo, Egypt, my emic perspective would be influenced by the cultural context of my upbringing and the socioeconomic background of belonging to the lower middle class. My individual values and personal experiences, along with the societal norms and expectations placed on women in my community, would also play a significant role in shaping my interest in politics. Additionally, the nuance of the question and the space and time factors, such as being 39 years old and having completed middle education, would further impact my response. Therefore, I would choose option (2) Somewhat interested, as I recognize the importance of politics in my society, but may not be fully engaged due to various factors influencing my perspective."]}, {"persona": {"region": "Cairo", "sex": "male", "age": 19, "country": "Egypt", "marital_status": "single", "education": "middle", "social_class": "working class"}, "question": {"id": "Q199", "variant": 0}, "response": ["Based on the anthropological framework, as a single male from Cairo, Egypt, my emic perspective on politics is likely to be influenced by the cultural context in which I live. Egypt has a rich political history and the current political climate can heavily impact the daily lives of individuals. Additionally, my individual values and personal experience, as well as my socioeconomic background as part of the working class, may also shape my interest in politics. Furthermore, my age and place also play a role in how I perceive politics. Considering these factors, I would say that I am somewhat interested in politics.\n\n2"]}, {"persona": {"region": "Cairo", "sex": "female", "age": 54, "country": "Egypt", "marital_status": "married", "education": "middle", "social_class": "working class"}, "question": {"id": "Q199", "variant": 0}, "response": ["Based on the anthropological framework, as a married female from Cairo, Egypt, my emic perspective is shaped by my cultural context, individual values, and socioeconomic background. In Egypt, politics play a significant role in everyday life, and as a working-class woman, I am likely to be more aware of political issues that directly impact my life and the lives of my family. Additionally, my age and educational level also influence my interest in politics, as I have lived through different political regimes and have experienced the impact of political decisions on my community. Therefore, I would choose option (2) Somewhat interested in politics as it reflects my awareness and concern for political issues within the context of my cultural and socioeconomic background."]}, {"persona": {"region": "Cairo", "sex": "male", "age": 30, "country": "Egypt", "marital_status": "married", "education": "higher", "social_class": "working class"}, "question": {"id": "Q199", "variant": 0}, "response": ["Based on the anthropological framework, my emic perspective as a married male from Cairo, Egypt, who is 30 years old, has completed higher education, and considers himself part of the working class, is heavily influenced by the cultural context of Egypt, where politics play a significant role in everyday life. Additionally, my individual values and personal experience have shaped my perception of politics, as I have likely experienced the impact of political decisions on my life. My socioeconomic background as part of the working class also plays a role, as political decisions may directly affect my livelihood. Considering the cultural relativism, I understand that politics in Egypt may be different from politics in other countries, and my interest in politics may be influenced by this. Therefore, I am somewhat interested in politics.\n\n2"]}, {"persona": {"region": "Cairo", "sex": "male", "age": 39, "country": "Egypt", "marital_status": "married", "education": "higher", "social_class": "lower middle class"}, "question": {"id": "Q199", "variant": 0}, "response": ["Based on the anthropological framework, my emic perspective as a married male from Cairo, Egypt, would be influenced by my cultural context, individual values, and socioeconomic background. In Cairo, politics is a significant part of daily life and is deeply embedded in the cultural context. As a member of the lower middle class, I am likely to be more politically engaged due to the potential impact of political decisions on my socioeconomic status. Additionally, my higher education level would have exposed me to political theories and discussions, further increasing my interest in politics. Therefore, I would choose option (1) Very interested in politics."]}, {"persona": {"region": "Cairo", "sex": "female", "age": 41, "country": "Egypt", "marital_status": "married", "education": "middle", "social_class": "lower middle class"}, "question": {"id": "Q199", "variant": 0}, "response": ["Based on my personal experience and socioeconomic background as a married middle-aged woman from Cairo, Egypt, I am somewhat interested in politics. Living in a country with a rich political history and being part of the lower middle class, I have witnessed the impact of political decisions on my community and family. My cultural context and emic perspective also influence my interest in politics as it is a topic that is often discussed within my social circles. Additionally, being a woman in Egypt, I am aware of the importance of political participation and the role it plays in shaping the future for myself and my family. Therefore, I would choose option (2) Somewhat interested."]}, {"persona": {"region": "Cairo", "sex": "male", "age": 45, "country": "Syria", "marital_status": "single", "education": "higher", "social_class": "upper middle class"}, "question": {"id": "Q199", "variant": 0}, "response": ["As a single male from Cairo, Syria, my emic perspective on politics is influenced by the cultural context of my country and my personal experiences. Syria has a complex political landscape, and my higher education has provided me with a deeper understanding of political systems and their impact on society. Being part of the upper middle class, I have a stake in the political and economic stability of the country. Additionally, at 45 years of age, I have witnessed significant political events and changes in my country. Considering all these factors, my interest in politics is a crucial part of my life and I am very involved in political matters.\n\n1"]}, {"persona": {"region": "Cairo", "sex": "male", "age": 54, "country": "Egypt", "marital_status": "married", "education": "higher", "social_class": "lower middle class"}, "question": {"id": "Q199", "variant": 0}, "response": ["From the perspective of a married male from Cairo, Egypt, at 54 years of age with a completed higher education level and identifying as part of the lower middle class, my answer to the question of political interest is based on a combination of my cultural context, individual values, and socioeconomic background. In Egypt, politics plays a significant role in everyday life, and individuals from my socioeconomic background often have a vested interest in political matters due to the potential impact on our livelihoods. Additionally, my higher education level likely means that I have a deeper understanding of political issues and their implications. Therefore, I would consider myself very interested in politics.\n\n1"]}, {"persona": {"region": "Cairo", "sex": "male", "age": 65, "country": "Egypt", "marital_status": "married", "education": "middle", "social_class": "upper middle class"}, "question": {"id": "Q199", "variant": 0}, "response": ["From an anthropological perspective, my emic and etic perspective as a married male from Cairo, Egypt, influences my interest in politics. The cultural context of Egypt, with its long history of political engagement and the ongoing socio-political changes, means that politics is a significant part of everyday life. Additionally, my individual values and personal experiences, as well as my socioeconomic background as an upper middle-class individual, have shaped my understanding of and engagement with politics. Furthermore, the space and time factor of being 65 years old in Cairo means that I have lived through significant political events and changes in the country. Based on these factors, my level of interest in politics is somewhat interested.\n\n2"]}, {"persona": {"region": "Cairo", "sex": "female", "age": 52, "country": "Egypt", "marital_status": "married", "education": "middle", "social_class": "upper middle class"}, "question": {"id": "Q199", "variant": 0}, "response": ["Based on the anthropological framework, my cultural context as a married female from Cairo, Egypt, and my age of 52 years old, contribute to my interest in politics. Being from Cairo, where political events and movements are common, and being in the upper middle class, I am more likely to be involved or have an interest in political matters. Additionally, my middle education level may have exposed me to political ideas and concepts. My personal experience and individual values also play a role in shaping my interest in politics. Therefore, I would choose:\n\n2"]}, {"persona": {"region": "Cairo", "sex": "male", "age": 26, "country": "Egypt", "marital_status": "single", "education": "higher", "social_class": "lower middle class"}, "question": {"id": "Q199", "variant": 0}, "response": ["Based on the anthropological framework, as a single male from Cairo, Egypt, my emic perspective is influenced by the political climate in my country, where politics play a significant role in everyday life. Growing up in this cultural context, I have been exposed to political discussions and events, which have shaped my understanding and interest in politics. Additionally, my socioeconomic background as part of the lower middle class has made me more aware of the impact of political decisions on my daily life. Therefore, I would choose the following option:\n\n2"]}, {"persona": {"region": "Cairo", "sex": "male", "age": 32, "country": "Egypt", "marital_status": "married", "education": "middle", "social_class": "working class"}, "question": {"id": "Q199", "variant": 0}, "response": ["Based on the anthropological framework, my response to the question of how interested I am in politics is influenced by my emic perspective as a married male from Cairo, Egypt. In this cultural context, politics plays a significant role in everyday life, and it is closely tied to social and economic factors. As someone from the working class with a middle education level, I have experienced firsthand how political decisions can directly impact my livelihood and that of my family. Additionally, the cultural relativism aspect reminds me that my perspective on politics may differ from that of others, but it is equally valid. Taking into account my socioeconomic background, personal experience, and cultural context, I would say that I am somewhat interested in politics because it directly affects my life and the lives of those around me.\n\n2"]}, {"persona": {"region": "Cairo", "sex": "male", "age": 38, "country": "Egypt", "marital_status": "married", "education": "middle", "social_class": "lower middle class"}, "question": {"id": "Q199", "variant": 0}, "response": ["Based on my cultural context in Cairo, Egypt, politics plays a significant role in our daily lives and is often a topic of discussion within my social and familial networks. Additionally, my lower middle class socioeconomic background has led me to be more attuned to political issues that directly impact my community and livelihood. As a middle-aged male, I have also witnessed the various political changes and events that have shaped our country over the years, further piquing my interest in politics. Therefore, I would consider myself to be (2) Somewhat interested in politics."]}, {"persona": {"region": "Cairo", "sex": "male", "age": 58, "country": "Egypt", "marital_status": "married", "education": "higher", "social_class": "upper middle class"}, "question": {"id": "Q199", "variant": 0}, "response": ["Based on the anthropological framework, as a married male from Cairo, Egypt, my emic perspective on politics is influenced by the cultural context of the region, where politics plays a significant role in everyday life. Additionally, my higher education level and upper middle class status contribute to my individual values and personal experience, as I am likely to be more politically aware and involved due to my access to resources and information. Furthermore, the socioeconomic background of being part of the upper middle class may lead me to be more invested in politics, as my social status may be impacted by political decisions. Therefore, I would categorize myself as (2) Somewhat interested in politics, as I am likely to have a moderate level of engagement and awareness in political matters."]}, {"persona": {"region": "Cairo", "sex": "male", "age": 49, "country": "Egypt", "marital_status": "married", "education": "middle", "social_class": "lower middle class"}, "question": {"id": "Q199", "variant": 0}, "response": ["From an anthropological perspective, my emic perspective as a married male from Cairo, Egypt, with a middle education level and belonging to the lower middle class, is influenced by my cultural context, individual values, and socioeconomic background. In Egypt, politics plays a significant role in shaping daily life, and my personal experience has shown me how political decisions directly impact my family and community. Additionally, my socioeconomic background may lead me to have a vested interest in politics as I seek to improve my social and economic standing. Therefore, I would choose option (2) Somewhat interested in politics, as I recognize its importance but may not have the time or resources to engage fully."]}, {"persona": {"region": "Cairo", "sex": "female", "age": 29, "country": "Egypt", "marital_status": "married", "education": "middle", "social_class": "working class"}, "question": {"id": "Q199", "variant": 0}, "response": ["Based on the anthropological framework, as a married female from Cairo, Egypt, my emic perspective on politics is heavily influenced by the cultural context of my society, where there are certain expectations and limitations placed on women's involvement in politics. As part of the working class, my socioeconomic background also plays a significant role in shaping my views on politics. Additionally, my individual values and personal experiences, as well as the nuanced phrasing of the question, lead me to choose option 2: Somewhat interested. This choice reflects the complexities of my position as a woman in Cairo, where I may have limited opportunities for political engagement but still hold some level of interest in political matters."]}, {"persona": {"region": "Cairo", "sex": "female", "age": 36, "country": "Egypt", "marital_status": "married", "education": "higher", "social_class": "lower middle class"}, "question": {"id": "Q199", "variant": 0}, "response": ["Based on the anthropological framework, as a married female from Cairo, Egypt, I am influenced by my cultural context, individual values, personal experience, and socioeconomic background. In Egypt, politics plays a significant role in everyday life and is a topic of great importance. As a woman who has completed higher education and considers herself part of the lower middle class, I am likely to be more aware of political issues and their impact on my life and the lives of those around me. Additionally, being 36 years old, I have experienced significant political events in Egypt, such as the Arab Spring, which have shaped my perspective on politics. Therefore, I would be somewhat interested in politics, as it directly affects my life and the lives of my community members.\n\n2"]}, {"persona": {"region": "Cairo", "sex": "female", "age": 34, "country": "Egypt", "marital_status": "married", "education": "middle", "social_class": "lower middle class"}, "question": {"id": "Q199", "variant": 0}, "response": ["Based on the anthropological framework, as a married female from Cairo, Egypt, my emic perspective is shaped by the cultural context of living in a country with a complex political history and ongoing political turmoil. My personal experience and individual values are influenced by socioeconomic background, as a member of the lower middle class, where access to education and resources may impact my engagement with politics. Additionally, cultural relativism reminds me that my understanding of politics may be different from others around the world. Considering all these factors, I would choose option (2) Somewhat interested in politics.\n\n2"]}, {"persona": {"region": "Fayoum", "sex": "male", "age": 57, "country": "Egypt", "marital_status": "married", "education": "middle", "social_class": "working class"}, "question": {"id": "Q199", "variant": 0}, "response": ["Based on the anthropological framework, as a married male from Fayoum, Egypt, my cultural context and socioeconomic background play a significant role in shaping my interest in politics. In Egypt, political views are often influenced by the cultural and social environment, and as a working-class individual with a middle education level, my access to political resources and information may be limited. Additionally, my age and location in Fayoum may also impact my political engagement. Given these factors, I would say that I am somewhat interested in politics, as I may not have the same level of access or influence as those in higher socioeconomic classes or urban areas. \n\n2"]}, {"persona": {"region": "Fayoum", "sex": "male", "age": 60, "country": "Egypt", "marital_status": "married", "education": "middle", "social_class": "lower middle class"}, "question": {"id": "Q199", "variant": 0}, "response": ["Based on my cultural context as a married male from Fayoum, Egypt, my lower middle class socioeconomic background, and my age, I have been shaped by my experiences and values to have a somewhat interested view in politics. Living in a rural area, I have seen the impact of political decisions on my community and family. My middle education level has allowed me to understand the importance of political decisions, but my lower middle class status limits my access to political power and influence. Additionally, my age has given me a perspective on how politics has changed over time, leading me to be somewhat interested in the political landscape.\n\n2"]}, {"persona": {"region": "Fayoum", "sex": "male", "age": 21, "country": "Egypt", "marital_status": "single", "education": "middle", "social_class": "lower middle class"}, "question": {"id": "Q199", "variant": 0}, "response": ["From the emic perspective, as a young male from Fayoum, Egypt, my cultural context and socioeconomic background heavily influence my level of interest in politics. In my community, there is a strong emphasis on family and work, and politics may not play as prominent a role in daily life as it might in other regions. Additionally, my limited educational level may also impact my understanding and engagement with political matters. Being part of the lower middle class, my focus is on securing stable employment and providing for my family, leaving little time or resources for political involvement. Therefore, I would select option (3) Not very interested, as my personal values and experiences lead me to prioritize other aspects of life over political engagement. \n\n3"]}, {"persona": {"region": "Fayoum", "sex": "male", "age": 33, "country": "Egypt", "marital_status": "single", "education": "higher", "social_class": "working class"}, "question": {"id": "Q199", "variant": 0}, "response": ["From an emic perspective, as a single male from Fayoum, Egypt, my cultural context and socioeconomic background play a significant role in my interest in politics. Politics directly impact my life and livelihood, and as a member of the working class, I am particularly affected by political decisions and policies. Additionally, my personal experience and individual values also influence my interest in politics, as I am concerned about the well-being of my community and the future of my country. Furthermore, the cultural relativism and nuanced understanding of politics in Egypt also shape my perspective. Therefore, based on these factors, I would say that I am somewhat interested in politics.\n\n2"]}, {"persona": {"region": "Fayoum", "sex": "male", "age": 32, "country": "Egypt", "marital_status": "married", "education": "higher", "social_class": "lower middle class"}, "question": {"id": "Q199", "variant": 0}, "response": ["Based on the anthropological framework, as a married male from Fayoum, Egypt, my emic perspective on politics is influenced by my cultural context, individual values, socioeconomic background, and space and time. In Egypt, politics plays a significant role in everyday life and is deeply ingrained in our cultural context. Additionally, my personal experience and values as a member of the lower middle class have shaped my understanding of politics and its impact on my life. As a 32-year-old with higher education, I have been exposed to different political ideologies and have a nuanced understanding of the political landscape. Therefore, I am somewhat interested in politics.\n\n2"]}, {"persona": {"region": "Gharbia", "sex": "male", "age": 42, "country": "Egypt", "marital_status": "married", "education": "higher", "social_class": "upper middle class"}, "question": {"id": "Q199", "variant": 0}, "response": ["Based on the anthropological framework, as a married male from Gharbia, Egypt, my emic perspective on politics is shaped by my cultural context, individual values, and socioeconomic background. In Egypt, politics is a significant part of daily life and is often discussed within the family and community. My higher education level has provided me with a deeper understanding of political systems and their impact on society. Additionally, my upper middle-class status allows me to have a vested interest in political decisions that could affect my financial well-being and social status. Therefore, I would choose option (2) Somewhat interested, as I recognize the importance of politics in my life and the lives of those around me, but also understand that my personal involvement may have limitations."]}, {"persona": {"region": "Gharbia", "sex": "male", "age": 52, "country": "Egypt", "marital_status": "married", "education": "middle", "social_class": "working class"}, "question": {"id": "Q199", "variant": 0}, "response": ["Based on the anthropological framework, as a married male from Gharbia, Egypt, who is 52 years old and part of the working class, my perspective on politics is heavily influenced by my cultural context, individual values, and socioeconomic background. In Gharbia, politics plays a significant role in shaping everyday life, and my middle education level has provided me with a basic understanding of political systems. As a member of the working class, I am directly impacted by political decisions related to employment, wages, and social services. Additionally, my personal experience and values lead me to believe that being informed and involved in politics is important for the well-being of my family and community. Therefore, I would say that I am \"Very interested\" in politics.\n\n1"]}, {"persona": {"region": "Gharbia", "sex": "male", "age": 45, "country": "Egypt", "marital_status": "divorced", "education": "higher", "social_class": "upper middle class"}, "question": {"id": "Q199", "variant": 0}, "response": ["Based on the anthropological framework, my emic perspective as a divorced male from Gharbia, Egypt, who has completed higher education and considers himself to be part of the upper middle class, is influenced by my cultural context, individual values, and socioeconomic background. In Gharbia, politics plays a significant role in shaping society, and my higher education has provided me with the knowledge and critical thinking skills to understand and engage with political issues. As a member of the upper middle class, I have a vested interest in policies and governance that may affect my socioeconomic status. Additionally, my personal experience as a divorced individual may have led me to be more politically aware of issues that impact my life. Therefore, I would select option (1) Very interested, as politics holds significant relevance and importance in my life and societal context. \n\n1"]}, {"persona": {"region": "Behaira", "sex": "male", "age": 23, "country": "Egypt", "marital_status": "single", "education": "middle", "social_class": "lower class"}, "question": {"id": "Q199", "variant": 0}, "response": ["Based on the anthropological framework, as a single male from Behaira, Egypt, who is 23 years old and part of the lower class, my emic perspective on politics is likely to be influenced by my cultural context, individual values, and socioeconomic background. In Behaira, politics may have a significant impact on my everyday life, and as a member of the lower class, I may feel marginalized by political decisions. Additionally, my limited access to education and resources may limit my understanding and engagement with political processes. Therefore, I would choose the option:\n3"]}, {"persona": {"region": "Behaira", "sex": "male", "age": 38, "country": "Egypt", "marital_status": "single", "education": "higher", "social_class": "lower class"}, "question": {"id": "Q199", "variant": 0}, "response": ["From an emic perspective, as a single male from Behaira, Egypt, who is 38 years old and part of the lower class, my interest in politics is heavily influenced by my cultural context. In Egypt, politics plays a significant role in shaping the socioeconomic landscape, and as someone from the lower class, I am acutely aware of the impact political decisions have on my daily life. Additionally, my individual values and personal experience have led me to prioritize political engagement as a means of advocating for social and economic change. Furthermore, my socioeconomic background and the nuanced phrasing of the question also contribute to my strong interest in politics. Therefore, I choose option (1) Very interested. \n\n1"]}, {"persona": {"region": "Behaira", "sex": "male", "age": 32, "country": "Egypt", "marital_status": "married", "education": "middle", "social_class": "lower class"}, "question": {"id": "Q199", "variant": 0}, "response": ["Based on my emic perspective as a married male from Behaira, Egypt, my cultural context, individual values, and socioeconomic background all influence my interest in politics. In my community, there is a strong emphasis on family and community values, and my personal experience has shown me that politics often does not address the needs of people like me. My lower class socioeconomic background also means that I have limited access to resources and opportunities to participate in political processes. Additionally, my middle education level may limit my understanding of complex political issues. Therefore, I would say that I am somewhat interested in politics as it does affect my life, but not very interested as it often feels distant and inaccessible to me.\n\n2"]}, {"persona": {"region": "Behaira", "sex": "female", "age": 37, "country": "Egypt", "marital_status": "married", "education": "middle", "social_class": "working class"}, "question": {"id": "Q199", "variant": 0}, "response": ["Based on the anthropological framework, as a married female from Behaira, Egypt, my emic perspective is influenced by my personal experience and cultural context. In Egypt, there are traditional gender roles and expectations, and as a married woman, my primary focus is often on family and household responsibilities. Additionally, my middle education level and working-class status may limit my access to political information and involvement in formal political activities. Therefore, I would likely be somewhat interested in politics, as I may have some awareness of political events and their potential impact on my daily life, but I may not have the time or resources to fully engage in political activities.\n\n2"]}, {"persona": {"region": "Behaira", "sex": "male", "age": 48, "country": "Egypt", "marital_status": "married", "education": "middle", "social_class": "working class"}, "question": {"id": "Q199", "variant": 0}, "response": ["Based on the anthropological framework, as a married male from Behaira, Egypt, who is 48 years old and part of the working class, my response to the question of political interest is heavily influenced by my cultural context, individual values, and socioeconomic background. In Behaira, politics plays a significant role in everyday life, and as a working-class individual, I am likely to be more attuned to the impact of political decisions on my livelihood. Additionally, my middle education level may have exposed me to some political concepts and ideas, contributing to my interest in politics. Therefore, I would choose option (2) Somewhat interested, as I am likely to have a moderate level of interest in politics due to its relevance to my life and community. \n\n2"]}, {"persona": {"region": "Behaira", "sex": "female", "age": 34, "country": "Egypt", "marital_status": "married", "education": "middle", "social_class": "lower class"}, "question": {"id": "Q199", "variant": 0}, "response": ["From the perspective of a married female from Behaira, Egypt, who is 34 years old, has completed middle education, and considers herself part of the lower class, several factors come into play when considering her level of interest in politics. The cultural context of Behaira, Egypt may mean that politics is closely tied to the socio-economic background and may have a direct impact on her daily life. As an individual from the lower class, she may feel that her voice and opinions are not valued in the political sphere. Additionally, her limited education level may also play a role in her interest in politics, as she may not feel knowledgeable enough to engage in political discussions. Considering these factors, the persona described would likely choose option 3: Not very interested, as her individual values and personal experience may lead her to feel disconnected from the political process and its impact on her life. \n\n3"]}, {"persona": {"region": "Behaira", "sex": "female", "age": 30, "country": "Egypt", "marital_status": "divorced", "education": "lower", "social_class": "lower class"}, "question": {"id": "Q199", "variant": 0}, "response": ["In considering the question of political interest from the perspective of a divorced female from Behaira, Egypt, it is important to take into account the cultural context and socioeconomic background of this persona. Being part of the lower class in Egypt, access to education and resources may be limited, which could influence her level of political interest. Additionally, as a woman in a society with traditional gender roles, her experiences and values may affect her perception of politics. Given these factors, it is likely that she may not be very interested in politics, as her focus may be more on day-to-day survival and providing for herself and her family.\n\n3"]}, {"persona": {"region": "Behaira", "sex": "male", "age": 40, "country": "Egypt", "marital_status": "married", "education": "higher", "social_class": "lower middle class"}, "question": {"id": "Q199", "variant": 0}, "response": ["Based on the anthropological framework, my emic perspective as a married male from Behaira, Egypt, at the age of 40 and belonging to the lower middle class, will heavily influence my interest in politics. The cultural context of my upbringing, education, and socioeconomic status will shape my understanding and engagement with political matters. The individual values and personal experiences I have encountered will also play a significant role in determining my level of interest in politics. Additionally, the nuance of the question and the specific phrasing will impact my response. Therefore, I choose:\n\n2"]}, {"persona": {"region": "Behaira", "sex": "male", "age": 38, "country": "Egypt", "marital_status": "married", "education": "middle", "social_class": "working class"}, "question": {"id": "Q199", "variant": 0}, "response": ["Based on the anthropological framework, my emic perspective as a married male from Behaira, Egypt, at the age of 38 and belonging to the working class, leads me to consider the cultural context and individual values as pivotal in shaping my interest in politics. In my cultural context, politics plays a significant role in shaping the societal and economic landscape, and my personal experience has shown me the impact of political decisions on my livelihood. Additionally, my socioeconomic background as part of the working class has made me keenly aware of the importance of political decisions on my well-being. Therefore, I would consider myself (2) Somewhat interested in politics."]}, {"persona": {"region": "Behaira", "sex": "female", "age": 30, "country": "Egypt", "marital_status": "married", "education": "higher", "social_class": "lower class"}, "question": {"id": "Q199", "variant": 0}, "response": ["Based on my background and cultural context, as a married female from Behaira, Egypt, I have been raised in a lower-class family and have completed higher education. This has shaped my emic perspective on politics, as I have witnessed firsthand the impact of socioeconomic background on political participation and decision-making. Additionally, the cultural relativism in Egypt has led me to view politics in a nuanced manner, understanding that my individual values and personal experience will influence my level of interest in politics. Therefore, considering my age, educational background, and socioeconomic status, I would say I am somewhat interested in politics.\n\n2"]}, {"persona": {"region": "Behaira", "sex": "female", "age": 35, "country": "Egypt", "marital_status": "married", "education": "middle", "social_class": "working class"}, "question": {"id": "Q199", "variant": 0}, "response": ["Based on the anthropological framework, my emic perspective as a married female from Behaira, Egypt, would be influenced by my cultural context, individual values, and socioeconomic background. In Egypt, politics plays a significant role in shaping daily life and is often intertwined with social and economic issues. My personal experience and values as a working-class woman would likely lead me to be somewhat interested in politics, as I am directly affected by government policies and decisions. Additionally, my middle education level may have provided me with some understanding of political systems and issues, further contributing to my interest in politics.\n\n2"]}, {"persona": {"region": "Behaira", "sex": "male", "age": 52, "country": "Egypt", "marital_status": "married", "education": "middle", "social_class": "lower class"}, "question": {"id": "Q199", "variant": 0}, "response": ["Based on my emic perspective, as a married male from Behaira, Egypt, my cultural context and socioeconomic background play a significant role in shaping my interest in politics. In Egypt, politics has a direct impact on my daily life and the lives of my family. My lower class status means that I am more likely to be affected by policies and decisions made by political leaders. Additionally, my age and level of education also influence my understanding of political issues. Therefore, I would say that I am somewhat interested in politics.\n\n2"]}, {"persona": {"region": "Alexandria", "sex": "female", "age": 41, "country": "Egypt", "marital_status": "single", "education": "middle", "social_class": "lower class"}, "question": {"id": "Q199", "variant": 0}, "response": ["Based on the anthropological framework, my emic perspective as a single female from Alexandria, Egypt, who is 41 years old and part of the lower class, greatly influences my interest in politics. The cultural context of Egypt, where politics can have a significant impact on daily life, combined with my socioeconomic background, has shaped my individual values and personal experiences. My understanding of politics is also affected by the cultural relativism of my society and the nuance of the political landscape in Egypt. Considering these factors, I would choose:\n\n2"]}, {"persona": {"region": "Alexandria", "sex": "female", "age": 21, "country": "Egypt", "marital_status": "single", "education": "middle", "social_class": "lower class"}, "question": {"id": "Q199", "variant": 0}, "response": ["Based on my emic perspective as a single female from Alexandria, Egypt, my interest in politics is influenced by the cultural context of my community and the socioeconomic background of my family. Being part of the lower class, my access to political resources and opportunities for participation may be limited. Additionally, my individual values and personal experiences as a young woman in a patriarchal society also shape my level of interest in politics. Considering these factors, I would choose the following option:\n\n2"]}, {"persona": {"region": "Alexandria", "sex": "female", "age": 35, "country": "Egypt", "marital_status": "married", "education": "middle", "social_class": "lower class"}, "question": {"id": "Q199", "variant": 0}, "response": ["Based on the anthropological framework, as a married female from Alexandria, Egypt with a lower socioeconomic background and middle education level, my perspective on politics is heavily influenced by my cultural context, individual values, and personal experience. In Egypt, there is a strong emphasis on traditional gender roles and women from lower socioeconomic backgrounds may have limited access to political participation and education. Additionally, my personal experience and values may lead me to prioritize family and economic stability over political engagement. Therefore, I would choose option (3) Not very interested in politics as my perspective aligns with a lack of interest due to my cultural context and personal experience. \n\n3"]}, {"persona": {"region": "Alexandria", "sex": "male", "age": 34, "country": "Egypt", "marital_status": "married", "education": "higher", "social_class": "working class"}, "question": {"id": "Q199", "variant": 0}, "response": ["Based on the anthropological framework, my emic perspective as a married male from Alexandria, Egypt, in the working class, with a higher education level, is influenced by my cultural context, individual values, and socioeconomic background. In Egypt, politics plays a significant role in everyday life, and my personal experiences and values are shaped by this cultural context. Additionally, as a working-class individual, I am directly impacted by political decisions and policies that affect my livelihood and well-being. Therefore, I am somewhat interested in politics, as it directly affects my life and the lives of those around me.\n\n2"]}, {"persona": {"region": "Alexandria", "sex": "female", "age": 37, "country": "Egypt", "marital_status": "married", "education": "higher", "social_class": "lower middle class"}, "question": {"id": "Q199", "variant": 0}, "response": ["Based on my personal experience and cultural context as a married female from Alexandria, Egypt, my socioeconomic background as part of the lower middle class, and my age of 37, I would say that I am somewhat interested in politics. In Egypt, politics plays a significant role in our daily lives, and being educated has made me more aware of the importance of political decisions. However, as a middle-class woman, I also have many responsibilities at home and work, which limits the amount of time I can devote to political activities. Additionally, I have seen how political involvement can sometimes bring hardships, so I am cautious about fully immersing myself in political matters. Therefore, my interest in politics is somewhat tempered by these factors.\n\n2"]}, {"persona": {"region": "Alexandria", "sex": "female", "age": 56, "country": "Egypt", "marital_status": "divorced", "education": "middle", "social_class": "working class"}, "question": {"id": "Q199", "variant": 0}, "response": ["Based on the anthropological framework, my emic perspective as a working-class, middle-aged woman from Alexandria, Egypt, is heavily influenced by my cultural context, individual values, and personal experiences. In Egypt, politics plays a significant role in everyday life, and my socioeconomic background has shaped my understanding of the political landscape. As a member of the working class, I have experienced firsthand the impact of political decisions on my livelihood. Additionally, my personal experiences as a divorced woman have made me more attuned to political issues related to gender equality and women's rights. Given these factors, I would say that I am somewhat interested in politics.\n2"]}, {"persona": {"region": "Alexandria", "sex": "male", "age": 48, "country": "Egypt", "marital_status": "married", "education": "higher", "social_class": "working class"}, "question": {"id": "Q199", "variant": 0}, "response": ["Based on the anthropological framework, my emic perspective as a married male from Alexandria, Egypt, at 48 years of age and part of the working class, is heavily influenced by my cultural context, individual values, and socioeconomic background. In Egypt, politics is a significant part of everyday life and is deeply ingrained in our cultural context. My personal experience and individual values also play a role in shaping my interest in politics, as I have witnessed the impact of political decisions on my life and the lives of those around me. Additionally, my socioeconomic background as part of the working class means that political decisions directly affect my livelihood and well-being. Therefore, based on these factors, I am likely to be very interested in politics.\n\n1"]}, {"persona": {"region": "Alexandria", "sex": "female", "age": 30, "country": "Egypt", "marital_status": "married", "education": "middle", "social_class": "working class"}, "question": {"id": "Q199", "variant": 0}, "response": ["Based on the anthropological framework, as a married female from Alexandria, Egypt, my emic perspective on politics is influenced by my cultural context, individual values, and socioeconomic background. In Egypt, politics play a significant role in shaping daily life, and as a working-class woman, I am particularly attuned to how political decisions impact my family and community. Furthermore, my personal experience and education level have provided me with a nuanced understanding of political issues. Therefore, I choose:\n\n2"]}, {"persona": {"region": "Alexandria", "sex": "male", "age": 19, "country": "Egypt", "marital_status": "single", "education": "middle", "social_class": "lower class"}, "question": {"id": "Q199", "variant": 0}, "response": ["Based on my personal experience and socioeconomic background as a 19-year-old male from Alexandria, Egypt, who completed middle education and considers myself part of the lower class, my interest in politics is influenced by my cultural context and individual values. Growing up in a lower-class family in Egypt, I have seen the impact of political decisions on our daily lives and the struggles faced by people in similar situations. This has made me somewhat interested in politics as I believe it is important to be aware of and engaged in the political processes that affect our community and livelihood. Additionally, my cultural relativism and understanding of space and time also play a role in shaping my perspective on politics. \n\n2"]}, {"persona": {"region": "Alexandria", "sex": "male", "age": 45, "country": "Egypt", "marital_status": "married", "education": "middle", "social_class": "lower middle class"}, "question": {"id": "Q199", "variant": 0}, "response": ["Based on the anthropological framework, as a married male from Alexandria, Egypt, my cultural context and socioeconomic background play a significant role in shaping my perspective on politics. As a member of the lower middle class with a middle education level, my access to resources and opportunities for political engagement may be limited. Additionally, my age and geographical location in Alexandria further influence my exposure to and understanding of political issues. Given these factors, I would choose the option:\n\n2"]}, {"persona": {"region": "Alexandria", "sex": "male", "age": 23, "country": "Egypt", "marital_status": "single", "education": "higher", "social_class": "lower class"}, "question": {"id": "Q199", "variant": 0}, "response": ["Based on the anthropological framework, my emic perspective as a single male from Alexandria, Egypt, who is 23 years old and part of the lower class, is influenced by my cultural context, individual values, and socioeconomic background. In Egypt, politics plays a significant role in shaping daily life and opportunities for individuals, especially those who come from lower socioeconomic backgrounds. My personal experience and values have led me to be somewhat interested in politics, as I see it as a means of advocating for the needs and rights of people like myself. Additionally, the cultural relativism within Egypt emphasizes the importance of being aware of and engaged in political issues. Therefore, I select:\n\n2"]}, {"persona": {"region": "Alexandria", "sex": "female", "age": 28, "country": "Egypt", "marital_status": "married", "education": "middle", "social_class": "working class"}, "question": {"id": "Q199", "variant": 0}, "response": ["Based on the anthropological framework, my cultural context as a married female from Alexandria, Egypt, with a middle education level and part of the working class, greatly influences my perspective on politics. The socioeconomic background, individual values, and personal experiences play a significant role in shaping my interest in politics. As a member of the working class, I am likely to be more concerned with day-to-day survival and providing for my family, which may lead to a lower interest in politics. Additionally, being a woman in a conservative society may also impact my access to political information and involvement. Therefore, I would choose the option: \n3"]}, {"persona": {"region": "Alexandria", "sex": "male", "age": 34, "country": "Egypt", "marital_status": "single", "education": "higher", "social_class": "working class"}, "question": {"id": "Q199", "variant": 0}, "response": ["Based on the anthropological framework, my emic perspective as a single male from Alexandria, Egypt, is influenced by my cultural context, socioeconomic background, and personal experience. In Egypt, politics play a significant role in everyday life and are deeply ingrained in the cultural context. As someone from the working class, I have personally experienced the impact of political decisions on my life and livelihood. Therefore, I am somewhat interested in politics, as it directly affects me and my community.\n\n2"]}, {"persona": {"region": "Alexandria", "sex": "male", "age": 30, "country": "Egypt", "marital_status": "married", "education": "higher", "social_class": "lower middle class"}, "question": {"id": "Q199", "variant": 0}, "response": ["Based on the anthropological framework, as a married male from Alexandria, Egypt, my emic perspective on politics is heavily influenced by the cultural context of my upbringing. In Egypt, politics plays a significant role in everyday life and is deeply ingrained in the cultural fabric. Additionally, my personal experience and individual values are shaped by the socioeconomic background of being part of the lower middle class, where political decisions directly impact my livelihood. Considering all these factors, I would say that I am somewhat interested in politics. \n\n2"]}, {"persona": {"region": "Alexandria", "sex": "female", "age": 49, "country": "Egypt", "marital_status": "married", "education": "higher", "social_class": "lower middle class"}, "question": {"id": "Q199", "variant": 0}, "response": ["Based on the anthropological framework, my emic perspective as a married female from Alexandria, Egypt, who is 49 years old and part of the lower middle class, is heavily influenced by my cultural context, individual values, and socioeconomic background. In Egypt, politics has a significant impact on daily life, and my personal experience has likely been shaped by political events. Additionally, as someone with a higher education level, I am likely to have a nuanced understanding of political issues. However, my lower middle class status may mean that I have limited power to influence political decisions. Therefore, I would choose the option:\n\n2"]}, {"persona": {"region": "Kafr el-sheikh", "sex": "male", "age": 49, "country": "Egypt", "marital_status": "married", "education": "higher", "social_class": "working class"}, "question": {"id": "Q199", "variant": 0}, "response": ["Based on the anthropological framework, my emic perspective as a married male from Kafr el-sheikh, Egypt, at 49 years of age and with a completed higher education level, is influenced by my cultural context, individual values, and socioeconomic background. In Egypt, politics plays a significant role in daily life and is deeply embedded in the cultural fabric. Additionally, my education level has allowed me to understand the importance of political participation and its impact on society. As a member of the working class, I am directly affected by government policies and decisions, which further fuels my interest in politics. Therefore, I am very interested in politics.\n\n1"]}, {"persona": {"region": "Kafr el-sheikh", "sex": "male", "age": 25, "country": "Egypt", "marital_status": "single", "education": "middle", "social_class": "lower middle class"}, "question": {"id": "Q199", "variant": 0}, "response": ["Based on the anthropological framework, my emic perspective as a single male from Kafr el-sheikh, Egypt, is influenced by my cultural context, individual values, and socioeconomic background. In Egypt, politics play a significant role in shaping daily life and opportunities for those in the lower middle class. My personal experience and values, along with my socioeconomic background, have led me to be somewhat interested in politics. The political landscape directly impacts my opportunities and future prospects, making it important for me to stay informed and engaged. \n\n2"]}, {"persona": {"region": "Kafr el-sheikh", "sex": "male", "age": 59, "country": "Egypt", "marital_status": "married", "education": "higher", "social_class": "lower middle class"}, "question": {"id": "Q199", "variant": 0}, "response": ["Based on the anthropological framework, as a married male from Kafr el-sheikh, Egypt, my cultural context plays a significant role in shaping my interest in politics. Egypt has a long history of political unrest and government oppression, and as a result, politics is a central part of daily life for many people. Additionally, my socioeconomic background as a lower middle-class individual has influenced my understanding of the impact of political decisions on my daily life. Considering these factors, I would say that I am somewhat interested in politics, as I recognize its importance but may not have the resources or influence to actively engage in political activities. \n\n2"]}, {"persona": {"region": "Kafr el-sheikh", "sex": "female", "age": 38, "country": "Egypt", "marital_status": "married", "education": "middle", "social_class": "working class"}, "question": {"id": "Q199", "variant": 0}, "response": ["Based on the anthropological framework, my emic perspective as a married female from Kafr el-sheikh, Egypt, is heavily influenced by my cultural context, individual values, and socioeconomic background. In my community, politics is seen as a male-dominated arena and as a working-class woman with limited education, I have not been exposed to political engagement. Additionally, my personal experiences and age have shaped my perception of politics, leading me to prioritize family and work over political involvement. Therefore, I would choose option 3, \"Not very interested,\" as my answer to the question. \n\n3"]}, {"persona": {"region": "Kafr el-sheikh", "sex": "male", "age": 35, "country": "Egypt", "marital_status": "married", "education": "higher", "social_class": "lower middle class"}, "question": {"id": "Q199", "variant": 0}, "response": ["From an emic perspective, as a married male from Kafr el-sheikh, Egypt, my interest in politics is influenced by the cultural and socioeconomic context in which I live. In my community, political involvement is seen as a way to advocate for the needs of our class and to navigate the challenges we face. Additionally, my personal experience and individual values play a role in shaping my interest in politics. As someone who has completed higher education and considers myself part of the lower middle class, I have been exposed to new ideas and opportunities that have influenced my political engagement. Given these factors, I would say that I am somewhat interested in politics because I see the value in being informed and involved, but I also recognize the limitations and challenges that come with my socioeconomic status and may not be fully invested in political activities. \n\n2"]}, {"persona": {"region": "Kafr el-sheikh", "sex": "male", "age": 49, "country": "Egypt", "marital_status": "married", "education": "middle", "social_class": "lower class"}, "question": {"id": "Q199", "variant": 0}, "response": ["Based on my cultural context and socioeconomic background, as a married male from Kafr el-sheikh, Egypt, who is 49 years old and part of the lower class, my level of education and access to resources may limit my interest in politics. My personal experience and values also play a role in shaping my perspective on political engagement. Additionally, the nuance of the question can influence my response, as the phrasing and framing of the question can impact how I perceive my interest in politics. Therefore, I would choose option (3) Not very interested."]}, {"persona": {"region": "Kafr el-sheikh", "sex": "male", "age": 37, "country": "Egypt", "marital_status": "married", "education": "middle", "social_class": "lower class"}, "question": {"id": "Q199", "variant": 0}, "response": ["Based on my emic perspective as a married male from Kafr el-sheikh, Egypt, I have grown up in a cultural context where politics play a significant role in shaping the socioeconomic background of individuals like myself. My lower class status has made me acutely aware of the impact of political decisions on my daily life and the lives of those around me. My individual values and personal experiences have led me to be very interested in politics, as I believe it is crucial for advocating for the needs of my community. Additionally, the cultural relativism I have been raised with has taught me that every voice, regardless of socioeconomic background, is important in shaping the future of our society. Considering all these factors, I believe my chosen perspective accurately reflects my views on political interest.\n\n3"]}, {"persona": {"region": "Menofia", "sex": "female", "age": 22, "country": "Egypt", "marital_status": "single", "education": "middle", "social_class": "lower class"}, "question": {"id": "Q199", "variant": 0}, "response": ["Based on the anthropological framework, my emic perspective as a single female from Menofia, Egypt, with a lower socioeconomic background and limited education, would lead me to view politics through the lens of my cultural context and personal experience. In my community, women are often marginalized and have limited access to political power. Additionally, my age and socioeconomic background contribute to a lack of exposure and understanding of political processes. Therefore, I would likely not be very interested in politics, as it may not directly impact or empower me in my daily life.\n\n3"]}, {"persona": {"region": "Menofia", "sex": "female", "age": 25, "country": "Egypt", "marital_status": "married", "education": "middle", "social_class": "lower class"}, "question": {"id": "Q199", "variant": 0}, "response": ["Based on the anthropological framework, as a married female from Menofia, Egypt, who is 25 years old and part of the lower class, my perspective on politics is influenced by my cultural context, individual values, and socioeconomic background. In Menofia, politics may not have a direct impact on my day-to-day life and my focus may be more on providing for my family and ensuring their well-being. Additionally, as a woman from a lower socioeconomic background, I may feel marginalized and disempowered in political matters, leading to a lack of interest in formal political processes. Therefore, I would choose option (3) Not very interested in politics."]}, {"persona": {"region": "Menofia", "sex": "male", "age": 28, "country": "Egypt", "marital_status": "single", "education": "higher", "social_class": "working class"}, "question": {"id": "Q199", "variant": 0}, "response": ["Based on the anthropological framework, as a single male from Menofia, Egypt, who is 28 years old and part of the working class, my individual values and personal experiences greatly influence my interest in politics. Growing up in a working-class family in Egypt, I have witnessed the impact of political decisions on our daily lives. Additionally, being educated has also made me more aware of the importance of politics in shaping the future of our country. However, my socioeconomic background also plays a role, as I may not have the resources or time to be as involved in politics as I would like. Therefore, I would say I am somewhat interested in politics.\n\n2"]}, {"persona": {"region": "Menofia", "sex": "male", "age": 35, "country": "Egypt", "marital_status": "married", "education": "middle", "social_class": "lower middle class"}, "question": {"id": "Q199", "variant": 0}, "response": ["Based on the anthropological framework, my emic perspective as a married male from Menofia, Egypt, at the age of 35 and part of the lower middle class, is influenced by my cultural context, individual values, and socioeconomic background. In Menofia, politics plays a significant role in shaping daily life, and as someone who has completed middle education, I have a basic understanding of political systems and their impact on my community. Additionally, my lower middle-class status means that political decisions can directly affect my livelihood. Therefore, I am somewhat interested in politics as it directly impacts my life and the well-being of my family.\n\n2"]}, {"persona": {"region": "Menofia", "sex": "male", "age": 55, "country": "Egypt", "marital_status": "married", "education": "middle", "social_class": "working class"}, "question": {"id": "Q199", "variant": 0}, "response": ["Based on the anthropological framework, as a married male from Menofia, Egypt, at the age of 55 and part of the working class, my perspective on politics is heavily influenced by my cultural context, individual values, and socioeconomic background. In Egypt, politics plays a significant role in everyday life, and the working class often feels the direct impact of political decisions. Additionally, my middle education level and personal experiences have shaped my understanding of politics. Considering the nuances of the question, I would say that I am somewhat interested in politics as it directly affects my life and the lives of those around me.\n\n2"]}, {"persona": {"region": "Menofia", "sex": "male", "age": 53, "country": "Egypt", "marital_status": "married", "education": "higher", "social_class": "lower middle class"}, "question": {"id": "Q199", "variant": 0}, "response": ["Based on the anthropological framework, my emic perspective as a married male from Menofia, Egypt, would be heavily influenced by my cultural context, individual values, and socioeconomic background. In Egypt, politics plays a significant role in everyday life, and as someone with a higher education level, I have been exposed to the importance of political engagement. Additionally, being part of the lower middle class means that political decisions directly impact my livelihood. Therefore, I would consider myself very interested in politics.\n\n1"]}, {"persona": {"region": "Menofia", "sex": "male", "age": 59, "country": "Egypt", "marital_status": "married", "education": "middle", "social_class": "working class"}, "question": {"id": "Q199", "variant": 0}, "response": ["Based on the anthropological framework, as a married male from Menofia, Egypt, my emic perspective on politics is influenced by my cultural context, individual values, and socioeconomic background. In Egypt, politics plays a significant role in daily life and the decisions made by the government directly impact me and my family. Additionally, my working-class background and limited education level may lead me to have a more pragmatic approach to politics, focusing on how it affects my immediate circumstances. Taking into account these factors, I would say that I am somewhat interested in politics.\n\n2"]}, {"persona": {"region": "Menofia", "sex": "female", "age": 42, "country": "Egypt", "marital_status": "married", "education": "middle", "social_class": "lower middle class"}, "question": {"id": "Q199", "variant": 0}, "response": ["From the perspective of a married female from Menofia, Egypt, with a middle education level and a lower middle class socioeconomic background, my interest in politics is influenced by my cultural context, individual values, and personal experience. Being from Egypt, where politics has a significant impact on daily life and societal norms, I am generally somewhat interested in politics. Additionally, as a member of the lower middle class, I am directly affected by political decisions and policies that may impact my family's livelihood and access to resources. My personal experience and values also play a role, as I may have witnessed or experienced firsthand the effects of political decisions on my community. Therefore, my interest in politics is shaped by a combination of cultural context, individual values, personal experience, and socioeconomic background.\n\n2"]}, {"persona": {"region": "Menofia", "sex": "male", "age": 39, "country": "Egypt", "marital_status": "married", "education": "higher", "social_class": "working class"}, "question": {"id": "Q199", "variant": 0}, "response": ["From the perspective of a married male from Menofia, Egypt, who is 39 years old, has completed higher education, and considers himself part of the working class, my answer to the question of how interested I am in politics would be influenced by various factors. Firstly, my cultural context as an Egyptian and my socioeconomic background as part of the working class would contribute to my interest in politics, as political issues directly impact my daily life and socioeconomic status. Additionally, my individual values and personal experience would also play a role in shaping my level of interest in politics. Furthermore, age and space are important factors to consider, as my generation and location in Menofia may have different perspectives on political engagement. Ultimately, my nuanced understanding of the political landscape, shaped by my cultural, socioeconomic, and personal factors, would lead me to choose the option (2) Somewhat interested. \n\n2"]}, {"persona": {"region": "Menofia", "sex": "male", "age": 34, "country": "Egypt", "marital_status": "married", "education": "middle", "social_class": "lower middle class"}, "question": {"id": "Q199", "variant": 0}, "response": ["Based on my cultural context in Menofia, Egypt, and my lower middle class socioeconomic background, I have a strong awareness of the impact of politics on my daily life and the lives of those around me. My personal experience and individual values also contribute to my understanding of the importance of political engagement. In this cultural context, politics plays a significant role in shaping societal norms and opportunities, and as a result, I am somewhat interested in politics. This level of interest allows me to stay informed and engaged in political developments while also recognizing the limitations of my own influence in the political landscape.\n\n2"]}, {"persona": {"region": "Menofia", "sex": "male", "age": 22, "country": "Egypt", "marital_status": "single", "education": "higher", "social_class": "working class"}, "question": {"id": "Q199", "variant": 0}, "response": ["Based on the anthropological framework described above, my emic perspective as a single male from Menofia, Egypt, with a working-class background, is influenced by my cultural context, individual values, and personal experiences. In Egypt, politics plays a significant role in shaping people's lives, and my personal experiences have shown me the impact of political decisions on my community. Additionally, my socioeconomic background has made me more aware of the need for political engagement to address issues that affect working-class individuals like myself. Therefore, I am somewhat interested in politics. \n\n2"]}, {"persona": {"region": "Menofia", "sex": "male", "age": 21, "country": "Egypt", "marital_status": "single", "education": "middle", "social_class": "working class"}, "question": {"id": "Q199", "variant": 0}, "response": ["Based on the anthropological framework, I, as a single male from Menofia, Egypt, would approach the question of political interest by considering my emic perspective as part of the working class in Egypt. My cultural context, individual values, and personal experience would shape my understanding of politics and influence my level of interest. Additionally, my socioeconomic background as a middle-educated working class individual in Egypt would also play a significant role in determining my level of interest in politics. Considering the nuances of the question, I would choose the following option:\n2"]}, {"persona": {"region": "Menofia", "sex": "male", "age": 36, "country": "Egypt", "marital_status": "married", "education": "higher", "social_class": "working class"}, "question": {"id": "Q199", "variant": 0}, "response": ["Based on the anthropological framework, my emic perspective as a married male from Menofia, Egypt, at the age of 36 and with a working-class background, is influenced by my cultural context, individual values, and personal experience. In Egypt, politics is deeply ingrained in the cultural context and has a significant impact on daily life. My personal experience and values have been shaped by this, and I have seen how politics can directly affect my family and community. Additionally, my socioeconomic background as part of the working class has also influenced my perspective on politics, as I have experienced the impact of policies on my livelihood. Therefore, given these factors, I am somewhat interested in politics.\n\n2"]}, {"persona": {"region": "Menofia", "sex": "female", "age": 52, "country": "Egypt", "marital_status": "married", "education": "higher", "social_class": "lower middle class"}, "question": {"id": "Q199", "variant": 0}, "response": ["Based on the anthropological framework, my emic perspective as a married woman from Menofia, Egypt, who is 52 years old and part of the lower middle class, is influenced by my cultural context, individual values, and socioeconomic background. In Menofia, politics plays a significant role in daily life and decision-making, and my education has provided me with the knowledge and awareness of political issues. However, as a lower middle class woman, I am also focused on providing for my family and navigating the economic challenges we face. Therefore, I would say I am somewhat interested in politics, as it is important for me to stay informed and engaged, but my primary focus is on the practical aspects of daily life.\n\n2"]}, {"persona": {"region": "Menofia", "sex": "male", "age": 52, "country": "Egypt", "marital_status": "married", "education": "higher", "social_class": "lower middle class"}, "question": {"id": "Q199", "variant": 0}, "response": ["Based on the anthropological framework, my emic perspective as a married male from Menofia, Egypt, who is 52 years old and part of the lower middle class, is influenced by my cultural context, individual values, socioeconomic background, and space and time. In Menofia, political engagement is important for community cohesion and individual empowerment. My personal experience and education level have also shaped my understanding of the significance of politics. As a member of the lower middle class, I am directly impacted by political decisions that affect my access to resources and opportunities. Therefore, I am somewhat interested in politics.\n\n2"]}, {"persona": {"region": "Menofia", "sex": "male", "age": 39, "country": "Egypt", "marital_status": "married", "education": "middle", "social_class": "lower class"}, "question": {"id": "Q199", "variant": 0}, "response": ["From the emic perspective, as a married male from Menofia, Egypt, I am likely to have a strong sense of community and kinship networks, which could lead me to be more interested in local politics that directly affect my family and community. Additionally, my lower socioeconomic background may make me more attuned to political issues that impact my financial situation and access to resources. Furthermore, my middle education level may have provided me with some understanding of political systems and their impact on society, which could increase my interest in politics. Given these factors, I would likely be somewhat interested in politics, as it directly affects my life and the lives of those around me.\n\n2"]}, {"persona": {"region": "Menofia", "sex": "male", "age": 23, "country": "Egypt", "marital_status": "single", "education": "middle", "social_class": "lower middle class"}, "question": {"id": "Q199", "variant": 0}, "response": ["From an emic perspective, growing up in Menofia, Egypt, I have been surrounded by a strong sense of community and collective identity, which has shaped my understanding of the importance of politics in our society. The cultural context of Egypt, with its history of political revolutions and movements, also influences my perception of politics as a significant aspect of our lives. As a young man from a lower middle class background, I am acutely aware of the impact of political decisions on our socioeconomic status and access to resources. Additionally, my personal experience with the education system and limited opportunities for upward mobility has made me somewhat interested in politics as a means of creating change and improving the lives of individuals in similar circumstances. Therefore, I would choose:\n\n2"]}, {"persona": {"region": "Dakahlia", "sex": "female", "age": 24, "country": "Egypt", "marital_status": "single", "education": "higher", "social_class": "lower middle class"}, "question": {"id": "Q199", "variant": 0}, "response": ["Based on the anthropological framework, my emic perspective as a single female from Dakahlia, Egypt, who is 24 years old and comes from the lower middle class, is influenced by my cultural context, individual values and personal experience, and socioeconomic background. In Egypt, there are specific cultural norms and expectations for women, especially those from lower socioeconomic backgrounds. My personal experiences have also likely shaped my perception of politics, and as a young woman who has completed higher education, I may feel somewhat interested in politics as it directly impacts my life and future opportunities. Therefore, I would choose:\n2"]}, {"persona": {"region": "Dakahlia", "sex": "male", "age": 36, "country": "Egypt", "marital_status": "married", "education": "higher", "social_class": "upper middle class"}, "question": {"id": "Q199", "variant": 0}, "response": ["Based on the anthropological framework, as a married male from Dakahlia, Egypt, my emic perspective is influenced by my cultural context, individual values, socioeconomic background, and the nuance of the question. In Egyptian society, politics is a significant part of everyday life and is deeply ingrained in our cultural context. As someone who has completed higher education and considers myself part of the upper middle class, I have been exposed to and have a deeper understanding of political issues. My personal values and experience also play a role in my interest in politics, as I believe that being informed and engaged in political matters is important for the betterment of society. Therefore, I am very interested in politics.\n\n1"]}, {"persona": {"region": "Dakahlia", "sex": "female", "age": 71, "country": "Egypt", "marital_status": "married", "education": "higher", "social_class": "upper middle class"}, "question": {"id": "Q199", "variant": 0}, "response": ["Based on the anthropological framework, as a married female from Dakahlia, Egypt, my emic perspective is influenced by my cultural context, individual values, and socioeconomic background. In Egyptian society, politics play a significant role in shaping everyday life, and as a woman who has completed higher education and considers herself part of the upper middle class, I am likely to be very interested in politics. My personal experience and values have led me to prioritize staying informed and engaged in political matters that impact my community and societal dynamics. Additionally, my age and place in society have given me a nuanced understanding of the importance of political involvement, further influencing my high level of interest in politics.\n\n2"]}, {"persona": {"region": "Dakahlia", "sex": "male", "age": 55, "country": "Egypt", "marital_status": "married", "education": "higher", "social_class": "upper middle class"}, "question": {"id": "Q199", "variant": 0}, "response": ["Based on the anthropological framework, as a married male from Dakahlia, Egypt, age 55, with a higher education level and part of the upper middle class, my perspective on politics is influenced by various factors. The cultural context of Egypt, combined with my socioeconomic background and educational attainment, has shaped my interest in politics. Additionally, my personal experiences and individual values play a significant role in determining my level of interest in political matters. Considering these factors, I would choose option (2) Somewhat interested in politics. \n\n2"]}, {"persona": {"region": "Dakahlia", "sex": "male", "age": 64, "country": "Egypt", "marital_status": "married", "education": "higher", "social_class": "lower middle class"}, "question": {"id": "Q199", "variant": 0}, "response": ["From the anthropological framework described above, my answer to the question of how interested I am in politics is influenced by a combination of factors. As a married male from Dakahlia, Egypt, my cultural context plays a significant role in shaping my interest in politics. Being from Egypt, where politics and governance have historically had a profound impact on daily life, I have been exposed to political discussions and events from a young age. Additionally, my higher education level has equipped me with the knowledge and critical thinking skills to engage with political issues. However, being part of the lower middle class means that I may not have the resources or access to actively participate in political activities. Considering my age, I may have witnessed significant political changes and have developed a nuanced understanding of political dynamics over time. Therefore, based on my personal experience, cultural context, and socioeconomic background, I would say that I am somewhat interested in politics.\n\n2"]}, {"persona": {"region": "Dakahlia", "sex": "female", "age": 29, "country": "Egypt", "marital_status": "married", "education": "middle", "social_class": "lower class"}, "question": {"id": "Q199", "variant": 0}, "response": ["Based on the anthropological framework, my emic perspective as a married female from Dakahlia, Egypt, is influenced by my cultural context, individual values, and socioeconomic background. In Egypt, political participation and interest in politics are often influenced by societal norms and expectations, which are shaped by cultural and socioeconomic factors. As a member of the lower class, my access to political information and opportunities for political involvement may be limited. Additionally, my personal experiences and values may also play a role in shaping my interest in politics. Therefore, considering all these factors, I would choose option 2: Somewhat interested. \n\n2"]}, {"persona": {"region": "Dakahlia", "sex": "female", "age": 40, "country": "Egypt", "marital_status": "married", "education": "middle", "social_class": "upper middle class"}, "question": {"id": "Q199", "variant": 0}, "response": ["Based on my personal experience and socioeconomic background, as a married female from Dakahlia, Egypt, I have been exposed to a particular cultural context that values education and social status. My age and place also play a role in shaping my perspective on politics. In my community, it is important to show interest in political matters as it reflects a sense of responsibility and social awareness. Additionally, being part of the upper middle class, I have access to resources and information that allow me to engage in political discussions and stay informed about current events. Therefore, I would choose option (2) Somewhat interested in politics as it accurately reflects my perspective.\n\n2"]}, {"persona": {"region": "Dakahlia", "sex": "male", "age": 37, "country": "Egypt", "marital_status": "married", "education": "higher", "social_class": "lower middle class"}, "question": {"id": "Q199", "variant": 0}, "response": ["From an anthropological perspective, my emic and etic perspectives as a married male from Dakahlia, Egypt, at 37 years of age, with a higher education level, and considering myself part of the lower middle class, are shaped by my cultural context, individual values, socioeconomic background, and space and time. In Egypt, politics play a significant role in daily life and are deeply intertwined with social and economic issues. My personal experiences and values lead me to be somewhat interested in politics, as I understand the impact of political decisions on my community and family. Additionally, my socioeconomic background and education level have provided me with the knowledge and understanding to engage with political matters to some extent. Therefore, I believe that my choice reflects the perspective of the persona described above.\n\n2"]}, {"persona": {"region": "Dakahlia", "sex": "female", "age": 45, "country": "Egypt", "marital_status": "married", "education": "middle", "social_class": "working class"}, "question": {"id": "Q199", "variant": 0}, "response": ["Based on the anthropological framework, as a married female from Dakahlia, Egypt, my emic perspective on politics is influenced by my cultural context, individual values, and socioeconomic background. In my community, women are expected to prioritize family and household duties, and political participation is not encouraged. Additionally, my middle education level and working-class status limit my exposure to political discourse and opportunities for involvement. Therefore, I would choose option (3) Not very interested to accurately reflect my perspective within this cultural and socioeconomic context. \n\n3"]}, {"persona": {"region": "Dakahlia", "sex": "male", "age": 34, "country": "Egypt", "marital_status": "single", "education": "middle", "social_class": "lower middle class"}, "question": {"id": "Q199", "variant": 0}, "response": ["Based on the anthropological framework, my emic perspective as a single male from Dakahlia, Egypt, with a middle education level and lower middle class background, leads me to prioritize my individual values and personal experience in evaluating my interest in politics. In my cultural context, politics may be seen as distant from my daily life and may not directly impact my socioeconomic background. Additionally, my age and place in society may also influence my level of interest in politics. Therefore, considering these factors, I would choose:\n\n2"]}, {"persona": {"region": "Dakahlia", "sex": "female", "age": 26, "country": "Egypt", "marital_status": "married", "education": "higher", "social_class": "upper middle class"}, "question": {"id": "Q199", "variant": 0}, "response": ["Based on the anthropological framework, I, as a married female from Dakahlia, Egypt, would consider my interest in politics within the cultural context of my upbringing and education. In Egypt, politics play a significant role in everyday life, and my higher education level has provided me with a deeper understanding of political systems and their impact on society. Additionally, my socioeconomic background as part of the upper middle class means that I am likely to have more access to information and resources to engage in political discussions. Therefore, I would consider myself very interested in politics.\n\n1"]}, {"persona": {"region": "Dakahlia", "sex": "male", "age": 21, "country": "Egypt", "marital_status": "single", "education": "middle", "social_class": "upper middle class"}, "question": {"id": "Q199", "variant": 0}, "response": ["Based on the anthropological framework, my emic perspective as a single male from Dakahlia, Egypt, influences my interest in politics. Being part of the upper middle class, my cultural context and socioeconomic background shape my understanding of politics. Additionally, my individual values and personal experiences play a role in my perception of political engagement. As a 21-year-old, my age and space (Dakahlia, Egypt) also contribute to my level of interest in politics. Therefore, considering all these factors, I would choose the following option:\n2"]}, {"persona": {"region": "Dakahlia", "sex": "female", "age": 32, "country": "Egypt", "marital_status": "married", "education": "middle", "social_class": "working class"}, "question": {"id": "Q199", "variant": 0}, "response": ["Based on the anthropological framework, as a married female from Dakahlia, Egypt, my emic perspective on politics is influenced by my cultural context, individual values, and socioeconomic background. In Egypt, politics plays a significant role in everyday life, and as a member of the working class, I am directly affected by government policies and decisions. Additionally, my personal experience and values have shaped my interest in politics, as I have witnessed the impact of political changes on my community. Therefore, I am somewhat interested in politics.\n\n2"]}, {"persona": {"region": "Dakahlia", "sex": "female", "age": 35, "country": "Egypt", "marital_status": "married", "education": "middle", "social_class": "upper middle class"}, "question": {"id": "Q199", "variant": 0}, "response": ["Based on the anthropological framework, as a married female from Dakahlia, Egypt, I have been influenced by my cultural context, individual values, and socioeconomic background. In Egypt, politics plays a significant role in everyday life and is intertwined with cultural, social, and economic factors. Additionally, as a member of the upper middle class, I may have more access to resources and opportunities that are affected by political decisions. My personal experience and values have also led me to be somewhat interested in politics, as I understand the impact it has on my life and the lives of those around me.\n\n2"]}, {"persona": {"region": "Dakahlia", "sex": "male", "age": 33, "country": "Egypt", "marital_status": "married", "education": "middle", "social_class": "upper middle class"}, "question": {"id": "Q199", "variant": 0}, "response": ["Based on the anthropological framework, as a married male from Dakahlia, Egypt, my emic perspective on politics is influenced by the cultural context of my community, where political engagement and awareness are valued. My personal experience and individual values also play a role, as I have seen the impact of political decisions on my family and community. Additionally, my socioeconomic background as part of the upper middle class has afforded me the education and resources to be more engaged in political discussions. Considering all these factors, my nuanced understanding of politics leads me to be somewhat interested in politics.\n\n2"]}, {"persona": {"region": "Dakahlia", "sex": "female", "age": 45, "country": "Egypt", "marital_status": "married", "education": "middle", "social_class": "upper middle class"}, "question": {"id": "Q199", "variant": 0}, "response": ["From the emic perspective, as a married female from Dakahlia, Egypt, my understanding and interest in politics are deeply influenced by my cultural context. In Egypt, the political landscape plays a significant role in shaping the everyday lives of its citizens. Additionally, my personal experience and individual values as a middle-aged, educated woman from the upper middle class also contribute to my interest in political affairs. Furthermore, my socioeconomic background and the nuanced phrasing of the question will impact my response. Therefore, I would choose option (2) Somewhat interested, as I am aware of the importance of politics in my society and have a moderate level of interest in staying informed and engaged in political matters. \n\n2"]}, {"persona": {"region": "Dakahlia", "sex": "male", "age": 30, "country": "Egypt", "marital_status": "married", "education": "middle", "social_class": "upper middle class"}, "question": {"id": "Q199", "variant": 0}, "response": ["Based on the anthropological framework, as a married male from Dakahlia, Egypt, my emic perspective on politics is influenced by my cultural context, individual values, and socioeconomic background. In my society, politics plays a significant role in shaping the lives of individuals and the community as a whole. Additionally, my upper middle class status may afford me more opportunities to engage with political matters. However, my personal experience and individual values may also lead me to prioritize other aspects of life over politics. Taking into account the nuance of the question and my specific background, I would choose option (2) Somewhat interested in politics.\n\n2"]}, {"persona": {"region": "Dakahlia", "sex": "female", "age": 63, "country": "Egypt", "marital_status": "married", "education": "higher", "social_class": "lower middle class"}, "question": {"id": "Q199", "variant": 0}, "response": ["Based on the anthropological framework, my emic perspective as a married female from Dakahlia, Egypt, at the age of 63 and part of the lower middle class, is influenced by my cultural context, individual values, and socioeconomic background. In my cultural context, politics may not have been a prominent topic of discussion, and my personal experiences may have led me to prioritize other aspects of life. Additionally, my lower middle class status may have limited my access to political participation and influence. Therefore, I am not very interested in politics.\n\n3"]}, {"persona": {"region": "Dakahlia", "sex": "male", "age": 28, "country": "Egypt", "marital_status": "single", "education": "higher", "social_class": "upper middle class"}, "question": {"id": "Q199", "variant": 0}, "response": ["Based on my emic perspective as a single male from Dakahlia, Egypt, I understand that political involvement and interest are influenced by cultural context, individual values, and socioeconomic background. In my community, higher education and being part of the upper middle class often correlate with a higher level of interest and involvement in politics. Additionally, my age and place in society also play a role in shaping my views on this topic. Given these factors, I would choose the following option:\n\n2"]}, {"persona": {"region": "Dakahlia", "sex": "female", "age": 24, "country": "Egypt", "marital_status": "married", "education": "higher", "social_class": "upper middle class"}, "question": {"id": "Q199", "variant": 0}, "response": ["Based on the anthropological framework, my individual values and personal experience play a significant role in shaping my perspective on politics. Growing up in Dakahlia, Egypt, I have been surrounded by a culture that values education and intellectual pursuits, which has influenced my own higher education level. Additionally, coming from the upper middle class, I have been exposed to discussions and debates on various societal issues, including politics. My socioeconomic background has provided me with the resources and opportunities to engage in political discourse. Furthermore, my age and place of upbringing have also shaped my understanding of the importance of being informed and involved in political matters. Therefore, I would choose option (1) Very interested in politics, as it aligns with my personal experiences and values. \n\n1"]}, {"persona": {"region": "Dakahlia", "sex": "male", "age": 20, "country": "Egypt", "marital_status": "single", "education": "middle", "social_class": "upper middle class"}, "question": {"id": "Q199", "variant": 0}, "response": ["Based on the anthropological framework, as a 20-year-old single male from Dakahlia, Egypt, who has completed middle education and considers himself part of the upper middle class, my emic perspective on politics is influenced by my cultural context, individual values, and socioeconomic background. In Egypt, politics play a significant role in daily life, and my cultural context has shaped my understanding of the importance of being informed about political matters. Additionally, my socioeconomic background as part of the upper middle class may afford me greater access to information and resources related to politics. Therefore, my personal experience and values lead me to be very interested in politics as it directly impacts my life and future prospects.\n\n3"]}, {"persona": {"region": "Dakahlia", "sex": "male", "age": 45, "country": "Egypt", "marital_status": "married", "education": "middle", "social_class": "upper middle class"}, "question": {"id": "Q199", "variant": 0}, "response": ["From the emic perspective, as a married male from Dakahlia, Egypt, my cultural context and socioeconomic background play a significant role in shaping my interest in politics. In Egypt, politics and social status are closely intertwined, and being part of the upper middle class, I am likely to have a vested interest in political matters that affect my social and economic standing. Additionally, my middle education level may have exposed me to political discussions and issues that have influenced my personal values and understanding of the political landscape. Considering the nuance of the question, I would say I am somewhat interested in politics, as it directly impacts my life and social standing in my community.\n\n2"]}, {"persona": {"region": "Dakahlia", "sex": "female", "age": 43, "country": "Egypt", "marital_status": "married", "education": "higher", "social_class": "upper middle class"}, "question": {"id": "Q199", "variant": 0}, "response": ["From the perspective of a married female from Dakahlia, Egypt, who is 43 years old, has completed higher education, and considers herself part of the upper middle class, it is important to consider the cultural context, individual values, and socioeconomic background in answering the question of interest in politics. In Egypt, there is a strong emphasis on family and community, and individuals often prioritize the well-being of their immediate social circles. Additionally, higher education and belonging to the upper middle class may lead to a greater awareness of political issues and a sense of civic responsibility. However, the political climate in Egypt may also be a factor, as there are limitations on political participation and freedom of expression. Taking these factors into account, I would choose the following option:\n\n2"]}, {"persona": {"region": "Dakahlia", "sex": "female", "age": 20, "country": "Egypt", "marital_status": "single", "education": "middle", "social_class": "upper middle class"}, "question": {"id": "Q199", "variant": 0}, "response": ["Based on the anthropological framework, my emic perspective as a single female from Dakahlia, Egypt, at the age of 20 and belonging to the upper middle class, is influenced by my cultural context, individual values, socioeconomic background, and space and time. In Egypt, there is a strong emphasis on family and community values, and as a young woman, I may feel a sense of duty to be involved in the political process to bring positive change for my community. Additionally, being part of the upper middle class may provide me with more opportunities to engage in politics and have a voice in decision-making. Therefore, I would be somewhat interested in politics as it directly impacts my life and the lives of those around me.\n\n2"]}, {"persona": {"region": "Dakahlia", "sex": "female", "age": 40, "country": "Egypt", "marital_status": "single", "education": "middle", "social_class": "lower middle class"}, "question": {"id": "Q199", "variant": 0}, "response": ["Based on the anthropological framework, as a single female from Dakahlia, Egypt, aged 40, with a middle education level and belonging to the lower middle class, my perspective on politics would be influenced by my cultural context, individual values, and socioeconomic background. As a member of the lower middle class in Egypt, I am likely to have limited access to political resources and may not have the means to actively engage in political activities. Additionally, my cultural context and personal experiences may have shaped my perception of politics, potentially leading me to feel disempowered or disconnected from the political process. Therefore, I would choose option (3) Not very interested in politics, as my circumstances may have led me to prioritize other aspects of my life over political engagement.  \n\n3"]}, {"persona": {"region": "Dakahlia", "sex": "female", "age": 33, "country": "Egypt", "marital_status": "married", "education": "higher", "social_class": "upper middle class"}, "question": {"id": "Q199", "variant": 0}, "response": ["Based on the anthropological framework, as a married female from Dakahlia, Egypt, I am heavily influenced by my cultural context, personal experience, and socioeconomic background. In Egypt, politics plays a significant role in shaping daily life and societal norms, and as someone who has completed higher education and considers themselves part of the upper middle class, I am likely to have a higher level of interest in politics. Additionally, being 33 years old, I am at an age where I am likely to be more aware and engaged in political matters. Therefore, based on my background and cultural context, I would be \"very interested\" in politics.\n\n1"]}, {"persona": {"region": "Dakahlia", "sex": "female", "age": 24, "country": "Egypt", "marital_status": "married", "education": "middle", "social_class": "working class"}, "question": {"id": "Q199", "variant": 0}, "response": ["Based on the anthropological framework, my perspective as a married female from Dakahlia, Egypt, who is 24 years old, has completed middle education, and considers herself part of the working class, is shaped by my cultural context, individual values, and socioeconomic background. In Dakahlia, politics may not be a top priority for someone in my demographic, as the focus may be on providing for my family and navigating daily life. Additionally, my education level and socioeconomic background may limit my access to political information and influence my level of interest in politics. Therefore, I would choose option 3, \"Not very interested,\" as this reflects the perspective of the persona described above.\n\n3"]}, {"persona": {"region": "Dakahlia", "sex": "female", "age": 53, "country": "Egypt", "marital_status": "widowed", "education": "middle", "social_class": "working class"}, "question": {"id": "Q199", "variant": 0}, "response": ["Based on the anthropological framework, my perspective as a widowed female from Dakahlia, Egypt, who is 53 years old, has a middle education level, and considers herself part of the working class would be shaped by my cultural context, individual values, and socioeconomic background. As a member of the working class in Egypt, I am likely to have experienced the impact of political decisions on my everyday life and have personal values that prioritize issues related to economic stability and social welfare. Additionally, my cultural context and socioeconomic background may have limited my access to formal political participation and decision-making processes. Therefore, I would choose option (2) Somewhat interested in politics, as I am likely to have a moderate level of interest and awareness of political issues that affect my life and community. \n\n2"]}, {"persona": {"region": "Dakahlia", "sex": "female", "age": 30, "country": "Egypt", "marital_status": "single", "education": "middle", "social_class": "lower middle class"}, "question": {"id": "Q199", "variant": 0}, "response": ["Based on my cultural context in Dakahlia, Egypt, as a single female in the lower middle class, my socioeconomic background and limited education level play a significant role in shaping my understanding and interest in politics. My personal experience and individual values also contribute to my perspective. As a member of this specific demographic, I am likely to have limited exposure to formal political education and may be more focused on daily survival and personal responsibilities. Additionally, societal expectations and gender roles may influence my level of interest in politics. Therefore, I would choose the option:\n2"]}, {"persona": {"region": "Dakahlia", "sex": "male", "age": 53, "country": "Egypt", "marital_status": "married", "education": "higher", "social_class": "upper middle class"}, "question": {"id": "Q199", "variant": 0}, "response": ["Based on my personal experience and cultural context, as a married male from Dakahlia, Egypt, who has completed higher education and considers himself part of the upper middle class, I am very interested in politics. In Egypt, politics plays a significant role in shaping the socioeconomic landscape and affects individuals' lives in various ways. As an educated and financially stable individual, I am likely to be more engaged and interested in political matters, as they directly impact my family, community, and personal well-being. Additionally, my age and socio-economic background also contribute to my heightened interest in politics, as I am at a stage in life where I am concerned about the future and stability of my country. Therefore, I am keenly interested in political affairs and make it a priority to stay informed and involved in the political discourse.\n\n2"]}, {"persona": {"region": "Dakahlia", "sex": "male", "age": 28, "country": "Egypt", "marital_status": "married", "education": "middle", "social_class": "working class"}, "question": {"id": "Q199", "variant": 0}, "response": ["Based on the anthropological framework, my emic perspective as a married male from Dakahlia, Egypt, who is 28 years old and part of the working class, is heavily influenced by my cultural context, individual values, socioeconomic background, and space and time. In Egypt, politics plays a significant role in our daily lives and is deeply ingrained in our culture. Additionally, my middle education level and working-class status may limit my access to political information and involvement in political activities. Considering these factors, I would say that I am somewhat interested in politics.\n\n2"]}, {"persona": {"region": "Dakahlia", "sex": "female", "age": 38, "country": "Egypt", "marital_status": "married", "education": "middle", "social_class": "upper middle class"}, "question": {"id": "Q199", "variant": 0}, "response": ["Based on the anthropological framework, my emic perspective as a married female from Dakahlia, Egypt, at the age of 38 with a middle education level and considering myself part of the upper middle class, would be influenced by my cultural context, individual values, and socioeconomic background. In Egypt, politics play a significant role in shaping everyday life, and as someone who values education and is part of the upper middle class, I would likely have a strong interest in politics as it directly impacts my social and economic status. Additionally, my experiences and personal values would likely lead me to be very interested in politics as I recognize the importance of being informed and engaged in societal affairs. Therefore, from this perspective, I would choose option (1) Very interested in politics. \n\n1"]}, {"persona": {"region": "Gharbia", "sex": "male", "age": 27, "country": "Egypt", "marital_status": "single", "education": "higher", "social_class": "upper middle class"}, "question": {"id": "Q199", "variant": 0}, "response": ["As a single male from Gharbia, Egypt, with a higher education and belonging to the upper middle class, my perspective on politics is heavily influenced by my socioeconomic background, cultural context, and individual values. In Egypt, politics plays a significant role in shaping the social and economic landscape, and as someone who has benefited from my class privilege and education, I am very interested in politics as it directly impacts my life and opportunities. Additionally, my cultural context and personal experiences have exposed me to the importance of being actively engaged in the political sphere to advocate for change and progress in my community and country. Therefore, I would choose:\n\n1"]}, {"persona": {"region": "Gharbia", "sex": "female", "age": 35, "country": "Egypt", "marital_status": "married", "education": "higher", "social_class": "upper middle class"}, "question": {"id": "Q199", "variant": 0}, "response": ["Based on the anthropological framework, as a married female from Gharbia, Egypt, I am influenced by my cultural context, individual values, and socioeconomic background. In Egypt, politics play a significant role in shaping our lives, and as someone who values education and belongs to the upper middle class, I understand the importance of being informed and engaged in political matters. Additionally, my age and education level have likely exposed me to different perspectives and given me the critical thinking skills to understand the impact of politics on my life and community. Therefore, I would choose option (1) Very interested in politics."]}, {"persona": {"region": "Gharbia", "sex": "female", "age": 37, "country": "Egypt", "marital_status": "married", "education": "higher", "social_class": "upper middle class"}, "question": {"id": "Q199", "variant": 0}, "response": ["Based on the anthropological framework, as a married female from Gharbia, Egypt, my emic perspective on politics is shaped by my cultural context, individual values, and socioeconomic background. In Egypt, politics play a significant role in society, and as a well-educated woman from the upper middle class, I have been exposed to political discussions and have the means to engage in political activities. Additionally, my personal experience and values have influenced my interest in politics, as I have witnessed the impact of political decisions on my family and community. Therefore, I am very interested in politics.\n\n1"]}, {"persona": {"region": "Gharbia", "sex": "male", "age": 43, "country": "Egypt", "marital_status": "married", "education": "middle", "social_class": "lower middle class"}, "question": {"id": "Q199", "variant": 0}, "response": ["Based on the anthropological framework, my response to the question of how interested I am in politics is influenced by my cultural context, individual values, and socioeconomic background. As a married male from Gharbia, Egypt, at 43 years of age with a middle education level and considering myself part of the lower middle class, my perspective on politics is shaped by the cultural and socioeconomic factors in my life. In Egypt, there is a strong emphasis on family and community, and as someone from the lower middle class, my focus is primarily on providing for my family and ensuring their well-being. While I understand the importance of politics, my personal experience and socioeconomic background have led me to prioritize other aspects of life. Therefore, my interest in politics is somewhat limited, and I would choose option (3) Not very interested."]}, {"persona": {"region": "Gharbia", "sex": "male", "age": 28, "country": "Egypt", "marital_status": "single", "education": "higher", "social_class": "lower middle class"}, "question": {"id": "Q199", "variant": 0}, "response": ["Based on the anthropological framework, as a single male from Gharbia, Egypt, my emic perspective is heavily influenced by the cultural context of my upbringing, education level, and socioeconomic background. Growing up in Gharbia, politics has always been a topic of discussion within my community, and my higher education has further deepened my understanding of its importance. Additionally, being part of the lower middle class, I am keenly aware of the impact political decisions have on my life and the lives of those around me. Therefore, my personal experience and values lead me to be very interested in politics.\n\n2"]}, {"persona": {"region": "Gharbia", "sex": "male", "age": 39, "country": "Egypt", "marital_status": "married", "education": "middle", "social_class": "lower middle class"}, "question": {"id": "Q199", "variant": 0}, "response": ["Based on the anthropological framework, my emic perspective as a married male from Gharbia, Egypt, at 39 years of age and belonging to the lower middle class, is heavily influenced by my cultural context, individual values, and socioeconomic background. In Egypt, politics has a significant impact on everyday life, and my personal experience has shown that it directly affects my family, work, and community. Additionally, my lower middle-class status means that I am more likely to be affected by political decisions and policies. Taking into account the nuanced phrasing of the question and the cultural relativism of my society, I would choose option (2) Somewhat interested. \n\n2"]}, {"persona": {"region": "Gharbia", "sex": "male", "age": 30, "country": "Egypt", "marital_status": "married", "education": "middle", "social_class": "lower middle class"}, "question": {"id": "Q199", "variant": 0}, "response": ["Based on the anthropological framework, as a married male from Gharbia, Egypt, my emic perspective on politics is influenced by my cultural context, individual values, and socioeconomic background. In Egypt, politics plays a significant role in daily life and is often intertwined with social and economic issues. As a member of the lower middle class, I am more likely to be directly impacted by political decisions and policies. Additionally, my personal experience and education level may also influence my understanding and interest in politics. Therefore, I would choose option 2, somewhat interested, as I recognize the importance of politics in my life and community, but may not have the resources or access to fully engage in political activities.\n\n2"]}, {"persona": {"region": "Gharbia", "sex": "male", "age": 43, "country": "Egypt", "marital_status": "married", "education": "lower", "social_class": "lower middle class"}, "question": {"id": "Q199", "variant": 0}, "response": ["From the perspective of a married male from Gharbia, Egypt, who is 43 years old, has completed a lower education level, and considers himself part of the lower middle class, several factors influence his interest in politics. Firstly, his cultural context in Egypt, where political engagement and awareness may be influenced by historical and contemporary socio-political events. Additionally, his lower education level may limit his access to information and understanding of political processes. Furthermore, his socioeconomic background as part of the lower middle class may mean that he is more focused on providing for his family and may not have the time or resources to engage in politics actively. Considering the emic and etic perspectives, it is likely that he may have a nuanced understanding of politics shaped by his personal experiences and values, and his interest in politics may be influenced by the specific political climate in Egypt. Taking all these factors into account, it is most likely that he would select option (2) Somewhat interested in politics. \n\n2"]}, {"persona": {"region": "Gharbia", "sex": "male", "age": 36, "country": "Egypt", "marital_status": "married", "education": "higher", "social_class": "lower middle class"}, "question": {"id": "Q199", "variant": 0}, "response": ["Based on the anthropological framework, my cultural context as a married male from Gharbia, Egypt, along with my socioeconomic background as part of the lower middle class, greatly influences my perspective on politics. My individual values and personal experience also play a significant role in shaping my interest in politics. In this region, politics has a direct impact on daily life, and the cultural context emphasizes the importance of community and family. Additionally, my age and education level have exposed me to different political ideologies. Therefore, considering all these factors, my interest in politics would be:\n\n3) Not very interested"]}, {"persona": {"region": "Gharbia", "sex": "male", "age": 25, "country": "Egypt", "marital_status": "married", "education": "middle", "social_class": "upper middle class"}, "question": {"id": "Q199", "variant": 0}, "response": ["Based on my cultural context in Gharbia, Egypt, where political engagement is highly valued and deeply ingrained in our society, my individual values and personal experience, as well as my socioeconomic background as part of the upper middle class, have shaped my interest in politics. Additionally, being 25 years of age, I am at a stage where I am actively involved in understanding and participating in political discussions and activities. Therefore, I am very interested in politics.\n\n1"]}, {"persona": {"region": "Gharbia", "sex": "male", "age": 31, "country": "Egypt", "marital_status": "married", "education": "middle", "social_class": "upper middle class"}, "question": {"id": "Q199", "variant": 0}, "response": ["Based on the anthropological framework, as a married male from Gharbia, Egypt, my emic perspective on politics is influenced by my cultural context, individual values, and socioeconomic background. In Egypt, political participation is highly valued and seen as a way to contribute to the community. Additionally, as part of the upper middle class, I have access to education and resources that allow me to engage in political discourse. Therefore, I would say I am somewhat interested in politics.\n\n2"]}, {"persona": {"region": "Gharbia", "sex": "male", "age": 33, "country": "Egypt", "marital_status": "married", "education": "higher", "social_class": "lower middle class"}, "question": {"id": "Q199", "variant": 0}, "response": ["Based on the anthropological framework, my emic perspective as a married male from Gharbia, Egypt, at 33 years of age and part of the lower middle class, is influenced by my cultural context, individual values, socioeconomic background, and space and time. In Gharbia, politics plays a significant role in shaping everyday life and opportunities for social and economic mobility. My higher education level has provided me with a deeper understanding of political systems and their impact on my community. As a member of the lower middle class, I am particularly attuned to political decisions that affect access to resources and opportunities for upward mobility. Therefore, I am very interested in politics.\n\n1"]}, {"persona": {"region": "Gharbia", "sex": "male", "age": 26, "country": "Egypt", "marital_status": "single", "education": "higher", "social_class": "upper middle class"}, "question": {"id": "Q199", "variant": 0}, "response": ["Based on the anthropological framework, my emic perspective as a single male from Gharbia, Egypt, who is 26 years old, has completed higher education, and considers myself part of the upper middle class, is influenced by my cultural context, individual values, and socioeconomic background. In Egypt, politics plays a significant role in shaping the society, economy, and daily life. My personal experience and values lead me to be very interested in politics as I understand its impact on my life and the lives of those around me. Additionally, my higher education has provided me with the knowledge and critical thinking skills to engage in political discourse and understand its complexities. As a member of the upper middle class, I have a stake in political decision-making and policies that may affect my socioeconomic status. Therefore, my interest in politics is influenced by my cultural context, personal experiences, and socioeconomic background, leading me to be very interested in politics.\n\n1"]}, {"persona": {"region": "Gharbia", "sex": "female", "age": 45, "country": "Egypt", "marital_status": "married", "education": "middle", "social_class": "lower middle class"}, "question": {"id": "Q199", "variant": 0}, "response": ["Based on the anthropological framework, as a married female from Gharbia, Egypt, my cultural context and socioeconomic background play a significant role in shaping my perspective on politics. In Egypt, women often have limited access to political participation and decision-making processes, which may influence my interest in politics. Additionally, as a member of the lower middle class, my focus may be more on daily survival and providing for my family, rather than engaging in political matters. Furthermore, my age and level of education may also impact my understanding and interest in political issues. Therefore, I would choose option (3) Not very interested, as my cultural context and socioeconomic background may lead me to prioritize other aspects of life over political engagement. \n\n3"]}, {"persona": {"region": "Gharbia", "sex": "female", "age": 55, "country": "Egypt", "marital_status": "married", "education": "middle", "social_class": "upper middle class"}, "question": {"id": "Q199", "variant": 0}, "response": ["Based on the anthropological framework, as a married female from Gharbia, Egypt, my emic perspective on politics is greatly influenced by my cultural context. In Egypt, politics is a significant aspect of daily life and is often discussed within the family and community. Additionally, my personal experience and individual values have shaped my interest in politics, as I have witnessed the impact of political decisions on my family and community. Furthermore, my socioeconomic background as part of the upper middle class has afforded me the opportunity to engage in political discussions and be more aware of political issues. Therefore, I would choose option (2) Somewhat interested as my perspective on politics is influenced by my cultural context, personal experience, and socioeconomic background. \n\n2"]}, {"persona": {"region": "Gharbia", "sex": "female", "age": 27, "country": "Egypt", "marital_status": "married", "education": "higher", "social_class": "upper middle class"}, "question": {"id": "Q199", "variant": 0}, "response": ["Based on the anthropological framework, my emic perspective as a married female from Gharbia, Egypt, who is 27 years old, has completed higher education, and considers herself part of the upper middle class, influences my answer to the question of how interested I am in politics. In my cultural context, politics may be seen as a vital aspect of societal structure and governance. My individual values and personal experience have also shaped my interest in politics, as I may have been exposed to the significance of political participation and its impact on my community. Additionally, my socioeconomic background as part of the upper middle class may afford me the resources and time to engage in political activities. Therefore, my nuanced understanding leads me to choose the option: (2) Somewhat interested."]}, {"persona": {"region": "Gharbia", "sex": "female", "age": 42, "country": "Egypt", "marital_status": "married", "education": "higher", "social_class": "upper middle class"}, "question": {"id": "Q199", "variant": 0}, "response": ["Based on the anthropological framework, as a married female from Gharbia, Egypt, my emic perspective on politics is heavily influenced by my cultural context, individual values, socioeconomic background, and space and time. As a woman in this region, I have likely experienced and observed how politics directly impacts my life, family, and community. Additionally, my higher education level and upper middle class status may have exposed me to a wider range of political issues and discussions. Furthermore, my age and place in society have likely shaped my understanding of the political landscape in Egypt. Considering all these factors, I would select option (2) Somewhat interested in politics as it reflects my nuanced understanding and personal experience in the realm of politics. \n\n2"]}, {"persona": {"region": "Gharbia", "sex": "female", "age": 32, "country": "Egypt", "marital_status": "married", "education": "middle", "social_class": "upper middle class"}, "question": {"id": "Q199", "variant": 0}, "response": ["Based on the anthropological framework, my emic perspective as a married female from Gharbia, Egypt, at the age of 32 and part of the upper middle class, is heavily influenced by my cultural context, individual values, and socioeconomic background. In Egyptian society, politics play a significant role in shaping daily life and are often discussed within the family and community. As someone who has completed middle education level and belongs to the upper middle class, I have been afforded certain opportunities for education and economic stability, which have likely influenced my interest in politics. Additionally, as a member of a society with a rich history and tradition of political participation, my personal experience and values may lead me to be somewhat interested in politics as a means of contributing to the betterment of my community and country.\n\n2"]}, {"persona": {"region": "Gharbia", "sex": "male", "age": 27, "country": "Egypt", "marital_status": "married", "education": "higher", "social_class": "upper middle class"}, "question": {"id": "Q199", "variant": 0}, "response": ["Based on the anthropological framework, as a married male from Gharbia, Egypt, my emic perspective is influenced by the cultural context of my upbringing and educational background. My personal experience and individual values also play a role in shaping my views. Additionally, my socioeconomic background as part of the upper middle class has likely afforded me certain privileges and opportunities that may impact my level of interest in politics. Furthermore, the nuanced phrasing of the question also influences my response.\n\n2"]}, {"persona": {"region": "Gharbia", "sex": "female", "age": 27, "country": "Egypt", "marital_status": "married", "education": "higher", "social_class": "lower middle class"}, "question": {"id": "Q199", "variant": 0}, "response": ["Based on the anthropological framework, as a married female from Gharbia, Egypt, my emic perspective on politics is influenced by the cultural context of my community and my socioeconomic background. In Gharbia, women are often expected to focus on their familial and domestic roles, and while there is a growing emphasis on women's rights and empowerment, political participation may still be limited for women in my demographic. Additionally, as part of the lower middle class, my personal experience and individual values may lead me to prioritize economic concerns over political engagement. Therefore, I would choose option (3) Not very interested, as my cultural context and socioeconomic background may lead me to have limited interest in politics."]}, {"persona": {"region": "Gharbia", "sex": "female", "age": 37, "country": "Egypt", "marital_status": "married", "education": "middle", "social_class": "upper middle class"}, "question": {"id": "Q199", "variant": 0}, "response": ["Based on the anthropological framework, my perspective as a married female from Gharbia, Egypt, at 37 years of age and belonging to the upper middle class, is influenced by my cultural context, individual values, and socioeconomic background. In Egyptian society, politics plays a significant role in shaping the daily lives of individuals and their families. As someone who has completed middle education level, I am aware of the impact of political decisions on various aspects of life, such as education, healthcare, and economic opportunities. Additionally, as part of the upper middle class, I may have a greater stake in political developments and may be more likely to engage with political issues. Therefore, my interest in politics is likely to be influenced by these factors.\n\n2"]}, {"persona": {"region": "Gharbia", "sex": "male", "age": 28, "country": "Egypt", "marital_status": "married", "education": "higher", "social_class": "working class"}, "question": {"id": "Q199", "variant": 0}, "response": ["Based on the anthropological framework, as a married male from Gharbia, Egypt, my emic perspective is influenced by the cultural context of my upbringing, language spoken, and kinship networks. My personal experience and individual values shape my subjective understanding of politics. Additionally, my socioeconomic background as part of the working class plays a significant role in my perception of politics. Cultural relativism reminds me that there is no hierarchy of culture, and my age and place further influence my perspective. Therefore, based on these factors, I would choose:\n\n3"]}, {"persona": {"region": "Gharbia", "sex": "female", "age": 50, "country": "Egypt", "marital_status": "married", "education": "middle", "social_class": "upper middle class"}, "question": {"id": "Q199", "variant": 0}, "response": ["Based on the anthropological framework, my perspective as a married female from Gharbia, Egypt, who is 50 years old and part of the upper middle class, is heavily influenced by my cultural context, individual values, and socioeconomic background. In Egypt, politics play a significant role in shaping societal norms and regulations, and as someone who is well-educated and part of the upper middle class, I am likely to be very interested in politics. My cultural context and socioeconomic background have instilled in me a strong sense of civic duty and responsibility, and I understand the impact that political decisions can have on my family and community. Additionally, my age and education level have likely exposed me to a variety of political perspectives, further fueling my interest in staying informed and engaged in political matters.\n\n2"]}, {"persona": {"region": "Gharbia", "sex": "male", "age": 39, "country": "Egypt", "marital_status": "single", "education": "higher", "social_class": "working class"}, "question": {"id": "Q199", "variant": 0}, "response": ["Based on the anthropological framework, my emic perspective as a single male from Gharbia, Egypt, with a working-class background and a higher education level, would influence my interest in politics. The cultural context of Egypt, with its complex political history and current socioeconomic challenges, would likely make me somewhat interested in politics. My individual values and personal experiences, along with my socioeconomic background, would also play a role in shaping my perspective on politics. Additionally, as a 39-year-old, I am at an age where I may feel a sense of responsibility to be informed about political matters. Taking into account these factors, I would choose option (2) Somewhat interested. \n\n2"]}, {"persona": {"region": "Gharbia", "sex": "female", "age": 45, "country": "Egypt", "marital_status": "married", "education": "higher", "social_class": "upper middle class"}, "question": {"id": "Q199", "variant": 0}, "response": ["Based on the anthropological framework described above, as a married female from Gharbia, Egypt, age 45, with higher education and part of the upper middle class, my perspective on politics is influenced by my cultural context, individual values, and socioeconomic background. In Gharbia, political engagement and awareness are valued, and my education has provided me with the knowledge and critical thinking skills to engage in political discourse. Additionally, as part of the upper middle class, I have a vested interest in policies that may affect my socioeconomic status. Therefore, I am very interested in politics.\n\n1"]}, {"persona": {"region": "Sharkia", "sex": "male", "age": 35, "country": "Egypt", "marital_status": "married", "education": "higher", "social_class": "upper middle class"}, "question": {"id": "Q199", "variant": 0}, "response": ["Based on the anthropological framework, my emic perspective as a married male from Sharkia, Egypt, who has completed higher education and considers himself part of the upper middle class, is that my cultural context and individual values and personal experience play a significant role in shaping my interest in politics. In Egypt, politics has a profound impact on daily life and is intricately linked with cultural, socioeconomic, and historical factors. As someone who values education and comes from a relatively privileged background, I am likely to have a greater awareness and interest in political affairs, as they directly affect my socioeconomic status and the opportunities available to me and my family. Additionally, my age and place in society also influence my perception of politics, as I am at a stage in life where I am actively engaged in shaping the future for myself and my community. Therefore, considering all these factors, I would choose option (1) Very interested. \n\n1"]}, {"persona": {"region": "Sharkia", "sex": "female", "age": 55, "country": "Egypt", "marital_status": "married", "education": "middle", "social_class": "lower middle class"}, "question": {"id": "Q199", "variant": 0}, "response": ["Based on my emic perspective, coming from Sharkia, Egypt, I have been influenced by the political climate and the cultural context in which I live. As a woman of 55 years with a middle education level and part of the lower middle class, my individual values and personal experiences have shaped my understanding of politics. My socioeconomic background has also played a role in my perception of politics. Additionally, the space and time in which I have lived have influenced my interest in politics. Therefore, my interest in politics is somewhat influenced by these factors, leading me to choose option (2) Somewhat interested."]}, {"persona": {"region": "Sharkia", "sex": "female", "age": 27, "country": "Egypt", "marital_status": "married", "education": "middle", "social_class": "lower middle class"}, "question": {"id": "Q199", "variant": 0}, "response": ["Based on the anthropological framework, my perspective as a married female from Sharkia, Egypt, is heavily influenced by my cultural context, personal experience, and socioeconomic background. In Sharkia, politics plays a significant role in shaping the community and the lives of individuals. However, as a woman from the lower middle class with limited formal education, my access to political information and participation may be restricted. Additionally, cultural norms and gender roles may also influence my level of interest in politics. Considering these factors, I would select option (2) Somewhat interested."]}, {"persona": {"region": "Sharkia", "sex": "female", "age": 52, "country": "Egypt", "marital_status": "married", "education": "middle", "social_class": "lower middle class"}, "question": {"id": "Q199", "variant": 0}, "response": ["Based on the anthropological framework, as a married female from Sharkia, Egypt, I would consider myself part of the lower middle class, which would greatly influence my perspective on politics. My individual values and personal experience, as well as my socioeconomic background, would play a significant role in shaping my interest in politics. Additionally, the cultural context of my community and the nuance of the question would also impact my response. Given these factors, I would choose the option:\n\n3) Not very interested"]}, {"persona": {"region": "Sharkia", "sex": "male", "age": 36, "country": "Egypt", "marital_status": "married", "education": "middle", "social_class": "lower middle class"}, "question": {"id": "Q199", "variant": 0}, "response": ["Based on the anthropological framework, my emic perspective as a married male from Sharkia, Egypt, who is 36 years old and part of the lower middle class, is heavily influenced by my cultural context, individual values, and socioeconomic background. In my cultural context, politics may be seen as something that is distant and inaccessible to someone like me, and my lower middle class socioeconomic background means that I may be more focused on providing for my family and meeting basic needs rather than being heavily involved in politics. Additionally, my individual values and personal experiences may lead me to believe that political involvement may not have a direct impact on my day-to-day life. Therefore, my answer to the question \"How interested are you in politics?\" is (3) Not very interested."]}, {"persona": {"region": "Sharkia", "sex": "female", "age": 20, "country": "Egypt", "marital_status": "single", "education": "middle", "social_class": "working class"}, "question": {"id": "Q199", "variant": 0}, "response": ["Based on the anthropological framework, my emic perspective as a single female from Sharkia, Egypt, who is 20 years old and part of the working class, shapes my understanding and interest in politics. The cultural context of Egypt, my individual values, and personal experiences all play a significant role in shaping my perspective. Additionally, my socioeconomic background and the space and time I inhabit also influence my views. Considering all these factors, I would choose option (2) Somewhat interested in politics."]}, {"persona": {"region": "Sharkia", "sex": "male", "age": 60, "country": "Egypt", "marital_status": "married", "education": "middle", "social_class": "working class"}, "question": {"id": "Q199", "variant": 0}, "response": ["Based on the anthropological framework, as a married male from Sharkia, Egypt, my emic perspective on politics is influenced by my cultural context, individual values, and socioeconomic background. In Egypt, politics plays a significant role in shaping daily life, and my middle education level has provided me with some understanding of political systems and their impact. As a member of the working class, I am particularly affected by political decisions and policies that may impact job opportunities and economic stability. Additionally, at 60 years of age, I have witnessed significant political changes in Egypt and have personal experiences that have shaped my perspective on politics. Therefore, I would say that I am somewhat interested in politics.\n\n2"]}, {"persona": {"region": "Sharkia", "sex": "male", "age": 41, "country": "Egypt", "marital_status": "married", "education": "higher", "social_class": "upper middle class"}, "question": {"id": "Q199", "variant": 0}, "response": ["From an anthropological perspective, my emic perspective as a married male from Sharkia, Egypt, who is 41 years old, has completed higher education, and considers himself part of the upper middle class, shapes my understanding and interest in politics. The cultural context of Egypt, with its history of political unrest and complex socio-economic background, is pivotal in understanding the level of interest in politics. My individual values and personal experience also play a significant role, as my education and socioeconomic status may influence my interest in politics. Additionally, my age and place of residence in Egypt also affect my level of interest. Based on these factors, I would choose option (2) Somewhat interested. \n\n2"]}, {"persona": {"region": "Sharkia", "sex": "female", "age": 23, "country": "Egypt", "marital_status": "married", "education": "middle", "social_class": "lower middle class"}, "question": {"id": "Q199", "variant": 0}, "response": ["Based on the anthropological framework, my perspective as a married female from Sharkia, Egypt, who is 23 years old and part of the lower middle class, is influenced by various factors. The emic perspective of my community emphasizes the importance of family and community, and I have been socialized to prioritize these aspects of life. The cultural context of Egypt also plays a significant role in shaping my views on politics, as the country has a complex political history and a strong emphasis on collective well-being. Additionally, my socioeconomic background has limited my access to higher education and opportunities for political engagement. Given these factors, I would choose option 2: Somewhat interested in politics. While I recognize the importance of politics in shaping society, my personal experiences and values lead me to prioritize other aspects of life."]}, {"persona": {"region": "Sharkia", "sex": "male", "age": 49, "country": "Egypt", "marital_status": "married", "education": "higher", "social_class": "upper middle class"}, "question": {"id": "Q199", "variant": 0}, "response": ["Based on the anthropological framework, as a married male from Sharkia, Egypt, my emic perspective on politics is heavily influenced by the cultural context in which I live. In Egypt, politics plays a significant role in our daily lives and is intertwined with our cultural, social, and economic backgrounds. My personal experience and values also contribute to my interest in politics, as I have received a higher education and consider myself part of the upper middle class. Additionally, my age and place in society have shaped my nuanced understanding of political issues. Therefore, I am very interested in politics.\n\n1"]}, {"persona": {"region": "Sharkia", "sex": "female", "age": 30, "country": "Egypt", "marital_status": "married", "education": "middle", "social_class": "upper middle class"}, "question": {"id": "Q199", "variant": 0}, "response": ["Based on the anthropological framework, my cultural context as a married female from Sharkia, Egypt, my age, educational level, and socioeconomic background all play a significant role in shaping my perspective on politics. In my community, politics is often seen as a male-dominated field, and as a woman, I may not have as much influence or opportunity to participate actively. Additionally, my middle education level may limit my access to information and understanding of political processes. As part of the upper middle class, I may have more pressing concerns related to maintaining my family's status and financial security. Therefore, I would choose option 3, not very interested in politics, as my personal values and experience lead me to prioritize other aspects of my life over political engagement. \n\n3"]}, {"persona": {"region": "Sharkia", "sex": "male", "age": 39, "country": "Egypt", "marital_status": "married", "education": "higher", "social_class": "upper middle class"}, "question": {"id": "Q199", "variant": 0}, "response": ["Based on the anthropological framework, my emic perspective as a married male from Sharkia, Egypt, who is 39 years old and part of the upper middle class, is influenced by my cultural context, individual values, and personal experience. In Egypt, politics plays a significant role in society, and my higher education level has provided me with a deep understanding of political systems and their impact. Additionally, being part of the upper middle class means that I have a vested interest in the political and socioeconomic development of my country. Considering these factors, I would choose option (1) Very interested in politics."]}, {"persona": {"region": "Sharkia", "sex": "female", "age": 26, "country": "Egypt", "marital_status": "married", "education": "middle", "social_class": "lower middle class"}, "question": {"id": "Q199", "variant": 0}, "response": ["Based on the anthropological framework, my emic perspective as a married female from Sharkia, Egypt, at 26 years of age with a middle education level and considering myself part of the lower middle class, greatly influences my interest in politics. The cultural context in Egypt and the socioeconomic background of my family has shaped my understanding and engagement with politics. I have been taught to prioritize family and community matters over national politics, and my personal experience with the limitations of my socioeconomic status has led me to believe that political engagement may not lead to tangible changes in my life. Therefore, I would choose: \n3"]}, {"persona": {"region": "Sharkia", "sex": "female", "age": 48, "country": "Egypt", "marital_status": "married", "education": "middle", "social_class": "lower middle class"}, "question": {"id": "Q199", "variant": 0}, "response": ["Based on the anthropological framework, my emic perspective as a married female from Sharkia, Egypt, at the age of 48 and part of the lower middle class, is influenced by my cultural context, individual values, and socioeconomic background. In my cultural context, there may be limited access to political information and resources, and as a woman, I may have been socialized to prioritize family and community over political engagement. My personal experience and values may also lead me to prioritize everyday survival and family concerns over political matters. Additionally, my socioeconomic background may limit my access to education and resources that would allow me to engage in political discourse. Therefore, based on these factors, I would select option (3) Not very interested in politics. \n\n3"]}, {"persona": {"region": "Sharkia", "sex": "male", "age": 34, "country": "Egypt", "marital_status": "married", "education": "higher", "social_class": "upper middle class"}, "question": {"id": "Q199", "variant": 0}, "response": ["Based on the anthropological framework, my emic perspective as a married male from Sharkia, Egypt, who is 34 years old and part of the upper middle class, is influenced by cultural context, individual values and personal experience, and socioeconomic background. In Egypt, politics plays a significant role in daily life and societal structure, and as someone with a higher education level and a comfortable socioeconomic background, I have been exposed to and have a stake in political matters. Additionally, my personal experience and values also drive my interest in politics, as I am invested in the well-being and progress of my community and country. Therefore, my perspective leads me to choose the option:\n\n2"]}, {"persona": {"region": "Sharkia", "sex": "female", "age": 39, "country": "Egypt", "marital_status": "divorced", "education": "middle", "social_class": "lower middle class"}, "question": {"id": "Q199", "variant": 0}, "response": ["Based on the anthropological framework, my perspective on politics is heavily influenced by my cultural context in Sharkia, Egypt, where political engagement may not be as accessible or emphasized for women. Additionally, my lower middle class socioeconomic background may limit my access to political resources and information. My individual values and personal experience also play a role, as a divorced woman, I may feel marginalized in the political sphere. Therefore, I would choose option (3) Not very interested, as my cultural, socioeconomic, and personal factors all contribute to a lack of enthusiasm or access to political engagement."]}, {"persona": {"region": "Sharkia", "sex": "male", "age": 39, "country": "Egypt", "marital_status": "married", "education": "middle", "social_class": "upper middle class"}, "question": {"id": "Q199", "variant": 0}, "response": ["Based on the anthropological framework, my emic perspective as a married male from Sharkia, Egypt, would be influenced by my cultural context, individual values, and socioeconomic background. In Egypt, politics plays a significant role in shaping people's lives, and as a member of the upper middle class, I have a vested interest in political decisions that could impact my family's well-being and future opportunities. Additionally, my personal experience and values have likely been shaped by the political climate in Egypt, leading me to be somewhat interested in politics. Furthermore, considering the nuance of the question, I would choose option (2) Somewhat interested."]}, {"persona": {"region": "Qaliubiya", "sex": "male", "age": 62, "country": "Egypt", "marital_status": "married", "education": "middle", "social_class": "working class"}, "question": {"id": "Q199", "variant": 0}, "response": ["Based on the anthropological framework, as a married male from Qaliubiya, Egypt, my emic perspective on politics is influenced by the cultural context of my community and the socioeconomic background of being part of the working class. My personal experience and values also play a role in shaping my interest in politics. Additionally, age and space are important factors, as my 62 years of age and living in Qaliubiya have likely influenced my perception of politics. Considering all these factors, I would say I am somewhat interested in politics.\n\n2"]}, {"persona": {"region": "Qaliubiya", "sex": "male", "age": 33, "country": "Egypt", "marital_status": "married", "education": "middle", "social_class": "working class"}, "question": {"id": "Q199", "variant": 0}, "response": ["Based on the anthropological framework, my emic perspective as a married male from Qaliubiya, Egypt, and part of the working class, is influenced by my cultural context, individual values, and personal experiences. In Egypt, politics play a significant role in shaping everyday life and future prospects. My socioeconomic background and limited educational attainment also influence my understanding of politics. Additionally, the nuanced phrasing of the question and the space and time in which I live all contribute to my response. Therefore, my answer is:\n\n2"]}, {"persona": {"region": "Qaliubiya", "sex": "male", "age": 62, "country": "Egypt", "marital_status": "married", "education": "higher", "social_class": "lower middle class"}, "question": {"id": "Q199", "variant": 0}, "response": ["Based on the anthropological framework, my perspective as a married, 62-year-old male from Qaliubiya, Egypt, with a completed higher education level and a lower middle-class background, is shaped by my cultural context, individual values, and personal experience. In Egypt, politics plays a significant role in daily life, and my age and education level have likely exposed me to various political ideologies and movements. Additionally, my socioeconomic background may influence my level of interest in politics, as individuals from lower middle-class backgrounds often have less access to political power and may feel disempowered by the political system. Therefore, I would say that I am somewhat interested in politics.\n\n2"]}, {"persona": {"region": "Qaliubiya", "sex": "male", "age": 29, "country": "Egypt", "marital_status": "married", "education": "middle", "social_class": "working class"}, "question": {"id": "Q199", "variant": 0}, "response": ["Based on the anthropological framework, my emic perspective as a married male from Qaliubiya, Egypt, at 29 years of age and with a middle education level, is heavily influenced by my cultural context, individual values, and socioeconomic background. The political landscape in Egypt is complex and my personal experiences have led me to be somewhat interested in politics. I have witnessed the impact of political decisions on my community and family, and my working-class background has instilled in me a sense of responsibility to stay informed and engaged. Additionally, the cultural relativism in Egypt means that political participation and interest are valued, but there are also limitations and challenges that come with it. Therefore, while I may not be extremely passionate about politics, I am certainly not apathetic towards it. (2)\n\n2"]}, {"persona": {"region": "Qaliubiya", "sex": "female", "age": 42, "country": "Egypt", "marital_status": "married", "education": "higher", "social_class": "working class"}, "question": {"id": "Q199", "variant": 0}, "response": ["Based on the anthropological framework, my emic perspective as a married female from Qaliubiya, Egypt, who is 42 years old and part of the working class, leads me to consider the cultural context, individual values, and socioeconomic background. In Egypt, politics plays a significant role in everyday life, and my personal experience and values as a woman in this society influence my interest in politics. Additionally, my socioeconomic background as part of the working class means that political decisions directly impact my life. Therefore, I would choose option (2) Somewhat interested, as I recognize the importance of politics but may not be deeply involved in political activities due to my personal and cultural context. \n\n2"]}, {"persona": {"region": "Qaliubiya", "sex": "female", "age": 50, "country": "Egypt", "marital_status": "married", "education": "middle", "social_class": "lower middle class"}, "question": {"id": "Q199", "variant": 0}, "response": ["Based on the anthropological framework, as a married female from Qaliubiya, Egypt, my emic perspective is influenced by my cultural context, individual values, and socioeconomic background. In Egypt, women are often expected to prioritize family and household responsibilities, which may limit their time and opportunities to engage in political activities. Additionally, my lower middle-class socioeconomic background may limit my access to political resources and information. However, my personal experience and values may still lead me to have some level of interest in politics, as I may have witnessed the impact of political decisions on my daily life and community. Taking all these factors into consideration, I would choose option 2) Somewhat interested in politics."]}, {"persona": {"region": "Qaliubiya", "sex": "male", "age": 29, "country": "Egypt", "marital_status": "married", "education": "higher", "social_class": "lower middle class"}, "question": {"id": "Q199", "variant": 0}, "response": ["From an emic perspective, as a 29-year-old married male from Qaliubiya, Egypt, my interest in politics is influenced by cultural context, individual values, and socioeconomic background. In Egypt, politics play a significant role in shaping daily life, and as someone who has completed higher education and considers myself part of the lower middle class, I am somewhat interested in politics. My personal experience and values, along with the societal and economic factors, contribute to my moderate interest in staying informed and involved in political issues.\n\n2"]}, {"persona": {"region": "Qaliubiya", "sex": "male", "age": 35, "country": "Egypt", "marital_status": "married", "education": "higher", "social_class": "working class"}, "question": {"id": "Q199", "variant": 0}, "response": ["Based on the anthropological framework, my answer to the question of political interest is influenced by my emic perspective as a married male from Qaliubiya, Egypt, as well as my individual values and personal experience. In my cultural context, politics may play a significant role in shaping my daily life and future opportunities. Additionally, my socioeconomic background as a working-class individual may lead me to have a vested interest in political decisions that impact my livelihood. Furthermore, my age and education level may also contribute to my understanding and engagement with political matters. Considering these factors, I would choose:\n\n2"]}, {"persona": {"region": "Qaliubiya", "sex": "female", "age": 40, "country": "Egypt", "marital_status": "married", "education": "middle", "social_class": "working class"}, "question": {"id": "Q199", "variant": 0}, "response": ["Based on the anthropological framework described above, my perspective on politics is influenced by my cultural context, socioeconomic background, individual values, and personal experience. As a married female from Qaliubiya, Egypt, I come from a working-class background and have only completed middle education level. This has provided me with a specific cultural context and limited access to political information and opportunities for engagement. Additionally, as a middle-aged woman, I may have experienced gender-based limitations in political participation. Considering these factors, I would choose the following option:\n\n2"]}, {"persona": {"region": "Qaliubiya", "sex": "female", "age": 48, "country": "Egypt", "marital_status": "divorced", "education": "lower", "social_class": "working class"}, "question": {"id": "Q199", "variant": 0}, "response": ["Based on the anthropological framework, my emic perspective as a divorced female from Qaliubiya, Egypt, with a lower education level and working-class background, leads me to prioritize personal experience and individual values in my understanding of politics. The cultural context of Egypt also plays a significant role in shaping my beliefs and attitudes towards politics. As a member of the working class, my socioeconomic background influences my perception of politics and the impact it has on my life. Additionally, my age and place in society also contribute to my understanding of politics. Therefore, I choose option (2) Somewhat interested, as I have a moderate level of interest in politics based on my individual values and personal experience."]}, {"persona": {"region": "Qaliubiya", "sex": "male", "age": 46, "country": "Egypt", "marital_status": "married", "education": "middle", "social_class": "working class"}, "question": {"id": "Q199", "variant": 0}, "response": ["Based on the anthropological framework, as a married male from Qaliubiya, Egypt, my emic perspective on politics is influenced by my cultural context, individual values, and socioeconomic background. In Egypt, politics play a significant role in daily life, and as a member of the working class, I am directly impacted by political decisions. Additionally, my personal experience and middle education level have shaped my understanding of politics and its importance in shaping the future for my family and community. Therefore, I am somewhat interested in politics.\n\n2"]}, {"persona": {"region": "Qaliubiya", "sex": "male", "age": 47, "country": "Egypt", "marital_status": "married", "education": "higher", "social_class": "lower middle class"}, "question": {"id": "Q199", "variant": 0}, "response": ["Based on my emic perspective as a married male from Qaliubiya, Egypt, I am very interested in politics. In my cultural context, politics plays a significant role in shaping the social and economic landscape of my community. Additionally, my higher education level has provided me with a deeper understanding of political systems and their impact on society. As part of the lower middle class, I am keenly aware of the importance of political decisions on my socioeconomic status and that of my fellow community members. My personal experience and individual values also contribute to my high level of interest in politics, as I have witnessed firsthand the effects of political decisions on my family and community. Furthermore, cultural relativism teaches me to respect the role of politics in different cultures, and as a 47-year-old individual, I recognize the importance of staying informed and engaged with political matters. Therefore, my choice is:\n\n1. Very interested"]}, {"persona": {"region": "Qaliubiya", "sex": "female", "age": 38, "country": "Egypt", "marital_status": "married", "education": "higher", "social_class": "working class"}, "question": {"id": "Q199", "variant": 0}, "response": ["Based on my emic perspective as a married female from Qaliubiya, Egypt, and considering my cultural context, individual values, and personal experience, I am somewhat interested in politics. In Egypt, politics plays a significant role in shaping our daily lives, and as a woman, I am aware of the importance of having a voice in political decision-making. However, my socioeconomic background as part of the working class and the demands of my personal and family life also shape my level of interest in politics. Additionally, cultural relativism and the nuance of the question also play a role in my response, as the term \"politics\" may have different connotations in my cultural context. \n\n2"]}, {"persona": {"region": "Qaliubiya", "sex": "male", "age": 58, "country": "Egypt", "marital_status": "married", "education": "middle", "social_class": "working class"}, "question": {"id": "Q199", "variant": 0}, "response": ["As a married male from Qaliubiya, Egypt, my emic perspective on politics is influenced by my cultural context, individual values, and socioeconomic background. In Egypt, politics plays a significant role in everyday life, and my working-class status means that I am directly affected by political decisions. Additionally, my age and education level have shaped my understanding of the political landscape. Considering these factors, I would say that I am somewhat interested in politics as it directly impacts my life and the lives of those around me.\n\n2"]}, {"persona": {"region": "Qaliubiya", "sex": "female", "age": 27, "country": "Egypt", "marital_status": "married", "education": "higher", "social_class": "working class"}, "question": {"id": "Q199", "variant": 0}, "response": ["Based on the anthropological framework, my emic perspective as a married female from Qaliubiya, Egypt, who is 27 years old and part of the working class, is shaped by my cultural context, individual values, and socioeconomic background. In my cultural context, politics plays a significant role in shaping the lives of individuals and families. My individual values and personal experience have also influenced my perception of politics, as I have witnessed the impact of political decisions on my community. Additionally, as part of the working class, my socioeconomic background has made me more aware of the importance of political participation in advocating for the rights and needs of my social class. Therefore, I am somewhat interested in politics.\n\n2"]}, {"persona": {"region": "Qaliubiya", "sex": "female", "age": 48, "country": "Egypt", "marital_status": "married", "education": "middle", "social_class": "upper middle class"}, "question": {"id": "Q199", "variant": 0}, "response": ["Based on the anthropological framework, as a married female from Qaliubiya, Egypt, my emic perspective on politics is heavily influenced by my cultural context, individual values, and socioeconomic background. In Egypt, politics plays a significant role in everyday life, and as a member of the upper middle class, I have more access to resources and education that allow me to engage in political discourse. Additionally, my age and middle education level have exposed me to a variety of political ideologies and events, leading to a nuanced understanding of political issues. Therefore, I would say I am somewhat interested in politics.\n\n2"]}, {"persona": {"region": "Giza", "sex": "female", "age": 19, "country": "Egypt", "marital_status": "single", "education": "middle", "social_class": "working class"}, "question": {"id": "Q199", "variant": 0}, "response": ["Based on the anthropological framework, as a single female from Giza, Egypt, I am influenced by my cultural context, which includes the political climate of my country. Being from a working-class background, my socioeconomic status also plays a role in shaping my views on politics. Additionally, my age and level of education contribute to my understanding of and interest in political matters. Considering these factors, I would choose:\n\n2) Somewhat interested"]}, {"persona": {"region": "Giza", "sex": "female", "age": 38, "country": "Egypt", "marital_status": "married", "education": "higher", "social_class": "lower middle class"}, "question": {"id": "Q199", "variant": 0}, "response": ["Based on the anthropological framework, my emic perspective as a married woman from Giza, Egypt, my cultural context and socioeconomic background play a significant role in shaping my interest in politics. In my community, women are often expected to prioritize family and domestic responsibilities over political engagement. Additionally, as a member of the lower middle class, my focus is primarily on providing for my family and ensuring their well-being, leaving little time or energy for political involvement. Therefore, I would choose option 3, \"Not very interested,\" as my response to the question."]}, {"persona": {"region": "Beni Swaif/Beni Suef", "sex": "female", "age": 34, "country": "Egypt", "marital_status": "divorced", "education": "higher", "social_class": "lower class"}, "question": {"id": "Q199", "variant": 0}, "response": ["Based on the anthropological framework, my emic perspective as a divorced female from Beni Swaif, Egypt, would be influenced by my individual values, personal experience, and socioeconomic background. Being part of the lower class, I have likely faced economic hardships and may feel marginalized by the political system. Additionally, I may have experienced gender-based discrimination and lack of representation in politics. Therefore, I would be somewhat interested in politics, as I may recognize its importance but also feel disillusioned by the system's impact on my life. \n\n2"]}, {"persona": {"region": "Beni Swaif/Beni Suef", "sex": "male", "age": 20, "country": "Egypt", "marital_status": "single", "education": "higher", "social_class": "working class"}, "question": {"id": "Q199", "variant": 0}, "response": ["Based on my individual values and personal experience, as a 20-year-old working-class male from Beni Suef, Egypt, I have been directly impacted by political decisions that have affected my family and community. Additionally, the cultural context of Egypt places a strong emphasis on political engagement and awareness, especially among the younger generation. My socioeconomic background also plays a role, as issues such as unemployment and access to education are heavily intertwined with politics. Furthermore, cultural relativism reminds me that my perspective is shaped by my unique experiences and may differ from others. Therefore, I am very interested in politics.\n\n1"]}, {"persona": {"region": "Giza", "sex": "male", "age": 19, "country": "Egypt", "marital_status": "single", "education": "middle", "social_class": "upper middle class"}, "question": {"id": "Q199", "variant": 0}, "response": ["Based on the anthropological framework, my emic perspective as a 19-year-old single male from Giza, Egypt, who has completed middle education and considers himself part of the upper middle class, is that my interest in politics is influenced by my cultural context, individual values, and personal experiences. In Egypt, politics play a significant role in everyday life, and my family's socioeconomic background has provided me with opportunities to engage in and understand political discussions. Additionally, my age and education level have exposed me to various political ideologies and movements, shaping my interest in politics. Therefore, my choice reflects my nuanced understanding of the political landscape in Egypt and my personal experiences with it.\n\n2"]}, {"persona": {"region": "Giza", "sex": "female", "age": 33, "country": "Egypt", "marital_status": "married", "education": "middle", "social_class": "working class"}, "question": {"id": "Q199", "variant": 0}, "response": ["Based on the anthropological framework, as a married female from Giza, Egypt, with a middle education level and working-class background, my perspective on politics is influenced by my cultural context, individual values, and socioeconomic background. In Egypt, politics plays a significant role in everyday life, and as a member of the working class, I am directly affected by government policies and decisions. Additionally, my education level and personal experiences have shaped my understanding of political issues. Therefore, I would say that I am somewhat interested in politics because while I recognize its importance, my focus is primarily on providing for my family and navigating daily challenges in a rapidly changing society.\n\n2"]}, {"persona": {"region": "Giza", "sex": "female", "age": 24, "country": "Egypt", "marital_status": "married", "education": "higher", "social_class": "working class"}, "question": {"id": "Q199", "variant": 0}, "response": ["Based on the anthropological framework, my emic perspective as a married female from Giza, Egypt, and my etic perspective as part of the working class will heavily influence my interest in politics. The cultural context of Egypt, particularly the socioeconomic background of being part of the working class, will also play a significant role. Additionally, my individual values and personal experience, as well as my age and place, will shape my perception of politics. Considering the cultural relativism and nuance in the question, I would choose the option that aligns with my persona's likely perspective.\n\n2"]}, {"persona": {"region": "Giza", "sex": "male", "age": 50, "country": "Egypt", "marital_status": "married", "education": "higher", "social_class": "working class"}, "question": {"id": "Q199", "variant": 0}, "response": ["Based on the anthropological framework, as a married male from Giza, Egypt, my emic perspective on politics is influenced by my cultural context, individual values, and socioeconomic background. In Egypt, politics play a significant role in societal and personal life, and as someone who has completed higher education and considers myself part of the working class, I am very interested in politics. My personal experience and values also shape my interest, as I have seen the impact of political decisions on my community and family. Additionally, my age and place in Giza, a region with a rich political history, further contribute to my high level of interest in politics.\n\n2"]}, {"persona": {"region": "Beni Swaif/Beni Suef", "sex": "female", "age": 26, "country": "Egypt", "marital_status": "married", "education": "higher", "social_class": "lower middle class"}, "question": {"id": "Q199", "variant": 0}, "response": ["From an emic perspective, as a married female from Beni Swaif, Egypt, my cultural context and socioeconomic background play a significant role in my interest in politics. In Egypt, women are traditionally expected to prioritize their family and household duties over political involvement. Additionally, being part of the lower middle class means that I may have limited access to resources and opportunities to engage in political activities. My individual values and personal experiences also shape my perspective, as I may have witnessed the challenges faced by individuals who are politically active. Taking into account cultural relativism, my understanding of politics may differ from those in higher socioeconomic classes or different cultural contexts. Therefore, my interest in politics may be influenced by these factors and I would choose option (3) Not very interested."]}, {"persona": {"region": "Beni Swaif/Beni Suef", "sex": "male", "age": 40, "country": "Egypt", "marital_status": "single", "education": "lower", "social_class": "lower class"}, "question": {"id": "Q199", "variant": 0}, "response": ["Based on my cultural context, as a single male from Beni Swaif, Egypt, my lower education level and socioeconomic background have shaped my perspective on politics. My personal experiences and individual values have influenced my understanding of the political landscape in Egypt. The nuance in the phrasing of the question is crucial, as I am not completely disinterested in politics, but given my limited access to resources and opportunities, I am not very interested in politics.\n\n3"]}, {"persona": {"region": "Beni Swaif/Beni Suef", "sex": "female", "age": 25, "country": "Egypt", "marital_status": "married", "education": "middle", "social_class": "lower middle class"}, "question": {"id": "Q199", "variant": 0}, "response": ["From the emic and etic perspectives, as a married female from Beni Swaif, Egypt, my cultural context and socioeconomic background greatly influence my level of interest in politics. In my community, women are often marginalized and have limited access to political participation or decision-making. Additionally, being part of the lower middle class means that my focus is primarily on providing for my family and navigating the challenges of everyday life. My individual values and personal experience also play a role, as I have not had much exposure to political engagement and have not seen it directly impact my life. Considering cultural relativism, my perspective on politics may differ from others who have more privilege and influence. Overall, my socioeconomic background, cultural context, and personal experience lead me to be not very interested in politics.\n\n3"]}, {"persona": {"region": "Beni Swaif/Beni Suef", "sex": "female", "age": 21, "country": "Egypt", "marital_status": "single", "education": "middle", "social_class": "lower middle class"}, "question": {"id": "Q199", "variant": 0}, "response": ["Based on the anthropological framework, my emic perspective as a single female from Beni Swaif/Beni Suef, Egypt, at 21 years old and with a middle education level, is influenced by my cultural context, individual values, and socioeconomic background. In my community, there is a strong emphasis on family and community ties, and as a lower middle class individual, my focus is on finding stable employment and supporting my family. Additionally, the political climate in Egypt may be seen as unstable to some, and my personal experiences and values may lead me to be somewhat interested in politics, as I understand the impact it has on my life and future opportunities.\n\n2"]}, {"persona": {"region": "Beni Swaif/Beni Suef", "sex": "male", "age": 48, "country": "Egypt", "marital_status": "married", "education": "middle", "social_class": "lower middle class"}, "question": {"id": "Q199", "variant": 0}, "response": ["Based on the anthropological framework, my emic perspective as a married male from Beni Swaif/Beni Suef, Egypt, at the age of 48 and belonging to the lower middle class, is influenced by my cultural context and socioeconomic background. In Egypt, politics play a significant role in shaping daily life and opportunities for individuals from different socioeconomic backgrounds. Additionally, my personal experience and individual values have also been shaped by the political climate in Egypt. Therefore, I am somewhat interested in politics because it directly impacts my life and the lives of those around me.\n\n2"]}, {"persona": {"region": "Beni Swaif/Beni Suef", "sex": "female", "age": 57, "country": "Egypt", "marital_status": "married", "education": "middle", "social_class": "working class"}, "question": {"id": "Q199", "variant": 0}, "response": ["Based on the anthropological framework, my emic perspective as a married female from Beni Suef, Egypt, would likely be influenced by my cultural context, individual values, and socioeconomic background. In Egypt, politics play a significant role in everyday life and are deeply ingrained in the cultural context. Additionally, as a working-class woman with a middle education level, I may have experienced the impact of political decisions on my daily life. Therefore, my interest in politics would likely be somewhat interested. \n2"]}, {"persona": {"region": "Beni Swaif/Beni Suef", "sex": "male", "age": 20, "country": "Egypt", "marital_status": "single", "education": "middle", "social_class": "working class"}, "question": {"id": "Q199", "variant": 0}, "response": ["Based on my emic and etic perspective as a working-class male from Beni Suef, Egypt, my interest in politics is heavily influenced by my cultural context and socioeconomic background. The political climate in Egypt has a significant impact on my daily life and opportunities, and my working-class status means that I am particularly attuned to political decisions that affect my livelihood. Additionally, my individual values and personal experiences have shaped my understanding of politics, as I have witnessed the impact of political decisions on my community and family. Furthermore, as a young person, I am also aware of the potential for political change and the importance of being engaged in the political process. Therefore, my interest in politics is influenced by a combination of cultural context, socioeconomic background, and personal experience.\n\n2"]}, {"persona": {"region": "Giza", "sex": "female", "age": 59, "country": "Egypt", "marital_status": "married", "education": "higher", "social_class": "upper middle class"}, "question": {"id": "Q199", "variant": 0}, "response": ["Based on the anthropological framework, as a married female from Giza, Egypt, at the age of 59, with a higher education level and considering myself part of the upper middle class, my interest in politics is influenced by my cultural context, individual values, socioeconomic background, and space and time. In Egypt, politics is a significant part of daily life and my education has equipped me with the knowledge and critical thinking skills to engage with political issues. Additionally, being part of the upper middle class means that I have the resources and access to information to stay informed and involved in political matters. Therefore, my answer to the question would be:\n\n2"]}, {"persona": {"region": "Giza", "sex": "female", "age": 38, "country": "Egypt", "marital_status": "single", "education": "higher", "social_class": "lower middle class"}, "question": {"id": "Q199", "variant": 0}, "response": ["Based on the anthropological framework, as a single female from Giza, Egypt, my emic perspective on politics is influenced by my cultural context, individual values, and socioeconomic background. As a member of the lower middle class, I am keenly aware of the impact of political decisions on my daily life and financial stability. My personal experience as a woman in Egypt also shapes my interest in politics, as I am aware of the societal and legal challenges faced by women in my country. Additionally, my higher education level has provided me with the knowledge and critical thinking skills to engage with political issues. Therefore, I would say I am \"Very interested\" in politics.\n\n1"]}, {"persona": {"region": "Giza", "sex": "female", "age": 26, "country": "Egypt", "marital_status": "single", "education": "higher", "social_class": "working class"}, "question": {"id": "Q199", "variant": 0}, "response": ["Based on the anthropological framework, as a single female from Giza, Egypt, my emic perspective would be influenced by the cultural context of Egypt, where politics play a pivotal role in everyday life. My personal experience and values as a young, educated woman in a working-class community also shape my interest in politics, as I may have firsthand experience with socioeconomic and gender-related issues. Additionally, my age and place in society also contribute to my nuanced understanding of the political landscape. Therefore, I would choose option 2: Somewhat interested."]}, {"persona": {"region": "Giza", "sex": "male", "age": 39, "country": "Egypt", "marital_status": "married", "education": "middle", "social_class": "working class"}, "question": {"id": "Q199", "variant": 0}, "response": ["Based on the anthropological framework, my emic perspective as a married male from Giza, Egypt, at the age of 39 and part of the working class, is influenced by my cultural context, individual values, and socioeconomic background. In Giza, politics play a significant role in shaping everyday life, and my personal experience and values have led me to be somewhat interested in politics. The socioeconomic background of being part of the working class also means that political decisions directly impact my livelihood and well-being. Therefore, I am somewhat interested in politics.\n\n2"]}, {"persona": {"region": "Giza", "sex": "male", "age": 36, "country": "Egypt", "marital_status": "married", "education": "middle", "social_class": "working class"}, "question": {"id": "Q199", "variant": 0}, "response": ["Based on the anthropological framework, as a married male from Giza, Egypt, my emic perspective is influenced by my cultural context, individual values, and socioeconomic background. In Egypt, political engagement is often considered an important aspect of citizenship, and as a member of the working class, I am likely to have a vested interest in the political decisions that affect my livelihood. Additionally, my age and educational level may have exposed me to certain political ideologies and movements that shape my perspective. Therefore, I would consider myself as somewhat interested in politics, as it directly affects my daily life and the well-being of my family and community.\n\n2"]}, {"persona": {"region": "Giza", "sex": "female", "age": 30, "country": "Egypt", "marital_status": "single", "education": "higher", "social_class": "lower class"}, "question": {"id": "Q199", "variant": 0}, "response": ["Based on the anthropological framework, my emic perspective as a single female from Giza, Egypt, who is 30 years old and part of the lower class, is heavily influenced by my cultural context, individual values, and socioeconomic background. In Egypt, there are cultural and societal barriers for women to actively participate in politics, and as a lower-class individual, my focus is primarily on securing basic needs and survival for myself and my family. Additionally, my personal experiences and values have shaped my perception of politics and have led me to feel somewhat disenfranchised and disinterested in the political system. Therefore, I would choose option 3: Not very interested in politics."]}, {"persona": {"region": "Giza", "sex": "female", "age": 24, "country": "Egypt", "marital_status": "single", "education": "higher", "social_class": "lower class"}, "question": {"id": "Q199", "variant": 0}, "response": ["Based on the anthropological framework, as a single female from Giza, Egypt, my emic perspective is influenced by my cultural context, individual values, and socioeconomic background. Living in a lower-class community in Giza, my access to resources and opportunities may be limited, and this could impact my interest in politics. Additionally, as a young woman who has completed higher education, I may have a heightened awareness of social and political issues, which could make me somewhat interested in politics. Furthermore, considering the cultural relativism and nuance of the question, I would choose option 2) Somewhat interested, as my personal experiences and values may lead me to have some level of interest in politics despite the challenges posed by my socioeconomic background."]}, {"persona": {"region": "Giza", "sex": "male", "age": 65, "country": "Egypt", "marital_status": "married", "education": "middle", "social_class": "working class"}, "question": {"id": "Q199", "variant": 0}, "response": ["Based on the anthropological framework, my emic perspective as a married male from Giza, Egypt would be influenced by my cultural context, individual values, and socioeconomic background. In Egypt, politics play a significant role in daily life and are often intertwined with social and economic issues. As a working-class individual with a middle education level, I am likely to be more concerned with the impact of political decisions on my livelihood and family. Additionally, my age and location in Giza, a city with a rich history and diverse population, would further shape my views on politics. Therefore, my interest in politics would likely be influenced by these factors, and I would choose the option that reflects my nuanced understanding based on my personal experiences and cultural context.\n\n2"]}, {"persona": {"region": "Giza", "sex": "female", "age": 56, "country": "Egypt", "marital_status": "married", "education": "middle", "social_class": "working class"}, "question": {"id": "Q199", "variant": 0}, "response": ["Based on the anthropological framework, my response to the question of political interest is influenced by my emic perspective as a married female from Giza, Egypt. My cultural context, including my socioeconomic background and educational level, plays a significant role in shaping my views. As a working-class woman in a traditional society, my individual values and personal experiences have led me to prioritize family and community over political engagement. Additionally, my age and place also contribute to my perspective, as older individuals in Egypt often have a more conservative approach to politics. Therefore, I would choose option 3: Not very interested.\n\n3"]}, {"persona": {"region": "Giza", "sex": "male", "age": 31, "country": "Egypt", "marital_status": "married", "education": "higher", "social_class": "lower middle class"}, "question": {"id": "Q199", "variant": 0}, "response": ["From an emic perspective, as a married male from Giza, Egypt, my cultural context and socioeconomic background play a significant role in shaping my interest in politics. Egypt has a rich history of political involvement and activism, and as a member of the lower middle class, I am keenly aware of the impact political decisions have on my daily life. Additionally, my higher education level has exposed me to different political ideologies and systems, further fueling my interest in politics. Moreover, my age and place in society also influence my perception of politics, as I have witnessed the effects of political decisions on my community. Therefore, based on these factors, I would select option (2) Somewhat interested in politics. \n\n2"]}, {"persona": {"region": "Giza", "sex": "male", "age": 28, "country": "Egypt", "marital_status": "single", "education": "middle", "social_class": "working class"}, "question": {"id": "Q199", "variant": 0}, "response": ["Based on the anthropological framework, as a single male from Giza, Egypt, with a middle education level and part of the working class, my emic perspective on politics is likely to be influenced by my cultural context, socioeconomic background, and personal experience. In Giza, politics may play a significant role in everyday life, and as a member of the working class, I may have a strong interest in political issues that directly impact my livelihood and community. Additionally, my age and place within society may also shape my perspective on politics. Therefore, I would say that I am somewhat interested in politics, as it is likely to have a tangible impact on my life and the lives of those around me.\n\n2"]}, {"persona": {"region": "Giza", "sex": "male", "age": 47, "country": "Egypt", "marital_status": "married", "education": "middle", "social_class": "lower middle class"}, "question": {"id": "Q199", "variant": 0}, "response": ["From an emic perspective, as a married male from Giza, Egypt, my cultural context and socioeconomic background heavily influence my interest in politics. In Egypt, politics play a significant role in everyday life, and my lower middle class status means that political decisions directly impact my family and me. Additionally, my personal experience and individual values play a role in shaping my interest in politics, as I have seen the effects of political decisions on my community and have developed strong opinions on the matter. Therefore, I am somewhat interested in politics as it directly impacts my life and the lives of those around me.\n\n2"]}, {"persona": {"region": "Giza", "sex": "male", "age": 26, "country": "Egypt", "marital_status": "single", "education": "middle", "social_class": "lower middle class"}, "question": {"id": "Q199", "variant": 0}, "response": ["Based on the anthropological framework, my emic perspective as a single male from Giza, Egypt, who has completed middle education level and considers myself part of the lower middle class, is influenced by my cultural context, individual values, and socioeconomic background. In Egypt, politics plays a significant role in people's lives, and my cultural context and personal experience have shaped my understanding and interest in politics. Additionally, my socioeconomic background as part of the lower middle class has an impact on my level of interest in politics. Therefore, based on these factors, I would choose option 2: Somewhat interested.\n\n2"]}, {"persona": {"region": "Giza", "sex": "male", "age": 48, "country": "Egypt", "marital_status": "married", "education": "middle", "social_class": "upper middle class"}, "question": {"id": "Q199", "variant": 0}, "response": ["Based on the anthropological framework, as a married male from Giza, Egypt, who is 48 years old and part of the upper middle class, my perspective on politics is shaped by my cultural context, individual values, and socioeconomic background. In Egypt, politics plays a significant role in everyday life, and as a member of the upper middle class, I have more at stake in political decisions. Additionally, my age and education level also contribute to my interest in politics, as I have likely experienced various political changes and have the ability to engage in political discourse. Therefore, I would choose option (2) Somewhat interested, as my background and experiences have influenced my moderate level of interest in politics. \n\n2"]}, {"persona": {"region": "Menya", "sex": "male", "age": 61, "country": "Egypt", "marital_status": "married", "education": "middle", "social_class": "working class"}, "question": {"id": "Q199", "variant": 0}, "response": ["Based on the anthropological framework, I, as a married male from Menya, Egypt, would approach the question of political interest considering my cultural context, individual values, and socioeconomic background. In Menya, politics holds a significant role in daily life, and as a member of the working class, I am directly impacted by political decisions. My age and level of education also contribute to my awareness of political issues. Additionally, my personal experiences and values influence my perspective on politics. Therefore, I would choose my answer based on the importance of politics in my life and its impact on my community.\n\n2"]}, {"persona": {"region": "Menya", "sex": "male", "age": 41, "country": "Egypt", "marital_status": "married", "education": "middle", "social_class": "lower middle class"}, "question": {"id": "Q199", "variant": 0}, "response": ["From an anthropological perspective, my emic and etic perspective as a married male from Menya, Egypt, is shaped by my cultural context, individual values, and socioeconomic background. In Menya, politics is an integral part of daily life and is heavily influenced by cultural and societal norms. As a lower-middle-class individual with a middle education level, I am keenly aware of the impact of political decisions on my family and community. My personal experiences and values also play a significant role in shaping my interest in politics. Therefore, I would choose:\n\n2"]}, {"persona": {"region": "Menya", "sex": "female", "age": 43, "country": "Egypt", "marital_status": "married", "education": "higher", "social_class": "working class"}, "question": {"id": "Q199", "variant": 0}, "response": ["Based on the anthropological framework, my emic perspective as a married female from Menya, Egypt, at 43 years of age with a higher education level and a working-class background, is influenced by my cultural context, individual values, socioeconomic background, and space and time. In Menya, politics is an important aspect of daily life and is deeply ingrained in our cultural context. As a well-educated working-class woman, I am personally invested in the political landscape and its impact on my community and family. My age and place also play a role in my interest, as I have witnessed firsthand the changes in the political climate over the years. Therefore, my answer is:\n\n2"]}, {"persona": {"region": "Menya", "sex": "male", "age": 57, "country": "Egypt", "marital_status": "married", "education": "middle", "social_class": "lower middle class"}, "question": {"id": "Q199", "variant": 0}, "response": ["Based on the anthropological framework, as a married male from Menya, Egypt, I would have a strong cultural context and personal values that influence my interest in politics. As someone from the lower middle class, my socioeconomic background could also play a role in how I view politics. Additionally, my age and education level may impact my understanding and engagement with political issues. Taking all of this into consideration, I would choose the following option:\n\n2"]}, {"persona": {"region": "Menya", "sex": "male", "age": 42, "country": "Egypt", "marital_status": "divorced", "education": "middle", "social_class": "lower middle class"}, "question": {"id": "Q199", "variant": 0}, "response": ["Based on my understanding of the anthropological framework, as a divorced male from Menya, Egypt, my emic perspective on politics is influenced by my cultural context, individual values, and socioeconomic background. In Menya, politics plays a significant role in shaping our daily lives and opportunities for social mobility. As a member of the lower middle class, I am personally affected by government policies and decisions, and therefore, I am somewhat interested in politics. My personal experience and values also contribute to my interest, as I believe that being informed about political matters is important for securing a better future for myself and my community. Additionally, my age and place in society have also shaped my understanding of the political landscape, further influencing my level of interest. \n\n2"]}, {"persona": {"region": "Menya", "sex": "female", "age": 59, "country": "Egypt", "marital_status": "married", "education": "middle", "social_class": "upper middle class"}, "question": {"id": "Q199", "variant": 0}, "response": ["Based on the anthropological framework, my emic perspective as a married female from Menya, Egypt, who is 59 years old and part of the upper middle class, is crucial in shaping my understanding and interest in politics. My cultural context, individual values, and personal experiences have influenced me to be somewhat interested in politics. In Menya, politics plays a significant role in shaping our lives and societal structures, and being part of the upper middle class has given me some level of exposure and influence in political matters. Additionally, my age and socioeconomic background have also contributed to my moderate interest in politics, as I have seen and experienced the impact of political decisions on my community and family over the years.\n\n2"]}, {"persona": {"region": "Menya", "sex": "female", "age": 31, "country": "Egypt", "marital_status": "married", "education": "middle", "social_class": "working class"}, "question": {"id": "Q199", "variant": 0}, "response": ["Based on the anthropological framework, my emic perspective as a married female from Menya, Egypt, at 31 years of age, with a middle education level and part of the working class, is influenced by my cultural context, individual values, socioeconomic background, and space and time. In Menya, politics is seen as a distant and often inaccessible realm, dominated by those in power. As a working-class woman, my daily concerns revolve around providing for my family and navigating the challenges of everyday life. Additionally, my level of education and limited exposure to political discourse may contribute to a lack of interest in formal politics. Therefore, I would choose option 3: Not very interested, as my daily experiences and cultural context shape my perspective on politics. \n\n3"]}, {"persona": {"region": "Menya", "sex": "male", "age": 55, "country": "Egypt", "marital_status": "single", "education": "middle", "social_class": "working class"}, "question": {"id": "Q199", "variant": 0}, "response": ["Based on my emic perspective as a single male from Menya, Egypt, I am aware that politics plays a significant role in shaping the cultural context of my community. As a member of the working class, my socioeconomic background influences my understanding and engagement with politics. Additionally, my age and personal experience have shaped my individual values, leading me to be somewhat interested in politics. I believe that my nuanced understanding of the political landscape is influenced by my cultural relativism, as I recognize the importance of political engagement while also acknowledging the limitations of my socioeconomic status. Therefore, my choice is:\n\n2) Somewhat interested"]}, {"persona": {"region": "Menya", "sex": "female", "age": 28, "country": "Egypt", "marital_status": "married", "education": "higher", "social_class": "lower middle class"}, "question": {"id": "Q199", "variant": 0}, "response": ["From an emic perspective, as a married female from Menya, Egypt, my interest in politics is influenced by my cultural context, individual values, and socioeconomic background. In Menya, women are often not encouraged to be actively involved in politics, and this cultural context may lead to a lower interest in political matters. Additionally, my lower middle-class socioeconomic background may mean that I have more immediate concerns, such as providing for my family, which could impact my level of interest in politics. Furthermore, my personal experiences and values may also play a role in shaping my perspective on politics. Therefore, considering these factors, my interest in politics would likely be somewhat interested (2)."]}, {"persona": {"region": "Menya", "sex": "male", "age": 24, "country": "Egypt", "marital_status": "single", "education": "middle", "social_class": "working class"}, "question": {"id": "Q199", "variant": 0}, "response": ["From the perspective of a single male from Menya, Egypt, who is 24 years old, completed middle education level, and considers himself part of the working class, my emic perspective on politics is influenced by my cultural context, individual values, and socioeconomic background. In Menya, politics plays a significant role in shaping our daily lives, and as a working-class individual, I am directly impacted by government policies and decisions. However, my middle education level and limited exposure to political discourse may limit my understanding and interest in politics. Additionally, my personal experiences and values may lead me to prioritize other aspects of life over political engagement. Therefore, I would choose option (2) Somewhat interested, as I recognize the importance of politics but may not be heavily involved due to my background and circumstances. \n\n2"]}, {"persona": {"region": "Menya", "sex": "female", "age": 23, "country": "Egypt", "marital_status": "married", "education": "middle", "social_class": "working class"}, "question": {"id": "Q199", "variant": 0}, "response": ["Based on the anthropological framework, my perspective as a married female from Menya, Egypt would be influenced by my cultural context, individual values, and socioeconomic background. In Menya, politics may play a significant role in the lives of the working class, as it can impact our daily lives and access to resources. Additionally, my middle education level and age may have exposed me to different political ideas and movements. Considering these factors, I would choose the following option:\n\n2"]}, {"persona": {"region": "Menya", "sex": "male", "age": 27, "country": "Egypt", "marital_status": "single", "education": "middle", "social_class": "lower middle class"}, "question": {"id": "Q199", "variant": 0}, "response": ["From an emic perspective, as a single male from Menya, Egypt, my cultural context plays a significant role in shaping my interest in politics. Being part of the lower middle class, my socioeconomic background has limited my exposure to political engagement and opportunities for involvement. Additionally, my individual values and personal experiences have influenced my understanding of politics and its relevance to my life. Given these factors, I would say that I am somewhat interested in politics, as I recognize its importance but have limited resources and opportunities to actively engage in political activities. \n\n2"]}, {"persona": {"region": "Asyut", "sex": "male", "age": 30, "country": "Egypt", "marital_status": "married", "education": "middle", "social_class": "working class"}, "question": {"id": "Q199", "variant": 0}, "response": ["Based on the anthropological framework, as a married male from Asyut, Egypt, my cultural context and socioeconomic background significantly impact my interest in politics. In Egypt, politics is deeply intertwined with daily life, and the working class often feels the direct effects of government policies. Additionally, my middle education level means I may have a more limited understanding of political systems and processes. As a result, I would consider myself somewhat interested in politics, as I recognize its importance but may not have the resources or education to fully engage in political discussions or activities.\n\n2"]}, {"persona": {"region": "Asyut", "sex": "female", "age": 26, "country": "Egypt", "marital_status": "married", "education": "middle", "social_class": "working class"}, "question": {"id": "Q199", "variant": 0}, "response": ["Based on the anthropological framework, as a married female from Asyut, Egypt, I would consider my emic perspective on politics to be influenced by my cultural context, individual values, and socioeconomic background. In my cultural context, women are traditionally expected to prioritize family and home life, while my individual values and personal experience also play a role in shaping my perception of politics. Growing up in a working-class family and completing only middle education level, I may have limited exposure to political engagement and may prioritize other aspects of my life. Therefore, I would choose option (3) Not very interested in politics."]}, {"persona": {"region": "Asyut", "sex": "male", "age": 32, "country": "Egypt", "marital_status": "single", "education": "higher", "social_class": "lower middle class"}, "question": {"id": "Q199", "variant": 0}, "response": ["Based on the anthropological framework, my emic perspective as a single male from Asyut, Egypt, who is 32 years old, educated, and part of the lower middle class, influences my interest in politics. In my cultural context, politics plays a significant role in shaping the socio-economic landscape and affects my daily life. Additionally, my individual values and personal experiences have shown me the impact of political decisions on my community. My socio-economic background also contributes to my interest in politics as I am directly affected by policies and decisions made by those in power. Considering all these factors, I would choose option (2) Somewhat interested in politics."]}, {"persona": {"region": "Asyut", "sex": "female", "age": 21, "country": "Egypt", "marital_status": "married", "education": "middle", "social_class": "working class"}, "question": {"id": "Q199", "variant": 0}, "response": ["Based on the anthropological framework, as a married female from Asyut, Egypt, my emic perspective is influenced by my cultural context, individual values, and socioeconomic background. As a member of the working class, my daily life is focused on providing for my family and meeting their needs. Additionally, my middle education level means that I may not have had as much exposure to political concepts or discussions. Therefore, I would be more likely to be not very interested in politics as it may not directly impact my immediate concerns.\n\n3"]}, {"persona": {"region": "Asyut", "sex": "female", "age": 30, "country": "Egypt", "marital_status": "married", "education": "higher", "social_class": "working class"}, "question": {"id": "Q199", "variant": 0}, "response": ["Based on my emic perspective as a married female from Asyut, Egypt, I have been brought up in a cultural context where politics play a significant role in our daily lives. My individual values and personal experiences have shaped my interest in politics, given that I have completed higher education and consider myself part of the working class, I am very aware of the impact politics can have on my life and the lives of those around me. Additionally, my socioeconomic background as a working-class individual has influenced my understanding of the importance of being engaged in political matters. Furthermore, the space and time in which I live have also contributed to my interest in politics, as I am living in a time of change and development for our country. Therefore, I am very interested in politics.\n\n1"]}, {"persona": {"region": "Asyut", "sex": "female", "age": 42, "country": "Egypt", "marital_status": "married", "education": "higher", "social_class": "lower middle class"}, "question": {"id": "Q199", "variant": 0}, "response": ["Based on the anthropological framework, my emic perspective as a married female from Asyut, Egypt, who is 42 years old and part of the lower middle class, is heavily influenced by my cultural context, individual values, and socioeconomic background. In Asyut, politics plays a significant role in daily life, and my education level has allowed me to understand the complexities of political issues. However, as a lower middle-class woman, my personal experience has shown me that my voice and opinions on political matters are often overlooked or undervalued. Therefore, while I may be somewhat interested in politics due to its impact on my community and family, I am also not very interested in actively participating in political discussions or activities due to the barriers I face in being heard and valued in these spaces.\n\n3"]}, {"persona": {"region": "Sohag", "sex": "male", "age": 63, "country": "Egypt", "marital_status": "married", "education": "middle", "social_class": "lower middle class"}, "question": {"id": "Q199", "variant": 0}, "response": ["From an anthropological perspective, my emic and etic perspectives as a married male from Sohag, Egypt, have shaped my understanding of politics. The cultural context in which I live, along with my socioeconomic background and limited education, have influenced my views on politics. My personal experience and individual values also play a significant role in shaping my interest in politics. Additionally, as a 63-year-old, my age and place in society have further influenced my perceptions. Therefore, based on my background and cultural context, I would choose option (2) Somewhat interested."]}, {"persona": {"region": "Sohag", "sex": "male", "age": 27, "country": "Egypt", "marital_status": "married", "education": "middle", "social_class": "working class"}, "question": {"id": "Q199", "variant": 0}, "response": ["From the emic perspective of a married male from Sohag, Egypt, who is 27 years old, completed middle education, and considers himself part of the working class, the cultural context and individual values play a crucial role in shaping his interest in politics. The socioeconomic background and cultural relativism also factor in, as the political landscape in Egypt is influenced by economic and social structures. Additionally, space and time are important, as the current political climate in Egypt may impact his level of interest. Finally, nuance is key in understanding his response, as the phrasing of the question may influence his answer.\n\n2"]}, {"persona": {"region": "Sohag", "sex": "male", "age": 56, "country": "Egypt", "marital_status": "married", "education": "higher", "social_class": "upper middle class"}, "question": {"id": "Q199", "variant": 0}, "response": ["Based on the anthropological framework, as a married male from Sohag, Egypt, my emic perspective is shaped by my cultural context, individual values, and socioeconomic background. In Sohag, politics is a significant part of everyday life and is deeply ingrained in our cultural context. As someone who has completed higher education and considers myself part of the upper middle class, I have been exposed to a variety of political ideologies and have a personal stake in political decisions. Additionally, my age and place also play a role, as older individuals in Sohag are typically more interested in politics due to their life experiences. Therefore, I would say I am very interested in politics.\n\n1"]}, {"persona": {"region": "Sohag", "sex": "male", "age": 51, "country": "Egypt", "marital_status": "married", "education": "higher", "social_class": "lower middle class"}, "question": {"id": "Q199", "variant": 0}, "response": ["From an anthropological perspective, my cultural context as a married male from Sohag, Egypt, and my age and socioeconomic background as a 51-year-old with a higher education level and lower middle class status greatly influence my interest in politics. In Egyptian society, there is a strong emphasis on family and community, and as a member of the lower middle class, my focus is likely on providing for my family and navigating the challenges of daily life. Additionally, the tumultuous political history of Egypt may have made me wary of political involvement. Therefore, I would choose:\n\n3"]}, {"persona": {"region": "Sohag", "sex": "female", "age": 26, "country": "Egypt", "marital_status": "married", "education": "higher", "social_class": "working class"}, "question": {"id": "Q199", "variant": 0}, "response": ["Based on the anthropological framework, my emic perspective as a married female from Sohag, Egypt, who is 26 years old and part of the working class, is shaped by my cultural context, individual values, and socioeconomic background. In Sohag, politics is an important part of daily life and conversations, and my personal experience and education have also influenced my interest in politics. Additionally, my socioeconomic background as part of the working class has made me more aware of the impact of political decisions on my community and family. Therefore, I am somewhat interested in politics.\n\n2"]}, {"persona": {"region": "Sohag", "sex": "female", "age": 29, "country": "Egypt", "marital_status": "married", "education": "higher", "social_class": "upper middle class"}, "question": {"id": "Q199", "variant": 0}, "response": ["Based on the anthropological framework, my emic perspective as a married female from Sohag, Egypt, who is 29 years old, highly educated, and part of the upper middle class, is influenced by my cultural context, individual values, and socioeconomic background. In Sohag, politics plays a significant role in shaping the social and economic landscape, and as an educated woman from a relatively affluent background, I am likely to be more engaged and interested in politics to ensure that my voice and the voices of others in my community are heard. Additionally, my higher education has likely exposed me to different political ideologies and issues, further increasing my interest in politics. Therefore, my perspective reflects a high level of interest in politics. \n\n2"]}, {"persona": {"region": "Sohag", "sex": "male", "age": 51, "country": "Egypt", "marital_status": "married", "education": "middle", "social_class": "lower middle class"}, "question": {"id": "Q199", "variant": 0}, "response": ["Based on the anthropological framework, my emic perspective as a married male from Sohag, Egypt, who is 51 years old and part of the lower middle class, is shaped by my cultural context, individual values, and socioeconomic background. In Sohag, politics plays a significant role in our daily lives and is deeply intertwined with our cultural context and socioeconomic background. My personal experience and values also influence my perception of politics. Given my age and social status, I have a high level of interest in politics, as I have witnessed and experienced the impact of political decisions on my community and family. Therefore, my answer to the question would be:\n\n2"]}, {"persona": {"region": "Qena", "sex": "male", "age": 32, "country": "Egypt", "marital_status": "single", "education": "middle", "social_class": "working class"}, "question": {"id": "Q199", "variant": 0}, "response": ["Based on the anthropological framework, my personal values and experiences as a working-class male from Qena, Egypt, heavily influence my perspective on politics. The cultural context of my upbringing and socioeconomic background have shaped my understanding of the political landscape. Additionally, my age and place in society have also played a role in forming my views. Therefore, taking into account these factors, I would choose:\n\n2"]}, {"persona": {"region": "Qena", "sex": "male", "age": 54, "country": "Egypt", "marital_status": "married", "education": "middle", "social_class": "lower middle class"}, "question": {"id": "Q199", "variant": 0}, "response": ["Based on the anthropological framework, my cultural context as a married male from Qena, Egypt, greatly influences my interest in politics. In Egypt, political participation is often tied to socioeconomic background and education level. As someone from the lower middle class with a middle education level, I am likely to have limited access to political resources and may feel disconnected from the political process. Additionally, my age and location play a role in shaping my political views, as older individuals in Qena may have experienced political changes and events that have shaped their perspectives. Considering all these factors, I would choose option (2) Somewhat interested in politics."]}, {"persona": {"region": "Qena", "sex": "male", "age": 25, "country": "Egypt", "marital_status": "single", "education": "lower", "social_class": "lower class"}, "question": {"id": "Q199", "variant": 0}, "response": ["Based on the anthropological framework, as a single male from Qena, Egypt, with a lower education level and belonging to the lower class, my perspective on politics is heavily influenced by my cultural context, individual values, and socioeconomic background. Politics in Egypt may not directly impact my daily life, as I may be more concerned with meeting my basic needs and navigating the challenges of lower socioeconomic status. Additionally, my lower education level may limit my understanding of political systems and structures. Therefore, I would be more inclined to choose \"Not very interested\" in politics. \n\n3"]}, {"persona": {"region": "Aswan", "sex": "male", "age": 34, "country": "Egypt", "marital_status": "single", "education": "middle", "social_class": "lower class"}, "question": {"id": "Q199", "variant": 0}, "response": ["From an emic perspective, as a single male from Aswan, Egypt, my cultural context heavily influences my interest in politics. As someone from the lower class with limited education, my access to information and resources to engage in political activities may be limited. Additionally, my individual values and personal experience may lead me to prioritize day-to-day survival over political engagement. Socioeconomic background also plays a significant role, as individuals from lower income brackets may feel disenfranchised and disempowered in the political process. Cultural relativism is crucial in understanding that my perspective on politics may differ significantly from those in higher socioeconomic classes. Additionally, my age and place also influence my level of interest in politics, as I may have grown up in a community with limited political engagement. Considering all these factors, I would choose option (3) Not very interested. \n\n3"]}, {"persona": {"region": "Aswan", "sex": "female", "age": 31, "country": "Egypt", "marital_status": "married", "education": "middle", "social_class": "lower middle class"}, "question": {"id": "Q199", "variant": 0}, "response": ["Based on my cultural context as a married woman from Aswan, Egypt, my level of interest in politics is influenced by my socioeconomic background, education level, and age. As a member of the lower middle class, I have limited access to political resources and opportunities for political participation. Additionally, with only a middle education level, my exposure to political knowledge and discourse may be limited. Furthermore, as a 31-year-old woman, I may have other pressing concerns such as family responsibilities and economic stability, which may detract from my interest in politics. Therefore, I would consider myself somewhat interested in politics. \n\n2"]}, {"persona": {"region": "Aswan", "sex": "female", "age": 39, "country": "Egypt", "marital_status": "married", "education": "middle", "social_class": "working class"}, "question": {"id": "Q199", "variant": 0}, "response": ["Based on the anthropological framework, my emic perspective as a married female from Aswan, Egypt, at the age of 39 and part of the working class, is heavily influenced by cultural context, individual values, and socioeconomic background. In Aswan, politics plays a significant role in shaping our lives and future, and as a member of the working class, I am directly impacted by political decisions. Additionally, my personal experiences and values have led me to be somewhat interested in politics, as I believe it is important to stay informed and engaged in the political process to advocate for the needs of my community and family.\n\n2"]}, {"persona": {"region": "Qena", "sex": "female", "age": 27, "country": "Egypt", "marital_status": "married", "education": "lower", "social_class": "lower middle class"}, "question": {"id": "Q199", "variant": 0}, "response": ["Based on the anthropological framework, my emic perspective as a married female from Qena, Egypt, is influenced by my cultural context, individual values, and socioeconomic background. In my community, women are often not encouraged to be heavily involved in politics, and there are limited opportunities for political engagement for those with lower education levels and lower middle class status. Additionally, my personal experiences and values may lead me to prioritize other aspects of life, such as family and work, over political involvement. Therefore, I would say I am not very interested in politics.\n\n3"]}, {"persona": {"region": "Qena", "sex": "male", "age": 40, "country": "Egypt", "marital_status": "single", "education": "middle", "social_class": "lower middle class"}, "question": {"id": "Q199", "variant": 0}, "response": ["From the perspective of a single male from Qena, Egypt, at 40 years of age and with a middle education level, my cultural context and socioeconomic background play a significant role in shaping my perspective on politics. As a member of the lower middle class, my access to political resources and information may be limited, and my personal values and experiences may lead me to prioritize other aspects of my life over political engagement. Additionally, the cultural relativism of my community may influence my views on politics, as well as the nuanced phrasing of the question itself. Therefore, based on my individual values, personal experience, and socio-economic background, I would choose the following option:\n\n3"]}, {"persona": {"region": "Qena", "sex": "male", "age": 30, "country": "Egypt", "marital_status": "single", "education": "middle", "social_class": "working class"}, "question": {"id": "Q199", "variant": 0}, "response": ["Based on the anthropological framework, as a single male from Qena, Egypt, who is 30 years old and part of the working class, my emic perspective on politics is influenced by my cultural context, individual values and personal experience, and socioeconomic background. In Qena, politics play a significant role in shaping our lives and opportunities, and as a working-class individual, the decisions made by political leaders directly impact my livelihood. Additionally, my personal experience and values lead me to believe that being informed and involved in politics is important for the betterment of my community and my own future. Therefore, I would choose option (2) Somewhat interested in politics. \n\n2"]}]