[{"persona": {"region": "Fayoum", "sex": "male", "age": 46, "country": "Egypt", "marital_status": "married", "education": "higher", "social_class": "lower middle class"}, "question": {"id": "Q224", "variant": 0}, "response": ["As a married male from Fayoum, Egypt, my perspective on the fairness of vote counting in the country's elections is influenced by multiple factors. Firstly, my cultural context and socioeconomic background play a significant role in shaping my views. Coming from a lower middle-class background in Egypt, I am aware of the socio-political dynamics that may impact the fairness of election processes. Additionally, my personal experiences and values have led me to be critical of the electoral system. Taking into account cultural relativism, I understand that my perspective may differ from others based on their own backgrounds and experiences. Therefore, I believe that votes are not often counted fairly in the country's elections.\n\n3"]}, {"persona": {"region": "Fayoum", "sex": "female", "age": 30, "country": "Egypt", "marital_status": "married", "education": "middle", "social_class": "lower middle class"}, "question": {"id": "Q224", "variant": 0}, "response": ["Based on the anthropological framework, as a married female from Fayoum, Egypt, my emic perspective would be shaped by my personal experiences and cultural context. As someone from the lower middle class, my socioeconomic background would influence my perception of the fairness of elections. Additionally, cultural relativism is important to consider, as Egypt has its own unique cultural and political context. Given these factors, I would perceive that votes are not often counted fairly in the country's elections.\n\n3"]}, {"persona": {"region": "Fayoum", "sex": "male", "age": 60, "country": "Egypt", "marital_status": "married", "education": "higher", "social_class": "working class"}, "question": {"id": "Q224", "variant": 0}, "response": ["Based on the anthropological framework, as a married male from Fayoum, Egypt, my emic perspective is influenced by my personal experience and cultural context. The socio-economic background of being part of the working class also shapes my perception. I have seen and experienced the impact of unfair voting practices in my community, and this has been further reinforced by my age and education level. Therefore, I believe that votes are not often counted fairly in the country's elections. \n\n3"]}, {"persona": {"region": "Fayoum", "sex": "male", "age": 20, "country": "Egypt", "marital_status": "single", "education": "middle", "social_class": "lower middle class"}, "question": {"id": "Q224", "variant": 0}, "response": ["Based on the anthropological framework, my perspective as a single male from Fayoum, Egypt, with a lower middle-class socioeconomic background and a middle-level education, is influenced by my individual values and personal experience, as well as the cultural context of my community. In Egypt, there is a long history of political unrest and allegations of election fraud, which has shaped my perception of the fairness of election processes. Additionally, my age and place factor in, as I have witnessed and experienced the impact of political events in my country. Therefore, I believe that votes are not often counted fairly in the country's elections.\n\n3"]}, {"persona": {"region": "Fayoum", "sex": "female", "age": 39, "country": "Egypt", "marital_status": "married", "education": "higher", "social_class": "lower middle class"}, "question": {"id": "Q224", "variant": 0}, "response": ["Based on the anthropological framework, my answer to the question would be influenced by my cultural context, individual values and personal experiences, and socioeconomic background. As a married female from Fayoum, Egypt, I am likely to have experienced and witnessed the impact of socioeconomic factors on the fairness of elections. Additionally, my education level would have provided me with a deeper understanding of political processes. Therefore, I would choose the option:\n\n(3) Not often"]}, {"persona": {"region": "Fayoum", "sex": "male", "age": 33, "country": "Egypt", "marital_status": "married", "education": "higher", "social_class": "working class"}, "question": {"id": "Q224", "variant": 0}, "response": ["Based on the anthropological framework, as a married male from Fayoum, Egypt, who is 33 years old, has completed a higher education level, and considers himself part of the working class, my perspective on the fairness of vote counting in the country's elections would be heavily influenced by my cultural context, individual values, and socioeconomic background. In Egypt, there have been historical and ongoing issues with electoral fairness, and as a member of the working class, I am likely to have experienced or observed instances of unfair vote counting. Additionally, my higher education level would have exposed me to critical thinking and analysis, leading me to question the fairness of the electoral process. Therefore, I would choose option (3) Not often, based on my personal experiences and understanding of the cultural and socioeconomic context in which I live.\n\n3"]}, {"persona": {"region": "Port Said", "sex": "female", "age": 45, "country": "Egypt", "marital_status": "married", "education": "higher", "social_class": "lower middle class"}, "question": {"id": "Q224", "variant": 0}, "response": ["Based on the anthropological framework, I, as a married female from Port Said, Egypt, must consider the emic and etic perspectives, cultural context, individual values and personal experience, socioeconomic background, cultural relativism, space and time, and nuance when answering this question. In Egypt, there is a complex political and social landscape with a history of contested elections and government control. As a lower middle-class woman who has completed higher education, I am aware of the inequalities and power dynamics that affect the fairness of elections. My personal experience and understanding of the cultural context lead me to believe that votes are not often counted fairly in the country's elections. \n\n3"]}, {"persona": {"region": "Port Said", "sex": "male", "age": 42, "country": "Egypt", "marital_status": "married", "education": "middle", "social_class": "lower middle class"}, "question": {"id": "Q224", "variant": 0}, "response": ["Based on my cultural context and socioeconomic background, I understand that my personal experience and values may differ from others. As a married male from Port Said, Egypt, I have witnessed and experienced the impact of socioeconomic factors on the fairness of elections. I am part of the lower middle class, and I have seen how this can affect the voting process. Additionally, I understand that the cultural relativism in Egypt plays a significant role in the perception of fair elections. Therefore, I believe that votes are not often counted fairly in the country's elections.\n\n3"]}, {"persona": {"region": "Port Said", "sex": "male", "age": 28, "country": "Egypt", "marital_status": "single", "education": "middle", "social_class": "lower middle class"}, "question": {"id": "Q224", "variant": 0}, "response": ["Based on the anthropological framework, as a single male from Port Said, Egypt, who is 28 years old, completed middle education, and considers himself part of the lower middle class, there are several factors that influence my perspective on the fairness of election votes in the country. First, my cultural context and socioeconomic background lead me to believe that votes are not often counted fairly in the country's elections. Additionally, my individual values and personal experiences have shaped my perception that the electoral process in Egypt is not always conducted in a fair and transparent manner. Furthermore, the space and time factor, as well as the nuanced phrasing of the question, lead me to believe that the fairness of election votes is a complex issue with no clear-cut answer. Therefore, I believe that votes are not often counted fairly in the country's elections.\n\n3"]}, {"persona": {"region": "Port Said", "sex": "female", "age": 30, "country": "Egypt", "marital_status": "married", "education": "higher", "social_class": "lower middle class"}, "question": {"id": "Q224", "variant": 0}, "response": ["From an emic perspective, as a married female from Port Said, Egypt, I am influenced by the cultural context of my community and the socioeconomic background of being part of the lower middle class. My individual values and personal experiences also play a role in shaping my perception. In Egypt, there have been instances of election irregularities, but there have also been efforts to improve the electoral process. Based on my nuanced understanding of the situation, I believe that votes are counted fairly often in the country's elections, taking into account the progress that has been made in recent years.\n\n2"]}, {"persona": {"region": "Port Said", "sex": "male", "age": 30, "country": "Egypt", "marital_status": "divorced", "education": "middle", "social_class": "lower middle class"}, "question": {"id": "Q224", "variant": 0}, "response": ["Based on my personal experience and socioeconomic background, I understand that there are challenges with fair election processes in my country. As a lower middle class individual, I have witnessed and heard about instances where votes are not accurately counted and election results are manipulated. Additionally, the cultural context and historical background of Egypt also contribute to the understanding that fair elections are not always guaranteed. Therefore, I believe that votes are not often counted fairly in the country's elections.\n\n3"]}, {"persona": {"region": "Port Said", "sex": "female", "age": 19, "country": "Egypt", "marital_status": "single", "education": "middle", "social_class": "lower middle class"}, "question": {"id": "Q224", "variant": 0}, "response": ["Based on the anthropological framework, as a single female from Port Said, Egypt, age 19, with a lower middle-class background and completed middle education level, my perspective on the fairness of vote counting in the country's elections is influenced by my cultural context, socioeconomic background, and personal experiences. In Egypt, there have been concerns raised about the fairness of election processes, and my lower middle-class background has made me more aware of the potential for unfairness in the system. Additionally, my age and education level have exposed me to discussions and news about election issues, leading me to believe that vote counting is not often fair in the country's elections.\n\n3"]}, {"persona": {"region": "Fayoum", "sex": "male", "age": 40, "country": "Egypt", "marital_status": "married", "education": "middle", "social_class": "working class"}, "question": {"id": "Q224", "variant": 0}, "response": ["Based on the anthropological framework, my answer to the question of how often votes are counted fairly in the country's elections is heavily influenced by my cultural context, socioeconomic background, and personal experience. As a married male from Fayoum, Egypt, who is 40 years old and part of the working class, I have witnessed and experienced instances where votes are not often counted fairly in our country's elections. This understanding is shaped by the political and social context in which I live, as well as the socioeconomic factors that affect my daily life. Therefore, my perspective is that votes are not often counted fairly in our country's elections.\n\n3"]}, {"persona": {"region": "Fayoum", "sex": "male", "age": 23, "country": "Egypt", "marital_status": "single", "education": "higher", "social_class": "lower middle class"}, "question": {"id": "Q224", "variant": 0}, "response": ["Based on the anthropological framework, as a 23-year-old single male from Fayoum, Egypt, with a lower middle class background and completed higher education level, my perspective is heavily influenced by my cultural context, individual values, and personal experience. I am aware of the socioeconomic disparities and political issues in my country, and I understand that fair vote counting is often influenced by power dynamics and corruption. Additionally, my age and place of residence have exposed me to the realities of election processes in Egypt. Therefore, I believe that votes are not often counted fairly in the country's elections.\n\n3"]}, {"persona": {"region": "Fayoum", "sex": "female", "age": 38, "country": "Egypt", "marital_status": "married", "education": "middle", "social_class": "lower middle class"}, "question": {"id": "Q224", "variant": 0}, "response": ["Based on the anthropological framework, my perspective as a married female from Fayoum, Egypt, is heavily influenced by my cultural context, socioeconomic background, and personal experience. In Egypt, there is a long history of political unrest and corruption, especially in the electoral process. As a member of the lower middle class, I have witnessed firsthand the struggles and injustices faced by my community, including unfair voting practices. Additionally, my middle level education has provided me with some understanding of the political system and its flaws. Therefore, I am inclined to believe that votes are not often counted fairly in the country's elections.\n\n3"]}, {"persona": {"region": "Fayoum", "sex": "male", "age": 32, "country": "Egypt", "marital_status": "married", "education": "middle", "social_class": "lower middle class"}, "question": {"id": "Q224", "variant": 0}, "response": ["From an emic perspective, as a married male from Fayoum, Egypt, my cultural context and socioeconomic background play a significant role in shaping my answer to the question about the fairness of vote counting in the country's elections. In Egypt, there have been historical issues with electoral transparency and fairness, and as a member of the lower middle class, I have witnessed firsthand the impact of political corruption and the manipulation of votes. My personal experience and individual values also lead me to believe that votes are not often counted fairly in the country's elections. Additionally, the cultural relativism perspective reminds me that my understanding of fairness in elections may differ from others, but based on my nuanced understanding of the question and my socio-economic background, I firmly believe that votes are not often counted fairly in Egypt's elections.\n\n3"]}, {"persona": {"region": "Fayoum", "sex": "male", "age": 31, "country": "Egypt", "marital_status": "married", "education": "higher", "social_class": "working class"}, "question": {"id": "Q224", "variant": 0}, "response": ["Based on the anthropological framework, my perspective as a married male from Fayoum, Egypt, who is 31 years old and part of the working class, is heavily influenced by my cultural context, individual values, and socio-economic background. In Egypt, there are often concerns about the fairness of election processes, with allegations of corruption and manipulation. As someone from the working class, I have seen firsthand the impact of political decisions on my community and believe that votes are not often counted fairly in the country's elections. This belief is also influenced by my personal experience and the nuanced understanding of the political landscape in Egypt. \n\n3"]}, {"persona": {"region": "Fayoum", "sex": "male", "age": 31, "country": "Egypt", "marital_status": "married", "education": "middle", "social_class": "lower middle class"}, "question": {"id": "Q224", "variant": 0}, "response": ["Based on the anthropological framework, as a married male from Fayoum, Egypt, my emic perspective would be influenced by the political and social context of my community. The cultural context of Egypt, including its history of authoritarian rule and the recent political instability, would shape my understanding of the fairness of elections. My individual values and personal experience, as well as my lower middle class socioeconomic background, would also influence my perception of the fairness of elections. Additionally, the cultural relativism of Egypt and the nuanced phrasing of the question would impact my response. Therefore, I would choose option (3) Not often, as I believe that votes are not counted fairly in the country's elections."]}, {"persona": {"region": "Fayoum", "sex": "female", "age": 32, "country": "Egypt", "marital_status": "married", "education": "middle", "social_class": "lower middle class"}, "question": {"id": "Q224", "variant": 0}, "response": ["Based on the anthropological framework, as a married female from Fayoum, Egypt, my emic perspective would be influenced by my cultural context, individual values, and socioeconomic background. In Egypt, the political system may not always guarantee fair elections, and as a member of the lower middle class with limited education, I am likely to be more aware of the challenges and biases in the electoral process. Additionally, my personal experiences and values may lead me to believe that the counting of votes is not often fair. Therefore, based on my perspective and understanding, I would choose option (3) Not often."]}, {"persona": {"region": "Ismailia", "sex": "male", "age": 53, "country": "Egypt", "marital_status": "married", "education": "middle", "social_class": "lower middle class"}, "question": {"id": "Q224", "variant": 0}, "response": ["Based on the anthropological framework, as a married male from Ismailia, Egypt, who is 53 years old and part of the lower middle class, my emic perspective would be influenced by my personal experiences and socioeconomic background. I have likely witnessed various political and social changes throughout my life, which may have affected my trust in the fairness of election processes. Additionally, my cultural context as an Egyptian citizen would also play a significant role in shaping my views on this matter. Therefore, I would answer this question from the perspective of someone who may be skeptical about the fairness of election processes in the country.\n\n3"]}, {"persona": {"region": "Ismailia", "sex": "male", "age": 38, "country": "Egypt", "marital_status": "married", "education": "higher", "social_class": "working class"}, "question": {"id": "Q224", "variant": 0}, "response": ["Based on my cultural context in Ismailia, Egypt, and my working-class background, I understand that the fairness of election vote counting can be influenced by various factors such as power dynamics, political affiliations, and socioeconomic status. My personal experience and values also play a significant role in shaping my perception of the electoral process. Additionally, the emic and etic perspectives in my community may differ from those outside of it, as well as the nuanced phrasing of the question. Taking into account these factors, I believe that votes are not often counted fairly in the country's elections.\n\n3"]}, {"persona": {"region": "Ismailia", "sex": "female", "age": 35, "country": "Egypt", "marital_status": "married", "education": "middle", "social_class": "lower middle class"}, "question": {"id": "Q224", "variant": 0}, "response": ["Based on the anthropological framework, my emic perspective as a married female from Ismailia, Egypt, is influenced by my cultural context, individual values, and socioeconomic background. In Egypt, there is a long history of political and social hierarchies that impact the fairness of elections. Additionally, as part of the lower middle class, I am aware of the challenges and inequalities that exist within the electoral system. Therefore, based on my personal experience and understanding of the cultural context, I would say that votes are not often counted fairly in the country's elections.\n\n3"]}, {"persona": {"region": "Ismailia", "sex": "female", "age": 57, "country": "Egypt", "marital_status": "married", "education": "lower", "social_class": "working class"}, "question": {"id": "Q224", "variant": 0}, "response": ["Based on the anthropological framework, my perspective as a married female from Ismailia, Egypt, who is 57 years old, completed lower education, and considers herself part of the working class, is heavily influenced by cultural context, individual values, and socioeconomic background. In Egypt, there are cultural and societal norms that may impact the fairness of election vote counting. Additionally, my personal experience and socioeconomic background as a member of the working class may lead me to have a different perspective on the fairness of vote counting compared to someone from a different background. Therefore, I would answer the question as follows:\n\n3"]}, {"persona": {"region": "Ismailia", "sex": "male", "age": 33, "country": "Egypt", "marital_status": "married", "education": "middle", "social_class": "lower middle class"}, "question": {"id": "Q224", "variant": 0}, "response": ["Based on the anthropological framework, my answer to the question about the fairness of vote counting in the country's elections is influenced by my emic perspective as a married male from Ismailia, Egypt. My cultural context and socioeconomic background as a lower middle-class individual have shaped my perception of the electoral process. Additionally, my personal experiences and individual values have led me to believe that votes are not often counted fairly in the country's elections due to various factors such as corruption and unequal access to resources. Therefore, I choose option (3) Not often."]}, {"persona": {"region": "Ismailia", "sex": "female", "age": 49, "country": "Egypt", "marital_status": "single", "education": "higher", "social_class": "upper middle class"}, "question": {"id": "Q224", "variant": 0}, "response": ["Based on my emic perspective as a single, educated, upper middle class woman from Ismailia, Egypt, I have witnessed and experienced the voting process in my country. I am influenced by my cultural context, individual values, and personal experiences, as well as my socioeconomic background. I am aware of the political climate and the challenges that exist within the electoral system. Additionally, my understanding of cultural relativism allows me to recognize the nuances of the voting process in Egypt. Therefore, I can confidently say that votes are counted fairly often in the country's elections.\n\n2"]}, {"persona": {"region": "Ismailia", "sex": "female", "age": 35, "country": "Egypt", "marital_status": "married", "education": "higher", "social_class": "lower middle class"}, "question": {"id": "Q224", "variant": 0}, "response": ["Based on the anthropological framework, my answer is influenced by my emic perspective as a married female from Ismailia, Egypt, as well as my socioeconomic background as part of the lower middle class. My personal experience and individual values also play a role in my perception of the fairness of election vote counting. Additionally, the cultural context of Egypt, including its political and social dynamics, shapes my understanding of this issue. Taking into account these factors, I choose option (3) Not often. \n\n3"]}, {"persona": {"region": "Ismailia", "sex": "male", "age": 24, "country": "Egypt", "marital_status": "single", "education": "higher", "social_class": "upper middle class"}, "question": {"id": "Q224", "variant": 0}, "response": ["Based on the anthropological framework, my cultural context as a single male from Ismailia, Egypt, who is 24 years old and part of the upper middle class, plays a significant role in my perception of the fairness of election votes. My socioeconomic background and higher education level have likely exposed me to a wider range of information and perspectives on political processes. Additionally, my individual values and personal experience in a country with a complex political history may lead me to believe that votes are not often counted fairly in the country's elections.\n\n3"]}, {"persona": {"region": "Ismailia", "sex": "female", "age": 23, "country": "Egypt", "marital_status": "single", "education": "higher", "social_class": "lower middle class"}, "question": {"id": "Q224", "variant": 0}, "response": ["Based on the anthropological framework, my emic perspective as a single female from Ismailia, Egypt, who is 23 years old and part of the lower middle class, is deeply influenced by my cultural context, individual values, and personal experience. In Egypt, there are both emic and etic perspectives on the fairness of elections. From an emic perspective, my personal experience and the experiences of those around me, as well as the socioeconomic background of my community, lead me to believe that votes are not often counted fairly in the country's elections. This perspective is informed by the cultural relativism and nuance of the Egyptian context, where power dynamics and social inequalities play a significant role in the electoral process. Therefore, my answer is (3) Not often."]}, {"persona": {"region": "Ismailia", "sex": "male", "age": 55, "country": "Egypt", "marital_status": "married", "education": "middle", "social_class": "lower middle class"}, "question": {"id": "Q224", "variant": 0}, "response": ["From the perspective of a married male from Ismailia, Egypt, who is 55 years old, completed middle education level, and considers himself part of the lower middle class, there are several factors that influence my answer to the question of how often votes are counted fairly in the country's elections. The cultural context in Egypt is one where there has historically been skepticism and concern about the fairness of elections. This skepticism is fueled by the socioeconomic background of individuals like myself, who are part of the lower middle class, and who may feel marginalized and voiceless in the political process. Additionally, the nuance of the question is important to consider - while there may be instances of fair vote counting, the overall perception is that it does not happen often. Therefore, based on these factors and my own personal experience, I would choose option (3) Not often.\n\n3"]}, {"persona": {"region": "Ismailia", "sex": "male", "age": 57, "country": "Egypt", "marital_status": "married", "education": "middle", "social_class": "upper middle class"}, "question": {"id": "Q224", "variant": 0}, "response": ["Based on my personal experience and socioeconomic background, I have observed that in our country, votes are often counted fairly in the elections. As a member of the upper middle class, I have had the privilege of witnessing the electoral process in a relatively stable and organized manner. Additionally, the cultural context and nuance of the question also play a role in my perception, as the political environment in Egypt is influenced by a complex history and social dynamics. Therefore, I firmly believe that votes are counted fairly in the country's elections more often than not.\n\n1"]}, {"persona": {"region": "Ismailia", "sex": "female", "age": 29, "country": "Egypt", "marital_status": "married", "education": "middle", "social_class": "upper middle class"}, "question": {"id": "Q224", "variant": 0}, "response": ["Based on my emic perspective as a married female from Ismailia, Egypt, I understand that the cultural context and socioeconomic background play a significant role in the fairness of election vote counting. In Egypt, there are certain societal and cultural norms that influence the political landscape and voting process. Additionally, as a member of the upper middle class, I have observed that there may be certain privileges and access to resources that can impact the level of fairness in vote counting. Therefore, I believe that votes are counted fairly often in the country's elections.\n\n2"]}, {"persona": {"region": "Damiatta", "sex": "female", "age": 46, "country": "Egypt", "marital_status": "married", "education": "middle", "social_class": "lower middle class"}, "question": {"id": "Q224", "variant": 0}, "response": ["Based on the anthropological framework, as a married female from Damiatta, Egypt, who is 46 years old and part of the lower middle class, my answer is influenced by my cultural context, socioeconomic background, and personal experience. In Egypt, there have been historical issues with the fairness of election votes, and as a member of the lower middle class, I have personally witnessed instances where votes were not counted fairly. Additionally, my age and education level have given me a nuanced understanding of the political landscape in Egypt. Therefore, my answer is:\n\n3) Not often"]}, {"persona": {"region": "Damiatta", "sex": "female", "age": 20, "country": "Egypt", "marital_status": "single", "education": "middle", "social_class": "lower middle class"}, "question": {"id": "Q224", "variant": 0}, "response": ["Based on the anthropological framework, my perspective on the fairness of vote counting in the country's elections is influenced by my cultural context, individual values, and socioeconomic background. As a 20-year-old single female from Damiatta, Egypt, with a middle education level and considering myself part of the lower middle class, I am aware of the political and social dynamics in my country and the challenges that come with it. I have personally experienced and witnessed how socioeconomic background can impact the fairness of elections, and I know that votes are not often counted fairly in the country's elections.\n\n3"]}, {"persona": {"region": "Damiatta", "sex": "male", "age": 19, "country": "Egypt", "marital_status": "single", "education": "middle", "social_class": "lower middle class"}, "question": {"id": "Q224", "variant": 0}, "response": ["Based on my personal experience and socioeconomic background as a lower middle class male from Damiatta, Egypt, I have witnessed that votes are not often counted fairly in the country's elections. The cultural context and socioeconomic background in Egypt play a significant role in the electoral process, and my individual values and personal experience have led me to this conclusion. Additionally, the emic and etic perspectives in Egypt highlight the challenges and disparities in the electoral system, further reinforcing my belief that votes are not often counted fairly in the country's elections.\n\n3"]}, {"persona": {"region": "Damiatta", "sex": "female", "age": 33, "country": "Egypt", "marital_status": "married", "education": "higher", "social_class": "lower middle class"}, "question": {"id": "Q224", "variant": 0}, "response": ["Based on the anthropological framework, my emic perspective as a married female from Damiatta, Egypt, is influenced by my cultural context, individual values, and socioeconomic background. I am aware of the political and social dynamics in my country, and I understand that the fairness of election vote counting can vary based on different factors such as regional differences and political affiliations. Additionally, my personal experience and education have taught me to critically analyze and question the fairness of electoral processes. Therefore, based on my perspective, I believe that votes are not often counted fairly in the country's elections.\n\n3"]}, {"persona": {"region": "Damiatta", "sex": "male", "age": 24, "country": "Egypt", "marital_status": "single", "education": "higher", "social_class": "lower middle class"}, "question": {"id": "Q224", "variant": 0}, "response": ["From an emic perspective, as a member of the lower middle class in Damiatta, Egypt, I have personally experienced and witnessed the impact of the cultural context, socioeconomic background, and space and time on the fairness of election votes. The cultural context in Egypt, including the influence of political and social structures, plays a significant role in shaping the fairness of election processes. Additionally, my socioeconomic background as a lower middle class individual has made me more aware of the potential disparities in the electoral system. Moreover, being 24 years old and having completed higher education, I am attuned to the nuances of the electoral process, which have led me to believe that votes are not often counted fairly in the country's elections.\n\n3"]}, {"persona": {"region": "Suez", "sex": "male", "age": 41, "country": "Egypt", "marital_status": "married", "education": "middle", "social_class": "working class"}, "question": {"id": "Q224", "variant": 0}, "response": ["Based on the anthropological framework, my perspective as a married male from Suez, Egypt, at the age of 41, with a middle education level, and considering myself part of the working class, is deeply influenced by my cultural context, individual values and personal experience, and socioeconomic background. In Egypt, there is a strong cultural and historical context of political unrest and skepticism towards the fairness of elections. Additionally, as a member of the working class, I am likely to have experienced socioeconomic disparities and inequalities that impact my trust in the electoral process. Therefore, based on these factors, I am inclined to believe that votes are not often counted fairly in the country's elections.\n\n3"]}, {"persona": {"region": "Suez", "sex": "female", "age": 39, "country": "Egypt", "marital_status": "divorced", "education": "middle", "social_class": "working class"}, "question": {"id": "Q224", "variant": 0}, "response": ["Based on the anthropological framework, my perspective as a divorced female from Suez, Egypt, with a middle education level and part of the working class, is shaped by my cultural context, individual values, and personal experience. In Egypt, there is a significant level of skepticism regarding the fairness of elections due to historical and cultural factors. The socioeconomic background also plays a role, as those from working-class backgrounds may feel further marginalized in the political process. Additionally, space and time are important factors, as the perception of electoral fairness may vary depending on the region and the specific historical moment. Therefore, my answer to the question would be:\n\n3"]}, {"persona": {"region": "Cairo", "sex": "female", "age": 55, "country": "Egypt", "marital_status": "married", "education": "middle", "social_class": "working class"}, "question": {"id": "Q224", "variant": 0}, "response": ["Based on the anthropological framework, the emic perspective of a married female from Cairo, Egypt, who is 55 years old and part of the working class, would be influenced by her cultural context, individual values, and socioeconomic background. In Egypt, there may be a sense of skepticism towards the fairness of elections due to historical and cultural factors. Additionally, being part of the working class may also lead to a belief that votes are not often counted fairly, as those in lower socioeconomic positions may feel marginalized in the political process. Therefore, I would choose option 3: Not often. \n\n3"]}, {"persona": {"region": "Cairo", "sex": "male", "age": 58, "country": "Egypt", "marital_status": "married", "education": "middle", "social_class": "lower middle class"}, "question": {"id": "Q224", "variant": 0}, "response": ["Based on the anthropological framework, my perspective as a married male from Cairo, Egypt, at 58 years of age with a middle education level and considering myself part of the lower middle class, is heavily influenced by my cultural context, individual values, and socioeconomic background. In Egypt, there is a long history of political turmoil and allegations of election fraud. My personal experience and the experiences of those in my social network have led me to believe that votes are not often counted fairly in the country's elections. Additionally, my socioeconomic background as a lower middle-class individual has limited my access to political power and influence, reinforcing my belief that the system is not fair. Therefore, I choose option (3) Not often.\n\n3"]}, {"persona": {"region": "Cairo", "sex": "female", "age": 29, "country": "Egypt", "marital_status": "married", "education": "higher", "social_class": "lower middle class"}, "question": {"id": "Q224", "variant": 0}, "response": ["Based on my emic perspective as a married female from Cairo, Egypt, I have witnessed and experienced firsthand the cultural context and socioeconomic background of my country. The political climate and the way elections are conducted are influenced by these factors. Additionally, my individual values and personal experiences have shaped my understanding of the fairness of the electoral process. Considering the nuance of the question, I must acknowledge that the perception of fair vote counting may vary among different groups within the society. Therefore, taking into account the cultural relativism and the space and time factors, I would have to say that votes are not often counted fairly in the country's elections.\n\n3"]}, {"persona": {"region": "Cairo", "sex": "male", "age": 38, "country": "Egypt", "marital_status": "married", "education": "higher", "social_class": "lower middle class"}, "question": {"id": "Q224", "variant": 0}, "response": ["Based on my personal experience and socioeconomic background, I believe that votes are not often counted fairly in the country's elections. As a lower middle-class individual from Cairo, I have seen and heard about instances of electoral fraud and manipulation. Additionally, considering the cultural context and space and time factors, it is evident that there are challenges to conducting fair elections in Egypt. Therefore, I would choose:\n\n(3) Not often"]}, {"persona": {"region": "Cairo", "sex": "female", "age": 40, "country": "Egypt", "marital_status": "married", "education": "higher", "social_class": "lower middle class"}, "question": {"id": "Q224", "variant": 0}, "response": ["In considering the question of how often votes are counted fairly in the country's elections, it is important to take into account the emic perspective of individuals within the lower middle class in Cairo, Egypt. This group is likely to have a strong awareness of the cultural context and socioeconomic background in which elections take place, as well as the impact of personal experiences and values. Additionally, the nuanced phrasing of the question and the understanding of cultural relativism are crucial in providing an accurate response. Taking all of these factors into consideration, I can confidently say that votes are not often counted fairly in the country's elections.\n\n3"]}, {"persona": {"region": "Cairo", "sex": "male", "age": 38, "country": "Egypt", "marital_status": "married", "education": "higher", "social_class": "upper middle class"}, "question": {"id": "Q224", "variant": 0}, "response": ["Based on my cultural context as a married male from Cairo, Egypt, I am aware that the electoral process in my country is influenced by a variety of factors, including political affiliations, socioeconomic background, and power dynamics. My individual values and personal experiences lead me to believe that votes are not often counted fairly in the country's elections. This belief is shaped by my understanding of the societal and political landscape, as well as by the experiences of those within my social and professional circles. Additionally, the concept of cultural relativism teaches me to acknowledge the complexities and nuances of the electoral process in Egypt, and to recognize that the perception of fairness may vary depending on one's perspective.\n\n3"]}, {"persona": {"region": "Cairo", "sex": "male", "age": 59, "country": "Egypt", "marital_status": "married", "education": "middle", "social_class": "lower middle class"}, "question": {"id": "Q224", "variant": 0}, "response": ["Based on the anthropological framework, my emic perspective as a married male from Cairo, Egypt, who is 59 years old and part of the lower middle class, is shaped by my cultural context, socioeconomic background, and personal experiences. In Egypt, there is a history of political turmoil and allegations of electoral fraud. As someone from the lower middle class, I have personally witnessed instances where votes were not counted fairly in elections. This has led me to believe that votes are not often counted fairly in the country's elections, as the political climate and power dynamics often influence the integrity of the electoral process.\n\n3"]}, {"persona": {"region": "Cairo", "sex": "female", "age": 30, "country": "Egypt", "marital_status": "married", "education": "higher", "social_class": "upper middle class"}, "question": {"id": "Q224", "variant": 0}, "response": ["Based on the anthropological framework, as a married female from Cairo, Egypt, my understanding and answer to the question of how often votes are counted fairly in the country's elections would be shaped by my cultural context, individual values, and socioeconomic background. Being from a city with a history of political activism and social movements, I am aware of the complexities and challenges in our electoral system. My education has also provided me with critical thinking skills to analyze the political landscape. Additionally, being part of the upper middle class, I have access to information and resources that may influence my perception. Therefore, based on my perspective, I would choose option (3) Not often. \n\n3"]}, {"persona": {"region": "Cairo", "sex": "male", "age": 22, "country": "Egypt", "marital_status": "single", "education": "middle", "social_class": "lower middle class"}, "question": {"id": "Q224", "variant": 0}, "response": ["Based on my emic perspective, as a young man from the lower middle class in Cairo, Egypt, I have personally witnessed and experienced the impact of socioeconomic background on the fairness of elections. The cultural context in Egypt also plays a significant role in the way elections are conducted and perceived. My personal experience and values lead me to believe that votes are not often counted fairly in the country's elections, and this is further supported by the nuance of the question, which allows for a subjective interpretation based on individual experiences and cultural understanding.\n\n3"]}, {"persona": {"region": "Cairo", "sex": "male", "age": 29, "country": "Egypt", "marital_status": "single", "education": "higher", "social_class": "lower middle class"}, "question": {"id": "Q224", "variant": 0}, "response": ["Based on the anthropological framework, my emic perspective as a single male from Cairo, Egypt would be influenced by my cultural context, individual values, and socioeconomic background. In Egypt, there is a strong emphasis on collectivism and loyalty to the state, so the in-group perspective may be to believe that votes are counted fairly in elections. However, my personal experience and lower middle class status may lead me to have some skepticism about the fairness of the electoral process. Additionally, the cultural relativism framework would encourage me to consider the nuances of the question and the potential for bias in the electoral system. Therefore, my answer would be:\n\n2. Fairly often"]}, {"persona": {"region": "Cairo", "sex": "female", "age": 31, "country": "Egypt", "marital_status": "married", "education": "higher", "social_class": "lower middle class"}, "question": {"id": "Q224", "variant": 0}, "response": ["Based on the anthropological framework of emic and etic perspectives, cultural context, individual values and personal experience, socioeconomic background, cultural relativism, space and time, and nuance, as a 31-year-old married woman from Cairo, Egypt, with a lower middle-class background and higher education, my perspective on the fairness of vote counting in the country's elections is shaped by my personal experience and cultural context. In Egypt, there have been historical and ongoing issues with fair elections, and my socioeconomic background and education have made me aware of these discrepancies. Additionally, the cultural relativism of the country's political system and the nuanced understanding of power dynamics lead me to believe that votes are not often counted fairly in the country's elections.\n\n3"]}, {"persona": {"region": "Cairo", "sex": "male", "age": 59, "country": "Egypt", "marital_status": "married", "education": "higher", "social_class": "upper middle class"}, "question": {"id": "Q224", "variant": 0}, "response": ["Based on the anthropological framework, my emic perspective as a married male from Cairo, Egypt, with a higher education level and belonging to the upper middle class, is influenced by my cultural context, individual values, and socioeconomic background. In Egypt, the political system and electoral processes are deeply embedded in the cultural and social fabric of the country. My personal experience and values lead me to believe that votes are not often counted fairly in the country's elections due to various factors such as corruption, political influence, and social disparities. Additionally, the cultural relativism perspective reminds me that my view may differ from others, but based on my background and understanding, I firmly believe that fair vote counting is not common in our country's elections.\n\n3"]}, {"persona": {"region": "Cairo", "sex": "male", "age": 27, "country": "Egypt", "marital_status": "single", "education": "middle", "social_class": "working class"}, "question": {"id": "Q224", "variant": 0}, "response": ["Based on my emic perspective as a single male from Cairo, Egypt, I have personally witnessed and experienced the cultural context of electoral processes in my country. The socioeconomic background of the working class, including myself, plays a significant role in shaping our individual values and personal experiences. Additionally, the cultural relativism of Egypt's political landscape and the nuanced understanding of space and time in my community have led me to the conclusion that votes are not often counted fairly in the country's elections.\n\n3"]}, {"persona": {"region": "Cairo", "sex": "female", "age": 25, "country": "Egypt", "marital_status": "single", "education": "higher", "social_class": "working class"}, "question": {"id": "Q224", "variant": 0}, "response": ["Based on the anthropological framework, as a single female from Cairo, Egypt, I am very aware of the cultural context in which elections take place. The political climate in Egypt is influenced by a long history of authoritarian rule and political instability, which has a significant impact on the fairness of elections. My personal experience and socioeconomic background as a working-class individual also play a role in my perception of the voting process. Additionally, the cultural relativism perspective reminds me that my understanding of fairness in elections may differ from others due to my individual values and cultural context. Therefore, I believe that votes are not often counted fairly in the country's elections.\n\n3"]}, {"persona": {"region": "Cairo", "sex": "female", "age": 23, "country": "Egypt", "marital_status": "married", "education": "higher", "social_class": "lower middle class"}, "question": {"id": "Q224", "variant": 0}, "response": ["Based on my personal experience and cultural context as a married female from Cairo, Egypt, I understand that the fairness of election vote counting is influenced by various factors such as socioeconomic background, cultural relativism, and the nuanced phrasing of the question. As a lower middle class individual with a higher education level, I am aware of the socioeconomic disparities that exist in my country, which may impact the fairness of election vote counting. Additionally, the cultural relativism perspective teaches me to recognize that different societal norms and values may influence the perception of fairness in elections. Therefore, based on these factors, I would choose option (3) Not often, as I believe that the vote counting in my country's elections may not occur fairly frequently. \n\n3"]}, {"persona": {"region": "Cairo", "sex": "male", "age": 58, "country": "Egypt", "marital_status": "married", "education": "higher", "social_class": "working class"}, "question": {"id": "Q224", "variant": 0}, "response": ["Based on the anthropological framework, as a married male from Cairo, Egypt, who is 58 years old and part of the working class, my perspective on the fairness of election vote counting is influenced by my cultural context, individual values, and socioeconomic background. In Egypt, there is a long history of political unrest and allegations of electoral fraud, which has shaped my view of the electoral process. Additionally, my socioeconomic background as a member of the working class may lead me to feel disenfranchised and skeptical of the fairness of vote counting. Therefore, I believe that votes are not counted fairly in the country's elections.\n\n3"]}, {"persona": {"region": "Cairo", "sex": "female", "age": 40, "country": "Egypt", "marital_status": "married", "education": "higher", "social_class": "working class"}, "question": {"id": "Q224", "variant": 0}, "response": ["Based on the anthropological framework, my perspective as a married female from Cairo, Egypt, who is 40 years old, completed higher education, and considers myself part of the working class, is shaped by my cultural context, individual values, and socioeconomic background. In Egypt, the cultural context and socioeconomic background play a significant role in shaping people's perceptions of fairness and justice, including in the electoral process. Additionally, my personal experiences and values as a woman in Egypt also influence my understanding of the fairness of elections. Therefore, my answer to the question is:\n\n3) Not often"]}, {"persona": {"region": "Cairo", "sex": "female", "age": 36, "country": "Egypt", "marital_status": "married", "education": "middle", "social_class": "upper middle class"}, "question": {"id": "Q224", "variant": 0}, "response": ["Based on the anthropological framework, I, as a married female from Cairo, Egypt, would consider the cultural context and the socioeconomic background to be crucial in answering this question. In Egypt, there is a long history of political and social unrest, and the cultural context of the country plays a significant role in shaping the perception of the fairness of elections. Additionally, as part of the upper middle class, I have likely been exposed to different sources of information and have had different experiences compared to those from lower socioeconomic backgrounds. These factors would influence my perception of how often votes are counted fairly in the country's elections.\n\n3"]}, {"persona": {"region": "Cairo", "sex": "male", "age": 40, "country": "Egypt", "marital_status": "married", "education": "middle", "social_class": "lower middle class"}, "question": {"id": "Q224", "variant": 0}, "response": ["Based on the anthropological framework, as a married male from Cairo, Egypt, who is 40 years old and part of the lower middle class, my perspective on the fairness of election vote counting is influenced by my cultural context, socioeconomic background, and personal experience. In Egypt, there is a long history of political instability and allegations of election fraud, which has led to a general mistrust of the electoral process among lower income citizens. Additionally, my lower middle class status means that I may not have the same access to resources or influence as those in higher socioeconomic brackets, further impacting my perception of the fairness of elections. Taking into account these factors, my answer is (3) Not often."]}, {"persona": {"region": "Cairo", "sex": "female", "age": 30, "country": "Egypt", "marital_status": "married", "education": "middle", "social_class": "lower class"}, "question": {"id": "Q224", "variant": 0}, "response": ["Based on the anthropological framework, my individual values and personal experience as a lower-class woman living in Cairo, Egypt, greatly influence my perception of the fairness of election vote counting. My socioeconomic background and cultural context also play a significant role in shaping my perspective. Additionally, the emic and etic perspectives highlight the in-group and out-group ways of answering this question, as well as the cultural relativism that emphasizes the subjective nature of cultural understanding. Considering all these factors, I would choose:\n3) Not often"]}, {"persona": {"region": "Cairo", "sex": "male", "age": 58, "country": "Egypt", "marital_status": "married", "education": "higher", "social_class": "lower middle class"}, "question": {"id": "Q224", "variant": 0}, "response": ["Based on the anthropological framework, my individual values and personal experiences as a married male from Cairo, Egypt, have shaped my perception of the fairness of election vote counting. The cultural context of living in a lower middle-class neighborhood in Cairo has also influenced my understanding of the political system and the socioeconomic background has made me aware of the challenges faced by the lower middle class. Additionally, being 58 years old, I have witnessed various elections and have formed my opinion based on my experiences. Therefore, based on these perspectives, I would say that votes are not often counted fairly in the country's elections.\n\n3"]}, {"persona": {"region": "Cairo", "sex": "male", "age": 50, "country": "Egypt", "marital_status": "married", "education": "middle", "social_class": "lower middle class"}, "question": {"id": "Q224", "variant": 0}, "response": ["From the perspective of a married middle-aged man from Cairo, Egypt, with a lower middle-class socioeconomic background, it is important to consider the emic and etic perspectives in answering this question. The cultural context of Egypt, with its history of political unrest and corruption, plays a pivotal role in understanding the fairness of election processes. Additionally, individual values and personal experiences shape the perception of electoral fairness. Socioeconomic background also factors into the perception of the fairness of elections, as those from lower middle-class backgrounds may have different experiences and access to information compared to those from higher socioeconomic statuses. Furthermore, cultural relativism reminds us that the perception of fairness in elections is subjective and can vary based on individual experiences and societal norms. Therefore, from this perspective, the answer to the question of how often votes are counted fairly in the country's elections would be (3) Not often. \n\n3"]}, {"persona": {"region": "Cairo", "sex": "female", "age": 40, "country": "Egypt", "marital_status": "married", "education": "higher", "social_class": "upper middle class"}, "question": {"id": "Q224", "variant": 0}, "response": ["Based on my cultural context as a married female from Cairo, Egypt, my understanding of the fairness of election vote counting is influenced by my socioeconomic background, individual values, and personal experience. As a member of the upper middle class who has completed higher education, I have been exposed to and have a better understanding of the political processes in Egypt. Additionally, my age and place also play a role in shaping my perception of how often votes are counted fairly in the country's elections. I believe that votes are counted fairly often, as there have been efforts to improve the electoral process and ensure transparency in recent years.\n\n2"]}, {"persona": {"region": "Cairo", "sex": "female", "age": 33, "country": "Egypt", "marital_status": "married", "education": "middle", "social_class": "lower middle class"}, "question": {"id": "Q224", "variant": 0}, "response": ["In considering the question of how often votes are counted fairly in the country's elections, it is important to take into account the emic and etic perspectives, cultural context, individual values and personal experience, socioeconomic background, cultural relativism, space and time, and nuance. As a married female from Cairo, Egypt, I am aware of the complexities of our political system and the impact of socioeconomic background on the fairness of elections. Additionally, the cultural context and personal experience have shown me that there are often challenges in ensuring fair vote counting, especially for individuals from the lower middle class. Therefore, based on these factors, I would choose option (3) Not often. \n\n3"]}, {"persona": {"region": "Cairo", "sex": "female", "age": 37, "country": "Egypt", "marital_status": "married", "education": "middle", "social_class": "lower middle class"}, "question": {"id": "Q224", "variant": 0}, "response": ["Based on the anthropological framework, as a married female from Cairo, Egypt, my emic perspective would be influenced by the cultural context of living in a country with a history of political instability and allegations of election fraud. My socioeconomic background as part of the lower middle class would also play a role, as those with less economic power may feel marginalized in the electoral process. Additionally, my personal experience and individual values would lead me to believe that votes are not often counted fairly in the country's elections. Therefore, my answer would be:\n\n3) Not often"]}, {"persona": {"region": "Cairo", "sex": "male", "age": 28, "country": "Egypt", "marital_status": "married", "education": "middle", "social_class": "lower middle class"}, "question": {"id": "Q224", "variant": 0}, "response": ["Based on the anthropological framework, as a married male from Cairo, Egypt, with a middle education level and part of the lower middle class, my perspective is influenced by my cultural context, individual values, and socioeconomic background. In Egypt, there are certain power dynamics and political influences that affect the fairness of election processes. Additionally, my personal experience and values lead me to believe that votes are not often counted fairly in the country's elections, as there have been instances of corruption and manipulation. Therefore, I would choose option (3) Not often."]}, {"persona": {"region": "Cairo", "sex": "male", "age": 53, "country": "Egypt", "marital_status": "married", "education": "higher", "social_class": "working class"}, "question": {"id": "Q224", "variant": 0}, "response": ["Based on the anthropological framework, as a married male from Cairo, Egypt, my emic perspective would be influenced by the cultural context of living in a country with a history of political unrest and a complex political landscape. Additionally, my individual values and personal experiences as a working-class individual who has witnessed various election processes would shape my perception. My socioeconomic background and age also play a role in my understanding of the electoral process. Furthermore, cultural relativism reminds me that my perspective is not universal and may differ from others. Therefore, considering all these factors, I would choose option (3) Not often, as I believe that votes are not counted fairly in the country's elections based on my personal experiences and the socio-political context of Egypt.\n\n3"]}, {"persona": {"region": "Cairo", "sex": "male", "age": 45, "country": "Egypt", "marital_status": "married", "education": "higher", "social_class": "lower middle class"}, "question": {"id": "Q224", "variant": 0}, "response": ["Based on the anthropological framework, as a married male from Cairo, Egypt, my emic perspective is influenced by the cultural context of Egypt, where there is a history of political turmoil and mistrust in the electoral process. My individual values and personal experience, along with my lower middle class socioeconomic background, lead me to believe that votes are not often counted fairly in the country's elections. This is further supported by the cultural relativism of Egypt, where there is a lack of trust in the government and the electoral system. Additionally, my age and place also contribute to my belief, as I have witnessed various instances of electoral irregularities. Therefore, I choose option 3: Not often.\n\n3"]}, {"persona": {"region": "Cairo", "sex": "male", "age": 52, "country": "Egypt", "marital_status": "married", "education": "middle", "social_class": "upper middle class"}, "question": {"id": "Q224", "variant": 0}, "response": ["From the perspective of a married male from Cairo, Egypt, who is 52 years old and part of the upper middle class, the answer to the question of how often votes are counted fairly in the country's elections would be influenced by cultural context, individual values, and socioeconomic background. In Egypt, there have been historical and cultural factors that have influenced the electoral process, and the individual's socioeconomic status may also impact their perception of the fairness of elections. Additionally, the individual's age and education level may contribute to their understanding of the political system and the electoral process. Therefore, considering these factors, the most likely answer would be that votes are not often counted fairly in the country's elections.\n\n3"]}, {"persona": {"region": "Cairo", "sex": "male", "age": 22, "country": "Egypt", "marital_status": "single", "education": "higher", "social_class": "lower middle class"}, "question": {"id": "Q224", "variant": 0}, "response": ["Based on the anthropological framework, my perspective as a single male from Cairo, Egypt, is influenced by my cultural context, socioeconomic background, individual values, and personal experience. In Egypt, there is a strong emphasis on the importance of fair elections, but the reality is that there are often reports of irregularities and lack of transparency in the electoral process. As a member of the lower middle class, I have witnessed firsthand the challenges and inequalities that exist in our electoral system. Additionally, my age and educational background have provided me with the awareness and critical thinking skills to recognize these issues. Therefore, I believe that votes are not often counted fairly in the country's elections.\n\n3"]}, {"persona": {"region": "Cairo", "sex": "female", "age": 57, "country": "Egypt", "marital_status": "divorced", "education": "middle", "social_class": "lower middle class"}, "question": {"id": "Q224", "variant": 0}, "response": ["Based on the anthropological framework, I, as a divorced female from Cairo, Egypt, understand and answer questions based on my individual values, personal experiences, and socioeconomic background. As a member of the lower middle class in Egypt, my access to education and information may be limited, and I may have experienced instances where votes were not counted fairly in the country's elections. Additionally, the cultural context and cultural relativism in Egypt also play a role in shaping my perspective on this issue. Therefore, my answer to the question \"How often are votes counted fairly in the country's elections?\" would be:\n\n3) Not often"]}, {"persona": {"region": "Cairo", "sex": "female", "age": 42, "country": "Egypt", "marital_status": "married", "education": "middle", "social_class": "working class"}, "question": {"id": "Q224", "variant": 0}, "response": ["Based on the anthropological framework, I believe that my emic perspective as a working-class woman from Cairo, Egypt, with a middle education level, and being 42 years old, is crucial in answering the question of how often votes are counted fairly in the country's elections. My cultural context and socioeconomic background play a significant role in shaping my perception of the fairness of election vote counting. Additionally, my individual values and personal experiences, as well as the space and time in which I have lived, have influenced my understanding of the electoral process in Egypt. Therefore, considering all these factors, I choose option (3) Not often."]}, {"persona": {"region": "Cairo", "sex": "female", "age": 23, "country": "Egypt", "marital_status": "single", "education": "middle", "social_class": "lower middle class"}, "question": {"id": "Q224", "variant": 0}, "response": ["Based on the anthropological framework, I would like to provide an answer from the perspective of a single female from Cairo, Egypt. As someone from the lower middle class with a middle education level, my understanding of the fairness of election vote counting is influenced by my cultural context, individual values, and socioeconomic background. My experiences and personal values shape my perception of the political system, and I am aware of the challenges and limitations that may affect the fairness of election vote counting in my country. Additionally, my age and place also play a role in forming my opinion on this matter. Considering these factors, I would choose the following option:\n\n3"]}, {"persona": {"region": "Cairo", "sex": "female", "age": 28, "country": "Egypt", "marital_status": "married", "education": "higher", "social_class": "upper middle class"}, "question": {"id": "Q224", "variant": 0}, "response": ["Based on my emic perspective as a married female from Cairo, Egypt, I am aware that there are in-group ways of understanding and answering this question. The cultural context of Egypt, including its political history and the current socio-economic background, plays a pivotal role in the understanding and answering of this question. As a member of the upper middle class and having completed higher education, I am also aware of the individual values and personal experiences that shape my perception of the fairness of elections. Additionally, the concept of cultural relativism reminds me that my answer may differ from those of other cultural backgrounds. Considering all these factors, I would choose option (3) Not often, as in my experience and understanding, there have been instances of unfairness in the counting of votes in the country's elections.\n\n3"]}, {"persona": {"region": "Cairo", "sex": "female", "age": 22, "country": "Egypt", "marital_status": "single", "education": "higher", "social_class": "lower middle class"}, "question": {"id": "Q224", "variant": 0}, "response": ["Based on the anthropological framework, my emic perspective as a single female from Cairo, Egypt, who is 22 years old and part of the lower middle class, is heavily influenced by my cultural context and socioeconomic background. In Egypt, there is a long history of political and social inequality, and the lower middle class often feels marginalized in the political process. Additionally, the cultural relativism in Egypt means that there is a general skepticism towards the fairness of elections. My personal experience and the experiences of those around me have shown that votes are not often counted fairly in the country's elections. Therefore, I believe that the most accurate answer from my perspective would be option (3) Not often.\n\n3"]}, {"persona": {"region": "Cairo", "sex": "female", "age": 39, "country": "Egypt", "marital_status": "married", "education": "middle", "social_class": "lower middle class"}, "question": {"id": "Q224", "variant": 0}, "response": ["In considering the question of how often votes are counted fairly in the country's elections from the perspective of a married female from Cairo, Egypt, it is important to take into account the cultural context, socioeconomic background, and individual values. In Egypt, there is a history of political instability and concerns about the fairness of elections. As a member of the lower middle class, access to resources and influence in the political process may be limited. Additionally, the cultural relativism perspective reminds us that different cultures have different systems of governance and power dynamics, which may affect the fairness of elections. Therefore, the perception of how often votes are counted fairly may be influenced by personal experiences and values, as well as the broader socioeconomic and cultural context. \n\n3"]}, {"persona": {"region": "Cairo", "sex": "male", "age": 19, "country": "Egypt", "marital_status": "single", "education": "middle", "social_class": "working class"}, "question": {"id": "Q224", "variant": 0}, "response": ["Based on the emic and etic perspectives, as a single male from Cairo, Egypt, I have a unique understanding of the fairness of elections within my country. The cultural context of Egypt, with its history of political unrest and power struggles, has a significant impact on the perceived fairness of election processes. Additionally, my individual values and personal experiences, shaped by my socioeconomic background as a working-class citizen, influence my perception of the electoral system. As a 19-year-old with limited formal education, I may have a more cynical view of the political system and believe that votes are not often counted fairly in the country's elections due to potential corruption and manipulation. While space and time also play a role, it is the nuanced phrasing of the question that leads me to select option 3: Not often. \n\n3"]}, {"persona": {"region": "Cairo", "sex": "female", "age": 54, "country": "Egypt", "marital_status": "married", "education": "middle", "social_class": "working class"}, "question": {"id": "Q224", "variant": 0}, "response": ["Based on the anthropological framework, my perspective as a married female from Cairo, Egypt, with a middle education level and working-class background, is heavily influenced by my cultural context, individual values, and socioeconomic background. In Egypt, there is a complex political and social landscape, and fair voting practices can be influenced by various factors such as socioeconomic status and access to resources. Additionally, the cultural relativism perspective reminds us that what may be considered fair in one culture may not be seen the same way in another. Thus, considering my background and experiences, I would say that votes are not often counted fairly in the country's elections.\n\n3"]}, {"persona": {"region": "Cairo", "sex": "male", "age": 30, "country": "Egypt", "marital_status": "married", "education": "higher", "social_class": "working class"}, "question": {"id": "Q224", "variant": 0}, "response": ["Based on the anthropological framework, my emic perspective as a married working-class male from Cairo, Egypt, is influenced by my cultural context, individual values, and personal experiences. In Egypt, there is a long history of issues with fair elections and political representation, which has shaped my perception. Additionally, my socioeconomic background as a working-class individual also influences my understanding of the political process. Taking into account cultural relativism, I understand that my perspective may differ from others in different socioeconomic and cultural contexts. Therefore, based on my personal experience and understanding, I would have to say that votes are not often counted fairly in the country's elections.\n3"]}, {"persona": {"region": "Cairo", "sex": "male", "age": 39, "country": "Egypt", "marital_status": "married", "education": "higher", "social_class": "lower middle class"}, "question": {"id": "Q224", "variant": 0}, "response": ["Based on the anthropological framework, as a married male from Cairo, Egypt, my emic perspective is influenced by my cultural context, individual values, and socioeconomic background. In Egypt, there is a history of political corruption and a lack of transparency in elections. This cultural context, combined with my lower middle-class status, leads me to believe that votes are not often counted fairly in the country's elections. Additionally, my personal experience and understanding of the political system in Egypt further reinforce this belief. Therefore, my answer to the question is:\n3"]}, {"persona": {"region": "Cairo", "sex": "female", "age": 41, "country": "Egypt", "marital_status": "married", "education": "middle", "social_class": "lower middle class"}, "question": {"id": "Q224", "variant": 0}, "response": ["Based on the anthropological framework, as a married female from Cairo, Egypt, who is 41 years old and part of the lower middle class, my perspective on the fairness of vote counting in the country's elections is influenced by my cultural context, individual values, and socioeconomic background. In Egypt, there have been historical issues with electoral fairness, and this perception is shaped by the experiences of people in my community. Additionally, my socioeconomic background may lead me to believe that the lower middle class is often marginalized in political processes. Therefore, I would choose option 3: Not often."]}, {"persona": {"region": "Cairo", "sex": "male", "age": 45, "country": "Syria", "marital_status": "single", "education": "higher", "social_class": "upper middle class"}, "question": {"id": "Q224", "variant": 0}, "response": ["Based on my emic perspective as a single male from Cairo, Syria, I have observed that the cultural context and socioeconomic background play a significant role in the fairness of election votes. In my experience, the individuals in my social circle who also come from the upper middle class, like myself, tend to have their votes counted fairly more often than those from lower socioeconomic backgrounds. Additionally, my personal values and education level lead me to believe that the electoral process in my country is generally fair. Therefore, I would say that votes are counted fairly often in the country's elections.\n\n2"]}, {"persona": {"region": "Cairo", "sex": "male", "age": 54, "country": "Egypt", "marital_status": "married", "education": "higher", "social_class": "lower middle class"}, "question": {"id": "Q224", "variant": 0}, "response": ["From the perspective of a married male from Cairo, Egypt, who is 54 years old, completed higher education, and considers himself part of the lower middle class, the answer to the question of how often votes are counted fairly in the country's elections would be influenced by a combination of cultural context, individual values, and socioeconomic background. In Egypt, there is a complex political and cultural context, where the fairness of elections can be perceived differently by different groups. As a member of the lower middle class, there may be a level of skepticism regarding the fairness of election processes, given the socioeconomic disparities and power dynamics at play. Additionally, personal experiences and values may lead to a nuanced understanding that votes may not be counted fairly as often as they should be, particularly from the perspective of someone who has experienced or witnessed instances of electoral manipulation. Therefore, the chosen answer is:\n3"]}, {"persona": {"region": "Cairo", "sex": "male", "age": 65, "country": "Egypt", "marital_status": "married", "education": "middle", "social_class": "upper middle class"}, "question": {"id": "Q224", "variant": 0}, "response": ["Based on the anthropological framework, my perspective as a married male from Cairo, Egypt, at the age of 65 and belonging to the upper middle class, is influenced by a combination of emic and etic perspectives, cultural context, individual values and personal experience, socioeconomic background, cultural relativism, space and time, and nuance. In Egypt, the political system and electoral process are heavily influenced by the cultural and socioeconomic context, as well as the historical and political factors that have shaped the country. My personal experience and values, along with my position in the upper middle class, lead me to believe that while there have been improvements in recent years, the counting of votes in the country's elections is not always fair due to historical and institutional factors. This understanding is also influenced by the nuanced phrasing of the question, as it allows for a more complex and contextualized response. Therefore, my answer is:\n\n3) Not often"]}, {"persona": {"region": "Cairo", "sex": "female", "age": 52, "country": "Egypt", "marital_status": "married", "education": "middle", "social_class": "upper middle class"}, "question": {"id": "Q224", "variant": 0}, "response": ["Based on the anthropological framework, as a married female from Cairo, Egypt, I would consider the cultural context and socio-economic background as important factors in answering this question. In Egypt, there may be a strong emphasis on family and kinship networks, and the upper middle class may have different access to political information and resources compared to other social classes. Additionally, personal experience and individual values play a role in shaping my perception of the fairness of election vote counting. Considering these factors, I would choose:\n\n(3) Not often"]}, {"persona": {"region": "Cairo", "sex": "male", "age": 26, "country": "Egypt", "marital_status": "single", "education": "higher", "social_class": "lower middle class"}, "question": {"id": "Q224", "variant": 0}, "response": ["Based on the anthropological framework, my perspective is heavily influenced by my cultural context, socioeconomic background, and personal experiences. As a single male from Cairo, Egypt, I am aware of the political and social dynamics in my country. The cultural context of Egypt, with its history of political unrest and corruption, has influenced my perception of the fairness of elections. Additionally, being part of the lower middle class, I have personally witnessed and experienced the effects of socioeconomic disparities and political manipulation. Therefore, my answer to the question of how often votes are counted fairly in the country's elections is:\n\n3) Not often"]}, {"persona": {"region": "Cairo", "sex": "male", "age": 32, "country": "Egypt", "marital_status": "married", "education": "middle", "social_class": "working class"}, "question": {"id": "Q224", "variant": 0}, "response": ["Based on the anthropological framework, as a married male from Cairo, Egypt, my emic perspective is influenced by my cultural context, individual values, and socioeconomic background. In Egypt, there is a long-held belief that the electoral process is not always fair, and this belief is reinforced by my working-class status and limited educational opportunities. Additionally, my personal experiences and the experiences of those around me have shaped my perception of the electoral process. Therefore, I believe that votes are not often counted fairly in the country's elections.\n\n3"]}, {"persona": {"region": "Cairo", "sex": "male", "age": 38, "country": "Egypt", "marital_status": "married", "education": "middle", "social_class": "lower middle class"}, "question": {"id": "Q224", "variant": 0}, "response": ["Based on the anthropological framework, my perspective on the fairness of vote counting in Egypt's elections is influenced by my individual values and personal experience. Being from the lower middle class in Cairo, I have personally witnessed instances where votes were not counted fairly in elections. Additionally, the cultural context of Egypt, including its political history and socioeconomic background, has shaped my understanding of the electoral process. Therefore, I believe that votes are not often counted fairly in the country's elections.\n\n3"]}, {"persona": {"region": "Cairo", "sex": "male", "age": 58, "country": "Egypt", "marital_status": "married", "education": "higher", "social_class": "upper middle class"}, "question": {"id": "Q224", "variant": 0}, "response": ["Based on my emic perspective as a married male from Cairo, Egypt, I have witnessed that votes are fairly counted in the country's elections. This is also supported by my etic perspective as a member of the upper middle class, where I have seen a fair and transparent electoral process. Additionally, my cultural context as an educated individual from Cairo has allowed me to understand the voting system and its fairness. My individual values and personal experiences have also shown me that the electoral process is conducted fairly. Furthermore, my socioeconomic background as part of the upper middle class has provided me with the opportunity to be involved in political processes and witness the fairness of vote counting. Lastly, my understanding of cultural relativism has allowed me to appreciate the fairness of the electoral process in Egypt. Therefore, based on these factors, I believe that votes are counted fairly in the country's elections.\n\n2"]}, {"persona": {"region": "Cairo", "sex": "male", "age": 49, "country": "Egypt", "marital_status": "married", "education": "middle", "social_class": "lower middle class"}, "question": {"id": "Q224", "variant": 0}, "response": ["Based on the anthropological framework, as a married male from Cairo, Egypt, my emic perspective would be shaped by my personal experience and cultural context. In Egypt, there have been reports and allegations of electoral fraud and manipulation in past elections, leading to a lack of trust in the fairness of the voting process. Additionally, my lower middle class socioeconomic background and middle education level may contribute to a sense of disenfranchisement and skepticism towards the electoral system. Therefore, I believe that votes are not often counted fairly in the country's elections.\n\n3"]}, {"persona": {"region": "Cairo", "sex": "female", "age": 29, "country": "Egypt", "marital_status": "married", "education": "middle", "social_class": "working class"}, "question": {"id": "Q224", "variant": 0}, "response": ["In considering the question of how often votes are counted fairly in the country's elections from the perspective of a married female from Cairo, Egypt, factors such as cultural context, individual values and personal experience, and socioeconomic background all come into play. Egypt has a complex political landscape with a history of authoritarian rule, which significantly impacts the fairness of elections. As a working-class woman with a middle education level, I have likely witnessed or experienced firsthand the challenges and limitations of political participation and fair representation in the electoral process. Additionally, cultural relativism reminds us that perceptions of fairness may vary across different socio-economic groups, and nuanced phrasing of the question is important. Therefore, my answer to the question is (3) Not often."]}, {"persona": {"region": "Cairo", "sex": "female", "age": 36, "country": "Egypt", "marital_status": "married", "education": "higher", "social_class": "lower middle class"}, "question": {"id": "Q224", "variant": 0}, "response": ["Based on the anthropological framework, my answer to the question of how often votes are counted fairly in the country's elections is influenced by my emic perspective as a married female from Cairo, Egypt. The cultural context and socioeconomic background play a significant role in shaping my response. Being part of the lower middle class and having completed higher education, I am aware of the challenges and disparities in the electoral process. Additionally, my personal experience and individual values lead me to believe that votes are not often counted fairly in the country's elections. The nuance of the question also factors into my response, as the phrasing implies a level of frequency, and considering the space and time in which I live, I am convinced that my answer accurately reflects the perspective of the persona described above.\n\n3"]}, {"persona": {"region": "Cairo", "sex": "female", "age": 34, "country": "Egypt", "marital_status": "married", "education": "middle", "social_class": "lower middle class"}, "question": {"id": "Q224", "variant": 0}, "response": ["Considering my cultural context in Cairo, Egypt, as a married woman of lower-middle-class standing and having completed only middle education level, my understanding of the fairness of the election process is influenced by my socioeconomic background, individual values, and personal experience. I am aware of the political and social dynamics in my country and recognize that there are often challenges and discrepancies in the electoral process. Additionally, my perspective is shaped by the cultural relativism framework, where I understand that the concept of fairness in elections may be perceived differently in my context compared to other societies. Therefore, based on my nuanced understanding and personal experience, I would say that votes are not often counted fairly in the country's elections.\n\n3"]}, {"persona": {"region": "Fayoum", "sex": "male", "age": 57, "country": "Egypt", "marital_status": "married", "education": "middle", "social_class": "working class"}, "question": {"id": "Q224", "variant": 0}, "response": ["Based on the anthropological framework, I, as a married male from Fayoum, Egypt, who is 57 years old, completed middle education level and consider myself part of the working class, would answer the question based on my cultural context, individual values, and socioeconomic background. In Egypt, there have been instances of election irregularities and unfair practices, which have affected my personal experiences and perception of the electoral process. Additionally, my working-class background and limited access to resources may also influence my belief that votes are not often counted fairly in the country's elections.\n\n3"]}, {"persona": {"region": "Fayoum", "sex": "male", "age": 60, "country": "Egypt", "marital_status": "married", "education": "middle", "social_class": "lower middle class"}, "question": {"id": "Q224", "variant": 0}, "response": ["Based on my emic perspective as a married male from Fayoum, Egypt, I have witnessed and experienced firsthand the cultural context and socioeconomic background that significantly impact the fairness of election vote counting. As a member of the lower middle class, I have seen how our socioeconomic status can influence the fairness of elections. Additionally, my personal experience and individual values have led me to believe that votes are not often counted fairly in the country's elections. Cultural relativism also plays a role in my understanding, as I recognize that the nuances of space and time in Egypt contribute to the lack of fairness in vote counting. Therefore, my answer is:\n\n3) Not often"]}, {"persona": {"region": "Fayoum", "sex": "male", "age": 21, "country": "Egypt", "marital_status": "single", "education": "middle", "social_class": "lower middle class"}, "question": {"id": "Q224", "variant": 0}, "response": ["In my cultural context, as a young man from Fayoum, Egypt, I have witnessed and experienced firsthand the effects of socioeconomic background on the fairness of election processes. My lower middle class status has made me aware of the disparities in access to resources and influence, which often result in votes not being counted fairly. Additionally, my age and education level have allowed me to understand the nuances of power dynamics and the impact they have on the electoral process. Taking into account the emic and etic perspectives, cultural relativism, and individual values, it is clear that votes are not often counted fairly in the country's elections.\n\n3"]}, {"persona": {"region": "Fayoum", "sex": "male", "age": 33, "country": "Egypt", "marital_status": "single", "education": "higher", "social_class": "working class"}, "question": {"id": "Q224", "variant": 0}, "response": ["Based on the anthropological framework, as a single male from Fayoum, Egypt, my perspective is heavily influenced by my cultural context, socioeconomic background, and individual values. In Egypt, there is a long history of political unrest and allegations of election fraud. As a member of the working class, I am aware of the power dynamics at play in our country's political system and the challenges faced by ordinary citizens. Additionally, my higher education level has provided me with critical thinking skills and an understanding of the importance of fair democratic processes. Therefore, I believe that votes are not often counted fairly in the country's elections.\n\n3"]}, {"persona": {"region": "Fayoum", "sex": "male", "age": 32, "country": "Egypt", "marital_status": "married", "education": "higher", "social_class": "lower middle class"}, "question": {"id": "Q224", "variant": 0}, "response": ["Based on the anthropological framework, as a married male from Fayoum, Egypt, I am influenced by my cultural context, socioeconomic background, and personal experiences. In Egypt, there is a history of political corruption and voter suppression, particularly for those in the lower middle class. My individual values and personal experience lead me to believe that votes are not often counted fairly in the country's elections. Additionally, considering the cultural relativism perspective, I understand that there may be different perceptions of fairness in elections, but from my lived experience, I have seen evidence of unfair practices. Therefore, I choose option (3) Not often.\n\n3"]}, {"persona": {"region": "Gharbia", "sex": "male", "age": 42, "country": "Egypt", "marital_status": "married", "education": "higher", "social_class": "upper middle class"}, "question": {"id": "Q224", "variant": 0}, "response": ["From the perspective of a married male from Gharbia, Egypt, who is 42 years old, highly educated, and considers himself part of the upper middle class, the answer to the question of how often votes are counted fairly in the country's elections would be \"Fairly often\" (2). This perspective takes into account the cultural context of Egypt, where the individual's socioeconomic background and education level would likely lead to a more optimistic view of the fairness of elections. Additionally, the nuanced phrasing of the question allows for the recognition that while there may be some irregularities, overall there is a perception of fairness in the electoral process."]}, {"persona": {"region": "Gharbia", "sex": "male", "age": 52, "country": "Egypt", "marital_status": "married", "education": "middle", "social_class": "working class"}, "question": {"id": "Q224", "variant": 0}, "response": ["Based on the anthropological framework, my emic perspective as a married male from Gharbia, Egypt, is influenced by my cultural context, individual values, and socioeconomic background. In Egypt, the cultural context of elections is influenced by historical and societal factors, and my personal experience and values are shaped by this context. As someone from the working class, I am aware of the socioeconomic disparities in the country and how they can impact the fairness of elections. Additionally, my age and education level have influenced my understanding of the political system. Considering these factors, I believe that votes are not often counted fairly in the country's elections.\n\n3"]}, {"persona": {"region": "Gharbia", "sex": "male", "age": 45, "country": "Egypt", "marital_status": "divorced", "education": "higher", "social_class": "upper middle class"}, "question": {"id": "Q224", "variant": 0}, "response": ["Based on the anthropological framework, as a divorced male from Gharbia, Egypt, who is 45 years old, completed higher education, and considers myself part of the upper middle class, my perspective on the fairness of election vote counting is influenced by my cultural context, individual values, and socioeconomic background. In Gharbia, there are traditional gender roles and societal expectations that may influence my perspective on the fairness of election vote counting. My higher education level and socioeconomic status may lead me to have a more optimistic view of the fairness of vote counting, as I may have more trust in the systems in place. Additionally, my personal experience and values may lead me to believe that vote counting is fairly often conducted in a fair manner.\n\n2"]}, {"persona": {"region": "Behaira", "sex": "male", "age": 23, "country": "Egypt", "marital_status": "single", "education": "middle", "social_class": "lower class"}, "question": {"id": "Q224", "variant": 0}, "response": ["Based on the anthropological framework, my perspective from Behaira, Egypt, as a 23-year-old male from the lower class with middle education level, is heavily influenced by my cultural context, individual values, and socioeconomic background. In Egypt, there is a history of political corruption and manipulation of elections, which is widely known and experienced by people in my socioeconomic class. This has shaped my understanding of the fairness of election processes, and I am inclined to believe that votes are not often counted fairly in the country's elections. This belief is rooted in my personal experiences and the experiences of those around me, as well as the cultural context in which I live. \n\n3"]}, {"persona": {"region": "Behaira", "sex": "male", "age": 38, "country": "Egypt", "marital_status": "single", "education": "higher", "social_class": "lower class"}, "question": {"id": "Q224", "variant": 0}, "response": ["Based on my personal experience and socioeconomic background as a lower-class individual from Behaira, Egypt, I have witnessed that votes are not often counted fairly in the country's elections. The socioeconomic background and cultural context in Egypt play a significant role in influencing the fairness of elections. Additionally, the emic and etic perspectives of the lower class in Egypt have provided me with the understanding that the voting process is often influenced by external factors and not conducted fairly. Therefore, I believe that the answer to the question is option 3: Not often."]}, {"persona": {"region": "Behaira", "sex": "male", "age": 32, "country": "Egypt", "marital_status": "married", "education": "middle", "social_class": "lower class"}, "question": {"id": "Q224", "variant": 0}, "response": ["Based on the anthropological framework, my perspective as a married male from Behaira, Egypt, is influenced by my cultural context, socioeconomic background, and individual values. As someone from the lower class in Egypt, my experiences and personal values shape my understanding of the fairness of election votes. The cultural context of living in a country with a history of political unrest and socioeconomic disparities also informs my perspective. Additionally, considering the nuance of the question, I would argue that votes are not often counted fairly in the country's elections.\n\n3"]}, {"persona": {"region": "Behaira", "sex": "female", "age": 37, "country": "Egypt", "marital_status": "married", "education": "middle", "social_class": "working class"}, "question": {"id": "Q224", "variant": 0}, "response": ["Based on my cultural context as a married female from Behaira, Egypt, my understanding of the fairness of election vote counting is influenced by my socioeconomic background and personal experience. Living in a working-class community, I have witnessed and experienced firsthand the challenges and injustices faced by individuals like myself. Additionally, my middle education level has provided me with some understanding of civic processes, including elections. Taking into account the emic and etic perspectives, as well as the cultural relativism framework, I believe that votes are not often counted fairly in the country's elections due to the systemic barriers and inequalities that exist within our society.\n\n3"]}, {"persona": {"region": "Behaira", "sex": "male", "age": 48, "country": "Egypt", "marital_status": "married", "education": "middle", "social_class": "working class"}, "question": {"id": "Q224", "variant": 0}, "response": ["Based on the anthropological framework, my perspective as a married male from Behaira, Egypt, at 48 years of age and with a middle education level, is heavily influenced by my cultural context, socioeconomic background, and personal experience. In Egypt, there is a long history of political corruption and manipulation of election results. As a member of the working class, I have personally witnessed and experienced the impact of unfair electoral practices, which has led to a deep distrust in the fairness of elections. Additionally, the cultural relativism perspective teaches me that my subjective understanding of the electoral process is shaped by my specific cultural and socioeconomic context. Therefore, based on my personal experience and cultural context, I firmly believe that votes are not counted fairly in the country's elections.\n\n3"]}, {"persona": {"region": "Behaira", "sex": "female", "age": 34, "country": "Egypt", "marital_status": "married", "education": "middle", "social_class": "lower class"}, "question": {"id": "Q224", "variant": 0}, "response": ["Based on my cultural context and socioeconomic background, as a married female from Behaira, Egypt, I have experienced and witnessed that votes are not often counted fairly in the country's elections. This is a common understanding among people in my community, as we have seen instances where the election process has been manipulated and influenced by those in power. Additionally, my personal experience and values lead me to believe that the lower class individuals like myself often have less agency and influence in the political process, further contributing to the perception that votes are not often counted fairly. Therefore, I choose option (3) Not often."]}, {"persona": {"region": "Behaira", "sex": "female", "age": 30, "country": "Egypt", "marital_status": "divorced", "education": "lower", "social_class": "lower class"}, "question": {"id": "Q224", "variant": 0}, "response": ["Based on my emic perspective as a divorced lower-class woman from Behaira, Egypt, I have personally experienced and witnessed unfair treatment and discrimination in various aspects of life, including access to resources and opportunities. The cultural context and socioeconomic background of my community also play a significant role in shaping my perception of fairness and equality. Additionally, my personal experience and individual values have led me to believe that votes are not often counted fairly in the country's elections, as those in positions of power often manipulate the system to maintain control. Therefore, based on my nuanced understanding of the situation, I would choose option 3: Not often.\n\n3"]}, {"persona": {"region": "Behaira", "sex": "male", "age": 40, "country": "Egypt", "marital_status": "married", "education": "higher", "social_class": "lower middle class"}, "question": {"id": "Q224", "variant": 0}, "response": ["From the perspective of a married male from Behaira, Egypt, who is 40 years old and part of the lower middle class, several factors would influence my answer to the question of how often votes are counted fairly in the country's elections. Firstly, the cultural context and socioeconomic background play a significant role in shaping my perceptions. Egypt has a complex political history and the lower middle class often feels marginalized in the political system. Additionally, my individual values and personal experiences have led me to be skeptical about the fairness of elections. Furthermore, the cultural relativism perspective reminds me that there may be different interpretations of what constitutes fair counting of votes. Based on these considerations, I would choose option (3) Not often. \n\n3"]}, {"persona": {"region": "Behaira", "sex": "male", "age": 38, "country": "Egypt", "marital_status": "married", "education": "middle", "social_class": "working class"}, "question": {"id": "Q224", "variant": 0}, "response": ["Based on the anthropological framework, as a married male from Behaira, Egypt, I would approach the question of how often votes are counted fairly in the country's elections with a nuanced understanding of the cultural context and socioeconomic background. In Egypt, there is a deep history of political unrest and corruption, which would influence my perception of the fairness of elections. Additionally, as a member of the working class with a middle education level, my access to information and resources may be limited, impacting my understanding of the electoral process. Considering the emic and etic perspectives, I would be influenced by the in-group beliefs and experiences of those around me, as well as the broader societal context. Therefore, my answer would be that votes are not often counted fairly in the country's elections. \n\n3"]}, {"persona": {"region": "Behaira", "sex": "female", "age": 30, "country": "Egypt", "marital_status": "married", "education": "higher", "social_class": "lower class"}, "question": {"id": "Q224", "variant": 0}, "response": ["Based on my personal experience and socioeconomic background, I have observed that votes are not often counted fairly in the country's elections. As a lower-class woman who has completed higher education, I have seen how political power and influence often dictate the fairness of electoral processes. Additionally, the cultural context and space and time factors in Egypt play a significant role in shaping my understanding of the political system. Therefore, I believe that votes are not often counted fairly in the country's elections.\n\n3"]}, {"persona": {"region": "Behaira", "sex": "female", "age": 35, "country": "Egypt", "marital_status": "married", "education": "middle", "social_class": "working class"}, "question": {"id": "Q224", "variant": 0}, "response": ["Based on the anthropological framework, my response to the question of how often votes are counted fairly in the country's elections is influenced by my cultural context, individual values, and socioeconomic background. As a married female from Behaira, Egypt, who has completed middle education and considers herself part of the working class, I am aware of the cultural and socioeconomic factors that impact the fairness of elections. The emic perspective within my community may lead me to believe that votes are not often counted fairly due to the influence of those in power. Additionally, my personal experience and values may lead me to be skeptical of the fairness of election processes. Therefore, my answer to the question is (3) Not often."]}, {"persona": {"region": "Behaira", "sex": "male", "age": 52, "country": "Egypt", "marital_status": "married", "education": "middle", "social_class": "lower class"}, "question": {"id": "Q224", "variant": 0}, "response": ["Based on the anthropological framework, as a married male from Behaira, Egypt, with a middle education level and lower socioeconomic background, my perspective on the fairness of vote counting in the country's elections is shaped by my cultural context, individual values, and personal experience. The cultural context in Egypt, including its political history and socioeconomic disparities, plays a significant role in shaping my perception of the electoral process. Additionally, my personal experience and socioeconomic background contribute to my belief that votes are not often counted fairly in the country's elections, as corruption and inequality have been prevalent in my community and country. Therefore, my response to the question would be:\n3"]}, {"persona": {"region": "Alexandria", "sex": "female", "age": 41, "country": "Egypt", "marital_status": "single", "education": "middle", "social_class": "lower class"}, "question": {"id": "Q224", "variant": 0}, "response": ["Based on my personal experience and socioeconomic background as a lower-class woman from Alexandria, Egypt, I have witnessed and heard of instances where votes are not counted fairly in the country's elections. The cultural context and emic perspective of my community also suggest that there is skepticism about the fairness of the electoral process. Additionally, the socioeconomic background and cultural relativism of my community have led to a general distrust in the political system. Therefore, based on these factors, I believe that votes are not often counted fairly in the country's elections.\n\n3"]}, {"persona": {"region": "Alexandria", "sex": "female", "age": 21, "country": "Egypt", "marital_status": "single", "education": "middle", "social_class": "lower class"}, "question": {"id": "Q224", "variant": 0}, "response": ["Based on the anthropological framework, my emic perspective as a lower-class single female from Alexandria, Egypt, has been shaped by my cultural context, individual values and personal experience, and socioeconomic background. In Egypt, there is a history of political corruption and manipulation, which has been widely reported in the media and discussed in my community. Additionally, as a member of the lower class, I have personally experienced the impact of unfair practices in elections, where my voice and the voices of others in similar socioeconomic positions are often marginalized. Therefore, I believe that votes are not often counted fairly in the country's elections.\n\n3"]}, {"persona": {"region": "Alexandria", "sex": "female", "age": 35, "country": "Egypt", "marital_status": "married", "education": "middle", "social_class": "lower class"}, "question": {"id": "Q224", "variant": 0}, "response": ["Based on the anthropological framework, as a married female from Alexandria, Egypt, my emic perspective would be influenced by my personal experience and socioeconomic background. Living in the lower class and having completed only middle education, I have likely experienced limited access to resources and opportunities. This would lead me to believe that votes are not often counted fairly in the country's elections, as those in power may not prioritize the voices of individuals from my socioeconomic background. Additionally, the cultural context and nuance of the question would lead me to believe that the system is not designed to benefit people like me. Therefore, my answer would be:\n\n3. Not often"]}, {"persona": {"region": "Alexandria", "sex": "male", "age": 34, "country": "Egypt", "marital_status": "married", "education": "higher", "social_class": "working class"}, "question": {"id": "Q224", "variant": 0}, "response": ["Based on my emic perspective as a married male from Alexandria, Egypt, I am keenly aware of the cultural and socioeconomic background that influences the fairness of election vote counting. The cultural context in Egypt is deeply rooted in a complex history of political turmoil and power struggles. As a member of the working class, I have witnessed firsthand the discrepancies in socioeconomic background and the influence it has on the political system. Additionally, my higher education has provided me with a nuanced understanding of the political landscape in Egypt. Therefore, I can confidently say that votes are not often counted fairly in the country's elections.\n\n3"]}, {"persona": {"region": "Alexandria", "sex": "female", "age": 37, "country": "Egypt", "marital_status": "married", "education": "higher", "social_class": "lower middle class"}, "question": {"id": "Q224", "variant": 0}, "response": ["Based on the anthropological framework, my emic perspective as a married female from Alexandria, Egypt, with a lower middle class socioeconomic background, is influenced by my cultural context, individual values, and personal experiences. I have witnessed and experienced firsthand the challenges and inequalities in our country's electoral process. The cultural relativism of our society also plays a role in my understanding, as I recognize that there are systemic issues that contribute to the unfair counting of votes. Additionally, my age and place in society have provided me with nuanced insights into the electoral process. Therefore, I choose option 3: Not often."]}, {"persona": {"region": "Alexandria", "sex": "female", "age": 56, "country": "Egypt", "marital_status": "divorced", "education": "middle", "social_class": "working class"}, "question": {"id": "Q224", "variant": 0}, "response": ["Based on the anthropological framework, as a divorced female from Alexandria, Egypt, with a working-class background and a middle level of education, my perspective on the fairness of vote counting in the country's elections is influenced by my cultural context, individual values, and personal experience. As a member of the working class, I am likely to have experienced or witnessed socio-economic disparities that may affect my trust in the fairness of the electoral process. Additionally, my age and place of residence in Alexandria, Egypt, may have exposed me to specific instances of unfair vote counting in the past. Therefore, considering these factors, I would choose option (3) Not often, as I believe that fair vote counting is not a common occurrence in the country's elections based on my personal experiences and cultural context. \n\n3"]}, {"persona": {"region": "Alexandria", "sex": "male", "age": 48, "country": "Egypt", "marital_status": "married", "education": "higher", "social_class": "working class"}, "question": {"id": "Q224", "variant": 0}, "response": ["Based on my cultural context and socioeconomic background as a married male from Alexandria, Egypt, who is 48 years old and considers himself part of the working class, my understanding of the fairness of election vote counting is influenced by my personal experience and individual values. In Egypt, there have been instances of electoral irregularities and concerns about the fairness of the voting process. Additionally, my cultural relativism perspective reminds me that other cultures may have different experiences with their electoral processes. Therefore, I believe that votes are not counted fairly in the country's elections.\n\n3"]}, {"persona": {"region": "Alexandria", "sex": "female", "age": 30, "country": "Egypt", "marital_status": "married", "education": "middle", "social_class": "working class"}, "question": {"id": "Q224", "variant": 0}, "response": ["Based on my emic perspective as a married female from Alexandria, Egypt, I understand that there are different in-group and out-group ways of thinking about the fairness of election votes. The cultural context in Egypt, including the political environment and history, influences my perception of the electoral process. My individual values and personal experience, as well as my socioeconomic background as a working-class woman, also shape my understanding of this issue. Considering the cultural relativism and the nuanced phrasing of the question, I believe that votes are not often counted fairly in the country's elections due to various factors such as corruption, power dynamics, and lack of transparency. This perspective is based on my lived experience and the socio-political context in Egypt.\n\n3"]}, {"persona": {"region": "Alexandria", "sex": "male", "age": 19, "country": "Egypt", "marital_status": "single", "education": "middle", "social_class": "lower class"}, "question": {"id": "Q224", "variant": 0}, "response": ["Based on the anthropological framework, my emic perspective as a lower-class, 19-year-old male from Alexandria, Egypt, is heavily influenced by my cultural context, individual values, and socioeconomic background. Living in a lower-class neighborhood in Egypt, I have personally witnessed and experienced the impact of unfair voting practices. The cultural context of Egypt's political history and socioeconomic disparities has shaped my perception of the fairness of election voting. Additionally, my personal experience and values lead me to believe that votes are not often counted fairly in the country's elections. This belief is further reinforced by the nuance of the question, as it implies a level of skepticism about the fairness of the electoral process.\n3"]}, {"persona": {"region": "Alexandria", "sex": "male", "age": 45, "country": "Egypt", "marital_status": "married", "education": "middle", "social_class": "lower middle class"}, "question": {"id": "Q224", "variant": 0}, "response": ["Based on the anthropological framework, my emic perspective as a married male from Alexandria, Egypt, would be influenced by my cultural context, individual values, and socioeconomic background. In Egypt, there is a strong emphasis on family and community, and my personal experience has taught me that there are often discrepancies in the electoral process, particularly in lower-income areas. Additionally, the cultural relativism in Egypt means that there is a general mistrust of government institutions, and this skepticism would influence my perception of the fairness of election vote counting. Given my lower middle class status and the socioeconomic background of many in my community, I would have to say that votes are not often counted fairly in the country's elections.\n\n3"]}, {"persona": {"region": "Alexandria", "sex": "male", "age": 23, "country": "Egypt", "marital_status": "single", "education": "higher", "social_class": "lower class"}, "question": {"id": "Q224", "variant": 0}, "response": ["From an emic perspective, as a lower class individual from Alexandria, Egypt, my understanding of the fairness of election votes is influenced by my cultural context, individual values, and socioeconomic background. In Egypt, there have been instances of election irregularities and manipulation, which have affected my personal experience and perception of the electoral process. Additionally, my socioeconomic background as a member of the lower class may make me more aware of instances of unfairness in the electoral system. Therefore, I believe that votes are not often counted fairly in the country's elections.\n\n3"]}, {"persona": {"region": "Alexandria", "sex": "female", "age": 28, "country": "Egypt", "marital_status": "married", "education": "middle", "social_class": "working class"}, "question": {"id": "Q224", "variant": 0}, "response": ["Based on the anthropological framework, as a married female from Alexandria, Egypt, I am influenced by my cultural context, socioeconomic background, and personal experiences. In Egypt, there are cultural and societal norms that may impact the fairness of elections, and as a working-class individual with a middle education level, I may have limited access to resources and information that could affect my perception of the fairness of vote counting. Additionally, my age and location in Alexandria may also influence my perspective. Taking into account the nuanced phrasing of the question, I would choose option (3) Not often, as my personal experiences and the cultural context in Egypt lead me to believe that vote counting in the country's elections is not often fair. \n\n3"]}, {"persona": {"region": "Alexandria", "sex": "male", "age": 34, "country": "Egypt", "marital_status": "single", "education": "higher", "social_class": "working class"}, "question": {"id": "Q224", "variant": 0}, "response": ["Based on the anthropological framework, as a single male from Alexandria, Egypt, I come from a specific cultural context with my own individual values and personal experiences. My socioeconomic background as part of the working class also influences my perception of the fairness of electoral processes. Additionally, the cultural relativism perspective reminds me that my viewpoint is not the only valid one. Taking into account the nuance of the question, I believe that votes are not often counted fairly in the country's elections.\n3"]}, {"persona": {"region": "Alexandria", "sex": "male", "age": 30, "country": "Egypt", "marital_status": "married", "education": "higher", "social_class": "lower middle class"}, "question": {"id": "Q224", "variant": 0}, "response": ["Based on my emic perspective as a married male from Alexandria, Egypt, I have witnessed and experienced firsthand the socioeconomic and cultural context in which elections take place. The cultural relativism in Egypt means that there are different expectations and understandings of what constitutes fair and just elections. As a member of the lower middle class, I have seen how the socioeconomic background of individuals can impact the fairness of the electoral process. Additionally, my personal experience and values have shaped my understanding of the frequency of fair elections in the country. Therefore, I believe that votes are counted fairly fairly often.\n\n2"]}, {"persona": {"region": "Alexandria", "sex": "female", "age": 49, "country": "Egypt", "marital_status": "married", "education": "higher", "social_class": "lower middle class"}, "question": {"id": "Q224", "variant": 0}, "response": ["Based on my emic perspective as a married woman from Alexandria, Egypt, I have witnessed and experienced firsthand the impact of cultural context, individual values, socioeconomic background, and space and time on the fairness of election vote counting. In Egypt, there are deeply entrenched cultural and socioeconomic factors that influence the fairness of election processes. Additionally, as a woman who has lived through different political periods, I have seen how age and place have also played a role in shaping the perceptions of election fairness. Therefore, taking into account the nuanced phrasing of the question and the cultural relativism of different perspectives, I would have to say that votes are not often counted fairly in the country's elections.\n\n3"]}, {"persona": {"region": "Kafr el-sheikh", "sex": "male", "age": 49, "country": "Egypt", "marital_status": "married", "education": "higher", "social_class": "working class"}, "question": {"id": "Q224", "variant": 0}, "response": ["Based on the anthropological framework, as a married male from Kafr el-sheikh, Egypt, who is 49 years old and part of the working class, my perspective is influenced by my cultural context, individual values, and socioeconomic background. In Egypt, there is a history of political and socioeconomic challenges, and as a member of the working class, I have personally experienced the impact of these challenges. My personal experience and values lead me to believe that votes are not often counted fairly in the country's elections. This belief is also influenced by the cultural context of Egypt and the historical and current political situation. (3)\n\n3"]}, {"persona": {"region": "Kafr el-sheikh", "sex": "male", "age": 25, "country": "Egypt", "marital_status": "single", "education": "middle", "social_class": "lower middle class"}, "question": {"id": "Q224", "variant": 0}, "response": ["Based on the anthropological framework, as a single male from Kafr el-sheikh, Egypt, who is 25 years old and part of the lower middle class, my perspective on the fairness of election vote counting is heavily influenced by my cultural context, individual values, and socioeconomic background. Being from a region with a history of political unrest and economic struggle, I have witnessed firsthand the impact of unfair voting practices on the representation of the lower middle class in government. Additionally, my personal experience and values lead me to believe that votes are not often counted fairly in the country's elections, as I have seen how this affects the lives of people in my community. Therefore, my answer to the question is:\n\n3) Not often"]}, {"persona": {"region": "Kafr el-sheikh", "sex": "male", "age": 59, "country": "Egypt", "marital_status": "married", "education": "higher", "social_class": "lower middle class"}, "question": {"id": "Q224", "variant": 0}, "response": ["Based on the anthropological framework, my emic perspective as a married male from Kafr el-Sheikh, Egypt, would be influenced by my cultural context, individual values and personal experience, and socioeconomic background. In Egypt, there have been instances of unfair electoral practices, which has been widely reported in the news and discussed among my social networks. As a member of the lower middle class, I am keenly aware of the impact that political decisions have on my daily life and livelihood. Therefore, taking into account my personal experience and the cultural context of my country, I would say that votes are not often counted fairly in the country's elections.\n\n3"]}, {"persona": {"region": "Kafr el-sheikh", "sex": "female", "age": 38, "country": "Egypt", "marital_status": "married", "education": "middle", "social_class": "working class"}, "question": {"id": "Q224", "variant": 0}, "response": ["Based on the anthropological framework, my perspective as a married female from Kafr el-sheikh, Egypt, who is part of the working class and has completed middle education level, is heavily influenced by my cultural context, individual values, and socioeconomic background. In Egypt, there are longstanding issues with corruption and lack of transparency in the electoral process. As a member of the working class, I have witnessed firsthand the impact of unfair electoral practices on my community. Additionally, my personal experience and upbringing have shaped my belief that the electoral system in Egypt is not often fair. Therefore, I choose option (3) Not often."]}, {"persona": {"region": "Kafr el-sheikh", "sex": "male", "age": 35, "country": "Egypt", "marital_status": "married", "education": "higher", "social_class": "lower middle class"}, "question": {"id": "Q224", "variant": 0}, "response": ["Based on the anthropological framework, my emic perspective as a married male from Kafr el-sheikh, Egypt, would be influenced by the cultural context of the country, where the political system may not always prioritize fairness in elections. Additionally, my lower middle class socioeconomic background may lead me to perceive the electoral process as not often fair, as those in positions of power may not always represent or prioritize the interests of individuals in my social and economic position. Furthermore, my personal experiences and individual values would also shape my perception of the electoral process. Therefore, I would choose:\n\n3) Not often"]}, {"persona": {"region": "Kafr el-sheikh", "sex": "male", "age": 49, "country": "Egypt", "marital_status": "married", "education": "middle", "social_class": "lower class"}, "question": {"id": "Q224", "variant": 0}, "response": ["Based on the anthropological framework described above, as a married male from Kafr el-sheikh, Egypt, who is 49 years old, completed middle education level, and considers myself part of the lower class, my viewpoint on the fairness of vote counting in the country's elections would be heavily influenced by my cultural context, individual values, and socioeconomic background. As a member of the lower class in Egypt, I am likely to have experienced firsthand the challenges and inequalities that exist within the electoral process. Additionally, my personal experience and values would lead me to believe that votes are not often counted fairly in the country's elections. This perspective is also shaped by the cultural relativism inherent in understanding that power dynamics and systemic inequalities play a significant role in shaping the electoral process in Egypt.\n\n3"]}, {"persona": {"region": "Kafr el-sheikh", "sex": "male", "age": 37, "country": "Egypt", "marital_status": "married", "education": "middle", "social_class": "lower class"}, "question": {"id": "Q224", "variant": 0}, "response": ["Based on my cultural context and socioeconomic background, I have witnessed and experienced firsthand the challenges faced by those in the lower class when it comes to fair representation and fair treatment in elections. The lower class often experiences discrimination and lack of access to resources, which can result in unfair voting practices. Additionally, the cultural relativism perspective reminds us that different social groups may have different experiences with the electoral process. Therefore, I would say that votes are not often counted fairly in the country's elections.\n\n3"]}, {"persona": {"region": "Menofia", "sex": "female", "age": 22, "country": "Egypt", "marital_status": "single", "education": "middle", "social_class": "lower class"}, "question": {"id": "Q224", "variant": 0}, "response": ["Based on my emic perspective as a single female from Menofia, Egypt, my understanding of the fairness of election vote counting is influenced by my cultural context, socioeconomic background, and personal experience. In my community, there is a general perception that votes are not often counted fairly in the country's elections. This belief is shaped by the socio-economic status of the people in my area, as well as the historical and political context of Egypt. Additionally, my age and level of education have also influenced my understanding of the electoral process. Therefore, I believe that votes are not often counted fairly in the country's elections.\n\n3"]}, {"persona": {"region": "Menofia", "sex": "female", "age": 25, "country": "Egypt", "marital_status": "married", "education": "middle", "social_class": "lower class"}, "question": {"id": "Q224", "variant": 0}, "response": ["Based on the anthropological framework, as a married female from Menofia, Egypt, who is part of the lower class and has completed middle education level, my answer to the question \"How often are votes counted fairly in the country's elections?\" is influenced by my cultural context, individual values, and socioeconomic background. In Egypt, there are deep-rooted cultural and socioeconomic factors that may impact the fairness of election processes. As a member of the lower class, I have witnessed instances where votes are not counted fairly, and my personal experience and values lead me to believe that this is not often the case in the country's elections. Additionally, the etic perspective from outside the group may also support this viewpoint, as there have been reports and observations of irregularities in election processes in Egypt. \n\n3"]}, {"persona": {"region": "Menofia", "sex": "male", "age": 28, "country": "Egypt", "marital_status": "single", "education": "higher", "social_class": "working class"}, "question": {"id": "Q224", "variant": 0}, "response": ["Based on the anthropological framework, my emic perspective as a single male from Menofia, Egypt, who has completed higher education and considers himself part of the working class, is influenced by my cultural context, individual values, socioeconomic background, and space and time. In Egypt, there has been a history of political turmoil and allegations of electoral fraud. My personal experience and values lead me to believe that votes are not often counted fairly in the country's elections. This belief is also influenced by my socioeconomic background as a member of the working class, where I have seen and experienced firsthand the impact of unfair electoral practices on my community. Therefore, my answer to the question is (3) Not often."]}, {"persona": {"region": "Menofia", "sex": "male", "age": 35, "country": "Egypt", "marital_status": "married", "education": "middle", "social_class": "lower middle class"}, "question": {"id": "Q224", "variant": 0}, "response": ["Based on the anthropological framework, as a married male from Menofia, Egypt, my emic perspective is that the country's elections are often influenced by power dynamics and personal connections. This is a common belief within my community and is shaped by our cultural context, individual values, and personal experiences. Additionally, my lower middle class socioeconomic background has exposed me to instances where votes are not always counted fairly, and I have witnessed cases of electoral fraud and manipulation. Therefore, based on my nuanced understanding of the question and my personal experience, I would answer:\n\n(3) Not often"]}, {"persona": {"region": "Menofia", "sex": "male", "age": 55, "country": "Egypt", "marital_status": "married", "education": "middle", "social_class": "working class"}, "question": {"id": "Q224", "variant": 0}, "response": ["Based on the anthropological framework, as a married male from Menofia, Egypt, at 55 years of age, with a middle education level and part of the working class, my response to the question of how often votes are counted fairly in the country's elections would be influenced by the cultural context, individual values, and personal experience. In Egypt, there has been a history of political unrest and allegations of electoral fraud. As a member of the working class, I may have personally witnessed or experienced instances where votes were not counted fairly, leading me to believe that it is not often that votes are counted fairly in the country's elections. Additionally, my cultural context and socioeconomic background contribute to my perception that the electoral process is not always fair and transparent. Therefore, my answer to the question would be (3) Not often."]}, {"persona": {"region": "Menofia", "sex": "male", "age": 53, "country": "Egypt", "marital_status": "married", "education": "higher", "social_class": "lower middle class"}, "question": {"id": "Q224", "variant": 0}, "response": ["Based on the anthropological framework, my perspective as a married male from Menofia, Egypt, is influenced by my cultural context, socioeconomic background, and personal experiences. In Egypt, there is a long history of political unrest and allegations of vote manipulation. Additionally, as a lower middle-class individual, I have witnessed how socioeconomic status can impact the fairness of elections. Furthermore, my age and education level have allowed me to critically analyze the political landscape in Egypt. Therefore, based on my understanding, I believe that votes are not often counted fairly in the country's elections.\n\n3"]}, {"persona": {"region": "Menofia", "sex": "male", "age": 59, "country": "Egypt", "marital_status": "married", "education": "middle", "social_class": "working class"}, "question": {"id": "Q224", "variant": 0}, "response": ["Based on the anthropological framework, the perspective of a married male from Menofia, Egypt, who is 59 years old, completed middle education, and considers himself part of the working class, would be heavily influenced by his cultural context, socioeconomic background, and individual values. As a member of the working class in Egypt, he may have experienced or witnessed instances of unfair voting practices due to the country's political and economic circumstances. Additionally, his limited educational opportunities may have shaped his understanding of the political system and the fairness of elections. Considering these factors, he may be more likely to believe that votes are not often counted fairly in the country's elections.\n\n3"]}, {"persona": {"region": "Menofia", "sex": "female", "age": 42, "country": "Egypt", "marital_status": "married", "education": "middle", "social_class": "lower middle class"}, "question": {"id": "Q224", "variant": 0}, "response": ["Based on my emic perspective as a married female from Menofia, Egypt, I have personally witnessed and experienced the impact of cultural context, individual values, and socioeconomic background on the fairness of elections in my country. In my community, there is a strong emphasis on traditional values and social hierarchies, which can influence the way votes are counted. Additionally, my lower middle-class status has made me more attuned to the challenges and inequalities that exist within the electoral process. My age and place have also shaped my understanding of the frequency with which votes are counted fairly. Taking all of these factors into consideration, I would say that votes are not often counted fairly in the country's elections.\n\n3"]}, {"persona": {"region": "Menofia", "sex": "male", "age": 39, "country": "Egypt", "marital_status": "married", "education": "higher", "social_class": "working class"}, "question": {"id": "Q224", "variant": 0}, "response": ["From the perspective of a married male from Menofia, Egypt, who is 39 years old and part of the working class, I would consider the cultural context of Egypt, which has a history of political turmoil and varying levels of corruption. This cultural context would heavily influence my perception of the fairness of election vote counting. Additionally, my individual values and personal experience would lead me to believe that votes are not often counted fairly in the country's elections. My socioeconomic background as part of the working class would also contribute to this belief, as there may be a sense of disenfranchisement and lack of representation in the political process. Based on these factors, I would select option 3) Not often."]}, {"persona": {"region": "Menofia", "sex": "male", "age": 34, "country": "Egypt", "marital_status": "married", "education": "middle", "social_class": "lower middle class"}, "question": {"id": "Q224", "variant": 0}, "response": ["Based on the anthropological framework, the emic perspective of a married male from Menofia, Egypt, who is 34 years old and part of the lower middle class, would be influenced by his cultural context, individual values and personal experience, and socioeconomic background. In Egypt, there are cultural and societal factors that may affect the perception of the fairness of elections, such as governmental influence and corruption. The individual's personal experience and values, shaped by his socioeconomic background and education level, may lead him to believe that votes are not counted fairly in the country's elections. Therefore, the chosen answer is:\n\n3. Not often"]}, {"persona": {"region": "Menofia", "sex": "male", "age": 22, "country": "Egypt", "marital_status": "single", "education": "higher", "social_class": "working class"}, "question": {"id": "Q224", "variant": 0}, "response": ["Based on my personal experience and socioeconomic background as a working-class male from Menofia, Egypt, I have witnessed and heard of instances where votes are not counted fairly in the country's elections. This is also influenced by the cultural context and the space and time in which I live, as there have been historical instances of electoral fraud and manipulation. Additionally, the cultural relativism perspective reminds me that this may not be the case in other cultures or societies. Therefore, based on my emic perspective, I would have to say that votes are not often counted fairly in the country's elections.\n\n3"]}, {"persona": {"region": "Menofia", "sex": "male", "age": 21, "country": "Egypt", "marital_status": "single", "education": "middle", "social_class": "working class"}, "question": {"id": "Q224", "variant": 0}, "response": ["Based on the anthropological framework, my perspective as a single male from Menofia, Egypt, who has completed middle education and considers himself part of the working class, is heavily influenced by my cultural context, individual values, and socioeconomic background. In Egypt, there are longstanding cultural and political factors that affect the fairness of elections, such as government control and corruption. Additionally, my working-class background means that I am more likely to be affected by socioeconomic inequalities and therefore may have a more critical view of the fairness of elections. Considering these factors, I would choose:\n\n3"]}, {"persona": {"region": "Menofia", "sex": "male", "age": 36, "country": "Egypt", "marital_status": "married", "education": "higher", "social_class": "working class"}, "question": {"id": "Q224", "variant": 0}, "response": ["Based on the anthropological framework, as a married male from Menofia, Egypt, my emic perspective is shaped by my cultural context, individual values, and socioeconomic background. In Egypt, there is a strong emphasis on family and community, and the cultural context is influenced by the country's political history and social dynamics. My personal experience and values also play a significant role in my understanding of the fairness of elections. As a member of the working class, I may have experienced or witnessed instances where votes are not counted fairly due to various socioeconomic and political factors. Therefore, my response to the question is influenced by these factors, and I believe that votes are not often counted fairly in the country's elections.\n\n3"]}, {"persona": {"region": "Menofia", "sex": "female", "age": 52, "country": "Egypt", "marital_status": "married", "education": "higher", "social_class": "lower middle class"}, "question": {"id": "Q224", "variant": 0}, "response": ["Based on the anthropological framework, as a married female from Menofia, Egypt, with a lower middle-class socioeconomic background and higher education level, my perspective on the fairness of vote counting in the country's elections would be influenced by my cultural context, individual values, and personal experience. In Egypt, there have been instances of election irregularities and concerns about the fairness of vote counting, which are widely reported in the media and discussed within the community. Additionally, my education has provided me with the critical thinking skills to analyze and understand the complexities of the electoral process. Considering these factors, I would say that votes are not often counted fairly in the country's elections. \n\n3"]}, {"persona": {"region": "Menofia", "sex": "male", "age": 52, "country": "Egypt", "marital_status": "married", "education": "higher", "social_class": "lower middle class"}, "question": {"id": "Q224", "variant": 0}, "response": ["From an anthropological perspective, my answer to the question of how often votes are counted fairly in the country's elections is influenced by a combination of factors. My emic perspective as a married male from Menofia, Egypt, who is 52 years old and part of the lower middle class, has shaped my understanding of the cultural context and socioeconomic background in which elections take place. My personal experience and individual values also play a role in my perception of the fairness of elections. Additionally, the nuance of the question itself and the space and time in which it is asked are important considerations. Based on these factors, I believe that votes are not often counted fairly in the country's elections.\n\n3"]}, {"persona": {"region": "Menofia", "sex": "male", "age": 39, "country": "Egypt", "marital_status": "married", "education": "middle", "social_class": "lower class"}, "question": {"id": "Q224", "variant": 0}, "response": ["Based on my cultural context, as a married male from Menofia, Egypt, I have witnessed and experienced the impact of the lower class on the fairness of election votes. My socioeconomic background has made me aware of the challenges and inequalities that exist in the electoral process. Additionally, my personal experience and individual values have shaped my understanding of the frequency of fair vote counting in the country's elections. Considering all these factors, I would have to say that votes are not often counted fairly in the country's elections.\n\n3"]}, {"persona": {"region": "Menofia", "sex": "male", "age": 23, "country": "Egypt", "marital_status": "single", "education": "middle", "social_class": "lower middle class"}, "question": {"id": "Q224", "variant": 0}, "response": ["Based on my emic perspective, I have observed that votes are not often counted fairly in the country's elections. This is influenced by the cultural context of Egypt, where there is a history of political corruption and manipulation. Additionally, my individual values and personal experience have shown me instances of electoral fraud and manipulation. My socioeconomic background as a lower middle class individual also affects my perception, as I am more likely to be impacted by unfair electoral practices. Furthermore, cultural relativism reminds me that my perspective is shaped by my own experiences and may not be the same for others. Finally, the nuance of the question leads me to choose option (3) Not often.\n\n3"]}, {"persona": {"region": "Dakahlia", "sex": "female", "age": 24, "country": "Egypt", "marital_status": "single", "education": "higher", "social_class": "lower middle class"}, "question": {"id": "Q224", "variant": 0}, "response": ["Based on the anthropological framework, my emic perspective as a single female from Dakahlia, Egypt, who belongs to the lower middle class, is shaped by my cultural context, individual values, and personal experiences. The cultural context in Egypt includes a history of political unrest and corruption, which has influenced my perception of the fairness of elections. Additionally, my socioeconomic background has exposed me to the challenges faced by individuals in my community, further influencing my perspective. Considering the nuanced phrasing of the question, I believe that votes are not counted fairly in the country's elections. This belief is based on my personal experiences and the experiences of those around me, as well as the historical and cultural context of Egypt.\n\n3"]}, {"persona": {"region": "Dakahlia", "sex": "male", "age": 36, "country": "Egypt", "marital_status": "married", "education": "higher", "social_class": "upper middle class"}, "question": {"id": "Q224", "variant": 0}, "response": ["Based on the anthropological framework, my answer to the question of how often votes are counted fairly in the country's elections would be influenced by my individual values and personal experience, as well as my socioeconomic background. As someone from Dakahlia, Egypt, with a higher education level and considering myself part of the upper middle class, I am likely to have more access to information and be more critical of the political system. Additionally, my cultural context and understanding of the political landscape in Egypt would lead me to believe that votes are not often counted fairly in the country's elections. Therefore, my answer to the question would be:\n\n3) Not often"]}, {"persona": {"region": "Dakahlia", "sex": "female", "age": 71, "country": "Egypt", "marital_status": "married", "education": "higher", "social_class": "upper middle class"}, "question": {"id": "Q224", "variant": 0}, "response": ["Based on my emic perspective, as a married female from Dakahlia, Egypt, I have observed and experienced the cultural and socioeconomic context in which elections take place. The cultural relativism in Egypt means that the way elections are conducted may be different from what others may perceive as \"fair\". Additionally, my individual values and personal experiences have shaped my understanding of the political system in Egypt. As a member of the upper middle class, I have been able to access higher education and have been exposed to a certain level of privilege that may influence my perception of the fairness of elections. Furthermore, my age and the historical context in which I have lived through have provided me with a nuanced understanding of the political landscape in Egypt. Therefore, based on my perspective and understanding, I would choose option (2) Fairly often, as I believe that while there may be some issues, overall the elections in Egypt are conducted fairly often. \n\n2"]}, {"persona": {"region": "Dakahlia", "sex": "male", "age": 55, "country": "Egypt", "marital_status": "married", "education": "higher", "social_class": "upper middle class"}, "question": {"id": "Q224", "variant": 0}, "response": ["Based on the anthropological framework, as a 55-year-old married male from Dakahlia, Egypt, who has completed higher education and considers myself part of the upper middle class, my perspective on the fairness of vote counting in the country's elections would be influenced by my cultural context, individual values, and socioeconomic background. I have likely been exposed to a range of political and social experiences, and my higher education level may have provided me with a deeper understanding of the political system. Additionally, my socioeconomic status may have afforded me opportunities to engage with political processes. Considering these factors, I would choose the following option:\n\n2) Fairly often"]}, {"persona": {"region": "Dakahlia", "sex": "male", "age": 64, "country": "Egypt", "marital_status": "married", "education": "higher", "social_class": "lower middle class"}, "question": {"id": "Q224", "variant": 0}, "response": ["Based on the anthropological framework, as a married male from Dakahlia, Egypt, who is 64 years old and part of the lower middle class, my perspective on the fairness of vote counting in the country's elections is influenced by my cultural context, individual values, and socioeconomic background. In Egypt, there is a history of political unrest and allegations of electoral fraud, which may lead to a perception that votes are not often counted fairly. Additionally, my lower middle-class status may contribute to a feeling of disenfranchisement and lack of trust in the electoral process. Therefore, I believe that votes are not often counted fairly in the country's elections.\n\n3"]}, {"persona": {"region": "Dakahlia", "sex": "female", "age": 29, "country": "Egypt", "marital_status": "married", "education": "middle", "social_class": "lower class"}, "question": {"id": "Q224", "variant": 0}, "response": ["Based on my cultural context as a married female from Dakahlia, Egypt, my emic perspective is that votes are not often counted fairly in the country's elections. This belief is shaped by my personal experiences and socioeconomic background, as I have seen and heard about instances of electoral fraud and corruption in my community. Additionally, the cultural relativism in my society leads me to believe that the electoral process is not as transparent and fair as it may be in other cultures. Furthermore, my lower-class status and middle education level contribute to my understanding that those in power may not always have the best interests of people like me in mind. Therefore, my answer is: \n3. Not often"]}, {"persona": {"region": "Dakahlia", "sex": "female", "age": 40, "country": "Egypt", "marital_status": "married", "education": "middle", "social_class": "upper middle class"}, "question": {"id": "Q224", "variant": 0}, "response": ["From the perspective of a married female from Dakahlia, Egypt, cultural context is pivotal in understanding the fairness of elections. As a member of the upper middle class, I have access to more resources and potentially better education, which may influence my perception of the fairness of elections. Additionally, my age and societal status play a role in how I perceive the political landscape. I am also influenced by personal experiences and individual values, which may shape my perception of the electoral process. Given these factors, I believe that votes are counted fairly fairly often in the country's elections.\n\n2"]}, {"persona": {"region": "Dakahlia", "sex": "male", "age": 37, "country": "Egypt", "marital_status": "married", "education": "higher", "social_class": "lower middle class"}, "question": {"id": "Q224", "variant": 0}, "response": ["Based on the anthropological framework, my emic perspective as a married male from Dakahlia, Egypt, with a higher education level and considering myself part of the lower middle class, is influenced by my cultural context, individual values, and socioeconomic background. In Egypt, there is a cultural norm of skepticism towards the fairness of elections due to historical experiences and political dynamics. Additionally, my personal experience and values lead me to believe that votes are not often counted fairly in the country's elections. This is further reinforced by my lower middle-class status, as there is a perception of unequal power dynamics and potential manipulation in the electoral process. Therefore, my answer to the question is:\n3"]}, {"persona": {"region": "Dakahlia", "sex": "female", "age": 45, "country": "Egypt", "marital_status": "married", "education": "middle", "social_class": "working class"}, "question": {"id": "Q224", "variant": 0}, "response": ["Based on the anthropological framework, as a married female from Dakahlia, Egypt, my emic perspective of the country's elections is influenced by my cultural context, individual values, and socioeconomic background. In Egypt, there is a strong emphasis on family and community, and the cultural context values fairness and justice. As a working-class woman with a middle education level, I have experienced firsthand the challenges and struggles faced by the majority of the population. Therefore, I believe that votes are not often counted fairly in the country's elections, as socioeconomic factors and power dynamics often impact the fairness of the electoral process.\n\n3"]}, {"persona": {"region": "Dakahlia", "sex": "male", "age": 34, "country": "Egypt", "marital_status": "single", "education": "middle", "social_class": "lower middle class"}, "question": {"id": "Q224", "variant": 0}, "response": ["Based on my emic perspective as a single male from Dakahlia, Egypt, I have personally witnessed and experienced the impact of socioeconomic background, cultural context, and individual values on the fairness of election votes. As a member of the lower middle class, I have often seen how individuals with more wealth and power tend to have a greater influence on the electoral process. Additionally, the cultural context in Egypt, including the prevalence of corruption and nepotism, further contributes to the lack of fairness in election votes. Therefore, based on my personal experience and understanding, I would say that votes are not often counted fairly in the country's elections.\n\n3"]}, {"persona": {"region": "Dakahlia", "sex": "female", "age": 26, "country": "Egypt", "marital_status": "married", "education": "higher", "social_class": "upper middle class"}, "question": {"id": "Q224", "variant": 0}, "response": ["Based on the anthropological framework, my emic perspective as a married female from Dakahlia, Egypt, who is 26 years old and part of the upper middle class, is influenced by my cultural context, individual values and personal experience, and socioeconomic background. In Egypt, there is a strong sense of community and family values, and the cultural context of the country is such that there is a history of political instability and concerns about electoral fairness. Additionally, my personal experience and values as an educated woman from the upper middle class have led me to be more aware of political issues and the potential for unfairness in the electoral process. Therefore, based on these factors, I would choose option (3) Not often, as I believe that votes are not counted fairly in the country's elections.\n\n3"]}, {"persona": {"region": "Dakahlia", "sex": "male", "age": 21, "country": "Egypt", "marital_status": "single", "education": "middle", "social_class": "upper middle class"}, "question": {"id": "Q224", "variant": 0}, "response": ["Based on my emic perspective as a single male from Dakahlia, Egypt, I understand that the cultural context in which I live plays a significant role in the fairness of election vote counting. My individual values and personal experiences have shown me that the socioeconomic background of individuals also influences the fairness of election processes. Additionally, I recognize the importance of cultural relativism in understanding that different cultures may have different approaches to election processes. Considering all these factors, I believe that votes are counted fairly often in the country's elections.\n\n2"]}, {"persona": {"region": "Dakahlia", "sex": "female", "age": 32, "country": "Egypt", "marital_status": "married", "education": "middle", "social_class": "working class"}, "question": {"id": "Q224", "variant": 0}, "response": ["Based on the anthropological framework, my cultural context as a married female from Dakahlia, Egypt, where I come from, my age, and my socioeconomic background as part of the working class all influence my perception of the fairness of election votes in my country. My personal experience and values also play a big role in my understanding of this issue. Additionally, cultural relativism reminds me that my perspective is shaped by my own cultural context and may not be the same as others. Therefore, I believe that votes are not often counted fairly in the country's elections.\n3"]}, {"persona": {"region": "Dakahlia", "sex": "female", "age": 35, "country": "Egypt", "marital_status": "married", "education": "middle", "social_class": "upper middle class"}, "question": {"id": "Q224", "variant": 0}, "response": ["Based on the anthropological framework, my answer to the question is influenced by my cultural context, socioeconomic background, and personal experience. As a married female from Dakahlia, Egypt, I am aware of the cultural and political dynamics in my country. I come from a region where traditional values and societal norms play a significant role in shaping people's perspectives on political issues, including the fairness of election processes. Additionally, being part of the upper middle class, I have access to information and resources that may not be available to individuals from lower socioeconomic backgrounds. Furthermore, my personal experience and understanding of the political landscape in Egypt lead me to believe that votes are not often counted fairly in the country's elections.\n\n3"]}, {"persona": {"region": "Dakahlia", "sex": "male", "age": 33, "country": "Egypt", "marital_status": "married", "education": "middle", "social_class": "upper middle class"}, "question": {"id": "Q224", "variant": 0}, "response": ["Based on my cultural context and socioeconomic background, I have observed that votes are counted fairly often in our country's elections. Being part of the upper middle class in Dakahlia, Egypt, I have had the opportunity to witness elections and I believe that our electoral system is generally fair and transparent. Additionally, my personal experience and individual values lead me to trust in the integrity of the electoral process. In my community, there is a sense of trust in the electoral system and the belief that votes are counted fairly. Therefore, option (2) Fairly often."]}, {"persona": {"region": "Dakahlia", "sex": "female", "age": 45, "country": "Egypt", "marital_status": "married", "education": "middle", "social_class": "upper middle class"}, "question": {"id": "Q224", "variant": 0}, "response": ["Based on the anthropological framework, as a married female from Dakahlia, Egypt, who is 45 years old and part of the upper middle class, my perspective on the fairness of election votes would be influenced by my cultural context, individual values, and socioeconomic background. The cultural context of Egypt, with its history of political instability and corruption, would lead me to believe that votes are not often counted fairly in the country's elections. Additionally, my personal experience and values as someone who has seen and experienced the impact of unfair elections would also contribute to this perception. Furthermore, my socioeconomic background as part of the upper middle class may provide me with more access to information and a better understanding of the political landscape, further reinforcing my belief that votes are not often counted fairly in Egypt's elections.\n\n3"]}, {"persona": {"region": "Dakahlia", "sex": "male", "age": 30, "country": "Egypt", "marital_status": "married", "education": "middle", "social_class": "upper middle class"}, "question": {"id": "Q224", "variant": 0}, "response": ["From the perspective of a married male from Dakahlia, Egypt, who is 30 years old and part of the upper middle class, the emic and etic perspectives are crucial in understanding the fairness of election vote counting. The cultural context of Egypt, with its history of political instability and corruption, plays a significant role in shaping perceptions of the electoral process. Additionally, the individual values and personal experiences of someone from the upper middle class may lead to a belief that votes are counted fairly, as they may have more access to resources and information. Socioeconomic background also factors in, as someone from this class may have a vested interest in the current political system and may be more likely to believe in its fairness. Finally, the nuanced phrasing of the question may lead to a more positive perception of the electoral process. \n\n2"]}, {"persona": {"region": "Dakahlia", "sex": "female", "age": 63, "country": "Egypt", "marital_status": "married", "education": "higher", "social_class": "lower middle class"}, "question": {"id": "Q224", "variant": 0}, "response": ["From the emic perspective, as a married female from Dakahlia, Egypt, I have personally experienced and witnessed the impact of cultural context, individual values, and socioeconomic background on the fairness of election votes. Living in a lower middle class community, I have seen how power dynamics, financial resources, and social connections can influence the fairness of election votes. Additionally, my higher education level has allowed me to critically analyze and understand the nuances of electoral processes. In Egypt, the cultural relativism and historical context also play a significant role in shaping the perception of fairness in elections. Therefore, based on my personal experience and understanding, I would say that votes are not often counted fairly in the country's elections.\n\n3"]}, {"persona": {"region": "Dakahlia", "sex": "male", "age": 28, "country": "Egypt", "marital_status": "single", "education": "higher", "social_class": "upper middle class"}, "question": {"id": "Q224", "variant": 0}, "response": ["Based on the anthropological framework described above, I, as a single male from Dakahlia, Egypt, would approach this question by considering the cultural context and my socioeconomic background. In Egypt, there is a complex political and social landscape, and the fairness of election processes can vary widely based on a range of factors such as regional differences, socioeconomic status, and access to resources. As someone who is part of the upper middle class and has completed higher education, I may have a more favorable view of the fairness of election processes compared to others in different socioeconomic brackets. Additionally, my personal experience and individual values may also influence my perception of the fairness of election processes. Considering these factors, I would choose the following option:\n(2) Fairly often"]}, {"persona": {"region": "Dakahlia", "sex": "female", "age": 24, "country": "Egypt", "marital_status": "married", "education": "higher", "social_class": "upper middle class"}, "question": {"id": "Q224", "variant": 0}, "response": ["Based on my cultural context in Dakahlia, Egypt, the socioeconomic background of being part of the upper middle class, and my age and education level, I have been exposed to a certain level of privilege and access to information. My individual values and personal experiences have shaped my perception that votes are counted fairly often in the country's elections. Additionally, my cultural relativism understanding tells me that Egypt has made progress in its democratic process, and my nuanced understanding of the question leads me to believe that the elections are generally fair. \n\n1"]}, {"persona": {"region": "Dakahlia", "sex": "male", "age": 20, "country": "Egypt", "marital_status": "single", "education": "middle", "social_class": "upper middle class"}, "question": {"id": "Q224", "variant": 0}, "response": ["Based on the anthropological framework, my emic perspective as a single male from Dakahlia, Egypt, who has completed middle education and considers himself part of the upper middle class, is influenced by my cultural context, individual values, and socioeconomic background. In Egypt, there is a long history of political unrest and allegations of election fraud. My personal experience and values lead me to believe that votes are not often counted fairly in the country's elections. This perception is shaped by the societal and political context in which I have grown up, where there have been widespread reports of electoral irregularities. Therefore, my answer to the question is:\n\n3. Not often"]}, {"persona": {"region": "Dakahlia", "sex": "male", "age": 45, "country": "Egypt", "marital_status": "married", "education": "middle", "social_class": "upper middle class"}, "question": {"id": "Q224", "variant": 0}, "response": ["Based on the anthropological framework, my answer to the question will be heavily influenced by my cultural context, individual values, and socioeconomic background. As a married male from Dakahlia, Egypt, I am familiar with the political and social dynamics of my country. My middle education level and upper middle-class status also shape my perspective. In Egypt, there is a history of electoral fraud and irregularities, which impacts the perception of fairness in elections. Additionally, my age and social status may give me a certain level of insight and awareness about the political situation in the country. Therefore, taking all of these factors into consideration, I would choose option 3: Not often. \n\n3"]}, {"persona": {"region": "Dakahlia", "sex": "female", "age": 43, "country": "Egypt", "marital_status": "married", "education": "higher", "social_class": "upper middle class"}, "question": {"id": "Q224", "variant": 0}, "response": ["Based on the anthropological framework, as a married female from Dakahlia, Egypt, with a higher education level and belonging to the upper middle class, my perspective on the fairness of vote counting in the country's elections is heavily influenced by my cultural context, individual values, and socioeconomic background. The cultural context in Egypt includes a history of political unrest and allegations of electoral fraud, which shapes my perception of the fairness of vote counting. My higher education level has also provided me with a critical understanding of democratic processes and the potential for manipulation. Additionally, as part of the upper middle class, I have access to information and resources that allow me to have a more nuanced understanding of the political landscape. Therefore, I believe that votes are not often counted fairly in the country's elections.\n\n3"]}, {"persona": {"region": "Dakahlia", "sex": "female", "age": 20, "country": "Egypt", "marital_status": "single", "education": "middle", "social_class": "upper middle class"}, "question": {"id": "Q224", "variant": 0}, "response": ["From an emic perspective, as a single female from Dakahlia, Egypt, my cultural context and socioeconomic background play a significant role in my understanding of the fairness of election votes. Being part of the upper middle class in Egypt, I have access to education and resources that have shaped my individual values and personal experiences. I have also witnessed the impact of socioeconomic background on political processes and understand that fair counting of votes is not guaranteed in the country's elections. Additionally, cultural relativism reminds me that my perspective is not superior to others, but it is informed by my lived experiences and the nuanced understanding of the political climate in Egypt. Therefore, I believe that votes are not counted fairly in the country's elections. \n\n3"]}, {"persona": {"region": "Dakahlia", "sex": "female", "age": 40, "country": "Egypt", "marital_status": "single", "education": "middle", "social_class": "lower middle class"}, "question": {"id": "Q224", "variant": 0}, "response": ["Based on the anthropological framework, as a single female from Dakahlia, Egypt, my emic perspective would be influenced by my cultural context, individual values, and socioeconomic background. In Egypt, there is a long history of political unrest and allegations of electoral fraud, which would impact my perception of the fairness of election vote counting. Additionally, being part of the lower middle class, I may have limited access to information and resources that could affect my trust in the electoral process. Therefore, I would perceive that votes are not often counted fairly in the country's elections.\n\n3"]}, {"persona": {"region": "Dakahlia", "sex": "female", "age": 33, "country": "Egypt", "marital_status": "married", "education": "higher", "social_class": "upper middle class"}, "question": {"id": "Q224", "variant": 0}, "response": ["Based on the anthropological framework, my personal experience and individual values as a married female from Dakahlia, Egypt, who has completed higher education and considers herself part of the upper middle class, are pivotal in my understanding and answering of this question. My cultural context and socioeconomic background also play a significant role in shaping my perspective. Additionally, the emic and etic perspectives remind me that there may be in-group and out-group ways of thinking about this question, and my nuanced understanding of the question will affect my answer. Therefore, I select:\n\n(3) Not often"]}, {"persona": {"region": "Dakahlia", "sex": "female", "age": 24, "country": "Egypt", "marital_status": "married", "education": "middle", "social_class": "working class"}, "question": {"id": "Q224", "variant": 0}, "response": ["Based on the anthropological framework, my emic perspective as a married female from Dakahlia, Egypt, with a middle education level and working-class background, is heavily influenced by my cultural context, individual values, and personal experiences. In Egypt, there are various cultural, social and economic factors that affect the fairness of election votes. Additionally, the notion of cultural relativism reminds us that what may be considered fair in one culture may not be the same in another. Therefore, considering my socioeconomic background and the political climate in Egypt, I would have to say that votes are not often counted fairly in the country's elections.\n\n3"]}, {"persona": {"region": "Dakahlia", "sex": "female", "age": 53, "country": "Egypt", "marital_status": "widowed", "education": "middle", "social_class": "working class"}, "question": {"id": "Q224", "variant": 0}, "response": ["From my perspective as a widowed female from Dakahlia, Egypt, with a middle education level and working-class background, my understanding and answer are influenced by my cultural context, individual values, and personal experience. In Egypt, there have been historical issues with unfair election practices, and my personal experience and the experiences of those around me inform me that votes are not counted fairly in the country's elections. Additionally, my socioeconomic background and age also play a role in shaping my perception of this issue. Therefore, I believe that votes are not often counted fairly in the country's elections.\n\n3"]}, {"persona": {"region": "Dakahlia", "sex": "female", "age": 30, "country": "Egypt", "marital_status": "single", "education": "middle", "social_class": "lower middle class"}, "question": {"id": "Q224", "variant": 0}, "response": ["Based on the anthropological framework, my answer to the question about the fairness of vote counting in the country's elections would be influenced by my cultural context, individual values, and socioeconomic background. As a single female from Dakahlia, Egypt, with a middle education level and lower middle-class status, I am aware of the challenges and inequalities that exist within the political system. My personal experience and the experiences of those within my community have shown that votes are not often counted fairly in the country's elections. This perspective is shaped by the emic understanding of the political climate in Egypt, the cultural relativism that acknowledges the complexities of the system, and the socioeconomic background that often dictates access and influence within the political sphere.\n\n3"]}, {"persona": {"region": "Dakahlia", "sex": "male", "age": 53, "country": "Egypt", "marital_status": "married", "education": "higher", "social_class": "upper middle class"}, "question": {"id": "Q224", "variant": 0}, "response": ["Based on the anthropological framework, as a married male from Dakahlia, Egypt, my emic perspective would be influenced by the cultural context of the country, including the political and social systems in place. My individual values and personal experience, shaped by my higher education and upper middle class status, would lead me to believe that votes are counted fairly in the country's elections. Additionally, my socioeconomic background and age would further influence my perception of the political system. Therefore, I choose option (1) Very often."]}, {"persona": {"region": "Dakahlia", "sex": "male", "age": 28, "country": "Egypt", "marital_status": "married", "education": "middle", "social_class": "working class"}, "question": {"id": "Q224", "variant": 0}, "response": ["Based on the anthropological framework, as a married male from Dakahlia, Egypt, with a middle education level and working-class background, my perspective on the fairness of election vote counting is influenced by my cultural context, socioeconomic background, and personal experience. In Egypt, there have been concerns about the fairness of elections in the past, and this has been a topic of discussion within my community. Additionally, my socioeconomic background as a member of the working class may lead me to have a more critical view of the fairness of election processes. Therefore, I would choose:\n\n(3) Not often"]}, {"persona": {"region": "Dakahlia", "sex": "female", "age": 38, "country": "Egypt", "marital_status": "married", "education": "middle", "social_class": "upper middle class"}, "question": {"id": "Q224", "variant": 0}, "response": ["Based on the anthropological framework, as a married female from Dakahlia, Egypt, my emic perspective is influenced by the cultural context of my community and the socioeconomic background of being part of the upper middle class. My personal experience and values also play a role in how I perceive the fairness of election votes. Additionally, the nuance of the question is important, as my response will be based on my understanding of the electoral process in my country and the space and time in which I have lived. Considering all these factors, I would choose:\n\n(3) Not often"]}, {"persona": {"region": "Gharbia", "sex": "male", "age": 27, "country": "Egypt", "marital_status": "single", "education": "higher", "social_class": "upper middle class"}, "question": {"id": "Q224", "variant": 0}, "response": ["Based on the anthropological framework, as a single male from Gharbia, Egypt, my emic perspective is influenced by the cultural context of the country and my personal experience. In Egypt, there is a history of political unrest and allegations of electoral fraud, which affects the way I perceive the fairness of election vote counting. Additionally, my upper middle class socioeconomic background may provide me with more access to information and resources to form a more nuanced understanding of the political situation in the country. Considering these factors, I would answer the question:\n(3) Not often"]}, {"persona": {"region": "Gharbia", "sex": "female", "age": 35, "country": "Egypt", "marital_status": "married", "education": "higher", "social_class": "upper middle class"}, "question": {"id": "Q224", "variant": 0}, "response": ["Based on the anthropological framework, as a married female from Gharbia, Egypt, with a higher education level and belonging to the upper middle class, my perspective is influenced by my cultural context, individual values, and socioeconomic background. In Egypt, the cultural context of elections is deeply embedded in the country's history and societal norms. As someone with a higher education level and belonging to the upper middle class, I have likely been exposed to more diverse perspectives and have a greater understanding of political processes. Additionally, my socioeconomic background may lead me to have more access to information and resources that shape my opinion. Therefore, I would select option (2) Fairly often to convey my perspective from this persona.\n\n2"]}, {"persona": {"region": "Gharbia", "sex": "female", "age": 37, "country": "Egypt", "marital_status": "married", "education": "higher", "social_class": "upper middle class"}, "question": {"id": "Q224", "variant": 0}, "response": ["Based on my emic perspective as a married female from Gharbia, Egypt, I have personally witnessed and experienced the impact of socioeconomic background on the fairness of election vote counting. In my cultural context, I have seen how the nuances of power dynamics and class play a significant role in the electoral process. Additionally, my individual values and personal experiences have led me to believe that votes are not often counted fairly in the country's elections, especially considering my upper middle class status and higher education level which has allowed me to critically analyze the situation. Furthermore, my understanding of cultural relativism has highlighted the disparities in the electoral process, leading me to the conclusion that votes are not often counted fairly in the country's elections.\n\n3"]}, {"persona": {"region": "Gharbia", "sex": "male", "age": 43, "country": "Egypt", "marital_status": "married", "education": "middle", "social_class": "lower middle class"}, "question": {"id": "Q224", "variant": 0}, "response": ["Based on my personal experience and socioeconomic background, I believe that votes are not often counted fairly in the country's elections. As a married male from Gharbia, Egypt, who is part of the lower middle class and has completed only middle education level, I have witnessed and experienced instances where the electoral process has been marred by irregularities and unfairness. Additionally, considering the cultural context and nuance, it is important to acknowledge that my perspective may differ from those in higher socioeconomic classes or different regions in Egypt, but from my standpoint, the counting of votes in elections is not often fair.\n\n3"]}, {"persona": {"region": "Gharbia", "sex": "male", "age": 28, "country": "Egypt", "marital_status": "single", "education": "higher", "social_class": "lower middle class"}, "question": {"id": "Q224", "variant": 0}, "response": ["Based on my personal experience and cultural context, I believe that votes are not often counted fairly in the country's elections. As a lower middle class individual from Gharbia, Egypt, I have witnessed and heard about instances of electoral fraud and manipulation. Additionally, my socioeconomic background and age have exposed me to the nuances of the political system, leading me to the conclusion that fair counting of votes is not a common occurrence in our country. Furthermore, cultural relativism teaches us that there is no hierarchy of culture, and my understanding of the political process is shaped by the emic perspective of my in-group. Therefore, my answer to the question is:\n\n3"]}, {"persona": {"region": "Gharbia", "sex": "male", "age": 39, "country": "Egypt", "marital_status": "married", "education": "middle", "social_class": "lower middle class"}, "question": {"id": "Q224", "variant": 0}, "response": ["From the perspective of a married male from Gharbia, Egypt, who is 39 years old and part of the lower middle class, the answer to the question of how often votes are counted fairly in the country's elections would be \"Not often\" (3). This response is based on the cultural context of Egypt, where there have been historical issues with electoral fraud and manipulation. Additionally, the socioeconomic background of the persona, being part of the lower middle class, may lead to a perception of unfairness in the electoral process due to potential power imbalances and lack of representation for individuals in similar socio-economic positions. The nuance of the question also leads to this response as it acknowledges that while votes may be counted, the emphasis is on the fairness of the process, which may not align with the experiences and values of the persona."]}, {"persona": {"region": "Gharbia", "sex": "male", "age": 30, "country": "Egypt", "marital_status": "married", "education": "middle", "social_class": "lower middle class"}, "question": {"id": "Q224", "variant": 0}, "response": ["Based on the anthropological framework, as a married male from Gharbia, Egypt, my emic perspective on the fairness of election vote counting is influenced by my cultural context, individual values, and socioeconomic background. In Egypt, there is a long history of political and social dynamics that shape the perception of fair elections. Additionally, my lower middle-class status and limited education may lead me to be more distrustful of the fairness of the election process. Taking into account cultural relativism and the nuanced phrasing of the question, I would have to say that votes are not often counted fairly in the country's elections.\n\n3"]}, {"persona": {"region": "Gharbia", "sex": "male", "age": 43, "country": "Egypt", "marital_status": "married", "education": "lower", "social_class": "lower middle class"}, "question": {"id": "Q224", "variant": 0}, "response": ["Based on the anthropological framework, my emic perspective as a married male from Gharbia, Egypt, and part of the lower middle class would lead me to consider the cultural context and socioeconomic background as pivotal in understanding and answering this question. In Egypt, there is a history of political corruption and manipulation in elections, and this is often widely recognized and discussed within my community. My personal experience and individual values also lead me to believe that votes are not often counted fairly in the country's elections, as I have witnessed and heard about instances of electoral fraud and manipulation. Additionally, my lower level of education and socioeconomic background have limited my access to information and resources that might provide a more nuanced understanding of the political process. Therefore, my answer to the question would be:\n\n3. Not often"]}, {"persona": {"region": "Gharbia", "sex": "male", "age": 36, "country": "Egypt", "marital_status": "married", "education": "higher", "social_class": "lower middle class"}, "question": {"id": "Q224", "variant": 0}, "response": ["Based on the framework of emic and etic perspectives, cultural context, individual values and personal experience, socioeconomic background, and cultural relativism, as a married male from Gharbia, Egypt, I understand that the fairness of election vote counting can vary greatly depending on one's personal experiences and socioeconomic background. In Egypt, there have been instances of contested elections and allegations of unfair vote counting, which may lead to a perception of not often being the case. Additionally, as a member of the lower middle class, I may have experienced or witnessed instances of unfair vote counting due to socioeconomic disparities. Taking into account the nuanced phrasing of the question and the cultural relativism principle, I would say that not often is the most accurate reflection of my perspective.\n\n3"]}, {"persona": {"region": "Gharbia", "sex": "male", "age": 25, "country": "Egypt", "marital_status": "married", "education": "middle", "social_class": "upper middle class"}, "question": {"id": "Q224", "variant": 0}, "response": ["Based on the anthropological framework, the emic perspective of a married male from Gharbia, Egypt who considers himself part of the upper middle class would be influenced by the cultural context, individual values, and socioeconomic background. In Egypt, there is a strong cultural emphasis on the importance of stability and order, which may lead individuals from the upper middle class to have a positive view of the country's electoral process. Additionally, their socioeconomic background may lead them to have a more optimistic view, as they may benefit from the current political system. Therefore, the answer chosen would be from the perspective of the persona described above. \n\n2"]}, {"persona": {"region": "Gharbia", "sex": "male", "age": 31, "country": "Egypt", "marital_status": "married", "education": "middle", "social_class": "upper middle class"}, "question": {"id": "Q224", "variant": 0}, "response": ["From the emic perspective, as a married male from Gharbia, Egypt, I have been brought up in a culture where voting and elections are seen as significant events that shape the future of the country. My cultural context, including my socioeconomic background and educational level, has shaped my understanding of the political system and the fairness of elections. My personal experience and individual values also play a role in how I perceive the fairness of election processes. Considering all these factors, I would say that votes are fairly often counted fairly in the country's elections.\n\n2"]}, {"persona": {"region": "Gharbia", "sex": "male", "age": 33, "country": "Egypt", "marital_status": "married", "education": "higher", "social_class": "lower middle class"}, "question": {"id": "Q224", "variant": 0}, "response": ["Based on the anthropological framework, as a married male from Gharbia, Egypt who is 33 years old and part of the lower middle class, my perspective on the fairness of vote counting in the country's elections is heavily influenced by my cultural context, individual values, and socioeconomic background. Being from Egypt, I am aware of the political and social dynamics at play in the country, and I know that there have been instances of election irregularities and lack of transparency. Additionally, my lower middle class status means that I may have experienced or witnessed instances where the voices of people like myself are not accurately represented in the electoral process. Therefore, from my emic perspective, I would have to say that votes are not often counted fairly in the country's elections.\n\n3"]}, {"persona": {"region": "Gharbia", "sex": "male", "age": 26, "country": "Egypt", "marital_status": "single", "education": "higher", "social_class": "upper middle class"}, "question": {"id": "Q224", "variant": 0}, "response": ["Based on my emic perspective as a single male from Gharbia, Egypt, I have personally witnessed and experienced the cultural context and socio-economic background of my community. I have seen how individuals' values and personal experiences, as well as their space and time, shape their perceptions and understanding of the fairness of election votes. As a member of the upper middle class who has completed higher education, I have been exposed to different viewpoints and have a nuanced understanding of the political landscape. Considering all these factors, I believe that votes are counted fairly often in the country's elections.\n\n2"]}, {"persona": {"region": "Gharbia", "sex": "female", "age": 45, "country": "Egypt", "marital_status": "married", "education": "middle", "social_class": "lower middle class"}, "question": {"id": "Q224", "variant": 0}, "response": ["Based on the anthropological framework, as a married female from Gharbia, Egypt, my emic perspective is influenced by the cultural context of living in a country with a history of political turmoil and questionable election practices. My individual values and personal experience, as well as my lower middle class socioeconomic background, contribute to my belief that votes are not often counted fairly in the country's elections. Additionally, the cultural relativism of recognizing the power dynamics at play in Egyptian politics and the nuance of the question lead me to choose option (3) Not often."]}, {"persona": {"region": "Gharbia", "sex": "female", "age": 55, "country": "Egypt", "marital_status": "married", "education": "middle", "social_class": "upper middle class"}, "question": {"id": "Q224", "variant": 0}, "response": ["Based on the anthropological framework, my perspective as a married female from Gharbia, Egypt, who is 55 years old and part of the upper middle class, is influenced by my cultural context, individual values, and socioeconomic background. In Egypt, there is a history of political unrest and allegations of election fraud. As an educated and financially stable individual, I am more likely to have access to information and resources that allow me to critically assess the fairness of election processes. Additionally, my age and social status may provide me with insights into the historical and current political climate of the country. Therefore, I believe that votes are not often counted fairly in the country's elections. \n\n3"]}, {"persona": {"region": "Gharbia", "sex": "female", "age": 27, "country": "Egypt", "marital_status": "married", "education": "higher", "social_class": "upper middle class"}, "question": {"id": "Q224", "variant": 0}, "response": ["Based on my emic perspective as a married female from Gharbia, Egypt, I have observed that the cultural context and socioeconomic background play a significant role in the fairness of election vote counting. I have personally experienced and witnessed the influence of socioeconomic status on the electoral process, as those with higher economic means often have more access to resources and influence in the political sphere. Additionally, the cultural relativism in Egypt means that there are varying perceptions and practices regarding the fairness of election vote counting. Furthermore, my individual values and personal experiences have shaped my understanding that while there have been improvements in recent years, there is still room for progress in ensuring fair vote counting in the country's elections.\n\n2"]}, {"persona": {"region": "Gharbia", "sex": "female", "age": 42, "country": "Egypt", "marital_status": "married", "education": "higher", "social_class": "upper middle class"}, "question": {"id": "Q224", "variant": 0}, "response": ["Based on the anthropological framework, my cultural context as a married female from Gharbia, Egypt, my age of 42 and completed higher education level, and my upper middle class status all play a significant role in how I perceive the fairness of election vote counting in my country. My individual values and personal experience have led me to believe that votes are counted fairly often in the country's elections. Additionally, my socioeconomic background has provided me with access to information and resources that may influence my perception of the electoral process. Cultural relativism also influences my belief that the electoral system in my country is relatively fair compared to other cultures. Lastly, space and time, as well as the nuanced phrasing of the question, have influenced my choice. \n\n2"]}, {"persona": {"region": "Gharbia", "sex": "female", "age": 32, "country": "Egypt", "marital_status": "married", "education": "middle", "social_class": "upper middle class"}, "question": {"id": "Q224", "variant": 0}, "response": ["Based on the anthropological framework, my perspective as a married female from Gharbia, Egypt, is shaped by my cultural context, individual values, and socioeconomic background. In Egypt, there are certain cultural and societal norms that influence the way elections are conducted and votes are counted. Additionally, my personal experience and values as a member of the upper middle class have likely shaped my understanding of the political landscape and the fairness of elections. Considering these factors, I would say that votes are counted fairly often in the country's elections.\n\n2"]}, {"persona": {"region": "Gharbia", "sex": "male", "age": 27, "country": "Egypt", "marital_status": "married", "education": "higher", "social_class": "upper middle class"}, "question": {"id": "Q224", "variant": 0}, "response": ["Based on the anthropological framework, my answer to the question about the fairness of vote counting in the country's elections would be influenced by my individual values and personal experience, as well as my socioeconomic background and cultural context. Coming from a relatively privileged background in Gharbia, Egypt and having completed higher education, I am likely to have more trust in the fairness of the electoral process compared to those from lower socioeconomic backgrounds. Additionally, being part of the upper middle class, I may have more access to information and resources that shape my perception of the electoral process. Therefore, my answer would be:\n\n2) Fairly often"]}, {"persona": {"region": "Gharbia", "sex": "female", "age": 27, "country": "Egypt", "marital_status": "married", "education": "higher", "social_class": "lower middle class"}, "question": {"id": "Q224", "variant": 0}, "response": ["Based on the anthropological framework, as a married female from Gharbia, Egypt, my emic perspective is influenced by my personal experience and cultural context. I have witnessed and experienced the impact of socioeconomic background on the fairness of election processes. Moreover, my educational level has provided me with the critical thinking skills to analyze the political dynamics in my country. Considering the cultural relativism and the nuanced phrasing of the question, I would say the votes are counted fairly often in the country's elections.\n\n2"]}, {"persona": {"region": "Gharbia", "sex": "female", "age": 37, "country": "Egypt", "marital_status": "married", "education": "middle", "social_class": "upper middle class"}, "question": {"id": "Q224", "variant": 0}, "response": ["Based on the anthropological framework, my perspective as a married female from Gharbia, Egypt, is influenced by my cultural context, individual values, and socioeconomic background. In Egypt, there is a strong emphasis on family and community, and my personal experience has shown that there is a high level of importance placed on fairness and justice. Additionally, being part of the upper middle class, I have likely had more exposure to the political processes and discussions surrounding elections. Therefore, I believe that votes are counted fairly fairly often in the country's elections.\n\n2"]}, {"persona": {"region": "Gharbia", "sex": "male", "age": 28, "country": "Egypt", "marital_status": "married", "education": "higher", "social_class": "working class"}, "question": {"id": "Q224", "variant": 0}, "response": ["Based on the anthropological framework, as a married male from Gharbia, Egypt, age 28, with a working-class background and higher education, my perspective is heavily influenced by my cultural context, individual values, and personal experience. In Egypt, there is a history of political corruption and election irregularities, which has led to a lack of trust in the electoral process. Additionally, my socioeconomic background as a working-class individual may make me more aware of the challenges faced by marginalized communities in having their votes counted fairly. Therefore, I believe that votes are not often counted fairly in the country's elections.\n\n3"]}, {"persona": {"region": "Gharbia", "sex": "female", "age": 50, "country": "Egypt", "marital_status": "married", "education": "middle", "social_class": "upper middle class"}, "question": {"id": "Q224", "variant": 0}, "response": ["Based on my cultural context as a married female from Gharbia, Egypt, my understanding of the fairness of election vote counting is influenced by my socioeconomic background, individual values, and personal experience. As a member of the upper middle class, I have likely been exposed to more opportunities for education and financial stability, which may lead me to believe that votes are counted fairly more often than not in the country's elections. Additionally, my age and location also play a role in shaping my perception, as older individuals in my community may have experienced different political climates and have differing perspectives on this issue. Therefore, my answer to the question would be:\n\n2. Fairly often"]}, {"persona": {"region": "Gharbia", "sex": "male", "age": 39, "country": "Egypt", "marital_status": "single", "education": "higher", "social_class": "working class"}, "question": {"id": "Q224", "variant": 0}, "response": ["Based on the anthropological framework, as a single male from Gharbia, Egypt, my emic perspective on the fairness of election vote counting will be influenced by my cultural context, individual values, socioeconomic background, and space and time. Growing up in a working-class family in Gharbia, I have witnessed firsthand the impact of power dynamics in elections and how they can affect the fairness of vote counting. My personal experience and values lead me to believe that votes are not often counted fairly in the country's elections, as I have seen instances of corruption and manipulation within the electoral process. Additionally, my age and education level have allowed me to critically analyze and understand the complexities of the political system in Egypt, further shaping my perspective. Therefore, I choose option 3: Not often."]}, {"persona": {"region": "Gharbia", "sex": "female", "age": 45, "country": "Egypt", "marital_status": "married", "education": "higher", "social_class": "upper middle class"}, "question": {"id": "Q224", "variant": 0}, "response": ["Based on the anthropological framework, my personal experience and individual values play a significant role in how I perceive the fairness of the electoral process in my country. As a married female from Gharbia, Egypt, I am aware of the cultural context and the socioeconomic background of the society, which influences my understanding of the electoral process. Additionally, my higher education level has provided me with critical thinking skills to assess the fairness of the electoral system. Therefore, based on my perspective, I believe that votes are counted fairly in the country's elections very often.\n\n1"]}, {"persona": {"region": "Sharkia", "sex": "male", "age": 35, "country": "Egypt", "marital_status": "married", "education": "higher", "social_class": "upper middle class"}, "question": {"id": "Q224", "variant": 0}, "response": ["Based on the anthropological framework, my answer is influenced by my personal experience and socioeconomic background. As a married male from Sharkia, Egypt, I have likely been exposed to a certain level of privilege and access to resources due to my upper middle class status and higher education. This has likely shaped my perception of the fairness of election processes in the country. Additionally, my cultural context and age may also influence my belief in the legitimacy of the electoral system. Taking into account the nuanced phrasing of the question, I believe that votes are counted fairly often in the country's elections.\n\n2"]}, {"persona": {"region": "Sharkia", "sex": "female", "age": 55, "country": "Egypt", "marital_status": "married", "education": "middle", "social_class": "lower middle class"}, "question": {"id": "Q224", "variant": 0}, "response": ["Based on my emic perspective as a married female from Sharkia, Egypt, I am deeply embedded in the cultural context of my community. I have personally witnessed the impact of socioeconomic background on the fairness of election processes, and I understand that space and time also play a role in how votes are counted. As someone from the lower middle class, I have experienced firsthand the challenges that people in my community face in having their voices heard in elections. Additionally, as a 55-year-old woman who has completed middle education, I have seen how the nuances of the electoral process can disproportionately affect certain groups. Therefore, I believe that votes are not often counted fairly in the country's elections.\n\n3"]}, {"persona": {"region": "Sharkia", "sex": "female", "age": 27, "country": "Egypt", "marital_status": "married", "education": "middle", "social_class": "lower middle class"}, "question": {"id": "Q224", "variant": 0}, "response": ["Based on my cultural context as a married female from Sharkia, Egypt, my understanding of the fairness of election votes is influenced by my socioeconomic background, individual values, and personal experiences. As a member of the lower middle class, I have witnessed and experienced instances where votes are not always counted fairly in the country's elections. Additionally, my age and education level have provided me with the awareness and critical thinking skills to recognize the impact of unfair voting practices. Taking into account the emic and etic perspectives, cultural relativism, and the nuanced phrasing of the question, I believe that votes are not often counted fairly in the country's elections.\n3"]}, {"persona": {"region": "Sharkia", "sex": "female", "age": 52, "country": "Egypt", "marital_status": "married", "education": "middle", "social_class": "lower middle class"}, "question": {"id": "Q224", "variant": 0}, "response": ["Based on the anthropological framework, my emic perspective as a married female from Sharkia, Egypt, would be influenced by my cultural context, individual values, socioeconomic background, and space and time. As a middle-aged woman from a lower middle class background in Egypt, I have experienced and witnessed the impact of socioeconomic factors on the fairness of election processes. My personal experience and cultural context lead me to believe that votes are not often counted fairly in the country's elections. This belief is shaped by the nuanced understanding of the political and social dynamics in Egypt, where power and influence often overshadow fair electoral processes.\n\n3"]}, {"persona": {"region": "Sharkia", "sex": "male", "age": 36, "country": "Egypt", "marital_status": "married", "education": "middle", "social_class": "lower middle class"}, "question": {"id": "Q224", "variant": 0}, "response": ["Based on the anthropological framework, as a married male from Sharkia, Egypt, my emic perspective on the fairness of election vote counting is influenced by my cultural context, individual values, and socioeconomic background. In Egypt, there is a long history of political and social issues, and the cultural context of corruption and inequality in the electoral process has shaped my personal experience and values. As a member of the lower middle class, I am keenly aware of the socioeconomic disparities that impact the fairness of elections. Additionally, the nuance of the question implies that there may be some level of vote counting that is considered fair, even if not entirely so. Therefore, my answer is #3: Not often."]}, {"persona": {"region": "Sharkia", "sex": "female", "age": 20, "country": "Egypt", "marital_status": "single", "education": "middle", "social_class": "working class"}, "question": {"id": "Q224", "variant": 0}, "response": ["Based on the anthropological framework, my emic perspective as a single female from Sharkia, Egypt, with a middle education level and working-class background, is heavily influenced by my cultural context, individual values, and personal experience. In Egypt, there is a strong emphasis on community and family, and my personal experience and values lead me to believe that there are often discrepancies in the counting of votes in the country's elections. Additionally, my socioeconomic background as part of the working class also leads me to believe that there may be biases in the electoral process. Therefore, my answer to the question \"How often are votes counted fairly in the country's elections?\" would be (3) Not often."]}, {"persona": {"region": "Sharkia", "sex": "male", "age": 60, "country": "Egypt", "marital_status": "married", "education": "middle", "social_class": "working class"}, "question": {"id": "Q224", "variant": 0}, "response": ["Based on the anthropological framework, my perspective as a married male from Sharkia, Egypt, who is 60 years old, has a middle education level, and considers myself part of the working class, is influenced by my cultural context, socioeconomic background, and personal experience. In Egypt, there is a history of political unrest and allegations of electoral fraud, which may lead me to believe that votes are not often counted fairly in the country's elections. Additionally, as a working-class individual, I may feel marginalized and believe that the electoral process does not accurately represent the interests of people like me. Therefore, my perception is that votes are not often counted fairly in the country's elections.\n\n3"]}, {"persona": {"region": "Sharkia", "sex": "male", "age": 41, "country": "Egypt", "marital_status": "married", "education": "higher", "social_class": "upper middle class"}, "question": {"id": "Q224", "variant": 0}, "response": ["Based on my personal experience and socioeconomic background as a married male from Sharkia, Egypt, who has completed higher education and considers myself part of the upper middle class, I understand that the fairness of vote counting in the country's elections can vary based on cultural context, individual values, and personal experiences. Additionally, the emic and etic perspectives in the country can influence one's perception of the electoral process. Taking into account the nuance and the socio-economic background, I would say that votes are counted fairly often in the country's elections. \n\n2"]}, {"persona": {"region": "Sharkia", "sex": "female", "age": 23, "country": "Egypt", "marital_status": "married", "education": "middle", "social_class": "lower middle class"}, "question": {"id": "Q224", "variant": 0}, "response": ["Based on the anthropological framework, my emic perspective as a married female from Sharkia, Egypt, who is 23 years old and part of the lower middle class, is heavily influenced by my cultural context, individual values, and socioeconomic background. In Egypt, there is a history of political unrest and allegations of electoral fraud, which shapes my perception of the fairness of election counting. Additionally, my limited education level may impact my access to information and understanding of the electoral process. Taking into account these factors, I would choose option (3) Not often. \n\n3"]}, {"persona": {"region": "Sharkia", "sex": "male", "age": 49, "country": "Egypt", "marital_status": "married", "education": "higher", "social_class": "upper middle class"}, "question": {"id": "Q224", "variant": 0}, "response": ["Based on the anthropological framework, my emic perspective as a married male from Sharkia, Egypt, who is 49 years old, highly educated, and part of the upper middle class, is influenced by my cultural context, individual values, and socioeconomic background. In Egypt, the electoral processes are often influenced by power dynamics and socio-economic factors, leading to a lack of fairness and transparency in vote counting. Additionally, my personal experience and understanding of the political system in Egypt have shown me that votes are not often counted fairly in the country's elections. Therefore, my answer is (3) Not often."]}, {"persona": {"region": "Sharkia", "sex": "female", "age": 30, "country": "Egypt", "marital_status": "married", "education": "middle", "social_class": "upper middle class"}, "question": {"id": "Q224", "variant": 0}, "response": ["Based on the anthropological framework, as a married female from Sharkia, Egypt, my emic perspective is influenced by my cultural context, individual values, and socioeconomic background. In Egypt, there is a long history of political corruption and lack of transparency in elections, so my personal experience and cultural context lead me to believe that votes are not often counted fairly in the country's elections. Additionally, my upper middle-class status affords me access to information and resources that may make me more aware of issues related to political corruption. Therefore, my perception is that votes are not often counted fairly in the country's elections.\n\n3"]}, {"persona": {"region": "Sharkia", "sex": "male", "age": 39, "country": "Egypt", "marital_status": "married", "education": "higher", "social_class": "upper middle class"}, "question": {"id": "Q224", "variant": 0}, "response": ["Based on the anthropological framework, my perspective as a married male from Sharkia, Egypt, with a higher education and belonging to the upper middle class is influenced by my cultural context, individual values, and socioeconomic background. In Egypt, there has been a long history of political unrest and concerns about the fairness of elections. My personal experience and values lead me to believe that votes are not often counted fairly in the country's elections, as there have been numerous reports of irregularities and manipulation. Additionally, my socioeconomic background as part of the upper middle class may give me more access to information and a critical perspective on the political system. Therefore, I would choose option (3) Not often. \n\n3"]}, {"persona": {"region": "Sharkia", "sex": "female", "age": 26, "country": "Egypt", "marital_status": "married", "education": "middle", "social_class": "lower middle class"}, "question": {"id": "Q224", "variant": 0}, "response": ["Based on the anthropological framework, as a married female from Sharkia, Egypt, my emic perspective would be influenced by the cultural context of living in a lower middle-class community, where access to resources and political power is limited. My individual values and personal experience would lead me to believe that votes are not counted fairly in the country's elections, as I have witnessed and experienced firsthand the impact of socioeconomic background on political processes. Additionally, cultural relativism teaches me to question the fairness of the electoral system in Egypt, as it is important to recognize the nuance and complexity of political dynamics in our society. Therefore, my answer is: \n3"]}, {"persona": {"region": "Sharkia", "sex": "female", "age": 48, "country": "Egypt", "marital_status": "married", "education": "middle", "social_class": "lower middle class"}, "question": {"id": "Q224", "variant": 0}, "response": ["Based on the anthropological framework, my answer to the question about the fairness of vote counting in the country's elections is influenced by my emic perspective as a married female from Sharkia, Egypt. My cultural context and socioeconomic background as part of the lower middle class in Egypt play a significant role in shaping my perception. Additionally, my limited middle education level and age of 48 further influence my understanding of the electoral process. Considering these factors, I believe that votes are not often counted fairly in the country's elections.\n\n3"]}, {"persona": {"region": "Sharkia", "sex": "male", "age": 34, "country": "Egypt", "marital_status": "married", "education": "higher", "social_class": "upper middle class"}, "question": {"id": "Q224", "variant": 0}, "response": ["Based on my emic perspective as a married male from Sharkia, Egypt, I have observed that votes are often counted fairly in the country's elections. This is influenced by the cultural context of my community, where there is a strong emphasis on upholding democratic values and principles. Additionally, my individual values and personal experiences have led me to believe that the electoral process is generally fair and transparent. Furthermore, my socioeconomic background as a member of the upper middle class has allowed me to witness the implementation of proper electoral procedures in my local area. Taking into account the cultural relativism and nuance of the situation, I am confident in my choice that votes are counted fairly in the country's elections quite often.\n\n2"]}, {"persona": {"region": "Sharkia", "sex": "female", "age": 39, "country": "Egypt", "marital_status": "divorced", "education": "middle", "social_class": "lower middle class"}, "question": {"id": "Q224", "variant": 0}, "response": ["From the perspective of a divorced female from Sharkia, Egypt, with a lower-middle-class background and a middle education level, it is important to consider the cultural context and socioeconomic background when answering questions about the country's elections. The individual values and personal experience of this persona are likely to influence their perception of the fairness of election processes. Additionally, the emic and etic perspectives in this context may differ from those of individuals from higher socioeconomic backgrounds or different cultural contexts. Considering the nuances of the question and the influence of space and time on electoral processes, it is likely that this persona would perceive that votes are not often counted fairly in the country's elections. \n\n3"]}, {"persona": {"region": "Sharkia", "sex": "male", "age": 39, "country": "Egypt", "marital_status": "married", "education": "middle", "social_class": "upper middle class"}, "question": {"id": "Q224", "variant": 0}, "response": ["Based on the anthropological framework, my cultural context as a married male from Sharkia, Egypt, along with my age, education level, and socioeconomic background, will heavily influence my perception of the fairness of election vote counting in the country. My personal experience and individual values also play a significant role in shaping my understanding of this issue. Additionally, my emic perspective as a member of the upper middle class in Egypt will likely lead me to have a more positive view of the fairness of election vote counting, as this demographic is often more privileged and may have more trust in the political system. Taking all these factors into account, I would choose option (2) Fairly often, as my background and perspective would lead me to believe that while there may be some issues, overall the elections are conducted fairly. \n\n2"]}, {"persona": {"region": "Qaliubiya", "sex": "male", "age": 62, "country": "Egypt", "marital_status": "married", "education": "middle", "social_class": "working class"}, "question": {"id": "Q224", "variant": 0}, "response": ["Based on the anthropological framework, my perspective as a married male from Qaliubiya, Egypt, is heavily influenced by my cultural context, socioeconomic background, and personal experience. In Egypt, there is a long history of political corruption and manipulation of election results. As a member of the working class with a middle education level, I have seen firsthand the challenges and injustices faced by people like me in the electoral process. Therefore, I believe that votes are not often counted fairly in the country's elections.\n\n3"]}, {"persona": {"region": "Qaliubiya", "sex": "male", "age": 33, "country": "Egypt", "marital_status": "married", "education": "middle", "social_class": "working class"}, "question": {"id": "Q224", "variant": 0}, "response": ["Based on the anthropological framework, as a married male from Qaliubiya, Egypt, my emic perspective is influenced by my cultural context, individual values, and socioeconomic background. In Egypt, there is a history of political unrest and corruption, which affects the fairness of elections. My personal experience and values as a working-class individual also shape my perception. Additionally, the socioeconomic background of the region I come from may impact the way elections are conducted and perceived. Therefore, I believe that votes are not often counted fairly in the country's elections.\n\n3"]}, {"persona": {"region": "Qaliubiya", "sex": "male", "age": 62, "country": "Egypt", "marital_status": "married", "education": "higher", "social_class": "lower middle class"}, "question": {"id": "Q224", "variant": 0}, "response": ["Based on the anthropological framework, my perspective as a married male from Qaliubiya, Egypt, who is 62 years old and part of the lower middle class, is shaped by my cultural context, individual values, and socioeconomic background. In Egypt, there is a complex political and social landscape, and the fairness of election vote counting is influenced by various factors such as power dynamics, social hierarchies, and political affiliations. Additionally, my personal experience and knowledge of historical and contemporary events in Egypt have led me to believe that votes are not often counted fairly in the country's elections, as there have been numerous instances of electoral fraud and manipulation. Therefore, my answer to the question is:\n3"]}, {"persona": {"region": "Qaliubiya", "sex": "male", "age": 29, "country": "Egypt", "marital_status": "married", "education": "middle", "social_class": "working class"}, "question": {"id": "Q224", "variant": 0}, "response": ["Based on the anthropological framework, my emic perspective as a married male from Qaliubiya, Egypt, would be influenced by my cultural context, individual values, and socioeconomic background. In Egypt, there is a history of political corruption and manipulation of election results. My personal experience and the experiences of those around me have shown that votes are not often counted fairly in the country's elections. This is further reinforced by my working class background, as those in positions of power often prioritize their own interests over the fair representation of the working class. Therefore, my answer to the question would be:\n\n3) Not often"]}, {"persona": {"region": "Qaliubiya", "sex": "female", "age": 42, "country": "Egypt", "marital_status": "married", "education": "higher", "social_class": "working class"}, "question": {"id": "Q224", "variant": 0}, "response": ["Based on the anthropological framework, I, as a married female from Qaliubiya, Egypt, would consider the cultural context, individual values, and socioeconomic background in answering this question. In Egypt, there may be a sense of distrust in the electoral process due to historical and current political events. As a member of the working class, I may have personally experienced or heard about instances of unfair voting practices. Additionally, my higher education level may have exposed me to critical perspectives on the country's electoral system. Therefore, I would answer the question based on my nuanced understanding of the political and social context in Egypt, rather than solely relying on official statements or media reports.\n\n3"]}, {"persona": {"region": "Qaliubiya", "sex": "female", "age": 50, "country": "Egypt", "marital_status": "married", "education": "middle", "social_class": "lower middle class"}, "question": {"id": "Q224", "variant": 0}, "response": ["Based on the anthropological framework, my perspective on the fairness of vote counting in the country's elections is influenced by my cultural context, socioeconomic background, and personal experience. As a married female from Qaliubiya, Egypt, who is 50 years old and part of the lower middle class, I have witnessed and experienced firsthand the impact of socioeconomic disparities on the electoral process. The cultural context of Egypt, along with my personal experience, leads me to believe that votes are not often counted fairly in the country's elections, as there is a history of political corruption and manipulation. This belief is further reinforced by the emic perspective within my community and the nuanced understanding of the political landscape. Therefore, my answer to the question is:\n\n3) Not often"]}, {"persona": {"region": "Qaliubiya", "sex": "male", "age": 29, "country": "Egypt", "marital_status": "married", "education": "higher", "social_class": "lower middle class"}, "question": {"id": "Q224", "variant": 0}, "response": ["From the perspective of a married male from Qaliubiya, Egypt, who is 29 years old and part of the lower middle class, it is important to consider the cultural context and socio-economic background in answering the question of how often votes are counted fairly in the country's elections. In Egypt, there is a history of political unrest and allegations of election fraud, which can influence the perception of the fairness of the electoral process. Additionally, being part of the lower middle class may mean that access to accurate information about the electoral process is limited, which could also impact the perception of fairness. Taking into account the emic perspective of being an Egyptian citizen and the etic perspective of an outsider looking in, it is likely that votes are not often counted fairly in the country's elections due to historical and socio-economic factors.\n\n3"]}, {"persona": {"region": "Qaliubiya", "sex": "male", "age": 35, "country": "Egypt", "marital_status": "married", "education": "higher", "social_class": "working class"}, "question": {"id": "Q224", "variant": 0}, "response": ["Based on the anthropological framework, my perspective as a married male from Qaliubiya, Egypt, who is 35 years old, completed higher education, and considers myself part of the working class, is heavily influenced by my cultural context, individual values, and socioeconomic background. In Egypt, there are deep-rooted cultural and societal norms that impact the political system, and my personal experiences and values have shaped my perception of the fairness of elections. Additionally, as someone with a working-class background, I have witnessed firsthand the challenges and inequalities in the electoral process. Therefore, my perspective on the frequency of fair vote counting in the country's elections is influenced by these factors, leading me to choose option (3) Not often.\n\n3"]}, {"persona": {"region": "Qaliubiya", "sex": "female", "age": 40, "country": "Egypt", "marital_status": "married", "education": "middle", "social_class": "working class"}, "question": {"id": "Q224", "variant": 0}, "response": ["From an emic perspective, as a married female from Qaliubiya, Egypt, my cultural context and socioeconomic background play a significant role in how I perceive the fairness of election vote counting. Living in a working-class community in Egypt, I have witnessed firsthand the challenges and inequalities that exist within our society. Additionally, my age and educational level have shaped my understanding of the political system and the extent to which votes are counted fairly. I have personally experienced and heard stories from others about the irregularities and corruption that often occur during elections. Therefore, based on my personal experience and the cultural context in which I live, I believe that votes are not often counted fairly in the country's elections.\n\n3"]}, {"persona": {"region": "Qaliubiya", "sex": "female", "age": 48, "country": "Egypt", "marital_status": "divorced", "education": "lower", "social_class": "working class"}, "question": {"id": "Q224", "variant": 0}, "response": ["Based on the anthropological framework, my perspective as a divorced female from Qaliubiya, Egypt, is heavily influenced by my cultural context, individual values, and socioeconomic background. As a member of the working class with lower education, I have experienced firsthand the challenges and inequalities present in my society. Additionally, my personal experiences and values have shaped my perception of the fairness of electoral processes. Considering the cultural relativism, I believe that there are inherent biases and power dynamics at play in the electoral system that often result in votes not being counted fairly. Therefore, I would choose option (3) Not often as my answer."]}, {"persona": {"region": "Qaliubiya", "sex": "male", "age": 46, "country": "Egypt", "marital_status": "married", "education": "middle", "social_class": "working class"}, "question": {"id": "Q224", "variant": 0}, "response": ["Based on the anthropological framework, my perspective as a married male from Qaliubiya, Egypt, who is 46 years old, completed middle education level, and considers myself part of the working class, is heavily influenced by my cultural context, individual values, and socioeconomic background. In Egypt, there has historically been a lack of fair and transparent electoral processes, which is influenced by the country's political and socioeconomic landscape. Additionally, my working-class background means that I am more likely to have experienced or witnessed instances of electoral fraud or unfairness. Therefore, based on my personal experience and cultural context, I would choose option (3) Not often. \n\n3"]}, {"persona": {"region": "Qaliubiya", "sex": "male", "age": 47, "country": "Egypt", "marital_status": "married", "education": "higher", "social_class": "lower middle class"}, "question": {"id": "Q224", "variant": 0}, "response": ["From the perspective of a married male from Qaliubiya, Egypt, who is 47 years old, has completed higher education, and considers himself part of the lower middle class, the answer to the question of how often votes are counted fairly in the country's elections would be influenced by several factors. The cultural context of Egypt, with its history of political turmoil and allegations of election fraud, would likely lead to a skeptical view of the fairness of the electoral process. The individual values and personal experiences of someone in this demographic, particularly if they have faced socioeconomic challenges, may lead to a belief that votes are not often counted fairly. Additionally, the nuance of the question may lead to a more cautious response, as it implies that there may be some instances of fair vote counting, but not enough to warrant a response of \"fairly often.\" Therefore, the chosen answer would be:\n\n3) Not often"]}, {"persona": {"region": "Qaliubiya", "sex": "female", "age": 38, "country": "Egypt", "marital_status": "married", "education": "higher", "social_class": "working class"}, "question": {"id": "Q224", "variant": 0}, "response": ["From the perspective of a married female from Qaliubiya, Egypt, who is 38 years old, completed higher education, and considers herself part of the working class, the answer to the question of how often votes are counted fairly in the country's elections would be informed by the cultural context, individual values, and socioeconomic background. Living in Egypt, where there is a history of political unrest and allegations of electoral fraud, the cultural context and personal experience would lead this individual to believe that votes are not often counted fairly in the country's elections. Additionally, being part of the working class and having higher education would likely lead to a critical understanding of the political system and its challenges. Therefore, the chosen answer is:\n\n3) Not often"]}, {"persona": {"region": "Qaliubiya", "sex": "male", "age": 58, "country": "Egypt", "marital_status": "married", "education": "middle", "social_class": "working class"}, "question": {"id": "Q224", "variant": 0}, "response": ["Based on the emic and etic perspectives, cultural context, individual values and personal experience, socioeconomic background, and space and time, as a married male from Qaliubiya, Egypt, who is 58 years old and part of the working class, my understanding of how often votes are counted fairly in the country's elections is influenced by my personal experience and socioeconomic background. I have seen and heard of instances where votes are not counted fairly and have witnessed the impact of this on my community. Additionally, my age and working-class status have led me to be more critical of the electoral process. Therefore, from my perspective, votes are not often counted fairly in the country's elections.\n\n3"]}, {"persona": {"region": "Qaliubiya", "sex": "female", "age": 27, "country": "Egypt", "marital_status": "married", "education": "higher", "social_class": "working class"}, "question": {"id": "Q224", "variant": 0}, "response": ["Based on my emic perspective, I understand that the cultural context in Qaliubiya, Egypt, is significant in shaping the perception of fairness in elections. The socioeconomic background of being part of the working class also influences my view on this matter. As a 27-year-old woman with higher education, I am aware of the importance of fair elections for the progress of the country. Additionally, cultural relativism teaches me to be aware that my perspective may differ from others'. Therefore, I believe that votes are not often counted fairly in the country's elections due to the systemic issues and power dynamics at play. \n\n3"]}, {"persona": {"region": "Qaliubiya", "sex": "female", "age": 48, "country": "Egypt", "marital_status": "married", "education": "middle", "social_class": "upper middle class"}, "question": {"id": "Q224", "variant": 0}, "response": ["Based on my personal experience and socioeconomic background, I have observed that in my upper middle class community in Qaliubiya, Egypt, elections are often conducted fairly. This is also supported by the cultural context and nuance in the way elections are organized and monitored in our region. Additionally, my age and education level have provided me with a nuanced understanding of the electoral process in our country. Therefore, from my perspective, I would say that votes are counted fairly in the country's elections.\n\n1"]}, {"persona": {"region": "Giza", "sex": "female", "age": 19, "country": "Egypt", "marital_status": "single", "education": "middle", "social_class": "working class"}, "question": {"id": "Q224", "variant": 0}, "response": ["Based on my Emic and Etic perspective as a single female from Giza, Egypt, I understand that there are in-group ways of thinking about the fairness of election counting, as well as out-group perspectives. The cultural context in Egypt, with its history and current political climate, heavily influences my understanding of this question. As a working-class individual, my socioeconomic background also plays a role in shaping my perceptions. Additionally, my age and limited education level may impact how I view the fairness of election counting. Taking into account the nuanced phrasing of the question, I believe that votes are not often counted fairly in the country's elections.\n\n3"]}, {"persona": {"region": "Giza", "sex": "female", "age": 38, "country": "Egypt", "marital_status": "married", "education": "higher", "social_class": "lower middle class"}, "question": {"id": "Q224", "variant": 0}, "response": ["Based on the anthropological framework, my perspective as a married female from Giza, Egypt, who is 38 years old and part of the lower middle class, is heavily influenced by my cultural context, individual values, and socioeconomic background. In Egypt, there is a strong cultural emphasis on community and collective decision-making, but there are also deep-seated issues with corruption and inequality. As someone with a higher education level, I am aware of the challenges in our electoral system and the potential for votes to not be counted fairly, especially for those from lower socioeconomic backgrounds. Additionally, my personal experience and values lead me to believe that while progress has been made, there are still significant issues with electoral fairness in our country. Therefore, my choice is:\n\n3) Not often"]}, {"persona": {"region": "Beni Swaif/Beni Suef", "sex": "female", "age": 34, "country": "Egypt", "marital_status": "divorced", "education": "higher", "social_class": "lower class"}, "question": {"id": "Q224", "variant": 0}, "response": ["Based on the anthropological framework, my emic perspective as a divorced female from Beni Suef, Egypt, who is part of the lower class, is influenced by my cultural context, individual values, and socioeconomic background. In Egypt, there are significant political and social disparities that affect the fairness of elections. My personal experience and values lead me to believe that votes are not often counted fairly in the country's elections. This belief is shaped by the challenges faced by individuals in lower socioeconomic classes, including limited access to resources and political representation. Additionally, cultural relativism reminds us that there is no hierarchy of culture, and my understanding of the political system in Egypt may differ from those in other social groups or classes.\n\n3"]}, {"persona": {"region": "Beni Swaif/Beni Suef", "sex": "male", "age": 20, "country": "Egypt", "marital_status": "single", "education": "higher", "social_class": "working class"}, "question": {"id": "Q224", "variant": 0}, "response": ["Based on the anthropological framework, my answer is influenced by the cultural context of Egypt, where there is a long history of political unrest and uncertainty surrounding the fairness of elections. My socioeconomic background as a working-class individual also plays a role in my perception, as I am more likely to be affected by the policies and decisions made by the government. Additionally, my personal experiences and values have led me to believe that votes are not often counted fairly in the country's elections, as I have witnessed and experienced instances of corruption and manipulation within the political system. Therefore, my answer is:\n\n3"]}, {"persona": {"region": "Giza", "sex": "male", "age": 19, "country": "Egypt", "marital_status": "single", "education": "middle", "social_class": "upper middle class"}, "question": {"id": "Q224", "variant": 0}, "response": ["Based on the anthropological framework, my perspective on the fairness of vote counting in Egypt's elections is shaped by my cultural context, individual values, and socioeconomic background. As a young adult from Giza, Egypt, I have grown up in a society where there is a certain level of skepticism towards the fairness of the electoral process. The cultural relativism in Egypt leads to a nuanced understanding of the political system, where I have personally witnessed instances of questionable vote counting. Additionally, my socioeconomic background as part of the upper middle class has exposed me to discussions and experiences that have reinforced a belief that votes are not often counted fairly in the country's elections.\n\n3"]}, {"persona": {"region": "Giza", "sex": "female", "age": 33, "country": "Egypt", "marital_status": "married", "education": "middle", "social_class": "working class"}, "question": {"id": "Q224", "variant": 0}, "response": ["From the perspective of a married female from Giza, Egypt, who is 33 years old, completed middle education, and considers herself part of the working class, it is important to consider the cultural context, individual values, and socioeconomic background when answering this question. In Egypt, there is a cultural context of political unrest and skepticism towards the fairness of elections. Additionally, as a working-class individual with limited education, access to information and awareness of the electoral process may be restricted. Furthermore, the socioeconomic background of being part of the working class may lead to a perception of unfairness in the electoral process. Therefore, considering these factors, the answer would be (3) Not often."]}, {"persona": {"region": "Giza", "sex": "female", "age": 24, "country": "Egypt", "marital_status": "married", "education": "higher", "social_class": "working class"}, "question": {"id": "Q224", "variant": 0}, "response": ["Based on my emic perspective as a married female from Giza, Egypt, I have personally witnessed and experienced the impact of cultural context, individual values, and socioeconomic background on the fairness of elections. The cultural context in Egypt, including its political and social structures, greatly influences the perception of fair elections. Additionally, my personal experience and values as a working-class woman who has completed higher education have led me to believe that votes are not often counted fairly in the country's elections. This belief is further reinforced by the socioeconomic background of many individuals in Egypt, which often limits their ability to access fair representation and influence in the electoral process.\n\n3"]}, {"persona": {"region": "Giza", "sex": "male", "age": 50, "country": "Egypt", "marital_status": "married", "education": "higher", "social_class": "working class"}, "question": {"id": "Q224", "variant": 0}, "response": ["Based on the anthropological framework, my perspective as a married male from Giza, Egypt is shaped by my cultural context, socioeconomic background, and personal experience. In Egypt, there are longstanding cultural and political factors that influence the fairness of elections. The country has a complex history with political unrest and controversy surrounding elections. Additionally, as a member of the working class, I have experienced firsthand the impact of socioeconomic inequality on political processes. Therefore, I believe that votes are not often counted fairly in the country's elections.\n\n3"]}, {"persona": {"region": "Beni Swaif/Beni Suef", "sex": "female", "age": 26, "country": "Egypt", "marital_status": "married", "education": "higher", "social_class": "lower middle class"}, "question": {"id": "Q224", "variant": 0}, "response": ["Based on the anthropological framework, as a 26-year-old married female from Beni Swaif, Egypt, who has completed higher education and considers herself part of the lower middle class, my perspective on the fairness of vote counting in the country's elections would be influenced by my cultural context, individual values, and socioeconomic background. Living in a lower middle-class community in Egypt, I have witnessed firsthand the impact of socioeconomic factors on the electoral process. Additionally, my educational background has provided me with an understanding of the importance of fair and transparent elections. Therefore, I would choose option (3) Not often, as I believe that votes are not counted fairly in the country's elections."]}, {"persona": {"region": "Beni Swaif/Beni Suef", "sex": "male", "age": 40, "country": "Egypt", "marital_status": "single", "education": "lower", "social_class": "lower class"}, "question": {"id": "Q224", "variant": 0}, "response": ["From an emic perspective, as a lower class individual from Beni Suef, Egypt, my personal experience and socioeconomic background have shaped my understanding of the fairness of election processes. My limited education and lower socioeconomic status mean that I may not have had the same access to information and resources as those in higher classes, potentially impacting my trust in the fairness of electoral processes. Additionally, cultural relativism reminds me that my viewpoint may be different from those in higher classes or different regions of the country. Considering these factors, I would answer: \n\n3"]}, {"persona": {"region": "Beni Swaif/Beni Suef", "sex": "female", "age": 25, "country": "Egypt", "marital_status": "married", "education": "middle", "social_class": "lower middle class"}, "question": {"id": "Q224", "variant": 0}, "response": ["Based on the anthropological framework of emic and etic perspectives, cultural context, individual values and personal experience, socioeconomic background, cultural relativism, and space and time, I would like to answer the question from the perspective of a married female from Beni Suef, Egypt. As a woman from a lower middle class background with a middle education level, my understanding and perception of the fairness of election vote counting is influenced by my cultural context, personal experience, and socioeconomic background. In Egypt, there have been historical issues with election transparency and fairness, and my personal experience and the experiences of those around me have led me to believe that votes are not often counted fairly in the country's elections. This perspective is also influenced by the cultural relativism of understanding that different countries have different political systems and practices. Therefore, my answer to the question is:\n\n3"]}, {"persona": {"region": "Beni Swaif/Beni Suef", "sex": "female", "age": 21, "country": "Egypt", "marital_status": "single", "education": "middle", "social_class": "lower middle class"}, "question": {"id": "Q224", "variant": 0}, "response": ["Based on the framework of anthropological methods, my perspective on the fairness of vote counting in the country's elections is influenced by my emic perspective as a member of the lower middle class in Beni Swaif/Beni Suef, Egypt. My cultural context and socioeconomic background have taught me to be skeptical of the fairness of elections, as I have observed instances of corruption and bias in the past. Additionally, my individual values and personal experiences have led me to believe that the electoral process is not always conducted fairly. Furthermore, the concept of cultural relativism reminds me that my perception may be different from others, but I am confident in my understanding that votes are not often counted fairly in the country's elections. Therefore, I choose option (3) Not often.\n\n3"]}, {"persona": {"region": "Beni Swaif/Beni Suef", "sex": "male", "age": 48, "country": "Egypt", "marital_status": "married", "education": "middle", "social_class": "lower middle class"}, "question": {"id": "Q224", "variant": 0}, "response": ["In my cultural context, the fairness of votes in elections is a complex issue, influenced by various factors such as socioeconomic background, cultural relativism, and space and time. As a married male from Beni Swaif, Egypt, I have witnessed firsthand the influence of power dynamics and societal hierarchies on electoral processes. My lower middle class status has made me keenly aware of the challenges and limitations faced by individuals like me in having a fair say in elections. Additionally, my middle education level has provided me with some understanding of the political system and the potential for biases in the counting of votes. Taking into account these factors, I believe that votes are not often counted fairly in the country's elections.\n\n3"]}, {"persona": {"region": "Beni Swaif/Beni Suef", "sex": "female", "age": 57, "country": "Egypt", "marital_status": "married", "education": "middle", "social_class": "working class"}, "question": {"id": "Q224", "variant": 0}, "response": ["Based on the anthropological framework, my perspective on the fairness of vote counting in the country's elections is shaped by my cultural context, individual values, and socioeconomic background. As a married female from Beni Suef, Egypt, with a middle education level and part of the working class, I am influenced by the cultural norms and values of my community, which may prioritize stability and social order. Additionally, my personal experience and socioeconomic background may lead me to perceive the electoral process in a particular way. Therefore, I believe that votes are counted fairly often in the country's elections.\n\n2"]}, {"persona": {"region": "Beni Swaif/Beni Suef", "sex": "male", "age": 20, "country": "Egypt", "marital_status": "single", "education": "middle", "social_class": "working class"}, "question": {"id": "Q224", "variant": 0}, "response": ["Based on the anthropological framework, as a 20-year-old working class male from Beni Swaif, Egypt, my perspective on the fairness of vote counting in the country's elections would be influenced by a combination of factors. My cultural context and socioeconomic background may lead me to believe that votes are not often counted fairly due to potential corruption and unequal access to resources. My personal experience and individual values also play a role in shaping this perspective, as I may have witnessed or heard about instances of unfairness in the electoral process. Additionally, the nuance of the question leads me to choose option (3) Not often as it accurately reflects my understanding and experience with the electoral process in Egypt. \n\n3"]}, {"persona": {"region": "Giza", "sex": "female", "age": 59, "country": "Egypt", "marital_status": "married", "education": "higher", "social_class": "upper middle class"}, "question": {"id": "Q224", "variant": 0}, "response": ["Based on the anthropological framework, my perspective as a married female from Giza, Egypt, who is 59 years old and part of the upper middle class, is heavily influenced by my cultural context, individual values, and socioeconomic background. In Egypt, the political landscape and the fairness of elections are often influenced by various cultural and socioeconomic factors. Additionally, my personal experience and educational level have also shaped my understanding of the political system and the fairness of electoral processes. Therefore, my answer to the question is influenced by a combination of these factors and is not a simple yes or no response.\n\n3"]}, {"persona": {"region": "Giza", "sex": "female", "age": 38, "country": "Egypt", "marital_status": "single", "education": "higher", "social_class": "lower middle class"}, "question": {"id": "Q224", "variant": 0}, "response": ["Based on the anthropological framework, my emic perspective as a single female from Giza, Egypt, is shaped by my cultural context, individual values, and socioeconomic background. I have witnessed firsthand the impact of socioeconomic inequality on political processes and have experienced the challenges faced by women in accessing fair representation. My personal experience and lower middle-class status have led me to believe that votes are not often counted fairly in the country's elections, as those in power often prioritize their own interests over the needs of the marginalized. Therefore, my answer is:\n\n3"]}, {"persona": {"region": "Giza", "sex": "female", "age": 26, "country": "Egypt", "marital_status": "single", "education": "higher", "social_class": "working class"}, "question": {"id": "Q224", "variant": 0}, "response": ["Based on the anthropological framework, my emic perspective as a single female from Giza, Egypt, would be influenced by my cultural context, individual values, and personal experience. As a member of the working class, I have likely experienced firsthand the challenges and inequalities present in the electoral process in Egypt. Additionally, my higher education level may have provided me with a deeper understanding of the political system and its shortcomings. Considering the cultural relativism aspect, I understand that the perception of fair elections may vary across different groups within the country. Therefore, I would say that votes are not often counted fairly in the country's elections.\n\n3"]}, {"persona": {"region": "Giza", "sex": "male", "age": 39, "country": "Egypt", "marital_status": "married", "education": "middle", "social_class": "working class"}, "question": {"id": "Q224", "variant": 0}, "response": ["Based on my emic perspective as a married male from Giza, Egypt, and considering my cultural context, individual values, and socioeconomic background, I would answer that votes are not often counted fairly in the country's elections. This is based on my personal experience and the experiences of those in my community, as well as the socioeconomic and political factors that influence the electoral process in Egypt. Cultural relativism also plays a role in my understanding, as I recognize that perspectives on fairness and electoral processes may vary across different cultures. Additionally, my age and place as a 39-year-old man from Giza also inform my perspective on this issue. \n\n3"]}, {"persona": {"region": "Giza", "sex": "male", "age": 36, "country": "Egypt", "marital_status": "married", "education": "middle", "social_class": "working class"}, "question": {"id": "Q224", "variant": 0}, "response": ["Based on the anthropological framework, as a married male from Giza, Egypt, who is 36 years old and part of the working class, my perspective on the fairness of election vote counting would be influenced by my cultural context, individual values, and socioeconomic background. I would consider the political and social dynamics of my country, the impact of my limited education, and my working-class status in influencing my perception of the fairness of election vote counting. Considering the cultural relativism, I would acknowledge that Egypt has its own unique political and social landscape, and my personal experiences and values would lead me to believe that votes are not often counted fairly in the country's elections.\n\n3"]}, {"persona": {"region": "Giza", "sex": "female", "age": 30, "country": "Egypt", "marital_status": "single", "education": "higher", "social_class": "lower class"}, "question": {"id": "Q224", "variant": 0}, "response": ["Based on the anthropological framework, as a single female from Giza, Egypt, my emic perspective would be influenced by my cultural context, individual values and personal experience, socioeconomic background, and the space and time I inhabit. In Egypt, there are cultural and societal norms that impact the fairness of election processes, especially for women and those from lower socioeconomic backgrounds. Additionally, my personal experiences and values as a woman from the lower class would lead me to believe that votes are not often counted fairly in the country's elections, as there are systemic barriers and biases that affect the electoral process. Therefore, my answer would be:\n\n3"]}, {"persona": {"region": "Giza", "sex": "female", "age": 24, "country": "Egypt", "marital_status": "single", "education": "higher", "social_class": "lower class"}, "question": {"id": "Q224", "variant": 0}, "response": ["Based on the anthropological framework, as a single female from Giza, Egypt, my emic perspective is heavily influenced by my cultural context as a member of the lower class in Egypt. My personal experience and socioeconomic background have shaped my understanding of the fairness of election processes. I have witnessed firsthand the struggles and inequalities faced by individuals like myself in the electoral process. Additionally, my age and place of residence in Egypt further contribute to my perspective on this issue. Therefore, my answer to the question would be:\n\n3"]}, {"persona": {"region": "Giza", "sex": "male", "age": 65, "country": "Egypt", "marital_status": "married", "education": "middle", "social_class": "working class"}, "question": {"id": "Q224", "variant": 0}, "response": ["Based on the anthropological framework, my understanding and answer are influenced by my emic perspective as a married male from Giza, Egypt, and my etic perspective as part of the working class. The cultural context of Egypt, including its political history and the current socioeconomic background, plays a significant role in shaping my perception of the fairness of election vote counting. Additionally, my individual values and personal experiences as a 65-year-old with a middle education level also contribute to my understanding. Considering cultural relativism, I recognize that my perspective may differ from others, and I must acknowledge the nuanced phrasing of the question. Therefore, based on my understanding and experience, I believe that votes are not often counted fairly in the country's elections.\n\n3"]}, {"persona": {"region": "Giza", "sex": "female", "age": 56, "country": "Egypt", "marital_status": "married", "education": "middle", "social_class": "working class"}, "question": {"id": "Q224", "variant": 0}, "response": ["Based on the anthropological framework, as a 56-year-old married female from Giza, Egypt, with a middle education level and part of the working class, my answer is influenced by my cultural context, socioeconomic background, and personal experience. Egypt has a complex political history and there have been instances of election irregularities. Being part of the working class, I have witnessed and experienced firsthand the challenges and disparities in the electoral process. Additionally, my age and experience have provided me with a nuanced understanding of the political landscape in Egypt. Taking these factors into consideration, I would answer:\n3"]}, {"persona": {"region": "Giza", "sex": "male", "age": 31, "country": "Egypt", "marital_status": "married", "education": "higher", "social_class": "lower middle class"}, "question": {"id": "Q224", "variant": 0}, "response": ["Based on the anthropological framework, as a married male from Giza, Egypt, my emic perspective is influenced by my cultural context, individual values, and socioeconomic background. As a member of the lower middle class, I have experienced firsthand the challenges and disparities in the electoral process. Additionally, my age and education level have exposed me to various perspectives on the issue. Therefore, I believe that votes are not often counted fairly in the country's elections.\n\n3"]}, {"persona": {"region": "Giza", "sex": "male", "age": 28, "country": "Egypt", "marital_status": "single", "education": "middle", "social_class": "working class"}, "question": {"id": "Q224", "variant": 0}, "response": ["Based on the anthropological framework, my response to the question would be heavily influenced by my cultural context, individual values, and socioeconomic background. As a working-class male from Giza, Egypt, I am likely to have experienced firsthand the impact of socioeconomic disparities on political processes. Additionally, my middle education level and age would shape my understanding of the political landscape in Egypt. Considering the emic and etic perspectives, I would be inclined to believe that votes are not often counted fairly in the country's elections due to the historical and ongoing power dynamics present in Egyptian politics.\n\n3"]}, {"persona": {"region": "Giza", "sex": "male", "age": 47, "country": "Egypt", "marital_status": "married", "education": "middle", "social_class": "lower middle class"}, "question": {"id": "Q224", "variant": 0}, "response": ["From the perspective of a married male from Giza, Egypt, who is 47 years old, has completed middle education, and considers himself part of the lower middle class, it is important to consider the cultural context, individual values, and socioeconomic background when answering the question about the fairness of vote counting in the country's elections. In Egypt, there is a longstanding cultural and political context of government control and manipulation of elections. As a member of the lower middle class, I have personally experienced and witnessed instances of unfair vote counting in elections, which is also supported by the experiences of others in my community. Therefore, based on my personal experience and the socio-political context of Egypt, I would choose option (3) Not often, as I believe that votes are not counted fairly in the country's elections. \n\n3"]}, {"persona": {"region": "Giza", "sex": "male", "age": 26, "country": "Egypt", "marital_status": "single", "education": "middle", "social_class": "lower middle class"}, "question": {"id": "Q224", "variant": 0}, "response": ["Based on the anthropological framework, the emic perspective of a single male from Giza, Egypt, who completed middle education level and considers himself part of the lower middle class, would be influenced by his cultural context, individual values, and socioeconomic background. In Egypt, there may be a level of skepticism regarding the fairness of election vote counting due to historical and contemporary political issues. As a lower middle class individual, he may feel marginalized in the political process, leading to a more critical view of the electoral system. Additionally, his personal experiences and values may contribute to a belief that votes are not often counted fairly. Considering these factors, the most likely response from this perspective would be (3) Not often."]}, {"persona": {"region": "Giza", "sex": "male", "age": 48, "country": "Egypt", "marital_status": "married", "education": "middle", "social_class": "upper middle class"}, "question": {"id": "Q224", "variant": 0}, "response": ["From the perspective of a married male from Giza, Egypt, with a middle education level and belonging to the upper middle class, the answer to the question of how often votes are counted fairly in the country's elections would be \"Not often.\" This choice is based on the cultural context, where there is a general perception of corruption and lack of transparency in the electoral process. Additionally, the socioeconomic background plays a role in this decision, as individuals from the upper middle class may have more exposure to the political system and are likely to be more aware of the issues related to the fairness of elections. Furthermore, the personal experience and individual values of this persona may lead them to believe that the electoral system is not always fair and transparent. Therefore, the chosen answer reflects the nuanced understanding of the cultural and social context in Egypt. \n\n3"]}, {"persona": {"region": "Menya", "sex": "male", "age": 61, "country": "Egypt", "marital_status": "married", "education": "middle", "social_class": "working class"}, "question": {"id": "Q224", "variant": 0}, "response": ["From the perspective of a married male from Menya, Egypt, who is 61 years old, has completed middle education, and considers himself part of the working class, several factors come into play when answering the question about the fairness of vote counting in the country's elections. Firstly, the cultural context in Egypt, including the historical and political background, significantly influences perceptions of the electoral process. Additionally, the individual's socioeconomic background as a member of the working class may lead to a more critical view of the fairness of vote counting. Furthermore, the individual's personal experience and values, shaped by living in Menya, Egypt, also play a significant role in shaping his perspective on this matter. Overall, the nuanced phrasing of the question and the cultural relativism inherent in understanding different perspectives must be considered. Given these factors, the chosen answer is:\n\n3) Not often"]}, {"persona": {"region": "Menya", "sex": "male", "age": 41, "country": "Egypt", "marital_status": "married", "education": "middle", "social_class": "lower middle class"}, "question": {"id": "Q224", "variant": 0}, "response": ["Based on the anthropological framework, my answer to the question of how often votes are counted fairly in the country's elections would be influenced by my individual values and personal experience, as well as my socioeconomic background. Being from Menya, Egypt, and part of the lower middle class, I have likely experienced or witnessed instances of unfairness and corruption in the electoral process. Additionally, my middle education level may have exposed me to discussions and information about the political environment in Egypt. Therefore, based on these factors, I would choose option (3) Not often."]}, {"persona": {"region": "Menya", "sex": "female", "age": 43, "country": "Egypt", "marital_status": "married", "education": "higher", "social_class": "working class"}, "question": {"id": "Q224", "variant": 0}, "response": ["Based on my personal experience and socioeconomic background as a married female from Menya, Egypt, I understand that the fairness of vote counting in the country's elections is influenced by the cultural context, individual values, and socioeconomic background. As a member of the working class, I have seen that the electoral process can be influenced by power dynamics and economic interests, leading to unfair vote counting at times. Additionally, the cultural relativism in Egypt means that there may be different perspectives on what constitutes fair vote counting. Therefore, considering these factors, I would say that votes are not often counted fairly in the country's elections.\n\n3"]}, {"persona": {"region": "Menya", "sex": "male", "age": 57, "country": "Egypt", "marital_status": "married", "education": "middle", "social_class": "lower middle class"}, "question": {"id": "Q224", "variant": 0}, "response": ["In considering the question of how often votes are counted fairly in the country's elections, it is important to take into account the cultural context of Menya, Egypt. As a married male from this region, I am aware that there are complexities in the electoral process and that fairness may be influenced by various factors such as socioeconomic background, cultural relativism, and the nuances of the question. Additionally, my age and educational level contribute to my understanding of the electoral system. Based on my personal experience and observation, I believe that votes are not often counted fairly in the country's elections. This belief is shaped by the collective experiences of individuals within my community and is influenced by the socioeconomic background and cultural context of our region.\n\n3"]}, {"persona": {"region": "Menya", "sex": "male", "age": 42, "country": "Egypt", "marital_status": "divorced", "education": "middle", "social_class": "lower middle class"}, "question": {"id": "Q224", "variant": 0}, "response": ["Based on my personal experience and socioeconomic background as a divorced male from Menya, Egypt, I am aware that there are often challenges with fairness in our country's elections. The cultural context and socioeconomic background of where I come from also play a significant role in shaping my perceptions. Additionally, the emic and etic perspectives within my community highlight the ongoing issues with electoral fairness. Therefore, I believe that votes are not often counted fairly in the country's elections.\n\n3"]}, {"persona": {"region": "Menya", "sex": "female", "age": 59, "country": "Egypt", "marital_status": "married", "education": "middle", "social_class": "upper middle class"}, "question": {"id": "Q224", "variant": 0}, "response": ["Based on the anthropological framework, my emic perspective as a married female from Menya, Egypt, who is 59 years old and part of the upper middle class, is heavily influenced by my cultural context, individual values, and socioeconomic background. In Egypt, there is a strong emphasis on respecting authority and hierarchy, and this has a significant impact on the political system. Additionally, my age and socioeconomic background provide me with a certain level of privilege and access to information. Therefore, I believe that votes are counted fairly often in the country's elections because the government strives to maintain order and stability, and my personal experiences and values lead me to perceive the electoral process in a positive light. \n\n2"]}, {"persona": {"region": "Menya", "sex": "female", "age": 31, "country": "Egypt", "marital_status": "married", "education": "middle", "social_class": "working class"}, "question": {"id": "Q224", "variant": 0}, "response": ["Based on the anthropological framework, my emic perspective as a married female from Menya, Egypt, would be influenced by my cultural context, individual values, and socioeconomic background. In Egypt, there are complex power dynamics and historical influences that impact the fairness of elections. As a working-class woman with a middle education, I am aware of the challenges faced by people like me in having our voices heard in the political process. Additionally, my cultural relativism allows me to understand that fairness is subjective and influenced by societal norms. Therefore, I would answer the question from my perspective by choosing:\n\n2) Fairly often"]}, {"persona": {"region": "Menya", "sex": "male", "age": 55, "country": "Egypt", "marital_status": "single", "education": "middle", "social_class": "working class"}, "question": {"id": "Q224", "variant": 0}, "response": ["From an emic perspective, as a working-class individual from Menya, Egypt, my cultural context and socioeconomic background greatly influence my perception of the fairness of election vote counting. The cultural relativism in Egypt and the nuanced phrasing of the question also play a role in my interpretation. In my experience, I have observed that votes are not often counted fairly in the country's elections. This is influenced by the socioeconomic background and cultural context of Egypt, where corruption and inequality are prevalent. Additionally, the space and time factor also plays a role, as I have witnessed this pattern over the years. Based on these factors, I choose option 3: Not often. \n\n3"]}, {"persona": {"region": "Menya", "sex": "female", "age": 28, "country": "Egypt", "marital_status": "married", "education": "higher", "social_class": "lower middle class"}, "question": {"id": "Q224", "variant": 0}, "response": ["Based on the anthropological framework, as a married female from Menya, Egypt, my emic perspective on the fairness of election vote counting is influenced by my cultural context, individual values, and socioeconomic background. I am aware that cultural relativism plays a significant role in shaping my understanding of the political system in Egypt. Additionally, my lower middle-class status and educational background have given me insight into the challenges faced by individuals like myself in the electoral process. Taking into account the nuanced phrasing of the question, I believe that votes are not often counted fairly in the country's elections due to various socioeconomic and political factors. \n\n3"]}, {"persona": {"region": "Menya", "sex": "male", "age": 24, "country": "Egypt", "marital_status": "single", "education": "middle", "social_class": "working class"}, "question": {"id": "Q224", "variant": 0}, "response": ["Based on my emic perspective as a working-class male from Menya, Egypt, I have observed that the cultural context and socioeconomic background play a significant role in the fairness of elections. The cultural relativism in Egypt means that there are different understandings of what constitutes fair and unfair election practices. Additionally, my individual values and personal experiences have led me to believe that votes are not often counted fairly in the country's elections. The socioeconomic background of the working class, including myself, often leads to marginalization and lack of influence in the political process. Therefore, I choose option (3) Not often."]}, {"persona": {"region": "Menya", "sex": "female", "age": 23, "country": "Egypt", "marital_status": "married", "education": "middle", "social_class": "working class"}, "question": {"id": "Q224", "variant": 0}, "response": ["Based on my cultural context, as a married female from Menya, Egypt, I am aware that the political system in my country is not always fair and there are often accusations of vote manipulation. My individual values and personal experiences also lead me to believe that the elections are not always counted fairly, especially for those of us from the working class. Additionally, my socioeconomic background as a member of the working class further influences my perception that votes are not often counted fairly. Considering the cultural relativism and the nuance of the question, I would say that votes are not often counted fairly in the country's elections.\n\n3"]}, {"persona": {"region": "Menya", "sex": "male", "age": 27, "country": "Egypt", "marital_status": "single", "education": "middle", "social_class": "lower middle class"}, "question": {"id": "Q224", "variant": 0}, "response": ["In Menya, Egypt, the cultural context and socioeconomic background play a crucial role in understanding the fairness of election vote counting. As a lower middle class individual who has completed only middle education, my access to information and understanding of the political processes may be limited. Additionally, the cultural relativism in Egypt means that there may be different standards for what is considered fair in elections. Given these factors, I would say that votes are not often counted fairly in the country's elections.\n\n3"]}, {"persona": {"region": "Asyut", "sex": "male", "age": 30, "country": "Egypt", "marital_status": "married", "education": "middle", "social_class": "working class"}, "question": {"id": "Q224", "variant": 0}, "response": ["Based on the anthropological framework, as a married male from Asyut, Egypt, I am deeply rooted in my cultural context, which heavily influences my perspective on the fairness of elections. My socioeconomic background as a working-class individual also plays a significant role in shaping my view. Additionally, my personal experiences and values have led me to believe that votes are not often counted fairly in the country's elections. This understanding is further reinforced by the nuanced phrasing of the question, which prompts me to consider the frequency of fair vote counting in a realistic and practical manner.\n\n3"]}, {"persona": {"region": "Asyut", "sex": "female", "age": 26, "country": "Egypt", "marital_status": "married", "education": "middle", "social_class": "working class"}, "question": {"id": "Q224", "variant": 0}, "response": ["Based on the anthropological framework, my perspective as a married female from Asyut, Egypt, is heavily influenced by my cultural context, socioeconomic background, and personal experiences. As a member of the working class, I have observed and experienced firsthand the challenges and disparities that exist within our society. Additionally, my middle education level has provided me with some understanding of political processes and the importance of fair elections. However, I also recognize that cultural relativism and nuance play a role in shaping my perspective, as the concept of fairness may be interpreted differently in different cultural contexts. Therefore, I believe that votes are not often counted fairly in the country's elections.\n3"]}, {"persona": {"region": "Asyut", "sex": "male", "age": 32, "country": "Egypt", "marital_status": "single", "education": "higher", "social_class": "lower middle class"}, "question": {"id": "Q224", "variant": 0}, "response": ["Based on my personal experience and socioeconomic background as a single male from Asyut, Egypt, I have witnessed and heard of instances where votes are not always counted fairly in the country's elections. The cultural context and nuance of the political system in Egypt, combined with my individual values and personal experiences, lead me to believe that votes are not often counted fairly in elections. Additionally, the emic and etic perspectives of the political environment in Egypt contribute to my understanding that the process of vote counting is not always transparent and fair. Therefore, based on my knowledge and experience, I choose option 3: Not often."]}, {"persona": {"region": "Asyut", "sex": "female", "age": 21, "country": "Egypt", "marital_status": "married", "education": "middle", "social_class": "working class"}, "question": {"id": "Q224", "variant": 0}, "response": ["Based on the anthropological framework, as a married female from Asyut, Egypt, I am influenced by the cultural context of my community, where there may be limited access to education and information about the electoral process. My individual values and personal experiences also play a role, as I may have witnessed or heard about instances of unfair vote counting in my community. Additionally, my socioeconomic background as part of the working class may lead me to believe that votes are not often counted fairly, as there may be power dynamics at play that disadvantage people like me. Considering all these factors, I would choose option (3) Not often.\n\n3"]}, {"persona": {"region": "Asyut", "sex": "female", "age": 30, "country": "Egypt", "marital_status": "married", "education": "higher", "social_class": "working class"}, "question": {"id": "Q224", "variant": 0}, "response": ["In considering the question of how often votes are counted fairly in the country's elections from the perspective of a married female from Asyut, Egypt, it is important to take into account the cultural context, individual values and personal experience, and socioeconomic background. In Egypt, there has been a history of political and social unrest, and the cultural context of the country has a significant impact on the fairness of elections. As a member of the working class, I have personally witnessed and experienced the challenges and inequalities that exist within the political system. Therefore, based on my personal experience and understanding of the socioeconomic and cultural context, I would argue that votes are not often counted fairly in the country's elections.\n\n3"]}, {"persona": {"region": "Asyut", "sex": "female", "age": 42, "country": "Egypt", "marital_status": "married", "education": "higher", "social_class": "lower middle class"}, "question": {"id": "Q224", "variant": 0}, "response": ["Based on the anthropological framework, my emic perspective as a married female from Asyut, Egypt, who is 42 years old and part of the lower middle class, leads me to consider the cultural context, individual values, and socioeconomic background. In Egypt, there is a long history of political unrest and corruption, which has a significant impact on the fairness of elections. As someone with higher education, I am aware of the socioeconomic disparities and the influence of power dynamics on the electoral process. Additionally, my personal experience and values lead me to believe that votes are not often counted fairly in the country's elections, as I have witnessed and experienced the impact of corruption and inequality in the political system.\n\n3"]}, {"persona": {"region": "Sohag", "sex": "male", "age": 63, "country": "Egypt", "marital_status": "married", "education": "middle", "social_class": "lower middle class"}, "question": {"id": "Q224", "variant": 0}, "response": ["Based on the anthropological framework, my perspective as a married male from Sohag, Egypt, who is 63 years old and part of the lower middle class, is heavily influenced by my cultural context, individual values, and socioeconomic background. In Egypt, there is a strong sense of community and trust in the government, which influences my perception of how often votes are counted fairly in the country's elections. Additionally, my lower middle class status may lead me to have a more skeptical view of the fairness of elections due to potential economic and social disparities. Therefore, based on my personal experience and cultural context, I would choose option (3) Not often. \n\n3"]}, {"persona": {"region": "Sohag", "sex": "male", "age": 27, "country": "Egypt", "marital_status": "married", "education": "middle", "social_class": "working class"}, "question": {"id": "Q224", "variant": 0}, "response": ["Based on the anthropological framework, my response is influenced by my cultural context, individual values, and socioeconomic background. As a married male from Sohag, Egypt, I have experienced firsthand the impact of socioeconomic factors on political processes. The working class in Egypt often feels marginalized and excluded from fair representation in elections. Additionally, my personal experience and values lead me to believe that votes are not often counted fairly in the country's elections, as there are often reports of irregularities and manipulation. Therefore, I choose option 3: Not often."]}, {"persona": {"region": "Sohag", "sex": "male", "age": 56, "country": "Egypt", "marital_status": "married", "education": "higher", "social_class": "upper middle class"}, "question": {"id": "Q224", "variant": 0}, "response": ["From an anthropological perspective, my cultural context as a married male from Sohag, Egypt, heavily influences my perception of the fairness of election processes. In Egypt, there is a long history of political and social factors that impact the way elections are conducted. Additionally, my higher education level has provided me with a nuanced understanding of the political and social dynamics at play in my country. As a member of the upper middle class, I have access to different resources and networks that may shape my perception of the fairness of election processes. Considering these factors, I would select option (3) Not often."]}, {"persona": {"region": "Sohag", "sex": "male", "age": 51, "country": "Egypt", "marital_status": "married", "education": "higher", "social_class": "lower middle class"}, "question": {"id": "Q224", "variant": 0}, "response": ["From the perspective of a married male from Sohag, Egypt, who is 51 years old, has completed higher education, and considers himself part of the lower middle class, there are several factors that influence my answer to this question. First, the cultural context in Egypt is important to consider, as the country has a long history of political turmoil and controversy surrounding its elections. Additionally, my socioeconomic background as part of the lower middle class may lead me to believe that votes are not often counted fairly, as there may be a perception of corruption and manipulation within the political system. Furthermore, my personal experience and values may lead me to be skeptical of the fairness of elections. Finally, the nuance of the question also plays a role, as the wording \"fairly often\" may imply that there is some level of fairness in the counting of votes, which may not align with my perception. Taking all of these factors into consideration, my answer would be:\n3. Not often"]}, {"persona": {"region": "Sohag", "sex": "female", "age": 26, "country": "Egypt", "marital_status": "married", "education": "higher", "social_class": "working class"}, "question": {"id": "Q224", "variant": 0}, "response": ["Based on the anthropological framework outlined, my perspective is heavily influenced by my cultural context, individual values, and socioeconomic background. As a married female from Sohag, Egypt, my experiences and values are shaped by the working class environment and the cultural norms of my community. Additionally, my higher education has provided me with a critical understanding of political processes and the importance of fair elections. Considering the historical and political context of Egypt, I would argue that votes are not often counted fairly in the country's elections. This perspective is informed by my personal experiences, cultural context, and socioeconomic background. \n\n3"]}, {"persona": {"region": "Sohag", "sex": "female", "age": 29, "country": "Egypt", "marital_status": "married", "education": "higher", "social_class": "upper middle class"}, "question": {"id": "Q224", "variant": 0}, "response": ["Based on my personal experience and socioeconomic background, I believe that votes are counted fairly often in the country's elections. As a married female from Sohag, Egypt, who has completed higher education and considers herself part of the upper middle class, I have witnessed a level of fairness and transparency in the electoral process. Additionally, the cultural context and nuance of the question leads me to believe that, in my specific region and social circle, there is a general trust in the electoral system. Therefore, I am confident in my choice of option (2) Fairly often."]}, {"persona": {"region": "Sohag", "sex": "male", "age": 51, "country": "Egypt", "marital_status": "married", "education": "middle", "social_class": "lower middle class"}, "question": {"id": "Q224", "variant": 0}, "response": ["Based on the anthropological framework, my perspective as a married male from Sohag, Egypt, is heavily influenced by my cultural context, socioeconomic background, and personal experience. In Egypt, there is a long history of political corruption and manipulation of election processes. As a member of the lower middle class, I have seen firsthand how this affects my community and my own ability to have a fair say in the democratic process. Additionally, my age and educational level have provided me with the knowledge and understanding to critically assess the fairness of elections. Therefore, I believe that votes are not often counted fairly in the country's elections.\n\n3"]}, {"persona": {"region": "Qena", "sex": "male", "age": 32, "country": "Egypt", "marital_status": "single", "education": "middle", "social_class": "working class"}, "question": {"id": "Q224", "variant": 0}, "response": ["Based on the anthropological framework, my emic perspective as a working-class individual from Qena, Egypt, leads me to believe that votes are not often counted fairly in the country's elections. This belief is influenced by my cultural context, where there is a history of corruption and distrust in the electoral process. Additionally, my socioeconomic background and personal experiences have shown me instances of manipulation and bias in elections. Therefore, my answer is 3.\n\n3"]}, {"persona": {"region": "Qena", "sex": "male", "age": 54, "country": "Egypt", "marital_status": "married", "education": "middle", "social_class": "lower middle class"}, "question": {"id": "Q224", "variant": 0}, "response": ["Based on my emic perspective as a married male from Qena, Egypt, I believe that the cultural context and socioeconomic background play a significant role in the fairness of election votes. In my community, there are often rumors and suspicions of unfair vote counting, especially for those in the lower middle class. My personal experience and values also lead me to believe that votes are not often counted fairly, as I have seen instances of manipulation and corruption firsthand. Additionally, cultural relativism reminds me that my perspective may be different from others, but in my space and time, the nuance of the situation leads me to believe that votes are not often counted fairly in the country's elections.\n\n3"]}, {"persona": {"region": "Qena", "sex": "male", "age": 25, "country": "Egypt", "marital_status": "single", "education": "lower", "social_class": "lower class"}, "question": {"id": "Q224", "variant": 0}, "response": ["Based on the emic and etic perspectives, my personal experience growing up in Qena, Egypt as a lower-class individual has shaped my understanding of how elections are conducted. The cultural context of my upbringing and the socioeconomic background I come from have influenced my perception of the fairness of elections. Additionally, the space and time I have lived in Qena and my age have also played a role in shaping my perspective. I believe that votes are not often counted fairly in the country's elections. This belief is influenced by the cultural relativism that I adhere to, as well as the nuance of the political landscape in Egypt.\n\n3"]}, {"persona": {"region": "Aswan", "sex": "male", "age": 34, "country": "Egypt", "marital_status": "single", "education": "middle", "social_class": "lower class"}, "question": {"id": "Q224", "variant": 0}, "response": ["Based on the anthropological framework, my perspective as a single male from Aswan, Egypt, who is 34 years old and part of the lower class, is heavily influenced by my cultural context, socioeconomic background, and personal experience. In Egypt, the cultural context of politics is deeply rooted in history and tradition, with a strong influence from the government. As someone from the lower class, I have experienced firsthand the challenges and injustices that come with being part of this socioeconomic group, including the lack of fair representation in elections. Additionally, my personal experience and the experiences of those around me have shown that votes are not often counted fairly in the country's elections, leading to a lack of trust in the electoral process. Therefore, my perspective on the fairness of vote counting in the country's elections is influenced by these factors, leading me to choose option (3) Not often.\n\n3"]}, {"persona": {"region": "Aswan", "sex": "female", "age": 31, "country": "Egypt", "marital_status": "married", "education": "middle", "social_class": "lower middle class"}, "question": {"id": "Q224", "variant": 0}, "response": ["Based on the anthropological framework, my emic perspective as a married female from Aswan, Egypt, would be influenced by my cultural context, individual values, and socioeconomic background. In Egypt, there is a long history of political corruption and manipulation of elections, leading to a lack of trust in the fairness of the electoral process. Additionally, as a member of the lower middle class with limited access to resources and political influence, I would likely perceive that votes are not often counted fairly in the country's elections due to the power dynamics at play. Therefore, my answer would be (3) Not often."]}, {"persona": {"region": "Aswan", "sex": "female", "age": 39, "country": "Egypt", "marital_status": "married", "education": "middle", "social_class": "working class"}, "question": {"id": "Q224", "variant": 0}, "response": ["Based on the anthropological framework, my perspective as a married female from Aswan, Egypt, is heavily influenced by my cultural context, socioeconomic background, and personal experience. As a member of the working class, I have witnessed firsthand the challenges and injustices faced by individuals in my community. Additionally, my middle education level has provided me with a critical understanding of the political and social dynamics at play in my country. Given the historical and socioeconomic factors that shape the electoral process in Egypt, I believe that votes are not often counted fairly in the country's elections.\n\n3"]}, {"persona": {"region": "Qena", "sex": "female", "age": 27, "country": "Egypt", "marital_status": "married", "education": "lower", "social_class": "lower middle class"}, "question": {"id": "Q224", "variant": 0}, "response": ["Based on the anthropological framework, my perspective as a married female from Qena, Egypt, who is 27 years old and part of the lower middle class, is heavily influenced by my cultural context, socioeconomic background, and personal experience. In Egypt, there is a history of political turmoil and allegations of electoral fraud, which has led to a general distrust in the fairness of election processes. Additionally, my lower education level may limit my access to and understanding of political information, further influencing my perception of the fairness of elections. Considering these factors, I would answer the question by selecting option 3: Not often."]}, {"persona": {"region": "Qena", "sex": "male", "age": 40, "country": "Egypt", "marital_status": "single", "education": "middle", "social_class": "lower middle class"}, "question": {"id": "Q224", "variant": 0}, "response": ["Based on the anthropological framework, as a single male from Qena, Egypt, who has completed middle education and considers myself part of the lower middle class, my answer to the question of how often votes are counted fairly in the country's elections is influenced by various factors. First, my cultural context as an Egyptian citizen living in a lower middle-class community shapes my perception of the political system and the fairness of elections. Additionally, my individual values and personal experiences have likely led me to believe that votes are not counted fairly due to historical and contemporary political events in Egypt. Furthermore, my socioeconomic background plays a role in my answer as I may have experienced or witnessed instances of electoral injustice due to my lower middle-class status. Therefore, based on my perspective and experiences, I would choose option (3) Not often. \n\n3"]}, {"persona": {"region": "Qena", "sex": "male", "age": 30, "country": "Egypt", "marital_status": "single", "education": "middle", "social_class": "working class"}, "question": {"id": "Q224", "variant": 0}, "response": ["Based on my cultural context and socioeconomic background, I understand that the fairness of vote counting in my country's elections can vary depending on the region and the level of government. I have personally witnessed instances where votes were not counted fairly, and I have heard similar experiences from others in my community. Additionally, my working-class status and middle education level have allowed me to see how political power dynamics can influence the fairness of vote counting. Therefore, I believe that votes are not often counted fairly in the country's elections.\n3"]}]