[{"persona": {"region": "Fayoum", "sex": "male", "age": 46, "country": "Egypt", "marital_status": "married", "education": "higher", "social_class": "lower middle class"}, "question": {"id": "Q210", "variant": 0}, "response": ["Based on the anthropological framework, as a married male from Fayoum, Egypt, my emic perspective on political participation is influenced by my cultural context, individual values, and socioeconomic background. In Egypt, there is a long history of political activism and participation, but as a member of the lower middle class, I have limited resources and influence in the political sphere. Additionally, my personal experience and values may lead me to be cautious about openly participating in political boycotts, as this could potentially have negative repercussions for my family and livelihood. Therefore, I might consider participating in a political boycott if the circumstances were right, but I would approach the decision with caution and consideration for my own well-being and that of my family.\n\n2"]}, {"persona": {"region": "Fayoum", "sex": "female", "age": 30, "country": "Egypt", "marital_status": "married", "education": "middle", "social_class": "lower middle class"}, "question": {"id": "Q210", "variant": 0}, "response": ["Based on the anthropological framework, my cultural context as a married female from Fayoum, Egypt, and my lower middle class socioeconomic background greatly influence my understanding and answer to this question. In Egypt, political participation is often influenced by cultural and socioeconomic factors, and as a woman from a lower middle class background, my access to political participation may be limited. Additionally, my individual values and personal experience may lead me to be cautious about participating in political activities that could potentially have negative consequences for myself and my family. Considering the emic and etic perspectives, as well as the cultural relativism, I would be more inclined to choose the option (3) Would never do."]}, {"persona": {"region": "Fayoum", "sex": "male", "age": 60, "country": "Egypt", "marital_status": "married", "education": "higher", "social_class": "working class"}, "question": {"id": "Q210", "variant": 0}, "response": ["Based on the anthropological framework, as a married male from Fayoum, Egypt, my emic perspective is heavily influenced by my cultural context, socioeconomic background, and age. In Egypt, there is a long history of political activism and participation, particularly among the working class. However, given my age and socioeconomic background, I have likely experienced the impact of political instability and economic hardship. This may lead me to have a more cautious approach to political participation, as I may prioritize stability and security for my family. Additionally, my personal values and experiences as a member of the working class may lead me to prioritize practical solutions over potentially risky political actions. Therefore, based on my emic perspective, I would never participate in a political boycott.\n\n3"]}, {"persona": {"region": "Fayoum", "sex": "male", "age": 20, "country": "Egypt", "marital_status": "single", "education": "middle", "social_class": "lower middle class"}, "question": {"id": "Q210", "variant": 0}, "response": ["From the perspective of a single male from Fayoum, Egypt, who is 20 years old and comes from a lower middle class background, my answer to the question of whether I have ever participated in a political boycott would be \"Might do\" (Option 2). This answer is based on the cultural context of Egypt, where political activism and participation are influenced by socioeconomic background and age. As a young person from a lower middle class background, I am aware of the political issues affecting my community and may consider participating in a boycott as a form of civic engagement. Additionally, my individual values and personal experience may lead me to consider the potential impact of a boycott on the issues I care about. My choice to \"Might do\" reflects the nuanced understanding of the question and the factors influencing my decision-making process."]}, {"persona": {"region": "Fayoum", "sex": "female", "age": 39, "country": "Egypt", "marital_status": "married", "education": "higher", "social_class": "lower middle class"}, "question": {"id": "Q210", "variant": 0}, "response": ["Based on the anthropological framework, as a married woman from Fayoum, Egypt, my emic perspective on political participation is shaped by my cultural context, individual values, and socioeconomic background. In Egypt, there is a strong emphasis on community and family, and political participation is often influenced by these factors. As a woman, my personal experience and values also play a significant role in my decision-making. Additionally, my lower middle class socioeconomic background may impact my access to resources and opportunities for political engagement. Considering these factors, I have never participated in a political boycott, as it may conflict with my cultural and personal values and may not align with the resources available to me in my socioeconomic position.\n\n2"]}, {"persona": {"region": "Fayoum", "sex": "male", "age": 33, "country": "Egypt", "marital_status": "married", "education": "higher", "social_class": "working class"}, "question": {"id": "Q210", "variant": 0}, "response": ["From the emic and etic perspectives, as a married male from Fayoum, Egypt, I am part of a community with specific in-group ways of thinking and answering questions. My cultural context, including my socioeconomic background and personal experience, plays a significant role in shaping my perceptions and actions. As someone from the working class in Egypt, I am influenced by the cultural relativism of my society, where political participation is often viewed through a nuanced lens. Given the space and time in which I live, I am more likely to have participated in a political boycott due to the social and economic factors that affect my life. Therefore, my answer to the question is 1) Have done."]}, {"persona": {"region": "Port Said", "sex": "female", "age": 45, "country": "Egypt", "marital_status": "married", "education": "higher", "social_class": "lower middle class"}, "question": {"id": "Q210", "variant": 0}, "response": ["Based on my emic perspective as a married woman from Port Said, Egypt, and considering my age, education level, and socioeconomic background, I have been influenced by the cultural context and individual values of my society. The political climate in Egypt has been tumultuous, and as a member of the lower middle class, I have felt the impact of certain political decisions on my family and community. Therefore, I have participated in a political boycott as a form of protest and expression of my dissatisfaction with the government's actions. My personal experience and values have led me to this decision, as I believe it is important to stand up for what I believe in and create change for the betterment of my community.\n\n1"]}, {"persona": {"region": "Port Said", "sex": "male", "age": 42, "country": "Egypt", "marital_status": "married", "education": "middle", "social_class": "lower middle class"}, "question": {"id": "Q210", "variant": 0}, "response": ["Based on the anthropological framework, my answer is influenced by my cultural context, socioeconomic background, individual values, and personal experience. As a married male from Port Said, Egypt, who is 42 years old and part of the lower middle class, my experience and values are shaped by the political and economic challenges faced by my community. The cultural context of Egypt also plays a significant role in my understanding of political participation. Additionally, my socioeconomic background has influenced my perceptions and opportunities for political engagement. Given these factors, my answer is influenced by nuanced phrasing of the question and the understanding of cultural relativism.\n\n2"]}, {"persona": {"region": "Port Said", "sex": "male", "age": 28, "country": "Egypt", "marital_status": "single", "education": "middle", "social_class": "lower middle class"}, "question": {"id": "Q210", "variant": 0}, "response": ["Based on the anthropological framework, my understanding and answer to the question are influenced by my cultural context, individual values, and socioeconomic background. As a single male from Port Said, Egypt, I am aware of the political climate and the impact of political decisions on my community. My middle education level and lower middle class background have shaped my perspective on political participation. I have personally witnessed the struggles of my community and understand the importance of standing up for our rights. Therefore, I have participated in a political boycott in the past, as it was a way for me to express my discontent with the system and demand change for the betterment of my community.\n\n1"]}, {"persona": {"region": "Port Said", "sex": "female", "age": 30, "country": "Egypt", "marital_status": "married", "education": "higher", "social_class": "lower middle class"}, "question": {"id": "Q210", "variant": 0}, "response": ["Based on the anthropological framework, my emic perspective as a married female from Port Said, Egypt, at 30 years of age and from the lower middle class, plays a crucial role in my understanding and response to the question. The cultural context of Egypt, with its history of political activism and current socioeconomic challenges, shapes my understanding of political participation. My personal experience and values, influenced by my education and socioeconomic background, also contribute to my response. Additionally, the nuanced phrasing of the question and the emphasis on nuance in anthropological methods further inform my choice.\n\n2"]}, {"persona": {"region": "Port Said", "sex": "male", "age": 30, "country": "Egypt", "marital_status": "divorced", "education": "middle", "social_class": "lower middle class"}, "question": {"id": "Q210", "variant": 0}, "response": ["From the perspective of a divorced male from Port Said, Egypt, who is 30 years old, completed middle education, and considers himself part of the lower middle class, it is important to consider the cultural context and socioeconomic background in understanding his potential participation in a political boycott. In Egypt, there is a strong emphasis on collective action and solidarity within the community, and political boycotts are often seen as a way to express dissatisfaction with the government. However, individuals from lower middle class backgrounds may have limited resources and opportunities to engage in political activism. Additionally, there may be a fear of repercussions from the government, which could impact their decision. Furthermore, personal experience and individual values also play a significant role in shaping one's perspective on political activism. Considering these factors, it is likely that this persona might consider participating in a political boycott as a form of expression, but would be cautious due to the potential risks involved.\n\n2"]}, {"persona": {"region": "Port Said", "sex": "female", "age": 19, "country": "Egypt", "marital_status": "single", "education": "middle", "social_class": "lower middle class"}, "question": {"id": "Q210", "variant": 0}, "response": ["Based on the anthropological framework, as a 19-year-old single female from Port Said, Egypt, who has completed middle education and considers myself part of the lower middle class, my response to the question of political boycott participation would be influenced by my cultural context, individual values, and socioeconomic background. In Egypt, there is a history of political activism and unrest, and individuals from lower socioeconomic backgrounds may feel more marginalized and motivated to participate in political action. Additionally, as a young person with limited education and resources, I may feel more inclined to express my frustration with the political system through boycotts. Therefore, my perspective would be shaped by my cultural context and socioeconomic background, leading me to select option (1) Have done."]}, {"persona": {"region": "Fayoum", "sex": "male", "age": 40, "country": "Egypt", "marital_status": "married", "education": "middle", "social_class": "working class"}, "question": {"id": "Q210", "variant": 0}, "response": ["Based on the anthropological framework, as a married male from Fayoum, Egypt, my emic perspective is shaped by my cultural context, socioeconomic background, and personal experience. Living in a working-class community in Egypt, I have witnessed the impact of political decisions on our daily lives. My cultural relativism also influences my perspective, as I understand the importance of collective action within my community. Considering my age and socioeconomic background, I have not personally participated in a political boycott, but I understand the potential impact and might consider it in the future if it aligns with the needs of my community.\n\n2"]}, {"persona": {"region": "Fayoum", "sex": "male", "age": 23, "country": "Egypt", "marital_status": "single", "education": "higher", "social_class": "lower middle class"}, "question": {"id": "Q210", "variant": 0}, "response": ["From the perspective of a single male from Fayoum, Egypt, who is 23 years old, has completed higher education, and considers himself part of the lower middle class, my answer will be influenced by my cultural context, socioeconomic background, individual values, and personal experience. In Egypt, political participation and attitudes towards boycotts are heavily influenced by the cultural and political context. As a member of the lower middle class, I am likely to have experienced the impact of political decisions on my daily life, which could make me more inclined to participate in a boycott as a form of protest. Additionally, my higher education level might have exposed me to political ideologies and activism, further influencing my perspective. Considering the socioeconomic and political context of Egypt, I might do. \n\n2"]}, {"persona": {"region": "Fayoum", "sex": "female", "age": 38, "country": "Egypt", "marital_status": "married", "education": "middle", "social_class": "lower middle class"}, "question": {"id": "Q210", "variant": 0}, "response": ["Based on the anthropological framework, as a married female from Fayoum, Egypt, my emic perspective on political participation is heavily influenced by my cultural context and socioeconomic background. In Egypt, there are strong cultural and societal expectations for women, especially those from lower middle class backgrounds, to prioritize family and household responsibilities over political engagement. Additionally, my personal experience and values as a middle-aged woman with limited education have shaped my perception of political participation. Given these factors, I would never do. \n\n3"]}, {"persona": {"region": "Fayoum", "sex": "male", "age": 32, "country": "Egypt", "marital_status": "married", "education": "middle", "social_class": "lower middle class"}, "question": {"id": "Q210", "variant": 0}, "response": ["From the perspective of a married male from Fayoum, Egypt, at 32 years of age and with a middle education level, the decision to participate in a political boycott would be influenced by several factors. Firstly, the cultural context of Egypt, with its history of political unrest and the presence of authoritarian regimes, would shape his understanding of political participation. His lower middle-class socioeconomic background may limit his access to political resources and influence his perception of the effectiveness of participating in a boycott. Additionally, his personal experience and individual values may play a role in his decision, as well as the nuanced phrasing of the question. Taking into account these factors, the persona may choose the option:\n\n2) Might do"]}, {"persona": {"region": "Fayoum", "sex": "male", "age": 31, "country": "Egypt", "marital_status": "married", "education": "higher", "social_class": "working class"}, "question": {"id": "Q210", "variant": 0}, "response": ["Based on the anthropological framework, my answer is influenced by my emic perspective as a married male from Fayoum, Egypt, my cultural context, individual values, and socioeconomic background as part of the working class. In my cultural context, political participation is highly valued and seen as a way to bring about change. However, my socioeconomic background and personal experiences have also shaped my views on political participation. As someone who completed higher education, I understand the importance of political engagement, but as a member of the working class, I also understand the challenges and limitations that come with it. Considering these factors, I would never participate in a political boycott.\n\n3"]}, {"persona": {"region": "Fayoum", "sex": "male", "age": 31, "country": "Egypt", "marital_status": "married", "education": "middle", "social_class": "lower middle class"}, "question": {"id": "Q210", "variant": 0}, "response": ["Based on my cultural context in Fayoum, Egypt, where politics play a significant role in daily life, and my socioeconomic background as part of the lower middle class, I have been exposed to the idea of political boycotts as a means of expressing dissatisfaction with the government. My individual values and personal experiences have also shaped my perception, and while I have not personally participated in a political boycott, I understand the motivations behind it and might consider doing so in the future if I feel strongly enough about a particular issue. Additionally, the nuanced phrasing of the question allows for the possibility of future participation based on changing circumstances. \n\n2"]}, {"persona": {"region": "Fayoum", "sex": "female", "age": 32, "country": "Egypt", "marital_status": "married", "education": "middle", "social_class": "lower middle class"}, "question": {"id": "Q210", "variant": 0}, "response": ["From the emic and etic perspective, as a married female from Fayoum, Egypt, my cultural context and socioeconomic background play a significant role in my understanding and participation in political activities. My individual values and personal experiences, along with my lower middle-class status and limited education, shape my perception of political boycotts. Additionally, the cultural relativism in Egypt and the societal norms surrounding women's participation in politics also influence my decision. Given my age and place, I would be more inclined to consider the potential consequences of participating in a political boycott, taking into account the nuance of the situation and the impact it could have on my family and community. \n\n2"]}, {"persona": {"region": "Ismailia", "sex": "male", "age": 53, "country": "Egypt", "marital_status": "married", "education": "middle", "social_class": "lower middle class"}, "question": {"id": "Q210", "variant": 0}, "response": ["Based on the anthropological framework, my emic perspective as a married male from Ismailia, Egypt, at the age of 53 with a middle education level and lower middle-class background, influences my answer to the question. The cultural context in Egypt, particularly in Ismailia, has a history of political activism and participation, but also a sense of distrust and disillusionment with the political system. My individual values and personal experiences have also shaped my perception of political boycotts, as I have witnessed the impact of political instability on my community. Furthermore, my socioeconomic background and age play a role in my decision, as I may feel less empowered to participate in political boycotts due to financial constraints and family responsibilities. Additionally, my nuanced understanding of the question leads me to choose the option that aligns with my experiences and cultural context.\n\n1"]}, {"persona": {"region": "Ismailia", "sex": "male", "age": 38, "country": "Egypt", "marital_status": "married", "education": "higher", "social_class": "working class"}, "question": {"id": "Q210", "variant": 0}, "response": ["Based on the anthropological framework, my emic perspective as a married male from Ismailia, Egypt, who is 38 years old and part of the working class, is heavily influenced by my cultural context, individual values, and socioeconomic background. In Egypt, political participation is seen as a duty and a way to bring about change, but as a working-class individual, I may feel marginalized and disempowered in the political process. Additionally, my personal experience and values may lead me to view political boycotts as a potential way to express dissatisfaction with the system. My socioeconomic background also plays a role, as I may feel that my voice is not adequately represented in the political sphere. Therefore, my perspective on political boycotts is complex and influenced by a variety of factors.\n\n2"]}, {"persona": {"region": "Ismailia", "sex": "female", "age": 35, "country": "Egypt", "marital_status": "married", "education": "middle", "social_class": "lower middle class"}, "question": {"id": "Q210", "variant": 0}, "response": ["Based on the anthropological framework, as a married female from Ismailia, Egypt, my emic perspective on political participation is influenced by cultural context, individual values, and socioeconomic background. In Egypt, political participation may be influenced by social and cultural norms, as well as the socioeconomic status of individuals. As a lower middle-class woman, my access to and involvement in political activities may be limited. Additionally, my personal experiences and values may shape my willingness to participate in political boycotts. Considering the nuances of the question, I would choose option (2) Might do, as my participation in a political boycott would depend on the specific circumstances and my personal beliefs at the time. \n\n2"]}, {"persona": {"region": "Ismailia", "sex": "female", "age": 57, "country": "Egypt", "marital_status": "married", "education": "lower", "social_class": "working class"}, "question": {"id": "Q210", "variant": 0}, "response": ["Based on the anthropological framework, my emic perspective as a married female from Ismailia, Egypt, at 57 years old with a lower education level and part of the working class, is heavily influenced by my cultural context, individual values, and socioeconomic background. In my cultural context, political participation may not be as accessible or encouraged, and my individual values and personal experience may lead me to prioritize other aspects of my life. Additionally, my socioeconomic background as part of the working class may limit my ability to engage in political activities. Therefore, my answer to the question is:\n3"]}, {"persona": {"region": "Ismailia", "sex": "male", "age": 33, "country": "Egypt", "marital_status": "married", "education": "middle", "social_class": "lower middle class"}, "question": {"id": "Q210", "variant": 0}, "response": ["From the perspective of a married male from Ismailia, Egypt, who is 33 years old, completed middle education, and considers himself part of the lower middle class, the emic and etic perspectives are crucial in understanding his potential participation in a political boycott. In this cultural context, there may be in-group ways of viewing political participation and out-group perspectives that differ. Additionally, individual values and personal experiences, as well as socioeconomic background, play a significant role in shaping his potential response. Cultural relativism is also important to consider, as there may be nuanced factors at play in his decision-making. Taking into account the space and time of his life in Ismailia, Egypt, and his middle education level, it is likely that his past experiences and current socioeconomic status will heavily influence his answer.\n\n2"]}, {"persona": {"region": "Ismailia", "sex": "female", "age": 49, "country": "Egypt", "marital_status": "single", "education": "higher", "social_class": "upper middle class"}, "question": {"id": "Q210", "variant": 0}, "response": ["Based on the anthropological framework, my individual values and personal experience as a single, educated woman from Ismailia, Egypt, play a significant role in my perception of political engagement. My socioeconomic background as part of the upper middle class also influences my perspective. Additionally, the cultural context of Egypt and the nuanced phrasing of the question are important factors. Therefore, considering all these aspects, I would choose:\n\n2) Might do"]}, {"persona": {"region": "Ismailia", "sex": "female", "age": 35, "country": "Egypt", "marital_status": "married", "education": "higher", "social_class": "lower middle class"}, "question": {"id": "Q210", "variant": 0}, "response": ["Based on the anthropological framework, as a married female from Ismailia, Egypt, my emic perspective and cultural context would heavily influence my answer to the question of participating in a political boycott. In Egypt, there is a long history of political activism and participation, and the cultural context of my community values civic engagement. Additionally, my personal experience and individual values as a well-educated woman from the lower middle class would lead me to consider participating in a political boycott as a potential way to express my dissatisfaction with the political system. Furthermore, my socioeconomic background and age would also play a role in shaping my perspective. Therefore, I would answer the question as follows:\n\n2"]}, {"persona": {"region": "Ismailia", "sex": "male", "age": 24, "country": "Egypt", "marital_status": "single", "education": "higher", "social_class": "upper middle class"}, "question": {"id": "Q210", "variant": 0}, "response": ["Based on the anthropological framework, my emic perspective as a single male from Ismailia, Egypt, who is 24 years old and part of the upper middle class, influences my answer to the question. In the cultural context of Egypt, participation in political activities is heavily influenced by socioeconomic background, individual values, and personal experiences. As a member of the upper middle class, I have been exposed to a certain level of privilege and access to education, which may influence my willingness to engage in political boycotts. Additionally, the cultural relativism of Egypt means that the perception of political participation may vary based on one's age and social status. Taking into account these factors, my answer is:\n2"]}, {"persona": {"region": "Ismailia", "sex": "female", "age": 23, "country": "Egypt", "marital_status": "single", "education": "higher", "social_class": "lower middle class"}, "question": {"id": "Q210", "variant": 0}, "response": ["Based on the anthropological framework, as a single female from Ismailia, Egypt, my emic perspective is shaped by my cultural context, individual values, and socioeconomic background. In my cultural context, political participation and activism are often seen as important, but as part of the lower middle class, I am not always able to actively participate in political boycotts due to financial constraints and time commitments. Additionally, my personal experiences and values inform my decision, as I have not yet participated in a political boycott due to a lack of opportunity and resources. Therefore, based on my emic perspective as a 23-year-old single female from Ismailia, Egypt, I have not done a political boycott. \n\n2"]}, {"persona": {"region": "Ismailia", "sex": "male", "age": 55, "country": "Egypt", "marital_status": "married", "education": "middle", "social_class": "lower middle class"}, "question": {"id": "Q210", "variant": 0}, "response": ["From the perspective of a married male from Ismailia, Egypt, who is 55 years old, has completed middle education, and considers himself part of the lower middle class, my answer to the question is influenced by several factors. Firstly, my cultural context as an Egyptian living in a region with a history of political activism and a strong sense of national identity plays a significant role in my understanding of political participation. Additionally, my socioeconomic background as part of the lower middle class has shaped my experiences and values, leading me to prioritize economic stability and social welfare. Furthermore, my age and personal experiences have influenced my perception of political activism and the potential impact it may have on my life and community. Considering these factors, I have never participated in a political boycott, as I believe in finding alternative ways to address social and political issues within the system. \n\n2"]}, {"persona": {"region": "Ismailia", "sex": "male", "age": 57, "country": "Egypt", "marital_status": "married", "education": "middle", "social_class": "upper middle class"}, "question": {"id": "Q210", "variant": 0}, "response": ["Based on the emic and etic perspectives, as a married male from Ismailia, Egypt, my in-group ways of thinking and answering questions are influenced by my cultural context, individual values, and personal experience. My socioeconomic background as an upper middle class individual also plays a role in shaping my perceptions and actions. Additionally, my age and place of living in Ismailia are important factors in understanding my perspective. Taking into account the cultural relativism and nuances of the question, I would never participate in a political boycott due to the potential impact it may have on my social and economic standing within my community. \n\n3"]}, {"persona": {"region": "Ismailia", "sex": "female", "age": 29, "country": "Egypt", "marital_status": "married", "education": "middle", "social_class": "upper middle class"}, "question": {"id": "Q210", "variant": 0}, "response": ["Based on the anthropological framework, my answer is influenced by my cultural context, individual values, and socioeconomic background. As a married female from Ismailia, Egypt, I am aware of the political climate and the importance of civic engagement. However, as a member of the upper middle class, I have certain privileges and opportunities that may not necessitate participation in political boycotts. Additionally, my personal experience and understanding of the political landscape may lead me to believe that there are other avenues for enacting change. Therefore, based on my cultural context, individual values, and socioeconomic background, I would never do a political boycott.\n\n3"]}, {"persona": {"region": "Damiatta", "sex": "female", "age": 46, "country": "Egypt", "marital_status": "married", "education": "middle", "social_class": "lower middle class"}, "question": {"id": "Q210", "variant": 0}, "response": ["From the perspective of a married female from Damiatta, Egypt, who is 46 years old, completed middle education level, and considers herself part of the lower middle class, my answer is influenced by a combination of individual values, personal experience, and socioeconomic background. In my cultural context, political participation may be limited due to societal expectations and economic constraints. Additionally, the emic and etic perspectives within my community may shape my views on political action. Taking into account the nuance of the question, my answer is influenced by the cultural relativism of my background, where political activism may not be as accessible or feasible. Therefore, my response is based on a combination of personal values, socioeconomic background, and cultural context.\n\n2"]}, {"persona": {"region": "Damiatta", "sex": "female", "age": 20, "country": "Egypt", "marital_status": "single", "education": "middle", "social_class": "lower middle class"}, "question": {"id": "Q210", "variant": 0}, "response": ["Based on the anthropological framework, as a single female from Damiatta, Egypt, my emic perspective is shaped by the cultural context and socioeconomic background of my community. Political participation is heavily influenced by cultural norms and societal expectations, as well as individual values and personal experiences. As a member of the lower middle class, I am keenly aware of the impact of political decisions on my daily life. I have also witnessed the consequences of political action or inaction within my community, and I understand the importance of civic engagement. Therefore, I would never do a political boycott.\n\n3"]}, {"persona": {"region": "Damiatta", "sex": "male", "age": 19, "country": "Egypt", "marital_status": "single", "education": "middle", "social_class": "lower middle class"}, "question": {"id": "Q210", "variant": 0}, "response": ["Based on the anthropological framework, I will answer this question from the perspective of a 19-year-old single male from Damiatta, Egypt, who has completed middle education and considers himself part of the lower middle class. My emic perspective on this question is influenced by my cultural context, individual values, and socioeconomic background. In Egypt, political participation is often influenced by factors such as age, education level, and socioeconomic status. As a young person from a lower middle class background, I am likely to have limited opportunities for political engagement and may feel disempowered in the political process. Additionally, my personal experiences and values may lead me to perceive political boycotts as a way to express dissatisfaction with the system. Therefore, my response to this question is influenced by my nuanced understanding of the political landscape in Egypt and my own position within it.\n\n2"]}, {"persona": {"region": "Damiatta", "sex": "female", "age": 33, "country": "Egypt", "marital_status": "married", "education": "higher", "social_class": "lower middle class"}, "question": {"id": "Q210", "variant": 0}, "response": ["Based on my emic perspective as a woman from Damiatta, Egypt, I have been influenced by the cultural context of my community and the socioeconomic background of my lower middle class status. My personal experience and individual values have shaped my understanding of political participation. Additionally, the cultural relativism of my society and the nuance of the question also play a role in my answer. Therefore, I have never participated in a political boycott.\n\n3"]}, {"persona": {"region": "Damiatta", "sex": "male", "age": 24, "country": "Egypt", "marital_status": "single", "education": "higher", "social_class": "lower middle class"}, "question": {"id": "Q210", "variant": 0}, "response": ["Based on the anthropological framework, as a single male from Damiatta, Egypt, my emic perspective is influenced by my cultural context, individual values and personal experience, socioeconomic background, and space and time. In Egypt, political participation is heavily influenced by cultural and socioeconomic factors, and as a lower middle class individual, I have experienced firsthand the impact of political decisions on my community. Additionally, as a young adult who has completed higher education, I am more likely to be aware of and engage in political movements. Therefore, my answer to the question would be:\n\n2"]}, {"persona": {"region": "Suez", "sex": "male", "age": 41, "country": "Egypt", "marital_status": "married", "education": "middle", "social_class": "working class"}, "question": {"id": "Q210", "variant": 0}, "response": ["Based on the anthropological framework, my emic perspective as a married male from Suez, Egypt, with a middle education level and part of the working class, is influenced by my cultural context, individual values, socioeconomic background, and space and time. In Egypt, political participation is heavily influenced by socioeconomic background and cultural norms. As a working-class individual, my ability to participate in political activities may be limited, and my personal values and experiences may shape my views on political boycotts. Additionally, my age and place of residence in Suez also play a role in my perspective. Considering these factors, my answer to the question would be:\n\n2) Might do"]}, {"persona": {"region": "Suez", "sex": "female", "age": 39, "country": "Egypt", "marital_status": "divorced", "education": "middle", "social_class": "working class"}, "question": {"id": "Q210", "variant": 0}, "response": ["Based on the anthropological framework, as a divorced female from Suez, Egypt, with a middle-level education and working-class background, my perspective is heavily influenced by my cultural context, socioeconomic background, and personal experience. In Egypt, political participation and activism are often tied to socioeconomic status and education level, and as a working-class individual with a middle education, my opportunities for political engagement may be limited. Additionally, as a woman in a conservative society, my personal experience and values may also influence my likelihood of participating in a political boycott. Given these factors, my answer would be:\n\n2"]}, {"persona": {"region": "Cairo", "sex": "female", "age": 55, "country": "Egypt", "marital_status": "married", "education": "middle", "social_class": "working class"}, "question": {"id": "Q210", "variant": 0}, "response": ["Based on the anthropological framework, my cultural context as a married female from Cairo, Egypt, my age of 55, and my middle education level, as well as my working-class background, all play a significant role in my perspective on political participation. My understanding of political boycotts is influenced by my individual values and personal experience, as well as my socioeconomic background. Additionally, the cultural relativism in Egypt and the nuanced phrasing of the question also contribute to my answer. Therefore, my perspective on political boycotts is shaped by a combination of these factors.\n\n2"]}, {"persona": {"region": "Cairo", "sex": "male", "age": 58, "country": "Egypt", "marital_status": "married", "education": "middle", "social_class": "lower middle class"}, "question": {"id": "Q210", "variant": 0}, "response": ["Based on the anthropological framework, as a married male from Cairo, Egypt, my emic perspective is influenced by my cultural context, individual values, and socioeconomic background. In Egypt, there are strong political tensions and participating in a boycott may be seen as a form of protest against the government. As a lower middle-class individual with a middle education level, I may feel marginalized and disenfranchised, leading me to consider participating in a political boycott as a means of expressing my dissatisfaction with the system. Additionally, my age and place in society also influence my decision, as older individuals in Egypt may have experienced more political turmoil and may be more likely to engage in such activities. Therefore, based on my background and cultural context, I would choose option (1) Have done."]}, {"persona": {"region": "Cairo", "sex": "female", "age": 29, "country": "Egypt", "marital_status": "married", "education": "higher", "social_class": "lower middle class"}, "question": {"id": "Q210", "variant": 0}, "response": ["Based on the anthropological framework, as a married female from Cairo, Egypt, my emic perspective on political boycotts is shaped by the cultural context of my country, where political activism and dissent may carry significant risks. My individual values and personal experience, as well as my socioeconomic background as part of the lower middle class, also influence my views on political engagement. Additionally, the cultural relativism in Egypt means that there are nuanced understandings of political participation, and the current space and time in which I live also play a role in my decision. Considering all these factors, I would never participate in a political boycott.\n\n3"]}, {"persona": {"region": "Cairo", "sex": "male", "age": 38, "country": "Egypt", "marital_status": "married", "education": "higher", "social_class": "lower middle class"}, "question": {"id": "Q210", "variant": 0}, "response": ["Based on my emic perspective as a married male from Cairo, Egypt, I have a deep understanding of the cultural context and the socioeconomic background in which I live. As part of the lower middle class, I have experienced firsthand the impact of political decisions on my daily life and the struggles faced by my community. My individual values and personal experiences have shaped my perception of political participation, and I am keenly aware of the nuances in the phrasing of the question. Considering the cultural relativism and the space and time in which I exist, I can confidently say that I have never participated in a political boycott. \n\n3"]}, {"persona": {"region": "Cairo", "sex": "female", "age": 40, "country": "Egypt", "marital_status": "married", "education": "higher", "social_class": "lower middle class"}, "question": {"id": "Q210", "variant": 0}, "response": ["From the perspective of a married female from Cairo, Egypt, who is 40 years old, completed higher education, and considers herself part of the lower middle class, it is important to consider the emic and etic perspectives when answering this question. The cultural context in Egypt, particularly in Cairo, is filled with political and social unrest, where participation in political activities is influenced by personal experience and individual values. Socioeconomic background also plays a role, as those from the lower middle class may feel marginalized and disenfranchised by the political system. Additionally, the cultural relativism of Egypt means that political participation is viewed differently than in other cultures. Therefore, the answer to this question is influenced by the nuanced phrasing of the question and the understanding of the persona's cultural and societal context.\n\n2"]}, {"persona": {"region": "Cairo", "sex": "male", "age": 38, "country": "Egypt", "marital_status": "married", "education": "higher", "social_class": "upper middle class"}, "question": {"id": "Q210", "variant": 0}, "response": ["Based on the anthropological framework, as a married male from Cairo, Egypt, my emic perspective on political boycotts is influenced by the cultural context of my upbringing and social status. As part of the upper middle class, my individual values and personal experiences have shaped my understanding of political participation. Additionally, my socioeconomic background and the cultural relativism of my society play a significant role in my decision-making. Furthermore, the nuance of the question and the space and time in which I live also impact my response. Taking all of these factors into consideration, I can confidently say that I have never participated in a political boycott.\n\n3"]}, {"persona": {"region": "Cairo", "sex": "male", "age": 59, "country": "Egypt", "marital_status": "married", "education": "middle", "social_class": "lower middle class"}, "question": {"id": "Q210", "variant": 0}, "response": ["Based on the anthropological framework described above, as a married male from Cairo, Egypt, at 59 years of age with a middle education level and from the lower middle class, my perspective on political boycotts would be influenced by my cultural context, individual values, and socioeconomic background. Living in a country with a complex political history and economic challenges, I would consider political participation and activism to be important, but my lower middle class status and limited educational opportunities may have restricted my ability to participate in political boycotts in the past. Additionally, my cultural context and values may prioritize stability and family well-being, leading me to be cautious about engaging in activities that could potentially disrupt the status quo. Therefore, I would never do a political boycott. \n\n3"]}, {"persona": {"region": "Cairo", "sex": "female", "age": 30, "country": "Egypt", "marital_status": "married", "education": "higher", "social_class": "upper middle class"}, "question": {"id": "Q210", "variant": 0}, "response": ["Based on the anthropological framework, as a married female from Cairo, Egypt, my emic perspective is influenced by the cultural context of my upbringing, education, and socioeconomic background. As a member of the upper middle class, my individual values and personal experiences shape my understanding of political participation. In Egypt, there is a strong emphasis on family and community, and political boycotts are often seen as a way to express dissatisfaction with the government. However, due to the potential consequences and the nuanced political climate in Egypt, I might consider participating in a political boycott as a form of peaceful protest, but would be cautious about the potential risks involved. Therefore, my answer would be:\n\n2) Might do"]}, {"persona": {"region": "Cairo", "sex": "male", "age": 22, "country": "Egypt", "marital_status": "single", "education": "middle", "social_class": "lower middle class"}, "question": {"id": "Q210", "variant": 0}, "response": ["Based on my emic perspective as a young man from Cairo, I have been influenced by the cultural context of my city, where political activism is common and often involves participating in boycotts. My individual values and personal experiences have also shaped my understanding of political boycotts, as I have seen the impact of such actions on my community. Additionally, my socioeconomic background as part of the lower middle class has led me to feel a sense of solidarity with others who may participate in political boycotts. In this space and time, I can see myself participating in a political boycott as a way to advocate for change. \n\n2"]}, {"persona": {"region": "Cairo", "sex": "male", "age": 29, "country": "Egypt", "marital_status": "single", "education": "higher", "social_class": "lower middle class"}, "question": {"id": "Q210", "variant": 0}, "response": ["Based on the anthropological framework, as a single male from Cairo, Egypt, my emic perspective is influenced by the cultural context of living in a politically charged environment. My individual values and personal experience, shaped by the socioeconomic background of being part of the lower middle class, have led me to actively participate in political boycotts in the past. Being 29 years old and having completed higher education, I have witnessed and experienced the impact of political movements and their effect on my community. Additionally, the nuanced phrasing of the question also influences my response, as my understanding of political boycotts is shaped by my specific cultural and socio-political context.\n\n1"]}, {"persona": {"region": "Cairo", "sex": "female", "age": 31, "country": "Egypt", "marital_status": "married", "education": "higher", "social_class": "lower middle class"}, "question": {"id": "Q210", "variant": 0}, "response": ["Based on the anthropological framework, as a married female from Cairo, Egypt, my emic perspective is influenced by my cultural context, individual values, and socioeconomic background. In Egypt, political participation is influenced by cultural and societal norms, especially for women. My lower middle-class socioeconomic background also affects my access to political participation and my personal experiences shape my understanding of the political climate. Additionally, my age and place of residence in Cairo also play a role in shaping my perspectives on political boycotts. Therefore, my answer is: 2) Might do"]}, {"persona": {"region": "Cairo", "sex": "male", "age": 59, "country": "Egypt", "marital_status": "married", "education": "higher", "social_class": "upper middle class"}, "question": {"id": "Q210", "variant": 0}, "response": ["Based on the anthropological framework, as a married male from Cairo, Egypt, of 59 years of age with a higher education level and considering myself part of the upper middle class, my answer to the question would be influenced by various factors. My cultural context and personal experience living in Cairo, as well as my socioeconomic background, would play a significant role in my decision. Additionally, my individual values and the nuanced phrasing of the question would also impact my response. Considering the political climate and my position in society, I might consider participating in a political boycott to express my discontent with the current political situation.\n\n2"]}, {"persona": {"region": "Cairo", "sex": "male", "age": 27, "country": "Egypt", "marital_status": "single", "education": "middle", "social_class": "working class"}, "question": {"id": "Q210", "variant": 0}, "response": ["Based on the anthropological framework, my emic perspective as a single male from Cairo, Egypt, is influenced by my cultural context, individual values, socioeconomic background, and the space and time in which I live. As a working-class individual with a middle education level, I have been exposed to the political climate of Egypt and have personally experienced the impact of political decisions on my life. Additionally, cultural relativism is important to consider, as the political landscape in Egypt is unique and may not be fully understood by those from outside my cultural context. Taking all these factors into account, I can confidently say that I have participated in a political boycott.\n\n1"]}, {"persona": {"region": "Cairo", "sex": "female", "age": 25, "country": "Egypt", "marital_status": "single", "education": "higher", "social_class": "working class"}, "question": {"id": "Q210", "variant": 0}, "response": ["Based on my emic perspective as a single female from Cairo, Egypt, I have been influenced by the cultural context of my society, where political participation is highly valued. My individual values and personal experience have shaped my understanding of the importance of standing up for political beliefs, despite my working-class background. Additionally, the socioeconomic background of my family has instilled in me a sense of responsibility to be actively engaged in political activities. Furthermore, cultural relativism in my community emphasizes the need to participate in political processes. Considering all these factors, I have actively participated in political boycotts in the past.\n\n1"]}, {"persona": {"region": "Cairo", "sex": "female", "age": 23, "country": "Egypt", "marital_status": "married", "education": "higher", "social_class": "lower middle class"}, "question": {"id": "Q210", "variant": 0}, "response": ["Based on the anthropological framework, my emic perspective as a married female from Cairo, Egypt, who is 23 years old and part of the lower middle class, is influenced by my cultural context, individual values, and socioeconomic background. In Egypt, there is a strong political culture and history of social movements, which has shaped my understanding of political participation. I have also been influenced by my education and family's socioeconomic status, which has led me to value the importance of political engagement. Additionally, as a young woman in Cairo, I am aware of the opportunities and limitations I face in participating in political activities. Given these factors, I have chosen option (1) Have done."]}, {"persona": {"region": "Cairo", "sex": "male", "age": 58, "country": "Egypt", "marital_status": "married", "education": "higher", "social_class": "working class"}, "question": {"id": "Q210", "variant": 0}, "response": ["Based on the anthropological framework, as a married male from Cairo, Egypt, my emic perspective is shaped by the cultural context of my upbringing and the socioeconomic background of being part of the working class. My personal experience and individual values have been influenced by the societal norms and values of my community. Cultural relativism is also crucial in understanding my perspective, as there is no hierarchy of culture. Additionally, my age and place as a 58-year-old from Cairo further influence my views. Considering all these factors, I have never participated in a political boycott. \n\n3"]}, {"persona": {"region": "Cairo", "sex": "female", "age": 40, "country": "Egypt", "marital_status": "married", "education": "higher", "social_class": "working class"}, "question": {"id": "Q210", "variant": 0}, "response": ["Based on my emic perspective as a married female from Cairo, Egypt, I have been influenced by the cultural context of my surroundings, including the political climate in Egypt. My individual values and personal experience have also shaped my views, and as part of the working class, my socioeconomic background has played a role in my decision-making. Additionally, cultural relativism has taught me to view political actions within the context of my own culture. Finally, as a 40-year-old woman from Cairo, I understand the importance of nuance in answering questions. \n\n3"]}, {"persona": {"region": "Cairo", "sex": "female", "age": 36, "country": "Egypt", "marital_status": "married", "education": "middle", "social_class": "upper middle class"}, "question": {"id": "Q210", "variant": 0}, "response": ["Based on the anthropological framework, as a married female from Cairo, Egypt, my emic perspective is influenced by my cultural context, individual values, and socioeconomic background. In Egypt, there is a long history of political activism and engagement, and as someone from the upper middle class, I have more access to education and resources that may allow me to participate in political activities. However, my personal experience and values may also influence my decision. Considering the current political climate and my level of education, I might consider participating in a political boycott as a form of protest or activism. \n\n2"]}, {"persona": {"region": "Cairo", "sex": "male", "age": 40, "country": "Egypt", "marital_status": "married", "education": "middle", "social_class": "lower middle class"}, "question": {"id": "Q210", "variant": 0}, "response": ["Based on the anthropological framework, my emic perspective as a married male from Cairo, Egypt, at the age of 40 and belonging to the lower middle class, is heavily influenced by my cultural context, individual values, and socioeconomic background. In Egypt, political participation and boycotts are often influenced by the cultural and socioeconomic environment, and as someone from the lower middle class, I have experienced the impact of political decisions on my daily life. Additionally, my personal experience and values shape my perception of political boycotts. Therefore, my answer to the question is (2) Might do."]}, {"persona": {"region": "Cairo", "sex": "female", "age": 30, "country": "Egypt", "marital_status": "married", "education": "middle", "social_class": "lower class"}, "question": {"id": "Q210", "variant": 0}, "response": ["From the perspective of a married woman from Cairo, Egypt, who is 30 years old, has completed middle education, and considers herself part of the lower class, it is important to consider the cultural context and individual values in answering the question. In Egypt, there is a strong political culture and participation in political activities is influenced by socioeconomic background, cultural context, and personal experience. The lower class often has limited access to political power and resources, which may lead to feelings of disenfranchisement and a desire to participate in political boycotts as a form of protest. Additionally, the cultural relativism of Egypt plays a role in shaping attitudes towards political participation, as there is a history of political activism and resistance. Therefore, it is likely that from this perspective, the answer chosen would be \"Have done\" (1) as a form of expressing dissent and frustration with the political system.\n\n1"]}, {"persona": {"region": "Cairo", "sex": "male", "age": 58, "country": "Egypt", "marital_status": "married", "education": "higher", "social_class": "lower middle class"}, "question": {"id": "Q210", "variant": 0}, "response": ["Based on the anthropological framework, as a married male from Cairo, Egypt, my emic perspective is influenced by my cultural context, individual values, and socioeconomic background. In Egypt, political participation is heavily influenced by cultural norms and socioeconomic status. As a lower middle class individual with a higher education, I have a nuanced understanding of the political landscape in Egypt and the potential impact of political boycotts. I have personally witnessed the effects of political decisions on my community and have participated in political boycotts in the past to express my discontent with the government's actions. Therefore, my answer is (1) Have done."]}, {"persona": {"region": "Cairo", "sex": "male", "age": 50, "country": "Egypt", "marital_status": "married", "education": "middle", "social_class": "lower middle class"}, "question": {"id": "Q210", "variant": 0}, "response": ["From an anthropological perspective, my cultural context as a married male from Cairo, Egypt, who is 50 years old and part of the lower middle class, plays a significant role in shaping my answer to the question. Socioeconomic background and personal experience greatly influence my perception of political participation. In Egypt, there have been periods of political unrest and instability, and as a result, I have personally witnessed the impact of political boycotts. Additionally, my lower middle-class status and limited educational background may lead me to view political participation and boycotts differently than those from higher socioeconomic backgrounds. Furthermore, cultural relativism is important to consider, as the cultural and political context in Egypt may differ from that of other countries. Therefore, my answer is based on my personal values, experience, and cultural context, and I believe it accurately represents the perspective of the persona described above.\n\n2"]}, {"persona": {"region": "Cairo", "sex": "female", "age": 40, "country": "Egypt", "marital_status": "married", "education": "higher", "social_class": "upper middle class"}, "question": {"id": "Q210", "variant": 0}, "response": ["Based on the anthropological framework, my perspective as a married female from Cairo, Egypt, who is 40 years old and part of the upper middle class, is influenced by my emic and etic perspectives, cultural context, individual values and personal experience, socioeconomic background, cultural relativism, space and time, and nuance. As an educated woman from Cairo, I am aware of the political climate in Egypt and the importance of political participation. However, as someone from the upper middle class, I also understand the potential risks and consequences of participating in a political boycott. Additionally, my personal experiences and values shape my decision, considering the potential impact on my family and social standing. Therefore, my perspective on participating in a political boycott may differ from others' based on these factors.\n\n2"]}, {"persona": {"region": "Cairo", "sex": "female", "age": 33, "country": "Egypt", "marital_status": "married", "education": "middle", "social_class": "lower middle class"}, "question": {"id": "Q210", "variant": 0}, "response": ["Based on my cultural context and socioeconomic background as a married female from Cairo, Egypt, I have been influenced by the political climate and social norms that surround me. My personal experience and individual values have also shaped my perspective. Being part of the lower middle class and having completed only middle education, I have limited access to resources and opportunities for political participation. Additionally, the cultural relativism within my community also plays a significant role in my decision-making process. Therefore, I have never participated in a political boycott.\n\n3"]}, {"persona": {"region": "Cairo", "sex": "female", "age": 37, "country": "Egypt", "marital_status": "married", "education": "middle", "social_class": "lower middle class"}, "question": {"id": "Q210", "variant": 0}, "response": ["Based on the anthropological framework, as a married female from Cairo, Egypt, with a middle education level and lower middle class background, my perspective is heavily influenced by the cultural context, socioeconomic background, and individual values. In Cairo, political participation is often influenced by cultural and social factors, and as a member of the lower middle class, I am more likely to prioritize day-to-day survival over political engagement. Additionally, my personal experiences and values may lead me to view political boycotts as ineffective or potentially risky. Therefore, I would never do a political boycott.\n\n3"]}, {"persona": {"region": "Cairo", "sex": "male", "age": 28, "country": "Egypt", "marital_status": "married", "education": "middle", "social_class": "lower middle class"}, "question": {"id": "Q210", "variant": 0}, "response": ["Based on the anthropological framework, my emic perspective as a married male from Cairo, Egypt, with a lower-middle-class socioeconomic background and completed middle education level, would influence my answer to the question. The cultural context in Egypt, especially in a city like Cairo, is deeply rooted in political activism and engagement. However, my individual values and personal experience, along with my socioeconomic background, might lead me to consider participating in a political boycott as a means of expressing dissatisfaction with the current political system and its impact on my daily life. Additionally, the nuance of the question and the specific circumstances surrounding the boycott would also play a significant role in my decision.\n\n2"]}, {"persona": {"region": "Cairo", "sex": "male", "age": 53, "country": "Egypt", "marital_status": "married", "education": "higher", "social_class": "working class"}, "question": {"id": "Q210", "variant": 0}, "response": ["Based on the anthropological framework, my answer is influenced by my cultural context as a married male from Cairo, Egypt, where political participation and activism are deeply embedded in societal structures and norms. As a member of the working class, my socioeconomic background also plays a significant role in shaping my perspectives on political participation. Additionally, my age and level of education contribute to my understanding of the political landscape. Given the nuanced phrasing of the question, and considering my individual values and personal experience, I would never do. \n\n3"]}, {"persona": {"region": "Cairo", "sex": "male", "age": 45, "country": "Egypt", "marital_status": "married", "education": "higher", "social_class": "lower middle class"}, "question": {"id": "Q210", "variant": 0}, "response": ["Based on the anthropological framework, as a married male from Cairo, Egypt, my emic perspective is shaped by the cultural context of my upbringing and personal experiences. I come from a lower middle class background with a higher education level, and my socioeconomic background plays a significant role in my decision-making. Additionally, my age and place of residence in Cairo also influence my perspective. Considering the cultural relativism and nuanced phrasing of the question, I would never participate in a political boycott. \n\n3"]}, {"persona": {"region": "Cairo", "sex": "male", "age": 52, "country": "Egypt", "marital_status": "married", "education": "middle", "social_class": "upper middle class"}, "question": {"id": "Q210", "variant": 0}, "response": ["Based on the anthropological framework, as a married male from Cairo, Egypt, my emic perspective is influenced by my cultural context, individual values, and socioeconomic background. In Egypt, political participation and activism are heavily influenced by cultural and societal norms, and my upper middle-class status may affect my willingness to participate in political boycotts. Additionally, my age and education level may shape my views on political activism. Considering all these factors, I would never participate in a political boycott.\n\n3"]}, {"persona": {"region": "Cairo", "sex": "male", "age": 22, "country": "Egypt", "marital_status": "single", "education": "higher", "social_class": "lower middle class"}, "question": {"id": "Q210", "variant": 0}, "response": ["Based on the anthropological framework, I understand that my cultural context, individual values, and socioeconomic background play a significant role in shaping my perspective. As a young adult from Cairo, Egypt, I have been influenced by the political climate and social issues prevalent in my country. Being part of the lower middle class, I am aware of the economic challenges faced by my community and the impact of political decisions on our livelihood. Additionally, my higher education level has provided me with a deeper understanding of political systems and the power of collective action. Considering these factors, I believe that I might participate in a political boycott if it aligns with my values and goals for social change.\n\n2"]}, {"persona": {"region": "Cairo", "sex": "female", "age": 57, "country": "Egypt", "marital_status": "divorced", "education": "middle", "social_class": "lower middle class"}, "question": {"id": "Q210", "variant": 0}, "response": ["Based on my personal experience and socioeconomic background as a divorced female from Cairo, Egypt, I have been directly affected by political and social dynamics in my country. As a member of the lower middle class, I have felt the impact of political decisions on my everyday life. Additionally, the cultural context in Egypt has shaped my understanding of political participation and the potential consequences of such actions. Considering all these factors, I have participated in political boycotts as a way to express my dissatisfaction with the current political system and advocate for change.\n\n1"]}, {"persona": {"region": "Cairo", "sex": "female", "age": 42, "country": "Egypt", "marital_status": "married", "education": "middle", "social_class": "working class"}, "question": {"id": "Q210", "variant": 0}, "response": ["From an emic perspective, as a married female from Cairo, Egypt, my cultural context and socioeconomic background play a significant role in my understanding and response to the question. In Egypt, there is a long history of political activism and boycotts as a means of expressing dissent and advocating for change. My personal experience and values also influence my perspective, as I have witnessed the impact of political movements and activism in my community. Additionally, as a member of the working class with a middle education level, I am keenly aware of the socioeconomic disparities and political issues that affect my daily life. Therefore, considering the cultural relativism and nuanced understanding of the question, my response will reflect my position within this context.\n\n2"]}, {"persona": {"region": "Cairo", "sex": "female", "age": 23, "country": "Egypt", "marital_status": "single", "education": "middle", "social_class": "lower middle class"}, "question": {"id": "Q210", "variant": 0}, "response": ["Based on the anthropological framework, my cultural context as a single female from Cairo, Egypt, my age, and my socioeconomic background are pivotal in my understanding and answering of this question. Growing up in a lower middle class family in Cairo, I have been exposed to the political climate and have personally witnessed the impact of political decisions on my community. My personal experience and values have also shaped my perception of political participation. Additionally, the emic and etic perspectives in my community regarding political boycotts have influenced my stance on this issue. Taking all of these factors into consideration, I can confidently say that I have never participated in a political boycott.\n\n3"]}, {"persona": {"region": "Cairo", "sex": "female", "age": 28, "country": "Egypt", "marital_status": "married", "education": "higher", "social_class": "upper middle class"}, "question": {"id": "Q210", "variant": 0}, "response": ["Based on the anthropological framework, as a married female from Cairo, Egypt, my emic perspective is heavily influenced by the cultural context of my upbringing. In Egypt, political participation is heavily influenced by cultural and societal norms, and my individual values and personal experiences have shaped my perception of political actions. Additionally, my socioeconomic background as part of the upper middle class has provided me with certain privileges and opportunities that have influenced my understanding of political engagement. Furthermore, the cultural relativism in Egypt emphasizes the importance of maintaining social harmony, which has an impact on political actions. Lastly, as a 28-year-old woman, I am influenced by my age and the current socio-political climate in Egypt. Taking all these factors into consideration, my answer would be:\n\n2\n\n(Might do)"]}, {"persona": {"region": "Cairo", "sex": "female", "age": 22, "country": "Egypt", "marital_status": "single", "education": "higher", "social_class": "lower middle class"}, "question": {"id": "Q210", "variant": 0}, "response": ["From the perspective of a single female from Cairo, Egypt, the emic and etic perspectives play a crucial role in understanding and answering this question. As a lower-middle-class individual who has completed higher education, my cultural context, individual values, and personal experiences have shaped my perception of political participation. Additionally, my socioeconomic background and the cultural relativism of my society influence my understanding of political engagement. As a 22-year-old woman living in Cairo, I have also been influenced by the space and time in which I live. Overall, my nuanced understanding of political engagement is based on these factors, and I would answer the question as follows:\n2"]}, {"persona": {"region": "Cairo", "sex": "female", "age": 39, "country": "Egypt", "marital_status": "married", "education": "middle", "social_class": "lower middle class"}, "question": {"id": "Q210", "variant": 0}, "response": ["Based on my emic perspective as a married female from Cairo, Egypt, and considering my lower middle class socioeconomic background, I have not participated in a political boycott. The cultural context and societal norms in Egypt, especially for women of my age and background, do not encourage direct political participation. Additionally, my personal experience and individual values have shaped my decision, as I have not been exposed to opportunities or encouragement to participate in such activities. The nuance of the question also plays a role, as the specific wording of \"political boycott\" may not align with the ways in which I have engaged with political issues in my community. Therefore, my answer is:\n2"]}, {"persona": {"region": "Cairo", "sex": "male", "age": 19, "country": "Egypt", "marital_status": "single", "education": "middle", "social_class": "working class"}, "question": {"id": "Q210", "variant": 0}, "response": ["Based on the anthropological framework, as a 19-year-old single male from Cairo, Egypt, my emic perspective is influenced by my age and socioeconomic background. Living in a country with a complex political history, my cultural context and individual values are shaped by my experiences as part of the working class. My personal experience and understanding of the political landscape have led me to consider participating in a political boycott as a way to express my discontent with the current state of affairs. Therefore, I have done.\n\n1"]}, {"persona": {"region": "Cairo", "sex": "female", "age": 54, "country": "Egypt", "marital_status": "married", "education": "middle", "social_class": "working class"}, "question": {"id": "Q210", "variant": 0}, "response": ["Based on the anthropological framework, my response is influenced by my cultural context, individual values, and socioeconomic background. As a married female from Cairo, Egypt, my understanding and perception of political participation are shaped by my experiences, values, and social class. My participation in political activities is also influenced by the cultural context of Egypt and the nuanced phrasing of the question. Taking into account my age and place, I would never participate in a political boycott as it goes against my personal values and the cultural norms of my society.\n\n3"]}, {"persona": {"region": "Cairo", "sex": "male", "age": 30, "country": "Egypt", "marital_status": "married", "education": "higher", "social_class": "working class"}, "question": {"id": "Q210", "variant": 0}, "response": ["Based on my emic perspective as a married male from Cairo, Egypt, I have been influenced by the cultural context and socioeconomic background of my community. Political activism and participation in boycotts are often seen as a way to challenge the status quo and demand change, but as part of the working class, I have limited resources and time to dedicate to such activities. Additionally, the cultural relativism of my society values stability and order, which may discourage me from participating in political boycotts. Furthermore, my individual values and personal experiences have shaped my perception, and I have not felt compelled to participate in a political boycott thus far. Therefore, based on my nuanced understanding of the question, I would never do.\n\n3"]}, {"persona": {"region": "Cairo", "sex": "male", "age": 39, "country": "Egypt", "marital_status": "married", "education": "higher", "social_class": "lower middle class"}, "question": {"id": "Q210", "variant": 0}, "response": ["Based on the anthropological framework, my emic perspective as a married male from Cairo, Egypt, who is 39 years old and part of the lower middle class, is influenced by my cultural context, individual values, and socioeconomic background. In Egypt, there is a long history of political activism and boycotts, and my personal experience and values may lead me to participate in a political boycott if I feel it aligns with my beliefs and goals for social change. Additionally, my socioeconomic background as part of the lower middle class may also influence my decision, as I may feel more compelled to participate in political actions as a way to advocate for my community. Therefore, my response is based on a combination of cultural context, individual values, and socioeconomic background.\n\n2"]}, {"persona": {"region": "Cairo", "sex": "female", "age": 41, "country": "Egypt", "marital_status": "married", "education": "middle", "social_class": "lower middle class"}, "question": {"id": "Q210", "variant": 0}, "response": ["Based on my emic perspective as a married female from Cairo, Egypt, my cultural context and socioeconomic background play a significant role in my understanding and response to the question. As a member of the lower middle class in Cairo, my individual values and personal experiences have shaped my perception of political participation. My age and place also influence my response. Considering the cultural relativism and nuanced phrasing of the question, I would never participate in a political boycott. \n\n3"]}, {"persona": {"region": "Cairo", "sex": "male", "age": 45, "country": "Syria", "marital_status": "single", "education": "higher", "social_class": "upper middle class"}, "question": {"id": "Q210", "variant": 0}, "response": ["Based on the anthropological framework, as a single male from Cairo, Syria, my emic perspective would be influenced by the political and social climate of my country, as well as my personal values and experiences. The cultural context of Syria and the socioeconomic background of being part of the upper middle class would also play a significant role in my answer. Additionally, my age and education level would provide nuance to my perspective. Taking all this into consideration, I would choose the following option:\n\n2"]}, {"persona": {"region": "Cairo", "sex": "male", "age": 54, "country": "Egypt", "marital_status": "married", "education": "higher", "social_class": "lower middle class"}, "question": {"id": "Q210", "variant": 0}, "response": ["Based on the anthropological framework, as a married male from Cairo, Egypt, my emic perspective would be heavily influenced by the cultural context of living in a city with a strong history of political activism and protest. My personal experiences and individual values, shaped by my higher education and lower middle class background, would also play a significant role in my decision-making. The socioeconomic background of being part of the lower middle class may lead me to feel disenfranchised and more inclined to participate in political boycotts as a form of protest. Additionally, the cultural relativism of valuing political activism in the context of Egyptian society would further influence my decision. Lastly, the nuance of the question and the specific phrasing would lead me to choose the option that best aligns with my persona.\n\n2"]}, {"persona": {"region": "Cairo", "sex": "male", "age": 65, "country": "Egypt", "marital_status": "married", "education": "middle", "social_class": "upper middle class"}, "question": {"id": "Q210", "variant": 0}, "response": ["From an emic perspective, my cultural context as a married male from Cairo, Egypt, shapes my understanding of political participation. My socioeconomic background as part of the upper middle class also influences my views. Additionally, my age and education level contribute to my individual values and personal experiences. As an older individual who has completed middle education, I have been exposed to certain political events and have developed a nuanced understanding of political engagement. Considering cultural relativism, I understand that my perspective may differ from others based on their own cultural and socioeconomic backgrounds. Taking all of this into account, I would never participate in a political boycott.\n\n3"]}, {"persona": {"region": "Cairo", "sex": "female", "age": 52, "country": "Egypt", "marital_status": "married", "education": "middle", "social_class": "upper middle class"}, "question": {"id": "Q210", "variant": 0}, "response": ["From the perspective of a married female from Cairo, Egypt, who is 52 years old, has completed middle education level, and considers herself part of the upper middle class, the answer to whether she has ever participated in a political boycott would be influenced by various factors. Her emic perspective, shaped by her cultural context, might lead her to consider the impact of political boycotts on her community and country, as well as the potential repercussions on her family and social connections. Her individual values and personal experience, coupled with her socioeconomic background, might also play a significant role in her decision-making. Additionally, her understanding of cultural relativism and the nuanced phrasing of the question would further shape her response. Considering these factors, the most likely answer from this perspective would be:\n\n2) Might do"]}, {"persona": {"region": "Cairo", "sex": "male", "age": 26, "country": "Egypt", "marital_status": "single", "education": "higher", "social_class": "lower middle class"}, "question": {"id": "Q210", "variant": 0}, "response": ["Based on the anthropological framework, I would like to approach this question from the perspective of my cultural context, individual values, and socioeconomic background. As a 26-year-old single male from Cairo, Egypt, who has completed higher education and considers myself part of the lower middle class, my understanding and perception of political boycotts are influenced by my cultural context, personal experience, and socioeconomic background. In Egypt, political activism and participation in boycotts are often associated with higher levels of education and socioeconomic status. Additionally, the political climate in Egypt may deter individuals from openly participating in boycotts due to potential consequences. Therefore, based on my background and context, I would never do participate in a political boycott.\n\n3"]}, {"persona": {"region": "Cairo", "sex": "male", "age": 32, "country": "Egypt", "marital_status": "married", "education": "middle", "social_class": "working class"}, "question": {"id": "Q210", "variant": 0}, "response": ["Based on the anthropological framework, my emic perspective as a married male from Cairo, Egypt, is shaped by my cultural context, individual values, and socioeconomic background. In Egypt, political participation is influenced by the cultural and social context, as well as by personal experiences and values. As a member of the working class and having completed only middle education, I am likely to have limited political influence and may feel disenfranchised by the political system. Additionally, the political climate in Egypt may make me hesitant to participate in political boycotts due to potential consequences. Based on these factors, my perspective would lead me to choose option (3) Would never do. \n\n3"]}, {"persona": {"region": "Cairo", "sex": "male", "age": 38, "country": "Egypt", "marital_status": "married", "education": "middle", "social_class": "lower middle class"}, "question": {"id": "Q210", "variant": 0}, "response": ["Based on the anthropological framework, as a married male from Cairo, Egypt, my emic perspective on political boycotts is influenced by the cultural context of my upbringing and the socioeconomic background of being part of the lower middle class. My individual values and personal experiences also play a role, as I have seen the impact of political protests and boycotts on my community. Additionally, the nuanced phrasing of the question and the space and time context of my age and location also influence my decision. Considering all these factors, my answer is: 2\n\n2"]}, {"persona": {"region": "Cairo", "sex": "male", "age": 58, "country": "Egypt", "marital_status": "married", "education": "higher", "social_class": "upper middle class"}, "question": {"id": "Q210", "variant": 0}, "response": ["Based on the anthropological framework, my answer to the question of whether I have ever participated in a political boycott would be influenced by my individual values, personal experience, cultural context, and socioeconomic background. As a married male from Cairo, Egypt, at the age of 58 with a higher education level and belonging to the upper middle class, I have been shaped by the political and social environment of my country. Egypt has a history of political activism and protests, and as someone with access to education and resources, I have been able to participate in political boycotts in the past as a form of expressing my dissatisfaction with the government. However, my decision to participate in a political boycott would also be influenced by the nuances of the specific situation and the potential impact on my social and economic standing.\n\n2"]}, {"persona": {"region": "Cairo", "sex": "male", "age": 49, "country": "Egypt", "marital_status": "married", "education": "middle", "social_class": "lower middle class"}, "question": {"id": "Q210", "variant": 0}, "response": ["Based on my emic perspective as a married male from Cairo, Egypt, I have been influenced by the cultural and socioeconomic background of my community. Political participation and activism are important in our culture, and I have seen the impact of political boycotts in the past. However, my individual values and personal experience have led me to prioritize providing for my family and maintaining stability in my life. As a member of the lower middle class, I have limited resources and opportunities for political engagement, so I have not actively participated in a political boycott before. Additionally, my age and education level have shaped my understanding of political activism, leading me to prioritize other means of participation that align with my personal values. \n\n2"]}, {"persona": {"region": "Cairo", "sex": "female", "age": 29, "country": "Egypt", "marital_status": "married", "education": "middle", "social_class": "working class"}, "question": {"id": "Q210", "variant": 0}, "response": ["Based on the anthropological framework, my cultural context as a married female from Cairo, Egypt, and my socioeconomic background as part of the working class will heavily influence my perspective on political participation. My individual values and personal experience, as well as the nuanced phrasing of the question, will also play a significant role in my response. Considering the historical and cultural context of Egypt, as well as the potential consequences of political activism, I have never participated in a political boycott. (3) Would never do"]}, {"persona": {"region": "Cairo", "sex": "female", "age": 36, "country": "Egypt", "marital_status": "married", "education": "higher", "social_class": "lower middle class"}, "question": {"id": "Q210", "variant": 0}, "response": ["Based on the anthropological framework, as a married female from Cairo, Egypt, my emic perspective is influenced by my cultural context, individual values, and socioeconomic background. In Egypt, political boycotts are often seen as a form of protest against the government, and as a member of the lower middle class, I am aware of the impact of political decisions on my family's well-being. My personal experience and values also play a role in my decision-making, as I prioritize stability and security for my loved ones. Additionally, cultural relativism reminds me that my perspective may differ from others due to my specific cultural and socioeconomic context. Therefore, my answer to the question is:\n\n2) Might do"]}, {"persona": {"region": "Cairo", "sex": "female", "age": 34, "country": "Egypt", "marital_status": "married", "education": "middle", "social_class": "lower middle class"}, "question": {"id": "Q210", "variant": 0}, "response": ["Based on the anthropological framework, my perspective as a married female from Cairo, Egypt, who is 34 years old and part of the lower middle class is influenced by a combination of cultural context, individual values, and socioeconomic background. In Egypt, there is a strong tradition of political participation, and many people in my community have participated in political boycotts as a form of protest. However, my personal experience and values lead me to believe that while I have not participated in a political boycott in the past, I might consider doing so in the future if the circumstances and cause align with my beliefs and the needs of my family and community. Additionally, my socioeconomic background as part of the lower middle class might also play a role in my decision, as I may feel more compelled to participate in political boycotts if they directly impact my economic and social well-being. \n\n2"]}, {"persona": {"region": "Fayoum", "sex": "male", "age": 57, "country": "Egypt", "marital_status": "married", "education": "middle", "social_class": "working class"}, "question": {"id": "Q210", "variant": 0}, "response": ["Based on the anthropological framework, my cultural context as a married male from Fayoum, Egypt, my age, education level, and working-class background all play a significant role in my perspective. The socioeconomic background and cultural context of Egypt, as well as my personal experience and values, would influence my decision. Additionally, the space and time in which I live, as well as the nuanced phrasing of the question, would also factor into my answer.\n\n2"]}, {"persona": {"region": "Fayoum", "sex": "male", "age": 60, "country": "Egypt", "marital_status": "married", "education": "middle", "social_class": "lower middle class"}, "question": {"id": "Q210", "variant": 0}, "response": ["Based on my personal experience and socioeconomic background, as a married male from Fayoum, Egypt, who is 60 years old and part of the lower middle class, I have never participated in a political boycott. The cultural context and values in my community prioritize stability and working within the existing political system, and my individual values align with this perspective. Additionally, my age and socioeconomic background have influenced my decision, as I have not been exposed to opportunities or resources that would lead me to participate in a boycott. Therefore, I would never do. \n\n3"]}, {"persona": {"region": "Fayoum", "sex": "male", "age": 21, "country": "Egypt", "marital_status": "single", "education": "middle", "social_class": "lower middle class"}, "question": {"id": "Q210", "variant": 0}, "response": ["From the perspective of a single male from Fayoum, Egypt, who has completed middle education and considers himself part of the lower middle class, it is important to consider the cultural context and individual values in understanding his potential participation in a political boycott. The socioeconomic background and cultural relativism also play a significant role in shaping his perspective. Given the current political climate in Egypt, where there is a history of political unrest and government crackdown on dissent, the individual values and personal experience of this persona may lead him to be cautious about openly participating in a political boycott. Furthermore, the nuance of the question and the potential consequences of such actions in his community should be considered. \n\n3"]}, {"persona": {"region": "Fayoum", "sex": "male", "age": 33, "country": "Egypt", "marital_status": "single", "education": "higher", "social_class": "working class"}, "question": {"id": "Q210", "variant": 0}, "response": ["Based on the anthropological framework, as a single male from Fayoum, Egypt, my emic perspective is influenced by my cultural context, individual values and personal experience, and socioeconomic background. As part of the working class, I have experienced the impact of political decisions on my daily life. My personal values and experience have shaped my understanding of the political system and the potential effectiveness of a boycott. Additionally, my socioeconomic background has influenced my perspective on political participation. Considering these factors, I would choose:\n\n2"]}, {"persona": {"region": "Fayoum", "sex": "male", "age": 32, "country": "Egypt", "marital_status": "married", "education": "higher", "social_class": "lower middle class"}, "question": {"id": "Q210", "variant": 0}, "response": ["Based on my emic perspective as a married male from Fayoum, Egypt, I have a strong sense of loyalty to my community and family. My cultural context and socioeconomic background as part of the lower middle class have shaped my values and personal experiences. In this context, participating in a political boycott might seem like a risky or futile endeavor, as it could potentially disrupt the stability of my family and community. Additionally, cultural relativism plays a role in my understanding, as I view political participation through the lens of my own cultural and socioeconomic context. Furthermore, my space and time in life, being 32 years old and having completed higher education, have influenced my perspectives on political action. Given these factors, I would never choose to participate in a political boycott. \n\n3"]}, {"persona": {"region": "Gharbia", "sex": "male", "age": 42, "country": "Egypt", "marital_status": "married", "education": "higher", "social_class": "upper middle class"}, "question": {"id": "Q210", "variant": 0}, "response": ["Based on my emic perspective as a married male from Gharbia, Egypt, I have a deep understanding of the cultural context and values within my community. In this region, there is a strong emphasis on education and social status, and as someone who has completed higher education and considers myself part of the upper middle class, I am aware of the importance of political participation. However, socioeconomic background plays a significant role in shaping individual values and personal experiences, and I have not participated in a political boycott. Additionally, cultural relativism is important to consider, and within my cultural context, participating in a political boycott may not be a common or acceptable practice. Therefore, I have never participated in a political boycott.\n\n2"]}, {"persona": {"region": "Gharbia", "sex": "male", "age": 52, "country": "Egypt", "marital_status": "married", "education": "middle", "social_class": "working class"}, "question": {"id": "Q210", "variant": 0}, "response": ["Based on the anthropological framework, my emic perspective as a married male from Gharbia, Egypt, at the age of 52 and part of the working class, is influenced by my cultural context, individual values, and socioeconomic background. In Gharbia, political participation is often influenced by factors such as family, community, and religious affiliations, and as a member of the working class, I may have limited access to political power and influence. Additionally, my personal experiences and values may shape my perspective on political boycotts. Therefore, my answer to the question is influenced by these factors.\n\n2"]}, {"persona": {"region": "Gharbia", "sex": "male", "age": 45, "country": "Egypt", "marital_status": "divorced", "education": "higher", "social_class": "upper middle class"}, "question": {"id": "Q210", "variant": 0}, "response": ["From an emic perspective, being a divorced male from Gharbia, Egypt, I have experienced the cultural and societal expectations and pressures that come with my status. My personal values and experiences as a member of the upper middle class, along with my higher education level, have shaped my understanding of political participation and activism. Taking into account the cultural context and socioeconomic background, I have a nuanced understanding of the implications of political boycotts. Therefore, my answer to the question would be:\n\n2) Might do"]}, {"persona": {"region": "Behaira", "sex": "male", "age": 23, "country": "Egypt", "marital_status": "single", "education": "middle", "social_class": "lower class"}, "question": {"id": "Q210", "variant": 0}, "response": ["From the emic perspective, as a single male from Behaira, Egypt, my cultural context, individual values, and socioeconomic background heavily influence my decision-making process. Being part of the lower class in Egypt, I have experienced firsthand the struggles and hardships faced by my community. My personal experiences and values have shaped my understanding of the political sphere, and I have come to believe that participation in a political boycott is a way to voice dissent and bring attention to the issues that affect people like me. Additionally, the cultural relativism of my community has taught me to challenge the status quo and stand up for what I believe in. Therefore, based on my nuanced understanding of the question and the factors at play in my life, I can confidently say that I have participated in a political boycott.\n1"]}, {"persona": {"region": "Behaira", "sex": "male", "age": 38, "country": "Egypt", "marital_status": "single", "education": "higher", "social_class": "lower class"}, "question": {"id": "Q210", "variant": 0}, "response": ["Based on the anthropological framework, my emic perspective as a lower-class, single male from Behaira, Egypt, with a higher education level, influences my understanding and response to the question. My cultural context, individual values, and personal experiences shape my perception of political participation. Being from a lower socioeconomic background, I am aware of the power dynamics at play in politics and how they affect my community. Additionally, my age and place also factor into my decision-making process. Therefore, my response is influenced by these nuanced factors and cultural relativism, leading me to choose option (2) Might do."]}, {"persona": {"region": "Behaira", "sex": "male", "age": 32, "country": "Egypt", "marital_status": "married", "education": "middle", "social_class": "lower class"}, "question": {"id": "Q210", "variant": 0}, "response": ["From the perspective of a married male from Behaira, Egypt, who is 32 years old, completed middle education level, and considers himself part of the lower class, the cultural context, individual values, and socioeconomic background are pivotal in understanding and answering this question. In this region, political participation is often influenced by socioeconomic background and personal experiences. Given the lower class status and limited access to political power, participation in a political boycott may be seen as a way to express dissatisfaction with the current system. Additionally, the cultural relativism of the region may lead to a nuanced understanding of political participation, where the individual values and personal experiences play a significant role in shaping the decision. \n\n2"]}, {"persona": {"region": "Behaira", "sex": "female", "age": 37, "country": "Egypt", "marital_status": "married", "education": "middle", "social_class": "working class"}, "question": {"id": "Q210", "variant": 0}, "response": ["Based on the anthropological framework, as a married female from Behaira, Egypt, who is 37 years old, completed middle education level, and considers herself part of the working class, I would approach this question from an emic perspective, considering my personal values, cultural context, and socioeconomic background. In Egypt, there is a strong sense of collective identity and the cultural context highly influences political participation. Additionally, my socioeconomic background as part of the working class may influence my perception of political boycotts, as they could be seen as a form of protest against injustices or as a risk to my livelihood. Considering these factors, I would never do a political boycott. \n\n3"]}, {"persona": {"region": "Behaira", "sex": "male", "age": 48, "country": "Egypt", "marital_status": "married", "education": "middle", "social_class": "working class"}, "question": {"id": "Q210", "variant": 0}, "response": ["Based on my emic perspective as a married male from Behaira, Egypt, I am influenced by the cultural context of my community, where political participation is often shaped by socioeconomic background and age. As a working-class individual with middle education, I am more likely to prioritize meeting the needs of my family and contributing to our household income. My personal experiences and values also play a significant role in my decision-making, as I have not been actively involved in political activism or boycotts in the past. Additionally, the cultural relativism in my community emphasizes the importance of stability and order, which may discourage me from participating in a political boycott. Therefore, I would never do so.\n\n3"]}, {"persona": {"region": "Behaira", "sex": "female", "age": 34, "country": "Egypt", "marital_status": "married", "education": "middle", "social_class": "lower class"}, "question": {"id": "Q210", "variant": 0}, "response": ["Based on the anthropological framework, my emic perspective as a lower-class married woman from Behaira, Egypt, with a middle education level and 34 years of age, greatly influences my understanding and response to the question. The cultural context of my community and socioeconomic background play a significant role in shaping my values and experiences. Political participation is often influenced by socioeconomic background and access to resources, and as a member of the lower class, I have limited opportunities for political involvement. Additionally, cultural relativism and the nuanced phrasing of the question also impact my response. Therefore, my answer is:\n\n2"]}, {"persona": {"region": "Behaira", "sex": "female", "age": 30, "country": "Egypt", "marital_status": "divorced", "education": "lower", "social_class": "lower class"}, "question": {"id": "Q210", "variant": 0}, "response": ["Based on my cultural context, as a divorced female from Behaira, Egypt, and part of the lower class, I have been influenced by my individual values and personal experiences, as well as my socioeconomic background. In this context, political participation and activism are not common due to the limited opportunities and resources available to me and others in similar socio-economic positions. Additionally, the cultural relativism in my community often discourages open political engagement, as it is not seen as a priority in our daily struggles for survival. Therefore, I have never participated in a political boycott.\n\n3"]}, {"persona": {"region": "Behaira", "sex": "male", "age": 40, "country": "Egypt", "marital_status": "married", "education": "higher", "social_class": "lower middle class"}, "question": {"id": "Q210", "variant": 0}, "response": ["Based on the anthropological framework, my perspective as a married male from Behaira, Egypt, who is 40 years old, has completed higher education, and considers myself part of the lower middle class, is shaped by my cultural context, individual values, socioeconomic background, and space and time. In my community, political participation is influenced by historical and cultural factors, as well as the availability of resources and opportunities. My personal experience and values also play a significant role in shaping my views on political engagement. Considering these factors, I would never participate in a political boycott. \n\n3"]}, {"persona": {"region": "Behaira", "sex": "male", "age": 38, "country": "Egypt", "marital_status": "married", "education": "middle", "social_class": "working class"}, "question": {"id": "Q210", "variant": 0}, "response": ["Based on the anthropological framework, my answer is influenced by my emic perspective as a working-class married male from Behaira, Egypt. The cultural context and individual values also play a role in my decision. Being from a working-class background, I am aware of the socioeconomic struggles faced by my community, and I understand the importance of political participation. However, I have only completed middle education level and may not have the same level of exposure to political activities as others. Additionally, my personal experience and age may have shaped my views on political participation. Therefore, my answer is influenced by all these factors.\n\n2"]}, {"persona": {"region": "Behaira", "sex": "female", "age": 30, "country": "Egypt", "marital_status": "married", "education": "higher", "social_class": "lower class"}, "question": {"id": "Q210", "variant": 0}, "response": ["Based on the anthropological framework, as a married female from Behaira, Egypt, with a lower socioeconomic background and higher education level, my perspective on political boycotts would be heavily influenced by my cultural context, individual values, and personal experience. In Egypt, political participation and activism are often limited for individuals from lower socioeconomic backgrounds, and as a woman, there may be additional social and cultural barriers to participation. My personal values and experience may also lead me to view political boycotts as potentially risky or ineffective, given the political climate in Egypt. Therefore, based on my emic perspective, I would never do (3) participate in a political boycott."]}, {"persona": {"region": "Behaira", "sex": "female", "age": 35, "country": "Egypt", "marital_status": "married", "education": "middle", "social_class": "working class"}, "question": {"id": "Q210", "variant": 0}, "response": ["Based on the anthropological framework, as a married female from Behaira, Egypt, my emic perspective is influenced by my cultural context, individual values, and socioeconomic background. In my community, political participation is heavily influenced by cultural norms and societal expectations. My personal experience and values are shaped by my middle education level and working-class status, which may limit my access to political knowledge and resources. Additionally, my age and place in society may impact my willingness to participate in political boycotts. Considering all these factors, my response would be: \n\n2) Might do"]}, {"persona": {"region": "Behaira", "sex": "male", "age": 52, "country": "Egypt", "marital_status": "married", "education": "middle", "social_class": "lower class"}, "question": {"id": "Q210", "variant": 0}, "response": ["Based on my emic perspective as a married male from Behaira, Egypt, I understand that political participation and boycotts are often influenced by cultural context, individual values, and socioeconomic background. Given my lower class status and limited education, I am more likely to be affected by economic and social issues, leading me to potentially participate in a political boycott as a form of protest against perceived injustices. Additionally, cultural relativism is important to consider, as my understanding of political activism may differ from that of individuals from different cultural backgrounds. Therefore, my answer to the question would reflect my personal experiences and values within the specific cultural and socioeconomic context in which I live.\n\n2"]}, {"persona": {"region": "Alexandria", "sex": "female", "age": 41, "country": "Egypt", "marital_status": "single", "education": "middle", "social_class": "lower class"}, "question": {"id": "Q210", "variant": 0}, "response": ["From the perspective of a single female from Alexandria, Egypt, who is 41 years old and considers herself part of the lower class, my answer is influenced by my cultural context, individual values, and socioeconomic background. As a member of the lower class in Egypt, I have firsthand experience of the challenges and struggles faced by my community, and I believe that participating in a political boycott could be a way to voice our collective dissatisfaction with the current political system. Additionally, my cultural context and personal values emphasize the importance of collective action and standing up for what is right. Therefore, considering my background and experiences, I would choose option (1) Have done.\n\n1"]}, {"persona": {"region": "Alexandria", "sex": "female", "age": 21, "country": "Egypt", "marital_status": "single", "education": "middle", "social_class": "lower class"}, "question": {"id": "Q210", "variant": 0}, "response": ["Based on the anthropological framework described above, my perspective as a single female from Alexandria, Egypt, who is 21 years old and part of the lower class, is heavily influenced by my cultural context, individual values, and socioeconomic background. As a member of the lower class in Egypt, I have limited access to resources and opportunities, which impacts my ability to engage in political activities. Additionally, my personal experiences and values may lead me to prioritize survival and day-to-day struggles over participation in political boycotts. Furthermore, the cultural relativism perspective suggests that my understanding of political engagement may be different from those in higher socioeconomic classes. Therefore, I may not have participated in a political boycott and would be unlikely to do so in the future.\n\n3"]}, {"persona": {"region": "Alexandria", "sex": "female", "age": 35, "country": "Egypt", "marital_status": "married", "education": "middle", "social_class": "lower class"}, "question": {"id": "Q210", "variant": 0}, "response": ["Based on the anthropological framework, as a married female from Alexandria, Egypt, my emic perspective on political boycotts is influenced by my cultural context, socioeconomic background, and personal experience. Being part of the lower class, I have seen the impact of political decisions on my community and family firsthand. My individual values and personal experience have made me more likely to participate in a political boycott as a means of expressing dissent and seeking change. Additionally, the cultural relativism of my community emphasizes the importance of collective action and resistance. Therefore, my answer to the question would be: (1) Have done"]}, {"persona": {"region": "Alexandria", "sex": "male", "age": 34, "country": "Egypt", "marital_status": "married", "education": "higher", "social_class": "working class"}, "question": {"id": "Q210", "variant": 0}, "response": ["Based on the anthropological framework, I, as a married male from Alexandria, Egypt, would approach the question of political boycott based on my emic perspective, cultural context, individual values and personal experience, and socioeconomic background. In Egypt, there is a strong culture of political activism and participation, especially among the working class. My personal experience and values align with the importance of participating in political movements and standing up for my rights. Additionally, my socioeconomic background as a working-class individual means that I am more likely to be directly affected by political decisions and therefore more likely to participate in a political boycott as a form of protest.\n\n2"]}, {"persona": {"region": "Alexandria", "sex": "female", "age": 37, "country": "Egypt", "marital_status": "married", "education": "higher", "social_class": "lower middle class"}, "question": {"id": "Q210", "variant": 0}, "response": ["Based on the anthropological framework, as a married female from Alexandria, Egypt, my emic perspective on political boycotts is influenced by my cultural context, individual values, and socioeconomic background. In Egypt, political participation is heavily influenced by cultural and societal norms, and as a lower middle class woman with higher education, I am aware of the impact politics has on my community. However, my personal experience and values lead me to believe that participation in political boycotts might do more harm than good, as it could potentially further polarize an already divided society. Therefore, I would never do. \n\n3"]}, {"persona": {"region": "Alexandria", "sex": "female", "age": 56, "country": "Egypt", "marital_status": "divorced", "education": "middle", "social_class": "working class"}, "question": {"id": "Q210", "variant": 0}, "response": ["Based on the anthropological framework, my emic perspective as a divorced female from Alexandria, Egypt, who is 56 years old and part of the working class, is influenced by my cultural context, individual values, socioeconomic background, and space and time. As a member of the working class in Egypt, I have experienced the impact of political decisions on my daily life, and I understand the importance of participating in political actions. However, my personal experience and values also play a role in my decision-making. Considering the current political climate, I might choose to participate in a political boycott to express my dissatisfaction with the government's policies, as it is a peaceful and non-violent way to make my voice heard.\n\n2"]}, {"persona": {"region": "Alexandria", "sex": "male", "age": 48, "country": "Egypt", "marital_status": "married", "education": "higher", "social_class": "working class"}, "question": {"id": "Q210", "variant": 0}, "response": ["From an emic perspective, as a married male from Alexandria, Egypt, my cultural context and socioeconomic background play a significant role in my understanding and potential participation in political boycotts. Living in a politically charged environment with a history of government oppression and limited freedom of expression, my individual values and personal experiences have shaped my perception of political activism. As a member of the working class, my socioeconomic background also influences my decision-making process. Furthermore, cultural relativism is crucial in understanding my perspective, as the political landscape in Egypt is unique and cannot be compared to other cultures. Additionally, age and place are important factors that contribute to my nuanced understanding of political participation.\n\n2"]}, {"persona": {"region": "Alexandria", "sex": "female", "age": 30, "country": "Egypt", "marital_status": "married", "education": "middle", "social_class": "working class"}, "question": {"id": "Q210", "variant": 0}, "response": ["Based on the anthropological framework, as a married female from Alexandria, Egypt, my emic perspective on political boycotts is influenced by my cultural context, individual values, socioeconomic background, and space and time. In Egypt, there is a history of political activism and protest, but as a working-class woman with only a middle education level, my access to information and resources may be limited. Additionally, my personal experience and values may shape my willingness to participate in political boycotts. Considering the current political climate and the potential risks involved, I might be open to the idea of participating in a political boycott as a form of protest, but I would need to carefully consider the potential impact on my family and livelihood. \n\n2"]}, {"persona": {"region": "Alexandria", "sex": "male", "age": 19, "country": "Egypt", "marital_status": "single", "education": "middle", "social_class": "lower class"}, "question": {"id": "Q210", "variant": 0}, "response": ["Based on the anthropological framework, my emic perspective as a young male from Alexandria, Egypt, coming from a lower socioeconomic background, is influenced by my cultural context, individual values, and personal experience. In my community, political participation is often limited and the lower class may feel marginalized and disempowered. My personal experience and values have led me to feel disillusioned with the political system and I believe that participating in a political boycott is a way to express my dissatisfaction with the current state of affairs. Additionally, the cultural relativism perspective emphasizes that there is no hierarchy of cultures, and the nuances of my particular circumstances lead me to believe that a political boycott is a valid form of protest.\n\n2"]}, {"persona": {"region": "Alexandria", "sex": "male", "age": 45, "country": "Egypt", "marital_status": "married", "education": "middle", "social_class": "lower middle class"}, "question": {"id": "Q210", "variant": 0}, "response": ["Based on my personal experience and socioeconomic background as a married male from Alexandria, Egypt, who considers himself part of the lower middle class, I have been influenced by the political and cultural context of my surroundings. In Egypt, there have been instances where political boycotts were seen as a form of protest against the government, which has had a significant impact on the society and economy. Additionally, my age and education level have provided me with a nuanced understanding of the political landscape, and I have developed certain individual values that may influence my decision. Therefore, considering all these factors, I would have to say that I might do participate in a political boycott.\n\n2"]}, {"persona": {"region": "Alexandria", "sex": "male", "age": 23, "country": "Egypt", "marital_status": "single", "education": "higher", "social_class": "lower class"}, "question": {"id": "Q210", "variant": 0}, "response": ["From the perspective of a single male from Alexandria, Egypt, who is 23 years old and comes from a lower socioeconomic background, my response to whether I have participated in a political boycott would be shaped by my cultural context, individual values, and personal experience. Living in a politically charged environment, I have witnessed and experienced the struggles of the lower class, which has influenced my perception of political activism. My socioeconomic background has limited my access to resources and opportunities, leading me to feel marginalized and voiceless in the political sphere. Therefore, I have chosen to participate in political boycotts as a way to express my discontent with the current system and demand change. My decision is a result of my nuanced understanding of the political landscape and my personal values of seeking justice and equality.\n\n1"]}, {"persona": {"region": "Alexandria", "sex": "female", "age": 28, "country": "Egypt", "marital_status": "married", "education": "middle", "social_class": "working class"}, "question": {"id": "Q210", "variant": 0}, "response": ["Based on the anthropological framework, as a married female from Alexandria, Egypt, my emic perspective is influenced by the cultural context of my city, my age, and my socioeconomic background as part of the working class. My individual values and personal experiences also play a role in shaping my views. Additionally, cultural relativism is important in understanding my perspective, as well as the nuanced phrasing of the question. Therefore, I might do. \n\n2"]}, {"persona": {"region": "Alexandria", "sex": "male", "age": 34, "country": "Egypt", "marital_status": "single", "education": "higher", "social_class": "working class"}, "question": {"id": "Q210", "variant": 0}, "response": ["Based on the anthropological framework, my perspective as a single male from Alexandria, Egypt is shaped by my cultural context, socioeconomic background, and personal experience. In Egypt, there is a long history of political activism and engagement, and as a member of the working class, I have been personally affected by political decisions and policies. My higher education has also exposed me to different political ideologies and movements. In this context, I have participated in political boycotts as a form of protest and expression of dissatisfaction with the political system.\n\n1"]}, {"persona": {"region": "Alexandria", "sex": "male", "age": 30, "country": "Egypt", "marital_status": "married", "education": "higher", "social_class": "lower middle class"}, "question": {"id": "Q210", "variant": 0}, "response": ["Based on the anthropological framework, my emic perspective as a lower middle-class married male from Alexandria, Egypt, is influenced by my cultural context, individual values, and socioeconomic background. In Egypt, political engagement is often tied to socioeconomic status and education level. As a member of the lower middle class with higher education, I am likely to have a nuanced understanding of political issues and may have participated in a political boycott to express my discontent with the government. Additionally, my personal experience and values may lead me to prioritize political activism as a means of expressing my concerns. Considering these factors, I would choose option (1) Have done."]}, {"persona": {"region": "Alexandria", "sex": "female", "age": 49, "country": "Egypt", "marital_status": "married", "education": "higher", "social_class": "lower middle class"}, "question": {"id": "Q210", "variant": 0}, "response": ["Based on the anthropological framework, my individual values and personal experiences as a married woman from Alexandria, Egypt, who is 49 years old and part of the lower middle class, greatly influence my perception of political participation. The cultural context of Egypt and its history of political movements also plays a significant role in shaping my views. Additionally, my socioeconomic background and access to education have provided me with a nuanced understanding of political engagement. Considering all these factors, I would never participate in a political boycott.\n\n3"]}, {"persona": {"region": "Kafr el-sheikh", "sex": "male", "age": 49, "country": "Egypt", "marital_status": "married", "education": "higher", "social_class": "working class"}, "question": {"id": "Q210", "variant": 0}, "response": ["Based on the anthropological framework, my emic perspective as a married male from Kafr el-sheikh, Egypt, who is 49 years old and part of the working class, is influenced by my cultural context, individual values, socioeconomic background, and space and time. In my community, political participation and activism are often tied to socioeconomic status and class, and I have personally witnessed the impact of political boycotts on the working class. Additionally, my personal experiences and values shape my understanding of political engagement. Therefore, I choose option (1) Have done."]}, {"persona": {"region": "Kafr el-sheikh", "sex": "male", "age": 25, "country": "Egypt", "marital_status": "single", "education": "middle", "social_class": "lower middle class"}, "question": {"id": "Q210", "variant": 0}, "response": ["Based on the anthropological framework, my emic perspective as a lower middle class male from Kafr el-sheikh, Egypt, and my personal experience and values would lead me to consider political boycotts as a potential means of expressing dissatisfaction with the political system. Additionally, my socioeconomic background and cultural context in Egypt would inform my understanding of the potential impact of political boycotts. Taking into account the nuanced phrasing of the question, I would choose:\n\n2"]}, {"persona": {"region": "Kafr el-sheikh", "sex": "male", "age": 59, "country": "Egypt", "marital_status": "married", "education": "higher", "social_class": "lower middle class"}, "question": {"id": "Q210", "variant": 0}, "response": ["Based on the anthropological framework, as a married male from Kafr el-sheikh, Egypt, my emic perspective would be influenced by my cultural context, individual values, and socioeconomic background. In this region, there is a strong tradition of political participation and engagement, and as someone with a higher education level, I understand the importance of being involved in shaping the political landscape. However, being part of the lower middle class, I also recognize the challenges and limitations that come with this socioeconomic status. Therefore, I might consider participating in a political boycott as a form of protest against certain issues, but I would also weigh the potential repercussions and impact it could have on my livelihood and family. Ultimately, my decision would be influenced by a nuanced understanding of the situation and my own personal values.\n\n2"]}, {"persona": {"region": "Kafr el-sheikh", "sex": "female", "age": 38, "country": "Egypt", "marital_status": "married", "education": "middle", "social_class": "working class"}, "question": {"id": "Q210", "variant": 0}, "response": ["Based on my emic perspective as a married female from Kafr el-sheikh, Egypt, I understand that political participation and boycotts are heavily influenced by cultural context, individual values, and socioeconomic background. In my community, there is a strong emphasis on traditional gender roles and family responsibilities, which may limit my ability to actively participate in political boycotts. Additionally, as a member of the working class, I am primarily focused on providing for my family and may not have the time or resources to engage in political activism. Furthermore, given the current political climate and potential consequences for participation, I may feel hesitant to engage in a political boycott. Taking all of these factors into consideration, I would likely never participate in a political boycott.\n\n3"]}, {"persona": {"region": "Kafr el-sheikh", "sex": "male", "age": 35, "country": "Egypt", "marital_status": "married", "education": "higher", "social_class": "lower middle class"}, "question": {"id": "Q210", "variant": 0}, "response": ["From an emic perspective, as a married male from Kafr el-sheikh, Egypt, my cultural context and socioeconomic background play a significant role in my decision-making process. Being part of the lower middle class, my individual values and personal experiences have shaped my understanding of political participation. Additionally, the cultural relativism in Egypt means that political participation is often viewed through a nuanced lens, taking into account space and time. Considering these factors, I believe that I might participate in a political boycott in the future if it aligns with my values and the current socio-political climate in Egypt.\n\n2"]}, {"persona": {"region": "Kafr el-sheikh", "sex": "male", "age": 49, "country": "Egypt", "marital_status": "married", "education": "middle", "social_class": "lower class"}, "question": {"id": "Q210", "variant": 0}, "response": ["From the perspective of a married male from Kafr el-sheikh, Egypt, who is 49 years old, has completed middle education level, and considers himself part of the lower class, it is important to consider the individual values and personal experience, as well as the socioeconomic background. In this cultural context, there may be a deep sense of disillusionment and disenfranchisement with the political system due to economic struggles and lack of representation. Additionally, the emic perspective of the community may prioritize familial and community support over political engagement. Therefore, the persona might lean towards option (1) Have done, as they may have participated in a political boycott as a form of protest against the perceived injustices and inequalities perpetuated by the political system. \n\n1"]}, {"persona": {"region": "Kafr el-sheikh", "sex": "male", "age": 37, "country": "Egypt", "marital_status": "married", "education": "middle", "social_class": "lower class"}, "question": {"id": "Q210", "variant": 0}, "response": ["Based on my emic perspective as a lower class married male from Kafr el-sheikh, Egypt, I have grown up in a cultural context where political participation may not always be accessible or encouraged. My individual values and personal experience have shaped my understanding of the limitations and challenges faced by individuals in my socioeconomic background when it comes to political engagement. Additionally, the cultural relativism in my community emphasizes the importance of collective well-being over individual political actions. Furthermore, being in the lower class and having limited access to resources, I have not had the opportunity to participate in political boycotts. Therefore, I would never do so.\n\n3"]}, {"persona": {"region": "Menofia", "sex": "female", "age": 22, "country": "Egypt", "marital_status": "single", "education": "middle", "social_class": "lower class"}, "question": {"id": "Q210", "variant": 0}, "response": ["Based on my personal experience and socioeconomic background, as a single female from Menofia, Egypt, who considers herself part of the lower class, I have been exposed to the challenges and limitations faced by people in my community. The cultural context and emic perspective have shaped my understanding of the political system and the impact it has on our lives. Considering the socioeconomic background and cultural relativism, I have never participated in a political boycott, as it is not a common practice in my community and I do not have the resources or connections to engage in such activities. Additionally, my individual values and personal experience have led me to prioritize practical ways of addressing issues, rather than participating in boycotts which may not effectively bring about change. \n\n2"]}, {"persona": {"region": "Menofia", "sex": "female", "age": 25, "country": "Egypt", "marital_status": "married", "education": "middle", "social_class": "lower class"}, "question": {"id": "Q210", "variant": 0}, "response": ["From my perspective as a married female from Menofia, Egypt, my emic perspective is heavily influenced by my cultural context, individual values, and socioeconomic background. In my community, there is a strong emphasis on family and community ties, and as a lower-class individual, I am more concerned with meeting basic needs and providing for my family than engaging in political activities. Additionally, my limited education level also affects my understanding and involvement in political matters. Based on these factors, I can confidently say that I have never participated in a political boycott. \n\n3"]}, {"persona": {"region": "Menofia", "sex": "male", "age": 28, "country": "Egypt", "marital_status": "single", "education": "higher", "social_class": "working class"}, "question": {"id": "Q210", "variant": 0}, "response": ["As a single male from Menofia, Egypt, my perspective is heavily influenced by my cultural context, socioeconomic background, and personal experience. In Egypt, there is a strong emphasis on collective action and political engagement, and as a member of the working class, I am acutely aware of the impact of government policies on my daily life. However, my individual values and personal experience also play a significant role in shaping my perspective. While I value political participation, I have never participated in a political boycott because I believe in finding alternative ways to make my voice heard and create change. Additionally, my age and education level have given me a nuanced understanding of the complexities of political action, leading me to prioritize different forms of engagement. Therefore, I would never do so, as it goes against my personal values and beliefs.\n\n3"]}, {"persona": {"region": "Menofia", "sex": "male", "age": 35, "country": "Egypt", "marital_status": "married", "education": "middle", "social_class": "lower middle class"}, "question": {"id": "Q210", "variant": 0}, "response": ["Based on my emic perspective, as a married male from Menofia, Egypt, I am influenced by the cultural context and socioeconomic background of my community. In our cultural context, there is a strong emphasis on family and community values, and participation in political activities may not be a common practice for someone like me, who considers themselves part of the lower middle class. Additionally, my individual values and personal experiences have shaped my understanding of political engagement, and based on these factors, I would never consider participating in a political boycott, as it goes against my cultural and personal beliefs. Furthermore, cultural relativism teaches us that there is no hierarchy of culture, and the nuanced phrasing of the question also plays a role in shaping my response.\n\n3"]}, {"persona": {"region": "Menofia", "sex": "male", "age": 55, "country": "Egypt", "marital_status": "married", "education": "middle", "social_class": "working class"}, "question": {"id": "Q210", "variant": 0}, "response": ["Based on my emic perspective, as a working-class male from Menofia, Egypt, my cultural context and socioeconomic background play a significant role in shaping my views on political participation. My individual values and personal experience also influence my decision-making process. Additionally, my age and education level contribute to my understanding of political boycotts. Considering the cultural relativism and nuances of the question, I would choose the option that best aligns with my persona.\n\n2"]}, {"persona": {"region": "Menofia", "sex": "male", "age": 53, "country": "Egypt", "marital_status": "married", "education": "higher", "social_class": "lower middle class"}, "question": {"id": "Q210", "variant": 0}, "response": ["From the perspective of a married male from Menofia, Egypt, who is 53 years old, completed higher education, and considers himself part of the lower middle class, my answer to the question of whether I have ever participated in a political boycott is influenced by my cultural context, individual values, and socioeconomic background. In Egypt, political participation and activism are deeply embedded in the cultural and historical context. My personal experience and values also play a significant role in shaping my perspective on political boycotts. Given my socioeconomic background and the potential consequences of participating in a political boycott, I would have to consider the potential risks and benefits before making a decision. Taking into account all these factors, I believe my answer aligns with the perspective of the persona described above.\n\n2"]}, {"persona": {"region": "Menofia", "sex": "male", "age": 59, "country": "Egypt", "marital_status": "married", "education": "middle", "social_class": "working class"}, "question": {"id": "Q210", "variant": 0}, "response": ["Based on the anthropological framework, I would like to provide my perspective as a married male from Menofia, Egypt. My emic perspective, influenced by my cultural context and socioeconomic background, is that political participation is important, but I have never participated in a political boycott. My personal experience and individual values also play a role in this decision, as I have always believed in finding alternative ways to express dissatisfaction with the political system. Additionally, my age and working-class status have shaped my understanding of political actions and their potential impact on my community. Therefore, my answer to the question would be:\n\n2"]}, {"persona": {"region": "Menofia", "sex": "female", "age": 42, "country": "Egypt", "marital_status": "married", "education": "middle", "social_class": "lower middle class"}, "question": {"id": "Q210", "variant": 0}, "response": ["From the perspective of a married woman from Menofia, Egypt, with a middle education level and lower middle-class background, my answer to the question of whether I have ever participated in a political boycott is influenced by several factors. Firstly, my cultural context and socioeconomic background play a significant role in shaping my perspective on political participation. In Egypt, political activism can be risky and may have serious consequences, especially for individuals from lower socioeconomic backgrounds. Additionally, my individual values and personal experience have led me to prioritize stability and security for my family, which may make me hesitant to engage in political boycotts. Furthermore, my age and place also factor into my decision, as the political climate and historical context of Menofia may influence my willingness to participate in such activities. Considering all these factors, I would never do (3) participate in a political boycott."]}, {"persona": {"region": "Menofia", "sex": "male", "age": 39, "country": "Egypt", "marital_status": "married", "education": "higher", "social_class": "working class"}, "question": {"id": "Q210", "variant": 0}, "response": ["Based on the anthropological framework of emic and etic perspectives, cultural context, individual values, socioeconomic background, and space and time, my perspective as a married male from Menofia, Egypt, at the age of 39, with a working-class background and higher education, is crucial in understanding my answer to the question. In Egypt, political boycotts have been used as a form of protest and expression of discontent with the government. As someone from a working-class background, I have personally witnessed the impact of political decisions on my community and my family. My higher education has also given me a deeper understanding of the political landscape and the potential effectiveness of political boycotts. Considering the cultural context and my individual values, I can confidently say that I have participated in a political boycott in the past.\n\n1"]}, {"persona": {"region": "Menofia", "sex": "male", "age": 34, "country": "Egypt", "marital_status": "married", "education": "middle", "social_class": "lower middle class"}, "question": {"id": "Q210", "variant": 0}, "response": ["From the perspective of a married male from Menofia, Egypt, who is 34 years old, has completed middle education, and considers himself part of the lower middle class, my answer to the question of whether I have ever participated in a political boycott is influenced by various factors. My cultural context, including my upbringing and social environment, has shaped my understanding of political activism and the potential consequences of participating in a boycott. Additionally, my individual values and personal experiences have led me to consider the potential impact on my family and community. Considering my socioeconomic background, I am aware of the potential risks and benefits of participating in political boycotts. Ultimately, my decision is influenced by these factors and the nuanced phrasing of the question.\n\n2"]}, {"persona": {"region": "Menofia", "sex": "male", "age": 22, "country": "Egypt", "marital_status": "single", "education": "higher", "social_class": "working class"}, "question": {"id": "Q210", "variant": 0}, "response": ["From an emic perspective, my cultural context and socioeconomic background play a significant role in my decision-making. As a single male from Menofia, Egypt, I am influenced by the political climate and the socioeconomic challenges that my community faces. Additionally, my individual values and personal experiences have shaped my understanding of political participation. Being part of the working class, I have witnessed the impact of political decisions on my community and have felt the need to take a stand. However, cultural relativism also plays a role in my decision, as I understand that different individuals may have different views on political participation. Ultimately, my nuanced understanding of the political landscape, combined with my personal experiences and values, leads me to the following choice:\n\n2"]}, {"persona": {"region": "Menofia", "sex": "male", "age": 21, "country": "Egypt", "marital_status": "single", "education": "middle", "social_class": "working class"}, "question": {"id": "Q210", "variant": 0}, "response": ["Based on my emic perspective as a single male from Menofia, Egypt, and being part of the working class, I have been influenced by my cultural context and socioeconomic background. The political climate in Egypt has been tumultuous, and as a young adult, I have witnessed the impact of political decisions on my community and family. Additionally, my individual values and personal experiences have shaped my views on political participation. Given the current state of affairs, I can see myself participating in a political boycott as a means of expressing my dissatisfaction with the government. Furthermore, the concept of cultural relativism reminds me that my perspective is not universal and may not be applicable to others in different contexts.\n\n2"]}, {"persona": {"region": "Menofia", "sex": "male", "age": 36, "country": "Egypt", "marital_status": "married", "education": "higher", "social_class": "working class"}, "question": {"id": "Q210", "variant": 0}, "response": ["Based on the anthropological framework, my emic perspective as a married male from Menofia, Egypt, with a working-class background and higher education, is shaped by my cultural context, individual values, and socioeconomic background. In Egypt, political participation is influenced by one's social and economic status, as well as by cultural norms and values. As a member of the working class, my access to political power and decision-making may be limited. Additionally, the cultural context of Egypt places a strong emphasis on collective action and social cohesion, which may influence my decision whether or not to participate in a political boycott. Considering these factors, I would never do a political boycott.\n\n3"]}, {"persona": {"region": "Menofia", "sex": "female", "age": 52, "country": "Egypt", "marital_status": "married", "education": "higher", "social_class": "lower middle class"}, "question": {"id": "Q210", "variant": 0}, "response": ["Based on the anthropological framework described above, as a married female from Menofia, Egypt, my emic perspective on political boycotts may differ from an etic perspective. My cultural context, individual values, and personal experience, as well as my socioeconomic background, all shape my understanding and approach to political participation. As a member of the lower middle class, I have experienced the impact of political decisions on my daily life and have a strong sense of agency in expressing my political views. Additionally, my age and educational background have provided me with the knowledge and critical thinking skills to make informed decisions about political engagement. Therefore, considering the nuanced phrasing of the question, I would never do participate in a political boycott. \n\n3"]}, {"persona": {"region": "Menofia", "sex": "male", "age": 52, "country": "Egypt", "marital_status": "married", "education": "higher", "social_class": "lower middle class"}, "question": {"id": "Q210", "variant": 0}, "response": ["Based on the anthropological framework, as a married male from Menofia, Egypt, my emic perspective is shaped by my cultural context, individual values, socioeconomic background, and the nuance of the question. In Egypt, political participation is heavily influenced by cultural and socioeconomic factors. As a lower middle class individual with higher education, I am likely to have a nuanced understanding of political boycotts. My personal experience and values may lead me to consider participating in a boycott, but the potential consequences of such actions in my community and the societal pressure to conform may prevent me from actually doing so. Therefore, my answer is (2) Might do."]}, {"persona": {"region": "Menofia", "sex": "male", "age": 39, "country": "Egypt", "marital_status": "married", "education": "middle", "social_class": "lower class"}, "question": {"id": "Q210", "variant": 0}, "response": ["Based on the anthropological framework, as a married male from Menofia, Egypt, my emic perspective is influenced by my cultural context, individual values, and socioeconomic background. In my community, political participation is often limited due to lower socioeconomic status and lack of access to education. Additionally, cultural relativism plays a role in shaping my perspective, as there is a strong sense of collectivism and community solidarity. Given these factors, I have never participated in a political boycott.\n\n3"]}, {"persona": {"region": "Menofia", "sex": "male", "age": 23, "country": "Egypt", "marital_status": "single", "education": "middle", "social_class": "lower middle class"}, "question": {"id": "Q210", "variant": 0}, "response": ["From the perspective of a single male from Menofia, Egypt, who is 23 years old, has completed middle education level, and considers himself part of the lower middle class, it is important to consider the cultural context and socioeconomic background. In Egypt, political participation is influenced by a complex web of social, economic, and cultural factors. As a young man from a lower middle class background, my access to political resources and opportunities for participation may be limited. Additionally, the cultural context in Egypt may shape my perceptions of political engagement and the potential consequences of participating in a political boycott. Given these factors, my decision to participate or not participate in a political boycott would be influenced by these considerations. \n\n2"]}, {"persona": {"region": "Dakahlia", "sex": "female", "age": 24, "country": "Egypt", "marital_status": "single", "education": "higher", "social_class": "lower middle class"}, "question": {"id": "Q210", "variant": 0}, "response": ["Based on the anthropological framework, as a single female from Dakahlia, Egypt, my cultural context and socioeconomic background play a significant role in shaping my perspective. Growing up in a lower-middle-class family in Egypt, I have been exposed to the political climate and the impact of political decisions on our daily lives. My individual values and personal experience have also influenced my understanding of political participation. Given the cultural context, socioeconomic background, and personal experience, I would never participate in a political boycott.\n\n3"]}, {"persona": {"region": "Dakahlia", "sex": "male", "age": 36, "country": "Egypt", "marital_status": "married", "education": "higher", "social_class": "upper middle class"}, "question": {"id": "Q210", "variant": 0}, "response": ["Based on the cultural context of Dakahlia, Egypt, where political participation is highly influenced by socioeconomic background and cultural relativism, as a married male in the upper middle class who values education and has reached a certain level of financial stability, I have not participated in a political boycott. My individual values and personal experience have led me to believe that there are other ways to effect change and make my voice heard within the system, and I see boycotts as a last resort. Furthermore, my age and place in society have shaped my understanding of political engagement, and I believe that participating in the political process is a more effective way to bring about change. Therefore, I would never do a political boycott.\n\n3"]}, {"persona": {"region": "Dakahlia", "sex": "female", "age": 71, "country": "Egypt", "marital_status": "married", "education": "higher", "social_class": "upper middle class"}, "question": {"id": "Q210", "variant": 0}, "response": ["From the perspective of a married, 71-year-old, highly educated woman from Dakahlia, Egypt, who considers herself part of the upper middle class, my cultural context and individual values would play a significant role in my response. In Egypt, political participation is often tied to social status and education, and as a member of the upper middle class with a higher education level, I may have been more likely to participate in political activities such as boycotts in my younger years, especially during periods of social and political unrest. Additionally, my age and personal experiences would also influence my response, as I may have been more politically active in my youth. However, as I have grown older, my perspective on political participation may have evolved, and I may now prioritize stability and security over activism. Based on these factors, my response would likely be influenced by a nuanced understanding of the question, considering both my past experiences and current values.\n\n2"]}, {"persona": {"region": "Dakahlia", "sex": "male", "age": 55, "country": "Egypt", "marital_status": "married", "education": "higher", "social_class": "upper middle class"}, "question": {"id": "Q210", "variant": 0}, "response": ["Based on my individual values and personal experience, as well as my socioeconomic background, I have never participated in a political boycott. As a 55-year-old male from Dakahlia, Egypt, who considers himself part of the upper middle class and has completed a higher education level, my understanding of political activism and participation is shaped by the cultural context and values of my community. Additionally, my emic perspective on political engagement is influenced by my age and place, as well as my nuanced understanding of the implications of participating in a political boycott. Therefore, my answer is: \n\n3"]}, {"persona": {"region": "Dakahlia", "sex": "male", "age": 64, "country": "Egypt", "marital_status": "married", "education": "higher", "social_class": "lower middle class"}, "question": {"id": "Q210", "variant": 0}, "response": ["From the perspective of a married male from Dakahlia, Egypt, who is 64 years old, completed higher education, and considers himself part of the lower middle class, my answer to the question of whether I have ever participated in a political boycott would be influenced by several factors. Firstly, my cultural context in Egypt and my socioeconomic background as a lower middle class individual would shape my understanding and participation in political activities. Additionally, my personal values and experiences, along with my age and place, would also play a significant role in my decision. Considering the cultural relativism and nuanced phrasing of the question, I would never do. \n\n3"]}, {"persona": {"region": "Dakahlia", "sex": "female", "age": 29, "country": "Egypt", "marital_status": "married", "education": "middle", "social_class": "lower class"}, "question": {"id": "Q210", "variant": 0}, "response": ["Based on the anthropological framework, my emic perspective as a married female from Dakahlia, Egypt, who is 29 years old and part of the lower class, is heavily influenced by my cultural context, individual values, and socioeconomic background. In my cultural context, political participation may not be a common practice for women in my community. My individual values and personal experiences may also lead me to be cautious about participating in political activities, as they may not directly impact my daily life. Additionally, my socioeconomic background may limit my access to information and resources needed to participate in political boycotts. Therefore, my perspective on political boycotts is shaped by a combination of cultural norms, personal experiences, and socioeconomic constraints. \n\n2"]}, {"persona": {"region": "Dakahlia", "sex": "female", "age": 40, "country": "Egypt", "marital_status": "married", "education": "middle", "social_class": "upper middle class"}, "question": {"id": "Q210", "variant": 0}, "response": ["Based on the anthropological framework, as a married female from Dakahlia, Egypt, my emic perspective on political participation is heavily influenced by my cultural context and socioeconomic background. In Egypt, political participation is often tied to gender roles and expectations, and my upper middle class status affords me a certain level of privilege and access to political opportunities. However, my personal values and experiences also play a significant role in shaping my views on political engagement. Considering these factors, I would never participate in a political boycott as it goes against my values and the opportunities available to me as a member of the upper middle class in Egypt.\n\n3"]}, {"persona": {"region": "Dakahlia", "sex": "male", "age": 37, "country": "Egypt", "marital_status": "married", "education": "higher", "social_class": "lower middle class"}, "question": {"id": "Q210", "variant": 0}, "response": ["Based on the anthropological framework, my answer to the question is influenced by my emic perspective as a married male from Dakahlia, Egypt. The cultural context in which I live, including my socioeconomic background as part of the lower middle class, has a significant impact on my answer. Additionally, my individual values and personal experience play a role in my decision. Considering the nuanced phrasing of the question, I would never participate in a political boycott due to the potential repercussions it could have on my family and livelihood. \n\n3"]}, {"persona": {"region": "Dakahlia", "sex": "female", "age": 45, "country": "Egypt", "marital_status": "married", "education": "middle", "social_class": "working class"}, "question": {"id": "Q210", "variant": 0}, "response": ["Based on the anthropological framework, as a married female from Dakahlia, Egypt, my emic perspective is influenced by my cultural context, individual values, and socioeconomic background. In my cultural context, political participation is often influenced by kinship networks and community ties, and as a member of the working class, I may have limited opportunities for political engagement. Additionally, my personal experiences and values may shape my willingness to participate in a political boycott. Considering these factors, I would never do. \n\n3"]}, {"persona": {"region": "Dakahlia", "sex": "male", "age": 34, "country": "Egypt", "marital_status": "single", "education": "middle", "social_class": "lower middle class"}, "question": {"id": "Q210", "variant": 0}, "response": ["Based on my emic perspective, as a member of the lower middle class in Dakahlia, Egypt, I have a strong understanding of the cultural context and socioeconomic background that shapes my experiences and decisions. I have personally witnessed the impact of political decisions on my community and understand the importance of participation. My individual values and personal experiences have also shaped my views on political participation. Given my age and the current socio-political climate, I have participated in a political boycott as a form of protest and to express my dissatisfaction with the system. This decision is nuanced and reflects my understanding of cultural relativism, as I believe in the power of collective action and the need for change in our society.\n\n1"]}, {"persona": {"region": "Dakahlia", "sex": "female", "age": 26, "country": "Egypt", "marital_status": "married", "education": "higher", "social_class": "upper middle class"}, "question": {"id": "Q210", "variant": 0}, "response": ["Based on the anthropological framework, my emic perspective as a married female from Dakahlia, Egypt, who is 26 years old and part of the upper middle class, is influenced by my cultural context, individual values, and socioeconomic background. In Egypt, political participation is influenced by cultural norms and values, as well as socioeconomic factors. As a member of the upper middle class, I have access to education and resources that may allow me to be more politically engaged. However, my personal experiences and values may also play a role in my decision. Considering the cultural relativism and nuanced phrasing of the question, I would never do a political boycott.\n\n3"]}, {"persona": {"region": "Dakahlia", "sex": "male", "age": 21, "country": "Egypt", "marital_status": "single", "education": "middle", "social_class": "upper middle class"}, "question": {"id": "Q210", "variant": 0}, "response": ["Based on the anthropological framework, as a single male from Dakahlia, Egypt, my emic perspective is influenced by the cultural context of my community, where political participation and activism may be viewed in a certain way. My individual values and personal experience, as well as my socioeconomic background, also play a significant role in shaping my perspective. In addition, cultural relativism reminds me that my understanding of political boycotts may differ from that of others, and the nuances of the question will affect my response. Considering all of these factors, I would never do. \n\n3"]}, {"persona": {"region": "Dakahlia", "sex": "female", "age": 32, "country": "Egypt", "marital_status": "married", "education": "middle", "social_class": "working class"}, "question": {"id": "Q210", "variant": 0}, "response": ["Based on the anthropological framework, as a married female from Dakahlia, Egypt, my emic perspective and cultural context would heavily influence my understanding and response to political actions. My individual values and personal experience, as well as my socioeconomic background as part of the working class, would also shape my perspective. Additionally, the cultural relativism and the importance of space and time in my community would impact my decision. Considering these factors, I would never do (3) participate in a political boycott."]}, {"persona": {"region": "Dakahlia", "sex": "female", "age": 35, "country": "Egypt", "marital_status": "married", "education": "middle", "social_class": "upper middle class"}, "question": {"id": "Q210", "variant": 0}, "response": ["Based on my emic perspective as a married female from Dakahlia, Egypt, and considering my cultural context, individual values, and socioeconomic background, I have never participated in a political boycott. In my community, there are certain expectations and norms regarding political participation, and my personal experience and values align with not engaging in political boycotts. Additionally, my socioeconomic background as part of the upper middle class has led to a level of comfort and stability that has not necessitated me to participate in such actions. Therefore, I would never do so. \n\n3"]}, {"persona": {"region": "Dakahlia", "sex": "male", "age": 33, "country": "Egypt", "marital_status": "married", "education": "middle", "social_class": "upper middle class"}, "question": {"id": "Q210", "variant": 0}, "response": ["Based on the anthropological framework, as a married male from Dakahlia, Egypt, my emic perspective on political participation and boycotts is influenced by my cultural context, individual values and personal experience, socioeconomic background, and space and time. In Egypt, there is a history of political unrest and instability, and as a member of the upper middle class, I have been fortunate enough to have some level of economic stability. My personal experience and values also play a role, as I have seen the impact of political boycotts and the potential risks involved. Additionally, my age and marital status may affect my willingness to participate in such activities. Therefore, based on these factors, I would never participate in a political boycott.\n\n3"]}, {"persona": {"region": "Dakahlia", "sex": "female", "age": 45, "country": "Egypt", "marital_status": "married", "education": "middle", "social_class": "upper middle class"}, "question": {"id": "Q210", "variant": 0}, "response": ["From the perspective of a married female from Dakahlia, Egypt, who is 45 years old and considers herself part of the upper middle class, my answer would be influenced by my cultural context, individual values, and socioeconomic background. In Egyptian society, political participation is often influenced by one's social class and educational level. As a member of the upper middle class with a middle education level, I may have been exposed to more political discussions and have a greater understanding of the potential impact of participating in a political boycott. Additionally, my personal values and experiences may shape my perspective on political activism. Considering the potential repercussions of participating in a political boycott, such as social and economic consequences, I might be more inclined to carefully consider my actions. Therefore, based on my cultural context, individual values, and socioeconomic background, my perspective on participating in a political boycott would be influenced by a nuanced understanding of the potential risks and benefits.\n\n2"]}, {"persona": {"region": "Dakahlia", "sex": "male", "age": 30, "country": "Egypt", "marital_status": "married", "education": "middle", "social_class": "upper middle class"}, "question": {"id": "Q210", "variant": 0}, "response": ["Based on my cultural context, as a married male from Dakahlia, Egypt, my participation in political activities is influenced by my socioeconomic background, individual values, and personal experiences. As a member of the upper middle class, I have access to education and resources that may make me more likely to engage in political activities. However, my middle education level may also limit my exposure to certain political ideologies and movements. Additionally, my cultural context and age may also play a role in shaping my perceptions of political participation. Taking into account these factors, I would consider the option that best aligns with my persona and perspective.\n\n2"]}, {"persona": {"region": "Dakahlia", "sex": "female", "age": 63, "country": "Egypt", "marital_status": "married", "education": "higher", "social_class": "lower middle class"}, "question": {"id": "Q210", "variant": 0}, "response": ["Based on the anthropological framework, my emic perspective as a married female from Dakahlia, Egypt, who is 63 years old and part of the lower middle class, is influenced by my cultural context, individual values, and socioeconomic background. In my cultural context, political participation may be limited for women, especially of my age and socioeconomic status. My individual values and personal experience also play a role, as I may have been raised with certain societal expectations and have experienced the impact of political decisions on my community. Additionally, my lower middle-class status may have limited my ability to participate in political activities. Therefore, based on this perspective, I would never do.\n\n3"]}, {"persona": {"region": "Dakahlia", "sex": "male", "age": 28, "country": "Egypt", "marital_status": "single", "education": "higher", "social_class": "upper middle class"}, "question": {"id": "Q210", "variant": 0}, "response": ["Based on the emic and etic perspectives, as a single male from Dakahlia, Egypt, I am influenced by the cultural context of my region, including the political climate and societal norms. My individual values and personal experience, as well as my socioeconomic background as part of the upper middle class, have shaped my perception of political participation. Cultural relativism also plays a role, as my understanding of political engagement is influenced by the cultural values and norms of my community. Additionally, space and time, as well as nuance, are important factors to consider. \n\n2"]}, {"persona": {"region": "Dakahlia", "sex": "female", "age": 24, "country": "Egypt", "marital_status": "married", "education": "higher", "social_class": "upper middle class"}, "question": {"id": "Q210", "variant": 0}, "response": ["Based on the anthropological framework, as a married female from Dakahlia, Egypt, my emic perspective is shaped by my cultural context, individual values, and socioeconomic background. In my cultural context, participation in political activities may be influenced by societal norms and expectations. My personal experience and individual values may also play a role in determining my willingness to participate in political boycotts. Additionally, my socioeconomic background as part of the upper middle class may impact my access to resources and opportunities for political engagement. Therefore, my decision on whether to participate in a political boycott would be influenced by a combination of these factors.\n\n2"]}, {"persona": {"region": "Dakahlia", "sex": "male", "age": 20, "country": "Egypt", "marital_status": "single", "education": "middle", "social_class": "upper middle class"}, "question": {"id": "Q210", "variant": 0}, "response": ["Based on the anthropological framework described above, as a single male from Dakahlia, Egypt, I have to consider the emic and etic perspectives. In my cultural context, political participation is influenced by the socioeconomic background, and as someone from the upper middle class, I may have more access and motivation to participate. My individual values and personal experience also play a role, as my middle education level may have exposed me to political ideas and perspectives. Additionally, cultural relativism is important to consider, as my age and place in society may shape my views on political participation. Therefore, based on my background and cultural context, I would never do participate in a political boycott.\n\n3"]}, {"persona": {"region": "Dakahlia", "sex": "male", "age": 45, "country": "Egypt", "marital_status": "married", "education": "middle", "social_class": "upper middle class"}, "question": {"id": "Q210", "variant": 0}, "response": ["From the perspective of a married male from Dakahlia, Egypt, it is important to consider the cultural context and socioeconomic background. In this region, there is a strong emphasis on community and family values, and political participation may be influenced by social and economic factors. Additionally, the individual's personal experiences and values, as well as their age and education level, will shape their understanding and approach to political action. Considering these factors, it is likely that this persona might consider participating in a political boycott as a potential option for expressing their views and advocating for change within the societal and cultural framework in which they live.\n\n2"]}, {"persona": {"region": "Dakahlia", "sex": "female", "age": 43, "country": "Egypt", "marital_status": "married", "education": "higher", "social_class": "upper middle class"}, "question": {"id": "Q210", "variant": 0}, "response": ["From an emic perspective, as a married female from Dakahlia, Egypt, my cultural context and socioeconomic background play a significant role in my understanding and response to political boycotts. In my community, there is a strong emphasis on maintaining social harmony and stability, and political involvement is often seen as disruptive. Additionally, as part of the upper middle class, my personal values and experiences have shaped my perception of political engagement, leading me to prioritize stability and security. Cultural relativism also plays a role, as my understanding of political participation is influenced by the societal norms and values of my community. Considering all these factors, I would never participate in a political boycott.\n\n3"]}, {"persona": {"region": "Dakahlia", "sex": "female", "age": 20, "country": "Egypt", "marital_status": "single", "education": "middle", "social_class": "upper middle class"}, "question": {"id": "Q210", "variant": 0}, "response": ["Based on the anthropological framework, as a single female from Dakahlia, Egypt, my emic perspective would be influenced by my cultural context, individual values, and socioeconomic background. In Egypt, political participation is heavily influenced by cultural norms and social expectations, particularly for women. My personal experience and values as a member of the upper middle class may also play a role in my decision. Additionally, my age and level of education may affect my understanding and interpretation of political boycotts. Considering the nuanced phrasing of the question, I would choose option (2) Might do, as it allows for the potential influence of my cultural context and personal experiences in shaping my decision.\n\n2"]}, {"persona": {"region": "Dakahlia", "sex": "female", "age": 40, "country": "Egypt", "marital_status": "single", "education": "middle", "social_class": "lower middle class"}, "question": {"id": "Q210", "variant": 0}, "response": ["From the perspective of a single female from Dakahlia, Egypt, who is 40 years old, completed middle education level, and considers herself part of the lower middle class, my answer to the question is influenced by a combination of emic and etic perspectives, cultural context, individual values and personal experience, socioeconomic background, cultural relativism, space and time, and nuance. In my cultural context, political participation may not be as accessible or encouraged for someone of my background and socioeconomic status. Additionally, my individual values and personal experience may have shaped my perception of political engagement. Considering the nuance of the question, I would choose the option:\n\n2) Might do"]}, {"persona": {"region": "Dakahlia", "sex": "female", "age": 33, "country": "Egypt", "marital_status": "married", "education": "higher", "social_class": "upper middle class"}, "question": {"id": "Q210", "variant": 0}, "response": ["From the perspective of a married female from Dakahlia, Egypt, who is 33 years old, has completed higher education, and considers herself part of the upper middle class, the answer to the question of whether she has ever participated in a political boycott would be influenced by various factors. Her emic perspective, shaped by her cultural context and individual values, might lead her to consider the potential impact of a boycott on her community and her own personal beliefs. Her socioeconomic background may also play a role in her decision, as she may have the resources and networks to participate in such political actions. Additionally, her nuanced understanding of the question may lead her to consider the timing and relevance of past political boycotts in her life. \n\n3"]}, {"persona": {"region": "Dakahlia", "sex": "female", "age": 24, "country": "Egypt", "marital_status": "married", "education": "middle", "social_class": "working class"}, "question": {"id": "Q210", "variant": 0}, "response": ["Based on the anthropological framework, as a married female from Dakahlia, Egypt, my emic perspective is influenced by my cultural context, individual values, and socioeconomic background. In my community, political participation is often limited by gender roles and social expectations. Additionally, my middle education level and working-class status may limit my exposure to political activism. Cultural relativism also plays a role in my decision-making, as my understanding of political boycotts may differ from those in other cultures. Taking all of this into consideration, I would never do a political boycott.\n\n3"]}, {"persona": {"region": "Dakahlia", "sex": "female", "age": 53, "country": "Egypt", "marital_status": "widowed", "education": "middle", "social_class": "working class"}, "question": {"id": "Q210", "variant": 0}, "response": ["From the emic and etic perspectives, as a widowed female from Dakahlia, Egypt, my in-group ways of thinking and answering this question are influenced by my cultural context, individual values, socioeconomic background, and space and time. In my cultural context, political participation is often influenced by familial and community ties, and as a member of the working class, my socioeconomic background may limit my ability to participate in political activities. Additionally, my age and personal experiences may have shaped my perception of political participation. Therefore, based on my nuanced understanding of the question and my personal values, I would never do (3) participate in a political boycott."]}, {"persona": {"region": "Dakahlia", "sex": "female", "age": 30, "country": "Egypt", "marital_status": "single", "education": "middle", "social_class": "lower middle class"}, "question": {"id": "Q210", "variant": 0}, "response": ["Based on my emic perspective as a single female from Dakahlia, Egypt, I have been influenced by the cultural context in which I live. My individual values and personal experience, as well as my socioeconomic background as part of the lower middle class, play a significant role in shaping my views and actions. Additionally, the cultural relativism in Egypt and the space and time in which I exist have also influenced my decision-making. Considering all these factors, I might choose to participate in a political boycott, as it aligns with my personal values and could potentially bring about positive change in my community.\n\n2"]}, {"persona": {"region": "Dakahlia", "sex": "male", "age": 53, "country": "Egypt", "marital_status": "married", "education": "higher", "social_class": "upper middle class"}, "question": {"id": "Q210", "variant": 0}, "response": ["Based on the anthropological framework, my cultural context as a married male from Dakahlia, Egypt, plays a significant role in shaping my perspectives and actions. As an individual with a higher education level and part of the upper middle class, my socioeconomic background and personal values influence my decision-making. Additionally, my age and place also factor into my response to the question. Taking into account the emic and etic perspectives, cultural relativism, and the nuanced phrasing of the question, I would never participate in a political boycott. \n\n3"]}, {"persona": {"region": "Dakahlia", "sex": "male", "age": 28, "country": "Egypt", "marital_status": "married", "education": "middle", "social_class": "working class"}, "question": {"id": "Q210", "variant": 0}, "response": ["Based on the anthropological framework, as a married male from Dakahlia, Egypt, my emic perspective would be heavily influenced by the cultural context of my community, where political participation may be viewed differently than in other cultures. My individual values and personal experience, along with my socioeconomic background as part of the working class, would also shape my views on political participation. Additionally, the cultural relativism in my community may also impact my understanding of political boycotts. Considering these factors, I would never do a political boycott.\n\n3"]}, {"persona": {"region": "Dakahlia", "sex": "female", "age": 38, "country": "Egypt", "marital_status": "married", "education": "middle", "social_class": "upper middle class"}, "question": {"id": "Q210", "variant": 0}, "response": ["Based on the anthropological framework, as a married female from Dakahlia, Egypt, my emic perspective is influenced by my cultural context, individual values, and socioeconomic background. In Egypt, political participation is heavily influenced by cultural and societal norms, and as a middle-class woman, my access to resources and opportunities for political engagement may be limited compared to other social groups. Additionally, my personal experience and values may lead me to prioritize other forms of societal engagement over political boycotts. Therefore, my nuanced understanding and answer to the question is: \n\n2\n\nMight do"]}, {"persona": {"region": "Gharbia", "sex": "male", "age": 27, "country": "Egypt", "marital_status": "single", "education": "higher", "social_class": "upper middle class"}, "question": {"id": "Q210", "variant": 0}, "response": ["Based on the anthropological framework, I would like to provide my perspective as a single male from Gharbia, Egypt. My emic perspective, shaped by my cultural context, individual values, and socioeconomic background, has led me to prioritize education and strive for upward mobility. As part of the upper middle class, I have been taught to value political participation and civic engagement. However, I am also aware of the potential consequences of publicly boycotting political events. Therefore, I might consider participating in a political boycott if I believe it aligns with my values and goals, but I would also weigh the potential risks and benefits before making a decision.\n\n2"]}, {"persona": {"region": "Gharbia", "sex": "female", "age": 35, "country": "Egypt", "marital_status": "married", "education": "higher", "social_class": "upper middle class"}, "question": {"id": "Q210", "variant": 0}, "response": ["Based on the anthropological framework, as a married female from Gharbia, Egypt, with a higher education level and part of the upper middle class, my emic perspective would be influenced by my cultural context, individual values, and socioeconomic background. In Gharbia, political boycotts are often seen as a way to express dissatisfaction with the government or specific policies. However, my personal values and social status might lead me to consider the potential consequences of participating in such an action. Additionally, my education has provided me with a nuanced understanding of political processes and the potential impact of boycotts. Therefore, I would consider the option of participating in a political boycott, but only if I felt it aligned with my personal values and had the potential to bring about meaningful change in my community.\n\n2"]}, {"persona": {"region": "Gharbia", "sex": "female", "age": 37, "country": "Egypt", "marital_status": "married", "education": "higher", "social_class": "upper middle class"}, "question": {"id": "Q210", "variant": 0}, "response": ["Based on my emic perspective as a married female from Gharbia, Egypt, I understand that participation in political boycotts is influenced by cultural context, individual values, and socioeconomic background. In Egypt, political participation is influenced by the country's complex political history, and as a member of the upper middle class, I have the privilege of being able to engage in political activities without as much risk as those from lower socioeconomic backgrounds. Additionally, my higher education level has provided me with a nuanced understanding of the political landscape, and I recognize the importance of political engagement in effecting change. Therefore, I have considered the possibility of participating in a political boycott if it aligns with my values and the goals I wish to achieve.\n\n2"]}, {"persona": {"region": "Gharbia", "sex": "male", "age": 43, "country": "Egypt", "marital_status": "married", "education": "middle", "social_class": "lower middle class"}, "question": {"id": "Q210", "variant": 0}, "response": ["Based on the anthropological framework, my emic perspective as a middle-aged married male from Gharbia, Egypt, with a lower middle class socioeconomic background, would influence my answer to the question. The cultural context of Egypt, with its history of political unrest and social inequality, has shaped my individual values and personal experiences. Additionally, the socioeconomic background and cultural relativism play a significant role in my decision-making process. As a result, I would never participate in a political boycott. \n\n3"]}, {"persona": {"region": "Gharbia", "sex": "male", "age": 28, "country": "Egypt", "marital_status": "single", "education": "higher", "social_class": "lower middle class"}, "question": {"id": "Q210", "variant": 0}, "response": ["Based on the anthropological framework, as a single male from Gharbia, Egypt, my emic perspective is influenced by my cultural context, individual values, and socioeconomic background. In Gharbia, there is a strong emphasis on community and family values, and as a lower middle class individual, I may feel a sense of disenfranchisement and alienation from the political system. Additionally, my personal experience and education level may lead me to critically analyze the political landscape and consider participating in a political boycott as a form of protest against perceived injustices. Therefore, I might do (2) a political boycott as a way to express my dissatisfaction with the current political system."]}, {"persona": {"region": "Gharbia", "sex": "male", "age": 39, "country": "Egypt", "marital_status": "married", "education": "middle", "social_class": "lower middle class"}, "question": {"id": "Q210", "variant": 0}, "response": ["From the perspective of a married male from Gharbia, Egypt, who is 39 years old, has completed middle education level, and considers himself part of the lower middle class, it is important to consider the cultural context and socioeconomic background. In Egypt, political participation and boycotts are often influenced by the cultural and socioeconomic factors, including the individual values and personal experiences. The emic perspective of this persona, shaped by their cultural and socioeconomic background, may lead them to have participated in a political boycott as a means of expressing their discontent with the political system. Additionally, the etic perspective, considering the broader cultural context of Egypt, suggests that political boycotts are not uncommon and may be seen as a way to make a statement. Therefore, it is likely that this persona may have participated in a political boycott as a means of expressing their frustrations with the political system.\n\n2"]}, {"persona": {"region": "Gharbia", "sex": "male", "age": 30, "country": "Egypt", "marital_status": "married", "education": "middle", "social_class": "lower middle class"}, "question": {"id": "Q210", "variant": 0}, "response": ["Based on the anthropological framework, my cultural context as a married male from Gharbia, Egypt, and my lower middle class socioeconomic background greatly influence my perception of political participation. My individual values and personal experience, as well as the emic perspective of my community, also play a significant role in my decision-making process. Additionally, the nuance of the question is important to consider, as the phrasing can impact my response. \n\n2"]}, {"persona": {"region": "Gharbia", "sex": "male", "age": 43, "country": "Egypt", "marital_status": "married", "education": "lower", "social_class": "lower middle class"}, "question": {"id": "Q210", "variant": 0}, "response": ["From the perspective of a married male from Gharbia, Egypt, who is 43 years old, completed lower education level, and considers himself part of the lower middle class, my response is shaped by the cultural context, individual values, socioeconomic background, and space and time factors. In Gharbia, political participation is often influenced by socioeconomic background and education level, and as a member of the lower middle class with lower education, my access to political information and resources may be limited. Additionally, the cultural context in Egypt may discourage political activism due to potential social and economic repercussions. Therefore, based on these factors, I would never participate in a political boycott.\n\n3"]}, {"persona": {"region": "Gharbia", "sex": "male", "age": 36, "country": "Egypt", "marital_status": "married", "education": "higher", "social_class": "lower middle class"}, "question": {"id": "Q210", "variant": 0}, "response": ["Based on the anthropological framework, my response to the question would be influenced by my cultural context, individual values and personal experience, and socioeconomic background. As a married male from Gharbia, Egypt, I am shaped by the political and social environment of my country, where participation in political activities may be influenced by societal and familial expectations. Additionally, my higher education level may have exposed me to different political ideologies and awareness of social issues. Considering my lower middle class status, I may feel the impact of political decisions more strongly, leading me to potentially participate in a political boycott as a form of protest or expression of dissatisfaction. Therefore, based on my cultural context and personal experience, I would choose the following option: \n\n2"]}, {"persona": {"region": "Gharbia", "sex": "male", "age": 25, "country": "Egypt", "marital_status": "married", "education": "middle", "social_class": "upper middle class"}, "question": {"id": "Q210", "variant": 0}, "response": ["Based on the emic and etic perspectives, as a married male from Gharbia, Egypt, my in-group ways of thinking and answering questions are influenced by my cultural context, individual values, and personal experience. My socioeconomic background as part of the upper middle class also plays a role in my perceptions. In addition, cultural relativism is important to consider, as my understanding of political boycotts may differ from those in other cultures. Furthermore, as a 25-year-old middle-educated individual, space and time are also influential factors in my decision-making. Finally, the nuanced phrasing of the question will impact my response. \n\n2"]}, {"persona": {"region": "Gharbia", "sex": "male", "age": 31, "country": "Egypt", "marital_status": "married", "education": "middle", "social_class": "upper middle class"}, "question": {"id": "Q210", "variant": 0}, "response": ["Based on the anthropological framework, as a married male from Gharbia, Egypt, my emic perspective is shaped by my cultural context, individual values, and socioeconomic background. In my cultural context, participation in political activities is highly influenced by societal norms and expectations. As a member of the upper middle class, my socioeconomic background also plays a role in my decision-making, as my family's social status and financial stability may impact my willingness to engage in political boycotts. Additionally, my personal experience and values, shaped by my education level and age, contribute to my perspective on political participation. Therefore, I would never participate in a political boycott. \n\n3"]}, {"persona": {"region": "Gharbia", "sex": "male", "age": 33, "country": "Egypt", "marital_status": "married", "education": "higher", "social_class": "lower middle class"}, "question": {"id": "Q210", "variant": 0}, "response": ["Based on the anthropological framework, as a married male from Gharbia, Egypt, my emic perspective on political participation is influenced by my cultural context, individual values, and socioeconomic background. In Egypt, political activism can be risky and can have consequences, so my personal experiences and values may lead me to be cautious about participating in political boycotts. Additionally, being part of the lower middle class, I may feel that I have limited influence in the political sphere and may prioritize other aspects of my life. Therefore, I might choose option (2) Might do."]}, {"persona": {"region": "Gharbia", "sex": "male", "age": 26, "country": "Egypt", "marital_status": "single", "education": "higher", "social_class": "upper middle class"}, "question": {"id": "Q210", "variant": 0}, "response": ["Based on my emic perspective as a single male from Gharbia, Egypt, I have been influenced by the cultural context of my community, where political participation is highly valued. My individual values and personal experience also play a role in my decision-making, as I have been raised in a family that values civic engagement. Additionally, my socioeconomic background as part of the upper middle class has provided me with the resources and education to understand the importance of political participation. Considering the nuance of the question, I would never do (3) participate in a political boycott."]}, {"persona": {"region": "Gharbia", "sex": "female", "age": 45, "country": "Egypt", "marital_status": "married", "education": "middle", "social_class": "lower middle class"}, "question": {"id": "Q210", "variant": 0}, "response": ["Based on the anthropological framework, as a married female from Gharbia, Egypt, my emic perspective is influenced by my cultural context, individual values, and socioeconomic background. In Egypt, there is a strong cultural emphasis on family and community, and my personal experience and values align with this. As a member of the lower middle class, I am concerned about the impact of political decisions on my family and community. Additionally, my middle education level has provided me with some understanding of political issues, but I may not feel confident in participating in a political boycott. Considering the nuanced phrasing of the question and the cultural relativism of Egypt, I would never do. \n\n3"]}, {"persona": {"region": "Gharbia", "sex": "female", "age": 55, "country": "Egypt", "marital_status": "married", "education": "middle", "social_class": "upper middle class"}, "question": {"id": "Q210", "variant": 0}, "response": ["Based on the anthropological framework, as a married female from Gharbia, Egypt, my emic perspective is influenced by my cultural context, individual values, and socioeconomic background. In our community, political participation is influenced by cultural norms and expectations, as well as by our socioeconomic status. As an educated woman from the upper middle class, I have been raised to value political engagement and have participated in political activities in the past. However, I also understand the importance of strategic actions and may choose to participate in a political boycott if it aligns with my values and goals for social change.\n\n1"]}, {"persona": {"region": "Gharbia", "sex": "female", "age": 27, "country": "Egypt", "marital_status": "married", "education": "higher", "social_class": "upper middle class"}, "question": {"id": "Q210", "variant": 0}, "response": ["Based on the anthropological framework, my emic perspective as a married female from Gharbia, Egypt, who is 27 years old and part of the upper middle class, would be influenced by my cultural context, individual values, and socioeconomic background. In Gharbia, there is a strong sense of community and social responsibility, and higher education has likely exposed me to political activism. However, as someone from the upper middle class, my family's stability and social status are important, and participating in a political boycott could be seen as a risk to that stability. Additionally, the cultural relativism in Egypt means that there are complex and nuanced political dynamics that influence my decision. Therefore, my answer would be:\n\n2) Might do"]}, {"persona": {"region": "Gharbia", "sex": "female", "age": 42, "country": "Egypt", "marital_status": "married", "education": "higher", "social_class": "upper middle class"}, "question": {"id": "Q210", "variant": 0}, "response": ["Based on the anthropological framework, as a married female from Gharbia, Egypt, with a higher education level and belonging to the upper middle class, my perspective is shaped by my cultural context, individual values, and socioeconomic background. In Egypt, political participation is influenced by cultural norms, personal experiences, and socioeconomic status. As a member of the upper middle class, I have the means and education to understand the potential impact of political boycotts, and I may have participated in one in the past as a form of protest or resistance. Additionally, my age and place of residence in Gharbia may have exposed me to specific political events that have influenced my views on participation in boycotts. Therefore, I would choose option (1) Have done. \n\n1"]}, {"persona": {"region": "Gharbia", "sex": "female", "age": 32, "country": "Egypt", "marital_status": "married", "education": "middle", "social_class": "upper middle class"}, "question": {"id": "Q210", "variant": 0}, "response": ["From my emic perspective as a married female from Gharbia, Egypt, I understand that political participation is heavily influenced by cultural context, individual values, and socioeconomic background. As a member of the upper middle class, I have been raised in a family that values political engagement and have been taught the importance of participating in the democratic process. Additionally, my personal experience and education have shaped my understanding of the political system and the power of my voice. Based on these factors, I have participated in political boycotts in the past as a form of peaceful protest to bring attention to issues that are important to me and my community.\n\n1"]}, {"persona": {"region": "Gharbia", "sex": "male", "age": 27, "country": "Egypt", "marital_status": "married", "education": "higher", "social_class": "upper middle class"}, "question": {"id": "Q210", "variant": 0}, "response": ["From an anthropological perspective, my response is shaped by my individual values and personal experience, as well as my socioeconomic background and cultural context as a married male from Gharbia, Egypt. As someone who has completed higher education and considers myself part of the upper middle class, I am aware of the political issues in my country and have a desire to participate in shaping the future. However, due to the potential repercussions and the current political climate, I have never participated in a political boycott, as it could potentially impact my social standing and economic stability. Therefore, I might consider participating in a political boycott in the future if the circumstances allow for it, but as of now, I have not done so.\n\n2"]}, {"persona": {"region": "Gharbia", "sex": "female", "age": 27, "country": "Egypt", "marital_status": "married", "education": "higher", "social_class": "lower middle class"}, "question": {"id": "Q210", "variant": 0}, "response": ["Based on the anthropological framework, as a married female from Gharbia, Egypt, my emic perspective is influenced by my cultural context, individual values, and socioeconomic background. In Gharbia, political engagement is often influenced by family networks and community ties, and as a lower middle class individual, I am keenly aware of the impact of political decisions on my family's livelihood. Additionally, my higher education level has provided me with a nuanced understanding of political issues, and I am open to participating in a political boycott if it aligns with my values and goals for social change. Therefore, my answer is: \n\n2) Might do"]}, {"persona": {"region": "Gharbia", "sex": "female", "age": 37, "country": "Egypt", "marital_status": "married", "education": "middle", "social_class": "upper middle class"}, "question": {"id": "Q210", "variant": 0}, "response": ["Based on the anthropological framework, as a married female from Gharbia, Egypt, my emic perspective on political boycotts is influenced by my cultural context, individual values, and socioeconomic background. In Egypt, there is a long history of political activism and the socio-political climate can be tumultuous. My personal experiences and values, as well as my middle education level, have shaped my understanding of political engagement. Considering my upper middle class status, I have the resources and social capital to potentially participate in a political boycott if I feel it aligns with my values and goals for societal change.\n\n2"]}, {"persona": {"region": "Gharbia", "sex": "male", "age": 28, "country": "Egypt", "marital_status": "married", "education": "higher", "social_class": "working class"}, "question": {"id": "Q210", "variant": 0}, "response": ["Based on the anthropological framework, as a married male from Gharbia, Egypt, my emic perspective would be influenced by my cultural context, individual values, and socioeconomic background. In Gharbia, political participation may be influenced by familial and community ties, as well as economic factors. As a member of the working class, my personal experience and values may lead me to prioritize economic stability over political activism. Additionally, the cultural relativism perspective reminds us that political participation is subjective and influenced by various factors such as age, place, and nuanced understanding of the question. \n\n2"]}, {"persona": {"region": "Gharbia", "sex": "female", "age": 50, "country": "Egypt", "marital_status": "married", "education": "middle", "social_class": "upper middle class"}, "question": {"id": "Q210", "variant": 0}, "response": ["Based on the anthropological framework outlined, as a married female from Gharbia, Egypt, at the age of 50 and with a middle education level, my perspective is deeply influenced by my cultural context, individual values, and socioeconomic background. Being part of the upper middle class in Gharbia, I have been shaped by the political and social dynamics of my community. My experiences and personal values have led me to prioritize stability and security for my family. Therefore, I have never participated in a political boycott, as it goes against my values of maintaining social harmony and stability in my community.\n\n3"]}, {"persona": {"region": "Gharbia", "sex": "male", "age": 39, "country": "Egypt", "marital_status": "single", "education": "higher", "social_class": "working class"}, "question": {"id": "Q210", "variant": 0}, "response": ["From an emic perspective, as a single male from Gharbia, Egypt, my cultural context and socioeconomic background play a significant role in my understanding and approach to political participation. Being part of the working class and having completed higher education, I am aware of the societal and economic challenges faced by my community. My individual values and personal experiences have shaped my perception of political activism and participation. Additionally, cultural relativism teaches me to respect the perspectives and choices of others. Given the nuanced phrasing of the question, I would never participate in a political boycott. \n\n3"]}, {"persona": {"region": "Gharbia", "sex": "female", "age": 45, "country": "Egypt", "marital_status": "married", "education": "higher", "social_class": "upper middle class"}, "question": {"id": "Q210", "variant": 0}, "response": ["Based on the anthropological framework, my emic perspective as a married female from Gharbia, Egypt, with a higher education level and upper middle class background, is influenced by my cultural context, individual values, and personal experience. In Egypt, there is a strong connection between social status and political participation, and as a member of the upper middle class, I have been raised with the understanding that political engagement is important for societal change. However, my personal experience has taught me to be cautious in my political actions, as there are potential repercussions for openly participating in boycotts. Therefore, I have chosen option (2) Might do, as I am open to the idea of participating in a political boycott if the circumstances align with my values and beliefs, but I am also mindful of the potential consequences."]}, {"persona": {"region": "Sharkia", "sex": "male", "age": 35, "country": "Egypt", "marital_status": "married", "education": "higher", "social_class": "upper middle class"}, "question": {"id": "Q210", "variant": 0}, "response": ["Based on my cultural context in Sharkia, Egypt, political participation is influenced by my socioeconomic background, educational level, and age. As an educated, upper middle class male, I understand the importance of political engagement and the potential impact of a political boycott. However, I also recognize the potential risks and consequences of such actions in the current political climate. Additionally, cultural relativism and the nuanced phrasing of the question play a role in my decision-making process. Ultimately, my personal experience and values lead me to believe that while I have not participated in a political boycott in the past, I might consider doing so in the future if the circumstances were right.\n\n2"]}, {"persona": {"region": "Sharkia", "sex": "female", "age": 55, "country": "Egypt", "marital_status": "married", "education": "middle", "social_class": "lower middle class"}, "question": {"id": "Q210", "variant": 0}, "response": ["Based on the anthropological framework, my cultural context as a married female from Sharkia, Egypt, my age, and my education level all play a crucial role in my understanding and response to the question. As part of the lower middle class, my socioeconomic background also influences my perspective. In Egypt, political participation can be influenced by cultural and societal norms, as well as personal experiences and values. Additionally, the nuanced phrasing of the question and the concept of cultural relativism are important to consider. Therefore, my response is based on a combination of these factors and reflects my emic perspective as a member of this particular cultural group.\n\n3"]}, {"persona": {"region": "Sharkia", "sex": "female", "age": 27, "country": "Egypt", "marital_status": "married", "education": "middle", "social_class": "lower middle class"}, "question": {"id": "Q210", "variant": 0}, "response": ["From my emic perspective as a married female from Sharkia, Egypt, I have been raised in a culture where political engagement is important, but as a lower middle-class individual with only a middle education level, my access to political participation is limited. My cultural context, socioeconomic background, and personal experience all contribute to my decision-making. Additionally, the nuance of the question is important to consider, as the phrasing can influence my response. Taking all of this into account, I would choose option (2) Might do. \n\n2"]}, {"persona": {"region": "Sharkia", "sex": "female", "age": 52, "country": "Egypt", "marital_status": "married", "education": "middle", "social_class": "lower middle class"}, "question": {"id": "Q210", "variant": 0}, "response": ["Based on the anthropological framework, as a married female from Sharkia, Egypt, my emic perspective is influenced by my cultural context, individual values, and socioeconomic background. In my community, political participation is often influenced by familial and social networks, and my personal experience and values may lead me to consider participating in a political boycott as a way to express my discontent with the current political situation. Additionally, my lower middle class socioeconomic background may lead me to feel marginalized and powerless in political decision-making. Therefore, I might consider participating in a political boycott as a form of protest and resistance. \n\n2"]}, {"persona": {"region": "Sharkia", "sex": "male", "age": 36, "country": "Egypt", "marital_status": "married", "education": "middle", "social_class": "lower middle class"}, "question": {"id": "Q210", "variant": 0}, "response": ["From the perspective of a married male from Sharkia, Egypt, who is 36 years old, has completed middle education, and considers himself part of the lower middle class, my answer to the question of whether I have ever participated in a political boycott is influenced by several factors. Firstly, my cultural context and socioeconomic background play a significant role in my decision-making process. Living in Sharkia, where political tensions are high and the economic situation is challenging, has led me to be more aware of political issues and their impact on my daily life. Additionally, my individual values and personal experience have shaped my perspective, as I have witnessed the consequences of political unrest firsthand. Furthermore, my emic perspective as a member of the lower middle class in Egypt has influenced my decision, as I am more inclined to align with the sentiments of my community. Ultimately, based on these factors, my answer is: \n\n2\n\n(Might do)"]}, {"persona": {"region": "Sharkia", "sex": "female", "age": 20, "country": "Egypt", "marital_status": "single", "education": "middle", "social_class": "working class"}, "question": {"id": "Q210", "variant": 0}, "response": ["Based on the anthropological framework, my emic perspective as a single female from Sharkia, Egypt, who is 20 years old and part of the working class, is heavily influenced by my cultural context, individual values, and socioeconomic background. In Egypt, political participation and activism are heavily influenced by cultural and societal norms, as well as the economic status of individuals. My personal experience and values also play a significant role in shaping my perspectives on political participation. Additionally, my age and socioeconomic background also impact my understanding and approach to political engagement. Therefore, my choice is influenced by a combination of these factors, leading me to select the option:\n\n(3) Would never do"]}, {"persona": {"region": "Sharkia", "sex": "male", "age": 60, "country": "Egypt", "marital_status": "married", "education": "middle", "social_class": "working class"}, "question": {"id": "Q210", "variant": 0}, "response": ["Based on the anthropological framework, as a married male from Sharkia, Egypt, my emic perspective on political participation is influenced by my cultural context, individual values, and socioeconomic background. I come from a working-class background, with a middle education level, and at 60 years of age, I have experienced the political climate of Egypt over time. My personal experience and values lead me to consider political boycotts as a means of expressing dissatisfaction with the political system. Additionally, cultural relativism plays a role in my understanding, as I am aware of the importance of collective action in my community. Therefore, my response to the question is influenced by these factors.\n\n2"]}, {"persona": {"region": "Sharkia", "sex": "male", "age": 41, "country": "Egypt", "marital_status": "married", "education": "higher", "social_class": "upper middle class"}, "question": {"id": "Q210", "variant": 0}, "response": ["Based on the anthropological framework, my perspective as a married male from Sharkia, Egypt, aged 41, with a higher education level, and considering myself part of the upper middle class, is heavily influenced by my cultural context, individual values, and socioeconomic background. In Sharkia, there is a strong emphasis on family and community values, and political participation is often seen as a way to contribute to the well-being of society. However, as part of the upper middle class, I may also have certain privileges and opportunities that could influence my decision to participate in a political boycott. Additionally, my personal experiences and individual values play a significant role in shaping my perspective on political participation. Considering these factors, I would never do a political boycott. \n\n3"]}, {"persona": {"region": "Sharkia", "sex": "female", "age": 23, "country": "Egypt", "marital_status": "married", "education": "middle", "social_class": "lower middle class"}, "question": {"id": "Q210", "variant": 0}, "response": ["Based on the anthropological framework, my cultural context as a married female from Sharkia, Egypt, along with my age, education level, and lower middle class background, greatly influences my perception of political participation. My personal experience and values also play a significant role. Given the political climate and socioeconomic conditions in my community, I am more likely to have participated in a political boycott as a form of protest against social and economic injustices. Therefore, I would choose option (1) Have done."]}, {"persona": {"region": "Sharkia", "sex": "male", "age": 49, "country": "Egypt", "marital_status": "married", "education": "higher", "social_class": "upper middle class"}, "question": {"id": "Q210", "variant": 0}, "response": ["Based on the anthropological framework, as a married male from Sharkia, Egypt, my emic perspective is influenced by my cultural context, individual values, and socioeconomic background. In Sharkia, political participation is often influenced by kinship networks and social status, and as part of the upper middle class, there may be pressures to participate in political activities. Additionally, my personal experience and education level may have shaped my understanding of the political system and the impact of boycotts. Therefore, my response to the question is influenced by these factors.\n\n1"]}, {"persona": {"region": "Sharkia", "sex": "female", "age": 30, "country": "Egypt", "marital_status": "married", "education": "middle", "social_class": "upper middle class"}, "question": {"id": "Q210", "variant": 0}, "response": ["From the perspective of a married female from Sharkia, Egypt, who is 30 years old and part of the upper-middle class, the emic perspective on political participation is influenced by cultural context, individual values, and socioeconomic background. In Egypt, there is a rich history of political activism, and participation in political boycotts is often seen as a way to express dissent and advocate for change. However, due to the cultural and social norms in Sharkia, as well as the individual values and personal experiences of someone from the upper-middle class, the likelihood of participating in a political boycott might be lower. Socioeconomic background also plays a role, as individuals from this class may have different ways of engaging in political activism. Therefore, the response would be (2) Might do. \n\n2"]}, {"persona": {"region": "Sharkia", "sex": "male", "age": 39, "country": "Egypt", "marital_status": "married", "education": "higher", "social_class": "upper middle class"}, "question": {"id": "Q210", "variant": 0}, "response": ["Based on the anthropological framework, my emic perspective as a married male from Sharkia, Egypt, is influenced by my cultural context, individual values, and socioeconomic background. In my cultural context, there is a strong emphasis on family and community, and I have been raised to prioritize stability and harmony. Additionally, my higher education level has exposed me to different political ideologies and movements, leading me to value peaceful and constructive engagement in politics. As part of the upper middle class, I have a stake in maintaining the current political system for stability and economic prosperity. Considering these factors, I would never participate in a political boycott.\n\n3"]}, {"persona": {"region": "Sharkia", "sex": "female", "age": 26, "country": "Egypt", "marital_status": "married", "education": "middle", "social_class": "lower middle class"}, "question": {"id": "Q210", "variant": 0}, "response": ["From the emic perspective, being a married female from Sharkia, Egypt, my cultural context and personal experience play a significant role in my understanding and decision-making. As a member of the lower middle class, my socioeconomic background also influences my perceptions and actions. Additionally, the cultural relativism of my community and the nuanced phrasing of the question are crucial in shaping my response. Given these factors, I would never participate in a political boycott. \n\n3"]}, {"persona": {"region": "Sharkia", "sex": "female", "age": 48, "country": "Egypt", "marital_status": "married", "education": "middle", "social_class": "lower middle class"}, "question": {"id": "Q210", "variant": 0}, "response": ["Based on the anthropological framework, my cultural context as a married female from Sharkia, Egypt, my age, education level, and lower middle class socioeconomic background all play a role in my perspective. I have been influenced by the emic perspective of my community, which values stability and security. My personal experience and individual values also shape my understanding of political participation. Additionally, the cultural relativism within my community emphasizes the importance of maintaining social harmony. Furthermore, space and time, as well as nuance, also impact my decision-making process. With all of these factors in mind, my answer is:\n\n2\n\nMight do"]}, {"persona": {"region": "Sharkia", "sex": "male", "age": 34, "country": "Egypt", "marital_status": "married", "education": "higher", "social_class": "upper middle class"}, "question": {"id": "Q210", "variant": 0}, "response": ["From the perspective of a married male from Sharkia, Egypt, who is 34 years old and part of the upper middle class, my answer to the question is influenced by several factors. Firstly, my cultural context and socioeconomic background play a significant role in shaping my response. In Egypt, political participation is often influenced by one's social class and family connections. Additionally, my individual values and personal experience, as well as the cultural relativism prevalent in Egyptian society, also come into play. Given these factors, I would never do (3) participate in a political boycott."]}, {"persona": {"region": "Sharkia", "sex": "female", "age": 39, "country": "Egypt", "marital_status": "divorced", "education": "middle", "social_class": "lower middle class"}, "question": {"id": "Q210", "variant": 0}, "response": ["Based on my personal experience and socioeconomic background, as a divorced female from Sharkia, Egypt, I have faced many challenges and hardships. My lower middle-class status has made it difficult for me to access certain opportunities and resources. Additionally, coming from a conservative cultural context, I have always been mindful of societal expectations and limitations. Given these factors, I have never participated in a political boycott, as it is not something that aligns with my personal values and experiences. \n\n3"]}, {"persona": {"region": "Sharkia", "sex": "male", "age": 39, "country": "Egypt", "marital_status": "married", "education": "middle", "social_class": "upper middle class"}, "question": {"id": "Q210", "variant": 0}, "response": ["Based on my emic perspective as a married male from Sharkia, Egypt, I understand that political boycotts are often used as a form of protest and expression of discontent with the government or a particular political issue. In the cultural context of Egypt, there have been instances of political boycotts in response to elections or government policies. My individual values and personal experiences have shaped my understanding, and as someone from the upper middle class, I have a certain level of privilege and access to resources that may influence my decision. Additionally, the socioeconomic background and cultural relativism in Egypt play a significant role in shaping my perspective. Considering my age and place, I have witnessed various political movements and changes in the country, and I understand the nuances involved in participating in a political boycott.\n\n2"]}, {"persona": {"region": "Qaliubiya", "sex": "male", "age": 62, "country": "Egypt", "marital_status": "married", "education": "middle", "social_class": "working class"}, "question": {"id": "Q210", "variant": 0}, "response": ["Based on the anthropological framework, as a married male from Qaliubiya, Egypt, my emic perspective is heavily influenced by my cultural context, individual values, and socioeconomic background. In Egypt, there is a long history of political activism and civil unrest, and as a member of the working class, I am keenly aware of the impact of political decisions on my daily life. My personal experience and values also play a significant role in shaping my perspective. Additionally, my age and education level have provided me with a nuanced understanding of political issues. Taking all of these factors into consideration, I would never participate in a political boycott as it goes against my personal values and beliefs in the importance of civic engagement and participation in the political process.\n\n3"]}, {"persona": {"region": "Qaliubiya", "sex": "male", "age": 33, "country": "Egypt", "marital_status": "married", "education": "middle", "social_class": "working class"}, "question": {"id": "Q210", "variant": 0}, "response": ["From the perspective of a married male from Qaliubiya, Egypt, who is 33 years old, has completed middle education, and considers himself part of the working class, the emic perspective would likely be shaped by his personal experience and individual values, as well as his socioeconomic background. In Qaliubiya, there may be a strong sense of community and solidarity among the working class, and the individual may feel a sense of duty to participate in political activities that align with their values and beliefs. Additionally, the cultural context of Egypt, with its history of political activism and social movements, may influence the individual's perspective on political participation. Given these factors, the persona described might choose option (1) Have done, as they may have felt compelled to participate in a political boycott based on their personal experience and values.\n\n1"]}, {"persona": {"region": "Qaliubiya", "sex": "male", "age": 62, "country": "Egypt", "marital_status": "married", "education": "higher", "social_class": "lower middle class"}, "question": {"id": "Q210", "variant": 0}, "response": ["From an emic perspective, as a married male from Qaliubiya, Egypt, my cultural context and socioeconomic background play a significant role in my understanding and approach to political participation. My individual values and personal experience, along with my age and place, also influence my decision-making. In the context of cultural relativism, I view political boycotts as a potential tool for expressing dissent and bringing about change. Considering my lower middle-class status and the socioeconomic challenges I have faced, I might consider participating in a political boycott as a means of advocating for my community's needs and rights. Therefore, I might do (2) Might do."]}, {"persona": {"region": "Qaliubiya", "sex": "male", "age": 29, "country": "Egypt", "marital_status": "married", "education": "middle", "social_class": "working class"}, "question": {"id": "Q210", "variant": 0}, "response": ["From an emic perspective, as a married male from Qaliubiya, Egypt, my cultural context and socioeconomic background play a significant role in shaping my understanding and actions regarding political participation. My middle education level and working-class status also influence my individual values and personal experiences. Additionally, the cultural relativism in Egypt emphasizes the importance of family, community, and tradition in decision-making, while space and time also play a role in shaping my perception of political engagement. Therefore, considering these factors, I would never do a political boycott.\n\n3"]}, {"persona": {"region": "Qaliubiya", "sex": "female", "age": 42, "country": "Egypt", "marital_status": "married", "education": "higher", "social_class": "working class"}, "question": {"id": "Q210", "variant": 0}, "response": ["Based on the anthropological framework, my emic perspective as a married female from Qaliubiya, Egypt, who is 42 years old, has completed higher education, and considers myself part of the working class, is influenced by my cultural context, individual values, and socioeconomic background. In Egypt, there is a rich history of political activism and the cultural context of the country shapes the way I understand and engage in politics. My personal values and experience also play a significant role in my decision-making process, as well as my socioeconomic background as part of the working class. Additionally, the nuanced phrasing of the question and the understanding of cultural relativism also contribute to my decision. \n\n2"]}, {"persona": {"region": "Qaliubiya", "sex": "female", "age": 50, "country": "Egypt", "marital_status": "married", "education": "middle", "social_class": "lower middle class"}, "question": {"id": "Q210", "variant": 0}, "response": ["Based on my emic perspective as a married female from Qaliubiya, Egypt, and my lower middle class socioeconomic background, I have been influenced by the cultural context and individual values of my community. In this region, political participation has often been met with skepticism and distrust, particularly among those who have limited access to resources and power. Additionally, my personal experience and values have shaped my understanding of political engagement, and I have not felt compelled to participate in political boycotts. Furthermore, cultural relativism reminds us that different cultures have different attitudes towards political participation, and in my community, there is a strong emphasis on maintaining stability and harmony. Therefore, based on these factors, my answer to the question would be: \n\n3) Would never do"]}, {"persona": {"region": "Qaliubiya", "sex": "male", "age": 29, "country": "Egypt", "marital_status": "married", "education": "higher", "social_class": "lower middle class"}, "question": {"id": "Q210", "variant": 0}, "response": ["From the cultural context of Qaliubiya, Egypt, political participation and boycotts are deeply intertwined with socioeconomic background, individual values, and personal experiences. As a married male from a lower middle-class background, my access to education and exposure to political ideologies may differ from those in higher socioeconomic classes. Additionally, the cultural context of Egypt and the historical significance of political activism in the region play a role in shaping my perspective. Furthermore, my age and personal experiences have influenced my understanding of political participation. Taking all these factors into account, my response aligns with the emic perspective of this persona.\n\n2"]}, {"persona": {"region": "Qaliubiya", "sex": "male", "age": 35, "country": "Egypt", "marital_status": "married", "education": "higher", "social_class": "working class"}, "question": {"id": "Q210", "variant": 0}, "response": ["From an emic perspective, as a married male from Qaliubiya, Egypt, my cultural context and socioeconomic background play a significant role in shaping my understanding of political activism. Being part of the working class in Egypt, I have experienced the impact of political decisions on my daily life and livelihood. My individual values and personal experiences have also shaped my perception of political participation. Additionally, the cultural relativism in Egypt and the nuance of the political landscape in my country influence my decision-making process. Therefore, based on my background and experiences, I would never participate in a political boycott.\n\n3"]}, {"persona": {"region": "Qaliubiya", "sex": "female", "age": 40, "country": "Egypt", "marital_status": "married", "education": "middle", "social_class": "working class"}, "question": {"id": "Q210", "variant": 0}, "response": ["Based on the anthropological framework, my perspective as a married female from Qaliubiya, Egypt, who is 40 years old, completed middle education, and considers myself part of the working class, is heavily influenced by my cultural context, individual values, and socioeconomic background. In Egypt, political participation is deeply rooted in cultural and societal norms, and as a working-class woman, I have limited access to political resources and opportunities. Additionally, my personal experiences and values may shape my decision to participate in a political boycott. Therefore, my answer to the question is:\n\n2) Might do"]}, {"persona": {"region": "Qaliubiya", "sex": "female", "age": 48, "country": "Egypt", "marital_status": "divorced", "education": "lower", "social_class": "working class"}, "question": {"id": "Q210", "variant": 0}, "response": ["Based on the anthropological framework, my emic perspective as a divorced female from Qaliubiya, Egypt, with a lower education level and working-class background, is influenced by my cultural context, individual values, and socioeconomic background. In Egypt, political participation is influenced by cultural norms and values, as well as socioeconomic factors. As a member of the working class, I may feel marginalized and disenfranchised by the political system, leading me to potentially participate in a political boycott as a form of protest. Additionally, my personal experience and values may lead me to view political boycotts as a means of expressing dissent and bringing attention to social and economic issues affecting my community. Considering these factors, my perspective as this persona would be to choose option (1) Have done.\n\n1"]}, {"persona": {"region": "Qaliubiya", "sex": "male", "age": 46, "country": "Egypt", "marital_status": "married", "education": "middle", "social_class": "working class"}, "question": {"id": "Q210", "variant": 0}, "response": ["Based on the anthropological framework, as a married male from Qaliubiya, Egypt, I am deeply rooted in the cultural context of my community. My personal experiences and values, shaped by my working-class background and middle education level, greatly influence my perceptions and actions. Additionally, cultural relativism is a key factor in my decision-making process, as I understand and respect the societal norms and values of my community. Furthermore, my age and socioeconomic background play a significant role in my perspective. Given these factors, I have never participated in a political boycott.\n\n3"]}, {"persona": {"region": "Qaliubiya", "sex": "male", "age": 47, "country": "Egypt", "marital_status": "married", "education": "higher", "social_class": "lower middle class"}, "question": {"id": "Q210", "variant": 0}, "response": ["Based on the anthropological framework, my perspective as a married male from Qaliubiya, Egypt, with a lower middle class socioeconomic background, is heavily influenced by my cultural context, individual values, and personal experiences. In Egypt, political participation is complex and can be influenced by a variety of factors such as family, community, and social standing. Additionally, my age and education level may also impact my views on political engagement. Considering the cultural relativism aspect, I understand that political participation is not viewed the same way in all societies and may have different implications. Therefore, my decision on whether or not to participate in a political boycott is deeply rooted in my understanding of my cultural context and personal values.\n\n2"]}, {"persona": {"region": "Qaliubiya", "sex": "female", "age": 38, "country": "Egypt", "marital_status": "married", "education": "higher", "social_class": "working class"}, "question": {"id": "Q210", "variant": 0}, "response": ["Based on the anthropological framework, my cultural context as a married female from Qaliubiya, Egypt, my age, educational background, and working-class status all play a significant role in my perception and participation in political activities. My personal experience and individual values also influence my decision-making process. Additionally, the socioeconomic background of being part of the working class has shaped my understanding of political participation. Cultural relativism reminds us that different cultures have different ways of engaging in political activities, and my nuanced understanding of the question will guide my response.\n\n2"]}, {"persona": {"region": "Qaliubiya", "sex": "male", "age": 58, "country": "Egypt", "marital_status": "married", "education": "middle", "social_class": "working class"}, "question": {"id": "Q210", "variant": 0}, "response": ["Based on the anthropological framework, my answer is influenced by my emic perspective as a working-class married male from Qaliubiya, Egypt. My cultural context, socioeconomic background, and age all play a role in my decision-making. As a middle-educated individual, I have a strong sense of loyalty to my community and a deep understanding of the political landscape. Additionally, my personal experiences and values shape my perception of political participation. Therefore, I choose option (3) - Would never do."]}, {"persona": {"region": "Qaliubiya", "sex": "female", "age": 27, "country": "Egypt", "marital_status": "married", "education": "higher", "social_class": "working class"}, "question": {"id": "Q210", "variant": 0}, "response": ["Based on the anthropological framework, as a married female from Qaliubiya, Egypt, my emic perspective is influenced by my cultural context, individual values, and socioeconomic background. In Egypt, political participation is heavily influenced by cultural and social norms, and as a woman from a working-class background, my opportunities for political participation may be limited. Additionally, my personal experiences and values may shape my decision, as well as the nuanced phrasing of the question. Considering these factors, I might do (2) participate in a political boycott, as it aligns with my values and beliefs, but it would depend on the specific circumstances and opportunities for participation in my cultural and socioeconomic context."]}, {"persona": {"region": "Qaliubiya", "sex": "female", "age": 48, "country": "Egypt", "marital_status": "married", "education": "middle", "social_class": "upper middle class"}, "question": {"id": "Q210", "variant": 0}, "response": ["From an anthropological perspective, I, as a married female from Qaliubiya, Egypt, would approach this question considering my emic perspective and cultural context. In Egypt, political participation is influenced by cultural and societal norms, and as a member of the upper middle class, I would be more likely to engage in political activities. Additionally, my personal values and experiences, as well as my socioeconomic background, would play a significant role in my decision-making process. Considering the nuanced phrasing of the question and the cultural relativism within Egyptian society, I would be more inclined to have participated in a political boycott as a form of political expression.\n\n1"]}, {"persona": {"region": "Giza", "sex": "female", "age": 19, "country": "Egypt", "marital_status": "single", "education": "middle", "social_class": "working class"}, "question": {"id": "Q210", "variant": 0}, "response": ["Based on the anthropological framework, my emic perspective as a single female from Giza, Egypt, who is 19 years old and part of the working class, is heavily influenced by my cultural context, individual values, and socioeconomic background. In Egypt, political participation is often influenced by socioeconomic status and access to resources, and as a member of the working class, I have limited opportunities to engage in political boycotts. Additionally, my personal experiences and values may lead me to prioritize other forms of political engagement. Therefore, my choice reflects the nuanced understanding of my circumstances and the cultural relativism of political participation in Egypt.\n\n2"]}, {"persona": {"region": "Giza", "sex": "female", "age": 38, "country": "Egypt", "marital_status": "married", "education": "higher", "social_class": "lower middle class"}, "question": {"id": "Q210", "variant": 0}, "response": ["Based on the anthropological framework, my emic perspective as a married female from Giza, Egypt, my cultural context, and socioeconomic background all play a significant role in my decision-making. Living in a country with a complex political landscape, I am acutely aware of the impact of political decisions on my everyday life. My individual values and personal experience, as well as the cultural relativism in Egyptian society, influence my views on political participation. Additionally, my age and place in society as a 38-year-old woman from Giza, Egypt, further shape my understanding of political boycotts. Considering all these factors, I would never participate in a political boycott. \n\n3"]}, {"persona": {"region": "Beni Swaif/Beni Suef", "sex": "female", "age": 34, "country": "Egypt", "marital_status": "divorced", "education": "higher", "social_class": "lower class"}, "question": {"id": "Q210", "variant": 0}, "response": ["Based on my cultural context and socioeconomic background, as a divorced female from Beni Swaif, Egypt, I have experienced the challenges faced by individuals in the lower class. My personal values and experiences have shaped my perception of political participation, and I understand the importance of collective action. However, considering the cultural relativism and nuanced phrasing of the question, I have chosen to participate in a political boycott in the past due to the impact of political decisions on my community and family. \n\n1"]}, {"persona": {"region": "Beni Swaif/Beni Suef", "sex": "male", "age": 20, "country": "Egypt", "marital_status": "single", "education": "higher", "social_class": "working class"}, "question": {"id": "Q210", "variant": 0}, "response": ["Based on the anthropological framework, my cultural context as a working-class individual from Beni Swaif, Egypt, my age of 20, and my completion of higher education play a significant role in my understanding and participation in political activities. The emic perspective of my community values political participation and is open to the idea of political boycotts as a form of protest. My personal experience and individual values also influence my decision, and my socioeconomic background as working class may lead me to actively participate in political boycotts as a means of expressing dissent. Additionally, cultural relativism reminds us that there is no hierarchy of culture, so my perspective is valid and worth considering. Therefore, with all these factors in mind, I have chosen the following option:\n\n2"]}, {"persona": {"region": "Giza", "sex": "male", "age": 19, "country": "Egypt", "marital_status": "single", "education": "middle", "social_class": "upper middle class"}, "question": {"id": "Q210", "variant": 0}, "response": ["Based on the anthropological framework, my emic perspective as a 19-year-old male from Giza, Egypt, would be influenced by my cultural context, socioeconomic background, and individual values. In Egypt, political participation and activism are influenced by cultural and socioeconomic factors, including family background and education level. As a member of the upper middle class, I am more likely to have access to education and resources that would allow me to participate in political activities. Additionally, my age and place in Giza, where there may be more opportunities for political engagement, would also influence my perspective. Considering all these factors, my personal experience and values might lead me to consider participating in a political boycott, as it could align with my understanding of social and political issues in Egypt.\n\n2"]}, {"persona": {"region": "Giza", "sex": "female", "age": 33, "country": "Egypt", "marital_status": "married", "education": "middle", "social_class": "working class"}, "question": {"id": "Q210", "variant": 0}, "response": ["From the perspective of a married female from Giza, Egypt, who is 33 years old, completed middle education level, and considers herself part of the working class, my understanding and response to the question of political boycott participation would be shaped by my cultural context, individual values and personal experience, and socioeconomic background. Living in Giza, a city known for its political activism, I have been influenced by the cultural context of political involvement and protests. As a working-class woman, I have experienced the impact of socioeconomic factors on my daily life, and I understand the importance of participating in political actions to advocate for change. Additionally, my personal values and experiences have shaped my understanding of the importance of political engagement. Therefore, I would choose option (1) Have done, as I have in fact participated in a political boycott as a way to express my discontent with the current political situation and advocate for change. \n\n1"]}, {"persona": {"region": "Giza", "sex": "female", "age": 24, "country": "Egypt", "marital_status": "married", "education": "higher", "social_class": "working class"}, "question": {"id": "Q210", "variant": 0}, "response": ["As a married female from Giza, Egypt, my emic perspective is influenced by the cultural context of my community, where political participation is often shaped by socio-economic background and personal experience. As a member of the working class, my individual values and personal experience have led me to prioritize my family and work responsibilities over political activism. Additionally, considering the cultural relativism of my society, I understand that political boycotts may be viewed as a privileged form of activism and may not be accessible or practical for individuals in my socioeconomic position. Therefore, based on my nuanced understanding of the question and my personal circumstances, I would never participate in a political boycott.\n\n3"]}, {"persona": {"region": "Giza", "sex": "male", "age": 50, "country": "Egypt", "marital_status": "married", "education": "higher", "social_class": "working class"}, "question": {"id": "Q210", "variant": 0}, "response": ["From an anthropological perspective, my emic perspective as a married male from Giza, Egypt, who is 50 years old and part of the working class, is influenced by my cultural context, individual values, socioeconomic background, and the nuance of the question. In Egypt, there is a history of political activism and participation in boycotts as a form of protest. My personal experience and values also play a role in my decision-making, as well as my socioeconomic background as a working-class individual. Taking all of this into consideration, my answer is (2) Might do."]}, {"persona": {"region": "Beni Swaif/Beni Suef", "sex": "female", "age": 26, "country": "Egypt", "marital_status": "married", "education": "higher", "social_class": "lower middle class"}, "question": {"id": "Q210", "variant": 0}, "response": ["Based on the anthropological framework, my emic perspective as a married female from Beni Suef, Egypt, would be influenced by my cultural context, individual values and personal experience, and socioeconomic background. In Egypt, political participation is heavily influenced by cultural and societal norms, and my personal experience as a lower middle class woman would also play a role. Additionally, my age and education level would contribute to my perspective on political engagement. Considering all these factors, I would choose the following option:\n\n2"]}, {"persona": {"region": "Beni Swaif/Beni Suef", "sex": "male", "age": 40, "country": "Egypt", "marital_status": "single", "education": "lower", "social_class": "lower class"}, "question": {"id": "Q210", "variant": 0}, "response": ["Based on my emic perspective as a lower class individual from Beni Swaif/Beni Suef, Egypt, my cultural context and socioeconomic background heavily influence my answer to this question. In my community, political boycotts are often seen as a way to express dissatisfaction with the government and the ruling class. As someone who considers myself part of the lower class and has experienced the struggles of living in poverty, I have participated in political boycotts as a way to voice my discontent and demand change. Additionally, my individual values and personal experience have led me to believe that participating in political boycotts is a necessary and effective way to bring attention to the issues facing people like me. My understanding of cultural relativism also informs my belief that political boycotts are a legitimate form of protest in my cultural context. As a 40-year-old with limited education and resources, I have actively participated in political boycotts to advocate for social and economic justice in my community.\n\n1"]}, {"persona": {"region": "Beni Swaif/Beni Suef", "sex": "female", "age": 25, "country": "Egypt", "marital_status": "married", "education": "middle", "social_class": "lower middle class"}, "question": {"id": "Q210", "variant": 0}, "response": ["Based on the emic and etic perspectives, cultural context, individual values and personal experience, socioeconomic background, cultural relativism, space and time, and nuance, the persona described is a 25-year-old married woman from Beni Swaif, Egypt, who has completed middle education and considers herself part of the lower middle class. Given her cultural context and the societal norms in her community, she is likely to have a strong sense of social responsibility and may have participated in a political boycott as a form of peaceful protest or to express her dissatisfaction with the political system. Additionally, her lower middle class status and limited access to resources may have influenced her to engage in political boycotts as a way to voice her concerns. Taking into account the nuanced phrasing of the question and the cultural relativism of her background, her response is likely to be influenced by her personal experiences and values, as well as the socio-political climate in Egypt.\n\n2"]}, {"persona": {"region": "Beni Swaif/Beni Suef", "sex": "female", "age": 21, "country": "Egypt", "marital_status": "single", "education": "middle", "social_class": "lower middle class"}, "question": {"id": "Q210", "variant": 0}, "response": ["As a single female from Beni Swaif, Egypt, my emic perspective on political participation is influenced by my cultural context, individual values, and socioeconomic background. In my community, there is a strong emphasis on family and community values, and political participation is often seen as a way to challenge the status quo and bring about positive change. However, as a young woman from the lower middle class with limited educational opportunities, I am aware of the challenges and risks associated with political activism. My personal experience and values lead me to believe that while I have not yet participated in a political boycott, I might consider doing so in the future if I feel that it aligns with my values and goals for social change.\n\n2"]}, {"persona": {"region": "Beni Swaif/Beni Suef", "sex": "male", "age": 48, "country": "Egypt", "marital_status": "married", "education": "middle", "social_class": "lower middle class"}, "question": {"id": "Q210", "variant": 0}, "response": ["Based on my emic perspective as a married male from Beni Suef, Egypt, my cultural context and socioeconomic background play a significant role in shaping my understanding and approach to political participation. As someone from the lower middle class, I have limited access to resources and opportunities for political engagement. Additionally, the cultural and societal norms in my community heavily influence my perceptions and actions. Given my age and level of education, I have a nuanced understanding of the political landscape and am aware of the potential consequences of participating in a political boycott. Taking into account my individual values and personal experiences, I would be hesitant to engage in such activities due to the potential risks and lack of tangible impact. Therefore, my response to the question would be:\n2"]}, {"persona": {"region": "Beni Swaif/Beni Suef", "sex": "female", "age": 57, "country": "Egypt", "marital_status": "married", "education": "middle", "social_class": "working class"}, "question": {"id": "Q210", "variant": 0}, "response": ["Based on the anthropological framework, my emic perspective as a married female from Beni Suef, Egypt, would be influenced by my cultural context, individual values, and socioeconomic background. In my cultural context, political participation may be influenced by traditional gender roles and societal expectations. Additionally, my personal experience and values may shape my perception of political boycotts. As a member of the working class, I may have different concerns and priorities than those from higher socioeconomic backgrounds. Considering these factors, my nuanced understanding of political boycotts may lead me to choose one of the following options:\n\n3"]}, {"persona": {"region": "Beni Swaif/Beni Suef", "sex": "male", "age": 20, "country": "Egypt", "marital_status": "single", "education": "middle", "social_class": "working class"}, "question": {"id": "Q210", "variant": 0}, "response": ["Based on the anthropological framework, my response is influenced by my cultural context as a single male from Beni Suef, Egypt, where political participation is often shaped by socioeconomic background and age. My individual values and personal experience also play a significant role in my perception of political actions. Considering the working-class environment I belong to, I have been exposed to discussions about political boycotts, and I understand the impact they can have. Additionally, cultural relativism reminds me that my perspective may differ from others based on their cultural background. Taking into account the nuanced phrasing of the question, I select:\n\n2"]}, {"persona": {"region": "Giza", "sex": "female", "age": 59, "country": "Egypt", "marital_status": "married", "education": "higher", "social_class": "upper middle class"}, "question": {"id": "Q210", "variant": 0}, "response": ["Based on the anthropological framework of emic and etic perspectives, cultural context, individual values and personal experience, socioeconomic background, cultural relativism, space and time, and nuance, as a married female from Giza, Egypt, at the age of 59 with a higher education level and belonging to the upper middle class, my answer to the question would be (3) Would never do. In Egypt, particularly in the upper middle class, political participation is often viewed as risky and potentially disruptive to social stability. Additionally, my personal experience and values align with prioritizing stability and security, and I have never felt the need to participate in political boycotts."]}, {"persona": {"region": "Giza", "sex": "female", "age": 38, "country": "Egypt", "marital_status": "single", "education": "higher", "social_class": "lower middle class"}, "question": {"id": "Q210", "variant": 0}, "response": ["From an emic perspective, as a single female from Giza, Egypt, my cultural context and socioeconomic background heavily influence my perspective. My personal experience and individual values also play a significant role in shaping my understanding of political participation. In Egypt, there have been calls for political boycotts in the past, and as someone from the lower middle class, I have witnessed the impact of political decisions on my community. Additionally, my higher education level has provided me with a nuanced understanding of political issues. Therefore, based on my cultural context, socioeconomic background, personal experience, and individual values, I could see myself considering participating in a political boycott as a form of activism and resistance.\n\n2"]}, {"persona": {"region": "Giza", "sex": "female", "age": 26, "country": "Egypt", "marital_status": "single", "education": "higher", "social_class": "working class"}, "question": {"id": "Q210", "variant": 0}, "response": ["Based on the anthropological framework, my personal experience as a single working-class female from Giza, Egypt, with a higher education level, is influenced by my cultural context, socioeconomic background, and individual values. As an Egyptian, I am aware of the political climate in my country and the importance of participation in political movements. However, my socioeconomic background and working-class status may limit my ability to actively participate in political boycotts. Additionally, my individual values and personal experience may lead me to believe that there are other ways to enact change in my society. Therefore, I might consider participating in a political boycott, but it would depend on the specific circumstances and the potential impact on my life and community.\n\n2"]}, {"persona": {"region": "Giza", "sex": "male", "age": 39, "country": "Egypt", "marital_status": "married", "education": "middle", "social_class": "working class"}, "question": {"id": "Q210", "variant": 0}, "response": ["Based on the anthropological framework, my response is influenced by my cultural context, individual values, socioeconomic background, and space and time. As a married male from Giza, Egypt, I am likely to have a strong sense of community and family values, which may influence my political participation. My middle education level and working-class status may also impact my access to political information and resources. Additionally, as a 39-year-old, I have lived through various political events and changes in Egypt, which may shape my perspective on political participation. Considering these factors, I would choose option (2) Might do."]}, {"persona": {"region": "Giza", "sex": "male", "age": 36, "country": "Egypt", "marital_status": "married", "education": "middle", "social_class": "working class"}, "question": {"id": "Q210", "variant": 0}, "response": ["Based on the anthropological framework, as a married male from Giza, Egypt, my emic perspective on political participation is heavily influenced by my cultural context, socioeconomic background, and personal experience. In Egypt, political boycotts have been a common form of protest and expression, particularly among the working class. My socioeconomic background as a working-class individual also influences my perception of political participation, as I may feel disenfranchised and marginalized within the political system. Additionally, my personal experience and values play a significant role in shaping my willingness to participate in a political boycott. Therefore, my answer would be: \n\n2"]}, {"persona": {"region": "Giza", "sex": "female", "age": 30, "country": "Egypt", "marital_status": "single", "education": "higher", "social_class": "lower class"}, "question": {"id": "Q210", "variant": 0}, "response": ["Based on my personal experience and individual values, as a lower-class single female from Giza, Egypt, I have been directly impacted by the socioeconomic and cultural context of my community. I have seen the struggles and challenges faced by people like me, and I understand the importance of standing up for our rights and demanding change. Considering the emic perspective, I have witnessed the effects of political decisions on my community and the need for collective action. Therefore, I believe that I have participated in a political boycott as a way to express my discontent and demand for better representation and resources for my community.\n\n2"]}, {"persona": {"region": "Giza", "sex": "female", "age": 24, "country": "Egypt", "marital_status": "single", "education": "higher", "social_class": "lower class"}, "question": {"id": "Q210", "variant": 0}, "response": ["Based on the anthropological framework, as a single female from Giza, Egypt, my emic perspective is shaped by my cultural context, individual values, and socioeconomic background. Being part of the lower class, I have limited access to resources and opportunities, which may make me more inclined to participate in political boycotts as a form of protest against inequality and injustice. Additionally, my personal experiences and education may have heightened my awareness of political issues and activism. Therefore, I might do.\n\n2"]}, {"persona": {"region": "Giza", "sex": "male", "age": 65, "country": "Egypt", "marital_status": "married", "education": "middle", "social_class": "working class"}, "question": {"id": "Q210", "variant": 0}, "response": ["Based on the anthropological framework, as a married male from Giza, Egypt, my emic perspective would be shaped by my cultural context, individual values, and socioeconomic background. In Egypt, political participation and activism are deeply influenced by cultural and socioeconomic factors. As a member of the working class with a middle education level, I may have limited access to political resources and may feel disenfranchised from the political system. Additionally, my age and life experiences would have contributed to my perception of political participation. Considering these factors, I would never consider participating in a political boycott as I may feel that it would not bring about meaningful change and could potentially have negative consequences for me and my family. \n\n3"]}, {"persona": {"region": "Giza", "sex": "female", "age": 56, "country": "Egypt", "marital_status": "married", "education": "middle", "social_class": "working class"}, "question": {"id": "Q210", "variant": 0}, "response": ["Based on the anthropological framework, I, as a married female from Giza, Egypt, would consider my perspective from an emic viewpoint, taking into account my cultural context, individual values, socioeconomic background, and age. As a member of the working class in Egypt, my experiences and values may lead me to view political boycotts in a certain way. Additionally, my age and the historical context of Egypt would also influence my perspective. Therefore, my answer to the question would be:\n\n2"]}, {"persona": {"region": "Giza", "sex": "male", "age": 31, "country": "Egypt", "marital_status": "married", "education": "higher", "social_class": "lower middle class"}, "question": {"id": "Q210", "variant": 0}, "response": ["Based on the anthropological framework, my emic perspective as a married male from Giza, Egypt, would be influenced by my cultural context, individual values, and socioeconomic background. The cultural context in Egypt includes a history of political activism and a recent wave of political boycotts. Additionally, my individual values and personal experience might lead me to consider participating in a political boycott as a way to express my dissatisfaction with the current political situation. However, my lower middle class socioeconomic background and the potential consequences of participating in such activities may also influence my decision. Therefore, I might consider participating in a political boycott, but the decision would depend on the specific circumstances and potential risks involved.\n\n2"]}, {"persona": {"region": "Giza", "sex": "male", "age": 28, "country": "Egypt", "marital_status": "single", "education": "middle", "social_class": "working class"}, "question": {"id": "Q210", "variant": 0}, "response": ["Based on the anthropological framework, my emic perspective as a working-class male from Giza, Egypt, has been heavily shaped by my cultural context, individual values, and personal experience. Growing up in a socioeconomically disadvantaged area, I have witnessed firsthand the impact of political decisions on my community. Additionally, my limited educational opportunities have made me more reliant on my personal experience and the experiences of those around me to form my political beliefs. As a result, I have a deep sense of skepticism towards the political system and am more likely to engage in political boycotts as a form of protest and resistance.\n\n2"]}, {"persona": {"region": "Giza", "sex": "male", "age": 47, "country": "Egypt", "marital_status": "married", "education": "middle", "social_class": "lower middle class"}, "question": {"id": "Q210", "variant": 0}, "response": ["From an anthropological perspective, my emic perspective as a lower middle class married male from Giza, Egypt, is influenced by my cultural context, individual values and personal experience, socioeconomic background, and space and time. I have grown up in a society where political participation is influenced by a complex set of factors including economic status, family dynamics, and social expectations. My personal experience and values also play a role in my decision-making process. Additionally, my socioeconomic background as part of the lower middle class has shaped my understanding of the political landscape and the potential consequences of participating in a political boycott. Taking all of these factors into consideration, I would never participate in a political boycott.\n\n3"]}, {"persona": {"region": "Giza", "sex": "male", "age": 26, "country": "Egypt", "marital_status": "single", "education": "middle", "social_class": "lower middle class"}, "question": {"id": "Q210", "variant": 0}, "response": ["In my cultural context, as a single male from Giza, Egypt, my socioeconomic background as part of the lower middle class and my age of 26 greatly influences my perceptions and actions. I have completed only middle education level, which limits my access to certain opportunities and information. Additionally, my personal experience living in Egypt has taught me to be cautious about participating in political activities, as they can have significant consequences. Considering the emic and etic perspectives, I understand that my in-group may have different attitudes towards political boycotts compared to out-groups. Based on these factors, I would never participate in a political boycott.\n\n3"]}, {"persona": {"region": "Giza", "sex": "male", "age": 48, "country": "Egypt", "marital_status": "married", "education": "middle", "social_class": "upper middle class"}, "question": {"id": "Q210", "variant": 0}, "response": ["Based on my emic perspective as a married male from Giza, Egypt, I am influenced by my cultural context and socioeconomic background. In my cultural context, it is common for individuals to participate in political boycotts as a form of expressing dissatisfaction with the government. Additionally, my socioeconomic background as an upper middle class individual has provided me with the resources and opportunities to engage in political activism. Furthermore, my personal experience and values have shaped my understanding of the importance of civic engagement. Therefore, I have participated in a political boycott in the past.\n\n1"]}, {"persona": {"region": "Menya", "sex": "male", "age": 61, "country": "Egypt", "marital_status": "married", "education": "middle", "social_class": "working class"}, "question": {"id": "Q210", "variant": 0}, "response": ["From the emic perspective, as a married male from Menya, Egypt, my in-group ways of thinking about political participation are shaped by my cultural context, individual values, and socioeconomic background. In Menya, political engagement is often influenced by kinship networks and community ties, and as a working-class individual with a middle education level, my access to political resources and opportunities for participation may be limited. Additionally, my personal experiences and age play a significant role in shaping my views on political activism. Given these factors, I would never participate in a political boycott, as such actions may not align with my values and may not be perceived as an effective means of enacting change within my cultural and socioeconomic context. \n\n3"]}, {"persona": {"region": "Menya", "sex": "male", "age": 41, "country": "Egypt", "marital_status": "married", "education": "middle", "social_class": "lower middle class"}, "question": {"id": "Q210", "variant": 0}, "response": ["From the perspective of a married male from Menya, Egypt, with a middle education level and lower middle-class status, my understanding and response to the question of political boycott participation is influenced by several factors. My cultural context and socioeconomic background play a significant role in shaping my views on political activism. Additionally, my individual values and personal experience, as well as the nuanced phrasing of the question, are important considerations. Based on these factors, I would choose option (2) Might do. \n\n2"]}, {"persona": {"region": "Menya", "sex": "female", "age": 43, "country": "Egypt", "marital_status": "married", "education": "higher", "social_class": "working class"}, "question": {"id": "Q210", "variant": 0}, "response": ["Based on my cultural context in Menya, Egypt, my personal experience, and my socioeconomic background as a working-class woman who has completed higher education, I have a nuanced understanding of political participation. In Menya, there are specific cultural and social expectations for women, and as a working-class woman, my priorities and opportunities for political engagement may differ from those of women in other socioeconomic classes. Additionally, my age and personal values play a significant role in my decision-making process. Therefore, I might consider participating in a political boycott, depending on the specific circumstances and issues involved. \n\n2"]}, {"persona": {"region": "Menya", "sex": "male", "age": 57, "country": "Egypt", "marital_status": "married", "education": "middle", "social_class": "lower middle class"}, "question": {"id": "Q210", "variant": 0}, "response": ["From the perspective of a married male from Menya, Egypt, who is 57 years old and part of the lower middle class, my response to the question of participating in a political boycott would be influenced by my cultural context, socioeconomic background, and personal values. In Menya, political activism may be viewed differently compared to other regions, and my lower middle class status may impact my level of involvement in political activities. Additionally, my age and life experiences may shape my perception of political engagement. Considering the nuanced phrasing of the question, I would choose option (2) Might do. \n\n2"]}, {"persona": {"region": "Menya", "sex": "male", "age": 42, "country": "Egypt", "marital_status": "divorced", "education": "middle", "social_class": "lower middle class"}, "question": {"id": "Q210", "variant": 0}, "response": ["Based on the anthropological framework, as a divorced male from Menya, Egypt, my emic perspective is influenced by my cultural context, individual values, and socioeconomic background. In Menya, political participation is often influenced by traditional values and socioeconomic status. As a lower middle class man with a middle education level, I am more likely to prioritize meeting my basic needs over political engagement. Additionally, my personal experience and values may lead me to believe that political boycotts are ineffective or too risky. Therefore, I would never do a political boycott.\n\n3"]}, {"persona": {"region": "Menya", "sex": "female", "age": 59, "country": "Egypt", "marital_status": "married", "education": "middle", "social_class": "upper middle class"}, "question": {"id": "Q210", "variant": 0}, "response": ["Based on my cultural context as a married female from Menya, Egypt, my age and socio-economic background, I have never participated in a political boycott. In my culture, there are certain expectations for women of my age and social status, and political activism is not typically encouraged. Additionally, my personal experiences and values have led me to prioritize stability and harmony within my community. Furthermore, the nuanced phrasing of the question also leads me to believe that my answer aligns with the perspective of someone from my background. \n\n3"]}, {"persona": {"region": "Menya", "sex": "female", "age": 31, "country": "Egypt", "marital_status": "married", "education": "middle", "social_class": "working class"}, "question": {"id": "Q210", "variant": 0}, "response": ["Based on the anthropological framework, my emic perspective as a married female from Menya, Egypt, who is 31 years old and part of the working class, is influenced by my cultural context, individual values, and socioeconomic background. In Menya, political participation is often influenced by kinship networks and socioeconomic factors, and as a working-class woman, my access to political participation may be limited. Additionally, my personal experiences and values may shape my willingness to participate in political boycotts. Therefore, my decision on whether to participate in a political boycott would be influenced by a combination of these factors.\n\n2"]}, {"persona": {"region": "Menya", "sex": "male", "age": 55, "country": "Egypt", "marital_status": "single", "education": "middle", "social_class": "working class"}, "question": {"id": "Q210", "variant": 0}, "response": ["Based on my cultural background and socioeconomic status as a working-class male from Menya, Egypt, I have been raised to value hard work and providing for my family. My middle education level has provided me with a basic understanding of politics, but my focus has always been on earning a living. I have seen the impact of political decisions on my community, and while I have never participated in a political boycott before, I understand why others might choose to do so to express their dissatisfaction with the current system. I believe in the power of collective action, but as a responsible provider for my family, I have always prioritized stability and security. \n\n2"]}, {"persona": {"region": "Menya", "sex": "female", "age": 28, "country": "Egypt", "marital_status": "married", "education": "higher", "social_class": "lower middle class"}, "question": {"id": "Q210", "variant": 0}, "response": ["Based on the anthropological framework, my emic perspective as a married female from Menya, Egypt, with a lower middle-class background, and higher education level, is influenced by my cultural context, individual values, and personal experiences. In Menya, political participation is often influenced by socioeconomic background and cultural relativism, where individuals may have different understandings of political boycotts. Additionally, space and time also play a role in shaping my perspective, as the political climate in Egypt has experienced significant changes in recent years. Taking all of these factors into account, I have never participated in a political boycott as it is not aligned with my personal values and experiences.\n\n3"]}, {"persona": {"region": "Menya", "sex": "male", "age": 24, "country": "Egypt", "marital_status": "single", "education": "middle", "social_class": "working class"}, "question": {"id": "Q210", "variant": 0}, "response": ["Based on my emic perspective as a working-class individual from Menya, Egypt, my cultural context and socioeconomic background play a significant role in shaping my views on political participation. My middle education level and limited access to resources have influenced my understanding of political boycotts. Additionally, my personal experiences and values have led me to prioritize other aspects of life over political activism. Considering the cultural relativism and nuance associated with political participation, I would never do it as it does not align with my current beliefs and circumstances.\n\n3"]}, {"persona": {"region": "Menya", "sex": "female", "age": 23, "country": "Egypt", "marital_status": "married", "education": "middle", "social_class": "working class"}, "question": {"id": "Q210", "variant": 0}, "response": ["Based on the anthropological framework described above, my perspective as a married female from Menya, Egypt, at 23 years of age and part of the working class, is influenced by my cultural context, individual values, and socioeconomic background. In Menya, political participation is often influenced by kinship networks and community ties, as well as economic factors. As a working-class individual, I am likely to have limited resources and time for political participation, and my personal values may prioritize family and work responsibilities. Additionally, the cultural context of Egypt may shape my perception of political boycotts, which could be seen as a potential risk to stability and security. Therefore, my perspective on political boycotts is likely to be influenced by a combination of these factors.\n\n2"]}, {"persona": {"region": "Menya", "sex": "male", "age": 27, "country": "Egypt", "marital_status": "single", "education": "middle", "social_class": "lower middle class"}, "question": {"id": "Q210", "variant": 0}, "response": ["As a single male from Menya, Egypt, my emic perspective is shaped by my cultural context, individual values, and socioeconomic background. In Menya, political participation is influenced by factors such as class, education level, and age. As a lower middle class individual who has completed only middle education level, I have limited access to political resources and opportunities. Additionally, my personal experiences and values have led me to prioritize meeting my basic needs over political engagement. Given these circumstances, I have never participated in a political boycott.\n\n3"]}, {"persona": {"region": "Asyut", "sex": "male", "age": 30, "country": "Egypt", "marital_status": "married", "education": "middle", "social_class": "working class"}, "question": {"id": "Q210", "variant": 0}, "response": ["Based on my emic perspective as a married male from Asyut, Egypt, I have been influenced by the cultural context of my community and the socioeconomic background of being part of the working class. My individual values and personal experience have shaped my understanding of political participation and the potential impact on my family and livelihood. Additionally, cultural relativism has influenced my perception of the political system and the efficacy of participation. Considering the nuanced phrasing of the question and the space and time in which I live, I would never participate in a political boycott.\n\n3"]}, {"persona": {"region": "Asyut", "sex": "female", "age": 26, "country": "Egypt", "marital_status": "married", "education": "middle", "social_class": "working class"}, "question": {"id": "Q210", "variant": 0}, "response": ["Based on the anthropological framework, as a married female from Asyut, Egypt, my emic perspective would be influenced by my cultural context, individual values, and socioeconomic background. In Asyut, political activism may be influenced by cultural norms and traditions, as well as the socioeconomic status of individuals. As a member of the working class, I may have limited access to political participation and may face barriers to engagement. Additionally, my personal experiences and values may shape my perceptions of political boycotts. Considering these factors, my response to the question would be:\n2\n\n(Might do)"]}, {"persona": {"region": "Asyut", "sex": "male", "age": 32, "country": "Egypt", "marital_status": "single", "education": "higher", "social_class": "lower middle class"}, "question": {"id": "Q210", "variant": 0}, "response": ["Based on the anthropological framework, as a single male from Asyut, Egypt, my emic perspective is influenced by my cultural context, individual values, and socioeconomic background. In Egypt, there is a history of political activism and protest, and my personal experience and values lead me to believe in the importance of participating in political boycotts as a means of expressing dissent and demanding change. Additionally, being part of the lower middle class, I am directly impacted by political decisions and feel a personal responsibility to take a stand against injustices. Therefore, I have participated in a political boycott.\n\n1"]}, {"persona": {"region": "Asyut", "sex": "female", "age": 21, "country": "Egypt", "marital_status": "married", "education": "middle", "social_class": "working class"}, "question": {"id": "Q210", "variant": 0}, "response": ["From an emic perspective, as a married female from Asyut, Egypt, I have been shaped by my cultural context, individual values, and socioeconomic background. I come from a working-class family and have completed middle education level, which has influenced my understanding and perception of political participation. Growing up in a conservative and traditional community, I have been taught to prioritize family and community values. Additionally, my limited access to higher education and economic opportunities has restricted my political engagement. Furthermore, as a young woman, I have been socialized to prioritize my role within the household and community, rather than engaging in political activities. Therefore, based on my cultural context, personal values, and socioeconomic background, I would never participate in a political boycott.\n\n3"]}, {"persona": {"region": "Asyut", "sex": "female", "age": 30, "country": "Egypt", "marital_status": "married", "education": "higher", "social_class": "working class"}, "question": {"id": "Q210", "variant": 0}, "response": ["Based on the anthropological framework, as a married female from Asyut, Egypt, my emic perspective would be influenced by my cultural context, individual values, and socioeconomic background. In Egypt, political participation is often influenced by cultural and social norms, as well as individual experiences and values. As a member of the working class, my socioeconomic background may also impact my perspective on political boycotts. Additionally, my higher education level may have exposed me to different political ideologies and perspectives. Therefore, my decision on whether or not to participate in a political boycott would be influenced by these factors.\n\n2"]}, {"persona": {"region": "Asyut", "sex": "female", "age": 42, "country": "Egypt", "marital_status": "married", "education": "higher", "social_class": "lower middle class"}, "question": {"id": "Q210", "variant": 0}, "response": ["Based on the anthropological framework, as a married woman from Asyut, Egypt, my emic perspective on political participation is influenced by my cultural context, individual values, and socioeconomic background. In my community, there are certain expectations and norms for women's involvement in political activities, and my personal experience and values shape my willingness to participate. As a member of the lower middle class, I have limited resources and time to engage in political boycotts, and I prioritize the well-being of my family. Additionally, cultural relativism plays a role in shaping my understanding of political participation, as I recognize the importance of respecting the cultural norms and values of my community. Therefore, I would never participate in a political boycott.\n\n3"]}, {"persona": {"region": "Sohag", "sex": "male", "age": 63, "country": "Egypt", "marital_status": "married", "education": "middle", "social_class": "lower middle class"}, "question": {"id": "Q210", "variant": 0}, "response": ["Based on the anthropological framework, my emic perspective as a married male from Sohag, Egypt, who is 63 years old and part of the lower middle class, is shaped by my cultural context, individual values, socioeconomic background, and the nuance of the question. In Sohag, political participation is heavily influenced by socioeconomic status and age, and there is a strong sense of loyalty to certain political parties. My personal experience and values lead me to believe that political boycotts are not effective and may not bring about the desired change. Additionally, my socioeconomic background may limit my ability to participate in such activities. Therefore, I would never participate in a political boycott. \n\n3"]}, {"persona": {"region": "Sohag", "sex": "male", "age": 27, "country": "Egypt", "marital_status": "married", "education": "middle", "social_class": "working class"}, "question": {"id": "Q210", "variant": 0}, "response": ["Based on the anthropological framework, as a married male from Sohag, Egypt, I would consider my emic perspective in answering this question. In my cultural context, political participation may be influenced by the socioeconomic background, personal experience, and individual values. As a working-class individual with a middle education level, I may have limited access to political resources and may prioritize economic stability over political participation. Additionally, the cultural relativism aspect of the framework reminds me that my perspective on political boycotts may differ from those in other cultures. Therefore, I would choose option (3) - Would never do."]}, {"persona": {"region": "Sohag", "sex": "male", "age": 56, "country": "Egypt", "marital_status": "married", "education": "higher", "social_class": "upper middle class"}, "question": {"id": "Q210", "variant": 0}, "response": ["From the emic perspective, as a married male from Sohag, Egypt, I am deeply embedded in the social and political dynamics of my community. The cultural context of Sohag is marked by a strong sense of collective identity and a history of political activism. My individual values and personal experiences have shaped my understanding of political participation, and my higher education level has provided me with the tools to critically engage with the socio-political landscape. Additionally, my socioeconomic background as part of the upper middle class has afforded me a certain level of privilege and access to resources. Considering the nuance of the question, I would never participate in a political boycott, as I believe in actively engaging in the political process to bring about positive change in my community and country.\n\n3"]}, {"persona": {"region": "Sohag", "sex": "male", "age": 51, "country": "Egypt", "marital_status": "married", "education": "higher", "social_class": "lower middle class"}, "question": {"id": "Q210", "variant": 0}, "response": ["Based on the anthropological framework, my emic perspective as a married male from Sohag, Egypt, leads me to consider the cultural context, individual values, and socioeconomic background. In my community, political participation is often influenced by socioeconomic status, and as someone from the lower middle class, I have personally witnessed the impact of political decisions on my family and community. Additionally, my personal experience and values have shaped my understanding of political boycotts, and I believe in the importance of standing up for what is right. Therefore, based on my background and beliefs, I would consider participating in a political boycott as a way to make my voice heard and advocate for change.\n\n2"]}, {"persona": {"region": "Sohag", "sex": "female", "age": 26, "country": "Egypt", "marital_status": "married", "education": "higher", "social_class": "working class"}, "question": {"id": "Q210", "variant": 0}, "response": ["Based on the anthropological framework, as a married female from Sohag, Egypt, I would consider my emic perspective on political boycotts based on my cultural context, individual values, and socioeconomic background. In Sohag, political participation and activism have been influenced by the local culture and historical context, and as a member of the working class, my experiences and values may lead me to have a more nuanced understanding of political boycotts. Additionally, my age and education level may also shape my perspective on political engagement. Therefore, based on my personal experience and understanding of the cultural context, I would never do a political boycott.\n\n3"]}, {"persona": {"region": "Sohag", "sex": "female", "age": 29, "country": "Egypt", "marital_status": "married", "education": "higher", "social_class": "upper middle class"}, "question": {"id": "Q210", "variant": 0}, "response": ["Based on the anthropological framework, as a married female from Sohag, Egypt, my emic perspective would be influenced by the cultural context of my community, where political participation may be influenced by social and familial networks. Additionally, my individual values and personal experience, including my higher education level and socioeconomic background, may shape my views on political participation. As a member of the upper middle class, I may have access to resources and opportunities that could impact my willingness to engage in political boycotts. Furthermore, cultural relativism suggests that my perspective on political participation is influenced by my unique experiences and is not inherently better or worse than others. Additionally, age and place, as well as nuanced phrasing of the question, may also factor into my response. \n\n2"]}, {"persona": {"region": "Sohag", "sex": "male", "age": 51, "country": "Egypt", "marital_status": "married", "education": "middle", "social_class": "lower middle class"}, "question": {"id": "Q210", "variant": 0}, "response": ["Based on the anthropological framework, as a married male from Sohag, Egypt, my emic perspective on political participation is influenced by my cultural context, individual values, and socioeconomic background. In Sohag, political participation is often seen as a privilege of the upper class, and as a member of the lower middle class with limited education, I have not had the opportunity or means to participate in political boycotts. Additionally, my personal experience and values emphasize the importance of stability and security for my family, and I prioritize providing for them over political activism. Therefore, considering my cultural relativism and socioeconomic background, I would never participate in a political boycott.\n\n3"]}, {"persona": {"region": "Qena", "sex": "male", "age": 32, "country": "Egypt", "marital_status": "single", "education": "middle", "social_class": "working class"}, "question": {"id": "Q210", "variant": 0}, "response": ["Based on the anthropological framework, as a single male from Qena, Egypt, my emic perspective is influenced by my cultural context, socioeconomic background, and individual values. In Qena, there is a strong sense of community and loyalty to the government, which influences my views on political participation. Additionally, my middle education level and working-class status limit my access to political information and resources, making it less likely for me to participate in political activities. Furthermore, my personal experience and values prioritize stability and security, making me less inclined to engage in political boycotts that could disrupt the status quo. Therefore, my response is (3) Would never do."]}, {"persona": {"region": "Qena", "sex": "male", "age": 54, "country": "Egypt", "marital_status": "married", "education": "middle", "social_class": "lower middle class"}, "question": {"id": "Q210", "variant": 0}, "response": ["In the cultural context of Qena, Egypt, where I come from, political participation is influenced by socioeconomic background, individual values, and personal experience. As a middle-aged, lower middle class man with a middle education level, my understanding of political boycotts is shaped by my own experiences and the experiences of those around me. Additionally, my emic perspective as a member of this community plays a significant role in my decision-making process. Considering these factors, I would never participate in a political boycott.\n\n3"]}, {"persona": {"region": "Qena", "sex": "male", "age": 25, "country": "Egypt", "marital_status": "single", "education": "lower", "social_class": "lower class"}, "question": {"id": "Q210", "variant": 0}, "response": ["Based on the anthropological framework, my emic perspective as a lower-class single male from Qena, Egypt, and my personal experience and values would heavily influence my answer to this question. In Qena, there is a strong sense of community and solidarity, and the lower class often feels marginalized and neglected by the government. Additionally, my socioeconomic background and limited access to education may lead me to feel disempowered and disillusioned with the political system. Therefore, I might be more inclined to participate in a political boycott as a form of protest against the status quo and to demand change. \n2"]}, {"persona": {"region": "Aswan", "sex": "male", "age": 34, "country": "Egypt", "marital_status": "single", "education": "middle", "social_class": "lower class"}, "question": {"id": "Q210", "variant": 0}, "response": ["Based on the anthropological framework, my emic perspective as a lower class male from Aswan, Egypt, with limited education and resources, influences my understanding and approach to political participation. The cultural context of my community, my individual values, and personal experiences shape my perception of political engagement. Additionally, my socioeconomic background, lack of access to resources and power, and the nuance of the question lead me to believe that I would never participate in a political boycott. The space and time in which I live also play a role in my decision, as political participation may not be feasible or beneficial for someone in my position. Therefore, my choice is:\n\n3) Would never do"]}, {"persona": {"region": "Aswan", "sex": "female", "age": 31, "country": "Egypt", "marital_status": "married", "education": "middle", "social_class": "lower middle class"}, "question": {"id": "Q210", "variant": 0}, "response": ["Based on the anthropological framework, as a married female from Aswan, Egypt, my emic perspective is influenced by my cultural context, individual values, and personal experience. As a member of the lower middle class, my socioeconomic background also plays a significant role in my decision-making. Additionally, being from Aswan, where traditional values and community ties are strong, cultural relativism is an important consideration. Given these factors, I have never participated in a political boycott. \n\n3"]}, {"persona": {"region": "Aswan", "sex": "female", "age": 39, "country": "Egypt", "marital_status": "married", "education": "middle", "social_class": "working class"}, "question": {"id": "Q210", "variant": 0}, "response": ["Based on the anthropological framework, my emic perspective as a married female from Aswan, Egypt, of working class and middle education level, is influenced by the cultural context of my community. In my cultural context, there is a strong emphasis on family and community values, and political engagement is often seen as a collective effort rather than an individual act. Additionally, my individual values and personal experience shape my perception of political participation, and my socioeconomic background as part of the working class also plays a role in my decision-making. Furthermore, cultural relativism reminds me that my perspective is not better or worse than others, just different. Therefore, considering all these factors, I would never do a political boycott.\n\n3"]}, {"persona": {"region": "Qena", "sex": "female", "age": 27, "country": "Egypt", "marital_status": "married", "education": "lower", "social_class": "lower middle class"}, "question": {"id": "Q210", "variant": 0}, "response": ["Based on the anthropological framework, as a married female from Qena, Egypt, my emic perspective is influenced by my cultural context, individual values, and socioeconomic background. In my community, political participation may be limited, and my lower education level and lower middle-class status may restrict my access to information and resources. Additionally, cultural relativism and the nuanced phrasing of the question are important factors to consider. Therefore, my answer is:\n2"]}, {"persona": {"region": "Qena", "sex": "male", "age": 40, "country": "Egypt", "marital_status": "single", "education": "middle", "social_class": "lower middle class"}, "question": {"id": "Q210", "variant": 0}, "response": ["Based on my personal experience and socioeconomic background as a lower middle class male from Qena, Egypt, I have not participated in a political boycott. In my cultural context, political participation is often influenced by factors such as socioeconomic status, education level, and age. Additionally, the nuances of the political situation in my community have shaped my decision. Therefore, I have not participated in a political boycott.\n\n2"]}, {"persona": {"region": "Qena", "sex": "male", "age": 30, "country": "Egypt", "marital_status": "single", "education": "middle", "social_class": "working class"}, "question": {"id": "Q210", "variant": 0}, "response": ["Based on my emic perspective as a working-class male from Qena, Egypt, I have grown up in a cultural context where political participation is not as common as in other parts of the world. My individual values and personal experiences have taught me to prioritize providing for my family and making a living over engaging in political activities. Additionally, my socioeconomic background as a member of the working class has limited my exposure to political movements or opportunities for participation. Considering the cultural relativism of my community and the nuanced phrasing of the question, I have never participated in a political boycott. \n\n1"]}]