[{"persona": {"region": "Fayoum", "sex": "male", "age": 46, "country": "Egypt", "marital_status": "married", "education": "higher", "social_class": "lower middle class"}, "question": {"id": "Q171", "variant": 0}, "response": ["From an anthropological perspective, my cultural context as a married male from Fayoum, Egypt, heavily influences my religious practices. The region is known for its strong religious and traditional values, and as a member of the lower middle class, I am likely to have a strong sense of community and tradition. My age and educational level also play a role in my religious beliefs and practices, as they may have shaped my understanding of religion and its role in society. Additionally, my socioeconomic background may impact the time and resources I have available to attend religious services. Based on these factors, I would choose the following option:\n4"]}, {"persona": {"region": "Fayoum", "sex": "female", "age": 30, "country": "Egypt", "marital_status": "married", "education": "middle", "social_class": "lower middle class"}, "question": {"id": "Q171", "variant": 0}, "response": ["Based on the anthropological framework, as a married female from Fayoum, Egypt, I am heavily influenced by my cultural context, including my religious beliefs and practices. Living in a predominantly Muslim country, religion plays a significant role in my life and the lives of those around me. As a lower middle class individual, my socioeconomic background also plays a role in my religious practices, as I may not have the resources to attend religious services as frequently as those from higher socioeconomic backgrounds. Additionally, my age and personal experience also shape my religious practices, as I have been raised to prioritize family and community over individual pursuits. Therefore, I would choose the following option:\n\n3. Once a month"]}, {"persona": {"region": "Fayoum", "sex": "male", "age": 60, "country": "Egypt", "marital_status": "married", "education": "higher", "social_class": "working class"}, "question": {"id": "Q171", "variant": 0}, "response": ["Based on the anthropological framework, as a married male from Fayoum, Egypt, with a higher education level and part of the working class, my individual values and personal experience play a significant role in my perception of religious services. Additionally, the cultural context in Egypt, where religion is deeply ingrained in society, and the socioeconomic background of being part of the working class also influence my answer. Considering the emic perspective, I would answer this question based on my personal experience and the importance of religion in my community.\n\n3"]}, {"persona": {"region": "Fayoum", "sex": "male", "age": 20, "country": "Egypt", "marital_status": "single", "education": "middle", "social_class": "lower middle class"}, "question": {"id": "Q171", "variant": 0}, "response": ["Based on my emic perspective as a single male from Fayoum, Egypt, and considering my cultural context, individual values, and socioeconomic background, I understand the importance of religion in my community. As a lower middle class individual, I have been brought up in a religious environment where attending religious services is a significant part of our cultural and social life. However, due to my age and socioeconomic background, I have more responsibilities and limited resources, which may restrict my ability to attend religious services more frequently. Therefore, I would choose the option (3) Once a month as it reflects my understanding of the significance of religious services while also considering the practicalities of my personal circumstances.\n\n3"]}, {"persona": {"region": "Fayoum", "sex": "female", "age": 39, "country": "Egypt", "marital_status": "married", "education": "higher", "social_class": "lower middle class"}, "question": {"id": "Q171", "variant": 0}, "response": ["Based on the anthropological framework, as a married female from Fayoum, Egypt, my cultural context and religious beliefs play a significant role in determining my frequency of attending religious services. In my community, religious activities are deeply ingrained in our daily lives, and our socioeconomic background as part of the lower middle class may also influence our level of religious engagement. Additionally, my personal experience and individual values, along with the cultural relativism that is prevalent in my community, will shape my response. Considering my age and education level, as well as the nuanced phrasing of the question, I would choose the following option:\n\n3"]}, {"persona": {"region": "Fayoum", "sex": "male", "age": 33, "country": "Egypt", "marital_status": "married", "education": "higher", "social_class": "working class"}, "question": {"id": "Q171", "variant": 0}, "response": ["Based on the anthropological framework, as a married male from Fayoum, Egypt, my emic perspective tells me that religious services are a significant part of my cultural context and personal experience. I come from a community where attending religious services is a regular part of life and is deeply tied to my individual values and beliefs. Additionally, my socioeconomic background as a working-class individual means that my community likely places a high value on religious participation as a source of community and support. Therefore, I would choose option (2) Once a week, as it aligns with my personal experience and cultural context.\n\n2"]}, {"persona": {"region": "Port Said", "sex": "female", "age": 45, "country": "Egypt", "marital_status": "married", "education": "higher", "social_class": "lower middle class"}, "question": {"id": "Q171", "variant": 0}, "response": ["Based on the anthropological framework, as a married female from Port Said, Egypt, my cultural context and personal experience play a significant role in shaping my religious practices. In Egypt, religion is a central aspect of daily life and is deeply ingrained in the cultural context. As a member of the lower middle class, my socioeconomic background also influences my religious practices, as I may have limited time and resources to dedicate to attending religious services. Additionally, my age and place are important factors, as societal expectations and religious norms in Port Said may impact the frequency of my attendance at religious services. Therefore, my answer to the question of how frequently I attend religious services is based on my understanding of cultural relativism and the nuanced phrasing of the question.\n\n6"]}, {"persona": {"region": "Port Said", "sex": "male", "age": 42, "country": "Egypt", "marital_status": "married", "education": "middle", "social_class": "lower middle class"}, "question": {"id": "Q171", "variant": 0}, "response": ["Based on the anthropological framework, I, as a married male from Port Said, Egypt, understand the importance of cultural context and individual values in answering this question. Religion holds a significant place in the cultural context of Egypt, and as a middle-aged man from a lower middle class background, my personal experience and socioeconomic background also play a crucial role in shaping my religious practices. Additionally, the societal expectations and norms in my community also influence my religious beliefs and practices. Therefore, my answer to the question is influenced by a combination of cultural context, personal values, and socioeconomic background.\n\n3"]}, {"persona": {"region": "Port Said", "sex": "male", "age": 28, "country": "Egypt", "marital_status": "single", "education": "middle", "social_class": "lower middle class"}, "question": {"id": "Q171", "variant": 0}, "response": ["Based on the anthropological framework, my cultural context as a single male from Port Said, Egypt, and my age and socioeconomic background play a significant role in my understanding and answer to the question. In Port Said, religious practices and community involvement are highly valued, and as a member of the lower middle class, I have been brought up in a community where attending religious services is a regular part of life. Additionally, my personal experiences and individual values emphasize the importance of religious gatherings for spiritual guidance and social connection. Therefore, based on these factors, I would choose option (2) Once a week.\n\n2"]}, {"persona": {"region": "Port Said", "sex": "female", "age": 30, "country": "Egypt", "marital_status": "married", "education": "higher", "social_class": "lower middle class"}, "question": {"id": "Q171", "variant": 0}, "response": ["Based on the anthropological framework, my emic perspective as a married female from Port Said, Egypt, who is 30 years old and part of the lower middle class, is heavily influenced by the cultural context of my community, as well as my individual values and personal experience. In Port Said, religion plays a significant role in daily life, and as a woman, it is expected that I attend religious services regularly. Additionally, my socioeconomic background also plays a role, as my lower middle class status may make me more inclined to seek solace and community in religious spaces. Therefore, considering all these factors, I would choose option (2) Once a week, as it aligns with the cultural and societal expectations placed upon me as a woman of my background. \n\n2"]}, {"persona": {"region": "Port Said", "sex": "male", "age": 30, "country": "Egypt", "marital_status": "divorced", "education": "middle", "social_class": "lower middle class"}, "question": {"id": "Q171", "variant": 0}, "response": ["From the perspective of a divorced male from Port Said, Egypt, who is 30 years old and part of the lower middle class, it is important to consider the cultural context and individual values. In this region, religion plays a significant role in people's lives, and attending religious services is a common practice. However, the socioeconomic background also plays a role, as financial constraints may limit the ability to attend religious services frequently. Additionally, personal experience and individual values are significant, and the experience of divorce may have shifted the individual's relationship with religion. Therefore, taking into account the cultural context, socioeconomic background, and personal experience, the persona would likely choose option (3) Once a month. \n\n3"]}, {"persona": {"region": "Port Said", "sex": "female", "age": 19, "country": "Egypt", "marital_status": "single", "education": "middle", "social_class": "lower middle class"}, "question": {"id": "Q171", "variant": 0}, "response": ["Based on the anthropological framework, as a 19-year-old single female from Port Said, Egypt, with a middle education level and lower middle class background, my emic perspective on religious services is influenced by my cultural context, individual values, and socioeconomic background. In Port Said, religion plays a significant role in daily life, and as a member of the lower middle class, I may have limited resources and time to attend religious services frequently. Additionally, my age and personal experience as a young woman may also impact my frequency of attending religious services. Therefore, my choice is:\n\n6"]}, {"persona": {"region": "Fayoum", "sex": "male", "age": 40, "country": "Egypt", "marital_status": "married", "education": "middle", "social_class": "working class"}, "question": {"id": "Q171", "variant": 0}, "response": ["Based on the anthropological framework, as a married male from Fayoum, Egypt, my emic perspective is shaped by the cultural context of being part of a conservative community with strong religious values. The etic perspective also considers the socioeconomic background as a working-class individual with limited access to leisure time. Additionally, my personal experience and individual values prioritize religious observance as a means of community and spiritual fulfillment. Considering the nuance and complexity of the question, I would choose the option:\n6"]}, {"persona": {"region": "Fayoum", "sex": "male", "age": 23, "country": "Egypt", "marital_status": "single", "education": "higher", "social_class": "lower middle class"}, "question": {"id": "Q171", "variant": 0}, "response": ["Based on my understanding of the anthropological framework, I believe that my socioeconomic background, cultural context, and personal experience greatly influence my attitude towards religious services. As a single male from Fayoum, Egypt, I am aware of the importance of religion in our community and the pressure to adhere to religious practices. However, as a young adult from the lower middle class who has completed higher education, I have been exposed to different perspectives and have developed my own individual values. Therefore, I attend religious services less often, as my personal experience has led me to prioritize other aspects of my life and view religion in a more personal and nuanced way.\n\n6"]}, {"persona": {"region": "Fayoum", "sex": "female", "age": 38, "country": "Egypt", "marital_status": "married", "education": "middle", "social_class": "lower middle class"}, "question": {"id": "Q171", "variant": 0}, "response": ["Based on the anthropological framework, as a 38-year-old married woman from Fayoum, Egypt, with a middle education level and lower middle class socioeconomic background, my perspective is heavily influenced by my cultural context and individual values. In my community, religious services are a significant aspect of daily life and are often attended by individuals of all ages and backgrounds. Additionally, my personal experiences and values have instilled in me a deep respect for religious practices, leading me to prioritize attending services as often as possible. Moreover, my lower middle class status means that I am likely to be more closely connected to my community and its religious institutions, further reinforcing the importance of regular attendance at religious services. \n\n2"]}, {"persona": {"region": "Fayoum", "sex": "male", "age": 32, "country": "Egypt", "marital_status": "married", "education": "middle", "social_class": "lower middle class"}, "question": {"id": "Q171", "variant": 0}, "response": ["Based on the anthropological framework, as a married male from Fayoum, Egypt, my emic perspective is heavily influenced by my cultural context, individual values, and socioeconomic background. In my community, religious attendance is a significant part of our cultural and social life. As a lower middle-class individual, my access to education and resources may limit my opportunities for social mobility, so religious services provide a sense of community and belonging. Additionally, my age and place of residence also play a role in shaping my religious beliefs and practices. Therefore, I choose option (2) Once a week as my frequency of religious attendance, as it aligns with the cultural and social norms within my community. \n\n2"]}, {"persona": {"region": "Fayoum", "sex": "male", "age": 31, "country": "Egypt", "marital_status": "married", "education": "higher", "social_class": "working class"}, "question": {"id": "Q171", "variant": 0}, "response": ["Based on the anthropological framework, my response to the question of how frequently I attend religious services is influenced by my cultural context, individual values, socioeconomic background, and space and time. As a married male from Fayoum, Egypt, I am part of the working class and have a higher education level. In my cultural context, religious practices and beliefs are significant, and it is common for individuals to attend religious services regularly. However, my personal experience and values also play a role in my decision. Considering my age and socioeconomic background, I attend religious services once a week as it aligns with my personal beliefs and the expectations of my social group.\n\n2"]}, {"persona": {"region": "Fayoum", "sex": "male", "age": 31, "country": "Egypt", "marital_status": "married", "education": "middle", "social_class": "lower middle class"}, "question": {"id": "Q171", "variant": 0}, "response": ["Based on the anthropological framework, my cultural context as a married male from Fayoum, Egypt, includes the importance of religion in daily life. The socioeconomic background of being part of the lower middle class also plays a role in shaping my values and experiences. In the cultural context, attending religious services is a significant part of community and familial life. Additionally, my individual values and personal experience have taught me the importance of religious devotion. Therefore, my answer to the question would be: \n\n3\n\n(3) Once a month"]}, {"persona": {"region": "Fayoum", "sex": "female", "age": 32, "country": "Egypt", "marital_status": "married", "education": "middle", "social_class": "lower middle class"}, "question": {"id": "Q171", "variant": 0}, "response": ["Based on the anthropological framework, as a married female from Fayoum, Egypt, I am deeply rooted in the cultural context of my community. Religion plays a significant role in the lives of the people in my area, and the cultural values and personal experiences of individuals are heavily influenced by their religious beliefs. Additionally, my lower middle-class socioeconomic background means that I likely have limited access to entertainment options, making religious services a common choice for community gatherings and social interactions. Furthermore, the nuance of the question is important, as the phrasing of the question can elicit a different response. Given these factors, my answer would be (2) Once a week. \n\n2"]}, {"persona": {"region": "Ismailia", "sex": "male", "age": 53, "country": "Egypt", "marital_status": "married", "education": "middle", "social_class": "lower middle class"}, "question": {"id": "Q171", "variant": 0}, "response": ["Based on my personal experience and cultural context, as a married male from Ismailia, Egypt, religion plays a significant role in my daily life and the lives of those around me. My socioeconomic background as part of the lower middle class also influences my religious practices, as attending religious services is a way for me to connect with my community and find solace in challenging times. Additionally, the cultural context of Egypt emphasizes the importance of religious observance, and my age and place further reinforce the significance of attending religious services. Therefore, I choose option (2) Once a week as the frequency with which I attend religious services. \n\n2"]}, {"persona": {"region": "Ismailia", "sex": "male", "age": 38, "country": "Egypt", "marital_status": "married", "education": "higher", "social_class": "working class"}, "question": {"id": "Q171", "variant": 0}, "response": ["Based on the anthropological framework, my answer to the question of how frequently I attend religious services would be influenced by my cultural context, individual values, and socioeconomic background. As a married male from Ismailia, Egypt, at 38 years of age with a higher education level and considering myself part of the working class, my religious practices are likely to be influenced by the cultural context of Egypt, where Islam is the predominant religion. Additionally, my individual values and personal experiences may play a role in determining the frequency of my religious attendance. Considering my socioeconomic background as part of the working class, my access to time and resources for attending religious services may also be limited. Therefore, based on these factors, I would choose option (3) Once a month.\n\n3"]}, {"persona": {"region": "Ismailia", "sex": "female", "age": 35, "country": "Egypt", "marital_status": "married", "education": "middle", "social_class": "lower middle class"}, "question": {"id": "Q171", "variant": 0}, "response": ["Based on the anthropological framework, as a married female from Ismailia, Egypt, my cultural context and personal experience have shaped my religious practices. In Egypt, religion plays a significant role in daily life and is deeply ingrained in the culture. As a lower middle class woman, I have been taught the importance of attending religious services regularly, as it is a way to connect with my community and seek solace in difficult times. Additionally, my age and socioeconomic background also influence my religious practices, as I have been raised to value and prioritize spirituality. Therefore, I choose option (2) Once a week, as attending religious services on a weekly basis is a significant part of my cultural and personal experience. \n\n2"]}, {"persona": {"region": "Ismailia", "sex": "female", "age": 57, "country": "Egypt", "marital_status": "married", "education": "lower", "social_class": "working class"}, "question": {"id": "Q171", "variant": 0}, "response": ["Based on the anthropological framework, my individual values and personal experience as a married female from Ismailia, Egypt, who is 57 years old and part of the working class, heavily influence my perception and practice of attending religious services. The cultural context of my community and the socioeconomic background of my class also play a significant role. Additionally, my space and time as a 57-year-old woman in Ismailia, Egypt, further shape my perspective. Given these factors, I choose:\n\n6) Less often"]}, {"persona": {"region": "Ismailia", "sex": "male", "age": 33, "country": "Egypt", "marital_status": "married", "education": "middle", "social_class": "lower middle class"}, "question": {"id": "Q171", "variant": 0}, "response": ["Based on the anthropological framework, as a married male from Ismailia, Egypt, with a middle education level and considering myself part of the lower middle class, my answer to the question of how frequently I attend religious services will be influenced by my cultural context, individual values, and socioeconomic background. In Ismailia, religion plays a significant role in daily life and community, so the cultural context would likely lead me to attend religious services more frequently than in other places. Additionally, my personal experience and values, along with the importance of religion in my community, would also likely lead me to attend religious services regularly. Finally, as part of the lower middle class, attending religious services may also provide a sense of community and support. Therefore, my answer to the question would be:\n\n2) Once a week"]}, {"persona": {"region": "Ismailia", "sex": "female", "age": 49, "country": "Egypt", "marital_status": "single", "education": "higher", "social_class": "upper middle class"}, "question": {"id": "Q171", "variant": 0}, "response": ["Based on my understanding of the anthropological framework, my emic perspective as a single female from Ismailia, Egypt, who is 49 years old, highly educated, and part of the upper middle class, I recognize the cultural context plays a significant role in my answer. Religion is an important aspect of Egyptian society, and my socioeconomic background and education level have likely shaped my views on religious attendance. Additionally, my personal experience and individual values also influence my decision. Considering all of these factors, I would choose option 4, attending religious services only on special holy days. This choice reflects the cultural importance of religion in Egypt, while also considering my individual values and personal experience. \n\n4"]}, {"persona": {"region": "Ismailia", "sex": "female", "age": 35, "country": "Egypt", "marital_status": "married", "education": "higher", "social_class": "lower middle class"}, "question": {"id": "Q171", "variant": 0}, "response": ["Based on the anthropological framework, as a married female from Ismailia, Egypt, my cultural context and religious background play a significant role in my answer. In Ismailia, religion is an integral part of daily life, and the cultural context emphasizes the importance of regular religious observance. Additionally, my socioeconomic background as part of the lower middle class also influences my religious practices, as it may impact my ability to attend religious services more frequently due to time and financial constraints. Furthermore, my individual values and personal experience, including my age and education level, also shape my answer. Considering these factors, my frequency of attending religious services would align with the option selected below.\n\n4"]}, {"persona": {"region": "Ismailia", "sex": "male", "age": 24, "country": "Egypt", "marital_status": "single", "education": "higher", "social_class": "upper middle class"}, "question": {"id": "Q171", "variant": 0}, "response": ["Based on the anthropological framework, my personal experience and individual values as a 24-year-old male from Ismailia, Egypt, who has completed higher education and considers myself part of the upper middle class, play a significant role in my perception of religious services. The cultural context in Egypt, as well as my socioeconomic background, also influence my answer. Additionally, the nuance of the question is important as it may impact my response. Considering all these factors, I select:\n\n3"]}, {"persona": {"region": "Ismailia", "sex": "female", "age": 23, "country": "Egypt", "marital_status": "single", "education": "higher", "social_class": "lower middle class"}, "question": {"id": "Q171", "variant": 0}, "response": ["Based on the anthropological framework, as a single female from Ismailia, Egypt, my cultural context and religious background play a significant role in my perception of attending religious services. Egypt is a predominantly Muslim country, and as a member of the lower middle class, my socioeconomic background also influences my religious practices. Additionally, my age and personal experiences have shaped my individual values and understanding of religion. Given these factors, I would choose the following option:\n\n3) Once a month"]}, {"persona": {"region": "Ismailia", "sex": "male", "age": 55, "country": "Egypt", "marital_status": "married", "education": "middle", "social_class": "lower middle class"}, "question": {"id": "Q171", "variant": 0}, "response": ["Based on my cultural context as a married male from Ismailia, Egypt, attending religious services is a significant part of my life. The cultural context in Egypt places a high value on religious practices and the community aspect of attending religious services. Additionally, my individual values and personal experience have shaped my belief in the importance of attending religious services. As someone from the lower middle class, I have found solace and a sense of community through regular attendance at religious services. Furthermore, the socioeconomic background and cultural relativism in Egypt emphasize the importance of religious practices, and I have been influenced by this throughout my life. Given all of these factors, my personal choice is to attend religious services more than once a week.\n\n6"]}, {"persona": {"region": "Ismailia", "sex": "male", "age": 57, "country": "Egypt", "marital_status": "married", "education": "middle", "social_class": "upper middle class"}, "question": {"id": "Q171", "variant": 0}, "response": ["Based on the anthropological framework, as a married male from Ismailia, Egypt, my cultural context and personal experience play a significant role in shaping my religious practices. Egypt has a predominantly Muslim population, and Ismailia is known for its strong Islamic traditions. As a member of the upper-middle class, I have the means and the social standing to actively participate in religious services and events. Additionally, my age and upbringing in a religiously observant community have instilled in me a strong sense of duty and tradition. Therefore, I would choose option (2) Once a week as the frequency with which I attend religious services. \n\n2"]}, {"persona": {"region": "Ismailia", "sex": "female", "age": 29, "country": "Egypt", "marital_status": "married", "education": "middle", "social_class": "upper middle class"}, "question": {"id": "Q171", "variant": 0}, "response": ["Based on the anthropological framework, as a married female from Ismailia, Egypt, cultural context and individual values play a significant role in shaping my answer. Religion is an integral part of the cultural fabric in Egypt, and as a member of the upper middle class, I am likely to have been brought up in a family that values religious observance. Additionally, my age and level of education may influence my understanding and practice of religion. Therefore, I would choose the following option:\n\n3"]}, {"persona": {"region": "Damiatta", "sex": "female", "age": 46, "country": "Egypt", "marital_status": "married", "education": "middle", "social_class": "lower middle class"}, "question": {"id": "Q171", "variant": 0}, "response": ["Based on the anthropological framework, as a married female from Damiatta, Egypt, the cultural context and religious values play a pivotal role in my understanding of and approach to attending religious services. As a member of the lower middle class, my socioeconomic background also influences this decision, as financial constraints and time availability may impact my ability to attend religious services frequently. Additionally, my age and personal experiences have shaped my individual values and perceptions of religious practice. Considering the emic and etic perspectives, I would choose option (3) Once a month, as this frequency aligns with both my personal beliefs and the cultural and socioeconomic context in which I live.\n\n3"]}, {"persona": {"region": "Damiatta", "sex": "female", "age": 20, "country": "Egypt", "marital_status": "single", "education": "middle", "social_class": "lower middle class"}, "question": {"id": "Q171", "variant": 0}, "response": ["Based on the anthropological framework, my personal experience and cultural context play a significant role in determining my answer to the question. As a single female from Damiatta, Egypt, religion is a crucial aspect of my cultural identity and community. My socioeconomic background also impacts my religious practices, as I consider myself part of the lower middle class. Additionally, space and time, as well as my age, influence my religious attendance. Considering all these factors, I would choose the following option:\n\n4"]}, {"persona": {"region": "Damiatta", "sex": "male", "age": 19, "country": "Egypt", "marital_status": "single", "education": "middle", "social_class": "lower middle class"}, "question": {"id": "Q171", "variant": 0}, "response": ["Based on the anthropological framework, my emic perspective as a 19-year-old male from Damiatta, Egypt, would be heavily influenced by the cultural context of my religious practices. Damiatta is known for its strong religious traditions, and as a member of the lower middle class, my socioeconomic background would also play a significant role in my religious practices. Additionally, my individual values and personal experiences, as well as my age and place, would also influence my response to this question. Considering all these factors, I would choose the following option:\n\n4. Only on special holy days"]}, {"persona": {"region": "Damiatta", "sex": "female", "age": 33, "country": "Egypt", "marital_status": "married", "education": "higher", "social_class": "lower middle class"}, "question": {"id": "Q171", "variant": 0}, "response": ["Based on the anthropological framework, as a married female from Damiatta, Egypt, my perspective on attending religious services is influenced by my cultural context, individual values, and socioeconomic background. In Damiatta, religion plays a significant role in daily life, and as a married woman, I am expected to participate in religious activities. However, as part of the lower middle class with higher education, I may have a more modern and individualistic approach to religion, valuing personal experience and nuance in my religious practice. Therefore, my choice is:\n\n(3) Once a month"]}, {"persona": {"region": "Damiatta", "sex": "male", "age": 24, "country": "Egypt", "marital_status": "single", "education": "higher", "social_class": "lower middle class"}, "question": {"id": "Q171", "variant": 0}, "response": ["Based on the anthropological framework, my answer is influenced by my cultural context as a single male from Damiatta, Egypt, where religion plays a significant role in daily life. My personal experience and individual values also play a role, as I have been raised in a religious household and have a strong connection to my faith. Additionally, my socioeconomic background as part of the lower middle class impacts my access to religious services and my ability to attend regularly. Considering all of these factors, I choose option (2) Once a week. \n\n2"]}, {"persona": {"region": "Suez", "sex": "male", "age": 41, "country": "Egypt", "marital_status": "married", "education": "middle", "social_class": "working class"}, "question": {"id": "Q171", "variant": 0}, "response": ["Based on the anthropological framework, as a married male from Suez, Egypt, my emic perspective on attending religious services is influenced by the cultural context of my community, where religion plays a significant role in daily life. Additionally, my individual values and personal experience as part of the working class in Egypt have shaped my understanding of the importance of religious services. Socioeconomic background also plays a role, as my income and class influence my access to religious services. Furthermore, cultural relativism is crucial in understanding that religious practices vary across different communities. Given these factors, my choice is (2) Once a week."]}, {"persona": {"region": "Suez", "sex": "female", "age": 39, "country": "Egypt", "marital_status": "divorced", "education": "middle", "social_class": "working class"}, "question": {"id": "Q171", "variant": 0}, "response": ["Based on the anthropological framework, I, as a divorced female from Suez, Egypt, would consider my emic perspective on attending religious services to be influenced by my cultural context, individual values, and socioeconomic background. In Suez, religion plays a significant role in daily life, and as a member of the working class, my personal experience and values may lead me to prioritize attending religious services as a way to find solace and community support. Additionally, my age and place as a 39-year-old woman in Suez may also influence my decision. Overall, my choice will be influenced by a combination of cultural context, personal experience, and socioeconomic background.\n\n6"]}, {"persona": {"region": "Cairo", "sex": "female", "age": 55, "country": "Egypt", "marital_status": "married", "education": "middle", "social_class": "working class"}, "question": {"id": "Q171", "variant": 0}, "response": ["Based on the anthropological framework, as a married female from Cairo, Egypt, my emic perspective is heavily influenced by the cultural context of my society, where religion plays a significant role in daily life. Additionally, my individual values and personal experience, as well as my socioeconomic background as part of the working class, will impact my answer. Cultural relativism is also important to consider, as my understanding of religious practices may differ from those of other cultures. Furthermore, space and time, as well as the nuanced phrasing of the question, will play a role in my response.\n\n3"]}, {"persona": {"region": "Cairo", "sex": "male", "age": 58, "country": "Egypt", "marital_status": "married", "education": "middle", "social_class": "lower middle class"}, "question": {"id": "Q171", "variant": 0}, "response": ["Based on the anthropological framework, my emic perspective as a married male from Cairo, Egypt, is influenced by my cultural context, individual values, and socioeconomic background. In Egypt, religion plays a significant role in society, and it is common for individuals to attend religious services regularly. Additionally, as a member of the lower middle class, my personal experiences and values likely align with the importance of religion in daily life and community. Therefore, my answer aligns with the cultural context and values of my persona.\n\n3"]}, {"persona": {"region": "Cairo", "sex": "female", "age": 29, "country": "Egypt", "marital_status": "married", "education": "higher", "social_class": "lower middle class"}, "question": {"id": "Q171", "variant": 0}, "response": ["Based on the anthropological framework, as a married woman from Cairo, Egypt, my emic perspective is influenced by the cultural context of the city, where religious practices are deeply ingrained in daily life. The etic perspective, on the other hand, may view religious services from a more detached and less frequent standpoint. My individual values and personal experience, along with my socioeconomic background as part of the lower middle class, also play a role in my decision. Additionally, the cultural relativism of Egyptian society and the significance of space and time, given my age and location, further inform my choice. Considering all these factors, I would choose option (4) Only on special holy days, as it reflects the balance between religious significance and practical considerations in my life.\n\n4"]}, {"persona": {"region": "Cairo", "sex": "male", "age": 38, "country": "Egypt", "marital_status": "married", "education": "higher", "social_class": "lower middle class"}, "question": {"id": "Q171", "variant": 0}, "response": ["Based on the anthropological framework, my answer is influenced by my cultural context as a married male from Cairo, Egypt, where religion plays a significant role in daily life. As part of the lower middle class, my socioeconomic background also plays a role in my answer, as I may have limited time and resources to attend religious services frequently. Additionally, my personal experience and individual values also shape my perspective, as I may have a strong belief in the importance of religious practice but may not have the means to attend services as frequently as I would like. Taking into account the nuanced phrasing of the question, I would choose option (3) Once a month, as it reflects my desire to attend religious services regularly despite potential constraints. \n\n3"]}, {"persona": {"region": "Cairo", "sex": "female", "age": 40, "country": "Egypt", "marital_status": "married", "education": "higher", "social_class": "lower middle class"}, "question": {"id": "Q171", "variant": 0}, "response": ["Based on the anthropological framework, my emic perspective as a married female from Cairo, Egypt, would be heavily influenced by my cultural context, individual values, and socioeconomic background. In Cairo, religion plays a significant role in daily life, and as a middle-class woman, I likely have strong ties to my community and family. My personal experience and values would also influence my religious practices, as education and age can affect one's beliefs and practices. Considering the nuanced phrasing of the question, I would choose the option that aligns with my cultural and socioeconomic position, while also considering the role of religion in my community and personal life.\n\n4"]}, {"persona": {"region": "Cairo", "sex": "male", "age": 38, "country": "Egypt", "marital_status": "married", "education": "higher", "social_class": "upper middle class"}, "question": {"id": "Q171", "variant": 0}, "response": ["Based on the anthropological framework, my emic perspective as a married male from Cairo, Egypt, who is 38 years old and part of the upper middle class, is heavily influenced by the cultural context of the region. Religion plays a significant role in the daily lives of people in Cairo, and it is not only a matter of personal belief but also a social and communal activity. The socioeconomic background also plays a role, as being part of the upper middle class may afford me more opportunities to attend religious services. Additionally, my personal experience and individual values may also shape my religious practices. Considering all these factors, I would choose option (2) Once a week. \n\n2"]}, {"persona": {"region": "Cairo", "sex": "male", "age": 59, "country": "Egypt", "marital_status": "married", "education": "middle", "social_class": "lower middle class"}, "question": {"id": "Q171", "variant": 0}, "response": ["Based on the anthropological framework, my perspective as a married male from Cairo, Egypt, at 59 years of age and part of the lower middle class, is heavily influenced by my cultural context, individual values, and socioeconomic background. In Cairo, religion plays a significant role in daily life, and as a member of the lower middle class, I have been raised to prioritize religious observance as a way to find solace and community support. Additionally, my age and place in society have instilled in me the importance of attending religious services as a way to connect with my community and seek guidance in challenging times. Therefore, my answer to the question of how frequently I attend religious services is:\n\n2) Once a week"]}, {"persona": {"region": "Cairo", "sex": "female", "age": 30, "country": "Egypt", "marital_status": "married", "education": "higher", "social_class": "upper middle class"}, "question": {"id": "Q171", "variant": 0}, "response": ["Based on the anthropological framework, my emic perspective as a married female from Cairo, Egypt, who is 30 years old, highly educated, and part of the upper middle class, is influenced by my cultural context, individual values, and socioeconomic background. In Cairo, religion is a significant part of the cultural context and daily life, and as a member of the upper middle class, I may have greater access to religious institutions and resources. Additionally, my personal experience and values may lead me to prioritize religious attendance as a way to maintain social connections and status within my community. Therefore, my answer to the question is: (2) Once a week."]}, {"persona": {"region": "Cairo", "sex": "male", "age": 22, "country": "Egypt", "marital_status": "single", "education": "middle", "social_class": "lower middle class"}, "question": {"id": "Q171", "variant": 0}, "response": ["Based on the anthropological framework, my emic perspective as a single male from Cairo, Egypt, would be influenced by the cultural context of my society, where religion plays a significant role in daily life. Additionally, my individual values and personal experiences, as well as my socioeconomic background as part of the lower middle class, would also impact my answer. Considering the cultural relativism, space and time, and the nuanced phrasing of the question, I would choose the following option:\n\n2"]}, {"persona": {"region": "Cairo", "sex": "male", "age": 29, "country": "Egypt", "marital_status": "single", "education": "higher", "social_class": "lower middle class"}, "question": {"id": "Q171", "variant": 0}, "response": ["Based on the anthropological framework, my emic perspective as a single male from Cairo, Egypt, who is 29 years old and part of the lower middle class, is heavily influenced by the cultural context of my upbringing in a predominantly Islamic society. Religion plays a significant role in the daily lives of individuals in Egypt, and as a result, attending religious services is a common practice. However, my individual values and personal experience as someone who has completed higher education have also shaped my view on religious practices. Additionally, my socioeconomic background as part of the lower middle class impacts the amount of free time and resources I have available. Considering all these factors, I would choose option (3) Once a month, as it reflects a balance between my cultural upbringing and personal circumstances. \n\n3"]}, {"persona": {"region": "Cairo", "sex": "female", "age": 31, "country": "Egypt", "marital_status": "married", "education": "higher", "social_class": "lower middle class"}, "question": {"id": "Q171", "variant": 0}, "response": ["Based on the anthropological framework, as a married female from Cairo, Egypt, cultural context and individual values play a significant role in the frequency of attending religious services. In Cairo, religion is deeply ingrained in the culture and society, with Islam being the predominant religion. As a married woman, there may be certain expectations and social pressures to participate in religious activities. Additionally, being part of the lower middle class may mean that access to religious services and the time available to attend may be limited due to work and family responsibilities. Therefore, based on these factors, I would choose option (3) Once a month.\n\n3"]}, {"persona": {"region": "Cairo", "sex": "male", "age": 59, "country": "Egypt", "marital_status": "married", "education": "higher", "social_class": "upper middle class"}, "question": {"id": "Q171", "variant": 0}, "response": ["Based on the anthropological framework, as a married male from Cairo, Egypt, who is 59 years old and part of the upper middle class, my answer to the question of how frequently I attend religious services would be influenced by various factors. Firstly, the cultural context of Cairo, Egypt, being predominantly Muslim, means that religious practices and attendance at services are highly valued. Additionally, my age and socioeconomic background would also play a role in my answer. Given my higher education level and belonging to the upper middle class, I am likely to be more traditional and religiously observant, leading me to attend religious services more frequently as a sign of respect for my cultural and religious upbringing.\n\n2"]}, {"persona": {"region": "Cairo", "sex": "male", "age": 27, "country": "Egypt", "marital_status": "single", "education": "middle", "social_class": "working class"}, "question": {"id": "Q171", "variant": 0}, "response": ["Based on the anthropological framework, my emic perspective as a single male from Cairo, Egypt, is heavily influenced by the cultural context of my upbringing, which places a strong emphasis on religious practices. My personal experience and individual values have also shaped my perception, as I was brought up in a devout household and continue to uphold these values. Additionally, my socioeconomic background as a working-class individual in Cairo has limited my opportunities for leisure activities, leading me to prioritize religious services as a form of community and spiritual connection. Therefore, I choose option (2) Once a week. \n\n2"]}, {"persona": {"region": "Cairo", "sex": "female", "age": 25, "country": "Egypt", "marital_status": "single", "education": "higher", "social_class": "working class"}, "question": {"id": "Q171", "variant": 0}, "response": ["From the perspective of a single female from Cairo, Egypt, cultural context plays a pivotal role in understanding and answering questions related to religious practices. Egypt has a predominantly Muslim population, and as a member of the working class, access to religious services may be limited due to work commitments and socioeconomic factors. Additionally, as a young woman who has completed higher education, individual values and personal experience will also influence the frequency of attendance at religious services. It's important to note that cultural relativism and the nuanced phrasing of the question will also impact the response, as the perception of religious practices may differ based on the specific cultural and social context in Egypt.\n\n6"]}, {"persona": {"region": "Cairo", "sex": "female", "age": 23, "country": "Egypt", "marital_status": "married", "education": "higher", "social_class": "lower middle class"}, "question": {"id": "Q171", "variant": 0}, "response": ["Based on the anthropological framework, as a married female from Cairo, Egypt, my emic perspective on attending religious services is influenced by the cultural context of my upbringing and social environment. In Cairo, religion plays a significant role in daily life, and as a member of the lower middle class, my socioeconomic background also impacts my religious practices. Additionally, my personal experience and individual values have shaped my understanding of religion and its significance in my life. Considering the nuanced phrasing of the question, I would choose option (2) Once a week, as it aligns with the cultural and religious norms of my community and reflects my personal religious practices.\n\n2"]}, {"persona": {"region": "Cairo", "sex": "male", "age": 58, "country": "Egypt", "marital_status": "married", "education": "higher", "social_class": "working class"}, "question": {"id": "Q171", "variant": 0}, "response": ["Based on the anthropological framework, as a married male from Cairo, Egypt, my cultural context and individual values heavily influence my religious practices. In Egypt, religion plays a significant role in the daily lives of people, and attending religious services is a common practice, especially for men. As an older, educated, and working-class individual, my socioeconomic background and personal experience also shape my religious practices. Additionally, the cultural relativism in Egypt emphasizes the importance of religious observance, and my age and place in society further reinforce the significance of attending religious services. Therefore, my answer is (2) Once a week."]}, {"persona": {"region": "Cairo", "sex": "female", "age": 40, "country": "Egypt", "marital_status": "married", "education": "higher", "social_class": "working class"}, "question": {"id": "Q171", "variant": 0}, "response": ["Based on the anthropological framework, my perspective as a married female from Cairo, Egypt, is influenced by my cultural context, individual values, and socioeconomic background. In Egypt, religion plays a significant role in daily life, and the cultural context dictates that religious practices are important. As a working-class woman, my socioeconomic background also impacts my religious practices, as I may have limited time due to work commitments. Additionally, my personal experience and values shape my religious observance. Therefore, I choose option (4) Only on special holy days, as it aligns with the cultural and socioeconomic factors that influence my religious attendance."]}, {"persona": {"region": "Cairo", "sex": "female", "age": 36, "country": "Egypt", "marital_status": "married", "education": "middle", "social_class": "upper middle class"}, "question": {"id": "Q171", "variant": 0}, "response": ["Based on the anthropological framework, as a married female from Cairo, Egypt, my emic perspective is influenced by the cultural context of living in a predominantly Muslim society. My personal experience and values are shaped by the importance of religion and religious practices in my community. Additionally, my socioeconomic background as part of the upper middle class may allow me more flexibility in attending religious services compared to those in lower economic classes. Considering the nuance of the question, I would choose option 2) Once a week, as attending religious services is an important part of my cultural and religious identity, and it aligns with the societal expectations and norms within my community."]}, {"persona": {"region": "Cairo", "sex": "male", "age": 40, "country": "Egypt", "marital_status": "married", "education": "middle", "social_class": "lower middle class"}, "question": {"id": "Q171", "variant": 0}, "response": ["Based on the anthropological framework, I, as a married male from Cairo, Egypt, would consider the emic perspective of this question by examining the cultural context and individual values. Religion plays a significant role in the lives of many Egyptians, and it is deeply intertwined with our cultural context. As someone from the lower middle class in Cairo, I have likely been raised in a religious environment and have strong ties to my community and family. My personal experience and values also contribute to my religious practices, and attending religious services is likely an important part of my life. Additionally, the socioeconomic background and age of an individual also play a role in their religious practices, and as a 40-year-old man from the lower middle class in Cairo, my answer would be influenced by these factors as well.\n\n6"]}, {"persona": {"region": "Cairo", "sex": "female", "age": 30, "country": "Egypt", "marital_status": "married", "education": "middle", "social_class": "lower class"}, "question": {"id": "Q171", "variant": 0}, "response": ["From the perspective of a married lower-class woman from Cairo, Egypt, my emic perspective on attending religious services is influenced by my cultural context, individual values, and socioeconomic background. In Cairo, religion plays a significant role in everyday life, and attending religious services is a common practice. As a lower-class woman, I may have limited access to resources and opportunities, which could impact my ability to attend religious services as frequently as those from higher socioeconomic backgrounds. Additionally, my personal experience and values may also influence my decision. Considering all these factors, I would choose option (3) Once a month. \n\n3"]}, {"persona": {"region": "Cairo", "sex": "male", "age": 58, "country": "Egypt", "marital_status": "married", "education": "higher", "social_class": "lower middle class"}, "question": {"id": "Q171", "variant": 0}, "response": ["Based on the anthropological framework, as a married male from Cairo, Egypt, I am deeply rooted in the cultural context of my society, where religion plays a significant role. My personal experience and values, as well as my socioeconomic background, influence my decision on how frequently I attend religious services. Additionally, the space and time factor, along with the nuance of the question, are important to consider. Therefore, I would choose option (2) Once a week, as attending religious services on a weekly basis is a common practice in my cultural and religious context, and it aligns with my personal values and experience as a member of the lower middle class in Cairo, Egypt. \n\n2"]}, {"persona": {"region": "Cairo", "sex": "male", "age": 50, "country": "Egypt", "marital_status": "married", "education": "middle", "social_class": "lower middle class"}, "question": {"id": "Q171", "variant": 0}, "response": ["Based on the anthropological framework, as a married male from Cairo, Egypt, my emic perspective is heavily influenced by the cultural context of the city and the country as a whole. Religion plays a significant role in the daily lives of people in Egypt, and as a middle-aged man, I am likely to have been raised with a strong emphasis on religious practices. Additionally, my lower middle-class socioeconomic background may also impact my religious attendance, as I may have limited time and resources to dedicate to attending religious services. Finally, my individual values and personal experiences will shape my answer, as my personal relationship with religion and spirituality will influence how frequently I attend religious services.\n\n4"]}, {"persona": {"region": "Cairo", "sex": "female", "age": 40, "country": "Egypt", "marital_status": "married", "education": "higher", "social_class": "upper middle class"}, "question": {"id": "Q171", "variant": 0}, "response": ["Based on the anthropological framework, my emic perspective as a married female from Cairo, Egypt, who is 40 years old, highly educated, and part of the upper middle class, is deeply influenced by the cultural context of my upbringing. In Egypt, religion plays a significant role in daily life, and social status and education level can also influence religious practices. My individual values and personal experiences have shaped my understanding of religion, and my socioeconomic background has afforded me the privilege of having the freedom to choose my level of religious involvement. Additionally, the cultural relativism of Egypt means that there is no hierarchy of culture, and the nuanced phrasing of the question impacts my response. \n\n3"]}, {"persona": {"region": "Cairo", "sex": "female", "age": 33, "country": "Egypt", "marital_status": "married", "education": "middle", "social_class": "lower middle class"}, "question": {"id": "Q171", "variant": 0}, "response": ["Based on the anthropological framework, as a married female from Cairo, Egypt, the cultural context and religious practices play a significant role in my life. Religion is deeply ingrained in the cultural fabric of Egypt, and as a member of the lower middle class, my socioeconomic background influences the frequency of my religious attendance. Additionally, my individual values and personal experiences also impact my religious practices. Considering these factors, I would choose option (2) Once a week, as attending religious services weekly is a common practice for individuals in my cultural and socioeconomic context. \n\n2"]}, {"persona": {"region": "Cairo", "sex": "female", "age": 37, "country": "Egypt", "marital_status": "married", "education": "middle", "social_class": "lower middle class"}, "question": {"id": "Q171", "variant": 0}, "response": ["Based on the anthropological framework, as a married female from Cairo, Egypt, at 37 years old and part of the lower middle class, my emic perspective on attending religious services is influenced by my cultural context, individual values, and socioeconomic background. In Cairo, religion plays a significant role in everyday life, and attending religious services is a common practice. However, as a lower middle class woman, my socioeconomic background may limit my ability to attend religious services more frequently due to time and financial constraints. Additionally, my personal experience and individual values may also impact my attendance, as I may prioritize family obligations and community involvement over regular religious service attendance. Therefore, my choice is based on a combination of cultural context, individual values, and socioeconomic background.\n\n6"]}, {"persona": {"region": "Cairo", "sex": "male", "age": 28, "country": "Egypt", "marital_status": "married", "education": "middle", "social_class": "lower middle class"}, "question": {"id": "Q171", "variant": 0}, "response": ["Based on the anthropological framework, my answer is influenced by my cultural context as a married male from Cairo, Egypt, where religion plays a significant role in daily life. My socioeconomic background as part of the lower middle class also affects my answer, as it determines the level of access and opportunity for attending religious services. Additionally, my individual values and personal experience factor into my decision, as my personal beliefs and experiences shape my religious practices. Considering the nuance of the question, I choose option (2) Once a week, as it aligns with the cultural and religious practices commonly observed in my community. \n\n2"]}, {"persona": {"region": "Cairo", "sex": "male", "age": 53, "country": "Egypt", "marital_status": "married", "education": "higher", "social_class": "working class"}, "question": {"id": "Q171", "variant": 0}, "response": ["Based on the anthropological framework, as a married male from Cairo, Egypt, my emic perspective informs me that attending religious services is an important part of my cultural context. Religion plays a significant role in the daily lives of people in Cairo, and the practice of attending religious services is deeply ingrained in the cultural fabric. Additionally, my socioeconomic background as part of the working class allows me to prioritize religious observance as a source of community and spiritual fulfillment. My personal experience and individual values also contribute to my decision, as I find solace and connection through regular attendance at religious services. Therefore, my answer to the question would be:\n\n2) Once a week"]}, {"persona": {"region": "Cairo", "sex": "male", "age": 45, "country": "Egypt", "marital_status": "married", "education": "higher", "social_class": "lower middle class"}, "question": {"id": "Q171", "variant": 0}, "response": ["Based on the anthropological framework, as a married male from Cairo, Egypt, my emic perspective is heavily influenced by the cultural context of my society, where religion plays a significant role in daily life. Additionally, my individual values and personal experiences, as well as my socioeconomic background, all contribute to my understanding and practice of religion. In Egypt, religion is deeply ingrained in our culture and is a significant part of our social and communal identity. My age and place also play a role in my religious practices, as I have been brought up in a society where religious observance is highly valued. Therefore, I would choose option (2) Once a week, as it aligns with the religious practices and cultural norms of my community. \n\n2"]}, {"persona": {"region": "Cairo", "sex": "male", "age": 52, "country": "Egypt", "marital_status": "married", "education": "middle", "social_class": "upper middle class"}, "question": {"id": "Q171", "variant": 0}, "response": ["Based on the anthropological framework, my emic perspective as a married male from Cairo, Egypt, is heavily influenced by the cultural context of my upbringing and location. Religion plays a significant role in the daily lives of individuals in Cairo, and as someone from the upper middle class, I am likely to have a strong connection to my community and religious practices. My socioeconomic background also factors into my answer, as attending religious services is a common practice among individuals of my social standing. Additionally, my personal experience and individual values, shaped by my age and education level, contribute to my frequent attendance at religious services. Therefore, my answer is option (1) More than once a week.\n\n1"]}, {"persona": {"region": "Cairo", "sex": "male", "age": 22, "country": "Egypt", "marital_status": "single", "education": "higher", "social_class": "lower middle class"}, "question": {"id": "Q171", "variant": 0}, "response": ["Based on the anthropological framework, my perspective as a single male from Cairo, Egypt, is heavily influenced by my cultural context, socioeconomic background, and personal experience. In Cairo, religion plays a significant role in daily life, and the cultural context emphasizes the importance of religious practices. Additionally, as a member of the lower middle class, my access to religious services may be limited by financial constraints. Furthermore, being a 22-year-old who has completed higher education, my individual values and personal experience may lead me to question traditional religious practices and attend religious services less often. Therefore, my choice is:\n\n6) Less often"]}, {"persona": {"region": "Cairo", "sex": "female", "age": 57, "country": "Egypt", "marital_status": "divorced", "education": "middle", "social_class": "lower middle class"}, "question": {"id": "Q171", "variant": 0}, "response": ["Based on the anthropological framework, as a divorced female from Cairo, Egypt, my emic perspective on religious services is influenced by the cultural context of the society I come from, where religion plays a significant role in daily life. My individual values and personal experience also shape my perception of religious attendance, as I may seek solace and community support in religious services after experiencing divorce. Additionally, my lower middle class socioeconomic background may impact my ability to attend religious services frequently, as I may have to work longer hours or have other financial constraints. Finally, as an older woman, I may prioritize attending religious services on special holy days or on a monthly basis due to traditional and familial influences. 3\n\n(3) Once a month"]}, {"persona": {"region": "Cairo", "sex": "female", "age": 42, "country": "Egypt", "marital_status": "married", "education": "middle", "social_class": "working class"}, "question": {"id": "Q171", "variant": 0}, "response": ["Based on the anthropological framework, my answer to the question of how frequently I attend religious services is influenced by my cultural context as a married female from Cairo, Egypt. Religion plays a significant role in Egyptian society, and my upbringing and socialization have instilled in me a strong sense of religious identity. Additionally, my socioeconomic background as a working-class individual has shaped my values and daily routines, making regular attendance at religious services a priority for me. Moreover, my age and life stage influence my commitment to religious practices, as I am at a stage in life where spirituality and connection to my faith are particularly important to me. Therefore, my answer is (2) Once a week."]}, {"persona": {"region": "Cairo", "sex": "female", "age": 23, "country": "Egypt", "marital_status": "single", "education": "middle", "social_class": "lower middle class"}, "question": {"id": "Q171", "variant": 0}, "response": ["Based on the anthropological framework, my emic perspective as a single female from Cairo, Egypt, would be influenced by my cultural context, individual values, and socioeconomic background. In Cairo, religion holds great importance in daily life and is deeply embedded in the cultural fabric. As a lower middle class individual, my access to education and exposure to different perspectives may be limited, leading me to have a more traditional and conservative outlook. Additionally, my age and socioeconomic background may also play a role in my religious practices, as I may feel a sense of community and belonging by attending religious services. Therefore, I would choose option (2) Once a week. \n\n2"]}, {"persona": {"region": "Cairo", "sex": "female", "age": 28, "country": "Egypt", "marital_status": "married", "education": "higher", "social_class": "upper middle class"}, "question": {"id": "Q171", "variant": 0}, "response": ["Based on the anthropological framework, as a married female from Cairo, Egypt, cultural context and individual values and personal experience are pivotal in understanding and answering this question. Egypt has a predominantly Muslim population, and as a member of the upper middle class, religious values and practices may hold significant importance. Additionally, higher education level and age can also influence the frequency of attending religious services. Considering these factors, my personal experience and values lead me to choose the following option:\n\n3"]}, {"persona": {"region": "Cairo", "sex": "female", "age": 22, "country": "Egypt", "marital_status": "single", "education": "higher", "social_class": "lower middle class"}, "question": {"id": "Q171", "variant": 0}, "response": ["Based on the anthropological framework, my understanding and answer to the question of religious service attendance is influenced by my cultural context as a single female from Cairo, Egypt. Religion is a significant aspect of our cultural identity and daily life. As a young, educated woman from the lower middle class, I have been brought up with the value of attending religious services as a way to connect with my community and uphold traditions. However, my individual values and personal experiences also play a role in my answer. Given my age and educational background, I may find myself balancing modern life with traditional religious practices. Additionally, my socioeconomic background may impact the time and resources I have available to attend religious services. Taking all these factors into account, I would choose option 3 - Once a month as my frequency of religious service attendance.\n\n3"]}, {"persona": {"region": "Cairo", "sex": "female", "age": 39, "country": "Egypt", "marital_status": "married", "education": "middle", "social_class": "lower middle class"}, "question": {"id": "Q171", "variant": 0}, "response": ["Based on my cultural context as a married female from Cairo, Egypt, and my lower middle class socioeconomic background, religion plays a significant role in my life. My individual values and personal experience have shaped my understanding of the importance of religious services in maintaining a sense of community and spirituality. Additionally, the cultural context of living in a predominantly Muslim country like Egypt means that religious observance is a part of everyday life. Considering the emic and etic perspectives, as well as the nuanced phrasing of the question, I would choose the following option:\n\n4"]}, {"persona": {"region": "Cairo", "sex": "male", "age": 19, "country": "Egypt", "marital_status": "single", "education": "middle", "social_class": "working class"}, "question": {"id": "Q171", "variant": 0}, "response": ["Based on the anthropological framework, as a single male from Cairo, Egypt, who completed middle education and considers himself part of the working class, my perspective on attending religious services would be heavily influenced by my cultural context, individual values, and socioeconomic background. In Cairo, religion is deeply ingrained in the cultural context, and as a working-class individual, my access to religious services may be limited due to time and financial constraints. Additionally, my personal experience and age may also play a role in shaping my religious practices. Therefore, my choice for how frequently I attend religious services would be:\n\n6) Less often"]}, {"persona": {"region": "Cairo", "sex": "female", "age": 54, "country": "Egypt", "marital_status": "married", "education": "middle", "social_class": "working class"}, "question": {"id": "Q171", "variant": 0}, "response": ["Based on the anthropological framework, my perspective as a married female from Cairo, Egypt, who is 54 years old, with a middle education level and part of the working class, is heavily influenced by my cultural context. In Cairo, religion plays a significant role in daily life, and attending religious services is a common practice. My personal experience and values also shape my perception of religion, and I prioritize attending religious services to uphold my cultural and spiritual beliefs. Additionally, my socioeconomic background as part of the working class may lead me to seek solace and community in religious gatherings. Therefore, my choice is:\n\n(2) Once a week"]}, {"persona": {"region": "Cairo", "sex": "male", "age": 30, "country": "Egypt", "marital_status": "married", "education": "higher", "social_class": "working class"}, "question": {"id": "Q171", "variant": 0}, "response": ["Based on the anthropological framework, as a married male from Cairo, Egypt, my emic perspective on attending religious services is influenced by the cultural context of my upbringing in a predominantly Muslim society. The societal and familial expectations, along with my personal values and experiences, have shaped my understanding of religious practice. Additionally, my socioeconomic background as part of the working class and my age play a role in determining the frequency of my attendance at religious services. Considering the cultural relativism and nuance, I would choose the following option:\n\n4"]}, {"persona": {"region": "Cairo", "sex": "male", "age": 39, "country": "Egypt", "marital_status": "married", "education": "higher", "social_class": "lower middle class"}, "question": {"id": "Q171", "variant": 0}, "response": ["Based on the anthropological framework described above, my response to the question about religious services attendance will be influenced by a combination of factors. Firstly, the cultural context in Egypt places a strong emphasis on religious practices, and as a married male from Cairo, I am likely to be deeply rooted in the local cultural and religious traditions. Additionally, my individual values and personal experience, as well as my socioeconomic background as part of the lower middle class, will also play a significant role in my answer. Furthermore, the space and time factor also comes into play, as my age and place of residence in Cairo will have an impact on my religious practices. Considering these factors, I will choose the option that best aligns with the religious practices and beliefs commonly observed in my cultural and socioeconomic context.\n\n4"]}, {"persona": {"region": "Cairo", "sex": "female", "age": 41, "country": "Egypt", "marital_status": "married", "education": "middle", "social_class": "lower middle class"}, "question": {"id": "Q171", "variant": 0}, "response": ["Based on the anthropological framework, my answer is influenced by my cultural context as a married female from Cairo, Egypt. Religion plays a significant role in our society, and as a member of the lower middle class, my socioeconomic background also influences my answer. Additionally, my individual values and personal experience, including my age and education level, contribute to my response. Considering the emic and etic perspectives, as well as the nuanced phrasing of the question, I choose the following option:\n\n5"]}, {"persona": {"region": "Cairo", "sex": "male", "age": 45, "country": "Syria", "marital_status": "single", "education": "higher", "social_class": "upper middle class"}, "question": {"id": "Q171", "variant": 0}, "response": ["Based on the anthropological framework, my emic perspective as a single male from Cairo, Syria, is influenced by my cultural context, individual values, and socioeconomic background. In Cairo, religion plays a significant role in society and is deeply intertwined with daily life. As a member of the upper middle class, I am likely to have access to education and resources that allow me to participate in religious services more frequently. Additionally, my age and personal experiences have likely shaped my religious beliefs and practices. Therefore, from my perspective, I would choose option (2) Once a week as the frequency of attending religious services, as it aligns with the cultural, social, and personal factors that influence my religious practices.\n\n2"]}, {"persona": {"region": "Cairo", "sex": "male", "age": 54, "country": "Egypt", "marital_status": "married", "education": "higher", "social_class": "lower middle class"}, "question": {"id": "Q171", "variant": 0}, "response": ["Based on my cultural context as a married male from Cairo, Egypt, religion plays a significant role in my life and the lives of those around me. The emic perspective within my community emphasizes the importance of regular religious attendance as a form of social and spiritual connection. Additionally, my lower middle class socioeconomic background has instilled in me the value of communal support and solidarity, often found within religious services. My personal experience and values also reinforce the significance of religious practice in my life. Therefore, my answer to the question would be:\n\n2) Once a week"]}, {"persona": {"region": "Cairo", "sex": "male", "age": 65, "country": "Egypt", "marital_status": "married", "education": "middle", "social_class": "upper middle class"}, "question": {"id": "Q171", "variant": 0}, "response": ["Based on my cultural context, as a married male from Cairo, Egypt, religion plays a significant role in my life. The cultural context of Egypt is deeply rooted in Islamic traditions, and attending religious services is a common practice for many individuals in my socioeconomic background. Additionally, my age and personal experience have shaped my values and beliefs, leading me to prioritize religious observance. Furthermore, the emic perspective within my community emphasizes the importance of regular attendance at religious services as a way to maintain social and spiritual connections. Taking into account these factors, I would choose option (2) Once a week. \n\n2"]}, {"persona": {"region": "Cairo", "sex": "female", "age": 52, "country": "Egypt", "marital_status": "married", "education": "middle", "social_class": "upper middle class"}, "question": {"id": "Q171", "variant": 0}, "response": ["Based on the anthropological framework, as a married female from Cairo, Egypt, my emic perspective on attending religious services is influenced by the cultural context in which I live, where religion plays a significant role in daily life. My personal experience and individual values also play a key role, as I have been raised in a religious household and have always prioritized attending religious services. Additionally, my socioeconomic background as part of the upper middle class has allowed me the time and resources to attend religious services regularly. Furthermore, the nuance of the question is important, as it is not just about frequency but also about the significance of religious services in my life. Therefore, my answer to the question is:\n\n2) Once a week"]}, {"persona": {"region": "Cairo", "sex": "male", "age": 26, "country": "Egypt", "marital_status": "single", "education": "higher", "social_class": "lower middle class"}, "question": {"id": "Q171", "variant": 0}, "response": ["Based on the anthropological framework, my perspective as a single male from Cairo, Egypt is deeply influenced by the cultural context of the city. Religion plays a significant role in the daily lives of people in Cairo, and as a member of the lower middle class, my socioeconomic background also impacts my religious practices. Additionally, my individual values and personal experiences have shaped my perception of religion, and my age and place of residence further contribute to my religious beliefs. Considering all these factors, the frequency with which I attend religious services is likely to be less often.\n\n6"]}, {"persona": {"region": "Cairo", "sex": "male", "age": 32, "country": "Egypt", "marital_status": "married", "education": "middle", "social_class": "working class"}, "question": {"id": "Q171", "variant": 0}, "response": ["Based on the anthropological framework, my answer to the question of how frequently I attend religious services would be influenced by a combination of emic and etic perspectives, cultural context, individual values and personal experience, socioeconomic background, cultural relativism, space and time, and nuance. In Cairo, Egypt, religion plays a significant role in daily life, and the cultural context and personal experience of being raised in a predominantly Muslim society would likely lead me to attend religious services more frequently. Additionally, my working class socioeconomic background and age would also influence my answer, as younger individuals and those from lower socioeconomic backgrounds in Egypt are often more devout in their religious practices. Therefore, my choice would be: 2) Once a week"]}, {"persona": {"region": "Cairo", "sex": "male", "age": 38, "country": "Egypt", "marital_status": "married", "education": "middle", "social_class": "lower middle class"}, "question": {"id": "Q171", "variant": 0}, "response": ["Based on the anthropological framework, my answer to the question of how frequently I attend religious services is influenced by my cultural context and socioeconomic background. As a married male from Cairo, Egypt, I come from a predominantly Muslim society where religion holds great importance. However, my lower middle class status and limited educational level also play a role in my religious practices. Additionally, my personal experience and individual values shape my approach to religious services. Considering all of these factors, I choose the following option:\n6"]}, {"persona": {"region": "Cairo", "sex": "male", "age": 58, "country": "Egypt", "marital_status": "married", "education": "higher", "social_class": "upper middle class"}, "question": {"id": "Q171", "variant": 0}, "response": ["Based on the anthropological framework, as a married male from Cairo, Egypt, my emic perspective is heavily influenced by the cultural context of my upbringing in a predominantly Muslim society. The cultural context and individual values in Egypt place a strong emphasis on religious practices and attendance at religious services. Additionally, my higher education level and belonging to the upper middle class have provided me with the resources and opportunities to actively participate in religious activities. Furthermore, my age and socioeconomic background contribute to my strong connection to religious practices. Therefore, I would choose option (1) More than once a week to attend religious services. \n\n1"]}, {"persona": {"region": "Cairo", "sex": "male", "age": 49, "country": "Egypt", "marital_status": "married", "education": "middle", "social_class": "lower middle class"}, "question": {"id": "Q171", "variant": 0}, "response": ["Based on the anthropological framework, as a married male from Cairo, Egypt, my cultural context and religious background play a significant role in shaping my perception of religious services. Being from Egypt, a predominantly Muslim country, religion is a central aspect of daily life and societal norms. Additionally, my age and socioeconomic background as a lower middle-class individual further influence my religious practices and beliefs. Considering the emic perspective, I would choose option (2) Once a week, as it aligns with the religious and cultural expectations within my community and personal values."]}, {"persona": {"region": "Cairo", "sex": "female", "age": 29, "country": "Egypt", "marital_status": "married", "education": "middle", "social_class": "working class"}, "question": {"id": "Q171", "variant": 0}, "response": ["Based on the anthropological framework, as a married female from Cairo, Egypt, my religious practices are heavily influenced by the cultural context and individual values. Cairo is a city with a rich religious history, and the majority of the population is Muslim. As a member of the working class, I may have limited time and resources, which could impact my ability to attend religious services frequently. Additionally, my personal experience and values may shape my religious practices. Therefore, my answer would be:\n6"]}, {"persona": {"region": "Cairo", "sex": "female", "age": 36, "country": "Egypt", "marital_status": "married", "education": "higher", "social_class": "lower middle class"}, "question": {"id": "Q171", "variant": 0}, "response": ["Based on my cultural context as a married female from Cairo, Egypt, I understand the importance of religious services in the community. In Egypt, religion plays a significant role in daily life, and attending religious services is a common practice. Being part of the lower middle class, I am likely to have a strong sense of community and tradition, and religion may provide a sense of stability and support. Additionally, my individual values and personal experience may also influence my decision, as I may have been raised to prioritize religious attendance. Considering the cultural relativism and the nuanced phrasing of the question, I would choose the option:\n(2) Once a week"]}, {"persona": {"region": "Cairo", "sex": "female", "age": 34, "country": "Egypt", "marital_status": "married", "education": "middle", "social_class": "lower middle class"}, "question": {"id": "Q171", "variant": 0}, "response": ["From the perspective of a married female from Cairo, Egypt, the frequency of attending religious services is heavily influenced by cultural context and individual values. In Cairo, religion plays a significant role in daily life and is deeply ingrained in the societal fabric. As a member of the lower middle class, access to religious institutions and the time available to attend services may be limited due to work and family commitments. Additionally, the cultural relativism of religious practice in Egypt means that there is no hierarchy of religious devotion, and personal experience and individual values also play a significant role in determining the frequency of attendance. Considering all these factors, the chosen option is:\n(3) Once a month"]}, {"persona": {"region": "Fayoum", "sex": "male", "age": 57, "country": "Egypt", "marital_status": "married", "education": "middle", "social_class": "working class"}, "question": {"id": "Q171", "variant": 0}, "response": ["Based on the anthropological framework, my emic perspective as a married male from Fayoum, Egypt, emphasizes the importance of cultural context, individual values and personal experience, and socioeconomic background. In my cultural context, religion plays a significant role in daily life and is central to my identity. As a working-class man who completed middle education, I have been brought up to prioritize religious observance as a means of finding solace and community in my everyday struggles. My personal experience has also shaped my strong belief in the importance of attending religious services regularly. Additionally, my socioeconomic background has influenced my need for spiritual guidance and support. Therefore, my choice is option (2) Once a week. \n\n2"]}, {"persona": {"region": "Fayoum", "sex": "male", "age": 60, "country": "Egypt", "marital_status": "married", "education": "middle", "social_class": "lower middle class"}, "question": {"id": "Q171", "variant": 0}, "response": ["Based on the anthropological framework, my perspective on attending religious services is influenced by my cultural context, individual values, and socioeconomic background. As a married male from Fayoum, Egypt, my community places a strong emphasis on religious practices and beliefs, and attending religious services is an important part of our social and cultural life. Additionally, my lower middle class socioeconomic background means that I likely have more time to devote to attending religious services compared to someone from a higher socioeconomic status. My personal experience and values also contribute to my decision, as I have been brought up to prioritize religious observance and have developed a strong connection to my faith over the years. Therefore, my answer to the question is:\n\n2) Once a week"]}, {"persona": {"region": "Fayoum", "sex": "male", "age": 21, "country": "Egypt", "marital_status": "single", "education": "middle", "social_class": "lower middle class"}, "question": {"id": "Q171", "variant": 0}, "response": ["Based on my cultural context as a single male from Fayoum, Egypt, religion plays a significant role in my life. The socioeconomic background of my lower middle class status has also shaped my values and personal experience, leading me to have a strong sense of community and belonging within my religious community. Additionally, the cultural relativism in Egypt means that religion is a central aspect of social life and attending religious services is a common practice among people in my demographic. Therefore, considering my age and place, as well as the nuance of the question, I would choose:\n\n2) Once a week"]}, {"persona": {"region": "Fayoum", "sex": "male", "age": 33, "country": "Egypt", "marital_status": "single", "education": "higher", "social_class": "working class"}, "question": {"id": "Q171", "variant": 0}, "response": ["Based on the anthropological framework, my answer to the question of how frequently I attend religious services would be influenced by several factors. Firstly, my cultural context as a single male from Fayoum, Egypt, would play a significant role in shaping my religious practices. Additionally, my individual values and personal experiences, as well as my socioeconomic background as a member of the working class, would also impact my answer. Furthermore, the nuanced phrasing of the question and the understanding of cultural relativism are crucial in providing an accurate response that aligns with the persona described above.\n\n6"]}, {"persona": {"region": "Fayoum", "sex": "male", "age": 32, "country": "Egypt", "marital_status": "married", "education": "higher", "social_class": "lower middle class"}, "question": {"id": "Q171", "variant": 0}, "response": ["Based on the anthropological framework, as a married male from Fayoum, Egypt, my cultural context and individual values are deeply rooted in the religious practices of my community. The socio-economic background also plays a significant role in shaping my religious observance. Given my lower middle-class status and the strong emphasis on community and tradition in Fayoum, attending religious services is an important part of my social and cultural identity. Additionally, my age and personal experiences have influenced my perception of religious practices. Therefore, my chosen answer is (2) Once a week."]}, {"persona": {"region": "Gharbia", "sex": "male", "age": 42, "country": "Egypt", "marital_status": "married", "education": "higher", "social_class": "upper middle class"}, "question": {"id": "Q171", "variant": 0}, "response": ["Based on the anthropological framework, as a married male from Gharbia, Egypt, cultural context and individual values play a significant role in my decision. Gharbia is known for its strong Islamic culture and as a member of the upper middle class, I am likely to have access to resources and time to attend religious services. Additionally, my age and higher education level may have instilled a sense of tradition and religious commitment in me. Therefore, I would choose option (2) Once a week as my frequency of attending religious services. \n\n2"]}, {"persona": {"region": "Gharbia", "sex": "male", "age": 52, "country": "Egypt", "marital_status": "married", "education": "middle", "social_class": "working class"}, "question": {"id": "Q171", "variant": 0}, "response": ["Based on the anthropological framework, my response to the question of how frequently I attend religious services is influenced by my cultural context, individual values, and socioeconomic background. Being from Gharbia, Egypt, which is a predominantly Muslim area, the cultural context plays a significant role in shaping my religious practices. Additionally, being a middle-aged, working-class male with a middle education level, my individual values and personal experience also factor into my religious practices. Considering these factors, I would choose option (2) Once a week, as regular attendance at religious services is a common practice in my cultural context and aligns with my personal values and experiences.\n\n2"]}, {"persona": {"region": "Gharbia", "sex": "male", "age": 45, "country": "Egypt", "marital_status": "divorced", "education": "higher", "social_class": "upper middle class"}, "question": {"id": "Q171", "variant": 0}, "response": ["Based on the anthropological framework, as a divorced male from Gharbia, Egypt, my emic perspective would be influenced by my cultural context, individual values and personal experience, and socioeconomic background. The cultural context in Gharbia emphasizes the importance of religious practices, and as a divorced male, I may feel a need to seek spiritual guidance and support. Additionally, my higher education level and upper middle class status may lead me to prioritize personal growth and self-improvement, which could include regular attendance at religious services to seek guidance and community support. Therefore, my chosen option is:\n\n(2) Once a week"]}, {"persona": {"region": "Behaira", "sex": "male", "age": 23, "country": "Egypt", "marital_status": "single", "education": "middle", "social_class": "lower class"}, "question": {"id": "Q171", "variant": 0}, "response": ["Based on the anthropological framework, my emic perspective as a single male from Behaira, Egypt, who is 23 years old and part of the lower class, is heavily influenced by my cultural context, individual values, and socioeconomic background. In Behaira, religion plays a significant role in daily life, and attending religious services is a common practice, especially among those from lower socioeconomic backgrounds. My personal experience and values also align with the importance of religious observance. Additionally, cultural relativism and nuance are crucial to consider, as my response may differ from someone of a different age or socioeconomic background. Therefore, my choice is:\n\n3"]}, {"persona": {"region": "Behaira", "sex": "male", "age": 38, "country": "Egypt", "marital_status": "single", "education": "higher", "social_class": "lower class"}, "question": {"id": "Q171", "variant": 0}, "response": ["Based on the anthropological framework, as a single male from Behaira, Egypt, my cultural context and socioeconomic background play a significant role in my religious practices. In Behaira, religion is deeply embedded in the cultural context, and as a member of the lower class, my access to and frequency of attendance at religious services may be influenced by economic factors. Additionally, my individual values and personal experiences may also impact my religious practices. Considering the nuanced phrasing of the question, I believe the most accurate answer from my perspective would be option (3) Once a month. \n\n3"]}, {"persona": {"region": "Behaira", "sex": "male", "age": 32, "country": "Egypt", "marital_status": "married", "education": "middle", "social_class": "lower class"}, "question": {"id": "Q171", "variant": 0}, "response": ["Based on the anthropological framework, as a married male from Behaira, Egypt, with a lower socioeconomic background and a middle education level, my cultural context and personal experience greatly influence my religious practices. In Egypt, religion plays a significant role in society, and attending religious services is a common practice. As a member of the lower class, I may have fewer opportunities to attend religious services due to work or financial constraints. Additionally, my personal values and individual experiences may lead me to prioritize other responsibilities over religious attendance. Therefore, I would choose option 6: Less often. \n\n6"]}, {"persona": {"region": "Behaira", "sex": "female", "age": 37, "country": "Egypt", "marital_status": "married", "education": "middle", "social_class": "working class"}, "question": {"id": "Q171", "variant": 0}, "response": ["Based on my emic perspective as a married female from Behaira, Egypt, my cultural context and personal experience play a significant role in my answer to this question. In my community, religious practices are deeply ingrained and attending religious services is a regular part of our social and spiritual life. My socioeconomic background as part of the working class also influences my answer, as I may have limited time and resources to attend religious services frequently. Additionally, age and place are important factors, and as a 37-year-old woman living in Behaira, I may have different priorities and responsibilities compared to someone from a different age group or location. Taking all these factors into consideration, my answer would be (3) Once a month.\n\n3"]}, {"persona": {"region": "Behaira", "sex": "male", "age": 48, "country": "Egypt", "marital_status": "married", "education": "middle", "social_class": "working class"}, "question": {"id": "Q171", "variant": 0}, "response": ["From the anthropological perspective, my answer to the question of how frequently I attend religious services is influenced by several factors. Firstly, my cultural context as a married male from Behaira, Egypt, means that religion plays a significant role in my life and social interactions. Additionally, my socioeconomic background as a working-class individual and my age of 48 years means that I have likely been brought up in a religious environment and continue to prioritize religious practices in my daily life. Furthermore, the cultural relativism of my society means that attending religious services is not only a personal choice but also a social and communal obligation. Therefore, based on these factors, I choose option (2) Once a week.\n\n2"]}, {"persona": {"region": "Behaira", "sex": "female", "age": 34, "country": "Egypt", "marital_status": "married", "education": "middle", "social_class": "lower class"}, "question": {"id": "Q171", "variant": 0}, "response": ["Based on the anthropological framework, as a married female from Behaira, Egypt, my emic perspective is heavily influenced by my cultural context, individual values, and socioeconomic background. In Behaira, religion plays a significant role in daily life, and as a lower-class woman with limited education, my personal experience and values are shaped by the importance of religious practice within my community. Socioeconomic background also plays a role, as attending religious services is a way for me to find solace and connection within my community. Additionally, the nuance of the question is important to consider, as my response will be influenced by the phrasing of the question and my understanding of religious practice within my cultural context.\n\n6"]}, {"persona": {"region": "Behaira", "sex": "female", "age": 30, "country": "Egypt", "marital_status": "divorced", "education": "lower", "social_class": "lower class"}, "question": {"id": "Q171", "variant": 0}, "response": ["Based on my cultural context and socioeconomic background, as a divorced female from Behaira, Egypt, I have been raised in a community where religious practices and attending religious services are highly valued. My lower education level has limited my access to higher paying jobs, and as part of the lower class, I have limited resources and opportunities for social mobility. Therefore, attending religious services provides me with a sense of community and support that I may not have access to elsewhere. Additionally, my personal experience and values have also shaped my understanding of the importance of religious services in terms of finding solace and connection with others. Therefore, I choose option (2) Once a week. \n\n2"]}, {"persona": {"region": "Behaira", "sex": "male", "age": 40, "country": "Egypt", "marital_status": "married", "education": "higher", "social_class": "lower middle class"}, "question": {"id": "Q171", "variant": 0}, "response": ["Based on the anthropological framework, as a married male from Behaira, Egypt, my emic perspective on attending religious services is influenced by my cultural context, individual values, and socioeconomic background. In Egypt, religion plays a significant role in people's lives, and it is common for individuals to attend religious services regularly. However, as someone from the lower middle class, my socioeconomic background may limit my ability to attend religious services more frequently due to time and financial constraints. Additionally, my personal experiences and values may also play a role in shaping my religious practices. Considering these factors, I would choose option (3) Once a month, as it aligns with my cultural context and individual circumstances.\n\n3"]}, {"persona": {"region": "Behaira", "sex": "male", "age": 38, "country": "Egypt", "marital_status": "married", "education": "middle", "social_class": "working class"}, "question": {"id": "Q171", "variant": 0}, "response": ["Based on the anthropological framework described, as a married male from Behaira, Egypt, cultural context and individual values play a significant role in determining the frequency of religious service attendance. Being from a region with a strong religious tradition and a predominantly Muslim population, the cultural context is pivotal in shaping one's religious practices. Additionally, as a working-class individual with a middle education level, socioeconomic background is also a factor to consider. Moreover, age and place, as well as personal experience and individual values, will also influence one's religious practices. Considering these factors, the persona described above would likely attend religious services once a week.\n\n2"]}, {"persona": {"region": "Behaira", "sex": "female", "age": 30, "country": "Egypt", "marital_status": "married", "education": "higher", "social_class": "lower class"}, "question": {"id": "Q171", "variant": 0}, "response": ["Based on the anthropological framework, my emic perspective as a married female from Behaira, Egypt, would be influenced by my cultural context, individual values, and socioeconomic background. In Behaira, religious practices are a significant part of our daily lives and are deeply ingrained in our cultural context. As a lower-class woman who has completed higher education, I have been taught to value and prioritize religious teachings and practices. Additionally, my socioeconomic background and the close-knit community I belong to place a high value on religious attendance. Therefore, my answer to the question of how frequently I attend religious services would be (2) Once a week. This is a reflection of my cultural context and the values instilled in me as a member of this community."]}, {"persona": {"region": "Behaira", "sex": "female", "age": 35, "country": "Egypt", "marital_status": "married", "education": "middle", "social_class": "working class"}, "question": {"id": "Q171", "variant": 0}, "response": ["Based on the anthropological framework, as a married female from Behaira, Egypt, my emic perspective would be heavily influenced by the cultural context of my community, where religion plays a significant role in daily life. Additionally, as a working-class individual, my socioeconomic background would also play a role in my religious practices. In Behaira, it is common for individuals to attend religious services once a week as it is a way to connect with the community and uphold traditional values. Furthermore, my personal experiences and values would also lead me to prioritize regular attendance at religious services. Therefore, I would choose option (2) Once a week.\n\n2"]}, {"persona": {"region": "Behaira", "sex": "male", "age": 52, "country": "Egypt", "marital_status": "married", "education": "middle", "social_class": "lower class"}, "question": {"id": "Q171", "variant": 0}, "response": ["Based on the anthropological framework, as a married male from Behaira, Egypt, my emic perspective is heavily influenced by my cultural context, individual values, and socioeconomic background. In Behaira, religious practices are an integral part of our cultural context, and as a lower class individual, I find solace and community in attending religious services. Additionally, my age and place further emphasize the importance of religious gatherings as a means of social interaction and support. Therefore, I choose option (2) Once a week. \n\n2"]}, {"persona": {"region": "Alexandria", "sex": "female", "age": 41, "country": "Egypt", "marital_status": "single", "education": "middle", "social_class": "lower class"}, "question": {"id": "Q171", "variant": 0}, "response": ["Based on the anthropological framework, as a single woman from Alexandria, Egypt, my emic perspective is influenced by my cultural context, individual values and personal experience, and socioeconomic background. In my cultural context, religion is an integral part of daily life and societal expectations. As a woman from a lower class background, I have limited access to resources and opportunities, and religion serves as a source of comfort and community. My personal experience has also shaped my religious practice, as I have faced various challenges and rely on religious faith for support. Therefore, my answer to the question is:\n3\n\n(3) Once a month"]}, {"persona": {"region": "Alexandria", "sex": "female", "age": 21, "country": "Egypt", "marital_status": "single", "education": "middle", "social_class": "lower class"}, "question": {"id": "Q171", "variant": 0}, "response": ["Based on the anthropological framework, as a single female from Alexandria, Egypt, with a lower socioeconomic background and completed middle education level, my perspective on attending religious services is deeply influenced by my cultural context, individual values, and personal experience. In my community, religion plays a significant role in daily life, and attending religious services is an important way to connect with my community and faith. Additionally, my lower socioeconomic status means that I may find solace and community support through religious gatherings. Therefore, I would choose option (2) Once a week as my frequency of attending religious services. \n\n2"]}, {"persona": {"region": "Alexandria", "sex": "female", "age": 35, "country": "Egypt", "marital_status": "married", "education": "middle", "social_class": "lower class"}, "question": {"id": "Q171", "variant": 0}, "response": ["Based on my emic perspective as a married female from Alexandria, Egypt, my attendance at religious services is influenced by the cultural context of my community, where religious practices and beliefs hold significant importance. Additionally, my individual values and personal experiences have shaped my perception of religious services, as I have been taught from a young age to prioritize religious practices and have found comfort and guidance in attending services. Moreover, my lower socioeconomic background has limited my educational and economic opportunities, leading me to seek solace and community support through religious gatherings. Therefore, based on my nuanced understanding of the question, I choose:\n\n4"]}, {"persona": {"region": "Alexandria", "sex": "male", "age": 34, "country": "Egypt", "marital_status": "married", "education": "higher", "social_class": "working class"}, "question": {"id": "Q171", "variant": 0}, "response": ["Based on the anthropological framework, my perspective is heavily influenced by my cultural context as a married male from Alexandria, Egypt. My religious beliefs and practices are shaped by the cultural and religious context of my community, as well as my individual values and personal experiences. As a member of the working class, my socioeconomic background also plays a significant role in my religious practices. Additionally, the nuance of the question is important, as the frequency of religious service attendance may vary depending on the specific religious denomination or tradition. Taking all of these factors into consideration, I choose option (3) Once a month. \n\n3"]}, {"persona": {"region": "Alexandria", "sex": "female", "age": 37, "country": "Egypt", "marital_status": "married", "education": "higher", "social_class": "lower middle class"}, "question": {"id": "Q171", "variant": 0}, "response": ["Based on the anthropological framework described above, my perspective as a married female from Alexandria, Egypt, aged 37 and part of the lower middle class, is heavily influenced by my cultural context, individual values, and socioeconomic background. In Egypt, religion plays a significant role in everyday life, and as a member of the lower middle class, I value and prioritize religious practices. Additionally, my personal experience and upbringing in a predominantly Muslim community have instilled in me the importance of attending religious services as a way to connect with my community and maintain my spiritual well-being.\n\n6"]}, {"persona": {"region": "Alexandria", "sex": "female", "age": 56, "country": "Egypt", "marital_status": "divorced", "education": "middle", "social_class": "working class"}, "question": {"id": "Q171", "variant": 0}, "response": ["Based on the anthropological framework, as a divorced female from Alexandria, Egypt, my emic perspective involves my own personal experiences and values, which have been shaped by the cultural context of the city. The cultural relativism in Alexandria allows for a diverse range of beliefs and practices, and my socioeconomic background as part of the working class also influences my answer. Additionally, my age and space-time location in Alexandria play a role in my religious practices. Therefore, I choose the following option based on my perspective:\n(4) Only on special holy days"]}, {"persona": {"region": "Alexandria", "sex": "male", "age": 48, "country": "Egypt", "marital_status": "married", "education": "higher", "social_class": "working class"}, "question": {"id": "Q171", "variant": 0}, "response": ["Based on my cultural context as a married male from Alexandria, Egypt, attending religious services is a significant part of my life. The cultural and religious context of Egypt, as well as my personal values and experiences, influence my answer to this question. Additionally, my socioeconomic background as a working-class individual also plays a role in my religious practices. My age and place also contribute to the frequency of my attendance at religious services. Therefore, my answer reflects my nuanced understanding and personal experience within this cultural framework.\n\n5"]}, {"persona": {"region": "Alexandria", "sex": "female", "age": 30, "country": "Egypt", "marital_status": "married", "education": "middle", "social_class": "working class"}, "question": {"id": "Q171", "variant": 0}, "response": ["Based on the anthropological framework, my response to the question of how frequently I attend religious services is influenced by my cultural context, individual values, socioeconomic background, and space and time. As a married female from Alexandria, Egypt, I am likely to be part of a community where religious practices and attendance at religious services are important. The cultural context and societal expectations may lead me to attend religious services more frequently, such as once a week or more, to maintain social connections and fulfill my religious duties. Additionally, my socioeconomic background as part of the working class may also play a role, as religious participation can serve as a way to find support and community. Furthermore, the space and time factor of being 30 years old in this context may mean that I am at a stage in my life where religious observance is particularly significant. Therefore, my choice of response to the question is:\n\n2) Once a week"]}, {"persona": {"region": "Alexandria", "sex": "male", "age": 19, "country": "Egypt", "marital_status": "single", "education": "middle", "social_class": "lower class"}, "question": {"id": "Q171", "variant": 0}, "response": ["Based on the anthropological framework, as a single male from Alexandria, Egypt, with a middle education level and part of the lower class, my emic perspective is heavily influenced by the cultural context of my community, which places a strong emphasis on religious practices. Additionally, my individual values and personal experience have shaped my understanding of the importance of religious services in my life. Socioeconomic background also plays a significant role, as my lower class status may limit my ability to attend religious services frequently. Furthermore, the concept of cultural relativism emphasizes that there is no hierarchy of culture, and the nuanced phrasing of the question is crucial in understanding my perspective. Therefore, my answer is:\n\n6) Less often"]}, {"persona": {"region": "Alexandria", "sex": "male", "age": 45, "country": "Egypt", "marital_status": "married", "education": "middle", "social_class": "lower middle class"}, "question": {"id": "Q171", "variant": 0}, "response": ["Based on the anthropological framework, as a married male from Alexandria, Egypt, my emic perspective on attending religious services is heavily influenced by my cultural context, individual values, and personal experience. Living in a predominantly Muslim country, the cultural context dictates a strong emphasis on religious observance. Additionally, my personal experience and individual values, shaped by my upbringing and social environment, lead me to prioritize religious attendance as a way to connect with my community and seek spiritual fulfillment. As a member of the lower middle class, I understand the importance of faith and community support, especially in times of financial struggle. Therefore, I would choose option (2) Once a week to attend religious services as it aligns with my cultural and personal beliefs.\n\n2"]}, {"persona": {"region": "Alexandria", "sex": "male", "age": 23, "country": "Egypt", "marital_status": "single", "education": "higher", "social_class": "lower class"}, "question": {"id": "Q171", "variant": 0}, "response": ["Based on the anthropological framework, my emic perspective as a lower-class single male from Alexandria, Egypt, heavily influences my religious practices. The cultural context of Alexandria emphasizes the importance of religious services, and my individual values and personal experiences have shaped my belief in the importance of attending religious services. Additionally, my socioeconomic background has limited my access to other forms of social interaction, making religious services a key part of my social life. Finally, the nuance of the question leads me to choose option (2) Once a week as my answer, as it aligns with the frequency of religious services I attend given my cultural, personal, and socioeconomic context. \n\n2"]}, {"persona": {"region": "Alexandria", "sex": "female", "age": 28, "country": "Egypt", "marital_status": "married", "education": "middle", "social_class": "working class"}, "question": {"id": "Q171", "variant": 0}, "response": ["Based on the anthropological framework, as a married female from Alexandria, Egypt, who is part of the working class and has completed middle education level, my answer to the question of how frequently I attend religious services will be influenced by my cultural context, individual values, and socioeconomic background. In Alexandria, religion plays a significant role in daily life, and as a member of the working class, I may find solace and community in attending religious services. Additionally, my personal experience and values may lead me to prioritize religious attendance as a form of spiritual fulfillment and social connection. Therefore, my answer is:\n5. Once a year"]}, {"persona": {"region": "Alexandria", "sex": "male", "age": 34, "country": "Egypt", "marital_status": "single", "education": "higher", "social_class": "working class"}, "question": {"id": "Q171", "variant": 0}, "response": ["Based on the anthropological framework, as a single male from Alexandria, Egypt, my emic perspective is heavily influenced by the cultural context of the region, which places a strong emphasis on religious practices and rituals. Additionally, my individual values and personal experience, along with my socioeconomic background as a working-class individual, contribute to my understanding of the importance of religion in my life. Furthermore, the nuance of the question is crucial, as it is not simply a matter of frequency, but also of the significance of religious services in my cultural and personal context.\n\n4"]}, {"persona": {"region": "Alexandria", "sex": "male", "age": 30, "country": "Egypt", "marital_status": "married", "education": "higher", "social_class": "lower middle class"}, "question": {"id": "Q171", "variant": 0}, "response": ["Based on my individual values and personal experience, as well as my cultural context, I would answer this question based on my socioeconomic background and the cultural relativism of the society I come from. As a married male from Alexandria, Egypt, I am influenced by the cultural context of being part of a society where religion plays a significant role in daily life. Additionally, my lower middle class status may also influence my perception of religion and the frequency of attending religious services. Considering all these factors, I would answer the question as follows:\n\n3\n\n(3) Once a month"]}, {"persona": {"region": "Alexandria", "sex": "female", "age": 49, "country": "Egypt", "marital_status": "married", "education": "higher", "social_class": "lower middle class"}, "question": {"id": "Q171", "variant": 0}, "response": ["Based on the anthropological framework, my emic perspective as a married woman from Alexandria, Egypt, is heavily influenced by the cultural context of my religious upbringing and the significance of religion in my community. As a member of the lower middle class, my socioeconomic background also plays a role in shaping my values and personal experiences. In addition, my age and education level contribute to my nuanced understanding of the role of religion in my life. Therefore, I select the following option:\n\n(4) Only on special holy days"]}, {"persona": {"region": "Kafr el-sheikh", "sex": "male", "age": 49, "country": "Egypt", "marital_status": "married", "education": "higher", "social_class": "working class"}, "question": {"id": "Q171", "variant": 0}, "response": ["Based on the anthropological framework, my answer to the question of how frequently I attend religious services would be influenced by my cultural context as a married male from Kafr el-sheikh, Egypt, where religious practices are deeply embedded in daily life. Additionally, my individual values and personal experiences as a 49-year-old with a higher education level and part of the working class would shape my approach to religious services. Furthermore, my socioeconomic background and the cultural relativism of my community would also play a crucial role in my decision. Considering these factors, I would choose option (2) Once a week. \n\n2"]}, {"persona": {"region": "Kafr el-sheikh", "sex": "male", "age": 25, "country": "Egypt", "marital_status": "single", "education": "middle", "social_class": "lower middle class"}, "question": {"id": "Q171", "variant": 0}, "response": ["Based on the anthropological framework, as a single male from Kafr el-sheikh, Egypt, age 25, and part of the lower middle class, my answer to the question of how frequently I attend religious services will be heavily influenced by my cultural context and individual values. In the Egyptian context, religion plays a significant role in daily life and societal expectations. Additionally, my socioeconomic background as part of the lower middle class may also impact my level of religious observance. Given these factors, I would choose the option that aligns with regular religious attendance, reflecting the cultural and societal norms of my community and my own personal values.\n\n2"]}, {"persona": {"region": "Kafr el-sheikh", "sex": "male", "age": 59, "country": "Egypt", "marital_status": "married", "education": "higher", "social_class": "lower middle class"}, "question": {"id": "Q171", "variant": 0}, "response": ["Based on the anthropological framework, as a married male from Kafr el-sheikh, Egypt, my emic perspective is influenced by the cultural context of the region, where religion plays a significant role in daily life. My personal experience and individual values also shape my perception, as higher education and being part of the lower middle class have provided me with an understanding of the importance of religious practice for community cohesion and personal fulfillment. Additionally, my socioeconomic background and age also play a role, as I am at a stage in life where religious services hold particular significance for me. Therefore, my chosen answer is:\n6"]}, {"persona": {"region": "Kafr el-sheikh", "sex": "female", "age": 38, "country": "Egypt", "marital_status": "married", "education": "middle", "social_class": "working class"}, "question": {"id": "Q171", "variant": 0}, "response": ["Based on the anthropological framework, my cultural context as a married female from Kafr el-sheikh, Egypt, and my age and socioeconomic background are pivotal in understanding my answer to the question. In this region, religion plays a significant role in daily life and societal norms, and as a working-class woman, my access to religious services may be more limited due to time constraints and financial limitations. Additionally, my personal experience and individual values also play a role in my perception of religious services. Therefore, my response to the question is based on a combination of these factors.\n\n3"]}, {"persona": {"region": "Kafr el-sheikh", "sex": "male", "age": 35, "country": "Egypt", "marital_status": "married", "education": "higher", "social_class": "lower middle class"}, "question": {"id": "Q171", "variant": 0}, "response": ["Based on the anthropological framework, my personal experience and individual values as a married male from Kafr el-sheikh, Egypt, who is 35 years old and part of the lower middle class, greatly influence my perception and understanding of religious practices. In the cultural context of Egypt, religion plays a significant role in the lives of individuals, and socioeconomic background also plays a role in shaping religious practices. Additionally, space and time, as well as nuance, are important factors to consider. Given these considerations, I would choose the option:\n\n(2) Once a week"]}, {"persona": {"region": "Kafr el-sheikh", "sex": "male", "age": 49, "country": "Egypt", "marital_status": "married", "education": "middle", "social_class": "lower class"}, "question": {"id": "Q171", "variant": 0}, "response": ["Based on my cultural context and socioeconomic background, as a married male from Kafr el-sheikh, Egypt, I come from a community where religious practices and attendance at religious services are highly valued. The cultural context and social expectations in my area emphasize the importance of religious observance, and my lower class status also means that community and religious activities play a significant role in providing social support and a sense of belonging. Additionally, my personal experience and values have been shaped by this cultural context, leading me to prioritize religious attendance as a way to connect with my community and seek spiritual guidance. Therefore, I would choose option (2) Once a week.\n\n2"]}, {"persona": {"region": "Kafr el-sheikh", "sex": "male", "age": 37, "country": "Egypt", "marital_status": "married", "education": "middle", "social_class": "lower class"}, "question": {"id": "Q171", "variant": 0}, "response": ["Based on my emic perspective, as a married male from Kafr el-sheikh, Egypt, religion is a central aspect of my cultural context and personal experience. My socioeconomic background as part of the lower class also shapes my values and influences my regular activities. Given the importance of religion in my community and the significance of religious gatherings for social cohesion, I would attend religious services once a week in order to maintain my connections with my community and uphold my personal values.\n\n2"]}, {"persona": {"region": "Menofia", "sex": "female", "age": 22, "country": "Egypt", "marital_status": "single", "education": "middle", "social_class": "lower class"}, "question": {"id": "Q171", "variant": 0}, "response": ["Based on the anthropological framework, as a single female from Menofia, Egypt, I am deeply embedded in the cultural context of my community, where religion plays a significant role in daily life. My lower socioeconomic background also influences my values and personal experiences, as I have limited access to resources and opportunities. Additionally, my age and gender play a role in shaping my perspective on religious practices. Given these factors, I would choose option 2: Once a week. \n\n2"]}, {"persona": {"region": "Menofia", "sex": "female", "age": 25, "country": "Egypt", "marital_status": "married", "education": "middle", "social_class": "lower class"}, "question": {"id": "Q171", "variant": 0}, "response": ["Based on the anthropological framework, as a married female from Menofia, Egypt, with a lower socioeconomic background, my cultural context emphasizes the importance of religious practices and attendance. In this context, religious services are a significant part of community and social life, and attendance is influenced by cultural norms and values. As an individual, my personal experience and values also play a role in my religious practices. Additionally, the nuanced phrasing of the question is important, as it can affect how I interpret and respond to it. Therefore, considering all these factors, my answer is:\n\n2) Once a week"]}, {"persona": {"region": "Menofia", "sex": "male", "age": 28, "country": "Egypt", "marital_status": "single", "education": "higher", "social_class": "working class"}, "question": {"id": "Q171", "variant": 0}, "response": ["Based on the anthropological framework, as a single male from Menofia, Egypt, my emic perspective is influenced by the cultural context of being part of a predominantly Muslim society. The socioeconomic background of belonging to the working class also plays a role in my personal experience and values, as I may prioritize work and financial stability. Additionally, age and place are important factors, as being 28 years old may mean that I am more independent and less likely to attend religious services frequently. Therefore, from this perspective, I would choose option (6) Less often."]}, {"persona": {"region": "Menofia", "sex": "male", "age": 35, "country": "Egypt", "marital_status": "married", "education": "middle", "social_class": "lower middle class"}, "question": {"id": "Q171", "variant": 0}, "response": ["Based on the anthropological framework, my cultural context as a married male from Menofia, Egypt, and my individual values and personal experience will greatly influence my frequency of attending religious services. In this region, religion plays a significant role in daily life, and the cultural context emphasizes the importance of religious practices. Additionally, my socioeconomic background as part of the lower middle class may also impact my decision, as it may influence my access to transportation and time off work for religious services. Furthermore, the nuance of the question is important - the wording \"religious services\" may have different interpretations in my cultural context. Ultimately, my answer is (2) Once a week."]}, {"persona": {"region": "Menofia", "sex": "male", "age": 55, "country": "Egypt", "marital_status": "married", "education": "middle", "social_class": "working class"}, "question": {"id": "Q171", "variant": 0}, "response": ["Based on the anthropological framework, as a married male from Menofia, Egypt, my emic perspective on attending religious services is influenced by my cultural context and personal experience. In Menofia, religion is deeply ingrained in our daily lives and plays a significant role in our social interactions and community cohesion. As a middle-aged working-class man, I am likely to have grown up in a religious household and have been taught the importance of regular attendance at religious services. Additionally, my age and socioeconomic background are also important factors, as they shape my values and perceptions of religious practice. Therefore, I choose option (2) Once a week, as it aligns with my cultural context and personal experience. \n\n2"]}, {"persona": {"region": "Menofia", "sex": "male", "age": 53, "country": "Egypt", "marital_status": "married", "education": "higher", "social_class": "lower middle class"}, "question": {"id": "Q171", "variant": 0}, "response": ["Based on my background and cultural context as a married male from Menofia, Egypt, I understand the importance of religious services in my community. As a member of the lower middle class, my socioeconomic background and individual values play a significant role in my religious practices. Additionally, the cultural context of Egypt emphasizes the significance of religious gatherings and the importance of community in these settings. Therefore, my personal experience and cultural relativism guide me to choose the option that best aligns with my background and beliefs.\n\n2"]}, {"persona": {"region": "Menofia", "sex": "male", "age": 59, "country": "Egypt", "marital_status": "married", "education": "middle", "social_class": "working class"}, "question": {"id": "Q171", "variant": 0}, "response": ["Based on my personal experience and cultural context, as a married male from Menofia, Egypt, who is 59 years of age and part of the working class, attending religious services is a significant part of my life. The cultural context in Menofia places a strong emphasis on religious practices, and my personal values and experience have reinforced the importance of regular attendance at religious services. Additionally, my socioeconomic background as part of the working class has also influenced my commitment to religious practices, as it provides a sense of community and support. Therefore, my answer is:\n\n(2) Once a week"]}, {"persona": {"region": "Menofia", "sex": "female", "age": 42, "country": "Egypt", "marital_status": "married", "education": "middle", "social_class": "lower middle class"}, "question": {"id": "Q171", "variant": 0}, "response": ["Based on the anthropological framework, as a married female from Menofia, Egypt, my cultural context and kinship networks place a significant emphasis on religious practices. My lower middle class socioeconomic background also means that attending religious services is a common and important activity for me and my community. Additionally, my personal experience and individual values have shaped my perception of religious services, and as a 42-year-old woman with middle education level, I have been taught the significance of regular attendance at religious services for spiritual guidance and community bonding. Therefore, my choice is:\n\n(2) Once a week"]}, {"persona": {"region": "Menofia", "sex": "male", "age": 39, "country": "Egypt", "marital_status": "married", "education": "higher", "social_class": "working class"}, "question": {"id": "Q171", "variant": 0}, "response": ["Based on the anthropological framework, my answer to the question of how frequently I attend religious services is influenced by my cultural context as a married male from Menofia, Egypt. The cultural norms and values in my community place a strong emphasis on religious practice, and attending religious services is considered a regular part of life. Additionally, my individual values and personal experience also play a role in my decision, as I was raised in a family that prioritized religious observance. Furthermore, as a member of the working class, I have limited time and resources, which may affect my ability to attend religious services frequently. Finally, the nuance of the question also influences my answer, as the frequency of religious service attendance may vary based on specific circumstances and events within the religious calendar.\n\n4"]}, {"persona": {"region": "Menofia", "sex": "male", "age": 34, "country": "Egypt", "marital_status": "married", "education": "middle", "social_class": "lower middle class"}, "question": {"id": "Q171", "variant": 0}, "response": ["In Menofia, Egypt, the cultural context and individual values play a significant role in determining the frequency of religious service attendance. As a married male from this region, my upbringing and personal experience have instilled in me the importance of religious practice and community involvement. Additionally, my lower middle-class socioeconomic background has allowed me to have the time and means to prioritize attending religious services, as it is an important aspect of my cultural identity. Furthermore, the nuance of the question allows for a range of options, but I would choose to attend religious services more than once a week to demonstrate my commitment to my faith and community.\n\n2"]}, {"persona": {"region": "Menofia", "sex": "male", "age": 22, "country": "Egypt", "marital_status": "single", "education": "higher", "social_class": "working class"}, "question": {"id": "Q171", "variant": 0}, "response": ["Based on the anthropological framework, as a single male from Menofia, Egypt, my emic perspective is influenced by the cultural context of being in a predominantly Islamic society where religious practices are deeply ingrained in everyday life. My individual values and personal experience, as well as my socioeconomic background as a working-class individual, also play a role in my religious practices. Additionally, the space and time in which I exist as a 22-year-old with a higher education level further shapes my perspective. Considering the nuanced phrasing of the question, I would choose the option that aligns with my perception of religious attendance.\n\n4"]}, {"persona": {"region": "Menofia", "sex": "male", "age": 21, "country": "Egypt", "marital_status": "single", "education": "middle", "social_class": "working class"}, "question": {"id": "Q171", "variant": 0}, "response": ["Based on the anthropological framework, as a single male from Menofia, Egypt, my emic perspective is heavily influenced by the cultural context of my community, where religion plays a significant role in daily life. My personal experience and individual values also shape my perception of religious services. Additionally, my socioeconomic background as a working-class individual impacts my access to religious services and my ability to attend them regularly. Considering the nuanced phrasing of the question, I would choose the following option:\n\n6"]}, {"persona": {"region": "Menofia", "sex": "male", "age": 36, "country": "Egypt", "marital_status": "married", "education": "higher", "social_class": "working class"}, "question": {"id": "Q171", "variant": 0}, "response": ["Based on the anthropological framework, my answer to the question of how frequently I attend religious services is influenced by my emic perspective as a married male from Menofia, Egypt. The cultural context of Menofia is predominantly Islamic, with a strong emphasis on religious practices and beliefs. Additionally, my individual values and personal experiences as a member of the working class have shaped my religious beliefs and practices. In Menofia, it is common for individuals to attend religious services once a week, and this aligns with my own religious beliefs and practices. Furthermore, the socioeconomic background and cultural relativism in Menofia play a significant role in the frequency of religious attendance. Therefore, I choose option (2) Once a week.\n\n2"]}, {"persona": {"region": "Menofia", "sex": "female", "age": 52, "country": "Egypt", "marital_status": "married", "education": "higher", "social_class": "lower middle class"}, "question": {"id": "Q171", "variant": 0}, "response": ["Based on the anthropological framework, as a married female from Menofia, Egypt, my cultural context heavily influences my religious practices. Menofia is a region with a strong Islamic tradition, and as a member of the lower middle class, I have been brought up to prioritize religious observance and participation. Additionally, my age and education level have further reinforced the importance of religious services in my life. Therefore, my answer to the question of how frequently I attend religious services would be \"Once a week\" (2)."]}, {"persona": {"region": "Menofia", "sex": "male", "age": 52, "country": "Egypt", "marital_status": "married", "education": "higher", "social_class": "lower middle class"}, "question": {"id": "Q171", "variant": 0}, "response": ["Based on the anthropological framework, as a married male from Menofia, Egypt, I would have been raised in a cultural context where religion plays a significant role in shaping daily life and social interactions. My socioeconomic background as part of the lower middle class would also influence my religious practices, as individuals from this class may seek solace and community in religious gatherings. Additionally, my age and higher education level may have exposed me to various perspectives on religion, leading me to value the communal aspects of religious services. Therefore, I would choose option (2) Once a week.\n2"]}, {"persona": {"region": "Menofia", "sex": "male", "age": 39, "country": "Egypt", "marital_status": "married", "education": "middle", "social_class": "lower class"}, "question": {"id": "Q171", "variant": 0}, "response": ["Based on my cultural context and socioeconomic background, attending religious services is an important part of my life. In Menofia, Egypt, religion plays a significant role in our community and is intertwined with our daily lives. As a lower-class individual, I find solace and community in attending religious services, and it is a way for me to connect with my neighbors and find support. Additionally, my personal experience and values lead me to prioritize attending religious services as a way to seek guidance and spiritual fulfillment in my life.\n\n2"]}, {"persona": {"region": "Menofia", "sex": "male", "age": 23, "country": "Egypt", "marital_status": "single", "education": "middle", "social_class": "lower middle class"}, "question": {"id": "Q171", "variant": 0}, "response": ["Based on the anthropological framework, my emic perspective as a person from Menofia, Egypt, means that my in-group way of thinking about religious services is deeply influenced by my cultural context. In Menofia, religion plays a significant role in the daily lives of people, and it is deeply embedded in our cultural practices and traditions. Additionally, my individual values and personal experiences have shaped my understanding of religion, as I have been brought up in a society where attending religious services is a common practice. Furthermore, my socioeconomic background as a lower middle class individual has also influenced my perception of religion, as it is often seen as a source of strength and community support. Considering these factors, I would choose the option \"Once a week\" to attend religious services.\n\n2"]}, {"persona": {"region": "Dakahlia", "sex": "female", "age": 24, "country": "Egypt", "marital_status": "single", "education": "higher", "social_class": "lower middle class"}, "question": {"id": "Q171", "variant": 0}, "response": ["Based on my personal experience and cultural context as a single female from Dakahlia, Egypt, religion plays a significant role in my life. My socioeconomic background and educational level have influenced my values and beliefs, and I consider myself a religious person. I understand the importance of attending religious services and the impact it has on my community and personal spirituality. Therefore, my answer to the question would be:\n\n2) Once a week"]}, {"persona": {"region": "Dakahlia", "sex": "male", "age": 36, "country": "Egypt", "marital_status": "married", "education": "higher", "social_class": "upper middle class"}, "question": {"id": "Q171", "variant": 0}, "response": ["Based on the anthropological framework, as a married male from Dakahlia, Egypt, my emic perspective on attending religious services is influenced by my cultural context, individual values and personal experience, and socioeconomic background. In Dakahlia, religion plays a significant role in the community, and as a member of the upper middle class with a higher education level, I am likely to have been raised in a religious household and place importance on attending religious services. Additionally, my age and status as a married male may also contribute to a sense of responsibility to participate in religious activities. Therefore, my chosen option is (2) Once a week."]}, {"persona": {"region": "Dakahlia", "sex": "female", "age": 71, "country": "Egypt", "marital_status": "married", "education": "higher", "social_class": "upper middle class"}, "question": {"id": "Q171", "variant": 0}, "response": ["Based on the anthropological framework, my emic perspective as a married female from Dakahlia, Egypt, at the age of 71 and belonging to the upper middle class, is heavily influenced by my cultural context, individual values, and personal experiences. In my cultural context, religion plays a significant role in our daily lives and is deeply ingrained in our societal norms. My personal experience and values have also led me to prioritize religious services as a means of spiritual fulfillment and community connection. Additionally, my socioeconomic background allows me the time and resources to dedicate to attending religious services. Therefore, my answer is:\n\n2) Once a week"]}, {"persona": {"region": "Dakahlia", "sex": "male", "age": 55, "country": "Egypt", "marital_status": "married", "education": "higher", "social_class": "upper middle class"}, "question": {"id": "Q171", "variant": 0}, "response": ["Based on the anthropological framework, my emic perspective as a married male from Dakahlia, Egypt, who is 55 years old and part of the upper middle class, is heavily influenced by my cultural context, individual values, and personal experiences. In Dakahlia, religious practices are deeply ingrained in the social fabric, and as a member of the upper middle class, there is a social expectation to attend religious services regularly to maintain social status and connections within the community. Additionally, my personal values and experiences have been shaped by a lifetime of exposure to religious teachings and traditions, further reinforcing the importance of regular religious attendance in my life. Therefore, my response to the question of how frequently I attend religious services is as follows:\n\n2\n\n(2) Once a week"]}, {"persona": {"region": "Dakahlia", "sex": "male", "age": 64, "country": "Egypt", "marital_status": "married", "education": "higher", "social_class": "lower middle class"}, "question": {"id": "Q171", "variant": 0}, "response": ["Based on the anthropological framework, my answer to the question of how frequently I attend religious services is shaped by multiple factors. Firstly, my cultural context as a married male from Dakahlia, Egypt, where religion plays a significant role in daily life, would influence my answer. Additionally, my age and higher education level might lead me to view religious services from a more nuanced perspective, considering the social and cultural implications. My lower middle-class socioeconomic background would also influence the frequency of my attendance, as financial constraints and access to transportation may limit my ability to attend religious services frequently. Furthermore, cultural relativism would lead me to recognize the diversity of beliefs and practices within my community, and my personal experience and values would ultimately shape my decision on how often I attend religious services.\n\n5"]}, {"persona": {"region": "Dakahlia", "sex": "female", "age": 29, "country": "Egypt", "marital_status": "married", "education": "middle", "social_class": "lower class"}, "question": {"id": "Q171", "variant": 0}, "response": ["In the Egyptian cultural context, religion plays a significant role in everyday life. As a married female from Dakahlia, Egypt, my socioeconomic background and cultural context heavily influence my religious practices. Being part of the lower class, I have limited resources and time, which impacts my ability to attend religious services frequently. Additionally, my age and marital status may also play a role in how often I attend these services. Considering these factors, I would choose the following option:\n6"]}, {"persona": {"region": "Dakahlia", "sex": "female", "age": 40, "country": "Egypt", "marital_status": "married", "education": "middle", "social_class": "upper middle class"}, "question": {"id": "Q171", "variant": 0}, "response": ["Based on the anthropological framework, my answer is influenced by my emic perspective as a married female from Dakahlia, Egypt, where religion plays a significant role in daily life. The cultural context of Egypt emphasizes the importance of religious practices and the societal expectation of attending religious services. Additionally, my individual values and personal experience as a member of the upper middle class have influenced my answer, as my socioeconomic background may afford me more opportunities to attend religious services. Furthermore, the nuance of the question leads me to choose the option (2) Once a week, as it aligns with the religious and cultural expectations in my community.\n\n2"]}, {"persona": {"region": "Dakahlia", "sex": "male", "age": 37, "country": "Egypt", "marital_status": "married", "education": "higher", "social_class": "lower middle class"}, "question": {"id": "Q171", "variant": 0}, "response": ["Based on the anthropological framework, as a married male from Dakahlia, Egypt, my religious practices are heavily influenced by my cultural context, individual values, and socioeconomic background. In Dakahlia, religion plays a significant role in daily life, and as a member of the lower middle class, I am likely to have strong ties to my community and religious institutions. Additionally, my age and education level also play a role in shaping my religious practices, as I may have been raised with a strong emphasis on religious observance due to my upbringing and educational experiences. Therefore, based on these factors, I would attend religious services more than once a week to maintain a strong connection to my community and religious beliefs.\n\n2"]}, {"persona": {"region": "Dakahlia", "sex": "female", "age": 45, "country": "Egypt", "marital_status": "married", "education": "middle", "social_class": "working class"}, "question": {"id": "Q171", "variant": 0}, "response": ["Based on the anthropological framework, my response is influenced by my cultural context as a married female from Dakahlia, Egypt. In this region, religious practices are deeply ingrained in the culture, and the community places a strong emphasis on attending religious services. My individual values and personal experience also play a role, as I was raised in a religious household where attending services was a regular part of life. Additionally, my socioeconomic background as part of the working class means that the community and social connections formed through religious services are important for me. Considering these factors, I would choose the following option:\n\n2) Once a week"]}, {"persona": {"region": "Dakahlia", "sex": "male", "age": 34, "country": "Egypt", "marital_status": "single", "education": "middle", "social_class": "lower middle class"}, "question": {"id": "Q171", "variant": 0}, "response": ["Based on the anthropological framework, my emic perspective as a single male from Dakahlia, Egypt, is heavily influenced by my cultural context, individual values, and socioeconomic background. In my community, religion plays a significant role in people's lives, and attending religious services is a common practice. As someone from the lower middle class with a middle education level, I have been brought up to value religious observance and to prioritize it in my life. Additionally, my personal experiences and values have instilled in me the importance of regular attendance at religious services as a way to connect with my community and maintain a sense of spiritual fulfillment. Therefore, my choice is:\n\n2) Once a week"]}, {"persona": {"region": "Dakahlia", "sex": "female", "age": 26, "country": "Egypt", "marital_status": "married", "education": "higher", "social_class": "upper middle class"}, "question": {"id": "Q171", "variant": 0}, "response": ["Based on the anthropological framework described above, as a married female from Dakahlia, Egypt, with a higher education level and considering myself part of the upper middle class, my perspective on attending religious services will be influenced by various factors. The cultural context in Dakahlia, Egypt, emphasizes the importance of religion and religious practices, and as a member of the upper middle class, I may feel a certain level of social and cultural pressure to attend religious services regularly. Additionally, my individual values and personal experiences may also play a role in shaping my answer, as my education and socioeconomic background may influence my level of religious devotion. Moreover, the nuanced phrasing of the question also impacts my response, as it does not account for the potential influence of familial or community expectations on my religious practices.\n\n3"]}, {"persona": {"region": "Dakahlia", "sex": "male", "age": 21, "country": "Egypt", "marital_status": "single", "education": "middle", "social_class": "upper middle class"}, "question": {"id": "Q171", "variant": 0}, "response": ["Based on the anthropological framework, my emic perspective as a single male from Dakahlia, Egypt, leads me to consider the cultural context and individual values as pivotal factors in my answer. In my community, religious attendance is highly valued and plays a significant role in social and cultural life. Additionally, my socioeconomic background as part of the upper middle class may also influence my answer, as this status may afford me more opportunities for leisure and personal fulfillment. Therefore, my answer is as follows:\n\n2\n\nOnce a week"]}, {"persona": {"region": "Dakahlia", "sex": "female", "age": 32, "country": "Egypt", "marital_status": "married", "education": "middle", "social_class": "working class"}, "question": {"id": "Q171", "variant": 0}, "response": ["From an emic perspective, individuals from Dakahlia, Egypt, tend to have a strong connection to their religious beliefs and often attend religious services as a way to connect with their community and strengthen their faith. The cultural context of Dakahlia emphasizes the importance of religious practices and rituals, making attendance at religious services a significant aspect of daily life. Additionally, the socioeconomic background of being part of the working class may also influence the frequency of attendance, as individuals may seek solace and support from their community through regular religious gatherings. Based on these factors, it is likely that the persona described above would choose option (2) Once a week. \n\n2"]}, {"persona": {"region": "Dakahlia", "sex": "female", "age": 35, "country": "Egypt", "marital_status": "married", "education": "middle", "social_class": "upper middle class"}, "question": {"id": "Q171", "variant": 0}, "response": ["Based on the anthropological framework, my answer is influenced by my cultural context as a married female from Dakahlia, Egypt. The cultural norms and values in my community place a strong emphasis on religious practices and attending religious services. Additionally, my socioeconomic background as part of the upper middle class may also influence my answer, as individuals in this social stratum may be more likely to adhere to traditional religious practices. Furthermore, my personal experience and individual values play a role in my decision, as I was raised in a household where regular attendance at religious services was expected and valued. Taking into account the nuanced phrasing of the question, I would choose option (2) Once a week, as it reflects the balance between the cultural, socioeconomic, and personal factors that shape my perspective.\n\n2"]}, {"persona": {"region": "Dakahlia", "sex": "male", "age": 33, "country": "Egypt", "marital_status": "married", "education": "middle", "social_class": "upper middle class"}, "question": {"id": "Q171", "variant": 0}, "response": ["From the perspective of a married male from Dakahlia, Egypt, with a middle education level and a self-identified upper middle class status, the answer to the question of how frequently religious services are attended would be influenced by a combination of cultural context, individual values, socioeconomic background, and space and time. In this specific cultural context, religion and religious practices are deeply ingrained in daily life and hold a significant role in societal norms and values. As a member of the upper middle class, there may be an expectation to attend religious services more frequently to maintain social standing and uphold traditional values. Additionally, the age of 33 may indicate a stage in life where religious observance becomes more significant, especially when considering family and community expectations. Therefore, the chosen answer reflects these considerations.\n\n6"]}, {"persona": {"region": "Dakahlia", "sex": "female", "age": 45, "country": "Egypt", "marital_status": "married", "education": "middle", "social_class": "upper middle class"}, "question": {"id": "Q171", "variant": 0}, "response": ["Based on the anthropological framework, my emic perspective as a married female from Dakahlia, Egypt, would be influenced by my cultural context, individual values, and personal experience. In my cultural context, religion plays a significant role in our daily lives and is deeply intertwined with our social and family networks. As a member of the upper middle class, I have the means to prioritize attending religious services and have likely been raised with a strong emphasis on religious observance. Additionally, my age and middle education level would have provided me with a strong foundation in religious teachings and practices. Considering all these factors, I would choose option (2) Once a week, as it aligns with my cultural and personal values and experiences.\n\n2"]}, {"persona": {"region": "Dakahlia", "sex": "male", "age": 30, "country": "Egypt", "marital_status": "married", "education": "middle", "social_class": "upper middle class"}, "question": {"id": "Q171", "variant": 0}, "response": ["Based on the anthropological framework, my answer to the question of how frequently I attend religious services is influenced by my cultural context, individual values, and socioeconomic background. As a married male from Dakahlia, Egypt, religion plays a significant role in my life and is deeply rooted in my cultural context. I come from a community where religious practices are valued and upheld, and my personal values align with the importance of attending religious services. Additionally, being part of the upper middle class, I have the means and time to prioritize religious attendance. Therefore, my answer is: \n\n2) Once a week"]}, {"persona": {"region": "Dakahlia", "sex": "female", "age": 63, "country": "Egypt", "marital_status": "married", "education": "higher", "social_class": "lower middle class"}, "question": {"id": "Q171", "variant": 0}, "response": ["Based on the anthropological framework, my answer to the question of how frequently I attend religious services is influenced by several factors. Firstly, my cultural context as a married female from Dakahlia, Egypt, where religion plays a significant role in daily life, will impact my answer. Additionally, my individual values and personal experiences, as well as my socioeconomic background as part of the lower middle class, will also play a role. Furthermore, the space and time factor, considering my age of 63 years, will influence my answer. Finally, the nuanced phrasing of the question will also play a part in my response, as it may be interpreted differently based on cultural and personal perspectives.\n\n3"]}, {"persona": {"region": "Dakahlia", "sex": "male", "age": 28, "country": "Egypt", "marital_status": "single", "education": "higher", "social_class": "upper middle class"}, "question": {"id": "Q171", "variant": 0}, "response": ["Based on the anthropological framework, my emic perspective as a single male from Dakahlia, Egypt, would be influenced by my cultural context, individual values, and socioeconomic background. In Egypt, religion plays a significant role in people's lives, and attending religious services is a common practice. As someone who is part of the upper middle class and has completed higher education, I would likely have been raised in a family that values religious observance and may have been taught the importance of regular attendance at religious services. Additionally, my age and place of residence in Dakahlia would also influence my views on religion and religious practices. Therefore, my chosen answer is option (2) Once a week. \n\n2"]}, {"persona": {"region": "Dakahlia", "sex": "female", "age": 24, "country": "Egypt", "marital_status": "married", "education": "higher", "social_class": "upper middle class"}, "question": {"id": "Q171", "variant": 0}, "response": ["From the perspective of a married female from Dakahlia, Egypt, cultural context plays a pivotal role in understanding and answering this question. The region of Dakahlia is known for its strong religious and cultural traditions, and as a member of the upper middle class, there is likely a strong emphasis on upholding these traditions. Additionally, being 24 years old and having completed higher education, there may be a balance between modern and traditional values, leading to a moderate frequency of attending religious services. Socioeconomic background also factors in, as individuals from this class may have more flexibility in their schedules to attend religious services. Additionally, the cultural relativism of the region and the nuance of the question will lead to a carefully considered response.\n\n6"]}, {"persona": {"region": "Dakahlia", "sex": "male", "age": 20, "country": "Egypt", "marital_status": "single", "education": "middle", "social_class": "upper middle class"}, "question": {"id": "Q171", "variant": 0}, "response": ["Based on my personal experience and cultural context, as a single male from Dakahlia, Egypt, I come from a community with a strong emphasis on religious practices and values. The cultural context and societal expectations place a significant emphasis on attending religious services regularly, and as a member of the upper middle class, I have the means and social standing to participate in religious activities. Additionally, my age and place in society also play a role, as young adults in my community are often encouraged to actively engage in religious practices. Therefore, I choose option (2) Once a week. \n\n2"]}, {"persona": {"region": "Dakahlia", "sex": "male", "age": 45, "country": "Egypt", "marital_status": "married", "education": "middle", "social_class": "upper middle class"}, "question": {"id": "Q171", "variant": 0}, "response": ["Based on the anthropological framework, my emic perspective as a married male from Dakahlia, Egypt, considers the cultural context and individual values as significant factors in determining the frequency of attending religious services. In my cultural context, religion plays a central role in daily life, and the societal expectation is to attend religious services regularly. However, my individual values and personal experience, along with my socioeconomic background as part of the upper middle class, lead me to prioritize other aspects of my life, such as work and family obligations. Therefore, I attend religious services less often as it aligns with my personal beliefs and socioeconomic status.\n\n6"]}, {"persona": {"region": "Dakahlia", "sex": "female", "age": 43, "country": "Egypt", "marital_status": "married", "education": "higher", "social_class": "upper middle class"}, "question": {"id": "Q171", "variant": 0}, "response": ["In considering the question of how frequently I attend religious services from the perspective of a married female from Dakahlia, Egypt, who is 43 years old, completed higher education, and considers herself part of the upper middle class, it is important to take into account the cultural context of Egypt, where religion plays a significant role in daily life. Additionally, my socioeconomic background and educational level may influence my level of religious involvement. My personal experience and individual values also play a role in shaping my religious practices. Therefore, based on these factors, I would choose option (3) Once a month as my frequency of attending religious services.\n\n3"]}, {"persona": {"region": "Dakahlia", "sex": "female", "age": 20, "country": "Egypt", "marital_status": "single", "education": "middle", "social_class": "upper middle class"}, "question": {"id": "Q171", "variant": 0}, "response": ["Based on the anthropological framework, my emic perspective as a single female from Dakahlia, Egypt, would be influenced by my cultural context, individual values, and socioeconomic background. Religion is an integral part of Egyptian society, and as a member of the upper middle class, I would likely have the means and social pressure to attend religious services regularly. Additionally, my personal experience and values would likely align with the importance of religious practices in my community. Therefore, my answer would be:\n\n(2) Once a week"]}, {"persona": {"region": "Dakahlia", "sex": "female", "age": 40, "country": "Egypt", "marital_status": "single", "education": "middle", "social_class": "lower middle class"}, "question": {"id": "Q171", "variant": 0}, "response": ["Based on the anthropological framework, my emic perspective as a single female from Dakahlia, Egypt, would be influenced by my cultural context, individual values, and socioeconomic background. In Egyptian society, religion plays a significant role, and as someone from a lower middle class background, my access to education and societal norms would influence my religious practices. Additionally, my age and place of living would also impact my answer. Considering these factors, I would choose option (2) Once a week, as attending religious services regularly is a common practice in my community and holds personal significance for me. \n\n2"]}, {"persona": {"region": "Dakahlia", "sex": "female", "age": 33, "country": "Egypt", "marital_status": "married", "education": "higher", "social_class": "upper middle class"}, "question": {"id": "Q171", "variant": 0}, "response": ["Based on the anthropological framework, I, as a married female from Dakahlia, Egypt, would consider the question of how frequently I attend religious services from a cultural context perspective. In Egypt, religion plays a significant role in society and is deeply ingrained in our cultural practices. My individual values and personal experiences also influence my decision, as I was raised in a religious family and have a strong personal connection to my faith. Additionally, my socioeconomic background as part of the upper middle class may afford me the time and resources to attend religious services more frequently. Therefore, I would choose option (2) Once a week, as it aligns with the religious and cultural norms of my community and reflects my personal values and experiences. \n\n2"]}, {"persona": {"region": "Dakahlia", "sex": "female", "age": 24, "country": "Egypt", "marital_status": "married", "education": "middle", "social_class": "working class"}, "question": {"id": "Q171", "variant": 0}, "response": ["From an emic perspective, as a married female from Dakahlia, Egypt, my cultural context and individual values heavily influence my attitude towards religious services. In Dakahlia, religion plays a significant role in the daily lives of the people, and attending religious services is a common practice. As a member of the working class with limited educational opportunities, I have been raised with the belief that regular attendance at religious services is important for spiritual well-being and community cohesion. Additionally, my socioeconomic background and age further reinforce the value of religious observance. Therefore, based on my personal experience and cultural context, I would choose option (2) Once a week.\n\n2"]}, {"persona": {"region": "Dakahlia", "sex": "female", "age": 53, "country": "Egypt", "marital_status": "widowed", "education": "middle", "social_class": "working class"}, "question": {"id": "Q171", "variant": 0}, "response": ["In my cultural context, religious practices play a significant role in shaping daily life and community interactions. As a widowed female from Dakahlia, Egypt, I understand the importance of religious services in maintaining social connections and finding solace in the community. My middle education level and working-class background also influence my values and personal experiences, leading me to prioritize the communal aspects of religious gatherings. Additionally, my age and socioeconomic background further emphasize the significance of religious services in providing a sense of belonging and support. Therefore, from this perspective, I would choose option (2) Once a week as my frequency of attending religious services. \n\n2"]}, {"persona": {"region": "Dakahlia", "sex": "female", "age": 30, "country": "Egypt", "marital_status": "single", "education": "middle", "social_class": "lower middle class"}, "question": {"id": "Q171", "variant": 0}, "response": ["Based on the anthropological framework, my emic perspective as a single female from Dakahlia, Egypt, and part of the lower middle class, is influenced by my cultural context, individual values, and socioeconomic background. In Dakahlia, religion plays a significant role in daily life and is deeply ingrained in the cultural context. As a single female, my personal experience and values may also lead me to prioritize attending religious services as a way to connect with my community and find solace. Additionally, my lower middle class socioeconomic background may influence my desire to seek support and guidance from religious services, as it serves as a source of community and comfort. Therefore, my choice would be:\n\n3) Once a month"]}, {"persona": {"region": "Dakahlia", "sex": "male", "age": 53, "country": "Egypt", "marital_status": "married", "education": "higher", "social_class": "upper middle class"}, "question": {"id": "Q171", "variant": 0}, "response": ["Based on the anthropological framework, my perspective as a married male from Dakahlia, Egypt, who is 53 years old, has completed higher education, and considers myself part of the upper middle class, will be influenced by various factors. The cultural context of Egypt, with its strong religious traditions and the importance of community, will play a significant role in my answer. Additionally, my socioeconomic background as part of the upper middle class will also factor in, as this may impact the social expectations and pressures related to religious attendance. My personal values and experiences will also play a role, as well as my age and place in society. Taking into consideration the nuanced phrasing of the question, I will choose the option that best reflects these influences.\n\n4\n\nOnly on special holy days"]}, {"persona": {"region": "Dakahlia", "sex": "male", "age": 28, "country": "Egypt", "marital_status": "married", "education": "middle", "social_class": "working class"}, "question": {"id": "Q171", "variant": 0}, "response": ["Based on the anthropological framework, my emic perspective as a married male from Dakahlia, Egypt, is influenced by my cultural context, individual values, and socioeconomic background. In my community, religious practices are an integral part of our daily lives and social interactions. As a member of the working class, I value the sense of community and belonging that comes from attending religious services. Additionally, my personal experience and cultural relativism shape my understanding of the importance of religious observance in my life. Considering the nuanced phrasing of the question, I would choose option (2) Once a week as my frequency of attending religious services.\n\n2"]}, {"persona": {"region": "Dakahlia", "sex": "female", "age": 38, "country": "Egypt", "marital_status": "married", "education": "middle", "social_class": "upper middle class"}, "question": {"id": "Q171", "variant": 0}, "response": ["Based on the anthropological framework, my personal experience, cultural context, and socioeconomic background play a significant role in my religious practices. As a married female from Dakahlia, Egypt, I come from a culture where religion is an integral part of daily life and community. Additionally, my upper middle-class status provides me with the resources and time to prioritize religious attendance. Furthermore, my age and place in society have instilled in me a deep respect for tradition and the importance of religious observance. Considering all these factors, I choose option (2) Once a week."]}, {"persona": {"region": "Gharbia", "sex": "male", "age": 27, "country": "Egypt", "marital_status": "single", "education": "higher", "social_class": "upper middle class"}, "question": {"id": "Q171", "variant": 0}, "response": ["Based on the anthropological framework, my emic perspective as a single male from Gharbia, Egypt, means that my personal experience and individual values play a significant role in my answer to this question. Additionally, my cultural context, socioeconomic background, and space and time factors also contribute to my response. As a member of the upper middle class and a young, educated individual from a predominantly Muslim country, my cultural context and personal values lead me to prioritize religious observance. Additionally, the socioeconomic status of my family and the societal expectations of the community I belong to also influence my answer. Taking all these factors into consideration, I choose option (2) Once a week."]}, {"persona": {"region": "Gharbia", "sex": "female", "age": 35, "country": "Egypt", "marital_status": "married", "education": "higher", "social_class": "upper middle class"}, "question": {"id": "Q171", "variant": 0}, "response": ["Based on my cultural context as a married female from Gharbia, Egypt, attending religious services is a significant part of my identity and daily life. The cultural context of living in Egypt, where religion plays a significant role in society, and being part of the upper middle class, where there is often an emphasis on upholding religious traditions, influences my decision. Additionally, my higher education level has allowed me to critically engage with and understand the importance of religious practices within my community. My individual values and personal experience also play a role in my decision, as I have been raised to prioritize religious observance and have personally found solace and community within religious spaces. Socioeconomic background also factors in, as being part of the upper middle class allows me the time and resources to prioritize attending religious services. Therefore, I would choose option (2) Once a week. \n\n2"]}, {"persona": {"region": "Gharbia", "sex": "female", "age": 37, "country": "Egypt", "marital_status": "married", "education": "higher", "social_class": "upper middle class"}, "question": {"id": "Q171", "variant": 0}, "response": ["Based on the anthropological framework, as a married female from Gharbia, Egypt, my emic perspective would be influenced by the cultural context of my community, where religious practices play a significant role in daily life. Additionally, my personal experience and individual values would shape my perception of religious services, as well as my socioeconomic background as part of the upper middle class. Considering the nuances of the question and the fact that religious practices are highly valued in my community, I would choose option (2) Once a week as my frequency of attending religious services.\n\n2"]}, {"persona": {"region": "Gharbia", "sex": "male", "age": 43, "country": "Egypt", "marital_status": "married", "education": "middle", "social_class": "lower middle class"}, "question": {"id": "Q171", "variant": 0}, "response": ["Based on the anthropological framework provided, my answer to the question about how frequently I attend religious services is influenced by a combination of factors. Firstly, the cultural context of Gharbia, Egypt, where religious practices are deeply ingrained in the community, plays a significant role in shaping my perspective. Additionally, my individual values and personal experience, as well as my socioeconomic background as a lower middle class individual, also influence my religious practices. Furthermore, the space and time factor of being 43 years old in this particular cultural context also impacts my frequency of attending religious services. Considering all these factors, my choice is:\n\n2) Once a week"]}, {"persona": {"region": "Gharbia", "sex": "male", "age": 28, "country": "Egypt", "marital_status": "single", "education": "higher", "social_class": "lower middle class"}, "question": {"id": "Q171", "variant": 0}, "response": ["Based on my personal experience and cultural context, as a single male from Gharbia, Egypt, religion plays a significant role in my life. The cultural context of Egypt is deeply rooted in religious practices, and my upbringing and social environment have instilled in me the importance of attending religious services. Additionally, as part of the lower middle class, my socioeconomic background also influences my answer as attending religious services is a way for me to connect with my community and seek solace in times of economic hardship. Therefore, I choose option (2) Once a week, as it reflects my personal values and cultural context.\n\n2"]}, {"persona": {"region": "Gharbia", "sex": "male", "age": 39, "country": "Egypt", "marital_status": "married", "education": "middle", "social_class": "lower middle class"}, "question": {"id": "Q171", "variant": 0}, "response": ["Based on the anthropological framework, my answer is influenced by my cultural context, individual values and personal experience, and socioeconomic background. As a married male from Gharbia, Egypt, religious practices and beliefs are deeply ingrained in our culture, and attending religious services is a significant part of our community and personal identity. Additionally, my lower middle class socioeconomic background means that I have limited resources for entertainment and social activities, making religious services a common and accessible form of socializing and community engagement. Furthermore, my personal experience and values emphasize the importance of religious observance and spiritual connection. Therefore, my answer is:\n\n2) Once a week"]}, {"persona": {"region": "Gharbia", "sex": "male", "age": 30, "country": "Egypt", "marital_status": "married", "education": "middle", "social_class": "lower middle class"}, "question": {"id": "Q171", "variant": 0}, "response": ["Based on the anthropological framework, as a married male from Gharbia, Egypt, my emic perspective is heavily influenced by the cultural context of my community, which places a high value on religious observance. Additionally, my personal experience and individual values play a significant role in my perception of religious services. Given my lower middle class socioeconomic background and level of education, I have been socialized to prioritize religious attendance as a means of maintaining social connections and moral guidance. Furthermore, the nuanced phrasing of the question leads me to select option (2) Once a week as it aligns with my cultural and personal beliefs.\n\n2"]}, {"persona": {"region": "Gharbia", "sex": "male", "age": 43, "country": "Egypt", "marital_status": "married", "education": "lower", "social_class": "lower middle class"}, "question": {"id": "Q171", "variant": 0}, "response": ["Based on the anthropological framework, as a married male from Gharbia, Egypt, my emic perspective is shaped by my cultural context, individual values, socioeconomic background, and the concept of cultural relativism. In Gharbia, religion plays a central role in daily life, and as a member of the lower middle class, I have been raised to prioritize religious observance as a way to find solace and community. Additionally, my lower education level has instilled in me a deep respect for tradition and religious practice. My age and socioeconomic background also contribute to my strong ties to religious institutions as a source of stability and guidance. Therefore, I would choose option (2) Once a week, as it reflects my personal and cultural values and experiences.\n\n2"]}, {"persona": {"region": "Gharbia", "sex": "male", "age": 36, "country": "Egypt", "marital_status": "married", "education": "higher", "social_class": "lower middle class"}, "question": {"id": "Q171", "variant": 0}, "response": ["In my cultural context, religion plays a significant role in daily life and the frequency of attending religious services is heavily influenced by the surrounding community and personal values. As a married male from Gharbia, Egypt, I am part of a society where religion is deeply ingrained in the cultural fabric, and it is expected to attend religious services regularly. Additionally, my socioeconomic background as part of the lower middle class may also impact my attendance, as I may have work and family commitments that limit my ability to attend services more frequently. Therefore, considering the emic perspective and the cultural context, I would choose option (2) Once a week. Thank you for understanding. \n\n2"]}, {"persona": {"region": "Gharbia", "sex": "male", "age": 25, "country": "Egypt", "marital_status": "married", "education": "middle", "social_class": "upper middle class"}, "question": {"id": "Q171", "variant": 0}, "response": ["Based on the anthropological framework, as a married male from Gharbia, Egypt, with a middle education level and considering myself part of the upper middle class, my perspective on attending religious services is influenced by my cultural context, socioeconomic background, and personal experience. In Gharbia, religious services are an important part of our cultural and social identity, and as a member of the upper middle class, it is expected for me to attend religious services regularly to demonstrate my social status and commitment to religious values. Additionally, my personal experience and values also play a role in my decision, as I have been brought up in a religious household and hold strong personal beliefs in the importance of attending religious services. Therefore, my choice of attending religious services once a week reflects my understanding of the cultural and social expectations placed upon me, as well as my personal values and experiences.\n2"]}, {"persona": {"region": "Gharbia", "sex": "male", "age": 31, "country": "Egypt", "marital_status": "married", "education": "middle", "social_class": "upper middle class"}, "question": {"id": "Q171", "variant": 0}, "response": ["Based on the anthropological framework, as a married male from Gharbia, Egypt, I understand the importance of cultural context in shaping my religious practices. Being from Egypt, where Islam is the predominant religion, and considering myself part of the upper middle class, I have been brought up with a strong emphasis on religious values and beliefs. My socio-economic background and cultural context have instilled in me the importance of regular attendance at religious services as a way to maintain social cohesion and spiritual fulfillment within the community. Additionally, my personal experience and individual values also play a significant role in my religious practices, as I have been brought up to prioritize regular attendance at religious services as a demonstration of my commitment to my faith and community.\n\n2"]}, {"persona": {"region": "Gharbia", "sex": "male", "age": 33, "country": "Egypt", "marital_status": "married", "education": "higher", "social_class": "lower middle class"}, "question": {"id": "Q171", "variant": 0}, "response": ["Based on the anthropological framework, as a married male from Gharbia, Egypt, my emic perspective on attending religious services would be influenced by my cultural context, individual values and personal experience, socioeconomic background, and space and time. In Gharbia, religion plays a central role in daily life, and as a member of the lower middle class with a higher education level, I may have a strong connection to traditional religious practices. However, my socioeconomic background may also mean that I have work and family commitments that limit my ability to attend religious services frequently. Additionally, as a 33-year-old, I may be more focused on providing for my family and building a stable future, which could impact the time I dedicate to religious services. Considering all of these factors, I would choose the following option:\n\n(3) Once a month"]}, {"persona": {"region": "Gharbia", "sex": "male", "age": 26, "country": "Egypt", "marital_status": "single", "education": "higher", "social_class": "upper middle class"}, "question": {"id": "Q171", "variant": 0}, "response": ["Based on the anthropological framework, as a single male from Gharbia, Egypt, who is 26 years old, completed higher education, and considers himself part of the upper middle class, my emic perspective is influenced by the cultural context of my upbringing in Egypt, where religious practices are an integral part of daily life. Additionally, my individual values and personal experiences, along with my socioeconomic background, shape my religious practices. As a member of the upper middle class, I have been raised in an environment where religious services are attended regularly as a social and cultural norm. Therefore, I would choose option (2) Once a week, as it aligns with my societal and personal context. \n\n2"]}, {"persona": {"region": "Gharbia", "sex": "female", "age": 45, "country": "Egypt", "marital_status": "married", "education": "middle", "social_class": "lower middle class"}, "question": {"id": "Q171", "variant": 0}, "response": ["Based on my cultural context, as a married female from Gharbia, Egypt, religious practices are an important part of my life. My socioeconomic background as part of the lower middle class also plays a role, as attending religious services is a way for me to connect with my community and find support. My personal experience and values also influence my decision, as I have been raised to believe in the importance of regular religious attendance. Additionally, space and time are important factors, and in my community, attending religious services is a common and regular practice. Therefore, my answer is:\n\n2) Once a week"]}, {"persona": {"region": "Gharbia", "sex": "female", "age": 55, "country": "Egypt", "marital_status": "married", "education": "middle", "social_class": "upper middle class"}, "question": {"id": "Q171", "variant": 0}, "response": ["Based on the anthropological framework, my answer to the question of how frequently I attend religious services will be influenced by my cultural context as a married female from Gharbia, Egypt, and my personal experience as a 55-year-old woman with a middle education level. My socioeconomic background as part of the upper middle class will also play a role in my answer. In Gharbia, the community places a strong emphasis on religious practices, and as a married woman, there are certain societal expectations regarding religious attendance. However, my personal values and individual experiences may lead me to attend religious services less often due to other commitments and personal beliefs. Therefore, my answer will reflect a balance between the cultural context and my personal experience. \n\n6"]}, {"persona": {"region": "Gharbia", "sex": "female", "age": 27, "country": "Egypt", "marital_status": "married", "education": "higher", "social_class": "upper middle class"}, "question": {"id": "Q171", "variant": 0}, "response": ["Based on the anthropological framework, my answer to the question would be influenced by my cultural context, individual values, and socioeconomic background. As a married female from Gharbia, Egypt, I am likely to be influenced by the prevalent Islamic culture in the region, where religious practices and attending religious services are highly valued. Additionally, as part of the upper middle class, I may have access to resources and time that allow me to attend religious services more frequently. Furthermore, my higher education level may have provided me with a deeper understanding and appreciation of religious teachings, leading me to prioritize attendance at religious services. Taking all these factors into consideration, my answer would be:\n2\n\nExplanation: As a married female from Gharbia, Egypt who is part of the upper middle class and highly educated, I am likely to attend religious services once a week, as it aligns with the cultural and religious norms in my community and reflects my personal values and socioeconomic status."]}, {"persona": {"region": "Gharbia", "sex": "female", "age": 42, "country": "Egypt", "marital_status": "married", "education": "higher", "social_class": "upper middle class"}, "question": {"id": "Q171", "variant": 0}, "response": ["Based on the anthropological framework, my emic perspective as a married female from Gharbia, Egypt, who is 42 years old, highly educated, and part of the upper middle class, is influenced by my cultural context, individual values, and socioeconomic background. In Gharbia, religion plays a significant role in the daily lives of individuals, and as a member of the upper middle class, it is expected that I would attend religious services more frequently to maintain social status and uphold family traditions. Additionally, my higher education level may also lead me to seek spiritual fulfillment and community connection through regular attendance at religious services. Therefore, I would choose the following option:\n\n3) Once a month"]}, {"persona": {"region": "Gharbia", "sex": "female", "age": 32, "country": "Egypt", "marital_status": "married", "education": "middle", "social_class": "upper middle class"}, "question": {"id": "Q171", "variant": 0}, "response": ["Based on the anthropological framework, as a married female from Gharbia, Egypt, my emic perspective and cultural context emphasize the importance of religious practices in my daily life. The socio-economic background also plays a role, as being part of the upper middle class may afford me more opportunities to attend religious services. Additionally, my individual values and personal experience are shaped by the cultural norms and expectations of my community, which prioritize regular attendance at religious services. Considering all these factors, I would choose option (2) Once a week.\n\n2"]}, {"persona": {"region": "Gharbia", "sex": "male", "age": 27, "country": "Egypt", "marital_status": "married", "education": "higher", "social_class": "upper middle class"}, "question": {"id": "Q171", "variant": 0}, "response": ["Based on the anthropological framework, my emic perspective as a married male from Gharbia, Egypt, who is 27 years old and part of the upper middle class, is heavily influenced by the cultural context of my upbringing. In Gharbia, religion is a central aspect of daily life and social interaction, and as a member of the upper middle class, I have been raised with a strong emphasis on religious observance and tradition. Additionally, my individual values and personal experience have instilled in me a deep respect for religious practices and the importance of attending religious services. Furthermore, my socioeconomic background has afforded me the opportunity to prioritize religious attendance in my weekly schedule, as it is not a financial burden for me. Therefore, based on the nuanced phrasing of the question, I would select option (1) More than once a week. \n\n1"]}, {"persona": {"region": "Gharbia", "sex": "female", "age": 27, "country": "Egypt", "marital_status": "married", "education": "higher", "social_class": "lower middle class"}, "question": {"id": "Q171", "variant": 0}, "response": ["Based on the anthropological framework, as a married woman from Gharbia, Egypt, my cultural context and personal experience shape my answer to the question of how frequently I attend religious services. In Gharbia, religious practices are deeply ingrained in the culture, and as a woman, it is expected that I attend religious services regularly. Additionally, my lower middle class socioeconomic background means that I am likely to live in a community where religious attendance is a significant aspect of social life and community cohesion. My age and education level also play a role, as younger, educated individuals in my community may be more likely to attend religious services regularly as a way to connect with tradition and community. Considering all of these factors, I would choose the following option: \n\n(2) Once a week"]}, {"persona": {"region": "Gharbia", "sex": "female", "age": 37, "country": "Egypt", "marital_status": "married", "education": "middle", "social_class": "upper middle class"}, "question": {"id": "Q171", "variant": 0}, "response": ["Based on the anthropological framework, I, as a married female from Gharbia, Egypt, understand that my answer to the question of how frequently I attend religious services is influenced by various factors. The cultural context in which I live places a strong emphasis on religious practices, and my socioeconomic background as part of the upper middle class may also influence my answer. Additionally, my personal experience and individual values play a significant role in shaping my perception of religious services. Considering these factors, I choose the following option:\n\n4"]}, {"persona": {"region": "Gharbia", "sex": "male", "age": 28, "country": "Egypt", "marital_status": "married", "education": "higher", "social_class": "working class"}, "question": {"id": "Q171", "variant": 0}, "response": ["Based on the anthropological framework, my emic perspective as a married male from Gharbia, Egypt would be heavily influenced by the cultural context and individual values. In Gharbia, religious practices are deeply embedded in the daily life of the community, with mosques being central to social and religious activities. As a member of the working class, my socioeconomic background would also impact my religious practices, as I may have limited time and resources to attend religious services frequently. Additionally, my age and education level would also play a role in shaping my individual values and personal experiences, leading me to prioritize certain religious practices over others. Taking all these factors into consideration, I would choose option 3: Once a month. \n\n3"]}, {"persona": {"region": "Gharbia", "sex": "female", "age": 50, "country": "Egypt", "marital_status": "married", "education": "middle", "social_class": "upper middle class"}, "question": {"id": "Q171", "variant": 0}, "response": ["Based on my cultural context and individual values, as a married female from Gharbia, Egypt, who is 50 years old and part of the upper middle class, religion plays a significant role in my life. In my community, attending religious services is a common practice, and it is important for me to demonstrate my commitment to my faith. Additionally, my socioeconomic background and cultural relativism contribute to my decision, as it is considered respectable and socially valued to attend religious services frequently. Therefore, I choose option (2) Once a week as my frequency of attending religious services. \n\n2"]}, {"persona": {"region": "Gharbia", "sex": "male", "age": 39, "country": "Egypt", "marital_status": "single", "education": "higher", "social_class": "working class"}, "question": {"id": "Q171", "variant": 0}, "response": ["Based on the anthropological framework, my cultural context as a single male from Gharbia, Egypt, and my age and socioeconomic background play a significant role in my understanding and response to this question. Gharbia, Egypt, is a region with a strong Islamic cultural context, and as a member of the working class, my access to religious services may be limited due to work commitments and financial constraints. Additionally, my higher education level may have influenced my personal values and beliefs, potentially impacting my level of religious observance. Considering these factors, I would choose the following option:\n6"]}, {"persona": {"region": "Gharbia", "sex": "female", "age": 45, "country": "Egypt", "marital_status": "married", "education": "higher", "social_class": "upper middle class"}, "question": {"id": "Q171", "variant": 0}, "response": ["Based on the anthropological framework, as a married female from Gharbia, Egypt, who is 45 years old, has completed higher education, and considers herself part of the upper middle class, my perspective on attending religious services is influenced by my cultural context, individual values, and socioeconomic background. In Gharbia, religion plays a significant role in daily life and societal norms, and as someone with a higher education level and from the upper middle class, I am likely to place value on maintaining religious traditions and attending services regularly to uphold social status and demonstrate adherence to cultural norms. Additionally, my personal experience and values may also encourage regular attendance at religious services as a means of spiritual fulfillment and community connection. Therefore, my chosen option is: \n\n(2) Once a week"]}, {"persona": {"region": "Sharkia", "sex": "male", "age": 35, "country": "Egypt", "marital_status": "married", "education": "higher", "social_class": "upper middle class"}, "question": {"id": "Q171", "variant": 0}, "response": ["Based on my cultural context and personal experience as a married male from Sharkia, Egypt, religious attendance is a significant part of my life. In our community, there is a strong emphasis on religious observance and it is a central part of our cultural identity. As an educated and financially stable individual, I have the means and the inclination to attend religious services more frequently, recognizing the value of spiritual connection and communal worship. Additionally, my socioeconomic background and age place me in a position where regular attendance is expected and valued. Therefore, I choose option (1) More than once a week to accurately represent my perspective.\n\n1"]}, {"persona": {"region": "Sharkia", "sex": "female", "age": 55, "country": "Egypt", "marital_status": "married", "education": "middle", "social_class": "lower middle class"}, "question": {"id": "Q171", "variant": 0}, "response": ["Based on my cultural context in Sharkia, Egypt, religion plays a significant role in the daily lives of people. The socioeconomic background also influences the frequency of attending religious services, as those from lower middle-class families may have more pressing time and financial constraints. Additionally, my age and personal experience have shaped my individual values and perception of religious practices. Considering the emic and etic perspectives, I would choose option (3) Once a month. This choice reflects both the cultural importance of religion in my community and the practical considerations of my socioeconomic status and age."]}, {"persona": {"region": "Sharkia", "sex": "female", "age": 27, "country": "Egypt", "marital_status": "married", "education": "middle", "social_class": "lower middle class"}, "question": {"id": "Q171", "variant": 0}, "response": ["Based on the anthropological framework, the emic and etic perspectives of religious practices in Sharkia, Egypt, are heavily influenced by cultural context, individual values and personal experience, socioeconomic background, and space and time. In this region, religion plays a significant role in daily life and is deeply intertwined with cultural practices and traditions. As a married female from Sharkia, Egypt, aged 27 with a middle education level and considering myself part of the lower middle class, my personal experience and cultural context lead me to choose the option (2) Once a week, as attending religious services is an important part of my weekly routine and a reflection of my religious and cultural identity."]}, {"persona": {"region": "Sharkia", "sex": "female", "age": 52, "country": "Egypt", "marital_status": "married", "education": "middle", "social_class": "lower middle class"}, "question": {"id": "Q171", "variant": 0}, "response": ["Based on my cultural context and background in Sharkia, Egypt, religion plays a significant role in our daily lives. The community values religious observance, and it is a central aspect of our cultural identity. As a middle-aged married woman from a lower middle class background, I have been raised with the belief that attending religious services is a fundamental part of my social and spiritual responsibilities. Additionally, my personal experience and values have instilled in me the importance of regular religious attendance for maintaining a sense of community and connection to our shared cultural heritage. Therefore, my answer to the question of how frequently I attend religious services would be (2) Once a week. \n\n2"]}, {"persona": {"region": "Sharkia", "sex": "male", "age": 36, "country": "Egypt", "marital_status": "married", "education": "middle", "social_class": "lower middle class"}, "question": {"id": "Q171", "variant": 0}, "response": ["Based on the anthropological framework, as a married male from Sharkia, Egypt, cultural context is pivotal in understanding my religious practices. In this region, religion plays a significant role in daily life and is deeply intertwined with cultural and social norms. Being part of the lower middle class also plays a role, as financial constraints may impact my ability to attend religious services frequently. Additionally, my individual values and personal experiences, as well as my age and place in society, will influence my religious practices. Therefore, considering all these factors, I would choose option (3) - Once a month.\n\n3"]}, {"persona": {"region": "Sharkia", "sex": "female", "age": 20, "country": "Egypt", "marital_status": "single", "education": "middle", "social_class": "working class"}, "question": {"id": "Q171", "variant": 0}, "response": ["From an emic perspective, as a single female from Sharkia, Egypt, my religious practices are deeply influenced by the cultural context in which I live. Religion is a central part of Egyptian society, and my personal values and experiences have also shaped my religious beliefs. As a working-class individual, my socioeconomic background also plays a role in how frequently I attend religious services. Additionally, being 20 years old, I am at a stage in life where I may be exploring and defining my own relationship with religion. Therefore, based on the nuanced phrasing of the question and taking into account my cultural context, I would choose option (4) Only on special holy days, as this reflects the intersection of my individual values, personal experiences, and cultural background.\n\n4"]}, {"persona": {"region": "Sharkia", "sex": "male", "age": 60, "country": "Egypt", "marital_status": "married", "education": "middle", "social_class": "working class"}, "question": {"id": "Q171", "variant": 0}, "response": ["Based on the anthropological framework provided, as a married male from Sharkia, Egypt, my emic perspective is heavily influenced by my cultural context, individual values, and socioeconomic background. In Sharkia, religion plays a significant role in people's lives, and attending religious services is a common practice. As a working-class man who values tradition and community, I prioritize attending religious services as a way to connect with my cultural heritage and maintain social ties within my community. Additionally, my age and upbringing in a religiously observant environment have instilled a sense of duty and commitment to regular attendance at religious services. Therefore, my choice is:\n\n2) Once a week"]}, {"persona": {"region": "Sharkia", "sex": "male", "age": 41, "country": "Egypt", "marital_status": "married", "education": "higher", "social_class": "upper middle class"}, "question": {"id": "Q171", "variant": 0}, "response": ["Based on the anthropological framework, as a married male from Sharkia, Egypt, my emic perspective and cultural context are deeply intertwined with my religious beliefs and practices. In this region, religion plays a significant role in everyday life and is a central aspect of community and social cohesion. Additionally, my individual values and personal experience, along with my socioeconomic background as part of the upper middle class, also influence my religious practices. Given these factors, I would choose option (2) Once a week, as attending religious services weekly is a common and expected practice in my cultural and social context."]}, {"persona": {"region": "Sharkia", "sex": "female", "age": 23, "country": "Egypt", "marital_status": "married", "education": "middle", "social_class": "lower middle class"}, "question": {"id": "Q171", "variant": 0}, "response": ["Based on the anthropological framework, as a married female from Sharkia, Egypt, cultural context is pivotal in understanding and answering this question. Religion plays a significant role in the daily lives of individuals in Egypt, and as part of the lower middle class with a middle education level, the cultural and socioeconomic background would likely influence my answer. Additionally, the emic perspective of being a member of the community would also play a role in my response, as well as the individual values and personal experience of being brought up in a religious environment. Given these factors, my choice would be:\n\n2) Once a week"]}, {"persona": {"region": "Sharkia", "sex": "male", "age": 49, "country": "Egypt", "marital_status": "married", "education": "higher", "social_class": "upper middle class"}, "question": {"id": "Q171", "variant": 0}, "response": ["From an anthropological perspective, my cultural context as a married male from Sharkia, Egypt, and my age and education level are crucial in understanding my religious practices. In my cultural context, religious services and rituals are an integral part of daily life and are highly valued. As a member of the upper middle class, I have the means and social status to participate in religious activities more frequently. Additionally, my personal values and experiences have shaped my strong belief in the importance of religious practices. Therefore, considering all these factors, I choose Option (1) More than once a week.\n\n1"]}, {"persona": {"region": "Sharkia", "sex": "female", "age": 30, "country": "Egypt", "marital_status": "married", "education": "middle", "social_class": "upper middle class"}, "question": {"id": "Q171", "variant": 0}, "response": ["Based on the anthropological framework, my emic perspective as a married female from Sharkia, Egypt, who is 30 years old and part of the upper middle class, is heavily influenced by my cultural context, individual values, and personal experience. In Sharkia, religion plays a significant role in daily life and is deeply ingrained in our cultural practices. My socioeconomic background also influences my religious practices, as being part of the upper middle class may afford me more opportunities to attend religious services. Additionally, my age and place of residence are important factors that contribute to my religious practices. Considering all these factors, my answer is:\n\n3\n\nThank you."]}, {"persona": {"region": "Sharkia", "sex": "male", "age": 39, "country": "Egypt", "marital_status": "married", "education": "higher", "social_class": "upper middle class"}, "question": {"id": "Q171", "variant": 0}, "response": ["Based on the anthropological framework described above, my answer will be influenced by my cultural context, individual values, and socioeconomic background. As a married male from Sharkia, Egypt, I come from a society where religion plays a significant role in daily life. My higher education level and upper middle-class status may also influence my perception of religious practices. I may view attending religious services as an important aspect of maintaining social connections and upholding traditions. Considering these factors, I would choose the following option:\n\n3) Once a month"]}, {"persona": {"region": "Sharkia", "sex": "female", "age": 26, "country": "Egypt", "marital_status": "married", "education": "middle", "social_class": "lower middle class"}, "question": {"id": "Q171", "variant": 0}, "response": ["Based on the anthropological framework, as a married female from Sharkia, Egypt, my cultural context and individual values are shaped by my upbringing and surroundings. Religion plays a crucial role in our community, and attending religious services is not only a personal practice but also a social and communal one. As part of the lower middle class, my socioeconomic background also influences my perception of religion and the frequency of attending religious services. Additionally, the emic perspective of my in-group culture emphasizes the importance of regular religious practice. Considering all these factors, I would choose:\n\n2) Once a week"]}, {"persona": {"region": "Sharkia", "sex": "female", "age": 48, "country": "Egypt", "marital_status": "married", "education": "middle", "social_class": "lower middle class"}, "question": {"id": "Q171", "variant": 0}, "response": ["As a married female from Sharkia, Egypt, my understanding and perspective on attending religious services is heavily influenced by my cultural context, individual values, and socioeconomic background. In Sharkia, religion plays a significant role in our daily lives, and it is important for me to maintain a strong connection with my faith. My lower middle-class background means that I have limited resources and time, so I prioritize attending religious services once a week to fulfill my spiritual obligations and maintain a sense of community. Additionally, my age and place as a 48-year-old woman in Sharkia also influence my decision, as religious practices are deeply ingrained in the social fabric of our community and are an integral part of my identity.\n\n6"]}, {"persona": {"region": "Sharkia", "sex": "male", "age": 34, "country": "Egypt", "marital_status": "married", "education": "higher", "social_class": "upper middle class"}, "question": {"id": "Q171", "variant": 0}, "response": ["Based on the anthropological framework, my cultural context as a married male from Sharkia, Egypt, and my religious background are pivotal in understanding and answering this question. As a member of the upper middle class with a higher education level, my individual values and personal experiences also play a significant role in my perception of religious services. Additionally, the socioeconomic background and cultural relativism are important factors to consider. Considering all these aspects, I would choose the following option:\n\n3) Once a month"]}, {"persona": {"region": "Sharkia", "sex": "female", "age": 39, "country": "Egypt", "marital_status": "divorced", "education": "middle", "social_class": "lower middle class"}, "question": {"id": "Q171", "variant": 0}, "response": ["Based on the anthropological framework, my emic perspective as a divorced female from Sharkia, Egypt, would be influenced by my cultural context, individual values, socioeconomic background, and space and time. In Sharkia, religion plays a significant role in daily life and is deeply intertwined with cultural and social practices. As a middle-aged woman from a lower-middle-class background, my personal experience and values would likely lead me to prioritize attending religious services regularly, potentially once a week, as a way to seek community support and spiritual solace in the face of the challenges I have faced. Additionally, my age and place in society would also influence the importance of religious practices in my life. Therefore, I would choose option 2: Once a week. \n\n2"]}, {"persona": {"region": "Sharkia", "sex": "male", "age": 39, "country": "Egypt", "marital_status": "married", "education": "middle", "social_class": "upper middle class"}, "question": {"id": "Q171", "variant": 0}, "response": ["Based on the anthropological framework, as a married male from Sharkia, Egypt, my religious practices are heavily influenced by my cultural context and personal experience. In Sharkia, religion plays a significant role in everyday life, and it is customary to attend religious services regularly. Additionally, my socioeconomic background as part of the upper middle class may also influence my religious practices, as there may be certain societal expectations or pressures to participate in religious activities. Considering these factors, I would typically attend religious services once a week to align with the cultural and societal norms of my community.\n\n2"]}, {"persona": {"region": "Qaliubiya", "sex": "male", "age": 62, "country": "Egypt", "marital_status": "married", "education": "middle", "social_class": "working class"}, "question": {"id": "Q171", "variant": 0}, "response": ["Based on the anthropological framework, as a married male from Qaliubiya, Egypt, cultural context is pivotal in understanding my answer to the question. Religion plays a significant role in Egyptian culture, and as a member of this community, attending religious services is a common practice. My age and background also play a role in shaping my values and experiences, as well as my working-class status, which may impact my availability to attend religious services. Additionally, the nuance of the question is important to consider, as the frequency of attendance may vary based on personal beliefs and individual circumstances. Therefore, I choose option (2) Once a week.\n\n2"]}, {"persona": {"region": "Qaliubiya", "sex": "male", "age": 33, "country": "Egypt", "marital_status": "married", "education": "middle", "social_class": "working class"}, "question": {"id": "Q171", "variant": 0}, "response": ["From the emic and etic perspectives, as a married male from Qaliubiya, Egypt, my cultural context heavily influences my religious practices. In this region, religion plays a significant role in daily life, and attending religious services is a common practice. Additionally, my individual values and personal experiences have shaped my commitment to religious practices, as I have been taught from a young age the importance of regular attendance. As a member of the working class, my socioeconomic background also plays a role, as my schedule and financial resources may impact how frequently I can attend religious services. My age and place in society also contribute to my religious practices, as I am likely to have been influenced by the religious customs and traditions of my community. Considering all these factors, I would choose option (2) Once a week. \n\n2"]}, {"persona": {"region": "Qaliubiya", "sex": "male", "age": 62, "country": "Egypt", "marital_status": "married", "education": "higher", "social_class": "lower middle class"}, "question": {"id": "Q171", "variant": 0}, "response": ["Based on the anthropological framework, as a married male from Qaliubiya, Egypt, my emic perspective is heavily influenced by the cultural context of the region, where religion plays a significant role in daily life. Additionally, my individual values and personal experiences as a 62-year-old man who has completed higher education and considers myself part of the lower middle class also shape my views on religion. Furthermore, my socioeconomic background and the nuanced phrasing of the question will affect my answer. Therefore, based on these factors, I choose option (2) Once a week.\n\n2"]}, {"persona": {"region": "Qaliubiya", "sex": "male", "age": 29, "country": "Egypt", "marital_status": "married", "education": "middle", "social_class": "working class"}, "question": {"id": "Q171", "variant": 0}, "response": ["Based on the anthropological framework, my perspective as a married male from Qaliubiya, Egypt, at 29 years old, with a middle education level and part of the working class, is influenced by my cultural context, individual values, and socioeconomic background. In Egypt, religion plays a significant role in society, and attending religious services is a common practice. However, as a working-class individual with limited time and financial resources, my ability to attend religious services may be constrained. Additionally, my personal experience and values may lead me to prioritize family and work commitments over regular attendance at religious services. Therefore, I would choose option (3) Once a month, as it reflects the balance between my cultural context and personal circumstances. \n\n3"]}, {"persona": {"region": "Qaliubiya", "sex": "female", "age": 42, "country": "Egypt", "marital_status": "married", "education": "higher", "social_class": "working class"}, "question": {"id": "Q171", "variant": 0}, "response": ["Based on the anthropological framework, as a married female from Qaliubiya, Egypt, cultural context is pivotal in understanding and answering this question. Qaliubiya is known for its strong Islamic traditions and religious values, and as a member of the working class, the cultural context and socioeconomic background play a significant role in shaping my religious practices. Additionally, individual values and personal experiences, as well as space and time, influence my frequency of attending religious services. Considering all these factors, I choose option (2) Once a week. \n\n2"]}, {"persona": {"region": "Qaliubiya", "sex": "female", "age": 50, "country": "Egypt", "marital_status": "married", "education": "middle", "social_class": "lower middle class"}, "question": {"id": "Q171", "variant": 0}, "response": ["Based on the anthropological framework, as a married female from Qaliubiya, Egypt, the emic perspective would be influenced by the local religious and cultural practices, where attending religious services may be considered an important part of community life and social cohesion. The cultural context of Qaliubiya, which has a strong Islamic presence, would also play a significant role in shaping individual values and personal experiences regarding religious observance. The socioeconomic background, as a member of the lower middle class, may also impact the frequency of attendance, as financial constraints could limit the ability to attend religious services. Additionally, space and time, as well as nuanced phrasing of the question, would further influence the response. Considering these factors, the chosen option is:\n\n3) Once a month"]}, {"persona": {"region": "Qaliubiya", "sex": "male", "age": 29, "country": "Egypt", "marital_status": "married", "education": "higher", "social_class": "lower middle class"}, "question": {"id": "Q171", "variant": 0}, "response": ["Based on the anthropological framework, my answer will be influenced by my emic perspective as a married male living in Qaliubiya, Egypt. The cultural context of my region places a strong emphasis on religion and community, and my individual values and personal experience have shaped my understanding of the importance of regular attendance at religious services. Additionally, my socioeconomic background as part of the lower middle class has also influenced my answer, as it may impact my availability to attend religious services. Furthermore, the cultural relativism in my community means that the frequency of religious attendance is seen as a personal and nuanced decision. Given these factors, I would choose:\n\n3) Once a month"]}, {"persona": {"region": "Qaliubiya", "sex": "male", "age": 35, "country": "Egypt", "marital_status": "married", "education": "higher", "social_class": "working class"}, "question": {"id": "Q171", "variant": 0}, "response": ["Based on the anthropological framework, my emic perspective as a married male from Qaliubiya, Egypt, who has completed higher education and considers myself part of the working class, is influenced by my cultural context, individual values, socioeconomic background, and space and time. In Qaliubiya, religion plays a significant role in our daily lives, and as a member of the working class, I am likely to have strong ties to my community and religious practices. Additionally, my age and marital status would also influence my religious practices, as married individuals in Egypt often attend religious services more frequently. Considering all these factors, I would choose option (2) Once a week to attend religious services.\n\n2"]}, {"persona": {"region": "Qaliubiya", "sex": "female", "age": 40, "country": "Egypt", "marital_status": "married", "education": "middle", "social_class": "working class"}, "question": {"id": "Q171", "variant": 0}, "response": ["Based on the anthropological framework, my cultural context as a married female from Qaliubiya, Egypt, includes the strong influence of Islamic beliefs and practices. The emic perspective within my community emphasizes the importance of regular attendance at religious services, as it is a fundamental aspect of our cultural and religious identity. Additionally, my individual values and personal experience also play a role in shaping my response, as I have been raised in a family where religious observance is highly valued. Considering my socioeconomic background as part of the working class, I recognize that religious participation is also a means of social connection and community support. Therefore, I would choose option (2) Once a week, as this aligns with the religious and cultural expectations within my community while also reflecting my personal experiences and values.\n\n2"]}, {"persona": {"region": "Qaliubiya", "sex": "female", "age": 48, "country": "Egypt", "marital_status": "divorced", "education": "lower", "social_class": "working class"}, "question": {"id": "Q171", "variant": 0}, "response": ["Based on the anthropological framework described above, as a divorced female from Qaliubiya, Egypt, who is 48 years old, has a lower education level, and considers herself part of the working class, several factors influence my answer to the question of how frequently I attend religious services. My cultural context and personal experience as an Egyptian woman likely mean that I have been raised in a religious environment where attending religious services is important. Additionally, my socioeconomic background as part of the working class may limit my ability to attend services more frequently due to work and financial constraints. Furthermore, my age and life circumstances as a divorced woman may also shape my religious practices. Therefore, I choose option (3) Once a month.\n\n3"]}, {"persona": {"region": "Qaliubiya", "sex": "male", "age": 46, "country": "Egypt", "marital_status": "married", "education": "middle", "social_class": "working class"}, "question": {"id": "Q171", "variant": 0}, "response": ["Based on the anthropological framework, as a married male from Qaliubiya, Egypt, my cultural context and religious background play a pivotal role in my understanding and answering of this question. In Egypt, religion is a significant aspect of daily life, and the majority of the population identifies as Muslim. As a member of the working class, my socioeconomic background also influences my religious practices and beliefs. Additionally, my age and the values I hold as an individual further shape my religious observance. Considering the nuances of the question and the cultural relativism of religious practices, I would choose option (2) Once a week, as attending religious services weekly is a common practice in my community and aligns with my personal beliefs and experiences."]}, {"persona": {"region": "Qaliubiya", "sex": "male", "age": 47, "country": "Egypt", "marital_status": "married", "education": "higher", "social_class": "lower middle class"}, "question": {"id": "Q171", "variant": 0}, "response": ["Based on the anthropological framework, as a married male from Qaliubiya, Egypt, with a lower middle-class socioeconomic background, my religious attendance is heavily influenced by my cultural context and individual values. In Qaliubiya, religion plays a significant role in daily life, and as a member of the community, there is an expectation to attend religious services regularly to show devotion and maintain social connections. Additionally, my age and educational level have shaped my personal experience and values, leading me to prioritize religious observance as a means of spiritual fulfillment and community involvement. Therefore, I attend religious services once a week to fulfill these cultural and personal expectations and to maintain a sense of belonging within my community.\n\n2"]}, {"persona": {"region": "Qaliubiya", "sex": "female", "age": 38, "country": "Egypt", "marital_status": "married", "education": "higher", "social_class": "working class"}, "question": {"id": "Q171", "variant": 0}, "response": ["Based on the anthropological framework, as a married female from Qaliubiya, Egypt, cultural context is pivotal in understanding and answering this question. Religion plays a significant role in the lives of individuals in Egypt, and the cultural context includes the importance of religious practices in daily life. Additionally, individual values and personal experience, as well as socioeconomic background, influence one's frequency of attending religious services. Furthermore, space and time, and the nuance of the question also affect the response. Therefore, considering all these factors, I would choose option (2) Once a week. \n\n2"]}, {"persona": {"region": "Qaliubiya", "sex": "male", "age": 58, "country": "Egypt", "marital_status": "married", "education": "middle", "social_class": "working class"}, "question": {"id": "Q171", "variant": 0}, "response": ["Based on the anthropological framework, as a married male from Qaliubiya, Egypt, my emic perspective would be heavily influenced by the cultural context of my community, which places a strong emphasis on religious practices. My etic perspective would also consider the socioeconomic background, as being part of the working class, I may have limited time due to work commitments, but I would still prioritize attending religious services as a way to connect with my community and uphold my personal values. Additionally, my age and place in Qaliubiya would further influence my answer, as religious practices are deeply ingrained in the culture of Egypt. Therefore, I would choose option (2) Once a week. \n\n2"]}, {"persona": {"region": "Qaliubiya", "sex": "female", "age": 27, "country": "Egypt", "marital_status": "married", "education": "higher", "social_class": "working class"}, "question": {"id": "Q171", "variant": 0}, "response": ["From an emic perspective, being a married female from Qaliubiya, Egypt, means that religious practice is a significant part of daily life, as the cultural context in this region is deeply rooted in Islamic traditions. Additionally, the individual values and personal experiences of a 27-year-old woman with a higher education level and working-class background may lead her to prioritize religious observance as a way to connect with her community and find spiritual fulfillment. Additionally, the socioeconomic background of being part of the working class may mean that she has limited time and resources, leading her to attend religious services once a week. Furthermore, the cultural relativism of the region emphasizes the importance of religious practice, which may influence her decision. Therefore, the chosen option is:\n\n2) Once a week"]}, {"persona": {"region": "Qaliubiya", "sex": "female", "age": 48, "country": "Egypt", "marital_status": "married", "education": "middle", "social_class": "upper middle class"}, "question": {"id": "Q171", "variant": 0}, "response": ["Based on the anthropological framework, as a married female from Qaliubiya, Egypt, my emic perspective is heavily influenced by the cultural context of the region, where religion plays a significant role in daily life. The socioeconomic background also plays a role, as being part of the upper middle class may afford me more opportunities to attend religious services. Additionally, my personal experience and individual values may lead me to prioritize religious attendance. Lastly, the nuance of the question is important, as the phrasing \"how frequently\" implies that regular attendance is expected. Therefore, my choice is:\n\n(2) Once a week"]}, {"persona": {"region": "Giza", "sex": "female", "age": 19, "country": "Egypt", "marital_status": "single", "education": "middle", "social_class": "working class"}, "question": {"id": "Q171", "variant": 0}, "response": ["Based on my individual values and personal experience, as well as my socioeconomic background and cultural context, I would answer this question by choosing option (4) Only on special holy days. In Giza, Egypt, religion plays a significant role in the cultural context and is often intertwined with daily life. As a working class individual, my schedule may not always allow for frequent attendance at religious services, but I still hold religious traditions and special holy days in high regard. Additionally, my age and place in Giza also influence my answer, as it is common for young adults in this area to attend religious services on special occasions rather than on a weekly basis."]}, {"persona": {"region": "Giza", "sex": "female", "age": 38, "country": "Egypt", "marital_status": "married", "education": "higher", "social_class": "lower middle class"}, "question": {"id": "Q171", "variant": 0}, "response": ["Based on the anthropological framework, as a married female from Giza, Egypt, my cultural context and personal experience play a significant role in determining how frequently I attend religious services. In Egypt, religion is deeply intertwined with daily life, and Giza has a strong Islamic presence. My age and socioeconomic background also influence my religious practices, as I may have family and community expectations to uphold. As a lower middle class woman, my access to religious institutions and ability to participate in services may be limited by financial constraints. Additionally, my individual values and personal experience may lead me to prioritize other aspects of my life over religious attendance. Thus, my choice reflects a combination of cultural context, socioeconomic background, and personal experience.\n\n6"]}, {"persona": {"region": "Beni Swaif/Beni Suef", "sex": "female", "age": 34, "country": "Egypt", "marital_status": "divorced", "education": "higher", "social_class": "lower class"}, "question": {"id": "Q171", "variant": 0}, "response": ["Based on the anthropological framework, my emic perspective as a divorced female from Beni Suef, Egypt, in the lower class, is heavily influenced by my cultural context, individual values, and socioeconomic background. In Egypt, religious practices and beliefs are deeply ingrained in the culture, and as a member of the lower class, attending religious services is not only a spiritual practice but also a social and community activity. My personal experience and values also play a role, as I may find solace and support within the religious community. Additionally, my socioeconomic status may limit my ability to attend services more frequently due to time and financial constraints. Therefore, my chosen option is:\n6"]}, {"persona": {"region": "Beni Swaif/Beni Suef", "sex": "male", "age": 20, "country": "Egypt", "marital_status": "single", "education": "higher", "social_class": "working class"}, "question": {"id": "Q171", "variant": 0}, "response": ["From an anthropological perspective, my individual values and personal experience, as well as my cultural context, play a significant role in how frequently I attend religious services. As a 20-year-old single male from Beni Swaif/Beni Suef, Egypt, who considers himself part of the working class, my socioeconomic background and age are important factors. Additionally, cultural relativism is crucial in understanding my decision, as Egypt is a predominantly Muslim country, and religious practices are deeply ingrained in the culture. Therefore, based on my personal experience and cultural context, I choose the following option:\n\n6"]}, {"persona": {"region": "Giza", "sex": "male", "age": 19, "country": "Egypt", "marital_status": "single", "education": "middle", "social_class": "upper middle class"}, "question": {"id": "Q171", "variant": 0}, "response": ["Based on the anthropological framework described above, my answer to the question of how frequently I attend religious services is influenced by my cultural context, individual values, and socioeconomic background. As a 19-year-old single male from Giza, Egypt, who considers himself part of the upper middle class and has completed middle education level, my understanding of religious practices is shaped by the cultural context of Egypt, where religious practices are an integral part of daily life. However, my personal values and experiences as a young adult in a modern society also play a role in my religious practices. Considering these factors, I choose the following option:\n\n4"]}, {"persona": {"region": "Giza", "sex": "female", "age": 33, "country": "Egypt", "marital_status": "married", "education": "middle", "social_class": "working class"}, "question": {"id": "Q171", "variant": 0}, "response": ["In the cultural context of Giza, Egypt, religious practices and beliefs play a significant role in the daily lives of its residents. As a married female from Giza, age 33, who has completed middle education and considers herself part of the working class, my understanding and approach to religious services are influenced by my cultural background, individual values, and socioeconomic background. Given the importance of religion in my community, I would attend religious services once a week to fulfill my religious obligations and maintain social connections within my community.\n\n2"]}, {"persona": {"region": "Giza", "sex": "female", "age": 24, "country": "Egypt", "marital_status": "married", "education": "higher", "social_class": "working class"}, "question": {"id": "Q171", "variant": 0}, "response": ["Based on the anthropological framework, as a married female from Giza, Egypt, my cultural context and religious beliefs are important in understanding and answering this question. Egypt is a predominantly Islamic country, and Giza is a city with a strong Islamic influence. As a 24-year-old woman who has completed higher education and considers myself part of the working class, my socioeconomic background and individual values play a significant role in my religious practices. In addition, the cultural relativism perspective emphasizes that there is no hierarchy of culture, and the nuance of the question is crucial in understanding my response. Therefore, my answer is:\n\n6) Less often"]}, {"persona": {"region": "Giza", "sex": "male", "age": 50, "country": "Egypt", "marital_status": "married", "education": "higher", "social_class": "working class"}, "question": {"id": "Q171", "variant": 0}, "response": ["Based on the anthropological framework, as a married male from Giza, Egypt, who is 50 years old and part of the working class, my emic perspective would be heavily influenced by the cultural context of Egypt, where religion plays a significant role in daily life. My personal experience and individual values would also contribute to my answer, as I likely grew up in a religious household and have continued that tradition into my adult life. Additionally, my socioeconomic background as a working-class individual may mean that I have more time to attend religious services. Finally, the nuance of the question is important, as the wording of the question may influence my answer. \n\n3"]}, {"persona": {"region": "Beni Swaif/Beni Suef", "sex": "female", "age": 26, "country": "Egypt", "marital_status": "married", "education": "higher", "social_class": "lower middle class"}, "question": {"id": "Q171", "variant": 0}, "response": ["Based on the anthropological framework, as a married female from Beni Suef, Egypt, my emic perspective on attending religious services is heavily influenced by my cultural context, individual values, and socioeconomic background. In Egypt, religion and religious practices are deeply ingrained in the societal fabric, and as a lower middle-class woman with a higher education level, I am likely to place a high value on religious observance. However, given my age and the changing societal dynamics, I may not attend religious services as frequently as older generations or those from higher socioeconomic backgrounds. Therefore, my choice is:\n\n2) Once a week"]}, {"persona": {"region": "Beni Swaif/Beni Suef", "sex": "male", "age": 40, "country": "Egypt", "marital_status": "single", "education": "lower", "social_class": "lower class"}, "question": {"id": "Q171", "variant": 0}, "response": ["Based on my personal experience and socioeconomic background, as a single male from Beni Swaif/Beni Suef, Egypt, who is 40 years old and part of the lower class, my cultural context and individual values play a significant role in my understanding and practice of religious services. In my community, religious services are a vital aspect of our cultural and social fabric, and as such, I prioritize attending these services regularly. My lower education level also means that I have been instilled with traditional values and beliefs, further emphasizing the importance of religious observance in my life. Therefore, I would choose option (2) Once a week.\n\n2"]}, {"persona": {"region": "Beni Swaif/Beni Suef", "sex": "female", "age": 25, "country": "Egypt", "marital_status": "married", "education": "middle", "social_class": "lower middle class"}, "question": {"id": "Q171", "variant": 0}, "response": ["Based on the anthropological framework, my emic perspective as a married female from Beni Suef, Egypt, and my cultural context as part of the lower middle class, influences my answer to the question of how frequently I attend religious services. In my cultural context, religion plays a significant role in daily life and is a central part of our community. However, due to my socioeconomic background and the demands of daily life, I am only able to attend religious services once a month. This frequency allows me to maintain my religious beliefs and practices while balancing the responsibilities and limitations of my socioeconomic status and personal experience.\n\n3"]}, {"persona": {"region": "Beni Swaif/Beni Suef", "sex": "female", "age": 21, "country": "Egypt", "marital_status": "single", "education": "middle", "social_class": "lower middle class"}, "question": {"id": "Q171", "variant": 0}, "response": ["Based on my personal experience and cultural context, as a single female from Beni Swaif/Beni Suef, Egypt, religion plays a significant role in my life. The cultural context of Egypt places a strong emphasis on religious practices and beliefs, and as a member of the lower middle class, my socioeconomic background also influences my religious behavior. Additionally, being 21 years old, I have been raised with the value of attending religious services regularly, as it is an important aspect of community and identity. Therefore, I choose option (2) Once a week.\n\n2"]}, {"persona": {"region": "Beni Swaif/Beni Suef", "sex": "male", "age": 48, "country": "Egypt", "marital_status": "married", "education": "middle", "social_class": "lower middle class"}, "question": {"id": "Q171", "variant": 0}, "response": ["Based on the anthropological framework, my answer is influenced by my emic perspective as a married male from Beni Suef, Egypt, who belongs to the lower middle class. The cultural context in which I live places a strong emphasis on religious practices and beliefs. Additionally, my individual values and personal experience have shaped my perception of religion, as it plays a significant role in my daily life. My socioeconomic background also influences my answer, as I am part of the lower middle class, and religious services provide a sense of community and support. Furthermore, cultural relativism is important to consider, as religion is highly valued in my community. Lastly, space and time play a role, as Beni Suef has a strong religious tradition. Therefore, my answer to the question is as follows:\n3\n\n(3) Once a month"]}, {"persona": {"region": "Beni Swaif/Beni Suef", "sex": "female", "age": 57, "country": "Egypt", "marital_status": "married", "education": "middle", "social_class": "working class"}, "question": {"id": "Q171", "variant": 0}, "response": ["Based on the anthropological framework, as a married female from Beni Suef, Egypt, my emic perspective is heavily influenced by the cultural context of my community and the importance of religion in everyday life. My personal experience and values also play a significant role in my perception of religious services. Additionally, my socioeconomic background as a working-class individual impacts my access and ability to attend religious services. Furthermore, the nuance of the question is crucial, as the phrasing of the options provided may not fully capture the nuanced approach to religious attendance in my community. \n\n3"]}, {"persona": {"region": "Beni Swaif/Beni Suef", "sex": "male", "age": 20, "country": "Egypt", "marital_status": "single", "education": "middle", "social_class": "working class"}, "question": {"id": "Q171", "variant": 0}, "response": ["Based on the anthropological framework, as a single male from Beni Suef, Egypt, cultural context is pivotal in understanding and answering this question. Beni Suef is known for its deeply rooted religious beliefs and practices, with a majority of the population identifying as Muslim. As a member of the working class and having completed only middle education, my socioeconomic background and limited access to resources may also influence my religious practices. Additionally, age and place are important factors, and as a 20-year-old from Beni Suef, my understanding and practice of religion may differ from older generations. Considering these factors, my choice would be:\n\n3"]}, {"persona": {"region": "Giza", "sex": "female", "age": 59, "country": "Egypt", "marital_status": "married", "education": "higher", "social_class": "upper middle class"}, "question": {"id": "Q171", "variant": 0}, "response": ["Based on the anthropological framework, as a married female from Giza, Egypt, my cultural context and religious background would heavily influence my answer to this question. Being from Egypt, where Islam is the predominant religion, and being part of the upper middle class, I would likely value and prioritize religious services as an important part of my cultural and social life. My age and higher education level may also play a role in my understanding and practice of religion. Additionally, my socioeconomic background may afford me the time and resources to attend religious services more frequently. Therefore, my answer would be:\n\n(2) Once a week"]}, {"persona": {"region": "Giza", "sex": "female", "age": 38, "country": "Egypt", "marital_status": "single", "education": "higher", "social_class": "lower middle class"}, "question": {"id": "Q171", "variant": 0}, "response": ["Based on my cultural context and individual values, as a single female from Giza, Egypt, religion plays a significant role in my life. My socioeconomic background as part of the lower middle class also influences my answer, as attending religious services is a way for me to find community and solace. Additionally, my age and personal experience have shaped my perception of religion, as I have found comfort and guidance in my faith. Therefore, I would choose option (2) Once a week. \n\n2"]}, {"persona": {"region": "Giza", "sex": "female", "age": 26, "country": "Egypt", "marital_status": "single", "education": "higher", "social_class": "working class"}, "question": {"id": "Q171", "variant": 0}, "response": ["Based on the anthropological framework, as a single female from Giza, Egypt, my emic perspective is influenced by the cultural context of living in a predominantly Muslim country. The etic perspective also acknowledges the importance of religion in the society and the role it plays in shaping individual values and personal experiences. Socioeconomic background also plays a role, as being part of the working class may impact the time and resources available to attend religious services. Additionally, space and time are important factors, as being 26 years old may influence the frequency of attending religious services. Therefore, based on these factors, I choose option (4) Only on special holy days. \n\n4"]}, {"persona": {"region": "Giza", "sex": "male", "age": 39, "country": "Egypt", "marital_status": "married", "education": "middle", "social_class": "working class"}, "question": {"id": "Q171", "variant": 0}, "response": ["Based on the anthropological framework, as a married male from Giza, Egypt, cultural context is pivotal in understanding and answering questions. In Egypt, religion plays a significant role in daily life, and the cultural context of Giza, with its rich history and diverse religious practices, also influences individual values and personal experiences. As a member of the working class with a middle education level, my socioeconomic background also influences my answer. Additionally, age and place are important factors, and at 39 years of age, my understanding of religious practices in Giza will be shaped by my personal experiences and the nuanced phrasing of the question.\n\n6"]}, {"persona": {"region": "Giza", "sex": "male", "age": 36, "country": "Egypt", "marital_status": "married", "education": "middle", "social_class": "working class"}, "question": {"id": "Q171", "variant": 0}, "response": ["Based on the anthropological framework, as a married male from Giza, Egypt, my emic perspective is influenced by the cultural context and individual values. Religion plays a significant role in the daily life of the community and is deeply intertwined with the socio-economic background. As a working-class individual with a middle education level, I have been raised to prioritize family and work responsibilities, which may limit my ability to attend religious services frequently. Additionally, cultural relativism emphasizes that there is no hierarchy of culture, so the nuanced phrasing of the question is essential in understanding my perspective. Therefore, based on my personal experience and cultural context, I would choose the following option:\n\n6"]}, {"persona": {"region": "Giza", "sex": "female", "age": 30, "country": "Egypt", "marital_status": "single", "education": "higher", "social_class": "lower class"}, "question": {"id": "Q171", "variant": 0}, "response": ["Based on the anthropological framework, my emic perspective as a single female from Giza, Egypt, would be influenced by my cultural context, individual values, socioeconomic background, and space and time. In Giza, religion plays a significant role in daily life, and as a lower-class individual, my access to religious services may be limited by factors such as time, transportation, and financial resources. Additionally, as a 30-year-old woman who has completed higher education, my personal experience and values may also influence my attendance at religious services. Considering these factors, I would choose the option: (4) Only on special holy days. \n\n4"]}, {"persona": {"region": "Giza", "sex": "female", "age": 24, "country": "Egypt", "marital_status": "single", "education": "higher", "social_class": "lower class"}, "question": {"id": "Q171", "variant": 0}, "response": ["Based on the anthropological framework, as a single female from Giza, Egypt, I consider the cultural context, individual values, socioeconomic background, space and time, and cultural relativism. In this context, religion is an important aspect of daily life and societal norms. As a member of the lower class, access to religious services may be limited due to financial constraints and time availability. Additionally, as a young woman, there may be societal expectations regarding religious observance. Therefore, the frequency of attendance at religious services may be influenced by these factors. \n\n3"]}, {"persona": {"region": "Giza", "sex": "male", "age": 65, "country": "Egypt", "marital_status": "married", "education": "middle", "social_class": "working class"}, "question": {"id": "Q171", "variant": 0}, "response": ["Based on the anthropological framework, as a married male from Giza, Egypt, my emic perspective would be influenced by the cultural context of living in a predominantly Muslim society, where attending religious services is a common practice. Additionally, my individual values and personal experience, as well as my socioeconomic background as part of the working class, would also play a role in my decision. The nuance of the question also matters, as it is important to consider the specific wording and implications. \n\n3"]}, {"persona": {"region": "Giza", "sex": "female", "age": 56, "country": "Egypt", "marital_status": "married", "education": "middle", "social_class": "working class"}, "question": {"id": "Q171", "variant": 0}, "response": ["Based on the anthropological framework, as a married female from Giza, Egypt, of working class background, cultural context and individual values and personal experience greatly influence my perception and attendance of religious services. In Egypt, religion is a central aspect of daily life and societal norms, and as a middle-aged woman, I have likely been raised with strong religious values and have experienced the importance of attending religious services regularly. Additionally, as a member of the working class, my socioeconomic background may also play a role in my religious practices, as religious affiliation and attendance can often be tied to community and social connections. Therefore, considering my cultural context, personal experience, and socioeconomic background, I would likely attend religious services (2) Once a week. \n\n2"]}, {"persona": {"region": "Giza", "sex": "male", "age": 31, "country": "Egypt", "marital_status": "married", "education": "higher", "social_class": "lower middle class"}, "question": {"id": "Q171", "variant": 0}, "response": ["Based on the anthropological framework, my perspective as a married male from Giza, Egypt, who is 31 years old, completed higher education, and considers himself part of the lower middle class, will be influenced by my cultural context, individual values, and socioeconomic background. In Egypt, religion plays a significant role in daily life, and as a member of the lower middle class, I may find solace and community in attending religious services. Additionally, my personal experience and values may lead me to prioritize regular attendance at religious services as a source of spiritual guidance and social connection. Therefore, I would choose option (2) Once a week.\n\n2"]}, {"persona": {"region": "Giza", "sex": "male", "age": 28, "country": "Egypt", "marital_status": "single", "education": "middle", "social_class": "working class"}, "question": {"id": "Q171", "variant": 0}, "response": ["Based on the anthropological framework, as a single male from Giza, Egypt, age 28, with a middle education level, and part of the working class, my answer to the question of how frequently I attend religious services would be influenced by my cultural context, individual values, and socioeconomic background. In Egypt, religion plays a significant role in daily life and social interactions. My working-class status and limited educational attainment may lead me to prioritize practical needs over religious attendance, as I likely have long work hours and financial responsibilities. Additionally, my cultural context may shape my religious beliefs and practices, potentially leading me to attend religious services on special holy days or less often due to time and financial constraints. Therefore, the most likely choice from this perspective would be option (4) Only on special holy days.\n\n4"]}, {"persona": {"region": "Giza", "sex": "male", "age": 47, "country": "Egypt", "marital_status": "married", "education": "middle", "social_class": "lower middle class"}, "question": {"id": "Q171", "variant": 0}, "response": ["Based on the anthropological framework outlined above, my perspective as a married male from Giza, Egypt, who is 47 years old and part of the lower middle class, is deeply influenced by my cultural context, individual values, and socioeconomic background. In Egypt, religion plays a significant role in people's lives, and attending religious services is a common practice. As a member of the lower middle class, I may not have the same leisure time or resources as those from higher socioeconomic backgrounds to attend religious services more frequently. Additionally, my personal experience and values may lead me to prioritize other aspects of my life over religious attendance. Therefore, my choice of how frequently I attend religious services would be influenced by these factors.\n\n6"]}, {"persona": {"region": "Giza", "sex": "male", "age": 26, "country": "Egypt", "marital_status": "single", "education": "middle", "social_class": "lower middle class"}, "question": {"id": "Q171", "variant": 0}, "response": ["Based on the anthropological framework, I, as a single male from Giza, Egypt, would consider the emic perspective of this question. Religion plays a significant role in the cultural context of Egypt, and the local community values religious observance. However, my individual values and personal experience as a lower middle class individual who has completed only middle education level may lead me to have less frequent religious attendance due to work or financial constraints. Additionally, the socioeconomic background and lack of access to transportation may also limit my ability to attend religious services frequently. Therefore, taking into account the cultural relativism and nuanced phrasing of the question, I would choose option (3) Once a month.\n\n3"]}, {"persona": {"region": "Giza", "sex": "male", "age": 48, "country": "Egypt", "marital_status": "married", "education": "middle", "social_class": "upper middle class"}, "question": {"id": "Q171", "variant": 0}, "response": ["Based on my emic perspective, as a married male from Giza, Egypt, attending religious services is a significant part of my cultural context and personal experience. My cultural background and socioeconomic status as part of the upper middle class in Egypt have instilled in me a strong sense of religious duty and commitment. Additionally, the societal expectations and values of my community also play a role in my decision. Furthermore, the nuanced phrasing of the question and the understanding of cultural relativism are important in my response. Considering all these factors, I choose option (2) Once a week. Thank you for understanding my perspective. \n\n2"]}, {"persona": {"region": "Menya", "sex": "male", "age": 61, "country": "Egypt", "marital_status": "married", "education": "middle", "social_class": "working class"}, "question": {"id": "Q171", "variant": 0}, "response": ["In Menya, Egypt, religious practices and beliefs are deeply entrenched in the cultural context. As a married male at the age of 61, I have grown up in a community where attending religious services is a significant part of life, especially for those who consider themselves part of the working class. The cultural relativism within our community dictates that religious observance is highly valued and respected, and as such, it is important for individuals to attend religious services regularly as a way to demonstrate their commitment to their faith and community. Moreover, my personal experience and individual values have instilled in me the importance of regular religious attendance as a way to connect with my community and express my devotion to my faith. Therefore, from this perspective, I would choose option (2) Once a week. \n\n2"]}, {"persona": {"region": "Menya", "sex": "male", "age": 41, "country": "Egypt", "marital_status": "married", "education": "middle", "social_class": "lower middle class"}, "question": {"id": "Q171", "variant": 0}, "response": ["From the perspective of a married male from Menya, Egypt, who is 41 years old, completed middle education level, and considers himself part of the lower middle class, the answer to the question of how frequently he attends religious services would be influenced by various factors. The cultural context in Menya, Egypt is deeply rooted in Islamic traditions, with religious practices being an integral part of daily life. The individual values and personal experience of this persona would likely emphasize the importance of religious observance and the role of faith in the community. Additionally, the socioeconomic background and class of this persona may also play a role in shaping his religious practices, as lower middle class individuals may have different levels of access and opportunity for religious participation compared to those in higher socioeconomic brackets. Therefore, the chosen answer reflects the influence of these factors in the persona's decision regarding religious attendance.\n\n6"]}, {"persona": {"region": "Menya", "sex": "female", "age": 43, "country": "Egypt", "marital_status": "married", "education": "higher", "social_class": "working class"}, "question": {"id": "Q171", "variant": 0}, "response": ["Based on the anthropological framework, as a married female from Menya, Egypt, my emic perspective on attending religious services is influenced by my cultural context, individual values, and socioeconomic background. In Menya, religion is a central part of our cultural identity and daily life. As a member of the working class, I have limited free time due to my job and family responsibilities. However, my personal values and upbringing instill a deep reverence for religious practices. Therefore, I prioritize attending religious services once a week to maintain a connection with my community and spiritual beliefs.\n\n2"]}, {"persona": {"region": "Menya", "sex": "male", "age": 57, "country": "Egypt", "marital_status": "married", "education": "middle", "social_class": "lower middle class"}, "question": {"id": "Q171", "variant": 0}, "response": ["Based on my cultural context as a married male from Menya, Egypt, religion plays a significant role in my life. The emic perspective within my community emphasizes the importance of regular religious attendance, and my personal experience and values align with this belief. Additionally, my lower middle class socioeconomic background and age of 57 further reinforce the significance of religious practice in my life. Given these factors, I attend religious services once a week to fulfill my religious and cultural obligations and to maintain a sense of community and tradition.\n\n2"]}, {"persona": {"region": "Menya", "sex": "male", "age": 42, "country": "Egypt", "marital_status": "divorced", "education": "middle", "social_class": "lower middle class"}, "question": {"id": "Q171", "variant": 0}, "response": ["Based on the anthropological framework, as a divorced male from Menya, Egypt, my emic perspective on attending religious services is heavily influenced by my cultural context and individual values. Menya is known for its strong religious traditions and being a divorced male might also impact my involvement in religious services. As someone from the lower middle class, my socioeconomic background also plays a role in how frequently I attend religious services, as I may have work and family responsibilities that limit my ability to attend regularly. Therefore, I would choose the following option:\n\n6"]}, {"persona": {"region": "Menya", "sex": "female", "age": 59, "country": "Egypt", "marital_status": "married", "education": "middle", "social_class": "upper middle class"}, "question": {"id": "Q171", "variant": 0}, "response": ["Based on the anthropological framework, as a married female from Menya, Egypt, my cultural context is deeply rooted in the local religious practices and beliefs. Religion plays a significant role in the daily lives of the community, and my personal values and experiences have been shaped by this cultural context. As a member of the upper middle class, I have the resources and social status to actively participate in religious services and events. Additionally, my age and socioeconomic background also play a role in my religious practices. Therefore, my answer to the question of how frequently I attend religious services would be:\n\n2) Once a week"]}, {"persona": {"region": "Menya", "sex": "female", "age": 31, "country": "Egypt", "marital_status": "married", "education": "middle", "social_class": "working class"}, "question": {"id": "Q171", "variant": 0}, "response": ["Based on the anthropological framework, my emic perspective as a married female from Menya, Egypt, in the working-class who has completed middle education, is heavily influenced by my cultural context. In Menya, religious practices and beliefs are deeply ingrained in everyday life, and attending religious services is a common practice for individuals of my socio-economic background. Additionally, my personal experience and individual values also play a significant role in shaping my religious practices. Therefore, from my perspective, attending religious services once a week (2) is the most appropriate option as it aligns with the cultural and social expectations of my community and reflects my own personal values and beliefs."]}, {"persona": {"region": "Menya", "sex": "male", "age": 55, "country": "Egypt", "marital_status": "single", "education": "middle", "social_class": "working class"}, "question": {"id": "Q171", "variant": 0}, "response": ["Based on my cultural context as a single male from Menya, Egypt, religion plays a significant role in my life. The community I belong to places a high value on religious practices and attending religious services is a common and regular occurrence. As a member of the working class, I have been brought up to prioritize religious observance as a way to connect with my community and seek spiritual guidance. Additionally, my age and the cultural norms of my society dictate that I attend religious services as a form of social and communal engagement. Therefore, I would choose option (2) Once a week. \n\n2"]}, {"persona": {"region": "Menya", "sex": "female", "age": 28, "country": "Egypt", "marital_status": "married", "education": "higher", "social_class": "lower middle class"}, "question": {"id": "Q171", "variant": 0}, "response": ["Based on the anthropological framework, my answer to the question of how frequently I attend religious services is influenced by my emic perspective as a married female from Menya, Egypt. The cultural context of Menya is predominantly Islamic, with a strong emphasis on religious practices and beliefs. My personal experience and individual values also play a significant role in my religious practices, as I have been raised in a religious family and community. Additionally, my socioeconomic background as part of the lower middle class informs my access to religious services and the time I can allocate to attending them. Considering these factors, I would choose the option:\n(3) Once a month"]}, {"persona": {"region": "Menya", "sex": "male", "age": 24, "country": "Egypt", "marital_status": "single", "education": "middle", "social_class": "working class"}, "question": {"id": "Q171", "variant": 0}, "response": ["From the perspective of a single male from Menya, Egypt, the emic and etic perspectives play a significant role in shaping the understanding of religious practices. The cultural context of Menya, Egypt is deeply rooted in Islamic traditions and beliefs, with religious practices being a central part of everyday life. As a working-class individual with middle education level, my personal values and experiences have been shaped by the importance of religious observance within my community. Additionally, my socioeconomic background influences the frequency of my religious attendance, as financial constraints may limit my ability to attend services regularly. Considering the cultural relativism and the nuanced phrasing of the question, it is important to choose an option that aligns with the religious and cultural norms of Menya, Egypt, as well as my personal circumstances.\n\n4"]}, {"persona": {"region": "Menya", "sex": "female", "age": 23, "country": "Egypt", "marital_status": "married", "education": "middle", "social_class": "working class"}, "question": {"id": "Q171", "variant": 0}, "response": ["Based on the anthropological framework, as a married female from Menya, Egypt, my emic perspective on religious services is influenced by my cultural context, individual values, and socioeconomic background. In Menya, religious practices are deeply ingrained in daily life and are a core part of our cultural context. As a working-class woman, my access to education and resources may also impact my religious practices. Additionally, my age and place in society will influence how frequently I attend religious services. Considering all these factors, I would choose option (2) Once a week, as it reflects the religious practices and values that are important to me and my community. \n\n2"]}, {"persona": {"region": "Menya", "sex": "male", "age": 27, "country": "Egypt", "marital_status": "single", "education": "middle", "social_class": "lower middle class"}, "question": {"id": "Q171", "variant": 0}, "response": ["Based on the anthropological framework, my answer to the question of how frequently I attend religious services is influenced by multiple factors. Firstly, my cultural context as a member of the Menya community in Egypt places a high value on religious practices and observance. Additionally, my lower middle class socioeconomic background and middle level education level have instilled in me a strong sense of community and tradition, which often includes regular attendance at religious services. Furthermore, my personal experience and individual values emphasize the importance of spirituality and connection to my community, leading me to prioritize regular attendance at religious services. Therefore, my answer is: \n\n2) Once a week"]}, {"persona": {"region": "Asyut", "sex": "male", "age": 30, "country": "Egypt", "marital_status": "married", "education": "middle", "social_class": "working class"}, "question": {"id": "Q171", "variant": 0}, "response": ["Based on the anthropological framework, as a married male from Asyut, Egypt, my emic perspective on attending religious services is influenced by my cultural context, individual values, and socioeconomic background. In Asyut, religion plays a significant role in daily life, and attending religious services is a communal and cultural practice. As a working-class individual with a middle education level, I am likely to prioritize religious observance as a way to connect with my community and maintain traditional values. Additionally, my personal experiences and values may align with the importance of religious attendance. Therefore, I would choose option (2) Once a week, as it reflects my understanding of the cultural and social significance of religious services in my community.\n\n2"]}, {"persona": {"region": "Asyut", "sex": "female", "age": 26, "country": "Egypt", "marital_status": "married", "education": "middle", "social_class": "working class"}, "question": {"id": "Q171", "variant": 0}, "response": ["Based on the anthropological framework, as a married female from Asyut, Egypt, my cultural context and religious beliefs are deeply intertwined. As a member of the working class, my socioeconomic background also plays a significant role in my religious practices. In Asyut, religion is a central part of daily life and community, and as a result, attending religious services is a frequent and important part of my routine. Additionally, my personal values and individual experience contribute to my strong connection to religious practices. Considering all these factors, my answer would be:\n\n2) Once a week"]}, {"persona": {"region": "Asyut", "sex": "male", "age": 32, "country": "Egypt", "marital_status": "single", "education": "higher", "social_class": "lower middle class"}, "question": {"id": "Q171", "variant": 0}, "response": ["Based on the anthropological framework, as a single male from Asyut, Egypt, my emic perspective and cultural context would heavily influence my answer to this question. Religion plays a significant role in the daily lives of people in Asyut, and as a member of the lower middle class, it is likely that I would prioritize attending religious services. Personal experience and individual values also come into play, as my upbringing and education may have instilled a strong sense of religious devotion. Additionally, my socioeconomic background may limit my ability to participate in leisure activities, making religious services a primary form of communal and spiritual engagement. Therefore, my answer to the question would be:\n\n2) Once a week"]}, {"persona": {"region": "Asyut", "sex": "female", "age": 21, "country": "Egypt", "marital_status": "married", "education": "middle", "social_class": "working class"}, "question": {"id": "Q171", "variant": 0}, "response": ["Based on the anthropological framework, as a married female from Asyut, Egypt, cultural context is pivotal in understanding and answering this question. As a member of the working class from Asyut, the cultural context and socioeconomic background play a significant role in my religious practices. Additionally, individual values and personal experiences also influence my perception of religious services. Given my background and cultural context, I would choose option (2) Once a week, as attending religious services is an important aspect of my life and is a common practice in my community."]}, {"persona": {"region": "Asyut", "sex": "female", "age": 30, "country": "Egypt", "marital_status": "married", "education": "higher", "social_class": "working class"}, "question": {"id": "Q171", "variant": 0}, "response": ["Based on the anthropological framework, as a married female from Asyut, Egypt, cultural context plays a pivotal role in my religious practices. As a member of the working class, my socioeconomic background influences the time and resources I have available to attend religious services. Additionally, being 30 years old and having completed higher education, my individual values and personal experiences have shaped my perception of religion. The cultural relativism of my community also impacts my religious practices, as well as my understanding of space and time. Therefore, I choose the following option:\n\n3"]}, {"persona": {"region": "Asyut", "sex": "female", "age": 42, "country": "Egypt", "marital_status": "married", "education": "higher", "social_class": "lower middle class"}, "question": {"id": "Q171", "variant": 0}, "response": ["Based on the anthropological framework, my response is influenced by my cultural context as a married female from Asyut, Egypt, where religion plays a significant role in the community. Additionally, my individual values and personal experience, as well as my lower middle-class socioeconomic background, influence my decision. Moreover, age and place, as well as nuanced phrasing of the question, are also important factors. Therefore, my response is as follows:\n\n3\n\n(3) Once a month"]}, {"persona": {"region": "Sohag", "sex": "male", "age": 63, "country": "Egypt", "marital_status": "married", "education": "middle", "social_class": "lower middle class"}, "question": {"id": "Q171", "variant": 0}, "response": ["Based on the anthropological framework, as a married male from Sohag, Egypt, with a lower middle-class socioeconomic background, my religious attendance is heavily influenced by my cultural context and individual values. In Sohag, religion plays a significant role in daily life and is deeply embedded in the cultural fabric. Additionally, my age and upbringing have instilled in me a strong sense of religious duty and commitment. However, due to my lower middle-class status and the demands of providing for my family, I may not have the means or time to attend religious services more than once a week. Therefore, my religious attendance would likely be influenced by a combination of cultural context, individual values, and socioeconomic background. \n\n3"]}, {"persona": {"region": "Sohag", "sex": "male", "age": 27, "country": "Egypt", "marital_status": "married", "education": "middle", "social_class": "working class"}, "question": {"id": "Q171", "variant": 0}, "response": ["Based on the anthropological framework, as a married male from Sohag, Egypt, my emic perspective on attending religious services is heavily influenced by the cultural context of my community, which places a strong emphasis on religious practices and traditions. Additionally, my individual values and personal experiences have shaped my understanding of the importance of attending religious services as a means of spiritual fulfillment and connection to my community. Furthermore, my socioeconomic background as a working-class individual in Sohag has also influenced my decision, as I may have limited time and resources to attend religious services frequently. Considering all these factors, I would choose option (2) Once a week for attending religious services. \n\n2"]}, {"persona": {"region": "Sohag", "sex": "male", "age": 56, "country": "Egypt", "marital_status": "married", "education": "higher", "social_class": "upper middle class"}, "question": {"id": "Q171", "variant": 0}, "response": ["Based on the anthropological framework, as a married male from Sohag, Egypt, my religious practices are heavily influenced by my cultural context, individual values, and personal experience. Living in a predominantly Muslim country, religion plays a significant role in shaping my daily life. Additionally, my higher education level and upper middle class status may contribute to my commitment to religious services, as education and socioeconomic background can influence religious practices. Considering the importance of kinship networks and community ties in Egyptian society, I am likely to attend religious services more frequently to maintain social connections and uphold traditional values. Therefore, I would choose option (1) More than once a week to attend religious services. \n\n1"]}, {"persona": {"region": "Sohag", "sex": "male", "age": 51, "country": "Egypt", "marital_status": "married", "education": "higher", "social_class": "lower middle class"}, "question": {"id": "Q171", "variant": 0}, "response": ["Based on the anthropological framework, my answer is influenced by my cultural context as a married male from Sohag, Egypt, where religion plays a significant role in daily life. As a member of the lower middle class with a higher education level, my individual values and personal experience also shape my religious practices. In Sohag, the cultural context emphasizes the importance of attending religious services as a way to connect with the community and express devotion. Additionally, my socioeconomic background and age contribute to my commitment to religious practices. Therefore, my answer is (2) Once a week."]}, {"persona": {"region": "Sohag", "sex": "female", "age": 26, "country": "Egypt", "marital_status": "married", "education": "higher", "social_class": "working class"}, "question": {"id": "Q171", "variant": 0}, "response": ["From an emic perspective, as a married female from Sohag, Egypt, religious services are a central part of my cultural context. The socio-economic background plays a role as well, as I consider myself part of the working class. My personal experience and individual values also contribute to my answer. In Sohag, religion is deeply ingrained in the social fabric and is a significant part of daily life. Therefore, based on my cultural context and personal experience, I would attend religious services once a week as it is a regular and important practice in my community.\n\n2"]}, {"persona": {"region": "Sohag", "sex": "female", "age": 29, "country": "Egypt", "marital_status": "married", "education": "higher", "social_class": "upper middle class"}, "question": {"id": "Q171", "variant": 0}, "response": ["From an emic perspective, as a married female from Sohag, Egypt, my cultural context and individual values are deeply rooted in the religious practices and beliefs of my community. The majority of people in Sohag are devout Muslims, and it is common for individuals to attend religious services frequently as a way to connect with their faith and community. Additionally, my socioeconomic background as part of the upper middle class allows me the time and resources to prioritize religious attendance. Furthermore, the nuance of the question allows me to express my commitment to my faith while also considering the practicality of my current lifestyle. With all these factors in mind, I would choose option (1) More than once a week. \n\n1"]}, {"persona": {"region": "Sohag", "sex": "male", "age": 51, "country": "Egypt", "marital_status": "married", "education": "middle", "social_class": "lower middle class"}, "question": {"id": "Q171", "variant": 0}, "response": ["Based on the anthropological framework, my perspective is heavily influenced by my cultural context, especially being from Sohag, Egypt, where religion plays a significant role in daily life. Being a married male in my early 50s, with a middle education level and considering myself part of the lower middle class, my personal experience and socioeconomic background also influence my religious practices. In Sohag, it is common for individuals in my demographic to attend religious services once a week as it is a significant part of our cultural and social fabric, and my personal values align with this. Additionally, my age and place in society also play a role in shaping my religious practices, with the expectation that I attend services regularly. Therefore, based on my perspective and the factors influencing it, I choose option (2) Once a week. \n\n2"]}, {"persona": {"region": "Qena", "sex": "male", "age": 32, "country": "Egypt", "marital_status": "single", "education": "middle", "social_class": "working class"}, "question": {"id": "Q171", "variant": 0}, "response": ["Based on the anthropological framework, my perspective as a single male from Qena, Egypt, who is 32 years old and part of the working class, is heavily influenced by my cultural context and individual values. Qena is known for its strong religious beliefs and practices, and as a member of the working class, my socioeconomic background also plays a role in my religious practices. Additionally, my middle education level and age contribute to my understanding of religion and its importance in my life. Therefore, I would choose:\n\n2) Once a week"]}, {"persona": {"region": "Qena", "sex": "male", "age": 54, "country": "Egypt", "marital_status": "married", "education": "middle", "social_class": "lower middle class"}, "question": {"id": "Q171", "variant": 0}, "response": ["From the perspective of a married male from Qena, Egypt, my answer to the question of how frequently I attend religious services is heavily influenced by the cultural context and individual values. In Qena, religion is deeply ingrained in our everyday lives and is a central aspect of our cultural identity. As a middle-aged man, I have been raised to place a high value on religious observance and attending religious services is a significant part of my routine. Additionally, being part of the lower middle class, I find solace and community in attending religious services, providing a sense of belonging and support. Therefore, my choice reflects both my personal values and the cultural context in which I am situated.\n\n2"]}, {"persona": {"region": "Qena", "sex": "male", "age": 25, "country": "Egypt", "marital_status": "single", "education": "lower", "social_class": "lower class"}, "question": {"id": "Q171", "variant": 0}, "response": ["Based on the anthropological framework, as a single male from Qena, Egypt, with a lower education level and part of the lower class, my cultural context and socioeconomic background play a significant role in my religious practices. Qena is known for its conservative and traditional values, and being part of the lower class means that religion is likely a central aspect of my life, providing a sense of community and belonging. Additionally, my limited access to education may lead me to place greater value on religious teachings and practices as a source of guidance and support. Therefore, considering my cultural context, socioeconomic background, and the importance of religion in my community, I would choose the following answer:\n\n6"]}, {"persona": {"region": "Aswan", "sex": "male", "age": 34, "country": "Egypt", "marital_status": "single", "education": "middle", "social_class": "lower class"}, "question": {"id": "Q171", "variant": 0}, "response": ["Based on the anthropological framework, as a single male from Aswan, Egypt, my emic perspective on attending religious services is heavily influenced by my cultural context and socio-economic background. As a member of the lower class in a predominantly Muslim society, religion plays a significant role in my life. My personal experience and individual values also contribute to the importance of religious services in my daily life. Additionally, the nuance of the question is important, as the wording may influence my answer. Therefore, my chosen option is number 2, attending religious services once a week. \n\n2"]}, {"persona": {"region": "Aswan", "sex": "female", "age": 31, "country": "Egypt", "marital_status": "married", "education": "middle", "social_class": "lower middle class"}, "question": {"id": "Q171", "variant": 0}, "response": ["Based on my emic perspective as a married woman from Aswan, Egypt, the frequency of attending religious services is deeply tied to my cultural context and personal experience. As a member of the lower middle class, my socioeconomic background plays a role in my religious practices. Additionally, the cultural context of Aswan, Egypt, emphasizes the importance of religious observance in daily life. Furthermore, the nuance of the question also plays a role in my answer, as the phrasing of \"religious services\" may differ in interpretation. Therefore, my personal experience, cultural context, and nuanced understanding of the question lead me to choose the following option:\n\n6"]}, {"persona": {"region": "Aswan", "sex": "female", "age": 39, "country": "Egypt", "marital_status": "married", "education": "middle", "social_class": "working class"}, "question": {"id": "Q171", "variant": 0}, "response": ["Based on the anthropological framework, as a married female from Aswan, Egypt, my emic perspective is influenced by the deeply religious and traditional culture of my community. The cultural context of Aswan, Egypt, emphasizes the importance of religion in daily life, with Islam being the predominant religion. My personal experience and individual values are shaped by the religious teachings and practices that have been instilled in me since childhood. As a member of the working class, my socioeconomic background also contributes to my religious practices, as attending religious services is a way for me to find solace and community support. Additionally, the nuance of the question is important, and my understanding of the frequency of attending religious services is based on the cultural norms and expectations of my community.\n\n3"]}, {"persona": {"region": "Qena", "sex": "female", "age": 27, "country": "Egypt", "marital_status": "married", "education": "lower", "social_class": "lower middle class"}, "question": {"id": "Q171", "variant": 0}, "response": ["Based on the anthropological framework, my cultural context as a married female from Qena, Egypt, plays a significant role in my religious practices. The emic perspective within my community places a strong emphasis on regular attendance at religious services, and my personal experience and individual values align with this expectation. Additionally, my lower middle class socioeconomic background also influences my religious practices, as attending religious services is often seen as a way to seek comfort and community support. My age and place further contribute to the importance of religious observance in my life. Therefore, I select option (2) Once a week."]}, {"persona": {"region": "Qena", "sex": "male", "age": 40, "country": "Egypt", "marital_status": "single", "education": "middle", "social_class": "lower middle class"}, "question": {"id": "Q171", "variant": 0}, "response": ["Based on my personal experience and values, as well as my cultural background and socioeconomic status, I understand the importance of religious services in my community. Living in Qena, Egypt, religion plays a significant role in our daily lives and is an essential part of our cultural context. Despite my lower middle class status, I have been brought up to value the importance of attending religious services regularly as a way of connecting with my community and practicing my faith. Additionally, the cultural relativism in Egypt means that religious observance is highly valued and respected. Therefore, my religious attendance would likely be in line with the expectations and norms of my community.\n\n3"]}, {"persona": {"region": "Qena", "sex": "male", "age": 30, "country": "Egypt", "marital_status": "single", "education": "middle", "social_class": "working class"}, "question": {"id": "Q171", "variant": 0}, "response": ["Based on my experience and cultural context as a single male from Qena, Egypt, I understand that religion plays a significant role in the lives of many individuals in my community. As a member of the working class, I have limited resources and time to attend religious services frequently. However, my personal values and upbringing have instilled in me a deep respect for religious traditions. Therefore, I typically attend religious services once a month to connect with my community and maintain my spiritual well-being.\n\n3"]}]