[{"persona": {"region": "Fayoum", "sex": "male", "age": 46, "country": "Egypt", "marital_status": "married", "education": "higher", "social_class": "lower middle class"}, "question": {"id": "Q127", "variant": 0}, "response": ["Based on the anthropological framework, my understanding of immigration in my country is heavily influenced by my cultural context, individual values, and socioeconomic background. As a married male from Fayoum, Egypt, I am part of the lower middle class and have completed higher education. My perspective on immigration and its impact on poor people is shaped by the socioeconomic background of my community, which may lead me to believe that immigration can provide opportunities for poor people to establish new lives. Additionally, my individual values and personal experiences may lead me to see immigration as a means of social mobility and a way to escape poverty. From this perspective, I would choose option (1) Agree."]}, {"persona": {"region": "Fayoum", "sex": "female", "age": 30, "country": "Egypt", "marital_status": "married", "education": "middle", "social_class": "lower middle class"}, "question": {"id": "Q127", "variant": 0}, "response": ["Based on the anthropological framework, as a married female from Fayoum, Egypt, I would consider the cultural context, individual values, and socioeconomic background as pivotal in my answer to the question. In Egypt, immigration may be seen as a way for poor people to establish new lives, especially for those from lower middle class backgrounds like myself. The cultural context in Egypt, along with individual values and personal experiences, may lead to the belief that immigration can provide opportunities for a better life for the less privileged. Additionally, considering the socioeconomic background, lower middle class individuals may view immigration as a means of upward social mobility. Therefore, my answer to the question would be: \n\n2"]}, {"persona": {"region": "Fayoum", "sex": "male", "age": 60, "country": "Egypt", "marital_status": "married", "education": "higher", "social_class": "working class"}, "question": {"id": "Q127", "variant": 0}, "response": ["Based on the anthropological framework, as a married male from Fayoum, Egypt, my emic perspective is shaped by my cultural context, individual values, and socioeconomic background. In Egypt, immigration is often seen as a way for people to seek better opportunities and escape poverty. However, my etic perspective also considers the larger cultural context and the impact of immigration on the local community and economy. Considering my working-class background and the struggles faced by the poor in my country, I believe that immigration can indeed help poor people establish new lives. It provides them with access to better job opportunities and a chance to improve their economic situation. Therefore, I would choose option (1) Agree."]}, {"persona": {"region": "Fayoum", "sex": "male", "age": 20, "country": "Egypt", "marital_status": "single", "education": "middle", "social_class": "lower middle class"}, "question": {"id": "Q127", "variant": 0}, "response": ["Based on the anthropological framework, I, as a single male from Fayoum, Egypt, place great emphasis on cultural context and socioeconomic background. Coming from a lower middle class background, I understand the struggles and challenges that people in similar situations face. The cultural context of Egypt also plays a significant role in shaping my perspective on immigration. I believe that immigration can provide opportunities for poor people to establish new lives, as it can offer access to better job prospects and living conditions. However, I also recognize that immigration can come with its own set of challenges and difficulties, particularly for those who are economically disadvantaged. Overall, I would say that I agree with the statement that immigration can help poor people establish new lives, but I also acknowledge that it is a complex issue with no simple answer.\n\n2"]}, {"persona": {"region": "Fayoum", "sex": "female", "age": 39, "country": "Egypt", "marital_status": "married", "education": "higher", "social_class": "lower middle class"}, "question": {"id": "Q127", "variant": 0}, "response": ["Based on the anthropological framework, my perspective as a married female from Fayoum, Egypt, who is 39 years old, has completed higher education, and considers herself part of the lower middle class is shaped by my cultural context, individual values, and socioeconomic background. In Egypt, immigration is often seen as a way for poor people to establish new lives, especially considering the limited economic opportunities available. Additionally, my personal experience and understanding of the challenges faced by the poor in my country lead me to believe that immigration can provide a pathway to improve their economic circumstances. Therefore, I would choose option (1) Agree."]}, {"persona": {"region": "Fayoum", "sex": "male", "age": 33, "country": "Egypt", "marital_status": "married", "education": "higher", "social_class": "working class"}, "question": {"id": "Q127", "variant": 0}, "response": ["Based on the anthropological framework, my cultural context as a married male from Fayoum, Egypt, my socioeconomic background as part of the working class, and my individual values and personal experience, I believe that immigration in my country does help poor people establish new lives. In Egypt, many people from rural areas migrate to urban centers in search of better economic opportunities. This movement is often driven by poverty and the hope of creating a better life for their families. I also believe in cultural relativism, understanding that the experiences and opportunities available to individuals in different regions may vary. Therefore, I believe that immigration can provide an opportunity for individuals to improve their socioeconomic status and access better resources, even though it may also come with its challenges. \n\n1"]}, {"persona": {"region": "Port Said", "sex": "female", "age": 45, "country": "Egypt", "marital_status": "married", "education": "higher", "social_class": "lower middle class"}, "question": {"id": "Q127", "variant": 0}, "response": ["From the perspective of a married female from Port Said, Egypt, with a lower middle-class background, the emic perspective on immigration is likely to be influenced by personal experiences and individual values. The cultural context of Egypt and the socioeconomic background of being part of the lower middle class will also play a significant role in shaping the perception of immigration and its impact on the poor. Furthermore, the understanding of cultural relativism and the nuanced phrasing of the question will contribute to a specific viewpoint on this issue.\n\n2"]}, {"persona": {"region": "Port Said", "sex": "male", "age": 42, "country": "Egypt", "marital_status": "married", "education": "middle", "social_class": "lower middle class"}, "question": {"id": "Q127", "variant": 0}, "response": ["From the emic perspective, as a married male from Port Said, Egypt, I would consider the impact of immigration on poor people from the cultural context of my home country. Egypt has historically been a destination for immigrants due to its geopolitical location and economic opportunities. However, the individual values and personal experiences of poor people seeking to establish new lives through immigration may vary based on their socioeconomic background. The lower middle-class status and completed middle education level of individuals like myself may lead to a nuanced understanding of immigration, recognizing the potential for both positive and negative impacts. Therefore, based on my personal experience and cultural context, I would choose:\n2"]}, {"persona": {"region": "Port Said", "sex": "male", "age": 28, "country": "Egypt", "marital_status": "single", "education": "middle", "social_class": "lower middle class"}, "question": {"id": "Q127", "variant": 0}, "response": ["Based on the anthropological framework, I would approach this question by considering my emic perspective as a single male from Port Said, Egypt, who is part of the lower middle class with middle education level. My cultural context and socioeconomic background would influence my answer, as well as my individual values and personal experiences. I would also consider the cultural relativism and the nuance of the question, taking into account the specific circumstances and challenges faced by poor people in my country. All of these factors would lead me to choose the following option:\n\n2"]}, {"persona": {"region": "Port Said", "sex": "female", "age": 30, "country": "Egypt", "marital_status": "married", "education": "higher", "social_class": "lower middle class"}, "question": {"id": "Q127", "variant": 0}, "response": ["Based on the anthropological framework, my perspective as a married female from Port Said, Egypt, who is 30 years old and part of the lower middle class, is heavily influenced by my cultural context, individual values, and socioeconomic background. In Egypt, immigration is often seen as a way for poor people to establish new lives due to the limited economic opportunities available domestically. Additionally, my personal experience and the experiences of those around me have shown that immigration can provide access to better job prospects and living conditions. Considering the cultural relativism and the nuance of this issue, I would have to agree that immigration in my country helps poor people establish new lives.\n\n1"]}, {"persona": {"region": "Port Said", "sex": "male", "age": 30, "country": "Egypt", "marital_status": "divorced", "education": "middle", "social_class": "lower middle class"}, "question": {"id": "Q127", "variant": 0}, "response": ["Based on my emic perspective as a divorced male from Port Said, Egypt, I have personally witnessed the struggles of the lower middle class in my community, and I understand the impact that immigration can have on individuals seeking better opportunities. The cultural context in Egypt, particularly in Port Said, is one of limited economic prospects and social mobility for those in lower socioeconomic backgrounds, which influences my understanding of the benefits of immigration for poor people. My individual values and personal experience also play a significant role in shaping my perspective, as I have seen firsthand the challenges faced by individuals in similar circumstances. Additionally, the cultural relativism in Egypt emphasizes the importance of seeking better opportunities for oneself and one's family, which further informs my opinion. Overall, taking into account my age, education level, and socioeconomic background, I believe that immigration can indeed help poor people establish new lives, and I choose option (1) Agree."]}, {"persona": {"region": "Port Said", "sex": "female", "age": 19, "country": "Egypt", "marital_status": "single", "education": "middle", "social_class": "lower middle class"}, "question": {"id": "Q127", "variant": 0}, "response": ["From my emic perspective as a single female from Port Said, Egypt, who comes from a lower middle-class background, I understand that immigration can offer opportunities for people to improve their economic situation. The cultural context of Egypt, as well as my personal experience and socioeconomic background, have shaped my understanding of the challenges faced by poor people in my country. I also recognize the importance of cultural relativism in acknowledging that different individuals may have varying experiences and perspectives on immigration. Therefore, I believe that immigration can potentially help poor people establish new lives in my country, as it may provide them with access to better economic opportunities and resources.\n\n1"]}, {"persona": {"region": "Fayoum", "sex": "male", "age": 40, "country": "Egypt", "marital_status": "married", "education": "middle", "social_class": "working class"}, "question": {"id": "Q127", "variant": 0}, "response": ["Based on my emic perspective as a married male from Fayoum, Egypt, I understand the cultural context and socioeconomic background of my community. I am aware of the individual values and personal experiences that shape our understanding of immigration and its impact on poor people. From my working-class background and middle education level, I have seen the struggles and challenges faced by the poor in our country. I also understand the importance of cultural relativism and the nuanced phrasing of the question. Considering all these factors, I believe that immigration can potentially help poor people establish new lives, as it can provide them with opportunities for better employment and living conditions. Therefore, I choose option (1) Agree."]}, {"persona": {"region": "Fayoum", "sex": "male", "age": 23, "country": "Egypt", "marital_status": "single", "education": "higher", "social_class": "lower middle class"}, "question": {"id": "Q127", "variant": 0}, "response": ["Based on my personal experience and socioeconomic background, I believe that immigration in my country does help poor people establish new lives. As a member of the lower middle class in Fayoum, Egypt, I have seen the struggles that many people face due to economic hardship. Immigration provides an opportunity for individuals to seek better opportunities and improve their quality of life. Additionally, the cultural context and emic perspective in Egypt emphasize the importance of supporting those in need, and immigration can serve as a means for individuals to escape poverty and build a better future for themselves and their families.\n\n1"]}, {"persona": {"region": "Fayoum", "sex": "female", "age": 38, "country": "Egypt", "marital_status": "married", "education": "middle", "social_class": "lower middle class"}, "question": {"id": "Q127", "variant": 0}, "response": ["Based on the anthropological framework, my perspective as a married female from Fayoum, Egypt, is heavily influenced by my cultural context, socioeconomic background, and personal experiences. Being part of the lower middle class, I am aware of the struggles that many people in my community face, including poverty and limited opportunities. My own experiences and the experiences of those around me have shaped my understanding of immigration and its impact on poor individuals. Additionally, the cultural relativism perspective reminds me that there is no hierarchy of culture, and I must consider the nuanced phrasing of the question. Therefore, I believe that immigration in my country can indeed help poor people establish new lives because it provides opportunities for them to escape poverty and seek better economic prospects elsewhere.\n\n1"]}, {"persona": {"region": "Fayoum", "sex": "male", "age": 32, "country": "Egypt", "marital_status": "married", "education": "middle", "social_class": "lower middle class"}, "question": {"id": "Q127", "variant": 0}, "response": ["Based on the anthropological framework, my emic perspective as a married male from Fayoum, Egypt, with a middle education level and lower middle-class background, is shaped by my cultural context, individual values, and socioeconomic background. I have grown up in a community where immigration is often seen as a way to escape poverty and seek better opportunities, so I understand the potential benefits it can bring to poor people. However, my personal experience and socioeconomic background also make me aware of the challenges and difficulties that come with immigration, especially for those who may not have the resources to establish themselves in a new country. Therefore, I am inclined to choose option (2) Hard to say, as I recognize the complexities and nuances of this issue from my perspective.\n\n2"]}, {"persona": {"region": "Fayoum", "sex": "male", "age": 31, "country": "Egypt", "marital_status": "married", "education": "higher", "social_class": "working class"}, "question": {"id": "Q127", "variant": 0}, "response": ["Based on the anthropological framework, as a married male from Fayoum, Egypt, my emic perspective is influenced by my cultural context, individual values, and socioeconomic background. In Egypt, immigration is often seen as a means to escape poverty and seek better opportunities. However, the etic perspective acknowledges the complexities of immigration and its impact on the country's economy and social dynamics. Considering my working-class background and the struggles faced by many in my community, I believe that immigration can indeed help poor people establish new lives, as it provides them with the chance to access better job opportunities and improve their standard of living. Therefore, I select:\n\n1"]}, {"persona": {"region": "Fayoum", "sex": "male", "age": 31, "country": "Egypt", "marital_status": "married", "education": "middle", "social_class": "lower middle class"}, "question": {"id": "Q127", "variant": 0}, "response": ["Based on the anthropological framework, as a married male from Fayoum, Egypt, I would consider the question of immigration from the perspective of my cultural context and socioeconomic background. I come from a lower middle class background and have completed middle education level, so my understanding of immigration would be influenced by my limited economic opportunities and the struggles of my community. Additionally, the cultural relativism aspect of the framework would remind me that immigration may be viewed differently in other cultures, and my individual values and personal experience would lead me to believe that immigration could potentially help poor people establish new lives, as it may provide them with opportunities they wouldn't have in Egypt. \n\n2"]}, {"persona": {"region": "Fayoum", "sex": "female", "age": 32, "country": "Egypt", "marital_status": "married", "education": "middle", "social_class": "lower middle class"}, "question": {"id": "Q127", "variant": 0}, "response": ["Based on the anthropological framework, as a married female from Fayoum, Egypt, my perspective is heavily influenced by my cultural context, socioeconomic background, and personal experience. In Egypt, immigration often offers opportunities for a better life, especially for those from lower middle class backgrounds like mine. However, cultural relativism also plays a role in my perspective, as I understand that not everyone may share the same views. Taking into account the nuanced phrasing of the question, I would choose the option:\n2"]}, {"persona": {"region": "Ismailia", "sex": "male", "age": 53, "country": "Egypt", "marital_status": "married", "education": "middle", "social_class": "lower middle class"}, "question": {"id": "Q127", "variant": 0}, "response": ["Based on my personal experience and socioeconomic background, I believe that immigration in my country can help poor people establish new lives. As a member of the lower middle class, I have seen firsthand the struggles that many people in my community face due to limited opportunities and resources. I understand the desire for a better life and the potential benefits that immigration can bring, such as access to better jobs and education. Additionally, considering the cultural context and nuance of the situation, I believe that immigration can provide an opportunity for individuals to improve their circumstances and contribute to the growth and diversity of our society.\n\n1"]}, {"persona": {"region": "Ismailia", "sex": "male", "age": 38, "country": "Egypt", "marital_status": "married", "education": "higher", "social_class": "working class"}, "question": {"id": "Q127", "variant": 0}, "response": ["Based on the anthropological framework, as a married male from Ismailia, Egypt, my emic perspective is influenced by my cultural context, individual values, and socioeconomic background. In Egypt, immigration is often seen as a way to escape economic hardship and find better opportunities, especially for those from lower socioeconomic backgrounds. As a member of the working class, I understand the struggles and challenges that poor people face in my country, and I believe that immigration can indeed help them establish new lives. This perspective is shaped by the cultural relativism and nuance of the situation, as well as the understanding that space and time play a role in how immigration is perceived in Egypt.\n\n1"]}, {"persona": {"region": "Ismailia", "sex": "female", "age": 35, "country": "Egypt", "marital_status": "married", "education": "middle", "social_class": "lower middle class"}, "question": {"id": "Q127", "variant": 0}, "response": ["Based on the anthropological framework, my answer is influenced by my cultural context, individual values, and socioeconomic background. As a married female from Ismailia, Egypt, I am aware of the challenges faced by the lower middle class in my country. Immigration can provide opportunities for poor people to establish new lives, as it may offer access to better job opportunities and living conditions. Additionally, cultural relativism plays a role in my understanding that different perspectives on immigration exist within my country. Therefore, my answer is: \n\n2"]}, {"persona": {"region": "Ismailia", "sex": "female", "age": 57, "country": "Egypt", "marital_status": "married", "education": "lower", "social_class": "working class"}, "question": {"id": "Q127", "variant": 0}, "response": ["Based on the anthropological framework, my emic perspective as a married working-class woman from Ismailia, Egypt, with limited education and at the age of 57, leads me to consider the cultural context and socioeconomic background as pivotal in understanding and answering this question. In Egypt, immigration is often seen as a means for poor people to establish new lives, as many individuals from lower socioeconomic backgrounds seek opportunities abroad due to limited economic prospects domestically. Additionally, my personal experience and values as a member of the working class also influence my belief that immigration can provide a pathway for economic improvement. Therefore, I choose:\n2"]}, {"persona": {"region": "Ismailia", "sex": "male", "age": 33, "country": "Egypt", "marital_status": "married", "education": "middle", "social_class": "lower middle class"}, "question": {"id": "Q127", "variant": 0}, "response": ["Based on the anthropological framework, my emic perspective as a married male from Ismailia, Egypt, at the age of 33 and with a middle education level, is influenced by my cultural context, individual values, and socioeconomic background. In Egypt, immigration is often seen as a way to escape economic hardship and seek better opportunities. However, the cultural relativism of my perspective reminds me that immigration may not be the best option for everyone, especially those who are deeply rooted in their cultural and familial networks. Additionally, my lower middle-class background leads me to believe that immigration can indeed help poor people establish new lives, as it may provide them with access to better job opportunities and living conditions. Therefore, I choose option (1) Agree."]}, {"persona": {"region": "Ismailia", "sex": "female", "age": 49, "country": "Egypt", "marital_status": "single", "education": "higher", "social_class": "upper middle class"}, "question": {"id": "Q127", "variant": 0}, "response": ["From an emic perspective, as a single female from Ismailia, Egypt, my cultural context and socioeconomic background play a significant role in shaping my understanding and answer to this question. In Egypt, immigration is often seen as a means for individuals to seek better economic opportunities and improve their livelihood. As someone who considers themselves part of the upper middle class and has completed higher education, I have seen the benefits of immigration firsthand, both for myself and for others in my community. Additionally, my individual values and personal experiences have also influenced my perspective on this matter. I believe that immigration can indeed help poor people establish new lives, as it provides them with the opportunity to seek better economic prospects and escape poverty. From a cultural relativism standpoint, I understand that my perspective may differ from others, but based on my own experiences and observations, I am inclined to agree with the statement. \n\n2"]}, {"persona": {"region": "Ismailia", "sex": "female", "age": 35, "country": "Egypt", "marital_status": "married", "education": "higher", "social_class": "lower middle class"}, "question": {"id": "Q127", "variant": 0}, "response": ["Based on the anthropological framework, my perspective is heavily influenced by my cultural context, individual values, and socioeconomic background. In Ismailia, Egypt, immigration is a complex issue that is deeply tied to economic opportunities and social mobility. As a married woman from a lower middle-class background, I understand the struggles of poverty and the desire for a better life. However, I also recognize the challenges and potential cultural clashes that come with immigration. Considering the emic and etic perspectives, I believe that immigration can provide opportunities for poor people to establish new lives, but it also presents significant challenges. Therefore, my answer to the question would be: \n\n2"]}, {"persona": {"region": "Ismailia", "sex": "male", "age": 24, "country": "Egypt", "marital_status": "single", "education": "higher", "social_class": "upper middle class"}, "question": {"id": "Q127", "variant": 0}, "response": ["Based on the anthropological framework, as a single male from Ismailia, Egypt, I understand the importance of taking into account cultural context, individual values, and socioeconomic background in answering this question. In Egyptian society, there is a strong emphasis on family and community, and the cultural context is such that immigration can provide opportunities for those in lower socioeconomic backgrounds to establish new lives. As someone from the upper middle class, I recognize the privileges and opportunities that come with my socioeconomic background, and I believe that immigration can indeed help poor people establish new lives by providing them with access to better opportunities and resources. Therefore, based on my personal experience and understanding of the cultural context, I would choose the following answer:\n\n1"]}, {"persona": {"region": "Ismailia", "sex": "female", "age": 23, "country": "Egypt", "marital_status": "single", "education": "higher", "social_class": "lower middle class"}, "question": {"id": "Q127", "variant": 0}, "response": ["Based on my emic perspective, as a single female from Ismailia, Egypt, my cultural context and socioeconomic background play a significant role in shaping my views on immigration. I have seen firsthand the struggles of the lower middle class in my community, and I understand the importance of opportunities for a better life. My personal experience and individual values also influence my understanding of immigration and its potential to help those in need. Additionally, cultural relativism reminds me that my perspective is shaped by my own context and may not necessarily apply to other cultures. Therefore, I believe that immigration can indeed help poor people establish new lives, as it provides them with the opportunity to escape poverty and pursue a better future.\n\n2"]}, {"persona": {"region": "Ismailia", "sex": "male", "age": 55, "country": "Egypt", "marital_status": "married", "education": "middle", "social_class": "lower middle class"}, "question": {"id": "Q127", "variant": 0}, "response": ["Based on the anthropological framework, as a married male from Ismailia, Egypt, with a middle education level and part of the lower middle class, my perspective is shaped by my cultural context, individual values, and socioeconomic background. In Egypt, immigration can be seen as a way for poor people to seek better opportunities and improve their lives. However, I also understand that immigration can create challenges for those left behind and for the social fabric of the country. Therefore, it is hard to say definitively whether immigration helps poor people establish new lives, as it depends on the specific circumstances and individual experiences.\n\n2"]}, {"persona": {"region": "Ismailia", "sex": "male", "age": 57, "country": "Egypt", "marital_status": "married", "education": "middle", "social_class": "upper middle class"}, "question": {"id": "Q127", "variant": 0}, "response": ["Based on the anthropological framework, my emic perspective as a married male from Ismailia, Egypt, at the age of 57, with a middle education level and considering myself part of the upper middle class, is heavily influenced by my cultural context, individual values, and socioeconomic background. In Egypt, immigration can have both positive and negative effects on the country and its people. On one hand, immigration can provide opportunities for poor people to establish new lives in different countries, where they may have access to better education, healthcare, and employment opportunities. However, it can also lead to brain drain and the loss of valuable human capital for Egypt. Considering my socioeconomic background, I believe that immigration can be beneficial for poor people, as it opens up new opportunities for them and their families. Therefore, I choose option 1: Agree."]}, {"persona": {"region": "Ismailia", "sex": "female", "age": 29, "country": "Egypt", "marital_status": "married", "education": "middle", "social_class": "upper middle class"}, "question": {"id": "Q127", "variant": 0}, "response": ["Based on the anthropological framework, my perspective as a married female from Ismailia, Egypt is influenced by my cultural context, individual values, socioeconomic background, and personal experiences. In Egypt, there is a strong sense of community and helping one another, so I believe that immigration can provide opportunities for poor people to establish new lives. Additionally, as part of the upper middle class, I have seen how access to resources and opportunities can greatly impact one's ability to improve their circumstances. Therefore, I believe that immigration can be beneficial for those in need. \n\n1"]}, {"persona": {"region": "Damiatta", "sex": "female", "age": 46, "country": "Egypt", "marital_status": "married", "education": "middle", "social_class": "lower middle class"}, "question": {"id": "Q127", "variant": 0}, "response": ["From my perspective as a married female from Damiatta, Egypt, with a middle education level and part of the lower middle class, my answer to the question of whether immigration helps poor people establish new lives in my country is influenced by my cultural context, socioeconomic background, and personal experience. In Egypt, many people from lower socioeconomic backgrounds face challenges in finding stable employment and accessing resources for a better quality of life. Immigration can provide opportunities for these individuals to seek better economic prospects and access to social services in other countries. Additionally, my understanding of cultural relativism reminds me that different societies have different opportunities and challenges, and immigration may be a viable option for some individuals. Therefore, I would have to agree that immigration can help poor people establish new lives.\n\n1"]}, {"persona": {"region": "Damiatta", "sex": "female", "age": 20, "country": "Egypt", "marital_status": "single", "education": "middle", "social_class": "lower middle class"}, "question": {"id": "Q127", "variant": 0}, "response": ["Based on the anthropological framework, I will consider my emic perspective as a single female from Damiatta, Egypt, who has completed middle education level and considers herself part of the lower middle class. My cultural context and socioeconomic background have shaped my understanding of immigration in my country. I have seen how immigration has provided opportunities for some poor people to establish new lives, especially in terms of finding employment and escaping poverty. However, I am also aware of the challenges and difficulties that immigrants face, as well as the strain it can place on both the sending and receiving communities. Taking into account my individual values and personal experiences, I believe that immigration can be beneficial for some poor people, but it is not without its complexities and drawbacks. Therefore, I choose option (2) Hard to say."]}, {"persona": {"region": "Damiatta", "sex": "male", "age": 19, "country": "Egypt", "marital_status": "single", "education": "middle", "social_class": "lower middle class"}, "question": {"id": "Q127", "variant": 0}, "response": ["Based on the anthropological framework, as a 19-year-old single male from Damiatta, Egypt, with a lower-middle-class background, my perspective on immigration and its impact on the poor in my country is heavily influenced by my cultural context, individual values, and socioeconomic background. In Egypt, there are both emic and etic perspectives on immigration, with some seeing it as an opportunity for economic advancement and others viewing it as a threat to local resources and opportunities. My personal experience and values lead me to believe that immigration can be beneficial for poor individuals seeking new opportunities, as it can open up access to different resources and improve their quality of life. Additionally, my lower-middle-class background also leads me to understand the struggles faced by those in poverty, and I believe that immigration can provide them with a chance for a fresh start and improved prospects for the future.\n\n2"]}, {"persona": {"region": "Damiatta", "sex": "female", "age": 33, "country": "Egypt", "marital_status": "married", "education": "higher", "social_class": "lower middle class"}, "question": {"id": "Q127", "variant": 0}, "response": ["Based on the anthropological framework, as a married woman from Damiatta, Egypt, I am deeply rooted in my cultural context, which includes a strong sense of community and kinship networks. My individual values and personal experience, along with my lower middle-class socioeconomic background, shape my perspective on immigration. I understand the struggles of the poor in my country and believe that immigration can provide opportunities for a better life. However, I also recognize the challenges and complexities of immigration, including potential cultural barriers and discrimination. Therefore, I am inclined to say that immigration in my country can indeed help poor people establish new lives, but it is not without its difficulties. \n\n2"]}, {"persona": {"region": "Damiatta", "sex": "male", "age": 24, "country": "Egypt", "marital_status": "single", "education": "higher", "social_class": "lower middle class"}, "question": {"id": "Q127", "variant": 0}, "response": ["Based on the anthropological framework, as a single male from Damiatta, Egypt, my emic perspective is influenced by my cultural context, individual values, and socioeconomic background. In Egypt, immigration often provides opportunities for poor people to establish new lives, as it can lead to better job prospects and improved living conditions. From my personal experience and values, I believe in the potential benefits of immigration for the less fortunate. However, I also recognize the complexities and challenges that come with immigration, so it is hard to say definitively whether it always helps poor people establish new lives. \n\n2"]}, {"persona": {"region": "Suez", "sex": "male", "age": 41, "country": "Egypt", "marital_status": "married", "education": "middle", "social_class": "working class"}, "question": {"id": "Q127", "variant": 0}, "response": ["Based on the anthropological framework, my perspective as a married male from Suez, Egypt, at 41 years old with a middle education level and part of the working class is heavily influenced by my cultural context, individual values, and socioeconomic background. As an Egyptian, I understand the importance of immigration in providing opportunities for a better life, especially for those in poverty. However, I also recognize the challenges and complexities that come with immigration, such as cultural adaptation and economic competition. Therefore, I would say it is hard to say. \n\n2"]}, {"persona": {"region": "Suez", "sex": "female", "age": 39, "country": "Egypt", "marital_status": "divorced", "education": "middle", "social_class": "working class"}, "question": {"id": "Q127", "variant": 0}, "response": ["Based on the anthropological framework, as a divorced female from Suez, Egypt, aged 39 and part of the working class, my understanding and answer to the question of immigration helping poor people establish new lives would be influenced by my cultural context, socioeconomic background, and personal experience. In Egypt, there are economic challenges and limited opportunities for the working class, making it difficult to establish a stable life. Additionally, the cultural context of Egypt may lead to skepticism about the benefits of immigration, as there is a strong emphasis on tradition and family ties. Considering these factors, I would have to say that immigration may provide some opportunities, but it is hard to say whether it truly helps poor people establish new lives.\n\n2"]}, {"persona": {"region": "Cairo", "sex": "female", "age": 55, "country": "Egypt", "marital_status": "married", "education": "middle", "social_class": "working class"}, "question": {"id": "Q127", "variant": 0}, "response": ["Based on the anthropological framework, as a married female from Cairo, Egypt, at 55 years of age and part of the working class, my perspective on immigration and its impact on poor people is shaped by my emic and etic perspectives, cultural context, individual values and personal experience, socioeconomic background, cultural relativism, space and time, and nuance. In Egypt, there are significant cultural and socioeconomic factors that influence immigration and its impact on the poor. From my personal experience and understanding, immigration can offer opportunities for poor people to establish new lives in countries with better economic prospects. Therefore, I would choose option (1) Agree."]}, {"persona": {"region": "Cairo", "sex": "male", "age": 58, "country": "Egypt", "marital_status": "married", "education": "middle", "social_class": "lower middle class"}, "question": {"id": "Q127", "variant": 0}, "response": ["Based on the anthropological framework, my perspective is heavily influenced by my cultural context, socioeconomic background, and personal experience. As a married male from Cairo, Egypt, I have seen how immigration has affected individuals in my community. I understand the challenges that come with establishing a new life in a different country, especially for those from lower middle class backgrounds like myself. I also recognize the potential opportunities that immigration can bring, such as access to better job prospects and living conditions. Therefore, my answer to the question would be:\n\n2"]}, {"persona": {"region": "Cairo", "sex": "female", "age": 29, "country": "Egypt", "marital_status": "married", "education": "higher", "social_class": "lower middle class"}, "question": {"id": "Q127", "variant": 0}, "response": ["Based on the anthropological framework, my perspective as a married female from Cairo, Egypt, who is 29 years old and part of the lower middle class, is heavily influenced by my cultural context, individual values, and socioeconomic background. In Egypt, there are complex cultural norms and values surrounding immigration, and as someone from the lower middle class, I am aware of the struggles and challenges that people in similar socioeconomic positions face. Additionally, my personal experiences and the experiences of those around me have shaped my understanding of immigration and its impact on poor people. Considering these factors, I would have to say that it is hard to say whether immigration in my country helps poor people establish new lives.\n\n2"]}, {"persona": {"region": "Cairo", "sex": "male", "age": 38, "country": "Egypt", "marital_status": "married", "education": "higher", "social_class": "lower middle class"}, "question": {"id": "Q127", "variant": 0}, "response": ["Based on my emic perspective as a married male from Cairo, Egypt, I have seen firsthand the struggles of the lower middle class in our country. The cultural context in which I live has shown me the challenges that many people face in finding stable employment and providing for their families. Additionally, my individual values and personal experiences have led me to believe that immigration can offer opportunities for those in poverty to establish new lives, as it can provide access to better job prospects and living conditions. Considering my socioeconomic background and the cultural relativism of our society, I believe that immigration can be a positive force for those in need. \n\n1"]}, {"persona": {"region": "Cairo", "sex": "female", "age": 40, "country": "Egypt", "marital_status": "married", "education": "higher", "social_class": "lower middle class"}, "question": {"id": "Q127", "variant": 0}, "response": ["From the perspective of a married female from Cairo, Egypt, who is 40 years old and part of the lower middle class, several factors come into play when considering the impact of immigration on the establishment of new lives for poor people. The cultural context of Egypt, with its own history of immigration and emigration, and the current socioeconomic background of the persona, would likely influence her understanding of the benefits and challenges that come with immigration. Personal experience and individual values also play a significant role in shaping her perspective. Additionally, the nuanced phrasing of the question and the concept of cultural relativism are important considerations in understanding her response. Therefore, based on these factors, the persona might choose the following option:\n\n2"]}, {"persona": {"region": "Cairo", "sex": "male", "age": 38, "country": "Egypt", "marital_status": "married", "education": "higher", "social_class": "upper middle class"}, "question": {"id": "Q127", "variant": 0}, "response": ["Based on my emic perspective as a married male from Cairo, Egypt, I understand the importance of immigration in our country. The cultural context of Egypt is diverse, and immigration can provide opportunities for poor people to establish new lives, especially in the context of economic challenges and political instability. Additionally, individual values and personal experience, like my own, have shown that immigration can bring new perspectives and opportunities for growth. Considering the socioeconomic background and the nuance of the situation, I believe that immigration does help poor people establish new lives in Egypt. \n\n1"]}, {"persona": {"region": "Cairo", "sex": "male", "age": 59, "country": "Egypt", "marital_status": "married", "education": "middle", "social_class": "lower middle class"}, "question": {"id": "Q127", "variant": 0}, "response": ["Based on my emic perspective as a married male from Cairo, Egypt, I have witnessed how immigration has provided opportunities for poor people to establish new lives. The cultural context in Egypt includes a high population density and limited job opportunities, so many people seek better economic prospects abroad. Additionally, my lower middle-class socioeconomic background has made me aware of the struggles faced by the poor in my country, and I believe that immigration can provide them with a chance for a better life. Furthermore, considering the nuanced phrasing of the question, I recognize that immigration is not a one-size-fits-all solution, but it can certainly be a positive option for those in need. \n\n1"]}, {"persona": {"region": "Cairo", "sex": "female", "age": 30, "country": "Egypt", "marital_status": "married", "education": "higher", "social_class": "upper middle class"}, "question": {"id": "Q127", "variant": 0}, "response": ["Based on my emic perspective as a married female from Cairo, Egypt, I understand that immigration in my country can provide opportunities for poor people to establish new lives. The cultural context of Egypt, with its diverse population and historical ties to immigration, suggests that there are potential benefits for those seeking a better life. Additionally, considering my individual values and personal experiences as a member of the upper middle class, I recognize the potential for socioeconomic mobility that immigration can offer. Moreover, the cultural relativism of Egypt allows for an understanding that immigration can be a positive force for those in need. Taking into account the nuances of the question, I believe that immigration can indeed help poor people establish new lives.\n\n1"]}, {"persona": {"region": "Cairo", "sex": "male", "age": 22, "country": "Egypt", "marital_status": "single", "education": "middle", "social_class": "lower middle class"}, "question": {"id": "Q127", "variant": 0}, "response": ["Based on the anthropological framework, my perspective as a 22-year-old male from Cairo, Egypt, with a middle education level and a lower middle class background, is heavily influenced by my cultural context, socioeconomic background, and personal experiences. In Egypt, immigration is often seen as a means of improving one's economic prospects, especially for those from lower socioeconomic backgrounds. However, the cultural context and individual values also play a role in shaping my perspective. On one hand, I have seen firsthand the struggles of poverty and the limited opportunities available to those in similar circumstances. On the other hand, I am also aware of the challenges and discrimination immigrants face in establishing new lives in foreign countries. Therefore, my perspective on immigration in my country is influenced by a combination of these factors, leading me to choose option (2) Hard to say."]}, {"persona": {"region": "Cairo", "sex": "male", "age": 29, "country": "Egypt", "marital_status": "single", "education": "higher", "social_class": "lower middle class"}, "question": {"id": "Q127", "variant": 0}, "response": ["Based on the anthropological framework, my answer to the question is influenced by my emic perspective as a lower middle class individual from Cairo, Egypt. My cultural context and socioeconomic background play a significant role in my understanding and perception of immigration in my country. Additionally, my individual values and personal experiences also shape my perspective. Considering the cultural relativism and nuance, I believe that immigration can provide opportunities for poor people to establish new lives, as it may offer them access to better economic prospects and living conditions. Therefore, my answer to the question is:\n\n2"]}, {"persona": {"region": "Cairo", "sex": "female", "age": 31, "country": "Egypt", "marital_status": "married", "education": "higher", "social_class": "lower middle class"}, "question": {"id": "Q127", "variant": 0}, "response": ["Based on the anthropological framework, as a married female from Cairo, Egypt, my emic perspective is heavily influenced by my cultural context, individual values, and socioeconomic background. In Egyptian culture, family and community are highly valued, and immigration can be seen as a way for individuals to seek better opportunities and provide for their families. However, the lower middle class, to which I belong, often struggles with economic stability and may view immigration as a means of leaving behind the familiar and facing uncertainty. Additionally, cultural relativism teaches us to understand that different individuals may have diverse opinions on immigration, and the nuanced phrasing of the question leads me to choose option (2) Hard to say, as it is a complex issue with varying implications for different socioeconomic groups. \n\n2"]}, {"persona": {"region": "Cairo", "sex": "male", "age": 59, "country": "Egypt", "marital_status": "married", "education": "higher", "social_class": "upper middle class"}, "question": {"id": "Q127", "variant": 0}, "response": ["Based on the anthropological framework, my perspective as a married male from Cairo, Egypt, who is 59 years old and part of the upper middle class, is influenced by a combination of emic and etic perspectives, cultural context, individual values, socioeconomic background, cultural relativism, space and time, and nuance. In Egypt, immigration is often seen as a way for poor people to establish new lives, as it provides opportunities for economic advancement and access to better resources and opportunities. Additionally, my personal values and experiences as someone who has completed higher education and is part of the upper middle class may lead me to believe that immigration can be beneficial for those seeking a better life. However, I also recognize that there are complexities and challenges associated with immigration, and that not everyone may share the same perspective on this issue. Therefore, my answer to the question is: \n\n2"]}, {"persona": {"region": "Cairo", "sex": "male", "age": 27, "country": "Egypt", "marital_status": "single", "education": "middle", "social_class": "working class"}, "question": {"id": "Q127", "variant": 0}, "response": ["Based on the anthropological framework, as a single male from Cairo, Egypt, my emic perspective would be influenced by my cultural context, individual values, socioeconomic background, and space and time. In Egypt, immigration is often seen as a way to escape economic hardships and find better opportunities abroad. However, the etic perspective might consider the impact of immigration on the country's economy and social structure. Taking into account my working-class background and personal experience, I would have to consider the potential benefits and challenges of immigration for poor people in my country. Therefore, I believe that immigration in Egypt can help poor people establish new lives, as it may provide them with opportunities for better employment and living conditions, even if it means leaving their home country.\n\n1"]}, {"persona": {"region": "Cairo", "sex": "female", "age": 25, "country": "Egypt", "marital_status": "single", "education": "higher", "social_class": "working class"}, "question": {"id": "Q127", "variant": 0}, "response": ["Based on my personal experience and cultural context as a single female from Cairo, Egypt, I understand the importance of immigration for poor people in establishing new lives. In Egypt, many individuals from lower socioeconomic backgrounds face challenges in accessing opportunities for upward mobility. Immigration can provide a pathway for individuals to seek better economic prospects and improve their quality of life. Additionally, considering the cultural relativism and nuance of the situation, I believe that immigration can be an important tool for social and economic empowerment for those in need. \n\n1"]}, {"persona": {"region": "Cairo", "sex": "female", "age": 23, "country": "Egypt", "marital_status": "married", "education": "higher", "social_class": "lower middle class"}, "question": {"id": "Q127", "variant": 0}, "response": ["Based on the anthropological framework, my perspective as a married female from Cairo, Egypt, who is 23 years old and part of the lower middle class, is shaped by a combination of emic and etic perspectives, cultural context, individual values and personal experience, socioeconomic background, cultural relativism, space and time, and nuance. In my cultural context, immigration may be seen as a way for poor people to establish new lives, as it provides opportunities for economic improvement and social mobility. However, my individual values and personal experience, as well as my lower middle class socioeconomic background, lead me to recognize the challenges and difficulties that may be faced by immigrants in my country. Therefore, my nuanced understanding leads me to select:\n\n2"]}, {"persona": {"region": "Cairo", "sex": "male", "age": 58, "country": "Egypt", "marital_status": "married", "education": "higher", "social_class": "working class"}, "question": {"id": "Q127", "variant": 0}, "response": ["Based on the anthropological framework, as a married male from Cairo, Egypt, my emic perspective is influenced by my cultural context, individual values, and socioeconomic background. In Egypt, immigration is often seen as a way to escape economic hardship and seek better opportunities abroad. As a member of the working class, I understand the struggles of poverty and the desire for a better life. However, I also recognize the challenges immigrants face in adjusting to a new culture and the potential strain on resources in the receiving country. Considering cultural relativism, I understand that different societies may have varying perspectives on immigration and its impact on poverty. Therefore, my answer is option (2) Hard to say."]}, {"persona": {"region": "Cairo", "sex": "female", "age": 40, "country": "Egypt", "marital_status": "married", "education": "higher", "social_class": "working class"}, "question": {"id": "Q127", "variant": 0}, "response": ["Based on the anthropological framework, as a married female from Cairo, Egypt, my emic perspective is influenced by my personal experience and cultural context. Living in a densely populated city with limited job opportunities and social services, immigration may be seen as a way for poor people to establish new lives and seek better economic opportunities. Additionally, my socioeconomic background as part of the working class and my higher education level may lead me to believe that immigration can be a positive avenue for social mobility. Therefore, I would choose option (1) Agree."]}, {"persona": {"region": "Cairo", "sex": "female", "age": 36, "country": "Egypt", "marital_status": "married", "education": "middle", "social_class": "upper middle class"}, "question": {"id": "Q127", "variant": 0}, "response": ["Based on the anthropological framework described above, my answer is influenced by my emic perspective as a married female from Cairo, Egypt, considering the cultural context, individual values, and socioeconomic background. In Egypt, immigration is often seen as an opportunity for poor people to establish new lives, especially in countries with better economic opportunities. The cultural context of Egypt values the idea of seeking better opportunities for oneself and one's family. Additionally, my personal experience and values as a member of the upper middle class lead me to believe that immigration can provide a path to economic improvement for those in need. Therefore, I choose option (1) Agree."]}, {"persona": {"region": "Cairo", "sex": "male", "age": 40, "country": "Egypt", "marital_status": "married", "education": "middle", "social_class": "lower middle class"}, "question": {"id": "Q127", "variant": 0}, "response": ["Based on my cultural context as a married male from Cairo, Egypt, with a middle education level and belonging to the lower middle class, my perspective on immigration and its impact on poor people is deeply influenced by my socioeconomic background. I understand the struggles of the lower class in my country and how immigration can offer opportunities for a better life. Additionally, my personal experience and individual values lead me to believe that immigration can provide a pathway for economic improvement and social mobility for those in poverty. Therefore, I would choose option 1: Agree."]}, {"persona": {"region": "Cairo", "sex": "female", "age": 30, "country": "Egypt", "marital_status": "married", "education": "middle", "social_class": "lower class"}, "question": {"id": "Q127", "variant": 0}, "response": ["Based on the anthropological framework, my perspective is heavily influenced by my cultural context, individual values, and socioeconomic background. As a married female from Cairo, Egypt, I come from a lower-class background and have only completed middle education level, which has shaped my understanding of immigration and its impact on poor people. In Egypt, the cultural context and socioeconomic background play a significant role in how immigration is perceived. My personal experience and values also lead me to have a nuanced understanding of this issue. Considering all these factors, I choose option (2) Hard to say."]}, {"persona": {"region": "Cairo", "sex": "male", "age": 58, "country": "Egypt", "marital_status": "married", "education": "higher", "social_class": "lower middle class"}, "question": {"id": "Q127", "variant": 0}, "response": ["From the perspective of a married male from Cairo, Egypt, who is 58 years old and considers himself part of the lower middle class, my answer to the question of whether immigration in my country helps poor people establish new lives is influenced by a combination of factors. My cultural context as an Egyptian, my socioeconomic background as a lower middle class individual, and my personal experiences and values all contribute to my perspective. In Egypt, immigration is often seen as a way to seek better opportunities and escape economic hardships. However, the cultural relativism in my understanding leads me to recognize that immigration may not be the best solution for everyone. Additionally, considering the socioeconomic background of the poor people in my country, I believe that immigration can indeed provide them with new opportunities for a better life. Therefore, based on these factors, my perspective is to (1) Agree.\n\n1"]}, {"persona": {"region": "Cairo", "sex": "male", "age": 50, "country": "Egypt", "marital_status": "married", "education": "middle", "social_class": "lower middle class"}, "question": {"id": "Q127", "variant": 0}, "response": ["Based on the anthropological framework, my perspective as a married male from Cairo, Egypt, at the age of 50 and part of the lower middle class, is heavily influenced by my cultural context, socioeconomic background, and personal experience. In Egypt, immigration is often seen as a way to escape economic hardship and seek better opportunities in other countries. However, the cultural context and individual values in Egypt also emphasize the importance of family and community ties, making immigration a difficult decision for many. Additionally, as someone from the lower middle class, I am aware of the challenges and limitations that poor people face in establishing new lives, and I understand the potential benefits and drawbacks of immigration for them. Therefore, my perspective on immigration in my country is influenced by a combination of these factors, leading me to choose the following option:\n\n2"]}, {"persona": {"region": "Cairo", "sex": "female", "age": 40, "country": "Egypt", "marital_status": "married", "education": "higher", "social_class": "upper middle class"}, "question": {"id": "Q127", "variant": 0}, "response": ["Based on the anthropological framework, as a married female from Cairo, Egypt, I understand the importance of considering the emic and etic perspectives when discussing immigration. In the cultural context of Egypt, where socioeconomic background and cultural relativism play a significant role, it is crucial to acknowledge the individual values and personal experiences of those affected by immigration. As someone with higher education and a part of the upper middle class, I recognize the potential benefits of immigration for poor people in my country, as it can provide them with opportunities for a better life. Therefore, I choose option (1) Agree."]}, {"persona": {"region": "Cairo", "sex": "female", "age": 33, "country": "Egypt", "marital_status": "married", "education": "middle", "social_class": "lower middle class"}, "question": {"id": "Q127", "variant": 0}, "response": ["Based on my cultural context as a married woman from Cairo, Egypt, and my lower middle class socioeconomic background, I believe that immigration in my country does help poor people establish new lives. The emic perspective from within my community shows that many individuals and families have benefited from moving to other countries for better economic opportunities. Additionally, considering the individual values and personal experiences of people in similar circumstances, I have witnessed and heard of success stories from those who have immigrated. Cultural relativism is also important to consider, as different cultures may have varying perspectives on immigration. Therefore, based on my understanding and experiences, I would choose option (1) Agree."]}, {"persona": {"region": "Cairo", "sex": "female", "age": 37, "country": "Egypt", "marital_status": "married", "education": "middle", "social_class": "lower middle class"}, "question": {"id": "Q127", "variant": 0}, "response": ["Based on the anthropological framework, my perspective as a married female from Cairo, Egypt, would be influenced by my cultural context, socioeconomic background, and personal experience. In Egypt, there is a strong emphasis on family and community, and immigration may be seen as a way for poor people to seek better opportunities and provide for their families. However, as a member of the lower middle class, I may also feel the strain of limited resources and competition for jobs, which could lead to a more cautious or skeptical view of immigration's impact on poor people. Additionally, my personal values and experiences may shape my opinion, as I may have witnessed both success stories and struggles of immigrants in my community. Taking all of this into account, I believe my perspective leans towards option (2) Hard to say."]}, {"persona": {"region": "Cairo", "sex": "male", "age": 28, "country": "Egypt", "marital_status": "married", "education": "middle", "social_class": "lower middle class"}, "question": {"id": "Q127", "variant": 0}, "response": ["From the emic perspective, as a lower middle-class married male from Cairo, Egypt, my understanding of immigration and its impact on poor people is influenced by my cultural context, individual values, and socioeconomic background. In Egypt, there are limited economic opportunities and resources for the lower class, and immigration can provide a chance for a better life for those who are struggling. Additionally, my personal experience and values lead me to believe that immigration can be a positive step for poor people to establish new lives. Considering the cultural relativism and nuanced understanding of the question, I would choose option (1) Agree, as I believe immigration can offer opportunities for those in need."]}, {"persona": {"region": "Cairo", "sex": "male", "age": 53, "country": "Egypt", "marital_status": "married", "education": "higher", "social_class": "working class"}, "question": {"id": "Q127", "variant": 0}, "response": ["Based on my emic perspective as a married male from Cairo, Egypt, I have seen firsthand the struggles that many poor people face in my country. The cultural context of Egypt, with its economic challenges and limited opportunities, has a significant impact on how immigration is viewed. My individual values and personal experiences also play a role, as I understand the desire for a better life and opportunities that may not be available in Egypt. Additionally, my socioeconomic background as a working-class individual informs my understanding of the difficulties faced by the poor. Cultural relativism teaches me to consider the perspectives of others, and space and time are important factors as well. Ultimately, with all these considerations in mind, I believe that immigration can indeed help poor people establish new lives, providing them with opportunities they may not have in their home country.\n\n1"]}, {"persona": {"region": "Cairo", "sex": "male", "age": 45, "country": "Egypt", "marital_status": "married", "education": "higher", "social_class": "lower middle class"}, "question": {"id": "Q127", "variant": 0}, "response": ["Based on my emic perspective as a married male from Cairo, Egypt, I have been influenced by the cultural context of my country, my individual values and personal experience, and my lower middle class socioeconomic background. I have seen firsthand how immigration has helped some poor people establish new lives, providing them with opportunities for better employment and living conditions. I also understand the challenges and complexities of immigration, including the impact it can have on the local economy and social dynamics. Therefore, I believe that immigration in my country can indeed help poor people establish new lives, but it is not without its difficulties and trade-offs.\n\n2"]}, {"persona": {"region": "Cairo", "sex": "male", "age": 52, "country": "Egypt", "marital_status": "married", "education": "middle", "social_class": "upper middle class"}, "question": {"id": "Q127", "variant": 0}, "response": ["Based on the anthropological framework, my perspective as a married male from Cairo, Egypt, aged 52, and part of the upper middle class is shaped by my cultural context, individual values, and socioeconomic background. In Egypt, immigration is often seen as a way to escape economic hardship and find better opportunities. However, my background and social status may lead me to believe that immigration does not necessarily help poor people establish new lives, as I may have a more privileged view of the socioeconomic opportunities available in our country. Additionally, my age and education level may also influence my perspective, as I may have a more traditional view of migration and its impact on society. Therefore, my answer to the question would be:\n\n2"]}, {"persona": {"region": "Cairo", "sex": "male", "age": 22, "country": "Egypt", "marital_status": "single", "education": "higher", "social_class": "lower middle class"}, "question": {"id": "Q127", "variant": 0}, "response": ["Based on the anthropological framework, as a 22-year-old single male from Cairo, Egypt, I am influenced by my cultural context, individual values, and socioeconomic background. In Egypt, immigration is often seen as a way for individuals from lower middle-class backgrounds to seek better opportunities and improve their lives. However, the cultural relativism in our society also acknowledges the challenges and hardships that come with immigration. My personal experience and the experiences of those around me have shown that immigration can indeed help poor people establish new lives, but it is not without its difficulties. Therefore, I believe that immigration in my country does help poor people establish new lives, but with some reservations and challenges. \n\n1"]}, {"persona": {"region": "Cairo", "sex": "female", "age": 57, "country": "Egypt", "marital_status": "divorced", "education": "middle", "social_class": "lower middle class"}, "question": {"id": "Q127", "variant": 0}, "response": ["Based on my personal experience and cultural context as a divorced female from Cairo, Egypt, I understand the potential benefits of immigration for poor people seeking to establish new lives. As a member of the lower middle class, I am aware of the socioeconomic challenges faced by many individuals in my country, and I believe that immigration can offer opportunities for economic advancement and improved living conditions. Additionally, considering the emic and etic perspectives, cultural relativism, and individual values, I recognize the potential for immigration to provide a pathway to a better future for those in need. Therefore, I would choose:\n\n2"]}, {"persona": {"region": "Cairo", "sex": "female", "age": 42, "country": "Egypt", "marital_status": "married", "education": "middle", "social_class": "working class"}, "question": {"id": "Q127", "variant": 0}, "response": ["Based on the anthropological framework, as a married female from Cairo, Egypt, who is part of the working class and has completed only middle education, my perspective on immigration and its impact on poor people is influenced by a combination of factors. The cultural context in Cairo, Egypt, includes a complex history of immigration and the challenges faced by the working class. My personal experience and individual values also shape my understanding of this issue. Additionally, my socioeconomic background as a member of the working class affects how I perceive the impact of immigration on poor people in my country. Considering these factors, I believe the option that best represents my perspective is:\n\n2"]}, {"persona": {"region": "Cairo", "sex": "female", "age": 23, "country": "Egypt", "marital_status": "single", "education": "middle", "social_class": "lower middle class"}, "question": {"id": "Q127", "variant": 0}, "response": ["In my cultural context, as a single female from Cairo, Egypt, my individual values and personal experience play a significant role in shaping my perspective on immigration. As someone from the lower middle class, I have personally witnessed the struggles and challenges faced by poor people in my country. I believe that immigration can provide opportunities for them to establish new lives, as it may open up access to better job prospects and living conditions. Additionally, considering the socioeconomic background and cultural relativism, I understand that different individuals may have varying experiences and perspectives on this issue. Therefore, I would choose option (1) Agree."]}, {"persona": {"region": "Cairo", "sex": "female", "age": 28, "country": "Egypt", "marital_status": "married", "education": "higher", "social_class": "upper middle class"}, "question": {"id": "Q127", "variant": 0}, "response": ["Based on my emic perspective as a married female from Cairo, Egypt, I have witnessed the impact of immigration on poor people in my country. The cultural context of Egypt, including its socioeconomic background and cultural relativism, has shaped my understanding of this issue. I believe that immigration can indeed help poor people establish new lives, as it provides them with opportunities for better education, employment, and living conditions. Additionally, individual values and personal experiences have influenced my perspective, as I have seen firsthand how immigration has benefited those in poverty. Therefore, I confidently choose option (1) Agree."]}, {"persona": {"region": "Cairo", "sex": "female", "age": 22, "country": "Egypt", "marital_status": "single", "education": "higher", "social_class": "lower middle class"}, "question": {"id": "Q127", "variant": 0}, "response": ["Based on my emic perspective as a single female from Cairo, Egypt, I understand that immigration in my country can have both positive and negative impacts on poor people trying to establish new lives. The cultural context of Egypt, with its history of immigration and diverse population, plays a significant role in how individuals perceive and experience immigration. As someone from the lower middle class, I am aware of the socioeconomic background and individual values that shape this issue. Additionally, considering the nuance of the question, I believe that immigration can provide opportunities for poor people to create new lives, but it can also present challenges and competition in a limited job market. Therefore, I find it hard to definitively agree or disagree with the statement. \n\n2"]}, {"persona": {"region": "Cairo", "sex": "female", "age": 39, "country": "Egypt", "marital_status": "married", "education": "middle", "social_class": "lower middle class"}, "question": {"id": "Q127", "variant": 0}, "response": ["Based on the anthropological framework, my emic perspective as a married female from Cairo, Egypt, who is 39 years old, completed middle education, and considers herself part of the lower middle class, is influenced by my cultural context, individual values, and socioeconomic background. In Egypt, immigration is often seen as a way to escape poverty and find better opportunities. However, the cultural relativism of this perspective acknowledges that not everyone may share the same view. My personal experience and understanding of immigration as a means of improving one's economic situation leads me to agree that immigration in my country can help poor people establish new lives.\n\n1"]}, {"persona": {"region": "Cairo", "sex": "male", "age": 19, "country": "Egypt", "marital_status": "single", "education": "middle", "social_class": "working class"}, "question": {"id": "Q127", "variant": 0}, "response": ["Based on the anthropological framework, I would consider the cultural context of Cairo, Egypt, where there is a significant population of working-class individuals who may struggle with socioeconomic challenges. My personal experience and individual values as a 19-year-old from the working class would also play a significant role in shaping my perspective. Additionally, the emic and etic perspectives would influence how I view immigration and its impact on establishing new lives for poor people in my country. Taking into account cultural relativism, space, and time, I would consider the nuanced phrasing of the question and how it relates to the socioeconomic background and cultural context of Egypt.\n\n2"]}, {"persona": {"region": "Cairo", "sex": "female", "age": 54, "country": "Egypt", "marital_status": "married", "education": "middle", "social_class": "working class"}, "question": {"id": "Q127", "variant": 0}, "response": ["Based on my emic perspective, as a married woman from Cairo, Egypt, I have seen firsthand the impact of immigration on poor people in my country. The cultural context in Egypt is such that many people from lower socioeconomic backgrounds struggle to make a living and often feel compelled to seek better opportunities elsewhere. My individual values and personal experience lead me to believe that immigration can provide a chance for poor people to establish new lives in more prosperous countries. Additionally, considering the socioeconomic background of many Egyptians, I believe that immigration can offer a way out of poverty for those who are willing to take the risk. Furthermore, cultural relativism teaches us that there are no inherent hierarchies of culture, and so I must acknowledge that the experience of immigration may differ for each individual based on their age and place in society. Overall, I believe that immigration can be a positive force for poor people in my country looking to improve their lives.\n\n1"]}, {"persona": {"region": "Cairo", "sex": "male", "age": 30, "country": "Egypt", "marital_status": "married", "education": "higher", "social_class": "working class"}, "question": {"id": "Q127", "variant": 0}, "response": ["Based on the anthropological framework, as a married male from Cairo, Egypt with a working-class background and a higher education level, my perspective is shaped by my cultural context, individual values, and socioeconomic background. In Egypt, immigration is often seen as a means for poor people to establish new lives, as it provides access to better economic opportunities and living conditions. The emic perspective within my community values the potential benefits of immigration for the less fortunate. Additionally, my individual values and personal experience contribute to my belief that immigration can be a positive solution for those in need. Therefore, I choose:\n\n1) Agree"]}, {"persona": {"region": "Cairo", "sex": "male", "age": 39, "country": "Egypt", "marital_status": "married", "education": "higher", "social_class": "lower middle class"}, "question": {"id": "Q127", "variant": 0}, "response": ["From my perspective as a married male from Cairo, Egypt, I consider immigration in my country to be a complex issue that cannot be easily categorized as either helpful or harmful for poor people. In Egyptian society, the cultural context and individual values play a significant role in shaping perceptions of immigration. The socioeconomic background of individuals, including their own, influences their attitudes towards immigration and its impact on the poor. Additionally, the emic and etic perspectives of the community, as well as the nuances of the question, also contribute to the diverse range of responses to this issue. Therefore, it is hard to categorically say whether immigration helps poor people establish new lives in my country.\n\n2"]}, {"persona": {"region": "Cairo", "sex": "female", "age": 41, "country": "Egypt", "marital_status": "married", "education": "middle", "social_class": "lower middle class"}, "question": {"id": "Q127", "variant": 0}, "response": ["Based on my emic perspective as a married female from Cairo, Egypt, and considering my lower middle class socioeconomic background, I believe that immigration in my country can provide new opportunities for poor people to establish new lives. The cultural context of Egypt, with its diverse population and economic challenges, means that immigration can offer better prospects for those seeking to improve their lives. Additionally, individual values and personal experiences, including my own, influence my belief that immigration can be a positive factor for those in need. Cultural relativism also plays a role, as I recognize that different perspectives and experiences may lead to different conclusions. Therefore, my answer is:\n1"]}, {"persona": {"region": "Cairo", "sex": "male", "age": 45, "country": "Syria", "marital_status": "single", "education": "higher", "social_class": "upper middle class"}, "question": {"id": "Q127", "variant": 0}, "response": ["From the perspective of a single male from Cairo, Syria, who is 45 years old, has completed higher education, and considers himself part of the upper middle class, there are several factors to consider in answering this question. The cultural context of Syria and the socioeconomic background of being part of the upper middle class will influence the perception of immigration and its impact on poor people. Additionally, personal experience and individual values will also play a role in shaping the perspective on immigration. Considering the emic and etic perspectives, it is important to acknowledge that there are in-group and out-group ways of thinking about immigration and its impact. Taking into account cultural relativism, the nuance of the question, and the space and time factors, the answer will be influenced by a complex interplay of these elements.\n\n2"]}, {"persona": {"region": "Cairo", "sex": "male", "age": 54, "country": "Egypt", "marital_status": "married", "education": "higher", "social_class": "lower middle class"}, "question": {"id": "Q127", "variant": 0}, "response": ["Based on my individual values and personal experience, as well as my socioeconomic background and cultural context, I believe that immigration in my country does help poor people establish new lives. As someone from the lower middle class in Cairo, I have witnessed firsthand the struggles and challenges that many individuals face in trying to make a better life for themselves and their families. I understand the importance of seeking opportunities elsewhere, especially when economic conditions are difficult. Additionally, my understanding of cultural relativism has taught me to appreciate the different perspectives and experiences of those who choose to immigrate for a better life. Therefore, based on my own experiences and beliefs, I would choose option (1) Agree."]}, {"persona": {"region": "Cairo", "sex": "male", "age": 65, "country": "Egypt", "marital_status": "married", "education": "middle", "social_class": "upper middle class"}, "question": {"id": "Q127", "variant": 0}, "response": ["Based on the anthropological framework, as a married male from Cairo, Egypt, my emic perspective is influenced by my cultural context, individual values, and socioeconomic background. In Egypt, immigration is often seen as a way for individuals to seek better opportunities and improve their socioeconomic status. However, the etic perspective may differ, as immigration can also be seen as a disruption to traditional kinship networks and societal structures. Considering my upper middle-class status and the cultural relativism, I would choose option (2) Hard to say, as I understand the complexities of immigration and its impact on both individuals and society."]}, {"persona": {"region": "Cairo", "sex": "female", "age": 52, "country": "Egypt", "marital_status": "married", "education": "middle", "social_class": "upper middle class"}, "question": {"id": "Q127", "variant": 0}, "response": ["Based on the anthropological framework, my emic perspective as a married female from Cairo, Egypt, is influenced by my cultural context, individual values, and socioeconomic background. In Egypt, immigration is often seen as a way for poor people to seek better opportunities and escape economic hardships. As someone from the upper middle class, I have experienced the benefits of socioeconomic stability and access to resources, and I understand the challenges faced by those in lower economic classes. Additionally, cultural relativism and nuance play a role in my understanding of immigration as a means for poor individuals to establish new lives. Therefore, I would choose option (1) Agree."]}, {"persona": {"region": "Cairo", "sex": "male", "age": 26, "country": "Egypt", "marital_status": "single", "education": "higher", "social_class": "lower middle class"}, "question": {"id": "Q127", "variant": 0}, "response": ["In considering the question of immigration in my country from an emic perspective, I must take into account the cultural context of Egypt, where there are socioeconomic disparities and limited opportunities for those in the lower middle class, such as myself. My personal experience and values play a significant role in shaping my view, as I have seen firsthand the struggles faced by the poor in our society. Furthermore, the cultural relativism perspective reminds me that there is no hierarchy of culture and that the nuanced phrasing of the question also influences my response. Taking all of these factors into consideration, I believe that immigration can indeed help poor people establish new lives in my country. \n\n1"]}, {"persona": {"region": "Cairo", "sex": "male", "age": 32, "country": "Egypt", "marital_status": "married", "education": "middle", "social_class": "working class"}, "question": {"id": "Q127", "variant": 0}, "response": ["Based on the anthropological framework, my perspective as a married working-class male from Cairo, Egypt, is influenced by my cultural context, individual values, and socioeconomic background. In Egypt, immigration is often seen as a way to escape economic hardship and seek better opportunities in other countries. However, the cultural context of Egypt values family and community ties, so leaving the country may be seen as a difficult decision. Additionally, as a working-class individual, I may have experienced the challenges of economic inequality and understand the desire for better opportunities. Therefore, I would have to say that immigration in my country helps poor people establish new lives.\n\n1"]}, {"persona": {"region": "Cairo", "sex": "male", "age": 38, "country": "Egypt", "marital_status": "married", "education": "middle", "social_class": "lower middle class"}, "question": {"id": "Q127", "variant": 0}, "response": ["Based on my personal experience and socioeconomic background as a married male from Cairo, Egypt, I believe that immigration can provide opportunities for poor people to establish new lives. The cultural context and socioeconomic factors in Egypt often limit the opportunities for those in the lower middle class, and immigration can offer a chance for a better future. Additionally, considering the emic and etic perspectives, I understand that different cultural contexts may shape my view on immigration, but from my own experience, I have seen how moving to a different country can provide new opportunities for those who are struggling in Egypt. \n\n1"]}, {"persona": {"region": "Cairo", "sex": "male", "age": 58, "country": "Egypt", "marital_status": "married", "education": "higher", "social_class": "upper middle class"}, "question": {"id": "Q127", "variant": 0}, "response": ["Based on the anthropological framework, my perspective as a married male from Cairo, Egypt, at the age of 58 with a higher education level and belonging to the upper middle class, is influenced by a combination of factors. The cultural context in Egypt is important to consider, as it shapes my understanding of immigration and its impact on the country. Additionally, my individual values and personal experiences, as well as my socioeconomic background, play a significant role in shaping my perspective. Cultural relativism is also crucial to consider, as it emphasizes the need to understand and respect different cultural viewpoints. Taking all of these factors into account, I believe that immigration in my country does help poor people establish new lives, as it can provide them with opportunities for better economic prospects and social mobility.\n\n2"]}, {"persona": {"region": "Cairo", "sex": "male", "age": 49, "country": "Egypt", "marital_status": "married", "education": "middle", "social_class": "lower middle class"}, "question": {"id": "Q127", "variant": 0}, "response": ["Based on the anthropological framework, my answer to the question about immigration in my country is influenced by my emic perspective as a married male from Cairo, Egypt, and my lower middle class socioeconomic background. My cultural context and personal experience lead me to believe that immigration can indeed help poor people establish new lives, as I have seen firsthand how immigration has provided opportunities for better economic prospects and improved living conditions for individuals and families in similar circumstances to my own. Additionally, the cultural relativism and nuance of the question also play a role in my perspective, as I recognize that the impact of immigration can vary depending on individual circumstances and the specific cultural and socioeconomic dynamics at play. Ultimately, my answer is influenced by my understanding of the complexities of immigration and its potential benefits for the less fortunate in my country.\n\n2"]}, {"persona": {"region": "Cairo", "sex": "female", "age": 29, "country": "Egypt", "marital_status": "married", "education": "middle", "social_class": "working class"}, "question": {"id": "Q127", "variant": 0}, "response": ["Based on the anthropological framework described, as a married female from Cairo, Egypt, I would consider the cultural context, individual values, socioeconomic background, and space and time in my response. In Egypt, immigration may be seen as a way for poor people to establish new lives, as it can provide opportunities for better employment and living conditions. However, the cultural context and socioeconomic background also play a significant role, as immigration can lead to separation from family and community support systems. Additionally, the current political and economic climate in Egypt may impact the perception of immigration and its benefits. Therefore, my response would be: 2. Hard to say"]}, {"persona": {"region": "Cairo", "sex": "female", "age": 36, "country": "Egypt", "marital_status": "married", "education": "higher", "social_class": "lower middle class"}, "question": {"id": "Q127", "variant": 0}, "response": ["Based on the anthropological framework, my perspective as a married female from Cairo, Egypt, is influenced by my cultural context, socioeconomic background, and individual values. In Egypt, immigration is often seen as a way for individuals to seek better opportunities and improve their lives. However, the cultural relativism perspective reminds us that there is no universal truth and that different people may have different views on immigration. As a member of the lower middle class, I understand the struggles of those in poverty and can see how immigration may provide them with new opportunities. Additionally, my personal experience and education have also shaped my belief that immigration can be a positive force for those seeking to improve their lives. Therefore, I would choose:\n\n1) Agree"]}, {"persona": {"region": "Cairo", "sex": "female", "age": 34, "country": "Egypt", "marital_status": "married", "education": "middle", "social_class": "lower middle class"}, "question": {"id": "Q127", "variant": 0}, "response": ["Based on my personal experience and socioeconomic background, I believe that immigration in my country can help poor people establish new lives. As a lower middle class woman from Cairo, Egypt, I understand the struggles of those in poverty and the limited opportunities available. Immigration can provide access to better employment and living conditions for those who are struggling to make ends meet in their current situation. Additionally, considering the cultural context and nuances of the question, I recognize that immigration can provide a new beginning for individuals and families who may not have the same opportunities in their home country. Therefore, I choose option (1) Agree."]}, {"persona": {"region": "Fayoum", "sex": "male", "age": 57, "country": "Egypt", "marital_status": "married", "education": "middle", "social_class": "working class"}, "question": {"id": "Q127", "variant": 0}, "response": ["Based on the anthropological framework, as a married male from Fayoum, Egypt, my perspective is heavily influenced by my emic and etic perspectives, cultural context, individual values and personal experience, socioeconomic background, cultural relativism, space and time, and nuance. Being part of the working class in Egypt, I understand the struggles that many poor people face in our country. Immigration can provide opportunities for them to establish new lives in countries with better economic prospects. Additionally, my cultural relativism perspective reminds me that different cultures and societies have different opportunities and challenges. Therefore, I believe that immigration can help poor people establish new lives. \n\n1"]}, {"persona": {"region": "Fayoum", "sex": "male", "age": 60, "country": "Egypt", "marital_status": "married", "education": "middle", "social_class": "lower middle class"}, "question": {"id": "Q127", "variant": 0}, "response": ["Based on the anthropological framework, as a married male from Fayoum, Egypt, my emic perspective is shaped by my cultural context, individual values, and socioeconomic background. In Egypt, lower middle class individuals like myself often struggle to make ends meet, and immigration is seen as a way to escape poverty and seek better opportunities. As someone who has completed middle education level and has limited access to resources, I believe that immigration can help poor people establish new lives by providing them with access to better jobs and living conditions. Additionally, my age and place in society have shaped my understanding of immigration and its potential benefits for those in need. Therefore, my perspective is influenced by my personal experience and the cultural context of my community.\n\n2"]}, {"persona": {"region": "Fayoum", "sex": "male", "age": 21, "country": "Egypt", "marital_status": "single", "education": "middle", "social_class": "lower middle class"}, "question": {"id": "Q127", "variant": 0}, "response": ["Based on the anthropological framework, my perspective as a single male from Fayoum, Egypt, is influenced by my cultural context, socioeconomic background, and personal experience. In Egypt, immigration is often seen as a way for people to escape poverty and seek better opportunities in other countries. As someone from the lower middle class, I understand the struggles and limitations faced by poor people in my country. I also recognize the impact of immigration on families and communities, as many people from my hometown have left to seek better lives abroad. Additionally, my age and level of education have provided me with some awareness of the challenges and opportunities associated with immigration. Considering all of these factors, I would choose option (1) Agree, as I believe that immigration can indeed help poor people establish new lives."]}, {"persona": {"region": "Fayoum", "sex": "male", "age": 33, "country": "Egypt", "marital_status": "single", "education": "higher", "social_class": "working class"}, "question": {"id": "Q127", "variant": 0}, "response": ["Based on the anthropological framework, my perspective as a single male from Fayoum, Egypt, must be considered. My cultural context, individual values, and socioeconomic background all contribute to my understanding of this issue. Immigration in my country may be viewed as a way for poor people to establish new lives, as it can provide new opportunities and a chance for a better life. However, the cultural relativism within my community may also lead me to believe that immigration can have negative impacts, such as brain drain and loss of skilled labor. Additionally, my working-class background may lead me to be more empathetic towards the struggles of the poor and thus more likely to view immigration as a positive opportunity. Ultimately, I believe that immigration can help poor people establish new lives, but it is a complex issue with both positive and negative implications.\n\n1"]}, {"persona": {"region": "Fayoum", "sex": "male", "age": 32, "country": "Egypt", "marital_status": "married", "education": "higher", "social_class": "lower middle class"}, "question": {"id": "Q127", "variant": 0}, "response": ["From the perspective of a married male from Fayoum, Egypt, who is 32 years old, completed higher education, and considers himself part of the lower middle class, my answer to the question of whether immigration in my country helps poor people establish new lives is influenced by the cultural context, socioeconomic background, and personal experience. In Egypt, many people, especially those from lower socioeconomic backgrounds, face limited opportunities for economic advancement. Immigration can provide a way for them to seek better opportunities elsewhere. Additionally, my personal experience and values lead me to believe that immigration can be a means for people to improve their lives and economic circumstances. Therefore, I would choose option (1) Agree."]}, {"persona": {"region": "Gharbia", "sex": "male", "age": 42, "country": "Egypt", "marital_status": "married", "education": "higher", "social_class": "upper middle class"}, "question": {"id": "Q127", "variant": 0}, "response": ["Based on my emic perspective as a married male from Gharbia, Egypt, I understand the importance of immigration in my country. The cultural context of Egypt, with its history of immigration and emigration, has shown that immigration can provide opportunities for poor people to establish new lives. My individual values and personal experience also play a role in my understanding, as I have witnessed firsthand the positive impact of immigration on those seeking better opportunities. Additionally, considering my socioeconomic background as part of the upper middle class, I recognize the potential for immigration to uplift those in need. Cultural relativism is also important to consider, as I understand that different cultures and backgrounds may have different perspectives on this issue. Therefore, I believe that immigration in my country can indeed help poor people establish new lives.\n\n1"]}, {"persona": {"region": "Gharbia", "sex": "male", "age": 52, "country": "Egypt", "marital_status": "married", "education": "middle", "social_class": "working class"}, "question": {"id": "Q127", "variant": 0}, "response": ["Based on the anthropological framework, the emic perspective of a married male from Gharbia, Egypt who is 52 years old, completed middle education, and considers himself part of the working class would likely be influenced by his cultural context, individual values, and socioeconomic background. In Egypt, immigration may be seen as a means for poor people to establish new lives due to economic opportunities in other countries. Additionally, personal experiences and values related to the struggles of the working class may lead to empathy towards those seeking better opportunities through immigration. Therefore, the persona would likely choose option (1) Agree as his perspective on whether immigration helps poor people establish new lives. \n\n1"]}, {"persona": {"region": "Gharbia", "sex": "male", "age": 45, "country": "Egypt", "marital_status": "divorced", "education": "higher", "social_class": "upper middle class"}, "question": {"id": "Q127", "variant": 0}, "response": ["Based on the anthropological framework, as a divorced male from Gharbia, Egypt, I would consider the cultural context and socioeconomic background as pivotal in answering this question. Immigration in Egypt is often seen as a way to escape poverty and seek better economic opportunities. As a member of the upper middle class, I may believe that immigration can indeed help poor people establish new lives by providing them with opportunities they may not have had in their home country. Additionally, my individual values and personal experience may also play a role in my belief that immigration can be beneficial for those seeking a better life. Therefore, I would choose option (1) Agree, as I believe immigration can help poor people establish new lives. \n\n1"]}, {"persona": {"region": "Behaira", "sex": "male", "age": 23, "country": "Egypt", "marital_status": "single", "education": "middle", "social_class": "lower class"}, "question": {"id": "Q127", "variant": 0}, "response": ["Based on the anthropological framework, as a single male from Behaira, Egypt, who has completed only middle education and considers myself part of the lower class, my perspective on immigration is heavily influenced by my individual values and personal experience. My socioeconomic background and cultural context also play a significant role in shaping my opinion. In my community, many people struggle to make ends meet and often see immigration as a means of escaping poverty and creating better opportunities for themselves and their families. However, I also recognize the challenges and complexities of immigration, especially for those coming from lower socioeconomic backgrounds. Therefore, I would have to say that it is hard to say whether immigration truly helps poor people establish new lives in my country.\n\n2"]}, {"persona": {"region": "Behaira", "sex": "male", "age": 38, "country": "Egypt", "marital_status": "single", "education": "higher", "social_class": "lower class"}, "question": {"id": "Q127", "variant": 0}, "response": ["From my perspective as a single male from Behaira, Egypt, my emic perspective on immigration is shaped by my cultural context, individual values, and socioeconomic background. Being part of the lower class, I am aware of the challenges and limited opportunities for economic advancement in my country. I understand the desire for people to seek better lives abroad, as I have felt the same pressure to improve my own circumstances. Additionally, my personal experiences and the experiences of those around me have shown that immigration can provide opportunities for upward mobility and financial stability. However, I also recognize the complexities of immigration and the potential challenges it poses for individuals and their families, as well as the impact it can have on the communities left behind. With these considerations in mind, I would have to say that immigration in my country does indeed help poor people establish new lives.\n\n1"]}, {"persona": {"region": "Behaira", "sex": "male", "age": 32, "country": "Egypt", "marital_status": "married", "education": "middle", "social_class": "lower class"}, "question": {"id": "Q127", "variant": 0}, "response": ["Based on my cultural context and socioeconomic background, I believe that immigration in my country does help poor people establish new lives. As a lower class individual from Behaira, Egypt, I have seen firsthand the struggles and limited opportunities that come with poverty. Immigration can provide access to better job opportunities, education, and healthcare for those who are struggling in their home country. Additionally, the cultural relativism perspective reminds us that there is no hierarchy of culture, and therefore, it is important to recognize the potential benefits that immigration can bring to those in need. Overall, I believe that immigration can be a positive solution for individuals seeking to improve their lives and socioeconomic status.\n\n1"]}, {"persona": {"region": "Behaira", "sex": "female", "age": 37, "country": "Egypt", "marital_status": "married", "education": "middle", "social_class": "working class"}, "question": {"id": "Q127", "variant": 0}, "response": ["Based on the anthropological framework, as a married female from Behaira, Egypt, my emic perspective on immigration is influenced by my cultural context, individual values, and socioeconomic background. In Egypt, many poor people struggle to find work and provide for their families, and immigration can offer them opportunities for better lives. Additionally, my working-class background means I understand the challenges of poverty and the desire for better opportunities. However, I also recognize the complexities of immigration and the potential challenges it may bring. Therefore, I would have to say it is hard to say.\n\n2"]}, {"persona": {"region": "Behaira", "sex": "male", "age": 48, "country": "Egypt", "marital_status": "married", "education": "middle", "social_class": "working class"}, "question": {"id": "Q127", "variant": 0}, "response": ["Based on the anthropological framework of emic and etic perspectives, cultural context, individual values and personal experience, socioeconomic background, cultural relativism, space and time, and nuance, as a married male from Behaira, Egypt, with a middle education level and part of the working class, my answer to the question is number 2. I believe that immigration in my country may help poor people establish new lives, but it is hard to say definitively without considering the specific circumstances and nuances of each individual case."]}, {"persona": {"region": "Behaira", "sex": "female", "age": 34, "country": "Egypt", "marital_status": "married", "education": "middle", "social_class": "lower class"}, "question": {"id": "Q127", "variant": 0}, "response": ["Based on my emic perspective as a married female from Behaira, Egypt, and considering my lower class socioeconomic background, I believe that immigration in my country does help poor people establish new lives. The cultural context and individual values and personal experience of people in my community and similar backgrounds would likely lead to a positive view of immigration as a means of improving economic opportunities. Additionally, considering the nuance of the question, I believe that immigration can provide new opportunities for those struggling in poverty, especially given the challenges faced in our current local economic context. \n\n1"]}, {"persona": {"region": "Behaira", "sex": "female", "age": 30, "country": "Egypt", "marital_status": "divorced", "education": "lower", "social_class": "lower class"}, "question": {"id": "Q127", "variant": 0}, "response": ["Based on the anthropological framework, my perspective is heavily influenced by my cultural context, socioeconomic background, and personal experience. As a divorced female from Behaira, Egypt, who is part of the lower class and has only completed lower education, I have seen firsthand the struggles and challenges that people in similar situations face. I understand the importance of immigration in providing opportunities for a better life, especially for those who are impoverished. Immigration can provide access to better job opportunities, education, and healthcare, which are often limited for the poor in Egypt. Therefore, I believe immigration can help poor people establish new lives.\n\n1"]}, {"persona": {"region": "Behaira", "sex": "male", "age": 40, "country": "Egypt", "marital_status": "married", "education": "higher", "social_class": "lower middle class"}, "question": {"id": "Q127", "variant": 0}, "response": ["Based on my emic perspective as a married male from Behaira, Egypt, I have witnessed how immigration has helped many poor people from my country establish new lives. The cultural context of Egypt and the struggles faced by those in poverty has led me to see how leaving the country can provide new opportunities for these individuals. Additionally, my individual values and personal experiences have shown me the impact of immigration on the lives of those in need. Considering my lower middle class socioeconomic background, I have seen firsthand the challenges faced by the poor in Egypt and how immigration can offer them a chance for a better life. Therefore, based on the nuanced phrasing of the question and my understanding of cultural relativism, I choose the following option:\n\n1"]}, {"persona": {"region": "Behaira", "sex": "male", "age": 38, "country": "Egypt", "marital_status": "married", "education": "middle", "social_class": "working class"}, "question": {"id": "Q127", "variant": 0}, "response": ["Based on the anthropological framework, my answer is influenced by my emic perspective as a married male from Behaira, Egypt, as well as my personal experience and socioeconomic background. As a working-class individual with a middle education level, I am aware of the challenges faced by poor people in my country. Additionally, cultural relativism is important to consider, as different cultural perspectives may influence the way immigration is perceived. Taking into account the cultural context and nuance, I believe that immigration can indeed help poor people establish new lives, as it can provide opportunities for better employment and living conditions. Therefore, my answer is:\n\n2"]}, {"persona": {"region": "Behaira", "sex": "female", "age": 30, "country": "Egypt", "marital_status": "married", "education": "higher", "social_class": "lower class"}, "question": {"id": "Q127", "variant": 0}, "response": ["Based on the anthropological framework, my emic perspective as a lower-class married woman from Behaira, Egypt, is shaped by my cultural context, individual values, and socioeconomic background. My understanding of immigration is influenced by the struggles and aspirations of my community, where many people seek better opportunities abroad due to limited resources and economic prospects at home. My personal experience and values also play a significant role in shaping my perspective, as I have witnessed the challenges and opportunities associated with immigration within my social networks. Additionally, my lower-class socioeconomic background leads me to consider the potential benefits of immigration for poor people seeking new lives, as it may provide them with access to resources and opportunities that are not readily available in their current environment.\n\n3"]}, {"persona": {"region": "Behaira", "sex": "female", "age": 35, "country": "Egypt", "marital_status": "married", "education": "middle", "social_class": "working class"}, "question": {"id": "Q127", "variant": 0}, "response": ["Based on the anthropological framework, as a married female from Behaira, Egypt, my emic perspective is shaped by my cultural context, individual values, and socioeconomic background. In Egypt, the working class, including myself, often struggles with economic challenges. I understand the importance of immigration for poor people as it can provide them with opportunities to establish new lives in more economically stable countries. Additionally, my personal experience and values lead me to believe that immigration can be a positive solution for those facing poverty and limited opportunities in Egypt. Therefore, I would choose option (1) Agree.\n\n1"]}, {"persona": {"region": "Behaira", "sex": "male", "age": 52, "country": "Egypt", "marital_status": "married", "education": "middle", "social_class": "lower class"}, "question": {"id": "Q127", "variant": 0}, "response": ["Based on the anthropological framework, as a married male from Behaira, Egypt, age 52, with a middle education level and considering myself part of the lower class, my perspective on immigration is influenced by my cultural context, socioeconomic background, and personal experience. In Egypt, many people from lower socioeconomic backgrounds struggle to find stable employment and provide for their families. In this context, immigration can be seen as an opportunity for poor people to establish new lives in countries with better economic opportunities. Additionally, my personal experience and values lead me to believe that immigration can provide a chance for a better future for those in need. Therefore, I would choose:\n\n1) Agree"]}, {"persona": {"region": "Alexandria", "sex": "female", "age": 41, "country": "Egypt", "marital_status": "single", "education": "middle", "social_class": "lower class"}, "question": {"id": "Q127", "variant": 0}, "response": ["Based on my personal experience and cultural context as a lower-class single woman from Alexandria, Egypt, I believe that immigration can help poor people establish new lives. Socioeconomic background plays a significant role in shaping my perspective, as opportunities for upward mobility are limited in my community. Additionally, the emic and etic perspectives in my cultural context suggest that immigration can provide the chance for a fresh start in a more economically prosperous environment. Cultural relativism also informs my belief that different cultures and countries offer diverse opportunities, and immigration can be a means of accessing these opportunities. Therefore, I choose option 1: Agree."]}, {"persona": {"region": "Alexandria", "sex": "female", "age": 21, "country": "Egypt", "marital_status": "single", "education": "middle", "social_class": "lower class"}, "question": {"id": "Q127", "variant": 0}, "response": ["Based on the anthropological framework, as a single female from Alexandria, Egypt, who is 21 years old and part of the lower class, my emic perspective is shaped by my personal experience and socioeconomic background. I have seen firsthand how immigration has helped poor people establish new lives by providing them with opportunities for better employment and living conditions. Additionally, considering the cultural context and nuance, I understand that immigration can also bring about challenges and changes in the cultural landscape. However, from my position, I believe that immigration can be beneficial for those in similar circumstances to mine. \n\n2"]}, {"persona": {"region": "Alexandria", "sex": "female", "age": 35, "country": "Egypt", "marital_status": "married", "education": "middle", "social_class": "lower class"}, "question": {"id": "Q127", "variant": 0}, "response": ["Based on my cultural context as a married woman from Alexandria, Egypt, my lower class socioeconomic background, and my middle level education, I am inclined to believe that immigration in my country does indeed help poor people establish new lives. My personal experience and the experiences of those around me have shown that many individuals and families have been able to improve their economic situation and access better opportunities by emigrating to other countries. Additionally, my cultural relativism perspective reminds me that each person's experience and understanding of immigration may be different based on their unique circumstances and values. Therefore, I believe that immigration can be a positive avenue for poor individuals to establish new and improved lives. \n\n2"]}, {"persona": {"region": "Alexandria", "sex": "male", "age": 34, "country": "Egypt", "marital_status": "married", "education": "higher", "social_class": "working class"}, "question": {"id": "Q127", "variant": 0}, "response": ["Based on the anthropological framework, my emic perspective as a married working-class male from Alexandria, Egypt, would be influenced by my cultural context, individual values, and socioeconomic background. In Egypt, immigration is often seen as a way for poor people to establish new lives, as it provides opportunities for better economic prospects and a chance to escape difficult living conditions. Additionally, my personal experience and values lead me to believe that immigration can be a positive option for those seeking a better life. Therefore, I would choose option (1) Agree as my response.\n\n1"]}, {"persona": {"region": "Alexandria", "sex": "female", "age": 37, "country": "Egypt", "marital_status": "married", "education": "higher", "social_class": "lower middle class"}, "question": {"id": "Q127", "variant": 0}, "response": ["Based on my personal experience and cultural context as a married female from Alexandria, Egypt, I understand the significance of socioeconomic background and cultural relativism in shaping my perspective on immigration. As part of the lower middle class, I am aware of the struggles and challenges that many poor people face in our country. I also recognize the value of cultural diversity and the potential for immigration to bring about positive change and opportunities for those in need. Therefore, I believe that immigration in our country can indeed help poor people establish new lives, as it can provide them with access to better opportunities and resources. \n\n1"]}, {"persona": {"region": "Alexandria", "sex": "female", "age": 56, "country": "Egypt", "marital_status": "divorced", "education": "middle", "social_class": "working class"}, "question": {"id": "Q127", "variant": 0}, "response": ["Based on the anthropological framework, as a divorced working-class woman from Alexandria, Egypt, my emic perspective is shaped by my personal experience and socioeconomic background. I have seen how immigration has helped some poor people establish new lives by providing them with better economic opportunities and living conditions. However, I also recognize the challenges and cultural adjustments that come with immigration, which is why I understand that it might be hard to say for some individuals. Therefore, I believe that immigration can be a positive opportunity for poor people, but it also comes with its own set of complexities and challenges.\n\n1"]}, {"persona": {"region": "Alexandria", "sex": "male", "age": 48, "country": "Egypt", "marital_status": "married", "education": "higher", "social_class": "working class"}, "question": {"id": "Q127", "variant": 0}, "response": ["Based on my emic perspective as a married male from Alexandria, Egypt, I believe that immigration in my country can help poor people establish new lives. In our cultural context, we have a strong understanding of the challenges faced by the working class, and we value the opportunities for growth and improvement. As an individual with a higher education level, I am aware of the potential benefits of immigration for those seeking better socioeconomic opportunities. Additionally, my personal experience and values lead me to empathize with those in need and advocate for their potential for a better life. Considering the cultural relativism and nuanced understanding of the question, I stand by my belief that immigration can be beneficial for poor individuals seeking to improve their lives.\n\n1"]}, {"persona": {"region": "Alexandria", "sex": "female", "age": 30, "country": "Egypt", "marital_status": "married", "education": "middle", "social_class": "working class"}, "question": {"id": "Q127", "variant": 0}, "response": ["Based on the anthropological framework, as a married female from Alexandria, Egypt, I would approach this question with consideration of my cultural context, individual values, and socioeconomic background. In Egypt, immigration is a complex issue influenced by historical, political, and economic factors. As a member of the working class with a middle education level, I am aware of the challenges faced by poor people in my country. While immigration may offer opportunities for some individuals, it is important to consider the impact on local communities and the potential exploitation of migrants. My personal experience and understanding of the socioeconomic context lead me to believe that immigration can sometimes help poor people establish new lives, but it is not a straightforward solution and must be carefully managed to ensure the well-being of all involved.\n\n2"]}, {"persona": {"region": "Alexandria", "sex": "male", "age": 19, "country": "Egypt", "marital_status": "single", "education": "middle", "social_class": "lower class"}, "question": {"id": "Q127", "variant": 0}, "response": ["Based on the anthropological framework, as a single male from Alexandria, Egypt, who has completed middle education and considers myself part of the lower class, my answer to the question of whether immigration helps poor people establish new lives would be influenced by my individual values and personal experience, as well as my socioeconomic background and cultural context. Coming from a lower class background, I have likely experienced the struggles and hardships that come with poverty, and I may have seen others in similar situations benefit from migrating to other countries for better opportunities. Additionally, living in a diverse cultural context like Alexandria, I may have been exposed to the stories and experiences of immigrants in my community. Therefore, my answer would be:\n\n2"]}, {"persona": {"region": "Alexandria", "sex": "male", "age": 45, "country": "Egypt", "marital_status": "married", "education": "middle", "social_class": "lower middle class"}, "question": {"id": "Q127", "variant": 0}, "response": ["Based on my cultural context as a married male from Alexandria, Egypt, my lower middle class socioeconomic background, and my middle education level, I understand that immigration can provide opportunities for poor people to establish new lives. I have seen how individuals from impoverished backgrounds have been able to find better job opportunities and improve their standard of living by moving to other countries. Additionally, my personal experience and individual values lead me to believe that immigration can be a positive solution for those looking to escape poverty. Furthermore, considering the emic and etic perspectives, I recognize that my in-group perspective may differ from those in higher socioeconomic classes or from different cultural backgrounds, but for people in similar circumstances to mine, immigration can be a viable option for improving their lives.\n\n1"]}, {"persona": {"region": "Alexandria", "sex": "male", "age": 23, "country": "Egypt", "marital_status": "single", "education": "higher", "social_class": "lower class"}, "question": {"id": "Q127", "variant": 0}, "response": ["From an emic perspective, as a lower-class individual in Alexandria, Egypt, my personal experience and socioeconomic background heavily influence my understanding of immigration. I have witnessed firsthand the struggles and hardships faced by the poor in my community, and I understand the desire for a better life. The cultural context of Egypt also plays a significant role, as the economic challenges and limited opportunities for upward mobility impact my perspective. Additionally, my age and socioeconomic background contribute to my belief that immigration can provide new opportunities for the poor. Considering cultural relativism, I recognize that my viewpoint may differ from those of higher socioeconomic status, but I firmly believe that immigration can offer hope and a chance for a better life for those in poverty.\n\n1"]}, {"persona": {"region": "Alexandria", "sex": "female", "age": 28, "country": "Egypt", "marital_status": "married", "education": "middle", "social_class": "working class"}, "question": {"id": "Q127", "variant": 0}, "response": ["Based on the anthropological framework, as a married female from Alexandria, Egypt with a middle education level and part of the working class, my perspective on immigration and its impact on poor people is influenced by my cultural context, individual values, and socioeconomic background. In Egypt, there are many economic challenges and limited opportunities for the working class, so immigration may be seen as a way for poor people to establish new lives and seek better opportunities abroad. Additionally, my personal experience and values may lead me to believe that immigration can be a positive way for individuals to improve their circumstances. Therefore, I would choose option (1) Agree."]}, {"persona": {"region": "Alexandria", "sex": "male", "age": 34, "country": "Egypt", "marital_status": "single", "education": "higher", "social_class": "working class"}, "question": {"id": "Q127", "variant": 0}, "response": ["Based on the anthropological framework, my perspective as a single male from Alexandria, Egypt, at 34 years of age and part of the working class, is influenced by my cultural context, individual values, and socioeconomic background. In Egypt, immigration is a complex issue that is heavily influenced by the cultural and socioeconomic context. Poverty and lack of opportunities are pervasive issues in Egypt, and many people see immigration as a way to seek better opportunities and improve their lives. As a working-class individual, I understand the struggles and challenges that come with poverty, and I believe that immigration can indeed help poor people establish new lives by providing them with access to better job opportunities and living conditions. Therefore, I choose option (1) Agree."]}, {"persona": {"region": "Alexandria", "sex": "male", "age": 30, "country": "Egypt", "marital_status": "married", "education": "higher", "social_class": "lower middle class"}, "question": {"id": "Q127", "variant": 0}, "response": ["Based on the anthropological framework, my answer to the question of whether immigration helps poor people establish new lives in my country is influenced by my emic perspective as a lower-middle-class married male from Alexandria, Egypt. The cultural context in Egypt, with its unique social and economic challenges, plays a significant role in shaping my understanding of immigration and its impact on the poor. My individual values and personal experience also inform my perspective, as I have witnessed the struggles of the less fortunate in my community. Additionally, my socioeconomic background as part of the lower middle class affects my perception of immigration and its potential benefits for the poor. Considering the nuanced phrasing of the question and the cultural relativism inherent in my perspective, I choose option (2) Hard to say."]}, {"persona": {"region": "Alexandria", "sex": "female", "age": 49, "country": "Egypt", "marital_status": "married", "education": "higher", "social_class": "lower middle class"}, "question": {"id": "Q127", "variant": 0}, "response": ["Based on the anthropological framework, as a married female from Alexandria, Egypt, my emic perspective is influenced by my cultural context, individual values, and socioeconomic background. In Egypt, immigration can be seen as a way for poor people to establish new lives, as it allows them to seek better opportunities and escape economic hardships. However, my etic perspective also acknowledges the challenges and difficulties that come with immigration, such as adapting to a new culture and finding stable employment. Considering my lower middle-class status and the cultural relativism of different social classes in Egypt, I would choose option (2) Hard to say, as it is a complex issue with both positive and negative implications."]}, {"persona": {"region": "Kafr el-sheikh", "sex": "male", "age": 49, "country": "Egypt", "marital_status": "married", "education": "higher", "social_class": "working class"}, "question": {"id": "Q127", "variant": 0}, "response": ["From the perspective of a married male from Kafr el-sheikh, Egypt, who is 49 years old, completed higher education, and considers himself part of the working class, there are several factors that would influence his answer to the question. His cultural context and socioeconomic background would shape his understanding of immigration and its impact on poor people. Additionally, his individual values and personal experiences would play a role in his perception of this issue. Furthermore, his emic perspective as a member of the local community would inform his understanding of how immigration affects the lives of poor people in his country. Based on these factors, he might choose to answer the question as follows:\n\n2\n\nHard to say"]}, {"persona": {"region": "Kafr el-sheikh", "sex": "male", "age": 25, "country": "Egypt", "marital_status": "single", "education": "middle", "social_class": "lower middle class"}, "question": {"id": "Q127", "variant": 0}, "response": ["From an emic perspective, as a single male from Kafr el-sheikh, Egypt, my cultural context and socioeconomic background heavily influence my understanding and opinion on immigration. In my community, there is a strong emphasis on family and kinship networks, as well as a deep connection to our homeland. Additionally, as part of the lower middle class, I am acutely aware of the economic challenges that many people in my community face. My individual values and personal experience also play a significant role in shaping my viewpoint. Having completed only middle education level, I have limited opportunities for upward mobility, and I understand the struggles that many poor people face. Considering all of these factors, I believe that immigration in my country can help poor people establish new lives because it provides them with opportunities for better economic prospects and a chance to escape poverty.\n\n1"]}, {"persona": {"region": "Kafr el-sheikh", "sex": "male", "age": 59, "country": "Egypt", "marital_status": "married", "education": "higher", "social_class": "lower middle class"}, "question": {"id": "Q127", "variant": 0}, "response": ["From the perspective of a married male from Kafr el-sheikh, Egypt, who is 59 years old, completed higher education, and considers himself part of the lower middle class, several factors come into play in answering the question of whether immigration helps poor people establish new lives. Firstly, the cultural context in Egypt and the socioeconomic background of the persona would lead to an understanding that immigration can indeed provide opportunities for poor people to establish new lives, as the economic conditions in Egypt may make it difficult for them to do so within the country. Additionally, the individual values and personal experiences of the persona may lead to the belief that immigration can be a means of improving one's circumstances, as education and hard work may not always guarantee upward mobility within the existing socioeconomic structure. Considering these factors, I choose option (1) Agree."]}, {"persona": {"region": "Kafr el-sheikh", "sex": "female", "age": 38, "country": "Egypt", "marital_status": "married", "education": "middle", "social_class": "working class"}, "question": {"id": "Q127", "variant": 0}, "response": ["From my emic perspective as a married female from Kafr el-sheikh, Egypt, I understand the importance of cultural context and socioeconomic background in shaping my views. My personal experience and values as a working-class woman who completed middle education also play a significant role in my understanding. I believe that cultural relativism is crucial in recognizing the diverse experiences and challenges faced by immigrants in my country. Additionally, the nuance of the question is important to consider, as the impacts of immigration on poor people can vary based on individual circumstances. Therefore, considering all these factors, I choose option (2) Hard to say."]}, {"persona": {"region": "Kafr el-sheikh", "sex": "male", "age": 35, "country": "Egypt", "marital_status": "married", "education": "higher", "social_class": "lower middle class"}, "question": {"id": "Q127", "variant": 0}, "response": ["Based on the anthropological framework, my perspective as a married male from Kafr el-sheikh, Egypt, is shaped by my cultural context, individual values, and socioeconomic background. In Egypt, immigration is often seen as a way for people to escape poverty and seek better opportunities in other countries. As someone from the lower middle class, I understand the struggles of poverty and the desire for a better life. However, I also recognize the challenges and difficulties that come with immigration, such as adapting to a new culture and facing discrimination. Therefore, I believe that immigration can help poor people establish new lives, but it is not without its challenges.\n\n2"]}, {"persona": {"region": "Kafr el-sheikh", "sex": "male", "age": 49, "country": "Egypt", "marital_status": "married", "education": "middle", "social_class": "lower class"}, "question": {"id": "Q127", "variant": 0}, "response": ["Based on my cultural context in Kafr el-Sheikh, Egypt, as a lower-class married male of 49 years with only a middle education level, my understanding and perspective on immigration and its impact on poor people is shaped by my socioeconomic background, individual values, and personal experience. I have seen firsthand the struggles of poverty and the limited opportunities available in my community. I believe that immigration can provide poor people with the chance to establish new lives in countries with better economic opportunities and social support systems. I understand that this may not be the case for everyone, as immigration also presents challenges and difficulties, but I ultimately believe that it can be a positive opportunity for those in need. \n\n1"]}, {"persona": {"region": "Kafr el-sheikh", "sex": "male", "age": 37, "country": "Egypt", "marital_status": "married", "education": "middle", "social_class": "lower class"}, "question": {"id": "Q127", "variant": 0}, "response": ["Based on my cultural context as a lower-class married male from Kafr el-sheikh, Egypt, immigration is viewed as an opportunity for poor people to establish new lives. Our socioeconomic background often limits our access to resources and opportunities, so the idea of leaving our country in search of better prospects is appealing. Additionally, personal experience has shown me that many people from our community have been able to improve their quality of life through immigration. Cultural relativism also plays a role in my perspective, as I understand that the experiences and opportunities in other countries may be different from those in Egypt. Therefore, based on my individual values, personal experience, and cultural context, I would choose:\n\n1. Agree"]}, {"persona": {"region": "Menofia", "sex": "female", "age": 22, "country": "Egypt", "marital_status": "single", "education": "middle", "social_class": "lower class"}, "question": {"id": "Q127", "variant": 0}, "response": ["From the perspective of a single female from Menofia, Egypt, who is 22 years old and considers herself part of the lower class, the answer to the question of whether immigration in the country helps poor people establish new lives would be influenced by various factors. The cultural context and socioeconomic background of this persona would lead to the understanding that for many in similar circumstances, immigration may offer opportunities for upward mobility and escaping economic hardship. Additionally, individual values and personal experience would play a role, as this persona may have personal connections or experiences with individuals who have benefitted from immigration. Therefore, the answer chosen is:\n\n3"]}, {"persona": {"region": "Menofia", "sex": "female", "age": 25, "country": "Egypt", "marital_status": "married", "education": "middle", "social_class": "lower class"}, "question": {"id": "Q127", "variant": 0}, "response": ["Based on the anthropological framework, as a married female from Menofia, Egypt, my emic perspective is heavily influenced by my cultural context, individual values, and socioeconomic background. In Egypt, lower-class individuals like myself often struggle to make ends meet, and immigration can offer opportunities for a better life. Additionally, my personal experience and the experiences of those around me have shown that immigration can provide access to better job opportunities and a higher standard of living. Considering the cultural relativism and nuance of the question, I believe immigration can indeed help poor people establish new lives in my country.\n\n1"]}, {"persona": {"region": "Menofia", "sex": "male", "age": 28, "country": "Egypt", "marital_status": "single", "education": "higher", "social_class": "working class"}, "question": {"id": "Q127", "variant": 0}, "response": ["Based on the anthropological framework, my perspective as a single male from Menofia, Egypt, who is 28 years old, completed higher education, and considers himself part of the working class, is influenced by my cultural context, individual values, and socioeconomic background. In Egypt, immigration is a complex issue that is deeply tied to economic and social factors. As someone from the working class, I have seen how immigration can provide opportunities for poor people to establish new lives, as it can open up access to better job opportunities and living conditions. However, I also understand the challenges and complexities that come with immigration, including the potential for exploitation and discrimination. Therefore, it is hard to say definitively whether immigration helps poor people establish new lives without considering the nuances and context of each individual case.\n\n2"]}, {"persona": {"region": "Menofia", "sex": "male", "age": 35, "country": "Egypt", "marital_status": "married", "education": "middle", "social_class": "lower middle class"}, "question": {"id": "Q127", "variant": 0}, "response": ["Based on my cultural context, socioeconomic background, and personal experience, I believe that immigration in my country does help poor people establish new lives. In Menofia, Egypt, many people struggle to find opportunities for a better life due to limited resources and economic challenges. Immigration can provide these individuals with the chance to access better job opportunities, education, and living conditions in other countries, ultimately improving their quality of life. Additionally, considering the emic and etic perspectives, I understand the value of cultural relativism and believe that immigration can offer individuals the chance to experience different cultures and perspectives, broadening their horizons and providing new opportunities. Overall, my understanding of the cultural context and socioeconomic background in my region leads me to support the idea that immigration can be beneficial for poor people seeking to establish new lives. \n\n1"]}, {"persona": {"region": "Menofia", "sex": "male", "age": 55, "country": "Egypt", "marital_status": "married", "education": "middle", "social_class": "working class"}, "question": {"id": "Q127", "variant": 0}, "response": ["As a married male from Menofia, Egypt, my perspective is heavily influenced by my cultural context, individual values, and socioeconomic background. In Egypt, there is a strong emphasis on family and community, and immigration is often seen as a way for individuals to seek better economic opportunities for themselves and their families. However, as a member of the working class, I am aware of the challenges that immigration can bring, such as separation from loved ones and the difficulties of starting anew in a different country. Additionally, my middle education level has given me a practical understanding of the complexities of immigration and the potential benefits and drawbacks it can bring. Therefore, I believe that while immigration can offer new opportunities for poor people, it also comes with significant challenges and uncertainties. \n\n2"]}, {"persona": {"region": "Menofia", "sex": "male", "age": 53, "country": "Egypt", "marital_status": "married", "education": "higher", "social_class": "lower middle class"}, "question": {"id": "Q127", "variant": 0}, "response": ["Based on my emic perspective as a married male from Menofia, Egypt, I understand that immigration is often a means for poor people to establish new lives. The cultural context of Egypt, with its economic challenges, pushes many to seek opportunities elsewhere. My individual values and personal experience also inform my belief that immigration can offer a chance for a better life. Considering my lower middle class socioeconomic background, I recognize the struggles of those in poverty and can empathize with their desire for a fresh start. Additionally, cultural relativism teaches me to understand the unique experiences and motivations of those who choose to immigrate. Therefore, I choose option 1: Agree."]}, {"persona": {"region": "Menofia", "sex": "male", "age": 59, "country": "Egypt", "marital_status": "married", "education": "middle", "social_class": "working class"}, "question": {"id": "Q127", "variant": 0}, "response": ["Based on the anthropological framework, as a married male from Menofia, Egypt, I consider the cultural context and socioeconomic background as crucial in understanding and answering this question. In Egypt, immigration is often seen as a means of escaping poverty and seeking better opportunities, especially for those from working-class backgrounds. Additionally, individual values and personal experiences, including my own, have shaped my understanding of immigration and its impact on the lives of the poor. Considering these factors, I would have to say that immigration in my country does help poor people establish new lives.\n\n1"]}, {"persona": {"region": "Menofia", "sex": "female", "age": 42, "country": "Egypt", "marital_status": "married", "education": "middle", "social_class": "lower middle class"}, "question": {"id": "Q127", "variant": 0}, "response": ["From the perspective of a married female from Menofia, Egypt, who is 42 years old, completed middle education level, and considers herself part of the lower middle class, the answer to the question of whether immigration in the country helps poor people establish new lives would be influenced by several factors. The cultural context in Egypt, including economic opportunities and social structures, may impact the perception of immigration and its impact on poverty. Additionally, individual values and personal experiences, as well as socioeconomic background, play a significant role in shaping the perspective on this issue. Cultural relativism also emphasizes the importance of understanding the unique challenges and opportunities within the Egyptian cultural context. Therefore, the chosen response is:\n\n2"]}, {"persona": {"region": "Menofia", "sex": "male", "age": 39, "country": "Egypt", "marital_status": "married", "education": "higher", "social_class": "working class"}, "question": {"id": "Q127", "variant": 0}, "response": ["Based on the anthropological framework, I believe that my cultural context, individual values, and socioeconomic background greatly influence my perspective on immigration in Egypt. As a married male from Menofia, Egypt, who is part of the working class and has completed higher education, I understand the challenges and opportunities that immigration can bring. I am aware that cultural relativism plays a crucial role in shaping my views, and I recognize the nuance in this question. Therefore, I believe that immigration can indeed help poor people establish new lives in my country, as it can provide them with access to better opportunities and resources that may not be readily available to them in their current circumstances.\n\n1"]}, {"persona": {"region": "Menofia", "sex": "male", "age": 34, "country": "Egypt", "marital_status": "married", "education": "middle", "social_class": "lower middle class"}, "question": {"id": "Q127", "variant": 0}, "response": ["Based on my cultural context and socioeconomic background, as a lower middle class married male from Menofia, Egypt, I believe that immigration can indeed help poor people establish new lives. In my community, many individuals have benefited from moving to other countries where they have found better job opportunities and improved living conditions. Additionally, considering the emic and etic perspectives, I understand the importance of cultural relativism and the nuance in answering this question. Therefore, my answer is: \n\n2"]}, {"persona": {"region": "Menofia", "sex": "male", "age": 22, "country": "Egypt", "marital_status": "single", "education": "higher", "social_class": "working class"}, "question": {"id": "Q127", "variant": 0}, "response": ["Based on the anthropological framework, as a single male from Menofia, Egypt, my emic perspective is influenced by my cultural context, individual values, and socioeconomic background. In Egypt, there is a strong emphasis on family and community, and immigration can provide opportunities for poor people to establish new lives and escape economic hardship. From my personal experience and values, I believe that immigration can be a positive force for those seeking a better life. Additionally, as part of the working class, I understand the challenges and limitations that economic status can impose, and I believe that immigration can offer a chance for upward mobility. Therefore, I would choose option (1) Agree."]}, {"persona": {"region": "Menofia", "sex": "male", "age": 21, "country": "Egypt", "marital_status": "single", "education": "middle", "social_class": "working class"}, "question": {"id": "Q127", "variant": 0}, "response": ["Based on the anthropological framework, my perspective on immigration in my country is shaped by my cultural context, individual values, and socioeconomic background. As a working-class individual from Menofia, Egypt, I understand the challenges and opportunities that come with immigration. I am aware of the cultural relativism that exists in different communities and understand that immigration can provide new opportunities for poor people to establish better lives. Additionally, considering the socioeconomic background of many individuals in Egypt, immigration can serve as a means of upward mobility and economic improvement. Therefore, based on my understanding and experiences, I would choose option 1: Agree."]}, {"persona": {"region": "Menofia", "sex": "male", "age": 36, "country": "Egypt", "marital_status": "married", "education": "higher", "social_class": "working class"}, "question": {"id": "Q127", "variant": 0}, "response": ["Based on the anthropological framework, as a married male from Menofia, Egypt, my emic perspective is shaped by my cultural context, individual values and personal experience, and socioeconomic background. In Egypt, immigration is often seen as a way for individuals to seek better economic opportunities and improve their standard of living. However, the cultural relativism of this issue is important to consider, as different individuals may have varying perceptions of the impact of immigration on their country. Additionally, my working-class background and personal experiences have influenced my understanding of the challenges and opportunities immigrants face. Therefore, I believe that immigration in my country can help poor people establish new lives, as it can provide them with access to better economic prospects and opportunities for upward mobility.\n\n1"]}, {"persona": {"region": "Menofia", "sex": "female", "age": 52, "country": "Egypt", "marital_status": "married", "education": "higher", "social_class": "lower middle class"}, "question": {"id": "Q127", "variant": 0}, "response": ["From an emic perspective, as a married female from Menofia, Egypt, I have witnessed the impact of immigration on poor individuals in my community. The cultural context of Egypt and the socioeconomic background of the lower middle class, to which I belong, play a significant role in shaping my views on immigration. I understand the importance of immigration in providing opportunities for a better life, especially for those from impoverished backgrounds. Additionally, my individual values and personal experiences have led me to believe that immigration can indeed help poor people establish new lives, as I have seen individuals from similar backgrounds succeed in other countries. Considering the cultural relativism and the nuanced phrasing of the question, I firmly believe that immigration can be a positive opportunity for the less fortunate in my country. \n\n1"]}, {"persona": {"region": "Menofia", "sex": "male", "age": 52, "country": "Egypt", "marital_status": "married", "education": "higher", "social_class": "lower middle class"}, "question": {"id": "Q127", "variant": 0}, "response": ["Based on my cultural context as a married male from Menofia, Egypt, and considering my age, education level, and socioeconomic background, I believe that immigration in my country can indeed help poor people establish new lives. I understand the emic perspective of the challenges faced by those in lower socioeconomic classes and the potential benefits of seeking opportunity elsewhere. Additionally, I recognize the importance of cultural relativism in understanding the diverse experiences and motivations of individuals who choose to immigrate. Taking into account my personal values and experiences, I believe that immigration can provide new opportunities for those in need, and I am inclined to support this perspective.\n\n2"]}, {"persona": {"region": "Menofia", "sex": "male", "age": 39, "country": "Egypt", "marital_status": "married", "education": "middle", "social_class": "lower class"}, "question": {"id": "Q127", "variant": 0}, "response": ["As a married male from Menofia, Egypt, my perspective is heavily influenced by my cultural context, individual values, and socioeconomic background. In Egypt, immigration is often seen as a way for people to escape poverty and seek better opportunities elsewhere. However, from my lower-class background and limited education, I understand that immigration can be a difficult and risky endeavor, and it may not always lead to a better life. Additionally, the cultural relativism perspective reminds me that different people may have different experiences with immigration, and it is not my place to judge whether it helps poor people establish new lives. Overall, I believe that immigration can have both positive and negative effects on the lives of poor people in Egypt, and it is hard to say definitively whether it helps or not. \n\n2"]}, {"persona": {"region": "Menofia", "sex": "male", "age": 23, "country": "Egypt", "marital_status": "single", "education": "middle", "social_class": "lower middle class"}, "question": {"id": "Q127", "variant": 0}, "response": ["Based on my emic perspective as a single male from Menofia, Egypt, I believe that immigration in my country can help poor people establish new lives. The cultural context of Egypt, along with my individual values and personal experiences, leads me to understand that immigration can provide opportunities that may not be available within the country. Additionally, considering my lower middle class background and the socioeconomic factors at play, I recognize the potential for immigration to improve the lives of those in poverty. Cultural relativism also plays a role in my understanding, as I recognize that different perspectives and experiences may lead to different conclusions. Overall, immigration can be seen as a way for individuals to improve their circumstances and access new opportunities.\n\n1"]}, {"persona": {"region": "Dakahlia", "sex": "female", "age": 24, "country": "Egypt", "marital_status": "single", "education": "higher", "social_class": "lower middle class"}, "question": {"id": "Q127", "variant": 0}, "response": ["Based on the emic and etic perspectives, as a single female from Dakahlia, Egypt, my in-group understanding is that immigration can provide opportunities for poor people to establish new lives. In the cultural context of Egypt, many people face economic hardships and limited opportunities, so immigration can be seen as a way to seek better prospects. My individual values and personal experience also lead me to believe that immigration can be a positive avenue for those in need. Considering my lower middle-class background, I am aware of the challenges faced by poor individuals and understand the potential benefits of immigration. Additionally, cultural relativism reminds us that there is no hierarchy of cultures, and space and time play a role in shaping our perspectives. Therefore, from my nuanced understanding of the situation, I would choose option (1) Agree. \n\n1"]}, {"persona": {"region": "Dakahlia", "sex": "male", "age": 36, "country": "Egypt", "marital_status": "married", "education": "higher", "social_class": "upper middle class"}, "question": {"id": "Q127", "variant": 0}, "response": ["Based on my emic perspective as a married male from Dakahlia, Egypt, and considering my upper middle class socioeconomic background, I believe that immigration in my country can indeed help poor people establish new lives. The cultural context and individual values within my community emphasize the importance of providing opportunities for those in need, and I have personally witnessed the positive impact of immigration on individuals who have come from less privileged backgrounds. Additionally, cultural relativism teaches us to value and respect the experiences and perspectives of others, and I believe that by welcoming immigrants, we can contribute to the growth and diversity of our society. Therefore, I choose option 1: Agree."]}, {"persona": {"region": "Dakahlia", "sex": "female", "age": 71, "country": "Egypt", "marital_status": "married", "education": "higher", "social_class": "upper middle class"}, "question": {"id": "Q127", "variant": 0}, "response": ["From the perspective of a married female from Dakahlia, Egypt, who is 71 years old, has completed higher education, and considers herself part of the upper middle class, my answer is based on a combination of emic and etic perspectives, cultural context, individual values and personal experience, socioeconomic background, cultural relativism, space and time, and nuance. In Dakahlia, Egypt, immigration has historically been viewed as a means for poor people to establish new lives in other countries, often in pursuit of better economic opportunities. However, from an etic perspective, the impact of immigration on the country's economy and social dynamics is a complex issue that involves the cultural context and socioeconomic background of both the immigrants and the local population. As someone who is part of the upper middle class and has had the opportunity to pursue higher education, my personal values and experiences may lead me to consider immigration as a potential threat to the local job market and social welfare systems. Additionally, the nuance of this question requires careful consideration of the potential benefits and drawbacks of immigration for both the immigrants and the local population. With all of these factors in mind, my chosen answer is:\n\n2"]}, {"persona": {"region": "Dakahlia", "sex": "male", "age": 55, "country": "Egypt", "marital_status": "married", "education": "higher", "social_class": "upper middle class"}, "question": {"id": "Q127", "variant": 0}, "response": ["In considering the question of whether immigration in my country helps poor people establish new lives, I must take into account the emic and etic perspectives of different social groups in Egypt. The cultural context of immigration is complex, as it involves issues of national identity, economic opportunities, and cultural exchange. My individual values and personal experiences lead me to believe that immigration can provide new opportunities for the poor, as it has for many in my community. Additionally, my upper-middle-class socioeconomic background has given me access to education and resources that have shaped my understanding of immigration and its potential benefits. Overall, I believe that immigration can be a positive force for poor people in my country, as it opens new doors for them to improve their lives. \n\n2"]}, {"persona": {"region": "Dakahlia", "sex": "male", "age": 64, "country": "Egypt", "marital_status": "married", "education": "higher", "social_class": "lower middle class"}, "question": {"id": "Q127", "variant": 0}, "response": ["Based on the anthropological framework, as a married male from Dakahlia, Egypt, my perspective on immigration and its impact on the establishment of new lives for poor people is influenced by my cultural context, individual values, and socioeconomic background. In Egypt, the lower middle class, like myself, often face economic challenges, and immigration can be seen as a way to seek better opportunities and improve living conditions. Additionally, the cultural relativism perspective reminds me that there are diverse experiences and perspectives on immigration within Egypt, and it is not appropriate to make blanket statements about its impact. Therefore, I would choose option (2) Hard to say, as I recognize the complexity of the issue and the need for further understanding and research to form a definitive opinion. \n\n2"]}, {"persona": {"region": "Dakahlia", "sex": "female", "age": 29, "country": "Egypt", "marital_status": "married", "education": "middle", "social_class": "lower class"}, "question": {"id": "Q127", "variant": 0}, "response": ["Based on the anthropological framework, as a married female from Dakahlia, Egypt, my emic perspective is influenced by my cultural context, individual values, socioeconomic background, and space and time. In my community, immigration is often seen as a way to escape poverty and seek better opportunities in other countries. However, my etic perspective acknowledges that immigration can also be a difficult and uncertain experience for poor people, and may not always lead to successful establishment of new lives. Considering all these factors, I would have to say it is hard to say.\n\n2"]}, {"persona": {"region": "Dakahlia", "sex": "female", "age": 40, "country": "Egypt", "marital_status": "married", "education": "middle", "social_class": "upper middle class"}, "question": {"id": "Q127", "variant": 0}, "response": ["Based on the anthropological framework, as a married female from Dakahlia, Egypt, I would approach the question of immigration and its impact on poor people from a cultural context perspective. In Egypt, the cultural context plays a pivotal role in understanding the dynamics of immigration and its impact on the lives of poor people. Additionally, my individual values and personal experience as a member of the upper middle class would influence my perspective on this issue. Considering the socioeconomic background, I would be inclined to believe that immigration can indeed help poor people establish new lives, as it can provide them with better opportunities and access to resources. Furthermore, the nuanced phrasing of the question leads me to believe that immigration can be a positive force for social mobility. \n\n1"]}, {"persona": {"region": "Dakahlia", "sex": "male", "age": 37, "country": "Egypt", "marital_status": "married", "education": "higher", "social_class": "lower middle class"}, "question": {"id": "Q127", "variant": 0}, "response": ["Based on my emic perspective as a married male from Dakahlia, Egypt, I have seen how immigration has helped many poor people establish new lives. In my cultural context, many people from my community have chosen to immigrate to other countries in search of better opportunities and a higher standard of living. Additionally, my individual values and personal experiences have shown me that immigration has provided economic stability and access to education and healthcare for those who may not have had these opportunities in Egypt. Furthermore, considering my lower middle class socioeconomic background, I have witnessed how immigration has positively impacted the lives of many people in similar economic situations. Therefore, I believe that immigration in my country does help poor people establish new lives.\n\n1"]}, {"persona": {"region": "Dakahlia", "sex": "female", "age": 45, "country": "Egypt", "marital_status": "married", "education": "middle", "social_class": "working class"}, "question": {"id": "Q127", "variant": 0}, "response": ["Based on the anthropological framework outlined above, as a married female from Dakahlia, Egypt, with a middle education level and part of the working class, my perspective is shaped by my cultural context, individual values, and socioeconomic background. I understand the importance of immigration in providing opportunities for poor people to establish new lives, as it can provide access to better economic prospects and improved living conditions. Additionally, cultural relativism teaches me to appreciate the diversity and contributions that immigrants bring to our society. Therefore, I would choose option (1) Agree."]}, {"persona": {"region": "Dakahlia", "sex": "male", "age": 34, "country": "Egypt", "marital_status": "single", "education": "middle", "social_class": "lower middle class"}, "question": {"id": "Q127", "variant": 0}, "response": ["Based on my emic perspective as a single male from Dakahlia, Egypt, I understand that immigration can provide opportunities for poor people to establish new lives, as it may offer access to better job opportunities and living conditions. The cultural context of Egypt, with its economic challenges, makes it important to consider immigration as a potential solution for those seeking better livelihoods. My individual values and personal experience as someone from the lower middle class also lead me to believe that immigration can be a positive option for those in need. Additionally, considering the socioeconomic background of individuals, immigration can potentially provide upward mobility for those in lower income brackets. In this nuanced context, I would choose the option:\n\n2"]}, {"persona": {"region": "Dakahlia", "sex": "female", "age": 26, "country": "Egypt", "marital_status": "married", "education": "higher", "social_class": "upper middle class"}, "question": {"id": "Q127", "variant": 0}, "response": ["From the emic perspective, as a married woman from Dakahlia, Egypt, who is part of the upper middle class, my cultural context and socioeconomic background play a significant role in my understanding of immigration. In my community, immigration is often seen as a way for poor people to seek better opportunities and improve their lives. Additionally, my personal experience and individual values shape my understanding of immigration, and I believe that it can indeed help poor people establish new lives. However, I also recognize that there are complexities and challenges associated with immigration, so while I lean towards agreeing with the statement, I acknowledge that it is not a straightforward issue.\n\n1"]}, {"persona": {"region": "Dakahlia", "sex": "male", "age": 21, "country": "Egypt", "marital_status": "single", "education": "middle", "social_class": "upper middle class"}, "question": {"id": "Q127", "variant": 0}, "response": ["Based on the anthropological framework, my response to the question of whether immigration in my country helps poor people establish new lives is influenced by my emic perspective as a member of the upper middle class in Dakahlia, Egypt. My individual values and personal experience, as well as my socioeconomic background, lead me to believe that immigration can provide opportunities for those seeking a better life. Additionally, considering the cultural context and the nuance of the question, I understand that immigration may not be the only solution to poverty, but it can certainly offer a chance for economic improvement. Therefore, I choose option (1) Agree."]}, {"persona": {"region": "Dakahlia", "sex": "female", "age": 32, "country": "Egypt", "marital_status": "married", "education": "middle", "social_class": "working class"}, "question": {"id": "Q127", "variant": 0}, "response": ["Based on the anthropological framework, my emic perspective as a married female from Dakahlia, Egypt, who has completed middle education and considers myself part of the working class, is heavily influenced by my cultural context, individual values, and socioeconomic background. In Egypt, immigration is often seen as a way for poor people to establish new lives, as economic opportunities within the country can be limited. Additionally, my personal experience and values lead me to believe that immigration can provide a chance for a better life for those in need. Considering the nuance of the question, I would choose the following option:\n\n2"]}, {"persona": {"region": "Dakahlia", "sex": "female", "age": 35, "country": "Egypt", "marital_status": "married", "education": "middle", "social_class": "upper middle class"}, "question": {"id": "Q127", "variant": 0}, "response": ["Based on the anthropological framework, as a married female from Dakahlia, Egypt, my emic perspective would be influenced by the cultural context, individual values, and socioeconomic background. In Egypt, immigration is often seen as a way for poor people to seek better opportunities and escape economic hardships. However, the etic perspective may consider the impact of immigration on the country's economy and social dynamics. Considering my upper middle-class background, I would take into account the potential competition for resources and jobs, as well as the strain on social services. Therefore, I would select option (2) Hard to say, as the issue is complex and requires consideration of both perspectives."]}, {"persona": {"region": "Dakahlia", "sex": "male", "age": 33, "country": "Egypt", "marital_status": "married", "education": "middle", "social_class": "upper middle class"}, "question": {"id": "Q127", "variant": 0}, "response": ["Based on the anthropological framework, as a married male from Dakahlia, Egypt, I understand the importance of considering cultural context, socioeconomic background, and personal experience in answering this question. In Egypt, immigration is often seen as a way for poor people to establish new lives in countries with better economic opportunities. However, the emic perspective of individuals within Egypt may also consider the challenges and difficulties faced by immigrants, as well as the impact on the communities they leave behind. Additionally, my upper middle class background may lead me to consider the potential benefits and drawbacks of immigration from a different perspective than someone from a lower socioeconomic background. Therefore, my answer to the question would be...\n\n2"]}, {"persona": {"region": "Dakahlia", "sex": "female", "age": 45, "country": "Egypt", "marital_status": "married", "education": "middle", "social_class": "upper middle class"}, "question": {"id": "Q127", "variant": 0}, "response": ["Based on my personal experience and cultural context as a married female from Dakahlia, Egypt, I believe that immigration in our country can indeed help poor people establish new lives. From an emic perspective, I have seen how immigration has provided opportunities for individuals from lower socioeconomic backgrounds to find better economic prospects and escape poverty. Additionally, considering the cultural relativism of our society, we value the notion of giving people the chance to improve their circumstances, regardless of their social status. Furthermore, my understanding is also influenced by my upper middle class status, which allows me to see the potential benefits of immigration for those in need. Overall, taking into account my individual values, personal experience, and cultural context, I firmly believe that immigration can be beneficial for poor people in our country.\n\n2"]}, {"persona": {"region": "Dakahlia", "sex": "male", "age": 30, "country": "Egypt", "marital_status": "married", "education": "middle", "social_class": "upper middle class"}, "question": {"id": "Q127", "variant": 0}, "response": ["Based on the anthropological framework, as a married male from Dakahlia, Egypt, my emic perspective would be influenced by the cultural context of my community, where immigration is often seen as a means for poor people to establish new lives. Additionally, my individual values and personal experience, as well as my socioeconomic background, as part of the upper middle class, would lead me to believe that immigration can provide opportunities for those in need. Furthermore, considering the cultural relativism of my community, where immigration is often viewed positively, and the nuance of the question, I would choose:\n\n1"]}, {"persona": {"region": "Dakahlia", "sex": "female", "age": 63, "country": "Egypt", "marital_status": "married", "education": "higher", "social_class": "lower middle class"}, "question": {"id": "Q127", "variant": 0}, "response": ["From the perspective of a married female from Dakahlia, Egypt, who is 63 years of age and part of the lower middle class, my answer to the question of whether immigration in our country helps poor people establish new lives is shaped by several factors. Firstly, the cultural context of Egypt and the importance of kinship networks plays a significant role in how immigration is perceived. Additionally, my individual values and personal experiences, as well as my socioeconomic background, influence my perspective. As a member of the lower middle class, I am likely to have firsthand experience with the challenges faced by poor people in our country, and I may believe that immigration can provide new opportunities for them. Furthermore, the nuanced phrasing of the question also impacts my response, as it is not a simple yes or no answer. Therefore, my answer is (1) Agree."]}, {"persona": {"region": "Dakahlia", "sex": "male", "age": 28, "country": "Egypt", "marital_status": "single", "education": "higher", "social_class": "upper middle class"}, "question": {"id": "Q127", "variant": 0}, "response": ["From an emic perspective, as a single male from Dakahlia, Egypt, my cultural context and socioeconomic background have greatly influenced my understanding of immigration in my country. My higher education level and classification as part of the upper middle class have shaped my individual values and personal experience, leading me to believe that immigration can indeed help poor people establish new lives. I understand the importance of socioeconomic background in shaping one's opportunities and believe that immigration can provide new avenues for those in need. Additionally, cultural relativism is crucial in understanding the diverse perspectives on immigration. However, I also recognize the potential challenges and complexities involved, particularly in a country like Egypt. Therefore, I choose:\n\n2"]}, {"persona": {"region": "Dakahlia", "sex": "female", "age": 24, "country": "Egypt", "marital_status": "married", "education": "higher", "social_class": "upper middle class"}, "question": {"id": "Q127", "variant": 0}, "response": ["Based on my cultural context as a married female from Dakahlia, Egypt, my personal experience and values, and my socioeconomic background, I believe that immigration in my country can indeed help poor people establish new lives. In Egypt, there are limited job opportunities and economic resources, especially for those from lower socioeconomic backgrounds. Immigration can provide access to better job opportunities and higher living standards for those willing to take the risk and move to a new country. Additionally, cultural relativism teaches us to understand and respect different perspectives, and in this case, the perspective of those seeking better opportunities through immigration. Therefore, I would choose option (1) Agree."]}, {"persona": {"region": "Dakahlia", "sex": "male", "age": 20, "country": "Egypt", "marital_status": "single", "education": "middle", "social_class": "upper middle class"}, "question": {"id": "Q127", "variant": 0}, "response": ["Based on my individual values and personal experience, as well as my socioeconomic background, I believe that immigration in my country does help poor people establish new lives. In Dakahlia, Egypt, there are limited opportunities for those in lower socioeconomic classes to improve their circumstances. Immigration provides a chance for individuals to seek better economic opportunities and improve their quality of life. Additionally, considering the cultural context and the emic and etic perspectives, I see immigration as a way for individuals to break free from the constraints of their current cultural and economic limitations, and to create new opportunities for themselves and their families. Therefore, I choose option (1) - Agree."]}, {"persona": {"region": "Dakahlia", "sex": "male", "age": 45, "country": "Egypt", "marital_status": "married", "education": "middle", "social_class": "upper middle class"}, "question": {"id": "Q127", "variant": 0}, "response": ["Based on my cultural context in Dakahlia, Egypt, my socioeconomic background as part of the upper middle class, and my age and experience, I believe that immigration in my country can help poor people establish new lives. My personal values and experiences have shown me that immigration can provide opportunities for those in need, and I understand the importance of cultural relativism in recognizing the diverse perspectives and experiences of immigrants. Additionally, considering the emic and etic perspectives, I recognize the potential benefits that immigration can bring to individuals and families seeking better opportunities. Therefore, I choose option 1: Agree."]}, {"persona": {"region": "Dakahlia", "sex": "female", "age": 43, "country": "Egypt", "marital_status": "married", "education": "higher", "social_class": "upper middle class"}, "question": {"id": "Q127", "variant": 0}, "response": ["Based on the anthropological framework, my perspective on immigration in Egypt is influenced by my cultural context, socioeconomic background, and personal experience. As a married female from Dakahlia, Egypt, I have witnessed the impact of immigration on both the poor and the wealthy in my community. I understand the importance of immigration for people seeking new opportunities and a better life, especially for those who are economically disadvantaged. However, I also recognize the challenges and complexities that immigration can bring to the social and economic fabric of my country. Therefore, I believe that immigration can help poor people establish new lives, but it also requires careful consideration and support from the government and society to ensure successful integration and mutual benefit.\n\n1"]}, {"persona": {"region": "Dakahlia", "sex": "female", "age": 20, "country": "Egypt", "marital_status": "single", "education": "middle", "social_class": "upper middle class"}, "question": {"id": "Q127", "variant": 0}, "response": ["As a single female from Dakahlia, Egypt, my perspective on immigration and its impact on poor people is heavily influenced by my cultural context, individual values, and socioeconomic background. In Egypt, immigration is often seen as a means of improving one's economic situation, especially for those from lower socioeconomic backgrounds. However, I also recognize the challenges and difficulties that immigrants face in establishing new lives in foreign countries. My upper middle-class background has provided me with certain privileges and opportunities that may not be accessible to those from lower economic strata. Therefore, while I believe that immigration can potentially benefit poor people in establishing new lives, I also acknowledge the complexities and hardships that come with it. \n\n2"]}, {"persona": {"region": "Dakahlia", "sex": "female", "age": 40, "country": "Egypt", "marital_status": "single", "education": "middle", "social_class": "lower middle class"}, "question": {"id": "Q127", "variant": 0}, "response": ["Based on my cultural context and socioeconomic background, as a middle-aged, single woman from Dakahlia, Egypt, I have seen firsthand the struggles faced by poor people in my country. I understand the importance of immigration in providing opportunities for a better life for those who are less fortunate. From my personal experience, I have witnessed the positive impact of immigration on the lives of individuals and families who are struggling to make ends meet. Therefore, I believe that immigration in my country does indeed help poor people establish new lives.\n\n1"]}, {"persona": {"region": "Dakahlia", "sex": "female", "age": 33, "country": "Egypt", "marital_status": "married", "education": "higher", "social_class": "upper middle class"}, "question": {"id": "Q127", "variant": 0}, "response": ["Based on the anthropological framework, my emic perspective as a married female from Dakahlia, Egypt, with a higher education level and belonging to the upper middle class, is influenced by my cultural context, individual values, and socioeconomic background. In Egypt, immigration is often seen as a means for poor people to establish new lives, as the economic opportunities in other countries can provide a better future for them and their families. Additionally, my personal experience and values lead me to believe that immigration can be a positive force for social and economic mobility. Therefore, I choose option (1) Agree."]}, {"persona": {"region": "Dakahlia", "sex": "female", "age": 24, "country": "Egypt", "marital_status": "married", "education": "middle", "social_class": "working class"}, "question": {"id": "Q127", "variant": 0}, "response": ["According to the anthropological framework, my emic perspective as a married female from Dakahlia, Egypt, who is part of the working class and has completed middle education level, is crucial in shaping my answer to the question about immigration. My cultural context, individual values, and socioeconomic background all play a role in my understanding. In Egypt, immigration can be seen as a way for poor people to establish new lives, as it can provide opportunities for economic advancement and access to better living conditions. Additionally, cultural relativism teaches us that there is no hierarchy of cultures, so I understand that immigration can be a positive pathway for those seeking to improve their circumstances. Therefore, my answer to the question would be:\n2"]}, {"persona": {"region": "Dakahlia", "sex": "female", "age": 53, "country": "Egypt", "marital_status": "widowed", "education": "middle", "social_class": "working class"}, "question": {"id": "Q127", "variant": 0}, "response": ["From the perspective of a widowed female from Dakahlia, Egypt, with a middle education level and part of the working class, it is important to consider the cultural context and socioeconomic background when answering this question. The cultural context in Egypt may differ from other countries, and the socioeconomic background of the persona may influence their perspective on immigration. Additionally, individual values and personal experiences will play a significant role in shaping their opinion. Considering the etic perspective, immigration may be seen as an opportunity for poor people to establish new lives, as it can provide access to better economic opportunities. However, from an emic perspective, there may be concerns about the impact of immigration on local job opportunities and resources. Overall, the nuanced phrasing of the question and the individual's personal experiences and values will ultimately shape their response.\n\n2"]}, {"persona": {"region": "Dakahlia", "sex": "female", "age": 30, "country": "Egypt", "marital_status": "single", "education": "middle", "social_class": "lower middle class"}, "question": {"id": "Q127", "variant": 0}, "response": ["From the perspective of a single female from Dakahlia, Egypt, the emic and etic perspectives are crucial in understanding the impact of immigration on poor people. As a member of the lower middle class, my socioeconomic background plays a significant role in shaping my views on this issue. Additionally, the cultural context of Egypt and the experiences of individuals in my community also influence my perspective. Cultural relativism is important to consider, as there is no hierarchy of culture and each person's viewpoint is valid. Moreover, the nuance in phrasing the question is essential in shaping my response. Therefore, I believe that immigration in my country can help poor people establish new lives because of the opportunities it can provide for economic advancement and social mobility.\n\n1"]}, {"persona": {"region": "Dakahlia", "sex": "male", "age": 53, "country": "Egypt", "marital_status": "married", "education": "higher", "social_class": "upper middle class"}, "question": {"id": "Q127", "variant": 0}, "response": ["Based on the anthropological framework, as a 53-year-old married male from Dakahlia, Egypt, who has completed higher education and considers myself part of the upper middle class, my perspective on immigration and its impact on poor people's ability to establish new lives is shaped by my individual values and personal experiences, as well as my socioeconomic background. I understand the importance of immigration in providing opportunities for those less fortunate, and I also recognize the potential benefits of cultural diversity and the contributions that immigrants can make to our society. However, I am also aware of the challenges that immigration can bring, such as strain on resources and competition for jobs. Therefore, I believe that immigration can have both positive and negative effects on the ability of poor people to establish new lives in our country.\n\n2"]}, {"persona": {"region": "Dakahlia", "sex": "male", "age": 28, "country": "Egypt", "marital_status": "married", "education": "middle", "social_class": "working class"}, "question": {"id": "Q127", "variant": 0}, "response": ["Based on my cultural context and socioeconomic background, as a married male from Dakahlia, Egypt, I understand that immigration can be a means for poor people to establish new lives. In my community, many people have left to seek better opportunities abroad, and I have seen how it has positively impacted their lives. Additionally, the emic perspective in my culture values the idea of seeking a better life for oneself and one's family, and immigration is seen as a viable option for achieving this. Therefore, based on my individual values and personal experience, I believe that immigration can help poor people establish new lives.\n\n1"]}, {"persona": {"region": "Dakahlia", "sex": "female", "age": 38, "country": "Egypt", "marital_status": "married", "education": "middle", "social_class": "upper middle class"}, "question": {"id": "Q127", "variant": 0}, "response": ["From the perspective of a married female from Dakahlia, Egypt, who is 38 years old and part of the upper middle class, my answer to the question of whether immigration in my country helps poor people establish new lives is influenced by my cultural context, socioeconomic background, and individual values. In Egypt, immigration has been a common practice for many years, and it is often seen as a means of seeking better opportunities and escaping economic hardships. As someone from the upper middle class, I may have a more positive view of immigration, as it may not directly impact my own socioeconomic status but can potentially benefit those in lower economic classes. Additionally, my personal experience and values may lead me to believe that immigration can provide new opportunities for those in need, thereby contributing to the establishment of new lives for poor individuals. Therefore, my response would be:\n\n2"]}, {"persona": {"region": "Gharbia", "sex": "male", "age": 27, "country": "Egypt", "marital_status": "single", "education": "higher", "social_class": "upper middle class"}, "question": {"id": "Q127", "variant": 0}, "response": ["From the perspective of a single male from Gharbia, Egypt, who has completed higher education and considers himself part of the upper middle class, the answer to the question of whether immigration in the country helps poor people establish new lives would be influenced by several factors. First, the cultural context of Egypt and the individual's socioeconomic background would play a significant role in shaping his perspective. Additionally, his personal values and experiences, as well as his understanding of cultural relativism, would inform his answer. Considering these factors, it is likely that he would choose option (2) Hard to say, as he may recognize the potential benefits of immigration for poor individuals while also acknowledging the complexities and challenges that come with the process."]}, {"persona": {"region": "Gharbia", "sex": "female", "age": 35, "country": "Egypt", "marital_status": "married", "education": "higher", "social_class": "upper middle class"}, "question": {"id": "Q127", "variant": 0}, "response": ["Based on the anthropological framework, my answer to the question regarding immigration in my country is influenced by my cultural context, individual values, and socioeconomic background. As a married female from Gharbia, Egypt, I understand the importance of immigration for poor people seeking to establish new lives, as it provides them with opportunities for better economic prospects and social mobility. Additionally, my higher education level and upper-middle-class status have exposed me to the benefits of immigration and the impact it can have on improving one's quality of life. Therefore, I believe that immigration in my country helps poor people establish new lives.\n\n1"]}, {"persona": {"region": "Gharbia", "sex": "female", "age": 37, "country": "Egypt", "marital_status": "married", "education": "higher", "social_class": "upper middle class"}, "question": {"id": "Q127", "variant": 0}, "response": ["Based on the anthropological framework, as a married female from Gharbia, Egypt, cultural context is pivotal in my understanding and answering of this question. In my community, immigration is often seen as a way for individuals to seek better economic opportunities and improve their lives. However, individual values and personal experiences also play a significant role in shaping my perspective. As someone who considers myself part of the upper middle class and has completed higher education, I may be more likely to view immigration as a positive opportunity for those seeking to improve their economic situation. Therefore, I would choose option (1) Agree."]}, {"persona": {"region": "Gharbia", "sex": "male", "age": 43, "country": "Egypt", "marital_status": "married", "education": "middle", "social_class": "lower middle class"}, "question": {"id": "Q127", "variant": 0}, "response": ["Based on the anthropological framework, my answer to the question is influenced by my emic perspective as a married male from Gharbia, Egypt, and my lower middle class socioeconomic background. The cultural context of my community and personal experiences have shaped my views, as well as the cultural relativism that I hold. Additionally, my age and level of education play a role in my understanding of immigration and its impact on poor people in my country. Taking all these factors into consideration, I choose option (2) Hard to say."]}, {"persona": {"region": "Gharbia", "sex": "male", "age": 28, "country": "Egypt", "marital_status": "single", "education": "higher", "social_class": "lower middle class"}, "question": {"id": "Q127", "variant": 0}, "response": ["Based on my personal experience and socioeconomic background, I believe that immigration in my country does help poor people establish new lives. As someone who comes from the lower middle class, I understand the struggles and limitations that many people face in Egypt. Immigration can provide opportunities for better education, employment, and living conditions for those who may not have access to these resources in their own country. Additionally, considering the cultural context and the emic perspective of individuals in my community, I have seen how immigration has positively impacted the lives of many and provided a chance for upward mobility. Therefore, I choose option 1: Agree."]}, {"persona": {"region": "Gharbia", "sex": "male", "age": 39, "country": "Egypt", "marital_status": "married", "education": "middle", "social_class": "lower middle class"}, "question": {"id": "Q127", "variant": 0}, "response": ["Based on my cultural context as a married male from Gharbia, Egypt, my lower middle class socioeconomic background, and my middle education level, I understand that immigration can have both positive and negative effects on poor people trying to establish new lives. From an emic perspective, I have seen how immigration can provide opportunities for better jobs and living conditions, but from an etic perspective, I also recognize the challenges and discrimination that immigrants may face in a new country. Additionally, my personal experience and values lead me to believe that immigration can be a difficult but potentially valuable option for poor people seeking to improve their lives. Therefore, my answer to the question would be:\n2"]}, {"persona": {"region": "Gharbia", "sex": "male", "age": 30, "country": "Egypt", "marital_status": "married", "education": "middle", "social_class": "lower middle class"}, "question": {"id": "Q127", "variant": 0}, "response": ["Based on the anthropological framework, as a married male from Gharbia, Egypt, my emic perspective is influenced by my cultural context, individual values, and socioeconomic background. In Egypt, immigration is often seen as a way to escape economic hardship and pursue better opportunities. However, the cultural relativism of my society also emphasizes the importance of family and community ties, making immigration a complex issue. Additionally, my lower middle-class background has shaped my understanding of the challenges and opportunities that come with immigration. Taking all of these factors into account, I choose option 2: Hard to say."]}, {"persona": {"region": "Gharbia", "sex": "male", "age": 43, "country": "Egypt", "marital_status": "married", "education": "lower", "social_class": "lower middle class"}, "question": {"id": "Q127", "variant": 0}, "response": ["From the perspective of a married male from Gharbia, Egypt, who is 43 years old, completed lower education, and considers himself part of the lower middle class, it is important to consider the cultural context, individual values and personal experience, and socioeconomic background when answering the question about immigration. In Egypt, there is a strong sense of community and family ties, and the cultural context emphasizes the importance of supporting one's own community. Additionally, individuals from lower education and socioeconomic backgrounds may feel that immigration can lead to brain drain and further economic hardships for those left behind. Therefore, based on these factors, the persona would most likely choose the option:\n2"]}, {"persona": {"region": "Gharbia", "sex": "male", "age": 36, "country": "Egypt", "marital_status": "married", "education": "higher", "social_class": "lower middle class"}, "question": {"id": "Q127", "variant": 0}, "response": ["From the perspective of a married male from Gharbia, Egypt, who is 36 years old, has completed higher education, and considers himself part of the lower middle class, several factors are crucial in considering the question of immigration and its impact on poor people. The cultural context of Egypt, with its history of immigration and emigration, plays a significant role in shaping individuals' perspectives on this issue. Additionally, the socioeconomic background of the persona, as part of the lower middle class, may influence their views on immigration and its potential impact on poverty. Personal experiences and individual values also shape their perception, as well as the nuanced phrasing of the question. Taking into account the emic and etic perspectives, the persona may consider immigration as a means for poor people to establish new lives, given the potential economic opportunities it may present. \n\n2"]}, {"persona": {"region": "Gharbia", "sex": "male", "age": 25, "country": "Egypt", "marital_status": "married", "education": "middle", "social_class": "upper middle class"}, "question": {"id": "Q127", "variant": 0}, "response": ["Based on the anthropological framework, as a married male from Gharbia, Egypt, my emic perspective would be influenced by my cultural context, individual values, and socioeconomic background. In Gharbia, immigration is often seen as a way for poor people to seek better opportunities and improve their lives. As someone from the upper middle class, I have seen firsthand how immigration has positively impacted the lives of many individuals from lower socioeconomic backgrounds, providing them with new opportunities and a chance for upward mobility. Therefore, I would agree that immigration in my country helps poor people establish new lives.\n\n1"]}, {"persona": {"region": "Gharbia", "sex": "male", "age": 31, "country": "Egypt", "marital_status": "married", "education": "middle", "social_class": "upper middle class"}, "question": {"id": "Q127", "variant": 0}, "response": ["Based on the anthropological framework, my perspective is heavily influenced by my cultural context, socioeconomic background, and personal experience. As a married male from Gharbia, Egypt, I understand the importance of immigration as a means for poor people to establish new lives, especially considering the economic challenges faced in our country. Additionally, my upper middle class status has allowed me to witness the opportunities that immigration can provide for those seeking a better life. Therefore, I believe that immigration in my country does help poor people establish new lives.\n\n1"]}, {"persona": {"region": "Gharbia", "sex": "male", "age": 33, "country": "Egypt", "marital_status": "married", "education": "higher", "social_class": "lower middle class"}, "question": {"id": "Q127", "variant": 0}, "response": ["From an anthropological perspective, my individual values and personal experiences as a married male from Gharbia, Egypt, who has completed higher education and considers myself part of the lower middle class, will heavily influence my answer to this question. Additionally, my socioeconomic background and cultural context will also play a significant role in shaping my perspective. Considering the emic and etic perspectives, I am likely to see immigration as a potential opportunity for poor people to establish new lives, particularly if they are coming from more difficult circumstances. However, I also recognize the challenges and complexities associated with immigration and the potential strain it can place on resources and infrastructure, which leads me to believe that it is hard to say whether immigration truly helps poor people establish new lives.\n\n2"]}, {"persona": {"region": "Gharbia", "sex": "male", "age": 26, "country": "Egypt", "marital_status": "single", "education": "higher", "social_class": "upper middle class"}, "question": {"id": "Q127", "variant": 0}, "response": ["Based on the anthropological framework, my perspective is heavily influenced by my cultural context, individual values, and socioeconomic background. As a single male from Gharbia, Egypt, I have been raised in a society where immigration is seen as a way to seek better opportunities and escape poverty. My higher education level and upper middle-class status also shape my belief that immigration can provide poor people with the chance to establish new lives and improve their circumstances. I understand the struggles of those who are less fortunate and believe that immigration can offer them a path to a better future.\n\n1"]}, {"persona": {"region": "Gharbia", "sex": "female", "age": 45, "country": "Egypt", "marital_status": "married", "education": "middle", "social_class": "lower middle class"}, "question": {"id": "Q127", "variant": 0}, "response": ["Based on the anthropological framework, my perspective is heavily influenced by my cultural context, socioeconomic background, and personal experience. As a married female from Gharbia, Egypt, who is 45 years old and part of the lower middle class, I have personally experienced the struggles of poverty and the challenges of establishing a stable life. I understand the importance of immigration in providing opportunities for those in need, as it can offer access to better resources and opportunities for a new beginning. Additionally, my cultural context has taught me the value of helping those in need and the importance of community support. Considering these factors, I choose option (1) Agree. \n\n1"]}, {"persona": {"region": "Gharbia", "sex": "female", "age": 55, "country": "Egypt", "marital_status": "married", "education": "middle", "social_class": "upper middle class"}, "question": {"id": "Q127", "variant": 0}, "response": ["Based on the anthropological framework, I must consider the emic perspective of my cultural context in Gharbia, Egypt. As a married female from this region, I am influenced by my individual values and personal experiences, as well as my socioeconomic background. Additionally, cultural relativism is important to me as I understand that different cultures have different perspectives on immigration. Considering all of these factors, I believe that immigration in my country can indeed help poor people establish new lives, as it can provide them with opportunities for better economic prospects and a chance for a better future.\n\n1"]}, {"persona": {"region": "Gharbia", "sex": "female", "age": 27, "country": "Egypt", "marital_status": "married", "education": "higher", "social_class": "upper middle class"}, "question": {"id": "Q127", "variant": 0}, "response": ["Based on the anthropological framework, as a married female from Gharbia, Egypt, I understand and answer questions based on my cultural context, individual values and personal experience, and socioeconomic background. In Egypt, immigration can be seen as a way for poor people to establish new lives, as it offers opportunities for better economic prospects and living conditions. Additionally, my upper middle class background and higher education level may lead me to believe that immigration can indeed be a positive option for those seeking a better life. Therefore, I would choose option 1: Agree."]}, {"persona": {"region": "Gharbia", "sex": "female", "age": 42, "country": "Egypt", "marital_status": "married", "education": "higher", "social_class": "upper middle class"}, "question": {"id": "Q127", "variant": 0}, "response": ["From the perspective of a married female from Gharbia, Egypt, who is 42 years old, completed higher education, and considers herself part of the upper middle class, it is important to consider the cultural context and socioeconomic background when answering the question about immigration. In Egypt, there is a strong emphasis on family and community, and immigration can provide opportunities for economic advancement and a better quality of life for many individuals. However, it is also important to acknowledge that immigration can lead to social and economic challenges, particularly for those who are left behind in their home country. Therefore, it is hard to say definitively whether immigration in Egypt helps poor people establish new lives, as the impact can vary depending on individual circumstances and the broader social and economic context.\n\n2"]}, {"persona": {"region": "Gharbia", "sex": "female", "age": 32, "country": "Egypt", "marital_status": "married", "education": "middle", "social_class": "upper middle class"}, "question": {"id": "Q127", "variant": 0}, "response": ["Based on my cultural context in Gharbia, Egypt, and my socioeconomic background as an upper middle-class married woman, I understand that immigration can have both positive and negative impacts on individuals and families. From an emic perspective, I see that some poor people may benefit from immigrating to other countries in search of better opportunities and living conditions. However, from an etic perspective, I recognize that immigration can also lead to social and economic challenges for both the individuals who leave and the communities they leave behind. Considering the nuance of the situation, I believe that immigration can be a complex issue with no clear-cut answer. \n\n2"]}, {"persona": {"region": "Gharbia", "sex": "male", "age": 27, "country": "Egypt", "marital_status": "married", "education": "higher", "social_class": "upper middle class"}, "question": {"id": "Q127", "variant": 0}, "response": ["Based on the anthropological framework, as a married male from Gharbia, Egypt who has completed higher education and considers myself part of the upper middle class, my perspective is influenced by my emic and etic perspectives, cultural context, individual values and personal experience, socioeconomic background, cultural relativism, space and time, and nuance. In my cultural context, immigration is seen as a way for poor people to establish new lives, as it provides them with opportunities that may not be available in their home country. Additionally, my higher education and socioeconomic background have shaped my belief in the benefits of immigration for those seeking to improve their lives. Therefore, I choose option (1) Agree."]}, {"persona": {"region": "Gharbia", "sex": "female", "age": 27, "country": "Egypt", "marital_status": "married", "education": "higher", "social_class": "lower middle class"}, "question": {"id": "Q127", "variant": 0}, "response": ["Based on the anthropological framework, as a married female from Gharbia, Egypt, my emic perspective is shaped by my cultural context, individual values, and socioeconomic background. In Gharbia, immigration is often seen as a means of escaping economic hardships and pursuing better opportunities. However, from an etic perspective, I recognize the complexities and challenges that come with immigration, especially for the poor. As someone from the lower middle class, I understand the struggles of poverty and the desire for a better life. Therefore, I would choose option (1) Agree, as I believe that immigration can provide opportunities for poor people to establish new lives and improve their circumstances."]}, {"persona": {"region": "Gharbia", "sex": "female", "age": 37, "country": "Egypt", "marital_status": "married", "education": "middle", "social_class": "upper middle class"}, "question": {"id": "Q127", "variant": 0}, "response": ["Based on my cultural context and individual values, as a married female from Gharbia, Egypt, I understand the importance of immigration in providing opportunities for those in need. My socioeconomic background as part of the upper middle class also allows me to recognize the potential benefits of immigration for those in poverty. Additionally, my age and life experience have shown me the struggles faced by the less fortunate in my community. Therefore, I believe that immigration can indeed help poor people establish new lives, providing them with opportunities they may not have had access to otherwise.\n\n1"]}, {"persona": {"region": "Gharbia", "sex": "male", "age": 28, "country": "Egypt", "marital_status": "married", "education": "higher", "social_class": "working class"}, "question": {"id": "Q127", "variant": 0}, "response": ["Based on my cultural context in Gharbia, Egypt, I have been raised to understand the importance of family and community ties. This perspective is deeply ingrained in my individual values and personal experience, as well as my socioeconomic background as a working-class individual. In my cultural context, immigration is often seen as a way to seek better economic opportunities and provide for one's family. However, there is also a recognition that immigration can lead to the loss of important social and familial ties. Additionally, the current economic situation in Egypt may make it difficult for poor people to establish new lives in other countries. Therefore, I believe that immigration can have both positive and negative impacts for poor people in my country, and it is hard to say definitively whether it helps them establish new lives.\n\n2"]}, {"persona": {"region": "Gharbia", "sex": "female", "age": 50, "country": "Egypt", "marital_status": "married", "education": "middle", "social_class": "upper middle class"}, "question": {"id": "Q127", "variant": 0}, "response": ["Based on the anthropological framework, my perspective is heavily influenced by my cultural context as a married female from Gharbia, Egypt. My age and education level also play a significant role in shaping my views. As part of the upper middle class, my socioeconomic background affects my understanding of immigration and its impact on poor people. Additionally, the cultural relativism aspect of the framework reminds me that there is no hierarchy of culture, so I am aware of the importance of empathy and understanding when considering the impact of immigration on others. Considering all these factors, my answer is:\n\n2"]}, {"persona": {"region": "Gharbia", "sex": "male", "age": 39, "country": "Egypt", "marital_status": "single", "education": "higher", "social_class": "working class"}, "question": {"id": "Q127", "variant": 0}, "response": ["Based on the anthropological framework, my emic perspective as a working-class individual from Gharbia, Egypt, is influenced by my cultural context, individual values, and socioeconomic background. In Egypt, immigration is often seen as a way to escape economic hardships and find better opportunities, especially for those from lower socioeconomic backgrounds. As someone who has completed higher education and is part of the working class, I understand the struggles of poverty and the desire for a better life. However, I also recognize the challenges and complexities of immigration, including the loss of connections to one's culture and community. Therefore, I believe that immigration can offer opportunities for poor people to establish new lives, but it is not without its difficulties and trade-offs.\n\n2"]}, {"persona": {"region": "Gharbia", "sex": "female", "age": 45, "country": "Egypt", "marital_status": "married", "education": "higher", "social_class": "upper middle class"}, "question": {"id": "Q127", "variant": 0}, "response": ["Based on the anthropological framework, as a married female from Gharbia, Egypt, who is 45 years old, completed higher education, and considers myself part of the upper middle class, my perspective is influenced by my individual values, personal experiences, and socioeconomic background. I understand the cultural context and the importance of cultural relativism, as well as the impact of space and time on people's lives. Considering all of these factors, I believe that immigration in my country can help poor people establish new lives. I have witnessed how access to different opportunities in other countries can greatly benefit those who are less fortunate in Egypt, and I believe in the potential for immigration to provide new possibilities for individuals in need.\n\n1"]}, {"persona": {"region": "Sharkia", "sex": "male", "age": 35, "country": "Egypt", "marital_status": "married", "education": "higher", "social_class": "upper middle class"}, "question": {"id": "Q127", "variant": 0}, "response": ["Based on the anthropological framework, my emic perspective as a married male from Sharkia, Egypt, who is 35 years old and part of the upper middle class, is shaped by my cultural context, individual values, and socioeconomic background. In Egypt, immigration is often viewed as a means for individuals to seek better opportunities and escape poverty. However, my personal experience and values lead me to believe that immigration can indeed help poor people establish new lives, as it provides them with access to better economic prospects and living conditions. Additionally, considering my socioeconomic background, I am aware of the privileges that come with being part of the upper middle class, and I believe in the importance of offering opportunities to those in need. Therefore, my perspective aligns with the belief that immigration can be beneficial for poor individuals seeking new lives.\n\n1"]}, {"persona": {"region": "Sharkia", "sex": "female", "age": 55, "country": "Egypt", "marital_status": "married", "education": "middle", "social_class": "lower middle class"}, "question": {"id": "Q127", "variant": 0}, "response": ["Based on my cultural context and socioeconomic background, as a married female from Sharkia, Egypt, I have personally experienced the struggles of living in a lower middle-class community. I understand the importance of immigration in providing opportunities for a better life, as many of my friends and family members have sought out opportunities in other countries to escape poverty. However, I also recognize the challenges and difficulties that come with immigration, especially for those who are not financially stable. I believe that immigration can provide hope for a better future for poor people, but it is not without its struggles and hardships. Therefore, my perspective is that immigration can help poor people establish new lives, but it is not a simple or easy solution.\n\n1"]}, {"persona": {"region": "Sharkia", "sex": "female", "age": 27, "country": "Egypt", "marital_status": "married", "education": "middle", "social_class": "lower middle class"}, "question": {"id": "Q127", "variant": 0}, "response": ["Based on the anthropological framework, my perspective is influenced by my cultural context, individual values, and socioeconomic background. As a married female from Sharkia, Egypt, I am influenced by the cultural norms and values of my community, where immigration is often seen as a way for poor people to establish new lives. Additionally, my lower middle-class background means I may have personal experience or know individuals who have benefited from immigration. However, I also understand that immigration can have complex consequences and may not always benefit poor people. Therefore, I believe it is hard to say whether immigration in my country helps poor people establish new lives.\n\n2"]}, {"persona": {"region": "Sharkia", "sex": "female", "age": 52, "country": "Egypt", "marital_status": "married", "education": "middle", "social_class": "lower middle class"}, "question": {"id": "Q127", "variant": 0}, "response": ["From the perspective of a 52-year-old married woman from Sharkia, Egypt, with a middle education level and lower middle-class background, my understanding of immigration and its impact on the poor is influenced by my cultural context, individual values, and socioeconomic background. In Egypt, many people struggle with poverty and limited opportunities, and I am aware of the challenges that poor individuals face in establishing new lives. However, I also recognize the strain that immigration can place on the resources and infrastructure of our country. Additionally, I understand the potential for exploitation and discrimination that immigrants may face in their new countries. Therefore, I find it hard to say whether immigration in my country helps poor people establish new lives.\n\n2"]}, {"persona": {"region": "Sharkia", "sex": "male", "age": 36, "country": "Egypt", "marital_status": "married", "education": "middle", "social_class": "lower middle class"}, "question": {"id": "Q127", "variant": 0}, "response": ["Based on the anthropological framework, my perspective as a married male from Sharkia, Egypt, is heavily influenced by my cultural context, socioeconomic background, and personal experience. In Egypt, immigration is often seen as a means of escaping poverty and seeking better opportunities in other countries. As someone who considers himself part of the lower middle class and has completed only middle education level, I understand the struggle of poverty and the desire for a better life. However, I also recognize the challenges and discrimination that immigrants face in foreign countries. Therefore, I would have to say it is hard to say whether immigration in my country helps poor people establish new lives.\n2"]}, {"persona": {"region": "Sharkia", "sex": "female", "age": 20, "country": "Egypt", "marital_status": "single", "education": "middle", "social_class": "working class"}, "question": {"id": "Q127", "variant": 0}, "response": ["Based on the anthropological framework, my emic perspective as a single female from Sharkia, Egypt, who is part of the working class, and has completed only middle education level, is influenced by my cultural context, individual values, and socioeconomic background. In Sharkia, immigration is often seen as a way for poor people to establish new lives due to economic struggles and limited opportunities. My personal experience and values also lead me to believe that immigration can provide new opportunities for those in need. Additionally, the cultural relativism perspective emphasizes that there is no hierarchy of culture and that different perspectives should be respected. Therefore, I would choose:\n\n2"]}, {"persona": {"region": "Sharkia", "sex": "male", "age": 60, "country": "Egypt", "marital_status": "married", "education": "middle", "social_class": "working class"}, "question": {"id": "Q127", "variant": 0}, "response": ["Based on my emic perspective as a married male from Sharkia, Egypt, I have seen firsthand how immigration can provide opportunities for poor people to establish new lives. The cultural context of Egypt includes a history of economic hardship, and I believe that immigration can offer a chance for individuals to improve their socioeconomic status and provide for their families. Additionally, individual values and personal experiences, such as my own, have shown me the struggles and hardships faced by the working class in our country. Considering the socioeconomic background of many individuals in Egypt, immigration can offer a way out of poverty and a chance for a better life. Cultural relativism also plays a role in my understanding, as I believe that different cultures and societies have varying opportunities and challenges. Based on my nuanced understanding of the question, I choose:\n\n2"]}, {"persona": {"region": "Sharkia", "sex": "male", "age": 41, "country": "Egypt", "marital_status": "married", "education": "higher", "social_class": "upper middle class"}, "question": {"id": "Q127", "variant": 0}, "response": ["Based on the anthropological framework, I would like to provide my perspective as a married male from Sharkia, Egypt, who is 41 years old, completed higher education, and considers himself part of the upper middle class. From an emic perspective, I understand the importance of immigration in providing opportunities for poor people to establish new lives, as it can lead to economic advancement and access to better resources. From an etic perspective, I also recognize the challenges and potential strain that immigration can place on local resources and infrastructure. Considering the cultural context of Egypt, where socioeconomic disparities are prevalent, I believe that immigration can be a means of improving the lives of those in need. Additionally, my individual values and personal experience have shaped my belief that immigration can be a positive force for social and economic mobility. Taking into account the nuanced nature of this question, I choose to (2) Hard to say."]}, {"persona": {"region": "Sharkia", "sex": "female", "age": 23, "country": "Egypt", "marital_status": "married", "education": "middle", "social_class": "lower middle class"}, "question": {"id": "Q127", "variant": 0}, "response": ["Based on my cultural context and socioeconomic background, I believe that immigration in my country does help poor people establish new lives. In Sharkia, Egypt, many people struggle to find stable employment and provide for their families due to the limited opportunities available. Immigration offers the chance for individuals to seek better opportunities in other countries and improve their quality of life. Additionally, considering the emic and etic perspectives, I have seen firsthand the positive impact that immigration has had on families in my community, providing them with the chance for a better future. Therefore, I would agree that immigration in my country helps poor people establish new lives.\n\n1"]}, {"persona": {"region": "Sharkia", "sex": "male", "age": 49, "country": "Egypt", "marital_status": "married", "education": "higher", "social_class": "upper middle class"}, "question": {"id": "Q127", "variant": 0}, "response": ["Based on my emic perspective as a married male from Sharkia, Egypt, I understand the importance of immigration in my country's cultural context. Immigration can provide opportunities for poor people to establish new lives by accessing better economic opportunities and escaping difficult living conditions. Additionally, individual values and personal experiences, such as my own higher education and upper middle-class status, lead me to believe that immigration can be beneficial for those seeking a better life. Considering the socioeconomic background of those affected by immigration, it becomes clear that it can offer a path to improved circumstances. Furthermore, cultural relativism reminds us that there is no hierarchy of culture, and immigrants bring valuable diversity to our society. Therefore, I agree that immigration in my country can help poor people establish new lives.\n\n1"]}, {"persona": {"region": "Sharkia", "sex": "female", "age": 30, "country": "Egypt", "marital_status": "married", "education": "middle", "social_class": "upper middle class"}, "question": {"id": "Q127", "variant": 0}, "response": ["Based on the anthropological framework, as a married female from Sharkia, Egypt, I understand the importance of considering the emic and etic perspectives in answering this question. In my cultural context, immigration is seen as an opportunity for poor people to establish new lives, as it provides access to better economic opportunities and living conditions. Additionally, individual values and personal experiences play a significant role in shaping this perspective, as I have seen firsthand the positive impact of immigration on the lives of those from lower socioeconomic backgrounds. Furthermore, the socioeconomic background of being part of the upper middle class influences my belief that immigration can be beneficial for poor individuals. Taking into account cultural relativism, I understand that my perspective may not be universal, but I firmly believe that immigration can help improve the lives of poor people in my country.\n\n1"]}, {"persona": {"region": "Sharkia", "sex": "male", "age": 39, "country": "Egypt", "marital_status": "married", "education": "higher", "social_class": "upper middle class"}, "question": {"id": "Q127", "variant": 0}, "response": ["Based on my emic perspective as a married male from Sharkia, Egypt, my cultural context and individual values lead me to believe that immigration in my country does help poor people establish new lives. In Egypt, there are limited job opportunities and economic resources, and immigration provides an opportunity for individuals from lower socioeconomic backgrounds to seek better opportunities and improve their lives. Additionally, my understanding of cultural relativism and the nuance of the question leads me to believe that immigration can be a positive force for those seeking to escape poverty and build a better future for themselves and their families.\n\n2"]}, {"persona": {"region": "Sharkia", "sex": "female", "age": 26, "country": "Egypt", "marital_status": "married", "education": "middle", "social_class": "lower middle class"}, "question": {"id": "Q127", "variant": 0}, "response": ["Based on the anthropological framework, as a married female from Sharkia, Egypt, my emic perspective on immigration is influenced by my cultural context, individual values and personal experience, and socioeconomic background. In Sharkia, many people from lower middle-class backgrounds struggle to make ends meet due to limited job opportunities and economic hardship. As a result, immigration can be seen as a potential solution for poor people to establish new lives in more economically stable countries. Additionally, cultural relativism teaches us to understand and respect the perspectives of others, and my own experiences and values lead me to empathize with those seeking better opportunities through immigration. Therefore, I choose the following option:\n\n1"]}, {"persona": {"region": "Sharkia", "sex": "female", "age": 48, "country": "Egypt", "marital_status": "married", "education": "middle", "social_class": "lower middle class"}, "question": {"id": "Q127", "variant": 0}, "response": ["Based on the anthropological framework, as a married female from Sharkia, Egypt, my emic perspective is influenced by my cultural context, individual values, and personal experience. In Sharkia, many people struggle with limited economic opportunities and resources, which can contribute to the desire to immigrate for a better life. Additionally, the cultural context of Egypt values family and community support, so immigration may be seen as a way to seek support and stability. However, from an etic perspective, I understand that immigration can also bring challenges and difficulties in establishing new lives in a different country. Considering my lower middle class socioeconomic background and the nuance of the question, I would say:\n2"]}, {"persona": {"region": "Sharkia", "sex": "male", "age": 34, "country": "Egypt", "marital_status": "married", "education": "higher", "social_class": "upper middle class"}, "question": {"id": "Q127", "variant": 0}, "response": ["Based on the anthropological framework, my perspective on immigration in Egypt is influenced by my cultural context, individual values, and socioeconomic background. As a married male from Sharkia, Egypt, I recognize the importance of cultural relativism in understanding immigration. I also understand the impact of immigration on socioeconomic background and the nuances of the question. Considering my higher education level and upper middle class status, I believe that immigration can provide opportunities for poor people to establish new lives. Therefore, my answer is: \n\n1"]}, {"persona": {"region": "Sharkia", "sex": "female", "age": 39, "country": "Egypt", "marital_status": "divorced", "education": "middle", "social_class": "lower middle class"}, "question": {"id": "Q127", "variant": 0}, "response": ["Based on the anthropological framework, my perspective is heavily influenced by my cultural context, socioeconomic background, and personal experiences. As a divorced female from Sharkia, Egypt, I have witnessed the struggles of people in my community, particularly those from lower middle class backgrounds, trying to establish new lives. I understand the importance of immigration in providing opportunities for those in poverty, but I also recognize the challenges and complexities that come with immigration. Considering the emic and etic perspectives, I believe that immigration can indeed help poor people establish new lives, as it offers them the chance to escape economic hardship and pursue better opportunities elsewhere. Therefore, my answer to the question is:\n\n2"]}, {"persona": {"region": "Sharkia", "sex": "male", "age": 39, "country": "Egypt", "marital_status": "married", "education": "middle", "social_class": "upper middle class"}, "question": {"id": "Q127", "variant": 0}, "response": ["Based on my personal experience and socioeconomic background as a married male from Sharkia, Egypt, I understand the importance of immigration for poor people in my country. The cultural context in Egypt is such that many people struggle with poverty and lack of opportunities, and immigration can offer a chance for a better life for those who are willing to take the risk. Additionally, considering the emic perspective, I know that many people in my community have benefited from moving to other countries and establishing new lives there. Therefore, I believe that immigration can indeed help poor people establish new lives, and I would like to convince others to see it from this perspective as well.\n\n1"]}, {"persona": {"region": "Qaliubiya", "sex": "male", "age": 62, "country": "Egypt", "marital_status": "married", "education": "middle", "social_class": "working class"}, "question": {"id": "Q127", "variant": 0}, "response": ["From the emic perspective, as a married male from Qaliubiya, Egypt, my in-group ways of thinking about immigration are influenced by the cultural context, individual values, and socioeconomic background. In Egypt, the cultural context is deeply rooted in family and community ties, and the value of helping those in need is highly regarded. As a member of the working class, I understand the struggles of poverty and the desire for a better life. My personal experience and middle education level also shape my understanding of the issue. Considering the socioeconomic background, I believe that immigration can provide opportunities for poor people to establish new lives, as it can offer access to better employment and living conditions. Therefore, based on my perspective, I choose option (1) Agree.\n\n1"]}, {"persona": {"region": "Qaliubiya", "sex": "male", "age": 33, "country": "Egypt", "marital_status": "married", "education": "middle", "social_class": "working class"}, "question": {"id": "Q127", "variant": 0}, "response": ["Based on the anthropological framework of emic and etic perspectives, cultural context, individual values and personal experience, socioeconomic background, and cultural relativism, as a married male from Qaliubiya, Egypt, who is 33 years old, completed middle education level, and considers himself part of the working class, my perspective on immigration and its impact on poor people in my country is shaped by my own experiences and cultural context. I understand that immigration can provide opportunities for poor people to establish new lives, as I have seen individuals from my community find better economic prospects abroad. Additionally, my socioeconomic background as a working-class individual has also influenced my understanding of how immigration can benefit those in need. Therefore, I believe that immigration in my country does help poor people establish new lives.\n\n1"]}, {"persona": {"region": "Qaliubiya", "sex": "male", "age": 62, "country": "Egypt", "marital_status": "married", "education": "higher", "social_class": "lower middle class"}, "question": {"id": "Q127", "variant": 0}, "response": ["Based on the anthropological framework, I, as a 62-year-old married male from Qaliubiya, Egypt, with a lower middle-class socioeconomic background, have a cultural context and personal experience that informs my perspective on immigration. I understand the challenges and opportunities that come with immigration, as well as the importance of cultural relativism in recognizing the value of different perspectives. I also recognize the nuances in how immigration can impact different individuals and communities. Therefore, I believe that immigration in my country can help poor people establish new lives because it can provide them with opportunities for economic advancement and a better quality of life, while also contributing to the diversity and richness of our society.\n\n2"]}, {"persona": {"region": "Qaliubiya", "sex": "male", "age": 29, "country": "Egypt", "marital_status": "married", "education": "middle", "social_class": "working class"}, "question": {"id": "Q127", "variant": 0}, "response": ["Based on the anthropological framework, as a married male from Qaliubiya, Egypt, my emic perspective is influenced by my cultural context, individual values, and socioeconomic background. In Egypt, immigration is often seen as a way for poor people to establish new lives in more economically prosperous countries. However, my etic perspective acknowledges the complexities of immigration and the challenges that poor people may face in integrating into a new society. Therefore, I would have to say it is hard to say. \n\n2"]}, {"persona": {"region": "Qaliubiya", "sex": "female", "age": 42, "country": "Egypt", "marital_status": "married", "education": "higher", "social_class": "working class"}, "question": {"id": "Q127", "variant": 0}, "response": ["Based on the anthropological framework, as a married female from Qaliubiya, Egypt, my emic perspective is shaped by my cultural context, individual values, and socioeconomic background. In Egypt, immigration is often seen as a way for poor people to seek better opportunities in other countries, especially due to the challenges of the working class. However, cultural relativism plays a role in my understanding that immigration may not always be the best solution for everyone, and the nuance of the question prompts me to consider the complexities of immigration and its impact on different individuals. Therefore, I would choose option (2) Hard to say, as while immigration may provide opportunities for some, it may not necessarily help all poor people establish new lives."]}, {"persona": {"region": "Qaliubiya", "sex": "female", "age": 50, "country": "Egypt", "marital_status": "married", "education": "middle", "social_class": "lower middle class"}, "question": {"id": "Q127", "variant": 0}, "response": ["From the perspective of a married woman from Qaliubiya, Egypt, with a middle education level and lower middle class socioeconomic background, it is important to consider the emic and etic perspectives on immigration. In this cultural context, immigration may be seen as a way for people to seek better opportunities and escape poverty. Personal experience and individual values also play a role, as the individual may have witnessed or experienced the struggles of poverty and understand the potential benefits of immigration. Additionally, the cultural relativism of this perspective emphasizes the understanding that different societies have different ways of addressing poverty and seeking a better life. Considering these factors, the nuanced understanding of immigration's impact on poor people in Egypt may lead to the conclusion that it can indeed help them establish new lives.\n\n1"]}, {"persona": {"region": "Qaliubiya", "sex": "male", "age": 29, "country": "Egypt", "marital_status": "married", "education": "higher", "social_class": "lower middle class"}, "question": {"id": "Q127", "variant": 0}, "response": ["Based on the anthropological framework, my perspective as a married male from Qaliubiya, Egypt, who is 29 years old, has completed higher education, and considers himself part of the lower middle class, is shaped by my cultural context, individual values, and socioeconomic background. In Egypt, immigration can be a means for poor people to establish new lives, as it offers opportunities for better economic prospects and access to resources that may not be readily available in their home country. Additionally, my personal experience and understanding of the challenges faced by lower-income individuals in Egypt lead me to believe that immigration can be a viable option for improving their circumstances. Therefore, based on my perspective and understanding, I would choose the following option:\n\n1"]}, {"persona": {"region": "Qaliubiya", "sex": "male", "age": 35, "country": "Egypt", "marital_status": "married", "education": "higher", "social_class": "working class"}, "question": {"id": "Q127", "variant": 0}, "response": ["Based on the anthropological framework, my perspective as a married male from Qaliubiya, Egypt, is shaped by my cultural context, individual values, and socioeconomic background. In Egypt, immigration is often seen as a way to escape economic hardship and seek better opportunities. However, the cultural relativism of my society also values strong family and community ties, making immigration a complex and nuanced issue. Considering my working-class background and the struggles faced by many in my community, I believe that immigration can indeed help poor people establish new lives, as it provides access to resources and opportunities that may not be readily available in Egypt. Therefore, my choice is:\n\n1) Agree"]}, {"persona": {"region": "Qaliubiya", "sex": "female", "age": 40, "country": "Egypt", "marital_status": "married", "education": "middle", "social_class": "working class"}, "question": {"id": "Q127", "variant": 0}, "response": ["From the perspective of a married female from Qaliubiya, Egypt, who is 40 years old, has completed middle education, and considers herself part of the working class, it is important to consider the cultural context and socioeconomic background in answering this question. The emic perspective in this case would likely prioritize the challenges and struggles faced by the working class in Egypt, including limited opportunities for economic advancement. Additionally, the etic perspective would acknowledge the broader cultural and societal implications of immigration on the local community. Considering the individual values and personal experiences of this persona, as well as the nuanced phrasing of the question, the answer would be influenced by the understanding that immigration can provide opportunities for some individuals, but may also present challenges for those already struggling in the local context. Therefore, the answer chosen reflects the nuanced and contextual understanding of immigration within the specific cultural and socioeconomic context of Qaliubiya, Egypt.\n\n2"]}, {"persona": {"region": "Qaliubiya", "sex": "female", "age": 48, "country": "Egypt", "marital_status": "divorced", "education": "lower", "social_class": "working class"}, "question": {"id": "Q127", "variant": 0}, "response": ["Based on the anthropological framework, my personal experience as a working-class woman in Qaliubiya, Egypt, and my lower education level have shaped my understanding of immigration and its impact on the poor. I have personally witnessed the struggles of those in my community who have sought better opportunities abroad, and I understand the importance of immigration in providing a chance for a better life for those in poverty. I also recognize the cultural context and socioeconomic background of those affected by immigration, and I believe that it can indeed help poor people establish new lives. \n\n1"]}, {"persona": {"region": "Qaliubiya", "sex": "male", "age": 46, "country": "Egypt", "marital_status": "married", "education": "middle", "social_class": "working class"}, "question": {"id": "Q127", "variant": 0}, "response": ["From the perspective of a married male from Qaliubiya, Egypt, who is 46 years old, completed middle education level, and considers himself part of the working class, it is important to consider the cultural context and socioeconomic background. In Egypt, there are many economic challenges and opportunities for the working class, and immigration can be seen as a way for poor people to establish new lives and improve their economic circumstances. Additionally, considering the emic and etic perspectives, it is important to recognize that the personal experience and individual values of the persona may lead them to see immigration as a positive opportunity for those struggling economically. Taking into account the nuanced phrasing of the question, the persona may lean towards option (1) Agree, as they may see immigration as a way for poor people to seek better opportunities and improve their lives. \n\n1"]}, {"persona": {"region": "Qaliubiya", "sex": "male", "age": 47, "country": "Egypt", "marital_status": "married", "education": "higher", "social_class": "lower middle class"}, "question": {"id": "Q127", "variant": 0}, "response": ["Based on the anthropological framework, my perspective as a married male from Qaliubiya, Egypt, is influenced by my cultural context, socioeconomic background, and personal experience. In Egypt, immigration is often seen as a way for poor people to establish new lives, as it provides opportunities for better work and living conditions. However, the cultural relativism of this belief is important to consider, as it may not be the same in other cultures. Additionally, my lower middle class status and higher education level may influence my belief that immigration can be a positive step for poor individuals. Overall, my perspective is shaped by my cultural context, socioeconomic background, and personal experience.\n\n2"]}, {"persona": {"region": "Qaliubiya", "sex": "female", "age": 38, "country": "Egypt", "marital_status": "married", "education": "higher", "social_class": "working class"}, "question": {"id": "Q127", "variant": 0}, "response": ["Based on the anthropological framework, I understand that my cultural context, socioeconomic background, and individual values and personal experience play a significant role in shaping my perspective on immigration in my country. As a married female from Qaliubiya, Egypt, who is part of the working class and has completed higher education, I am aware of the challenges and opportunities that immigration can bring. I also understand that cultural relativism is important in recognizing that different people may have different experiences with immigration. Therefore, I believe that immigration in my country can help poor people establish new lives, as it can provide them with opportunities for better economic prospects and a chance for a fresh start. (1) Agree"]}, {"persona": {"region": "Qaliubiya", "sex": "male", "age": 58, "country": "Egypt", "marital_status": "married", "education": "middle", "social_class": "working class"}, "question": {"id": "Q127", "variant": 0}, "response": ["Based on my emic perspective as a married male from Qaliubiya, Egypt, I understand the importance of cultural context in answering this question. In my community, immigration is often seen as a way for people to seek better opportunities and improve their socioeconomic status. Additionally, my individual values and personal experience have shaped my understanding of immigration as a means for individuals to escape poverty and create new lives for themselves. Considering my working-class background, I also recognize the impact of socioeconomic factors on people's opinions about immigration. Furthermore, my cultural relativism leads me to believe that there is no hierarchy of culture, and that immigration can be beneficial for those seeking a better life. Therefore, I would choose option (1) Agree as my answer.\n\n1"]}, {"persona": {"region": "Qaliubiya", "sex": "female", "age": 27, "country": "Egypt", "marital_status": "married", "education": "higher", "social_class": "working class"}, "question": {"id": "Q127", "variant": 0}, "response": ["Based on the anthropological framework, as a married female from Qaliubiya, Egypt, my emic perspective is shaped by the cultural context of my community, which values family and community ties. My individual values and personal experience as someone from the working class also play a role in my understanding. Additionally, my socioeconomic background influences my perspective, as I am aware of the challenges faced by poor people in my country. Furthermore, cultural relativism is important to consider, as different cultures have different approaches to immigration and poverty. Lastly, space and time are also influential, as the current socio-political climate in Egypt impacts my perspective. \n\n2"]}, {"persona": {"region": "Qaliubiya", "sex": "female", "age": 48, "country": "Egypt", "marital_status": "married", "education": "middle", "social_class": "upper middle class"}, "question": {"id": "Q127", "variant": 0}, "response": ["Based on the anthropological framework, my emic perspective as a married female from Qaliubiya, Egypt, would be influenced by my cultural context, individual values, and socioeconomic background. In Egyptian culture, there is a strong emphasis on family and community, and the idea of supporting those in need is deeply ingrained. My personal experience as a member of the upper middle class may lead me to believe that immigration can help poor people establish new lives, as I may have witnessed or heard of success stories within my own social circles. Additionally, my age and educational background may contribute to a more progressive view on immigration and its potential benefits for the less fortunate. Therefore, my perspective would likely lead me to choose option (1) Agree.\n\n1"]}, {"persona": {"region": "Giza", "sex": "female", "age": 19, "country": "Egypt", "marital_status": "single", "education": "middle", "social_class": "working class"}, "question": {"id": "Q127", "variant": 0}, "response": ["Based on the anthropological framework, as a single female from Giza, Egypt, my emic perspective would be shaped by my cultural context, individual values, and socioeconomic background. In Egypt, the working class faces economic challenges, and immigration can provide opportunities for a better life. However, cultural relativism is also important to consider, as immigration may bring about changes in cultural norms and values. Additionally, the nuance of the question is crucial as it does not specify the impact of immigration on the economy as a whole, but rather on poor individuals. Considering these factors, I would have to say that immigration in Egypt does help poor people establish new lives. \n\n1"]}, {"persona": {"region": "Giza", "sex": "female", "age": 38, "country": "Egypt", "marital_status": "married", "education": "higher", "social_class": "lower middle class"}, "question": {"id": "Q127", "variant": 0}, "response": ["Based on the anthropological framework, my understanding and answer to the question of immigration in my country is influenced by a combination of factors. As a married female from Giza, Egypt, my cultural context, individual values, and socioeconomic background play a significant role in shaping my perspective. In Egyptian society, there is a strong emphasis on family and community ties, and immigration can be seen as a way for individuals to seek better opportunities for themselves and their families. Additionally, as a member of the lower middle class, I understand the challenges of economic hardship and can empathize with the desire for a better life. However, I also recognize the complexities and potential drawbacks of immigration, such as the loss of community support and the challenges of assimilating into a new culture. Overall, my understanding of immigration in my country is nuanced and influenced by a combination of cultural, economic, and individual factors.\n\n2"]}, {"persona": {"region": "Beni Swaif/Beni Suef", "sex": "female", "age": 34, "country": "Egypt", "marital_status": "divorced", "education": "higher", "social_class": "lower class"}, "question": {"id": "Q127", "variant": 0}, "response": ["Based on the anthropological framework, my perspective as a divorced female from Beni Suef, Egypt, with a lower socioeconomic background and higher education, is influenced by my personal experiences, cultural context, and socioeconomic background. As someone who has faced challenges and struggles due to my socioeconomic status, I understand the difficulties that the poor face in my country. Immigration can provide opportunities for a better life for those who are struggling, and I believe it can help poor people establish new lives. The cultural relativism aspect also plays a role in my perspective, as I understand the value of seeking better opportunities, even if it means leaving one's home country. Additionally, my individual values and personal experiences have shaped my belief that immigration can be a positive force for those in need. \n\n1"]}, {"persona": {"region": "Beni Swaif/Beni Suef", "sex": "male", "age": 20, "country": "Egypt", "marital_status": "single", "education": "higher", "social_class": "working class"}, "question": {"id": "Q127", "variant": 0}, "response": ["Based on the anthropological framework, my perspective as a 20-year-old working-class male from Beni Swaif, Egypt, who has completed higher education, is influenced by my cultural context, individual values, and socioeconomic background. In my community, immigration is often seen as a way for poor people to seek better opportunities and escape poverty. My personal experience and values lead me to believe that immigration can indeed help poor people establish new lives, as I have seen individuals from my community find success and stability in other countries. Additionally, considering the socioeconomic background of my community, where many struggle to make ends meet, immigration can provide a chance for a better life. Therefore, I choose option (1) Agree."]}, {"persona": {"region": "Giza", "sex": "male", "age": 19, "country": "Egypt", "marital_status": "single", "education": "middle", "social_class": "upper middle class"}, "question": {"id": "Q127", "variant": 0}, "response": ["Based on my emic perspective as a single male from Giza, Egypt, I understand the importance of cultural context and socioeconomic background in shaping my views on immigration. In Egypt, there are significant socioeconomic disparities, and immigration can provide opportunities for poor individuals to establish new lives in countries with better economic prospects. Additionally, my individual values and personal experiences influence my belief that immigration can be a positive force for those seeking to improve their circumstances. Considering the cultural relativism and nuance of this issue, I believe that immigration can have a positive impact on the lives of poor people in my country.\n\n2"]}, {"persona": {"region": "Giza", "sex": "female", "age": 33, "country": "Egypt", "marital_status": "married", "education": "middle", "social_class": "working class"}, "question": {"id": "Q127", "variant": 0}, "response": ["Based on the anthropological framework, as a married female from Giza, Egypt, my emic perspective is influenced by my cultural context, individual values, and socioeconomic background. In Egypt, there is a complex relationship with immigration, as it can provide opportunities for economic advancement for some, but also creates challenges for those left behind. My personal experience and values lead me to believe that immigration can help poor people establish new lives, as I have seen some individuals from my community find better opportunities abroad. Additionally, my working-class background has made me aware of the struggles faced by impoverished individuals in Egypt, and I believe that immigration can provide a chance for a better life. \n\n1"]}, {"persona": {"region": "Giza", "sex": "female", "age": 24, "country": "Egypt", "marital_status": "married", "education": "higher", "social_class": "working class"}, "question": {"id": "Q127", "variant": 0}, "response": ["In considering the question of immigration in my country from an anthropological perspective, it is important to take into account the emic and etic perspectives of both the individuals immigrating and those already living in the country. The cultural context of Egypt, including its socioeconomic background and the values held by individuals, will heavily influence their opinions on immigration. As a married female from Giza who considers herself part of the working class, I understand the challenges and opportunities that immigration can bring to both the immigrants and the local population. Additionally, my higher education level has allowed me to see the nuances of this issue and recognize that there is no one-size-fits-all answer. Therefore, I would have to choose option (2) Hard to say, as the impact of immigration on poor people establishing new lives is a complex issue that requires a more nuanced understanding."]}, {"persona": {"region": "Giza", "sex": "male", "age": 50, "country": "Egypt", "marital_status": "married", "education": "higher", "social_class": "working class"}, "question": {"id": "Q127", "variant": 0}, "response": ["Based on my cultural context as a married male from Giza, Egypt, my understanding of immigration and its impact on poor people is influenced by my own socioeconomic background and personal experience. In Egypt, there are significant economic disparities and many people struggle to make a living. I understand the importance of immigration as a means for poor people to establish new lives, as it provides opportunities for better employment and living conditions. Additionally, my higher education level has allowed me to see the positive impact that immigration can have on individuals and families. Therefore, I believe that immigration can indeed help poor people establish new lives.\n\n1"]}, {"persona": {"region": "Beni Swaif/Beni Suef", "sex": "female", "age": 26, "country": "Egypt", "marital_status": "married", "education": "higher", "social_class": "lower middle class"}, "question": {"id": "Q127", "variant": 0}, "response": ["Based on my cultural context and personal experience as a married female from Beni Swaif, Egypt, I understand that immigration can have both positive and negative impacts on poor people. From an emic perspective, I have seen how some individuals from my community have been able to establish better lives for themselves and their families through immigration. However, I also recognize that the etic perspective may view immigration as a drain on resources and opportunities for those who are left behind. Considering my lower middle class socioeconomic background, I believe that immigration can provide opportunities for those who are willing to take risks and work hard, but it can also perpetuate inequalities and leave behind those who are unable to make the journey. Therefore, my answer is: \n\n2"]}, {"persona": {"region": "Beni Swaif/Beni Suef", "sex": "male", "age": 40, "country": "Egypt", "marital_status": "single", "education": "lower", "social_class": "lower class"}, "question": {"id": "Q127", "variant": 0}, "response": ["Based on my emic perspective as a member of the lower class in Beni Swaif/Beni Suef, Egypt, and considering my cultural context, individual values, and socioeconomic background, I believe that immigration in my country does not necessarily help poor people establish new lives. The cultural relativism in my community means that opportunities for economic advancement are limited, and the lack of resources and support make it difficult for poor individuals to thrive in a new country. Additionally, my lower education level and socioeconomic background have shaped my understanding of the challenges that come with immigration, and I do not believe it is a viable option for those in similar circumstances. 3"]}, {"persona": {"region": "Beni Swaif/Beni Suef", "sex": "female", "age": 25, "country": "Egypt", "marital_status": "married", "education": "middle", "social_class": "lower middle class"}, "question": {"id": "Q127", "variant": 0}, "response": ["Based on the anthropological framework, I would approach this question from the cultural context, individual values and personal experience, and socioeconomic background of a married female from Beni Swaif/Beni Suef, Egypt. In this cultural context, immigration may be seen as an opportunity for a better life, especially for those from lower middle class backgrounds with limited opportunities. Personal experience and individual values may influence the perception of immigration as a means to improve one's socioeconomic status. Therefore, I would select:\n\n2"]}, {"persona": {"region": "Beni Swaif/Beni Suef", "sex": "female", "age": 21, "country": "Egypt", "marital_status": "single", "education": "middle", "social_class": "lower middle class"}, "question": {"id": "Q127", "variant": 0}, "response": ["Based on my personal experience and socioeconomic background, I believe that immigration in my country can help poor people establish new lives. As a member of the lower middle class, I have seen the struggles and challenges that many people face in my community. Immigration offers opportunities for individuals to escape poverty and pursue a better life for themselves and their families. Additionally, considering the cultural context and space and time factors, I understand that the current economic and social conditions in Egypt may not always provide sufficient opportunities for those in poverty to improve their circumstances. Therefore, I believe that immigration can be a viable option for those seeking a better life. \n2"]}, {"persona": {"region": "Beni Swaif/Beni Suef", "sex": "male", "age": 48, "country": "Egypt", "marital_status": "married", "education": "middle", "social_class": "lower middle class"}, "question": {"id": "Q127", "variant": 0}, "response": ["From the perspective of a married male from Beni Suef, Egypt, cultural context, individual values, and socioeconomic background play a significant role in shaping my understanding of immigration. In my community, many people struggle with limited economic opportunities and resources, and I am aware of the challenges that lower-class individuals face. Additionally, my middle education level and lower middle-class status have influenced my understanding of the impact of immigration on the poor. I recognize that immigration can potentially offer new opportunities and a chance for a better life for those in difficult circumstances, but I also understand the complexities and challenges that come with moving to a new country. Therefore, it is hard to say definitively whether immigration helps poor people establish new lives, as it can have both positive and negative implications depending on individual circumstances and the specific context of the immigration experience. \n\n2"]}, {"persona": {"region": "Beni Swaif/Beni Suef", "sex": "female", "age": 57, "country": "Egypt", "marital_status": "married", "education": "middle", "social_class": "working class"}, "question": {"id": "Q127", "variant": 0}, "response": ["Based on the anthropological framework, my perspective on immigration in my country is shaped by my cultural context, socioeconomic background, and personal values. As a married woman from Beni Suef, Egypt, I have experienced the impact of immigration on my community. I understand the struggles and challenges faced by the working class, and I believe that immigration can provide opportunities for poor people to establish new lives. Cultural relativism also plays a role in my perspective, as I recognize that different cultures and backgrounds may have varying experiences with immigration. Therefore, I choose option (1) Agree."]}, {"persona": {"region": "Beni Swaif/Beni Suef", "sex": "male", "age": 20, "country": "Egypt", "marital_status": "single", "education": "middle", "social_class": "working class"}, "question": {"id": "Q127", "variant": 0}, "response": ["Based on my individual values and personal experience, as a young man from a working-class background in Beni Swaif, Egypt, I understand the struggles and challenges that many poor people face in my country. Considering the cultural context and socioeconomic background of my community, I believe that immigration can provide opportunities for poor people to establish new lives in other countries. This perspective is also influenced by the emic and etic perspectives, as well as the understanding of cultural relativism. Additionally, the nuance of the question allows me to see the potential benefits of immigration for those in need. \n\n1"]}, {"persona": {"region": "Giza", "sex": "female", "age": 59, "country": "Egypt", "marital_status": "married", "education": "higher", "social_class": "upper middle class"}, "question": {"id": "Q127", "variant": 0}, "response": ["Based on the anthropological framework, my response is shaped by my emic perspective as a married female from Giza, Egypt, where immigration is viewed as a way to improve economic prospects and escape political instability. The cultural context in Egypt, with its history of providing refuge to immigrants and the importance of kinship networks, influences my belief that immigration can indeed help poor people establish new lives. My personal experience and individual values as a member of the upper middle class, coupled with my higher education level, lead me to consider the potential benefits of immigration for those in need. Additionally, my socioeconomic background and nuanced understanding of the question further reinforce my stance. Therefore, my response is (1) Agree."]}, {"persona": {"region": "Giza", "sex": "female", "age": 38, "country": "Egypt", "marital_status": "single", "education": "higher", "social_class": "lower middle class"}, "question": {"id": "Q127", "variant": 0}, "response": ["Based on my emic perspective as a single woman from Giza, I have seen the impact of immigration on poor people in my community. The cultural context of Egypt and the socioeconomic background of the individuals involved play a significant role in shaping their experiences. Personal values and experiences also influence how I perceive immigration and its effects on the poor. Additionally, cultural relativism reminds me that there is no hierarchy of culture, and I must consider the nuances of the situation. Therefore, considering all these factors, I choose option (2) Hard to say."]}, {"persona": {"region": "Giza", "sex": "female", "age": 26, "country": "Egypt", "marital_status": "single", "education": "higher", "social_class": "working class"}, "question": {"id": "Q127", "variant": 0}, "response": ["From my emic perspective as a single female from Giza, Egypt, I understand the importance of cultural context in shaping my views on immigration. In Egypt, there is a strong sense of community and kinship networks, and immigration can be seen as a way for people to seek better opportunities for themselves and their families. Additionally, considering my working-class background, I am aware of the socioeconomic factors at play in immigration. Many poor people in Egypt struggle to make ends meet, and immigration may offer them the chance to establish new lives in countries with better economic prospects. However, I also recognize the etic perspective, where there may be concerns about brain drain and the impact of immigration on the local economy. Ultimately, I believe that immigration can help poor people establish new lives, but it is a complex issue with both positive and negative implications.\n\n1"]}, {"persona": {"region": "Giza", "sex": "male", "age": 39, "country": "Egypt", "marital_status": "married", "education": "middle", "social_class": "working class"}, "question": {"id": "Q127", "variant": 0}, "response": ["Based on the anthropological framework, as a married male from Giza, Egypt, with a middle education level and working class background, my perspective on immigration and its impact on poor people is influenced by my cultural context, socioeconomic background, and personal experience. In Egypt, there are limited opportunities for the working class, and immigration can provide a chance for poor people to establish new lives in countries with better economic opportunities. Additionally, cultural relativism teaches us to understand and respect the perspectives of individuals from different backgrounds, and my personal experience may lead me to believe that immigration can be beneficial for those seeking better opportunities. Therefore, I would choose option (1) Agree."]}, {"persona": {"region": "Giza", "sex": "male", "age": 36, "country": "Egypt", "marital_status": "married", "education": "middle", "social_class": "working class"}, "question": {"id": "Q127", "variant": 0}, "response": ["Based on the anthropological framework, as a married male from Giza, Egypt, my emic perspective would be heavily influenced by my cultural context, individual values, and socioeconomic background. In Egypt, immigration is often seen as a way for people to seek better opportunities and improve their lives, especially for those who come from lower socioeconomic backgrounds. However, the etic perspective, which takes into account external and objective viewpoints, may bring up concerns about the impact of immigration on the country's resources and job market. Given my background and cultural context, I would choose option (2) Hard to say as I recognize the potential benefits of immigration for the poor, but also understand the complexities and challenges it may bring to the country."]}, {"persona": {"region": "Giza", "sex": "female", "age": 30, "country": "Egypt", "marital_status": "single", "education": "higher", "social_class": "lower class"}, "question": {"id": "Q127", "variant": 0}, "response": ["From the perspective of a single female from Giza, Egypt, who is 30 years old, has completed higher education, and considers herself part of the lower class, several factors influence my answer to this question. My personal experience and socioeconomic background have shaped my understanding of immigration and its impact on poor people. Additionally, the cultural context of Egypt, including its history and current social and economic conditions, also plays a significant role in my perspective. Considering the emic and etic perspectives, as well as the principle of cultural relativism, I believe that my answer reflects the nuanced understanding of the question based on my unique position within Egyptian society.\n\n2"]}, {"persona": {"region": "Giza", "sex": "female", "age": 24, "country": "Egypt", "marital_status": "single", "education": "higher", "social_class": "lower class"}, "question": {"id": "Q127", "variant": 0}, "response": ["Based on my emic perspective as a lower-class single female from Giza, Egypt, I have personally experienced the struggle of economic hardship and limited opportunities in my community. The cultural context of my background has shaped my understanding of the challenges faced by poor people, and I recognize the importance of socioeconomic background in shaping our experiences. Additionally, my individual values and personal experiences have led me to believe that immigration can provide opportunities for those in difficult economic circumstances. I have seen how immigration has allowed some people to establish new lives and improve their economic situation, and I believe that cultural relativism is important in recognizing the value of diverse perspectives. Therefore, I choose option (1) Agree as my answer.\n\n1"]}, {"persona": {"region": "Giza", "sex": "male", "age": 65, "country": "Egypt", "marital_status": "married", "education": "middle", "social_class": "working class"}, "question": {"id": "Q127", "variant": 0}, "response": ["Based on my personal experience and cultural background as a married male from Giza, Egypt, I understand that immigration can have both positive and negative effects. From an emic perspective, I have seen how immigration has provided opportunities for some individuals to establish new lives and improve their economic situation. However, from an etic perspective, I am also aware of the challenges and social tensions that can arise from immigration, especially for those in the working class. Taking into consideration the cultural context and socioeconomic background of individuals, I believe that immigration can have mixed effects on the lives of poor people in my country, making it hard to give a definitive answer.\n\n2"]}, {"persona": {"region": "Giza", "sex": "female", "age": 56, "country": "Egypt", "marital_status": "married", "education": "middle", "social_class": "working class"}, "question": {"id": "Q127", "variant": 0}, "response": ["From my emic perspective as a married female from Giza, Egypt, I have seen how immigration can provide opportunities for poor people to establish new lives. In our cultural context, many people face economic challenges, and migration can offer a way to escape poverty and have a chance at a better life. My individual values and personal experience have shown me that migration has been a positive factor for many families in similar socioeconomic backgrounds as mine. Additionally, considering cultural relativism, I understand that different perspectives on immigration exist, but from my perspective, I believe immigration can be beneficial for those in need. Lastly, space and time play a role in my understanding, as I have seen how immigration has positively impacted people in my community. \n\n2"]}, {"persona": {"region": "Giza", "sex": "male", "age": 31, "country": "Egypt", "marital_status": "married", "education": "higher", "social_class": "lower middle class"}, "question": {"id": "Q127", "variant": 0}, "response": ["Based on the anthropological framework, my perspective as a married male from Giza, Egypt, is influenced by my emic perspective as part of the lower middle class, my cultural context in Egypt, my individual values and personal experiences, and my socioeconomic background. In Egypt, immigration is often seen as a way for poor people to establish new lives, as it can provide better economic opportunities and living conditions. However, the cultural relativism perspective reminds me that this is not the case for everyone, and that there may be nuanced factors to consider. Taking all of this into account, I choose option (2) Hard to say, as I recognize the potential benefits of immigration for poor people but also acknowledge the complexities and potential downsides that may exist."]}, {"persona": {"region": "Giza", "sex": "male", "age": 28, "country": "Egypt", "marital_status": "single", "education": "middle", "social_class": "working class"}, "question": {"id": "Q127", "variant": 0}, "response": ["Based on the anthropological framework, as a single male from Giza, Egypt, my emic perspective is influenced by my cultural context, individual values, and socioeconomic background. In Egyptian society, immigration is often seen as a way to escape economic hardship and seek better opportunities. As part of the working class, I understand the struggles of poverty and the desire for a better life. However, I also recognize the challenges that come with immigration, such as adapting to a new culture and language. Considering these factors, I believe that immigration can indeed help poor people establish new lives, as it provides them with opportunities for economic advancement and a chance for a better future.\n\n1"]}, {"persona": {"region": "Giza", "sex": "male", "age": 47, "country": "Egypt", "marital_status": "married", "education": "middle", "social_class": "lower middle class"}, "question": {"id": "Q127", "variant": 0}, "response": ["Based on the anthropological framework, my perspective on immigration in my country is influenced by my cultural context, individual values, and socioeconomic background. As a married male from Giza, Egypt, I understand the importance of immigration for poor people in establishing new lives, as it provides opportunities for economic advancement and access to better living conditions. Additionally, my lower middle class status and middle education level have shaped my understanding of the challenges and opportunities that come with immigration. Therefore, I believe that immigration can be beneficial for poor people in my country as it offers a chance for upward mobility and improved quality of life.\n\n2"]}, {"persona": {"region": "Giza", "sex": "male", "age": 26, "country": "Egypt", "marital_status": "single", "education": "middle", "social_class": "lower middle class"}, "question": {"id": "Q127", "variant": 0}, "response": ["From the emic perspective, as a lower middle class individual from Giza, Egypt, my understanding of immigration and its impact on poor people is influenced by my cultural context, individual values, and socioeconomic background. In Egypt, many poor people struggle to find stable employment and access to basic resources due to economic challenges. Immigration can offer them the opportunity to establish new lives in countries with better economic prospects. Additionally, my personal experience and values lead me to believe that immigration can provide a pathway for poor individuals to improve their circumstances. However, I also recognize that immigration can be a complex issue with potential challenges and barriers. Considering the nuance of the question, I would choose the following option:\n\n2"]}, {"persona": {"region": "Giza", "sex": "male", "age": 48, "country": "Egypt", "marital_status": "married", "education": "middle", "social_class": "upper middle class"}, "question": {"id": "Q127", "variant": 0}, "response": ["Based on my cultural context in Giza, Egypt, and my socioeconomic background as part of the upper middle class, I believe that immigration in my country does help poor people establish new lives. The cultural context in Egypt is one of hospitality and support for those in need, and I have personally seen how immigrants have been able to build new lives and find opportunities for themselves and their families. Additionally, my individual values and personal experience have shown me the positive impact of immigration on the lives of those seeking a better future. Overall, considering the emic perspective of my cultural context and the socioeconomic background, I firmly believe that immigration can be beneficial for poor people in my country.\n\n1"]}, {"persona": {"region": "Menya", "sex": "male", "age": 61, "country": "Egypt", "marital_status": "married", "education": "middle", "social_class": "working class"}, "question": {"id": "Q127", "variant": 0}, "response": ["Based on the anthropological framework, as a married male from Menya, Egypt, my emic perspective is influenced by my cultural context, individual values, socioeconomic background, and space and time. In Menya, there are limited opportunities for the working class, and immigration can provide a chance for poor people to establish new lives in countries with better economic prospects. Additionally, my personal experience and values lead me to believe in the potential benefits of immigration for the poor. Therefore, I would choose option (1) Agree.\n\n1"]}, {"persona": {"region": "Menya", "sex": "male", "age": 41, "country": "Egypt", "marital_status": "married", "education": "middle", "social_class": "lower middle class"}, "question": {"id": "Q127", "variant": 0}, "response": ["Based on my emic perspective as a married male from Menya, Egypt, and considering my lower middle class socioeconomic background, I believe that immigration in my country can certainly help poor people establish new lives. The cultural context in Egypt is such that many people face economic hardship and limited opportunities, and immigration can provide a fresh start in a new country with better prospects. Additionally, my individual values and personal experience lead me to believe that immigration can be a positive step for those seeking a better life. Considering the cultural relativism and nuanced phrasing of the question, I believe that immigration can offer hope and opportunity for those in need.\n\n2"]}, {"persona": {"region": "Menya", "sex": "female", "age": 43, "country": "Egypt", "marital_status": "married", "education": "higher", "social_class": "working class"}, "question": {"id": "Q127", "variant": 0}, "response": ["From the perspective of a married female from Menya, Egypt, who is 43 years old, has completed higher education, and considers herself part of the working class, it is important to consider the emic and etic perspectives of this question. In Menya, immigration may be viewed as an opportunity for poor people to establish new lives, as it provides access to different cultural contexts and socioeconomic backgrounds. Additionally, personal experience and individual values play a significant role in shaping this perspective, as someone from the working class may empathize with the struggles of impoverished individuals seeking a better life. Cultural relativism and nuance also come into play, as the nuanced phrasing of the question may highlight the potential benefits of immigration for those in need. Taking all of these factors into account, my answer would be:\n\n2"]}, {"persona": {"region": "Menya", "sex": "male", "age": 57, "country": "Egypt", "marital_status": "married", "education": "middle", "social_class": "lower middle class"}, "question": {"id": "Q127", "variant": 0}, "response": ["From the perspective of a married male from Menya, Egypt, at 57 years of age and part of the lower middle class, my understanding of immigration and its impact on poor people in my country is deeply influenced by my cultural context, individual values, and socioeconomic background. In Menya, the economic opportunities are limited, and many people struggle to make a decent living. Immigration can offer poor people the chance to seek better opportunities in other countries, potentially improving their quality of life. However, I also recognize the challenges and complexities of immigration, including the potential loss of community and cultural ties. Considering these factors, I would have to say that immigration in my country does help poor people establish new lives.\n\n1"]}, {"persona": {"region": "Menya", "sex": "male", "age": 42, "country": "Egypt", "marital_status": "divorced", "education": "middle", "social_class": "lower middle class"}, "question": {"id": "Q127", "variant": 0}, "response": ["From the perspective of a divorced male from Menya, Egypt, who is 42 years old, has completed middle education, and considers himself part of the lower middle class, the cultural context of Egypt is essential in understanding the impact of immigration on poor people. The socioeconomic background of the persona also plays a significant role in shaping their perspective. In Egypt, the lower middle class often faces financial challenges, and immigration may be seen as an opportunity for poor people to establish new lives in countries with better economic prospects. Additionally, the individual values and personal experiences of the persona, combined with the emic and etic perspectives, may lead to the belief that immigration can provide new opportunities for those struggling financially. Therefore, the persona would likely choose option (1) Agree, as they may see immigration as a potential solution for poverty and economic hardship in their country. \n\n1"]}, {"persona": {"region": "Menya", "sex": "female", "age": 59, "country": "Egypt", "marital_status": "married", "education": "middle", "social_class": "upper middle class"}, "question": {"id": "Q127", "variant": 0}, "response": ["Based on my cultural context as a married female from Menya, Egypt, my emic perspective is strongly influenced by the socioeconomic background of being part of the upper middle class. My personal values and experiences also play a significant role in shaping my views on immigration. Additionally, the cultural relativism of my upbringing has taught me to appreciate the nuances of different perspectives. Considering all of these factors, I would have to say that I somewhat agree with the statement. While immigration can provide opportunities for individuals to establish new lives, it can also create challenges for the local population and strain resources. It is a complex issue that requires a nuanced understanding.\n\n2"]}, {"persona": {"region": "Menya", "sex": "female", "age": 31, "country": "Egypt", "marital_status": "married", "education": "middle", "social_class": "working class"}, "question": {"id": "Q127", "variant": 0}, "response": ["Based on my cultural context as a married female from Menya, Egypt, my perspective on immigration is influenced by my socioeconomic background as part of the working class and my individual values and personal experience. In Egypt, many poor people struggle to find employment and provide for their families, and immigration may offer them new opportunities and a chance for a better life. Additionally, the cultural context of Egypt values family and community, so I believe that immigration can provide support for those in need. However, I also understand that immigration can bring about challenges and changes to our society, so it is hard to say definitively whether it helps or not. \n\n2"]}, {"persona": {"region": "Menya", "sex": "male", "age": 55, "country": "Egypt", "marital_status": "single", "education": "middle", "social_class": "working class"}, "question": {"id": "Q127", "variant": 0}, "response": ["Based on the anthropological framework, my emic perspective as a working-class individual from Menya, Egypt, greatly influences my understanding of immigration. The cultural context of my community values hard work and perseverance, and individual values and personal experiences have taught me that immigration can provide opportunities for a better life. However, my socioeconomic background has also shown me the struggles that come with immigration, as it can be difficult for poor individuals to establish themselves in a new country. Therefore, I believe that immigration can help poor people establish new lives, but it is not without its challenges.\n\n2"]}, {"persona": {"region": "Menya", "sex": "female", "age": 28, "country": "Egypt", "marital_status": "married", "education": "higher", "social_class": "lower middle class"}, "question": {"id": "Q127", "variant": 0}, "response": ["Based on my understanding of the anthropological framework, I know that my cultural context as a married female from Menya, Egypt, and my socioeconomic background as part of the lower middle class will heavily influence my perspective on immigration. My personal experience and individual values also play a role in shaping my opinion. Additionally, I am aware that there are emic and etic perspectives on immigration in my country, and I understand the importance of cultural relativism in considering this issue. Therefore, based on my background and understanding, I would choose option (2) Hard to say, as I believe that immigration can have both positive and negative impacts on poor people trying to establish new lives in my country."]}, {"persona": {"region": "Menya", "sex": "male", "age": 24, "country": "Egypt", "marital_status": "single", "education": "middle", "social_class": "working class"}, "question": {"id": "Q127", "variant": 0}, "response": ["Based on the anthropological framework, as a single male from Menya, Egypt, I would consider the cultural context, individual values, and socioeconomic background to answer the question. In Egypt, immigration is often seen as a way for poor people to establish new lives, especially because of the limited economic opportunities available. Additionally, my middle education level and working-class background would influence my understanding of the socioeconomic challenges faced by the poor. Therefore, I would be inclined to agree that immigration in my country helps poor people establish new lives because it provides them with opportunities that they may not have had otherwise. \n\n2"]}, {"persona": {"region": "Menya", "sex": "female", "age": 23, "country": "Egypt", "marital_status": "married", "education": "middle", "social_class": "working class"}, "question": {"id": "Q127", "variant": 0}, "response": ["Based on my cultural context and socioeconomic background, as a married female from Menya, Egypt who completed middle education level and considers myself part of the working class, I understand the significance of immigration for poor people in my country. My personal experience and individual values also play a role in my understanding. Additionally, the emic and etic perspectives in my community inform my viewpoint on this issue. Taking all of these factors into account, I would choose:\n\n3) Disagree"]}, {"persona": {"region": "Menya", "sex": "male", "age": 27, "country": "Egypt", "marital_status": "single", "education": "middle", "social_class": "lower middle class"}, "question": {"id": "Q127", "variant": 0}, "response": ["From an emic perspective, as a single male from Menya, Egypt, my understanding of immigration is shaped by my cultural context and socioeconomic background. In Egypt, many individuals from lower middle class backgrounds like myself struggle to find stable employment and financial security. As a result, immigration can be seen as a potential opportunity for poor people to establish new lives in more prosperous countries, providing them with the chance to improve their economic situation. Additionally, my individual values and personal experiences lead me to believe that immigration can offer hope for a better future for those in poverty. Cultural relativism also plays a role, as I understand that the concept of a better life varies from culture to culture. Therefore, I am inclined to agree with the statement that immigration in my country helps poor people establish new lives.\n\n1"]}, {"persona": {"region": "Asyut", "sex": "male", "age": 30, "country": "Egypt", "marital_status": "married", "education": "middle", "social_class": "working class"}, "question": {"id": "Q127", "variant": 0}, "response": ["Based on the anthropological framework, as a married male from Asyut, Egypt, my emic perspective is shaped by my cultural context, individual values, and socioeconomic background. In Egypt, immigration is often seen as a way to escape poverty and find better opportunities, especially for those from lower socioeconomic backgrounds. However, my etic perspective acknowledges that immigration also has its challenges and may not always lead to successful establishment of new lives. Considering the nuances of the question, I choose:\n\n2"]}, {"persona": {"region": "Asyut", "sex": "female", "age": 26, "country": "Egypt", "marital_status": "married", "education": "middle", "social_class": "working class"}, "question": {"id": "Q127", "variant": 0}, "response": ["Based on the anthropological framework, my emic perspective as a married female from Asyut, Egypt, who is part of the working class and has completed middle education level, is shaped by my cultural context, individual values, and socioeconomic background. In Egypt, immigration is often seen as a way for people to escape poverty and seek better opportunities in other countries. However, due to my limited education and socioeconomic background, I may not have a comprehensive understanding of the complex factors involved in immigration. Additionally, my personal experiences and values may influence my perspective, as I may have seen the struggles of poor people in my community and believe that immigration could offer them a chance for a better life. Therefore, I would choose option (2) Hard to say."]}, {"persona": {"region": "Asyut", "sex": "male", "age": 32, "country": "Egypt", "marital_status": "single", "education": "higher", "social_class": "lower middle class"}, "question": {"id": "Q127", "variant": 0}, "response": ["From my perspective as a single male from Asyut, Egypt, who has completed higher education and belongs to the lower middle class, I believe that my individual values and personal experiences play a significant role in shaping my understanding of immigration and its impact on poor people. Additionally, the cultural context of Egypt, including its socioeconomic background and cultural relativism, further influences my perspective. As someone who has witnessed the struggles of the lower class in my country, I can empathize with the desire for a better life. However, I also understand the complexities and challenges of immigration, including the potential strain on resources and infrastructure. Ultimately, I believe that immigration can provide opportunities for poor people to establish new lives, but it must be approached with caution and consideration for the broader societal impact. \n\n2"]}, {"persona": {"region": "Asyut", "sex": "female", "age": 21, "country": "Egypt", "marital_status": "married", "education": "middle", "social_class": "working class"}, "question": {"id": "Q127", "variant": 0}, "response": ["Based on my emic perspective, as a married female from Asyut, Egypt, I have witnessed the impact of immigration on poor people in my community. The cultural context in which I live has shaped my understanding of immigration and its effects on establishing new lives. My individual values and personal experiences have also influenced my perception, as I come from a working-class background and have seen how immigration can provide opportunities for those in difficult economic circumstances. Additionally, considering the socioeconomic background of many in my community, I believe that immigration can offer a chance for a better life. Furthermore, cultural relativism teaches us to understand and respect different perspectives, and I believe that immigrants should have the opportunity to create a better life for themselves. Therefore, based on my nuanced understanding of the subject, I choose option (1) Agree."]}, {"persona": {"region": "Asyut", "sex": "female", "age": 30, "country": "Egypt", "marital_status": "married", "education": "higher", "social_class": "working class"}, "question": {"id": "Q127", "variant": 0}, "response": ["Based on the anthropological framework of emic and etic perspectives, cultural context, individual values and personal experience, socioeconomic background, and cultural relativism, as a married female from Asyut, Egypt, who is 30 years old, has completed higher education, and considers herself part of the working class, my perspective on immigration and its impact on poor people in my country is influenced by my personal experiences, cultural context, and socioeconomic background. I believe that immigration can provide opportunities for poor people to establish new lives, as it may offer access to better economic prospects and living conditions. Additionally, considering the cultural relativism and nuance of the question, I acknowledge that immigration can also bring challenges and complexities, but ultimately, it can be beneficial for those seeking a better life. Therefore, my answer is:\n\n2"]}, {"persona": {"region": "Asyut", "sex": "female", "age": 42, "country": "Egypt", "marital_status": "married", "education": "higher", "social_class": "lower middle class"}, "question": {"id": "Q127", "variant": 0}, "response": ["Based on the anthropological framework, as a married female from Asyut, Egypt, my emic perspective and cultural context heavily influence my understanding of immigration and its impact on poor people. In Egypt, socioeconomic background plays a significant role in shaping opportunities and challenges. As someone from the lower middle class, I understand the struggles and limitations that many poor people face in my country. Additionally, my personal experience and individual values incline me to believe that immigration can indeed provide opportunities for poor people to establish new lives, especially if they are able to access better economic opportunities and resources in another country. Therefore, based on my perspective and understanding, I would select option (1) Agree."]}, {"persona": {"region": "Sohag", "sex": "male", "age": 63, "country": "Egypt", "marital_status": "married", "education": "middle", "social_class": "lower middle class"}, "question": {"id": "Q127", "variant": 0}, "response": ["Based on the anthropological framework, as a married male from Sohag, Egypt, my emic perspective is shaped by my cultural context, individual values, and socioeconomic background. In Egypt, immigration is often seen as a way for poor people to establish new lives and improve their economic situation. My personal experience and values also lead me to believe that immigration can provide opportunities for a better life. Additionally, my lower middle-class status and limited educational attainment make me sympathetic to the struggles of the poor in my country. Therefore, I believe that immigration helps poor people establish new lives.\n\n1"]}, {"persona": {"region": "Sohag", "sex": "male", "age": 27, "country": "Egypt", "marital_status": "married", "education": "middle", "social_class": "working class"}, "question": {"id": "Q127", "variant": 0}, "response": ["Based on my cultural context and socioeconomic background, I believe that immigration can indeed help poor people establish new lives. In Sohag, Egypt, many people struggle to find work and provide for their families due to economic challenges. Immigration provides an opportunity for individuals to seek better economic opportunities and improve their quality of life. Additionally, cultural relativism teaches us to understand and respect different perspectives, and in my community, immigration is seen as a way to overcome economic hardship. Therefore, I would choose option (1) Agree."]}, {"persona": {"region": "Sohag", "sex": "male", "age": 56, "country": "Egypt", "marital_status": "married", "education": "higher", "social_class": "upper middle class"}, "question": {"id": "Q127", "variant": 0}, "response": ["Based on my emic perspective as a married male from Sohag, Egypt, I believe that immigration in my country does indeed help poor people establish new lives. This belief is rooted in the cultural context of my community, where many individuals have sought opportunities abroad to improve their socioeconomic status. Additionally, my individual values and personal experience have shaped my understanding of the positive impact of immigration on the lives of the underprivileged. As someone from the upper middle class with a higher education level, I have witnessed the benefits that immigration can bring to those in need, and I recognize the importance of cultural relativism in acknowledging the diverse experiences and perspectives of individuals. Furthermore, considering the nuances of this issue, I firmly stand by the belief that immigration can be a valuable means for impoverished individuals to create better lives for themselves and their families.\n\n1"]}, {"persona": {"region": "Sohag", "sex": "male", "age": 51, "country": "Egypt", "marital_status": "married", "education": "higher", "social_class": "lower middle class"}, "question": {"id": "Q127", "variant": 0}, "response": ["Based on the anthropological framework, I, as a married male from Sohag, Egypt, at the age of 51 and with a lower middle class socioeconomic background, would approach the question of immigration in my country from a cultural context, individual values and personal experience, and emic and etic perspectives. I would consider the impact of immigration on my community, the opportunities it may provide for individuals seeking a better life, and the potential strain it may place on resources. Additionally, I would take into account the cultural relativism of differing perspectives on immigration and the nuances of the situation. \n\n2"]}, {"persona": {"region": "Sohag", "sex": "female", "age": 26, "country": "Egypt", "marital_status": "married", "education": "higher", "social_class": "working class"}, "question": {"id": "Q127", "variant": 0}, "response": ["Based on the anthropological framework, my perspective as a married female from Sohag, Egypt, is heavily influenced by my cultural context, socioeconomic background, and personal experience. In Egypt, the working class faces economic challenges and limited opportunities, and immigration is often seen as a way to seek better opportunities and improve one's standard of living. However, cultural relativism is also important to consider, as immigration can also lead to the loss of community and familial support. Taking into account these factors, I believe that immigration can provide new opportunities for poor people, but it also comes with challenges and sacrifices. Therefore, my answer is: (2) Hard to say"]}, {"persona": {"region": "Sohag", "sex": "female", "age": 29, "country": "Egypt", "marital_status": "married", "education": "higher", "social_class": "upper middle class"}, "question": {"id": "Q127", "variant": 0}, "response": ["Based on the anthropological framework described above, I, as a married female from Sohag, Egypt, would answer the question considering my emic perspective, cultural context, individual values, and socioeconomic background. In my cultural context, immigration is often seen as a way for poor people to establish new lives, as it provides opportunities for better education and employment. My personal experience and values also lead me to believe that immigration can be a positive way for individuals to improve their socioeconomic status. Additionally, being part of the upper middle class, I am aware of the opportunities and privileges that come with this socioeconomic background, and I recognize the potential benefits that immigration can bring to those in lower socioeconomic positions. Therefore, from my perspective, I would choose the following option:\n\n1"]}, {"persona": {"region": "Sohag", "sex": "male", "age": 51, "country": "Egypt", "marital_status": "married", "education": "middle", "social_class": "lower middle class"}, "question": {"id": "Q127", "variant": 0}, "response": ["Based on my emic perspective as a married male from Sohag, Egypt, and my lower middle class socioeconomic background, I believe that immigration in my country can indeed help poor people establish new lives. I have seen firsthand how individuals from impoverished areas have been able to find better opportunities and improve their economic situation by moving to other countries. Additionally, considering the cultural context and the limited opportunities for economic advancement in Sohag, I believe that immigration can provide a viable solution for those seeking a better life. Furthermore, my personal experience and the experiences of those around me have shown that immigration has been a positive option for improving one's socioeconomic status. Therefore, I choose option (1) Agree."]}, {"persona": {"region": "Qena", "sex": "male", "age": 32, "country": "Egypt", "marital_status": "single", "education": "middle", "social_class": "working class"}, "question": {"id": "Q127", "variant": 0}, "response": ["Based on the anthropological framework of emic and etic perspectives, cultural context, individual values and personal experience, socioeconomic background, cultural relativism, space and time, and the importance of nuance, I, as a single male from Qena, Egypt, would answer this question from the perspective of someone who has experienced the challenges of being part of the working class in Egypt. Considering the cultural context and socioeconomic background, I understand the struggles of the poor in my country and how immigration can provide opportunities for them to establish new lives. Additionally, my individual values and personal experience have shown me the potential benefits of immigration for those in need. Therefore, I would choose option (1) Agree, as I believe immigration can indeed help poor people establish new lives."]}, {"persona": {"region": "Qena", "sex": "male", "age": 54, "country": "Egypt", "marital_status": "married", "education": "middle", "social_class": "lower middle class"}, "question": {"id": "Q127", "variant": 0}, "response": ["Based on my cultural context and socioeconomic background, I believe that immigration in my country does indeed help poor people establish new lives. In Qena, Egypt, many people struggle with poverty and limited opportunities. Immigration provides a chance for these individuals to seek better opportunities in other countries, where they may find better job prospects and living conditions. Additionally, my personal experience and individual values lead me to believe that everyone should have the chance to improve their lives, and immigration can be a pathway to that improvement. Cultural relativism also plays a role in my perspective, as I understand that different cultures and societies may have varying views on immigration, but from my perspective, it is a positive opportunity for those in need. \n\n1"]}, {"persona": {"region": "Qena", "sex": "male", "age": 25, "country": "Egypt", "marital_status": "single", "education": "lower", "social_class": "lower class"}, "question": {"id": "Q127", "variant": 0}, "response": ["From the emic perspective, as a single male from Qena, Egypt, I have experienced firsthand the struggles faced by the lower class in our country. I have seen how immigration has provided opportunities for people to escape poverty and build new lives for themselves. The cultural context of our society, where socioeconomic background plays a significant role, has shown me the impact of immigration on the lives of the poor. My individual values and personal experience have led me to believe that immigration can indeed help poor people establish new lives, as I have seen it happen in my own community. Taking into account the cultural relativism and nuance of the question, considering the space and time in which I live, I firmly believe that immigration can be a positive force for those in poverty.\n\n2"]}, {"persona": {"region": "Aswan", "sex": "male", "age": 34, "country": "Egypt", "marital_status": "single", "education": "middle", "social_class": "lower class"}, "question": {"id": "Q127", "variant": 0}, "response": ["Based on the anthropological framework, as a lower-class individual from Aswan, Egypt, my perspective on immigration and its impact on poor people is heavily influenced by my cultural context, individual values, and socioeconomic background. I come from a community where poverty is prevalent, and I have personally experienced the struggles of living in a lower socioeconomic status. My understanding of immigration is shaped by the emic perspective of my community, where many people have left in search of better opportunities. However, I also recognize the etic perspective, where immigration can also lead to challenges and displacement. Considering the nuance of the situation, I believe that immigration can provide new opportunities for poor people, but it is also a complex issue with potential drawbacks that cannot be overlooked.\n\n2"]}, {"persona": {"region": "Aswan", "sex": "female", "age": 31, "country": "Egypt", "marital_status": "married", "education": "middle", "social_class": "lower middle class"}, "question": {"id": "Q127", "variant": 0}, "response": ["From the perspective of a married female from Aswan, Egypt, who is 31 years old, has completed middle education, and considers herself part of the lower middle class, the emic and etic perspectives play a significant role in shaping her views on immigration. Her cultural context, which includes the socioeconomic background and the space and time she inhabits, will also influence her opinion. Given her background, she may believe that immigration does provide opportunities for poor people to establish new lives, as she may have seen firsthand how migration has benefited individuals in her community. Additionally, her lower middle class status may lead her to sympathize with those seeking better opportunities through immigration, as she likely understands the struggles of those in lower socioeconomic positions. Therefore, her personal experience, cultural context, and socioeconomic background may lead her to choose option (1) Agree. \n\n1"]}, {"persona": {"region": "Aswan", "sex": "female", "age": 39, "country": "Egypt", "marital_status": "married", "education": "middle", "social_class": "working class"}, "question": {"id": "Q127", "variant": 0}, "response": ["Based on the anthropological framework, as a married female from Aswan, Egypt, cultural context and socioeconomic background play a significant role in my understanding of immigration. As part of the working class, I am aware of the challenges faced by poor people in my country and the potential opportunities that immigration may offer. My personal experiences and values also shape my perspective, as I have witnessed the struggles and aspirations of individuals in similar socioeconomic positions. Additionally, my age and education level contribute to my nuanced understanding of this issue. Therefore, I believe that immigration can indeed help poor people establish new lives, as it may provide them with access to better opportunities and resources. \n\n1"]}, {"persona": {"region": "Qena", "sex": "female", "age": 27, "country": "Egypt", "marital_status": "married", "education": "lower", "social_class": "lower middle class"}, "question": {"id": "Q127", "variant": 0}, "response": ["Based on my cultural context and socioeconomic background, I believe that immigration in my country can be beneficial for poor people looking to establish new lives. I have seen many individuals from lower income backgrounds find better opportunities and improved living conditions in other countries. Additionally, considering the emic and etic perspectives, I understand that my personal experience and individual values may differ from others, but I believe that immigration can offer hope and a chance for a better future for those from impoverished backgrounds. Therefore, I would choose option (1) Agree."]}, {"persona": {"region": "Qena", "sex": "male", "age": 40, "country": "Egypt", "marital_status": "single", "education": "middle", "social_class": "lower middle class"}, "question": {"id": "Q127", "variant": 0}, "response": ["Based on the anthropological framework, as a single male from Qena, Egypt, my emic perspective is influenced by my cultural context, individual values, and socioeconomic background. In Egypt, immigration is often seen as an opportunity for better economic prospects, especially for those from lower middle class backgrounds like myself. However, I also recognize the etic perspective that immigration can bring about social and economic challenges for both immigrants and the host country. Considering the nuanced phrasing of the question and the cultural relativism, I would have to say that immigration in my country does help poor people establish new lives, as it provides them with opportunities for better economic prospects and a chance for a better life.\n\n1"]}, {"persona": {"region": "Qena", "sex": "male", "age": 30, "country": "Egypt", "marital_status": "single", "education": "middle", "social_class": "working class"}, "question": {"id": "Q127", "variant": 0}, "response": ["Based on the anthropological framework, my perspective on immigration in my country is heavily influenced by my cultural context, socioeconomic background, and personal experience. As a working-class single male from Qena, Egypt, I have witnessed firsthand the struggles and challenges faced by poor people in my community. I understand the importance of immigration in providing opportunities for a better life, as many of my friends and family members have sought opportunities abroad. Additionally, my individual values and personal experience lead me to believe that immigration can indeed help poor people establish new lives, as it has provided them with access to better education, employment, and living conditions. Therefore, I am inclined to choose option (1) Agree. \n\n1"]}]