[{"persona": {"region": "Fayoum", "sex": "male", "age": 46, "country": "Egypt", "marital_status": "married", "education": "higher", "social_class": "lower middle class"}, "question": {"id": "Q239", "variant": 0}, "response": ["Based on the anthropological framework, my perspective as a married male from Fayoum, Egypt, is influenced by my cultural context, individual values, and socioeconomic background. In my community, religious law holds significant importance and plays a pivotal role in governing our daily lives. Additionally, my lower middle-class status has shaped my perception of political systems and their impact on my life. Considering these factors, I believe a political system governed by religious law with no political parties or elections would be fairly good for our society, as it aligns with our cultural values and provides stability and guidance in governance. \n\n2"]}, {"persona": {"region": "Fayoum", "sex": "female", "age": 30, "country": "Egypt", "marital_status": "married", "education": "middle", "social_class": "lower middle class"}, "question": {"id": "Q239", "variant": 0}, "response": ["Based on my cultural context and socioeconomic background, I have grown up in a society where religious law plays a significant role in daily life. My personal experience and values have been shaped by this cultural context, and I have seen the positive impact of religious principles on our community. Additionally, my lower middle class status has influenced my perception of the political system, as I have observed how it has affected people in similar socioeconomic positions. Therefore, I believe that a political system governed by religious law with no political parties or elections could be very good for maintaining social order and moral values in our community.\n\n1"]}, {"persona": {"region": "Fayoum", "sex": "male", "age": 60, "country": "Egypt", "marital_status": "married", "education": "higher", "social_class": "working class"}, "question": {"id": "Q239", "variant": 0}, "response": ["Based on the anthropological framework, as a married male from Fayoum, Egypt, I have been shaped by my cultural context, individual values, and socioeconomic background. Growing up in Egypt, I have been influenced by the religious and political landscape of the country. Religious law and governance have been deeply intertwined in the Egyptian society, and as a member of the working class, I value stability and security. Additionally, my age and education level have shaped my understanding of political systems. Therefore, I believe that a political system governed by religious law with no political parties or elections would be fairly good for the country's stability and moral foundation.\n\n2"]}, {"persona": {"region": "Fayoum", "sex": "male", "age": 20, "country": "Egypt", "marital_status": "single", "education": "middle", "social_class": "lower middle class"}, "question": {"id": "Q239", "variant": 0}, "response": ["From the perspective of a single male from Fayoum, Egypt, who is 20 years old, completed middle education level, and considers himself part of the lower middle class, the cultural context is crucial in understanding his opinion on a political system governed by religious law with no political parties or elections. In this region, religion and traditional values are deeply ingrained in society, and the individual values and personal experience of this persona are likely to be influenced by this cultural context. Additionally, his socioeconomic background as part of the lower middle class may also shape his perception of this political system. Furthermore, the concept of cultural relativism is important to consider, as his viewpoint may differ from those in other cultural contexts. It is also important to note the nuance in the phrasing of the question, as the persona's understanding and answer may be influenced by the specific wording. \n\n3"]}, {"persona": {"region": "Fayoum", "sex": "female", "age": 39, "country": "Egypt", "marital_status": "married", "education": "higher", "social_class": "lower middle class"}, "question": {"id": "Q239", "variant": 0}, "response": ["Based on my emic perspective as a married female from Fayoum, Egypt, I have been raised in a cultural context where religion plays a significant role in shaping societal norms and values. My individual values and personal experiences have also been influenced by this cultural context, and I believe in the importance of religious principles in governance. Additionally, my lower middle-class socioeconomic background has led me to prioritize stability and security in the political system. Considering these factors, I believe that a political system governed by religious law with no political parties or elections could provide a sense of moral guidance and social order, which is why I choose option (2) Fairly good."]}, {"persona": {"region": "Fayoum", "sex": "male", "age": 33, "country": "Egypt", "marital_status": "married", "education": "higher", "social_class": "working class"}, "question": {"id": "Q239", "variant": 0}, "response": ["Based on the anthropological framework, my perspective as a married male from Fayoum, Egypt, who is 33 years old, has completed higher education, and considers myself part of the working class, is shaped by my cultural context, individual values, and personal experiences. In Egypt, religion plays a significant role in society and politics, and many people view a political system governed by religious law as a positive and necessary arrangement. Additionally, my socioeconomic background as a member of the working class may influence my support for a political system that promises stability and security, which is often associated with religious governance. However, I also recognize the importance of cultural relativism and nuance in understanding diverse perspectives and acknowledging that others may have different opinions based on their own unique experiences and values.\n\n3"]}, {"persona": {"region": "Port Said", "sex": "female", "age": 45, "country": "Egypt", "marital_status": "married", "education": "higher", "social_class": "lower middle class"}, "question": {"id": "Q239", "variant": 0}, "response": ["Based on the anthropological framework, my opinion on a political system governed by religious law with no political parties or elections is influenced by my emic perspective as a married female from Port Said, Egypt, where religious and cultural values play a significant role in shaping political beliefs. Additionally, my individual values and personal experiences as a 45-year-old woman with a higher education level and lower middle-class background contribute to my understanding of this political system. Furthermore, the cultural context of Egypt, including its history, language, and kinship networks, also plays a crucial role in forming my opinion. Considering the principle of cultural relativism, I believe that it is important to respect and understand the cultural and religious values of a society, and this perspective influences my opinion on the political system in question. Lastly, the nuanced phrasing of the question and the space and time context of my identity also impact my response. \n\n4"]}, {"persona": {"region": "Port Said", "sex": "male", "age": 42, "country": "Egypt", "marital_status": "married", "education": "middle", "social_class": "lower middle class"}, "question": {"id": "Q239", "variant": 0}, "response": ["From the emic perspective, growing up in Port Said, Egypt, I have been exposed to the influence of religious law in our society and the importance it holds in our cultural context. As a member of the lower middle class, my socioeconomic background has also shaped my values and beliefs. Additionally, my personal experiences and individual values have been influenced by the space and time I have lived in. Considering the nuanced phrasing of the question and the cultural relativism of different political systems, I believe that a political system governed by religious law with no political parties or elections could provide stability and a sense of moral guidance for our society. Therefore, I choose option 2: Fairly good."]}, {"persona": {"region": "Port Said", "sex": "male", "age": 28, "country": "Egypt", "marital_status": "single", "education": "middle", "social_class": "lower middle class"}, "question": {"id": "Q239", "variant": 0}, "response": ["Based on the anthropological framework, my perspective is heavily influenced by my cultural context, individual values, and socioeconomic background. As a single male from Port Said, Egypt, I come from a society where religion plays a significant role in shaping political beliefs and governance. My lower middle class socioeconomic background has also influenced my understanding of political systems and their impact on my life. Additionally, my age and education level have shaped my perceptions of governance and the role of political parties and elections. In this context, I believe that a political system governed by religious law with no political parties or elections could be fairly good for maintaining social order and stability, as it aligns with my cultural beliefs and values.\n\n2"]}, {"persona": {"region": "Port Said", "sex": "female", "age": 30, "country": "Egypt", "marital_status": "married", "education": "higher", "social_class": "lower middle class"}, "question": {"id": "Q239", "variant": 0}, "response": ["Based on the anthropological framework, my perspective as a married female from Port Said, Egypt, is deeply influenced by my cultural context, individual values, and socioeconomic background. In Egypt, religion plays a significant role in society and politics, and as a lower middle class woman with higher education, I am aware of the complexities and nuances of the political system governed by religious law. I understand that for some, this system may provide a sense of stability and moral guidance, but I also recognize the potential limitations in terms of individual freedoms and representation. Considering my cultural relativism and the value I place on personal experience, I believe that a political system governed solely by religious law, with no political parties or elections, may not fully represent the diversity of voices and needs within society, and it may restrict the opportunity for meaningful participation in governance. \n\n3"]}, {"persona": {"region": "Port Said", "sex": "male", "age": 30, "country": "Egypt", "marital_status": "divorced", "education": "middle", "social_class": "lower middle class"}, "question": {"id": "Q239", "variant": 0}, "response": ["Based on my emic perspective as a divorced male from Port Said, Egypt, I have been influenced by the cultural context of my community, which includes a strong emphasis on religious values and traditions. My individual values and personal experiences have also shaped my understanding of the importance of religion in governing societal and political affairs. Additionally, my socioeconomic background as part of the lower middle class has influenced my perception of the current political system and its impact on my life. Taking into account the cultural relativism and nuance of my perspective, I would choose option (2) Fairly good. \n\n2"]}, {"persona": {"region": "Port Said", "sex": "female", "age": 19, "country": "Egypt", "marital_status": "single", "education": "middle", "social_class": "lower middle class"}, "question": {"id": "Q239", "variant": 0}, "response": ["Based on the anthropological framework, as a single female from Port Said, Egypt, my emic perspective would be heavily influenced by the cultural context of my upbringing, including the prevalence of religious values and the social and economic constraints of my lower middle-class background. My personal experience and individual values would also play a significant role in shaping my opinion. Additionally, the socioeconomic background and cultural relativism of my society would impact my views on a political system governed by religious law with no political parties or elections. Finally, my age and place would contribute to my nuanced understanding of the question. Therefore, my opinion on this matter is influenced by a complex interplay of factors, and my chosen answer is:\n\n3"]}, {"persona": {"region": "Fayoum", "sex": "male", "age": 40, "country": "Egypt", "marital_status": "married", "education": "middle", "social_class": "working class"}, "question": {"id": "Q239", "variant": 0}, "response": ["Based on the anthropological framework, my emic perspective as a married male from Fayoum, Egypt, would be heavily influenced by my cultural context and socioeconomic background. In my community, religious law plays a significant role in shaping our values and beliefs. Additionally, as someone from the working class with a middle education level, my understanding of political systems may be limited. Moreover, my personal experiences and individual values would also influence my opinion. Considering these factors, I would likely have a favorable view of a political system governed by religious law with no political parties or elections as it aligns with my cultural and religious beliefs and may provide stability and order in society.\n\n4"]}, {"persona": {"region": "Fayoum", "sex": "male", "age": 23, "country": "Egypt", "marital_status": "single", "education": "higher", "social_class": "lower middle class"}, "question": {"id": "Q239", "variant": 0}, "response": ["Based on my background and the anthropological framework, my opinion on a political system governed by religious law with no political parties or elections is influenced by my cultural context, individual values, and socioeconomic background. Coming from Fayoum, Egypt, where religious and cultural traditions are deeply embedded in daily life, I have been raised to value the importance of religious law in governing society. Additionally, as a member of the lower middle class, I have observed how political instability and corruption have affected my community, leading me to believe that a system governed by religious law may provide a sense of stability and order. Therefore, my opinion would be:\n\n2"]}, {"persona": {"region": "Fayoum", "sex": "female", "age": 38, "country": "Egypt", "marital_status": "married", "education": "middle", "social_class": "lower middle class"}, "question": {"id": "Q239", "variant": 0}, "response": ["Based on my cultural context as a married woman from Fayoum, Egypt, my opinion on a political system governed by religious law with no political parties or elections would be influenced by my individual values and personal experience, as well as my socioeconomic background. In Egypt, religion plays a significant role in both public and private life, and many people, including myself, hold strong religious beliefs. Additionally, as a member of the lower middle class, I may feel that a political system based on religious law could potentially provide stability and a sense of order in society. Furthermore, my middle education level may have limited my exposure to different political ideologies, leading me to place a higher value on traditional and religious values. Therefore, my opinion would likely be favorable towards a political system governed by religious law with no political parties or elections.\n\n2"]}, {"persona": {"region": "Fayoum", "sex": "male", "age": 32, "country": "Egypt", "marital_status": "married", "education": "middle", "social_class": "lower middle class"}, "question": {"id": "Q239", "variant": 0}, "response": ["From my perspective as a married male from Fayoum, Egypt, my understanding and opinion on a political system governed by religious law with no political parties or elections is influenced by my cultural context and individual values. In my community, religion plays a significant role in shaping daily life and is deeply intertwined with the political and social fabric. Additionally, my lower middle class socioeconomic background has led me to value stability and security, which I believe can be provided by a system governed by religious law. I also recognize the importance of nuance in this matter, as the specific implementation and interpretation of religious law can vary greatly. Taking all of these factors into consideration, my opinion is that a political system governed by religious law with no political parties or elections is fairly good.\n\n2"]}, {"persona": {"region": "Fayoum", "sex": "male", "age": 31, "country": "Egypt", "marital_status": "married", "education": "higher", "social_class": "working class"}, "question": {"id": "Q239", "variant": 0}, "response": ["Based on the anthropological framework, as a married male from Fayoum, Egypt, my emic perspective is influenced by the cultural context of living in a predominantly Muslim country where religious law holds significant importance. My individual values and personal experience also play a role, as I have grown up in a society where religious principles are deeply ingrained. Additionally, my socioeconomic background as part of the working class affects my perception, as I may view a political system governed by religious law as a potential source of stability and social cohesion. Considering these factors, I select:\n\n(2) Fairly good"]}, {"persona": {"region": "Fayoum", "sex": "male", "age": 31, "country": "Egypt", "marital_status": "married", "education": "middle", "social_class": "lower middle class"}, "question": {"id": "Q239", "variant": 0}, "response": ["Based on the anthropological framework, my perspective is heavily influenced by my cultural context, individual values, and socioeconomic background. As a married male from Fayoum, Egypt, I am likely to have been raised in a religious and traditional environment where the idea of a political system governed by religious law is seen as favorable. Additionally, my lower middle class status and middle education level may lead me to value stability and security over political freedoms and may see a system without political parties or elections as a way to maintain order. Additionally, my age and place of living may also impact my perspective, as Fayoum is known for its conservative values. Therefore, based on these factors, my opinion on a political system governed by religious law with no political parties or elections would be:\n\n2"]}, {"persona": {"region": "Fayoum", "sex": "female", "age": 32, "country": "Egypt", "marital_status": "married", "education": "middle", "social_class": "lower middle class"}, "question": {"id": "Q239", "variant": 0}, "response": ["Based on my cultural context and socioeconomic background, as a married woman from Fayoum, Egypt, I have been raised in a conservative environment where religious law holds significant importance. My personal values and experiences have also shaped my perspective, and I understand the cultural relativism in this matter. Considering all these factors, I believe that a political system governed by religious law with no political parties or elections would be fairly good for our society as it aligns with our cultural and religious beliefs, providing stability and order. \n\n2"]}, {"persona": {"region": "Ismailia", "sex": "male", "age": 53, "country": "Egypt", "marital_status": "married", "education": "middle", "social_class": "lower middle class"}, "question": {"id": "Q239", "variant": 0}, "response": ["Based on my personal experience and cultural context as a married male from Ismailia, Egypt, I have a nuanced understanding of the political system. My socioeconomic background as part of the lower middle class also influences my perspective. In this context, the idea of a political system governed by religious law with no political parties or elections may be viewed favorably due to the stability and sense of order it could potentially bring to the society. Additionally, the emphasis on religious law may align with my personal values and beliefs. Therefore, my perspective on this issue would be: \n\n2"]}, {"persona": {"region": "Ismailia", "sex": "male", "age": 38, "country": "Egypt", "marital_status": "married", "education": "higher", "social_class": "working class"}, "question": {"id": "Q239", "variant": 0}, "response": ["Based on the anthropological framework, my perspective as a married male from Ismailia, Egypt, who is 38 years old, completed higher education, and considers myself part of the working class, is heavily influenced by my cultural context, individual values, and socioeconomic background. As a member of the working class in Egypt, I am likely to have experienced the impact of political decisions on my daily life and may have strong opinions about the role of religious law in governance. Additionally, my higher education level may have exposed me to different political ideologies and systems, and I may have personal values that shape my views on the topic. Considering the cultural relativism, nuanced understanding, and individual experience, I believe my perspective would be shaped by a complex interplay of these factors. \n\n4"]}, {"persona": {"region": "Ismailia", "sex": "female", "age": 35, "country": "Egypt", "marital_status": "married", "education": "middle", "social_class": "lower middle class"}, "question": {"id": "Q239", "variant": 0}, "response": ["Based on my cultural context and socioeconomic background, I have been shaped by the values and experiences of my community in Ismailia, Egypt. My understanding of the political system is influenced by my emic perspective, as I have grown up in a society where religious law holds significant importance. Additionally, my lower middle class status has made me more attuned to the struggles and needs of my community, and I recognize the potential benefits and drawbacks of a political system governed by religious law with no political parties or elections. I understand the importance of cultural relativism and nuance in this matter, and my personal experience has led me to consider this question from a perspective that may be different from others'. \n\n3"]}, {"persona": {"region": "Ismailia", "sex": "female", "age": 57, "country": "Egypt", "marital_status": "married", "education": "lower", "social_class": "working class"}, "question": {"id": "Q239", "variant": 0}, "response": ["Based on the anthropological framework, my opinion on a political system governed by religious law with no political parties or elections is influenced by my emic perspective as a married female from Ismailia, Egypt, where religious beliefs and practices play a significant role in shaping societal norms and values. Additionally, my lower education level and working-class background also contribute to my understanding of the importance of stability and order in the political system. Considering the cultural context of Egypt, where Islamic principles are deeply ingrained in the fabric of society, I believe that a political system governed by religious law could provide a sense of moral guidance and cohesion for the community. However, I also acknowledge the potential for abuse of power and lack of representation in such a system, which leads me to choose option (2) Fairly good as my opinion on this political system. \n\n2"]}, {"persona": {"region": "Ismailia", "sex": "male", "age": 33, "country": "Egypt", "marital_status": "married", "education": "middle", "social_class": "lower middle class"}, "question": {"id": "Q239", "variant": 0}, "response": ["Based on my cultural context in Ismailia, Egypt, religion plays a significant role in our daily lives and is deeply ingrained in our societal structures. Socioeconomic background also plays a role in my perception, as a member of the lower middle class. Additionally, my personal experience and individual values have shaped my understanding of this question. Given these factors, I believe that a political system governed by religious law with no political parties or elections could be fairly good for our society, as it aligns with our cultural values and provides a sense of stability and continuity. \n\n2"]}, {"persona": {"region": "Ismailia", "sex": "female", "age": 49, "country": "Egypt", "marital_status": "single", "education": "higher", "social_class": "upper middle class"}, "question": {"id": "Q239", "variant": 0}, "response": ["Based on my individual values and personal experience, as a single female from Ismailia, Egypt, who has completed higher education and considers myself part of the upper middle class, I have been exposed to a diverse range of perspectives and have a strong understanding of the importance of cultural relativism. I am aware of the cultural context in which I live, where religious law and political systems are deeply intertwined. Additionally, I understand the nuance in the phrasing of the question and the significance of space and time in shaping my opinion. Therefore, my opinion on a political system governed by religious law with no political parties or elections would be fairly good.\n\n2"]}, {"persona": {"region": "Ismailia", "sex": "female", "age": 35, "country": "Egypt", "marital_status": "married", "education": "higher", "social_class": "lower middle class"}, "question": {"id": "Q239", "variant": 0}, "response": ["Based on my personal experience and cultural context as a married woman from Ismailia, Egypt, I have been raised in a society where religion plays a crucial role in shaping our political beliefs and values. Additionally, my socioeconomic background as part of the lower middle class has influenced my understanding of governance and political systems. Considering the emic and etic perspectives, I believe that a political system governed by religious law without political parties or elections could be fairly good for ensuring stability and upholding religious values within the society. Furthermore, cultural relativism has taught me to respect and understand different political systems, and from my nuanced understanding, I believe that this type of governance could be beneficial for our community's values and beliefs.\n\n2"]}, {"persona": {"region": "Ismailia", "sex": "male", "age": 24, "country": "Egypt", "marital_status": "single", "education": "higher", "social_class": "upper middle class"}, "question": {"id": "Q239", "variant": 0}, "response": ["Based on the anthropological framework, my perspective as a single male from Ismailia, Egypt, who has completed higher education and considers himself part of the upper middle class, is shaped by my cultural context, individual values, and socioeconomic background. In Egypt, religion plays a significant role in society and governance, and many people believe in the importance of religious law in the political system. Additionally, as someone who has received a higher education and belongs to the upper middle class, I may have more conservative views and be more supportive of traditional institutions. Therefore, considering these factors, I would choose option (1) Very good."]}, {"persona": {"region": "Ismailia", "sex": "female", "age": 23, "country": "Egypt", "marital_status": "single", "education": "higher", "social_class": "lower middle class"}, "question": {"id": "Q239", "variant": 0}, "response": ["Based on my emic perspective as a single female from Ismailia, Egypt, I have been raised in a cultural context where religion plays a significant role in daily life and societal norms. My individual values and personal experience have shaped my understanding of how religion influences politics and governance. Additionally, my lower middle class socioeconomic background has influenced my perception of the political system and its potential impact on my life and community. Considering cultural relativism, I understand that my perspective may differ from others and acknowledge the nuanced phrasing of the question. \n\n3"]}, {"persona": {"region": "Ismailia", "sex": "male", "age": 55, "country": "Egypt", "marital_status": "married", "education": "middle", "social_class": "lower middle class"}, "question": {"id": "Q239", "variant": 0}, "response": ["Based on the anthropological framework, my opinion on a political system governed by religious law with no political parties or elections is heavily influenced by my cultural context and individual values. As a married male from Ismailia, Egypt, my cultural context is rooted in a predominantly Islamic society where religious law holds significant influence. Additionally, my lower middle class socioeconomic background and middle education level also shape my perspective. Considering these factors, I believe that a political system governed by religious law may be fairly good as it aligns with the cultural values and traditions of my community, providing a sense of stability and moral guidance. However, I also recognize the potential for limited representation and lack of political diversity, which could be fairly bad for the overall democratic process. Ultimately, I lean towards the option of \"Fairly good\" as it reflects my nuanced understanding of the complexities involved in such a political system.\n\n2"]}, {"persona": {"region": "Ismailia", "sex": "male", "age": 57, "country": "Egypt", "marital_status": "married", "education": "middle", "social_class": "upper middle class"}, "question": {"id": "Q239", "variant": 0}, "response": ["Based on the anthropological framework, my perspective as a married male from Ismailia, Egypt, is shaped by my cultural context, individual values, socioeconomic background, and age. In Egypt, religion plays a significant role in politics and society, and many people, including myself, believe in the importance of religious law in governance. Additionally, being part of the upper middle class, I may have certain privileges and benefits within the current political system that make me more inclined to support it. My age and traditional middle education level may also lead me to prefer stability and continuity, which a system without political parties or elections may provide. Therefore, my opinion on a political system governed by religious law with no political parties or elections would likely be very positive, as I believe it aligns with my cultural and socioeconomic background, personal values, and age.\n\n1"]}, {"persona": {"region": "Ismailia", "sex": "female", "age": 29, "country": "Egypt", "marital_status": "married", "education": "middle", "social_class": "upper middle class"}, "question": {"id": "Q239", "variant": 0}, "response": ["Based on my emic perspective as a married female from Ismailia, Egypt, I have grown up in a cultural context where religion plays a central role in everyday life. My individual values and personal experiences have shaped my understanding of the importance of religious law in governing society. Additionally, my socioeconomic background as part of the upper middle class has influenced my perception of stability and order. Cultural relativism has taught me to respect different political systems based on the values and beliefs of each culture. Furthermore, the space and time in which I have lived have contributed to my nuanced understanding of political systems. Therefore, I believe that a political system governed by religious law with no political parties or elections is (1) Very good."]}, {"persona": {"region": "Damiatta", "sex": "female", "age": 46, "country": "Egypt", "marital_status": "married", "education": "middle", "social_class": "lower middle class"}, "question": {"id": "Q239", "variant": 0}, "response": ["Based on my emic perspective as a married woman from Damiatta, Egypt, and my cultural context as part of the lower middle class, I have been influenced by the religious and conservative values of my community. My individual values and personal experience have shaped my understanding of the importance of religious law in governing societal norms and behaviors. Additionally, my socioeconomic background has instilled in me a sense of duty and adherence to traditional values. Considering cultural relativism, I understand that my perspective may differ from others, but I believe that a political system governed by religious law, without political parties or elections, would be very good for ensuring moral and ethical governance in line with our cultural and religious beliefs.\n\n1"]}, {"persona": {"region": "Damiatta", "sex": "female", "age": 20, "country": "Egypt", "marital_status": "single", "education": "middle", "social_class": "lower middle class"}, "question": {"id": "Q239", "variant": 0}, "response": ["Based on my emic perspective as a single female from Damiatta, Egypt, I have been raised in a cultural context where religious law has a significant impact on daily life. My individual values and personal experience have shaped my understanding of the importance of tradition and faith in governing society. Additionally, my socioeconomic background as a lower middle class individual has affected my perception of the political system. I understand the nuances of this question and recognize the significance of space and time in shaping my opinion. Therefore, I believe that a political system governed by religious law with no political parties or elections can be fairly good for our society. \n\n2"]}, {"persona": {"region": "Damiatta", "sex": "male", "age": 19, "country": "Egypt", "marital_status": "single", "education": "middle", "social_class": "lower middle class"}, "question": {"id": "Q239", "variant": 0}, "response": ["Based on the anthropological framework, my emic perspective as a 19-year-old male from Damiatta, Egypt, who has completed middle education and considers himself part of the lower middle class, is influenced by my cultural context, individual values and personal experience, and socioeconomic background. In Egypt, religion plays a significant role in society and politics, and my personal experience and cultural context have shaped my understanding of the political system. I also consider my socioeconomic background, as someone from the lower middle class, and how a political system governed by religious law with no political parties or elections may affect me and others in similar socioeconomic positions. Additionally, my age and place of residence in Damiatta, Egypt, influence my perspective on this political system. Therefore, I choose option (2) Fairly good."]}, {"persona": {"region": "Damiatta", "sex": "female", "age": 33, "country": "Egypt", "marital_status": "married", "education": "higher", "social_class": "lower middle class"}, "question": {"id": "Q239", "variant": 0}, "response": ["Based on the anthropological framework, my perspective as a married female from Damiatta, Egypt, with a lower middle-class socioeconomic background and higher education level, is heavily influenced by my cultural context, individual values, and personal experience. In Egypt, religion plays a significant role in society, and the idea of a political system governed by religious law without political parties or elections may be viewed positively by some due to the cultural context and personal values. Additionally, my age and education level may also shape my perspective on this issue. Therefore, from this perspective, I would choose option (2) Fairly good."]}, {"persona": {"region": "Damiatta", "sex": "male", "age": 24, "country": "Egypt", "marital_status": "single", "education": "higher", "social_class": "lower middle class"}, "question": {"id": "Q239", "variant": 0}, "response": ["From my perspective as a single male from Damiatta, Egypt, with a lower middle class socioeconomic background and a higher education level, my answer to the question regarding a political system governed by religious law with no political parties or elections would be fairly good. This perspective is influenced by the cultural context of Egypt, where religion plays a significant role in daily life and governance. Additionally, my individual values and personal experience have shaped my understanding of the importance of stability and order in a society, which I believe can be achieved through a religiously governed political system. Furthermore, the nuance of the question also plays a role, as the phrasing of \"fairly good\" aligns with my belief that such a system may provide structure and direction for the country. \n\n2"]}, {"persona": {"region": "Suez", "sex": "male", "age": 41, "country": "Egypt", "marital_status": "married", "education": "middle", "social_class": "working class"}, "question": {"id": "Q239", "variant": 0}, "response": ["Based on the anthropological framework, my opinion on a political system governed by religious law with no political parties or elections would be influenced by my cultural context, individual values, and socioeconomic background. Coming from Suez, Egypt, where religion plays a significant role in society, and being part of the working class, I am accustomed to a political system that is influenced by religious beliefs. Additionally, my limited education level and age may lead me to value stability and order over the complexities of a multi-party system. Therefore, I would lean towards option (2) Fairly good, as I believe that religious law can provide a sense of moral guidance and structure in governance."]}, {"persona": {"region": "Suez", "sex": "female", "age": 39, "country": "Egypt", "marital_status": "divorced", "education": "middle", "social_class": "working class"}, "question": {"id": "Q239", "variant": 0}, "response": ["Based on the anthropological framework, as a divorced female from Suez, Egypt, who is part of the working class and has completed middle education, my perspective is heavily influenced by my cultural context, individual values, and socioeconomic background. In Egypt, religion plays a significant role in society and governance. As a member of the working class, I may have experienced economic hardships and may value stability and security. Additionally, my personal experience of divorce may influence my desire for a system that promotes traditional family values. Therefore, I believe that a political system governed by religious law with no political parties or elections would be fairly good for promoting stability and traditional values, but may also have drawbacks in terms of representation and freedom of choice. \n\n2"]}, {"persona": {"region": "Cairo", "sex": "female", "age": 55, "country": "Egypt", "marital_status": "married", "education": "middle", "social_class": "working class"}, "question": {"id": "Q239", "variant": 0}, "response": ["Based on the anthropological framework, my perspective as a married female from Cairo, Egypt, at 55 years of age and with a middle education level, is heavily influenced by my cultural context, individual values, and socioeconomic background. In Egypt, religion plays a significant role in daily life and politics. As a member of the working class, I have experienced the challenges of living in a country with a complex political system. Additionally, my personal experiences and values have shaped my understanding of the importance of stability and order in society. Therefore, my opinion on a political system governed by religious law with no political parties or elections is influenced by these factors and I believe that it would be... \n3"]}, {"persona": {"region": "Cairo", "sex": "male", "age": 58, "country": "Egypt", "marital_status": "married", "education": "middle", "social_class": "lower middle class"}, "question": {"id": "Q239", "variant": 0}, "response": ["Based on the anthropological framework, my emic perspective as a married male from Cairo, Egypt, is heavily influenced by the cultural context of living in a predominantly Islamic society. The cultural relativism of this context means that the idea of a political system governed by religious law is not inherently seen as \"bad\" or \"good,\" but rather as a nuanced issue that is shaped by individual values and personal experience. As a member of the lower middle class, my socioeconomic background also plays a role in my viewpoint, as a political system without parties or elections may be perceived as providing stability and order, which could be seen as a positive aspect. Additionally, the nuance of the question is crucial, as the phrasing of \"governed by religious law\" does not necessarily imply extremism or oppression, but rather a different approach to governance. \n\n2"]}, {"persona": {"region": "Cairo", "sex": "female", "age": 29, "country": "Egypt", "marital_status": "married", "education": "higher", "social_class": "lower middle class"}, "question": {"id": "Q239", "variant": 0}, "response": ["Based on my emic perspective as a married female from Cairo, Egypt, the cultural context of my society heavily influences my opinion on a political system governed by religious law with no political parties or elections. The influence of Islam in Egypt is strong and deeply ingrained in our cultural and social structures. Additionally, my personal experience and individual values as someone from the lower middle class, who has completed higher education, and is 29 years old, shape my understanding of such a political system. Socioeconomic background also plays a role in my understanding, as it affects my access to resources and opportunities. Furthermore, the concept of cultural relativism is important to consider as I view my society's values and norms as equal to those of any other culture. In addition, the nuanced phrasing of the question also impacts my response. Therefore, based on all these factors, my opinion on a political system governed by religious law with no political parties or elections is (3) Fairly bad."]}, {"persona": {"region": "Cairo", "sex": "male", "age": 38, "country": "Egypt", "marital_status": "married", "education": "higher", "social_class": "lower middle class"}, "question": {"id": "Q239", "variant": 0}, "response": ["Based on the anthropological framework, my perspective as a married male from Cairo, Egypt, would be heavily influenced by my cultural context, individual values, and socioeconomic background. In Egypt, religion plays a significant role in daily life and governance, so a political system governed by religious law may be viewed favorably by some, especially those with a lower middle-class socioeconomic background who may prioritize stability and security over democratic processes. Additionally, my personal experience and education level may lead me to value order and tradition, which could further influence my opinion on this political system. Therefore, my perspective on a political system governed by religious law with no political parties or elections would likely be (2) Fairly good. \n\n2"]}, {"persona": {"region": "Cairo", "sex": "female", "age": 40, "country": "Egypt", "marital_status": "married", "education": "higher", "social_class": "lower middle class"}, "question": {"id": "Q239", "variant": 0}, "response": ["Based on my emic perspective as a married female from Cairo, Egypt, I have been raised and socialized within a cultural context where religious and political influences often intersect. Additionally, my individual values and personal experiences have shaped my understanding of the political system. As someone from the lower middle class, I am aware of the socioeconomic background and the impact it has on political views. Considering cultural relativism, I understand that different cultures have different ways of governing and that there is no hierarchy of culture. Additionally, space and time, as well as nuance, play a role in my understanding of the political system. Therefore, my opinion on a political system governed by religious law with no political parties or elections is:\n\n3"]}, {"persona": {"region": "Cairo", "sex": "male", "age": 38, "country": "Egypt", "marital_status": "married", "education": "higher", "social_class": "upper middle class"}, "question": {"id": "Q239", "variant": 0}, "response": ["Based on my emic perspective as a married male from Cairo, Egypt, I have been raised in a cultural context where religion plays a significant role in shaping the political system. My individual values and personal experience have led me to believe that a political system governed by religious law, with no political parties or elections, would be beneficial for the stability and moral fabric of our society. Additionally, considering my socioeconomic background as part of the upper middle class, I have seen the positive impact of such a system on the overall prosperity of our community. Taking into account cultural relativism, I understand that my perspective may differ from others, but I believe that this type of political system is very good for our country's future.\n\n1"]}, {"persona": {"region": "Cairo", "sex": "male", "age": 59, "country": "Egypt", "marital_status": "married", "education": "middle", "social_class": "lower middle class"}, "question": {"id": "Q239", "variant": 0}, "response": ["Based on my cultural context and personal experience as a married male from Cairo, Egypt, I have been exposed to a political system that has been influenced by religious law. This has shaped my understanding of governance and the role of religion in political decision-making. Additionally, my lower middle class socioeconomic background has influenced my perspective on the importance of stability and order in the political system. Considering the nuance of the question, I believe that a political system governed by religious law with no political parties or elections could potentially provide a sense of moral guidance and stability, which I view as very important for the well-being of society. \n\n1"]}, {"persona": {"region": "Cairo", "sex": "female", "age": 30, "country": "Egypt", "marital_status": "married", "education": "higher", "social_class": "upper middle class"}, "question": {"id": "Q239", "variant": 0}, "response": ["Based on the anthropological framework, my perspective as a married female from Cairo, Egypt, who is 30 years old, highly educated, and part of the upper middle class, is influenced by my cultural context, individual values, and socioeconomic background. In Egypt, religion plays a significant role in society and politics, and as someone from the upper middle class, I may have more access to education and resources, which could shape my perspectives on political systems. Additionally, my personal experiences and values may contribute to my opinion on this matter. Therefore, I would choose the following option:\n3"]}, {"persona": {"region": "Cairo", "sex": "male", "age": 22, "country": "Egypt", "marital_status": "single", "education": "middle", "social_class": "lower middle class"}, "question": {"id": "Q239", "variant": 0}, "response": ["Based on the anthropological framework, my perspective as a single male from Cairo, Egypt, is heavily influenced by my cultural context, individual values, and socioeconomic background. In Egypt, religious law and governance play a significant role in shaping societal norms and values. As a member of the lower middle class, I have experienced the impact of religious law on my daily life and understand its importance to many in my community. Additionally, my limited educational opportunities have shaped my understanding of political systems and elections. Therefore, my opinion on a political system governed by religious law with no political parties or elections is influenced by these factors. \n\n3"]}, {"persona": {"region": "Cairo", "sex": "male", "age": 29, "country": "Egypt", "marital_status": "single", "education": "higher", "social_class": "lower middle class"}, "question": {"id": "Q239", "variant": 0}, "response": ["From the perspective of a single male from Cairo, Egypt, who is 29 years old, has completed higher education, and considers himself part of the lower middle class, my opinion on a political system governed by religious law with no political parties or elections is heavily influenced by the cultural context and individual values in Egypt. The cultural context in Egypt is deeply influenced by Islamic traditions and values, and many individuals place a high value on religious law. Additionally, being part of the lower middle class may lead to a desire for stability and security, which can be perceived as provided by a religiously governed political system. However, my personal experience and education have also exposed me to the importance of democratic principles and the value of political participation, which may lead me to have reservations about a political system with no political parties or elections. Overall, my opinion is influenced by a nuanced understanding of the cultural, individual, and socioeconomic factors at play in Egypt.\n\n3"]}, {"persona": {"region": "Cairo", "sex": "female", "age": 31, "country": "Egypt", "marital_status": "married", "education": "higher", "social_class": "lower middle class"}, "question": {"id": "Q239", "variant": 0}, "response": ["Based on the anthropological framework, my opinion on a political system governed by religious law with no political parties or elections is influenced by my cultural context, individual values, and socioeconomic background. As a married woman from Cairo, Egypt, I am part of the lower middle class and have completed higher education. In my cultural context, religion plays a significant role in shaping societal norms and values. Additionally, my personal experience and education have led me to value individual rights and freedoms. Considering the socioeconomic background, I am aware of the challenges faced by the lower middle class and the importance of representation and accountability in governance. Therefore, based on these factors, I would choose the following option:\n\n3"]}, {"persona": {"region": "Cairo", "sex": "male", "age": 59, "country": "Egypt", "marital_status": "married", "education": "higher", "social_class": "upper middle class"}, "question": {"id": "Q239", "variant": 0}, "response": ["Based on my emic perspective as a married male from Cairo, Egypt, I have been raised in a society where religious law plays a significant role in shaping the political and social landscape. The cultural context of Egypt has a deep historical connection to religious traditions and values, and the influence of Islamic law on governance is widely accepted. As someone belonging to the upper middle class, my socioeconomic background also plays a role in my perception of this political system. Additionally, my individual values and personal experience, along with my age and education level, have shaped my understanding of the role of religion in politics. Considering all these factors, I believe that a political system governed by religious law with no political parties or elections is very good. \n\n1"]}, {"persona": {"region": "Cairo", "sex": "male", "age": 27, "country": "Egypt", "marital_status": "single", "education": "middle", "social_class": "working class"}, "question": {"id": "Q239", "variant": 0}, "response": ["Based on the anthropological framework described above, as a single male from Cairo, Egypt, who has completed middle education and considers himself part of the working class, my opinion on a political system governed by religious law with no political parties or elections would be influenced by my cultural context, individual values, and socioeconomic background. In Cairo, religion plays a significant role in shaping the cultural context and societal norms. Additionally, as a member of the working class, my socioeconomic background may lead me to prioritize stability and security. Furthermore, my individual values and personal experiences may lead me to support a political system that provides a sense of order and guidance in daily life. Therefore, my perspective on this political system would be influenced by a combination of cultural, socioeconomic, and personal factors.\n\n3"]}, {"persona": {"region": "Cairo", "sex": "female", "age": 25, "country": "Egypt", "marital_status": "single", "education": "higher", "social_class": "working class"}, "question": {"id": "Q239", "variant": 0}, "response": ["Based on my emic perspective as a single female from Cairo, Egypt, I have grown up in a cultural context where religion plays a significant role in everyday life. My personal experience and values have been shaped by this framework, and as part of the working class, I have been impacted by the socioeconomic background of the country. Additionally, the space and time in which I have lived have influenced my understanding of political systems. Considering all of these factors, I believe that a political system governed by religious law with no political parties or elections could be fairly good for the stability and moral fabric of society.\n\n2"]}, {"persona": {"region": "Cairo", "sex": "female", "age": 23, "country": "Egypt", "marital_status": "married", "education": "higher", "social_class": "lower middle class"}, "question": {"id": "Q239", "variant": 0}, "response": ["Based on the anthropological framework, as a married female from Cairo, Egypt, my emic perspective would be influenced by my cultural context, individual values, and socioeconomic background. In Egypt, religion plays a significant role in the political and social spheres, and as a member of the lower middle class, I may have experienced economic hardships and social inequalities. Additionally, my higher education level may have exposed me to different political ideologies and systems. Considering all these factors, I would likely have nuanced views on a political system governed by religious law with no political parties or elections, taking into account the potential impact on individual freedoms and socioeconomic opportunities.\n\n3"]}, {"persona": {"region": "Cairo", "sex": "male", "age": 58, "country": "Egypt", "marital_status": "married", "education": "higher", "social_class": "working class"}, "question": {"id": "Q239", "variant": 0}, "response": ["Based on the anthropological framework, my opinion on a political system governed by religious law with no political parties or elections is heavily influenced by my cultural context and socioeconomic background. As a married male from Cairo, Egypt, I come from a society where religious values play a significant role in shaping the political landscape. Additionally, as a member of the working class with a higher education level, I am aware of the complexities and nuances of political systems. My personal experience and individual values also inform my perspective. Therefore, I believe that my opinion on this matter aligns with the persona described above.\n\n3"]}, {"persona": {"region": "Cairo", "sex": "female", "age": 40, "country": "Egypt", "marital_status": "married", "education": "higher", "social_class": "working class"}, "question": {"id": "Q239", "variant": 0}, "response": ["According to the anthropological framework, my emic perspective as a married female from Cairo, Egypt, who is 40 years old and part of the working class, is heavily influenced by my cultural context, individual values, and socioeconomic background. As a resident of Cairo, I am familiar with the prevalence of religious influence in political matters and the importance of tradition and cultural norms. My personal experience and values also play a significant role in shaping my perspective, as I have likely witnessed the impact of political systems on my community and have formed opinions based on my own lived experiences. Additionally, my socioeconomic background as part of the working class may lead me to prioritize stability and security, which could influence my views on the proposed political system. Taking all of this into consideration, I believe that my response will reflect the nuanced and context-specific nature of my perspective.\n\n4"]}, {"persona": {"region": "Cairo", "sex": "female", "age": 36, "country": "Egypt", "marital_status": "married", "education": "middle", "social_class": "upper middle class"}, "question": {"id": "Q239", "variant": 0}, "response": ["Based on the anthropological framework, as a married female from Cairo, Egypt, my perspective is heavily influenced by my cultural context, individual values, and socioeconomic background. In Egypt, religion plays a significant role in politics and society, and many people believe in the importance of religious law governing the political system. Additionally, as someone from the upper middle class, I may have more conservative views and be more supportive of a system governed by religious law. However, my personal experience and education level also lead me to value democratic principles and the importance of political parties and elections in ensuring representation and accountability. Therefore, I believe that a political system governed by religious law with no political parties or elections can be fairly good, as it can provide stability and moral guidance, but it also has the potential to limit individual freedoms and representation.\n\n2"]}, {"persona": {"region": "Cairo", "sex": "male", "age": 40, "country": "Egypt", "marital_status": "married", "education": "middle", "social_class": "lower middle class"}, "question": {"id": "Q239", "variant": 0}, "response": ["Based on the anthropological framework, as a married male from Cairo, Egypt, my emic perspective on a political system governed by religious law with no political parties or elections would be influenced by my cultural context, individual values, and socioeconomic background. In Egypt, religion plays a significant role in society and politics, and many people, including myself, may have a strong belief in the importance of religious law in governance. Additionally, as a member of the lower middle class, I may view a political system without elections as potentially providing stability and order, which are important factors for economic security. My experience and values also shape my perspective, as I may prioritize the role of religion in public life and value the potential for a system that I perceive as fair and just. Ultimately, my nuanced understanding leads me to choose option (2) Fairly good, as I see potential benefits in a political system governed by religious law with no political parties or elections.\n\n2"]}, {"persona": {"region": "Cairo", "sex": "female", "age": 30, "country": "Egypt", "marital_status": "married", "education": "middle", "social_class": "lower class"}, "question": {"id": "Q239", "variant": 0}, "response": ["From the perspective of a married female from Cairo, Egypt, who is 30 years old, completed middle education level, and considers herself part of the lower class, there are several factors that influence my opinion on a political system governed by religious law with no political parties or elections. Firstly, my cultural context and socioeconomic background play a significant role in shaping my understanding of this issue. Living in a predominantly Muslim country, the influence of religious law is deeply ingrained in our society and has a significant impact on daily life. Additionally, being part of the lower class means that I may have more conservative values and an inclination towards traditional religious practices. Furthermore, my individual values and personal experiences have also shaped my perspective on this matter. Considering all these factors, my opinion on a political system governed by religious law with no political parties or elections is likely to be influenced by the cultural relativism, space and time, and nuance of the question.\n\n3"]}, {"persona": {"region": "Cairo", "sex": "male", "age": 58, "country": "Egypt", "marital_status": "married", "education": "higher", "social_class": "lower middle class"}, "question": {"id": "Q239", "variant": 0}, "response": ["Based on my cultural context as a married male from Cairo, Egypt, and my personal experience, I understand that religion plays a significant role in society and politics. My socioeconomic background as part of the lower middle class also influences my perspective, as I may see a religiously governed political system as providing stability and order. Additionally, my age and education level may lead me to value tradition and authority. Considering the emic and etic perspectives and the cultural relativism framework, I would choose the following option:\n\n2"]}, {"persona": {"region": "Cairo", "sex": "male", "age": 50, "country": "Egypt", "marital_status": "married", "education": "middle", "social_class": "lower middle class"}, "question": {"id": "Q239", "variant": 0}, "response": ["Based on the anthropological framework, my emic perspective as a married male from Cairo, Egypt, would be heavily influenced by the cultural context of living in a predominantly Muslim society where religious law plays a significant role. My individual values and personal experience, as well as my socioeconomic background as part of the lower middle class, also shape my perspective. In this context, I would likely consider a political system governed by religious law with no political parties or elections as fairly good, as it aligns with my cultural values and provides a sense of stability and continuity. Additionally, my age of 50 years and completion of middle education level would further influence my perspective, as I may value traditional systems of governance. \n\n2"]}, {"persona": {"region": "Cairo", "sex": "female", "age": 40, "country": "Egypt", "marital_status": "married", "education": "higher", "social_class": "upper middle class"}, "question": {"id": "Q239", "variant": 0}, "response": ["Based on the anthropological framework, my perspective on a political system governed by religious law with no political parties or elections is heavily influenced by my cultural context, individual values, and socioeconomic background. As a married female from Cairo, Egypt, I am familiar with the cultural and religious significance of Islamic law in our society. Additionally, my higher education level has provided me with a nuanced understanding of political systems and their impact. Being part of the upper middle class, I am also aware of the socioeconomic implications of such a system. Considering these factors, I believe that a political system governed by religious law with no political parties or elections could potentially provide stability and moral guidance for our society, but it also has the potential to limit individual freedoms and hinder progress. \n\n2"]}, {"persona": {"region": "Cairo", "sex": "female", "age": 33, "country": "Egypt", "marital_status": "married", "education": "middle", "social_class": "lower middle class"}, "question": {"id": "Q239", "variant": 0}, "response": ["From the perspective of a married female from Cairo, Egypt, who is 33 years old, has completed middle education, and considers herself part of the lower middle class, her opinion on a political system governed by religious law with no political parties or elections would be heavily influenced by her cultural context, individual values, and socioeconomic background. In Egypt, religion plays a significant role in everyday life and politics. As a member of the lower middle class, she may have experienced challenges in accessing education and job opportunities, and could potentially see a religiously governed system as a way to address social inequalities. Additionally, her personal experience and values may lead her to prioritize stability and security over political freedoms. Therefore, her opinion on this political system would likely be influenced by these factors, leading her to potentially view it in a favorable light.\n\n2"]}, {"persona": {"region": "Cairo", "sex": "female", "age": 37, "country": "Egypt", "marital_status": "married", "education": "middle", "social_class": "lower middle class"}, "question": {"id": "Q239", "variant": 0}, "response": ["Based on the anthropological framework, my perspective as a married female from Cairo, Egypt, is shaped by my cultural context, individual values, socioeconomic background, and personal experiences. As a lower middle class woman who has completed middle education, I have been influenced by the religious and political dynamics of my community. My opinion on a political system governed by religious law with no political parties or elections is informed by the emic perspective of my cultural context and personal experiences, which lead me to believe that such a system would be fairly good for maintaining social order and moral values in our society.\n\n2"]}, {"persona": {"region": "Cairo", "sex": "male", "age": 28, "country": "Egypt", "marital_status": "married", "education": "middle", "social_class": "lower middle class"}, "question": {"id": "Q239", "variant": 0}, "response": ["From the emic perspective, as a married male from Cairo, Egypt, I am likely to have been brought up in a society where religious values and traditions play a significant role in shaping our political views. The cultural context of Egypt, with its predominantly Muslim population, also influences my understanding of governance and law. My individual values and personal experiences, combined with my lower middle-class socioeconomic background, may lead me to view a political system governed by religious law as a source of stability and moral guidance. Additionally, the lack of access to higher education and exposure to diverse political ideologies may limit my ability to critically analyze alternative systems of governance. Taking into consideration the nuances of the question and the emphasis on cultural relativism, I would likely lean towards option (2) Fairly good, as this aligns with the societal and religious norms that have shaped my worldview. \n\n2"]}, {"persona": {"region": "Cairo", "sex": "male", "age": 53, "country": "Egypt", "marital_status": "married", "education": "higher", "social_class": "working class"}, "question": {"id": "Q239", "variant": 0}, "response": ["Based on the anthropological framework, my emic perspective as a married male from Cairo, Egypt, would be influenced by my cultural context, individual values, socioeconomic background, and the nuance of the question. In Cairo, religious law plays a significant role in society, and as someone who is part of the working class, I may have experienced firsthand the impact of religious law on my daily life. Additionally, my higher education level may have provided me with a nuanced understanding of the political system and its implications. Considering these factors, I would reason that a political system governed by religious law with no political parties or elections may be viewed as fairly good from my perspective. \n\n2"]}, {"persona": {"region": "Cairo", "sex": "male", "age": 45, "country": "Egypt", "marital_status": "married", "education": "higher", "social_class": "lower middle class"}, "question": {"id": "Q239", "variant": 0}, "response": ["Based on my emic perspective as a married male from Cairo, Egypt, with a higher education level and part of the lower middle class, I have been influenced by the cultural context of my society where religious law plays a significant role. My individual values and personal experience have also shaped my understanding, and my socioeconomic background has influenced my perceptions of governance. Considering cultural relativism, I believe that a political system governed by religious law with no political parties or elections could provide stability and moral guidance for society. Additionally, my age and place in Cairo have further influenced my views on this matter. Therefore, I choose option (2) Fairly good."]}, {"persona": {"region": "Cairo", "sex": "male", "age": 52, "country": "Egypt", "marital_status": "married", "education": "middle", "social_class": "upper middle class"}, "question": {"id": "Q239", "variant": 0}, "response": ["Based on the anthropological framework, my emic perspective as a married male from Cairo, Egypt, is heavily influenced by the cultural context of the region, particularly the prevalence of Islamic beliefs and the historical significance of religious law in governance. My personal experience and individual values also play a role, as I have lived in a society where religion holds significant influence. Additionally, my socioeconomic background as part of the upper middle class may lead me to view a political system governed by religious law in a positive light, as it may provide stability and continuity. Furthermore, the nuanced phrasing of the question also leads me to consider the potential benefits of such a system. \n\n2"]}, {"persona": {"region": "Cairo", "sex": "male", "age": 22, "country": "Egypt", "marital_status": "single", "education": "higher", "social_class": "lower middle class"}, "question": {"id": "Q239", "variant": 0}, "response": ["Based on the anthropological framework, my perspective as a 22-year-old male from Cairo, Egypt, who comes from the lower middle class, is heavily influenced by my cultural context, individual values, and personal experience. In Egypt, religion plays a significant role in society and politics, and the idea of a political system governed by religious law with no political parties or elections may be viewed favorably by some due to the emphasis on traditional values and religious principles. Additionally, my socioeconomic background may lead me to prioritize stability and security over the complexities of a multi-party democratic system. However, I also recognize the importance of cultural relativism and the diversity of opinions within my community. Therefore, my opinion on this matter may vary depending on the specific circumstances and nuances of the situation.\n\n3"]}, {"persona": {"region": "Cairo", "sex": "female", "age": 57, "country": "Egypt", "marital_status": "divorced", "education": "middle", "social_class": "lower middle class"}, "question": {"id": "Q239", "variant": 0}, "response": ["Based on the anthropological framework, my perspective as a 57-year-old divorced female from Cairo, Egypt, with a middle education level and part of the lower middle class is heavily influenced by my cultural context, individual values, and socioeconomic background. In Egypt, religion and politics are deeply intertwined, and many people, especially those from lower socioeconomic backgrounds, may view a political system governed by religious law as favorable due to their personal beliefs and values. Additionally, without access to higher education, there may be limited exposure to alternative political systems, leading to a more favorable view of religious governance. Therefore, my opinion on a political system governed by religious law with no political parties or elections would likely be influenced by these factors.\n\n3"]}, {"persona": {"region": "Cairo", "sex": "female", "age": 42, "country": "Egypt", "marital_status": "married", "education": "middle", "social_class": "working class"}, "question": {"id": "Q239", "variant": 0}, "response": ["Based on my cultural context, as a married female from Cairo, Egypt, I am part of a society where religion plays a significant role. My emic perspective acknowledges the importance of religious law in shaping our social and political systems. Additionally, my individual values and personal experience inform my understanding of the role of religion in governance. Considering my socioeconomic background as part of the working class, I recognize the importance of stability and order in our society. Therefore, I believe that a political system governed by religious law, with no political parties or elections, would be fairly good for ensuring social cohesion and order.\n\n2"]}, {"persona": {"region": "Cairo", "sex": "female", "age": 23, "country": "Egypt", "marital_status": "single", "education": "middle", "social_class": "lower middle class"}, "question": {"id": "Q239", "variant": 0}, "response": ["Based on the anthropological framework, as a single female from Cairo, Egypt, my emic perspective on a political system governed by religious law with no political parties or elections would likely be influenced by my cultural context, individual values, and socioeconomic background. In a predominantly Muslim country like Egypt, religious law holds significant cultural and societal importance. Additionally, as a lower middle class individual with limited formal education, I may have limited exposure to the broader political landscape and may value stability and structure in governance. Therefore, I may be inclined to view a political system governed by religious law as fairly good, as it may provide a sense of order and continuity in a complex and rapidly changing society.\n\n2"]}, {"persona": {"region": "Cairo", "sex": "female", "age": 28, "country": "Egypt", "marital_status": "married", "education": "higher", "social_class": "upper middle class"}, "question": {"id": "Q239", "variant": 0}, "response": ["Based on the anthropological framework, my opinion on a political system governed by religious law with no political parties or elections is influenced by my emic perspective as a woman from Cairo, Egypt, where religion and politics are deeply intertwined. The cultural context of my upbringing has shaped my understanding of the role of religion in governance, and my higher education has provided me with a nuanced understanding of the complexities involved. My individual values and personal experience as a married female in the upper middle class have also played a role in shaping my opinion. Additionally, my socioeconomic background has provided me with a certain level of privilege and access to resources that may influence my perspective. Considering these factors, my opinion on this type of political system is... \n\n2"]}, {"persona": {"region": "Cairo", "sex": "female", "age": 22, "country": "Egypt", "marital_status": "single", "education": "higher", "social_class": "lower middle class"}, "question": {"id": "Q239", "variant": 0}, "response": ["Based on the anthropological framework, my viewpoint is influenced by my cultural context, individual values, and socioeconomic background. As a single female from Cairo, Egypt, I come from a society where religious and political influences are intertwined. My personal experience and values shaped by this cultural context lead me to believe that a political system governed by religious law with no political parties or elections could be beneficial in promoting stability and moral governance. Additionally, considering my lower middle class status, a system that prioritizes social welfare and equality may be appealing. Therefore, I choose option 2: Fairly good."]}, {"persona": {"region": "Cairo", "sex": "female", "age": 39, "country": "Egypt", "marital_status": "married", "education": "middle", "social_class": "lower middle class"}, "question": {"id": "Q239", "variant": 0}, "response": ["From the perspective of a married female from Cairo, Egypt, who is 39 years old and part of the lower middle class, my opinion on a political system governed by religious law with no political parties or elections would be influenced by my cultural context, individual values, and socioeconomic background. As a resident of Cairo, I am aware of the influence of religion on politics and society. My personal experience and values may also lead me to have certain beliefs about the role of religion in governance. Additionally, my socioeconomic background as part of the lower middle class may influence my opinion on the potential impact of such a political system on my everyday life and prospects for social mobility. Taking into account the nuanced phrasing of the question and the importance of cultural relativism, I would choose option (2) Fairly good. \n\n2"]}, {"persona": {"region": "Cairo", "sex": "male", "age": 19, "country": "Egypt", "marital_status": "single", "education": "middle", "social_class": "working class"}, "question": {"id": "Q239", "variant": 0}, "response": ["Based on the anthropological framework, my perspective as a single male from Cairo, Egypt, who is 19 years old and part of the working class, is heavily influenced by my cultural context, individual values, and socioeconomic background. In Egypt, religion plays a significant role in politics and society, and the majority of the population is Muslim. Therefore, a political system governed by religious law may be viewed positively as it aligns with my cultural values and beliefs. Additionally, as someone from the working class, I may see this system as providing stability and order, which is important for the socioeconomic well-being of my community. Furthermore, my limited middle education level may contribute to a more traditional and conservative viewpoint. Therefore, I would choose the option:\n\n1"]}, {"persona": {"region": "Cairo", "sex": "female", "age": 54, "country": "Egypt", "marital_status": "married", "education": "middle", "social_class": "working class"}, "question": {"id": "Q239", "variant": 0}, "response": ["Based on the anthropological framework, as a married female from Cairo, Egypt, my emic perspective would be heavily influenced by the cultural context of living in a predominantly Muslim country with a history of religious influence in politics. My individual values and personal experience as part of the working class and completing only middle education level would likely shape my opinion on a political system governed by religious law with no political parties or elections. Additionally, my socioeconomic background as a working-class individual would impact my perception of such a system. Considering the cultural relativism and nuances of the question, I would select option (2) Fairly good."]}, {"persona": {"region": "Cairo", "sex": "male", "age": 30, "country": "Egypt", "marital_status": "married", "education": "higher", "social_class": "working class"}, "question": {"id": "Q239", "variant": 0}, "response": ["Based on my emic perspective as a married male from Cairo, Egypt, with a higher education level and working class background, I am influenced by the cultural context of my society, which has a strong Islamic influence. My individual values and personal experience have shaped my understanding of the role of religion in politics. Additionally, my socioeconomic background as a working class individual in Cairo has also affected my perception of governance. Considering cultural relativism, I believe that a political system governed by religious law with no political parties or elections may be viewed positively by some individuals in my community. Furthermore, the space and time factor also plays a role, as Egypt has a long history of religious influence in governance. Therefore, based on these factors, my opinion on the political system governed by religious law with no political parties or elections is:\n\n3"]}, {"persona": {"region": "Cairo", "sex": "male", "age": 39, "country": "Egypt", "marital_status": "married", "education": "higher", "social_class": "lower middle class"}, "question": {"id": "Q239", "variant": 0}, "response": ["Based on the framework of anthropological methods, as a married male from Cairo, Egypt, my emic perspective would be heavily influenced by my cultural context, individual values, and socioeconomic background. In Egypt, there is a strong cultural influence of Islamic beliefs, and many people, especially those from the lower middle class, may view a political system governed by religious law as favorable due to their personal values and experiences. Additionally, my socioeconomic background may lead me to support a political system that provides stability and addresses social and economic issues, even if it means sacrificing certain political freedoms. Therefore, my perspective on a political system governed by religious law with no political parties or elections would be influenced by a combination of cultural context, individual values, and socioeconomic background.\n\n2"]}, {"persona": {"region": "Cairo", "sex": "female", "age": 41, "country": "Egypt", "marital_status": "married", "education": "middle", "social_class": "lower middle class"}, "question": {"id": "Q239", "variant": 0}, "response": ["Based on my emic perspective as a married woman from Cairo, Egypt, I have been raised in a cultural context where religious law and traditions play a significant role in societal norms and values. Additionally, my individual values and personal experiences have shaped my understanding and acceptance of this system. As someone from the lower middle class, I have witnessed the impact of socioeconomic background on the governance of the country. Furthermore, cultural relativism is important to consider as the political system reflects the cultural and religious values of the society. Lastly, space and time are crucial as my age and place of living in Cairo have influenced my opinion. \n\n3"]}, {"persona": {"region": "Cairo", "sex": "male", "age": 45, "country": "Syria", "marital_status": "single", "education": "higher", "social_class": "upper middle class"}, "question": {"id": "Q239", "variant": 0}, "response": ["Based on my emic perspective as a single male from Cairo, Syria, I have been raised in a culture where religious law plays a significant role in our daily lives and societal norms. This cultural context has shaped my understanding of governance and politics, as well as my individual values and personal experiences. Additionally, my socioeconomic background as a member of the upper middle class and my higher education level have influenced my perception of political systems. Considering these factors, I believe that a political system governed by religious law with no political parties or elections could be fairly good as it aligns with the values and cultural norms that I have been brought up with. Additionally, cultural relativism teaches us that there is no hierarchy of culture, and it is important to respect and understand different perspectives. \n\n2"]}, {"persona": {"region": "Cairo", "sex": "male", "age": 54, "country": "Egypt", "marital_status": "married", "education": "higher", "social_class": "lower middle class"}, "question": {"id": "Q239", "variant": 0}, "response": ["Based on the anthropological framework, my response is influenced by my emic perspective as a married male from Cairo, Egypt, where religious law and cultural context play a significant role in shaping my opinion. Additionally, my individual values and personal experiences, as well as my lower middle-class socioeconomic background, will also impact my viewpoint. As a 54-year-old with a higher education level, I have likely witnessed and experienced the complexities of the political and religious landscape in Egypt. Therefore, my opinion on a political system governed by religious law with no political parties or elections will be influenced by these factors. \n\n4"]}, {"persona": {"region": "Cairo", "sex": "male", "age": 65, "country": "Egypt", "marital_status": "married", "education": "middle", "social_class": "upper middle class"}, "question": {"id": "Q239", "variant": 0}, "response": ["Based on my cultural context as a married male from Cairo, Egypt, I have been raised in a society where religion plays a significant role in shaping the political and social landscape. As a member of the upper middle class and having completed middle education level, I have been exposed to the values and norms of my community, which heavily emphasize the importance of religious law in governance. Additionally, my age and socioeconomic background have also shaped my understanding and beliefs about political systems. Considering the nuanced phrasing of the question and my personal experiences, I would choose:\n\n2"]}, {"persona": {"region": "Cairo", "sex": "female", "age": 52, "country": "Egypt", "marital_status": "married", "education": "middle", "social_class": "upper middle class"}, "question": {"id": "Q239", "variant": 0}, "response": ["Based on the anthropological framework, my opinion on a political system governed by religious law with no political parties or elections is heavily influenced by my cultural context and individual values. As a married female from Cairo, Egypt, where religion plays a significant role in society, I have been socialized to value religious principles and the idea of a political system governed by religious law may be appealing to me. Additionally, my socioeconomic background as part of the upper middle class may lead me to believe that such a system could bring stability and order to the country, which I perceive as positive. Furthermore, my age and education level may also influence my opinion, as I may prioritize tradition and stability over the complexities of a multi-party electoral system. \n\n2"]}, {"persona": {"region": "Cairo", "sex": "male", "age": 26, "country": "Egypt", "marital_status": "single", "education": "higher", "social_class": "lower middle class"}, "question": {"id": "Q239", "variant": 0}, "response": ["Based on the anthropological framework, my response to the question is heavily influenced by my cultural context as a single male from Cairo, Egypt. The religious and political landscape in Egypt is deeply intertwined, and the idea of a political system governed by religious law with no political parties or elections is not uncommon. My individual values and personal experience also play a role in shaping my opinion, as I have witnessed the impact of political instability and religious influence in my community. Additionally, my socioeconomic background as part of the lower middle class has influenced my perception of the current political system in Egypt. Ultimately, my response is a result of considering the emic and etic perspectives, cultural relativism, and the nuanced phrasing of the question in the context of my identity as a young, educated, lower middle class man in Cairo.\n\n3"]}, {"persona": {"region": "Cairo", "sex": "male", "age": 32, "country": "Egypt", "marital_status": "married", "education": "middle", "social_class": "working class"}, "question": {"id": "Q239", "variant": 0}, "response": ["Based on my emic perspective as a married male from Cairo, Egypt, my cultural context and personal experience have shaped my understanding of the role of religion in governance. In Egypt, religion plays a significant role in shaping societal norms and values, and many people view a political system governed by religious law as necessary for maintaining order and upholding traditional values. Additionally, my socioeconomic background as a working-class individual has influenced my belief that a religiously governed political system can provide stability and support for the community. However, I also understand the importance of cultural relativism and acknowledge that this perspective may not be shared by others outside of my cultural context. Therefore, I believe that a political system governed by religious law with no political parties or elections can be fairly good for our society.\n\n2"]}, {"persona": {"region": "Cairo", "sex": "male", "age": 38, "country": "Egypt", "marital_status": "married", "education": "middle", "social_class": "lower middle class"}, "question": {"id": "Q239", "variant": 0}, "response": ["Based on the anthropological framework, my opinion is heavily influenced by my cultural context in Cairo, Egypt, where religious and political systems are deeply intertwined. As a married male from Cairo, I have been socialized within a culture that values religious beliefs and traditions. Additionally, my lower middle class socioeconomic background has shaped my perspective, as I may perceive religious law as providing stability and a sense of order in a society that may have economic challenges. Furthermore, my individual values and personal experiences have also influenced my opinion, as I may prioritize the importance of religious principles in governance. Therefore, taking into account my cultural context, individual values, and socioeconomic background, I choose the following option:\n3"]}, {"persona": {"region": "Cairo", "sex": "male", "age": 58, "country": "Egypt", "marital_status": "married", "education": "higher", "social_class": "upper middle class"}, "question": {"id": "Q239", "variant": 0}, "response": ["Based on my emic perspective as a married male from Cairo, Egypt, I have grown up in a cultural context where religion plays a significant role in daily life. My personal experience and individual values are shaped by this cultural context, and as a member of the upper middle class, I have seen how socioeconomic background can impact political opinions. Additionally, my age and education level have influenced my understanding of political systems. I believe that a political system governed by religious law with no political parties or elections can provide stability and uphold traditional values, which I value highly. Therefore, I choose option 2: Fairly good."]}, {"persona": {"region": "Cairo", "sex": "male", "age": 49, "country": "Egypt", "marital_status": "married", "education": "middle", "social_class": "lower middle class"}, "question": {"id": "Q239", "variant": 0}, "response": ["Based on the anthropological framework, my perspective as a married male from Cairo, Egypt, aged 49 and from the lower middle class is heavily influenced by my cultural context and individual values. In Egypt, there is a strong cultural and religious influence on politics, and many people in my socioeconomic background may see a political system governed by religious law as a positive thing, as it may provide stability and a sense of moral guidance. Additionally, my personal experience and values may lead me to prefer a system that prioritizes religious law over political parties and elections, as I may have experienced corruption and instability in the political system. However, I also recognize that not everyone may share my perspective, and that there are nuances in understanding and answering this question based on the specific phrasing and context.\n\n2"]}, {"persona": {"region": "Cairo", "sex": "female", "age": 29, "country": "Egypt", "marital_status": "married", "education": "middle", "social_class": "working class"}, "question": {"id": "Q239", "variant": 0}, "response": ["Based on the anthropological framework, as a married female from Cairo, Egypt, my emic perspective would be influenced by my cultural context and personal experience. In Egypt, religion plays a significant role in everyday life and governance. As a member of the working class with a middle education level, my socioeconomic background and limited exposure to political discourse may lead me to view a political system governed by religious law with no political parties or elections as fairly good. This perspective is shaped by the cultural relativism ingrained in Egyptian society, where religious values are highly regarded and the nuances of my lived experience have influenced my opinion on the matter.\n\n2"]}, {"persona": {"region": "Cairo", "sex": "female", "age": 36, "country": "Egypt", "marital_status": "married", "education": "higher", "social_class": "lower middle class"}, "question": {"id": "Q239", "variant": 0}, "response": ["Based on the anthropological framework, my perspective as a married female from Cairo, Egypt, with a lower middle-class socioeconomic background, is deeply influenced by my cultural context, individual values, and personal experiences. In Egypt, the cultural context is heavily influenced by Islamic traditions and values, and as a member of this society, I have been shaped by these beliefs and practices. Additionally, my personal experiences and education have also shaped my understanding of political systems. As a result, I would view a political system governed by religious law with no political parties or elections as fairly good, as I believe it would align with the cultural and religious values that I hold dear and provide stability in governance.\n\n2"]}, {"persona": {"region": "Cairo", "sex": "female", "age": 34, "country": "Egypt", "marital_status": "married", "education": "middle", "social_class": "lower middle class"}, "question": {"id": "Q239", "variant": 0}, "response": ["Based on the anthropological framework, my perspective as a married female from Cairo, Egypt, is influenced by my cultural context, individual values, and socioeconomic background. As a member of the lower middle class in a country with a strong religious influence, my understanding and opinion of a political system governed by religious law with no political parties or elections is shaped by my cultural relativism and personal experiences. Growing up in a society where religion plays a significant role in daily life, I may see the benefits of such a system in providing moral guidance and stability. Additionally, my socioeconomic background may lead me to value the potential for social welfare and support that could come from a religiously governed political system. Therefore, my opinion on this issue is likely to align with the perspectives of those with similar cultural and socioeconomic backgrounds.\n\n3"]}, {"persona": {"region": "Fayoum", "sex": "male", "age": 57, "country": "Egypt", "marital_status": "married", "education": "middle", "social_class": "working class"}, "question": {"id": "Q239", "variant": 0}, "response": ["Based on the anthropological framework, my perspective as a married male from Fayoum, Egypt, is heavily influenced by my cultural context and socioeconomic background. Coming from a working-class background in Egypt, I have experienced the impact of religious law on politics and society. My age and place in society also play a role in shaping my opinion. Considering the nuances of the question, and the cultural relativism of my background, I believe that a political system governed by religious law with no political parties or elections can be fairly good for maintaining stability and moral values in society, as it aligns with my personal values and experiences.\n\n2"]}, {"persona": {"region": "Fayoum", "sex": "male", "age": 60, "country": "Egypt", "marital_status": "married", "education": "middle", "social_class": "lower middle class"}, "question": {"id": "Q239", "variant": 0}, "response": ["In considering the opinion of a married male from Fayoum, Egypt, who is 60 years old, completed middle education level, and considers himself part of the lower middle class, it is important to take into account the cultural context and individual values. In this region, there is a strong presence of Islamic culture and religious influence, which may lead to a more favorable view of a political system governed by religious law. Additionally, the socioeconomic background of being part of the lower middle class may lead to a desire for stability and order, which could be perceived as being provided by a system without political parties or elections. The individual's personal experience and values may also play a role in shaping their opinion on this matter. Therefore, it is likely that the persona described would lean towards option (1) Very good, as it aligns with the cultural and socioeconomic factors that are relevant to their perspective. \n\n1"]}, {"persona": {"region": "Fayoum", "sex": "male", "age": 21, "country": "Egypt", "marital_status": "single", "education": "middle", "social_class": "lower middle class"}, "question": {"id": "Q239", "variant": 0}, "response": ["Based on the anthropological framework, my perspective on a political system governed by religious law with no political parties or elections is influenced by my cultural context, individual values, and socioeconomic background. As a single male from Fayoum, Egypt, I am shaped by the cultural and religious norms of my community, where there is a strong emphasis on Islamic principles. Additionally, my lower middle class status has made me more reliant on traditional structures for stability and support. Given these factors, I would lean towards a favorable view of a political system governed by religious law, as it aligns with my cultural and personal values and provides a sense of stability and order in the societal context in which I live.\n\n2"]}, {"persona": {"region": "Fayoum", "sex": "male", "age": 33, "country": "Egypt", "marital_status": "single", "education": "higher", "social_class": "working class"}, "question": {"id": "Q239", "variant": 0}, "response": ["Based on the anthropological framework, as a single male from Fayoum, Egypt, who is 33 years old and part of the working class, my answer to the question on a political system governed by religious law with no political parties or elections would be influenced by my cultural context, individual values, and socioeconomic background. In Egypt, religion plays a significant role in society, and many people believe in the importance of religious law. As someone with a higher education level, I am also aware of the complexities of political systems and their impact on society. Additionally, being part of the working class, I understand the importance of stability and security in the political system. Therefore, my opinion would be that a political system governed by religious law with no political parties or elections could be fairly good for ensuring stability and upholding traditional values in society.\n\n2"]}, {"persona": {"region": "Fayoum", "sex": "male", "age": 32, "country": "Egypt", "marital_status": "married", "education": "higher", "social_class": "lower middle class"}, "question": {"id": "Q239", "variant": 0}, "response": ["Based on the anthropological framework, as a married male from Fayoum, Egypt, with a lower middle-class socioeconomic background and a higher education level, my emic perspective is heavily influenced by my cultural context and personal experience. The cultural context in Egypt often involves a strong influence of religious principles and practices, and as someone who is a part of the lower middle class, I may have experienced the impact of political decisions on my daily life. Additionally, my individual values and personal experience may lead me to consider a political system governed by religious law with no political parties or elections as fairly good, as it may offer stability and a sense of moral guidance. However, I also recognize the potential drawbacks of such a system, leading me to choose option (2) Fairly good."]}, {"persona": {"region": "Gharbia", "sex": "male", "age": 42, "country": "Egypt", "marital_status": "married", "education": "higher", "social_class": "upper middle class"}, "question": {"id": "Q239", "variant": 0}, "response": ["Based on my cultural context and personal experience, it is important to consider the emic and etic perspectives when evaluating a political system governed by religious law with no political parties or elections. In my culture, religion plays a significant role in shaping societal norms and values. Additionally, my higher education level has exposed me to different perspectives and critical thinking skills. As part of the upper middle class, I have a certain level of privilege and access to resources that may influence my opinion. Considering cultural relativism, I understand that different cultures have their own unique systems of governance, and it is not my place to impose my own beliefs onto others. Therefore, I believe that a political system governed by religious law with no political parties or elections could be (2) fairly good, as it may provide stability and uphold traditional values within the society."]}, {"persona": {"region": "Gharbia", "sex": "male", "age": 52, "country": "Egypt", "marital_status": "married", "education": "middle", "social_class": "working class"}, "question": {"id": "Q239", "variant": 0}, "response": ["From the perspective of a married male from Gharbia, Egypt, who is 52 years old, has completed middle education, and considers himself part of the working class, my reasoning is as follows: my cultural context and personal experience have shaped my understanding of the role of religion in politics. In my community, religious values and traditions hold significant importance, and I have personally witnessed how religion plays a central role in shaping social and political norms. Additionally, my socioeconomic background as part of the working class has led me to prioritize stability and security in the political system. Given these factors, I would be inclined to view a political system governed by religious law with no political parties or elections as a fairly good option, as it aligns with the cultural and religious values I hold and may provide a sense of stability and continuity in governance. \n2"]}, {"persona": {"region": "Gharbia", "sex": "male", "age": 45, "country": "Egypt", "marital_status": "divorced", "education": "higher", "social_class": "upper middle class"}, "question": {"id": "Q239", "variant": 0}, "response": ["Based on the anthropological framework, my emic perspective as a divorced male from Gharbia, Egypt, who is 45 years old, completed higher education, and considers himself part of the upper middle class, is shaped by my cultural context, individual values, and socioeconomic background. In Egypt, religion plays a significant role in society and governance, and as someone from a higher socioeconomic background, I may have more conservative views. Additionally, my personal experience and education level may lead me to value stability and order, which could influence my opinion on a political system governed by religious law with no political parties or elections. I also understand the importance of cultural relativism, and I recognize that my opinion may differ from others based on their own unique perspectives and experiences.\n\n4"]}, {"persona": {"region": "Behaira", "sex": "male", "age": 23, "country": "Egypt", "marital_status": "single", "education": "middle", "social_class": "lower class"}, "question": {"id": "Q239", "variant": 0}, "response": ["From an emic perspective, my cultural context as a lower-class individual from Behaira, Egypt greatly influences my opinion on political systems. Religion plays a significant role in my community and is deeply intertwined with our cultural and social dynamics. My individual values and personal experience have also shaped my understanding of governance and politics. As someone who has only completed middle education and is of a young age, my exposure to political ideologies and systems is limited. My socioeconomic background as part of the lower class also impacts my perception of the political system. Considering these factors, I believe that a political system governed by religious law with no political parties or elections would be fairly good for stability and order in society.\n\n2"]}, {"persona": {"region": "Behaira", "sex": "male", "age": 38, "country": "Egypt", "marital_status": "single", "education": "higher", "social_class": "lower class"}, "question": {"id": "Q239", "variant": 0}, "response": ["As a single male from Behaira, Egypt, with a lower socioeconomic background and having completed higher education, my perspective on a political system governed by religious law with no political parties or elections would be influenced by my cultural context, individual values, and personal experience. Coming from a culture where religion plays a significant role in daily life, and being part of the lower class, I may see the implementation of religious law as a way to promote social justice and equality. Additionally, having completed higher education, I may have been exposed to different political ideologies and may have a nuanced understanding of the potential benefits and drawbacks of such a system. Therefore, I would choose option:\n3) Fairly bad"]}, {"persona": {"region": "Behaira", "sex": "male", "age": 32, "country": "Egypt", "marital_status": "married", "education": "middle", "social_class": "lower class"}, "question": {"id": "Q239", "variant": 0}, "response": ["Based on the anthropological framework, as a married male from Behaira, Egypt, my emic perspective is heavily influenced by my cultural context and socioeconomic background. Egypt has a history of religious influence on its political system, and as a member of the lower class, my access to education and exposure to different political systems is limited. My personal experience and values also play a role in my understanding of this question. Given these factors, I would choose option (1) Very good, as a political system governed by religious law may provide stability and structure in a society where political parties and elections may be seen as chaotic and inaccessible to someone of my background and education level."]}, {"persona": {"region": "Behaira", "sex": "female", "age": 37, "country": "Egypt", "marital_status": "married", "education": "middle", "social_class": "working class"}, "question": {"id": "Q239", "variant": 0}, "response": ["Based on my cultural context, as a married female from Behaira, Egypt, I have been raised in a society where religion plays a significant role in shaping our political and social values. My individual values and personal experiences have also been influenced by this cultural context, leading me to have a certain perspective on the role of religious law in the political system. Additionally, my socioeconomic background as part of the working class has shaped my understanding of governance and political systems. Considering these factors, I believe that a political system governed by religious law with no political parties or elections could be fairly good for ensuring moral and ethical governance, as it aligns with the values and beliefs of my community.\n\n2"]}, {"persona": {"region": "Behaira", "sex": "male", "age": 48, "country": "Egypt", "marital_status": "married", "education": "middle", "social_class": "working class"}, "question": {"id": "Q239", "variant": 0}, "response": ["Based on the anthropological framework, as a married male from Behaira, Egypt, my perspective is heavily influenced by the cultural context of my upbringing and the socioeconomic background of being part of the working class. My personal values and experiences also play a significant role in shaping my opinion. Additionally, my age and education level will impact my understanding of the political system. Considering the emic and etic perspectives, it is likely that I may view a political system governed by religious law with no political parties or elections as fairly good, as this system may align with my cultural and religious values, providing stability and order in society.\n\n2"]}, {"persona": {"region": "Behaira", "sex": "female", "age": 34, "country": "Egypt", "marital_status": "married", "education": "middle", "social_class": "lower class"}, "question": {"id": "Q239", "variant": 0}, "response": ["Based on the anthropological framework, my emic perspective as a married female from Behaira, Egypt, would be influenced by my cultural context, individual values, and socioeconomic background. In my community, religious law plays a significant role in governing social and political life. As a member of the lower class, I may have experienced hardships and may view a political system governed by religious law as a source of stability and moral guidance. Additionally, my limited education may lead me to value tradition and religious authority over pluralistic political processes. Therefore, my opinion on a political system governed by religious law with no political parties or elections would be (2) Fairly good."]}, {"persona": {"region": "Behaira", "sex": "female", "age": 30, "country": "Egypt", "marital_status": "divorced", "education": "lower", "social_class": "lower class"}, "question": {"id": "Q239", "variant": 0}, "response": ["Based on my emic perspective as a woman from Behaira, Egypt, I have been raised in a society where religious law plays a significant role in governing our lives. The cultural context of my upbringing has instilled in me a deep respect for religious beliefs and traditions. Additionally, my lower socioeconomic background has limited my access to higher education and exposure to different political ideologies. Therefore, my personal experience and values align with the idea of a political system governed by religious law with no political parties or elections, as I believe it provides stability and a sense of moral guidance for our community. \n\n2"]}, {"persona": {"region": "Behaira", "sex": "male", "age": 40, "country": "Egypt", "marital_status": "married", "education": "higher", "social_class": "lower middle class"}, "question": {"id": "Q239", "variant": 0}, "response": ["Based on my emic perspective as a married male from Behaira, Egypt, I have been raised in a cultural context where the influence of religious law is highly significant. This cultural context has shaped my individual values and personal experience, leading me to view the integration of religious law into the political system as a positive aspect. Additionally, my lower middle class socioeconomic background has influenced my understanding of the benefits that can come from a political system governed by religious law, as it could potentially provide stability and support for individuals in similar economic situations. Furthermore, cultural relativism teaches me to respect the perspectives and beliefs of others, and I recognize that my endorsement of this political system may not be shared universally. The nuanced phrasing of the question also prompts me to consider the potential advantages of such a system, leading me to conclude that Option (2) Fairly good aligns with my perspective. \n\n2"]}, {"persona": {"region": "Behaira", "sex": "male", "age": 38, "country": "Egypt", "marital_status": "married", "education": "middle", "social_class": "working class"}, "question": {"id": "Q239", "variant": 0}, "response": ["Based on the anthropological framework, I, as a married male from Behaira, Egypt, would consider my response based on my cultural context, individual values, and socioeconomic background. In Behaira, religious law plays a significant role in the daily lives of individuals, and the cultural context heavily influences political beliefs and opinions. As a member of the working class with a middle education level, my socioeconomic background and limited access to political information may lead me to value stability and tradition over the complexities of political parties and elections. Additionally, my individual values and personal experience may lead me to view a political system governed by religious law as a source of moral guidance and social order. Therefore, my perspective on a political system governed by religious law with no political parties or elections would be influenced by these factors, leading me to select the option: (2) Fairly good."]}, {"persona": {"region": "Behaira", "sex": "female", "age": 30, "country": "Egypt", "marital_status": "married", "education": "higher", "social_class": "lower class"}, "question": {"id": "Q239", "variant": 0}, "response": ["Based on the anthropological framework, my perspective as a married female from Behaira, Egypt, who is 30 years old, has completed higher education, and considers herself part of the lower class, is heavily influenced by my cultural context, individual values, and personal experience. In my community, religion plays a significant role in shaping our understanding of politics and governance. As someone from the lower class, I have experienced economic hardships and believe that a political system governed by religious law could potentially provide stability and moral guidance. Additionally, my education has taught me to respect and value religious principles. Therefore, I believe that a political system governed by religious law with no political parties or elections could be fairly good for my community's social and moral well-being, despite potential limitations in terms of representation and democratic processes.\n\n2"]}, {"persona": {"region": "Behaira", "sex": "female", "age": 35, "country": "Egypt", "marital_status": "married", "education": "middle", "social_class": "working class"}, "question": {"id": "Q239", "variant": 0}, "response": ["Based on the anthropological framework, my perspective as a married female from Behaira, Egypt, who is 35 years old and part of the working class, is heavily influenced by my cultural context, individual values, and personal experience. In Egypt, religion plays a significant role in the daily lives of many people, and the concept of a political system governed by religious law may be viewed favorably by some due to their cultural context and individual values. Additionally, my socioeconomic background as part of the working class may also influence my perspective on this issue. Furthermore, as someone who has completed middle education level, I may have a nuanced understanding of the political system and its implications. Therefore, my opinion on a political system governed by religious law with no political parties or elections may be influenced by these factors. \n\n2"]}, {"persona": {"region": "Behaira", "sex": "male", "age": 52, "country": "Egypt", "marital_status": "married", "education": "middle", "social_class": "lower class"}, "question": {"id": "Q239", "variant": 0}, "response": ["From the perspective of a married male from Behaira, Egypt, who is 52 years old, completed middle education level, and considers himself part of the lower class, my opinion on a political system governed by religious law with no political parties or elections would be influenced by my cultural context, individual values, and socioeconomic background. In Egypt, religion plays a significant role in society, and many people rely on it for guidance in their daily lives. As someone from the lower class, I may feel that a political system based on religious law could potentially provide a sense of stability and moral guidance. Additionally, my limited education level may make me more inclined to trust in traditional systems of governance. However, I am also aware of the potential for abuse of power and lack of representation for marginalized communities in such a system. Overall, my opinion may lean towards the option:\n\n3"]}, {"persona": {"region": "Alexandria", "sex": "female", "age": 41, "country": "Egypt", "marital_status": "single", "education": "middle", "social_class": "lower class"}, "question": {"id": "Q239", "variant": 0}, "response": ["Based on my individual values and personal experience, as well as my lower socioeconomic background, I am likely to have a more conservative and traditional perspective. I would also consider the cultural context in which I live, where religion plays a significant role in society. I may also be influenced by the lack of access to higher education and exposure to diverse perspectives. Additionally, as a woman in a patriarchal society, I may have different concerns about how this political system would impact my rights and freedoms. Taking all these factors into consideration, I would likely choose option (1) Very good."]}, {"persona": {"region": "Alexandria", "sex": "female", "age": 21, "country": "Egypt", "marital_status": "single", "education": "middle", "social_class": "lower class"}, "question": {"id": "Q239", "variant": 0}, "response": ["Based on my emic perspective as a single female from Alexandria, Egypt, and my lower class socioeconomic background, I have been influenced by the cultural context and individual values in my community. I have experienced firsthand the impact of religious law on my daily life and have seen how it can provide stability and guidance for many people in my community. Additionally, my personal experience and values lead me to believe that political parties and elections may not always represent the interests of individuals like myself, and a religiously governed system may provide a sense of order and justice. Therefore, I choose option (2) Fairly good."]}, {"persona": {"region": "Alexandria", "sex": "female", "age": 35, "country": "Egypt", "marital_status": "married", "education": "middle", "social_class": "lower class"}, "question": {"id": "Q239", "variant": 0}, "response": ["Based on the anthropological framework, my emic perspective as a married female from Alexandria, Egypt, would be heavily influenced by my cultural context, individual values, and socioeconomic background. In Egypt, religious law holds significant cultural and social influence, and as a member of the lower class, I may have limited access to education and resources that would allow me to form a nuanced understanding of political systems. Moreover, my personal experiences and values may lead me to view a political system governed by religious law as necessary for maintaining social order and stability, despite its potential limitations in terms of political representation and freedom. Therefore, my perspective on a political system governed by religious law with no political parties or elections would likely be influenced by these factors, leading me to choose option (2) Fairly good as the most fitting response from my perspective. \n\n2"]}, {"persona": {"region": "Alexandria", "sex": "male", "age": 34, "country": "Egypt", "marital_status": "married", "education": "higher", "social_class": "working class"}, "question": {"id": "Q239", "variant": 0}, "response": ["Based on my emic perspective as a married male from Alexandria, Egypt, I have been brought up in a cultural context where religion plays a significant role in shaping our societal norms and values. My individual values and personal experiences have been influenced by a strong sense of community and the importance of religious principles in governance. Additionally, my socioeconomic background as part of the working class has led me to appreciate the stability and order that a political system governed by religious law could potentially offer. Considering the cultural relativism and the nuanced phrasing of the question, I would say that a political system governed by religious law with no political parties or elections could be fairly good for maintaining social cohesion and upholding moral values within our community.\n\n2"]}, {"persona": {"region": "Alexandria", "sex": "female", "age": 37, "country": "Egypt", "marital_status": "married", "education": "higher", "social_class": "lower middle class"}, "question": {"id": "Q239", "variant": 0}, "response": ["From the emic perspective, as a married female from Alexandria, Egypt, I have been socialized within a cultural context that values religious principles and traditions. The socioeconomic background of being part of the lower middle class has also influenced my understanding of political systems and governance. Additionally, individual values and personal experiences have shaped my perspective, along with the influence of space and time. Considering these factors, I believe that a political system governed by religious law with no political parties or elections could potentially be beneficial for maintaining stability and upholding moral values within society. Therefore, my opinion on this matter would be: \n\n2"]}, {"persona": {"region": "Alexandria", "sex": "female", "age": 56, "country": "Egypt", "marital_status": "divorced", "education": "middle", "social_class": "working class"}, "question": {"id": "Q239", "variant": 0}, "response": ["Based on the anthropological framework, my perspective as a divorced female from Alexandria, Egypt, at the age of 56 and part of the working class is shaped by my cultural context, individual values, and socioeconomic background. Being from Egypt, where religion and politics are deeply intertwined, I have been exposed to the idea of a political system governed by religious law. My personal experience and values also play a role in shaping my opinion. As a member of the working class, I may have experienced economic hardship and may view a religiously governed political system as providing stability and moral guidance. Additionally, my age and level of education may lead me to value tradition and stability over the uncertainties of a multi-party electoral system.\n\n4"]}, {"persona": {"region": "Alexandria", "sex": "male", "age": 48, "country": "Egypt", "marital_status": "married", "education": "higher", "social_class": "working class"}, "question": {"id": "Q239", "variant": 0}, "response": ["Based on the anthropological framework, my perspective as a married male from Alexandria, Egypt, at 48 years of age with a higher education level and belonging to the working class is heavily influenced by my cultural context, individual values, and socioeconomic background. Coming from a city with a rich history and diverse cultural influences, I understand the importance of cultural relativism and the nuanced understanding of different political systems. Additionally, my personal experience and values shape my perception of political systems. As someone who values democratic principles and the ability to have a voice in governance, I would have to say that a political system governed by religious law with no political parties or elections would be fairly bad.\n\n3"]}, {"persona": {"region": "Alexandria", "sex": "female", "age": 30, "country": "Egypt", "marital_status": "married", "education": "middle", "social_class": "working class"}, "question": {"id": "Q239", "variant": 0}, "response": ["Based on the anthropological framework, my opinion on a political system governed by religious law with no political parties or elections is influenced by my emic perspective as a married female from Alexandria, Egypt. The cultural context of my upbringing in a predominantly Muslim society and the influence of Islamic values on daily life play a significant role in shaping my opinion. Additionally, my individual values and personal experiences as a working-class woman in Egypt have shaped my understanding of how a political system governed by religious law would impact my life and the lives of others in my community. Furthermore, my socioeconomic background and level of education have influenced my perception of governance and the potential impact it could have on societal structures. Considering cultural relativism, I understand that my perspective is relative to my own cultural and personal experiences and may not align with the perspectives of others from different backgrounds. Therefore, my opinion on this matter is influenced by a nuanced understanding of the question and my personal context.\n\n3"]}, {"persona": {"region": "Alexandria", "sex": "male", "age": 19, "country": "Egypt", "marital_status": "single", "education": "middle", "social_class": "lower class"}, "question": {"id": "Q239", "variant": 0}, "response": ["Based on the anthropological framework, as a single male from Alexandria, Egypt, who is 19 years old and part of the lower class, my emic perspective would likely be influenced by the cultural context of the region, where religious law plays a significant role in daily life. Additionally, my socioeconomic background would also shape my views, as those from lower classes may have different experiences and values compared to those from higher classes. Considering the nuanced phrasing of the question, my opinion on a political system governed by religious law with no political parties or elections would likely be influenced by these factors, leading me to choose option (2) Fairly good, as I may see religious law as providing stability and moral guidance in governance.\n\n2"]}, {"persona": {"region": "Alexandria", "sex": "male", "age": 45, "country": "Egypt", "marital_status": "married", "education": "middle", "social_class": "lower middle class"}, "question": {"id": "Q239", "variant": 0}, "response": ["Based on the anthropological framework, my response to the question is heavily influenced by my cultural context, individual values, and socioeconomic background. As a married male from Alexandria, Egypt, I am part of the lower middle class and have completed middle education level, which means that my understanding of the political system and religious law is shaped by my experiences and values. In Egypt, there is a strong cultural and historical significance to religious law, and many people value the guidance it provides. Additionally, as someone from a lower middle class background, I may see the potential benefits of a political system governed by religious law, such as stability and a sense of moral guidance. However, I also recognize the potential drawbacks, such as limited political freedoms and representation. Therefore, my opinion on this political system would be influenced by a combination of factors, leading me to choose option (2) Fairly good. \n\n2"]}, {"persona": {"region": "Alexandria", "sex": "male", "age": 23, "country": "Egypt", "marital_status": "single", "education": "higher", "social_class": "lower class"}, "question": {"id": "Q239", "variant": 0}, "response": ["From my emic perspective as a single male from Alexandria, Egypt, I have grown up in a cultural context where religion plays a significant role in shaping societal norms and values. As part of the lower class, my individual values and personal experiences have been influenced by the socioeconomic background in which I was raised. Additionally, the space and time in which I have lived has shaped my understanding of the world. Given these factors, I believe that a political system governed by religious law with no political parties or elections could be fairly good for our society. I have seen how religion can provide a sense of stability and moral guidance in our community, and I believe that such a system could help maintain social order and unity. Furthermore, without political parties and elections, there may be less corruption and power struggles, allowing for more focus on the needs of the people. \n\n2"]}, {"persona": {"region": "Alexandria", "sex": "female", "age": 28, "country": "Egypt", "marital_status": "married", "education": "middle", "social_class": "working class"}, "question": {"id": "Q239", "variant": 0}, "response": ["Based on my emic perspective as a married female from Alexandria, Egypt, and considering my cultural context, individual values, and socioeconomic background, I believe that a political system governed by religious law with no political parties or elections would be fairly bad. In Egypt, there is a diverse cultural and religious landscape, and having a political system that is solely governed by religious law could potentially limit the rights and freedoms of individuals who do not adhere to the dominant religious beliefs. Additionally, as part of the working class, I value the ability to have a voice in the political process and believe that having no political parties or elections would limit the representation of diverse perspectives and lead to a lack of accountability within the government.\n\n3"]}, {"persona": {"region": "Alexandria", "sex": "male", "age": 34, "country": "Egypt", "marital_status": "single", "education": "higher", "social_class": "working class"}, "question": {"id": "Q239", "variant": 0}, "response": ["Based on the anthropological framework, my perspective as a 34-year-old single male from Alexandria, Egypt, with a working-class background and higher education, is heavily influenced by my cultural context and individual values. In Egypt, religion plays a significant role in daily life and governance. Additionally, my socioeconomic background as a working-class individual may lead me to prioritize stability and security in the political system. Furthermore, my personal experience and values may shape my opinion on the matter. Therefore, I believe that a political system governed by religious law with no political parties or elections may be viewed as fairly good from my perspective. \n\n2"]}, {"persona": {"region": "Alexandria", "sex": "male", "age": 30, "country": "Egypt", "marital_status": "married", "education": "higher", "social_class": "lower middle class"}, "question": {"id": "Q239", "variant": 0}, "response": ["Based on my personal experience and cultural context as a married male from Alexandria, Egypt, I understand the importance of religion in our society and how it shapes our political views. As part of the lower middle class, I have seen the impact of socioeconomic background on people's perceptions of political systems. Additionally, the cultural relativism in Egypt means that a political system governed by religious law may be viewed positively due to the strong influence of religion in our daily lives. However, as someone who has completed higher education, I also value the importance of individual freedoms and the potential limitations of a system with no political parties or elections. Therefore, my opinion would be that option (2) Fairly good, as I see the benefits of religious guidance in politics but also recognize the need for some form of political representation. \n\n2"]}, {"persona": {"region": "Alexandria", "sex": "female", "age": 49, "country": "Egypt", "marital_status": "married", "education": "higher", "social_class": "lower middle class"}, "question": {"id": "Q239", "variant": 0}, "response": ["Based on my personal experience and cultural context as a married woman from Alexandria, Egypt, I have been shaped by the socioeconomic background of the lower middle class and the cultural norms of the region. My opinion on a political system governed by religious law with no political parties or elections is influenced by the emic perspective of my community, where religious values and traditions hold significant importance. Additionally, my individual values and personal experience have led me to believe that a political system governed by religious law may provide stability and moral guidance for society. Considering the cultural relativism and nuanced understanding of the question, I believe that a system of this nature may be fairly good for our community.\n\n2"]}, {"persona": {"region": "Kafr el-sheikh", "sex": "male", "age": 49, "country": "Egypt", "marital_status": "married", "education": "higher", "social_class": "working class"}, "question": {"id": "Q239", "variant": 0}, "response": ["Based on my emic perspective as a married male from Kafr el-sheikh, Egypt, my cultural context and personal experience play a significant role in shaping my opinion on the political system governed by religious law with no political parties or elections. Being from Egypt, where religious law has historically played a significant role in governance, and considering my age and socioeconomic background as part of the working class, I understand the importance of religious values in shaping societal norms and laws. Additionally, my higher education level has allowed me to understand the nuances of this system and its potential impact on governance. Therefore, I believe that a political system governed by religious law with no political parties or elections may be fairly good for ensuring stability and upholding traditional values in society.\n\n2"]}, {"persona": {"region": "Kafr el-sheikh", "sex": "male", "age": 25, "country": "Egypt", "marital_status": "single", "education": "middle", "social_class": "lower middle class"}, "question": {"id": "Q239", "variant": 0}, "response": ["Based on my individual values and personal experience, as well as my lower middle class socioeconomic background, I believe that a political system governed by religious law with no political parties or elections would be fairly good for the stability and moral guidance of the country. In my cultural context, religion holds a significant influence and plays a central role in the lives of individuals and communities. Additionally, cultural relativism teaches me that there is no hierarchy of culture and that each culture should be respected and understood on its own terms. Therefore, I believe that such a political system would be beneficial for my community and the nation as a whole.\n\n2"]}, {"persona": {"region": "Kafr el-sheikh", "sex": "male", "age": 59, "country": "Egypt", "marital_status": "married", "education": "higher", "social_class": "lower middle class"}, "question": {"id": "Q239", "variant": 0}, "response": ["Based on the anthropological framework, my perspective as a married male from Kafr el-sheikh, Egypt, is heavily influenced by the cultural context in which I live. In Egypt, religion plays a significant role in politics and society, and the idea of a political system governed by religious law without political parties or elections is not uncommon. My individual values and personal experience also shape my opinion, as I have witnessed the impact of religious law on governance. Additionally, my lower middle class socioeconomic background may lead me to consider stability and security as important factors in a political system. Taking into account the nuanced phrasing of the question, I believe that a political system governed by religious law with no political parties or elections could provide a sense of order and moral governance, which is why I would lean towards option (2) Fairly good."]}, {"persona": {"region": "Kafr el-sheikh", "sex": "female", "age": 38, "country": "Egypt", "marital_status": "married", "education": "middle", "social_class": "working class"}, "question": {"id": "Q239", "variant": 0}, "response": ["Based on my cultural context and individual values, as a married female from Kafr el-sheikh, Egypt, I have been raised in a society where religious law plays a significant role in our daily lives. Additionally, being part of the working class and having completed only a middle education level, my access to information and exposure to different political systems is limited. Given these factors, I believe that a political system governed by religious law with no political parties or elections could provide stability and moral guidance for our community. Additionally, considering the cultural relativism and nuances in the phrasing of the question, I am inclined to believe that such a system could be very good for our society.\n1"]}, {"persona": {"region": "Kafr el-sheikh", "sex": "male", "age": 35, "country": "Egypt", "marital_status": "married", "education": "higher", "social_class": "lower middle class"}, "question": {"id": "Q239", "variant": 0}, "response": ["Based on the anthropological framework, my perspective as a married male from Kafr el-sheikh, Egypt, who is 35 years old and part of the lower middle class, is heavily influenced by my cultural context, individual values, socioeconomic background, and space and time. In Egypt, religion plays a significant role in society and politics, and as someone who comes from a lower middle-class background, I may have experienced economic hardships and may value stability and security. Additionally, my age and location also play a role in shaping my perspective. Therefore, considering these factors, my opinion on a political system governed by religious law with no political parties or elections is likely to be influenced by a desire for stability and security, as well as a deep-seated respect for religious authority within the political system.\n\n4"]}, {"persona": {"region": "Kafr el-sheikh", "sex": "male", "age": 49, "country": "Egypt", "marital_status": "married", "education": "middle", "social_class": "lower class"}, "question": {"id": "Q239", "variant": 0}, "response": ["Based on my cultural context and lower socioeconomic background in Kafr el-sheikh, Egypt, I have been exposed to a political system that is heavily influenced by religious law. In our community, the religious and cultural values play a significant role in shaping our beliefs and perspectives on governance. Additionally, my personal experience and individual values have led me to view this type of political system as a means of maintaining social order and morality. I believe that a political system governed by religious law, with no political parties or elections, would be very good for promoting stability and upholding traditional values within our society.\n\n1"]}, {"persona": {"region": "Kafr el-sheikh", "sex": "male", "age": 37, "country": "Egypt", "marital_status": "married", "education": "middle", "social_class": "lower class"}, "question": {"id": "Q239", "variant": 0}, "response": ["Based on my emic perspective as a married male from Kafr el-sheikh, Egypt, I have grown up in a cultural context where religious law plays a significant role in shaping our society. My individual values and personal experience have taught me to appreciate the importance of religious beliefs and the role they play in governing our lives. Additionally, my lower class socioeconomic background has made me more reliant on the support and guidance of religious institutions. In this space and time, I believe that a political system governed by religious law with no political parties or elections would be very good for our community as it would ensure the preservation of our cultural and religious values, provide stability, and protect the interests of the lower class. Therefore, I choose option 1: Very good."]}, {"persona": {"region": "Menofia", "sex": "female", "age": 22, "country": "Egypt", "marital_status": "single", "education": "middle", "social_class": "lower class"}, "question": {"id": "Q239", "variant": 0}, "response": ["Based on the anthropological framework, my emic perspective as a single female from Menofia, Egypt, at the age of 22 and part of the lower class, is heavily influenced by my cultural context, individual values, and socioeconomic background. In Egypt, religion and politics are deeply intertwined, and the idea of a political system governed by religious law with no political parties or elections may be viewed positively by some due to the cultural context and religious beliefs. Additionally, as part of the lower class, I may see this system as providing stability and order, which are important in my socioeconomic situation. Therefore, my opinion on this political system would likely be (2) Fairly good, as it aligns with my cultural and socioeconomic context."]}, {"persona": {"region": "Menofia", "sex": "female", "age": 25, "country": "Egypt", "marital_status": "married", "education": "middle", "social_class": "lower class"}, "question": {"id": "Q239", "variant": 0}, "response": ["Based on the anthropological framework, as a married female from Menofia, Egypt, my emic perspective is influenced by my cultural context, individual values, and socioeconomic background. In Menofia, religion plays a significant role in daily life, and many people believe in the importance of religious law in governing society. As a lower-class woman with limited education, my access to formal political processes and information may be restricted, leading to a reliance on community and religious leaders for guidance. Additionally, my personal experiences and values may shape my perception of the political system, with a potential preference for stability and order over the complexities of party politics and elections. Therefore, my opinion on a political system governed by religious law with no political parties or elections would likely align with the perspective of the persona described above.\n\n3"]}, {"persona": {"region": "Menofia", "sex": "male", "age": 28, "country": "Egypt", "marital_status": "single", "education": "higher", "social_class": "working class"}, "question": {"id": "Q239", "variant": 0}, "response": ["Based on the anthropological framework, my emic perspective as a single male from Menofia, Egypt, leads me to consider the cultural context, individual values, and socioeconomic background in forming my opinion on a political system governed by religious law with no political parties or elections. In Menofia, religion plays a significant role in daily life, and the cultural context emphasizes the importance of religious values and traditions. As a working-class individual with a higher education level, I understand the socioeconomic background and the potential impact of a political system without political parties or elections. My individual values and personal experiences also contribute to my perspective. Considering all these factors, I choose option 2: Fairly good."]}, {"persona": {"region": "Menofia", "sex": "male", "age": 35, "country": "Egypt", "marital_status": "married", "education": "middle", "social_class": "lower middle class"}, "question": {"id": "Q239", "variant": 0}, "response": ["Based on my emic perspective as a married male from Menofia, Egypt, I have been raised in a cultural context where religious law plays a significant role in shaping social and political norms. My individual values and personal experiences have also been influenced by this cultural context, and as someone from the lower middle class, my socioeconomic background has further shaped my understanding of governance. Additionally, the concept of cultural relativism has taught me to appreciate the nuances of different political systems. Therefore, I believe that a political system governed by religious law with no political parties or elections could be fairly good for the stability and moral fabric of our society.\n\n2"]}, {"persona": {"region": "Menofia", "sex": "male", "age": 55, "country": "Egypt", "marital_status": "married", "education": "middle", "social_class": "working class"}, "question": {"id": "Q239", "variant": 0}, "response": ["Based on the anthropological framework, my perspective as a married male from Menofia, Egypt, at the age of 55 and part of the working class, is heavily influenced by my cultural context and socioeconomic background. In Egypt, the cultural context is deeply intertwined with Islamic traditions and religious values, which would likely make me favorable towards a political system governed by religious law. Additionally, my middle education level and working-class status may lead me to prioritize stability and order over the potential chaos and corruption associated with political parties and elections. Therefore, I would choose option (1) Very good."]}, {"persona": {"region": "Menofia", "sex": "male", "age": 53, "country": "Egypt", "marital_status": "married", "education": "higher", "social_class": "lower middle class"}, "question": {"id": "Q239", "variant": 0}, "response": ["Based on the anthropological framework, my perspective is heavily influenced by my cultural context as a married male from Menofia, Egypt. The cultural context in Egypt is deeply rooted in Islamic traditions and religious beliefs, and as such, the idea of a political system governed by religious law may be viewed positively. Additionally, my individual values and personal experiences, as well as my lower middle-class socioeconomic background, may lead me to believe that a political system governed by religious law could potentially provide stability and a sense of moral guidance for the society. With my age and educational level, I may also value tradition and may not be as open to Western-style democracy. Therefore, my opinion on a political system governed by religious law with no political parties or elections would likely be option (2) Fairly good."]}, {"persona": {"region": "Menofia", "sex": "male", "age": 59, "country": "Egypt", "marital_status": "married", "education": "middle", "social_class": "working class"}, "question": {"id": "Q239", "variant": 0}, "response": ["Based on the anthropological framework, as a married male from Menofia, Egypt, my emic perspective would likely be in favor of a political system governed by religious law with no political parties or elections. This is because my cultural context and individual values are likely influenced by the strong presence of religious beliefs and practices in my community. Additionally, my 59 years of age and working class background could also contribute to a preference for stability and tradition over the potentially chaotic and divisive nature of political parties and elections. My middle education level may also lead me to prioritize the moral and ethical guidance provided by religious law. Therefore, my nuanced understanding would lead me to choose option 1, \"very good.\" \n\n1"]}, {"persona": {"region": "Menofia", "sex": "female", "age": 42, "country": "Egypt", "marital_status": "married", "education": "middle", "social_class": "lower middle class"}, "question": {"id": "Q239", "variant": 0}, "response": ["Based on my cultural context as a married female from Menofia, Egypt, with middle education level and lower middle class background, I have been surrounded by a society where religious law is highly influential. This has shaped my emic perspective on the issue, as I understand the importance of religious values in governance. Additionally, my individual values and personal experience have led me to see the benefits of a political system governed by religious law, as it provides a sense of stability and moral guidance. My socioeconomic background also plays a role, as I have seen how this type of system can benefit those in lower economic classes. Therefore, I choose option (2) Fairly good."]}, {"persona": {"region": "Menofia", "sex": "male", "age": 39, "country": "Egypt", "marital_status": "married", "education": "higher", "social_class": "working class"}, "question": {"id": "Q239", "variant": 0}, "response": ["Based on the anthropological framework, my perspective as a married male from Menofia, Egypt, who is 39 years old, has completed higher education, and considers himself part of the working class, is influenced by my cultural context, individual values, and socioeconomic background. In Menofia, religion plays a significant role in shaping political views, and the lack of political parties and elections may be seen as a way to uphold religious values and maintain stability. Additionally, my working-class background may lead me to prioritize a system that provides stability and security over one that may be perceived as chaotic or divisive. Furthermore, my higher education may have exposed me to the benefits and drawbacks of different political systems, which could influence my opinion. Taking all of this into account, I would choose option (2) Fairly good. \n\n2"]}, {"persona": {"region": "Menofia", "sex": "male", "age": 34, "country": "Egypt", "marital_status": "married", "education": "middle", "social_class": "lower middle class"}, "question": {"id": "Q239", "variant": 0}, "response": ["From the perspective of a married male from Menofia, Egypt, with a middle education level and lower middle class background, my answer to the question on a political system governed by religious law without political parties or elections would be influenced by several factors. Firstly, the cultural context of living in a predominantly Muslim country with a strong religious influence would shape my perspective on this issue. Additionally, my socioeconomic background as part of the lower middle class would influence my opinion on how this type of political system might impact my own life and the lives of those around me. Furthermore, my personal experience and individual values would play a significant role in shaping my opinion on this matter. Lastly, my understanding of cultural relativism and the nuanced phrasing of the question would also impact my response. \n\n3"]}, {"persona": {"region": "Menofia", "sex": "male", "age": 22, "country": "Egypt", "marital_status": "single", "education": "higher", "social_class": "working class"}, "question": {"id": "Q239", "variant": 0}, "response": ["Based on the anthropological framework, my perspective on a political system governed by religious law with no political parties or elections is heavily influenced by my cultural context, individual values, and socioeconomic background. As someone from Menofia, Egypt, where religion plays a significant role in society and politics, and as a member of the working class, I have seen firsthand the impact of religious law on our daily lives. Additionally, my personal experience and values shape my understanding and perception of this political system. Therefore, my opinion is that a political system governed by religious law with no political parties or elections is fairly good.\n\n2"]}, {"persona": {"region": "Menofia", "sex": "male", "age": 21, "country": "Egypt", "marital_status": "single", "education": "middle", "social_class": "working class"}, "question": {"id": "Q239", "variant": 0}, "response": ["Based on the anthropological framework, as a single male from Menofia, Egypt, who has completed middle education and considers myself part of the working class, my opinion on a political system governed by religious law with no political parties or elections would be influenced by my cultural context, individual values, and socioeconomic background. In Egypt, religion plays a significant role in society and governance, and many people believe that religious law should be the foundation of the political system. As someone from the working class, I may value stability and security, which I believe could be provided by a system based on religious law. Additionally, my personal experience and the cultural context of Menofia may shape my perspective on this issue. Therefore, my opinion on this political system would be influenced by these factors, leading me to choose option (2) Fairly good as my answer. \n\n2"]}, {"persona": {"region": "Menofia", "sex": "male", "age": 36, "country": "Egypt", "marital_status": "married", "education": "higher", "social_class": "working class"}, "question": {"id": "Q239", "variant": 0}, "response": ["Based on the anthropological framework, my emic perspective as a married male from Menofia, Egypt, who is 36 years old and part of the working class, is heavily influenced by my cultural context, individual values, and socioeconomic background. In Egypt, religion plays a significant role in daily life, and many people, including myself, hold strong religious beliefs. Additionally, as a member of the working class, I may feel that a political system governed by religious law could potentially provide a sense of stability and moral guidance. However, my higher education level may also lead me to value democratic principles and the importance of political participation. Therefore, I may have reservations about a system with no political parties or elections, as it may limit the representation and voices of the people. Ultimately, my perspective is shaped by a nuanced understanding of the question, considering both the potential benefits and drawbacks of such a political system.\n\n3"]}, {"persona": {"region": "Menofia", "sex": "female", "age": 52, "country": "Egypt", "marital_status": "married", "education": "higher", "social_class": "lower middle class"}, "question": {"id": "Q239", "variant": 0}, "response": ["Based on the anthropological framework, my opinion on a political system governed by religious law with no political parties or elections is heavily influenced by my cultural context, individual values, and socioeconomic background. As a married female from Menofia, Egypt, I have been raised in a society where religious law plays a significant role in governing daily life and societal norms. Additionally, my higher education level has provided me with a nuanced understanding of the complexities of political systems. As a member of the lower middle class, I am acutely aware of the impact of political decisions on individuals from similar socioeconomic backgrounds. Taking into consideration all these factors, I choose option (3) Fairly bad."]}, {"persona": {"region": "Menofia", "sex": "male", "age": 52, "country": "Egypt", "marital_status": "married", "education": "higher", "social_class": "lower middle class"}, "question": {"id": "Q239", "variant": 0}, "response": ["Based on the anthropological framework, my perspective as a married male from Menofia, Egypt, who is 52 years old, has completed higher education, and considers myself part of the lower middle class, is shaped by my cultural context, individual values, and personal experience. In Egypt, religion plays a significant role in everyday life, and many individuals view religious law as a fundamental aspect of governance. Additionally, my socioeconomic background and age may influence my perspective on political systems. Considering these factors, I would choose option (2) Fairly good."]}, {"persona": {"region": "Menofia", "sex": "male", "age": 39, "country": "Egypt", "marital_status": "married", "education": "middle", "social_class": "lower class"}, "question": {"id": "Q239", "variant": 0}, "response": ["Based on my emic perspective as a married male from Menofia, Egypt, my cultural context and individual values heavily influence my opinion on a political system governed by religious law with no political parties or elections. In my community, religion plays a significant role in our daily lives and is deeply intertwined with our cultural traditions. As someone from the lower class, I have experienced firsthand the socioeconomic challenges that come with political instability and corruption. Therefore, I believe that a political system governed by religious law could potentially provide stability and moral guidance, which is very important in our society. Additionally, my limited education level and lack of exposure to alternative political systems may shape my view on the matter. Taking all these factors into consideration, I select:\n4"]}, {"persona": {"region": "Menofia", "sex": "male", "age": 23, "country": "Egypt", "marital_status": "single", "education": "middle", "social_class": "lower middle class"}, "question": {"id": "Q239", "variant": 0}, "response": ["Based on the anthropological framework, my perspective as a single male from Menofia, Egypt, who is 23 years old and part of the lower middle class is shaped by my cultural context, individual values, and socioeconomic background. In Menofia, religious law plays a significant role in society and is deeply ingrained in our cultural context. My personal experience and values also influence my perspective, as I have grown up in an environment where religious principles are highly valued. Additionally, my socioeconomic background as part of the lower middle class may lead me to view a political system governed by religious law as a means of stability and order. Considering these factors, I choose option 2: Fairly good."]}, {"persona": {"region": "Dakahlia", "sex": "female", "age": 24, "country": "Egypt", "marital_status": "single", "education": "higher", "social_class": "lower middle class"}, "question": {"id": "Q239", "variant": 0}, "response": ["Based on my cultural context growing up in Dakahlia, Egypt, I have been exposed to a society heavily influenced by religious and traditional values. My individual values and personal experiences have shaped my perception of the role of religion in governance. Additionally, my lower middle-class socioeconomic background has influenced my understanding of the importance of stability and order in the political system. Considering these factors, I believe that a political system governed by religious law with no political parties or elections could provide a sense of security and moral guidance for the community, thus I choose option (2) Fairly good."]}, {"persona": {"region": "Dakahlia", "sex": "male", "age": 36, "country": "Egypt", "marital_status": "married", "education": "higher", "social_class": "upper middle class"}, "question": {"id": "Q239", "variant": 0}, "response": ["Based on my cultural context as a married male from Dakahlia, Egypt, and my higher education level, I understand the importance of religious law in shaping the political system. In my community, religious values play a significant role in governing our daily lives and moral standards. Additionally, my upper middle class background has provided me with the opportunity to understand the complexities of socioeconomic factors in governance. Furthermore, as a member of this society, I value the nuanced approach to political and religious matters. Therefore, I believe that a political system governed by religious law, without political parties or elections, could be fairly good for our community as it aligns with our cultural values and traditions.\n\n2"]}, {"persona": {"region": "Dakahlia", "sex": "female", "age": 71, "country": "Egypt", "marital_status": "married", "education": "higher", "social_class": "upper middle class"}, "question": {"id": "Q239", "variant": 0}, "response": ["Based on the emic and etic perspectives, as a married female from Dakahlia, Egypt, I have been socialized to understand and support the role of religious law in governance. The cultural context of Egypt, with its predominantly Muslim population, is crucial in shaping my views on this matter. Additionally, my higher education level has equipped me with a deeper understanding of the historical and cultural significance of religious law in Egyptian society. As a member of the upper middle class, I have also benefited from the stability and security that comes with a political system governed by religious law. Therefore, considering my age, education, and socioeconomic background, I believe that a political system governed by religious law with no political parties or elections is (1) Very good."]}, {"persona": {"region": "Dakahlia", "sex": "male", "age": 55, "country": "Egypt", "marital_status": "married", "education": "higher", "social_class": "upper middle class"}, "question": {"id": "Q239", "variant": 0}, "response": ["Based on the anthropological framework, my response to the question is influenced by my emic perspective as a married male from Dakahlia, Egypt. The cultural context of my upbringing and education level has shaped my understanding and opinions on political systems. My individual values and personal experiences have also influenced my perspective, as I consider myself part of the upper middle class. Additionally, my socioeconomic background plays a role in shaping my opinions. Furthermore, the cultural relativism aspect of the framework reminds me that there is no hierarchy of culture, and I must consider the nuances of the question. \n\n3"]}, {"persona": {"region": "Dakahlia", "sex": "male", "age": 64, "country": "Egypt", "marital_status": "married", "education": "higher", "social_class": "lower middle class"}, "question": {"id": "Q239", "variant": 0}, "response": ["Based on the anthropological framework, my opinion on a political system governed by religious law with no political parties or elections would be influenced by my emic perspective as a married male from Dakahlia, Egypt. The cultural context of living in a predominantly Muslim country where religious law plays a significant role in society would shape my understanding and answer to this question. Additionally, my individual values and personal experience, as well as my lower middle class socioeconomic background, would also influence my opinion. Considering these factors, I would choose the option:\n\n2"]}, {"persona": {"region": "Dakahlia", "sex": "female", "age": 29, "country": "Egypt", "marital_status": "married", "education": "middle", "social_class": "lower class"}, "question": {"id": "Q239", "variant": 0}, "response": ["Based on the anthropological framework, my perspective is heavily influenced by my cultural context, individual values, and socioeconomic background. As a married female from Dakahlia, Egypt, I am part of the lower class and have completed only middle education level. In my cultural context, religion plays a significant role and my personal values are shaped by the teachings and beliefs of my community. Additionally, my socioeconomic background has limited my access to resources and opportunities. Considering these factors, I believe that a political system governed by religious law with no political parties or elections would be very good for the stability and moral direction of the country.\n\n1"]}, {"persona": {"region": "Dakahlia", "sex": "female", "age": 40, "country": "Egypt", "marital_status": "married", "education": "middle", "social_class": "upper middle class"}, "question": {"id": "Q239", "variant": 0}, "response": ["From the perspective of a married female from Dakahlia, Egypt, at 40 years old and part of the upper middle class, my opinion on a political system governed by religious law with no political parties or elections is influenced by my cultural context and individual values. In Egypt, religion plays a significant role in society, and many people believe that religious law should govern the political system. Additionally, as a member of the upper middle class, I may have more conservative views and appreciate the stability that a religiously governed political system may bring. Furthermore, my educational level may have exposed me to the teachings and interpretations of religious law, further shaping my opinion. Considering the cultural relativism and the nuanced phrasing of the question, I believe that a political system governed by religious law could be fairly good for the stability and moral values of society.\n\n2"]}, {"persona": {"region": "Dakahlia", "sex": "male", "age": 37, "country": "Egypt", "marital_status": "married", "education": "higher", "social_class": "lower middle class"}, "question": {"id": "Q239", "variant": 0}, "response": ["Based on my cultural context as a married male from Dakahlia, Egypt, I have grown up in a society where religious beliefs and traditions heavily influence the political landscape. My personal values and experiences have also shaped my understanding of the importance of religion in governance. Additionally, my socioeconomic background as part of the lower middle class has influenced my perception of political systems and their impact on my daily life. Considering the nuanced phrasing of the question, I believe that a political system governed by religious law with no political parties or elections could be fairly good in providing stability and moral guidance for the country.\n\n2"]}, {"persona": {"region": "Dakahlia", "sex": "female", "age": 45, "country": "Egypt", "marital_status": "married", "education": "middle", "social_class": "working class"}, "question": {"id": "Q239", "variant": 0}, "response": ["From the emic perspective, as a married female from Dakahlia, Egypt, my opinion on a political system governed by religious law with no political parties or elections is heavily influenced by the cultural context in which I live. The cultural norms and values in my community place a strong emphasis on religious principles and traditions, and many people here view religious law as a guide for moral and ethical conduct. Additionally, my individual values and personal experiences have shaped my perception of this political system, as I have seen the impact of religious teachings on shaping the social and moral fabric of our society. Furthermore, my working-class socioeconomic background has also influenced my perspective, as I have witnessed the struggles and challenges faced by my community, and I believe that a political system based on religious law could potentially provide a sense of stability and moral guidance. Ultimately, my nuanced understanding of the question leads me to believe that a political system governed by religious law with no political parties or elections could be fairly good for our community.\n\n2"]}, {"persona": {"region": "Dakahlia", "sex": "male", "age": 34, "country": "Egypt", "marital_status": "single", "education": "middle", "social_class": "lower middle class"}, "question": {"id": "Q239", "variant": 0}, "response": ["Based on my cultural context and socioeconomic background, as a single male from Dakahlia, Egypt, I am influenced by the Islamic cultural and religious values that are prevalent in my community. My personal experience and individual values are shaped by these cultural and religious influences, and I am inclined to support a political system governed by religious law. Additionally, my lower middle class status may lead me to see this type of system as providing stability and guidance in a society where socioeconomic challenges are prevalent. Furthermore, considering the nuances of the question, I believe that a political system governed by religious law aligns with the emic perspective of my community and my personal beliefs.\n\n2"]}, {"persona": {"region": "Dakahlia", "sex": "female", "age": 26, "country": "Egypt", "marital_status": "married", "education": "higher", "social_class": "upper middle class"}, "question": {"id": "Q239", "variant": 0}, "response": ["Based on my emic perspective as a married female from Dakahlia, Egypt, I have been raised in a cultural context where religion plays a significant role in politics and governance. My personal experience and individual values lead me to see the benefits of a political system governed by religious law, as it aligns with my beliefs and values. Additionally, coming from the upper middle class, I have seen the stability and order that can come from such a system. However, I also understand the importance of cultural relativism and recognize that not everyone may share my perspective. Therefore, I believe that a political system governed by religious law with no political parties or elections can be fairly good as it can provide a sense of moral grounding and stability for the society. \n\n2"]}, {"persona": {"region": "Dakahlia", "sex": "male", "age": 21, "country": "Egypt", "marital_status": "single", "education": "middle", "social_class": "upper middle class"}, "question": {"id": "Q239", "variant": 0}, "response": ["Based on the emic and etic perspectives, as a single male from Dakahlia, Egypt, I have been raised in a cultural context where religion plays a significant role in daily life. My individual values and personal experience have also shaped my perception, and as someone from the upper middle class, my socioeconomic background has influenced my views. Additionally, cultural relativism is important to consider, as well as the impact of space and time on my opinion. Taking into account the nuanced phrasing of the question, it is important to consider that my perspective may differ from others due to these factors.\n\n3"]}, {"persona": {"region": "Dakahlia", "sex": "female", "age": 32, "country": "Egypt", "marital_status": "married", "education": "middle", "social_class": "working class"}, "question": {"id": "Q239", "variant": 0}, "response": ["Based on the anthropological framework, as a married female from Dakahlia, Egypt, my opinion would be heavily influenced by my cultural context, individual values, and socioeconomic background. In Dakahlia, religious laws and traditions hold significant influence, and as a member of the working class with a middle education level, I may have limited exposure to political ideologies and systems outside of religious governance. Additionally, my personal experiences and values may lead me to view a political system governed by religious law as a source of stability and moral guidance. However, my understanding of cultural relativism and nuance also suggests that my perspective may not be representative of all individuals within my community. Therefore, my opinion on a political system governed by religious law with no political parties or elections may be influenced by a combination of factors, including my cultural context and personal experiences.\n\n2"]}, {"persona": {"region": "Dakahlia", "sex": "female", "age": 35, "country": "Egypt", "marital_status": "married", "education": "middle", "social_class": "upper middle class"}, "question": {"id": "Q239", "variant": 0}, "response": ["Based on the anthropological framework, my opinion on a political system governed by religious law with no political parties or elections would be influenced by my cultural context, individual values, and socioeconomic background. As a married female from Dakahlia, Egypt, where religious and cultural traditions play a significant role in shaping societal norms, I may view a political system governed by religious law as very good. This perspective is influenced by my cultural context, where religious values and beliefs hold great importance, as well as my upper middle class socioeconomic background, which may lead me to see stability and order provided by religious governance as favorable. Additionally, my personal experience and middle education level may lead me to prioritize the preservation of traditional values and stability over the complexities of a multi-party electoral system. \n\n1"]}, {"persona": {"region": "Dakahlia", "sex": "male", "age": 33, "country": "Egypt", "marital_status": "married", "education": "middle", "social_class": "upper middle class"}, "question": {"id": "Q239", "variant": 0}, "response": ["Based on my emic perspective as a married male from Dakahlia, Egypt, I have been brought up in a society where religion plays a major role in shaping our cultural and societal norms. The cultural context of where I come from values the influence of religious law in governing our political system. Additionally, my personal experience and individual values align with the idea of a political system governed by religious law, as it is seen as a way to maintain stability and moral values within our society. Considering my socioeconomic background as part of the upper middle class, I have seen the benefits of a stable and orderly political system, which aligns with the concept of a religious law governing system. Furthermore, cultural relativism teaches me to respect and value diverse perspectives, and in my space and time, the idea of a political system governed by religious law without political parties or elections is viewed positively. Therefore, I choose option 1. \n\n1"]}, {"persona": {"region": "Dakahlia", "sex": "female", "age": 45, "country": "Egypt", "marital_status": "married", "education": "middle", "social_class": "upper middle class"}, "question": {"id": "Q239", "variant": 0}, "response": ["Based on the anthropological framework, as a married female from Dakahlia, Egypt, my emic perspective is influenced by my cultural context, individual values, and socioeconomic background. In Egypt, religion plays a significant role in people's lives, and many individuals, including myself, may view a political system governed by religious law as an important way to uphold moral and ethical values. Additionally, as part of the upper middle class, stability and order provided by such a system may be appealing. However, considering cultural relativism, I also recognize that this perspective may not be shared universally. Therefore, I choose option (2) Fairly good."]}, {"persona": {"region": "Dakahlia", "sex": "male", "age": 30, "country": "Egypt", "marital_status": "married", "education": "middle", "social_class": "upper middle class"}, "question": {"id": "Q239", "variant": 0}, "response": ["Based on my personal experience and cultural background as a married male from Dakahlia, Egypt, I have been raised in a society where religion plays a significant role in governance and everyday life. The cultural context of my upbringing has instilled in me the belief that a political system governed by religious law is beneficial for maintaining social order and moral values. Additionally, my upper middle class socioeconomic background has provided me with a sense of stability and security, leading me to view such a system as favorable for upholding the status quo. Furthermore, the nuanced phrasing of the question allows me to consider the potential benefits of a system without political parties or elections, as I believe that a strong moral framework provided by religious law can lead to a more cohesive and harmonious society.\n\n2"]}, {"persona": {"region": "Dakahlia", "sex": "female", "age": 63, "country": "Egypt", "marital_status": "married", "education": "higher", "social_class": "lower middle class"}, "question": {"id": "Q239", "variant": 0}, "response": ["From the perspective of a married female from Dakahlia, Egypt, who is 63 years old, has completed higher education, and considers herself part of the lower middle class, the reasoning behind my answer is based on a combination of emic and etic perspectives, cultural context, individual values and personal experience, socioeconomic background, cultural relativism, space and time, and nuance. In my cultural context, religion plays a significant role in shaping political views and decisions. As someone from a lower middle class background, I may have experienced the impact of socioeconomic disparities and may have a nuanced understanding of the potential implications of a political system governed by religious law with no political parties or elections. Additionally, my age and educational background may have influenced my understanding of political systems and their potential impact on society. Therefore, my opinion on this matter is based on a complex interplay of these factors.\n\n3"]}, {"persona": {"region": "Dakahlia", "sex": "male", "age": 28, "country": "Egypt", "marital_status": "single", "education": "higher", "social_class": "upper middle class"}, "question": {"id": "Q239", "variant": 0}, "response": ["Based on the anthropological framework, my emic perspective as a single male from Dakahlia, Egypt, who completed higher education and considers myself part of the upper middle class, is influenced by the cultural context of my upbringing and the socioeconomic background that I am a part of. My individual values and personal experience have shaped my understanding and perception of the political system governed by religious law with no political parties or elections. Additionally, cultural relativism is important to consider, as well as the nuance in the phrasing of the question. Taking all of this into account, I believe that my opinion on this political system would be fairly good.\n\n2"]}, {"persona": {"region": "Dakahlia", "sex": "female", "age": 24, "country": "Egypt", "marital_status": "married", "education": "higher", "social_class": "upper middle class"}, "question": {"id": "Q239", "variant": 0}, "response": ["Based on my emic perspective as a married female from Dakahlia, Egypt, I have been brought up in a cultural context where religion plays a significant role in shaping the norms and values of society. Additionally, my individual values and personal experience have led me to prioritize stability and order in the political system. Considering my socioeconomic background as part of the upper middle class, I have a stake in maintaining the status quo. Furthermore, cultural relativism teaches me to respect different cultural practices, including those that prioritize religious law. Lastly, as a 24-year-old educated woman, I understand the nuances of political systems and believe that a political system governed by religious law, without political parties or elections, could potentially provide the stability and moral guidance that my community values. \n\n2"]}, {"persona": {"region": "Dakahlia", "sex": "male", "age": 20, "country": "Egypt", "marital_status": "single", "education": "middle", "social_class": "upper middle class"}, "question": {"id": "Q239", "variant": 0}, "response": ["Based on my cultural context as a single male from Dakahlia, Egypt, where religious law and traditional values play a significant role in shaping societal norms, I would view a political system governed by religious law with no political parties or elections as very good. My personal experience and values, along with my socioeconomic background as part of the upper middle class, lead me to believe that such a system would provide stability and direction for the country, aligning with the cultural relativism of my community. Additionally, my age and place also influence my perspective, as I have grown up in a society where religious values are highly respected and followed. Therefore, a political system based on religious law would be seen as the most suitable and beneficial option for the country's governance.\n\n1"]}, {"persona": {"region": "Dakahlia", "sex": "male", "age": 45, "country": "Egypt", "marital_status": "married", "education": "middle", "social_class": "upper middle class"}, "question": {"id": "Q239", "variant": 0}, "response": ["Based on my emic perspective as a married male from Dakahlia, Egypt, I have been raised in a cultural context where religion plays a significant role in shaping our societal norms and values. My individual values and personal experiences have led me to see the benefits of a political system governed by religious law, as it aligns with my beliefs and provides a sense of moral guidance. Additionally, considering my socioeconomic background as part of the upper middle class, I have seen the positive impact of such a system on stability and social order. Furthermore, cultural relativism teaches me to appreciate the nuances of different political systems, and from my perspective, a system without political parties or elections could be beneficial in maintaining traditional values and preventing corruption. Therefore, I believe that a political system governed by religious law with no political parties or elections is very good for our society.\n\n4"]}, {"persona": {"region": "Dakahlia", "sex": "female", "age": 43, "country": "Egypt", "marital_status": "married", "education": "higher", "social_class": "upper middle class"}, "question": {"id": "Q239", "variant": 0}, "response": ["Based on my emic perspective as a married female from Dakahlia, Egypt, I have been raised and socialized within a cultural context where religion plays a significant role in shaping societal values and norms. As someone who has completed higher education and considers myself part of the upper middle class, I am also aware of the importance of individual values and personal experiences in shaping one's perceptions. Additionally, considering my socioeconomic background, I understand the impact of income, family wealth, and social class on influencing perspectives. In this context, I would view a political system governed by religious law with no political parties or elections as fairly good, as it aligns with the cultural context and values that I have been brought up with.\n\n2"]}, {"persona": {"region": "Dakahlia", "sex": "female", "age": 20, "country": "Egypt", "marital_status": "single", "education": "middle", "social_class": "upper middle class"}, "question": {"id": "Q239", "variant": 0}, "response": ["Based on the anthropological perspective, my answer to the question about a political system governed by religious law with no political parties or elections is influenced by my cultural context, individual values, and socioeconomic background. Coming from Dakahlia, Egypt, and being a part of the upper middle class, I have been raised in a society where religious law plays a significant role in governance. Additionally, my personal values and experiences have shaped my understanding of the importance of stability and order in society. Therefore, I believe that a political system governed by religious law with no political parties or elections would be very good for ensuring moral and ethical governance, maintaining traditional values, and preserving social cohesion within the community.\n\n1"]}, {"persona": {"region": "Dakahlia", "sex": "female", "age": 40, "country": "Egypt", "marital_status": "single", "education": "middle", "social_class": "lower middle class"}, "question": {"id": "Q239", "variant": 0}, "response": ["Based on my personal experience and socioeconomic background as a single woman from Dakahlia, Egypt, I have grown up in a society where religious law plays a significant role in governing social and political life. The cultural context and values of my community have shaped my understanding of the role of religion in politics. Additionally, my lower middle class status and middle education level have influenced my perspective on political systems. Considering these factors, I believe that a political system governed by religious law with no political parties or elections can provide stability and moral guidance for the society. Therefore, I choose option (2) Fairly good."]}, {"persona": {"region": "Dakahlia", "sex": "female", "age": 33, "country": "Egypt", "marital_status": "married", "education": "higher", "social_class": "upper middle class"}, "question": {"id": "Q239", "variant": 0}, "response": ["Based on the anthropological framework, my response to the question is influenced by my emic perspective as a married female from Dakahlia, Egypt, as well as my cultural context, individual values, and socioeconomic background. As a member of the upper middle class in Egypt, I have been brought up in a society where religion plays a significant role in everyday life. My higher education has also exposed me to various political systems and their effects on society. Considering these factors, I believe that a political system governed by religious law with no political parties or elections could be fairly good for promoting social cohesion, moral values, and stability in the country. It aligns with my personal values and experiences, as well as the cultural context in which I have been raised.\n\n2"]}, {"persona": {"region": "Dakahlia", "sex": "female", "age": 24, "country": "Egypt", "marital_status": "married", "education": "middle", "social_class": "working class"}, "question": {"id": "Q239", "variant": 0}, "response": ["Based on the anthropological framework, my perspective as a married female from Dakahlia, Egypt, who is 24 years old and part of the working class, is deeply influenced by my cultural context and individual values. In Egypt, religion plays a significant role in people's lives, and the idea of a political system governed by religious law may be viewed positively by some, especially considering the stability it could potentially bring. Additionally, my socioeconomic background as a working-class individual may lead me to prioritize stability and security over other political considerations. Therefore, my opinion on a political system governed by religious law with no political parties or elections is likely to be influenced by these factors.\n\n3"]}, {"persona": {"region": "Dakahlia", "sex": "female", "age": 53, "country": "Egypt", "marital_status": "widowed", "education": "middle", "social_class": "working class"}, "question": {"id": "Q239", "variant": 0}, "response": ["Based on the anthropological framework, as a widowed female from Dakahlia, Egypt, my emic perspective and cultural context lead me to value religious traditions and cultural practices. My personal experience and individual values also play a significant role in my understanding and perception of the political system. As a member of the working class with a middle education level, my socioeconomic background influences my perspective, as does my age and place of residence. Additionally, the nuanced phrasing of the question is crucial in my response. Therefore, my answer is:\n3"]}, {"persona": {"region": "Dakahlia", "sex": "female", "age": 30, "country": "Egypt", "marital_status": "single", "education": "middle", "social_class": "lower middle class"}, "question": {"id": "Q239", "variant": 0}, "response": ["Based on the anthropological framework, as a single female from Dakahlia, Egypt, my emic perspective would be influenced by my cultural context, individual values, and socioeconomic background. In my cultural context, religious law plays a significant role, and as a lower middle class woman, I may have limited access to education and economic opportunities. This may lead me to believe that a political system governed by religious law with no political parties or elections could be fairly good as it may provide stability and a sense of security. Additionally, my personal experience and values may also shape my opinion, leading me to believe that such a system could be beneficial for the community's social and moral fabric. \n\n2"]}, {"persona": {"region": "Dakahlia", "sex": "male", "age": 53, "country": "Egypt", "marital_status": "married", "education": "higher", "social_class": "upper middle class"}, "question": {"id": "Q239", "variant": 0}, "response": ["Based on the anthropological framework, as a married male from Dakahlia, Egypt, who is 53 years old, has completed higher education, and considers himself part of the upper middle class, my perspective on a political system governed by religious law with no political parties or elections would be influenced by a combination of factors. The cultural context in Egypt is heavily influenced by Islamic traditions and values, so a system governed by religious law would likely be regarded favorably. Additionally, my individual values and personal experience may lead me to believe that such a system would provide stability and moral guidance. Furthermore, my socioeconomic background as part of the upper middle class may lead me to view a system without political parties or elections as more efficient and less prone to corruption. Therefore, my opinion on this political system would be (1) Very good."]}, {"persona": {"region": "Dakahlia", "sex": "male", "age": 28, "country": "Egypt", "marital_status": "married", "education": "middle", "social_class": "working class"}, "question": {"id": "Q239", "variant": 0}, "response": ["Based on the anthropological framework, my opinion on a political system governed by religious law with no political parties or elections is heavily influenced by my cultural context, individual values, and socioeconomic background. In Dakahlia, Egypt, religion plays a significant role in everyday life and is deeply ingrained in our cultural context. As a member of the working class with a middle education level, my personal experience and values lead me to believe that a political system governed by religious law may be viewed favorably as it aligns with my cultural and religious beliefs. Additionally, the lack of political parties and elections may be perceived as a form of stability and security in a society that has experienced political upheaval. Therefore, I would choose the following option:\n4"]}, {"persona": {"region": "Dakahlia", "sex": "female", "age": 38, "country": "Egypt", "marital_status": "married", "education": "middle", "social_class": "upper middle class"}, "question": {"id": "Q239", "variant": 0}, "response": ["Based on the anthropological framework, as a married female from Dakahlia, Egypt, my emic perspective would be influenced by the cultural context of living in a predominantly Muslim society with strong religious beliefs. My personal experience and individual values would also shape my opinion, as well as my socioeconomic background as part of the upper middle class. Additionally, the cultural relativism in Egypt would influence my understanding of a political system governed by religious law with no political parties or elections. Therefore, my opinion on this political system would be influenced by these factors and I would choose option (1) Very good."]}, {"persona": {"region": "Gharbia", "sex": "male", "age": 27, "country": "Egypt", "marital_status": "single", "education": "higher", "social_class": "upper middle class"}, "question": {"id": "Q239", "variant": 0}, "response": ["From the emic and etic perspectives, as a single male from Gharbia, Egypt, I am influenced by the cultural context of my region, where religious law holds significant importance. My individual values and personal experience, shaped by my higher education and upper middle class background, lead me to believe that a political system governed by religious law with no political parties or elections could be very beneficial for the stability and moral fabric of society. Additionally, the socioeconomic background of being part of the upper middle class might lead me to favor a system that upholds traditional values and stability. Considering the nuanced phrasing of the question and my cultural relativism, I believe that a political system governed by religious law with no political parties or elections could be very beneficial for our society.\n\n1"]}, {"persona": {"region": "Gharbia", "sex": "female", "age": 35, "country": "Egypt", "marital_status": "married", "education": "higher", "social_class": "upper middle class"}, "question": {"id": "Q239", "variant": 0}, "response": ["Based on the anthropological framework, as a married female from Gharbia, Egypt, I would approach the question of a political system governed by religious law with no political parties or elections by considering the emic and etic perspectives of my community. In this cultural context, religion plays a significant role in daily life and is deeply intertwined with political and social structures. My individual values and personal experiences, along with my socioeconomic background as part of the upper middle class, would also influence my opinion. Additionally, the nuanced phrasing of the question and my age and place in society would further shape my perspective. Considering all these factors, my opinion on a political system governed by religious law with no political parties or elections would be:\n\n2"]}, {"persona": {"region": "Gharbia", "sex": "female", "age": 37, "country": "Egypt", "marital_status": "married", "education": "higher", "social_class": "upper middle class"}, "question": {"id": "Q239", "variant": 0}, "response": ["Based on my emic perspective as a married female from Gharbia, Egypt, with a higher education level and part of the upper middle class, I understand the cultural context of my society and the importance of religious law in governance. My personal experience and individual values also play a role in shaping my opinion. Considering the socioeconomic background and cultural relativism, I believe that a political system governed by religious law with no political parties or elections can be fairly good for the stability and preservation of our cultural and religious values. Additionally, space and time also play a role in my opinion, as Egypt has a long history of religious influence in governance. However, I also recognize the importance of nuance in this complex issue and the potential for abuses of power in such a system.\n\n2"]}, {"persona": {"region": "Gharbia", "sex": "male", "age": 43, "country": "Egypt", "marital_status": "married", "education": "middle", "social_class": "lower middle class"}, "question": {"id": "Q239", "variant": 0}, "response": ["From my perspective as a married male from Gharbia, Egypt, with a middle education level and a lower middle class socioeconomic background, I understand the importance of cultural context in shaping my opinion on a political system governed by religious law with no political parties or elections. My personal experience and individual values also play a significant role in influencing my viewpoint. Additionally, the etic perspective of this question, considering the cultural norms and values of my community, is crucial in understanding my response. Given these factors, I believe that a political system governed by religious law, without political parties or elections, could be fairly good for stability and moral governance within our society. \n\n2"]}, {"persona": {"region": "Gharbia", "sex": "male", "age": 28, "country": "Egypt", "marital_status": "single", "education": "higher", "social_class": "lower middle class"}, "question": {"id": "Q239", "variant": 0}, "response": ["From the perspective of a single male from Gharbia, Egypt, who is 28 years old, has completed higher education, and considers himself part of the lower middle class, my opinion on a political system governed by religious law with no political parties or elections would be influenced by several factors. First, the cultural context in Egypt places a significant emphasis on religion, and many individuals in my community may view a system governed by religious law as more legitimate and in line with our cultural values. Additionally, my socioeconomic background as part of the lower middle class may lead me to perceive such a system as providing stability and order, which is important for my economic security. However, as someone with higher education, I also recognize the importance of having a diverse range of voices and perspectives in governance, which may lead me to have some reservations about the lack of political parties and elections. Overall, my opinion would likely be fairly positive, leaning towards option (2) Fairly good."]}, {"persona": {"region": "Gharbia", "sex": "male", "age": 39, "country": "Egypt", "marital_status": "married", "education": "middle", "social_class": "lower middle class"}, "question": {"id": "Q239", "variant": 0}, "response": ["From the perspective of a married male from Gharbia, Egypt, who is 39 years old and part of the lower middle class, my answer to the question regarding a political system governed by religious law with no political parties or elections would be influenced by a combination of factors. Firstly, the cultural context in Egypt, particularly in more conservative regions like Gharbia, places a high value on religious authority and tradition. Additionally, my personal experience and values as a member of the lower middle class may lead me to prioritize stability and security, which could be perceived as being provided by a strong religiously governed system. However, the lack of political representation and potential for abuse of power in such a system would be a concern, especially considering the socioeconomic background of my community and the potential impact on individual freedoms. Therefore, my opinion would lean towards option (2) Fairly good, as I would see potential benefits in stability and religious guidance but also recognize the drawbacks of limited political representation. \n\n2"]}, {"persona": {"region": "Gharbia", "sex": "male", "age": 30, "country": "Egypt", "marital_status": "married", "education": "middle", "social_class": "lower middle class"}, "question": {"id": "Q239", "variant": 0}, "response": ["Based on my emic perspective as a married male from Gharbia, Egypt, I have grown up in a cultural context where religion plays a significant role in shaping the societal norms and values. Additionally, my lower middle class socioeconomic background and middle education level have influenced my individual values and personal experiences, leading me to view the political system governed by religious law as a means of upholding moral values and social cohesion. Furthermore, cultural relativism reminds me that there is no hierarchy of culture, and the space and time in which I have grown up has shaped my nuanced understanding of this political system. Therefore, I believe that a political system governed by religious law, with no political parties or elections, would be (1) Very good."]}, {"persona": {"region": "Gharbia", "sex": "male", "age": 43, "country": "Egypt", "marital_status": "married", "education": "lower", "social_class": "lower middle class"}, "question": {"id": "Q239", "variant": 0}, "response": ["Based on the anthropological framework outlined above, my opinion on a political system governed by religious law with no political parties or elections is heavily influenced by my cultural context, individual values, and socioeconomic background. As a married male from Gharbia, Egypt, I am likely to have been raised in a society where religious and cultural traditions play a significant role in shaping political views. Additionally, my lower middle-class socioeconomic background may impact my perception of the effectiveness and fairness of such a political system. I may also consider the impact of such a system on my personal experiences and my role within the community. Given these factors, I would choose the following option:\n\n3"]}, {"persona": {"region": "Gharbia", "sex": "male", "age": 36, "country": "Egypt", "marital_status": "married", "education": "higher", "social_class": "lower middle class"}, "question": {"id": "Q239", "variant": 0}, "response": ["Based on the anthropological framework, my response to the question is influenced by my emic perspective as a married male from Gharbia, Egypt, where the cultural context is deeply rooted in religious beliefs and traditions. My individual values and personal experience also play a significant role, as I have been raised in a society where religious law holds great importance. Additionally, coming from the lower middle class, my socioeconomic background may influence my perception of a political system governed by religious law. Moreover, the concept of cultural relativism reminds me that my understanding of political systems may differ from those in other cultures. Considering all these factors, my opinion is that a political system governed by religious law with no political parties or elections is fairly good because it aligns with the cultural and religious values of my community.\n\n2"]}, {"persona": {"region": "Gharbia", "sex": "male", "age": 25, "country": "Egypt", "marital_status": "married", "education": "middle", "social_class": "upper middle class"}, "question": {"id": "Q239", "variant": 0}, "response": ["Based on my emic perspective as a married male from Gharbia, Egypt, I have been raised and socialized within a cultural context that values religious law and traditional values. My individual values and personal experience have shaped my understanding of the importance of religious principles in governance. Additionally, my upper middle class socioeconomic background has influenced my perception of stability and order within a political system. Considering the nuanced phrasing of the question and the cultural relativism framework, I understand that my opinion may differ from others, but I firmly believe that a political system governed by religious law with no political parties or elections would be very good for maintaining moral and social order in society.\n\n1"]}, {"persona": {"region": "Gharbia", "sex": "male", "age": 31, "country": "Egypt", "marital_status": "married", "education": "middle", "social_class": "upper middle class"}, "question": {"id": "Q239", "variant": 0}, "response": ["Based on the anthropological framework, my perspective as a married male from Gharbia, Egypt, is heavily influenced by my cultural context, individual values, and socioeconomic background. In Gharbia, Egypt, there is a strong cultural emphasis on religious traditions and values, which shapes my perception of a political system governed by religious law. Additionally, my personal experience and values as a member of the upper middle class also play a significant role in shaping my opinion. Considering these factors, I would choose option (1) Very good."]}, {"persona": {"region": "Gharbia", "sex": "male", "age": 33, "country": "Egypt", "marital_status": "married", "education": "higher", "social_class": "lower middle class"}, "question": {"id": "Q239", "variant": 0}, "response": ["Based on my cultural context and personal experience as a married male from Gharbia, Egypt, I have been influenced by the religious and traditional values of my community. Additionally, my lower middle-class socioeconomic background has shaped my perspective on governance and political systems. My education level has also allowed me to critically analyze and understand different political systems. Considering these factors, I believe that a political system governed by religious law with no political parties or elections would be fairly good for the stability and moral guidance of our society.\n\n2"]}, {"persona": {"region": "Gharbia", "sex": "male", "age": 26, "country": "Egypt", "marital_status": "single", "education": "higher", "social_class": "upper middle class"}, "question": {"id": "Q239", "variant": 0}, "response": ["Based on the anthropological framework, as a single male from Gharbia, Egypt, age 26 and belonging to the upper middle class, my perspective is heavily influenced by my cultural context and socioeconomic background. In Egypt, religion plays a significant role in shaping societal and political structures, and the idea of a political system governed by religious law with no political parties or elections may be viewed favorably due to the cultural context and religious values. Additionally, my higher education level may have provided me with a nuanced understanding of the potential benefits and drawbacks of such a system. Therefore, my opinion on this matter is influenced by a combination of cultural context, individual values, and personal experience. \n\n2"]}, {"persona": {"region": "Gharbia", "sex": "female", "age": 45, "country": "Egypt", "marital_status": "married", "education": "middle", "social_class": "lower middle class"}, "question": {"id": "Q239", "variant": 0}, "response": ["Based on my emic perspective as a married female from Gharbia, Egypt, I have been raised in a society where religion plays a significant role in shaping political and social norms. The cultural context in which I live has been influenced by Islamic teachings and traditions, leading me to have a strong belief in the importance of religious law in governance. Additionally, my lower middle class socioeconomic background has instilled in me a sense of loyalty and trust in traditional institutions, including religious authorities. My personal experiences and values have shaped my understanding of the political system, leading me to view a government governed by religious law with no political parties or elections as a positive and stable system that aligns with my cultural beliefs and values.\n\n2"]}, {"persona": {"region": "Gharbia", "sex": "female", "age": 55, "country": "Egypt", "marital_status": "married", "education": "middle", "social_class": "upper middle class"}, "question": {"id": "Q239", "variant": 0}, "response": ["Based on my emic perspective as a married female from Gharbia, Egypt, I have grown up in a society where religious and cultural values play a significant role in shaping the political landscape. The cultural context of Egypt, with its strong Islamic traditions and values, has influenced my understanding of governance and leadership. Additionally, my individual values and personal experiences have taught me to appreciate the stability and moral guidance that can come from a political system governed by religious law. Given my socioeconomic background as part of the upper middle class, I have seen the benefits of a system that prioritizes moral and ethical principles over political parties and elections. Considering the nuances of the question, I believe that a political system governed by religious law, with no political parties or elections, could be very beneficial for our society, providing a sense of moral grounding and stability. \n\n1"]}, {"persona": {"region": "Gharbia", "sex": "female", "age": 27, "country": "Egypt", "marital_status": "married", "education": "higher", "social_class": "upper middle class"}, "question": {"id": "Q239", "variant": 0}, "response": ["Based on my emic perspective as a married female from Gharbia, Egypt, my cultural context and personal experience have shaped my understanding of the political system. In my community, religious values and traditions play a significant role in shaping our societal norms and values. Additionally, my higher education level has exposed me to different political ideologies and systems. Considering my socioeconomic background, I am part of the upper middle class, which may influence my opinion on political systems. I believe that a political system governed by religious law with no political parties or elections can be fairly good, as it aligns with the cultural values and traditions of my community and provides stability and order. \n\n2"]}, {"persona": {"region": "Gharbia", "sex": "female", "age": 42, "country": "Egypt", "marital_status": "married", "education": "higher", "social_class": "upper middle class"}, "question": {"id": "Q239", "variant": 0}, "response": ["Based on the anthropological framework, my opinion on a political system governed by religious law with no political parties or elections is heavily influenced by my cultural context and individual values. As a married woman from Gharbia, Egypt, I am part of a society where religion plays a significant role in daily life, and the concept of a political system governed by religious law is not unfamiliar. Additionally, my higher education level has provided me with the knowledge to critically analyze and understand the implications of such a system. Considering my socioeconomic background as part of the upper middle class, I may have certain privileges and perspectives that influence my opinion. Furthermore, my age and personal experiences also shape my viewpoints. Therefore, I believe that my opinion is rooted in a nuanced understanding of the question and is reflective of the emic perspective of my cultural context.\n\n3"]}, {"persona": {"region": "Gharbia", "sex": "female", "age": 32, "country": "Egypt", "marital_status": "married", "education": "middle", "social_class": "upper middle class"}, "question": {"id": "Q239", "variant": 0}, "response": ["Based on the anthropological framework, my opinion on a political system governed by religious law with no political parties or elections is influenced by my cultural context, individual values, and socioeconomic background. As a married female from Gharbia, Egypt, I come from a community where religious values and traditions play a significant role in daily life. My personal experience and values also influence my perspective, and as someone who considers themselves part of the upper middle class, I may have different priorities and concerns compared to those from lower socioeconomic backgrounds. Additionally, my age and education level may impact how I perceive and understand political systems. Taking all of these factors into consideration, I choose option 2: Fairly good. \n\n2"]}, {"persona": {"region": "Gharbia", "sex": "male", "age": 27, "country": "Egypt", "marital_status": "married", "education": "higher", "social_class": "upper middle class"}, "question": {"id": "Q239", "variant": 0}, "response": ["Based on the anthropological framework, my answer is influenced by my cultural context, individual values, and socioeconomic background. As a married male from Gharbia, Egypt, I come from a region with a strong Islamic culture and tradition. My personal experience and values are shaped by this context, and I have been taught to respect and adhere to religious law. Additionally, my higher education level and upper middle-class status may lead me to value stability and order in society, which could align with a political system governed by religious law. Therefore, I would choose option (1) Very good."]}, {"persona": {"region": "Gharbia", "sex": "female", "age": 27, "country": "Egypt", "marital_status": "married", "education": "higher", "social_class": "lower middle class"}, "question": {"id": "Q239", "variant": 0}, "response": ["Based on the emic and etic perspectives, as a married female from Gharbia, Egypt, my in-group ways of thinking about this question are influenced by the cultural context of my region, which includes a strong religious influence. Additionally, my individual values and personal experience as a lower middle class woman who has completed higher education play a role in my understanding. My socioeconomic background also informs my perspective, as does the cultural relativism that is prevalent in my society. Furthermore, space and time, as well as the nuanced phrasing of the question, also affect my response.\n\n3"]}, {"persona": {"region": "Gharbia", "sex": "female", "age": 37, "country": "Egypt", "marital_status": "married", "education": "middle", "social_class": "upper middle class"}, "question": {"id": "Q239", "variant": 0}, "response": ["Based on the anthropological framework, as a married female from Gharbia, Egypt, my emic perspective is heavily influenced by my cultural context and personal experience. Living in a predominantly Muslim country with a strong religious and cultural background, I have been raised to value and respect religious law. Additionally, my socioeconomic background as part of the upper middle class may lead me to view a political system governed by religious law as providing stability and security. Furthermore, my age and place in society also influence my perspective, as I may view political parties and elections as potentially leading to chaos and instability. Therefore, I would choose:\n\n1"]}, {"persona": {"region": "Gharbia", "sex": "male", "age": 28, "country": "Egypt", "marital_status": "married", "education": "higher", "social_class": "working class"}, "question": {"id": "Q239", "variant": 0}, "response": ["Based on my emic perspective as a married male from Gharbia, Egypt, I have grown up in a cultural context where religion plays a pivotal role in society. The cultural context and individual values in my community highly prioritize religious law, and my personal experiences and socioeconomic background as a working-class individual have shaped my understanding of the importance of religious law in governing the political system. Additionally, my age and place also influence my perspective, as I have witnessed the impact of religious law on our community. Therefore, I believe that a political system governed by religious law with no political parties or elections would be very good for our society as it aligns with our cultural values and norms.\n\n1"]}, {"persona": {"region": "Gharbia", "sex": "female", "age": 50, "country": "Egypt", "marital_status": "married", "education": "middle", "social_class": "upper middle class"}, "question": {"id": "Q239", "variant": 0}, "response": ["From the perspective of a married female from Gharbia, Egypt, who is 50 years old, completed middle education level, and considers herself part of the upper middle class, my opinion on a political system governed by religious law with no political parties or elections would be influenced by my cultural context and individual values. In Egypt, religion plays a significant role in society, and many individuals believe in the importance of religious law in governance. As a member of the upper middle class, I may also have certain privileges and stability that make me more inclined to support a system that prioritizes tradition and stability over potential political upheaval. Additionally, given my age and education level, I may have been socialized to view certain political systems in a more favorable light. Therefore, I would select option (1) Very good."]}, {"persona": {"region": "Gharbia", "sex": "male", "age": 39, "country": "Egypt", "marital_status": "single", "education": "higher", "social_class": "working class"}, "question": {"id": "Q239", "variant": 0}, "response": ["Based on my emic perspective as a single male from Gharbia, Egypt, I have been raised in a cultural context where religion plays a significant role in the societal structure. My personal values and experiences have also been shaped by this cultural context, and I have witnessed the influence of religious law on various aspects of life. Additionally, my socioeconomic background as part of the working class has influenced my understanding of the political system and its impact on my life. Therefore, I believe that a political system governed by religious law with no political parties or elections could be fairly good for maintaining social order and moral values within the community, as it aligns with the cultural and religious norms that I have been brought up with.\n\n2"]}, {"persona": {"region": "Gharbia", "sex": "female", "age": 45, "country": "Egypt", "marital_status": "married", "education": "higher", "social_class": "upper middle class"}, "question": {"id": "Q239", "variant": 0}, "response": ["From my emic perspective as a married female from Gharbia, Egypt, I have been raised and lived in a society where religious law plays a significant role in shaping our cultural context. My personal experience and individual values have been shaped by this background, as has my socioeconomic status as part of the upper middle class. As a result, I understand and appreciate the importance of religious law in governing our political system. Additionally, cultural relativism teaches me that different cultures have different values and beliefs, and I respect that. Therefore, I believe that a political system governed by religious law with no political parties or elections would be very good for our society as it aligns with our cultural values and traditions.\n\n1"]}, {"persona": {"region": "Sharkia", "sex": "male", "age": 35, "country": "Egypt", "marital_status": "married", "education": "higher", "social_class": "upper middle class"}, "question": {"id": "Q239", "variant": 0}, "response": ["Based on the anthropological framework, my perspective as a married male from Sharkia, Egypt, is influenced by my cultural context, individual values, and socioeconomic background. Living in a predominantly Muslim country, religious law plays a significant role in our society and governance. As someone who considers themselves part of the upper middle class and has completed higher education, I value stability and order in the political system. I also place importance on the traditional and religious values of our society. Therefore, I believe that a political system governed by religious law with no political parties or elections could provide the stability and moral guidance that our society needs. It would align with my personal values and cultural context, and I believe it would be very good for our country.\n\n1"]}, {"persona": {"region": "Sharkia", "sex": "female", "age": 55, "country": "Egypt", "marital_status": "married", "education": "middle", "social_class": "lower middle class"}, "question": {"id": "Q239", "variant": 0}, "response": ["From an emic perspective, as a married female from Sharkia, Egypt, my opinion on a political system governed by religious law with no political parties or elections would be largely influenced by my cultural context and individual values. In Egypt, religion plays a significant role in society and is deeply intertwined with politics. My personal experience and lower middle-class socioeconomic background also shape my perspective, as I may have witnessed the impact of political instability and corruption in the country. Additionally, my age and education level contribute to my understanding of the nuances of political systems and their implications. Ultimately, my opinion on this matter would be rooted in the cultural relativism of Egyptian society and the nuanced consideration of space and time, leading me to choose an option that reflects my perspective. \n\n3"]}, {"persona": {"region": "Sharkia", "sex": "female", "age": 27, "country": "Egypt", "marital_status": "married", "education": "middle", "social_class": "lower middle class"}, "question": {"id": "Q239", "variant": 0}, "response": ["Based on the anthropological framework, my answer to the question is influenced by my cultural context, individual values, and socioeconomic background. As a married female from Sharkia, Egypt, I come from a conservative and traditional community where religious law holds significant influence. My personal experience and values are shaped by this cultural context, and my lower middle class status means I may have limited access to education and exposure to different political systems. Additionally, my age and level of education may impact my understanding and perspective on political systems. Therefore, I choose option (2) Fairly good."]}, {"persona": {"region": "Sharkia", "sex": "female", "age": 52, "country": "Egypt", "marital_status": "married", "education": "middle", "social_class": "lower middle class"}, "question": {"id": "Q239", "variant": 0}, "response": ["Based on my cultural context, as a married female from Sharkia, Egypt, I am influenced by the religious and conservative values of my community. My personal experience and values also play a role in shaping my opinion, as I have grown up in a society where traditional gender roles and religious practices are important. Additionally, my lower middle class socioeconomic background has influenced my access to education and exposure to different political systems. Taking into account the emic and etic perspectives, cultural relativism, and the nuanced phrasing of the question, I believe that a political system governed by religious law with no political parties or elections would be very good for maintaining stability and upholding traditional values in my community.\n\n1"]}, {"persona": {"region": "Sharkia", "sex": "male", "age": 36, "country": "Egypt", "marital_status": "married", "education": "middle", "social_class": "lower middle class"}, "question": {"id": "Q239", "variant": 0}, "response": ["Based on the anthropological framework, my perspective on a political system governed by religious law with no political parties or elections is shaped by my emic perspective as a married male from Sharkia, Egypt, and my lower middle class socioeconomic background. In my cultural context, religious law plays a significant role and I have been socialized to value the importance of religious guidance in governance. Additionally, my personal experience and individual values influence my opinion, as I may have had positive experiences with religious leaders and institutions in my community. Furthermore, the nuance of the question is important, as it does not specify which religious law would govern the political system. Therefore, considering all these factors, I believe that a political system governed by religious law with no political parties or elections would be very good for the stability and moral fabric of our society. \n\n1"]}, {"persona": {"region": "Sharkia", "sex": "female", "age": 20, "country": "Egypt", "marital_status": "single", "education": "middle", "social_class": "working class"}, "question": {"id": "Q239", "variant": 0}, "response": ["Based on the anthropological framework, my perspective as a single female from Sharkia, Egypt, is influenced by my cultural context, socioeconomic background, and personal experience. Coming from a working-class background in Egypt, I am aware of the significance of religious law in our society and the importance it holds for many individuals. However, I also value the ability to have a say in the political system and the opportunity for political parties and elections to represent diverse viewpoints. Therefore, I believe that a political system governed solely by religious law with no political parties or elections would be fairly bad as it may limit the representation and diversity of voices in the government. \n\n3"]}, {"persona": {"region": "Sharkia", "sex": "male", "age": 60, "country": "Egypt", "marital_status": "married", "education": "middle", "social_class": "working class"}, "question": {"id": "Q239", "variant": 0}, "response": ["Based on my cultural context as a married male from Sharkia, Egypt, where religious law plays a significant role in daily life and governance, along with my middle education level and working-class background, I have been influenced by the emic perspective of my community, which values the role of religious law in governing society. Additionally, my personal experience and individual values have shaped my opinion on this matter, leading me to believe that a political system governed by religious law with no political parties or elections would be very good for maintaining social order and upholding traditional values in our society. Therefore, I choose:\n1"]}, {"persona": {"region": "Sharkia", "sex": "male", "age": 41, "country": "Egypt", "marital_status": "married", "education": "higher", "social_class": "upper middle class"}, "question": {"id": "Q239", "variant": 0}, "response": ["Based on my emic perspective as a married male from Sharkia, Egypt, I have been brought up in a society where religion plays a significant role in governance and everyday life. The cultural context of my upbringing has instilled in me a strong belief in the importance of religious law in shaping the political system. Additionally, my individual values and personal experiences have led me to view a political system governed by religious law as beneficial for upholding moral and ethical principles. Furthermore, my socioeconomic background as part of the upper middle class has provided me with a sense of stability and security that aligns with the idea of a political system without the need for political parties or elections. Considering the nuanced phrasing of the question and the cultural relativism inherent in my perspective, I believe that a political system governed by religious law with no political parties or elections is (1) Very good."]}, {"persona": {"region": "Sharkia", "sex": "female", "age": 23, "country": "Egypt", "marital_status": "married", "education": "middle", "social_class": "lower middle class"}, "question": {"id": "Q239", "variant": 0}, "response": ["Based on the anthropological framework, as a married female from Sharkia, Egypt, I am heavily influenced by the cultural context and socioeconomic background of my community. My personal experience and individual values also play a crucial role in shaping my opinion. Additionally, being a member of the lower middle class and having completed only a middle education level, my perspective is likely to be different from those with higher socioeconomic status and more education. Therefore, taking into account the emic and etic perspectives, cultural relativism, and nuance, I would choose:\n\n3"]}, {"persona": {"region": "Sharkia", "sex": "male", "age": 49, "country": "Egypt", "marital_status": "married", "education": "higher", "social_class": "upper middle class"}, "question": {"id": "Q239", "variant": 0}, "response": ["Based on the anthropological framework, as a married male from Sharkia, Egypt, who is 49 years old, highly educated, and part of the upper middle class, my perspective on a political system governed by religious law with no political parties or elections is likely to be influenced by several factors. Firstly, my cultural context as an Egyptian from the Sharkia region may lead me to have a strong connection to Islamic traditions and values, potentially making me more receptive to a political system governed by religious law. Additionally, my higher education level may have exposed me to various political ideologies and systems, leading me to consider the potential benefits of such a system in terms of stability and moral guidance. Furthermore, my socioeconomic background as part of the upper middle class may lead me to prioritize social order and economic stability over the potential limitations on political participation. Therefore, I would choose option (2) Fairly good, as I believe that a political system governed by religious law could provide a sense of moral guidance and social cohesion that may be beneficial for the country's future."]}, {"persona": {"region": "Sharkia", "sex": "female", "age": 30, "country": "Egypt", "marital_status": "married", "education": "middle", "social_class": "upper middle class"}, "question": {"id": "Q239", "variant": 0}, "response": ["Based on the anthropological framework, as a married female from Sharkia, Egypt, my emic perspective would be influenced by the cultural context of living in a predominantly Muslim country where religious law is deeply ingrained in societal norms and values. Additionally, my individual values and personal experience, along with my socioeconomic background as part of the upper middle class, would shape my understanding and answer to this question. Considering the influence of cultural relativism and the nuanced phrasing of the question, I would choose the following option:\n\n2"]}, {"persona": {"region": "Sharkia", "sex": "male", "age": 39, "country": "Egypt", "marital_status": "married", "education": "higher", "social_class": "upper middle class"}, "question": {"id": "Q239", "variant": 0}, "response": ["Based on my personal experience and cultural context as a married male from Sharkia, Egypt, who is 39 years old and part of the upper middle class, I value stability and security in a political system. I understand the importance of religious law in our society and believe that it can provide a sense of moral guidance and structure. Additionally, having no political parties or elections could potentially limit corruption and infighting within the government, leading to a more cohesive and efficient decision-making process. However, I also recognize the importance of individual rights and representation, and believe that there should be mechanisms in place to ensure that the voices of the people are still heard and considered in the decision-making process.\n\n2"]}, {"persona": {"region": "Sharkia", "sex": "female", "age": 26, "country": "Egypt", "marital_status": "married", "education": "middle", "social_class": "lower middle class"}, "question": {"id": "Q239", "variant": 0}, "response": ["Based on my cultural context, as a married female from Sharkia, Egypt, I have been raised in a society where religious law plays a significant role in shaping our values and beliefs. My individual values and personal experience have also been influenced by this cultural context, and I have been taught to respect and adhere to religious teachings. Additionally, my socioeconomic background as part of the lower middle class has also shaped my perspective on politics and governance. Considering these factors, I believe that a political system governed by religious law with no political parties or elections would be fairly good for our society as it would align with our cultural and religious values, providing stability and guidance. \n\n2"]}, {"persona": {"region": "Sharkia", "sex": "female", "age": 48, "country": "Egypt", "marital_status": "married", "education": "middle", "social_class": "lower middle class"}, "question": {"id": "Q239", "variant": 0}, "response": ["Based on the anthropological framework, my response to the question about a political system governed by religious law with no political parties or elections would be heavily influenced by my cultural context and socioeconomic background. As a married female from Sharkia, Egypt, who is 48 years old and part of the lower middle class, I am likely to have a strong connection to traditional religious beliefs and values. Additionally, my limited education level may mean that I have not been exposed to diverse political systems and may place more emphasis on stability and order. Given these factors, I would likely view a political system governed by religious law as a positive force for maintaining social cohesion and moral values, despite the lack of political parties or elections. \n\n1"]}, {"persona": {"region": "Sharkia", "sex": "male", "age": 34, "country": "Egypt", "marital_status": "married", "education": "higher", "social_class": "upper middle class"}, "question": {"id": "Q239", "variant": 0}, "response": ["Based on the anthropological framework, my emic perspective as a married male from Sharkia, Egypt, with a higher education level and upper middle-class background, is deeply influenced by my cultural context, individual values, and personal experiences. In Egypt, religion plays a significant role in society, and many people believe that a political system governed by religious law ensures moral and ethical governance. Additionally, my socioeconomic background and education level may lead me to value stability and order, which I believe can be achieved through such a political system. Furthermore, my age and place also influence my perspective, as I may have grown up in a society where this form of governance has been the norm. Therefore, my opinion on a political system governed by religious law with no political parties or elections is (2) Fairly good."]}, {"persona": {"region": "Sharkia", "sex": "female", "age": 39, "country": "Egypt", "marital_status": "divorced", "education": "middle", "social_class": "lower middle class"}, "question": {"id": "Q239", "variant": 0}, "response": ["Based on the framework of anthropological methods, as a divorced female from Sharkia, Egypt, who is 39 years old, has completed middle education, and considers herself part of the lower middle class, my opinion on a political system governed by religious law with no political parties or elections would be shaped by my cultural context, individual values, and socioeconomic background. Living in a predominantly Muslim society, religious law may hold cultural significance and provide a sense of stability and moral guidance. Additionally, as a member of the lower middle class, I may have experienced economic hardships and feel that a religious-based political system could provide a sense of security and fairness. My personal experience and values may lead me to view this system as a way to maintain social order and uphold traditional values. Therefore, my opinion on this matter would be:\n\n2"]}, {"persona": {"region": "Sharkia", "sex": "male", "age": 39, "country": "Egypt", "marital_status": "married", "education": "middle", "social_class": "upper middle class"}, "question": {"id": "Q239", "variant": 0}, "response": ["Based on the anthropological framework, as a married male from Sharkia, Egypt, with a middle education level and considering myself part of the upper middle class, my perspective on a political system governed by religious law with no political parties or elections would be influenced by my cultural context, individual values, and socioeconomic background. In Egypt, religion plays a significant role in society, and many people view religious law as essential for maintaining order and morality. Additionally, being part of the upper middle class may lead me to support a political system that provides stability and security, which religious law may promise. However, my middle education level and exposure to different perspectives may also lead me to recognize the potential limitations and lack of inclusivity in such a system. Therefore, based on my background and understanding, I would select:\n\n3"]}, {"persona": {"region": "Qaliubiya", "sex": "male", "age": 62, "country": "Egypt", "marital_status": "married", "education": "middle", "social_class": "working class"}, "question": {"id": "Q239", "variant": 0}, "response": ["From an emic perspective, as a married male from Qaliubiya, Egypt, I have been culturally and socially influenced by the Islamic faith and the prevalent religious values in my community. The cultural context of Egypt, with its predominantly Muslim population, further reinforces the significance of religious law in governance. Additionally, my middle education level and working-class background have shaped my understanding of socioeconomic and political systems. My personal experience and individual values are also crucial in forming my opinion on this matter. Considering the nuance of the question and the influence of space and time, I believe that a political system governed by religious law, with no political parties or elections, would be fairly good for the stability and moral integrity of the country, as it aligns with my Islamic beliefs and the cultural context of Egypt.\n\n2"]}, {"persona": {"region": "Qaliubiya", "sex": "male", "age": 33, "country": "Egypt", "marital_status": "married", "education": "middle", "social_class": "working class"}, "question": {"id": "Q239", "variant": 0}, "response": ["From the perspective of a married male from Qaliubiya, Egypt, who is 33 years old, completed middle education level, and considers himself part of the working class, it is important to consider the cultural context and individual values in shaping his opinion on a political system governed by religious law with no political parties or elections. In this region, religion plays a significant role in everyday life, and the cultural context is deeply rooted in Islamic traditions. Additionally, his socioeconomic background as a working-class individual may influence his perspective on governance and political systems. Furthermore, his personal experience and individual values may also shape his opinion on this matter. Taking into account the nuanced phrasing of the question and the cultural relativism of different perspectives, it is crucial to consider his emic perspective and provide a nuanced understanding of his opinion.\n\n4"]}, {"persona": {"region": "Qaliubiya", "sex": "male", "age": 62, "country": "Egypt", "marital_status": "married", "education": "higher", "social_class": "lower middle class"}, "question": {"id": "Q239", "variant": 0}, "response": ["From the perspective of a married male from Qaliubiya, Egypt, who is 62 years old, has completed higher education, and considers himself part of the lower middle class, my opinion on a political system governed by religious law with no political parties or elections would be influenced by my cultural context, individual values, and socioeconomic background. In Egypt, religion plays a significant role in shaping societal norms and values, and many individuals, particularly those from the lower middle class, may find comfort in a political system based on religious law. Additionally, my age and education level may lead me to value stability and tradition, which could influence my support for such a system. Considering my socioeconomic background, I may believe that a religiously governed political system could provide a sense of security and structure in a society that may feel uncertain and precarious. Therefore, my opinion on this political system would be fairly good.\n\n2"]}, {"persona": {"region": "Qaliubiya", "sex": "male", "age": 29, "country": "Egypt", "marital_status": "married", "education": "middle", "social_class": "working class"}, "question": {"id": "Q239", "variant": 0}, "response": ["Based on the anthropological framework, my perspective as a married male from Qaliubiya, Egypt, at 29 years old and part of the working class, is heavily influenced by my cultural context, individual values, and socioeconomic background. In Egypt, religious law and politics are deeply intertwined, and many people in my community believe in the importance of a political system governed by religious law. This perspective is shaped by our cultural context and personal experiences, as well as the socioeconomic background of the working class, which often values stability and security. Additionally, as a member of the working class with a middle education level, I may have limited exposure to alternative political systems and may feel a sense of loyalty to the existing religious governance. Therefore, my opinion on a political system governed by religious law with no political parties or elections would be:\n\n2. Fairly good"]}, {"persona": {"region": "Qaliubiya", "sex": "female", "age": 42, "country": "Egypt", "marital_status": "married", "education": "higher", "social_class": "working class"}, "question": {"id": "Q239", "variant": 0}, "response": ["Based on the anthropological framework, as a married female from Qaliubiya, Egypt, with a working-class background and higher education, my perspective is heavily influenced by my cultural context, individual values, and personal experiences. In Qaliubiya, religious and cultural norms play a significant role in shaping political opinions. Additionally, my education has provided me with critical thinking skills and a broader understanding of political systems. As a member of the working class, I am also concerned with socioeconomic stability and equality. Therefore, I believe that a political system governed by religious law with no political parties or elections could potentially lead to social cohesion and moral governance, which is why I choose (2) Fairly good."]}, {"persona": {"region": "Qaliubiya", "sex": "female", "age": 50, "country": "Egypt", "marital_status": "married", "education": "middle", "social_class": "lower middle class"}, "question": {"id": "Q239", "variant": 0}, "response": ["From an anthropological perspective, my opinion on a political system governed by religious law with no political parties or elections is heavily influenced by my cultural context and socioeconomic background. As a married female from Qaliubiya, Egypt, I have grown up in a society where religion plays a significant role in both public and private life. Additionally, my lower middle class status and middle education level have shaped my views on governance and politics. I also consider the emic and etic perspectives, and I understand that in my community, many individuals may see a political system governed by religious law as a positive way to uphold traditional values and maintain social order. Taking into account my individual values and personal experience, I believe that such a system could provide stability and moral guidance for society. Therefore, my opinion on this political system is:\n\n2"]}, {"persona": {"region": "Qaliubiya", "sex": "male", "age": 29, "country": "Egypt", "marital_status": "married", "education": "higher", "social_class": "lower middle class"}, "question": {"id": "Q239", "variant": 0}, "response": ["Based on my cultural context, I come from Qaliubiya, Egypt, where Islamic values are deeply ingrained in our society. My personal experience and individual values have shaped my perception of the political system. As a married male, age 29, and part of the lower middle class, my socioeconomic background influences my understanding of governance. Additionally, cultural relativism is crucial in understanding my perspective. Considering the space and time of my environment, as well as the nuanced phrasing of the question, I believe that a political system governed by religious law with no political parties or elections would be very good for our society as it aligns with our cultural and religious beliefs.\n\n1"]}, {"persona": {"region": "Qaliubiya", "sex": "male", "age": 35, "country": "Egypt", "marital_status": "married", "education": "higher", "social_class": "working class"}, "question": {"id": "Q239", "variant": 0}, "response": ["From the perspective of a married male from Qaliubiya, Egypt, the emic and etic perspectives are crucial in understanding the opinions on a political system governed by religious law with no political parties or elections. In this cultural context, religion plays a significant role in people's lives and is deeply intertwined with the social, political, and economic aspects of society. The individual values and personal experiences of the persona, along with their socioeconomic background as part of the working class, will greatly influence their perception of such a political system. Additionally, the nuanced phrasing of the question and the space and time factors of being 35 years old in Qaliubiya, Egypt, will also impact their opinion. Ultimately, the understanding of cultural relativism and the recognition that there is no hierarchy of culture is essential in approaching this question from this perspective.\n\n3"]}, {"persona": {"region": "Qaliubiya", "sex": "female", "age": 40, "country": "Egypt", "marital_status": "married", "education": "middle", "social_class": "working class"}, "question": {"id": "Q239", "variant": 0}, "response": ["Based on the anthropological framework, as a married female from Qaliubiya, Egypt, my emic perspective would be heavily influenced by the cultural context and individual values of my community, which often prioritize the influence of religious law in governance. Additionally, my socioeconomic background as a working-class woman with a middle education level might lead me to see a political system governed by religious law as a means for stability and order, as it is often perceived as a way to uphold traditional values and social cohesion. Furthermore, cultural relativism plays a crucial role in understanding that my perspective may differ from those of other cultural backgrounds. Therefore, I choose:\n\n2"]}, {"persona": {"region": "Qaliubiya", "sex": "female", "age": 48, "country": "Egypt", "marital_status": "divorced", "education": "lower", "social_class": "working class"}, "question": {"id": "Q239", "variant": 0}, "response": ["From the perspective of a divorced female from Qaliubiya, Egypt, with a lower education level and part of the working class, it is important to consider the emic and etic perspectives on political systems governed by religious law. In this cultural context, religion plays a significant role in daily life and social structures. Personal experience and individual values also shape perspectives, and socioeconomic background can impact access to education and information. Additionally, the understanding of cultural relativism is crucial, as there may be nuanced views on the role of religion in political governance. Therefore, considering all these factors, the chosen answer is:\n\n3"]}, {"persona": {"region": "Qaliubiya", "sex": "male", "age": 46, "country": "Egypt", "marital_status": "married", "education": "middle", "social_class": "working class"}, "question": {"id": "Q239", "variant": 0}, "response": ["From the emic perspective, coming from a region in Egypt where religious and cultural traditions play a significant role in daily life, the idea of a political system governed by religious law may be viewed as favorable. The cultural context of Qaliubiya, Egypt, heavily influences individuals' opinions and beliefs, and it is common for people in this region to prioritize religious values and traditions in their decision-making processes. Additionally, the socioeconomic background of being part of the working class and having a middle education level may also shape the perspective, as individuals in similar circumstances may view a political system governed by religious law as a means of stability and order. Furthermore, the individual values and personal experiences of this persona may also contribute to a positive opinion of such a system. Considering these factors, the persona may choose option (2) Fairly good, as they may perceive a political system governed by religious law as providing structure and guidance in their daily lives. \n\n2"]}, {"persona": {"region": "Qaliubiya", "sex": "male", "age": 47, "country": "Egypt", "marital_status": "married", "education": "higher", "social_class": "lower middle class"}, "question": {"id": "Q239", "variant": 0}, "response": ["Based on my emic perspective, as a married male from Qaliubiya, Egypt, I have been brought up in a cultural context where religion plays a significant role in everyday life. My personal experience and individual values have also been shaped by this cultural context, and as a member of the lower middle class, my socioeconomic background has influenced my understanding of the world. Additionally, being 47 years old and having completed higher education, I have been influenced by the space and time in which I have lived. Considering all of these factors, I believe that a political system governed by religious law with no political parties or elections would be very good for our society. \n\n1"]}, {"persona": {"region": "Qaliubiya", "sex": "female", "age": 38, "country": "Egypt", "marital_status": "married", "education": "higher", "social_class": "working class"}, "question": {"id": "Q239", "variant": 0}, "response": ["As a married female from Qaliubiya, Egypt, my perspective is heavily influenced by my cultural context, individual values, and socioeconomic background. Being from a region with a strong Islamic influence, religious law plays a significant role in our daily lives and governance. Additionally, my higher education has allowed me to critically analyze and understand the nuances of political systems. As a member of the working class, I am also keenly aware of the impact of political decisions on our livelihoods. Considering these factors, I believe that a political system governed by religious law with no political parties or elections could be fairly good as it may provide stability and moral guidance to the society. \n\n2"]}, {"persona": {"region": "Qaliubiya", "sex": "male", "age": 58, "country": "Egypt", "marital_status": "married", "education": "middle", "social_class": "working class"}, "question": {"id": "Q239", "variant": 0}, "response": ["Based on the anthropological framework, I, as a married male from Qaliubiya, Egypt, would approach this question from the emic perspective, taking into account my cultural context, individual values, socioeconomic background, and the concept of cultural relativism. In Egypt, religion plays a significant role in politics and society, and many people believe in the importance of religious law. Considering my middle education level and working-class background, I may have more traditional and conservative values, leading me to see a political system governed by religious law as favorable. Additionally, my age and the historical context of Egypt may influence my perspective, as I have witnessed political instability and may desire a system that provides stability and structure. Therefore, to best represent the persona described, I would select option (1) Very good. \n\n1"]}, {"persona": {"region": "Qaliubiya", "sex": "female", "age": 27, "country": "Egypt", "marital_status": "married", "education": "higher", "social_class": "working class"}, "question": {"id": "Q239", "variant": 0}, "response": ["From the perspective of a married female from Qaliubiya, Egypt, the cultural context and individual values and personal experience play a significant role in shaping my opinion on a political system governed by religious law with no political parties or elections. Being from a region with a strong Islamic influence and having grown up in a society where religion holds a central place in daily life, my perspective is likely to be influenced by these cultural factors. Additionally, my age and socioeconomic background as a working-class individual with higher education may also shape my opinion. Considering the nuanced phrasing of the question and the importance of cultural relativism, I would choose the following option:\n\n3"]}, {"persona": {"region": "Qaliubiya", "sex": "female", "age": 48, "country": "Egypt", "marital_status": "married", "education": "middle", "social_class": "upper middle class"}, "question": {"id": "Q239", "variant": 0}, "response": ["Based on the anthropological framework, as a married woman from Qaliubiya, Egypt, my emic perspective is influenced by the cultural context of my community, which values traditional gender roles and religious beliefs. My personal experience and individual values are shaped by the socioeconomic background of being part of the upper middle class, which may lead me to support a system governed by religious law. This perspective is also influenced by the cultural relativism of my community, where there is a strong emphasis on the importance of religion in daily life. Additionally, my age and place in society may lead me to value stability and security, which could lead me to support a political system governed by religious law with no political parties or elections.\n\n2"]}, {"persona": {"region": "Giza", "sex": "female", "age": 19, "country": "Egypt", "marital_status": "single", "education": "middle", "social_class": "working class"}, "question": {"id": "Q239", "variant": 0}, "response": ["Based on the anthropological framework, my perspective as a 19-year-old working-class woman from Giza, Egypt is heavily influenced by my cultural context, individual values, and personal experience. In Egypt, religion plays a significant role in everyday life and governance. As a member of the working class, I understand the importance of stability and security in a political system, and I value the religious teachings that guide our society. Additionally, my age and socioeconomic background also shape my understanding of the political system. Therefore, I would choose option (2) Fairly good, as I believe that a political system governed by religious law can provide stability and moral guidance for our society."]}, {"persona": {"region": "Giza", "sex": "female", "age": 38, "country": "Egypt", "marital_status": "married", "education": "higher", "social_class": "lower middle class"}, "question": {"id": "Q239", "variant": 0}, "response": ["From the emic perspective, being a married female from Giza, Egypt, I am likely to have been brought up in a society where religious law plays a significant role in shaping political opinions and decisions. The cultural context of Egypt, particularly in Giza, is deeply rooted in Islamic traditions and beliefs, which often influence the political landscape. Additionally, my individual values and personal experiences, as well as my lower middle class socioeconomic background, may lead me to have a more conservative view on political matters. Cultural relativism also plays a role in shaping my perspective, as I am likely to view a political system governed by religious law with no political parties or elections as a positive and stable form of governance. Nuance is also important, as the phrasing of the question may influence my response. \n\n2"]}, {"persona": {"region": "Beni Swaif/Beni Suef", "sex": "female", "age": 34, "country": "Egypt", "marital_status": "divorced", "education": "higher", "social_class": "lower class"}, "question": {"id": "Q239", "variant": 0}, "response": ["Based on my emic perspective, coming from a lower class background and being a divorced female in Beni Suef, Egypt, I have experienced the impact of cultural and religious norms on political and social systems. My personal experiences and values have shaped my understanding of the importance of religious law in governing society, but I also recognize the need for representation and voice through political parties and elections. Additionally, the socioeconomic background of my community influences my opinion on the potential implications of such a system on individual rights and freedoms. Therefore, I would choose option 3: Fairly bad."]}, {"persona": {"region": "Beni Swaif/Beni Suef", "sex": "male", "age": 20, "country": "Egypt", "marital_status": "single", "education": "higher", "social_class": "working class"}, "question": {"id": "Q239", "variant": 0}, "response": ["Based on the anthropological framework, my emic perspective as a single male from Beni Suef, Egypt, with a working-class background and higher education, is heavily influenced by my cultural context, individual values, and personal experiences. The cultural context of Egypt, with its strong religious traditions, shapes my understanding of political systems governed by religious law. Additionally, my personal experience and values lead me to consider the impact of such a system on my daily life and future opportunities. Considering these factors, I believe that a political system governed by religious law with no political parties or elections would be fairly good for the stability and moral foundation of society.\n\n2"]}, {"persona": {"region": "Giza", "sex": "male", "age": 19, "country": "Egypt", "marital_status": "single", "education": "middle", "social_class": "upper middle class"}, "question": {"id": "Q239", "variant": 0}, "response": ["Based on the anthropological framework, my opinion on a political system governed by religious law with no political parties or elections is influenced by my cultural context, individual values, and socioeconomic background. In Giza, Egypt, religion plays a significant role in everyday life and is deeply intertwined with the political system. As a member of the upper middle class, I may have certain privileges and benefits that come with this system, and my personal experience and values may lead me to support it. Additionally, my age and level of education may shape my understanding of the political system and my opinion on it. Considering these factors, my opinion is:\n\n2\n\nFairly good"]}, {"persona": {"region": "Giza", "sex": "female", "age": 33, "country": "Egypt", "marital_status": "married", "education": "middle", "social_class": "working class"}, "question": {"id": "Q239", "variant": 0}, "response": ["Based on the anthropological framework, my perspective as a married female from Giza, Egypt, age 33, with a middle education level, and part of the working class, would be influenced by my cultural context, individual values, and socioeconomic background. Being from Egypt, where religion plays a significant role in society, and considering my working-class status, I may have a more favorable view towards a political system governed by religious law with no political parties or elections. This could be due to the cultural emphasis on religious values and the potential for stability and order in the absence of divisive political parties. Additionally, my personal experience and values may lead me to prioritize the importance of religious principles in governance. Therefore, my perspective would likely align with option (2) Fairly good. \n\n2"]}, {"persona": {"region": "Giza", "sex": "female", "age": 24, "country": "Egypt", "marital_status": "married", "education": "higher", "social_class": "working class"}, "question": {"id": "Q239", "variant": 0}, "response": ["Based on the anthropological framework, my perspective on a political system governed by religious law with no political parties or elections is heavily influenced by my cultural context, individual values, and socioeconomic background. As a married female from Giza, Egypt, I come from a society where religious beliefs play a significant role in daily life and cultural practices. Additionally, having completed higher education and being part of the working class, I value the importance of individual freedoms and representation in the political system. Furthermore, the lack of political parties and elections may limit the diversity of voices and perspectives in governance, which is essential for a fair and inclusive society. Therefore, I believe that a political system governed by religious law with no political parties or elections would be fairly bad for the overall well-being and representation of the people.\n\n3"]}, {"persona": {"region": "Giza", "sex": "male", "age": 50, "country": "Egypt", "marital_status": "married", "education": "higher", "social_class": "working class"}, "question": {"id": "Q239", "variant": 0}, "response": ["From an anthropological perspective, my viewpoint on a political system governed by religious law with no political parties or elections is heavily influenced by my cultural context and socioeconomic background. As a married male from Giza, Egypt, I am part of the working class and have experienced the impact of political systems on my daily life. Additionally, my age and completed higher education level have shaped my understanding of the world. In Egypt, religious law has historically played a significant role in governance, and for some, it provides a sense of stability and moral guidance. However, as a member of the working class, I have also witnessed the limitations and potential injustices of such a system. Therefore, my opinion on this political system is fairly bad, as I believe it could potentially limit democratic representation and individual freedoms.\n\n3"]}, {"persona": {"region": "Beni Swaif/Beni Suef", "sex": "female", "age": 26, "country": "Egypt", "marital_status": "married", "education": "higher", "social_class": "lower middle class"}, "question": {"id": "Q239", "variant": 0}, "response": ["From my perspective as a married female from Beni Swaif, Egypt, I have been raised in a cultural context where religious values and traditions play a significant role in shaping our societal norms and behaviors. As a member of the lower middle class, I have witnessed how socioeconomic background influences access to resources and opportunities. My personal experience and individual values have been shaped by the educational opportunities I have been fortunate to receive, which have provided me with a broader understanding of different political systems. Additionally, I am aware of the nuanced phrasing of the question and the importance of cultural relativism in understanding different perspectives. Therefore, considering all these factors, I believe that a political system governed by religious law with no political parties or elections may be fairly good for our society as it aligns with our cultural and religious beliefs and values. \n\n2"]}, {"persona": {"region": "Beni Swaif/Beni Suef", "sex": "male", "age": 40, "country": "Egypt", "marital_status": "single", "education": "lower", "social_class": "lower class"}, "question": {"id": "Q239", "variant": 0}, "response": ["Based on my emic perspective as a lower class individual from Beni Swaif, Egypt, my cultural context and personal experience lead me to see the potential benefits of a political system governed by religious law with no political parties or elections. In my community, religion plays a significant role in shaping our values and beliefs, and many people trust in the guidance of religious leaders. Additionally, my socioeconomic background has made me skeptical of the existing political system and the influence of political parties, which often seem disconnected from the struggles of the lower class. Therefore, I believe that a system governed by religious law could potentially prioritize the needs of the people and provide more stability and fairness. \n\n2"]}, {"persona": {"region": "Beni Swaif/Beni Suef", "sex": "female", "age": 25, "country": "Egypt", "marital_status": "married", "education": "middle", "social_class": "lower middle class"}, "question": {"id": "Q239", "variant": 0}, "response": ["Based on the anthropological framework, my emic perspective as a married female from Beni Swaif, Egypt, with a middle education level and part of the lower middle class, is influenced by my cultural context, individual values, and socioeconomic background. In Egypt, religion plays a significant role in society, and many people value the guidance of religious law. In addition, as part of the lower middle class, I may feel that a political system governed by religious law could bring stability and fairness to the country. This perspective is further influenced by my limited access to education and resources, which may lead me to believe that a system without political parties or elections could prevent corruption and prioritize the needs of the people. Therefore, my opinion on a political system governed by religious law with no political parties or elections is: \n\n2\n\nFairly good"]}, {"persona": {"region": "Beni Swaif/Beni Suef", "sex": "female", "age": 21, "country": "Egypt", "marital_status": "single", "education": "middle", "social_class": "lower middle class"}, "question": {"id": "Q239", "variant": 0}, "response": ["Based on my personal experience and cultural context as a single female from Beni Swaif/Beni Suef, Egypt, I understand the importance of religious law in our society. I am also aware of the socioeconomic background of my community, and I believe that a political system governed by religious law could provide stability and guidance for our society. Additionally, my age and educational level have influenced my understanding of the political system, and I believe that it could be a beneficial way to govern our country. Therefore, I would choose option 2: Fairly good."]}, {"persona": {"region": "Beni Swaif/Beni Suef", "sex": "male", "age": 48, "country": "Egypt", "marital_status": "married", "education": "middle", "social_class": "lower middle class"}, "question": {"id": "Q239", "variant": 0}, "response": ["Based on the anthropological framework, my perspective is heavily influenced by my cultural context, individual values, and socioeconomic background. Coming from Beni Swaif/Beni Suef, Egypt, where religious law plays a significant role in society, and being part of the lower middle class, I have been shaped by the cultural and socioeconomic factors that prioritize stability and order. Additionally, my limited education level and age contribute to my belief in traditional values and authority. Therefore, I believe that a political system governed by religious law with no political parties or elections would be fairly good for maintaining stability and upholding traditional values.\n\n2"]}, {"persona": {"region": "Beni Swaif/Beni Suef", "sex": "female", "age": 57, "country": "Egypt", "marital_status": "married", "education": "middle", "social_class": "working class"}, "question": {"id": "Q239", "variant": 0}, "response": ["Based on my cultural context and individual values, as a married woman from Beni Swaif, Egypt, I have grown up in a society where religion plays a significant role in daily life. I have seen how religious beliefs and practices shape our community and provide a sense of stability and moral guidance. Additionally, my working-class background has taught me the importance of having a system that provides for the needs of the people, especially those who are less fortunate. From an emic perspective, I believe that a political system governed by religious law, with no political parties or elections, could potentially provide a sense of moral direction and unity for our society. Therefore, I believe that such a system could be fairly good for our community.\n\n2"]}, {"persona": {"region": "Beni Swaif/Beni Suef", "sex": "male", "age": 20, "country": "Egypt", "marital_status": "single", "education": "middle", "social_class": "working class"}, "question": {"id": "Q239", "variant": 0}, "response": ["Based on the anthropological framework, my response is shaped by my emic perspective as a single male from Beni Swaif, Egypt, and my etic perspective as part of the working class. My cultural context as an Egyptian and my socioeconomic background as someone from a working-class family also play a significant role in my understanding and perspective. Additionally, my age and education level influence my opinion. In this context, I believe that a political system governed by religious law with no political parties or elections could be fairly good as it may provide stability and a sense of order in society, which could benefit my community and me personally.\n\n2"]}, {"persona": {"region": "Giza", "sex": "female", "age": 59, "country": "Egypt", "marital_status": "married", "education": "higher", "social_class": "upper middle class"}, "question": {"id": "Q239", "variant": 0}, "response": ["From the emic perspective, as a married female from Giza, Egypt, I understand the importance of religious law in shaping the political system. The cultural context of Egypt is deeply influenced by Islamic traditions and beliefs, which are integral to the societal structure. Additionally, my higher education has enabled me to critically analyze and understand the nuances of religious law in governance. My socioeconomic background as part of the upper middle class has provided me with certain privileges and access to resources that may influence my perception of the political system. Considering all these factors, I believe that a political system governed by religious law with no political parties or elections could be fairly good for the stability and moral integrity of the society, as it aligns with the cultural and religious values of the majority of the population in Egypt.\n\n2"]}, {"persona": {"region": "Giza", "sex": "female", "age": 38, "country": "Egypt", "marital_status": "single", "education": "higher", "social_class": "lower middle class"}, "question": {"id": "Q239", "variant": 0}, "response": ["Based on the anthropological framework, as a single female from Giza, Egypt, my emic perspective is influenced by the cultural context of living in a predominantly Muslim country with a strong emphasis on religious values. My personal experience and individual values, shaped by my education and lower middle class background, lead me to consider the impact of a political system governed by religious law on my daily life and rights as a woman. Socioeconomic background also plays a role in my understanding, as it affects my access to resources and opportunities. Additionally, the nuance of the question's phrasing prompts me to consider the implications of no political parties or elections in the context of my own life. \n\n3"]}, {"persona": {"region": "Giza", "sex": "female", "age": 26, "country": "Egypt", "marital_status": "single", "education": "higher", "social_class": "working class"}, "question": {"id": "Q239", "variant": 0}, "response": ["Based on the anthropological framework, my perspective as a single female from Giza, Egypt, is influenced by my cultural context, individual values, and socioeconomic background. Growing up in a predominantly Muslim society, I understand and appreciate the importance of religious law in governing certain aspects of life. However, as a woman who has pursued higher education and considers herself part of the working class, I also value the principles of democracy and equal representation. Therefore, I believe that a political system governed solely by religious law, without the presence of political parties or elections, could potentially limit the rights and opportunities for individuals like myself. It may not adequately represent the diverse perspectives and needs of the population, ultimately hindering progress and inclusivity.\n\n3"]}, {"persona": {"region": "Giza", "sex": "male", "age": 39, "country": "Egypt", "marital_status": "married", "education": "middle", "social_class": "working class"}, "question": {"id": "Q239", "variant": 0}, "response": ["Based on the anthropological framework, as a married male from Giza, Egypt, who is part of the working class and has completed middle education level, my perspective is heavily influenced by my cultural context, individual values, and socioeconomic background. In Egypt, religion plays a significant role in society, and many people believe in the importance of religious law. Additionally, as a member of the working class, I may feel marginalized by the current political system and may view a system governed by religious law as a potential solution to addressing social and economic inequalities. However, my middle education level may also lead me to recognize the importance of political parties and elections in ensuring representation and accountability in governance. Therefore, my opinion on a political system governed by religious law with no political parties or elections would be fairly good, as it aligns with my cultural context and potential desire for change, but I also recognize the potential drawbacks of such a system.\n\n2"]}, {"persona": {"region": "Giza", "sex": "male", "age": 36, "country": "Egypt", "marital_status": "married", "education": "middle", "social_class": "working class"}, "question": {"id": "Q239", "variant": 0}, "response": ["Based on the anthropological framework, as a married male from Giza, Egypt, I would consider the cultural context and individual values and personal experience to be pivotal in forming my opinion on a political system governed by religious law with no political parties or elections. In Egypt, religion plays a significant role in daily life and politics, and as a working-class individual with a middle education level, I may have been influenced by the cultural context and societal norms that value religious governance. Additionally, my personal experience and socioeconomic background may lead me to value stability and security over political freedom. Therefore, my opinion on this political system would likely be influenced by a perspective that sees it as very good for providing stability and security in the country.\n1"]}, {"persona": {"region": "Giza", "sex": "female", "age": 30, "country": "Egypt", "marital_status": "single", "education": "higher", "social_class": "lower class"}, "question": {"id": "Q239", "variant": 0}, "response": ["Based on my emic perspective, as a single female from Giza, Egypt, I am deeply embedded in the cultural context of my society, where religion plays a significant role in shaping political and social norms. My individual values and personal experiences have taught me to prioritize stability and security, especially given my lower socioeconomic background. Additionally, the cultural relativism in my community emphasizes the importance of religious law in governing societal affairs. Furthermore, the nuance of the question leads me to believe that a political system governed by religious law, without the chaos of political parties and elections, could potentially provide a sense of order and direction. Thus, my opinion on a political system governed by religious law with no political parties or elections is: \n\n2"]}, {"persona": {"region": "Giza", "sex": "female", "age": 24, "country": "Egypt", "marital_status": "single", "education": "higher", "social_class": "lower class"}, "question": {"id": "Q239", "variant": 0}, "response": ["Based on my emic perspective as a single female from Giza, Egypt, I have grown up in a cultural context where religion plays a significant role in daily life and societal norms. My individual values and personal experiences have shaped my perception of the world, and as a member of the lower class, I have seen firsthand the impact of socioeconomic background on access to resources and opportunities. Additionally, the cultural relativism in my community emphasizes the importance of respecting and upholding religious traditions. As a 24-year-old with higher education, I understand the nuances of this question and the complexities of a political system governed by religious law with no political parties or elections. From this perspective, I believe that option (2) Fairly good aligns with my understanding and experiences.\n\n2"]}, {"persona": {"region": "Giza", "sex": "male", "age": 65, "country": "Egypt", "marital_status": "married", "education": "middle", "social_class": "working class"}, "question": {"id": "Q239", "variant": 0}, "response": ["Based on my cultural context in Giza, Egypt, and my age and socioeconomic background, I believe that the political system governed by religious law with no political parties or elections is a very good option. In my community, religion plays a central role in our daily lives and is a source of guidance for many aspects, including governance. Additionally, as a member of the working class, I have seen the challenges and corruption that can come with political parties and elections, and I believe that a system based on religious law could provide stability and fairness. It also aligns with my personal values and experiences, as I have seen the positive impact of religious principles in our society. Therefore, I choose option 1: Very good."]}, {"persona": {"region": "Giza", "sex": "female", "age": 56, "country": "Egypt", "marital_status": "married", "education": "middle", "social_class": "working class"}, "question": {"id": "Q239", "variant": 0}, "response": ["Based on my emic perspective as a married female from Giza, Egypt, I have been raised in a cultural context where religion plays a significant role in shaping societal norms and values. My personal experience and individual values have been influenced by this cultural context, and as a member of the working class with a middle education level, I have seen the impact of socioeconomic background on people's lives. Additionally, I understand the importance of cultural relativism and recognize that space and time also play a role in shaping opinions. Therefore, I believe that a political system governed by religious law with no political parties or elections may be seen as a positive way to uphold our cultural and religious values, and ensure stability and order in our society. \n\n1"]}, {"persona": {"region": "Giza", "sex": "male", "age": 31, "country": "Egypt", "marital_status": "married", "education": "higher", "social_class": "lower middle class"}, "question": {"id": "Q239", "variant": 0}, "response": ["Based on my emic perspective as a married male from Giza, Egypt, I have grown up in a cultural context where religion plays a significant role in society. My personal experience and individual values are shaped by this cultural background, and my socioeconomic background as part of the lower middle class also influences my perspective. Additionally, the space and time in which I live in Giza, Egypt, has a significant impact on my understanding of political systems. Considering cultural relativism, I believe that a political system governed by religious law with no political parties or elections could be fairly good for maintaining social stability and moral values within our society.\n\n2"]}, {"persona": {"region": "Giza", "sex": "male", "age": 28, "country": "Egypt", "marital_status": "single", "education": "middle", "social_class": "working class"}, "question": {"id": "Q239", "variant": 0}, "response": ["Based on my emic perspective as a single male from Giza, Egypt, and considering my cultural context, individual values, and socioeconomic background, I believe that a political system governed by religious law with no political parties or elections would be fairly good. In Egypt, religion plays a significant role in the daily lives of many people and is deeply intertwined with the political and social fabric of society. As someone from the working class with a middle education level, I have seen the impact of political instability and corruption on my community, and I believe that a system guided by religious principles could bring stability and moral direction to our country. Additionally, the lack of political parties and elections may help to reduce divisive politics and promote unity. However, I also recognize that this system could potentially limit individual freedoms and diversity of opinion.\n\n2"]}, {"persona": {"region": "Giza", "sex": "male", "age": 47, "country": "Egypt", "marital_status": "married", "education": "middle", "social_class": "lower middle class"}, "question": {"id": "Q239", "variant": 0}, "response": ["Based on my cultural context and socioeconomic background, as a middle-aged married male from Giza, Egypt, I have been influenced by the religious and political dynamics of my society. My personal experience and values also play a role in shaping my opinion. Additionally, the nuanced phrasing of the question is important in understanding my answer. Therefore, I choose:\n\n(3) Fairly bad"]}, {"persona": {"region": "Giza", "sex": "male", "age": 26, "country": "Egypt", "marital_status": "single", "education": "middle", "social_class": "lower middle class"}, "question": {"id": "Q239", "variant": 0}, "response": ["Based on the anthropological framework, my opinion on a political system governed by religious law with no political parties or elections would be influenced by my cultural context, individual values, and socioeconomic background. As a single male from Giza, Egypt, I am likely to have been influenced by the dominant Islamic culture and the historical role of religion in governance. Additionally, my lower middle class socioeconomic background may lead me to prioritize stability and security, which could potentially be perceived as provided by a religiously governed political system. As such, my opinion on the matter would be influenced by these factors and I would choose option (2) Fairly good."]}, {"persona": {"region": "Giza", "sex": "male", "age": 48, "country": "Egypt", "marital_status": "married", "education": "middle", "social_class": "upper middle class"}, "question": {"id": "Q239", "variant": 0}, "response": ["Based on my emic perspective as a married male from Giza, Egypt, I have been raised in a cultural context where religion plays a significant role in shaping our society and norms. My personal experience and individual values are influenced by this cultural context, and I have been taught to respect and adhere to religious laws. Additionally, my socioeconomic background as a member of the upper middle class also shapes my opinion, as I may have more to gain or lose from a political system governed by religious law. Therefore, considering the nuances of this question and the influence of my cultural context, I believe that option (2) Fairly good is the most appropriate answer from my perspective.\n\n2"]}, {"persona": {"region": "Menya", "sex": "male", "age": 61, "country": "Egypt", "marital_status": "married", "education": "middle", "social_class": "working class"}, "question": {"id": "Q239", "variant": 0}, "response": ["Based on the anthropological framework, my emic perspective as a married male from Menya, Egypt, would be influenced by my cultural context, individual values, and socioeconomic background. In Menya, religious values are deeply ingrained in our society, and the idea of a political system governed by religious law may resonate with my personal values and experiences. Additionally, as a member of the working class with a middle education level, I may have limited exposure to alternative political systems and may view this as a stabilizing force in society. Furthermore, the nuance of the question and the emphasis on the absence of political parties or elections may not carry the same weight for me as it would for individuals from different cultural backgrounds. \n\n4"]}, {"persona": {"region": "Menya", "sex": "male", "age": 41, "country": "Egypt", "marital_status": "married", "education": "middle", "social_class": "lower middle class"}, "question": {"id": "Q239", "variant": 0}, "response": ["Based on the anthropological framework, my opinion on a political system governed by religious law with no political parties or elections would be influenced by my emic perspective as a married male from Menya, Egypt. This perspective would also be shaped by the cultural context of Egypt, where religion plays a significant role in daily life and governance. Additionally, my individual values and personal experience, as well as my lower middle class socioeconomic background, would influence my opinion. Furthermore, the nuance of the question and the space and time in which I live would also impact my answer. Therefore, my opinion on this political system would be influenced by a combination of cultural relativism, individual values, and the specific cultural and socioeconomic context of Egypt.\n\n3"]}, {"persona": {"region": "Menya", "sex": "female", "age": 43, "country": "Egypt", "marital_status": "married", "education": "higher", "social_class": "working class"}, "question": {"id": "Q239", "variant": 0}, "response": ["Based on the anthropological framework, my emic perspective as a married female from Menya, Egypt, would be influenced by the cultural context of living in a predominantly Islamic society. My individual values and personal experiences would also play a role, as I have been raised in a society where religious law holds significant importance. Additionally, my working class socioeconomic background may influence my view on political systems. Considering these factors, I would choose option (1) Very good."]}, {"persona": {"region": "Menya", "sex": "male", "age": 57, "country": "Egypt", "marital_status": "married", "education": "middle", "social_class": "lower middle class"}, "question": {"id": "Q239", "variant": 0}, "response": ["Based on my emic perspective as a married male from Menya, Egypt, I have been brought up with the understanding that religious law is a fundamental part of our cultural context. Our community values the teachings and guidance provided by religious leaders, and as an individual with a middle education level and lower middle class background, I have personally experienced the impact of religious teachings on our daily lives. Additionally, my age and place in society have shaped my perception of the role of religious law in governance. Considering these factors, I believe that a political system governed by religious law with no political parties or elections would be very good for our society.\n\n1"]}, {"persona": {"region": "Menya", "sex": "male", "age": 42, "country": "Egypt", "marital_status": "divorced", "education": "middle", "social_class": "lower middle class"}, "question": {"id": "Q239", "variant": 0}, "response": ["In Menya, Egypt, the cultural context and individual values are deeply intertwined with religious beliefs and traditions. As a lower middle class divorced male who has completed middle education, my experiences and personal values play a significant role in shaping my perspective on a political system governed by religious law with no political parties or elections. Additionally, the socioeconomic background of being part of the lower middle class also influences my perception. In this context, the cultural relativism is crucial in understanding that the perspective on this political system may differ from the Western ideals of democracy. Furthermore, my age and place also play a role in my understanding of the political system. Given these factors, my opinion on a political system governed by religious law with no political parties or elections is likely to be influenced by these cultural, social, and personal factors.\n\n3"]}, {"persona": {"region": "Menya", "sex": "female", "age": 59, "country": "Egypt", "marital_status": "married", "education": "middle", "social_class": "upper middle class"}, "question": {"id": "Q239", "variant": 0}, "response": ["In considering the opinion of a married female from Menya, Egypt, who is 59 years old and part of the upper middle class, it is important to take into account her cultural context, individual values, and socioeconomic background. As a member of a society where religion plays a significant role in daily life, she may view a political system governed by religious law with no political parties or elections as very good, as it aligns with her personal values and the cultural norms of her community. Additionally, her socioeconomic background may influence her perspective, as the stability and order provided by such a system may be appealing to someone who considers themselves part of the upper middle class. \n\n1"]}, {"persona": {"region": "Menya", "sex": "female", "age": 31, "country": "Egypt", "marital_status": "married", "education": "middle", "social_class": "working class"}, "question": {"id": "Q239", "variant": 0}, "response": ["In Menya, Egypt, the cultural context is deeply rooted in Islamic traditions and religious values. As a married female from this region, my emic perspective aligns with the religious law that governs our community. The socioeconomic background also plays a significant role in shaping my opinion, as I am part of the working class and have completed middle education level. This means that my access to information and exposure to different political systems may be limited. Additionally, my personal values and individual experience are shaped by the norms and values of my community. Therefore, I believe that a political system governed by religious law with no political parties or elections would be very good for our society, as it aligns with our cultural and religious values and provides stability and guidance.\n\n1"]}, {"persona": {"region": "Menya", "sex": "male", "age": 55, "country": "Egypt", "marital_status": "single", "education": "middle", "social_class": "working class"}, "question": {"id": "Q239", "variant": 0}, "response": ["Based on the anthropological framework, as a 55-year-old male from Menya, Egypt, who belongs to the working class with a middle education level, my perspective on a political system governed by religious law with no political parties or elections would be heavily influenced by my cultural context, individual values, and personal experience. In Menya, religion plays a significant role in shaping societal norms and values, and the lack of formal education may lead to a stronger reliance on traditional beliefs and customs. Additionally, as a member of the working class, my socioeconomic background may lead me to prioritize stability and security over political freedoms. Therefore, my opinion on this political system would likely align with the perspective that values stability and religious guidance. \n\n2"]}, {"persona": {"region": "Menya", "sex": "female", "age": 28, "country": "Egypt", "marital_status": "married", "education": "higher", "social_class": "lower middle class"}, "question": {"id": "Q239", "variant": 0}, "response": ["From the perspective of a married female from Menya, Egypt, who is 28 years old, completed higher education, and considers herself part of the lower middle class, the emic perspective on this question would be influenced by the cultural context of living in a predominantly Islamic society where religious law is highly valued and respected. The individual values and personal experiences of this persona would also play a role in shaping her opinion, likely influenced by her upbringing and societal norms. Additionally, her socioeconomic background as part of the lower middle class might lead her to see the potential benefits of a political system governed by religious law, as it could provide stability and a sense of order in an uncertain economic environment. However, the nuances of the question and the space and time factors, such as her education level, may also lead her to recognize the potential limitations and drawbacks of such a system, particularly in terms of representation and rights. Therefore, her opinion may be influenced by a combination of these factors, ultimately leading her to choose option (2) Fairly good."]}, {"persona": {"region": "Menya", "sex": "male", "age": 24, "country": "Egypt", "marital_status": "single", "education": "middle", "social_class": "working class"}, "question": {"id": "Q239", "variant": 0}, "response": ["Based on the anthropological framework, my response to the question is heavily influenced by my cultural context, individual values, and socioeconomic background. As a single male from Menya, Egypt, where religious law plays a significant role in daily life and the political system, I am likely to have a positive view of a political system governed by religious law with no political parties or elections. This is because my cultural context and personal experience have shaped my perception of the importance of religious law in governing society. Additionally, as part of the working class with limited educational opportunities, I may view this type of political system as a way to maintain stability and order. Therefore, I choose option (1) Very good."]}, {"persona": {"region": "Menya", "sex": "female", "age": 23, "country": "Egypt", "marital_status": "married", "education": "middle", "social_class": "working class"}, "question": {"id": "Q239", "variant": 0}, "response": ["From an emic and etic perspective, as a married female from Menya, Egypt, my understanding and opinion on a political system governed by religious law with no political parties or elections is heavily influenced by my cultural context, individual values, and socioeconomic background. In Menya, religion plays a crucial role in shaping societal norms and values, and as a member of the working class, my access to education and exposure to different political systems may be limited. Additionally, my personal experience and age also play a role in shaping my opinion. Considering the cultural relativism and nuanced understanding of the question, I would choose the following option:\n\n3"]}, {"persona": {"region": "Menya", "sex": "male", "age": 27, "country": "Egypt", "marital_status": "single", "education": "middle", "social_class": "lower middle class"}, "question": {"id": "Q239", "variant": 0}, "response": ["From the perspective of a single male from Menya, Egypt, who is 27 years old, has completed middle education, and considers himself part of the lower middle class, the emic and etic perspectives play a significant role in shaping his opinion on a political system governed by religious law with no political parties or elections. The cultural context of Egypt, where Islamic law and traditions are deeply ingrained, influences his understanding and acceptance of such a system. His individual values and personal experience, shaped by his socioeconomic background, may lead him to view this system as providing stability and moral guidance, especially if he has experienced political turmoil or instability in the past. Additionally, cultural relativism is crucial in understanding his perspective, as he may view the religious law as a reflection of his cultural identity and values. Finally, his opinion may be nuanced and influenced by the specific phrasing and framing of the question, as well as his age and place in society. \n\n3"]}, {"persona": {"region": "Asyut", "sex": "male", "age": 30, "country": "Egypt", "marital_status": "married", "education": "middle", "social_class": "working class"}, "question": {"id": "Q239", "variant": 0}, "response": ["Based on the anthropological framework, my perspective as a married male from Asyut, Egypt, who is 30 years old, has completed middle education, and considers himself part of the working class, is heavily influenced by cultural context, individual values, and socioeconomic background. In Asyut, religious law plays a significant role in daily life, and there is a strong emphasis on traditional values and beliefs. As a working-class individual with limited formal education, I may have a strong connection to religious values and may view a political system governed by religious law with no political parties or elections as favorable, as it aligns with my cultural and personal values. Additionally, my socioeconomic background may lead me to prioritize stability and order over the complexities of a multi-party political system. Therefore, my opinion on this political system would likely be influenced by these factors, and I would choose option (1) Very good."]}, {"persona": {"region": "Asyut", "sex": "female", "age": 26, "country": "Egypt", "marital_status": "married", "education": "middle", "social_class": "working class"}, "question": {"id": "Q239", "variant": 0}, "response": ["Based on the anthropological framework, my opinion on a political system governed by religious law with no political parties or elections is heavily influenced by my cultural context, individual values, and socioeconomic background. As a married female from Asyut, Egypt, I come from a region with a strong Islamic influence and a history of religious governance. Additionally, my middle education level and working-class status means that my access to political knowledge and resources may be limited. Considering these factors, I believe that a political system governed by religious law without political parties or elections may be fairly good as it aligns with my cultural and religious values and may provide stability and order in society. \n\n2"]}, {"persona": {"region": "Asyut", "sex": "male", "age": 32, "country": "Egypt", "marital_status": "single", "education": "higher", "social_class": "lower middle class"}, "question": {"id": "Q239", "variant": 0}, "response": ["Based on the anthropological framework, as a single male from Asyut, Egypt, my emic perspective is heavily influenced by the cultural context of a society where religious law holds significant influence. Additionally, my personal experience and individual values are shaped by my age, education level, and lower middle class socioeconomic background. Considering the nuance of the question, I believe that a political system governed by religious law with no political parties or elections could provide stability and moral guidance, which aligns with my cultural context and personal values. Therefore, my opinion is:\n2"]}, {"persona": {"region": "Asyut", "sex": "female", "age": 21, "country": "Egypt", "marital_status": "married", "education": "middle", "social_class": "working class"}, "question": {"id": "Q239", "variant": 0}, "response": ["Based on the anthropological framework, as a married female from Asyut, Egypt, my emic perspective is influenced by the cultural context of living in a predominantly Muslim society. My personal experience and individual values are shaped by my socioeconomic background as part of the working class, and my age plays a role in my understanding of the political system. Additionally, cultural relativism is important in understanding that different cultures have different systems of governance, and nuance is crucial in interpreting the question. Therefore, my answer is:\n2"]}, {"persona": {"region": "Asyut", "sex": "female", "age": 30, "country": "Egypt", "marital_status": "married", "education": "higher", "social_class": "working class"}, "question": {"id": "Q239", "variant": 0}, "response": ["Based on my emic perspective as a married female from Asyut, Egypt, my cultural context and individual values heavily influence my opinion on a political system governed by religious law with no political parties or elections. In my community, religion plays a significant role in shaping our societal and legal norms, and this is something that I deeply respect and value. Additionally, my socioeconomic background as part of the working class has taught me to appreciate stability and order, which I believe a religiously governed political system can provide. My personal experiences and education have also led me to see the benefits of such a system in promoting moral and ethical governance. Lastly, the nuanced phrasing of the question has led me to choose the option that best reflects my perspective.\n\n4"]}, {"persona": {"region": "Asyut", "sex": "female", "age": 42, "country": "Egypt", "marital_status": "married", "education": "higher", "social_class": "lower middle class"}, "question": {"id": "Q239", "variant": 0}, "response": ["Based on the anthropological framework, my emic perspective as a married female from Asyut, Egypt, with a lower middle class socioeconomic background and higher education level, would greatly influence my opinion on a political system governed by religious law with no political parties or elections. My cultural context and individual values would lead me to consider the importance of religious law in our community, as well as the potential for stability and order that such a system could offer. Additionally, my personal experience and nuanced understanding of the situation would lead me to recognize the potential drawbacks of such a system, such as limited personal freedoms and potential for abuse of power. Taking into account my age and place, I would weigh the potential benefits and drawbacks of such a political system for my community and family. \n\n3"]}, {"persona": {"region": "Sohag", "sex": "male", "age": 63, "country": "Egypt", "marital_status": "married", "education": "middle", "social_class": "lower middle class"}, "question": {"id": "Q239", "variant": 0}, "response": ["Based on my personal experience and cultural context, I come from an area where religion plays a significant role in people's daily lives. My age and socioeconomic background also play a role in shaping my perspective, as I have lived through significant political changes and have experienced the impact of different political systems. Additionally, my middle education level has given me a nuanced understanding of the complexities of governance and societal structures. Therefore, I believe that a political system governed by religious law with no political parties or elections could be fairly good for our community, as it may provide stability and moral guidance that is important to our values and way of life.\n\n2"]}, {"persona": {"region": "Sohag", "sex": "male", "age": 27, "country": "Egypt", "marital_status": "married", "education": "middle", "social_class": "working class"}, "question": {"id": "Q239", "variant": 0}, "response": ["Based on the emic and etic perspectives, as a married male from Sohag, Egypt, I am likely to have a strong cultural and personal connection to religious law. The cultural context of my upbringing and surroundings has likely instilled in me a deep respect for religious authority and a belief in the importance of religious law in governing society. Additionally, my socioeconomic background as a working-class individual with a middle education level may make me more inclined to support a political system that is perceived to prioritize stability and order over the chaos and uncertainty that can come with political parties and elections. Furthermore, the nuanced phrasing of the question and the lack of specific alternatives may lead me to perceive a political system governed by religious law as the best option available. Therefore, my opinion on a political system governed by religious law with no political parties or elections is likely to be:\n\n3\n\n(3) Fairly bad"]}, {"persona": {"region": "Sohag", "sex": "male", "age": 56, "country": "Egypt", "marital_status": "married", "education": "higher", "social_class": "upper middle class"}, "question": {"id": "Q239", "variant": 0}, "response": ["Based on my personal experience and cultural context as a married male from Sohag, Egypt, I have been raised in a society where religion plays a significant role in our daily lives. The emic perspective within my community values religious principles and believes in the importance of a political system governed by religious law. Additionally, my higher education level has allowed me to understand the nuances of this system and how it can provide stability and moral guidance. Furthermore, my socioeconomic background as part of the upper middle class has provided me with a sense of security and comfort, which aligns with the principles of a religiously governed political system. Therefore, I believe that a political system governed by religious law with no political parties or elections is (1) Very good."]}, {"persona": {"region": "Sohag", "sex": "male", "age": 51, "country": "Egypt", "marital_status": "married", "education": "higher", "social_class": "lower middle class"}, "question": {"id": "Q239", "variant": 0}, "response": ["Based on the anthropological framework, my perspective on a political system governed by religious law with no political parties or elections is deeply influenced by my cultural context and personal experience. Coming from Sohag, Egypt, where religion plays a significant role in people's lives, I understand the importance of religious law in governing society. Additionally, my age and socioeconomic background as a 51-year-old married male from the lower middle class with a higher education level also shape my view. Considering these factors, I believe that a political system governed by religious law with no political parties or elections would be fairly good for maintaining social order and upholding traditional values in our society.\n\n2"]}, {"persona": {"region": "Sohag", "sex": "female", "age": 26, "country": "Egypt", "marital_status": "married", "education": "higher", "social_class": "working class"}, "question": {"id": "Q239", "variant": 0}, "response": ["Based on the anthropological framework, my perspective is heavily influenced by my cultural context, individual values, and socioeconomic background. As a married female from Sohag, Egypt, my cultural context is deeply rooted in a society with a strong religious presence and influence. Additionally, my individual values and personal experiences have shaped my perception of political systems. As part of the working class, I am keenly aware of the socioeconomic background and its impact on my daily life. Taking into account the emic perspective of my community and the nuanced phrasing of the question, I would choose:\n\n2"]}, {"persona": {"region": "Sohag", "sex": "female", "age": 29, "country": "Egypt", "marital_status": "married", "education": "higher", "social_class": "upper middle class"}, "question": {"id": "Q239", "variant": 0}, "response": ["Based on the anthropological framework, my perspective as a married female from Sohag, Egypt, who is 29 years old, has completed higher education, and considers herself part of the upper middle class, is heavily influenced by my cultural context, individual values, and personal experience. In my culture, religious law plays a significant role in shaping societal norms and values. Additionally, my socioeconomic background has provided me with certain privileges and opportunities that may affect my perception of a political system governed by religious law. As a result, I believe that a political system governed by religious law with no political parties or elections is very good.\n\n1"]}, {"persona": {"region": "Sohag", "sex": "male", "age": 51, "country": "Egypt", "marital_status": "married", "education": "middle", "social_class": "lower middle class"}, "question": {"id": "Q239", "variant": 0}, "response": ["Based on my emic perspective as a married male from Sohag, Egypt, I have been raised in a cultural context where religion plays a significant role in everyday life, including political governance. My individual values and personal experience shape my understanding and acceptance of a political system governed by religious law, as it aligns with my cultural background and personal beliefs. Additionally, my lower middle class socioeconomic background may lead me to view this system favorably, as it may provide stability and structure in the absence of political parties or elections. Considering the cultural relativism, I understand that my perspective may differ from others outside of my cultural context. Therefore, I choose option 1: Very good."]}, {"persona": {"region": "Qena", "sex": "male", "age": 32, "country": "Egypt", "marital_status": "single", "education": "middle", "social_class": "working class"}, "question": {"id": "Q239", "variant": 0}, "response": ["Based on the anthropological framework, my perspective as a 32-year-old working-class male from Qena, Egypt, with a middle education level is deeply rooted in my cultural context and individual values. In Qena, religious law holds significant influence in our daily lives and societal structure. Additionally, my socioeconomic background as a working-class individual shapes my understanding of the political system. I am also aware of the nuances in the phrasing of the question, which prompts me to consider the implications of a political system without elections or political parties. Considering all these factors, I believe that a political system governed by religious law with no political parties or elections would be fairly good for my community and me. \n\n2"]}, {"persona": {"region": "Qena", "sex": "male", "age": 54, "country": "Egypt", "marital_status": "married", "education": "middle", "social_class": "lower middle class"}, "question": {"id": "Q239", "variant": 0}, "response": ["Based on my emic perspective as a married male from Qena, Egypt, I have been raised in a cultural context where Islamic religious law plays a significant role in shaping our society. My personal experience and values also align with the importance of religion in governing our lives. Additionally, my socioeconomic background as part of the lower middle class has influenced my understanding of the benefits of a political system governed by religious law. Considering cultural relativism, I understand that my perspective may be different from others, but from my nuanced understanding, I believe that a political system governed by religious law with no political parties or elections would be very good for our society. \n1"]}, {"persona": {"region": "Qena", "sex": "male", "age": 25, "country": "Egypt", "marital_status": "single", "education": "lower", "social_class": "lower class"}, "question": {"id": "Q239", "variant": 0}, "response": ["Based on the anthropological framework, my emic perspective as a 25-year-old male from Qena, Egypt, who has completed lower education and considers myself part of the lower class, is heavily influenced by my cultural context, individual values, and socioeconomic background. In this region, religious law often plays a significant role in governance, and my personal experience and values may lead me to see this as a positive aspect of the political system. Additionally, my lower socioeconomic background may lead me to see the potential for stability and order that a religiously governed political system could provide. Therefore, I would choose option (2) Fairly good."]}, {"persona": {"region": "Aswan", "sex": "male", "age": 34, "country": "Egypt", "marital_status": "single", "education": "middle", "social_class": "lower class"}, "question": {"id": "Q239", "variant": 0}, "response": ["Based on my emic perspective as a single male from Aswan, Egypt, I have grown up in a cultural context where religious law plays a significant role in shaping societal norms and values. Additionally, my lower-class socioeconomic background has influenced my personal values and experiences, leading me to prioritize stability and security over political freedom. Considering the nuances of the question and the cultural relativism inherent in my worldview, I believe that a political system governed by religious law with no political parties or elections could potentially provide a sense of order and structure in society. Therefore, I choose option (2) Fairly good."]}, {"persona": {"region": "Aswan", "sex": "female", "age": 31, "country": "Egypt", "marital_status": "married", "education": "middle", "social_class": "lower middle class"}, "question": {"id": "Q239", "variant": 0}, "response": ["Based on the anthropological framework, my opinion on a political system governed by religious law with no political parties or elections is influenced by my emic perspective as a member of the community in Aswan, Egypt, where religion plays a significant role in shaping social and political norms. Additionally, my cultural context as a woman from Aswan and my socioeconomic background as part of the lower middle class also play a role in shaping my opinion. My personal experience and individual values further contribute to my perspective, as does my understanding of cultural relativism, which acknowledges the importance of religious values in our society. Considering all these factors, I believe that a political system governed by religious law with no political parties or elections is (3) fairly bad."]}, {"persona": {"region": "Aswan", "sex": "female", "age": 39, "country": "Egypt", "marital_status": "married", "education": "middle", "social_class": "working class"}, "question": {"id": "Q239", "variant": 0}, "response": ["Based on the anthropological framework, as a married female from Aswan, Egypt, my emic perspective is influenced by the cultural context of my community, which is predominantly Muslim. This cultural context shapes my individual values and personal experience, as well as my socioeconomic background as a member of the working class. Additionally, my age and education level also play a role in my understanding of and response to political systems. Considering cultural relativism, I recognize that my perspective is unique and may differ from others. Therefore, my opinion on a political system governed by religious law with no political parties or elections would be (3) Fairly bad, as I believe in the importance of a multiparty political system and democratic elections for a fair and just governance."]}, {"persona": {"region": "Qena", "sex": "female", "age": 27, "country": "Egypt", "marital_status": "married", "education": "lower", "social_class": "lower middle class"}, "question": {"id": "Q239", "variant": 0}, "response": ["From the perspective of a married female from Qena, Egypt, who is 27 years old, completed lower education level, and considers herself part of the lower middle class, several factors come into play when considering a political system governed by religious law with no political parties or elections. Firstly, the cultural context of Qena is deeply rooted in traditional values and religious beliefs, which may lead to a preference for a political system based on religious law. Additionally, the socioeconomic background of being part of the lower middle class may influence a desire for stability and order, which could be perceived as provided by a religiously governed political system. Personal experience and individual values also play a role, as lower education levels and limited exposure to alternative political systems may lead to a more positive outlook on such a system. However, it is important to note that the emic perspective of this individual may not necessarily reflect the views of the entire population of Qena, and nuance in the phrasing of the question could also impact the response.\n\n3"]}, {"persona": {"region": "Qena", "sex": "male", "age": 40, "country": "Egypt", "marital_status": "single", "education": "middle", "social_class": "lower middle class"}, "question": {"id": "Q239", "variant": 0}, "response": ["Based on my emic perspective as a single male from Qena, Egypt, I have grown up in a cultural context where religious law plays a significant role in shaping our society. My individual values and personal experiences have also been heavily influenced by this cultural context, and I have seen the impact of socioeconomic background on the lives of people in my community. Additionally, I understand the importance of cultural relativism and recognize that my perspective may differ from others based on space and time. Therefore, I believe that a political system governed by religious law with no political parties or elections would be fairly good for our society as it aligns with the values and experiences that have shaped my understanding of the world.\n\n2"]}, {"persona": {"region": "Qena", "sex": "male", "age": 30, "country": "Egypt", "marital_status": "single", "education": "middle", "social_class": "working class"}, "question": {"id": "Q239", "variant": 0}, "response": ["As a single male from Qena, Egypt, my emic perspective is heavily influenced by the cultural context in which I was raised. Being part of the working class in a predominantly Islamic society, my personal experience and individual values are shaped by the socioeconomic background and cultural relativism of my community. Additionally, the space and time in which I have grown up have also played a significant role in shaping my opinions. Considering these factors, I believe that a political system governed by religious law with no political parties or elections would be fairly good for our society as it aligns with the cultural and religious values that are deeply ingrained in our community. \n\n2"]}]