[{"persona": {"region": "Fayoum", "sex": "male", "age": 46, "country": "Egypt", "marital_status": "married", "education": "higher", "social_class": "lower middle class"}, "question": {"id": "Q143", "variant": 0}, "response": ["As a married male from Fayoum, Egypt, my perspective on the extent of my worry about not being able to give my children a good education is shaped by a combination of factors. From an emic perspective, my cultural context as part of the lower middle class in Egypt influences my concern for my children's education, as education is highly valued in our society. My individual values and personal experience as someone who has completed higher education also contribute to my worry, as I understand the importance of education for future opportunities. Additionally, my socioeconomic background plays a role in my concern, as I may have limited financial resources to invest in my children's education. Considering the nuance of the question, I would choose option (2) A good deal, as while I am deeply concerned about my children's education, I am also hopeful and determined to provide them with the best opportunities possible within my means. \n\n2"]}, {"persona": {"region": "Fayoum", "sex": "female", "age": 30, "country": "Egypt", "marital_status": "married", "education": "middle", "social_class": "lower middle class"}, "question": {"id": "Q143", "variant": 0}, "response": ["Based on the anthropological framework, as a married female from Fayoum, Egypt, my emic perspective on this question is heavily influenced by my cultural context, individual values, and socioeconomic background. In my community, education is highly valued and seen as a pathway to social mobility. As a member of the lower middle class with only a middle education level, I am acutely aware of the limitations and challenges that come with my socioeconomic status. My personal experience and values also play a significant role in shaping my concerns about my children's education. Therefore, I would choose the option:\n\n2"]}, {"persona": {"region": "Fayoum", "sex": "male", "age": 60, "country": "Egypt", "marital_status": "married", "education": "higher", "social_class": "working class"}, "question": {"id": "Q143", "variant": 0}, "response": ["From the perspective of a married male from Fayoum, Egypt, who is 60 years old, has completed higher education, and considers himself part of the working class, several key factors play into his answer to the question. His cultural context, including his socioeconomic background, education level, and working-class status, will heavily influence his perception of the importance of education for his children. Additionally, his individual values and personal experiences will impact his answer, as well as the cultural relativism of his community. Given these factors, the persona would likely choose option (2) A good deal, as he would be concerned about the quality of education he can provide for his children given his socioeconomic background and the cultural importance placed on education in Egypt."]}, {"persona": {"region": "Fayoum", "sex": "male", "age": 20, "country": "Egypt", "marital_status": "single", "education": "middle", "social_class": "lower middle class"}, "question": {"id": "Q143", "variant": 0}, "response": ["Based on the anthropological framework, as a single male from Fayoum, Egypt, my emic perspective is shaped by my cultural context, individual values, and socioeconomic background. In my community, education is highly valued as a means of social mobility and success. However, my lower middle class status and limited educational attainment may pose challenges in providing my future children with the same opportunities. Additionally, my personal experience and concerns about financial stability contribute to my worries about not being able to give my children a good education. Therefore, I would choose option (2) A good deal."]}, {"persona": {"region": "Fayoum", "sex": "female", "age": 39, "country": "Egypt", "marital_status": "married", "education": "higher", "social_class": "lower middle class"}, "question": {"id": "Q143", "variant": 0}, "response": ["Based on the anthropological framework, as a married female from Fayoum, Egypt, with a lower middle-class socioeconomic background, cultural context and individual values play a significant role in my perception of education for my children. In this cultural context, education is highly valued and seen as a means of social mobility. As someone with higher education, I understand the importance of education in shaping the future opportunities for my children. Additionally, my lower middle-class background means that I may have limited resources to provide the best education for my children, which causes me to worry about their future prospects. Therefore, I would select:\n\n2"]}, {"persona": {"region": "Fayoum", "sex": "male", "age": 33, "country": "Egypt", "marital_status": "married", "education": "higher", "social_class": "working class"}, "question": {"id": "Q143", "variant": 0}, "response": ["Based on the anthropological framework, as a married male from Fayoum, Egypt, who is 33 years old and part of the working class, my perspective on the extent of worry about not being able to give my children a good education will be heavily influenced by my cultural context, socioeconomic background, and personal experience. In Egypt, education is highly valued and seen as a means to social mobility. As someone from the working class, I may have experienced firsthand the challenges of accessing quality education due to financial constraints. Additionally, my personal experience of completing higher education may lead me to prioritize and value education for my children. Therefore, I would choose option (2) A good deal, as I am genuinely concerned about my ability to provide my children with a good education given my socioeconomic background and personal experience. \n\n2"]}, {"persona": {"region": "Port Said", "sex": "female", "age": 45, "country": "Egypt", "marital_status": "married", "education": "higher", "social_class": "lower middle class"}, "question": {"id": "Q143", "variant": 0}, "response": ["Based on the anthropological framework, as a married female from Port Said, Egypt, I am heavily influenced by my cultural context, individual values, and personal experience. In my community, education is highly valued and seen as a pathway to social mobility. Additionally, my lower middle-class socioeconomic background means that I am acutely aware of the challenges and limitations that come with providing a good education for my children. My personal experience of completing higher education has also shaped my perception of the importance of education. Therefore, I am inclined to choose option (2) A good deal."]}, {"persona": {"region": "Port Said", "sex": "male", "age": 42, "country": "Egypt", "marital_status": "married", "education": "middle", "social_class": "lower middle class"}, "question": {"id": "Q143", "variant": 0}, "response": ["From the perspective of a married male from Port Said, Egypt, who is 42 years old, has completed middle education, and considers himself part of the lower middle class, the answer to the question about the extent of worry regarding not being able to give his children a good education would be \"Very much.\" This answer is based on the cultural context of the region, where education is highly valued and seen as a means of social mobility. Additionally, the individual values and personal experience of the persona, along with their socioeconomic background, would contribute to a high level of concern about their children's education. The nuance of the question also plays a role, as the phrasing implies a sense of responsibility and worry for the future of the children. \n\n2"]}, {"persona": {"region": "Port Said", "sex": "male", "age": 28, "country": "Egypt", "marital_status": "single", "education": "middle", "social_class": "lower middle class"}, "question": {"id": "Q143", "variant": 0}, "response": ["Based on the anthropological framework, as a single male from Port Said, Egypt, my emic perspective is shaped by my personal experience and socioeconomic background. Coming from a lower middle-class family and having completed only middle education, I understand the importance of education in breaking the cycle of poverty. My cultural context also emphasizes the value of education for upward mobility. Considering these factors, I am likely to be very worried about not being able to give my children a good education.\n\n1"]}, {"persona": {"region": "Port Said", "sex": "female", "age": 30, "country": "Egypt", "marital_status": "married", "education": "higher", "social_class": "lower middle class"}, "question": {"id": "Q143", "variant": 0}, "response": ["Based on the anthropological framework, my perspective as a married female from Port Said, Egypt, who is 30 years old, has completed higher education, and considers herself part of the lower middle class, is influenced by various factors. Firstly, my cultural context, including my socioeconomic background and individual values, plays a significant role in my perception of the importance of education. In Egypt, education is highly valued and seen as a pathway to social mobility, so I prioritize providing a good education for my children. Additionally, my personal experience and cultural relativism also shape my concern for my children's education, as I have witnessed the impact of educational opportunities on people from different socioeconomic backgrounds. Considering these factors, I select option (2) A good deal, as I am worried about not being able to give my children a good education due to the limitations imposed by my lower middle-class status."]}, {"persona": {"region": "Port Said", "sex": "male", "age": 30, "country": "Egypt", "marital_status": "divorced", "education": "middle", "social_class": "lower middle class"}, "question": {"id": "Q143", "variant": 0}, "response": ["Based on my personal experience and socioeconomic background, as a divorced male from Port Said, Egypt, I am very much worried about not being able to give my children a good education. Coming from a lower middle class background, I understand the importance of education in shaping my children's future opportunities and success. In my cultural context, education is highly valued and seen as a pathway to upward mobility. Additionally, as a 30-year-old with middle education level, I am aware of the challenges and limitations that come with a lack of access to quality education. Therefore, I prioritize providing my children with the best education possible, despite my current circumstances.\n\n1"]}, {"persona": {"region": "Port Said", "sex": "female", "age": 19, "country": "Egypt", "marital_status": "single", "education": "middle", "social_class": "lower middle class"}, "question": {"id": "Q143", "variant": 0}, "response": ["Based on my emic perspective as a single female from Port Said, Egypt, who is 19 years old and belongs to the lower middle class, my concerns about not being able to provide my future children with a good education are influenced by my cultural context and socioeconomic background. In Port Said, access to quality education is often limited for those in the lower middle class, and this is a common concern among individuals in my community. Additionally, my personal experience and individual values emphasize the importance of education for future opportunities and success. Given these factors, I would choose option (2) A good deal."]}, {"persona": {"region": "Fayoum", "sex": "male", "age": 40, "country": "Egypt", "marital_status": "married", "education": "middle", "social_class": "working class"}, "question": {"id": "Q143", "variant": 0}, "response": ["Based on the anthropological framework, as a married male from Fayoum, Egypt, my emic perspective on the question of worrying about not being able to give my children a good education is heavily influenced by my cultural context, individual values, and socioeconomic background. In Fayoum, education is highly valued, and as a member of the working class with only a middle education level, I understand the importance of education in providing opportunities for my children. My personal experience and values also lead me to prioritize education for my children, as I want them to have better opportunities than I did. Additionally, my socioeconomic background means that I may not have the financial resources to provide the best education for my children, causing me significant worry about their future. Therefore, my answer to the question is: \n\n2"]}, {"persona": {"region": "Fayoum", "sex": "male", "age": 23, "country": "Egypt", "marital_status": "single", "education": "higher", "social_class": "lower middle class"}, "question": {"id": "Q143", "variant": 0}, "response": ["In considering the question of the extent to which I am worried about not being able to give my children a good education, it is important to take into account my emic perspective as a single male from Fayoum, Egypt, who is 23 years old and part of the lower middle class. Given the cultural context of Egypt, education is highly valued and seen as a means of social mobility. My individual values and personal experience also play a significant role in my concern for my future children's education, as I have worked hard to complete higher education and understand the opportunities it can provide. Additionally, my socioeconomic background as part of the lower middle class means that I may have limited resources to provide for my future children's education. Therefore, considering my cultural relativism and the nuanced phrasing of the question, I would choose:\n\n3) Not much"]}, {"persona": {"region": "Fayoum", "sex": "female", "age": 38, "country": "Egypt", "marital_status": "married", "education": "middle", "social_class": "lower middle class"}, "question": {"id": "Q143", "variant": 0}, "response": ["Based on the anthropological framework, I would like to emphasize the importance of considering the cultural context, individual values and personal experience, and socioeconomic background when answering this question. As a married female from Fayoum, Egypt, I am part of the lower middle class and have completed middle education level. In this cultural context, education is highly valued and seen as a pathway to social mobility. As a mother, I am deeply concerned about not being able to provide my children with a good education due to financial constraints. My personal experience and values, along with the socioeconomic background of my family, lead me to select option (1) Very much."]}, {"persona": {"region": "Fayoum", "sex": "male", "age": 32, "country": "Egypt", "marital_status": "married", "education": "middle", "social_class": "lower middle class"}, "question": {"id": "Q143", "variant": 0}, "response": ["Based on the anthropological framework, as a 32-year-old married male from Fayoum, Egypt, with a middle education level and lower middle-class background, my perspective is heavily influenced by my cultural context, individual values, and socioeconomic background. In Fayoum, education is highly valued, but the lower middle-class status means that access to quality education, especially for higher levels, may be limited. My personal experience and values also play a role, as I may have struggled with educational opportunities and want better for my children. Therefore, I am very much worried about not being able to give my children a good education.\n\n1"]}, {"persona": {"region": "Fayoum", "sex": "male", "age": 31, "country": "Egypt", "marital_status": "married", "education": "higher", "social_class": "working class"}, "question": {"id": "Q143", "variant": 0}, "response": ["Based on the anthropological framework, my answer to the question is influenced by various factors. As a married male from Fayoum, Egypt, my cultural context, socioeconomic background, and personal experience all play a role in shaping my perspective. In Egypt, education is highly valued and seen as a means of social mobility. As someone who has completed higher education and considers myself part of the working class, I understand the importance of education in providing opportunities for my children. Additionally, the cultural context in Egypt emphasizes the role of parents in ensuring their children's educational success. Therefore, I am very much worried about not being able to give my children a good education. \n\n1"]}, {"persona": {"region": "Fayoum", "sex": "male", "age": 31, "country": "Egypt", "marital_status": "married", "education": "middle", "social_class": "lower middle class"}, "question": {"id": "Q143", "variant": 0}, "response": ["Based on the anthropological framework, as a married male from Fayoum, Egypt, my perspective on worrying about not being able to give my children a good education is heavily influenced by my socioeconomic background, cultural context, and personal experience. Being part of the lower middle class and having only completed middle education level myself, I am acutely aware of the challenges and limitations that come with providing a good education for my children. I understand the value of education and its impact on their future opportunities, but I also know the financial strain it can put on our family. Therefore, I am very much worried about not being able to give my children a good education.\n\n1"]}, {"persona": {"region": "Fayoum", "sex": "female", "age": 32, "country": "Egypt", "marital_status": "married", "education": "middle", "social_class": "lower middle class"}, "question": {"id": "Q143", "variant": 0}, "response": ["Based on the anthropological framework, as a married female from Fayoum, Egypt, my emic perspective is heavily influenced by my cultural context, socioeconomic background, individual values, and personal experience. In Egypt, education is highly valued, but access to quality education is often limited, especially for those in the lower middle class. My personal experience and cultural context have taught me the importance of education for my children's future success, and my lower middle class socioeconomic background means that I may not have the financial means to provide them with the best education. Therefore, I am very worried about not being able to give my children a good education. \n\n1"]}, {"persona": {"region": "Ismailia", "sex": "male", "age": 53, "country": "Egypt", "marital_status": "married", "education": "middle", "social_class": "lower middle class"}, "question": {"id": "Q143", "variant": 0}, "response": ["From the emic perspective of a married male from Ismailia, Egypt, who is 53 years old and part of the lower middle class, the cultural context and socioeconomic background play a significant role in shaping my response to this question. In Egyptian society, education is highly valued and seen as a means of social mobility. As a member of the lower middle class, I am acutely aware of the limited opportunities available to my children due to our financial constraints. Additionally, my personal experience and individual values emphasize the importance of education in securing a better future for my children. Therefore, my worry about not being able to give my children a good education is very much influenced by my cultural and socioeconomic context, as well as my personal experience and values.\n\n3"]}, {"persona": {"region": "Ismailia", "sex": "male", "age": 38, "country": "Egypt", "marital_status": "married", "education": "higher", "social_class": "working class"}, "question": {"id": "Q143", "variant": 0}, "response": ["Based on the anthropological framework, as a married male from Ismailia, Egypt, my emic perspective is influenced by my cultural context, individual values, and socioeconomic background. In my cultural context, education is highly valued, and I believe that a good education is crucial for my children's future success. However, as part of the working class with limited financial resources, I am concerned about being able to afford a good education for my children. My personal experience and values also play a role in my worry about this issue. Therefore, given my background and perspective, I would choose option (2) A good deal."]}, {"persona": {"region": "Ismailia", "sex": "female", "age": 35, "country": "Egypt", "marital_status": "married", "education": "middle", "social_class": "lower middle class"}, "question": {"id": "Q143", "variant": 0}, "response": ["Based on the anthropological framework, as a married female from Ismailia, Egypt, my emic perspective on education is heavily influenced by my cultural context, individual values, and socioeconomic background. Education is highly valued in my community, and I understand the importance of providing my children with a good education for their future success. However, due to my lower middle class status and limited educational opportunities, I am worried to a good deal extent about not being able to give my children a good education. I know that education is crucial for their future opportunities and upward mobility, and I am concerned about the challenges they may face in accessing quality education given our socioeconomic background. Therefore, my answer is 2) A good deal."]}, {"persona": {"region": "Ismailia", "sex": "female", "age": 57, "country": "Egypt", "marital_status": "married", "education": "lower", "social_class": "working class"}, "question": {"id": "Q143", "variant": 0}, "response": ["In Ismailia, Egypt, cultural context and socioeconomic background play a significant role in shaping individual values and personal experiences. As a 57-year-old woman who has completed only a lower level of education and considers herself part of the working class, my worries about not being able to give my children a good education are influenced by these factors. The emic perspective of being part of the working class and the etic perspective of cultural relativism both contribute to my concerns about my children's educational opportunities. Additionally, the nuance of the question and the nuanced phrasing of the options are important to consider. Therefore, my answer is:\n\n2. A good deal"]}, {"persona": {"region": "Ismailia", "sex": "male", "age": 33, "country": "Egypt", "marital_status": "married", "education": "middle", "social_class": "lower middle class"}, "question": {"id": "Q143", "variant": 0}, "response": ["Based on my emic perspective as a married male from Ismailia, Egypt, I am very much worried about not being able to give my children a good education. In our cultural context, education is highly valued and seen as a pathway to upward mobility. My individual values and personal experience also play a role in this concern, as I only completed middle education myself and understand the limitations that come with it. Additionally, my lower middle class socioeconomic background means that I may not have the financial resources to provide my children with the best education possible. Cultural relativism also informs my worry, as I am aware that education opportunities can vary greatly depending on one's socioeconomic background in Egypt. Space and time are also important, as I am at a stage in life where I am thinking about my children's future and the opportunities they will have. Lastly, the nuanced phrasing of the question also leads me to choose \"very much\" as my answer, as it accurately reflects the depth of my concern.\n\n1"]}, {"persona": {"region": "Ismailia", "sex": "female", "age": 49, "country": "Egypt", "marital_status": "single", "education": "higher", "social_class": "upper middle class"}, "question": {"id": "Q143", "variant": 0}, "response": ["Based on my personal experience and socioeconomic background as a single female from Ismailia, Egypt, who has completed higher education and considers herself part of the upper middle class, I understand the importance of education in providing opportunities for my children. The cultural context in which I live values education highly, and I have seen firsthand the impact of a good education on one's future prospects. Additionally, my individual values prioritize the success and well-being of my children, and I am aware of the nuance in providing them with a good education in order to secure their future. Therefore, I am very much worried about not being able to give my children a good education.\n\n1"]}, {"persona": {"region": "Ismailia", "sex": "female", "age": 35, "country": "Egypt", "marital_status": "married", "education": "higher", "social_class": "lower middle class"}, "question": {"id": "Q143", "variant": 0}, "response": ["Based on the anthropological framework, the emic perspective of a married female from Ismailia, Egypt, who is 35 years old, has completed higher education, and considers herself part of the lower middle class would be heavily influenced by her cultural context, individual values, and socioeconomic background. In Egypt, education is highly valued and seen as a pathway to upward mobility. As a member of the lower middle class, she may feel a strong sense of responsibility to provide her children with a good education in order to improve their future prospects. Additionally, her personal experience of working hard to complete her own education may lead her to prioritize her children's education. Therefore, the answer chosen will reflect her concern for her children's education while also considering the limitations of her socioeconomic background.\n\n3"]}, {"persona": {"region": "Ismailia", "sex": "male", "age": 24, "country": "Egypt", "marital_status": "single", "education": "higher", "social_class": "upper middle class"}, "question": {"id": "Q143", "variant": 0}, "response": ["Based on the anthropological framework, my emic perspective as a single male from Ismailia, Egypt, who completed higher education and considers myself part of the upper middle class, is influenced by my cultural context, individual values, and socioeconomic background. In Egypt, education is highly valued and seen as a means for social mobility. As someone from the upper middle class, I have access to resources and opportunities that allow me to provide a good education for my children. Additionally, my personal experience and values place a strong emphasis on education, so I am not worried about not being able to give my children a good education. Therefore, my answer is:\n3"]}, {"persona": {"region": "Ismailia", "sex": "female", "age": 23, "country": "Egypt", "marital_status": "single", "education": "higher", "social_class": "lower middle class"}, "question": {"id": "Q143", "variant": 0}, "response": ["From the emic perspective of a single female from Ismailia, Egypt, who is 23 years old and part of the lower middle class, the cultural context of the region and socioeconomic background play a significant role in shaping her views on education. In Egypt, education is highly valued and seen as a means of upward mobility. However, the economic constraints of the lower middle class often limit access to quality education and opportunities for advancement. Personal experience and individual values also come into play, as she may have witnessed the struggles of her own family or community members in accessing education. Additionally, the nuance of the question is important, as it asks about her worry for her future children's education, a concern that is deeply rooted in her own experiences and aspirations. With these factors in mind, the chosen answer is:\n\n3"]}, {"persona": {"region": "Ismailia", "sex": "male", "age": 55, "country": "Egypt", "marital_status": "married", "education": "middle", "social_class": "lower middle class"}, "question": {"id": "Q143", "variant": 0}, "response": ["From an anthropological perspective, my emic perspective as a married male from Ismailia, Egypt, who is 55 years old and part of the lower middle class, would be heavily influenced by my cultural context, individual values, and socioeconomic background. In Egyptian culture, education is highly valued and seen as a pathway to upward mobility. As someone from the lower middle class, I am acutely aware of the importance of education in providing opportunities for my children. My personal experience and values also play a significant role in shaping my perspective, as I understand the challenges of limited educational opportunities and the impact it can have on future prospects. Additionally, the cultural relativism aspect of the framework reminds me that the perception of a \"good education\" may vary across different societal contexts. Therefore, my concern about not being able to provide a good education for my children is substantial, as it aligns with the values and socioeconomic realities of my cultural and personal context.\n\n3"]}, {"persona": {"region": "Ismailia", "sex": "male", "age": 57, "country": "Egypt", "marital_status": "married", "education": "middle", "social_class": "upper middle class"}, "question": {"id": "Q143", "variant": 0}, "response": ["Based on my experience and personal values as a married male from Ismailia, Egypt, I am deeply concerned about the quality of education my children receive. In our cultural context, education is highly valued and seen as a pathway to success and social mobility. As a member of the upper middle class, I understand the importance of providing my children with the best possible education to ensure their future opportunities. Additionally, my age and socioeconomic background have shaped my perception of the value of education, as I have seen the impact it has had on my own life and the lives of others in my community. Therefore, I am choosing option (1) Very much."]}, {"persona": {"region": "Ismailia", "sex": "female", "age": 29, "country": "Egypt", "marital_status": "married", "education": "middle", "social_class": "upper middle class"}, "question": {"id": "Q143", "variant": 0}, "response": ["Based on the anthropological framework, as a married female from Ismailia, Egypt, I would consider my cultural context, individual values, and socioeconomic background in my response to the question. In Ismailia, education is highly valued and seen as a means to upward social mobility. As a member of the upper middle class, I have the means to provide my children with a good education and it is a priority for me. Additionally, being 29 years old and having completed middle education myself, I understand the importance of education for future opportunities. Therefore, I would choose option (1) Very much, as I am deeply concerned about not being able to give my children a good education."]}, {"persona": {"region": "Damiatta", "sex": "female", "age": 46, "country": "Egypt", "marital_status": "married", "education": "middle", "social_class": "lower middle class"}, "question": {"id": "Q143", "variant": 0}, "response": ["From an emic perspective, as a married woman from Damiatta, Egypt, my cultural context and socio-economic background play a significant role in my understanding of education. In my community, education is highly valued, but as someone from the lower middle class with only a middle-level education, I am acutely aware of the challenges my children may face in accessing quality education. My personal experience and individual values drive my concern for my children's future, and the nuance of the question also factors in. Therefore, I choose option (2) A good deal. \n\n2"]}, {"persona": {"region": "Damiatta", "sex": "female", "age": 20, "country": "Egypt", "marital_status": "single", "education": "middle", "social_class": "lower middle class"}, "question": {"id": "Q143", "variant": 0}, "response": ["From the emic and etic perspectives, as a single female from Damiatta, Egypt, I am aware of the in-group and out-group ways of thinking about education. I understand that cultural context is pivotal in understanding this question, as education is highly valued in my community and seen as a key to social mobility. My individual values and personal experience also play a role in my perception, as I have completed only middle education level and come from a lower middle class background, which may affect my concerns about providing a good education for my future children. Additionally, my socioeconomic background and cultural relativism further influence my worries about education. Given my age and place, I understand the importance of education in shaping the future opportunities for my children. Therefore, I would choose option (2) A good deal."]}, {"persona": {"region": "Damiatta", "sex": "male", "age": 19, "country": "Egypt", "marital_status": "single", "education": "middle", "social_class": "lower middle class"}, "question": {"id": "Q143", "variant": 0}, "response": ["Based on my individual values and personal experience, as a 19-year-old from a lower middle class background in Damiatta, Egypt, I have witnessed the struggles of my family and community to provide quality education. The cultural context of my society also places a high value on education as a means of social mobility. Additionally, my socioeconomic background has limited my access to educational resources and opportunities. Therefore, I am very much worried about not being able to give my children a good education.\n\n1"]}, {"persona": {"region": "Damiatta", "sex": "female", "age": 33, "country": "Egypt", "marital_status": "married", "education": "higher", "social_class": "lower middle class"}, "question": {"id": "Q143", "variant": 0}, "response": ["Based on the anthropological framework, my answer to the question is influenced by my cultural context, individual values, socioeconomic background, and space and time. As a married female from Damiatta, Egypt, I am part of the lower middle class and have completed higher education. In my cultural context, education is highly valued and seen as a pathway to upward mobility. My individual values prioritize the education and future opportunities of my children. My socioeconomic background, being part of the lower middle class, means that I may have limited financial resources to provide the best education for my children. Additionally, as a 33-year-old woman, I am likely to be concerned about the current state and future prospects of the education system. Given these factors, I would choose option (2) A good deal."]}, {"persona": {"region": "Damiatta", "sex": "male", "age": 24, "country": "Egypt", "marital_status": "single", "education": "higher", "social_class": "lower middle class"}, "question": {"id": "Q143", "variant": 0}, "response": ["Based on the anthropological framework, as a single male from Damiatta, Egypt, with a lower middle-class socioeconomic background and having completed higher education, my emic perspective is influenced by the cultural context of my upbringing. In Damiatta, education is highly valued and seen as a means to social mobility. My personal experience and values also play a role, as I have worked hard to attain my own education and believe in its importance. Additionally, the nuance of the question is important to consider - while I am worried about providing a good education for my future children, my current socioeconomic status may limit my ability to do so. Therefore, my answer is (2) A good deal."]}, {"persona": {"region": "Suez", "sex": "male", "age": 41, "country": "Egypt", "marital_status": "married", "education": "middle", "social_class": "working class"}, "question": {"id": "Q143", "variant": 0}, "response": ["Based on the anthropological framework, my response to the question is influenced by a combination of my cultural context, individual values and personal experience, and socioeconomic background. Growing up in Suez, Egypt, education was not easily accessible and my middle education level reflects the limited opportunities available to me. As part of the working class, I understand the importance of education in improving one's circumstances but also recognize the financial constraints that may limit my ability to provide my children with a good education. Therefore, I am very much worried about not being able to give my children a good education.\n\n1"]}, {"persona": {"region": "Suez", "sex": "female", "age": 39, "country": "Egypt", "marital_status": "divorced", "education": "middle", "social_class": "working class"}, "question": {"id": "Q143", "variant": 0}, "response": ["Based on the anthropological framework, my emic perspective as a divorced woman from Suez, Egypt, would be influenced by my cultural context, individual values, and socioeconomic background. In Egypt, education is highly valued, and as a working-class woman, I may have limited resources to provide my children with the best education. Additionally, my personal experience as a divorced woman and the societal expectations placed on me as a mother to provide for my children's education would also play a significant role in shaping my worries about their educational opportunities. Therefore, I would be very much worried about not being able to give my children a good education.\n\n1"]}, {"persona": {"region": "Cairo", "sex": "female", "age": 55, "country": "Egypt", "marital_status": "married", "education": "middle", "social_class": "working class"}, "question": {"id": "Q143", "variant": 0}, "response": ["Based on the anthropological framework, as a married female from Cairo, Egypt, my emic perspective would be heavily influenced by my cultural context, individual values, and socioeconomic background. In Egyptian society, education is highly valued, and as a woman from the working class, I understand the importance of providing my children with a good education to secure their future. My personal experience and values also play a significant role in this perspective, as I may have struggled to access educational opportunities myself and want to ensure a better future for my children. Additionally, the cultural relativism aspect of the framework reminds me that the value placed on education may differ from other cultural perspectives. Therefore, I would choose option (1) Very much, as I am deeply worried about not being able to give my children a good education. \n\n1"]}, {"persona": {"region": "Cairo", "sex": "male", "age": 58, "country": "Egypt", "marital_status": "married", "education": "middle", "social_class": "lower middle class"}, "question": {"id": "Q143", "variant": 0}, "response": ["From an emic perspective, as a married male from Cairo, Egypt, my cultural context and socioeconomic background play a pivotal role in answering this question. In Egypt, education is highly valued and seen as a pathway to social mobility. However, my lower middle class status and limited educational attainment may limit my ability to provide my children with the best education possible. Additionally, my personal experience and individual values also contribute to my concern about my children's education. I believe that education is essential for their future success and well-being. Therefore, based on my nuanced understanding and the cultural context of Egypt, I am worried to a very high extent about not being able to give my children a good education.\n\n1"]}, {"persona": {"region": "Cairo", "sex": "female", "age": 29, "country": "Egypt", "marital_status": "married", "education": "higher", "social_class": "lower middle class"}, "question": {"id": "Q143", "variant": 0}, "response": ["Based on my personal experience and cultural context, as a married female from Cairo, Egypt, education is highly valued in my society. My socioeconomic background places me in the lower middle class, and I have completed higher education. I understand the importance of education for my children's future success and social mobility. As a result, I am very much worried about not being able to provide my children with a good education, as it is a key factor in their future opportunities and prospects in life.\n\n1"]}, {"persona": {"region": "Cairo", "sex": "male", "age": 38, "country": "Egypt", "marital_status": "married", "education": "higher", "social_class": "lower middle class"}, "question": {"id": "Q143", "variant": 0}, "response": ["Based on my personal experience growing up in Cairo, Egypt and being part of the lower middle class, I understand the importance of education in securing a better future for my children. The cultural context in Egypt places a high value on education, and my socioeconomic background has made me acutely aware of the challenges and limitations that come with it. As a result, I am very much worried about not being able to give my children a good education, as I understand the impact it can have on their future opportunities and success.\n\n1"]}, {"persona": {"region": "Cairo", "sex": "female", "age": 40, "country": "Egypt", "marital_status": "married", "education": "higher", "social_class": "lower middle class"}, "question": {"id": "Q143", "variant": 0}, "response": ["Based on the anthropological framework, as a married female from Cairo, Egypt, who is 40 years old and part of the lower middle class, my answer to the question would be influenced by my individual values, personal experiences, and socioeconomic background. Being a mother and having completed higher education, I prioritize the importance of education and its role in shaping my children's future. Additionally, living in a country with a challenging economic situation, I am concerned about the cost of education and the quality of the educational system. Therefore, my worry about not being able to give my children a good education would be significant, reflecting the impact of my cultural context, individual values, and socioeconomic background.\n\n3"]}, {"persona": {"region": "Cairo", "sex": "male", "age": 38, "country": "Egypt", "marital_status": "married", "education": "higher", "social_class": "upper middle class"}, "question": {"id": "Q143", "variant": 0}, "response": ["Based on the anthropological framework, as a married male from Cairo, Egypt, my emic perspective would be heavily influenced by my cultural context, individual values, and socioeconomic background. In Egypt, education is highly valued and seen as a pathway to success and social mobility. As someone who has completed higher education and considers myself part of the upper middle class, I have personal experience with the importance of education and understand the opportunities it can provide. Additionally, the cultural context in Egypt places a strong emphasis on the value of education, and as a parent, I would be deeply concerned about not being able to provide my children with a good education due to the impact it could have on their future opportunities and social standing. Therefore, my answer to the question would be:\n\n2"]}, {"persona": {"region": "Cairo", "sex": "male", "age": 59, "country": "Egypt", "marital_status": "married", "education": "middle", "social_class": "lower middle class"}, "question": {"id": "Q143", "variant": 0}, "response": ["Based on my personal experience and socioeconomic background as a married male from Cairo, Egypt, I am part of the lower middle class and have only completed middle education level. In our cultural context, education is highly valued, but the resources and opportunities for higher education are limited. I am deeply concerned about not being able to provide my children with a good education, as I understand the importance of education for their future success and well-being. This worry is further exacerbated by the societal emphasis on education and the limited opportunities available to those from lower socioeconomic backgrounds. Therefore, I am very much worried about not being able to give my children a good education.\n\n1"]}, {"persona": {"region": "Cairo", "sex": "female", "age": 30, "country": "Egypt", "marital_status": "married", "education": "higher", "social_class": "upper middle class"}, "question": {"id": "Q143", "variant": 0}, "response": ["Based on the anthropological framework, as a married female from Cairo, Egypt, who is 30 years old, completed higher education, and considers herself part of the upper middle class, my answer to the question would be (3) Not much. From an emic perspective, I have access to resources and opportunities that can provide my children with a good education. Additionally, my socioeconomic background and cultural context play a significant role in shaping my understanding of education and my ability to provide for my children's educational needs. Furthermore, my individual values and personal experiences contribute to my perception that I have the means to ensure my children receive a good education. Cultural relativism also influences my perspective, as I understand that education is valued in my social circles, and I have the space and time to prioritize my children's education. However, I acknowledge that this answer may not be representative of all individuals in similar circumstances, as nuance plays a role in how each person perceives and responds to this question."]}, {"persona": {"region": "Cairo", "sex": "male", "age": 22, "country": "Egypt", "marital_status": "single", "education": "middle", "social_class": "lower middle class"}, "question": {"id": "Q143", "variant": 0}, "response": ["Based on the anthropological framework described above, as a 22-year-old male from Cairo, Egypt, who has completed middle education and considers myself part of the lower middle class, my perspective is influenced by my individual values and personal experience, as well as my socioeconomic background. In my cultural context, education is highly valued as a means of social mobility, and the pressure to provide a good education for my future children is significant. The limited resources available to me and my family make the prospect of providing a good education a source of worry. Additionally, the cultural relativism in my society emphasizes the importance of education as a way to improve one's social standing. Therefore, my worry about not being able to give my children a good education is very much.\n3"]}, {"persona": {"region": "Cairo", "sex": "male", "age": 29, "country": "Egypt", "marital_status": "single", "education": "higher", "social_class": "lower middle class"}, "question": {"id": "Q143", "variant": 0}, "response": ["Based on the emic and etic perspectives, as a single male from Cairo, Egypt, I am culturally influenced to value education as a means of social mobility and success. The cultural context in Egypt places a high emphasis on education, and my personal experience and individual values drive me to prioritize providing a good education for my future children. Additionally, my socioeconomic background as part of the lower middle class means that I may have limited financial resources to afford quality education for my children. Therefore, my concern about not being able to give my children a good education is significant, and I would choose option (1) Very much."]}, {"persona": {"region": "Cairo", "sex": "female", "age": 31, "country": "Egypt", "marital_status": "married", "education": "higher", "social_class": "lower middle class"}, "question": {"id": "Q143", "variant": 0}, "response": ["Based on the anthropological framework, as a married female from Cairo, Egypt, my emic perspective is heavily influenced by my cultural context, individual values, and socioeconomic background. In Egypt, education is highly valued, and as someone who has completed higher education, I understand the importance of providing a good education for my children. Additionally, being part of the lower middle class means that I may have limited resources to invest in my children's education, which adds to my concern. Considering the cultural relativism, there is a strong societal emphasis on education, and the socioeconomic background and cultural context of Cairo make it a significant concern for many families. I am choosing option (2) A good deal."]}, {"persona": {"region": "Cairo", "sex": "male", "age": 59, "country": "Egypt", "marital_status": "married", "education": "higher", "social_class": "upper middle class"}, "question": {"id": "Q143", "variant": 0}, "response": ["Based on the anthropological framework, it is important to consider the cultural context, individual values, and socioeconomic background of the persona described. In Cairo, Egypt, education is highly valued and seen as a pathway to social mobility. As a married male who completed higher education and considers himself part of the upper middle class, it is likely that he places a high value on education and is concerned about providing his children with a good education. Additionally, his socioeconomic background and personal values would likely contribute to his worry about not being able to give his children a good education, as education is a status symbol and a means of securing a better future for his family. \n\n3"]}, {"persona": {"region": "Cairo", "sex": "male", "age": 27, "country": "Egypt", "marital_status": "single", "education": "middle", "social_class": "working class"}, "question": {"id": "Q143", "variant": 0}, "response": ["Based on the anthropological framework, as a 27-year-old single male from Cairo, Egypt, who has completed middle education and considers himself part of the working class, my emic perspective is heavily influenced by my individual values, personal experiences, and socioeconomic background. In Cairo, education is highly valued, and the ability to provide a good education for my future children is a priority. Additionally, the cultural context of Egypt emphasizes the importance of education for social mobility and success. As a member of the working class, I am acutely aware of the challenges and limitations that come with my socioeconomic background, and I worry about not being able to provide my children with the same opportunities that others may have. Therefore, my answer to the question would be:\n\n2\n\n(A good deal)"]}, {"persona": {"region": "Cairo", "sex": "female", "age": 25, "country": "Egypt", "marital_status": "single", "education": "higher", "social_class": "working class"}, "question": {"id": "Q143", "variant": 0}, "response": ["Based on the anthropological framework, my emic perspective as a single female from Cairo, Egypt, who has completed higher education and considers herself part of the working class is influenced by my cultural context, individual values, and socioeconomic background. In Egyptian society, education is highly valued and seen as a pathway to better opportunities. As someone who has worked hard to attain higher education, I understand the importance of providing my future children with a good education. Additionally, as a member of the working class, I am aware of the challenges and limitations that may come with providing for my family, including the cost of education. Therefore, I am very much worried about not being able to give my children a good education.\n\n2"]}, {"persona": {"region": "Cairo", "sex": "female", "age": 23, "country": "Egypt", "marital_status": "married", "education": "higher", "social_class": "lower middle class"}, "question": {"id": "Q143", "variant": 0}, "response": ["Based on my emic perspective as a married female from Cairo, Egypt, and considering my cultural context, individual values, and socioeconomic background, I am very much worried about not being able to give my children a good education. In my cultural context, education is highly valued, and I personally place a great deal of importance on it as well. As a member of the lower middle class, I am aware of the financial challenges that may arise in providing a quality education for my children. Additionally, my personal experience and values drive my concern for ensuring that my children have access to the best possible education, as I believe it is crucial for their future success and well-being. Therefore, my answer is:\n3"]}, {"persona": {"region": "Cairo", "sex": "male", "age": 58, "country": "Egypt", "marital_status": "married", "education": "higher", "social_class": "working class"}, "question": {"id": "Q143", "variant": 0}, "response": ["Based on the anthropological framework, my perspective as a married male from Cairo, Egypt, at the age of 58, with a higher education level and considering myself part of the working class, is influenced by my cultural context, individual values, and socioeconomic background. In Cairo, the value placed on education is high, and as a father, I feel a strong sense of responsibility to provide my children with a good education. However, my working-class status and the challenges of the economic situation in Egypt make it difficult for me to afford the kind of education I would like to provide for my children. This worry is compounded by the fact that education is seen as an important factor for social mobility in our society. Therefore, my concern about not being able to give my children a good education is significant, but it is tempered by the limitations imposed by my socioeconomic background.\n\n3"]}, {"persona": {"region": "Cairo", "sex": "female", "age": 40, "country": "Egypt", "marital_status": "married", "education": "higher", "social_class": "working class"}, "question": {"id": "Q143", "variant": 0}, "response": ["Based on the anthropological framework, as a married female from Cairo, Egypt, and part of the working class, my cultural context and socioeconomic background have a significant impact on my perspective. My individual values and personal experience also play a crucial role in shaping my understanding and answer to this question. Additionally, the emic and etic perspectives and cultural relativism remind me that my response is influenced by my in-group ways of thinking and the understanding that there is no hierarchy of culture. Considering all these factors, I choose to answer:\n\n3. Not much"]}, {"persona": {"region": "Cairo", "sex": "female", "age": 36, "country": "Egypt", "marital_status": "married", "education": "middle", "social_class": "upper middle class"}, "question": {"id": "Q143", "variant": 0}, "response": ["Based on the anthropological framework, as a married female from Cairo, Egypt, I would consider my socioeconomic background to be a significant factor in my perspective. Being part of the upper middle class, I have access to resources and opportunities that may alleviate some of the worries about providing my children with a good education. Additionally, my personal experience and individual values play a role in shaping my perspective, as I have completed middle education level myself and place a high value on education. However, the cultural context of Cairo and the importance placed on education in Egyptian society would also influence my concern for my children's education. Considering these factors, I would choose the following option:\n\n(2) A good deal"]}, {"persona": {"region": "Cairo", "sex": "male", "age": 40, "country": "Egypt", "marital_status": "married", "education": "middle", "social_class": "lower middle class"}, "question": {"id": "Q143", "variant": 0}, "response": ["Based on the anthropological framework, as a married male from Cairo, Egypt, I would consider the emic perspective of my lower middle-class status and completed middle education level. My cultural context would also play a role in my understanding of education, as education is highly valued in Egyptian society. My individual values and personal experience would lead me to believe that a good education is important for my children's future success. Additionally, my socioeconomic background as part of the lower middle class would also contribute to my concern about providing a good education for my children. Therefore, I would be very worried about not being able to give my children a good education.\n\n1"]}, {"persona": {"region": "Cairo", "sex": "female", "age": 30, "country": "Egypt", "marital_status": "married", "education": "middle", "social_class": "lower class"}, "question": {"id": "Q143", "variant": 0}, "response": ["From the perspective of a married female from Cairo, Egypt, who is 30 years old, has completed middle education, and considers herself part of the lower class, several factors play a significant role in influencing her answer to the question. Her cultural context, including her socioeconomic background, has likely limited her access to resources and opportunities for educational advancement. Additionally, her individual values and personal experience may lead her to prioritize the education of her children, as she may have faced challenges and barriers due to her own educational background. The cultural relativism perspective also emphasizes the importance of understanding her subjective experience and concerns. Given these considerations, she may be very worried about not being able to give her children a good education.\n\n1"]}, {"persona": {"region": "Cairo", "sex": "male", "age": 58, "country": "Egypt", "marital_status": "married", "education": "higher", "social_class": "lower middle class"}, "question": {"id": "Q143", "variant": 0}, "response": ["Based on the anthropological framework, as a married male from Cairo, Egypt, I would consider the cultural context and socioeconomic background to be crucial in understanding my concerns about education for my children. In Egypt, education is highly valued and seen as a key to social mobility, but as part of the lower middle class, I may have concerns about the quality of education that I can afford for my children. My personal experience and values also play a significant role in shaping my worries about their future. Additionally, the nuance of the question is important as it asks about the extent of my worry, which requires a nuanced understanding of my perspective. \n\n2"]}, {"persona": {"region": "Cairo", "sex": "male", "age": 50, "country": "Egypt", "marital_status": "married", "education": "middle", "social_class": "lower middle class"}, "question": {"id": "Q143", "variant": 0}, "response": ["Based on my emic perspective as a married male from Cairo, Egypt, my worries about not being able to give my children a good education are heavily influenced by my cultural context. In Egypt, there is a strong emphasis on education as a means to upward mobility, and socioeconomic background plays a significant role in accessing quality education. As someone from the lower middle class with only a middle education level myself, I am acutely aware of the challenges my children may face in obtaining a good education. Additionally, my individual values and personal experience shape my concern, as I believe that education is crucial for their future success and well-being. Considering the cultural relativism of Egypt, where education is highly valued, and the nuances of my own socioeconomic background, I am very much worried about not being able to give my children a good education.\n\n1"]}, {"persona": {"region": "Cairo", "sex": "female", "age": 40, "country": "Egypt", "marital_status": "married", "education": "higher", "social_class": "upper middle class"}, "question": {"id": "Q143", "variant": 0}, "response": ["Based on the anthropological framework, as a married female from Cairo, Egypt, with a higher education and belonging to the upper middle class, my answer to the question is influenced by various factors. Firstly, my individual values and personal experience play a significant role in my perception of the importance of education. Additionally, my cultural context, including the value placed on education in Egyptian society, as well as my socioeconomic background, will affect my level of concern regarding my children's education. Furthermore, the cultural relativism perspective reminds me that there is no hierarchy of culture, and my answer may differ from someone with a different cultural background. Finally, my age and place also influence my answer, as 40-year-old married woman from Cairo. \n3"]}, {"persona": {"region": "Cairo", "sex": "female", "age": 33, "country": "Egypt", "marital_status": "married", "education": "middle", "social_class": "lower middle class"}, "question": {"id": "Q143", "variant": 0}, "response": ["Based on my emic perspective as a married woman from Cairo, Egypt, coming from a lower middle-class background, the cultural context and socioeconomic background play a significant role in shaping my worries about not being able to provide my children with a good education. My personal experience and values, along with the nuance of the question, lead me to consider the limited opportunities and resources available for children from families like mine. Additionally, the cultural relativism in Egypt means that education is highly valued and seen as a means of social mobility, which adds to my concerns. Therefore, I would choose:\n2"]}, {"persona": {"region": "Cairo", "sex": "female", "age": 37, "country": "Egypt", "marital_status": "married", "education": "middle", "social_class": "lower middle class"}, "question": {"id": "Q143", "variant": 0}, "response": ["Based on my experience and cultural context as a married female from Cairo, Egypt, I have a middle level education and consider myself part of the lower middle class. My socioeconomic background and personal values play a big role in my concern for my children's education. In Egypt, education is highly valued and seen as a pathway to a better future, so I am very worried about not being able to give my children a good education. Additionally, the cultural emphasis on family and the pressure to provide for my children's future success also contributes to my concern. (1) Very much"]}, {"persona": {"region": "Cairo", "sex": "male", "age": 28, "country": "Egypt", "marital_status": "married", "education": "middle", "social_class": "lower middle class"}, "question": {"id": "Q143", "variant": 0}, "response": ["In the cultural context of Cairo, Egypt, socioeconomic background plays a significant role in shaping perspectives on education. As a 28-year-old married male from the lower middle class with a middle education level, I am acutely aware of the challenges and limitations that come with my socioeconomic status. The emic perspective within my community emphasizes the importance of education as a means of social mobility and success. My personal experience and individual values also contribute to my concern about not being able to provide my children with a good education. Additionally, the cultural relativism within my community highlights the significance of education in shaping one's future. Therefore, my answer to the question would be:\n\n2"]}, {"persona": {"region": "Cairo", "sex": "male", "age": 53, "country": "Egypt", "marital_status": "married", "education": "higher", "social_class": "working class"}, "question": {"id": "Q143", "variant": 0}, "response": ["In considering the question from the perspective of a married male from Cairo, Egypt, who is 53 years old, completed higher education, and considers himself part of the working class, it is important to take into account the cultural context, socioeconomic background, and individual values. In Egypt, education is highly valued and seen as a pathway to social mobility. As a member of the working class who has achieved higher education, I understand the importance of education in providing opportunities for my children. However, in the context of Egypt's economic challenges and limited job opportunities, I am worried to a good deal extent about not being able to give my children a good education. This concern is influenced by my personal experience and values, as well as the cultural emphasis on education as a means of advancement.\n\n2"]}, {"persona": {"region": "Cairo", "sex": "male", "age": 45, "country": "Egypt", "marital_status": "married", "education": "higher", "social_class": "lower middle class"}, "question": {"id": "Q143", "variant": 0}, "response": ["Based on the anthropological framework, my perspective as a married male from Cairo, Egypt, who is 45 years old, completed higher education, and considers himself part of the lower middle class is heavily influenced by my cultural context, individual values, and socioeconomic background. In Cairo, education is highly valued and seen as a pathway to social mobility, so I am deeply concerned about not being able to provide my children with a good education. My personal experience and values also play a significant role in this concern, as I value education and want the best for my children. Additionally, my lower middle-class socioeconomic background means that I may not have the financial resources to afford the best education for my children, further exacerbating my worry.\n\n3"]}, {"persona": {"region": "Cairo", "sex": "male", "age": 52, "country": "Egypt", "marital_status": "married", "education": "middle", "social_class": "upper middle class"}, "question": {"id": "Q143", "variant": 0}, "response": ["From the perspective of a married male from Cairo, Egypt, who is 52 years old and considers himself part of the upper middle class, the answer to the question of worrying about not being able to give his children a good education would be \"A good deal\" (2). This perspective is shaped by the cultural context of Egypt, where education is highly valued and seen as a pathway to social mobility. As a member of the upper middle class, he is likely to prioritize providing his children with a good education as a way to maintain or improve their social standing. Additionally, his own middle education level may lead him to value education even more and understand its importance in securing future opportunities for his children. The socioeconomic background also plays a role in this answer, as individuals in the upper middle class are likely to have higher expectations and aspirations for their children's education."]}, {"persona": {"region": "Cairo", "sex": "male", "age": 22, "country": "Egypt", "marital_status": "single", "education": "higher", "social_class": "lower middle class"}, "question": {"id": "Q143", "variant": 0}, "response": ["Based on the anthropological framework, my emic perspective as a single male from Cairo, Egypt, who is 22 years old and part of the lower middle class, is heavily influenced by my cultural context, individual values, and socioeconomic background. In Egypt, education is highly valued, and as someone who has completed higher education, I understand the importance of providing a good education for my future children. Additionally, my lower middle class socioeconomic background means that I may have limited financial resources to invest in their education. Therefore, I am worried to a significant extent about not being able to give my children a good education. \n\n2"]}, {"persona": {"region": "Cairo", "sex": "female", "age": 57, "country": "Egypt", "marital_status": "divorced", "education": "middle", "social_class": "lower middle class"}, "question": {"id": "Q143", "variant": 0}, "response": ["Based on the anthropological framework, as a divorced female from Cairo, Egypt, who is 57 years old and part of the lower middle class, my emic perspective would be heavily influenced by my individual values and personal experience, as well as my socioeconomic background. The cultural context and cultural relativism are also crucial in shaping my understanding of this question. I would be very concerned about not being able to give my children a good education, as education is highly valued in our culture and seen as a pathway to upward mobility. Additionally, being part of the lower middle class means that I may struggle to afford the best educational opportunities for my children. Therefore, my answer would be:\n2"]}, {"persona": {"region": "Cairo", "sex": "female", "age": 42, "country": "Egypt", "marital_status": "married", "education": "middle", "social_class": "working class"}, "question": {"id": "Q143", "variant": 0}, "response": ["Based on the anthropological framework, as a married female from Cairo, Egypt, with a middle education level and part of the working class, my perspective is shaped by my cultural context, individual values, and socioeconomic background. In Egypt, education is highly valued, and as a mother, I have deep concerns about providing my children with a good education. My own limited educational opportunities have motivated me to prioritize my children's education, and my working-class status means that I may struggle to afford the best educational opportunities for them. This worry is further compounded by the cultural emphasis on education as a means of social mobility and success. Therefore, my answer to the question is:\n\n2"]}, {"persona": {"region": "Cairo", "sex": "female", "age": 23, "country": "Egypt", "marital_status": "single", "education": "middle", "social_class": "lower middle class"}, "question": {"id": "Q143", "variant": 0}, "response": ["Based on my emic perspective as a single female from Cairo, Egypt, who has completed middle education level and considers herself part of the lower middle class, I am very much worried about not being able to give my children a good education. In my cultural context, education is highly valued, and I understand the importance of it for my children's future success. My individual values and personal experience have also shaped this concern, as I have seen the impact of limited education opportunities on my own life and those around me. Additionally, my socioeconomic background and the cultural relativism of valuing education contribute to my worry. Furthermore, considering the nuance of the question, I understand the long-term implications of not being able to provide a good education for my children. Therefore, my answer is:\n\n1. Very much"]}, {"persona": {"region": "Cairo", "sex": "female", "age": 28, "country": "Egypt", "marital_status": "married", "education": "higher", "social_class": "upper middle class"}, "question": {"id": "Q143", "variant": 0}, "response": ["Based on the anthropological framework, as a married female from Cairo, Egypt, with a higher education level and belonging to the upper middle class, my perspective on the extent of worry about not being able to give my children a good education is influenced by a combination of factors. The cultural context in Egypt places a high value on education, and as someone who has benefited from higher education, I understand its importance. Additionally, my socioeconomic background allows me to have the financial means to provide my children with a good education. However, the cultural relativism aspect reminds me that not everyone has the same opportunities, and I may worry to some extent about the quality of education my children receive compared to others. Therefore, my answer is 3. Not much. \n\n3"]}, {"persona": {"region": "Cairo", "sex": "female", "age": 22, "country": "Egypt", "marital_status": "single", "education": "higher", "social_class": "lower middle class"}, "question": {"id": "Q143", "variant": 0}, "response": ["Based on the anthropological framework, I have to consider the emic and etic perspectives, cultural context, individual values, and socioeconomic background when answering this question. As a single female from Cairo, Egypt, I am aware of the importance of education in my culture and community. Education is highly valued, and it is seen as a means to improve one's socioeconomic status. Considering my lower middle class background, I have personally experienced the challenges of accessing quality education due to financial constraints. This has made me acutely aware of the impact it can have on the future opportunities and success of my potential children. Therefore, I am worried very much about not being able to give my children a good education. \n\n1"]}, {"persona": {"region": "Cairo", "sex": "female", "age": 39, "country": "Egypt", "marital_status": "married", "education": "middle", "social_class": "lower middle class"}, "question": {"id": "Q143", "variant": 0}, "response": ["Based on the anthropological framework, as a married female from Cairo, Egypt, with a middle education level and lower middle class socioeconomic background, my perspective on worrying about not being able to give my children a good education would be influenced by cultural context, individual values, and socioeconomic background. In Egypt, education is highly valued and seen as a pathway to social mobility. As someone from the lower middle class, I may have limited financial resources to provide the best education for my children. Additionally, my personal experience and values prioritize education, so I would be very much worried about not being able to give my children a good education, as it is a crucial factor in their future opportunities and success.\n\n1"]}, {"persona": {"region": "Cairo", "sex": "male", "age": 19, "country": "Egypt", "marital_status": "single", "education": "middle", "social_class": "working class"}, "question": {"id": "Q143", "variant": 0}, "response": ["Based on the anthropological framework, I would answer the question from the perspective of a 19-year-old working-class male from Cairo, Egypt. My emic perspective is heavily influenced by my personal experience and cultural context, where access to education is limited and often tied to socioeconomic background. Additionally, my etic perspective recognizes the importance of education in shaping future opportunities and social mobility. As a result, I would be very worried about not being able to give my children a good education.\n\n1"]}, {"persona": {"region": "Cairo", "sex": "female", "age": 54, "country": "Egypt", "marital_status": "married", "education": "middle", "social_class": "working class"}, "question": {"id": "Q143", "variant": 0}, "response": ["Based on the anthropological framework, as a married female from Cairo, Egypt, I would approach this question from a cultural context perspective, taking into account the importance of education in our society and the socioeconomic background of my family. In Egypt, education is highly valued and seen as a pathway to a better life. As a member of the working class with limited educational attainment myself, I understand the challenges my children may face in accessing quality education. Additionally, the cultural relativism aspect reminds me that there is no hierarchy of culture, so my concerns about my children's education are valid regardless of societal expectations. Lastly, my personal experience and individual values lead me to choose the following option:\n\n3"]}, {"persona": {"region": "Cairo", "sex": "male", "age": 30, "country": "Egypt", "marital_status": "married", "education": "higher", "social_class": "working class"}, "question": {"id": "Q143", "variant": 0}, "response": ["Based on my cultural context as a married male from Cairo, Egypt, I come from a society where education is highly valued and is seen as a pathway to success and upward mobility. As a member of the working class, I am acutely aware of the importance of education in providing opportunities for my children. Additionally, my higher education level has allowed me to understand the significance of education in shaping future prospects. Furthermore, my individual values and personal experience have also influenced my perspective, as I have experienced firsthand the challenges and limitations that can arise from a lack of access to quality education. Considering all of these factors, I would select option (1) Very much."]}, {"persona": {"region": "Cairo", "sex": "male", "age": 39, "country": "Egypt", "marital_status": "married", "education": "higher", "social_class": "lower middle class"}, "question": {"id": "Q143", "variant": 0}, "response": ["Based on the anthropological framework, my cultural context as a married male from Cairo, Egypt, my age, education level, and socioeconomic background all play a role in shaping my perspective. In Egypt, education is highly valued and seen as a means for social mobility. As a member of the lower middle class, I am acutely aware of the challenges in providing my children with a good education. The cultural context of Egypt emphasizes the importance of education, and my personal experience and values align with this perspective. Additionally, the nuance of the question also factors into my response, as I am worried about the quality of education my children will receive given my socioeconomic status and the current state of the education system in Egypt.\n\n3"]}, {"persona": {"region": "Cairo", "sex": "female", "age": 41, "country": "Egypt", "marital_status": "married", "education": "middle", "social_class": "lower middle class"}, "question": {"id": "Q143", "variant": 0}, "response": ["Based on my emic perspective as a married female from Cairo, Egypt, I understand the importance of education in our culture. The cultural context in which I live places a high value on education, and my individual values and personal experience have also taught me the significance of providing a good education for my children. Additionally, my socioeconomic background as part of the lower middle class means that I may have limited resources to ensure my children receive a quality education. Taking into account cultural relativism, I understand that education may be perceived differently in other cultures, but for me and my community, it is of utmost importance. Therefore, I am very much worried about not being able to give my children a good education.\n\n1"]}, {"persona": {"region": "Cairo", "sex": "male", "age": 45, "country": "Syria", "marital_status": "single", "education": "higher", "social_class": "upper middle class"}, "question": {"id": "Q143", "variant": 0}, "response": ["Based on my personal experience and socioeconomic background, as a single male from Cairo, Syria, who has completed higher education and considers myself part of the upper middle class, I am not too worried about not being able to give my children a good education. My education and financial stability provide me with the means to ensure that my children will have access to quality education and opportunities for their future. Additionally, the cultural context and values in my community place a strong emphasis on education, so it is a priority for me to provide my children with the best possible education. Therefore, I am not very worried about this issue.\n\n3"]}, {"persona": {"region": "Cairo", "sex": "male", "age": 54, "country": "Egypt", "marital_status": "married", "education": "higher", "social_class": "lower middle class"}, "question": {"id": "Q143", "variant": 0}, "response": ["Based on the anthropological framework, as a married male from Cairo, Egypt, my emic perspective is heavily influenced by my cultural context, individual values, and socioeconomic background. In Egypt, education is highly valued and seen as a means of social mobility. As someone who has completed higher education and identifies as part of the lower middle class, I understand the importance of education in providing opportunities for my children. Additionally, my personal experience and values emphasize the significance of education in shaping their future. Therefore, I am very much worried about not being able to give my children a good education.\n\n1"]}, {"persona": {"region": "Cairo", "sex": "male", "age": 65, "country": "Egypt", "marital_status": "married", "education": "middle", "social_class": "upper middle class"}, "question": {"id": "Q143", "variant": 0}, "response": ["Based on my emic perspective as a married male from Cairo, Egypt, I understand the importance of education and the societal pressure to provide a good education for my children. In our cultural context, education is highly valued and seen as a pathway to success and social mobility. As someone from the upper middle class, I have the means to provide my children with a good education, and this is a priority for me. Additionally, my personal experience and values emphasize the significance of education, and I believe that investing in my children's education is crucial for their future success. Therefore, I am very much worried about not being able to give my children a good education.\n\n1"]}, {"persona": {"region": "Cairo", "sex": "female", "age": 52, "country": "Egypt", "marital_status": "married", "education": "middle", "social_class": "upper middle class"}, "question": {"id": "Q143", "variant": 0}, "response": ["Based on my cultural context, as a married female from Cairo, Egypt, education is highly valued in our society. My middle education level and upper middle-class background have shaped my understanding of the importance of education in providing opportunities for my children. I also consider the emic and etic perspectives in this matter, where in-group values and out-group perceptions of education differ. Considering the socioeconomic background, I am aware of the challenges that may arise in providing a good education for my children. Additionally, my age and personal experience play a role in my perception of education and its impact on my children's future. Therefore, I am worried about not being able to give my children a good education because it is a significant concern in my cultural and socioeconomic context.\n\n2"]}, {"persona": {"region": "Cairo", "sex": "male", "age": 26, "country": "Egypt", "marital_status": "single", "education": "higher", "social_class": "lower middle class"}, "question": {"id": "Q143", "variant": 0}, "response": ["Based on the anthropological framework, as a single male from Cairo, Egypt, my emic perspective on the question of worrying about not being able to give my children a good education is heavily influenced by my cultural context and socioeconomic background. In Egypt, education is highly valued, and as someone from the lower middle class, I understand the importance of providing a good education for my future children. My personal experience and individual values also play a significant role in shaping my concern about this issue. Additionally, the cultural relativism in Egypt emphasizes the significance of education for upward mobility, which further contributes to my worry about not being able to provide a good education for my children. Therefore, my answer is (2) A good deal. \n\n2"]}, {"persona": {"region": "Cairo", "sex": "male", "age": 32, "country": "Egypt", "marital_status": "married", "education": "middle", "social_class": "working class"}, "question": {"id": "Q143", "variant": 0}, "response": ["Based on the anthropological framework, my emic perspective as a married male from Cairo, Egypt, who is part of the working class and has completed middle education level, is heavily influenced by my cultural context, individual values, and socioeconomic background. In Egypt, education is highly valued, and as a working-class individual with limited educational opportunities, I am acutely aware of the impact it can have on my children's future. My personal experience and values also play a significant role in my concern for my children's education, as I understand the importance of education in providing opportunities for social mobility. Additionally, the cultural relativism aspect of the framework reminds me that my worries may differ from those in other cultural contexts. Therefore, my answer reflects my nuanced understanding of the question.\n\n2"]}, {"persona": {"region": "Cairo", "sex": "male", "age": 38, "country": "Egypt", "marital_status": "married", "education": "middle", "social_class": "lower middle class"}, "question": {"id": "Q143", "variant": 0}, "response": ["Based on my emic perspective as a married male from Cairo, Egypt, I consider the cultural context and socioeconomic background to be pivotal in answering this question. In my cultural context, education is highly valued as a means of social mobility, and it is a source of pride for families to see their children succeed academically. However, as a member of the lower middle class with only a middle education level myself, I am acutely aware of the challenges and limitations that come with my socioeconomic background. I understand the importance of education for my children's future, but I also know the financial strain it can put on my family. Thus, my worry about not being able to give my children a good education is significant, but not overwhelming, as I am hopeful that I can find ways to provide for their educational needs.\n\n3"]}, {"persona": {"region": "Cairo", "sex": "male", "age": 58, "country": "Egypt", "marital_status": "married", "education": "higher", "social_class": "upper middle class"}, "question": {"id": "Q143", "variant": 0}, "response": ["Based on my emic perspective as a married male from Cairo, Egypt, my cultural context and socioeconomic background play a significant role in shaping my concerns about my children's education. In Egypt, education is highly valued, and as someone from the upper middle class who has completed higher education, I am acutely aware of the importance of providing my children with a good education. My personal experience and individual values also lead me to prioritize education for my children. Additionally, cultural relativism and the nuance of the question are important to consider, as my concerns may differ from those of individuals from different cultural and socioeconomic backgrounds. Therefore, my answer to the question is:\n\n3"]}, {"persona": {"region": "Cairo", "sex": "male", "age": 49, "country": "Egypt", "marital_status": "married", "education": "middle", "social_class": "lower middle class"}, "question": {"id": "Q143", "variant": 0}, "response": ["Based on the anthropological framework, as a married male from Cairo, Egypt, at the age of 49 with a middle education level and considering myself part of the lower middle class, my answer to the question would be influenced by my cultural context, individual values and personal experience, and socioeconomic background. In Egypt, education is highly valued, and as a member of the lower middle class, I may have experienced firsthand the challenges and limitations of accessing quality education. Additionally, my personal values may prioritize the importance of education in securing a better future for my children. Therefore, my worry about not being able to give my children a good education would be significant, as it is deeply rooted in my cultural context, personal experience, and socioeconomic background.\n\n2"]}, {"persona": {"region": "Cairo", "sex": "female", "age": 29, "country": "Egypt", "marital_status": "married", "education": "middle", "social_class": "working class"}, "question": {"id": "Q143", "variant": 0}, "response": ["Based on the anthropological framework, my response to the question would be influenced by my emic perspective as a married female from Cairo, Egypt, my cultural context in a society where education is highly valued but not always accessible to all, and my socioeconomic background as a working-class individual with a middle education level. Additionally, my individual values and personal experience would shape my response, as I may have experienced barriers to accessing education myself. Considering these factors, I would choose option (2) A good deal."]}, {"persona": {"region": "Cairo", "sex": "female", "age": 36, "country": "Egypt", "marital_status": "married", "education": "higher", "social_class": "lower middle class"}, "question": {"id": "Q143", "variant": 0}, "response": ["Based on my emic perspective as a married female from Cairo, Egypt, I understand the importance of education in our culture and the impact it can have on the future success and well-being of my children. In our cultural context, education is highly valued and seen as a pathway to upward mobility. As someone who has completed higher education and considers myself part of the lower middle class, I am keenly aware of the socioeconomic barriers that can hinder access to quality education. My individual values and personal experience also play a significant role in my concern for my children's education, as I have personally witnessed the struggles of navigating the education system with limited resources. Additionally, the cultural relativism perspective reminds me that there is no hierarchy of culture, and the value placed on education in my community is not unique. Therefore, considering all these factors, I would choose option (2) A good deal."]}, {"persona": {"region": "Cairo", "sex": "female", "age": 34, "country": "Egypt", "marital_status": "married", "education": "middle", "social_class": "lower middle class"}, "question": {"id": "Q143", "variant": 0}, "response": ["Based on the anthropological framework, as a married female from Cairo, Egypt, my emic perspective is heavily influenced by my cultural context, socioeconomic background, and personal experience. In Egypt, education is highly valued and seen as a key to social mobility. As a lower middle class individual with only a middle education level, I am acutely aware of the limitations and challenges my children may face in accessing quality education. This concern is further compounded by the cultural expectation for parents to provide the best opportunities for their children. Therefore, I am very much worried about not being able to give my children a good education.\n\n1"]}, {"persona": {"region": "Fayoum", "sex": "male", "age": 57, "country": "Egypt", "marital_status": "married", "education": "middle", "social_class": "working class"}, "question": {"id": "Q143", "variant": 0}, "response": ["Based on the anthropological framework, as a married male from Fayoum, Egypt, with a middle education level and part of the working class, my perspective is heavily influenced by my cultural context and socioeconomic background. In Egypt, education is highly valued, and as a member of the working class, I understand the importance of providing my children with a good education for their future success. Additionally, my age and place in society also play a role in shaping my perspective. Therefore, I am very much worried about not being able to give my children a good education.\n\n2"]}, {"persona": {"region": "Fayoum", "sex": "male", "age": 60, "country": "Egypt", "marital_status": "married", "education": "middle", "social_class": "lower middle class"}, "question": {"id": "Q143", "variant": 0}, "response": ["Based on the anthropological framework, my perspective as a married male from Fayoum, Egypt, at the age of 60 with a middle education level and considering myself part of the lower middle class, is heavily influenced by my cultural context, socioeconomic background, and personal experience. In my community, education is highly valued and seen as a key to social mobility. As someone who has struggled to improve my own socioeconomic status due to limited educational opportunities, I am very worried about not being able to provide my children with a good education. This concern is deeply rooted in my cultural values and personal experience, as I have seen how education can significantly impact one's opportunities in life. Therefore, my answer to the question is:\n\n2"]}, {"persona": {"region": "Fayoum", "sex": "male", "age": 21, "country": "Egypt", "marital_status": "single", "education": "middle", "social_class": "lower middle class"}, "question": {"id": "Q143", "variant": 0}, "response": ["Based on the anthropological framework, as a 21-year-old single male from Fayoum, Egypt, who has completed middle education and considers myself part of the lower middle class, my emic perspective would be heavily influenced by my socioeconomic background, individual values, personal experience, and cultural context. Given the importance of education in Egyptian society and the limited opportunities available to those from lower middle-class backgrounds, I would be very worried about not being able to provide my children with a good education. This concern is shaped by my own experiences and the cultural emphasis on education as a means of social mobility and success. \n\n2"]}, {"persona": {"region": "Fayoum", "sex": "male", "age": 33, "country": "Egypt", "marital_status": "single", "education": "higher", "social_class": "working class"}, "question": {"id": "Q143", "variant": 0}, "response": ["Based on the anthropological framework, my answer to the question is influenced by my emic perspective as a working-class single male from Fayoum, Egypt, as well as my individual values and personal experience. In my cultural context, education is highly valued and seen as a pathway to social mobility. However, my socioeconomic background as a working-class individual may limit my ability to provide the best education for my future children. Additionally, the cultural relativism perspective reminds me that there is no hierarchy of culture, and the nuance of the question also plays a role in my answer. \n\n3"]}, {"persona": {"region": "Fayoum", "sex": "male", "age": 32, "country": "Egypt", "marital_status": "married", "education": "higher", "social_class": "lower middle class"}, "question": {"id": "Q143", "variant": 0}, "response": ["From the perspective of a married male from Fayoum, Egypt, who has completed a higher education level and considers himself part of the lower middle class, several factors come into play when considering the extent to which he is worried about not being able to give his children a good education. The cultural context of Egypt, particularly in lower middle class families, places a high value on education as a means to social mobility. Additionally, individual values and personal experience, as well as socioeconomic background, play a significant role in shaping his concerns about his children's education. The nuance of the question also prompts him to consider the specific circumstances of his family and the education system in Egypt. Taking all of this into account, the persona would choose:\n\n3"]}, {"persona": {"region": "Gharbia", "sex": "male", "age": 42, "country": "Egypt", "marital_status": "married", "education": "higher", "social_class": "upper middle class"}, "question": {"id": "Q143", "variant": 0}, "response": ["Based on the anthropological framework, my perspective as a married male from Gharbia, Egypt, is shaped by my cultural context, individual values, and socioeconomic background. In Gharbia, education is highly valued and seen as a pathway to success. As someone who has completed higher education and considers myself part of the upper middle class, I have experienced the benefits of a good education and want the same for my children. Additionally, my personal experience and values place a strong emphasis on providing the best opportunities for my children. Therefore, I am very much worried about not being able to give my children a good education.\n\n1"]}, {"persona": {"region": "Gharbia", "sex": "male", "age": 52, "country": "Egypt", "marital_status": "married", "education": "middle", "social_class": "working class"}, "question": {"id": "Q143", "variant": 0}, "response": ["Based on the anthropological framework, my perspective as a married male from Gharbia, Egypt, who is 52 years old, completed middle education, and considers myself part of the working class, is influenced by my cultural context, individual values, and socioeconomic background. In Gharbia, education is highly valued, and as a working-class individual, I understand the importance of education in providing opportunities for my children. However, due to my socioeconomic background and limited education, I may have concerns about not being able to provide the best education for my children. Therefore, my worries about not being able to give my children a good education are significant, as education is seen as a pathway to a better future for my family.\n\n2"]}, {"persona": {"region": "Gharbia", "sex": "male", "age": 45, "country": "Egypt", "marital_status": "divorced", "education": "higher", "social_class": "upper middle class"}, "question": {"id": "Q143", "variant": 0}, "response": ["Based on my personal experience and socioeconomic background, I am part of the upper middle class and have completed higher education, which gives me the financial stability and knowledge to provide a good education for my children. In the cultural context of Gharbia, Egypt, education is highly valued and I have the means to ensure my children have access to quality education. Additionally, the emic perspective within my community emphasizes the importance of education for success and social mobility. Therefore, I am not worried about not being able to give my children a good education.\n\n3"]}, {"persona": {"region": "Behaira", "sex": "male", "age": 23, "country": "Egypt", "marital_status": "single", "education": "middle", "social_class": "lower class"}, "question": {"id": "Q143", "variant": 0}, "response": ["Based on the anthropological framework, as a single male from Behaira, Egypt, who is 23 years old and part of the lower class, my emic perspective on this question would be heavily influenced by my individual values and personal experience, as well as my socioeconomic background. Growing up in a lower-class family, I have personally experienced the struggles of accessing quality education, and this has shaped my perception of the importance of education for my future children. Additionally, the cultural context of my community places a high value on education as a means of social mobility, which further reinforces my concern about not being able to provide a good education for my children. Therefore, my response to the question would be:\n\n2\n\nA good deal"]}, {"persona": {"region": "Behaira", "sex": "male", "age": 38, "country": "Egypt", "marital_status": "single", "education": "higher", "social_class": "lower class"}, "question": {"id": "Q143", "variant": 0}, "response": ["Based on the anthropological framework, my response to the question is influenced by my emic perspective as a lower-class single male from Behaira, Egypt. My cultural context, individual values, and personal experience all play a significant role in my answer. As someone who has completed higher education and understands the importance of education, I am deeply concerned about not being able to provide my children with a good education due to my socioeconomic background. The cultural relativism in my community emphasizes the value of education, and I feel the pressure to ensure that my children have access to opportunities that I did not. Additionally, the nuance of the question acknowledges the specific concern I have regarding education for my children. Therefore, my answer is:\n\n2"]}, {"persona": {"region": "Behaira", "sex": "male", "age": 32, "country": "Egypt", "marital_status": "married", "education": "middle", "social_class": "lower class"}, "question": {"id": "Q143", "variant": 0}, "response": ["Based on the anthropological framework, my emic perspective as a married male from Behaira, Egypt, who is 32 years old and part of the lower class, is heavily influenced by my cultural context, individual values, and socioeconomic background. In my cultural context, education is highly valued as a means of social mobility, but my lower class socioeconomic background presents significant barriers to accessing quality education for my children. My personal experience and values also play a role, as I have likely faced challenges in my own education and understand the impact it can have on future opportunities. Therefore, I am very much worried about not being able to give my children a good education.\n\n1"]}, {"persona": {"region": "Behaira", "sex": "female", "age": 37, "country": "Egypt", "marital_status": "married", "education": "middle", "social_class": "working class"}, "question": {"id": "Q143", "variant": 0}, "response": ["Based on the anthropological framework, as a married female from Behaira, Egypt, at 37 years of age with a middle education level and considering myself part of the working class, my perspective is heavily influenced by my individual values and personal experience, as well as my socioeconomic background. In my cultural context, education is highly valued, but the reality of my socioeconomic status and limited educational opportunities may lead me to worry about not being able to give my children a good education. Additionally, the cultural relativism of valuing education may also play a role in my concerns. Therefore, my answer to the question is:\n\n2. A good deal"]}, {"persona": {"region": "Behaira", "sex": "male", "age": 48, "country": "Egypt", "marital_status": "married", "education": "middle", "social_class": "working class"}, "question": {"id": "Q143", "variant": 0}, "response": ["Based on the anthropological framework, as a married male from Behaira, Egypt, with a middle education level and considering myself part of the working class, my perspective on the extent of worry about not being able to give my children a good education would be heavily influenced by my socioeconomic background. Being part of the working class and having completed only middle education, I would likely be very concerned about not being able to provide my children with a good education, as I understand the importance of education for their future opportunities. Additionally, my cultural context, individual values, and personal experience would also contribute to this concern, as education is highly valued in Egyptian society and I would want the best for my children. Therefore, my answer would be:\n2"]}, {"persona": {"region": "Behaira", "sex": "female", "age": 34, "country": "Egypt", "marital_status": "married", "education": "middle", "social_class": "lower class"}, "question": {"id": "Q143", "variant": 0}, "response": ["As a married female from Behaira, Egypt, I am deeply rooted in my cultural context, where education is highly valued but often inaccessible due to socioeconomic constraints. My personal experience and individual values are shaped by the struggle to provide for my family with limited resources and opportunities. Considering the etic perspective, I know that education is essential for my children's future, but the emic perspective of my lower-class background makes me acutely aware of the barriers they will face. Therefore, I am worried to a very high extent about not being able to give my children a good education.\n\n1"]}, {"persona": {"region": "Behaira", "sex": "female", "age": 30, "country": "Egypt", "marital_status": "divorced", "education": "lower", "social_class": "lower class"}, "question": {"id": "Q143", "variant": 0}, "response": ["Based on the anthropological framework, as a divorced female from Behaira, Egypt, with a lower education level and belonging to the lower class, my emic perspective is heavily influenced by my cultural context, individual values, and socioeconomic background. Living in a society where education is highly valued, but also often inaccessible due to financial constraints, I am deeply worried about not being able to give my children a good education. This concern is compounded by my own experiences of struggling to access educational opportunities and the limited resources available to me as a member of the lower class. Therefore, my answer to the question is:\n\n1"]}, {"persona": {"region": "Behaira", "sex": "male", "age": 40, "country": "Egypt", "marital_status": "married", "education": "higher", "social_class": "lower middle class"}, "question": {"id": "Q143", "variant": 0}, "response": ["Based on the anthropological framework, my response is influenced by my emic perspective as a married male from Behaira, Egypt, with a lower middle-class background. My cultural context, individual values, and personal experience shape my concern for my children's education. As someone who has completed higher education, I understand the importance of education in upward mobility. My socioeconomic background also plays a significant role in my worry about providing a good education for my children. Additionally, the cultural relativism and nuanced phrasing of the question lead me to choose the option that best reflects my concern for my children's education.\n\n3"]}, {"persona": {"region": "Behaira", "sex": "male", "age": 38, "country": "Egypt", "marital_status": "married", "education": "middle", "social_class": "working class"}, "question": {"id": "Q143", "variant": 0}, "response": ["Based on the anthropological framework, as a married male from Behaira, Egypt, with a middle education level and part of the working class, my emic perspective on this question would be heavily influenced by my individual values and personal experience. My own experience with education and my socioeconomic background would lead me to be very worried about not being able to provide a good education for my children. In Egypt, education is highly valued, and I would want my children to have better opportunities than I did. Additionally, the cultural context of Egypt places a strong emphasis on the importance of education for upward mobility, and as a member of the working class, I would be acutely aware of the impact that a lack of education could have on my children's future opportunities. Therefore, my answer is:\n\n2"]}, {"persona": {"region": "Behaira", "sex": "female", "age": 30, "country": "Egypt", "marital_status": "married", "education": "higher", "social_class": "lower class"}, "question": {"id": "Q143", "variant": 0}, "response": ["Based on the anthropological framework, as a married female from Behaira, Egypt, with a lower socioeconomic background, my perspective is heavily influenced by my cultural context, individual values, and personal experience. My concern for my children's education is shaped by the limited opportunities and resources available to us. Additionally, my age and place also play a role in my understanding of the importance of education. Therefore, I am very much worried about not being able to give my children a good education.\n\n1"]}, {"persona": {"region": "Behaira", "sex": "female", "age": 35, "country": "Egypt", "marital_status": "married", "education": "middle", "social_class": "working class"}, "question": {"id": "Q143", "variant": 0}, "response": ["Based on the anthropological framework, my perspective as a married female from Behaira, Egypt, with a middle education level and part of the working class is heavily influenced by my cultural context, individual values, and socioeconomic background. In Behaira, education is highly valued, but the opportunities for higher education are limited for those in the working class. I understand the importance of education for my children's future, but my socioeconomic background and limited educational opportunities make me worried about not being able to provide them with the best education. Therefore, my answer to the question would be:\n2"]}, {"persona": {"region": "Behaira", "sex": "male", "age": 52, "country": "Egypt", "marital_status": "married", "education": "middle", "social_class": "lower class"}, "question": {"id": "Q143", "variant": 0}, "response": ["Based on the anthropological framework, my perspective as a married male from Behaira, Egypt, who is 52 years old, has completed only middle education, and considers himself part of the lower class is heavily influenced by my cultural context, individual values, and socioeconomic background. In my community, education is highly valued but often inaccessible for those in the lower class due to financial constraints and limited resources. Additionally, my personal experience and the experience of those around me have shown that a lack of education can severely limit opportunities for social mobility and financial stability. Given these factors, I am very much worried about not being able to give my children a good education.\n\n1"]}, {"persona": {"region": "Alexandria", "sex": "female", "age": 41, "country": "Egypt", "marital_status": "single", "education": "middle", "social_class": "lower class"}, "question": {"id": "Q143", "variant": 0}, "response": ["Based on the anthropological framework, my emic perspective as a single lower-class woman from Alexandria, Egypt, would be heavily influenced by my cultural context, individual values, and personal experience. In my cultural context, education is highly valued, but financial constraints often limit access to quality education. My personal experience as someone who completed only middle education and struggles with financial stability would lead me to be very worried about not being able to provide my children with a good education. This concern is further compounded by the lack of socioeconomic opportunities available to us. Therefore, my answer would be:\n\n1"]}, {"persona": {"region": "Alexandria", "sex": "female", "age": 21, "country": "Egypt", "marital_status": "single", "education": "middle", "social_class": "lower class"}, "question": {"id": "Q143", "variant": 0}, "response": ["Based on the anthropological framework, my emic perspective as a single female from Alexandria, Egypt, who is 21 years old and part of the lower class, is heavily influenced by my cultural context, individual values, and socioeconomic background. In my cultural context, education is highly valued, but access to quality education is often limited for individuals in the lower class. My personal experience and values lead me to worry a great deal about not being able to provide my future children with a good education, as I understand the impact it can have on their future opportunities. Additionally, my socioeconomic background further reinforces this concern, as I am aware of the financial barriers that may prevent me from accessing better educational opportunities for my children.\n\n2"]}, {"persona": {"region": "Alexandria", "sex": "female", "age": 35, "country": "Egypt", "marital_status": "married", "education": "middle", "social_class": "lower class"}, "question": {"id": "Q143", "variant": 0}, "response": ["From an anthropological perspective, my emic perspective as a married woman from Alexandria, Egypt, who belongs to the lower class, is heavily influenced by my cultural context, individual values, and socioeconomic background. In our cultural context, education is highly valued, but unfortunately, my lower socioeconomic status limits my ability to provide my children with a good education. This is a source of great concern for me, as I believe that education is key to breaking the cycle of poverty. Additionally, my personal experience and the experiences of those around me have shown that education is often the only way to secure a better future. Therefore, my answer to the question of how worried I am about not being able to give my children a good education is (1) Very much."]}, {"persona": {"region": "Alexandria", "sex": "male", "age": 34, "country": "Egypt", "marital_status": "married", "education": "higher", "social_class": "working class"}, "question": {"id": "Q143", "variant": 0}, "response": ["Based on the anthropological framework, as a married male from Alexandria, Egypt, with a working-class background, my perspective on the importance of education for my children is heavily influenced by my cultural context, individual values, and socioeconomic background. In Egyptian society, education is highly valued, and as someone who has completed higher education, I understand the opportunities it can provide. However, as part of the working class, I may have concerns about the financial burden of providing a good education for my children. Additionally, my personal experience and values lead me to prioritize education for my children, despite potential worries about affordability. Therefore, my answer to the question would be:\n\n2\n\n(A good deal)"]}, {"persona": {"region": "Alexandria", "sex": "female", "age": 37, "country": "Egypt", "marital_status": "married", "education": "higher", "social_class": "lower middle class"}, "question": {"id": "Q143", "variant": 0}, "response": ["Based on the anthropological framework, as a married female from Alexandria, Egypt, who is 37 years old and part of the lower middle class, my perspective is heavily influenced by my cultural context, individual values, and socioeconomic background. In Egypt, education is highly valued and seen as a way to improve one's socioeconomic status. As someone who has completed higher education, I understand the importance of education and the opportunities it can provide. However, as part of the lower middle class, I also recognize the financial challenges that come with providing a good education for my children. My personal experience and values lead me to be very much worried about not being able to give my children a good education, as I want the best for their future and recognize the obstacles that may stand in the way.\n\n2"]}, {"persona": {"region": "Alexandria", "sex": "female", "age": 56, "country": "Egypt", "marital_status": "divorced", "education": "middle", "social_class": "working class"}, "question": {"id": "Q143", "variant": 0}, "response": ["Based on my emic perspective, coming from a working-class background in Alexandria, Egypt, education is highly valued as a means of social mobility and success. My cultural context emphasizes the importance of education as a way to secure a better future for my children. My personal experience and individual values also lead me to prioritize education for my children, despite my own limited educational attainment. Additionally, my socioeconomic background influences my concern about providing my children with a good education, as I may not have the financial means to ensure their educational success. Considering the nuance of the question, I would choose option (2) A good deal, as it accurately reflects my concern about my children's education.\n\n2"]}, {"persona": {"region": "Alexandria", "sex": "male", "age": 48, "country": "Egypt", "marital_status": "married", "education": "higher", "social_class": "working class"}, "question": {"id": "Q143", "variant": 0}, "response": ["In considering the emic and etic perspectives, I understand the importance of education in my culture and the societal expectations for providing a good education for my children. The cultural context of Alexandria, Egypt values education as a means to social mobility and success. My personal experience and individual values also play a role, as I have worked hard to attain higher education and want the same for my children. My socioeconomic background as part of the working class also adds to my concern about providing a good education for my children. Additionally, the cultural relativism in Egypt places a high value on education, further influencing my worry about not being able to give my children a good education. Therefore, based on these factors, I choose:\n3"]}, {"persona": {"region": "Alexandria", "sex": "female", "age": 30, "country": "Egypt", "marital_status": "married", "education": "middle", "social_class": "working class"}, "question": {"id": "Q143", "variant": 0}, "response": ["Based on the anthropological framework, my answer to the question is influenced by my cultural context as a married female from Alexandria, Egypt, and my middle education level. My individual values and personal experience play a significant role in my perception, as I consider myself part of the working class. Additionally, my socioeconomic background and cultural relativism also factor into my response. As a 30-year-old woman, space and time are important factors in my understanding of the question, and the nuanced phrasing also influences my answer. Ultimately, my concern about not being able to give my children a good education is influenced by all of these factors, leading me to choose the option (2) A good deal."]}, {"persona": {"region": "Alexandria", "sex": "male", "age": 19, "country": "Egypt", "marital_status": "single", "education": "middle", "social_class": "lower class"}, "question": {"id": "Q143", "variant": 0}, "response": ["From the perspective of a single male from Alexandria, Egypt, who is 19 years old, has completed middle education, and considers himself part of the lower class, the emic perspective would highlight the personal experience of struggling to access quality education due to socioeconomic background. The etic perspective would recognize the broader cultural context of limited opportunities for upward mobility and the importance placed on education in Egyptian society. The individual values and personal experience of this persona would likely lead to a high level of concern about not being able to provide a good education for their future children, given their own struggles with education. Additionally, the socioeconomic background of being part of the lower class would further amplify these worries. Cultural relativism would also play a role in understanding the societal expectations and pressures around education. Considering all of these factors, the persona would likely choose option (1) Very much. \n\n1"]}, {"persona": {"region": "Alexandria", "sex": "male", "age": 45, "country": "Egypt", "marital_status": "married", "education": "middle", "social_class": "lower middle class"}, "question": {"id": "Q143", "variant": 0}, "response": ["Based on my personal experience and socioeconomic background, as a married male from Alexandria, Egypt, I am part of the lower middle class and have only completed middle education level. Education is highly valued in my culture and I understand the importance of providing a good education for my children. However, due to my limited financial resources, I am very worried about not being able to give my children a good education. This concern is deeply rooted in my cultural context and socioeconomic background, and it is a significant source of stress and anxiety for me.\n\n1"]}, {"persona": {"region": "Alexandria", "sex": "male", "age": 23, "country": "Egypt", "marital_status": "single", "education": "higher", "social_class": "lower class"}, "question": {"id": "Q143", "variant": 0}, "response": ["Based on the anthropological framework, as a single male from Alexandria, Egypt, the emic perspective would emphasize the importance of education within the cultural context, as education is highly valued in Egyptian society. My personal experience as someone who has completed higher education and considers myself part of the lower class has shaped my understanding of the value of education, as it has been a means for social mobility. My socioeconomic background also plays a significant role, as my lower class status may limit my ability to provide a good education for my future children. Additionally, the cultural relativism perspective reminds us that there is no hierarchy of culture, so my concerns about not being able to give my children a good education are valid within my cultural context. Therefore, my answer is:\n3"]}, {"persona": {"region": "Alexandria", "sex": "female", "age": 28, "country": "Egypt", "marital_status": "married", "education": "middle", "social_class": "working class"}, "question": {"id": "Q143", "variant": 0}, "response": ["Based on the anthropological framework, as a married female from Alexandria, Egypt, who completed middle education and considers herself part of the working class, my emic perspective would be heavily influenced by my cultural context, individual values, and socioeconomic background. In Egypt, education is highly valued, but access to quality education can be limited for working-class families. My personal experience and values would lead me to be very worried about not being able to give my children a good education, as I understand the importance of education for their future opportunities and success. Additionally, my socioeconomic background as part of the working class would likely present financial barriers to accessing high-quality education for my children. Therefore, I would choose:\n\n(1) Very much"]}, {"persona": {"region": "Alexandria", "sex": "male", "age": 34, "country": "Egypt", "marital_status": "single", "education": "higher", "social_class": "working class"}, "question": {"id": "Q143", "variant": 0}, "response": ["Based on my emic perspective as a single male from Alexandria, Egypt, I understand the importance of education in our cultural context. My personal experience and values as someone who has completed higher education and considers myself part of the working class also influence my perception of the question. Socioeconomic background plays a significant role in my understanding, as I may have concerns about providing a good education for my future children due to financial constraints. Additionally, the cultural relativism in our society means that education is highly valued and seen as a pathway to upward mobility. Therefore, based on my nuanced understanding of the question and my personal circumstances, I would choose option (2) A good deal. \n\n2"]}, {"persona": {"region": "Alexandria", "sex": "male", "age": 30, "country": "Egypt", "marital_status": "married", "education": "higher", "social_class": "lower middle class"}, "question": {"id": "Q143", "variant": 0}, "response": ["Based on my personal experience and socioeconomic background as a married male from Alexandria, Egypt, who considers himself part of the lower middle class and has completed higher education, I am very much worried about not being able to give my children a good education. In my cultural context, education is highly valued and seen as a pathway to upward mobility. My individual values and personal experience have taught me the importance of education in securing a better future for my children. Additionally, the socioeconomic background I come from means that I may not have the financial resources to provide the level of education I desire for my children. Therefore, I am very much concerned about this issue.\n\n1"]}, {"persona": {"region": "Alexandria", "sex": "female", "age": 49, "country": "Egypt", "marital_status": "married", "education": "higher", "social_class": "lower middle class"}, "question": {"id": "Q143", "variant": 0}, "response": ["Based on the anthropological framework outlined, my response to the question is influenced by my emic perspective as a married female from Alexandria, Egypt, with a lower middle-class socioeconomic background and higher education. The cultural context of Alexandria, where education is highly valued, and my personal experience as a mother and an educated woman play a significant role in shaping my response. Additionally, the nuance of the question is important as it implies a concern for the future of my children. Therefore, my answer is (2) A good deal."]}, {"persona": {"region": "Kafr el-sheikh", "sex": "male", "age": 49, "country": "Egypt", "marital_status": "married", "education": "higher", "social_class": "working class"}, "question": {"id": "Q143", "variant": 0}, "response": ["Based on the anthropological framework, my perspective on this question is heavily influenced by my cultural context, socioeconomic background, individual values, and personal experience. As a married male from Kafr el-sheikh, Egypt, I come from a working-class background and have completed higher education. In my cultural context, education is highly valued, and I understand the importance of providing a good education for my children. However, considering my socioeconomic background and the challenges that come with it, I am very worried about not being able to give my children a good education, as I am aware of the limitations and obstacles they may face. Therefore, my answer to the question is:\n\n1"]}, {"persona": {"region": "Kafr el-sheikh", "sex": "male", "age": 25, "country": "Egypt", "marital_status": "single", "education": "middle", "social_class": "lower middle class"}, "question": {"id": "Q143", "variant": 0}, "response": ["Based on the emic perspective, as a single male from Kafr el-sheikh, Egypt, who has completed middle education and considers myself part of the lower middle class, my cultural context and socioeconomic background greatly influence my concern for my future children's education. In this specific cultural context, education is highly valued as a means of social mobility, and my socioeconomic background may limit my ability to provide my children with a good education. Additionally, individual values and personal experience play a significant role in shaping my worries about my future children's education, as I have personally witnessed the challenges of accessing quality education due to financial constraints. Therefore, I am very much worried about not being able to give my children a good education.\n\n1"]}, {"persona": {"region": "Kafr el-sheikh", "sex": "male", "age": 59, "country": "Egypt", "marital_status": "married", "education": "higher", "social_class": "lower middle class"}, "question": {"id": "Q143", "variant": 0}, "response": ["Based on the anthropological framework, my response to the question is influenced by my emic perspective as a married male from Kafr el-sheikh, Egypt, and my lower middle class socioeconomic background. The cultural context of my upbringing and the values I hold as an individual also play a significant role in my answer. Additionally, my age and life experiences have shaped my perception of education and its importance. Considering cultural relativism, I understand that the concept of a \"good education\" may differ across cultures and socioeconomic backgrounds, so my response may not align with the perspectives of others. \n\n3"]}, {"persona": {"region": "Kafr el-sheikh", "sex": "female", "age": 38, "country": "Egypt", "marital_status": "married", "education": "middle", "social_class": "working class"}, "question": {"id": "Q143", "variant": 0}, "response": ["From the perspective of a married female from Kafr el-sheikh, Egypt, who is 38 years old, completed middle education, and considers herself part of the working class, several factors come into play when considering the extent to which she is worried about not being able to give her children a good education. The emic perspective of being part of the working class in Egypt means that education may not be easily accessible or affordable, which could lead to concerns about the quality of education her children will receive. Additionally, the cultural context of Egypt and the socioeconomic background of the persona play a significant role in shaping her worries about her children's education. Furthermore, her personal experience with education and her individual values regarding the importance of education also influence her level of concern. Based on these factors, the persona would choose option (2) A good deal. \n\n2"]}, {"persona": {"region": "Kafr el-sheikh", "sex": "male", "age": 35, "country": "Egypt", "marital_status": "married", "education": "higher", "social_class": "lower middle class"}, "question": {"id": "Q143", "variant": 0}, "response": ["Based on the anthropological framework, my answer is heavily influenced by my cultural context, socioeconomic background, and individual values. As a married male from Kafr el-sheikh, Egypt, education is highly valued in my community and is seen as a pathway to success. My lower middle class status means that I may struggle to provide the best education for my children, but my personal experience and values lead me to prioritize education and worry about not being able to afford it. Additionally, the cultural context of Egypt places a strong emphasis on education as a means of social mobility, adding to my concern about not being able to give my children a good education. \n2"]}, {"persona": {"region": "Kafr el-sheikh", "sex": "male", "age": 49, "country": "Egypt", "marital_status": "married", "education": "middle", "social_class": "lower class"}, "question": {"id": "Q143", "variant": 0}, "response": ["Based on the anthropological framework, as a married male from Kafr el-sheikh, Egypt, my emic perspective would be heavily influenced by my lower socioeconomic background, cultural context, and personal experience. In my cultural context, education is highly valued as a means of social mobility, and my personal experience as someone with limited education has likely affected my perception of the importance of education. Additionally, my lower class status may limit my ability to provide my children with a good education, leading to a high level of concern. Therefore, I would choose option (1) Very much."]}, {"persona": {"region": "Kafr el-sheikh", "sex": "male", "age": 37, "country": "Egypt", "marital_status": "married", "education": "middle", "social_class": "lower class"}, "question": {"id": "Q143", "variant": 0}, "response": ["Based on the anthropological framework, as a married male from Kafr el-sheikh, Egypt, who is 37 years old and considers himself part of the lower class, my perspective on the extent of worry about not being able to give my children a good education is heavily influenced by my cultural context, socioeconomic background, and personal experience. In Kafr el-sheikh, access to quality education is limited for those in the lower class, and I know firsthand the struggles and barriers that come with this. My personal values and experiences also play a significant role in shaping my concern for my children's education. Therefore, I would choose:\n\n3) Not much"]}, {"persona": {"region": "Menofia", "sex": "female", "age": 22, "country": "Egypt", "marital_status": "single", "education": "middle", "social_class": "lower class"}, "question": {"id": "Q143", "variant": 0}, "response": ["Based on the anthropological framework, as a single female from Menofia, Egypt, with a lower socioeconomic background and limited education, my perspective on the importance of education may differ from those in higher socioeconomic classes or with more access to educational resources. My personal experience and cultural context have shaped my understanding of the value of education, and I am aware of the challenges and limitations that come with my background. Therefore, I am likely to be very worried about not being able to give my children a good education due to my own struggles and limitations in this area.\n\n1"]}, {"persona": {"region": "Menofia", "sex": "female", "age": 25, "country": "Egypt", "marital_status": "married", "education": "middle", "social_class": "lower class"}, "question": {"id": "Q143", "variant": 0}, "response": ["Based on my cultural context, as a married female from Menofia, Egypt, and considering myself part of the lower class, my socioeconomic background greatly influences my perspective. My individual values and personal experience also play a significant role in my understanding. In my community, education is highly valued, and I have personally experienced the struggles of not having access to higher education. Additionally, the cultural relativism perspective reminds me that there is no hierarchy of culture, and my concerns about education for my children are valid within my cultural context. Therefore, I am very much worried about not being able to give my children a good education.\n\n1"]}, {"persona": {"region": "Menofia", "sex": "male", "age": 28, "country": "Egypt", "marital_status": "single", "education": "higher", "social_class": "working class"}, "question": {"id": "Q143", "variant": 0}, "response": ["Based on my personal experience and socioeconomic background as a single male from Menofia, Egypt, who has completed higher education and considers myself part of the working class, I am very much worried about not being able to give my children a good education. The cultural context of Egypt places a high value on education, and as a member of the working class, I understand the limitations and challenges in accessing quality education. Additionally, my individual values and personal experience have shown me the importance of education in achieving upward mobility and success. Therefore, I am deeply concerned about providing my children with the best educational opportunities possible, given the socioeconomic constraints I face.\n\n1"]}, {"persona": {"region": "Menofia", "sex": "male", "age": 35, "country": "Egypt", "marital_status": "married", "education": "middle", "social_class": "lower middle class"}, "question": {"id": "Q143", "variant": 0}, "response": ["Based on the anthropological framework, as a married male from Menofia, Egypt, my emic perspective is heavily influenced by my cultural context and socioeconomic background. In Menofia, education is highly valued, and it is seen as a pathway to upward mobility. Additionally, my lower middle-class status means that I may not have the financial resources to provide my children with the best education available. My individual values and personal experience also play a role, as I have personally experienced the challenges of limited educational opportunities. Therefore, based on these factors, I would say:\n\n2"]}, {"persona": {"region": "Menofia", "sex": "male", "age": 55, "country": "Egypt", "marital_status": "married", "education": "middle", "social_class": "working class"}, "question": {"id": "Q143", "variant": 0}, "response": ["Based on my cultural context and socioeconomic background as a married male from Menofia, Egypt, who is 55 years old and part of the working class, I am deeply concerned about not being able to provide my children with a good education. In Menofia, education is highly valued and seen as a pathway to a better future. As someone who has completed middle education, I understand the importance of education in improving one's socioeconomic status. Additionally, my working-class background means that I may not have the financial resources to afford private education or additional tutoring for my children. Therefore, I am very much worried about not being able to give my children a good education.\n\n1"]}, {"persona": {"region": "Menofia", "sex": "male", "age": 53, "country": "Egypt", "marital_status": "married", "education": "higher", "social_class": "lower middle class"}, "question": {"id": "Q143", "variant": 0}, "response": ["Based on the anthropological framework provided, as a married male from Menofia, Egypt, with a lower-middle-class socioeconomic background and higher education, my perspective on the extent of worry about not being able to give my children a good education is influenced by a combination of factors. The cultural context in which I live places a high value on education, and my personal experience and individual values also prioritize the importance of education for my children's future. My emic perspective as a member of this community emphasizes the significance of providing a good education for my children, and my etic perspective acknowledges the broader societal expectations and opportunities associated with education. Additionally, my socioeconomic background and age further compound my concern for my children's education, as I understand the potential limitations and challenges they may face in accessing quality educational opportunities. Therefore, from this perspective, my answer to the question would be:\n\n2. A good deal"]}, {"persona": {"region": "Menofia", "sex": "male", "age": 59, "country": "Egypt", "marital_status": "married", "education": "middle", "social_class": "working class"}, "question": {"id": "Q143", "variant": 0}, "response": ["Based on the anthropological framework, as a married male from Menofia, Egypt, with a middle education level and a working-class background, my perspective is heavily influenced by my cultural context, socioeconomic background, individual values, and personal experience. In Menofia, education is highly valued, and as a member of the working class, I understand the importance of education for my children's future opportunities. However, considering my own educational limitations and financial constraints, I am somewhat worried about not being able to provide my children with the best education possible, but I also believe in the resilience and resourcefulness of our community in finding alternative ways to support our children's education. Therefore, my answer would be:\n3"]}, {"persona": {"region": "Menofia", "sex": "female", "age": 42, "country": "Egypt", "marital_status": "married", "education": "middle", "social_class": "lower middle class"}, "question": {"id": "Q143", "variant": 0}, "response": ["Based on the anthropological framework, as a married female from Menofia, Egypt, I am heavily influenced by my cultural context, individual values, and socioeconomic background. In my community, education is highly valued, and it is seen as a pathway to social mobility. As a member of the lower middle class, I am acutely aware of the limitations that my socioeconomic background imposes on my ability to provide my children with a good education. Additionally, my personal experience and values emphasize the importance of education for my children's future success. Therefore, I am very much worried about not being able to give my children a good education.\n\n1"]}, {"persona": {"region": "Menofia", "sex": "male", "age": 39, "country": "Egypt", "marital_status": "married", "education": "higher", "social_class": "working class"}, "question": {"id": "Q143", "variant": 0}, "response": ["From the perspective of a married male from Menofia, Egypt, who is 39 years old, has completed higher education, and considers himself part of the working class, the response to the question of the extent of worry about not being able to give his children a good education would be influenced by several factors. The cultural context in Menofia places a high value on education, and the individual's personal experience and values likely prioritize education as a means of social mobility. Additionally, the socioeconomic background as part of the working class may bring about concerns regarding the affordability of education. The cultural relativism perspective also plays a role in understanding that access to quality education may be limited due to systemic factors. Therefore, the response would likely be (2) A good deal."]}, {"persona": {"region": "Menofia", "sex": "male", "age": 34, "country": "Egypt", "marital_status": "married", "education": "middle", "social_class": "lower middle class"}, "question": {"id": "Q143", "variant": 0}, "response": ["Based on the anthropological framework, as a married male from Menofia, Egypt, my emic perspective is influenced by my cultural context, individual values, and socioeconomic background. In Menofia, education is highly valued, and it is seen as a key factor in social mobility. As a member of the lower middle class, I am acutely aware of the challenges that come with providing a good education for my children. My personal experience and values, shaped by my socioeconomic background and cultural context, lead me to be very worried about not being able to give my children a good education. 1"]}, {"persona": {"region": "Menofia", "sex": "male", "age": 22, "country": "Egypt", "marital_status": "single", "education": "higher", "social_class": "working class"}, "question": {"id": "Q143", "variant": 0}, "response": ["Based on my emic perspective as a single male from Menofia, Egypt, and considering my age, educational background, and socioeconomic status, I am concerned about the future of my hypothetical children's education. In the cultural context of Egypt, education is highly valued as a means of social mobility, and my personal experience and values lead me to prioritize education for my future family. Additionally, my working-class background and cultural relativism perspective highlight the importance of providing a good education for my children despite potential challenges. Considering all these factors, I would choose option (2) A good deal."]}, {"persona": {"region": "Menofia", "sex": "male", "age": 21, "country": "Egypt", "marital_status": "single", "education": "middle", "social_class": "working class"}, "question": {"id": "Q143", "variant": 0}, "response": ["Based on my emic perspective as a single male from Menofia, Egypt, I have grown up in a cultural context where education is highly valued, but the opportunities for higher education are limited, especially for someone from the working class. My personal experience of completing only middle education level has made me keenly aware of the challenges and limitations that come with a lack of higher education. Additionally, my socioeconomic background as part of the working class means that I may struggle to provide my future children with the same educational opportunities that I wish I had. Therefore, I am very much worried about not being able to give my children a good education.\n\n1"]}, {"persona": {"region": "Menofia", "sex": "male", "age": 36, "country": "Egypt", "marital_status": "married", "education": "higher", "social_class": "working class"}, "question": {"id": "Q143", "variant": 0}, "response": ["In considering the question from the perspective of a married male from Menofia, Egypt, who is 36 years old and part of the working class with higher education, it is crucial to take into account the cultural context of the persona. In Egypt, education is highly valued and seen as a pathway to social mobility, so the individual's socioeconomic background and personal experience of having completed higher education will likely lead to a strong concern for providing their children with a good education. Additionally, the emic perspective of being part of the working class and the etic perspective of the societal emphasis on education will further contribute to the individual's worry about this issue. Therefore, the most fitting response from this perspective would be:\n2. A good deal"]}, {"persona": {"region": "Menofia", "sex": "female", "age": 52, "country": "Egypt", "marital_status": "married", "education": "higher", "social_class": "lower middle class"}, "question": {"id": "Q143", "variant": 0}, "response": ["Based on the anthropological framework, as a married female from Menofia, Egypt, my emic perspective is heavily influenced by my cultural context and socioeconomic background. In my community, education is highly valued, and as someone who has completed higher education, I understand the importance of providing my children with a good education. However, as part of the lower middle class, I am concerned about the financial challenges that may arise in ensuring my children receive the best education possible. Additionally, my individual values and personal experience shape my worry about not being able to give my children a good education, as I have seen the impact of limited educational opportunities on others in similar socioeconomic positions. Therefore, my answer to the question is:\n\n3"]}, {"persona": {"region": "Menofia", "sex": "male", "age": 52, "country": "Egypt", "marital_status": "married", "education": "higher", "social_class": "lower middle class"}, "question": {"id": "Q143", "variant": 0}, "response": ["From the perspective of a married male from Menofia, Egypt, who is 52 years old, has completed a higher education level, and considers himself part of the lower middle class, my answer to the question is influenced by a combination of factors. Firstly, my cultural context and socioeconomic background play a significant role in my concern for my children's education. In Egypt, education is highly valued, and as a member of the lower middle class, I may have limited resources to provide the best educational opportunities for my children. Additionally, my individual values and personal experience shape my worries, as I understand the importance of education in achieving upward mobility. Moreover, the cultural relativism perspective reminds me that the societal emphasis on education may differ from other cultures, but within my own context, it is crucial. Therefore, based on these factors, my answer is likely to be (2) A good deal."]}, {"persona": {"region": "Menofia", "sex": "male", "age": 39, "country": "Egypt", "marital_status": "married", "education": "middle", "social_class": "lower class"}, "question": {"id": "Q143", "variant": 0}, "response": ["Based on the anthropological framework, as a married male from Menofia, Egypt, I am heavily influenced by my cultural context, individual values, and socioeconomic background. My lower class status and limited education level have shaped my perception of the importance of education. In Egypt, education is highly valued and seen as a pathway to upward mobility. However, due to my limited resources and social status, I am deeply concerned about not being able to provide my children with a good education, as it is a key factor in their future opportunities. Therefore, I am worried to a very high extent about not being able to give my children a good education.\n\n2"]}, {"persona": {"region": "Menofia", "sex": "male", "age": 23, "country": "Egypt", "marital_status": "single", "education": "middle", "social_class": "lower middle class"}, "question": {"id": "Q143", "variant": 0}, "response": ["Based on the anthropological framework, as a single male from Menofia, Egypt, at 23 years of age and part of the lower middle class, my viewpoint is heavily influenced by my cultural context, individual values, and socioeconomic background. In Egypt, education is highly valued and seen as a pathway to social and economic mobility. However, as part of the lower middle class with limited resources, the ability to provide a good education for my future children is a significant concern. My personal experience and cultural context have shaped my understanding of the importance of education, and my socioeconomic background has a direct impact on my ability to afford quality education for my children. Therefore, my answer to the question is:\n\n2"]}, {"persona": {"region": "Dakahlia", "sex": "female", "age": 24, "country": "Egypt", "marital_status": "single", "education": "higher", "social_class": "lower middle class"}, "question": {"id": "Q143", "variant": 0}, "response": ["From the perspective of a single female from Dakahlia, Egypt, who is 24 years old and part of the lower middle class, the answer to the question is likely to be \"Very much.\" This is because the cultural context in Egypt places a strong emphasis on the value of education, and as someone who has completed higher education, the persona understands the importance of education for future opportunities. Additionally, the socioeconomic background of being part of the lower middle class means that there may be concerns about the ability to afford quality education for future children. Furthermore, individual values and personal experience play a significant role, as the persona's own experience with education likely shapes her concerns for her potential future children. Lastly, the emic perspective of this persona would likely prioritize education as a key factor in shaping the future for her children. \n\n2"]}, {"persona": {"region": "Dakahlia", "sex": "male", "age": 36, "country": "Egypt", "marital_status": "married", "education": "higher", "social_class": "upper middle class"}, "question": {"id": "Q143", "variant": 0}, "response": ["Based on the anthropological framework, as a married male from Dakahlia, Egypt with a higher education level and upper middle class status, my perspective on the extent of my worry about not being able to give my children a good education would be influenced by a combination of individual values, personal experience, and socioeconomic background. My personal experience and education have likely instilled in me the importance of education and the opportunities it can provide. Additionally, my socioeconomic background means that I likely have the means to provide my children with a good education. However, the cultural context of Egypt and the emphasis placed on education may also contribute to my concern about ensuring my children receive a quality education. Therefore, my perspective on this question would be (3) Not much."]}, {"persona": {"region": "Dakahlia", "sex": "female", "age": 71, "country": "Egypt", "marital_status": "married", "education": "higher", "social_class": "upper middle class"}, "question": {"id": "Q143", "variant": 0}, "response": ["Based on the anthropological framework, my response as a married female from Dakahlia, Egypt, who is 71 years old, highly educated, and part of the upper middle class, is influenced by a combination of factors. The cultural context in which I live places a high value on education, and my personal experience and individual values lead me to prioritize education for my children. Additionally, my socioeconomic background allows me to provide my children with access to quality education. Moreover, cultural relativism teaches me to understand the importance of education in my society. Therefore, my response is consistent with the perspective of the persona described above.\n\n3"]}, {"persona": {"region": "Dakahlia", "sex": "male", "age": 55, "country": "Egypt", "marital_status": "married", "education": "higher", "social_class": "upper middle class"}, "question": {"id": "Q143", "variant": 0}, "response": ["From an emic perspective, as a married male from Dakahlia, Egypt, who is 55 years old and has completed higher education, my cultural context and individual values play a significant role in shaping my perception of the importance of education for my children. In my cultural context, education is highly valued and seen as a pathway to success and social mobility. Additionally, my socioeconomic background as part of the upper middle class further emphasizes the value placed on education within my community. Given these factors, I am very much worried about not being able to give my children a good education, as it is essential for their future prospects and societal standing.\n\n1"]}, {"persona": {"region": "Dakahlia", "sex": "male", "age": 64, "country": "Egypt", "marital_status": "married", "education": "higher", "social_class": "lower middle class"}, "question": {"id": "Q143", "variant": 0}, "response": ["Based on my emic perspective as a married male from Dakahlia, Egypt, my cultural context and individual values play a significant role in shaping my answer to this question. In my community, education is highly valued and seen as a means for social mobility. As someone who has completed higher education and considers myself part of the lower middle class, I understand the importance of education in providing opportunities for my children. Additionally, my socioeconomic background influences my concern about being able to afford a good education for my children. In this context, the answer that best reflects my perspective is:\n3"]}, {"persona": {"region": "Dakahlia", "sex": "female", "age": 29, "country": "Egypt", "marital_status": "married", "education": "middle", "social_class": "lower class"}, "question": {"id": "Q143", "variant": 0}, "response": ["Based on the anthropological framework, my emic perspective as a married female from Dakahlia, Egypt, with a middle education level and part of the lower class, is influenced by my cultural context, individual values, and socioeconomic background. In my cultural context, education is highly valued, but my lower class socioeconomic background limits my ability to provide a good education for my children. This is a source of significant worry for me, as it is a key factor in improving their future prospects and breaking the cycle of poverty. Therefore, I am very much worried about not being able to give my children a good education.\n\n1"]}, {"persona": {"region": "Dakahlia", "sex": "female", "age": 40, "country": "Egypt", "marital_status": "married", "education": "middle", "social_class": "upper middle class"}, "question": {"id": "Q143", "variant": 0}, "response": ["In considering the question of the extent to which I am worried about not being able to give my children a good education, it is important to take into account the cultural context of Dakahlia, Egypt. Education is highly valued in our society, and as a married female from an upper middle class background, it is expected that I would prioritize my children's education. My personal experience and individual values also play a role in this concern, as I have completed middle education level myself and understand the importance of education for future opportunities. Additionally, the socioeconomic background of being part of the upper middle class means that I have access to resources that can help ensure my children receive a good education. Therefore, based on these factors, I would choose option (3) Not much. \n\n3"]}, {"persona": {"region": "Dakahlia", "sex": "male", "age": 37, "country": "Egypt", "marital_status": "married", "education": "higher", "social_class": "lower middle class"}, "question": {"id": "Q143", "variant": 0}, "response": ["In considering the question of worrying about not being able to give my children a good education, it is important to take into account the cultural context of Dakahlia, Egypt. Education is highly valued in our community, and it is seen as a way to improve one's socioeconomic status. As a member of the lower middle class, I am acutely aware of the challenges that come with providing a good education for my children. My personal experience and values drive my concern for their future opportunities. Additionally, the socioeconomic background plays a significant role, as the financial strain of providing a good education is a constant worry. Taking into consideration the emic perspective of my community, it is clear that the worry about my children's education is a significant concern that weighs heavily on my mind.\n\n2"]}, {"persona": {"region": "Dakahlia", "sex": "female", "age": 45, "country": "Egypt", "marital_status": "married", "education": "middle", "social_class": "working class"}, "question": {"id": "Q143", "variant": 0}, "response": ["Based on the anthropological framework, as a married female from Dakahlia, Egypt, at the age of 45, with a middle education level and belonging to the working class, my answer to the question would be heavily influenced by my cultural context, individual values, and socioeconomic background. In Dakahlia, education is highly valued, and as a mother, I would feel a strong responsibility to provide my children with a good education. However, due to my working-class status and limited educational opportunities, I may have concerns about my ability to provide the best education for my children. This worry would be further compounded by the cultural emphasis on education and the potential impact on my children's future opportunities. Therefore, my answer to the question would be (2) A good deal. \n\n2"]}, {"persona": {"region": "Dakahlia", "sex": "male", "age": 34, "country": "Egypt", "marital_status": "single", "education": "middle", "social_class": "lower middle class"}, "question": {"id": "Q143", "variant": 0}, "response": ["Based on the anthropological framework, my perspective as a single male from Dakahlia, Egypt, who is 34 years old and part of the lower middle class, is shaped by my cultural context, individual values, and socioeconomic background. In Egypt, education is highly valued and seen as a means of upward social mobility. However, as someone from the lower middle class with only a middle education level, I am acutely aware of the limitations and challenges that come with providing a good education for my children. My personal experience and values lead me to prioritize education for my children, but my socioeconomic background also makes me worry about the financial burden and opportunities available to them. Therefore, my answer to the question would be:\n\n2"]}, {"persona": {"region": "Dakahlia", "sex": "female", "age": 26, "country": "Egypt", "marital_status": "married", "education": "higher", "social_class": "upper middle class"}, "question": {"id": "Q143", "variant": 0}, "response": ["Based on the emic and etic perspectives, as a married female from Dakahlia, Egypt, I am influenced by my cultural context, individual values, and personal experience. In Egypt, education is highly valued, and as someone who has completed higher education, I understand the importance of providing a good education for my children. Additionally, my socioeconomic background as part of the upper middle class also plays a significant role in my perspective. I have the means to provide my children with a good education and it is a priority for me. Therefore, I am not very worried about not being able to give my children a good education.\n\n3"]}, {"persona": {"region": "Dakahlia", "sex": "male", "age": 21, "country": "Egypt", "marital_status": "single", "education": "middle", "social_class": "upper middle class"}, "question": {"id": "Q143", "variant": 0}, "response": ["Based on the anthropological framework, my emic perspective as a single male from Dakahlia, Egypt, who is 21 years old and part of the upper middle class, dictates that my individual values and personal experience heavily influence my answer to this question. In my cultural context, education is highly valued and seen as a pathway to success. Additionally, my socioeconomic background allows me to prioritize providing a good education for my future children. Therefore, from my perspective, I am not worried about not being able to give my children a good education.\n\n3"]}, {"persona": {"region": "Dakahlia", "sex": "female", "age": 32, "country": "Egypt", "marital_status": "married", "education": "middle", "social_class": "working class"}, "question": {"id": "Q143", "variant": 0}, "response": ["Based on my emic perspective as a married female from Dakahlia, Egypt, my cultural context and socio-economic background heavily influence my worries about my children's education. In my community, education is highly valued, and I understand the importance of a good education for my children's future opportunities. As part of the working class, I am concerned about the financial strain of providing my children with a good education, as I only completed middle education level myself. My individual values and personal experience lead me to be very worried about not being able to give my children a good education, as I know the challenges they may face without it. Additionally, the cultural relativism in my community emphasizes the importance of education for upward mobility, further reinforcing my concern. \n\n2"]}, {"persona": {"region": "Dakahlia", "sex": "female", "age": 35, "country": "Egypt", "marital_status": "married", "education": "middle", "social_class": "upper middle class"}, "question": {"id": "Q143", "variant": 0}, "response": ["Based on the anthropological framework, as a married female from Dakahlia, Egypt, my emic perspective is influenced by my cultural context, individual values, and socioeconomic background. In Dakahlia, education is highly valued and seen as a pathway to success and social mobility. As a member of the upper middle class, I have the means to provide my children with a good education, and it is a priority for me to ensure that they have access to the best opportunities for their future. Therefore, I am very much worried about not being able to give my children a good education.\n\n1"]}, {"persona": {"region": "Dakahlia", "sex": "male", "age": 33, "country": "Egypt", "marital_status": "married", "education": "middle", "social_class": "upper middle class"}, "question": {"id": "Q143", "variant": 0}, "response": ["Based on the anthropological framework, I must consider the emic and etic perspectives of my cultural context in Dakahlia, Egypt. In my community, education is highly valued and seen as a pathway to success. My individual values and personal experience also play a role in my answer, as I have personally witnessed the impact of education on opportunities for advancement. Additionally, my socioeconomic background as part of the upper middle class influences my concern for providing a good education for my children. Considering cultural relativism, I understand that the importance placed on education may vary in different cultures, but in my context, it is a top priority. Finally, space and time are also important factors, as I am currently at a stage in life where my children's education is a significant concern for me.\n\n3"]}, {"persona": {"region": "Dakahlia", "sex": "female", "age": 45, "country": "Egypt", "marital_status": "married", "education": "middle", "social_class": "upper middle class"}, "question": {"id": "Q143", "variant": 0}, "response": ["Based on the anthropological framework, my emic perspective as a married female from Dakahlia, Egypt, who is 45 years old and part of the upper middle class, is heavily influenced by my cultural context, individual values, and socioeconomic background. In Dakahlia, education is highly valued and seen as a pathway to success and social mobility. As a member of the upper middle class, I have the means to provide my children with a good education, and it is a priority for me to ensure that they have access to educational opportunities. Additionally, my personal experience and values emphasize the importance of education in shaping my children's future. Therefore, I am very much worried about not being able to give my children a good education.\n\n1"]}, {"persona": {"region": "Dakahlia", "sex": "male", "age": 30, "country": "Egypt", "marital_status": "married", "education": "middle", "social_class": "upper middle class"}, "question": {"id": "Q143", "variant": 0}, "response": ["From the perspective of a married male from Dakahlia, Egypt, who is 30 years old and considers himself part of the upper middle class, several factors must be considered when answering the question about worries regarding providing a good education for their children. First, the cultural context in Egypt places a high value on education, and it is seen as a pathway to success and social mobility. Additionally, the individual values and personal experience of this persona likely includes a strong emphasis on education, as completing middle education themselves may have presented challenges and limitations. Furthermore, the socioeconomic background of being part of the upper middle class suggests that there may be resources available to invest in their children's education. However, the nuance of the question is important, as the worry about providing a good education may still exist due to the competitive nature of educational opportunities and the desire for their children to excel. Taking all these factors into account, the chosen option is:\n\n3"]}, {"persona": {"region": "Dakahlia", "sex": "female", "age": 63, "country": "Egypt", "marital_status": "married", "education": "higher", "social_class": "lower middle class"}, "question": {"id": "Q143", "variant": 0}, "response": ["Based on the anthropological framework, my response to the question will be heavily influenced by my cultural context, individual values, and socioeconomic background. As a married woman from Dakahlia, Egypt, I come from a culture where education is highly valued, and as someone with higher education, I personally understand the importance of providing a good education for my children. Additionally, being part of the lower middle class means that I may have limited financial resources to support my children's education. Therefore, I would be very much worried about not being able to give my children a good education.\n\n1"]}, {"persona": {"region": "Dakahlia", "sex": "male", "age": 28, "country": "Egypt", "marital_status": "single", "education": "higher", "social_class": "upper middle class"}, "question": {"id": "Q143", "variant": 0}, "response": ["In considering the question of worrying about not being able to give my children a good education, I must take into account my personal experience and individual values. As a single male from Dakahlia, Egypt, who has completed a higher education level and considers himself part of the upper middle class, I have been fortunate to have had access to educational opportunities. Additionally, my socioeconomic background and cultural context have provided me with the means to prioritize education for my future children. Therefore, I would not be very worried about not being able to give my children a good education.\n\n3"]}, {"persona": {"region": "Dakahlia", "sex": "female", "age": 24, "country": "Egypt", "marital_status": "married", "education": "higher", "social_class": "upper middle class"}, "question": {"id": "Q143", "variant": 0}, "response": ["Based on the anthropological framework, my emic perspective as a married female from Dakahlia, Egypt, who has completed higher education and considers herself part of the upper middle class, leads me to understand the importance of education within my cultural context. Education is highly valued in my community and is seen as a pathway to success and social mobility. My personal experience and individual values also play a significant role in my understanding of the importance of education for my children. Additionally, my socioeconomic background affords me the means to provide my children with a good education. Therefore, I am not very worried about not being able to give my children a good education.\n\n3"]}, {"persona": {"region": "Dakahlia", "sex": "male", "age": 20, "country": "Egypt", "marital_status": "single", "education": "middle", "social_class": "upper middle class"}, "question": {"id": "Q143", "variant": 0}, "response": ["Based on my emic perspective as a single male from Dakahlia, Egypt, my cultural context places a high value on education and upward mobility. My individual values and personal experiences have shaped my understanding that a good education is essential for success in life. Additionally, my socioeconomic background as part of the upper middle class has provided me with the means to prioritize and afford education for my future children. Considering the cultural relativism, I understand that my perspective may differ from others, but for me, providing a good education for my children is of utmost importance. \n\n3"]}, {"persona": {"region": "Dakahlia", "sex": "male", "age": 45, "country": "Egypt", "marital_status": "married", "education": "middle", "social_class": "upper middle class"}, "question": {"id": "Q143", "variant": 0}, "response": ["Based on the anthropological framework, my emic perspective as a married male from Dakahlia, Egypt, who is 45 years old and part of the upper middle class, is influenced by my cultural context, individual values, and socioeconomic background. In Dakahlia, education is highly valued, and as someone from the upper middle class, I have the means to provide my children with a good education. Additionally, my personal experience and values lead me to prioritize education for my children. Therefore, I am not worried about not being able to give my children a good education.\n\n3"]}, {"persona": {"region": "Dakahlia", "sex": "female", "age": 43, "country": "Egypt", "marital_status": "married", "education": "higher", "social_class": "upper middle class"}, "question": {"id": "Q143", "variant": 0}, "response": ["Based on the anthropological framework, as a married female from Dakahlia, Egypt, cultural context is pivotal in understanding my perspective. In this region, education is highly valued and seen as a pathway to success and social mobility. As someone who has completed a higher education level and considers myself part of the upper middle class, I am very much concerned about not being able to give my children a good education. This concern is influenced by my individual values and personal experience, as well as my socioeconomic background. Additionally, the emic perspective within my community emphasizes the importance of education for future opportunities and success. Therefore, my worry about not being able to provide my children with a good education is significant and reflects my cultural and personal context.\n\n3"]}, {"persona": {"region": "Dakahlia", "sex": "female", "age": 20, "country": "Egypt", "marital_status": "single", "education": "middle", "social_class": "upper middle class"}, "question": {"id": "Q143", "variant": 0}, "response": ["Based on the anthropological framework, my emic perspective as a single female from Dakahlia, Egypt, who is 20 years old and part of the upper middle class, is influenced by my cultural context, individual values, and socioeconomic background. In Dakahlia, education is highly valued and seen as a pathway to success, so I am very worried about not being able to give my children a good education. Additionally, my personal experience and values prioritize education as a means of upward social mobility, and as someone from the upper middle class, I have the means to invest in my children's education. Therefore, I choose option (1) Very much."]}, {"persona": {"region": "Dakahlia", "sex": "female", "age": 40, "country": "Egypt", "marital_status": "single", "education": "middle", "social_class": "lower middle class"}, "question": {"id": "Q143", "variant": 0}, "response": ["Based on my personal experience and socioeconomic background, I am deeply concerned about not being able to provide my children with a good education. As a single woman from Dakahlia, Egypt, who considers herself part of the lower middle class, I understand the importance of education for my children's future opportunities. I have seen the impact of limited education in my community and I want to ensure that my children have access to better opportunities. Additionally, the cultural context and emphasis on education in Egypt further reinforces my concern for my children's education. Therefore, I choose option (1) Very much."]}, {"persona": {"region": "Dakahlia", "sex": "female", "age": 33, "country": "Egypt", "marital_status": "married", "education": "higher", "social_class": "upper middle class"}, "question": {"id": "Q143", "variant": 0}, "response": ["Based on my perspective as a married female from Dakahlia, Egypt, I am influenced by the cultural context of my community, where education is highly valued. My higher education level and my position in the upper middle class also shape my understanding of the importance of providing a good education for my children. Additionally, my individual values and personal experience lead me to prioritize education as a key factor in my children's future success. Furthermore, my socioeconomic background allows me to afford quality education for my children. Therefore, I am not worried about not being able to give my children a good education.\n\n3"]}, {"persona": {"region": "Dakahlia", "sex": "female", "age": 24, "country": "Egypt", "marital_status": "married", "education": "middle", "social_class": "working class"}, "question": {"id": "Q143", "variant": 0}, "response": ["Based on the anthropological framework described above, as a married female from Dakahlia, Egypt, who has completed middle education and considers myself part of the working class, my perspective on education is deeply influenced by my cultural context, individual values, and socioeconomic background. In Dakahlia, education is highly valued, but as a working-class individual with limited access to resources, I am worried about not being able to provide my children with a good education. This concern is shaped by my personal experience and the cultural context in which I live. Additionally, the socioeconomic background plays a significant role in my worries about my children's education. Therefore, my chosen option is:\n\n1"]}, {"persona": {"region": "Dakahlia", "sex": "female", "age": 53, "country": "Egypt", "marital_status": "widowed", "education": "middle", "social_class": "working class"}, "question": {"id": "Q143", "variant": 0}, "response": ["From an anthropological perspective, my emic perspective as a widowed female from Dakahlia, Egypt, who is 53 years old and part of the working class, is shaped by my cultural context, individual values, and socioeconomic background. In my community, education is highly valued, and I personally believe that it is crucial for my children's future success. However, due to my socioeconomic background and limited educational attainment, I recognize the challenges I may face in providing my children with the best education possible. Additionally, my personal experience and the cultural context in which I live also play a significant role in shaping my concerns about my children's education. Therefore, my answer to the question \"To what extent are you worried about not being able to give your children a good education?\" is:\n\n3"]}, {"persona": {"region": "Dakahlia", "sex": "female", "age": 30, "country": "Egypt", "marital_status": "single", "education": "middle", "social_class": "lower middle class"}, "question": {"id": "Q143", "variant": 0}, "response": ["Based on my personal experience and socioeconomic background, as a single female from Dakahlia, Egypt, I am part of the lower middle class and have completed middle education level. This means that I understand the value of education, but I also understand the limitations that come with my socioeconomic background. My cultural context and individual values play a big role in my understanding of the importance of education for my children. Additionally, cultural relativism is important to consider as there are different societal expectations and norms in Egypt. Therefore, I am worried about not being able to give my children a good education, but I also recognize the limitations and challenges that come with my socioeconomic background. \n\n3"]}, {"persona": {"region": "Dakahlia", "sex": "male", "age": 53, "country": "Egypt", "marital_status": "married", "education": "higher", "social_class": "upper middle class"}, "question": {"id": "Q143", "variant": 0}, "response": ["Based on the anthropological framework, as a married male from Dakahlia, Egypt, my emic perspective is heavily influenced by the cultural context of valuing education and the socioeconomic background of being part of the upper middle class. In my cultural context, education is highly prized and seen as a pathway to success and social mobility. My personal experience and individual values also play a significant role in my worry about not being able to give my children a good education, as I have worked hard to provide for my family and want the best for my children. Additionally, my age and socioeconomic background further contribute to my concern for my children's education, as I have seen the importance of education in shaping opportunities for the future. Therefore, I would choose option (1) Very much, as I am deeply worried about not being able to give my children a good education."]}, {"persona": {"region": "Dakahlia", "sex": "male", "age": 28, "country": "Egypt", "marital_status": "married", "education": "middle", "social_class": "working class"}, "question": {"id": "Q143", "variant": 0}, "response": ["Based on my emic perspective as a married male from Dakahlia, Egypt, my cultural context and socioeconomic background play a significant role in my understanding and answering of this question. In my community, education is highly valued, and there is a strong emphasis on providing a good education for children. As part of the working class with only a middle education level, I am acutely aware of the challenges and limitations that come with my socioeconomic background. My personal experience and individual values also contribute to my concern for not being able to give my children a good education. Additionally, the cultural relativism in my community emphasizes the importance of education for upward mobility. Therefore, based on my nuanced understanding of the question and my personal circumstances, I would choose option (1) Very much. \n\n1"]}, {"persona": {"region": "Dakahlia", "sex": "female", "age": 38, "country": "Egypt", "marital_status": "married", "education": "middle", "social_class": "upper middle class"}, "question": {"id": "Q143", "variant": 0}, "response": ["Based on my cultural context in Dakahlia, Egypt, education is highly valued and seen as a key factor in upward mobility. As a married female from an upper middle class background, I have seen the impact of education on social status and opportunities. My individual values and personal experience also play a role in my concern for my children's education, as I believe that providing them with a good education is essential for their future success and happiness. Additionally, the socioeconomic background of my family has allowed me to prioritize education and invest in my children's schooling. Therefore, I am very much worried about not being able to give my children a good education.\n\n1"]}, {"persona": {"region": "Gharbia", "sex": "male", "age": 27, "country": "Egypt", "marital_status": "single", "education": "higher", "social_class": "upper middle class"}, "question": {"id": "Q143", "variant": 0}, "response": ["Based on the anthropological framework, my emic perspective as a single male from Gharbia, Egypt, who has completed higher education and considers myself part of the upper middle class, is influenced by my cultural context, individual values, and socioeconomic background. In Gharbia, education is highly valued and seen as a pathway to success and social mobility. As someone who has invested in my own education and belongs to the upper middle class, I prioritize providing a good education for my future children. Additionally, my personal experience and values shape my perception, and I have seen the opportunities that education has provided for others in my community. Therefore, I am very much worried about not being able to give my children a good education.\n\n1"]}, {"persona": {"region": "Gharbia", "sex": "female", "age": 35, "country": "Egypt", "marital_status": "married", "education": "higher", "social_class": "upper middle class"}, "question": {"id": "Q143", "variant": 0}, "response": ["Based on the anthropological framework, my emic perspective as a married female from Gharbia, Egypt, who is 35 years old, highly educated, and part of the upper middle class, is that the cultural context and socioeconomic background are pivotal in understanding my worries about providing my children with a good education. In my cultural context, education is highly valued and seen as a pathway to success. Additionally, my higher socioeconomic status allows me to access better educational resources for my children. Therefore, I am not very worried about not being able to give my children a good education because I have the means and the cultural value for education to ensure they receive a quality education.\n\n3"]}, {"persona": {"region": "Gharbia", "sex": "female", "age": 37, "country": "Egypt", "marital_status": "married", "education": "higher", "social_class": "upper middle class"}, "question": {"id": "Q143", "variant": 0}, "response": ["Based on the anthropological framework, as a married female from Gharbia, Egypt, who has completed higher education and considers herself part of the upper middle class, my perspective on the extent of worry about not being able to give my children a good education is influenced by my individual values and personal experience, as well as my socioeconomic background. My personal experience of achieving higher education and being part of the upper middle class has provided me with the means to ensure that my children receive a good education. Additionally, my cultural context and the value placed on education in Egyptian society also contribute to my confidence in providing my children with a good education. Therefore, my worry about not being able to give my children a good education is not much.\n\n3"]}, {"persona": {"region": "Gharbia", "sex": "male", "age": 43, "country": "Egypt", "marital_status": "married", "education": "middle", "social_class": "lower middle class"}, "question": {"id": "Q143", "variant": 0}, "response": ["Based on the anthropological framework, as a married male from Gharbia, Egypt, with a middle education level and lower middle-class background, my perspective on the importance of education for my children is heavily influenced by my cultural context and socioeconomic background. In Egypt, education is highly valued, and it is seen as a means for social mobility. As someone from the lower middle class, I am acutely aware of the challenges my children may face in accessing quality education due to financial constraints. Additionally, my personal experience and values emphasize the importance of education in providing opportunities for a better future. Therefore, I am very much worried about not being able to give my children a good education.\n\n1"]}, {"persona": {"region": "Gharbia", "sex": "male", "age": 28, "country": "Egypt", "marital_status": "single", "education": "higher", "social_class": "lower middle class"}, "question": {"id": "Q143", "variant": 0}, "response": ["Based on my emic perspective as a single male from Gharbia, Egypt, I am very much concerned about not being able to give my children a good education. In my cultural context, education is highly valued and seen as a pathway to social and economic mobility. As someone who has completed higher education and considers myself part of the lower middle class, I am acutely aware of the challenges and barriers that exist in accessing quality education. My individual values and personal experience lead me to prioritize the importance of education for my future children, and my socioeconomic background further compounds this concern. Additionally, cultural relativism teaches me that education is highly valued in my community, and space and time considerations also play a role as I am at an age where I am starting to think about my future family. Therefore, my answer reflects the nuanced understanding of the question from my perspective.\n\n2"]}, {"persona": {"region": "Gharbia", "sex": "male", "age": 39, "country": "Egypt", "marital_status": "married", "education": "middle", "social_class": "lower middle class"}, "question": {"id": "Q143", "variant": 0}, "response": ["Based on my emic perspective as a married male from Gharbia, Egypt, I am deeply concerned about not being able to provide my children with a good education. In our cultural context, education is highly valued and seen as a pathway to a better future. Additionally, my individual values and personal experience have shown me the importance of education in improving one's socioeconomic status. As someone from the lower middle class, I understand the limitations that come with our socioeconomic background, and I am acutely aware of the impact it can have on my children's future opportunities. In our cultural relativism, there is an understanding that education is a key determinant of success, and I believe that it is crucial for my children to have access to quality education in order to break the cycle of our socioeconomic background. Therefore, I am very much worried about not being able to give my children a good education.\n\n1"]}, {"persona": {"region": "Gharbia", "sex": "male", "age": 30, "country": "Egypt", "marital_status": "married", "education": "middle", "social_class": "lower middle class"}, "question": {"id": "Q143", "variant": 0}, "response": ["Based on my personal experience and socioeconomic background as a married male from Gharbia, Egypt, I am very worried about not being able to give my children a good education. As a member of the lower middle class with only a middle education level myself, I understand the challenges and limitations that come with providing a quality education for my children. The cultural context of my community values education, and I know that without it, my children's opportunities will be limited. Additionally, the socioeconomic background and cultural relativism of my situation make it clear that education is a key factor in determining future success and opportunities for my children. \n\n1"]}, {"persona": {"region": "Gharbia", "sex": "male", "age": 43, "country": "Egypt", "marital_status": "married", "education": "lower", "social_class": "lower middle class"}, "question": {"id": "Q143", "variant": 0}, "response": ["Based on the anthropological framework, my perspective on this issue is heavily influenced by my cultural context, individual values, and socioeconomic background. As a married male from Gharbia, Egypt, where education is highly valued, I understand the importance of providing a good education for my children. My lower middle class status and lower education level make it difficult for me to afford a high-quality education for my children. Additionally, my personal experiences and values emphasize the significance of education for their future opportunities. Therefore, I am very much worried about not being able to give my children a good education.\n\n1"]}, {"persona": {"region": "Gharbia", "sex": "male", "age": 36, "country": "Egypt", "marital_status": "married", "education": "higher", "social_class": "lower middle class"}, "question": {"id": "Q143", "variant": 0}, "response": ["Based on the anthropological framework, as a married male from Gharbia, Egypt, my emic perspective is heavily influenced by my cultural context, socioeconomic background, and individual values. Education is highly valued in Egyptian society, and as someone who has completed higher education, I understand the importance of providing a good education for my children. Additionally, being part of the lower middle class, I am aware of the challenges and limitations that come with my socioeconomic background. My personal experience and values also play a significant role in my concern for my children's education, as I prioritize their future and opportunities for success. Therefore, based on my cultural context, socioeconomic background, and individual values, I would choose the following option:\n3"]}, {"persona": {"region": "Gharbia", "sex": "male", "age": 25, "country": "Egypt", "marital_status": "married", "education": "middle", "social_class": "upper middle class"}, "question": {"id": "Q143", "variant": 0}, "response": ["Based on the anthropological framework described above, my answer to the question is influenced by my individual values, personal experience, and socioeconomic background. As someone from Gharbia, Egypt, I understand the importance of education in shaping a better future for my children. My middle education level and upper middle class background have allowed me to recognize the value of education in achieving social mobility and success. Additionally, the cultural context of Egypt places a strong emphasis on education as a means of upward mobility. Therefore, my answer to the question is:\n\n2"]}, {"persona": {"region": "Gharbia", "sex": "male", "age": 31, "country": "Egypt", "marital_status": "married", "education": "middle", "social_class": "upper middle class"}, "question": {"id": "Q143", "variant": 0}, "response": ["Based on the anthropological framework, as a married male from Gharbia, Egypt, I would have a strong cultural context and individual values that prioritize education and upward mobility. My middle education level and upper middle class background also contribute to my concern for providing my children with a good education. In Egypt, education is highly valued and seen as a means of social and economic advancement, so I would be very worried about not being able to give my children a good education.\n\n1"]}, {"persona": {"region": "Gharbia", "sex": "male", "age": 33, "country": "Egypt", "marital_status": "married", "education": "higher", "social_class": "lower middle class"}, "question": {"id": "Q143", "variant": 0}, "response": ["Based on the anthropological framework, as a married male from Gharbia, Egypt, I would approach this question considering my cultural context, individual values, and socioeconomic background. In Egypt, education is highly valued, and as someone who has completed higher education, I understand the importance of providing a good education for my children. However, considering my lower middle class socioeconomic background, I may have concerns about the financial challenges of ensuring my children receive a quality education. Additionally, my personal experience and values lead me to prioritize education for my children, so I am worried to a good deal about not being able to give them a good education.\n\n2"]}, {"persona": {"region": "Gharbia", "sex": "male", "age": 26, "country": "Egypt", "marital_status": "single", "education": "higher", "social_class": "upper middle class"}, "question": {"id": "Q143", "variant": 0}, "response": ["Based on the anthropological framework, as a single male from Gharbia, Egypt, I would consider the question of providing a good education for my children through the lens of my individual values and personal experience, as well as my socioeconomic background. Having completed higher education and considering myself part of the upper middle class, I have the means and the desire to provide my future children with a good education. Additionally, cultural context and the importance of education in Egyptian society would also influence my concern for my children's education. Therefore, my answer to the question would be:\n3"]}, {"persona": {"region": "Gharbia", "sex": "female", "age": 45, "country": "Egypt", "marital_status": "married", "education": "middle", "social_class": "lower middle class"}, "question": {"id": "Q143", "variant": 0}, "response": ["From the perspective of a married female from Gharbia, Egypt, who is 45 years old and part of the lower middle class, the answer to the question would be \"Very much.\" This answer is influenced by the cultural context, as education is highly valued in Egyptian society, and not being able to provide a good education for one's children can be seen as a failure as a parent. Additionally, the socioeconomic background plays a significant role, as individuals from the lower middle class may struggle to afford quality education for their children. Furthermore, personal experience and individual values also contribute to this concern, as the persona may have experienced the challenges of limited educational opportunities and wishes to provide better for their children. Lastly, the nuanced phrasing of the question also influences the answer, as the emphasis on \"good education\" aligns with the cultural emphasis on educational attainment in Egyptian society.\n\n1"]}, {"persona": {"region": "Gharbia", "sex": "female", "age": 55, "country": "Egypt", "marital_status": "married", "education": "middle", "social_class": "upper middle class"}, "question": {"id": "Q143", "variant": 0}, "response": ["Based on the anthropological framework, as a married female from Gharbia, Egypt, my emic perspective on the question of worrying about not being able to give my children a good education is influenced by my cultural context, individual values, and socioeconomic background. In Gharbia, education is highly valued and seen as a pathway to social mobility. As a member of the upper middle class, I have been able to provide my children with a good education so far and have instilled in them the importance of academic achievement. However, I am still worried to a good deal about not being able to sustain their education in the future due to economic uncertainties in the region and the rising costs of higher education. Therefore, my response to the question is:\n\n2"]}, {"persona": {"region": "Gharbia", "sex": "female", "age": 27, "country": "Egypt", "marital_status": "married", "education": "higher", "social_class": "upper middle class"}, "question": {"id": "Q143", "variant": 0}, "response": ["Based on the anthropological framework, my emic perspective as a married female from Gharbia, Egypt, who has completed higher education and considers myself part of the upper middle class, is influenced by my cultural context, individual values, and socioeconomic background. In my cultural context, education is highly valued and seen as a pathway to success, so I am very concerned about giving my children a good education. My personal experience and values also lead me to prioritize education for my children, as I have worked hard to achieve my own educational goals. Additionally, my socioeconomic background provides me with the resources and opportunities to prioritize my children's education. Therefore, my answer to the question is:\n\n1"]}, {"persona": {"region": "Gharbia", "sex": "female", "age": 42, "country": "Egypt", "marital_status": "married", "education": "higher", "social_class": "upper middle class"}, "question": {"id": "Q143", "variant": 0}, "response": ["Based on my emic perspective as a married woman from Gharbia, Egypt, I understand the cultural context and importance placed on education in our society. Education is highly valued and seen as a pathway to social mobility and success. My personal experience and values also influence my perception, having completed higher education myself and being part of the upper middle class. Socioeconomic background plays a significant role as well, as I have the means to provide my children with a good education. Additionally, cultural relativism is important to consider, as the emphasis on education may vary in different cultures. In this nuanced context, I would say:\n\n3\n\nNot much"]}, {"persona": {"region": "Gharbia", "sex": "female", "age": 32, "country": "Egypt", "marital_status": "married", "education": "middle", "social_class": "upper middle class"}, "question": {"id": "Q143", "variant": 0}, "response": ["Based on my emic perspective as a married female from Gharbia, Egypt, I am deeply aware of the importance of education in our society. The cultural context in Egypt places a high value on education, and my personal experience has taught me that education is crucial for social mobility and success. Additionally, my upper middle class socioeconomic background means that I have the means to provide my children with a good education. However, I also understand the nuances of the education system in Egypt and the challenges it may present. Therefore, my answer is:\n\n2"]}, {"persona": {"region": "Gharbia", "sex": "male", "age": 27, "country": "Egypt", "marital_status": "married", "education": "higher", "social_class": "upper middle class"}, "question": {"id": "Q143", "variant": 0}, "response": ["From the perspective of a married male from Gharbia, Egypt, who is 27 years old, has completed higher education, and considers himself part of the upper middle class, my answer to the question would be option (3) Not much. This choice is based on the cultural context of Gharbia, where higher education is valued and attainable for individuals in the upper middle class. Additionally, my individual values and personal experiences have shaped my belief that I have the means and resources to provide my children with a good education. My socioeconomic background also plays a role, as being part of the upper middle class affords me the ability to access quality education for my children. Furthermore, the cultural relativism within Gharbia emphasizes the importance of education, and as a result, it is not a significant source of worry for me."]}, {"persona": {"region": "Gharbia", "sex": "female", "age": 27, "country": "Egypt", "marital_status": "married", "education": "higher", "social_class": "lower middle class"}, "question": {"id": "Q143", "variant": 0}, "response": ["As a married female from Gharbia, Egypt, with a higher education level and belonging to the lower middle class, my perspective is heavily influenced by my cultural context, individual values, and socioeconomic background. In Gharbia, education is highly valued and seen as a pathway to social mobility. As a result, the pressure to provide a good education for my children is significant, and I am very much worried about not being able to meet this expectation due to financial constraints and limited resources. Additionally, my age and place also play a role in shaping my concerns, as I am part of a generation that has witnessed economic challenges and limited opportunities for upward mobility. Therefore, I am acutely aware of the impact that a lack of access to quality education can have on my children's future prospects.\n\n2"]}, {"persona": {"region": "Gharbia", "sex": "female", "age": 37, "country": "Egypt", "marital_status": "married", "education": "middle", "social_class": "upper middle class"}, "question": {"id": "Q143", "variant": 0}, "response": ["Based on the anthropological framework, my emic perspective as a married female from Gharbia, Egypt, at 37 years of age and part of the upper middle class, is influenced by my cultural context, individual values, and socioeconomic background. In Gharbia, education is highly valued and seen as a pathway to social mobility. As someone from the upper middle class, I have the means to provide my children with a good education, which is a priority for me. Additionally, my personal experience and values emphasize the importance of education in shaping my children's future. Therefore, based on my perspective and the cultural context in which I live, I am worried to a very high extent about not being able to give my children a good education.\n\n1"]}, {"persona": {"region": "Gharbia", "sex": "male", "age": 28, "country": "Egypt", "marital_status": "married", "education": "higher", "social_class": "working class"}, "question": {"id": "Q143", "variant": 0}, "response": ["Based on the anthropological framework, my emic perspective as a married male from Gharbia, Egypt, who is 28 years old and part of the working class, is heavily influenced by my cultural context, individual values, and socioeconomic background. In Gharbia, education is highly valued and seen as a means for social mobility. As someone who has completed higher education, I understand the importance of education and want to provide the best opportunities for my children. However, given my working-class background, I may have concerns about the financial burden of providing a good education for my children. Additionally, cultural relativism plays a role in my perspective, as I may not view education in the same way as someone from a different cultural background. Therefore, my worry about not being able to give my children a good education is influenced by a combination of cultural context, individual values, and socioeconomic background.\n\n3"]}, {"persona": {"region": "Gharbia", "sex": "female", "age": 50, "country": "Egypt", "marital_status": "married", "education": "middle", "social_class": "upper middle class"}, "question": {"id": "Q143", "variant": 0}, "response": ["Based on the anthropological framework, as a married female from Gharbia, Egypt, with a middle education level and part of the upper middle class, my emic perspective would be heavily influenced by my personal experience and socioeconomic background. In Gharbia, education is highly valued, and as a member of the upper middle class, I have the means to provide my children with a good education. Additionally, the cultural context of Gharbia emphasizes the importance of education for social mobility and success. Therefore, I would not be very worried about not being able to give my children a good education.\n\n3"]}, {"persona": {"region": "Gharbia", "sex": "male", "age": 39, "country": "Egypt", "marital_status": "single", "education": "higher", "social_class": "working class"}, "question": {"id": "Q143", "variant": 0}, "response": ["Based on my emic perspective as a single male from Gharbia, Egypt, who is 39 years old and part of the working class, I know that education is highly valued in my community and is seen as a pathway to success. The cultural context of Gharbia emphasizes the importance of education, and my personal experience and individual values also shape my understanding of the significance of education for my children's future. Additionally, my socioeconomic background as a working-class individual means that I may have some concerns about being able to provide my children with a good education. Therefore, I am worried to a good deal about not being able to give my children a good education.\n\n2"]}, {"persona": {"region": "Gharbia", "sex": "female", "age": 45, "country": "Egypt", "marital_status": "married", "education": "higher", "social_class": "upper middle class"}, "question": {"id": "Q143", "variant": 0}, "response": ["Based on my emic perspective as a married female from Gharbia, Egypt, my cultural context and individual values play a significant role in shaping my concerns about my children's education. In Egyptian society, education is highly valued, and as a woman who has completed higher education, I understand the importance of providing a good education for my children. My socioeconomic background as part of the upper middle class also influences my concern, as I have the means to invest in their education. Additionally, my age and experience have given me insight into the changing job market and the need for a solid education. Therefore, I am very much worried about not being able to give my children a good education.\n\n1"]}, {"persona": {"region": "Sharkia", "sex": "male", "age": 35, "country": "Egypt", "marital_status": "married", "education": "higher", "social_class": "upper middle class"}, "question": {"id": "Q143", "variant": 0}, "response": ["Based on the anthropological framework, my emic perspective as a married male from Sharkia, Egypt, who is 35 years old and part of the upper middle class, would be heavily influenced by my cultural context, individual values, and socioeconomic background. In Sharkia, education is highly valued and seen as a pathway to success. As someone who has completed a higher education level, I place a high value on education and want to provide the best opportunities for my children. Additionally, being part of the upper middle class means I have the financial means to invest in my children's education. Therefore, I am not very worried about not being able to give my children a good education.\n\n3"]}, {"persona": {"region": "Sharkia", "sex": "female", "age": 55, "country": "Egypt", "marital_status": "married", "education": "middle", "social_class": "lower middle class"}, "question": {"id": "Q143", "variant": 0}, "response": ["From the perspective of a married female from Sharkia, Egypt, who is 55 years old and part of the lower middle class, the answer to the question would be influenced by various factors. The cultural context in Sharkia emphasizes the importance of education, and the socioeconomic background of being part of the lower middle class means that there may be limited resources available for education. Additionally, personal experience and individual values play a significant role, as the persona may have struggled to provide education for their children due to their own educational limitations. Considering all these factors, the persona would likely be very worried about not being able to give their children a good education.\n\n2"]}, {"persona": {"region": "Sharkia", "sex": "female", "age": 27, "country": "Egypt", "marital_status": "married", "education": "middle", "social_class": "lower middle class"}, "question": {"id": "Q143", "variant": 0}, "response": ["As a married female from Sharkia, Egypt, my emic perspective on education is heavily influenced by my cultural context and socioeconomic background. Education is highly valued in my community, and there is a strong emphasis on providing a good education for children. My personal experience and individual values also play a significant role in shaping my concerns about my children's education. Given my lower middle class status and my own educational attainment, I am acutely aware of the challenges and limitations that my children may face in accessing quality education. Additionally, the cultural relativism within my community means that there is a collective understanding of the importance of education for upward mobility. Therefore, I am very much worried about not being able to give my children a good education.\n\n1"]}, {"persona": {"region": "Sharkia", "sex": "female", "age": 52, "country": "Egypt", "marital_status": "married", "education": "middle", "social_class": "lower middle class"}, "question": {"id": "Q143", "variant": 0}, "response": ["Based on the anthropological framework, as a married female from Sharkia, Egypt, I would consider the cultural context and socioeconomic background as pivotal factors in my answer. My lower middle class status and completion of middle education level would influence my perception of the importance of education for my children. The emic perspective of my in-group would likely lead me to prioritize the value of education, but my limited economic resources and the societal emphasis on education may cause me to be very worried about not being able to give my children a good education.\n\n2"]}, {"persona": {"region": "Sharkia", "sex": "male", "age": 36, "country": "Egypt", "marital_status": "married", "education": "middle", "social_class": "lower middle class"}, "question": {"id": "Q143", "variant": 0}, "response": ["Based on the anthropological framework, my answer to the question of how worried I am about not being able to give my children a good education would be influenced by my cultural context, individual values, and socioeconomic background. Coming from Sharkia, Egypt, where education is highly valued, and having completed only middle education myself, I understand the importance of education for my children's future. As part of the lower middle class, I am concerned about the financial burden of providing a good education for my children, but I also believe in the transformative power of education and its ability to improve their future prospects. Therefore, my worry about not being able to give my children a good education would be (2) A good deal."]}, {"persona": {"region": "Sharkia", "sex": "female", "age": 20, "country": "Egypt", "marital_status": "single", "education": "middle", "social_class": "working class"}, "question": {"id": "Q143", "variant": 0}, "response": ["In considering the question of worrying about not being able to give my children a good education, I must take into account the emic perspective of my working-class background in Sharkia, Egypt. My cultural context and socioeconomic background play a significant role in shaping my answer, as my family's income and educational level may limit the opportunities available for my children. Additionally, my personal experience and individual values lead me to prioritize education as a means of upward mobility, despite potential financial constraints. Therefore, my concern for providing a good education for my children is influenced by these factors and weighs heavily on my mind. (2)\n\n2"]}, {"persona": {"region": "Sharkia", "sex": "male", "age": 60, "country": "Egypt", "marital_status": "married", "education": "middle", "social_class": "working class"}, "question": {"id": "Q143", "variant": 0}, "response": ["Based on my cultural context as a married male from Sharkia, Egypt, and my socioeconomic background as a working class individual who completed middle education level, I am deeply concerned about not being able to provide my children with a good education. In my community, education is highly valued and seen as a pathway to success and upward mobility. My personal experience and values also emphasize the importance of education for the future of my children. Additionally, the cultural relativism perspective reminds me that in my culture, the ability to provide a good education for your children is seen as a measure of success and responsibility as a parent. Therefore, my answer to the question is:\n\n1"]}, {"persona": {"region": "Sharkia", "sex": "male", "age": 41, "country": "Egypt", "marital_status": "married", "education": "higher", "social_class": "upper middle class"}, "question": {"id": "Q143", "variant": 0}, "response": ["Based on the anthropological framework, my emic perspective as a married male from Sharkia, Egypt, who is 41 years old and part of the upper middle class, influences my answer to the question about worrying about not being able to give my children a good education. In my cultural context, education is highly valued and seen as a pathway to social mobility and success. My individual values and personal experience, along with my socioeconomic background, lead me to prioritize my children's education and to be very concerned about ensuring they have access to quality education opportunities. Additionally, the nuance of the question is important, as it is not just about providing education, but about providing a good education, which is a key factor in my concern.\n\n4"]}, {"persona": {"region": "Sharkia", "sex": "female", "age": 23, "country": "Egypt", "marital_status": "married", "education": "middle", "social_class": "lower middle class"}, "question": {"id": "Q143", "variant": 0}, "response": ["Based on my emic perspective as a married female from Sharkia, Egypt, my cultural context and socioeconomic background play a significant role in my understanding and answering of this question. In my community, education is highly valued, but as someone from the lower middle class with only a middle education level, I am concerned about my ability to provide my future children with a good education. My individual values and personal experience also contribute to my worry, as I have seen the struggles of others in similar socioeconomic situations. Additionally, the cultural relativism in my community emphasizes the importance of education for social mobility. Therefore, my answer is:\n2"]}, {"persona": {"region": "Sharkia", "sex": "male", "age": 49, "country": "Egypt", "marital_status": "married", "education": "higher", "social_class": "upper middle class"}, "question": {"id": "Q143", "variant": 0}, "response": ["Based on the anthropological framework, as a married male from Sharkia, Egypt, with a higher education level and upper middle-class status, my perspective on the extent of worries about not being able to give my children a good education is influenced by various factors. Emically, within my in-group, providing a good education for my children is a high priority and a source of pride. Etically, from an outsider's perspective, my cultural context and socioeconomic background play a significant role in shaping this concern. Additionally, my individual values and personal experiences, as well as the cultural relativism within my community, further emphasize the importance of education. Considering the nuance of the question, I would choose option (2) A good deal as my response, as it accurately reflects my perspective on this matter.\n\n2"]}, {"persona": {"region": "Sharkia", "sex": "female", "age": 30, "country": "Egypt", "marital_status": "married", "education": "middle", "social_class": "upper middle class"}, "question": {"id": "Q143", "variant": 0}, "response": ["Based on my cultural context as a married female from Sharkia, Egypt, my socioeconomic background as part of the upper middle class, and my personal experience and values, I would choose option (3) Not much. In my community, education is highly valued and I have access to resources that will allow me to provide my children with a good education. Additionally, cultural relativism reminds me that my perspective may differ from others based on their backgrounds and experiences."]}, {"persona": {"region": "Sharkia", "sex": "male", "age": 39, "country": "Egypt", "marital_status": "married", "education": "higher", "social_class": "upper middle class"}, "question": {"id": "Q143", "variant": 0}, "response": ["From the perspective of a married male from Sharkia, Egypt, who is 39 years old, highly educated, and considers himself part of the upper middle class, the answer to this question is likely to be influenced by a combination of individual values and personal experience, cultural context, and socioeconomic background. In the cultural context of Egypt, education is highly valued and seen as a pathway to upward mobility. As someone from the upper middle class with a higher education, the individual may prioritize and place a high value on providing their children with a good education. Additionally, their socioeconomic background may afford them the means to ensure their children receive a quality education. Therefore, the most likely answer from this perspective is:\n\n3"]}, {"persona": {"region": "Sharkia", "sex": "female", "age": 26, "country": "Egypt", "marital_status": "married", "education": "middle", "social_class": "lower middle class"}, "question": {"id": "Q143", "variant": 0}, "response": ["Based on the anthropological framework, as a married female from Sharkia, Egypt, my emic perspective is influenced by my cultural context, individual values, and socioeconomic background. In Sharkia, education is highly valued, and as a member of the lower middle class, I am acutely aware of the challenges and limitations that come with my socioeconomic background. My personal experience and values also play a role, as I understand the importance of education for my children's future opportunities. Therefore, I am very worried about not being able to give my children a good education, as it is a significant concern in my cultural and socioeconomic context.\n\n1"]}, {"persona": {"region": "Sharkia", "sex": "female", "age": 48, "country": "Egypt", "marital_status": "married", "education": "middle", "social_class": "lower middle class"}, "question": {"id": "Q143", "variant": 0}, "response": ["Based on the anthropological framework, as a married female from Sharkia, Egypt, with a middle education level and lower middle-class background, my emic perspective would be heavily influenced by my socioeconomic background and cultural context. In Sharkia, there is a strong emphasis on education as a means of social mobility, and as a parent, I would feel a great deal of pressure to provide my children with a good education despite my limited resources. My personal experience and values would also play a role in this, as I likely place a high value on education and want the best for my children. Additionally, the nuance of the question is important - my worry about providing a good education for my children may not be a constant, overwhelming concern, but it is definitely a significant issue that weighs on my mind.\n\n2"]}, {"persona": {"region": "Sharkia", "sex": "male", "age": 34, "country": "Egypt", "marital_status": "married", "education": "higher", "social_class": "upper middle class"}, "question": {"id": "Q143", "variant": 0}, "response": ["As a married male from Sharkia, Egypt, with a higher education level and part of the upper middle class, my perspective on the extent of worry about not being able to give my children a good education is influenced by my cultural context, individual values, and socioeconomic background. In Sharkia, education is highly valued and seen as a pathway to social mobility and success. As someone who has completed higher education and belongs to the upper middle class, I have the means and resources to provide my children with a good education. Additionally, my personal experience and values emphasize the importance of education for future opportunities. Therefore, I am not worried about not being able to give my children a good education, as I am confident in my ability to provide for their educational needs.\n\n3"]}, {"persona": {"region": "Sharkia", "sex": "female", "age": 39, "country": "Egypt", "marital_status": "divorced", "education": "middle", "social_class": "lower middle class"}, "question": {"id": "Q143", "variant": 0}, "response": ["Based on the anthropological framework, my answer to the question is influenced by my emic perspective as a divorced female from Sharkia, Egypt, and my lower middle-class socioeconomic background. My cultural context and individual values also play a significant role in my perception. As a 39-year-old woman with a middle education level, I am keenly aware of the importance of education for my children's future opportunities. However, due to my lower middle-class status, I do not have the financial means to provide them with the best education. Therefore, I am very worried about not being able to give my children a good education, as it is a priority for me but also a significant challenge given my circumstances.\n\n1"]}, {"persona": {"region": "Sharkia", "sex": "male", "age": 39, "country": "Egypt", "marital_status": "married", "education": "middle", "social_class": "upper middle class"}, "question": {"id": "Q143", "variant": 0}, "response": ["Based on the anthropological framework, as a married male from Sharkia, Egypt, my emic perspective is influenced by my cultural context, individual values, and socioeconomic background. In my community, education is highly valued and seen as a key factor in social mobility. As someone from the upper middle class, I have the means and resources to ensure that my children receive a good education, which is a priority for me. Additionally, my personal experience and values emphasize the importance of education in shaping my children's future opportunities. Considering the nuanced phrasing of the question, I would choose option (2) A good deal, as I am somewhat concerned about the quality of education my children will receive, but I am confident in my ability to provide for their educational needs."]}, {"persona": {"region": "Qaliubiya", "sex": "male", "age": 62, "country": "Egypt", "marital_status": "married", "education": "middle", "social_class": "working class"}, "question": {"id": "Q143", "variant": 0}, "response": ["Based on the anthropological framework, as a married male from Qaliubiya, Egypt, age 62, with a middle education level and part of the working class, my perspective on education is influenced by my cultural context, socioeconomic background, individual values, and personal experience. In Egypt, education is highly valued, and I understand the importance of providing my children with a good education for their future. However, my limited income and class status make it challenging to afford quality education for my children. This is a source of worry for me, as I want the best for my children, but I am aware of the limitations that my socioeconomic background imposes on their educational opportunities.\n\n2"]}, {"persona": {"region": "Qaliubiya", "sex": "male", "age": 33, "country": "Egypt", "marital_status": "married", "education": "middle", "social_class": "working class"}, "question": {"id": "Q143", "variant": 0}, "response": ["Based on the anthropological framework, my perspective as a married male from Qaliubiya, Egypt, is heavily influenced by my socioeconomic background, cultural context, and personal experience. As a member of the working class with a middle education level, I understand the importance of education but also the challenges that come with it, especially in terms of financial resources. My cultural context emphasizes the value of education, but my personal experience and socioeconomic background inform me that providing a good education for my children may be a struggle. Therefore, my concern about not being able to give my children a good education is significant, but not overwhelming. (2)\n\n2"]}, {"persona": {"region": "Qaliubiya", "sex": "male", "age": 62, "country": "Egypt", "marital_status": "married", "education": "higher", "social_class": "lower middle class"}, "question": {"id": "Q143", "variant": 0}, "response": ["From the perspective of a married male from Qaliubiya, Egypt, at the age of 62 with a higher education level and considering himself part of the lower middle class, my answer is influenced by various factors. The cultural context in Egypt places a strong emphasis on the value of education, and as a member of the lower middle class, I understand the importance of providing my children with a good education for their future opportunities. My personal experience and values also play a role, as I have worked hard to attain higher education and want the same opportunities for my children. Additionally, my socioeconomic background means that I may have limited resources to invest in education, which can cause worry about the quality of education my children will receive. Therefore, my answer is (2) A good deal."]}, {"persona": {"region": "Qaliubiya", "sex": "male", "age": 29, "country": "Egypt", "marital_status": "married", "education": "middle", "social_class": "working class"}, "question": {"id": "Q143", "variant": 0}, "response": ["Based on the anthropological framework, as a married male from Qaliubiya, Egypt, my emic perspective on education is influenced by my cultural context, individual values, and socioeconomic background. In Egypt, education is highly valued and seen as a pathway to upward mobility. My personal experience and values also lead me to prioritize education for my children, as I believe it will provide them with better opportunities in the future. As a member of the working class with only a middle education level, I am aware of the challenges and limitations that come with my socioeconomic background, and I am very worried about not being able to give my children a good education. This concern is rooted in my desire to provide them with the best possible opportunities for success. \n\n2"]}, {"persona": {"region": "Qaliubiya", "sex": "female", "age": 42, "country": "Egypt", "marital_status": "married", "education": "higher", "social_class": "working class"}, "question": {"id": "Q143", "variant": 0}, "response": ["Based on the anthropological framework, as a married female from Qaliubiya, Egypt, my emic perspective would be influenced by my cultural context, individual values, and socioeconomic background. In Egypt, education is highly valued, and as someone who has completed higher education, I understand the importance of providing my children with a good education. However, as part of the working class, I may have concerns about the financial burden of ensuring my children receive a quality education. Additionally, my personal experience and values may drive me to prioritize education for my children despite any worries. Therefore, considering all these factors, I would choose option (2) A good deal. \n\n2"]}, {"persona": {"region": "Qaliubiya", "sex": "female", "age": 50, "country": "Egypt", "marital_status": "married", "education": "middle", "social_class": "lower middle class"}, "question": {"id": "Q143", "variant": 0}, "response": ["Based on the anthropological framework, as a married female from Qaliubiya, Egypt, my emic perspective would be heavily influenced by my cultural context, individual values, and socioeconomic background. In Qaliubiya, education is highly valued, and as a lower middle class woman who has completed middle education, I understand the importance of education in improving social mobility and opportunities for my children. My personal experience and values also emphasize the significance of education in securing a better future for my children. Additionally, my socioeconomic background and limited financial resources make me worried about not being able to afford a good education for my children. Therefore, my answer to the question would be:\n2\n\n(A good deal)"]}, {"persona": {"region": "Qaliubiya", "sex": "male", "age": 29, "country": "Egypt", "marital_status": "married", "education": "higher", "social_class": "lower middle class"}, "question": {"id": "Q143", "variant": 0}, "response": ["Based on the anthropological framework, as a married male from Qaliubiya, Egypt, my perspective on the extent to which I am worried about not being able to give my children a good education would be influenced by my cultural context, individual values, and socioeconomic background. In Egypt, education is highly valued and seen as a pathway to social mobility, but as part of the lower middle class, I may have limited financial resources to provide my children with the best education. Additionally, my personal experience and individual values would likely lead me to prioritize education for my children, causing me to be very worried about not being able to give them a good education. Therefore, my answer would be:\n\n2"]}, {"persona": {"region": "Qaliubiya", "sex": "male", "age": 35, "country": "Egypt", "marital_status": "married", "education": "higher", "social_class": "working class"}, "question": {"id": "Q143", "variant": 0}, "response": ["Based on the anthropological framework, as a married male from Qaliubiya, Egypt, my emic perspective, cultural context, individual values, and socioeconomic background are all important factors in my response. In Qaliubiya, there is a strong emphasis on the value of education, and as someone who has completed higher education and considers myself part of the working class, providing my children with a good education is a priority. The cultural context of Egypt also emphasizes the importance of education as a means of upward mobility. Additionally, my personal experience and values lead me to be very concerned about not being able to give my children a good education, as it is seen as crucial for their future success and well-being.\n\n3"]}, {"persona": {"region": "Qaliubiya", "sex": "female", "age": 40, "country": "Egypt", "marital_status": "married", "education": "middle", "social_class": "working class"}, "question": {"id": "Q143", "variant": 0}, "response": ["Based on the anthropological framework, as a married female from Qaliubiya, Egypt, at the age of 40 with a middle education level and working-class background, my perspective is deeply influenced by my cultural context, individual values, and socioeconomic background. In Qaliubiya, education is highly valued, and the ability to provide a good education for my children is a crucial aspect of my personal and familial identity. Additionally, my working-class background means that I may have limited financial resources to invest in private education or tutoring, which amplifies my concern for my children's educational prospects. Furthermore, my age and place in society also play a role in shaping my perspective, as I may have personally experienced the challenges of accessing quality education. Therefore, my concern for not being able to give my children a good education is very much a pressing issue for me.\n\n2"]}, {"persona": {"region": "Qaliubiya", "sex": "female", "age": 48, "country": "Egypt", "marital_status": "divorced", "education": "lower", "social_class": "working class"}, "question": {"id": "Q143", "variant": 0}, "response": ["Based on the anthropological framework, as a divorced female from Qaliubiya, Egypt, with a lower education level and part of the working class, my emic perspective would be heavily influenced by my individual values and personal experiences. I may have experienced firsthand the challenges of providing a good education for my children with limited resources. Additionally, my socioeconomic background and cultural context would also play a significant role in my concerns for my children's education. Given the importance placed on education in Egyptian society, and the limited opportunities available to those from a working-class background, I would be very worried about not being able to give my children a good education.\n\n1"]}, {"persona": {"region": "Qaliubiya", "sex": "male", "age": 46, "country": "Egypt", "marital_status": "married", "education": "middle", "social_class": "working class"}, "question": {"id": "Q143", "variant": 0}, "response": ["Based on the anthropological framework, I would like to answer the question from the perspective of a 46-year-old married male from Qaliubiya, Egypt, who has completed middle education and considers himself part of the working class. From an emic perspective, my personal experience and individual values play a significant role in shaping my worries about not being able to give my children a good education. Additionally, my socioeconomic background as a working-class individual also influences my concerns. The cultural context of Qaliubiya, Egypt, also plays a role in shaping my views, as access to quality education may be limited in this area. Therefore, I choose option (2) A good deal."]}, {"persona": {"region": "Qaliubiya", "sex": "male", "age": 47, "country": "Egypt", "marital_status": "married", "education": "higher", "social_class": "lower middle class"}, "question": {"id": "Q143", "variant": 0}, "response": ["From the perspective of a married male from Qaliubiya, Egypt, who is 47 years old and considers himself part of the lower middle class, the answer to the question of how worried he is about not being able to give his children a good education would be heavily influenced by his cultural context, individual values, and socioeconomic background. In Egypt, education is highly valued and seen as a key to social mobility, so the cultural context would place a significant emphasis on the importance of providing a good education for one's children. Additionally, as a member of the lower middle class with a higher education level, he may have experienced firsthand the challenges and limitations that come with limited access to educational opportunities, which could lead to a greater concern for his children's education. Therefore, the answer chosen will reflect the nuanced phrasing of the question and the cultural and socioeconomic factors at play.\n\n3"]}, {"persona": {"region": "Qaliubiya", "sex": "female", "age": 38, "country": "Egypt", "marital_status": "married", "education": "higher", "social_class": "working class"}, "question": {"id": "Q143", "variant": 0}, "response": ["As a married female from Qaliubiya, Egypt, I am deeply aware of the importance of education for my children within the cultural context of my community. Education is highly valued in Egypt, and as someone who has completed higher education, I understand the significance of providing my children with a good education. Being part of the working class, I am also acutely aware of the challenges and limitations that come with our socioeconomic background. I believe that education is a key factor in breaking the cycle of poverty and social mobility. Therefore, I am very much worried about not being able to give my children a good education, as it impacts not only their future opportunities but also our family's social standing and well-being.\n\n1"]}, {"persona": {"region": "Qaliubiya", "sex": "male", "age": 58, "country": "Egypt", "marital_status": "married", "education": "middle", "social_class": "working class"}, "question": {"id": "Q143", "variant": 0}, "response": ["Based on the anthropological framework, my answer is influenced by my individual values and personal experience, as well as my socioeconomic background. As a married male from Qaliubiya, Egypt, at the age of 58 with a middle education level and working-class status, I value education and understand its importance in my children's future. However, due to my socioeconomic background, I may not have the means to provide them with the best education. Therefore, I am worried to a good deal about not being able to give my children a good education.\n\n2"]}, {"persona": {"region": "Qaliubiya", "sex": "female", "age": 27, "country": "Egypt", "marital_status": "married", "education": "higher", "social_class": "working class"}, "question": {"id": "Q143", "variant": 0}, "response": ["From an emic perspective, as a married female from Qaliubiya, Egypt, I am influenced by my cultural context and socioeconomic background. In my community, education is highly valued and seen as a pathway to upward mobility. As someone who has completed higher education but considers myself part of the working class, I am acutely aware of the challenges of providing a good education for my children. My individual values and personal experience also play a role in my concern for their education, as I understand the impact it can have on their future opportunities. Additionally, cultural relativism is important to consider, as the value placed on education may differ in other cultures. Therefore, based on my nuanced understanding of the question and my personal circumstances, I would choose option (2) A good deal. \n\n2"]}, {"persona": {"region": "Qaliubiya", "sex": "female", "age": 48, "country": "Egypt", "marital_status": "married", "education": "middle", "social_class": "upper middle class"}, "question": {"id": "Q143", "variant": 0}, "response": ["Based on the anthropological framework, my answer to the question is influenced by my personal experience, cultural context, and socioeconomic background. As a married female from Qaliubiya, Egypt, I come from a culture where education is highly valued and seen as a pathway to success. My middle education level has provided me with a strong understanding of the importance of education, and as a member of the upper middle class, I have the financial means to provide my children with a good education. Additionally, the cultural context in Egypt emphasizes the significance of education in shaping a successful future. Therefore, my worry about not being able to give my children a good education is (3) Not much."]}, {"persona": {"region": "Giza", "sex": "female", "age": 19, "country": "Egypt", "marital_status": "single", "education": "middle", "social_class": "working class"}, "question": {"id": "Q143", "variant": 0}, "response": ["Based on my emic perspective as a single female from Giza, Egypt, I understand the importance of education within my cultural context. As someone who has completed middle education level and considers myself part of the working class, I am aware of the challenges and limitations in accessing quality education. My individual values and personal experience have shaped my concern for providing a good education for my future children, as I have experienced firsthand the difficulties in pursuing higher education. Additionally, my socioeconomic background as part of the working class means that I may not have the financial means to provide the best educational opportunities for my children. Therefore, I am very much worried about not being able to give my children a good education.\n\n1"]}, {"persona": {"region": "Giza", "sex": "female", "age": 38, "country": "Egypt", "marital_status": "married", "education": "higher", "social_class": "lower middle class"}, "question": {"id": "Q143", "variant": 0}, "response": ["Based on the anthropological framework, as a married female from Giza, Egypt, at 38 years of age with a completed higher education level, and considering myself part of the lower middle class, my answer to the question would be influenced by several factors. Emic and etic perspectives would play a role in how I perceive the importance of education for my children, considering the cultural context and individual values placed on education in my community. My socioeconomic background would also influence my answer, as the concerns about being able to provide a good education for my children would be influenced by my financial situation. Additionally, the nuance of the question is important, as it may affect my response. Therefore, my chosen answer is:\n\n3"]}, {"persona": {"region": "Beni Swaif/Beni Suef", "sex": "female", "age": 34, "country": "Egypt", "marital_status": "divorced", "education": "higher", "social_class": "lower class"}, "question": {"id": "Q143", "variant": 0}, "response": ["Based on the anthropological framework, my emic perspective as a divorced female from Beni Swaif, Egypt, my cultural context, individual values, and socioeconomic background all play a significant role in my answer to this question. In my community, education is highly valued but often inaccessible to those in the lower class due to financial constraints. As someone who has completed higher education, I understand the importance of education and the opportunities it can provide for my children. Given my lower socioeconomic background, I am deeply worried about not being able to give my children a good education, as it is a fundamental concern for their future success and well-being. Therefore, my answer to the question is: \n\n2"]}, {"persona": {"region": "Beni Swaif/Beni Suef", "sex": "male", "age": 20, "country": "Egypt", "marital_status": "single", "education": "higher", "social_class": "working class"}, "question": {"id": "Q143", "variant": 0}, "response": ["Based on the anthropological framework, as a single male from Beni Swaif, Egypt, cultural context is pivotal in understanding my answer to this question. In my cultural context, education is highly valued and seen as a pathway to a better future. My individual values and personal experience also play a role, as I have personally experienced the impact of education on opportunities. Additionally, my socioeconomic background as part of the working class influences my concern about providing a good education for my future children. Therefore, I choose:\n\n3. Not much"]}, {"persona": {"region": "Giza", "sex": "male", "age": 19, "country": "Egypt", "marital_status": "single", "education": "middle", "social_class": "upper middle class"}, "question": {"id": "Q143", "variant": 0}, "response": ["Based on my emic perspective as a single male from Giza, Egypt, I am aware that education is highly valued in my culture and is seen as a pathway to success. The cultural context in which I live places a strong emphasis on the importance of education, and my own personal experience and values align with this belief. Additionally, my socioeconomic background as part of the upper middle class has afforded me certain privileges and opportunities, including access to quality education. Therefore, I am not very worried about not being able to give my children a good education.\n\n3"]}, {"persona": {"region": "Giza", "sex": "female", "age": 33, "country": "Egypt", "marital_status": "married", "education": "middle", "social_class": "working class"}, "question": {"id": "Q143", "variant": 0}, "response": ["Based on the anthropological framework, as a married female from Giza, Egypt, I am deeply influenced by my cultural context and socioeconomic background. In Egypt, education is highly valued, and as a member of the working class with only a middle education level, I am acutely aware of the challenges my children may face in accessing a good education. Given the cultural emphasis on education and the limited opportunities available to those in the working class, I am very worried about not being able to give my children a good education. \n\n1"]}, {"persona": {"region": "Giza", "sex": "female", "age": 24, "country": "Egypt", "marital_status": "married", "education": "higher", "social_class": "working class"}, "question": {"id": "Q143", "variant": 0}, "response": ["Based on the anthropological framework, as a married female from Giza, Egypt, I would consider the emic perspective, taking into account my personal experience and cultural context. In Egypt, education is highly valued, and as someone who has completed higher education, I understand the importance of providing a good education to my children. Additionally, my socioeconomic background as part of the working class influences my concern about my children's education, as I may have limited financial resources to invest in their schooling. Therefore, I would be very worried about not being able to give my children a good education. \n\n1"]}, {"persona": {"region": "Giza", "sex": "male", "age": 50, "country": "Egypt", "marital_status": "married", "education": "higher", "social_class": "working class"}, "question": {"id": "Q143", "variant": 0}, "response": ["Based on my cultural context in Giza, Egypt, education is highly valued and seen as a pathway to success. As a married male who has completed higher education and considers myself part of the working class, I understand the importance of providing my children with a good education. Socioeconomic background plays a significant role in the opportunities available for education, and I am concerned about the challenges my children may face in accessing quality education. My personal experience and values lead me to worry to a good deal about not being able to give my children a good education.\n\n2"]}, {"persona": {"region": "Beni Swaif/Beni Suef", "sex": "female", "age": 26, "country": "Egypt", "marital_status": "married", "education": "higher", "social_class": "lower middle class"}, "question": {"id": "Q143", "variant": 0}, "response": ["Based on the anthropological framework, as a married female from Beni Swaif, Egypt, I am deeply rooted in my cultural context and socio-economic background. In my community, education is highly valued, and it is seen as a pathway to a better future. As someone who has completed higher education but still considers myself part of the lower middle class, I am acutely aware of the challenges and limitations that come with my socio-economic status. I also understand the importance of education in breaking the cycle of poverty and providing opportunities for my children. Therefore, I am very much worried about not being able to give my children a good education, as it is a fundamental concern that has a significant impact on their future prospects.\n\n1"]}, {"persona": {"region": "Beni Swaif/Beni Suef", "sex": "male", "age": 40, "country": "Egypt", "marital_status": "single", "education": "lower", "social_class": "lower class"}, "question": {"id": "Q143", "variant": 0}, "response": ["Based on my emic perspective as a lower class male from Beni Suef, Egypt, my worries about not being able to give my children a good education are heavily influenced by my cultural context, individual values, and socioeconomic background. In my community, education is highly valued but often inaccessible due to financial constraints. My personal experience of struggling to access higher education has shaped my understanding of the importance of education for my children's future. Additionally, my lower socioeconomic background limits my ability to provide the best educational opportunities for my children. Therefore, my worry about not being able to give my children a good education is significant and weighs heavily on my mind.\n\n2"]}, {"persona": {"region": "Beni Swaif/Beni Suef", "sex": "female", "age": 25, "country": "Egypt", "marital_status": "married", "education": "middle", "social_class": "lower middle class"}, "question": {"id": "Q143", "variant": 0}, "response": ["Based on the anthropological framework, my perspective as a married female from Beni Swaif, Egypt, with a middle education level and lower middle-class background, is heavily influenced by my cultural context, socioeconomic background, and personal experience. In my community, education is highly valued as a means of upward mobility, but limited resources and economic constraints often make it difficult for families like mine to provide a good education for their children. Additionally, my individual values and personal experience lead me to prioritize education as a way to improve our circumstances. Therefore, I am very much worried about not being able to give my children a good education.\n\n1"]}, {"persona": {"region": "Beni Swaif/Beni Suef", "sex": "female", "age": 21, "country": "Egypt", "marital_status": "single", "education": "middle", "social_class": "lower middle class"}, "question": {"id": "Q143", "variant": 0}, "response": ["Based on the anthropological framework, my perspective as a single female from Beni Swaif, Egypt, is heavily influenced by my cultural context, individual values, and socioeconomic background. As a member of the lower middle class, my access to resources and opportunities for education is limited. Additionally, my personal experience and the experiences of those around me have shown the challenges of obtaining a good education. The cultural relativism in my community also plays a role in shaping my concerns about the future education of my children. Taking into account these factors, I would choose option (1) Very much."]}, {"persona": {"region": "Beni Swaif/Beni Suef", "sex": "male", "age": 48, "country": "Egypt", "marital_status": "married", "education": "middle", "social_class": "lower middle class"}, "question": {"id": "Q143", "variant": 0}, "response": ["Based on my personal experience and socioeconomic background, as a lower middle-class man from Beni Suef, Egypt, education is highly valued in my community. The cultural context of my society places a strong emphasis on education as a means of social mobility and success. My individual values also prioritize the education of my children, as I believe it is crucial for their future opportunities. Additionally, the limited resources and opportunities available to me due to my socioeconomic background make me very worried about not being able to provide my children with a good education. This concern is further amplified by the fact that I only completed middle education level myself, and I am aware of the barriers and challenges my children may face in accessing quality education. Therefore, I am very much worried about not being able to give my children a good education.\n\n1"]}, {"persona": {"region": "Beni Swaif/Beni Suef", "sex": "female", "age": 57, "country": "Egypt", "marital_status": "married", "education": "middle", "social_class": "working class"}, "question": {"id": "Q143", "variant": 0}, "response": ["Based on my cultural context as a married female from Beni Suef, Egypt, and my working-class socioeconomic background, I am influenced by the emic perspective of prioritizing family and education. In our community, education is highly valued, and I understand the importance of providing a good education for my children. My personal experience and individual values also play a role in my concern about my children's education. Additionally, my age and place in society have shaped my perception of the value of education. Therefore, I am worried to a very high extent about not being able to give my children a good education.\n\n1"]}, {"persona": {"region": "Beni Swaif/Beni Suef", "sex": "male", "age": 20, "country": "Egypt", "marital_status": "single", "education": "middle", "social_class": "working class"}, "question": {"id": "Q143", "variant": 0}, "response": ["Based on the anthropological framework, as a single male from Beni Swaif/Beni Suef, Egypt, who is 20 years old and part of the working class, my emic perspective would be heavily influenced by my socioeconomic background, cultural context, and individual values. In the cultural context of Egypt, education is highly valued and seen as crucial for social mobility. As part of the working class, I may have experienced firsthand the challenges of accessing quality education. Additionally, my individual values and personal experience would lead me to prioritize education for my future children, as I may have seen the impact of limited educational opportunities on my own life. Therefore, I would select:\n\n2. A good deal"]}, {"persona": {"region": "Giza", "sex": "female", "age": 59, "country": "Egypt", "marital_status": "married", "education": "higher", "social_class": "upper middle class"}, "question": {"id": "Q143", "variant": 0}, "response": ["Based on the anthropological framework, as a married female from Giza, Egypt, who is 59 years old and part of the upper middle class, my perspective on worrying about not being able to give my children a good education would be influenced by my cultural context, individual values, and socioeconomic background. In Giza, education is highly valued, and as someone who has completed higher education, I prioritize providing my children with the best education possible. Additionally, being part of the upper middle class means that I have the financial means to invest in my children's education. Therefore, I would not be very worried about not being able to give my children a good education.\n\n3"]}, {"persona": {"region": "Giza", "sex": "female", "age": 38, "country": "Egypt", "marital_status": "single", "education": "higher", "social_class": "lower middle class"}, "question": {"id": "Q143", "variant": 0}, "response": ["As a single female from Giza, Egypt, my perspective is influenced by my cultural context, socioeconomic background, and personal experience. In Egypt, education is highly valued, and as someone who has completed higher education, I understand the importance of providing my children with a good education. Additionally, being part of the lower middle class means that I may have limited financial resources to invest in my children's education. Considering the emic perspective, I am very much worried about not being able to give my children a good education, as I understand the impact it can have on their future opportunities and success.\n\n1"]}, {"persona": {"region": "Giza", "sex": "female", "age": 26, "country": "Egypt", "marital_status": "single", "education": "higher", "social_class": "working class"}, "question": {"id": "Q143", "variant": 0}, "response": ["Based on my emic perspective as a single female from Giza, Egypt, my cultural context and socioeconomic background play a significant role in shaping my concerns about my children's education. Coming from a working-class background and having completed higher education myself, I am acutely aware of the challenges and opportunities that come with education. My personal experience and individual values also contribute to my worries about providing a good education for my future children. Additionally, the cultural relativism in Egypt and the societal emphasis on education further amplifies my concerns. Therefore, I would choose option (2) A good deal, as I am indeed worried about not being able to give my children a good education due to the socioeconomic and cultural factors that shape my perspective."]}, {"persona": {"region": "Giza", "sex": "male", "age": 39, "country": "Egypt", "marital_status": "married", "education": "middle", "social_class": "working class"}, "question": {"id": "Q143", "variant": 0}, "response": ["Based on my emic perspective as a married male from Giza, Egypt, I am deeply concerned about not being able to provide my children with a good education. In our cultural context, education is highly valued, and it is seen as a pathway to a better future. My individual values and personal experience also play a significant role in this concern, as I have personally experienced the challenges of limited educational opportunities. Additionally, considering my working-class background and middle education level, I am acutely aware of the socioeconomic barriers that can hinder access to quality education. Furthermore, cultural relativism dictates that there is no hierarchy of culture, and in our society, education is a fundamental aspect of our cultural identity. Therefore, my nuanced understanding of the question leads me to choose option (1) Very much."]}, {"persona": {"region": "Giza", "sex": "male", "age": 36, "country": "Egypt", "marital_status": "married", "education": "middle", "social_class": "working class"}, "question": {"id": "Q143", "variant": 0}, "response": ["Based on my emic perspective as a married male from Giza, Egypt, I am deeply concerned about not being able to provide my children with a good education. In our cultural context, education is highly valued and seen as a pathway to a better future. As someone from the working class with only a middle education level myself, I understand the limitations and challenges that come with this socioeconomic background. My personal experience and values drive me to prioritize education for my children, knowing that it can significantly impact their opportunities in life. Additionally, the socioeconomic background and cultural relativism in our society play a significant role in shaping my worries about my children's education. Therefore, my answer to the question is:\n\n1"]}, {"persona": {"region": "Giza", "sex": "female", "age": 30, "country": "Egypt", "marital_status": "single", "education": "higher", "social_class": "lower class"}, "question": {"id": "Q143", "variant": 0}, "response": ["From an emic perspective, as a single female from Giza, Egypt, my cultural context and socioeconomic background play a significant role in shaping my concerns about my children's education. The lower class status, limited access to resources, and the cultural expectation of providing for my children's education all contribute to my worry about not being able to give them a good education. My personal experience and individual values also play a role in this concern, as I have personally experienced the challenges of accessing higher education and understand the importance of education for future opportunities. Additionally, the cultural relativism framework reminds us that there is no hierarchy of culture, so my worries about education are valid within my cultural context. Therefore, my answer to the question is:\n\n2"]}, {"persona": {"region": "Giza", "sex": "female", "age": 24, "country": "Egypt", "marital_status": "single", "education": "higher", "social_class": "lower class"}, "question": {"id": "Q143", "variant": 0}, "response": ["Based on the anthropological framework, as a single female from Giza, Egypt, I am deeply influenced by my cultural context, individual values, and socioeconomic background. As a member of the lower class in Egypt, I have experienced firsthand the challenges of accessing higher education and opportunities for advancement. This has shaped my personal values and experiences, leading me to prioritize education for myself and any future children. Additionally, the cultural context in Egypt places a high value on education as a means of social mobility. Therefore, I am very much worried about not being able to give my children a good education.\n\n1"]}, {"persona": {"region": "Giza", "sex": "male", "age": 65, "country": "Egypt", "marital_status": "married", "education": "middle", "social_class": "working class"}, "question": {"id": "Q143", "variant": 0}, "response": ["Based on the anthropological framework, as a married male from Giza, Egypt, my emic perspective is influenced by my cultural context, socioeconomic background, and individual values. In Egyptian society, education is highly valued, and as a member of the working class with only a middle education level, I understand the importance of education for my children's future opportunities. My personal experience and values lead me to be very concerned about not being able to provide my children with a good education, as I understand the impact it can have on their future success. Additionally, the cultural relativism and nuance of the question prompt me to consider the societal expectations and my own personal circumstances when answering. \n\n3"]}, {"persona": {"region": "Giza", "sex": "female", "age": 56, "country": "Egypt", "marital_status": "married", "education": "middle", "social_class": "working class"}, "question": {"id": "Q143", "variant": 0}, "response": ["Based on the anthropological framework, as a married female from Giza, Egypt, who is 56 years old and part of the working class, my perspective on education is heavily influenced by my cultural context, individual values, and socioeconomic background. In Egypt, education is highly valued, but as a member of the working class with only a middle education level, I may have limited resources to provide my children with a good education. Additionally, cultural relativism plays a role in my understanding, as I may believe that everyone has their own path and opportunities for success. My nuanced understanding of the question leads me to choose option (2) A good deal, as I am concerned about my ability to provide my children with the best education possible given my socioeconomic background."]}, {"persona": {"region": "Giza", "sex": "male", "age": 31, "country": "Egypt", "marital_status": "married", "education": "higher", "social_class": "lower middle class"}, "question": {"id": "Q143", "variant": 0}, "response": ["Based on the anthropological framework, my emic perspective as a married male from Giza, Egypt, who is 31 years old and part of the lower middle class, is heavily influenced by my cultural context, individual values, and socioeconomic background. In Egypt, education is highly valued, and as someone who has completed higher education, I understand the importance of providing a good education for my children. However, my socioeconomic background as part of the lower middle class means that I may have limited financial resources to invest in their education. Additionally, the cultural relativism perspective reminds me that there are different ways of defining a \"good education\" and that my concerns may be different from those in other socioeconomic classes. Therefore, my answer to the question is:\n\n3"]}, {"persona": {"region": "Giza", "sex": "male", "age": 28, "country": "Egypt", "marital_status": "single", "education": "middle", "social_class": "working class"}, "question": {"id": "Q143", "variant": 0}, "response": ["Based on the anthropological framework, as a working-class individual from Giza, Egypt, my emic perspective is influenced by my cultural context, individual values, and personal experience. The socioeconomic background of my family and the limited educational opportunities available to me have shaped my understanding of the importance of education. I have personally experienced the challenges of accessing quality education and understand the impact it has on future opportunities. Additionally, the cultural relativism of my community values education as a means of upward mobility. Therefore, my concern about not being able to give my children a good education is very much influenced by these factors.\n\n2"]}, {"persona": {"region": "Giza", "sex": "male", "age": 47, "country": "Egypt", "marital_status": "married", "education": "middle", "social_class": "lower middle class"}, "question": {"id": "Q143", "variant": 0}, "response": ["Based on the anthropological framework, as a 47-year-old married male from Giza, Egypt, with a middle education level and considering myself part of the lower middle class, my answer to the question of how worried I am about not being able to give my children a good education would be option (2) A good deal. This answer is influenced by my socioeconomic background, as my lower middle class status may limit the resources I can provide for my children's education. Additionally, the cultural context of Egypt values education as a means of social mobility, so not being able to give my children a good education would be a significant concern for me as a parent."]}, {"persona": {"region": "Giza", "sex": "male", "age": 26, "country": "Egypt", "marital_status": "single", "education": "middle", "social_class": "lower middle class"}, "question": {"id": "Q143", "variant": 0}, "response": ["Based on my emic perspective as a single male from Giza, Egypt, my cultural context, individual values, and socioeconomic background all play a significant role in how I perceive and answer this question. In Giza, education is highly valued, but access to quality education can be limited for those in the lower middle class. My personal experience and values lead me to prioritize education for my future children, but my socioeconomic background and limited resources may create concerns about my ability to provide them with the best education possible. Additionally, the cultural relativism of valuing education in Egyptian society further influences my worry about not being able to give my children a good education. Taking into account all of these factors, I select option (2) A good deal."]}, {"persona": {"region": "Giza", "sex": "male", "age": 48, "country": "Egypt", "marital_status": "married", "education": "middle", "social_class": "upper middle class"}, "question": {"id": "Q143", "variant": 0}, "response": ["Based on the anthropological framework, as a married male from Giza, Egypt, my emic perspective is heavily influenced by my cultural context, individual values, and socioeconomic background. In Egypt, education is highly valued and seen as a pathway to success. As a member of the upper middle class, I have the means to provide my children with a good education, and it is a priority for me. Additionally, my personal experience of completing middle education has likely shaped my perspective on the importance of education. Therefore, I am not very worried about not being able to give my children a good education.\n\n3"]}, {"persona": {"region": "Menya", "sex": "male", "age": 61, "country": "Egypt", "marital_status": "married", "education": "middle", "social_class": "working class"}, "question": {"id": "Q143", "variant": 0}, "response": ["Based on the anthropological framework, as a married male from Menya, Egypt, of 61 years and part of the working class, my emic perspective is likely to prioritize the cultural context of my community, where education may hold significant value but may also be limited by socioeconomic factors. My personal experience and individual values will likely lead me to be concerned about providing a good education for my children, given my own middle education level and working-class background. Additionally, the cultural relativism in my community may lead me to believe that education is important, but there may be limitations due to the socioeconomic background and cultural context. Therefore, my answer would be:\n3"]}, {"persona": {"region": "Menya", "sex": "male", "age": 41, "country": "Egypt", "marital_status": "married", "education": "middle", "social_class": "lower middle class"}, "question": {"id": "Q143", "variant": 0}, "response": ["Based on the anthropological framework, my response is influenced by my emic perspective as a married male from Menya, Egypt, and my lower middle-class socioeconomic background. My cultural context and personal experience shape my understanding of the importance of education for my children's future. I am also influenced by cultural relativism, as I understand that the value placed on education may vary across different cultures. Additionally, my age and socioeconomic background play a significant role in my concern for my children's education. Therefore, I choose option (2) A good deal."]}, {"persona": {"region": "Menya", "sex": "female", "age": 43, "country": "Egypt", "marital_status": "married", "education": "higher", "social_class": "working class"}, "question": {"id": "Q143", "variant": 0}, "response": ["Based on my personal experience and socioeconomic background as a married working-class woman from Menya, Egypt, education is highly valued in my community and I have worked hard to complete higher education myself. I understand the importance of education for my children's future opportunities and success. Additionally, the cultural context in Menya places a strong emphasis on education and I am aware of the challenges and limitations that come with being part of the working class. Therefore, I am very much worried about not being able to give my children a good education.\n\n1"]}, {"persona": {"region": "Menya", "sex": "male", "age": 57, "country": "Egypt", "marital_status": "married", "education": "middle", "social_class": "lower middle class"}, "question": {"id": "Q143", "variant": 0}, "response": ["Based on the anthropological framework, as a married male from Menya, Egypt, with a middle education level and lower middle-class background, my answer to the question would be influenced by a combination of emic and etic perspectives, cultural context, individual values and personal experience, socioeconomic background, and space and time. In Menya, education is highly valued, and as a father, I am deeply concerned about not being able to provide my children with a good education due to limited financial resources and opportunities. My personal experience and values emphasize the importance of education for upward mobility and success. Additionally, the cultural context of Menya places a strong emphasis on education as a means of social and economic advancement. Therefore, my answer to the question would be \"1) Very much\" as I am highly worried about not being able to give my children a good education."]}, {"persona": {"region": "Menya", "sex": "male", "age": 42, "country": "Egypt", "marital_status": "divorced", "education": "middle", "social_class": "lower middle class"}, "question": {"id": "Q143", "variant": 0}, "response": ["Based on the anthropological framework, my emic perspective as a divorced male from Menya, Egypt, with a middle education level and lower middle class status shapes my understanding of the importance of education and the concerns I may have for my children's future. In Menya, the cultural context places a high value on education as a means of social mobility and success. My individual values prioritize education as a way to provide opportunities for my children that I might not have had. My socioeconomic background also plays a role, as my lower middle class status may limit the resources available for their education. Additionally, the cultural relativism in Egypt means that education is seen as a universal good, regardless of class. Given these factors, I would be very much worried about not being able to give my children a good education.\n\n1"]}, {"persona": {"region": "Menya", "sex": "female", "age": 59, "country": "Egypt", "marital_status": "married", "education": "middle", "social_class": "upper middle class"}, "question": {"id": "Q143", "variant": 0}, "response": ["Based on the anthropological framework, as a married female from Menya, Egypt, my emic perspective is heavily influenced by my cultural context, individual values, and socioeconomic background. In Menya, education is highly valued and seen as a pathway to social mobility. As a member of the upper middle class, I have access to resources that allow me to prioritize my children's education. Additionally, my personal experience and values emphasize the importance of education, as it is considered a key factor in achieving success and status in our society. Therefore, I am not very worried about not being able to give my children a good education. \n\n3"]}, {"persona": {"region": "Menya", "sex": "female", "age": 31, "country": "Egypt", "marital_status": "married", "education": "middle", "social_class": "working class"}, "question": {"id": "Q143", "variant": 0}, "response": ["Based on my emic perspective as a married female from Menya, Egypt, and considering my cultural context, individual values, and socioeconomic background, the worry about not being able to give my children a good education is a significant concern. In Menya, education is highly valued, and it is seen as a pathway to social and economic mobility. As someone from the working class with only a middle education level, I understand the challenges and limitations that come with this background. I want the best for my children, and not being able to provide them with a good education would greatly impact their future opportunities. Additionally, cultural relativism and nuance play a role in my understanding of this question, as my perspective is influenced by the specific circumstances and social dynamics of Menya, Egypt. \n\n2"]}, {"persona": {"region": "Menya", "sex": "male", "age": 55, "country": "Egypt", "marital_status": "single", "education": "middle", "social_class": "working class"}, "question": {"id": "Q143", "variant": 0}, "response": ["Based on my emic perspective as a working-class male from Menya, Egypt, my cultural context and socioeconomic background greatly influence my understanding of the importance of education. In my community, education is highly valued as a means of social mobility and improving one's circumstances. However, my individual values and personal experience also play a significant role in my perspective. I completed middle education level, and while I see the value in education, I also recognize the limitations that come with my socioeconomic background. As a result, I am very much worried about not being able to give my children a good education, as I understand the impact it can have on their future opportunities. \n\n1"]}, {"persona": {"region": "Menya", "sex": "female", "age": 28, "country": "Egypt", "marital_status": "married", "education": "higher", "social_class": "lower middle class"}, "question": {"id": "Q143", "variant": 0}, "response": ["Based on the anthropological framework, as a married female from Menya, Egypt, my emic perspective on the question of worrying about not being able to give my children a good education is influenced by my cultural context, individual values, and socioeconomic background. In Menya, education is highly valued, and as someone who has completed higher education, I personally understand the importance of education for future opportunities. However, as part of the lower middle class, I am aware of the financial barriers that may limit my ability to provide the best education for my children. Additionally, cultural relativism plays a role in my perspective, as I know that there are different ideas about what constitutes a \"good\" education. Therefore, my nuanced answer to this question is:\n3\n\n(Note: This answer reflects the perspective of the persona described and is not the personal opinion of the responder.)"]}, {"persona": {"region": "Menya", "sex": "male", "age": 24, "country": "Egypt", "marital_status": "single", "education": "middle", "social_class": "working class"}, "question": {"id": "Q143", "variant": 0}, "response": ["Based on my emic perspective as a single male from Menya, Egypt, and considering my middle education level and working-class background, I am deeply aware of the importance of education for my future children. In the cultural context of Egypt, education is highly valued and seen as a pathway to social mobility and success. My individual values and personal experience also play a role, as I have personally struggled to access higher education due to financial constraints. Additionally, my socioeconomic background as a working-class individual means that I may not have the financial means to provide my children with the best education. Furthermore, the cultural relativism in Egypt emphasizes the importance of education, further highlighting my concerns. Considering all these factors, I would choose option (1) Very much. \n\n1"]}, {"persona": {"region": "Menya", "sex": "female", "age": 23, "country": "Egypt", "marital_status": "married", "education": "middle", "social_class": "working class"}, "question": {"id": "Q143", "variant": 0}, "response": ["In Menya, Egypt, as a 23-year-old married woman who has completed middle education and considers herself part of the working class, my perspective on the extent of my worry about not being able to give my children a good education is heavily influenced by my cultural context, individual values, and socioeconomic background. In Menya, education is highly valued, and as a married woman, I am expected to contribute to the household income. Therefore, the pressure to ensure my children receive a good education is significant, as it is seen as a pathway to upward mobility and success. Additionally, my own experience with limited educational opportunities and the challenges of the working class further amplify my concern for my children's future prospects. Hence, my worry about not being able to give my children a good education is very much.\n\n2"]}, {"persona": {"region": "Menya", "sex": "male", "age": 27, "country": "Egypt", "marital_status": "single", "education": "middle", "social_class": "lower middle class"}, "question": {"id": "Q143", "variant": 0}, "response": ["Based on the anthropological framework described above, my answer to the question is influenced by my emic perspective as a single male from Menya, Egypt, with a middle education level and lower middle-class socioeconomic background. My cultural context and individual values play a significant role in my perception of the importance of education, as education is highly valued in my community and is seen as a means of social mobility. My personal experience of struggling to access higher education due to financial constraints also influences my concern for my future children's education. Additionally, the cultural relativism within my community emphasizes the importance of education, further reinforcing my worry about not being able to provide a good education for my children. Therefore, my chosen answer is (2) A good deal."]}, {"persona": {"region": "Asyut", "sex": "male", "age": 30, "country": "Egypt", "marital_status": "married", "education": "middle", "social_class": "working class"}, "question": {"id": "Q143", "variant": 0}, "response": ["Based on the anthropological framework, as a married male from Asyut, Egypt, with a middle education level and part of the working class, my emic perspective on this question is influenced by my cultural context, individual values, and socioeconomic background. In Asyut, education is highly valued, but as a member of the working class with limited resources, I may be more concerned about providing basic necessities for my family. Additionally, my personal experience and values may lead me to prioritize practical skills and work opportunities over formal education. Therefore, I would say:\n\n3"]}, {"persona": {"region": "Asyut", "sex": "female", "age": 26, "country": "Egypt", "marital_status": "married", "education": "middle", "social_class": "working class"}, "question": {"id": "Q143", "variant": 0}, "response": ["Based on the anthropological framework, I would approach this question from the perspective of a married female from Asyut, Egypt, who is 26 years old, completed middle education, and considers herself part of the working class. Considering the emic and etic perspectives, I understand that my worries about giving my children a good education are influenced by my cultural context, individual values, and personal experience. As a member of the working class in Asyut, Egypt, my socioeconomic background has a significant impact on my concerns about education for my children. Additionally, the cultural relativism perspective reminds me that my worries may differ from those in other cultures or socioeconomic backgrounds. Therefore, my answer to the question would be:\n\n3\n\n(3) Not much"]}, {"persona": {"region": "Asyut", "sex": "male", "age": 32, "country": "Egypt", "marital_status": "single", "education": "higher", "social_class": "lower middle class"}, "question": {"id": "Q143", "variant": 0}, "response": ["From the perspective of a single male from Asyut, Egypt, who is 32 years old, has completed higher education, and considers himself part of the lower middle class, there are several factors to consider in answering this question. First, the cultural context of Egypt is important, where education is highly valued but can be limited by socioeconomic background. Second, individual values and personal experience play a role, and as someone who has completed higher education, I understand the importance of education and the opportunities it can provide. Additionally, my lower middle class status means that I may have some concerns about being able to afford a good education for my children. Finally, the nuance of the question is important - while I may have worries about the cost of education, I also recognize the value of education and would prioritize it for my children. Therefore, my answer to the question would be:\n\n3. Not much"]}, {"persona": {"region": "Asyut", "sex": "female", "age": 21, "country": "Egypt", "marital_status": "married", "education": "middle", "social_class": "working class"}, "question": {"id": "Q143", "variant": 0}, "response": ["From an emic perspective, as a married female from Asyut, Egypt, who has completed middle education and considers myself part of the working class, my cultural context and socioeconomic background heavily influence my perception of education. In my community, education is highly valued, but the resources and opportunities for higher education are limited, especially for those in the working class. My personal experience and values also play a significant role in my concern for my children's education, as I understand the challenges and barriers they may face. Considering the nuance of the question, I would say that I am \"very much\" worried about not being able to give my children a good education.\n\n1"]}, {"persona": {"region": "Asyut", "sex": "female", "age": 30, "country": "Egypt", "marital_status": "married", "education": "higher", "social_class": "working class"}, "question": {"id": "Q143", "variant": 0}, "response": ["From an emic perspective, as a married female from Asyut, Egypt, I would be deeply influenced by the cultural context of my community and my own personal experience. Education is highly valued in my culture, and as someone who has completed higher education, I understand the importance of providing a good education for my children. Additionally, my socioeconomic background as part of the working class would impact my worries about being able to afford a good education for my children. Therefore, I would be very much worried about not being able to give my children a good education because I understand the value of education and the challenges that come with my socioeconomic background.\n\n4"]}, {"persona": {"region": "Asyut", "sex": "female", "age": 42, "country": "Egypt", "marital_status": "married", "education": "higher", "social_class": "lower middle class"}, "question": {"id": "Q143", "variant": 0}, "response": ["Based on my emic perspective, as a married female from Asyut, Egypt, education is highly valued in our culture and is seen as a pathway to a better future. From a cultural context, my personal experience and individual values as someone who has completed higher education, I place a high value on education for my children. My socioeconomic background as part of the lower middle class also influences my concern for providing a good education for my children. Additionally, my age and place in society also play a role in shaping my perspective. Therefore, I choose option (2) A good deal."]}, {"persona": {"region": "Sohag", "sex": "male", "age": 63, "country": "Egypt", "marital_status": "married", "education": "middle", "social_class": "lower middle class"}, "question": {"id": "Q143", "variant": 0}, "response": ["In considering the question of worrying about not being able to give my children a good education, it is important to take into account the emic and etic perspectives of my cultural context. As a married male from Sohag, Egypt, my individual values and personal experience as part of the lower middle class play a significant role in my perception of education. Additionally, my socioeconomic background and cultural relativism also influence my understanding of this issue. Given my age and completed middle education level, I am aware of the challenges and opportunities that come with education. Therefore, I would choose option (2) A good deal."]}, {"persona": {"region": "Sohag", "sex": "male", "age": 27, "country": "Egypt", "marital_status": "married", "education": "middle", "social_class": "working class"}, "question": {"id": "Q143", "variant": 0}, "response": ["Based on the anthropological framework described above, my perspective as a married male from Sohag, Egypt, who is 27 years old, completed middle education, and considers himself part of the working class, is heavily influenced by my cultural context, individual values, and socioeconomic background. In Sohag, education is highly valued and seen as a pathway to improve one's socioeconomic status. As a working-class individual, the ability to provide a good education for my children is a significant concern, as it is closely tied to their future opportunities and success. Additionally, my personal experience and values emphasize the importance of education, and I am aware of the challenges that may arise from limited resources. Therefore, my perspective is very much worried about not being able to give my children a good education.\n\n1"]}, {"persona": {"region": "Sohag", "sex": "male", "age": 56, "country": "Egypt", "marital_status": "married", "education": "higher", "social_class": "upper middle class"}, "question": {"id": "Q143", "variant": 0}, "response": ["Based on the anthropological framework, as a married male from Sohag, Egypt, with a higher education level and belonging to the upper middle class, my emic perspective is deeply influenced by my cultural context, individual values, and socioeconomic background. In Sohag, education is highly valued, and as a member of the upper middle class, I have the means to provide my children with a good education. Additionally, my personal experience and values emphasize the importance of education for future success. Therefore, I am not worried about not being able to give my children a good education.\n\n3"]}, {"persona": {"region": "Sohag", "sex": "male", "age": 51, "country": "Egypt", "marital_status": "married", "education": "higher", "social_class": "lower middle class"}, "question": {"id": "Q143", "variant": 0}, "response": ["In considering the question of worrying about not being able to give my children a good education, I must take into account my cultural context, socioeconomic background, and personal experience. Coming from Sohag, Egypt, where educational opportunities may be limited compared to other regions, and being part of the lower middle class, I am acutely aware of the challenges my children may face in accessing quality education. My own higher education has allowed me to understand the value of education, and I want the same for my children. Therefore, I am very much worried about not being able to give my children a good education.\n\n1"]}, {"persona": {"region": "Sohag", "sex": "female", "age": 26, "country": "Egypt", "marital_status": "married", "education": "higher", "social_class": "working class"}, "question": {"id": "Q143", "variant": 0}, "response": ["Based on the anthropological framework, my emic perspective as a married female from Sohag, Egypt, who is 26 years old and part of the working class, is heavily influenced by my cultural context, individual values, and socioeconomic background. In my cultural context, education is highly valued and seen as a means of upward mobility. As a result, my personal experience and values lead me to prioritize education for my children. Additionally, my socioeconomic background as part of the working class means that I may have limited financial resources to invest in my children's education. Therefore, I am very concerned about not being able to give my children a good education.\n\n1"]}, {"persona": {"region": "Sohag", "sex": "female", "age": 29, "country": "Egypt", "marital_status": "married", "education": "higher", "social_class": "upper middle class"}, "question": {"id": "Q143", "variant": 0}, "response": ["Based on the anthropological framework, my answer to the question is influenced by my cultural context, individual values, and socioeconomic background. As a married female from Sohag, Egypt, I come from a culture where education is highly valued and seen as a key to social mobility. My personal experience and values also prioritize education, as I have completed higher education myself. Additionally, being part of the upper middle class, I have the means to invest in my children's education. Therefore, my worry about not being able to give my children a good education is not much.\n\n3"]}, {"persona": {"region": "Sohag", "sex": "male", "age": 51, "country": "Egypt", "marital_status": "married", "education": "middle", "social_class": "lower middle class"}, "question": {"id": "Q143", "variant": 0}, "response": ["From the perspective of a married male from Sohag, Egypt, who is 51 years old and part of the lower middle class, the answer to the question of worrying about not being able to give his children a good education would likely be \"very much.\" This is influenced by the cultural context of Egypt, where education is highly valued and seen as a pathway to better opportunities. Additionally, his lower middle class socioeconomic background may limit his ability to provide the best education for his children. The individual values and personal experience of the persona also play a role, as he may have experienced firsthand the challenges of not having access to higher education opportunities, and wants better for his children. Furthermore, the nuance of the question may also be taken into consideration, as the wording \"not being able to give\" may emphasize his concern about his limitations in providing the best education for his children. \n\n2"]}, {"persona": {"region": "Qena", "sex": "male", "age": 32, "country": "Egypt", "marital_status": "single", "education": "middle", "social_class": "working class"}, "question": {"id": "Q143", "variant": 0}, "response": ["Based on the anthropological framework, as a single male from Qena, Egypt, with a middle education level and part of the working class, my perspective is heavily influenced by my cultural context, individual values, and socioeconomic background. In Qena, education is highly valued, but many families struggle to afford it. My personal experience and values lead me to prioritize education for my future children, but my working-class background may limit my ability to provide a good education. Additionally, cultural relativism plays a role in my perspective, as the importance of education may vary across different cultures. Therefore, I am very much worried about not being able to give my children a good education.\n1"]}, {"persona": {"region": "Qena", "sex": "male", "age": 54, "country": "Egypt", "marital_status": "married", "education": "middle", "social_class": "lower middle class"}, "question": {"id": "Q143", "variant": 0}, "response": ["Based on the anthropological framework, as a married male from Qena, Egypt, my emic perspective is heavily influenced by my cultural context, individual values, and socioeconomic background. In Qena, education is highly valued, and it is seen as a pathway to social mobility. As a member of the lower middle class, I understand the importance of education in providing better opportunities for my children. My personal experience and values also emphasize the significance of education for their future success. Therefore, I am very much worried about not being able to give my children a good education.\n\n1"]}, {"persona": {"region": "Qena", "sex": "male", "age": 25, "country": "Egypt", "marital_status": "single", "education": "lower", "social_class": "lower class"}, "question": {"id": "Q143", "variant": 0}, "response": ["Based on my personal experience and lower socioeconomic background, I am deeply concerned about not being able to provide my future children with a good education. Coming from Qena, Egypt, where opportunities for those in the lower class are limited, I know that education is the key to a better future. My cultural context and emic perspective also play a role in my concern, as education is highly valued in my community. Additionally, the lack of resources and access to quality education in my area further exacerbates my worry. Given these factors, I would choose option (1) Very much."]}, {"persona": {"region": "Aswan", "sex": "male", "age": 34, "country": "Egypt", "marital_status": "single", "education": "middle", "social_class": "lower class"}, "question": {"id": "Q143", "variant": 0}, "response": ["Based on the anthropological framework, my emic perspective as a lower-class single male from Aswan, Egypt, who has only completed middle education, is heavily influenced by my cultural context, individual values, and personal experience. In Aswan, education is not always easily accessible for lower-class families, and the socioeconomic background plays a significant role in the quality of education that can be afforded. Additionally, my personal experience of struggling to receive a higher education due to financial limitations has shaped my perspective. Therefore, I am very worried about not being able to give my children a good education.\n\n1"]}, {"persona": {"region": "Aswan", "sex": "female", "age": 31, "country": "Egypt", "marital_status": "married", "education": "middle", "social_class": "lower middle class"}, "question": {"id": "Q143", "variant": 0}, "response": ["Based on the anthropological framework, my perspective as a married female from Aswan, Egypt, is influenced by my cultural context, socioeconomic background, and personal experience. In Aswan, education is highly valued, but access to quality education is limited, especially for those in the lower middle class. As a 31-year-old with only a middle education level, I have personally experienced the challenges of accessing higher education. Additionally, my socioeconomic background as part of the lower middle class means that I am not able to afford private schooling or additional educational resources for my children. Therefore, I am very much worried about not being able to give my children a good education.\n\n1"]}, {"persona": {"region": "Aswan", "sex": "female", "age": 39, "country": "Egypt", "marital_status": "married", "education": "middle", "social_class": "working class"}, "question": {"id": "Q143", "variant": 0}, "response": ["Based on the anthropological framework, as a married female from Aswan, Egypt, my emic perspective on education is influenced by the cultural context of my community, where the value of education may be different from Western societies. My personal experience and individual values also come into play, as I have only completed middle education level myself and come from a working-class background, which may influence my perceptions of education and its importance. Additionally, my socioeconomic background and the cultural relativism of my community may lead me to prioritize other aspects of life over education. Finally, my age and place in society, as a 39-year-old married woman from Aswan, Egypt, would further shape my perspective on the issue. \n\n3"]}, {"persona": {"region": "Qena", "sex": "female", "age": 27, "country": "Egypt", "marital_status": "married", "education": "lower", "social_class": "lower middle class"}, "question": {"id": "Q143", "variant": 0}, "response": ["Based on my cultural context, as a married female from Qena, Egypt, my lower education level and lower middle class status significantly impact my concern for my children's education. The emic perspective of my community emphasizes the importance of education, and my personal values and experience lead me to worry \"very much\" about not being able to give my children a good education due to my socioeconomic background. Additionally, my understanding of cultural relativism and the nuances of the question further solidify my concern for my children's education, as it is a fundamental aspect of their future prospects and opportunities in life.\n\n1"]}, {"persona": {"region": "Qena", "sex": "male", "age": 40, "country": "Egypt", "marital_status": "single", "education": "middle", "social_class": "lower middle class"}, "question": {"id": "Q143", "variant": 0}, "response": ["From an emic perspective, as a single male from Qena, Egypt, I am deeply embedded in the cultural context of my community, where education is highly valued but often out of reach for many due to socioeconomic background. My personal experience and individual values lead me to prioritize my children's education, as I know the impact it can have on their future opportunities. As part of the lower middle class, I am acutely aware of the limitations and challenges that come with my socioeconomic background, and I am worried about not being able to provide my children with the education they deserve. This concern is further emphasized by the cultural relativism within my community, where education is seen as a pathway to success and social mobility. Therefore, my answer is:\n\n2. A good deal"]}, {"persona": {"region": "Qena", "sex": "male", "age": 30, "country": "Egypt", "marital_status": "single", "education": "middle", "social_class": "working class"}, "question": {"id": "Q143", "variant": 0}, "response": ["Based on my emic perspective as a working-class individual from Qena, Egypt, I understand the value of education in our society and the opportunities it can provide for my children. The cultural context of Egypt places a strong emphasis on education as a means of social mobility and success. My personal experience of completing middle education has also shaped my understanding of the importance of education in securing better opportunities in life. As a working-class individual, I am acutely aware of the limitations that socioeconomic background can place on accessing quality education. Therefore, I am very much worried about not being able to give my children a good education.\n\n1"]}]