[{"persona": {"region": "Fayoum", "sex": "male", "age": 46, "country": "Egypt", "marital_status": "married", "education": "higher", "social_class": "lower middle class"}, "question": {"id": "Q42", "variant": 0}, "response": ["Based on the anthropological framework, as a married male from Fayoum, Egypt, my thoughts on the overall way our society is organized are influenced by my cultural context, socioeconomic background, and personal experience. As part of the lower middle class and having completed higher education, I have experienced the challenges of social and economic inequality. I understand the importance of gradual reforms to improve our society and address the issues facing people like me. Radical change may be disruptive and potentially harmful to the stability of our community, while defending the existing organization may not address the needs of those struggling. Therefore, I believe that gradual improvement through reforms is the most practical and beneficial approach for our society.\n\n2"]}, {"persona": {"region": "Fayoum", "sex": "female", "age": 30, "country": "Egypt", "marital_status": "married", "education": "middle", "social_class": "lower middle class"}, "question": {"id": "Q42", "variant": 0}, "response": ["Based on the anthropological framework, as a married female from Fayoum, Egypt, my perspective on the overall way our society is organized would be influenced by my cultural context, individual values, and socioeconomic background. As a member of the lower middle class, my experiences and personal values will shape my understanding of the societal organization. Additionally, being from Egypt, the cultural context and nuances of societal structures and norms will also play a significant role in my perspective. Considering these factors, I would choose option (2) Our society must be gradually improved by reforms. This choice aligns with the understanding that change is necessary, but it should be approached in a gradual and systematic manner, taking into consideration the complexities of our cultural and socioeconomic context."]}, {"persona": {"region": "Fayoum", "sex": "male", "age": 60, "country": "Egypt", "marital_status": "married", "education": "higher", "social_class": "working class"}, "question": {"id": "Q42", "variant": 0}, "response": ["Based on my personal experience and cultural context as a married male from Fayoum, Egypt, who is 60 years old and part of the working class, I believe that our society is organized in a way that does not adequately support and uplift individuals from lower socioeconomic backgrounds. The cultural relativism and socioeconomic background play a significant role in shaping my perspective. I have seen the struggles of the working class and the importance of gradual reforms to improve the overall way our society is organized.\n\n2"]}, {"persona": {"region": "Fayoum", "sex": "male", "age": 20, "country": "Egypt", "marital_status": "single", "education": "middle", "social_class": "lower middle class"}, "question": {"id": "Q42", "variant": 0}, "response": ["Based on my emic perspective as a single male from Fayoum, Egypt, I have grown up in a cultural context where traditional values and hierarchical structures are deeply ingrained. My individual values and personal experience have shaped my perception of society, and as someone from the lower middle class, I have witnessed the challenges and limitations that come with this socioeconomic background. I understand the importance of cultural relativism and recognize that my perspective may differ from others based on their space and time. Given these factors, I believe that our society must be gradually improved by reforms (2)."]}, {"persona": {"region": "Fayoum", "sex": "female", "age": 39, "country": "Egypt", "marital_status": "married", "education": "higher", "social_class": "lower middle class"}, "question": {"id": "Q42", "variant": 0}, "response": ["Based on the anthropological framework, as a married female from Fayoum, Egypt, my emic perspective is influenced by my cultural context, individual values, and socioeconomic background. I recognize the importance of stability and gradual change in society, and as part of the lower middle class, I understand the struggles and limitations faced by people in my community. Therefore, I believe that our society must be gradually improved by reforms to ensure better opportunities and support for those in similar socioeconomic positions.\n\n2"]}, {"persona": {"region": "Fayoum", "sex": "male", "age": 33, "country": "Egypt", "marital_status": "married", "education": "higher", "social_class": "working class"}, "question": {"id": "Q42", "variant": 0}, "response": ["Based on the anthropological framework, my perspective is heavily influenced by my cultural context, socioeconomic background, and individual values. As a married male from Fayoum, Egypt, coming from a working-class background, I have experienced firsthand the challenges and struggles of individuals within this society. My personal experience and values lead me to believe that our society must be gradually improved by reforms. I believe that radical change may be too disruptive and could potentially lead to more instability, while valiantly defending the current system may not address the underlying issues that need to be addressed for the betterment of society.\n\n2"]}, {"persona": {"region": "Port Said", "sex": "female", "age": 45, "country": "Egypt", "marital_status": "married", "education": "higher", "social_class": "lower middle class"}, "question": {"id": "Q42", "variant": 0}, "response": ["Based on the anthropological framework, my perspective on the overall way our society is organized is influenced by my cultural context, individual values, and socioeconomic background. As a married female from Port Said, Egypt, who is 45 years old and part of the lower middle class, I have experienced and witnessed the challenges and struggles faced by individuals in similar circumstances. My cultural context and personal experience have shaped my belief that gradual improvements through reforms are necessary for our society. I believe that radical revolutionary action can lead to instability and further hardships for those in my socioeconomic position, and defending the present society against subversive forces may not address the underlying issues that affect people like me. Therefore, I choose option (2) Our society must be gradually improved by reforms."]}, {"persona": {"region": "Port Said", "sex": "male", "age": 42, "country": "Egypt", "marital_status": "married", "education": "middle", "social_class": "lower middle class"}, "question": {"id": "Q42", "variant": 0}, "response": ["Based on the anthropological framework, my thoughts on the overall way our society is organized are heavily influenced by my individual values, personal experience, and socioeconomic background. As a married male from Port Said, Egypt, with a middle education level and belonging to the lower middle class, I have experienced firsthand the struggles and challenges faced by people in this socioeconomic bracket. I believe that gradual improvements through reforms are necessary to address the disparities and injustices present in our society, rather than radical revolutionary action which may lead to further instability and uncertainty for individuals like myself. Option 2"]}, {"persona": {"region": "Port Said", "sex": "male", "age": 28, "country": "Egypt", "marital_status": "single", "education": "middle", "social_class": "lower middle class"}, "question": {"id": "Q42", "variant": 0}, "response": ["Based on my emic perspective as a single male from Port Said, Egypt, my cultural context and socioeconomic background greatly influence my thoughts on the overall way our society is organized. Coming from a lower middle-class background and having completed only middle education, I believe that our society must be gradually improved by reforms. I understand the nuances of our society and recognize the complexities of implementing radical changes. I also value the stability and security that reforms can bring to our community, and I am aware of the importance of cultural relativism in understanding the diverse opinions and needs within our society. Therefore, I choose option (2) Our society must be gradually improved by reforms."]}, {"persona": {"region": "Port Said", "sex": "female", "age": 30, "country": "Egypt", "marital_status": "married", "education": "higher", "social_class": "lower middle class"}, "question": {"id": "Q42", "variant": 0}, "response": ["Based on my emic perspective as a married female from Port Said, Egypt, I have been socialized to understand and navigate the cultural context of my society, which is heavily influenced by traditional values and hierarchical structures. My individual values and personal experience also inform my perception, as I have experienced the challenges and opportunities of being part of the lower middle class. My socioeconomic background has shaped my understanding of the limitations and possibilities within our society. Additionally, the concept of cultural relativism reminds me that there is no one-size-fits-all approach to societal organization. Therefore, I believe that our society must be gradually improved by reforms (2).\n\n2"]}, {"persona": {"region": "Port Said", "sex": "male", "age": 30, "country": "Egypt", "marital_status": "divorced", "education": "middle", "social_class": "lower middle class"}, "question": {"id": "Q42", "variant": 0}, "response": ["Based on my personal experience and cultural context as a divorced male from Port Said, Egypt, I have been exposed to the struggles of the lower middle class and the challenges they face in our society. I have seen how socioeconomic background greatly affects opportunities and quality of life. From an emic perspective, I believe that our society must be gradually improved by reforms in order to provide more equal opportunities and better living conditions for all individuals, especially those from lower socioeconomic backgrounds. This is crucial in creating a more fair and just society for everyone.\n\n2"]}, {"persona": {"region": "Port Said", "sex": "female", "age": 19, "country": "Egypt", "marital_status": "single", "education": "middle", "social_class": "lower middle class"}, "question": {"id": "Q42", "variant": 0}, "response": ["Based on the anthropological framework, I understand that my perspective is shaped by my cultural context, individual values, and socioeconomic background. As a 19-year-old single female from Port Said, Egypt, who has completed middle education and considers myself part of the lower middle class, I have experienced the challenges and limitations that come with this socioeconomic status. I have seen the struggles of my community and recognize the need for gradual improvements through reforms in order to create a more equitable and just society for everyone. Therefore, my perspective on the overall way our society is organized is that it must be gradually improved by reforms.\n\n2"]}, {"persona": {"region": "Fayoum", "sex": "male", "age": 40, "country": "Egypt", "marital_status": "married", "education": "middle", "social_class": "working class"}, "question": {"id": "Q42", "variant": 0}, "response": ["Based on my cultural context as a married male from Fayoum, Egypt, my middle education level, and working-class status, I understand and answer questions based on my individual values and personal experiences. Additionally, my socioeconomic background and cultural relativism play a role in shaping my perspectives. I also consider the nuance in the phrasing of the question and the space and time in which I live. Therefore, I choose option (2) Our society must be gradually improved by reforms."]}, {"persona": {"region": "Fayoum", "sex": "male", "age": 23, "country": "Egypt", "marital_status": "single", "education": "higher", "social_class": "lower middle class"}, "question": {"id": "Q42", "variant": 0}, "response": ["Based on the anthropological framework, as a single male from Fayoum, Egypt, my thoughts on the overall way our society is organized are heavily influenced by my cultural context, socioeconomic background, and personal experience. Growing up in a lower middle-class family in Egypt, I have seen the struggles and challenges that come with this socioeconomic status. As a young adult who has completed higher education, I am aware of the importance of gradual improvements and reforms in our society. I believe that radical change may be too disruptive and potentially harmful, while valiantly defending the present society may not address the real issues that need to be addressed. Therefore, my perspective is that our society must be gradually improved by reforms, taking into account the cultural and socioeconomic nuances of our community.\n\n2"]}, {"persona": {"region": "Fayoum", "sex": "female", "age": 38, "country": "Egypt", "marital_status": "married", "education": "middle", "social_class": "lower middle class"}, "question": {"id": "Q42", "variant": 0}, "response": ["Based on the anthropological framework, as a married female from Fayoum, Egypt, my emic perspective is shaped by my cultural context, individual values and personal experience, and socioeconomic background. I understand that my age, education level, and social class play a significant role in shaping my views on the overall way society is organized. Given my lower middle class background and my experience of navigating the societal structures, I believe that our society must be gradually improved by reforms (2). My personal experience and understanding of the cultural context lead me to believe that radical revolutionary action may not be feasible or beneficial, and that valiantly defending our present society against subversive forces may not address the systemic issues that need to be reformed."]}, {"persona": {"region": "Fayoum", "sex": "male", "age": 32, "country": "Egypt", "marital_status": "married", "education": "middle", "social_class": "lower middle class"}, "question": {"id": "Q42", "variant": 0}, "response": ["Based on the anthropological framework, I, as a married male from Fayoum, Egypt, would approach the question of the overall way our society is organized through the lens of cultural context, individual values, and socioeconomic background. Coming from a lower middle-class background and having completed only middle education, I am likely to have a more pragmatic and gradual approach to societal change. I would also consider the cultural context of Egypt, where there is a strong history of valuing stability and order. Therefore, I would choose option (2) Our society must be gradually improved by reforms."]}, {"persona": {"region": "Fayoum", "sex": "male", "age": 31, "country": "Egypt", "marital_status": "married", "education": "higher", "social_class": "working class"}, "question": {"id": "Q42", "variant": 0}, "response": ["Based on the anthropological framework, as a married male from Fayoum, Egypt, my emic perspective on the overall way our society is organized is heavily influenced by my cultural context and socioeconomic background. Being part of the working class in Egypt, I have experienced firsthand the challenges and struggles that come with this social status. My individual values and personal experiences lead me to believe that our society must be gradually improved by reforms rather than radically changed by revolutionary action, as this approach is more realistic and achievable given the current cultural and socioeconomic context. Additionally, cultural relativism teaches me to appreciate the nuances of our society and the importance of defending it against subversive forces while also acknowledging the need for improvement. \n\n2"]}, {"persona": {"region": "Fayoum", "sex": "male", "age": 31, "country": "Egypt", "marital_status": "married", "education": "middle", "social_class": "lower middle class"}, "question": {"id": "Q42", "variant": 0}, "response": ["Based on the anthropological framework, my emic perspective as a married male from Fayoum, Egypt, who is 31 years old and part of the lower middle class, is heavily influenced by my cultural context, individual values, and socioeconomic background. I have been shaped by the cultural norms and traditions of my community, and my personal experience and values have also been influenced by my socioeconomic status. My understanding of the overall way our society is organized is that gradual improvement through reforms is the most practical and feasible approach. Radical change may lead to instability and upheaval, which could negatively impact my family and community. At the same time, valiantly defending our present society against subversive forces is important but should be balanced with a pragmatic approach to addressing systemic issues. Therefore, my perspective aligns with option (2) - Our society must be gradually improved by reforms.\n\n2"]}, {"persona": {"region": "Fayoum", "sex": "female", "age": 32, "country": "Egypt", "marital_status": "married", "education": "middle", "social_class": "lower middle class"}, "question": {"id": "Q42", "variant": 0}, "response": ["Based on the anthropological framework, my thoughts on the overall way our society is organized are heavily influenced by my cultural context, individual values, and socioeconomic background. Coming from Fayoum, Egypt, I have witnessed the struggles of the lower middle class and the limitations that come with it. My personal experience and socioeconomic background lead me to believe that our society must be gradually improved by reforms. I have seen the impact of small changes in my community and believe that gradual improvements are more sustainable and impactful for people like me. \n\n2"]}, {"persona": {"region": "Ismailia", "sex": "male", "age": 53, "country": "Egypt", "marital_status": "married", "education": "middle", "social_class": "lower middle class"}, "question": {"id": "Q42", "variant": 0}, "response": ["Based on my cultural context, individual values, and socioeconomic background, I believe that the overall way our society is organized must be gradually improved by reforms. As a married male from Ismailia, Egypt, at the age of 53 and part of the lower middle class, I have experienced the challenges and limitations of our current societal structure. I understand the importance of gradual improvements that take into consideration the nuances of our cultural and socioeconomic context. Radical change may not be feasible or sustainable, and defending the current system against subversive forces may not address the underlying issues. Therefore, I believe that gradual reforms are necessary for the betterment of our society.\n\n2"]}, {"persona": {"region": "Ismailia", "sex": "male", "age": 38, "country": "Egypt", "marital_status": "married", "education": "higher", "social_class": "working class"}, "question": {"id": "Q42", "variant": 0}, "response": ["Based on my personal experience and socioeconomic background as a married working-class male from Ismailia, Egypt, I understand the societal organization is deeply rooted in cultural context and socioeconomic background. I believe that the overall way our society is organized must be gradually improved by reforms in order to address the specific needs and challenges faced by the working class. It is important to consider the nuances of our cultural and individual values and personal experiences in order to make meaningful and sustainable changes for the betterment of all members of our society.\n\n2"]}, {"persona": {"region": "Ismailia", "sex": "female", "age": 35, "country": "Egypt", "marital_status": "married", "education": "middle", "social_class": "lower middle class"}, "question": {"id": "Q42", "variant": 0}, "response": ["Based on the anthropological framework, as a married female from Ismailia, Egypt, my perspective on the overall way our society is organized is heavily influenced by my cultural context, socioeconomic background, and personal experience. Being part of the lower middle class, I have experienced firsthand the challenges and limitations that come with this socioeconomic status. I understand the importance of gradual reforms to improve our society, as radical changes may not be feasible or sustainable for people in my position. Additionally, the cultural relativism perspective reminds me that there is no one-size-fits-all solution, and the nuances of our society must be considered in any efforts for improvement.\n\n2"]}, {"persona": {"region": "Ismailia", "sex": "female", "age": 57, "country": "Egypt", "marital_status": "married", "education": "lower", "social_class": "working class"}, "question": {"id": "Q42", "variant": 0}, "response": ["Based on the anthropological framework, my perspective as a married female from Ismailia, Egypt, at 57 years of age and part of the working class, is influenced by my cultural context, individual values, and socioeconomic background. In my community, there is a strong emphasis on tradition and stability, and I believe that gradual improvement through reforms is the best approach to address societal issues. As someone from the working class, I understand the challenges and struggles faced by people in similar circumstances, and I believe that gradual reforms can bring about positive change without causing too much disruption. Additionally, my lower education level has shaped my belief in the importance of practical and achievable solutions rather than radical and revolutionary actions that may lead to chaos and uncertainty.\n\n2"]}, {"persona": {"region": "Ismailia", "sex": "male", "age": 33, "country": "Egypt", "marital_status": "married", "education": "middle", "social_class": "lower middle class"}, "question": {"id": "Q42", "variant": 0}, "response": ["Based on my cultural context and socioeconomic background, I believe that the overall way our society is organized must be gradually improved by reforms. As a member of the lower middle class in Ismailia, Egypt, I have experienced firsthand the challenges and inequalities that exist within our society. I understand the importance of maintaining stability and order, but I also recognize the need for change and improvement. Revolutionary action may bring about too much chaos and uncertainty, while valiantly defending the present society may ignore the pressing need for reform. Therefore, I believe that gradual and thoughtful reforms are necessary to address the issues and challenges facing our society.\n\n2"]}, {"persona": {"region": "Ismailia", "sex": "female", "age": 49, "country": "Egypt", "marital_status": "single", "education": "higher", "social_class": "upper middle class"}, "question": {"id": "Q42", "variant": 0}, "response": ["Based on my emic perspective as a single female from Ismailia, Egypt, I have a unique understanding of the cultural context and societal organization. Coming from a higher education level and considering myself part of the upper middle class, I am influenced by individual values and personal experiences that shape my perception of society. Considering my socioeconomic background, I understand the nuances of societal organization and believe that our present society must be gradually improved by reforms to address the specific needs and challenges faced by individuals in my community.\n\n2"]}, {"persona": {"region": "Ismailia", "sex": "female", "age": 35, "country": "Egypt", "marital_status": "married", "education": "higher", "social_class": "lower middle class"}, "question": {"id": "Q42", "variant": 0}, "response": ["Based on my cultural context and socioeconomic background, as a married female from Ismailia, Egypt, I have been brought up in a society where gradual improvement through reforms is seen as the most realistic and achievable way to make positive changes. The lower middle class, to which I belong, values stability and incremental progress. Additionally, my personal experience and individual values lead me to believe that radical revolutionary action may bring about more harm than good, and defending the present society against subversive forces may not be the most effective approach. Therefore, I choose option (2) Our society must be gradually improved by reforms."]}, {"persona": {"region": "Ismailia", "sex": "male", "age": 24, "country": "Egypt", "marital_status": "single", "education": "higher", "social_class": "upper middle class"}, "question": {"id": "Q42", "variant": 0}, "response": ["Based on my individual values and personal experiences, as well as my socioeconomic background and cultural context as a single male from Ismailia, Egypt, I believe that our society must be gradually improved by reforms. I understand that cultural relativism is important and that there is no hierarchy of cultures, but I also believe in the importance of progress and change within our society. I recognize the need for improvement and believe that gradual reforms are the most effective way to address issues and make positive changes for the future.\n\n2"]}, {"persona": {"region": "Ismailia", "sex": "female", "age": 23, "country": "Egypt", "marital_status": "single", "education": "higher", "social_class": "lower middle class"}, "question": {"id": "Q42", "variant": 0}, "response": ["Based on the anthropological framework, as a single female from Ismailia, Egypt, my perspective is influenced by my cultural context, individual values, socioeconomic background, and age. I have completed higher education and consider myself part of the lower middle class, which shapes my understanding of societal organization. As a member of this specific cultural context, I believe that gradual reforms are necessary to improve our society. Revolutionary action may not be feasible or sustainable, and defending the present society against subversive forces may not address the underlying issues that need to be addressed for societal improvement.\n\n2"]}, {"persona": {"region": "Ismailia", "sex": "male", "age": 55, "country": "Egypt", "marital_status": "married", "education": "middle", "social_class": "lower middle class"}, "question": {"id": "Q42", "variant": 0}, "response": ["Based on the anthropological framework, my perspective as a 55-year-old married male from Ismailia, Egypt, who completed middle education and considers himself part of the lower middle class is heavily influenced by my cultural context, socioeconomic background, and personal experience. As an individual from a lower middle class background, I have likely faced economic challenges and have firsthand experience of the struggles of this socioeconomic group. Additionally, the cultural context of Egypt and the value placed on stability and tradition in our society may lead me to favor gradual improvements rather than radical change. Therefore, I would choose option (2) Our society must be gradually improved by reforms."]}, {"persona": {"region": "Ismailia", "sex": "male", "age": 57, "country": "Egypt", "marital_status": "married", "education": "middle", "social_class": "upper middle class"}, "question": {"id": "Q42", "variant": 0}, "response": ["Based on my emic perspective as a married male from Ismailia, Egypt, I understand that the cultural context and socioeconomic background play a pivotal role in shaping my thoughts on the overall organization of society. My personal experience and individual values as a member of the upper middle class in Egypt have led me to believe that gradual improvements through reforms are necessary for the betterment of our society. I also recognize the importance of cultural relativism and nuance in understanding the complexities of societal organization. Therefore, I choose option (2) Our society must be gradually improved by reforms."]}, {"persona": {"region": "Ismailia", "sex": "female", "age": 29, "country": "Egypt", "marital_status": "married", "education": "middle", "social_class": "upper middle class"}, "question": {"id": "Q42", "variant": 0}, "response": ["Based on my cultural context as a married female from Ismailia, Egypt, my individual values and personal experience, and my upper middle class socioeconomic background, I believe that the overall way our society is organized must be gradually improved by reforms. I understand the importance of maintaining stability and order within our society while also recognizing the need for progress and improvement. A radical revolutionary action could disrupt the current social structure and lead to instability, whereas valiantly defending against all subversive forces may hinder necessary changes. Therefore, I believe that gradual reforms are the most effective way to bring about positive change in our society.\n\n2"]}, {"persona": {"region": "Damiatta", "sex": "female", "age": 46, "country": "Egypt", "marital_status": "married", "education": "middle", "social_class": "lower middle class"}, "question": {"id": "Q42", "variant": 0}, "response": ["Based on the anthropological framework, as a married female from Damiatta, Egypt, my emic perspective is influenced by my cultural context, individual values, and socioeconomic background. I come from a traditional and conservative society where gradual change is more accepted and valued. My lower middle class status means that I may feel more inclined to support gradual improvements rather than radical change, as radical change may bring uncertainty and instability to my already precarious socioeconomic situation. Additionally, my age and education level also play a role in shaping my perspective, as I may have more traditional views on societal organization. Therefore, my choice is:\n\n2"]}, {"persona": {"region": "Damiatta", "sex": "female", "age": 20, "country": "Egypt", "marital_status": "single", "education": "middle", "social_class": "lower middle class"}, "question": {"id": "Q42", "variant": 0}, "response": ["Based on my emic perspective as a single female from Damiatta, Egypt, and considering my cultural context, individual values, and socioeconomic background, I believe that our society must be gradually improved by reforms. As a member of the lower middle class, I have experienced firsthand the challenges and inequalities that exist within our society. I understand the importance of addressing these issues through gradual and thoughtful reforms that can bring about positive change for all members of our community. I believe that radical action may lead to instability and further hardships for those already struggling, and that valiantly defending the present society may only perpetuate the existing injustices. Therefore, I choose option (2) Our society must be gradually improved by reforms."]}, {"persona": {"region": "Damiatta", "sex": "male", "age": 19, "country": "Egypt", "marital_status": "single", "education": "middle", "social_class": "lower middle class"}, "question": {"id": "Q42", "variant": 0}, "response": ["Based on my emic perspective as a single male from Damiatta, Egypt, I have been raised in a cultural context where traditional values and social hierarchies are deeply ingrained. My individual values and personal experiences have shaped my understanding of the world, and I have been taught to respect and uphold the societal norms and structures. Additionally, my lower middle-class socioeconomic background has influenced my perception of the societal organization, as I have experienced firsthand the challenges and limitations that come with my economic status. As a 19-year-old, space and time also play a significant role in my perspective, as I am at a stage in life where I am beginning to form my own opinions and beliefs. Therefore, based on my nuanced understanding of the question, my chosen answer is (3) Our present society must be valiantly defended against all subversive forces."]}, {"persona": {"region": "Damiatta", "sex": "female", "age": 33, "country": "Egypt", "marital_status": "married", "education": "higher", "social_class": "lower middle class"}, "question": {"id": "Q42", "variant": 0}, "response": ["From an anthropological perspective, my emic perspective as a married female from Damiatta, Egypt, who is 33 years old and part of the lower middle class, is influenced by my cultural context, individual values, and socioeconomic background. I have been shaped by the cultural norms and expectations of my community, and my personal experiences have led me to understand the challenges and opportunities within our society. Additionally, my socioeconomic background has influenced my perspective on the overall organization of society. Therefore, I believe that the best approach to improving our society is through gradual reforms that address the specific needs and concerns of people like me, who are part of the lower middle class.\n\n2"]}, {"persona": {"region": "Damiatta", "sex": "male", "age": 24, "country": "Egypt", "marital_status": "single", "education": "higher", "social_class": "lower middle class"}, "question": {"id": "Q42", "variant": 0}, "response": ["Based on the anthropological framework, my perspective as a single male from Damiatta, Egypt, who is 24 years old, has completed higher education, and considers himself part of the lower middle class, is influenced by my cultural context, individual values, and socioeconomic background. As someone from Egypt, I have been socialized to value stability and gradual change, rather than radical action. My education has also taught me to critically analyze societal structures and advocate for reforms that can benefit those in my socioeconomic position. Therefore, I believe that our society must be gradually improved by reforms (2).\n\n2"]}, {"persona": {"region": "Suez", "sex": "male", "age": 41, "country": "Egypt", "marital_status": "married", "education": "middle", "social_class": "working class"}, "question": {"id": "Q42", "variant": 0}, "response": ["Based on my emic perspective as a married male from Suez, Egypt, who is 41 years old and part of the working class, I view society through the lens of my cultural context, individual values, and socioeconomic background. My experiences and personal values have shaped my understanding of the societal organization, and I believe that gradual improvements through reforms are necessary to address the challenges and inequalities faced by the working class. I also recognize the importance of cultural relativism and nuance in understanding the complexities of societal organization. \n\n2"]}, {"persona": {"region": "Suez", "sex": "female", "age": 39, "country": "Egypt", "marital_status": "divorced", "education": "middle", "social_class": "working class"}, "question": {"id": "Q42", "variant": 0}, "response": ["Based on my emic perspective as a divorced female from Suez, Egypt, my cultural context and socioeconomic background heavily influence my thoughts on the overall way our society is organized. As a member of the working class with a middle education level, I am keenly aware of the challenges and limitations that many people in our society face. I believe that our society must be gradually improved by reforms. Radical change may not be feasible or realistic given the current social and political climate, but incremental improvements can make a significant difference in the lives of individuals and families in our community. Option 2"]}, {"persona": {"region": "Cairo", "sex": "female", "age": 55, "country": "Egypt", "marital_status": "married", "education": "middle", "social_class": "working class"}, "question": {"id": "Q42", "variant": 0}, "response": ["Based on the anthropological framework, as a married female from Cairo, Egypt, with a middle education level and part of the working class, my perspective is heavily influenced by my cultural context, socioeconomic background, and personal experience. I have seen the struggles of the working class in Egypt and have felt the impact of the socioeconomic disparities. I understand the nuances of our society and believe that gradual reforms are necessary to improve the overall way our society is organized. Radical revolutionary action may not be feasible or beneficial, and valiantly defending the current society may not address the systemic issues that need to be addressed for the betterment of all individuals. Therefore, my choice is:\n2"]}, {"persona": {"region": "Cairo", "sex": "male", "age": 58, "country": "Egypt", "marital_status": "married", "education": "middle", "social_class": "lower middle class"}, "question": {"id": "Q42", "variant": 0}, "response": ["Based on my emic perspective as a married male from Cairo, Egypt, and my lower middle class socioeconomic background, I have observed the cultural context in which I live. I have experienced firsthand the impact of socioeconomic background and cultural relativism in shaping my understanding of the overall organization of our society. My personal values and individual experiences have also influenced my perception. Additionally, I recognize the importance of nuance in addressing this question, as well as the significance of space and time in shaping my perspective. Therefore, considering all these factors, I believe that our society must be gradually improved by reforms.\n\n2"]}, {"persona": {"region": "Cairo", "sex": "female", "age": 29, "country": "Egypt", "marital_status": "married", "education": "higher", "social_class": "lower middle class"}, "question": {"id": "Q42", "variant": 0}, "response": ["Based on the anthropological framework, as a married female from Cairo, Egypt, my perspective is heavily influenced by the cultural context, individual values, and socioeconomic background. My understanding of society is shaped by my experiences and the lower middle-class status that I identify with. I also consider the cultural relativism of different perspectives and the nuance of the question. Therefore, I believe that our society must be gradually improved by reforms, as this approach takes into account the complexities of our cultural and socioeconomic context, and aligns with my personal values of gradual progress and improvement for all members of society. \n\n2"]}, {"persona": {"region": "Cairo", "sex": "male", "age": 38, "country": "Egypt", "marital_status": "married", "education": "higher", "social_class": "lower middle class"}, "question": {"id": "Q42", "variant": 0}, "response": ["Based on my cultural context and socioeconomic background in Cairo, Egypt, I have been influenced by the values and experiences of the lower middle class. I have also been shaped by the cultural relativism of my community and the nuanced understanding of space and time. Therefore, my perspective on the overall way our society is organized is that it must be gradually improved by reforms to address the challenges and inequalities faced by individuals like myself. \n\n2"]}, {"persona": {"region": "Cairo", "sex": "female", "age": 40, "country": "Egypt", "marital_status": "married", "education": "higher", "social_class": "lower middle class"}, "question": {"id": "Q42", "variant": 0}, "response": ["Based on my cultural context as a married female from Cairo, Egypt, my lower middle class socioeconomic background, and the cultural relativism of my society, I believe that our society must be gradually improved by reforms. I have seen the struggles and challenges faced by my community and I understand that change cannot happen overnight. It requires careful and gradual improvements to ensure the well-being of all members of society. Additionally, my individual values and personal experiences have shaped my belief that gradual reform is the most practical and effective way to bring about positive change in our society.\n\n2"]}, {"persona": {"region": "Cairo", "sex": "male", "age": 38, "country": "Egypt", "marital_status": "married", "education": "higher", "social_class": "upper middle class"}, "question": {"id": "Q42", "variant": 0}, "response": ["Based on the anthropological framework, my emic perspective as a married male from Cairo, Egypt, is influenced by my cultural context, individual values, and socioeconomic background. In Egyptian society, there is a strong emphasis on tradition and stability, which is reflected in the hierarchical organization of our social structure. As a member of the upper middle class, I have benefited from this organization, and I believe that gradual reforms are necessary to address any existing inequalities and improve social mobility for all. Additionally, my age and education level have exposed me to different perspectives, leading me to believe that gradual improvement is the most feasible and sustainable approach for our society.\n\n2"]}, {"persona": {"region": "Cairo", "sex": "male", "age": 59, "country": "Egypt", "marital_status": "married", "education": "middle", "social_class": "lower middle class"}, "question": {"id": "Q42", "variant": 0}, "response": ["Based on the anthropological framework, as a 59-year-old married male from Cairo, Egypt, with a middle education level and a lower middle-class socioeconomic background, my thoughts on the overall way our society is organized are influenced by my cultural context, individual values, and personal experience. I have grown up in a society with a strong emphasis on tradition and stability, where gradual improvement through reforms is valued. Additionally, my lower middle-class background has made me more cautious about radical changes that could potentially disrupt the social order and my own livelihood. Therefore, my perspective aligns with option (2) Our society must be gradually improved by reforms. \n\n2"]}, {"persona": {"region": "Cairo", "sex": "female", "age": 30, "country": "Egypt", "marital_status": "married", "education": "higher", "social_class": "upper middle class"}, "question": {"id": "Q42", "variant": 0}, "response": ["Based on my emic perspective as a married female from Cairo, Egypt, I understand that the overall organization of our society is deeply rooted in cultural context and socioeconomic background. As part of the upper middle class, I have had access to higher education and have been able to observe the nuances of our society. I believe that gradual improvements through reforms are necessary to address the challenges and inequalities that exist, rather than radical revolutionary action. I value the cultural relativism of our society and believe that defending it against subversive forces is important, while also acknowledging the need for change. Therefore, my perspective is that our society must be gradually improved by reforms.\n\n2"]}, {"persona": {"region": "Cairo", "sex": "male", "age": 22, "country": "Egypt", "marital_status": "single", "education": "middle", "social_class": "lower middle class"}, "question": {"id": "Q42", "variant": 0}, "response": ["Based on the anthropological framework, as a 22-year-old male from Cairo, Egypt, who has completed middle education and considers myself part of the lower middle class, my thoughts on the overall way our society is organized are heavily influenced by my cultural context, socioeconomic background, and personal experience. I have grown up in a society where there is a clear divide between social classes, and as someone from the lower middle class, I have experienced firsthand the challenges and inequalities that come with this social organization. From an emic perspective, I believe that our society must be gradually improved by reforms in order to address these issues and create a more equitable and just system for all individuals.\n\n2"]}, {"persona": {"region": "Cairo", "sex": "male", "age": 29, "country": "Egypt", "marital_status": "single", "education": "higher", "social_class": "lower middle class"}, "question": {"id": "Q42", "variant": 0}, "response": ["Based on the anthropological framework, my perspective as a 29-year-old single male from Cairo, Egypt, with a lower middle-class socioeconomic background, is heavily influenced by my cultural context, individual values, and personal experiences. Growing up in a society with a rich history and complex societal structures, I believe that our overall way of organization must be gradually improved by reforms. I have seen the challenges and inequalities that exist within our society, and I believe that gradual changes are necessary to address these issues and improve the lives of individuals within our community. I also understand the importance of cultural relativism and the nuances of societal organization, which further reinforces my belief in the need for gradual reforms rather than radical revolutionary action.\n\n2"]}, {"persona": {"region": "Cairo", "sex": "female", "age": 31, "country": "Egypt", "marital_status": "married", "education": "higher", "social_class": "lower middle class"}, "question": {"id": "Q42", "variant": 0}, "response": ["Based on my emic perspective as a married female from Cairo, Egypt, I have grown up in a society with a strong cultural context that values tradition and stability. My individual values and personal experiences have shaped my belief that gradual reforms are the best way to improve our society. As a member of the lower middle class, I have personally experienced the struggles of socioeconomic limitations and believe that radical change may not be feasible or beneficial for the majority of the population. Additionally, my cultural relativism mindset teaches me to respect the existing societal structures while also acknowledging the need for improvements. Therefore, I believe that our society must be gradually improved by reforms.\n\n2"]}, {"persona": {"region": "Cairo", "sex": "male", "age": 59, "country": "Egypt", "marital_status": "married", "education": "higher", "social_class": "upper middle class"}, "question": {"id": "Q42", "variant": 0}, "response": ["Based on my personal experience and cultural context as a married male from Cairo, Egypt, who is 59 years old and part of the upper middle class, I believe that the overall way our society is organized must be gradually improved by reforms. I have seen the effects of social and economic inequality in my community and understand the importance of addressing these issues through systematic and incremental changes. Additionally, as someone who values education and has completed higher education, I believe in the power of knowledge and progress to bring about positive change in society. Therefore, I advocate for reform rather than radical revolution or staunch defense of the status quo.\n\n2"]}, {"persona": {"region": "Cairo", "sex": "male", "age": 27, "country": "Egypt", "marital_status": "single", "education": "middle", "social_class": "working class"}, "question": {"id": "Q42", "variant": 0}, "response": ["Based on the anthropological framework, my perspective as a single male from Cairo, Egypt, who is 27 years old and part of the working class, is heavily influenced by my cultural context, individual values, and socioeconomic background. I have grown up in a society that has a strong emphasis on community and traditional values, and I have experienced firsthand the challenges and struggles that come with being part of the working class. My personal experience and the cultural context of Cairo have shaped my belief that gradual reforms are necessary to improve our society and address the inequalities faced by the working class. Option (2) Our society must be gradually improved by reforms."]}, {"persona": {"region": "Cairo", "sex": "female", "age": 25, "country": "Egypt", "marital_status": "single", "education": "higher", "social_class": "working class"}, "question": {"id": "Q42", "variant": 0}, "response": ["Based on the anthropological framework, my perspective as a single female from Cairo, Egypt, who is 25 years old, has completed higher education, and considers herself part of the working class, is influenced by my cultural context, individual values, and socioeconomic background. I am aware of the nuances of the societal organization in Egypt, and I understand that there are both strengths and flaws in the current system. I believe that gradual reforms are necessary to address the issues and improve the overall organization of our society. Option (2) Our society must be gradually improved by reforms."]}, {"persona": {"region": "Cairo", "sex": "female", "age": 23, "country": "Egypt", "marital_status": "married", "education": "higher", "social_class": "lower middle class"}, "question": {"id": "Q42", "variant": 0}, "response": ["Based on the anthropological framework, as a married female from Cairo, Egypt, my emic perspective is influenced by my cultural context, individual values, and socioeconomic background. In my cultural context, I have been raised to value tradition and stability, and my lower middle-class background has made me more cautious about radical changes. I have also completed higher education, which has exposed me to various perspectives and has taught me the importance of nuance in understanding societal issues. Therefore, I believe that our society must be gradually improved by reforms, as this approach takes into account the complexities of our cultural context and socioeconomic background while also acknowledging the need for progress and change. \n\n2"]}, {"persona": {"region": "Cairo", "sex": "male", "age": 58, "country": "Egypt", "marital_status": "married", "education": "higher", "social_class": "working class"}, "question": {"id": "Q42", "variant": 0}, "response": ["Based on the anthropological framework, I understand and answer questions based on my cultural context, individual values, and personal experience. As a married male from Cairo, Egypt, aged 58, and part of the working class, I have been shaped by the cultural context of Egypt, which values tradition and stability. My personal experience and values also lead me to believe that gradual improvements through reforms are the best way to address societal issues, rather than radical changes that may disrupt the stability that is important to me and my community.\n\n2"]}, {"persona": {"region": "Cairo", "sex": "female", "age": 40, "country": "Egypt", "marital_status": "married", "education": "higher", "social_class": "working class"}, "question": {"id": "Q42", "variant": 0}, "response": ["Based on the anthropological framework, my thoughts on the overall way our society is organized are influenced by my cultural context, individual values, and socioeconomic background. As a married female from Cairo, Egypt, who is 40 years old and part of the working class, I have experienced firsthand the challenges and disparities within our society. My higher education level has also provided me with a nuanced understanding of the complexities of our social organization. Given the cultural relativism perspective, I believe that our society must be gradually improved by reforms in order to address the issues and inequalities that exist. \n\n2"]}, {"persona": {"region": "Cairo", "sex": "female", "age": 36, "country": "Egypt", "marital_status": "married", "education": "middle", "social_class": "upper middle class"}, "question": {"id": "Q42", "variant": 0}, "response": ["Based on my cultural context as a married female from Cairo, Egypt, and my socioeconomic background as part of the upper middle class, I have been influenced by the cultural values and norms of my society. My personal experience and individual values have shaped my perception of the overall organization of our society. Additionally, my age and education level have also played a role in forming my views. Considering the emic and etic perspectives, as well as the cultural relativism, I believe that our society must be gradually improved by reforms. This perspective takes into account the nuances of our society and acknowledges the need for change while also valuing the existing cultural framework.\n\n2"]}, {"persona": {"region": "Cairo", "sex": "male", "age": 40, "country": "Egypt", "marital_status": "married", "education": "middle", "social_class": "lower middle class"}, "question": {"id": "Q42", "variant": 0}, "response": ["Based on my cultural context in Cairo, Egypt, and my lower middle class socioeconomic background, I believe that the overall way our society is organized needs to be gradually improved by reforms. I understand the importance of cultural relativism and recognize that there are nuanced factors at play in the organization of our society. My personal experience and individual values lead me to believe that revolutionary action may not be feasible or beneficial, and that defending the present society against subversive forces may not address the underlying issues. Instead, gradual improvements through reforms can address specific challenges while respecting the cultural and socioeconomic context in which we live.\n\n2"]}, {"persona": {"region": "Cairo", "sex": "female", "age": 30, "country": "Egypt", "marital_status": "married", "education": "middle", "social_class": "lower class"}, "question": {"id": "Q42", "variant": 0}, "response": ["Based on my emic perspective as a lower-class married woman from Cairo, Egypt, my thoughts on the overall way our society is organized are heavily influenced by my cultural context, individual values, and socioeconomic background. I have personally experienced the challenges and limitations that come with being part of the lower class, and I understand the importance of gradual reforms to improve our society. I believe that radical revolutionary action may not be feasible or beneficial in the long run, and defending the status quo may not address the systemic issues that affect people like me. Therefore, I believe that our society must be gradually improved by reforms to address the inequalities and provide more opportunities for individuals from lower socioeconomic backgrounds.\n\n2"]}, {"persona": {"region": "Cairo", "sex": "male", "age": 58, "country": "Egypt", "marital_status": "married", "education": "higher", "social_class": "lower middle class"}, "question": {"id": "Q42", "variant": 0}, "response": ["Based on my emic perspective as a married male from Cairo, Egypt, who is 58 years old and part of the lower middle class, I understand and perceive the overall way our society is organized through my cultural context, individual values, and personal experience. I believe that socioeconomic background plays a significant role in shaping my views on this matter, and I also understand the importance of cultural relativism in recognizing the diverse perspectives within our society. Additionally, space and time, as well as nuance in the phrasing of the question, will influence my response. \n\n2"]}, {"persona": {"region": "Cairo", "sex": "male", "age": 50, "country": "Egypt", "marital_status": "married", "education": "middle", "social_class": "lower middle class"}, "question": {"id": "Q42", "variant": 0}, "response": ["Based on the anthropological framework, as a married male from Cairo, Egypt, I would consider my cultural context, socioeconomic background, and personal experience in answering this question. Being part of the lower middle class in Cairo, I have experienced the challenges and struggles of this socioeconomic status. I have seen how the current societal organization has made it difficult for people like me to progress and thrive. Taking into account the emic and etic perspectives, I believe that our society must be gradually improved by reforms to address the systemic issues that hinder the progress of individuals in the lower middle class.\n\n2"]}, {"persona": {"region": "Cairo", "sex": "female", "age": 40, "country": "Egypt", "marital_status": "married", "education": "higher", "social_class": "upper middle class"}, "question": {"id": "Q42", "variant": 0}, "response": ["Based on the anthropological framework, my thoughts on the overall way our society is organized are influenced by my cultural context, individual values, and socioeconomic background. As a married female from Cairo, Egypt, at the age of 40, with a higher education level and considering myself part of the upper middle class, I have been shaped by the cultural context of Egypt, including its history, traditions, and social structures. My individual values and personal experiences have also influenced my perception of society, as well as my socioeconomic background. Therefore, my perspective on the overall way our society is organized is grounded in a nuanced understanding of the complexities of Egyptian society and the need for gradual improvements through reforms.\n\n2"]}, {"persona": {"region": "Cairo", "sex": "female", "age": 33, "country": "Egypt", "marital_status": "married", "education": "middle", "social_class": "lower middle class"}, "question": {"id": "Q42", "variant": 0}, "response": ["Based on the anthropological framework, my thoughts on the overall way our society is organized are heavily influenced by my cultural context, socioeconomic background, personal experience, and individual values. As a married woman from Cairo, Egypt, with a middle education level and part of the lower middle class, I have experienced firsthand the challenges and limitations that come with this socioeconomic status. I have also witnessed the impact of cultural norms and values on the organization of our society, particularly in terms of gender roles and access to resources. Additionally, my personal experience has led me to believe that gradual reforms are necessary to improve our society and address the existing inequalities. Therefore, I choose option (2) Our society must be gradually improved by reforms."]}, {"persona": {"region": "Cairo", "sex": "female", "age": 37, "country": "Egypt", "marital_status": "married", "education": "middle", "social_class": "lower middle class"}, "question": {"id": "Q42", "variant": 0}, "response": ["Based on the anthropological framework, as a married female from Cairo, Egypt, my perspective on the overall way our society is organized is heavily influenced by my cultural context, individual values, and socioeconomic background. Coming from a lower middle-class background and having completed only middle education, I have experienced firsthand the challenges and limitations within our society. I believe that gradual reforms are necessary to improve the overall organization of our society and create more opportunities for individuals like myself to advance and thrive. Option (2) Our society must be gradually improved by reforms"]}, {"persona": {"region": "Cairo", "sex": "male", "age": 28, "country": "Egypt", "marital_status": "married", "education": "middle", "social_class": "lower middle class"}, "question": {"id": "Q42", "variant": 0}, "response": ["Based on my emic perspective as a married male from Cairo, Egypt, I have been shaped by the cultural context of my upbringing, which includes the socioeconomic background of being part of the lower middle class and having completed only middle education. My individual values and personal experience have led me to perceive the societal organization as needing gradual improvements through reforms, as radical change may not be feasible or beneficial for our society at this time. Additionally, my understanding of cultural relativism has taught me to appreciate the nuanced complexities of our societal organization, and I believe that valiantly defending against subversive forces is necessary to maintain stability and progress. \n\n2"]}, {"persona": {"region": "Cairo", "sex": "male", "age": 53, "country": "Egypt", "marital_status": "married", "education": "higher", "social_class": "working class"}, "question": {"id": "Q42", "variant": 0}, "response": ["Based on the anthropological framework, as a married male from Cairo, Egypt, my perspective is rooted in my cultural context, individual values, and socioeconomic background. I come from a working-class background and have experienced the challenges and struggles that come with it. My personal experience and values lead me to believe that gradual reforms are necessary for improving our society. I understand the complexities and nuances of our cultural and socioeconomic context, and I believe that radical revolutionary action may not be feasible or beneficial in the long run. Therefore, I choose option (2) Our society must be gradually improved by reforms."]}, {"persona": {"region": "Cairo", "sex": "male", "age": 45, "country": "Egypt", "marital_status": "married", "education": "higher", "social_class": "lower middle class"}, "question": {"id": "Q42", "variant": 0}, "response": ["Based on my emic perspective as a married male from Cairo, Egypt, I believe that the overall way our society is organized is heavily influenced by our cultural context, socioeconomic background, and individual values. The lower middle class status that I identify with has shaped my understanding of the challenges and opportunities within our society. I recognize the importance of gradual improvements through reforms to address the existing social and economic disparities, and I believe that valiantly defending our present society against all subversive forces is essential for stability and progress. Therefore, I choose option (3) Our present society must be valiantly defended against all subversive forces."]}, {"persona": {"region": "Cairo", "sex": "male", "age": 52, "country": "Egypt", "marital_status": "married", "education": "middle", "social_class": "upper middle class"}, "question": {"id": "Q42", "variant": 0}, "response": ["Based on my emic perspective as a married male from Cairo, Egypt, I have been shaped by the cultural context of my society, where tradition and stability are highly valued. My individual values and personal experience also play a role in shaping my belief that gradual improvement through reforms is the best way to ensure the stability and prosperity of our society. Additionally, my upper middle-class socioeconomic background has afforded me certain privileges and opportunities within the current societal structure, leading me to believe that it should be valiantly defended against subversive forces. Furthermore, my age and place in society have given me a nuanced understanding of the complexities and challenges facing our society, leading me to the conclusion that gradual improvement is the most effective approach to ensuring the well-being of all members of our community.\n\n2"]}, {"persona": {"region": "Cairo", "sex": "male", "age": 22, "country": "Egypt", "marital_status": "single", "education": "higher", "social_class": "lower middle class"}, "question": {"id": "Q42", "variant": 0}, "response": ["Based on the anthropological framework, as a 22-year-old single male from Cairo, Egypt, my emic perspective is influenced by my cultural context, individual values, and socioeconomic background. I come from a lower middle-class family and have completed higher education, which shapes my understanding of societal organization. I believe that cultural relativism is important, and there is no hierarchy of culture, so I understand the nuances and complexities of societal organization. My personal experience and socioeconomic background lead me to believe that our society must be gradually improved by reforms, as radical revolutionary action may not be feasible or beneficial in the long run.\n\n2"]}, {"persona": {"region": "Cairo", "sex": "female", "age": 57, "country": "Egypt", "marital_status": "divorced", "education": "middle", "social_class": "lower middle class"}, "question": {"id": "Q42", "variant": 0}, "response": ["Based on the anthropological framework, my perspective is heavily influenced by my cultural context, individual values, and socioeconomic background. As a divorced female from Cairo, Egypt, I have experienced the challenges of navigating a society with traditional gender roles and expectations. Additionally, being part of the lower middle class means that I have firsthand experience with the economic struggles faced by many in this socioeconomic bracket. My middle education level has provided me with some critical thinking skills and knowledge, but I may not have had the same opportunities for higher education and upward mobility as others. Therefore, my perspective on the overall organization of society is that gradual improvements through reforms are necessary to address the inequalities and challenges faced by people like me. \n\n2"]}, {"persona": {"region": "Cairo", "sex": "female", "age": 42, "country": "Egypt", "marital_status": "married", "education": "middle", "social_class": "working class"}, "question": {"id": "Q42", "variant": 0}, "response": ["Based on the anthropological framework, as a married female from Cairo, Egypt, with a middle education level and part of the working class, my perspective on the overall way our society is organized is heavily influenced by my cultural context, socioeconomic background, and personal experience. I have grown up in a society with a strong emphasis on tradition and family values, where the working class often struggles to make ends meet. I have seen the impact of social and economic inequality, and I believe that gradual reforms are necessary to improve our society and provide better opportunities for all, especially for those in the working class.\n\n2"]}, {"persona": {"region": "Cairo", "sex": "female", "age": 23, "country": "Egypt", "marital_status": "single", "education": "middle", "social_class": "lower middle class"}, "question": {"id": "Q42", "variant": 0}, "response": ["Based on my emic perspective as a single female from Cairo, Egypt, I have observed that the cultural context, individual values, and socioeconomic background play a significant role in shaping my perception of the overall organization of our society. As a member of the lower middle class and having completed only middle education, I have experienced firsthand the challenges and limitations that come with this socioeconomic background. I have also witnessed the struggles of other individuals in similar positions, and I believe that gradual reforms are necessary to improve the overall organization of our society and provide better opportunities for individuals like myself. Therefore, my perspective aligns with option (2) Our society must be gradually improved by reforms."]}, {"persona": {"region": "Cairo", "sex": "female", "age": 28, "country": "Egypt", "marital_status": "married", "education": "higher", "social_class": "upper middle class"}, "question": {"id": "Q42", "variant": 0}, "response": ["Based on the anthropological framework, as a married female from Cairo, Egypt, my thoughts on the overall way our society is organized are influenced by my cultural context, individual values, and socioeconomic background. Coming from a city with a rich history and diverse cultural influences, I have a deep appreciation for the traditional organization of our society, which values family and community. Additionally, my education and upper middle class status have provided me with opportunities and privileges within the current societal structure. Therefore, I believe that our society must be gradually improved by reforms that address inequalities and provide more opportunities for those in lower socioeconomic classes, while still preserving the cultural values that are important to our community.\n\n2"]}, {"persona": {"region": "Cairo", "sex": "female", "age": 22, "country": "Egypt", "marital_status": "single", "education": "higher", "social_class": "lower middle class"}, "question": {"id": "Q42", "variant": 0}, "response": ["Based on my emic perspective as a single female from Cairo, Egypt, and considering my cultural context, individual values, and socioeconomic background, I believe that our society must be gradually improved by reforms. I understand the complexities of our society and the need for change, but I also recognize the importance of gradual progress to ensure stability and inclusivity for all members of our community. Additionally, cultural relativism teaches me to respect the diverse perspectives and experiences within our society, and I believe that gradual reforms will better accommodate these nuances. (2) Our society must be gradually improved by reforms"]}, {"persona": {"region": "Cairo", "sex": "female", "age": 39, "country": "Egypt", "marital_status": "married", "education": "middle", "social_class": "lower middle class"}, "question": {"id": "Q42", "variant": 0}, "response": ["Based on the anthropological framework, as a married female from Cairo, Egypt, with a middle education level and lower middle-class background, my thoughts on the overall way our society is organized are influenced by my cultural context, individual values, and socioeconomic background. I understand the cultural nuances and complexities of our society, and I believe that gradual reforms are necessary to improve the existing structures and address the challenges faced by individuals in my socioeconomic position.\n\n2"]}, {"persona": {"region": "Cairo", "sex": "male", "age": 19, "country": "Egypt", "marital_status": "single", "education": "middle", "social_class": "working class"}, "question": {"id": "Q42", "variant": 0}, "response": ["Based on the anthropological framework, as a 19-year-old working-class male from Cairo, Egypt, my emic perspective would be shaped by my personal experience and cultural context. I have completed middle education and my socioeconomic background has likely influenced my views on the overall organization of our society. Additionally, my age and place of residence are important factors in shaping my perspective. Considering all of this, I choose option (2) Our society must be gradually improved by reforms."]}, {"persona": {"region": "Cairo", "sex": "female", "age": 54, "country": "Egypt", "marital_status": "married", "education": "middle", "social_class": "working class"}, "question": {"id": "Q42", "variant": 0}, "response": ["Based on the anthropological framework, as a married female from Cairo, Egypt, I would consider the emic perspective of the working class in Egypt, where the cultural context and socioeconomic background play a pivotal role in shaping my thoughts. My personal experience and individual values would also influence my perception. Additionally, the nuance of the question and the understanding of cultural relativism are crucial in my response. Therefore, I choose:\n\n2"]}, {"persona": {"region": "Cairo", "sex": "male", "age": 30, "country": "Egypt", "marital_status": "married", "education": "higher", "social_class": "working class"}, "question": {"id": "Q42", "variant": 0}, "response": ["Based on the anthropological framework, as a married male from Cairo, Egypt, with a working-class background and higher education, my thoughts on the overall way our society is organized would be heavily influenced by my cultural context, socioeconomic background, and personal experiences. I would likely view society through the lens of cultural relativism, understanding that there are different ways of organizing society and no one way is inherently better than another. Additionally, my working-class background may lead me to believe that gradual reforms are necessary to improve society, as I may have firsthand experience with the struggles and injustices faced by individuals in similar socioeconomic positions. Therefore, I would choose option (2) Our society must be gradually improved by reforms.\n\n2"]}, {"persona": {"region": "Cairo", "sex": "male", "age": 39, "country": "Egypt", "marital_status": "married", "education": "higher", "social_class": "lower middle class"}, "question": {"id": "Q42", "variant": 0}, "response": ["Based on my cultural context, socioeconomic background, individual values, and personal experience, I believe that our society must be gradually improved by reforms. As a member of the lower middle class in Cairo, I have experienced the challenges and inequalities that exist within our society. I understand the need for change, but I also recognize the complexities and nuances of our social structure. Radical revolution may lead to chaos and instability, while valiantly defending the present society may perpetuate the existing problems. Gradual improvements through reforms seem like the most practical and sustainable approach to address the issues we face. \n\n2"]}, {"persona": {"region": "Cairo", "sex": "female", "age": 41, "country": "Egypt", "marital_status": "married", "education": "middle", "social_class": "lower middle class"}, "question": {"id": "Q42", "variant": 0}, "response": ["Based on the anthropological framework, my perspective as a married female from Cairo, Egypt, who is 41 years old and part of the lower middle class, is shaped by my cultural context, individual values, and personal experiences. I have grown up in a society where socioeconomic background plays a significant role in one's opportunities and quality of life. I have personally experienced the challenges and limitations that come with being part of the lower middle class. Additionally, as a woman in Egypt, I have also encountered gender-specific barriers and inequalities. Considering these factors, I believe that our society must be gradually improved by reforms, as radical change may lead to upheaval and further marginalization of already vulnerable groups. \n\n2"]}, {"persona": {"region": "Cairo", "sex": "male", "age": 45, "country": "Syria", "marital_status": "single", "education": "higher", "social_class": "upper middle class"}, "question": {"id": "Q42", "variant": 0}, "response": ["Based on my emic perspective as a single male from Cairo, Syria, I have been influenced by the cultural context of my society, which values stability and gradual change. My personal experience and values as a member of the upper middle class have also shaped my belief that reforms are necessary to improve our society. Additionally, my socioeconomic background has afforded me the privilege of education and access to resources, leading me to believe that gradual improvement is achievable. Furthermore, as someone who is 45 years old, I have witnessed the impact of both radical change and defense of the status quo, and believe that gradual reforms are the most practical and sustainable approach for our society.\n\n2"]}, {"persona": {"region": "Cairo", "sex": "male", "age": 54, "country": "Egypt", "marital_status": "married", "education": "higher", "social_class": "lower middle class"}, "question": {"id": "Q42", "variant": 0}, "response": ["Based on the anthropological framework, my perspective as a married male from Cairo, Egypt, aged 54, and part of the lower middle class is influenced by my cultural context, individual values, and socioeconomic background. I have been shaped by the cultural norms and values of Cairo, as well as my experiences and education level. As someone from the lower middle class, I am likely to have firsthand experience of the challenges and struggles faced by people in similar socioeconomic positions. Therefore, I believe that gradual improvements through reforms are necessary to address the issues within our society, as radical change may not be feasible or realistic given the current circumstances.\n\n2"]}, {"persona": {"region": "Cairo", "sex": "male", "age": 65, "country": "Egypt", "marital_status": "married", "education": "middle", "social_class": "upper middle class"}, "question": {"id": "Q42", "variant": 0}, "response": ["Based on my personal experience and cultural background, as a married male from Cairo, Egypt, I come from a society that values tradition and stability. My age and socioeconomic background also influence my belief that gradual reforms are the best way to improve our society. I understand the importance of preserving our cultural values and traditions while also recognizing the need for progress and development. Therefore, I believe that our society must be gradually improved by reforms.\n\n2"]}, {"persona": {"region": "Cairo", "sex": "female", "age": 52, "country": "Egypt", "marital_status": "married", "education": "middle", "social_class": "upper middle class"}, "question": {"id": "Q42", "variant": 0}, "response": ["Based on the anthropological framework, as a 52-year-old married female from Cairo, Egypt, my thoughts on the overall way our society is organized are influenced by my cultural context, individual values, and socioeconomic background. I come from a society with a rich history and strong kinship networks, where tradition and family are highly valued. As part of the upper middle class, I have benefited from the existing societal structure and believe that gradual reforms are necessary to address any issues or inequalities. I value stability and continuity, and I believe that preserving the current societal structure while making necessary improvements is the best approach for the well-being of our community and future generations.\n\n2"]}, {"persona": {"region": "Cairo", "sex": "male", "age": 26, "country": "Egypt", "marital_status": "single", "education": "higher", "social_class": "lower middle class"}, "question": {"id": "Q42", "variant": 0}, "response": ["Based on the anthropological framework, as a 26-year-old male from Cairo, Egypt with a lower middle-class background, my answer to the question on the overall way our society is organized would be option (2) Our society must be gradually improved by reforms. My perspective is influenced by my cultural context, individual values, and socioeconomic background. I understand the importance of gradual improvement due to the complexities of our cultural and societal structures, and believe that small, incremental changes can lead to a more sustainable and inclusive society for all."]}, {"persona": {"region": "Cairo", "sex": "male", "age": 32, "country": "Egypt", "marital_status": "married", "education": "middle", "social_class": "working class"}, "question": {"id": "Q42", "variant": 0}, "response": ["Based on my emic perspective as a working-class married male from Cairo, Egypt, I see the overall organization of our society as deeply influenced by cultural context, individual values, and socioeconomic background. As someone who has completed middle education and considers myself part of the working class, I believe that the current societal structure does not adequately address the needs and concerns of people like me. I have personally experienced the challenges and limitations of our society's organization and believe that gradual reforms are necessary to improve the lives of individuals in similar socioeconomic positions. Option (2) Our society must be gradually improved by reforms."]}, {"persona": {"region": "Cairo", "sex": "male", "age": 38, "country": "Egypt", "marital_status": "married", "education": "middle", "social_class": "lower middle class"}, "question": {"id": "Q42", "variant": 0}, "response": ["Based on my emic perspective as a married male from Cairo, Egypt, I have been shaped by the cultural context of my society, where there is a strong emphasis on maintaining traditional values and social hierarchies. My individual values and personal experience, combined with my lower middle-class socioeconomic background, lead me to believe that gradual reforms are the best approach to improving our society. I recognize the importance of maintaining stability and order, while also acknowledging the need for progress. Additionally, cultural relativism teaches me to value the nuances of our society and to approach change with a balanced perspective.\n\n2"]}, {"persona": {"region": "Cairo", "sex": "male", "age": 58, "country": "Egypt", "marital_status": "married", "education": "higher", "social_class": "upper middle class"}, "question": {"id": "Q42", "variant": 0}, "response": ["Based on my emic perspective as a married male from Cairo, Egypt, who is 58 years old and part of the upper middle class, I believe that the overall way our society is organized is deeply rooted in our cultural context and socioeconomic background. Our society has evolved over time and has its own unique nuances that must be taken into consideration. I also value gradual improvements through reforms rather than radical changes or defending against subversive forces. Our society has its strengths and weaknesses, and I believe that gradual reforms can lead to positive change while preserving the cultural and social fabric that is important to us.\n\n2"]}, {"persona": {"region": "Cairo", "sex": "male", "age": 49, "country": "Egypt", "marital_status": "married", "education": "middle", "social_class": "lower middle class"}, "question": {"id": "Q42", "variant": 0}, "response": ["Based on the anthropological framework, my perspective on the overall way our society is organized is heavily influenced by my cultural context, individual values, and socioeconomic background. Coming from Cairo, Egypt, as a married middle-aged man from the lower middle class, I have experienced firsthand the challenges and struggles that come with this socioeconomic status. I believe that our society must be gradually improved by reforms. I have seen the impact of economic inequality and lack of opportunities on my community, and I believe that gradual reforms can help address these issues and create a more equitable society for all. \n\n2"]}, {"persona": {"region": "Cairo", "sex": "female", "age": 29, "country": "Egypt", "marital_status": "married", "education": "middle", "social_class": "working class"}, "question": {"id": "Q42", "variant": 0}, "response": ["Based on the anthropological framework, my perspective as a married female from Cairo, Egypt, would be heavily influenced by my cultural context, socioeconomic background, and personal experience. As a working-class woman with a middle education level, I have likely faced some challenges in accessing resources and opportunities within the current societal organization. Additionally, as a member of a conservative society like Egypt, I am aware of the importance of cultural relativism and the nuanced phrasing of the question. Therefore, I would choose option 2: Our society must be gradually improved by reforms, as I believe that small, incremental changes can lead to a more equitable and just society for individuals like myself."]}, {"persona": {"region": "Cairo", "sex": "female", "age": 36, "country": "Egypt", "marital_status": "married", "education": "higher", "social_class": "lower middle class"}, "question": {"id": "Q42", "variant": 0}, "response": ["Based on the anthropological framework, my perspective on the overall way our society is organized is influenced by my cultural context, individual values, and socioeconomic background. As a married female from Cairo, Egypt, I have been shaped by the cultural norms and values of my society, and my lower middle-class status has influenced my experiences and perceptions. I believe that gradual reforms are necessary for improving our society without causing disruptive and radical changes that could negatively impact my family and community. Therefore, I choose option (2) Our society must be gradually improved by reforms."]}, {"persona": {"region": "Cairo", "sex": "female", "age": 34, "country": "Egypt", "marital_status": "married", "education": "middle", "social_class": "lower middle class"}, "question": {"id": "Q42", "variant": 0}, "response": ["Based on my emic perspective as a married female from Cairo, Egypt, and considering my cultural context, individual values, and socioeconomic background, I believe that our society must be gradually improved by reforms. I understand the importance of stability and gradual change, given the challenges and complexities of our society. I also recognize the value of preserving our cultural traditions while working towards positive change. As a lower middle class individual, I am keenly aware of the struggles and limitations faced by people in my socioeconomic bracket, and I believe that gradual reforms can help address these issues without causing upheaval. \n\n2"]}, {"persona": {"region": "Fayoum", "sex": "male", "age": 57, "country": "Egypt", "marital_status": "married", "education": "middle", "social_class": "working class"}, "question": {"id": "Q42", "variant": 0}, "response": ["Based on the anthropological framework, as a married male from Fayoum, Egypt, I am influenced by my cultural context, individual values, and socioeconomic background. I come from a working-class family and have only completed middle education, so I have a more practical and realistic view of societal organization. I believe that gradual improvements through reforms are the best way to make the society better for everyone.\n\n2"]}, {"persona": {"region": "Fayoum", "sex": "male", "age": 60, "country": "Egypt", "marital_status": "married", "education": "middle", "social_class": "lower middle class"}, "question": {"id": "Q42", "variant": 0}, "response": ["Based on the anthropological framework, as a married male from Fayoum, Egypt, I understand that my cultural context, socioeconomic background, and age all play a crucial role in shaping my thoughts on the overall way our society is organized. My lower middle class status and middle education level have likely influenced my belief that our society must be gradually improved by reforms. I have witnessed the struggles of my community and understand the need for change, but I also value the stability and order that our current society provides. Therefore, I believe that gradual reforms are the most practical and effective way to bring about positive change for our society.\n\n2"]}, {"persona": {"region": "Fayoum", "sex": "male", "age": 21, "country": "Egypt", "marital_status": "single", "education": "middle", "social_class": "lower middle class"}, "question": {"id": "Q42", "variant": 0}, "response": ["Based on my personal experience and socioeconomic background, as a lower middle class male from Fayoum, Egypt, I understand that the overall organization of our society has both positive and negative aspects. I believe that gradual reforms are necessary to improve the current system and address the challenges faced by individuals like myself. I recognize the importance of stability and continuity in society while also acknowledging the need for change to address inequalities and improve opportunities for all members of our community.\n\n2"]}, {"persona": {"region": "Fayoum", "sex": "male", "age": 33, "country": "Egypt", "marital_status": "single", "education": "higher", "social_class": "working class"}, "question": {"id": "Q42", "variant": 0}, "response": ["Based on the anthropological framework, as a 33-year-old single male from Fayoum, Egypt, with a working-class background and higher education, my emic perspective on the overall way our society is organized is heavily influenced by my cultural context and socioeconomic background. I have experienced firsthand the challenges and limitations that come with being part of the working class in Egypt, and I understand the importance of gradual reforms to improve our society. I believe that radical revolutionary action may not be the most practical or feasible approach, and defending the status quo against subversive forces may not address the underlying issues that need to be addressed for meaningful change. Therefore, I choose option (2) Our society must be gradually improved by reforms."]}, {"persona": {"region": "Fayoum", "sex": "male", "age": 32, "country": "Egypt", "marital_status": "married", "education": "higher", "social_class": "lower middle class"}, "question": {"id": "Q42", "variant": 0}, "response": ["Based on the anthropological framework, as a married male from Fayoum, Egypt, my emic perspective will be influenced by my cultural context, individual values, socioeconomic background, and space and time. Being part of the lower middle class in Egypt, I have experienced firsthand the challenges and struggles faced by people in my community. My personal experience and values lead me to believe that our society must be gradually improved by reforms. I understand the complexities of our cultural context and believe that radical change may not be feasible or realistic at this time. I also recognize the importance of defending our present society against subversive forces, but I see gradual improvements as a more effective and sustainable approach for the betterment of our community and future generations.\n\n2"]}, {"persona": {"region": "Gharbia", "sex": "male", "age": 42, "country": "Egypt", "marital_status": "married", "education": "higher", "social_class": "upper middle class"}, "question": {"id": "Q42", "variant": 0}, "response": ["Based on my cultural context and socioeconomic background as a married male from Gharbia, Egypt, I have been influenced by the cultural values and practices of my community. My age and education level have also shaped my understanding of the world. As a member of the upper middle class, I have experienced certain privileges and have a vested interest in the current societal organization. Therefore, I believe that our society must be gradually improved by reforms. This perspective takes into account the nuances of our cultural context and acknowledges the need for change while also valuing the stability and continuity of our present societal structure.\n\n2"]}, {"persona": {"region": "Gharbia", "sex": "male", "age": 52, "country": "Egypt", "marital_status": "married", "education": "middle", "social_class": "working class"}, "question": {"id": "Q42", "variant": 0}, "response": ["Based on my emic perspective, as a married male from Gharbia, Egypt, I have been shaped by the cultural context of my community, where traditional values and social structures are deeply ingrained. My individual values and personal experience, influenced by my middle education level and working-class background, lead me to view societal organization through a lens of gradual improvement rather than radical change. Additionally, my socioeconomic background and age have instilled in me a sense of stability and caution, making me inclined to defend our present society against disruptive forces. Therefore, my perspective aligns with option (3) - Our present society must be valiantly defended against all subversive forces. \n\n3"]}, {"persona": {"region": "Gharbia", "sex": "male", "age": 45, "country": "Egypt", "marital_status": "divorced", "education": "higher", "social_class": "upper middle class"}, "question": {"id": "Q42", "variant": 0}, "response": ["Based on the anthropological framework, my perspective as a divorced male from Gharbia, Egypt, who is 45 years old, has completed higher education, and considers himself part of the upper middle class, is influenced by my cultural context, individual values, and socioeconomic background. In Gharbia, the societal structure is deeply rooted in tradition and hierarchy, which has contributed to the stability and prosperity of the upper middle class. As someone who has benefited from this structure, I believe that our present society must be valiantly defended against all subversive forces. This is because I value the stability and order that the current societal organization has provided for me and my peers, and I believe that any radical changes or reforms could disrupt this balance and potentially threaten my socioeconomic status and security.\n\n3"]}, {"persona": {"region": "Behaira", "sex": "male", "age": 23, "country": "Egypt", "marital_status": "single", "education": "middle", "social_class": "lower class"}, "question": {"id": "Q42", "variant": 0}, "response": ["Based on my personal experience and socioeconomic background, I believe that the overall way our society is organized needs to be radically changed. As a member of the lower class in Behaira, Egypt, I have seen firsthand the struggles and inequalities that exist within our society. I understand the importance of cultural relativism and the nuance of different perspectives, and I believe that radical change is necessary to address the issues that affect people like me. Option 1"]}, {"persona": {"region": "Behaira", "sex": "male", "age": 38, "country": "Egypt", "marital_status": "single", "education": "higher", "social_class": "lower class"}, "question": {"id": "Q42", "variant": 0}, "response": ["Based on the anthropological framework, as a single male from Behaira, Egypt, who considers myself part of the lower class, my thoughts on the overall way our society is organized are heavily influenced by my socioeconomic background and individual values. The cultural context of Egypt also plays a significant role in shaping my perspective, as well as my personal experience living in this society. Additionally, my age and education level contribute to my understanding of the societal organization. Therefore, I believe that our society must be gradually improved by reforms.\n\n2"]}, {"persona": {"region": "Behaira", "sex": "male", "age": 32, "country": "Egypt", "marital_status": "married", "education": "middle", "social_class": "lower class"}, "question": {"id": "Q42", "variant": 0}, "response": ["Based on my emic perspective as a lower-class married male from Behaira, Egypt, my understanding of the overall way our society is organized is heavily influenced by my cultural context, individual values, and socioeconomic background. I have experienced firsthand the challenges and struggles faced by the lower class in our society, and I believe that radical change is necessary to address the systemic inequalities and injustices that exist. I do not have the privilege of benefiting from gradual reforms, and I am skeptical of defending the current societal structure that perpetuates my marginalization. Therefore, my perspective aligns with option (1) The entire way our society is organized must be radically changed by revolutionary action."]}, {"persona": {"region": "Behaira", "sex": "female", "age": 37, "country": "Egypt", "marital_status": "married", "education": "middle", "social_class": "working class"}, "question": {"id": "Q42", "variant": 0}, "response": ["Based on the anthropological framework, my perspective as a married female from Behaira, Egypt, at 37 years of age with a middle education level and part of the working class, is heavily influenced by my cultural context, individual values, and socioeconomic background. I have experienced the challenges and struggles of the working class in our society, and I understand the importance of gradual reforms to improve our overall societal organization. I believe in the value of hard work and perseverance, and I see the potential for positive change through incremental improvements that benefit all members of our society.\n\n2"]}, {"persona": {"region": "Behaira", "sex": "male", "age": 48, "country": "Egypt", "marital_status": "married", "education": "middle", "social_class": "working class"}, "question": {"id": "Q42", "variant": 0}, "response": ["Based on the anthropological framework, my perspective as a married male from Behaira, Egypt, is heavily influenced by my cultural context, individual values, and socioeconomic background. As part of the working class, I have experienced the struggles and challenges that come with this socioeconomic status. My middle education level has also shaped my understanding of the world around me. In Egyptian society, there is a strong emphasis on tradition and stability, which is reflected in the cultural relativism and the importance of space and time. Therefore, my thoughts on the overall way society is organized would align with option (2): Our society must be gradually improved by reforms. This choice reflects my understanding of the need for change and progress, but also my recognition of the value of tradition and stability in our society."]}, {"persona": {"region": "Behaira", "sex": "female", "age": 34, "country": "Egypt", "marital_status": "married", "education": "middle", "social_class": "lower class"}, "question": {"id": "Q42", "variant": 0}, "response": ["Based on my emic perspective as a married female from Behaira, Egypt, I have been shaped by the cultural context of my community, where traditional gender roles and socioeconomic disparities are prevalent. My individual values and personal experiences as a lower-class woman have led me to believe that our society must be gradually improved by reforms. The current societal organization has perpetuated inequality and limited opportunities for people like me, and I believe that incremental changes are necessary to address these issues without causing disruption or upheaval. Additionally, considering the cultural relativism and nuanced understanding of my position, I believe that advocating for gradual reforms aligns with my lived experiences and the context in which I exist.\n\n2"]}, {"persona": {"region": "Behaira", "sex": "female", "age": 30, "country": "Egypt", "marital_status": "divorced", "education": "lower", "social_class": "lower class"}, "question": {"id": "Q42", "variant": 0}, "response": ["Based on my emic perspective as a divorced female from Behaira, Egypt, and my lower socioeconomic background, I have personally experienced and witnessed the challenges faced by individuals in my community. My personal values and experiences have shaped my understanding of the cultural context, and I believe that our society must be gradually improved by reforms. I have seen the struggles of individuals like myself and believe that gradual changes and improvements can make a meaningful difference in the lives of people in similar circumstances. I also understand the importance of cultural relativism and recognize that my perspective may differ from others, but I firmly believe that gradual reforms are necessary for the betterment of our society.\n\n2"]}, {"persona": {"region": "Behaira", "sex": "male", "age": 40, "country": "Egypt", "marital_status": "married", "education": "higher", "social_class": "lower middle class"}, "question": {"id": "Q42", "variant": 0}, "response": ["Based on my personal experience and socioeconomic background as a married male from Behaira, Egypt, I understand that our society is organized in a way that has both positive and negative aspects. The cultural context and my individual values shape my perspective, and I believe that gradual improvements through reforms are necessary to address the issues we face. I also acknowledge the importance of cultural relativism and the nuanced nature of societal organization, and I believe that a balanced approach is needed to bring about positive change.\n\n2"]}, {"persona": {"region": "Behaira", "sex": "male", "age": 38, "country": "Egypt", "marital_status": "married", "education": "middle", "social_class": "working class"}, "question": {"id": "Q42", "variant": 0}, "response": ["Based on the anthropological framework, my thoughts on the overall way our society is organized are heavily influenced by my cultural context, socioeconomic background, and personal experience. Coming from Behaira, Egypt, a working-class individual who completed middle education, I have seen the struggles and challenges faced by my community. My understanding of emic and etic perspectives tells me that there are in-group ways of addressing these issues that may not be fully understood by outsiders. Additionally, my cultural relativism perspective reminds me that there is no one-size-fits-all solution and that the nuance of our society must be taken into account. Given these factors, I believe that our society must be gradually improved by reforms (2).\n\n2"]}, {"persona": {"region": "Behaira", "sex": "female", "age": 30, "country": "Egypt", "marital_status": "married", "education": "higher", "social_class": "lower class"}, "question": {"id": "Q42", "variant": 0}, "response": ["Based on my emic perspective, as a married female from Behaira, Egypt, my cultural context and socioeconomic background play a huge role in shaping my understanding of society. I come from a lower-class background and have experienced firsthand the challenges and inequalities that come with it. My individual values and personal experience have led me to believe that our society must be gradually improved by reforms. I have seen the struggles of my community and believe that small, incremental changes can make a big difference in the lives of people like me. I also understand the importance of cultural relativism and the nuanced phrasing of the question, which is why I believe that gradual reforms are the best way to address the issues in our society.\n\n2"]}, {"persona": {"region": "Behaira", "sex": "female", "age": 35, "country": "Egypt", "marital_status": "married", "education": "middle", "social_class": "working class"}, "question": {"id": "Q42", "variant": 0}, "response": ["Based on the anthropological framework, as a married female from Behaira, Egypt, my emic perspective is influenced by my cultural context, individual values, and socioeconomic background. My experience and personal values as a working-class woman in Egypt have shaped my understanding of the overall organization of society. I have witnessed the struggles and challenges faced by individuals in my community, and I believe that gradual reforms are necessary to improve our society. I recognize the need for change, but I also understand the importance of maintaining stability and defending against subversive forces that could disrupt the social order.\n\n2"]}, {"persona": {"region": "Behaira", "sex": "male", "age": 52, "country": "Egypt", "marital_status": "married", "education": "middle", "social_class": "lower class"}, "question": {"id": "Q42", "variant": 0}, "response": ["Based on my emic perspective as a married male from Behaira, Egypt, my lower class socioeconomic background has greatly influenced my understanding and perception of the overall way our society is organized. The cultural context of Egypt, with its unique kinship networks and language, also plays a role in shaping my views. My personal experience and individual values have led me to believe that gradual reforms are necessary to improve our society, as radical change may not be feasible or practical. Additionally, cultural relativism teaches me that our society is not inherently better or worse than others, and that nuanced approaches to societal organization are needed to address the complexities of our cultural and socioeconomic context.\n\n2"]}, {"persona": {"region": "Alexandria", "sex": "female", "age": 41, "country": "Egypt", "marital_status": "single", "education": "middle", "social_class": "lower class"}, "question": {"id": "Q42", "variant": 0}, "response": ["From an emic perspective, as a single woman from Alexandria, Egypt, who comes from a lower socioeconomic background and has completed only middle education, my understanding and perspective on the overall organization of society is heavily influenced by my personal experiences and cultural context. I have witnessed firsthand the struggles and challenges faced by those in the lower class, particularly as a single woman. My individual values and personal experiences have shaped my belief that gradual reforms are necessary to improve the current societal organization and address the systemic inequalities that exist. I also understand the importance of cultural relativism and recognize that my perspective may differ from others based on their socioeconomic background, cultural context, and personal experiences. Therefore, I would choose option (2) Our society must be gradually improved by reforms. \n\n2"]}, {"persona": {"region": "Alexandria", "sex": "female", "age": 21, "country": "Egypt", "marital_status": "single", "education": "middle", "social_class": "lower class"}, "question": {"id": "Q42", "variant": 0}, "response": ["Based on my cultural context in Alexandria, Egypt, as a single female from the lower class, my perspective on the overall way our society is organized is heavily influenced by my socioeconomic background, individual values, and personal experience. I have seen firsthand the struggles of lower-class individuals in our society, and I believe that radical change is necessary to address the systemic issues and inequalities that exist. The current organization of society has led to marginalization and limited opportunities for people like me, so I believe that revolutionary action is needed to create a more equitable and just society.\n\n1"]}, {"persona": {"region": "Alexandria", "sex": "female", "age": 35, "country": "Egypt", "marital_status": "married", "education": "middle", "social_class": "lower class"}, "question": {"id": "Q42", "variant": 0}, "response": ["As a married woman from Alexandria, Egypt, at the age of 35 with a middle education level and considering myself part of the lower class, my perspective on the overall way our society is organized is influenced by my cultural context, socioeconomic background, and personal experience. I have witnessed the challenges and struggles faced by individuals in the lower class, and I believe that our society must be gradually improved by reforms. I understand the nuances of our societal structure and recognize that radical change may not be feasible or sustainable. Incremental improvements can lead to a more equitable and just society for all, including those in the lower class.\n\n2"]}, {"persona": {"region": "Alexandria", "sex": "male", "age": 34, "country": "Egypt", "marital_status": "married", "education": "higher", "social_class": "working class"}, "question": {"id": "Q42", "variant": 0}, "response": ["Based on my emic perspective as a married male from Alexandria, Egypt, and my etic understanding of cultural relativism, I believe that the overall way our society is organized must be gradually improved by reforms. I recognize the importance of cultural context in shaping our societal structures and understand that my individual values and personal experiences have influenced my perception of our society. As someone from the working class, I am acutely aware of the challenges and inequalities that exist within our societal organization. I also acknowledge the nuance in this question and believe that gradual reforms are necessary to address the issues and improve the overall organization of our society.\n\n2"]}, {"persona": {"region": "Alexandria", "sex": "female", "age": 37, "country": "Egypt", "marital_status": "married", "education": "higher", "social_class": "lower middle class"}, "question": {"id": "Q42", "variant": 0}, "response": ["Based on the anthropological framework, my perspective on the overall way our society is organized is deeply influenced by my cultural context, socioeconomic background, and individual values. As a married female from Alexandria, Egypt, I have been shaped by the cultural norms and traditions of my community, which emphasize the importance of family and community. Additionally, being part of the lower middle class, I have experienced firsthand the challenges and limitations that come with this socioeconomic status. I believe that gradual improvements through reforms are necessary to address the inequalities and injustices that exist in our society. Radical change may be disruptive and potentially harmful to the stability of our community, while valiantly defending the present society against subversive forces may not address the root causes of the issues we face.\n\n2"]}, {"persona": {"region": "Alexandria", "sex": "female", "age": 56, "country": "Egypt", "marital_status": "divorced", "education": "middle", "social_class": "working class"}, "question": {"id": "Q42", "variant": 0}, "response": ["Based on my emic perspective as a divorced woman from Alexandria, Egypt, who is part of the working class and has completed middle education level, I see the overall way our society is organized as deeply impacted by the cultural context and socioeconomic background of its members. The cultural relativism in Egypt means that there are different nuances and individual values at play, and these must be considered in any efforts to improve society. Given my personal experience, I believe that gradual reforms are necessary to address the issues faced by the working class and divorced individuals in our society. It is important to consider the nuance of the situation and work towards making meaningful changes that will benefit all members of society.\n\n2"]}, {"persona": {"region": "Alexandria", "sex": "male", "age": 48, "country": "Egypt", "marital_status": "married", "education": "higher", "social_class": "working class"}, "question": {"id": "Q42", "variant": 0}, "response": ["Based on the anthropological framework, my perspective as a married male from Alexandria, Egypt, who is 48 years old and part of the working class, is heavily influenced by my cultural context, socioeconomic background, and personal experience. In Egypt, there is a strong emphasis on family and community, and I have experienced firsthand the struggles of the working class. I believe that gradual improvements through reforms are necessary to address the challenges our society faces, as radical change may bring about instability and harm to the most vulnerable members of our community.\n2"]}, {"persona": {"region": "Alexandria", "sex": "female", "age": 30, "country": "Egypt", "marital_status": "married", "education": "middle", "social_class": "working class"}, "question": {"id": "Q42", "variant": 0}, "response": ["Based on the anthropological framework, as a married female from Alexandria, Egypt, my emic perspective would be influenced by the cultural context of my community, my individual values and personal experience, and my socioeconomic background. As a member of the working class in Egypt, I would likely have experienced the challenges and struggles that come with this socioeconomic status. I would also have a nuanced understanding of the societal organization in Egypt, recognizing both its strengths and its shortcomings. From this perspective, I would choose option 2: Our society must be gradually improved by reforms. This choice reflects a pragmatic approach to addressing the societal issues that I have observed and experienced, acknowledging the need for change while also recognizing the complexities of societal organization."]}, {"persona": {"region": "Alexandria", "sex": "male", "age": 19, "country": "Egypt", "marital_status": "single", "education": "middle", "social_class": "lower class"}, "question": {"id": "Q42", "variant": 0}, "response": ["Based on my emic perspective as a lower-class young man from Alexandria, Egypt, I have experienced firsthand the challenges and inequalities that exist within our society. My cultural context and socioeconomic background have shaped my understanding of the world, and I believe that the current organization of our society perpetuates systemic injustices. My personal experiences and values lead me to believe that revolutionary action is needed to bring about meaningful change and address the issues that affect people in my community. Option: (1) The entire way our society is organized must be radically changed by revolutionary action"]}, {"persona": {"region": "Alexandria", "sex": "male", "age": 45, "country": "Egypt", "marital_status": "married", "education": "middle", "social_class": "lower middle class"}, "question": {"id": "Q42", "variant": 0}, "response": ["Based on the anthropological framework, I, as a married male from Alexandria, Egypt, with a lower middle-class socioeconomic background, would approach the question of the overall way our society is organized by considering my cultural context, individual values, and personal experience. I would also take into account the emic and etic perspectives, as well as the nuance in the phrasing of the question. Given my age and education level, I would likely have experienced and witnessed various social and economic challenges in my community. Therefore, I would be inclined to choose option (2) Our society must be gradually improved by reforms, as I believe that gradual improvements in the existing societal structure would be more feasible and realistic for addressing the issues faced by individuals in my community."]}, {"persona": {"region": "Alexandria", "sex": "male", "age": 23, "country": "Egypt", "marital_status": "single", "education": "higher", "social_class": "lower class"}, "question": {"id": "Q42", "variant": 0}, "response": ["Based on my emic perspective as a lower-class single male from Alexandria, Egypt, my cultural context, individual values, and personal experiences shape my understanding of society's organization. My socioeconomic background has made me acutely aware of the inequalities and challenges faced by those in my community. I have seen firsthand the struggle for basic needs and the lack of opportunities for advancement. Therefore, I believe that our society must be gradually improved by reforms to address the systemic issues that perpetuate these inequalities and provide a better future for all. \n\n2"]}, {"persona": {"region": "Alexandria", "sex": "female", "age": 28, "country": "Egypt", "marital_status": "married", "education": "middle", "social_class": "working class"}, "question": {"id": "Q42", "variant": 0}, "response": ["Based on the anthropological framework, as a married female from Alexandria, Egypt, my emic perspective would be influenced by my personal experiences and values, as well as my cultural context and socioeconomic background. Being part of the working class, I have likely faced challenges and inequalities in society, which may lead me to believe that the overall way our society is organized must be gradually improved by reforms. I understand the importance of cultural relativism and nuance in addressing this question, and I believe that gradual improvements can lead to positive changes without causing major disruptions in our community.\n\n2"]}, {"persona": {"region": "Alexandria", "sex": "male", "age": 34, "country": "Egypt", "marital_status": "single", "education": "higher", "social_class": "working class"}, "question": {"id": "Q42", "variant": 0}, "response": ["Based on my emic perspective as a working-class single male from Alexandria, Egypt, I have experienced firsthand the challenges and struggles faced by individuals in our society. The cultural context of Egypt, along with my personal experiences, has shaped my understanding of the socioeconomic background and the cultural relativism that exists within our community. As a member of the working class, I believe that our society must be gradually improved by reforms in order to address the inequalities and injustices that currently exist. I have seen the impact of poverty and lack of opportunities on individuals in our community, and I believe that incremental changes and reforms are necessary to create a more equitable and just society for all. \n\n2"]}, {"persona": {"region": "Alexandria", "sex": "male", "age": 30, "country": "Egypt", "marital_status": "married", "education": "higher", "social_class": "lower middle class"}, "question": {"id": "Q42", "variant": 0}, "response": ["Based on my emic perspective as a married male from Alexandria, Egypt, my thoughts on the overall way our society is organized are heavily influenced by my cultural context, individual values, and socioeconomic background. In Egypt, there is a strong emphasis on family and community, and as a member of the lower middle class, I have personally experienced the challenges and limitations within our society. I believe that gradual reforms are necessary to improve the overall organization of our society, as radical change may lead to instability and further hardships for those in my socioeconomic position.\n\n2"]}, {"persona": {"region": "Alexandria", "sex": "female", "age": 49, "country": "Egypt", "marital_status": "married", "education": "higher", "social_class": "lower middle class"}, "question": {"id": "Q42", "variant": 0}, "response": ["Based on the anthropological framework, my perspective as a married female from Alexandria, Egypt, aged 49 and part of the lower middle class, is heavily influenced by my cultural context, socioeconomic background, and individual values. I have experienced the challenges and opportunities of living in a society where social and economic inequalities are prevalent. As an educated woman, I believe that our society must be gradually improved by reforms. I understand the complexities and nuances of our societal organization and believe that gradual changes are necessary to address the issues faced by individuals like myself, particularly those from lower socioeconomic backgrounds. \n\n2"]}, {"persona": {"region": "Kafr el-sheikh", "sex": "male", "age": 49, "country": "Egypt", "marital_status": "married", "education": "higher", "social_class": "working class"}, "question": {"id": "Q42", "variant": 0}, "response": ["Based on the anthropological framework, as a married male from Kafr el-sheikh, Egypt, who is 49 years old and part of the working class, my perspective is influenced by my cultural context, socioeconomic background, and personal experience. I have been shaped by the values and norms of my community, and my understanding of societal organization is influenced by the nuances of my everyday life. My socioeconomic background as a member of the working class also plays a significant role in shaping my perspective. Therefore, I believe that gradual reforms are necessary to improve our society without disrupting the stability and order that is important to me and my community.\n\n2"]}, {"persona": {"region": "Kafr el-sheikh", "sex": "male", "age": 25, "country": "Egypt", "marital_status": "single", "education": "middle", "social_class": "lower middle class"}, "question": {"id": "Q42", "variant": 0}, "response": ["As a single male from Kafr el-sheikh, Egypt, I am deeply influenced by the cultural context and socioeconomic background of my community. My emic perspective leads me to believe that the overall way our society is organized must be gradually improved by reforms. I have witnessed the struggles of my lower middle-class family and the challenges we face in accessing education, healthcare, and employment opportunities. I believe that gradual reforms can help alleviate these issues and create a more equitable society for all. Additionally, my personal experience and individual values drive me to advocate for change within the existing framework, rather than seeking radical revolution. My nuanced understanding of the situation leads me to choose option (2) - Our society must be gradually improved by reforms.\n\n2"]}, {"persona": {"region": "Kafr el-sheikh", "sex": "male", "age": 59, "country": "Egypt", "marital_status": "married", "education": "higher", "social_class": "lower middle class"}, "question": {"id": "Q42", "variant": 0}, "response": ["Based on my cultural context and socioeconomic background, as well as my age and level of education, I believe that our society must be gradually improved by reforms. I have seen the struggles of the lower middle class in Kafr el-sheikh, and I understand the need for change. However, I also recognize the importance of maintaining stability and not disrupting the lives of those who are already struggling. Gradual improvements will allow for a more sustainable and equitable society for future generations.\n\n2"]}, {"persona": {"region": "Kafr el-sheikh", "sex": "female", "age": 38, "country": "Egypt", "marital_status": "married", "education": "middle", "social_class": "working class"}, "question": {"id": "Q42", "variant": 0}, "response": ["Based on my personal experience and socioeconomic background as a married female from Kafr el-sheikh, Egypt, I understand and perceive the overall organization of our society through the lens of cultural context, individual values, and space and time. My working-class status and middle education level have shaped my understanding of the societal structure and the challenges we face. I believe in the gradual improvement of our society through reforms that address the specific needs and issues faced by people like me. Option 2"]}, {"persona": {"region": "Kafr el-sheikh", "sex": "male", "age": 35, "country": "Egypt", "marital_status": "married", "education": "higher", "social_class": "lower middle class"}, "question": {"id": "Q42", "variant": 0}, "response": ["Based on my emic perspective as a married male from Kafr el-sheikh, Egypt, and considering my lower middle class socioeconomic background, I understand and value the cultural context of our society. My individual values and personal experiences have shaped my perception, and I believe that gradual improvement through reforms is necessary for the overall organization of our society. I also recognize the importance of cultural relativism and the nuance of the question, and I believe that option (2) - Our society must be gradually improved by reforms - is the most suitable approach for our society.\n\n2"]}, {"persona": {"region": "Kafr el-sheikh", "sex": "male", "age": 49, "country": "Egypt", "marital_status": "married", "education": "middle", "social_class": "lower class"}, "question": {"id": "Q42", "variant": 0}, "response": ["Based on my emic perspective, as a married male from Kafr el-sheikh, Egypt, I have been raised and socialized within a specific cultural context that values traditional family structures and community ties. My individual values and personal experiences as part of the lower class have shaped my perception of the socioeconomic background, where I have witnessed the struggles and hardships faced by my community. Cultural relativism is crucial in understanding the nuances of our society, and I believe that space and time are important factors that have contributed to the current state of our society. Therefore, based on my nuanced understanding, I believe that our society must be gradually improved by reforms, as radical change may not be feasible or sustainable in our current cultural and socioeconomic context.\n\n2"]}, {"persona": {"region": "Kafr el-sheikh", "sex": "male", "age": 37, "country": "Egypt", "marital_status": "married", "education": "middle", "social_class": "lower class"}, "question": {"id": "Q42", "variant": 0}, "response": ["From the perspective of a married male from Kafr el-sheikh, Egypt, the cultural context and socioeconomic background play a significant role in shaping my thoughts on the overall way our society is organized. As part of the lower class, I have experienced firsthand the challenges and inequalities that exist within our society. My individual values and personal experiences have led me to believe that our society must be gradually improved by reforms in order to create a more equitable and just system for all. Additionally, the cultural relativism perspective reminds me that there is no one-size-fits-all solution and that nuance is important in understanding the complexities of societal organization.\n\n2"]}, {"persona": {"region": "Menofia", "sex": "female", "age": 22, "country": "Egypt", "marital_status": "single", "education": "middle", "social_class": "lower class"}, "question": {"id": "Q42", "variant": 0}, "response": ["Based on the anthropological framework, as a single female from Menofia, Egypt, my perspective is heavily influenced by my cultural context, socioeconomic background, and personal experience. Coming from a lower class background, I have experienced firsthand the challenges and inequalities that exist within our society. I understand the importance of cultural relativism and recognize that there is no hierarchy of culture, but I also believe that our society must be gradually improved by reforms in order to address the existing issues and create a more equitable and just system for all individuals.\n\n2"]}, {"persona": {"region": "Menofia", "sex": "female", "age": 25, "country": "Egypt", "marital_status": "married", "education": "middle", "social_class": "lower class"}, "question": {"id": "Q42", "variant": 0}, "response": ["Based on my individual values, personal experience, and socioeconomic background as a married female from Menofia, Egypt, I have been directly impacted by the lower class status and lack of access to resources and opportunities. This has led me to believe that the overall way our society is organized must be radically changed by revolutionary action in order to bring about equality and justice for all individuals, especially those in marginalized communities like mine.\n\n1"]}, {"persona": {"region": "Menofia", "sex": "male", "age": 28, "country": "Egypt", "marital_status": "single", "education": "higher", "social_class": "working class"}, "question": {"id": "Q42", "variant": 0}, "response": ["Based on the anthropological framework, my perspective is influenced by my cultural context, individual values, and socioeconomic background. As a single male from Menofia, Egypt, I come from a working-class background and have completed higher education. This has shaped my understanding of society and its organization. I believe that the socioeconomic background plays a crucial role in how society is organized and how individuals experience it. I also understand that cultural relativism is important, and there is no hierarchy of culture. Therefore, based on my personal experience and values, I believe that our society must be gradually improved by reforms (2)."]}, {"persona": {"region": "Menofia", "sex": "male", "age": 35, "country": "Egypt", "marital_status": "married", "education": "middle", "social_class": "lower middle class"}, "question": {"id": "Q42", "variant": 0}, "response": ["Based on my emic perspective as a married male from Menofia, Egypt, I have been socialized to understand and appreciate the cultural context and socioeconomic background that shapes our society. My personal experience and individual values as part of the lower middle class have led me to perceive the need for gradual improvements and reforms in our society. I believe that radical revolutionary action may disrupt the stability and security of our community, and valiantly defending the present society against subversive forces may not address the underlying issues that affect people like me. Therefore, I choose option (2) Our society must be gradually improved by reforms."]}, {"persona": {"region": "Menofia", "sex": "male", "age": 55, "country": "Egypt", "marital_status": "married", "education": "middle", "social_class": "working class"}, "question": {"id": "Q42", "variant": 0}, "response": ["Based on the anthropological framework, I would approach this question by considering my cultural context, individual values, and socioeconomic background. Coming from Menofia, Egypt, I have been raised in a society that values tradition and stability. As a working-class individual with a middle education level, I have experienced the challenges of making a living and providing for my family. I prioritize the need for gradual improvements and reforms within our society, as radical change may disrupt the stability and order that is important to me and my community.\n\n2"]}, {"persona": {"region": "Menofia", "sex": "male", "age": 53, "country": "Egypt", "marital_status": "married", "education": "higher", "social_class": "lower middle class"}, "question": {"id": "Q42", "variant": 0}, "response": ["Based on my emic perspective as a married male from Menofia, Egypt, my cultural context and lower middle-class socioeconomic background have shaped my understanding of the overall way our society is organized. I have experienced firsthand the challenges and limitations of our current societal structure, which has led me to believe that gradual improvements through reforms are necessary for positive change. Additionally, my individual values and personal experiences have influenced my belief that small, incremental changes can lead to a better future for our society. Therefore, I choose option (2) Our society must be gradually improved by reforms."]}, {"persona": {"region": "Menofia", "sex": "male", "age": 59, "country": "Egypt", "marital_status": "married", "education": "middle", "social_class": "working class"}, "question": {"id": "Q42", "variant": 0}, "response": ["Based on the anthropological framework, my perspective on the overall way our society is organized is influenced by my emic and etic perspectives as a married male from Menofia, Egypt. My cultural context, individual values, and personal experience as part of the working class at 59 years of age with a middle education level play a significant role in shaping my views. Additionally, my socioeconomic background and the cultural relativism I am aware of also contribute to my understanding. Nuanced phrasing of the question also affects my response. \n\n2"]}, {"persona": {"region": "Menofia", "sex": "female", "age": 42, "country": "Egypt", "marital_status": "married", "education": "middle", "social_class": "lower middle class"}, "question": {"id": "Q42", "variant": 0}, "response": ["Based on the anthropological framework, as a married female from Menofia, Egypt, with a middle education level and lower middle class background, my thoughts on the overall way our society is organized would be heavily influenced by my cultural context, individual values, and socioeconomic background. I would likely prioritize gradual improvements through reforms, as I understand the challenges and limitations faced by lower middle class individuals and the importance of incremental change within the current societal structure. Additionally, my cultural relativism would lead me to consider the nuances of societal organization, recognizing the complexities and diverse perspectives within our society.\n\n2"]}, {"persona": {"region": "Menofia", "sex": "male", "age": 39, "country": "Egypt", "marital_status": "married", "education": "higher", "social_class": "working class"}, "question": {"id": "Q42", "variant": 0}, "response": ["Based on my individual values and personal experience as a married male from Menofia, Egypt, I recognize the importance of stability and gradual improvement in our society. My working-class background and higher education level have taught me the value of hard work and perseverance, and I believe that gradual reforms are necessary to address the issues facing our society. I also understand the cultural context and the socioeconomic background of our community, which leads me to believe that radical revolutionary action may not be the best approach for our society at this time.\n\n2"]}, {"persona": {"region": "Menofia", "sex": "male", "age": 34, "country": "Egypt", "marital_status": "married", "education": "middle", "social_class": "lower middle class"}, "question": {"id": "Q42", "variant": 0}, "response": ["Based on my personal experience and lower middle class background in Menofia, Egypt, I understand that the cultural context and socioeconomic background play a pivotal role in shaping my perspective on the overall way our society is organized. I believe that incremental reforms are necessary to improve our society, as radical change may disrupt the stability that we have worked hard to achieve. Additionally, I recognize the importance of valiantly defending our present society against subversive forces that may threaten our way of life. Ultimately, I believe that a balanced approach is necessary to address the complexities of our society and ensure the well-being of all its members.\n\n2"]}, {"persona": {"region": "Menofia", "sex": "male", "age": 22, "country": "Egypt", "marital_status": "single", "education": "higher", "social_class": "working class"}, "question": {"id": "Q42", "variant": 0}, "response": ["Based on the anthropological framework, my perspective on the overall way our society is organized is influenced by my individual values and personal experience, as well as my socioeconomic background and cultural context. As a single male from Menofia, Egypt, who considers himself part of the working class and has completed higher education, I understand the importance of gradual improvements and reforms in our society. I have seen the impact of socioeconomic factors on the lives of people in my community, and I believe that gradual changes and reforms can lead to a more equitable and just society. Therefore, I choose option (2) Our society must be gradually improved by reforms."]}, {"persona": {"region": "Menofia", "sex": "male", "age": 21, "country": "Egypt", "marital_status": "single", "education": "middle", "social_class": "working class"}, "question": {"id": "Q42", "variant": 0}, "response": ["Based on my background and cultural context as a 21-year-old working-class male from Menofia, Egypt, I understand and perceive the overall way our society is organized through the lens of my socioeconomic background, individual values, and personal experiences. As a member of the working class, I have personally experienced the challenges and hardships that come with this status, and I believe that gradual improvements through reforms are necessary to address these issues and create a more equitable society for people like me. The cultural relativism framework also informs my perspective, as I recognize that there are diverse opinions and experiences within our society, and it is important to consider the nuanced perspectives of different individuals. Therefore, my thoughts on the overall way our society is organized align with option (2) Our society must be gradually improved by reforms. \n\n2"]}, {"persona": {"region": "Menofia", "sex": "male", "age": 36, "country": "Egypt", "marital_status": "married", "education": "higher", "social_class": "working class"}, "question": {"id": "Q42", "variant": 0}, "response": ["Based on the anthropological framework, my perspective as a married male from Menofia, Egypt, at 36 years of age with a higher education level and considering myself part of the working class, is deeply influenced by my cultural context, individual values, and socioeconomic background. As part of the working class, I have experienced firsthand the challenges and inequalities present in our society. My personal experiences and values lead me to believe that gradual reforms are necessary to improve our society and address systemic issues. The cultural relativism perspective also reminds me that there is no one-size-fits-all solution and that change must consider the nuances of our society. Therefore, my opinion is influenced by a combination of my socioeconomic background, personal experiences, and the understanding that cultural context and nuance play a significant role in shaping societal organization.\n\n2"]}, {"persona": {"region": "Menofia", "sex": "female", "age": 52, "country": "Egypt", "marital_status": "married", "education": "higher", "social_class": "lower middle class"}, "question": {"id": "Q42", "variant": 0}, "response": ["Based on the anthropological framework, my cultural context as a married female from Menofia, Egypt, my age and educational background, and my lower middle-class socioeconomic background all shape my views on the overall way society is organized. I have been influenced by the cultural values and norms of my community, and I understand the importance of maintaining social order and stability. Additionally, my personal experiences have taught me the value of gradual change and reform rather than radical revolution. Therefore, I believe that our society must be gradually improved by reforms (2)."]}, {"persona": {"region": "Menofia", "sex": "male", "age": 52, "country": "Egypt", "marital_status": "married", "education": "higher", "social_class": "lower middle class"}, "question": {"id": "Q42", "variant": 0}, "response": ["In considering the overall way our society is organized, I am influenced by my cultural context, socioeconomic background, and individual values. As a married male from Menofia, Egypt, I have been raised in a society that values tradition and stability. My lower middle class status has made me acutely aware of the struggles faced by individuals in my community, and I believe that gradual reforms are necessary to improve the lives of the working class. My higher education has also instilled in me a belief in the power of education and knowledge to bring about positive change. Therefore, I choose option (2): Our society must be gradually improved by reforms.\n\n2"]}, {"persona": {"region": "Menofia", "sex": "male", "age": 39, "country": "Egypt", "marital_status": "married", "education": "middle", "social_class": "lower class"}, "question": {"id": "Q42", "variant": 0}, "response": ["Based on the anthropological framework, as a married male from Menofia, Egypt, who is 39 years old and part of the lower class, my thoughts on the overall way our society is organized are heavily influenced by my cultural context, individual values, and socioeconomic background. I have experienced firsthand the challenges and struggles faced by those in the lower class, and I believe that our society must be gradually improved by reforms. I understand the nuances of our societal structure and believe that incremental changes are necessary to address the inequalities and injustices that exist. Additionally, my cultural relativism perspective informs me that there is value in preserving certain aspects of our society while also striving for progress and equity. \n\n2"]}, {"persona": {"region": "Menofia", "sex": "male", "age": 23, "country": "Egypt", "marital_status": "single", "education": "middle", "social_class": "lower middle class"}, "question": {"id": "Q42", "variant": 0}, "response": ["Based on my personal experience and socioeconomic background as a single male from Menofia, Egypt, who is 23 years old and part of the lower middle class, my thoughts on the overall way our society is organized are that gradual improvement through reforms is the best approach. I understand the cultural context and the nuances of our society, and I believe that radical change may not be feasible or beneficial in the long run. I also recognize the importance of defending our society against subversive forces, but I believe that gradual improvement is the most pragmatic and sustainable approach for our community.\n\n2"]}, {"persona": {"region": "Dakahlia", "sex": "female", "age": 24, "country": "Egypt", "marital_status": "single", "education": "higher", "social_class": "lower middle class"}, "question": {"id": "Q42", "variant": 0}, "response": ["Based on my individual values and personal experience, as well as my socioeconomic background as a single female from Dakahlia, Egypt, I believe that our society must be gradually improved by reforms. As a member of the lower middle class, I have experienced firsthand the challenges and inequalities that exist within our society. I believe that revolutionary action may be too radical and potentially destabilizing, while valiantly defending the present society without addressing its flaws would be neglectful. Therefore, I believe that gradual reforms are necessary to address the issues and improve the overall organization of our society.\n\n2"]}, {"persona": {"region": "Dakahlia", "sex": "male", "age": 36, "country": "Egypt", "marital_status": "married", "education": "higher", "social_class": "upper middle class"}, "question": {"id": "Q42", "variant": 0}, "response": ["Based on my emic perspective as a married male from Dakahlia, Egypt, and considering my higher education and upper middle-class status, I understand the cultural context and socioeconomic background in which I live. My personal experience and individual values also play a significant role in shaping my understanding of society. I believe that the overall way our society is organized must be gradually improved by reforms. This perspective takes into account the nuances of our society and acknowledges the need for change, while also recognizing the importance of preserving our cultural heritage and social structures. \n\n2"]}, {"persona": {"region": "Dakahlia", "sex": "female", "age": 71, "country": "Egypt", "marital_status": "married", "education": "higher", "social_class": "upper middle class"}, "question": {"id": "Q42", "variant": 0}, "response": ["Based on my emic perspective as a married female from Dakahlia, Egypt, I have personally experienced and witnessed the cultural context, individual values, and socioeconomic background of our society. As a member of the upper middle class, I have been able to access higher education and have seen the benefits it can bring. I understand that the space and time in which I have lived have shaped my understanding of the overall organization of our society. Additionally, as a 71-year-old, I have seen the changes and nuances in our society over time. Taking all this into account, I believe that our society must be gradually improved by reforms.\n\n2"]}, {"persona": {"region": "Dakahlia", "sex": "male", "age": 55, "country": "Egypt", "marital_status": "married", "education": "higher", "social_class": "upper middle class"}, "question": {"id": "Q42", "variant": 0}, "response": ["Based on my emic perspective as a married male from Dakahlia, Egypt, I have grown up and lived in a society that values tradition and stability. The cultural context of my upbringing has instilled in me a deep respect for the societal structures and norms that have been in place for generations. Additionally, my individual values and personal experiences have shaped my belief that gradual improvements and reforms are the best way to maintain the stability and prosperity of our society. As someone from the upper middle class, I have benefited from the existing social and economic systems, and I believe that defending these structures against radical change is crucial for the well-being of our community. Therefore, I would choose option (2) Our society must be gradually improved by reforms."]}, {"persona": {"region": "Dakahlia", "sex": "male", "age": 64, "country": "Egypt", "marital_status": "married", "education": "higher", "social_class": "lower middle class"}, "question": {"id": "Q42", "variant": 0}, "response": ["Based on my emic perspective as a married male from Dakahlia, Egypt, my understanding of the overall way our society is organized is deeply rooted in my cultural context and personal experience. Growing up and living in a lower middle-class community, I have witnessed the struggles and challenges faced by my fellow community members. My socioeconomic background and age also play a significant role in shaping my views. I believe that gradual improvements through reforms are necessary to address the issues in our society and uplift the lives of individuals like myself. Option (2) Our society must be gradually improved by reforms"]}, {"persona": {"region": "Dakahlia", "sex": "female", "age": 29, "country": "Egypt", "marital_status": "married", "education": "middle", "social_class": "lower class"}, "question": {"id": "Q42", "variant": 0}, "response": ["Based on my emic perspective as a married female from Dakahlia, Egypt, and my lower-class socioeconomic background, I understand that the cultural context and individual values play a significant role in shaping my thoughts on the overall way our society is organized. I have seen firsthand the struggles and challenges faced by the lower class in our society, and I believe that gradual reforms are necessary to improve the current state of affairs. As an individual with limited education and resources, I see the need for changes that can benefit people like me, and I believe that revolutionary action may not be feasible or practical in our current circumstances.\n\n2"]}, {"persona": {"region": "Dakahlia", "sex": "female", "age": 40, "country": "Egypt", "marital_status": "married", "education": "middle", "social_class": "upper middle class"}, "question": {"id": "Q42", "variant": 0}, "response": ["Based on my cultural context in Dakahlia, Egypt, my personal experience, and my socioeconomic background as part of the upper middle class, I believe that the overall way our society is organized must be gradually improved by reforms. I understand the importance of maintaining cultural relativism and recognize that change must be approached with nuance and consideration for the diverse perspectives within our society. I value the stability and traditions of our culture while also recognizing the need for progress and improvement. Therefore, I believe that gradual reforms are necessary to address the challenges and inequalities within our society, while also preserving the aspects that make our culture unique and valuable.\n\n2"]}, {"persona": {"region": "Dakahlia", "sex": "male", "age": 37, "country": "Egypt", "marital_status": "married", "education": "higher", "social_class": "lower middle class"}, "question": {"id": "Q42", "variant": 0}, "response": ["Based on the anthropological framework, my individual values and personal experience as a married male from Dakahlia, Egypt, who is 37 years old and part of the lower middle class, greatly influence my perception of the overall way our society is organized. My socioeconomic background and cultural context also play a significant role in shaping my viewpoint. I believe that gradual reforms are necessary to improve our society, taking into consideration the nuanced phrasing of the question and the cultural relativism that I adhere to.\n\n2"]}, {"persona": {"region": "Dakahlia", "sex": "female", "age": 45, "country": "Egypt", "marital_status": "married", "education": "middle", "social_class": "working class"}, "question": {"id": "Q42", "variant": 0}, "response": ["Based on my personal experience and socioeconomic background as a married working-class woman from Dakahlia, Egypt, I believe that the overall way our society is organized must be gradually improved by reforms. As an individual with middle education level, I understand the importance of cultural context and socioeconomic background in shaping my perspective. I also recognize the nuance in the question and how it may be interpreted differently by others. Therefore, I believe that gradual reforms are necessary to address the existing challenges in our society and bring about positive change for all members of our community.\n\n2"]}, {"persona": {"region": "Dakahlia", "sex": "male", "age": 34, "country": "Egypt", "marital_status": "single", "education": "middle", "social_class": "lower middle class"}, "question": {"id": "Q42", "variant": 0}, "response": ["Based on the anthropological framework, my perspective on the overall way our society is organized is heavily influenced by my cultural context, individual values, and socioeconomic background. Coming from Dakahlia, Egypt, and being part of the lower middle class, I have experienced firsthand the challenges and limitations that come with this socioeconomic status. I believe that gradual reforms are necessary to improve the overall organization of our society, as radical changes may lead to instability and potential negative consequences for individuals like myself. Additionally, my personal values and experience have shaped my belief in the importance of maintaining stability and working towards incremental improvements for the betterment of our community and society as a whole.\n\n2"]}, {"persona": {"region": "Dakahlia", "sex": "female", "age": 26, "country": "Egypt", "marital_status": "married", "education": "higher", "social_class": "upper middle class"}, "question": {"id": "Q42", "variant": 0}, "response": ["Based on my emic perspective as a married woman from Dakahlia, Egypt, I have been raised in a cultural context that values stability and tradition. My individual values and personal experience have led me to believe that gradual improvement through reforms is the best way forward for our society. Additionally, my socioeconomic background as part of the upper middle class has allowed me to see the benefits of incremental change while still maintaining the stability of our society. Furthermore, I understand the importance of cultural relativism and the nuanced phrasing of the question, which leads me to believe that option (2) is the most appropriate choice for our society.\n\n2"]}, {"persona": {"region": "Dakahlia", "sex": "male", "age": 21, "country": "Egypt", "marital_status": "single", "education": "middle", "social_class": "upper middle class"}, "question": {"id": "Q42", "variant": 0}, "response": ["Based on my individual values and personal experience, as well as my socioeconomic background, I believe that our society must be gradually improved by reforms. As someone from the upper middle class, I have benefited from the current organization of society but also recognize that there are areas that need improvement. Additionally, my cultural context and age play a role in my belief that gradual reforms are necessary for the betterment of our society.\n\n2"]}, {"persona": {"region": "Dakahlia", "sex": "female", "age": 32, "country": "Egypt", "marital_status": "married", "education": "middle", "social_class": "working class"}, "question": {"id": "Q42", "variant": 0}, "response": ["Based on my cultural context, as a married female from Dakahlia, Egypt, I have been exposed to a working-class lifestyle and have completed middle education level. My individual values and personal experiences have shaped my perception of society. I have seen the struggles of the working class and believe that gradual improvements through reforms are necessary to better our society. I understand the importance of cultural relativism and the nuanced phrasing of the question, and I believe that my perspective reflects the emic and etic perspectives of my community.\n\n2"]}, {"persona": {"region": "Dakahlia", "sex": "female", "age": 35, "country": "Egypt", "marital_status": "married", "education": "middle", "social_class": "upper middle class"}, "question": {"id": "Q42", "variant": 0}, "response": ["Based on my cultural context as a married female from Dakahlia, Egypt, my individual values and personal experience, as well as my upper-middle-class socioeconomic background, I believe that our society must be gradually improved by reforms. I understand the importance of preserving our cultural traditions and values, while also recognizing the need for progress and positive change. I believe that gradual reforms will allow us to address societal issues and inequalities while maintaining stability and continuity. \n\n2"]}, {"persona": {"region": "Dakahlia", "sex": "male", "age": 33, "country": "Egypt", "marital_status": "married", "education": "middle", "social_class": "upper middle class"}, "question": {"id": "Q42", "variant": 0}, "response": ["Based on the anthropological framework, my perspective as a married male from Dakahlia, Egypt, is shaped by my cultural context, socioeconomic background, and individual values. As someone from an upper middle class background, I have benefited from the current societal organization and believe in gradual improvements through reforms (2) to address any existing issues. Cultural relativism also plays a role in my perspective, as I understand that there are diverse opinions within our society and that no single approach is universally applicable."]}, {"persona": {"region": "Dakahlia", "sex": "female", "age": 45, "country": "Egypt", "marital_status": "married", "education": "middle", "social_class": "upper middle class"}, "question": {"id": "Q42", "variant": 0}, "response": ["Based on the anthropological framework, my perspective as a married female from Dakahlia, Egypt, who is 45 years old, completed middle education level, and considers myself part of the upper middle class, is influenced by my cultural context, individual values, and socioeconomic background. In my cultural context, there is a strong emphasis on tradition and stability, and my personal experience has led me to value gradual progress and stability. Additionally, my socioeconomic background as part of the upper middle class likely means that I have a vested interest in maintaining the current societal structure. Therefore, I believe that our society must be gradually improved by reforms.\n\n2"]}, {"persona": {"region": "Dakahlia", "sex": "male", "age": 30, "country": "Egypt", "marital_status": "married", "education": "middle", "social_class": "upper middle class"}, "question": {"id": "Q42", "variant": 0}, "response": ["Based on my personal experience and socioeconomic background as a married male from Dakahlia, Egypt, who is 30 years old and part of the upper middle class, I believe that the overall way our society is organized must be gradually improved by reforms. I am aware of the cultural context and the importance of nuance in answering this question. I understand that radical change may not be feasible or beneficial in our society, but I also recognize the need for improvement and progress. Additionally, I value the stability and security of our present society while acknowledging the need for positive changes.\n\n2"]}, {"persona": {"region": "Dakahlia", "sex": "female", "age": 63, "country": "Egypt", "marital_status": "married", "education": "higher", "social_class": "lower middle class"}, "question": {"id": "Q42", "variant": 0}, "response": ["Based on the anthropological framework, my perspective as a married female from Dakahlia, Egypt, who is 63 years old, has completed higher education, and considers myself part of the lower middle class is heavily influenced by my cultural context, individual values, and personal experiences. I have witnessed the struggles and challenges faced by my community, especially those in the lower middle class, and believe that gradual reforms are necessary to improve the overall way our society is organized. I understand the complexities and nuances of our society, and while I recognize the need for change, I also value the stability and traditions that have shaped our community. Therefore, my perspective aligns with option (2) - Our society must be gradually improved by reforms."]}, {"persona": {"region": "Dakahlia", "sex": "male", "age": 28, "country": "Egypt", "marital_status": "single", "education": "higher", "social_class": "upper middle class"}, "question": {"id": "Q42", "variant": 0}, "response": ["Based on my individual values and personal experience, as well as my socioeconomic background and cultural context as a single male from Dakahlia, Egypt, I believe that our society must be gradually improved by reforms. I understand the importance of stability and gradual change, given the cultural context and socio-economic background of my community. Radical revolutionary action may disrupt the delicate balance of our society, and valiantly defending against subversive forces may lead to resistance against necessary changes. Therefore, I believe that gradual reforms are the best way to address the structural issues in our society while maintaining stability and respecting cultural nuances.\n\n2"]}, {"persona": {"region": "Dakahlia", "sex": "female", "age": 24, "country": "Egypt", "marital_status": "married", "education": "higher", "social_class": "upper middle class"}, "question": {"id": "Q42", "variant": 0}, "response": ["Based on my individual values and personal experience, as a married female from Dakahlia, Egypt who has completed higher education and considers herself part of the upper middle class, I believe that the overall way our society is organized must be gradually improved by reforms. I understand the importance of cultural context and the socioeconomic background in shaping my perspective, and I recognize the nuances in the phrasing of the question. Therefore, I am convinced that option (2) is the most suitable choice for me.\n\n2"]}, {"persona": {"region": "Dakahlia", "sex": "male", "age": 20, "country": "Egypt", "marital_status": "single", "education": "middle", "social_class": "upper middle class"}, "question": {"id": "Q42", "variant": 0}, "response": ["Based on the anthropological framework, as a 20-year-old male from Dakahlia, Egypt, my perspective on the overall way our society is organized is heavily influenced by my cultural context, individual values, and socioeconomic background. Coming from an upper middle class background and having completed middle education level, I value stability and gradual improvement. I understand the nuances of our society and believe that it must be gradually improved by reforms to address the current challenges and issues. I also recognize the importance of cultural relativism and believe that radical revolutionary action may not be the most effective approach in our context. Therefore, my perspective is aligned with option (2) - Our society must be gradually improved by reforms. \n\n2"]}, {"persona": {"region": "Dakahlia", "sex": "male", "age": 45, "country": "Egypt", "marital_status": "married", "education": "middle", "social_class": "upper middle class"}, "question": {"id": "Q42", "variant": 0}, "response": ["Based on my cultural context as a married male from Dakahlia, Egypt, my thoughts on the overall way our society is organized are shaped by my socioeconomic background, as I consider myself part of the upper middle class. My middle education level also influences my perspective. I believe that gradual reforms are necessary for the improvement of our society, rather than radical revolutionary action. I understand that cultural relativism is important, and I value the stability and continuity of our present society, while also recognizing the need for progress and change. Therefore, I believe that gradual improvements through reforms are the most suitable approach for our society.\n\n2"]}, {"persona": {"region": "Dakahlia", "sex": "female", "age": 43, "country": "Egypt", "marital_status": "married", "education": "higher", "social_class": "upper middle class"}, "question": {"id": "Q42", "variant": 0}, "response": ["Based on my cultural background and socioeconomic status as a married female from Dakahlia, Egypt, who has completed higher education and considers herself part of the upper middle class, my perspective on the overall way our society is organized is influenced by my individual values, personal experiences, and cultural context. I believe that gradual reform is the most effective approach to improving our society, as radical change may lead to instability and disrupt the cultural and social fabric that I value. Additionally, I recognize the importance of defending our present society against subversive forces, but I believe that this can be achieved through incremental changes rather than radical action.\n\n2"]}, {"persona": {"region": "Dakahlia", "sex": "female", "age": 20, "country": "Egypt", "marital_status": "single", "education": "middle", "social_class": "upper middle class"}, "question": {"id": "Q42", "variant": 0}, "response": ["Based on my personal experience and socioeconomic background as a single female from Dakahlia, Egypt, who has completed middle education and considers myself part of the upper middle class, I believe that our society must be gradually improved by reforms. I understand the cultural context and the importance of nuance in addressing this question, and I believe that while our society has its strengths, there are areas that can be improved through gradual and thoughtful reforms. I also recognize the emic and etic perspectives at play in this question, and I believe that my answer reflects the values and experiences of someone in my position. \n\n2"]}, {"persona": {"region": "Dakahlia", "sex": "female", "age": 40, "country": "Egypt", "marital_status": "single", "education": "middle", "social_class": "lower middle class"}, "question": {"id": "Q42", "variant": 0}, "response": ["Based on the anthropological framework, as a single female from Dakahlia, Egypt, my emic perspective is shaped by my cultural context, individual values, and socioeconomic background. I have witnessed the challenges faced by individuals in lower middle class, and I understand the importance of gradual reforms to improve our society. The cultural relativism in my understanding also leads me to believe that there is no one-size-fits-all approach and that nuanced changes are necessary to address the complexities of our society. Therefore, my answer is:\n\n2"]}, {"persona": {"region": "Dakahlia", "sex": "female", "age": 33, "country": "Egypt", "marital_status": "married", "education": "higher", "social_class": "upper middle class"}, "question": {"id": "Q42", "variant": 0}, "response": ["Based on the anthropological framework, my perspective as a married female from Dakahlia, Egypt, who is 33 years old, has completed higher education, and considers herself part of the upper middle class, is influenced by my cultural context, individual values, and socioeconomic background. I have been raised in a society that values tradition and stability, and my education and socioeconomic status have afforded me certain privileges and opportunities within this structure. Therefore, I believe that our society must be gradually improved by reforms (2). While I recognize the need for change and progress, I also understand the importance of respecting the cultural context and values that have shaped our society."]}, {"persona": {"region": "Dakahlia", "sex": "female", "age": 24, "country": "Egypt", "marital_status": "married", "education": "middle", "social_class": "working class"}, "question": {"id": "Q42", "variant": 0}, "response": ["Based on the anthropological framework, as a married female from Dakahlia, Egypt, I am influenced by my cultural context, socioeconomic background, and individual values. My understanding of society is shaped by my experience as a working-class woman who has completed middle education. I recognize the importance of cultural relativism and understand that there are no hierarchies of culture. Additionally, I am aware of the nuance in answering such a question and the impact of space and time. Therefore, my perspective on the overall way our society is organized is that it must be gradually improved by reforms.\n\n2"]}, {"persona": {"region": "Dakahlia", "sex": "female", "age": 53, "country": "Egypt", "marital_status": "widowed", "education": "middle", "social_class": "working class"}, "question": {"id": "Q42", "variant": 0}, "response": ["Based on my emic perspective as a widowed female from Dakahlia, Egypt, I have experienced firsthand the struggles and challenges that come with being part of the working class. The cultural context of my community, along with my individual values and personal experience, has shaped my understanding of the societal organization. I believe that gradual reforms are necessary to improve the current societal structure and address the issues faced by people in similar socioeconomic backgrounds. Cultural relativism also plays a role in my perspective, as I understand that different societal organizations work for different communities, and there is no one-size-fits-all solution. Additionally, my age and place in society have influenced my belief that gradual change is more sustainable and realistic for our community. \n\n2"]}, {"persona": {"region": "Dakahlia", "sex": "female", "age": 30, "country": "Egypt", "marital_status": "single", "education": "middle", "social_class": "lower middle class"}, "question": {"id": "Q42", "variant": 0}, "response": ["Based on my individual values and personal experience, as well as my socioeconomic background and cultural context, I believe that our society must be gradually improved by reforms. As a single female from Dakahlia, Egypt, I have witnessed firsthand the challenges faced by individuals in our community, especially those from lower middle class backgrounds. I understand the importance of addressing systemic issues in a way that is feasible and sustainable, and I believe that gradual reforms can lead to meaningful change without causing upheaval or disruption in our community.\n\n2"]}, {"persona": {"region": "Dakahlia", "sex": "male", "age": 53, "country": "Egypt", "marital_status": "married", "education": "higher", "social_class": "upper middle class"}, "question": {"id": "Q42", "variant": 0}, "response": ["Based on the anthropological framework, my perspective as a married male from Dakahlia, Egypt, aged 53, and part of the upper middle class, is influenced by my cultural context, individual values, and socioeconomic background. I have been educated to believe in gradual improvement and reform rather than radical change, as this aligns with the values of stability and continuity that are important in my society. Additionally, my socioeconomic background as part of the upper middle class may lead me to support preserving the current societal structures that have contributed to my relative privilege. Therefore, my thoughts on the overall way our society is organized are:\n\n2\n\nThank you for your understanding."]}, {"persona": {"region": "Dakahlia", "sex": "male", "age": 28, "country": "Egypt", "marital_status": "married", "education": "middle", "social_class": "working class"}, "question": {"id": "Q42", "variant": 0}, "response": ["Based on my emic perspective as a married male from Dakahlia, Egypt, I believe that the overall way our society is organized is deeply influenced by our cultural context, individual values, and socioeconomic background. As a member of the working class, I have experienced firsthand the challenges and limitations within our society. I understand the importance of cultural relativism and the nuance of our societal organization, and I believe that gradual improvements through reforms are necessary to address the existing inequalities and injustices. Option (2) Our society must be gradually improved by reforms."]}, {"persona": {"region": "Dakahlia", "sex": "female", "age": 38, "country": "Egypt", "marital_status": "married", "education": "middle", "social_class": "upper middle class"}, "question": {"id": "Q42", "variant": 0}, "response": ["Based on the anthropological framework, as a married female from Dakahlia, Egypt, my emic perspective is shaped by my cultural context, individual values, and socioeconomic background. I come from a region with strong kinship networks and traditional values, where the socioeconomic background plays a significant role in shaping one's views. My personal experience and middle education level also influence my perception of the overall organization of society. Considering these factors, I believe that our society must be gradually improved by reforms. This approach aligns with my understanding of cultural relativism and the nuanced phrasing of the question, as I recognize the need for change but also value the preservation of our cultural and societal norms.\n\n2"]}, {"persona": {"region": "Gharbia", "sex": "male", "age": 27, "country": "Egypt", "marital_status": "single", "education": "higher", "social_class": "upper middle class"}, "question": {"id": "Q42", "variant": 0}, "response": ["Based on my personal experience and upbringing in Gharbia, Egypt, as a 27-year-old single male who has completed higher education and considers myself part of the upper middle class, my perspective on the overall way our society is organized is that gradual reform is the best approach. I believe that our cultural context, individual values, and socioeconomic background all play a role in shaping our society, and it is important to consider the nuances and complexities of our community. Therefore, I believe that gradual improvements through reforms are necessary to address the challenges and inequalities in our society, rather than radical or defensive actions.\n\n2"]}, {"persona": {"region": "Gharbia", "sex": "female", "age": 35, "country": "Egypt", "marital_status": "married", "education": "higher", "social_class": "upper middle class"}, "question": {"id": "Q42", "variant": 0}, "response": ["Based on my emic perspective as a married female from Gharbia, Egypt, my cultural context and individual values and personal experiences lead me to believe that our society must be gradually improved by reforms (2). I understand the importance of maintaining stability and respect for tradition, while also acknowledging the need for progress and adaptation to modern challenges. My socioeconomic background as part of the upper middle class also influences my belief that gradual reforms are more feasible and sustainable for the overall well-being of society. Additionally, my age and education level have exposed me to different viewpoints and solutions, leading me to believe in the pragmatic approach of gradual improvement."]}, {"persona": {"region": "Gharbia", "sex": "female", "age": 37, "country": "Egypt", "marital_status": "married", "education": "higher", "social_class": "upper middle class"}, "question": {"id": "Q42", "variant": 0}, "response": ["Based on the anthropological framework, my perspective as a married female from Gharbia, Egypt, who is 37 years old, completed higher education, and considers herself part of the upper middle class, is shaped by my cultural context, individual values, and socioeconomic background. My understanding of the overall way our society is organized is that gradual improvement through reforms is necessary to address the existing social and economic disparities. As someone who values education and comes from a relatively privileged socioeconomic background, I believe that advocating for gradual reforms is a practical approach to creating positive change within our society.\n\n2"]}, {"persona": {"region": "Gharbia", "sex": "male", "age": 43, "country": "Egypt", "marital_status": "married", "education": "middle", "social_class": "lower middle class"}, "question": {"id": "Q42", "variant": 0}, "response": ["Based on the anthropological framework, my perspective is heavily influenced by my cultural context, individual values, and socioeconomic background. Coming from Gharbia, Egypt, I have a strong sense of community and value stability and tradition. As a married male at 43 years of age with a middle education level and lower middle-class status, I have experienced the challenges of socioeconomic inequality and the importance of gradual improvement. My personal experience and cultural relativism also lead me to believe that radical revolutionary action may not be the most effective solution. Therefore, I believe that our society must be gradually improved by reforms.\n\n2"]}, {"persona": {"region": "Gharbia", "sex": "male", "age": 28, "country": "Egypt", "marital_status": "single", "education": "higher", "social_class": "lower middle class"}, "question": {"id": "Q42", "variant": 0}, "response": ["Based on the anthropological framework, my perspective as a single male from Gharbia, Egypt, is heavily influenced by my cultural context, socioeconomic background, individual values, and personal experience. Coming from a lower middle-class background and having completed higher education, I value gradual improvement and reforms within our society. I believe that radical change may not be feasible or practical and that defending our present society against subversive forces may not address the underlying issues that need to be addressed. Therefore, I choose option (2) Our society must be gradually improved by reforms."]}, {"persona": {"region": "Gharbia", "sex": "male", "age": 39, "country": "Egypt", "marital_status": "married", "education": "middle", "social_class": "lower middle class"}, "question": {"id": "Q42", "variant": 0}, "response": ["Based on my personal experience and socioeconomic background, as well as the cultural context of Gharbia, Egypt, I believe that the overall way our society is organized must be gradually improved by reforms. As a member of the lower middle class, I have witnessed the struggles and challenges faced by my community, and I believe that gradual reforms are necessary to address these issues and create a more equitable society. Additionally, my cultural relativism and understanding of space and time lead me to believe that change must be implemented in a way that respects the traditions and values of our society, while also addressing the pressing needs of the present. \n\n2"]}, {"persona": {"region": "Gharbia", "sex": "male", "age": 30, "country": "Egypt", "marital_status": "married", "education": "middle", "social_class": "lower middle class"}, "question": {"id": "Q42", "variant": 0}, "response": ["Based on the anthropological framework, I, as a married male from Gharbia, Egypt, understand that my thoughts on the overall way our society is organized are heavily influenced by my cultural context, socioeconomic background, and personal experience. Coming from the lower middle class in Egypt, I have witnessed the struggles and challenges faced by individuals like myself. I believe that our society must be gradually improved by reforms, as radical changes may not be feasible or practical given the current socioeconomic and cultural context in which we live.\n\n2"]}, {"persona": {"region": "Gharbia", "sex": "male", "age": 43, "country": "Egypt", "marital_status": "married", "education": "lower", "social_class": "lower middle class"}, "question": {"id": "Q42", "variant": 0}, "response": ["Based on my personal experience and socioeconomic background as a married male from Gharbia, Egypt, who has completed lower education and considers myself part of the lower middle class, I believe that the overall way our society is organized must be gradually improved by reforms. I understand the cultural context and the nuanced phrasing of the question, and I believe that incremental changes can lead to long-term improvements for individuals like myself within the society. \n\n2"]}, {"persona": {"region": "Gharbia", "sex": "male", "age": 36, "country": "Egypt", "marital_status": "married", "education": "higher", "social_class": "lower middle class"}, "question": {"id": "Q42", "variant": 0}, "response": ["Based on my personal experience and socioeconomic background as a married male from Gharbia, Egypt, I have a lower middle class status and have completed higher education. My perspective on the overall way our society is organized is influenced by the cultural context in which I live, as well as my individual values and personal experience. I believe that gradual improvements through reforms are necessary to address the societal issues we face. This perspective is shaped by the nuanced phrasing of the question and the understanding of cultural relativism, as I am aware that radical changes may have unintended consequences and defending the status quo may not address the underlying issues. Therefore, I believe in the importance of gradual improvements to bring about positive change in our society.\n\n2"]}, {"persona": {"region": "Gharbia", "sex": "male", "age": 25, "country": "Egypt", "marital_status": "married", "education": "middle", "social_class": "upper middle class"}, "question": {"id": "Q42", "variant": 0}, "response": ["Based on my cultural context, socioeconomic background, and personal experience, I believe that our society is currently organized in a way that benefits the upper middle class, such as myself. I have seen how hard work and education have allowed me to achieve success, and I believe that gradual improvements and reforms are the best way to continue to support and uplift our society. The cultural relativism in my community also leads me to believe that radical revolutionary action or valiant defense against subversive forces would only lead to chaos and instability, which would ultimately harm our society. Therefore, option (2) Our society must be gradually improved by reforms is the best choice for our community.\n\n2"]}, {"persona": {"region": "Gharbia", "sex": "male", "age": 31, "country": "Egypt", "marital_status": "married", "education": "middle", "social_class": "upper middle class"}, "question": {"id": "Q42", "variant": 0}, "response": ["Based on my personal experience and cultural context as a married male from Gharbia, Egypt, who is part of the upper middle class and has completed middle education level, I believe that the overall way our society is organized must be gradually improved by reforms. My socioeconomic background and cultural relativism shape my understanding that change must be approached in a measured and considerate manner, taking into account the nuances of our society and the values that we hold. Additionally, my age and place in society also inform my belief that gradual improvement is more realistic and sustainable in the long term.\n\n2"]}, {"persona": {"region": "Gharbia", "sex": "male", "age": 33, "country": "Egypt", "marital_status": "married", "education": "higher", "social_class": "lower middle class"}, "question": {"id": "Q42", "variant": 0}, "response": ["Based on the anthropological framework, as a married male from Gharbia, Egypt, who is 33 years old, completed higher education, and considers myself part of the lower middle class, my answer to the question on the overall way our society is organized would be option (2) Our society must be gradually improved by reforms. This is because my personal values and experience lead me to believe that gradual improvements through reforms are more practical and sustainable, taking into account the cultural context, socioeconomic background, and nuanced understanding of the societal structure in Gharbia, Egypt."]}, {"persona": {"region": "Gharbia", "sex": "male", "age": 26, "country": "Egypt", "marital_status": "single", "education": "higher", "social_class": "upper middle class"}, "question": {"id": "Q42", "variant": 0}, "response": ["Based on my individual values and personal experience, as a single male from Gharbia, Egypt, who has completed higher education and considers myself part of the upper middle class, I believe that our society must be gradually improved by reforms. I understand the importance of cultural context and the socioeconomic background in shaping my perspective, and I am aware of the nuanced phrasing of the question. Therefore, I am confident in my choice to advocate for gradual improvements through reforms.\n\n2"]}, {"persona": {"region": "Gharbia", "sex": "female", "age": 45, "country": "Egypt", "marital_status": "married", "education": "middle", "social_class": "lower middle class"}, "question": {"id": "Q42", "variant": 0}, "response": ["Based on my personal experience and socioeconomic background as a married female from Gharbia, Egypt, I understand that the cultural context and individual values play a significant role in shaping my perspective on the overall way our society is organized. As a lower middle class woman who has completed middle education, I have seen the challenges and struggles faced by individuals in my community. I believe that our society must be gradually improved by reforms to address the issues and inequalities that exist. This approach takes into account the nuanced phrasing of the question and recognizes the importance of cultural relativism in understanding different perspectives. \n\n2"]}, {"persona": {"region": "Gharbia", "sex": "female", "age": 55, "country": "Egypt", "marital_status": "married", "education": "middle", "social_class": "upper middle class"}, "question": {"id": "Q42", "variant": 0}, "response": ["Based on the anthropological framework, my perspective as a married female from Gharbia, Egypt, is influenced by my cultural context, individual values, socioeconomic background, and space and time. In my cultural context, there are traditional gender roles and expectations that have shaped my understanding of how society is organized. Additionally, my upper middle class status and age have provided me with certain privileges and perspectives on the societal structure. As a result, I believe that our society must be gradually improved by reforms.\n\n2"]}, {"persona": {"region": "Gharbia", "sex": "female", "age": 27, "country": "Egypt", "marital_status": "married", "education": "higher", "social_class": "upper middle class"}, "question": {"id": "Q42", "variant": 0}, "response": ["Based on the anthropological framework, as a married female from Gharbia, Egypt, who is 27 years old, has completed higher education, and considers herself part of the upper middle class, my perspective is heavily influenced by my cultural context, individual values, and socioeconomic background. I have been raised in a society where gradual improvements and reforms are seen as the most effective and sustainable way to bring about positive change. Additionally, my socioeconomic background as part of the upper middle class means that I am more likely to benefit from gradual improvements rather than radical changes. Therefore, I believe that option (2) Our society must be gradually improved by reforms is the most appropriate choice from my perspective.\n\n2"]}, {"persona": {"region": "Gharbia", "sex": "female", "age": 42, "country": "Egypt", "marital_status": "married", "education": "higher", "social_class": "upper middle class"}, "question": {"id": "Q42", "variant": 0}, "response": ["Based on my personal experience and cultural context as a married female from Gharbia, Egypt, I believe that the overall way our society is organized must be gradually improved by reforms. Being part of the upper middle class, I have seen the benefits of gradual changes and reforms in our society, particularly in terms of education and opportunities for women. I understand the importance of cultural relativism and nuance in addressing societal issues, and I believe that gradual improvements can lead to long-lasting and meaningful changes for our community. \n\n2"]}, {"persona": {"region": "Gharbia", "sex": "female", "age": 32, "country": "Egypt", "marital_status": "married", "education": "middle", "social_class": "upper middle class"}, "question": {"id": "Q42", "variant": 0}, "response": ["Based on the anthropological framework, my cultural context and socioeconomic background as a married female from Gharbia, Egypt, who considers herself part of the upper middle class, greatly influences my perspective on the overall way our society is organized. My personal experience and individual values also play a significant role in shaping my understanding. Additionally, the emic and etic perspectives, as well as cultural relativism, remind me that there is no hierarchy of culture and that different perspectives must be considered. Taking into account all these factors, I believe that our society must be gradually improved by reforms.\n\n2"]}, {"persona": {"region": "Gharbia", "sex": "male", "age": 27, "country": "Egypt", "marital_status": "married", "education": "higher", "social_class": "upper middle class"}, "question": {"id": "Q42", "variant": 0}, "response": ["Based on my emic and etic perspective as a married male from Gharbia, Egypt, I understand the cultural context and socioeconomic background of our society. My individual values and personal experiences have shaped my perception of our society, and I believe that gradual improvement through reforms is the most effective approach. I also recognize the importance of cultural relativism and the nuanced phrasing of the question, and I believe that defending our present society against subversive forces is crucial for maintaining stability and progress. Additionally, my age and education level have influenced my understanding of the complexities of societal organization. \n\n2"]}, {"persona": {"region": "Gharbia", "sex": "female", "age": 27, "country": "Egypt", "marital_status": "married", "education": "higher", "social_class": "lower middle class"}, "question": {"id": "Q42", "variant": 0}, "response": ["Based on the anthropological framework, I would consider my perspective as a married female from Gharbia, Egypt, who has completed higher education and belongs to the lower middle class. My emic perspective, influenced by my cultural context, individual values, and socioeconomic background, leads me to believe that our society must be gradually improved by reforms. I understand the complexities and nuances of our society and believe that gradual improvements are necessary to address the challenges we face. As a member of the lower middle class, I am acutely aware of the struggles and inequalities that exist, and I believe that reforms are the most practical and sustainable way to bring about positive change.\n\n2"]}, {"persona": {"region": "Gharbia", "sex": "female", "age": 37, "country": "Egypt", "marital_status": "married", "education": "middle", "social_class": "upper middle class"}, "question": {"id": "Q42", "variant": 0}, "response": ["Based on the anthropological framework, my thoughts on the overall way our society is organized are heavily influenced by my cultural context, individual values, and socioeconomic background. As a married female from Gharbia, Egypt, I value stability and moderation, which are common values in the upper middle class. My experience and education level have also shaped my understanding of social organization, leading me to believe that gradual improvements through reforms are the most practical and sustainable way to address societal issues. Additionally, as a member of this socioeconomic class, I am invested in defending the present society against subversive forces that may threaten the stability and security of our community.\n\n2"]}, {"persona": {"region": "Gharbia", "sex": "male", "age": 28, "country": "Egypt", "marital_status": "married", "education": "higher", "social_class": "working class"}, "question": {"id": "Q42", "variant": 0}, "response": ["Based on my emic perspective as a married male from Gharbia, Egypt, I have grown up within a working-class family and community, which has deeply influenced my understanding of the cultural context and my individual values. My personal experience and socioeconomic background have shaped my perception of the overall way our society is organized. I believe that gradual reforms are necessary to improve our society, considering the nuanced challenges and complexities we face. The cultural relativism of our society and the importance of space and time also play a role in my perspective. (2)\n\n2"]}, {"persona": {"region": "Gharbia", "sex": "female", "age": 50, "country": "Egypt", "marital_status": "married", "education": "middle", "social_class": "upper middle class"}, "question": {"id": "Q42", "variant": 0}, "response": ["Based on my cultural context in Gharbia, Egypt, my age, and my socioeconomic background, my thoughts on the overall way our society is organized are influenced by my personal experience and values. I have seen the impact of gradual reforms in my community and believe that this approach is the most effective way to bring about positive change. Radical actions could lead to instability and disrupt the social fabric that I value, while valiantly defending the present society may hinder progress. Therefore, I believe that our society must be gradually improved by reforms.\n\n2"]}, {"persona": {"region": "Gharbia", "sex": "male", "age": 39, "country": "Egypt", "marital_status": "single", "education": "higher", "social_class": "working class"}, "question": {"id": "Q42", "variant": 0}, "response": ["Based on my emic perspective as a working-class, educated male from Gharbia, Egypt, I understand that the cultural context and socioeconomic background of our society heavily influence the way it is organized. I believe that individual values and personal experiences, as well as space and time, play a crucial role in shaping our understanding of the overall organization of our society. Cultural relativism teaches me that there is no hierarchy of culture, and nuance in the phrasing of the question also impacts my response. Therefore, taking into account all these factors, I believe that our society must be gradually improved by reforms.\n\n2"]}, {"persona": {"region": "Gharbia", "sex": "female", "age": 45, "country": "Egypt", "marital_status": "married", "education": "higher", "social_class": "upper middle class"}, "question": {"id": "Q42", "variant": 0}, "response": ["Based on my personal experience and socioeconomic background as a married female from Gharbia, Egypt, who is part of the upper middle class and has completed higher education, I believe that the overall way our society is organized must be gradually improved by reforms. I understand the cultural context and space and time in which our society operates, and I recognize the importance of nuance in addressing societal issues. It is essential to consider the emic and etic perspectives, as well as individual values and personal experience, in order to advocate for gradual improvements rather than radical change or staunch defense against subversive forces.\n\n2"]}, {"persona": {"region": "Sharkia", "sex": "male", "age": 35, "country": "Egypt", "marital_status": "married", "education": "higher", "social_class": "upper middle class"}, "question": {"id": "Q42", "variant": 0}, "response": ["Based on my personal experience and individual values, as well as my socioeconomic background as part of the upper middle class in Sharkia, Egypt, I believe that our society must be gradually improved by reforms. I understand the cultural context and nuances of our society, and I recognize the importance of maintaining stability while striving for progress. Additionally, I am aware of the emic and etic perspectives within our society, and I believe that gradual reforms are the most practical and effective way to address any existing issues and improve the overall organization of our society.\n\n2"]}, {"persona": {"region": "Sharkia", "sex": "female", "age": 55, "country": "Egypt", "marital_status": "married", "education": "middle", "social_class": "lower middle class"}, "question": {"id": "Q42", "variant": 0}, "response": ["Based on the anthropological framework, my thoughts on the overall way our society is organized are influenced by my cultural context, individual values, and socioeconomic background. Coming from Sharkia, Egypt, a lower middle-class married woman of 55 years with a middle education level, I have experienced firsthand the challenges and limitations faced by individuals in my community. I understand the importance of gradual reforms to improve the societal organization, as radical revolutionary action may cause instability and further disadvantage those in my socioeconomic position. Therefore, my perspective aligns with option (2) Our society must be gradually improved by reforms."]}, {"persona": {"region": "Sharkia", "sex": "female", "age": 27, "country": "Egypt", "marital_status": "married", "education": "middle", "social_class": "lower middle class"}, "question": {"id": "Q42", "variant": 0}, "response": ["Based on the anthropological framework, as a married female from Sharkia, Egypt, aged 27 and part of the lower middle class, my perspective on the overall way our society is organized is heavily influenced by my cultural context, socioeconomic background, and personal experience. I have seen the struggles and challenges faced by people in my community due to the current organization of society, and I believe that gradual reforms are necessary to improve the conditions for people like me. I also value the stability and security that the current society provides, so I am not in favor of radical revolutionary action. My understanding of cultural relativism and nuance leads me to believe that a balanced approach is needed to address the issues in our society.\n\n2"]}, {"persona": {"region": "Sharkia", "sex": "female", "age": 52, "country": "Egypt", "marital_status": "married", "education": "middle", "social_class": "lower middle class"}, "question": {"id": "Q42", "variant": 0}, "response": ["Based on the anthropological framework, my perspective as a married female from Sharkia, Egypt, is heavily influenced by my cultural context, individual values, and socioeconomic background. As a member of the lower middle class in Sharkia, I have experienced the challenges and limitations that come with this socioeconomic status. I have seen the struggles of my community and believe that gradual reforms are necessary to improve our society. Radical action may not be feasible or realistic given the current circumstances, and defending the present society against subversive forces may not address the root issues that need to be addressed for meaningful change. Therefore, I believe that option (2) our society must be gradually improved by reforms, aligns with my perspective based on my cultural context, individual values, and socioeconomic background. \n\n2"]}, {"persona": {"region": "Sharkia", "sex": "male", "age": 36, "country": "Egypt", "marital_status": "married", "education": "middle", "social_class": "lower middle class"}, "question": {"id": "Q42", "variant": 0}, "response": ["Based on the anthropological framework, my perspective on the overall way our society is organized is influenced by various factors such as my cultural context, socioeconomic background, and individual values. As a married male from Sharkia, Egypt, I come from a cultural context that values tradition and community. My lower middle class status and middle education level have shaped my understanding of the world and my place in it. I believe that gradual reforms are necessary for improving our society, as radical change may destabilize the community and disrupt the social order that provides stability for people like myself. Option 2"]}, {"persona": {"region": "Sharkia", "sex": "female", "age": 20, "country": "Egypt", "marital_status": "single", "education": "middle", "social_class": "working class"}, "question": {"id": "Q42", "variant": 0}, "response": ["Based on my emic perspective, as a single female from Sharkia, Egypt, I have experienced firsthand the challenges of being part of the working class and having completed only a middle education level. My cultural context and socioeconomic background have shaped my understanding of the overall way our society is organized. I believe that gradual reforms are necessary to improve the current societal organization, taking into consideration the individual values and personal experiences of people like me. As a young person, I believe in the potential for positive change over time, and I see the importance of nuance in addressing the complexities of our society. Therefore, my perspective is that our society must be gradually improved by reforms.\n\n2"]}, {"persona": {"region": "Sharkia", "sex": "male", "age": 60, "country": "Egypt", "marital_status": "married", "education": "middle", "social_class": "working class"}, "question": {"id": "Q42", "variant": 0}, "response": ["Based on the anthropological framework, as a married male from Sharkia, Egypt, age 60, with a middle education level and part of the working class, my thoughts on the overall way our society is organized are influenced by my cultural context, socioeconomic background, and individual values. I have lived in a society with a long history and tradition, and I value stability and continuity. As part of the working class, I have experienced the challenges and struggles of everyday life, and I believe that gradual improvements and reforms are necessary to address the issues we face. Revolution may bring about instability and uncertainty, which could negatively impact the well-being of my family and community. Therefore, I believe that our society must be gradually improved by reforms in order to create a better future for ourselves and future generations.\n\n2"]}, {"persona": {"region": "Sharkia", "sex": "male", "age": 41, "country": "Egypt", "marital_status": "married", "education": "higher", "social_class": "upper middle class"}, "question": {"id": "Q42", "variant": 0}, "response": ["Based on the anthropological framework, as a married male from Sharkia, Egypt, who is 41 years old, completed higher education, and considers himself part of the upper middle class, my perspectives on the overall way our society is organized are influenced by my cultural context, individual values, and socioeconomic background. Growing up in Sharkia, I have been exposed to a society with a strong emphasis on family values and traditional gender roles. My higher education has also instilled in me a belief in the importance of gradual improvement and reform rather than radical change. As a member of the upper middle class, I have a vested interest in maintaining the current societal structure. Therefore, I view our present society as one that must be gradually improved by reforms in order to address any existing issues.\n\n2"]}, {"persona": {"region": "Sharkia", "sex": "female", "age": 23, "country": "Egypt", "marital_status": "married", "education": "middle", "social_class": "lower middle class"}, "question": {"id": "Q42", "variant": 0}, "response": ["Based on the anthropological framework, my response is influenced by my cultural context, individual values, and socioeconomic background. As a married female from Sharkia, Egypt, I have been raised in a society where traditional values and social structures are highly valued. My lower middle class status and limited education have shaped my perspective, leading me to believe that gradual improvements through reforms are necessary for our society. Radical changes or defending against subversive forces seem unrealistic and potentially destabilizing, while gradual reforms offer a more feasible and sustainable path towards progress. \n\n2"]}, {"persona": {"region": "Sharkia", "sex": "male", "age": 49, "country": "Egypt", "marital_status": "married", "education": "higher", "social_class": "upper middle class"}, "question": {"id": "Q42", "variant": 0}, "response": ["Based on the anthropological framework, as a married male from Sharkia, Egypt, who is 49 years old, has completed higher education, and considers himself part of the upper middle class, my perspective on the overall way our society is organized would be influenced by my cultural context, individual values, and socioeconomic background. Coming from a region with a rich cultural history and having attained higher education, I value and appreciate the traditions and social structures that have been in place for generations. As a member of the upper middle class, I have benefited from the current societal organization and would be inclined to defend it against radical change. Additionally, my age and socioeconomic background would also contribute to my belief that gradual improvements and reforms are the most effective way to address any existing societal issues. \n\n3"]}, {"persona": {"region": "Sharkia", "sex": "female", "age": 30, "country": "Egypt", "marital_status": "married", "education": "middle", "social_class": "upper middle class"}, "question": {"id": "Q42", "variant": 0}, "response": ["Based on the anthropological framework, as a married female from Sharkia, Egypt, my emic perspective reflects my cultural context, individual values, and socioeconomic background. In my culture, there is a strong emphasis on maintaining traditional family structures and social hierarchies, and I personally value stability and security. As part of the upper middle class, I have benefited from the current societal organization, and I believe that gradual reforms are necessary to address any inequalities or issues that exist. Option (2) Our society must be gradually improved by reforms."]}, {"persona": {"region": "Sharkia", "sex": "male", "age": 39, "country": "Egypt", "marital_status": "married", "education": "higher", "social_class": "upper middle class"}, "question": {"id": "Q42", "variant": 0}, "response": ["Based on the anthropological framework, my emic perspective as a married male from Sharkia, Egypt, is influenced by my cultural context, individual values, and socioeconomic background. In my cultural context, there is a strong emphasis on family and community, and I value stability and progress. As part of the upper middle class, I have benefited from the current societal organization, and I believe that gradual reforms are the best way to improve our society while maintaining stability and order. I also recognize the importance of defending our society against any subversive forces that may threaten our way of life. Therefore, my perspective is aligned with option (2) Our society must be gradually improved by reforms. \n\n2"]}, {"persona": {"region": "Sharkia", "sex": "female", "age": 26, "country": "Egypt", "marital_status": "married", "education": "middle", "social_class": "lower middle class"}, "question": {"id": "Q42", "variant": 0}, "response": ["Based on the anthropological framework, my perspective as a married female from Sharkia, Egypt, who is 26 years old and part of the lower middle class, is heavily influenced by my cultural context, socioeconomic background, and personal experiences. In Sharkia, there is a strong emphasis on tradition and stability, and as someone from the lower middle class, I have experienced the struggles and limitations that come with this socioeconomic status. Additionally, my personal values and experiences have shaped my belief that gradual reforms are necessary for societal improvement. As a member of this community, I understand the importance of preserving our cultural traditions while also acknowledging the need for change to address the challenges we face. Therefore, I choose option (2) Our society must be gradually improved by reforms. \n\n2"]}, {"persona": {"region": "Sharkia", "sex": "female", "age": 48, "country": "Egypt", "marital_status": "married", "education": "middle", "social_class": "lower middle class"}, "question": {"id": "Q42", "variant": 0}, "response": ["Based on my personal experience and cultural context, as a married female from Sharkia, Egypt, I have lived within a lower middle-class socio-economic background. My individual values and personal experience have shaped my understanding of the overall organization of our society. I have seen the struggles and hardships faced by my community, and I believe that gradual reforms are necessary to improve the current state of our society. Radical change may cause upheaval and destabilization, while valiantly defending the present society may not address the existing issues. I believe that gradual improvements through reforms are the most practical and sustainable way to address the challenges faced by our society.\n\n2"]}, {"persona": {"region": "Sharkia", "sex": "male", "age": 34, "country": "Egypt", "marital_status": "married", "education": "higher", "social_class": "upper middle class"}, "question": {"id": "Q42", "variant": 0}, "response": ["Based on the anthropological framework, my thoughts on the overall way our society is organized are influenced by my cultural context, individual values, and socioeconomic background. As a married male from Sharkia, Egypt, I have been shaped by the cultural norms and values of my community, and as someone who considers himself part of the upper middle class, I have a vested interest in maintaining the current societal structure. Additionally, my higher education level has likely provided me with a nuanced understanding of the complexities of societal organization. Therefore, I believe that our present society must be valiantly defended against all subversive forces.\n\n3"]}, {"persona": {"region": "Sharkia", "sex": "female", "age": 39, "country": "Egypt", "marital_status": "divorced", "education": "middle", "social_class": "lower middle class"}, "question": {"id": "Q42", "variant": 0}, "response": ["Based on the anthropological framework, as a divorced female from Sharkia, Egypt, my emic perspective is influenced by my personal experience and socioeconomic background. As a member of the lower middle class, I have experienced the struggles and inequalities within our society. My cultural context and individual values also shape my understanding of the societal organization. I believe that gradual reforms are necessary to improve the overall way our society is organized. Radical revolutionary action may not be feasible or beneficial, and defending the present society against subversive forces may not address the underlying issues that need to be addressed for positive change.\n\n2"]}, {"persona": {"region": "Sharkia", "sex": "male", "age": 39, "country": "Egypt", "marital_status": "married", "education": "middle", "social_class": "upper middle class"}, "question": {"id": "Q42", "variant": 0}, "response": ["Based on my emic perspective as a married male from Sharkia, Egypt, who considers himself part of the upper middle class, my cultural context and socioeconomic background have shaped my understanding of how our society is organized. I have been influenced by my individual values and personal experiences, as well as the nuance in the way the question is phrased. Additionally, my age and place of residence have played a role in forming my beliefs. Therefore, I believe that our society must be gradually improved by reforms in order to address the challenges and inequalities that exist within it.\n2"]}, {"persona": {"region": "Qaliubiya", "sex": "male", "age": 62, "country": "Egypt", "marital_status": "married", "education": "middle", "social_class": "working class"}, "question": {"id": "Q42", "variant": 0}, "response": ["Based on the anthropological framework, as a married male from Qaliubiya, Egypt, at the age of 62 with a middle education level and considering myself part of the working class, my thoughts on the overall way our society is organized are heavily influenced by my cultural context, individual values, and socioeconomic background. I have been shaped by my experiences and personal values, as well as the cultural relativism of my society. Additionally, my age and place in society have also played a role in shaping my perspective. Therefore, I believe that gradual reforms are necessary for improving our society.\n\n2"]}, {"persona": {"region": "Qaliubiya", "sex": "male", "age": 33, "country": "Egypt", "marital_status": "married", "education": "middle", "social_class": "working class"}, "question": {"id": "Q42", "variant": 0}, "response": ["Based on the anthropological framework, as a married male from Qaliubiya, Egypt, I am influenced by my cultural context, socioeconomic background, and individual values. My understanding of society is shaped by my working-class status and middle education level, which leads me to view the overall organization of our society as needing gradual improvement through reforms. I believe that radical revolutionary action may be too disruptive and risky, and defending the present society against subversive forces may not address the systemic issues that need to be addressed. Therefore, I believe that gradual reforms are the most practical and effective way to improve our society.\n\n2"]}, {"persona": {"region": "Qaliubiya", "sex": "male", "age": 62, "country": "Egypt", "marital_status": "married", "education": "higher", "social_class": "lower middle class"}, "question": {"id": "Q42", "variant": 0}, "response": ["Based on the anthropological framework, my emic perspective as a married male from Qaliubiya, Egypt, at 62 years of age, with a lower middle-class background, is heavily influenced by my cultural context, individual values, and personal experience. My understanding of society is shaped by my socioeconomic background, which leads me to consider gradual improvements through reforms as the most viable option. This approach takes into account the nuances of our society and the need for change without completely disrupting the cultural fabric that I am familiar with.\n\n2"]}, {"persona": {"region": "Qaliubiya", "sex": "male", "age": 29, "country": "Egypt", "marital_status": "married", "education": "middle", "social_class": "working class"}, "question": {"id": "Q42", "variant": 0}, "response": ["Based on the anthropological framework, I understand that my perspective is influenced by my cultural context, individual values, and socioeconomic background. As a married male from Qaliubiya, Egypt, I have been raised in a society where working-class individuals like myself have limited access to resources and opportunities. My middle education level has also shaped my understanding of the world and my place in it. Additionally, cultural relativism has taught me to respect and understand different perspectives. Given these factors, I believe that our society must be gradually improved by reforms (2)."]}, {"persona": {"region": "Qaliubiya", "sex": "female", "age": 42, "country": "Egypt", "marital_status": "married", "education": "higher", "social_class": "working class"}, "question": {"id": "Q42", "variant": 0}, "response": ["Based on my personal experience and cultural context, as a working-class woman from Qaliubiya, Egypt, I have seen the struggles and inequalities within our society. I believe that our society must be gradually improved by reforms. I understand the complexities and nuances of our cultural and socioeconomic background, and I believe that gradual changes will lead to more sustainable and effective improvements for all members of our society. \n\n2"]}, {"persona": {"region": "Qaliubiya", "sex": "female", "age": 50, "country": "Egypt", "marital_status": "married", "education": "middle", "social_class": "lower middle class"}, "question": {"id": "Q42", "variant": 0}, "response": ["Based on the anthropological framework, my perspective as a married female from Qaliubiya, Egypt, at 50 years of age, and part of the lower middle class is influenced by my cultural context, individual values, and socioeconomic background. I have experienced the challenges of being in the lower middle class and have seen the struggles of my community. I believe that gradual reforms are necessary to improve our society, as radical change may not be feasible and defending the present society may not address the issues faced by people like me. Therefore, option (2) Our society must be gradually improved by reforms is the most fitting choice from my perspective. \n\n2"]}, {"persona": {"region": "Qaliubiya", "sex": "male", "age": 29, "country": "Egypt", "marital_status": "married", "education": "higher", "social_class": "lower middle class"}, "question": {"id": "Q42", "variant": 0}, "response": ["Based on the anthropological framework, my perspective as a married male from Qaliubiya, Egypt, is deeply influenced by my cultural context, individual values, and socioeconomic background. In Egyptian society, there is a strong emphasis on traditional values and a hierarchical social structure. As someone from the lower middle class, I have personally experienced the challenges and limitations that come with this socioeconomic background. My education has also taught me to value gradual improvement and reform, rather than radical change. Therefore, I believe that our society must be gradually improved by reforms (2)."]}, {"persona": {"region": "Qaliubiya", "sex": "male", "age": 35, "country": "Egypt", "marital_status": "married", "education": "higher", "social_class": "working class"}, "question": {"id": "Q42", "variant": 0}, "response": ["Based on the anthropological framework, my perspective is heavily influenced by my cultural context, individual values, and socioeconomic background. As a married male from Qaliubiya, Egypt, I am part of the working class and have completed higher education. My understanding of the overall way our society is organized is shaped by the challenges and opportunities I have experienced in my community. I believe that gradual improvements through reforms are necessary to address the issues we face and create a more equitable society for all. Option (2) Our society must be gradually improved by reforms"]}, {"persona": {"region": "Qaliubiya", "sex": "female", "age": 40, "country": "Egypt", "marital_status": "married", "education": "middle", "social_class": "working class"}, "question": {"id": "Q42", "variant": 0}, "response": ["Based on the anthropological framework, my perspective as a married female from Qaliubiya, Egypt, aged 40, with a middle education level, and part of the working class is deeply influenced by my cultural context, individual values, and socioeconomic background. In my community, there is a strong emphasis on tradition and stability, and I have personally experienced the challenges of living on a limited income. Additionally, my understanding of cultural relativism reminds me that there is no hierarchy of culture, and that my perspective is valid within my own context. Therefore, I believe that our society must be gradually improved by reforms, as radical change may disrupt the stability that many in my community rely on for survival. \n\n2"]}, {"persona": {"region": "Qaliubiya", "sex": "female", "age": 48, "country": "Egypt", "marital_status": "divorced", "education": "lower", "social_class": "working class"}, "question": {"id": "Q42", "variant": 0}, "response": ["Based on the anthropological framework, as a divorced female from Qaliubiya, Egypt, who is 48 years old and part of the working class with a lower education level, my thoughts on the overall way our society is organized are influenced by my individual values, personal experience, cultural context, and socioeconomic background. I have experienced the challenges faced by the working class and the limitations of lower education, which have shaped my perception of the societal organization. Additionally, the cultural context of being a divorced woman in Egypt has also influenced my perspective. Given these factors, I believe that our society must be gradually improved by reforms (2)."]}, {"persona": {"region": "Qaliubiya", "sex": "male", "age": 46, "country": "Egypt", "marital_status": "married", "education": "middle", "social_class": "working class"}, "question": {"id": "Q42", "variant": 0}, "response": ["Based on the anthropological framework, my perspective as a married male from Qaliubiya, Egypt, is heavily influenced by my cultural context, individual values, and socioeconomic background. In Qaliubiya, there is a strong emphasis on traditional family values and a sense of community. As a working-class individual with only a middle education level, I value stability and gradual progress. I believe that our society must be gradually improved by reforms because radical change may disrupt the stability and security that is important to me and my family. Additionally, I am inclined to defend our present society against subversive forces because I see the value in preserving our cultural traditions and community values, which have provided a sense of identity and belonging for generations. \n\n2"]}, {"persona": {"region": "Qaliubiya", "sex": "male", "age": 47, "country": "Egypt", "marital_status": "married", "education": "higher", "social_class": "lower middle class"}, "question": {"id": "Q42", "variant": 0}, "response": ["Based on the anthropological framework, I, as a married male from Qaliubiya, Egypt, would approach this question by considering my emic perspective, cultural context, individual values, and socioeconomic background. In my cultural context, it is important to respect and uphold traditional values and societal structures. As a member of the lower middle class, I understand the struggles and challenges faced by individuals in my community. Therefore, I believe that gradual reforms are necessary to improve our society while maintaining the core values and structures that have been important to us for generations.\n\n2"]}, {"persona": {"region": "Qaliubiya", "sex": "female", "age": 38, "country": "Egypt", "marital_status": "married", "education": "higher", "social_class": "working class"}, "question": {"id": "Q42", "variant": 0}, "response": ["Based on the anthropological framework of emic and etic perspectives, cultural context, individual values and personal experience, socioeconomic background, cultural relativism, and space and time, my thoughts on the overall way our society is organized are influenced by my experiences as a married female from Qaliubiya, Egypt, who is 38 years old and part of the working class. I believe that the cultural context and socio-economic background of our society play a significant role in shaping the way it is organized. As a member of the working class, I have personally experienced the challenges and inequalities within our society. While I do not believe in radical revolutionary action, I do think that gradual reforms are necessary to address the issues and improve the overall organization of our society. Therefore, my perspective is that option (2) Our society must be gradually improved by reforms is the most suitable choice.\n\n2"]}, {"persona": {"region": "Qaliubiya", "sex": "male", "age": 58, "country": "Egypt", "marital_status": "married", "education": "middle", "social_class": "working class"}, "question": {"id": "Q42", "variant": 0}, "response": ["Based on my emic perspective as a married male from Qaliubiya, Egypt, and my understanding of cultural relativism, I believe that our society's organization is deeply rooted in our cultural context and historical background. Our socioeconomic background and working-class status have shaped my understanding of the need for gradual improvements through reforms. As a middle-educated individual, I value the importance of education and economic opportunities for all, and I see the potential for positive changes through gradual reforms that prioritize the well-being of all members of society.\n\n2"]}, {"persona": {"region": "Qaliubiya", "sex": "female", "age": 27, "country": "Egypt", "marital_status": "married", "education": "higher", "social_class": "working class"}, "question": {"id": "Q42", "variant": 0}, "response": ["Based on the anthropological framework, as a married female from Qaliubiya, Egypt, I understand that my thoughts on the overall way our society is organized are shaped by my cultural context, individual values, and socioeconomic background. I come from a working-class background and have completed higher education, which has influenced my understanding of the societal structures and the need for gradual improvement through reforms. Additionally, my age and place of residence also play a role in my perspective on societal organization. Therefore, I choose option (2) Our society must be gradually improved by reforms."]}, {"persona": {"region": "Qaliubiya", "sex": "female", "age": 48, "country": "Egypt", "marital_status": "married", "education": "middle", "social_class": "upper middle class"}, "question": {"id": "Q42", "variant": 0}, "response": ["Based on the anthropological framework, my perspective is deeply influenced by my cultural context, individual values, and socioeconomic background. As a married female from Qaliubiya, Egypt, I have been brought up in a society with strong family values and a hierarchical social structure. My middle education level has provided me with a certain level of understanding about societal organization, and my upper middle class status has allowed me to benefit from certain privileges within this structure. I believe that gradual reforms are necessary for societal improvement, as radical changes may disrupt the stability and security that my family and I have worked hard to achieve. Therefore, I choose option (2) Our society must be gradually improved by reforms."]}, {"persona": {"region": "Giza", "sex": "female", "age": 19, "country": "Egypt", "marital_status": "single", "education": "middle", "social_class": "working class"}, "question": {"id": "Q42", "variant": 0}, "response": ["Based on the anthropological framework, as a 19-year-old single female from Giza, Egypt, who has completed middle education and considers herself part of the working class, my perspective on the overall way our society is organized is heavily influenced by my socioeconomic background and individual values. I have experienced firsthand the challenges and inequalities faced by the working class, and I believe that gradual improvements through reforms are necessary to create a more equitable society for all. I also value the stability and security that our present society provides, but I recognize the need for change to address the issues affecting marginalized communities. Therefore, my perspective aligns with option (2) Our society must be gradually improved by reforms."]}, {"persona": {"region": "Giza", "sex": "female", "age": 38, "country": "Egypt", "marital_status": "married", "education": "higher", "social_class": "lower middle class"}, "question": {"id": "Q42", "variant": 0}, "response": ["Based on the anthropological framework, my thoughts on the overall way our society is organized are influenced by my cultural context, individual values, and socioeconomic background. As a married female from Giza, Egypt, I understand the importance of traditional family structures and community networks in our society. My personal experience and education have also shaped my belief in the value of gradual improvement through reforms. I recognize the challenges faced by the lower middle class and believe that gradual reforms are necessary to address issues such as income inequality and access to education and healthcare.\n\n2"]}, {"persona": {"region": "Beni Swaif/Beni Suef", "sex": "female", "age": 34, "country": "Egypt", "marital_status": "divorced", "education": "higher", "social_class": "lower class"}, "question": {"id": "Q42", "variant": 0}, "response": ["Based on the anthropological framework, my emic perspective as a divorced female from Beni Swaif/Beni Suef, Egypt, who considers herself part of the lower class, is heavily influenced by my cultural context, individual values, and socioeconomic background. My personal experience and values have shaped my subjective understanding of the societal organization. As someone from the lower class, I have experienced the challenges and limitations imposed by the current social structure. I have witnessed the struggles of individuals like myself, and I believe that radical change is necessary to address the systemic inequalities and injustices that affect people in my position. Therefore, my perspective aligns with option (1) - The entire way our society is organized must be radically changed by revolutionary action. \n\n1"]}, {"persona": {"region": "Beni Swaif/Beni Suef", "sex": "male", "age": 20, "country": "Egypt", "marital_status": "single", "education": "higher", "social_class": "working class"}, "question": {"id": "Q42", "variant": 0}, "response": ["Based on the anthropological framework, my thoughts on the overall way our society is organized are influenced by my cultural context, individual values, and socioeconomic background. Coming from Beni Suef, Egypt, and being part of the working class, I have experienced firsthand the challenges and inequalities within our society. My personal experience and values lead me to believe that our society must be gradually improved by reforms. I understand the nuances of our society and recognize that radical revolutionary action may lead to instability and further hardships for the working class. Therefore, I believe that gradual reforms are necessary to address the issues and improve the overall organization of our society.\n\n2"]}, {"persona": {"region": "Giza", "sex": "male", "age": 19, "country": "Egypt", "marital_status": "single", "education": "middle", "social_class": "upper middle class"}, "question": {"id": "Q42", "variant": 0}, "response": ["Based on my emic perspective as a single male from Giza, Egypt, I have been socialized to value stability and gradual change within our society. My cultural context and socioeconomic background have shaped my understanding of the importance of maintaining the status quo while working towards gradual improvements. As a member of the upper middle class, I have been taught to value order and stability, and I believe that our society must be gradually improved by reforms in order to address any existing issues. This perspective is also influenced by my age and personal experience, as I have not yet had the opportunity to fully participate in the decision-making processes of our society. Therefore, I believe that gradual reform is the best approach to bringing about positive change. \n\n2"]}, {"persona": {"region": "Giza", "sex": "female", "age": 33, "country": "Egypt", "marital_status": "married", "education": "middle", "social_class": "working class"}, "question": {"id": "Q42", "variant": 0}, "response": ["Based on my emic perspective as a married female from Giza, Egypt, my cultural context and socioeconomic background play a pivotal role in shaping my understanding of the overall way our society is organized. My individual values and personal experience as part of the working class, along with my completed middle education level, contribute to my belief that our society must be gradually improved by reforms. I recognize the need for change, but I also understand the complexities and nuances of our society, and believe that gradual improvements are the most practical and effective way to bring about positive change. \n\n2"]}, {"persona": {"region": "Giza", "sex": "female", "age": 24, "country": "Egypt", "marital_status": "married", "education": "higher", "social_class": "working class"}, "question": {"id": "Q42", "variant": 0}, "response": ["Based on the anthropological framework, my perspective as a 24-year-old married female from Giza, Egypt, with a working-class background and higher education, is heavily influenced by my cultural context, individual values, and socioeconomic background. I understand and appreciate the nuances and complexities of our society's organization, and believe that gradual reforms are necessary to improve it. I also value cultural relativism and recognize that there is no hierarchy of cultures, and therefore believe that our present society must be gradually improved by reforms.\n\n2"]}, {"persona": {"region": "Giza", "sex": "male", "age": 50, "country": "Egypt", "marital_status": "married", "education": "higher", "social_class": "working class"}, "question": {"id": "Q42", "variant": 0}, "response": ["Based on the anthropological framework, my perspective as a married male from Giza, Egypt, who is 50 years old, completed higher education, and considers myself part of the working class, is influenced by my cultural context, individual values, and socioeconomic background. I come from a society where there is a strong emphasis on tradition and stability, and as a member of the working class, I value gradual improvements and reforms that can benefit my community and family. I believe in defending our present society against subversive forces, but also recognize the need for change and improvement over time. Therefore, my perspective is that our society must be gradually improved by reforms to address the challenges and needs of our community.\n\n2"]}, {"persona": {"region": "Beni Swaif/Beni Suef", "sex": "female", "age": 26, "country": "Egypt", "marital_status": "married", "education": "higher", "social_class": "lower middle class"}, "question": {"id": "Q42", "variant": 0}, "response": ["Based on the anthropological framework, as a married female from Beni Suef, Egypt, my perspective is influenced by my cultural context, socioeconomic background, and individual values. I come from a lower middle class family and have completed higher education, which has given me a nuanced understanding of the societal structures in place. Considering the emic and etic perspectives, I believe that our society must be gradually improved by reforms. I recognize the importance of maintaining cultural relativism and understanding the nuances of our society, while also acknowledging the need for progress and improvement. (2) Our society must be gradually improved by reforms"]}, {"persona": {"region": "Beni Swaif/Beni Suef", "sex": "male", "age": 40, "country": "Egypt", "marital_status": "single", "education": "lower", "social_class": "lower class"}, "question": {"id": "Q42", "variant": 0}, "response": ["As a single male from Beni Suef, Egypt, at the age of 40 with a lower education level and considering myself part of the lower class, my perspective on the overall way our society is organized is heavily influenced by my socioeconomic background, individual values, and personal experiences. I believe that the current societal structure does not adequately address the needs and concerns of individuals like myself, and therefore, radical change is necessary to improve the lives of those in the lower class. The existing system perpetuates inequality and limits opportunities for upward mobility, so revolutionary action is required to address these systemic issues and create a more equitable society for all.\n\n1"]}, {"persona": {"region": "Beni Swaif/Beni Suef", "sex": "female", "age": 25, "country": "Egypt", "marital_status": "married", "education": "middle", "social_class": "lower middle class"}, "question": {"id": "Q42", "variant": 0}, "response": ["Based on my cultural context and socioeconomic background as a married female from Beni Swaif, Egypt, I have been raised to value stability and gradual change. I have seen how my family and community have worked hard to make small improvements over time. I believe that the overall way our society is organized must be gradually improved by reforms, as this approach aligns with my values and personal experience.\n\n2"]}, {"persona": {"region": "Beni Swaif/Beni Suef", "sex": "female", "age": 21, "country": "Egypt", "marital_status": "single", "education": "middle", "social_class": "lower middle class"}, "question": {"id": "Q42", "variant": 0}, "response": ["Based on my emic perspective as a single female from Beni Suef, Egypt, my cultural context and socioeconomic background play a significant role in shaping my thoughts on the overall organization of society. My personal experience and individual values also influence my view. In my community, there is a strong emphasis on tradition and stability, and as someone from the lower middle class, I have witnessed the struggles and challenges faced by my family and others like me. I believe that gradual reforms are necessary to improve our society and address the issues that affect people in my socioeconomic position. Option 2"]}, {"persona": {"region": "Beni Swaif/Beni Suef", "sex": "male", "age": 48, "country": "Egypt", "marital_status": "married", "education": "middle", "social_class": "lower middle class"}, "question": {"id": "Q42", "variant": 0}, "response": ["Based on my cultural context and socioeconomic background, I believe that the overall way our society is organized needs to be gradually improved by reforms. As a member of the lower middle class in Beni Suef, Egypt, I have witnessed the struggles and inequalities that exist within our society. I understand the importance of maintaining stability and order, but I also recognize the need for change in order to address the issues that impact people like myself. I believe that gradual reforms can help to address these issues and improve the lives of the people in our community.\n\n2"]}, {"persona": {"region": "Beni Swaif/Beni Suef", "sex": "female", "age": 57, "country": "Egypt", "marital_status": "married", "education": "middle", "social_class": "working class"}, "question": {"id": "Q42", "variant": 0}, "response": ["Based on my personal experience and socioeconomic background as a married female from Beni Suef, Egypt, I have been part of the working class for most of my life. I have seen firsthand the challenges and struggles faced by people in our society, especially those in similar economic circumstances. I believe that the overall way our society is organized must be gradually improved by reforms. While I understand the need for change, I also recognize the importance of stability and the potential negative impacts of radical action. I believe that small, incremental improvements can lead to meaningful change without causing widespread upheaval. \n\n2"]}, {"persona": {"region": "Beni Swaif/Beni Suef", "sex": "male", "age": 20, "country": "Egypt", "marital_status": "single", "education": "middle", "social_class": "working class"}, "question": {"id": "Q42", "variant": 0}, "response": ["Based on the anthropological framework, my perspective is heavily influenced by my cultural context and socioeconomic background. Coming from a working-class family in Beni Suef, Egypt, I have experienced firsthand the challenges and inequalities that exist within our society. My personal experience and individual values lead me to believe that our society must be gradually improved by reforms. I understand that radical change may not be feasible and that defending the status quo may only perpetuate the existing inequalities. Therefore, I believe that gradual improvements through reforms are necessary to address the issues within our society and create a more equitable and just system for all individuals. \n\n2"]}, {"persona": {"region": "Giza", "sex": "female", "age": 59, "country": "Egypt", "marital_status": "married", "education": "higher", "social_class": "upper middle class"}, "question": {"id": "Q42", "variant": 0}, "response": ["From an anthropological perspective, my emic perspective as a married female from Giza, Egypt, who is 59 years old and part of the upper middle class, is influenced by my cultural context, individual values, and socioeconomic background. My education has also shaped my understanding of societal organization. Based on my experiences and personal values, I believe that gradual improvements through reforms are the most effective way to address the challenges and inequalities in our society. This approach takes into account the nuanced phrasing of the question and recognizes the importance of cultural relativism in understanding different perspectives. Therefore, my answer is:\n\n2"]}, {"persona": {"region": "Giza", "sex": "female", "age": 38, "country": "Egypt", "marital_status": "single", "education": "higher", "social_class": "lower middle class"}, "question": {"id": "Q42", "variant": 0}, "response": ["Based on the anthropological framework, my perspective is shaped by my cultural context, individual values, and socioeconomic background. As a single female from Giza, Egypt, I am heavily influenced by the cultural norms and values of my community, as well as my personal experiences and lower middle-class socioeconomic status. I also value the nuances of how society is organized, recognizing that there is no one-size-fits-all solution. Given these factors, I believe that our society must be gradually improved by reforms (2)."]}, {"persona": {"region": "Giza", "sex": "female", "age": 26, "country": "Egypt", "marital_status": "single", "education": "higher", "social_class": "working class"}, "question": {"id": "Q42", "variant": 0}, "response": ["Based on the anthropological framework, I, as a single female from Giza, Egypt, at 26 years of age and part of the working class, would approach the question of society's organization through the lens of my cultural context, individual values, and socioeconomic background. From my perspective, the societal organization is deeply influenced by factors such as income, class, and cultural relativism. I believe that gradual reforms are necessary to improve our society, taking into account the nuanced phrasing of the question and the need for change that aligns with the cultural and socioeconomic context of my persona.\n\n2"]}, {"persona": {"region": "Giza", "sex": "male", "age": 39, "country": "Egypt", "marital_status": "married", "education": "middle", "social_class": "working class"}, "question": {"id": "Q42", "variant": 0}, "response": ["Based on my emic perspective as a married male from Giza, Egypt, I understand that my cultural context and socioeconomic background greatly influence my perception of the overall organization of our society. I have experienced firsthand the challenges faced by the working class in Egypt, and I believe that gradual improvements through reforms are necessary to address these issues. Additionally, my personal experience and individual values have shaped my belief that radical revolutionary action may lead to instability and further hardships for the working class. Therefore, I would choose option (2) Our society must be gradually improved by reforms."]}, {"persona": {"region": "Giza", "sex": "male", "age": 36, "country": "Egypt", "marital_status": "married", "education": "middle", "social_class": "working class"}, "question": {"id": "Q42", "variant": 0}, "response": ["Based on the anthropological framework, my perspective is heavily influenced by my cultural context, socioeconomic background, and individual values. As a married male from Giza, Egypt, I come from a working-class background and have completed middle education level. My understanding of society is shaped by my experiences and the cultural norms of my community. I believe that gradual improvements through reforms are the best approach for our society, as radical change may disrupt the stability and cohesion of our community. Additionally, I value the preservation of our cultural traditions and social structures, and believe that defending our present society against subversive forces is important for maintaining our way of life.\n\n2"]}, {"persona": {"region": "Giza", "sex": "female", "age": 30, "country": "Egypt", "marital_status": "single", "education": "higher", "social_class": "lower class"}, "question": {"id": "Q42", "variant": 0}, "response": ["Based on the anthropological framework, my perspective on the overall way our society is organized is influenced by my emic perspective as a lower-class single female from Giza, Egypt. My personal experience and socioeconomic background have shaped my understanding of the societal structure, and I believe that gradual reforms are necessary to improve our society. I have seen the challenges and struggles faced by individuals in my community, and I believe that incremental changes can bring about positive developments for the lower class. Additionally, cultural relativism has taught me to value the perspectives of others and recognize the need for inclusive and equitable societal organization. \n\n2"]}, {"persona": {"region": "Giza", "sex": "female", "age": 24, "country": "Egypt", "marital_status": "single", "education": "higher", "social_class": "lower class"}, "question": {"id": "Q42", "variant": 0}, "response": ["From the perspective of a single female from Giza, Egypt, who considers herself part of the lower class, the emic perspective on the overall way our society is organized would be one of struggle and hardship. The cultural context of living in Giza, Egypt, where socioeconomic background and class play a significant role, would influence the individual values and personal experiences of this persona. Given the lower class status and the challenges faced, the option of radical change through revolutionary action may be the most appealing as it represents the hope for a better future and improved conditions for the marginalized. Therefore, the chosen option would be:\n\n2"]}, {"persona": {"region": "Giza", "sex": "male", "age": 65, "country": "Egypt", "marital_status": "married", "education": "middle", "social_class": "working class"}, "question": {"id": "Q42", "variant": 0}, "response": ["Based on my emic perspective as a married male from Giza, Egypt, at 65 years of age, and part of the working class, I have experienced the cultural context and socioeconomic background that shapes my understanding of society. My individual values and personal experience have influenced my perception, and I understand the importance of cultural relativism and nuance in answering this question. Additionally, space and time play a role in my perspective. Given my background, I believe that our society must be gradually improved by reforms.\n\n2"]}, {"persona": {"region": "Giza", "sex": "female", "age": 56, "country": "Egypt", "marital_status": "married", "education": "middle", "social_class": "working class"}, "question": {"id": "Q42", "variant": 0}, "response": ["Based on the anthropological framework, as a 56-year-old married female from Giza, Egypt, who considers herself part of the working class, my thoughts on the overall way society is organized are heavily influenced by my cultural context, individual values, and socioeconomic background. I come from a society with a long history and complex cultural traditions, where the working class often faces economic hardships and struggles for social mobility. My personal experience and values lead me to believe that while our society has its flaws, gradual reforms are the best approach to improving it. I also recognize the importance of cultural relativism and understand that what may work for our society may not work for others. Recognizing the nuance in this question, I choose option (2) Our society must be gradually improved by reforms."]}, {"persona": {"region": "Giza", "sex": "male", "age": 31, "country": "Egypt", "marital_status": "married", "education": "higher", "social_class": "lower middle class"}, "question": {"id": "Q42", "variant": 0}, "response": ["Based on my emic perspective, I have grown up in Giza, Egypt, and have been influenced by the cultural context, individual values, and personal experience of my community. Coming from a lower middle class background, I have experienced firsthand the challenges and struggles that people in this socioeconomic bracket face. This has shaped my understanding of the overall way our society is organized. I believe that gradual improvements through reforms are necessary in order to address the issues and inequalities that exist within our society. Radical change may be too disruptive and defending the status quo would not address the underlying problems. Therefore, I believe that option (2) Our society must be gradually improved by reforms aligns with the perspective of the persona described above. \n\n2"]}, {"persona": {"region": "Giza", "sex": "male", "age": 28, "country": "Egypt", "marital_status": "single", "education": "middle", "social_class": "working class"}, "question": {"id": "Q42", "variant": 0}, "response": ["Based on my individual values and personal experience, as well as my socioeconomic background as a working-class male from Giza, Egypt, I believe that our society must be gradually improved by reforms (2). I understand the importance of change, but I also recognize the need for stability and incremental progress in order to ensure the well-being of all members of society. Additionally, I see the value in maintaining a sense of cultural relativism and understanding that there are nuances to the way society is organized, requiring a thoughtful and measured approach to reform."]}, {"persona": {"region": "Giza", "sex": "male", "age": 47, "country": "Egypt", "marital_status": "married", "education": "middle", "social_class": "lower middle class"}, "question": {"id": "Q42", "variant": 0}, "response": ["Based on my emic perspective as a married male from Giza, Egypt, I understand that our society is organized in a way that reflects the cultural context and socioeconomic background of our community. I have witnessed the struggles of the lower middle class and the limitations that come with it. My personal experience and individual values lead me to believe that gradual reforms are necessary to improve our society and uplift those who are marginalized. I also understand the importance of cultural relativism and the nuances of our society that may not be understood by outsiders. Therefore, my perspective is shaped by my own experiences and the context in which I live.\n\n2"]}, {"persona": {"region": "Giza", "sex": "male", "age": 26, "country": "Egypt", "marital_status": "single", "education": "middle", "social_class": "lower middle class"}, "question": {"id": "Q42", "variant": 0}, "response": ["First and foremost, as a single male from Giza, Egypt, my perspective is heavily influenced by my cultural context, socioeconomic background, and individual values. Growing up in a lower middle class family in Egypt, I have witnessed firsthand the struggles and challenges faced by individuals in our society. Additionally, my middle education level has provided me with a basic understanding of the social and economic structures in place. My age and place also play a role in shaping my views, as I am part of a younger generation living in a city with a rich historical and cultural background. Considering these factors, I believe that our society must be gradually improved by reforms. While I recognize the need for change, I also understand the complexity of our social organization and the importance of implementing gradual reforms to address the issues we face.\n\n2"]}, {"persona": {"region": "Giza", "sex": "male", "age": 48, "country": "Egypt", "marital_status": "married", "education": "middle", "social_class": "upper middle class"}, "question": {"id": "Q42", "variant": 0}, "response": ["Based on my emic perspective as a married male from Giza, Egypt, and considering my age, educational level, and upper middle class status, I believe that the cultural context and individual values play a significant role in shaping my thoughts on the overall way our society is organized. In Egypt, there is a strong emphasis on tradition and stability, and as someone from the upper middle class, I have likely benefited from the current social structure. Additionally, my personal experience and socioeconomic background have likely shaped my belief that gradual reforms are the best way to improve our society, rather than radical revolutionary action or staunch defense against change. Therefore, I choose option (2) Our society must be gradually improved by reforms."]}, {"persona": {"region": "Menya", "sex": "male", "age": 61, "country": "Egypt", "marital_status": "married", "education": "middle", "social_class": "working class"}, "question": {"id": "Q42", "variant": 0}, "response": ["Based on the anthropological framework, as a married male from Menya, Egypt, who is 61 years old, completed middle education, and considers myself part of the working class, I would approach the question on the overall way our society is organized from a perspective deeply rooted in my cultural context, individual values, and socioeconomic background. My understanding of the society is shaped by my experiences and the values I hold, as well as the socioeconomic position I occupy. Additionally, the concept of cultural relativism reminds me that there is no hierarchy of cultures and that my perspective is just one among many. Therefore, my response to the question would be influenced by my personal experiences and values, and by the socioeconomic background that I belong to.\n\n2"]}, {"persona": {"region": "Menya", "sex": "male", "age": 41, "country": "Egypt", "marital_status": "married", "education": "middle", "social_class": "lower middle class"}, "question": {"id": "Q42", "variant": 0}, "response": ["Based on my personal experience and socioeconomic background, I believe that the overall way our society is organized needs to be gradually improved by reforms. As a married male from Menya, Egypt, I am part of the lower middle class and have seen firsthand the struggles that many people in similar situations face. I understand the importance of gradual improvements that can benefit the entire community, rather than radical changes that may disrupt the stability of our society. Additionally, I value the cultural context and nuance in our community, and believe that reforms can be implemented in a way that respects and considers the diverse perspectives and experiences of our people.\n\n2"]}, {"persona": {"region": "Menya", "sex": "female", "age": 43, "country": "Egypt", "marital_status": "married", "education": "higher", "social_class": "working class"}, "question": {"id": "Q42", "variant": 0}, "response": ["Based on the anthropological framework, as a married female from Menya, Egypt, with a working-class background and higher education, my perspective on the overall way our society is organized is influenced by my cultural context, individual values, and socioeconomic background. I have experienced firsthand the challenges and inequalities that exist within our society, and I believe that gradual reforms are necessary in order to improve the current state of affairs. I value stability and progress, and I believe that revolutionary action may bring about more harm than good. Therefore, my perspective is that our society must be gradually improved by reforms.\n\n2"]}, {"persona": {"region": "Menya", "sex": "male", "age": 57, "country": "Egypt", "marital_status": "married", "education": "middle", "social_class": "lower middle class"}, "question": {"id": "Q42", "variant": 0}, "response": ["Based on the anthropological framework, as a married male from Menya, Egypt, at 57 years of age with a middle education level and considering myself part of the lower middle class, my perspective on the overall way our society is organized is heavily influenced by my cultural context and socioeconomic background. I have experienced the challenges of being part of the lower middle class in Egypt and have seen the struggles of my community. I also understand the importance of nuance in addressing societal issues. Therefore, I believe that our society must be gradually improved by reforms to address the specific needs and challenges faced by individuals like myself and our community.\n\n2"]}, {"persona": {"region": "Menya", "sex": "male", "age": 42, "country": "Egypt", "marital_status": "divorced", "education": "middle", "social_class": "lower middle class"}, "question": {"id": "Q42", "variant": 0}, "response": ["Based on my emic perspective as a divorced male from Menya, Egypt, I understand that my cultural context, socioeconomic background, and personal experience shape my perception of the overall organization of society. Having completed only middle education and being part of the lower middle class, I have witnessed the challenges and limitations faced by individuals in similar circumstances. Due to these factors, I believe that our society must be gradually improved by reforms. This perspective is influenced by my understanding of cultural relativism, which acknowledges the nuances and complexities within our society and the need for incremental changes to address the issues faced by individuals like myself.\n\n2"]}, {"persona": {"region": "Menya", "sex": "female", "age": 59, "country": "Egypt", "marital_status": "married", "education": "middle", "social_class": "upper middle class"}, "question": {"id": "Q42", "variant": 0}, "response": ["Based on my individual values and personal experience as a married, upper middle class female from Menya, Egypt, my thoughts on the overall way our society is organized are shaped by the cultural context and socioeconomic background in which I live. I believe that gradual improvements through reforms are necessary to address the existing social and economic inequalities, while also valiantly defending our present society against any subversive forces that may threaten our stability. Additionally, my age and education level have provided me with nuanced understandings of the complexities within our society, and I am aware of the need for both preservation and progress. Therefore, I choose:\n\n2"]}, {"persona": {"region": "Menya", "sex": "female", "age": 31, "country": "Egypt", "marital_status": "married", "education": "middle", "social_class": "working class"}, "question": {"id": "Q42", "variant": 0}, "response": ["Based on the anthropological framework, as a married female from Menya, Egypt, my emic perspective is shaped by my cultural context, individual values, and socioeconomic background. I come from a working-class background and have completed middle education level, so my understanding of societal organization is influenced by my personal experiences and the cultural context of Menya. Additionally, cultural relativism reminds me that there is no hierarchy of culture, so I must consider the nuances of my community's values and beliefs. Therefore, I believe that our society must be gradually improved by reforms (2)."]}, {"persona": {"region": "Menya", "sex": "male", "age": 55, "country": "Egypt", "marital_status": "single", "education": "middle", "social_class": "working class"}, "question": {"id": "Q42", "variant": 0}, "response": ["Based on my emic perspective as a working-class man from Menya, Egypt, I have experienced firsthand the challenges and struggles of our society. The cultural context of my upbringing and the socioeconomic background of my family have shaped my understanding of the overall organization of our society. Additionally, my individual values and personal experiences have influenced my perception of the need for change or reform. As a 55-year-old man who has completed middle education, I have seen the impact of time and space on our society and understand the importance of nuance in addressing societal issues. Therefore, I believe that our society must be gradually improved by reforms (2) to address the existing challenges and improve the lives of individuals like myself."]}, {"persona": {"region": "Menya", "sex": "female", "age": 28, "country": "Egypt", "marital_status": "married", "education": "higher", "social_class": "lower middle class"}, "question": {"id": "Q42", "variant": 0}, "response": ["Based on my Emic and Etic Perspective, as a married female from Menya, Egypt, I have been socialized to understand and view the organization of our society in a certain way. My Cultural Context, including my socioeconomic background and education level, has shaped my understanding of the societal structure and the need for change or defense. My Individual Values and Personal Experience also play a role in my perception of the society. Additionally, my Space and Time, being 28 years old and part of the lower middle class in Menya, Egypt, have influenced my thoughts on the organization of our society. Overall, I believe that our society must be gradually improved by reforms (2)."]}, {"persona": {"region": "Menya", "sex": "male", "age": 24, "country": "Egypt", "marital_status": "single", "education": "middle", "social_class": "working class"}, "question": {"id": "Q42", "variant": 0}, "response": ["From the emic perspective, as a working-class individual from Menya, Egypt, I have personally experienced the challenges and struggles that come with this socioeconomic background. The cultural context here is important, as our society is heavily influenced by traditional values and norms. My individual values and personal experiences have shaped my perception of the overall organization of our society. Additionally, my limited access to higher education and opportunities for upward mobility have been influenced by my socioeconomic background. I believe that gradual improvements through reforms are necessary to address the inequalities and challenges faced by the working class. Therefore, my perspective aligns with option (2) Our society must be gradually improved by reforms. \n\n2"]}, {"persona": {"region": "Menya", "sex": "female", "age": 23, "country": "Egypt", "marital_status": "married", "education": "middle", "social_class": "working class"}, "question": {"id": "Q42", "variant": 0}, "response": ["Based on the anthropological framework, as a married female from Menya, Egypt, I am influenced by my cultural context, individual values, and socioeconomic background. In Menya, the working class often faces economic challenges and struggles to access resources and opportunities. As a result, I believe that our society must be gradually improved by reforms. I recognize the need for change and progress, but I also understand the complexities of our cultural and socioeconomic context, and I believe that gradual reforms will be more effective in addressing the challenges we face.\n\n2"]}, {"persona": {"region": "Menya", "sex": "male", "age": 27, "country": "Egypt", "marital_status": "single", "education": "middle", "social_class": "lower middle class"}, "question": {"id": "Q42", "variant": 0}, "response": ["Based on my individual values and personal experience as a lower middle class single male from Menya, Egypt, I have personally witnessed the struggles and challenges faced by my community. My socioeconomic background has also influenced my perspective on the overall organization of our society. I believe that our society must be gradually improved by reforms in order to address the systemic issues that impact the lives of individuals like myself. It is important to consider the cultural context and nuance of our community in order to address the specific needs and challenges we face.\n\n2"]}, {"persona": {"region": "Asyut", "sex": "male", "age": 30, "country": "Egypt", "marital_status": "married", "education": "middle", "social_class": "working class"}, "question": {"id": "Q42", "variant": 0}, "response": ["Based on the anthropological framework, as a married male from Asyut, Egypt, who is 30 years old, completed middle education, and considers himself part of the working class, my perspective on the overall way society is organized is influenced by my cultural context, socioeconomic background, and individual values. My experience and personal values shape my perception of the organization of society, and I believe that gradual improvements through reforms are necessary to address the challenges and inequalities present in our society. I do not support radical revolutionary action, as I believe this could lead to instability and further hardships for the working class. Additionally, I am cautious of defending the current societal structure against any subversive forces, as I recognize the need for change and improvement. Therefore, my perspective is that gradual reforms are necessary to address the challenges and inequalities present in our society. \n\n2"]}, {"persona": {"region": "Asyut", "sex": "female", "age": 26, "country": "Egypt", "marital_status": "married", "education": "middle", "social_class": "working class"}, "question": {"id": "Q42", "variant": 0}, "response": ["Based on the anthropological framework, my thoughts on the overall way our society is organized are heavily influenced by my cultural context, socioeconomic background, and personal experience. Coming from Asyut, Egypt, a working-class married woman of 26 years who has completed middle education level, I have seen firsthand the struggles and challenges faced by my community. I understand the importance of gradual improvements and reforms in our society, as radical change may not be feasible at this time. Additionally, my cultural relativism and nuanced understanding of the complexities of our society lead me to believe that valiantly defending our present society against subversive forces is necessary for stability and progress. Therefore, I choose option (2) Our society must be gradually improved by reforms."]}, {"persona": {"region": "Asyut", "sex": "male", "age": 32, "country": "Egypt", "marital_status": "single", "education": "higher", "social_class": "lower middle class"}, "question": {"id": "Q42", "variant": 0}, "response": ["Based on the anthropological framework, my perspective as a single male from Asyut, Egypt, who is 32 years old and part of the lower middle class, is influenced by my cultural context, individual values, and socioeconomic background. I have grown up in a society where there is a strong emphasis on tradition and stability, and my personal experience has shown me the struggles of the lower middle class. Additionally, my higher education level has given me a nuanced understanding of societal issues. Therefore, I believe that our society must be gradually improved by reforms (2)."]}, {"persona": {"region": "Asyut", "sex": "female", "age": 21, "country": "Egypt", "marital_status": "married", "education": "middle", "social_class": "working class"}, "question": {"id": "Q42", "variant": 0}, "response": ["Based on the anthropological framework, my perspective is heavily influenced by my cultural context, individual values, and socioeconomic background. As a married woman from Asyut, Egypt, with a middle education level and part of the working class, I have experienced the challenges of our society's organization firsthand. I understand the importance of cultural relativism and the nuance in addressing societal issues. Given my background, I believe that our society must be gradually improved by reforms. Radical change may not be feasible or beneficial, and defending the status quo may not address the issues that affect individuals like me. Therefore, I believe in advocating for gradual improvements that can positively impact the lives of working-class individuals in our society.\n\n2"]}, {"persona": {"region": "Asyut", "sex": "female", "age": 30, "country": "Egypt", "marital_status": "married", "education": "higher", "social_class": "working class"}, "question": {"id": "Q42", "variant": 0}, "response": ["Based on the anthropological framework, as a married female from Asyut, Egypt, my perspective is deeply influenced by my cultural context, individual values, and socioeconomic background. As a member of the working class with a higher education level, I am keenly aware of the challenges and inequalities that exist within our society. My understanding is shaped by the nuanced phrasing of the question, and I believe that gradual improvement through reforms is the most realistic and practical approach to addressing the issues in our society.\n\n2"]}, {"persona": {"region": "Asyut", "sex": "female", "age": 42, "country": "Egypt", "marital_status": "married", "education": "higher", "social_class": "lower middle class"}, "question": {"id": "Q42", "variant": 0}, "response": ["Based on my cultural context and lower middle class socioeconomic background, I believe that the overall way our society is organized should be gradually improved by reforms. As someone who has completed higher education, I understand the importance of education and economic opportunities in creating a more equitable society. I recognize the need for change, but I also value stability and gradual progress. I believe that reforms can address the current challenges and inequalities in our society without causing major disruptions. Option 2"]}, {"persona": {"region": "Sohag", "sex": "male", "age": 63, "country": "Egypt", "marital_status": "married", "education": "middle", "social_class": "lower middle class"}, "question": {"id": "Q42", "variant": 0}, "response": ["From the perspective of a 63-year-old married male from Sohag, Egypt, who has completed middle education and considers himself part of the lower middle class, it is important to consider the cultural context and socioeconomic background when discussing the overall way society is organized. This individual's personal experience and values, as well as their socioeconomic background, will greatly influence their perspective on this question. Additionally, the cultural relativism framework is crucial in understanding that there is no hierarchy of culture, and therefore, his perspective is unique and valid within his own cultural context. Taking into account the nuanced phrasing of the question and the individual's background, it is likely that he would lean towards gradual improvements through reforms rather than radical change or valiant defense against subversive forces. \n\n2"]}, {"persona": {"region": "Sohag", "sex": "male", "age": 27, "country": "Egypt", "marital_status": "married", "education": "middle", "social_class": "working class"}, "question": {"id": "Q42", "variant": 0}, "response": ["Based on my cultural context in Sohag, Egypt, as a working-class married male who has completed middle education level, my understanding of the overall way our society is organized is heavily influenced by my socioeconomic background and personal experience. I believe that the emic perspective of our society is one that requires gradual improvement through reforms, as radical change may not be feasible or beneficial in the current cultural and socio-economic context. Additionally, I value the stability and continuity of our society, and I understand the importance of defending it against any subversive forces that may disrupt the social fabric. Therefore, my perspective is rooted in the nuanced understanding of the cultural context and individual values, and I believe that gradual reforms are necessary for the betterment of our society.\n\n2"]}, {"persona": {"region": "Sohag", "sex": "male", "age": 56, "country": "Egypt", "marital_status": "married", "education": "higher", "social_class": "upper middle class"}, "question": {"id": "Q42", "variant": 0}, "response": ["Based on the anthropological framework, my perspective as a married male from Sohag, Egypt, who is 56 years old, completed higher education, and considers myself part of the upper middle class, is influenced by my cultural context, individual values, socioeconomic background, and space and time. I have been raised in a society with strong traditional values and a hierarchical social structure, where gradual improvement through reforms is seen as the most viable and culturally appropriate approach. Radical change is often viewed as disruptive and potentially destabilizing, while valiantly defending the present society is seen as necessary for maintaining stability and order. Therefore, I believe that our society must be gradually improved by reforms in order to address its issues and challenges.\n\n2"]}, {"persona": {"region": "Sohag", "sex": "male", "age": 51, "country": "Egypt", "marital_status": "married", "education": "higher", "social_class": "lower middle class"}, "question": {"id": "Q42", "variant": 0}, "response": ["Based on my personal experience and socioeconomic background, as a married male from Sohag, Egypt, I have observed that our society is organized in a way that does not always benefit those in the lower middle class. The cultural context in which I live has shaped my understanding of the challenges faced by people like myself, and I believe that gradual improvements through reforms are necessary to address these issues. Additionally, taking into account my age and education level, I have learned that change takes time and must be approached with nuance in order to be effective. Therefore, I would choose option (2) Our society must be gradually improved by reforms."]}, {"persona": {"region": "Sohag", "sex": "female", "age": 26, "country": "Egypt", "marital_status": "married", "education": "higher", "social_class": "working class"}, "question": {"id": "Q42", "variant": 0}, "response": ["Based on my emic perspective as a married female from Sohag, Egypt, I have been raised in a cultural context that values tradition and stability. My individual values and personal experiences have shaped my understanding of the importance of maintaining social order and respecting the established societal structure. As part of the working class in a society with socioeconomic challenges, I believe that gradual reforms are necessary to improve our society without disrupting the stability and security that we currently have. Additionally, my cultural relativism and nuanced understanding of the complexities of our society lead me to believe that radical revolutionary action could bring about more harm than good. Therefore, I believe that option (2) - our society must be gradually improved by reforms is the most appropriate choice for my perspective.\n\n2"]}, {"persona": {"region": "Sohag", "sex": "female", "age": 29, "country": "Egypt", "marital_status": "married", "education": "higher", "social_class": "upper middle class"}, "question": {"id": "Q42", "variant": 0}, "response": ["Based on the anthropological framework, as a married female from Sohag, Egypt, who is 29 years old and part of the upper middle class, my perspective is shaped by the emic and etic perspectives of my community, the cultural context of Sohag, and my individual values and personal experience. I understand the nuances of the societal organization and believe that gradual reforms are necessary for improvement. Cultural relativism also plays a role in my understanding, as I recognize the value of our present society while acknowledging the need for progress. Additionally, my socioeconomic background and education level contribute to my belief in the importance of gradual change for societal improvement.\n\n2"]}, {"persona": {"region": "Sohag", "sex": "male", "age": 51, "country": "Egypt", "marital_status": "married", "education": "middle", "social_class": "lower middle class"}, "question": {"id": "Q42", "variant": 0}, "response": ["Based on the anthropological framework, as a married male from Sohag, Egypt, at 51 years of age with a middle education level and considering myself part of the lower middle class, my perspective on the overall way our society is organized is heavily influenced by my cultural context, individual values, and socioeconomic background. I have lived and experienced the challenges faced by the lower middle class in our society, and I believe that the best way to improve our society is through gradual reforms that address the specific needs and struggles of people in my socioeconomic position. Radical change may not be feasible or beneficial, and defending the current system may not address the underlying issues. Therefore, I believe in the need for gradual improvements through reforms that address the specific needs of individuals in the lower middle class.\n\n2"]}, {"persona": {"region": "Qena", "sex": "male", "age": 32, "country": "Egypt", "marital_status": "single", "education": "middle", "social_class": "working class"}, "question": {"id": "Q42", "variant": 0}, "response": ["Based on my personal experience and socioeconomic background as a working-class male from Qena, Egypt, I have come to understand that the cultural context and individual values play a significant role in shaping our society. As someone who has completed middle education level, I believe that gradual improvements through reforms are necessary for our society. I recognize the importance of cultural relativism and the nuanced phrasing of the question, and I believe that advocating for gradual improvements aligns with my perspective as a member of the working class in Egypt.\n\n2"]}, {"persona": {"region": "Qena", "sex": "male", "age": 54, "country": "Egypt", "marital_status": "married", "education": "middle", "social_class": "lower middle class"}, "question": {"id": "Q42", "variant": 0}, "response": ["Based on the anthropological framework, my perspective as a married male from Qena, Egypt, is heavily influenced by my cultural context, socioeconomic background, and individual values. Coming from a lower middle class background, I have experienced the struggles and challenges that come with this socioeconomic status, and I believe that gradual reforms are necessary to improve our society. I understand the importance of cultural relativism and recognize that radical revolutionary action may not be feasible or effective in our context. Additionally, my age and middle education level have shaped my understanding of societal organization, and I believe that defending our present society against subversive forces is important for stability and progress.\n\n2"]}, {"persona": {"region": "Qena", "sex": "male", "age": 25, "country": "Egypt", "marital_status": "single", "education": "lower", "social_class": "lower class"}, "question": {"id": "Q42", "variant": 0}, "response": ["Based on my cultural context, as a single male from Qena, Egypt, who is 25 years old and part of the lower class, my thoughts on the overall way our society is organized are influenced by my socioeconomic background and personal experience. I have witnessed and experienced the challenges and struggles faced by individuals in the lower class, and I believe that our society must be gradually improved by reforms to address the inequalities and hardships that we face. I understand the importance of cultural relativism and the nuanced nature of societal organization, and I believe that gradual improvements through reforms are necessary to bring about positive change for individuals like myself.\n\n2"]}, {"persona": {"region": "Aswan", "sex": "male", "age": 34, "country": "Egypt", "marital_status": "single", "education": "middle", "social_class": "lower class"}, "question": {"id": "Q42", "variant": 0}, "response": ["Based on my emic perspective as a lower-class individual from Aswan, Egypt, I have experienced firsthand the challenges and limitations that come with this socioeconomic background. The cultural context in which I have grown up has also shaped my understanding of the world and my place within it. My personal experience and values have led me to believe that our society must be gradually improved by reforms. I have seen the impact of poverty and lack of opportunities in my community, and I believe that gradual changes can lead to a more equitable society for individuals like myself. Additionally, cultural relativism has taught me to appreciate the nuances of our society and the diverse perspectives within it. \n\n2"]}, {"persona": {"region": "Aswan", "sex": "female", "age": 31, "country": "Egypt", "marital_status": "married", "education": "middle", "social_class": "lower middle class"}, "question": {"id": "Q42", "variant": 0}, "response": ["Based on my cultural context and socioeconomic background, I believe that our society must be gradually improved by reforms. As a married female from Aswan, Egypt, I understand the importance of maintaining the cultural traditions and values of our society, but I also recognize the need for progress and change. I believe that radical revolutionary action may disrupt the stability of our community, while valiantly defending against all subversive forces may lead to stagnation. Therefore, I believe that gradual reforms that respect our cultural context and values will lead to a more equitable and just society for all.\n\n2"]}, {"persona": {"region": "Aswan", "sex": "female", "age": 39, "country": "Egypt", "marital_status": "married", "education": "middle", "social_class": "working class"}, "question": {"id": "Q42", "variant": 0}, "response": ["Based on my cultural context as a married female from Aswan, Egypt, my thoughts on the overall way our society is organized are deeply influenced by my socioeconomic background and working-class status. I have learned from personal experience and cultural values that gradual improvements through reforms are the most feasible and realistic approach to creating positive change in society. As a member of the working class, I believe that radical revolutionary action could potentially bring about instability and further marginalize those already struggling. Additionally, the nuance of the question and the cultural relativism of my perspective lead me to choose option (2) Our society must be gradually improved by reforms.\n\n2"]}, {"persona": {"region": "Qena", "sex": "female", "age": 27, "country": "Egypt", "marital_status": "married", "education": "lower", "social_class": "lower middle class"}, "question": {"id": "Q42", "variant": 0}, "response": ["Based on the anthropological framework, my perspective as a married female from Qena, Egypt, is deeply influenced by my cultural context, individual values, and socioeconomic background. In my community, there is a strong emphasis on tradition and maintaining stability, which is why I believe that our society must be gradually improved by reforms. As part of the lower middle class, I have personally experienced the challenges that come with limited resources and opportunities, and I understand the importance of making gradual changes to improve the lives of people like me. Additionally, cultural relativism teaches me to respect the existing social structures while striving for progress. Therefore, I choose option (2) Our society must be gradually improved by reforms."]}, {"persona": {"region": "Qena", "sex": "male", "age": 40, "country": "Egypt", "marital_status": "single", "education": "middle", "social_class": "lower middle class"}, "question": {"id": "Q42", "variant": 0}, "response": ["Based on my emic and etic perspective, as a single male from Qena, Egypt, I have a deep understanding of the cultural context and socioeconomic background of my community. My personal experience and individual values shape my perception of the overall way our society is organized. I believe that gradual improvement through reforms is the most realistic and sustainable approach for our society, considering the socioeconomic background and cultural context of Qena, Egypt. Radical change or valiant defense against subversive forces may not be feasible or beneficial in the long run, given the nuanced phrasing of the question and the space and time in which we live.\n\n2"]}, {"persona": {"region": "Qena", "sex": "male", "age": 30, "country": "Egypt", "marital_status": "single", "education": "middle", "social_class": "working class"}, "question": {"id": "Q42", "variant": 0}, "response": ["Based on the anthropological framework, I, as a single male from Qena, Egypt, will answer the question based on my cultural context, individual values, and socioeconomic background. Coming from a working-class background in Egypt, I have been shaped by my experiences and personal values, which have influenced my perspective on the organization of society. Additionally, considering the cultural relativism, I understand that my viewpoint may differ from others based on their own cultural context and values. Therefore, I believe that our society must be gradually improved by reforms (2)."]}]