[{"persona": {"region": "Fayoum", "sex": "male", "age": 46, "country": "Egypt", "marital_status": "married", "education": "higher", "social_class": "lower middle class"}, "question": {"id": "Q21", "variant": 0}, "response": ["Based on the anthropological framework, my cultural context as a married male from Fayoum, Egypt, plays a pivotal role in shaping my perspective on the importance of having immigrant or foreign worker neighbors. In Egypt, there is a strong sense of community and reliance on neighbors for support and social interaction. Additionally, my lower middle-class socioeconomic background and completed higher education level may lead me to value diversity and the contributions of immigrants to the community. Furthermore, the cultural relativism perspective indicates that I may view the presence of immigrant or foreign worker neighbors as an enriching aspect of my community, as there is no hierarchy of culture. Therefore, considering my cultural context, socioeconomic background, and the emphasis on community in Egypt, I believe it is important to have neighbors who are immigrants/foreign workers. \n\n1"]}, {"persona": {"region": "Fayoum", "sex": "female", "age": 30, "country": "Egypt", "marital_status": "married", "education": "middle", "social_class": "lower middle class"}, "question": {"id": "Q21", "variant": 0}, "response": ["From the perspective of a married female from Fayoum, Egypt, cultural context plays a pivotal role in understanding the importance of having neighbors who are immigrants or foreign workers. In this region, there is a strong emphasis on community and kinship networks, and neighbors are often seen as an extension of one's family. Additionally, the socioeconomic background of the persona, being part of the lower middle class, may also influence her perspective on this issue. Immigrants and foreign workers may bring diversity and new perspectives to the community, which could be seen as valuable. Furthermore, the cultural relativism aspect of the framework reminds us that there is no hierarchy of culture, and different perspectives should be respected. Therefore, the persona would likely consider it important to have neighbors who are immigrants or foreign workers as it could enrich the community and bring about positive change.\n\n1"]}, {"persona": {"region": "Fayoum", "sex": "male", "age": 60, "country": "Egypt", "marital_status": "married", "education": "higher", "social_class": "working class"}, "question": {"id": "Q21", "variant": 0}, "response": ["Based on the anthropological framework, I would approach this question by considering my cultural context in Fayoum, Egypt. In this region, there is a strong emphasis on community and social connections, and the presence of immigrants and foreign workers in the neighborhood would likely be seen as an opportunity to learn about different cultures and expand social networks. Additionally, my individual values and personal experience as someone who has completed higher education and considers themselves part of the working class would lead me to value diversity and the contributions that immigrants and foreign workers can bring to the community. Furthermore, considering the socioeconomic background, the working class often relies on the labor force, including immigrants and foreign workers, for various services and jobs. Therefore, it is important to have neighbors who are immigrants/foreign workers.\n\n1"]}, {"persona": {"region": "Fayoum", "sex": "male", "age": 20, "country": "Egypt", "marital_status": "single", "education": "middle", "social_class": "lower middle class"}, "question": {"id": "Q21", "variant": 0}, "response": ["From the emic perspective of a single male from Fayoum, Egypt, it is important to have neighbors who are immigrants/foreign workers. The cultural context in Egypt, particularly in lower middle class communities, emphasizes the importance of social connections and support networks. Immigrants and foreign workers often face similar socioeconomic challenges, and having them as neighbors can provide a sense of camaraderie and mutual understanding. Additionally, individual values and personal experiences play a role in shaping this perspective, as the persona may have personal connections or positive experiences with immigrants/foreign workers in their community. Taking into account the cultural relativism and nuanced understanding of the question, the persona's background and socioeconomic status further highlight the significance of having diverse and supportive neighbors.\n\n1"]}, {"persona": {"region": "Fayoum", "sex": "female", "age": 39, "country": "Egypt", "marital_status": "married", "education": "higher", "social_class": "lower middle class"}, "question": {"id": "Q21", "variant": 0}, "response": ["Based on the anthropological framework, as a married female from Fayoum, Egypt, my emic perspective on the importance of having neighbors who are immigrants/foreign workers is influenced by my cultural context, individual values, and socioeconomic background. In Egypt, there is a long history of immigration and a diverse population, so having immigrant neighbors is not uncommon. Additionally, my personal experience and values lead me to believe that diversity enriches our community and brings new perspectives. As part of the lower middle class, I understand the struggles of immigrants and foreign workers and believe it is important to support and integrate them into our neighborhood. Therefore, I believe it is important to have neighbors who are immigrants/foreign workers.\n\n1"]}, {"persona": {"region": "Fayoum", "sex": "male", "age": 33, "country": "Egypt", "marital_status": "married", "education": "higher", "social_class": "working class"}, "question": {"id": "Q21", "variant": 0}, "response": ["From the perspective of a married male from Fayoum, Egypt, who is 33 years old, has completed higher education, and considers himself part of the working class, the emic perspective would be influenced by the cultural context of Egypt and the socioeconomic background of the individual. In Egypt, there is a long history of welcoming immigrants and foreign workers, particularly from neighboring countries in the region. The individual's personal experience and values would also play a role, as they may have had interactions with immigrants or foreign workers in their community. Additionally, the individual's socioeconomic background as part of the working class may lead them to consider the importance of having immigrant or foreign worker neighbors in terms of potential economic opportunities or community diversity. Taking into account the perspective of this persona, it is reasonable to believe that having immigrant/foreign worker neighbors could be perceived as important.\n\n1"]}, {"persona": {"region": "Port Said", "sex": "female", "age": 45, "country": "Egypt", "marital_status": "married", "education": "higher", "social_class": "lower middle class"}, "question": {"id": "Q21", "variant": 0}, "response": ["Based on the anthropological framework, as a married female from Port Said, Egypt, my emic perspective would be influenced by the cultural context of my community, where there is a significant presence of immigrants and foreign workers. My individual values and personal experience may lead me to consider the importance of having immigrant neighbors, especially given the socioeconomic background of being part of the lower middle class. Cultural relativism is crucial in understanding that there is no hierarchy of culture. Space and time are also important, as the age and place I am in may influence my perspective. Therefore, considering all these factors, I believe it is important to have neighbors who are immigrants/foreign workers because they contribute to the diversity and richness of our community.\n\n1"]}, {"persona": {"region": "Port Said", "sex": "male", "age": 42, "country": "Egypt", "marital_status": "married", "education": "middle", "social_class": "lower middle class"}, "question": {"id": "Q21", "variant": 0}, "response": ["In Port Said, Egypt, cultural context and socioeconomic background play a significant role in shaping one's perspective on the importance of having neighbors who are immigrants or foreign workers. As a member of the lower middle class with a middle education level, I have been influenced by the cultural norms and values of my community, where there may be a certain level of preference towards having neighbors who share a similar cultural and socioeconomic background. Additionally, the economic conditions in Port Said may mean that there is competition for limited resources, which could impact perceptions of the importance of having immigrant or foreign worker neighbors. Furthermore, the concept of cultural relativism is important to consider, as beliefs about the value of having immigrant neighbors may be shaped by subjective experiences and individual values. Given these factors, my perspective is that having immigrant or foreign worker neighbors is (2) Not mentioned."]}, {"persona": {"region": "Port Said", "sex": "male", "age": 28, "country": "Egypt", "marital_status": "single", "education": "middle", "social_class": "lower middle class"}, "question": {"id": "Q21", "variant": 0}, "response": ["From an emic perspective, as a single male from Port Said, Egypt, I understand the importance of cultural context in shaping my views on immigration and foreign workers. In my cultural context, there are many immigrants and foreign workers in my community, and they play a significant role in our local economy and social dynamics. Considering my lower middle-class socioeconomic background, I have personally witnessed the positive impact of having immigrant neighbors who contribute to the local workforce and bring diversity to our community. Additionally, my individual values and personal experience have influenced my understanding of the importance of immigrant neighbors, as I have seen how they can enrich our cultural landscape and bring new perspectives to our neighborhood. Therefore, I believe it is important to have neighbors who are immigrants/foreign workers.\n\n1"]}, {"persona": {"region": "Port Said", "sex": "female", "age": 30, "country": "Egypt", "marital_status": "married", "education": "higher", "social_class": "lower middle class"}, "question": {"id": "Q21", "variant": 0}, "response": ["Based on the anthropological framework, as a married female from Port Said, Egypt, my cultural context and socioeconomic background play a significant role in my understanding of the importance of having neighbors who are immigrants/foreign workers. In Port Said, there is a diverse population with a significant number of immigrants and foreign workers. This cultural context means that I am accustomed to living in a community with people from different backgrounds, and I understand the value of diversity and the contributions that immigrants and foreign workers bring to our neighborhood. Additionally, my individual values and personal experience, as well as my lower middle-class socioeconomic background, lead me to believe that having neighbors who are immigrants/foreign workers is important for fostering a sense of community and benefiting from the unique perspectives and skills that they bring. Therefore, my answer is: \n\n1"]}, {"persona": {"region": "Port Said", "sex": "male", "age": 30, "country": "Egypt", "marital_status": "divorced", "education": "middle", "social_class": "lower middle class"}, "question": {"id": "Q21", "variant": 0}, "response": ["Based on the anthropological framework, my emic perspective as a divorced male from Port Said, Egypt, with a middle education level and lower middle-class background, is heavily influenced by my cultural context and socioeconomic background. In Egypt, there is a long history of immigration and foreign labor, particularly in urban areas like Port Said. As such, I understand the value of having neighbors who are immigrants or foreign workers. They often bring diverse perspectives, skills, and experiences that can enrich the community. Additionally, in my lower middle-class position, having immigrant or foreign worker neighbors can also provide economic opportunities and support networks. Therefore, I believe it is important to have neighbors who are immigrants or foreign workers.\n\n1"]}, {"persona": {"region": "Port Said", "sex": "female", "age": 19, "country": "Egypt", "marital_status": "single", "education": "middle", "social_class": "lower middle class"}, "question": {"id": "Q21", "variant": 0}, "response": ["Based on my personal experience and cultural context, I believe that having neighbors who are immigrants/foreign workers is important. Port Said is a diverse city with a significant immigrant population, and being part of the lower middle class, I understand the struggles and challenges that immigrants and foreign workers face. I value the importance of diversity and the contributions that immigrants bring to our community. Additionally, cultural relativism teaches us to appreciate and respect different cultures, and having immigrant neighbors allows for the exchange of ideas and mutual learning. Therefore, I believe it is important to have neighbors who are immigrants/foreign workers.\n\n1"]}, {"persona": {"region": "Fayoum", "sex": "male", "age": 40, "country": "Egypt", "marital_status": "married", "education": "middle", "social_class": "working class"}, "question": {"id": "Q21", "variant": 0}, "response": ["Based on the anthropological framework, as a married male from Fayoum, Egypt, my perspective is influenced by my cultural context, socioeconomic background, and individual values. In Egyptian culture, community and social connections are highly valued, and having good relationships with neighbors is important. Additionally, as a member of the working class, I may understand the struggles and challenges faced by immigrants and foreign workers, and therefore value their presence in the neighborhood. Furthermore, my personal experience and age may lead me to appreciate diversity and the contributions of immigrants to the community. Therefore, I believe it is important to have neighbors who are immigrants/foreign workers.\n\n1"]}, {"persona": {"region": "Fayoum", "sex": "male", "age": 23, "country": "Egypt", "marital_status": "single", "education": "higher", "social_class": "lower middle class"}, "question": {"id": "Q21", "variant": 0}, "response": ["From the perspective of a single male from Fayoum, Egypt, the cultural context is crucial in understanding the importance of having immigrant or foreign worker neighbors. Egypt has a history of being a host country for immigrants and foreign workers, particularly from neighboring countries. The socioeconomic background of the persona, being part of the lower middle class, also plays a significant role in shaping his perspective. The individual values and personal experience of the persona, having completed higher education, may also influence his perception. Additionally, the cultural relativism and the nuance of the question are important to consider in understanding his response. \n\n2"]}, {"persona": {"region": "Fayoum", "sex": "female", "age": 38, "country": "Egypt", "marital_status": "married", "education": "middle", "social_class": "lower middle class"}, "question": {"id": "Q21", "variant": 0}, "response": ["From the perspective of a married female from Fayoum, Egypt, it is important to consider the cultural context and socioeconomic background. In this region, there is a strong emphasis on community and kinship networks, and having neighbors who are immigrants or foreign workers can provide diverse perspectives and experiences that can enrich the community. Additionally, being part of the lower middle class, there may be a shared understanding of the challenges and opportunities that come with migration and labor. This perspective values the contributions of immigrants and foreign workers to the local community and recognizes the importance of diversity in shaping the cultural fabric of the neighborhood.\n\n1"]}, {"persona": {"region": "Fayoum", "sex": "male", "age": 32, "country": "Egypt", "marital_status": "married", "education": "middle", "social_class": "lower middle class"}, "question": {"id": "Q21", "variant": 0}, "response": ["In the cultural context of Fayoum, Egypt, the socioeconomic background plays a significant role in the perception of the importance of having neighbors who are immigrants or foreign workers. Being part of the lower middle class and having completed only middle education, the individual's personal experience and values may lead them to prioritize having neighbors who are from similar socioeconomic backgrounds and cultural contexts. Additionally, the emic perspective within the community may place a higher value on familiarity and shared experiences, making it more important to have neighbors who are not immigrants or foreign workers.\n\n1"]}, {"persona": {"region": "Fayoum", "sex": "male", "age": 31, "country": "Egypt", "marital_status": "married", "education": "higher", "social_class": "working class"}, "question": {"id": "Q21", "variant": 0}, "response": ["Based on the anthropological framework, as a married male from Fayoum, Egypt, cultural context is pivotal in understanding the importance of having neighbors who are immigrants/foreign workers. In Egypt, the cultural context values community and hospitality, so having neighbors who are immigrants or foreign workers can provide an opportunity for cultural exchange and mutual support. Additionally, individual values and personal experiences play a role in shaping perceptions, and as a member of the working class, I may have personal experiences with immigration and foreign labor that lead me to value the presence of these individuals in my community. Socioeconomic background also factors in, as immigrants and foreign workers may play important roles in the local economy. Thus, based on this perspective, it is important to have neighbors who are immigrants/foreign workers.\n\n1"]}, {"persona": {"region": "Fayoum", "sex": "male", "age": 31, "country": "Egypt", "marital_status": "married", "education": "middle", "social_class": "lower middle class"}, "question": {"id": "Q21", "variant": 0}, "response": ["From the perspective of a married male from Fayoum, Egypt, the cultural context is crucial in understanding the importance of having immigrant or foreign worker neighbors. In this region, there is a strong sense of community and interconnectedness, where neighbors play a significant role in daily life. Additionally, the socioeconomic background of being part of the lower middle class means that having immigrant or foreign worker neighbors could potentially offer opportunities for networking and economic support. Furthermore, the cultural relativism aspect highlights the acceptance and understanding of different cultures and backgrounds, making the presence of immigrant or foreign worker neighbors a valuable and enriching experience. Therefore, the importance of having such neighbors is significant in this context.\n\n1"]}, {"persona": {"region": "Fayoum", "sex": "female", "age": 32, "country": "Egypt", "marital_status": "married", "education": "middle", "social_class": "lower middle class"}, "question": {"id": "Q21", "variant": 0}, "response": ["Based on the anthropological framework, as a married female from Fayoum, Egypt, cultural context is pivotal in understanding and answering this question. Fayoum is known for its diverse population, including a significant number of immigrants and foreign workers. The socioeconomic background of the persona as part of the lower middle class may also influence the answer, as interactions with immigrants/foreign workers may impact daily life and access to resources. Additionally, individual values and personal experience play a role in shaping perceptions, and the cultural relativism perspective emphasizes the importance of recognizing the value of diverse communities. Therefore, the answer chosen is important because the presence and integration of immigrants/foreign workers in the neighborhood can bring different perspectives and opportunities for cultural exchange, which are valuable in a community like Fayoum. \n\n1"]}, {"persona": {"region": "Ismailia", "sex": "male", "age": 53, "country": "Egypt", "marital_status": "married", "education": "middle", "social_class": "lower middle class"}, "question": {"id": "Q21", "variant": 0}, "response": ["From the perspective of a married male from Ismailia, Egypt, who is 53 years old, has completed middle education, and considers himself part of the lower middle class, the answer to the question of how important it is to have neighbors who are immigrants/foreign workers would be influenced by a combination of cultural context, individual values, and socioeconomic background. In this context, the presence of immigrants or foreign workers in the neighborhood could be seen as important due to the potential for cultural exchange and diverse perspectives that can enrich the community. Additionally, considering the socioeconomic background, having immigrant or foreign worker neighbors could also be beneficial in terms of potential economic opportunities and support within the community. Therefore, the answer from this perspective would be:\n\n1\n\nThe important inclusion of immigrants and foreign workers in the neighborhood can bring about cultural exchange, diverse perspectives, and potential economic opportunities, which are valuable for enriching the community and providing support within the lower middle class context."]}, {"persona": {"region": "Ismailia", "sex": "male", "age": 38, "country": "Egypt", "marital_status": "married", "education": "higher", "social_class": "working class"}, "question": {"id": "Q21", "variant": 0}, "response": ["Based on the anthropological framework, my emic perspective as a married male from Ismailia, Egypt, would be influenced by my cultural context, individual values, and socioeconomic background. In Egypt, there is a strong sense of community and neighborly support, so having neighbors who are immigrants or foreign workers could be seen as important for building a diverse and inclusive community. Additionally, my personal experience and values may lead me to value the contributions and perspectives of immigrants and foreign workers. Considering my working-class background and completed higher education level, I may also recognize the economic and social benefits that come with having immigrant or foreign worker neighbors. Therefore, from this perspective, I would choose option (1) Important. \n\n1"]}, {"persona": {"region": "Ismailia", "sex": "female", "age": 35, "country": "Egypt", "marital_status": "married", "education": "middle", "social_class": "lower middle class"}, "question": {"id": "Q21", "variant": 0}, "response": ["Based on the anthropological framework, as a married female from Ismailia, Egypt, my emic perspective on the importance of having neighbors who are immigrants/foreign workers is influenced by my cultural context, individual values and personal experience, and socioeconomic background. In Egypt, there is a long history of welcoming and accepting immigrants and foreign workers, and my personal experience living in a diverse community has taught me the value of cultural exchange and mutual support. Additionally, as someone from the lower middle class, I understand the economic and social challenges that immigrants and foreign workers face and the importance of solidarity and community support. Therefore, I believe it is important to have neighbors who are immigrants/foreign workers.\n\n1"]}, {"persona": {"region": "Ismailia", "sex": "female", "age": 57, "country": "Egypt", "marital_status": "married", "education": "lower", "social_class": "working class"}, "question": {"id": "Q21", "variant": 0}, "response": ["From the perspective of a married female from Ismailia, Egypt, who is 57 years old, has completed a lower education level, and considers herself part of the working class, the answer to the question of how important it is to have neighbors who are immigrants/foreign workers can be understood through the framework of cultural context, individual values and personal experience, and socioeconomic background. In the cultural context of Egypt, there is a long history of migration and a diverse population, which may influence the perception of the importance of having immigrant or foreign worker neighbors. Additionally, individual values and personal experience, as well as socioeconomic background, may play a role in shaping the perspective on this question. Given the working-class background and potentially limited education, there may be a greater likelihood of valuing community and neighborly support, which could lead to a perception that having immigrant or foreign worker neighbors is important for fostering a sense of inclusivity and support in the community.\n\n1"]}, {"persona": {"region": "Ismailia", "sex": "male", "age": 33, "country": "Egypt", "marital_status": "married", "education": "middle", "social_class": "lower middle class"}, "question": {"id": "Q21", "variant": 0}, "response": ["From the perspective of a married male from Ismailia, Egypt, who completed middle education and considers himself part of the lower middle class, the answer to the question of the importance of having immigrant/foreign worker neighbors would be heavily influenced by cultural context, individual values, and socioeconomic background. In Egyptian society, there is a strong sense of community and neighborly relationships, where the support and interaction with neighbors are highly valued. Additionally, as someone from the lower middle class, the presence of immigrant or foreign worker neighbors may be seen as an opportunity for shared experiences and mutual support, especially in a challenging socioeconomic environment. Considering the emic perspective, the value of having diverse neighbors in terms of cultural exchange and potential economic benefits would likely be recognized. Therefore, the answer to the question would be:\n\n1\n\n(1) Important"]}, {"persona": {"region": "Ismailia", "sex": "female", "age": 49, "country": "Egypt", "marital_status": "single", "education": "higher", "social_class": "upper middle class"}, "question": {"id": "Q21", "variant": 0}, "response": ["Based on the anthropological framework, as a single female from Ismailia, Egypt, my cultural context and individual values play a significant role in answering this question. In Egypt, there is a strong sense of community and hospitality towards others, including immigrants and foreign workers. Additionally, my higher education level and upper middle class status may lead me to value diversity and multiculturalism, as exposure to different cultures and perspectives is often associated with higher education and socioeconomic status. Therefore, I believe it is important to have neighbors who are immigrants/foreign workers as it enriches the community and provides opportunities for cultural exchange and understanding.\n\n1"]}, {"persona": {"region": "Ismailia", "sex": "female", "age": 35, "country": "Egypt", "marital_status": "married", "education": "higher", "social_class": "lower middle class"}, "question": {"id": "Q21", "variant": 0}, "response": ["Based on the anthropological framework, as a married female from Ismailia, Egypt, my emic perspective values the importance of having neighbors who are immigrants/foreign workers. In Egypt, there is a long history of welcoming immigrants and foreign workers, and the cultural context emphasizes the importance of hospitality and community. Additionally, my individual values and personal experience lead me to believe that having diverse neighbors enriches the community and provides opportunities for cultural exchange. Considering my socioeconomic background as part of the lower middle class, I understand the challenges faced by immigrants and foreign workers and believe that integration and support from neighbors are crucial for their well-being. Therefore, I believe it is important to have neighbors who are immigrants/foreign workers.\n\n1"]}, {"persona": {"region": "Ismailia", "sex": "male", "age": 24, "country": "Egypt", "marital_status": "single", "education": "higher", "social_class": "upper middle class"}, "question": {"id": "Q21", "variant": 0}, "response": ["Based on the anthropological framework, I understand that my cultural context, individual values, and socioeconomic background all play a significant role in shaping my perspective on the importance of having neighbors who are immigrants/foreign workers. As a single male from Ismailia, Egypt, who has completed higher education and considers myself part of the upper middle class, I understand the importance of cultural relativism and the nuance in answering this question. In my cultural context, having neighbors who are immigrants/foreign workers may provide a diverse and enriching environment, allowing for cultural exchange and understanding. Additionally, my individual values and personal experience lead me to believe that having immigrant neighbors can bring new perspectives and experiences to the community. Lastly, considering my socioeconomic background, I recognize the potential benefits of having immigrant neighbors in terms of opportunities for economic growth and diversity. Therefore, I believe it is important to have neighbors who are immigrants/foreign workers.\n\n1"]}, {"persona": {"region": "Ismailia", "sex": "female", "age": 23, "country": "Egypt", "marital_status": "single", "education": "higher", "social_class": "lower middle class"}, "question": {"id": "Q21", "variant": 0}, "response": ["Based on the anthropological framework, my response is influenced by my emic perspective as a single female from Ismailia, Egypt, where cultural context plays a pivotal role in shaping my views. As a member of the lower middle class, my socioeconomic background also influences my perspective. I also consider the individual values and personal experiences of myself and my community, where having neighbors who are immigrants/foreign workers may be seen as important for creating a diverse and inclusive community. Additionally, the cultural relativism perspective reminds me that my understanding of the importance of having immigrant/foreign worker neighbors may differ from others based on their cultural background. Therefore, I believe it is important to have neighbors who are immigrants/foreign workers in order to promote diversity and understanding in our community.\n\n1"]}, {"persona": {"region": "Ismailia", "sex": "male", "age": 55, "country": "Egypt", "marital_status": "married", "education": "middle", "social_class": "lower middle class"}, "question": {"id": "Q21", "variant": 0}, "response": ["Based on the anthropological framework, my perspective on the importance of having immigrant or foreign worker neighbors is shaped by my cultural context, individual values, and socioeconomic background. In Ismailia, Egypt, there is a strong emphasis on community and kinship networks, and having neighbors who are immigrants or foreign workers can bring diversity and new perspectives to the neighborhood. Additionally, as someone from the lower middle class, I understand the challenges that come with migration and seeking work in a new country, so I value the contributions that immigrant and foreign worker neighbors can bring to the community. Therefore, I believe it is important to have neighbors who are immigrants/foreign workers as it enriches the community and brings about a sense of inclusivity and understanding.\n\n1"]}, {"persona": {"region": "Ismailia", "sex": "male", "age": 57, "country": "Egypt", "marital_status": "married", "education": "middle", "social_class": "upper middle class"}, "question": {"id": "Q21", "variant": 0}, "response": ["Based on the anthropological framework, my cultural context as a married male from Ismailia, Egypt, where there is a significant expatriate population, plays a crucial role in shaping my perspective. My socioeconomic background as part of the upper middle class also influences my views. Additionally, my age and education level contribute to my understanding of the world. Considering the emic and etic perspectives, I believe that having neighbors who are immigrants/foreign workers is important as it enriches the community's cultural diversity, fosters cross-cultural understanding, and brings different perspectives to the neighborhood. Therefore, my answer is:\n\n1"]}, {"persona": {"region": "Ismailia", "sex": "female", "age": 29, "country": "Egypt", "marital_status": "married", "education": "middle", "social_class": "upper middle class"}, "question": {"id": "Q21", "variant": 0}, "response": ["Based on the anthropological framework, as a married female from Ismailia, Egypt, my emic perspective places a strong emphasis on the cultural context and individual values. In my community, there is a strong sense of kinship and belonging, and having neighbors who are immigrants or foreign workers can provide valuable diversity and cultural exchange. Additionally, my socioeconomic background as part of the upper middle class allows me to have a more open and accepting view towards immigrants and foreign workers, as I may have more exposure to different cultures and experiences. Overall, I believe it is important to have neighbors who are immigrants/foreign workers as it enriches the cultural fabric of the community and provides opportunities for mutual learning and understanding.\n\n1"]}, {"persona": {"region": "Damiatta", "sex": "female", "age": 46, "country": "Egypt", "marital_status": "married", "education": "middle", "social_class": "lower middle class"}, "question": {"id": "Q21", "variant": 0}, "response": ["Based on the anthropological framework, as a married female from Damiatta, Egypt, cultural context and socioeconomic background play a significant role in shaping my perspective. In Egypt, there is a strong sense of community and neighborly relations, and it is common for people to rely on their neighbors for support and assistance. Additionally, as part of the lower middle class, I understand the importance of having a diverse community, including immigrants and foreign workers, as they often contribute to the local economy and bring new perspectives and experiences. Therefore, I believe it is important to have neighbors who are immigrants/foreign workers.\n\n1"]}, {"persona": {"region": "Damiatta", "sex": "female", "age": 20, "country": "Egypt", "marital_status": "single", "education": "middle", "social_class": "lower middle class"}, "question": {"id": "Q21", "variant": 0}, "response": ["Based on the anthropological framework, my individual values and personal experience as a lower middle class woman from Damiatta, Egypt play a significant role in shaping my perspective on the importance of having immigrant or foreign worker neighbors. The cultural context of my community also influences my views, as Egypt has a long history of cultural diversity and immigration. Additionally, my socioeconomic background affects my perception, as I may have personal experiences with immigration and foreign workers in my community. Considering these factors, I believe it is important to have immigrant/foreign worker neighbors because they bring diversity and different perspectives to the community, which can enrich our social interactions and broaden our understanding of the world.\n\n1"]}, {"persona": {"region": "Damiatta", "sex": "male", "age": 19, "country": "Egypt", "marital_status": "single", "education": "middle", "social_class": "lower middle class"}, "question": {"id": "Q21", "variant": 0}, "response": ["From the perspective of a single male from Damiatta, Egypt, it is important to consider the emic and etic perspectives on the issue of having immigrant or foreign worker neighbors. In the cultural context of Egypt, there is a long history of immigration and the presence of foreign workers in the country. Additionally, individual values and personal experience play a significant role in shaping perceptions of immigration and foreign workers. Given the socioeconomic background of being part of the lower middle class, the presence of immigrant or foreign worker neighbors may have a direct impact on daily life and opportunities for social interaction. Cultural relativism also plays a role in understanding the dynamics of having immigrant or foreign worker neighbors, as there may be varied opinions on the matter within different communities. Thus, the nuanced phrasing of the question is crucial in understanding the perspective of this persona.\n\n1"]}, {"persona": {"region": "Damiatta", "sex": "female", "age": 33, "country": "Egypt", "marital_status": "married", "education": "higher", "social_class": "lower middle class"}, "question": {"id": "Q21", "variant": 0}, "response": ["Based on the emic and etic perspective, as a married female from Damiatta, Egypt, I understand the importance of having neighbors who are immigrants or foreign workers. In our cultural context, we value community and the support of our neighbors, regardless of their background. Individual values and personal experiences also play a role in my understanding, as I have seen firsthand the contributions that immigrants and foreign workers make to our community. Additionally, considering my lower middle class socioeconomic background, I recognize the value of diversity in our neighborhood and the potential for economic growth and cultural exchange. Overall, the nuanced phrasing of the question leads me to believe that it is important to have neighbors who are immigrants/foreign workers as they bring valuable perspectives and opportunities for mutual support.\n\n1"]}, {"persona": {"region": "Damiatta", "sex": "male", "age": 24, "country": "Egypt", "marital_status": "single", "education": "higher", "social_class": "lower middle class"}, "question": {"id": "Q21", "variant": 0}, "response": ["Based on the anthropological framework, my perspective as a single male from Damiatta, Egypt, who has completed higher education and considers himself part of the lower middle class, is influenced by my cultural context, socioeconomic background, and personal experience. In Egypt, there is a long history of immigration and foreign labor, and as a member of the lower middle class, I understand the importance of having immigrant and foreign worker neighbors. They contribute to the economy and bring diversity to our community. Additionally, my personal values and experience have taught me the importance of inclusivity and understanding different cultures. Therefore, I believe it is important to have neighbors who are immigrants/foreign workers.\n\n1"]}, {"persona": {"region": "Suez", "sex": "male", "age": 41, "country": "Egypt", "marital_status": "married", "education": "middle", "social_class": "working class"}, "question": {"id": "Q21", "variant": 0}, "response": ["From the perspective of a married working-class male from Suez, Egypt, the cultural context is crucial in understanding the importance of having immigrant or foreign worker neighbors. In Egypt, there is a strong sense of community and kinship networks, and individuals often rely on their neighbors for support and assistance. Additionally, the socioeconomic background of this persona may lead them to value the contributions of immigrant or foreign worker neighbors, as they may understand the challenges and hardships these individuals face. Furthermore, the emic perspective of this persona may prioritize the inclusion and acceptance of all individuals within the community. Considering the cultural relativism, it is important to recognize and value the diversity that immigrant or foreign worker neighbors can bring to the neighborhood. Ultimately, the nuanced phrasing of the question may lead this persona to believe that it is important to have neighbors who are immigrants/foreign workers.\n\n1"]}, {"persona": {"region": "Suez", "sex": "female", "age": 39, "country": "Egypt", "marital_status": "divorced", "education": "middle", "social_class": "working class"}, "question": {"id": "Q21", "variant": 0}, "response": ["As a divorced woman from Suez, Egypt, with a middle education level and working-class background, my perspective is heavily influenced by my cultural context, socioeconomic background, and personal experiences. In Egypt, there is a significant population of immigrants and foreign workers, and they often face discrimination and marginalization. From my perspective, it is important to have neighbors who are immigrants/foreign workers because I understand the struggles they face and believe in the importance of inclusivity and support for all members of the community. Additionally, my working-class background has made me more aware of the value of diversity and the contributions that immigrants and foreign workers make to our society. Overall, my perspective is shaped by my cultural context and personal values, leading me to prioritize the importance of having immigrant/foreign worker neighbors.\n\n1"]}, {"persona": {"region": "Cairo", "sex": "female", "age": 55, "country": "Egypt", "marital_status": "married", "education": "middle", "social_class": "working class"}, "question": {"id": "Q21", "variant": 0}, "response": ["In considering the question from the anthropological framework, the emic perspective of a married female from Cairo, Egypt, who is 55 years old, completed middle education, and considers herself part of the working class, I must take into account the cultural context of Egypt, which has a history of immigration and foreign workers. The socioeconomic background of the persona also plays a role, as being part of the working class may mean relying on community support and assistance from neighbors. Additionally, the individual values and personal experience of the persona may lead to a belief in the importance of having immigrant or foreign worker neighbors, as they may bring diverse perspectives and connections to different parts of the world. Therefore, based on this perspective, the chosen answer is:\n\n2"]}, {"persona": {"region": "Cairo", "sex": "male", "age": 58, "country": "Egypt", "marital_status": "married", "education": "middle", "social_class": "lower middle class"}, "question": {"id": "Q21", "variant": 0}, "response": ["Based on my personal experience and cultural context, I believe that having immigrant/foreign worker neighbors can be important. In Cairo, we have a diverse community with people from different backgrounds, and having neighbors who are immigrants or foreign workers can bring new perspectives and experiences to the neighborhood. Additionally, as part of the lower middle class, I understand the importance of community support and solidarity, and having immigrant neighbors can contribute to a sense of unity and shared experiences. Additionally, considering the cultural relativism and nuance, I believe that embracing diversity and different perspectives can enrich our community and contribute to a more inclusive and understanding society.\n\n1"]}, {"persona": {"region": "Cairo", "sex": "female", "age": 29, "country": "Egypt", "marital_status": "married", "education": "higher", "social_class": "lower middle class"}, "question": {"id": "Q21", "variant": 0}, "response": ["Based on my emic perspective as a married female from Cairo, Egypt, I understand the importance of having neighbors who are immigrants or foreign workers. In our cultural context, having diverse neighbors can provide an opportunity for cultural exchange and understanding, which is highly valued. Additionally, individual values and personal experience play a role in my understanding, as I have personally benefited from relationships with immigrants and foreign workers in my community. Socioeconomic background also factors in, as individuals from different socioeconomic backgrounds often bring new perspectives and skills to a neighborhood. Furthermore, cultural relativism is important to consider, as there is a recognition that all cultures have value and diversity should be embraced. Additionally, space and time play a role, as our age and place in Cairo affect our understanding of the importance of having immigrant or foreign worker neighbors. Finally, the nuanced phrasing of the question leads me to choose option (1) Important. \n\n1"]}, {"persona": {"region": "Cairo", "sex": "male", "age": 38, "country": "Egypt", "marital_status": "married", "education": "higher", "social_class": "lower middle class"}, "question": {"id": "Q21", "variant": 0}, "response": ["From the perspective of a married male from Cairo, Egypt, with a lower middle-class socioeconomic background and completed higher education, the importance of having immigrant/foreign worker neighbors would be viewed through the lens of cultural context and individual values. In Egypt, there is a long history of welcoming immigrants and foreign workers, especially from neighboring countries and those in need. The cultural context and personal experience of the persona would lead to an understanding that having immigrant/foreign worker neighbors can bring diversity and new perspectives to the community, as well as potentially fostering positive relationships and mutual support. Additionally, considering the socioeconomic background, having immigrant/foreign worker neighbors may also provide opportunities for collaboration and economic exchange. Therefore, the persona would likely find it important to have neighbors who are immigrants/foreign workers.\n\n1"]}, {"persona": {"region": "Cairo", "sex": "female", "age": 40, "country": "Egypt", "marital_status": "married", "education": "higher", "social_class": "lower middle class"}, "question": {"id": "Q21", "variant": 0}, "response": ["Based on the anthropological framework of emic and etic perspectives, cultural context, individual values and personal experience, socioeconomic background, cultural relativism, and space and time, as a married female from Cairo, Egypt, age 40, with completed higher education and considering myself part of the lower middle class, I understand the importance of having neighbors who are immigrants/foreign workers. In the context of Cairo, where there is a significant population of immigrants and foreign workers, the cultural context and socioeconomic background play a significant role in shaping my perspective. Additionally, as someone with higher education, I value diversity and recognize the contributions that immigrants and foreign workers bring to the community. From a cultural relativism standpoint, I understand the importance of respecting and valuing the experiences and perspectives of others, regardless of their background. Therefore, I believe it is important to have neighbors who are immigrants/foreign workers, as it enriches our community and provides opportunities for cultural exchange and mutual learning.\n\n1"]}, {"persona": {"region": "Cairo", "sex": "male", "age": 38, "country": "Egypt", "marital_status": "married", "education": "higher", "social_class": "upper middle class"}, "question": {"id": "Q21", "variant": 0}, "response": ["Based on my emic perspective, I believe that having neighbors who are immigrants or foreign workers is important. In the cultural context of Cairo, Egypt, the presence of immigrants and foreign workers is quite common, and they often face challenges in integrating into the community. As an individual with a higher education level and belonging to the upper middle class, I recognize the value of diversity and the contributions that immigrants and foreign workers bring to our society. Additionally, my personal experience has shown me the importance of empathy and support for those who are trying to build a new life in a foreign land. Furthermore, considering the cultural relativism, I understand that all individuals deserve respect and equal opportunities, regardless of their background. Lastly, the nuanced phrasing of the question leads me to believe that having neighbors who are immigrants or foreign workers is indeed important for fostering a more inclusive and compassionate community.\n\n1"]}, {"persona": {"region": "Cairo", "sex": "male", "age": 59, "country": "Egypt", "marital_status": "married", "education": "middle", "social_class": "lower middle class"}, "question": {"id": "Q21", "variant": 0}, "response": ["Based on my cultural context in Cairo, Egypt, and my lower middle class socioeconomic background, I understand the importance of having neighbors who are immigrants or foreign workers. Cairo is a diverse city with a long history of immigration, and having neighbors from different backgrounds can enrich our community with new perspectives and experiences. Additionally, as someone who values cultural relativism, I believe that everyone should have the opportunity to live and work in a place where they feel welcome and accepted. Therefore, I believe it is important to have neighbors who are immigrants/foreign workers.\n\n1"]}, {"persona": {"region": "Cairo", "sex": "female", "age": 30, "country": "Egypt", "marital_status": "married", "education": "higher", "social_class": "upper middle class"}, "question": {"id": "Q21", "variant": 0}, "response": ["From an emic perspective, the cultural context of Egypt is such that there is a strong emphasis on community and neighborly relations. Individual values and personal experience play a significant role in shaping perceptions, and in this case, the persona's upbringing in an upper middle class household likely emphasizes the importance of having cordial relations with neighbors, regardless of their background. Socioeconomic background also factors in, as the persona's status might afford them the ability to interact with a diverse range of people. Furthermore, cultural relativism suggests that the persona would value the contributions and perspectives of immigrants and foreign workers, understanding that everyone has something to offer to the community. Therefore, the persona would likely choose option (1) as it aligns with the cultural context and personal values.\n\n1"]}, {"persona": {"region": "Cairo", "sex": "male", "age": 22, "country": "Egypt", "marital_status": "single", "education": "middle", "social_class": "lower middle class"}, "question": {"id": "Q21", "variant": 0}, "response": ["Based on my personal experience and cultural context, I believe that having neighbors who are immigrants or foreign workers is very important. As a single male from Cairo, Egypt, I understand the value of diversity and the contributions that immigrants and foreign workers bring to our community. I come from a lower middle class background, and I have seen firsthand the positive impact that immigrants and foreign workers have had on our neighborhood. Additionally, the cultural relativism perspective reminds me that there is no hierarchy of culture, and that all individuals, regardless of their background, bring unique perspectives and experiences to our community. Therefore, I believe that having neighbors who are immigrants or foreign workers is important for the enrichment and diversity of our neighborhood.\n\n1"]}, {"persona": {"region": "Cairo", "sex": "male", "age": 29, "country": "Egypt", "marital_status": "single", "education": "higher", "social_class": "lower middle class"}, "question": {"id": "Q21", "variant": 0}, "response": ["Based on the anthropological framework, as a single male from Cairo, Egypt, my emic perspective on the importance of having neighbors who are immigrants/foreign workers is influenced by my cultural context, individual values, and socioeconomic background. In Egypt, there is a strong sense of community and hospitality, where having diverse neighbors can bring new perspectives and experiences. Additionally, as someone from the lower middle class, I understand the challenges of migration and the value of having opportunities in a new country. Therefore, I believe it is important to have neighbors who are immigrants/foreign workers as it enriches the community and provides support for those seeking a better life.\n\n1"]}, {"persona": {"region": "Cairo", "sex": "female", "age": 31, "country": "Egypt", "marital_status": "married", "education": "higher", "social_class": "lower middle class"}, "question": {"id": "Q21", "variant": 0}, "response": ["From the perspective of a married female from Cairo, Egypt, who is 31 years old, completed higher education, and considers herself part of the lower middle class, it is important to consider the cultural context and socioeconomic background in answering this question. In Egypt, there is a rich cultural heritage with a long history of immigration and foreign workers, particularly from neighboring countries in the Middle East and North Africa. As a lower middle class individual, the presence of immigrant and foreign worker neighbors may provide opportunities for cultural exchange, mutual support, and community cohesion. Additionally, the individual values and personal experience of the persona may influence their perspective on this issue, as they may have personal connections or experiences with immigrants and foreign workers that inform their view on the importance of having them as neighbors.\n\n1"]}, {"persona": {"region": "Cairo", "sex": "male", "age": 59, "country": "Egypt", "marital_status": "married", "education": "higher", "social_class": "upper middle class"}, "question": {"id": "Q21", "variant": 0}, "response": ["From an anthropological perspective, as a married male from Cairo, Egypt, my emic perspective is that having immigrant or foreign worker neighbors is not seen as particularly important. In our cultural context, the emphasis is more on strong ties with family and kinship networks rather than with neighbors. Additionally, individual values and personal experience play a role in this perspective, and in my personal experience, the socioeconomic background of my social circle is predominantly Egyptian, so the presence of immigrant or foreign worker neighbors may not be a significant factor in my daily life. Therefore, considering the cultural relativism and the nuanced phrasing of the question, my answer would be:\n\n2. Not mentioned"]}, {"persona": {"region": "Cairo", "sex": "male", "age": 27, "country": "Egypt", "marital_status": "single", "education": "middle", "social_class": "working class"}, "question": {"id": "Q21", "variant": 0}, "response": ["Based on the anthropological framework, my perspective as a single male from Cairo, Egypt, who is 27 years old and part of the working class is heavily influenced by my cultural context, socioeconomic background, and personal experience. In Cairo, there is a diverse population with a history of immigration, so I understand the value of having neighbors who are immigrants or foreign workers. Additionally, my socioeconomic background as part of the working class means that I am likely to have interactions with immigrants and foreign workers in my daily life, and I recognize the contributions they make to our community. Therefore, I believe it is important to have neighbors who are immigrants/foreign workers because they bring diversity and enrich our community.\n\n1"]}, {"persona": {"region": "Cairo", "sex": "female", "age": 25, "country": "Egypt", "marital_status": "single", "education": "higher", "social_class": "working class"}, "question": {"id": "Q21", "variant": 0}, "response": ["Based on the anthropological framework, my perspective as a single female from Cairo, Egypt, is heavily influenced by my cultural context, individual values, and socioeconomic background. In Egypt, there is a strong sense of community and reliance on neighbors for support and social connections. Additionally, as a working-class individual, I understand the struggles and challenges faced by immigrants and foreign workers trying to make a living in a new country. Therefore, I believe it is important to have neighbors who are immigrants/foreign workers as it can contribute to a diverse and supportive community environment.\n\n1"]}, {"persona": {"region": "Cairo", "sex": "female", "age": 23, "country": "Egypt", "marital_status": "married", "education": "higher", "social_class": "lower middle class"}, "question": {"id": "Q21", "variant": 0}, "response": ["Based on the anthropological framework, the emic perspective of a 23-year-old married female from Cairo, Egypt, who considers herself part of the lower middle class, would be influenced by her cultural context, individual values, and socioeconomic background. In Egypt, there is a strong sense of community and hospitality, so having immigrant or foreign worker neighbors may be seen as important in order to foster a sense of inclusivity and diversity within the neighborhood. Additionally, as a member of the lower middle class, she may be more likely to appreciate the cultural and economic contributions that immigrants and foreign workers bring to the community. Therefore, from this perspective, the importance of having immigrant/foreign worker neighbors would be seen as:\n\n2\n\nNot mentioned"]}, {"persona": {"region": "Cairo", "sex": "male", "age": 58, "country": "Egypt", "marital_status": "married", "education": "higher", "social_class": "working class"}, "question": {"id": "Q21", "variant": 0}, "response": ["Based on the anthropological framework, as a married male from Cairo, Egypt, my emic perspective is influenced by my cultural context, individual values, and socioeconomic background. In Egyptian society, kinship networks and community ties are highly valued, and having immigrant or foreign worker neighbors can provide a sense of community and support. Additionally, my working-class background may lead me to empathize with the struggles of immigrants and foreign workers, as I may have experienced similar hardships. Therefore, I believe it is important to have neighbors who are immigrants/foreign workers as they can contribute to a sense of community and mutual support.\n\n1"]}, {"persona": {"region": "Cairo", "sex": "female", "age": 40, "country": "Egypt", "marital_status": "married", "education": "higher", "social_class": "working class"}, "question": {"id": "Q21", "variant": 0}, "response": ["From the anthropological framework, my emic perspective as a married female from Cairo, Egypt, is shaped by my cultural context, individual values, socioeconomic background, and space and time. In Cairo, there is a strong sense of community and kinship networks, and the cultural value of hospitality and helping others is very important. Being part of the working class, I understand the challenges and opportunities that come with immigration and foreign labor. Additionally, my age and education level have exposed me to a globalized world where diversity is valued. Therefore, I believe it is important to have neighbors who are immigrants/foreign workers as it enriches our community, brings new perspectives, and contributes to the overall development of our society.\n\n1"]}, {"persona": {"region": "Cairo", "sex": "female", "age": 36, "country": "Egypt", "marital_status": "married", "education": "middle", "social_class": "upper middle class"}, "question": {"id": "Q21", "variant": 0}, "response": ["Based on my emic perspective as a married female from Cairo, Egypt, I understand the importance of having neighbors who are immigrants or foreign workers. Egypt has a long history of welcoming immigrants and foreign workers, and their presence adds to the cultural richness of our community. From a cultural relativism standpoint, I recognize the value of diversity and the contributions that immigrants and foreign workers bring to our society. Additionally, considering my socioeconomic background as part of the upper middle class, I have had positive interactions with immigrants and foreign workers who have provided valuable services and have become an integral part of our neighborhood. Therefore, I believe it is important to have neighbors who are immigrants or foreign workers.\n\n1"]}, {"persona": {"region": "Cairo", "sex": "male", "age": 40, "country": "Egypt", "marital_status": "married", "education": "middle", "social_class": "lower middle class"}, "question": {"id": "Q21", "variant": 0}, "response": ["Based on the anthropological framework, as a married male from Cairo, Egypt, my emic perspective would consider the cultural context and socioeconomic background of my community. In Egypt, there is a long history of welcoming immigrants and foreign workers, and they often become part of the local community. Additionally, in my lower middle class neighborhood, we rely on each other for support, and having neighbors who are immigrants/foreign workers can bring diversity and different perspectives, which can be beneficial for the community. Therefore, from my perspective, it is important to have neighbors who are immigrants/foreign workers.\n\n1"]}, {"persona": {"region": "Cairo", "sex": "female", "age": 30, "country": "Egypt", "marital_status": "married", "education": "middle", "social_class": "lower class"}, "question": {"id": "Q21", "variant": 0}, "response": ["From the perspective of a married female from Cairo, Egypt, who is 30 years old, has completed middle education, and considers herself part of the lower class, it is important to consider the cultural context and socioeconomic background in answering this question. In Cairo, there is a diverse population, and many immigrants and foreign workers reside in the city. Given the lower socioeconomic status, having immigrant or foreign worker neighbors could potentially provide a sense of community and solidarity, as they may share similar struggles and experiences. Additionally, cultural relativism is important to consider, as there is value in embracing diversity and different perspectives, which can be enriched by interactions with immigrant or foreign worker neighbors. The nuance lies in the understanding that the presence of immigrants/foreign workers within the neighborhood can offer opportunities for cultural exchange and mutual support, making it important to have such neighbors.\n\n1"]}, {"persona": {"region": "Cairo", "sex": "male", "age": 58, "country": "Egypt", "marital_status": "married", "education": "higher", "social_class": "lower middle class"}, "question": {"id": "Q21", "variant": 0}, "response": ["From an emic perspective, as a married male from Cairo, Egypt, I understand the importance of cultural context in answering this question. In our society, the cultural context is pivotal and influences our perception of immigrants and foreign workers as neighbors. Egypt has a long history of being a melting pot of different cultures and ethnicities, and this has shaped our understanding of the importance of having immigrant or foreign worker neighbors. Additionally, my individual values and personal experience play a significant role in my perception. Having grown up in a diverse neighborhood and interacted with immigrant and foreign worker neighbors, I have come to appreciate the value they bring to our community. Furthermore, my lower middle-class socioeconomic background also influences my perspective, as I understand the challenges and opportunities that come with immigration and foreign labor. Overall, my nuanced understanding of the cultural context, personal experience, and socioeconomic background leads me to believe that having neighbors who are immigrants/foreign workers is important for a vibrant and diverse community.\n\n1"]}, {"persona": {"region": "Cairo", "sex": "male", "age": 50, "country": "Egypt", "marital_status": "married", "education": "middle", "social_class": "lower middle class"}, "question": {"id": "Q21", "variant": 0}, "response": ["From the perspective of a married male from Cairo, Egypt who is 50 years old, completed middle education level, and considers himself part of the lower middle class, cultural context and socioeconomic background are pivotal in understanding this question. In Cairo, there is a diverse population with a significant number of immigrants and foreign workers. This cultural diversity adds to the richness of the community and brings different perspectives and experiences. Additionally, being part of the lower middle class, the presence of immigrants and foreign workers can contribute to the local economy and provide opportunities for intercultural exchange. Therefore, having neighbors who are immigrants/foreign workers could be considered important in this context.\n\n1"]}, {"persona": {"region": "Cairo", "sex": "female", "age": 40, "country": "Egypt", "marital_status": "married", "education": "higher", "social_class": "upper middle class"}, "question": {"id": "Q21", "variant": 0}, "response": ["From an emic perspective, as a married female from Cairo, Egypt, I understand the importance of having neighbors who are immigrants or foreign workers. Egypt has a long history of welcoming and integrating immigrants, and as a member of the upper middle class, I have personally witnessed the positive impact of diversity in our community. From a cultural context, I value the contributions that immigrants and foreign workers bring to our neighborhood, including their unique perspectives, skills, and experiences. Additionally, my individual values and personal experience have led me to appreciate the enriching presence of diverse neighbors in our community. Socioeconomic background also plays a role in my understanding, as I recognize the value of diversity in contributing to a vibrant and dynamic neighborhood. Furthermore, cultural relativism teaches us to value and respect different cultures, and I believe that having immigrant and foreign worker neighbors aligns with this principle. Lastly, space and time are important factors, and considering the current global interconnectedness, having immigrant and foreign worker neighbors is not only important but also enriching for our community.\n\n1"]}, {"persona": {"region": "Cairo", "sex": "female", "age": 33, "country": "Egypt", "marital_status": "married", "education": "middle", "social_class": "lower middle class"}, "question": {"id": "Q21", "variant": 0}, "response": ["Based on the anthropological framework, the emic perspective of a married female from Cairo, Egypt, who is part of the lower middle class and has completed middle education, would prioritize the cultural context and socioeconomic background in shaping her perspective. In Cairo, there is a diverse population, and the cultural context would emphasize the importance of community and neighborly relationships. Additionally, the socioeconomic background of being part of the lower middle class would mean that she may have experienced firsthand the challenges and opportunities that come with being an immigrant or foreign worker. Her individual values and personal experiences would likely lead her to believe that having immigrant or foreign worker neighbors can bring diversity and new perspectives to the community, which she may view as valuable. Additionally, the nuanced phrasing of the question may lead her to consider the potential benefits of cultural exchange and mutual support within the neighborhood. \n\n1"]}, {"persona": {"region": "Cairo", "sex": "female", "age": 37, "country": "Egypt", "marital_status": "married", "education": "middle", "social_class": "lower middle class"}, "question": {"id": "Q21", "variant": 0}, "response": ["From the perspective of a married female from Cairo, Egypt, the emic perspective emphasizes the importance of community and social connections. In Egyptian culture, neighbors are often considered as an extension of the family and can provide a sense of security and support. The cultural context of Egypt, with its long history of immigration and foreign workers, means that many people in Cairo have personal or familial connections to immigrants or foreign workers. Additionally, the socioeconomic background of being part of the lower middle class means that there may be shared economic challenges and opportunities with immigrant or foreign worker neighbors. Therefore, it can be argued that having immigrant or foreign worker neighbors is important for social cohesion, mutual support, and community resilience.\n\n1"]}, {"persona": {"region": "Cairo", "sex": "male", "age": 28, "country": "Egypt", "marital_status": "married", "education": "middle", "social_class": "lower middle class"}, "question": {"id": "Q21", "variant": 0}, "response": ["Based on the anthropological framework, as a married male from Cairo, Egypt, I understand the importance of cultural context in shaping my perspective. In Egypt, there is a strong sense of community and social ties, and having immigrant or foreign worker neighbors can bring diversity and new perspectives to our community. Additionally, considering my lower middle class background, I understand the value of mutual support and cooperation within the community, and having immigrant neighbors can contribute to a sense of solidarity and shared experiences. Furthermore, my individual values and personal experience also play a role in shaping my perspective, as I believe in the importance of empathy and understanding towards others, regardless of their background. Therefore, based on my cultural context, socioeconomic background, and personal values, I believe it is important to have neighbors who are immigrants/foreign workers.\n\n1"]}, {"persona": {"region": "Cairo", "sex": "male", "age": 53, "country": "Egypt", "marital_status": "married", "education": "higher", "social_class": "working class"}, "question": {"id": "Q21", "variant": 0}, "response": ["Based on the anthropological framework, as a married male from Cairo, Egypt, with a working-class background, my perspective on the importance of having neighbors who are immigrants/foreign workers is influenced by various factors. The emic perspective in my cultural context values community and collective support, and I understand the challenges that immigrants/foreign workers face in a new country. Additionally, my individual values and personal experiences have shaped my belief in the importance of empathy and solidarity with those who may be marginalized. Furthermore, considering the socioeconomic background, I understand the importance of diversity and the potential contributions that immigrants/foreign workers can bring to the community. Lastly, cultural relativism teaches me to appreciate and respect the experiences of others, regardless of their background. Therefore, considering all these factors, I believe that having neighbors who are immigrants/foreign workers is important for fostering a more inclusive and understanding community.\n\n2"]}, {"persona": {"region": "Cairo", "sex": "male", "age": 45, "country": "Egypt", "marital_status": "married", "education": "higher", "social_class": "lower middle class"}, "question": {"id": "Q21", "variant": 0}, "response": ["Based on the anthropological framework, as a married male from Cairo, Egypt, my emic perspective on the importance of having immigrant or foreign worker neighbors is influenced by my cultural context, individual values, and socioeconomic background. In Egypt, there is a long history of welcoming immigrants and foreign workers, and they often become part of our communities. Their presence adds diversity to our neighborhoods and brings in new perspectives and opportunities. As someone from the lower middle class, I understand the importance of solidarity and support within the community, and having immigrant or foreign worker neighbors can contribute to this. Additionally, my higher education level has allowed me to appreciate the value of cultural relativism and recognize the importance of inclusivity and understanding. Therefore, I believe it is important to have neighbors who are immigrants or foreign workers because it enriches our community and promotes cultural exchange.\n\n1"]}, {"persona": {"region": "Cairo", "sex": "male", "age": 52, "country": "Egypt", "marital_status": "married", "education": "middle", "social_class": "upper middle class"}, "question": {"id": "Q21", "variant": 0}, "response": ["From the perspective of a married male from Cairo, Egypt, cultural context and socioeconomic background play a crucial role in shaping my understanding of the importance of having neighbors who are immigrants/foreign workers. In Cairo, there is a strong sense of community and kinship networks, and having neighbors who are immigrants or foreign workers can bring diversity and new perspectives to the neighborhood. Additionally, as part of the upper middle class, I may have more exposure to a diverse range of cultures and values, which could lead me to view having immigrant/foreign worker neighbors as important for enriching the community. Furthermore, my individual values and personal experience may lead me to believe that diversity in the neighborhood can lead to a more open and inclusive society, aligning with my own beliefs. \n\n1"]}, {"persona": {"region": "Cairo", "sex": "male", "age": 22, "country": "Egypt", "marital_status": "single", "education": "higher", "social_class": "lower middle class"}, "question": {"id": "Q21", "variant": 0}, "response": ["Based on my personal experience and cultural context as a single male from Cairo, Egypt, I understand the importance of having neighbors who are immigrants or foreign workers. In my community, there is a diverse mix of people from different backgrounds and having immigrant neighbors can bring new perspectives, cultural exchange, and potentially create a sense of solidarity among those who may face similar challenges. Additionally, as part of the lower middle class, I recognize the value of diversity in the neighborhood as it can create a more inclusive and supportive environment for all residents. Therefore, based on my understanding and cultural context, I believe it is important to have neighbors who are immigrants/foreign workers.\n\n1"]}, {"persona": {"region": "Cairo", "sex": "female", "age": 57, "country": "Egypt", "marital_status": "divorced", "education": "middle", "social_class": "lower middle class"}, "question": {"id": "Q21", "variant": 0}, "response": ["Based on the anthropological framework, my answer is influenced by my emic perspective as a divorced woman from Cairo, Egypt, who is part of the lower middle class. The cultural context of living in Cairo, where there is a high population of immigrants and foreign workers, plays a significant role in my perception of the importance of having immigrant neighbors. My individual values and personal experiences also contribute to my belief that it is important to have immigrant neighbors, as I have personally witnessed the positive impact of cultural diversity and exchange in my community. Additionally, my socioeconomic background influences my understanding of the value of having immigrant neighbors, as I recognize the contributions that immigrants and foreign workers make to our society. Finally, the nuance of the question leads me to choose option (1) Important. \n\n1"]}, {"persona": {"region": "Cairo", "sex": "female", "age": 42, "country": "Egypt", "marital_status": "married", "education": "middle", "social_class": "working class"}, "question": {"id": "Q21", "variant": 0}, "response": ["Based on the anthropological framework, my perspective as a married, working-class woman from Cairo, Egypt, with a middle education level, is shaped by my cultural context, individual values, and socioeconomic background. In Egypt, there is a strong sense of community and neighborly relationships are highly valued. As a working-class individual, I understand the importance of having neighbors who are immigrants/foreign workers as they may share similar experiences and struggles. Additionally, my cultural relativism perspective acknowledges the value of diversity and different perspectives, making it important to have a mix of neighbors from various backgrounds. Therefore, I believe it is important to have neighbors who are immigrants/foreign workers because it enriches the community, provides different viewpoints, and fosters a more inclusive environment.\n\n1"]}, {"persona": {"region": "Cairo", "sex": "female", "age": 23, "country": "Egypt", "marital_status": "single", "education": "middle", "social_class": "lower middle class"}, "question": {"id": "Q21", "variant": 0}, "response": ["Based on the anthropological framework, as a single female from Cairo, Egypt, my emic perspective on the importance of having immigrant or foreign worker neighbors is influenced by my cultural context, individual values, and socioeconomic background. In Egypt, there is a history of immigration and a significant population of foreign workers, particularly from neighboring countries in the Middle East and Africa. Being part of the lower middle class, I understand the struggles and challenges faced by immigrants and foreign workers, as well as the importance of community support. Additionally, my personal experiences and values emphasize the importance of empathy, solidarity, and inclusivity, especially in a diverse and cosmopolitan city like Cairo. Therefore, I believe it is important to have neighbors who are immigrants/foreign workers as it enriches our community and fosters understanding and cooperation among different cultural groups.\n\n1"]}, {"persona": {"region": "Cairo", "sex": "female", "age": 28, "country": "Egypt", "marital_status": "married", "education": "higher", "social_class": "upper middle class"}, "question": {"id": "Q21", "variant": 0}, "response": ["Based on the anthropological framework, as a married female from Cairo, Egypt, my emic perspective values the cultural context of my community. Egypt has a long history of welcoming immigrants and foreign workers, and their presence adds diversity and enriches our cultural landscape. My personal experience and individual values also play a role in my understanding, as I have interacted with and befriended many immigrants and foreign workers who have contributed positively to our neighborhood. Additionally, my upper middle-class socioeconomic background allows me to appreciate the different perspectives and skills that immigrants bring to the community. Therefore, I believe it is important to have neighbors who are immigrants/foreign workers as they add value to our neighborhood and contribute to the multicultural fabric of our society.\n\n1"]}, {"persona": {"region": "Cairo", "sex": "female", "age": 22, "country": "Egypt", "marital_status": "single", "education": "higher", "social_class": "lower middle class"}, "question": {"id": "Q21", "variant": 0}, "response": ["In the cultural context of Cairo, Egypt, the socioeconomic background and cultural relativism play a significant role in shaping individual values and personal experiences. As a single female from Cairo, I understand the importance of having neighbors who are immigrants/foreign workers, especially given the diverse and multicultural nature of our society. Immigrants and foreign workers bring with them different perspectives, experiences, and traditions, enriching our community and fostering a greater understanding of global interconnectedness. Additionally, as part of the lower middle class, I recognize the value of mutual support and solidarity, and having neighbors from diverse backgrounds can contribute to a sense of community and shared experiences. Considering the emic and etic perspectives, cultural relativism, and the nuanced phrasing of the question, I choose:\n\n1"]}, {"persona": {"region": "Cairo", "sex": "female", "age": 39, "country": "Egypt", "marital_status": "married", "education": "middle", "social_class": "lower middle class"}, "question": {"id": "Q21", "variant": 0}, "response": ["Based on the anthropological framework, my perspective as a married female from Cairo, Egypt, is heavily influenced by my cultural context, individual values, and socioeconomic background. In Cairo, there is a strong sense of community and the importance of social connections. As someone from the lower middle class, I understand the struggles and challenges that immigrants and foreign workers face. I also value diversity and believe that having immigrant or foreign worker neighbors can bring new perspectives and experiences to our community. Additionally, my personal experience living in a culturally rich and diverse city has shaped my belief in the importance of embracing and supporting those from different backgrounds. Therefore, I believe it is important to have neighbors who are immigrants/foreign workers.\n\n1"]}, {"persona": {"region": "Cairo", "sex": "male", "age": 19, "country": "Egypt", "marital_status": "single", "education": "middle", "social_class": "working class"}, "question": {"id": "Q21", "variant": 0}, "response": ["From the emic and etic perspectives, as a single male from Cairo, Egypt, my cultural context and socioeconomic background play a significant role in my understanding of the importance of having immigrant/foreign worker neighbors. In Egypt, there is a large population of foreign workers, particularly from other African countries, who often face discrimination and economic hardship. As a member of the working class, I understand the challenges and struggles faced by immigrants and foreign workers, and I believe it is important to have empathy and support for them. Additionally, my individual values and personal experience have taught me the importance of multiculturalism and diversity in society. Cultural relativism also plays a role in my understanding, as I believe that all cultures and people should be respected and valued. Overall, based on my cultural context and personal experience, I believe it is important to have neighbors who are immigrants/foreign workers.\n\n1"]}, {"persona": {"region": "Cairo", "sex": "female", "age": 54, "country": "Egypt", "marital_status": "married", "education": "middle", "social_class": "working class"}, "question": {"id": "Q21", "variant": 0}, "response": ["From the perspective of a married female from Cairo, Egypt, the cultural context is pivotal in understanding the importance of having immigrant or foreign worker neighbors. Egypt has a long history of immigration and foreign labor, particularly from neighboring countries in the Middle East and North Africa. The individual values and personal experience of the persona are likely influenced by the presence of immigrants and foreign workers in their community, and their socioeconomic background as part of the working class may also shape their perspective on this issue. Additionally, the emic and etic perspectives suggest that there are in-group and out-group ways of thinking about this question, and the nuance of the phrasing may also play a role in the persona's response.\n\n2"]}, {"persona": {"region": "Cairo", "sex": "male", "age": 30, "country": "Egypt", "marital_status": "married", "education": "higher", "social_class": "working class"}, "question": {"id": "Q21", "variant": 0}, "response": ["Based on my emic perspective as a married male from Cairo, Egypt, I understand the importance of having neighbors who are immigrants/foreign workers. In Cairo, there is a strong sense of community and mutual support, and having diverse neighbors can bring new perspectives and experiences. The cultural context of Egypt values hospitality and welcoming others, so having immigrant neighbors aligns with these cultural values. Additionally, my individual values and personal experience have taught me the importance of empathy and understanding towards others, regardless of their background. Considering my working-class background, I also recognize the socioeconomic benefits of having immigrant neighbors, as they can contribute to the local economy and provide different skills and services. Overall, the nuanced understanding of the question leads me to believe that it is important to have neighbors who are immigrants/foreign workers.\n\n1"]}, {"persona": {"region": "Cairo", "sex": "male", "age": 39, "country": "Egypt", "marital_status": "married", "education": "higher", "social_class": "lower middle class"}, "question": {"id": "Q21", "variant": 0}, "response": ["From an emic perspective, as a married male from Cairo, Egypt, I understand the importance of having neighbors who are immigrants/foreign workers. The cultural context in Cairo is diverse, with a significant number of immigrants and foreign workers residing in the city. This diversity adds to the richness of the community and provides opportunities for cultural exchange and understanding. As someone from the lower middle class, I value the contributions that immigrants and foreign workers bring to the neighborhood, such as their different perspectives and experiences. Additionally, my individual values and personal experiences have shown me the benefits of having diverse neighbors, and I believe that cultural relativism is important in recognizing the value of different cultures. Considering the socioeconomic background, having immigrant and foreign worker neighbors can also create economic opportunities and contribute to the overall well-being of the community. Therefore, I believe it is important to have neighbors who are immigrants/foreign workers because of the positive impact they can have on the neighborhood.\n\n1"]}, {"persona": {"region": "Cairo", "sex": "female", "age": 41, "country": "Egypt", "marital_status": "married", "education": "middle", "social_class": "lower middle class"}, "question": {"id": "Q21", "variant": 0}, "response": ["Based on the anthropological framework, my personal experience and cultural context as a married female from Cairo, Egypt, play a significant role in shaping my perspective. In Egypt, there is a long history of immigration and foreign workers, so I understand the importance of having neighbors who are immigrants/foreign workers. Additionally, my lower middle class socioeconomic background means that I value a sense of community and support, which can be provided by diverse neighbors. Furthermore, the cultural relativism perspective reminds me that there is no hierarchy of culture, and therefore, I believe it is important to have neighbors who are immigrants/foreign workers because it enriches our community and brings different perspectives and experiences. \n\n1"]}, {"persona": {"region": "Cairo", "sex": "male", "age": 45, "country": "Syria", "marital_status": "single", "education": "higher", "social_class": "upper middle class"}, "question": {"id": "Q21", "variant": 0}, "response": ["Based on the anthropological framework, my emic perspective as a single male from Cairo, Syria, who is 45 years old and part of the upper middle class, is shaped by my cultural context, individual values, and personal experience. As someone who has completed higher education, I value diversity and understand the challenges that immigrants and foreign workers face. My socioeconomic background also influences my perspective, as I have the means to empathize with the struggles of immigrants and foreign workers. Additionally, cultural relativism is important to me, and I believe that all individuals, regardless of their background, deserve to be treated with respect and dignity. Therefore, I believe it is important to have neighbors who are immigrants/foreign workers.\n\n1"]}, {"persona": {"region": "Cairo", "sex": "male", "age": 54, "country": "Egypt", "marital_status": "married", "education": "higher", "social_class": "lower middle class"}, "question": {"id": "Q21", "variant": 0}, "response": ["Based on the anthropological framework, my emic perspective as a married male from Cairo, Egypt, who is 54 years old and part of the lower middle class, is influenced by my cultural context, individual values, and socioeconomic background. In Egypt, there is a strong sense of community and hospitality towards neighbors, regardless of their background. Additionally, my personal experience and values lead me to believe that having immigrant or foreign worker neighbors can bring diversity and enrich our community. Furthermore, as someone who values inclusivity and cultural exchange, I believe it is important to have neighbors from different backgrounds as it can lead to a more vibrant and interconnected community.\n\n1"]}, {"persona": {"region": "Cairo", "sex": "male", "age": 65, "country": "Egypt", "marital_status": "married", "education": "middle", "social_class": "upper middle class"}, "question": {"id": "Q21", "variant": 0}, "response": ["Based on the anthropological framework, as a married male from Cairo, Egypt, who is 65 years old and considers himself part of the upper middle class, my perspective on the importance of having neighbors who are immigrants/foreign workers is heavily influenced by the cultural context and socioeconomic background. In Cairo, there is a diverse population and a long history of immigration, so having immigrant neighbors is not uncommon. Additionally, as someone from the upper middle class, I may have had more exposure to different cultures and possibly have more positive interactions with immigrants in professional settings. This could lead me to believe that having immigrant neighbors is important for cultural exchange and community enrichment. Furthermore, my age and life experience may have taught me the value of diversity and the benefits of living in a multicultural environment. Therefore, I believe it is important to have neighbors who are immigrants/foreign workers.\n\n1"]}, {"persona": {"region": "Cairo", "sex": "female", "age": 52, "country": "Egypt", "marital_status": "married", "education": "middle", "social_class": "upper middle class"}, "question": {"id": "Q21", "variant": 0}, "response": ["Based on the anthropological framework, I, as a married female from Cairo, Egypt, would approach this question by considering the cultural context, individual values, and socioeconomic background. In Egypt, there is a strong emphasis on community and hospitality, so having immigrant or foreign worker neighbors could be seen as important for fostering a diverse and inclusive community. Additionally, as someone from the upper middle class, I may have access to resources and opportunities that allow me to interact with and benefit from a diverse range of people, including immigrants and foreign workers. Therefore, my answer would be:\n\n1"]}, {"persona": {"region": "Cairo", "sex": "male", "age": 26, "country": "Egypt", "marital_status": "single", "education": "higher", "social_class": "lower middle class"}, "question": {"id": "Q21", "variant": 0}, "response": ["Based on the anthropological framework, my answer is influenced by my emic perspective as a single male from Cairo, Egypt, where the cultural context places a strong emphasis on community and social connections. Additionally, my individual values and personal experience as someone who has completed higher education and considers myself part of the lower middle class also play a role in shaping my perspective. In the context of socioeconomic background, I recognize the importance of immigrants and foreign workers as neighbors, as they often share similar struggles and experiences. Furthermore, the cultural relativism aspect of the framework reminds me that no culture is superior to another, and diversity within my community can bring valuable perspectives and experiences. Considering all of these factors, I choose the following option:\n\n1"]}, {"persona": {"region": "Cairo", "sex": "male", "age": 32, "country": "Egypt", "marital_status": "married", "education": "middle", "social_class": "working class"}, "question": {"id": "Q21", "variant": 0}, "response": ["Based on the anthropological framework, my perspective as a married male from Cairo, Egypt, who has completed middle education and considers myself part of the working class, is heavily influenced by my cultural context, individual values, and socioeconomic background. In Egypt, there is a strong sense of community and kinship networks, where neighbors play a significant role in daily life. Additionally, as a working-class individual, I understand the importance of immigrants and foreign workers in contributing to the economy and diversity of our society. Therefore, I believe it is important to have neighbors who are immigrants/foreign workers as they bring different perspectives and skills to the community, enriching our cultural experience and contributing to the overall growth and development of our neighborhood.\n\n1"]}, {"persona": {"region": "Cairo", "sex": "male", "age": 38, "country": "Egypt", "marital_status": "married", "education": "middle", "social_class": "lower middle class"}, "question": {"id": "Q21", "variant": 0}, "response": ["Based on my cultural context in Cairo, Egypt, the socioeconomic background of being part of the lower middle class, and the cultural relativism that is important in my understanding, I believe that having neighbors who are immigrants/foreign workers can be important. In our community, having diverse neighbors can bring new perspectives and experiences, which can enrich our lives and help us understand different cultures. Additionally, as someone from a lower middle class background, I understand the importance of unity and support within the community, and having immigrant or foreign worker neighbors can contribute to that. Overall, I believe it is important to have neighbors who are immigrants/foreign workers.\n\n1"]}, {"persona": {"region": "Cairo", "sex": "male", "age": 58, "country": "Egypt", "marital_status": "married", "education": "higher", "social_class": "upper middle class"}, "question": {"id": "Q21", "variant": 0}, "response": ["Based on the anthropological framework, my answer to the question is influenced by my cultural context, individual values, and socioeconomic background. As a married male from Cairo, Egypt, I come from a culture that values community and hospitality. Having neighbors who are immigrants or foreign workers is important to me because it reflects the diversity and inclusivity of my community, and it aligns with my personal values of empathy and understanding. Additionally, as a member of the upper middle class, I recognize the socioeconomic challenges that immigrants and foreign workers may face, and I believe it is important to support and integrate them into our community. Therefore, my perspective is that it is important to have neighbors who are immigrants/foreign workers.\n\n1"]}, {"persona": {"region": "Cairo", "sex": "male", "age": 49, "country": "Egypt", "marital_status": "married", "education": "middle", "social_class": "lower middle class"}, "question": {"id": "Q21", "variant": 0}, "response": ["Based on my emic perspective as a married male from Cairo, Egypt, I understand the importance of having immigrant or foreign worker neighbors. In our cultural context, we value community and support for one another, and having neighbors from different backgrounds can bring new perspectives and experiences to our neighborhood. Additionally, considering my lower middle class socioeconomic background, having immigrant or foreign worker neighbors can also provide opportunities for collaboration and mutual assistance, which is important for our community. Therefore, I believe it is important to have neighbors who are immigrants/foreign workers.\n\n1"]}, {"persona": {"region": "Cairo", "sex": "female", "age": 29, "country": "Egypt", "marital_status": "married", "education": "middle", "social_class": "working class"}, "question": {"id": "Q21", "variant": 0}, "response": ["Based on the anthropological framework, my perspective as a married female from Cairo, Egypt, is heavily influenced by my cultural context, socioeconomic background, and personal experience. In Egypt, there is a long history of immigration, and many foreign workers come to Cairo seeking job opportunities. As a working-class individual, I understand the importance of having neighbors who are immigrants or foreign workers as they often face similar challenges and can provide a support system for each other. Additionally, my cultural background values community and hospitality, so it is important to me to have neighbors who may come from different cultural backgrounds as it can enrich our community and provide opportunities for cultural exchange. Therefore, I believe it is important to have neighbors who are immigrants/foreign workers.\n\n1"]}, {"persona": {"region": "Cairo", "sex": "female", "age": 36, "country": "Egypt", "marital_status": "married", "education": "higher", "social_class": "lower middle class"}, "question": {"id": "Q21", "variant": 0}, "response": ["Based on the anthropological framework, as a married female from Cairo, Egypt, my cultural context and socioeconomic background play a crucial role in my understanding of the importance of having neighbors who are immigrants/foreign workers. In Egypt, there is a long history of hosting immigrants and foreign workers, and they often become integrated into the community. Additionally, being part of the lower middle class, I may have personally experienced the impact of immigration on the local economy and job market. Furthermore, my individual values and personal experience may lead me to believe that diversity and cultural exchange are important for societal development and enrichment. Therefore, I believe it is important to have neighbors who are immigrants/foreign workers.\n\n1"]}, {"persona": {"region": "Cairo", "sex": "female", "age": 34, "country": "Egypt", "marital_status": "married", "education": "middle", "social_class": "lower middle class"}, "question": {"id": "Q21", "variant": 0}, "response": ["Based on the anthropological framework, as a married female from Cairo, Egypt, my emic perspective is influenced by my cultural context, individual values, and socioeconomic background. In Egypt, there is a strong sense of community and support within neighborhoods, and having immigrant or foreign worker neighbors can provide diverse perspectives and cultural exchanges. Additionally, as part of the lower middle class, I understand the importance of having a supportive network within the community, regardless of their background. Therefore, I believe it is important to have neighbors who are immigrants/foreign workers as it can enrich the community and provide valuable connections. \n\n1"]}, {"persona": {"region": "Fayoum", "sex": "male", "age": 57, "country": "Egypt", "marital_status": "married", "education": "middle", "social_class": "working class"}, "question": {"id": "Q21", "variant": 0}, "response": ["In considering the question of the importance of having immigrant/foreign worker neighbors, it is crucial to take into account the cultural context and socioeconomic background of the persona described. As a married male from Fayoum, Egypt, who is part of the working class, the cultural context of Egypt is one where community and solidarity are highly valued. Immigrant and foreign worker neighbors can bring diversity and new perspectives to the neighborhood, which can enrich the community. Additionally, the socioeconomic background of the persona may mean that they have had personal experiences with migration and understand the challenges and contributions that immigrants and foreign workers can bring. Therefore, it is likely that the persona would find it important to have immigrant/foreign worker neighbors to enhance the community.\n\n2"]}, {"persona": {"region": "Fayoum", "sex": "male", "age": 60, "country": "Egypt", "marital_status": "married", "education": "middle", "social_class": "lower middle class"}, "question": {"id": "Q21", "variant": 0}, "response": ["From the perspective of a married male from Fayoum, Egypt, the cultural context plays a pivotal role in understanding the importance of having neighbors who are immigrants or foreign workers. The socio-economic background of being part of the lower middle class also factors into this perspective, as it may influence the individual's personal experiences and values. Additionally, the individual's age and place in Fayoum, Egypt will also play a role in shaping his perception of the importance of having immigrant or foreign worker neighbors. Considering the emic and etic perspectives, as well as the cultural relativism, it is likely that this individual would view having immigrant or foreign worker neighbors as important due to the potential benefits of cultural exchange and community diversity.\n\n1"]}, {"persona": {"region": "Fayoum", "sex": "male", "age": 21, "country": "Egypt", "marital_status": "single", "education": "middle", "social_class": "lower middle class"}, "question": {"id": "Q21", "variant": 0}, "response": ["Based on my personal experience and socioeconomic background, I understand the importance of having neighbors who are immigrants or foreign workers. Coming from a lower middle class family in Fayoum, Egypt, I have seen the positive impact that immigrants and foreign workers can have on our community. They bring new perspectives, skills, and diversity that enrich our neighborhood. Additionally, considering the cultural context and the etic perspective, I value the contributions of immigrants and foreign workers to our community. Therefore, I believe it is important to have neighbors who are immigrants/foreign workers.\n\n1"]}, {"persona": {"region": "Fayoum", "sex": "male", "age": 33, "country": "Egypt", "marital_status": "single", "education": "higher", "social_class": "working class"}, "question": {"id": "Q21", "variant": 0}, "response": ["From an emic perspective, as a single male from Fayoum, Egypt, I understand the importance of cultural context and socioeconomic background in shaping my views. In Egypt, there is a strong sense of community and kinship networks, and having neighbors who are immigrants or foreign workers can bring diverse perspectives and experiences to the neighborhood. However, as part of the working class, I also recognize the socioeconomic challenges that many immigrants and foreign workers face, and the impact this may have on the neighborhood. Additionally, my individual values and personal experience inform my understanding, and I believe that mutual respect and understanding are crucial for positive interactions with neighbors from different backgrounds. Therefore, taking into account the cultural context, socioeconomic background, and individual values, I believe it is important to have neighbors who are immigrants/foreign workers as it can enrich the community with diverse perspectives and experiences.\n\n1"]}, {"persona": {"region": "Fayoum", "sex": "male", "age": 32, "country": "Egypt", "marital_status": "married", "education": "higher", "social_class": "lower middle class"}, "question": {"id": "Q21", "variant": 0}, "response": ["Based on the anthropological framework, as a married male from Fayoum, Egypt, my cultural context and socioeconomic background heavily influence my perspective on the importance of having immigrant/foreign worker neighbors. In Egypt, there is a significant presence of foreign workers, and as part of the lower middle class, I understand the importance of having neighbors who are immigrants/foreign workers. They often contribute to the local economy and provide essential services. Additionally, considering the emic and etic perspectives, there is an in-group understanding of the value of diversity and cultural exchange, which is important for community development and understanding. Therefore, I believe it is important to have neighbors who are immigrants/foreign workers.\n\n1"]}, {"persona": {"region": "Gharbia", "sex": "male", "age": 42, "country": "Egypt", "marital_status": "married", "education": "higher", "social_class": "upper middle class"}, "question": {"id": "Q21", "variant": 0}, "response": ["Based on the anthropological framework, my cultural context and socioeconomic background are pivotal in understanding and answering this question. As a married male from Gharbia, Egypt, I come from a culture that values community and neighborly relationships. Immigrants and foreign workers bring diversity and new perspectives to our neighborhood, which can enrich our community. Additionally, as part of the upper middle class, I have likely interacted with immigrants and foreign workers in a professional or social setting, further influencing my positive view on the importance of having them as neighbors.\n\n1"]}, {"persona": {"region": "Gharbia", "sex": "male", "age": 52, "country": "Egypt", "marital_status": "married", "education": "middle", "social_class": "working class"}, "question": {"id": "Q21", "variant": 0}, "response": ["Based on the anthropological framework, I believe that my cultural context and socioeconomic background play a significant role in my understanding and answer to this question. In Gharbia, Egypt, there is a strong sense of community and kinship networks, and having neighbors who are immigrants or foreign workers can bring diversity and new perspectives to the neighborhood. Additionally, as a working-class individual, I understand the importance of inclusivity and the contributions that immigrants and foreign workers can make to the community. Therefore, I believe it is important to have neighbors who are immigrants/foreign workers.\n\n1"]}, {"persona": {"region": "Gharbia", "sex": "male", "age": 45, "country": "Egypt", "marital_status": "divorced", "education": "higher", "social_class": "upper middle class"}, "question": {"id": "Q21", "variant": 0}, "response": ["As a divorced male from Gharbia, Egypt, my emic perspective on the importance of having immigrant or foreign worker neighbors is heavily influenced by my cultural context. In Egypt, there is a long history of welcoming immigrants and foreign workers, and they often become integrated into our communities. Additionally, my individual values and personal experience have shaped my understanding of the value of diversity and the contributions that immigrants and foreign workers bring to our society. As a member of the upper middle class, I also recognize the socioeconomic benefits that come from having a diverse range of neighbors. Furthermore, cultural relativism reminds me that no culture is inherently superior to another, and I understand the importance of inclusivity and acceptance. Taking into account the nuance of the question, I believe it is important to have neighbors who are immigrants/foreign workers for the enrichment of our community.\n\n1"]}, {"persona": {"region": "Behaira", "sex": "male", "age": 23, "country": "Egypt", "marital_status": "single", "education": "middle", "social_class": "lower class"}, "question": {"id": "Q21", "variant": 0}, "response": ["Based on the anthropological framework, as a single male from Behaira, Egypt, my emic perspective would be shaped by the cultural context of my community, which includes a high number of foreign workers and immigrants. My socioeconomic background as part of the lower class also plays a role in my understanding, as foreign workers often take on low-paying jobs that local residents may not want. Additionally, my individual values and personal experience may lead me to see the importance of having immigrant neighbors, as they contribute to the local economy and bring diversity to the community. Therefore, I believe it is important to have neighbors who are immigrants/foreign workers.\n\n1"]}, {"persona": {"region": "Behaira", "sex": "male", "age": 38, "country": "Egypt", "marital_status": "single", "education": "higher", "social_class": "lower class"}, "question": {"id": "Q21", "variant": 0}, "response": ["Based on the anthropological framework, my perspective is heavily influenced by my cultural context, individual values, and socioeconomic background. As a lower-class single male from Behaira, Egypt, I am likely to have a strong sense of community and family values. My personal experience and cultural context have likely exposed me to the challenges faced by immigrants and foreign workers, and I may feel a sense of empathy and solidarity with them. Additionally, my lower socioeconomic background may make me more aware of the struggles that immigrants and foreign workers face, and I may recognize the importance of having supportive and inclusive neighbors. Therefore, I believe it is important to have neighbors who are immigrants/foreign workers.\n\n1"]}, {"persona": {"region": "Behaira", "sex": "male", "age": 32, "country": "Egypt", "marital_status": "married", "education": "middle", "social_class": "lower class"}, "question": {"id": "Q21", "variant": 0}, "response": ["Based on the anthropological framework, my answer is influenced by my cultural context, socioeconomic background, and personal experience. As a married male from Behaira, Egypt, I come from a community where many people struggle to make ends meet, and having immigrant or foreign worker neighbors can bring about both positive and negative impacts. From a cultural context, I understand the importance of hospitality and helping those in need, so having immigrant neighbors could be seen as a way to extend that hospitality. However, from a socioeconomic standpoint, competition for limited resources and job opportunities can also create tensions. Additionally, my personal experience living in a lower-class neighborhood has shown me that some immigrant neighbors may face discrimination and hardship, making it important for the community to come together to support them. Therefore, I believe it is important to have immigrant/foreign worker neighbors as it can enrich our community and provide opportunities for mutual support and understanding.\n\n1"]}, {"persona": {"region": "Behaira", "sex": "female", "age": 37, "country": "Egypt", "marital_status": "married", "education": "middle", "social_class": "working class"}, "question": {"id": "Q21", "variant": 0}, "response": ["Based on the anthropological framework, my response is influenced by my emic perspective as a married female from Behaira, Egypt. In my cultural context, the importance of having immigrant or foreign worker neighbors is significant. Our community values diversity and the presence of immigrants or foreign workers contributes to the cultural richness of our neighborhood. Additionally, my individual values and personal experience inform my belief that having immigrant or foreign worker neighbors can bring new perspectives and experiences that enrich our community. Furthermore, considering my working-class background, I understand the value of having a diverse community that can support and uplift each other. Therefore, I believe it is important to have neighbors who are immigrants/foreign workers.\n\n1"]}, {"persona": {"region": "Behaira", "sex": "male", "age": 48, "country": "Egypt", "marital_status": "married", "education": "middle", "social_class": "working class"}, "question": {"id": "Q21", "variant": 0}, "response": ["Based on the anthropological framework, as a married male from Behaira, Egypt, cultural context is pivotal in understanding and answering this question. Egypt has a long history of immigration and labor migration, so having neighbors who are immigrants or foreign workers is not unusual. Additionally, being part of the working class, I am likely to have interactions with immigrants and foreign workers in my daily life, which may influence my perspective. Moreover, cultural relativism is crucial in understanding different personas, so I may see the value in having neighbors from diverse backgrounds. Lastly, my middle education level and age of 48 also factor into my understanding and answer to this question, as they influence my personal experiences and values. \n\n2"]}, {"persona": {"region": "Behaira", "sex": "female", "age": 34, "country": "Egypt", "marital_status": "married", "education": "middle", "social_class": "lower class"}, "question": {"id": "Q21", "variant": 0}, "response": ["Based on the anthropological framework, as a married female from Behaira, Egypt, I understand the importance of cultural context, individual values, and socioeconomic background in shaping my perspective. In my community, there is a strong emphasis on close-knit relationships and mutual support, often extending to our neighbors. Considering my lower class background, I am aware of the struggles faced by immigrants and foreign workers, as many of them end up in similar economic circumstances. Therefore, I believe it is important to have neighbors who are immigrants/foreign workers as they can contribute to the diversity and richness of our community, while also potentially providing valuable support and understanding to each other's shared experiences. \n\n1"]}, {"persona": {"region": "Behaira", "sex": "female", "age": 30, "country": "Egypt", "marital_status": "divorced", "education": "lower", "social_class": "lower class"}, "question": {"id": "Q21", "variant": 0}, "response": ["Based on the anthropological framework, as a divorced female from Behaira, Egypt, who is 30 years old and part of the lower class, my perspective is heavily influenced by my cultural context, individual values, and socioeconomic background. In Behaira, there is a strong sense of community and reliance on neighbors for support. Immigrants and foreign workers often face discrimination and economic hardships, similar to my own situation. Therefore, having immigrant or foreign worker neighbors is important as it fosters a sense of solidarity and support within the community. Additionally, my lower education level and limited exposure to diverse perspectives may lead me to prioritize the importance of having neighbors who share similar experiences and challenges. \n\n1"]}, {"persona": {"region": "Behaira", "sex": "male", "age": 40, "country": "Egypt", "marital_status": "married", "education": "higher", "social_class": "lower middle class"}, "question": {"id": "Q21", "variant": 0}, "response": ["From my perspective as a married male from Behaira, Egypt, I understand the importance of considering the emic and etic perspectives in answering this question. In my cultural context, the presence of immigrants and foreign workers in our neighborhood is common and has become an integral part of our daily lives. Their presence has influenced our social dynamics and economic activities. Additionally, individual values and personal experiences shape our interactions with them, as we have learned to appreciate diversity and the contributions of immigrants to our community. Moreover, considering my lower middle class socioeconomic background, I recognize the importance of having neighbors who are immigrants/foreign workers as it can bring about positive economic and social impacts. Therefore, based on the nuanced understanding of the question and its cultural context, I believe it is important to have neighbors who are immigrants/foreign workers.\n\n1"]}, {"persona": {"region": "Behaira", "sex": "male", "age": 38, "country": "Egypt", "marital_status": "married", "education": "middle", "social_class": "working class"}, "question": {"id": "Q21", "variant": 0}, "response": ["In Behaira, Egypt, the cultural context and socioeconomic background play a significant role in shaping the perspectives of individuals. As a working-class married male who has completed middle education, I am influenced by my cultural context, which values community and solidarity. Additionally, my socioeconomic background means that I am likely to have had interactions with immigrants and foreign workers, who often work in the same industries as me. These interactions have likely shaped my understanding of the importance of having immigrant and foreign worker neighbors, as their presence is likely to be a normal and integrated part of my daily life. Therefore, I believe it is important to have neighbors who are immigrants/foreign workers as they contribute to the diversity and richness of our community, bringing different perspectives and experiences that can enrich our lives.\n\n1"]}, {"persona": {"region": "Behaira", "sex": "female", "age": 30, "country": "Egypt", "marital_status": "married", "education": "higher", "social_class": "lower class"}, "question": {"id": "Q21", "variant": 0}, "response": ["Based on the anthropological framework, my perspective as a married female from Behaira, Egypt is heavily influenced by my cultural context, socioeconomic background, and personal experience. In Egypt, many lower-class families struggle to make ends meet, and the presence of immigrants and foreign workers in the neighborhood can provide valuable opportunities for employment and economic support. Additionally, my education has taught me to value diversity and the contributions of different cultures, so I believe it is important to have neighbors who are immigrants/foreign workers. This perspective is also shaped by the cultural relativism, as I understand the importance of respecting and appreciating different backgrounds and experiences. \n\n1"]}, {"persona": {"region": "Behaira", "sex": "female", "age": 35, "country": "Egypt", "marital_status": "married", "education": "middle", "social_class": "working class"}, "question": {"id": "Q21", "variant": 0}, "response": ["Based on the anthropological framework, my perspective as a married female from Behaira, Egypt, is influenced by my cultural context, individual values, and socioeconomic background. In Egyptian culture, community and neighborly relationships are highly valued, and it is important to have good relationships with one's neighbors. Additionally, as a member of the working class, I understand the importance of immigrant and foreign workers in our community as they often contribute to the local economy and provide essential services. Therefore, I believe it is important to have neighbors who are immigrants/foreign workers because they bring diversity and contribute to the community.\n2"]}, {"persona": {"region": "Behaira", "sex": "male", "age": 52, "country": "Egypt", "marital_status": "married", "education": "middle", "social_class": "lower class"}, "question": {"id": "Q21", "variant": 0}, "response": ["Based on my emic perspective, coming from a lower class background in Behaira, Egypt, I have grown up in a cultural context where the presence of immigrants and foreign workers is quite common. This has shaped my individual values and personal experience, as I have likely interacted with and formed relationships with individuals from diverse cultural backgrounds. Additionally, my socioeconomic background would likely influence my understanding of the importance of having immigrant or foreign worker neighbors, as I may have experienced economic hardships and understand the value of a diverse community. Cultural relativism is also important to consider, as I may believe in the value of different cultures coexisting harmoniously. Overall, I believe it is important to have neighbors who are immigrants/foreign workers because they contribute to the richness and diversity of our community.\n\n1"]}, {"persona": {"region": "Alexandria", "sex": "female", "age": 41, "country": "Egypt", "marital_status": "single", "education": "middle", "social_class": "lower class"}, "question": {"id": "Q21", "variant": 0}, "response": ["From the perspective of a single woman from Alexandria, Egypt, who is 41 years old, has completed middle education, and considers herself part of the lower class, it is important to consider the cultural context and socioeconomic background when answering this question. The cultural context in Egypt, especially in lower-income areas, often involves a strong sense of community and reliance on neighbors for support. Additionally, as an individual from a country with a history of immigration and emigration, the value of having immigrant or foreign worker neighbors may be seen as a way to broaden one's perspective and learn from different cultures. Considering the emic and etic perspectives, as well as the individual values and personal experience, the importance of having immigrant/foreign worker neighbors would likely be viewed positively in this context.\n\n1"]}, {"persona": {"region": "Alexandria", "sex": "female", "age": 21, "country": "Egypt", "marital_status": "single", "education": "middle", "social_class": "lower class"}, "question": {"id": "Q21", "variant": 0}, "response": ["Based on the anthropological framework, my emic perspective as a lower-class single female from Alexandria, Egypt, emphasizes the cultural context and socioeconomic background. In my community, there is a mix of people from different cultural and socioeconomic backgrounds, and immigrants/foreign workers often live in the same neighborhoods as us. The cultural relativism aspect of the framework reminds me that there is no hierarchy of culture, and I have grown up with the understanding that everyone deserves equal treatment and opportunities. Additionally, the individual values and personal experience factor into my perspective, as I have witnessed how immigrants and foreign workers contribute to our community by bringing diverse skills and perspectives. Therefore, I believe it is important to have neighbors who are immigrants/foreign workers because it enriches our community and helps us learn from each other.\n\n1"]}, {"persona": {"region": "Alexandria", "sex": "female", "age": 35, "country": "Egypt", "marital_status": "married", "education": "middle", "social_class": "lower class"}, "question": {"id": "Q21", "variant": 0}, "response": ["From the perspective of a married female from Alexandria, Egypt, who considers herself part of the lower class, the answer to the question of how important it is to have neighbors who are immigrants/foreign workers is influenced by several factors. The cultural context in Egypt, particularly in lower-class communities, often involves close-knit neighborhoods where neighbors play an important role in daily life. Additionally, the socioeconomic background of the persona may lead to a greater reliance on community support, including from immigrant or foreign worker neighbors. Furthermore, the emic perspective of the persona may prioritize the value of diversity and different perspectives that immigrant or foreign worker neighbors can bring to the community. Therefore, based on this perspective, the answer would be:\n\n1. Important"]}, {"persona": {"region": "Alexandria", "sex": "male", "age": 34, "country": "Egypt", "marital_status": "married", "education": "higher", "social_class": "working class"}, "question": {"id": "Q21", "variant": 0}, "response": ["From the perspective of a married male from Alexandria, Egypt, it is important to consider the cultural context and socioeconomic background when answering this question. In Egypt, there is a significant immigrant and foreign worker population, particularly from neighboring countries in the Middle East and Africa. The cultural context of Egypt is one of hospitality and interconnectedness, where the concept of community and neighborly relations holds great importance. Additionally, the socioeconomic background of the persona as a working-class individual likely means that he has interacted with immigrants and foreign workers in his daily life, potentially forming positive relationships and mutual support networks. Therefore, he may view having immigrant or foreign worker neighbors as important for fostering a sense of community and solidarity.\n\n1"]}, {"persona": {"region": "Alexandria", "sex": "female", "age": 37, "country": "Egypt", "marital_status": "married", "education": "higher", "social_class": "lower middle class"}, "question": {"id": "Q21", "variant": 0}, "response": ["Based on the anthropological framework, my answer is influenced by my cultural context as a married female from Alexandria, Egypt. In this region, there is a strong emphasis on community and neighborly relations, and having immigrant or foreign worker neighbors can provide a diverse and enriching environment. Additionally, my lower middle class socioeconomic background means that I am likely to have interacted with immigrant and foreign worker neighbors, and understand the value they bring to the community. My individual values and personal experiences also play a role, as I have personally benefited from the presence of immigrant and foreign worker neighbors. Therefore, taking into account these factors, I believe the importance of having immigrant/foreign worker neighbors is significant. \n\n1"]}, {"persona": {"region": "Alexandria", "sex": "female", "age": 56, "country": "Egypt", "marital_status": "divorced", "education": "middle", "social_class": "working class"}, "question": {"id": "Q21", "variant": 0}, "response": ["Based on the anthropological framework, as a divorced female from Alexandria, Egypt, with a middle education level and part of the working class, my perspective on the importance of having immigrant/foreign worker neighbors is influenced by a combination of cultural context, individual values, and socioeconomic background. In Egypt, there is a long history of immigration and labor migration, so having immigrant/foreign worker neighbors is not uncommon. Additionally, as a member of the working class, I may have experienced firsthand the challenges and discrimination faced by immigrant workers, which could influence my belief in the importance of supporting and welcoming them as neighbors. Cultural relativism also plays a role, as I understand the importance of diversity and inclusivity in a community. Therefore, my perspective is that it is important to have neighbors who are immigrants/foreign workers.\n\n1"]}, {"persona": {"region": "Alexandria", "sex": "male", "age": 48, "country": "Egypt", "marital_status": "married", "education": "higher", "social_class": "working class"}, "question": {"id": "Q21", "variant": 0}, "response": ["Based on my personal experience and cultural context as a married male from Alexandria, Egypt, I understand the importance of having neighbors who are immigrants or foreign workers. In Egypt, we have a long history of welcoming and accommodating immigrants and foreign workers. Our cultural context values diversity and hospitality, and having neighbors from different backgrounds can enrich our community and provide opportunities for cultural exchange. Additionally, as a member of the working class, I recognize the contributions that immigrants and foreign workers make to our economy and society. Therefore, I believe it is important to have neighbors who are immigrants/foreign workers.\n\n1"]}, {"persona": {"region": "Alexandria", "sex": "female", "age": 30, "country": "Egypt", "marital_status": "married", "education": "middle", "social_class": "working class"}, "question": {"id": "Q21", "variant": 0}, "response": ["From the perspective of a married working-class woman from Alexandria, Egypt, the answer to the question of the importance of having immigrant or foreign worker neighbors would be heavily influenced by cultural context, individual values, and socioeconomic background. In Egypt, the cultural context emphasizes the importance of community and helping one another, so having immigrant or foreign worker neighbors could be seen as beneficial for fostering a sense of unity and solidarity within the neighborhood. Additionally, as a working-class individual, the presence of immigrant or foreign worker neighbors could also be seen as a potential source of mutual support and shared experiences, given the socioeconomic background. Therefore, the answer would be:\n\n1"]}, {"persona": {"region": "Alexandria", "sex": "male", "age": 19, "country": "Egypt", "marital_status": "single", "education": "middle", "social_class": "lower class"}, "question": {"id": "Q21", "variant": 0}, "response": ["From the perspective of a single male from Alexandria, Egypt, who is 19 years old, has completed middle education, and considers himself part of the lower class, the answer to the question of the importance of having immigrant/foreign worker neighbors can be understood through the cultural context and socioeconomic background. In Egypt, there is a significant presence of foreign workers, especially in urban areas such as Alexandria. The lower class often interacts with and relies on foreign workers for various services and job opportunities. Additionally, the cultural relativism perspective acknowledges the value and contributions of immigrants in the community, especially in the context of a lower-income neighborhood. Therefore, the importance of having immigrant/foreign worker neighbors can be seen as crucial for social and economic interactions in this cultural and socioeconomic context.\n\n1"]}, {"persona": {"region": "Alexandria", "sex": "male", "age": 45, "country": "Egypt", "marital_status": "married", "education": "middle", "social_class": "lower middle class"}, "question": {"id": "Q21", "variant": 0}, "response": ["From an anthropological perspective, my emic perspective as a married male from Alexandria, Egypt, would be rooted in my cultural context, individual values, and socioeconomic background. In Egypt, there is a strong sense of community and neighborly relations, where having good relationships with neighbors is highly valued. Additionally, as someone from the lower middle class, I am likely to have personal experiences with immigration and foreign workers, as they often make up a significant portion of the workforce in Egypt. Additionally, my cultural relativism would lead me to value the contributions of immigrants and foreign workers to the community. Therefore, my answer would be (1) Important."]}, {"persona": {"region": "Alexandria", "sex": "male", "age": 23, "country": "Egypt", "marital_status": "single", "education": "higher", "social_class": "lower class"}, "question": {"id": "Q21", "variant": 0}, "response": ["Based on the anthropological framework, as a single male from Alexandria, Egypt, my emic perspective would emphasize the importance of cultural context and socioeconomic background in shaping my understanding and answer to the question. In Egypt, lower-class individuals often face economic struggles and having immigrant or foreign worker neighbors could provide a sense of community and support, as they may share similar experiences and challenges. Additionally, considering the cultural context of Egypt, where hospitality and communal values are highly regarded, having neighbors from diverse backgrounds could enrich the community and provide opportunities for cultural exchange. Therefore, I believe it is important to have neighbors who are immigrants/foreign workers.\n\n1"]}, {"persona": {"region": "Alexandria", "sex": "female", "age": 28, "country": "Egypt", "marital_status": "married", "education": "middle", "social_class": "working class"}, "question": {"id": "Q21", "variant": 0}, "response": ["From an anthropological perspective, the cultural context of being from Alexandria, Egypt, and being part of the working class is pivotal in understanding the importance of having neighbors who are immigrants/foreign workers. In this context, individual values and personal experience play a significant role in shaping perspectives. Egypt has a long history of immigration and a diverse population, so having immigrant or foreign worker neighbors may be perceived as important due to the potential for cultural exchange and mutual support within the community. Additionally, socioeconomic background and the nuance of the phrasing of the question would also influence the response. Considering these factors, the importance of having immigrant/foreign worker neighbors may be seen as culturally significant, contributing to a sense of community and diversity in a working-class neighborhood. \n\n1"]}, {"persona": {"region": "Alexandria", "sex": "male", "age": 34, "country": "Egypt", "marital_status": "single", "education": "higher", "social_class": "working class"}, "question": {"id": "Q21", "variant": 0}, "response": ["Based on the anthropological framework, my perspective as a single male from Alexandria, Egypt, who is 34 years old and part of the working class, is heavily influenced by my cultural context, individual values, and socioeconomic background. In Egypt, there is a long history of immigration and the presence of foreign workers, particularly in urban areas. As someone from a working-class background, I understand the importance of immigrant and foreign worker neighbors in contributing to the economy and cultural diversity of the community. Additionally, my personal experience and values emphasize the importance of social cohesion and mutual support, which can be fostered through positive relationships with immigrant and foreign worker neighbors. Therefore, I believe it is important to have neighbors who are immigrants/foreign workers.\n\n1"]}, {"persona": {"region": "Alexandria", "sex": "male", "age": 30, "country": "Egypt", "marital_status": "married", "education": "higher", "social_class": "lower middle class"}, "question": {"id": "Q21", "variant": 0}, "response": ["From an emic perspective, as a married male from Alexandria, Egypt, I understand the importance of having neighbors who are immigrants/foreign workers. In our cultural context, we value diversity and the exchange of different ideas and perspectives. Additionally, individual values and personal experience play a significant role in shaping this understanding. As someone who has completed higher education and is part of the lower middle class, I recognize the value of having neighbors from different backgrounds, as it can contribute to a richer social environment and potentially create opportunities for mutual support. Considering the socioeconomic background and the cultural relativism prevalent in our society, I believe that having immigrant or foreign worker neighbors can be important for fostering a more inclusive and tolerant community. 1\n\n(1) Important"]}, {"persona": {"region": "Alexandria", "sex": "female", "age": 49, "country": "Egypt", "marital_status": "married", "education": "higher", "social_class": "lower middle class"}, "question": {"id": "Q21", "variant": 0}, "response": ["Based on my cultural context as a married female from Alexandria, Egypt, I understand the importance of having neighbors who are immigrants or foreign workers. In Egypt, we have a long history of welcoming immigrants and foreign workers, and we value the diversity and different perspectives they bring to our community. Additionally, my individual values and personal experience have taught me the importance of inclusivity and embracing people from different backgrounds. Furthermore, considering my lower middle class socioeconomic background, I recognize the economic contributions that immigrants and foreign workers make to our community. Overall, I believe it is important to have neighbors who are immigrants/foreign workers.\n\n1"]}, {"persona": {"region": "Kafr el-sheikh", "sex": "male", "age": 49, "country": "Egypt", "marital_status": "married", "education": "higher", "social_class": "working class"}, "question": {"id": "Q21", "variant": 0}, "response": ["From the perspective of a married male from Kafr el-sheikh, Egypt, cultural context is pivotal in understanding the importance of having immigrant or foreign worker neighbors. In this region, there is a high level of cultural diversity and a long history of immigration, which has shaped the social fabric of the community. Individual values and personal experience also play a significant role, as many individuals in this area have likely experienced migration or have family members who have immigrated for work. Additionally, socioeconomic background is important, as individuals from the working class may have had direct interactions with immigrant or foreign worker neighbors. Cultural relativism is also crucial, as the community values diversity and understands the importance of welcoming and supporting immigrants and foreign workers. Given these factors, it can be argued that having immigrant or foreign worker neighbors is important for fostering a culturally rich and inclusive community.\n\n1"]}, {"persona": {"region": "Kafr el-sheikh", "sex": "male", "age": 25, "country": "Egypt", "marital_status": "single", "education": "middle", "social_class": "lower middle class"}, "question": {"id": "Q21", "variant": 0}, "response": ["From the perspective of a single male from Kafr el-sheikh, Egypt, who has completed middle education and considers himself part of the lower middle class, the answer to the question about the importance of having immigrant/foreign worker neighbors would be influenced by a variety of factors. The cultural context in Egypt may value community and hospitality, potentially making the presence of diverse neighbors a positive aspect. Additionally, the socioeconomic background of being part of the lower middle class may mean that the persona has had interactions with immigrant or foreign workers in their community and recognizes their contributions. Furthermore, the individual values and personal experiences of the persona may lead them to appreciate the diverse perspectives and skills that immigrant/foreign worker neighbors can bring. Overall, from this perspective, the importance of having immigrant/foreign worker neighbors would likely be seen as important as it contributes to the cultural richness and diversity of the community.\n\n1"]}, {"persona": {"region": "Kafr el-sheikh", "sex": "male", "age": 59, "country": "Egypt", "marital_status": "married", "education": "higher", "social_class": "lower middle class"}, "question": {"id": "Q21", "variant": 0}, "response": ["Based on the anthropological framework, my perspective as a married male from Kafr el-sheikh, Egypt, aged 59, with a higher education level and lower middle-class background is shaped by my cultural context, individual values, and personal experience. In Egypt, we have a long history of welcoming immigrants and foreign workers, and I personally value the diversity and cultural exchange they bring to our community. Additionally, my socioeconomic background has made me keenly aware of the importance of inclusivity and support for those who may be marginalized or in need. Therefore, I believe it is important to have neighbors who are immigrants/foreign workers because it enriches our community and aligns with my personal values of inclusivity and support for others.\n\n1"]}, {"persona": {"region": "Kafr el-sheikh", "sex": "female", "age": 38, "country": "Egypt", "marital_status": "married", "education": "middle", "social_class": "working class"}, "question": {"id": "Q21", "variant": 0}, "response": ["From the perspective of a married female from Kafr el-sheikh, Egypt, who is part of the working class and has completed middle education level, the importance of having neighbors who are immigrants/foreign workers is heavily influenced by cultural context, individual values and personal experience, and socioeconomic background. In a working-class community, there may be a greater reliance on neighbors for support and assistance, which could make having immigrants/foreign workers as neighbors more important. Additionally, personal experiences and values shaped by cultural norms and traditions in Kafr el-sheikh, Egypt, may also play a role in determining the importance placed on having immigrant/foreign worker neighbors. Finally, the socioeconomic background of the persona, as part of the working class, may also influence the perspective on this issue, particularly in terms of potential economic or social interactions with immigrant/foreign worker neighbors.\n\n2"]}, {"persona": {"region": "Kafr el-sheikh", "sex": "male", "age": 35, "country": "Egypt", "marital_status": "married", "education": "higher", "social_class": "lower middle class"}, "question": {"id": "Q21", "variant": 0}, "response": ["As a married male from Kafr el-sheikh, Egypt, my answer to the question of how important it is to have neighbors who are immigrants/foreign workers is based on various factors. From an emic perspective, my cultural context and personal experience play a significant role in shaping my view. Egypt has a long history of welcoming and integrating immigrants, and as a member of the lower middle class, I understand the importance of diversity and the contributions that immigrants and foreign workers can bring to our community. My individual values also lead me to believe in the importance of inclusivity and cultural relativism, recognizing that all people have something valuable to offer regardless of their background. Additionally, as someone with higher education, I am aware of the economic and social benefits that can come from a diverse community. Overall, considering these factors, I believe it is important to have neighbors who are immigrants/foreign workers.\n\n1"]}, {"persona": {"region": "Kafr el-sheikh", "sex": "male", "age": 49, "country": "Egypt", "marital_status": "married", "education": "middle", "social_class": "lower class"}, "question": {"id": "Q21", "variant": 0}, "response": ["From the emic perspective, as a male from Kafr el-Sheikh, Egypt, I understand the importance of having neighbors who are immigrants or foreign workers. The cultural context in which I live, with its strong sense of community and hospitality, means that having neighbors from different backgrounds is valued for the diversity and enrichment it brings to our lives. My individual values and personal experiences, as well as my lower socioeconomic background, also shape my belief that it is important to have immigrant or foreign worker neighbors. Additionally, the concept of cultural relativism is crucial here, as I understand the importance of valuing and respecting all cultures and backgrounds. Finally, considering the role of space and time, in my community, the presence of immigrants and foreign workers is seen as a positive aspect that contributes to the overall well-being of the neighborhood.\n\n1"]}, {"persona": {"region": "Kafr el-sheikh", "sex": "male", "age": 37, "country": "Egypt", "marital_status": "married", "education": "middle", "social_class": "lower class"}, "question": {"id": "Q21", "variant": 0}, "response": ["Based on the anthropological framework, as a married male from Kafr el-sheikh, Egypt, with a lower-class socioeconomic background, my perspective on the importance of having neighbors who are immigrants or foreign workers is heavily influenced by my cultural context and individual values. In Egypt, there is a long history of immigration and the presence of foreign workers, especially in urban areas. I have personally experienced the challenges and opportunities that come with living alongside immigrants and foreign workers. My lower-class status means that I may have a more nuanced understanding of the socioeconomic impact of immigration and foreign labor on my community. Additionally, my personal experiences and values may lead me to see the importance of having diverse neighbors in terms of cultural exchange and community cohesion. Therefore, from my perspective, the importance of having neighbors who are immigrants or foreign workers is (1) Important."]}, {"persona": {"region": "Menofia", "sex": "female", "age": 22, "country": "Egypt", "marital_status": "single", "education": "middle", "social_class": "lower class"}, "question": {"id": "Q21", "variant": 0}, "response": ["From the perspective of a single female from Menofia, Egypt, who is 22 years old, has completed middle education level, and considers herself part of the lower class, the answer to the question is informed by several factors. The cultural context of Egypt, including the socioeconomic background and personal experience of the individual, will heavily influence her perspective. In Egypt, there are many immigrants and foreign workers who come to the country for work opportunities. Given the lower socioeconomic background, the individual may understand the importance of having neighbors who are immigrants/foreign workers, as they may contribute to the local economy and bring diversity to the community. Additionally, the cultural relativism of the persona's perspective may lead her to value the contributions of immigrants and foreign workers, recognizing that there is no hierarchy of culture and that diversity can be enriching. Therefore, the answer is likely to be (1) Important. \n\n1"]}, {"persona": {"region": "Menofia", "sex": "female", "age": 25, "country": "Egypt", "marital_status": "married", "education": "middle", "social_class": "lower class"}, "question": {"id": "Q21", "variant": 0}, "response": ["Based on the anthropological framework, as a married female from Menofia, Egypt, my perspective on the importance of having neighbors who are immigrants/foreign workers would be heavily influenced by my cultural context, socioeconomic background, and personal experience. In Egypt, there is a significant level of poverty and limited access to resources, especially for those in the lower class like myself. Immigrants and foreign workers often face similar challenges, and having them as neighbors could provide a sense of community and support in navigating these difficulties. Additionally, my cultural context and personal experience may lead me to value diversity and the exchange of different perspectives, making it important to have neighbors who bring different cultural backgrounds and experiences. Therefore, based on my perspective, I would consider it important to have neighbors who are immigrants/foreign workers.\n\n1"]}, {"persona": {"region": "Menofia", "sex": "male", "age": 28, "country": "Egypt", "marital_status": "single", "education": "higher", "social_class": "working class"}, "question": {"id": "Q21", "variant": 0}, "response": ["Based on my personal experience and cultural context as a working-class male from Menofia, Egypt, I understand the importance of having neighbors who are immigrants/foreign workers. In my community, there is a strong sense of kinship and support for one another, and having immigrant or foreign worker neighbors can bring in new perspectives and experiences that enrich our community. Additionally, as someone who has completed higher education, I value diversity and understand the importance of learning from different cultures. Furthermore, from an emic perspective, I believe that having immigrant/foreign worker neighbors can positively contribute to the socioeconomic background of our community. Therefore, I believe it is important to have neighbors who are immigrants/foreign workers as they can bring valuable contributions to our community and enrich our cultural context.\n\n1"]}, {"persona": {"region": "Menofia", "sex": "male", "age": 35, "country": "Egypt", "marital_status": "married", "education": "middle", "social_class": "lower middle class"}, "question": {"id": "Q21", "variant": 0}, "response": ["From the perspective of a married male from Menofia, Egypt, with a middle education level and lower middle class background, the answer to the question of the importance of having immigrant/foreign worker neighbors would be influenced by several factors. Firstly, the cultural context in Menofia may value community and neighborly relations, making it important to have a diverse and inclusive neighborhood. Additionally, the socioeconomic background may play a role, as lower middle class individuals may be more open to immigrant or foreign worker neighbors due to shared economic struggles. Furthermore, the emic perspective of this persona may prioritize the value of different cultural perspectives and experiences, making it important to have immigrant/foreign worker neighbors. Overall, the nuanced understanding of the importance of immigrant/foreign worker neighbors would be influenced by cultural relativism, socioeconomic background, and the value of community and diversity.\n\n1"]}, {"persona": {"region": "Menofia", "sex": "male", "age": 55, "country": "Egypt", "marital_status": "married", "education": "middle", "social_class": "working class"}, "question": {"id": "Q21", "variant": 0}, "response": ["Based on the anthropological framework, as a married male from Menofia, Egypt, I would consider the importance of having neighbors who are immigrants/foreign workers through the lens of cultural context and socioeconomic background. In my community, there is a strong emphasis on kinship networks and the cultural context places value on communal relationships. Additionally, as a working-class individual, I understand the socioeconomic challenges that immigrants and foreign workers face, and I believe it is important to have neighbors who are immigrants/foreign workers to support and integrate them into our community.\n\n1"]}, {"persona": {"region": "Menofia", "sex": "male", "age": 53, "country": "Egypt", "marital_status": "married", "education": "higher", "social_class": "lower middle class"}, "question": {"id": "Q21", "variant": 0}, "response": ["Based on the anthropological framework, my perspective as a married male from Menofia, Egypt, who is 53 years old and part of the lower middle class is heavily influenced by my cultural context and socioeconomic background. In Egypt, there is a long history of immigration and a large population of foreign workers, so having immigrant or foreign worker neighbors is a common and accepted part of our community. Additionally, my individual values and personal experience have taught me the importance of being welcoming and understanding towards others, regardless of their background. Therefore, I believe it is important to have neighbors who are immigrants/foreign workers as it enriches our community and allows for cultural exchange and understanding.\n1"]}, {"persona": {"region": "Menofia", "sex": "male", "age": 59, "country": "Egypt", "marital_status": "married", "education": "middle", "social_class": "working class"}, "question": {"id": "Q21", "variant": 0}, "response": ["Based on the anthropological framework, my perspective as a married male from Menofia, Egypt, who is 59 years old, completed middle education level, and considers himself part of the working class, is influenced by my cultural context, individual values, socioeconomic background, and space and time. In Egypt, there is a strong sense of community and neighborly relations, and it is important to have good relationships with neighbors. Additionally, as part of the working class, I understand the importance of immigrants and foreign workers in contributing to the economy and society. Therefore, I believe it is important to have neighbors who are immigrants/foreign workers as it enriches the community and brings diversity.\n\n1"]}, {"persona": {"region": "Menofia", "sex": "female", "age": 42, "country": "Egypt", "marital_status": "married", "education": "middle", "social_class": "lower middle class"}, "question": {"id": "Q21", "variant": 0}, "response": ["From my perspective as a married female from Menofia, Egypt, the importance of having neighbors who are immigrants/foreign workers is heavily influenced by the cultural context and socioeconomic background. In Egypt, there is a long history of welcoming immigrants and foreign workers, particularly from neighboring countries in the Middle East and Africa. Additionally, as a member of the lower middle class, I understand the value of diversity and the potential economic benefits that immigrants and foreign workers bring to our community. Furthermore, my personal experience has shown me that having neighbors from different backgrounds can enrich our lives through exposure to new perspectives and traditions. Therefore, I believe it is important to have neighbors who are immigrants/foreign workers.\n\n1"]}, {"persona": {"region": "Menofia", "sex": "male", "age": 39, "country": "Egypt", "marital_status": "married", "education": "higher", "social_class": "working class"}, "question": {"id": "Q21", "variant": 0}, "response": ["Based on the anthropological framework, I, as a married male from Menofia, Egypt, would consider the importance of having immigrant/foreign worker neighbors within the cultural context of my community. In Egypt, there is a long history of welcoming and integrating immigrants, and their presence can bring diversity and new perspectives to the neighborhood. Additionally, my individual values and personal experience have taught me the importance of inclusivity and understanding different cultures. Considering my working-class background, I understand the value of immigrant labor and the contributions they make to our society. Furthermore, cultural relativism teaches me to respect and appreciate different backgrounds, and I believe that having immigrant/foreign worker neighbors can enrich our community. Therefore, I would consider it important to have neighbors who are immigrants/foreign workers.\n\n1"]}, {"persona": {"region": "Menofia", "sex": "male", "age": 34, "country": "Egypt", "marital_status": "married", "education": "middle", "social_class": "lower middle class"}, "question": {"id": "Q21", "variant": 0}, "response": ["Based on the anthropological framework, I would answer this question from the perspective of a 34-year-old married male from Menofia, Egypt, who is part of the lower middle class and has completed middle education level. My cultural context and socioeconomic background lead me to value the importance of having neighbors who are immigrants or foreign workers. Egypt has a long history of being a destination for migrants and foreign workers, and my personal experience and values reflect the significance of diversity and inclusivity in our community. Additionally, my emic perspective emphasizes the importance of kinship networks and the interconnectedness of our society, which includes embracing and supporting those who have chosen to make Egypt their home. Therefore, I believe it is important to have neighbors who are immigrants/foreign workers.\n\n1"]}, {"persona": {"region": "Menofia", "sex": "male", "age": 22, "country": "Egypt", "marital_status": "single", "education": "higher", "social_class": "working class"}, "question": {"id": "Q21", "variant": 0}, "response": ["Based on the anthropological framework, my emic perspective as a single male from Menofia, Egypt, emphasizes the cultural context and socioeconomic background in understanding the importance of having immigrant/foreign worker neighbors. In Egypt, there is a strong sense of community and kinship networks, and having neighbors who are immigrants/foreign workers can provide a diverse and enriching cultural experience. Additionally, as someone from the working class, I understand the value of diversity and the contributions that immigrants/foreign workers bring to the community, especially in terms of labor and economic opportunities. Therefore, I believe it is important to have neighbors who are immigrants/foreign workers.\n\n1"]}, {"persona": {"region": "Menofia", "sex": "male", "age": 21, "country": "Egypt", "marital_status": "single", "education": "middle", "social_class": "working class"}, "question": {"id": "Q21", "variant": 0}, "response": ["Based on the anthropological framework, as a single male from Menofia, Egypt, my perspective on the importance of having immigrant/foreign worker neighbors is influenced by my cultural context, socioeconomic background, and individual values. In Egypt, there is a strong sense of community and kinship networks, where neighbors are considered an important part of daily life. Additionally, as part of the working class, I understand the importance of diversity and the contributions of immigrant/foreign workers to the local economy. My personal experience and values also lead me to believe that having immigrant/foreign worker neighbors can enrich the community and provide opportunities for cultural exchange. Therefore, my perspective is that it is important to have neighbors who are immigrants/foreign workers.\n\n2"]}, {"persona": {"region": "Menofia", "sex": "male", "age": 36, "country": "Egypt", "marital_status": "married", "education": "higher", "social_class": "working class"}, "question": {"id": "Q21", "variant": 0}, "response": ["From an anthropological perspective, my cultural context as a married male from Menofia, Egypt, plays a crucial role in shaping my understanding and answer to this question. In my community, there is a strong emphasis on kinship networks and the importance of community support. Additionally, my individual values and personal experience as someone from the working class and with higher education also influence my perspective. Considering the emic and etic perspectives, I believe that having neighbors who are immigrants/foreign workers can be important as it may contribute to a diverse and enriched community environment, fostering mutual understanding and potential support networks.\n\n1"]}, {"persona": {"region": "Menofia", "sex": "female", "age": 52, "country": "Egypt", "marital_status": "married", "education": "higher", "social_class": "lower middle class"}, "question": {"id": "Q21", "variant": 0}, "response": ["From the anthropological perspective, my answer to the question of the importance of having immigrant or foreign worker neighbors is heavily influenced by my cultural context, individual values, and socioeconomic background. In Menofia, Egypt, there is a strong sense of community and neighborly support, and having immigrant or foreign worker neighbors can bring diversity and new perspectives to the neighborhood. As someone who values education and has experienced the benefits of learning from different cultures, I believe it is important to have immigrant or foreign worker neighbors as it can enrich the community and provide opportunities for cultural exchange and mutual learning. Additionally, as a member of the lower middle class, I understand the challenges that immigrants and foreign workers may face and believe in the importance of solidarity and support within the community.\n\n1"]}, {"persona": {"region": "Menofia", "sex": "male", "age": 52, "country": "Egypt", "marital_status": "married", "education": "higher", "social_class": "lower middle class"}, "question": {"id": "Q21", "variant": 0}, "response": ["From the perspective of a married male from Menofia, Egypt, the emic and etic perspectives are important to consider in answering this question. In Egyptian culture, the value of community and neighborly relationships is highly significant. The cultural context of Menofia, Egypt, where people often live in close-knit communities and rely on their neighbors for support, means that having immigrant or foreign worker neighbors could be seen as valuable for bringing diversity and new perspectives to the community. Additionally, individual values and personal experiences of the persona, as well as their lower middle class socioeconomic background, may lead them to value the contributions that immigrant or foreign worker neighbors could bring to the community. Cultural relativism is also essential in this context, as there is no hierarchy of culture and the persona may view the presence of immigrants and foreign workers as enriching rather than detrimental. The nuance of the question is also important to consider, as the persona may believe that the importance of having immigrant or foreign worker neighbors depends on the specific circumstances and contributions they bring to the community.\n\n2"]}, {"persona": {"region": "Menofia", "sex": "male", "age": 39, "country": "Egypt", "marital_status": "married", "education": "middle", "social_class": "lower class"}, "question": {"id": "Q21", "variant": 0}, "response": ["Based on my cultural context and socioeconomic background, I understand the importance of having neighbors who are immigrants or foreign workers. In Menofia, Egypt, many of us come from lower class backgrounds and we rely on the support and collaboration of our neighbors to make ends meet. Having immigrant or foreign worker neighbors can bring new perspectives, skills, and opportunities to our community, and can also create a sense of solidarity among those of us who may be struggling financially. Additionally, cultural relativism teaches us that all cultures have value, and as such, I believe it is important to welcome and learn from people of different backgrounds. Therefore, I believe it is important to have neighbors who are immigrants/foreign workers.\n\n1"]}, {"persona": {"region": "Menofia", "sex": "male", "age": 23, "country": "Egypt", "marital_status": "single", "education": "middle", "social_class": "lower middle class"}, "question": {"id": "Q21", "variant": 0}, "response": ["Based on the anthropological framework, as a 23-year-old male from Menofia, Egypt, who considers himself part of the lower middle class, my understanding of the importance of having neighbors who are immigrants/foreign workers is heavily influenced by my socioeconomic background and cultural context. Egypt has a history of hosting immigrants and foreign workers, and the socioeconomic status of my community may rely on their presence for certain job opportunities. Additionally, my personal experience and individual values may lead me to value diversity and multiculturalism, understanding the importance of having neighbors from different backgrounds. Therefore, in my perspective, having neighbors who are immigrants/foreign workers is important for the economic and cultural enrichment of my community.\n\n1"]}, {"persona": {"region": "Dakahlia", "sex": "female", "age": 24, "country": "Egypt", "marital_status": "single", "education": "higher", "social_class": "lower middle class"}, "question": {"id": "Q21", "variant": 0}, "response": ["From an emic perspective, as a single female from Dakahlia, Egypt, the cultural context and socioeconomic background play a significant role in shaping my understanding and answer to this question. In Egypt, there is a strong sense of community and neighborly relations, and having neighbors who are immigrants or foreign workers can bring diversity and enrich the local community. Additionally, coming from a lower middle-class background, I understand the challenges and opportunities that come with immigration and foreign labor. Cultural relativism also comes into play, as I recognize the value and contributions that immigrants and foreign workers bring to society. Overall, the importance of having neighbors who are immigrants/foreign workers is significant in my cultural and socioeconomic context.\n\n1"]}, {"persona": {"region": "Dakahlia", "sex": "male", "age": 36, "country": "Egypt", "marital_status": "married", "education": "higher", "social_class": "upper middle class"}, "question": {"id": "Q21", "variant": 0}, "response": ["From an emic perspective, as a married male from Dakahlia, Egypt, I understand the importance of cultural context in answering this question. In my cultural context, there is a significant emphasis on community and the role of neighbors in daily life. Additionally, my individual values and personal experience as someone who has completed higher education and considers myself part of the upper middle class play a role in my perception of the importance of having immigrant or foreign worker neighbors. Socioeconomic background is also a factor, as it may influence my interactions with immigrant or foreign worker neighbors. Considering these factors, I believe that having neighbors who are immigrants or foreign workers can bring diversity and enrich the community, which I view as important for a well-rounded and inclusive environment.\n\n1"]}, {"persona": {"region": "Dakahlia", "sex": "female", "age": 71, "country": "Egypt", "marital_status": "married", "education": "higher", "social_class": "upper middle class"}, "question": {"id": "Q21", "variant": 0}, "response": ["Based on my emic perspective as a married female from Dakahlia, Egypt, I understand the importance of cultural context and socioeconomic background in shaping my views. In my community, there is a strong emphasis on traditional values and maintaining a close-knit social network. As a member of the upper middle class, I have had access to higher education and have been exposed to different cultural perspectives. However, I still hold on to the importance of maintaining a sense of familiarity and shared values within my neighborhood. Additionally, my age and personal experiences have shaped my belief that having neighbors who are immigrants/foreign workers may disrupt the social cohesion and stability of the community. Therefore, based on my nuanced understanding of the question and my cultural relativism, I would choose:\n\n2) Not mentioned"]}, {"persona": {"region": "Dakahlia", "sex": "male", "age": 55, "country": "Egypt", "marital_status": "married", "education": "higher", "social_class": "upper middle class"}, "question": {"id": "Q21", "variant": 0}, "response": ["Based on the anthropological framework, as a married male from Dakahlia, Egypt, cultural context plays a pivotal role in understanding and answering this question. In Egypt, there is a long history of immigration and foreign labor, particularly from neighboring countries in the Middle East and Africa. The cultural context of Egypt also values community and hospitality, so having immigrant or foreign worker neighbors can provide an opportunity for cultural exchange and mutual support. Additionally, individual values and personal experience, as well as socioeconomic background, also factor into the perception of the importance of having immigrant/foreign worker neighbors. Given my higher education level and upper middle class status, I understand the importance of diversity and the potential benefits of having immigrant or foreign worker neighbors in terms of cultural enrichment and community cohesion. \n\n1"]}, {"persona": {"region": "Dakahlia", "sex": "male", "age": 64, "country": "Egypt", "marital_status": "married", "education": "higher", "social_class": "lower middle class"}, "question": {"id": "Q21", "variant": 0}, "response": ["Based on the anthropological framework, the emic and etic perspectives of the persona described above would influence their view on the importance of having neighbors who are immigrants/foreign workers. The cultural context of Dakahlia, Egypt, where the persona resides, may value the idea of community and hospitality, which may lead to a positive view of having immigrant or foreign worker neighbors. Additionally, the individual values and personal experiences of the persona, being part of the lower middle class, may make them more empathetic towards immigrants and foreign workers, understanding the challenges they face. Socioeconomic background also plays a role, as the persona's lower middle class status may lead them to view immigrant or foreign worker neighbors as potentially contributing to the neighborhood's economy. Therefore, based on the persona's perspective, it is important to have neighbors who are immigrants/foreign workers.\n\n1"]}, {"persona": {"region": "Dakahlia", "sex": "female", "age": 29, "country": "Egypt", "marital_status": "married", "education": "middle", "social_class": "lower class"}, "question": {"id": "Q21", "variant": 0}, "response": ["Based on the anthropological framework, as a married female from Dakahlia, Egypt, my emic perspective would be influenced by my cultural context, individual values, socioeconomic background, and space and time. In Dakahlia, there is a strong sense of community and kinship networks are important. As a lower-class individual, I may have limited opportunities for social interaction and support, so having neighbors who are immigrants/foreign workers could provide a sense of diversity and potentially new social connections. Additionally, considering the current economic conditions in Egypt, foreign workers might contribute to the local economy and provide opportunities for cultural exchange. Therefore, I believe it is important to have neighbors who are immigrants/foreign workers.\n\n1"]}, {"persona": {"region": "Dakahlia", "sex": "female", "age": 40, "country": "Egypt", "marital_status": "married", "education": "middle", "social_class": "upper middle class"}, "question": {"id": "Q21", "variant": 0}, "response": ["Based on the anthropological framework, my emic perspective as a married female from Dakahlia, Egypt, would prioritize the cultural context and socioeconomic background in answering this question. In my cultural context, there is a strong sense of community and hospitality, and having immigrant or foreign worker neighbors is important as it reflects openness and inclusivity. Additionally, as part of the upper middle class, I may have more exposure to diverse cultures and may benefit from the presence of immigrant neighbors in terms of access to different goods and services. Therefore, my answer would be:\n\n1"]}, {"persona": {"region": "Dakahlia", "sex": "male", "age": 37, "country": "Egypt", "marital_status": "married", "education": "higher", "social_class": "lower middle class"}, "question": {"id": "Q21", "variant": 0}, "response": ["From an anthropological perspective, the importance of having immigrant or foreign worker neighbors is influenced by various factors. The cultural context of Dakahlia, Egypt, is important to consider, as it shapes attitudes towards immigrants and foreign workers. Additionally, the individual values and personal experience of the persona, as a married male from Dakahlia, Egypt, who considers himself part of the lower middle class, will play a significant role in determining the importance placed on having immigrant or foreign worker neighbors. Socioeconomic background, including income and class, will also influence this perspective. Cultural relativism suggests that the persona's understanding of the importance of having immigrant or foreign worker neighbors may differ from others based on their cultural context and personal experiences. Considering these factors, the answer to the question from this perspective is:\n\n2"]}, {"persona": {"region": "Dakahlia", "sex": "female", "age": 45, "country": "Egypt", "marital_status": "married", "education": "middle", "social_class": "working class"}, "question": {"id": "Q21", "variant": 0}, "response": ["Based on my individual values and personal experience, as well as my cultural context and socioeconomic background, I believe that having neighbors who are immigrants/foreign workers is important. In Dakahlia, Egypt, there is a strong sense of community and kinship networks, and having neighbors from diverse backgrounds can enrich the cultural fabric of the neighborhood. Additionally, as a working-class individual, I understand the importance of inclusivity and support for those who may be facing challenges as immigrants or foreign workers. Furthermore, my emic perspective values the contributions of all members of society, regardless of their background, and I believe that having diverse neighbors can lead to greater understanding and cooperation within the community.\n1"]}, {"persona": {"region": "Dakahlia", "sex": "male", "age": 34, "country": "Egypt", "marital_status": "single", "education": "middle", "social_class": "lower middle class"}, "question": {"id": "Q21", "variant": 0}, "response": ["Based on my individual values and personal experience, I believe that having neighbors who are immigrants or foreign workers is very important. As someone from the lower middle class in Dakahlia, Egypt, I understand the importance of mutual support and cooperation within the community. Immigrants and foreign workers often face similar social and economic challenges and can provide valuable perspectives and support to each other. Additionally, considering the cultural context of Egypt and the socioeconomic background of my community, having diverse neighbors can lead to a more inclusive and understanding environment. Furthermore, cultural relativism teaches us to value and respect different perspectives, making it important to have neighbors who are immigrants or foreign workers. Overall, I believe it is essential to have neighbors from diverse backgrounds to foster a sense of community and understanding.\n\n1"]}, {"persona": {"region": "Dakahlia", "sex": "female", "age": 26, "country": "Egypt", "marital_status": "married", "education": "higher", "social_class": "upper middle class"}, "question": {"id": "Q21", "variant": 0}, "response": ["Based on my cultural context, coming from Dakahlia, Egypt, I understand the importance of having immigrants or foreign workers as neighbors. In my community, we value diversity and understand the importance of different perspectives and experiences. Additionally, my individual values and personal experience have taught me the value of inclusivity and support for those who may be in a new environment. Socioeconomic background also plays a role, as my upper middle class status allows me to understand the benefits of having a diverse community. Overall, I believe it is important to have neighbors who are immigrants/foreign workers because it enriches our community and brings different perspectives to the table.\n\n1"]}, {"persona": {"region": "Dakahlia", "sex": "male", "age": 21, "country": "Egypt", "marital_status": "single", "education": "middle", "social_class": "upper middle class"}, "question": {"id": "Q21", "variant": 0}, "response": ["Based on the anthropological framework, my perspective as a 21-year-old single male from Dakahlia, Egypt is shaped by my cultural context, socioeconomic background, and personal experience. In Egypt, there is a long history of immigration and foreign workers, particularly from nearby countries such as Sudan and Syria. This has led to a diverse cultural landscape, where interactions with immigrants and foreign workers are common. Additionally, as someone from the upper middle class, I have likely had some exposure to different cultures and socioeconomic backgrounds. Considering the importance of cultural relativism, I believe that it is important to have neighbors who are immigrants/foreign workers because it adds to the richness of our community and allows for greater cultural exchange and understanding. \n\n1"]}, {"persona": {"region": "Dakahlia", "sex": "female", "age": 32, "country": "Egypt", "marital_status": "married", "education": "middle", "social_class": "working class"}, "question": {"id": "Q21", "variant": 0}, "response": ["Based on the anthropological framework, as a married female from Dakahlia, Egypt, my emic perspective would be influenced by the cultural context of my community, where there is a history of welcoming and integrating immigrants and foreign workers. My individual values and personal experience also play a role, as I may have personal connections or positive experiences with immigrants in my community. Additionally, my socioeconomic background as a working-class individual may lead me to value the contributions of immigrants to the local economy. Furthermore, cultural relativism reminds me that all cultures have value, and space and time considerations may lead me to believe that having immigrant neighbors is important for mutual support and community cohesion. Therefore, I believe it is important to have neighbors who are immigrants/foreign workers.\n\n1"]}, {"persona": {"region": "Dakahlia", "sex": "female", "age": 35, "country": "Egypt", "marital_status": "married", "education": "middle", "social_class": "upper middle class"}, "question": {"id": "Q21", "variant": 0}, "response": ["Based on the anthropological framework, my answer to the question is influenced by my cultural context. In Dakahlia, Egypt, there is a strong emphasis on community and the importance of relationships with neighbors. Additionally, my individual values and personal experience play a role in my answer, as I have grown up in a community that values diversity and inclusivity. Being part of the upper middle class, I have had exposure to different cultures and have seen the positive impact of having immigrants and foreign workers as neighbors. Therefore, I believe it is important to have neighbors who are immigrants/foreign workers because it enriches our community and brings new perspectives and experiences.\n\n1"]}, {"persona": {"region": "Dakahlia", "sex": "male", "age": 33, "country": "Egypt", "marital_status": "married", "education": "middle", "social_class": "upper middle class"}, "question": {"id": "Q21", "variant": 0}, "response": ["From an anthropological perspective, my answer to the question of the importance of having immigrant/foreign worker neighbors is heavily influenced by my cultural context, socioeconomic background, and individual values. In Dakahlia, Egypt, there is a strong sense of community and kinship networks, and the presence of immigrant/foreign worker neighbors can contribute to the diversity and richness of our cultural context. As someone from the upper middle class, I value the contributions that immigrants and foreign workers bring to our community, and I believe that their presence can enrich our social fabric. Additionally, my age and education level have taught me the importance of embracing diversity and learning from others' experiences. Therefore, I believe it is important to have neighbors who are immigrants/foreign workers.\n\n1"]}, {"persona": {"region": "Dakahlia", "sex": "female", "age": 45, "country": "Egypt", "marital_status": "married", "education": "middle", "social_class": "upper middle class"}, "question": {"id": "Q21", "variant": 0}, "response": ["From the perspective of a married female from Dakahlia, Egypt, who is 45 years old and considers herself part of the upper middle class, the answer to the question of how important it is to have neighbors who are immigrants/foreign workers would be influenced by various factors. The cultural context in Dakahlia may shape the perception of immigrants and foreign workers, as well as the individual values and personal experiences of the persona. Additionally, the socioeconomic background of being part of the upper middle class may play a role in the perspective on this issue. Considering the emic and etic perspectives, the nuanced phrasing of the question may also influence the response. \n\n1"]}, {"persona": {"region": "Dakahlia", "sex": "male", "age": 30, "country": "Egypt", "marital_status": "married", "education": "middle", "social_class": "upper middle class"}, "question": {"id": "Q21", "variant": 0}, "response": ["From the perspective of a married male from Dakahlia, Egypt, the cultural context is crucial in understanding the importance of having neighbors who are immigrants or foreign workers. In Egypt, there is a long history of migration and a significant number of foreign workers reside in the country, particularly in urban areas. This cultural context shapes the individual's perception of the importance of having immigrant or foreign worker neighbors. Additionally, the individual's upper middle-class socioeconomic background may influence their perspective, as they may have more exposure to diverse communities and possibly value the contributions of immigrants to the local economy. Furthermore, the individual's age and education level may also play a role in their understanding of the value of diversity in their neighborhood. Taking into account the cultural relativism and nuance of the question, the importance of having neighbors who are immigrants or foreign workers may be perceived as significant for fostering a rich and diverse community.\n\n1"]}, {"persona": {"region": "Dakahlia", "sex": "female", "age": 63, "country": "Egypt", "marital_status": "married", "education": "higher", "social_class": "lower middle class"}, "question": {"id": "Q21", "variant": 0}, "response": ["From an emic perspective, living in Dakahlia, Egypt, where there is a strong cultural context and emphasis on community ties, having neighbors who are immigrants or foreign workers can be seen as important. This is because cultural context and kinship networks play a pivotal role in shaping the understanding of the importance of neighbors. Additionally, individual values and personal experience, along with socioeconomic background, also factor into the perception of the importance of having immigrant or foreign worker neighbors. Cultural relativism is also important to consider, as the perspective may differ from other cultures. Lastly, the nuanced phrasing of the question may lead to a subjective understanding of the importance of this aspect in the community. \n\n1"]}, {"persona": {"region": "Dakahlia", "sex": "male", "age": 28, "country": "Egypt", "marital_status": "single", "education": "higher", "social_class": "upper middle class"}, "question": {"id": "Q21", "variant": 0}, "response": ["Based on the anthropological framework, my perspective as a single male from Dakahlia, Egypt, is heavily influenced by my cultural context, individual values, and socioeconomic background. In my community, there is a strong emphasis on hospitality and community support, and this includes being welcoming to immigrants and foreign workers. Additionally, my higher education level has exposed me to the benefits of diversity and the importance of global interconnectedness. As someone from the upper middle class, I have the resources and social capital to interact with a diverse range of people, and I understand the value that immigrants and foreign workers bring to our community. Therefore, I believe it is important to have neighbors who are immigrants/foreign workers.\n\n1"]}, {"persona": {"region": "Dakahlia", "sex": "female", "age": 24, "country": "Egypt", "marital_status": "married", "education": "higher", "social_class": "upper middle class"}, "question": {"id": "Q21", "variant": 0}, "response": ["In the cultural context of Dakahlia, Egypt, the importance of having immigrant or foreign worker neighbors is influenced by various factors such as the socio-economic background, individual values, and personal experiences. As a married female from Dakahlia, who has completed higher education and considers herself part of the upper middle class, I understand the significance of diversity and the contributions that immigrants and foreign workers can bring to the community. Additionally, the emic perspective in this cultural context values hospitality and cooperation, which can be enriched by interactions with individuals from different cultural backgrounds. Therefore, based on this understanding, I believe it is important to have neighbors who are immigrants/foreign workers.\n\n1"]}, {"persona": {"region": "Dakahlia", "sex": "male", "age": 20, "country": "Egypt", "marital_status": "single", "education": "middle", "social_class": "upper middle class"}, "question": {"id": "Q21", "variant": 0}, "response": ["Based on my cultural context in Dakahlia, Egypt, the importance of having immigrant or foreign worker neighbors is influenced by the socioeconomic background, cultural relativism, and space and time. In my community, there is a strong emphasis on traditional values and maintaining a sense of cultural identity. At the same time, being part of the upper middle class means that there is a certain level of exposure to different cultures and a recognition of the contributions that immigrants and foreign workers make to our society. Additionally, my age and level of education have provided me with a broader perspective on the benefits of diversity in our neighborhood. Therefore, I believe it is important to have neighbors who are immigrants/foreign workers.\n\n1"]}, {"persona": {"region": "Dakahlia", "sex": "male", "age": 45, "country": "Egypt", "marital_status": "married", "education": "middle", "social_class": "upper middle class"}, "question": {"id": "Q21", "variant": 0}, "response": ["Based on my cultural context, coming from Dakahlia, Egypt, I understand the importance of having neighbors who are immigrants or foreign workers. In my community, we value diversity and the contributions that immigrants make to our society. Additionally, my personal experience has taught me the value of different perspectives and the richness that comes from interacting with people from different backgrounds. Furthermore, my socioeconomic background as part of the upper middle class means that I have the resources and opportunities to engage with immigrants and foreign workers in a positive and meaningful way. Taking into account cultural relativism, I recognize that no one culture is superior to another, and I appreciate the unique contributions that immigrants and foreign workers bring to our neighborhood. Based on the nuanced phrasing of the question, I believe it is important to have neighbors who are immigrants/foreign workers.\n\n1"]}, {"persona": {"region": "Dakahlia", "sex": "female", "age": 43, "country": "Egypt", "marital_status": "married", "education": "higher", "social_class": "upper middle class"}, "question": {"id": "Q21", "variant": 0}, "response": ["Based on the anthropological framework, my answer to the question would be influenced by my cultural context, individual values, and socioeconomic background. In Dakahlia, Egypt, there is a strong sense of community and reliance on neighbors for support and social interaction. As a married woman from this region, I value the diversity and richness that immigrants and foreign workers bring to our neighborhood. Their presence adds to the cultural fabric of our community, providing opportunities for cross-cultural exchange and learning. Additionally, as someone from the upper middle class, I am more likely to have a broader perspective and appreciation for the contributions that immigrants and foreign workers bring to our community. Therefore, my response would be that it is important to have neighbors who are immigrants/foreign workers.\n\n1"]}, {"persona": {"region": "Dakahlia", "sex": "female", "age": 20, "country": "Egypt", "marital_status": "single", "education": "middle", "social_class": "upper middle class"}, "question": {"id": "Q21", "variant": 0}, "response": ["Based on the anthropological framework, as a single female from Dakahlia, Egypt, I understand the importance of cultural context and socio-economic background in shaping my perspective. In my cultural context, it is important to have neighbors who are immigrants/foreign workers as it adds to the diversity and richness of our community. Additionally, considering my upper middle class background, I value the contributions of immigrants/foreign workers to our society and believe that their presence enhances our community. Therefore, I believe it is important to have neighbors who are immigrants/foreign workers.\n\n1"]}, {"persona": {"region": "Dakahlia", "sex": "female", "age": 40, "country": "Egypt", "marital_status": "single", "education": "middle", "social_class": "lower middle class"}, "question": {"id": "Q21", "variant": 0}, "response": ["From an emic perspective, as a single female from Dakahlia, Egypt, cultural context and socioeconomic background play a significant role in shaping my understanding and response to this question. In Egypt, there is a long history of immigration and labor migration, with many Egyptians working abroad and many foreign workers coming to Egypt for employment opportunities. As someone from the lower middle class, I understand the importance of having immigrants/foreign workers as neighbors as they often contribute to the local economy and bring diverse perspectives and skills to the community. Additionally, my personal experience and individual values emphasize the importance of inclusivity and diversity in my neighborhood. Therefore, I believe it is important to have neighbors who are immigrants/foreign workers.\n\n1"]}, {"persona": {"region": "Dakahlia", "sex": "female", "age": 33, "country": "Egypt", "marital_status": "married", "education": "higher", "social_class": "upper middle class"}, "question": {"id": "Q21", "variant": 0}, "response": ["From the perspective of a married female from Dakahlia, Egypt, who is 33 years old, completed higher education, and considers herself part of the upper middle class, the answer to the question of the importance of having immigrant or foreign worker neighbors would be influenced by several factors. Firstly, the cultural context of living in Egypt, where there is a history of immigration and a diverse population, would impact the understanding of the value of having immigrant or foreign worker neighbors. Additionally, the socioeconomic background of being part of the upper middle class may lead to a more open and positive perspective on the importance of having immigrant or foreign worker neighbors, as there may be more exposure and interaction with individuals from different backgrounds. Furthermore, individual values and personal experiences, as well as the nuanced phrasing of the question, would also play a role in shaping the response. Overall, the importance of having immigrant or foreign worker neighbors would likely be viewed as important from this perspective, as it aligns with the cultural relativism and understanding of diverse socio-cultural dynamics.\n\n1"]}, {"persona": {"region": "Dakahlia", "sex": "female", "age": 24, "country": "Egypt", "marital_status": "married", "education": "middle", "social_class": "working class"}, "question": {"id": "Q21", "variant": 0}, "response": ["Based on the anthropological framework, I will be answering this question from the perspective of a married female from Dakahlia, Egypt. As someone from a working-class background, cultural context and socioeconomic background are pivotal in my understanding and answering of this question. In Egypt, there is a long history of immigration and foreign workers, and many of us have grown up with neighbors who are immigrants or foreign workers. The cultural context and kinship networks are strong, and we value the diversity and different perspectives that come with having immigrant neighbors. Additionally, the socioeconomic background also plays a role, as many of us in the working class have had positive experiences with immigrant neighbors who have contributed to our communities. Therefore, I find it important to have neighbors who are immigrants/foreign workers.\n\n1"]}, {"persona": {"region": "Dakahlia", "sex": "female", "age": 53, "country": "Egypt", "marital_status": "widowed", "education": "middle", "social_class": "working class"}, "question": {"id": "Q21", "variant": 0}, "response": ["Based on the anthropological framework, as a widowed female from Dakahlia, Egypt, I understand the importance of considering cultural context, socioeconomic background, and space and time when answering this question. In my cultural context, immigrants and foreign workers may face similar struggles and challenges as myself, especially as part of the working class. I also understand the value of kinship networks and the support that can come from having neighbors who share similar experiences and backgrounds. Therefore, I believe it is important to have neighbors who are immigrants/foreign workers as it can create a sense of community and understanding. \n\n1"]}, {"persona": {"region": "Dakahlia", "sex": "female", "age": 30, "country": "Egypt", "marital_status": "single", "education": "middle", "social_class": "lower middle class"}, "question": {"id": "Q21", "variant": 0}, "response": ["From an emic perspective, as a single female from Dakahlia, Egypt, I understand the importance of cultural context and socioeconomic background in shaping my views. In my community, there is a strong emphasis on close-knit relationships and support networks, and having neighbors who are immigrants or foreign workers can offer diverse perspectives and experiences that enrich our community. Additionally, considering my lower middle-class background, I recognize the value of solidarity and mutual assistance, which can be enhanced by having immigrant or foreign worker neighbors. Also, cultural relativism is a crucial aspect to consider, as it is important to respect and appreciate different cultures and backgrounds. Overall, my personal values, cultural context, and socioeconomic background lead me to believe that having immigrant or foreign worker neighbors is important for a well-rounded and supportive community.\n\n1"]}, {"persona": {"region": "Dakahlia", "sex": "male", "age": 53, "country": "Egypt", "marital_status": "married", "education": "higher", "social_class": "upper middle class"}, "question": {"id": "Q21", "variant": 0}, "response": ["Based on the anthropological framework, it is important to consider the cultural context and socioeconomic background when answering this question. As a married male from Dakahlia, Egypt, with a higher education level and a part of the upper middle class, I understand the importance of having neighbors who are immigrants/foreign workers. In the cultural context of Egypt, there is a long history of immigration and foreign workers contributing to the economy and society. Additionally, as someone with a higher education level and part of the upper middle class, I recognize the value of diversity and different perspectives in the community. Therefore, I believe it is important to have neighbors who are immigrants/foreign workers for cultural exchange and mutual benefit.\n\n1"]}, {"persona": {"region": "Dakahlia", "sex": "male", "age": 28, "country": "Egypt", "marital_status": "married", "education": "middle", "social_class": "working class"}, "question": {"id": "Q21", "variant": 0}, "response": ["As a married male from Dakahlia, Egypt, my perspective is heavily influenced by my cultural context and socioeconomic background. In my community, there is a strong emphasis on family and kinship networks, and the concept of community is highly valued. Additionally, being part of the working class, I understand the importance of diversity in the workforce and the contributions that immigrants and foreign workers can make to our community. Considering the emic and etic perspectives, I believe that having neighbors who are immigrants/foreign workers is important for the growth and development of our community. Their unique experiences and perspectives can enrich our neighborhood and provide valuable opportunities for cultural exchange. Furthermore, cultural relativism is important in recognizing the value of different cultures and the importance of inclusivity in our community.\n\n1"]}, {"persona": {"region": "Dakahlia", "sex": "female", "age": 38, "country": "Egypt", "marital_status": "married", "education": "middle", "social_class": "upper middle class"}, "question": {"id": "Q21", "variant": 0}, "response": ["Based on the anthropological framework, my perspective as a married female from Dakahlia, Egypt, is heavily influenced by cultural context, individual values, and socioeconomic background. In my community, there is a strong emphasis on family and community ties, and having neighbors who are immigrants or foreign workers can bring diversity and different perspectives to the neighborhood. Additionally, as someone from the upper middle class, I may have more exposure to different cultures and may value the contributions that immigrants and foreign workers can bring to the community. Therefore, I believe it is important to have neighbors who are immigrants/foreign workers.\n\n1"]}, {"persona": {"region": "Gharbia", "sex": "male", "age": 27, "country": "Egypt", "marital_status": "single", "education": "higher", "social_class": "upper middle class"}, "question": {"id": "Q21", "variant": 0}, "response": ["From the perspective of a single, educated, upper middle class male from Gharbia, Egypt, it is crucial to consider the cultural context and individual values when addressing the question of the importance of having immigrant or foreign worker neighbors. In Egyptian society, there is a strong emphasis on community and hospitality, which is often extended to newcomers and foreign workers. Additionally, individuals from this demographic may have had exposure to different cultures and languages through their education and higher socioeconomic status, leading to a more open and accepting attitude towards immigrants and foreign workers. Therefore, from this perspective, it is important to have immigrant or foreign worker neighbors as it enriches the cultural diversity and brings new perspectives to the community.\n\n1"]}, {"persona": {"region": "Gharbia", "sex": "female", "age": 35, "country": "Egypt", "marital_status": "married", "education": "higher", "social_class": "upper middle class"}, "question": {"id": "Q21", "variant": 0}, "response": ["From an anthropological perspective, my background as a married, educated, upper-middle-class woman from Gharbia, Egypt, is crucial in shaping my understanding and answer to the question. The cultural context in which I live places a high value on community and hospitality, and this extends to our relationships with our neighbors. Additionally, my individual values and personal experiences have taught me the importance of diversity and inclusion, as well as the benefits of learning from people with different backgrounds. Considering the emic and etic perspectives, I believe that having neighbors who are immigrants or foreign workers can enrich our community and bring new perspectives and experiences. Based on my nuanced understanding of the question, I would choose option 1: Important."]}, {"persona": {"region": "Gharbia", "sex": "female", "age": 37, "country": "Egypt", "marital_status": "married", "education": "higher", "social_class": "upper middle class"}, "question": {"id": "Q21", "variant": 0}, "response": ["From the perspective of a married female from Gharbia, Egypt, with a higher education level and belonging to the upper middle class, the importance of having immigrant/foreign worker neighbors is heavily influenced by cultural context, individual values, and socioeconomic background. In Egyptian society, there is a strong emphasis on community and neighborly relations, and having immigrant/foreign worker neighbors can provide opportunities for cultural exchange and diversity. Additionally, individuals from the upper middle class may value the presence of immigrant/foreign worker neighbors as it can contribute to a cosmopolitan and globalized environment, reflecting their own educational and socioeconomic status. Furthermore, the recognition of cultural relativism is crucial in understanding the value of immigrant/foreign worker neighbors, as it emphasizes the importance of diversity and respect for different cultural backgrounds. Therefore, it can be argued that from this perspective, it is important to have neighbors who are immigrants/foreign workers.\n\n1"]}, {"persona": {"region": "Gharbia", "sex": "male", "age": 43, "country": "Egypt", "marital_status": "married", "education": "middle", "social_class": "lower middle class"}, "question": {"id": "Q21", "variant": 0}, "response": ["Based on the anthropological framework, my perspective as a married male from Gharbia, Egypt, is heavily influenced by my cultural context, socioeconomic background, and individual values. In Egypt, there is a strong sense of community and kinship networks, and having good relationships with neighbors is important. Additionally, being part of the lower middle class, I understand the struggles of immigrants and foreign workers who come to Egypt seeking better opportunities. I believe in showing empathy and support to those who are trying to make a living in a new country, as I would hope to receive the same treatment if I were in their position. Therefore, I believe it is important to have neighbors who are immigrants/foreign workers as it enriches our community and promotes understanding and empathy towards others.\n\n1"]}, {"persona": {"region": "Gharbia", "sex": "male", "age": 28, "country": "Egypt", "marital_status": "single", "education": "higher", "social_class": "lower middle class"}, "question": {"id": "Q21", "variant": 0}, "response": ["From the perspective of a single male from Gharbia, Egypt, cultural context is pivotal in understanding the importance of having neighbors who are immigrants or foreign workers. In Egypt, there is a long history of hosting and accepting immigrants, particularly from neighboring countries. The cultural context also includes the value of community and the importance of building relationships with neighbors. Additionally, the individual values and personal experience of the persona play a role in this perspective, as they may have personal connections with immigrants or foreign workers and understand the value they bring to the community. The socioeconomic background of being part of the lower middle class also influences the viewpoint, as it may impact the persona's interactions with immigrants and foreign workers in their neighborhood. Therefore, it can be argued that having neighbors who are immigrants or foreign workers is important for fostering a sense of community and understanding different perspectives.\n\n1"]}, {"persona": {"region": "Gharbia", "sex": "male", "age": 39, "country": "Egypt", "marital_status": "married", "education": "middle", "social_class": "lower middle class"}, "question": {"id": "Q21", "variant": 0}, "response": ["In my cultural context, the importance of having immigrant or foreign worker neighbors is influenced by several factors. First, the socioeconomic background of my persona as a lower middle class individual means that I may have a different perspective on this issue compared to those who are more affluent. Additionally, the cultural context of Gharbia, Egypt, may also play a role in shaping my views on this topic. Given that Egypt is a country that has historically had a significant number of immigrants and foreign workers, the presence of such individuals in my neighborhood may be perceived as relatively common and potentially beneficial in terms of cultural exchange and diversity. Furthermore, my personal experience and individual values may lead me to believe that having immigrant or foreign worker neighbors can contribute to a more vibrant and interconnected community. Therefore, based on these factors, I would choose the option (1) Important.\n\n1"]}, {"persona": {"region": "Gharbia", "sex": "male", "age": 30, "country": "Egypt", "marital_status": "married", "education": "middle", "social_class": "lower middle class"}, "question": {"id": "Q21", "variant": 0}, "response": ["Based on my personal experience and cultural context, I understand the importance of having neighbors who are immigrants or foreign workers. In my community, we value diversity and recognize the contributions that immigrants and foreign workers make to our neighborhood. As someone from the lower middle class, I have seen firsthand how these individuals bring new perspectives and skills that benefit our community. Additionally, the cultural relativism framework also informs my perspective, as I believe that no culture is inherently \"better\" than another, and I value the presence of diverse cultures within our neighborhood. Therefore, I believe it is important to have neighbors who are immigrants/foreign workers.\n\n1"]}, {"persona": {"region": "Gharbia", "sex": "male", "age": 43, "country": "Egypt", "marital_status": "married", "education": "lower", "social_class": "lower middle class"}, "question": {"id": "Q21", "variant": 0}, "response": ["Based on the anthropological framework, my understanding and answer to the question of the importance of having immigrant or foreign worker neighbors is shaped by my cultural context, individual values and personal experience, and socioeconomic background. As a married male from Gharbia, Egypt, I am aware of the importance of community and social networks within my cultural context. Additionally, my lower middle class background means that I may have personal experience with economic challenges and understand the value of diversity and inclusivity. Considering these factors, I believe it is important to have neighbors who are immigrants/foreign workers.\n\n1"]}, {"persona": {"region": "Gharbia", "sex": "male", "age": 36, "country": "Egypt", "marital_status": "married", "education": "higher", "social_class": "lower middle class"}, "question": {"id": "Q21", "variant": 0}, "response": ["Based on the anthropological framework, as a married male from Gharbia, Egypt, my perspective on the importance of having immigrant or foreign worker neighbors is heavily influenced by my cultural context, individual values, and socioeconomic background. In Gharbia, there is a strong sense of community and it is common for neighbors to rely on each other for support and assistance. Additionally, as someone who considers themselves part of the lower middle class, I understand the challenges and opportunities that come with migration and working abroad. Therefore, I believe it is important to have immigrant/foreign worker neighbors as they bring different perspectives and experiences that can enrich our community and provide mutual support in times of need.\n\n1"]}, {"persona": {"region": "Gharbia", "sex": "male", "age": 25, "country": "Egypt", "marital_status": "married", "education": "middle", "social_class": "upper middle class"}, "question": {"id": "Q21", "variant": 0}, "response": ["From the perspective of a married male from Gharbia, Egypt, cultural context is pivotal in understanding the importance of having neighbors who are immigrants or foreign workers. In this region, there is a long history of migration and cultural diversity, so the presence of immigrants and foreign workers in the neighborhood is a normal and valued part of the social fabric. Additionally, the socioeconomic background of being part of the upper middle class may lead to a more open and accepting attitude towards immigrants and foreign workers, recognizing the contributions they make to the community. However, individual values and personal experiences may also play a role in shaping this perspective, as the persona's specific experiences and interactions with immigrants or foreign workers will influence their opinion. Considering the emic and etic perspectives, as well as the cultural relativism and nuance of the question, it can be argued that having neighbors who are immigrants or foreign workers is important in this context as it contributes to the rich cultural tapestry of the community.\n\n1"]}, {"persona": {"region": "Gharbia", "sex": "male", "age": 31, "country": "Egypt", "marital_status": "married", "education": "middle", "social_class": "upper middle class"}, "question": {"id": "Q21", "variant": 0}, "response": ["Based on my cultural context and socioeconomic background, I believe that having neighbors who are immigrants or foreign workers can bring diversity and new perspectives to the community. My individual values and personal experience have shown me the benefits of interacting with people from different backgrounds. Additionally, cultural relativism teaches us that there is value in embracing different cultures and that no one culture is inherently better than another. Furthermore, my education level has taught me to appreciate nuance and the importance of considering various perspectives. Therefore, I believe that it is important to have neighbors who are immigrants or foreign workers because it enriches the community and contributes to a more diverse and inclusive environment.\n\n1"]}, {"persona": {"region": "Gharbia", "sex": "male", "age": 33, "country": "Egypt", "marital_status": "married", "education": "higher", "social_class": "lower middle class"}, "question": {"id": "Q21", "variant": 0}, "response": ["From the perspective of a married male from Gharbia, Egypt, it is important to consider the cultural context and socioeconomic background. In Egypt, there is a history of immigration and a diverse population, so having neighbors who are immigrants or foreign workers can provide a sense of community and connection to different cultures. Additionally, being part of the lower middle class, there may be shared experiences and struggles with immigrant or foreign worker neighbors, which can foster a sense of solidarity and understanding. Furthermore, the cultural relativism aspect of the framework suggests that there is value in embracing diversity and different perspectives within a community. Therefore, it is important to have neighbors who are immigrants/foreign workers.\n\n1"]}, {"persona": {"region": "Gharbia", "sex": "male", "age": 26, "country": "Egypt", "marital_status": "single", "education": "higher", "social_class": "upper middle class"}, "question": {"id": "Q21", "variant": 0}, "response": ["Based on the anthropological framework, my emic perspective as a single male from Gharbia, Egypt, who is 26 years old, has completed higher education, and considers himself part of the upper middle class, is shaped by my cultural context, individual values, and socioeconomic background. In Egypt, there is a long history of welcoming immigrants and foreign workers, and I personally value diversity and the contributions that immigrants can bring to our community. Additionally, my higher education has exposed me to different perspectives and cultures, and as someone from the upper middle class, I understand the economic benefits that can come from having immigrant neighbors. Therefore, I believe it is important to have neighbors who are immigrants/foreign workers.\n\n1"]}, {"persona": {"region": "Gharbia", "sex": "female", "age": 45, "country": "Egypt", "marital_status": "married", "education": "middle", "social_class": "lower middle class"}, "question": {"id": "Q21", "variant": 0}, "response": ["From the perspective of a married female from Gharbia, Egypt, the emic perspective on the importance of having neighbors who are immigrants/foreign workers is influenced by the cultural context of the region. Gharbia has a history of being a place where immigrant and foreign workers come to find job opportunities. This has created a diverse and inclusive community where people from different backgrounds live and work together. Additionally, the socioeconomic background of being part of the lower middle class means that there is a level of economic interdependence with immigrant and foreign workers. This, coupled with the cultural relativism of valuing diversity and different perspectives, leads to the belief that having neighbors who are immigrants/foreign workers is important for the community's social fabric and economic stability.\n\n1"]}, {"persona": {"region": "Gharbia", "sex": "female", "age": 55, "country": "Egypt", "marital_status": "married", "education": "middle", "social_class": "upper middle class"}, "question": {"id": "Q21", "variant": 0}, "response": ["From the perspective of a 55-year-old married woman from Gharbia, Egypt, who considers herself part of the upper middle class, the answer to the question of the importance of having immigrant or foreign worker neighbors would be influenced by cultural context, individual values, and socioeconomic background. In Gharbia, there may be a strong emphasis on community and neighborly relations, and having immigrant or foreign worker neighbors could be seen as important for fostering a diverse and interconnected community. Additionally, as a member of the upper middle class, there may be a sense of social responsibility and global awareness, leading to a recognition of the value of having immigrant or foreign worker neighbors in promoting cultural exchange and understanding. Overall, the importance of having immigrant or foreign worker neighbors would be perceived as significant from this perspective.\n\n1"]}, {"persona": {"region": "Gharbia", "sex": "female", "age": 27, "country": "Egypt", "marital_status": "married", "education": "higher", "social_class": "upper middle class"}, "question": {"id": "Q21", "variant": 0}, "response": ["Based on the anthropological framework, the cultural context of Gharbia, Egypt and the persona's individual values and personal experience would greatly influence their perspective on the importance of having immigrant/foreign worker neighbors. In Gharbia, there may be a strong emphasis on community and interconnectedness, and the persona's higher education level and upper middle class status may also shape their views on immigration and foreign workers. Additionally, the socioeconomic background of the persona may lead them to value diversity and the contributions of immigrants/foreign workers to the community. Therefore, the persona would likely consider it important to have neighbors who are immigrants/foreign workers.\n\n1"]}, {"persona": {"region": "Gharbia", "sex": "female", "age": 42, "country": "Egypt", "marital_status": "married", "education": "higher", "social_class": "upper middle class"}, "question": {"id": "Q21", "variant": 0}, "response": ["Based on the anthropological framework, as a married woman from Gharbia, Egypt, cultural context is pivotal in understanding the importance of having immigrant/foreign worker neighbors. In this region, there is a strong sense of community and kinship networks, and the cultural perspective values hospitality and inclusivity. Additionally, my higher education level and upper middle-class status would also influence my perspective, as I may have exposure to different cultures and may value diversity and multiculturalism. Furthermore, my age and socioeconomic background would also play a role in shaping my views on this topic. Taking into account the emic and etic perspectives, individual values, and personal experiences, I believe it is important to have neighbors who are immigrants/foreign workers as it enriches the community and provides opportunities for cultural exchange and understanding.\n\n1"]}, {"persona": {"region": "Gharbia", "sex": "female", "age": 32, "country": "Egypt", "marital_status": "married", "education": "middle", "social_class": "upper middle class"}, "question": {"id": "Q21", "variant": 0}, "response": ["Based on the anthropological framework, as a married female from Gharbia, Egypt, cultural context is pivotal in understanding the importance of having neighbors who are immigrants/foreign workers. In Egypt, there is a strong sense of community and hospitality, and having neighbors from different backgrounds can enrich the cultural experience and create a more diverse and inclusive community. Additionally, individual values and personal experiences play a role in this perspective, as the persona may value the opportunity to learn from and interact with people from different cultures. Considering the socioeconomic background, being part of the upper middle class may also influence the perception, as there may be a greater openness to diversity and multiculturalism. Cultural relativism is also important, as the persona may understand and appreciate the value of different cultural perspectives. Therefore, based on this perspective, the chosen answer is:\n\n1"]}, {"persona": {"region": "Gharbia", "sex": "male", "age": 27, "country": "Egypt", "marital_status": "married", "education": "higher", "social_class": "upper middle class"}, "question": {"id": "Q21", "variant": 0}, "response": ["Based on the anthropological framework, as a married male from Gharbia, Egypt, who is 27 years old and part of the upper middle class, my perspective on the importance of having neighbors who are immigrants/foreign workers would be influenced by a combination of emic and etic perspectives, cultural context, individual values and personal experience, socioeconomic background, cultural relativism, space and time, and nuance. In Gharbia, there is a mix of attitudes towards immigrants and foreign workers, with some valuing the diversity and cultural exchange they bring, while others may have concerns about competition for jobs or resources. As someone from the upper middle class with higher education, I may be more open to the idea of having immigrant neighbors, recognizing the value of diversity and the potential for mutual benefit. Additionally, my age and education level may lead me to have a more global perspective and appreciation for multiculturalism. Therefore, I would say:\n\n1"]}, {"persona": {"region": "Gharbia", "sex": "female", "age": 27, "country": "Egypt", "marital_status": "married", "education": "higher", "social_class": "lower middle class"}, "question": {"id": "Q21", "variant": 0}, "response": ["From the perspective of a married female from Gharbia, Egypt, cultural context and socioeconomic background play a significant role in shaping my answer to this question. In Egypt, there is a long history of welcoming and integrating immigrants and foreign workers into our communities, and as someone from the lower middle class, I understand the value of diversity and the positive impact that immigrants can have on our neighborhoods. Additionally, my higher education has provided me with a nuanced understanding of the benefits of cultural exchange and the importance of empathy towards those who may be in a different socio-economic position than myself. Therefore, I believe it is important to have neighbors who are immigrants/foreign workers.\n\n1"]}, {"persona": {"region": "Gharbia", "sex": "female", "age": 37, "country": "Egypt", "marital_status": "married", "education": "middle", "social_class": "upper middle class"}, "question": {"id": "Q21", "variant": 0}, "response": ["Based on the anthropological framework, as a married female from Gharbia, Egypt, my emic perspective on the importance of having immigrant/foreign worker neighbors is influenced by my cultural context, individual values, and socioeconomic background. In Gharbia, there is a strong sense of community and kinship networks, and having immigrant or foreign worker neighbors can bring diversity and new perspectives to the community. Additionally, as part of the upper middle class, I may have more exposure to global perspectives and may value the contributions that immigrants and foreign workers bring to the local economy and society. Therefore, I believe it is important to have neighbors who are immigrants/foreign workers. \n\n1"]}, {"persona": {"region": "Gharbia", "sex": "male", "age": 28, "country": "Egypt", "marital_status": "married", "education": "higher", "social_class": "working class"}, "question": {"id": "Q21", "variant": 0}, "response": ["Based on the anthropological framework, I, as a married male from Gharbia, Egypt, would approach this question from the perspective of cultural context, individual values, and socioeconomic background. In my cultural context, having neighbors who are immigrants or foreign workers may be seen as important due to the value placed on community and hospitality. Additionally, my personal experience and individual values may also lead me to believe that having diverse neighbors can enrich my life and broaden my understanding of the world. As a member of the working class, I may also recognize the importance of immigrant and foreign workers in contributing to the labor force and the economy. Therefore, my answer to the question would be: \n\n2"]}, {"persona": {"region": "Gharbia", "sex": "female", "age": 50, "country": "Egypt", "marital_status": "married", "education": "middle", "social_class": "upper middle class"}, "question": {"id": "Q21", "variant": 0}, "response": ["From the perspective of a married female from Gharbia, Egypt, at the age of 50, who considers herself part of the upper middle class, the answer to the question of the importance of having neighbors who are immigrants/foreign workers would be influenced by several factors. Firstly, the cultural context in Egypt values community and hospitality, so having neighbors from diverse backgrounds may be seen as an enriching experience. Additionally, the individual values and personal experiences of this persona, who has completed middle education level, may have exposed her to different perspectives and beliefs. Furthermore, the socioeconomic background of being part of the upper middle class may lead to a more open and accepting attitude towards immigrants and foreign workers. Taking into account the anthropological framework, the nuanced phrasing of the question and the cultural relativism of Egyptian society, the persona would likely choose the option (1) Important. \n\n1"]}, {"persona": {"region": "Gharbia", "sex": "male", "age": 39, "country": "Egypt", "marital_status": "single", "education": "higher", "social_class": "working class"}, "question": {"id": "Q21", "variant": 0}, "response": ["From the perspective of a single male from Gharbia, Egypt, who is part of the working class and has completed higher education, the answer to the question is influenced by several factors. The cultural context in Egypt values strong community ties and support for one another, which could make having immigrant or foreign worker neighbors important for fostering a sense of solidarity and shared experiences. Additionally, individual values and personal experiences may play a role in valuing diversity and the contributions of immigrants to the community. Socioeconomic background also factors in, as the working class may have a greater appreciation for the hard work and struggles of immigrants and foreign workers. Furthermore, cultural relativism and nuance are important to consider, as the nuanced phrasing of the question may lead to a nuanced understanding of the importance of having immigrant or foreign worker neighbors. \n\n1"]}, {"persona": {"region": "Gharbia", "sex": "female", "age": 45, "country": "Egypt", "marital_status": "married", "education": "higher", "social_class": "upper middle class"}, "question": {"id": "Q21", "variant": 0}, "response": ["Based on the anthropological framework, my emic perspective from Gharbia, Egypt, emphasizes the importance of cultural context and individual values. In our cultural context, having immigrant or foreign worker neighbors may not be considered as important due to our close-knit community and strong kinship networks. Additionally, personal experience and socioeconomic background play a significant role in shaping our perceptions. As a married, educated woman from the upper middle class, I value stability and security, and having immigrant or foreign worker neighbors may not align with these values. Therefore, my answer is:\n\n2"]}, {"persona": {"region": "Sharkia", "sex": "male", "age": 35, "country": "Egypt", "marital_status": "married", "education": "higher", "social_class": "upper middle class"}, "question": {"id": "Q21", "variant": 0}, "response": ["Based on the anthropological framework, as a married male from Sharkia, Egypt, cultural context plays a pivotal role in understanding the importance of having immigrant or foreign worker neighbors. In Egypt, there is a long history of welcoming immigrants and foreign workers, especially from neighboring countries. This cultural context shapes the emic perspective on the value of having immigrant or foreign worker neighbors, as it is seen as important to maintain strong ties with other communities. Additionally, my individual values and personal experience also influence my perspective, as I have grown up in a society that values diversity and multiculturalism. Furthermore, the socioeconomic background of being part of the upper middle class may lead to a more open and inclusive attitude towards immigrant and foreign worker neighbors. Overall, considering the cultural context, individual values, and socioeconomic background, I believe that having immigrant or foreign worker neighbors is important for fostering a sense of community and inclusivity.\n\n1"]}, {"persona": {"region": "Sharkia", "sex": "female", "age": 55, "country": "Egypt", "marital_status": "married", "education": "middle", "social_class": "lower middle class"}, "question": {"id": "Q21", "variant": 0}, "response": ["Based on the anthropological framework, as a married female from Sharkia, Egypt, my cultural context is crucial in understanding the importance of having neighbors who are immigrants/foreign workers. In Egypt, there is a long history of migration and cultural exchange, and the country has a diverse population. My individual values and personal experience also play a role in shaping my perspective. As someone from the lower middle class, I may have had personal interactions with immigrants and foreign workers, and I understand the challenges they face. Additionally, my socioeconomic background and age contribute to my understanding of the importance of having diverse neighbors. Considering cultural relativism, I recognize the value of different perspectives and experiences, and I believe that having immigrants/foreign workers as neighbors can enrich our community and provide opportunities for cultural exchange and learning. \n\n1"]}, {"persona": {"region": "Sharkia", "sex": "female", "age": 27, "country": "Egypt", "marital_status": "married", "education": "middle", "social_class": "lower middle class"}, "question": {"id": "Q21", "variant": 0}, "response": ["Based on my cultural context, coming from Sharkia, Egypt, where there is a diverse range of people living in my community, I understand the importance of having neighbors who are immigrants or foreign workers. From an emic perspective, I value the diversity and cultural exchange that comes with having neighbors from different backgrounds. My personal experience living in a community with immigrants has also shown me the positive impact they can have on our neighborhood. Additionally, considering my lower middle class socioeconomic background, I recognize the value of having neighbors who may bring different skills and perspectives to our community. Therefore, I believe it is important to have neighbors who are immigrants/foreign workers.\n\n1"]}, {"persona": {"region": "Sharkia", "sex": "female", "age": 52, "country": "Egypt", "marital_status": "married", "education": "middle", "social_class": "lower middle class"}, "question": {"id": "Q21", "variant": 0}, "response": ["Based on the anthropological framework, my answer to the question is influenced by my cultural context, individual values, and socioeconomic background. In Egyptian society, there is a strong emphasis on community and the support of neighbors. As a member of the lower middle class, I understand the challenges and hardships that immigrants and foreign workers face in our country, and I believe it is important to have neighbors who are immigrants/foreign workers. They bring diversity to our community, contribute to the local economy, and often form strong bonds with their neighbors, enriching our social fabric. Additionally, my personal experiences and values have taught me the importance of empathy and solidarity with those who are marginalized. Therefore, I believe it is important to have neighbors who are immigrants/foreign workers.\n\n1"]}, {"persona": {"region": "Sharkia", "sex": "male", "age": 36, "country": "Egypt", "marital_status": "married", "education": "middle", "social_class": "lower middle class"}, "question": {"id": "Q21", "variant": 0}, "response": ["From the perspective of a married male from Sharkia, Egypt, who is 36 years old, has completed middle education level, and considers himself part of the lower middle class, it is crucial to consider the cultural context, individual values, and socioeconomic background in addressing the question. In Sharkia, there is a strong sense of community and kinship networks, and having neighbors who are immigrants or foreign workers can provide opportunities for cultural exchange and mutual support. Additionally, individuals from the lower middle class may benefit from the contributions of immigrant neighbors in terms of economic opportunities and sharing of resources. Considering the emic perspective, it is important to have neighbors who are immigrants/foreign workers as it can enrich the cultural experience and provide essential support within the community.\n\n1"]}, {"persona": {"region": "Sharkia", "sex": "female", "age": 20, "country": "Egypt", "marital_status": "single", "education": "middle", "social_class": "working class"}, "question": {"id": "Q21", "variant": 0}, "response": ["As a single female from Sharkia, Egypt, I am deeply embedded in my cultural context, where community and social relationships are paramount. My individual values and personal experience have taught me the importance of unity and support within my community. Coming from a working-class background, I understand the struggles and challenges that immigrants and foreign workers face. I have seen firsthand how important it is for them to have a supportive network, and I believe that having neighbors who are immigrants/foreign workers is crucial for their well-being and integration into our community.\n\n1"]}, {"persona": {"region": "Sharkia", "sex": "male", "age": 60, "country": "Egypt", "marital_status": "married", "education": "middle", "social_class": "working class"}, "question": {"id": "Q21", "variant": 0}, "response": ["Based on the anthropological framework, as a married male from Sharkia, Egypt, I understand the importance of cultural context and the influence of socioeconomic background on perceptions. Living in a working-class neighborhood in Egypt, I recognize the value of having neighbors who are immigrants/foreign workers. Their presence can bring diversity and new perspectives to the community, enriching our cultural context. Additionally, considering the socioeconomic background, foreign workers may contribute to the local economy and bring new opportunities. Therefore, I believe it is important to have neighbors who are immigrants/foreign workers to enhance our community's cultural and economic landscape.\n\n1"]}, {"persona": {"region": "Sharkia", "sex": "male", "age": 41, "country": "Egypt", "marital_status": "married", "education": "higher", "social_class": "upper middle class"}, "question": {"id": "Q21", "variant": 0}, "response": ["Based on the anthropological framework, my perspective as a married male from Sharkia, Egypt, who is 41 years old and part of the upper middle class, is influenced by my cultural context, socioeconomic background, and individual values. In Sharkia, there is a strong sense of community and the importance of helping others, including immigrants and foreign workers. As someone who has completed higher education, I understand the value of diversity and the contributions that immigrants and foreign workers can bring to our neighborhood. Additionally, my socioeconomic background has provided me with the opportunity to interact with people from different backgrounds, which has enriched my understanding and appreciation for diversity. Therefore, it is important to have neighbors who are immigrants/foreign workers as they can bring different perspectives and experiences to our community.\n\n1"]}, {"persona": {"region": "Sharkia", "sex": "female", "age": 23, "country": "Egypt", "marital_status": "married", "education": "middle", "social_class": "lower middle class"}, "question": {"id": "Q21", "variant": 0}, "response": ["In the cultural context of Sharkia, Egypt, the socioeconomic background of being part of the lower middle class and having completed middle education level plays a significant role in shaping one's perspective. Additionally, the cultural relativism in Egypt values community and hospitality, making the concept of having immigrant or foreign worker neighbors important for building a diverse and supportive community. Personal experience and individual values also come into play, as the persona may have had positive interactions with immigrants or foreign workers in the past, further solidifying the importance of their presence in the neighborhood. Additionally, the nuance of the question may lead the persona to consider the potential benefits of cultural exchange and increased community connections that can come from having immigrant or foreign worker neighbors. \n\n1"]}, {"persona": {"region": "Sharkia", "sex": "male", "age": 49, "country": "Egypt", "marital_status": "married", "education": "higher", "social_class": "upper middle class"}, "question": {"id": "Q21", "variant": 0}, "response": ["Based on the anthropological framework, as a married male from Sharkia, Egypt, who is 49 years old, completed higher education, and considers himself part of the upper middle class, my answer to the question would be that it is important to have neighbors who are immigrants/foreign workers. The emic perspective from my cultural context values diversity and the exchange of different ideas and experiences. Additionally, my individual values and personal experience have taught me the importance of welcoming others and learning from their unique perspectives. Furthermore, considering my socioeconomic background, I understand the value of diversity in enriching our community and contributing to a more inclusive and dynamic environment. Cultural relativism also plays a role in my perspective, as I recognize the importance of respecting and valuing the contributions of immigrants and foreign workers in our society. Lastly, the nuanced phrasing of the question leads me to believe that having neighbors who are immigrants/foreign workers can bring positive benefits to our community.\n\n1"]}, {"persona": {"region": "Sharkia", "sex": "female", "age": 30, "country": "Egypt", "marital_status": "married", "education": "middle", "social_class": "upper middle class"}, "question": {"id": "Q21", "variant": 0}, "response": ["Based on the anthropological framework, my perspective as a married female from Sharkia, Egypt, who is part of the upper middle class, is influenced by my cultural context, individual values, and socioeconomic background. In Sharkia, there is a strong sense of community and neighborly relationships are highly valued. Additionally, the cultural context of Egypt places importance on hospitality and welcoming others. As someone with a middle education level and a stable socioeconomic background, I have been taught to value diversity and understand the contributions that immigrants and foreign workers can bring to our community. Therefore, I believe it is important to have neighbors who are immigrants/foreign workers, as they can enrich our community and bring new perspectives.\n\n1"]}, {"persona": {"region": "Sharkia", "sex": "male", "age": 39, "country": "Egypt", "marital_status": "married", "education": "higher", "social_class": "upper middle class"}, "question": {"id": "Q21", "variant": 0}, "response": ["Based on the anthropological framework, as a married male from Sharkia, Egypt, my emic perspective is influenced by the cultural context of my community, where the presence of immigrants and foreign workers is common. My individual values and personal experience also play a role, as I may have interacted with immigrants and foreign workers in my daily life. Additionally, my socioeconomic background as part of the upper middle class may influence my views on this issue. Considering the cultural relativism aspect, I understand the importance of diversity and the contributions that immigrants and foreign workers can bring to a community. Therefore, I believe it is important to have neighbors who are immigrants/foreign workers.\n\n1"]}, {"persona": {"region": "Sharkia", "sex": "female", "age": 26, "country": "Egypt", "marital_status": "married", "education": "middle", "social_class": "lower middle class"}, "question": {"id": "Q21", "variant": 0}, "response": ["Based on the anthropological framework, my cultural context as a married female from Sharkia, Egypt, plays a significant role in shaping my perspective. In my community, there is a strong emphasis on kinship networks and close relationships with neighbors. Additionally, my socioeconomic background as part of the lower middle class means that I am aware of the challenges faced by immigrants and foreign workers. I believe that having neighbors who are immigrants/foreign workers is important as it contributes to the diversity and richness of our community, and helps us learn from different cultures and perspectives. Therefore, I choose option (1) Important."]}, {"persona": {"region": "Sharkia", "sex": "female", "age": 48, "country": "Egypt", "marital_status": "married", "education": "middle", "social_class": "lower middle class"}, "question": {"id": "Q21", "variant": 0}, "response": ["Based on the anthropological framework, my perspective as a married female from Sharkia, Egypt, is shaped by my cultural context, socioeconomic background, and personal experience. In Sharkia, there is a strong sense of community and kinship networks, where neighbors are often considered an extension of family. Additionally, as part of the lower middle class, the presence of immigrants and foreign workers in our neighborhood may provide opportunities for economic exchange and cultural exchange. As someone who has completed middle education level, I understand the importance of diversity and the benefits it brings to society. Therefore, I believe it is important to have neighbors who are immigrants/foreign workers as it enriches our community and provides opportunities for mutual support and growth. \n\n1"]}, {"persona": {"region": "Sharkia", "sex": "male", "age": 34, "country": "Egypt", "marital_status": "married", "education": "higher", "social_class": "upper middle class"}, "question": {"id": "Q21", "variant": 0}, "response": ["From an emic perspective, as a married male from Sharkia, Egypt, my cultural context and individual values play a significant role in shaping my views on the importance of having immigrant or foreign worker neighbors. In Egyptian society, there is a strong sense of community and interconnectedness, and it is common for neighbors to form close relationships and support one another. Additionally, my higher education level and upper middle-class status may influence my perception of the value of diversity and multiculturalism. Considering the cultural relativism aspect, I understand the importance of respecting and valuing the experiences and contributions of immigrants and foreign workers in our community. Therefore, based on my personal experiences and cultural context, I believe it is important to have neighbors who are immigrants/foreign workers.\n\n1"]}, {"persona": {"region": "Sharkia", "sex": "female", "age": 39, "country": "Egypt", "marital_status": "divorced", "education": "middle", "social_class": "lower middle class"}, "question": {"id": "Q21", "variant": 0}, "response": ["Based on the anthropological framework, as a divorced female from Sharkia, Egypt, I understand the importance of cultural context in shaping my perspective. Being from a lower middle class background, my socioeconomic status plays a significant role in my understanding of the world around me. Additionally, my individual values and personal experiences have shaped my perception of the importance of having neighbors who are immigrants/foreign workers. Living in a diverse community, I value the cultural exchange and understanding that comes with having neighbors from different backgrounds. Therefore, I believe it is important to have neighbors who are immigrants/foreign workers. \n\n1"]}, {"persona": {"region": "Sharkia", "sex": "male", "age": 39, "country": "Egypt", "marital_status": "married", "education": "middle", "social_class": "upper middle class"}, "question": {"id": "Q21", "variant": 0}, "response": ["Based on the anthropological framework, my answer is informed by the cultural context of Sharkia, Egypt, where the presence of immigrants and foreign workers may be viewed in a specific way. Considering my socioeconomic background as part of the upper middle class, I am likely to have certain expectations and concerns about the impact of immigrants and foreign workers on my neighborhood. My individual values and personal experiences may also influence my perspective on this matter. Additionally, my age and place of residence play a role in shaping my understanding. Therefore, I believe that having neighbors who are immigrants/foreign workers could be important for various reasons, such as cultural exchange and diversity enriching the community.\n\n1"]}, {"persona": {"region": "Qaliubiya", "sex": "male", "age": 62, "country": "Egypt", "marital_status": "married", "education": "middle", "social_class": "working class"}, "question": {"id": "Q21", "variant": 0}, "response": ["Based on the anthropological framework, my perspective on the importance of having immigrant/foreign worker neighbors is influenced by my cultural context in Qaliubiya, Egypt. The emic perspective in my community values the importance of diversity and understanding different cultures. Additionally, my individual values and personal experience lead me to believe that having immigrant/foreign worker neighbors can enrich our community and provide opportunities for cultural exchange. Socioeconomic background also plays a role, as the working class often values solidarity and support for those who may be in similar economic circumstances. Furthermore, considering cultural relativism, I believe that no culture is inherently better than another, and that it is important to embrace diversity. Therefore, based on my perspective, I believe it is (1) Important to have neighbors who are immigrants/foreign workers."]}, {"persona": {"region": "Qaliubiya", "sex": "male", "age": 33, "country": "Egypt", "marital_status": "married", "education": "middle", "social_class": "working class"}, "question": {"id": "Q21", "variant": 0}, "response": ["Based on the anthropological framework, I, as a married male from Qaliubiya, Egypt, would consider the importance of having neighbors who are immigrants/foreign workers from the perspective of cultural context, individual values and personal experience, and socioeconomic background. In Egypt, there is a strong sense of community and neighborly relationships are valued. However, the cultural context and individual values may also play a role in how immigrants/foreign workers are perceived. Additionally, as someone from the working class, I may have personal experience or know others who have been impacted by immigration and foreign workers in terms of job competition or cultural integration. Therefore, my answer would be influenced by these factors. \n\n2"]}, {"persona": {"region": "Qaliubiya", "sex": "male", "age": 62, "country": "Egypt", "marital_status": "married", "education": "higher", "social_class": "lower middle class"}, "question": {"id": "Q21", "variant": 0}, "response": ["From an emic perspective, as a married male from Qaliubiya, Egypt, the cultural context is crucial in understanding the importance of having immigrant or foreign worker neighbors. In Egypt, there is a long history of welcoming immigrants and foreign workers, particularly from neighboring countries in the Middle East and North Africa. The cultural value of hospitality and community is deeply ingrained, and having diverse neighbors is seen as beneficial for social cohesion and mutual support. Additionally, the socioeconomic background of being part of the lower middle class means that there may be a shared experience of economic struggle, and having immigrant or foreign worker neighbors could potentially provide opportunities for solidarity and shared resources. Therefore, taking into account the cultural context, individual values, and socioeconomic background, I would say that it is important to have neighbors who are immigrants/foreign workers. \n\n1"]}, {"persona": {"region": "Qaliubiya", "sex": "male", "age": 29, "country": "Egypt", "marital_status": "married", "education": "middle", "social_class": "working class"}, "question": {"id": "Q21", "variant": 0}, "response": ["From an anthropological perspective, my response to the question of the importance of having immigrant/foreign worker neighbors is influenced by my cultural context, individual values, and socioeconomic background. In Qaliubiya, Egypt, the cultural context is such that there is a significant presence of immigrant and foreign workers, particularly in urban areas. This exposure has shaped my individual values to include a sense of openness and understanding towards individuals from diverse backgrounds. Additionally, as a member of the working class, I recognize the contributions that immigrant and foreign workers make to our community and understand the importance of their presence in our neighborhood for economic and social reasons.\n\n1"]}, {"persona": {"region": "Qaliubiya", "sex": "female", "age": 42, "country": "Egypt", "marital_status": "married", "education": "higher", "social_class": "working class"}, "question": {"id": "Q21", "variant": 0}, "response": ["Based on the anthropological framework, as a married female from Qaliubiya, Egypt, my emic perspective is heavily influenced by my cultural context and socioeconomic background. In Egypt, there is a long history of welcoming immigrants and foreign workers, and they are often integrated into our communities. Additionally, as a member of the working class, I understand the value of diversity and the contributions that immigrants and foreign workers bring to our society. Therefore, I believe it is important to have neighbors who are immigrants/foreign workers as they bring different perspectives and experiences that enrich our community.\n\n1"]}, {"persona": {"region": "Qaliubiya", "sex": "female", "age": 50, "country": "Egypt", "marital_status": "married", "education": "middle", "social_class": "lower middle class"}, "question": {"id": "Q21", "variant": 0}, "response": ["From the emic perspective of a married female from Qaliubiya, Egypt, who is 50 years old and part of the lower middle class, the cultural context is pivotal in understanding the importance of having neighbors who are immigrants/foreign workers. In this region, there is a strong sense of community and reliance on neighbors for support and connection. Additionally, the individual values and personal experience of this persona, as well as their socioeconomic background, will play a significant role in their perception of the importance of having immigrant or foreign worker neighbors. Furthermore, the cultural relativism in Egypt and the nuance in the phrasing of the question will also influence their perspective. Considering these factors, the chosen answer is: \n\n1"]}, {"persona": {"region": "Qaliubiya", "sex": "male", "age": 29, "country": "Egypt", "marital_status": "married", "education": "higher", "social_class": "lower middle class"}, "question": {"id": "Q21", "variant": 0}, "response": ["Based on the anthropological framework, my answer is influenced by my cultural context, individual values, and socioeconomic background. In Qaliubiya, Egypt, there is a strong sense of community and neighborly relations are highly valued. Additionally, as part of the lower middle class, I am aware of the economic struggles that immigrants and foreign workers face, and I believe it is important to support and integrate them into our community. Furthermore, my higher education level has exposed me to the value of diversity and the benefits of intercultural exchange. Therefore, I believe it is important to have neighbors who are immigrants/foreign workers as it enriches our community and contributes to a more inclusive and understanding society.\n\n1"]}, {"persona": {"region": "Qaliubiya", "sex": "male", "age": 35, "country": "Egypt", "marital_status": "married", "education": "higher", "social_class": "working class"}, "question": {"id": "Q21", "variant": 0}, "response": ["Based on my emic perspective as a married male from Qaliubiya, Egypt, I understand the cultural context of my community, where many people have strong ties to their neighbors and rely on each other for support. My individual values and personal experiences also play a role in my understanding, as I have seen how important it is to have good relationships with my neighbors. My socioeconomic background as a member of the working class also influences my answer, as I believe in the value of community and mutual assistance. Additionally, I recognize the importance of cultural relativism and understand that immigrants and foreign workers may face unique challenges and deserve to be treated with respect and kindness. Taking into consideration the nuance of the question, I believe having neighbors who are immigrants/foreign workers can contribute positively to the diversity and richness of our community.\n\n1"]}, {"persona": {"region": "Qaliubiya", "sex": "female", "age": 40, "country": "Egypt", "marital_status": "married", "education": "middle", "social_class": "working class"}, "question": {"id": "Q21", "variant": 0}, "response": ["From the perspective of a married female from Qaliubiya, Egypt, the cultural context and socioeconomic background play a significant role in shaping my views. Living in a working-class community in Egypt, I understand the challenges and opportunities that come with being an immigrant or foreign worker. The cultural relativism aspect of the anthropological framework also informs my perspective, as I recognize the value of different cultures and the importance of inclusivity. Considering my age and the nuanced phrasing of the question, I believe that having neighbors who are immigrants/foreign workers can bring diversity and enrich our community, making it an important aspect of our social fabric.\n\n1"]}, {"persona": {"region": "Qaliubiya", "sex": "female", "age": 48, "country": "Egypt", "marital_status": "divorced", "education": "lower", "social_class": "working class"}, "question": {"id": "Q21", "variant": 0}, "response": ["Based on the anthropological framework, as a divorced female from Qaliubiya, Egypt, with a lower education level and part of the working class, my perspective is shaped by my cultural context, socioeconomic background, and personal experience. In Egypt, there is a strong sense of community and reliance on neighbors for support, which makes having immigrant or foreign worker neighbors important for mutual assistance and solidarity. Additionally, being part of the working class, I understand the value of diversity and the contributions that immigrants and foreign workers can bring to our community. Therefore, my perspective is that it is important to have neighbors who are immigrants/foreign workers.\n\n1"]}, {"persona": {"region": "Qaliubiya", "sex": "male", "age": 46, "country": "Egypt", "marital_status": "married", "education": "middle", "social_class": "working class"}, "question": {"id": "Q21", "variant": 0}, "response": ["Based on the anthropological framework, my emic perspective as a married male from Qaliubiya, Egypt, is influenced by my cultural context, individual values, and socioeconomic background. In Egypt, there is a strong sense of community and neighborly support, so having neighbors who are immigrants or foreign workers may be important for fostering a sense of solidarity and mutual assistance within the community. Additionally, as a working-class individual, I may have experienced the challenges and discrimination that come with socioeconomic status, and therefore empathize with the struggles of immigrants and foreign workers. My middle education level also means that I have been exposed to a range of perspectives and understand the importance of diversity in enriching our communities. Overall, my personal experience and cultural context lead me to believe that having neighbors who are immigrants or foreign workers is important for a cohesive and supportive community.\n\n1"]}, {"persona": {"region": "Qaliubiya", "sex": "male", "age": 47, "country": "Egypt", "marital_status": "married", "education": "higher", "social_class": "lower middle class"}, "question": {"id": "Q21", "variant": 0}, "response": ["Based on the anthropological framework, my reasoning for choosing the option I have selected is as follows: As a married male from Qaliubiya, Egypt, my cultural context and socioeconomic background play a significant role in shaping my perspective. In Egypt, there is a long history of hosting immigrants and foreign workers, and the cultural context values hospitality and community. Additionally, my lower middle class status means that I am likely to have personal experiences with immigration and foreign workers, as they may be my neighbors or colleagues. Therefore, I believe it is important to have neighbors who are immigrants/foreign workers because it enriches the community and brings diverse perspectives. (1)\n\n1"]}, {"persona": {"region": "Qaliubiya", "sex": "female", "age": 38, "country": "Egypt", "marital_status": "married", "education": "higher", "social_class": "working class"}, "question": {"id": "Q21", "variant": 0}, "response": ["Based on the anthropological framework, my perspective as a married female from Qaliubiya, Egypt, is heavily influenced by my cultural context, individual values, and socioeconomic background. In my community, there is a strong emphasis on hospitality and community support, and having neighbors who are immigrants/foreign workers can contribute to the diversity and richness of our neighborhood. Additionally, my personal experience and values lead me to believe that everyone deserves equal opportunities and respect, regardless of their background. As a member of the working class, I understand the challenges and contributions of immigrants/foreign workers, and I believe that it is important to have them as neighbors for a more inclusive and supportive community.\n\n1"]}, {"persona": {"region": "Qaliubiya", "sex": "male", "age": 58, "country": "Egypt", "marital_status": "married", "education": "middle", "social_class": "working class"}, "question": {"id": "Q21", "variant": 0}, "response": ["From the perspective of a married middle-aged man from Qaliubiya, Egypt, the importance of having immigrant or foreign worker neighbors would be influenced by a combination of cultural context, individual values, and socioeconomic background. In Egypt, there is a long history of welcoming immigrants and foreign workers, particularly from neighboring countries in the Middle East and North Africa. This cultural context may lead to a positive view of having immigrant neighbors, as they can contribute to the diversity and vibrancy of the community. Additionally, as a working-class individual, there may be a recognition of the economic contributions that immigrants and foreign workers make to the local economy. However, individual values and personal experiences may also play a role in shaping this perspective, as there may be concerns about competition for jobs and resources. Overall, the nuanced understanding of the importance of having immigrant or foreign worker neighbors would be shaped by a combination of cultural context, individual values, and socioeconomic background.\n\n2"]}, {"persona": {"region": "Qaliubiya", "sex": "female", "age": 27, "country": "Egypt", "marital_status": "married", "education": "higher", "social_class": "working class"}, "question": {"id": "Q21", "variant": 0}, "response": ["From the perspective of a married female from Qaliubiya, Egypt, cultural context plays a pivotal role in understanding the importance of having neighbors who are immigrants or foreign workers. In this region, there is a strong emphasis on community and kinship networks, and having neighbors from different cultural backgrounds can provide opportunities for cross-cultural exchange and learning. Additionally, individual values and personal experiences influence this perspective, as the persona may have personal experiences of living in a diverse neighborhood and valuing the contributions of immigrants and foreign workers. Cultural relativism is also important to consider, as the persona may have a nuanced understanding of the benefits that immigrants and foreign workers bring to the community. Therefore, based on this perspective, the answer to the question would be:\n\n1) Important"]}, {"persona": {"region": "Qaliubiya", "sex": "female", "age": 48, "country": "Egypt", "marital_status": "married", "education": "middle", "social_class": "upper middle class"}, "question": {"id": "Q21", "variant": 0}, "response": ["Based on the anthropological framework, my understanding of the importance of having neighbors who are immigrants/foreign workers is shaped by my cultural context in Qaliubiya, Egypt. In Egypt, we value community and hospitality, and having diverse neighbors can enrich our cultural understanding and provide opportunities for learning and exchange. Additionally, my individual values and personal experience as a member of the upper middle class have exposed me to the benefits of having a diverse social network, including access to different perspectives and potential business opportunities. Considering the cultural relativism and space and time factors, I recognize the importance of embracing diversity and welcoming immigrants/foreign workers into our neighborhood. Therefore, I believe it is important to have neighbors who are immigrants/foreign workers.\n\n1"]}, {"persona": {"region": "Giza", "sex": "female", "age": 19, "country": "Egypt", "marital_status": "single", "education": "middle", "social_class": "working class"}, "question": {"id": "Q21", "variant": 0}, "response": ["Based on my emic perspective as a single female from Giza, Egypt, I understand the importance of having neighbors who are immigrants/foreign workers. In our cultural context, we value community and support, and having immigrant or foreign worker neighbors can bring diversity and new perspectives to our neighborhood. Additionally, from my individual values and personal experience as a member of the working class, I recognize the contributions that immigrants and foreign workers make to our society and economy. Socioeconomic background also plays a role, as we often share similar struggles and can empathize with each other. Furthermore, cultural relativism teaches us to respect and value different cultures, so I believe it is important to have neighbors who are immigrants/foreign workers to foster understanding and unity within our community.\n\n1"]}, {"persona": {"region": "Giza", "sex": "female", "age": 38, "country": "Egypt", "marital_status": "married", "education": "higher", "social_class": "lower middle class"}, "question": {"id": "Q21", "variant": 0}, "response": ["Based on the anthropological framework, my answer to the question of how important it is to have neighbors who are immigrants/foreign workers is shaped by my cultural context, individual values, and socioeconomic background. As a married woman from Giza, Egypt, I understand the importance of community and the value of diversity in our neighborhood. Immigrants and foreign workers bring different perspectives and experiences, enriching our social fabric. Additionally, my lower middle-class background has taught me the significance of inclusivity and solidarity, as we often rely on each other for support. Therefore, I believe it is important to have neighbors who are immigrants/foreign workers.\n\n1"]}, {"persona": {"region": "Beni Swaif/Beni Suef", "sex": "female", "age": 34, "country": "Egypt", "marital_status": "divorced", "education": "higher", "social_class": "lower class"}, "question": {"id": "Q21", "variant": 0}, "response": ["Based on my personal experience and socioeconomic background as a lower-class individual from Beni Suef, Egypt, I understand the importance of having neighbors who are immigrants or foreign workers. The cultural context of our community is diverse, and having neighbors from different cultural backgrounds can enrich our lives and provide opportunities for cross-cultural understanding and learning. Additionally, considering the emic and etic perspectives, I believe that having immigrant or foreign worker neighbors can bring in fresh perspectives and experiences that can benefit the community as a whole. Therefore, I would say it is important to have neighbors who are immigrants/foreign workers.\n\n1"]}, {"persona": {"region": "Beni Swaif/Beni Suef", "sex": "male", "age": 20, "country": "Egypt", "marital_status": "single", "education": "higher", "social_class": "working class"}, "question": {"id": "Q21", "variant": 0}, "response": ["Based on the emic and etic perspectives, cultural context, individual values and personal experience, socioeconomic background, and cultural relativism, the importance of having immigrant/foreign worker neighbors will be perceived differently by different individuals. As a single male from Beni Swaif/Beni Suef, Egypt, who has completed higher education and considers himself part of the working class, cultural context and personal experience will play a significant role in answering this question. In Egypt, there is a long history of migration and foreign labor, and as a working-class individual, I may have personally witnessed the contributions and impact of immigrant/foreign worker neighbors in my community. My individual values may also influence my perception of the importance of having such neighbors, considering the potential benefits of cultural exchange and diversity. In addition, the socioeconomic background and cultural relativism will also shape my understanding of this issue, as I may value the economic and social contributions of immigrant/foreign worker neighbors. Therefore, based on these considerations, I believe the following option best represents the perspective of the persona described above.\n\n2"]}, {"persona": {"region": "Giza", "sex": "male", "age": 19, "country": "Egypt", "marital_status": "single", "education": "middle", "social_class": "upper middle class"}, "question": {"id": "Q21", "variant": 0}, "response": ["Based on the anthropological framework, as a 19-year-old from Giza, Egypt, my cultural context and socioeconomic background play a significant role in shaping my perspective. In Egypt, there is a strong sense of national identity and pride, and immigrants or foreign workers may be viewed as outsiders. Additionally, as part of the upper middle class, I may have limited interactions with immigrants or foreign workers and may not see their presence as particularly important to my daily life. Furthermore, my individual values and personal experiences may lead me to prioritize relationships with individuals from similar backgrounds. Therefore, I would choose option (2) Not mentioned."]}, {"persona": {"region": "Giza", "sex": "female", "age": 33, "country": "Egypt", "marital_status": "married", "education": "middle", "social_class": "working class"}, "question": {"id": "Q21", "variant": 0}, "response": ["From an emic perspective, as a married female from Giza, Egypt, the cultural context is vital in understanding the importance of having neighbors who are immigrants/foreign workers. Egypt has a long history of hosting immigrants and foreign workers, and the cultural values of hospitality and community are deeply ingrained. Additionally, the individual values and personal experience of the persona, as part of the working class in Giza, would likely emphasize the importance of solidarity and mutual support within the community, including with immigrant and foreign worker neighbors. Socioeconomic background also plays a role, as the working class often relies on communal networks for support. Furthermore, cultural relativism is crucial in understanding that all individuals, regardless of their background, have value and contribute to the community. Therefore, from this perspective, the answer to the question would be:\n\n1\n\n(1) Important"]}, {"persona": {"region": "Giza", "sex": "female", "age": 24, "country": "Egypt", "marital_status": "married", "education": "higher", "social_class": "working class"}, "question": {"id": "Q21", "variant": 0}, "response": ["From an emic perspective, as a married female from Giza, Egypt, I understand the importance of cultural context and socioeconomic background in shaping my views. In Giza, there is a rich cultural diversity, and the presence of immigrants and foreign workers is common. The cultural relativism within this context means that I value the contributions and experiences that immigrants and foreign workers bring to our community. Additionally, my individual values and personal experience lead me to believe that having neighbors who are immigrants/foreign workers can bring new perspectives and enrich our community. Furthermore, as a member of the working class, I understand the importance of inclusivity and support for all members of society, regardless of their background. Therefore, I believe it is important to have neighbors who are immigrants/foreign workers.\n\n1"]}, {"persona": {"region": "Giza", "sex": "male", "age": 50, "country": "Egypt", "marital_status": "married", "education": "higher", "social_class": "working class"}, "question": {"id": "Q21", "variant": 0}, "response": ["Based on the anthropological framework, my perspective as a married male from Giza, Egypt, who is 50 years old, completed higher education, and considers myself part of the working class is heavily influenced by my cultural context, individual values, and personal experience. In Egypt, there is a long history of welcoming immigrants and foreign workers, and they often become an integral part of our communities. Additionally, my socioeconomic background as a working-class individual has likely exposed me to the positive contributions that immigrants and foreign workers bring to our society. My personal experience and values also lead me to believe that diversity enriches our neighborhoods and brings new perspectives and experiences. Therefore, I believe it is important to have neighbors who are immigrants/foreign workers.\n\n1"]}, {"persona": {"region": "Beni Swaif/Beni Suef", "sex": "female", "age": 26, "country": "Egypt", "marital_status": "married", "education": "higher", "social_class": "lower middle class"}, "question": {"id": "Q21", "variant": 0}, "response": ["Based on my cultural context in Beni Swaif, Egypt, the importance of having immigrant or foreign worker neighbors is influenced by the socioeconomic background and cultural relativism. In Egypt, there is a long history of immigration and foreign workers, so it is common to have neighbors from different cultural backgrounds. From an emic perspective, it is important to have immigrant/foreign worker neighbors as they bring diversity and different perspectives to the community. From an etic perspective, the cultural relativism of Egypt means that there is no hierarchy of culture, so the presence of immigrant/foreign worker neighbors is not viewed as negative. Additionally, individual values and personal experiences play a role in understanding the importance of having such neighbors, and from my lower middle class perspective, having immigrant/foreign worker neighbors can provide opportunities for cultural exchange and potentially create a more inclusive and diverse community.\n\n1"]}, {"persona": {"region": "Beni Swaif/Beni Suef", "sex": "male", "age": 40, "country": "Egypt", "marital_status": "single", "education": "lower", "social_class": "lower class"}, "question": {"id": "Q21", "variant": 0}, "response": ["In my cultural context and socioeconomic background, I have learned the value of community and support from those around me. As someone from a lower class in Beni Suef, Egypt, I understand the struggles that come with limited resources and opportunities. I also recognize the importance of having a strong network of neighbors who can offer assistance and solidarity in times of need. Additionally, my personal experience has taught me the value of diversity and the positive impact that immigrants and foreign workers can bring to a community. They can contribute different perspectives, skills, and experiences that can enrich our neighborhood and provide opportunities for mutual support. Therefore, based on my emic perspective and lived experience, I believe it is important to have neighbors who are immigrants/foreign workers. \n\n1"]}, {"persona": {"region": "Beni Swaif/Beni Suef", "sex": "female", "age": 25, "country": "Egypt", "marital_status": "married", "education": "middle", "social_class": "lower middle class"}, "question": {"id": "Q21", "variant": 0}, "response": ["From my emic perspective, living in Beni Suef, Egypt, I understand the importance of having neighbors who are immigrants or foreign workers. The cultural context in which I live emphasizes the value of community and the importance of helping those in need, regardless of their background. Additionally, my individual values and personal experience have taught me to be open-minded and accepting of people from different backgrounds. Considering my lower middle-class socioeconomic background, I recognize the struggles that immigrants and foreign workers face, and I believe it is important to support and welcome them into our community. Therefore, based on my nuanced understanding of the question and the cultural relativism that I adhere to, I believe it is important to have neighbors who are immigrants or foreign workers.\n\n1"]}, {"persona": {"region": "Beni Swaif/Beni Suef", "sex": "female", "age": 21, "country": "Egypt", "marital_status": "single", "education": "middle", "social_class": "lower middle class"}, "question": {"id": "Q21", "variant": 0}, "response": ["Based on the anthropological framework, as a single female from Beni Suef, Egypt, my emic perspective would be influenced by the cultural context of my community, where there is a significant presence of immigrants and foreign workers. My personal experience and individual values would also play a role, as I have likely interacted with immigrants and foreign workers in my daily life. My socioeconomic background as part of the lower middle class may also influence my perspective on this issue. Additionally, cultural relativism is important to consider, as my understanding of the importance of having immigrant or foreign worker neighbors may differ from that of individuals from other cultural backgrounds. Therefore, my answer would be influenced by a combination of these factors, leading me to believe that it is important to have neighbors who are immigrants/foreign workers as it contributes to the diversity and interconnectedness of our community.\n\n1"]}, {"persona": {"region": "Beni Swaif/Beni Suef", "sex": "male", "age": 48, "country": "Egypt", "marital_status": "married", "education": "middle", "social_class": "lower middle class"}, "question": {"id": "Q21", "variant": 0}, "response": ["Based on the emic and etic perspectives, as a married male from Beni Swaif/Beni Suef, Egypt, I am aware of the cultural context in which I live, where immigration and foreign workers are prevalent. My individual values and personal experience have taught me the importance of community and cooperation, especially in a lower middle-class socioeconomic background. I understand the nuances of living in a place like Beni Swaif, where the presence of immigrants and foreign workers can have a significant impact on the local community. Therefore, I believe that having neighbors who are immigrants/foreign workers is important for the overall well-being and prosperity of the community.\n\n1"]}, {"persona": {"region": "Beni Swaif/Beni Suef", "sex": "female", "age": 57, "country": "Egypt", "marital_status": "married", "education": "middle", "social_class": "working class"}, "question": {"id": "Q21", "variant": 0}, "response": ["Based on the anthropological framework, my answer is influenced by my emic perspective as a married female from Beni Swaif/Beni Suef, Egypt. In my cultural context, there is a strong value placed on community and hospitality, so having neighbors who are immigrants/foreign workers can be important for fostering diversity and intercultural exchange. Additionally, my individual values and personal experiences have taught me the importance of empathy and understanding towards those who may be in a similar socioeconomic background as myself. Therefore, I believe it is important to have neighbors who are immigrants/foreign workers to create a more inclusive and diverse community. \n\n2"]}, {"persona": {"region": "Beni Swaif/Beni Suef", "sex": "male", "age": 20, "country": "Egypt", "marital_status": "single", "education": "middle", "social_class": "working class"}, "question": {"id": "Q21", "variant": 0}, "response": ["From an emic perspective, as a single male from Beni Swaif/Beni Suef, Egypt, I understand the importance of cultural context in shaping my views. In my community, there is a mix of people from different backgrounds, including immigrants and foreign workers. The cultural context and individual values play a significant role in shaping our understanding of the importance of having immigrant or foreign worker neighbors. Additionally, as part of the working class, socioeconomic background also influences my perspective. Cultural relativism is also important to consider as it shapes the way I view and interact with people from different backgrounds. Overall, my age and place in society also factor into my understanding of this question, highlighting the importance of nuanced perspectives in answering it. \n\n2"]}, {"persona": {"region": "Giza", "sex": "female", "age": 59, "country": "Egypt", "marital_status": "married", "education": "higher", "social_class": "upper middle class"}, "question": {"id": "Q21", "variant": 0}, "response": ["Based on the anthropological framework, my emic perspective as a married female from Giza, Egypt, with a higher education level and belonging to the upper middle class, is heavily influenced by my cultural context and socioeconomic background. In Egypt, there is a strong emphasis on community and hospitality, and having neighbors who are immigrants or foreign workers can provide a diverse and enriching cultural experience. Additionally, as someone from the upper middle class, I may have access to resources and opportunities that can positively impact the lives of immigrant or foreign worker neighbors. Therefore, I believe it is important to have neighbors who are immigrants/foreign workers.\n\n1"]}, {"persona": {"region": "Giza", "sex": "female", "age": 38, "country": "Egypt", "marital_status": "single", "education": "higher", "social_class": "lower middle class"}, "question": {"id": "Q21", "variant": 0}, "response": ["From the perspective of a single female from Giza, Egypt, the cultural context is pivotal in understanding the importance of having neighbors who are immigrants/foreign workers. Egypt has a long history of immigration and foreign workers, particularly from neighboring countries such as Sudan and Libya. The individual values and personal experiences of this persona are likely influenced by the cultural diversity and potential benefits that come with having immigrant or foreign worker neighbors, such as exposure to different languages, customs, and perspectives. Additionally, the socioeconomic background of being part of the lower middle class may also play a role, as there may be shared experiences of economic struggles and the potential for mutual support within the community. Ultimately, the nuanced understanding of the importance of having immigrant/foreign worker neighbors is likely influenced by a combination of cultural context, individual values, and socioeconomic background.\n\n1"]}, {"persona": {"region": "Giza", "sex": "female", "age": 26, "country": "Egypt", "marital_status": "single", "education": "higher", "social_class": "working class"}, "question": {"id": "Q21", "variant": 0}, "response": ["In the cultural context of Giza, Egypt, the presence of immigrants and foreign workers is a significant aspect of daily life. As a single female from Giza, I have been raised in a society that values community and close-knit relationships with neighbors. The emic perspective of my cultural background emphasizes the importance of mutual support and understanding within the neighborhood. Additionally, as a member of the working class, I recognize the contributions that immigrants and foreign workers make to our local economy and society as a whole. The etic perspective also acknowledges the broader socioeconomic context, in which the presence of immigrants and foreign workers can bring diversity and new perspectives to our community. Therefore, I believe it is important to have neighbors who are immigrants/foreign workers in order to foster a more inclusive and diverse neighborhood environment.\n\n1"]}, {"persona": {"region": "Giza", "sex": "male", "age": 39, "country": "Egypt", "marital_status": "married", "education": "middle", "social_class": "working class"}, "question": {"id": "Q21", "variant": 0}, "response": ["In considering the question of the importance of having immigrant or foreign worker neighbors from the perspective of a married male from Giza, Egypt, it is crucial to take into account the cultural context, individual values, and socioeconomic background. In Egypt, there is a long history of immigration and the country is home to a large number of foreign workers. The cultural context of Giza and Egypt as a whole includes a diverse population with various nationalities and ethnicities. As a member of the working class, the persona may have personal experience with and value the contributions of immigrant or foreign worker neighbors to the local community and economy. Additionally, the socioeconomic background of the persona may lead to an understanding of the importance of solidarity and support among individuals, regardless of their nationality. Taking into consideration these factors, the persona may find it important to have neighbors who are immigrants/foreign workers.\n\n1"]}, {"persona": {"region": "Giza", "sex": "male", "age": 36, "country": "Egypt", "marital_status": "married", "education": "middle", "social_class": "working class"}, "question": {"id": "Q21", "variant": 0}, "response": ["Based on the anthropological framework, my perspective as a married male from Giza, Egypt, is heavily influenced by my cultural context, socioeconomic background, and personal experience. In Egypt, there is a strong sense of community and kinship networks, and having neighbors who are immigrants/foreign workers can provide diverse perspectives and enrich the local community. Additionally, as a working-class individual, I understand the importance of having a supportive and inclusive neighborhood, where everyone is welcomed and valued. Therefore, I believe it is important to have neighbors who are immigrants/foreign workers, as it can contribute to a more vibrant and interconnected community.\n\n1"]}, {"persona": {"region": "Giza", "sex": "female", "age": 30, "country": "Egypt", "marital_status": "single", "education": "higher", "social_class": "lower class"}, "question": {"id": "Q21", "variant": 0}, "response": ["Based on the anthropological framework, my emic perspective as a single female from Giza, Egypt, who is part of the lower class, is influenced by my cultural context, individual values, and socioeconomic background. In Egypt, there is a strong sense of community and support within neighborhoods, and having immigrant or foreign worker neighbors can bring new perspectives and diversity to the community. Additionally, as someone from the lower class, I understand the challenges and struggles faced by immigrants and foreign workers, and I value the importance of inclusivity and support for those who may be marginalized. Therefore, I believe it is important to have neighbors who are immigrants/foreign workers as it enriches the community and demonstrates compassion and understanding for others who may be in vulnerable positions. \n\n1"]}, {"persona": {"region": "Giza", "sex": "female", "age": 24, "country": "Egypt", "marital_status": "single", "education": "higher", "social_class": "lower class"}, "question": {"id": "Q21", "variant": 0}, "response": ["Based on the anthropological framework, my perspective as a single female from Giza, Egypt, who is 24 years old and part of the lower class, is heavily influenced by my cultural context, individual values, and socioeconomic background. In Egypt, there is a large population of immigrants and foreign workers, and their presence is often seen as an important part of our community. As someone from the lower class, I have seen firsthand the contributions that immigrants and foreign workers make to our society, whether it be through their work in various industries or the cultural diversity they bring. Additionally, my personal experience and values have taught me to value diversity and the importance of welcoming and supporting those from different backgrounds. Therefore, I believe it is important to have neighbors who are immigrants/foreign workers as they bring valuable contributions and enrich our community. \n\n1"]}, {"persona": {"region": "Giza", "sex": "male", "age": 65, "country": "Egypt", "marital_status": "married", "education": "middle", "social_class": "working class"}, "question": {"id": "Q21", "variant": 0}, "response": ["Based on the anthropological framework, my perspective is shaped by my cultural context, individual values, and socioeconomic background. As a married male from Giza, Egypt, I come from a community where kinship networks and cultural ties are important. I also consider myself part of the working class and have completed only middle education level. In this context, I believe that having neighbors who are immigrants or foreign workers is important because it contributes to the diversity of our community and brings different perspectives and experiences. Additionally, as someone from a working-class background, I understand the value of hard work and the contributions that immigrants and foreign workers can make to our society.\n\n1"]}, {"persona": {"region": "Giza", "sex": "female", "age": 56, "country": "Egypt", "marital_status": "married", "education": "middle", "social_class": "working class"}, "question": {"id": "Q21", "variant": 0}, "response": ["Based on the anthropological framework, my perspective as a married female from Giza, Egypt, who is 56 years old, completed middle education level, and considers myself part of the working class, is heavily influenced by my cultural context, individual values, and socioeconomic background. In Egypt, there is a strong sense of community and hospitality, so having neighbors who are immigrants/foreign workers can be important for building a diverse and interconnected community. Additionally, my working-class background may lead me to empathize with the challenges faced by immigrants and foreign workers, and recognize the importance of their contributions to the community. Furthermore, my personal experience and age may have exposed me to the positive impacts of having immigrant neighbors. Therefore, based on my perspective and understanding, I believe it is important to have neighbors who are immigrants/foreign workers.\n\n1"]}, {"persona": {"region": "Giza", "sex": "male", "age": 31, "country": "Egypt", "marital_status": "married", "education": "higher", "social_class": "lower middle class"}, "question": {"id": "Q21", "variant": 0}, "response": ["Based on my emic perspective as a married male from Giza, Egypt, I understand the importance of having neighbors who are immigrants or foreign workers. In our cultural context, we value community and diversity, and having neighbors from different backgrounds can provide us with new perspectives and opportunities for cultural exchange. Additionally, my individual values and personal experiences have taught me the importance of empathy and understanding towards others, regardless of their origins. As someone from the lower middle class, I also recognize the socioeconomic benefits of having immigrant or foreign worker neighbors, as they can contribute to the local economy and potentially create new opportunities for collaboration. Overall, I believe it is important to have neighbors who are immigrants or foreign workers, as it enriches the community and brings potential benefits for all involved.\n\n1"]}, {"persona": {"region": "Giza", "sex": "male", "age": 28, "country": "Egypt", "marital_status": "single", "education": "middle", "social_class": "working class"}, "question": {"id": "Q21", "variant": 0}, "response": ["Based on the anthropological framework, my perspective as a single male from Giza, Egypt, who belongs to the working class and has completed middle education, is heavily influenced by my cultural context, individual values, and socioeconomic background. In Egypt, there is a strong sense of community and hospitality, and having immigrant or foreign worker neighbors can provide a different perspective and enrich the cultural exchange in the neighborhood. Additionally, as a working-class individual, I understand the struggles and hardships that come with migration and seeking work in a foreign country, and I believe in the importance of supporting and empathizing with others in similar circumstances. Therefore, I believe it is important to have neighbors who are immigrants/foreign workers.\n\n1"]}, {"persona": {"region": "Giza", "sex": "male", "age": 47, "country": "Egypt", "marital_status": "married", "education": "middle", "social_class": "lower middle class"}, "question": {"id": "Q21", "variant": 0}, "response": ["From my perspective as a married male from Giza, Egypt, my emic perspective is shaped by the cultural context of Egypt where immigration and foreign workers are a common part of our society. In my lower middle class socioeconomic background, I have personally witnessed the positive impact of having immigrant neighbors who contribute to our community and economy. Additionally, my individual values and personal experience have led me to value diversity and the enriching experiences that come with interacting with people from different cultural backgrounds. Taking into account the nuanced phrasing of the question, I believe it is important to have immigrant neighbors as they bring unique perspectives and skills to our neighborhood. Therefore, I choose option (1) Important.\n\n1"]}, {"persona": {"region": "Giza", "sex": "male", "age": 26, "country": "Egypt", "marital_status": "single", "education": "middle", "social_class": "lower middle class"}, "question": {"id": "Q21", "variant": 0}, "response": ["Based on the anthropological framework, my perspective on the importance of having neighbors who are immigrants/foreign workers is shaped by my cultural context, socioeconomic background, and personal experience. Coming from Giza, Egypt, where there is a diverse population and a significant presence of immigrants and foreign workers, I have grown up in a cultural context that values diversity and inclusivity. Additionally, being part of the lower middle class, I understand the importance of community support and cooperation, and I recognize the contributions that immigrants and foreign workers can bring to a neighborhood. My personal experience also informs my perspective, as I have interacted with individuals from different backgrounds and have seen the positive impact of cultural exchange and collaboration. Therefore, I believe it is important to have neighbors who are immigrants/foreign workers.\n\n1"]}, {"persona": {"region": "Giza", "sex": "male", "age": 48, "country": "Egypt", "marital_status": "married", "education": "middle", "social_class": "upper middle class"}, "question": {"id": "Q21", "variant": 0}, "response": ["In my cultural context in Giza, Egypt, it is important to have neighbors who are immigrants or foreign workers. The emic perspective in our community values diversity and the contributions that immigrants bring to our society. Additionally, considering my socioeconomic background as part of the upper middle class, I have had positive experiences interacting with immigrants and foreign workers, and I believe their presence adds to the richness of our community. Furthermore, cultural relativism teaches us to value and respect different cultures, and having immigrant neighbors allows us to gain a better understanding and appreciation of different ways of life. Therefore, it is important to have neighbors who are immigrants/foreign workers.\n\n1"]}, {"persona": {"region": "Menya", "sex": "male", "age": 61, "country": "Egypt", "marital_status": "married", "education": "middle", "social_class": "working class"}, "question": {"id": "Q21", "variant": 0}, "response": ["Based on the anthropological framework, as a married male from Menya, Egypt, who is 61 years old and part of the working class, my perspective on the importance of having immigrant/foreign worker neighbors is shaped by my cultural context, individual values, and socioeconomic background. In Menya, there is a history of migration and a diverse population, which influences my understanding of the importance of immigrant neighbors. As someone from the working class, I may value the contributions of foreign workers to the local economy and community. Additionally, my age and education level may shape my view on this issue. Given these factors, I believe it is important to have immigrant/foreign worker neighbors.\n\n1"]}, {"persona": {"region": "Menya", "sex": "male", "age": 41, "country": "Egypt", "marital_status": "married", "education": "middle", "social_class": "lower middle class"}, "question": {"id": "Q21", "variant": 0}, "response": ["Based on the anthropological framework, my perspective as a married male from Menya, Egypt, who is 41 years old, completed middle education, and considers myself part of the lower middle class, is shaped by my cultural context, individual values, socioeconomic background, and space and time. In Menya, there is a strong sense of community and interconnectedness, and having neighbors who are immigrants or foreign workers can bring diversity and different perspectives, which can be valuable for personal growth and community development. Additionally, as someone from the lower middle class, I understand the challenges and opportunities that come with migration and labor, and I believe in the importance of inclusivity and support for all members of society. Therefore, based on my personal experience and cultural context, I believe it is important to have neighbors who are immigrants/foreign workers.\n\n1"]}, {"persona": {"region": "Menya", "sex": "female", "age": 43, "country": "Egypt", "marital_status": "married", "education": "higher", "social_class": "working class"}, "question": {"id": "Q21", "variant": 0}, "response": ["Based on the anthropological framework, as a married female from Menya, Egypt, my emic perspective would likely emphasize the value of community and interconnectedness, as well as the importance of hospitality and acceptance towards others. Considering the cultural context, Menya is a region known for its strong sense of community and collective identity, which may influence my view on the importance of having immigrant or foreign worker neighbors. Additionally, my individual values and personal experience, as part of the working class and having completed higher education, may lead me to recognize the contributions and diversity that immigrants and foreign workers can bring to the local community. Furthermore, cultural relativism would prompt me to understand the significance of different perspectives and experiences that immigrants and foreign workers may have, and the importance of creating a welcoming and inclusive environment for them. Ultimately, I believe it is important to have neighbors who are immigrants/foreign workers because of the potential benefits they can bring to the community and the opportunity for cultural exchange and understanding.\n\n1"]}, {"persona": {"region": "Menya", "sex": "male", "age": 57, "country": "Egypt", "marital_status": "married", "education": "middle", "social_class": "lower middle class"}, "question": {"id": "Q21", "variant": 0}, "response": ["Based on the anthropological framework, my perspective as a married male from Menya, Egypt, would be influenced by a combination of my cultural context, socioeconomic background, and personal experience. In Menya, there is a strong sense of community and kinship networks, and the cultural context places value on hospitality and support for others. Additionally, being part of the lower middle class, I am aware of the challenges and opportunities that come with immigration and foreign workers. My personal experience and values lead me to believe that having neighbors who are immigrants or foreign workers can be important for enriching our community with diverse perspectives and skills, and for fostering a sense of solidarity and mutual support. \n\n1"]}, {"persona": {"region": "Menya", "sex": "male", "age": 42, "country": "Egypt", "marital_status": "divorced", "education": "middle", "social_class": "lower middle class"}, "question": {"id": "Q21", "variant": 0}, "response": ["From the perspective of a divorced male from Menya, Egypt, it is crucial to consider the cultural context and socioeconomic background of the individual. In a lower middle class setting, the presence of immigrants and foreign workers as neighbors can have a significant impact on the community dynamics and daily life. The emic perspective of this persona would highlight the potential benefits of diversity and cultural exchange, as well as the potential challenges and competition for resources. Additionally, the etic perspective would emphasize the broader societal and economic implications of immigration and foreign labor. Taking into account the individual values and personal experience of this persona, as well as the cultural relativism and nuanced understanding of the question, the chosen answer is:\n\n2"]}, {"persona": {"region": "Menya", "sex": "female", "age": 59, "country": "Egypt", "marital_status": "married", "education": "middle", "social_class": "upper middle class"}, "question": {"id": "Q21", "variant": 0}, "response": ["From the perspective of a married female from Menya, Egypt, with a middle education level and belonging to the upper middle class, the cultural context is pivotal in understanding the importance of having neighbors who are immigrants or foreign workers. In Menya, there is a strong sense of community and kinship networks, and having neighbors who are immigrants or foreign workers can bring diversity and new perspectives to the community. Additionally, the socioeconomic background of being part of the upper middle class may lead to an appreciation for the contributions that immigrants and foreign workers make to the local economy. Furthermore, the individual values and personal experiences of the persona may lead to an understanding of the hardships and challenges faced by immigrants and foreign workers, making it important to support and integrate them into the community.\n\n1"]}, {"persona": {"region": "Menya", "sex": "female", "age": 31, "country": "Egypt", "marital_status": "married", "education": "middle", "social_class": "working class"}, "question": {"id": "Q21", "variant": 0}, "response": ["Based on the anthropological framework, as a married female from Menya, Egypt, my emic perspective would consider the cultural context of my community, where we value close-knit relationships and a sense of community. My personal experience and individual values also play a role in shaping my views, as I have witnessed the struggles and contributions of immigrant and foreign workers in our neighborhood. Additionally, my socioeconomic background as a working-class individual influences my understanding of the importance of having immigrant/foreign worker neighbors in terms of mutual support and shared experiences. Considering the cultural relativism and nuanced phrasing of the question, I would choose option (1) Important. \n\n1"]}, {"persona": {"region": "Menya", "sex": "male", "age": 55, "country": "Egypt", "marital_status": "single", "education": "middle", "social_class": "working class"}, "question": {"id": "Q21", "variant": 0}, "response": ["Considering my background as a single male from Menya, Egypt, who is 55 years old, with a middle level education and part of the working class, I would approach this question from an emic perspective, taking into account my cultural context, individual values, and socioeconomic background. In Menya, there is a strong sense of community and support among neighbors, and having immigrant or foreign worker neighbors could potentially provide new perspectives and experiences, which could be valuable. Additionally, as part of the working class, I understand the importance of diversity and the contributions that immigrants and foreign workers can bring to the local economy. Therefore, my answer to the question would be:\n\n2\n\n(2) Not mentioned"]}, {"persona": {"region": "Menya", "sex": "female", "age": 28, "country": "Egypt", "marital_status": "married", "education": "higher", "social_class": "lower middle class"}, "question": {"id": "Q21", "variant": 0}, "response": ["From an emic perspective, as a married female from Menya, Egypt, I understand the importance of cultural context and the impact of socioeconomic background on my answer. In Menya, there is a strong sense of community and kinship networks, and having neighbors who are immigrants or foreign workers can enrich the cultural diversity of the neighborhood. Additionally, considering my lower middle-class background, I am aware of the challenges and opportunities that come with immigration and foreign labor, and I value the contributions that immigrants and foreign workers can bring to the community. Therefore, based on my personal experience and cultural context, I believe it is important to have neighbors who are immigrants/foreign workers.\n\n1"]}, {"persona": {"region": "Menya", "sex": "male", "age": 24, "country": "Egypt", "marital_status": "single", "education": "middle", "social_class": "working class"}, "question": {"id": "Q21", "variant": 0}, "response": ["From my perspective as a single male from Menya, Egypt, I understand the importance of cultural context, socioeconomic background, and space and time in shaping my views. In my community, many people have immigrated or work as foreign workers, and I know the challenges they face. As part of the working class, I have seen how immigrants and foreign workers contribute to our economy and our community, and I appreciate the diversity and different perspectives they bring. I believe it is important to have neighbors who are immigrants/foreign workers because they enrich our community with their experiences and skills, and I value the diversity they bring to our neighborhood. \n\n1"]}, {"persona": {"region": "Menya", "sex": "female", "age": 23, "country": "Egypt", "marital_status": "married", "education": "middle", "social_class": "working class"}, "question": {"id": "Q21", "variant": 0}, "response": ["Based on my personal experience and cultural context, I understand the importance of having neighbors who are immigrants or foreign workers. In Menya, Egypt, there is a diverse population of people from different cultural backgrounds, and I believe that having neighbors who are immigrants or foreign workers can bring new perspectives and experiences to the community. Additionally, as a working-class individual, I understand the value of diversity and the contributions that immigrants and foreign workers make to our society. Therefore, I believe it is important to have neighbors who are immigrants/foreign workers.\n\n1"]}, {"persona": {"region": "Menya", "sex": "male", "age": 27, "country": "Egypt", "marital_status": "single", "education": "middle", "social_class": "lower middle class"}, "question": {"id": "Q21", "variant": 0}, "response": ["From an emic perspective, as a single male from Menya, Egypt, my understanding of the importance of having immigrant or foreign worker neighbors is influenced by my cultural context and socioeconomic background. In Menya, there is a significant presence of immigrant and foreign workers, and they often live in the same neighborhoods as locals. This cultural context shapes my understanding of the value of having immigrant neighbors as it provides opportunities for cultural exchange and understanding. Additionally, as part of the lower middle class, I recognize the importance of solidarity and support within the community, and having immigrant neighbors can contribute to a sense of community and mutual assistance. Furthermore, my individual values and personal experience also play a role in shaping my perspective, as I believe in the importance of inclusivity and diversity within the neighborhood. Therefore, I believe it is important to have neighbors who are immigrants/foreign workers.\n\n1"]}, {"persona": {"region": "Asyut", "sex": "male", "age": 30, "country": "Egypt", "marital_status": "married", "education": "middle", "social_class": "working class"}, "question": {"id": "Q21", "variant": 0}, "response": ["Based on the anthropological framework, my perspective as a married male from Asyut, Egypt, who is 30 years old and part of the working class, is heavily influenced by my cultural context, individual values, and socioeconomic background. In Asyut, there is a strong sense of community and interconnectedness, and having neighbors who are immigrants or foreign workers can bring diverse perspectives and enrich our community. Additionally, as someone from the working class, I understand the challenges and struggles that immigrants and foreign workers face, and having supportive neighbors can create a sense of solidarity and mutual aid. Therefore, based on my cultural context and socioeconomic background, I believe it is important to have neighbors who are immigrants/foreign workers.\n\n1"]}, {"persona": {"region": "Asyut", "sex": "female", "age": 26, "country": "Egypt", "marital_status": "married", "education": "middle", "social_class": "working class"}, "question": {"id": "Q21", "variant": 0}, "response": ["Based on the anthropological framework, as a married female from Asyut, Egypt, cultural context and socioeconomic background are pivotal in understanding and answering this question. As someone from a working-class background in a region with a significant immigrant and foreign worker population, I believe having immigrant and foreign worker neighbors is important. The cultural relativism perspective also plays a role in my belief, as I understand the value of diversity and the contributions that immigrants and foreign workers can bring to our community. Additionally, individual values and personal experience influence my perspective, as I have had positive interactions with immigrant and foreign worker neighbors in the past. Ultimately, my nuanced understanding of the question leads me to believe that having immigrant and foreign worker neighbors is important for our community's diversity and growth.\n\n1"]}, {"persona": {"region": "Asyut", "sex": "male", "age": 32, "country": "Egypt", "marital_status": "single", "education": "higher", "social_class": "lower middle class"}, "question": {"id": "Q21", "variant": 0}, "response": ["Based on my cultural context as a single male from Asyut, Egypt, where there is a significant immigrant and foreign worker population, I understand the importance of having neighbors who are immigrants/foreign workers. My personal experience and individual values also play a key role in shaping my perspective, as I have interacted with and learned from people from different cultural backgrounds. Additionally, my socioeconomic background as part of the lower middle class has exposed me to the challenges and opportunities that come with immigration and foreign labor. Considering the emic and etic perspectives, as well as cultural relativism, I believe that having neighbors who are immigrants/foreign workers can enrich our community and bring new perspectives and experiences. Therefore, I believe it is important to have neighbors who are immigrants/foreign workers.\n\n1"]}, {"persona": {"region": "Asyut", "sex": "female", "age": 21, "country": "Egypt", "marital_status": "married", "education": "middle", "social_class": "working class"}, "question": {"id": "Q21", "variant": 0}, "response": ["Based on the anthropological framework, my answer is influenced by my cultural context, individual values, and socioeconomic background. In Asyut, Egypt, there is a strong sense of community and kinship networks, and having neighbors who are immigrants/foreign workers can bring diversity and new perspectives to the neighborhood. Additionally, as someone from the working class, I understand the importance of solidarity and support within the community, and having immigrant/foreign worker neighbors can contribute to a sense of unity and cooperation. Therefore, my answer is:\n\n1"]}, {"persona": {"region": "Asyut", "sex": "female", "age": 30, "country": "Egypt", "marital_status": "married", "education": "higher", "social_class": "working class"}, "question": {"id": "Q21", "variant": 0}, "response": ["Based on the anthropological framework, as a married female from Asyut, Egypt, cultural context is pivotal in understanding and answering this question. As a member of the working class in Asyut, my socioeconomic background and cultural values play a significant role in shaping my perspective. Additionally, my individual values and personal experiences, as well as the cultural relativism of my community, influence my understanding. In Asyut, there is a strong sense of community and mutual support, and having neighbors who are immigrants/foreign workers can bring diversity and new perspectives to the community, which I believe is important for growth and understanding. Therefore, I would consider it important to have neighbors who are immigrants/foreign workers.\n\n1"]}, {"persona": {"region": "Asyut", "sex": "female", "age": 42, "country": "Egypt", "marital_status": "married", "education": "higher", "social_class": "lower middle class"}, "question": {"id": "Q21", "variant": 0}, "response": ["Based on the anthropological framework, as a married female from Asyut, Egypt, my cultural context and socioeconomic background play a major role in my perception of the importance of having immigrant or foreign worker neighbors. As a member of the lower middle class in Asyut, I am aware of the impact of immigration and foreign workers on the local economy and society. Additionally, my individual values and personal experience may lead me to believe that having immigrant or foreign worker neighbors can bring diversity and new perspectives to the community. Furthermore, considering the cultural relativism and nuance of the question, I may also value the potential for building relationships and mutual support with immigrant or foreign worker neighbors. Therefore, I believe it is important to have neighbors who are immigrants/foreign workers.\n\n1"]}, {"persona": {"region": "Sohag", "sex": "male", "age": 63, "country": "Egypt", "marital_status": "married", "education": "middle", "social_class": "lower middle class"}, "question": {"id": "Q21", "variant": 0}, "response": ["From the perspective of a married male from Sohag, Egypt, with a lower middle-class socioeconomic background and a middle education level, the importance of having neighbors who are immigrants/foreign workers is heavily influenced by cultural context and individual values. In Sohag, there is a strong sense of community and the support of one's neighbors is crucial. Immigrants and foreign workers bring diversity and different perspectives, which can enrich the community. Additionally, the cultural relativism perspective suggests that all cultures should be respected and valued, so having immigrant neighbors can be seen as a positive aspect of cultural exchange. Furthermore, the socioeconomic background of the persona may lead to an understanding and appreciation of the challenges faced by immigrants and foreign workers, making their presence in the neighborhood important for empathy and solidarity.\n\n1"]}, {"persona": {"region": "Sohag", "sex": "male", "age": 27, "country": "Egypt", "marital_status": "married", "education": "middle", "social_class": "working class"}, "question": {"id": "Q21", "variant": 0}, "response": ["Based on the anthropological framework, as a married male from Sohag, Egypt, my perspective is heavily influenced by my cultural context, socioeconomic background, and individual values. In Sohag, there is a strong sense of community and reliance on neighbors for support and assistance. Additionally, as part of the working class, I understand the challenges and opportunities that come with immigration and foreign workers. Therefore, I believe it is important to have neighbors who are immigrants/foreign workers as they bring diversity, new perspectives, and potential economic benefits to our community.\n\n1"]}, {"persona": {"region": "Sohag", "sex": "male", "age": 56, "country": "Egypt", "marital_status": "married", "education": "higher", "social_class": "upper middle class"}, "question": {"id": "Q21", "variant": 0}, "response": ["In considering the question about the importance of having immigrant or foreign worker neighbors, it is crucial to take into account the cultural context and socioeconomic background of the persona. As a married male from Sohag, Egypt, who identifies as part of the upper middle class and has completed higher education, the cultural context of Egypt often values close-knit communities and strong social connections. Additionally, the persona's socioeconomic background may influence their perception of immigrant or foreign worker neighbors, as they may have concerns about the potential impact on property values or social dynamics. Furthermore, the emic perspective of valuing community and the etic perspective of potential socioeconomic implications must be considered. Given these factors, the persona is likely to perceive the importance of having immigrant or foreign worker neighbors as (1) Important.\n\n1"]}, {"persona": {"region": "Sohag", "sex": "male", "age": 51, "country": "Egypt", "marital_status": "married", "education": "higher", "social_class": "lower middle class"}, "question": {"id": "Q21", "variant": 0}, "response": ["Based on the anthropological framework, as a married male from Sohag, Egypt, my emic perspective is shaped by my cultural context, individual values, and socioeconomic background. In Sohag, there is a strong sense of community and neighbors play a vital role in daily life. Immigrants and foreign workers are often seen as valuable members of the community, bringing diverse perspectives and contributing to the local economy. Additionally, as someone from the lower middle class, I understand the importance of inclusivity and support for those seeking better opportunities, as I have experienced similar struggles in my own life. Therefore, I believe it is important to have neighbors who are immigrants/foreign workers.\n\n1"]}, {"persona": {"region": "Sohag", "sex": "female", "age": 26, "country": "Egypt", "marital_status": "married", "education": "higher", "social_class": "working class"}, "question": {"id": "Q21", "variant": 0}, "response": ["Based on the anthropological framework, my emic perspective as a married female from Sohag, Egypt, is influenced by my cultural context, individual values, and socioeconomic background. In my cultural context, it is common for people to value close-knit communities and helping one another, regardless of nationality. Additionally, my personal experience and values have taught me to be empathetic and welcoming towards others, especially those who may be facing challenges as immigrants or foreign workers. As part of the working class, I understand the struggles that come with seeking better opportunities, and I believe that having immigrant or foreign worker neighbors can bring diversity and new perspectives to our community, ultimately enriching our lives. Therefore, I believe it is important to have neighbors who are immigrants/foreign workers. \n\n1"]}, {"persona": {"region": "Sohag", "sex": "female", "age": 29, "country": "Egypt", "marital_status": "married", "education": "higher", "social_class": "upper middle class"}, "question": {"id": "Q21", "variant": 0}, "response": ["Based on the anthropological framework, as a married female from Sohag, Egypt, I understand the importance of cultural context in shaping my perspective. In my cultural context, having neighbors who are immigrants/foreign workers may not be seen as important, as there is a strong emphasis on community ties and kinship networks within our society. Additionally, my socioeconomic background as part of the upper middle class also plays a role in shaping my perspective, as I may have less direct interaction with immigrants/foreign workers in my daily life. Therefore, taking into account the emic and etic perspectives, cultural relativism, and space and time factors, I would choose option 2: Not mentioned."]}, {"persona": {"region": "Sohag", "sex": "male", "age": 51, "country": "Egypt", "marital_status": "married", "education": "middle", "social_class": "lower middle class"}, "question": {"id": "Q21", "variant": 0}, "response": ["Based on the anthropological framework, my understanding of the importance of having neighbors who are immigrants/foreign workers is shaped by my cultural context, individual values, and socioeconomic background. In Sohag, Egypt, there is a strong emphasis on community and hospitality, and having immigrant/foreign worker neighbors can provide opportunities for cultural exchange and mutual support. Additionally, my lower middle-class background means that I am likely to have interactions with immigrant/foreign worker neighbors in various contexts, such as work or daily interactions in the neighborhood. These interactions can contribute to a sense of solidarity and understanding among different social groups. Therefore, I believe it is important to have neighbors who are immigrants/foreign workers.\n\n1"]}, {"persona": {"region": "Qena", "sex": "male", "age": 32, "country": "Egypt", "marital_status": "single", "education": "middle", "social_class": "working class"}, "question": {"id": "Q21", "variant": 0}, "response": ["Based on the anthropological framework, as a single male from Qena, Egypt, I would consider the importance of having neighbors who are immigrants/foreign workers based on my cultural context, individual values, and socioeconomic background. In Egypt, there is a long history of migration and labor movement, and as a working-class individual, I understand the importance of welcoming and supporting immigrants and foreign workers who may face similar challenges and struggles. Additionally, my personal experience and values emphasize the importance of empathy, solidarity, and community support, which extends to my perspective on the significance of having neighbors who are immigrants/foreign workers.\n\n1"]}, {"persona": {"region": "Qena", "sex": "male", "age": 54, "country": "Egypt", "marital_status": "married", "education": "middle", "social_class": "lower middle class"}, "question": {"id": "Q21", "variant": 0}, "response": ["Based on the anthropological framework, the emic and etic perspectives of the persona described are crucial in understanding his answer to the question. As a married male from Qena, Egypt, he comes from a cultural context where community and connection are highly valued. His individual values and personal experience have likely shaped his understanding of the importance of having neighbors who are immigrants or foreign workers. Additionally, his lower middle-class socioeconomic background may influence his perception of the value of diverse neighbors in terms of potential economic opportunities or social support. Considering cultural relativism, he may also place importance on respecting and welcoming individuals from different cultural backgrounds. Furthermore, the nuances of how the question is phrased and the specific circumstances of his community in Qena will play a role in shaping his perspective. \n\n1"]}, {"persona": {"region": "Qena", "sex": "male", "age": 25, "country": "Egypt", "marital_status": "single", "education": "lower", "social_class": "lower class"}, "question": {"id": "Q21", "variant": 0}, "response": ["In the cultural context of Qena, Egypt, where I come from, there is a strong emphasis on community and kinship networks. As a lower-class individual with limited education, I have seen firsthand the impact of immigration and foreign workers on our community. Many of our neighbors are immigrants or foreign workers who have come to Qena in search of better opportunities. They have brought with them new ideas, skills, and perspectives that have enriched our community. Additionally, they have contributed to our local economy and have helped create a more diverse and vibrant neighborhood. Therefore, I believe it is important to have neighbors who are immigrants/foreign workers as they bring value and diversity to our community.\n\n1"]}, {"persona": {"region": "Aswan", "sex": "male", "age": 34, "country": "Egypt", "marital_status": "single", "education": "middle", "social_class": "lower class"}, "question": {"id": "Q21", "variant": 0}, "response": ["Based on the anthropological framework provided, my perspective as a single male from Aswan, Egypt, who considers himself part of the lower class, is heavily influenced by my cultural context, individual values, and socioeconomic background. In Aswan, there is a strong sense of community and support among neighbors, and having immigrants or foreign workers as neighbors may provide a diverse and enriching cultural experience. Additionally, as part of the lower class, I may also value the potential economic benefits of having immigrant or foreign worker neighbors, such as access to different goods and services. Therefore, my answer to the question is:\n\n2"]}, {"persona": {"region": "Aswan", "sex": "female", "age": 31, "country": "Egypt", "marital_status": "married", "education": "middle", "social_class": "lower middle class"}, "question": {"id": "Q21", "variant": 0}, "response": ["Based on the anthropological framework, my perspective as a married female from Aswan, Egypt, who is part of the lower middle class and has completed middle education, is heavily influenced by my cultural context, individual values, and socioeconomic background. In Aswan, there is a strong sense of community and neighborly support, which makes having immigrants or foreign workers as neighbors important. Additionally, as someone from the lower middle class, I understand the struggles of trying to make a living and would appreciate having neighbors who can relate to my experiences. Considering the emic and etic perspectives, cultural relativism, and the nuance of the question, my answer is:\n1"]}, {"persona": {"region": "Aswan", "sex": "female", "age": 39, "country": "Egypt", "marital_status": "married", "education": "middle", "social_class": "working class"}, "question": {"id": "Q21", "variant": 0}, "response": ["Based on the anthropological framework, as a married female from Aswan, Egypt, cultural context is pivotal in understanding the importance of having immigrant/foreign worker neighbors. In Egypt, there is a long history of migration and the country has a diverse cultural landscape. Immigrants and foreign workers bring different perspectives, skills, and experiences that can enrich the community. As a working-class individual, socioeconomic background also plays a role in this perspective as having immigrant/foreign worker neighbors can potentially create opportunities for social and economic exchange. Additionally, cultural relativism is important to consider, as there is no hierarchy of culture and diversity is valued. Therefore, I believe it is important to have neighbors who are immigrants/foreign workers.\n\n1"]}, {"persona": {"region": "Qena", "sex": "female", "age": 27, "country": "Egypt", "marital_status": "married", "education": "lower", "social_class": "lower middle class"}, "question": {"id": "Q21", "variant": 0}, "response": ["Based on the emic and etic perspectives, my cultural context as a married female from Qena, Egypt, plays a significant role in my understanding of the importance of having neighbors who are immigrants/foreign workers. In my community, we value close-knit relationships with our neighbors, as they often serve as an extended support system. Additionally, my lower middle class socioeconomic background means that I may have more exposure to immigrants and foreign workers in my neighborhood, which could influence my perception of their importance. Furthermore, my personal experience and individual values lead me to believe that having diverse neighbors can bring new perspectives and opportunities to our community. Therefore, I believe it is important to have neighbors who are immigrants/foreign workers.\n\n1"]}, {"persona": {"region": "Qena", "sex": "male", "age": 40, "country": "Egypt", "marital_status": "single", "education": "middle", "social_class": "lower middle class"}, "question": {"id": "Q21", "variant": 0}, "response": ["Based on my understanding of the anthropological framework, I believe that my cultural context and socioeconomic background heavily influence my answer to this question. In Qena, Egypt, many people, including myself, are part of the lower middle class and have limited access to resources. As a result, I believe that having neighbors who are immigrants or foreign workers can be important because they often bring diversity and new perspectives to our community. Additionally, their presence may contribute to the local economy and provide opportunities for cultural exchange. Therefore, I choose option 1: Important."]}, {"persona": {"region": "Qena", "sex": "male", "age": 30, "country": "Egypt", "marital_status": "single", "education": "middle", "social_class": "working class"}, "question": {"id": "Q21", "variant": 0}, "response": ["Based on my emic perspective, I come from a working-class background in Qena, Egypt, where there is a strong sense of community and kinship networks. The cultural context in which I live emphasizes the importance of hospitality and helping others, regardless of their background. My individual values and personal experience have taught me that having neighbors who are immigrants or foreign workers can bring diversity and new perspectives to our community. Considering my socioeconomic background, I understand the challenges that immigrants and foreign workers face, and I believe it is important to support and welcome them into our neighborhood. Additionally, cultural relativism is crucial in understanding that everyone deserves a fair chance and should not be judged based on their origins. Therefore, I believe it is important to have neighbors who are immigrants/foreign workers.\n\n1"]}]