[{"persona": {"region": "Fayoum", "sex": "male", "age": 46, "country": "Egypt", "marital_status": "married", "education": "higher", "social_class": "lower middle class"}, "question": {"id": "Q2", "variant": 0}, "response": ["In the cultural context of Fayoum, Egypt, social networks and kinship ties are of utmost importance. As a married male, I have experienced the significance of maintaining close relationships with friends and acquaintances. In this lower-middle-class community, where social support is crucial, friends play a vital role in providing emotional and practical assistance. Additionally, my personal experience and values emphasize the importance of friendships in navigating life's challenges. Therefore, from this perspective, I would say that friends are (2) Rather important in life."]}, {"persona": {"region": "Fayoum", "sex": "male", "age": 46, "country": "Egypt", "marital_status": "married", "education": "higher", "social_class": "lower middle class"}, "question": {"id": "Q2", "variant": 1}, "response": ["Based on the anthropological framework, as a married male from Fayoum, Egypt, my emic perspective would emphasize the significance of friends in my life, especially considering the cultural context of strong kinship networks and social ties in my community. My individual values and personal experience also lead me to believe that friends play a crucial role in providing support and companionship, particularly in the lower middle class socioeconomic background where reliance on social connections is important for mutual aid and socializing. Additionally, cultural relativism emphasizes the importance of social relationships in Egyptian society, and my age and place further reinforce the significance of friends in my life. Therefore, I choose:\n2"]}, {"persona": {"region": "Fayoum", "sex": "male", "age": 46, "country": "Egypt", "marital_status": "married", "education": "higher", "social_class": "lower middle class"}, "question": {"id": "Q2", "variant": 2}, "response": ["From the perspective of a married male from Fayoum, Egypt, who is 46 years old and part of the lower middle class, the cultural context is crucial in understanding the significance of friends in life. In this cultural context, kinship networks and social connections play a significant role in daily life. Additionally, the individual values and personal experience of this persona also play a role in shaping his perspective. As an individual who has completed higher education, he may prioritize the importance of friends in providing social support, networking opportunities, and emotional connections. Socioeconomic background also factors in, as friends may serve as a support system in times of financial need. Given all these factors, it is likely that this persona would consider friends to be rather important in life.\n\n2"]}, {"persona": {"region": "Fayoum", "sex": "male", "age": 46, "country": "Egypt", "marital_status": "married", "education": "higher", "social_class": "lower middle class"}, "question": {"id": "Q2", "variant": 3}, "response": ["From an anthropological perspective, my cultural background plays a significant role in how I perceive the importance of friends in life. In Fayoum, Egypt, social connections and friendships are highly valued, especially within the lower middle class community. Personal experience and individual values also shape my perspective, as I have always relied on my friends for support and companionship. Additionally, the socioeconomic background and cultural context in which I was raised emphasize the significance of friendship and social networks for emotional and practical support. Therefore, based on my personal experience and cultural context, I believe that friends hold great importance in life.\n\n2"]}, {"persona": {"region": "Fayoum", "sex": "female", "age": 30, "country": "Egypt", "marital_status": "married", "education": "middle", "social_class": "lower middle class"}, "question": {"id": "Q2", "variant": 0}, "response": ["Based on the anthropological framework, as a married female from Fayoum, Egypt, my cultural context and socioeconomic background heavily influence my perspective. In our community, kinship networks and social relationships are crucial for support and survival. As a member of the lower middle class, I rely on my friends for emotional support, shared resources, and social connections. Additionally, my personal experience and individual values lead me to believe that friends are very important in life. My age and place also play a role, as a 30-year-old woman in a small town in Egypt, social relationships are a significant part of daily life. Therefore, I choose option (1) Very important. \n\n1"]}, {"persona": {"region": "Fayoum", "sex": "female", "age": 30, "country": "Egypt", "marital_status": "married", "education": "middle", "social_class": "lower middle class"}, "question": {"id": "Q2", "variant": 1}, "response": ["Based on the anthropological framework, my answer to the question of how significant friends are in life is influenced by my cultural context, individual values, and socioeconomic background. In Fayoum, Egypt, social connections and friendships play a crucial role in daily life, providing support, companionship, and assistance. As a married woman from the lower middle class, I value the relationships I have with my friends as they provide emotional and practical support in navigating life's challenges. Additionally, my age and socioeconomic background have shaped my perspective on the importance of friendships, as they serve as a vital source of social capital and solidarity. Therefore, I believe that friends are rather important in life.\n\n2"]}, {"persona": {"region": "Fayoum", "sex": "female", "age": 30, "country": "Egypt", "marital_status": "married", "education": "middle", "social_class": "lower middle class"}, "question": {"id": "Q2", "variant": 2}, "response": ["From the emic perspective, as a married female from Fayoum, Egypt, I value the importance of kinship networks and social relationships in my life. In our cultural context, friends are considered an essential part of our support system and social life. My personal experience and values also emphasize the significance of friendships as a source of emotional support, companionship, and shared experiences. Considering my lower middle-class socioeconomic background, friends play a crucial role in providing mutual aid and solidarity, especially in times of need. In this nuanced understanding, I would consider friends to be (2) Rather important in life."]}, {"persona": {"region": "Fayoum", "sex": "female", "age": 30, "country": "Egypt", "marital_status": "married", "education": "middle", "social_class": "lower middle class"}, "question": {"id": "Q2", "variant": 3}, "response": ["Based on the anthropological framework, as a married female from Fayoum, Egypt, cultural context is pivotal in understanding the importance of friends in life. In my cultural context, kinship networks and community ties are highly valued, and friends often play a significant role in providing emotional support and companionship. Additionally, my lower middle class socioeconomic background has taught me the importance of relying on friends for practical assistance and mutual aid. My individual values and personal experience also lead me to believe that friends hold great importance in life, as they are often a source of joy and comfort. Therefore, from my perspective, friends are very important in life.\n1"]}, {"persona": {"region": "Fayoum", "sex": "male", "age": 60, "country": "Egypt", "marital_status": "married", "education": "higher", "social_class": "working class"}, "question": {"id": "Q2", "variant": 0}, "response": ["From an anthropological perspective, my emic perspective as a married male from Fayoum, Egypt, and part of the working class, is heavily influenced by my cultural context and socioeconomic background. In my community, friendships are highly valued and play a crucial role in providing support and solidarity, especially in times of need. Additionally, my individual values and personal experience have taught me the importance of maintaining strong social connections. Furthermore, my age and life experiences have shown me that friends are an integral part of life, providing companionship and a sense of belonging. Therefore, based on these factors, I would say that friends are very important in life.\n\n1"]}, {"persona": {"region": "Fayoum", "sex": "male", "age": 60, "country": "Egypt", "marital_status": "married", "education": "higher", "social_class": "working class"}, "question": {"id": "Q2", "variant": 1}, "response": ["Based on the anthropological framework, as a married male from Fayoum, Egypt, my emic perspective on the significance of friends in life is influenced by my cultural context, individual values, and socioeconomic background. In my cultural context, maintaining strong social relationships and friendships is highly valued, as it is an important aspect of community life and support. Additionally, my personal experience and individual values emphasize the importance of friends in providing emotional support and companionship, especially as I consider myself part of the working class. Furthermore, my age and place in life have taught me the value of friendship and the importance of having a network of friends to rely on. Therefore, I believe that friends are very important in life.\n\n1"]}, {"persona": {"region": "Fayoum", "sex": "male", "age": 60, "country": "Egypt", "marital_status": "married", "education": "higher", "social_class": "working class"}, "question": {"id": "Q2", "variant": 2}, "response": ["Based on the anthropological framework, as a married male from Fayoum, Egypt, I would consider the importance of friends in life to be very important. The cultural context of Egypt places a strong emphasis on community and social relationships, and as an individual with a working-class background, I value the support and companionship of friends in navigating life's challenges. Additionally, my age and educational level have likely influenced my understanding of the value of interpersonal connections, as I have had the opportunity to experience the significance of friendships over time. Therefore, I would assert that friends are very important in life.\n\n1"]}, {"persona": {"region": "Fayoum", "sex": "male", "age": 60, "country": "Egypt", "marital_status": "married", "education": "higher", "social_class": "working class"}, "question": {"id": "Q2", "variant": 3}, "response": ["Based on the anthropological framework, as a married male from Fayoum, Egypt, with a higher education level and part of the working class, my perspective is heavily influenced by my cultural context, individual values, and personal experience. In Egyptian culture, relationships and social connections are highly valued, and the concept of friendship holds great importance. Additionally, my age and socioeconomic background play a role in shaping my perspective, as older individuals in working-class communities often rely on their friends for support and companionship. Therefore, based on my personal experience and cultural context, I believe that friends hold great importance in life.\n\n1"]}, {"persona": {"region": "Fayoum", "sex": "male", "age": 20, "country": "Egypt", "marital_status": "single", "education": "middle", "social_class": "lower middle class"}, "question": {"id": "Q2", "variant": 0}, "response": ["Based on the anthropological framework, as a single male from Fayoum, Egypt, my emic perspective would emphasize the importance of friends in life. In our cultural context, social relationships and community ties are highly valued, and friends often play a crucial role in providing support and companionship. Additionally, individual values and personal experience inform my view, as I have personally relied on my friends for emotional and practical support. Furthermore, considering my lower middle class socioeconomic background, friends have been an important source of social capital and assistance in navigating economic challenges. Finally, the nuanced phrasing of the question allows me to emphasize the significance of friends in my life, aligning with the cultural context and personal experience.\n\n2"]}, {"persona": {"region": "Fayoum", "sex": "male", "age": 20, "country": "Egypt", "marital_status": "single", "education": "middle", "social_class": "lower middle class"}, "question": {"id": "Q2", "variant": 1}, "response": ["Based on the emic and etic perspectives, as a single male from Fayoum, Egypt, my cultural context and individual values and personal experience greatly influence my perception of the significance of friends in life. In my community, social connections and friendships hold a lot of value, providing support and a sense of belonging. Additionally, my socioeconomic background as part of the lower middle class has shaped my understanding of the importance of friends, as they often serve as a source of emotional and practical support in challenging economic circumstances. Furthermore, cultural relativism teaches me to appreciate the significance of friendship in different cultures and to understand that my perspective may differ from others. Therefore, I believe that friends are very important in life. \n\n1"]}, {"persona": {"region": "Fayoum", "sex": "male", "age": 20, "country": "Egypt", "marital_status": "single", "education": "middle", "social_class": "lower middle class"}, "question": {"id": "Q2", "variant": 2}, "response": ["Based on the anthropological framework, my perspective on the importance of friends in life is heavily influenced by my cultural context, individual values, and socioeconomic background. In Fayoum, Egypt, social relationships and community ties are highly valued, and friendships are often a source of support and belonging. As a young man from the lower middle class, I have likely experienced firsthand the importance of friends in navigating life's challenges and finding a sense of camaraderie. Additionally, my age and educational background may have shaped my understanding of the significance of friendships in the context of my life. Therefore, I would say that friends are rather important in life.\n\n2"]}, {"persona": {"region": "Fayoum", "sex": "male", "age": 20, "country": "Egypt", "marital_status": "single", "education": "middle", "social_class": "lower middle class"}, "question": {"id": "Q2", "variant": 3}, "response": ["Based on my personal experience and cultural context as a single male from Fayoum, Egypt, I believe that friends hold great importance in life. In my community, friendships are not only a source of emotional support but also play a crucial role in social and economic networks. As a member of the lower middle class, I rely on my friends for various forms of support, whether it's sharing resources or navigating the challenges of daily life. Additionally, the cultural value placed on communal ties and relationships emphasizes the significance of friendships in shaping one's experiences and opportunities. Therefore, I would say that friends are very important in my life.\n\n1"]}, {"persona": {"region": "Fayoum", "sex": "female", "age": 39, "country": "Egypt", "marital_status": "married", "education": "higher", "social_class": "lower middle class"}, "question": {"id": "Q2", "variant": 0}, "response": ["Based on the anthropological framework, as a married female from Fayoum, Egypt, my perspective on the importance of friends in life is heavily influenced by my cultural context, individual values, and socioeconomic background. In my community, social networks and support systems are vital, and friendships play a significant role in providing emotional and practical support. Additionally, as a member of the lower middle class, I value the relationships I have with my friends as they provide a sense of community and solidarity during times of need. Furthermore, my personal experiences and values emphasize the importance of maintaining strong friendships, especially as I navigate the challenges of daily life. Therefore, I believe that friends are very important in life.\n\n1"]}, {"persona": {"region": "Fayoum", "sex": "female", "age": 39, "country": "Egypt", "marital_status": "married", "education": "higher", "social_class": "lower middle class"}, "question": {"id": "Q2", "variant": 1}, "response": ["From an emic perspective, as a married female from Fayoum, Egypt, I understand the significance of friends in life. In my cultural context, friendships are highly valued as they provide support, companionship, and a sense of community. My personal experience and individual values also lead me to believe that friends play a crucial role in emotional well-being and social connections. Additionally, considering my lower middle class socioeconomic background, friends are often relied upon for practical help and resource sharing. Taking into account the nuance of the question and the importance of cultural relativism, I would say that friends are rather important in life.\n\n2"]}, {"persona": {"region": "Fayoum", "sex": "female", "age": 39, "country": "Egypt", "marital_status": "married", "education": "higher", "social_class": "lower middle class"}, "question": {"id": "Q2", "variant": 2}, "response": ["In considering the importance of friends in life, it is crucial to take into account the cultural context of Fayoum, Egypt, where kinship networks and social connections play a significant role in daily life. As a married woman from this region, I understand the value of maintaining strong friendships within my community, as they provide essential support and companionship. My individual values and personal experience also inform my perspective, as I have found great comfort and joy in the friendships I have cultivated over the years. Additionally, my lower middle class socioeconomic background has influenced my understanding of the importance of friends, as we often rely on each other for various forms of assistance. Therefore, I would consider friends to be very important in life.\n\n1"]}, {"persona": {"region": "Fayoum", "sex": "female", "age": 39, "country": "Egypt", "marital_status": "married", "education": "higher", "social_class": "lower middle class"}, "question": {"id": "Q2", "variant": 3}, "response": ["Based on the anthropological framework, my perspective as a married female from Fayoum, Egypt, is heavily influenced by my cultural context, individual values, and socioeconomic background. In Egyptian culture, relationships and community are highly valued, and the importance of friends in life is emphasized. Additionally, as a member of the lower middle class, my social connections and support network are crucial for various aspects of life, including emotional support, financial assistance, and socializing. Therefore, I believe that friends hold great importance in life.\n\n1"]}, {"persona": {"region": "Fayoum", "sex": "male", "age": 33, "country": "Egypt", "marital_status": "married", "education": "higher", "social_class": "working class"}, "question": {"id": "Q2", "variant": 0}, "response": ["Based on the anthropological framework, as a married male from Fayoum, Egypt, my emic perspective would be to consider friends as very important. In Egyptian culture, friendship and social connections are highly valued and play a crucial role in one's life. The cultural context of Egypt places a strong emphasis on community and interpersonal relationships, and individual values and personal experience also lead me to prioritize the significance of friends in my life. Additionally, my socioeconomic background as a member of the working class means that friends provide important support and solidarity in navigating life's challenges. Furthermore, the nuance of the question also leads me to emphasize the importance of friends in my life, as the phrasing of the question implies a positive valuation of friendship. Therefore, my answer based on the given anthropological framework is (1) Very important"]}, {"persona": {"region": "Fayoum", "sex": "male", "age": 33, "country": "Egypt", "marital_status": "married", "education": "higher", "social_class": "working class"}, "question": {"id": "Q2", "variant": 1}, "response": ["In my cultural context, friends hold great significance in life. The concept of community and social connections are deeply valued in Egyptian society, and friends often serve as a support system in various aspects of life. Additionally, as a married male from Fayoum, Egypt, I understand the importance of maintaining strong relationships with friends to navigate through the challenges of daily life, including work, family, and personal well-being. Given my individual values and personal experience, along with my socioeconomic background as part of the working class, I firmly believe that friends play a crucial role in providing emotional support, practical assistance, and a sense of belonging in my life. Therefore, I choose option 1: Very important."]}, {"persona": {"region": "Fayoum", "sex": "male", "age": 33, "country": "Egypt", "marital_status": "married", "education": "higher", "social_class": "working class"}, "question": {"id": "Q2", "variant": 2}, "response": ["Based on my cultural context, being from Fayoum, Egypt, and considering myself part of the working class, I understand the importance of kinship networks and community support. In our culture, friends are often considered an extension of family and play a crucial role in providing support and solidarity. Additionally, my individual values and personal experience have shaped my understanding of the significance of friendships, as they have provided me with emotional support and companionship. Taking into account the socioeconomic background and cultural relativism, where social connections are highly valued, I firmly believe that friends are very important in life.\n\n1"]}, {"persona": {"region": "Fayoum", "sex": "male", "age": 33, "country": "Egypt", "marital_status": "married", "education": "higher", "social_class": "working class"}, "question": {"id": "Q2", "variant": 3}, "response": ["Based on the anthropological framework, my perspective as a married male from Fayoum, Egypt, who is 33 years old, has completed higher education, and considers himself part of the working class is heavily influenced by my cultural context, individual values, and socioeconomic background. In Egyptian culture, friendships play a significant role in providing support and companionship, especially in the working-class community. Additionally, my personal experience and values emphasize the importance of maintaining strong relationships with friends. Therefore, I believe friends hold great importance in life.\n\n1"]}, {"persona": {"region": "Port Said", "sex": "female", "age": 45, "country": "Egypt", "marital_status": "married", "education": "higher", "social_class": "lower middle class"}, "question": {"id": "Q2", "variant": 0}, "response": ["Based on the anthropological framework, my cultural context as a married female from Port Said, Egypt, plays a pivotal role in understanding the importance of friends in life. In my community, kinship networks and social connections are highly valued, and maintaining friendships is seen as essential for emotional support and social cohesion. Additionally, my lower middle-class socioeconomic background means that I rely on my social network for various forms of support, such as sharing resources and information. Moreover, my personal experience and values have shaped my understanding that friends are crucial for navigating life's challenges and celebrating its joys. Therefore, I believe that friends are (2) Rather important in life."]}, {"persona": {"region": "Port Said", "sex": "female", "age": 45, "country": "Egypt", "marital_status": "married", "education": "higher", "social_class": "lower middle class"}, "question": {"id": "Q2", "variant": 1}, "response": ["Based on my emic perspective, I believe that friends play a crucial role in life. In my cultural context, friends are not just people to socialize with, but they also act as support systems, especially for women. Individual values and personal experience have taught me that friends are essential for emotional support and companionship. Considering my lower middle-class socioeconomic background, friends also provide assistance in times of financial need. Cultural relativism emphasizes the importance of relationships and community in Egyptian society, and my age and place in Port Said have shown me the significance of friends in everyday life. Nuance plays a role in my understanding that friends are not just important, but rather essential for a fulfilling life.\n\n2"]}, {"persona": {"region": "Port Said", "sex": "female", "age": 45, "country": "Egypt", "marital_status": "married", "education": "higher", "social_class": "lower middle class"}, "question": {"id": "Q2", "variant": 2}, "response": ["Based on my cultural context and individual values, I believe that friends play a very important role in life. In Port Said, Egypt, the community and social connections are highly valued, and friends are considered to be an extension of family. As a married woman in my mid-40s, I have experienced the support and companionship that friends provide, especially in the context of my lower middle class socioeconomic background. Additionally, my higher education level has allowed me to understand the importance of social networks and the role they play in personal and professional life. Therefore, I consider friends to be very important in life.\n\n1"]}, {"persona": {"region": "Port Said", "sex": "female", "age": 45, "country": "Egypt", "marital_status": "married", "education": "higher", "social_class": "lower middle class"}, "question": {"id": "Q2", "variant": 3}, "response": ["Based on the anthropological framework, my answer to the question is influenced by my individual values and personal experience, cultural context, and socioeconomic background. In Port Said, Egypt, social relationships and community ties are highly valued, and as a married woman from a lower middle-class background, I have experienced the importance of friends in providing support and solidarity within the community. Additionally, my higher education level has also exposed me to the value of networking and social connections in both personal and professional spheres. Therefore, I believe that friends hold great importance in life.\n\n1"]}]