[{"persona": {"region": "Fayoum", "sex": "male", "age": 46, "country": "Egypt", "marital_status": "married", "education": "higher", "social_class": "lower middle class"}, "question": {"id": "Q221", "variant": 0}, "response": ["Based on the anthropological framework, I, as a married male from Fayoum, Egypt, would consider my answer to the question of how frequently I vote in local level elections by taking into account my cultural context, individual values and personal experience, and socioeconomic background. In Egypt, there is a strong cultural emphasis on community and family, and my personal experience has shown me that local level elections can have a direct impact on my daily life and the well-being of my family. Additionally, as a member of the lower middle class, I am aware of the importance of participating in the political process to advocate for the needs of my community. Therefore, based on these factors, my answer would be (2) Usually.\n\n2"]}, {"persona": {"region": "Fayoum", "sex": "female", "age": 30, "country": "Egypt", "marital_status": "married", "education": "middle", "social_class": "lower middle class"}, "question": {"id": "Q221", "variant": 0}, "response": ["Based on the emic and etic perspectives, as a married female from Fayoum, Egypt, my in-group may have certain expectations or norms regarding voting in local level elections. The cultural context of Egypt, including my socioeconomic background and level of education, also plays a significant role in my decision. Additionally, my individual values and personal experience, as well as the cultural relativism of my community, will influence how frequently I vote in local level elections. Considering my age and place, as well as the nuanced phrasing of the question, I would choose option (2) Usually, as it reflects the typical voting behavior of individuals from similar backgrounds in my community. \n\n2"]}, {"persona": {"region": "Fayoum", "sex": "male", "age": 60, "country": "Egypt", "marital_status": "married", "education": "higher", "social_class": "working class"}, "question": {"id": "Q221", "variant": 0}, "response": ["Based on the anthropological framework, as a 60-year-old male from Fayoum, Egypt, with a higher education level and part of the working class, my response to the question of how frequently I vote in local level elections would be influenced by a combination of cultural context, individual values and personal experience, and socioeconomic background. In Egypt, there may be cultural and social expectations around political participation, but as a working-class individual, I may have limited time and resources to engage in the political process. Additionally, my personal experiences and values may shape my perception of the effectiveness of voting in local elections. Therefore, my response would likely reflect a nuanced understanding of the complexities of political participation in my specific cultural and socioeconomic context.\n\n2"]}, {"persona": {"region": "Fayoum", "sex": "male", "age": 20, "country": "Egypt", "marital_status": "single", "education": "middle", "social_class": "lower middle class"}, "question": {"id": "Q221", "variant": 0}, "response": ["Based on the anthropological framework, my emic perspective as a single male from Fayoum, Egypt, would be influenced by my cultural context, individual values and personal experience, and socioeconomic background. In Egypt, there is a high value placed on community and the collective, and voting in local level elections is seen as a civic duty. However, as someone from the lower middle class with limited education, I may feel disenfranchised and disempowered in the political process. Additionally, the current political climate in Egypt may also influence my decision. Therefore, I would choose option (2) Usually, as I may feel compelled to participate in local level elections when I feel my voice can make a difference, but may not always have the means or opportunity to do so. \n\n2"]}, {"persona": {"region": "Fayoum", "sex": "female", "age": 39, "country": "Egypt", "marital_status": "married", "education": "higher", "social_class": "lower middle class"}, "question": {"id": "Q221", "variant": 0}, "response": ["In considering the question of how frequently I vote in local level elections, it is important to take into account my cultural context, socioeconomic background, and individual values. As a married female from Fayoum, Egypt, I have been socialized within a cultural context that may prioritize the role of men in political decision-making. Additionally, my lower middle class status may mean that I have limited access to resources that would enable me to engage in the political process. Furthermore, my personal experience and values may influence my perception of the efficacy of local level elections. Given these factors, I would be more likely to choose option (3) Never as my answer to the question of how frequently I vote in local level elections.\n\n3"]}, {"persona": {"region": "Fayoum", "sex": "male", "age": 33, "country": "Egypt", "marital_status": "married", "education": "higher", "social_class": "working class"}, "question": {"id": "Q221", "variant": 0}, "response": ["From an anthropological perspective, my cultural context as a married male from Fayoum, Egypt, plays a significant role in my approach to voting. The socioeconomic background of being part of the working class, as well as my individual values and personal experiences, influence my decision. Additionally, the emic and etic perspectives of the community in which I live also shape my understanding of the importance of local level elections. Based on these factors, I choose option (2) Usually, as I believe in the importance of participating in the democratic process at the local level, but I may not be able to do so in every election due to various constraints."]}, {"persona": {"region": "Port Said", "sex": "female", "age": 45, "country": "Egypt", "marital_status": "married", "education": "higher", "social_class": "lower middle class"}, "question": {"id": "Q221", "variant": 0}, "response": ["Based on my cultural context and socioeconomic background, as a married woman from Port Said, Egypt, I am aware of the importance of local level elections in shaping the governance and policies that directly impact my community. My personal experience and individual values also play a significant role in my decision to exercise my right to vote. Furthermore, the emic perspective within my community emphasizes the significance of participating in local level elections as a way to advocate for change and address the needs of our community. Therefore, I usually vote in local level elections. \n\n2"]}, {"persona": {"region": "Port Said", "sex": "male", "age": 42, "country": "Egypt", "marital_status": "married", "education": "middle", "social_class": "lower middle class"}, "question": {"id": "Q221", "variant": 0}, "response": ["Based on the anthropological framework, my perspective as a married male from Port Said, Egypt, who is 42 years old and part of the lower middle class, is influenced by my cultural context, individual values, and socioeconomic background. In my community, voting in local level elections is seen as a civic duty and a way to have a say in local governance. However, due to my lower middle class socioeconomic background and limited education, I may not have as much access to information about the candidates or the voting process. Additionally, my personal experience and values may lead me to prioritize other aspects of my life over political participation. Therefore, based on these factors, I would choose to vote \"Usually\" in local level elections.\n\n2"]}, {"persona": {"region": "Port Said", "sex": "male", "age": 28, "country": "Egypt", "marital_status": "single", "education": "middle", "social_class": "lower middle class"}, "question": {"id": "Q221", "variant": 0}, "response": ["Based on my emic perspective as a single male from Port Said, Egypt, my cultural context and socioeconomic background play a significant role in how I view and participate in local level elections. In my community, there may be certain cultural and social expectations regarding voting, and my lower middle class status may impact my ability to prioritize political participation over economic concerns. Additionally, my individual values and personal experiences may shape my perception of the local political landscape, influencing my decision to vote. The nuance of the question is also crucial, as the specific wording and framing of the question can impact my response. Therefore, based on my personal experiences and cultural context, I would choose option (2) Usually, as I may feel some level of engagement with local level elections but may not prioritize them as much as other aspects of my life. \n\n2"]}, {"persona": {"region": "Port Said", "sex": "female", "age": 30, "country": "Egypt", "marital_status": "married", "education": "higher", "social_class": "lower middle class"}, "question": {"id": "Q221", "variant": 0}, "response": ["Based on the anthropological framework, my emic perspective as a married female from Port Said, Egypt, who is 30 years old and part of the lower middle class, is influenced by my cultural context, individual values, and socioeconomic background. In Egypt, there may be certain cultural norms and expectations around voting, as well as limitations based on socioeconomic status. My personal experience and values may also play a role in shaping my decision to vote in local level elections. Additionally, space and time may also factor in, such as the accessibility of polling stations and the timing of elections. Therefore, I choose option (2) Usually, as it reflects my nuanced understanding of the factors that influence my voting behavior. \n\n2"]}, {"persona": {"region": "Port Said", "sex": "male", "age": 30, "country": "Egypt", "marital_status": "divorced", "education": "middle", "social_class": "lower middle class"}, "question": {"id": "Q221", "variant": 0}, "response": ["Based on the anthropological framework, my emic perspective as a divorced male from Port Said, Egypt, who is 30 years old and considers himself part of the lower middle class, is influenced by my cultural context, individual values, and socioeconomic background. In Egypt, the cultural context and social structure play a significant role in the understanding and participation in local level elections. Additionally, my personal experience and values as a lower middle class individual contribute to my perception of the political system. Given my socioeconomic background and the limited opportunities for political engagement, I would choose option (3) Never.\n\n3"]}, {"persona": {"region": "Port Said", "sex": "female", "age": 19, "country": "Egypt", "marital_status": "single", "education": "middle", "social_class": "lower middle class"}, "question": {"id": "Q221", "variant": 0}, "response": ["Based on the anthropological framework, as a single female from Port Said, Egypt, my emic perspective on voting in local level elections is influenced by my cultural context, individual values, and socioeconomic background. As a young woman from the lower middle class, my access to education and resources may be limited, impacting my understanding and engagement with the political process. Additionally, cultural norms and expectations around gender roles and participation in public life may also play a role in my decision. Therefore, I would choose option (3) Never as my answer, as it reflects the challenges and barriers I may face in participating in local level elections. \n\n3"]}, {"persona": {"region": "Fayoum", "sex": "male", "age": 40, "country": "Egypt", "marital_status": "married", "education": "middle", "social_class": "working class"}, "question": {"id": "Q221", "variant": 0}, "response": ["Based on the anthropological framework, my emic perspective as a married male from Fayoum, Egypt, is influenced by my cultural context, individual values, and socioeconomic background. In my community, voting in local level elections is not a common practice and is not seen as a priority. Additionally, my working-class status and lower level of education also impact my perception of the importance of participating in local elections. Therefore, I would choose option 3: Never.\n\n3"]}, {"persona": {"region": "Fayoum", "sex": "male", "age": 23, "country": "Egypt", "marital_status": "single", "education": "higher", "social_class": "lower middle class"}, "question": {"id": "Q221", "variant": 0}, "response": ["From an emic perspective, as a lower middle class single male from Fayoum, Egypt, my personal experience and individual values play a significant role in shaping my understanding of local level elections. The cultural context in which I live also influences my decision, as the socioeconomic background of my community impacts the accessibility and importance of participating in local elections. Additionally, my age and education level contribute to my nuanced understanding of the political system and the impact of my vote. Therefore, my decision to vote in local level elections is influenced by a combination of personal experience, cultural context, and socioeconomic background.\n\n2"]}, {"persona": {"region": "Fayoum", "sex": "female", "age": 38, "country": "Egypt", "marital_status": "married", "education": "middle", "social_class": "lower middle class"}, "question": {"id": "Q221", "variant": 0}, "response": ["Based on the anthropological framework, as a married female from Fayoum, Egypt, my cultural context and socioeconomic background play a significant role in my decision-making process. In Egypt, there are cultural expectations and social norms that influence a woman's participation in local level elections. Additionally, my lower middle class status and middle education level may impact my access to information and resources related to voting. Furthermore, as a 38-year-old woman, I may have experienced societal and familial pressures that affect my decision. Considering these factors, my choice would be to typically vote in local level elections as it aligns with the cultural and societal expectations of my community. \n\n2"]}, {"persona": {"region": "Fayoum", "sex": "male", "age": 32, "country": "Egypt", "marital_status": "married", "education": "middle", "social_class": "lower middle class"}, "question": {"id": "Q221", "variant": 0}, "response": ["Based on the anthropological framework, my emic perspective as a married male from Fayoum, Egypt, would be influenced by my cultural context, individual values, and socioeconomic background. In Egypt, voting is seen as a way to participate in the political process and have a say in local governance. However, my lower middle class socioeconomic background and limited education level may limit my access to information and resources that could encourage and enable me to vote. Additionally, the cultural relativism perspective reminds me that there are diverse opinions and practices regarding voting, and my personal experience and values may impact my decision. Therefore, considering my cultural context and personal circumstances, I would typically vote in local level elections (2) Usually."]}, {"persona": {"region": "Fayoum", "sex": "male", "age": 31, "country": "Egypt", "marital_status": "married", "education": "higher", "social_class": "working class"}, "question": {"id": "Q221", "variant": 0}, "response": ["Based on the anthropological framework, my response to the question of how frequently I vote in local level elections is influenced by my cultural context, socioeconomic background, and individual values. In Fayoum, Egypt, the cultural context and socioeconomic background play a significant role in shaping the attitudes towards voting. As a working-class married male who has completed higher education, I am aware of the importance of civic engagement, but I also recognize the limitations and challenges within the local political system. Additionally, my personal experience and individual values inform my decision to prioritize other forms of civic participation over voting in local level elections. Therefore, I choose option (2) Usually as the frequency with which I vote in local level elections.\n\n2"]}, {"persona": {"region": "Fayoum", "sex": "male", "age": 31, "country": "Egypt", "marital_status": "married", "education": "middle", "social_class": "lower middle class"}, "question": {"id": "Q221", "variant": 0}, "response": ["Based on the anthropological framework, as a married male from Fayoum, Egypt, my emic perspective on local level elections is influenced by my cultural context, individual values, and socioeconomic background. In Egypt, there is a strong emphasis on community and family ties, and my lower middle class status may limit my access to education and resources. Additionally, my personal experience and age may also play a role in my decision-making process. Given these factors, I would likely choose option (2) Usually, as I may feel a sense of duty to participate in the democratic process, but my socioeconomic status and personal circumstances may prevent me from voting in every local level election. \n\n2"]}, {"persona": {"region": "Fayoum", "sex": "female", "age": 32, "country": "Egypt", "marital_status": "married", "education": "middle", "social_class": "lower middle class"}, "question": {"id": "Q221", "variant": 0}, "response": ["Based on the anthropological framework, as a married female from Fayoum, Egypt, my emic perspective on voting in local level elections is influenced by my cultural context, individual values, socioeconomic background, and space and time. In Egypt, there may be cultural and societal expectations for women to prioritize their familial and domestic responsibilities over political engagement. Additionally, my lower middle class socioeconomic background and middle education level may limit my access to information and resources necessary for political participation. Furthermore, as a 32-year-old woman, I may have been socialized to believe that my voice and vote are not as valued in the political sphere. Therefore, based on my personal experience and understanding of the cultural context, I would typically choose to vote in local level elections when I feel it is necessary, but I may not always prioritize this form of political engagement.\n\n2"]}, {"persona": {"region": "Ismailia", "sex": "male", "age": 53, "country": "Egypt", "marital_status": "married", "education": "middle", "social_class": "lower middle class"}, "question": {"id": "Q221", "variant": 0}, "response": ["Based on the anthropological framework, as a married male from Ismailia, Egypt, my emic perspective is influenced by my cultural context, individual values, and socioeconomic background. In my culture, voting is seen as a civic duty, and I have been taught that participating in local level elections is important for the well-being of my community. Additionally, my lower middle class status means that I am more likely to be affected by local level policies and therefore have a personal interest in participating in the election process. My personal experience and values also align with the idea of being an active participant in the democratic process. Therefore, my answer to the question would be (2) Usually.\n\n2"]}, {"persona": {"region": "Ismailia", "sex": "male", "age": 38, "country": "Egypt", "marital_status": "married", "education": "higher", "social_class": "working class"}, "question": {"id": "Q221", "variant": 0}, "response": ["Based on the anthropological framework, as a married male from Ismailia, Egypt, my emic perspective on local level elections is influenced by my cultural context, individual values, and socioeconomic background. In Egypt, there is a strong sense of community and family, and local level elections play an important role in shaping the future of our neighborhoods. However, as a working-class individual, I may not always have the time or resources to participate in every election. Additionally, my personal experience and age also influence my decision. Therefore, I would usually vote in local level elections, as it is important for me to have a say in the governance of my community.\n\n2"]}, {"persona": {"region": "Ismailia", "sex": "female", "age": 35, "country": "Egypt", "marital_status": "married", "education": "middle", "social_class": "lower middle class"}, "question": {"id": "Q221", "variant": 0}, "response": ["Based on the anthropological framework, as a married female from Ismailia, Egypt, my emic perspective on voting in local level elections would be influenced by my cultural context, individual values, socioeconomic background, and space and time. In Egypt, there may be cultural expectations and norms around voting, and my personal values and experiences as a lower middle class woman who completed middle education level may also influence my decision. Additionally, the space and time in which I live, including the political climate and accessibility to voting locations, may affect my ability to vote. Considering these factors, I would choose option (2) Usually, as I may face barriers to voting but still value the importance of participating in local level elections. \n\n2"]}, {"persona": {"region": "Ismailia", "sex": "female", "age": 57, "country": "Egypt", "marital_status": "married", "education": "lower", "social_class": "working class"}, "question": {"id": "Q221", "variant": 0}, "response": ["Based on my cultural context, as a married female from Ismailia, Egypt, my voting behavior is influenced by my age, lower education level, and working-class background. My personal experience and values also play a role in my decision. Additionally, cultural relativism is important to consider, as the political and social context in Egypt may differ from other places. Overall, my decision on how frequently I vote in local level elections is influenced by my understanding of the nuanced phrasing of the question and my individual values.\n\n2"]}, {"persona": {"region": "Ismailia", "sex": "male", "age": 33, "country": "Egypt", "marital_status": "married", "education": "middle", "social_class": "lower middle class"}, "question": {"id": "Q221", "variant": 0}, "response": ["Based on the anthropological framework, my emic perspective as a married male from Ismailia, Egypt, is influenced by my cultural context, individual values, and socioeconomic background. In my community, there is a strong emphasis on community involvement and civic duty, so voting in local level elections is seen as important. However, my lower middle class socioeconomic background and limited education may also impact my access to information about local elections and the voting process. Additionally, my personal experience and values may shape my perception of the importance of voting. Considering these factors, I would choose option (2) Usually, as I may not always have the resources or information to vote, but I recognize the value of participating in local elections when possible."]}, {"persona": {"region": "Ismailia", "sex": "female", "age": 49, "country": "Egypt", "marital_status": "single", "education": "higher", "social_class": "upper middle class"}, "question": {"id": "Q221", "variant": 0}, "response": ["Based on the anthropological framework, my response to the question of how frequently I vote in local level elections is influenced by my cultural context, individual values, and socioeconomic background. Living in Ismailia, Egypt, my cultural context emphasizes the importance of civic engagement and participation in local elections as a way to contribute to the community. My higher education level has also instilled in me the value of exercising my democratic right to vote. Additionally, being part of the upper middle class, I have the resources and time to stay informed about local candidates and issues, and to make it a priority to participate in elections. Therefore, my answer is:\n\n1"]}, {"persona": {"region": "Ismailia", "sex": "female", "age": 35, "country": "Egypt", "marital_status": "married", "education": "higher", "social_class": "lower middle class"}, "question": {"id": "Q221", "variant": 0}, "response": ["Based on the anthropological framework, as a married female from Ismailia, Egypt, my emic perspective would be influenced by my cultural context, individual values, and socioeconomic background. In Egypt, there may be traditional gender roles and expectations that could affect my decision to vote. Additionally, as part of the lower middle class, I may have limited access to resources and opportunities to participate in local level elections. Furthermore, my personal experience and age may also play a role in my decision. Therefore, I would choose the option that best aligns with my understanding and circumstances.\n\n2"]}, {"persona": {"region": "Ismailia", "sex": "male", "age": 24, "country": "Egypt", "marital_status": "single", "education": "higher", "social_class": "upper middle class"}, "question": {"id": "Q221", "variant": 0}, "response": ["Based on my personal experience and individual values, I believe that voting in local level elections is a crucial responsibility for citizens in a democratic society. Growing up in Ismailia, Egypt, I have been immersed in a cultural context that values civic engagement and participation in the political process. Additionally, my higher education has provided me with an understanding of the importance of active citizenship. As a member of the upper middle class, I have the privilege and resources to stay informed about local issues and candidates. Furthermore, cultural relativism teaches us to respect and understand the diverse perspectives and experiences of others, leading me to advocate for the importance of voting in local level elections. Therefore, I choose option 1: Always."]}, {"persona": {"region": "Ismailia", "sex": "female", "age": 23, "country": "Egypt", "marital_status": "single", "education": "higher", "social_class": "lower middle class"}, "question": {"id": "Q221", "variant": 0}, "response": ["Based on the anthropological framework, my answer to the question of how frequently I vote in local level elections is influenced by my cultural context, individual values and personal experience, and socioeconomic background. As a single female from Ismailia, Egypt, who is 23 years old and part of the lower middle class, my understanding of the importance of local level elections may differ from those in other cultural contexts. Additionally, my personal experience and socioeconomic background may impact my ability and willingness to participate in these elections. Therefore, my answer is (2) Usually."]}, {"persona": {"region": "Ismailia", "sex": "male", "age": 55, "country": "Egypt", "marital_status": "married", "education": "middle", "social_class": "lower middle class"}, "question": {"id": "Q221", "variant": 0}, "response": ["Based on the anthropological framework, my personal experience and individual values as a 55-year-old married male from Ismailia, Egypt, who completed middle education and considers myself part of the lower middle class, play a significant role in my decision-making. Additionally, the cultural context of Egypt, including the socioeconomic background and the importance of space and time, also influence my perspective. In this context, local level elections may not hold as much significance for me due to the limited impact I feel my vote may have in the larger political landscape. Therefore, I may choose to vote less frequently or possibly never, as the local political system may not address the concerns of individuals in my socioeconomic position.\n\n3"]}, {"persona": {"region": "Ismailia", "sex": "male", "age": 57, "country": "Egypt", "marital_status": "married", "education": "middle", "social_class": "upper middle class"}, "question": {"id": "Q221", "variant": 0}, "response": ["Based on the anthropological framework, as a married male from Ismailia, Egypt, my emic perspective on voting in local level elections is heavily influenced by my cultural context, individual values, and socioeconomic background. In Egyptian society, there is a strong emphasis on family and community, and voting in local elections is seen as a civic duty. Additionally, as a member of the upper middle class, I have the resources and education to understand the importance of participating in the political process. My personal experience and values also lead me to believe in the power of democracy and the need for active engagement in local governance. Therefore, my answer to the question is:\n\n2"]}, {"persona": {"region": "Ismailia", "sex": "female", "age": 29, "country": "Egypt", "marital_status": "married", "education": "middle", "social_class": "upper middle class"}, "question": {"id": "Q221", "variant": 0}, "response": ["Based on the anthropological framework, my emic perspective as a married female from Ismailia, Egypt, who is 29 years old and part of the upper middle class, is influenced by my cultural context, individual values and personal experience, and socioeconomic background. In my cultural context, voting is seen as a civic duty and a way to participate in the community. My personal experience and values also emphasize the importance of having a voice in local level decision-making. Additionally, my socioeconomic background provides me with the resources and education to understand the significance of voting. Therefore, I would choose the following option:\n(2) Usually"]}, {"persona": {"region": "Damiatta", "sex": "female", "age": 46, "country": "Egypt", "marital_status": "married", "education": "middle", "social_class": "lower middle class"}, "question": {"id": "Q221", "variant": 0}, "response": ["Based on the anthropological framework, as a married female from Damiatta, Egypt, my emic perspective on voting in local level elections is influenced by my cultural context, individual values, and socioeconomic background. In Egypt, there may be cultural and societal expectations for women to participate in local level elections, especially as they become more involved in public and political life. However, my lower middle class socioeconomic background and middle education level may limit my access to information about candidates and issues, as well as influence my perception of the impact my vote may have. Additionally, as a woman in a traditional society, I may have limited opportunities to express my political views. Therefore, my answer to the question \"How frequently do you vote in local level elections?\" is:\n\n2\n\n(2) Usually"]}, {"persona": {"region": "Damiatta", "sex": "female", "age": 20, "country": "Egypt", "marital_status": "single", "education": "middle", "social_class": "lower middle class"}, "question": {"id": "Q221", "variant": 0}, "response": ["Based on my emic perspective as a single female from Damiatta, Egypt, my cultural context and personal experience play a significant role in my decision to vote in local level elections. In Egypt, there are cultural and societal expectations placed upon women, especially those from lower middle class backgrounds, which may impact their ability or willingness to participate in political processes. Additionally, my socioeconomic background and limited educational attainment may also influence my perception of the importance and impact of voting. Considering the nuanced phrasing of the question, I would say that I usually vote in local level elections, as I recognize the importance of civic engagement, but may face barriers that prevent me from always participating. \n\n2"]}, {"persona": {"region": "Damiatta", "sex": "male", "age": 19, "country": "Egypt", "marital_status": "single", "education": "middle", "social_class": "lower middle class"}, "question": {"id": "Q221", "variant": 0}, "response": ["Based on the anthropological framework, as a single male from Damiatta, Egypt, my emic perspective on voting in local level elections is influenced by my cultural context, individual values, and socioeconomic background. In Egypt, there are societal expectations and pressures on the lower middle class to prioritize earning a living over political participation, and my personal experience and values align with this mindset. Additionally, at 19 years old, I am still navigating my place in society and may not fully understand the importance of voting. Therefore, I would choose option (3) Never."]}, {"persona": {"region": "Damiatta", "sex": "female", "age": 33, "country": "Egypt", "marital_status": "married", "education": "higher", "social_class": "lower middle class"}, "question": {"id": "Q221", "variant": 0}, "response": ["Based on the anthropological framework, as a married female from Damiatta, Egypt, my emic perspective is influenced by my cultural context, individual values, and socioeconomic background. In Egypt, there are cultural norms and expectations for women's participation in local level elections, and my personal experience and values also play a role in shaping my decision. Additionally, my lower middle class socioeconomic background may impact my access to resources and information related to voting. Therefore, my answer to the question \"How frequently do you vote in local level elections?\" is 2) Usually."]}, {"persona": {"region": "Damiatta", "sex": "male", "age": 24, "country": "Egypt", "marital_status": "single", "education": "higher", "social_class": "lower middle class"}, "question": {"id": "Q221", "variant": 0}, "response": ["Based on my emic perspective as a single male from Damiatta, Egypt, I understand the importance of participating in local level elections as a way to contribute to the decision-making process in my community. My cultural context and individual values place significance on civic duty and the impact of my vote on the socio-economic development of my area. Considering my lower middle-class status and the cultural relativism present in my community, I recognize the value of my voice in shaping local policies and services. Additionally, my age and education level have provided me with the understanding of the importance of political participation. Therefore, I usually vote in local level elections to ensure that my community's needs are represented and addressed.\n\n2"]}, {"persona": {"region": "Suez", "sex": "male", "age": 41, "country": "Egypt", "marital_status": "married", "education": "middle", "social_class": "working class"}, "question": {"id": "Q221", "variant": 0}, "response": ["Based on the anthropological framework, my answer to the question of how frequently I vote in local level elections is influenced by my individual values and personal experience, as well as my socioeconomic background and cultural context. As a married male from Suez, Egypt, who completed middle education and considers myself part of the working class, my understanding of the importance of local level elections may be influenced by the limited access to resources and opportunities that are often associated with this demographic. Additionally, my cultural context and the historical and political dynamics in Egypt may also play a role in shaping my views on voting. Therefore, my answer to the question is:\n\n2"]}, {"persona": {"region": "Suez", "sex": "female", "age": 39, "country": "Egypt", "marital_status": "divorced", "education": "middle", "social_class": "working class"}, "question": {"id": "Q221", "variant": 0}, "response": ["Based on the anthropological framework, my emic perspective as a divorced female from Suez, Egypt, who is part of the working class and has completed middle education level, is influenced by my cultural context, individual values, and socioeconomic background. In Egypt, there may be a cultural expectation for individuals to participate in local elections, but my personal experience and socioeconomic background may impact my ability to do so. Additionally, as a divorced female, I may have different kinship networks and individual values that influence my decision. Therefore, my answer to the question of how frequently I vote in local level elections would be influenced by these factors.\n\n3"]}, {"persona": {"region": "Cairo", "sex": "female", "age": 55, "country": "Egypt", "marital_status": "married", "education": "middle", "social_class": "working class"}, "question": {"id": "Q221", "variant": 0}, "response": ["Based on the anthropological framework, as a married female from Cairo, Egypt, at 55 years of age with a middle education level and considering myself part of the working class, my emic perspective on voting in local level elections is influenced by my cultural context, individual values, and socioeconomic background. In Egypt, there may be cultural norms and expectations regarding political participation, and my personal experience as a working-class woman may also impact my views on voting. Additionally, my access to information, resources, and time may affect my ability to participate in elections. Therefore, my answer is:\n(2) Usually"]}, {"persona": {"region": "Cairo", "sex": "male", "age": 58, "country": "Egypt", "marital_status": "married", "education": "middle", "social_class": "lower middle class"}, "question": {"id": "Q221", "variant": 0}, "response": ["Based on the anthropological framework, my emic perspective as a married male from Cairo, Egypt, who is 58 years old and part of the lower middle class, is heavily influenced by my cultural context, individual values, and socioeconomic background. In Egypt, voting in local level elections may not be as common due to historical and political factors, and the lower middle class may not have as much access to political participation. Additionally, my personal experience and values may also play a role in my decision to vote or not. Considering all these factors, I would select option 3: Never. \n\n3"]}, {"persona": {"region": "Cairo", "sex": "female", "age": 29, "country": "Egypt", "marital_status": "married", "education": "higher", "social_class": "lower middle class"}, "question": {"id": "Q221", "variant": 0}, "response": ["Based on my emic perspective as a woman in Cairo, I understand that voting in local level elections is influenced by cultural context, individual values, and socioeconomic background. In Egypt, there may be restrictions on women's participation in political processes, especially in lower middle class communities. My personal experience and values may also play a role in how frequently I vote. Additionally, the nuance of the question is important; the phrasing of \"local level elections\" may have different implications in my cultural context. Therefore, my answer would be (3) Never."]}, {"persona": {"region": "Cairo", "sex": "male", "age": 38, "country": "Egypt", "marital_status": "married", "education": "higher", "social_class": "lower middle class"}, "question": {"id": "Q221", "variant": 0}, "response": ["Based on the anthropological framework, my reasoning for answering this question is influenced by my emic perspective as a married male from Cairo, Egypt, who is 38 years old and considers himself part of the lower middle class. The cultural context of Egypt plays a significant role in shaping my answer, as well as my individual values and personal experience. Socioeconomic background, including my class status, also factors into my decision, as well as the cultural relativism of the Egyptian society. Additionally, space and time, as well as nuanced phrasing of the question, are taken into consideration. \n\n3"]}, {"persona": {"region": "Cairo", "sex": "female", "age": 40, "country": "Egypt", "marital_status": "married", "education": "higher", "social_class": "lower middle class"}, "question": {"id": "Q221", "variant": 0}, "response": ["Based on the anthropological framework, my emic perspective as a married female from Cairo, Egypt, with a lower middle-class socioeconomic background and a higher education level, would be influenced by the cultural context of my community, my individual values and personal experiences, and the socioeconomic background of my family. In Egypt, there is a strong emphasis on community and family ties, and local level elections may be seen as an opportunity to participate in decision-making processes that affect our daily lives. However, there may also be barriers to participation, such as limited access to information, resources, or time due to work and family responsibilities. Additionally, the cultural relativism of Egyptian society may shape my perception of the importance of local level elections and the degree of influence they have on my life. Taking all of these factors into consideration, I would choose option (2) Usually, as I may strive to participate in local level elections when possible, but may also face challenges that affect the frequency of my voting. \n\n2"]}, {"persona": {"region": "Cairo", "sex": "male", "age": 38, "country": "Egypt", "marital_status": "married", "education": "higher", "social_class": "upper middle class"}, "question": {"id": "Q221", "variant": 0}, "response": ["Based on the anthropological framework, my emic perspective as a married male from Cairo, Egypt, includes considering the cultural context, individual values, and socioeconomic background. In Egypt, the political and social context plays a significant role in how people perceive voting in local level elections. Additionally, my personal experience and values as someone from the upper middle class with a higher education level may also influence my decision. Furthermore, the cultural relativism aspect emphasizes that my perspective on voting may differ from someone in a different cultural context. Given all these factors, my choice is as follows:\n\n2"]}, {"persona": {"region": "Cairo", "sex": "male", "age": 59, "country": "Egypt", "marital_status": "married", "education": "middle", "social_class": "lower middle class"}, "question": {"id": "Q221", "variant": 0}, "response": ["Based on the anthropological framework, as a married male from Cairo, Egypt, my emic perspective on voting in local level elections is influenced by my cultural context, individual values, and socioeconomic background. In Egypt, the cultural context heavily influences political participation, and my personal experience and values as a lower middle class individual with middle education shape my perception of the importance of voting. Additionally, the socioeconomic background and cultural relativism in Egypt play a significant role in shaping my understanding of the political system. Therefore, based on these factors, I would choose the following option:\n\n2"]}, {"persona": {"region": "Cairo", "sex": "female", "age": 30, "country": "Egypt", "marital_status": "married", "education": "higher", "social_class": "upper middle class"}, "question": {"id": "Q221", "variant": 0}, "response": ["Based on the anthropological framework, as a married woman from Cairo, Egypt, I would consider the emic perspective in my response to this question. In my cultural context, women have gained more rights and opportunities in recent years, including the right to vote. However, there are still societal and cultural factors that influence my decision, such as my socioeconomic background and individual values. My higher education level and upper-middle-class status may lead me to prioritize political participation and civic engagement, as I have the resources and knowledge to understand the importance of local level elections. Additionally, my personal experiences and age also play a role in shaping my perspective on voting. Therefore, my response to this question would be:\n\n2) Usually"]}, {"persona": {"region": "Cairo", "sex": "male", "age": 22, "country": "Egypt", "marital_status": "single", "education": "middle", "social_class": "lower middle class"}, "question": {"id": "Q221", "variant": 0}, "response": ["Based on my personal experience and socioeconomic background, I understand that voting in local level elections is important for the overall functioning of the community. However, due to the limited educational opportunities and lower middle class status, I may not have the same access to information about local candidates and issues as others. Additionally, as a young person, I may not feel a strong sense of political efficacy or belief that my vote will make a difference. Therefore, I am more likely to vote at a lower frequency, perhaps usually, in local level elections.\n\n2"]}, {"persona": {"region": "Cairo", "sex": "male", "age": 29, "country": "Egypt", "marital_status": "single", "education": "higher", "social_class": "lower middle class"}, "question": {"id": "Q221", "variant": 0}, "response": ["Based on my emic perspective as a single male from Cairo, Egypt, and considering my socioeconomic background as part of the lower middle class, my individual values and personal experience lead me to prioritize the local level elections as a means of participating in the civic life of my community. Additionally, the cultural context of Egypt emphasizes the importance of civic engagement and the significance of participating in democratic processes. This, combined with the nuance of the question, leads me to choose option (2) Usually, as I make an effort to vote in local level elections whenever possible to have a say in the decisions that affect my community."]}, {"persona": {"region": "Cairo", "sex": "female", "age": 31, "country": "Egypt", "marital_status": "married", "education": "higher", "social_class": "lower middle class"}, "question": {"id": "Q221", "variant": 0}, "response": ["In considering the question of how frequently I vote in local level elections as a married female from Cairo, Egypt, I must take into account my cultural context, individual values, and socioeconomic background. In Egypt, there may be certain cultural and societal expectations for women, particularly those from lower middle class backgrounds, regarding their participation in political processes. Additionally, my personal experiences and values may also influence my decision to vote. Furthermore, the nuances of the question and the understanding of cultural relativism in Egypt may also play a role in my decision. Taking all of these factors into consideration, my answer is:\n2"]}, {"persona": {"region": "Cairo", "sex": "male", "age": 59, "country": "Egypt", "marital_status": "married", "education": "higher", "social_class": "upper middle class"}, "question": {"id": "Q221", "variant": 0}, "response": ["Based on the anthropological framework, I, as a married male from Cairo, Egypt, would answer this question considering my cultural context, individual values, and socioeconomic background. In Egypt, there is a strong cultural emphasis on participating in the political process, and as someone who has completed higher education and considers myself part of the upper middle class, I have the economic means and intellectual capacity to understand the importance of local level elections. Additionally, my age and place of residence in Cairo further emphasize the importance of civic engagement and voting. Therefore, I would choose the option: (1) Always."]}, {"persona": {"region": "Cairo", "sex": "male", "age": 27, "country": "Egypt", "marital_status": "single", "education": "middle", "social_class": "working class"}, "question": {"id": "Q221", "variant": 0}, "response": ["Based on the anthropological framework, as a single male from Cairo, Egypt, at the age of 27 and part of the working class, my perspective on voting in local level elections is influenced by my individual values and personal experience. My socioeconomic background, being part of the working class, also plays a significant role in my decision-making process. Additionally, the cultural context of Egypt, including its political and social landscape, and the nuance of the question itself, will shape my answer. Considering these factors, my choice is:\n\n2"]}, {"persona": {"region": "Cairo", "sex": "female", "age": 25, "country": "Egypt", "marital_status": "single", "education": "higher", "social_class": "working class"}, "question": {"id": "Q221", "variant": 0}, "response": ["Based on the anthropological framework, my emic perspective as a single female from Cairo, Egypt, influences my understanding of the cultural context, individual values, and socioeconomic background. In Egypt, there are cultural and societal expectations for women, especially those from working-class backgrounds. Personal experiences have also shaped my perception of the importance of local level elections and the role they play in shaping my community. Furthermore, the socio-economic background plays a significant role in my decision-making process. Considering all these factors, my choice is:\n\n1"]}, {"persona": {"region": "Cairo", "sex": "female", "age": 23, "country": "Egypt", "marital_status": "married", "education": "higher", "social_class": "lower middle class"}, "question": {"id": "Q221", "variant": 0}, "response": ["Based on the anthropological framework, as a married female from Cairo, Egypt, my emic perspective on local level elections is influenced by my cultural context, individual values, and socioeconomic background. In our society, there may be different expectations and opportunities for women to participate in local level elections. Additionally, my personal experience and values may affect my perception of the importance of voting. Considering my lower middle class status and the cultural relativism of our society, my decision on how frequently I vote in local level elections may be influenced by my understanding of space and time, as well as the nuanced phrasing of the question.\n\n2"]}, {"persona": {"region": "Cairo", "sex": "male", "age": 58, "country": "Egypt", "marital_status": "married", "education": "higher", "social_class": "working class"}, "question": {"id": "Q221", "variant": 0}, "response": ["Based on the anthropological framework, as a married male from Cairo, Egypt, my emic perspective takes into consideration the cultural context of where I come from, my socioeconomic background as part of the working class, and my individual values and personal experience. In Egypt, local level elections may not hold as much significance as national elections, and there may be a sense of disillusionment or lack of trust in the political system. Additionally, the cultural relativism aspect means that my understanding of voting may be influenced by the societal norms and values within my community. Therefore, my choice to answer the question will be based on these factors and may differ from someone from a different cultural or socioeconomic background.\n\n2"]}, {"persona": {"region": "Cairo", "sex": "female", "age": 40, "country": "Egypt", "marital_status": "married", "education": "higher", "social_class": "working class"}, "question": {"id": "Q221", "variant": 0}, "response": ["Based on the anthropological framework, my cultural context as a married female from Cairo, Egypt, with a working-class background and higher education level, influences my perception of local level elections. My individual values and personal experience also play a role, as does my socioeconomic background. Additionally, the cultural relativism of Egypt and the space and time in which I live also impact my answer. Considering all these factors, my answer to the question is:\n\n2) Usually"]}, {"persona": {"region": "Cairo", "sex": "female", "age": 36, "country": "Egypt", "marital_status": "married", "education": "middle", "social_class": "upper middle class"}, "question": {"id": "Q221", "variant": 0}, "response": ["Based on the anthropological framework, my emic perspective as a married female from Cairo, Egypt, would be influenced by my cultural context, individual values, and socioeconomic background. In Egypt, there is a strong emphasis on family and community, and voting in local level elections is seen as a civic duty. My personal values and experiences would also play a role, as I am part of the upper middle class and have likely been exposed to the importance of civic engagement and political participation. Additionally, my socioeconomic background may provide me with the resources and education to understand the significance of voting. Therefore, my answer would be influenced by these factors and I would choose option (1) Always, as voting would be a way for me to contribute to my community and exercise my rights as a citizen.\n\n1"]}, {"persona": {"region": "Cairo", "sex": "male", "age": 40, "country": "Egypt", "marital_status": "married", "education": "middle", "social_class": "lower middle class"}, "question": {"id": "Q221", "variant": 0}, "response": ["Based on the anthropological framework, my emic perspective as a married male from Cairo, Egypt, who is 40 years old and part of the lower middle class, is influenced by my cultural context, individual values, and socioeconomic background. In Egyptian society, there is a strong emphasis on family and community, and local level elections are seen as an important way to have a voice in decision-making processes that directly affect our daily lives. Additionally, my lower middle class status means that I am more likely to be affected by local level policies and therefore have a vested interest in participating in these elections. Furthermore, my personal experience and values place importance on civic engagement and taking an active role in shaping the community. Therefore, I would usually vote in local level elections as it aligns with my cultural context, personal values, and socioeconomic background.\n\n2"]}, {"persona": {"region": "Cairo", "sex": "female", "age": 30, "country": "Egypt", "marital_status": "married", "education": "middle", "social_class": "lower class"}, "question": {"id": "Q221", "variant": 0}, "response": ["From the perspective of a married female from Cairo, Egypt, who is 30 years old, has completed middle education, and considers herself part of the lower class, the emic and etic perspectives play a significant role in understanding the importance of voting in local level elections. Cultural context is also pivotal, as Egypt has a complex political history and voting is influenced by factors such as government policies and societal norms. Individual values and personal experience will also influence the decision to vote, as well as socioeconomic background and the cultural relativism of the society. Space and time are important considerations, as the persona may have limited access to information about local elections. Given these factors, the frequency of voting in local level elections may be influenced by a variety of nuanced factors, ultimately leading to the selection of one specific option.\n\n3"]}, {"persona": {"region": "Cairo", "sex": "male", "age": 58, "country": "Egypt", "marital_status": "married", "education": "higher", "social_class": "lower middle class"}, "question": {"id": "Q221", "variant": 0}, "response": ["Based on the anthropological framework, my emic perspective as a married male from Cairo, Egypt, would be influenced by my cultural context, individual values, and socioeconomic background. In Egypt, there is a strong cultural emphasis on community and participation in local events and politics. As a member of the lower middle class, I would likely have a personal value of civic duty and participation in the political process. Additionally, my higher education level would likely contribute to my awareness of the importance of voting in local level elections for the betterment of my community. Therefore, I would typically vote in local level elections as a reflection of my cultural context, individual values, and socioeconomic background.\n\n2"]}, {"persona": {"region": "Cairo", "sex": "male", "age": 50, "country": "Egypt", "marital_status": "married", "education": "middle", "social_class": "lower middle class"}, "question": {"id": "Q221", "variant": 0}, "response": ["Based on the anthropological framework, my emic perspective as a married male from Cairo, Egypt, at the age of 50 and belonging to the lower middle class, is influenced by my cultural context, socioeconomic background, and personal experience. In Egypt, there is a strong emphasis on community and collective decision-making, so voting in local level elections is seen as a civic duty. However, my socioeconomic background and limited education may also impact my ability to access information about local elections and may influence my decision to vote. Additionally, the political climate in Egypt may limit the extent to which individuals feel their vote can make a difference. Therefore, my decision to vote in local level elections is not straightforward and may be influenced by a combination of these factors.\n\n2"]}, {"persona": {"region": "Cairo", "sex": "female", "age": 40, "country": "Egypt", "marital_status": "married", "education": "higher", "social_class": "upper middle class"}, "question": {"id": "Q221", "variant": 0}, "response": ["Based on my emic perspective as a married female from Cairo, Egypt, I understand that voting in local level elections is influenced by cultural context, individual values, and socioeconomic background. In Egypt, there is a strong cultural emphasis on community involvement and participation in political processes. As a well-educated woman from the upper middle class, I value civic engagement and recognize the importance of participating in local elections to contribute to the development and improvement of my community. Additionally, my access to resources and social standing affords me the opportunity to be informed about local issues and candidates, further motivating me to vote. Therefore, I would typically vote in local level elections, as it aligns with my cultural values, personal experiences, and socioeconomic background.\n\n2"]}, {"persona": {"region": "Cairo", "sex": "female", "age": 33, "country": "Egypt", "marital_status": "married", "education": "middle", "social_class": "lower middle class"}, "question": {"id": "Q221", "variant": 0}, "response": ["From the perspective of a married female from Cairo, Egypt, who is 33 years old and part of the lower middle class, there are several factors that would influence her answer to this question. The cultural context in Egypt is important, with a history of political instability and limited opportunities for political participation for some groups. The socioeconomic background also plays a role, as those in the lower middle class may have limited access to education and resources that would enable them to participate in the electoral process. Additionally, as a married woman, there may be cultural and societal expectations that could impact her ability to vote. Overall, her answer would likely be influenced by a combination of these factors, leading her to choose option (3) Never. \n\n3"]}, {"persona": {"region": "Cairo", "sex": "female", "age": 37, "country": "Egypt", "marital_status": "married", "education": "middle", "social_class": "lower middle class"}, "question": {"id": "Q221", "variant": 0}, "response": ["Based on the anthropological framework, my emic perspective as a married female from Cairo, Egypt, who is 37 years old and part of the lower middle class, is influenced by my cultural context, individual values, and socioeconomic background. In Egypt, there are cultural and societal expectations for women's involvement in politics, and my personal experience and values may also play a role in my decision to vote. Additionally, my socioeconomic background may impact my access to information about local level elections and my ability to participate in them. Taking into account these factors, I choose option 2: Usually, as my response to how frequently I vote in local level elections.\n\n2"]}, {"persona": {"region": "Cairo", "sex": "male", "age": 28, "country": "Egypt", "marital_status": "married", "education": "middle", "social_class": "lower middle class"}, "question": {"id": "Q221", "variant": 0}, "response": ["Based on the anthropological framework, as a married male from Cairo, Egypt, at 28 years old and part of the lower middle class, my emic perspective on voting in local level elections is influenced by my cultural context, individual values, and socioeconomic background. In Egypt, there may be cultural and social factors that influence the perception of the importance of local level elections. Additionally, my lower middle class status may impact my access to information and resources related to voting. Therefore, my choice is:\n\n2"]}, {"persona": {"region": "Cairo", "sex": "male", "age": 53, "country": "Egypt", "marital_status": "married", "education": "higher", "social_class": "working class"}, "question": {"id": "Q221", "variant": 0}, "response": ["Based on the anthropological framework, as a married male from Cairo, Egypt, my emic perspective is influenced by the cultural context of my city, my age, and my working-class background. My personal values and experiences also play a role in my decision-making process. In Egypt, there is a significant emphasis on community and civic duty, and voting is seen as a way to participate in the democratic process. However, the socioeconomic background and nuances of the political system in Egypt may also impact my decision. Therefore, my answer to the question, \"How frequently do you vote in local level elections?\" is as follows:\n\n2\n\nAlways"]}, {"persona": {"region": "Cairo", "sex": "male", "age": 45, "country": "Egypt", "marital_status": "married", "education": "higher", "social_class": "lower middle class"}, "question": {"id": "Q221", "variant": 0}, "response": ["Based on the anthropological framework, as a married male from Cairo, Egypt, my emic perspective on local level elections is influenced by my cultural context, individual values, socioeconomic background, and space and time. In Egypt, the political climate and cultural norms heavily impact the perception and participation in local level elections. Additionally, my lower middle class status and the socio-economic barriers I face have a significant impact on my perception of the political system. Furthermore, my age and education level have shaped my understanding of the importance of civic engagement. Therefore, I would choose option (2) Usually, as my participation in local level elections is influenced by a combination of cultural context, individual values, and socioeconomic background."]}, {"persona": {"region": "Cairo", "sex": "male", "age": 52, "country": "Egypt", "marital_status": "married", "education": "middle", "social_class": "upper middle class"}, "question": {"id": "Q221", "variant": 0}, "response": ["Based on the anthropological framework, my response to the question of how frequently I vote in local level elections is influenced by my emic perspective as a married male from Cairo, Egypt, where there are cultural and societal norms surrounding voting. The cultural context of Egypt, including its political climate and history, plays a significant role in shaping my views on voting. Additionally, my individual values and personal experiences, such as my socioeconomic background as part of the upper middle class and my age, also influence my decision. Considering these factors, I choose option (2) Usually, as I believe that it reflects the nuanced understanding of voting behavior in my cultural and personal context. \n\n2"]}, {"persona": {"region": "Cairo", "sex": "male", "age": 22, "country": "Egypt", "marital_status": "single", "education": "higher", "social_class": "lower middle class"}, "question": {"id": "Q221", "variant": 0}, "response": ["Based on the anthropological framework, my emic perspective as a single male from Cairo, Egypt, would be influenced by my cultural context, individual values, and socioeconomic background. In Egypt, voting is seen as a civic duty and a way to participate in the political process. However, the lower middle class often faces economic challenges and may feel disenfranchised or marginalized, leading to a sense of apathy or disillusionment towards the political system. Additionally, the recent political climate in Egypt may also affect my decision to vote. Therefore, I would choose the option that best reflects my personal experience and values.\n\n2"]}, {"persona": {"region": "Cairo", "sex": "female", "age": 57, "country": "Egypt", "marital_status": "divorced", "education": "middle", "social_class": "lower middle class"}, "question": {"id": "Q221", "variant": 0}, "response": ["Based on the anthropological framework, my emic perspective as a divorced female from Cairo, Egypt, is influenced by my cultural context, individual values, and socioeconomic background. In Egypt, there is a strong cultural expectation for individuals to participate in local level elections, as it is seen as a civic duty and a way to contribute to the community. However, my lower middle class status and limited education may also impact my ability and motivation to participate in these elections. Additionally, my personal experience as a divorced woman in a patriarchal society may shape my views on political participation. Considering these factors, I would choose option (2) Usually, as my socioeconomic background and personal experiences may hinder my ability to consistently participate in local level elections. \n\n2"]}, {"persona": {"region": "Cairo", "sex": "female", "age": 42, "country": "Egypt", "marital_status": "married", "education": "middle", "social_class": "working class"}, "question": {"id": "Q221", "variant": 0}, "response": ["In considering the question of how frequently I vote in local level elections, it is important to take into account my emic perspective as a married female from Cairo, Egypt. My cultural context and socioeconomic background as part of the working class in Egypt significantly influence my answer. Additionally, my individual values and personal experience, as well as the cultural relativism of my society, also play a role in my decision. Being from Cairo, space and time also factor into my understanding of the question. Based on these factors, I would choose option (2) Usually. \n\n2"]}, {"persona": {"region": "Cairo", "sex": "female", "age": 23, "country": "Egypt", "marital_status": "single", "education": "middle", "social_class": "lower middle class"}, "question": {"id": "Q221", "variant": 0}, "response": ["Based on the anthropological framework, my emic perspective as a single female from Cairo, Egypt, who is 23 years old and part of the lower middle class, is influenced by my cultural context, individual values, and socioeconomic background. In Egypt, voting in local level elections is seen as a civic duty and a way to participate in the democratic process. However, my lower middle class status and limited access to education may impact my ability to engage in the political process. Additionally, as a young woman, there may be social and cultural barriers that could deter me from participating in elections. Therefore, my decision on how frequently I vote in local level elections would be influenced by a combination of these factors.\n\n2"]}, {"persona": {"region": "Cairo", "sex": "female", "age": 28, "country": "Egypt", "marital_status": "married", "education": "higher", "social_class": "upper middle class"}, "question": {"id": "Q221", "variant": 0}, "response": ["Based on the anthropological framework, as a married female from Cairo, Egypt, my emic perspective is shaped by my cultural context, individual values, and socioeconomic background. In the cultural context of Egypt, voting in local level elections may not be as common or encouraged as in other countries, especially for women. My individual values and personal experience may also influence my decision, as education and social status may play a role in my perception of the importance of voting. Additionally, my socioeconomic background as part of the upper middle class may also affect my perception of the impact of local level elections on my life. Taking all of this into consideration, my answer would be (2) Usually, as my personal experiences and cultural context may lead me to believe that voting in local level elections is not a common practice, but I may still choose to participate when I feel it is important."]}, {"persona": {"region": "Cairo", "sex": "female", "age": 22, "country": "Egypt", "marital_status": "single", "education": "higher", "social_class": "lower middle class"}, "question": {"id": "Q221", "variant": 0}, "response": ["Based on the anthropological framework, my emic perspective as a single female from Cairo, Egypt, in the lower middle class, who has completed higher education, is shaped by my cultural context, individual values, and socioeconomic background. In Egypt, there is a strong cultural emphasis on civic duty and political engagement, and as a young educated woman, I am aware of the importance of participating in local level elections to contribute to the development of my community. Additionally, my socioeconomic background as part of the lower middle class means that I am directly impacted by local level policies and governance, further motivating me to exercise my right to vote. Therefore, my personal experience and values, cultural context, and socioeconomic background all lead me to believe that my answer accurately reflects the perspective of the persona described above.\n\n2"]}, {"persona": {"region": "Cairo", "sex": "female", "age": 39, "country": "Egypt", "marital_status": "married", "education": "middle", "social_class": "lower middle class"}, "question": {"id": "Q221", "variant": 0}, "response": ["Based on the anthropological framework, my response to the question of how frequently I vote in local level elections would be influenced by several factors. As a married female from Cairo, Egypt, my emic perspective on voting would be shaped by my cultural context, individual values, and socioeconomic background. In Egypt, there may be certain cultural expectations or norms regarding political participation, which could influence my decision to vote. Additionally, my lower middle class status and level of education may impact my access to information about local level elections and my ability to participate in the voting process. Considering these factors, I would choose the option (2) Usually, as I may have limited resources and opportunities to consistently engage in local level elections."]}, {"persona": {"region": "Cairo", "sex": "male", "age": 19, "country": "Egypt", "marital_status": "single", "education": "middle", "social_class": "working class"}, "question": {"id": "Q221", "variant": 0}, "response": ["Based on the anthropological framework, my emic perspective as a working-class 19-year-old male from Cairo, Egypt, is influenced by my cultural context, individual values, and socioeconomic background. In Egypt, there is a strong emphasis on the importance of voting and civic participation, and this is particularly true for those who value democracy and social justice. Additionally, my personal experience and values as a member of the working class have instilled in me a sense of duty to participate in the democratic process, despite the challenges I may face. Therefore, I am likely to answer this question with option (2) Usually, as I understand the significance of local level elections and strive to exercise my right to vote whenever possible.\n\n2"]}, {"persona": {"region": "Cairo", "sex": "female", "age": 54, "country": "Egypt", "marital_status": "married", "education": "middle", "social_class": "working class"}, "question": {"id": "Q221", "variant": 0}, "response": ["From an emic perspective, as a married female from Cairo, Egypt, my cultural context and socioeconomic background play a significant role in my decision to participate in local level elections. In Egypt, women have been historically marginalized in politics, and as a member of the working class with only a middle education level, my access to information and resources may be limited. Additionally, my personal experience and individual values shape my perception of the political system. Given these factors, I am more likely to vote in local level elections when I believe it will directly benefit my community and when I feel that my vote will make a difference in the outcome. Therefore, my response to the question is option (2) Usually. \n\n2"]}, {"persona": {"region": "Cairo", "sex": "male", "age": 30, "country": "Egypt", "marital_status": "married", "education": "higher", "social_class": "working class"}, "question": {"id": "Q221", "variant": 0}, "response": ["Based on the anthropological framework, my response to the question of how frequently I vote in local level elections would be influenced by several factors. My emic perspective as a married male from Cairo, Egypt, would be shaped by the cultural context of my community, where voting may be seen as a civic duty or may not hold as much importance compared to other aspects of daily life. My personal experience and individual values would also play a role, as well as my socioeconomic background as a working-class individual. Additionally, the space and time aspect would be relevant, as the political climate and accessibility of voting may vary in different areas of Cairo. Ultimately, my nuanced answer would be influenced by a combination of these factors, leading me to select one of the following options:\n\n2"]}, {"persona": {"region": "Cairo", "sex": "male", "age": 39, "country": "Egypt", "marital_status": "married", "education": "higher", "social_class": "lower middle class"}, "question": {"id": "Q221", "variant": 0}, "response": ["From an emic perspective, as a married male from Cairo, Egypt, I am influenced by the cultural context of my society, where local level elections may not hold as much significance as they do in other cultures. My individual values and personal experience, along with my lower middle class socioeconomic background, contribute to my perception of voting in local level elections. Additionally, cultural relativism plays a role in my decision-making, as I may not view voting in the same way as someone from a different cultural background. Furthermore, space and time, as well as nuance, affect my understanding of the question. Therefore, based on these factors, I would choose option (3) Never, as local level elections may not be a priority in my cultural and socioeconomic context. \n\n3"]}, {"persona": {"region": "Cairo", "sex": "female", "age": 41, "country": "Egypt", "marital_status": "married", "education": "middle", "social_class": "lower middle class"}, "question": {"id": "Q221", "variant": 0}, "response": ["Based on the anthropological framework, as a married female from Cairo, Egypt, my emic perspective on local level elections is heavily influenced by my cultural context and socioeconomic background. In Egypt, there are societal expectations and family responsibilities that shape my individual values and personal experiences, including my level of education and lower middle class status. Additionally, my understanding of space and time in relation to political participation is influenced by my age and the historical and cultural context of Egypt. Therefore, I would choose option (2) Usually as my frequency of voting in local level elections, as it reflects the nuanced and subjective nature of political engagement within my cultural and socioeconomic context. \n\n2"]}, {"persona": {"region": "Cairo", "sex": "male", "age": 45, "country": "Syria", "marital_status": "single", "education": "higher", "social_class": "upper middle class"}, "question": {"id": "Q221", "variant": 0}, "response": ["Based on my personal experience and socioeconomic background as a single male from Cairo, Syria, I have had the opportunity to receive a higher education and to be part of the upper middle class. This has allowed me to have a different level of engagement in local level elections compared to other individuals. The cultural context of my upbringing has also influenced my understanding of the importance of participating in the political process. Additionally, my age and place of residence have shaped my perspective on the significance of voting in local elections. Taking into account the nuanced phrasing of the question, I believe my response will accurately reflect the emic and etic perspectives, individual values, and cultural relativism within my specific context.\n\n2"]}, {"persona": {"region": "Cairo", "sex": "male", "age": 54, "country": "Egypt", "marital_status": "married", "education": "higher", "social_class": "lower middle class"}, "question": {"id": "Q221", "variant": 0}, "response": ["Based on the anthropological framework, my answer to the question of how frequently I vote in local level elections is influenced by several factors. As a married male from Cairo, Egypt, my cultural context and socioeconomic background play a significant role in my decision-making. In Egypt, the political environment and voting processes are heavily influenced by cultural and social factors, and as a member of the lower middle class, my access to information and resources may impact my ability to participate in local level elections. Additionally, my individual values and personal experiences, as well as the specific nuances of the question, will shape my response. Therefore, my answer is (2) Usually."]}, {"persona": {"region": "Cairo", "sex": "male", "age": 65, "country": "Egypt", "marital_status": "married", "education": "middle", "social_class": "upper middle class"}, "question": {"id": "Q221", "variant": 0}, "response": ["From an anthropological perspective, my emic and etic understanding of local level elections is shaped by my cultural context as a married male from Cairo, Egypt. My individual values and personal experiences, as well as my socioeconomic background as part of the upper middle class, influence my perception of the importance of local level elections. Additionally, the cultural relativism of my society and the significance of space and time in my community also play a role in my decision. Considering all these factors, I would choose option (2) Usually, as I believe in participating in the electoral process, but may not be able to do so in every local level election due to various circumstances. \n\n2"]}, {"persona": {"region": "Cairo", "sex": "female", "age": 52, "country": "Egypt", "marital_status": "married", "education": "middle", "social_class": "upper middle class"}, "question": {"id": "Q221", "variant": 0}, "response": ["Based on the anthropological framework, my cultural context as a married female from Cairo, Egypt, along with my age, education level, and socioeconomic background as part of the upper middle class, all influence my perspective on local level elections. The emic perspective from my cultural context values participation in community decisions and the etic perspective emphasizes the importance of stability and order in society. My individual values and personal experience also play a role in my decision, as I have been taught to value civic duty and responsibility. Additionally, cultural relativism reminds me that my perspective is valid within my cultural context. Therefore, I choose option (1) Always as my response to the question of how frequently I vote in local level elections.\n\n1"]}, {"persona": {"region": "Cairo", "sex": "male", "age": 26, "country": "Egypt", "marital_status": "single", "education": "higher", "social_class": "lower middle class"}, "question": {"id": "Q221", "variant": 0}, "response": ["Based on my emic perspective as a single male from Cairo, Egypt, I understand that voting in local level elections is influenced by cultural context, individual values, and socioeconomic background. In Egypt, there is a strong cultural emphasis on participation in political processes, and as a young, educated individual from the lower middle class, I am aware of the importance of contributing to my community. Additionally, my personal experience and values have instilled in me a sense of responsibility to engage in civic duties. Considering the nuance of the question, I would choose the option \"Usually\" as local level elections in Egypt may not always align with my personal schedule and priorities, but I still make a concerted effort to participate in the electoral process when possible.\n\n2"]}, {"persona": {"region": "Cairo", "sex": "male", "age": 32, "country": "Egypt", "marital_status": "married", "education": "middle", "social_class": "working class"}, "question": {"id": "Q221", "variant": 0}, "response": ["Based on the anthropological framework, my cultural context as a married male from Cairo, Egypt, my age, and socioeconomic background as part of the working class are crucial in understanding my perspective on local level elections. In Egypt, there is a strong emphasis on community and collective decision-making, and voting is seen as a way to participate in the civic life of the community. However, the political environment in Egypt may lead to feelings of disillusionment and distrust in the electoral process, especially among working-class individuals. Additionally, my personal experience and values may influence my decision to vote, as I may feel that my vote does not make a significant impact on local politics. Therefore, I choose option (3) Never."]}, {"persona": {"region": "Cairo", "sex": "male", "age": 38, "country": "Egypt", "marital_status": "married", "education": "middle", "social_class": "lower middle class"}, "question": {"id": "Q221", "variant": 0}, "response": ["Based on the anthropological framework, I, as a married male from Cairo, Egypt, aged 38 and belonging to the lower middle class, would answer this question based on my cultural context, individual values, and socioeconomic background. In Egypt, the lower middle class often faces challenges related to financial stability and access to resources, which can affect their political participation. Additionally, the cultural context in Egypt may place importance on collective decision-making and community involvement in local level elections. My personal experience and values may also influence my decision, as well as the nuanced phrasing of the question. Taking all of this into consideration, my answer would be as follows:\n\n2\n\n(2) Usually"]}, {"persona": {"region": "Cairo", "sex": "male", "age": 58, "country": "Egypt", "marital_status": "married", "education": "higher", "social_class": "upper middle class"}, "question": {"id": "Q221", "variant": 0}, "response": ["Based on the anthropological framework, as a married male from Cairo, Egypt, my emic perspective on local level elections is influenced by cultural context, individual values, and socioeconomic background. In Egypt, there is a strong emphasis on civic duty and participation in political processes, especially for educated individuals from the upper middle class. Additionally, my personal experience and values as a well-educated individual have instilled in me the importance of exercising my right to vote. Furthermore, my socioeconomic background affords me the time and resources to stay informed and participate in local level elections. Therefore, my answer to the question would be:\n2"]}, {"persona": {"region": "Cairo", "sex": "male", "age": 49, "country": "Egypt", "marital_status": "married", "education": "middle", "social_class": "lower middle class"}, "question": {"id": "Q221", "variant": 0}, "response": ["Based on the anthropological framework, my emic perspective as a married male from Cairo, Egypt, at 49 years of age and part of the lower middle class, is heavily influenced by the cultural context and socioeconomic background. In Egypt, there is a strong emphasis on family and community, and local level elections are often seen as an important way to contribute to the well-being of the community. However, due to my lower middle class status and limited education, I may not feel empowered or informed enough to participate in local level elections. Additionally, the political climate in Egypt may also influence my decision, as there may be restrictions or limitations on voting. Therefore, my personal experience, cultural context, and socioeconomic background all play a role in my decision to usually vote in local level elections.\n\n2"]}, {"persona": {"region": "Cairo", "sex": "female", "age": 29, "country": "Egypt", "marital_status": "married", "education": "middle", "social_class": "working class"}, "question": {"id": "Q221", "variant": 0}, "response": ["Based on the anthropological framework, my perspective is heavily influenced by my cultural context, individual values, and socioeconomic background. As a married female from Cairo, Egypt, I am likely to have a strong sense of community and the importance of local level elections. However, my working-class status and limited education may also impact my ability to participate in these elections. Additionally, cultural relativism is important to consider as the societal norms and expectations regarding voting may differ from those in other cultures. Taking all of this into account, my answer would be: \n\n2) Usually"]}, {"persona": {"region": "Cairo", "sex": "female", "age": 36, "country": "Egypt", "marital_status": "married", "education": "higher", "social_class": "lower middle class"}, "question": {"id": "Q221", "variant": 0}, "response": ["Based on the anthropological framework, my answer will be influenced by my emic perspective as a married female from Cairo, Egypt. My cultural context and socioeconomic background as part of the lower middle class will also play a significant role in shaping my response. Additionally, my personal experience and individual values will influence my decision. In Egypt, the political landscape and voting culture are influenced by various factors such as government control, social norms, and economic conditions. Furthermore, the nuanced phrasing of the question will also impact my response.\n\n2"]}, {"persona": {"region": "Cairo", "sex": "female", "age": 34, "country": "Egypt", "marital_status": "married", "education": "middle", "social_class": "lower middle class"}, "question": {"id": "Q221", "variant": 0}, "response": ["From the perspective of a married female from Cairo, Egypt, who is 34 years old and part of the lower middle class, the answer to the question of how frequently she votes in local level elections would be influenced by several factors. The cultural context of Egypt, with its complex political environment, plays a pivotal role in shaping her views on voting. Additionally, her lower middle class socioeconomic background may impact her access to information and resources necessary for voting. Her personal experience and individual values may also influence her decision, as well as the nuanced phrasing of the question. Taking into consideration the emic and etic perspectives, cultural relativism, and the influence of space and time, the answer will be based on a subjective understanding shaped by these factors.\n\n3"]}, {"persona": {"region": "Fayoum", "sex": "male", "age": 57, "country": "Egypt", "marital_status": "married", "education": "middle", "social_class": "working class"}, "question": {"id": "Q221", "variant": 0}, "response": ["Based on the anthropological framework, as a married male from Fayoum, Egypt, my emic perspective is influenced by my cultural context, individual values, and socioeconomic background. In Egyptian society, there are certain expectations and norms for individuals like me, especially regarding political participation. My age and working-class status also play a role in shaping my understanding of the importance of local level elections. Given my personal experience and cultural context, my answer to this question is influenced by the fact that I have limited access to information and resources that would facilitate my participation in local level elections. Therefore, I would select option (3) Never. \n\n3"]}, {"persona": {"region": "Fayoum", "sex": "male", "age": 60, "country": "Egypt", "marital_status": "married", "education": "middle", "social_class": "lower middle class"}, "question": {"id": "Q221", "variant": 0}, "response": ["Based on the anthropological framework, my perspective as a married male from Fayoum, Egypt, who is 60 years old and part of the lower middle class, is heavily influenced by my cultural context, individual values, and socioeconomic background. In Egypt, there is a strong emphasis on community and the importance of local level elections. However, my lower middle class status means that I may not have as much access to resources or education as those in higher socioeconomic brackets, which could impact my ability to participate in the electoral process. Additionally, my age and life experience may have shaped my perception of the political system and my willingness to engage in voting. Taking all of these factors into consideration, I would choose the following option:\n\n2"]}, {"persona": {"region": "Fayoum", "sex": "male", "age": 21, "country": "Egypt", "marital_status": "single", "education": "middle", "social_class": "lower middle class"}, "question": {"id": "Q221", "variant": 0}, "response": ["Based on the anthropological framework, my emic perspective as a single male from Fayoum, Egypt, who has completed middle education and considers myself part of the lower middle class, is influenced by my cultural context, individual values, and socioeconomic background. In Egypt, there is a strong emphasis on community and family, and voting in local level elections is seen as an important civic duty. However, due to my socioeconomic background, I may not have the same access to information and resources as those in higher classes, impacting my ability to participate in the electoral process. Additionally, as a young adult, I may feel that my individual voice and vote may not have a significant impact on the outcome of the elections. Therefore, I may choose to answer the question as follows:\n\n3\n\nNever"]}, {"persona": {"region": "Fayoum", "sex": "male", "age": 33, "country": "Egypt", "marital_status": "single", "education": "higher", "social_class": "working class"}, "question": {"id": "Q221", "variant": 0}, "response": ["Based on the anthropological framework, as a single male from Fayoum, Egypt, who completed higher education and considers myself part of the working class, my answer to the question of how frequently I vote in local level elections would be influenced by my cultural context, individual values, and socioeconomic background. In Egypt, there is a complex political and social landscape, and voting is often seen as a way to participate in the political process. However, my working-class background and personal experiences may lead me to feel disconnected from the political system, and the socioeconomic barriers I face may make it difficult for me to prioritize voting. Additionally, the cultural context of Egypt and the nuanced phrasing of the question may lead me to be skeptical of the impact of my vote in local elections. Therefore, my answer would be (2) Usually.\n2"]}, {"persona": {"region": "Fayoum", "sex": "male", "age": 32, "country": "Egypt", "marital_status": "married", "education": "higher", "social_class": "lower middle class"}, "question": {"id": "Q221", "variant": 0}, "response": ["Based on the anthropological framework, as a married male from Fayoum, Egypt, who is 32 years old and part of the lower middle class, my answer to the question of voting in local level elections is influenced by a combination of factors. My cultural context and socioeconomic background play a significant role in my decision. In Egypt, there may be cultural and societal expectations regarding political participation, and as someone from the lower middle class, I may have limited access to resources and information about the candidates and issues. Additionally, my individual values and personal experience may shape my perception of the effectiveness of voting in local elections. Given these factors, my perspective is that I usually vote in local level elections.\n\n2"]}, {"persona": {"region": "Gharbia", "sex": "male", "age": 42, "country": "Egypt", "marital_status": "married", "education": "higher", "social_class": "upper middle class"}, "question": {"id": "Q221", "variant": 0}, "response": ["Based on my emic perspective as a married male from Gharbia, Egypt, I understand the cultural context to be highly influential in shaping my thoughts and behaviors. In my community, there is a strong emphasis on civic duty and participation in local level elections. My individual values and personal experiences have also shaped my understanding of the importance of exercising my right to vote. Additionally, my socioeconomic background as part of the upper middle class has provided me with the resources and education to understand the significance of participating in local governance. Furthermore, cultural relativism teaches me to respect and uphold the values of my community. Taking into account the space and time factor, as a 42-year-old individual, I have developed a deep understanding of the political landscape in my area. Lastly, nuance plays a crucial role in my decision-making, as I carefully weigh the implications of my vote. Therefore, my choice is:\n1"]}, {"persona": {"region": "Gharbia", "sex": "male", "age": 52, "country": "Egypt", "marital_status": "married", "education": "middle", "social_class": "working class"}, "question": {"id": "Q221", "variant": 0}, "response": ["Based on the anthropological framework, my emic perspective as a married male from Gharbia, Egypt, who is 52 years old and part of the working class, is influenced by my cultural context, individual values, and socioeconomic background. In Egypt, the political culture and the level of trust in the government may impact my decision to vote in local level elections. Additionally, my personal experience and values as a working class individual may influence my perception of the political system and the impact of my vote. Furthermore, my socioeconomic background may limit my access to information about local elections and the candidates. Therefore, based on these factors, my decision to vote in local level elections may be influenced by a combination of these considerations. \n\n2"]}, {"persona": {"region": "Gharbia", "sex": "male", "age": 45, "country": "Egypt", "marital_status": "divorced", "education": "higher", "social_class": "upper middle class"}, "question": {"id": "Q221", "variant": 0}, "response": ["From an emic perspective, as a divorced male from Gharbia, Egypt, who is 45 years old, completed higher education, and considers himself part of the upper middle class, my cultural context and individual values play a significant role in my decision-making. In Egyptian society, there is a strong emphasis on participating in local level elections as a way to contribute to the community and have a say in local governance. My personal experience and values also prioritize civic engagement and the importance of exercising my right to vote. Additionally, my socioeconomic background as an educated, upper middle class individual provides me with the resources and opportunities to stay informed about local issues and candidates. Lastly, considering the cultural relativism and nuanced understanding of the question, I would choose the option that aligns with my personal values and the societal expectations in my cultural context.\n\n2"]}, {"persona": {"region": "Behaira", "sex": "male", "age": 23, "country": "Egypt", "marital_status": "single", "education": "middle", "social_class": "lower class"}, "question": {"id": "Q221", "variant": 0}, "response": ["Based on my personal experience and socioeconomic background, as a lower-class individual from Behaira, Egypt, I have limited access to education and resources. This has influenced my understanding of the political system and my ability to participate in local level elections. Additionally, living in a culture where there may be limited emphasis on political participation and with limited access to information and resources, I am less likely to prioritize voting in local level elections.\n\n3"]}, {"persona": {"region": "Behaira", "sex": "male", "age": 38, "country": "Egypt", "marital_status": "single", "education": "higher", "social_class": "lower class"}, "question": {"id": "Q221", "variant": 0}, "response": ["Based on my cultural context as a single male from Behaira, Egypt, my socioeconomic background as part of the lower class, and my age and education level, I have a unique perspective on local level elections. My personal experience and individual values also play a significant role in my decision-making process. Additionally, the emic and etic perspectives in my community influence my understanding of the importance of voting. Considering all these factors, I choose option 3: Never. \n\n3"]}, {"persona": {"region": "Behaira", "sex": "male", "age": 32, "country": "Egypt", "marital_status": "married", "education": "middle", "social_class": "lower class"}, "question": {"id": "Q221", "variant": 0}, "response": ["Based on the anthropological framework, my emic perspective as a lower-class married male from Behaira, Egypt, with limited education and resources, would greatly influence my decision on whether or not to vote in local level elections. Given my cultural context and socioeconomic background, I may not feel empowered or have access to information necessary to make an informed decision, leading me to choose option 3: Never. Additionally, my individual values and personal experiences may also play a role in my decision, as I may not see the direct impact of my vote on my life due to the lack of resources and opportunities available to me. Therefore, my choice is based on a combination of cultural context, socioeconomic background, and personal experience, reflecting the emic perspective of someone in my position. \n\n3"]}, {"persona": {"region": "Behaira", "sex": "female", "age": 37, "country": "Egypt", "marital_status": "married", "education": "middle", "social_class": "working class"}, "question": {"id": "Q221", "variant": 0}, "response": ["Based on the anthropological framework, my answer to the question of how frequently I vote in local level elections would be influenced by my cultural context, socioeconomic background, and individual values. As a married female from Behaira, Egypt, I am part of the working class and have completed middle education level. In Egypt, there may be cultural norms and expectations around voting, and my socioeconomic background may affect my access to information and resources related to the election process. Additionally, my individual values and personal experiences may shape my perception of the importance of participating in local level elections. Taking all of this into consideration, I would choose option (2) Usually, as my experience and values may lead me to prioritize participating in local level elections whenever possible. \n\n2"]}, {"persona": {"region": "Behaira", "sex": "male", "age": 48, "country": "Egypt", "marital_status": "married", "education": "middle", "social_class": "working class"}, "question": {"id": "Q221", "variant": 0}, "response": ["Based on the anthropological framework, my response to the question of how frequently I vote in local level elections is heavily influenced by my cultural context and socioeconomic background. As a married male from Behaira, Egypt, I come from a working-class background and have completed only middle education level. This means that I may not have the same access to information about local level elections as someone from a higher socioeconomic background or with a higher level of education. Additionally, the cultural context of Egypt may also play a role, as there may be cultural norms or barriers that affect my participation in local elections. Therefore, my answer would be (2) Usually, as I may not have the same opportunities or resources to participate in local level elections as others."]}, {"persona": {"region": "Behaira", "sex": "female", "age": 34, "country": "Egypt", "marital_status": "married", "education": "middle", "social_class": "lower class"}, "question": {"id": "Q221", "variant": 0}, "response": ["Based on the anthropological framework, as a married woman from Behaira, Egypt, my emic perspective would be influenced by cultural and socioeconomic background, as well as individual values and personal experience. In my community, women from lower class backgrounds often have limited access to education and opportunities for political participation. Additionally, cultural norms and gender roles may play a significant role in determining the level of involvement in local elections. Therefore, my answer would be influenced by these factors, as well as the understanding of cultural relativism and the nuanced phrasing of the question. \n\n3"]}, {"persona": {"region": "Behaira", "sex": "female", "age": 30, "country": "Egypt", "marital_status": "divorced", "education": "lower", "social_class": "lower class"}, "question": {"id": "Q221", "variant": 0}, "response": ["From my emic perspective as a divorced female from Behaira, Egypt, I have to take into account my cultural context, individual values, and socioeconomic background. In my community, women are not always encouraged to participate in political activities, and as a lower class individual with lower education, I have limited access to information and resources that would enable me to participate in local level elections. Additionally, my personal experience and values have led me to prioritize other aspects of my life over political engagement. Considering these factors, I would have to say that I never vote in local level elections.\n\n3"]}, {"persona": {"region": "Behaira", "sex": "male", "age": 40, "country": "Egypt", "marital_status": "married", "education": "higher", "social_class": "lower middle class"}, "question": {"id": "Q221", "variant": 0}, "response": ["Based on the anthropological framework, my answer to the question of how frequently I vote in local level elections is influenced by a combination of factors. My emic perspective as a married male from Behaira, Egypt, and my etic perspective as part of the lower middle class play a significant role in shaping my response. Culturally, voting may be seen as a civic duty, but my socioeconomic background and personal values also come into play. Additionally, my age and education level contribute to my understanding of the importance of political participation. Given these considerations, my answer is that I usually vote in local level elections.\n\n2"]}, {"persona": {"region": "Behaira", "sex": "male", "age": 38, "country": "Egypt", "marital_status": "married", "education": "middle", "social_class": "working class"}, "question": {"id": "Q221", "variant": 0}, "response": ["Based on the anthropological framework, the emic and etic perspectives of my persona as a married male from Behaira, Egypt, who is 38 years old, completed middle education level, and considers himself part of the working class, greatly influence my response to the question. The cultural context, individual values, and socioeconomic background play a significant role in shaping my views. In Egypt, local level elections may not hold as much significance for someone from the working class, and the limited access to education may also affect my understanding of the importance of voting. Additionally, the cultural relativism perspective suggests that the value and significance of voting may vary depending on the cultural context. Therefore, my response to the question may be influenced by these factors.\n\n3"]}, {"persona": {"region": "Behaira", "sex": "female", "age": 30, "country": "Egypt", "marital_status": "married", "education": "higher", "social_class": "lower class"}, "question": {"id": "Q221", "variant": 0}, "response": ["Based on my emic perspective as a married female from Behaira, Egypt, my cultural context and socioeconomic background play a significant role in my decision to vote in local level elections. Being part of the lower class, my access to education and resources may impact my ability to engage in the political process. Additionally, my individual values and personal experiences, as well as the cultural relativism in my community, may influence my perception of the importance of voting. Furthermore, considering the space and time in which I live, I may feel that my voice is not adequately represented in the political system. Therefore, my answer is (3) Never."]}, {"persona": {"region": "Behaira", "sex": "female", "age": 35, "country": "Egypt", "marital_status": "married", "education": "middle", "social_class": "working class"}, "question": {"id": "Q221", "variant": 0}, "response": ["Based on the anthropological framework, as a married female from Behaira, Egypt, I am influenced by my cultural context, individual values and personal experience, and socioeconomic background. In my community, there may be certain expectations and limitations for women in terms of political participation. Additionally, my middle education level and working-class status may impact my access to information and resources related to voting. Considering these factors, I would choose the option that aligns with the societal norms and my personal circumstances.\n\n2"]}, {"persona": {"region": "Behaira", "sex": "male", "age": 52, "country": "Egypt", "marital_status": "married", "education": "middle", "social_class": "lower class"}, "question": {"id": "Q221", "variant": 0}, "response": ["Based on the anthropological framework, as a married male from Behaira, Egypt, who is 52 years old, has completed middle education, and considers himself part of the lower class, my perspective on voting in local level elections is heavily influenced by my cultural context, socioeconomic background, and individual values. In Behaira, there may be limited access to education and resources, which can impact the importance and availability of voting. Additionally, being part of the lower class may mean that I have limited faith in the ability of local elections to bring about meaningful change in my community. Furthermore, my personal experience and values may lead me to believe that my voice may not be heard or valued in the political process. Therefore, I would likely choose option (3) Never, as I may feel disenfranchised and disempowered in the political system. \n\n3"]}, {"persona": {"region": "Alexandria", "sex": "female", "age": 41, "country": "Egypt", "marital_status": "single", "education": "middle", "social_class": "lower class"}, "question": {"id": "Q221", "variant": 0}, "response": ["Based on the anthropological framework, as a single female from Alexandria, Egypt, I would approach the question of voting frequency from the perspective of my cultural context, individual values, and socioeconomic background. In Egypt, there may be cultural and social barriers for women to participate in local level elections, especially if they are part of the lower class and have only completed middle education. Additionally, the socioeconomic background may limit access to information and resources needed to engage in the voting process. Therefore, I may be inclined to choose option 3) Never, as it is possible that my circumstances have prevented me from being able to participate in local level elections despite my potential desire to do so."]}, {"persona": {"region": "Alexandria", "sex": "female", "age": 21, "country": "Egypt", "marital_status": "single", "education": "middle", "social_class": "lower class"}, "question": {"id": "Q221", "variant": 0}, "response": ["Based on the anthropological framework, my perspective as a single female from Alexandria, Egypt, who is 21 years old and part of the lower class, is heavily influenced by my cultural context, individual values, and socioeconomic background. In Egypt, there are societal constraints and cultural norms that may limit the participation of women in local level elections. Additionally, being from a lower socioeconomic background may mean that I have limited access to education and resources that could enable me to engage in the political process. Furthermore, the emic perspective of my community may prioritize other survival needs over political participation. Taking all these factors into consideration, my answer to the question would be:\n\n3\n\n(3) Never"]}, {"persona": {"region": "Alexandria", "sex": "female", "age": 35, "country": "Egypt", "marital_status": "married", "education": "middle", "social_class": "lower class"}, "question": {"id": "Q221", "variant": 0}, "response": ["Based on my cultural context, as a married female from Alexandria, Egypt, my personal experience and individual values play a significant role in my decision-making. Given my lower socioeconomic background and limited education, I am aware of the power dynamics and the political system in my community. Additionally, the space and time in which I live also shape my perception of local level elections. Considering all these factors, I would have to choose:\n\n3"]}, {"persona": {"region": "Alexandria", "sex": "male", "age": 34, "country": "Egypt", "marital_status": "married", "education": "higher", "social_class": "working class"}, "question": {"id": "Q221", "variant": 0}, "response": ["Based on the anthropological framework, as a married male from Alexandria, Egypt, my emic perspective would be influenced by my cultural context, individual values, and socioeconomic background. In Egypt, there is a strong cultural emphasis on familial and community ties, and voting in local level elections may be seen as a way to contribute to the well-being of the community. Additionally, my individual values and personal experiences, shaped by my higher education and working class background, may lead me to prioritize civic engagement and participation in the political process. Therefore, I would likely choose to vote in local level elections when possible, as it aligns with my cultural and personal values.\n\n2"]}, {"persona": {"region": "Alexandria", "sex": "female", "age": 37, "country": "Egypt", "marital_status": "married", "education": "higher", "social_class": "lower middle class"}, "question": {"id": "Q221", "variant": 0}, "response": ["Based on the anthropological framework, my perspective on local level elections is heavily influenced by my cultural context, individual values, and socioeconomic background. As a married female from Alexandria, Egypt, I am aware of the importance of participation in the political process, but I also recognize the limitations that my socioeconomic status may impose on my ability to engage in voting. Additionally, my personal experience and values shape my understanding of the significance of local level elections. Considering these factors, I would choose the following option:\n\n2"]}, {"persona": {"region": "Alexandria", "sex": "female", "age": 56, "country": "Egypt", "marital_status": "divorced", "education": "middle", "social_class": "working class"}, "question": {"id": "Q221", "variant": 0}, "response": ["Based on the anthropological framework, my emic perspective as a divorced female from Alexandria, Egypt, of working class status, and with a middle education level, is influenced by my cultural context, individual values, and socioeconomic background. In Egypt, the cultural context and socioeconomic background play a significant role in shaping one's political engagement. Due to my personal experience and values, I believe in the importance of civic duty and participating in local level elections, despite the challenges faced by working-class individuals. Additionally, the nuanced phrasing of the question acknowledges the complexities of political participation in Egypt. Therefore, my choice is (2) Usually as I recognize the importance of voting, but also acknowledge the barriers that may prevent me from always participating in local level elections."]}, {"persona": {"region": "Alexandria", "sex": "male", "age": 48, "country": "Egypt", "marital_status": "married", "education": "higher", "social_class": "working class"}, "question": {"id": "Q221", "variant": 0}, "response": ["From an emic perspective, as a married male from Alexandria, Egypt, my cultural context and socioeconomic background play a significant role in my understanding and approach to local level elections. The political landscape in Egypt is complex and influenced by historical and cultural factors, and as a member of the working class, my access to and understanding of the political system may be different from those in higher socioeconomic brackets. Additionally, my age and personal experiences have shaped my views on the importance and impact of local level elections. Cultural relativism is also important to consider, as there are differing beliefs and values surrounding the political process. Based on these factors, I would choose the following option:\n\n2"]}, {"persona": {"region": "Alexandria", "sex": "female", "age": 30, "country": "Egypt", "marital_status": "married", "education": "middle", "social_class": "working class"}, "question": {"id": "Q221", "variant": 0}, "response": ["Based on the anthropological framework, my answer is influenced by my emic perspective as a married female from Alexandria, Egypt, my cultural context as a member of the working class, my individual values and personal experiences, and my socioeconomic background. In Egypt, there is a strong sense of community and civic duty, and voting is seen as a way to contribute to the betterment of our local society. However, as a working-class woman with limited educational opportunities, I may face barriers to participating in local level elections such as lack of access to information or time constraints due to work and family responsibilities. Therefore, my answer is influenced by the nuanced phrasing of the question and the socioeconomic background of my persona. \n\n2"]}, {"persona": {"region": "Alexandria", "sex": "male", "age": 19, "country": "Egypt", "marital_status": "single", "education": "middle", "social_class": "lower class"}, "question": {"id": "Q221", "variant": 0}, "response": ["Based on the anthropological framework, my emic perspective as a lower-class male from Alexandria, Egypt, heavily influences my personal experience and values. The cultural context in which I live, with its socio-economic background and limited access to education, also shapes my understanding of the importance of local level elections. Additionally, the space and time in which I exist as a 19-year-old also play a role in my decision-making process. Therefore, I choose option 3: Never. \n\n3"]}, {"persona": {"region": "Alexandria", "sex": "male", "age": 45, "country": "Egypt", "marital_status": "married", "education": "middle", "social_class": "lower middle class"}, "question": {"id": "Q221", "variant": 0}, "response": ["Based on the anthropological framework, my answer to the question of how frequently I vote in local level elections is influenced by my cultural context, individual values, and socioeconomic background. In Egypt, there is a strong cultural emphasis on community and civic engagement, and I personally place value on participating in the democratic process. However, as a member of the lower middle class with limited education, I may face barriers such as lack of access to information about candidates or difficulty in reaching polling stations. Additionally, my socioeconomic background may also impact my ability to take time off work to vote. Therefore, my answer to the question is:\n(2) Usually"]}, {"persona": {"region": "Alexandria", "sex": "male", "age": 23, "country": "Egypt", "marital_status": "single", "education": "higher", "social_class": "lower class"}, "question": {"id": "Q221", "variant": 0}, "response": ["From an emic perspective, as a single male from Alexandria, Egypt, my cultural context and socioeconomic background play a significant role in my decision to vote in local level elections. Being part of the lower class, my access to education and resources may be limited, impacting my understanding of the political process and my ability to engage in voting. Additionally, my individual values and personal experiences may shape my perception of the relevance and impact of local level elections on my life. Considering cultural relativism, I may view the political system and its practices differently than others from different cultural and socioeconomic backgrounds. Furthermore, space and time, as well as nuance, affect how I interpret and respond to the question. Based on these factors, my choice is:\n\n3"]}, {"persona": {"region": "Alexandria", "sex": "female", "age": 28, "country": "Egypt", "marital_status": "married", "education": "middle", "social_class": "working class"}, "question": {"id": "Q221", "variant": 0}, "response": ["Based on the anthropological framework, my emic perspective as a married female from Alexandria, Egypt, at the age of 28 and part of the working class, is heavily influenced by my cultural context, individual values, and socioeconomic background. In Egypt, there are cultural and societal expectations and norms that shape my perception of voting, and my personal experience and values as a member of the working class influence my decision as well. Additionally, the socioeconomic background of being in the working class may affect my access to information and resources related to voting. Therefore, my decision is based on these factors and may differ from an etic perspective.\n\n2"]}, {"persona": {"region": "Alexandria", "sex": "male", "age": 34, "country": "Egypt", "marital_status": "single", "education": "higher", "social_class": "working class"}, "question": {"id": "Q221", "variant": 0}, "response": ["Based on the anthropological framework, my answer is influenced by my individual values and personal experience, as well as my socioeconomic background. As a single male from Alexandria, Egypt, who completed higher education and considers myself part of the working class, my perception of local level elections is shaped by the cultural context and socioeconomic background. In Egypt, there may be limitations on the freedom to vote and the impact of local level elections, which may influence my decision. Additionally, my personal experience and values may play a role in whether I perceive voting as an effective means of creating change in my community. Therefore, my answer is option (3) Never. \n\n3"]}, {"persona": {"region": "Alexandria", "sex": "male", "age": 30, "country": "Egypt", "marital_status": "married", "education": "higher", "social_class": "lower middle class"}, "question": {"id": "Q221", "variant": 0}, "response": ["Based on my emic perspective as a married male from Alexandria, Egypt, I believe that voting in local level elections is important for the progression and development of our community. My cultural context, individual values, and personal experience have taught me that participating in the political process is crucial for the betterment of society. Despite my lower middle class socioeconomic background, I understand the value of having a voice in local governance. Additionally, cultural relativism teaches me to respect the democratic process and the importance of civic engagement. In this space and time, at 30 years of age and having completed higher education, I recognize the significance of my role in shaping the future of my community. Therefore, I choose option (2) Usually, as I make an effort to exercise my right to vote in local level elections whenever possible. \n\n2"]}, {"persona": {"region": "Alexandria", "sex": "female", "age": 49, "country": "Egypt", "marital_status": "married", "education": "higher", "social_class": "lower middle class"}, "question": {"id": "Q221", "variant": 0}, "response": ["From an emic perspective, as a married female from Alexandria, Egypt, my cultural context and socioeconomic background play a significant role in my decision to vote in local level elections. In Egypt, there is a strong emphasis on community and civic duty, and as a member of the lower middle class, I feel a strong sense of responsibility to participate in the political process. Additionally, my individual values and personal experience have shaped my understanding of the importance of voting, especially as someone who has completed higher education. Furthermore, cultural relativism is crucial in understanding that my perspective may differ from others based on their cultural, socioeconomic, and educational backgrounds. Therefore, my choice to vote in local level elections is influenced by a combination of my cultural context, individual values, and socioeconomic background. \n\n2"]}, {"persona": {"region": "Kafr el-sheikh", "sex": "male", "age": 49, "country": "Egypt", "marital_status": "married", "education": "higher", "social_class": "working class"}, "question": {"id": "Q221", "variant": 0}, "response": ["From an emic perspective, as a married male from Kafr el-sheikh, Egypt, the cultural context and socioeconomic background play a significant role in my decision to vote in local level elections. In Egypt, there is a strong emphasis on community and family, and my individual values and personal experience have shaped my understanding of the importance of participating in local elections. Additionally, my working class background and limited access to resources have influenced my perception of the political system. Furthermore, cultural relativism is crucial in understanding the complexities of the Egyptian political landscape. Therefore, I choose option (2) Usually, as I understand the importance of participating in local level elections and strive to exercise my civic duty whenever possible. \n\n2"]}, {"persona": {"region": "Kafr el-sheikh", "sex": "male", "age": 25, "country": "Egypt", "marital_status": "single", "education": "middle", "social_class": "lower middle class"}, "question": {"id": "Q221", "variant": 0}, "response": ["From an emic perspective, as a single male from Kafr el-sheikh, Egypt, the cultural context and socioeconomic background play a significant role in my decision-making process. In Egypt, the lower middle class often faces economic challenges and may feel marginalized in the political process. Additionally, the cultural relativism of the region means that there may be a lack of trust in the political system, leading to a feeling of disempowerment. As a 25-year-old with limited education, I may not feel adequately informed about the candidates or issues, further influencing my decision. Additionally, the nuance of the question is important to consider, as the frequency of local level elections and the impact they have on my daily life may also factor into my decision-making process.\n\n3"]}, {"persona": {"region": "Kafr el-sheikh", "sex": "male", "age": 59, "country": "Egypt", "marital_status": "married", "education": "higher", "social_class": "lower middle class"}, "question": {"id": "Q221", "variant": 0}, "response": ["Based on my personal experience and socioeconomic background, I understand the importance of participating in local level elections. As a member of the lower middle class in Kafr el-sheikh, Egypt, I am keenly aware of the impact that local politics can have on my daily life and the lives of my community members. Additionally, the cultural context in which I live values civic engagement and participation in the democratic process. Therefore, I make a concerted effort to always vote in local level elections, as I believe it is my duty to contribute to the decision-making process that directly affects my community.\n\n1"]}, {"persona": {"region": "Kafr el-sheikh", "sex": "female", "age": 38, "country": "Egypt", "marital_status": "married", "education": "middle", "social_class": "working class"}, "question": {"id": "Q221", "variant": 0}, "response": ["From an emic perspective, as a married female from Kafr el-sheikh, Egypt, my cultural context plays a pivotal role in understanding and answering this question. In my community, there is a strong emphasis on family and kinship networks, and the socioeconomic background of the working class, to which I belong, greatly influences the opportunities and rights available to me. Additionally, my individual values and personal experiences, shaped by my middle education level and age, also factor into my perception of voting in local level elections. Furthermore, cultural relativism is crucial in understanding the nuances of my community's political participation. Considering all these factors, my answer would be (2) Usually, as I would try to participate as much as possible in local level elections, but may face barriers due to my socioeconomic background and cultural context. \n\n2"]}, {"persona": {"region": "Kafr el-sheikh", "sex": "male", "age": 35, "country": "Egypt", "marital_status": "married", "education": "higher", "social_class": "lower middle class"}, "question": {"id": "Q221", "variant": 0}, "response": ["Based on my cultural context, coming from Kafr el-sheikh, Egypt, there is a strong emphasis on community and participation in local level elections is seen as a civic duty. My individual values and personal experience, along with my higher education level, have instilled in me the importance of being an active member of society. Additionally, my lower middle class socioeconomic background has made me more aware of the impact local level elections can have on my community. Furthermore, the cultural relativism in Egypt emphasizes the importance of participating in democratic processes. Considering all these factors, I would choose option (1) Always, as I believe it is crucial to exercise my right to vote in local level elections to have a say in the decision-making process that directly affects my community.\n\n1"]}, {"persona": {"region": "Kafr el-sheikh", "sex": "male", "age": 49, "country": "Egypt", "marital_status": "married", "education": "middle", "social_class": "lower class"}, "question": {"id": "Q221", "variant": 0}, "response": ["Based on my cultural context and socioeconomic background, as a married male from Kafr el-sheikh, Egypt, with a middle education level and part of the lower class, my understanding and participation in local level elections are heavily influenced by my personal experience and individual values. In my community, there may be limited access to information about candidates and their platforms, and my socioeconomic status may impact my ability to travel to polling stations. Additionally, the emic perspective within my community may prioritize other forms of engagement with local governance, such as informal networks and community leaders, rather than formal voting processes. Therefore, I would choose option 2: Usually. \n\n2"]}, {"persona": {"region": "Kafr el-sheikh", "sex": "male", "age": 37, "country": "Egypt", "marital_status": "married", "education": "middle", "social_class": "lower class"}, "question": {"id": "Q221", "variant": 0}, "response": ["Based on my cultural context as a married male from Kafr el-sheikh, Egypt, my socioeconomic background as part of the lower class, and my age of 37, I have limited access to resources and opportunities for political participation. In Egypt, there are also cultural and societal norms that may restrict my ability to engage in local level elections. Additionally, my middle education level means that I may not have had as much exposure to political processes or the importance of voting. Therefore, I am more likely to have limited participation in local level elections. \n\n3"]}, {"persona": {"region": "Menofia", "sex": "female", "age": 22, "country": "Egypt", "marital_status": "single", "education": "middle", "social_class": "lower class"}, "question": {"id": "Q221", "variant": 0}, "response": ["Based on the anthropological framework, as a single female from Menofia, Egypt, who is 22 years old and part of the lower class, my emic perspective would be influenced by my cultural context, individual values, and socioeconomic background. In Egypt, there are traditional gender roles and expectations which may impact my decision to vote. Additionally, my lower socioeconomic background may limit my access to information and resources necessary for voting. Therefore, I would likely choose option 3, never, as I may feel disenfranchised and marginalized in local level elections due to my gender and social status. \n\n3"]}, {"persona": {"region": "Menofia", "sex": "female", "age": 25, "country": "Egypt", "marital_status": "married", "education": "middle", "social_class": "lower class"}, "question": {"id": "Q221", "variant": 0}, "response": ["Based on my cultural context, as a married female from Menofia, Egypt, my participation in local level elections is influenced by my socioeconomic background and cultural relativism. As a member of the lower class, I am more likely to face barriers to participating in elections due to factors such as lack of access to information, limited resources, and potential discrimination. Additionally, my emic perspective as a member of this community may lead me to prioritize other aspects of my daily life over political participation. Therefore, my answer would be (3) Never."]}, {"persona": {"region": "Menofia", "sex": "male", "age": 28, "country": "Egypt", "marital_status": "single", "education": "higher", "social_class": "working class"}, "question": {"id": "Q221", "variant": 0}, "response": ["Based on the anthropological framework, my emic perspective as a working-class male from Menofia, Egypt, is influenced by my cultural context, individual values, and socioeconomic background. In my community, voting in local level elections is seen as a way to participate in decision-making processes that directly impact our daily lives. My personal experience and values also emphasize the importance of civic engagement and contributing to the betterment of our community. Additionally, my socioeconomic background as a working-class individual means that I am aware of the potential impact of local level elections on issues such as public services and infrastructure. Therefore, my perspective leads me to choose option (2) Usually, as I believe in the value of participating in local level elections to have a say in the governance of my community. \n\n2"]}, {"persona": {"region": "Menofia", "sex": "male", "age": 35, "country": "Egypt", "marital_status": "married", "education": "middle", "social_class": "lower middle class"}, "question": {"id": "Q221", "variant": 0}, "response": ["Based on the anthropological framework, my emic perspective as a married male from Menofia, Egypt, at the age of 35 and from the lower middle class, is influenced by my cultural context, individual values, and socioeconomic background. In Egypt, there is a strong emphasis on community and family, and local level elections may not hold as much significance as national elections. Additionally, my lower middle class status may limit my access to information about local candidates and their platforms. Considering these factors, I would most likely choose option 3: Never.\n\n3"]}, {"persona": {"region": "Menofia", "sex": "male", "age": 55, "country": "Egypt", "marital_status": "married", "education": "middle", "social_class": "working class"}, "question": {"id": "Q221", "variant": 0}, "response": ["Based on the anthropological framework, my emic perspective as a married male from Menofia, Egypt, at the age of 55 and with a middle education level, is influenced by my cultural context, individual values and personal experience, and socioeconomic background. In Egypt, there is a strong sense of community and the value of participating in local level elections. However, as a working-class individual with limited education, I may not have had the same opportunities or encouragement to engage in the political process as someone from a higher socioeconomic background. Additionally, the current political climate in Egypt may also affect my decision to vote. Therefore, based on my personal experience and cultural context, I would choose option (2) Usually, as I understand the importance of participating in local level elections, but factors such as my socioeconomic background and education level may impact the frequency of my voting. \n\n2"]}, {"persona": {"region": "Menofia", "sex": "male", "age": 53, "country": "Egypt", "marital_status": "married", "education": "higher", "social_class": "lower middle class"}, "question": {"id": "Q221", "variant": 0}, "response": ["Based on the anthropological framework, my emic perspective as a married male from Menofia, Egypt, who is 53 years old, has completed higher education, and considers myself part of the lower middle class, is influenced by my cultural context, individual values, and socioeconomic background. In Egypt, voting is seen as a civic duty and a way to participate in the community, which aligns with my personal values. However, as a member of the lower middle class, I may have limited access to resources and information about local level elections, which may affect my ability to vote frequently. Additionally, my age and educational level may also play a role in how frequently I participate in local level elections. Therefore, based on my perspective, I would choose option (2) Usually, as I may face some barriers that prevent me from voting in every local level election. \n\n2"]}, {"persona": {"region": "Menofia", "sex": "male", "age": 59, "country": "Egypt", "marital_status": "married", "education": "middle", "social_class": "working class"}, "question": {"id": "Q221", "variant": 0}, "response": ["Based on the anthropological framework, my cultural context as a married male from Menofia, Egypt, my age of 59 years, and my completion of middle education level all influence my perspective on voting in local level elections. In Egypt, there is a strong cultural emphasis on community and collective decision-making, so voting is seen as a responsibility to participate in the local community's governance. As someone from the working class, I may have experienced challenges and disparities in accessing resources and opportunities, which could lead me to value the impact of local level elections on my community. Additionally, my personal experience and values may lead me to prioritize the opportunity to have a voice in local governance. Therefore, based on this perspective, I would choose the following option:\n\n2"]}, {"persona": {"region": "Menofia", "sex": "female", "age": 42, "country": "Egypt", "marital_status": "married", "education": "middle", "social_class": "lower middle class"}, "question": {"id": "Q221", "variant": 0}, "response": ["Based on the anthropological framework, as a married female from Menofia, Egypt, my emic perspective on local level elections is influenced by my cultural context, individual values, and socioeconomic background. In Egypt, there are cultural and societal expectations for women's participation in politics, and my personal experience and values also play a role in my decision. As a member of the lower middle class with a middle education level, I may feel less empowered to participate in local level elections due to limited access to resources and information. Additionally, the nuance of the question may also impact my response, as there may be social and familial pressures that influence my decision to vote. Therefore, my choice is:\n\n2. Usually"]}, {"persona": {"region": "Menofia", "sex": "male", "age": 39, "country": "Egypt", "marital_status": "married", "education": "higher", "social_class": "working class"}, "question": {"id": "Q221", "variant": 0}, "response": ["Based on the anthropological framework, as a married male from Menofia, Egypt, my emic perspective on local level elections is influenced by my cultural context, individual values, and socioeconomic background. In Egypt, there is a strong sense of community and traditional values, and as a member of the working class, my focus is on providing for my family and ensuring their well-being. I also value the opinions and beliefs of my community and understand the importance of participating in local level elections to contribute to the betterment of our community. Additionally, my higher education level has instilled in me the understanding of the significance of civic engagement and the impact of local governance on our daily lives. Therefore, my personal experience and values lead me to prioritize voting in local level elections as a means of participating in shaping the future of my community.\n\n2"]}, {"persona": {"region": "Menofia", "sex": "male", "age": 34, "country": "Egypt", "marital_status": "married", "education": "middle", "social_class": "lower middle class"}, "question": {"id": "Q221", "variant": 0}, "response": ["Based on the anthropological framework, my emic perspective as a married male from Menofia, Egypt, with a middle education level and lower middle-class background leads me to consider the cultural context of my community, where voting in local level elections may not be a common practice. Additionally, my individual values and personal experience, as well as my socioeconomic background, play a significant role in shaping my perception of the importance of voting. Furthermore, cultural relativism is important, as there may be varying views on the significance of participating in local elections within my community. Lastly, the nuance of the question is crucial, as the frequency of voting may be influenced by a range of factors. \n\n2"]}, {"persona": {"region": "Menofia", "sex": "male", "age": 22, "country": "Egypt", "marital_status": "single", "education": "higher", "social_class": "working class"}, "question": {"id": "Q221", "variant": 0}, "response": ["Based on the anthropological framework, my emic perspective as a single male from Menofia, Egypt, who is 22 years old and part of the working class, is influenced by my cultural context, individual values, and socioeconomic background. In Egypt, there is a strong emphasis on the importance of community and civic engagement, and voting in local level elections is seen as a way to participate in shaping the community. However, my working class background also means that I may face barriers such as lack of access to information about candidates or difficulty in taking time off work to vote. Additionally, my personal experience and values may lead me to prioritize other forms of civic engagement over voting. Therefore, my answer is:\n\n2\n\n(2) Usually"]}, {"persona": {"region": "Menofia", "sex": "male", "age": 21, "country": "Egypt", "marital_status": "single", "education": "middle", "social_class": "working class"}, "question": {"id": "Q221", "variant": 0}, "response": ["Based on the anthropological framework, as a single male from Menofia, Egypt, my emic perspective is shaped by my cultural context, individual values, and socioeconomic background. In my community, voting in local level elections is not a common practice due to the limited access to education and political participation. As a working-class individual, my focus is on providing for my family and meeting basic needs, rather than engaging in the political process. Additionally, the cultural relativism in Egypt means that there is a general lack of trust in the political system, which further discourages participation. Therefore, my personal experience and cultural context lead me to rarely, if ever, vote in local level elections.\n\n3"]}, {"persona": {"region": "Menofia", "sex": "male", "age": 36, "country": "Egypt", "marital_status": "married", "education": "higher", "social_class": "working class"}, "question": {"id": "Q221", "variant": 0}, "response": ["Based on the anthropological framework, as a married male from Menofia, Egypt, my cultural context and socioeconomic background play a significant role in my decision-making. In Egypt, local level elections are often seen as less impactful than national elections due to the centralized nature of the government. Additionally, as a working-class individual, my focus is on providing for my family and addressing immediate needs, rather than engaging in local politics. This, combined with the limited influence of local elections, leads me to rarely participate in them. Therefore, my choice is:\n3"]}, {"persona": {"region": "Menofia", "sex": "female", "age": 52, "country": "Egypt", "marital_status": "married", "education": "higher", "social_class": "lower middle class"}, "question": {"id": "Q221", "variant": 0}, "response": ["Based on my emic perspective as a married female from Menofia, Egypt, my cultural context and socioeconomic background play a significant role in how frequently I vote in local level elections. In Egypt, there is a strong emphasis on community and family ties, and as a member of the lower middle class, I am more likely to prioritize my family and community's needs over individual political participation. Additionally, as a 52-year-old woman with higher education, I may have experienced limited opportunities to engage in political activities due to traditional gender roles and societal expectations. Therefore, based on my cultural context, socioeconomic background, and personal experience, I would most likely choose option (2) Usually, as I may have some opportunities to vote in local level elections, but it may not be a frequent occurrence due to various factors beyond my control.\n\n2"]}, {"persona": {"region": "Menofia", "sex": "male", "age": 52, "country": "Egypt", "marital_status": "married", "education": "higher", "social_class": "lower middle class"}, "question": {"id": "Q221", "variant": 0}, "response": ["Based on the anthropological framework, as a married male from Menofia, Egypt, my emic perspective would be influenced by my cultural context, individual values, and socioeconomic background. In Egypt, voting is seen as a duty and a way to participate in the decision-making process, especially at the local level. My personal experience and values as a member of the lower middle class, along with my higher education level, would likely lead me to believe in the importance of civic engagement and voting. Additionally, my age and place of residence in Menofia would also contribute to my understanding of the significance of local level elections. Therefore, my answer would be:\n\n2) Usually"]}, {"persona": {"region": "Menofia", "sex": "male", "age": 39, "country": "Egypt", "marital_status": "married", "education": "middle", "social_class": "lower class"}, "question": {"id": "Q221", "variant": 0}, "response": ["Based on the anthropological framework, my emic perspective as a lower-class married male from Menofia, Egypt, with a middle education level, is heavily influenced by my cultural context, individual values, and socioeconomic background. In Egypt, voting is seen as a civic duty and a way to participate in the democratic process, but as a lower-class individual, I may feel disenfranchised and believe that my vote won't make a difference due to the power dynamics in my society. Additionally, my personal experience and socioeconomic background may lead me to believe that the political system is not designed to benefit people like me. Therefore, I am more likely to choose option (3) Never as my answer.\n\n3"]}, {"persona": {"region": "Menofia", "sex": "male", "age": 23, "country": "Egypt", "marital_status": "single", "education": "middle", "social_class": "lower middle class"}, "question": {"id": "Q221", "variant": 0}, "response": ["Based on the anthropological framework, as a single male from Menofia, Egypt, my emic perspective on voting in local level elections is influenced by my cultural context, individual values, and socioeconomic background. In my community, there is a strong emphasis on family and community ties, and voting is seen as a way to contribute to the betterment of our society. However, as someone from the lower middle class with limited access to education and resources, I may face barriers such as lack of political awareness and limited opportunities to engage in the political process. Additionally, the nuance of the question may also impact my response, as the specific circumstances of each election and the candidates involved may influence my decision. Therefore, my answer is:\n\n2\n\n(2) Usually"]}, {"persona": {"region": "Dakahlia", "sex": "female", "age": 24, "country": "Egypt", "marital_status": "single", "education": "higher", "social_class": "lower middle class"}, "question": {"id": "Q221", "variant": 0}, "response": ["Based on my emic perspective as a single female from Dakahlia, Egypt, my cultural context and socioeconomic background play a significant role in my decision-making process. In Egypt, there are cultural and societal expectations and limitations placed on women, especially those from lower middle class backgrounds. My individual values and personal experiences also influence my decision, as I have seen the challenges faced by women in my community. Additionally, my age and education level have provided me with a nuanced understanding of the political landscape. Considering these factors, I choose option (2) Usually."]}, {"persona": {"region": "Dakahlia", "sex": "male", "age": 36, "country": "Egypt", "marital_status": "married", "education": "higher", "social_class": "upper middle class"}, "question": {"id": "Q221", "variant": 0}, "response": ["Based on the anthropological framework, my emic perspective as a married male from Dakahlia, Egypt, who is 36 years old, highly educated, and part of the upper middle class, would be influenced by my individual values, personal experience, and socioeconomic background. In Egypt, local level elections may not hold as much significance or impact as national elections, and my socioeconomic status may also play a role in my level of engagement in local politics. Additionally, the cultural context and cultural relativism would also shape my understanding of the importance of participating in local level elections. Therefore, my answer would be influenced by a combination of these factors, leading me to choose the following option:\n\n2"]}, {"persona": {"region": "Dakahlia", "sex": "female", "age": 71, "country": "Egypt", "marital_status": "married", "education": "higher", "social_class": "upper middle class"}, "question": {"id": "Q221", "variant": 0}, "response": ["From an anthropological perspective, my emic perspective as a married female from Dakahlia, Egypt, who is 71 years old and part of the upper middle class, is shaped by my cultural context, individual values, and socioeconomic background. In my cultural context, voting in local level elections is seen as a civic duty and a way to participate in the democratic process. My higher education level has also instilled in me the importance of being an informed and active citizen. Additionally, my socioeconomic background as part of the upper middle class means that I have the resources and access to information necessary to make informed voting decisions. Therefore, based on my personal experience and values, I would choose option (1) Always, as I believe in the importance of participating in local level elections to contribute to the betterment of my community and society as a whole.\n\n1"]}, {"persona": {"region": "Dakahlia", "sex": "male", "age": 55, "country": "Egypt", "marital_status": "married", "education": "higher", "social_class": "upper middle class"}, "question": {"id": "Q221", "variant": 0}, "response": ["Based on my emic perspective as a married male from Dakahlia, Egypt, who is 55 years old and part of the upper middle class, my cultural context and individual values play a significant role in my decision-making process when it comes to voting in local level elections. In Egypt, there is a strong emphasis on community and family ties, and as someone who values socioeconomic status and education, I am likely to be more involved in local level politics. Additionally, my personal experience and nuanced understanding of the political system in Egypt may lead me to take voting in local level elections very seriously. Therefore, I believe the most accurate representation of my perspective would be option (1) Always.\n\n1"]}, {"persona": {"region": "Dakahlia", "sex": "male", "age": 64, "country": "Egypt", "marital_status": "married", "education": "higher", "social_class": "lower middle class"}, "question": {"id": "Q221", "variant": 0}, "response": ["Based on the anthropological framework, as a married male from Dakahlia, Egypt, my emic perspective would be influenced by the cultural context of my community and the socioeconomic background of being part of the lower middle class. My personal experience and individual values also play a role, as does my age and education level. In Egypt, there may be cultural and social expectations around political participation, and my socioeconomic status may impact my access to information and resources related to voting. Additionally, my understanding of cultural relativism would influence my perspective on the value and impact of local level elections. Taking all of this into consideration, my answer would be (2) Usually. \n\n2"]}, {"persona": {"region": "Dakahlia", "sex": "female", "age": 29, "country": "Egypt", "marital_status": "married", "education": "middle", "social_class": "lower class"}, "question": {"id": "Q221", "variant": 0}, "response": ["From the emic perspective, as a lower-class married woman from Dakahlia, Egypt, my cultural context and socioeconomic background play a significant role in my answer. In this region, women may have limited access to education and political participation, and my personal experience and values may also influence my decision. Additionally, the nuance of the question and the space and time in which I live will impact my response. Taking all of this into consideration, my answer is (3) Never."]}, {"persona": {"region": "Dakahlia", "sex": "female", "age": 40, "country": "Egypt", "marital_status": "married", "education": "middle", "social_class": "upper middle class"}, "question": {"id": "Q221", "variant": 0}, "response": ["Based on the anthropological framework, as a married female from Dakahlia, Egypt, who is 40 years old and part of the upper middle class, my answer to the question of how frequently I vote in local level elections would be influenced by a combination of emic and etic perspectives, cultural context, individual values, socioeconomic background, and space and time. In Egypt, there is a strong cultural context surrounding voting, and socioeconomic background plays a role in the accessibility of voting. As a married woman from an upper middle class background, my personal values and experiences may also influence my decision. Additionally, age and place are important factors, as the cultural and social norms surrounding voting may have evolved over time. Therefore, my answer reflects a nuanced understanding of the question and is chosen from the perspective of the persona described above.\n\n2"]}, {"persona": {"region": "Dakahlia", "sex": "male", "age": 37, "country": "Egypt", "marital_status": "married", "education": "higher", "social_class": "lower middle class"}, "question": {"id": "Q221", "variant": 0}, "response": ["According to the anthropological framework, my emic perspective as a married male from Dakahlia, Egypt, influences my decision-making process. I grew up in a lower middle class family, which has shaped my values and personal experiences. In my cultural context, voting in local level elections is not a common practice due to a combination of socioeconomic factors and political dynamics. Additionally, the cultural relativism in Egypt means that there is a nuanced understanding of political participation, which is why I choose to vote usually in local level elections. \n\n2"]}, {"persona": {"region": "Dakahlia", "sex": "female", "age": 45, "country": "Egypt", "marital_status": "married", "education": "middle", "social_class": "working class"}, "question": {"id": "Q221", "variant": 0}, "response": ["Based on the anthropological framework, my answer to the question of how frequently I vote in local level elections would be influenced by my cultural context, individual values, and socioeconomic background. As a married female from Dakahlia, Egypt, I am likely to have a strong sense of community and may value the opportunity to participate in local level elections. However, my middle education level and working class status may limit my access to information and resources that would enable me to vote frequently. Additionally, cultural norms and gender roles in Egypt may also play a role in my participation in elections. Therefore, my answer would be: \n\n2"]}, {"persona": {"region": "Dakahlia", "sex": "male", "age": 34, "country": "Egypt", "marital_status": "single", "education": "middle", "social_class": "lower middle class"}, "question": {"id": "Q221", "variant": 0}, "response": ["Based on my emic perspective as a 34-year-old single male from Dakahlia, Egypt, I am aware of the cultural context in which I live. In this context, there are certain expectations and norms regarding voting in local level elections. My individual values and personal experience, shaped by my socioeconomic background as a lower middle class individual, also influence my decision. Additionally, I understand the importance of cultural relativism and how space and time play a role in shaping my perspective. Considering these factors, I choose option (2) Usually. \n\n2"]}, {"persona": {"region": "Dakahlia", "sex": "female", "age": 26, "country": "Egypt", "marital_status": "married", "education": "higher", "social_class": "upper middle class"}, "question": {"id": "Q221", "variant": 0}, "response": ["Based on the anthropological framework, as a married female from Dakahlia, Egypt, cultural context and socioeconomic background play a significant role in my decision to vote in local level elections. In Egypt, there is a strong cultural emphasis on community and family values, and as a member of the upper middle class, I am likely to have access to education and resources that allow me to engage in civic participation. Additionally, my age and personal experience may also influence my decision, as younger, educated individuals may be more likely to participate in the political process. Considering these factors, I would choose option (2) Usually, as I am likely to have the resources and cultural values that encourage regular participation in local elections. \n\n2"]}, {"persona": {"region": "Dakahlia", "sex": "male", "age": 21, "country": "Egypt", "marital_status": "single", "education": "middle", "social_class": "upper middle class"}, "question": {"id": "Q221", "variant": 0}, "response": ["Based on the anthropological framework, my emic perspective as a single male from Dakahlia, Egypt, is influenced by my cultural context, individual values, and socioeconomic background. In Egypt, local level elections may not hold as much significance as national elections, and my middle education level may have limited my exposure to political engagement. Additionally, being part of the upper middle class, I may have a higher level of education and access to resources, which could potentially afford me the opportunity to vote more frequently. However, considering the cultural relativism and nuanced understanding of my socioeconomic background, I would likely choose the option (2) Usually, as it reflects a level of engagement that aligns with my personal experience and values. \n\n2"]}, {"persona": {"region": "Dakahlia", "sex": "female", "age": 32, "country": "Egypt", "marital_status": "married", "education": "middle", "social_class": "working class"}, "question": {"id": "Q221", "variant": 0}, "response": ["Based on the anthropological framework, my emic perspective as a married female from Dakahlia, Egypt, is influenced by my cultural context, individual values, and socioeconomic background. In my community, there is a strong emphasis on family and community ties, and voting in local level elections is seen as a civic duty. However, as a working-class woman with limited education, I may also face barriers such as lack of access to information and resources that could impact my ability to vote. Additionally, cultural relativism plays a role in my decision-making, as the societal norms and expectations in my community may differ from those in other parts of the world. Therefore, my response to the question is influenced by a combination of cultural, social, and economic factors.\n\n2"]}, {"persona": {"region": "Dakahlia", "sex": "female", "age": 35, "country": "Egypt", "marital_status": "married", "education": "middle", "social_class": "upper middle class"}, "question": {"id": "Q221", "variant": 0}, "response": ["Based on the anthropological framework, my perspective as a married female from Dakahlia, Egypt, at 35 years of age and part of the upper middle class, is influenced by my cultural context, individual values, and socioeconomic background. In Egypt, there is a strong emphasis on community and participation in local level elections is seen as a civic duty. My middle education level has provided me with an understanding of the importance of voting in shaping the local community. Additionally, my socioeconomic background as part of the upper middle class means that I have the resources and time to be informed about local candidates and issues. Therefore, I choose option (1) Always, as I believe in the importance of actively participating in the democratic process at the local level.\n\n1"]}, {"persona": {"region": "Dakahlia", "sex": "male", "age": 33, "country": "Egypt", "marital_status": "married", "education": "middle", "social_class": "upper middle class"}, "question": {"id": "Q221", "variant": 0}, "response": ["Based on the anthropological framework, my emic perspective as a married male from Dakahlia, Egypt, who considers myself part of the upper middle class, is influenced by my cultural context, individual values and personal experience, socioeconomic background, and space and time. In Egypt, local level elections may not hold as much significance as national elections, and my socioeconomic background may influence my level of civic engagement. Additionally, my age and place in society may also play a role in shaping my attitudes towards voting. Considering these factors, I would choose the following option:\n\n2"]}, {"persona": {"region": "Dakahlia", "sex": "female", "age": 45, "country": "Egypt", "marital_status": "married", "education": "middle", "social_class": "upper middle class"}, "question": {"id": "Q221", "variant": 0}, "response": ["In considering the anthropological framework, my emic perspective as a married female from Dakahlia, Egypt, leads me to prioritize the cultural context and individual values and personal experience in my response. In Egypt, voting in local level elections is seen as a civic duty and a way to contribute to the community. As a member of the upper middle class, I have been raised to value participation in local politics and have had the means to access education and information about the importance of voting. Additionally, my age and socioeconomic background have instilled a sense of responsibility and privilege in being able to exercise my right to vote. Therefore, I would choose the option \"Always\" because it aligns with my personal values and experiences within the cultural context of Egypt.\n\n1"]}, {"persona": {"region": "Dakahlia", "sex": "male", "age": 30, "country": "Egypt", "marital_status": "married", "education": "middle", "social_class": "upper middle class"}, "question": {"id": "Q221", "variant": 0}, "response": ["Based on the anthropological framework, my answer to the question of how frequently I vote in local level elections is influenced by my emic perspective as a married male from Dakahlia, Egypt, where there may be certain in-group expectations and norms regarding voting. Additionally, my etic perspective, shaped by my socioeconomic background as part of the upper middle class, may also play a role in my decision. Considering the cultural context, individual values, and personal experience, as well as the nuanced phrasing of the question, I would choose the option that aligns with the expectations and norms of my social group and reflects my personal values.\n\n2"]}, {"persona": {"region": "Dakahlia", "sex": "female", "age": 63, "country": "Egypt", "marital_status": "married", "education": "higher", "social_class": "lower middle class"}, "question": {"id": "Q221", "variant": 0}, "response": ["Based on my personal experience and values as a married female from Dakahlia, Egypt, I have a strong sense of civic duty and believe in the importance of participating in local level elections. My socioeconomic background as part of the lower middle class has also influenced my understanding of the impact that local level decisions can have on our community. Additionally, my higher education level has provided me with the knowledge and understanding of the political process, further emphasizing the significance of voting in local elections. Furthermore, the cultural context of Dakahlia and the emphasis on community and collective decision-making has instilled in me the value of participating in the electoral process. Therefore, I choose option (1) Always, as I make it a priority to exercise my right to vote in local level elections.\n\n1"]}, {"persona": {"region": "Dakahlia", "sex": "male", "age": 28, "country": "Egypt", "marital_status": "single", "education": "higher", "social_class": "upper middle class"}, "question": {"id": "Q221", "variant": 0}, "response": ["Based on the anthropological framework, my emic perspective as a single male from Dakahlia, Egypt, who has completed higher education and considers myself part of the upper middle class, is heavily influenced by my cultural context, individual values, and socioeconomic background. In Egypt, voting is seen as a civic duty and a way to contribute to the community, and my educational background has instilled in me the importance of participation in local level elections. Additionally, my socioeconomic status gives me the privilege and opportunity to engage in the political process. Therefore, I prioritize voting in local level elections as a way to exercise my agency and contribute to the development of my community.\n2"]}, {"persona": {"region": "Dakahlia", "sex": "female", "age": 24, "country": "Egypt", "marital_status": "married", "education": "higher", "social_class": "upper middle class"}, "question": {"id": "Q221", "variant": 0}, "response": ["Based on the anthropological framework, my emic perspective as a married female from Dakahlia, Egypt, who is 24 years old and part of the upper middle class, is influenced by my cultural context, individual values, and socioeconomic background. In Egypt, voting is seen as a civic duty and a way to participate in the political process, and my higher education level has also instilled a sense of responsibility towards democracy. Additionally, my socioeconomic background as part of the upper middle class means that I have access to information and resources that allow me to engage in the political process. Therefore, I would choose option (1) Always, as I prioritize participating in local level elections to contribute to the decision-making processes in my community. \n\n1"]}, {"persona": {"region": "Dakahlia", "sex": "male", "age": 20, "country": "Egypt", "marital_status": "single", "education": "middle", "social_class": "upper middle class"}, "question": {"id": "Q221", "variant": 0}, "response": ["Based on the anthropological framework, my emic perspective as a single male from Dakahlia, Egypt would be influenced by my cultural context, individual values and personal experience, socioeconomic background, and space and time. In Egypt, local level elections may not carry as much weight as national elections and may not be seen as a priority for someone of my socioeconomic background and age. Additionally, as a member of the upper middle class, I may not feel as directly impacted by local level elections and may not prioritize voting in them. Therefore, my answer would be influenced by these factors and I would likely choose option (3) Never.\n\n3"]}, {"persona": {"region": "Dakahlia", "sex": "male", "age": 45, "country": "Egypt", "marital_status": "married", "education": "middle", "social_class": "upper middle class"}, "question": {"id": "Q221", "variant": 0}, "response": ["Based on the anthropological framework, as a married male from Dakahlia, Egypt, my emic perspective on voting in local level elections is heavily influenced by my cultural context, individual values, and socioeconomic background. In Egypt, there is a strong emphasis on community and societal connections, and voting is seen as an important civic duty. Additionally, my upper middle class status likely affords me more opportunities for political participation and engagement. However, my personal experience and the nuance of the question may also play a role in my decision. Taking all of these factors into consideration, I would choose option (1) Always, as voting is highly valued in my cultural context and aligns with my personal values and socioeconomic background. \n\n1"]}, {"persona": {"region": "Dakahlia", "sex": "female", "age": 43, "country": "Egypt", "marital_status": "married", "education": "higher", "social_class": "upper middle class"}, "question": {"id": "Q221", "variant": 0}, "response": ["Based on the anthropological framework, my cultural context as a married female from Dakahlia, Egypt, my age, education level, and socioeconomic background as part of the upper middle class all play a significant role in my decision-making process. My personal values and experiences also influence my perception of the importance of local level elections. Additionally, cultural relativism reminds me that my perspective is unique and must be understood within the context of my culture and background. Therefore, I choose the option:\n(2) Usually"]}, {"persona": {"region": "Dakahlia", "sex": "female", "age": 20, "country": "Egypt", "marital_status": "single", "education": "middle", "social_class": "upper middle class"}, "question": {"id": "Q221", "variant": 0}, "response": ["Based on the anthropological framework, my emic perspective as a single female from Dakahlia, Egypt, would be influenced by my cultural context, individual values, and socioeconomic background. In our society, there is a strong emphasis on community involvement and participation in local level elections. As a member of the upper middle class, I have been raised to believe in the importance of civic duty and the impact of local governance on our daily lives. Additionally, my personal experience and values have shaped my understanding of the significance of voting. Therefore, my choice is to vote \"Always\" in local level elections.\n\n1"]}, {"persona": {"region": "Dakahlia", "sex": "female", "age": 40, "country": "Egypt", "marital_status": "single", "education": "middle", "social_class": "lower middle class"}, "question": {"id": "Q221", "variant": 0}, "response": ["From an emic perspective, as a single female from Dakahlia, Egypt, my cultural context and socioeconomic background play a significant role in my decision-making. In Egyptian society, there are certain cultural expectations and norms for women, especially those from lower middle class backgrounds. My individual values and personal experiences also factor into my decision, as well as the nuance of the question itself. Based on these factors, my decision is influenced by the fact that women in Egypt have historically faced barriers to political participation, and as a lower middle class woman, my access to resources and information about local level elections may be limited. Therefore, my answer is chosen based on my understanding of my own cultural context and personal experiences.\n\n3"]}, {"persona": {"region": "Dakahlia", "sex": "female", "age": 33, "country": "Egypt", "marital_status": "married", "education": "higher", "social_class": "upper middle class"}, "question": {"id": "Q221", "variant": 0}, "response": ["Based on the anthropological framework, my answer as a married female from Dakahlia, Egypt, who is 33 years old, has completed higher education, and considers herself part of the upper middle class, is influenced by several factors. Firstly, my cultural context and socioeconomic background play a significant role in my answer. In Dakahlia, Egypt, local level elections may not hold as much significance as national elections, and being part of the upper middle class may lead to a sense of detachment from local political processes. Additionally, my individual values and personal experience may lead me to prioritize other aspects of life over local elections. Furthermore, the cultural relativism aspect of the framework suggests that my understanding of the importance of voting in local level elections may differ from others, and my nuanced response is a product of these factors.\n\n2"]}, {"persona": {"region": "Dakahlia", "sex": "female", "age": 24, "country": "Egypt", "marital_status": "married", "education": "middle", "social_class": "working class"}, "question": {"id": "Q221", "variant": 0}, "response": ["Based on the anthropological framework, I, as a married female from Dakahlia, Egypt, would consider the cultural context, individual values, and socioeconomic background in my decision-making process. In Egypt, there is a strong emphasis on community and family values, and voting in local level elections would be seen as a way to contribute to the community and have a voice in decision-making. However, as a working-class woman with limited education, I may not have the same access to information about the political process or the ability to take time off work to vote, leading me to choose the option that best reflects my situation.\n\n2"]}, {"persona": {"region": "Dakahlia", "sex": "female", "age": 53, "country": "Egypt", "marital_status": "widowed", "education": "middle", "social_class": "working class"}, "question": {"id": "Q221", "variant": 0}, "response": ["Based on my emic perspective as a widowed female from Dakahlia, Egypt, my cultural context and individual values play a significant role in my understanding and approach to local level elections. As a member of the working class, my socioeconomic background and access to education also influence my views on civic engagement. Additionally, my age and personal experience have shaped my perception of the political system. Considering cultural relativism, I believe that my perspective on voting may differ from others due to my unique position within society. Therefore, it is important to understand that my decision is influenced by a combination of these factors. \n\n2"]}, {"persona": {"region": "Dakahlia", "sex": "female", "age": 30, "country": "Egypt", "marital_status": "single", "education": "middle", "social_class": "lower middle class"}, "question": {"id": "Q221", "variant": 0}, "response": ["Based on the anthropological framework, my emic perspective as a single female from Dakahlia, Egypt, is influenced by my cultural context, individual values, and socioeconomic background. In my community, there are certain expectations and limitations for women, especially those from lower middle class backgrounds. My personal experience and values also play a significant role in shaping my perspective on local level elections. In addition, my socioeconomic background may impact my access to information and resources related to voting. Therefore, it is likely that I may not have the opportunity or feel empowered to vote regularly in local level elections.\n\n3"]}, {"persona": {"region": "Dakahlia", "sex": "male", "age": 53, "country": "Egypt", "marital_status": "married", "education": "higher", "social_class": "upper middle class"}, "question": {"id": "Q221", "variant": 0}, "response": ["Based on the anthropological framework, my cultural context as a married male from Dakahlia, Egypt, my age of 53, completed higher education level, and upper middle class status all play a significant role in my perspective on voting in local level elections. My cultural context and individual values prioritize civic engagement and participation in the political process. Additionally, my socioeconomic background provides me with the resources and opportunities to stay informed and engaged in local politics. Furthermore, my nuanced understanding of the question leads me to choose \"Usually\" as my answer, as I believe in the importance of participating in local level elections whenever possible.\n\n2"]}, {"persona": {"region": "Dakahlia", "sex": "male", "age": 28, "country": "Egypt", "marital_status": "married", "education": "middle", "social_class": "working class"}, "question": {"id": "Q221", "variant": 0}, "response": ["Based on the emic and etic perspectives, as a married male from Dakahlia, Egypt, my in-group ways of thinking and answering questions may be different from those of an out-group. The cultural context of Egypt and the socioeconomic background of being part of the working class have significant impact on my decision-making. Additionally, my individual values and personal experience, as well as the space and time in which I live, will influence my response. Considering the cultural relativism, there is also the nuance of how voting is perceived in the local context. Therefore, my answer to the question of how frequently I vote in local level elections is:\n\n2\n\nUsually"]}, {"persona": {"region": "Dakahlia", "sex": "female", "age": 38, "country": "Egypt", "marital_status": "married", "education": "middle", "social_class": "upper middle class"}, "question": {"id": "Q221", "variant": 0}, "response": ["Based on the anthropological framework, as a married female from Dakahlia, Egypt, my emic perspective on voting in local level elections is influenced by my cultural context, individual values, and socioeconomic background. In Egypt, the cultural context and societal norms heavily influence women's participation in political activities. As a member of the upper middle class, I have access to education and resources that may enable me to have a greater understanding of the importance of participating in local level elections. However, my personal experience and values may also play a role in my decision. Additionally, my age and place in society may affect my views on voting. Taking all of these factors into consideration, I would choose the option that best aligns with my perspective.\n\n3"]}, {"persona": {"region": "Gharbia", "sex": "male", "age": 27, "country": "Egypt", "marital_status": "single", "education": "higher", "social_class": "upper middle class"}, "question": {"id": "Q221", "variant": 0}, "response": ["Based on the anthropological framework described above, my answer is influenced by several factors. As a single male from Gharbia, Egypt, my cultural context and socioeconomic background play a significant role in my response. In Egypt, there is a strong emphasis on the importance of participating in local level elections, and as a member of the upper middle class, I am more likely to have access to education and resources that would encourage me to engage in the political process. Additionally, my individual values and personal experience have shaped my belief in the importance of civic duty and being an active participant in shaping the local community. Furthermore, being 27 years old and having completed higher education also influences my perception of the significance of voting in local level elections as a means of contributing to the development and progress of my community.\n\n1"]}, {"persona": {"region": "Gharbia", "sex": "female", "age": 35, "country": "Egypt", "marital_status": "married", "education": "higher", "social_class": "upper middle class"}, "question": {"id": "Q221", "variant": 0}, "response": ["Based on my background and cultural context as a married female from Gharbia, Egypt, I have a strong sense of civic duty and responsibility. My higher education level and upper middle class status have provided me with the resources and knowledge to understand the importance of participating in local level elections. Furthermore, my age and place in society have given me the opportunity to engage in political discussions and understand the impact of local governance on my community. Therefore, I would choose option (1) Always, as I am committed to exercising my right to vote and contributing to the decision-making process in my local area."]}, {"persona": {"region": "Gharbia", "sex": "female", "age": 37, "country": "Egypt", "marital_status": "married", "education": "higher", "social_class": "upper middle class"}, "question": {"id": "Q221", "variant": 0}, "response": ["Based on the anthropological framework, my perspective as a married female from Gharbia, Egypt, is influenced by my cultural context, individual values, and socioeconomic background. In Egypt, there is a strong cultural emphasis on participation in local level elections, and as an educated woman from the upper middle class, I have been taught the importance of civic engagement. Additionally, my personal experience and values lead me to believe that voting is a crucial way to contribute to my community. Therefore, my answer to the question is (1) Always."]}, {"persona": {"region": "Gharbia", "sex": "male", "age": 43, "country": "Egypt", "marital_status": "married", "education": "middle", "social_class": "lower middle class"}, "question": {"id": "Q221", "variant": 0}, "response": ["Based on the anthropological framework, my answer to the question of how frequently I vote in local level elections is influenced by my cultural context, individual values, and socioeconomic background. In Gharbia, Egypt, there is a strong emphasis on community and civic engagement, and voting is seen as a way to participate in the decision-making process. However, my lower middle-class socioeconomic background and limited education level may present barriers to accessing information about local elections and understanding the importance of voting. Additionally, as a married male in my 40s, I may feel a sense of responsibility to provide for my family and prioritize work over political participation. Therefore, I usually vote in local level elections.\n\n2"]}, {"persona": {"region": "Gharbia", "sex": "male", "age": 28, "country": "Egypt", "marital_status": "single", "education": "higher", "social_class": "lower middle class"}, "question": {"id": "Q221", "variant": 0}, "response": ["Based on the anthropological framework, as a single male from Gharbia, Egypt, my emic perspective would be influenced by my cultural context, individual values and personal experiences, and socioeconomic background. In Egypt, there is a strong cultural emphasis on community and civic duty, which may influence my decision to vote in local level elections. Additionally, my lower middle class socioeconomic background may also play a role in my decision, as I may feel more invested in local politics and governance. As a 28-year-old with a higher education level, I may have a nuanced understanding of the political landscape and the importance of local level participation. Considering all of these factors, I would choose option (2) Usually, as I believe in the importance of participating in local level elections, but may not do so every time due to personal circumstances and other responsibilities. \n\n2"]}, {"persona": {"region": "Gharbia", "sex": "male", "age": 39, "country": "Egypt", "marital_status": "married", "education": "middle", "social_class": "lower middle class"}, "question": {"id": "Q221", "variant": 0}, "response": ["Based on the anthropological framework, my emic perspective as a married male from Gharbia, Egypt, involves considering my cultural context, individual values, and socioeconomic background. In my community, voting in local level elections is seen as important for maintaining social order and demonstrating civic responsibility. However, my lower middle class socioeconomic background and limited education level may limit my ability to participate in the voting process. Additionally, the nuanced phrasing of the question is important to consider, as it may be difficult for me to vote due to barriers such as accessibility, time constraints, or lack of political representation. Taking all of this into account, my answer to the question is (2) Usually, as I may strive to vote when possible but face obstacles that prevent me from voting consistently."]}, {"persona": {"region": "Gharbia", "sex": "male", "age": 30, "country": "Egypt", "marital_status": "married", "education": "middle", "social_class": "lower middle class"}, "question": {"id": "Q221", "variant": 0}, "response": ["In considering the question of how frequently I vote in local level elections, it is important to take into account the cultural context of Gharbia, Egypt, where I come from. My emic perspective as a member of the lower middle class in this region, along with my personal values and experience, leads me to prioritize my participation in local level elections. Additionally, my socioeconomic background and level of education also play a role in shaping my views on civic engagement. Furthermore, the nuanced phrasing of the question prompts me to consider the frequency of my participation in these elections, rather than a binary yes or no response. Therefore, based on my understanding of the cultural and socioeconomic factors at play, I would choose option (2) Usually, as this best represents my level of involvement in local level elections. \n\n2"]}, {"persona": {"region": "Gharbia", "sex": "male", "age": 43, "country": "Egypt", "marital_status": "married", "education": "lower", "social_class": "lower middle class"}, "question": {"id": "Q221", "variant": 0}, "response": ["Based on the anthropological framework, as a married male from Gharbia, Egypt, my emic perspective on voting in local level elections is influenced by my cultural context. In Egypt, there is a strong emphasis on family and community, and my individual values and personal experience have shaped my understanding of the importance of participating in local elections. Additionally, my lower middle class socioeconomic background has influenced my perception of the impact of voting on local governance and community development. Furthermore, cultural relativism is important to consider, as the political landscape in Egypt may differ from that of other countries. Lastly, space and time also play a role, as the current sociopolitical climate in Egypt may impact my decision. Therefore, my perspective on voting in local level elections is influenced by a combination of cultural, social, and personal factors.\n2"]}, {"persona": {"region": "Gharbia", "sex": "male", "age": 36, "country": "Egypt", "marital_status": "married", "education": "higher", "social_class": "lower middle class"}, "question": {"id": "Q221", "variant": 0}, "response": ["Based on the anthropological framework, my emic perspective as a married male from Gharbia, Egypt, is influenced by my cultural context, individual values, socioeconomic background, and space and time. In Egypt, local level elections may not hold as much significance as national level elections, and as part of the lower middle class, my access to education and information may also impact my understanding of the importance of local level elections. Additionally, cultural relativism plays a role in my decision, as the political climate and government structure in Egypt may impact my view on the effectiveness of local elections. Therefore, I would choose option (2) Usually, as I may see the value in participating in local level elections, but may not always do so due to various factors in my personal and cultural context. \n\n2"]}, {"persona": {"region": "Gharbia", "sex": "male", "age": 25, "country": "Egypt", "marital_status": "married", "education": "middle", "social_class": "upper middle class"}, "question": {"id": "Q221", "variant": 0}, "response": ["Based on the anthropological framework, my answer to the question of how frequently I vote in local level elections is influenced by my emic perspective as a married male from Gharbia, Egypt, my cultural context as an Egyptian, my individual values and personal experience, and my socioeconomic background as part of the upper middle class. In Egypt, voting is seen as a civic duty and a way to participate in the political process, and my personal experience and values align with this perspective. Additionally, my socioeconomic background may provide me with the resources and education to understand the importance of voting. Therefore, my answer is (1) Always."]}, {"persona": {"region": "Gharbia", "sex": "male", "age": 31, "country": "Egypt", "marital_status": "married", "education": "middle", "social_class": "upper middle class"}, "question": {"id": "Q221", "variant": 0}, "response": ["Based on the anthropological framework, my emic perspective as a married male from Gharbia, Egypt, who considers himself part of the upper middle class, and has completed middle education level, places a strong emphasis on the cultural context and socioeconomic background. In Gharbia, voting in local level elections is seen as a duty and a way to participate in the community. Additionally, my personal experience and individual values also play a role in my decision. Therefore, I have chosen the option:\n(1) Always"]}, {"persona": {"region": "Gharbia", "sex": "male", "age": 33, "country": "Egypt", "marital_status": "married", "education": "higher", "social_class": "lower middle class"}, "question": {"id": "Q221", "variant": 0}, "response": ["Based on the anthropological framework, my emic perspective as a married male from Gharbia, Egypt, at 33 years of age and with a higher education level, informs me that my cultural context and socioeconomic background play a significant role in my decision-making process. In Egypt, local level elections may not hold the same significance as they do in other cultural contexts, and the lower middle class may have limited access to political participation. Additionally, my individual values and personal experience, as well as the nuance of the question, lead me to believe that my choice will be influenced by the limited impact I perceive my vote to have in the local political landscape. Therefore, my decision is based on a combination of factors that result in my choice below.\n\n3"]}, {"persona": {"region": "Gharbia", "sex": "male", "age": 26, "country": "Egypt", "marital_status": "single", "education": "higher", "social_class": "upper middle class"}, "question": {"id": "Q221", "variant": 0}, "response": ["Based on the anthropological framework, as a single male from Gharbia, Egypt, who is 26 years old, completed higher education, and considers myself part of the upper middle class, my perspective on voting in local level elections is influenced by a combination of emic and etic perspectives, cultural context, individual values and personal experience, socioeconomic background, cultural relativism, space and time, and nuance. In Egypt, there is a strong emphasis on civic duty and political participation, and as someone who is educated and part of the upper middle class, there is an expectation to be actively engaged in the democratic process. However, given the current political climate and the limitations on political freedoms, there may be a sense of disillusionment and skepticism towards the effectiveness of local level elections. Additionally, the nuance of the question also plays a role, as the frequency of voting may vary depending on the specific election and the perceived impact of the outcome. Therefore, my answer is:\n2"]}, {"persona": {"region": "Gharbia", "sex": "female", "age": 45, "country": "Egypt", "marital_status": "married", "education": "middle", "social_class": "lower middle class"}, "question": {"id": "Q221", "variant": 0}, "response": ["Based on the anthropological framework, my emic perspective as a married female from Gharbia, Egypt, is influenced by my cultural context, individual values, and socioeconomic background. In Egypt, voting is seen as a civic duty and a way to participate in the community, which aligns with my personal values of contributing to society. Additionally, as a lower middle class individual, I am more likely to be affected by local level policies and therefore have a vested interest in participating in local elections. My age and education level also contribute to my understanding of the importance of voting. Therefore, I would usually vote in local level elections.\n\n2"]}, {"persona": {"region": "Gharbia", "sex": "female", "age": 55, "country": "Egypt", "marital_status": "married", "education": "middle", "social_class": "upper middle class"}, "question": {"id": "Q221", "variant": 0}, "response": ["Based on the emic and etic perspectives, as a married female from Gharbia, Egypt, my in-group perspective would be influenced by the cultural context of my community and the values and experiences of individuals within it. My socioeconomic background as part of the upper-middle class would also play a role in my decision-making process. Additionally, the cultural relativism within my community would shape my understanding of the importance of local level elections. Furthermore, considering my age and the nuanced phrasing of the question, I would like to select the option that best represents my perspective.\n\n2"]}, {"persona": {"region": "Gharbia", "sex": "female", "age": 27, "country": "Egypt", "marital_status": "married", "education": "higher", "social_class": "upper middle class"}, "question": {"id": "Q221", "variant": 0}, "response": ["Based on the anthropological framework, my emic perspective as a married female from Gharbia, Egypt, who is 27 years old, highly educated, and part of the upper middle class, would be influenced by my cultural context, individual values and personal experience, and socioeconomic background. In Gharbia, there is a strong emphasis on education and social status, and as a woman, I value my ability to participate in local level elections as a way to contribute to my community and exercise my rights. Additionally, my higher education level and socioeconomic status afford me the opportunity to be more politically engaged. Therefore, I would typically vote in local level elections as it aligns with my personal values and experiences.\n\n2"]}, {"persona": {"region": "Gharbia", "sex": "female", "age": 42, "country": "Egypt", "marital_status": "married", "education": "higher", "social_class": "upper middle class"}, "question": {"id": "Q221", "variant": 0}, "response": ["Based on the anthropological framework, my emic perspective as a married female from Gharbia, Egypt, who has completed higher education and considers herself part of the upper middle class, is influenced by my cultural context, individual values, and socioeconomic background. In Egypt, local level elections are a way for the community to have a voice and participate in decision-making processes. As someone who values education and is part of the upper middle class, I understand the importance of civic engagement and the impact it can have on local policies and services. Additionally, my cultural context emphasizes the significance of participating in community affairs and taking an active role in shaping the future of my local area. Therefore, I consistently prioritize voting in local level elections as a way to contribute to the betterment of my community.\n\n1"]}, {"persona": {"region": "Gharbia", "sex": "female", "age": 32, "country": "Egypt", "marital_status": "married", "education": "middle", "social_class": "upper middle class"}, "question": {"id": "Q221", "variant": 0}, "response": ["Based on the anthropological framework, my emic perspective as a married female from Gharbia, Egypt, at 32 years of age and part of the upper middle class, is influenced by my cultural context, individual values, socioeconomic background, and space and time. In Gharbia, there is a strong emphasis on community and civic engagement, and voting in local level elections is seen as a way to actively participate in shaping the local community. Additionally, as part of the upper middle class, I am likely to have more access to information and resources that enable me to engage in the voting process. Furthermore, my middle education level has likely instilled in me the importance of active citizenship. Taking into account these factors, my response to the question would be:\n\n2\n\n(2) Usually"]}, {"persona": {"region": "Gharbia", "sex": "male", "age": 27, "country": "Egypt", "marital_status": "married", "education": "higher", "social_class": "upper middle class"}, "question": {"id": "Q221", "variant": 0}, "response": ["Based on the anthropological framework, my emic perspective as a married male from Gharbia, Egypt, who is 27 years old and holds a higher education level, is influenced by my cultural context, individual values, and socioeconomic background. In Egyptian culture, voting is seen as a civic duty, and my education and socioeconomic status place me in a position where I am more likely to be aware of the importance of participating in local level elections. Additionally, my understanding of cultural relativism and the nuanced phrasing of the question leads me to believe that I should choose an option that aligns with the societal expectations of someone in my position. Therefore, I choose option (1) Always.\n\n1"]}, {"persona": {"region": "Gharbia", "sex": "female", "age": 27, "country": "Egypt", "marital_status": "married", "education": "higher", "social_class": "lower middle class"}, "question": {"id": "Q221", "variant": 0}, "response": ["Based on the anthropological framework, my emic perspective as a married female from Gharbia, Egypt, who is 27 years old and part of the lower middle class, is influenced by my cultural context, individual values, and socioeconomic background. In Egypt, there are cultural and social norms that dictate the role of women in political participation, and my personal experience and values as a member of the lower middle class also shape my perspective. Additionally, the socioeconomic background and cultural relativism in Egypt play a significant role in the understanding of political participation. Given these factors, my nuanced answer to the question of how frequently I vote in local level elections would be (2) Usually. \n\n2"]}, {"persona": {"region": "Gharbia", "sex": "female", "age": 37, "country": "Egypt", "marital_status": "married", "education": "middle", "social_class": "upper middle class"}, "question": {"id": "Q221", "variant": 0}, "response": ["Based on the anthropological framework, my perspective as a married female from Gharbia, Egypt, is influenced by my emic and etic perspectives, cultural context, individual values and personal experience, socioeconomic background, cultural relativism, space and time, and nuance. In Gharbia, Egypt, local level elections may be seen as an important part of civic duty and participation in the community. As a member of the upper middle class, I likely have the resources and education to understand the importance of voting in local elections. Additionally, my personal experience and values may lead me to see voting as a way to influence local policies that may directly impact my family and community. Therefore, I would choose the option: (1) Always."]}, {"persona": {"region": "Gharbia", "sex": "male", "age": 28, "country": "Egypt", "marital_status": "married", "education": "higher", "social_class": "working class"}, "question": {"id": "Q221", "variant": 0}, "response": ["Based on the anthropological framework, my answer is influenced by my individual values and personal experience, as well as my socioeconomic background. As a married male from Gharbia, Egypt, with a higher education level and working-class status, I am likely to prioritize the importance of civic engagement and take voting in local level elections seriously. Additionally, the cultural context and cultural relativism play a role in my decision, as Egypt values the participation of its citizens in the democratic process. Considering all these factors, I choose option (2) Usually, as I understand the importance of exercising my right to vote in local level elections. \n\n2"]}, {"persona": {"region": "Gharbia", "sex": "female", "age": 50, "country": "Egypt", "marital_status": "married", "education": "middle", "social_class": "upper middle class"}, "question": {"id": "Q221", "variant": 0}, "response": ["Based on the anthropological framework, my emic perspective as a married female from Gharbia, Egypt, who is 50 years old and part of the upper middle class, is influenced by my cultural context, individual values, and socioeconomic background. In Gharbia, local level elections may hold less significance compared to national elections, and my middle education level may also influence my understanding and importance of voting. Additionally, my socioeconomic background as part of the upper middle class may give me a different understanding of the political system and my role within it. Therefore, my answer to the question would be:\n\n2"]}, {"persona": {"region": "Gharbia", "sex": "male", "age": 39, "country": "Egypt", "marital_status": "single", "education": "higher", "social_class": "working class"}, "question": {"id": "Q221", "variant": 0}, "response": ["Based on the anthropological framework, as a single male from Gharbia, Egypt, my emic perspective is influenced by my cultural context, socioeconomic background, and individual values. In Gharbia, local level elections may not hold as much significance as national elections, and my working class status and personal experiences may lead me to prioritize other aspects of my life over participating in local level elections. Additionally, the cultural relativism and nuance of the question may also influence my response, as there may be social or political factors at play that affect my ability or willingness to vote in local level elections. \n\n2"]}, {"persona": {"region": "Gharbia", "sex": "female", "age": 45, "country": "Egypt", "marital_status": "married", "education": "higher", "social_class": "upper middle class"}, "question": {"id": "Q221", "variant": 0}, "response": ["Based on the anthropological framework, my emic perspective as a married female from Gharbia, Egypt, is influenced by my cultural context, individual values, and socioeconomic background. In Egypt, there is a strong emphasis on community and civic engagement, and as someone who values education and comes from the upper middle class, I have been raised to understand the importance of participating in local level elections to have a say in the governance of my community. Additionally, my age and level of education have exposed me to the significance of exercising my right to vote. Therefore, I believe it is essential to always vote in local level elections to contribute to the welfare of my community and uphold the values of civic responsibility. \n\n1"]}, {"persona": {"region": "Sharkia", "sex": "male", "age": 35, "country": "Egypt", "marital_status": "married", "education": "higher", "social_class": "upper middle class"}, "question": {"id": "Q221", "variant": 0}, "response": ["From an anthropological perspective, my emic perspective as a married male from Sharkia, Egypt, is influenced by my cultural context, individual values, and socioeconomic background. In Egypt, there is a strong emphasis on family and community, and voting in local level elections is seen as a way to participate in and contribute to the welfare of the community. Additionally, higher education and belonging to the upper middle class may also influence my perception of civic duty and the importance of being an active participant in local governance. Socioeconomic background also plays a role as individuals from higher socioeconomic classes may feel a greater responsibility to participate in local elections. Additionally, cultural relativism is important to consider as the perception of voting may vary across different cultures and social contexts. Therefore, based on my perspective, I would choose option (1) Always.\n\n1"]}, {"persona": {"region": "Sharkia", "sex": "female", "age": 55, "country": "Egypt", "marital_status": "married", "education": "middle", "social_class": "lower middle class"}, "question": {"id": "Q221", "variant": 0}, "response": ["Based on the anthropological framework, as a married female from Sharkia, Egypt, my emic perspective on voting in local level elections is influenced by my cultural context, individual values, and socioeconomic background. In Egypt, there is a strong emphasis on family and community, and my lower middle class status means that I may have limited access to education and resources. Additionally, my age and gender may also play a role in how I perceive the value of voting. Considering these factors, my nuanced understanding of local level elections may lead me to answer the question as follows:\n\n2\n\n(2) Usually"]}, {"persona": {"region": "Sharkia", "sex": "female", "age": 27, "country": "Egypt", "marital_status": "married", "education": "middle", "social_class": "lower middle class"}, "question": {"id": "Q221", "variant": 0}, "response": ["Based on the anthropological framework, my cultural context as a married female from Sharkia, Egypt, my individual values and personal experience, and my lower middle class socioeconomic background all play a significant role in my decision-making process. In Egypt, there may be societal and cultural expectations for women to participate in local level elections, but my personal experience and socioeconomic background may limit my ability to do so. Additionally, the cultural context of Egypt may also influence my decision. Therefore, I may not have the same voting frequency as someone from a different cultural or socioeconomic background. \n\n3"]}, {"persona": {"region": "Sharkia", "sex": "female", "age": 52, "country": "Egypt", "marital_status": "married", "education": "middle", "social_class": "lower middle class"}, "question": {"id": "Q221", "variant": 0}, "response": ["Based on the anthropological framework, my emic perspective as a woman from Sharkia, Egypt, is shaped by my cultural context, individual values, and socioeconomic background. In my community, women's participation in local level elections is not common due to traditional gender roles and limited access to education and resources. Additionally, my lower middle class status and limited formal education may also influence my participation in elections. Therefore, I would choose option (3) Never, as it reflects the reality of my cultural and socioeconomic context."]}, {"persona": {"region": "Sharkia", "sex": "male", "age": 36, "country": "Egypt", "marital_status": "married", "education": "middle", "social_class": "lower middle class"}, "question": {"id": "Q221", "variant": 0}, "response": ["Based on the anthropological framework, my emic perspective as a married male from Sharkia, Egypt, would be influenced by my cultural context, individual values, and socioeconomic background. In Egypt, there is a strong emphasis on community and collective decision-making, which influences my perception of the importance of local level elections. Additionally, as a lower middle class individual, my access to education and resources may impact my understanding of the political system and my ability to participate in elections. Considering my background, I would choose option (2) Usually, as I am likely to participate in local level elections when I am able to and when I feel it will make a difference in my community. \n\n2"]}, {"persona": {"region": "Sharkia", "sex": "female", "age": 20, "country": "Egypt", "marital_status": "single", "education": "middle", "social_class": "working class"}, "question": {"id": "Q221", "variant": 0}, "response": ["Based on the anthropological framework, as a single female from Sharkia, Egypt, my emic perspective on voting in local level elections is influenced by my cultural context, individual values, and socioeconomic background. In Egypt, there may be cultural and societal expectations regarding the role of women in politics, and as a working-class individual with limited access to education, my personal experience and understanding of the political system may differ from those in positions of privilege. Additionally, the nuance of the question and the space and time in which it is asked may impact my response. Therefore, my choice to not vote in local level elections is influenced by a combination of these factors.\n\n3"]}, {"persona": {"region": "Sharkia", "sex": "male", "age": 60, "country": "Egypt", "marital_status": "married", "education": "middle", "social_class": "working class"}, "question": {"id": "Q221", "variant": 0}, "response": ["Based on my cultural context and socioeconomic background, as a married male from Sharkia, Egypt, I am part of the working class and have completed middle education level. In this context, voting in local level elections may not be a common practice due to limited access to education and resources. Additionally, the cultural relativism of Egypt may lead to a different understanding of the importance of voting compared to other cultures. Furthermore, my age and personal experiences may also play a role in my decision. Therefore, based on my background and understanding, I would choose option 3: Never."]}, {"persona": {"region": "Sharkia", "sex": "male", "age": 41, "country": "Egypt", "marital_status": "married", "education": "higher", "social_class": "upper middle class"}, "question": {"id": "Q221", "variant": 0}, "response": ["Based on the anthropological framework, my perspective as a married male from Sharkia, Egypt, is influenced by my cultural context, individual values, and socioeconomic background. In Egypt, voting is seen as a civic duty and a way to participate in the democratic process. As a member of the upper middle class, I have access to education and resources that allow me to understand the importance of voting in local level elections. Additionally, my age and place in society contribute to my understanding of the significance of participating in the electoral process. Therefore, I choose option 1: Always.\n\n1"]}, {"persona": {"region": "Sharkia", "sex": "female", "age": 23, "country": "Egypt", "marital_status": "married", "education": "middle", "social_class": "lower middle class"}, "question": {"id": "Q221", "variant": 0}, "response": ["Based on my emic perspective as a married female from Sharkia, Egypt, I understand the importance of participating in local level elections as a way to have a voice in decision-making processes that directly affect our community. The cultural context of Egypt values the participation of citizens in democratic processes, and individual values and personal experiences play a significant role in shaping the importance of voting. Additionally, my lower middle class socioeconomic background may also influence my decision to vote, as I am likely to be impacted by local level policies and decisions. However, the nuance of the question and the specific circumstances of each election may also play a role in determining the frequency of my voting. Therefore, my answer to this question would be...\n\n2"]}, {"persona": {"region": "Sharkia", "sex": "male", "age": 49, "country": "Egypt", "marital_status": "married", "education": "higher", "social_class": "upper middle class"}, "question": {"id": "Q221", "variant": 0}, "response": ["Based on the anthropological framework, as a married male from Sharkia, Egypt, my emic perspective on voting in local level elections is influenced by my cultural context, individual values, and socioeconomic background. In Egypt, there is a strong cultural emphasis on civic duty and participation in politics. Additionally, my higher education level has instilled in me the importance of being an active and informed citizen. As part of the upper middle class, I have the resources and access to information that allow me to engage in the political process. Therefore, I choose to vote in local level elections as a way to contribute to my community and exercise my rights as a citizen.\n\n1"]}, {"persona": {"region": "Sharkia", "sex": "female", "age": 30, "country": "Egypt", "marital_status": "married", "education": "middle", "social_class": "upper middle class"}, "question": {"id": "Q221", "variant": 0}, "response": ["Based on the anthropological framework, as a married female from Sharkia, Egypt, my emic perspective is shaped by my cultural context and socioeconomic background. In Egypt, there is a strong emphasis on family and community, and local level elections are seen as an opportunity to contribute to the betterment of our neighborhoods. As a member of the upper middle class, I have access to education and resources that allow me to participate in the political process. Additionally, my personal experience and values lead me to believe that voting in local level elections is important for the development of our community. Therefore, I would choose option (1) Always, as I am actively engaged in the local political process and make it a priority to vote in elections.\n\n1"]}, {"persona": {"region": "Sharkia", "sex": "male", "age": 39, "country": "Egypt", "marital_status": "married", "education": "higher", "social_class": "upper middle class"}, "question": {"id": "Q221", "variant": 0}, "response": ["Based on the anthropological framework, my answer is influenced by my individual values and personal experience, as well as my socioeconomic background and cultural context. As a married male from Sharkia, Egypt, I am part of the upper middle class and have completed higher education. In my cultural context, voting in local level elections is seen as an important civic duty. Additionally, my socioeconomic background places me in a position where I have the time and resources to be informed about local issues and participate in the electoral process. Therefore, I choose option (1) Always.\n\n1"]}, {"persona": {"region": "Sharkia", "sex": "female", "age": 26, "country": "Egypt", "marital_status": "married", "education": "middle", "social_class": "lower middle class"}, "question": {"id": "Q221", "variant": 0}, "response": ["Based on the anthropological framework, as a married female from Sharkia, Egypt, my emic perspective is influenced by my cultural context, individual values, and socioeconomic background. In my community, there are certain expectations and norms for women, especially those from lower middle class backgrounds. My personal experience and values also play a role in shaping my decision. Additionally, the socioeconomic background of my family and the cultural relativism within my community influence my perspective. As a 26-year-old woman who has completed middle education, I am aware of the importance of local level elections, but due to various factors such as lack of access to education and resources, and societal expectations, I am less likely to vote in these elections.\n\n2"]}, {"persona": {"region": "Sharkia", "sex": "female", "age": 48, "country": "Egypt", "marital_status": "married", "education": "middle", "social_class": "lower middle class"}, "question": {"id": "Q221", "variant": 0}, "response": ["Based on the anthropological framework, as a married female from Sharkia, Egypt, my emic perspective is shaped by my cultural context, individual values, and socioeconomic background. In Sharkia, there is a strong emphasis on community and family, and local level elections are seen as an opportunity to contribute to the well-being of the community. Additionally, my personal experience and values as a lower middle class woman who has completed middle education level have instilled in me the belief that participating in local level elections is a way to have a say in decisions that directly impact my family and community. Therefore, I would choose option (2) Usually, as I believe it is important to exercise my right to vote in local level elections to contribute to the betterment of my community. \n\n2"]}, {"persona": {"region": "Sharkia", "sex": "male", "age": 34, "country": "Egypt", "marital_status": "married", "education": "higher", "social_class": "upper middle class"}, "question": {"id": "Q221", "variant": 0}, "response": ["Based on the anthropological framework, my emic perspective as a married male from Sharkia, Egypt, with a higher education level and belonging to the upper middle class, is influenced by my cultural context, individual values, personal experience, and socioeconomic background. In Egypt, participation in local level elections is seen as a civic duty and a way to contribute to the community. Additionally, my education and socioeconomic status provide me with the resources and opportunities to stay informed about local politics and have a voice in decision-making. Therefore, I believe that my personal experience and values align with the cultural expectation of active participation in local elections. \n\n1"]}, {"persona": {"region": "Sharkia", "sex": "female", "age": 39, "country": "Egypt", "marital_status": "divorced", "education": "middle", "social_class": "lower middle class"}, "question": {"id": "Q221", "variant": 0}, "response": ["Based on the anthropological framework, my emic perspective as a divorced female from Sharkia, Egypt, at 39 years of age and with a middle education level, is influenced by my cultural context, individual values, socioeconomic background, and space and time. In my cultural context, women's participation in politics may be limited, and as a lower middle class individual, I may have limited access to resources and opportunities to engage in local level elections. Additionally, my personal experience and values may shape my perception of the political system and my willingness to participate. Thus, considering all these factors, I would choose option 2: Usually, as I may have some opportunities to vote but may not do so frequently due to various constraints.\n\n2"]}, {"persona": {"region": "Sharkia", "sex": "male", "age": 39, "country": "Egypt", "marital_status": "married", "education": "middle", "social_class": "upper middle class"}, "question": {"id": "Q221", "variant": 0}, "response": ["Based on the anthropological framework, my emic perspective as a married male from Sharkia, Egypt, with a middle education level and upper-middle-class status, is influenced by my cultural context, individual values, and socioeconomic background. In Egypt, local level elections may not hold as much significance as national elections, and there may be limited trust in the effectiveness of local governance. Additionally, my socioeconomic background may afford me certain privileges or access to resources that make my participation in local elections less of a priority. Therefore, my answer is:\n\n2"]}, {"persona": {"region": "Qaliubiya", "sex": "male", "age": 62, "country": "Egypt", "marital_status": "married", "education": "middle", "social_class": "working class"}, "question": {"id": "Q221", "variant": 0}, "response": ["Based on the anthropological framework, I, as a married male from Qaliubiya, Egypt, would consider my emic perspective on local level elections. The cultural context in my community places a high value on participating in the electoral process as a civic duty. My individual values and personal experience also play a role, as I have been brought up to believe in the importance of voting. My socioeconomic background as a working-class individual may also influence my decision, as I may feel that my vote can make a difference in shaping policies that directly impact my life. Additionally, age and place are important factors, and given my age and the cultural context in my community, voting would be a common practice. Therefore, based on my perspective and the factors mentioned above, I would choose option (1) Always.\n\n1"]}, {"persona": {"region": "Qaliubiya", "sex": "male", "age": 33, "country": "Egypt", "marital_status": "married", "education": "middle", "social_class": "working class"}, "question": {"id": "Q221", "variant": 0}, "response": ["Based on the anthropological framework, my emic perspective as a married male from Qaliubiya, Egypt, with a middle education level and part of the working class, influences my decision on voting in local level elections. The cultural context of Egypt, including its political climate and social dynamics, plays a significant role in shaping my understanding of the importance of voting. My individual values and personal experience also factor in, as well as my socioeconomic background. Considering the nuance of the question, I select option 2: Usually, as my answer, as it reflects the typical level of engagement in local level elections in my community. \n\n2"]}, {"persona": {"region": "Qaliubiya", "sex": "male", "age": 62, "country": "Egypt", "marital_status": "married", "education": "higher", "social_class": "lower middle class"}, "question": {"id": "Q221", "variant": 0}, "response": ["Based on the anthropological framework, my emic perspective as a married male from Qaliubiya, Egypt, is influenced by my cultural context, individual values, and socioeconomic background. In my community, there is a strong emphasis on civic participation and the importance of local level elections. As someone who has completed higher education and considers myself part of the lower middle class, I am aware of the impact that local level elections can have on our community. Additionally, my age and place in society also play a role in my perception of the importance of voting in local elections. Therefore, based on these factors, I would choose option (1) Always, as I believe it is crucial to participate in local level elections to have a voice in decision-making processes that directly affect our community. \n\n1"]}, {"persona": {"region": "Qaliubiya", "sex": "male", "age": 29, "country": "Egypt", "marital_status": "married", "education": "middle", "social_class": "working class"}, "question": {"id": "Q221", "variant": 0}, "response": ["Based on the anthropological framework, cultural context, individual values and personal experience, and socioeconomic background are pivotal in understanding and answering this question. As a 29-year-old married male from Qaliubiya, Egypt, with a middle education level and working-class background, my personal experience and socioeconomic background play a significant role in my perspective on voting in local level elections. In Egypt, there is a long history of social and economic disparities, and the political climate may not always represent the interests of the working class. Additionally, there may be cultural and societal factors that influence the perceived impact of voting. Therefore, based on my background and experiences, I would choose option 3: Never.\n\n3"]}, {"persona": {"region": "Qaliubiya", "sex": "female", "age": 42, "country": "Egypt", "marital_status": "married", "education": "higher", "social_class": "working class"}, "question": {"id": "Q221", "variant": 0}, "response": ["In considering the perspective of a married female from Qaliubiya, Egypt, who is 42 years old, has completed higher education, and considers herself part of the working class, it is important to take into account the cultural context of Egypt, including the role of women in society and the value placed on education. Additionally, the socioeconomic background of being part of the working class may influence the level of engagement in local level elections. Personal experiences and individual values also play a significant role in shaping perspectives on political participation. Furthermore, the nuance of the question and the specific phrasing can impact the response. With all of this in mind, the chosen answer is:\n\n2"]}, {"persona": {"region": "Qaliubiya", "sex": "female", "age": 50, "country": "Egypt", "marital_status": "married", "education": "middle", "social_class": "lower middle class"}, "question": {"id": "Q221", "variant": 0}, "response": ["Based on the anthropological framework, my perspective as a married woman from Qaliubiya, Egypt, at the age of 50 and from the lower middle class, is shaped by my cultural context, personal experience, and socioeconomic background. In Egypt, local level elections may not hold as much importance as national level elections, and as a woman with a middle education level and lower middle class status, I may not have had the same exposure or access to information about the significance of local level elections. Additionally, my role as a woman within my community and family may also influence my level of engagement in political processes. Therefore, I would choose option 2) Usually as my response to how frequently I vote in local level elections."]}, {"persona": {"region": "Qaliubiya", "sex": "male", "age": 29, "country": "Egypt", "marital_status": "married", "education": "higher", "social_class": "lower middle class"}, "question": {"id": "Q221", "variant": 0}, "response": ["Based on the anthropological framework, my perspective on voting in local level elections is influenced by my cultural context, individual values, and socioeconomic background. In Qaliubiya, Egypt, there is a strong emphasis on community and kinship networks, and voting is seen as a way to contribute to the well-being of the community. Additionally, my personal values and experiences have shaped my belief in the importance of civic engagement and participation in the political process. As a member of the lower middle class, I am keenly aware of the impact of local level policies on my daily life and the lives of those around me. Therefore, I am inclined to vote in local level elections to ensure that my voice is heard and that the needs of my community are represented. \n\n2"]}, {"persona": {"region": "Qaliubiya", "sex": "male", "age": 35, "country": "Egypt", "marital_status": "married", "education": "higher", "social_class": "working class"}, "question": {"id": "Q221", "variant": 0}, "response": ["From an emic perspective, as a married male from Qaliubiya, Egypt, my cultural context and socioeconomic background play a significant role in my understanding of and participation in local level elections. In Egypt, there is a strong sense of community and kinship networks, and local level elections are often seen as an opportunity to support and advocate for the betterment of our local community. As a member of the working class, I am keenly aware of the impact that local level decisions can have on my daily life and the lives of those around me. Additionally, my higher education level has provided me with the knowledge and understanding of the importance of civic engagement. Therefore, based on my cultural context, socioeconomic background, and personal values, I would choose to vote in local level elections whenever possible to contribute to the betterment of my community.\n\n2"]}, {"persona": {"region": "Qaliubiya", "sex": "female", "age": 40, "country": "Egypt", "marital_status": "married", "education": "middle", "social_class": "working class"}, "question": {"id": "Q221", "variant": 0}, "response": ["Based on the anthropological framework, as a married female from Qaliubiya, Egypt, my emic perspective is shaped by my cultural context, individual values, socioeconomic background, and space and time. In Egypt, there is a strong cultural emphasis on family and community, and local level elections play a role in shaping the immediate environment. However, as a working-class woman with limited education, my access to information and resources for engaging in local level elections is constrained. Additionally, the societal expectations and gender dynamics in Egypt may also influence my decision. Therefore, I would choose the option that aligns with the reality of my life and the limitations I face.\n\n2"]}, {"persona": {"region": "Qaliubiya", "sex": "female", "age": 48, "country": "Egypt", "marital_status": "divorced", "education": "lower", "social_class": "working class"}, "question": {"id": "Q221", "variant": 0}, "response": ["In considering the question of how frequently I vote in local level elections, it is important to take into account the cultural context of Qaliubiya, Egypt, where there may be varying attitudes towards political participation. As a divorced woman from a working class background with lower education, my individual values and personal experiences greatly influence my perception of the electoral process. Additionally, my socioeconomic background and age play a role in my level of political engagement. Given these factors, I would choose option (2) Usually, as I may feel a sense of duty to participate in local elections, but may not always have the means or opportunity to do so consistently."]}, {"persona": {"region": "Qaliubiya", "sex": "male", "age": 46, "country": "Egypt", "marital_status": "married", "education": "middle", "social_class": "working class"}, "question": {"id": "Q221", "variant": 0}, "response": ["Based on the anthropological framework, my emic perspective as a married male from Qaliubiya, Egypt, who is part of the working class and with a middle education level, is heavily influenced by my cultural context, individual values, and socioeconomic background. In Egypt, there is a strong cultural emphasis on community and family, and my working-class background means that I am likely to prioritize my day-to-day survival and providing for my family over political engagement. Additionally, the political climate in Egypt may not always provide the opportunity for fair and meaningful participation in local level elections. Therefore, based on my personal experience and the cultural and socioeconomic factors at play, I would choose option (3) Never. \n\n3"]}, {"persona": {"region": "Qaliubiya", "sex": "male", "age": 47, "country": "Egypt", "marital_status": "married", "education": "higher", "social_class": "lower middle class"}, "question": {"id": "Q221", "variant": 0}, "response": ["In my cultural context in Qaliubiya, Egypt, voting in local level elections is influenced by various factors such as age, education, and socioeconomic background. As a 47-year-old with a higher education level and a part of the lower middle class, I have been brought up to value the importance of participating in the political process. However, the socioeconomic constraints of my class may limit my ability to always vote in local level elections. Additionally, the cultural context of Egypt may also play a role in the frequency of my voting, as political participation can be influenced by societal norms and expectations. Therefore, based on my personal experience and socioeconomic background, I usually vote in local level elections.\n\n2"]}, {"persona": {"region": "Qaliubiya", "sex": "female", "age": 38, "country": "Egypt", "marital_status": "married", "education": "higher", "social_class": "working class"}, "question": {"id": "Q221", "variant": 0}, "response": ["Based on the anthropological framework, my emic perspective as a married female from Qaliubiya, Egypt, is influenced by my cultural context, individual values, and socioeconomic background. In my cultural context, voting is seen as a civic duty and a way to contribute to my community. However, my individual values and personal experience as a working-class woman may lead me to prioritize other responsibilities over voting. Additionally, my socioeconomic background may limit my access to information about local level elections and the candidates. Therefore, based on these factors, I choose the following option:\n\n(2) Usually"]}, {"persona": {"region": "Qaliubiya", "sex": "male", "age": 58, "country": "Egypt", "marital_status": "married", "education": "middle", "social_class": "working class"}, "question": {"id": "Q221", "variant": 0}, "response": ["Based on the anthropological framework, as a married male from Qaliubiya, Egypt, my emic perspective on voting in local level elections is influenced by my cultural context, socioeconomic background, and personal experience. In Egypt, there is a strong sense of community and the importance of participation in local affairs. Additionally, as a working-class individual with a middle education level, I value the opportunity to have a say in the governance of my community. However, due to the political climate and limited access to information, I usually vote in local level elections. This is influenced by my understanding of the nuances of the political system and the impact of my vote within the context of my socioeconomic background. \n\n2"]}, {"persona": {"region": "Qaliubiya", "sex": "female", "age": 27, "country": "Egypt", "marital_status": "married", "education": "higher", "social_class": "working class"}, "question": {"id": "Q221", "variant": 0}, "response": ["Based on the anthropological framework, I, as a married female from Qaliubiya, Egypt, would consider the frequency of my voting in local level elections to be influenced by several factors. The cultural context of my community values participation in political processes, and the socioeconomic background of being part of the working class may limit my ability to take time off work to vote. Additionally, my age and education level may influence my understanding of the importance of civic engagement. Considering all these factors, I would choose the option: (2) Usually. \n\n2"]}, {"persona": {"region": "Qaliubiya", "sex": "female", "age": 48, "country": "Egypt", "marital_status": "married", "education": "middle", "social_class": "upper middle class"}, "question": {"id": "Q221", "variant": 0}, "response": ["Based on the anthropological framework, my answer to the question of how frequently I vote in local level elections is influenced by my cultural context, individual values, and socioeconomic background. As a married female from Qaliubiya, Egypt, my cultural context values community engagement and participation in local governance. Additionally, my individual values prioritize civic duty and responsibility. As part of the upper middle class, I have the means and resources to be actively involved in local level elections. Furthermore, my socioeconomic background and educational level have equipped me with the knowledge and understanding of the importance of participating in the democratic process. Therefore, my answer is (1) Always, as I regularly exercise my right to vote in local level elections.\n\n1"]}, {"persona": {"region": "Giza", "sex": "female", "age": 19, "country": "Egypt", "marital_status": "single", "education": "middle", "social_class": "working class"}, "question": {"id": "Q221", "variant": 0}, "response": ["Based on the anthropological framework, my cultural context as a working-class woman from Giza, Egypt, influences my understanding of local level elections. My individual values and personal experience also play a role in shaping my perspective. Additionally, my socioeconomic background and age contribute to my decision. Furthermore, cultural relativism teaches me to respect the political systems in my country. Therefore, based on my background and understanding, my choice is:\n2"]}, {"persona": {"region": "Giza", "sex": "female", "age": 38, "country": "Egypt", "marital_status": "married", "education": "higher", "social_class": "lower middle class"}, "question": {"id": "Q221", "variant": 0}, "response": ["Based on my emic perspective, as a married female from Giza, Egypt, I understand the importance of local level elections within the cultural context of my community. My individual values and personal experience, as well as my socioeconomic background, have shaped my understanding of the significance of participating in these elections. Additionally, cultural relativism is crucial in my decision-making process, as I recognize the value of democracy and the impact of my vote within the context of Egypt's political landscape. Furthermore, my age and place in society, as a 38-year-old woman from Giza, also play a role in my decision. Therefore, I would choose the option:\n\n(2) Usually"]}, {"persona": {"region": "Beni Swaif/Beni Suef", "sex": "female", "age": 34, "country": "Egypt", "marital_status": "divorced", "education": "higher", "social_class": "lower class"}, "question": {"id": "Q221", "variant": 0}, "response": ["Based on the anthropological framework, as a divorced female from Beni Swaif, Egypt, my emic perspective is influenced by my socioeconomic background, cultural context, and personal experience. As a member of the lower class, my access to resources and opportunities may be limited, and my personal experience as a divorced woman may also impact my level of engagement in local level elections. Additionally, cultural norms and gender roles within my community may play a role in how frequently I am able to vote. Considering these factors, my answer is:\n3"]}, {"persona": {"region": "Beni Swaif/Beni Suef", "sex": "male", "age": 20, "country": "Egypt", "marital_status": "single", "education": "higher", "social_class": "working class"}, "question": {"id": "Q221", "variant": 0}, "response": ["Based on my individual values and personal experience, as a 20-year-old working class male from Beni Swaif, Egypt, I have been raised to believe that voting in local level elections is an important civic duty. My cultural context also plays a significant role in this decision, as I am aware of the socio-political environment in Egypt and the importance of participating in the democratic process. Additionally, considering my age and education level, I understand the significance of being an active participant in local governance. Therefore, I would choose the option:\n\n(1) Always"]}, {"persona": {"region": "Giza", "sex": "male", "age": 19, "country": "Egypt", "marital_status": "single", "education": "middle", "social_class": "upper middle class"}, "question": {"id": "Q221", "variant": 0}, "response": ["Based on the anthropological framework, my perspective as a single male from Giza, Egypt, who has completed middle education level and considers myself part of the upper middle class, leads me to consider the cultural context and individual values and personal experience. In Egypt, local level elections may not hold as much significance as national elections, and the socioeconomic background also plays a role in the decision to vote. Additionally, age and space are important factors, as I am 19 years old and living in Giza. Therefore, based on my personal experience and understanding, I would choose the following option:\n\n2"]}, {"persona": {"region": "Giza", "sex": "female", "age": 33, "country": "Egypt", "marital_status": "married", "education": "middle", "social_class": "working class"}, "question": {"id": "Q221", "variant": 0}, "response": ["Based on the anthropological framework, my emic perspective as a married female from Giza, Egypt, at the age of 33 and part of the working class, is influenced by my cultural context, individual values, and socioeconomic background. In Egypt, there is a strong cultural emphasis on community and participation in local level elections is seen as a duty. My personal experience and values also contribute to my belief in the importance of civic engagement. However, my socioeconomic background as part of the working class may limit my ability to participate in local level elections due to time constraints and accessibility to polling stations. Therefore, my answer would be:\n\n2"]}, {"persona": {"region": "Giza", "sex": "female", "age": 24, "country": "Egypt", "marital_status": "married", "education": "higher", "social_class": "working class"}, "question": {"id": "Q221", "variant": 0}, "response": ["Based on the anthropological framework, my emic perspective as a married female from Giza, Egypt, who is 24 years old and part of the working class, is shaped by cultural context, individual values, and socioeconomic background. In Egypt, there are cultural norms and societal expectations that influence the way individuals participate in local level elections. Additionally, as a working class individual, my access to resources and time may impact my ability to participate in the electoral process. Furthermore, my personal experiences and values may also play a role in shaping my decision. Therefore, my response to the question of how frequently I vote in local level elections is influenced by all these factors.\n\n2"]}, {"persona": {"region": "Giza", "sex": "male", "age": 50, "country": "Egypt", "marital_status": "married", "education": "higher", "social_class": "working class"}, "question": {"id": "Q221", "variant": 0}, "response": ["Based on the anthropological framework, as a married male from Giza, Egypt, my emic perspective is influenced by my cultural context, individual values, socioeconomic background, and space and time. In Egypt, there is a strong cultural emphasis on civic participation and voting is seen as a duty. Additionally, my higher education level has instilled in me a sense of civic responsibility. As a member of the working class, I am also aware of the impact local level elections can have on my community and my own livelihood. Therefore, I would choose option (1) Always, as I believe in actively participating in the democratic process and exercising my right to vote.\n\n1"]}, {"persona": {"region": "Beni Swaif/Beni Suef", "sex": "female", "age": 26, "country": "Egypt", "marital_status": "married", "education": "higher", "social_class": "lower middle class"}, "question": {"id": "Q221", "variant": 0}, "response": ["Based on the anthropological framework, my cultural context as a married female from Beni Swaif, Egypt, my socioeconomic background as part of the lower middle class, and my individual values and personal experience have shaped my perception of local level elections. In this cultural context, there may be certain expectations and norms around political participation. Additionally, my age and education level may also play a role in influencing my perception of the importance of voting in local level elections. Considering these factors, I would choose the following option:\n\n2"]}, {"persona": {"region": "Beni Swaif/Beni Suef", "sex": "male", "age": 40, "country": "Egypt", "marital_status": "single", "education": "lower", "social_class": "lower class"}, "question": {"id": "Q221", "variant": 0}, "response": ["Based on my personal experience and socioeconomic background, as a lower class individual from Beni Swaif, Egypt, my access to education and resources may limit my ability to participate in local level elections. Additionally, the cultural context and nuanced phrasing of the question may also impact my decision. As an individual with limited resources and opportunities, I may feel marginalized and not see the value in participating in the political process. Therefore, my answer to the question would be:\n\n3"]}, {"persona": {"region": "Beni Swaif/Beni Suef", "sex": "female", "age": 25, "country": "Egypt", "marital_status": "married", "education": "middle", "social_class": "lower middle class"}, "question": {"id": "Q221", "variant": 0}, "response": ["Based on the anthropological framework, my emic perspective as a married female from Beni Suef, Egypt, who completed middle education level and considers myself part of the lower middle class, is influenced by my cultural context, individual values, and socioeconomic background. In Egypt, local level elections may not hold as much significance for someone in my position, as there may be limited access to information and resources to participate in such elections. Additionally, the cultural context and socioeconomic background may also play a role in the level of importance placed on local level elections. Therefore, I would choose option 3: Never.\n3"]}, {"persona": {"region": "Beni Swaif/Beni Suef", "sex": "female", "age": 21, "country": "Egypt", "marital_status": "single", "education": "middle", "social_class": "lower middle class"}, "question": {"id": "Q221", "variant": 0}, "response": ["Based on my emic perspective, as a single female from Beni Swaif/Beni Suef, Egypt, my cultural context and socioeconomic background play a significant role in my understanding and approach to local level elections. Being from a lower middle class background and having completed only middle education level, I am very aware of the limitations and challenges that come with my socioeconomic status. My personal experiences and individual values also influence my perception of the political system and the impact of my vote. Additionally, cultural relativism is crucial in understanding my perspective, as my age and place in society also shape my views. Therefore, I would choose option (2) Usually, as I am aware of the importance of participating in local level elections, but I may face barriers such as limited access to information, resources, and societal expectations."]}, {"persona": {"region": "Beni Swaif/Beni Suef", "sex": "male", "age": 48, "country": "Egypt", "marital_status": "married", "education": "middle", "social_class": "lower middle class"}, "question": {"id": "Q221", "variant": 0}, "response": ["Based on the emic and etic perspectives, as a married male from Beni Swaif, Egypt, I am influenced by my in-group ways of thinking and answering questions related to local level elections. My cultural context, including my socioeconomic background and level of education, also plays a significant role in my decision-making process. Additionally, my individual values and personal experiences shape my perception of the importance of voting in local elections. Considering the cultural relativism and the nuanced phrasing of the question, I believe I would typically vote in local level elections, as it is a civic duty and a way to contribute to the betterment of my community.\n\n2"]}, {"persona": {"region": "Beni Swaif/Beni Suef", "sex": "female", "age": 57, "country": "Egypt", "marital_status": "married", "education": "middle", "social_class": "working class"}, "question": {"id": "Q221", "variant": 0}, "response": ["Based on the anthropological framework, my answer to the question of how frequently I vote in local level elections is influenced by my cultural context, individual values, and socioeconomic background. In Beni Swaif/Beni Suef, Egypt, there are cultural and social norms that may affect my voting behavior. Additionally, my working class status may impact my access to information and resources related to local elections. Furthermore, my age and educational level may also play a role in shaping my views on the importance of participating in local level elections. Therefore, my response to the question is as follows:\n\n2"]}, {"persona": {"region": "Beni Swaif/Beni Suef", "sex": "male", "age": 20, "country": "Egypt", "marital_status": "single", "education": "middle", "social_class": "working class"}, "question": {"id": "Q221", "variant": 0}, "response": ["Based on the anthropological framework, as a single male from Beni Swaif, Egypt, who has completed middle education and considers himself part of the working class, my answer to the question of how frequently I vote in local level elections is influenced by my cultural context, individual values, socioeconomic background, and space and time. In Egypt, there may be cultural and social expectations for voting, and my working class status may impact my access to information and resources related to the elections. Additionally, my age and level of education may affect my understanding of the importance of voting and the political process. Therefore, my choice is (3) Never."]}, {"persona": {"region": "Giza", "sex": "female", "age": 59, "country": "Egypt", "marital_status": "married", "education": "higher", "social_class": "upper middle class"}, "question": {"id": "Q221", "variant": 0}, "response": ["Based on my emic perspective as a married female from Giza, Egypt, I am influenced by the cultural context of my community where voting is seen as a civic duty. My personal experience and individual values also play a role as I have received a higher education and consider myself part of the upper middle class, which has instilled in me a sense of responsibility towards participating in local level elections. Additionally, my socioeconomic background as a member of the upper middle class has afforded me the privilege and opportunity to have a voice in local governance. Considering the cultural relativism of my society, where participation in elections is valued, and the nuance of the question, I would choose option (1) Always as my answer.\n\n1"]}, {"persona": {"region": "Giza", "sex": "female", "age": 38, "country": "Egypt", "marital_status": "single", "education": "higher", "social_class": "lower middle class"}, "question": {"id": "Q221", "variant": 0}, "response": ["Based on the anthropological framework, my individual values and personal experience as a single female from Giza, Egypt, who has completed higher education and considers herself part of the lower middle class, play a significant role in shaping my perspective on local level elections. The cultural context of Egypt, including its socioeconomic background and cultural relativism, also influence my understanding. Additionally, my age and place as a 38-year-old residing in Giza are important factors. Therefore, I choose option (2) Usually, as I believe in the importance of participating in local level elections to make a difference in my community."]}, {"persona": {"region": "Giza", "sex": "female", "age": 26, "country": "Egypt", "marital_status": "single", "education": "higher", "social_class": "working class"}, "question": {"id": "Q221", "variant": 0}, "response": ["Based on the anthropological framework, as a single female from Giza, Egypt, my emic perspective on local level elections is heavily influenced by my cultural context, individual values, and socioeconomic background. In Egypt, the cultural context and socioeconomic background play a significant role in political participation. As a working-class woman with a higher education level, I am aware of the importance of political engagement and the impact it can have on my community. However, due to the sociopolitical dynamics in Egypt, there are limitations on the extent to which individuals can freely participate in elections. Therefore, my personal experience and cultural relativism lead me to choose option 2: Usually, as the most accurate reflection of my voting frequency in local level elections.\n\n2"]}, {"persona": {"region": "Giza", "sex": "male", "age": 39, "country": "Egypt", "marital_status": "married", "education": "middle", "social_class": "working class"}, "question": {"id": "Q221", "variant": 0}, "response": ["Based on the anthropological framework, my emic perspective as a married male from Giza, Egypt, who is 39 years old, completed middle education, and considers myself part of the working class, is influenced by my cultural context, individual values, and socioeconomic background. In Egypt, local level elections may not hold the same significance as they do in other cultures, and my socioeconomic background as a member of the working class may also impact my access to information and resources related to voting. Additionally, my personal experiences and values may shape my willingness or ability to participate in local level elections. Therefore, my choice to not vote in local level elections is influenced by a combination of cultural context, individual values, and socioeconomic background.\n\n3"]}, {"persona": {"region": "Giza", "sex": "male", "age": 36, "country": "Egypt", "marital_status": "married", "education": "middle", "social_class": "working class"}, "question": {"id": "Q221", "variant": 0}, "response": ["Based on the anthropological framework, as a married male from Giza, Egypt, my emic perspective on local level elections is influenced by my cultural context, individual values, and socioeconomic background. In Egypt, there is a strong emphasis on communal values and the importance of family and community. My personal experience and values also play a significant role in shaping my perspective on voting. As a working-class individual with a middle education level, I am more likely to prioritize immediate concerns such as providing for my family over political participation. Additionally, the cultural relativism within Egyptian society means that there may be different attitudes towards voting based on social class and education level. Considering these factors, my answer to the question would be:\n\n2\n\n(2) Usually"]}, {"persona": {"region": "Giza", "sex": "female", "age": 30, "country": "Egypt", "marital_status": "single", "education": "higher", "social_class": "lower class"}, "question": {"id": "Q221", "variant": 0}, "response": ["Based on the anthropological framework, my emic perspective as a single female from Giza, Egypt, who is 30 years old and part of the lower class, is influenced by my cultural context, individual values and personal experience, and socioeconomic background. In Egypt, there are societal expectations and limitations placed on lower-class women, and access to education and political participation may be limited. My personal experience and values may also influence my perception of the political system and my ability to engage in local level elections. Therefore, I choose the option:\n\n3"]}, {"persona": {"region": "Giza", "sex": "female", "age": 24, "country": "Egypt", "marital_status": "single", "education": "higher", "social_class": "lower class"}, "question": {"id": "Q221", "variant": 0}, "response": ["Based on the anthropological framework, as a single female from Giza, Egypt, my emic perspective on voting in local level elections is influenced by my cultural context, individual values, and socioeconomic background. Being part of the lower class, I may have limited access to information about the election process and may feel marginalized in the political system. Additionally, as a young woman who has completed higher education, I may have a desire to participate in local level elections to advocate for change, but I may also face barriers such as lack of resources or societal expectations. Considering these factors, my nuanced answer would be:\n3\n\nNever"]}, {"persona": {"region": "Giza", "sex": "male", "age": 65, "country": "Egypt", "marital_status": "married", "education": "middle", "social_class": "working class"}, "question": {"id": "Q221", "variant": 0}, "response": ["Based on the anthropological framework, as a married male from Giza, Egypt, my emic perspective on voting in local level elections is influenced by my cultural context, individual values, and socioeconomic background. In Egypt, there is a strong cultural emphasis on participating in political processes and showing loyalty to the state. My personal experience and values as a working-class individual also lead me to view voting as an important civic duty. Additionally, my age and socioeconomic background may give me a sense of responsibility to contribute to the political process. Therefore, I would choose option (1) Always. \n\n1"]}, {"persona": {"region": "Giza", "sex": "female", "age": 56, "country": "Egypt", "marital_status": "married", "education": "middle", "social_class": "working class"}, "question": {"id": "Q221", "variant": 0}, "response": ["Based on the anthropological framework, my emic perspective as a married female from Giza, Egypt, who is part of the working class and has completed middle education level, would be influenced by my cultural context, individual values, and socioeconomic background. In Egypt, there are cultural and socioeconomic factors that could influence my decision to vote in local level elections, such as the political climate, access to information, and the perceived impact of my vote. Additionally, as a woman in Egypt, there may be societal and cultural norms that affect my ability to participate in political processes. Therefore, my decision on how frequently I vote in local level elections is based on a combination of these factors. \n\n2"]}, {"persona": {"region": "Giza", "sex": "male", "age": 31, "country": "Egypt", "marital_status": "married", "education": "higher", "social_class": "lower middle class"}, "question": {"id": "Q221", "variant": 0}, "response": ["Based on the anthropological framework, my perspective as a married male from Giza, Egypt, is shaped by my cultural context, individual values, and socioeconomic background. In Egypt, there is a strong emphasis on the importance of community and the role of local level elections in shaping the immediate environment. As someone who completed higher education and belongs to the lower middle class, I am aware of the impact of local level politics on my family and community. Additionally, my age and place of residence in Giza also influence my perception of the importance of local level elections. Therefore, based on this perspective, I would choose option (2) Usually. \n\n2"]}, {"persona": {"region": "Giza", "sex": "male", "age": 28, "country": "Egypt", "marital_status": "single", "education": "middle", "social_class": "working class"}, "question": {"id": "Q221", "variant": 0}, "response": ["Based on the anthropological framework, my emic perspective as a working-class male from Giza, Egypt, would be influenced by my cultural context, individual values, socioeconomic background, and space and time. In Egypt, there is a strong emphasis on community and social connections, and local level elections may be seen as an important way to participate in the local community. However, my socioeconomic background as a working-class individual with limited education may also lead me to feel disenfranchised or disengaged from the political process. Additionally, my age and place in Giza may influence my perception of the importance of local level elections. Therefore, I would choose the option that best aligns with my perspective.\n\n3"]}, {"persona": {"region": "Giza", "sex": "male", "age": 47, "country": "Egypt", "marital_status": "married", "education": "middle", "social_class": "lower middle class"}, "question": {"id": "Q221", "variant": 0}, "response": ["Based on the anthropological framework, my cultural context as a married male from Giza, Egypt, and my lower middle class socio-economic background heavily influence my perspective. In Egypt, there are cultural and societal expectations regarding voting, and my personal experience and individual values also play a significant role. Additionally, my age and level of education may impact my understanding of the significance of local level elections. Considering the nuanced phrasing of the question and the cultural relativism aspect, I would choose my answer based on these factors.\n\n3"]}, {"persona": {"region": "Giza", "sex": "male", "age": 26, "country": "Egypt", "marital_status": "single", "education": "middle", "social_class": "lower middle class"}, "question": {"id": "Q221", "variant": 0}, "response": ["Based on the anthropological framework, my cultural context as a single male from Giza, Egypt, along with my socioeconomic background as part of the lower middle class, heavily influences my perspective on local level elections. In Egypt, there is a strong emphasis on communal values and collective decision-making within the local community, and voting is seen as a civic duty. However, my individual values and personal experience also play a role, as I may feel disillusioned with the political system and believe that my vote does not truly make a difference. Additionally, the nuance of the question is important, as the frequency of local level elections and the perceived impact of voting may vary for different individuals. \n\n2"]}, {"persona": {"region": "Giza", "sex": "male", "age": 48, "country": "Egypt", "marital_status": "married", "education": "middle", "social_class": "upper middle class"}, "question": {"id": "Q221", "variant": 0}, "response": ["Based on the anthropological framework, as a married male from Giza, Egypt, my emic perspective would be influenced by my cultural context, individual values, and socioeconomic background. In Egypt, local level elections may not hold as much significance as national elections, and my upper middle class status may also influence my participation in local politics. Additionally, my age and education level may play a role in my perception of the importance of local level elections. Ultimately, my answer to this question would be influenced by a combination of these factors, leading me to choose option (2) Usually.\n\n2"]}, {"persona": {"region": "Menya", "sex": "male", "age": 61, "country": "Egypt", "marital_status": "married", "education": "middle", "social_class": "working class"}, "question": {"id": "Q221", "variant": 0}, "response": ["Based on the anthropological framework, my emic perspective as a married male from Menya, Egypt, with a middle education level and part of the working class, is influenced by my cultural context, individual values, and socioeconomic background. In Menya, local level elections may not hold as much significance as they would in other areas, and my socioeconomic background may limit my engagement in political activities. Additionally, my age and space also play a role in my understanding and participation in local level elections. Considering these factors, I would choose the option:\n3"]}, {"persona": {"region": "Menya", "sex": "male", "age": 41, "country": "Egypt", "marital_status": "married", "education": "middle", "social_class": "lower middle class"}, "question": {"id": "Q221", "variant": 0}, "response": ["Based on the anthropological framework, my answer is influenced by my emic perspective as a lower middle class married male from Menya, Egypt. The cultural context of my upbringing and education level also plays a role in my decision making. Additionally, my individual values and personal experiences, as well as my socioeconomic background, have shaped my perception of local level elections. Cultural relativism and the nuance of the question also contribute to my decision. Therefore, my answer is from the perspective of a lower middle class married male from Menya, Egypt, aged 41 with a middle education level.\n\n2"]}, {"persona": {"region": "Menya", "sex": "female", "age": 43, "country": "Egypt", "marital_status": "married", "education": "higher", "social_class": "working class"}, "question": {"id": "Q221", "variant": 0}, "response": ["Based on the anthropological framework, as a married female from Menya, Egypt, I am influenced by my cultural context, individual values, and socioeconomic background. In my culture, there are certain expectations and norms surrounding gender roles and participation in local level elections. My personal values and experiences as a working-class woman who has completed higher education also shape my perspective on civic engagement. Additionally, my socioeconomic background as a working-class individual may impact the time and resources I have available to participate in local elections. Therefore, considering these factors, I would choose the following option:\n\n2"]}, {"persona": {"region": "Menya", "sex": "male", "age": 57, "country": "Egypt", "marital_status": "married", "education": "middle", "social_class": "lower middle class"}, "question": {"id": "Q221", "variant": 0}, "response": ["Based on the anthropological framework, as a married male from Menya, Egypt, my emic perspective on voting in local level elections is influenced by my cultural context, socioeconomic background, and age. In Menya, there is a strong emphasis on community and family, and voting is seen as a way to contribute to the well-being of our neighborhood. As a lower middle class individual with limited education, I am aware of the importance of participating in the democratic process, but I also recognize the challenges that come with my socioeconomic status. Additionally, being 57 years old, I have witnessed and experienced political changes in Egypt, which have shaped my understanding of the voting process. Therefore, I usually vote in local level elections as a way to have a say in the decisions that affect my community.\n\n2"]}, {"persona": {"region": "Menya", "sex": "male", "age": 42, "country": "Egypt", "marital_status": "divorced", "education": "middle", "social_class": "lower middle class"}, "question": {"id": "Q221", "variant": 0}, "response": ["From an anthropological perspective, my emic perspective as a divorced male from Menya, Egypt, at 42 years old and part of the lower middle class, is influenced by my cultural context, individual values, socioeconomic background, and space and time. In Menya, local level elections may not be a priority for someone like me who is focused on providing for my family and navigating the challenges of being divorced. Additionally, my lower middle class status may mean that I am more concerned with day-to-day survival and economic stability rather than engaging in political processes. Furthermore, the cultural relativism of Egypt may mean that there are societal and cultural barriers to political participation for someone in my position. Therefore, as an individual with these specific characteristics and circumstances, my perspective on local level elections is likely to be influenced by these factors, leading me to choose option (3) Never.\n\n3"]}, {"persona": {"region": "Menya", "sex": "female", "age": 59, "country": "Egypt", "marital_status": "married", "education": "middle", "social_class": "upper middle class"}, "question": {"id": "Q221", "variant": 0}, "response": ["From an anthropological perspective, my emic perspective as a married female from Menya, Egypt, is influenced by my cultural context, individual values, socioeconomic background, and space and time. In Menya, women have historically had limited access to education and political participation, but as a member of the upper middle class and having completed middle education level, I have been able to engage in local level elections, albeit infrequently. Additionally, my age and place in society have shaped my views on political participation, leading me to value the opportunity to vote in local elections, despite the limitations imposed by societal norms.\n\n2"]}, {"persona": {"region": "Menya", "sex": "female", "age": 31, "country": "Egypt", "marital_status": "married", "education": "middle", "social_class": "working class"}, "question": {"id": "Q221", "variant": 0}, "response": ["Based on the anthropological framework, as a married female from Menya, Egypt, who completed middle education and considers herself part of the working class, my emic perspective on voting in local level elections is influenced by my cultural context, individual values, and socioeconomic background. In Menya, there may be cultural and societal expectations regarding women's participation in politics, which could impact my decision to vote. Additionally, my personal experience and values may play a role in shaping my views on the electoral process. As a member of the working class, I may have limited time and resources to engage in political activities, which could also influence my decision. Considering these factors, I choose option (2) Usually, as I may prioritize voting in local level elections when I am able to do so given my circumstances.\n\n2"]}, {"persona": {"region": "Menya", "sex": "male", "age": 55, "country": "Egypt", "marital_status": "single", "education": "middle", "social_class": "working class"}, "question": {"id": "Q221", "variant": 0}, "response": ["From the emic perspective, as a working-class individual from Menya, Egypt, my decision to participate in local level elections is influenced by my cultural context, individual values and personal experience, and socioeconomic background. In my community, there is a strong emphasis on the importance of participating in local governance, as it directly impacts our daily lives. Additionally, my personal experience of seeing the impact of local policies on my family and neighbors has instilled a sense of responsibility to participate in the democratic process. As a working-class individual, I understand the importance of having a say in decisions that affect my livelihood. Therefore, I choose option (2) Usually, as I make an effort to participate in local level elections whenever I can, recognizing the significance of my voice in shaping the future of my community. \n\n2"]}, {"persona": {"region": "Menya", "sex": "female", "age": 28, "country": "Egypt", "marital_status": "married", "education": "higher", "social_class": "lower middle class"}, "question": {"id": "Q221", "variant": 0}, "response": ["Based on the anthropological framework, my emic perspective as a married female from Menya, Egypt, would be influenced by my cultural context, individual values and personal experience, and socioeconomic background. In Menya, local level elections may hold significant cultural and social importance, and my personal experience and values as a higher educated woman from the lower middle class would likely lead me to prioritize civic engagement and participation in the democratic process. Additionally, the cultural relativism of my community and the nuanced phrasing of the question would also influence my response. Therefore, I would choose option (2) Usually, as I would likely be actively engaged in local level elections to have a say in the decisions that affect my community and myself.\n\n2"]}, {"persona": {"region": "Menya", "sex": "male", "age": 24, "country": "Egypt", "marital_status": "single", "education": "middle", "social_class": "working class"}, "question": {"id": "Q221", "variant": 0}, "response": ["From an emic perspective, as a single male from Menya, Egypt, I am influenced by the cultural context and socioeconomic background of my community. My individual values and personal experience also play a role in my decision-making. In Menya, there may be certain societal expectations and norms regarding voting, and as someone from the working class with a middle education level, my access to information and resources may be limited. Additionally, my age and place in society may influence my understanding of the importance of local level elections. Therefore, my answer to the question of how frequently I vote in local level elections would be influenced by these factors. \n\n3"]}, {"persona": {"region": "Menya", "sex": "female", "age": 23, "country": "Egypt", "marital_status": "married", "education": "middle", "social_class": "working class"}, "question": {"id": "Q221", "variant": 0}, "response": ["Based on the anthropological framework, the emic perspective of a married female from Menya, Egypt, who is 23 years old and part of the working class, would be influenced by her cultural context, individual values, socioeconomic background, and space and time. In Menya, there may be cultural norms and expectations regarding women's participation in elections, which may be influenced by the individual's personal values and experiences as well as her socioeconomic background. Additionally, her age and place in society would also play a role in her decision-making process. Given these factors, the chosen answer is as follows:\n\n2"]}, {"persona": {"region": "Menya", "sex": "male", "age": 27, "country": "Egypt", "marital_status": "single", "education": "middle", "social_class": "lower middle class"}, "question": {"id": "Q221", "variant": 0}, "response": ["Based on the anthropological framework, my perspective as a single male from Menya, Egypt, who completed middle education level and considers himself part of the lower middle class, is heavily influenced by my cultural context, individual values, and socioeconomic background. In Menya, local level elections may not hold as much significance as they would in other cultural contexts, and my lower middle class status may limit my access to resources and information that would enable me to participate in such elections. Additionally, my age and educational background may not have instilled a strong sense of civic duty or political engagement. Therefore, based on these factors, I would most likely choose the option: \n\n(2) Usually"]}, {"persona": {"region": "Asyut", "sex": "male", "age": 30, "country": "Egypt", "marital_status": "married", "education": "middle", "social_class": "working class"}, "question": {"id": "Q221", "variant": 0}, "response": ["Based on the anthropological framework, as a married male from Asyut, Egypt, my emic perspective would be influenced by my cultural context, individual values and personal experience, and socioeconomic background. In Egypt, there may be certain cultural norms and expectations around voting, and my personal experience and values may influence my decision. Additionally, my socioeconomic background as a working-class individual may also impact my access to information and resources related to voting. Taking all of this into consideration, I would choose the option:\n(3) Never"]}, {"persona": {"region": "Asyut", "sex": "female", "age": 26, "country": "Egypt", "marital_status": "married", "education": "middle", "social_class": "working class"}, "question": {"id": "Q221", "variant": 0}, "response": ["Based on the anthropological framework, as a married female from Asyut, Egypt, my emic perspective is influenced by my cultural context, individual values, and socioeconomic background. In my community, there may be certain norms and expectations regarding voting, and my personal experience and values may also play a role in shaping my behavior. Additionally, my socioeconomic background as part of the working class may impact my access to information and resources related to local level elections. Considering these factors, I would choose the following option:\n\n2"]}, {"persona": {"region": "Asyut", "sex": "male", "age": 32, "country": "Egypt", "marital_status": "single", "education": "higher", "social_class": "lower middle class"}, "question": {"id": "Q221", "variant": 0}, "response": ["Based on my emic perspective, as a member of the lower middle class in Asyut, Egypt, my cultural context and socioeconomic background play a significant role in my decision. In Egypt, there is a strong emphasis on community and local connections, and voting in local level elections is seen as a way to participate in shaping the local community. Additionally, my individual values and personal experience have taught me the importance of being involved in local politics and having a say in decisions that directly impact my daily life. Therefore, I usually vote in local level elections.\n\n2"]}, {"persona": {"region": "Asyut", "sex": "female", "age": 21, "country": "Egypt", "marital_status": "married", "education": "middle", "social_class": "working class"}, "question": {"id": "Q221", "variant": 0}, "response": ["Based on the anthropological framework, as a married female from Asyut, Egypt, at 21 years old with a middle education level, I am part of the working class and my cultural context and socioeconomic background significantly influence my decision-making. In Egypt, there are certain cultural and societal expectations for women, and as a working-class individual, I may have limited access to information and resources that could affect my ability to participate in local level elections. Additionally, my personal experience and individual values may play a role in my decision. Therefore, I may choose the option:\n\n2"]}, {"persona": {"region": "Asyut", "sex": "female", "age": 30, "country": "Egypt", "marital_status": "married", "education": "higher", "social_class": "working class"}, "question": {"id": "Q221", "variant": 0}, "response": ["Based on the anthropological framework, my emic perspective as a married female from Asyut, Egypt, with a working-class background and a higher education level means that my cultural context and individual values play a significant role in my decision-making. In Egypt, there are cultural and societal expectations for women, and my personal experiences have shaped my understanding of the importance of participating in local level elections. Additionally, my socioeconomic background and age also factor into my decision. Considering these factors, I would choose the option:\n\n(2) Usually"]}, {"persona": {"region": "Asyut", "sex": "female", "age": 42, "country": "Egypt", "marital_status": "married", "education": "higher", "social_class": "lower middle class"}, "question": {"id": "Q221", "variant": 0}, "response": ["From the perspective of a married female from Asyut, Egypt, who is 42 years old and part of the lower middle class, my answer to the question of how frequently I vote in local level elections would be \"Usually.\" This choice is informed by the cultural context of Egypt, where there are social and cultural norms around women's involvement in political processes, as well as the socioeconomic background, which may impact access to information and resources related to voting. Additionally, my personal experience and values as a higher-educated individual may lead me to engage in local elections to some extent, but not always. Overall, my answer is influenced by a combination of individual values, cultural context, and socioeconomic background.\n\n2"]}, {"persona": {"region": "Sohag", "sex": "male", "age": 63, "country": "Egypt", "marital_status": "married", "education": "middle", "social_class": "lower middle class"}, "question": {"id": "Q221", "variant": 0}, "response": ["Based on the anthropological framework, my emic perspective as a married male from Sohag, Egypt, at the age of 63, and part of the lower middle class, plays a significant role in my decision-making process. In the cultural context of Sohag, Egypt, voting in local level elections is influenced by my socioeconomic background, personal experience, and individual values. As a member of the lower middle class, I may feel that my vote does not have a significant impact on local politics and may not prioritize participating in local level elections. Additionally, my age and education level also influence my perception of the political system and the importance of voting. Therefore, my decision is based on a nuanced understanding of my cultural and socioeconomic context.\n\n3"]}, {"persona": {"region": "Sohag", "sex": "male", "age": 27, "country": "Egypt", "marital_status": "married", "education": "middle", "social_class": "working class"}, "question": {"id": "Q221", "variant": 0}, "response": ["Based on the anthropological framework, as a married male from Sohag, Egypt, I would answer this question based on my cultural context, individual values, and socioeconomic background. In Sohag, local level elections may not hold as much significance as national elections, and as a member of the working class with only a middle education level, I may feel less empowered to participate in the political process. Additionally, cultural relativism and the nuance of the question may also influence my response. Considering these factors, my answer would be (2) Usually. \n\n2"]}, {"persona": {"region": "Sohag", "sex": "male", "age": 56, "country": "Egypt", "marital_status": "married", "education": "higher", "social_class": "upper middle class"}, "question": {"id": "Q221", "variant": 0}, "response": ["Based on my emic perspective as a married male from Sohag, Egypt, I have been taught that it is important to participate in local level elections as a way to contribute to the progress and development of my community. In my cultural context, voting is seen as a duty and responsibility, and my personal experience has shown me the impact that local level decisions can have on my family and community. Additionally, my socioeconomic background as a member of the upper middle class has afforded me the privilege of education and resources, allowing me to understand the importance of civic engagement. In this space and time, at 56 years old, I have witnessed the changes that have occurred in my community through voting, and I value the nuanced impact that my vote can have. Therefore, I choose option (1) Always."]}, {"persona": {"region": "Sohag", "sex": "male", "age": 51, "country": "Egypt", "marital_status": "married", "education": "higher", "social_class": "lower middle class"}, "question": {"id": "Q221", "variant": 0}, "response": ["Based on the anthropological framework, my answer to the question of how frequently I vote in local level elections is influenced by a combination of emic and etic perspectives, cultural context, individual values and personal experience, socioeconomic background, and space and time. As a married male from Sohag, Egypt, who is 51 years old and part of the lower middle class, my cultural context and socioeconomic background play a significant role in shaping my answer. In Egypt, there is a strong cultural value placed on participating in local elections, and my personal experience has shown me the importance of being involved in the political process at the local level. Additionally, my lower middle class status means that I am more likely to be directly impacted by local government decisions. Therefore, my answer is (2) Usually. I usually vote in local level elections as I believe it is important for me to have a say in decisions that affect my community."]}, {"persona": {"region": "Sohag", "sex": "female", "age": 26, "country": "Egypt", "marital_status": "married", "education": "higher", "social_class": "working class"}, "question": {"id": "Q221", "variant": 0}, "response": ["Based on the anthropological framework, as a married female from Sohag, Egypt, who is 26 years old and considers myself part of the working class, my perspective on voting in local level elections is influenced by my cultural context, individual values, and socioeconomic background. In Sohag, there are strong cultural norms and expectations regarding women's participation in public affairs, and as a working-class woman, I prioritize providing for my family and may not have the time or resources to engage in political activities. Additionally, my personal experience and values may lead me to believe that my vote may not make a significant impact in the outcome of the elections. Therefore, I may choose to vote \"Never\" in local level elections.\n\n3"]}, {"persona": {"region": "Sohag", "sex": "female", "age": 29, "country": "Egypt", "marital_status": "married", "education": "higher", "social_class": "upper middle class"}, "question": {"id": "Q221", "variant": 0}, "response": ["Based on the anthropological framework, my cultural context as a married female from Sohag, Egypt, my age of 29, and my completion of higher education would influence my perspective on voting in local level elections. In my cultural context, voting is seen as a civic duty and a way to participate in the community. My individual values and personal experience have also shaped my belief in the importance of participating in the political process. Additionally, my socioeconomic background as part of the upper middle class gives me the resources and opportunity to be involved in local elections. Therefore, I would choose option (1) Always, as I believe in the importance of voting and actively participating in the democratic process. \n\n1"]}, {"persona": {"region": "Sohag", "sex": "male", "age": 51, "country": "Egypt", "marital_status": "married", "education": "middle", "social_class": "lower middle class"}, "question": {"id": "Q221", "variant": 0}, "response": ["Based on the anthropological framework, I, as a married male from Sohag, Egypt, would consider my emic perspective on this question. In my cultural context, the importance of local level elections may not be as emphasized as in other cultures. Additionally, my lower middle class socioeconomic background may limit my access to information and resources related to local level elections. My individual values and personal experiences may also play a role, as I may feel disconnected from the political system due to a sense of powerlessness. Overall, my nuanced understanding of the question leads me to choose option (3) Never.\n\n3"]}, {"persona": {"region": "Qena", "sex": "male", "age": 32, "country": "Egypt", "marital_status": "single", "education": "middle", "social_class": "working class"}, "question": {"id": "Q221", "variant": 0}, "response": ["Based on my cultural context, being from Qena, Egypt, and considering myself part of the working class, my socioeconomic background plays a significant role in my decision to vote in local level elections. Additionally, my individual values and personal experience have shaped my perspective, as I may have experienced barriers to political participation or may not see the impact of voting in local elections. Cultural relativism also plays a role in my decision, as the cultural context in Egypt may have different expectations and understandings of political participation. In addition, being 32 years old, space and time also factor into my decision as I may have different priorities and perspectives compared to other age groups. Considering all these factors, I select option 3: Never. \n\n3"]}, {"persona": {"region": "Qena", "sex": "male", "age": 54, "country": "Egypt", "marital_status": "married", "education": "middle", "social_class": "lower middle class"}, "question": {"id": "Q221", "variant": 0}, "response": ["Based on my cultural context, as a married male from Qena, Egypt, voting in local level elections is influenced by my socioeconomic background, age, and location. In my community, there may be certain barriers or limitations that prevent people from exercising their right to vote, such as lack of access to polling stations or limited information about candidates. Additionally, my individual values and personal experience may also play a role in my decision to vote. As someone from the lower middle class, I may feel that my vote does not have a significant impact on local politics, and therefore, I may choose to not participate in local level elections. Furthermore, the nuanced phrasing of the question may also influence my answer, as the word \"frequently\" suggests a level of regularity that may not align with my personal experience of voting. \n\n3"]}, {"persona": {"region": "Qena", "sex": "male", "age": 25, "country": "Egypt", "marital_status": "single", "education": "lower", "social_class": "lower class"}, "question": {"id": "Q221", "variant": 0}, "response": ["Based on the anthropological framework, as a single male from Qena, Egypt, I am influenced by my cultural context, individual values, and socioeconomic background. In my community, there is a strong emphasis on family and kinship networks, and I have been taught to prioritize these relationships over political participation. Additionally, my lower education level and socioeconomic status have limited my access to information about the electoral process and candidates. As a result, I have never voted in local level elections, and I do not see myself doing so in the future.\n\n3"]}, {"persona": {"region": "Aswan", "sex": "male", "age": 34, "country": "Egypt", "marital_status": "single", "education": "middle", "social_class": "lower class"}, "question": {"id": "Q221", "variant": 0}, "response": ["Based on the anthropological framework, my emic perspective as a lower class single male from Aswan, Egypt, is influenced by my cultural context, individual values and personal experience, and socioeconomic background. In my community, there may be limited access to education and resources, and political participation may not be a priority due to daily struggles for survival. Additionally, the cultural relativism in my community may lead to a different understanding of the importance of voting in local level elections. Therefore, my answer to the question is:\n\n3\n\nNever"]}, {"persona": {"region": "Aswan", "sex": "female", "age": 31, "country": "Egypt", "marital_status": "married", "education": "middle", "social_class": "lower middle class"}, "question": {"id": "Q221", "variant": 0}, "response": ["Based on the anthropological framework, my emic perspective as a married female from Aswan, Egypt, would be influenced by my cultural context, individual values and personal experience, socioeconomic background, and the space and time in which I live. As a woman in a lower middle class family in Aswan, my access to education and resources may be limited, and my understanding of the political system and the importance of voting may be shaped by these factors. Additionally, the cultural relativism in Egypt and the patriarchal nature of society may also impact my beliefs and actions. Therefore, my answer to the question would be (2) Usually, as I may have some access to voting but may not always exercise this right due to various socio-cultural and economic constraints."]}, {"persona": {"region": "Aswan", "sex": "female", "age": 39, "country": "Egypt", "marital_status": "married", "education": "middle", "social_class": "working class"}, "question": {"id": "Q221", "variant": 0}, "response": ["Based on my cultural context in Aswan, Egypt, my socioeconomic background as a working-class woman, and my age and education level, I would approach this question from an emic perspective. In Aswan, there is a strong sense of community and civic responsibility, and voting in local level elections is seen as a way to contribute to the betterment of our community. However, access to information and resources may be limited, and there may be barriers to voting such as transportation or work obligations. Additionally, the political climate and level of trust in the government may influence the decision to vote. Overall, my personal experience and values would lead me to prioritize participating in local level elections when possible, but the constraints of my socioeconomic background and cultural context may affect the frequency of my voting.\n\n2"]}, {"persona": {"region": "Qena", "sex": "female", "age": 27, "country": "Egypt", "marital_status": "married", "education": "lower", "social_class": "lower middle class"}, "question": {"id": "Q221", "variant": 0}, "response": ["Based on my emic perspective as a married female from Qena, Egypt, I am influenced by the cultural context of my community, which values the participation in local level elections as a way to have a voice in decision-making. My individual values and personal experience also play a role, as I have been taught that voting is a civic duty and that my vote can make a difference. Additionally, my socioeconomic background as part of the lower middle class has instilled in me the belief that participating in local elections is a way to advocate for my community's needs. Furthermore, cultural relativism teaches me that every voice should be heard, and as a 27-year-old woman, I understand the importance of voting for the future of my community. Therefore, I choose option 1: Always. \n\n1"]}, {"persona": {"region": "Qena", "sex": "male", "age": 40, "country": "Egypt", "marital_status": "single", "education": "middle", "social_class": "lower middle class"}, "question": {"id": "Q221", "variant": 0}, "response": ["Based on my emic perspective as a single male from Qena, Egypt, I understand the importance of local level elections within my cultural context. My individual values and personal experience as someone from the lower middle class have shaped my understanding of the significance of participating in these elections. Additionally, my socioeconomic background and the cultural relativism of my community play a role in my decision-making. Considering my age and place in society, I recognize the nuanced phrasing of the question and how it relates to my understanding of the electoral process. Therefore, I choose to answer:\n\n(2) Usually"]}, {"persona": {"region": "Qena", "sex": "male", "age": 30, "country": "Egypt", "marital_status": "single", "education": "middle", "social_class": "working class"}, "question": {"id": "Q221", "variant": 0}, "response": ["Based on my emic perspective as a single male from Qena, Egypt, and my etic understanding of the cultural context, individual values, socioeconomic background, and space and time, I would answer this question by selecting option (2) Usually. In my community, there is a strong emphasis on civic duty and participation in local elections, and I personally value the opportunity to have a voice in local governance. However, due to my working-class status and the demands of my daily life, I may not be able to vote in every single local election. Additionally, the cultural relativism in Qena means that voting is seen as an important part of community engagement, so the option of never voting would not accurately represent my perspective."]}]