[{"persona": {"region": "Fayoum", "sex": "male", "age": 46, "country": "Egypt", "marital_status": "married", "education": "higher", "social_class": "lower middle class"}, "question": {"id": "Q84", "variant": 0}, "response": ["Based on the anthropological framework, I, as a married male from Fayoum, Egypt, understand the importance of considering my cultural context, individual values, socioeconomic background, and the influence of space and time on my perspective. As a member of the lower middle class in Egypt, I have experienced the impact of economic policies on my community and my own financial stability. Additionally, being 46 years old and having completed higher education, I have been exposed to various perspectives and information about the IMF. Considering all these factors, I would choose option 3) Not very much. The IMF's policies have often been criticized for their impact on the economic conditions of countries like Egypt, and as a member of the lower middle class, I have personally felt the effects of these policies."]}, {"persona": {"region": "Fayoum", "sex": "female", "age": 30, "country": "Egypt", "marital_status": "married", "education": "middle", "social_class": "lower middle class"}, "question": {"id": "Q84", "variant": 0}, "response": ["From the perspective of a married female from Fayoum, Egypt, who is 30 years old, has completed middle education, and considers herself part of the lower middle class, the answer to the question about confidence in the International Monetary Fund (IMF) will likely be influenced by her cultural context, socioeconomic background, and personal experience. Given the economic challenges faced by the lower middle class in Egypt, including the impact of IMF policies on the country's economy, she may have limited confidence in the IMF. Additionally, her limited education may affect her awareness and understanding of IMF operations. Her individual values and personal experience, along with the cultural relativism of viewing the IMF from the perspective of a lower middle class Egyptian, could lead her to have not very much confidence in the IMF, as she may feel that its policies have not significantly improved the economic situation for people in her socioeconomic position.\n\n3"]}, {"persona": {"region": "Fayoum", "sex": "male", "age": 60, "country": "Egypt", "marital_status": "married", "education": "higher", "social_class": "working class"}, "question": {"id": "Q84", "variant": 0}, "response": ["Based on the anthropological framework, as a married male from Fayoum, Egypt, who is 60 years old and part of the working class, my emic perspective on the International Monetary Fund (IMF) is likely to be influenced by my cultural context, individual values, and personal experience. Living in a country that has historically had a complicated relationship with international financial institutions, including the IMF, and being part of the working class, I may have a more critical view of the IMF. My socioeconomic background and personal experience may lead me to believe that IMF policies have not always been beneficial for people in similar circumstances as myself. Additionally, cultural relativism suggests that my perspective may be shaped by the collective experience of my community and country as a whole. Therefore, my confidence in the IMF is likely to be influenced by these factors. \n\n3"]}, {"persona": {"region": "Fayoum", "sex": "male", "age": 20, "country": "Egypt", "marital_status": "single", "education": "middle", "social_class": "lower middle class"}, "question": {"id": "Q84", "variant": 0}, "response": ["Based on my emic perspective as a single male from Fayoum, Egypt, and considering my socioeconomic background as part of the lower middle class, I have had limited exposure to the workings of international financial organizations such as the IMF. My cultural context and personal experience lead me to have not very much confidence in the IMF, as I have heard from my family and community about the negative impact of IMF policies on our economy and livelihoods. Additionally, cultural relativism and nuance play a role in my understanding of this question, as my nuanced understanding of the IMF is shaped by my specific cultural and socioeconomic context. \n\n3"]}, {"persona": {"region": "Fayoum", "sex": "female", "age": 39, "country": "Egypt", "marital_status": "married", "education": "higher", "social_class": "lower middle class"}, "question": {"id": "Q84", "variant": 0}, "response": ["Based on my personal experience and socioeconomic background, as a married woman from Fayoum, Egypt, I have completed higher education and consider myself part of the lower middle class. My perspective is heavily influenced by the cultural context and socioeconomic background. Living in Egypt, I have seen the impact of IMF policies on the economy and on people like me. I have also heard from my community about the negative effects of IMF loans and policies, which have often led to austerity measures that disproportionately affect lower and middle-class families. Additionally, my individual values and personal experience have led me to be skeptical of international organizations like the IMF, as I have seen firsthand the challenges faced by families in my community. Therefore, my confidence in the IMF is not very much.\n\n3"]}, {"persona": {"region": "Fayoum", "sex": "male", "age": 33, "country": "Egypt", "marital_status": "married", "education": "higher", "social_class": "working class"}, "question": {"id": "Q84", "variant": 0}, "response": ["Based on the anthropological framework, my response to the question of confidence in the International Monetary Fund (IMF) would be influenced by my individual values and personal experience, as well as my socioeconomic background. As a married male from Fayoum, Egypt, who is 33 years old and part of the working class, I have experienced the impact of economic policies on my community and family. My personal experience and socioeconomic background lead me to have not very much confidence in the IMF. The IMF's policies have often been criticized for their impact on the working class and I have personally witnessed the negative effects of these policies. Therefore, my answer is:\n3\n\n(3) Not very much"]}, {"persona": {"region": "Port Said", "sex": "female", "age": 45, "country": "Egypt", "marital_status": "married", "education": "higher", "social_class": "lower middle class"}, "question": {"id": "Q84", "variant": 0}, "response": ["Based on the anthropological framework, my perspective is heavily influenced by my cultural context, individual values, and socioeconomic background. As a married female from Port Said, Egypt, I am part of the lower middle class, which means that I have likely experienced the impact of IMF policies on the economy. My personal experience and values have shaped my perception of the IMF, and I have a nuanced understanding of its impact on my community. Considering the historical context of IMF involvement in Egypt and the socioeconomic challenges faced by the lower middle class, I have limited confidence in the IMF's policies and their effect on my community.\n\n3"]}, {"persona": {"region": "Port Said", "sex": "male", "age": 42, "country": "Egypt", "marital_status": "married", "education": "middle", "social_class": "lower middle class"}, "question": {"id": "Q84", "variant": 0}, "response": ["Based on the anthropological framework, my perspective as a married male from Port Said, Egypt, at 42 years old and part of the lower middle class, is influenced by my cultural context, individual values, and socioeconomic background. In Egypt, there is a general skepticism towards international organizations like the IMF due to historical and political reasons. Additionally, as someone from the lower middle class, I may feel that the policies of the IMF do not benefit people like me and may even exacerbate economic disparities. Therefore, I would choose option 3, \"Not very much,\" as my confidence in the IMF is influenced by my cultural and socioeconomic background.\n\n3"]}, {"persona": {"region": "Port Said", "sex": "male", "age": 28, "country": "Egypt", "marital_status": "single", "education": "middle", "social_class": "lower middle class"}, "question": {"id": "Q84", "variant": 0}, "response": ["Based on the anthropological framework of emic and etic perspectives, cultural context, individual values and personal experience, socioeconomic background, and cultural relativism, my response to the question about confidence in the International Monetary Fund (IMF) will be influenced by my personal experience and socioeconomic background as a single male from Port Said, Egypt, who is 28 years old and considers himself part of the lower middle class. Growing up in a lower middle class family in Port Said, I have witnessed the challenges and hardships faced by my community due to economic instability and lack of resources. Therefore, my confidence in the IMF is not very much, as I have seen firsthand the negative impact of IMF policies on my community and believe that their approach may not align with the needs and interests of lower middle class individuals like myself.\n\n3"]}, {"persona": {"region": "Port Said", "sex": "female", "age": 30, "country": "Egypt", "marital_status": "married", "education": "higher", "social_class": "lower middle class"}, "question": {"id": "Q84", "variant": 0}, "response": ["From the perspective of a married female from Port Said, Egypt, who is 30 years old and part of the lower middle class, my answer to the question about the confidence in the International Monetary Fund (IMF) is influenced by several factors. Firstly, my cultural context and socioeconomic background play a significant role in shaping my perspective. Egypt has a complex history with IMF policies and programs, and their impact on the country's economy and society. Additionally, my personal experience and individual values also shape my opinion. Having completed higher education, I have likely been exposed to discussions and critiques of international financial institutions, which may lead me to have less confidence in the IMF. Furthermore, as a member of the lower middle class, I may have experienced the effects of economic policies on my community firsthand. This nuanced understanding leads me to select option (3) Not very much. \n\n3"]}, {"persona": {"region": "Port Said", "sex": "male", "age": 30, "country": "Egypt", "marital_status": "divorced", "education": "middle", "social_class": "lower middle class"}, "question": {"id": "Q84", "variant": 0}, "response": ["In answering the question about confidence in the International Monetary Fund (IMF), it is important to consider the cultural context, individual values and personal experience, and socioeconomic background of the persona described. As a divorced male from Port Said, Egypt, who has completed middle education and considers himself part of the lower middle class, his perspectives may be shaped by his experience with economic struggles and the impact of IMF policies on his community. Additionally, cultural relativism is crucial in understanding his perspective as it is influenced by the sociopolitical context of Egypt and the region. Therefore, his response would likely reflect a lack of confidence in the IMF due to the perceived negative effects of its policies on his personal and community's economic situation.\n\n3"]}, {"persona": {"region": "Port Said", "sex": "female", "age": 19, "country": "Egypt", "marital_status": "single", "education": "middle", "social_class": "lower middle class"}, "question": {"id": "Q84", "variant": 0}, "response": ["Based on the anthropological framework, my answer is influenced by my cultural context as a single female from Port Said, Egypt, and my lower middle class socioeconomic background. My personal experience and individual values also shape my perception of international organizations. Additionally, my age and educational level play a role in how I understand and answer this question. Ultimately, my response is a product of the nuanced phrasing of the question and represents the emic perspective of someone in my position.\n\n3"]}, {"persona": {"region": "Fayoum", "sex": "male", "age": 40, "country": "Egypt", "marital_status": "married", "education": "middle", "social_class": "working class"}, "question": {"id": "Q84", "variant": 0}, "response": ["From an emic perspective, as a married male from Fayoum, Egypt, who is 40 years old and part of the working class, my confidence in the International Monetary Fund (IMF) is influenced by my cultural context, individual values, and socioeconomic background. In Egypt, there has been a history of IMF interventions that have had mixed results, and the working class has often borne the brunt of austerity measures and economic reforms imposed by the IMF. Additionally, my personal experience and values lead me to be cautious about international institutions that may not have the best interests of the working class at heart. Therefore, I have limited confidence in the IMF.\n\n3"]}, {"persona": {"region": "Fayoum", "sex": "male", "age": 23, "country": "Egypt", "marital_status": "single", "education": "higher", "social_class": "lower middle class"}, "question": {"id": "Q84", "variant": 0}, "response": ["Based on my emic perspective as a lower middle-class individual from Fayoum, Egypt, I have limited confidence in the International Monetary Fund (IMF) due to the historical context of IMF policies in Egypt, which have often been associated with economic austerity measures that have negatively impacted lower-income individuals and families. Additionally, my personal experience and socioeconomic background have shaped my skepticism towards international financial institutions. Furthermore, considering the cultural context and the nuanced phrasing of the question, my answer reflects a critical view of IMF policies and their impact on my community.\n\n3"]}, {"persona": {"region": "Fayoum", "sex": "female", "age": 38, "country": "Egypt", "marital_status": "married", "education": "middle", "social_class": "lower middle class"}, "question": {"id": "Q84", "variant": 0}, "response": ["Based on the anthropological framework, as a married female from Fayoum, Egypt, cultural context and socioeconomic background play a significant role in my perception of the International Monetary Fund (IMF). My lower middle-class status and middle education level have shaped my understanding of economic policies and international financial institutions. Additionally, my age and place of residence have influenced my perspective on the IMF. Given the historical and political context of Egypt’s relationship with the IMF, I have not had positive experiences with their interventions in our economy. Therefore, I have little confidence in the IMF's ability to positively impact the economic situation in Egypt.\n\n3"]}, {"persona": {"region": "Fayoum", "sex": "male", "age": 32, "country": "Egypt", "marital_status": "married", "education": "middle", "social_class": "lower middle class"}, "question": {"id": "Q84", "variant": 0}, "response": ["From the perspective of a married male from Fayoum, Egypt, who is 32 years old and part of the lower middle class, my answer would be based on my cultural context, individual values, and socioeconomic background. In Egypt, the IMF has been involved in providing financial assistance and policy advice, which has had a significant impact on the country's economy. As someone from the lower middle class, I am likely to have experienced the effects of IMF policies on my daily life and financial situation. My personal experience and socioeconomic background lead me to have less confidence in the IMF, as I may have seen how their policies can exacerbate economic inequality and hardship for people in my position. Therefore, based on my cultural context and personal experience, I would choose option 3: Not very much.\n\n3"]}, {"persona": {"region": "Fayoum", "sex": "male", "age": 31, "country": "Egypt", "marital_status": "married", "education": "higher", "social_class": "working class"}, "question": {"id": "Q84", "variant": 0}, "response": ["Based on the anthropological framework, my perspective as a married male from Fayoum, Egypt, is influenced by my cultural context, socioeconomic background, and personal experience. In Egypt, there is a history of skepticism towards international organizations like the IMF due to the perception that their policies prioritize the interests of wealthy nations over the needs of developing countries. As part of the working class, I have personally experienced the impact of economic policies on my community, and I have seen how they can exacerbate inequality. Therefore, I have limited confidence in the IMF's ability to address the economic challenges facing Egypt.\n\n3"]}, {"persona": {"region": "Fayoum", "sex": "male", "age": 31, "country": "Egypt", "marital_status": "married", "education": "middle", "social_class": "lower middle class"}, "question": {"id": "Q84", "variant": 0}, "response": ["Based on the anthropological framework, as a married male from Fayoum, Egypt, who is 31 years old and part of the lower middle class, my emic perspective and cultural context heavily influence my view on the International Monetary Fund (IMF). Growing up in a lower middle class household in Egypt, I have witnessed the economic struggles faced by my family and community. My individual values and personal experiences have led me to have a deep skepticism towards international financial institutions like the IMF, as I have seen the negative impact of their policies on everyday people in my community. Additionally, my socioeconomic background and cultural relativism further shape my view, as I believe that the IMF's policies often prioritize the interests of global financial elites over the well-being of people like myself and my community. Therefore, I would select option 3) Not very much, as I have little confidence in the IMF's ability to positively impact the economic situation in Egypt."]}, {"persona": {"region": "Fayoum", "sex": "female", "age": 32, "country": "Egypt", "marital_status": "married", "education": "middle", "social_class": "lower middle class"}, "question": {"id": "Q84", "variant": 0}, "response": ["Based on the anthropological framework, my perspective as a married female from Fayoum, Egypt, with a middle education level and lower middle-class background is influenced by my cultural context, individual values, and socioeconomic background. In Egypt, there is a history of skepticism and distrust towards international organizations due to historical colonialism and political interventions. As a lower middle-class individual, I am likely to have experienced the impact of economic policies and may feel that organizations like the IMF do not prioritize the needs of people like me. Additionally, my limited education may lead to a lack of exposure to the IMF's work, making me less confident in their actions. Therefore, I would choose option 3: Not very much."]}, {"persona": {"region": "Ismailia", "sex": "male", "age": 53, "country": "Egypt", "marital_status": "married", "education": "middle", "social_class": "lower middle class"}, "question": {"id": "Q84", "variant": 0}, "response": ["Based on my emic perspective as a married male from Ismailia, Egypt, I have to consider the cultural context and my lower middle-class socioeconomic background. The IMF has historically been associated with economic policies that have negatively impacted the working class and the poor in Egypt. Additionally, my personal experience and individual values lead me to be skeptical of international financial institutions like the IMF. Therefore, I have not much confidence in the International Monetary Fund (IMF) as it does not align with my personal experience and cultural context.\n\n3"]}, {"persona": {"region": "Ismailia", "sex": "male", "age": 38, "country": "Egypt", "marital_status": "married", "education": "higher", "social_class": "working class"}, "question": {"id": "Q84", "variant": 0}, "response": ["Based on the anthropological framework, as a married male from Ismailia, Egypt with a working-class background and higher education, my perspective on the International Monetary Fund (IMF) would be influenced by my cultural context, socioeconomic background, and personal values. In Egypt, the IMF has been involved in economic reform programs that have had significant impacts on the country's economy, including austerity measures and subsidy cuts. As a working-class individual, I may have experienced the effects of these policies firsthand, leading me to have limited confidence in the IMF. Additionally, my higher education may have provided me with a critical understanding of economic systems and the IMF's role in them. Therefore, I would choose the option: (3) Not very much"]}, {"persona": {"region": "Ismailia", "sex": "female", "age": 35, "country": "Egypt", "marital_status": "married", "education": "middle", "social_class": "lower middle class"}, "question": {"id": "Q84", "variant": 0}, "response": ["Based on the anthropological framework, my perspective is heavily influenced by my cultural context, individual values, and socioeconomic background. As a lower middle class woman from Ismailia, Egypt, I have experienced the effects of IMF policies on my community and family. I have seen how these policies often benefit the wealthy and powerful at the expense of the working class and poor. Additionally, my education level has allowed me to critically analyze and understand the impact of IMF decisions on my community. Therefore, I have little confidence in the IMF as I believe their policies do not prioritize the needs of people like me.\n\n3"]}, {"persona": {"region": "Ismailia", "sex": "female", "age": 57, "country": "Egypt", "marital_status": "married", "education": "lower", "social_class": "working class"}, "question": {"id": "Q84", "variant": 0}, "response": ["From my emic perspective as a married woman from Ismailia, Egypt, with a lower education level and part of the working class, my understanding and confidence in the International Monetary Fund (IMF) are shaped by my cultural context, individual values, and socioeconomic background. In my community, there is a general skepticism towards international financial institutions and their impact on our economy. My personal experience and values also lead me to question the IMF's influence, as I have seen the struggles of my family and neighbors in the face of economic changes. As part of the working class, I am acutely aware of the challenges we face and the limited resources available to us. Therefore, I have little confidence in the IMF and its policies, as they do not seem to align with the needs of people like me. \n\n3"]}, {"persona": {"region": "Ismailia", "sex": "male", "age": 33, "country": "Egypt", "marital_status": "married", "education": "middle", "social_class": "lower middle class"}, "question": {"id": "Q84", "variant": 0}, "response": ["Based on the anthropological framework, my perspective is heavily influenced by my cultural context, socioeconomic background, and personal experience. As a married male from Ismailia, Egypt, I come from a middle-level educational background and consider myself part of the lower middle class. Given the IMF's history of imposing structural adjustment programs that have negatively impacted the socioeconomic conditions of many Egyptians, including myself, I have little confidence in the IMF. The IMF's policies have often led to austerity measures that have resulted in economic hardships for people like me. Therefore, my personal experience and socioeconomic background lead me to have \"not very much\" confidence in the International Monetary Fund (IMF).\n\n3"]}, {"persona": {"region": "Ismailia", "sex": "female", "age": 49, "country": "Egypt", "marital_status": "single", "education": "higher", "social_class": "upper middle class"}, "question": {"id": "Q84", "variant": 0}, "response": ["Based on my emic perspective as a single female from Ismailia, Egypt, with a higher education and belonging to the upper middle class, my confidence in the International Monetary Fund (IMF) is quite a lot. This perspective is influenced by my cultural context, where economic stability and growth are valued, as well as my individual values and personal experience of seeing the positive impact of IMF programs in my community. Additionally, my socioeconomic background plays a role in this perspective, as I have likely benefited from economic policies supported by the IMF. Finally, my age and place in society contribute to a nuanced understanding of the IMF's impact on Egypt's economy.\n\n2"]}, {"persona": {"region": "Ismailia", "sex": "female", "age": 35, "country": "Egypt", "marital_status": "married", "education": "higher", "social_class": "lower middle class"}, "question": {"id": "Q84", "variant": 0}, "response": ["Based on my emic perspective as a married female from Ismailia, Egypt, I have a nuanced understanding of the impact of IMF policies on our country's economy and the daily lives of people in my socioeconomic class. The cultural context of Egypt, including its history and political situation, also plays a crucial role in shaping my perception of the IMF. My personal experience and values, as someone who has completed higher education and is part of the lower middle class, lead me to have very little confidence in the IMF. The IMF's policies have often been associated with austerity measures that disproportionately affect the working and middle classes, and I have seen the negative effects of these policies on my community. Additionally, the concept of cultural relativism reminds me that my perspective may differ from others' based on their socioeconomic background, and the space and time aspect reminds me that my age and place in society greatly influence my view of the IMF. Therefore, based on my understanding and personal experience, I choose option (3) Not very much.\n\n3"]}, {"persona": {"region": "Ismailia", "sex": "male", "age": 24, "country": "Egypt", "marital_status": "single", "education": "higher", "social_class": "upper middle class"}, "question": {"id": "Q84", "variant": 0}, "response": ["Based on the anthropological framework, my perspective as a single male from Ismailia, Egypt, who is 24 years old, has completed higher education, and considers myself part of the upper middle class, is influenced by my cultural context, individual values and personal experience, and socioeconomic background. In Egypt, there is a general mistrust of international organizations and their influence on the country's economy. Additionally, as someone from the upper middle class with a higher education level, I may have been exposed to critical perspectives on the IMF and its role in global economic policies. Therefore, I have little confidence in the IMF due to my cultural context and personal experiences.\n\n3"]}, {"persona": {"region": "Ismailia", "sex": "female", "age": 23, "country": "Egypt", "marital_status": "single", "education": "higher", "social_class": "lower middle class"}, "question": {"id": "Q84", "variant": 0}, "response": ["Based on the anthropological framework, as a single female from Ismailia, Egypt, my emic perspective is shaped by my cultural context, individual values, and socioeconomic background. Coming from a lower middle class background, my access to information and resources may be limited, and my personal experience with the IMF may not be favorable. Additionally, my cultural context and socioeconomic background may influence my perception of the IMF's impact on Egypt's economy. Considering the nuanced phrasing of the question, I would choose option 3 - Not very much, as my subjective understanding of the IMF's role may not align with the perspectives of those in higher socioeconomic classes or with different cultural backgrounds. \n\n3"]}, {"persona": {"region": "Ismailia", "sex": "male", "age": 55, "country": "Egypt", "marital_status": "married", "education": "middle", "social_class": "lower middle class"}, "question": {"id": "Q84", "variant": 0}, "response": ["Based on the anthropological framework, my perspective as a married male from Ismailia, Egypt, who is 55 years old and part of the lower middle class, would be influenced by my cultural context, individual values, socioeconomic background, and space and time. In Ismailia, there is a strong sense of community and reliance on local networks, and the IMF's policies and interventions may not always align with the needs and values of the local community. Additionally, as someone from the lower middle class, I may have experienced the effects of economic policies and reforms that were influenced by the IMF, which could impact my confidence in the organization. Therefore, I would choose:\n\n(3) Not very much"]}, {"persona": {"region": "Ismailia", "sex": "male", "age": 57, "country": "Egypt", "marital_status": "married", "education": "middle", "social_class": "upper middle class"}, "question": {"id": "Q84", "variant": 0}, "response": ["Based on my emic perspective as a married male from Ismailia, Egypt, I have a strong sense of pride and national identity. I am influenced by the cultural context of Egypt, including its historical relationship with the IMF and the impact of IMF policies on our economy. My individual values and personal experience have also shaped my opinion, as I have seen the effects of IMF programs on my community and understand the socioeconomic background of those impacted. Additionally, my age and socioeconomic status as part of the upper middle class have influenced my perception of the IMF. Considering the nuanced phrasing of the question, I would choose option (3) Not very much, as I have reservations about the IMF's impact on our economy and believe there are alternative solutions that could better serve our country's needs. \n\n3"]}, {"persona": {"region": "Ismailia", "sex": "female", "age": 29, "country": "Egypt", "marital_status": "married", "education": "middle", "social_class": "upper middle class"}, "question": {"id": "Q84", "variant": 0}, "response": ["Based on my cultural context and socioeconomic background, as a married female from Ismailia, Egypt, I have been exposed to a certain level of education and have had access to information and resources that have shaped my understanding of global financial institutions like the International Monetary Fund (IMF). My personal experience and individual values have also influenced my perception of the IMF. Additionally, my age and place of origin have contributed to my nuanced understanding of economic issues. Therefore, I have chosen the following option:\n2"]}, {"persona": {"region": "Damiatta", "sex": "female", "age": 46, "country": "Egypt", "marital_status": "married", "education": "middle", "social_class": "lower middle class"}, "question": {"id": "Q84", "variant": 0}, "response": ["Based on the anthropological framework, as a married female from Damiatta, Egypt, my emic perspective is influenced by my cultural context and socioeconomic background. In my community, there is a general distrust of international institutions and their impact on our economy. My personal experience and values also play a significant role in shaping my perception of the IMF. As part of the lower middle class, I have experienced the challenges of economic instability and have seen how it has affected my family and community. Therefore, I have very little confidence in the IMF and its ability to positively impact our economy.\n\n3"]}, {"persona": {"region": "Damiatta", "sex": "female", "age": 20, "country": "Egypt", "marital_status": "single", "education": "middle", "social_class": "lower middle class"}, "question": {"id": "Q84", "variant": 0}, "response": ["Based on the anthropological framework, as a single female from Damiatta, Egypt, I am heavily influenced by my cultural context and socioeconomic background. Living in a lower middle-class community, I have experienced firsthand the economic challenges faced by my family and others in my community. This has shaped my perception of institutions like the International Monetary Fund (IMF), which often have a significant impact on economic policies and development in my country. Additionally, my individual values and personal experience play a significant role in my level of confidence in the IMF. Considering these factors, I would choose option 3: Not very much."]}, {"persona": {"region": "Damiatta", "sex": "male", "age": 19, "country": "Egypt", "marital_status": "single", "education": "middle", "social_class": "lower middle class"}, "question": {"id": "Q84", "variant": 0}, "response": ["Based on the anthropological framework, my perspective as a 19-year-old single male from Damiatta, Egypt, with a middle education and lower middle class background, is heavily influenced by my cultural context, individual values, and socioeconomic background. In my community, there is a general skepticism towards international organizations like the IMF due to the perception that their policies often benefit the wealthy and powerful while disproportionately impacting those in lower socioeconomic positions. Additionally, my personal experience and values lead me to believe that the IMF's policies may not align with the needs and interests of individuals like myself in Egypt. Therefore, my confidence in the IMF is not very much.\n\n3"]}, {"persona": {"region": "Damiatta", "sex": "female", "age": 33, "country": "Egypt", "marital_status": "married", "education": "higher", "social_class": "lower middle class"}, "question": {"id": "Q84", "variant": 0}, "response": ["Based on my emic perspective as a married female from Damiatta, Egypt, my cultural context, individual values and personal experience, and socioeconomic background all play a role in how I perceive the International Monetary Fund (IMF). Living in a lower middle-class setting, I have witnessed the impact of IMF policies on my community, and it has not always been positive. The IMF's programs have often led to austerity measures that have affected the livelihoods of people in my social circle. Additionally, the cultural relativism perspective reminds me that my viewpoint is shaped by my specific cultural context and socioeconomic background. Therefore, based on my personal experience and the influence of the IMF policies on my community, I have to say that I have \"Not very much\" confidence in the International Monetary Fund (IMF).\n\n3"]}, {"persona": {"region": "Damiatta", "sex": "male", "age": 24, "country": "Egypt", "marital_status": "single", "education": "higher", "social_class": "lower middle class"}, "question": {"id": "Q84", "variant": 0}, "response": ["From the emic perspective, as a lower middle class individual from Damiatta, Egypt, my cultural context and socioeconomic background play a significant role in shaping my confidence in international organizations like the International Monetary Fund (IMF). My personal experience and values have been influenced by the economic challenges faced by my community, and I have witnessed the impact of IMF policies on our local economy. Additionally, cultural relativism teaches me to be critical of global financial institutions and their actions in different cultural contexts. Considering all these factors, I would choose:\n\n3"]}, {"persona": {"region": "Suez", "sex": "male", "age": 41, "country": "Egypt", "marital_status": "married", "education": "middle", "social_class": "working class"}, "question": {"id": "Q84", "variant": 0}, "response": ["Based on the anthropological framework, my perspective as a married male from Suez, Egypt, who is 41 years old, has completed middle education, and considers himself part of the working class, is heavily influenced by my cultural context, socioeconomic background, and personal experience. In Egypt, the IMF has been involved in economic reform programs that have had significant impacts on the country's economy, particularly on the working class. As someone from this background, I have personally experienced the effects of IMF policies, which have often led to austerity measures and economic hardships for working-class families. Therefore, my confidence in the IMF is not very much, as I believe their policies have not been beneficial for people like me.\n\n3"]}, {"persona": {"region": "Suez", "sex": "female", "age": 39, "country": "Egypt", "marital_status": "divorced", "education": "middle", "social_class": "working class"}, "question": {"id": "Q84", "variant": 0}, "response": ["Based on the anthropological framework, I understand that my socioeconomic background as a working-class divorced woman from Suez, Egypt, will heavily influence my perception of the International Monetary Fund (IMF). My personal experience and values may lead me to view the IMF with skepticism, as I may have experienced economic challenges that were exacerbated by policies associated with the IMF. Additionally, the cultural context of Egypt and the historical relationship between the IMF and developing countries like Egypt may also lead me to have reservations about the organization's impact on my country. Taking into account my nuanced understanding of economic issues and the impact of international organizations on my community, I choose option 3: Not very much. \n\n3"]}, {"persona": {"region": "Cairo", "sex": "female", "age": 55, "country": "Egypt", "marital_status": "married", "education": "middle", "social_class": "working class"}, "question": {"id": "Q84", "variant": 0}, "response": ["Based on the anthropological framework of emic and etic perspectives, cultural context, individual values and personal experience, socioeconomic background, cultural relativism, space and time, and nuance, as a 55-year-old married female from Cairo, Egypt, with a middle education level and working-class status, my confidence in the International Monetary Fund (IMF) is likely to be influenced by my personal experience of economic struggles and the impact of IMF policies on the working class in Egypt. Additionally, the cultural context of Egypt's history with IMF loans and the perception of Western influence on the country's economy may also play a role in shaping my views. This, combined with the socioeconomic background and nuance of my individual experience, may lead me to choose a specific level of confidence in the IMF.\n3"]}, {"persona": {"region": "Cairo", "sex": "male", "age": 58, "country": "Egypt", "marital_status": "married", "education": "middle", "social_class": "lower middle class"}, "question": {"id": "Q84", "variant": 0}, "response": ["From the perspective of a married male from Cairo, Egypt, who is 58 years old, has completed middle education, and considers himself part of the lower middle class, the answer to the question about confidence in the International Monetary Fund (IMF) will be influenced by a combination of cultural context, individual values, and socioeconomic background. Egypt has a complex history with the IMF, and people from lower middle-class backgrounds may have experienced negative impacts of IMF policies, leading to a lack of confidence in the organization. Additionally, the individual's age and educational level may have provided them with a nuanced understanding of global economic systems, further shaping their perspective. \n\n3"]}, {"persona": {"region": "Cairo", "sex": "female", "age": 29, "country": "Egypt", "marital_status": "married", "education": "higher", "social_class": "lower middle class"}, "question": {"id": "Q84", "variant": 0}, "response": ["Based on my cultural context as a married female from Cairo, Egypt, my socioeconomic background as part of the lower middle class, and my personal experience, I have limited confidence in the International Monetary Fund (IMF). In Egypt, there has been a history of economic challenges and government reliance on IMF loans, which have often led to austerity measures that disproportionately affect people in my socioeconomic class. Additionally, the IMF's policies are often seen as favoring the interests of wealthier nations and corporations over the well-being of ordinary citizens in developing countries like Egypt. Therefore, I would choose option (3) Not very much."]}, {"persona": {"region": "Cairo", "sex": "male", "age": 38, "country": "Egypt", "marital_status": "married", "education": "higher", "social_class": "lower middle class"}, "question": {"id": "Q84", "variant": 0}, "response": ["Based on the anthropological framework, as a married male from Cairo, Egypt, my emic perspective on the International Monetary Fund (IMF) is influenced by my cultural context, individual values, and socioeconomic background. Growing up in Cairo, I have seen the impact of IMF policies on my community and understand the importance of international financial institutions in shaping our economic landscape. As part of the lower middle class, I have experienced firsthand the challenges of socioeconomic inequality and the impact of IMF interventions on our local economy. Therefore, my confidence in the IMF is not very much. \n\n3"]}, {"persona": {"region": "Cairo", "sex": "female", "age": 40, "country": "Egypt", "marital_status": "married", "education": "higher", "social_class": "lower middle class"}, "question": {"id": "Q84", "variant": 0}, "response": ["Based on my emic perspective as a married female from Cairo, Egypt, I have limited confidence in the International Monetary Fund (IMF) due to the cultural context and socioeconomic background in which I live. Egypt has a history of economic challenges and IMF interventions, which have often been met with skepticism and criticism from the lower middle class. Additionally, my personal experience and values as a 40-year-old woman with higher education have shaped my perception of the IMF's impact on the country. Therefore, my answer is (3) Not very much."]}, {"persona": {"region": "Cairo", "sex": "male", "age": 38, "country": "Egypt", "marital_status": "married", "education": "higher", "social_class": "upper middle class"}, "question": {"id": "Q84", "variant": 0}, "response": ["From an emic perspective, as a married male from Cairo, Egypt, with a higher education level and part of the upper middle class, my cultural context and socioeconomic background play a major role in shaping my perception of the International Monetary Fund (IMF). Being from Egypt, a country that has a history of IMF involvement and economic reform programs, my personal experience and values influence my confidence in the IMF. Additionally, my age and place of residence in Cairo further impact my understanding of the IMF's impact on my country. Therefore, my answer to this question is (2) Quite a lot."]}, {"persona": {"region": "Cairo", "sex": "male", "age": 59, "country": "Egypt", "marital_status": "married", "education": "middle", "social_class": "lower middle class"}, "question": {"id": "Q84", "variant": 0}, "response": ["Based on my cultural context, as a married male from Cairo, Egypt, my understanding and perception of the International Monetary Fund (IMF) is heavily influenced by my socioeconomic background. As part of the lower middle class, I have experienced the impact of economic policies and reforms pushed by international organizations like the IMF. My personal experience and individual values lead me to have limited confidence in the IMF, as I have seen how their interventions have often exacerbated economic inequality and hardship for people in my community. Additionally, cultural relativism is important to consider, as my perspective may differ from those in higher socioeconomic classes who may have a more positive view of the IMF. Therefore, my answer is:\n3"]}, {"persona": {"region": "Cairo", "sex": "female", "age": 30, "country": "Egypt", "marital_status": "married", "education": "higher", "social_class": "upper middle class"}, "question": {"id": "Q84", "variant": 0}, "response": ["From the perspective of a married female from Cairo, Egypt who is 30 years old, completed higher education, and considers herself part of the upper middle class, my answer to the question about confidence in the International Monetary Fund (IMF) will be influenced by my cultural context, individual values, and socioeconomic background. In Egypt, there is a long history of IMF involvement in the country's economic policies, which has often been met with mixed reactions from the public. As someone from the upper middle class with higher education, I am likely to have a greater understanding of the IMF's role in shaping economic policies and may have personally benefited from its initiatives. Additionally, my socioeconomic background may lead me to have more confidence in the IMF, as its policies are often seen as beneficial for economic stability and growth, which are important for maintaining a certain standard of living. Therefore, my answer will reflect a greater level of confidence in the IMF.\n\n2"]}, {"persona": {"region": "Cairo", "sex": "male", "age": 22, "country": "Egypt", "marital_status": "single", "education": "middle", "social_class": "lower middle class"}, "question": {"id": "Q84", "variant": 0}, "response": ["Based on the anthropological framework described above, my perspective on the International Monetary Fund (IMF) is heavily influenced by my cultural context and socioeconomic background. As a young man from Cairo, Egypt, with a middle education level and lower middle class status, I have experienced firsthand the economic challenges faced by my community. This has led me to view the IMF with skepticism, as I believe its policies often prioritize the interests of wealthier nations and corporations over the needs of ordinary citizens in developing countries like Egypt. Additionally, my personal experience and values lead me to question the effectiveness and fairness of the IMF's approach to economic development. Therefore, I would choose option (3) Not very much. \n\n3"]}, {"persona": {"region": "Cairo", "sex": "male", "age": 29, "country": "Egypt", "marital_status": "single", "education": "higher", "social_class": "lower middle class"}, "question": {"id": "Q84", "variant": 0}, "response": ["Based on the anthropological framework, as a single male from Cairo, Egypt, who considers myself part of the lower middle class, my perspective on the International Monetary Fund (IMF) would be influenced by my cultural context, socioeconomic background, and individual values. In Egypt, the IMF is often associated with austerity measures and economic reforms that have had negative impacts on the lower and middle classes. Additionally, my personal experience and education have likely exposed me to critiques of the IMF and its policies. Therefore, I would have \"Not very much\" confidence in the IMF.\n\n3"]}, {"persona": {"region": "Cairo", "sex": "female", "age": 31, "country": "Egypt", "marital_status": "married", "education": "higher", "social_class": "lower middle class"}, "question": {"id": "Q84", "variant": 0}, "response": ["Based on the anthropological framework, as a married female from Cairo, Egypt, my emic perspective is influenced by my cultural context, individual values, and socioeconomic background. In Egypt, there is a history of economic instability and reliance on external financial institutions like the IMF. As a member of the lower middle class, I have personally experienced the challenges of economic hardship and have witnessed the impact of IMF policies on my community. Therefore, my confidence in the IMF is not very much, as I have seen firsthand how their interventions have not always benefited people in my socioeconomic position.\n\n3"]}, {"persona": {"region": "Cairo", "sex": "male", "age": 59, "country": "Egypt", "marital_status": "married", "education": "higher", "social_class": "upper middle class"}, "question": {"id": "Q84", "variant": 0}, "response": ["Based on the anthropological framework, as a married male from Cairo, Egypt, who is 59 years old and part of the upper middle class, my perspective on the International Monetary Fund (IMF) would be influenced by my cultural context, individual values, and socioeconomic background. In Egypt, the IMF has been involved in economic reform programs that have had both positive and negative effects on the country. As a member of the upper middle class, I may have benefited from some of the IMF's policies that have aimed to stabilize the economy and attract foreign investment. However, I may also have concerns about the impact of IMF programs on the wider Egyptian population, as they have often been associated with austerity measures that have disproportionately affected lower-income groups. Therefore, my confidence in the IMF would be influenced by a combination of positive and negative experiences and values, leading me to select option 2: Quite a lot. \n\n2"]}, {"persona": {"region": "Cairo", "sex": "male", "age": 27, "country": "Egypt", "marital_status": "single", "education": "middle", "social_class": "working class"}, "question": {"id": "Q84", "variant": 0}, "response": ["Based on my cultural context and socioeconomic background as a working-class male from Cairo, Egypt, I have limited exposure to and understanding of the workings of international financial institutions like the IMF. My individual values and personal experience also lead me to be skeptical of the impact of such organizations on my daily life. Additionally, the cultural relativism perspective reminds me that my views may be different from those of other cultural backgrounds. Therefore, I would choose option 3: Not very much. \n\n3"]}, {"persona": {"region": "Cairo", "sex": "female", "age": 25, "country": "Egypt", "marital_status": "single", "education": "higher", "social_class": "working class"}, "question": {"id": "Q84", "variant": 0}, "response": ["Based on the anthropological framework, the emic and etic perspectives of someone from Cairo, Egypt, especially a working-class individual, will greatly influence their confidence in the International Monetary Fund (IMF). The cultural context of Egypt, with its history of economic challenges and political unrest, will also play a significant role in shaping their view. Additionally, their individual values and personal experience, including their education level and socioeconomic background, will impact their perception of the IMF. The nuance of the question will also be critical, as the wording can shape their response. Taking all these factors into consideration, I would choose option (3) Not very much, as the IMF's policies and interventions have often been viewed as favoring the wealthy and exacerbating economic disparities in Egypt and other developing countries."]}, {"persona": {"region": "Cairo", "sex": "female", "age": 23, "country": "Egypt", "marital_status": "married", "education": "higher", "social_class": "lower middle class"}, "question": {"id": "Q84", "variant": 0}, "response": ["Based on the anthropological framework, my perspective on the International Monetary Fund (IMF) is shaped by my cultural context, individual values, and socioeconomic background. As a married female from Cairo, Egypt, I come from a lower middle-class background and have completed higher education. My cultural context and socioeconomic background have likely influenced my understanding of the IMF and its impact on my community. Egypt has a history of IMF involvement, and its policies have often been met with skepticism and criticism, especially from lower-income individuals who have been negatively affected by austerity measures. Additionally, my age and place also play a role in my perception, as I have likely witnessed the consequences of IMF policies in Egypt. Therefore, based on my background and experiences, I would choose option (3) Not very much, as I have little confidence in the IMF's ability to positively impact my community. \n\n3"]}, {"persona": {"region": "Cairo", "sex": "male", "age": 58, "country": "Egypt", "marital_status": "married", "education": "higher", "social_class": "working class"}, "question": {"id": "Q84", "variant": 0}, "response": ["Based on the anthropological framework, my perspective as a married male from Cairo, Egypt, at 58 years of age and part of the working class, is heavily influenced by my cultural context, individual values, and socioeconomic background. In Egypt, there is a history of skepticism towards international organizations like the IMF due to the perception of them imposing policies that benefit the wealthy and powerful at the expense of the working class. My personal experience and values as someone from the working class in Egypt lead me to have not very much confidence in the IMF. Additionally, cultural relativism plays a role in shaping my perspective as I am influenced by the views of those around me and the wider societal discourse on international organizations. \n\n3"]}, {"persona": {"region": "Cairo", "sex": "female", "age": 40, "country": "Egypt", "marital_status": "married", "education": "higher", "social_class": "working class"}, "question": {"id": "Q84", "variant": 0}, "response": ["Based on the anthropological framework, my emic perspective as a married female from Cairo, Egypt, who is 40 years old and part of the working class, will heavily influence my views on the IMF. My cultural context and socioeconomic background will play a significant role in shaping my opinion. Egypt has had a history of IMF involvement, and as a working-class individual, I may have experienced the impact of IMF policies on my community. Additionally, my personal experiences and individual values will also contribute to my perception of the IMF. Therefore, my answer will be based on these factors and may not align with mainstream Western viewpoints on the IMF.\n\n3"]}, {"persona": {"region": "Cairo", "sex": "female", "age": 36, "country": "Egypt", "marital_status": "married", "education": "middle", "social_class": "upper middle class"}, "question": {"id": "Q84", "variant": 0}, "response": ["Based on my cultural context as a married female from Cairo, Egypt, my socioeconomic background as part of the upper middle class, and my personal experience and values, I have a relatively positive perception of the International Monetary Fund (IMF). In Egypt, the IMF has provided financial support and policy advice to help stabilize the economy and promote growth. As someone who has benefitted from the economic stability and opportunities that have arisen as a result of IMF support, I have a great deal of confidence in their ability to positively impact the economy. Therefore, my answer is:\n2"]}, {"persona": {"region": "Cairo", "sex": "male", "age": 40, "country": "Egypt", "marital_status": "married", "education": "middle", "social_class": "lower middle class"}, "question": {"id": "Q84", "variant": 0}, "response": ["Based on my cultural context and socioeconomic background, as a married male from Cairo, Egypt, who is 40 years old and part of the lower middle class, my perspective on the International Monetary Fund (IMF) is influenced by the history of IMF interventions in Egypt and the impact they have had on the economy and society. My personal experience and individual values also play a role in shaping my perception of the IMF. Additionally, cultural relativism is important to consider, as different cultures may have different views on international financial institutions. Therefore, my confidence in the IMF is influenced by a combination of these factors, leading me to choose option 3, \"Not very much\".\n\n3"]}, {"persona": {"region": "Cairo", "sex": "female", "age": 30, "country": "Egypt", "marital_status": "married", "education": "middle", "social_class": "lower class"}, "question": {"id": "Q84", "variant": 0}, "response": ["Based on the anthropological framework, my emic perspective as a married woman from Cairo, Egypt, leads me to consider the IMF in the context of my cultural and socioeconomic background. As part of the lower class, I have experienced firsthand the impact of IMF policies on my community, which often result in austerity measures and economic hardship. Additionally, my personal experience and individual values lead me to be skeptical of international financial institutions, as they have not always prioritized the needs of people like me. Therefore, my confidence in the IMF is not very much. \n\n3"]}, {"persona": {"region": "Cairo", "sex": "male", "age": 58, "country": "Egypt", "marital_status": "married", "education": "higher", "social_class": "lower middle class"}, "question": {"id": "Q84", "variant": 0}, "response": ["Based on my personal experience and socioeconomic background as a married male from Cairo, Egypt, who considers himself part of the lower middle class, I have not had much exposure to the activities and impact of the International Monetary Fund (IMF) in my daily life. My cultural context and individual values also lead me to have limited confidence in international financial institutions that may not fully understand or prioritize the needs of individuals like myself. Additionally, I am aware of the historical and ongoing impact of IMF policies on developing countries, which further influences my lack of confidence in their actions. Therefore, I would choose option 3: Not very much."]}, {"persona": {"region": "Cairo", "sex": "male", "age": 50, "country": "Egypt", "marital_status": "married", "education": "middle", "social_class": "lower middle class"}, "question": {"id": "Q84", "variant": 0}, "response": ["Based on the anthropological framework, as a married male from Cairo, Egypt, age 50, with a middle education level and considering myself part of the lower middle class, my perspective is shaped by my cultural context, individual values, and socioeconomic background. In Egypt, there is a history of skepticism towards international financial organizations like the IMF due to concerns about the impact of their policies on the country's economy and society. Additionally, as someone from the lower middle class, I may have experienced firsthand the effects of economic policies on my community and may feel a lack of trust in institutions like the IMF. Therefore, my confidence in the IMF is not very much.\n\n3"]}, {"persona": {"region": "Cairo", "sex": "female", "age": 40, "country": "Egypt", "marital_status": "married", "education": "higher", "social_class": "upper middle class"}, "question": {"id": "Q84", "variant": 0}, "response": ["Based on the anthropological framework, my emic perspective as a married female from Cairo, Egypt, who is 40 years old, highly educated, and part of the upper middle class, would lead me to consider the cultural context, individual values, and socioeconomic background in my answer. In Cairo, there is a general skepticism towards international organizations like the IMF due to historical and political reasons. However, my higher education and socioeconomic background may lead me to have more confidence in the IMF's expertise and ability to support economic development in Egypt. Additionally, my personal experience and values may also influence my perception of the IMF. Taking all these factors into consideration, I would choose option (2) Quite a lot. \n\n2"]}, {"persona": {"region": "Cairo", "sex": "female", "age": 33, "country": "Egypt", "marital_status": "married", "education": "middle", "social_class": "lower middle class"}, "question": {"id": "Q84", "variant": 0}, "response": ["From an emic perspective, as a married female from Cairo, Egypt, I am influenced by the cultural context and socioeconomic background. Egypt has had a history of economic challenges, and the IMF's involvement in economic reform programs has had mixed results. As part of the lower middle class, I have experienced firsthand the impact of economic policies on my family and community. My personal experience and values also play a significant role in shaping my perception of the IMF. Therefore, my confidence in the IMF is not very much. \n\n3"]}, {"persona": {"region": "Cairo", "sex": "female", "age": 37, "country": "Egypt", "marital_status": "married", "education": "middle", "social_class": "lower middle class"}, "question": {"id": "Q84", "variant": 0}, "response": ["Based on the anthropological framework, my emic perspective as a lower middle class married woman from Cairo, Egypt, is influenced by my cultural context, individual values, and socioeconomic background. The IMF's policies and programs have had an impact on the economic situation in my country, and as a result, I have a critical view of their role. My personal experience and values lead me to have not very much confidence in the International Monetary Fund. \n\n3"]}, {"persona": {"region": "Cairo", "sex": "male", "age": 28, "country": "Egypt", "marital_status": "married", "education": "middle", "social_class": "lower middle class"}, "question": {"id": "Q84", "variant": 0}, "response": ["Based on my cultural context and socioeconomic background, as a married male from Cairo, Egypt, who has completed middle education and considers myself part of the lower middle class, I have limited exposure to the workings of international financial institutions like the IMF. My understanding of their policies and their impact on my life is limited, and I rely on local economic conditions and government policies to gauge my confidence in financial institutions. Therefore, I would have to choose option (3) Not very much."]}, {"persona": {"region": "Cairo", "sex": "male", "age": 53, "country": "Egypt", "marital_status": "married", "education": "higher", "social_class": "working class"}, "question": {"id": "Q84", "variant": 0}, "response": ["Based on the anthropological framework, my perspective on the International Monetary Fund (IMF) is heavily influenced by my cultural context, individual values, and socioeconomic background. As a married male from Cairo, Egypt, I come from a working-class background and have completed higher education. Egypt has a complex relationship with the IMF due to economic policies and loans that have affected the country's economy and society. My cultural context and socioeconomic background lead me to have not very much confidence in the IMF, as I have seen firsthand the impact of their policies on my community and the working class in Egypt.\n\n3"]}, {"persona": {"region": "Cairo", "sex": "male", "age": 45, "country": "Egypt", "marital_status": "married", "education": "higher", "social_class": "lower middle class"}, "question": {"id": "Q84", "variant": 0}, "response": ["From an emic perspective, as a lower middle class married male from Cairo, Egypt, my understanding of the International Monetary Fund (IMF) is heavily influenced by my cultural context, individual values, and socioeconomic background. Egypt has a complicated history with the IMF and their policies, and my personal experience has shown me that IMF loans and interventions have often led to economic hardships for the lower and middle classes. Additionally, my socioeconomic background as part of the lower middle class means that I have felt the negative effects of IMF policies firsthand. This, along with my cultural relativism and nuanced understanding of the situation, leads me to have not very much confidence in the IMF. \n\n3"]}, {"persona": {"region": "Cairo", "sex": "male", "age": 52, "country": "Egypt", "marital_status": "married", "education": "middle", "social_class": "upper middle class"}, "question": {"id": "Q84", "variant": 0}, "response": ["From an anthropological perspective, as a married male from Cairo, Egypt, at 52 years of age and part of the upper middle class, my answer to the question about my confidence in the International Monetary Fund (IMF) would be influenced by my cultural context, individual values, and socioeconomic background. In Egypt, there is a long history of IMF involvement in the country's economic policies, and this has often been met with mixed reactions. As a member of the upper middle class, I may have personally benefited from IMF policies that have promoted economic liberalization and growth, leading me to have a great deal of confidence in the IMF. Additionally, my education level and access to information about global economic trends may also contribute to my positive perception of the IMF's role in shaping international financial policies.\n\n2"]}, {"persona": {"region": "Cairo", "sex": "male", "age": 22, "country": "Egypt", "marital_status": "single", "education": "higher", "social_class": "lower middle class"}, "question": {"id": "Q84", "variant": 0}, "response": ["From the perspective of a single male from Cairo, Egypt, who is 22 years old and part of the lower middle class, several factors come into play when considering the level of confidence in the International Monetary Fund (IMF). First, the cultural context and socioeconomic background are important to consider. Egypt has a history of IMF interventions, which have often been met with skepticism and criticism due to their impact on the economy and society. Additionally, individual values and personal experience play a role, as someone from the lower middle class may have experienced firsthand the effects of IMF policies on their livelihood. Furthermore, the nuance in the phrasing of the question is crucial, as it allows for a nuanced response that takes into account the complex relationship between the IMF and Egypt. Therefore, the answer chosen reflects the perspective of this persona and is based on the factors mentioned above.\n\n3"]}, {"persona": {"region": "Cairo", "sex": "female", "age": 57, "country": "Egypt", "marital_status": "divorced", "education": "middle", "social_class": "lower middle class"}, "question": {"id": "Q84", "variant": 0}, "response": ["Based on my emic perspective as a divorced female from Cairo, Egypt, my cultural context and socioeconomic background have a significant impact on my perception of the International Monetary Fund (IMF). As a member of the lower middle class, I have experienced the effects of economic policies and interventions firsthand. My personal experience and individual values also play a role in shaping my opinion. Given the history of IMF programs in Egypt and the impact they have had on people like me, I have little confidence in the IMF's ability to address the economic challenges facing my country. Therefore, I choose option (3) Not very much."]}, {"persona": {"region": "Cairo", "sex": "female", "age": 42, "country": "Egypt", "marital_status": "married", "education": "middle", "social_class": "working class"}, "question": {"id": "Q84", "variant": 0}, "response": ["Based on the anthropological framework, as a married female from Cairo, Egypt, who is 42 years old and part of the working class, my emic perspective on the International Monetary Fund (IMF) is influenced by my cultural context, individual values, and socioeconomic background. Egypt has a complex relationship with the IMF, and many working-class individuals have experienced the impact of IMF policies on their daily lives and economic stability. Additionally, my personal experience and values lead me to consider the IMF with skepticism, as I have witnessed the challenges faced by my community due to IMF interventions. Therefore, my confidence in the IMF is not very much. \n\n3"]}, {"persona": {"region": "Cairo", "sex": "female", "age": 23, "country": "Egypt", "marital_status": "single", "education": "middle", "social_class": "lower middle class"}, "question": {"id": "Q84", "variant": 0}, "response": ["Based on the anthropological framework, my emic perspective as a single female from Cairo, Egypt, who has completed middle education and considers herself part of the lower middle class, is influenced by my cultural context, individual values, and socioeconomic background. In Egypt, the IMF is often associated with economic reforms and austerity measures that have a significant impact on the everyday lives of individuals in the lower middle class. My personal experience and values lead me to have not very much confidence in the IMF, as I have seen how their policies have contributed to economic hardship for people like me. Additionally, cultural relativism and nuance play a role in my perception of the IMF, as my understanding is shaped by the specific socioeconomic and cultural context of Egypt. Therefore, my answer is:\n\n3. Not very much"]}, {"persona": {"region": "Cairo", "sex": "female", "age": 28, "country": "Egypt", "marital_status": "married", "education": "higher", "social_class": "upper middle class"}, "question": {"id": "Q84", "variant": 0}, "response": ["Based on my emic perspective as a married female from Cairo, Egypt, I have grown up in a cultural context where the IMF has had a significant impact on our country's economy. My personal experience and values, shaped by my higher education and upper-middle-class background, have led me to have quite a lot of confidence in the IMF. I have seen the positive effects of their financial programs and initiatives in stabilizing our economy and creating opportunities for growth. Furthermore, considering the socioeconomic background of my family and the importance of economic stability for our community, I believe that the IMF plays a crucial role in supporting our country's development. Additionally, the nuanced phrasing of the question allows for me to express my confidence in the IMF based on my specific cultural and individual context.\n\n2"]}, {"persona": {"region": "Cairo", "sex": "female", "age": 22, "country": "Egypt", "marital_status": "single", "education": "higher", "social_class": "lower middle class"}, "question": {"id": "Q84", "variant": 0}, "response": ["Based on the anthropological framework, my perspective as a single female from Cairo, Egypt, with a lower middle-class socioeconomic background and higher education, is heavily influenced by my cultural context, individual values, and personal experience. In Egypt, there is a history of economic challenges and political turmoil, and as a member of the lower middle class, I have experienced the impact of these issues firsthand. My personal experience and values lead me to have a limited amount of confidence in the IMF, as I have seen the consequences of their policies on the ground. Additionally, my cultural context and socioeconomic background have shaped my understanding of the IMF's role in global economic dynamics. Therefore, my perspective on the IMF is influenced by my nuanced understanding of its impact on people in similar circumstances to mine.\n\n3"]}, {"persona": {"region": "Cairo", "sex": "female", "age": 39, "country": "Egypt", "marital_status": "married", "education": "middle", "social_class": "lower middle class"}, "question": {"id": "Q84", "variant": 0}, "response": ["Based on my emic perspective as a married female from Cairo, Egypt, I have been influenced by the cultural context of my country and my lower middle-class socioeconomic background. My personal experience and individual values also play a significant role in shaping my perception. Additionally, as a woman of 39 years of age, I have witnessed the impact of IMF policies on my community and family. Considering the cultural relativism and nuance of the question, I would say that I have \"not very much\" confidence in the International Monetary Fund (IMF) due to the negative effects I have observed on the economy and the livelihoods of people in my social circle.\n\n3"]}, {"persona": {"region": "Cairo", "sex": "male", "age": 19, "country": "Egypt", "marital_status": "single", "education": "middle", "social_class": "working class"}, "question": {"id": "Q84", "variant": 0}, "response": ["Based on the anthropological framework, my perspective as a single male from Cairo, Egypt, who has completed middle education and considers himself part of the working class, is heavily influenced by my cultural context, individual values and personal experience, and socioeconomic background. The IMF's policies and interventions have had a significant impact on Egypt's economy, particularly on the working class. My personal experience and the experiences of those around me have led me to have not very much confidence in the IMF, as I have seen how their policies have resulted in economic hardships for many in my community. Additionally, the cultural context and nuanced understanding of the IMF's role in Egypt's economic landscape have shaped my view. Therefore, my choice is:\n\n3) Not very much"]}, {"persona": {"region": "Cairo", "sex": "female", "age": 54, "country": "Egypt", "marital_status": "married", "education": "middle", "social_class": "working class"}, "question": {"id": "Q84", "variant": 0}, "response": ["Based on the anthropological framework, as a married female from Cairo, Egypt, at the age of 54, with a middle education level and considering myself part of the working class, my perspective on the International Monetary Fund (IMF) would be influenced by my cultural context, individual values, and socioeconomic background. In Egypt, there is a history of economic reforms and structural adjustments imposed by the IMF which have had mixed results. As a member of the working class, I have likely experienced firsthand the impact of these policies on my community and family. My confidence in the IMF may not be very high due to the perceived negative effects of their interventions on our economic situation.\n\n3"]}, {"persona": {"region": "Cairo", "sex": "male", "age": 30, "country": "Egypt", "marital_status": "married", "education": "higher", "social_class": "working class"}, "question": {"id": "Q84", "variant": 0}, "response": ["Based on the anthropological framework, my perspective as a married male from Cairo, Egypt, who is 30 years old, has completed higher education, and considers himself part of the working class would be heavily influenced by my cultural context, individual values, and socioeconomic background. In Egypt, there has been a long history of skepticism and criticism towards international financial institutions like the IMF due to their perceived impact on the country's economy and the well-being of its citizens. Additionally, as a member of the working class, I am likely to be more attuned to the economic challenges facing my community and may be critical of organizations like the IMF that are seen as imposing economic policies that may not benefit the working class. Therefore, my confidence in the IMF would not be very high, and I would choose option 3: Not very much.\n\n3"]}, {"persona": {"region": "Cairo", "sex": "male", "age": 39, "country": "Egypt", "marital_status": "married", "education": "higher", "social_class": "lower middle class"}, "question": {"id": "Q84", "variant": 0}, "response": ["Based on the anthropological framework, as a married male from Cairo, Egypt, who is 39 years old and part of the lower middle class, my emic perspective on the International Monetary Fund (IMF) is likely to be influenced by my cultural context, individual values, and socioeconomic background. In Egypt, the IMF has been associated with economic reforms and austerity measures that have had a significant impact on the lower and middle classes. As someone from this socioeconomic background, I may have experienced firsthand or heard about the negative effects of IMF policies on the local economy and society. Additionally, my personal experience and values may lead me to have less confidence in the IMF's ability to address the economic challenges faced by people like me. Therefore, my answer to the question would likely be:\n3\n\n(3) Not very much"]}, {"persona": {"region": "Cairo", "sex": "female", "age": 41, "country": "Egypt", "marital_status": "married", "education": "middle", "social_class": "lower middle class"}, "question": {"id": "Q84", "variant": 0}, "response": ["Based on the anthropological framework, my perspective as a married female from Cairo, Egypt, who is 41 years old and part of the lower middle class, is heavily influenced by my cultural context, individual values, and socioeconomic background. In Egypt, there is a history of economic challenges and IMF interventions that have had mixed results. My personal experience and socioeconomic background have led me to be cautious about expressing a great deal of confidence in the IMF, as I have seen the impact of their policies on my community and my family. Additionally, cultural relativism and nuance play a role in my understanding, as my nuanced perspective is shaped by the specific economic and political context of Egypt. With these factors in mind, I would choose option (3) Not very much. \n\n3"]}, {"persona": {"region": "Cairo", "sex": "male", "age": 45, "country": "Syria", "marital_status": "single", "education": "higher", "social_class": "upper middle class"}, "question": {"id": "Q84", "variant": 0}, "response": ["Based on my emic perspective as a single male from Cairo, Syria, who is 45 years old, has completed higher education, and considers himself to be part of the upper middle class, I have a high level of confidence in the International Monetary Fund (IMF). My cultural context and socioeconomic background have provided me with a positive view of international financial institutions, and my individual values and personal experience have also shaped my perception. Additionally, my nuanced understanding of the role of the IMF in global economics leads me to have a great deal of confidence in their capabilities.\n\n1"]}, {"persona": {"region": "Cairo", "sex": "male", "age": 54, "country": "Egypt", "marital_status": "married", "education": "higher", "social_class": "lower middle class"}, "question": {"id": "Q84", "variant": 0}, "response": ["Based on my emic perspective, as a married male from Cairo, Egypt, I have grown up in a cultural context where the IMF has played a significant role in shaping the economic policies of my country. As part of the lower middle class, I have personally experienced the impact of IMF policies on my socioeconomic background, which has influenced my individual values and personal experience. Additionally, living in a heavily populated and politically charged city like Cairo, the cultural relativism of the IMF and its impact on Egypt's economy cannot be ignored. Furthermore, the nuance of the question also plays a role in shaping my answer, as the phrasing of the question and the time and place in which it is asked can affect my response. \n\n3"]}, {"persona": {"region": "Cairo", "sex": "male", "age": 65, "country": "Egypt", "marital_status": "married", "education": "middle", "social_class": "upper middle class"}, "question": {"id": "Q84", "variant": 0}, "response": ["Based on the anthropological framework, as a married male from Cairo, Egypt, at the age of 65 and part of the upper middle class, my perspective on the International Monetary Fund (IMF) is influenced by my cultural context, individual values, and socioeconomic background. Growing up and living in Cairo, I have witnessed the impact of IMF policies on the economy and society. As someone with a middle education level, I have a nuanced understanding of economic policies and their implications. Additionally, being part of the upper middle class, I have likely benefited from certain economic policies promoted by the IMF. Therefore, my confidence in the IMF is quite high, as I believe their interventions have positively influenced economic stability and growth in Egypt.\n\n2"]}, {"persona": {"region": "Cairo", "sex": "female", "age": 52, "country": "Egypt", "marital_status": "married", "education": "middle", "social_class": "upper middle class"}, "question": {"id": "Q84", "variant": 0}, "response": ["Based on my personal experience and socioeconomic background as a married female from Cairo, Egypt, who considers herself part of the upper middle class, I have a moderately high level of confidence in the International Monetary Fund (IMF). Egypt has had a long history of engagement with the IMF, and while there have been criticisms of some of its policies, there have also been positive impacts on the economy. Additionally, my age and education level have provided me with a nuanced understanding of the IMF's role in global economic governance. Therefore, I believe that my perspective aligns with option (2) Quite a lot. \n\n2"]}, {"persona": {"region": "Cairo", "sex": "male", "age": 26, "country": "Egypt", "marital_status": "single", "education": "higher", "social_class": "lower middle class"}, "question": {"id": "Q84", "variant": 0}, "response": ["Based on the anthropological framework, my perspective as a single male from Cairo, Egypt, who is 26 years old, has completed higher education, and considers myself part of the lower middle class, is influenced by my cultural context, socioeconomic background, and personal experience. In Egypt, there is a history of economic challenges and IMF interventions, which have had mixed results. As someone from the lower middle class, I have personally experienced the impact of economic policies on my community and have seen the struggles of those around me. Therefore, my confidence in the IMF may not be very high due to the negative consequences I have witnessed. Additionally, cultural relativism and nuanced phrasing of the question may also influence my response, as my understanding of the IMF may differ from those in higher socioeconomic classes or from different cultural backgrounds.\n\n3"]}, {"persona": {"region": "Cairo", "sex": "male", "age": 32, "country": "Egypt", "marital_status": "married", "education": "middle", "social_class": "working class"}, "question": {"id": "Q84", "variant": 0}, "response": ["Based on the anthropological framework, my perspective as a married male from Cairo, Egypt, who is 32 years old and part of the working class, is heavily influenced by my cultural context, individual values, and socioeconomic background. As an Egyptian, my country has a complex relationship with the IMF due to past loan agreements and economic reforms that have impacted the working class. My personal experience and values lead me to have a lack of confidence in the IMF, as I have witnessed the negative effects of their policies on my community and family. Additionally, my socioeconomic background as part of the working class means that I have likely been disproportionately affected by IMF policies. Therefore, my lack of confidence in the IMF is shaped by a combination of cultural context, personal experience, and socioeconomic background.\n\n3"]}, {"persona": {"region": "Cairo", "sex": "male", "age": 38, "country": "Egypt", "marital_status": "married", "education": "middle", "social_class": "lower middle class"}, "question": {"id": "Q84", "variant": 0}, "response": ["Based on the anthropological framework, my perspective as a married male from Cairo, Egypt, with a lower middle class socioeconomic background, is influenced by my cultural context, individual values, and personal experience. Egypt has a history with the IMF and its policies have had significant impact on the country's economy and society. My personal experience and the experiences of those around me have shaped my perception of the IMF, and I have seen how its policies have affected people in my community. Additionally, my lower middle class status means that I may have different economic concerns and priorities than someone from a higher socioeconomic background. Therefore, my confidence in the IMF may be influenced by these factors, leading me to choose the option that best reflects my perspective.\n\n3"]}, {"persona": {"region": "Cairo", "sex": "male", "age": 58, "country": "Egypt", "marital_status": "married", "education": "higher", "social_class": "upper middle class"}, "question": {"id": "Q84", "variant": 0}, "response": ["Based on the anthropological framework, my perspective as a married male from Cairo, Egypt, at 58 years of age with a higher education level and part of the upper middle class, is shaped by my cultural context, socioeconomic background, individual values, and personal experiences. In Egypt, there has been a historical mistrust of international organizations like the IMF due to their perceived impact on the country's economy and sovereignty. As someone from the upper middle class, I may have more exposure to economic policies and may have more confidence in the IMF's ability to stabilize the economy. Additionally, my higher education level may have provided me with a more nuanced understanding of global economic systems. Therefore, I have quite a lot of confidence in the International Monetary Fund (IMF).\n\n2"]}, {"persona": {"region": "Cairo", "sex": "male", "age": 49, "country": "Egypt", "marital_status": "married", "education": "middle", "social_class": "lower middle class"}, "question": {"id": "Q84", "variant": 0}, "response": ["Based on the anthropological framework, my emic perspective as a married male from Cairo, Egypt, would be influenced by my cultural context, individual values, and socioeconomic background. In Egypt, there is a general distrust of international organizations like the IMF due to historical and political reasons. As a member of the lower middle class, I have personally experienced the economic challenges faced by people in my socioeconomic bracket, and I have seen how IMF policies have not always benefitted people like me. Additionally, my age and education level have shaped my understanding of economic issues. Therefore, I would not have much confidence in the IMF.\n\n3"]}, {"persona": {"region": "Cairo", "sex": "female", "age": 29, "country": "Egypt", "marital_status": "married", "education": "middle", "social_class": "working class"}, "question": {"id": "Q84", "variant": 0}, "response": ["Based on the anthropological framework, my perspective as a married female from Cairo, Egypt, is heavily influenced by my cultural context, individual values, and socioeconomic background. As part of the working class, I have been directly impacted by economic policies and decisions made by international organizations like the IMF. My personal experience and the experiences of those around me have led me to have not very much confidence in the IMF. The IMF's policies have often been associated with austerity measures that have negatively affected working-class families in Egypt. Additionally, cultural relativism and nuance play a role in my understanding of the IMF, as I am aware that perceptions of this organization may vary among different social classes and cultural groups in Egypt. \n\n3"]}, {"persona": {"region": "Cairo", "sex": "female", "age": 36, "country": "Egypt", "marital_status": "married", "education": "higher", "social_class": "lower middle class"}, "question": {"id": "Q84", "variant": 0}, "response": ["Based on my emic perspective as a married female from Cairo, Egypt, and considering my lower middle-class socioeconomic background, I have limited confidence in the International Monetary Fund (IMF). The IMF's policies and programs often seem to favor the upper class and neglect the needs of the lower middle class and the poor. Additionally, my cultural context and personal experience have taught me that IMF interventions can lead to austerity measures and economic hardships for ordinary citizens. Therefore, I would choose option 3: Not very much.\n\n3"]}, {"persona": {"region": "Cairo", "sex": "female", "age": 34, "country": "Egypt", "marital_status": "married", "education": "middle", "social_class": "lower middle class"}, "question": {"id": "Q84", "variant": 0}, "response": ["Based on the anthropological framework, my perspective as a married female from Cairo, Egypt, who is 34 years old and part of the lower middle class, is influenced by my cultural context, socioeconomic background, and personal experience. In Egypt, there is a history of economic challenges and social inequality, and the IMF has been involved in economic restructuring programs that have had mixed results. My personal experience and the experiences of people in my community have led to a lack of confidence in the IMF's effectiveness in addressing the economic needs of Egypt. Therefore, my answer is:\n\n3"]}, {"persona": {"region": "Fayoum", "sex": "male", "age": 57, "country": "Egypt", "marital_status": "married", "education": "middle", "social_class": "working class"}, "question": {"id": "Q84", "variant": 0}, "response": ["Based on my emic perspective as a married male from Fayoum, Egypt, and my etic understanding of the IMF's policies and practices, I have developed a low level of confidence in the organization. My cultural context and socioeconomic background have shaped my perception of the IMF as an institution that primarily benefits wealthier countries and does not prioritize the needs of working-class individuals like myself. My personal experience and individual values also play a significant role in my lack of confidence, as I have witnessed the negative impact of IMF policies on my community and the broader Egyptian population. Additionally, the concept of cultural relativism reminds me that my perspective on the IMF is influenced by my specific cultural and economic context, and I understand that others may have differing opinions based on their own experiences and backgrounds.\n\n3"]}, {"persona": {"region": "Fayoum", "sex": "male", "age": 60, "country": "Egypt", "marital_status": "married", "education": "middle", "social_class": "lower middle class"}, "question": {"id": "Q84", "variant": 0}, "response": ["From the perspective of a married male from Fayoum, Egypt, who is 60 years old, has completed middle education, and considers himself part of the lower middle class, there are several factors that influence my answer to the question about confidence in the IMF. First, my cultural context as an Egyptian and my socioeconomic background as part of the lower middle class inform my perception of international financial institutions like the IMF. Additionally, my personal experience and individual values play a role in shaping my trust in such organizations. Given the historical and socio-political context of Egypt's relationship with international financial institutions, I would have to say that I have not very much confidence in the IMF.\n\n3"]}, {"persona": {"region": "Fayoum", "sex": "male", "age": 21, "country": "Egypt", "marital_status": "single", "education": "middle", "social_class": "lower middle class"}, "question": {"id": "Q84", "variant": 0}, "response": ["Based on my cultural context as a single male from Fayoum, Egypt, I have been brought up in a community where there is a general skepticism towards international institutions and their impact on our country. My socioeconomic background as part of the lower middle class has also influenced my perception, as I have seen the struggles of my family and community members due to economic challenges. Additionally, my personal experience and individual values have led me to believe that the IMF's policies may not always align with the needs and interests of the Egyptian people. Therefore, I have limited confidence in the IMF's effectiveness in addressing our country's economic issues.\n\n3"]}, {"persona": {"region": "Fayoum", "sex": "male", "age": 33, "country": "Egypt", "marital_status": "single", "education": "higher", "social_class": "working class"}, "question": {"id": "Q84", "variant": 0}, "response": ["Based on the anthropological framework, my perspective as a single male from Fayoum, Egypt, who is 33 years old, has completed higher education, and considers himself part of the working class, is shaped by my cultural context, individual values, and socioeconomic background. In Egypt, there is a history of economic challenges and the IMF has played a significant role in providing financial support to the government. However, the IMF's policies have often been criticized for disproportionately impacting the working class and for not considering the cultural and social context of the country. As someone from the working class, I have experienced the effects of IMF policies on our community, and this has influenced my lack of confidence in the IMF. The IMF's interventions have not significantly improved the economic conditions of the working class, and I have personal values that prioritize the well-being of my community. Therefore, my perspective on the IMF is shaped by these factors, leading me to choose option (3) Not very much.\n\n3"]}, {"persona": {"region": "Fayoum", "sex": "male", "age": 32, "country": "Egypt", "marital_status": "married", "education": "higher", "social_class": "lower middle class"}, "question": {"id": "Q84", "variant": 0}, "response": ["Based on the anthropological framework, my perspective as a married male from Fayoum, Egypt, who is 32 years old, has completed higher education, and considers himself part of the lower middle class, is heavily influenced by my cultural context, socioeconomic background, and personal experiences. In Egypt, the IMF has been involved in providing financial assistance and policy advice, which has had mixed results. As someone from the lower middle class, I have personally experienced the impact of IMF policies on the economy and society, and my perceptions are influenced by the socioeconomic challenges that my community faces. Additionally, my cultural context and values shape my perspective on the IMF, as I may have concerns about the impact of IMF policies on social welfare and economic inequality. Therefore, my confidence in the IMF is not very much (3).\n\n3"]}, {"persona": {"region": "Gharbia", "sex": "male", "age": 42, "country": "Egypt", "marital_status": "married", "education": "higher", "social_class": "upper middle class"}, "question": {"id": "Q84", "variant": 0}, "response": ["Based on my emic perspective as a married male from Gharbia, Egypt, who is 42 years old and part of the upper middle class, my confidence in the International Monetary Fund (IMF) is influenced by my cultural context, socioeconomic background, and personal values. In Egypt, the IMF has played a significant role in shaping economic policies, and while some may view their interventions positively, others may be critical of the impact on the local economy and society. Additionally, my higher education level has provided me with a nuanced understanding of global financial institutions, leading me to have quite a lot of confidence in the IMF's ability to positively impact economic stability and growth in Egypt and similar countries. Therefore, I choose option 2: Quite a lot. \n\n2"]}, {"persona": {"region": "Gharbia", "sex": "male", "age": 52, "country": "Egypt", "marital_status": "married", "education": "middle", "social_class": "working class"}, "question": {"id": "Q84", "variant": 0}, "response": ["Based on the anthropological framework, as a married male from Gharbia, Egypt, I would consider the emic perspective of my community's view on the IMF. The cultural context of Egypt, including its history with IMF loans and the impact of economic policies on the working class, would heavily influence my answer. My individual values and personal experience as part of the working class, along with my socioeconomic background, would also play a significant role in shaping my perception of the IMF. Additionally, cultural relativism would lead me to consider the diverse perspectives within Egypt and the nuanced phrasing of the question. Therefore, I would choose option (3) Not very much, as I have observed the negative effects of IMF policies on my community and have little confidence in their approach. \n\n3"]}, {"persona": {"region": "Gharbia", "sex": "male", "age": 45, "country": "Egypt", "marital_status": "divorced", "education": "higher", "social_class": "upper middle class"}, "question": {"id": "Q84", "variant": 0}, "response": ["Based on the anthropological framework, as a divorced male from Gharbia, Egypt, I have a unique perspective shaped by my cultural context, socioeconomic background, and personal experience. As a member of the upper middle class, I have likely benefited from and have a stake in the economic policies promoted by international organizations like the IMF. Additionally, my higher education level may have provided me with a deeper understanding of global financial systems, further influencing my perspective. Therefore, I would likely have a great deal of confidence in the IMF, as I perceive it to be a stabilizing force in the global economy and an institution that aligns with my personal and socioeconomic interests.\n\n2"]}, {"persona": {"region": "Behaira", "sex": "male", "age": 23, "country": "Egypt", "marital_status": "single", "education": "middle", "social_class": "lower class"}, "question": {"id": "Q84", "variant": 0}, "response": ["Based on the anthropological framework, my emic perspective as a single male from Behaira, Egypt, who has only completed middle education level and considers himself part of the lower class, is influenced by my cultural context, individual values and personal experience, and socioeconomic background. I have grown up in a community where the IMF's policies have had negative effects on the local economy, leading to increased poverty and unemployment. Additionally, my personal experience and values have shaped my distrust in international organizations that I perceive as benefiting the wealthy and powerful at the expense of people like me. Therefore, I have little confidence in the IMF.\n\n3"]}, {"persona": {"region": "Behaira", "sex": "male", "age": 38, "country": "Egypt", "marital_status": "single", "education": "higher", "social_class": "lower class"}, "question": {"id": "Q84", "variant": 0}, "response": ["Based on my emic perspective as a lower-class, educated male from Behaira, Egypt, I have limited confidence in the International Monetary Fund (IMF). My personal experience and socioeconomic background have led me to believe that the IMF's policies often do not benefit people like me. Additionally, my cultural context and values lead me to be skeptical of external organizations that may not fully understand or prioritize the needs of my community. Therefore, I would choose option (3) Not very much.\n\n3"]}, {"persona": {"region": "Behaira", "sex": "male", "age": 32, "country": "Egypt", "marital_status": "married", "education": "middle", "social_class": "lower class"}, "question": {"id": "Q84", "variant": 0}, "response": ["Based on the anthropological framework, my emic perspective as a lower-class, married male from Behaira, Egypt, with limited education and socioeconomic background, influences my understanding and confidence in the International Monetary Fund (IMF). My cultural context, individual values, and personal experience lead me to view the IMF with skepticism, as I have experienced economic hardships and may not have benefitted from their policies. Additionally, cultural relativism and nuance play a role in my perception, as I am influenced by the negative portrayal of the IMF in the media and within my social circles. Therefore, my answer is:\n\n3"]}, {"persona": {"region": "Behaira", "sex": "female", "age": 37, "country": "Egypt", "marital_status": "married", "education": "middle", "social_class": "working class"}, "question": {"id": "Q84", "variant": 0}, "response": ["Based on the anthropological framework, as a married female from Behaira, Egypt, my emic perspective is influenced by my cultural context, individual values, socioeconomic background, and space and time. Behaira is a region with a history of economic challenges, and as a working-class woman, I am aware of the impact of IMF policies on my community. My middle education level also allows me to critically evaluate the IMF's impact on Egypt's economy. Additionally, my age and experience have shaped my perception of international financial institutions. Considering these factors, I have chosen the option which best reflects my perspective.\n\n3"]}, {"persona": {"region": "Behaira", "sex": "male", "age": 48, "country": "Egypt", "marital_status": "married", "education": "middle", "social_class": "working class"}, "question": {"id": "Q84", "variant": 0}, "response": ["Based on the anthropological framework, my answer is influenced by my cultural context as a married male from Behaira, Egypt, and my middle education level. My socioeconomic background as part of the working class also plays a role in my perception. Additionally, my age and place of residence in Behaira shape my understanding. My answer is influenced by the emic perspective of my community and personal experiences. Therefore, I choose option 3: Not very much."]}, {"persona": {"region": "Behaira", "sex": "female", "age": 34, "country": "Egypt", "marital_status": "married", "education": "middle", "social_class": "lower class"}, "question": {"id": "Q84", "variant": 0}, "response": ["Based on my cultural context, as a lower-class married woman from Behaira, Egypt, my socioeconomic background and personal experience greatly influence my perception of international institutions like the International Monetary Fund (IMF). My limited access to education and resources has made me skeptical of organizations like the IMF, as they are often seen as representing the interests of the wealthy and powerful, rather than the needs of people like me. Additionally, my age and place of origin have exposed me to the negative impacts of IMF policies on my community and country. Therefore, I have little confidence in the IMF to address the economic challenges faced by people in my position.\n\n3"]}, {"persona": {"region": "Behaira", "sex": "female", "age": 30, "country": "Egypt", "marital_status": "divorced", "education": "lower", "social_class": "lower class"}, "question": {"id": "Q84", "variant": 0}, "response": ["Based on my personal experience and lower socioeconomic background, I have very little confidence in the International Monetary Fund. As a divorced woman from Behaira, Egypt, I have seen firsthand the struggles of the lower class in my community, and I believe that the IMF's policies often benefit the wealthy and powerful at the expense of those who are already marginalized. Additionally, my limited education level has not provided me with a deep understanding of global economic policies, but I have seen the negative impact of IMF interventions in my own community. Therefore, I choose option 3: Not very much."]}, {"persona": {"region": "Behaira", "sex": "male", "age": 40, "country": "Egypt", "marital_status": "married", "education": "higher", "social_class": "lower middle class"}, "question": {"id": "Q84", "variant": 0}, "response": ["Based on my personal experience and cultural context as a married male from Behaira, Egypt, I have limited confidence in the International Monetary Fund (IMF). My lower middle class socioeconomic background and higher education have shaped my understanding of the IMF's impact on developing countries like Egypt. The IMF's policies and interventions are often seen as favoring the interests of wealthy nations and corporations, while negatively affecting the livelihoods and economic stability of people in lower income brackets. Additionally, cultural relativism and the nuanced phrasing of the question also lead me to choose option 3: Not very much.\n\n3"]}, {"persona": {"region": "Behaira", "sex": "male", "age": 38, "country": "Egypt", "marital_status": "married", "education": "middle", "social_class": "working class"}, "question": {"id": "Q84", "variant": 0}, "response": ["Based on my cultural context as a married male from Behaira, Egypt, my emic perspective is influenced by the socioeconomic background of being part of the working class, which shapes my individual values and personal experience. The IMF's policies and programs may have a direct impact on my daily life and the economic stability of my family. Additionally, cultural relativism teaches me to consider the nuances of the IMF's actions in Egypt, taking into account the historical and current geopolitical factors. Therefore, my confidence in the IMF may be influenced by these factors, as well as the space and time in which I live. All of these factors contribute to my perception of the IMF, leading me to choose option 3, \"Not very much.\"\n\n3"]}, {"persona": {"region": "Behaira", "sex": "female", "age": 30, "country": "Egypt", "marital_status": "married", "education": "higher", "social_class": "lower class"}, "question": {"id": "Q84", "variant": 0}, "response": ["From the perspective of a married female from Behaira, Egypt, who is 30 years old, has completed higher education, and considers herself part of the lower class, my answer is influenced by my cultural context, individual values, and socioeconomic background. In Behaira, many people in the lower class struggle financially, and the IMF's policies and programs may directly impact their lives. My personal experience and values lead me to have not very much confidence in the IMF, as I have seen how their interventions have often led to austerity measures and economic hardships for people like me. Additionally, cultural relativism reminds me that my perspective is valid and must be considered. Thus, I choose option (3) Not very much. \n\n3"]}, {"persona": {"region": "Behaira", "sex": "female", "age": 35, "country": "Egypt", "marital_status": "married", "education": "middle", "social_class": "working class"}, "question": {"id": "Q84", "variant": 0}, "response": ["Based on the anthropological framework, my emic perspective as a married female from Behaira, Egypt, who is 35 years old, completed middle education, and considers herself part of the working class, is shaped by my cultural context, individual values, and socioeconomic background. In Egypt, there is a history of economic challenges and the IMF has played a significant role in providing financial support to the country. However, this support has often come with conditions that have negatively impacted the working class and middle-income individuals like myself. Additionally, my personal experience and values lead me to question the effectiveness and motives of the IMF in addressing the economic needs of people like me. Therefore, based on my emic perspective, I would choose option 3: Not very much. \n\n3"]}, {"persona": {"region": "Behaira", "sex": "male", "age": 52, "country": "Egypt", "marital_status": "married", "education": "middle", "social_class": "lower class"}, "question": {"id": "Q84", "variant": 0}, "response": ["Based on my cultural context and socioeconomic background, I have very little confidence in the International Monetary Fund (IMF). As a lower-class individual from Behaira, Egypt, I have experienced firsthand the impact of IMF policies on our economy and society. These policies often prioritize the interests of the global elite and multinational corporations over the needs of ordinary working people like myself. The IMF's structural adjustment programs have led to austerity measures, privatization of public services, and increased inequality, causing hardship for many in my community. Therefore, I have very little confidence in the IMF's ability to truly address the economic challenges facing Egypt and other developing countries.\n\n3"]}, {"persona": {"region": "Alexandria", "sex": "female", "age": 41, "country": "Egypt", "marital_status": "single", "education": "middle", "social_class": "lower class"}, "question": {"id": "Q84", "variant": 0}, "response": ["In considering the emic and etic perspectives, my cultural context as a lower-class woman from Alexandria, Egypt, plays a significant role in shaping my views on the International Monetary Fund (IMF). My individual values and personal experience, as well as my socioeconomic background, also factor into my understanding. As a member of the lower class, the IMF's policies and programs may not have directly benefited me or my community, leading to a lack of confidence in their effectiveness. Additionally, the cultural relativism of my perspective may differ from those of higher socioeconomic backgrounds who may have had more positive experiences with the IMF. Finally, my age and place also shape my perspective, as I have lived through economic hardships that may have been influenced by IMF interventions. \n\n3"]}, {"persona": {"region": "Alexandria", "sex": "female", "age": 21, "country": "Egypt", "marital_status": "single", "education": "middle", "social_class": "lower class"}, "question": {"id": "Q84", "variant": 0}, "response": ["Based on my emic perspective as a single female from Alexandria, Egypt, I have been influenced by the cultural context of my community, which is often skeptical of international institutions such as the IMF. My lower socioeconomic background has also shaped my personal experience and values, leading me to believe that the IMF does not have the best interest of individuals like myself in mind. Additionally, cultural relativism plays a role in my understanding, as I have been exposed to narratives that critique the IMF's impact on developing countries. Therefore, I have little confidence in the IMF's intentions and its ability to positively impact my life and the lives of others in similar circumstances.\n\n3"]}, {"persona": {"region": "Alexandria", "sex": "female", "age": 35, "country": "Egypt", "marital_status": "married", "education": "middle", "social_class": "lower class"}, "question": {"id": "Q84", "variant": 0}, "response": ["Based on my emic perspective as a married woman from Alexandria, Egypt, who identifies as part of the lower class, my confidence in the International Monetary Fund (IMF) is influenced by my cultural context, individual values, and socioeconomic background. In Egypt, there is a history of IMF loans being tied to economic reforms that have negatively impacted the lower class, leading to skepticism and distrust. Additionally, my personal experience of struggling financially and witnessing the hardships faced by others in similar socioeconomic positions informs my lack of confidence in the IMF. Furthermore, as a member of the lower class, I am more likely to be directly impacted by IMF policies and therefore have a heightened awareness of their potential negative effects on my community.\n\n3"]}, {"persona": {"region": "Alexandria", "sex": "male", "age": 34, "country": "Egypt", "marital_status": "married", "education": "higher", "social_class": "working class"}, "question": {"id": "Q84", "variant": 0}, "response": ["Based on my emic perspective as a working-class male from Alexandria, Egypt, I have limited confidence in the International Monetary Fund (IMF) due to the socioeconomic background and cultural context of my community. The IMF's policies and programs are often seen as favoring the interests of wealthy nations and multinational corporations, which can have negative impacts on working-class individuals and their families. Additionally, my personal experiences and values lead me to be skeptical of international financial institutions that may not fully understand the challenges and needs of my community. Therefore, I have chosen option 3: Not very much."]}, {"persona": {"region": "Alexandria", "sex": "female", "age": 37, "country": "Egypt", "marital_status": "married", "education": "higher", "social_class": "lower middle class"}, "question": {"id": "Q84", "variant": 0}, "response": ["Based on my emic perspective as a married woman from Alexandria, Egypt, and considering my lower middle-class socioeconomic background, I have limited confidence in the International Monetary Fund (IMF). My personal experiences and values have shaped my understanding of economic policies and their impact on my community. Additionally, the cultural context of Egypt and the historical relationship between the IMF and the country's economic development have influenced my opinion. Furthermore, the nuance of the question also plays a role, as the wording \"how much confidence\" implies a spectrum of opinions rather than a binary yes or no answer. Therefore, I choose option (3) Not very much. \n\n3"]}, {"persona": {"region": "Alexandria", "sex": "female", "age": 56, "country": "Egypt", "marital_status": "divorced", "education": "middle", "social_class": "working class"}, "question": {"id": "Q84", "variant": 0}, "response": ["Based on the anthropological framework, as a divorced female from Alexandria, Egypt, my emic perspective would be influenced by my personal experience and socioeconomic background. Being part of the working class, I have likely experienced economic hardships and have seen the impact of IMF policies on my community. My etic perspective would take into account the cultural context of Egypt and the historical relationship between the IMF and the country. Considering these factors, I would choose option (3) Not very much, as I may have skepticism towards the IMF and its impact on the economic wellbeing of myself and my community."]}, {"persona": {"region": "Alexandria", "sex": "male", "age": 48, "country": "Egypt", "marital_status": "married", "education": "higher", "social_class": "working class"}, "question": {"id": "Q84", "variant": 0}, "response": ["Based on the anthropological framework, as a married male from Alexandria, Egypt, my emic perspective is influenced by my cultural context, individual values, and socioeconomic background. In Egypt, there is a sense of distrust towards international organizations like the IMF due to historical and political reasons. My personal experience and values as a working-class individual have led me to feel a lack of confidence in the IMF, as I believe their policies often benefit the wealthy at the expense of the working class. Additionally, the socioeconomic background of Egypt as a whole, with its struggles with debt and economic inequality, further shapes my perspective. Therefore, my answer to the question is (3) Not very much."]}, {"persona": {"region": "Alexandria", "sex": "female", "age": 30, "country": "Egypt", "marital_status": "married", "education": "middle", "social_class": "working class"}, "question": {"id": "Q84", "variant": 0}, "response": ["Based on the anthropological framework, as a married female from Alexandria, Egypt, who is 30 years old and part of the working class, my emic perspective is influenced by my cultural context, individual values, and socioeconomic background. In Egypt, there is a history of economic challenges and IMF interventions that have had mixed results. As a member of the working class, I have likely experienced the impact of these economic policies firsthand. Additionally, my personal experience and values may lead me to question the effectiveness of IMF policies in addressing the economic needs of people like me. Therefore, my confidence in the IMF may not be very high.\n\n3"]}, {"persona": {"region": "Alexandria", "sex": "male", "age": 19, "country": "Egypt", "marital_status": "single", "education": "middle", "social_class": "lower class"}, "question": {"id": "Q84", "variant": 0}, "response": ["From an emic perspective, as a member of the lower class in Alexandria, Egypt, my individual values and personal experience have led me to have not very much confidence in the IMF. My socioeconomic background and cultural context have shaped my understanding of the IMF's impact on my community and the global economy. Additionally, the space and time in which I live also play a role in my perception of the IMF's influence. Ultimately, my nuanced understanding of the IMF has led me to have not very much confidence in their actions and policies.\n\n3"]}, {"persona": {"region": "Alexandria", "sex": "male", "age": 45, "country": "Egypt", "marital_status": "married", "education": "middle", "social_class": "lower middle class"}, "question": {"id": "Q84", "variant": 0}, "response": ["Based on the anthropological framework, my perspective on the International Monetary Fund (IMF) is heavily influenced by my cultural context, individual values, and socioeconomic background. As a married male from Alexandria, Egypt, belonging to the lower middle class, I have experienced the impact of IMF policies on my community and the country as a whole. My personal experience and socioeconomic background lead me to have not very much confidence in the IMF. I have seen how IMF policies have contributed to economic instability and inequality in my country, and my cultural context has shaped my skepticism towards international financial institutions. Additionally, my lower middle-class status means that I have been directly affected by economic hardships, which further influences my lack of confidence in the IMF.\n\n3"]}, {"persona": {"region": "Alexandria", "sex": "male", "age": 23, "country": "Egypt", "marital_status": "single", "education": "higher", "social_class": "lower class"}, "question": {"id": "Q84", "variant": 0}, "response": ["Based on the anthropological framework, as a single male from Alexandria, Egypt, who considers himself part of the lower class, my emic perspective would likely be influenced by my personal experience and socioeconomic background. My cultural context and cultural relativism would also play a significant role in shaping my view. Being from a lower class background in Egypt, I may have experienced economic hardships and may have a distrust of international financial institutions like the IMF, which are often seen as serving the interests of wealthy countries and corporations. Additionally, Egypt has a complex history with the IMF, and its policies have often been criticized for exacerbating inequality and poverty in the country. Therefore, my confidence in the IMF would likely be low, as I may perceive it as having a negative impact on the economic well-being of people like myself.\n\n3"]}, {"persona": {"region": "Alexandria", "sex": "female", "age": 28, "country": "Egypt", "marital_status": "married", "education": "middle", "social_class": "working class"}, "question": {"id": "Q84", "variant": 0}, "response": ["From the perspective of a married female from Alexandria, Egypt, who is 28 years old, completed middle education, and considers herself part of the working class, the answer to the question about confidence in the International Monetary Fund (IMF) would be influenced by her cultural context, socioeconomic background, and personal experience. As a member of the working class in a country that has received loans and financial assistance from the IMF, her perception of the organization might be influenced by how its policies have affected her and her community. Additionally, her level of education and access to information about global financial institutions may shape her understanding and confidence in the IMF. Given the nuanced phrasing of the question and the factors outlined above, the persona described would likely select the following option:\n\n4) None at all"]}, {"persona": {"region": "Alexandria", "sex": "male", "age": 34, "country": "Egypt", "marital_status": "single", "education": "higher", "social_class": "working class"}, "question": {"id": "Q84", "variant": 0}, "response": ["Based on the anthropological framework, my perspective as a single male from Alexandria, Egypt, who is 34 years old and part of the working class, is heavily influenced by my cultural context, individual values, and socioeconomic background. In Egypt, working-class individuals often face economic challenges and have experienced the impact of IMF policies on their daily lives. My personal experiences and values lead me to have little confidence in the IMF as I have seen how their policies have negatively affected the economy and working-class families in Egypt. Additionally, the cultural relativism perspective reminds us that different cultures may have different views on international financial institutions. Therefore, based on my background and experiences, I would choose option (3) Not very much. \n\n3"]}, {"persona": {"region": "Alexandria", "sex": "male", "age": 30, "country": "Egypt", "marital_status": "married", "education": "higher", "social_class": "lower middle class"}, "question": {"id": "Q84", "variant": 0}, "response": ["Based on my emic perspective as a married male from Alexandria, Egypt, I have grown up in a cultural context where the IMF has often been viewed with skepticism due to its historical presence in Egypt and its impact on the country's economic policies. My personal experience and individual values also play a role in shaping my perception, as I have witnessed the socioeconomic challenges faced by my community and how they have been affected by IMF interventions. Additionally, my lower middle-class status has made me more aware of the socioeconomic background that influences my perspective. Overall, cultural relativism and the nuanced phrasing of the question also contribute to my response, as I have a nuanced understanding of the IMF's role in Egypt's economic development.\n\n3"]}, {"persona": {"region": "Alexandria", "sex": "female", "age": 49, "country": "Egypt", "marital_status": "married", "education": "higher", "social_class": "lower middle class"}, "question": {"id": "Q84", "variant": 0}, "response": ["Based on the anthropological framework, my emic perspective as a married female from Alexandria, Egypt, who is 49 years old and part of the lower middle class, is influenced by my cultural context, individual values, and socioeconomic background. In Egypt, there is a historical distrust of international organizations like the IMF due to their involvement in imposing economic policies that have negatively impacted the country in the past. Additionally, as a member of the lower middle class, I have personally experienced the effects of these policies on my family and community. Therefore, my confidence in the IMF is not very much. (3)\n\n3"]}, {"persona": {"region": "Kafr el-sheikh", "sex": "male", "age": 49, "country": "Egypt", "marital_status": "married", "education": "higher", "social_class": "working class"}, "question": {"id": "Q84", "variant": 0}, "response": ["Based on the anthropological framework, my emic perspective as a married male from Kafr el-sheikh, Egypt, who is 49 years old, has completed higher education, and considers myself part of the working class, shapes my confidence in the International Monetary Fund (IMF). My cultural context and socioeconomic background influence my perception of the IMF's impact on Egypt's economy and the working class. My personal experience and individual values also play a significant role in my confidence level. Additionally, cultural relativism and nuanced phrasing of the question are important in understanding my perspective. Therefore, my response to the question is:\n3"]}, {"persona": {"region": "Kafr el-sheikh", "sex": "male", "age": 25, "country": "Egypt", "marital_status": "single", "education": "middle", "social_class": "lower middle class"}, "question": {"id": "Q84", "variant": 0}, "response": ["From the perspective of a single male from Kafr el-sheikh, Egypt, who has completed middle education level and considers himself part of the lower middle class, the answer to the question of confidence in the International Monetary Fund (IMF) would be influenced by a combination of cultural context, individual values and personal experience, and socioeconomic background. Living in a lower middle class environment in Egypt, where there may be a lack of trust in international financial institutions due to economic struggles and political instability, this individual may have limited confidence in the IMF. Additionally, the cultural relativism perspective would also play a role, as the individual's cultural context and background may influence their perception of the IMF. \n\n3"]}, {"persona": {"region": "Kafr el-sheikh", "sex": "male", "age": 59, "country": "Egypt", "marital_status": "married", "education": "higher", "social_class": "lower middle class"}, "question": {"id": "Q84", "variant": 0}, "response": ["Based on the emic and etic perspectives, as a married male from Kafr el-sheikh, Egypt, I have been influenced by the cultural context and socioeconomic background of my community. My personal experience and individual values have shaped my perception and understanding of the International Monetary Fund (IMF). In the lower middle class, the IMF's policies and programs may have had a direct impact on my life and the lives of those around me. Therefore, my confidence in the IMF is not very high. Additionally, cultural relativism teaches us that different cultures have different perspectives, and in my community, there may be a skepticism towards international financial institutions. Furthermore, my age and place have also played a role in shaping my perception. Therefore, I would choose option (3) Not very much. \n\n3"]}, {"persona": {"region": "Kafr el-sheikh", "sex": "female", "age": 38, "country": "Egypt", "marital_status": "married", "education": "middle", "social_class": "working class"}, "question": {"id": "Q84", "variant": 0}, "response": ["Based on my emic perspective as a married female from Kafr el-sheikh, Egypt, with a middle education level and part of the working class, I have learned to view the IMF through the lens of my cultural context and socioeconomic background. In my community, there is a general distrust of international organizations like the IMF, as they are seen as imposing policies that often negatively impact the working class and contribute to economic hardships. Additionally, my personal experience and values have led me to be skeptical of institutions that are not rooted in the local context and do not necessarily have the best interests of people like me in mind. Therefore, I have little confidence in the IMF and its policies.\n\n3"]}, {"persona": {"region": "Kafr el-sheikh", "sex": "male", "age": 35, "country": "Egypt", "marital_status": "married", "education": "higher", "social_class": "lower middle class"}, "question": {"id": "Q84", "variant": 0}, "response": ["Based on my emic perspective as a lower middle class married male from Kafr el-sheikh, Egypt, I have been influenced by my cultural context and socioeconomic background. My personal experience and individual values also play a big role in shaping my perception. The IMF's policies and programs have had a direct impact on the economy and living conditions in Egypt, and as a result, I have observed the effects of their influence on my family and community. Therefore, I have a certain level of skepticism towards the IMF and their policies, as I believe they do not always prioritize the needs and well-being of individuals like myself.\n\n3"]}, {"persona": {"region": "Kafr el-sheikh", "sex": "male", "age": 49, "country": "Egypt", "marital_status": "married", "education": "middle", "social_class": "lower class"}, "question": {"id": "Q84", "variant": 0}, "response": ["Based on the anthropological framework, my emic perspective as a lower-class married male from Kafr el-sheikh, Egypt, with middle education, and 49 years of age, is heavily influenced by my cultural context, individual values, and socioeconomic background. In my community, there is a general lack of trust in international organizations and institutions like the IMF, as they are often seen as representing the interests of wealthier countries and not considering the needs and struggles of people like myself. Additionally, my personal experience and values have shaped my perception of these organizations, leading me to have a limited amount of confidence in the IMF. Therefore, I would choose option (3) Not very much, as this aligns with my personal and cultural perspective. \n\n3"]}, {"persona": {"region": "Kafr el-sheikh", "sex": "male", "age": 37, "country": "Egypt", "marital_status": "married", "education": "middle", "social_class": "lower class"}, "question": {"id": "Q84", "variant": 0}, "response": ["From the perspective of a married male from Kafr el-sheikh, Egypt, who has completed only middle education and considers himself part of the lower class, the answer to the question regarding confidence in the International Monetary Fund (IMF) would be influenced by several factors. Firstly, the individual's cultural context and socioeconomic background would shape their perception of the IMF, as they may have experienced the impact of IMF policies on their local economy and community. Additionally, their personal experience and individual values would play a significant role in their level of confidence in the IMF, as they may have had negative experiences with economic reforms or austerity measures imposed by the IMF. Finally, cultural relativism and nuance would also influence their response, as they may view the IMF through a lens that differs from those in higher socioeconomic classes or in Western countries.\n\n3"]}, {"persona": {"region": "Menofia", "sex": "female", "age": 22, "country": "Egypt", "marital_status": "single", "education": "middle", "social_class": "lower class"}, "question": {"id": "Q84", "variant": 0}, "response": ["Based on the anthropological framework, as a single female from Menofia, Egypt, who is 22 years old and part of the lower class, my emic perspective is shaped by my cultural context, individual values, and personal experience. Egypt has a history of economic struggles and IMF interventions have often been associated with austerity measures that have negatively impacted the lower class. Additionally, my personal experience and socioeconomic background have led me to have little confidence in the IMF. Therefore, I choose:\n3"]}, {"persona": {"region": "Menofia", "sex": "female", "age": 25, "country": "Egypt", "marital_status": "married", "education": "middle", "social_class": "lower class"}, "question": {"id": "Q84", "variant": 0}, "response": ["Based on my cultural context, as a married female from Menofia, Egypt, at the age of 25, and part of the lower class, my socioeconomic background and individual values play a significant role in shaping my perception of the International Monetary Fund (IMF). The IMF's policies and programs have often been criticized for their impact on developing countries, including Egypt, where there have been concerns about austerity measures and their effects on the most vulnerable populations. Additionally, my personal experiences and the experiences of those around me have led me to have little confidence in the IMF and its ability to positively impact the economic situation in my community. Therefore, I would choose option (3) Not very much. \n\n3"]}, {"persona": {"region": "Menofia", "sex": "male", "age": 28, "country": "Egypt", "marital_status": "single", "education": "higher", "social_class": "working class"}, "question": {"id": "Q84", "variant": 0}, "response": ["Based on the anthropological framework described above, as a single male from Menofia, Egypt, aged 28 and part of the working class, my perspective on the International Monetary Fund (IMF) is heavily influenced by my cultural context and socioeconomic background. Egypt has a history of IMF interventions, and many working-class individuals have experienced the negative effects of IMF policies on their livelihoods. Additionally, my personal experience and values lead me to have little confidence in the IMF, as I have witnessed its impact on the economy and society firsthand. Therefore, my answer is:\n\n3"]}, {"persona": {"region": "Menofia", "sex": "male", "age": 35, "country": "Egypt", "marital_status": "married", "education": "middle", "social_class": "lower middle class"}, "question": {"id": "Q84", "variant": 0}, "response": ["Based on my emic perspective as a married male from Menofia, Egypt, and my lower middle class socioeconomic background, I have limited confidence in the International Monetary Fund (IMF). My cultural context and personal experience have shaped my understanding of the IMF's impact on Egypt's economy, and I believe that their policies have not significantly improved the economic conditions for people like me. Additionally, the nuance of the question leads me to select \"Not very much\" confidence in the IMF because while I do believe they have some influence, it has not been enough to positively impact my life or the lives of those around me.\n\n3"]}, {"persona": {"region": "Menofia", "sex": "male", "age": 55, "country": "Egypt", "marital_status": "married", "education": "middle", "social_class": "working class"}, "question": {"id": "Q84", "variant": 0}, "response": ["Based on the anthropological framework, my emic perspective as a married male from Menofia, Egypt, who is 55 years old, has completed middle education, and considers myself part of the working class, is influenced by my cultural context, individual values, and socioeconomic background. In Egypt, there has been a long history of economic challenges and IMF interventions have often been associated with austerity measures that have negatively impacted the working class. Additionally, my cultural context and personal experience have shaped my view of the IMF, leading me to have not very much confidence in their actions. As a member of the working class, I have seen firsthand the effects of IMF policies that have led to increased economic hardship for people like myself. Therefore, my answer is:\n\n3\n\nNot very much"]}, {"persona": {"region": "Menofia", "sex": "male", "age": 53, "country": "Egypt", "marital_status": "married", "education": "higher", "social_class": "lower middle class"}, "question": {"id": "Q84", "variant": 0}, "response": ["Based on the anthropological framework, my perspective as a married male from Menofia, Egypt, who is 53 years old and part of the lower middle class, is heavily influenced by my cultural context, individual values, and socioeconomic background. In Egypt, there is a history of skepticism towards international financial institutions like the IMF, as they are often seen as imposing policies that benefit the wealthy elite at the expense of the working class. Additionally, my personal experience of struggling to make ends meet despite having completed higher education further reinforces my lack of confidence in the IMF, as I have not seen tangible benefits from their interventions. Therefore, I would choose option 3: Not very much. \n\n3"]}, {"persona": {"region": "Menofia", "sex": "male", "age": 59, "country": "Egypt", "marital_status": "married", "education": "middle", "social_class": "working class"}, "question": {"id": "Q84", "variant": 0}, "response": ["Based on the anthropological framework, as a married male from Menofia, Egypt, at 59 years of age with a middle education level and considering myself part of the working class, my perspective on the International Monetary Fund (IMF) is greatly influenced by my socioeconomic background, cultural context, and personal experience. As someone from a working-class background in Egypt, I have seen firsthand the impact of IMF policies on our economy and society. The IMF's structural adjustment programs have often been associated with austerity measures that disproportionately affect the working class and have led to economic hardships for many. Therefore, my confidence in the IMF is not very much. \n\n3"]}, {"persona": {"region": "Menofia", "sex": "female", "age": 42, "country": "Egypt", "marital_status": "married", "education": "middle", "social_class": "lower middle class"}, "question": {"id": "Q84", "variant": 0}, "response": ["Based on the anthropological framework, as a married female from Menofia, Egypt, my emic perspective and cultural context would influence my confidence in the IMF. Given my lower middle class socioeconomic background and limited educational attainment, I may not have much exposure to or understanding of the IMF's operations. Additionally, cultural relativism suggests that my perception of the IMF may be influenced by the broader political and economic context in Egypt, which may be critical of international financial institutions. My personal experience and individual values may also lead me to be skeptical of external organizations that may not have directly benefited my community. Therefore, I would choose option 3 - Not very much - as my confidence in the International Monetary Fund. \n\n3"]}, {"persona": {"region": "Menofia", "sex": "male", "age": 39, "country": "Egypt", "marital_status": "married", "education": "higher", "social_class": "working class"}, "question": {"id": "Q84", "variant": 0}, "response": ["From the emic perspective, as a married male from Menofia, Egypt, I have a strong sense of loyalty and connection to my community and country. The cultural context of Egypt has been shaped by a complex history and a deep sense of national pride, which has influenced my understanding of international institutions like the IMF. My individual values and personal experience, shaped by my higher education and working class background, lead me to have a nuanced view on the IMF. The IMF's policies and interventions have had a direct impact on Egypt's economy and my own socioeconomic status, which has led me to have less confidence in the IMF. Additionally, cultural relativism plays a role in my understanding, as I recognize that the IMF's approach may not align with the values and priorities of Egypt. Therefore, based on my perspective, I would choose option 3: Not very much.\n\n3"]}, {"persona": {"region": "Menofia", "sex": "male", "age": 34, "country": "Egypt", "marital_status": "married", "education": "middle", "social_class": "lower middle class"}, "question": {"id": "Q84", "variant": 0}, "response": ["Based on my cultural context in Menofia, Egypt, and my lower middle class socioeconomic background, I have limited confidence in the International Monetary Fund (IMF). The IMF's policies and programs have often been criticized for negatively impacting the economies and living standards of developing countries like Egypt. The IMF's structural adjustment programs have been associated with austerity measures that have led to increased poverty and inequality. Additionally, as someone with a middle education level, I have been exposed to alternative perspectives on the IMF's role in global financial systems, leading me to have a critical view of its actions. Therefore, I would choose option (3) Not very much."]}, {"persona": {"region": "Menofia", "sex": "male", "age": 22, "country": "Egypt", "marital_status": "single", "education": "higher", "social_class": "working class"}, "question": {"id": "Q84", "variant": 0}, "response": ["Based on the anthropological framework, my perspective as a single male from Menofia, Egypt, who is 22 years old, has completed higher education, and considers himself part of the working class, is heavily influenced by my cultural context, individual values, and socioeconomic background. In Menofia, the working class often experiences the direct impact of economic policies, including those enforced by the IMF. My personal experience and values lead me to have not very much confidence in the IMF, as I have seen firsthand the negative effects of their policies on my community and my family. Additionally, the socioeconomic background of being part of the working class further reinforces my lack of confidence in the IMF, as their policies often exacerbate existing economic inequalities. Therefore, my perspective is deeply rooted in my cultural context, personal experience, and socioeconomic background, which leads me to choose option 3: Not very much.\n\n3"]}, {"persona": {"region": "Menofia", "sex": "male", "age": 21, "country": "Egypt", "marital_status": "single", "education": "middle", "social_class": "working class"}, "question": {"id": "Q84", "variant": 0}, "response": ["Based on the anthropological framework, my answer to the question is influenced by my emic perspective as a working-class individual from Menofia, Egypt. My cultural context and socioeconomic background have shaped my perception of the IMF. My personal experience and individual values also play a significant role in my answer. Additionally, cultural relativism and the nuance of the question are important factors to consider. Therefore, my answer reflects the perspective of a 21-year-old working-class male from Menofia, Egypt. \n\n3"]}, {"persona": {"region": "Menofia", "sex": "male", "age": 36, "country": "Egypt", "marital_status": "married", "education": "higher", "social_class": "working class"}, "question": {"id": "Q84", "variant": 0}, "response": ["From the emic and etic perspectives, as a married male from Menofia, Egypt, I am part of a culture that has historically been impacted by IMF policies. The cultural context of my upbringing and education in Menofia, as well as my experience as a working-class individual, have shaped my understanding of the IMF's role in the global economy. Additionally, my socioeconomic background and personal values influence my perception of the IMF. Considering the principles of cultural relativism, my view on the IMF is likely to be more critical due to the historical and ongoing impact of IMF policies on Egypt and similar developing countries. Therefore, I would have \"Not very much\" confidence in the International Monetary Fund.\n\n3"]}, {"persona": {"region": "Menofia", "sex": "female", "age": 52, "country": "Egypt", "marital_status": "married", "education": "higher", "social_class": "lower middle class"}, "question": {"id": "Q84", "variant": 0}, "response": ["Based on my emic perspective as a married female from Menofia, Egypt, and considering my lower middle-class socioeconomic background, I have limited confidence in the International Monetary Fund (IMF). My cultural context and personal experience have taught me that IMF policies often benefit wealthier nations and individuals at the expense of those in lower socioeconomic brackets. As a member of the lower middle class, I have personally felt the negative impacts of IMF austerity measures and structural adjustment programs, which have exacerbated poverty and inequality in my community. Additionally, cultural relativism teaches me to be critical of global financial institutions that may not fully understand or consider the unique needs and challenges of my local context. Therefore, I have limited confidence in the IMF's ability to positively impact my life and the lives of others in similar socioeconomic positions.\n\n3"]}, {"persona": {"region": "Menofia", "sex": "male", "age": 52, "country": "Egypt", "marital_status": "married", "education": "higher", "social_class": "lower middle class"}, "question": {"id": "Q84", "variant": 0}, "response": ["Based on the anthropological framework, my perspective as a married male from Menofia, Egypt, who is 52 years old, educated to a higher level, and considers himself part of the lower middle class, is heavily influenced by my cultural context, individual values, and socioeconomic background. As someone from Menofia, Egypt, I have grown up in a community with a strong sense of pride and self-reliance, and I am wary of external influences on our economy and financial stability. Additionally, my lower middle class status means that I am keenly aware of the impact of economic policies on my family and community. Therefore, I have limited confidence in the International Monetary Fund (IMF) and its ability to address the economic challenges faced by Egypt.\n\n3"]}, {"persona": {"region": "Menofia", "sex": "male", "age": 39, "country": "Egypt", "marital_status": "married", "education": "middle", "social_class": "lower class"}, "question": {"id": "Q84", "variant": 0}, "response": ["Based on my emic perspective as a lower-class married male from Menofia, Egypt, my confidence in the International Monetary Fund (IMF) is influenced by my cultural context, individual values, and socioeconomic background. Historically, the IMF has been associated with imposing economic policies that have negatively impacted the livelihoods of people in Egypt, leading to increased poverty and inequality. Additionally, my personal experience and values have shaped my skepticism towards international financial institutions, as they often prioritize the interests of wealthy nations and corporations over the needs of the working class and marginalized communities. Therefore, I have limited confidence in the IMF's ability to address the economic challenges faced by people in Egypt, and I believe that alternative solutions are necessary to promote sustainable and equitable development in our country.\n\n3"]}, {"persona": {"region": "Menofia", "sex": "male", "age": 23, "country": "Egypt", "marital_status": "single", "education": "middle", "social_class": "lower middle class"}, "question": {"id": "Q84", "variant": 0}, "response": ["Based on the anthropological framework, my emic perspective as a 23-year-old male from Menofia, Egypt, who completed middle education and considers myself part of the lower middle class, is influenced by my cultural context, individual values, and socioeconomic background. In Egypt, there is a general skepticism towards international organizations like the IMF due to their historical involvement in economic policies that have negatively impacted the country. Additionally, as someone from the lower middle class, I have personally experienced the challenges of economic instability and inequality, which further influences my lack of confidence in the IMF. Therefore, my choice reflects my personal experience and the cultural context in which I am situated.\n\n3"]}, {"persona": {"region": "Dakahlia", "sex": "female", "age": 24, "country": "Egypt", "marital_status": "single", "education": "higher", "social_class": "lower middle class"}, "question": {"id": "Q84", "variant": 0}, "response": ["Based on the anthropological framework described above, my perspective on the International Monetary Fund (IMF) is influenced by a combination of my cultural context, individual values and personal experience, and socioeconomic background. As a single female from Dakahlia, Egypt, who is 24 years old and part of the lower middle class, I have been raised in a cultural context where the IMF's policies and interventions have had a significant impact on the economic and social landscape of my community. Additionally, my personal experience of navigating the challenges of higher education and limited financial resources has shaped my perception of international financial institutions. Considering these factors, I have limited confidence in the IMF's approach and interventions, as I believe they often prioritize the interests of wealthier nations and corporations over the needs of individuals and communities in developing countries like Egypt. Therefore, my answer to the question is:\n3. Not very much"]}, {"persona": {"region": "Dakahlia", "sex": "male", "age": 36, "country": "Egypt", "marital_status": "married", "education": "higher", "social_class": "upper middle class"}, "question": {"id": "Q84", "variant": 0}, "response": ["Based on the anthropological framework, my perspective as a married male from Dakahlia, Egypt, who is 36 years old, has completed higher education, and considers myself part of the upper middle class, is heavily influenced by my cultural context, individual values, and socioeconomic background. In Egypt, there is a general skepticism towards international financial institutions like the IMF due to historical and political reasons. However, as someone who has received a higher education and belongs to the upper middle class, I am more likely to have been exposed to positive narratives about the IMF and its potential to contribute to economic stability and growth. Additionally, my socioeconomic background may lead me to believe that the IMF's policies could benefit people in my social and economic circles. Therefore, my confidence in the IMF is likely to be higher compared to someone from a different cultural, educational, or socioeconomic background.\n\n2"]}, {"persona": {"region": "Dakahlia", "sex": "female", "age": 71, "country": "Egypt", "marital_status": "married", "education": "higher", "social_class": "upper middle class"}, "question": {"id": "Q84", "variant": 0}, "response": ["From the emic and etic perspectives, my cultural context as a married female from Dakahlia, Egypt, who is 71 years of age and part of the upper middle class, greatly influences my perception of the International Monetary Fund (IMF). My individual values and personal experience, shaped by my higher education level and socioeconomic background, lead me to have a great deal of confidence in the IMF. Additionally, cultural relativism is important to consider, as my understanding of the IMF may differ from others based on my age, place, and nuanced understanding of the organization. Therefore, based on my personal perspective and the anthropological framework, I select option (1) A great deal."]}, {"persona": {"region": "Dakahlia", "sex": "male", "age": 55, "country": "Egypt", "marital_status": "married", "education": "higher", "social_class": "upper middle class"}, "question": {"id": "Q84", "variant": 0}, "response": ["Based on the anthropological framework, as a married male from Dakahlia, Egypt, I would have a strong sense of cultural context and individual values. Being part of the upper middle class and having completed higher education, I would have a more global perspective and understanding of economic issues. My socioeconomic background would also play a role in shaping my view of the IMF. Additionally, being 55 years old, I would have lived through various economic changes and would have a nuanced understanding of the IMF's impact on Egypt. Therefore, my answer would be:\n\n2"]}, {"persona": {"region": "Dakahlia", "sex": "male", "age": 64, "country": "Egypt", "marital_status": "married", "education": "higher", "social_class": "lower middle class"}, "question": {"id": "Q84", "variant": 0}, "response": ["Based on the anthropological framework, my answer to the question about confidence in the IMF is influenced by my cultural context, individual values and personal experience, and socioeconomic background. As a married male from Dakahlia, Egypt, who is 64 years old and part of the lower middle class, my perception of the IMF is likely to be influenced by my personal experience with economic hardships and the impact of international financial policies on my community. Additionally, my cultural context and values may lead me to have skepticism towards international organizations and their impact on the economic well-being of my country. Therefore, my confidence in the IMF is likely to be not very much (3).\n\n3"]}, {"persona": {"region": "Dakahlia", "sex": "female", "age": 29, "country": "Egypt", "marital_status": "married", "education": "middle", "social_class": "lower class"}, "question": {"id": "Q84", "variant": 0}, "response": ["Based on the anthropological framework, my perspective is heavily influenced by my cultural context as a married female from Dakahlia, Egypt, with a middle education level and part of the lower class. My individual values and personal experience have shaped my perception of the IMF. My socioeconomic background also plays a significant role in how I view international organizations like the IMF. Cultural relativism is important to consider, as my understanding of the IMF is influenced by my cultural context and socioeconomic background. Additionally, space and time play a role as well, as my age and place of residence impact my perception. Given these factors, I choose option (3) Not very much, as my confidence in the IMF is influenced by my personal experience and cultural context. \n\n3"]}, {"persona": {"region": "Dakahlia", "sex": "female", "age": 40, "country": "Egypt", "marital_status": "married", "education": "middle", "social_class": "upper middle class"}, "question": {"id": "Q84", "variant": 0}, "response": ["Based on the anthropological framework, my answer to the question about the confidence in the International Monetary Fund (IMF) is influenced by my emic perspective as a married female from Dakahlia, Egypt, with a middle education level and part of the upper middle class. My cultural context and individual values lead me to have not very much confidence in the IMF. This is influenced by the historical and current economic policies of the IMF, which have often been criticized for not taking into account the specific cultural and socioeconomic contexts of countries like Egypt. Additionally, my personal experience and socioeconomic background lead me to believe that the IMF's policies may not always align with the best interests of individuals like myself and my community. Therefore, my answer is: 3) Not very much."]}, {"persona": {"region": "Dakahlia", "sex": "male", "age": 37, "country": "Egypt", "marital_status": "married", "education": "higher", "social_class": "lower middle class"}, "question": {"id": "Q84", "variant": 0}, "response": ["Based on the anthropological framework, my answer to the question of how much confidence I have in the International Monetary Fund (IMF) is influenced by various factors. As a lower middle-class individual from Dakahlia, Egypt, my cultural context and socioeconomic background play a significant role in shaping my perspective. My personal experience and values also inform my understanding of the IMF. Additionally, my age and location in Egypt further influence my perception. Considering cultural relativism, I understand that my perspective may differ from others based on their own cultural and socioeconomic backgrounds. Therefore, I choose option 3: Not very much."]}, {"persona": {"region": "Dakahlia", "sex": "female", "age": 45, "country": "Egypt", "marital_status": "married", "education": "middle", "social_class": "working class"}, "question": {"id": "Q84", "variant": 0}, "response": ["Based on the anthropological framework, as a married female from Dakahlia, Egypt, I am influenced by my cultural context, individual values, and socioeconomic background. In my community, the IMF's policies and interventions are often seen as detrimental to the working class and the middle education level individuals like myself. The IMF's emphasis on austerity measures and structural adjustments has led to economic hardships for many families in my community. Additionally, my personal experience and the experiences of those around me have shown that IMF policies have not been beneficial for our socioeconomic background. Therefore, I have very little confidence in the International Monetary Fund.\n\n3"]}, {"persona": {"region": "Dakahlia", "sex": "male", "age": 34, "country": "Egypt", "marital_status": "single", "education": "middle", "social_class": "lower middle class"}, "question": {"id": "Q84", "variant": 0}, "response": ["Based on my emic perspective as a single male from Dakahlia, Egypt, who has completed middle education and considers himself part of the lower middle class, my confidence in the International Monetary Fund (IMF) is not very high. The cultural context of Egypt, with its history of economic struggles and the impact of IMF policies on the country, has led me to be cautious about the IMF. My individual values and personal experience, shaped by my socioeconomic background, have also influenced my view. Additionally, cultural relativism reminds me that different cultures have different experiences with the IMF, and my nuanced understanding of the organization leads me to have limited confidence in it.\n\n3"]}, {"persona": {"region": "Dakahlia", "sex": "female", "age": 26, "country": "Egypt", "marital_status": "married", "education": "higher", "social_class": "upper middle class"}, "question": {"id": "Q84", "variant": 0}, "response": ["Based on my emic perspective as a married female from Dakahlia, Egypt, I have been exposed to a cultural context where the International Monetary Fund (IMF) has played a significant role in influencing economic policies and financial aid to the country. My personal experience and education have provided me with the understanding that IMF interventions have had both positive and negative impacts on the country's economy. Considering my socioeconomic background as part of the upper middle class, I have generally seen the IMF as having a positive influence on economic stability and development. Therefore, I have quite a lot of confidence in the International Monetary Fund (IMF).\n\n2"]}, {"persona": {"region": "Dakahlia", "sex": "male", "age": 21, "country": "Egypt", "marital_status": "single", "education": "middle", "social_class": "upper middle class"}, "question": {"id": "Q84", "variant": 0}, "response": ["Based on the anthropological framework, as a single male from Dakahlia, Egypt, my emic perspective shapes my understanding of the International Monetary Fund (IMF) and my confidence in it. My cultural context, individual values, and personal experience have influenced my perception of the IMF. Additionally, my socioeconomic background as part of the upper middle class also plays a role in my opinion. Furthermore, cultural relativism reminds me that different cultures have different understandings of global institutions like the IMF. Lastly, my age and place in society contribute to my nuanced understanding of the IMF.\n\n2"]}, {"persona": {"region": "Dakahlia", "sex": "female", "age": 32, "country": "Egypt", "marital_status": "married", "education": "middle", "social_class": "working class"}, "question": {"id": "Q84", "variant": 0}, "response": ["Based on the anthropological framework, my perspective is influenced by my cultural context, socioeconomic background, and personal experience. As a married female from Dakahlia, Egypt, I come from a working-class background and have completed a middle education level. In my cultural context, there is a general skepticism towards international organizations like the IMF, as they are often seen as representing the interests of wealthier nations and not necessarily benefiting the working class. Additionally, my personal experience and socioeconomic background have shaped my perception of the IMF, leading me to have not very much confidence in their actions and policies. Therefore, I choose:\n\n3. Not very much"]}, {"persona": {"region": "Dakahlia", "sex": "female", "age": 35, "country": "Egypt", "marital_status": "married", "education": "middle", "social_class": "upper middle class"}, "question": {"id": "Q84", "variant": 0}, "response": ["Based on the anthropological framework, my perspective as a married female from Dakahlia, Egypt, at 35 years of age and part of the upper middle class, is influenced by my cultural context, individual values, and socioeconomic background. In Egypt, there is a general skepticism towards international organizations like the IMF due to historical and political reasons. As someone with a middle education level and a comfortable socioeconomic background, I have been exposed to discussions about the IMF's impact on our country's economy. Additionally, the socioeconomic status of my family and peers also plays a role in shaping my perspective. Therefore, I have chosen option 3: Not very much. \n\n3"]}, {"persona": {"region": "Dakahlia", "sex": "male", "age": 33, "country": "Egypt", "marital_status": "married", "education": "middle", "social_class": "upper middle class"}, "question": {"id": "Q84", "variant": 0}, "response": ["Based on the anthropological framework, my answer to the question about confidence in the IMF is influenced by my cultural context, individual values, socioeconomic background, and space and time. As a married male from Dakahlia, Egypt, I come from a culture where trust in international organizations like the IMF may be influenced by historical and political factors. Additionally, my personal experience and values as a member of the upper middle class may lead me to have a different perspective on global financial institutions compared to others. Therefore, given my background and socioeconomic status, I would choose option 2: Quite a lot. \n\n2"]}, {"persona": {"region": "Dakahlia", "sex": "female", "age": 45, "country": "Egypt", "marital_status": "married", "education": "middle", "social_class": "upper middle class"}, "question": {"id": "Q84", "variant": 0}, "response": ["Based on the anthropological framework, my response to the question about the International Monetary Fund (IMF) would be shaped by my emic perspective as a married female from Dakahlia, Egypt, who is 45 years old and part of the upper middle class. My cultural context, socioeconomic background, and personal experience would all play a role in shaping my opinion. Additionally, my individual values and nuanced understanding of the IMF's impact on the Egyptian economy would influence my response. Therefore, my answer would be influenced by a combination of factors, including my cultural context, socioeconomic background, and personal experience.\n\n2"]}, {"persona": {"region": "Dakahlia", "sex": "male", "age": 30, "country": "Egypt", "marital_status": "married", "education": "middle", "social_class": "upper middle class"}, "question": {"id": "Q84", "variant": 0}, "response": ["Based on the anthropological framework, as a married male from Dakahlia, Egypt, my emic perspective is influenced by my cultural context, individual values, and socioeconomic background. In Egyptian society, there is a general distrust of international organizations like the IMF due to historical power imbalances and negative experiences with economic policies imposed by such organizations. Additionally, my personal experience and middle education level have shaped my understanding of global economic systems and the impact of IMF policies on my country. As a member of the upper middle class, I may have a more positive view of the IMF due to potential benefits for economic stability and growth. However, overall, my nuanced understanding of the IMF leads me to have not very much confidence in the organization due to its perceived negative impact on my country's economy and my community's well-being. \n\n3"]}, {"persona": {"region": "Dakahlia", "sex": "female", "age": 63, "country": "Egypt", "marital_status": "married", "education": "higher", "social_class": "lower middle class"}, "question": {"id": "Q84", "variant": 0}, "response": ["Based on the anthropological framework, as a married female from Dakahlia, Egypt, I have to consider my emic perspective as well as my cultural context. In my community, the IMF is often viewed with skepticism due to its history of imposing strict economic policies that have negatively impacted the livelihoods of many people. Additionally, my lower middle class socioeconomic background further influences my lack of confidence in the IMF, as I have personally experienced the economic hardships brought about by such policies. Therefore, I would choose option 3: Not very much.\n\n3"]}, {"persona": {"region": "Dakahlia", "sex": "male", "age": 28, "country": "Egypt", "marital_status": "single", "education": "higher", "social_class": "upper middle class"}, "question": {"id": "Q84", "variant": 0}, "response": ["Based on the anthropological framework, as a 28-year-old male from Dakahlia, Egypt, who has completed higher education and considers himself part of the upper middle class, my response to the question about the confidence in the International Monetary Fund (IMF) is influenced by my individual values, personal experience, and socioeconomic background. My higher education has exposed me to various economic theories and global financial systems, leading me to have a great deal of confidence in the IMF. Additionally, being part of the upper middle class, I may have benefited from economic stability and growth, which I attribute to the IMF's interventions and policies. Therefore, my response is based on my personal experience and socioeconomic background, which has shaped my confidence in the IMF.\n\n2"]}, {"persona": {"region": "Dakahlia", "sex": "female", "age": 24, "country": "Egypt", "marital_status": "married", "education": "higher", "social_class": "upper middle class"}, "question": {"id": "Q84", "variant": 0}, "response": ["Based on my emic perspective as a married female from Dakahlia, Egypt, I have been influenced by the cultural context and socioeconomic background of my upbringing and education. As part of the upper middle class, I have been exposed to the positive impacts of international financial institutions such as the IMF on economic stability and growth. Additionally, my higher education has provided me with a nuanced understanding of global economics and the role of organizations like the IMF. Therefore, I have a great deal of confidence in the IMF's ability to positively impact economic development and stability in Egypt and other countries.\n\n1"]}, {"persona": {"region": "Dakahlia", "sex": "male", "age": 20, "country": "Egypt", "marital_status": "single", "education": "middle", "social_class": "upper middle class"}, "question": {"id": "Q84", "variant": 0}, "response": ["Based on the anthropological framework, as a single male from Dakahlia, Egypt, my emic perspective on the International Monetary Fund (IMF) is influenced by my cultural context and socioeconomic background. In Egypt, there is a history of economic reform programs implemented with the support of the IMF, which have had mixed results. As someone from the upper middle class, I may have more exposure to discussions about international finance and economic policies, and may have a more positive view of the IMF's role in stabilizing the economy. Additionally, my individual values and personal experience may lead me to have greater confidence in the IMF's ability to address economic challenges. Therefore, I would select option (2) Quite a lot, as I have confidence in the IMF's ability to contribute to economic stability and growth. \n\n2"]}, {"persona": {"region": "Dakahlia", "sex": "male", "age": 45, "country": "Egypt", "marital_status": "married", "education": "middle", "social_class": "upper middle class"}, "question": {"id": "Q84", "variant": 0}, "response": ["Based on my emic perspective as a married male from Dakahlia, Egypt, my cultural context and individual values play a crucial role in shaping my confidence in the International Monetary Fund (IMF). As someone from an upper middle class background in Egypt, I have been influenced by the socioeconomic factors and cultural relativism in my country. My personal experience and values have led me to have not very much confidence in the IMF due to the historical impact of their policies on the Egyptian economy. Additionally, the nuance of the question also influences my response as it is important to consider the specific wording and phrasing. Therefore, my answer to the question is:\n3"]}, {"persona": {"region": "Dakahlia", "sex": "female", "age": 43, "country": "Egypt", "marital_status": "married", "education": "higher", "social_class": "upper middle class"}, "question": {"id": "Q84", "variant": 0}, "response": ["Based on the anthropological framework, my perspective on the International Monetary Fund (IMF) is shaped by my cultural context, individual values, and socioeconomic background. As a married female from Dakahlia, Egypt, who is 43 years old and part of the upper middle class, I have had higher education and have been exposed to economic and financial knowledge. Additionally, my cultural context and socioeconomic background have likely influenced my perception of the IMF and its impact on global and local economies. Therefore, my answer is:\n\n2"]}, {"persona": {"region": "Dakahlia", "sex": "female", "age": 20, "country": "Egypt", "marital_status": "single", "education": "middle", "social_class": "upper middle class"}, "question": {"id": "Q84", "variant": 0}, "response": ["Based on the anthropological framework, as a single female from Dakahlia, Egypt, I am influenced by my cultural context, individual values, and socioeconomic background. In my society, there is a general skepticism towards international organizations like the IMF due to historical and political reasons. As a member of the upper middle class, I have been exposed to discussions and viewpoints that are critical of the IMF's policies and their impact on Egypt's economy. Additionally, my personal experience and education level have shaped my understanding of economic issues, leading me to have a critical perspective on the IMF's involvement in my country. Therefore, I would choose option (3) Not very much. \n\n3"]}, {"persona": {"region": "Dakahlia", "sex": "female", "age": 40, "country": "Egypt", "marital_status": "single", "education": "middle", "social_class": "lower middle class"}, "question": {"id": "Q84", "variant": 0}, "response": ["Based on my emic perspective as a single female from Dakahlia, Egypt, and my lower middle class socioeconomic background, I have a limited amount of confidence in the International Monetary Fund (IMF). My personal experience and cultural context have shown me that IMF policies often lead to austerity measures that disproportionately affect those in lower socioeconomic positions, such as myself. Additionally, my individual values and personal experience have shaped my perception of the IMF as an institution that does not prioritize the needs and well-being of people like me. Therefore, I would choose option 3: Not very much."]}, {"persona": {"region": "Dakahlia", "sex": "female", "age": 33, "country": "Egypt", "marital_status": "married", "education": "higher", "social_class": "upper middle class"}, "question": {"id": "Q84", "variant": 0}, "response": ["Based on my emic perspective as a married female from Dakahlia, Egypt, I have a high level of confidence in the International Monetary Fund (IMF). In my cultural context, I have seen the positive impact of IMF programs in improving the economic stability of my country and region. My individual values and personal experience have also shaped my view, as I have witnessed the benefits of IMF support in my community. Additionally, my socioeconomic background as part of the upper middle class has likely shielded me from some of the negative effects that others may have experienced from IMF interventions. Therefore, I have a great deal of confidence in the IMF.\n\n1"]}, {"persona": {"region": "Dakahlia", "sex": "female", "age": 24, "country": "Egypt", "marital_status": "married", "education": "middle", "social_class": "working class"}, "question": {"id": "Q84", "variant": 0}, "response": ["Based on the anthropological framework, my perspective as a married female from Dakahlia, Egypt, who is 24 years old and part of the working class, is heavily influenced by my cultural context, socioeconomic background, and personal experience. In Egypt, there is a general skepticism towards international organizations like the IMF due to a long history of economic struggles and perceived interference in domestic affairs. As someone from the working class, I have personally experienced the challenges of economic instability and have seen the impact of IMF policies on my community. Therefore, my confidence in the IMF is not very much. \n\n3"]}, {"persona": {"region": "Dakahlia", "sex": "female", "age": 53, "country": "Egypt", "marital_status": "widowed", "education": "middle", "social_class": "working class"}, "question": {"id": "Q84", "variant": 0}, "response": ["Based on the anthropological framework, as a widowed female from Dakahlia, Egypt, who is 53 years old and part of the working class, my perspective on the International Monetary Fund (IMF) would be influenced by my cultural context, socioeconomic background, and personal experience. Living in a lower-middle-income country, I have seen the impact of IMF policies on my community and have experienced the effects of austerity measures. My socioeconomic background as a working-class individual also means that I am likely to be more critical of international financial institutions that are perceived to prioritize the interests of wealthier nations. Therefore, I would have \"Not very much\" confidence in the IMF.\n\n3"]}, {"persona": {"region": "Dakahlia", "sex": "female", "age": 30, "country": "Egypt", "marital_status": "single", "education": "middle", "social_class": "lower middle class"}, "question": {"id": "Q84", "variant": 0}, "response": ["Based on the anthropological framework, my emic perspective as a single female from Dakahlia, Egypt, who is part of the lower middle class, is heavily influenced by my cultural context, individual values, and socioeconomic background. Living in a region with a history of economic challenges, I have limited access to education and resources, which has shaped my understanding of international financial institutions like the IMF. The IMF's policies have often been criticized for exacerbating economic inequality and hardship in developing countries like Egypt, and my personal experience has led me to have little confidence in their effectiveness. Therefore, my answer is (3) Not very much."]}, {"persona": {"region": "Dakahlia", "sex": "male", "age": 53, "country": "Egypt", "marital_status": "married", "education": "higher", "social_class": "upper middle class"}, "question": {"id": "Q84", "variant": 0}, "response": ["Based on the anthropological framework, I must consider my cultural context, individual values, socioeconomic background, and age in order to answer this question. As a married male from Dakahlia, Egypt, who is 53 years old and part of the upper middle class, I have received a higher education and likely have a strong understanding of global economic systems. I am also aware of the impact of IMF policies on my country's economy and society. Given my background, I would have quite a lot of confidence in the International Monetary Fund (IMF) as I believe their policies and initiatives can positively impact the global economy and potentially benefit my own socioeconomic status and that of my community.\n\n2"]}, {"persona": {"region": "Dakahlia", "sex": "male", "age": 28, "country": "Egypt", "marital_status": "married", "education": "middle", "social_class": "working class"}, "question": {"id": "Q84", "variant": 0}, "response": ["Based on the anthropological framework, as a married male from Dakahlia, Egypt, my emic perspective is influenced by my cultural context, individual values, and socioeconomic background. In Egypt, there is a history of economic instability and government corruption, which has led to a lack of trust in international organizations like the IMF. Additionally, as a working-class individual with only a middle education level, I may feel marginalized and believe that IMF policies primarily benefit the wealthy and do not address the needs of people like myself. Therefore, I would have \"Not very much\" confidence in the International Monetary Fund (IMF) due to the negative impact I perceive it to have on my community and personal circumstances.\n\n3"]}, {"persona": {"region": "Dakahlia", "sex": "female", "age": 38, "country": "Egypt", "marital_status": "married", "education": "middle", "social_class": "upper middle class"}, "question": {"id": "Q84", "variant": 0}, "response": ["Based on my emic perspective as a married female from Dakahlia, Egypt, who is part of the upper middle class, I have been influenced by the cultural context and socioeconomic background of my upbringing. In my cultural context, there is a general perception of skepticism towards international organizations like the IMF, due to the history of their policies impacting our country's economy. Additionally, my personal experience and individual values have led me to have not very much confidence in the IMF. As someone who has completed middle education level, I have learned about the impact of IMF policies on our economy and have personally witnessed the effects. Therefore, I choose option 3: Not very much. \n\n3"]}, {"persona": {"region": "Gharbia", "sex": "male", "age": 27, "country": "Egypt", "marital_status": "single", "education": "higher", "social_class": "upper middle class"}, "question": {"id": "Q84", "variant": 0}, "response": ["Based on the anthropological framework, as a single male from Gharbia, Egypt, who is 27 years old and part of the upper middle class, my response to the question of confidence in the International Monetary Fund (IMF) is influenced by my cultural context, individual values, and socioeconomic background. In Egypt, the IMF has been involved in providing financial assistance and policy advice to the country, which has had both positive and negative effects on the economy and society. My higher education level has allowed me to critically analyze the impact of IMF policies, and my socioeconomic background as part of the upper middle class may lead me to have a higher level of confidence in the IMF due to the perceived benefits it has brought to the economy. Therefore, based on these factors, my response to the question would be:\n\n2\n\nQuite a lot"]}, {"persona": {"region": "Gharbia", "sex": "female", "age": 35, "country": "Egypt", "marital_status": "married", "education": "higher", "social_class": "upper middle class"}, "question": {"id": "Q84", "variant": 0}, "response": ["Based on my cultural context, as a married female from Gharbia, Egypt, I have been influenced by the socio-economic background of my upper middle class family, as well as my higher education level. My individual values and personal experience have also shaped my perspective. In this context, my confidence in the IMF is quite a lot. I have seen the positive impact of IMF programs on the economy and the standard of living in my community, and I believe that they play a crucial role in stabilizing the global economy.\n\n2"]}, {"persona": {"region": "Gharbia", "sex": "female", "age": 37, "country": "Egypt", "marital_status": "married", "education": "higher", "social_class": "upper middle class"}, "question": {"id": "Q84", "variant": 0}, "response": ["Based on the anthropological framework, as a married female from Gharbia, Egypt, who is 37 years old, has completed higher education, and considers herself part of the upper middle class, my perspective on the International Monetary Fund (IMF) is influenced by my cultural context, individual values, and socioeconomic background. In Egypt, the IMF has been involved in economic reform programs, which have had both positive and negative impacts on the country. As someone with a higher education level and part of the upper middle class, I may have a more favorable view of the IMF, as I may have personally benefited from economic reforms that have improved business opportunities and market access. Additionally, my socioeconomic background may lead me to have more confidence in international financial institutions like the IMF, as they are seen as sources of stability and support for economic growth. Therefore, I would choose option (2) Quite a lot. \n\n2"]}, {"persona": {"region": "Gharbia", "sex": "male", "age": 43, "country": "Egypt", "marital_status": "married", "education": "middle", "social_class": "lower middle class"}, "question": {"id": "Q84", "variant": 0}, "response": ["Based on the anthropological framework, as a married male from Gharbia, Egypt, with a lower middle-class background and a middle education level, my emic perspective on the International Monetary Fund (IMF) is likely to be influenced by the cultural context of my community, the socioeconomic background that shapes my views on global financial institutions, and the individual values and personal experiences that have shaped my perception of such organizations. Additionally, my age and place of residence will also influence how much confidence I have in the IMF. Therefore, I would choose option (3) Not very much, as my personal and cultural context would likely lead me to have reservations about the IMF's impact on my community and country. \n\n3"]}, {"persona": {"region": "Gharbia", "sex": "male", "age": 28, "country": "Egypt", "marital_status": "single", "education": "higher", "social_class": "lower middle class"}, "question": {"id": "Q84", "variant": 0}, "response": ["Based on the anthropological framework, as a 28-year-old single male from Gharbia, Egypt, who considers himself part of the lower middle class, my perspective on the International Monetary Fund (IMF) is heavily influenced by my cultural context, socioeconomic background, and personal values. Gharbia is a region with a history of socioeconomic challenges, and my experience as a member of the lower middle class has shaped my perception of international financial institutions. Additionally, my higher education has provided me with a critical understanding of global economic systems. Considering these factors, my confidence in the IMF is not very much. I believe that the IMF's policies and interventions often prioritize the interests of wealthy nations and corporations, leading to negative impacts on developing economies like Egypt. Therefore, I have limited confidence in the IMF's ability to promote equitable and sustainable economic development in my country and others like it.\n\n3"]}, {"persona": {"region": "Gharbia", "sex": "male", "age": 39, "country": "Egypt", "marital_status": "married", "education": "middle", "social_class": "lower middle class"}, "question": {"id": "Q84", "variant": 0}, "response": ["Based on the anthropological framework, my perspective as a married male from Gharbia, Egypt, who is 39 years old and part of the lower middle class, is influenced by my cultural context, individual values, and socioeconomic background. In my community, there is a general skepticism towards international organizations like the IMF due to historical experiences of economic policies that have not been favorable to the average citizen. Additionally, my personal experience and values lead me to be cautious about placing too much confidence in external organizations that may not fully understand the needs and challenges faced by individuals in my socioeconomic position. Therefore, my answer is:\n\n3"]}, {"persona": {"region": "Gharbia", "sex": "male", "age": 30, "country": "Egypt", "marital_status": "married", "education": "middle", "social_class": "lower middle class"}, "question": {"id": "Q84", "variant": 0}, "response": ["Based on my emic perspective as a lower middle class married man from Gharbia, Egypt, my cultural context and socioeconomic background play a significant role in shaping my views on the International Monetary Fund (IMF). My personal experience and individual values also influence my perception of the IMF. As someone with a middle education level, I have been exposed to different viewpoints on global financial institutions like the IMF and have developed a nuanced understanding of their impact on countries like Egypt. Additionally, my age and place of residence have exposed me to the socioeconomic challenges faced by my community, which further shapes my perspective on the IMF. Therefore, based on my cultural relativism and nuanced understanding, I would select option (3) Not very much."]}, {"persona": {"region": "Gharbia", "sex": "male", "age": 43, "country": "Egypt", "marital_status": "married", "education": "lower", "social_class": "lower middle class"}, "question": {"id": "Q84", "variant": 0}, "response": ["Based on my emic perspective, as a married male from Gharbia, Egypt, my cultural context and socioeconomic background play a huge role in shaping my views on the International Monetary Fund (IMF). My lower education level and lower middle-class status have also influenced my understanding of the IMF and its impact on my community. Additionally, my personal experience and individual values have led me to have a not very much confidence in the IMF. This is because I have seen how IMF policies have negatively affected people in my community, and I do not believe that it has their best interests at heart. Therefore, I choose option 3: Not very much."]}, {"persona": {"region": "Gharbia", "sex": "male", "age": 36, "country": "Egypt", "marital_status": "married", "education": "higher", "social_class": "lower middle class"}, "question": {"id": "Q84", "variant": 0}, "response": ["Based on my cultural context and socioeconomic background, as a married male from Gharbia, Egypt, I have a lower middle-class status and have completed higher education. My personal experience and values also play a significant role in shaping my perspective. Considering the emic and etic perspectives, and taking into account the cultural relativism, I understand that my perception of the IMF may be different from others. Given the historical and contemporary dynamics between Egypt and the IMF, as well as the impact of IMF policies on the socioeconomic conditions in my region, I have some reservations about the IMF. Therefore, my confidence in the International Monetary Fund is not very much. \n\n3"]}, {"persona": {"region": "Gharbia", "sex": "male", "age": 25, "country": "Egypt", "marital_status": "married", "education": "middle", "social_class": "upper middle class"}, "question": {"id": "Q84", "variant": 0}, "response": ["Based on the anthropological framework, as a married male from Gharbia, Egypt, who is 25 years old, completed middle education, and considers himself part of the upper middle class, I would answer this question with a great deal of confidence in the International Monetary Fund (IMF). This is because my socioeconomic background and level of education would likely lead me to have a positive view of international financial institutions and their impact on global economics. Additionally, my cultural context and personal values may lead me to see the IMF as a positive force for economic stability and growth. I also may have a nuanced understanding of the role that the IMF plays in the global economy, which would further contribute to my confidence in their work.\n\n1"]}, {"persona": {"region": "Gharbia", "sex": "male", "age": 31, "country": "Egypt", "marital_status": "married", "education": "middle", "social_class": "upper middle class"}, "question": {"id": "Q84", "variant": 0}, "response": ["Based on the anthropological framework, my response to the question regarding confidence in the International Monetary Fund (IMF) is influenced by my cultural context, socioeconomic background, and personal experience. As a married male from Gharbia, Egypt, with a middle education level and considering myself part of the upper middle class, I have been exposed to the economic policies and impact of international organizations like the IMF. In my cultural context, there may be a general skepticism towards external economic interventions, but given my socioeconomic background and education level, I have likely been exposed to more positive perspectives on the IMF's role in economic development. Additionally, my personal experience and values may lead me to have a greater level of confidence in the IMF's ability to positively impact the economy. Therefore, I choose option 2: Quite a lot. \n\n2"]}, {"persona": {"region": "Gharbia", "sex": "male", "age": 33, "country": "Egypt", "marital_status": "married", "education": "higher", "social_class": "lower middle class"}, "question": {"id": "Q84", "variant": 0}, "response": ["Based on the anthropological framework, my answer to the question of confidence in the International Monetary Fund (IMF) is influenced by my emic perspective as a married male from Gharbia, Egypt, my cultural context, individual values and personal experience, socioeconomic background, and the concept of cultural relativism. As someone from a lower middle class background in Egypt, I have experienced the impact of IMF policies on my community and have seen how they have often led to economic hardships. Additionally, my cultural context and personal values instill in me a sense of skepticism towards international financial institutions and their influence on our local economy. Therefore, I would choose:\n\n3. Not very much"]}, {"persona": {"region": "Gharbia", "sex": "male", "age": 26, "country": "Egypt", "marital_status": "single", "education": "higher", "social_class": "upper middle class"}, "question": {"id": "Q84", "variant": 0}, "response": ["Based on my personal experience and socioeconomic background, as a single male from Gharbia, Egypt, who has completed higher education and considers myself part of the upper middle class, I have been exposed to and have a better understanding of global economic policies and their impact on my country. My cultural context and individual values also play a role in shaping my confidence in the IMF. Additionally, my age and education level have given me the opportunity to critically analyze and understand the role of the IMF in global economic affairs. Therefore, I have a great deal of confidence in the International Monetary Fund (IMF) because of their expertise and ability to provide financial assistance and policy advice to countries in need.\n\n1"]}, {"persona": {"region": "Gharbia", "sex": "female", "age": 45, "country": "Egypt", "marital_status": "married", "education": "middle", "social_class": "lower middle class"}, "question": {"id": "Q84", "variant": 0}, "response": ["Based on my personal experience and socioeconomic background as a married female from Gharbia, Egypt, who has completed middle education and considers herself part of the lower middle class, I have limited confidence in the International Monetary Fund (IMF). My cultural context and individual values lead me to believe that the IMF's policies and programs often prioritize the interests of wealthy nations and corporations over the needs of developing countries like Egypt. Additionally, the IMF's history of imposing austerity measures has negatively impacted the livelihoods of people in my community and worsened economic inequality. Therefore, I have limited confidence in the IMF's ability to address the economic challenges facing Egypt and similar countries. \n\n3"]}, {"persona": {"region": "Gharbia", "sex": "female", "age": 55, "country": "Egypt", "marital_status": "married", "education": "middle", "social_class": "upper middle class"}, "question": {"id": "Q84", "variant": 0}, "response": ["From the perspective of a married female from Gharbia, Egypt, who is 55 years old, completed middle education, and considers herself part of the upper middle class, the answer to the question about confidence in the International Monetary Fund (IMF) is influenced by a combination of emic and etic perspectives. The cultural context of Egypt, including its history with the IMF and the impact of IMF policies on the country's economy, plays a significant role in shaping perceptions. Individual values and personal experiences, as well as socioeconomic background, also factor into the answer. Additionally, cultural relativism and the nuanced phrasing of the question will influence the response. \n\n2"]}, {"persona": {"region": "Gharbia", "sex": "female", "age": 27, "country": "Egypt", "marital_status": "married", "education": "higher", "social_class": "upper middle class"}, "question": {"id": "Q84", "variant": 0}, "response": ["Based on the anthropological framework, as a married female from Gharbia, Egypt, with a higher education level and part of the upper middle class, my emic perspective is influenced by the cultural context of my upbringing and education, as well as my socioeconomic background. My personal experience and values also play a significant role in shaping my perceptions. Additionally, my age and place also factor in my understanding of global financial institutions. Therefore, I have a great deal of confidence in the International Monetary Fund (IMF) as I believe in the stability and credibility of its financial policies and interventions. \n\n1"]}, {"persona": {"region": "Gharbia", "sex": "female", "age": 42, "country": "Egypt", "marital_status": "married", "education": "higher", "social_class": "upper middle class"}, "question": {"id": "Q84", "variant": 0}, "response": ["From the perspective of a married female from Gharbia, Egypt, who is 42 years old, has completed higher education, and considers herself part of the upper middle class, I would answer this question based on a combination of cultural context, individual values, and socioeconomic background. In Gharbia, there is a general understanding of the importance of international organizations like the IMF in stabilizing the global economy, and my higher education has provided me with a deeper understanding of economic policies and their impact. As part of the upper middle class, I am likely to have a positive view of the IMF's role in economic development and stability. Additionally, my personal experience and values may lead me to have confidence in the IMF's ability to support economic growth and financial stability in Egypt and around the world.\n\n2"]}, {"persona": {"region": "Gharbia", "sex": "female", "age": 32, "country": "Egypt", "marital_status": "married", "education": "middle", "social_class": "upper middle class"}, "question": {"id": "Q84", "variant": 0}, "response": ["As a married female from Gharbia, Egypt, my perspective on the International Monetary Fund (IMF) is influenced by my cultural context, socioeconomic background, and personal experience. In my community, there is a general sense of skepticism towards international organizations like the IMF due to the history of colonialism and the perception that they serve the interests of Western powers. Additionally, as someone from the upper middle class, I have seen firsthand the impact of IMF policies on our economy and society, which has led to a certain level of mistrust. Therefore, I would have \"Not very much\" confidence in the IMF. \n\n3"]}, {"persona": {"region": "Gharbia", "sex": "male", "age": 27, "country": "Egypt", "marital_status": "married", "education": "higher", "social_class": "upper middle class"}, "question": {"id": "Q84", "variant": 0}, "response": ["Based on the anthropological framework, as a married male from Gharbia, Egypt, with a higher education level and considering myself part of the upper middle class, I would approach the question of confidence in the International Monetary Fund (IMF) from a cultural, socioeconomic, and individual experience perspective. In Egyptian society, there is a general skepticism towards international financial institutions due to historical and political reasons. Additionally, my higher education level would make me more aware of the complexities of global economics, leading me to have a moderate level of confidence in the IMF. As a member of the upper middle class, I may have benefited from policies supported by the IMF, which would also contribute to my confidence in their work. Therefore, my answer would be \"2) Quite a lot\" as my personal and cultural context would lead me to have a positive view of the IMF."]}, {"persona": {"region": "Gharbia", "sex": "female", "age": 27, "country": "Egypt", "marital_status": "married", "education": "higher", "social_class": "lower middle class"}, "question": {"id": "Q84", "variant": 0}, "response": ["Based on my emic perspective as a married female from Gharbia, Egypt, I have a strong cultural context that influences my confidence in the International Monetary Fund. As part of the lower middle class, my socioeconomic background and personal experience with economic struggles lead me to have not very much confidence in the IMF. My understanding of cultural relativism also plays a role in my perspective, as I am aware of the power dynamics at play in global financial institutions. Additionally, my individual values and personal experience with the impact of IMF policies on my community further shape my lack of confidence in the organization. Therefore, I choose option (3) Not very much. \n\n3"]}, {"persona": {"region": "Gharbia", "sex": "female", "age": 37, "country": "Egypt", "marital_status": "married", "education": "middle", "social_class": "upper middle class"}, "question": {"id": "Q84", "variant": 0}, "response": ["Based on the anthropological framework, as a married female from Gharbia, Egypt, who is 37 years old and part of the upper middle class, my answer to the question about confidence in the International Monetary Fund (IMF) is influenced by my cultural context, individual values, and socioeconomic background. In Gharbia, there is a general skepticism towards international organizations and their impact on local economies. As someone with a middle education level and belonging to the upper middle class, I have been exposed to discussions about the IMF and its policies, which have often been viewed as favoring the interests of powerful nations over those of developing countries like Egypt. Additionally, my socioeconomic background has provided me with a level of financial stability that may lead me to be more critical of international financial institutions. Therefore, my answer reflects these influences.\n\n3"]}, {"persona": {"region": "Gharbia", "sex": "male", "age": 28, "country": "Egypt", "marital_status": "married", "education": "higher", "social_class": "working class"}, "question": {"id": "Q84", "variant": 0}, "response": ["Based on the anthropological framework, my response to the question about confidence in the International Monetary Fund (IMF) is influenced by my individual values and personal experience. As a married male from Gharbia, Egypt, who is 28 years old and part of the working class, my socioeconomic background plays a significant role in shaping my perspective. I have completed higher education, which has exposed me to different economic theories and global financial institutions. However, my cultural context and the experiences of my community in dealing with economic challenges have led me to have not very much confidence in the IMF. The IMF's policies and interventions have often been criticized for their impact on working-class individuals and their families in Egypt. Therefore, I perceive the IMF with skepticism, considering the potential implications for my community and the working class in general.\n\n3"]}, {"persona": {"region": "Gharbia", "sex": "female", "age": 50, "country": "Egypt", "marital_status": "married", "education": "middle", "social_class": "upper middle class"}, "question": {"id": "Q84", "variant": 0}, "response": ["Based on the anthropological framework, my response to the question of confidence in the International Monetary Fund (IMF) is influenced by my cultural context, individual values, and socioeconomic background. As a married female from Gharbia, Egypt, who is 50 years old and part of the upper middle class, my perception of the IMF is shaped by the cultural context of Egypt's relationship with international financial institutions, as well as my personal experience with economic policies. Additionally, my socioeconomic background as an upper middle class individual may lead me to have more confidence in the IMF due to potential benefits for the economy and financial stability. Therefore, my response is: \n\n2. Quite a lot"]}, {"persona": {"region": "Gharbia", "sex": "male", "age": 39, "country": "Egypt", "marital_status": "single", "education": "higher", "social_class": "working class"}, "question": {"id": "Q84", "variant": 0}, "response": ["Based on my emic perspective as a working-class male from Gharbia, Egypt, my confidence in the IMF is influenced by my cultural context, individual values, and socioeconomic background. My understanding is shaped by the fact that Egypt has a history of IMF interventions that have had mixed results, and my personal experience and values lead me to question the efficacy of their policies in addressing the needs of the working class. Additionally, my socioeconomic background and the impact of IMF policies on the Egyptian economy have also influenced my lack of confidence in the IMF. Therefore, my answer is:\n3"]}, {"persona": {"region": "Gharbia", "sex": "female", "age": 45, "country": "Egypt", "marital_status": "married", "education": "higher", "social_class": "upper middle class"}, "question": {"id": "Q84", "variant": 0}, "response": ["From the perspective of a married female from Gharbia, Egypt, who is 45 years old, has completed higher education, and considers herself part of the upper middle class, the answer to the question about confidence in the International Monetary Fund (IMF) will be influenced by various factors. The cultural context of Egypt and its complex relationship with international financial institutions, including the IMF, will play a significant role in the perception of the organization. Additionally, the socioeconomic background of the persona, being part of the upper middle class, may impact her views on the IMF. Furthermore, her individual values and personal experiences, shaped by her education and age, will also contribute to her perspective. Considering the nuanced phrasing of the question and the cultural relativism inherent in the persona's background, the answer will reflect a balanced assessment of the IMF's role and impact on Egypt's economic context.\n\n2"]}, {"persona": {"region": "Sharkia", "sex": "male", "age": 35, "country": "Egypt", "marital_status": "married", "education": "higher", "social_class": "upper middle class"}, "question": {"id": "Q84", "variant": 0}, "response": ["Based on my cultural context, as a married male from Sharkia, Egypt, I have been influenced by the socioeconomic background of my upper middle class status and my higher education level. My personal experience and individual values also play a significant role in shaping my perspective. In Egypt, the IMF has historically been associated with controversial economic policies that have had a significant impact on the country. Therefore, I have limited confidence in the IMF due to the negative consequences that its interventions have had on the Egyptian economy and society.\n\n3"]}, {"persona": {"region": "Sharkia", "sex": "female", "age": 55, "country": "Egypt", "marital_status": "married", "education": "middle", "social_class": "lower middle class"}, "question": {"id": "Q84", "variant": 0}, "response": ["Based on the anthropological framework, as a married female from Sharkia, Egypt, who is 55 years old and part of the lower middle class, my perspective on the International Monetary Fund (IMF) is influenced by my cultural context, socioeconomic background, and personal experience. Egypt has a history of IMF involvement in its economic policies, which has often been met with mixed reactions from the population. As someone from the lower middle class, I have experienced firsthand the impact of IMF policies on the cost of living and social services. Therefore, my confidence in the IMF is not very much (3).\n\n3"]}, {"persona": {"region": "Sharkia", "sex": "female", "age": 27, "country": "Egypt", "marital_status": "married", "education": "middle", "social_class": "lower middle class"}, "question": {"id": "Q84", "variant": 0}, "response": ["Based on the anthropological framework described, my perspective as a married female from Sharkia, Egypt, with a middle education level and part of the lower middle class, is shaped by my cultural context, individual values, and socioeconomic background. In Sharkia, there is a general sense of skepticism towards international organizations like the IMF due to past economic policies that have negatively impacted the local population. Additionally, my lower middle-class status means that I have experienced firsthand the challenges of economic inequality and may hold reservations about the IMF's impact on economic policies. Therefore, my confidence in the IMF is not very much.\n\n3"]}, {"persona": {"region": "Sharkia", "sex": "female", "age": 52, "country": "Egypt", "marital_status": "married", "education": "middle", "social_class": "lower middle class"}, "question": {"id": "Q84", "variant": 0}, "response": ["Based on the anthropological framework, my perspective as a married female from Sharkia, Egypt, who is 52 years old, has completed middle education, and considers herself part of the lower middle class, is shaped by my cultural context, individual values, and socioeconomic background. In Sharkia, there is a history of skepticism towards international organizations like the IMF due to perceived unequal power dynamics and past negative experiences with economic reforms. Additionally, as a member of the lower middle class, I have limited access to information and resources to fully understand the impact of IMF policies on my community. Therefore, my confidence in the IMF is not very much.\n\n3"]}, {"persona": {"region": "Sharkia", "sex": "male", "age": 36, "country": "Egypt", "marital_status": "married", "education": "middle", "social_class": "lower middle class"}, "question": {"id": "Q84", "variant": 0}, "response": ["From an anthropological perspective, my emic and etic perspective as a married male from Sharkia, Egypt, is influenced by my cultural context, individual values, and socioeconomic background. In my cultural context, there is a general skepticism towards international organizations and their impact on our local economy. As part of the lower middle class, I am keenly aware of the socioeconomic struggles faced by my community, and I am personally impacted by the policies and programs implemented by organizations like the IMF. Additionally, my personal experience and values shape my perception of the IMF and its influence on our country. Taking into account the cultural relativism and nuanced phrasing of the question, I choose the following option:\n\n3"]}, {"persona": {"region": "Sharkia", "sex": "female", "age": 20, "country": "Egypt", "marital_status": "single", "education": "middle", "social_class": "working class"}, "question": {"id": "Q84", "variant": 0}, "response": ["Based on the anthropological framework, as a single female from Sharkia, Egypt, with a middle education level and part of the working class, my perspective on the International Monetary Fund (IMF) will be influenced by my cultural context, individual values, and socioeconomic background. In Egypt, the IMF has been involved in economic restructuring programs that have had significant impacts on the working class and middle education level individuals, such as myself. This has led to a sense of skepticism and distrust towards the IMF, as their policies have often been seen as favoring the elite and exacerbating economic inequality. Additionally, my personal experience and the experiences of those around me have shaped my perception of the IMF, leading me to have not very much confidence in their actions. Therefore, my answer to the question is:\n3"]}, {"persona": {"region": "Sharkia", "sex": "male", "age": 60, "country": "Egypt", "marital_status": "married", "education": "middle", "social_class": "working class"}, "question": {"id": "Q84", "variant": 0}, "response": ["Based on the anthropological framework, my perspective as a married male from Sharkia, Egypt, who is 60 years old, completed middle education, and considers himself part of the working class, is heavily influenced by my cultural context, socioeconomic background, and personal experience. In Egypt, the IMF has been involved in restructuring the economy, which has often resulted in austerity measures that have significantly impacted the working class. Additionally, my limited education and socioeconomic background have not provided me with a comprehensive understanding of the IMF's policies and their implications. Therefore, I have limited confidence in the IMF's actions and their impact on my community.\n\n3"]}, {"persona": {"region": "Sharkia", "sex": "male", "age": 41, "country": "Egypt", "marital_status": "married", "education": "higher", "social_class": "upper middle class"}, "question": {"id": "Q84", "variant": 0}, "response": ["As a married male from Sharkia, Egypt, with a higher education level and part of the upper middle class, my perspective on the International Monetary Fund (IMF) is influenced by my cultural context, individual values, and socioeconomic background. In Egyptian society, there is a level of skepticism towards international organizations like the IMF due to historical relationships and policies that have affected the country's economy. Additionally, my higher education has provided me with a critical understanding of global financial systems and the potential impact of IMF interventions. As a member of the upper middle class, I have a vested interest in economic stability and growth, and I believe that working with organizations like the IMF can provide opportunities for investment and development. Therefore, based on my personal experience and understanding, I would choose option (2) Quite a lot. \n\n2"]}, {"persona": {"region": "Sharkia", "sex": "female", "age": 23, "country": "Egypt", "marital_status": "married", "education": "middle", "social_class": "lower middle class"}, "question": {"id": "Q84", "variant": 0}, "response": ["Based on the anthropological framework, my perspective on the International Monetary Fund (IMF) is influenced by various factors. As a married female from Sharkia, Egypt, I am part of the lower middle class and have completed middle education level. My cultural context and socioeconomic background have shaped my understanding of the IMF. Living in a region with limited economic opportunities, I have witnessed the impact of IMF policies on my community and have seen that they often benefit the wealthy and powerful while causing hardship for those in the lower socioeconomic classes. Additionally, my personal experience and individual values lead me to have limited confidence in the IMF. Therefore, my answer to the question \"How much confidence do you have in the International Monetary Fund (IMF)?\" is (3) Not very much."]}, {"persona": {"region": "Sharkia", "sex": "male", "age": 49, "country": "Egypt", "marital_status": "married", "education": "higher", "social_class": "upper middle class"}, "question": {"id": "Q84", "variant": 0}, "response": ["From the perspective of a married male from Sharkia, Egypt, who is 49 years old, has completed higher education, and identifies as part of the upper middle class, several factors come into play in determining his confidence in the International Monetary Fund (IMF). His cultural context as an Egyptian, his socioeconomic background as part of the upper middle class, and his individual values and personal experience will heavily influence his perception of the IMF. Additionally, his nuanced understanding of the IMF's impact on Egypt's economy and his understanding of cultural relativism will shape his response. Taking into account these factors, his confidence in the IMF may be influenced by a combination of his education, socioeconomic status, and personal experiences with economic policies. \n\n2"]}, {"persona": {"region": "Sharkia", "sex": "female", "age": 30, "country": "Egypt", "marital_status": "married", "education": "middle", "social_class": "upper middle class"}, "question": {"id": "Q84", "variant": 0}, "response": ["Based on the anthropological framework, my perspective as a married female from Sharkia, Egypt, who is 30 years old, completed middle education and considers herself part of the upper middle class, is heavily influenced by my cultural context, individual values, and socioeconomic background. In Sharkia, Egypt, the IMF's policies and interventions are often viewed with skepticism due to their impact on the economy and the livelihoods of the people. Additionally, my personal experience and values lead me to be cautious about placing too much confidence in external financial institutions, as I have seen the effects of economic policies on my community. Therefore, I would choose option (3) Not very much. \n\n3"]}, {"persona": {"region": "Sharkia", "sex": "male", "age": 39, "country": "Egypt", "marital_status": "married", "education": "higher", "social_class": "upper middle class"}, "question": {"id": "Q84", "variant": 0}, "response": ["Based on my emic perspective as a married male from Sharkia, Egypt, who has completed higher education and considers myself part of the upper middle class, my confidence in the International Monetary Fund (IMF) is quite a lot. This perspective is influenced by my cultural context, individual values, and socioeconomic background. In Sharkia, there is a general trust in international organizations like the IMF to help stabilize the economy and provide financial support. Additionally, my education has exposed me to the benefits of international financial institutions, and my socioeconomic status allows me to see the positive impact of IMF programs on the economy. This confidence is also shaped by my personal experience and the nuanced understanding of the role of international organizations in Egypt's economic development.\n\n2"]}, {"persona": {"region": "Sharkia", "sex": "female", "age": 26, "country": "Egypt", "marital_status": "married", "education": "middle", "social_class": "lower middle class"}, "question": {"id": "Q84", "variant": 0}, "response": ["Based on the anthropological framework, my emic perspective as a married female from Sharkia, Egypt, who is 26 years old and part of the lower middle class, is influenced by my cultural context, individual values, socioeconomic background, and space and time. In Sharkia, there is a general lack of confidence in international financial institutions due to a history of economic struggles and a belief that these institutions do not prioritize the needs of the lower middle class. Additionally, my personal experience and values have led me to be skeptical of the IMF's effectiveness in addressing the economic challenges faced by people in my community. Therefore, I would select option (3) Not very much, as this choice reflects my emic perspective and the nuanced phrasing of the question. \n\n3"]}, {"persona": {"region": "Sharkia", "sex": "female", "age": 48, "country": "Egypt", "marital_status": "married", "education": "middle", "social_class": "lower middle class"}, "question": {"id": "Q84", "variant": 0}, "response": ["Based on my cultural context and socioeconomic background, I have limited exposure and understanding of the International Monetary Fund (IMF). Additionally, my personal experience and individual values may lead me to have skepticism towards international organizations that may not have directly impacted my life. As part of the lower middle class in Sharkia, Egypt, I have not had much interaction with the IMF and my understanding of their work is limited. Therefore, I would choose option (3) Not very much."]}, {"persona": {"region": "Sharkia", "sex": "male", "age": 34, "country": "Egypt", "marital_status": "married", "education": "higher", "social_class": "upper middle class"}, "question": {"id": "Q84", "variant": 0}, "response": ["Based on my personal experience and cultural context as a married male from Sharkia, Egypt, with a higher education level and belonging to the upper middle class, my confidence in the International Monetary Fund (IMF) is quite a lot. The IMF has played a significant role in providing financial assistance to Egypt, and as a member of the upper middle class, I have observed the positive impact of IMF programs on the country's economy. Additionally, my socioeconomic background and education have instilled in me a sense of trust in international financial institutions like the IMF, as they are seen as key players in promoting economic stability and growth. Therefore, I have a great deal of confidence in the IMF and its initiatives.\n2"]}, {"persona": {"region": "Sharkia", "sex": "female", "age": 39, "country": "Egypt", "marital_status": "divorced", "education": "middle", "social_class": "lower middle class"}, "question": {"id": "Q84", "variant": 0}, "response": ["Based on the anthropological framework, as a divorced female from Sharkia, Egypt, who is part of the lower middle class and has completed middle education level, my emic perspective would be influenced by my personal experience, socioeconomic background, and cultural context. I may have limited exposure to international financial institutions like the IMF, and my trust in them may be influenced by the economic challenges I have faced. Additionally, my cultural context and values may shape my views on external financial organizations. Therefore, I would choose option (3) Not very much as my confidence level in the IMF. \n\n3"]}, {"persona": {"region": "Sharkia", "sex": "male", "age": 39, "country": "Egypt", "marital_status": "married", "education": "middle", "social_class": "upper middle class"}, "question": {"id": "Q84", "variant": 0}, "response": ["Based on the anthropological framework, my emic perspective as a married male from Sharkia, Egypt, would be influenced by my cultural context, individual values, socioeconomic background, and space and time. In Sharkia, there is a general distrust of international organizations like the IMF due to historical and political factors. My middle education level and upper middle class status also contribute to a more critical and informed viewpoint on global economic matters. Additionally, at 39 years of age, I have experienced economic fluctuations and understand the impact of IMF policies on my community. Therefore, my answer is:\n\n2"]}, {"persona": {"region": "Qaliubiya", "sex": "male", "age": 62, "country": "Egypt", "marital_status": "married", "education": "middle", "social_class": "working class"}, "question": {"id": "Q84", "variant": 0}, "response": ["From an emic perspective, as a married male from Qaliubiya, Egypt, who is 62 years old and part of the working class, my answer to the question of confidence in the International Monetary Fund (IMF) is heavily influenced by my cultural context, individual values, and socioeconomic background. Egypt has a complex history with the IMF and its economic policies, and as someone from the working class, I have likely experienced the impact of these policies firsthand. Additionally, my age and education level may shape my perception of the IMF and its role in shaping Egypt's economy. Moreover, my personal experience and values would lead me to have a nuanced understanding of the IMF's impact on my community and country. Therefore, my answer is based on a combination of these factors and my perception may be different from someone with a different cultural, socioeconomic, or educational background.\n\n3"]}, {"persona": {"region": "Qaliubiya", "sex": "male", "age": 33, "country": "Egypt", "marital_status": "married", "education": "middle", "social_class": "working class"}, "question": {"id": "Q84", "variant": 0}, "response": ["Based on the anthropological framework, my perspective as a married male from Qaliubiya, Egypt, at 33 years of age, with a middle education level and part of the working class, is heavily influenced by my cultural context, individual values, and socioeconomic background. In Egypt, there has been a history of economic struggle and the IMF has been involved in providing loans and advice to the Egyptian government. However, these policies have often been met with skepticism and criticism from the working class due to their perceived negative impact on the economy and living standards. Additionally, my personal experience and values lead me to question the IMF's effectiveness in addressing the economic challenges faced by people like me. Therefore, my confidence in the IMF is not very much.\n\n3"]}, {"persona": {"region": "Qaliubiya", "sex": "male", "age": 62, "country": "Egypt", "marital_status": "married", "education": "higher", "social_class": "lower middle class"}, "question": {"id": "Q84", "variant": 0}, "response": ["Based on my emic perspective as a married male from Qaliubiya, Egypt, I have a lower middle class socioeconomic background and have completed a higher education level. In the cultural context of Egypt, there is a history of IMF involvement in the country, which has had mixed results and has been met with skepticism by many. Additionally, my individual values and personal experience have led me to be cautious about international financial organizations like the IMF. From a cultural relativism standpoint, there is a nuanced understanding of the impact of IMF policies on different socioeconomic groups in Egypt, which informs my perception. Therefore, my answer to the question would be:\n3\n\n(3) Not very much"]}, {"persona": {"region": "Qaliubiya", "sex": "male", "age": 29, "country": "Egypt", "marital_status": "married", "education": "middle", "social_class": "working class"}, "question": {"id": "Q84", "variant": 0}, "response": ["Based on the anthropological framework, as a married male from Qaliubiya, Egypt, my emic perspective would be influenced by the cultural context of my region, my individual values and personal experiences, and my socioeconomic background. In Egypt, there is a history of skepticism towards international financial institutions like the IMF due to concerns about the impact of their policies on the working class and the broader population. Additionally, my middle education level may have provided me with limited exposure to the intricacies of international financial institutions, leading to a cautious approach. As a member of the working class, I may have experienced firsthand the impact of economic policies on my community, further influencing my perspective. Therefore, from this perspective, I would answer the question as follows:\n\n3\n\nNot very much"]}, {"persona": {"region": "Qaliubiya", "sex": "female", "age": 42, "country": "Egypt", "marital_status": "married", "education": "higher", "social_class": "working class"}, "question": {"id": "Q84", "variant": 0}, "response": ["Based on the anthropological framework, as a married female from Qaliubiya, Egypt, with a working-class background, my perspective on the International Monetary Fund (IMF) is informed by my cultural context, individual values, and socioeconomic background. I have witnessed the impact of IMF policies on my community and have personally experienced the socioeconomic challenges that they have exacerbated. Therefore, my confidence in the IMF is not very much (3).\n\n3"]}, {"persona": {"region": "Qaliubiya", "sex": "female", "age": 50, "country": "Egypt", "marital_status": "married", "education": "middle", "social_class": "lower middle class"}, "question": {"id": "Q84", "variant": 0}, "response": ["From the perspective of a married female from Qaliubiya, Egypt, who is 50 years old and part of the lower middle class, my answer to the question about the International Monetary Fund (IMF) would be influenced by my cultural context, socioeconomic background, and personal experience. Living in a region with economic challenges and limited access to resources, I have had to navigate financial struggles and rely on government support. This has likely shaped my view of international financial institutions like the IMF, which may be seen as inaccessible and disconnected from the everyday realities of individuals in my community. My limited education level also plays a role in my understanding of global financial systems, as I may not have the same level of exposure or understanding as those with higher education. Additionally, cultural relativism and the nuance of the question will influence my response, as I strive to convey my perspective accurately within the given framework.\n\n3"]}, {"persona": {"region": "Qaliubiya", "sex": "male", "age": 29, "country": "Egypt", "marital_status": "married", "education": "higher", "social_class": "lower middle class"}, "question": {"id": "Q84", "variant": 0}, "response": ["Based on the anthropological framework, my perspective is heavily influenced by my cultural context, individual values, socioeconomic background, and space and time. As a married male from Qaliubiya, Egypt, I am deeply embedded in a society that has historically had complicated relationships with international organizations like the IMF. My lower middle class socioeconomic background has also influenced my perception of the IMF, as I have seen firsthand the economic challenges faced by my community. Additionally, being 29 years old and having completed higher education, I am aware of the impact of IMF policies on my country's economy. Therefore, I have chosen option (3) Not very much, as my personal experiences and cultural context have led me to have limited confidence in the IMF's effectiveness in addressing the economic challenges faced by Egypt."]}, {"persona": {"region": "Qaliubiya", "sex": "male", "age": 35, "country": "Egypt", "marital_status": "married", "education": "higher", "social_class": "working class"}, "question": {"id": "Q84", "variant": 0}, "response": ["Based on the anthropological framework, my emic perspective as a married male from Qaliubiya, Egypt, with a working-class background and higher education level, is heavily influenced by my cultural context, individual values, and personal experience. In Egypt, the IMF has been involved in economic reforms and austerity measures that have had a significant impact on the working class and lower-income individuals. This has led to a general lack of confidence in the IMF and its policies, as they have often been seen as detrimental to the economic well-being of the average citizen. Additionally, my personal experience and values lead me to believe that the IMF's actions do not align with the best interests of people like myself. Therefore, I have chosen option 3: Not very much, as my response to the question regarding confidence in the International Monetary Fund.\n\n3"]}, {"persona": {"region": "Qaliubiya", "sex": "female", "age": 40, "country": "Egypt", "marital_status": "married", "education": "middle", "social_class": "working class"}, "question": {"id": "Q84", "variant": 0}, "response": ["Based on the anthropological framework, my perspective as a married female from Qaliubiya, Egypt, at 40 years of age with a middle education level and working-class background is heavily influenced by my cultural context, individual values, and socioeconomic background. My cultural context and socioeconomic background have likely led me to have limited exposure to the workings and impact of the IMF. Additionally, my individual values may lead me to be cautious and skeptical of large international organizations that may not have a direct impact on my daily life. Therefore, my confidence in the IMF is likely to be not very much. \n\n3"]}, {"persona": {"region": "Qaliubiya", "sex": "female", "age": 48, "country": "Egypt", "marital_status": "divorced", "education": "lower", "social_class": "working class"}, "question": {"id": "Q84", "variant": 0}, "response": ["Based on the anthropological framework, I, as a divorced female from Qaliubiya, Egypt, would approach the question of confidence in the International Monetary Fund (IMF) from my emic perspective, taking into account my cultural context, individual values, and socioeconomic background. As a member of the working class with a lower education level, I may have limited exposure to global economic policies and may not fully understand the IMF's impact on my daily life. Additionally, Egypt has a history of economic challenges and may have had negative experiences with IMF policies in the past. Therefore, I would approach the question with caution and limited confidence in the IMF's effectiveness in addressing the economic needs of people like me.\n\n3"]}, {"persona": {"region": "Qaliubiya", "sex": "male", "age": 46, "country": "Egypt", "marital_status": "married", "education": "middle", "social_class": "working class"}, "question": {"id": "Q84", "variant": 0}, "response": ["Based on the anthropological framework, I, as a married male from Qaliubiya, Egypt, would approach the question of confidence in the International Monetary Fund (IMF) from an emic perspective, considering my own personal values and experiences, as well as my cultural context and socioeconomic background. Being part of the working class in Egypt, I have likely experienced the impact of IMF policies on my community and understand the complexities of global financial institutions. Additionally, my age and education level may also shape my understanding of the IMF. Therefore, my answer to the question is:\n\n3"]}, {"persona": {"region": "Qaliubiya", "sex": "male", "age": 47, "country": "Egypt", "marital_status": "married", "education": "higher", "social_class": "lower middle class"}, "question": {"id": "Q84", "variant": 0}, "response": ["Based on the anthropological framework, my emic perspective as a married male from Qaliubiya, Egypt, who is 47 years old and part of the lower middle class, is influenced by my cultural context, individual values, and socioeconomic background. In Egypt, the IMF has historically been viewed with skepticism due to its role in implementing economic policies that have negatively impacted the country's lower and middle classes. Additionally, my personal experience and values lead me to question the IMF's intentions and efficacy in addressing Egypt's economic challenges. Therefore, I would choose option (3) Not very much, as my perspective aligns with the skepticism and lack of confidence in the IMF based on my cultural and socioeconomic context.\n\n3"]}, {"persona": {"region": "Qaliubiya", "sex": "female", "age": 38, "country": "Egypt", "marital_status": "married", "education": "higher", "social_class": "working class"}, "question": {"id": "Q84", "variant": 0}, "response": ["Based on the anthropological framework, my perspective on the International Monetary Fund (IMF) is influenced by my cultural context as a married female from Qaliubiya, Egypt. The socioeconomic background of being part of the working class and having completed higher education also plays a significant role in shaping my views. Additionally, my individual values and personal experience have influenced my confidence in the IMF. As someone who has experienced the impact of economic policies on my family and community, I have observed the effects of IMF interventions. Considering the nuanced phrasing of the question and the cultural relativism aspect of the framework, I choose:\n\n2"]}, {"persona": {"region": "Qaliubiya", "sex": "male", "age": 58, "country": "Egypt", "marital_status": "married", "education": "middle", "social_class": "working class"}, "question": {"id": "Q84", "variant": 0}, "response": ["Based on the anthropological framework, as a married male from Qaliubiya, Egypt, I would have a strong cultural context and individual values shaped by my middle education level and working-class status. My perception of the International Monetary Fund (IMF) would likely be influenced by my socioeconomic background and personal experience with economic policies. Additionally, my age and place of living would also play a role in shaping my understanding of the IMF. Taking into account the cultural relativism and nuanced phrasing of the question, I would choose the option (3) Not very much, as my experience and socio-economic background may lead me to have reservations about the IMF's impact on my community and country. \n\n3"]}, {"persona": {"region": "Qaliubiya", "sex": "female", "age": 27, "country": "Egypt", "marital_status": "married", "education": "higher", "social_class": "working class"}, "question": {"id": "Q84", "variant": 0}, "response": ["Based on the anthropological framework, as a married female from Qaliubiya, Egypt, with a higher education level and working-class background, my emic perspective is influenced by my personal experience and socioeconomic background. My cultural context and individual values shape my perception of organizations like the International Monetary Fund. Considering cultural relativism, I understand that different cultures may have varying levels of confidence in the IMF, and space and time may also play a role in shaping my perspective. Therefore, I choose option (3) Not very much. \n\n3"]}, {"persona": {"region": "Qaliubiya", "sex": "female", "age": 48, "country": "Egypt", "marital_status": "married", "education": "middle", "social_class": "upper middle class"}, "question": {"id": "Q84", "variant": 0}, "response": ["Based on the anthropological framework, my answer to the question about confidence in the International Monetary Fund (IMF) is influenced by my cultural context, socioeconomic background, and individual values. As a married female from Qaliubiya, Egypt, belonging to the upper middle class, my perspective is shaped by the economic and political impact of IMF programs in my country. My socioeconomic background and education level have provided me with a nuanced understanding of the IMF's role in shaping economic policies. Additionally, my cultural context and personal experience have led me to have not very much confidence in the IMF due to the perceived negative effects of its programs on the Egyptian economy and society.\n\n3"]}, {"persona": {"region": "Giza", "sex": "female", "age": 19, "country": "Egypt", "marital_status": "single", "education": "middle", "social_class": "working class"}, "question": {"id": "Q84", "variant": 0}, "response": ["Based on the anthropological framework, my perspective as a single female from Giza, Egypt, who has completed middle education and considers herself part of the working class, is shaped by my cultural context, individual values, and socioeconomic background. In Egypt, there is a general skepticism towards international organizations such as the IMF due to the perceived negative impact of their policies on the working class and the economy as a whole. Additionally, my personal experience and values lead me to believe that the IMF does not have the best interests of the working class in mind. Therefore, I would choose:\n\n3"]}, {"persona": {"region": "Giza", "sex": "female", "age": 38, "country": "Egypt", "marital_status": "married", "education": "higher", "social_class": "lower middle class"}, "question": {"id": "Q84", "variant": 0}, "response": ["From the perspective of a married female from Giza, Egypt, who is 38 years old, has completed higher education, and considers herself part of the lower middle class, the emic and etic perspectives, cultural context, individual values and personal experience, socioeconomic background, and cultural relativism all play a role in how this question is understood and answered. As an individual with a lower middle class socioeconomic background, the perception of the IMF may be influenced by personal experiences with economic hardships and the impact of IMF policies on the local economy. Additionally, the cultural context of Egypt, as well as the individual's personal values, may shape their level of confidence in the IMF. Therefore, the answer chosen will reflect these nuanced factors and the subjective understanding of the IMF from this specific perspective.\n\n4"]}, {"persona": {"region": "Beni Swaif/Beni Suef", "sex": "female", "age": 34, "country": "Egypt", "marital_status": "divorced", "education": "higher", "social_class": "lower class"}, "question": {"id": "Q84", "variant": 0}, "response": ["Based on the anthropological framework, my emic perspective as a divorced female from Beni Suef, Egypt, who considers herself part of the lower class, is influenced by my cultural context, individual values, and socioeconomic background. In my cultural context, there is a history of economic hardship and inequality, which has shaped my personal experience and individual values. As someone from the lower class, I have been directly impacted by the economic policies and decisions of international organizations like the IMF. Given this, I have little confidence in the IMF as I believe it does not prioritize the needs and concerns of people like me, who are struggling to make ends meet. Therefore, my answer to the question would be:\n3"]}, {"persona": {"region": "Beni Swaif/Beni Suef", "sex": "male", "age": 20, "country": "Egypt", "marital_status": "single", "education": "higher", "social_class": "working class"}, "question": {"id": "Q84", "variant": 0}, "response": ["Based on the anthropological framework, my response is influenced by my emic perspective as a working-class individual from Beni Suef, Egypt. My cultural context and socioeconomic background have shaped my view, as I have experienced the impact of IMF policies on my community. Additionally, my personal experience and individual values have led me to believe that the IMF's policies have not been beneficial for people like me. Therefore, I have little confidence in the IMF.\n\n3"]}, {"persona": {"region": "Giza", "sex": "male", "age": 19, "country": "Egypt", "marital_status": "single", "education": "middle", "social_class": "upper middle class"}, "question": {"id": "Q84", "variant": 0}, "response": ["Based on my emic perspective, as a 19-year-old from Giza, Egypt, who considers myself part of the upper middle class, my personal experience and socioeconomic background significantly influence my perception of the International Monetary Fund (IMF). My family's economic status and the access to resources have shaped my understanding of global financial institutions. Additionally, the cultural context of Egypt and its relationship with international organizations like the IMF also plays a role in my perspective. Furthermore, my age and educational level impact my understanding of economic policies and global financial systems. Therefore, I choose option 2: Quite a lot, as I believe the IMF plays a significant role in global economic stability and development."]}, {"persona": {"region": "Giza", "sex": "female", "age": 33, "country": "Egypt", "marital_status": "married", "education": "middle", "social_class": "working class"}, "question": {"id": "Q84", "variant": 0}, "response": ["Based on my emic perspective as a married female from Giza, Egypt, who is part of the working class and has completed middle education level, I have grown up in a cultural context where my socioeconomic background has been a significant factor in shaping my views. My personal experience and individual values have also influenced my perspective. Additionally, cultural relativism is important to consider, as my age and place in society have played a role in my understanding of the world. Therefore, my answer to the question is 3) Not very much."]}, {"persona": {"region": "Giza", "sex": "female", "age": 24, "country": "Egypt", "marital_status": "married", "education": "higher", "social_class": "working class"}, "question": {"id": "Q84", "variant": 0}, "response": ["Based on the anthropological framework, my emic perspective as a married female from Giza, Egypt, with a working-class background and higher education, is influenced by my cultural context, individual values, and personal experience. My cultural context includes the economic challenges faced by my community, where many people struggle to make ends meet. Additionally, my personal experience and values have led me to be cautious in placing my trust in international organizations, as I have seen firsthand the impact of economic policies on my family and community. Therefore, my answer is: \n3"]}, {"persona": {"region": "Giza", "sex": "male", "age": 50, "country": "Egypt", "marital_status": "married", "education": "higher", "social_class": "working class"}, "question": {"id": "Q84", "variant": 0}, "response": ["Based on my emic perspective as a married male from Giza, Egypt, with a working-class background and higher education, my cultural context and socioeconomic background play a pivotal role in shaping my views on the International Monetary Fund (IMF). As an individual with personal experience and values, I understand the impact of IMF policies on my community and the country as a whole. Considering cultural relativism, I believe that the IMF's policies may not always align with the values and needs of the Egyptian people. Additionally, my nuanced understanding of the IMF's role in the global economy and its historical impact on Egypt leads me to have (3) Not very much confidence in the International Monetary Fund."]}, {"persona": {"region": "Beni Swaif/Beni Suef", "sex": "female", "age": 26, "country": "Egypt", "marital_status": "married", "education": "higher", "social_class": "lower middle class"}, "question": {"id": "Q84", "variant": 0}, "response": ["Based on the anthropological framework, my personal values and experiences, along with my socioeconomic background and cultural context, greatly influence my perception of the International Monetary Fund (IMF). As a lower middle class, educated woman from Beni Swaif/Beni Suef, Egypt, I have had limited exposure to the workings of the IMF and its impact on my community. My cultural relativism also plays a role in my understanding of global financial institutions. Therefore, I have limited confidence in the IMF's ability to positively impact my life and the lives of those around me.\n\n3"]}, {"persona": {"region": "Beni Swaif/Beni Suef", "sex": "male", "age": 40, "country": "Egypt", "marital_status": "single", "education": "lower", "social_class": "lower class"}, "question": {"id": "Q84", "variant": 0}, "response": ["Based on the anthropological framework, my emic perspective as a lower class individual from Beni Swaif, Egypt is influenced by my cultural context, individual values, and socioeconomic background. I have limited access to education and resources, and I am more likely to be impacted by the policies and decisions made by organizations such as the IMF. My personal experience and cultural relativism also shape my understanding of the IMF and its impact on people like me. Therefore, my confidence in the IMF is likely to be low. \n\n3"]}, {"persona": {"region": "Beni Swaif/Beni Suef", "sex": "female", "age": 25, "country": "Egypt", "marital_status": "married", "education": "middle", "social_class": "lower middle class"}, "question": {"id": "Q84", "variant": 0}, "response": ["Based on the anthropological framework, my answer to the question of how much confidence I have in the International Monetary Fund (IMF) is influenced by my cultural context, individual values and personal experience, and socioeconomic background. As a married female from Beni Swaif/Beni Suef, Egypt, with a middle education level and lower middle-class status, I have experienced the impact of economic policies and international financial institutions on my community. My personal experience and socioeconomic background lead me to have not very much confidence in the IMF. I have seen how their policies have affected the economy and people's livelihoods in my region, and I have personal values that lead me to believe that their actions do not always benefit people like me.\n\n3"]}, {"persona": {"region": "Beni Swaif/Beni Suef", "sex": "female", "age": 21, "country": "Egypt", "marital_status": "single", "education": "middle", "social_class": "lower middle class"}, "question": {"id": "Q84", "variant": 0}, "response": ["Based on the anthropological framework, my emic perspective as a single female from Beni Suef, Egypt, would be influenced by my cultural context, individual values, socioeconomic background, and space and time. In my cultural context, there is a general mistrust of international organizations and their impact on our economy. As an individual from the lower middle class, I have experienced the struggles of economic instability and have seen firsthand the impact of IMF policies on my community. Therefore, I would have a low level of confidence in the IMF. Option 3: Not very much"]}, {"persona": {"region": "Beni Swaif/Beni Suef", "sex": "male", "age": 48, "country": "Egypt", "marital_status": "married", "education": "middle", "social_class": "lower middle class"}, "question": {"id": "Q84", "variant": 0}, "response": ["Based on my emic perspective as a married male from Beni Swaif, Egypt, I have to consider the cultural context, my individual values and personal experience, and my socioeconomic background in answering this question. In my community, there is a general lack of trust in international organizations and their influence on our economy. Additionally, as someone from the lower middle class, I have personally experienced the challenges of economic instability and the impact of IMF policies on our local economy. Therefore, I do not have much confidence in the International Monetary Fund.\n\n3"]}, {"persona": {"region": "Beni Swaif/Beni Suef", "sex": "female", "age": 57, "country": "Egypt", "marital_status": "married", "education": "middle", "social_class": "working class"}, "question": {"id": "Q84", "variant": 0}, "response": ["Based on the anthropological framework, my perspective on the International Monetary Fund (IMF) is influenced by a combination of cultural context, individual values, socioeconomic background, and nuance. As a married female from Beni Swaif/Beni Suef, Egypt, who is 57 years old, completed middle education, and considers herself part of the working class, my confidence in the IMF is likely to be influenced by the economic and political challenges faced by my community and country. Additionally, my personal experience and values may lead me to have a nuanced view of the IMF, considering both its potential benefits and drawbacks for people in my socioeconomic position. Therefore, my response to the question is:\n\n3. Not very much"]}, {"persona": {"region": "Beni Swaif/Beni Suef", "sex": "male", "age": 20, "country": "Egypt", "marital_status": "single", "education": "middle", "social_class": "working class"}, "question": {"id": "Q84", "variant": 0}, "response": ["Based on the anthropological framework, my emic perspective as a working-class individual from Beni Suef, Egypt, is heavily influenced by my cultural context, individual values, and socioeconomic background. In my cultural context, there is a general sense of skepticism towards international institutions like the IMF, as they are often seen as distant and disconnected from the everyday struggles of working-class people. Additionally, my personal experience and values lead me to believe that the IMF's policies disproportionately impact people like me, leading to a lack of trust in their actions. Furthermore, my socioeconomic background as a working-class individual means that I am more likely to feel the negative effects of IMF policies, further contributing to my lack of confidence in the institution.\n\n3"]}, {"persona": {"region": "Giza", "sex": "female", "age": 59, "country": "Egypt", "marital_status": "married", "education": "higher", "social_class": "upper middle class"}, "question": {"id": "Q84", "variant": 0}, "response": ["Based on the anthropological framework, my response to the question on confidence in the International Monetary Fund (IMF) is influenced by my cultural context, individual values, and socioeconomic background. As a married female from Giza, Egypt, who is 59 years old with a higher education level and considers herself part of the upper middle class, my perspective is likely to be shaped by the historical and economic context of Egypt, as well as my educational and socioeconomic status. My personal experience and values would also play a role in forming my opinion on the IMF. Therefore, my response is likely to reflect a nuanced understanding of the IMF's impact on Egypt and the global economy, and it would be influenced by a range of factors including the country's relationship with the IMF, the efficacy of IMF policies, and the potential impact on my own socioeconomic status and that of my community. \n\n2"]}, {"persona": {"region": "Giza", "sex": "female", "age": 38, "country": "Egypt", "marital_status": "single", "education": "higher", "social_class": "lower middle class"}, "question": {"id": "Q84", "variant": 0}, "response": ["As a single female from Giza, Egypt, my perspective on the International Monetary Fund (IMF) is heavily influenced by my cultural context, socioeconomic background, and personal experience. Living in a lower middle-class community, I have witnessed the impact of IMF policies on my own family and neighbors. The IMF's loan conditions often lead to austerity measures that disproportionately affect the working class and the poor, causing economic hardships and social unrest. As someone who values social justice and economic equity, I have little confidence in the IMF's ability to address the needs of the most vulnerable populations in Egypt and around the world.\n\n3"]}, {"persona": {"region": "Giza", "sex": "female", "age": 26, "country": "Egypt", "marital_status": "single", "education": "higher", "social_class": "working class"}, "question": {"id": "Q84", "variant": 0}, "response": ["From the perspective of a single female from Giza, Egypt, who is 26 years old, has completed higher education, and considers herself part of the working class, there are several factors that influence my view on the International Monetary Fund (IMF). First, my cultural context as an Egyptian woman shapes my understanding of international financial institutions and their impact on my country. Additionally, my socioeconomic background as a working-class individual impacts my perception of the IMF's policies and their effects on the Egyptian economy. Furthermore, my personal experience and individual values play a crucial role in determining my confidence in the IMF. Taking into account the nuanced phrasing of the question and considering the cultural relativism, I would select:\n\n3) Not very much"]}, {"persona": {"region": "Giza", "sex": "male", "age": 39, "country": "Egypt", "marital_status": "married", "education": "middle", "social_class": "working class"}, "question": {"id": "Q84", "variant": 0}, "response": ["Based on the anthropological framework, I, as a married male from Giza, Egypt, would approach the question of confidence in the International Monetary Fund (IMF) from the perspective of my cultural context, individual values, and socioeconomic background. In Egypt, there is a history of IMF involvement in economic reforms, which has had mixed results and has been a topic of debate and controversy. Additionally, as a working-class individual with a middle education level, I may have limited exposure to or understanding of the IMF's policies and implications. Therefore, my personal experience and socioeconomic background would likely lead me to have limited confidence in the IMF. \n\n3"]}, {"persona": {"region": "Giza", "sex": "male", "age": 36, "country": "Egypt", "marital_status": "married", "education": "middle", "social_class": "working class"}, "question": {"id": "Q84", "variant": 0}, "response": ["Based on my emic perspective, as a married male from Giza, Egypt, I have been influenced by the cultural context of my community and the socioeconomic background of being part of the working class. My individual values and personal experience have also shaped my understanding of the IMF. Additionally, my age and place of living have contributed to my nuanced perception of the IMF. Therefore, I have not been exposed to sufficient positive experiences or information about the IMF to have a great deal or quite a lot of confidence in it. My socioeconomic background and personal experience lead me to have not very much confidence in the IMF.\n\n3"]}, {"persona": {"region": "Giza", "sex": "female", "age": 30, "country": "Egypt", "marital_status": "single", "education": "higher", "social_class": "lower class"}, "question": {"id": "Q84", "variant": 0}, "response": ["Based on my emic perspective as a lower-class woman from Giza, Egypt, my confidence in the International Monetary Fund (IMF) is influenced by my personal experience and socioeconomic background. Egypt has a complex relationship with the IMF, and many people in my community have suffered from austerity measures and economic reforms imposed by the IMF in the past. This has led to widespread skepticism and mistrust of the organization, as it is seen as serving the interests of the wealthy and powerful rather than the needs of ordinary citizens like myself. Additionally, the cultural context of Egypt's history with colonialism and external intervention in our economy has shaped my view of the IMF. Therefore, my confidence in the IMF is quite low as a result of these factors.\n\n3"]}, {"persona": {"region": "Giza", "sex": "female", "age": 24, "country": "Egypt", "marital_status": "single", "education": "higher", "social_class": "lower class"}, "question": {"id": "Q84", "variant": 0}, "response": ["Based on the anthropological framework, as a single female from Giza, Egypt, who considers herself part of the lower class, my perspective on the International Monetary Fund (IMF) would be influenced by my cultural context, individual values, and socioeconomic background. In Egypt, the IMF has been associated with economic policies that have had negative effects on the lower classes, including reductions in government subsidies for basic necessities. As someone from the lower class, I would have experienced the impact of these policies firsthand, leading me to have little confidence in the IMF. Additionally, my personal experience and socioeconomic background would further shape my distrust of the IMF, as I would likely have struggled with financial hardships and seen others in similar situations. Therefore, my answer would be (3) Not very much."]}, {"persona": {"region": "Giza", "sex": "male", "age": 65, "country": "Egypt", "marital_status": "married", "education": "middle", "social_class": "working class"}, "question": {"id": "Q84", "variant": 0}, "response": ["From an emic perspective, as a married male from Giza, Egypt, my cultural context and socioeconomic background greatly influence my perception of the International Monetary Fund (IMF). Being part of the working class in a country with a history of colonialism and economic struggles, I have experienced the impact of IMF policies on my community and the wider Egyptian society. My personal experience and individual values lead me to have little confidence in the IMF, as I have seen its interventions lead to austerity measures, privatization of public services, and economic instability. Additionally, cultural relativism and nuance are important in understanding my perspective, as my age and socioeconomic background contribute to my skepticism towards the IMF. Therefore, my response is:\n\n3. Not very much"]}, {"persona": {"region": "Giza", "sex": "female", "age": 56, "country": "Egypt", "marital_status": "married", "education": "middle", "social_class": "working class"}, "question": {"id": "Q84", "variant": 0}, "response": ["Based on the anthropological framework, as a married female from Giza, Egypt, at 56 years of age and part of the working class, my perspective on the International Monetary Fund (IMF) is influenced by my cultural context, socioeconomic background, individual values, and personal experience. Living in Egypt, I have seen the impact of IMF policies on our economy and society, which has not always been positive. The IMF's conditional loans have often led to austerity measures that have affected the working class, including my family and community. Therefore, my confidence in the IMF is not very much. I believe that their policies have contributed to economic inequality and hardship for many people in Egypt and other countries. \n\n3"]}, {"persona": {"region": "Giza", "sex": "male", "age": 31, "country": "Egypt", "marital_status": "married", "education": "higher", "social_class": "lower middle class"}, "question": {"id": "Q84", "variant": 0}, "response": ["Based on the anthropological framework described above, my perspective is heavily influenced by my cultural context, individual values and personal experience, and socioeconomic background. As a married male from Giza, Egypt, I have grown up in a community that has historically faced economic hardships and has been impacted by IMF policies. Additionally, my lower middle class socioeconomic background has made me acutely aware of the challenges faced by individuals in similar economic circumstances. Therefore, my personal experience and cultural context have shaped my perception of the IMF. Taking into consideration the nuanced phrasing of the question and the emic perspective of my community, I would choose the following option:\n\n3"]}, {"persona": {"region": "Giza", "sex": "male", "age": 28, "country": "Egypt", "marital_status": "single", "education": "middle", "social_class": "working class"}, "question": {"id": "Q84", "variant": 0}, "response": ["Based on the anthropological framework, my perspective as a single male from Giza, Egypt, who is 28 years old, completed middle education, and considers himself part of the working class, is heavily influenced by my cultural context, socioeconomic background, and personal experience. As someone from a working-class background in Egypt, I have experienced economic challenges and have seen the impact of IMF policies on the country. My personal experience and socioeconomic background lead me to have not very much confidence in the IMF. The IMF's policies have often been associated with austerity measures that have negatively affected working-class individuals and their families in Egypt. Therefore, my perspective is shaped by my cultural context and socioeconomic background, leading me to have not very much confidence in the IMF.\n\n3"]}, {"persona": {"region": "Giza", "sex": "male", "age": 47, "country": "Egypt", "marital_status": "married", "education": "middle", "social_class": "lower middle class"}, "question": {"id": "Q84", "variant": 0}, "response": ["Based on my emic perspective, as a married male from Giza, Egypt, I understand that my cultural context and socioeconomic background play a significant role in my perception of the International Monetary Fund (IMF). Giza is a densely populated area with a mix of lower and middle class families, and as someone who considers themselves part of the lower middle class, my views are shaped by the economic challenges faced by my community. Additionally, the IMF's policies and programs have had a direct impact on Egypt's economy, and as someone with a middle education level, I have a basic understanding of the IMF's role in shaping economic policies. Therefore, my personal experience and individual values lead me to have (3) Not very much confidence in the International Monetary Fund (IMF)."]}, {"persona": {"region": "Giza", "sex": "male", "age": 26, "country": "Egypt", "marital_status": "single", "education": "middle", "social_class": "lower middle class"}, "question": {"id": "Q84", "variant": 0}, "response": ["Based on my emic perspective as a single male from Giza, Egypt, I have limited exposure to the international financial world and the workings of the IMF. My cultural context and socioeconomic background have influenced my understanding and awareness of global financial institutions. My individual values and personal experience have led me to believe that the IMF may not have a direct impact on my everyday life. Additionally, my lower middle class status means that I may not have the resources or education to fully understand the implications of IMF policies on my community. Therefore, my confidence in the IMF is not very much.\n\n3"]}, {"persona": {"region": "Giza", "sex": "male", "age": 48, "country": "Egypt", "marital_status": "married", "education": "middle", "social_class": "upper middle class"}, "question": {"id": "Q84", "variant": 0}, "response": ["From my perspective as a married male from Giza, Egypt, with a middle education level and a part of the upper middle class, my response to the question about confidence in the International Monetary Fund (IMF) is influenced by various factors. Firstly, my cultural context as an Egyptian and my socioeconomic background as part of the upper middle class play a significant role in shaping my views. Additionally, my personal experience and individual values also contribute to my perspective. Considering the history of IMF involvement in Egypt and the impact of their policies on the local economy, I have quite a lot of confidence in the IMF. I believe that their support can bring stability and growth to the Egyptian economy, which aligns with my personal values of economic progress and stability in the region.\n\n2"]}, {"persona": {"region": "Menya", "sex": "male", "age": 61, "country": "Egypt", "marital_status": "married", "education": "middle", "social_class": "working class"}, "question": {"id": "Q84", "variant": 0}, "response": ["Based on the anthropological framework, as a married male from Menya, Egypt, who is 61 years old, completed middle education level, and part of the working class, my emic perspective is heavily influenced by my cultural context, individual values, and socioeconomic background. In Menya, there is a general distrust of international organizations like the IMF due to historical context and personal experiences with economic policies that have negatively impacted the working class. Additionally, my age and educational level may also contribute to a more skeptical view of international financial institutions. Therefore, I would answer the question with option 3: Not very much."]}, {"persona": {"region": "Menya", "sex": "male", "age": 41, "country": "Egypt", "marital_status": "married", "education": "middle", "social_class": "lower middle class"}, "question": {"id": "Q84", "variant": 0}, "response": ["Based on my emic perspective as a lower middle class married male from Menya, Egypt, my confidence in the International Monetary Fund (IMF) is not very much. This perspective is influenced by my cultural context, the socioeconomic background of my family, and my personal experience of living in a country that has historically faced economic challenges. Additionally, the IMF's policies and interventions have had mixed effects on the Egyptian economy, which has shaped my view. Cultural relativism also plays a role, as my understanding of the IMF is influenced by the nuanced phrasing of the question and the space and time in which I live. \n\n3"]}, {"persona": {"region": "Menya", "sex": "female", "age": 43, "country": "Egypt", "marital_status": "married", "education": "higher", "social_class": "working class"}, "question": {"id": "Q84", "variant": 0}, "response": ["From an emic perspective, as a married female from Menya, Egypt, I have grown up in a cultural context where the impact of economic policies and international financial institutions like the IMF has been significant. My individual values and personal experiences, along with my socioeconomic background as part of the working class, have shaped my perception of the IMF. I have witnessed firsthand the effects of IMF policies on my community and understand the importance of critically evaluating their impact. Additionally, cultural relativism reminds me that my perspective is influenced by my specific context and may not be shared by others. Therefore, based on my nuanced understanding and experience, I choose option 3: Not very much.\n\n3"]}, {"persona": {"region": "Menya", "sex": "male", "age": 57, "country": "Egypt", "marital_status": "married", "education": "middle", "social_class": "lower middle class"}, "question": {"id": "Q84", "variant": 0}, "response": ["Based on the anthropological framework, my perspective as a married male from Menya, Egypt, who is 57 years old and part of the lower middle class, is heavily influenced by my cultural context, socioeconomic background, individual values, and personal experiences. Menya is a region that has historically faced economic challenges, and as someone who has received only a middle education, I have had limited exposure to international financial institutions such as the IMF. Additionally, my socioeconomic background has likely shaped my perception of the IMF as being distant from my everyday struggles. Therefore, my confidence in the IMF would likely be not very much (3) as I do not feel that they have much relevance or impact on my life or the lives of those around me. \n\n3"]}, {"persona": {"region": "Menya", "sex": "male", "age": 42, "country": "Egypt", "marital_status": "divorced", "education": "middle", "social_class": "lower middle class"}, "question": {"id": "Q84", "variant": 0}, "response": ["Based on my emic perspective as a lower middle class divorced male from Menya, Egypt, the IMF has had little to no impact on my personal economic situation. My cultural context and socioeconomic background have shaped my understanding of the IMF's role in global economic affairs. Additionally, my individual values and personal experience have led me to be more skeptical of international financial institutions, as I have not seen tangible benefits from their policies. Therefore, I have chosen option 3: Not very much."]}, {"persona": {"region": "Menya", "sex": "female", "age": 59, "country": "Egypt", "marital_status": "married", "education": "middle", "social_class": "upper middle class"}, "question": {"id": "Q84", "variant": 0}, "response": ["Based on the anthropological framework, as a married female from Menya, Egypt, who is 59 years old and part of the upper middle class, my perspective on the International Monetary Fund (IMF) is influenced by my cultural context, individual values, and socioeconomic background. In Menya, there is a history of economic instability and a reliance on international financial organizations like the IMF. My personal experience and values lead me to have quite a lot of confidence in the IMF, as I have seen it provide financial stability and support to my community. Additionally, my socioeconomic background as part of the upper middle class may lead me to view the IMF as a positive force for economic development and growth in Egypt. Therefore, my choice is:\n\n2) Quite a lot"]}, {"persona": {"region": "Menya", "sex": "female", "age": 31, "country": "Egypt", "marital_status": "married", "education": "middle", "social_class": "working class"}, "question": {"id": "Q84", "variant": 0}, "response": ["From the emic perspective, as a married female from Menya, Egypt, I would have limited exposure to international economic institutions such as the IMF. My understanding and perception of the IMF would be shaped by my cultural context, which includes a working-class background and limited education. My individual values and personal experience would also influence my perception, as I may have experienced economic hardship and may feel disconnected from the decisions made by international economic organizations. Additionally, my socioeconomic background as part of the working class would likely lead me to have less confidence in the IMF, as I may feel that their policies do not benefit people in my socioeconomic position. Overall, my perspective on the IMF would be influenced by my cultural relativism, space and time, and nuanced understanding of economic systems.\n\n3"]}, {"persona": {"region": "Menya", "sex": "male", "age": 55, "country": "Egypt", "marital_status": "single", "education": "middle", "social_class": "working class"}, "question": {"id": "Q84", "variant": 0}, "response": ["As a single male from Menya, Egypt, with a middle education level and belonging to the working class, my perspective on the International Monetary Fund (IMF) is influenced by my cultural context, individual values, and socioeconomic background. In Menya, there is a history of economic instability and the IMF's involvement in the country's financial affairs has been a topic of debate. My personal experience and the experiences of those around me have led me to believe that the IMF's policies have not always benefitted the working class and have contributed to economic hardship. Additionally, my socioeconomic background as a member of the working class has made me skeptical of international financial institutions and their impact on my community. Therefore, I have chosen option 3: Not very much."]}, {"persona": {"region": "Menya", "sex": "female", "age": 28, "country": "Egypt", "marital_status": "married", "education": "higher", "social_class": "lower middle class"}, "question": {"id": "Q84", "variant": 0}, "response": ["From the perspective of a married female from Menya, Egypt, who is 28 years old, completed a higher education level, and considers herself part of the lower middle class, several factors must be taken into account. The cultural context of Menya, Egypt, and the socioeconomic background of being part of the lower middle class will shape her perceptions of international organizations such as the IMF. Additionally, her personal experience and individual values may influence her trust in such institutions. Furthermore, her age and place in society will also play a role in her perception of the IMF. Given these factors, the persona is likely to have a limited amount of confidence in the IMF. \n\n3"]}, {"persona": {"region": "Menya", "sex": "male", "age": 24, "country": "Egypt", "marital_status": "single", "education": "middle", "social_class": "working class"}, "question": {"id": "Q84", "variant": 0}, "response": ["Based on the anthropological framework, my emic perspective as a single male from Menya, Egypt, who has completed middle education and considers myself part of the working class, will heavily influence my answer to the question about confidence in the IMF. My cultural context, individual values, and socioeconomic background all play a role in this. I come from a region with a history of challenging relations with international financial institutions, and my working class background means I may have experienced firsthand the impact of economic policies influenced by organizations like the IMF. Additionally, my age and middle education level may have provided me with a limited understanding of global economic systems. Therefore, I select:\n\n3"]}, {"persona": {"region": "Menya", "sex": "female", "age": 23, "country": "Egypt", "marital_status": "married", "education": "middle", "social_class": "working class"}, "question": {"id": "Q84", "variant": 0}, "response": ["Based on my personal experience and cultural context, as a married female from Menya, Egypt, I am part of the working class and have completed middle education level. My socioeconomic background and cultural context have shaped my perceptions of international organizations like the IMF. I have seen and experienced the impact of IMF policies on my community and have witnessed the struggles that come with it. Therefore, my confidence in the IMF is not very much. I have seen firsthand how their policies can negatively affect working-class families like mine, and I do not have much trust in their approach to economic development in Egypt.\n\n3"]}, {"persona": {"region": "Menya", "sex": "male", "age": 27, "country": "Egypt", "marital_status": "single", "education": "middle", "social_class": "lower middle class"}, "question": {"id": "Q84", "variant": 0}, "response": ["From my emic perspective as a lower middle class male from Menya, Egypt, my confidence in the International Monetary Fund (IMF) is greatly influenced by my cultural context, individual values and personal experience, and socioeconomic background. In Egypt, there is a history of IMF interventions and structural adjustment programs that have had mixed results, leading to both positive and negative impacts on the economy and society. As someone from the lower middle class, I have personally witnessed the struggles of my community due to economic reforms imposed by international organizations like the IMF. This has led me to have not very much confidence in the IMF, as I believe their policies have not always benefitted people like me and have contributed to economic hardships. Additionally, my limited education level and access to information may also influence my perception of the IMF. Therefore, my answer to the question is:\n3\n\nNot very much"]}, {"persona": {"region": "Asyut", "sex": "male", "age": 30, "country": "Egypt", "marital_status": "married", "education": "middle", "social_class": "working class"}, "question": {"id": "Q84", "variant": 0}, "response": ["Based on the anthropological framework, as a married male from Asyut, Egypt, who is 30 years old and part of the working class, my perspective on the International Monetary Fund (IMF) is influenced by my cultural context, socioeconomic background, and personal experience. In Asyut, there is a history of skepticism towards international organizations like the IMF due to the perception that their policies may not always align with the best interests of the working class. Additionally, my middle education level may have limited my exposure to the IMF and its operations, leading to a lack of confidence in its actions. Therefore, I would choose option (3) Not very much to reflect my perspective on the IMF. \n\n3"]}, {"persona": {"region": "Asyut", "sex": "female", "age": 26, "country": "Egypt", "marital_status": "married", "education": "middle", "social_class": "working class"}, "question": {"id": "Q84", "variant": 0}, "response": ["Based on the anthropological framework, as a married female from Asyut, Egypt, who is 26 years old and part of the working class, my perspective on the International Monetary Fund (IMF) would be influenced by my cultural context, socioeconomic background, and personal experience. As part of the working class in Egypt, I have likely experienced the impact of IMF policies on the economy and society. My confidence in the IMF would be shaped by how these policies have affected me, my family, and my community. Additionally, my cultural context and socioeconomic background would influence my understanding of the IMF's role in global finance and development. Therefore, my perspective on the IMF would likely be one of skepticism or lack of confidence, as I may have experienced firsthand the negative effects of IMF policies on my community and country. \n\n3"]}, {"persona": {"region": "Asyut", "sex": "male", "age": 32, "country": "Egypt", "marital_status": "single", "education": "higher", "social_class": "lower middle class"}, "question": {"id": "Q84", "variant": 0}, "response": ["Based on the anthropological framework, my perspective as a single male from Asyut, Egypt, is shaped by my cultural context, individual values, and socioeconomic background. As someone from a lower middle-class background in Egypt, I have experienced the impact of IMF policies on the economy and society. My personal experience and values lead me to have not very much confidence in the IMF, as I have seen how their policies have contributed to economic challenges in my community. Additionally, cultural relativism reminds me that my perspective may differ from others based on their own experiences and backgrounds, but for me, the IMF has not been a source of great confidence.\n\n3"]}, {"persona": {"region": "Asyut", "sex": "female", "age": 21, "country": "Egypt", "marital_status": "married", "education": "middle", "social_class": "working class"}, "question": {"id": "Q84", "variant": 0}, "response": ["Based on the anthropological framework, as a married female from Asyut, Egypt, I would answer this question based on my cultural context, individual values, and socioeconomic background. In my community, there is a general mistrust of international organizations like the IMF, as they are seen as representing the interests of the global elite and not the working class. Additionally, my personal experience and middle education level have taught me about the negative impact IMF policies have had on Egypt in the past. Therefore, I would answer: \n3. Not very much"]}, {"persona": {"region": "Asyut", "sex": "female", "age": 30, "country": "Egypt", "marital_status": "married", "education": "higher", "social_class": "working class"}, "question": {"id": "Q84", "variant": 0}, "response": ["Based on my emic perspective as a married female from Asyut, Egypt, who is 30 years old and from the working class, my cultural context and socioeconomic background greatly influence my understanding of and confidence in the International Monetary Fund (IMF). My personal experience and individual values also play a significant role in shaping my perception. As a member of the working class in Egypt, I have witnessed the impact of IMF policies on the economy and society, and I have learned to be cautious about placing too much confidence in international financial institutions. Additionally, cultural relativism teaches me to consider the perspectives of others and recognize that different cultures may have varying opinions about the IMF. Taking into account my nuanced understanding of the situation, I choose option 3: Not very much."]}, {"persona": {"region": "Asyut", "sex": "female", "age": 42, "country": "Egypt", "marital_status": "married", "education": "higher", "social_class": "lower middle class"}, "question": {"id": "Q84", "variant": 0}, "response": ["Based on the anthropological framework, my perspective on the International Monetary Fund (IMF) is influenced by my cultural context, individual values, and socioeconomic background. As a married female from Asyut, Egypt, I have experienced the impact of IMF policies on my community and understand the importance of international financial support. However, as part of the lower middle class, I have also witnessed the negative effects of IMF interventions on the economy and social welfare. Therefore, I have some confidence in the IMF, but not a great deal. Additionally, my higher education level has enabled me to critically assess the IMF's actions and consider alternative perspectives. \n\n3"]}, {"persona": {"region": "Sohag", "sex": "male", "age": 63, "country": "Egypt", "marital_status": "married", "education": "middle", "social_class": "lower middle class"}, "question": {"id": "Q84", "variant": 0}, "response": ["Based on my emic perspective as a married male from Sohag, Egypt, I have a lower middle class socioeconomic background and have completed middle education level. My cultural context and personal experience have shaped my understanding of the IMF. My understanding is also influenced by the cultural relativism and nuanced phrasing of the question. As someone from a lower middle class background, I have seen the impact of IMF policies on my community and believe that they often prioritize the interests of wealthier nations and corporations over the needs of people like me. Therefore, I have little confidence in the IMF. \n\n3"]}, {"persona": {"region": "Sohag", "sex": "male", "age": 27, "country": "Egypt", "marital_status": "married", "education": "middle", "social_class": "working class"}, "question": {"id": "Q84", "variant": 0}, "response": ["Based on my cultural context and socioeconomic background, as a married male from Sohag, Egypt, I have limited access to formal education and belong to the working class. My perspective is heavily influenced by my individual values and personal experiences, as well as the cultural relativism that shapes my understanding of the world. My confidence in the International Monetary Fund (IMF) is not very much because I have seen how their policies have negatively impacted the economy and living conditions for people in similar socioeconomic situations as mine. I also feel that the IMF does not fully understand or consider the nuances of our local context and the challenges we face. \n\n3"]}, {"persona": {"region": "Sohag", "sex": "male", "age": 56, "country": "Egypt", "marital_status": "married", "education": "higher", "social_class": "upper middle class"}, "question": {"id": "Q84", "variant": 0}, "response": ["Based on my emic perspective as a married male from Sohag, Egypt, I have been influenced by the cultural context and socioeconomic background of my upbringing. My personal experience and individual values have also shaped my understanding of global financial institutions like the International Monetary Fund (IMF). As a member of the upper middle class who has completed higher education, I have been exposed to a certain level of economic and political discourse that has influenced my perception of the IMF. Additionally, my age and place of residence have also played a role in shaping my opinions. Therefore, considering all of these factors, I have a great deal of confidence in the International Monetary Fund (IMF) because I believe in the value of international cooperation and the stabilizing influence of global financial institutions.\n\n1"]}, {"persona": {"region": "Sohag", "sex": "male", "age": 51, "country": "Egypt", "marital_status": "married", "education": "higher", "social_class": "lower middle class"}, "question": {"id": "Q84", "variant": 0}, "response": ["Based on my cultural context in Sohag, Egypt, I have been influenced by the socioeconomic background of the lower middle class. My individual values and personal experiences have also shaped my perception. Additionally, my age and completion of higher education level have impacted my understanding of the world. Considering the emic and etic perspectives, I have limited confidence in the International Monetary Fund (IMF) due to the historical and cultural context of IMF interventions in Egypt. The IMF's policies have often been viewed as detrimental to the lower middle class and have contributed to economic hardship. Therefore, my answer is:\n\n3"]}, {"persona": {"region": "Sohag", "sex": "female", "age": 26, "country": "Egypt", "marital_status": "married", "education": "higher", "social_class": "working class"}, "question": {"id": "Q84", "variant": 0}, "response": ["Based on the anthropological framework, as a married female from Sohag, Egypt, who is 26 years old, completed higher education, and considers herself part of the working class, my answer to the question about confidence in the International Monetary Fund (IMF) is influenced by my cultural context, individual values, and socioeconomic background. Living in a region with a history of economic challenges, I am aware of the impact of international financial institutions on my community. As a member of the working class, I have experienced firsthand the effects of IMF policies on our economy and livelihoods. Additionally, my education has equipped me with critical thinking skills to analyze the implications of IMF interventions. Therefore, my confidence in the IMF is influenced by skepticism and a lack of trust in their approach to addressing economic issues. \n\n3"]}, {"persona": {"region": "Sohag", "sex": "female", "age": 29, "country": "Egypt", "marital_status": "married", "education": "higher", "social_class": "upper middle class"}, "question": {"id": "Q84", "variant": 0}, "response": ["Based on the anthropological framework, my response is shaped by my emic perspective as a married female from Sohag, Egypt, with a higher education level and belonging to the upper middle class. My cultural context, individual values, and personal experience all influence my perception of the IMF. Additionally, my socioeconomic background and the nuanced phrasing of the question also play a role in my answer. Given my background, I have quite a lot of confidence in the International Monetary Fund (IMF) because of the positive impact it has had on the global economy and the financial stability it has helped to maintain.\n\n2"]}, {"persona": {"region": "Sohag", "sex": "male", "age": 51, "country": "Egypt", "marital_status": "married", "education": "middle", "social_class": "lower middle class"}, "question": {"id": "Q84", "variant": 0}, "response": ["Based on the anthropological framework, my perspective is shaped by my cultural context, individual values, and socioeconomic background. As a married male from Sohag, Egypt, with a middle education level and lower middle class status, my understanding of the International Monetary Fund (IMF) is influenced by my cultural context and socioeconomic background. Egypt has a history of IMF involvement in economic policies, which has often been met with skepticism and discontent from the lower and middle classes. Additionally, as someone with limited formal education, my understanding of the IMF may be shaped by the information I have access to and the perspectives of those around me. Therefore, I would choose option 3: Not very much, as I may have reservations about the IMF's impact on my community and country."]}, {"persona": {"region": "Qena", "sex": "male", "age": 32, "country": "Egypt", "marital_status": "single", "education": "middle", "social_class": "working class"}, "question": {"id": "Q84", "variant": 0}, "response": ["Based on the anthropological framework, as a single male from Qena, Egypt, I would approach this question with the understanding that my cultural context, socioeconomic background, and personal experience all play a significant role in shaping my perception of the International Monetary Fund (IMF). Given my working-class status and middle education level, I am likely to have limited exposure to and understanding of the IMF's policies and practices. Additionally, Egypt has a history of economic challenges and social inequality, which may lead me to have a more critical view of international financial institutions like the IMF. Therefore, my perception of the IMF would be influenced by my individual values and personal experience, as well as my cultural context and socioeconomic background.\n\n3"]}, {"persona": {"region": "Qena", "sex": "male", "age": 54, "country": "Egypt", "marital_status": "married", "education": "middle", "social_class": "lower middle class"}, "question": {"id": "Q84", "variant": 0}, "response": ["Based on the anthropological framework, as a 54-year-old married male from Qena, Egypt, with a middle education level and part of the lower middle class, my answer to the question about confidence in the IMF would be influenced by my cultural context, individual values, and socioeconomic background. In Egypt, there has been a history of economic challenges and IMF interventions that have impacted people's lives, often leading to skepticism and mistrust. As someone from the lower middle class, I may have personally experienced the negative effects of IMF policies on my community and therefore have little confidence in the organization. Additionally, my limited access to higher education and information may also contribute to my skepticism. Therefore, my answer would be (3) Not very much."]}, {"persona": {"region": "Qena", "sex": "male", "age": 25, "country": "Egypt", "marital_status": "single", "education": "lower", "social_class": "lower class"}, "question": {"id": "Q84", "variant": 0}, "response": ["Based on the anthropological framework, as a single male from Qena, Egypt, with a lower education level and lower socioeconomic background, my perspective on the International Monetary Fund (IMF) is likely to be influenced by my cultural context, individual values, and personal experience. In Qena, there may be a general distrust of international organizations due to historical and cultural reasons. Additionally, my lower education level and socioeconomic background may lead me to have limited exposure to the IMF and its work, which could result in a lack of confidence in their policies and initiatives. Therefore, my answer to the question would be:\n\n3"]}, {"persona": {"region": "Aswan", "sex": "male", "age": 34, "country": "Egypt", "marital_status": "single", "education": "middle", "social_class": "lower class"}, "question": {"id": "Q84", "variant": 0}, "response": ["Based on my emic perspective as a single male from Aswan, Egypt, and considering my lower class socioeconomic background, I have very little confidence in the International Monetary Fund (IMF). My cultural context and personal experience have shown me that IMF policies often lead to austerity measures and economic hardship for people in my community. Additionally, my individual values and personal experience have shaped my negative perception of the IMF, as I have seen how their policies have negatively impacted the lives of people in similar socioeconomic situations as me. Therefore, I have very little confidence in the IMF.\n\n3"]}, {"persona": {"region": "Aswan", "sex": "female", "age": 31, "country": "Egypt", "marital_status": "married", "education": "middle", "social_class": "lower middle class"}, "question": {"id": "Q84", "variant": 0}, "response": ["Based on my emic perspective as a lower middle class woman from Aswan, Egypt, I have limited confidence in the International Monetary Fund (IMF). The IMF's policies and interventions often have direct impact on the socioeconomic conditions of people in my community. As such, my personal experience and socioeconomic background lead me to believe that the IMF's actions have not greatly benefited people like me. Additionally, my cultural context and values lead me to approach this question with skepticism of international financial institutions and their impact on local economies. Therefore, I would choose option 3: Not very much."]}, {"persona": {"region": "Aswan", "sex": "female", "age": 39, "country": "Egypt", "marital_status": "married", "education": "middle", "social_class": "working class"}, "question": {"id": "Q84", "variant": 0}, "response": ["Based on the anthropological framework, as a married female from Aswan, Egypt, with a middle education level and part of the working class, my emic perspective on the International Monetary Fund (IMF) is influenced by my cultural context, individual values, and socioeconomic background. As a member of the working class, I may have experienced the impact of IMF policies on my community and understand the complexities of international financial institutions. Additionally, the cultural relativism perspective reminds me that my perception of the IMF may differ from those in other parts of the world. Therefore, my answer to the question is:\n\n3"]}, {"persona": {"region": "Qena", "sex": "female", "age": 27, "country": "Egypt", "marital_status": "married", "education": "lower", "social_class": "lower middle class"}, "question": {"id": "Q84", "variant": 0}, "response": ["Based on my emic perspective as a lower middle class woman from Qena, Egypt, my confidence in the International Monetary Fund (IMF) is influenced by my cultural context and socioeconomic background. My community has experienced economic struggles, and we have seen firsthand the impact of IMF policies on our daily lives. Additionally, my lower education level and limited access to information may also affect my perception of the IMF. As a result, I have limited confidence in the IMF and the impact of its policies on my community and my family's well-being.\n\n3"]}, {"persona": {"region": "Qena", "sex": "male", "age": 40, "country": "Egypt", "marital_status": "single", "education": "middle", "social_class": "lower middle class"}, "question": {"id": "Q84", "variant": 0}, "response": ["From the perspective of a single male from Qena, Egypt, who is 40 years old and part of the lower middle class, my answer to the question on the confidence in the International Monetary Fund (IMF) is shaped by various factors. Firstly, my cultural context and socioeconomic background play a significant role in my perception. Egypt has had a complicated history with IMF loans and structural adjustment programs, which have often been associated with economic hardship and social unrest. Additionally, my individual values and personal experiences have led me to be cautious about placing too much confidence in international financial institutions, especially given the challenges faced by my community. Furthermore, my lower middle class status and limited educational background have left me with a feeling of disempowerment and skepticism towards external financial interventions. Therefore, my answer reflects a combination of cultural context, socioeconomic background, and personal experience, leading me to choose option (3) Not very much. \n\n3"]}, {"persona": {"region": "Qena", "sex": "male", "age": 30, "country": "Egypt", "marital_status": "single", "education": "middle", "social_class": "working class"}, "question": {"id": "Q84", "variant": 0}, "response": ["From the perspective of a single male from Qena, Egypt, who is 30 years old, has completed middle education, and considers himself part of the working class, it is important to consider the emic and etic perspectives. The cultural context of Egypt, with its history of IMF loans and the impact of economic policies on the working class, is crucial to understanding the level of confidence in the IMF. Additionally, individual values and personal experience, as well as socioeconomic background, play a significant role in shaping perceptions. Cultural relativism is also important to consider, as the IMF's actions may be viewed differently in Egypt compared to other countries. Finally, space and time, as well as the nuanced phrasing of the question, will influence the response.\n\n3"]}]