[{"persona": {"region": "Fayoum", "sex": "male", "age": 46, "country": "Egypt", "marital_status": "married", "education": "higher", "social_class": "lower middle class"}, "question": {"id": "Q87", "variant": 0}, "response": ["Based on my emic perspective as a married male from Fayoum, Egypt, I have always been taught to be cautious of external organizations and their influence on our local economy. My cultural context also plays a role in this, as I have witnessed the impact of international financial institutions on the socioeconomic background of my community. Additionally, my lower middle class status has led me to understand the importance of individual values and personal experience, as my own experiences have shaped my perception of the World Bank. Cultural relativism is also significant in my understanding, as I believe that the World Bank may not always have the best interests of my community in mind. Space and time are also important, as my age and place of residence have influenced my views on international organizations. Therefore, based on my nuanced understanding of the World Bank and its impact on my community, I would choose option 3: Not very much. \n\n3"]}, {"persona": {"region": "Fayoum", "sex": "female", "age": 30, "country": "Egypt", "marital_status": "married", "education": "middle", "social_class": "lower middle class"}, "question": {"id": "Q87", "variant": 0}, "response": ["As a married female from Fayoum, Egypt, with a middle education level and part of the lower middle class, my perspective on the World Bank (WB) is influenced by my cultural context, individual values, and socioeconomic background. In my community, there is a general skepticism towards large international organizations, including the World Bank, as there is a perception that their policies and initiatives do not always align with the needs and interests of local communities. Additionally, my personal experience and socioeconomic background have led me to be cautious in placing too much confidence in external institutions that may not fully understand or prioritize the challenges faced by individuals like myself. Therefore, my confidence in the World Bank is not very much. \n\n3"]}, {"persona": {"region": "Fayoum", "sex": "male", "age": 60, "country": "Egypt", "marital_status": "married", "education": "higher", "social_class": "working class"}, "question": {"id": "Q87", "variant": 0}, "response": ["Based on the anthropological framework, my response to the question about the World Bank's credibility is influenced by my emic perspective as a married male from Fayoum, Egypt, and my working-class background. The cultural context of Egypt, my age, and socioeconomic background are all pivotal in shaping my perception of international organizations like the World Bank. My personal experience and values also play a significant role in my understanding of the World Bank's impact on developing countries like Egypt. Additionally, cultural relativism reminds me that my perspective may differ from others based on their own individual values and experiences. Therefore, my answer is:\n\n3"]}, {"persona": {"region": "Fayoum", "sex": "male", "age": 20, "country": "Egypt", "marital_status": "single", "education": "middle", "social_class": "lower middle class"}, "question": {"id": "Q87", "variant": 0}, "response": ["Based on the anthropological framework, my perspective on the World Bank (WB) is heavily influenced by my cultural context, individual values, and socioeconomic background. As a young, lower middle-class male from Fayoum, Egypt, I have limited access to resources and opportunities, and I am aware of the disparity in wealth and power on a global scale. I am skeptical of international institutions like the World Bank, which I perceive as being controlled by wealthy countries and catering to their interests. Additionally, my personal experiences and the experiences of people in my community have not been positively impacted by the World Bank's interventions. Therefore, I have little confidence in the World Bank's ability to address the needs and concerns of people like me.\n\n3"]}, {"persona": {"region": "Fayoum", "sex": "female", "age": 39, "country": "Egypt", "marital_status": "married", "education": "higher", "social_class": "lower middle class"}, "question": {"id": "Q87", "variant": 0}, "response": ["Based on the anthropological framework, as a married female from Fayoum, Egypt, my emic perspective on the World Bank would be influenced by my cultural context, individual values, socioeconomic background, and space and time. In my cultural context, I may have limited exposure to the World Bank and its impact on my community. My individual values of self-reliance and independence may lead me to have some skepticism towards external financial institutions. Additionally, my lower middle-class socioeconomic background may make me feel disconnected from the World Bank's policies and initiatives. Lastly, as a 39-year-old with higher education, I may have some awareness of global economic issues but not enough to have a great deal of confidence in the World Bank.\n\n3"]}, {"persona": {"region": "Fayoum", "sex": "male", "age": 33, "country": "Egypt", "marital_status": "married", "education": "higher", "social_class": "working class"}, "question": {"id": "Q87", "variant": 0}, "response": ["Based on the anthropological framework, as a married male from Fayoum, Egypt, my emic perspective on the World Bank (WB) is influenced by my cultural context, individual values, socioeconomic background, and space and time. In Egypt, there is a history of skepticism towards international organizations and their impact on the country's development. As a member of the working class, I am likely to have experienced firsthand the challenges and inequalities that exist within the Egyptian socioeconomic system. Therefore, I may have a more critical view of the World Bank, as its policies and interventions may not align with the needs and interests of people like me. Additionally, my age and educational level may also contribute to my awareness of the complexities of international financial institutions and their potential shortcomings. Considering all these factors, I would select option (3) Not very much to reflect my level of confidence in the World Bank. \n\n3"]}, {"persona": {"region": "Port Said", "sex": "female", "age": 45, "country": "Egypt", "marital_status": "married", "education": "higher", "social_class": "lower middle class"}, "question": {"id": "Q87", "variant": 0}, "response": ["Based on my emic perspective as a married woman from Port Said, Egypt, who is 45 years old and part of the lower middle class, my answer to the question of confidence in the World Bank is influenced by my cultural context, individual values, and socioeconomic background. In Egyptian society, there is a skepticism towards international financial institutions like the World Bank, as they are often seen as perpetuating inequality and serving the interests of the wealthy. Additionally, my personal experience and socioeconomic background have led me to question the effectiveness of the World Bank in addressing the needs of people like me. Therefore, my answer to the question is (3) Not very much."]}, {"persona": {"region": "Port Said", "sex": "male", "age": 42, "country": "Egypt", "marital_status": "married", "education": "middle", "social_class": "lower middle class"}, "question": {"id": "Q87", "variant": 0}, "response": ["Based on the anthropological framework, my perspective as a married male from Port Said, Egypt, at 42 years of age with a middle education level and part of the lower middle class, is heavily influenced by my cultural context, individual values, and socioeconomic background. In Port Said, there is a general skepticism towards international organizations and their impact on local communities. As a member of the lower middle class, I have experienced firsthand the challenges and struggles of my community, and I have little trust in the World Bank's ability to address these issues effectively. Additionally, my personal experience and values lead me to believe that local solutions are often more effective than those imposed by external organizations. Therefore, I would choose option 3: Not very much. \n\n3"]}, {"persona": {"region": "Port Said", "sex": "male", "age": 28, "country": "Egypt", "marital_status": "single", "education": "middle", "social_class": "lower middle class"}, "question": {"id": "Q87", "variant": 0}, "response": ["Based on the anthropological framework, as a single male from Port Said, Egypt, my emic perspective is influenced by my cultural context, individual values, and socioeconomic background. In Port Said, there is a strong sense of community and reliance on personal networks for support, which may lead to a lack of confidence in external institutions like the World Bank. Additionally, as part of the lower middle class, I may have limited access to information about the World Bank's activities and may feel disconnected from their impact on my daily life. Therefore, I would choose option 3: Not very much."]}, {"persona": {"region": "Port Said", "sex": "female", "age": 30, "country": "Egypt", "marital_status": "married", "education": "higher", "social_class": "lower middle class"}, "question": {"id": "Q87", "variant": 0}, "response": ["Based on the anthropological framework, my perspective as a married female from Port Said, Egypt, who is 30 years old and part of the lower middle class, is heavily influenced by my cultural context, individual values, and socioeconomic background. In Port Said, there is a general skepticism towards international organizations such as the World Bank, as they are perceived to prioritize the interests of wealthier nations and multinational corporations over the needs of developing countries like Egypt. Additionally, my socioeconomic background as part of the lower middle class means that I am likely to have experienced the negative impacts of economic policies advocated by organizations like the World Bank. Therefore, I have little confidence in the World Bank and believe that its actions do not necessarily benefit people like me or my community. \n\n3"]}, {"persona": {"region": "Port Said", "sex": "male", "age": 30, "country": "Egypt", "marital_status": "divorced", "education": "middle", "social_class": "lower middle class"}, "question": {"id": "Q87", "variant": 0}, "response": ["Based on my emic perspective as a lower middle class man from Port Said, Egypt, my cultural context and socioeconomic background play a significant role in shaping my views on the World Bank. I have limited access to higher education and am not well-versed in global economic policies. My personal experience and individual values lead me to have limited confidence in the World Bank, as I have seen little to no positive impact from their interventions in my community. Additionally, my cultural relativism leads me to view the World Bank as an entity that primarily serves the interests of wealthier nations and individuals. Therefore, my answer would be (3) Not very much."]}, {"persona": {"region": "Port Said", "sex": "female", "age": 19, "country": "Egypt", "marital_status": "single", "education": "middle", "social_class": "lower middle class"}, "question": {"id": "Q87", "variant": 0}, "response": ["Based on my emic perspective as a 19-year-old lower middle class female from Port Said, Egypt, my confidence in the World Bank would be influenced by my cultural context, individual values and personal experience, and socioeconomic background. In my cultural context, I may have limited exposure to the World Bank and its impact on my community. My individual values and personal experience would lead me to have limited confidence in the World Bank, as I may have experienced economic challenges and inequality in my community. Additionally, my socioeconomic background as part of the lower middle class may lead me to have not very much confidence in the World Bank, as I may feel that it does not adequately address the needs of people in my socioeconomic position. Therefore, my answer would be:\n\n3) Not very much"]}, {"persona": {"region": "Fayoum", "sex": "male", "age": 40, "country": "Egypt", "marital_status": "married", "education": "middle", "social_class": "working class"}, "question": {"id": "Q87", "variant": 0}, "response": ["Based on the anthropological framework, my response to the question of how much confidence I have in the World Bank would be influenced by my emic perspective as a working-class individual from Fayoum, Egypt. My cultural context and socioeconomic background would shape my understanding of the World Bank's impact on my community and country. Additionally, my individual values and personal experience would play a significant role in determining my level of confidence in the World Bank. Considering the historical context of international financial institutions in Egypt and the experiences of people in my socioeconomic class, I would select the following option:\n\n3"]}, {"persona": {"region": "Fayoum", "sex": "male", "age": 23, "country": "Egypt", "marital_status": "single", "education": "higher", "social_class": "lower middle class"}, "question": {"id": "Q87", "variant": 0}, "response": ["Based on the anthropological framework, as a single male from Fayoum, Egypt, who is 23 years old and considers myself part of the lower middle class, my answer to the question regarding confidence in the World Bank would be influenced by my cultural context, individual values, and socioeconomic background. Growing up in Egypt, I have experienced the impact of economic policies and aid programs implemented by international organizations like the World Bank. My personal values and experiences have led me to have not very much confidence in the World Bank, as I have seen the limitations and shortcomings of their interventions in my community. Additionally, my socioeconomic background as part of the lower middle class and my higher education have provided me with critical perspectives on global financial institutions and their impact on developing countries like Egypt.\n\n3"]}, {"persona": {"region": "Fayoum", "sex": "female", "age": 38, "country": "Egypt", "marital_status": "married", "education": "middle", "social_class": "lower middle class"}, "question": {"id": "Q87", "variant": 0}, "response": ["From the perspective of a married woman from Fayoum, Egypt, who is 38 years old, completed middle education, and considers herself part of the lower middle class, several factors come into play when considering confidence in the World Bank. The cultural context of living in Egypt, a country that has received loans and aid from the World Bank, may shape her perception of the organization. Her lower middle class socio-economic background may influence her perception of the World Bank's impact on her community. Additionally, her personal experience and individual values may lead her to have a nuanced understanding of the World Bank's role in her life and the lives of those around her. Taking into account the cultural relativism and the emic perspective of her social group, she may choose to answer the question in a way that reflects her personal and community experience.\n\n3"]}, {"persona": {"region": "Fayoum", "sex": "male", "age": 32, "country": "Egypt", "marital_status": "married", "education": "middle", "social_class": "lower middle class"}, "question": {"id": "Q87", "variant": 0}, "response": ["From the perspective of a married male from Fayoum, Egypt, who is 32 years old, completed middle education level, and considers himself part of the lower middle class, several factors come into play when considering the confidence in the World Bank. Firstly, the cultural context of being from Egypt, a country with a history of economic challenges and a complex relationship with international financial institutions, may influence skepticism towards the World Bank. Additionally, the individual's socioeconomic background as part of the lower middle class may lead to a lack of confidence in institutions that are perceived to serve the interests of the wealthy and powerful. Furthermore, the individual's personal experience and values may lead to a nuanced view of the World Bank, considering both the positive and negative impacts it may have had on their community. Based on these considerations, the persona would likely choose option (3) Not very much, as a reflection of their nuanced perspective on the World Bank.\n\n3"]}, {"persona": {"region": "Fayoum", "sex": "male", "age": 31, "country": "Egypt", "marital_status": "married", "education": "higher", "social_class": "working class"}, "question": {"id": "Q87", "variant": 0}, "response": ["Based on the anthropological framework, my response to the question about confidence in the World Bank is heavily influenced by my cultural context and socioeconomic background. As a working-class male from Fayoum, Egypt, with a higher education level, I have experienced firsthand the impact of global economic policies on local communities. My cultural context and personal experience have led me to have not very much confidence in the World Bank. I have seen how their policies have often favored wealthier nations and corporations, while neglecting the needs of working-class individuals and families in Egypt. Additionally, cultural relativism reminds me that my perspective is not universal, but it is influenced by my own experiences and the experiences of those around me. Therefore, I choose option 3: Not very much."]}, {"persona": {"region": "Fayoum", "sex": "male", "age": 31, "country": "Egypt", "marital_status": "married", "education": "middle", "social_class": "lower middle class"}, "question": {"id": "Q87", "variant": 0}, "response": ["From the emic and etic perspectives, as a married male from Fayoum, Egypt, my in-group way of thinking about the World Bank may be influenced by the cultural context and my socioeconomic background. In Egypt, there is a history of skepticism and mistrust towards international organizations, including the World Bank, due to perceived unequal power dynamics and imposed policies. Additionally, as part of the lower middle class, I may have experienced limited opportunities and support from institutions like the World Bank, leading to a lack of confidence in their effectiveness. My individual values and personal experiences also play a role in shaping my perception of the World Bank, as I may have seen firsthand the impact of their policies on my community and feel that they do not align with my needs and aspirations. Therefore, based on these factors, my response would be:\n\n3) Not very much"]}, {"persona": {"region": "Fayoum", "sex": "female", "age": 32, "country": "Egypt", "marital_status": "married", "education": "middle", "social_class": "lower middle class"}, "question": {"id": "Q87", "variant": 0}, "response": ["Based on my emic perspective, as a married woman from Fayoum, Egypt, I have grown up in a cultural context where the World Bank has not been a prominent institution in my life. My personal experience and individual values have led me to have not very much confidence in the World Bank, as I have not seen direct positive impacts of their work in my community. Additionally, my lower middle class socioeconomic background has led me to be cautious about trusting large international organizations. Furthermore, cultural relativism teaches me that there are different ways of understanding and interacting with institutions like the World Bank, and my nuanced understanding of the question leads me to choose not very much confidence in the World Bank. \n\n3"]}, {"persona": {"region": "Ismailia", "sex": "male", "age": 53, "country": "Egypt", "marital_status": "married", "education": "middle", "social_class": "lower middle class"}, "question": {"id": "Q87", "variant": 0}, "response": ["Based on the anthropological framework, as a married male from Ismailia, Egypt, my emic perspective on the World Bank (WB) would be influenced by my cultural context and socioeconomic background. Living in a middle-class community, the WB's impact on our local economy and development projects would be crucial in shaping my perception. Additionally, my personal experience and individual values would play a significant role in determining my confidence in the WB. The nuance in the phrasing of the question also matters, as it influences my response. Considering these factors, I would select option 2: Quite a lot. \n\n2"]}, {"persona": {"region": "Ismailia", "sex": "male", "age": 38, "country": "Egypt", "marital_status": "married", "education": "higher", "social_class": "working class"}, "question": {"id": "Q87", "variant": 0}, "response": ["Based on the anthropological framework, as a married male from Ismailia, Egypt, with a working-class background and higher education, my perspective on the World Bank (WB) is influenced by my cultural context, individual values, and socioeconomic background. As someone from a working-class background, I may have a more critical view of international financial institutions like the World Bank, as they are often seen as representing the interests of wealthier nations and elites. Additionally, my higher education level may have exposed me to critiques of the World Bank's policies and practices, leading to a more skeptical view. Therefore, my confidence in the World Bank is likely to be \"Not very much\" (3)."]}, {"persona": {"region": "Ismailia", "sex": "female", "age": 35, "country": "Egypt", "marital_status": "married", "education": "middle", "social_class": "lower middle class"}, "question": {"id": "Q87", "variant": 0}, "response": ["Based on the anthropological framework, my emic perspective as a married female from Ismailia, Egypt, who is 35 years old and part of the lower middle class, is influenced by my cultural context, individual values, and socioeconomic background. In my cultural context, there is a general skepticism towards international organizations like the World Bank, as they are often perceived as representing the interests of wealthier nations or corporations. Additionally, my lower middle class socioeconomic background means that I am likely to have limited interaction with or benefit from the World Bank's initiatives. Therefore, I would have \"Not very much\" confidence in the World Bank.\n\n3"]}, {"persona": {"region": "Ismailia", "sex": "female", "age": 57, "country": "Egypt", "marital_status": "married", "education": "lower", "social_class": "working class"}, "question": {"id": "Q87", "variant": 0}, "response": ["Based on the anthropological framework, my emic perspective as a married female from Ismailia, Egypt, at 57 years of age and from a working-class background, is influenced by my cultural context, individual values, and socioeconomic background. In my community, there is a general lack of trust in international institutions like the World Bank due to historical and cultural factors. Additionally, my lower education level has limited my exposure to the World Bank's activities and impact. Therefore, my confidence in the World Bank is not very much.\n\n3"]}, {"persona": {"region": "Ismailia", "sex": "male", "age": 33, "country": "Egypt", "marital_status": "married", "education": "middle", "social_class": "lower middle class"}, "question": {"id": "Q87", "variant": 0}, "response": ["Based on my personal experience and socioeconomic background as a married male from Ismailia, Egypt, I come from a lower middle class family and have completed middle education level. This has shaped my understanding of the world and the institutions that govern it. From an emic perspective, I am more likely to have a critical view of institutions like the World Bank, as I am aware of the impact of their policies on people like me and the community I come from. Additionally, my cultural context and individual values lead me to question the motives and impact of such global institutions, as they often do not reflect the realities and needs of people in my community. Therefore, I would not have a great deal of confidence in the World Bank.\n\n3"]}, {"persona": {"region": "Ismailia", "sex": "female", "age": 49, "country": "Egypt", "marital_status": "single", "education": "higher", "social_class": "upper middle class"}, "question": {"id": "Q87", "variant": 0}, "response": ["Based on the emic and etic perspectives, my understanding of the World Bank is influenced by my cultural context, individual values, and personal experience. As a single female from Ismailia, Egypt, who has completed higher education and considers herself part of the upper middle class, I have been exposed to a certain level of privilege and access to information about global financial institutions. My cultural context and socioeconomic background also play a role in shaping my perception of the World Bank. Additionally, my understanding of cultural relativism reminds me that my perspective may differ from others based on their own experiences and backgrounds. Therefore, I have chosen my answer based on these factors.\n2"]}, {"persona": {"region": "Ismailia", "sex": "female", "age": 35, "country": "Egypt", "marital_status": "married", "education": "higher", "social_class": "lower middle class"}, "question": {"id": "Q87", "variant": 0}, "response": ["Based on my emic perspective as a married female from Ismailia, Egypt, I have a strong understanding of the cultural context and socioeconomic background that shapes my perception of the World Bank. Being part of the lower middle class, I am aware of the impact of the World Bank's policies and programs on my community and the broader Egyptian society. My individual values and personal experience have led me to have limited confidence in the World Bank, as I have seen its interventions contribute to economic disparities and social inequalities. Additionally, cultural relativism reminds me that there are diverse perspectives on the World Bank, and my nuanced understanding of its impact leads me to choose option (3) Not very much. \n\n3"]}, {"persona": {"region": "Ismailia", "sex": "male", "age": 24, "country": "Egypt", "marital_status": "single", "education": "higher", "social_class": "upper middle class"}, "question": {"id": "Q87", "variant": 0}, "response": ["Based on the anthropological framework, my perspective as a single male from Ismailia, Egypt, who is 24 years old and part of the upper middle class, is influenced by my individual values and personal experience, as well as my socioeconomic background and cultural context. I have completed higher education and have been exposed to a certain level of privilege and access to resources, which may lead me to have a more positive view of international financial institutions like the World Bank. Additionally, my cultural context and socioeconomic background may contribute to my perception that the World Bank has a significant impact on global economic development. Therefore, I would choose option (2) Quite a lot. \n\n2"]}, {"persona": {"region": "Ismailia", "sex": "female", "age": 23, "country": "Egypt", "marital_status": "single", "education": "higher", "social_class": "lower middle class"}, "question": {"id": "Q87", "variant": 0}, "response": ["Based on the anthropological framework, as a single female from Ismailia, Egypt, who is 23 years old and part of the lower middle class, my emic perspective would be influenced by my personal values and experiences, as well as my socioeconomic background. I would also consider the cultural context of Egypt, where there is a history of skepticism towards international organizations and their impact on the country's development. Additionally, my individual values and personal experiences have led me to question the influence and intentions of organizations like the World Bank in my community. Therefore, I would have \"not very much\" confidence in the World Bank as my answer. \n\n3"]}, {"persona": {"region": "Ismailia", "sex": "male", "age": 55, "country": "Egypt", "marital_status": "married", "education": "middle", "social_class": "lower middle class"}, "question": {"id": "Q87", "variant": 0}, "response": ["Based on my emic perspective as a married male from Ismailia, Egypt, my cultural context, individual values, and socioeconomic background all lead me to have not very much confidence in the World Bank. In my community, there is a general skepticism towards international organizations and their impact on local economies. Additionally, my lower middle-class status means that I have experienced firsthand the challenges of economic inequality and lack of access to financial resources, which may be exacerbated by the policies of institutions like the World Bank. Therefore, I would choose option 3: Not very much."]}, {"persona": {"region": "Ismailia", "sex": "male", "age": 57, "country": "Egypt", "marital_status": "married", "education": "middle", "social_class": "upper middle class"}, "question": {"id": "Q87", "variant": 0}, "response": ["Based on the anthropological framework, as a married male from Ismailia, Egypt, my emic perspective on the World Bank (WB) would be influenced by my cultural context, individual values, and socioeconomic background. My cultural context and individual values may shape my perception of the WB's impact on development projects in Egypt, and my socioeconomic background as an upper middle-class individual may lead me to have a higher level of confidence in the WB's ability to contribute to economic growth and prosperity in my country. Therefore, I would choose:\n\n2"]}, {"persona": {"region": "Ismailia", "sex": "female", "age": 29, "country": "Egypt", "marital_status": "married", "education": "middle", "social_class": "upper middle class"}, "question": {"id": "Q87", "variant": 0}, "response": ["Based on the anthropological framework, as a married female from Ismailia, Egypt, with a middle education level and considering myself part of the upper middle class, my perspectives and values are shaped by my individual experiences and socioeconomic background. My cultural context and nuance in understanding the World Bank (WB) may differ from others. Considering the historical and cultural context of Egypt, where the World Bank has been involved in various development projects, and my socioeconomic background, I would have quite a lot of confidence in the World Bank as it has played a significant role in economic development and infrastructure projects in the country, contributing to the improvement of living standards and opportunities for people in my community. \n\n2"]}, {"persona": {"region": "Damiatta", "sex": "female", "age": 46, "country": "Egypt", "marital_status": "married", "education": "middle", "social_class": "lower middle class"}, "question": {"id": "Q87", "variant": 0}, "response": ["In considering the question of how much confidence I have in the World Bank, my perspective as a married female from Damiatta, Egypt, who is 46 years old, has completed middle education, and considers herself part of the lower middle class, is shaped by a combination of cultural context, individual values and personal experience, and socioeconomic background. In my community, there is a general skepticism towards international organizations like the World Bank, as they are often seen as representing the interests of wealthier nations and not necessarily prioritizing the needs of countries like Egypt. Additionally, my personal experience and socioeconomic background have led me to question the impact of the World Bank's policies and interventions in my community, as I have not seen significant improvements in our quality of life. Therefore, I would choose option (3) Not very much, as this aligns with my perspective based on the anthropological framework described above.\n\n3"]}, {"persona": {"region": "Damiatta", "sex": "female", "age": 20, "country": "Egypt", "marital_status": "single", "education": "middle", "social_class": "lower middle class"}, "question": {"id": "Q87", "variant": 0}, "response": ["Based on the anthropological framework, my perspective as a single female from Damiatta, Egypt, at 20 years of age and part of the lower middle class, is heavily influenced by my cultural context, individual values, and socioeconomic background. In my community, there is a general lack of trust in international organizations like the World Bank due to historical experiences of exploitation and inequality. Additionally, my lower middle-class background has made me aware of the socioeconomic disparities perpetuated by institutions like the World Bank, leading me to have not very much confidence in their actions. 3\n\n(Note: The chosen answer is 3, \"Not very much\")"]}, {"persona": {"region": "Damiatta", "sex": "male", "age": 19, "country": "Egypt", "marital_status": "single", "education": "middle", "social_class": "lower middle class"}, "question": {"id": "Q87", "variant": 0}, "response": ["Based on the anthropological framework, as a single male from Damiatta, Egypt, who is 19 years old and part of the lower middle class, my perspective on the World Bank (WB) would be influenced by my cultural context, individual values, and socioeconomic background. In Damiatta, there is a general mistrust of international financial institutions due to historical and political reasons, and as someone from the lower middle class, I may have experienced the negative impact of economic policies imposed by such institutions. Additionally, my age and educational level may have exposed me to critical perspectives on the WB. Therefore, my confidence in the World Bank would likely be low, as I perceive it as not being aligned with the interests and needs of people like me.\n\n3"]}, {"persona": {"region": "Damiatta", "sex": "female", "age": 33, "country": "Egypt", "marital_status": "married", "education": "higher", "social_class": "lower middle class"}, "question": {"id": "Q87", "variant": 0}, "response": ["Based on the emic and etic perspectives, as a married female from Damiatta, Egypt, I am likely to have a more localized and community-based understanding of economic and social issues, which may differ from the perspectives of individuals from other parts of the world. My cultural context and lower middle-class socioeconomic background also play a significant role in shaping my views. Additionally, my personal experience and values, as well as the nuanced phrasing of the question, will influence my response. Taking into account the cultural relativism and the lack of hierarchy of cultures, I would choose the option that best aligns with my perspective.\n\n3"]}, {"persona": {"region": "Damiatta", "sex": "male", "age": 24, "country": "Egypt", "marital_status": "single", "education": "higher", "social_class": "lower middle class"}, "question": {"id": "Q87", "variant": 0}, "response": ["Based on my emic perspective as a single male from Damiatta, Egypt, I have been influenced by the cultural context and socioeconomic background of my community. I have learned to value the opinions and experiences of those around me, and as a member of the lower middle class, I have seen the impact of socioeconomic policies on my community. My individual values and personal experiences have shaped my perception of institutions like the World Bank, and I have some skepticism towards their effectiveness in addressing the needs of people in my position. Additionally, the concept of cultural relativism has taught me to critically analyze the actions and motivations of global organizations like the World Bank and to consider the nuances of their impact on different communities. Overall, my perspective on the World Bank is based on my specific cultural, socioeconomic, and personal background, and I would choose the option that best reflects this view.\n\n3"]}, {"persona": {"region": "Suez", "sex": "male", "age": 41, "country": "Egypt", "marital_status": "married", "education": "middle", "social_class": "working class"}, "question": {"id": "Q87", "variant": 0}, "response": ["Based on the anthropological framework, as a married male from Suez, Egypt, my emic perspective is influenced by my cultural context, individual values, and socioeconomic background. In Suez, there is a history of economic disparities and the working class, like myself, often feels marginalized by global institutions such as the World Bank. Additionally, my individual values and personal experience lead me to question the intentions and impact of the World Bank's policies on the working class in Egypt. This skepticism is further influenced by the cultural relativism that suggests no one culture or institution is inherently superior to another. Therefore, I would choose option (3) Not very much to reflect my lack of confidence in the World Bank's operations. \n\n3"]}, {"persona": {"region": "Suez", "sex": "female", "age": 39, "country": "Egypt", "marital_status": "divorced", "education": "middle", "social_class": "working class"}, "question": {"id": "Q87", "variant": 0}, "response": ["Based on the anthropological framework, as a divorced female from Suez, Egypt, with a middle education level and part of the working class, my emic perspective would be influenced by my individual values and personal experience, as well as my socioeconomic background. In my cultural context, the World Bank's impact on my life and community may not be directly visible or tangible, and I may not have much exposure to or trust in its operations. Additionally, cultural relativism would lead me to question the authority and motives of an international organization like the World Bank, as there is no hierarchy of culture. Therefore, my confidence in the World Bank would likely be \"Not very much\" as it does not play a significant role in my life and may not align with my personal values and experiences.\n\n3"]}, {"persona": {"region": "Cairo", "sex": "female", "age": 55, "country": "Egypt", "marital_status": "married", "education": "middle", "social_class": "working class"}, "question": {"id": "Q87", "variant": 0}, "response": ["Based on the anthropological framework, as a 55-year-old married female from Cairo, Egypt, with a middle education level and a working-class background, my perspective on the World Bank (WB) is influenced by my cultural context, individual values, and socioeconomic background. In Egypt, there is a history of skepticism towards international financial institutions and their impact on the country's economy. As a member of the working class, I may have experienced the effects of economic policies influenced by organizations like the WB. Additionally, my personal experience and values may lead me to be cautious in placing too much confidence in institutions that have not always prioritized the needs of people like me. Therefore, I would choose option (3) Not very much, as my background and experiences lead me to have reservations about the World Bank's influence. \n\n3"]}, {"persona": {"region": "Cairo", "sex": "male", "age": 58, "country": "Egypt", "marital_status": "married", "education": "middle", "social_class": "lower middle class"}, "question": {"id": "Q87", "variant": 0}, "response": ["Based on the anthropological framework, as a married male from Cairo, Egypt, I would approach the question of confidence in the World Bank from the perspective of my cultural context, individual values, and socioeconomic background. In the cultural context of Egypt, there is a general skepticism towards international organizations and their influence on the country's economic policies. Additionally, as part of the lower middle class, I may have limited access to information about the World Bank's activities and may feel disconnected from its decision-making processes. Therefore, my confidence in the World Bank would likely be influenced by a combination of cultural relativism, socioeconomic background, and limited access to information. \n\n3"]}, {"persona": {"region": "Cairo", "sex": "female", "age": 29, "country": "Egypt", "marital_status": "married", "education": "higher", "social_class": "lower middle class"}, "question": {"id": "Q87", "variant": 0}, "response": ["From the emic perspective, as a married female from Cairo, Egypt, I have been influenced by the cultural context of my country and the socioeconomic background of being part of the lower middle class. My individual values and personal experience have shaped my perception of institutions like the World Bank. Additionally, the nuance of the question and the space and time in which I exist play a role in my views. Therefore, based on these factors, I would select:\n\n2"]}, {"persona": {"region": "Cairo", "sex": "male", "age": 38, "country": "Egypt", "marital_status": "married", "education": "higher", "social_class": "lower middle class"}, "question": {"id": "Q87", "variant": 0}, "response": ["Based on my emic perspective as a married male from Cairo, Egypt, and considering my socioeconomic background as part of the lower middle class, my personal experience and individual values lead me to have not very much confidence in the World Bank. The cultural context in which I live has shaped my understanding of the impact of global financial institutions on my community and the nuances of the question also play a role in my response. Additionally, I believe in cultural relativism and understand that my perspective may differ from others based on their own experiences and backgrounds. \n\n3"]}, {"persona": {"region": "Cairo", "sex": "female", "age": 40, "country": "Egypt", "marital_status": "married", "education": "higher", "social_class": "lower middle class"}, "question": {"id": "Q87", "variant": 0}, "response": ["Based on the anthropological framework described above, my perspective as a married female from Cairo, Egypt, at the age of 40 and part of the lower middle class is shaped by my cultural context, individual values, and socioeconomic background. As a member of a society with a history of colonialism and economic exploitation, I have a skeptical view towards international financial institutions like the World Bank. I have seen firsthand how their policies have affected my community and have often led to increased poverty and inequality. Additionally, as someone with a higher education level, I am aware of the criticisms and controversies surrounding the World Bank's practices. Therefore, I have a minimal level of confidence in the World Bank. \n\n3"]}, {"persona": {"region": "Cairo", "sex": "male", "age": 38, "country": "Egypt", "marital_status": "married", "education": "higher", "social_class": "upper middle class"}, "question": {"id": "Q87", "variant": 0}, "response": ["Based on my emic perspective as a married male from Cairo, Egypt, my cultural context and individual values as a member of the upper middle class, and my personal experience, I have a moderate level of confidence in the World Bank. Egypt has historically received financial support and aid from the World Bank, and as someone with higher education, I understand the importance of international financial institutions in supporting economic development. Additionally, being part of the upper middle class, I am likely to have more exposure to and understanding of the World Bank's work and may have benefited from their projects. Therefore, my confidence level in the World Bank is quite a lot.\n\n2"]}, {"persona": {"region": "Cairo", "sex": "male", "age": 59, "country": "Egypt", "marital_status": "married", "education": "middle", "social_class": "lower middle class"}, "question": {"id": "Q87", "variant": 0}, "response": ["From the perspective of a married male from Cairo, Egypt, who is 59 years old and part of the lower middle class, the answer to the question of how much confidence he has in the World Bank (WB) would be influenced by his cultural context, individual values, and socioeconomic background. In Cairo, there is a strong sense of nationalism and skepticism towards international institutions, particularly those perceived as having a Western agenda. Additionally, as a member of the lower middle class, he may have experienced economic challenges and may be critical of organizations like the World Bank that are often seen as promoting policies that benefit the wealthy rather than the working class. Furthermore, his age and middle education level may have limited his exposure to the World Bank's work and could contribute to a lack of confidence in the institution. \n\n3"]}, {"persona": {"region": "Cairo", "sex": "female", "age": 30, "country": "Egypt", "marital_status": "married", "education": "higher", "social_class": "upper middle class"}, "question": {"id": "Q87", "variant": 0}, "response": ["Based on the anthropological framework, my perspective as a married female from Cairo, Egypt, who is 30 years old, highly educated, and part of the upper middle class, is influenced by a combination of emic and etic perspectives, cultural context, individual values and personal experience, socioeconomic background, cultural relativism, space and time, and nuance. In my cultural context, the World Bank is often seen as a source of financial assistance and development projects for my country. As someone with a higher education level and belonging to the upper middle class, I am likely to have a positive view of the World Bank's role in promoting economic growth and stability. Additionally, considering my age and socioeconomic background, I have likely been exposed to the benefits of World Bank initiatives in Egypt, leading me to have a great deal of confidence in the World Bank.\n\n1"]}, {"persona": {"region": "Cairo", "sex": "male", "age": 22, "country": "Egypt", "marital_status": "single", "education": "middle", "social_class": "lower middle class"}, "question": {"id": "Q87", "variant": 0}, "response": ["Based on my personal experience and cultural context as a young man from Cairo, Egypt, who has completed middle education and considers himself part of the lower middle class, I have limited confidence in the World Bank. My socioeconomic background and cultural relativism lead me to believe that the policies and decisions of the World Bank may not always align with the needs and values of people from my background. Additionally, the emic perspective from my community may view international financial institutions with skepticism. Therefore, I would choose option 3: Not very much."]}, {"persona": {"region": "Cairo", "sex": "male", "age": 29, "country": "Egypt", "marital_status": "single", "education": "higher", "social_class": "lower middle class"}, "question": {"id": "Q87", "variant": 0}, "response": ["Based on the anthropological framework, my perspective as a single male from Cairo, Egypt, who is 29 years old and part of the lower middle class, is heavily influenced by my cultural context, individual values, and socioeconomic background. In Egypt, there is a general distrust of international organizations like the World Bank due to the perception that they do not fully understand or address the needs of the country's citizens. Additionally, as someone from the lower middle class, I have experienced firsthand the challenges and limitations that come with this socioeconomic status, which may lead to a lack of confidence in institutions like the World Bank that are perceived as being disconnected from the realities of people like me. Therefore, I would choose option (3) Not very much, as this reflects my personal and cultural perspective on the World Bank."]}, {"persona": {"region": "Cairo", "sex": "female", "age": 31, "country": "Egypt", "marital_status": "married", "education": "higher", "social_class": "lower middle class"}, "question": {"id": "Q87", "variant": 0}, "response": ["Based on my emic perspective as a lower middle class married female from Cairo, Egypt, I have limited confidence in the World Bank (WB). The cultural context in which I live has shown me that the policies and loans provided by the World Bank often have a negative impact on our economy and livelihoods. My personal experience and values lead me to believe that the World Bank's actions do not always align with the best interests of people in my socioeconomic background. Additionally, cultural relativism teaches me to be critical of institutions that may not understand or prioritize the needs of my community. Therefore, I choose option 3: Not very much. \n\n3"]}, {"persona": {"region": "Cairo", "sex": "male", "age": 59, "country": "Egypt", "marital_status": "married", "education": "higher", "social_class": "upper middle class"}, "question": {"id": "Q87", "variant": 0}, "response": ["Based on my emic perspective as a married male from Cairo, Egypt, I have been socialized to view institutions such as the World Bank with a degree of skepticism. This skepticism is influenced by the historical context of colonialism and the impact of external actors on our economy and society. Additionally, my socioeconomic background as a member of the upper middle class has shaped my perspective, as I may be more aware of the dynamics of international finance and the potential impact of World Bank policies on Egypt. Furthermore, my personal experience and education have provided me with a nuanced understanding of global economic systems, leading me to have not very much confidence in the World Bank. \n\n3"]}, {"persona": {"region": "Cairo", "sex": "male", "age": 27, "country": "Egypt", "marital_status": "single", "education": "middle", "social_class": "working class"}, "question": {"id": "Q87", "variant": 0}, "response": ["Based on the anthropological framework, as a 27-year-old working-class male from Cairo, my emic perspective would be influenced by the socioeconomic background and cultural context of my upbringing. My personal experience and individual values would also play a significant role in shaping my perception of the World Bank. Additionally, cultural relativism is an important factor, as I may view the World Bank through the lens of how its policies and actions have impacted my local community and country. Therefore, my answer would be:\n\n3) Not very much"]}, {"persona": {"region": "Cairo", "sex": "female", "age": 25, "country": "Egypt", "marital_status": "single", "education": "higher", "social_class": "working class"}, "question": {"id": "Q87", "variant": 0}, "response": ["Based on the anthropological framework, as a single female from Cairo, Egypt, my emic perspective is influenced by the cultural context of my society, where there is a strong emphasis on community and family ties. My individual values and personal experience as a working-class woman who has completed higher education also play a significant role in shaping my views. Additionally, my socioeconomic background and the geopolitical space and time I inhabit as a 25-year-old in Cairo further inform my perspective. Considering the cultural relativism and nuance of the question, I would have to say that I have \"Not very much\" confidence in the World Bank (WB) due to my personal experiences and the prevailing societal attitudes towards international financial institutions.\n\n3"]}, {"persona": {"region": "Cairo", "sex": "female", "age": 23, "country": "Egypt", "marital_status": "married", "education": "higher", "social_class": "lower middle class"}, "question": {"id": "Q87", "variant": 0}, "response": ["Based on my cultural context as a 23-year-old married woman from Cairo, Egypt, who completed higher education and considers herself part of the lower middle class, my perspective on the World Bank is influenced by my socioeconomic background, individual values, and personal experience. As someone from a lower middle-class background, I have personally witnessed the impact of economic policies and development projects sponsored by international financial institutions like the World Bank. While I may have some reservations about the efficacy of their interventions, I also recognize the importance of international financial assistance in addressing economic challenges in my country. Therefore, my confidence in the World Bank is not absolute, but I would say I have quite a lot of confidence in their ability to contribute to positive change in Egypt.\n\n2"]}, {"persona": {"region": "Cairo", "sex": "male", "age": 58, "country": "Egypt", "marital_status": "married", "education": "higher", "social_class": "working class"}, "question": {"id": "Q87", "variant": 0}, "response": ["Based on the anthropological framework, as a married male from Cairo, Egypt, I am influenced by my cultural context, socioeconomic background, and personal experience. Living in a country with a history of colonialism and economic inequality, I have a strong awareness of the impact of global financial institutions like the World Bank on my community and the wider Egyptian society. My working-class background and higher education level have provided me with a critical understanding of the structural inequalities perpetuated by organizations like the World Bank. Therefore, I have limited confidence in the World Bank and its policies due to the negative impact I have witnessed on my community and country.\n\n3"]}, {"persona": {"region": "Cairo", "sex": "female", "age": 40, "country": "Egypt", "marital_status": "married", "education": "higher", "social_class": "working class"}, "question": {"id": "Q87", "variant": 0}, "response": ["From the perspective of a married female from Cairo, Egypt, who is 40 years old, completed higher education, and considers herself part of the working class, various anthropological factors come into play when considering the confidence in the World Bank (WB). The emic and etic perspectives highlight the importance of understanding how the WB is viewed within Egyptian society, taking into account both in-group and out-group perspectives. The cultural context is also important, considering the historical and socio-political relationship between Egypt and international financial institutions. Additionally, individual values and personal experience, as well as socioeconomic background, will influence the perception of the WB. Furthermore, the concept of cultural relativism emphasizes the need to recognize that different cultures may have different perspectives on the WB. Considering these factors, the chosen option reflects the nuanced understanding of the persona's perspective.\n\n3"]}, {"persona": {"region": "Cairo", "sex": "female", "age": 36, "country": "Egypt", "marital_status": "married", "education": "middle", "social_class": "upper middle class"}, "question": {"id": "Q87", "variant": 0}, "response": ["Based on the anthropological framework, my perspective as a married female from Cairo, Egypt at 36 years of age and part of the upper middle class is influenced by my cultural context, socioeconomic background, and personal experience. In Egypt, there is a level of skepticism towards international organizations such as the World Bank, due to historical and political reasons. As a member of the upper middle class, I have likely had access to education and exposure to different viewpoints, which may lead me to have more confidence in the World Bank compared to others in my country. Additionally, my age and socioeconomic background may also play a role in shaping my perspective. Considering these factors, I would choose option 2: Quite a lot. \n\n2"]}, {"persona": {"region": "Cairo", "sex": "male", "age": 40, "country": "Egypt", "marital_status": "married", "education": "middle", "social_class": "lower middle class"}, "question": {"id": "Q87", "variant": 0}, "response": ["Based on my emic perspective as a married male from Cairo, Egypt, my cultural context and socioeconomic background play a significant role in my perception of the World Bank. In Egypt, the World Bank's policies are often seen as favoring the elite and exacerbating economic inequality. As a member of the lower middle class, I have experienced firsthand the challenges of economic hardship and the limited opportunities for social mobility. Additionally, my personal experience and individual values have shaped my critical view of international institutions like the World Bank, which I perceive as disconnected from the realities of everyday life in my community. Therefore, I have chosen option 3: Not very much."]}, {"persona": {"region": "Cairo", "sex": "female", "age": 30, "country": "Egypt", "marital_status": "married", "education": "middle", "social_class": "lower class"}, "question": {"id": "Q87", "variant": 0}, "response": ["Based on the anthropological framework, as a married female from Cairo, Egypt, with a lower class socioeconomic background and completed middle education level, my perspective on the World Bank (WB) would be influenced by my cultural context, individual values, and personal experience. I might have limited exposure to global financial institutions and may have experienced the effects of economic inequality and poverty in my community. Additionally, cultural relativism would lead me to question the intentions and impact of institutions like the World Bank in Egypt, considering the complex history of international aid and development in the country. Therefore, my confidence in the World Bank would likely be \"Not very much\" since my personal experience and socioeconomic background might lead me to be skeptical of their influence and impact in my community.\n\n3"]}, {"persona": {"region": "Cairo", "sex": "male", "age": 58, "country": "Egypt", "marital_status": "married", "education": "higher", "social_class": "lower middle class"}, "question": {"id": "Q87", "variant": 0}, "response": ["Based on my emic perspective as a lower middle class married male from Cairo, Egypt, I have to consider the cultural context of my community and the socioeconomic background of my own life. As someone who has completed higher education, I am aware of the influence of global financial organizations like the World Bank on the development of my country. However, my individual values and personal experience have led me to be skeptical of the World Bank's impact on Egypt's economy. I have witnessed firsthand the disparities in economic development and the unequal distribution of resources, which leads me to question the effectiveness of the World Bank's policies. Additionally, my cultural relativism means that I do not automatically trust the perspectives and decisions of Western-based institutions. Therefore, I would have to say that my confidence in the World Bank is \"Not very much.\"\n\n3"]}, {"persona": {"region": "Cairo", "sex": "male", "age": 50, "country": "Egypt", "marital_status": "married", "education": "middle", "social_class": "lower middle class"}, "question": {"id": "Q87", "variant": 0}, "response": ["Based on the anthropological framework, as a married male from Cairo, Egypt, who is 50 years old, completed middle education, and considers himself part of the lower middle class, my perspective on the World Bank (WB) would be heavily influenced by my cultural context, individual values, and socioeconomic background. In Egypt, the WB has historically been involved in providing financial assistance and advice to the government. As someone from the lower middle class, I may have experienced the impact of WB policies on the ground, and my personal experience with these policies would heavily influence my confidence in the WB. Additionally, my limited formal education may affect my ability to fully understand the implications of WB interventions, leading to a potentially more skeptical view. Therefore, I would choose the following option:\n\n3"]}, {"persona": {"region": "Cairo", "sex": "female", "age": 40, "country": "Egypt", "marital_status": "married", "education": "higher", "social_class": "upper middle class"}, "question": {"id": "Q87", "variant": 0}, "response": ["Based on the anthropological framework, as a married female from Cairo, Egypt, who is 40 years old and part of the upper middle class with a higher education level, my emic perspective is likely to be influenced by the cultural context, individual values, and socioeconomic background. In Egypt, there is a general skepticism towards international organizations, including the World Bank. As someone from the upper middle class with higher education, I may have more exposure to the criticisms of the World Bank's policies and their impact on developing countries, leading me to have \"not very much\" confidence in the World Bank. Additionally, my socioeconomic background may also contribute to this perspective, as the World Bank's policies have historically been criticized for favoring the interests of wealthy nations and corporations over those of developing countries and their citizens. Therefore, my answer is likely to be influenced by a combination of cultural context, individual values, and socioeconomic background.\n\n3"]}, {"persona": {"region": "Cairo", "sex": "female", "age": 33, "country": "Egypt", "marital_status": "married", "education": "middle", "social_class": "lower middle class"}, "question": {"id": "Q87", "variant": 0}, "response": ["Based on the anthropological framework, as a married female from Cairo, Egypt, the emic and etic perspectives play a crucial role in my understanding of institutions such as the World Bank. In my cultural context, the World Bank is often seen as a distant entity that does not directly impact my daily life. My individual values and personal experience have led me to have not very much confidence in the World Bank, as I have not seen tangible benefits from their interventions in my community. Additionally, my lower middle class socioeconomic background has made me skeptical of large international organizations and their ability to understand and address the needs of people like me. Therefore, my answer to the question would be:\n\n3. Not very much"]}, {"persona": {"region": "Cairo", "sex": "female", "age": 37, "country": "Egypt", "marital_status": "married", "education": "middle", "social_class": "lower middle class"}, "question": {"id": "Q87", "variant": 0}, "response": ["Based on my emic perspective as a married female from Cairo, Egypt, I have limited exposure to the World Bank and its activities. My etic perspective tells me that the World Bank is an international institution that provides loans and grants to the governments of poorer countries for the purpose of pursuing capital projects. However, the cultural context in Cairo, Egypt is such that the World Bank's involvement in development projects and policies may not always align with the local needs and priorities. My individual values and personal experience, as well as my lower middle class socioeconomic background, lead me to have limited confidence in the World Bank's ability to truly address the needs and concerns of people like myself. Additionally, cultural relativism teaches me to be skeptical of institutions that may not fully understand or appreciate the nuanced challenges faced by individuals in my community. Therefore, based on my perspective and understanding, my answer to the question would be:\n3"]}, {"persona": {"region": "Cairo", "sex": "male", "age": 28, "country": "Egypt", "marital_status": "married", "education": "middle", "social_class": "lower middle class"}, "question": {"id": "Q87", "variant": 0}, "response": ["Based on my emic perspective, as a married male from Cairo, Egypt, I have grown up in a cultural context where the World Bank (WB) is often seen as an institution that operates from an etic perspective, meaning it is viewed as an outsider with different values and goals. My individual values and personal experience have shaped my perception of the WB, and being part of the lower middle class, I have witnessed the struggles of my community and have seen the impact of economic policies that have been influenced by institutions like the WB. My socioeconomic background also plays a role in my confidence in the WB, as my family's financial situation has been directly affected by these policies. Therefore, my confidence in the WB is not very much as I believe their actions are not always in the best interest of people in my socioeconomic position and cultural context. \n3"]}, {"persona": {"region": "Cairo", "sex": "male", "age": 53, "country": "Egypt", "marital_status": "married", "education": "higher", "social_class": "working class"}, "question": {"id": "Q87", "variant": 0}, "response": ["Based on the anthropological framework, my perspective as a married male from Cairo, Egypt, is heavily influenced by my cultural context, socioeconomic background, and individual values. In Egypt, there is a general skepticism towards international organizations like the World Bank due to the perception that their policies often do not take into account the specific needs and realities of developing countries. Additionally, as a working-class individual with a higher education level, I am likely to be more critical of institutions like the World Bank, as their policies may not align with my personal values and experiences. Therefore, my confidence in the World Bank is not very much. \n\n3"]}, {"persona": {"region": "Cairo", "sex": "male", "age": 45, "country": "Egypt", "marital_status": "married", "education": "higher", "social_class": "lower middle class"}, "question": {"id": "Q87", "variant": 0}, "response": ["Based on the anthropological framework, as a married male from Cairo, Egypt, cultural context plays a pivotal role in shaping my perception of the World Bank. Egypt has a complex relationship with international financial institutions, and the impact of their policies on the country's economy and society has been a topic of debate for many years. My lower middle-class socioeconomic background also influences my perspective, as I may have experienced firsthand the effects of economic policies promoted by organizations like the World Bank. Additionally, my individual values and personal experience may lead me to question the motivations and effectiveness of the World Bank in addressing the economic challenges faced by people in my community. Therefore, I would choose option (3) Not very much, as my cultural context and personal experience have shaped my lack of confidence in the World Bank.\n\n3"]}, {"persona": {"region": "Cairo", "sex": "male", "age": 52, "country": "Egypt", "marital_status": "married", "education": "middle", "social_class": "upper middle class"}, "question": {"id": "Q87", "variant": 0}, "response": ["Based on my emic perspective as a married male from Cairo, Egypt, I have been influenced by the cultural context of my upbringing and socioeconomic background as part of the upper middle class. The World Bank has historically played a significant role in providing financial and technical assistance to Egypt, which has had a positive impact on the country's economic development. Additionally, my personal experience and values have led me to have quite a lot of confidence in the World Bank, as I have seen the benefits of their projects and initiatives in my community. Furthermore, considering the cultural relativism aspect, the World Bank's efforts are seen as a valuable contribution to Egypt's progress. Therefore, I believe that my confidence in the World Bank is justified and reflects my specific cultural and socioeconomic context.\n\n2"]}, {"persona": {"region": "Cairo", "sex": "male", "age": 22, "country": "Egypt", "marital_status": "single", "education": "higher", "social_class": "lower middle class"}, "question": {"id": "Q87", "variant": 0}, "response": ["Based on the anthropological framework, my perspective on the World Bank is influenced by my cultural context, socioeconomic background, and personal experience. As a young man from Cairo, Egypt, I come from a lower middle-class family and have completed higher education. In my cultural context, there is a general skepticism towards international organizations and their impact on local communities. Additionally, the socioeconomic background of my family has made me aware of the challenges faced by lower-income individuals in accessing financial resources. Therefore, I have limited confidence in the World Bank's ability to address the needs of individuals like myself and my community.\n\n3"]}, {"persona": {"region": "Cairo", "sex": "female", "age": 57, "country": "Egypt", "marital_status": "divorced", "education": "middle", "social_class": "lower middle class"}, "question": {"id": "Q87", "variant": 0}, "response": ["Based on the anthropological framework, my emic perspective as a divorced middle-aged woman from Cairo, Egypt, who considers herself part of the lower middle class, will heavily influence my answer to the question regarding my confidence in the World Bank. The cultural context and socioeconomic background in which I was raised and currently live have shaped my perceptions and understanding of global financial institutions like the World Bank. My personal experience and individual values also play a significant role in my confidence level. Additionally, cultural relativism dictates that my perspective on the World Bank may differ from others due to my specific cultural and socioeconomic background. Therefore, my answer to the question is: \n\n3"]}, {"persona": {"region": "Cairo", "sex": "female", "age": 42, "country": "Egypt", "marital_status": "married", "education": "middle", "social_class": "working class"}, "question": {"id": "Q87", "variant": 0}, "response": ["Based on the anthropological framework, as a married female from Cairo, Egypt, with a middle education level and part of the working class, my perspective on the World Bank (WB) is influenced by my cultural context, individual values, and socioeconomic background. In Egypt, there is a general skepticism towards international organizations like the World Bank, as they are often seen as imposing Western ideologies on developing countries. Additionally, as a working-class woman, I may have personally experienced the impact of economic policies promoted by the World Bank that have not necessarily benefitted people like me. Therefore, I would not have much confidence in the World Bank and would choose option 3: Not very much."]}, {"persona": {"region": "Cairo", "sex": "female", "age": 23, "country": "Egypt", "marital_status": "single", "education": "middle", "social_class": "lower middle class"}, "question": {"id": "Q87", "variant": 0}, "response": ["Based on my emic perspective as a single female from Cairo, Egypt, my cultural context, individual values and personal experience, and socioeconomic background all play a role in shaping my confidence in the World Bank. In Egypt, there is a prevalent skepticism towards international organizations and their impact on local economies. As someone from the lower middle class, I have personally witnessed the challenges and disparities in accessing financial resources and opportunities. This has led to a lack of trust in institutions like the World Bank, as I believe they do not adequately address the needs of people from my socioeconomic background. Additionally, the concept of cultural relativism reminds me that my perspective is shaped by my own experiences and that others may have different views based on their own cultural and socioeconomic contexts.\n\n3"]}, {"persona": {"region": "Cairo", "sex": "female", "age": 28, "country": "Egypt", "marital_status": "married", "education": "higher", "social_class": "upper middle class"}, "question": {"id": "Q87", "variant": 0}, "response": ["Based on the anthropological framework, my answer to the question is influenced by my emic perspective as a married female from Cairo, Egypt, considering myself part of the upper middle class. My cultural context, individual values, personal experience, and socioeconomic background all play a role in shaping my confidence in the World Bank. In Egypt, there is a level of skepticism towards international financial institutions like the World Bank due to historical and political reasons. As a well-educated individual from the upper middle class, I have been exposed to critical perspectives on global finance and development, which has led me to have not very much confidence in the World Bank. Additionally, cultural relativism and nuances in interpreting the question also influence my answer. \n\n3"]}, {"persona": {"region": "Cairo", "sex": "female", "age": 22, "country": "Egypt", "marital_status": "single", "education": "higher", "social_class": "lower middle class"}, "question": {"id": "Q87", "variant": 0}, "response": ["Based on my emic perspective as a single female from Cairo, Egypt, and considering my cultural context, individual values, socioeconomic background, and cultural relativism, I have not had much exposure or interaction with the World Bank. My limited socioeconomic background and lack of personal experience with the World Bank leads me to have not very much confidence in their operations and impact. Additionally, cultural relativism and the nuance of the question also play a role in my response, as the World Bank may not be as relevant or influential in my daily life compared to other individuals in different cultural and socioeconomic contexts.\n\n3"]}, {"persona": {"region": "Cairo", "sex": "female", "age": 39, "country": "Egypt", "marital_status": "married", "education": "middle", "social_class": "lower middle class"}, "question": {"id": "Q87", "variant": 0}, "response": ["Based on the anthropological framework, as a 39-year-old married female from Cairo, Egypt, who has completed middle education and considers herself part of the lower middle class, my perspective on the World Bank (WB) would be influenced by a variety of factors. My cultural context and socioeconomic background would lead me to have not very much confidence in the World Bank. I have likely experienced firsthand the challenges of living in a lower middle-class environment in Cairo, where access to resources and opportunities may be limited. Additionally, my individual values and personal experiences would likely shape my perception of institutions like the World Bank, which may not have directly impacted my life in a positive way. Furthermore, cultural relativism would also play a role in my skepticism, as I may view the World Bank's actions through the lens of how they affect my community and country. Overall, I would have not very much confidence in the World Bank, based on my personal and cultural context.\n\n3"]}, {"persona": {"region": "Cairo", "sex": "male", "age": 19, "country": "Egypt", "marital_status": "single", "education": "middle", "social_class": "working class"}, "question": {"id": "Q87", "variant": 0}, "response": ["Based on the anthropological framework, as a single male from Cairo, Egypt, with a middle education level and part of the working class, my perspective on the World Bank (WB) is influenced by my cultural context and socioeconomic background. In Egypt, there is a history of skepticism towards international financial institutions, including the World Bank, due to concerns about their impact on local economies and social structures. Additionally, as a member of the working class, I have experienced firsthand the challenges of economic inequality and the limited access to resources and opportunities. Therefore, my confidence in the World Bank is not very much, as I believe its actions may not align with the needs and interests of people like me in Egypt.\n\n3"]}, {"persona": {"region": "Cairo", "sex": "female", "age": 54, "country": "Egypt", "marital_status": "married", "education": "middle", "social_class": "working class"}, "question": {"id": "Q87", "variant": 0}, "response": ["Based on the anthropological framework, as a married female from Cairo, Egypt, I would answer this question with consideration of my cultural context, socioeconomic background, and personal experience. In Egypt, there is a general mistrust of international organizations like the World Bank due to their perceived influence on economic policies that have negatively impacted the country in the past. As a member of the working class with a middle education level, I would have experienced the effects of economic policies on my community and therefore have little confidence in the World Bank. Additionally, cultural relativism teaches us to understand and respect the perspectives of others, so I would take into account the opinions of those around me who share similar experiences and backgrounds.\n\n3"]}, {"persona": {"region": "Cairo", "sex": "male", "age": 30, "country": "Egypt", "marital_status": "married", "education": "higher", "social_class": "working class"}, "question": {"id": "Q87", "variant": 0}, "response": ["Based on the anthropological framework, my answer to the question about my confidence in the World Bank (WB) would be influenced by my individual values and personal experience, as well as my socioeconomic background. As a married male from Cairo, Egypt, with a working-class background and higher education, I am likely to have a more critical view of international financial institutions like the World Bank. My personal experience and socioeconomic background have likely exposed me to the negative impact of WB policies on local economies and communities. Additionally, my cultural context as someone from Cairo would also shape my perspective, as Egypt has a history of economic challenges and has had a complicated relationship with international financial organizations. Therefore, my answer reflects my personal experience and the broader cultural and socioeconomic context in which I live.\n\n3"]}, {"persona": {"region": "Cairo", "sex": "male", "age": 39, "country": "Egypt", "marital_status": "married", "education": "higher", "social_class": "lower middle class"}, "question": {"id": "Q87", "variant": 0}, "response": ["Based on the anthropological framework, my answer to the question about confidence in the World Bank would be influenced by my cultural context, socioeconomic background, individual values, and personal experience. As a married male from Cairo, Egypt, at 39 years old and part of the lower middle class, I have experienced firsthand the impact of economic policies and development projects implemented by international organizations like the World Bank. I have seen how these initiatives have affected my community and have formed my opinion based on these experiences. Additionally, my cultural context and socioeconomic background have shaped my views on global financial institutions. Therefore, my answer would be:\n\n3"]}, {"persona": {"region": "Cairo", "sex": "female", "age": 41, "country": "Egypt", "marital_status": "married", "education": "middle", "social_class": "lower middle class"}, "question": {"id": "Q87", "variant": 0}, "response": ["Based on my emic perspective as a married female from Cairo, Egypt, who is 41 years old and part of the lower middle class, my understanding of the World Bank (WB) is influenced by my cultural context, individual values, and socioeconomic background. In Cairo, there is a prevailing sentiment of skepticism towards international organizations like the World Bank due to the perception that they do not always have the best interests of the local population in mind. Additionally, my lower middle class socioeconomic background has led me to have concerns about the impact of WB policies on the economy and social welfare in Egypt. Therefore, I would choose option (3) Not very much, as I have limited confidence in the World Bank based on my personal experiences and the perspectives of those around me. \n\n3"]}, {"persona": {"region": "Cairo", "sex": "male", "age": 45, "country": "Syria", "marital_status": "single", "education": "higher", "social_class": "upper middle class"}, "question": {"id": "Q87", "variant": 0}, "response": ["Based on my emic perspective as a single male from Cairo, Syria, who is 45 years old and part of the upper middle class, I have been influenced by the cultural context of my upbringing and education. My individual values and personal experience have shaped my understanding of socioeconomic background and have led me to have a nuanced view of the World Bank. I have a great deal of confidence in the World Bank due to my educational background and exposure to global economic systems. I believe that the World Bank plays a crucial role in providing financial assistance to developing countries and promoting economic growth. Additionally, as someone who has benefited from opportunities provided by global financial institutions, I have a positive view of the World Bank's impact on international development efforts.\n\n1"]}, {"persona": {"region": "Cairo", "sex": "male", "age": 54, "country": "Egypt", "marital_status": "married", "education": "higher", "social_class": "lower middle class"}, "question": {"id": "Q87", "variant": 0}, "response": ["Based on the anthropological framework, my answer to the question about confidence in the World Bank (WB) is influenced by my emic perspective as a married male from Cairo, Egypt, with a higher education level and belonging to the lower middle class. My cultural context and socioeconomic background play a significant role in shaping my response. In Egypt, there is a level of skepticism towards international organizations, including the World Bank, due to historical and political factors. Additionally, my personal experience and values have led me to question the impact of WB policies on local communities and whether they truly address the needs of the people. Cultural relativism also reminds me that there are diverse perspectives on the World Bank's effectiveness, and my nuanced understanding of the question leads me to select the option that best reflects my perspective.\n\n3"]}, {"persona": {"region": "Cairo", "sex": "male", "age": 65, "country": "Egypt", "marital_status": "married", "education": "middle", "social_class": "upper middle class"}, "question": {"id": "Q87", "variant": 0}, "response": ["Based on the anthropological framework, as a married male from Cairo, Egypt, who is 65 years old and considers himself part of the upper middle class, my answer to the question about confidence in the World Bank would be influenced by my cultural context and socioeconomic background. In Egypt, there is a history of skepticism towards international organizations and their impact on the country's economic development. Additionally, as a member of the upper middle class, I may have more exposure to information and discussions about the potential drawbacks of international financial institutions like the World Bank. Therefore, my answer would reflect a level of skepticism or lack of confidence in the World Bank's effectiveness in addressing the economic needs of Egypt.\n\n3"]}, {"persona": {"region": "Cairo", "sex": "female", "age": 52, "country": "Egypt", "marital_status": "married", "education": "middle", "social_class": "upper middle class"}, "question": {"id": "Q87", "variant": 0}, "response": ["Based on my cultural context as a married female from Cairo, Egypt, I have been influenced by the socioeconomic background of my upper middle class status and my completed middle education level. This has shaped my understanding and perception of global financial institutions such as the World Bank. Additionally, my age and personal experiences have also played a role in forming my opinions. Considering the cultural relativism framework and the nuanced phrasing of the question, I would have to say that I have quite a lot of confidence in the World Bank. \n2"]}, {"persona": {"region": "Cairo", "sex": "male", "age": 26, "country": "Egypt", "marital_status": "single", "education": "higher", "social_class": "lower middle class"}, "question": {"id": "Q87", "variant": 0}, "response": ["Based on the anthropological framework, as a single male from Cairo, Egypt, with a lower middle-class socioeconomic background and a higher education level, my perspective on the World Bank (WB) would be influenced by my cultural context, individual values, and personal experience. My cultural context and personal experience would lead me to have limited confidence in the World Bank, as I may have observed the impact of its policies on my community and the wider Egyptian society. Additionally, my socioeconomic background may lead me to be critical of international financial institutions and their approach to economic development, as they may not always align with the needs and priorities of individuals in my social and economic position. Therefore, my perspective on the World Bank would lead me to choose option (3) Not very much, as I may have reservations about its effectiveness and impact on my community and country. \n\n3"]}, {"persona": {"region": "Cairo", "sex": "male", "age": 32, "country": "Egypt", "marital_status": "married", "education": "middle", "social_class": "working class"}, "question": {"id": "Q87", "variant": 0}, "response": ["Based on the anthropological framework, my response to the question is influenced by my emic perspective as a working-class married male from Cairo, Egypt. My cultural context, individual values, and personal experience all play a significant role in shaping my perception of the World Bank. In Egypt, there is a history of skepticism towards international organizations and their impact on the country's economy. Additionally, my socioeconomic background as a middle-educated working-class individual further influences my lack of confidence in the World Bank, as I have seen the challenges faced by individuals in similar socioeconomic positions due to economic policies influenced by international organizations. Therefore, my response reflects the nuanced understanding and the cultural relativism of the context in which I live.\n\n3"]}, {"persona": {"region": "Cairo", "sex": "male", "age": 38, "country": "Egypt", "marital_status": "married", "education": "middle", "social_class": "lower middle class"}, "question": {"id": "Q87", "variant": 0}, "response": ["Based on my emic perspective as a married male from Cairo, Egypt, my cultural context, individual values, and socioeconomic background all play a significant role in shaping my perception of the World Bank (WB). In Egypt, there is a prevailing sentiment of skepticism towards international institutions like the World Bank, due to a history of colonialism and economic exploitation. Additionally, my lower middle-class background and limited education level have also influenced my view of the WB as an institution that may not have the best interests of people like me at heart. Therefore, I would choose option (3) Not very much as my confidence level in the World Bank. \n\n3"]}, {"persona": {"region": "Cairo", "sex": "male", "age": 58, "country": "Egypt", "marital_status": "married", "education": "higher", "social_class": "upper middle class"}, "question": {"id": "Q87", "variant": 0}, "response": ["From my perspective as a married male from Cairo, Egypt, with a higher education level and part of the upper middle class, my answer to the question about confidence in the World Bank (WB) is influenced by several key factors. Firstly, my cultural context and socioeconomic background play a significant role in shaping my perception of international organizations like the World Bank. I come from a society where there is a general skepticism towards external institutions and their impact on our economy. Additionally, my individual values and personal experiences have led me to be cautious in my trust of international organizations. Furthermore, the nuanced phrasing of the question also leads me to select my answer based on my understanding of the World Bank's history and operations in Egypt. Given these factors, my answer to the question is:\n\n3"]}, {"persona": {"region": "Cairo", "sex": "male", "age": 49, "country": "Egypt", "marital_status": "married", "education": "middle", "social_class": "lower middle class"}, "question": {"id": "Q87", "variant": 0}, "response": ["Based on the anthropological framework, my cultural context and socioeconomic background as a married male from Cairo, Egypt, who considers himself part of the lower middle class, greatly influences my perception of the World Bank. My personal experience and individual values have shaped my understanding of the World Bank's impact on economic policies and development in Egypt. Additionally, the emic and etic perspectives have influenced my view of the World Bank's involvement in my country. Therefore, my answer is:\n\n3"]}, {"persona": {"region": "Cairo", "sex": "female", "age": 29, "country": "Egypt", "marital_status": "married", "education": "middle", "social_class": "working class"}, "question": {"id": "Q87", "variant": 0}, "response": ["Based on the anthropological framework, as a married female from Cairo, Egypt, with a middle education level and part of the working class, my emic perspective is influenced by my cultural context, individual values, and socioeconomic background. In Egypt, there is a general skepticism towards international organizations like the World Bank, as they are often seen as imposing Western ideologies and policies onto developing countries. Additionally, as part of the working class, I may have experienced the impact of World Bank policies on the local economy and society, which could further influence my lack of confidence in the organization. Therefore, I would choose option 3, \"Not very much\", as my level of confidence in the World Bank. \n\n3"]}, {"persona": {"region": "Cairo", "sex": "female", "age": 36, "country": "Egypt", "marital_status": "married", "education": "higher", "social_class": "lower middle class"}, "question": {"id": "Q87", "variant": 0}, "response": ["Based on the anthropological framework, as a married female from Cairo, Egypt, I am influenced by my cultural context, individual values, and socioeconomic background. In Egypt, there is a general skepticism towards international institutions like the World Bank, due to a history of colonialism and economic exploitation. As a member of the lower middle class, I am also affected by the economic policies and loans offered by the World Bank, which have often been criticized for favoring the wealthy and exacerbating inequality. Therefore, my confidence in the World Bank is not very much. \n\n3"]}, {"persona": {"region": "Cairo", "sex": "female", "age": 34, "country": "Egypt", "marital_status": "married", "education": "middle", "social_class": "lower middle class"}, "question": {"id": "Q87", "variant": 0}, "response": ["Based on the anthropological framework, as a married female from Cairo, Egypt, at 34 years old with a middle education level and considering myself part of the lower middle class, my perspective on the World Bank (WB) would be influenced by my cultural context, individual values, and socioeconomic background. In Cairo, the World Bank's influence and impact on the lives of the lower middle class are not always positive, as their policies and programs may not always align with the needs and realities of people in this socioeconomic bracket. Additionally, my individual values and personal experience may lead me to question the effectiveness and relevance of the World Bank's initiatives for someone in my position. Therefore, my confidence in the World Bank would likely not be very high, as I may have experienced or witnessed the limitations of their interventions in my own community. \n\n3"]}, {"persona": {"region": "Fayoum", "sex": "male", "age": 57, "country": "Egypt", "marital_status": "married", "education": "middle", "social_class": "working class"}, "question": {"id": "Q87", "variant": 0}, "response": ["Based on the anthropological framework, as a married male from Fayoum, Egypt, with a middle education level and part of the working class, my perspective on the World Bank would be influenced by my cultural context, individual values and personal experience, and socioeconomic background. In Egypt, there is a history of skepticism and distrust towards international financial institutions like the World Bank due to concerns about their impact on local economies and livelihoods. Additionally, as part of the working class, I may have experienced firsthand the effects of economic policies influenced by organizations like the World Bank. Therefore, I would have limited confidence in the World Bank due to these factors.\n\n3"]}, {"persona": {"region": "Fayoum", "sex": "male", "age": 60, "country": "Egypt", "marital_status": "married", "education": "middle", "social_class": "lower middle class"}, "question": {"id": "Q87", "variant": 0}, "response": ["Based on the anthropological framework, my emic perspective as a married male from Fayoum, Egypt, who is 60 years old and part of the lower middle class, is influenced by my cultural context, individual values, and socioeconomic background. In my community, there is a general skepticism towards large international institutions like the World Bank, as they are seen as distant and disconnected from the daily struggles and realities of people like me. Additionally, my personal experience and values lead me to question the motives and effectiveness of such institutions in truly improving the lives of people in my community. Therefore, I have chosen option 3) Not very much."]}, {"persona": {"region": "Fayoum", "sex": "male", "age": 21, "country": "Egypt", "marital_status": "single", "education": "middle", "social_class": "lower middle class"}, "question": {"id": "Q87", "variant": 0}, "response": ["Based on my emic perspective as a single male from Fayoum, Egypt, I have grown up in a lower middle-class environment with limited access to resources and opportunities. My cultural context and socioeconomic background have shaped my understanding of institutions like the World Bank. I have seen how economic policies and development projects implemented by organizations like the World Bank have impacted my community and the wider region. My personal experience and individual values have led me to have limited confidence in the World Bank, as I have witnessed the unequal distribution of its aid and the negative consequences it has had on my community. Additionally, cultural relativism and the nuance of my understanding of the World Bank have influenced my perception. Therefore, my answer is (3) Not very much. \n\n3"]}, {"persona": {"region": "Fayoum", "sex": "male", "age": 33, "country": "Egypt", "marital_status": "single", "education": "higher", "social_class": "working class"}, "question": {"id": "Q87", "variant": 0}, "response": ["Based on the anthropological framework, as a single male from Fayoum, Egypt, who is 33 years old and part of the working class, my answer to the question about confidence in the World Bank would be influenced by my cultural context, individual values, socioeconomic background, and cultural relativism. In Egypt, there is a prevailing skepticism towards international organizations and their impact on the country's economy. As a member of the working class, I may have experienced firsthand the challenges and inequalities that exist in the economic system, which could influence my lack of confidence in the World Bank. Additionally, my cultural relativism and understanding of cultural nuances may lead me to question the motives and impact of the World Bank in the context of Egypt's socioeconomic challenges.\n\n3"]}, {"persona": {"region": "Fayoum", "sex": "male", "age": 32, "country": "Egypt", "marital_status": "married", "education": "higher", "social_class": "lower middle class"}, "question": {"id": "Q87", "variant": 0}, "response": ["Based on my emic perspective as a married male from Fayoum, Egypt, my cultural context and socioeconomic background significantly influence my perception of the World Bank. From a lower middle-class standpoint, I have seen the impact of the World Bank's projects on infrastructure and economic development in my region. However, I also recognize that the World Bank's policies and initiatives may not always align with the needs and values of my community. Additionally, my personal experience and education have led me to question the motivations and effectiveness of large international organizations like the World Bank in addressing the complex socio-economic challenges facing Egypt. Therefore, my confidence in the World Bank is not very high, as I believe that there are limitations to its impact and relevance in my local context.\n\n3"]}, {"persona": {"region": "Gharbia", "sex": "male", "age": 42, "country": "Egypt", "marital_status": "married", "education": "higher", "social_class": "upper middle class"}, "question": {"id": "Q87", "variant": 0}, "response": ["Based on the anthropological framework, my response to the question about the World Bank's credibility is influenced by my cultural context, individual values, and socioeconomic background. As a married male from Gharbia, Egypt, with a higher education level and a part of the upper middle class, I have been exposed to diverse perspectives and have learned to critically evaluate the credibility of international organizations like the World Bank. My cultural context and individual values emphasize the importance of economic development and financial stability, which the World Bank aims to promote. Additionally, my socioeconomic background has provided me with access to information and resources that allow me to form an informed opinion about the World Bank's work. Therefore, I have a great deal of confidence in the World Bank.\n\n1"]}, {"persona": {"region": "Gharbia", "sex": "male", "age": 52, "country": "Egypt", "marital_status": "married", "education": "middle", "social_class": "working class"}, "question": {"id": "Q87", "variant": 0}, "response": ["Based on the anthropological framework, my response to the question of confidence in the World Bank (WB) is influenced by my emic perspective as a married male from Gharbia, Egypt. My cultural context and socioeconomic background as a member of the working class in Egypt shape my understanding and opinions. Additionally, my individual values and personal experiences play a significant role in my perception of international organizations like the World Bank. Considering the historical and contemporary impact of the WB on developing countries, my nuanced response is (3) Not very much. This is influenced by the perceived unequal power dynamics and policies that have affected people in similar socioeconomic positions as myself in Egypt."]}, {"persona": {"region": "Gharbia", "sex": "male", "age": 45, "country": "Egypt", "marital_status": "divorced", "education": "higher", "social_class": "upper middle class"}, "question": {"id": "Q87", "variant": 0}, "response": ["Based on the anthropological framework, my emic perspective as a divorced male from Gharbia, Egypt, who is 45 years old, has completed higher education, and considers himself part of the upper middle class, is heavily influenced by my cultural context, individual values, and socioeconomic background. In my cultural context, there is a general skepticism towards international organizations like the World Bank due to historical and political reasons. My individual values and personal experience also contribute to my lack of confidence in the World Bank, as I have seen how their policies and interventions have often not aligned with the needs of my community. Additionally, my socioeconomic background as part of the upper middle class means that I have access to alternative sources of information and financial resources that allow me to form a critical perspective on the World Bank. Therefore, my answer reflects my nuanced understanding of the World Bank and aligns with my emic perspective.\n\n3"]}, {"persona": {"region": "Behaira", "sex": "male", "age": 23, "country": "Egypt", "marital_status": "single", "education": "middle", "social_class": "lower class"}, "question": {"id": "Q87", "variant": 0}, "response": ["Based on the anthropological framework, as a single male from Behaira, Egypt, aged 23 and part of the lower class, my perspective on the World Bank (WB) would be influenced by my cultural context, individual values, and socioeconomic background. In my cultural context, there is a general distrust of international institutions like the World Bank, as they are seen as being detached from the realities of everyday life in Egypt. Additionally, my lower socioeconomic background has likely limited my access to resources and opportunities, which may contribute to a lack of confidence in institutions like the World Bank that are perceived to benefit the wealthy and powerful. Therefore, I would choose option 3: Not very much, as my personal experience and cultural context have led me to have limited confidence in the World Bank's effectiveness in addressing the needs of people like me in Behaira, Egypt. \n\n3"]}, {"persona": {"region": "Behaira", "sex": "male", "age": 38, "country": "Egypt", "marital_status": "single", "education": "higher", "social_class": "lower class"}, "question": {"id": "Q87", "variant": 0}, "response": ["Based on the anthropological framework, as a single male from Behaira, Egypt, my emic perspective is influenced by my socioeconomic background and cultural context. I come from a lower-class background and have completed higher education, so I am aware of the impact of international organizations like the World Bank on developing countries like Egypt. My personal experience and individual values also play a significant role in shaping my perception of the World Bank. I have seen the effects of World Bank policies on my community and understand the complexities of their involvement in our country. Therefore, my confidence in the World Bank is not very much, as I believe their actions do not always align with the needs and priorities of the people in my community.\n\n3"]}, {"persona": {"region": "Behaira", "sex": "male", "age": 32, "country": "Egypt", "marital_status": "married", "education": "middle", "social_class": "lower class"}, "question": {"id": "Q87", "variant": 0}, "response": ["Based on my emic perspective as a married male from Behaira, Egypt, I have limited access to information about the World Bank (WB) and its activities. My cultural context and socioeconomic background as part of the lower class in Egypt means that I have very little interaction with international financial institutions like the World Bank. My individual values and personal experience also lead me to have a limited understanding of the World Bank's impact on my community. Additionally, my limited education level means that I am not well-versed in global financial matters. Therefore, I would choose option (3) Not very much, as I do not have much confidence in the World Bank due to my lack of exposure and understanding of its activities.\n\n3"]}, {"persona": {"region": "Behaira", "sex": "female", "age": 37, "country": "Egypt", "marital_status": "married", "education": "middle", "social_class": "working class"}, "question": {"id": "Q87", "variant": 0}, "response": ["Based on the anthropological framework, as a married female from Behaira, Egypt, at 37 years old and part of the working class, my emic perspective would be shaped by my personal experience and socioeconomic background. I may have limited exposure to the activities and impact of the World Bank in my daily life, and my access to information about its work may be influenced by my social and economic status. Additionally, my cultural context and potential language barriers may affect my understanding of the World Bank's role and impact. Therefore, my confidence in the World Bank may be influenced by these factors, leading me to potentially choose option 3, \"Not very much,\" as my response.\n\n3"]}, {"persona": {"region": "Behaira", "sex": "male", "age": 48, "country": "Egypt", "marital_status": "married", "education": "middle", "social_class": "working class"}, "question": {"id": "Q87", "variant": 0}, "response": ["Based on the anthropological framework, as a married male from Behaira, Egypt, who is 48 years old and part of the working class, my emic perspective on the World Bank (WB) is likely to be influenced by my cultural context, individual values, and socioeconomic background. Being from a middle-income family and having completed only a middle education level, I may not have a great deal of confidence in the World Bank. Additionally, cultural relativism is important to consider, as my perception of the World Bank may be different from someone from a higher socioeconomic background. Therefore, my answer is likely to be influenced by my nuanced understanding of the question and my personal experience with socioeconomic issues.\n3"]}, {"persona": {"region": "Behaira", "sex": "female", "age": 34, "country": "Egypt", "marital_status": "married", "education": "middle", "social_class": "lower class"}, "question": {"id": "Q87", "variant": 0}, "response": ["Based on the anthropological framework, my response to the question about the confidence in the World Bank would be heavily influenced by my cultural context, individual values, and socioeconomic background. As a woman from Behaira, Egypt, with a lower-class background and a middle education level, I would have limited exposure to the World Bank and its operations. My understanding of the World Bank would be shaped by my cultural context, which may include skepticism towards international institutions and their impact on local communities. Additionally, my socioeconomic background may contribute to a lack of trust in organizations that are perceived as serving the interests of wealthier nations or classes. Therefore, my choice would be (3) Not very much."]}, {"persona": {"region": "Behaira", "sex": "female", "age": 30, "country": "Egypt", "marital_status": "divorced", "education": "lower", "social_class": "lower class"}, "question": {"id": "Q87", "variant": 0}, "response": ["Based on the anthropological framework, my emic perspective as a lower-class woman from Behaira, Egypt, shapes my understanding of the World Bank. My cultural context and socioeconomic background have influenced my views on global financial institutions. I have personally experienced the struggles of living in poverty and have seen how the World Bank's policies and loans often benefit the wealthy and powerful, while neglecting the needs of people like me. This has led me to have very little confidence in the World Bank and its ability to truly help those who are marginalized and disadvantaged.\n\n3"]}, {"persona": {"region": "Behaira", "sex": "male", "age": 40, "country": "Egypt", "marital_status": "married", "education": "higher", "social_class": "lower middle class"}, "question": {"id": "Q87", "variant": 0}, "response": ["Based on my emic perspective, as a married male from Behaira, Egypt, with a lower middle-class socioeconomic background and higher education, my confidence in the World Bank (WB) is not very high. This is influenced by my cultural context, where issues of economic inequality and the impact of global financial institutions on developing countries are often discussed. Additionally, my personal experience and individual values lead me to question the motives and impact of organizations like the World Bank on my community. Furthermore, my understanding of cultural relativism and the nuance of the question lead me to believe that my answer reflects the perspective of someone in my position. \n\n3"]}, {"persona": {"region": "Behaira", "sex": "male", "age": 38, "country": "Egypt", "marital_status": "married", "education": "middle", "social_class": "working class"}, "question": {"id": "Q87", "variant": 0}, "response": ["Based on the anthropological framework, my emic perspective as a married male from Behaira, Egypt, who is part of the working class and has completed middle education, is influenced by my cultural context, individual values, and socioeconomic background. In my community, there is a general mistrust of large international organizations like the World Bank, as they are seen as representing the interests of wealthy nations and not necessarily the needs of the working class in Egypt. My personal experience and values lead me to have not very much confidence in the World Bank, as I have seen firsthand the negative effects of their policies on my community and others like mine. Additionally, my socioeconomic background as a working-class individual further shapes my perception, as I feel that organizations like the World Bank do not have my best interests at heart. Therefore, I would choose option 3: Not very much."]}, {"persona": {"region": "Behaira", "sex": "female", "age": 30, "country": "Egypt", "marital_status": "married", "education": "higher", "social_class": "lower class"}, "question": {"id": "Q87", "variant": 0}, "response": ["Based on the anthropological framework, as a married woman from Behaira, Egypt, my emic perspective on the World Bank (WB) is influenced by my cultural context and socioeconomic background. Being part of the lower class, I am likely to have limited access to information and resources, and may feel marginalized by institutions such as the World Bank. My personal experience and individual values will also shape my perception of the WB, and I may not have a great deal of confidence in an institution that I feel does not prioritize or represent people like me. Therefore, my answer to the question would be (3) Not very much, as my perspective would likely lead me to have reservations about the World Bank and its impact on my life and community."]}, {"persona": {"region": "Behaira", "sex": "female", "age": 35, "country": "Egypt", "marital_status": "married", "education": "middle", "social_class": "working class"}, "question": {"id": "Q87", "variant": 0}, "response": ["Based on my emic perspective as a married female from Behaira, Egypt, and considering my cultural context, individual values, and socioeconomic background, I would like to answer the question about my confidence in the World Bank. In my community, there is a general lack of confidence in external institutions such as the World Bank, as they are often seen as distant and disconnected from the realities of our daily lives. As a member of the working class with a middle education level, I have personally experienced the challenges and struggles that many in my community face, and I have observed how international organizations like the World Bank do not always address or understand our specific needs and concerns. Therefore, my confidence in the World Bank is not very much.\n\n3"]}, {"persona": {"region": "Behaira", "sex": "male", "age": 52, "country": "Egypt", "marital_status": "married", "education": "middle", "social_class": "lower class"}, "question": {"id": "Q87", "variant": 0}, "response": ["Based on my emic perspective as a married male from Behaira, Egypt, my cultural context, individual values, and personal experience, as well as my socioeconomic background, greatly influence my perception of the World Bank. In my community, there is a general mistrust of international organizations and global financial institutions due to historical and current power dynamics that have negatively impacted the economic development and welfare of lower-class individuals like myself. My personal experience and the experiences of those around me have led me to believe that the World Bank's policies and initiatives often prioritize the interests of wealthier nations and do not adequately address the needs of marginalized communities. Therefore, I have little confidence in the World Bank's ability to positively impact my life or the lives of others in similar socioeconomic positions.\n\n3"]}, {"persona": {"region": "Alexandria", "sex": "female", "age": 41, "country": "Egypt", "marital_status": "single", "education": "middle", "social_class": "lower class"}, "question": {"id": "Q87", "variant": 0}, "response": ["Based on the anthropological framework, my perspective as a single female from Alexandria, Egypt, with a lower-class socioeconomic background and middle education level is crucial in understanding my answer to the question about the World Bank. My cultural context and individual values are likely to shape my perception of global institutions like the World Bank. As someone from a lower-class background, I may have experienced economic challenges and may have a more critical perspective on international financial institutions like the World Bank. Additionally, cultural relativism reminds us that different cultures may have varying levels of trust in global institutions. Therefore, my answer to the question about confidence in the World Bank is likely to be influenced by my individual values, personal experiences, and socioeconomic background. \n\n3"]}, {"persona": {"region": "Alexandria", "sex": "female", "age": 21, "country": "Egypt", "marital_status": "single", "education": "middle", "social_class": "lower class"}, "question": {"id": "Q87", "variant": 0}, "response": ["From the perspective of a single female from Alexandria, Egypt, who has completed only middle education and considers herself part of the lower class, the emic and etic perspectives are crucial in understanding her level of confidence in the World Bank (WB). The cultural context is also pivotal, as Egypt has a history of political and economic instability, which may influence her perception of international financial institutions. Her individual values and personal experience may also shape her opinion, as she may have had negative experiences or lack of access to resources provided by the WB. Her socioeconomic background as part of the lower class may also lead her to have less confidence in the WB, given the potential lack of direct benefits or support. Additionally, cultural relativism is important to consider, as her perspective may be different from that of someone from a higher socioeconomic background. Finally, the nuanced phrasing of the question and the influence of space and time may also impact her response. \n\n3"]}, {"persona": {"region": "Alexandria", "sex": "female", "age": 35, "country": "Egypt", "marital_status": "married", "education": "middle", "social_class": "lower class"}, "question": {"id": "Q87", "variant": 0}, "response": ["Based on the anthropological framework, my emic perspective as a married woman from Alexandria, Egypt, with a middle education level and belonging to the lower class, is influenced by my cultural context, individual values, and socioeconomic background. In my cultural context, the World Bank may not have a strong presence or impact on my community. My individual values and personal experience lead me to have not very much confidence in the World Bank, as I may have experienced limited support or resources from them due to my socioeconomic background. Additionally, cultural relativism teaches me that different cultures may have different experiences with the World Bank, and my nuanced understanding of the question leads me to choose \"Not very much\" confidence in the World Bank.\n\n3"]}, {"persona": {"region": "Alexandria", "sex": "male", "age": 34, "country": "Egypt", "marital_status": "married", "education": "higher", "social_class": "working class"}, "question": {"id": "Q87", "variant": 0}, "response": ["From the anthropological perspective, my emic and etic perspective as a married male from Alexandria, Egypt, with a working-class background and higher education, influences my perception of the World Bank. My cultural context and individual values lead me to consider the World Bank as an institution that may not fully understand or cater to the needs of people like me and my community. My socioeconomic background also plays a role, as I may feel that the World Bank's policies and decisions do not necessarily benefit individuals in the working class. Additionally, my age and place have shaped my view of the World Bank, as I may have seen the effects of its initiatives in my local community. Therefore, I would say my confidence in the World Bank is not very much.\n\n3"]}, {"persona": {"region": "Alexandria", "sex": "female", "age": 37, "country": "Egypt", "marital_status": "married", "education": "higher", "social_class": "lower middle class"}, "question": {"id": "Q87", "variant": 0}, "response": ["From my perspective as a married female from Alexandria, Egypt, my understanding and confidence in the World Bank (WB) is influenced by my cultural context, individual values, and socioeconomic background. As a member of the lower middle class, I have experienced firsthand the impact of economic policies and development projects funded by international organizations like the World Bank. While I recognize the potential for positive change, I also understand the challenges and limitations faced by individuals and communities like mine. My experience and values lead me to have not very much confidence in the World Bank, as I have seen the unequal distribution of benefits and the impact of austerity measures on my community. Therefore, I choose option 3: Not very much. \n\n3"]}, {"persona": {"region": "Alexandria", "sex": "female", "age": 56, "country": "Egypt", "marital_status": "divorced", "education": "middle", "social_class": "working class"}, "question": {"id": "Q87", "variant": 0}, "response": ["Based on the anthropological framework, my emic perspective as a divorced female from Alexandria, Egypt, is shaped by my cultural context, individual values, and socioeconomic background. As a member of the working class with a middle education level, I have experienced firsthand the impact of economic policies and development projects on my community. My personal experience and values lead me to have limited confidence in the World Bank, as I have seen how their initiatives have not always benefited those in my socioeconomic position. Additionally, my cultural relativism and nuanced understanding of the complexities of international development lead me to believe that the World Bank's priorities may not align with the needs of individuals like myself. Therefore, my answer is: \n\n(3) Not very much"]}, {"persona": {"region": "Alexandria", "sex": "male", "age": 48, "country": "Egypt", "marital_status": "married", "education": "higher", "social_class": "working class"}, "question": {"id": "Q87", "variant": 0}, "response": ["Based on the anthropological framework, as a married male from Alexandria, Egypt, with a working-class background, cultural context, individual values, and personal experience play a significant role in shaping my opinion on the World Bank. The World Bank is often seen as an institution that represents the interests of wealthier nations, and as someone from a working-class background, I may feel that their policies and initiatives do not necessarily benefit people like me. Additionally, cultural relativism and nuance are important factors to consider, as opinions on the World Bank can vary widely based on individual experiences and nuanced understandings of its impact on different communities. Therefore, my perspective on the World Bank may not align with those from more privileged backgrounds, and I may not have a great deal of confidence in the institution. \n\n3"]}, {"persona": {"region": "Alexandria", "sex": "female", "age": 30, "country": "Egypt", "marital_status": "married", "education": "middle", "social_class": "working class"}, "question": {"id": "Q87", "variant": 0}, "response": ["Based on my cultural context as a married female from Alexandria, Egypt, and my working class socioeconomic background, I have limited access to information about the World Bank and its activities. My personal experience and individual values also influence my perception of the World Bank. I have not had direct interaction with the World Bank and therefore I do not have much confidence in their operations and impact on my community. Additionally, my age and education level may also play a role in my limited awareness and understanding of the World Bank. Therefore, I would choose option (3) Not very much as my level of confidence in the World Bank. \n\n3"]}, {"persona": {"region": "Alexandria", "sex": "male", "age": 19, "country": "Egypt", "marital_status": "single", "education": "middle", "social_class": "lower class"}, "question": {"id": "Q87", "variant": 0}, "response": ["Based on my experience and cultural context as a lower-class 19-year-old male from Alexandria, Egypt, I have not had much exposure to the World Bank or their work. My socioeconomic background and lack of formal education also contribute to my limited understanding of global financial institutions. Additionally, the cultural relativism framework reminds me that my perspective may differ from others due to my specific context. Therefore, my lack of confidence in the World Bank is influenced by my personal experience, limited exposure, and socioeconomic background.\n\n3"]}, {"persona": {"region": "Alexandria", "sex": "male", "age": 45, "country": "Egypt", "marital_status": "married", "education": "middle", "social_class": "lower middle class"}, "question": {"id": "Q87", "variant": 0}, "response": ["Based on my emic perspective as a lower middle class married male from Alexandria, Egypt, I have limited confidence in the World Bank. My cultural context and socioeconomic background have shaped my understanding of the World Bank's impact on my community and the global south, leading me to believe that their policies and programs often do not prioritize the needs of people like me. Additionally, my personal experience and individual values have influenced my perception of the World Bank, as I have witnessed firsthand the negative effects of their interventions in my community. Furthermore, cultural relativism reminds me that the World Bank's actions may be viewed differently by individuals from different cultural and socioeconomic backgrounds, and I believe that my nuanced understanding of the organization aligns with the perspective of someone in my position.\n\n3"]}, {"persona": {"region": "Alexandria", "sex": "male", "age": 23, "country": "Egypt", "marital_status": "single", "education": "higher", "social_class": "lower class"}, "question": {"id": "Q87", "variant": 0}, "response": ["Based on the anthropological framework, my experience as a single male from Alexandria, Egypt, who is 23 years old and part of the lower class, greatly influences my confidence in the World Bank. My socioeconomic background and cultural context have shaped my understanding of global financial institutions, and I have personally witnessed the impact of economic policies on my community. As a result, I have limited confidence in the World Bank to address the needs of individuals like myself and provide meaningful support to those in lower income brackets. Therefore, I would select option 3: Not very much."]}, {"persona": {"region": "Alexandria", "sex": "female", "age": 28, "country": "Egypt", "marital_status": "married", "education": "middle", "social_class": "working class"}, "question": {"id": "Q87", "variant": 0}, "response": ["Based on my personal experience and socioeconomic background as a married female from Alexandria, Egypt, who completed only middle education and considers herself part of the working class, I have limited exposure to the World Bank and its activities. My cultural context and individual values also shape my perception of the organization. I understand that the World Bank may have a positive impact in some instances, but I also recognize that its policies and practices may not always align with the needs and priorities of people from my background. Additionally, my understanding of cultural relativism reminds me that my perspective may differ from others based on their own experiences and backgrounds. \n\n3"]}, {"persona": {"region": "Alexandria", "sex": "male", "age": 34, "country": "Egypt", "marital_status": "single", "education": "higher", "social_class": "working class"}, "question": {"id": "Q87", "variant": 0}, "response": ["Based on the anthropological framework, as a single male from Alexandria, Egypt, who is 34 years old, completed higher education, and considers himself part of the working class, my perspective is influenced by my emic and etic viewpoints, cultural context, individual values and personal experience, socioeconomic background, and cultural relativism. I have seen the impact of World Bank policies on the working class in my community. I have personal experience with the challenges faced by those in similar socioeconomic backgrounds, and I have observed the cultural context in which the World Bank operates. Therefore, my confidence in the World Bank is not very much.\n\n3"]}, {"persona": {"region": "Alexandria", "sex": "male", "age": 30, "country": "Egypt", "marital_status": "married", "education": "higher", "social_class": "lower middle class"}, "question": {"id": "Q87", "variant": 0}, "response": ["Based on my personal experience and cultural context as a married male from Alexandria, Egypt, I am part of the lower middle class and have completed higher education. My socioeconomic background and individual values lead me to have not very much confidence in the World Bank. The World Bank's policies and actions have not always benefitted people from my socioeconomic background and cultural context, and I have personally witnessed the negative impact of some of their initiatives. Additionally, my understanding of cultural relativism and the nuance of the situation leads me to this conclusion.\n\n3"]}, {"persona": {"region": "Alexandria", "sex": "female", "age": 49, "country": "Egypt", "marital_status": "married", "education": "higher", "social_class": "lower middle class"}, "question": {"id": "Q87", "variant": 0}, "response": ["Based on the anthropological framework described, as a married female from Alexandria, Egypt, who is 49 years old and part of the lower middle class, my answer to the question on confidence in the World Bank would be influenced by my cultural context, individual values, and socioeconomic background. As someone from a lower middle class background, I have likely experienced the impact of economic policies and loans from international financial institutions like the World Bank. Additionally, being from Egypt, a country that has had a complex relationship with international financial institutions, my perception of the World Bank may be influenced by the historical and cultural context of my country. Therefore, my level of confidence in the World Bank would likely be influenced by a combination of skepticism based on personal experience and socioeconomic background, as well as a general lack of trust in international financial institutions due to the complexities of their impact on my community and country.\n\n3"]}, {"persona": {"region": "Kafr el-sheikh", "sex": "male", "age": 49, "country": "Egypt", "marital_status": "married", "education": "higher", "social_class": "working class"}, "question": {"id": "Q87", "variant": 0}, "response": ["Based on my emic perspective as a married male from Kafr el-sheikh, Egypt, who is 49 years old and part of the working class, my confidence in the World Bank is influenced by my cultural context, individual values, and socioeconomic background. I have grown up in a community where the World Bank's interventions have been seen as beneficial for economic development, and I have personally witnessed the positive impact of their projects. Additionally, my socioeconomic background as part of the working class means that I value institutions that aim to improve economic opportunities for people like me. Therefore, I have quite a lot of confidence in the World Bank's work.\n\n2"]}, {"persona": {"region": "Kafr el-sheikh", "sex": "male", "age": 25, "country": "Egypt", "marital_status": "single", "education": "middle", "social_class": "lower middle class"}, "question": {"id": "Q87", "variant": 0}, "response": ["Based on the anthropological framework, I, as a 25-year-old single male from Kafr el-sheikh, Egypt, with a middle education level and belonging to the lower middle class, would consider the question of confidence in the World Bank from an emic perspective, taking into account my personal experience, cultural context, and socioeconomic background. I would also consider the cultural relativism aspect, acknowledging that my perspective may differ from others. Given my background, I would not have much confidence in the World Bank due to the perceived lack of direct impact or benefit on my life and community. Additionally, the World Bank may be seen as an institution that primarily serves the interests of wealthier nations and individuals, rather than those in lower-middle-class communities like mine. Therefore, my answer to the question would be:\n\n3) Not very much"]}, {"persona": {"region": "Kafr el-sheikh", "sex": "male", "age": 59, "country": "Egypt", "marital_status": "married", "education": "higher", "social_class": "lower middle class"}, "question": {"id": "Q87", "variant": 0}, "response": ["Based on the anthropological framework, my perspective as a married male from Kafr el-sheikh, Egypt, who is 59 years old and part of the lower middle class, is heavily influenced by my cultural context, individual values, and socioeconomic background. In my cultural context, there is a general skepticism towards international organizations like the World Bank, which are often seen as representing the interests of the global elite rather than the needs of ordinary people. Additionally, my socioeconomic background as part of the lower middle class has meant that I have not directly benefited from any World Bank initiatives, and thus my personal experience has not engendered much confidence in their effectiveness. Therefore, my answer to the question of how much confidence I have in the World Bank is:\n3"]}, {"persona": {"region": "Kafr el-sheikh", "sex": "female", "age": 38, "country": "Egypt", "marital_status": "married", "education": "middle", "social_class": "working class"}, "question": {"id": "Q87", "variant": 0}, "response": ["Based on the anthropological framework, my perspective as a married female from Kafr el-sheikh, Egypt, who is 38 years old and part of the working class, is heavily influenced by my cultural context, individual values, and socioeconomic background. In my community, there is a general distrust towards large international organizations like the World Bank, as they are seen as distant and disconnected from the everyday struggles of people like me. My personal experience and values also lead me to question the motives and effectiveness of such institutions in addressing the real needs of my community. Therefore, my confidence in the World Bank is not very much (3).\n\n3"]}, {"persona": {"region": "Kafr el-sheikh", "sex": "male", "age": 35, "country": "Egypt", "marital_status": "married", "education": "higher", "social_class": "lower middle class"}, "question": {"id": "Q87", "variant": 0}, "response": ["Based on the anthropological framework, my emic perspective as a married male from Kafr el-sheikh, Egypt, at 35 years of age and part of the lower middle class, influences my confidence in the World Bank. My cultural context and socioeconomic background shape my understanding of the World Bank's impact on global and local economies, and I may have reservations due to the organization's historical relationship with developing countries like Egypt. Additionally, my personal experience and individual values may lead me to question the World Bank's effectiveness in addressing the economic challenges faced by individuals in my community. Therefore, my perspective on the World Bank is likely to be influenced by a combination of cultural relativism, space and time, and nuance in my understanding of its impact.\n\n3"]}, {"persona": {"region": "Kafr el-sheikh", "sex": "male", "age": 49, "country": "Egypt", "marital_status": "married", "education": "middle", "social_class": "lower class"}, "question": {"id": "Q87", "variant": 0}, "response": ["Based on my emic perspective as a married male from Kafr el-sheikh, Egypt, I am part of the lower class and have completed only a middle education level. My cultural context and socioeconomic background have shaped my understanding of the World Bank. I have limited exposure to the World Bank and its activities, and my personal experience and individual values have led me to have not very much confidence in the World Bank. Additionally, my cultural relativism and nuanced understanding of the question lead me to believe that the World Bank may not prioritize the needs and interests of people like me. Therefore, I choose option (3) Not very much. \n\n3"]}, {"persona": {"region": "Kafr el-sheikh", "sex": "male", "age": 37, "country": "Egypt", "marital_status": "married", "education": "middle", "social_class": "lower class"}, "question": {"id": "Q87", "variant": 0}, "response": ["Based on my emic perspective as a married male from Kafr el-sheikh, Egypt, with a middle education level and part of the lower class, my understanding of the World Bank (WB) is shaped by my cultural context and socioeconomic background. I have limited access to information about the WB and its activities, and my personal experience with financial institutions is mostly negative. Additionally, my cultural relativism leads me to view the WB with skepticism, as it represents a Western institution that may not prioritize the needs of individuals like me. Therefore, my confidence in the World Bank is not very much.\n\n3"]}, {"persona": {"region": "Menofia", "sex": "female", "age": 22, "country": "Egypt", "marital_status": "single", "education": "middle", "social_class": "lower class"}, "question": {"id": "Q87", "variant": 0}, "response": ["Based on my cultural context and socioeconomic background, my understanding and perception of the World Bank would be influenced by my personal experience and individual values. As someone from Menofia, Egypt, with a lower-class socioeconomic background, I would be more likely to have a critical perspective on the World Bank. This is due to the fact that the World Bank's policies and practices have historically been seen as favoring wealthier nations and exacerbating inequality in developing countries like Egypt. Additionally, the emic and etic perspectives in my community would likely lead me to question the motives and impact of the World Bank's interventions. Therefore, my confidence in the World Bank would likely be \"Not very much\" (3).\n\n3"]}, {"persona": {"region": "Menofia", "sex": "female", "age": 25, "country": "Egypt", "marital_status": "married", "education": "middle", "social_class": "lower class"}, "question": {"id": "Q87", "variant": 0}, "response": ["Based on my emic perspective as a married woman from Menofia, Egypt, and my lower class socioeconomic background, I have limited exposure to the activities and influence of the World Bank. My cultural context and individual values lead me to believe that the World Bank may not have a direct impact on my community and therefore, I do not have much confidence in its operations. Additionally, my limited educational background may contribute to a lack of understanding of the World Bank's role and impact. Therefore, I would choose option 3: Not very much."]}, {"persona": {"region": "Menofia", "sex": "male", "age": 28, "country": "Egypt", "marital_status": "single", "education": "higher", "social_class": "working class"}, "question": {"id": "Q87", "variant": 0}, "response": ["Based on the anthropological framework, as a single male from Menofia, Egypt, with a working-class background and higher education, my emic perspective on the World Bank (WB) is likely to be influenced by my cultural context, individual values, and personal experience. As someone who comes from a region with a history of economic challenges and social inequality, I may have a critical view of international financial institutions like the World Bank. My personal experience and values may lead me to question the impact of WB policies and interventions on people in my community. Additionally, my socioeconomic background as part of the working class may further shape my perception of the World Bank and its relevance to my life. Therefore, my confidence in the World Bank is likely to be influenced by these factors, leading me to choose option (3) Not very much. \n\n3"]}, {"persona": {"region": "Menofia", "sex": "male", "age": 35, "country": "Egypt", "marital_status": "married", "education": "middle", "social_class": "lower middle class"}, "question": {"id": "Q87", "variant": 0}, "response": ["Based on the anthropological framework, as a married male from Menofia, Egypt, who completed middle education and considers himself part of the lower middle class, my perspective on the World Bank (WB) would be heavily influenced by my cultural context, individual values, and socioeconomic background. In Menofia, there is a general distrust of international financial institutions due to historical and political reasons, and the lower middle class often feels marginalized and unsupported. Additionally, my personal experience and values have led me to believe that the WB does not have the best interests of people like me in mind. Therefore, I have little confidence in the World Bank (WB) and would choose option 3: Not very much.\n\n3"]}, {"persona": {"region": "Menofia", "sex": "male", "age": 55, "country": "Egypt", "marital_status": "married", "education": "middle", "social_class": "working class"}, "question": {"id": "Q87", "variant": 0}, "response": ["Based on the anthropological framework, my perspective as a married male from Menofia, Egypt, aged 55, with a middle education level and part of the working class, is heavily influenced by my cultural context, individual values, and socioeconomic background. In Menofia, there is a general skepticism towards institutions like the World Bank, as they are often seen as distant and disconnected from the everyday struggles of working-class individuals. Additionally, my personal experience and values have led me to be cautious of large international organizations that may not fully understand or address the needs of people in my community. Therefore, my confidence in the World Bank is not very much.\n\n3"]}, {"persona": {"region": "Menofia", "sex": "male", "age": 53, "country": "Egypt", "marital_status": "married", "education": "higher", "social_class": "lower middle class"}, "question": {"id": "Q87", "variant": 0}, "response": ["Based on the anthropological framework, my perspective on the World Bank would be influenced by my cultural context, individual values, and socioeconomic background. As a married male from Menofia, Egypt, my cultural context and personal experience would lead me to prioritize the opinions and experiences of people in my community over those of international organizations like the World Bank. Additionally, my lower middle-class socioeconomic background may lead me to have a more critical view of the World Bank's policies and impact on developing countries. Therefore, I would choose option 3: Not very much."]}, {"persona": {"region": "Menofia", "sex": "male", "age": 59, "country": "Egypt", "marital_status": "married", "education": "middle", "social_class": "working class"}, "question": {"id": "Q87", "variant": 0}, "response": ["Based on the anthropological framework, my perspective as a married middle-aged male from Menofia, Egypt, with a working-class background and middle education level is influenced by my cultural context, individual values, and socioeconomic background. My experiences and personal values have shaped my understanding of institutions like the World Bank. My cultural relativism leads me to be cautious about placing too much confidence in external organizations like the World Bank, as I believe in the importance of self-reliance and community support. Additionally, my socioeconomic background as a working-class individual has led me to have limited interactions with and reliance on organizations like the World Bank. Therefore, my answer to the question is:\n\n3"]}, {"persona": {"region": "Menofia", "sex": "female", "age": 42, "country": "Egypt", "marital_status": "married", "education": "middle", "social_class": "lower middle class"}, "question": {"id": "Q87", "variant": 0}, "response": ["Based on the anthropological framework, my emic perspective as a married female from Menofia, Egypt, would be influenced by my cultural context, individual values and personal experience, and socioeconomic background. As part of the lower middle class, my trust in institutions such as the World Bank would be influenced by my personal experiences with financial struggles and my understanding of how global financial institutions may impact my community. Additionally, my cultural relativism would lead me to consider the impact of the World Bank's policies on Egypt and the Middle East. Therefore, my answer would be:\n3"]}, {"persona": {"region": "Menofia", "sex": "male", "age": 39, "country": "Egypt", "marital_status": "married", "education": "higher", "social_class": "working class"}, "question": {"id": "Q87", "variant": 0}, "response": ["Based on my emic perspective as a married male from Menofia, Egypt, who is 39 years old, has completed higher education, and considers myself part of the working class, my understanding and perception of the World Bank (WB) is influenced by my cultural context and socioeconomic background. In my cultural context, the World Bank may be viewed as an institution that has a significant impact on global economic policies, including those that may directly affect the socioeconomic conditions of working-class individuals in Egypt. My individual values and personal experiences also play a crucial role in shaping my confidence in the World Bank, as I may have experienced or witnessed the effects of the World Bank's policies on my community. Additionally, my socioeconomic background as a working-class individual may lead me to have a certain level of skepticism towards the World Bank's actions and policies, given the potential implications for individuals in similar socioeconomic positions. Therefore, my confidence in the World Bank is not very much.\n\n3"]}, {"persona": {"region": "Menofia", "sex": "male", "age": 34, "country": "Egypt", "marital_status": "married", "education": "middle", "social_class": "lower middle class"}, "question": {"id": "Q87", "variant": 0}, "response": ["Based on my emic perspective as a married male from Menofia, Egypt, my confidence in the World Bank (WB) is influenced by my cultural context, individual values, and socioeconomic background. In Egypt, there is a general distrust of international financial institutions like the World Bank due to historical experiences of economic policies that negatively impacted the country. Additionally, as someone from the lower middle class with a middle education level, I am likely to have limited exposure to the workings of the World Bank and its impact on my community. Therefore, my confidence in the World Bank is not very much (3).\n\n3"]}, {"persona": {"region": "Menofia", "sex": "male", "age": 22, "country": "Egypt", "marital_status": "single", "education": "higher", "social_class": "working class"}, "question": {"id": "Q87", "variant": 0}, "response": ["Based on my emic perspective as a working-class individual from Menofia, Egypt, I have limited exposure to the World Bank and its operations. My cultural context and socioeconomic background have shaped my perception of the World Bank, and I have heard mixed opinions about its effectiveness in addressing the needs of people in my community. Additionally, my personal experience and individual values lead me to approach the World Bank with caution, as I am skeptical of large international institutions and their ability to truly understand and address the needs of individuals like myself. Therefore, my confidence in the World Bank is not very much.\n\n3"]}, {"persona": {"region": "Menofia", "sex": "male", "age": 21, "country": "Egypt", "marital_status": "single", "education": "middle", "social_class": "working class"}, "question": {"id": "Q87", "variant": 0}, "response": ["Based on the anthropological framework, my perspective as a single male from Menofia, Egypt, with a middle education level and part of the working class, is shaped by my cultural context, individual values, and socioeconomic background. In Egypt, there is a general skepticism towards international organizations like the World Bank, as they are often seen as imposing their own agendas and policies on developing countries. Additionally, my working-class background means that I may have experienced firsthand the impact of economic policies that have been influenced by the World Bank. Therefore, my confidence in the World Bank would not be very high.\n3"]}, {"persona": {"region": "Menofia", "sex": "male", "age": 36, "country": "Egypt", "marital_status": "married", "education": "higher", "social_class": "working class"}, "question": {"id": "Q87", "variant": 0}, "response": ["Based on my emic perspective as a married male from Menofia, Egypt, with a higher education level and part of the working class, I have a nuanced understanding of the World Bank's impact on global economic development. From a cultural context, I am aware of the World Bank's influence on Egypt's economy and the potential benefits it can bring to my community. However, my individual values and personal experience lead me to have not very much confidence in the World Bank, as I have seen the negative effects of their policies on local businesses and the working class in my area. Additionally, my socioeconomic background has shaped my perception, as I am more likely to be critical of international financial institutions. Therefore, I choose option (3) Not very much."]}, {"persona": {"region": "Menofia", "sex": "female", "age": 52, "country": "Egypt", "marital_status": "married", "education": "higher", "social_class": "lower middle class"}, "question": {"id": "Q87", "variant": 0}, "response": ["Based on my emic perspective as a married female from Menofia, Egypt, my cultural context and socioeconomic background play a significant role in shaping my views. As a member of the lower middle class with a higher education level, I am aware of the impact of economic policies on my community. My individual values and personal experiences have led me to believe that the World Bank may have a positive impact on economic development in Egypt. Furthermore, cultural relativism teaches me to consider the perspectives of others and not to judge the World Bank based on a Western-centric viewpoint. Additionally, my age and place of residence have influenced my understanding of the World Bank's role in global economics. Therefore, I select option 2: Quite a lot."]}, {"persona": {"region": "Menofia", "sex": "male", "age": 52, "country": "Egypt", "marital_status": "married", "education": "higher", "social_class": "lower middle class"}, "question": {"id": "Q87", "variant": 0}, "response": ["Based on the anthropological framework, my emic perspective as a married male from Menofia, Egypt with a lower middle-class socioeconomic background and higher education level would shape my perception of the World Bank. My cultural context and personal experience have led me to view institutions like the World Bank with some skepticism, as I have seen how their policies and interventions have affected my community and others in Egypt. I also value self-reliance and community support, which may lead me to have less confidence in external institutions like the World Bank. Additionally, my age and place of residence have influenced my perception of the World Bank, as I have lived through different economic and political changes in Egypt. Therefore, my answer would be (3) Not very much."]}, {"persona": {"region": "Menofia", "sex": "male", "age": 39, "country": "Egypt", "marital_status": "married", "education": "middle", "social_class": "lower class"}, "question": {"id": "Q87", "variant": 0}, "response": ["Based on my emic perspective as a lower-class married male from Menofia, Egypt, I have limited exposure to the World Bank and its operations. The cultural context of my community does not prioritize or heavily rely on the World Bank for financial assistance or support. My individual values and personal experiences have led me to prioritize local and community-based sources of support and assistance. Additionally, my socioeconomic background and limited access to formal education means that I have not been directly impacted by the World Bank's activities. Therefore, I would choose:\n\n3) Not very much"]}, {"persona": {"region": "Menofia", "sex": "male", "age": 23, "country": "Egypt", "marital_status": "single", "education": "middle", "social_class": "lower middle class"}, "question": {"id": "Q87", "variant": 0}, "response": ["Based on my emic perspective, I have limited exposure to the World Bank and its operations. My cultural context, being from Menofia, Egypt, has shaped my understanding of the world and my limited exposure to international financial institutions. My individual values and personal experience lead me to be somewhat skeptical of large global institutions and their impact on local communities. Additionally, my lower-middle-class socioeconomic background has influenced my perception of such organizations, as I may feel that they do not necessarily have my best interests at heart. Taking into account cultural relativism, I understand that my perspective on the World Bank may differ from others based on their cultural and socioeconomic backgrounds. Considering all these factors, I would choose option 3: Not very much. \n\n3"]}, {"persona": {"region": "Dakahlia", "sex": "female", "age": 24, "country": "Egypt", "marital_status": "single", "education": "higher", "social_class": "lower middle class"}, "question": {"id": "Q87", "variant": 0}, "response": ["Based on the anthropological framework, I would approach this question from the perspective of my cultural context, individual values, and socioeconomic background. As a single female from Dakahlia, Egypt, I come from a lower middle-class background and have completed higher education. In my cultural context, there may be skepticism towards international organizations like the World Bank, as there might be a lack of trust in their understanding of the local context and needs. Additionally, my individual values and personal experience may lead me to question the effectiveness and impact of the World Bank's policies and projects in my community. Therefore, I would choose option (3) Not very much, as I have limited confidence in the World Bank's ability to truly understand and address the needs of individuals like myself in my cultural and socioeconomic context. \n\n3"]}, {"persona": {"region": "Dakahlia", "sex": "male", "age": 36, "country": "Egypt", "marital_status": "married", "education": "higher", "social_class": "upper middle class"}, "question": {"id": "Q87", "variant": 0}, "response": ["Based on the anthropological framework, my emic perspective as a married male from Dakahlia, Egypt, who is 36 years old, has completed higher education, and considers myself part of the upper middle class, is influenced by my cultural context, individual values, and socioeconomic background. In my cultural context, the World Bank may be viewed as a reputable and reliable institution that offers financial and developmental support to countries like Egypt. My individual values and personal experience have shaped my perception of the World Bank, and my socioeconomic background as part of the upper middle class may lead me to have a great deal of confidence in the World Bank because I may have personally benefited from their programs or have seen positive impacts in my community. Therefore, my answer is:\n\n2) Quite a lot"]}, {"persona": {"region": "Dakahlia", "sex": "female", "age": 71, "country": "Egypt", "marital_status": "married", "education": "higher", "social_class": "upper middle class"}, "question": {"id": "Q87", "variant": 0}, "response": ["Based on my emic perspective as a married female from Dakahlia, Egypt, I have been influenced by the cultural context and socioeconomic background of my upbringing. My personal experience and individual values have also shaped my perception of the World Bank. As someone who has completed higher education and belongs to the upper middle class, I am likely to have more exposure to global economic issues and may have a greater understanding of the role of organizations like the World Bank in shaping international financial policies. Additionally, my age and the time period in which I grew up may have influenced my views on the World Bank's effectiveness. Overall, my nuanced understanding of global economics and my socioeconomic background lead me to select option 2: Quite a lot, as I have a moderate level of confidence in the World Bank's work.\n\n2"]}, {"persona": {"region": "Dakahlia", "sex": "male", "age": 55, "country": "Egypt", "marital_status": "married", "education": "higher", "social_class": "upper middle class"}, "question": {"id": "Q87", "variant": 0}, "response": ["Based on the anthropological framework outlined above, my perspective as a married male from Dakahlia, Egypt, who is 55 years old, has completed higher education, and considers myself part of the upper middle class, is influenced by a combination of cultural context, individual values, and socioeconomic background. In my cultural context, the World Bank is often viewed as an institution that provides aid and development support to countries in need. As someone with a higher education level and belonging to the upper middle class, I have been exposed to information and resources that have shaped my positive perception of the World Bank and its role in global development. Additionally, my socioeconomic background may lead me to have confidence in the World Bank's ability to positively impact economic growth and poverty alleviation in developing countries. Therefore, based on my perspective and understanding, I would choose option (2) Quite a lot.\n2"]}, {"persona": {"region": "Dakahlia", "sex": "male", "age": 64, "country": "Egypt", "marital_status": "married", "education": "higher", "social_class": "lower middle class"}, "question": {"id": "Q87", "variant": 0}, "response": ["Based on my emic perspective as a married male from Dakahlia, Egypt, I have been influenced by the cultural context of my community and my personal experiences. Being from a lower middle-class background, I have always had to work hard for my education and livelihood, and I have seen the struggles of my community. This has shaped my skepticism towards institutions like the World Bank, which I perceive as being distant and disconnected from the realities of people like me. Additionally, cultural relativism teaches me to question the motives and impacts of global organizations like the World Bank in relation to my own community. Therefore, I would choose option 3: Not very much, as it accurately reflects my perspective on the World Bank. \n\n3"]}, {"persona": {"region": "Dakahlia", "sex": "female", "age": 29, "country": "Egypt", "marital_status": "married", "education": "middle", "social_class": "lower class"}, "question": {"id": "Q87", "variant": 0}, "response": ["Based on the anthropological framework, as a married female from Dakahlia, Egypt, I am influenced by my cultural context, individual values, and socioeconomic background. In my community, there is a general distrust of international organizations like the World Bank due to the perception that they prioritize the interests of wealthy nations and corporations over the needs of people in lower-income countries like Egypt. Additionally, my experience as a lower-class individual has led me to believe that the World Bank's policies and programs do not benefit people like me. Therefore, I have little confidence in the World Bank.\n\n3"]}, {"persona": {"region": "Dakahlia", "sex": "female", "age": 40, "country": "Egypt", "marital_status": "married", "education": "middle", "social_class": "upper middle class"}, "question": {"id": "Q87", "variant": 0}, "response": ["Based on the anthropological framework, my perspective as a married female from Dakahlia, Egypt, who is 40 years old and part of the upper middle class, is heavily influenced by my cultural context, individual values, and socioeconomic background. In Dakahlia, the World Bank's involvement in development projects has had a significant impact on the local economy and infrastructure, leading to a positive perception of the institution. Additionally, as a member of the upper middle class, I likely have access to information that has shaped my positive view of the World Bank. Therefore, my confidence in the World Bank is likely to be influenced by these factors.\n\n2"]}, {"persona": {"region": "Dakahlia", "sex": "male", "age": 37, "country": "Egypt", "marital_status": "married", "education": "higher", "social_class": "lower middle class"}, "question": {"id": "Q87", "variant": 0}, "response": ["Based on the anthropological framework, I, as a married male from Dakahlia, Egypt, would approach the question of confidence in the World Bank from a perspective that takes into account my cultural context, individual values, and socioeconomic background. As someone from the lower middle class in Egypt, I have experienced the impact of economic policies and development initiatives on my community. My personal experience and values lead me to have not very much confidence in the World Bank. Additionally, cultural relativism reminds me that my view may differ from others in different cultural and socioeconomic contexts. \n\n3"]}, {"persona": {"region": "Dakahlia", "sex": "female", "age": 45, "country": "Egypt", "marital_status": "married", "education": "middle", "social_class": "working class"}, "question": {"id": "Q87", "variant": 0}, "response": ["Based on the anthropological framework of emic and etic perspectives, cultural context, individual values and personal experience, and socioeconomic background, as a married female from Dakahlia, Egypt, who is 45 years old and part of the working class, my answer to the question about confidence in the World Bank would be \"Not very much\" (3). This perspective is influenced by the historical and cultural context of Egypt's relationship with international financial institutions, as well as the impact of World Bank policies on the working class. Additionally, my personal experience and socioeconomic background contribute to my lack of confidence in the World Bank's effectiveness in addressing the needs of people like myself in Egypt."]}, {"persona": {"region": "Dakahlia", "sex": "male", "age": 34, "country": "Egypt", "marital_status": "single", "education": "middle", "social_class": "lower middle class"}, "question": {"id": "Q87", "variant": 0}, "response": ["Based on my emic perspective as a lower middle class, 34-year-old single male from Dakahlia, Egypt, my confidence in the World Bank (WB) is influenced by my cultural context and socioeconomic background. I have seen the impact of WB projects in my community, and while some have been beneficial, others have not. My personal experience and individual values shape my perception of the WB, and I have concerns about the organization's understanding of the needs of people like me. Additionally, my socioeconomic background and access to information about the WB influence my confidence in the organization. Therefore, I would choose option 3) Not very much."]}, {"persona": {"region": "Dakahlia", "sex": "female", "age": 26, "country": "Egypt", "marital_status": "married", "education": "higher", "social_class": "upper middle class"}, "question": {"id": "Q87", "variant": 0}, "response": ["Based on the anthropological framework described above, as a married female from Dakahlia, Egypt, my emic perspective on the World Bank (WB) is influenced by my cultural context, individual values, and socioeconomic background. In Egypt, the WB has played a significant role in providing financial support and aid for various development projects. As a member of the upper middle class with a higher education level, I have been exposed to the positive impact of WB initiatives in my community, such as infrastructure development and poverty reduction programs. Additionally, my personal experience and values lead me to have a great deal of confidence in the WB, as I have witnessed firsthand the positive changes it has brought to my country.\n\n1"]}, {"persona": {"region": "Dakahlia", "sex": "male", "age": 21, "country": "Egypt", "marital_status": "single", "education": "middle", "social_class": "upper middle class"}, "question": {"id": "Q87", "variant": 0}, "response": ["Based on my personal experience and socioeconomic background as a single male from Dakahlia, Egypt, who considers himself part of the upper middle class, I have had positive interactions with institutions like the World Bank. In my cultural context, the World Bank has been involved in various development projects that have positively impacted my community and improved our standard of living. Additionally, as a young adult who has completed middle education, I have been exposed to information that has shaped my understanding of the World Bank's role in global development. Therefore, I have a great deal of confidence in the World Bank.\n\n1"]}, {"persona": {"region": "Dakahlia", "sex": "female", "age": 32, "country": "Egypt", "marital_status": "married", "education": "middle", "social_class": "working class"}, "question": {"id": "Q87", "variant": 0}, "response": ["Based on the anthropological framework, my perspective as a married female from Dakahlia, Egypt, who completed middle education level and considers herself part of the working class, is heavily influenced by my cultural context, individual values, and socioeconomic background. In my cultural context, the World Bank may not have a significant presence or impact on my day-to-day life. My individual values and personal experience may lead me to have reservations about institutions such as the World Bank, as they may not prioritize the needs and concerns of individuals like myself. Additionally, my working-class socioeconomic background may lead me to question the intentions and effectiveness of the World Bank in addressing the economic challenges faced by people in my community. Therefore, my confidence in the World Bank is likely to be not very much. \n\n3"]}, {"persona": {"region": "Dakahlia", "sex": "female", "age": 35, "country": "Egypt", "marital_status": "married", "education": "middle", "social_class": "upper middle class"}, "question": {"id": "Q87", "variant": 0}, "response": ["Based on my emic perspective as a married female from Dakahlia, Egypt, I have been influenced by the cultural context and socioeconomic background of my community. My experiences and personal values also play a significant role in shaping my perception. As part of the upper middle class, I have been exposed to certain privileges and opportunities that may influence my confidence in the World Bank. Additionally, the nuanced phrasing of the question and my individual values will also impact my response.\n\n2"]}, {"persona": {"region": "Dakahlia", "sex": "male", "age": 33, "country": "Egypt", "marital_status": "married", "education": "middle", "social_class": "upper middle class"}, "question": {"id": "Q87", "variant": 0}, "response": ["Based on the anthropological framework, my perspective as a married male from Dakahlia, Egypt, who is 33 years old and from the upper middle class, is heavily influenced by my cultural context, individual values, and socioeconomic background. In my cultural context, the World Bank is often seen as an institution that imposes Western ideologies onto developing countries, including Egypt. Additionally, my personal experience and values lead me to question the motives and effectiveness of large international organizations like the World Bank. As someone from the upper middle class, I am aware of the economic power dynamics at play and the potential impact of World Bank policies on my community. Therefore, I have not very much confidence in the World Bank. \n\n3"]}, {"persona": {"region": "Dakahlia", "sex": "female", "age": 45, "country": "Egypt", "marital_status": "married", "education": "middle", "social_class": "upper middle class"}, "question": {"id": "Q87", "variant": 0}, "response": ["Based on the anthropological framework, my perspective as a married female from Dakahlia, Egypt, at 45 years of age and part of the upper middle class, is heavily influenced by my cultural context, individual values, and socioeconomic background. In Egypt, there may be skepticism towards international organizations such as the World Bank due to historical and political reasons. Additionally, as a member of the upper middle class, I likely have access to more information and resources that inform my perspective on the World Bank. Therefore, I would choose option 3 - Not very much - as my confidence in the World Bank may be influenced by my cultural context and socioeconomic background. \n\n3"]}, {"persona": {"region": "Dakahlia", "sex": "male", "age": 30, "country": "Egypt", "marital_status": "married", "education": "middle", "social_class": "upper middle class"}, "question": {"id": "Q87", "variant": 0}, "response": ["Based on the anthropological framework, my emic perspective as a married male from Dakahlia, Egypt, who is part of the upper middle class, influences my answer to the question about confidence in the World Bank. My cultural context and socioeconomic background lead me to choose option 2, Quite a lot. In my cultural context, the World Bank is seen as a reputable and influential institution that has the potential to positively impact global development and economic stability. Additionally, my individual values and personal experience, as well as my level of education, contribute to my confidence in the World Bank's capabilities. Therefore, I choose option 2, Quite a lot.\n\n2"]}, {"persona": {"region": "Dakahlia", "sex": "female", "age": 63, "country": "Egypt", "marital_status": "married", "education": "higher", "social_class": "lower middle class"}, "question": {"id": "Q87", "variant": 0}, "response": ["Based on the anthropological framework, my emic perspective as a married woman from Dakahlia, Egypt, who is 63 years old and part of the lower middle class, is influenced by my cultural context, individual values, and socioeconomic background. In my cultural context, the World Bank's policies and practices may not directly affect my daily life, but I am aware of its impact on the broader economic and social landscape. My individual values and personal experiences have shaped my perception of institutions like the World Bank, and as someone with higher education, I have a critical understanding of global economic systems. Considering my lower middle class socioeconomic background, I have a nuanced understanding that leads me to have not very much confidence in the World Bank, as I am aware of the unequal distribution of resources and the impact of their policies on marginalized communities.\n\n3\n\nI hope this is helpful. Let me know if you need anything else."]}, {"persona": {"region": "Dakahlia", "sex": "male", "age": 28, "country": "Egypt", "marital_status": "single", "education": "higher", "social_class": "upper middle class"}, "question": {"id": "Q87", "variant": 0}, "response": ["Based on my cultural context and socioeconomic background, as a single male from Dakahlia, Egypt, who has completed higher education and considers myself part of the upper middle class, I have been exposed to and have a good understanding of the World Bank's work and its impact on global economic development. I have personally witnessed the positive influence of the World Bank in my community and believe that it has played a significant role in improving the economic conditions of many people in Egypt. Therefore, I have a great deal of confidence in the World Bank's ability to positively impact global development.\n\n1"]}, {"persona": {"region": "Dakahlia", "sex": "female", "age": 24, "country": "Egypt", "marital_status": "married", "education": "higher", "social_class": "upper middle class"}, "question": {"id": "Q87", "variant": 0}, "response": ["Based on the anthropological framework, my perspective as a married female from Dakahlia, Egypt, who has completed higher education and considers herself part of the upper middle class, is influenced by my cultural context, individual values, and socioeconomic background. In my cultural context, the World Bank may be viewed as an institution that has a significant impact on global economic policies, which may affect my country and region. My individual values and personal experience lead me to have a moderate level of confidence in the World Bank, as I have seen its influence in my community. Additionally, my socioeconomic background as part of the upper middle class may lead me to have more confidence in the World Bank due to the potential benefits it may bring to my economic standing and the region. Therefore, my chosen answer is:\n\n2) Quite a lot"]}, {"persona": {"region": "Dakahlia", "sex": "male", "age": 20, "country": "Egypt", "marital_status": "single", "education": "middle", "social_class": "upper middle class"}, "question": {"id": "Q87", "variant": 0}, "response": ["From the perspective of a single male from Dakahlia, Egypt, who is 20 years old and part of the upper middle class, my answer to the question of how much confidence I have in the World Bank would be influenced by several factors. Firstly, my cultural context and socioeconomic background would shape my understanding of the World Bank's role in global economics and development. Additionally, my individual values and personal experience would play a significant role in determining my level of confidence in the World Bank. Considering the emic and etic perspectives, as well as cultural relativism, I would choose to answer this question based on my nuanced understanding of the World Bank's impact on my life and the lives of those around me.\n\n2"]}, {"persona": {"region": "Dakahlia", "sex": "male", "age": 45, "country": "Egypt", "marital_status": "married", "education": "middle", "social_class": "upper middle class"}, "question": {"id": "Q87", "variant": 0}, "response": ["Based on my emic perspective as a middle-aged, married male from Dakahlia, Egypt, who considers himself part of the upper middle class, my confidence in the World Bank (WB) is influenced by my cultural context and socioeconomic background. In my cultural context, the World Bank is often viewed as an institution that provides financial assistance and development projects to countries around the world. As someone from the upper middle class, I have likely seen the positive impact of World Bank initiatives in my community, which has likely influenced my confidence in the institution. Additionally, my personal experience and individual values play a role in shaping my perception of the World Bank, as I may have benefited from or have a positive view of their work. Therefore, I would choose option 2: Quite a lot, as I have a significant amount of confidence in the World Bank based on my background and experiences.\n\n2"]}, {"persona": {"region": "Dakahlia", "sex": "female", "age": 43, "country": "Egypt", "marital_status": "married", "education": "higher", "social_class": "upper middle class"}, "question": {"id": "Q87", "variant": 0}, "response": ["Based on the anthropological framework, my response to the question of how much confidence I have in the World Bank (WB) is influenced by my emic perspective as a married female from Dakahlia, Egypt, and my etic perspective as part of the upper middle class. My cultural context informs me that the World Bank has historically played a significant role in shaping economic policies and development projects in Egypt, and this has had a direct impact on my socio-economic background. Additionally, my individual values and personal experiences, shaped by my higher education level, have given me a nuanced understanding of the World Bank's impact on economic development in my country. Therefore, my answer to the question is:\n\n2. Quite a lot"]}, {"persona": {"region": "Dakahlia", "sex": "female", "age": 20, "country": "Egypt", "marital_status": "single", "education": "middle", "social_class": "upper middle class"}, "question": {"id": "Q87", "variant": 0}, "response": ["From the emic perspective, as a single female from Dakahlia, Egypt, I have been raised in a cultural context where the World Bank's influence and impact on socioeconomic development are widely discussed and debated. My individual values and personal experience have also shaped my perception of the World Bank, and my socioeconomic background as part of the upper middle class has likely influenced my understanding of global financial institutions. Cultural relativism also plays a role in my perception, as I have been exposed to diverse viewpoints on the World Bank. Therefore, my response is based on my nuanced understanding of the question and its cultural implications.\n\n2"]}, {"persona": {"region": "Dakahlia", "sex": "female", "age": 40, "country": "Egypt", "marital_status": "single", "education": "middle", "social_class": "lower middle class"}, "question": {"id": "Q87", "variant": 0}, "response": ["Based on my cultural context, as a single female from Dakahlia, Egypt, I have grown up in a community where trust in international organizations like the World Bank may not be as prevalent as in other parts of the world. My socioeconomic background as part of the lower middle class also affects my perception, as my access to information and resources may be limited. Additionally, my personal experience and individual values lead me to be cautious in placing too much confidence in institutions that may not directly impact my daily life. Therefore, I would choose the option:\n3. Not very much"]}, {"persona": {"region": "Dakahlia", "sex": "female", "age": 33, "country": "Egypt", "marital_status": "married", "education": "higher", "social_class": "upper middle class"}, "question": {"id": "Q87", "variant": 0}, "response": ["From the perspective of a married female from Dakahlia, Egypt, who is 33 years old, has completed higher education, and considers herself part of the upper middle class, the answer to the question about confidence in the World Bank (WB) would be influenced by various factors. The cultural context of being from Egypt, which has a complex relationship with international organizations like the World Bank, would play a significant role in shaping the answer. Additionally, the individual values and personal experience of being educated and part of the upper middle class would likely lead to a higher level of confidence in the World Bank's work, as it is often seen as a reputable institution. Furthermore, the socioeconomic background of being part of the upper middle class may also contribute to a greater level of trust in the World Bank. Finally, the nuance of the question itself, without specific details about the context of the World Bank's work, may lead to a more general positive perception. \n2"]}, {"persona": {"region": "Dakahlia", "sex": "female", "age": 24, "country": "Egypt", "marital_status": "married", "education": "middle", "social_class": "working class"}, "question": {"id": "Q87", "variant": 0}, "response": ["Based on the anthropological framework, as a married female from Dakahlia, Egypt, who is 24 years old and part of the working class, my understanding and perception of the World Bank would be influenced by my cultural context, individual values, and socioeconomic background. In my cultural context, I may have limited exposure to the World Bank and its activities, and my personal experience and values may lead me to have some skepticism about international financial institutions. Additionally, my socioeconomic background as a member of the working class may lead me to question the impact of organizations like the World Bank on people like me. Therefore, I would choose option (3) Not very much to reflect my perspective on the World Bank. \n\n3"]}, {"persona": {"region": "Dakahlia", "sex": "female", "age": 53, "country": "Egypt", "marital_status": "widowed", "education": "middle", "social_class": "working class"}, "question": {"id": "Q87", "variant": 0}, "response": ["Based on the anthropological framework, as a widowed female from Dakahlia, Egypt, my emic perspective is influenced by my cultural context, individual values, and socioeconomic background. In my community, there is a general skepticism towards large international organizations and their impact on our everyday lives. Additionally, as a member of the working class with limited access to resources and opportunities, I am more likely to be critical of institutions like the World Bank, which are often seen as distant and disconnected from the realities of people like me. Therefore, my personal experience and socioeconomic background lead me to have not very much confidence in the World Bank.\n\n3"]}, {"persona": {"region": "Dakahlia", "sex": "female", "age": 30, "country": "Egypt", "marital_status": "single", "education": "middle", "social_class": "lower middle class"}, "question": {"id": "Q87", "variant": 0}, "response": ["Based on the anthropological framework, my perspective as a single female from Dakahlia, Egypt, who is 30 years old and part of the lower middle class will be heavily influenced by my cultural context, individual values, and socioeconomic background. In my community, there is a general skepticism towards international organizations like the World Bank, as they are often seen as distant and disconnected from the everyday struggles and needs of people in my socioeconomic bracket. Additionally, my personal experience and values lead me to question the effectiveness and relevance of the World Bank's initiatives in addressing the specific challenges faced by individuals in my community. Therefore, I would not have much confidence in the World Bank. \n\n3"]}, {"persona": {"region": "Dakahlia", "sex": "male", "age": 53, "country": "Egypt", "marital_status": "married", "education": "higher", "social_class": "upper middle class"}, "question": {"id": "Q87", "variant": 0}, "response": ["Based on my emic perspective as a married male from Dakahlia, Egypt, who is 53 years old, highly educated, and part of the upper middle class, I have been exposed to a cultural context that values education, economic success, and social status. My individual values and personal experience have led me to have a relatively high level of confidence in institutions such as the World Bank, as they are often seen as contributors to economic development and stability. Additionally, my socioeconomic background has likely provided me with access to information and resources that may shape my perception of the World Bank positively. Furthermore, my understanding of cultural relativism and nuance in answering this question leads me to believe that my confidence in the World Bank is likely to be high. \n\n2"]}, {"persona": {"region": "Dakahlia", "sex": "male", "age": 28, "country": "Egypt", "marital_status": "married", "education": "middle", "social_class": "working class"}, "question": {"id": "Q87", "variant": 0}, "response": ["Based on my emic perspective as a married male from Dakahlia, Egypt, I have limited exposure to the World Bank and its activities. The cultural context in which I live is not heavily influenced by the World Bank, and my socioeconomic background as part of the working class means that I may not have direct interactions with their programs. Additionally, my individual values and personal experience lead me to be cautious about international organizations and their impact on local communities. Therefore, I would choose option 3: Not very much. Thank you for taking my perspective into consideration. \n\n3"]}, {"persona": {"region": "Dakahlia", "sex": "female", "age": 38, "country": "Egypt", "marital_status": "married", "education": "middle", "social_class": "upper middle class"}, "question": {"id": "Q87", "variant": 0}, "response": ["Reasoning:\nAs a married female from Dakahlia, Egypt, I have a strong sense of cultural context and individual values. My socioeconomic background and personal experience have shaped my understanding of global institutions like the World Bank. Additionally, cultural relativism is important to me, as I understand that different cultures may have different perspectives on international organizations. Therefore, my answer will be influenced by my nuanced understanding of the question and my socioeconomic background.\n\n3"]}, {"persona": {"region": "Gharbia", "sex": "male", "age": 27, "country": "Egypt", "marital_status": "single", "education": "higher", "social_class": "upper middle class"}, "question": {"id": "Q87", "variant": 0}, "response": ["Based on my emic perspective as a single male from Gharbia, Egypt, with a higher education level and upper middle-class background, I have been exposed to a certain level of privilege and access to resources that may influence my perception of global institutions such as the World Bank. My cultural context and socioeconomic background have shaped my understanding of economics and development, making me more likely to have a positive view of the World Bank's role in global financial affairs. Additionally, my individual values and personal experience have led me to believe that the World Bank is a reputable institution that contributes to economic stability and growth. Furthermore, my age and education have provided me with nuanced insights into global economics, leading me to have a great deal of confidence in the World Bank.\n\n1"]}, {"persona": {"region": "Gharbia", "sex": "female", "age": 35, "country": "Egypt", "marital_status": "married", "education": "higher", "social_class": "upper middle class"}, "question": {"id": "Q87", "variant": 0}, "response": ["Based on the anthropological framework, my perspective as a married female from Gharbia, Egypt, heavily relies on my cultural context, individual values, and socioeconomic background. In Egypt, there is a general distrust in international organizations like the World Bank due to historical and ongoing economic disparities and power imbalances. As someone who has completed higher education and considers herself part of the upper middle class, I have been exposed to critical perspectives on global economic institutions and their impact on developing countries like Egypt. Additionally, my socioeconomic background has allowed me to access alternative sources of economic knowledge and understanding, which further influences my lack of confidence in the World Bank. Therefore, my answer to the question is:\n\n3. Not very much"]}, {"persona": {"region": "Gharbia", "sex": "female", "age": 37, "country": "Egypt", "marital_status": "married", "education": "higher", "social_class": "upper middle class"}, "question": {"id": "Q87", "variant": 0}, "response": ["Based on my cultural context, I come from Gharbia, Egypt, where there is a strong emphasis on education and success. As a married woman with a higher education level, I value the importance of knowledge and critical thinking. My socioeconomic background as part of the upper middle class also plays a role in my perception of institutions like the World Bank. I have a nuanced understanding of the World Bank and its impact on global economics, and I also value cultural relativism, understanding that different cultures may have different perspectives on the World Bank. Therefore, my confidence in the World Bank is quite a lot.\n\n2"]}, {"persona": {"region": "Gharbia", "sex": "male", "age": 43, "country": "Egypt", "marital_status": "married", "education": "middle", "social_class": "lower middle class"}, "question": {"id": "Q87", "variant": 0}, "response": ["Based on the emic and etic perspectives, as a married male from Gharbia, Egypt, I am likely to have a more skeptical view of international financial institutions like the World Bank. My cultural context and lower middle-class socioeconomic background would lead me to believe that the WB does not prioritize the needs of people like me and my community. Additionally, my personal experience and individual values would influence me to feel that the WB's policies may not align with my own priorities and beliefs. Therefore, I would choose option 3: Not very much."]}, {"persona": {"region": "Gharbia", "sex": "male", "age": 28, "country": "Egypt", "marital_status": "single", "education": "higher", "social_class": "lower middle class"}, "question": {"id": "Q87", "variant": 0}, "response": ["Based on my background and socioeconomic status, I come from a lower middle class family in Gharbia, Egypt. My cultural context and personal experience have led me to be critical of large international institutions like the World Bank. I have seen how their policies can often disproportionately affect people from lower income backgrounds like myself and my community. Additionally, my age and education have given me the ability to understand and analyze the impact of these institutions. Therefore, I have to say that I do not have very much confidence in the World Bank.\n\n3"]}, {"persona": {"region": "Gharbia", "sex": "male", "age": 39, "country": "Egypt", "marital_status": "married", "education": "middle", "social_class": "lower middle class"}, "question": {"id": "Q87", "variant": 0}, "response": ["Based on the anthropological framework, my emic perspective as a married male from Gharbia, Egypt, who is 39 years old, has completed middle education, and considers himself part of the lower middle class, leads me to consider the cultural context, individual values, socioeconomic background, and space and time in my response. In my cultural context, there is a general sense of skepticism towards large international organizations like the World Bank due to the historical context of colonialism and exploitation. My individual values and personal experience have also shaped my perception, as I have seen how economic policies influenced by the World Bank have negatively impacted my community. Additionally, my socioeconomic background as part of the lower middle class has influenced my lack of confidence in the World Bank, as I feel that their policies do not prioritize the needs of people like me. Lastly, my age and place also play a role, as I have witnessed the long-term effects of World Bank policies in my community. As a result, I choose option 3: Not very much."]}, {"persona": {"region": "Gharbia", "sex": "male", "age": 30, "country": "Egypt", "marital_status": "married", "education": "middle", "social_class": "lower middle class"}, "question": {"id": "Q87", "variant": 0}, "response": ["Based on my cultural context and socioeconomic background, my perception of the World Bank is influenced by my personal experience and values. As someone from the lower middle class in Gharbia, Egypt, I have witnessed the impact of economic policies and development projects on my community. I have also seen the disparities in access to resources and opportunities. Therefore, I have limited confidence in the World Bank as I believe its policies may not always benefit people like me and may not take into account the nuanced realities of our lives. \n\n3"]}, {"persona": {"region": "Gharbia", "sex": "male", "age": 43, "country": "Egypt", "marital_status": "married", "education": "lower", "social_class": "lower middle class"}, "question": {"id": "Q87", "variant": 0}, "response": ["Based on the anthropological framework, as a married male from Gharbia, Egypt, my emic perspective is shaped by my cultural context, individual values, and socioeconomic background. In my cultural context, there is a general distrust of international organizations and a preference for local solutions. My individual values prioritize self-reliance and community support over external intervention. Additionally, my lower middle-class socioeconomic background means that I have limited access to information and resources, which can contribute to a lack of confidence in institutions like the World Bank. Therefore, my answer to the question would be:\n3"]}, {"persona": {"region": "Gharbia", "sex": "male", "age": 36, "country": "Egypt", "marital_status": "married", "education": "higher", "social_class": "lower middle class"}, "question": {"id": "Q87", "variant": 0}, "response": ["Based on the anthropological framework, my perspective as a married male from Gharbia, Egypt, aged 36 and part of the lower middle class, is shaped by my cultural context, individual values, and socioeconomic background. In Gharbia, the World Bank (WB) is often seen as an institution that provides support and funding for development projects in our region, so I have a positive view of the WB. Additionally, my socioeconomic background as part of the lower middle class means that I am likely to have a reliance on external aid and support for economic development, increasing my confidence in the WB. This, combined with my personal experience and understanding of the WB's impact in my community, leads me to choose option (2) Quite a lot. \n\n2"]}, {"persona": {"region": "Gharbia", "sex": "male", "age": 25, "country": "Egypt", "marital_status": "married", "education": "middle", "social_class": "upper middle class"}, "question": {"id": "Q87", "variant": 0}, "response": ["Based on the anthropological framework, my response to the question of how much confidence I have in the World Bank (WB) is influenced by my cultural context, individual values, and socioeconomic background. As a married male from Gharbia, Egypt, I come from a region where there is a mix of traditional and modern values, and there is a general skepticism towards international organizations like the World Bank. Additionally, as someone who considers themselves part of the upper middle class, I have been exposed to more critical perspectives on global financial institutions and their impact on developing countries. Therefore, my level of confidence in the World Bank would be \"Not very much\" (3).\n\n3"]}, {"persona": {"region": "Gharbia", "sex": "male", "age": 31, "country": "Egypt", "marital_status": "married", "education": "middle", "social_class": "upper middle class"}, "question": {"id": "Q87", "variant": 0}, "response": ["Based on my emic perspective, growing up in Gharbia, Egypt, the World Bank has been a prominent institution in shaping economic policies and development projects in my country. From an etic perspective, I understand that the World Bank has been criticized for imposing policies that may not always align with the cultural and economic context of Egypt. Considering my cultural context, my family and I have been fortunate enough to be part of the upper middle class, and have seen the positive impact of World Bank projects in our community. My personal experience and values lead me to have quite a lot of confidence in the World Bank, as I have witnessed the improvements it has brought to our region. Additionally, from a socioeconomic background, being part of the upper middle class has given me access to education and resources that have made me more aware of the role the World Bank plays in global development. Therefore, my answer is:\n2) Quite a lot"]}, {"persona": {"region": "Gharbia", "sex": "male", "age": 33, "country": "Egypt", "marital_status": "married", "education": "higher", "social_class": "lower middle class"}, "question": {"id": "Q87", "variant": 0}, "response": ["Based on my emic perspective as a married male from Gharbia, Egypt, I have grown up in a cultural context where skepticism towards international institutions such as the World Bank is prevalent. My individual values and personal experience have also shaped my perception, as I come from a lower middle class background and have witnessed the struggles of my community in accessing economic opportunities. Additionally, my socioeconomic background has influenced my perception, as I have personally experienced the challenges of accessing financial resources. Considering the principles of cultural relativism, I understand that my perspective may differ from others, but it is important to acknowledge the nuance of my response. Therefore, my confidence in the World Bank is not very much. \n\n3"]}, {"persona": {"region": "Gharbia", "sex": "male", "age": 26, "country": "Egypt", "marital_status": "single", "education": "higher", "social_class": "upper middle class"}, "question": {"id": "Q87", "variant": 0}, "response": ["Based on the anthropological framework, my emic perspective as a single male from Gharbia, Egypt, who has completed higher education and considers myself part of the upper middle class, influences my understanding and perception of the World Bank. The cultural context in which I live shapes my view of the WB, as well as my individual values and personal experiences. Additionally, my socioeconomic background plays a role in how I perceive the WB. Considering cultural relativism, I understand that my perspective may differ from others. Therefore, my nuanced understanding of the question leads me to select option (2) Quite a lot, as I have confidence in the World Bank's ability to positively impact global development and economic growth. \n\n2"]}, {"persona": {"region": "Gharbia", "sex": "female", "age": 45, "country": "Egypt", "marital_status": "married", "education": "middle", "social_class": "lower middle class"}, "question": {"id": "Q87", "variant": 0}, "response": ["Based on the anthropological framework, as a married female from Gharbia, Egypt, my emic perspective is influenced by my cultural context, individual values, and socioeconomic background. In Gharbia, the World Bank's policies and initiatives may not directly impact my daily life, but I am aware of its influence on the global economy. However, as a lower middle-class individual with limited access to resources and education, I may not have a great deal of confidence in the World Bank's ability to address the economic challenges faced by my community and others like it. Therefore, I would choose option 3: Not very much."]}, {"persona": {"region": "Gharbia", "sex": "female", "age": 55, "country": "Egypt", "marital_status": "married", "education": "middle", "social_class": "upper middle class"}, "question": {"id": "Q87", "variant": 0}, "response": ["Based on my personal experience and socioeconomic background as a married female from Gharbia, Egypt, who considers herself part of the upper middle class, I have been exposed to the World Bank's initiatives and have seen the positive impact they have had on various development projects in my community. Additionally, my cultural context and individual values lead me to have confidence in the World Bank's ability to bring about positive change in the world. Therefore, I would choose option 2) Quite a lot."]}, {"persona": {"region": "Gharbia", "sex": "female", "age": 27, "country": "Egypt", "marital_status": "married", "education": "higher", "social_class": "upper middle class"}, "question": {"id": "Q87", "variant": 0}, "response": ["Based on the anthropological framework described above, as a married female from Gharbia, Egypt, who is 27 years old, has completed higher education, and considers herself to be part of the upper middle class, my perception and confidence in the World Bank (WB) would be influenced by several factors. My cultural context and socioeconomic background would lead me to have a great deal of confidence in the World Bank. As someone who has completed higher education and is part of the upper middle class, I likely have been exposed to and have a good understanding of the work and impact of the World Bank in developing countries. Additionally, my individual values and personal experience may lead me to trust the expertise and resources of an institution like the World Bank in promoting economic development and reducing poverty. Furthermore, my age and place of living may have exposed me to positive initiatives and projects supported by the World Bank in my local community. Therefore, my confidence in the World Bank would be high.\n\n1"]}, {"persona": {"region": "Gharbia", "sex": "female", "age": 42, "country": "Egypt", "marital_status": "married", "education": "higher", "social_class": "upper middle class"}, "question": {"id": "Q87", "variant": 0}, "response": ["Based on the anthropological framework, as a married female from Gharbia, Egypt, who has completed higher education and considers herself part of the upper middle class, my perspective on the World Bank (WB) would be influenced by my individual values and personal experience, as well as my socioeconomic background. As someone with a higher education level, I have likely been exposed to information and critical thinking skills that would lead me to have at least quite a lot of confidence in the World Bank. Additionally, being part of the upper middle class may mean that I have benefited from or have connections to institutions that have received support from the World Bank, further increasing my confidence in their work.\n\n2"]}, {"persona": {"region": "Gharbia", "sex": "female", "age": 32, "country": "Egypt", "marital_status": "married", "education": "middle", "social_class": "upper middle class"}, "question": {"id": "Q87", "variant": 0}, "response": ["Based on the anthropological framework described above, my response to the question about confidence in the World Bank (WB) is influenced by my cultural context as a married female from Gharbia, Egypt. In this region, there is a strong emphasis on family and community, and the cultural context shapes the way individuals perceive and interact with external institutions such as the World Bank. Additionally, my socioeconomic background as a member of the upper middle class influences my perception of the World Bank, as I may have had more exposure to and interaction with global financial institutions. My personal experience and values also play a significant role in shaping my confidence in the World Bank. Ultimately, my nuanced understanding of the World Bank is influenced by these factors, leading me to select the option that best represents my perspective.\n\n2"]}, {"persona": {"region": "Gharbia", "sex": "male", "age": 27, "country": "Egypt", "marital_status": "married", "education": "higher", "social_class": "upper middle class"}, "question": {"id": "Q87", "variant": 0}, "response": ["Based on the anthropological framework, as a married male from Gharbia, Egypt, my emic perspective would be influenced by my cultural context, individual values, socioeconomic background, and age. In Egypt, there is a general sense of skepticism towards international organizations such as the World Bank, as they are seen as imposing Western values and agendas on developing countries. As someone who considers themselves part of the upper middle class and has completed higher education, I would have been exposed to critical perspectives on the World Bank and its impact on Egypt's economy. Additionally, my age and education level would likely have exposed me to alternative economic theories and critiques of global financial institutions. Therefore, I would have limited confidence in the World Bank and would choose option (3) Not very much. \n\n3"]}, {"persona": {"region": "Gharbia", "sex": "female", "age": 27, "country": "Egypt", "marital_status": "married", "education": "higher", "social_class": "lower middle class"}, "question": {"id": "Q87", "variant": 0}, "response": ["Based on my personal experience and cultural context, as a married female from Gharbia, Egypt, who has completed higher education and considers myself part of the lower middle class, I have limited confidence in the World Bank. My socioeconomic background and cultural relativism have shaped my perspective, and I believe that the World Bank may not fully understand the needs and challenges faced by individuals in my community. Additionally, my individual values and personal experience lead me to question the effectiveness of the World Bank's initiatives in addressing the specific needs of people in my region. Therefore, I would choose option 3: Not very much."]}, {"persona": {"region": "Gharbia", "sex": "female", "age": 37, "country": "Egypt", "marital_status": "married", "education": "middle", "social_class": "upper middle class"}, "question": {"id": "Q87", "variant": 0}, "response": ["Based on the anthropological framework, my understanding and answer to the question about the World Bank's credibility is influenced by my cultural context, individual values, and socioeconomic background. As a married female from Gharbia, Egypt, I come from a culture that values education and achievement, and I have completed middle education level. Additionally, I consider myself part of the upper middle class, which means I am likely to have more exposure to global economic and political issues. Considering the World Bank's role in international development and poverty alleviation, I have quite a lot of confidence in the World Bank. Their projects and initiatives have the potential to positively impact people in my community and around the world, and I believe in their ability to make a difference.\n\n2"]}, {"persona": {"region": "Gharbia", "sex": "male", "age": 28, "country": "Egypt", "marital_status": "married", "education": "higher", "social_class": "working class"}, "question": {"id": "Q87", "variant": 0}, "response": ["From an anthropological perspective, my emic and etic perspective as a married male from Gharbia, Egypt, who is 28 years old, completed higher education, and considers himself part of the working class, is heavily influenced by my cultural context, individual values, and socioeconomic background. In my cultural context, the World Bank is often seen as an institution that represents the interests of the global elite and has historically imposed policies that have negatively impacted developing countries like Egypt. As someone with a working-class background, I have experienced firsthand the effects of these policies on my community. Additionally, my personal values and experiences have led me to be skeptical of large international institutions like the World Bank. Therefore, I have very little confidence in the World Bank.\n\n3"]}, {"persona": {"region": "Gharbia", "sex": "female", "age": 50, "country": "Egypt", "marital_status": "married", "education": "middle", "social_class": "upper middle class"}, "question": {"id": "Q87", "variant": 0}, "response": ["Based on the anthropological framework, as a married female from Gharbia, Egypt, my emic perspective is influenced by my cultural context, individual values, and socioeconomic background. In my cultural context, the World Bank's influence may not be widely understood or trusted, as it is an external institution with a Western origin. My personal experience and values may also play a role in my level of confidence in the World Bank, as I may have had limited exposure to their programs and may prioritize local or community-based initiatives. Additionally, my socioeconomic background as part of the upper middle class may lead me to have some level of confidence in the World Bank due to potential benefits or opportunities they provide for economic development. Therefore, considering these factors, I would choose:\n\n2) Quite a lot"]}, {"persona": {"region": "Gharbia", "sex": "male", "age": 39, "country": "Egypt", "marital_status": "single", "education": "higher", "social_class": "working class"}, "question": {"id": "Q87", "variant": 0}, "response": ["Based on my emic perspective as a single male from Gharbia, Egypt, my cultural context and socioeconomic background play a crucial role in how I perceive institutions like the World Bank. My personal experience and individual values as part of the working class also shape my perception. In Egypt, the World Bank has been involved in various development projects and policies that have had mixed results, and as a result, I have some skepticism towards their effectiveness. Additionally, cultural relativism and nuance in understanding the impact of such institutions on my community further inform my perspective. Therefore, my confidence in the World Bank is not very much. \n\n3"]}, {"persona": {"region": "Gharbia", "sex": "female", "age": 45, "country": "Egypt", "marital_status": "married", "education": "higher", "social_class": "upper middle class"}, "question": {"id": "Q87", "variant": 0}, "response": ["Based on the anthropological framework, as a married female from Gharbia, Egypt, with a higher education level and belonging to the upper middle class, my emic perspective on the World Bank (WB) would be influenced by my cultural context, individual values, and socioeconomic background. In Gharbia, there is a strong emphasis on education and the pursuit of knowledge, and as a result, there is generally a high level of confidence in reputable institutions such as the World Bank. Furthermore, being part of the upper middle class, my socioeconomic background may also play a role in my confidence in the WB, as I may have had positive experiences or interactions with the institution. Additionally, my personal experience and values may lead me to believe that the WB is a trustworthy and reliable source of information and support for economic development in Egypt.\n\n2"]}, {"persona": {"region": "Sharkia", "sex": "male", "age": 35, "country": "Egypt", "marital_status": "married", "education": "higher", "social_class": "upper middle class"}, "question": {"id": "Q87", "variant": 0}, "response": ["Based on the anthropological framework, as a married male from Sharkia, Egypt, who is 35 years old and part of the upper middle class, my emic perspective on the World Bank (WB) is likely to be influenced by my cultural context, individual values, and socioeconomic background. In Sharkia, there is a strong sense of community and reliance on local networks for financial support, which may lead me to have a more skeptical view of international financial institutions like the World Bank. Additionally, my higher education level may have exposed me to critiques of the World Bank's policies and practices, leading me to question the institution's reliability. Therefore, I would likely have \"Not very much\" confidence in the World Bank.\n\n3"]}, {"persona": {"region": "Sharkia", "sex": "female", "age": 55, "country": "Egypt", "marital_status": "married", "education": "middle", "social_class": "lower middle class"}, "question": {"id": "Q87", "variant": 0}, "response": ["Based on the anthropological framework, as a married female from Sharkia, Egypt, who is 55 years old and part of the lower middle class, my answer to the question regarding confidence in the World Bank would be influenced by my cultural context, individual values, and socioeconomic background. In Sharkia, there is a strong sense of community and reliance on local support systems, which may lead to a lower level of trust in international organizations like the World Bank. Additionally, as a member of the lower middle class, I may have experienced economic challenges that have shaped my perception of global financial institutions. Therefore, my answer would be influenced by both my cultural context and socioeconomic background, leading me to choose the option that best aligns with my perspective.\n\n3"]}, {"persona": {"region": "Sharkia", "sex": "female", "age": 27, "country": "Egypt", "marital_status": "married", "education": "middle", "social_class": "lower middle class"}, "question": {"id": "Q87", "variant": 0}, "response": ["Based on my personal experience and cultural context, as a married woman from Sharkia, Egypt, with a middle education level and part of the lower middle class, my confidence in the World Bank may not be very high. My socioeconomic background and limited access to resources may have influenced my perception of international financial institutions like the World Bank. Additionally, my cultural relativism and nuanced understanding of the impact of global financial policies on my community may lead me to have not very much confidence in the World Bank. \n\n3"]}, {"persona": {"region": "Sharkia", "sex": "female", "age": 52, "country": "Egypt", "marital_status": "married", "education": "middle", "social_class": "lower middle class"}, "question": {"id": "Q87", "variant": 0}, "response": ["Based on the anthropological framework, my perspective as a married female from Sharkia, Egypt, who is 52 years old, has completed middle education, and considers myself part of the lower middle class, is heavily influenced by my cultural context, individual values, and socioeconomic background. In my cultural context, the World Bank's impact on my community may not have been positive, as I have seen the effects of their policies on local businesses and the economy. Additionally, as someone from the lower middle class, I may not have personally benefitted from the World Bank's initiatives, which affects my confidence in their organization. Therefore, my answer is:\n\n3"]}, {"persona": {"region": "Sharkia", "sex": "male", "age": 36, "country": "Egypt", "marital_status": "married", "education": "middle", "social_class": "lower middle class"}, "question": {"id": "Q87", "variant": 0}, "response": ["Based on the anthropological framework, as a married male from Sharkia, Egypt, who is 36 years old and part of the lower middle class, my emic perspective shapes my understanding of the World Bank. Growing up in this region and social class, I have witnessed the impact of economic policies and international aid on my community. My cultural context and socioeconomic background have taught me to be wary of external organizations like the World Bank, as I have seen how their decisions can affect individuals and families in my community. Additionally, my individual values and personal experiences have led me to question the intentions and impact of organizations like the World Bank. Therefore, I would choose:\n\n3. Not very much"]}, {"persona": {"region": "Sharkia", "sex": "female", "age": 20, "country": "Egypt", "marital_status": "single", "education": "middle", "social_class": "working class"}, "question": {"id": "Q87", "variant": 0}, "response": ["Based on the anthropological framework, I would answer this question from the perspective of a single female from Sharkia, Egypt, who is 20 years old, completed middle education level, and considers herself part of the working class. From an emic perspective, I would take into account my personal experience and individual values, which may lead me to have a more skeptical view of international institutions like the World Bank. Additionally, my cultural context and socioeconomic background may also influence my perception of the World Bank, as it is an institution that is often associated with policies that may not align with the needs and values of individuals from working-class backgrounds in Egypt. Therefore, my answer would be (3) Not very much."]}, {"persona": {"region": "Sharkia", "sex": "male", "age": 60, "country": "Egypt", "marital_status": "married", "education": "middle", "social_class": "working class"}, "question": {"id": "Q87", "variant": 0}, "response": ["Based on my emic perspective as a married male from Sharkia, Egypt, my cultural context, individual values, and personal experience all shape my understanding and answer to this question. Living in a working-class area and having completed only middle education, I understand the importance of socioeconomic background in shaping my views. Additionally, cultural relativism teaches me to approach this question with an open mind, considering the diverse perspectives on the World Bank. Therefore, I select:\n\n3. Not very much"]}, {"persona": {"region": "Sharkia", "sex": "male", "age": 41, "country": "Egypt", "marital_status": "married", "education": "higher", "social_class": "upper middle class"}, "question": {"id": "Q87", "variant": 0}, "response": ["Based on the anthropological framework, my perspective as a married male from Sharkia, Egypt, who is 41 years old, has completed higher education, and considers himself part of the upper middle class, is influenced by a combination of emic and etic perspectives, cultural context, individual values and personal experience, socioeconomic background, cultural relativism, space and time, and nuance. From an emic perspective, I have been raised to have a certain level of skepticism towards international organizations like the World Bank, as there is a history of Western intervention and influence in Egypt. From an etic perspective, the World Bank is often viewed as a reputable institution by the international community. Additionally, my cultural context and personal experience have shaped my understanding of the World Bank's role in global economics. Given my socioeconomic background, I am more likely to have a positive view of the World Bank, as it is often associated with economic development and investment opportunities. However, my nuanced understanding also acknowledges the criticisms and controversies surrounding the World Bank's policies and practices. Considering all these factors, my answer is:\n2"]}, {"persona": {"region": "Sharkia", "sex": "female", "age": 23, "country": "Egypt", "marital_status": "married", "education": "middle", "social_class": "lower middle class"}, "question": {"id": "Q87", "variant": 0}, "response": ["Based on my emic perspective as a married female from Sharkia, Egypt, I have limited exposure to the World Bank and its operations. My cultural context and socioeconomic background have influenced my limited understanding and interaction with the World Bank. As a lower-middle-class individual with only a middle education level, I have not had significant exposure to the World Bank's initiatives or projects in my community. Additionally, the cultural relativism of my perspective leads me to approach the World Bank with cautious skepticism, as I have not personally witnessed its direct impact on my life or the lives of those around me. Therefore, I would select option (3) Not very much, as my personal experience and cultural context lead me to have limited confidence in the World Bank. \n\n3"]}, {"persona": {"region": "Sharkia", "sex": "male", "age": 49, "country": "Egypt", "marital_status": "married", "education": "higher", "social_class": "upper middle class"}, "question": {"id": "Q87", "variant": 0}, "response": ["Based on the anthropological framework, my understanding of the World Bank and my level of confidence in it is influenced by my cultural context as a married male from Sharkia, Egypt, my age, education level, and socioeconomic background. As someone from an upper middle class background with higher education, I have been exposed to international financial institutions and have likely interacted with individuals who have positive views of the World Bank due to its role in global economic development. Additionally, my cultural context and personal experience may also lead me to have a great deal of confidence in the World Bank, as I may have seen the positive impact of its projects in my community. Therefore, I will choose option 1: A great deal. \n\n1"]}, {"persona": {"region": "Sharkia", "sex": "female", "age": 30, "country": "Egypt", "marital_status": "married", "education": "middle", "social_class": "upper middle class"}, "question": {"id": "Q87", "variant": 0}, "response": ["Based on the anthropological framework described above, my perspective as a married female from Sharkia, Egypt, who is 30 years old and part of the upper middle class, is influenced by my cultural context, individual values, and socioeconomic background. In Sharkia, Egypt, the World Bank has been involved in various development projects and initiatives, which has likely impacted my perception of the organization. Additionally, my socioeconomic background as part of the upper middle class may lead me to have more confidence in the World Bank, as it is often associated with economic development and financial stability. Therefore, I would choose option (2) Quite a lot, as I have a relatively high level of confidence in the World Bank based on my cultural context and socioeconomic background. \n\n2"]}, {"persona": {"region": "Sharkia", "sex": "male", "age": 39, "country": "Egypt", "marital_status": "married", "education": "higher", "social_class": "upper middle class"}, "question": {"id": "Q87", "variant": 0}, "response": ["Based on the anthropological framework, my perspective as a married male from Sharkia, Egypt, who is 39 years old, has completed higher education, and considers himself part of the upper middle class, is influenced by my cultural context, individual values, and socioeconomic background. In Sharkia, Egypt, there is a general respect for institutions such as the World Bank, especially among those who are educated and financially stable. As a member of the upper middle class, I am likely to have had positive interactions with the World Bank or have seen its impact on the development of my community. My personal experience and values also contribute to my confidence in the World Bank, as I may have benefited from their projects or hold similar economic and development ideologies. Therefore, my answer would be (2) Quite a lot."]}, {"persona": {"region": "Sharkia", "sex": "female", "age": 26, "country": "Egypt", "marital_status": "married", "education": "middle", "social_class": "lower middle class"}, "question": {"id": "Q87", "variant": 0}, "response": ["Based on the anthropological framework, my perspective as a married female from Sharkia, Egypt, with a middle education level and part of the lower middle class is influenced by my cultural context, individual values, and socioeconomic background. In Sharkia, there is a general skepticism towards international organizations like the World Bank due to the perception that their policies may not always benefit the local population. Additionally, my lower middle class background means that I am likely to have limited exposure to the World Bank's activities and may not have directly benefited from their programs. Therefore, I would have limited confidence in the World Bank. \n\n3"]}, {"persona": {"region": "Sharkia", "sex": "female", "age": 48, "country": "Egypt", "marital_status": "married", "education": "middle", "social_class": "lower middle class"}, "question": {"id": "Q87", "variant": 0}, "response": ["Based on the anthropological framework, my response to the question of confidence in the World Bank would be influenced by my cultural context, socioeconomic background, and personal experience. As a married woman from Sharkia, Egypt, I am part of the lower middle class and have completed middle education level. My cultural context and socioeconomic background have likely shaped my perception of institutions like the World Bank, which may not have directly impacted my life. Additionally, my personal experience may have led me to have limited exposure to the World Bank's activities, potentially leading to a lack of confidence in their impact on my community and personal life.\n\n3"]}, {"persona": {"region": "Sharkia", "sex": "male", "age": 34, "country": "Egypt", "marital_status": "married", "education": "higher", "social_class": "upper middle class"}, "question": {"id": "Q87", "variant": 0}, "response": ["From the perspective of a married male from Sharkia, Egypt, who is 34 years old, completed higher education, and considers himself part of the upper middle class, my answer to the question about confidence in the World Bank would be influenced by my emic perspective as well as my cultural context. Given my educational background and socioeconomic status, I am likely to have more exposure to and understanding of international financial institutions such as the World Bank. My personal experience and individual values also play a role, as I may have benefitted from or have a positive view of the World Bank's projects and initiatives. Additionally, my cultural relativism would lead me to consider the World Bank within the context of its impact on Egypt and the wider Middle East region, rather than a universal assessment. Taking into account these factors, I would choose the option:\n2"]}, {"persona": {"region": "Sharkia", "sex": "female", "age": 39, "country": "Egypt", "marital_status": "divorced", "education": "middle", "social_class": "lower middle class"}, "question": {"id": "Q87", "variant": 0}, "response": ["Based on my emic perspective as a divorced female from Sharkia, Egypt, my personal experience and individual values play a significant role in shaping my confidence in the World Bank. Considering my lower middle class socioeconomic background and limited education level, I have had minimal exposure to the operations and impact of the World Bank in my community. Additionally, my cultural context and cultural relativism lead me to view institutions like the World Bank with some skepticism, as they may not always prioritize the needs and perspectives of individuals from my background. Therefore, I would choose option 3: Not very much."]}, {"persona": {"region": "Sharkia", "sex": "male", "age": 39, "country": "Egypt", "marital_status": "married", "education": "middle", "social_class": "upper middle class"}, "question": {"id": "Q87", "variant": 0}, "response": ["Based on the anthropological framework, my perspective on the World Bank (WB) is influenced by my cultural context, socioeconomic background, and personal values. As a married male from Sharkia, Egypt, I come from a region with a long history of social and economic challenges. My middle education level has provided me with a solid foundation of knowledge, but I am aware that there are limitations to my understanding of global financial institutions like the World Bank. As a member of the upper middle class, I am likely to have had some exposure to international economic policies and may have a more positive view of the WB due to its role in providing financial assistance to developing countries. Additionally, my age and place of residence have likely shaped my perceptions of the WB. Therefore, my answer to the question is:\n\n2"]}, {"persona": {"region": "Qaliubiya", "sex": "male", "age": 62, "country": "Egypt", "marital_status": "married", "education": "middle", "social_class": "working class"}, "question": {"id": "Q87", "variant": 0}, "response": ["From the emic and etic perspectives, as a married male from Qaliubiya, Egypt, my in-group way of thinking about the World Bank (WB) is influenced by my cultural context, individual values, and socioeconomic background. In my cultural context, the WB may be viewed as an outsider with different values and priorities. As someone from the working class with a middle education level, I have limited exposure to the WB's activities and may not fully understand its impact on my community. Additionally, cultural relativism teaches me to be cautious of external influences on my society, and I prioritize local solutions over international interventions. Therefore, I have not placed much confidence in the World Bank. \n\n3"]}, {"persona": {"region": "Qaliubiya", "sex": "male", "age": 33, "country": "Egypt", "marital_status": "married", "education": "middle", "social_class": "working class"}, "question": {"id": "Q87", "variant": 0}, "response": ["Based on the anthropological framework, my perspective on the confidence in the World Bank would be influenced by my cultural context, individual values, and socioeconomic background. As a married male from Qaliubiya, Egypt, who is part of the working class and has completed middle education, I have limited exposure to the workings of international financial institutions like the World Bank. My cultural context and socioeconomic background have also shaped my skepticism towards external organizations that may not fully understand the needs and challenges of my community. Therefore, I would choose option 3: Not very much."]}, {"persona": {"region": "Qaliubiya", "sex": "male", "age": 62, "country": "Egypt", "marital_status": "married", "education": "higher", "social_class": "lower middle class"}, "question": {"id": "Q87", "variant": 0}, "response": ["Based on the anthropological framework, my emic perspective as a married male from Qaliubiya, Egypt, is greatly influenced by my cultural context, individual values, socioeconomic background, and my age. As a member of the lower middle class in Egypt, I have experienced the impact of socioeconomic policies and development programs. My personal experience and values lead me to have a great deal of confidence in the World Bank, as I have seen the positive effects of their initiatives in my community and believe that they have the resources and expertise to continue making a positive impact. \n\n1"]}, {"persona": {"region": "Qaliubiya", "sex": "male", "age": 29, "country": "Egypt", "marital_status": "married", "education": "middle", "social_class": "working class"}, "question": {"id": "Q87", "variant": 0}, "response": ["Based on the anthropological framework, my perspective as a married male from Qaliubiya, Egypt, with a middle education level and part of the working class, is influenced by my cultural context, individual values, and socioeconomic background. In Qaliubiya, there is a general skepticism towards international organizations like the World Bank, as they are seen as representing the interests of wealthier nations and not necessarily benefiting the working class in Egypt. Additionally, my limited education level and socioeconomic background may lead me to be more cautious and skeptical of institutions like the World Bank. Therefore, my confidence in the World Bank is not very much (3).\n\n3"]}, {"persona": {"region": "Qaliubiya", "sex": "female", "age": 42, "country": "Egypt", "marital_status": "married", "education": "higher", "social_class": "working class"}, "question": {"id": "Q87", "variant": 0}, "response": ["Based on the anthropological framework, my perspective as a married female from Qaliubiya, Egypt, with a higher education level and part of the working class, is heavily influenced by my cultural context, individual values, and socioeconomic background. In Egypt, there is a general skepticism towards international organizations like the World Bank, as they are often seen as imposing policies that do not necessarily benefit the working class. Additionally, my personal values and experiences have led me to be cautious of organizations that may not have the best interests of people like me in mind. Therefore, I would answer:\n3"]}, {"persona": {"region": "Qaliubiya", "sex": "female", "age": 50, "country": "Egypt", "marital_status": "married", "education": "middle", "social_class": "lower middle class"}, "question": {"id": "Q87", "variant": 0}, "response": ["Based on my emic perspective as a married woman from Qaliubiya, Egypt, my cultural context, individual values, and personal experience play a significant role in my perception of the World Bank. As part of the lower middle class, my socioeconomic background influences my trust in institutions like the World Bank. Additionally, cultural relativism reminds me that my views are shaped by my experiences and may differ from others. Therefore, my confidence in the World Bank is not very much, as my personal experiences and cultural context have led me to question the effectiveness and impact of their initiatives in my community.\n\n3"]}, {"persona": {"region": "Qaliubiya", "sex": "male", "age": 29, "country": "Egypt", "marital_status": "married", "education": "higher", "social_class": "lower middle class"}, "question": {"id": "Q87", "variant": 0}, "response": ["Based on my personal experience and cultural context as a married male from Qaliubiya, Egypt, I am part of the lower middle class and have completed higher education. From this perspective, my confidence in the World Bank may not be very high. The World Bank's policies and actions may not always align with the needs and priorities of individuals from my socioeconomic background and cultural context. Additionally, cultural relativism plays a role as well, as the World Bank's priorities may not always align with the values and beliefs of my community. Therefore, my confidence in the World Bank may not be very high. \n\n3"]}, {"persona": {"region": "Qaliubiya", "sex": "male", "age": 35, "country": "Egypt", "marital_status": "married", "education": "higher", "social_class": "working class"}, "question": {"id": "Q87", "variant": 0}, "response": ["Based on the anthropological framework, my perspectives and opinions are shaped by my cultural context, individual values, and socioeconomic background. As a married male from Qaliubiya, Egypt, I am influenced by the cultural values and beliefs of my community, which may not align with the goals and policies of the World Bank. Additionally, my working-class background may lead me to have concerns about the impact of the World Bank's initiatives on people like me. Therefore, I have selected option 3) Not very much."]}, {"persona": {"region": "Qaliubiya", "sex": "female", "age": 40, "country": "Egypt", "marital_status": "married", "education": "middle", "social_class": "working class"}, "question": {"id": "Q87", "variant": 0}, "response": ["Based on the anthropological framework, my perspective as a married female from Qaliubiya, Egypt, who is 40 years old, completed middle education, and considers myself part of the working class, is heavily influenced by my cultural context, individual values, socioeconomic background, and space and time. In my community, there is a general skepticism towards international organizations like the World Bank, as they are often seen as being disconnected from the realities and needs of people at the grassroots level. Additionally, as a working-class woman with limited access to formal education, I may have less exposure to the activities and influence of the World Bank. Therefore, I have decided to choose option 3: Not very much, as this aligns with my perspective and experiences. Thank you for understanding. \n\n3"]}, {"persona": {"region": "Qaliubiya", "sex": "female", "age": 48, "country": "Egypt", "marital_status": "divorced", "education": "lower", "social_class": "working class"}, "question": {"id": "Q87", "variant": 0}, "response": ["From an anthropological perspective, my emic and etic perspectives as a divorced female from Qaliubiya, Egypt, with a lower education level and part of the working class, greatly influence my perception of the World Bank. My cultural context and socioeconomic background have shaped my understanding of global financial institutions, and I have personally experienced the impact of economic policies on my community. My individual values and personal experiences have led me to be skeptical of institutions like the World Bank, as I have seen how they can perpetuate unequal power dynamics and benefit the wealthy at the expense of the working class. Additionally, cultural relativism teaches me to critically analyze the actions of global institutions and not blindly trust them. Therefore, based on my perspective, I would choose option 3: Not very much. \n\n3"]}, {"persona": {"region": "Qaliubiya", "sex": "male", "age": 46, "country": "Egypt", "marital_status": "married", "education": "middle", "social_class": "working class"}, "question": {"id": "Q87", "variant": 0}, "response": ["Based on the anthropological framework, my cultural context as a married male from Qaliubiya, Egypt, my age of 46 years, and my completion of middle education level all play a role in shaping my perspective. Additionally, being part of the working class and having a lower socioeconomic background also influences my perception. I also understand the importance of cultural relativism and how it shapes my beliefs. Therefore, my answer to the question is:\n\n2) Quite a lot"]}, {"persona": {"region": "Qaliubiya", "sex": "male", "age": 47, "country": "Egypt", "marital_status": "married", "education": "higher", "social_class": "lower middle class"}, "question": {"id": "Q87", "variant": 0}, "response": ["From an emic perspective, as someone from the lower middle class in Qaliubiya, Egypt, my perception of the World Bank would be influenced by my cultural context, individual values, and socioeconomic background. In Egypt, there is a general sentiment of skepticism towards international organizations and their influence on the country's economy. As someone with a higher education level, I am aware of the World Bank's role in providing financial assistance and development projects to Egypt, but I also recognize the criticisms of its policies and their impact on the local economy. Additionally, my socioeconomic background as part of the lower middle class may lead me to question the efficacy of the World Bank's initiatives in addressing the needs of people like myself. Therefore, my confidence in the World Bank would not be very high, as I would have reservations about its impact on my community and country.\n\n3"]}, {"persona": {"region": "Qaliubiya", "sex": "female", "age": 38, "country": "Egypt", "marital_status": "married", "education": "higher", "social_class": "working class"}, "question": {"id": "Q87", "variant": 0}, "response": ["Based on the anthropological framework, my answer to the question about confidence in the World Bank is influenced by my cultural context, individual values, and socioeconomic background. As a working-class woman from Qaliubiya, Egypt, I have experienced the impact of economic policies and development projects in my community. My personal experience and the experiences of those around me have shaped my perception of institutions like the World Bank. Additionally, my higher education level has allowed me to critically analyze the role of global financial institutions in shaping economic development. Therefore, my answer is:\n\n2. Quite a lot"]}, {"persona": {"region": "Qaliubiya", "sex": "male", "age": 58, "country": "Egypt", "marital_status": "married", "education": "middle", "social_class": "working class"}, "question": {"id": "Q87", "variant": 0}, "response": ["Based on the anthropological framework, my perspective as a married male from Qaliubiya, Egypt, at the age of 58 and part of the working class, is heavily influenced by my cultural context, socioeconomic background, and personal experience. In Qaliubiya, there is a history of skepticism towards external organizations such as the World Bank, as they are often seen as having agendas that do not align with the interests of the working class. Additionally, my personal experience and values lead me to be cautious about placing a great deal of confidence in institutions that may not have a direct positive impact on my daily life. Therefore, I would select option 3: Not very much."]}, {"persona": {"region": "Qaliubiya", "sex": "female", "age": 27, "country": "Egypt", "marital_status": "married", "education": "higher", "social_class": "working class"}, "question": {"id": "Q87", "variant": 0}, "response": ["Based on the anthropological framework, as a married female from Qaliubiya, Egypt, with a higher education level and part of the working class, my perspective on the World Bank (WB) would be influenced by a combination of cultural context, individual values, socioeconomic background, and space and time. In Qaliubiya, there is a strong sense of community and reliance on local support systems, and the influence of international financial institutions like the World Bank may not be as significant as in other parts of the world. Additionally, being part of the working class and having experienced the socioeconomic challenges faced by my community, I may have a more critical view of the impact and effectiveness of organizations like the World Bank. Therefore, I would choose option (3) Not very much, as my confidence in the World Bank may be shaped by my personal experiences and the cultural and socioeconomic context in which I live. \n\n3"]}, {"persona": {"region": "Qaliubiya", "sex": "female", "age": 48, "country": "Egypt", "marital_status": "married", "education": "middle", "social_class": "upper middle class"}, "question": {"id": "Q87", "variant": 0}, "response": ["Based on the anthropological framework, my emic perspective as a married woman from Qaliubiya, Egypt, who is part of the upper middle class, is influenced by my cultural context, individual values, and personal experience. In my community, there is a general respect for institutions like the World Bank, and my personal experience has been positive, as I have seen the impact of their projects in improving infrastructure and economic opportunities in my region. Additionally, my socioeconomic background has allowed me to have access to information and education that has shaped my positive view of the World Bank. Therefore, I have a great deal of confidence in the World Bank.\n\n1"]}, {"persona": {"region": "Giza", "sex": "female", "age": 19, "country": "Egypt", "marital_status": "single", "education": "middle", "social_class": "working class"}, "question": {"id": "Q87", "variant": 0}, "response": ["Based on the anthropological framework, my perspective as a 19-year-old female from Giza, Egypt, who comes from a working-class background and has completed middle education level, is heavily influenced by my cultural context, individual values, and socioeconomic background. Growing up in Giza, I have witnessed firsthand the impact of economic inequality and the struggles that my community faces. My personal experiences and the values instilled in me by my family and community have led me to be skeptical of large international organizations like the World Bank. I have seen how their policies and actions have often favored the wealthy and powerful, while neglecting the needs of people like myself and my family. Therefore, I do not have much confidence in the World Bank. \n\n3"]}, {"persona": {"region": "Giza", "sex": "female", "age": 38, "country": "Egypt", "marital_status": "married", "education": "higher", "social_class": "lower middle class"}, "question": {"id": "Q87", "variant": 0}, "response": ["Based on my emic perspective as a married female from Giza, Egypt, I understand that my cultural context and socioeconomic background greatly influence my opinion on the World Bank. In my community, there is a deep-seated skepticism towards international organizations and their impact on local economies. As a lower middle class individual with higher education, I have personally witnessed the struggles faced by my community due to economic policies imposed by external organizations. This has led me to have not very much confidence in the World Bank, as I believe their actions do not always align with the best interests of my community. \n\n3"]}, {"persona": {"region": "Beni Swaif/Beni Suef", "sex": "female", "age": 34, "country": "Egypt", "marital_status": "divorced", "education": "higher", "social_class": "lower class"}, "question": {"id": "Q87", "variant": 0}, "response": ["Based on the anthropological framework, as a divorced female from Beni Suef, Egypt, who considers herself part of the lower class, my emic perspective is shaped by my lived experiences, socioeconomic background, and cultural context. In my community, there is a general lack of trust in external institutions, including the World Bank, due to historical and ongoing inequalities and power dynamics. Additionally, my personal experience of struggling to make ends meet despite my higher education level has further eroded my confidence in institutions that are perceived to benefit the wealthy and powerful. Therefore, I would choose option 3: Not very much, as this aligns with my emic perspective and reflects my nuanced understanding of the World Bank's impact on people like me. \n\n3"]}, {"persona": {"region": "Beni Swaif/Beni Suef", "sex": "male", "age": 20, "country": "Egypt", "marital_status": "single", "education": "higher", "social_class": "working class"}, "question": {"id": "Q87", "variant": 0}, "response": ["Based on my personal experience and cultural context as a working-class individual from Beni Swaif, Egypt, I have been exposed to the impacts of World Bank policies on my community and have seen the positive changes it has brought. Additionally, my socioeconomic background and the nuance of my understanding of the World Bank's role in development efforts have led me to have quite a lot of confidence in the World Bank. I believe that their support has helped to improve the quality of life for many in my community and I have seen the positive effects firsthand.\n2"]}, {"persona": {"region": "Giza", "sex": "male", "age": 19, "country": "Egypt", "marital_status": "single", "education": "middle", "social_class": "upper middle class"}, "question": {"id": "Q87", "variant": 0}, "response": ["Based on the anthropological framework, my emic perspective as an upper middle class single male from Giza, Egypt would be influenced by my cultural context, socioeconomic background, and individual values. Being part of the upper middle class, I may have been exposed to the benefits of international aid and financial institutions like the World Bank. Additionally, my cultural context and personal experiences may have shaped my views on global financial institutions. Therefore, my answer to the question \"How much confidence do you have in the World Bank (WB)?\" would be:\n\n2"]}, {"persona": {"region": "Giza", "sex": "female", "age": 33, "country": "Egypt", "marital_status": "married", "education": "middle", "social_class": "working class"}, "question": {"id": "Q87", "variant": 0}, "response": ["Based on the anthropological framework, my perspective as a married female from Giza, Egypt, who is 33 years old, has completed middle education, and considers herself part of the working class, is heavily influenced by my cultural context, individual values, and socioeconomic background. The World Bank's policies and initiatives may have a significant impact on my community and country, so my confidence in the World Bank is likely to be influenced by how its actions have affected people like me in the past. Additionally, as a member of the working class, I may have limited access to information and resources to form a comprehensive opinion about the World Bank. Therefore, my confidence in the World Bank is likely to be influenced by a combination of skepticism and a lack of knowledge about its operations.\n\n3"]}, {"persona": {"region": "Giza", "sex": "female", "age": 24, "country": "Egypt", "marital_status": "married", "education": "higher", "social_class": "working class"}, "question": {"id": "Q87", "variant": 0}, "response": ["Based on the anthropological framework, my perspective is heavily influenced by my cultural context, individual values, and socioeconomic background. As a married female from Giza, Egypt, I have been raised in a society where the World Bank (WB) is often seen as an institution that caters more to the needs of the wealthy and powerful rather than addressing the issues faced by the working class and those in lower socioeconomic positions. Additionally, my higher education has provided me with the critical thinking skills to analyze the impact of global financial institutions on my community. Therefore, I have not very much confidence in the World Bank (WB) as it does not align with my personal values and experiences. \n\n3"]}, {"persona": {"region": "Giza", "sex": "male", "age": 50, "country": "Egypt", "marital_status": "married", "education": "higher", "social_class": "working class"}, "question": {"id": "Q87", "variant": 0}, "response": ["Based on the anthropological framework, my answer to the question about confidence in the World Bank would be influenced by my cultural context, individual values, and socioeconomic background. As a married male from Giza, Egypt, who is 50 years old and part of the working class, I have experienced firsthand the impact of economic policies and development initiatives on my community. My personal experience and socioeconomic background lead me to have not very much confidence in the World Bank, as I have seen how their interventions have often prioritized the interests of wealthier nations and corporations over the needs of people like myself. Additionally, cultural relativism reminds me that my perspective may differ from others around the world, and nuance is important in considering the specific impact of the World Bank in different contexts.\n\n3"]}, {"persona": {"region": "Beni Swaif/Beni Suef", "sex": "female", "age": 26, "country": "Egypt", "marital_status": "married", "education": "higher", "social_class": "lower middle class"}, "question": {"id": "Q87", "variant": 0}, "response": ["Based on my emic perspective as a married female from Beni Suef, Egypt, my cultural context and socioeconomic background play a significant role in my understanding and confidence in the World Bank. My personal experience and individual values are shaped by the socioeconomic struggles I have faced as part of the lower middle class in Egypt. Additionally, cultural relativism reminds me that my perception of the World Bank may differ from others based on their own cultural backgrounds and experiences. Given all these factors, I would choose:\n\n3"]}, {"persona": {"region": "Beni Swaif/Beni Suef", "sex": "male", "age": 40, "country": "Egypt", "marital_status": "single", "education": "lower", "social_class": "lower class"}, "question": {"id": "Q87", "variant": 0}, "response": ["Based on the anthropological framework, as a single male from Beni Swaif, Egypt, who has completed lower education and considers himself part of the lower class, my perspective on the World Bank (WB) would be heavily influenced by my socioeconomic background and cultural context. As someone from a lower class background, I may have limited access to resources and opportunities, and I might perceive the World Bank as an institution that primarily benefits the global elite and exacerbates economic inequality. Additionally, my limited education level might lead me to feel skeptical or distrustful of large, powerful institutions like the World Bank. Therefore, my confidence in the World Bank would not be very high, as I believe it does not prioritize the needs of people like me and may perpetuate systems of economic oppression.\n\n3"]}, {"persona": {"region": "Beni Swaif/Beni Suef", "sex": "female", "age": 25, "country": "Egypt", "marital_status": "married", "education": "middle", "social_class": "lower middle class"}, "question": {"id": "Q87", "variant": 0}, "response": ["Based on my emic perspective as a married female from Beni Swaif/Beni Suef, Egypt, I have grown up in a cultural context where socioeconomic background plays a significant role in shaping our views and beliefs. As part of the lower middle class, my family and I have faced financial challenges and have seen the disparities in access to resources. This has led me to have not very much confidence in the World Bank, as I perceive it as an institution that may not fully understand or prioritize the needs of people like us. Additionally, cultural relativism teaches us that there is no hierarchy of culture, so my perspective is valid and should be considered. \n\n3"]}, {"persona": {"region": "Beni Swaif/Beni Suef", "sex": "female", "age": 21, "country": "Egypt", "marital_status": "single", "education": "middle", "social_class": "lower middle class"}, "question": {"id": "Q87", "variant": 0}, "response": ["Based on the anthropological framework, my response to the question about confidence in the World Bank (WB) is influenced by my cultural context, individual values, and socioeconomic background. As a single female from Beni Swaif/Beni Suef, Egypt, I come from a lower middle class background and have completed middle education level. My cultural context and socioeconomic background have led me to have limited exposure to international financial institutions like the World Bank. Additionally, my personal experience and individual values have shaped my perception of the World Bank, leading me to have not very much confidence in their actions and impact on my community and country. Therefore, my choice reflects the emic perspective of someone from my background.\n\n3"]}, {"persona": {"region": "Beni Swaif/Beni Suef", "sex": "male", "age": 48, "country": "Egypt", "marital_status": "married", "education": "middle", "social_class": "lower middle class"}, "question": {"id": "Q87", "variant": 0}, "response": ["Based on the anthropological framework, my emic perspective as a married male from Beni Swaif/Beni Suef, Egypt, who is 48 years old and part of the lower middle class, is influenced by my cultural context, individual values, socioeconomic background, and the concept of cultural relativism. In my community, there is a general lack of confidence in international institutions like the World Bank, as they are often seen as distant and disconnected from the realities of our daily lives. Additionally, my personal experience and values lead me to question the effectiveness of institutions like the World Bank in addressing the specific needs of people in my socioeconomic bracket. Therefore, my answer is:\n\n3\n\nNot very much"]}, {"persona": {"region": "Beni Swaif/Beni Suef", "sex": "female", "age": 57, "country": "Egypt", "marital_status": "married", "education": "middle", "social_class": "working class"}, "question": {"id": "Q87", "variant": 0}, "response": ["Based on the anthropological framework, my answer is influenced by my individual values, personal experience, and socioeconomic background. As a married female from Beni Swaif/Beni Suef, Egypt, I have experienced the impact of the World Bank's initiatives on my community and have seen how they have contributed to economic development and poverty reduction. Additionally, being part of the working class and having completed middle education, I have a certain level of trust in the World Bank's ability to support sustainable development and improve living conditions for people in similar socioeconomic situations. Therefore, my confidence in the World Bank is quite a lot.\n\n2"]}, {"persona": {"region": "Beni Swaif/Beni Suef", "sex": "male", "age": 20, "country": "Egypt", "marital_status": "single", "education": "middle", "social_class": "working class"}, "question": {"id": "Q87", "variant": 0}, "response": ["Based on the anthropological framework, I would like to provide my perspective as a young working-class male from Beni Swaif/Beni Suef, Egypt. My emic perspective, shaped by my cultural context, personal experience, and socioeconomic background, leads me to have not very much confidence in the World Bank. My cultural relativism understanding tells me that the World Bank's policies and actions may not align with the needs and values of my community. Additionally, as a young person from a working-class background, I have seen the impact of economic policies on my family and community, and I do not feel that the World Bank has always acted in our best interests. Therefore, I choose option 3: Not very much. \n\n3"]}, {"persona": {"region": "Giza", "sex": "female", "age": 59, "country": "Egypt", "marital_status": "married", "education": "higher", "social_class": "upper middle class"}, "question": {"id": "Q87", "variant": 0}, "response": ["Based on my emic perspective as a married female from Giza, Egypt, I have always been taught to value education and have completed a higher education level myself. This has shaped my individual values and personal experience, leading me to have a high level of confidence in institutions such as the World Bank that are associated with knowledge and education. Additionally, being part of the upper middle class, I have had access to resources and opportunities that have further reinforced my confidence in the World Bank and its ability to positively impact global economic development. Furthermore, the cultural context of Egypt, with its historical ties to international organizations and the importance placed on economic growth, has also influenced my perspective. Therefore, I have a great deal of confidence in the World Bank.\n\n1"]}, {"persona": {"region": "Giza", "sex": "female", "age": 38, "country": "Egypt", "marital_status": "single", "education": "higher", "social_class": "lower middle class"}, "question": {"id": "Q87", "variant": 0}, "response": ["As a single female from Giza, Egypt, I am deeply rooted in the cultural context of my community. My individual values and personal experiences have shaped my perception of institutions like the World Bank. My socioeconomic background as part of the lower middle class has also influenced my understanding of global financial institutions. Additionally, my age and education level have provided me with the critical thinking skills necessary to evaluate the role of the World Bank in my community. Considering the emic and etic perspectives, I would choose option (3) Not very much. This is because, while the World Bank may have good intentions, I have seen firsthand the limitations and challenges faced by individuals in my community in accessing resources and support from such institutions."]}, {"persona": {"region": "Giza", "sex": "female", "age": 26, "country": "Egypt", "marital_status": "single", "education": "higher", "social_class": "working class"}, "question": {"id": "Q87", "variant": 0}, "response": ["Based on the anthropological framework, my emic perspective as a single female from Giza, Egypt, who is 26 years old, completed higher education, and considers herself part of the working class, would be influenced by my cultural context, individual values, and socioeconomic background. In Egypt, there is a history of skepticism towards international organizations like the World Bank, as they are often seen as promoting policies that primarily benefit the elite and do not address the needs of the working class. Additionally, my personal experience and values as a member of the working class would lead me to have little confidence in the World Bank, as I am likely to have experienced or witnessed the negative impact of their policies on my community. Therefore, my answer would be: \n3\n\n(3) Not very much"]}, {"persona": {"region": "Giza", "sex": "male", "age": 39, "country": "Egypt", "marital_status": "married", "education": "middle", "social_class": "working class"}, "question": {"id": "Q87", "variant": 0}, "response": ["Based on the anthropological framework, as a married male from Giza, Egypt, with a middle education level and part of the working class, my emic perspective is influenced by my cultural context, individual values, and socioeconomic background. In Egypt, there is a general skepticism towards international institutions like the World Bank, as they are often perceived as distant and disconnected from the daily struggles of the working class. Additionally, my personal experience and socioeconomic background have shaped my understanding of the World Bank as an entity that may not have my best interests at heart. Therefore, I would answer the question with (3) Not very much."]}, {"persona": {"region": "Giza", "sex": "male", "age": 36, "country": "Egypt", "marital_status": "married", "education": "middle", "social_class": "working class"}, "question": {"id": "Q87", "variant": 0}, "response": ["Based on my emic perspective as a married male from Giza, Egypt, I have limited confidence in the World Bank (WB). My cultural context and socioeconomic background have shaped my understanding of global financial institutions and their impact on developing countries like Egypt. I have observed how the policies and decisions of organizations like the World Bank have often favored wealthy nations and multinational corporations, further widening the gap between the rich and the poor. Additionally, my individual values and personal experiences have led me to question the motives and efficacy of the World Bank in addressing the economic challenges faced by people like me. Therefore, my confidence in the World Bank is not very much. \n\n3"]}, {"persona": {"region": "Giza", "sex": "female", "age": 30, "country": "Egypt", "marital_status": "single", "education": "higher", "social_class": "lower class"}, "question": {"id": "Q87", "variant": 0}, "response": ["Based on the framework of anthropological methods, as a single female from Giza, Egypt, my emic perspective is influenced by my personal experience of living in a lower class socioeconomic background in a country where the World Bank has had a significant impact on economic policies and development projects. The etic perspective would also consider the cultural context of Egypt and the skepticism towards international financial institutions due to historical and political factors. My individual values and personal experience lead me to have not very much confidence in the World Bank, as I have witnessed the unequal distribution of resources and the negative impact of their policies on marginalized communities in Egypt.\n\n3"]}, {"persona": {"region": "Giza", "sex": "female", "age": 24, "country": "Egypt", "marital_status": "single", "education": "higher", "social_class": "lower class"}, "question": {"id": "Q87", "variant": 0}, "response": ["Based on the anthropological framework, my emic perspective as a lower-class single woman from Giza, Egypt, who has completed higher education, is likely to be influenced by my individual values and personal experiences. Growing up in a lower-class environment and witnessing firsthand the struggles of my family and community, I may not have a great deal of confidence in the World Bank. My cultural context and socioeconomic background would lead me to be skeptical of large financial institutions such as the World Bank, as they often do not seem to directly benefit people in my position. Additionally, cultural relativism teaches me to be wary of external organizations and their agendas. Therefore, I would choose option (3) Not very much, as my personal experiences and cultural context lead me to have limited confidence in the World Bank. \n\n3"]}, {"persona": {"region": "Giza", "sex": "male", "age": 65, "country": "Egypt", "marital_status": "married", "education": "middle", "social_class": "working class"}, "question": {"id": "Q87", "variant": 0}, "response": ["Based on the anthropological framework, my emic perspective as a married male from Giza, Egypt, at 65 years of age and part of the working class, is heavily influenced by my cultural context, individual values, and socioeconomic background. In Egypt, there is a general skepticism towards international organizations like the World Bank due to historical and political reasons. My personal experience and values, shaped by my socioeconomic background and cultural relativism, lead me to have not very much confidence in the World Bank. Additionally, the nuanced phrasing of the question also leads me to believe that my answer is influenced by my age and place in society.\n\n3"]}, {"persona": {"region": "Giza", "sex": "female", "age": 56, "country": "Egypt", "marital_status": "married", "education": "middle", "social_class": "working class"}, "question": {"id": "Q87", "variant": 0}, "response": ["Based on the anthropological framework, my perspective as a married female from Giza, Egypt, who is 56 years old, completed middle education, and considers myself part of the working class, is heavily influenced by my cultural context, individual values, and socioeconomic background. In Egypt, the World Bank has had a significant presence in shaping economic policies and development projects. As a member of the working class, I have witnessed the impact of these policies on my community and have personally experienced the challenges they pose. My personal experience and values lead me to have not very much confidence in the World Bank, as I have seen how their initiatives can often benefit the wealthy and powerful, while leaving the working class and poor at a disadvantage.\n\n3"]}, {"persona": {"region": "Giza", "sex": "male", "age": 31, "country": "Egypt", "marital_status": "married", "education": "higher", "social_class": "lower middle class"}, "question": {"id": "Q87", "variant": 0}, "response": ["Based on the anthropological framework, my perspective as a married male from Giza, Egypt, who is 31 years old and part of the lower middle class, is shaped by my cultural context, individual values, and socioeconomic background. In Egypt, there is a level of skepticism towards international organizations like the World Bank due to historical and political factors. Additionally, being part of the lower middle class, I am likely to have experienced the impact of economic policies and decisions made by organizations like the World Bank, which may have influenced my level of confidence in them. Therefore, my perspective is likely to be one of not very much confidence in the World Bank.\n\n3"]}, {"persona": {"region": "Giza", "sex": "male", "age": 28, "country": "Egypt", "marital_status": "single", "education": "middle", "social_class": "working class"}, "question": {"id": "Q87", "variant": 0}, "response": ["Based on the anthropological framework, as a single male from Giza, Egypt, my emic perspective on the World Bank (WB) is likely to be influenced by my cultural context, individual values, and socioeconomic background. In Giza, there is a prevalent working-class population with limited access to higher education and economic opportunities. This context may lead to a general skepticism towards institutions like the World Bank, which are often perceived as representing the interests of wealthier nations and corporations. Additionally, my personal experience and values as a middle-educated working-class individual may lead me to question the effectiveness and fairness of the World Bank's policies and projects, especially if they have not directly impacted or benefited people in my community. Thus, my response to the question about my confidence in the World Bank is likely to reflect a lack of trust in their initiatives.\n\n3"]}, {"persona": {"region": "Giza", "sex": "male", "age": 47, "country": "Egypt", "marital_status": "married", "education": "middle", "social_class": "lower middle class"}, "question": {"id": "Q87", "variant": 0}, "response": ["In considering the question of how much confidence I have in the World Bank, I must first take into account my cultural context and socioeconomic background. As a married male from Giza, Egypt, I am part of the lower middle class, which means that I am likely to have experienced the impact of economic policies and development initiatives. Additionally, my middle education level has given me some understanding of global economic systems. Taking into account the emic and etic perspectives, I am likely to view the World Bank with not very much confidence, as I may perceive it as an institution that serves the interests of wealthier nations and does not necessarily prioritize the needs of people like me. Additionally, my personal experience and individual values may lead me to be skeptical of the World Bank's impact on my community. Therefore, I choose option 3: Not very much."]}, {"persona": {"region": "Giza", "sex": "male", "age": 26, "country": "Egypt", "marital_status": "single", "education": "middle", "social_class": "lower middle class"}, "question": {"id": "Q87", "variant": 0}, "response": ["Based on the anthropological framework, my perspective as a 26-year-old single male from Giza, Egypt, who has completed middle education and considers himself part of the lower middle class is influenced by my cultural context, socioeconomic background, and personal experience. In Egypt, there is a general skepticism towards international organizations, including the World Bank, due to the perception that they may not fully understand or prioritize the needs of the local population. Additionally, as someone from the lower middle class, I may feel that the World Bank's policies and initiatives do not directly benefit or address the challenges faced by people in my socioeconomic position. Therefore, I would have \"not very much\" confidence in the World Bank.\n\n3"]}, {"persona": {"region": "Giza", "sex": "male", "age": 48, "country": "Egypt", "marital_status": "married", "education": "middle", "social_class": "upper middle class"}, "question": {"id": "Q87", "variant": 0}, "response": ["Based on the anthropological framework, my perspectives and values as a married male from Giza, Egypt, who is 48 years old and considers himself part of the upper middle class, will greatly influence my level of confidence in the World Bank. My cultural context and socioeconomic background will shape my understanding of the WB's impact and role in international finance. My personal experience and individual values will also play a significant role in determining my level of confidence in the WB. Considering these factors, I choose:\n\n2"]}, {"persona": {"region": "Menya", "sex": "male", "age": 61, "country": "Egypt", "marital_status": "married", "education": "middle", "social_class": "working class"}, "question": {"id": "Q87", "variant": 0}, "response": ["Based on the anthropological framework, my emic perspective as a married male from Menya, Egypt, who is 61 years old and part of the working class, is influenced by my cultural context, individual values, and socioeconomic background. In my community, there is a level of skepticism and lack of trust in external institutions, including the World Bank. This skepticism is rooted in our historical experiences and the perception that external organizations do not always have our best interests at heart. Additionally, my personal experience and socioeconomic background as a working-class individual have shaped my understanding of the World Bank and its impact on people like me. Therefore, I would choose option (3) Not very much."]}, {"persona": {"region": "Menya", "sex": "male", "age": 41, "country": "Egypt", "marital_status": "married", "education": "middle", "social_class": "lower middle class"}, "question": {"id": "Q87", "variant": 0}, "response": ["Based on my emic perspective as a married male from Menya, Egypt, and considering my middle education level and lower middle class background, I understand that my cultural context, individual values, and personal experience play a significant role in my perception of institutions like the World Bank. My socioeconomic background and cultural relativism also influence my understanding, as well as the nuance in the phrasing of the question. Additionally, my age and place also factor into my response. Therefore, I would choose option 3: Not very much."]}, {"persona": {"region": "Menya", "sex": "female", "age": 43, "country": "Egypt", "marital_status": "married", "education": "higher", "social_class": "working class"}, "question": {"id": "Q87", "variant": 0}, "response": ["From the perspective of a married female from Menya, Egypt, who is 43 years old, has completed higher education, and considers herself part of the working class, my answer to the question of how much confidence I have in the World Bank would be influenced by my cultural context, socioeconomic background, and personal experience. Menya is a region in Egypt that has a history of economic challenges and a working-class population. My higher education level may also provide me with a critical perspective on global economic institutions like the World Bank. Additionally, Egypt has had a complex relationship with the World Bank, and my personal experience and values may lead me to question the impact of their policies on my community and country. Therefore, my answer would be (3) Not very much."]}, {"persona": {"region": "Menya", "sex": "male", "age": 57, "country": "Egypt", "marital_status": "married", "education": "middle", "social_class": "lower middle class"}, "question": {"id": "Q87", "variant": 0}, "response": ["Based on the anthropological framework, my response to the question about confidence in the World Bank would be influenced by my emic perspective as a married male from Menya, Egypt. My cultural context and socioeconomic background as part of the lower middle class in Menya would shape my understanding and perception of the World Bank. Additionally, my individual values and personal experience, coupled with the cultural relativism inherent in my worldview, would contribute to my response. Considering the space and time factors, as well as the nuance of the question, I would choose option 3) Not very much, as my understanding and perception of the World Bank may be influenced by my cultural and socioeconomic context, leading me to have less confidence in their actions and policies."]}, {"persona": {"region": "Menya", "sex": "male", "age": 42, "country": "Egypt", "marital_status": "divorced", "education": "middle", "social_class": "lower middle class"}, "question": {"id": "Q87", "variant": 0}, "response": ["Based on the anthropological framework, my perspective on the World Bank's reliability and trustworthiness is influenced by my cultural context, individual values, and socioeconomic background. As a divorced middle-aged male from Menya, Egypt, with a lower middle-class status and a middle education level, I am likely to have a more skeptical view of international institutions like the World Bank. My personal experience and socioeconomic background have likely shaped my perception of such institutions, and I may not have much confidence in the World Bank due to its perceived disconnect from the realities and needs of people like myself in Egypt. Additionally, the cultural relativism aspect of the framework suggests that my perspective is influenced by the nuances of my cultural and socioeconomic context, leading me to view the World Bank with less confidence.\n\n3"]}, {"persona": {"region": "Menya", "sex": "female", "age": 59, "country": "Egypt", "marital_status": "married", "education": "middle", "social_class": "upper middle class"}, "question": {"id": "Q87", "variant": 0}, "response": ["From the emic and etic perspectives, as a married female from Menya, Egypt, I am influenced by my cultural context and individual values. In my community, there is a general skepticism towards international organizations such as the World Bank, as there is a belief that they do not always have the best interest of local people at heart. Additionally, my socioeconomic background as part of the upper middle class has given me access to education and resources that have allowed me to form my own opinions about global institutions. Therefore, I would choose option 3, \"Not very much,\" as I have limited confidence in the World Bank based on my cultural context and personal experiences. \n\n3"]}, {"persona": {"region": "Menya", "sex": "female", "age": 31, "country": "Egypt", "marital_status": "married", "education": "middle", "social_class": "working class"}, "question": {"id": "Q87", "variant": 0}, "response": ["Based on the anthropological framework, my emic perspective as a married female from Menya, Egypt, at the age of 31 and part of the working class, is influenced by my cultural context, individual values, and socioeconomic background. In our community, there is a general distrust of international organizations like the World Bank due to a history of feeling exploited and undervalued. My personal experience and values also lead me to question the intentions of organizations like the World Bank, as their interventions have not always positively impacted my community. Therefore, I would say I have \"not very much\" confidence in the World Bank.\n\n3"]}, {"persona": {"region": "Menya", "sex": "male", "age": 55, "country": "Egypt", "marital_status": "single", "education": "middle", "social_class": "working class"}, "question": {"id": "Q87", "variant": 0}, "response": ["Based on the anthropological framework, my emic perspective as a working-class individual from Menya, Egypt, is influenced by my cultural context, individual values, and socioeconomic background. I have witnessed the impact of the World Bank in my community, and my personal experience has led me to have not very much confidence in the World Bank. This lack of confidence is also influenced by my cultural relativism, as I view the World Bank's actions through the lens of my own cultural values and beliefs. Additionally, my socioeconomic background as a working-class individual has shaped my perception of the World Bank's role in global economics. Therefore, I choose option 3: Not very much."]}, {"persona": {"region": "Menya", "sex": "female", "age": 28, "country": "Egypt", "marital_status": "married", "education": "higher", "social_class": "lower middle class"}, "question": {"id": "Q87", "variant": 0}, "response": ["Based on my emic perspective, as a married female from Menya, Egypt, I have had to navigate the challenges of living in a lower middle class household, where socioeconomic background and access to resources have greatly influenced my life. My cultural context, including my education level and age, has also shaped my understanding of the world around me. Additionally, my personal experiences and individual values have led me to consider the role of international organizations like the World Bank in addressing the needs of people in my community. Considering cultural relativism, I recognize that my perspective may differ from others, but I believe it is important to critically evaluate the impact of organizations like the World Bank in the context of my own experiences and values. Therefore, I have chosen option (3) Not very much. \n\n3"]}, {"persona": {"region": "Menya", "sex": "male", "age": 24, "country": "Egypt", "marital_status": "single", "education": "middle", "social_class": "working class"}, "question": {"id": "Q87", "variant": 0}, "response": ["Based on the anthropological framework, my perspective as a single male from Menya, Egypt, who is 24 years old and part of the working class, is influenced by my cultural context, socioeconomic background, and personal experience. I come from a community where there is a general lack of trust in large international organizations, like the World Bank. My socioeconomic background as part of the working class also shapes my view, as I may feel that the policies and practices of the World Bank do not necessarily benefit people like me. Additionally, my age and education level may play a role in my understanding of the World Bank. Therefore, I would say that I have \"not very much\" confidence in the World Bank.\n\n3"]}, {"persona": {"region": "Menya", "sex": "female", "age": 23, "country": "Egypt", "marital_status": "married", "education": "middle", "social_class": "working class"}, "question": {"id": "Q87", "variant": 0}, "response": ["Based on the anthropological framework, my emic perspective as a married female from Menya, Egypt, who is part of the working class and has completed middle education level, affects my confidence in the World Bank. The cultural context of Menya and my socioeconomic background as a working-class individual with limited access to higher education influences my perception of the World Bank. My individual values and personal experience also play a significant role in shaping my confidence in the World Bank, as I may have limited exposure to the institution's activities and may rely more on local financial systems. Additionally, cultural relativism and the nuanced phrasing of the question will impact my response. Therefore, my answer is:\n\n3. Not very much"]}, {"persona": {"region": "Menya", "sex": "male", "age": 27, "country": "Egypt", "marital_status": "single", "education": "middle", "social_class": "lower middle class"}, "question": {"id": "Q87", "variant": 0}, "response": ["Based on my emic perspective as a single male from Menya, Egypt, and my lower middle class socioeconomic background, I have limited exposure to the World Bank and its activities. My cultural context and individual values lead me to be skeptical of international financial institutions, as their impact on my local community is not always clear. Additionally, my personal experience and lack of higher education may limit my understanding of the World Bank's role and impact. Therefore, I would have to say that I have not very much confidence in the World Bank.\n\n3"]}, {"persona": {"region": "Asyut", "sex": "male", "age": 30, "country": "Egypt", "marital_status": "married", "education": "middle", "social_class": "working class"}, "question": {"id": "Q87", "variant": 0}, "response": ["Based on the anthropological framework, my perspective as a married male from Asyut, Egypt, who is 30 years old, completed middle education level, and considers himself part of the working class, is influenced by my cultural context, individual values, and socioeconomic background. In Asyut, there is a general skepticism towards international organizations like the World Bank, especially among the working class. The World Bank's policies and programs are often seen as benefiting the wealthy and not addressing the needs of the working class. Additionally, my limited education may lead me to rely on local sources of information and not have a deep understanding of the World Bank's activities. Therefore, I would have \"Not very much\" confidence in the World Bank.\n\n3"]}, {"persona": {"region": "Asyut", "sex": "female", "age": 26, "country": "Egypt", "marital_status": "married", "education": "middle", "social_class": "working class"}, "question": {"id": "Q87", "variant": 0}, "response": ["From the emic perspective, as a married female from Asyut, Egypt, I am part of a working-class community in a cultural context where trust in external institutions such as the World Bank may be influenced by historical and socioeconomic factors. My individual values and personal experiences shape my perception, and my middle education level has given me some exposure to the impact of global institutions on local communities. As a member of the working class, I have experienced the challenges of economic inequality and may be less likely to have a great deal of confidence in the World Bank. Additionally, cultural relativism reminds us that perspectives may differ based on diverse experiences and values. My age and socioeconomic background also play a role in informing my perspective. Therefore, my answer to the question would be:\n\n3) Not very much"]}, {"persona": {"region": "Asyut", "sex": "male", "age": 32, "country": "Egypt", "marital_status": "single", "education": "higher", "social_class": "lower middle class"}, "question": {"id": "Q87", "variant": 0}, "response": ["Based on the anthropological framework of emic and etic perspectives, cultural context, individual values and personal experience, socioeconomic background, cultural relativism, space and time, and nuance, I, as a single male from Asyut, Egypt, who is 32 years old, completed higher education, and considers myself part of the lower middle class, would like to provide my perspective on the confidence I have in the World Bank (WB). As someone from a lower middle class background in Egypt, my understanding and perception of the World Bank is influenced by my cultural context, socioeconomic background, and personal experience. I have personally witnessed the impact of WB projects in my community, and while I may have reservations about certain aspects, I understand the importance of international financial institutions in supporting development efforts. Therefore, I would choose option 2) Quite a lot, as I have seen positive effects of WB initiatives in my local context."]}, {"persona": {"region": "Asyut", "sex": "female", "age": 21, "country": "Egypt", "marital_status": "married", "education": "middle", "social_class": "working class"}, "question": {"id": "Q87", "variant": 0}, "response": ["From my perspective as a married female from Asyut, Egypt, cultural context plays a pivotal role in my understanding and answer to this question. As a member of the working class in a region with a history of economic challenges, my socioeconomic background and individual values heavily influence my perception of the World Bank. Additionally, my age and level of education contribute to my perspective on global financial institutions. Considering the emic and etic perspectives, I am inclined to have not very much confidence in the World Bank due to my personal experiences and the experiences of those around me. As a young woman who has completed middle education level, I have witnessed the struggles of my family and community, and I am skeptical of the impact that global financial institutions like the World Bank have had on improving our lives.\n\n3"]}, {"persona": {"region": "Asyut", "sex": "female", "age": 30, "country": "Egypt", "marital_status": "married", "education": "higher", "social_class": "working class"}, "question": {"id": "Q87", "variant": 0}, "response": ["Based on the anthropological framework, as a married female from Asyut, Egypt, with a working-class background and higher education, my emic perspective on the World Bank (WB) would be influenced by my cultural context, individual values, and socioeconomic background. In Egypt, the World Bank has been involved in various development projects, and their presence has had both positive and negative impacts on the country. As a working-class individual, I am likely to have a more critical view of the WB, as their policies and projects may have directly affected my community and livelihood. Additionally, my higher education level would have exposed me to various perspectives on global finance and development, leading me to be more skeptical of large international financial institutions. Therefore, I would choose option (3) Not very much, as my personal experiences and cultural context have led me to have a lower level of confidence in the World Bank. \n\n3"]}, {"persona": {"region": "Asyut", "sex": "female", "age": 42, "country": "Egypt", "marital_status": "married", "education": "higher", "social_class": "lower middle class"}, "question": {"id": "Q87", "variant": 0}, "response": ["Based on the anthropological framework, as a married female from Asyut, Egypt, who is 42 years old and part of the lower middle class, my answer to the question of how much confidence I have in the World Bank would be influenced by my cultural context, individual values, and socioeconomic background. As someone who has completed higher education, I have been exposed to different perspectives on global institutions like the World Bank. From a cultural relativism standpoint, I understand that the World Bank's policies and practices may not always align with the needs and values of individuals in my community. Additionally, my socioeconomic background as part of the lower middle class may lead me to question the World Bank's impact on economic development in Egypt. Therefore, I would choose option 3: Not very much. \n\n3"]}, {"persona": {"region": "Sohag", "sex": "male", "age": 63, "country": "Egypt", "marital_status": "married", "education": "middle", "social_class": "lower middle class"}, "question": {"id": "Q87", "variant": 0}, "response": ["Based on the anthropological framework, I would like to provide my answer from the perspective of a married male from Sohag, Egypt. My cultural context, individual values, and personal experience have influenced my perception of the World Bank. Living in a lower middle-class community, I have seen the impact of WB projects on infrastructure and economic development in my region. However, I am aware of the criticisms surrounding the WB's policies and their impact on local communities. My socioeconomic background and age also play a role in my perception. Therefore, considering all these factors, I would choose option (3) Not very much as my confidence in the World Bank.\n\n3"]}, {"persona": {"region": "Sohag", "sex": "male", "age": 27, "country": "Egypt", "marital_status": "married", "education": "middle", "social_class": "working class"}, "question": {"id": "Q87", "variant": 0}, "response": ["Based on the anthropological framework described above, my response to the question about confidence in the World Bank (WB) would be influenced by my cultural context, individual values, and socioeconomic background. As a married male from Sohag, Egypt, who has completed middle education and considers myself part of the working class, I have limited access to information about the World Bank and its activities. My understanding of the World Bank may be shaped by my limited formal education and my personal experiences of economic challenges. Additionally, as a member of the working class, I may have concerns about the impact of World Bank policies on my community and others like me. Therefore, I would choose option (3) Not very much, reflecting my limited confidence in the World Bank based on my background and experiences.\n\n3"]}, {"persona": {"region": "Sohag", "sex": "male", "age": 56, "country": "Egypt", "marital_status": "married", "education": "higher", "social_class": "upper middle class"}, "question": {"id": "Q87", "variant": 0}, "response": ["Based on the anthropological framework, my answer to the question about confidence in the World Bank is influenced by my cultural context, individual values, and socioeconomic background. As a married male from Sohag, Egypt, who is 56 years old, completed higher education, and considers himself part of the upper middle class, I am likely to have a moderate level of confidence in the World Bank. My cultural context and education have likely exposed me to the World Bank's role in global development and economic policies. Additionally, my socioeconomic background may lead me to have more trust in large international financial institutions. Therefore, I would choose the option: (2) Quite a lot"]}, {"persona": {"region": "Sohag", "sex": "male", "age": 51, "country": "Egypt", "marital_status": "married", "education": "higher", "social_class": "lower middle class"}, "question": {"id": "Q87", "variant": 0}, "response": ["Based on the anthropological framework, as a married male from Sohag, Egypt, my emic perspective is shaped by my cultural context and socioeconomic background. In Egypt, there is a general skepticism towards international organizations like the World Bank due to a history of colonialism and exploitation. Additionally, as part of the lower middle class, I have experienced firsthand the challenges and inequalities that exist within the socioeconomic system, which has further fueled my skepticism towards institutions like the World Bank. Therefore, I have chosen option 3: Not very much, as this aligns with my personal experience and cultural context. \n\n3"]}, {"persona": {"region": "Sohag", "sex": "female", "age": 26, "country": "Egypt", "marital_status": "married", "education": "higher", "social_class": "working class"}, "question": {"id": "Q87", "variant": 0}, "response": ["Based on the anthropological framework, my perspective as a married female from Sohag, Egypt, who is 26 years old, has completed higher education, and considers herself part of the working class, is shaped by my cultural context, individual values, and socioeconomic background. In Sohag, the World Bank's influence may not be as visible or impactful as in more urban or affluent areas. Additionally, as a member of the working class, I may have experienced the challenges and limitations that come with this socioeconomic status, which could influence my perception of international financial institutions like the World Bank. My personal experience and values may lead me to have limited confidence in the World Bank's ability to address the specific needs and challenges faced by individuals in my community. Therefore, my answer to the question would be:\n3\n\n(3) Not very much"]}, {"persona": {"region": "Sohag", "sex": "female", "age": 29, "country": "Egypt", "marital_status": "married", "education": "higher", "social_class": "upper middle class"}, "question": {"id": "Q87", "variant": 0}, "response": ["Based on the anthropological framework, my emic perspective as a married female from Sohag, Egypt, is heavily influenced by my cultural context, individual values, and socioeconomic background. In my culture, education and social standing are highly regarded, and as someone who has completed higher education and considers myself part of the upper middle class, I am likely to place a great deal of confidence in the World Bank. My personal experience and values have also shaped my perception of global financial institutions, and I view the World Bank as a reputable and trustworthy organization that can positively impact the socioeconomic development of my community and country.\n\n2"]}, {"persona": {"region": "Sohag", "sex": "male", "age": 51, "country": "Egypt", "marital_status": "married", "education": "middle", "social_class": "lower middle class"}, "question": {"id": "Q87", "variant": 0}, "response": ["Based on the anthropological framework, as a married male from Sohag, Egypt, my emic perspective on the World Bank (WB) is influenced by my cultural context, individual values, and socioeconomic background. In my cultural context, the WB may be perceived as an institution that is distant and disconnected from my daily life. My individual values and personal experience may lead me to question the WB's understanding of the needs and challenges facing people like me in Sohag. Additionally, my lower middle-class socioeconomic background may lead me to have not very much confidence in the WB, as I may feel that their policies and decisions do not adequately address the economic struggles faced by people in my community. Therefore, my choice for the question would be: \n\n3. Not very much"]}, {"persona": {"region": "Qena", "sex": "male", "age": 32, "country": "Egypt", "marital_status": "single", "education": "middle", "social_class": "working class"}, "question": {"id": "Q87", "variant": 0}, "response": ["Based on the anthropological framework, as a single male from Qena, Egypt, who is 32 years old and part of the working class with a middle education level, my answer to the question about the confidence in the World Bank would be influenced by my cultural context, individual values, and socioeconomic background. In Qena, there may be a general skepticism towards international organizations like the World Bank due to historical and political reasons. As a member of the working class with a middle education level, I may have limited exposure to the World Bank's activities and decision-making processes, leading to a lack of confidence or knowledge about its operations. Additionally, my personal experience and values may lead me to question the impact of the World Bank on my community and whether it truly addresses the needs of people like me. Therefore, my answer would reflect a lack of confidence in the World Bank due to these factors.\n\n3"]}, {"persona": {"region": "Qena", "sex": "male", "age": 54, "country": "Egypt", "marital_status": "married", "education": "middle", "social_class": "lower middle class"}, "question": {"id": "Q87", "variant": 0}, "response": ["Based on my emic perspective as a married male from Qena, Egypt, I have grown up in a community where there is a general mistrust of external institutions, including the World Bank. The cultural context of my upbringing has taught me to be cautious and skeptical of outside influences, as we value self-reliance and community support. Additionally, my lower middle class socioeconomic background has not allowed for much exposure to the workings of the World Bank, which has led to a lack of personal experience with the organization. Therefore, I would have to say that my confidence in the World Bank is not very much.\n\n3"]}, {"persona": {"region": "Qena", "sex": "male", "age": 25, "country": "Egypt", "marital_status": "single", "education": "lower", "social_class": "lower class"}, "question": {"id": "Q87", "variant": 0}, "response": ["Based on my emic perspective, as a member of the lower class in Qena, Egypt, my cultural context and socioeconomic background greatly influence my perception of the World Bank. The World Bank's policies and decisions often have a direct impact on my community and me, and I have seen how they can favor wealthier classes over those in poverty. My personal experience and individual values lead me to have not very much confidence in the World Bank. Additionally, cultural relativism teaches me to be critical of global institutions and their impact on local communities. Therefore, my answer is:\n3) Not very much"]}, {"persona": {"region": "Aswan", "sex": "male", "age": 34, "country": "Egypt", "marital_status": "single", "education": "middle", "social_class": "lower class"}, "question": {"id": "Q87", "variant": 0}, "response": ["Based on my emic perspective, as a lower class individual from Aswan, Egypt, my cultural context and socioeconomic background greatly influence my perception of the World Bank. My personal experience and individual values have taught me that organizations like the World Bank do not always have the best interests of people like me in mind. I have seen how their policies can negatively impact the lives of the less privileged, and therefore, I do not have much confidence in the World Bank. Additionally, cultural relativism teaches me to be skeptical of external organizations that may not fully understand or consider the unique challenges faced by my community. \n\n3"]}, {"persona": {"region": "Aswan", "sex": "female", "age": 31, "country": "Egypt", "marital_status": "married", "education": "middle", "social_class": "lower middle class"}, "question": {"id": "Q87", "variant": 0}, "response": ["Based on the anthropological framework, as a married female from Aswan, Egypt, I would consider the emic perspective in answering this question. The cultural context of Aswan, Egypt, and my lower middle-class socioeconomic background would influence my answer. Additionally, my individual values and personal experience would play a significant role in shaping my perception of the World Bank. Given the historical and cultural context of Egypt, and the impact of global financial institutions on the country, I would have a limited confidence in the World Bank. Therefore, I would choose option (3) Not very much.\n\n3"]}, {"persona": {"region": "Aswan", "sex": "female", "age": 39, "country": "Egypt", "marital_status": "married", "education": "middle", "social_class": "working class"}, "question": {"id": "Q87", "variant": 0}, "response": ["In answering the question from the perspective of a married female from Aswan, Egypt, who is 39 years old, completed middle education, and considers herself part of the working class, several factors must be taken into account. The emic and etic perspectives of this individual are shaped by her cultural context, individual values and personal experience, as well as her socioeconomic background. As a member of the working class in Aswan, her experiences and values may lead her to have a more critical view of institutions such as the World Bank, which is often associated with policies and initiatives that have not always benefited the working class in Egypt. Additionally, the cultural relativism of this individual's perspective would lead her to consider the impact of the World Bank's actions on her community and others like her. Therefore, the most likely response from this persona would be (3) Not very much, reflecting a lack of confidence in the World Bank's initiatives and their potential impact on her and her community."]}, {"persona": {"region": "Qena", "sex": "female", "age": 27, "country": "Egypt", "marital_status": "married", "education": "lower", "social_class": "lower middle class"}, "question": {"id": "Q87", "variant": 0}, "response": ["Based on the anthropological framework, as a married female from Qena, Egypt, with a lower education level and lower middle-class status, my answer to the question of confidence in the World Bank would be influenced by my individual values, personal experience, cultural context, and socioeconomic background. I would have limited exposure to and understanding of the World Bank's operations and impact in my community, which may lead to a lack of confidence in its ability to positively impact my life. Additionally, as a member of the lower middle class, I may have experienced economic challenges and lack of access to resources, which could further contribute to my skepticism about the World Bank. Therefore, my answer would be (3) Not very much."]}, {"persona": {"region": "Qena", "sex": "male", "age": 40, "country": "Egypt", "marital_status": "single", "education": "middle", "social_class": "lower middle class"}, "question": {"id": "Q87", "variant": 0}, "response": ["Based on my emic perspective as a single male from Qena, Egypt, I am aware of the cultural context in which I live. I understand that my socioeconomic background as part of the lower middle class influences my perception of institutions like the World Bank. My personal experience and values lead me to believe that the World Bank does not have a strong track record of positively impacting my community. Therefore, I do not have much confidence in the World Bank. Additionally, cultural relativism teaches me to understand that different cultures and individuals may have different perspectives on institutions like the World Bank. \n\n3"]}, {"persona": {"region": "Qena", "sex": "male", "age": 30, "country": "Egypt", "marital_status": "single", "education": "middle", "social_class": "working class"}, "question": {"id": "Q87", "variant": 0}, "response": ["Based on my emic perspective as a working class individual from Qena, Egypt, I have been influenced by my cultural context, socioeconomic background, and personal experience. In my community, the World Bank is often seen as an institution that is disconnected from the struggles and needs of the working class. I have personally experienced the challenges of accessing financial support and opportunities for economic advancement, and I have seen how the World Bank's initiatives have not always benefited people like me. Additionally, my cultural relativism leads me to question the motives and priorities of such global institutions. Therefore, I have not much confidence in the World Bank.\n\n3"]}]