[{"persona": {"region": "Fayoum", "sex": "male", "age": 46, "country": "Egypt", "marital_status": "married", "education": "higher", "social_class": "lower middle class"}, "question": {"id": "Q62", "variant": 0}, "response": ["Based on the anthropological framework, my perspective as a married male from Fayoum, Egypt, at 46 years of age, with a higher education level and a lower middle-class background is influenced by various factors. Firstly, the emic and etic perspectives play a role, as my in-group and out-group ways of thinking may influence my trust towards people of another religion. Additionally, my cultural context, individual values, and personal experiences shape my perception. Socioeconomic background also plays a role, as it may affect my interactions with people of different religions. Cultural relativism is important to consider, as my understanding of other religions may differ from that of people from different cultures. Finally, space and time, as well as nuance, are important in my understanding of this question.\n\n3"]}, {"persona": {"region": "Fayoum", "sex": "female", "age": 30, "country": "Egypt", "marital_status": "married", "education": "middle", "social_class": "lower middle class"}, "question": {"id": "Q62", "variant": 0}, "response": ["Based on my cultural context and socioeconomic background, my understanding and trust of people of another religion is influenced by my personal experiences and individual values. Growing up in Fayoum, Egypt, I have been exposed to a diverse religious landscape and have interacted with people from different religious backgrounds. My middle education level has also provided me with some level of understanding and tolerance towards people of different religions. However, my lower middle class status has also exposed me to instances of economic disparity and social tensions, which can impact my level of trust towards people of another religion. Therefore, my perspective on this matter is that I trust somewhat. \n\n2"]}, {"persona": {"region": "Fayoum", "sex": "male", "age": 60, "country": "Egypt", "marital_status": "married", "education": "higher", "social_class": "working class"}, "question": {"id": "Q62", "variant": 0}, "response": ["Based on the anthropological framework, my cultural context as a married male from Fayoum, Egypt, my age, education level, and working class background are crucial in understanding and answering this question. My cultural context is deeply influenced by the religious diversity in Egypt, where I have been exposed to people of different religions throughout my life. My personal experience and individual values have shaped my perception of people of other religions, and I understand the importance of cultural relativism in respecting and understanding others' beliefs. Additionally, my socioeconomic background as a working-class individual also impacts my level of trust in people of another religion. Given these factors, I would choose:\n\n2"]}, {"persona": {"region": "Fayoum", "sex": "male", "age": 20, "country": "Egypt", "marital_status": "single", "education": "middle", "social_class": "lower middle class"}, "question": {"id": "Q62", "variant": 0}, "response": ["From an emic perspective, as a single male from Fayoum, Egypt, my cultural context heavily influences my understanding and trust of people from another religion. Egypt is a predominantly Muslim country, and as a member of the lower middle class, I have likely had limited exposure to people of other religions. My personal experience and individual values also play a role in shaping my perception. Additionally, my socioeconomic background and age factor into my understanding of trust towards people of another religion. Cultural relativism is important to consider, as my understanding of trust may differ from someone of a different cultural background. Given these factors, I would choose option 2: Trust somewhat. \n\n2"]}, {"persona": {"region": "Fayoum", "sex": "female", "age": 39, "country": "Egypt", "marital_status": "married", "education": "higher", "social_class": "lower middle class"}, "question": {"id": "Q62", "variant": 0}, "response": ["Based on the anthropological framework, my response is influenced by my cultural context as a married female from Fayoum, Egypt. In this region, religion plays a significant role in people's lives and interactions. My individual values and personal experiences also shape my perspective, as I have been raised to respect and coexist peacefully with people of different religions. Additionally, my socioeconomic background as a lower middle class individual has provided me with opportunities to interact with individuals from diverse religious backgrounds, leading me to trust people of another religion somewhat. This nuanced response reflects the complexity of my cultural and personal experiences.\n\n2"]}, {"persona": {"region": "Fayoum", "sex": "male", "age": 33, "country": "Egypt", "marital_status": "married", "education": "higher", "social_class": "working class"}, "question": {"id": "Q62", "variant": 0}, "response": ["Based on the anthropological framework, my cultural context as a married male from Fayoum, Egypt, my age, education level, and working-class background all play a role in my answer to the question. My personal experience and individual values are also important factors, as well as the cultural relativism perspective. In my community, there is a mix of religions, and I have personally interacted with people of different faiths. I have found that trust is built on personal interactions and not solely based on religious affiliation. Therefore, I trust people of other religions somewhat. \n\n2"]}, {"persona": {"region": "Port Said", "sex": "female", "age": 45, "country": "Egypt", "marital_status": "married", "education": "higher", "social_class": "lower middle class"}, "question": {"id": "Q62", "variant": 0}, "response": ["From an emic perspective, as a married female from Port Said, Egypt, my cultural context and individual values heavily influence my perception of trust towards people of another religion. Being from a diverse and religiously tolerant community, my personal experience and understanding of cultural relativism have shaped my belief that trust should be extended to all individuals regardless of their religious background. Additionally, my socioeconomic background as part of the lower middle class has exposed me to the struggles and hardships faced by individuals of different faiths, fostering empathy and understanding. Therefore, based on my nuanced understanding and the cultural context in which I am situated, I choose option (2) Trust somewhat.\n\n2"]}, {"persona": {"region": "Port Said", "sex": "male", "age": 42, "country": "Egypt", "marital_status": "married", "education": "middle", "social_class": "lower middle class"}, "question": {"id": "Q62", "variant": 0}, "response": ["Based on my emic perspective as a married male from Port Said, Egypt, I have grown up in a cultural context where people of different religions coexist and interact on a daily basis. My individual values and personal experiences have taught me to be open-minded and accepting of others, regardless of their religious beliefs. Additionally, my lower middle class socioeconomic background has led me to rely on the support and cooperation of people from various religious backgrounds in order to make a living. Furthermore, cultural relativism has taught me to appreciate and respect the beliefs of others, and I understand that trust is not determined by religion but by individual character. Therefore, I choose option (2) Trust somewhat.\n\n2"]}, {"persona": {"region": "Port Said", "sex": "male", "age": 28, "country": "Egypt", "marital_status": "single", "education": "middle", "social_class": "lower middle class"}, "question": {"id": "Q62", "variant": 0}, "response": ["Based on my emic perspective as a single male from Port Said, Egypt, the cultural context of my upbringing and community heavily influences my perception of people of another religion. In my cultural context, there is a history of tension and conflict between different religious groups, and this has shaped my understanding of trust and relationships with people of another religion. Additionally, my individual values and personal experience have led me to have a cautious approach when it comes to trusting people of another religion. My socioeconomic background as part of the lower middle class also plays a role in my perception, as it impacts the opportunities I have had to interact with individuals from different religious backgrounds. Furthermore, the nuance of the question is important to consider, as it may influence my response based on how I interpret the level of trust being asked. \n\n3"]}, {"persona": {"region": "Port Said", "sex": "female", "age": 30, "country": "Egypt", "marital_status": "married", "education": "higher", "social_class": "lower middle class"}, "question": {"id": "Q62", "variant": 0}, "response": ["Based on the anthropological framework, my perspective as a married female from Port Said, Egypt, would be influenced by my cultural context, individual values, and socioeconomic background. In Port Said, there is a diverse religious community, and interactions with people of different religions are common. My personal experience and education have taught me to be open-minded and respectful towards people of different faiths. As a member of the lower middle class, I understand the importance of mutual support and cooperation in a diverse community. Therefore, I would choose option (2) Trust somewhat, as I believe in giving people the benefit of the doubt and being cautious in building trust with individuals of different religions. \n\n2"]}, {"persona": {"region": "Port Said", "sex": "male", "age": 30, "country": "Egypt", "marital_status": "divorced", "education": "middle", "social_class": "lower middle class"}, "question": {"id": "Q62", "variant": 0}, "response": ["Based on my emic perspective as a divorced male from Port Said, Egypt, I have grown up in a society with a dominant Islamic culture. The cultural context of my upbringing has taught me to have a level of trust in people of other religions, as long as they do not directly oppose or threaten my own beliefs. My individual values and personal experiences have shaped my understanding of trust, and while I may have some level of trust in people of other religions, my socioeconomic background as part of the lower middle class has also influenced my level of trust. In addition, the cultural relativism in my society does not necessarily promote a high level of trust in people of other religions, and my age and place also play a role in this. Considering these factors, I would choose option (2) Trust somewhat. \n\n2"]}, {"persona": {"region": "Port Said", "sex": "female", "age": 19, "country": "Egypt", "marital_status": "single", "education": "middle", "social_class": "lower middle class"}, "question": {"id": "Q62", "variant": 0}, "response": ["From an emic perspective, as a single female from Port Said, Egypt, with a middle education level and lower middle class background, my cultural context and personal experience have shaped my understanding of trust towards people of other religions. In this conservative and religiously diverse community, I have been taught to be cautious and reserved in my interactions with those of different faiths. The socioeconomic background also plays a role in my perception, as my family's financial status has limited my exposure to diverse perspectives. Additionally, the cultural relativism in this society emphasizes the importance of maintaining one's own religious beliefs and values. Therefore, based on these factors, I would choose option (3) - Do not trust very much. \n\n3"]}, {"persona": {"region": "Fayoum", "sex": "male", "age": 40, "country": "Egypt", "marital_status": "married", "education": "middle", "social_class": "working class"}, "question": {"id": "Q62", "variant": 0}, "response": ["Based on the anthropological framework, my emic perspective as a married male from Fayoum, Egypt, with a middle education level and part of the working class, would be influenced by my cultural context, individual values, and personal experience. In Egypt, there is a strong cultural emphasis on religious identity, and as a result, my trust in people of another religion may be limited. Additionally, my socioeconomic background as part of the working class may also influence my trust levels, as there may be economic and social disparities between different religious groups. Therefore, my answer would be:\n\n3"]}, {"persona": {"region": "Fayoum", "sex": "male", "age": 23, "country": "Egypt", "marital_status": "single", "education": "higher", "social_class": "lower middle class"}, "question": {"id": "Q62", "variant": 0}, "response": ["Based on the anthropological framework, my emic perspective as a single male from Fayoum, Egypt, is heavily influenced by my cultural context, individual values, and personal experiences. In Egypt, religion plays a significant role in society and can impact social interactions and trust. Additionally, my socioeconomic background as part of the lower middle class has shaped my perceptions and interactions with people of different religious backgrounds. Furthermore, my age and completed higher education level have likely exposed me to diverse perspectives and have influenced my nuanced understanding of trust. Taking all these factors into account, I believe I would choose option (2) Trust somewhat. \n\n2"]}, {"persona": {"region": "Fayoum", "sex": "female", "age": 38, "country": "Egypt", "marital_status": "married", "education": "middle", "social_class": "lower middle class"}, "question": {"id": "Q62", "variant": 0}, "response": ["Based on the anthropological framework, my response to the question of how much I trust people of another religion would be influenced by my cultural context, individual values, and socioeconomic background. In Fayoum, Egypt, there is a strong emphasis on cultural and religious identity, and interactions between people of different religions may be limited. As a married woman from a lower middle class background with a middle education level, I may have had limited exposure to people of other religions and may have been taught to be cautious or wary of those outside of my own religious community. This, coupled with the cultural context of Egypt, may lead me to choose option (3) Do not trust very much, as I may have been socialized to be cautious and not fully trust those of other religions. \n\n3"]}, {"persona": {"region": "Fayoum", "sex": "male", "age": 32, "country": "Egypt", "marital_status": "married", "education": "middle", "social_class": "lower middle class"}, "question": {"id": "Q62", "variant": 0}, "response": ["Based on my personal experience and cultural context as a married male from Fayoum, Egypt, I am aware that there are deep-rooted religious differences in my community. These differences have been shaped by historical and cultural factors, and as a result, there may be a degree of mistrust towards people of another religion. Additionally, my lower middle class socioeconomic background has influenced my interactions with individuals from different religious backgrounds, as economic disparities can sometimes exacerbate religious tensions. Furthermore, considering the emic and etic perspectives, I understand that my in-group may have certain biases and beliefs that impact my level of trust towards individuals of another religion. Therefore, I would choose option (3) Do not trust very much. \n\n3"]}, {"persona": {"region": "Fayoum", "sex": "male", "age": 31, "country": "Egypt", "marital_status": "married", "education": "higher", "social_class": "working class"}, "question": {"id": "Q62", "variant": 0}, "response": ["Based on the anthropological framework, as a 31-year-old married male from Fayoum, Egypt, with a working-class background and higher education, my perspective is heavily influenced by my cultural context, individual values, and personal experience. Living in a predominantly Muslim society, the cultural context and religious dynamics play a significant role in shaping my understanding and trust towards people of other religions. Additionally, my socioeconomic background and education level also impact my perceptions and interactions with individuals from different religious backgrounds. Therefore, my response to the question would be shaped by these factors, leading me to select the option that best aligns with my perspective.\n\n2"]}, {"persona": {"region": "Fayoum", "sex": "male", "age": 31, "country": "Egypt", "marital_status": "married", "education": "middle", "social_class": "lower middle class"}, "question": {"id": "Q62", "variant": 0}, "response": ["Based on my cultural context as a married male from Fayoum, Egypt, I have been raised in a society where religion plays a significant role in shaping social interactions and relationships. The emic perspective within my community emphasizes the importance of trust and mutual respect, regardless of religious differences. Additionally, my lower middle-class socioeconomic background has instilled in me the value of cooperation and solidarity with others, regardless of their religious beliefs. However, my personal experience and individual values may lead me to approach this question with a certain level of caution, as I have encountered instances where religious differences have caused tension. Nevertheless, my understanding of cultural relativism and the nuanced phrasing of the question leads me to select option (2) Trust somewhat. \n\n2"]}, {"persona": {"region": "Fayoum", "sex": "female", "age": 32, "country": "Egypt", "marital_status": "married", "education": "middle", "social_class": "lower middle class"}, "question": {"id": "Q62", "variant": 0}, "response": ["Based on the anthropological framework, as a married female from Fayoum, Egypt, cultural context and individual values play a significant role in my perception of trust towards people of another religion. The cultural context in Egypt, particularly in rural areas like Fayoum, is characterized by a strong influence of Islam. As a member of the lower middle class, my socioeconomic background further shapes my views. Middle education level and limited exposure to different religious beliefs may lead to a tendency to not trust people of another religion very much, as this is a common sentiment in this cultural and socioeconomic context. Therefore, my response to the question would be:\n3"]}, {"persona": {"region": "Ismailia", "sex": "male", "age": 53, "country": "Egypt", "marital_status": "married", "education": "middle", "social_class": "lower middle class"}, "question": {"id": "Q62", "variant": 0}, "response": ["Based on my cultural context, as a married male from Ismailia, Egypt, I am aware that religion plays a significant role in the lives of individuals and communities. In my community, there is a strong emphasis on mutual respect and understanding between people of different religions. However, due to historical and contemporary tensions, there may be some level of skepticism towards individuals of other religions. Additionally, my lower middle-class socioeconomic background has influenced my experiences and interactions with people of different religious backgrounds. Therefore, I would choose option (2) Trust somewhat. \n\n2"]}, {"persona": {"region": "Ismailia", "sex": "male", "age": 38, "country": "Egypt", "marital_status": "married", "education": "higher", "social_class": "working class"}, "question": {"id": "Q62", "variant": 0}, "response": ["Based on the anthropological framework, my perspective is influenced by my cultural context, individual values, and socioeconomic background. As a married male from Ismailia, Egypt, my cultural context is deeply rooted in a society where religious identity plays a significant role in shaping social interactions. Additionally, having completed higher education and considering myself part of the working class, my individual values and personal experience have led me to have a more open and tolerant attitude towards people of different religions. However, the socioeconomic background of being part of the working class has also exposed me to instances of religious discrimination and tension, causing me to have some reservations. Therefore, my response to the question is influenced by a combination of trust and skepticism towards people of another religion. \n\n2"]}, {"persona": {"region": "Ismailia", "sex": "female", "age": 35, "country": "Egypt", "marital_status": "married", "education": "middle", "social_class": "lower middle class"}, "question": {"id": "Q62", "variant": 0}, "response": ["From the perspective of a married female from Ismailia, Egypt, who is 35 years old, has completed middle education, and considers herself to be part of the lower middle class, my answer is influenced by various factors outlined in the anthropological framework. Firstly, the cultural context is important as Egypt is a predominantly Muslim country, and the societal norms and values may influence my level of trust towards people of another religion. Additionally, my individual values and personal experiences play a significant role in shaping my perception, as well as my socioeconomic background. Given the cultural relativism and nuanced phrasing of the question, my answer is that I trust somewhat. This is because while I may have limited exposure and interaction with people of other religions, I still believe in treating others with respect and understanding. \n\n2"]}, {"persona": {"region": "Ismailia", "sex": "female", "age": 57, "country": "Egypt", "marital_status": "married", "education": "lower", "social_class": "working class"}, "question": {"id": "Q62", "variant": 0}, "response": ["Based on the anthropological framework, my answer is influenced by my emic perspective as a married female from Ismailia, Egypt, my cultural context as an Egyptian, and my lower education level and working-class background. As an older individual, I have experienced and observed the dynamics of religious diversity in my community, and this has shaped my personal values and perceptions. Additionally, cultural relativism is important to me, as I understand the value of respecting and understanding different religious beliefs. Given these factors, I choose:\n\n2"]}, {"persona": {"region": "Ismailia", "sex": "male", "age": 33, "country": "Egypt", "marital_status": "married", "education": "middle", "social_class": "lower middle class"}, "question": {"id": "Q62", "variant": 0}, "response": ["Based on the anthropological framework, as a married male from Ismailia, Egypt, who considers himself part of the lower middle class, my perspective on trusting people of another religion is heavily influenced by my cultural context, individual values, and socioeconomic background. In Egypt, there is a long history of religious diversity and coexistence, but there have also been tensions between different religious groups. As a middle-educated individual, I have been exposed to different perspectives and understand the importance of trust in building relationships across religious boundaries. However, my lower middle-class socioeconomic background may have limited my exposure to people of different religions and influenced my level of trust. Therefore, I would choose option (2) Trust somewhat. \n\n2"]}, {"persona": {"region": "Ismailia", "sex": "female", "age": 49, "country": "Egypt", "marital_status": "single", "education": "higher", "social_class": "upper middle class"}, "question": {"id": "Q62", "variant": 0}, "response": ["Based on the anthropological framework, as a single female from Ismailia, Egypt, I understand the importance of cultural context in shaping perceptions and attitudes toward people of another religion. My individual values and personal experiences, as well as my socioeconomic background as part of the upper middle class, play a significant role in influencing my level of trust toward people of another religion. Additionally, the cultural relativism perspective reminds me that no culture or religion is inherently better than another, and I must approach this question with an open mind. Considering the nuanced phrasing of the question and the space and time aspects, I choose the option:\n2"]}, {"persona": {"region": "Ismailia", "sex": "female", "age": 35, "country": "Egypt", "marital_status": "married", "education": "higher", "social_class": "lower middle class"}, "question": {"id": "Q62", "variant": 0}, "response": ["Based on the anthropological framework, my perspective on trusting people of another religion is heavily influenced by my cultural context as a married female from Ismailia, Egypt. The cultural and religious diversity in my community has shaped my understanding of different religions. As someone with a higher education level, I have been exposed to the teachings of tolerance and understanding of different belief systems. Additionally, being part of the lower middle class has allowed me to interact with individuals from various socioeconomic backgrounds, further reinforcing the importance of trust and mutual respect regardless of religious differences. I also value personal experiences, and my positive interactions with people of different religions have led me to trust them to a certain extent. Therefore, my choice is: \n\n2. Trust somewhat"]}, {"persona": {"region": "Ismailia", "sex": "male", "age": 24, "country": "Egypt", "marital_status": "single", "education": "higher", "social_class": "upper middle class"}, "question": {"id": "Q62", "variant": 0}, "response": ["Based on the anthropological framework, my emic perspective as a single male from Ismailia, Egypt, is influenced by my cultural context, individual values, and socioeconomic background. In my cultural context, Egypt is a predominantly Muslim country, and there is a long history of coexistence with minority Christian and Jewish communities. My personal experience and individual values also play a role in my perception of people from other religions. Having completed higher education, I have been exposed to diverse perspectives and have learned to appreciate and respect different belief systems. Additionally, as part of the upper middle class, I have had the privilege of interacting with people from different backgrounds, including those of other religions, and have developed a level of trust based on these interactions.\n\n2"]}, {"persona": {"region": "Ismailia", "sex": "female", "age": 23, "country": "Egypt", "marital_status": "single", "education": "higher", "social_class": "lower middle class"}, "question": {"id": "Q62", "variant": 0}, "response": ["Based on the anthropological framework, as a single female from Ismailia, Egypt, my emic perspective is influenced by the cultural context of my upbringing, the individual values and personal experiences I have had, and my lower middle class socioeconomic background. In my community, there is a strong emphasis on cultural relativism, and I have been taught to respect people of all religions. However, the societal norms and values in my community also play a role in shaping my perspective, as there might be some level of hesitation or caution in trusting people of another religion due to historical and political tensions. Additionally, my age and education level have exposed me to different perspectives, leading me to trust somewhat in people of another religion, but with a degree of caution.\n\n2"]}, {"persona": {"region": "Ismailia", "sex": "male", "age": 55, "country": "Egypt", "marital_status": "married", "education": "middle", "social_class": "lower middle class"}, "question": {"id": "Q62", "variant": 0}, "response": ["Based on my personal experience and cultural context as a married male from Ismailia, Egypt, I understand the importance of trust and cooperation in a community. I believe that individual values and personal experience play a significant role in shaping one's perception of people from another religion. Additionally, the socioeconomic background and cultural relativism are important factors to consider. As a member of the lower middle class, I have interacted with individuals from diverse religious backgrounds and have learned to trust them to a certain extent, based on their actions and character. However, the cultural context and nuanced phrasing of the question also influence my response. Therefore, I choose option (2) Trust somewhat. \n\n2"]}, {"persona": {"region": "Ismailia", "sex": "male", "age": 57, "country": "Egypt", "marital_status": "married", "education": "middle", "social_class": "upper middle class"}, "question": {"id": "Q62", "variant": 0}, "response": ["Based on my cultural context, as a married male from Ismailia, Egypt, I have been raised in a predominantly Muslim community where interactions with people of other religions are limited. My individual values and personal experiences have shaped my perspective, and I have been taught to be cautious and not fully trust people of other religions. Additionally, my socioeconomic background as part of the upper middle class has allowed me to have limited exposure to people of different faiths, leading to a lack of trust. Furthermore, my age and place have also influenced my perspective, as I have lived through times of tension between different religious groups in Egypt. Therefore, based on my nuanced understanding of the question and my cultural context, I would choose option 3: Do not trust very much. \n\n3"]}, {"persona": {"region": "Ismailia", "sex": "female", "age": 29, "country": "Egypt", "marital_status": "married", "education": "middle", "social_class": "upper middle class"}, "question": {"id": "Q62", "variant": 0}, "response": ["Based on the anthropological framework, my emic perspective as a married female from Ismailia, Egypt, with a middle education level and part of the upper middle class, is heavily influenced by my cultural context, individual values, and personal experience. In my cultural context, there is a strong emphasis on respect and tolerance for people of all religions. My personal experience has also shown me that people of different religions can coexist peacefully and can be trusted. Additionally, my socioeconomic background has given me the opportunity to interact with people of various religious backgrounds in a positive and respectful manner. Therefore, my answer to the question would be:\n\n2"]}, {"persona": {"region": "Damiatta", "sex": "female", "age": 46, "country": "Egypt", "marital_status": "married", "education": "middle", "social_class": "lower middle class"}, "question": {"id": "Q62", "variant": 0}, "response": ["Based on the anthropological framework, my emic perspective as a married female from Damiatta, Egypt, at 46 years of age and having completed middle education level, is shaped by the cultural context of my community which includes a predominantly Muslim population. My individual values and personal experience also play a role in influencing my level of trust toward people of another religion. As a member of the lower middle class, my socioeconomic background may also impact my perceptions. Additionally, the cultural relativism within my community may lead to a nuanced understanding of trust toward people of another religion. Given these factors, my response is (2) Trust somewhat."]}, {"persona": {"region": "Damiatta", "sex": "female", "age": 20, "country": "Egypt", "marital_status": "single", "education": "middle", "social_class": "lower middle class"}, "question": {"id": "Q62", "variant": 0}, "response": ["Based on my emic and etic perspective, as a single female from Damiatta, Egypt, I have been raised in a cultural context where religion plays a significant role in people's lives. My personal experiences and individual values have taught me to be open-minded and respectful towards people of other religions. Additionally, my lower-middle-class socioeconomic background has allowed me to interact with individuals from diverse religious backgrounds, leading me to understand the importance of cultural relativism. Considering all these factors, I am inclined to choose option (2) Trust somewhat. \n\n2"]}, {"persona": {"region": "Damiatta", "sex": "male", "age": 19, "country": "Egypt", "marital_status": "single", "education": "middle", "social_class": "lower middle class"}, "question": {"id": "Q62", "variant": 0}, "response": ["Based on my emic perspective as a single male from Damiatta, Egypt, and considering my 19 years of age and completion of middle education level, my trust in people of another religion is influenced by my cultural context and individual values. Growing up in a diverse and religiously tolerant community, I have been taught to trust and respect people of all religions. Additionally, my lower middle-class socioeconomic background has shaped my understanding of the importance of unity and cooperation among different religious groups in our society. Therefore, I choose option (2) Trust somewhat."]}, {"persona": {"region": "Damiatta", "sex": "female", "age": 33, "country": "Egypt", "marital_status": "married", "education": "higher", "social_class": "lower middle class"}, "question": {"id": "Q62", "variant": 0}, "response": ["Based on the anthropological framework, my emic perspective as a married female from Damiatta, Egypt, with a higher education level and lower middle class background, is influenced by my cultural context, individual values, and personal experience. Growing up in a diverse religious community, I have been taught to respect and trust people of all religions. My socioeconomic background has also shaped my understanding of the importance of mutual trust and cooperation in building relationships with people from different religious backgrounds. Additionally, my age and education have allowed me to develop a nuanced understanding of religious diversity and the importance of trust in interfaith relationships. Therefore, I choose option 2: Trust somewhat. \n\n2"]}, {"persona": {"region": "Damiatta", "sex": "male", "age": 24, "country": "Egypt", "marital_status": "single", "education": "higher", "social_class": "lower middle class"}, "question": {"id": "Q62", "variant": 0}, "response": ["Based on the anthropological framework, my emic perspective as a single male from Damiatta, Egypt, would be influenced by my cultural context, individual values, and socioeconomic background. In Egypt, there is a strong sense of community and trust is often based on personal connections and kinship networks. Additionally, as a member of the lower middle class, I may have had limited exposure to people of other religions and may have been influenced by societal prejudices and biases. However, having completed higher education, I may have a more open-minded and nuanced understanding of the world. Therefore, I choose option (2) Trust somewhat. \n\n2"]}, {"persona": {"region": "Suez", "sex": "male", "age": 41, "country": "Egypt", "marital_status": "married", "education": "middle", "social_class": "working class"}, "question": {"id": "Q62", "variant": 0}, "response": ["Based on the anthropological framework, my response is influenced by my cultural context, individual values, and socioeconomic background. As a married male from Suez, Egypt, I have been raised in a predominantly Muslim community and have limited exposure to people of other religions. My cultural context and personal experience have shaped my perception of individuals from other religious backgrounds. Additionally, my working-class socioeconomic background may have limited my interactions with people of diverse religious beliefs. Therefore, I may have developed a level of distrust towards people of other religions due to societal and cultural influences. \n\n3"]}, {"persona": {"region": "Suez", "sex": "female", "age": 39, "country": "Egypt", "marital_status": "divorced", "education": "middle", "social_class": "working class"}, "question": {"id": "Q62", "variant": 0}, "response": ["Based on the anthropological framework, as a divorced female from Suez, Egypt, who is 39 years old and part of the working class, my response to the question of trusting people of another religion would be heavily influenced by my cultural context, individual values, and personal experiences. In Egypt, there is a strong cultural and religious divide between different faiths, and as a member of the working class, I may have limited opportunities to interact with people from other religions. Additionally, my personal experiences and values may lead me to be cautious or hesitant in trusting people of another religion, as societal and religious norms may have shaped my perceptions and attitudes towards those of different faiths. Therefore, my response would be influenced by a combination of cultural context, personal experiences, and individual values, leading me to choose option (3) Do not trust very much.\n\n3"]}, {"persona": {"region": "Cairo", "sex": "female", "age": 55, "country": "Egypt", "marital_status": "married", "education": "middle", "social_class": "working class"}, "question": {"id": "Q62", "variant": 0}, "response": ["Based on the anthropological framework, my perspective as a married female from Cairo, Egypt, at 55 years of age and with a middle education level, is heavily influenced by my cultural context, individual values, and socioeconomic background. In Egypt, there is a strong sense of community and trust within the same religious group, but there may be some hesitation or lack of trust towards people of a different religion due to historical and social factors. My working-class background also means that I may have had limited exposure to people of other religions, which could impact my level of trust. Additionally, the cultural relativism principle reminds us that there is no hierarchy of culture, so my perspective should be respected within its cultural context.\n\n2"]}, {"persona": {"region": "Cairo", "sex": "male", "age": 58, "country": "Egypt", "marital_status": "married", "education": "middle", "social_class": "lower middle class"}, "question": {"id": "Q62", "variant": 0}, "response": ["Based on the anthropological framework, my perspective as a married male from Cairo, Egypt, is heavily influenced by my cultural context, individual values, and socioeconomic background. As a member of the lower middle class in Egypt, my access to education and resources may have shaped my perception of people from other religions. Additionally, being 58 years old, I have likely experienced significant social and political changes in Egypt, which may have further influenced my trust in people of different religions. Considering the nuanced phrasing of the question, I would choose option 2, as I may trust people of another religion somewhat, but my personal experiences and cultural context may also lead me to exercise caution in fully trusting them.\n\n2"]}, {"persona": {"region": "Cairo", "sex": "female", "age": 29, "country": "Egypt", "marital_status": "married", "education": "higher", "social_class": "lower middle class"}, "question": {"id": "Q62", "variant": 0}, "response": ["Based on the anthropological framework, my answer to the question is influenced by my cultural context, individual values, and socioeconomic background. As a married female from Cairo, Egypt, my cultural context and personal experiences have shaped my understanding of different religions and their followers. Additionally, my lower middle class socioeconomic background has influenced my interactions with people of other religions. I understand the importance of cultural relativism and recognize that trust in people of another religion may vary based on individual experiences and nuanced phrasing of the question. Therefore, my answer to the question is (2) Trust somewhat."]}, {"persona": {"region": "Cairo", "sex": "male", "age": 38, "country": "Egypt", "marital_status": "married", "education": "higher", "social_class": "lower middle class"}, "question": {"id": "Q62", "variant": 0}, "response": ["Based on the anthropological framework, my perspective is influenced by my cultural context, individual values, and socioeconomic background. As a married male from Cairo, Egypt, I am likely to have been raised in a society where trust and social relationships are highly valued. My higher education level also means I have been exposed to diverse perspectives and have cultivated a more open-minded approach. Additionally, being part of the lower middle class, I may have experienced economic challenges that have fostered empathy and understanding for others. Therefore, I am more likely to choose option (2) Trust somewhat. \n\n2"]}, {"persona": {"region": "Cairo", "sex": "female", "age": 40, "country": "Egypt", "marital_status": "married", "education": "higher", "social_class": "lower middle class"}, "question": {"id": "Q62", "variant": 0}, "response": ["Based on my personal experience and cultural context as a married female from Cairo, Egypt, I have learned to approach individuals from different religious backgrounds with a level of caution. This is influenced by the emic perspective within my community, where there is a history of tension and conflict between different religious groups. Additionally, my lower middle class socioeconomic background has shaped my interactions with people of other religions, as I have observed and experienced economic disparities that are often tied to religious identity. However, my higher education has also taught me the importance of cultural relativism, and I strive to approach individuals from other religions with an open mind and willingness to build trust based on individual interactions rather than broad generalizations. Therefore, I would choose option (2) Trust somewhat. \n\n2"]}, {"persona": {"region": "Cairo", "sex": "male", "age": 38, "country": "Egypt", "marital_status": "married", "education": "higher", "social_class": "upper middle class"}, "question": {"id": "Q62", "variant": 0}, "response": ["Based on the anthropological framework, my emic perspective as a married male from Cairo, Egypt, leads me to consider the cultural context, individual values, and socioeconomic background when answering the question of how much I trust people of another religion. In Cairo, diverse religious communities coexist, and as a member of the upper middle class, I have had the opportunity to engage with individuals from different religious backgrounds. My individual values and personal experiences have also shaped my trust in others, and my higher education has exposed me to different perspectives. Therefore, I would select option 2: Trust somewhat. \n\n2"]}, {"persona": {"region": "Cairo", "sex": "male", "age": 59, "country": "Egypt", "marital_status": "married", "education": "middle", "social_class": "lower middle class"}, "question": {"id": "Q62", "variant": 0}, "response": ["Based on the anthropological framework, as a married male from Cairo, Egypt, my emic perspective is influenced by the cultural context, individual values, and socioeconomic background. In Egypt, religion plays a significant role in people's lives and societal norms. As a middle-aged man from the lower middle class with a middle education level, I have grown up in a society where religious differences are deeply ingrained. My personal experience and cultural context lead me to trust people of another religion somewhat. While I may not completely trust them due to the societal and cultural differences, I also recognize the importance of coexisting and working together in a diverse society.\n\n2"]}, {"persona": {"region": "Cairo", "sex": "female", "age": 30, "country": "Egypt", "marital_status": "married", "education": "higher", "social_class": "upper middle class"}, "question": {"id": "Q62", "variant": 0}, "response": ["Based on the anthropological framework, my perspective as a married female from Cairo, Egypt, at the age of 30 and part of the upper middle class is heavily influenced by my cultural context, individual values, and personal experiences. In Egypt, religion plays a significant role in people's lives, and there is a strong sense of community within each religious group. However, there have been instances of tension and conflict between different religious communities in the country. As someone with higher education and a relatively privileged socioeconomic background, I have been exposed to a more diverse and inclusive mindset. I have also personally interacted with individuals from different religions and have built trusting relationships with them. Therefore, I would choose option (2) Trust somewhat, as I believe in the importance of mutual respect and understanding among people of different religious backgrounds. \n\n2"]}, {"persona": {"region": "Cairo", "sex": "male", "age": 22, "country": "Egypt", "marital_status": "single", "education": "middle", "social_class": "lower middle class"}, "question": {"id": "Q62", "variant": 0}, "response": ["Based on the anthropological framework, as a single male from Cairo, Egypt, my emic perspective is influenced by my cultural context, individual values, and socioeconomic background. In Egypt, religion plays a significant role in society, and there are distinct differences between the treatment of different religious groups. As a lower middle-class individual, I have witnessed and experienced a lack of trust and discrimination towards people of other religions. This has shaped my personal experience and values, leading me to have a lower level of trust towards people of other religions. Additionally, my age and education level contribute to my understanding of this issue, as I have been exposed to various societal attitudes and beliefs. Therefore, my response is as follows:\n\n3\n\nDo not trust very much"]}, {"persona": {"region": "Cairo", "sex": "male", "age": 29, "country": "Egypt", "marital_status": "single", "education": "higher", "social_class": "lower middle class"}, "question": {"id": "Q62", "variant": 0}, "response": ["Based on the anthropological framework, my emic perspective as a single male from Cairo, Egypt, would be influenced by my cultural context, individual values, and socioeconomic background. In Cairo, religion plays a significant role in people's lives, and there is a strong sense of community within each religious group. However, as someone from the lower middle class, I have likely experienced socioeconomic challenges and may have faced discrimination or prejudice based on my socioeconomic status. This could lead me to have a more nuanced perspective on trusting people from another religion, as I may have personal experiences that influence my trust levels. Additionally, cultural relativism is important to consider, as I understand the importance of respecting different religious beliefs. Therefore, my answer would be influenced by a combination of trust somewhat and do not trust very much, as I may have some level of trust but also some hesitations based on personal experiences and cultural nuances.\n\n2"]}, {"persona": {"region": "Cairo", "sex": "female", "age": 31, "country": "Egypt", "marital_status": "married", "education": "higher", "social_class": "lower middle class"}, "question": {"id": "Q62", "variant": 0}, "response": ["Based on the anthropological framework, as a married female from Cairo, Egypt, my emic perspective is shaped by the cultural context of the city. In Cairo, there is a diverse religious landscape and religious identity is deeply intertwined with social and political life. My individual values and personal experience have also influenced my perception, as I have grown up in a multicultural and multi-faith environment. Additionally, my lower middle class socioeconomic background has shaped my understanding of trust and my interactions with people of different religious backgrounds. Considering the nuanced phrasing of the question and the cultural relativism inherent in my perspective, I would choose option (2) Trust somewhat. \n\n2"]}, {"persona": {"region": "Cairo", "sex": "male", "age": 59, "country": "Egypt", "marital_status": "married", "education": "higher", "social_class": "upper middle class"}, "question": {"id": "Q62", "variant": 0}, "response": ["Based on the anthropological framework, as a married male from Cairo, Egypt, I have been influenced by the cultural context of my upbringing in a predominantly Muslim society. My personal experience and individual values have been shaped by this context, as well as my socioeconomic background as part of the upper middle class. Additionally, the nuance of the question is important, as it asks about trust in people of another religion, not specifying which religion. Therefore, I would choose option 2) Trust somewhat, as I have been taught to be respectful and tolerant of others, but my upbringing and cultural context may lead me to have some reservations about fully trusting those of another religion."]}, {"persona": {"region": "Cairo", "sex": "male", "age": 27, "country": "Egypt", "marital_status": "single", "education": "middle", "social_class": "working class"}, "question": {"id": "Q62", "variant": 0}, "response": ["Based on the anthropological framework, my perspective as a 27-year-old single male from Cairo, Egypt, with a middle education level and working-class background is shaped by my cultural context, individual values, and personal experience. In Egypt, there is a significant cultural and religious diversity, with a predominantly Muslim population, but also a Christian minority. My personal experience and cultural context have exposed me to interactions with individuals from different religions, which has influenced my perception. Additionally, my socioeconomic background as part of the working class has also played a role in shaping my perspective. Taking into account the nuanced phrasing of the question and the cultural relativism aspect, I would choose the following option:\n\n2"]}, {"persona": {"region": "Cairo", "sex": "female", "age": 25, "country": "Egypt", "marital_status": "single", "education": "higher", "social_class": "working class"}, "question": {"id": "Q62", "variant": 0}, "response": ["Based on the anthropological framework, as a single female from Cairo, Egypt, my emic perspective on trust towards people of another religion is influenced by my cultural context, individual values and personal experience, socioeconomic background, and the nuance of the question. In Cairo, there is a history of religious diversity and coexistence, but also occasional tensions between different religious groups. My personal experience and values may lead me to trust somewhat, as I have interacted with people from different religions and have had positive experiences. As a working-class individual, my socioeconomic background may also play a role in my level of trust, as economic disparities can sometimes exacerbate tensions between religious groups. Additionally, the nuanced phrasing of the question allows me to select \"Trust somewhat\" as it reflects my understanding of the complexities of interreligious relationships in my context.\n\n2"]}, {"persona": {"region": "Cairo", "sex": "female", "age": 23, "country": "Egypt", "marital_status": "married", "education": "higher", "social_class": "lower middle class"}, "question": {"id": "Q62", "variant": 0}, "response": ["Based on the anthropological framework, my personal experience and individual values as a 23-year-old married woman from Cairo, Egypt, who comes from the lower middle class, play a significant role in shaping my perspective. Additionally, the cultural context of Egypt, with its diverse religious landscape and historical tensions, also influences my answer. I understand the importance of cultural relativism and the nuance in phrasing the question. Therefore, based on my background and the societal context in which I live, I choose the following option:\n\n2"]}, {"persona": {"region": "Cairo", "sex": "male", "age": 58, "country": "Egypt", "marital_status": "married", "education": "higher", "social_class": "working class"}, "question": {"id": "Q62", "variant": 0}, "response": ["Based on the anthropological framework, my perspective as a married male from Cairo, Egypt, who is 58 years old, completed higher education, and considers himself part of the working class is shaped by my cultural context, individual values, and personal experience. In Cairo, there is a diverse religious landscape, and I have been taught to respect and coexist with people of other religions. My higher education has also taught me to have an open mind and be tolerant of different beliefs. As a member of the working class, I have had interactions with people from various religious backgrounds, which has influenced my trust in them. Therefore, I trust people of other religions somewhat. \n\n2"]}, {"persona": {"region": "Cairo", "sex": "female", "age": 40, "country": "Egypt", "marital_status": "married", "education": "higher", "social_class": "working class"}, "question": {"id": "Q62", "variant": 0}, "response": ["Based on the anthropological framework, my cultural context as a married female from Cairo, Egypt, who is 40 years old and part of the working class, greatly influences my answer to the question. My personal experience and individual values are shaped by the diverse religious landscape of Egypt and the historical coexistence of different religious groups. I am also aware of the socioeconomic background and cultural relativism, which play a role in my perception of trust towards people of another religion. Additionally, the nuance in the phrasing of the question is important as it can impact my response. \n\n2"]}, {"persona": {"region": "Cairo", "sex": "female", "age": 36, "country": "Egypt", "marital_status": "married", "education": "middle", "social_class": "upper middle class"}, "question": {"id": "Q62", "variant": 0}, "response": ["Based on my emic perspective, as a married female from Cairo, Egypt, I have grown up in a cultural context where religion plays a significant role in daily life and societal interactions. My personal experience and individual values are shaped by this context, as well as my socioeconomic background as part of the upper middle class. In Egypt, there is a strong emphasis on tolerance and coexistence among people of different religions, and I have been taught to trust and respect individuals regardless of their religious beliefs. Additionally, I have witnessed the importance of nuance in understanding and interacting with people from diverse religious backgrounds. Therefore, I would trust people of another religion somewhat, as I have been raised to value tolerance and respect for others' religious beliefs.\n\n2"]}, {"persona": {"region": "Cairo", "sex": "male", "age": 40, "country": "Egypt", "marital_status": "married", "education": "middle", "social_class": "lower middle class"}, "question": {"id": "Q62", "variant": 0}, "response": ["Based on the anthropological framework, as a married male from Cairo, Egypt, age 40, with a middle education level and identifying as part of the lower middle class, my perspective on trust towards people of another religion is heavily influenced by my cultural context, individual values, and socioeconomic background. In Egypt, there is a history of religious tensions and discrimination, and as someone from the lower middle class, I may have experienced or witnessed economic disparities that are tied to religious differences. Additionally, my personal experiences and values may lead me to be cautious in trusting people from other religions due to potential social and economic implications. Therefore, I would choose option 3 as my answer.\n\n3"]}, {"persona": {"region": "Cairo", "sex": "female", "age": 30, "country": "Egypt", "marital_status": "married", "education": "middle", "social_class": "lower class"}, "question": {"id": "Q62", "variant": 0}, "response": ["Based on the emic and etic perspectives, as a married female from Cairo, Egypt, I am heavily influenced by the cultural context and religious diversity present in my society. My individual values and personal experience have shaped my understanding of trust towards people of other religions, and my lower socioeconomic background has also influenced my perceptions. As a member of the lower class, I have had limited exposure to individuals of other religions and have primarily interacted with those from my own community. Additionally, cultural relativism plays a significant role in my perspective, as I have been raised to prioritize my own religious beliefs. Therefore, my answer to the question would be based on these factors, and I choose the following option:\n3"]}, {"persona": {"region": "Cairo", "sex": "male", "age": 58, "country": "Egypt", "marital_status": "married", "education": "higher", "social_class": "lower middle class"}, "question": {"id": "Q62", "variant": 0}, "response": ["Based on my cultural context, as a married male from Cairo, Egypt, I am aware of the diverse religious landscape in my country and the historical tensions between different religious groups. My personal experience and individual values have shaped my perception of people from other religions, and while I have interacted with individuals from different religious backgrounds and have had positive experiences, I am also aware of the societal prejudices and discrimination that exist. Additionally, my socioeconomic background as a lower middle class individual has influenced my interactions with people of other religions. Taking into account the principles of cultural relativism and the nuance of the question, I would say that I trust somewhat people of another religion, recognizing that trust is earned through individual interactions and cannot be generalized across an entire religious group.\n\n2"]}, {"persona": {"region": "Cairo", "sex": "male", "age": 50, "country": "Egypt", "marital_status": "married", "education": "middle", "social_class": "lower middle class"}, "question": {"id": "Q62", "variant": 0}, "response": ["Based on the anthropological framework, my emic perspective as a married, middle-aged, lower middle class man from Cairo, Egypt, is shaped by my cultural context, individual values, and personal experience. In Egypt, religion plays a significant role in society, and there is a long history of coexistence between Muslims and Christians. Therefore, my cultural context and personal experience lead me to trust people of another religion somewhat, as I have interacted with individuals from different religious backgrounds in my community and have had positive experiences. Additionally, my socioeconomic background also influences my perspective, as I understand the importance of building relationships and trust in a diverse society in order to navigate social and economic challenges. \n\n2"]}, {"persona": {"region": "Cairo", "sex": "female", "age": 40, "country": "Egypt", "marital_status": "married", "education": "higher", "social_class": "upper middle class"}, "question": {"id": "Q62", "variant": 0}, "response": ["Based on the anthropological framework, my response to the question about trusting people of another religion is deeply influenced by my cultural context in Cairo, Egypt. As a married female from a predominantly Muslim society, the emic perspective within my cultural context may lead me to have certain biases or preconceptions about individuals of other religions. Additionally, my socioeconomic background as part of the upper middle class may also influence my level of trust, as individuals in higher socioeconomic brackets may have more exposure to diverse religious beliefs and may be more open-minded. Furthermore, my personal experiences and individual values play a significant role in shaping my level of trust towards people of another religion. Taking into account the nuance of the question, I would choose option (2) Trust somewhat, as it reflects a balanced approach that acknowledges the complexities of trust in cross-religious interactions. \n\n2"]}, {"persona": {"region": "Cairo", "sex": "female", "age": 33, "country": "Egypt", "marital_status": "married", "education": "middle", "social_class": "lower middle class"}, "question": {"id": "Q62", "variant": 0}, "response": ["Based on the anthropological framework, my response to the question will be influenced by my emic perspective as a married female from Cairo, Egypt, as well as my cultural context and socioeconomic background. In Cairo, there is a diverse religious landscape, and as a lower-middle-class individual, my interactions with individuals of different religions have likely been limited. This, combined with the cultural relativism of Egypt, where people are generally accepting of different religious beliefs, leads me to have a somewhat trusting attitude towards people of another religion. My personal experiences and values also play a role in shaping this perspective, as I have had positive interactions with individuals of different religions in the past, leading me to trust them somewhat.\n\n2"]}, {"persona": {"region": "Cairo", "sex": "female", "age": 37, "country": "Egypt", "marital_status": "married", "education": "middle", "social_class": "lower middle class"}, "question": {"id": "Q62", "variant": 0}, "response": ["Based on the anthropological framework, my cultural context as a married woman from Cairo, Egypt, plays a significant role in how I perceive and answer this question. In Egypt, religion is deeply intertwined with cultural and social life, and there is a long history of coexistence between different religious groups. However, there are also tensions and conflicts between different religious communities. My individual values and personal experiences have shaped my perspective, as well as my lower middle-class socioeconomic background. Additionally, the nuanced phrasing of the question is important, as it asks about trust in people of another religion, rather than trust in a specific individual. Therefore, considering all these factors, I would choose the following option:\n\n2"]}, {"persona": {"region": "Cairo", "sex": "male", "age": 28, "country": "Egypt", "marital_status": "married", "education": "middle", "social_class": "lower middle class"}, "question": {"id": "Q62", "variant": 0}, "response": ["Based on my emic perspective, as a married male from Cairo, Egypt, I have grown up in a society where religion plays a significant role in people's lives and interactions. The cultural context of Cairo is one where religious differences are deeply ingrained in social dynamics, and my personal experience and individual values have shaped my understanding of people from other religions. Additionally, my socioeconomic background as part of the lower middle class has influenced how I perceive and interact with individuals of different religious backgrounds. Moreover, as a 28-year-old, I have witnessed the impact of space and time on religious relations in Cairo. Therefore, my nuanced understanding of trust towards people of another religion is shaped by these factors.\n\n2"]}, {"persona": {"region": "Cairo", "sex": "male", "age": 53, "country": "Egypt", "marital_status": "married", "education": "higher", "social_class": "working class"}, "question": {"id": "Q62", "variant": 0}, "response": ["Based on the anthropological framework, as a married male from Cairo, Egypt, my emic perspective on trust towards people of another religion is shaped by my cultural context, individual values, and socioeconomic background. Egypt is a predominantly Muslim country with a significant Christian minority, and religious tensions have historically existed. My personal experience and values, combined with my working-class background, have influenced my perception of trust towards people of another religion. Additionally, cultural relativism and nuance play a role in my understanding of this question, as the phrasing of the question may impact my response. \n\n3"]}, {"persona": {"region": "Cairo", "sex": "male", "age": 45, "country": "Egypt", "marital_status": "married", "education": "higher", "social_class": "lower middle class"}, "question": {"id": "Q62", "variant": 0}, "response": ["Based on my personal experiences and cultural context as a married male from Cairo, Egypt, I understand the importance of religious diversity in our society. Egypt is a country with a rich history of religious coexistence and tolerance, and as someone with a higher education level and part of the lower middle class, I have interacted with people of different religions throughout my life. I believe in the importance of mutual respect and trust among individuals, regardless of their religious beliefs. While there may be differences in religious practices and traditions, I trust people of other religions to a great extent, as I have personally witnessed the positive impact of interfaith relationships in our community.\n\n2"]}, {"persona": {"region": "Cairo", "sex": "male", "age": 52, "country": "Egypt", "marital_status": "married", "education": "middle", "social_class": "upper middle class"}, "question": {"id": "Q62", "variant": 0}, "response": ["Based on my cultural context and individual values, as a married male from Cairo, Egypt, I understand that the religious diversity in my country is significant. My age and socioeconomic background have also shaped my understanding of the importance of tolerance and respect for different religious beliefs. As part of the upper middle class, I have had the opportunity to interact with individuals from various religious backgrounds and have learned to trust and respect them. My personal experience has shown me that trust is not solely based on religious affiliation, but rather on individual character. Therefore, I believe that I trust people of another religion somewhat, as I have seen the positive impact of interfaith relationships in my community.\n\n2"]}, {"persona": {"region": "Cairo", "sex": "male", "age": 22, "country": "Egypt", "marital_status": "single", "education": "higher", "social_class": "lower middle class"}, "question": {"id": "Q62", "variant": 0}, "response": ["Based on the framework of anthropological methods, my emic perspective as a 22-year-old single male from Cairo, Egypt, who belongs to the lower middle class, is heavily influenced by my cultural context, individual values, and personal experience. In Egypt, religion plays a significant role in societal dynamics, and there is a strong emphasis on respecting and coexisting with people of different religious backgrounds. My personal experience has taught me to trust people of other religions somewhat, as I have had positive interactions and friendships with individuals from different religious communities. Additionally, my socioeconomic background has instilled in me the importance of tolerance and understanding, as I have witnessed firsthand the value of unity within diversity in a diverse and multicultural city like Cairo.\n\n2"]}, {"persona": {"region": "Cairo", "sex": "female", "age": 57, "country": "Egypt", "marital_status": "divorced", "education": "middle", "social_class": "lower middle class"}, "question": {"id": "Q62", "variant": 0}, "response": ["Based on my personal experience and socioeconomic background, I have grown up in a culturally diverse city like Cairo where people from different religions and backgrounds coexist. I have learned to understand and appreciate the diversity of beliefs and values, and I have developed a level of trust for people from other religions. However, due to the societal norms and historical tensions between different religious groups in Egypt, I still have some reservations and do not trust completely. My age and cultural context have also influenced my perspective, as I have witnessed changes in interreligious dynamics over time. Therefore, I would choose option (2) Trust somewhat."]}, {"persona": {"region": "Cairo", "sex": "female", "age": 42, "country": "Egypt", "marital_status": "married", "education": "middle", "social_class": "working class"}, "question": {"id": "Q62", "variant": 0}, "response": ["Based on my cultural context and personal experience as a married female from Cairo, Egypt, I understand the importance of religious diversity and coexistence in our society. Living in a diverse and multicultural city like Cairo, I have been exposed to people of different religious backgrounds and have learned to trust and coexist with them. My middle education level has also taught me to appreciate the value of tolerance and understanding towards people of different religions. As a member of the working class, I have interacted with individuals from various religious backgrounds and have built trust and relationships based on mutual respect and understanding. Therefore, I would choose option (2) Trust somewhat, as I believe in the importance of trust and coexistence with people of another religion. \n\n2"]}, {"persona": {"region": "Cairo", "sex": "female", "age": 23, "country": "Egypt", "marital_status": "single", "education": "middle", "social_class": "lower middle class"}, "question": {"id": "Q62", "variant": 0}, "response": ["Based on the anthropological framework, my individual values and personal experiences as a single female from Cairo, Egypt, play a significant role in shaping my perspective. The cultural context of living in a predominantly Muslim country with a lower middle-class socioeconomic background has influenced my understanding of trust and relationships with people of other religions. My personal experiences and interactions have led me to trust somewhat, as I have had positive interactions with individuals of other religions, but I am also aware of the societal and cultural factors that may impact trust levels. Therefore, my answer is:\n\n2"]}, {"persona": {"region": "Cairo", "sex": "female", "age": 28, "country": "Egypt", "marital_status": "married", "education": "higher", "social_class": "upper middle class"}, "question": {"id": "Q62", "variant": 0}, "response": ["Based on the anthropological framework, my emic perspective as a married female from Cairo, Egypt, would be influenced by the cultural context of living in a predominantly Muslim society. My individual values and personal experiences, as well as my socioeconomic background as part of the upper middle class, would also play a significant role in shaping my perception. Cultural relativism is important to consider, as it reminds us that my perspective is not objectively superior to others. Additionally, space and time are important factors, and my age and place of living in Cairo would influence my trust in people of another religion. Lastly, the nuanced phrasing of the question is crucial in understanding my response.\n\n2"]}, {"persona": {"region": "Cairo", "sex": "female", "age": 22, "country": "Egypt", "marital_status": "single", "education": "higher", "social_class": "lower middle class"}, "question": {"id": "Q62", "variant": 0}, "response": ["Based on my emic perspective, as a single female from Cairo, Egypt, I have grown up in a cultural context where religion plays a significant role in people's lives. My personal experience and individual values have shaped my perception of people of different religions. Additionally, my lower middle class socioeconomic background has also influenced my interactions with individuals of different faiths. I understand the importance of cultural relativism and recognize that my age and place in society also play a role in my trust towards people of another religion. Therefore, my nuanced understanding leads me to choose option (2) Trust somewhat.\n\n2"]}, {"persona": {"region": "Cairo", "sex": "female", "age": 39, "country": "Egypt", "marital_status": "married", "education": "middle", "social_class": "lower middle class"}, "question": {"id": "Q62", "variant": 0}, "response": ["Based on my emic perspective as a married female from Cairo, Egypt, and considering the cultural context of my surroundings, I understand that my trust in people of another religion is heavily influenced by my personal experience and individual values. Being part of the lower middle class, I have had limited exposure to people of other religions and have been taught to be cautious and reserved in my interactions with them. Additionally, the socio-economic background of my community often perpetuates a sense of mistrust and division between different religious groups. Therefore, based on these factors, I would have to select option (3) Do not trust very much."]}, {"persona": {"region": "Cairo", "sex": "male", "age": 19, "country": "Egypt", "marital_status": "single", "education": "middle", "social_class": "working class"}, "question": {"id": "Q62", "variant": 0}, "response": ["Based on the anthropological framework, my perspective as a 19-year-old single male from Cairo, Egypt, who has completed middle education and considers himself part of the working class, is heavily influenced by my cultural context, individual values, and personal experiences. Living in a diverse and religiously oriented society, I have been taught to respect and coexist with people of different religious beliefs. However, due to societal and political tensions, I have also experienced instances of mistrust and discrimination towards people of different religions. My socioeconomic background also plays a role, as the working class often faces economic struggles, which can lead to interreligious tension. Therefore, my perspective on trusting people of another religion would be a cautious \"Trust somewhat.\"\n\n2"]}, {"persona": {"region": "Cairo", "sex": "female", "age": 54, "country": "Egypt", "marital_status": "married", "education": "middle", "social_class": "working class"}, "question": {"id": "Q62", "variant": 0}, "response": ["Based on the anthropological framework, my perspective as a married female from Cairo, Egypt, at 54 years of age and from the working class, is heavily influenced by my cultural context, individual values, and personal experiences. Egypt has a diverse religious landscape, and as someone who has grown up in this environment, I have learned to navigate interactions with people of different religions. My middle education level and socioeconomic background also play a role in shaping my perceptions. Additionally, cultural relativism is important to consider, as Egypt has a long history of religious coexistence. Therefore, my answer reflects a nuanced understanding of trust towards people of another religion, taking into account my personal experiences and cultural context.\n\n3"]}, {"persona": {"region": "Cairo", "sex": "male", "age": 30, "country": "Egypt", "marital_status": "married", "education": "higher", "social_class": "working class"}, "question": {"id": "Q62", "variant": 0}, "response": ["Based on the anthropological framework, my perspective as a married male from Cairo, Egypt, who is 30 years old and part of the working class, is heavily influenced by my cultural context, individual values, and personal experience. In Egypt, religion plays a significant role in shaping social dynamics and interactions. My experiences and personal values have been shaped by growing up in a predominantly Muslim society, which may lead me to have a higher level of trust in people of the same religion. Additionally, the socioeconomic background of being part of the working class may have also influenced my interactions with people of different religions, potentially leading to a more cautious approach. Ultimately, the nuanced phrasing of the question and the influence of cultural relativism means that my response may not fit neatly into the options provided, but it will be a reflection of my unique cultural and individual context.\n\n2"]}, {"persona": {"region": "Cairo", "sex": "male", "age": 39, "country": "Egypt", "marital_status": "married", "education": "higher", "social_class": "lower middle class"}, "question": {"id": "Q62", "variant": 0}, "response": ["Based on the anthropological framework, my answer to the question of how much I trust people of another religion is influenced by my cultural context, individual values, socioeconomic background, and space and time. In Cairo, Egypt, there is a diverse religious landscape with a significant Muslim majority. As a member of the lower middle class who has completed higher education, I have likely been exposed to different perspectives and have a nuanced understanding of interreligious relationships. Additionally, at 39 years old, I have lived through periods of religious tension and harmony in Egypt. Therefore, considering all these factors, I would choose option (2) Trust somewhat. \n\n2"]}, {"persona": {"region": "Cairo", "sex": "female", "age": 41, "country": "Egypt", "marital_status": "married", "education": "middle", "social_class": "lower middle class"}, "question": {"id": "Q62", "variant": 0}, "response": ["Based on my emic perspective as a married female from Cairo, Egypt, I understand that there are in-group ways of thinking about trust towards people of another religion. The cultural context of Egypt, including its diverse religious landscape and historical tensions, plays a significant role in shaping my perceptions. My individual values and personal experiences, as well as my socioeconomic background as part of the lower middle class, also influence my level of trust. Additionally, the concept of cultural relativism reminds me that different religious backgrounds and beliefs are not inherently better or worse than my own. Therefore, my answer to the question would be to trust somewhat, taking into consideration the complexities and nuances of interreligious relationships in the Egyptian context.\n\n2"]}, {"persona": {"region": "Cairo", "sex": "male", "age": 45, "country": "Syria", "marital_status": "single", "education": "higher", "social_class": "upper middle class"}, "question": {"id": "Q62", "variant": 0}, "response": ["Based on the anthropological framework, as a single male from Cairo, Syria, my emic perspective is influenced by my cultural context, individual values, socioeconomic background, and space and time. Growing up in a predominantly Muslim society, I have been taught to have a certain level of distrust towards people of other religions. However, my higher education and upper middle-class status have exposed me to more diverse perspectives, leading me to trust people of other religions somewhat. This nuanced understanding is also influenced by my age and place, as I have seen the impact of interreligious relationships in my community. Therefore, my answer to the question would be:\n\n2"]}, {"persona": {"region": "Cairo", "sex": "male", "age": 54, "country": "Egypt", "marital_status": "married", "education": "higher", "social_class": "lower middle class"}, "question": {"id": "Q62", "variant": 0}, "response": ["Based on my emic perspective as a married male from Cairo, Egypt, I have been raised in a cultural context where religion plays a significant role in shaping social and political dynamics. My individual values and personal experience have influenced my perception of people from different religions, and I understand the importance of respecting and trusting individuals regardless of their religious beliefs. Additionally, my socioeconomic background as part of the lower middle class has taught me to be open-minded and to value diversity. Considering the cultural relativism in Egypt, where coexistence among different religious groups is common, I believe that trust is essential for social harmony. However, nuance is crucial in this matter, as historical and political factors may also influence the level of trust. Therefore, my perspective is to trust somewhat people of another religion. \n\n2"]}, {"persona": {"region": "Cairo", "sex": "male", "age": 65, "country": "Egypt", "marital_status": "married", "education": "middle", "social_class": "upper middle class"}, "question": {"id": "Q62", "variant": 0}, "response": ["Based on my cultural context as a married male from Cairo, Egypt, I have grown up in a predominantly Muslim society with a strong emphasis on religious identity. My age and educational background have also shaped my perceptions and attitudes towards people of other religions. Being part of the upper middle class, I have had the privilege of interacting with individuals from different socioeconomic backgrounds and have developed a nuanced understanding of cultural relativism. While I may have some level of trust in people of another religion, my personal experience and values may also influence my level of trust. Additionally, considering the historical and contemporary religious tensions in Egypt, my answer may vary based on the specific religious group in question. \n\n3"]}, {"persona": {"region": "Cairo", "sex": "female", "age": 52, "country": "Egypt", "marital_status": "married", "education": "middle", "social_class": "upper middle class"}, "question": {"id": "Q62", "variant": 0}, "response": ["Based on the anthropological framework, my perspective as a 52-year-old woman from Cairo, Egypt, is influenced by my cultural context, individual values, and socioeconomic background. As a member of the upper middle class in Cairo, I have been exposed to diverse religious communities and have developed a nuanced understanding of religious trust. In Cairo, where people of different religions coexist, it is important to trust and respect individuals regardless of their religious beliefs. Additionally, my middle education level has provided me with a broader perspective on the importance of religious tolerance and coexistence in a diverse society. Therefore, I would select option (2) Trust somewhat, as I believe in the importance of building trust and understanding with people of other religions. \n\n2"]}, {"persona": {"region": "Cairo", "sex": "male", "age": 26, "country": "Egypt", "marital_status": "single", "education": "higher", "social_class": "lower middle class"}, "question": {"id": "Q62", "variant": 0}, "response": ["From the perspective of a single male from Cairo, Egypt, who is 26 years old, completed higher education, and considers himself part of the lower middle class, it is important to consider the cultural context, individual values, and socioeconomic background when answering the question. In Cairo, there is a diverse religious landscape with a predominantly Muslim population, but also a significant Christian minority. As a member of the lower middle class, social interactions and trust are often influenced by economic factors. Additionally, personal experiences and values will play a significant role in shaping perceptions of people from other religions. Finally, cultural relativism is important to consider, as Egypt has a long history of religious coexistence and interaction. Based on these factors, the chosen answer is:\n\n2"]}, {"persona": {"region": "Cairo", "sex": "male", "age": 32, "country": "Egypt", "marital_status": "married", "education": "middle", "social_class": "working class"}, "question": {"id": "Q62", "variant": 0}, "response": ["Based on the anthropological framework, my perspective as a married male from Cairo, Egypt, who is 32 years old and part of the working class, is heavily influenced by my cultural context, individual values, and socioeconomic background. In Egypt, there is a significant divide between Muslims and Christians, and this has been a source of tension for many years. As a working-class individual, I have likely experienced economic hardships and may feel a sense of competition or resentment towards people of a different religion due to the socioeconomic disparities present in my community. Additionally, my personal experiences and values may have been shaped by the cultural and religious dynamics in Egypt. Therefore, I am likely to have a lower level of trust towards people of another religion, as it is ingrained in my cultural context and personal experiences. \n\n3"]}, {"persona": {"region": "Cairo", "sex": "male", "age": 38, "country": "Egypt", "marital_status": "married", "education": "middle", "social_class": "lower middle class"}, "question": {"id": "Q62", "variant": 0}, "response": ["From the perspective of a married male from Cairo, Egypt, with a middle education level and lower middle-class background, the answer to the question of how much trust is placed in people of another religion will be heavily influenced by cultural context, individual values, and personal experience. In Cairo, there is a complex and diverse religious landscape, with a large Muslim majority but also significant Christian and other religious communities. The individual's personal experience and values, influenced by this cultural context, may lead to a nuanced understanding of trust towards people of another religion. Additionally, socioeconomic background, including education level and class, may also play a role in shaping this perspective. \n\n5"]}, {"persona": {"region": "Cairo", "sex": "male", "age": 58, "country": "Egypt", "marital_status": "married", "education": "higher", "social_class": "upper middle class"}, "question": {"id": "Q62", "variant": 0}, "response": ["Based on the anthropological framework, as a married male from Cairo, Egypt, cultural context plays a pivotal role in understanding and answering this question. Egypt is a country with a predominantly Muslim population, and as an upper middle-class individual who has completed higher education, I have been socialized within this cultural context. Furthermore, my age and socioeconomic background also influence my perspective. Considering the historical and political tensions between different religious groups in Egypt, along with my personal experiences and values, I would choose option (2) Trust somewhat. This choice reflects the nuanced and complex nature of interreligious relationships in Cairo, where I acknowledge the potential for trust but also recognize the challenges and tensions that exist. \n\n2"]}, {"persona": {"region": "Cairo", "sex": "male", "age": 49, "country": "Egypt", "marital_status": "married", "education": "middle", "social_class": "lower middle class"}, "question": {"id": "Q62", "variant": 0}, "response": ["Based on my emic perspective as a married male from Cairo, Egypt, and considering the cultural context and my individual values, I would say that I trust people of another religion somewhat. In Egypt, there is a long history of religious diversity and coexistence, even though there have been instances of tension. I have personally had positive interactions with people of different religious backgrounds, and I understand the importance of mutual respect and understanding. However, due to the socioeconomic background and cultural relativism, there may be some underlying mistrust or apprehension, especially in light of certain societal and political dynamics. Overall, my trust in people of another religion is influenced by a complex interplay of factors, and I believe that my perspective reflects the nuanced phrasing of the question.\n\n2"]}, {"persona": {"region": "Cairo", "sex": "female", "age": 29, "country": "Egypt", "marital_status": "married", "education": "middle", "social_class": "working class"}, "question": {"id": "Q62", "variant": 0}, "response": ["Based on the anthropological framework, as a married female from Cairo, Egypt, my emic perspective is influenced by the cultural context of living in a predominantly Muslim society, where there is a strong emphasis on religious identity. My personal experience and individual values are shaped by this cultural context, as well as my socioeconomic background as a working-class woman with a middle education level. Cultural relativism is important to consider, as there is a diversity of religious beliefs within Egypt, and nuance in the phrasing of the question is crucial. Therefore, considering all these factors, I would choose option (2) Trust somewhat. \n\n2"]}, {"persona": {"region": "Cairo", "sex": "female", "age": 36, "country": "Egypt", "marital_status": "married", "education": "higher", "social_class": "lower middle class"}, "question": {"id": "Q62", "variant": 0}, "response": ["Based on the anthropological framework, my perspective as a married female from Cairo, Egypt, is influenced by a combination of cultural context, individual values, and socioeconomic background. In Cairo, there is a diverse religious landscape with a strong Muslim majority and significant Christian and other religious communities. As a lower middle class woman who has completed higher education, I have been exposed to different perspectives and have interacted with people from various religious backgrounds. My trust in people of another religion would be influenced by my personal experiences and the cultural relativism that is prevalent in my society. Additionally, my age and education level have likely broadened my understanding of the world and my ability to empathize with others. Therefore, my answer to the question is:\n3\n\n(3) Do not trust very much"]}, {"persona": {"region": "Cairo", "sex": "female", "age": 34, "country": "Egypt", "marital_status": "married", "education": "middle", "social_class": "lower middle class"}, "question": {"id": "Q62", "variant": 0}, "response": ["From the perspective of a married woman from Cairo, Egypt, who is 34 years old, has completed middle education, and considers herself part of the lower middle class, it is important to consider the cultural context and individual values in answering this question. In Egypt, there is a complex religious landscape with a predominantly Muslim population and a significant Coptic Christian minority. The cultural context and individual values in this setting would likely lead to a nuanced understanding of trust towards people of another religion. As a member of the lower middle class, the individual may have personal experiences and interactions with people of other religions that have shaped their perspective. Additionally, the socioeconomic background and cultural relativism play a role in influencing trust towards people of another religion. Taking these factors into account, the persona may choose option (2) Trust somewhat, as the cultural context and individual values may lead to a moderate level of trust towards people of another religion. \n\n2"]}, {"persona": {"region": "Fayoum", "sex": "male", "age": 57, "country": "Egypt", "marital_status": "married", "education": "middle", "social_class": "working class"}, "question": {"id": "Q62", "variant": 0}, "response": ["Based on my emic perspective as a married male from Fayoum, Egypt, and considering my age, educational level, and working-class background, my cultural context and individual values and personal experience lead me to understand that trust in people of another religion may vary. In my community, there is a history of coexistence between different religious groups, and I have personal relationships with individuals from various religious backgrounds. However, socioeconomic background and cultural relativism also play a role in shaping my perspective. While I may have some level of trust in people of another religion based on my personal experiences, I am also aware of the societal and historical factors that may impact trust between different religious groups. Therefore, my response to the question would be:\n3\n\n (3) Do not trust very much"]}, {"persona": {"region": "Fayoum", "sex": "male", "age": 60, "country": "Egypt", "marital_status": "married", "education": "middle", "social_class": "lower middle class"}, "question": {"id": "Q62", "variant": 0}, "response": ["Based on my cultural context, as a married male from Fayoum, Egypt, my trust in people of another religion is influenced by the religious diversity in my community. My socioeconomic background as part of the lower middle class has also shaped my perception of people from different religions. Additionally, my age and education level play a role in how I view individuals from other religious backgrounds. Considering the cultural relativism and the nuanced phrasing of the question, I would choose the following option:\n\n2"]}, {"persona": {"region": "Fayoum", "sex": "male", "age": 21, "country": "Egypt", "marital_status": "single", "education": "middle", "social_class": "lower middle class"}, "question": {"id": "Q62", "variant": 0}, "response": ["Based on the anthropological framework, my response to the question of how much I trust people of another religion is heavily influenced by my cultural context, individual values, and socioeconomic background. As a 21-year-old male from Fayoum, Egypt, who has completed middle education and considers himself part of the lower middle class, my perception of people from other religions may be shaped by the historical and cultural context of religious diversity in Egypt. My personal experience and values may lead me to have a somewhat cautious approach to trusting people of another religion, as I may have limited exposure to individuals from different religious backgrounds. Additionally, my socioeconomic background may influence my interactions with people of other religions, as factors such as education and social networks can impact the level of trust I have in individuals from different religious communities.\n\n2"]}, {"persona": {"region": "Fayoum", "sex": "male", "age": 33, "country": "Egypt", "marital_status": "single", "education": "higher", "social_class": "working class"}, "question": {"id": "Q62", "variant": 0}, "response": ["Based on my emic perspective as a single male from Fayoum, Egypt, and my personal experience, I understand that the cultural context and my socioeconomic background play a significant role in shaping my views on trusting people of another religion. Egypt is a diverse country with a rich history of coexistence among different religious groups. However, there have been tensions and conflicts between different religious communities in recent years. Additionally, as a working-class individual, I have been affected by the socioeconomic disparities in my community, which can influence my level of trust in people of another religion. Therefore, based on these factors, I would choose option (2) Trust somewhat.\n\n2"]}, {"persona": {"region": "Fayoum", "sex": "male", "age": 32, "country": "Egypt", "marital_status": "married", "education": "higher", "social_class": "lower middle class"}, "question": {"id": "Q62", "variant": 0}, "response": ["Based on the anthropological framework, my perspective as a married male from Fayoum, Egypt, would be influenced by my cultural context, individual values, and socioeconomic background. As part of the lower middle class, I have likely had limited exposure to people of other religions and may have been influenced by societal biases. Additionally, my higher education level may have exposed me to more diverse perspectives, but my personal experiences and cultural context may still play a significant role in shaping my views. Considering the nuanced phrasing of the question, I would choose option (2) Trust somewhat, as I may have some level of trust in people of other religions, but my personal experiences and cultural context may lead me to exercise caution in fully trusting individuals from different religious backgrounds. \n\n2"]}, {"persona": {"region": "Gharbia", "sex": "male", "age": 42, "country": "Egypt", "marital_status": "married", "education": "higher", "social_class": "upper middle class"}, "question": {"id": "Q62", "variant": 0}, "response": ["Based on the anthropological framework, my emic perspective as a married male from Gharbia, Egypt, includes the cultural context of living in a predominantly Muslim society with a strong emphasis on religious identity. My individual values and personal experience have led me to have a high level of trust in people of other religions, as I have been exposed to diversity and have had positive interactions with individuals from different religious backgrounds. Additionally, my socioeconomic background as part of the upper middle class has afforded me the opportunity for education and exposure to different cultures, leading to a more inclusive and open-minded perspective. My age and education have also contributed to my nuanced understanding of religious diversity and my ability to trust people of another religion. Therefore, my perspective is one of trust and respect for people of all religions, as I believe in cultural relativism and value diversity in my interactions with others.\n\n2"]}, {"persona": {"region": "Gharbia", "sex": "male", "age": 52, "country": "Egypt", "marital_status": "married", "education": "middle", "social_class": "working class"}, "question": {"id": "Q62", "variant": 0}, "response": ["Based on the anthropological framework, as a married male from Gharbia, Egypt, with a working-class background, my personal values and cultural context are pivotal in shaping my perspective. In this region, there is a strong emphasis on religious identity and the importance of maintaining trust within the community. However, socioeconomic background also plays a role, as individuals from different religions may have different socioeconomic statuses. Additionally, cultural relativism is important to consider, as there is a history of religious diversity within Egypt. Therefore, my response is rooted in my personal and cultural experience, acknowledging the complexity of interreligious relationships in my community.\n\n2"]}, {"persona": {"region": "Gharbia", "sex": "male", "age": 45, "country": "Egypt", "marital_status": "divorced", "education": "higher", "social_class": "upper middle class"}, "question": {"id": "Q62", "variant": 0}, "response": ["Based on the anthropological framework, as a divorced male from Gharbia, Egypt, who is 45 years old and part of the upper middle class, my emic perspective is influenced by my personal experience and individual values. Additionally, the cultural context of Egypt, including its religious diversity, informs my understanding. My socioeconomic background also plays a role in how I perceive and interact with people of other religions. Considering the nuanced phrasing of the question, I would choose to trust somewhat. This choice reflects my understanding of cultural relativism and the importance of nuanced responses in anthropological research.\n\n2"]}, {"persona": {"region": "Behaira", "sex": "male", "age": 23, "country": "Egypt", "marital_status": "single", "education": "middle", "social_class": "lower class"}, "question": {"id": "Q62", "variant": 0}, "response": ["Based on my emic perspective, coming from Behaira, Egypt, I have been surrounded by a predominantly Muslim community, and there is a strong emphasis on religious unity and trust within our own religious group. However, from an etic perspective, I understand that there are people from different religions who may have different values and beliefs. This cultural context has shaped my understanding of people from other religions and has led me to be cautious in trusting them completely. Additionally, my lower socioeconomic background has limited my exposure to people from other religions, so I cannot confidently say that I trust them completely. Therefore, I would choose option (2) Trust somewhat. \n\n2"]}, {"persona": {"region": "Behaira", "sex": "male", "age": 38, "country": "Egypt", "marital_status": "single", "education": "higher", "social_class": "lower class"}, "question": {"id": "Q62", "variant": 0}, "response": ["Based on the anthropological framework, as a single male from Behaira, Egypt, my emic perspective on trusting people of another religion is heavily influenced by the cultural context of where I come from and the socioeconomic background I belong to. Behaira is a diverse region with a mix of religious beliefs, and my lower-class status means that I may have had limited interactions with people of other religions due to socioeconomic segregation. Additionally, my personal experiences and values may have been shaped by this lack of interaction, leading me to be more cautious in trusting people of another religion. Therefore, I would choose option (3) Do not trust very much. \n\n3"]}, {"persona": {"region": "Behaira", "sex": "male", "age": 32, "country": "Egypt", "marital_status": "married", "education": "middle", "social_class": "lower class"}, "question": {"id": "Q62", "variant": 0}, "response": ["Based on the anthropological framework, my response is influenced by my emic perspective as a married male from Behaira, Egypt, and my cultural context as a member of the lower class. My personal experiences and values also play a role in shaping my response. Considering these factors, I would choose option 2: Trust somewhat. This choice reflects the nuanced understanding of the question, taking into account the socio-economic background, cultural relativism, and space and time factors."]}, {"persona": {"region": "Behaira", "sex": "female", "age": 37, "country": "Egypt", "marital_status": "married", "education": "middle", "social_class": "working class"}, "question": {"id": "Q62", "variant": 0}, "response": ["Based on the anthropological framework, as a married female from Behaira, Egypt, my emic perspective is shaped by the cultural context of my upbringing, which includes being part of a predominantly Muslim community. My individual values and personal experience also play a role in shaping my views, as I have had limited exposure to people of other religions due to my socioeconomic background and education level. Additionally, cultural relativism is important, as I understand that my perspective may differ from others due to space and time factors. Therefore, based on my understanding and experience, I would choose option (2) Trust somewhat."]}, {"persona": {"region": "Behaira", "sex": "male", "age": 48, "country": "Egypt", "marital_status": "married", "education": "middle", "social_class": "working class"}, "question": {"id": "Q62", "variant": 0}, "response": ["Based on the anthropological framework, my emic perspective as a married male from Behaira, Egypt, with a middle education level and part of the working class, is heavily influenced by my cultural context, individual values, and personal experiences. In Egypt, there is a diversity of religious beliefs, and my cultural context has taught me to be respectful and tolerant of people from different religions. Additionally, my personal experiences have led me to interact and work with individuals from various religious backgrounds, which has shaped my understanding and trust in people of other religions. Given my socioeconomic background and the cultural relativism I adhere to, I would say I trust somewhat, recognizing that trust may vary based on individual interactions and experiences.\n\n2"]}, {"persona": {"region": "Behaira", "sex": "female", "age": 34, "country": "Egypt", "marital_status": "married", "education": "middle", "social_class": "lower class"}, "question": {"id": "Q62", "variant": 0}, "response": ["Based on my personal experience and cultural context as a married female from Behaira, Egypt, who is part of the lower class and has completed middle education level, I understand that trust in people of another religion is influenced by a combination of individual values, cultural context, and socioeconomic background. In my community, there may be limited interaction with people from different religions, and the media portrayal of other religious groups may shape my perceptions. Additionally, my lower socioeconomic status may impact my trust in others, as economic disparities can lead to feelings of distrust. Therefore, my response to the question would be (3) Do not trust very much."]}, {"persona": {"region": "Behaira", "sex": "female", "age": 30, "country": "Egypt", "marital_status": "divorced", "education": "lower", "social_class": "lower class"}, "question": {"id": "Q62", "variant": 0}, "response": ["Based on my emic perspective, as a divorced woman from Behaira, Egypt, I have been raised in a predominantly Muslim community where there is a strong sense of loyalty and trust within the religious group. However, my lower socioeconomic background and limited education have also exposed me to instances of discrimination and economic hardship, which may have influenced my personal experiences and values. Considering the cultural context of my upbringing, I have been taught to be cautious of people from other religions, as there is a historical and cultural divide that has perpetuated a lack of trust. Additionally, my individual values and personal experiences have led me to believe that there may be a lack of understanding and acceptance from individuals of other religions. Therefore, I would select option (3) Do not trust very much."]}, {"persona": {"region": "Behaira", "sex": "male", "age": 40, "country": "Egypt", "marital_status": "married", "education": "higher", "social_class": "lower middle class"}, "question": {"id": "Q62", "variant": 0}, "response": ["Based on the anthropological framework, as a married male from Behaira, Egypt, my emic perspective on trusting people of another religion is influenced by my cultural context, individual values and personal experience, socioeconomic background, and the nuance of the question. In Behaira, there is a mix of religious and cultural traditions, and while I may have personal experiences of positive interactions with people of other religions, the societal and economic pressures of the lower middle class may play a role in influencing my trust levels. Additionally, the nuanced phrasing of the question can impact my response as well. Given these factors, my response is:\n\n2"]}, {"persona": {"region": "Behaira", "sex": "male", "age": 38, "country": "Egypt", "marital_status": "married", "education": "middle", "social_class": "working class"}, "question": {"id": "Q62", "variant": 0}, "response": ["Based on the anthropological framework, as a married male from Behaira, Egypt, my emic perspective is heavily influenced by my cultural context, individual values, and socioeconomic background. In Behaira, there is a strong sense of community and religious identity, and people often rely on close-knit kinship networks for support. My middle education level and working-class status also shape my perspective, as I may have limited exposure to people of other religions and may feel more economically vulnerable. Additionally, the cultural relativism in Egypt means that there is a strong emphasis on respecting and valuing different religious beliefs. Therefore, based on these factors, I would choose option (2) Trust somewhat, as I would have some level of trust in people of another religion, but my personal experiences and cultural context may lead me to have some reservations."]}, {"persona": {"region": "Behaira", "sex": "female", "age": 30, "country": "Egypt", "marital_status": "married", "education": "higher", "social_class": "lower class"}, "question": {"id": "Q62", "variant": 0}, "response": ["Based on the anthropological framework, as a married female from Behaira, Egypt, my emic perspective is shaped by my cultural context, individual values, and socioeconomic background. Egypt is a predominantly Muslim country and there is a history of religious tensions. My personal experience and cultural background have influenced my perception of people from other religions. As a lower-class woman, I have had limited interaction with people from other religions and have heard negative stereotypes about them. Therefore, I am more likely to be cautious and not trust people of another religion very much. \n\n3"]}, {"persona": {"region": "Behaira", "sex": "female", "age": 35, "country": "Egypt", "marital_status": "married", "education": "middle", "social_class": "working class"}, "question": {"id": "Q62", "variant": 0}, "response": ["Based on the anthropological framework, my perspective as a married female from Behaira, Egypt, is shaped by my cultural context, individual values, and socioeconomic background. In Behaira, there is a mix of religious communities and I have been taught to be open-minded and respectful towards people of other religions. Additionally, as a working-class woman who has completed middle education, I have had the opportunity to interact with individuals from diverse backgrounds and have learned to trust and coexist with people of different religious beliefs. My personal experience has led me to trust people of other religions somewhat, as I believe in the importance of understanding and respecting others' beliefs.\n\n2"]}, {"persona": {"region": "Behaira", "sex": "male", "age": 52, "country": "Egypt", "marital_status": "married", "education": "middle", "social_class": "lower class"}, "question": {"id": "Q62", "variant": 0}, "response": ["Based on the anthropological framework, as a married male from Behaira, Egypt, my emic perspective would be influenced by the cultural context of being part of a predominantly Muslim community. My personal experience and individual values would also play a significant role in shaping my trust towards people of another religion. Considering my lower class socioeconomic background, I might have limited exposure to people of different religions and therefore may not trust them very much due to lack of familiarity and potential social and economic differences. Additionally, the cultural relativism of my community may also influence my perception and trust towards people of another religion. Therefore, based on these factors, I would choose option (3) Do not trust very much.\n\n3"]}, {"persona": {"region": "Alexandria", "sex": "female", "age": 41, "country": "Egypt", "marital_status": "single", "education": "middle", "social_class": "lower class"}, "question": {"id": "Q62", "variant": 0}, "response": ["Based on the anthropological framework, as a single female from Alexandria, Egypt, who is part of the lower class and has completed middle education level, my emic perspective would be influenced by my cultural context, individual values, and socioeconomic background. Living in a diverse city like Alexandria, I have been exposed to people of different religions and have learned to coexist with them. However, my lower socioeconomic background may have limited my interactions with people of other religions, leading to a somewhat cautious approach. Additionally, my personal experiences and values may have shaped my perception, making me more skeptical of those from different religious backgrounds. Therefore, I would choose option (2) Trust somewhat. \n\n2"]}, {"persona": {"region": "Alexandria", "sex": "female", "age": 21, "country": "Egypt", "marital_status": "single", "education": "middle", "social_class": "lower class"}, "question": {"id": "Q62", "variant": 0}, "response": ["Based on the anthropological framework, my emic perspective as a single female from Alexandria, Egypt, who is 21 years old and part of the lower class, is heavily influenced by my cultural context, individual values, and socioeconomic background. In Egypt, religious identity is a significant factor in social interactions and trust. Additionally, my personal experiences and values as a lower-class woman may lead me to have limited exposure to people of other religions, which may impact my level of trust. Furthermore, the cultural relativism of Egyptian society may also contribute to a nuanced understanding of trust towards people of other religions. Therefore, my answer to the question is based on my unique position within Egyptian society.\n\n3"]}, {"persona": {"region": "Alexandria", "sex": "female", "age": 35, "country": "Egypt", "marital_status": "married", "education": "middle", "social_class": "lower class"}, "question": {"id": "Q62", "variant": 0}, "response": ["Based on my Emic perspective, coming from Alexandria, Egypt, and being part of the lower class, I am surrounded by people of different religions on a daily basis. The cultural context in which I live values tolerance and mutual respect among different religious groups. My individual values and personal experiences have taught me to trust somewhat people of another religion, as I have had positive interactions with individuals from different religious backgrounds. My socioeconomic background also plays a role, as I have not had the opportunity for higher education or exposure to different perspectives. Additionally, the nuance of the question is important, as the level of trust may vary depending on the specific individual and their actions, rather than solely based on their religion.\n\n2"]}, {"persona": {"region": "Alexandria", "sex": "male", "age": 34, "country": "Egypt", "marital_status": "married", "education": "higher", "social_class": "working class"}, "question": {"id": "Q62", "variant": 0}, "response": ["Based on my personal experience and cultural context as a married male from Alexandria, Egypt, I understand the importance of religious diversity and coexistence in our society. My education has taught me to appreciate and respect different religious beliefs, and my working-class background has exposed me to interactions with people from various religious backgrounds. Additionally, cultural relativism and the understanding of emic and etic perspectives have shaped my open-mindedness towards people of other religions. Therefore, I would choose option 2) Trust somewhat, as I believe in giving individuals the benefit of the doubt while also being cautious and aware of potential differences in beliefs and practices."]}, {"persona": {"region": "Alexandria", "sex": "female", "age": 37, "country": "Egypt", "marital_status": "married", "education": "higher", "social_class": "lower middle class"}, "question": {"id": "Q62", "variant": 0}, "response": ["Based on my cultural context as a married female from Alexandria, Egypt, my understanding of trust towards people of another religion is influenced by the emic and etic perspectives prevalent in my community. The historical and cultural context of Egypt, as well as my personal values and individual experiences, play a significant role in shaping my perceptions. Additionally, my socioeconomic background as part of the lower middle class has influenced my interactions with people of different religious backgrounds. Furthermore, cultural relativism and the nuances of the question also influence my response. Therefore, my answer is:\n2"]}, {"persona": {"region": "Alexandria", "sex": "female", "age": 56, "country": "Egypt", "marital_status": "divorced", "education": "middle", "social_class": "working class"}, "question": {"id": "Q62", "variant": 0}, "response": ["Based on the anthropological framework, as a divorced female from Alexandria, Egypt, I would consider my cultural context and personal experience as a pivotal factor in my perception of people of another religion. Being part of the working class in a diverse city like Alexandria, I understand the importance of cultural relativism and the nuances of different religions. My middle education level has also taught me to be open-minded and understanding of different perspectives. Therefore, I would choose option (2) Trust somewhat. While I may not trust completely due to my own personal experiences and cultural context, I would not completely discount the trustworthiness of people from another religion."]}, {"persona": {"region": "Alexandria", "sex": "male", "age": 48, "country": "Egypt", "marital_status": "married", "education": "higher", "social_class": "working class"}, "question": {"id": "Q62", "variant": 0}, "response": ["Based on the anthropological framework, as a married male from Alexandria, Egypt, my emic perspective is influenced by cultural context, individual values, and personal experience. The cultural context of Alexandria includes a diverse population with a long history of coexistence among people of different religions. My personal experience and individual values also emphasize the importance of tolerance and understanding. As part of the working class, I am accustomed to interacting with people of various backgrounds and religions, and I have learned to trust and cooperate with others regardless of their religious beliefs. Therefore, my answer to the question would be:\n\n2"]}, {"persona": {"region": "Alexandria", "sex": "female", "age": 30, "country": "Egypt", "marital_status": "married", "education": "middle", "social_class": "working class"}, "question": {"id": "Q62", "variant": 0}, "response": ["Based on the anthropological framework, I would answer this question by considering my emic perspective as a married female from Alexandria, Egypt, where religious diversity is common and cultural context is pivotal in understanding the dynamics between different religious groups. As a member of the working class, my socioeconomic background and personal experience also play a role in shaping my perceptions. Furthermore, cultural relativism is crucial in understanding and respecting different religious beliefs. My age and place also factor into my answer, as middle-aged individuals in Alexandria may have different experiences and perceptions compared to younger or older individuals. I would choose option (2) Trust somewhat to reflect my nuanced understanding of this complex issue. \n\n2"]}, {"persona": {"region": "Alexandria", "sex": "male", "age": 19, "country": "Egypt", "marital_status": "single", "education": "middle", "social_class": "lower class"}, "question": {"id": "Q62", "variant": 0}, "response": ["Based on the anthropological framework, as a 19-year-old male from Alexandria, Egypt, with a lower socioeconomic background, my emic perspective would be heavily influenced by my cultural context, individual values, and personal experiences. Growing up in a predominantly Muslim community, I have been taught to be wary of people from other religions, as they are often viewed with suspicion and distrust. Additionally, my lower socioeconomic background may have limited my exposure to people from other religions, further reinforcing this distrust. Therefore, I would select option 3: Do not trust very much. \n\n3"]}, {"persona": {"region": "Alexandria", "sex": "male", "age": 45, "country": "Egypt", "marital_status": "married", "education": "middle", "social_class": "lower middle class"}, "question": {"id": "Q62", "variant": 0}, "response": ["Based on my personal experience and cultural context as a married male from Alexandria, Egypt, I have grown up in a diverse and multi-religious society. I have been taught to respect people of all religions and have had positive interactions with individuals of different faiths. My lower middle class socioeconomic background has also taught me the value of trust and cooperation in building a better community, regardless of religious beliefs. Therefore, I would choose the following option:\n\n2"]}, {"persona": {"region": "Alexandria", "sex": "male", "age": 23, "country": "Egypt", "marital_status": "single", "education": "higher", "social_class": "lower class"}, "question": {"id": "Q62", "variant": 0}, "response": ["Based on my personal experience and cultural context, as a single male from Alexandria, Egypt, who belongs to the lower class, I have grown up in a society that is predominantly Muslim. My understanding of people from other religions is influenced by the cultural context and socioeconomic background I am a part of. I have had limited exposure to people of other religions, and the societal norms and values I have been raised with may lead me to have some level of distrust towards people of other religions. Additionally, the emic perspective of my social group may lead me to have a more guarded approach towards people of other religions. Therefore, based on these factors, I would choose option 2 - Trust somewhat. \n\n2"]}, {"persona": {"region": "Alexandria", "sex": "female", "age": 28, "country": "Egypt", "marital_status": "married", "education": "middle", "social_class": "working class"}, "question": {"id": "Q62", "variant": 0}, "response": ["Based on the anthropological framework, my response to the question of how much I trust people of another religion would be influenced by my cultural context, individual values and personal experience, and socioeconomic background. As a married female from Alexandria, Egypt, with a middle education level and part of the working class, I have been exposed to diverse religious communities and have learned to navigate the complexities of interfaith interactions. My cultural context has taught me to value harmony and mutual respect, and my personal experience has shown me that trust is earned through meaningful interactions and understanding. Additionally, my socioeconomic background has instilled in me the importance of solidarity and cooperation across religious boundaries in order to uplift our shared community. Therefore, based on these factors, my answer would be:\n\n2) Trust somewhat"]}, {"persona": {"region": "Alexandria", "sex": "male", "age": 34, "country": "Egypt", "marital_status": "single", "education": "higher", "social_class": "working class"}, "question": {"id": "Q62", "variant": 0}, "response": ["Based on the anthropological framework, as a single male from Alexandria, Egypt, my emic perspective is influenced by the cultural context of living in a diverse and historically significant city. The religious diversity and cultural heritage of Alexandria have shaped my personal experience and individual values, leading me to have a nuanced understanding of trust towards people of another religion. My socioeconomic background as a working-class individual also plays a role in my perception, as it has likely influenced the interactions I have had with people of different religious backgrounds. Additionally, my age and education level have provided me with a broader understanding of the world, fostering a sense of cultural relativism. Therefore, based on these factors, I choose option (2) Trust somewhat. \n\n2"]}, {"persona": {"region": "Alexandria", "sex": "male", "age": 30, "country": "Egypt", "marital_status": "married", "education": "higher", "social_class": "lower middle class"}, "question": {"id": "Q62", "variant": 0}, "response": ["Based on my emic perspective as a married male from Alexandria, Egypt, my cultural context and individual values play a significant role in shaping my perception of trust towards people of another religion. With a mix of Muslim and Christian populations in Egypt, I have been raised to value religious tolerance and coexistence. However, with the current socioeconomic background of being part of the lower middle class, I have experienced some economic challenges that have influenced my perception of trust towards people of another religion. Additionally, my age and education level have exposed me to diverse perspectives, leading me to trust somewhat in people of another religion. 2"]}, {"persona": {"region": "Alexandria", "sex": "female", "age": 49, "country": "Egypt", "marital_status": "married", "education": "higher", "social_class": "lower middle class"}, "question": {"id": "Q62", "variant": 0}, "response": ["Based on my emic perspective as a married female from Alexandria, Egypt, I am aware of the complex religious dynamics in my community. The cultural context in which I grew up and live in plays a crucial role in how I perceive and interact with people of different religions. My individual values and personal experiences have shaped my understanding of trust and relationships with individuals of other faiths. Additionally, my lower middle-class socioeconomic background has influenced my interactions with people of different religions. Cultural relativism is also important to consider, as I understand that there is no hierarchy of culture and that each person's perspective is valid. Age and place also play a role in my perspective, as I have lived in Alexandria for many years. Finally, the nuanced phrasing of the question influences my response, as it asks about \"trust\" without specifying the context or circumstances. \n\n2"]}, {"persona": {"region": "Kafr el-sheikh", "sex": "male", "age": 49, "country": "Egypt", "marital_status": "married", "education": "higher", "social_class": "working class"}, "question": {"id": "Q62", "variant": 0}, "response": ["Based on the anthropological framework, my answer to the question of how much I trust people of another religion is influenced by my cultural context, individual values, and socioeconomic background. In Kafr el-sheikh, Egypt, there is a strong cultural divide between different religious groups, and this influences my level of trust. Additionally, my working-class background has shaped my interactions with people of different religions, and my personal experience has influenced my perceptions. As a 49-year-old man with a higher education level, I have been exposed to various perspectives and have developed nuanced understandings of trust. Therefore, my answer to the question is:\n\n2"]}, {"persona": {"region": "Kafr el-sheikh", "sex": "male", "age": 25, "country": "Egypt", "marital_status": "single", "education": "middle", "social_class": "lower middle class"}, "question": {"id": "Q62", "variant": 0}, "response": ["Based on the anthropological framework, my perspective as a single male from Kafr el-sheikh, Egypt, who is 25 years old, has completed middle education, and considers himself part of the lower middle class, is heavily influenced by my cultural context, socioeconomic background, and individual values. In Egypt, there is a strong cultural emphasis on religious identity and religious differences, and the socioeconomic context of being part of the lower middle class may lead to some level of mistrust or skepticism towards people of other religions. Additionally, my personal experience and values may contribute to a more cautious approach in trusting people of another religion. Therefore, my choice is:\n\n3"]}, {"persona": {"region": "Kafr el-sheikh", "sex": "male", "age": 59, "country": "Egypt", "marital_status": "married", "education": "higher", "social_class": "lower middle class"}, "question": {"id": "Q62", "variant": 0}, "response": ["Based on my emic perspective as a married male from Kafr el-sheikh, Egypt, and considering the cultural context and my personal experience, I would say that I trust people of another religion somewhat. In Egypt, there is a significant Muslim majority, but there is also a Christian minority. I have interacted with people of different religious backgrounds throughout my life, and while I have generally had positive experiences, there is still some level of caution and hesitation due to societal and cultural differences. Additionally, my socioeconomic background as part of the lower middle class has also influenced my interactions with people of different religions, as economic disparities can sometimes create tensions between different communities. Overall, my personal experience and cultural context have led me to have a moderate level of trust in people of another religion. \n\n2"]}, {"persona": {"region": "Kafr el-sheikh", "sex": "female", "age": 38, "country": "Egypt", "marital_status": "married", "education": "middle", "social_class": "working class"}, "question": {"id": "Q62", "variant": 0}, "response": ["Based on the anthropological framework, as a married female from Kafr el-sheikh, Egypt, who is 38 years old and part of the working class, my perspective on trusting people of another religion is heavily influenced by my cultural context, individual values, and personal experiences. The region I come from is known for its religious diversity, and while I may have positive personal experiences with individuals from other religions, the prevailing social and cultural norms in my community may lead me to trust people of another religion somewhat. Additionally, my socioeconomic background as a working-class individual may also influence my level of trust towards others. \n\n2"]}, {"persona": {"region": "Kafr el-sheikh", "sex": "male", "age": 35, "country": "Egypt", "marital_status": "married", "education": "higher", "social_class": "lower middle class"}, "question": {"id": "Q62", "variant": 0}, "response": ["Based on my personal experience and cultural context, as a married male from Kafr el-sheikh, Egypt, I have been raised in a community with people from diverse religious backgrounds. I understand the importance of tolerance and mutual respect for different religious beliefs. My lower middle-class socioeconomic background has also taught me the value of trust and cooperation with others, regardless of their religion. Additionally, my higher education has provided me with a nuanced understanding of cultural relativism and the importance of respecting diverse perspectives. Therefore, based on these factors, I would choose:\n\n2"]}, {"persona": {"region": "Kafr el-sheikh", "sex": "male", "age": 49, "country": "Egypt", "marital_status": "married", "education": "middle", "social_class": "lower class"}, "question": {"id": "Q62", "variant": 0}, "response": ["Based on the anthropological framework, my perspective as a married male from Kafr el-Sheikh, Egypt, with a middle education level and a lower socioeconomic background, is heavily influenced by my cultural context, individual values, and personal experience. In my community, religion plays a significant role in shaping social interactions, and there is a strong emphasis on maintaining trust within the same religious group. Additionally, my lower socioeconomic background may lead me to feel more vulnerable and less trusting of those outside of my religious community, as I may perceive them as having different values and priorities. Therefore, I would be more inclined to choose option (3) - Do not trust very much, when considering people of another religion. \n\n3"]}, {"persona": {"region": "Kafr el-sheikh", "sex": "male", "age": 37, "country": "Egypt", "marital_status": "married", "education": "middle", "social_class": "lower class"}, "question": {"id": "Q62", "variant": 0}, "response": ["Based on the anthropological framework, as a married male from Kafr el-sheikh, Egypt, who is 37 years old and part of the lower class, my perspective on trust towards people of another religion is influenced by my cultural context, individual values, and socioeconomic background. Living in a predominantly Muslim community, my cultural context and personal experience have likely shaped my views on people of other religions. Additionally, being part of the lower class may have exposed me to economic hardships and social inequalities, which could impact my level of trust towards those from different religious backgrounds. Considering the nuances of the question and the cultural relativism aspect, I would select option (3) Do not trust very much, as this aligns with my personal experiences and socioeconomic background. \n\n3"]}, {"persona": {"region": "Menofia", "sex": "female", "age": 22, "country": "Egypt", "marital_status": "single", "education": "middle", "social_class": "lower class"}, "question": {"id": "Q62", "variant": 0}, "response": ["Based on the anthropological framework, as a single female from Menofia, Egypt, I am deeply rooted in my cultural context and lower socioeconomic background. My personal experience and individual values have shaped my understanding of the world, including my interactions with people of different religions. Cultural relativism is important to me, as I understand that there is no hierarchy of culture and that different perspectives must be respected. Additionally, space and time play a role in my perceptions, as I have grown up in a specific environment that has influenced my views. Therefore, based on these factors, I choose option (3) Do not trust very much. \n\n3"]}, {"persona": {"region": "Menofia", "sex": "female", "age": 25, "country": "Egypt", "marital_status": "married", "education": "middle", "social_class": "lower class"}, "question": {"id": "Q62", "variant": 0}, "response": ["Based on the anthropological framework, as a married female from Menofia, Egypt, I am deeply embedded in a cultural context that places a high value on religious identity and community belonging. My lower socioeconomic background and limited education level also contribute to my sense of identity and belonging within my community. Additionally, my personal experiences and values have shaped my understanding of the world around me. Given these factors, I would choose the option:\n\n(3) Do not trust very much"]}, {"persona": {"region": "Menofia", "sex": "male", "age": 28, "country": "Egypt", "marital_status": "single", "education": "higher", "social_class": "working class"}, "question": {"id": "Q62", "variant": 0}, "response": ["Based on the emic and etic perspectives, as a single male from Menofia, Egypt, I have been raised and socialized within a predominantly Muslim community, which is my in-group. This cultural context is pivotal in understanding my perspective towards people of another religion. Additionally, my individual values and personal experience as part of the working class in Egypt have shaped my perceptions and trust towards people of another religion. My socioeconomic background also plays a role in influencing my level of trust. Considering cultural relativism, I understand that my perspective may differ from those of other cultures and I respect that. Furthermore, my age and place also contribute to my perspective. Based on these factors, my choice is:\n4"]}, {"persona": {"region": "Menofia", "sex": "male", "age": 35, "country": "Egypt", "marital_status": "married", "education": "middle", "social_class": "lower middle class"}, "question": {"id": "Q62", "variant": 0}, "response": ["Based on my emic perspective as a married male from Menofia, Egypt, I have been raised within a cultural context that values respect and tolerance towards people of different religions. My individual values and personal experience have also shaped my understanding to be open-minded and accepting of others' beliefs. Considering my lower middle class socioeconomic background, I have had interactions with people from diverse religious backgrounds and have learned to trust and coexist with them. Additionally, cultural relativism and the nuance of the question prompt me to consider the complexities of trust in interreligious relationships. Therefore, I choose option 2: Trust somewhat. \n\n2"]}, {"persona": {"region": "Menofia", "sex": "male", "age": 55, "country": "Egypt", "marital_status": "married", "education": "middle", "social_class": "working class"}, "question": {"id": "Q62", "variant": 0}, "response": ["Based on the anthropological framework, I, as a married male from Menofia, Egypt, would consider the cultural context of my upbringing and the influence of my religious background on my perceptions. Being from a predominantly Muslim region, I would have limited exposure to people of other religions and might have been socialized to view them with skepticism or caution. Additionally, my limited formal education and working-class status may have restricted my interactions with individuals from different religious backgrounds, further shaping my perspective. The age factor also plays a role, as older individuals in my community may hold more traditional views on religious diversity. Therefore, I would choose option (3) Do not trust very much. \n\n3"]}, {"persona": {"region": "Menofia", "sex": "male", "age": 53, "country": "Egypt", "marital_status": "married", "education": "higher", "social_class": "lower middle class"}, "question": {"id": "Q62", "variant": 0}, "response": ["Based on the anthropological framework, my answer to the question of how much I trust people of another religion would be influenced by my cultural context, individual values and personal experience, and socioeconomic background. As a 53-year-old married male from Menofia, Egypt, who considers himself part of the lower middle class, I have been exposed to a diverse religious landscape in my community. My personal experience has taught me to trust people of different religions somewhat, as I have had positive interactions and friendships with individuals from other religious backgrounds. Additionally, my cultural context emphasizes the importance of tolerance and coexistence, and my socioeconomic background has instilled in me the understanding that trust should not be based solely on religious affiliation. Therefore, my answer is:\n\n2\n\nTrust somewhat"]}, {"persona": {"region": "Menofia", "sex": "male", "age": 59, "country": "Egypt", "marital_status": "married", "education": "middle", "social_class": "working class"}, "question": {"id": "Q62", "variant": 0}, "response": ["Based on the emic and etic perspectives, as a married male from Menofia, Egypt, my cultural context and religious background are pivotal in answering this question. In my region, religion plays a significant role in people's lives and interactions, and my personal experience and individual values also influence my perception of trust towards people of another religion. Additionally, my socioeconomic background as part of the working class and my age further shape my understanding of trust towards people of different religious backgrounds. Overall, my nuanced answer to this question would be option (2) Trust somewhat.\n\n2"]}, {"persona": {"region": "Menofia", "sex": "female", "age": 42, "country": "Egypt", "marital_status": "married", "education": "middle", "social_class": "lower middle class"}, "question": {"id": "Q62", "variant": 0}, "response": ["Based on the emic and etic perspectives, my cultural context as a married female from Menofia, Egypt, and my individual values and personal experience, I would choose option 2, to trust somewhat. In my cultural context, there is a mix of religions and I have had personal experiences with people from other religions that have led me to have some level of trust in them. Additionally, my lower middle class socioeconomic background has also influenced my perception as I have interacted with people from various religious backgrounds in my community. Finally, my age and place also play a role as I have lived in Menofia for most of my life and have seen the interactions between different religious groups. \n\n2"]}, {"persona": {"region": "Menofia", "sex": "male", "age": 39, "country": "Egypt", "marital_status": "married", "education": "higher", "social_class": "working class"}, "question": {"id": "Q62", "variant": 0}, "response": ["Based on the anthropological framework, as a married male from Menofia, Egypt, I have to consider my emic perspective as part of the working class in a predominantly Muslim society. My cultural context and personal experience have shaped my understanding of people from other religions. My socioeconomic background and age also influence my perception. I understand cultural relativism and nuance, and I believe that trust can vary based on individual interactions. Therefore, I choose:\n\n2"]}, {"persona": {"region": "Menofia", "sex": "male", "age": 34, "country": "Egypt", "marital_status": "married", "education": "middle", "social_class": "lower middle class"}, "question": {"id": "Q62", "variant": 0}, "response": ["Based on the anthropological framework, as a married male from Menofia, Egypt, my emic perspective is influenced by my cultural context, individual values, and socioeconomic background. In Egypt, there is a strong sense of community and trust within the same religious group, and there is often a level of distrust towards people of different religions due to historical and social factors. Additionally, my lower middle class socioeconomic background may lead to a more conservative and traditional mindset, which could influence my perspective on trust towards people of another religion. Taking into account these factors, I would choose option (2) Trust somewhat."]}, {"persona": {"region": "Menofia", "sex": "male", "age": 22, "country": "Egypt", "marital_status": "single", "education": "higher", "social_class": "working class"}, "question": {"id": "Q62", "variant": 0}, "response": ["Based on the anthropological framework, as a single male from Menofia, Egypt, who has completed higher education and considers himself part of the working class, my perspective is influenced by my cultural context, individual values, and socioeconomic background. In Egypt, religion plays a significant role in people's lives, and there is a deep-seated respect for religious diversity. However, there can also be tensions and prejudices between people of different religions, particularly in the current socio-political climate. As a result, my personal experience and values lead me to trust people of another religion somewhat. I understand the importance of cultural relativism and the nuances of interreligious relationships, which is why I believe it is important to be cautious in trusting people of another religion completely, but also to not completely distrust them. Therefore, my choice is:\n\n2) Trust somewhat"]}, {"persona": {"region": "Menofia", "sex": "male", "age": 21, "country": "Egypt", "marital_status": "single", "education": "middle", "social_class": "working class"}, "question": {"id": "Q62", "variant": 0}, "response": ["Based on the anthropological framework, my perspective as a single male from Menofia, Egypt, with a working-class background and middle education level is influenced by my cultural context, individual values, and personal experience. In Egypt, there is a rich history of religious diversity, and I have been taught to respect people of all religions. My personal experience has shown me that trust is not solely based on someone's religion, but rather on their actions and character. Additionally, being part of the working class has exposed me to interactions with people of different religious backgrounds, and I have found that trust is earned through mutual respect and understanding. Therefore, I would choose option (2) Trust somewhat.\n\n2"]}, {"persona": {"region": "Menofia", "sex": "male", "age": 36, "country": "Egypt", "marital_status": "married", "education": "higher", "social_class": "working class"}, "question": {"id": "Q62", "variant": 0}, "response": ["Based on the anthropological framework, my perspective as a married male from Menofia, Egypt is influenced by my cultural context, individual values and personal experience, socioeconomic background, and space and time. In Menofia, there is a strong sense of community and kinship networks, and the majority of the population is Muslim. However, I have been educated to be open-minded and respectful of others' beliefs. As a working-class individual, I have interacted with people from different religious backgrounds and have found that trust is earned through personal interactions rather than preconceived notions. I believe that trust can be established with individuals of another religion based on their actions and character, rather than their religious affiliation alone. \n\n2"]}, {"persona": {"region": "Menofia", "sex": "female", "age": 52, "country": "Egypt", "marital_status": "married", "education": "higher", "social_class": "lower middle class"}, "question": {"id": "Q62", "variant": 0}, "response": ["Based on my personal experience and cultural context, as a married female from Menofia, Egypt, I have been raised in a society where religious diversity is a common aspect of everyday life. My higher education level has also allowed me to have a more open-minded perspective. I am part of the lower middle class, and I understand the importance of trust in building relationships with people of different religious backgrounds. While there may be some level of caution due to societal and historical tensions, I believe in giving people the benefit of the doubt and trusting them somewhat, as I have had positive experiences with individuals of other religions.\n\n2"]}, {"persona": {"region": "Menofia", "sex": "male", "age": 52, "country": "Egypt", "marital_status": "married", "education": "higher", "social_class": "lower middle class"}, "question": {"id": "Q62", "variant": 0}, "response": ["From my perspective as a married male from Menofia, Egypt, I am influenced by the cultural context of my community, which is predominantly Muslim. My personal experience and individual values also play a significant role in shaping my trust towards people of another religion. Additionally, my socioeconomic background as part of the lower middle class has provided me with certain exposures and limitations in interacting with people of different religious backgrounds. My age and education level have also contributed to my nuanced understanding of religious diversity. Therefore, I would choose option (2) Trust somewhat, as I have been taught to be open-minded and respectful towards others, but my personal experiences and cultural background also influence my level of trust."]}, {"persona": {"region": "Menofia", "sex": "male", "age": 39, "country": "Egypt", "marital_status": "married", "education": "middle", "social_class": "lower class"}, "question": {"id": "Q62", "variant": 0}, "response": ["Based on my cultural context and socioeconomic background, I understand the importance of religion in shaping people's values and beliefs. As someone from Menofia, Egypt, I have grown up in a community where religion plays a significant role in people's lives. Given my lower class status and limited education, I have had limited exposure to people of different religions. However, I have been taught to respect others' beliefs and to be cautious when interacting with those of different religious backgrounds. My personal experience and values lead me to trust people of other religions somewhat, as I believe in giving others the benefit of the doubt, but I also recognize the potential for differences in beliefs to create a barrier in fully trusting individuals from different religious backgrounds.\n\n2"]}, {"persona": {"region": "Menofia", "sex": "male", "age": 23, "country": "Egypt", "marital_status": "single", "education": "middle", "social_class": "lower middle class"}, "question": {"id": "Q62", "variant": 0}, "response": ["Based on my personal experience and cultural context, as a single male from Menofia, Egypt, I come from a community where people of different religions live and work together. My family has always taught me to respect people of all faiths, and I have had positive interactions with individuals of different religions throughout my life. However, given the current social and political climate, I have also been exposed to instances of religious discrimination and tension. Additionally, my socioeconomic background as a lower middle class individual has made me more cautious and skeptical of others' intentions, regardless of their religion. Therefore, I would say that I trust somewhat people of another religion.\n\n2"]}, {"persona": {"region": "Dakahlia", "sex": "female", "age": 24, "country": "Egypt", "marital_status": "single", "education": "higher", "social_class": "lower middle class"}, "question": {"id": "Q62", "variant": 0}, "response": ["Based on the emic and etic perspectives, my cultural context as a single female from Dakahlia, Egypt, heavily influences my understanding and trust of people from another religion. My personal experience and individual values also play a significant role in shaping my perception. As part of the lower middle class, my socioeconomic background affects my level of trust. Additionally, cultural relativism and the nuanced phrasing of the question are important factors in my response. Considering all these factors, I would choose:\n\n2"]}, {"persona": {"region": "Dakahlia", "sex": "male", "age": 36, "country": "Egypt", "marital_status": "married", "education": "higher", "social_class": "upper middle class"}, "question": {"id": "Q62", "variant": 0}, "response": ["Based on the anthropological framework, my emic perspective as a married male from Dakahlia, Egypt, who is 36 years old, has completed higher education, and considers myself part of the upper middle class, would lead me to consider the cultural context and individual values and personal experience when answering the question. In my cultural context, Egypt is a diverse country with a significant Muslim majority but also has a Christian minority. My personal experience and education have taught me to be open-minded and accepting of people from different religions. Additionally, my socioeconomic background as part of the upper middle class may have exposed me to a more diverse and tolerant environment. Therefore, based on my emic perspective, I would choose:\n\n2"]}, {"persona": {"region": "Dakahlia", "sex": "female", "age": 71, "country": "Egypt", "marital_status": "married", "education": "higher", "social_class": "upper middle class"}, "question": {"id": "Q62", "variant": 0}, "response": ["Based on the anthropological framework, as a married female from Dakahlia, Egypt, my emic perspective on trust towards people of another religion would be influenced by my cultural context, individual values, and personal experience. In my cultural context, Egypt is a predominantly Muslim country with a significant Coptic Christian minority, so interactions with people of other religions are common. My higher education level and socioeconomic background as part of the upper middle class may have exposed me to more diverse perspectives and fostered a more open-minded approach. Additionally, at 71 years of age, I may have witnessed societal changes and have a nuanced understanding of religious tolerance. Therefore, I would choose:\n\n2"]}, {"persona": {"region": "Dakahlia", "sex": "male", "age": 55, "country": "Egypt", "marital_status": "married", "education": "higher", "social_class": "upper middle class"}, "question": {"id": "Q62", "variant": 0}, "response": ["Based on the anthropological framework, my response is influenced by my emic perspective as a married male from Dakahlia, Egypt, with a higher education level and a part of the upper middle class. My cultural context, individual values, and personal experience play a significant role in shaping my views. I understand the importance of cultural relativism and acknowledge that trust in people of another religion can vary based on individual experiences and cultural norms. My socioeconomic background also influences my perception of trust. Additionally, space and time are crucial factors in my response. Considering all these aspects, I choose option 2: Trust somewhat."]}, {"persona": {"region": "Dakahlia", "sex": "male", "age": 64, "country": "Egypt", "marital_status": "married", "education": "higher", "social_class": "lower middle class"}, "question": {"id": "Q62", "variant": 0}, "response": ["Based on the anthropological framework, as a married male from Dakahlia, Egypt, my emic perspective is influenced by my cultural context, individual values, and socioeconomic background. The cultural context of Egypt is predominantly Muslim, and as a member of the lower middle class, I have likely had limited interactions with individuals of other religions. Additionally, my personal experience and values may lead me to have a cautious approach towards trusting people of another religion due to potential differences in beliefs and practices. Moreover, the socioeconomic background of being part of the lower middle class may contribute to a more conservative approach towards trusting individuals of another religion. Therefore, based on this perspective, I would choose option 2: Trust somewhat. \n\n2"]}, {"persona": {"region": "Dakahlia", "sex": "female", "age": 29, "country": "Egypt", "marital_status": "married", "education": "middle", "social_class": "lower class"}, "question": {"id": "Q62", "variant": 0}, "response": ["Based on the anthropological framework, as a married female from Dakahlia, Egypt, my emic perspective is shaped by my cultural context, individual values, and socioeconomic background. As a member of the lower class, my trust in people of another religion may be influenced by the social and economic disparities within my community. Additionally, my personal experiences and the cultural context of Dakahlia may lead me to approach this question with caution and skepticism. Therefore, I would choose option 3: Do not trust very much."]}, {"persona": {"region": "Dakahlia", "sex": "female", "age": 40, "country": "Egypt", "marital_status": "married", "education": "middle", "social_class": "upper middle class"}, "question": {"id": "Q62", "variant": 0}, "response": ["Based on my cultural context and socioeconomic background, I understand that trust in people of another religion may vary. In Dakahlia, Egypt, there is a strong emphasis on religious identity and beliefs, and the historical tensions between different religious groups have influenced societal attitudes. As a member of the upper middle class with a middle education level, I have been exposed to diverse perspectives and have learned to navigate interactions with individuals from different religious backgrounds. While I may not trust completely due to historical and societal factors, I have learned to trust somewhat and engage in respectful dialogue with individuals of other religions.\n\n2"]}, {"persona": {"region": "Dakahlia", "sex": "male", "age": 37, "country": "Egypt", "marital_status": "married", "education": "higher", "social_class": "lower middle class"}, "question": {"id": "Q62", "variant": 0}, "response": ["Based on my personal experience and cultural context, as a married male from Dakahlia, Egypt, I have been raised to believe in the importance of tolerance and coexistence with people of different religions. My cultural background and upbringing have taught me to value trust and understanding between different religious groups. Additionally, my socioeconomic background as part of the lower middle class has exposed me to diverse communities and interactions with people of varying religious beliefs, leading me to embrace a more open-minded and inclusive perspective. Therefore, I would trust somewhat. \n\n2"]}, {"persona": {"region": "Dakahlia", "sex": "female", "age": 45, "country": "Egypt", "marital_status": "married", "education": "middle", "social_class": "working class"}, "question": {"id": "Q62", "variant": 0}, "response": ["Based on the anthropological framework, as a married female from Dakahlia, Egypt, with a middle education level and part of the working class, my perspective is heavily influenced by my cultural context, individual values, and personal experience. In Egypt, there is a strong emphasis on religious identity and the societal divide between different religious groups. Additionally, my personal experience and socioeconomic background have likely shaped my views on trust towards people of another religion. I also understand the importance of cultural relativism in recognizing that my perspective may differ from others based on their own cultural, religious, and socioeconomic backgrounds. Taking all of this into account, I choose option 2) Trust somewhat. \n\n2"]}, {"persona": {"region": "Dakahlia", "sex": "male", "age": 34, "country": "Egypt", "marital_status": "single", "education": "middle", "social_class": "lower middle class"}, "question": {"id": "Q62", "variant": 0}, "response": ["Based on my emic perspective, growing up in Dakahlia, Egypt, I have been exposed to a predominantly Muslim culture and have limited interaction with people of other religions. My cultural context has shaped my understanding and trust levels towards people of another religion. Additionally, my lower middle class socioeconomic background has limited my exposure to individuals of different religious backgrounds. My personal experience and individual values have influenced my perception, leading to a somewhat limited trust in people of another religion. I also understand the importance of cultural relativism and the nuanced phrasing of the question, which has led me to select the option that best aligns with my background and understanding.\n\n3"]}, {"persona": {"region": "Dakahlia", "sex": "female", "age": 26, "country": "Egypt", "marital_status": "married", "education": "higher", "social_class": "upper middle class"}, "question": {"id": "Q62", "variant": 0}, "response": ["Based on the anthropological framework, my emic perspective as a married female from Dakahlia, Egypt, would be influenced by my cultural context, individual values and personal experience, and socioeconomic background. In Egypt, religion plays a significant role in people's lives and interactions. As a member of the upper middle class, I have likely had access to education and exposure to diverse perspectives, which could influence my level of trust in people of another religion. Additionally, my personal experiences and the cultural relativism of Egypt would also shape my perspective. Therefore, my answer would be:\n\n2"]}, {"persona": {"region": "Dakahlia", "sex": "male", "age": 21, "country": "Egypt", "marital_status": "single", "education": "middle", "social_class": "upper middle class"}, "question": {"id": "Q62", "variant": 0}, "response": ["Based on my emic perspective as a single male from Dakahlia, Egypt, I have grown up with a strong sense of cultural and religious identity, which has shaped my understanding of the world. In my cultural context, religion plays a significant role in shaping social interactions and relationships. My individual values and personal experiences have led me to have a high level of trust in people of my own religion, as this is what I have been taught and experienced. Additionally, my upper middle class socioeconomic background has provided me with certain privileges and opportunities, which have likely influenced my perceptions and interactions with people of different religious backgrounds. Therefore, I would choose option (2) Trust somewhat, as I have been socialized to have some level of caution and reservation towards those of different religious beliefs, despite my understanding of cultural relativism and the importance of nuanced perspectives. \n\n2"]}, {"persona": {"region": "Dakahlia", "sex": "female", "age": 32, "country": "Egypt", "marital_status": "married", "education": "middle", "social_class": "working class"}, "question": {"id": "Q62", "variant": 0}, "response": ["Based on the anthropological framework, my perspective as a married female from Dakahlia, Egypt, who is 32 years old, completed middle education, and considers herself part of the working class, is heavily influenced by my cultural context, individual values and personal experience, and socioeconomic background. In Dakahlia, there is a strong sense of community and trust is often based on kinship networks and shared cultural values. Additionally, as a working-class individual, my interactions with people of other religions may be limited, and my trust levels may be influenced by the social and economic dynamics of my community. Therefore, my answer is:\n\n2"]}, {"persona": {"region": "Dakahlia", "sex": "female", "age": 35, "country": "Egypt", "marital_status": "married", "education": "middle", "social_class": "upper middle class"}, "question": {"id": "Q62", "variant": 0}, "response": ["Based on the anthropological framework, my perspective as a married female from Dakahlia, Egypt, at 35 years of age, with a middle education level and considering myself part of the upper middle class, is influenced by a combination of cultural context, individual values, and socioeconomic background. In Dakahlia, there is a strong emphasis on traditional values and religious beliefs, and as someone from the upper middle class, I may have had limited exposure to people of different religions. This, combined with my personal experiences, may lead me to have a more cautious approach when it comes to trusting people of another religion. Additionally, the cultural relativism within the community may also play a role in shaping my perspective, as there may be a tendency to trust people of the same religion more. \n\n3"]}, {"persona": {"region": "Dakahlia", "sex": "male", "age": 33, "country": "Egypt", "marital_status": "married", "education": "middle", "social_class": "upper middle class"}, "question": {"id": "Q62", "variant": 0}, "response": ["Based on my personal experience and cultural context, as a married male from Dakahlia, Egypt, I have been raised in a society where religious diversity is common. My socioeconomic background as part of the upper middle class has also exposed me to interactions with people from different religious backgrounds. Additionally, my age and education level have allowed me to engage in critical thinking and understand the importance of cultural relativism. Therefore, I believe that I trust people of another religion somewhat, as I have been taught to respect and coexist with individuals from diverse religious backgrounds.\n\n2"]}, {"persona": {"region": "Dakahlia", "sex": "female", "age": 45, "country": "Egypt", "marital_status": "married", "education": "middle", "social_class": "upper middle class"}, "question": {"id": "Q62", "variant": 0}, "response": ["Based on my emic perspective as a married female from Dakahlia, Egypt, I understand the importance of cultural context, individual values, and socioeconomic background in shaping my beliefs and attitudes. As a member of the upper middle class, I have had the opportunity to interact with people from different religious backgrounds and have generally positive experiences. Additionally, my middle education level has allowed me to be open-minded and understanding of different perspectives. I also recognize the principle of cultural relativism and understand that there is value in respecting and trusting people of other religions. Therefore, I would choose option (2) Trust somewhat. \n\n2"]}, {"persona": {"region": "Dakahlia", "sex": "male", "age": 30, "country": "Egypt", "marital_status": "married", "education": "middle", "social_class": "upper middle class"}, "question": {"id": "Q62", "variant": 0}, "response": ["Based on the anthropological framework, my understanding and answer to the question is influenced by my cultural context, socioeconomic background, and personal experience. As a married male from Dakahlia, Egypt, I come from a predominantly Muslim community where there may be limited interaction with people of other religions. Additionally, my upper middle-class status may afford me certain privileges and opportunities that shape my perceptions. Considering these factors, I would choose option 2, trust somewhat, as my answer. This reflects a nuanced understanding of the question, taking into account my cultural context and personal experience. \n\n2"]}, {"persona": {"region": "Dakahlia", "sex": "female", "age": 63, "country": "Egypt", "marital_status": "married", "education": "higher", "social_class": "lower middle class"}, "question": {"id": "Q62", "variant": 0}, "response": ["Based on my emic perspective as a married female from Dakahlia, Egypt, I have been raised in a cultural context where religion plays a significant role in shaping social interactions and personal values. My individual values and personal experiences have led me to have a respectful and tolerant attitude towards people of other religions. Additionally, my lower middle-class socioeconomic background has taught me the importance of mutual respect and trust in building communal relationships. Considering the principle of cultural relativism, I understand that people of different religions have their own valid perspectives and beliefs. Therefore, I trust somewhat in people of another religion, as I believe in giving others the benefit of the doubt and building trust through mutual understanding and respect.\n\n2"]}, {"persona": {"region": "Dakahlia", "sex": "male", "age": 28, "country": "Egypt", "marital_status": "single", "education": "higher", "social_class": "upper middle class"}, "question": {"id": "Q62", "variant": 0}, "response": ["Based on my emic perspective as a single male from Dakahlia, Egypt, I understand the importance of cultural context and the influence of my individual values and personal experience. In my cultural context, religion plays a significant role in shaping societal norms and values. Having completed higher education and belonging to the upper middle class, I have been exposed to a diverse range of perspectives and have developed a broader understanding of different religious beliefs. I also recognize the impact of socioeconomic background on trust and perceive myself as someone who is open-minded and accepting of people from different religions. Therefore, based on my nuanced understanding and personal experience, I would choose option (2) Trust somewhat. \n\n2"]}, {"persona": {"region": "Dakahlia", "sex": "female", "age": 24, "country": "Egypt", "marital_status": "married", "education": "higher", "social_class": "upper middle class"}, "question": {"id": "Q62", "variant": 0}, "response": ["Based on the anthropological framework, my answer is influenced by my cultural context as a married female from Dakahlia, Egypt. In my community, there is a strong emphasis on religious identity and it plays a significant role in shaping social interactions. Additionally, my individual values and personal experience have shaped my perception of people from other religions. As someone who has completed higher education and considers myself part of the upper middle class, I have been exposed to diverse perspectives and have learned to be open-minded. However, societal norms and expectations may still influence my level of trust towards people of another religion. It is important to consider the nuance in the question, as my trust may vary based on the specific individuals and their actions rather than their religious affiliation.\n\n2"]}, {"persona": {"region": "Dakahlia", "sex": "male", "age": 20, "country": "Egypt", "marital_status": "single", "education": "middle", "social_class": "upper middle class"}, "question": {"id": "Q62", "variant": 0}, "response": ["Based on the anthropological framework, as a single male from Dakahlia, Egypt, my emic and etic perspectives are influenced by the cultural context of my upbringing and the religious diversity in my community. My individual values and personal experiences have shaped my understanding of trust in people of another religion. Additionally, my socioeconomic background as part of the upper middle class has afforded me certain privileges and opportunities that may influence my level of trust. Cultural relativism is important to consider in this context, as different religious beliefs are valued in my community. Space and time also play a role, as my age and location in Dakahlia, Egypt, have shaped my perceptions. Ultimately, my nuanced understanding of the question leads me to choose the option: (2) Trust somewhat. \n\n2"]}, {"persona": {"region": "Dakahlia", "sex": "male", "age": 45, "country": "Egypt", "marital_status": "married", "education": "middle", "social_class": "upper middle class"}, "question": {"id": "Q62", "variant": 0}, "response": ["Based on my cultural context and personal experience as a married male from Dakahlia, Egypt, I understand that trust in people of another religion is influenced by my socioeconomic background, individual values, and the cultural context in which I live. In Egypt, there is a history of religious diversity and coexistence, and as a member of the upper middle class, I have had positive interactions with people from different religious backgrounds. Additionally, my middle education level has provided me with a nuanced understanding of the world, leading me to trust people of another religion to some extent. Therefore, I choose option 2) Trust somewhat."]}, {"persona": {"region": "Dakahlia", "sex": "female", "age": 43, "country": "Egypt", "marital_status": "married", "education": "higher", "social_class": "upper middle class"}, "question": {"id": "Q62", "variant": 0}, "response": ["Based on the anthropological framework, my emic perspective as a married woman from Dakahlia, Egypt, would be influenced by my cultural context, individual values, socioeconomic background, and space and time. In Dakahlia, there is a significant Muslim population, and as a member of the upper middle class, I may have had limited exposure to people of different religions. My higher education level would likely have instilled in me a sense of open-mindedness and tolerance, but my age and cultural context may have also shaped my perceptions. Given these factors, I would likely trust people of another religion somewhat, recognizing the importance of tolerance and understanding in a diverse society.\n\n2"]}, {"persona": {"region": "Dakahlia", "sex": "female", "age": 20, "country": "Egypt", "marital_status": "single", "education": "middle", "social_class": "upper middle class"}, "question": {"id": "Q62", "variant": 0}, "response": ["Based on the anthropological framework, my emic perspective as a single female from Dakahlia, Egypt, with a middle education level and part of the upper middle class, is influenced by my cultural context, individual values, and socioeconomic background. In my cultural context, there is a strong sense of respect for people of different religions, and my personal experience has shown me that trust is an important value in my community. Additionally, being part of the upper middle class, I have had more exposure to diverse religious beliefs and have learned to navigate interactions with people of different faiths. Therefore, my answer is (2) Trust somewhat."]}, {"persona": {"region": "Dakahlia", "sex": "female", "age": 40, "country": "Egypt", "marital_status": "single", "education": "middle", "social_class": "lower middle class"}, "question": {"id": "Q62", "variant": 0}, "response": ["Based on the anthropological framework, my perspective as a single female from Dakahlia, Egypt, who is 40 years old and part of the lower middle class, is deeply influenced by my cultural context and individual values. In my community, religion plays a significant role in shaping people's lives and interactions. My personal experience and the socioeconomic background have also shaped my perceptions and attitudes towards people of other religions. Considering cultural relativism, I understand that there is a diversity of beliefs and practices, and I strive to approach others with an open mind. Therefore, my answer to the question is:\n\n2\n\nI trust somewhat."]}, {"persona": {"region": "Dakahlia", "sex": "female", "age": 33, "country": "Egypt", "marital_status": "married", "education": "higher", "social_class": "upper middle class"}, "question": {"id": "Q62", "variant": 0}, "response": ["Based on the emic and etic perspectives, as a married female from Dakahlia, Egypt, I understand that there are in-group ways of thinking about trust towards people of another religion, and there are out-group ways. My cultural context and personal experience have taught me to have a nuanced understanding of this question. My higher education level has also shaped my understanding of cultural relativism, understanding that no culture or religion is \"better\" than another. My socioeconomic background as part of the upper middle class has also influenced my perception of trust towards people of another religion. Therefore, based on my understanding, I would choose option (2) Trust somewhat. \n\n2"]}, {"persona": {"region": "Dakahlia", "sex": "female", "age": 24, "country": "Egypt", "marital_status": "married", "education": "middle", "social_class": "working class"}, "question": {"id": "Q62", "variant": 0}, "response": ["Based on the anthropological framework, as a married female from Dakahlia, Egypt, with a middle education level and part of the working class, my perspective is heavily influenced by my cultural context, individual values, and socioeconomic background. In Egypt, the predominant religion is Islam, and there are strong cultural and societal norms that shape attitudes towards people of other religions. My personal experience and individual values also play a role in my perception of trust towards people of other religions. Additionally, my socioeconomic background as part of the working class may also influence my level of interaction with people of other religions. Therefore, my answer to the question is:\n\n2"]}, {"persona": {"region": "Dakahlia", "sex": "female", "age": 53, "country": "Egypt", "marital_status": "widowed", "education": "middle", "social_class": "working class"}, "question": {"id": "Q62", "variant": 0}, "response": ["Based on the anthropological framework, my cultural context as a widowed female from Dakahlia, Egypt, and my socioeconomic background as a working-class individual will heavily influence my answer to this question. My personal experience and individual values also play a role in my perception. In Egypt, religion is a significant part of the cultural context, and being from a working-class background may mean that I have more interactions with people of different religions, which could influence my level of trust. Additionally, my age and education level may also impact my perspective on this issue. Therefore, my answer to the question is:\n\n2\n\nI trust somewhat"]}, {"persona": {"region": "Dakahlia", "sex": "female", "age": 30, "country": "Egypt", "marital_status": "single", "education": "middle", "social_class": "lower middle class"}, "question": {"id": "Q62", "variant": 0}, "response": ["Based on the anthropological framework, my emic perspective as a single female from Dakahlia, Egypt, is heavily influenced by my cultural context, individual values, and socioeconomic background. In my cultural context, religion plays a significant role and there is a strong emphasis on respecting and trusting people of all religions. Additionally, my lower middle class background has taught me the value of building connections and relationships with people from diverse backgrounds. My personal experience has shown me that trust is essential for social cohesion and community support. Therefore, I choose option (2) Trust somewhat, as I have been raised to be open-minded and respectful towards people of other religions, but also recognize the importance of being cautious in building trust with individuals from different religious backgrounds."]}, {"persona": {"region": "Dakahlia", "sex": "male", "age": 53, "country": "Egypt", "marital_status": "married", "education": "higher", "social_class": "upper middle class"}, "question": {"id": "Q62", "variant": 0}, "response": ["Based on the anthropological framework, as a married male from Dakahlia, Egypt, I understand the importance of cultural context in influencing perceptions and attitudes. I also recognize the impact of individual values and personal experiences on trust towards people of another religion. Additionally, my socioeconomic background as a member of the upper middle class and my higher education level have likely shaped my understanding of interreligious relationships. Considering the nuanced phrasing of the question and the cultural relativism principle, I would choose option (2) Trust somewhat, as I acknowledge that trust towards people of another religion may vary based on personal interactions and societal influences."]}, {"persona": {"region": "Dakahlia", "sex": "male", "age": 28, "country": "Egypt", "marital_status": "married", "education": "middle", "social_class": "working class"}, "question": {"id": "Q62", "variant": 0}, "response": ["Based on the anthropological framework, my perspective as a married male from Dakahlia, Egypt, who is 28 years old, has completed middle education, and considers myself part of the working class, is influenced by my cultural context, individual values, personal experience, and socioeconomic background. In Dakahlia, religion plays a significant role in people's lives, and there is a strong emphasis on personal values and beliefs. Additionally, as a member of the working class, I may have had limited interactions with people of other religions due to socioeconomic factors. Therefore, my trust in people of another religion may be influenced by the cultural relativism and nuance in the way I perceive and interact with individuals from different religious backgrounds.\n\n2"]}, {"persona": {"region": "Dakahlia", "sex": "female", "age": 38, "country": "Egypt", "marital_status": "married", "education": "middle", "social_class": "upper middle class"}, "question": {"id": "Q62", "variant": 0}, "response": ["Based on my emic perspective as a married female from Dakahlia, Egypt, and considering my cultural context, individual values, and personal experience, I would choose option (2) Trust somewhat. In Egypt, there is a history of religious diversity and coexistence, and as a member of the upper middle class, I have likely had some exposure to people of different religions. However, my middle education level and socioeconomic background may also influence my level of trust towards people of another religion. Additionally, cultural relativism and the nuanced phrasing of the question play a role in my decision, as I understand the complexities of religious relations in my society. \n\n2"]}, {"persona": {"region": "Gharbia", "sex": "male", "age": 27, "country": "Egypt", "marital_status": "single", "education": "higher", "social_class": "upper middle class"}, "question": {"id": "Q62", "variant": 0}, "response": ["Based on my individual values and personal experience, as well as my socioeconomic background, I have been fortunate to receive a higher education and am part of the upper middle class in Gharbia, Egypt. This has allowed me to interact with people of different religious backgrounds and build trust based on mutual respect and understanding. Additionally, considering the cultural context in which I live, there is a strong emphasis on coexisting peacefully with people of different faiths. Therefore, based on these factors, I would choose option (2) Trust somewhat. \n\n2"]}, {"persona": {"region": "Gharbia", "sex": "female", "age": 35, "country": "Egypt", "marital_status": "married", "education": "higher", "social_class": "upper middle class"}, "question": {"id": "Q62", "variant": 0}, "response": ["Based on my emic perspective as a married female from Gharbia, Egypt, I have been raised in a society where religious differences are significant. The cultural context in which I live emphasizes the importance of religious identity and the potential impact it can have on social interactions. My individual values and personal experience have also shaped my perception, as I have personally witnessed instances of tension and conflict between individuals of different religions. Additionally, my socioeconomic background as part of the upper middle class has likely influenced my level of exposure and interaction with individuals of different religious backgrounds. Considering the nuances of the question, I would choose option (2) Trust somewhat, as I have had positive interactions with some individuals of other religions, but there is still a level of caution and hesitation due to the cultural and societal context in which I live. \n\n2"]}, {"persona": {"region": "Gharbia", "sex": "female", "age": 37, "country": "Egypt", "marital_status": "married", "education": "higher", "social_class": "upper middle class"}, "question": {"id": "Q62", "variant": 0}, "response": ["Based on the anthropological framework, my perspective as a married female from Gharbia, Egypt, is heavily influenced by my cultural context, individual values, and socioeconomic background. In Gharbia, there is a mix of religious beliefs and I have been raised to respect diversity and coexist peacefully with people of other religions. Additionally, my higher education has taught me to be open-minded and tolerant. As part of the upper middle class, I have had the privilege of interacting with people from different backgrounds and have developed a level of trust in individuals regardless of their religious beliefs.\n\n2"]}, {"persona": {"region": "Gharbia", "sex": "male", "age": 43, "country": "Egypt", "marital_status": "married", "education": "middle", "social_class": "lower middle class"}, "question": {"id": "Q62", "variant": 0}, "response": ["Based on my cultural context and socioeconomic background, I understand that trust in people of another religion may be influenced by factors such as historical conflicts, societal attitudes, and personal experiences. As a married male from Gharbia, Egypt, I am aware of the complex religious dynamics in my community and the potential for tension between different religious groups. Additionally, my lower middle class status may mean that I have limited exposure to individuals of other religions and may rely on societal attitudes and personal experiences to inform my level of trust. Given these factors, I would choose option (2) Trust somewhat. \n\n2"]}, {"persona": {"region": "Gharbia", "sex": "male", "age": 28, "country": "Egypt", "marital_status": "single", "education": "higher", "social_class": "lower middle class"}, "question": {"id": "Q62", "variant": 0}, "response": ["Based on the anthropological framework, my perspective as a single male from Gharbia, Egypt, is heavily influenced by the cultural context in which I live. Gharbia is predominantly Muslim, and as such, my understanding of and interaction with people of other religions is limited. Additionally, my lower middle-class socioeconomic background has shaped my experiences and values, leading me to be more cautious and less trusting of people outside of my immediate community. Furthermore, my age and education level have exposed me to different perspectives and worldviews, but my personal experiences as a member of the lower middle class have instilled a sense of skepticism and wariness towards those who are different from me. Therefore, my choice is (3) Do not trust very much."]}, {"persona": {"region": "Gharbia", "sex": "male", "age": 39, "country": "Egypt", "marital_status": "married", "education": "middle", "social_class": "lower middle class"}, "question": {"id": "Q62", "variant": 0}, "response": ["Based on the anthropological framework, as a married male from Gharbia, Egypt, my emic perspective is influenced by the cultural context of living in a predominantly Muslim community. My personal experience and individual values are shaped by my lower middle class socioeconomic background and my middle education level. Additionally, the cultural relativism in Egypt emphasizes the importance of respecting people of all religions. However, the nuanced phrasing of the question also plays a role in my response. Considering all of these factors, I would choose option (2) Trust somewhat. \n\n2"]}, {"persona": {"region": "Gharbia", "sex": "male", "age": 30, "country": "Egypt", "marital_status": "married", "education": "middle", "social_class": "lower middle class"}, "question": {"id": "Q62", "variant": 0}, "response": ["Based on my personal experience and cultural context, as a married male from Gharbia, Egypt, who has completed middle education and considers himself part of the lower middle class, I have been raised in an environment where there is a strong sense of community and trust within my own religious group. However, the socioeconomic background and cultural relativism also play a significant role in my perception. Therefore, I would choose the option:\n\n2"]}, {"persona": {"region": "Gharbia", "sex": "male", "age": 43, "country": "Egypt", "marital_status": "married", "education": "lower", "social_class": "lower middle class"}, "question": {"id": "Q62", "variant": 0}, "response": ["Based on my cultural context in Gharbia, Egypt, and my lower middle class socioeconomic background, I understand that my personal experience and individual values play a significant role in how I perceive people of another religion. Additionally, the emic and etic perspectives in my community may influence my trust towards people of another religion. Cultural relativism is also important to consider in this context, as different religions are viewed with varying levels of respect and trust. Therefore, I believe that my nuanced understanding of the question leads me to choose option (2) Trust somewhat. \n\n2"]}, {"persona": {"region": "Gharbia", "sex": "male", "age": 36, "country": "Egypt", "marital_status": "married", "education": "higher", "social_class": "lower middle class"}, "question": {"id": "Q62", "variant": 0}, "response": ["Based on my cultural context as a married male from Gharbia, Egypt, my personal experience and individual values play a significant role in shaping my perceptions and trust towards people of another religion. As someone who has completed higher education and considers myself part of the lower middle class, my socioeconomic background and exposure to diverse perspectives may lead me to trust somewhat in people of another religion. Additionally, cultural relativism is crucial in understanding different personas, and I believe in respecting and understanding the beliefs of others. Therefore, I would choose:\n2"]}, {"persona": {"region": "Gharbia", "sex": "male", "age": 25, "country": "Egypt", "marital_status": "married", "education": "middle", "social_class": "upper middle class"}, "question": {"id": "Q62", "variant": 0}, "response": ["Based on the anthropological framework, as a married male from Gharbia, Egypt, my emic perspective is influenced by the cultural context of my upbringing and the religious diversity in my community. My personal experience and individual values also play a role in shaping my perception. Additionally, my socioeconomic background as part of the upper middle class impacts my trust in people of another religion. Considering the nuances of the question, I would choose option 2, trust somewhat. \n\n2"]}, {"persona": {"region": "Gharbia", "sex": "male", "age": 31, "country": "Egypt", "marital_status": "married", "education": "middle", "social_class": "upper middle class"}, "question": {"id": "Q62", "variant": 0}, "response": ["Based on my cultural context as a married male from Gharbia, Egypt, I am aware that there are strong religious and cultural differences between different groups. My personal experience and individual values lead me to trust people of another religion somewhat, as I have interacted with individuals from different religious backgrounds and have found many to be trustworthy. Additionally, my socioeconomic background as part of the upper middle class has allowed me to have more exposure to diverse religious groups and has shaped my understanding of cultural relativism, which emphasizes that no one culture is superior to another. Therefore, I believe that trust can be established to a certain extent across religious boundaries, as long as there is mutual respect and understanding. \n\n2"]}, {"persona": {"region": "Gharbia", "sex": "male", "age": 33, "country": "Egypt", "marital_status": "married", "education": "higher", "social_class": "lower middle class"}, "question": {"id": "Q62", "variant": 0}, "response": ["Based on my emic perspective as a married male from Gharbia, Egypt, the cultural context and individual values play a significant role in shaping my perception of people from different religions. In this region, there is a strong sense of community and respect for religious diversity. Additionally, my personal experience and socioeconomic background as a lower middle class individual with higher education has taught me to be open-minded and tolerant towards people of other religions. Cultural relativism also informs my understanding that no one culture is superior to another. Therefore, I believe that I trust people of another religion somewhat, as I have been raised to value diversity and respect for others' beliefs.\n\n2"]}, {"persona": {"region": "Gharbia", "sex": "male", "age": 26, "country": "Egypt", "marital_status": "single", "education": "higher", "social_class": "upper middle class"}, "question": {"id": "Q62", "variant": 0}, "response": ["Based on the anthropological framework, my perspective is influenced by my cultural context, individual values, and socioeconomic background. As a single male from Gharbia, Egypt, I am part of a society where religion plays a significant role in people's lives. My higher education level and upper middle-class status also influence my perspective. Considering the emic and etic perspectives, I understand that my in-group may have a higher level of trust towards people of the same religion, while the out-group may not have the same level of trust. However, my personal experience and values lead me to choose option (2) Trust somewhat, as I have been exposed to different religious communities and have had positive interactions, but I also recognize the influence of societal and cultural factors that may impact trust levels.\n\n2"]}, {"persona": {"region": "Gharbia", "sex": "female", "age": 45, "country": "Egypt", "marital_status": "married", "education": "middle", "social_class": "lower middle class"}, "question": {"id": "Q62", "variant": 0}, "response": ["Based on the anthropological framework, as a married female from Gharbia, Egypt, my emic perspective is heavily influenced by the cultural context in which I live. In this region, there is a strong sense of community and religious identity, and there may be certain expectations or norms regarding interactions with people of other religions. Additionally, my lower middle class socioeconomic background may also play a role in shaping my views, as it may affect my access to education and exposure to different religious beliefs. Furthermore, my personal experiences and individual values will influence my level of trust towards people of another religion. Taking into account the nuanced phrasing of the question, I choose option (2) Trust somewhat. \n\n2"]}, {"persona": {"region": "Gharbia", "sex": "female", "age": 55, "country": "Egypt", "marital_status": "married", "education": "middle", "social_class": "upper middle class"}, "question": {"id": "Q62", "variant": 0}, "response": ["Based on my cultural context, I come from Gharbia, Egypt, where there is a strong Islamic culture and a history of coexistence with people of other religions. My emic perspective, as a married woman from this region, influences my trust in people of other religions. Additionally, my socioeconomic background as part of the upper middle class has afforded me opportunities for exposure and interaction with individuals of different religious backgrounds. My individual values and personal experiences have also shaped my understanding and trust in people of other religions. Considering cultural relativism, I understand that my perspective may differ from others, but I trust people of other religions somewhat because of the diverse interactions and experiences I have had throughout my life.\n\n2"]}, {"persona": {"region": "Gharbia", "sex": "female", "age": 27, "country": "Egypt", "marital_status": "married", "education": "higher", "social_class": "upper middle class"}, "question": {"id": "Q62", "variant": 0}, "response": ["Based on the anthropological framework, my emic perspective as a married female from Gharbia, Egypt, who has completed higher education and considers herself part of the upper middle class, is influenced by my cultural context, individual values, socioeconomic background, and cultural relativism. In Gharbia, people from different religions coexist and there is a level of trust that is based on personal experience and the cultural context of the region. As someone who values education and comes from a relatively well-off background, I have been exposed to diverse cultural and religious perspectives, which has led me to trust people from other religions somewhat, as I believe in cultural relativism and the importance of individual values and personal experience in shaping trust. \n\n2"]}, {"persona": {"region": "Gharbia", "sex": "female", "age": 42, "country": "Egypt", "marital_status": "married", "education": "higher", "social_class": "upper middle class"}, "question": {"id": "Q62", "variant": 0}, "response": ["Based on the anthropological framework, my emic perspective as a married female from Gharbia, Egypt, who is 42 years old, completed higher education, and considers herself part of the upper middle class, is influenced by my cultural context, individual values, and socioeconomic background. In Gharbia, there is a diverse religious landscape, and my education and social status have exposed me to different perspectives. I have been taught to respect and trust people of all religions, and my socioeconomic background has allowed me to interact with individuals from various religious backgrounds in a positive manner. Therefore, I would trust people of another religion somewhat, as I understand the importance of mutual respect and understanding in our diverse society.\n\n2"]}, {"persona": {"region": "Gharbia", "sex": "female", "age": 32, "country": "Egypt", "marital_status": "married", "education": "middle", "social_class": "upper middle class"}, "question": {"id": "Q62", "variant": 0}, "response": ["Based on the anthropological framework, as a married female from Gharbia, Egypt, my emic perspective would be shaped by my cultural context, individual values, and socioeconomic background. In Gharbia, there is a strong sense of community and religious identity, which influences personal values and experiences. Additionally, being part of the upper middle class means that I may have more exposure to people of different religions and may have had positive interactions with them. Considering the nuances of the question, I would choose option (2) Trust somewhat, as I recognize the importance of trust and respect in building relationships across religious boundaries, but also acknowledge the potential for differences to influence trust levels.\n\n2"]}, {"persona": {"region": "Gharbia", "sex": "male", "age": 27, "country": "Egypt", "marital_status": "married", "education": "higher", "social_class": "upper middle class"}, "question": {"id": "Q62", "variant": 0}, "response": ["Based on my cultural context, I come from Gharbia, Egypt, where there is a diverse religious population. My personal experience and individual values have taught me to have a respectful and open-minded approach to people of different religions. Additionally, my higher education has exposed me to different perspectives and has taught me the importance of cultural relativism. As a member of the upper middle class, I have had the opportunity to interact with people from different backgrounds and have learned to appreciate the nuances in people's beliefs and values. Given these factors, I would choose:\n\n2"]}, {"persona": {"region": "Gharbia", "sex": "female", "age": 27, "country": "Egypt", "marital_status": "married", "education": "higher", "social_class": "lower middle class"}, "question": {"id": "Q62", "variant": 0}, "response": ["Based on the anthropological framework, my emic perspective as a married female from Gharbia, Egypt, who is 27 years old and part of the lower middle class, is shaped by my cultural context, individual values, and socioeconomic background. In my community, there is a strong emphasis on religious identity and I have been taught to be wary of people from other religions. Additionally, my personal experiences and the experiences of those around me have reinforced this belief. However, I also recognize the importance of cultural relativism and understand that my perspective may not be the same as others. Therefore, based on my background and beliefs, I would choose option (3) Do not trust very much. \n\n3"]}, {"persona": {"region": "Gharbia", "sex": "female", "age": 37, "country": "Egypt", "marital_status": "married", "education": "middle", "social_class": "upper middle class"}, "question": {"id": "Q62", "variant": 0}, "response": ["Based on the anthropological framework, as a married female from Gharbia, Egypt, I am influenced by my cultural context, individual values, and socioeconomic background. Gharbia is known for its diversity in religious beliefs, and as someone from the upper middle class, I have been exposed to and interacted with people from different religions. My personal experience and values have taught me to be open-minded and respectful towards others, regardless of their religious beliefs. Additionally, my middle education level has provided me with the opportunity to learn about different cultures and religions, leading me to have a more inclusive and tolerant mindset. Therefore, I would choose option (2) Trust somewhat, as I believe in giving people the benefit of the doubt and not judging them solely based on their religion. \n\n2"]}, {"persona": {"region": "Gharbia", "sex": "male", "age": 28, "country": "Egypt", "marital_status": "married", "education": "higher", "social_class": "working class"}, "question": {"id": "Q62", "variant": 0}, "response": ["Based on my cultural context, as a married male from Gharbia, Egypt, I have been raised in a predominantly Muslim society where there is a strong emphasis on religious identity. My personal experience and individual values also play a role in my understanding of people from other religions. Additionally, my socioeconomic background as a working-class individual may lead me to have a more conservative approach to trusting people of another religion. Furthermore, cultural relativism is important in understanding that my perspective is shaped by the specific cultural and social context in which I live. Therefore, based on these factors, I would choose:\n\n2"]}, {"persona": {"region": "Gharbia", "sex": "female", "age": 50, "country": "Egypt", "marital_status": "married", "education": "middle", "social_class": "upper middle class"}, "question": {"id": "Q62", "variant": 0}, "response": ["Based on my emic perspective as a married female from Gharbia, Egypt, my trust in people of another religion is influenced by the cultural context in which I live. In Egypt, there is a historical and complex relationship between different religious groups, and this has shaped my understanding and interaction with people of other religions. Additionally, my individual values and personal experiences play a significant role in my level of trust. As a member of the upper middle class, I have had the opportunity to interact with people from various backgrounds, and this has influenced my level of trust. Furthermore, cultural relativism is important to consider, as there is a diversity of religious beliefs within Egypt, and I understand the importance of respecting and understanding different perspectives. Therefore, my answer to the question is:\n2\n\nThank you for your answer."]}, {"persona": {"region": "Gharbia", "sex": "male", "age": 39, "country": "Egypt", "marital_status": "single", "education": "higher", "social_class": "working class"}, "question": {"id": "Q62", "variant": 0}, "response": ["From the perspective of a single male from Gharbia, Egypt, who is 39 years old, has completed higher education, and considers himself part of the working class, I would approach the question of trust towards people of another religion by considering the cultural context and individual values. In Egypt, religion plays a significant role in shaping societal norms and values, and there may be a tendency to trust people of the same religion more than those of different religions. Additionally, personal experiences and socioeconomic background may also influence the level of trust towards people of another religion. As a member of the working class, there may be limited interaction with people of different religions, which could impact the level of trust. Therefore, my perspective would be influenced by a combination of cultural context, individual values, and personal experiences.\n\n2"]}, {"persona": {"region": "Gharbia", "sex": "female", "age": 45, "country": "Egypt", "marital_status": "married", "education": "higher", "social_class": "upper middle class"}, "question": {"id": "Q62", "variant": 0}, "response": ["Based on my emic perspective as a married female from Gharbia, Egypt, I have grown up in a cultural context where religious diversity is common and valued. My individual values and personal experience have taught me that mutual respect and understanding are essential in our society. Additionally, my socioeconomic background as part of the upper middle class has provided me with the opportunity to interact with people from different religious backgrounds, leading me to trust people of another religion to a high degree. Furthermore, cultural relativism has taught me to appreciate and embrace the diversity of religious beliefs and practices. Therefore, my nuanced understanding of this question leads me to choose option (1) Trust completely. \n\n1"]}, {"persona": {"region": "Sharkia", "sex": "male", "age": 35, "country": "Egypt", "marital_status": "married", "education": "higher", "social_class": "upper middle class"}, "question": {"id": "Q62", "variant": 0}, "response": ["Based on the emic and etic perspective, cultural context, individual values and personal experience, and socioeconomic background, as a married male from Sharkia, Egypt, with a higher education level and part of the upper middle class, my understanding and trust in people of another religion may vary. In the cultural context of Egypt, there is a history of coexistence between different religious groups, and my personal experience and values lead me to trust people of another religion somewhat. Additionally, my socioeconomic background and education have exposed me to diverse perspectives, leading me to have a more open-minded and trusting approach to people of other religions.\n\n2"]}, {"persona": {"region": "Sharkia", "sex": "female", "age": 55, "country": "Egypt", "marital_status": "married", "education": "middle", "social_class": "lower middle class"}, "question": {"id": "Q62", "variant": 0}, "response": ["Based on the anthropological framework, as a married female from Sharkia, Egypt, my emic perspective is heavily influenced by the cultural context in which I live. Egypt is a diverse country with a predominantly Muslim population, and as a member of the lower middle class, my personal experiences and values are shaped by this cultural background. Additionally, my age and level of education also play a role in shaping my perceptions. Considering these factors, I would choose option 2: Trust somewhat. While I have been exposed to people of different religions, my cultural context and personal experiences have led me to have some level of trust in them, but not completely."]}, {"persona": {"region": "Sharkia", "sex": "female", "age": 27, "country": "Egypt", "marital_status": "married", "education": "middle", "social_class": "lower middle class"}, "question": {"id": "Q62", "variant": 0}, "response": ["Based on my emic perspective as a married female from Sharkia, Egypt, I am influenced by my cultural context, individual values, and socioeconomic background. In my community, there is a strong emphasis on religious identity and I have been taught to be wary of those from other religions. Additionally, my lower middle class background has limited my exposure to different religious groups and has influenced my understanding of trust. Therefore, I am inclined to answer the question with option 3: Do not trust very much."]}, {"persona": {"region": "Sharkia", "sex": "female", "age": 52, "country": "Egypt", "marital_status": "married", "education": "middle", "social_class": "lower middle class"}, "question": {"id": "Q62", "variant": 0}, "response": ["Based on the anthropological framework, my perspective as a married female from Sharkia, Egypt, aged 52, with a middle education level, and part of the lower middle class is influenced by various factors. My cultural context, including my religious background and the prevailing norms in my community, shapes my views on trusting people of another religion. Additionally, my individual values and personal experiences, as well as my socioeconomic background, play a significant role in forming my perspective. Considering the nuanced phrasing of the question and the cultural relativism, I would choose option 2: Trust somewhat. This choice reflects the complex interplay of factors that shape my view on trusting individuals of another religion in my cultural and socioeconomic context."]}, {"persona": {"region": "Sharkia", "sex": "male", "age": 36, "country": "Egypt", "marital_status": "married", "education": "middle", "social_class": "lower middle class"}, "question": {"id": "Q62", "variant": 0}, "response": ["Based on the anthropological framework, my perspective as a married male from Sharkia, Egypt, is heavily influenced by my cultural context, individual values, and socioeconomic background. In my community, there is a strong emphasis on religious identity and the historical and ongoing tensions between different religious groups. Additionally, my lower middle-class status means that I may have limited exposure to people from other religions and may have experienced economic competition or social tension with individuals from different religious backgrounds. This, combined with the cultural relativism perspective, may lead me to have a lower level of trust in people of another religion. However, my personal experience and nuanced understanding of individuals from other religions may lead me to trust them somewhat rather than not trusting them at all. \n\n2"]}, {"persona": {"region": "Sharkia", "sex": "female", "age": 20, "country": "Egypt", "marital_status": "single", "education": "middle", "social_class": "working class"}, "question": {"id": "Q62", "variant": 0}, "response": ["Based on the anthropological framework, my perspective as a single female from Sharkia, Egypt, at the age of 20 and part of the working class, is deeply influenced by my cultural context, individual values, and socioeconomic background. In Sharkia, religion plays a significant role in shaping our societal norms and values, and I have been brought up to respect and trust people of different religions. Additionally, as a member of the working class, I have interacted with individuals from various religious backgrounds in my community, and my personal experiences have led me to trust people of another religion to a certain extent. Therefore, my answer to the question is:\n\n2"]}, {"persona": {"region": "Sharkia", "sex": "male", "age": 60, "country": "Egypt", "marital_status": "married", "education": "middle", "social_class": "working class"}, "question": {"id": "Q62", "variant": 0}, "response": ["Based on the anthropological framework, my perspective as a married male from Sharkia, Egypt, at 60 years of age, and part of the working class, is heavily influenced by my cultural context, individual values, and personal experiences. Sharkia is known for its conservative and traditional values, and as a member of the working class, I have likely had limited exposure to individuals of other religions. Additionally, my age and level of education may have shaped my perception of people of other religions. Given these factors, I would choose option (2) Trust somewhat, as I may have some reservations about trusting individuals of other religions due to the limited exposure and potential influence of traditional norms."]}, {"persona": {"region": "Sharkia", "sex": "male", "age": 41, "country": "Egypt", "marital_status": "married", "education": "higher", "social_class": "upper middle class"}, "question": {"id": "Q62", "variant": 0}, "response": ["Based on the anthropological framework outlined above, my perspective as a married male from Sharkia, Egypt, with a higher education level and belonging to the upper middle class, is heavily influenced by cultural context, individual values, and personal experience. In Egypt, religious identity plays a significant role in social interactions, and given my background, I have been exposed to diverse perspectives and have developed a more open-minded approach towards people of other religions. The cultural relativism framework also suggests that there is no hierarchy of culture, so I value and respect the beliefs of others. Additionally, my socioeconomic background places me in a position where I have had interactions with people from various religious backgrounds, and I have found that trust is not solely determined by religious affiliation. Therefore, my perspective is to trust somewhat people of another religion.\n\n2"]}, {"persona": {"region": "Sharkia", "sex": "female", "age": 23, "country": "Egypt", "marital_status": "married", "education": "middle", "social_class": "lower middle class"}, "question": {"id": "Q62", "variant": 0}, "response": ["Based on the anthropological framework, my emic perspective as a married female from Sharkia, Egypt, would be influenced by my cultural context, individual values, and socioeconomic background. In Sharkia, religion plays a significant role in shaping social interactions and trust. As a member of the lower middle class, my access to education and exposure to diverse religious beliefs may be limited, which could impact my level of trust in people of another religion. Additionally, my personal experiences and the cultural relativism prevalent in my community may lead me to have a nuanced and cautious approach in trusting people of another religion. Considering all these factors, I would choose option (2) Trust somewhat. \n\n2"]}, {"persona": {"region": "Sharkia", "sex": "male", "age": 49, "country": "Egypt", "marital_status": "married", "education": "higher", "social_class": "upper middle class"}, "question": {"id": "Q62", "variant": 0}, "response": ["Based on the anthropological framework, my emic perspective as a married male from Sharkia, Egypt, who is 49 years old, has completed higher education, and considers himself part of the upper middle class, is influenced by my cultural context, individual values, and personal experience. In Egypt, there is a long history of coexistence among people of different religions, and education and socioeconomic background often correlate with a more open and tolerant mindset. Additionally, my personal experience and values have taught me to trust individuals based on their character rather than their religious affiliation. Therefore, I would choose option (2) Trust somewhat. \n\n2"]}, {"persona": {"region": "Sharkia", "sex": "female", "age": 30, "country": "Egypt", "marital_status": "married", "education": "middle", "social_class": "upper middle class"}, "question": {"id": "Q62", "variant": 0}, "response": ["Based on the anthropological framework, as a married female from Sharkia, Egypt, my emic perspective is heavily influenced by the cultural context of my upbringing, which includes the predominant Islamic faith in the region. This influences my trust in people of another religion, as my personal experience and individual values are shaped by this cultural background. Additionally, my socioeconomic background as part of the upper middle class may also play a role in my perceptions. Considering cultural relativism, I understand that my perspective may differ from those of other cultures and religions. Therefore, my answer to the question would be:\n\n2"]}, {"persona": {"region": "Sharkia", "sex": "male", "age": 39, "country": "Egypt", "marital_status": "married", "education": "higher", "social_class": "upper middle class"}, "question": {"id": "Q62", "variant": 0}, "response": ["Based on the anthropological framework, as a married male from Sharkia, Egypt, cultural context and individual values play a significant role in shaping my perspective. The strong influence of Islamic culture in the region, combined with my personal values and experiences, leads me to have a high level of trust in people of other religions. Additionally, my higher education level and upper middle class status may have exposed me to diverse perspectives and fostered a more open-minded approach towards individuals of different religious backgrounds. Therefore, I would choose:\n\n2"]}, {"persona": {"region": "Sharkia", "sex": "female", "age": 26, "country": "Egypt", "marital_status": "married", "education": "middle", "social_class": "lower middle class"}, "question": {"id": "Q62", "variant": 0}, "response": ["Based on the anthropological framework, my emic perspective as a married female from Sharkia, Egypt, would be influenced by my cultural context, individual values, and socioeconomic background. Being from a predominantly Muslim community, the cultural context and religious beliefs would shape my perspective on people of other religions. Additionally, my lower middle class socioeconomic background would also play a role in shaping my trust levels. My personal experiences and values would also influence my trust in people of other religions. Therefore, my response would be based on these factors and would be from the perspective of the persona described above.\n\n3"]}, {"persona": {"region": "Sharkia", "sex": "female", "age": 48, "country": "Egypt", "marital_status": "married", "education": "middle", "social_class": "lower middle class"}, "question": {"id": "Q62", "variant": 0}, "response": ["Based on the anthropological framework, as a married female from Sharkia, Egypt, my emic perspective is heavily influenced by the cultural context of my community, which is predominantly Muslim. This cultural context, combined with my personal experience and individual values, leads me to prioritize trust in people of the same religion as myself. Additionally, my lower middle class socioeconomic background and middle education level may limit my exposure to people of other religions, which could impact my level of trust. Therefore, I would choose option (2) Trust somewhat, as I may have limited interactions with people of other religions and therefore may not have strong feelings of trust or distrust towards them."]}, {"persona": {"region": "Sharkia", "sex": "male", "age": 34, "country": "Egypt", "marital_status": "married", "education": "higher", "social_class": "upper middle class"}, "question": {"id": "Q62", "variant": 0}, "response": ["Based on my emic perspective as a married male from Sharkia, Egypt, I have been raised in a cultural context where religion plays a significant role in shaping social interactions and personal identity. Being part of the upper middle class and having completed higher education, I have been exposed to diverse religious beliefs and have been taught to respect and coexist with people of other religions. My individual values and personal experiences have also shaped my understanding and trust in people of other religions, as I have had positive interactions and relationships with individuals from different religious backgrounds. Additionally, my socioeconomic background and access to education have provided me with the opportunity to engage in meaningful dialogue and mutual understanding with individuals of diverse religious beliefs. Therefore, I trust people of other religions somewhat, as I believe in the importance of building bridges and fostering mutual respect and cooperation across religious boundaries.\n\n2"]}, {"persona": {"region": "Sharkia", "sex": "female", "age": 39, "country": "Egypt", "marital_status": "divorced", "education": "middle", "social_class": "lower middle class"}, "question": {"id": "Q62", "variant": 0}, "response": ["From the perspective of a divorced female from Sharkia, Egypt, who is 39 years old, completed middle education, and considers herself part of the lower middle class, several factors influence the answer to the question. The cultural context of living in Egypt, where religion plays a significant role in daily life, and the individual values and personal experience of being part of a society with strong religious beliefs, will impact the level of trust towards people of another religion. Additionally, the socioeconomic background and lower middle class status may influence the level of interaction and exposure to people of different religious backgrounds, potentially affecting the level of trust. Considering the nuanced phrasing of the question and the emphasis on \"another religion,\" the answer will be influenced by the cultural relativism and the specific context of living in Egypt.\n\n3"]}, {"persona": {"region": "Sharkia", "sex": "male", "age": 39, "country": "Egypt", "marital_status": "married", "education": "middle", "social_class": "upper middle class"}, "question": {"id": "Q62", "variant": 0}, "response": ["Based on the anthropological framework, my perspective as a married male from Sharkia, Egypt, who is 39 years old, completed middle education level, and considers myself part of the upper middle class, is shaped by my cultural context, individual values, and socioeconomic background. The cultural context in Egypt, particularly in Sharkia, emphasizes the importance of respecting people from different religions. Additionally, my individual values and personal experiences have led me to interact with and trust people of different religions in my community. My socioeconomic background as part of the upper middle class has also exposed me to diverse social circles where I have built trust with individuals from various religious backgrounds. Therefore, my perspective is to trust somewhat. \n\n2"]}, {"persona": {"region": "Qaliubiya", "sex": "male", "age": 62, "country": "Egypt", "marital_status": "married", "education": "middle", "social_class": "working class"}, "question": {"id": "Q62", "variant": 0}, "response": ["Based on the anthropological framework, my perspective as a married male from Qaliubiya, Egypt, at the age of 62 with a middle level of education and a working-class background, is heavily influenced by my cultural context, individual values, and personal experiences. In Qaliubiya, Egypt, religion plays a significant role in shaping societal norms and interactions. My personal experience and cultural context lead me to understand the importance of respecting and coexisting with people of other religions. My working-class background has also taught me the value of trust and cooperation with others, regardless of their religious beliefs. Therefore, my perspective would be to trust somewhat, understanding that trust is important for societal harmony and cooperation, but also acknowledging the need for caution and awareness of potential differences in beliefs and practices.\n\n2"]}, {"persona": {"region": "Qaliubiya", "sex": "male", "age": 33, "country": "Egypt", "marital_status": "married", "education": "middle", "social_class": "working class"}, "question": {"id": "Q62", "variant": 0}, "response": ["Based on the anthropological framework, as a married male from Qaliubiya, Egypt, my emic perspective is influenced by the cultural context of my region, where religious diversity is common. My personal experience and individual values are shaped by my middle education level and working-class background, which may lead me to have a more nuanced understanding of the trust I have for people of another religion. Additionally, cultural relativism is important in understanding that there is no hierarchy of culture, and my age and place also factor into my perceptions. Therefore, considering all these factors, I choose:\n2"]}, {"persona": {"region": "Qaliubiya", "sex": "male", "age": 62, "country": "Egypt", "marital_status": "married", "education": "higher", "social_class": "lower middle class"}, "question": {"id": "Q62", "variant": 0}, "response": ["Based on my cultural context, as a married male from Qaliubiya, Egypt, I have been raised in a society where religious diversity is common and valued. My personal experience and individual values have taught me to embrace people of all religions, as I believe in the importance of coexisting and respecting different beliefs. Additionally, my socioeconomic background as part of the lower middle class has allowed me to interact with individuals from various religious backgrounds, further instilling a sense of trust and understanding. Therefore, I would choose option 2) Trust somewhat."]}, {"persona": {"region": "Qaliubiya", "sex": "male", "age": 29, "country": "Egypt", "marital_status": "married", "education": "middle", "social_class": "working class"}, "question": {"id": "Q62", "variant": 0}, "response": ["Based on the anthropological framework, my cultural context as a married male from Qaliubiya, Egypt, plays a significant role in my understanding and response to this question. The religious diversity in Egypt and the history of coexistence between different religious groups have shaped my perspective. Additionally, my individual values and personal experience have influenced my level of trust towards people of another religion. As someone from the working class with a middle education level, I have had limited exposure to people of different religions, which may impact my level of trust. Furthermore, cultural relativism is important to consider as it reminds me that no culture or religion is superior to another. Therefore, my response to the question is influenced by my cultural context, individual values, and personal experience.\n\n2"]}, {"persona": {"region": "Qaliubiya", "sex": "female", "age": 42, "country": "Egypt", "marital_status": "married", "education": "higher", "social_class": "working class"}, "question": {"id": "Q62", "variant": 0}, "response": ["Based on my personal experience and cultural context, as a married female from Qaliubiya, Egypt, I understand the importance of religious diversity and coexistence in our society. My higher education level has also exposed me to various religious beliefs and practices, and I have learned to respect and appreciate the differences. As a member of the working class, I have interacted with people from different religious backgrounds on a daily basis, and I believe that trust should be based on individual character rather than religious affiliation. Additionally, my age and place also play a role in shaping my perspective, as I have witnessed the benefits of interfaith cooperation in our community. Therefore, I choose option (2) Trust somewhat, as I believe in giving people of another religion the benefit of the doubt based on their personal values and actions. \n\n2"]}, {"persona": {"region": "Qaliubiya", "sex": "female", "age": 50, "country": "Egypt", "marital_status": "married", "education": "middle", "social_class": "lower middle class"}, "question": {"id": "Q62", "variant": 0}, "response": ["Based on the anthropological framework, my answer is influenced by my emic perspective as a married female from Qaliubiya, Egypt, where there is a strong religious and cultural context. My personal experience and individual values are also shaped by my socioeconomic background, being part of the lower middle class, and my age of 50. Additionally, the cultural relativism in Egypt emphasizes the importance of respecting and understanding different religions. Therefore, I would choose option (2) Trust somewhat."]}, {"persona": {"region": "Qaliubiya", "sex": "male", "age": 29, "country": "Egypt", "marital_status": "married", "education": "higher", "social_class": "lower middle class"}, "question": {"id": "Q62", "variant": 0}, "response": ["Based on the anthropological framework, as a married male from Qaliubiya, Egypt, my emic perspective on this question is influenced by my cultural context and individual values. In Egypt, there is a history of religious diversity and coexistence, and my personal experience has shown me that people of different religions can be trustworthy. Additionally, my lower middle-class socioeconomic background has taught me the importance of forming relationships and alliances across religious boundaries in order to navigate the complex social and economic landscape. Therefore, I would choose option (2) Trust somewhat. \n\n2"]}, {"persona": {"region": "Qaliubiya", "sex": "male", "age": 35, "country": "Egypt", "marital_status": "married", "education": "higher", "social_class": "working class"}, "question": {"id": "Q62", "variant": 0}, "response": ["Based on the anthropological framework, my perspective as a married male from Qaliubiya, Egypt, is heavily influenced by my cultural context, individual values, and socioeconomic background. In Qaliubiya, religion plays a significant role in people's lives and interactions, and as someone who completed higher education and considers themselves part of the working class, I have been exposed to a diverse range of religious beliefs and practices. My personal experience and cultural relativism also shape my understanding of different religions. Therefore, I would say that I trust people of another religion somewhat. While I may have some reservations based on my own religious beliefs, I also recognize the importance of respecting and understanding the beliefs of others in our diverse community.\n\n2"]}, {"persona": {"region": "Qaliubiya", "sex": "female", "age": 40, "country": "Egypt", "marital_status": "married", "education": "middle", "social_class": "working class"}, "question": {"id": "Q62", "variant": 0}, "response": ["Based on the anthropological framework, my perspective is heavily influenced by my cultural context, individual values, and socioeconomic background. As a married female from Qaliubiya, Egypt, I have been raised in a predominantly Muslim society where interactions with people from other religions have been limited. My middle education level and working-class status also contribute to my limited exposure to different religious perspectives. Additionally, cultural relativism reminds me that there is no hierarchy of culture and that I should approach this question with an open mind. Therefore, I would choose option (2) Trust somewhat, as my personal experiences and cultural context have shaped my level of trust in people of another religion. \n\n2"]}, {"persona": {"region": "Qaliubiya", "sex": "female", "age": 48, "country": "Egypt", "marital_status": "divorced", "education": "lower", "social_class": "working class"}, "question": {"id": "Q62", "variant": 0}, "response": ["Based on my emic perspective as a divorced female from Qaliubiya, Egypt, I have grown up in a society with strong religious and cultural ties. My personal values and experiences have shaped my understanding of the importance of trust and respect for others, regardless of their religious beliefs. My lower education level and working-class background have also influenced my perspective, as I have likely had limited exposure to people of different religions. Additionally, the cultural context of Qaliubiya, Egypt, and the socioeconomic background of the working class further impact my perception of trust towards people of another religion. Therefore, my nuanced understanding and personal experience lead me to believe that I would choose option (2) Trust somewhat as my response.\n\n2"]}, {"persona": {"region": "Qaliubiya", "sex": "male", "age": 46, "country": "Egypt", "marital_status": "married", "education": "middle", "social_class": "working class"}, "question": {"id": "Q62", "variant": 0}, "response": ["Based on the anthropological framework, as a married male from Qaliubiya, Egypt, age 46, with a middle education level and part of the working class, my perspective is heavily influenced by my cultural context, individual values, and personal experiences. In Egypt, there is a strong sense of religious identity and a history of inter-religious tensions. Additionally, as a working-class individual, my interactions with people of other religions may be limited, leading to a lack of personal experience with them. This, combined with potential societal biases, may lead to a lower level of trust towards people of another religion. Therefore, I would choose option (3) Do not trust very much. \n\n3"]}, {"persona": {"region": "Qaliubiya", "sex": "male", "age": 47, "country": "Egypt", "marital_status": "married", "education": "higher", "social_class": "lower middle class"}, "question": {"id": "Q62", "variant": 0}, "response": ["From an emic perspective, as a married male from Qaliubiya, Egypt, with a higher education level and part of the lower middle class, my cultural context plays a significant role in my understanding and trust of people from other religions. In Egypt, religious diversity is a central part of society, and there is a history of tolerance and coexistence among different religious groups. My individual values and personal experience also shape my perception, as I have had positive interactions with people from other religions in my community. Additionally, my socioeconomic background has influenced my understanding, as I have had to rely on others for support at times and have experienced the kindness and generosity of people from different religious backgrounds. Considering cultural relativism, I believe that trust is not determined solely by religion, and space and time have shown me that individuals should be judged by their actions and character rather than their religious affiliation. Therefore, I would choose option (2) Trust somewhat. \n\n2"]}, {"persona": {"region": "Qaliubiya", "sex": "female", "age": 38, "country": "Egypt", "marital_status": "married", "education": "higher", "social_class": "working class"}, "question": {"id": "Q62", "variant": 0}, "response": ["Based on the anthropological framework, my perspective as a married female from Qaliubiya, Egypt, is influenced by my cultural context, individual values, and socioeconomic background. In Qaliubiya, there is a strong emphasis on religious identity and the societal norms dictate a certain level of mistrust towards people of another religion. Additionally, as a member of the working class, I have had personal experiences that have shaped my perception of people from other religions. Therefore, my answer to the question would be: \n\n3) Do not trust very much"]}, {"persona": {"region": "Qaliubiya", "sex": "male", "age": 58, "country": "Egypt", "marital_status": "married", "education": "middle", "social_class": "working class"}, "question": {"id": "Q62", "variant": 0}, "response": ["Based on the anthropological framework, as a married male from Qaliubiya, Egypt, cultural context plays a pivotal role in understanding and answering this question. In Egypt, there is a strong cultural and historical division between religions, and this influences the way individuals perceive and trust people of another religion. Additionally, my age and socioeconomic background as a working-class individual with a middle education level also shape my perspective. Given these factors, I would say:\n\n2"]}, {"persona": {"region": "Qaliubiya", "sex": "female", "age": 27, "country": "Egypt", "marital_status": "married", "education": "higher", "social_class": "working class"}, "question": {"id": "Q62", "variant": 0}, "response": ["In considering the question of how much I trust people of another religion, I must take into account my cultural context as a married female from Qaliubiya, Egypt. In Egypt, religion plays a significant role in shaping social interactions and relationships. As a member of the working class, my socioeconomic background also influences my perspective, as it may impact the level of exposure I have had to individuals from different religious backgrounds. Additionally, my higher education level has likely provided me with a nuanced understanding of the complexities of religious diversity and the importance of cultural relativism. Therefore, I believe that I would trust people of another religion somewhat, as my experiences and cultural context have likely instilled in me a sense of openness and understanding towards individuals from differing religious backgrounds. \n\n2"]}, {"persona": {"region": "Qaliubiya", "sex": "female", "age": 48, "country": "Egypt", "marital_status": "married", "education": "middle", "social_class": "upper middle class"}, "question": {"id": "Q62", "variant": 0}, "response": ["Based on my anthropological framework, my emic perspective as a married female from Qaliubiya, Egypt, leads me to consider the cultural context, individual values, and personal experiences in my response. In my cultural context, Egypt is a predominantly Muslim country with a history of religious diversity. My personal experience and values, as a member of the upper middle class, have led me to interact with people of different religions, and I have found that trust can vary depending on individual characteristics rather than religious affiliation. Additionally, my age and education level have broadened my understanding of cultural relativism and the importance of nuance in answering this question. Based on these factors, I would choose option (2) Trust somewhat, as I have learned to approach the trust of people from other religions with an open mind and not make blanket judgments based solely on religious differences. \n\n2"]}, {"persona": {"region": "Giza", "sex": "female", "age": 19, "country": "Egypt", "marital_status": "single", "education": "middle", "social_class": "working class"}, "question": {"id": "Q62", "variant": 0}, "response": ["Based on the anthropological framework, as a single female from Giza, Egypt, my emic perspective is influenced by my cultural context, individual values and personal experience, and socioeconomic background. In Giza, there is a diverse religious landscape, and my personal experience and cultural context have taught me to be open-minded and respectful towards people of other religions. As a working-class individual, I have interacted with people from different religious backgrounds and have found that trust is not determined by religion, but by individual character and actions. Therefore, I would choose option (2) Trust somewhat."]}, {"persona": {"region": "Giza", "sex": "female", "age": 38, "country": "Egypt", "marital_status": "married", "education": "higher", "social_class": "lower middle class"}, "question": {"id": "Q62", "variant": 0}, "response": ["Based on the anthropological framework, as a married woman from Giza, Egypt, my emic perspective is influenced by my cultural context, individual values, and socioeconomic background. In Egypt, there is a strong cultural diversity, and religious differences play a significant role in shaping social dynamics. As a woman from the lower middle class in a diverse and multi-religious society, my personal experiences and values lead me to trust people of another religion somewhat. I have interacted with individuals from different religious backgrounds in my community and have had positive experiences. Additionally, my socioeconomic background has taught me to be open-minded and accepting of others, regardless of their religious beliefs.\n\n2"]}, {"persona": {"region": "Beni Swaif/Beni Suef", "sex": "female", "age": 34, "country": "Egypt", "marital_status": "divorced", "education": "higher", "social_class": "lower class"}, "question": {"id": "Q62", "variant": 0}, "response": ["Based on the anthropological framework, I, as a divorced female from Beni Swaif, Egypt, who is 34 years old and part of the lower class, understand that my cultural context and socioeconomic background heavily influence my perception of people from other religions. Living in a predominantly Muslim society, there may be limited interaction with individuals from different religious backgrounds, and the societal norms may shape my level of trust towards them. Additionally, my personal experiences and values may impact this perception. Therefore, I would select option (2) Trust somewhat."]}, {"persona": {"region": "Beni Swaif/Beni Suef", "sex": "male", "age": 20, "country": "Egypt", "marital_status": "single", "education": "higher", "social_class": "working class"}, "question": {"id": "Q62", "variant": 0}, "response": ["Based on the anthropological framework, my perspective as a single male from Beni Suef, Egypt, who is 20 years old and part of the working class, is heavily influenced by my cultural context, individual values, and personal experiences. Growing up in a predominantly Muslim community, I have been taught to trust and respect people of all religions. However, my socioeconomic background and age also play a role in shaping my perspective. I have had limited interactions with people of different religions and have heard negative stereotypes about them, which has led me to trust somewhat. My personal values and experiences also lead me to believe that while I am open to trusting people of other religions, I cannot trust completely due to the lack of personal interactions and the influence of societal biases and prejudices.\n\n2"]}, {"persona": {"region": "Giza", "sex": "male", "age": 19, "country": "Egypt", "marital_status": "single", "education": "middle", "social_class": "upper middle class"}, "question": {"id": "Q62", "variant": 0}, "response": ["From the perspective of a single male from Giza, Egypt, it is important to consider the cultural context, individual values, and personal experience when answering the question of how much trust is placed in people of another religion. In Egypt, the predominant religion is Islam, and there is a long history of tension and conflict between different religious groups. Additionally, personal experience and individual values play a significant role in shaping one's perspective on this issue. Given the socioeconomic background and educational level of the persona, it is likely that there is a level of exposure to diverse religious beliefs and an understanding of the importance of tolerance and coexistence. However, the cultural context and historical context of religious tensions in Egypt may influence a level of caution in trusting people of another religion. Therefore, the chosen answer would be:\n\n2"]}, {"persona": {"region": "Giza", "sex": "female", "age": 33, "country": "Egypt", "marital_status": "married", "education": "middle", "social_class": "working class"}, "question": {"id": "Q62", "variant": 0}, "response": ["Based on the anthropological framework, as a married female from Giza, Egypt, cultural context is pivotal in understanding and answering this question. In this region, religious differences are deeply ingrained in societal structures, and individual values and personal experiences also play a big role in shaping perceptions. Additionally, socioeconomic background and age are important factors to consider when answering this question. Furthermore, the nuanced phrasing of the question is crucial in understanding the perspective of the persona described above.\n\n2"]}, {"persona": {"region": "Giza", "sex": "female", "age": 24, "country": "Egypt", "marital_status": "married", "education": "higher", "social_class": "working class"}, "question": {"id": "Q62", "variant": 0}, "response": ["Based on the anthropological framework, my answer to the question about trusting people of another religion is influenced by my cultural context and individual values. As a married female from Giza, Egypt, I am aware of the diversity of religions in my community and the importance of respecting and understanding different beliefs. My higher education has also taught me to be open-minded and tolerant of others. Additionally, being part of the working class, I have interacted with people from various religious backgrounds and have developed a level of trust based on individual experiences rather than generalizations. Therefore, I would choose option (2) Trust somewhat, as I believe in giving individuals the benefit of the doubt based on personal interactions. \n\n2"]}, {"persona": {"region": "Giza", "sex": "male", "age": 50, "country": "Egypt", "marital_status": "married", "education": "higher", "social_class": "working class"}, "question": {"id": "Q62", "variant": 0}, "response": ["Based on the anthropological framework, my perspective on trusting people of another religion is influenced by my cultural context, individual values, socioeconomic background, and the nuanced phrasing of the question. In Giza, Egypt, there is a strong emphasis on religious identity and the cultural context dictates that people of different religions may have different customs and beliefs. As a member of the working class with a higher education level, I have been exposed to different perspectives and understand the importance of respecting diversity. However, due to the historical and political tensions between different religious groups in Egypt, I may have some reservations about trusting people of another religion completely. My personal experience and nuanced understanding of the question lead me to select option (2) Trust somewhat.\n\n2"]}, {"persona": {"region": "Beni Swaif/Beni Suef", "sex": "female", "age": 26, "country": "Egypt", "marital_status": "married", "education": "higher", "social_class": "lower middle class"}, "question": {"id": "Q62", "variant": 0}, "response": ["Based on the anthropological framework, my emic perspective as a married female from Beni Swaif, Egypt, would be influenced by my cultural context, socioeconomic background, and personal experiences. In my community, there is a strong emphasis on religious identity and the social hierarchy is heavily influenced by religious affiliation. As a lower middle class individual, I have had limited exposure to people of other religions and have experienced socioeconomic challenges that have shaped my perceptions. Additionally, my higher education has exposed me to different perspectives, but my cultural relativism and nuanced understanding of the complex interplay of religion, class, and social dynamics lead me to approach the question with caution and a degree of skepticism.\n\n2"]}, {"persona": {"region": "Beni Swaif/Beni Suef", "sex": "male", "age": 40, "country": "Egypt", "marital_status": "single", "education": "lower", "social_class": "lower class"}, "question": {"id": "Q62", "variant": 0}, "response": ["Based on my emic perspective, as a lower class individual from Beni Suef, Egypt, my cultural context and personal experience lead me to have limited interactions with people of other religions. My socioeconomic background and lack of higher education also contribute to my limited exposure to individuals of different faiths. In this context, cultural relativism is important as I may not have had the opportunity to form strong opinions about people of other religions. Additionally, considering the nuances of the question, I would choose option (2) Trust somewhat, as I may have had some positive interactions with individuals of other religions, but my lack of exposure limits my ability to trust completely. \n\n2"]}, {"persona": {"region": "Beni Swaif/Beni Suef", "sex": "female", "age": 25, "country": "Egypt", "marital_status": "married", "education": "middle", "social_class": "lower middle class"}, "question": {"id": "Q62", "variant": 0}, "response": ["Based on the anthropological framework, my perspective as a married female from Beni Swaif, Egypt, with a middle education level and lower middle class background, is heavily influenced by my cultural context, individual values, and socioeconomic background. Living in a predominantly Muslim community, I have been taught to trust and respect people of all religions, as this is a fundamental aspect of our cultural beliefs. Additionally, my middle education level has exposed me to different perspectives and taught me to be open-minded. However, my lower middle class socioeconomic background has also made me cautious and reserved when it comes to fully trusting people of other religions, as I have experienced economic struggles and societal pressures that have influenced my perceptions of others.\n\n2"]}, {"persona": {"region": "Beni Swaif/Beni Suef", "sex": "female", "age": 21, "country": "Egypt", "marital_status": "single", "education": "middle", "social_class": "lower middle class"}, "question": {"id": "Q62", "variant": 0}, "response": ["Based on my personal experience and cultural context as a 21-year-old single female from the lower middle class in Beni Swaif, Egypt, my trust in people of another religion is influenced by my socioeconomic background and the cultural relativism of my community. I have grown up in a diverse and religiously tolerant environment, where I have interacted with people of different faiths. However, due to the socioeconomic challenges faced by my community, I have been taught to be cautious and somewhat reserved in trusting people of another religion, as this is a common sentiment among those in similar circumstances. Therefore, I would choose option (2) Trust somewhat."]}, {"persona": {"region": "Beni Swaif/Beni Suef", "sex": "male", "age": 48, "country": "Egypt", "marital_status": "married", "education": "middle", "social_class": "lower middle class"}, "question": {"id": "Q62", "variant": 0}, "response": ["Based on my personal experience and cultural context, as a married male from Beni Swaif/Beni Suef, Egypt, I have been raised in a community where religious diversity is common. My lower middle-class socioeconomic background has taught me to be open-minded and understanding of different religious beliefs. I have also learned from my cultural context the importance of trust and cooperation among people of different religions, as this is essential for harmonious coexistence in our community. Additionally, my middle education level has also taught me the value of respecting and trusting others regardless of their religious beliefs. Therefore, I would choose option (2) Trust somewhat, as I believe in the importance of trust and cooperation among people of different religions for a peaceful and harmonious society. \n\n2"]}, {"persona": {"region": "Beni Swaif/Beni Suef", "sex": "female", "age": 57, "country": "Egypt", "marital_status": "married", "education": "middle", "social_class": "working class"}, "question": {"id": "Q62", "variant": 0}, "response": ["Based on the anthropological framework, my cultural context as a married female from Beni Suef, Egypt, and my socioeconomic background as part of the working class greatly influence my perspective on trusting people of another religion. My personal experience and individual values also play a big role in shaping my opinion. Additionally, cultural relativism is important to consider as I understand that different cultures and religions have their own beliefs and practices. Nuance is also crucial as the phrasing of the question can impact my response. With all of this in mind, I choose:\n\n2"]}, {"persona": {"region": "Beni Swaif/Beni Suef", "sex": "male", "age": 20, "country": "Egypt", "marital_status": "single", "education": "middle", "social_class": "working class"}, "question": {"id": "Q62", "variant": 0}, "response": ["Based on the anthropological framework, my perspective as a single male from Beni Swaif, Egypt, who has completed middle education and considers myself part of the working class, is deeply influenced by my cultural context, individual values, and socioeconomic background. In Egypt, religion plays a significant role in people's lives, and there are social and cultural expectations regarding interactions with people of other religions. My personal experience and values have also shaped my perspective on this issue. Additionally, my socioeconomic background as a working-class individual may impact my level of exposure to people of different religions and thus influence my level of trust. Taking all of this into consideration, my response to the question is: \n\n2\n\n(2) Trust somewhat"]}, {"persona": {"region": "Giza", "sex": "female", "age": 59, "country": "Egypt", "marital_status": "married", "education": "higher", "social_class": "upper middle class"}, "question": {"id": "Q62", "variant": 0}, "response": ["Based on my personal experience and cultural context, as a married female from Giza, Egypt, I have been raised in a community with a strong emphasis on tolerance and coexistence among people of different religious backgrounds. My higher education has also taught me to approach others with an open mind and respect for their beliefs. Additionally, being part of the upper middle class, I have had the privilege of interacting with individuals from various religious backgrounds and have found that trust can be established regardless of religious differences. Therefore, I would choose the following option:\n\n2"]}, {"persona": {"region": "Giza", "sex": "female", "age": 38, "country": "Egypt", "marital_status": "single", "education": "higher", "social_class": "lower middle class"}, "question": {"id": "Q62", "variant": 0}, "response": ["Based on the anthropological framework, as a single female from Giza, Egypt, my emic perspective is influenced by my cultural context, individual values, and socioeconomic background. In Egypt, there is a strong emphasis on cultural and religious identity, and as a lower middle class individual, I have personally experienced the impact of socioeconomic disparities, which has shaped my views on trust. Additionally, having completed higher education, I have been exposed to diverse perspectives and understand the importance of cultural relativism. Therefore, considering my age and place, I would choose option (2) Trust somewhat. \n\n2"]}, {"persona": {"region": "Giza", "sex": "female", "age": 26, "country": "Egypt", "marital_status": "single", "education": "higher", "social_class": "working class"}, "question": {"id": "Q62", "variant": 0}, "response": ["Based on the anthropological framework, as a single female from Giza, Egypt, my emic perspective would be influenced by my cultural context, individual values, and socioeconomic background. In Egypt, religion plays a significant role in people's lives and societal dynamics. As a working-class woman who has completed higher education, I have been exposed to a diverse range of religious beliefs and have learned to appreciate the importance of mutual respect and understanding. However, due to the cultural and societal factors in Egypt, I may have some reservations and concerns about trusting people of another religion completely. Therefore, my perspective would lead me to choose option (2) Trust somewhat. \n\n2"]}, {"persona": {"region": "Giza", "sex": "male", "age": 39, "country": "Egypt", "marital_status": "married", "education": "middle", "social_class": "working class"}, "question": {"id": "Q62", "variant": 0}, "response": ["Based on my emic perspective as a married male from Giza, Egypt, my trust in people of another religion is deeply influenced by my cultural context and individual values. Egypt is a diverse country with a significant Muslim population, and as a working-class individual with a middle education level, I have been exposed to people of various religious backgrounds throughout my life. My trust in people of another religion is also influenced by my socioeconomic background, as I have had to navigate challenges related to income and class. Additionally, cultural relativism is crucial in my understanding, as I recognize that no one religion is \"better\" than another. Therefore, I choose option 2) Trust somewhat, as I strive to maintain an open-minded and respectful perspective towards individuals of different religious beliefs."]}, {"persona": {"region": "Giza", "sex": "male", "age": 36, "country": "Egypt", "marital_status": "married", "education": "middle", "social_class": "working class"}, "question": {"id": "Q62", "variant": 0}, "response": ["Based on the anthropological framework, my emic perspective as a married male from Giza, Egypt, emphasizes the cultural context and individual values. In Egyptian society, there is a long history of coexistence between people of different religions, and my personal experience has been positive in terms of interactions with individuals of other faiths. Additionally, my working-class background has taught me the value of mutual support and trust within the community, regardless of religious differences. Therefore, I trust people of other religions somewhat.\n\n2"]}, {"persona": {"region": "Giza", "sex": "female", "age": 30, "country": "Egypt", "marital_status": "single", "education": "higher", "social_class": "lower class"}, "question": {"id": "Q62", "variant": 0}, "response": ["Based on my personal experience and cultural context as a single female from Giza, Egypt, I have grown up in a community where religion plays a significant role in people's lives. As part of the lower class, I have witnessed firsthand the social and economic disparities that exist between different religious groups. This has led to a lack of trust and understanding between individuals of different religions in my community. Additionally, my education has taught me to approach cultural relativism with an open mind, understanding that each person's perception of trust towards individuals of another religion may vary. Therefore, based on my background and experiences, I would choose option (2) Trust somewhat. \n\n2"]}, {"persona": {"region": "Giza", "sex": "female", "age": 24, "country": "Egypt", "marital_status": "single", "education": "higher", "social_class": "lower class"}, "question": {"id": "Q62", "variant": 0}, "response": ["Based on the anthropological framework, as a 24-year-old single female from Giza, Egypt, my perspective on trust towards people of another religion is heavily influenced by my cultural context, individual values, and socioeconomic background. In Egypt, there is a long history of religious tension and discrimination, and as a member of the lower class, I have likely faced economic hardships that could influence my trust towards others. Additionally, my personal experience and values may lead me to be cautious in trusting people of another religion due to societal norms and expectations. Therefore, I would choose option 3, \"Do not trust very much,\" as my perspective. \n\n3"]}, {"persona": {"region": "Giza", "sex": "male", "age": 65, "country": "Egypt", "marital_status": "married", "education": "middle", "social_class": "working class"}, "question": {"id": "Q62", "variant": 0}, "response": ["Based on the anthropological framework, my perspective as a married male from Giza, Egypt, who is 65 years old and part of the working class, is influenced by my cultural context, individual values, and personal experience. In Egypt, there is a strong emphasis on religious identity and the coexistence of different religious groups. My age and socioeconomic background may lead me to have a more traditional and conservative view, valuing trust and familiarity within my own religious community. However, my personal experience and cultural context have also exposed me to positive interactions with people of other religions, leading me to have a moderate level of trust in them. Therefore, based on my background and understanding, I would choose option 2, Trust somewhat.\n\n2"]}, {"persona": {"region": "Giza", "sex": "female", "age": 56, "country": "Egypt", "marital_status": "married", "education": "middle", "social_class": "working class"}, "question": {"id": "Q62", "variant": 0}, "response": ["Based on the anthropological framework, as a married female from Giza, Egypt, my emic perspective is heavily influenced by my cultural context, individual values, and personal experiences. Being from a predominantly Muslim country, my cultural context and personal experience have taught me to have a level of trust in people of other religions, but also to be cautious. Additionally, my socioeconomic background as part of the working class has shaped my understanding of trust and relationships with those of different religious backgrounds. Therefore, based on my age and place, I would say that I trust somewhat. \n\n2"]}, {"persona": {"region": "Giza", "sex": "male", "age": 31, "country": "Egypt", "marital_status": "married", "education": "higher", "social_class": "lower middle class"}, "question": {"id": "Q62", "variant": 0}, "response": ["From the perspective of a married male from Giza, Egypt, who has completed higher education and considers himself part of the lower middle class, the answer to the question of how much he trusts people of another religion would be influenced by his cultural context, individual values, and personal experience. In Egypt, there is a long history of religious diversity, and individuals from different religious backgrounds have coexisted for centuries. However, the current social and political climate, along with personal experiences, may lead to a nuanced response. Additionally, his socioeconomic background may also play a role in shaping his perceptions of people from other religions. Therefore, the chosen answer is option (2) Trust somewhat. \n\n2"]}, {"persona": {"region": "Giza", "sex": "male", "age": 28, "country": "Egypt", "marital_status": "single", "education": "middle", "social_class": "working class"}, "question": {"id": "Q62", "variant": 0}, "response": ["Based on my emic perspective as a single male from Giza, Egypt, my trust in people of another religion is influenced by the cultural context of my community, where religious differences can sometimes lead to tensions. My individual values and personal experiences also play a significant role in shaping my trust levels, as I have grown up in a predominantly Muslim community and have limited exposure to individuals of other religions. Additionally, my socioeconomic background as a member of the working class has influenced my interactions with people of different religious backgrounds, leading me to trust somewhat, but not completely, as I have limited personal experiences to draw from. My age and place in Giza also contribute to my nuanced understanding of trust towards people of another religion.\n\n2"]}, {"persona": {"region": "Giza", "sex": "male", "age": 47, "country": "Egypt", "marital_status": "married", "education": "middle", "social_class": "lower middle class"}, "question": {"id": "Q62", "variant": 0}, "response": ["Based on my emic perspective as a married male from Giza, Egypt, my trust in people of another religion is influenced by the cultural context of my surroundings. In Egypt, there is a history of religious diversity and coexistence, which has shaped my individual values and personal experience. My socioeconomic background as part of the lower middle class has also influenced my interactions with people of different religions. Additionally, the cultural relativism in Egypt has taught me to respect and understand different religious beliefs. Therefore, based on my nuanced understanding of the question and my personal experiences, I would choose option (2) Trust somewhat. \n\n2"]}, {"persona": {"region": "Giza", "sex": "male", "age": 26, "country": "Egypt", "marital_status": "single", "education": "middle", "social_class": "lower middle class"}, "question": {"id": "Q62", "variant": 0}, "response": ["From the perspective of a single male from Giza, Egypt, who is 26 years old and part of the lower middle class, my answer to the question of how much I trust people of another religion would be influenced by several factors. Firstly, my cultural context and religious upbringing would play a significant role in shaping my views on this issue. Additionally, my socioeconomic background and level of education would also influence my perceptions. The concept of cultural relativism is important to consider, as it reminds us that there is no hierarchy of cultures. Furthermore, my personal experiences and individual values would contribute to my level of trust in people of another religion. Ultimately, my nuanced understanding of this question would lead me to choose the following option:\n\n2"]}, {"persona": {"region": "Giza", "sex": "male", "age": 48, "country": "Egypt", "marital_status": "married", "education": "middle", "social_class": "upper middle class"}, "question": {"id": "Q62", "variant": 0}, "response": ["Based on the anthropological framework, my perspective as a married male from Giza, Egypt, who is 48 years old and part of the upper middle class, is influenced by my cultural context, individual values, and personal experience. In Egypt, there is a long history of coexistence between people of different religions, and I have personally had positive interactions with individuals of other religious backgrounds. Additionally, my socioeconomic background may lead me to have a more open and tolerant perspective. Therefore, I would choose option 2: Trust somewhat.\n\n2"]}, {"persona": {"region": "Menya", "sex": "male", "age": 61, "country": "Egypt", "marital_status": "married", "education": "middle", "social_class": "working class"}, "question": {"id": "Q62", "variant": 0}, "response": ["Based on the anthropological framework, my perspective on how much I trust people of another religion is influenced by my cultural context, individual values, and socioeconomic background. As a married male from Menya, Egypt, I have been shaped by the cultural and religious diversity of my community. My middle level education has provided me with some exposure to different belief systems, but my working class status and age have also influenced my perspectives. I understand the importance of cultural relativism and nuance in understanding and respecting different belief systems. Therefore, my answer to the question is:\n\n2"]}, {"persona": {"region": "Menya", "sex": "male", "age": 41, "country": "Egypt", "marital_status": "married", "education": "middle", "social_class": "lower middle class"}, "question": {"id": "Q62", "variant": 0}, "response": ["Based on my emic perspective as a married male from Menya, Egypt, and considering my cultural context and individual values, I would answer this question by selecting option 2, \"Trust somewhat.\" In my community, there is a strong sense of religious identity and trust is largely based on shared religious beliefs. However, I have also had personal experiences with individuals of other religions who have shown themselves to be trustworthy. Additionally, my lower middle class socioeconomic background has influenced my interactions with people of different religions, as I have had to rely on cooperation and trust with individuals from various backgrounds in order to navigate daily life. Therefore, while I may not trust completely, I am willing to extend some level of trust to people of another religion based on my experiences and cultural context. \n\n2"]}, {"persona": {"region": "Menya", "sex": "female", "age": 43, "country": "Egypt", "marital_status": "married", "education": "higher", "social_class": "working class"}, "question": {"id": "Q62", "variant": 0}, "response": ["Based on the anthropological framework, my emic perspective as a married female from Menya, Egypt, who is 43 years old, has completed higher education, and considers myself part of the working class, is influenced by cultural context, individual values, and personal experience. In Menya, people have a strong sense of community and trust is often built based on cultural and religious affiliations. However, my higher education has also exposed me to different perspectives and ways of thinking, leading me to be more open-minded and willing to trust people of other religions to some extent. Additionally, my working-class background has taught me the importance of cooperation and collaboration with people from diverse backgrounds in order to succeed. Therefore, I choose option (2) Trust somewhat. \n\n2"]}, {"persona": {"region": "Menya", "sex": "male", "age": 57, "country": "Egypt", "marital_status": "married", "education": "middle", "social_class": "lower middle class"}, "question": {"id": "Q62", "variant": 0}, "response": ["Based on my cultural context as a married male from Menya, Egypt, and my lower middle class background, I understand the importance of religion in our society and the potential impact it has on trust. In my culture, there are strong religious divisions and tensions between different religious groups, and this has been ingrained in our society for generations. Therefore, my personal experience and the cultural context I am a part of would lead me to be cautious and not trust people of another religion very much. This is not a reflection of my personal values, but rather a result of the cultural and socioeconomic factors that have shaped my perspective.\n\n3"]}, {"persona": {"region": "Menya", "sex": "male", "age": 42, "country": "Egypt", "marital_status": "divorced", "education": "middle", "social_class": "lower middle class"}, "question": {"id": "Q62", "variant": 0}, "response": ["Based on the anthropological framework, my response is influenced by my cultural context as a divorced male from Menya, Egypt. In Egypt, religion plays a significant role in society, and there can be tensions between different religious groups. As a lower middle class individual, my socioeconomic background also shapes my perspective, as I may have had limited exposure to people of other religions due to my financial constraints. Additionally, my individual values and personal experience may lead me to be cautious in trusting people of another religion, as I may have experienced or heard about instances of religious tensions in my community. Therefore, my response is influenced by a combination of cultural context, socioeconomic background, and personal experience, leading me to select option (3) Do not trust very much. \n\n3"]}, {"persona": {"region": "Menya", "sex": "female", "age": 59, "country": "Egypt", "marital_status": "married", "education": "middle", "social_class": "upper middle class"}, "question": {"id": "Q62", "variant": 0}, "response": ["Based on the anthropological framework, as a married female from Menya, Egypt, my emic perspective would be influenced by my cultural context, individual values, and personal experiences. Menya is a predominantly Muslim region, and as a member of the upper middle class, I likely have limited interactions with people of other religions. My upbringing and social circles may have instilled a sense of distrust or wariness towards those of different faiths. Additionally, my age and education level may have contributed to a more traditional and conservative mindset. Therefore, I would choose option 3: Do not trust very much. \n\n3"]}, {"persona": {"region": "Menya", "sex": "female", "age": 31, "country": "Egypt", "marital_status": "married", "education": "middle", "social_class": "working class"}, "question": {"id": "Q62", "variant": 0}, "response": ["Based on my emic and etic perspectives, as a married female from Menya, Egypt, I am aware of the in-group and out-group ways of thinking about people of different religions. The cultural context of Menya, Egypt, where religion plays a major role in daily life, also influences my answer. My individual values and personal experience, as well as my socioeconomic background as part of the working class, also play a significant role in shaping my perception of people of other religions. Additionally, the concept of cultural relativism and the nuanced phrasing of the question are important factors to consider. Taking all of this into account, I choose the following option:\n\n3"]}, {"persona": {"region": "Menya", "sex": "male", "age": 55, "country": "Egypt", "marital_status": "single", "education": "middle", "social_class": "working class"}, "question": {"id": "Q62", "variant": 0}, "response": ["Based on my individual values and personal experience, as well as my socioeconomic background as a working-class man from Menya, Egypt, I believe that trust in people of another religion is influenced by cultural context and the emic and etic perspectives of my community. I have grown up in a society where religious beliefs and practices are deeply ingrained in the cultural context, and my personal experiences have taught me to trust and coexist with people of other religions. Additionally, as a middle-aged man, I have learned the importance of respecting and understanding different belief systems. Therefore, I would choose:\n\n2"]}, {"persona": {"region": "Menya", "sex": "female", "age": 28, "country": "Egypt", "marital_status": "married", "education": "higher", "social_class": "lower middle class"}, "question": {"id": "Q62", "variant": 0}, "response": ["Based on my personal experience and cultural context, as a married female from Menya, Egypt, I have been raised in a society where religion plays a significant role in shaping our values and beliefs. Additionally, my lower middle-class socioeconomic background has also influenced my interactions with people of different religions. In Menya, there is a strong sense of community and trust within the same religious group, but interactions with people of different religions are generally met with caution. This is not to say that I do not trust people of another religion at all, but rather that I have learned to approach these interactions with a sense of reservation. Therefore, I would choose option (3) Do not trust very much."]}, {"persona": {"region": "Menya", "sex": "male", "age": 24, "country": "Egypt", "marital_status": "single", "education": "middle", "social_class": "working class"}, "question": {"id": "Q62", "variant": 0}, "response": ["Based on the anthropological framework, as a single male from Menya, Egypt, who has completed middle education and considers myself part of the working class, my perspective on how much I trust people of another religion would be heavily influenced by my cultural context, individual values, and socioeconomic background. Living in a predominantly Muslim society, I have been taught to trust and respect people of other religions, but there may also be societal pressures that influence my level of trust. Additionally, my socioeconomic background as a working-class individual may impact my interactions with people of other religions. Overall, my answer would be influenced by a combination of cultural context, individual values, and socioeconomic background.\n\n2"]}, {"persona": {"region": "Menya", "sex": "female", "age": 23, "country": "Egypt", "marital_status": "married", "education": "middle", "social_class": "working class"}, "question": {"id": "Q62", "variant": 0}, "response": ["Based on my emic perspective as a married female from Menya, Egypt, and considering the cultural context and socio-economic background, I would say that my trust in people of another religion would be somewhat limited. This is influenced by the cultural and religious diversity in Menya, as well as the socioeconomic factors that have shaped my experiences and interactions with people of different religious backgrounds. Additionally, my personal values and individual experiences have also contributed to this perspective. Therefore, I would choose option (2) Trust somewhat. \n\n2"]}, {"persona": {"region": "Menya", "sex": "male", "age": 27, "country": "Egypt", "marital_status": "single", "education": "middle", "social_class": "lower middle class"}, "question": {"id": "Q62", "variant": 0}, "response": ["Based on my emic perspective, growing up in Menya, Egypt, I have been surrounded by a predominantly Muslim community and have been taught to have a certain level of trust and respect for people of the same religion. However, the etic perspective also influences my understanding, as I have been exposed to media and societal narratives that often portray people of other religions in a negative light. Additionally, my lower middle class socioeconomic background has made me more cautious and less trusting of people in general, regardless of their religion. The cultural relativism aspect of the framework also reminds me that there is no hierarchy of culture and that my personal experiences and values may not align with those of others. Therefore, my nuanced understanding of this question leads me to choose option (3) Do not trust very much. \n\n3"]}, {"persona": {"region": "Asyut", "sex": "male", "age": 30, "country": "Egypt", "marital_status": "married", "education": "middle", "social_class": "working class"}, "question": {"id": "Q62", "variant": 0}, "response": ["Based on the anthropological framework, as a married male from Asyut, Egypt, my emic perspective is heavily influenced by my cultural context, individual values, and personal experiences. As a part of the working class in a predominantly Muslim community, I have been raised to have a strong sense of trust and solidarity within my own religious group. Additionally, the socioeconomic background and historical context of Egypt have also shaped my perception of people from other religions. Therefore, I would choose option (2) Trust somewhat. This choice reflects the nuanced understanding of trust and the influence of cultural relativism on my perspective."]}, {"persona": {"region": "Asyut", "sex": "female", "age": 26, "country": "Egypt", "marital_status": "married", "education": "middle", "social_class": "working class"}, "question": {"id": "Q62", "variant": 0}, "response": ["Based on the anthropological framework, my perspective as a married female from Asyut, Egypt, of 26 years old, with a middle education level and part of the working class, is heavily influenced by my cultural context, individual values, and socioeconomic background. As a member of a conservative society, my trust in people of another religion is somewhat limited due to the prevailing social norms and historical tensions between different religious groups in Egypt. Additionally, my working-class status means I may have limited exposure to diverse religious communities and may rely on my personal experiences and the experiences of those in my immediate social circle to inform my level of trust in individuals from other religions. Therefore, my answer would be:\n\n2) Trust somewhat"]}, {"persona": {"region": "Asyut", "sex": "male", "age": 32, "country": "Egypt", "marital_status": "single", "education": "higher", "social_class": "lower middle class"}, "question": {"id": "Q62", "variant": 0}, "response": ["Based on my emic perspective as a single male from Asyut, Egypt, I understand that there are in-group ways of thinking and answering this question. My cultural context also plays a significant role in shaping my views, as Asyut is known for its conservative and traditional values. Additionally, my individual values and personal experiences have led me to have a somewhat cautious approach when it comes to trusting people of another religion. My lower middle-class socioeconomic background also influences my views, as I have had limited exposure to people of different religions due to financial constraints. Furthermore, the cultural relativism perspective reminds me that my views are shaped by my specific cultural and social context. Therefore, based on my nuanced understanding of the question and these factors, I would choose option (2) Trust somewhat.\n\n2"]}, {"persona": {"region": "Asyut", "sex": "female", "age": 21, "country": "Egypt", "marital_status": "married", "education": "middle", "social_class": "working class"}, "question": {"id": "Q62", "variant": 0}, "response": ["Based on the anthropological framework, as a married female from Asyut, Egypt, I am influenced by my cultural context, individual values, and socioeconomic background. As a member of a working-class family and having completed only middle education level, I have limited exposure to people of different religions. My perceptions are also shaped by the cultural relativism prevalent in my community, which may lead me to have limited trust in people of another religion. Additionally, my age and place also play a role in my understanding, as I may have been taught to be cautious of those with different religious beliefs. Overall, my nuanced understanding of this question leads me to select option (3) - Do not trust very much.\n\n3"]}, {"persona": {"region": "Asyut", "sex": "female", "age": 30, "country": "Egypt", "marital_status": "married", "education": "higher", "social_class": "working class"}, "question": {"id": "Q62", "variant": 0}, "response": ["Based on the anthropological framework, as a married female from Asyut, Egypt, my emic perspective would be influenced by my cultural context, individual values, socioeconomic background, and space and time. As a member of the working class in Asyut, I have likely had personal experiences and interactions with people of different religions, and my trust in them would be shaped by these experiences. Additionally, cultural relativism is important to consider, as Egypt is a diverse country with a long history of different religious groups coexisting. Therefore, my answer is influenced by my nuanced understanding of the question and my personal experiences.\n\n2"]}, {"persona": {"region": "Asyut", "sex": "female", "age": 42, "country": "Egypt", "marital_status": "married", "education": "higher", "social_class": "lower middle class"}, "question": {"id": "Q62", "variant": 0}, "response": ["Based on the anthropological framework, my emic perspective as a married female from Asyut, Egypt, would be influenced by my cultural context, individual values, and socioeconomic background. Living in a predominantly Muslim society, I have been raised to have a certain level of trust in people of other religions, but there may also be a level of caution due to historical and societal tensions. My personal experience and values would also play a significant role in shaping my level of trust. Considering my age and place, I would have witnessed and experienced various interactions with people of different religions, which would inform my level of trust. As a member of the lower middle class, my socioeconomic background may also impact my level of trust, as economic disparities can sometimes lead to tensions between different religious communities. Therefore, based on my perspective, I would choose:\n\n2"]}, {"persona": {"region": "Sohag", "sex": "male", "age": 63, "country": "Egypt", "marital_status": "married", "education": "middle", "social_class": "lower middle class"}, "question": {"id": "Q62", "variant": 0}, "response": ["Based on my emic perspective as a married male from Sohag, Egypt, who is 63 years old and part of the lower middle class, my cultural context and individual values heavily influence my level of trust towards people of another religion. Living in a predominantly Muslim community, the cultural context in Sohag emphasizes the importance of religious identity and the potential for religious tensions. As a member of the lower middle class, my socioeconomic background also plays a role in shaping my trust towards people of other religions. Additionally, my age and personal experiences have likely shaped my perceptions and levels of trust. Considering the nuanced phrasing of the question and the influence of cultural relativism, I would choose option (2) Trust somewhat, as it reflects the complex interplay of cultural, personal, and socioeconomic factors in my mindset.\n\n2"]}, {"persona": {"region": "Sohag", "sex": "male", "age": 27, "country": "Egypt", "marital_status": "married", "education": "middle", "social_class": "working class"}, "question": {"id": "Q62", "variant": 0}, "response": ["Based on the anthropological framework, my perspective as a married male from Sohag, Egypt, is shaped by my cultural context, individual values, and socioeconomic background. In Sohag, people are primarily Muslim and there is a history of tension between different religious groups. My middle education level and working-class status also influence my perspective, as I may have limited exposure to people of other religions and may have experienced economic hardship, which can lead to mistrust. Additionally, cultural relativism is important to consider, as my perspective may differ from someone from a different cultural background. Therefore, my personal experience and cultural context lead me to choose option 2: Trust somewhat.\n\n2"]}, {"persona": {"region": "Sohag", "sex": "male", "age": 56, "country": "Egypt", "marital_status": "married", "education": "higher", "social_class": "upper middle class"}, "question": {"id": "Q62", "variant": 0}, "response": ["Based on the anthropological framework, my cultural context as a married male from Sohag, Egypt, heavily influences my understanding and answer to this question. Sohag is known for its religious diversity, and as an educated member of the upper middle class, I have been exposed to and interacted with people of different religions. My personal experience and individual values also play a significant role in my perception of trust towards people of another religion. Additionally, cultural relativism is crucial in my understanding, as I believe that no one culture or religion is \"better\" than another. Therefore, my answer is: \n\n2\n\nTrust somewhat"]}, {"persona": {"region": "Sohag", "sex": "male", "age": 51, "country": "Egypt", "marital_status": "married", "education": "higher", "social_class": "lower middle class"}, "question": {"id": "Q62", "variant": 0}, "response": ["Based on my personal experience and cultural context as a married male from Sohag, Egypt, I have been brought up to value and respect people of all religions. In my community, there is a diverse range of religious beliefs, and I have always believed in the importance of tolerance and understanding. My lower middle class background has also taught me the value of cooperation and mutual respect, which has influenced my perspective on trusting people of another religion. Additionally, my higher education has allowed me to appreciate the nuances of different belief systems and has contributed to my open-minded approach. Therefore, I would choose option (2) Trust somewhat. \n\n2"]}, {"persona": {"region": "Sohag", "sex": "female", "age": 26, "country": "Egypt", "marital_status": "married", "education": "higher", "social_class": "working class"}, "question": {"id": "Q62", "variant": 0}, "response": ["Based on the anthropological framework, my perspective as a married female from Sohag, Egypt, is influenced by my cultural context, individual values, and socioeconomic background. In Egypt, religion plays a significant role in people's lives, and there are cultural norms and expectations regarding interactions with individuals from other religions. Additionally, my personal experiences and values, shaped by my education and working-class background, have influenced my understanding of trust and interactions with people of different religious beliefs. Therefore, my response to the question will be influenced by these factors.\n\n2"]}, {"persona": {"region": "Sohag", "sex": "female", "age": 29, "country": "Egypt", "marital_status": "married", "education": "higher", "social_class": "upper middle class"}, "question": {"id": "Q62", "variant": 0}, "response": ["From an emic perspective, as a married female from Sohag, Egypt, my cultural context and religious background heavily influence my perception of people of another religion. Living in a predominantly Muslim community, I have been raised to have a strong sense of trust and solidarity within my own religious community. However, I have also been educated at a higher level and have been exposed to different perspectives and ideas. My individual values and personal experience have taught me to approach people of other religions with an open mind and to trust them somewhat, as I believe in the importance of tolerance and understanding. Additionally, my socioeconomic background as part of the upper middle class has provided me with opportunities to interact with people from diverse backgrounds, further shaping my perspective on trust and relationships with individuals of other religions. Therefore, based on my nuanced understanding and the influence of my cultural context, I would choose option (2) Trust somewhat.\n\n2"]}, {"persona": {"region": "Sohag", "sex": "male", "age": 51, "country": "Egypt", "marital_status": "married", "education": "middle", "social_class": "lower middle class"}, "question": {"id": "Q62", "variant": 0}, "response": ["Based on the anthropological framework, my perspective on trusting people of another religion is shaped by my cultural context, individual values and personal experience, and socioeconomic background. As a married male from Sohag, Egypt, I come from a community with a strong religious identity and a history of inter-religious tension. My personal experience and the cultural context have led me to have a somewhat cautious approach to trusting people of another religion, as I have witnessed and experienced instances of prejudice and discrimination. Additionally, my lower middle class socioeconomic background has influenced my perception, as it has limited my exposure to diverse perspectives and interactions with people from different religious backgrounds. Therefore, I would choose option (2) Trust somewhat.\n\n2"]}, {"persona": {"region": "Qena", "sex": "male", "age": 32, "country": "Egypt", "marital_status": "single", "education": "middle", "social_class": "working class"}, "question": {"id": "Q62", "variant": 0}, "response": ["Based on my personal experience and cultural context, as a single male from Qena, Egypt, I am well aware of the importance of religion in our society. I have grown up in a community where religious identity often plays a significant role in how people interact with one another. Additionally, as part of the working class, I have observed how socioeconomic background can also influence trust and relationships between people of different religious backgrounds. Furthermore, considering the emic and etic perspectives, I understand that there may be in-group and out-group ways of thinking about trust towards people of another religion. Therefore, based on these factors, I would choose option (2) Trust somewhat. \n\n2"]}, {"persona": {"region": "Qena", "sex": "male", "age": 54, "country": "Egypt", "marital_status": "married", "education": "middle", "social_class": "lower middle class"}, "question": {"id": "Q62", "variant": 0}, "response": ["Based on the anthropological framework, my emic perspective as a married male from Qena, Egypt, with a lower middle class socioeconomic background and completed middle education level, is heavily influenced by my cultural context and individual values. In my community, there is a strong sense of kinship and trust is often based on personal connections and familiarity. Additionally, the cultural relativism of Egypt means that there is a coexistence of different religions, which has influenced my understanding and acceptance of people from other religious backgrounds. My age and place in society also play a role in shaping my perspective, as I have witnessed the importance of interfaith relationships in my community. Therefore, my answer to the question of how much I trust people of another religion would be:\n\n2\n\nTrust somewhat"]}, {"persona": {"region": "Qena", "sex": "male", "age": 25, "country": "Egypt", "marital_status": "single", "education": "lower", "social_class": "lower class"}, "question": {"id": "Q62", "variant": 0}, "response": ["Based on my personal experience and cultural context, as a lower class single male from Qena, Egypt, I have grown up in a community where religion plays a significant role in shaping social interactions and relationships. My limited education and socioeconomic background have also influenced my understanding of the world around me. Considering the emic and etic perspectives, as well as the cultural relativism and individual values, I have been taught to be cautious and wary of people from other religions. This is not to say that I do not interact with them, but there is a certain level of distrust that has been ingrained in me from a young age. Additionally, the nuanced phrasing of the question also plays a role in my response as it is important to consider the specific context in which this question is being asked. \n\n3"]}, {"persona": {"region": "Aswan", "sex": "male", "age": 34, "country": "Egypt", "marital_status": "single", "education": "middle", "social_class": "lower class"}, "question": {"id": "Q62", "variant": 0}, "response": ["From an emic perspective, as a single male from Aswan, Egypt, my trust in people of another religion is influenced by my cultural context and socioeconomic background. As someone from a lower class background in a country with a predominantly Muslim population, my interactions with people of other religions may be limited. Additionally, my personal experiences and values may shape my level of trust in individuals from other religious backgrounds. Considering the cultural relativism and nuance of the question, my answer would be influenced by the nuances of the relationships and interactions I have had with individuals of other religions. Furthermore, the historical and contemporary context of religious relations in Egypt is a key factor in my perception of trust towards people of another religion.\n\n3"]}, {"persona": {"region": "Aswan", "sex": "female", "age": 31, "country": "Egypt", "marital_status": "married", "education": "middle", "social_class": "lower middle class"}, "question": {"id": "Q62", "variant": 0}, "response": ["Based on my cultural context, as a married female from Aswan, Egypt, where religion plays a significant role in daily life, my trust in people of another religion would be influenced by my individual values and personal experience. In this conservative and traditional society, there is a strong emphasis on religious identity and differences between religious groups. Additionally, my lower middle class socioeconomic background and limited education level may have limited my exposure to individuals of different faiths, leading to a more insular perspective. Therefore, I would choose option (3) Do not trust very much."]}, {"persona": {"region": "Aswan", "sex": "female", "age": 39, "country": "Egypt", "marital_status": "married", "education": "middle", "social_class": "working class"}, "question": {"id": "Q62", "variant": 0}, "response": ["Based on the anthropological framework, as a married female from Aswan, Egypt, with a middle education level and working-class background, my answer to the question of how much I trust people of another religion would be influenced by my cultural context, individual values, and personal experience. In Aswan, there is a history of coexistence between different religious groups, and I have been raised to respect and trust people of other religions. Additionally, my personal experience has shown me that individuals should not be judged based solely on their religious affiliation. Therefore, I would choose option (2) Trust somewhat. \n\n2"]}, {"persona": {"region": "Qena", "sex": "female", "age": 27, "country": "Egypt", "marital_status": "married", "education": "lower", "social_class": "lower middle class"}, "question": {"id": "Q62", "variant": 0}, "response": ["In Qena, Egypt, the cultural context is highly influential in shaping perceptions and attitudes towards people of other religions. As a lower middle class woman who has completed lower education, my personal experience and individual values are significant in how I view others. Additionally, my socioeconomic background plays a role in my interactions with people of different religious beliefs. Cultural relativism is crucial in understanding and respecting the diverse beliefs and practices of others, and my age and place also factor into my perceptions. Ultimately, my nuanced understanding of the question, combined with the factors mentioned above, leads me to choose option 2: Trust somewhat."]}, {"persona": {"region": "Qena", "sex": "male", "age": 40, "country": "Egypt", "marital_status": "single", "education": "middle", "social_class": "lower middle class"}, "question": {"id": "Q62", "variant": 0}, "response": ["From my perspective as a single male from Qena, Egypt, my understanding of trust towards people of another religion is heavily influenced by my emic and etic perspective. Living in a predominantly Muslim community, I have been taught to trust and respect people of all religions as part of our cultural context. My personal experience and values have also shaped my understanding, as I have had positive interactions with individuals of different religious backgrounds. Additionally, my lower middle class socioeconomic background has led me to rely on the support and cooperation of people from various religious groups in our community. Therefore, I believe that trust towards people of another religion is essential for social cohesion and mutual respect.\n\n2"]}, {"persona": {"region": "Qena", "sex": "male", "age": 30, "country": "Egypt", "marital_status": "single", "education": "middle", "social_class": "working class"}, "question": {"id": "Q62", "variant": 0}, "response": ["Based on my emic perspective as a single male from Qena, Egypt, I have been raised in a cultural context where religion plays a significant role in shaping social interactions and personal values. My individual values and personal experiences have been influenced by this cultural context, and I have been taught to have a certain level of trust for people of other religions. Additionally, my socioeconomic background as part of the working class has also shaped my understanding of trust in people of different religions. Lastly, the nuance of the question is important as it is not a simple yes or no answer, but rather a nuanced understanding of trust in people of another religion.\n\n2"]}]