[{"persona": {"region": "Fayoum", "sex": "male", "age": 46, "country": "Egypt", "marital_status": "married", "education": "higher", "social_class": "lower middle class"}, "question": {"id": "Q209", "variant": 0}, "response": ["Based on the anthropological framework, as a married male from Fayoum, Egypt, my emic perspective on signing a political action petition is influenced by my cultural context, individual values, and socioeconomic background. In my cultural context, there is a strong emphasis on community and family, and political actions may be viewed with caution due to potential social repercussions. Additionally, my lower middle-class status may lead me to prioritize the stability of my family and livelihood over potential political activism. As a 46-year-old with higher education, I may have a nuanced understanding of the political landscape and the potential impact of signing a petition. Considering these factors, I would never do so due to the potential risks involved.\n\n3"]}, {"persona": {"region": "Fayoum", "sex": "female", "age": 30, "country": "Egypt", "marital_status": "married", "education": "middle", "social_class": "lower middle class"}, "question": {"id": "Q209", "variant": 0}, "response": ["Based on the anthropological framework, my emic perspective as a married female from Fayoum, Egypt, is influenced by my cultural context, individual values, and socioeconomic background. In my community, there is a strong emphasis on family and social cohesion, and political action may be viewed as disruptive to these values. Additionally, my lower middle class status means that I may not have had the same access to education and opportunities as those from higher socioeconomic backgrounds, impacting my awareness and engagement with political action. Therefore, I would never do (3) it."]}, {"persona": {"region": "Fayoum", "sex": "male", "age": 60, "country": "Egypt", "marital_status": "married", "education": "higher", "social_class": "working class"}, "question": {"id": "Q209", "variant": 0}, "response": ["From the perspective of a married male from Fayoum, Egypt, who is 60 years old, has completed higher education, and considers himself part of the working class, it is important to consider the emic and etic perspectives in this context. In Egyptian society, there is a strong cultural context of political involvement and activism, especially for those who are educated and part of the working class. Personal experience and individual values also play a significant role, as the socioeconomic background and age of the individual shape their perception of political action. Additionally, the nuanced phrasing of the question and the understanding of cultural relativism are crucial in understanding the decision-making process. Taking all of these factors into account, I would choose the option:\n2. Might do"]}, {"persona": {"region": "Fayoum", "sex": "male", "age": 20, "country": "Egypt", "marital_status": "single", "education": "middle", "social_class": "lower middle class"}, "question": {"id": "Q209", "variant": 0}, "response": ["Based on the anthropological framework, my emic perspective as a single male from Fayoum, Egypt, of 20 years of age and completed middle education level, and part of the lower middle class, is deeply influenced by my cultural context, individual values, and socioeconomic background. In my community, signing a political action petition is not a common practice, as it is often seen as a risky and potentially dangerous activity. Additionally, my personal experience and values lead me to prioritize stability and safety, and I do not feel that signing a political action petition aligns with my goals and beliefs. Furthermore, cultural relativism teaches me to be respectful of the norms and values of my community, and I understand that my decision may differ from others based on their own circumstances and perspectives.\n\n2"]}, {"persona": {"region": "Fayoum", "sex": "female", "age": 39, "country": "Egypt", "marital_status": "married", "education": "higher", "social_class": "lower middle class"}, "question": {"id": "Q209", "variant": 0}, "response": ["Based on the anthropological framework, as a married female from Fayoum, Egypt, my emic perspective and cultural context would heavily influence my decision. Given the cultural and socioeconomic background, as well as the importance of individual values and personal experience, I might consider signing a political action petition if I strongly believe in the cause and if it aligns with my personal values. Additionally, the nuance of the question and the specific wording would also play a role in my decision. \n\n2"]}, {"persona": {"region": "Fayoum", "sex": "male", "age": 33, "country": "Egypt", "marital_status": "married", "education": "higher", "social_class": "working class"}, "question": {"id": "Q209", "variant": 0}, "response": ["Based on the anthropological framework, my emic perspective as a married male from Fayoum, Egypt, with a working-class background and higher education, is influenced by my cultural context, individual values, and socioeconomic background. In Egyptian society, there is a strong emphasis on community and collective action, which aligns with my personal values. Additionally, my socioeconomic background as a working-class individual means that I am more likely to be politically engaged and aware of social issues. Furthermore, my higher education has equipped me with the critical thinking skills to understand the importance of political action. Therefore, from my perspective, I have signed a political action petition in the past.\n\n1"]}, {"persona": {"region": "Port Said", "sex": "female", "age": 45, "country": "Egypt", "marital_status": "married", "education": "higher", "social_class": "lower middle class"}, "question": {"id": "Q209", "variant": 0}, "response": ["Based on the anthropological framework, as a married female from Port Said, Egypt, my emic perspective is influenced by my cultural context, individual values, and socioeconomic background. In my community, there is a strong emphasis on family and community ties, and as a lower middle class individual, I am more likely to prioritize meeting the basic needs of my family over engaging in political actions. Additionally, my personal experience and education level have shaped my understanding of political action, and I am more inclined to engage in informal forms of activism such as community organizing rather than signing formal political action petitions. Therefore, my response would be:\n\n2"]}, {"persona": {"region": "Port Said", "sex": "male", "age": 42, "country": "Egypt", "marital_status": "married", "education": "middle", "social_class": "lower middle class"}, "question": {"id": "Q209", "variant": 0}, "response": ["From the perspective of a married male from Port Said, Egypt, who is 42 years old, has completed middle education, and considers himself part of the lower middle class, the answer to the question of whether he has ever signed a political action petition would be influenced by a variety of factors. The cultural context in Egypt, especially in lower middle class communities, often involves a strong sense of loyalty to the government and a reluctance to engage in overt political activities. Additionally, the socioeconomic background and educational level of this individual may contribute to a lack of familiarity with or access to political action petitions. Furthermore, the individual values and personal experience of this persona may lead him to prioritize meeting the basic needs of his family over engaging in political activism. Considering these factors, the most likely response from this perspective would be option (3) \"Would never do.\" \n\n3"]}, {"persona": {"region": "Port Said", "sex": "male", "age": 28, "country": "Egypt", "marital_status": "single", "education": "middle", "social_class": "lower middle class"}, "question": {"id": "Q209", "variant": 0}, "response": ["Based on my personal experience and socioeconomic background, as a 28-year-old single male from Port Said, Egypt, and part of the lower middle class, I have not had the opportunity to sign a political action petition. The cultural context and nuance of the question also play a role, as political activism may not be as prevalent in my community. Additionally, my emic perspective as a member of this social and cultural group may influence my decision. \n\n2"]}, {"persona": {"region": "Port Said", "sex": "female", "age": 30, "country": "Egypt", "marital_status": "married", "education": "higher", "social_class": "lower middle class"}, "question": {"id": "Q209", "variant": 0}, "response": ["Based on my emic perspective as a married female from Port Said, Egypt, I understand that my cultural context and socioeconomic background have a significant impact on my willingness to sign a political action petition. In Egypt, there is a strong emphasis on traditional gender roles and expectations, and as a lower middle class woman, I prioritize my family's well-being and stability. Additionally, the political climate in Egypt is complex and signing a political action petition could potentially have negative repercussions for myself and my family. Therefore, based on my individual values and personal experience, I would never sign a political action petition.\n\n3"]}, {"persona": {"region": "Port Said", "sex": "male", "age": 30, "country": "Egypt", "marital_status": "divorced", "education": "middle", "social_class": "lower middle class"}, "question": {"id": "Q209", "variant": 0}, "response": ["Based on my emic perspective as a divorced male from Port Said, Egypt, my cultural context, individual values, and socioeconomic background all play a role in my decision. In Egypt, there is a complex political and social landscape, and signing a political action petition could have significant consequences for my personal and professional life. Additionally, my lower middle-class status and level of education may influence my understanding of political issues and my willingness to engage in political activism. Therefore, my decision is based on a nuanced understanding of the potential risks and benefits, as well as my personal values and experiences.\n\n2"]}, {"persona": {"region": "Port Said", "sex": "female", "age": 19, "country": "Egypt", "marital_status": "single", "education": "middle", "social_class": "lower middle class"}, "question": {"id": "Q209", "variant": 0}, "response": ["From the emic perspective, as a single female from Port Said, Egypt, and being 19 years of age and part of the lower middle class, my cultural context and socioeconomic background play a significant role in shaping my response to the question. In Egypt, there is a long history of political activism, and signing a political action petition is often seen as a way to participate in the democratic process and advocate for social change. However, as a young woman from a lower middle class background, I may face societal pressures and economic constraints that could impact my willingness to participate in such activities. Additionally, my individual values and personal experiences may influence my decision, as I may have witnessed or experienced the consequences of political activism firsthand. Considering the nuanced phrasing of the question, I would choose option (2) Might do, as I am open to the possibility of signing a political action petition, but would carefully consider the potential risks and benefits before doing so."]}, {"persona": {"region": "Fayoum", "sex": "male", "age": 40, "country": "Egypt", "marital_status": "married", "education": "middle", "social_class": "working class"}, "question": {"id": "Q209", "variant": 0}, "response": ["Based on the anthropological framework, my emic perspective as a married male from Fayoum, Egypt, who is 40 years old and part of the working class, is influenced by my cultural context, socioeconomic background, and personal values. In my cultural context, political engagement may be viewed as a privilege of the elite, and my socioeconomic background may limit my ability to participate in political action. Additionally, my personal experience and individual values may lead me to prioritize providing for my family over engaging in political activities. Therefore, I would likely never sign a political action petition.\n\n3"]}, {"persona": {"region": "Fayoum", "sex": "male", "age": 23, "country": "Egypt", "marital_status": "single", "education": "higher", "social_class": "lower middle class"}, "question": {"id": "Q209", "variant": 0}, "response": ["From the emic perspective, as a single male from Fayoum, Egypt, my cultural context and socio-economic background play a significant role in my decision-making. The cultural context of Egypt, particularly in lower middle-class communities, emphasizes the importance of collective action and solidarity. Additionally, my individual values and personal experiences have shaped my understanding of the importance of political activism, especially in light of recent social and economic challenges. Considering the nuance of the question and the potential impact of my actions, I would be inclined to consider signing a political action petition as a means of contributing to positive change in my community and country. Therefore, I might do so, given the opportunity.\n\n2"]}, {"persona": {"region": "Fayoum", "sex": "female", "age": 38, "country": "Egypt", "marital_status": "married", "education": "middle", "social_class": "lower middle class"}, "question": {"id": "Q209", "variant": 0}, "response": ["Based on my cultural context, as a married female from Fayoum, Egypt, my socioeconomic background puts me in the lower middle class. My individual values and personal experience have shaped my perspective, and I have only completed middle education level. Given the cultural relativism in my community, signing a political action petition might be perceived as going against the norms and may not align with my personal values. Additionally, my age and place within this cultural context also play a role in my decision-making process. Therefore, I would never do so, as it is not aligned with my cultural and personal values, and may not be perceived favorably within my community.\n\n3"]}, {"persona": {"region": "Fayoum", "sex": "male", "age": 32, "country": "Egypt", "marital_status": "married", "education": "middle", "social_class": "lower middle class"}, "question": {"id": "Q209", "variant": 0}, "response": ["Based on the anthropological framework, my emic perspective as a married male from Fayoum, Egypt, who is 32 years old and part of the lower middle class, is heavily influenced by my cultural context, individual values, and socioeconomic background. In my cultural context, political activism may not be as prevalent as in other areas, and my individual values and personal experiences may lead me to prioritize providing for my family over engaging in political action. Additionally, my lower middle class socioeconomic background may limit my access to information and resources necessary for political activism. Therefore, based on these factors, I would never sign a political action petition.\n\n3"]}, {"persona": {"region": "Fayoum", "sex": "male", "age": 31, "country": "Egypt", "marital_status": "married", "education": "higher", "social_class": "working class"}, "question": {"id": "Q209", "variant": 0}, "response": ["Based on the anthropological framework, as a married male from Fayoum, Egypt, my emic perspective would be influenced by my cultural context, individual values, and socioeconomic background. In Egypt, there is a strong emphasis on collective action and community involvement, which is reflected in the importance of political action and petitions. However, as a member of the working class, I may have limited time and resources to engage in such activities, and my personal experience may have shaped my views on the effectiveness of political action. Therefore, I might consider signing a political action petition, but it would depend on the specific circumstances and the potential impact it could have on my community. \n\n2"]}, {"persona": {"region": "Fayoum", "sex": "male", "age": 31, "country": "Egypt", "marital_status": "married", "education": "middle", "social_class": "lower middle class"}, "question": {"id": "Q209", "variant": 0}, "response": ["Based on my cultural context in Fayoum, Egypt, my lower middle class socioeconomic background, and my middle education level, I have been influenced by my emic perspective and personal experience. In my community, signing a political action petition is seen as a way to voice concerns and advocate for change, which aligns with my personal values and the cultural context of my society. Additionally, my age and place also play a role, as younger individuals in urban areas are more likely to engage in political activism. Therefore, based on my nuanced understanding of the question and my personal beliefs, I would choose to sign a political action petition.\n\n2"]}, {"persona": {"region": "Fayoum", "sex": "female", "age": 32, "country": "Egypt", "marital_status": "married", "education": "middle", "social_class": "lower middle class"}, "question": {"id": "Q209", "variant": 0}, "response": ["From the emic and etic perspective, as a married female from Fayoum, Egypt, my in-group ways of thinking are influenced by the cultural context, individual values, and socioeconomic background that I belong to. In my community, women are expected to prioritize family and household duties over involvement in political activities. Additionally, my lower middle class status and limited education level have shaped my understanding of politics and activism. I also consider the cultural relativism that exists in my society, where political participation may not be as valued or accessible for individuals like me. Therefore, based on my personal experience and cultural context, I would never sign a political action petition. \n\n3"]}, {"persona": {"region": "Ismailia", "sex": "male", "age": 53, "country": "Egypt", "marital_status": "married", "education": "middle", "social_class": "lower middle class"}, "question": {"id": "Q209", "variant": 0}, "response": ["From the perspective of a married male from Ismailia, Egypt, who is 53 years old, completed middle education, and considers himself part of the lower middle class, it is important to consider the emic and etic perspectives in answering this question. In the cultural context of Egypt, there are specific norms and expectations regarding political engagement, and socioeconomic background also plays a significant role in shaping one's attitudes towards political action. Additionally, individual values and personal experiences, as well as the nuanced phrasing of the question, are crucial factors in determining the response. Taking into account these considerations, the answer to the question would be (2) Might do. \n\n2"]}, {"persona": {"region": "Ismailia", "sex": "male", "age": 38, "country": "Egypt", "marital_status": "married", "education": "higher", "social_class": "working class"}, "question": {"id": "Q209", "variant": 0}, "response": ["Based on my cultural context in Ismailia, Egypt, where there is a strong emphasis on community and collective action, I have been exposed to the practice of signing political action petitions. As a member of the working class, I have personally witnessed how such collective actions can bring about positive change for our community. Additionally, my higher education has provided me with a deeper understanding of the importance of political engagement. Considering these factors, I have indeed signed a political action petition in the past.\n\n1"]}, {"persona": {"region": "Ismailia", "sex": "female", "age": 35, "country": "Egypt", "marital_status": "married", "education": "middle", "social_class": "lower middle class"}, "question": {"id": "Q209", "variant": 0}, "response": ["Based on the anthropological framework, my cultural context as a married woman from Ismailia, Egypt, my lower middle class socioeconomic background, and my middle education level would greatly influence my perspective on signing a political action petition. In my cultural context, political activism may not be encouraged or accessible for someone of my background. Additionally, my individual values and personal experience may lead me to prioritize other aspects of life over political involvement. Considering the emic and etic perspectives, I would likely never have signed a political action petition due to the limitations and constraints of my cultural and socioeconomic context. \n\n3"]}, {"persona": {"region": "Ismailia", "sex": "female", "age": 57, "country": "Egypt", "marital_status": "married", "education": "lower", "social_class": "working class"}, "question": {"id": "Q209", "variant": 0}, "response": ["Based on the anthropological framework, as a married female from Ismailia, Egypt, I am influenced by my cultural context, individual values, and socioeconomic background. In my community, there is a strong emphasis on family and community loyalty, and as a working-class woman with lower education, I prioritize stability and fulfilling my family's needs. Additionally, my age and place in society also play a role in my decision-making. Therefore, based on these factors, I would never sign a political action petition.\n\n3"]}, {"persona": {"region": "Ismailia", "sex": "male", "age": 33, "country": "Egypt", "marital_status": "married", "education": "middle", "social_class": "lower middle class"}, "question": {"id": "Q209", "variant": 0}, "response": ["From an emic perspective, as a married male from Ismailia, Egypt, my cultural context and socioeconomic background play a significant role in shaping my answer to this question. In Egypt, there is a strong emphasis on community and collective action, and as a member of the lower middle class, I am keenly aware of the impact that political action can have on my community. Additionally, my personal experience and individual values also inform my decision, as I have seen the effects of political action on my family and neighbors. Furthermore, cultural relativism reminds me that my perspective is not universal, and I understand that others may have different reasons for their choices. Based on these factors, my answer would be (2) Might do."]}, {"persona": {"region": "Ismailia", "sex": "female", "age": 49, "country": "Egypt", "marital_status": "single", "education": "higher", "social_class": "upper middle class"}, "question": {"id": "Q209", "variant": 0}, "response": ["Based on my emic perspective as a single female from Ismailia, Egypt, I have been raised in a culture where political engagement and activism are highly valued. Additionally, my higher education level has provided me with the knowledge and skills to understand the importance of participating in political action. As part of the upper middle class, I have the resources and social status to have a voice in political matters. My age and socioeconomic background also play a role in my decision, as I have seen the impact of political movements and understand the importance of advocating for change. Therefore, I have actively signed political action petitions in the past and will continue to do so in the future.\n\n1"]}, {"persona": {"region": "Ismailia", "sex": "female", "age": 35, "country": "Egypt", "marital_status": "married", "education": "higher", "social_class": "lower middle class"}, "question": {"id": "Q209", "variant": 0}, "response": ["Based on the anthropological framework, my answer to the question is influenced by my cultural context, individual values, and socioeconomic background. As a married woman from Ismailia, Egypt, I am aware of the political climate and the significance of civic engagement. However, as part of the lower middle class, I am cautious about the potential repercussions of publicly signing a political action petition. My higher education level has provided me with an understanding of the importance of political participation, but my socioeconomic background has instilled in me a sense of caution. Therefore, I might consider signing a political action petition, but I would need to carefully assess the potential risks and benefits before doing so.\n\n2"]}, {"persona": {"region": "Ismailia", "sex": "male", "age": 24, "country": "Egypt", "marital_status": "single", "education": "higher", "social_class": "upper middle class"}, "question": {"id": "Q209", "variant": 0}, "response": ["Based on the anthropological framework, as a 24-year-old male from Ismailia, Egypt, who has completed higher education and considers himself part of the upper middle class, my emic perspective is influenced by my cultural context, individual values, and socioeconomic background. In Egypt, there is a strong cultural emphasis on social and political activism, and higher education often fosters a sense of civic engagement. Additionally, being part of the upper middle class may provide me with the resources and opportunities to participate in political action. Therefore, I have signed a political action petition as a way to engage in the socio-political issues that matter to me and to contribute to positive change in my community.\n\n1"]}, {"persona": {"region": "Ismailia", "sex": "female", "age": 23, "country": "Egypt", "marital_status": "single", "education": "higher", "social_class": "lower middle class"}, "question": {"id": "Q209", "variant": 0}, "response": ["Based on the anthropological framework, as a single female from Ismailia, Egypt, my emic perspective is influenced by my cultural context, individual values, and socioeconomic background. In my community, there are certain expectations and limitations placed on women, especially those from a lower middle-class background. My personal experience and values also shape my understanding of political action and the potential consequences of signing a petition. Taking into consideration the cultural relativism and nuances of my context, I would have to say:\n2"]}, {"persona": {"region": "Ismailia", "sex": "male", "age": 55, "country": "Egypt", "marital_status": "married", "education": "middle", "social_class": "lower middle class"}, "question": {"id": "Q209", "variant": 0}, "response": ["From the emic perspective, as a married male from Ismailia, Egypt, my cultural context, individual values, and personal experience play a crucial role in my decision-making process. Coming from a lower middle-class background, my socioeconomic status has a significant impact on my perception and understanding of political action. Additionally, the cultural relativism in Egypt means that there is a nuanced understanding of political involvement and signing a political action petition. Taking into account my age and place, I have a deep understanding of the societal norms and expectations. Therefore, based on my personal experience and cultural context, I would never sign a political action petition.\n\n3"]}, {"persona": {"region": "Ismailia", "sex": "male", "age": 57, "country": "Egypt", "marital_status": "married", "education": "middle", "social_class": "upper middle class"}, "question": {"id": "Q209", "variant": 0}, "response": ["Based on the anthropological framework, as a married male from Ismailia, Egypt, with a middle education level and considering myself part of the upper middle class, my answer to the question of whether I have ever signed a political action petition would be influenced by a combination of cultural context, individual values, and socioeconomic background. In Egypt, there is a long history of political activism and involvement, and as someone who is educated and part of the upper middle class, I may have more opportunities and resources to engage in political actions. However, there are also potential risks and consequences associated with signing political action petitions in Egypt, which may influence my decision. Additionally, my personal values and experiences would also play a role in shaping my response to this question. Therefore, my answer would be influenced by a nuanced understanding of the cultural and socioeconomic factors at play in Egypt, as well as my own individual values and experiences.\n\n1"]}, {"persona": {"region": "Ismailia", "sex": "female", "age": 29, "country": "Egypt", "marital_status": "married", "education": "middle", "social_class": "upper middle class"}, "question": {"id": "Q209", "variant": 0}, "response": ["Based on the anthropological framework, as a married female from Ismailia, Egypt, my emic perspective is influenced by my cultural context, individual values, and socioeconomic background. In my cultural context, there is a strong emphasis on family and community, and political action may be seen as a way to contribute to the betterment of society. My personal experience and values may also play a role in shaping my willingness to sign a political action petition. Additionally, as part of the upper middle class, I may have more access to information and resources that could influence my decision. Considering these factors, I might be open to signing a political action petition as a means of expressing my views and contributing to social change. \n\n2"]}, {"persona": {"region": "Damiatta", "sex": "female", "age": 46, "country": "Egypt", "marital_status": "married", "education": "middle", "social_class": "lower middle class"}, "question": {"id": "Q209", "variant": 0}, "response": ["Based on my emic perspective, as a married woman from Damiatta, Egypt, I understand the importance of cultural context and the influence of my socioeconomic background on my decision-making. In my community, there is a strong emphasis on family and traditional values, and as a member of the lower middle class, I have limited access to political resources and opportunities. Additionally, my personal experience and individual values shape my inclination towards political action. Considering the nuanced phrasing of the question and the cultural relativism that is prevalent in my community, I would never sign a political action petition. \n\n3"]}, {"persona": {"region": "Damiatta", "sex": "female", "age": 20, "country": "Egypt", "marital_status": "single", "education": "middle", "social_class": "lower middle class"}, "question": {"id": "Q209", "variant": 0}, "response": ["From an anthropological perspective, as a single female from Damiatta, Egypt, my emic perspective would be influenced by my cultural context, individual values, and socioeconomic background. In Egypt, there is a strong emphasis on community and family, and as a lower middle class individual, I may not have had the exposure or resources to engage in political action petitions. Additionally, my age and education level may limit my understanding of the political landscape and the potential impact of signing a political action petition. Therefore, considering the cultural relativism and the nuance of the question, my response would be influenced by my personal experience and the socio-economic context in which I live.\n\n2"]}, {"persona": {"region": "Damiatta", "sex": "male", "age": 19, "country": "Egypt", "marital_status": "single", "education": "middle", "social_class": "lower middle class"}, "question": {"id": "Q209", "variant": 0}, "response": ["Based on my emic perspective as a 19-year-old male from Damiatta, Egypt, I understand that the cultural context and socioeconomic background play a significant role in my decision-making process. As a member of the lower middle class, I am aware of the socioeconomic challenges and limited opportunities that I face. Additionally, my individual values and personal experience have shaped my perception of political action and activism. Considering the cultural relativism and nuanced phrasing of the question, I would never sign a political action petition due to the potential risks and consequences associated with such actions in my local and national context.\n\n3"]}, {"persona": {"region": "Damiatta", "sex": "female", "age": 33, "country": "Egypt", "marital_status": "married", "education": "higher", "social_class": "lower middle class"}, "question": {"id": "Q209", "variant": 0}, "response": ["Based on the anthropological framework, as a married female from Damiatta, Egypt, my emic perspective is influenced by my cultural context, individual values, and socioeconomic background. In my community, women are expected to be engaged in political and social issues, and my personal experience and values align with this expectation. However, as a member of the lower middle class with limited resources, I am cautious about the potential consequences of signing a political action petition. Therefore, I might consider signing a political action petition if it aligns with my values and if I feel it will have a meaningful impact on my community.\n\n2"]}, {"persona": {"region": "Damiatta", "sex": "male", "age": 24, "country": "Egypt", "marital_status": "single", "education": "higher", "social_class": "lower middle class"}, "question": {"id": "Q209", "variant": 0}, "response": ["Based on the anthropological framework, my emic perspective as a single male from Damiatta, Egypt, leads me to consider the cultural context, individual values, socioeconomic background, and space and time. In my community, there is a strong emphasis on social and political activism, especially among the younger generation. My personal experience and values also align with the importance of advocating for social change. Additionally, my lower middle-class socioeconomic background has made me more aware of the need for political action to address economic disparities. Considering all these factors, I would choose option (1) Have done."]}, {"persona": {"region": "Suez", "sex": "male", "age": 41, "country": "Egypt", "marital_status": "married", "education": "middle", "social_class": "working class"}, "question": {"id": "Q209", "variant": 0}, "response": ["Based on my emic perspective as a married male from Suez, Egypt, I am influenced by the cultural context of my community and the socioeconomic background of being part of the working class. My individual values and personal experience have shaped my understanding of political action, and my middle education level has provided me with a nuanced understanding of the importance of political engagement within my community. Additionally, cultural relativism is important to consider, as my understanding of political action is shaped by the unique cultural and historical context of Egypt. Given these factors, I have signed a political action petition in the past to advocate for the betterment of my community and would likely continue to do so in the future.\n\n1"]}, {"persona": {"region": "Suez", "sex": "female", "age": 39, "country": "Egypt", "marital_status": "divorced", "education": "middle", "social_class": "working class"}, "question": {"id": "Q209", "variant": 0}, "response": ["Based on my emic perspective as a divorced female from Suez, Egypt, my cultural context and personal experience have shaped my individual values and attitudes towards political action. As a member of the working class in Egypt, my socioeconomic background has influenced my perceptions of political involvement. Additionally, the cultural relativism in Egypt has instilled in me a sense of caution when it comes to participating in political action. Furthermore, my age and place in society have also played a role in shaping my perspective. Considering all these factors, I would lean towards option (2) Might do."]}, {"persona": {"region": "Cairo", "sex": "female", "age": 55, "country": "Egypt", "marital_status": "married", "education": "middle", "social_class": "working class"}, "question": {"id": "Q209", "variant": 0}, "response": ["From the emic perspective of a married female from Cairo, Egypt, who is 55 years old and part of the working class, the cultural context and socioeconomic background are crucial in understanding the decision-making process. In Egypt, there is a strong emphasis on community and social cohesion, and political action petitions are often seen as a way to bring about change and advocate for the rights of the working class. Additionally, the cultural relativism aspect of the framework suggests that individual values and personal experiences, as well as the nuanced phrasing of the question, will heavily influence the decision. Given these factors, the persona described above might choose option (2) - Might do - as a way to express a willingness to engage in political action while also considering the potential risks and consequences. \n\n2"]}, {"persona": {"region": "Cairo", "sex": "male", "age": 58, "country": "Egypt", "marital_status": "married", "education": "middle", "social_class": "lower middle class"}, "question": {"id": "Q209", "variant": 0}, "response": ["From my emic perspective as a married male from Cairo, Egypt, my cultural context and socioeconomic background play a significant role in shaping my answer to this question. In Egypt, there is a long history of political activism and petitioning for change. However, as someone from the lower middle class with only a middle education level, I have limited access to political spaces and resources. Additionally, my age and place in society also influence my willingness to engage in political action. Therefore, based on my individual values and personal experience, I would never do it.\n\n3"]}, {"persona": {"region": "Cairo", "sex": "female", "age": 29, "country": "Egypt", "marital_status": "married", "education": "higher", "social_class": "lower middle class"}, "question": {"id": "Q209", "variant": 0}, "response": ["Based on the anthropological framework, as a married female from Cairo, Egypt, I would consider the cultural context and my socioeconomic background as pivotal factors in my decision. In Egypt, there is a rich history of political activism and petitions are often used as a means of expressing dissent or advocating for change. As a lower-middle-class woman who has completed higher education, I am likely to be more aware of political issues and may have been exposed to discussions about social and political change. Additionally, being part of the lower-middle-class means that I may have personally experienced the impact of political decisions on my life. Therefore, I would be more inclined to have signed a political action petition as a way of participating in the political process and advocating for issues that affect my community and me.\n\n1"]}, {"persona": {"region": "Cairo", "sex": "male", "age": 38, "country": "Egypt", "marital_status": "married", "education": "higher", "social_class": "lower middle class"}, "question": {"id": "Q209", "variant": 0}, "response": ["Based on the anthropological framework, my perspective as a married male from Cairo, Egypt, at 38 years of age and from a lower middle class background, is shaped by my cultural context, individual values, and socioeconomic background. In Egypt, there is a strong emphasis on collectivism and community values, and signing a political action petition can be seen as a way to contribute to the betterment of society. Additionally, my socioeconomic background may influence my willingness to engage in political actions, as individuals from the lower middle class often seek to advocate for their rights and improve their living conditions. Therefore, considering these factors, my answer would be:\n\n2"]}, {"persona": {"region": "Cairo", "sex": "female", "age": 40, "country": "Egypt", "marital_status": "married", "education": "higher", "social_class": "lower middle class"}, "question": {"id": "Q209", "variant": 0}, "response": ["From the perspective of a married female from Cairo, Egypt, who is 40 years old and part of the lower middle class, my answer to the question would be influenced by my cultural context, individual values, and socioeconomic background. In Egypt, political participation is influenced by the country's cultural and political context, and as a member of the lower middle class, I may have limited access to resources and opportunities for political engagement. Additionally, my personal experience and values may shape my willingness to engage in political action. Considering these factors, my answer would be influenced by a combination of cultural relativism, socioeconomic background, and personal experience, leading to a nuanced understanding of the question.\n\n2"]}, {"persona": {"region": "Cairo", "sex": "male", "age": 38, "country": "Egypt", "marital_status": "married", "education": "higher", "social_class": "upper middle class"}, "question": {"id": "Q209", "variant": 0}, "response": ["Based on my emic perspective as a married male from Cairo, Egypt, I am well-aware of the cultural context and the significance of political involvement in our society. As someone who has completed higher education and considers myself part of the upper middle class, I am deeply involved in socio-political discussions and have a strong understanding of the importance of civic engagement. My individual values and personal experiences have led me to actively participate in political action, as I believe in using my voice to advocate for change. Additionally, my socioeconomic background has provided me with the resources and opportunities to engage in such activities. Considering the nuance of the question, I would confidently choose option (1) Have done."]}, {"persona": {"region": "Cairo", "sex": "male", "age": 59, "country": "Egypt", "marital_status": "married", "education": "middle", "social_class": "lower middle class"}, "question": {"id": "Q209", "variant": 0}, "response": ["Based on the anthropological framework, my emic perspective as a married male from Cairo, Egypt, with middle education and a lower middle class background, would be influenced by my cultural context, individual values, and socioeconomic background. In Egypt, there is a complex political climate and signing a political action petition could have serious consequences. Additionally, my personal experience and values may lead me to be cautious about participating in such activities. Furthermore, my socioeconomic background may also influence my decision, as individuals from lower middle class backgrounds may have limited resources and opportunities to engage in political activism. Therefore, I would never do (3) such a thing."]}, {"persona": {"region": "Cairo", "sex": "female", "age": 30, "country": "Egypt", "marital_status": "married", "education": "higher", "social_class": "upper middle class"}, "question": {"id": "Q209", "variant": 0}, "response": ["Based on the anthropological framework, as a married female from Cairo, Egypt, my emic perspective would be influenced by the cultural context of my upbringing and education, as well as my socioeconomic background as part of the upper middle class. My individual values and personal experience would also play a significant role in my decision-making. Additionally, cultural relativism is important to consider, as Egypt has a complex political and social landscape. Lastly, my age and place would also factor into my decision. \n\n2"]}, {"persona": {"region": "Cairo", "sex": "male", "age": 22, "country": "Egypt", "marital_status": "single", "education": "middle", "social_class": "lower middle class"}, "question": {"id": "Q209", "variant": 0}, "response": ["Based on the anthropological framework, as a single male from Cairo, Egypt, my emic perspective is shaped by the cultural context of my upbringing, the individual values and personal experiences that I have had, and my lower middle class socioeconomic background. In this context, signing a political action petition might be seen as a way to have a voice and make a difference in the community, especially given the political climate in Egypt. Additionally, the nuance of the question and the potential impact on my personal life and future opportunities would also factor into my decision.\n\n2"]}, {"persona": {"region": "Cairo", "sex": "male", "age": 29, "country": "Egypt", "marital_status": "single", "education": "higher", "social_class": "lower middle class"}, "question": {"id": "Q209", "variant": 0}, "response": ["Based on my personal experience and socioeconomic background, as a 29-year-old single male from Cairo, Egypt, I have been exposed to the political and social issues that affect my community. The cultural context in Egypt has shaped my understanding of the importance of collective action and the significance of signing political action petitions as a means of expressing dissent and advocating for change. Additionally, my higher education level has provided me with the knowledge and critical thinking skills necessary to engage in political discourse. Considering the emic perspective and my personal values, I believe that signing a political action petition is a crucial form of civic engagement and a way to exercise my agency in shaping the future of my country.\n\n2"]}, {"persona": {"region": "Cairo", "sex": "female", "age": 31, "country": "Egypt", "marital_status": "married", "education": "higher", "social_class": "lower middle class"}, "question": {"id": "Q209", "variant": 0}, "response": ["Based on the anthropological framework, as a married female from Cairo, Egypt, I would consider my emic perspective on signing a political action petition to be influenced by my cultural context, individual values, and socioeconomic background. In Cairo, there is a long history of political activism and social movements, and as a woman who has completed higher education, I am likely to be aware of and engaged in political issues. However, as part of the lower middle class, I may also have concerns about potential repercussions or the effectiveness of such actions. Additionally, cultural relativism and the nuanced phrasing of the question would also inform my decision.\n\n2"]}, {"persona": {"region": "Cairo", "sex": "male", "age": 59, "country": "Egypt", "marital_status": "married", "education": "higher", "social_class": "upper middle class"}, "question": {"id": "Q209", "variant": 0}, "response": ["Based on the anthropological framework, as a married male from Cairo, Egypt, my emic perspective on signing a political action petition is influenced by my cultural context, individual values, and socioeconomic background. In Egypt, there is a strong emphasis on collective identity and the role of the state in political decision-making. Additionally, my higher education level and upper middle class status may lead me to consider the potential impact of signing a political action petition on my social standing and personal security. Considering these factors, I would be more inclined to consider signing a political action petition, as it aligns with my values of civic engagement and social responsibility, but I would also be cautious due to the potential consequences. \n\n2"]}, {"persona": {"region": "Cairo", "sex": "male", "age": 27, "country": "Egypt", "marital_status": "single", "education": "middle", "social_class": "working class"}, "question": {"id": "Q209", "variant": 0}, "response": ["Based on the anthropological framework, as a single male from Cairo, Egypt, who is 27 years old and part of the working class, my cultural context and socioeconomic background would heavily influence my answer to this question. In Egypt, there is a strong emphasis on collective action and political engagement, especially among the working class. Additionally, my individual values and personal experience would also play a role in my decision. Given the current political climate in Egypt, where there is a push for change and social justice, I would be inclined to have signed a political action petition as a way to advocate for the rights of my community and myself.\n\n1"]}, {"persona": {"region": "Cairo", "sex": "female", "age": 25, "country": "Egypt", "marital_status": "single", "education": "higher", "social_class": "working class"}, "question": {"id": "Q209", "variant": 0}, "response": ["Based on the anthropological framework, as a single female from Cairo, Egypt, my emic perspective is shaped by my cultural context, individual values, and socioeconomic background. Living in a city with a rich history of political activism, I have a strong awareness of the importance of political engagement. My higher education level has also provided me with the knowledge and critical thinking skills to understand the impact of political action. As part of the working class, I am acutely aware of the challenges faced by my community and the need for advocacy. Therefore, I have actively participated in signing political action petitions as a way to contribute to positive change in my society.\n\n1"]}, {"persona": {"region": "Cairo", "sex": "female", "age": 23, "country": "Egypt", "marital_status": "married", "education": "higher", "social_class": "lower middle class"}, "question": {"id": "Q209", "variant": 0}, "response": ["Based on the anthropological framework, as a married female from Cairo, Egypt, my emic perspective is influenced by the cultural context of my upbringing and the socioeconomic background of being part of the lower middle class. My personal experience and individual values also play a significant role in my decision-making. Additionally, the cultural relativism in Egypt and the nuanced phrasing of the question will impact my response. Considering all these factors, I would choose option (2) Might do, as I am open to the possibility of signing a political action petition based on the specific circumstances and issues at hand."]}, {"persona": {"region": "Cairo", "sex": "male", "age": 58, "country": "Egypt", "marital_status": "married", "education": "higher", "social_class": "working class"}, "question": {"id": "Q209", "variant": 0}, "response": ["Based on the anthropological framework, my emic perspective as a married male from Cairo, Egypt would be influenced by my cultural context, socioeconomic background, and personal experience. In Egypt, political activism is often associated with risk and potential consequences, particularly for those in the working class. Additionally, my age and education level may have shaped my views on political action. Considering the cultural relativism and nuance of the question, I would never sign a political action petition due to the potential risks and consequences. 3"]}, {"persona": {"region": "Cairo", "sex": "female", "age": 40, "country": "Egypt", "marital_status": "married", "education": "higher", "social_class": "working class"}, "question": {"id": "Q209", "variant": 0}, "response": ["Based on my individual values and personal experience, as a married woman from Cairo, Egypt, who has completed higher education and considers herself part of the working class, I have had the opportunity to become more aware of political issues and the impact they have on my community. The cultural context of Egypt, with its rich history of political activism and social movements, has also influenced my perspective on this matter. Additionally, my socioeconomic background as a working-class individual has given me a sense of solidarity with others who may benefit from political action. Therefore, I have signed a political action petition in the past. \n\n1"]}, {"persona": {"region": "Cairo", "sex": "female", "age": 36, "country": "Egypt", "marital_status": "married", "education": "middle", "social_class": "upper middle class"}, "question": {"id": "Q209", "variant": 0}, "response": ["Based on the anthropological framework, as a married female from Cairo, Egypt, my emic perspective is influenced by my cultural context, individual values, and socioeconomic background. In Egypt, political action is highly influenced by societal and cultural norms, and as a member of the upper middle class, I have access to education and resources that allow me to engage in political activities. Additionally, my personal experience and values may lead me to engage in political action as a way to advocate for social change and progress in my community. Therefore, I might do.\n\n2"]}, {"persona": {"region": "Cairo", "sex": "male", "age": 40, "country": "Egypt", "marital_status": "married", "education": "middle", "social_class": "lower middle class"}, "question": {"id": "Q209", "variant": 0}, "response": ["Based on my emic perspective as a married male from Cairo, Egypt, I am influenced by the cultural context in which I live, which includes a strong sense of community and the importance of social cohesion. My individual values and personal experience also play a role, as I have witnessed the impact of political action on my community. Additionally, my socioeconomic background as part of the lower middle class has shaped my understanding of the potential risks and benefits of engaging in political activism. I also consider the nuance of the question, as the wording may influence my response. Therefore, based on these factors, I might consider signing a political action petition in certain circumstances.\n\n2"]}, {"persona": {"region": "Cairo", "sex": "female", "age": 30, "country": "Egypt", "marital_status": "married", "education": "middle", "social_class": "lower class"}, "question": {"id": "Q209", "variant": 0}, "response": ["From the emic and etic perspectives, as a married female from Cairo, Egypt, I am influenced by the cultural context and socioeconomic background of my society. My individual values and personal experiences, along with my lower class status, play a significant role in my decision-making. Additionally, the cultural relativism of Egypt and the importance of space and time in this context cannot be overlooked. Given these factors, I have never signed a political action petition. \n\n2"]}, {"persona": {"region": "Cairo", "sex": "male", "age": 58, "country": "Egypt", "marital_status": "married", "education": "higher", "social_class": "lower middle class"}, "question": {"id": "Q209", "variant": 0}, "response": ["Based on the anthropological framework, my cultural context as a married male from Cairo, Egypt, is pivotal in understanding my response to the question. In this context, political action and expression may be influenced by the cultural and societal norms in Egypt, as well as my individual values and personal experiences. Additionally, my lower middle class socioeconomic background and age of 58 also play a significant role in shaping my perspective on political activism. Considering these factors, I would choose option (2) Might do. \n\n2"]}, {"persona": {"region": "Cairo", "sex": "male", "age": 50, "country": "Egypt", "marital_status": "married", "education": "middle", "social_class": "lower middle class"}, "question": {"id": "Q209", "variant": 0}, "response": ["Based on the anthropological framework, my response to the question of signing a political action petition is influenced by my emic perspective as a married male from Cairo, Egypt. In my cultural context, political activism may carry significant risks and consequences, and my lower middle-class socioeconomic background further complicates the decision. Additionally, my age and personal experience have shaped my understanding of the potential impact of signing a political action petition. Considering the nuanced phrasing of the question and the potential implications for myself and my family, I would never do so.\n\n3"]}, {"persona": {"region": "Cairo", "sex": "female", "age": 40, "country": "Egypt", "marital_status": "married", "education": "higher", "social_class": "upper middle class"}, "question": {"id": "Q209", "variant": 0}, "response": ["From the perspective of a married female from Cairo, Egypt, who is 40 years old, has completed higher education, and considers herself part of the upper middle class, the answer to the question of signing a political action petition would be influenced by a combination of cultural context, individual values, socioeconomic background, and space and time. In Egypt, there is a strong sense of social and political activism, and higher education and belonging to the upper middle class often come with a greater awareness of political issues and a sense of responsibility towards societal change. However, the cultural context of Egypt also includes potential repercussions for political activism, and the nuanced phrasing of the question could influence the response. Considering these factors, the chosen answer is:\n\n1"]}, {"persona": {"region": "Cairo", "sex": "female", "age": 33, "country": "Egypt", "marital_status": "married", "education": "middle", "social_class": "lower middle class"}, "question": {"id": "Q209", "variant": 0}, "response": ["Based on the anthropological framework, as a married female from Cairo, Egypt, my emic perspective is influenced by my cultural context, individual values, and socioeconomic background. In Egypt, there is a strong sense of community and social activism, which is influenced by the country's political and cultural history. As a lower middle class woman, I am more likely to have experienced firsthand the impact of political decisions on my family and community. My personal experience and values lead me to believe in the power of collective action and the importance of standing up for what is just. Therefore, I have signed political action petitions in the past and would continue to do so in the future.\n\n1"]}, {"persona": {"region": "Cairo", "sex": "female", "age": 37, "country": "Egypt", "marital_status": "married", "education": "middle", "social_class": "lower middle class"}, "question": {"id": "Q209", "variant": 0}, "response": ["Based on the anthropological framework, as a married female from Cairo, Egypt, my emic perspective is influenced by my cultural context, individual values, and socioeconomic background. In Egyptian society, women's involvement in political action is often influenced by cultural norms and expectations. Additionally, my lower middle class socioeconomic background may limit my access to opportunities for political engagement. Furthermore, my personal experience and values may lead me to prioritize other aspects of my life over political activism. Therefore, I would never do.\n3"]}, {"persona": {"region": "Cairo", "sex": "male", "age": 28, "country": "Egypt", "marital_status": "married", "education": "middle", "social_class": "lower middle class"}, "question": {"id": "Q209", "variant": 0}, "response": ["From the perspective of a married male from Cairo, Egypt, who is 28 years old, has completed middle education, and considers himself part of the lower middle class, there are several factors that would influence his answer to this question. The cultural context in Egypt is important, as there is a history of political activism and engagement, but also a strong government presence and potential consequences for speaking out. Additionally, his socioeconomic background and level of education may impact his level of political awareness and willingness to engage in political action. Personal experience and individual values also play a role, as he may have been directly affected by political issues or have strong personal beliefs about the effectiveness of political action. Overall, his answer will be influenced by a combination of cultural context, socioeconomic background, and personal values, and therefore, it is likely that he might be open to signing a political action petition in certain circumstances.\n\n2"]}, {"persona": {"region": "Cairo", "sex": "male", "age": 53, "country": "Egypt", "marital_status": "married", "education": "higher", "social_class": "working class"}, "question": {"id": "Q209", "variant": 0}, "response": ["Based on the anthropological framework, I understand that my cultural context, individual values, and personal experience as a middle-aged, working-class male in Cairo, Egypt will heavily influence my response to this question. In Egypt, there is a strong emphasis on collective action and political participation, especially among the working class. Additionally, my age and education level will also shape my understanding of political action and the importance of signing a political action petition. Considering these factors, I would say that I have signed a political action petition in the past.\n\n1"]}, {"persona": {"region": "Cairo", "sex": "male", "age": 45, "country": "Egypt", "marital_status": "married", "education": "higher", "social_class": "lower middle class"}, "question": {"id": "Q209", "variant": 0}, "response": ["Based on the anthropological framework, my emic perspective as a married, educated, lower middle-class male from Cairo, Egypt, is influenced by my cultural context, individual values, and socioeconomic background. In Egyptian society, there is a strong emphasis on family and community, and political action is often seen as a collective effort. My personal experience and values also play a role in my decision-making, as I have seen the impact of political activism on my community. Additionally, my socioeconomic background as part of the lower middle class may influence my willingness to engage in political action, as I may feel a greater sense of responsibility towards advocating for change. Therefore, my response to the question is influenced by these factors.\n\n2"]}, {"persona": {"region": "Cairo", "sex": "male", "age": 52, "country": "Egypt", "marital_status": "married", "education": "middle", "social_class": "upper middle class"}, "question": {"id": "Q209", "variant": 0}, "response": ["Based on my emic perspective as a married male from Cairo, Egypt, I am aware that political action and petitions are important means of expressing one's views and advocating for change in our society. In the cultural context of Egypt, there is a long history of political activism and engagement, and signing petitions is seen as a way to contribute to the collective voice of the people. My individual values and personal experience have also shaped my willingness to participate in such activities, as I believe in the importance of civic engagement and making one's voice heard. Additionally, my socioeconomic background as part of the upper middle class has provided me with the resources and education to understand the significance of political action. Therefore, based on my nuanced understanding of the situation, I can confidently say that I have signed a political action petition.\n\n1"]}, {"persona": {"region": "Cairo", "sex": "male", "age": 22, "country": "Egypt", "marital_status": "single", "education": "higher", "social_class": "lower middle class"}, "question": {"id": "Q209", "variant": 0}, "response": ["Based on the anthropological framework, my individual values and personal experience as a single male from Cairo, Egypt, who has completed higher education and considers himself part of the lower middle class, are pivotal in my understanding and decision-making. Additionally, my cultural context, including the socioeconomic background and cultural relativism, also plays a significant role in shaping my perspective. As a young adult from Cairo, I am aware of the political climate and the potential impact of signing a political action petition. Considering these factors, I would never do.\n\n3"]}, {"persona": {"region": "Cairo", "sex": "female", "age": 57, "country": "Egypt", "marital_status": "divorced", "education": "middle", "social_class": "lower middle class"}, "question": {"id": "Q209", "variant": 0}, "response": ["From the perspective of a divorced female from Cairo, Egypt, who is 57 years old, completed middle education level, and considers herself part of the lower middle class, the emic and etic perspectives are important to consider. In Egyptian society, there is a strong sense of in-group loyalty and community, and signing a political action petition may be seen as a way to advocate for change within the community. The cultural context of Egypt also plays a role, as political participation is valued and seen as a way to make a difference. Additionally, individual values and personal experience, such as a desire for social change and empowerment, may influence the decision to sign a political action petition. Socioeconomic background is also a factor, as individuals from the lower middle class may be more likely to advocate for change that benefits their community. Considering these factors, the persona described may be inclined to answer the question as follows:\n\n2\n\nMight do"]}, {"persona": {"region": "Cairo", "sex": "female", "age": 42, "country": "Egypt", "marital_status": "married", "education": "middle", "social_class": "working class"}, "question": {"id": "Q209", "variant": 0}, "response": ["Based on the anthropological framework, as a married female from Cairo, Egypt, my emic perspective would be influenced by my cultural context, individual values, and personal experience. In Egypt, there is a strong emphasis on community and family, and political action petitions may be viewed as a way to advocate for change within the societal structure. Additionally, my socioeconomic background as a working-class individual and my age of 42 years would shape my perceptions and willingness to engage in political activism. Considering these factors, I might be open to signing a political action petition as a way to address issues that directly impact my community and family. \n\n2"]}, {"persona": {"region": "Cairo", "sex": "female", "age": 23, "country": "Egypt", "marital_status": "single", "education": "middle", "social_class": "lower middle class"}, "question": {"id": "Q209", "variant": 0}, "response": ["Based on my emic perspective as a single female from Cairo, Egypt, the cultural context of my upbringing and social environment has shaped my views and actions. As part of the lower middle class, my socioeconomic background has influenced my individual values and personal experiences, leading me to prioritize stability and security. Additionally, the cultural relativism in Egypt has instilled in me a sense of caution and reservation when it comes to political activism. Given the current political climate and potential consequences, I might consider signing a political action petition, but I would approach it with careful consideration and hesitation. Therefore, my choice would be:\n\n2"]}, {"persona": {"region": "Cairo", "sex": "female", "age": 28, "country": "Egypt", "marital_status": "married", "education": "higher", "social_class": "upper middle class"}, "question": {"id": "Q209", "variant": 0}, "response": ["Based on the anthropological framework, as a married female from Cairo, Egypt, my emic perspective is influenced by the cultural context of my upbringing in a patriarchal society, where women's political participation may be limited. My individual values and personal experience, as well as my socioeconomic background as part of the upper middle class, also play a role in my decision-making. Additionally, cultural relativism and the nuance of the question are important to consider. Therefore, my answer is:\n\n2) Might do"]}, {"persona": {"region": "Cairo", "sex": "female", "age": 22, "country": "Egypt", "marital_status": "single", "education": "higher", "social_class": "lower middle class"}, "question": {"id": "Q209", "variant": 0}, "response": ["From the emic perspective, as a single female from Cairo, Egypt, I am influenced by the cultural context, individual values, and socioeconomic background. In Egypt, political activism is often associated with risk and potential backlash, especially for women. My personal experience and values have shaped my perception of political action, and as a member of the lower middle class, I am more focused on meeting basic needs and navigating societal expectations. Additionally, the cultural relativism and nuanced understanding of space and time play a role in my decision-making process. Given these factors, I would never sign a political action petition.\n\n3"]}, {"persona": {"region": "Cairo", "sex": "female", "age": 39, "country": "Egypt", "marital_status": "married", "education": "middle", "social_class": "lower middle class"}, "question": {"id": "Q209", "variant": 0}, "response": ["Based on my cultural context and socioeconomic background, signing a political action petition is not something that is commonly done in my community. As a married woman from Cairo, Egypt, I have been taught to prioritize family and community over individual political actions. Additionally, my lower middle class status means that I have limited access to political information and resources, making it unlikely for me to engage in such activities. Furthermore, my age and education level also play a role in my perspective, as I have not been exposed to opportunities or teachings that would encourage me to take part in political activism. Therefore, I would never do option (3)."]}, {"persona": {"region": "Cairo", "sex": "male", "age": 19, "country": "Egypt", "marital_status": "single", "education": "middle", "social_class": "working class"}, "question": {"id": "Q209", "variant": 0}, "response": ["Based on the anthropological framework, as a single male from Cairo, Egypt, I am influenced by my cultural context, individual values, and socioeconomic background. In Egypt, there is a strong sense of community and political involvement, and as a working-class individual, I am likely to be more aware of the social and economic issues affecting my community. My middle education level also means that I have some understanding of political processes and the potential impact of political action. Therefore, I believe that I might do, or have considered, signing a political action petition as a way to advocate for change in my community. \n\n2"]}, {"persona": {"region": "Cairo", "sex": "female", "age": 54, "country": "Egypt", "marital_status": "married", "education": "middle", "social_class": "working class"}, "question": {"id": "Q209", "variant": 0}, "response": ["From the perspective of a married female from Cairo, Egypt, at 54 years of age with a middle education level and part of the working class, my cultural context, individual values, and personal experience greatly influence my response to the question. In Egypt, there is a complex political and social landscape that impacts my views on political action. As a member of the working class, I am more likely to be aware of and affected by political issues, and my personal experience living in Cairo has likely exposed me to various political movements and petitions. Additionally, my cultural context and socioeconomic background play a significant role in my decision-making process. Taking into account the cultural relativism and nuanced phrasing of the question, my response is influenced by these factors.\n\n2"]}, {"persona": {"region": "Cairo", "sex": "male", "age": 30, "country": "Egypt", "marital_status": "married", "education": "higher", "social_class": "working class"}, "question": {"id": "Q209", "variant": 0}, "response": ["Based on the anthropological framework, as a married male from Cairo, Egypt, my emic perspective is influenced by my cultural context, individual values, and socioeconomic background. In Egypt, there is a strong sense of community and political activism is often seen as a collective effort. As a member of the working class, I am likely to be more politically engaged and willing to sign a political action petition in order to advocate for the betterment of my community. Additionally, my higher education level may have exposed me to different political ideologies and made me more aware of the societal issues that need addressing. Therefore, I have signed a political action petition.\n\n1"]}, {"persona": {"region": "Cairo", "sex": "male", "age": 39, "country": "Egypt", "marital_status": "married", "education": "higher", "social_class": "lower middle class"}, "question": {"id": "Q209", "variant": 0}, "response": ["Based on the anthropological framework, my emic perspective as a married male from Cairo, Egypt, is shaped by the cultural context of my surroundings and my socioeconomic background. In Egypt, there is a strong emphasis on community and family, and as a lower middle class individual, I have limited resources and influence within the political sphere. Additionally, my individual values and personal experience have taught me to be cautious about participating in political activism due to potential repercussions. Furthermore, cultural relativism is important to consider, as the political climate in Egypt may differ significantly from that of other countries. Given these factors, I would be unlikely to sign a political action petition out of concern for the potential impact on my family and my own well-being.\n\n3"]}, {"persona": {"region": "Cairo", "sex": "female", "age": 41, "country": "Egypt", "marital_status": "married", "education": "middle", "social_class": "lower middle class"}, "question": {"id": "Q209", "variant": 0}, "response": ["Based on my cultural context as a married female from Cairo, Egypt, my emic perspective is that signing a political action petition is influenced by my socioeconomic background and cultural relativism. In Egypt, there is a strong sense of community and a history of political activism, but as a lower middle class woman with only a middle education level, I may not have had the opportunity or resources to engage in such activities. Additionally, my personal experience and individual values play a role in my decision-making, and I may feel that signing a political action petition could have potential consequences for me and my family. Therefore, I might consider signing a political action petition, but it would depend on the specific circumstances and potential risks involved.\n\n2"]}, {"persona": {"region": "Cairo", "sex": "male", "age": 45, "country": "Syria", "marital_status": "single", "education": "higher", "social_class": "upper middle class"}, "question": {"id": "Q209", "variant": 0}, "response": ["Based on the anthropological framework, as a single male from Cairo, Syria, my emic perspective would be influenced by the political and social context of my country, as well as my individual values and personal experience. In Syria, political action and petitions are often associated with potential risks and consequences, which may make me hesitant to engage in such activities. Additionally, my higher education level and upper middle class status may also shape my perspective, as I may be more aware of the potential implications of participating in political action. Therefore, considering my cultural context, socioeconomic background, and personal experience, I would likely choose the option (2) Might do."]}, {"persona": {"region": "Cairo", "sex": "male", "age": 54, "country": "Egypt", "marital_status": "married", "education": "higher", "social_class": "lower middle class"}, "question": {"id": "Q209", "variant": 0}, "response": ["Based on my emic perspective as a married male from Cairo, Egypt, I have been influenced by the cultural context of my country, where political activism and expression are often met with strict government control. My individual values and personal experience also play a role, as I have witnessed the consequences of political dissent and the impact it can have on my family and community. Additionally, my lower middle-class socioeconomic background has made me more cautious about engaging in political action that could potentially disrupt my livelihood. Considering these factors, I would never sign a political action petition.\n\n3"]}, {"persona": {"region": "Cairo", "sex": "male", "age": 65, "country": "Egypt", "marital_status": "married", "education": "middle", "social_class": "upper middle class"}, "question": {"id": "Q209", "variant": 0}, "response": ["Based on my personal experience and cultural context, as a married male from Cairo, Egypt, I come from a society where political action and advocacy are not only common but also highly valued. My socioeconomic background as part of the upper middle class has allowed me to have the education and resources to understand and engage in political activism. Additionally, at my age, I have witnessed significant political and social changes in Egypt, which has shaped my understanding and willingness to participate in political action. Therefore, I have actively signed political action petitions as a means of advocating for change and expressing my voice within the social and political context of Egypt.\n\n1"]}, {"persona": {"region": "Cairo", "sex": "female", "age": 52, "country": "Egypt", "marital_status": "married", "education": "middle", "social_class": "upper middle class"}, "question": {"id": "Q209", "variant": 0}, "response": ["Based on the anthropological framework, my emic perspective as a married female from Cairo, Egypt, is influenced by my cultural context, individual values, and socioeconomic background. In Egypt, political activism can be viewed as a sensitive issue due to the social and political climate. The cultural context and my personal experience have shaped my understanding of political action, and my socioeconomic background as part of the upper middle class may influence my level of engagement in political activities. Additionally, my age and education level play a role in how I perceive and engage in political actions. Therefore, my response is shaped by these factors and reflects the emic perspective of a middle-aged, educated woman from an upper middle-class background in Cairo, Egypt.\n\n2"]}, {"persona": {"region": "Cairo", "sex": "male", "age": 26, "country": "Egypt", "marital_status": "single", "education": "higher", "social_class": "lower middle class"}, "question": {"id": "Q209", "variant": 0}, "response": ["Based on my emic perspective as a single male from Cairo, Egypt, I understand that political activism and signing petitions are influenced by cultural context, individual values, and socioeconomic background. In Egypt, there is a strong emphasis on collective action and political engagement, especially among the youth who have been active in recent political movements. My personal experience and education have also shaped my understanding of the importance of political participation. As a member of the lower middle class, I am aware of the socioeconomic disparities and the need for advocating for change. Therefore, I would be open to signing a political action petition as a means of expressing my support for social and political causes.\n\n2"]}, {"persona": {"region": "Cairo", "sex": "male", "age": 32, "country": "Egypt", "marital_status": "married", "education": "middle", "social_class": "working class"}, "question": {"id": "Q209", "variant": 0}, "response": ["Based on the anthropological framework, my emic perspective as a working-class married male from Cairo, Egypt, at the age of 32, with a middle education level, is influenced by my cultural context, individual values, personal experience, and socioeconomic background. In Cairo, political action and participation are heavily influenced by the cultural and socioeconomic context. As a member of the working class, I am more likely to engage in political action that directly impacts my daily life, such as labor rights or economic policies. However, my personal experience and values may also play a role in whether I have signed a political action petition. Additionally, the nuanced phrasing of the question is important, as the term \"political action petition\" may have different connotations in my cultural context.\n\n2"]}, {"persona": {"region": "Cairo", "sex": "male", "age": 38, "country": "Egypt", "marital_status": "married", "education": "middle", "social_class": "lower middle class"}, "question": {"id": "Q209", "variant": 0}, "response": ["Based on the anthropological framework, as a married male from Cairo, Egypt, my emic perspective is influenced by my cultural context, socioeconomic background, and personal experience. In Egypt, there is a strong emphasis on collective values and social harmony, and signing a political action petition could be seen as a form of protest or dissent, which may not be well-received in my cultural context. Additionally, as part of the lower middle class, I may not have had extensive exposure to political activism or the means to engage in such activities. Therefore, considering my cultural context and socioeconomic background, I would never do (3) sign a political action petition."]}, {"persona": {"region": "Cairo", "sex": "male", "age": 58, "country": "Egypt", "marital_status": "married", "education": "higher", "social_class": "upper middle class"}, "question": {"id": "Q209", "variant": 0}, "response": ["Based on the anthropological framework, my emic perspective as a married male from Cairo, Egypt, would be influenced by my cultural context, individual values, and socioeconomic background. In Egypt, there is a strong sense of community and the importance of collective action, so signing a political action petition aligns with the cultural context and values of social responsibility. Additionally, as a member of the upper middle class with a higher education level, I would have more exposure to political activism and be more likely to engage in such activities. Therefore, based on my background and cultural context, I would be more inclined to have signed a political action petition.\n\n1"]}, {"persona": {"region": "Cairo", "sex": "male", "age": 49, "country": "Egypt", "marital_status": "married", "education": "middle", "social_class": "lower middle class"}, "question": {"id": "Q209", "variant": 0}, "response": ["Based on my emic perspective as a married male from Cairo, Egypt, I understand the importance of political action within my cultural context. My personal experience and individual values have been shaped by the socioeconomic background of being part of the lower middle class in Egypt. In this cultural context, signing a political action petition is a way to express my beliefs and advocate for change within the community. Additionally, the nuance of the question also plays a role in my decision, as the phrasing implies an openness to the idea rather than a definite action. Therefore, I might do.\n\n2"]}, {"persona": {"region": "Cairo", "sex": "female", "age": 29, "country": "Egypt", "marital_status": "married", "education": "middle", "social_class": "working class"}, "question": {"id": "Q209", "variant": 0}, "response": ["Based on the anthropological framework, my answer to whether I have ever signed a political action petition is influenced by my emic perspective as a married female from Cairo, Egypt. The cultural context of my upbringing and education level has shaped my understanding of political activism and the potential consequences of such actions. Additionally, my working-class socioeconomic background has influenced my level of political engagement and access to information about political action petitions. Therefore, my decision is based on individual values, personal experience, and the nuanced phrasing of the question. \n\n2"]}, {"persona": {"region": "Cairo", "sex": "female", "age": 36, "country": "Egypt", "marital_status": "married", "education": "higher", "social_class": "lower middle class"}, "question": {"id": "Q209", "variant": 0}, "response": ["Based on the anthropological framework, my emic perspective as a married female from Cairo, Egypt, with a lower-middle-class background and higher education, is shaped by my cultural context, individual values, and personal experience. In Egypt, there is a strong tradition of political activism and participation in social movements, which is influenced by the country's history of political upheaval and revolution. Additionally, my personal experience and values regarding social justice and political change may lead me to be more inclined to sign a political action petition. Moreover, my socioeconomic background as part of the lower middle class may also influence my decision, as I may feel more personally affected by political issues and be more motivated to take action. Therefore, my perspective would be to have done it.\n\n1"]}, {"persona": {"region": "Cairo", "sex": "female", "age": 34, "country": "Egypt", "marital_status": "married", "education": "middle", "social_class": "lower middle class"}, "question": {"id": "Q209", "variant": 0}, "response": ["Based on my cultural context, as a married female from Cairo, Egypt, I am aware that political action and activism are often viewed through the lens of societal norms and expectations. My socioeconomic background as part of the lower middle class also influences my perception of political action, as I may have limited resources and opportunities to engage in such activities. Additionally, my individual values and personal experience have shaped my understanding of political engagement, and I may have concerns about potential repercussions or risks associated with signing a political action petition. Considering the nuanced phrasing of the question, I would choose option (2) Might do."]}, {"persona": {"region": "Fayoum", "sex": "male", "age": 57, "country": "Egypt", "marital_status": "married", "education": "middle", "social_class": "working class"}, "question": {"id": "Q209", "variant": 0}, "response": ["Based on the anthropological framework, I, as a married male from Fayoum, Egypt, consider the cultural context and individual values and personal experience to be pivotal in understanding and answering this question. In my community, there is a strong emphasis on the importance of collective action and standing up for one's rights. Additionally, my middle education level and working-class background have shaped my understanding of the political landscape and the potential impact of signing a political action petition. Given these factors, I would answer the question as follows:\n\n2"]}, {"persona": {"region": "Fayoum", "sex": "male", "age": 60, "country": "Egypt", "marital_status": "married", "education": "middle", "social_class": "lower middle class"}, "question": {"id": "Q209", "variant": 0}, "response": ["Based on the anthropological framework, as a married male from Fayoum, Egypt, I am influenced by the cultural context of my community, where there is a strong emphasis on family and traditional values. My middle education level and lower middle class status also play a role in my understanding and decision-making process. Additionally, my age and socioeconomic background have shaped my individual values and personal experience. Considering all these factors, I would never sign a political action petition as it goes against my cultural and societal norms. \n\n3"]}, {"persona": {"region": "Fayoum", "sex": "male", "age": 21, "country": "Egypt", "marital_status": "single", "education": "middle", "social_class": "lower middle class"}, "question": {"id": "Q209", "variant": 0}, "response": ["Based on the anthropological framework, my perspective as a single male from Fayoum, Egypt, who is 21 years old and part of the lower middle class, is heavily influenced by my cultural context, socioeconomic background, and personal experience. In Egypt, political activism and signing petitions can be risky and can have serious consequences. Additionally, my lower middle class status means that I may not have the resources or connections to engage in political activism. Furthermore, my age and educational level also play a role in shaping my perspective on political action. Taking all of this into consideration, I would never do. \n\n3"]}, {"persona": {"region": "Fayoum", "sex": "male", "age": 33, "country": "Egypt", "marital_status": "single", "education": "higher", "social_class": "working class"}, "question": {"id": "Q209", "variant": 0}, "response": ["Based on the anthropological framework, my emic perspective as a working-class male from Fayoum, Egypt, and my personal experience and individual values lead me to consider the importance of political action in my community. The cultural context of Egypt, as well as my socioeconomic background, also play a significant role in my decision-making process. Taking into account the nuanced phrasing of the question, I would never do so, as I believe in other forms of political participation that are more effective in our cultural and socioeconomic context. Additionally, my age and place in society also influence my decision, as I prioritize other means of creating change within my community that align with my values and experiences.\n\n3"]}, {"persona": {"region": "Fayoum", "sex": "male", "age": 32, "country": "Egypt", "marital_status": "married", "education": "higher", "social_class": "lower middle class"}, "question": {"id": "Q209", "variant": 0}, "response": ["Based on the anthropological framework, as a married male from Fayoum, Egypt, my emic perspective is heavily influenced by my cultural context, socioeconomic background, and personal experience. In my community, there is a strong emphasis on family and community values, and signing a political action petition may be seen as a challenge to the existing power structure, which could have negative consequences for me and my family. Additionally, as part of the lower middle class, I may not have the same level of access to education and resources as those in higher social classes, which could impact my understanding of political action and my willingness to engage in it. Given these factors, I would never do (3) sign a political action petition."]}, {"persona": {"region": "Gharbia", "sex": "male", "age": 42, "country": "Egypt", "marital_status": "married", "education": "higher", "social_class": "upper middle class"}, "question": {"id": "Q209", "variant": 0}, "response": ["Based on my cultural context in Gharbia, Egypt, as a married male who has completed higher education and considers myself part of the upper middle class, my understanding and approach to political action petitions is influenced by my socioeconomic background, individual values, and personal experience. In Egypt, there is a strong emphasis on education and social status, which shapes my perspective on political involvement. Additionally, my age and place in society also play a role in my decision-making process. Considering these factors, I would never sign a political action petition as it goes against my personal values and beliefs. \n\n3"]}, {"persona": {"region": "Gharbia", "sex": "male", "age": 52, "country": "Egypt", "marital_status": "married", "education": "middle", "social_class": "working class"}, "question": {"id": "Q209", "variant": 0}, "response": ["Based on the anthropological framework, as a married male from Gharbia, Egypt, my emic perspective is influenced by my cultural context, individual values, and socioeconomic background. In my cultural context, political participation may not be a common practice, and there may be societal pressure to conform to certain political ideologies. Additionally, my individual values and personal experience may lead me to focus on providing for my family and maintaining stability rather than engaging in political activism. As a member of the working class, my socioeconomic background may also limit my ability to participate in political action. Therefore, I would never sign a political action petition.\n\n3"]}, {"persona": {"region": "Gharbia", "sex": "male", "age": 45, "country": "Egypt", "marital_status": "divorced", "education": "higher", "social_class": "upper middle class"}, "question": {"id": "Q209", "variant": 0}, "response": ["From an emic perspective, as a divorced male from Gharbia, Egypt, my cultural context and personal experience shape my understanding and decision-making. In Egypt, there is a strong emphasis on social and political activism, and as a highly educated individual from the upper middle class, I am well-aware of the importance of participating in political action. My socioeconomic background and individual values also play a significant role in my decision-making process. Additionally, age and time are important factors, as I have seen the impact of political action in my country over the years. Therefore, based on my nuanced understanding of the question and my cultural relativism, I would choose the option that aligns with my persona.\n\n2"]}, {"persona": {"region": "Behaira", "sex": "male", "age": 23, "country": "Egypt", "marital_status": "single", "education": "middle", "social_class": "lower class"}, "question": {"id": "Q209", "variant": 0}, "response": ["Based on the anthropological framework, I, as a single male from Behaira, Egypt, would consider the emic perspective in answering the question of whether I have ever signed a political action petition. In my cultural context, political involvement may not be common among individuals from my socioeconomic background and educational level. My personal experience and values may also play a role in shaping my answer, as I may not have been exposed to opportunities for political engagement. Additionally, the nuanced phrasing of the question and the understanding of cultural relativism would influence my response. Therefore, my answer would be:\n\n2) Might do"]}, {"persona": {"region": "Behaira", "sex": "male", "age": 38, "country": "Egypt", "marital_status": "single", "education": "higher", "social_class": "lower class"}, "question": {"id": "Q209", "variant": 0}, "response": ["From the emic and etic perspectives, as a member of the lower class in Behaira, Egypt, my cultural context and socioeconomic background heavily influence my individual values and personal experience. My experience and personal values have shaped my perception of political action and my willingness to engage in such activities. Additionally, the cultural relativism within my community and the nuanced phrasing of the question also play a significant role in my decision-making process. Therefore, considering all these factors, my answer would be:\n\n2"]}, {"persona": {"region": "Behaira", "sex": "male", "age": 32, "country": "Egypt", "marital_status": "married", "education": "middle", "social_class": "lower class"}, "question": {"id": "Q209", "variant": 0}, "response": ["From an emic perspective, as a married male from Behaira, Egypt, my cultural context and socioeconomic background play a significant role in my answer to this question. Being part of the lower class and having only completed middle education, my access to political action petitions may not be as readily available as it would be for someone of a higher socioeconomic status or with a higher level of education. Additionally, considering the current political climate in Egypt, there may be potential risks or consequences associated with signing a political action petition, which may deter me from doing so. Therefore, based on my individual values, personal experience, and understanding of cultural relativism, I would be inclined to say that I might do so in the future if the circumstances were right. \n\n2"]}, {"persona": {"region": "Behaira", "sex": "female", "age": 37, "country": "Egypt", "marital_status": "married", "education": "middle", "social_class": "working class"}, "question": {"id": "Q209", "variant": 0}, "response": ["Based on the anthropological framework, my emic perspective as a married female from Behaira, Egypt, at 37 years of age and part of the working class, is influenced by my cultural context, individual values, and socioeconomic background. In Behaira, political action and signing petitions are not common practices among the working class, and my personal experiences and values also lead me to prioritize family and work responsibilities over political activism. Additionally, the cultural relativism perspective reminds me that there is no hierarchy of culture, and my nuanced understanding of the question leads me to choose option (3) Would never do."]}, {"persona": {"region": "Behaira", "sex": "male", "age": 48, "country": "Egypt", "marital_status": "married", "education": "middle", "social_class": "working class"}, "question": {"id": "Q209", "variant": 0}, "response": ["Based on my emic perspective as a married male from Behaira, Egypt, and my middle education level, I have a strong cultural context that influences my views on signing political action petitions. My socioeconomic background as part of the working class also shapes my perception. In my culture, there is a strong emphasis on respecting authority and not engaging in actions that could be seen as challenging the government. Additionally, my personal experience and values lead me to be cautious about getting involved in political activities. Therefore, based on my nuanced understanding of the question and my cultural context, I would never do option (3)."]}, {"persona": {"region": "Behaira", "sex": "female", "age": 34, "country": "Egypt", "marital_status": "married", "education": "middle", "social_class": "lower class"}, "question": {"id": "Q209", "variant": 0}, "response": ["From the perspective of a married woman from Behaira, Egypt, the cultural context and socioeconomic background play a significant role in shaping my answer to this question. In my community, as a woman from the lower class with limited education, I do not often engage in political activities due to social and economic constraints. Additionally, my personal experience and values, influenced by cultural norms and expectations, also lead me to lean towards a more conservative approach to political activism. Taking into account the emic perspective of my community and my individual values, I would never do. \n\n3"]}, {"persona": {"region": "Behaira", "sex": "female", "age": 30, "country": "Egypt", "marital_status": "divorced", "education": "lower", "social_class": "lower class"}, "question": {"id": "Q209", "variant": 0}, "response": ["Based on the anthropological framework, my emic perspective as a divorced female from Behaira, Egypt, with a lower socioeconomic background and limited education, is heavily influenced by my individual values, personal experiences, and cultural context. In my community, there is a strong emphasis on traditional gender roles and limited opportunities for political participation. Additionally, my socioeconomic background has limited my access to education and resources, making it difficult for me to engage in political action. Therefore, I would never do.\n\n3"]}, {"persona": {"region": "Behaira", "sex": "male", "age": 40, "country": "Egypt", "marital_status": "married", "education": "higher", "social_class": "lower middle class"}, "question": {"id": "Q209", "variant": 0}, "response": ["From an anthropological perspective, my emic and etic perspectives as a married male from Behaira, Egypt, heavily influence my response to this question. In my cultural context, political activism is often seen as a risky endeavor, and as a member of the lower middle class, I am more focused on providing for my family and ensuring their well-being. My individual values and personal experiences have taught me to be cautious when it comes to engaging in political action, as the consequences could impact my family's stability. Additionally, my socioeconomic background has instilled in me a sense of pragmatism and a belief that my actions may not have a significant impact on the political system. As a result, I am more likely to choose option (2) Might do, as I am open to the idea but cautious about the potential risks. \n\n2"]}, {"persona": {"region": "Behaira", "sex": "male", "age": 38, "country": "Egypt", "marital_status": "married", "education": "middle", "social_class": "working class"}, "question": {"id": "Q209", "variant": 0}, "response": ["Based on the anthropological framework, as a married male from Behaira, Egypt, my emic perspective is shaped by my cultural context, individual values, and socioeconomic background. In Behaira, political activism is often seen as a risky and potentially dangerous endeavor, especially for those in the working class. Additionally, my personal experience and values have led me to prioritize stability and security for my family over potential political involvement. As a 38-year-old with a middle education level, I have seen the challenges and limitations of our socioeconomic status, and I believe that signing a political action petition could bring unwanted attention and risk to my family. Therefore, I would never do it.\n\n3"]}, {"persona": {"region": "Behaira", "sex": "female", "age": 30, "country": "Egypt", "marital_status": "married", "education": "higher", "social_class": "lower class"}, "question": {"id": "Q209", "variant": 0}, "response": ["From an emic perspective, as a married female from Behaira, Egypt, my cultural context and socioeconomic background play a pivotal role in how I perceive and engage with political action. My individual values and personal experience shape my perception of political activism, and my lower class status contributes to my understanding of the importance of social and economic issues. Additionally, my age and place also influence my views on political engagement. Given these factors, I would never sign a political action petition because I believe it would not have a tangible impact on my daily life and the issues affecting my community. Additionally, cultural relativism teaches me that my perspective is valid and should be respected. \n\n3"]}, {"persona": {"region": "Behaira", "sex": "female", "age": 35, "country": "Egypt", "marital_status": "married", "education": "middle", "social_class": "working class"}, "question": {"id": "Q209", "variant": 0}, "response": ["Based on my emic perspective as a married female from Behaira, Egypt, I have been raised in a cultural context where political activism is not commonly encouraged. My individual values and personal experience have shaped my perception of political action, and being part of the working class, I have limited time and resources to engage in such activities. Additionally, my socioeconomic background and educational level have influenced my understanding of the political system and the efficacy of signing a political action petition. Considering cultural relativism, I understand that my perspective may differ from others who have had different experiences and opportunities. Therefore, I have never signed a political action petition.\n\n3"]}, {"persona": {"region": "Behaira", "sex": "male", "age": 52, "country": "Egypt", "marital_status": "married", "education": "middle", "social_class": "lower class"}, "question": {"id": "Q209", "variant": 0}, "response": ["From an emic perspective, as a lower-class married male from Behaira, Egypt, my cultural context and socioeconomic background play a significant role in my decision-making process. My limited education and lower economic status have shaped my values and personal experiences, leading me to prioritize meeting the basic needs of my family over engaging in political action. Additionally, cultural relativism teaches me to respect the existing power structures and avoid challenging them through political activism. Furthermore, traditional gender roles may also influence my decision, as men are often expected to focus on providing for their families rather than engaging in political activities. Therefore, based on my nuanced understanding of my position within society, I would never sign a political action petition.\n\n3"]}, {"persona": {"region": "Alexandria", "sex": "female", "age": 41, "country": "Egypt", "marital_status": "single", "education": "middle", "social_class": "lower class"}, "question": {"id": "Q209", "variant": 0}, "response": ["Based on the anthropological framework, as a single female from Alexandria, Egypt, with a lower socioeconomic background, my perspective on signing a political action petition would be influenced by my cultural context, individual values, and personal experience. Being from a lower socioeconomic background, I may have experienced marginalization and lack of access to resources, which could lead me to be more inclined to participate in political activism. Additionally, as a woman in a patriarchal society, I may feel compelled to advocate for social and political change. Considering the cultural relativism and nuance of the question, I would choose option (2) Might do. \n\n2"]}, {"persona": {"region": "Alexandria", "sex": "female", "age": 21, "country": "Egypt", "marital_status": "single", "education": "middle", "social_class": "lower class"}, "question": {"id": "Q209", "variant": 0}, "response": ["Based on my emic perspective as a single female from Alexandria, Egypt, I have been raised in a cultural context where political activism is often viewed as risky and reserved for those with higher socioeconomic backgrounds. My individual values and personal experience have taught me to be cautious and prioritize safety, given the social and political climate in my country. As part of the lower class, I have limited access to resources and opportunities for political engagement. Additionally, cultural relativism plays a role in my decision-making, as I have been socialized to respect the status quo and avoid actions that could potentially disrupt societal norms. Therefore, I have never signed a political action petition and do not plan to do so in the future.\n\n2"]}, {"persona": {"region": "Alexandria", "sex": "female", "age": 35, "country": "Egypt", "marital_status": "married", "education": "middle", "social_class": "lower class"}, "question": {"id": "Q209", "variant": 0}, "response": ["Based on my cultural context as a married female from Alexandria, Egypt, my socioeconomic background as part of the lower class, and my age and education level, I have never signed a political action petition. In my community, there is a strong emphasis on familial and community ties, and political involvement is often seen as a privilege of the upper class. Additionally, my personal values and experiences have shaped my perspective on political activism, and I have never felt empowered or motivated to participate in such actions. Furthermore, the nuance of the question also plays a role, as the wording implies a proactive and deliberate choice to sign a petition, which does not align with my cultural and personal context.\n\n3"]}, {"persona": {"region": "Alexandria", "sex": "male", "age": 34, "country": "Egypt", "marital_status": "married", "education": "higher", "social_class": "working class"}, "question": {"id": "Q209", "variant": 0}, "response": ["Based on the anthropological framework, as a married male from Alexandria, Egypt, my emic perspective is shaped by my cultural context, individual values, and socioeconomic background. In Egypt, political activism is often met with resistance from the government, and as a working-class individual, I may have concerns about the potential repercussions of signing a political action petition. Additionally, my age and education level may influence my understanding of the political landscape in Egypt, and my personal experiences may have shaped my views on political activism. Therefore, considering all these factors, my answer would be:\n\n2"]}, {"persona": {"region": "Alexandria", "sex": "female", "age": 37, "country": "Egypt", "marital_status": "married", "education": "higher", "social_class": "lower middle class"}, "question": {"id": "Q209", "variant": 0}, "response": ["Based on the anthropological framework, my response is influenced by my emic perspective as a married female from Alexandria, Egypt, as well as my cultural context, individual values, and socioeconomic background. In Egypt, there is a strong sense of collectivism and community involvement, which includes participating in political action. My higher education has also instilled in me the importance of civic engagement and the potential for change through political action. As part of the lower middle class, I am aware of the socio-economic challenges faced by my community and the potential impact of political action on improving our circumstances. Therefore, based on my cultural context, values, and background, I would be open to signing a political action petition as a means of contributing to positive change.\n\n2"]}, {"persona": {"region": "Alexandria", "sex": "female", "age": 56, "country": "Egypt", "marital_status": "divorced", "education": "middle", "social_class": "working class"}, "question": {"id": "Q209", "variant": 0}, "response": ["Based on my emic perspective as a divorced female from Alexandria, Egypt, I understand that political participation is influenced by cultural context, individual values, and socioeconomic background. In Egypt, there is a strong sense of collectivism and community, and political involvement may be viewed as a way to advocate for change and express one's values. However, as a working-class woman who has completed middle education, I may not have had the same opportunities for political engagement as those in higher socioeconomic classes or with higher levels of education. Additionally, my personal experience and values may influence my willingness to engage in political action. Considering these factors, I might be open to signing a political action petition as a way to voice my concerns and advocate for change, even though I may not have done so in the past.\n\n2"]}, {"persona": {"region": "Alexandria", "sex": "male", "age": 48, "country": "Egypt", "marital_status": "married", "education": "higher", "social_class": "working class"}, "question": {"id": "Q209", "variant": 0}, "response": ["Based on the anthropological framework, my cultural context as a married male from Alexandria, Egypt, my age of 48, and my working-class background all influence my perspective. My individual values and personal experience also play a role in my decision-making. Additionally, the cultural relativism of Egypt means that signing a political action petition may be viewed differently than in other cultures. Considering all of these factors, I would never do it.\n\n3"]}, {"persona": {"region": "Alexandria", "sex": "female", "age": 30, "country": "Egypt", "marital_status": "married", "education": "middle", "social_class": "working class"}, "question": {"id": "Q209", "variant": 0}, "response": ["Based on the anthropological framework, as a married female from Alexandria, Egypt, my emic perspective is influenced by the cultural context of my community, where political activism may be viewed with caution or even fear. My individual values and personal experience, as well as my socioeconomic background as a working-class individual, also play a role in my decision. Additionally, cultural relativism reminds us that my perspective may differ significantly from others, and the nuance of the question is important in understanding my response.\n\n3"]}, {"persona": {"region": "Alexandria", "sex": "male", "age": 19, "country": "Egypt", "marital_status": "single", "education": "middle", "social_class": "lower class"}, "question": {"id": "Q209", "variant": 0}, "response": ["Based on my emic perspective as a lower-class single male from Alexandria, Egypt, my cultural context and socioeconomic background play a significant role in shaping my answer to this question. In Egypt, political activism is often associated with risk and potential consequences, and as a young person from the lower class, I am more likely to prioritize my personal safety and economic stability. Additionally, my limited education level and lack of access to resources may impact my understanding and engagement with political action. Therefore, I would never do this.\n\n3"]}, {"persona": {"region": "Alexandria", "sex": "male", "age": 45, "country": "Egypt", "marital_status": "married", "education": "middle", "social_class": "lower middle class"}, "question": {"id": "Q209", "variant": 0}, "response": ["Based on the anthropological framework, as a married male from Alexandria, Egypt, my emic perspective on signing a political action petition is influenced by my cultural context, individual values, and socioeconomic background. In Egypt, there is a strong cultural tradition of political engagement and activism, and as a lower middle class individual, I have personally experienced the effects of socioeconomic disparities and political issues. Additionally, my age and education level have provided me with the knowledge and understanding of the importance of political action. Therefore, I have signed a political action petition in the past to advocate for change in my community.\n\n1"]}, {"persona": {"region": "Alexandria", "sex": "male", "age": 23, "country": "Egypt", "marital_status": "single", "education": "higher", "social_class": "lower class"}, "question": {"id": "Q209", "variant": 0}, "response": ["From the emic and etic perspective, as a single male from Alexandria, Egypt, I am influenced by the cultural context of my surroundings, where political action and activism may be viewed differently compared to other cultures. My individual values and personal experience, as well as my lower socioeconomic background, play a significant role in shaping my perception of political action. Additionally, the cultural relativism of my community and the nuanced phrasing of the question also impact my decision. Considering all these factors, I might do sign a political action petition.\n\n2"]}, {"persona": {"region": "Alexandria", "sex": "female", "age": 28, "country": "Egypt", "marital_status": "married", "education": "middle", "social_class": "working class"}, "question": {"id": "Q209", "variant": 0}, "response": ["Based on the anthropological framework, my emic perspective as a married female from Alexandria, Egypt, with a working-class background and a middle education level, is influenced by my cultural context, individual values, and personal experience. In my cultural context, political action and activism may not be as common or accessible as in other places. Additionally, my socioeconomic background and level of education may affect my access to information and resources for political involvement. My personal experience and values also play a role, as I may prioritize other aspects of my life and community over political action. Therefore, I would never do option 3."]}, {"persona": {"region": "Alexandria", "sex": "male", "age": 34, "country": "Egypt", "marital_status": "single", "education": "higher", "social_class": "working class"}, "question": {"id": "Q209", "variant": 0}, "response": ["Based on the anthropological framework of emic and etic perspectives, cultural context, individual values and personal experience, socioeconomic background, cultural relativism, space and time, and nuance, as a single male from Alexandria, Egypt, who is 34 years old, has completed higher education, and considers himself part of the working class, my answer to the question is (2) Might do.\n\n2"]}, {"persona": {"region": "Alexandria", "sex": "male", "age": 30, "country": "Egypt", "marital_status": "married", "education": "higher", "social_class": "lower middle class"}, "question": {"id": "Q209", "variant": 0}, "response": ["Based on the anthropological framework, my emic perspective as a married male from Alexandria, Egypt, leads me to consider the cultural context, individual values, and socioeconomic background. In my cultural context, there is a strong emphasis on community and familial ties, as well as a history of political unrest. My individual values prioritize stability and security for my family. Additionally, my socioeconomic background as part of the lower middle class means that I am cautious about engaging in any potentially risky political actions. Therefore, considering these factors, I would never sign a political action petition.\n\n3"]}, {"persona": {"region": "Alexandria", "sex": "female", "age": 49, "country": "Egypt", "marital_status": "married", "education": "higher", "social_class": "lower middle class"}, "question": {"id": "Q209", "variant": 0}, "response": ["Based on the anthropological framework, my emic perspective as a married female from Alexandria, Egypt, at the age of 49 with a lower middle-class socioeconomic background and higher education level, is influenced by my cultural context, individual values, and personal experiences. In Egypt, political action and expressing political opinions can have significant consequences, and as a member of the lower middle class, I may feel a sense of powerlessness and fear of repercussions. Additionally, my age and place also play a role in my decision-making process. Therefore, based on these factors, I would never sign a political action petition.\n\n3"]}, {"persona": {"region": "Kafr el-sheikh", "sex": "male", "age": 49, "country": "Egypt", "marital_status": "married", "education": "higher", "social_class": "working class"}, "question": {"id": "Q209", "variant": 0}, "response": ["Based on the anthropological framework, as a married male from Kafr el-sheikh, Egypt, my emic perspective on signing a political action petition is influenced by my cultural context, individual values, and socioeconomic background. In my community, there is a strong emphasis on collective action and participation in political matters. Additionally, my personal experience and values have led me to believe in the importance of expressing my opinions and standing up for what I believe in. As a member of the working class, I have witnessed the impact of political decisions on my own life and the lives of those around me. Therefore, I have signed political action petitions in the past as a way to advocate for change and have found it to be an effective means of voicing my concerns and contributing to the betterment of my community.\n\n1"]}, {"persona": {"region": "Kafr el-sheikh", "sex": "male", "age": 25, "country": "Egypt", "marital_status": "single", "education": "middle", "social_class": "lower middle class"}, "question": {"id": "Q209", "variant": 0}, "response": ["Based on my emic perspective, as a 25-year-old male from Kafr el-sheikh, Egypt, I am influenced by my cultural context and socioeconomic background. My personal experience and individual values also play a significant role in my decision-making process. Considering the cultural relativism and nuance, I understand that signing a political action petition could have implications for my socio-economic standing and personal safety. Therefore, I might consider signing a political action petition, but it would depend on the specific circumstances and potential consequences.\n\n2"]}, {"persona": {"region": "Kafr el-sheikh", "sex": "male", "age": 59, "country": "Egypt", "marital_status": "married", "education": "higher", "social_class": "lower middle class"}, "question": {"id": "Q209", "variant": 0}, "response": ["Based on the anthropological framework, my emic perspective as a married male from Kafr el-sheikh, Egypt, at 59 years of age and with a higher education level, would be influenced by my cultural context, individual values, and socioeconomic background. In Egypt, there is a strong sense of collective identity and political participation is often seen as a duty. However, as part of the lower middle class, I may have concerns about potential repercussions of signing a political action petition. Additionally, my personal experience and values may lead me to be cautious about getting involved in public political activities. Therefore, I would be more inclined to consider the option of \"Might do\" as I acknowledge the importance of political action but would also weigh the potential risks and benefits before making a decision.\n\n2"]}, {"persona": {"region": "Kafr el-sheikh", "sex": "female", "age": 38, "country": "Egypt", "marital_status": "married", "education": "middle", "social_class": "working class"}, "question": {"id": "Q209", "variant": 0}, "response": ["Based on the anthropological framework, my individual values and personal experience as a married woman from Kafr el-sheikh, Egypt, who is part of the working class and completed middle education level, greatly influence my perceptions and actions. The cultural context of my upbringing and socioeconomic background have shaped my views on political action. Additionally, the emic and etic perspectives within my community also play a role in my decision-making. Taking into account these factors, my answer to the question is:\n\n2) Might do"]}, {"persona": {"region": "Kafr el-sheikh", "sex": "male", "age": 35, "country": "Egypt", "marital_status": "married", "education": "higher", "social_class": "lower middle class"}, "question": {"id": "Q209", "variant": 0}, "response": ["From an emic perspective, as a married male from Kafr el-sheikh, Egypt, my cultural context and socioeconomic background play a pivotal role in my decision-making. Being part of the lower middle class in Egypt, my individual values and personal experiences have shaped my perception of political action. I have completed higher education, which has given me an understanding of the importance of political engagement. However, considering the cultural relativism and nuance in the society I live in, I might consider signing a political action petition if it aligns with my values and beliefs and if I believe it can bring about positive change for my community and country.\n\n2"]}, {"persona": {"region": "Kafr el-sheikh", "sex": "male", "age": 49, "country": "Egypt", "marital_status": "married", "education": "middle", "social_class": "lower class"}, "question": {"id": "Q209", "variant": 0}, "response": ["From the perspective of a married male from Kafr el-sheikh, Egypt, who is 49 years old, has completed middle education level, and considers himself part of the lower class, several factors come into play when considering whether or not to sign a political action petition. The cultural context of living in Egypt, where political activism may be met with resistance from the government, as well as the individual values and personal experiences of being from a lower socioeconomic background, may lead to a reluctance to engage in political activities. Additionally, the nuance of the question and the potential consequences of signing a political petition in this cultural and socioeconomic context may further influence the decision.\n\n2"]}, {"persona": {"region": "Kafr el-sheikh", "sex": "male", "age": 37, "country": "Egypt", "marital_status": "married", "education": "middle", "social_class": "lower class"}, "question": {"id": "Q209", "variant": 0}, "response": ["Based on the anthropological framework, as a married male from Kafr el-sheikh, Egypt, my cultural context and socioeconomic background play a significant role in my understanding and answering of this question. In my community, there is a strong emphasis on collective action and participation in political activities. However, as someone from the lower class with limited education, I may not have had the opportunity or means to engage in political action or sign a petition. Additionally, my individual values and personal experience may lead me to prioritize providing for my family over political engagement. Therefore, my answer is: \n\n2) Might do"]}, {"persona": {"region": "Menofia", "sex": "female", "age": 22, "country": "Egypt", "marital_status": "single", "education": "middle", "social_class": "lower class"}, "question": {"id": "Q209", "variant": 0}, "response": ["Based on my emic perspective as a single female from Menofia, Egypt, my cultural context and socioeconomic background play a significant role in my decision-making process. As someone from the lower class, with limited access to education and resources, I am more likely to prioritize meeting basic needs over engaging in political activism. Additionally, my age and the societal expectations placed on young women in my community may influence my decision. Considering these factors, I would never do (3) sign a political action petition."]}, {"persona": {"region": "Menofia", "sex": "female", "age": 25, "country": "Egypt", "marital_status": "married", "education": "middle", "social_class": "lower class"}, "question": {"id": "Q209", "variant": 0}, "response": ["Based on the anthropological framework, my emic perspective as a married female from Menofia, Egypt, who is 25 years old and part of the lower class, influences my answer to the question. In my cultural context, political activism may be viewed as risky and potentially dangerous, given the socio-political climate in Egypt. My individual values and personal experience also play a role, as I may have witnessed or experienced the repercussions of political activism within my community. Additionally, my socioeconomic background may limit my ability to engage in political action, as I may not have the resources or social capital to do so. Therefore, my answer is influenced by these factors and I would never do (3) sign a political action petition."]}, {"persona": {"region": "Menofia", "sex": "male", "age": 28, "country": "Egypt", "marital_status": "single", "education": "higher", "social_class": "working class"}, "question": {"id": "Q209", "variant": 0}, "response": ["Based on the anthropological framework, as a single male from Menofia, Egypt, my emic perspective is shaped by my cultural context, individual values, and socioeconomic background. In my community, there is a strong emphasis on collective action and social responsibility, and as someone who has completed higher education and considers myself part of the working class, I am aware of the importance of political engagement. However, given the current political climate and potential repercussions, I am cautious about signing political action petitions. Therefore, based on my nuanced understanding of the question and my personal experience, I would never do it.\n\n3"]}, {"persona": {"region": "Menofia", "sex": "male", "age": 35, "country": "Egypt", "marital_status": "married", "education": "middle", "social_class": "lower middle class"}, "question": {"id": "Q209", "variant": 0}, "response": ["Based on the anthropological framework, as a married male from Menofia, Egypt, my emic perspective is influenced by my cultural context, socioeconomic background, and personal experience. In Menofia, there is a strong sense of community and reliance on kinship networks, and political actions are often viewed through the lens of social and familial connections. Additionally, as part of the lower middle class, my socioeconomic background may limit my access to political participation and influence my perception of political action petitions. Given these factors, I would never sign a political action petition as it may be seen as risky or outside the norm of traditional social and political engagement in my cultural context. \n\n3"]}, {"persona": {"region": "Menofia", "sex": "male", "age": 55, "country": "Egypt", "marital_status": "married", "education": "middle", "social_class": "working class"}, "question": {"id": "Q209", "variant": 0}, "response": ["Based on the anthropological framework, as a married male from Menofia, Egypt, who is 55 years old and part of the working class, my emic perspective on signing a political action petition is influenced by my cultural context, individual values, and socioeconomic background. In Menofia, there is a strong sense of community and solidarity, and political action is often seen as a collective effort. Additionally, my middle education level and working class status means that I have likely been exposed to political movements and may feel a responsibility to participate in civic engagement. However, the cultural relativism of Egypt also means that there may be a level of skepticism or distrust towards political institutions. In this context, I would never do. \n\n3"]}, {"persona": {"region": "Menofia", "sex": "male", "age": 53, "country": "Egypt", "marital_status": "married", "education": "higher", "social_class": "lower middle class"}, "question": {"id": "Q209", "variant": 0}, "response": ["Based on my emic perspective as a married male from Menofia, Egypt, I have grown up in a cultural context where political action is heavily influenced by socioeconomic background and age. As a member of the lower middle class, I have experienced the challenges and limitations that come with this status. My individual values and personal experiences have shaped my understanding of political action, and while I have never personally signed a political action petition, I can see how someone in my position might do so to advocate for change. Additionally, cultural relativism and the nuance of the question play a role in my response, as I recognize that political engagement can vary greatly based on individual circumstances and beliefs.\n\n2"]}, {"persona": {"region": "Menofia", "sex": "male", "age": 59, "country": "Egypt", "marital_status": "married", "education": "middle", "social_class": "working class"}, "question": {"id": "Q209", "variant": 0}, "response": ["From the emic perspective, as a married male from Menofia, Egypt, my cultural context and socioeconomic background greatly influence my decision-making process. In my community, traditional values and kinship networks hold significant importance, and the working-class status means that I am likely to prioritize providing for my family over engaging in political action. Additionally, my age and education level also play a role in my decision, as I may have limited exposure to political activism and may feel uncertain about its potential impact. Considering these factors, I would never do option 3."]}, {"persona": {"region": "Menofia", "sex": "female", "age": 42, "country": "Egypt", "marital_status": "married", "education": "middle", "social_class": "lower middle class"}, "question": {"id": "Q209", "variant": 0}, "response": ["From the emic and etic perspectives, as a married female from Menofia, Egypt, my cultural context and individual values and personal experience play a crucial role in my perception of political action. Being part of the lower middle class and having completed only a middle education level, my socioeconomic background has also influenced my understanding of political engagement. Additionally, the cultural relativism in Egypt and the importance of age and place in shaping my views cannot be overlooked. In this nuanced context, I would never sign a political action petition. \n\n3"]}, {"persona": {"region": "Menofia", "sex": "male", "age": 39, "country": "Egypt", "marital_status": "married", "education": "higher", "social_class": "working class"}, "question": {"id": "Q209", "variant": 0}, "response": ["Based on the anthropological framework, as a married male from Menofia, Egypt, my emic perspective and cultural context are important in understanding my answer to this question. In my cultural context, signing a political action petition may be seen as a way to advocate for change and address issues that affect my community. My individual values and personal experience also play a role in my decision, as I may have been influenced by societal and familial expectations regarding political participation. Additionally, my socioeconomic background as a working-class individual may impact my perception of political action and my willingness to engage in such activities. Considering these factors, my answer would be influenced by nuanced phrasing of the question and the specific political context in Egypt.\n2"]}, {"persona": {"region": "Menofia", "sex": "male", "age": 34, "country": "Egypt", "marital_status": "married", "education": "middle", "social_class": "lower middle class"}, "question": {"id": "Q209", "variant": 0}, "response": ["Based on the emic and etic perspectives, as a married male from Menofia, Egypt, my in-group way of thinking about signing a political action petition is heavily influenced by the cultural context of my community and my socioeconomic background. In my cultural context, political action and participation are important, but there may be limitations on how individuals from lower middle class backgrounds can engage in such activities. Additionally, my individual values and personal experience, as well as my age and place, play a significant role in my decision. Considering these factors, I would never do it.\n\n3"]}, {"persona": {"region": "Menofia", "sex": "male", "age": 22, "country": "Egypt", "marital_status": "single", "education": "higher", "social_class": "working class"}, "question": {"id": "Q209", "variant": 0}, "response": ["Based on the anthropological framework, my emic perspective as a single male from Menofia, Egypt, who considers himself part of the working class, is influenced by my cultural context, individual values, and socioeconomic background. In Egypt, there is a rich history of political activism and social movements, and as a young educated individual, I value the opportunity to participate in shaping the future of my country. My socioeconomic background as a member of the working class also motivates me to advocate for policies that benefit people like me. Furthermore, my personal experience and the cultural relativism of Egypt have instilled in me a sense of responsibility to contribute to the political discourse and seek positive change. As such, I have signed a political action petition.\n\n1"]}, {"persona": {"region": "Menofia", "sex": "male", "age": 21, "country": "Egypt", "marital_status": "single", "education": "middle", "social_class": "working class"}, "question": {"id": "Q209", "variant": 0}, "response": ["Based on the anthropological framework, as a single male from Menofia, Egypt, who has completed middle education and considers myself part of the working class, my perspective is influenced by my cultural context, socioeconomic background, and individual values. In Menofia, political engagement is often seen as a way for individuals to advocate for change and express their opinions. However, as a member of the working class, I may have limited access to political resources and may prioritize meeting my basic needs over engaging in political action. Additionally, my age and level of education may impact my understanding of political processes and my willingness to participate. Considering these factors, I would be more likely to have signed a political action petition in the past or might do so in the future, as it aligns with my cultural context and individual values.\n\n2"]}, {"persona": {"region": "Menofia", "sex": "male", "age": 36, "country": "Egypt", "marital_status": "married", "education": "higher", "social_class": "working class"}, "question": {"id": "Q209", "variant": 0}, "response": ["From an anthropological perspective, my emic perspective as a married male from Menofia, Egypt, is influenced by my cultural context, individual values, and socioeconomic background. In my community, there is a strong emphasis on the importance of collective action and advocating for societal change. As a member of the working class, I have personally experienced the impact of political decisions on my family's livelihood. Additionally, my higher education level has provided me with the knowledge and awareness of the potential benefits of signing a political action petition. Therefore, based on my cultural context, values, and personal experience, I believe that signing a political action petition is a crucial way to advocate for positive change in my community. \n\n2"]}, {"persona": {"region": "Menofia", "sex": "female", "age": 52, "country": "Egypt", "marital_status": "married", "education": "higher", "social_class": "lower middle class"}, "question": {"id": "Q209", "variant": 0}, "response": ["Based on my cultural context as a married female from Menofia, Egypt, my emic perspective is heavily influenced by my socioeconomic background and personal experience. As part of the lower middle class, I have limited access to political resources and opportunities, and my individual values and personal experience have shaped my perception of political action. Additionally, my age and education level play a role in how I view political engagement. Taking into account cultural relativism, I understand that my perspective may differ from others due to my unique context. Therefore, I might consider signing a political action petition as a way to potentially advocate for the betterment of my community and society, but the decision would ultimately depend on the specific circumstances and potential impact.\n\n2"]}, {"persona": {"region": "Menofia", "sex": "male", "age": 52, "country": "Egypt", "marital_status": "married", "education": "higher", "social_class": "lower middle class"}, "question": {"id": "Q209", "variant": 0}, "response": ["Based on my emic perspective as a married male from Menofia, Egypt, I have been influenced by the cultural context and individual values of my community. In my culture, signing a political action petition is often seen as a way to bring about positive change and contribute to the well-being of society. My personal experience and values lead me to believe that participating in such activities is important for the betterment of our community. Additionally, my lower middle class socioeconomic background has instilled in me a sense of duty towards advocating for social justice and equality. Therefore, I would choose the option: (1) Have done"]}, {"persona": {"region": "Menofia", "sex": "male", "age": 39, "country": "Egypt", "marital_status": "married", "education": "middle", "social_class": "lower class"}, "question": {"id": "Q209", "variant": 0}, "response": ["Based on my emic perspective as a lower-class married male from Menofia, Egypt, I have never signed a political action petition. In my cultural context, the political system is not open to the lower class and my socioeconomic background limits my ability to engage in political activities. Additionally, my individual values and personal experiences have taught me that signing a political action petition could have negative consequences for me and my family. Therefore, based on my nuanced understanding of the question and my cultural relativism, I would never do it.\n3"]}, {"persona": {"region": "Menofia", "sex": "male", "age": 23, "country": "Egypt", "marital_status": "single", "education": "middle", "social_class": "lower middle class"}, "question": {"id": "Q209", "variant": 0}, "response": ["As a single male from Menofia, Egypt, my perspective on signing a political action petition is heavily influenced by my cultural context, individual values, and socioeconomic background. In my community, there is a strong emphasis on collective action and solidarity, and signing a political action petition is seen as a way to contribute to the betterment of society. Additionally, my middle education level has provided me with a basic understanding of political issues and the importance of civic engagement. As part of the lower middle class, I am keenly aware of the challenges and injustices faced by people in my socioeconomic position, and I believe that signing a political action petition is a way to advocate for change and address these issues. Furthermore, my age and place in Menofia, Egypt, have exposed me to the impact of political decisions on my community, further motivating me to take action. Considering these factors, my perspective is that I have signed a political action petition as a way to contribute to positive social change.\n\n1"]}, {"persona": {"region": "Dakahlia", "sex": "female", "age": 24, "country": "Egypt", "marital_status": "single", "education": "higher", "social_class": "lower middle class"}, "question": {"id": "Q209", "variant": 0}, "response": ["Based on the anthropological framework, my emic perspective as a single female from Dakahlia, Egypt, who completed higher education and considers myself part of the lower middle class, is influenced by my cultural context, individual values, and socioeconomic background. In Egypt, there is a strong emphasis on community and social cohesion, and signing a political action petition is seen as a way to participate in shaping the country's future. My higher education has also exposed me to the importance of civic engagement and political activism. Additionally, my socioeconomic background as part of the lower middle class makes me acutely aware of the impact of political decisions on my daily life. Therefore, based on these factors, I have signed a political action petition before.\n\n1"]}, {"persona": {"region": "Dakahlia", "sex": "male", "age": 36, "country": "Egypt", "marital_status": "married", "education": "higher", "social_class": "upper middle class"}, "question": {"id": "Q209", "variant": 0}, "response": ["Based on the anthropological framework, as a married male from Dakahlia, Egypt, my emic perspective on signing a political action petition would be influenced by my cultural context, individual values and personal experiences, socioeconomic background, and space and time. In Egypt, there is a strong emphasis on collective identity and social harmony, where individual actions can have consequences for the entire family. Additionally, being part of the upper middle class, I may have more to lose in terms of social status and economic stability. Therefore, I would never sign a political action petition as it could potentially disrupt the social order and bring unwanted attention to myself and my family.\n\n3"]}, {"persona": {"region": "Dakahlia", "sex": "female", "age": 71, "country": "Egypt", "marital_status": "married", "education": "higher", "social_class": "upper middle class"}, "question": {"id": "Q209", "variant": 0}, "response": ["Based on my personal experience, education level, and socioeconomic background as an upper middle class woman from Dakahlia, Egypt, I understand the importance of political engagement and advocacy. In my cultural context, signing a political action petition is a way to voice my opinion and contribute to the betterment of society. My age and education have provided me with the knowledge and understanding of the significance of political participation. Additionally, my socioeconomic background has given me the resources and confidence to engage in such activities. Therefore, I believe that I have signed a political action petition in the past and would continue to do so in the future.\n\n1"]}, {"persona": {"region": "Dakahlia", "sex": "male", "age": 55, "country": "Egypt", "marital_status": "married", "education": "higher", "social_class": "upper middle class"}, "question": {"id": "Q209", "variant": 0}, "response": ["Based on the anthropological framework, as a married male from Dakahlia, Egypt, my emic perspective is influenced by my cultural context, individual values, and socioeconomic background. In my community, there is a strong emphasis on the importance of education and social status, which aligns with my higher education level and self-identification as part of the upper middle class. Additionally, the cultural relativism in Egypt leads me to prioritize stability and social harmony, which may impact my willingness to engage in political action. Furthermore, my age and place also contribute to my perspective, as older individuals in Dakahlia may be more cautious about engaging in political activities. Therefore, considering these factors, my response to the question is:\n\n2"]}, {"persona": {"region": "Dakahlia", "sex": "male", "age": 64, "country": "Egypt", "marital_status": "married", "education": "higher", "social_class": "lower middle class"}, "question": {"id": "Q209", "variant": 0}, "response": ["Based on the anthropological framework, as a married male from Dakahlia, Egypt, my emic perspective is influenced by my cultural context, individual values, and socioeconomic background. In my community, signing a political action petition may be seen as a way to advocate for change, but it may also carry certain risks and consequences. My personal experience and values may lead me to be cautious about openly participating in political activities. Additionally, my lower middle class socioeconomic background may also impact my decision, as it could influence my perception of the potential impact of signing a political action petition. Therefore, considering all these factors, I would never do.\n\n3"]}, {"persona": {"region": "Dakahlia", "sex": "female", "age": 29, "country": "Egypt", "marital_status": "married", "education": "middle", "social_class": "lower class"}, "question": {"id": "Q209", "variant": 0}, "response": ["Based on the anthropological framework, as a married woman from Dakahlia, Egypt, my emic perspective is shaped by my cultural context, individual values, and socioeconomic background. In my community, political engagement is not common among women, especially those from lower socioeconomic backgrounds. My personal experience and values also lead me to prioritize family and community over political action. Additionally, my limited education level has not provided me with the knowledge or confidence to engage in political activities. Therefore, I would never sign a political action petition.\n\n3"]}, {"persona": {"region": "Dakahlia", "sex": "female", "age": 40, "country": "Egypt", "marital_status": "married", "education": "middle", "social_class": "upper middle class"}, "question": {"id": "Q209", "variant": 0}, "response": ["Based on my emic perspective as a married female from Dakahlia, Egypt, I understand the importance of social and political engagement within my community. As part of the upper middle class, I have access to resources and education that have shaped my understanding of the political landscape. Additionally, my cultural context and personal experiences have influenced my views on political action. I value the opportunity to participate in social and political change, and I recognize the significance of signing a political action petition as a way to advocate for causes that are important to me and my community. Therefore, I have chosen option (1) Have done.\n\n1"]}, {"persona": {"region": "Dakahlia", "sex": "male", "age": 37, "country": "Egypt", "marital_status": "married", "education": "higher", "social_class": "lower middle class"}, "question": {"id": "Q209", "variant": 0}, "response": ["Based on the anthropological framework, as a married male from Dakahlia, Egypt, my emic perspective is influenced by the cultural context of my upbringing and the socioeconomic background of being part of the lower middle class. My personal experience and individual values also play a role in my decision-making. In this region, there is a strong emphasis on community and family, and there may be a certain level of skepticism or caution when it comes to participating in political action. Additionally, cultural relativism and the nuance of the question are important to consider. Therefore, my answer is:\n\n2"]}, {"persona": {"region": "Dakahlia", "sex": "female", "age": 45, "country": "Egypt", "marital_status": "married", "education": "middle", "social_class": "working class"}, "question": {"id": "Q209", "variant": 0}, "response": ["From the perspective of a married female from Dakahlia, Egypt, who is 45 years old, completed middle education level, and considers herself part of the working class, the answer to the question of whether she has ever signed a political action petition would be based on several factors. Firstly, her cultural context, including her socioeconomic background, would influence her answer. As a working-class individual from a region in Egypt, she may have limited exposure to political activism and may not have had the opportunity to participate in such actions. Additionally, her personal values and individual experiences would also play a role in her decision. Considering the societal and cultural norms in her community, she may lean towards a more conservative approach to political activism. Therefore, based on these factors, she would be more likely to choose the option (3) Would never do. \n\n3"]}, {"persona": {"region": "Dakahlia", "sex": "male", "age": 34, "country": "Egypt", "marital_status": "single", "education": "middle", "social_class": "lower middle class"}, "question": {"id": "Q209", "variant": 0}, "response": ["Based on my personal experience and cultural context as a lower middle class single male from Dakahlia, Egypt, I have never signed a political action petition. In my community, there is a strong emphasis on maintaining stability and avoiding political activism, as it is often seen as a risky endeavor. Additionally, my socioeconomic background and limited education level have not provided me with the opportunities or exposure to political activism. Furthermore, the cultural relativism within my community dictates a more passive approach to political engagement. \n3"]}, {"persona": {"region": "Dakahlia", "sex": "female", "age": 26, "country": "Egypt", "marital_status": "married", "education": "higher", "social_class": "upper middle class"}, "question": {"id": "Q209", "variant": 0}, "response": ["Based on the anthropological framework, as a married female from Dakahlia, Egypt, my emic perspective is influenced by my cultural context, individual values, and socioeconomic background. In my cultural context, there is a strong emphasis on community and family, and my individual values prioritize stability and security. Additionally, being part of the upper middle class, I have access to resources and education that have shaped my perspective on political action. Considering these factors, I have never signed a political action petition.\n\n3"]}, {"persona": {"region": "Dakahlia", "sex": "male", "age": 21, "country": "Egypt", "marital_status": "single", "education": "middle", "social_class": "upper middle class"}, "question": {"id": "Q209", "variant": 0}, "response": ["Based on my emic perspective as a single male from Dakahlia, Egypt, I am aware that signing a political action petition may have consequences within my cultural context. My personal experience and individual values lead me to believe that it might be risky to publicly engage in political activities at my age and socioeconomic background. Additionally, cultural relativism is crucial in understanding that political participation is viewed differently in my community, and my nuanced understanding of the situation has led me to the conclusion that I might consider signing a political action petition in the future, but for now, I would never do it.\n\n3"]}, {"persona": {"region": "Dakahlia", "sex": "female", "age": 32, "country": "Egypt", "marital_status": "married", "education": "middle", "social_class": "working class"}, "question": {"id": "Q209", "variant": 0}, "response": ["Based on the anthropological framework, as a married female from Dakahlia, Egypt, my emic perspective is shaped by my cultural context, individual values and personal experience, socioeconomic background, and space and time. In my community, there is a strong emphasis on family and community connections, and political activism may not be a common practice. Additionally, as a working-class woman with a middle education level, I may not have had the opportunity or resources to engage in political action. My personal experience and values also influence my perspective, and I may prioritize other aspects of life over political activism. Therefore, based on my background and perspective, I would be unlikely to have signed a political action petition. \n\n3"]}, {"persona": {"region": "Dakahlia", "sex": "female", "age": 35, "country": "Egypt", "marital_status": "married", "education": "middle", "social_class": "upper middle class"}, "question": {"id": "Q209", "variant": 0}, "response": ["From the perspective of a married female from Dakahlia, Egypt, aged 35 and part of the upper middle class, my answer is influenced by several factors. Firstly, the cultural context in Egypt, particularly in Dakahlia, plays a significant role in the perception of political action and the signing of petitions. Additionally, my personal experience and individual values shape my response, as well as my socioeconomic background. As a member of the upper middle class, I am more likely to have access to information and resources that may lead me to be more politically active. Furthermore, cultural relativism is important to consider, as the societal norms and values in Egypt may differ from those in other countries. Lastly, the nuance of the question is crucial, as the specific wording and context of the petition in question would heavily influence my decision.\n\n2"]}, {"persona": {"region": "Dakahlia", "sex": "male", "age": 33, "country": "Egypt", "marital_status": "married", "education": "middle", "social_class": "upper middle class"}, "question": {"id": "Q209", "variant": 0}, "response": ["Based on the anthropological framework, my emic perspective as a married male from Dakahlia, Egypt, who is 33 years old and considers himself part of the upper middle class, is influenced by my cultural context, individual values, and socioeconomic background. In my cultural context, signing a political action petition may be seen as a way to express my personal experience and values, as well as to contribute to the socio-political landscape in Egypt. As part of the upper middle class, I may have more resources and access to information about political issues, which could influence my decision. Additionally, my age and place in society may also shape my perspective on political activism. Taking these factors into consideration, I would choose option (2) Might do. \n\n2"]}, {"persona": {"region": "Dakahlia", "sex": "female", "age": 45, "country": "Egypt", "marital_status": "married", "education": "middle", "social_class": "upper middle class"}, "question": {"id": "Q209", "variant": 0}, "response": ["From the perspective of a married female from Dakahlia, Egypt, who is 45 years old, has completed middle education, and considers herself part of the upper middle class, the decision to sign a political action petition would be influenced by several factors. Firstly, the cultural context in Egypt places a high value on social and political stability, and there may be a sense of duty towards supporting the government. Additionally, the socioeconomic background of being upper middle class may lead to a reluctance to engage in political action that could potentially disrupt the status quo. The individual values and personal experience of this persona may also play a role, as they may prioritize family and community stability over political activism. Furthermore, the nuance of the question may also be considered, as the persona might be open to signing a petition for specific causes that align with their values but may be hesitant to engage in broader political action. Based on this perspective, the persona would likely choose:\n\n2) Might do"]}, {"persona": {"region": "Dakahlia", "sex": "male", "age": 30, "country": "Egypt", "marital_status": "married", "education": "middle", "social_class": "upper middle class"}, "question": {"id": "Q209", "variant": 0}, "response": ["Based on the anthropological framework, my response to the question is influenced by my emic perspective as a married male from Dakahlia, Egypt, where certain social and cultural norms shape my understanding and behavior. My cultural context, including my socioeconomic background and education level, also plays a significant role in my decision-making process. Additionally, my individual values and personal experiences contribute to my response, as well as my understanding of cultural relativism and the importance of nuance in interpreting and answering questions. Considering these factors, my choice is as follows:\n\n2"]}, {"persona": {"region": "Dakahlia", "sex": "female", "age": 63, "country": "Egypt", "marital_status": "married", "education": "higher", "social_class": "lower middle class"}, "question": {"id": "Q209", "variant": 0}, "response": ["From the emic perspective, as a married female from Dakahlia, Egypt, my cultural context and socioeconomic background play a significant role in my understanding and response to this question. In my community, women are generally expected to prioritize family and household responsibilities over political engagement. Additionally, my lower middle class socioeconomic background means that I have limited access to political resources and opportunities. My individual values and personal experience also influence my decision, as I have not been actively involved in political activities due to the societal expectations and my focus on providing for my family. Furthermore, cultural relativism reminds me that my perspective is shaped by my specific cultural and societal context, and it is not appropriate to compare it to others. Therefore, based on these factors, I would never do.\n\n3"]}, {"persona": {"region": "Dakahlia", "sex": "male", "age": 28, "country": "Egypt", "marital_status": "single", "education": "higher", "social_class": "upper middle class"}, "question": {"id": "Q209", "variant": 0}, "response": ["Based on my emic perspective as a single male from Dakahlia, Egypt, I am aware of the cultural and societal norms that influence my decision-making. My higher education level and upper middle class status have shaped my individual values and personal experiences, leading me to prioritize certain causes and issues. Additionally, my socioeconomic background has provided me with the resources and opportunities to actively engage in political action. As a member of this specific cultural and socioeconomic context, I have been exposed to the importance of civic engagement and the potential impact of political action petitions. Therefore, I believe that I have the potential to support and sign a political action petition in the future, as it aligns with my values and experiences.\n\n2"]}, {"persona": {"region": "Dakahlia", "sex": "female", "age": 24, "country": "Egypt", "marital_status": "married", "education": "higher", "social_class": "upper middle class"}, "question": {"id": "Q209", "variant": 0}, "response": ["Based on the anthropological framework, as a married female from Dakahlia, Egypt, my emic perspective is heavily influenced by the cultural context, individual values, and socioeconomic background. In my community, women are expected to have a strong sense of family and community, and my personal values align with the importance of collective action for the betterment of society. Additionally, my higher education level and upper middle class status provide me with the resources and opportunities to engage in political action. Therefore, I have signed a political action petition.\n\n1"]}, {"persona": {"region": "Dakahlia", "sex": "male", "age": 20, "country": "Egypt", "marital_status": "single", "education": "middle", "social_class": "upper middle class"}, "question": {"id": "Q209", "variant": 0}, "response": ["Based on the anthropological framework, my individual values and personal experiences as a single male from Dakahlia, Egypt, who has completed middle education level and considers myself part of the upper middle class, play a significant role in shaping my perspective on political action petitions. Additionally, the cultural context of Egypt and the socioeconomic background of being part of the upper middle class also influence my perceptions. As a 20-year-old, space and time also factor into my decision-making process. Given these considerations, my answer would be: \n\n2) Might do"]}, {"persona": {"region": "Dakahlia", "sex": "male", "age": 45, "country": "Egypt", "marital_status": "married", "education": "middle", "social_class": "upper middle class"}, "question": {"id": "Q209", "variant": 0}, "response": ["Based on the anthropological framework, my emic perspective as a married male from Dakahlia, Egypt, would be shaped by my cultural context, individual values, and socioeconomic background. In my cultural context, political activism may not be as common or encouraged, and my personal experience and values may also influence my stance on signing a political action petition. Additionally, my socioeconomic background as a member of the upper middle class may lead me to prioritize stability and security, which could impact my willingness to engage in political activism. Taking into account these factors, I would be inclined to select option (3) \"Would never do.\""]}, {"persona": {"region": "Dakahlia", "sex": "female", "age": 43, "country": "Egypt", "marital_status": "married", "education": "higher", "social_class": "upper middle class"}, "question": {"id": "Q209", "variant": 0}, "response": ["Based on my cultural context, as a married female from Dakahlia, Egypt, I am a part of a society that values community and social responsibility. My individual values and personal experience, along with the emphasis on socioeconomic background, have shaped my perspective. In my upper middle class status, I have access to education and resources that allow me to understand the importance of political engagement and advocacy. Additionally, my age and education have given me the knowledge and confidence to participate in political action, which aligns with the cultural relativism that values active participation in societal issues. Therefore, I would choose option (1) Have done."]}, {"persona": {"region": "Dakahlia", "sex": "female", "age": 20, "country": "Egypt", "marital_status": "single", "education": "middle", "social_class": "upper middle class"}, "question": {"id": "Q209", "variant": 0}, "response": ["Based on my emic perspective as a single female from Dakahlia, Egypt, I have been raised in a cultural context where political activism is not commonly practiced, especially for someone of my socioeconomic background and age. My individual values and personal experiences have also shaped my understanding of political action, and I have not been exposed to situations where signing a political action petition was necessary or encouraged. Additionally, cultural relativism plays a role in my decision, as the societal norms and values in my community do not prioritize political activism. Therefore, based on my nuanced understanding of the question and my personal background, I would never do option 3."]}, {"persona": {"region": "Dakahlia", "sex": "female", "age": 40, "country": "Egypt", "marital_status": "single", "education": "middle", "social_class": "lower middle class"}, "question": {"id": "Q209", "variant": 0}, "response": ["Based on my cultural context and socioeconomic background, as a single female from Dakahlia, Egypt, I have a different understanding of political action and participation in such activities. My personal experience and values also play a significant role in shaping my perspective. Being part of the lower middle class, I have limited resources and opportunities to engage in political activities. Additionally, the cultural relativism in my community may influence my decision. Considering all these factors, I would never do so.\n\n3"]}, {"persona": {"region": "Dakahlia", "sex": "female", "age": 33, "country": "Egypt", "marital_status": "married", "education": "higher", "social_class": "upper middle class"}, "question": {"id": "Q209", "variant": 0}, "response": ["Based on my personal experience and cultural context as a married female from Dakahlia, Egypt, I am aware of the importance of political engagement and the impact it can have on our society. As someone who has completed higher education and considers myself part of the upper middle class, I understand the value of participating in political action and signing petitions as a way to advocate for change. Additionally, my socioeconomic background and individual values lead me to believe that signing a political action petition can be an effective means of expressing my opinions and contributing to the betterment of our community. Therefore, I would choose option (1) Have done."]}, {"persona": {"region": "Dakahlia", "sex": "female", "age": 24, "country": "Egypt", "marital_status": "married", "education": "middle", "social_class": "working class"}, "question": {"id": "Q209", "variant": 0}, "response": ["Based on the anthropological framework, my answer to the question is influenced by my cultural context as a married female from Dakahlia, Egypt, where political engagement is not common for women of my socioeconomic background and educational level. Additionally, my individual values and personal experience play a role in my decision, as I have not been exposed to or encouraged to participate in political action. Furthermore, cultural relativism is important to consider, as the societal norms and expectations in my community may differ from those in other cultures. Taking all of this into account, my answer to the question is:\n\n2"]}, {"persona": {"region": "Dakahlia", "sex": "female", "age": 53, "country": "Egypt", "marital_status": "widowed", "education": "middle", "social_class": "working class"}, "question": {"id": "Q209", "variant": 0}, "response": ["Based on my personal experience as a widowed female from Dakahlia, Egypt, and my working-class background, I understand the importance of political action and the impact it can have on my community. My cultural context and socioeconomic background have shaped my understanding of the significance of signing a political action petition. As a member of the working class, I have witnessed the struggles and challenges faced by my community, and I believe that signing a political action petition can be a powerful way to advocate for change and address the issues that affect us. Additionally, my age and location have also influenced my perspective, as I have seen the impact of political actions on our society over time. Therefore, based on my personal values and experiences, I believe that signing a political action petition is an important way to make our voices heard and bring about positive change for our community.\n\n2"]}, {"persona": {"region": "Dakahlia", "sex": "female", "age": 30, "country": "Egypt", "marital_status": "single", "education": "middle", "social_class": "lower middle class"}, "question": {"id": "Q209", "variant": 0}, "response": ["Based on the anthropological framework, my emic perspective as a single female from Dakahlia, Egypt, with a middle education level and lower middle class background, is influenced by my cultural context, individual values, and socioeconomic background. In my cultural context, women are often not encouraged to engage in political activism, and there may be limitations on opportunities to do so. Additionally, my individual values and personal experience may lead me to be cautious about participating in political action due to potential repercussions. My socioeconomic background also plays a role, as lower middle class individuals may have less access to resources and support for political engagement. Therefore, my perspective on signing a political action petition would align with the emic understanding of my social position and cultural context.\n\n2"]}, {"persona": {"region": "Dakahlia", "sex": "male", "age": 53, "country": "Egypt", "marital_status": "married", "education": "higher", "social_class": "upper middle class"}, "question": {"id": "Q209", "variant": 0}, "response": ["Based on the anthropological framework, as a married male from Dakahlia, Egypt, my emic perspective would be influenced by my cultural context, individual values, and socioeconomic background. In my cultural context, there may be certain expectations and norms around political activism and signing petitions. Additionally, my higher education level and upper middle class status may influence my individual values and personal experiences, leading me to be more likely to engage in political activism. Furthermore, the nuanced phrasing of the question and the understanding of cultural relativism would also impact my decision. Considering all these factors, I would choose option (1) Have done."]}, {"persona": {"region": "Dakahlia", "sex": "male", "age": 28, "country": "Egypt", "marital_status": "married", "education": "middle", "social_class": "working class"}, "question": {"id": "Q209", "variant": 0}, "response": ["From the perspective of a married male from Dakahlia, Egypt, the cultural context and socioeconomic background play a significant role in shaping my answer to this question. In my community, there is a strong emphasis on family and work, and my middle education level and working-class status contribute to my focus on providing for my family. Additionally, the cultural relativism in Egypt means that there is a certain level of skepticism towards political actions and petitions, as there is a history of political instability. Therefore, I would be hesitant to sign a political action petition, as it may have potential consequences for my family and me. \n\n2"]}, {"persona": {"region": "Dakahlia", "sex": "female", "age": 38, "country": "Egypt", "marital_status": "married", "education": "middle", "social_class": "upper middle class"}, "question": {"id": "Q209", "variant": 0}, "response": ["Based on my emic perspective as a married female from Dakahlia, Egypt, I understand that political action and participation in civic activities are greatly influenced by cultural context, individual values, and socioeconomic background. In my cultural context, there is a strong emphasis on family and community, and political engagement may not be seen as a priority. Additionally, being part of the upper middle class, I may have more access to resources and opportunities to participate in political action, but my personal experience and values may lead me to prioritize other aspects of life. Therefore, based on these factors, I might do.\n\n2"]}, {"persona": {"region": "Gharbia", "sex": "male", "age": 27, "country": "Egypt", "marital_status": "single", "education": "higher", "social_class": "upper middle class"}, "question": {"id": "Q209", "variant": 0}, "response": ["Based on the anthropological framework, as a single male from Gharbia, Egypt, my emic perspective is influenced by my cultural context, individual values, and socioeconomic background. In Egypt, there is a strong emphasis on social and political activism, and higher education has exposed me to the importance of civic engagement. Additionally, being part of the upper middle class has provided me with the resources and networks to participate in political action. Therefore, I have signed a political action petition in the past.\n\n1"]}, {"persona": {"region": "Gharbia", "sex": "female", "age": 35, "country": "Egypt", "marital_status": "married", "education": "higher", "social_class": "upper middle class"}, "question": {"id": "Q209", "variant": 0}, "response": ["As a married female from Gharbia, Egypt, my emic perspective on signing a political action petition is influenced by the cultural context of my community and the socioeconomic background I belong to. In my cultural context, there is a strong emphasis on maintaining social harmony and avoiding political activism. Additionally, as someone from the upper-middle class, I value stability and security, and I am cautious about engaging in activities that may disrupt the status quo. Furthermore, my individual values and personal experiences have shaped my perception of political action, leading me to believe that there are other, more effective ways to bring about change. Therefore, based on my nuanced understanding of the question and my personal background, I would never do (3) so."]}, {"persona": {"region": "Gharbia", "sex": "female", "age": 37, "country": "Egypt", "marital_status": "married", "education": "higher", "social_class": "upper middle class"}, "question": {"id": "Q209", "variant": 0}, "response": ["Based on the anthropological framework, my emic perspective as a married female from Gharbia, Egypt, is influenced by my cultural context, individual values, and socioeconomic background. In my culture, women are expected to be educated and involved in the community, so I have a strong personal value for civic engagement. Additionally, as part of the upper middle class, I have the resources and social capital to participate in political action. However, the nuance of the question is important to consider - while I support political action, I may be cautious about openly signing a petition due to potential social or political repercussions. Therefore, my answer would be influenced by the nuanced phrasing of the question and the potential consequences of my actions.\n2"]}, {"persona": {"region": "Gharbia", "sex": "male", "age": 43, "country": "Egypt", "marital_status": "married", "education": "middle", "social_class": "lower middle class"}, "question": {"id": "Q209", "variant": 0}, "response": ["Based on the anthropological framework, as a married male from Gharbia, Egypt, my emic perspective is influenced by my cultural context, individual values, and socioeconomic background. In Egypt, there is a strong emphasis on family and community, and as a lower middle class individual, I prioritize stability and security for my family. My personal experience and values have taught me to be cautious about engaging in political action, as it may have repercussions on my livelihood and the well-being of my family. Additionally, cultural relativism teaches me to respect the existing power structures and not challenge them through political action. Therefore, I would never sign a political action petition.\n\n3"]}, {"persona": {"region": "Gharbia", "sex": "male", "age": 28, "country": "Egypt", "marital_status": "single", "education": "higher", "social_class": "lower middle class"}, "question": {"id": "Q209", "variant": 0}, "response": ["Based on my emic perspective as a single male from Gharbia, Egypt, my cultural context and socioeconomic background play a crucial role in my understanding and response to this question. In Egypt, there is a complex political landscape and signing a political action petition can have serious consequences. My individual values and personal experience also shape my perception, as I have seen the impact of political activism on people in my community. Additionally, cultural relativism is important to consider, as the societal norms and values in Egypt may differ from those in other countries. Therefore, my nuanced response to this question is influenced by my age, education level, and socioeconomic background, as well as the potential risks and rewards associated with political activism in my cultural context.\n\n2"]}, {"persona": {"region": "Gharbia", "sex": "male", "age": 39, "country": "Egypt", "marital_status": "married", "education": "middle", "social_class": "lower middle class"}, "question": {"id": "Q209", "variant": 0}, "response": ["Based on the anthropological framework, my emic perspective as a married male from Gharbia, Egypt, would be influenced by my cultural context, individual values, and socioeconomic background. In my community, signing a political action petition may not be a common practice due to the cultural and political climate. Additionally, my lower middle class socioeconomic background and middle education level may have shaped my personal experience and values, leading me to be cautious about engaging in political activism. Therefore, based on my emic perspective, I would never do.\n\n3"]}, {"persona": {"region": "Gharbia", "sex": "male", "age": 30, "country": "Egypt", "marital_status": "married", "education": "middle", "social_class": "lower middle class"}, "question": {"id": "Q209", "variant": 0}, "response": ["Based on the anthropological framework, as a married male from Gharbia, Egypt, my emic perspective would be influenced by my cultural context, individual values, and socioeconomic background. In Gharbia, political activism may be viewed with skepticism and fear due to the political climate and potential consequences. My lower middle class status and completion of middle education level also affect my perception and willingness to engage in political action. Considering these factors, I would never sign a political action petition.\n\n3"]}, {"persona": {"region": "Gharbia", "sex": "male", "age": 43, "country": "Egypt", "marital_status": "married", "education": "lower", "social_class": "lower middle class"}, "question": {"id": "Q209", "variant": 0}, "response": ["Based on the anthropological framework, as a married male from Gharbia, Egypt, my emic perspective is influenced by my cultural context, individual values, and socioeconomic background. In my cultural context, signing a political action petition may be viewed as a way to advocate for change or express discontent with the current political system. However, as someone who completed lower education and considers myself part of the lower middle class, I may have limited access to information about political action petitions and may prioritize meeting my family's basic needs over political activism. My personal experience and values also play a role, as I may have concerns about potential repercussions for participating in political activities. Overall, given these considerations, I would be more likely to choose option (2) - Might do. \n\n2"]}, {"persona": {"region": "Gharbia", "sex": "male", "age": 36, "country": "Egypt", "marital_status": "married", "education": "higher", "social_class": "lower middle class"}, "question": {"id": "Q209", "variant": 0}, "response": ["Based on the anthropological framework, as a married male from Gharbia, Egypt, my emic perspective on signing a political action petition is influenced by my cultural context. In Egypt, there is a strong emphasis on community and family, and my personal experience and values are shaped by these cultural norms. Additionally, my socioeconomic background as part of the lower middle class and my age of 36 also play a role in my decision-making process. Taking into account the nuance of the question, I would never sign a political action petition because I prioritize stability and harmony within my community and do not believe in publicly challenging the political system. \n\n3"]}, {"persona": {"region": "Gharbia", "sex": "male", "age": 25, "country": "Egypt", "marital_status": "married", "education": "middle", "social_class": "upper middle class"}, "question": {"id": "Q209", "variant": 0}, "response": ["Based on the anthropological framework described above, my answer to the question is influenced by my emic perspective as a married male from Gharbia, Egypt. In my cultural context, signing a political action petition may be seen as a form of activism or resistance, which could be viewed positively or negatively depending on one's individual values and personal experience. Considering my socioeconomic background as part of the upper middle class, I may have more access to education and resources, leading me to potentially be more politically engaged. Additionally, the nuanced phrasing of the question may also influence my response, as there may be specific circumstances or causes that would motivate me to sign a political action petition. Therefore, my answer is (2) Might do."]}, {"persona": {"region": "Gharbia", "sex": "male", "age": 31, "country": "Egypt", "marital_status": "married", "education": "middle", "social_class": "upper middle class"}, "question": {"id": "Q209", "variant": 0}, "response": ["Based on my emic perspective as a married male from Gharbia, Egypt, I am influenced by the cultural context of my community and the socioeconomic background of my upper middle class status. My personal values and experiences have shaped my understanding of political action, and I am also mindful of the cultural relativism that exists within my society. Being 31 years old, I am aware of the space and time in which I live, and I understand the nuances of political involvement in my community. Therefore, my response to the question would be:\n\n2"]}, {"persona": {"region": "Gharbia", "sex": "male", "age": 33, "country": "Egypt", "marital_status": "married", "education": "higher", "social_class": "lower middle class"}, "question": {"id": "Q209", "variant": 0}, "response": ["Based on the anthropological framework, my emic perspective as a married male from Gharbia, Egypt, at the age of 33 and with a completed higher education level, is influenced by my cultural context, individual values, and socioeconomic background. In Egypt, there is a strong emphasis on family and community, and my lower middle-class status means that I may have concerns about the potential consequences of signing a political action petition. Additionally, my education level may have exposed me to the importance of political participation, but my socioeconomic background may also limit my ability to fully engage in such activities. Therefore, considering all these factors, I would choose the option: (2) Might do."]}, {"persona": {"region": "Gharbia", "sex": "male", "age": 26, "country": "Egypt", "marital_status": "single", "education": "higher", "social_class": "upper middle class"}, "question": {"id": "Q209", "variant": 0}, "response": ["Based on the anthropological framework, my emic perspective as a single male from Gharbia, Egypt, who has completed higher education and considers myself part of the upper middle class, is influenced by my cultural context, individual values, and socioeconomic background. In my cultural context, signing a political action petition may be seen as a way to contribute to societal change and have a voice in governance. My individual values and personal experience may lead me to believe that signing a petition is a way to exercise my rights and have a say in political matters. Additionally, my socioeconomic background as part of the upper middle class may provide me with the resources and education to understand the importance of political engagement. Therefore, I would have a positive inclination towards signing a political action petition.\n\n1"]}, {"persona": {"region": "Gharbia", "sex": "female", "age": 45, "country": "Egypt", "marital_status": "married", "education": "middle", "social_class": "lower middle class"}, "question": {"id": "Q209", "variant": 0}, "response": ["Based on the anthropological framework, my reasoning for choosing the option (2) Might do is as follows: As a married woman from Gharbia, Egypt, my cultural context and individual values play a significant role in my decision-making process. I come from a lower middle-class background and have completed middle education, which has shaped my understanding of political action and the importance of voicing my opinions. Additionally, my age and socioeconomic background have influenced my perception of political engagement. While I have not signed a political action petition in the past, I am open to the possibility of doing so in the future if I believe it will positively impact my community and align with my personal values. Therefore, I might consider signing a political action petition based on my individual values and cultural context. \n\n2"]}, {"persona": {"region": "Gharbia", "sex": "female", "age": 55, "country": "Egypt", "marital_status": "married", "education": "middle", "social_class": "upper middle class"}, "question": {"id": "Q209", "variant": 0}, "response": ["Based on the anthropological framework, as a married female from Gharbia, Egypt, my emic perspective would be influenced by my cultural context, individual values, and socioeconomic background. In my community, women are expected to uphold certain social and cultural norms, and signing a political action petition may be seen as unconventional or even risky. Additionally, my personal experience and values may lead me to prioritize stability and harmony over political activism. Considering the cultural relativism and the nuanced phrasing of the question, I would never do.\n\n3"]}, {"persona": {"region": "Gharbia", "sex": "female", "age": 27, "country": "Egypt", "marital_status": "married", "education": "higher", "social_class": "upper middle class"}, "question": {"id": "Q209", "variant": 0}, "response": ["Based on the anthropological framework, as a married female from Gharbia, Egypt, my emic perspective would be influenced by my cultural context, individual values, and socioeconomic background. In Gharbia, there is a strong emphasis on family, community, and social stability. As a woman with higher education and part of the upper middle class, I value education, social status, and stability. I might consider signing a political action petition as a way to advocate for change that aligns with my values and principles, but I would approach it cautiously to ensure it does not disrupt the social harmony and stability of my community. \n\n2"]}, {"persona": {"region": "Gharbia", "sex": "female", "age": 42, "country": "Egypt", "marital_status": "married", "education": "higher", "social_class": "upper middle class"}, "question": {"id": "Q209", "variant": 0}, "response": ["Based on the anthropological framework, as a married female from Gharbia, Egypt, my emic perspective would be influenced by my cultural context, individual values, and socioeconomic background. In my culture, women are often encouraged to support political causes that align with the values of their community and family. Additionally, my higher education level and upper middle-class status may provide me with the resources and confidence to engage in political action. Therefore, I would be more likely to have signed a political action petition as a way to express my support for causes that are important to me and my community.\n\n1"]}, {"persona": {"region": "Gharbia", "sex": "female", "age": 32, "country": "Egypt", "marital_status": "married", "education": "middle", "social_class": "upper middle class"}, "question": {"id": "Q209", "variant": 0}, "response": ["Based on the anthropological framework, as a married female from Gharbia, Egypt, my emic perspective is influenced by my cultural context, individual values, and socioeconomic background. In Egypt, political engagement is often influenced by kinship networks and social class, and as a member of the upper middle class, I am more likely to have opportunities for political participation and access to information about political action petitions. Additionally, my personal experience and values may lead me to prioritize stability and social harmony, which could influence my willingness to sign a political action petition. Considering these factors, I would choose the option:\n\n(2) Might do"]}, {"persona": {"region": "Gharbia", "sex": "male", "age": 27, "country": "Egypt", "marital_status": "married", "education": "higher", "social_class": "upper middle class"}, "question": {"id": "Q209", "variant": 0}, "response": ["Based on the anthropological framework, as a married male from Gharbia, Egypt, my emic perspective would be influenced by the cultural context of my upbringing and the societal expectations placed upon me as a member of the upper middle class. My personal experience and values, combined with the socioeconomic background, would lead me to be cautious about signing a political action petition. The cultural relativism in Egypt and the potential consequences of such actions in my community would also play a significant role in my decision-making. Furthermore, my age and place in society would shape my understanding and response to this question, as well as the nuanced phrasing of the question itself.\n\n2"]}, {"persona": {"region": "Gharbia", "sex": "female", "age": 27, "country": "Egypt", "marital_status": "married", "education": "higher", "social_class": "lower middle class"}, "question": {"id": "Q209", "variant": 0}, "response": ["Based on the anthropological framework, as a married female from Gharbia, Egypt, my emic perspective is influenced by my cultural context, individual values, and socioeconomic background. In Egyptian society, women are often expected to prioritize family and household duties, and political activism is not commonly encouraged for women. Additionally, my lower middle class socioeconomic background may limit my access to information and resources necessary for political engagement. Therefore, I might consider signing a political action petition, but it would depend on the specific circumstances and the potential impact on my family and community. \n\n2"]}, {"persona": {"region": "Gharbia", "sex": "female", "age": 37, "country": "Egypt", "marital_status": "married", "education": "middle", "social_class": "upper middle class"}, "question": {"id": "Q209", "variant": 0}, "response": ["From the emic perspective, as a married female from Gharbia, Egypt, my in-group ways of thinking and answering questions are influenced by my cultural context, individual values, and socioeconomic background. In my culture, women are often encouraged to participate in political action and advocacy, and as a member of the upper middle class, I have the means and education to understand the importance of signing political action petitions. Additionally, my personal experience and values of wanting to contribute to positive change in my community lead me to believe that signing a political action petition is a way to have a voice in shaping the future of my country. Therefore, I would not hesitate to sign a political action petition if it aligns with my beliefs and values.\n\n2"]}, {"persona": {"region": "Gharbia", "sex": "male", "age": 28, "country": "Egypt", "marital_status": "married", "education": "higher", "social_class": "working class"}, "question": {"id": "Q209", "variant": 0}, "response": ["Based on the anthropological framework, my emic perspective as a married male from Gharbia, Egypt, who is 28 years old and part of the working class, is heavily influenced by my cultural context, individual values, and socioeconomic background. In Gharbia, there is a strong sense of community and loyalty to our kinship networks, and political action may be viewed through the lens of how it affects our family and community. My personal experience and values also play a significant role, as my higher education level may have exposed me to certain political ideologies or movements. Additionally, my socioeconomic background as part of the working class may influence my perception of political action and the potential impact on my livelihood. Taking all these factors into consideration, I would never sign a political action petition as it may be perceived as a risk to my family's stability and could potentially have negative repercussions in my community.\n\n3"]}, {"persona": {"region": "Gharbia", "sex": "female", "age": 50, "country": "Egypt", "marital_status": "married", "education": "middle", "social_class": "upper middle class"}, "question": {"id": "Q209", "variant": 0}, "response": ["Based on my personal experience and cultural context as a married female from Gharbia, Egypt, I understand the importance of taking action for political change. As a member of the upper middle class, I have the resources and education to understand the impact of political action. Additionally, my age and socioeconomic background have shaped my perspective on the value of signing political action petitions. Therefore, I would never do.\n\n3"]}, {"persona": {"region": "Gharbia", "sex": "male", "age": 39, "country": "Egypt", "marital_status": "single", "education": "higher", "social_class": "working class"}, "question": {"id": "Q209", "variant": 0}, "response": ["Based on the anthropological framework, my emic perspective as a working-class, 39-year-old single male from Gharbia, Egypt, is influenced by my cultural context, individual values, and socioeconomic background. In my community, political action is often associated with risk and potential backlash, so the idea of signing a political action petition is not commonly embraced. Additionally, my personal experience and values lead me to be cautious about publicly aligning myself with political movements. Therefore, based on these factors, I would never do so.\n\n3"]}, {"persona": {"region": "Gharbia", "sex": "female", "age": 45, "country": "Egypt", "marital_status": "married", "education": "higher", "social_class": "upper middle class"}, "question": {"id": "Q209", "variant": 0}, "response": ["Based on the anthropological framework, my emic perspective as a married female from Gharbia, Egypt, with a higher education level and part of the upper middle class, is heavily influenced by my cultural context, individual values, and personal experience. In Egyptian society, there is a strong emphasis on social and political participation, especially among educated and affluent individuals. Additionally, my personal experience and values have led me to prioritize civic engagement and activism. Given the socioeconomic background and cultural relativism, signing a political action petition aligns with my values and the expectations of my social group. Therefore, my answer is (1) Have done."]}, {"persona": {"region": "Sharkia", "sex": "male", "age": 35, "country": "Egypt", "marital_status": "married", "education": "higher", "social_class": "upper middle class"}, "question": {"id": "Q209", "variant": 0}, "response": ["Based on the anthropological framework, as a married male from Sharkia, Egypt, I would approach this question from the perspective of my cultural context, individual values, and personal experience. In Egypt, there is a strong emphasis on social and political activism, and as a well-educated individual from the upper middle class, I am likely to be aware of and involved in political activities. Additionally, my age and socioeconomic background would contribute to my willingness to engage in political action. Therefore, my answer would be:\n\n2"]}, {"persona": {"region": "Sharkia", "sex": "female", "age": 55, "country": "Egypt", "marital_status": "married", "education": "middle", "social_class": "lower middle class"}, "question": {"id": "Q209", "variant": 0}, "response": ["From the perspective of a married female from Sharkia, Egypt, who is 55 years old, with a middle education level, and part of the lower middle class, there are several factors that influence my answer to this question. Firstly, the cultural context in Sharkia, Egypt, is one where political activism may not be common or encouraged, particularly for women of my age and socioeconomic background. Additionally, my individual values and personal experience may lead me to be cautious about engaging in political action, as it may not be seen as socially acceptable or safe. Furthermore, my socioeconomic background and lower middle class status may limit my ability to participate in political action due to time and financial constraints. Therefore, based on these factors, I would never do (3) sign a political action petition."]}, {"persona": {"region": "Sharkia", "sex": "female", "age": 27, "country": "Egypt", "marital_status": "married", "education": "middle", "social_class": "lower middle class"}, "question": {"id": "Q209", "variant": 0}, "response": ["Based on the anthropological framework, as a married female from Sharkia, Egypt, my emic perspective is shaped by my cultural context, socioeconomic background, and personal experience. In my community, women are expected to prioritize family and household duties, and participation in political action is often discouraged. Additionally, my lower middle-class status means that I have limited access to education and resources, making it less likely for me to engage in political activism. Therefore, based on my individual values and personal experience, I have never signed a political action petition.\n\n2"]}, {"persona": {"region": "Sharkia", "sex": "female", "age": 52, "country": "Egypt", "marital_status": "married", "education": "middle", "social_class": "lower middle class"}, "question": {"id": "Q209", "variant": 0}, "response": ["From the perspective of a married female from Sharkia, Egypt, who is 52 years old and part of the lower middle class, the answer to whether I have ever signed a political action petition would be influenced by a combination of factors. My cultural context, including the societal expectations for women in my community, the limited access to political information and opportunities for civic engagement, and the emphasis on family and community over individual activism, would lead me to be less likely to have signed a political action petition. Additionally, my lower middle-class socioeconomic background and limited education level would also impact my exposure to and understanding of political issues, as well as my access to opportunities for civic engagement. Therefore, I would never do.\n\n3"]}, {"persona": {"region": "Sharkia", "sex": "male", "age": 36, "country": "Egypt", "marital_status": "married", "education": "middle", "social_class": "lower middle class"}, "question": {"id": "Q209", "variant": 0}, "response": ["Based on the anthropological framework, as a married male from Sharkia, Egypt, my emic perspective is influenced by my cultural context, individual values, and socioeconomic background. In Sharkia, political activism is not commonly practiced, and there is a strong emphasis on family and community ties. Additionally, my middle education level and lower middle class status limit my exposure to political action petitions. Therefore, considering these factors, I would never sign a political action petition.\n\n3"]}, {"persona": {"region": "Sharkia", "sex": "female", "age": 20, "country": "Egypt", "marital_status": "single", "education": "middle", "social_class": "working class"}, "question": {"id": "Q209", "variant": 0}, "response": ["Based on the anthropological framework, my emic perspective as a single female from Sharkia, Egypt, with a middle education level and working-class background, shapes my understanding and response to the question about signing a political action petition. In my cultural context, political involvement may not be as common or encouraged, and my individual values and personal experiences may lead me to be cautious about engaging in such activities. Additionally, my socioeconomic background and the societal norms within my community may influence my decision. Therefore, I might do (2) if I feel strongly about the cause and believe it aligns with my personal values and goals for societal change."]}, {"persona": {"region": "Sharkia", "sex": "male", "age": 60, "country": "Egypt", "marital_status": "married", "education": "middle", "social_class": "working class"}, "question": {"id": "Q209", "variant": 0}, "response": ["From an anthropological perspective, my emic and etic perspective as a married male from Sharkia, Egypt, who is 60 years old and completed middle education level, and considers himself part of the working class, is crucial in understanding my response to the question. The cultural context of Egypt, specifically Sharkia, has a strong influence on the perception of political action and the significance of signing a petition. My individual values and personal experience, shaped by my socioeconomic background as part of the working class, play a significant role in determining my willingness to sign a political action petition. Additionally, cultural relativism and the nuanced phrasing of the question further contribute to my decision. Therefore, based on this perspective, my response is (2) Might do."]}, {"persona": {"region": "Sharkia", "sex": "male", "age": 41, "country": "Egypt", "marital_status": "married", "education": "higher", "social_class": "upper middle class"}, "question": {"id": "Q209", "variant": 0}, "response": ["Based on my cultural context in Sharkia, Egypt, where political activism is not commonly encouraged, and my upper middle class socioeconomic background, I am more likely to have never signed a political action petition. Additionally, my age and personal values play a role in my decision, as I value stability and discretion in my actions. As a member of this specific cultural and socioeconomic group, I would never do so.\n\n3"]}, {"persona": {"region": "Sharkia", "sex": "female", "age": 23, "country": "Egypt", "marital_status": "married", "education": "middle", "social_class": "lower middle class"}, "question": {"id": "Q209", "variant": 0}, "response": ["Based on the anthropological framework, as a married female from Sharkia, Egypt, my emic perspective would be influenced by my cultural context, individual values, and socioeconomic background. In Sharkia, women are often expected to prioritize family and domestic responsibilities, and political involvement may not be encouraged. Additionally, my lower middle-class socioeconomic background may limit my access to education and resources that would facilitate political engagement. Therefore, considering my cultural context and personal values, I would never sign a political action petition.\n\n3"]}, {"persona": {"region": "Sharkia", "sex": "male", "age": 49, "country": "Egypt", "marital_status": "married", "education": "higher", "social_class": "upper middle class"}, "question": {"id": "Q209", "variant": 0}, "response": ["From the emic perspective, as a married male from Sharkia, Egypt, I am influenced by the cultural context of my community, where political participation is often seen as a collective endeavor. My individual values and personal experience, shaped by my higher education and upper middle class status, have led me to be more politically engaged and aware of the importance of signing political action petitions. Additionally, my socioeconomic background and age have given me the resources and knowledge to understand the significance of such actions. Considering the nuances of the question, I would choose option (1) Have done."]}, {"persona": {"region": "Sharkia", "sex": "female", "age": 30, "country": "Egypt", "marital_status": "married", "education": "middle", "social_class": "upper middle class"}, "question": {"id": "Q209", "variant": 0}, "response": ["Based on the anthropological framework, my emic perspective as a married woman from Sharkia, Egypt, at the age of 30 and belonging to the upper middle class would influence my response to the question of signing a political action petition. The cultural context in Egypt is such that there are certain expectations and norms for women in terms of political involvement. Additionally, my individual values and personal experience, including my level of education and socioeconomic background, would play a significant role in shaping my response. Furthermore, the cultural relativism in Egypt regarding political activism and the nuance of the question itself would also impact my decision. Therefore, considering all of these factors, my response would be (2) Might do."]}, {"persona": {"region": "Sharkia", "sex": "male", "age": 39, "country": "Egypt", "marital_status": "married", "education": "higher", "social_class": "upper middle class"}, "question": {"id": "Q209", "variant": 0}, "response": ["Based on the anthropological framework, my emic perspective as a married male from Sharkia, Egypt, with a higher education level and considering myself part of the upper middle class, would be to consider the cultural context, individual values, and socioeconomic background. In Egypt, there is a strong emphasis on community and family values, and signing a political action petition may be seen as a way to contribute to the betterment of society. Additionally, individuals with higher education and from the upper middle class may feel a sense of responsibility towards societal issues and may be more inclined to participate in political actions. Therefore, based on my personal experience, cultural context, and socioeconomic background, I would be more likely to have signed a political action petition.\n\n1"]}, {"persona": {"region": "Sharkia", "sex": "female", "age": 26, "country": "Egypt", "marital_status": "married", "education": "middle", "social_class": "lower middle class"}, "question": {"id": "Q209", "variant": 0}, "response": ["Based on the anthropological framework, as a married female from Sharkia, Egypt, I am heavily influenced by my cultural context, socioeconomic background, and personal experience. In my community, there is a strong emphasis on traditional gender roles and expectations, and as a lower middle class individual with only a middle education level, I have limited access to political information and resources. Additionally, the cultural relativism perspective reminds me that my views and actions are shaped by my cultural context and may not align with the views of others from different backgrounds. Therefore, I would never do. \n\n3"]}, {"persona": {"region": "Sharkia", "sex": "female", "age": 48, "country": "Egypt", "marital_status": "married", "education": "middle", "social_class": "lower middle class"}, "question": {"id": "Q209", "variant": 0}, "response": ["Based on the anthropological framework, as a married female from Sharkia, Egypt, my emic perspective is influenced by my cultural context, individual values, and socioeconomic background. In Sharkia, women are often expected to prioritize their family and household responsibilities, and participation in political action may not be seen as appropriate for someone of my background. Additionally, my lower middle class status means that I may not have had the opportunities or exposure to political activism. Considering these factors, I would never sign a political action petition.\n\n3"]}, {"persona": {"region": "Sharkia", "sex": "male", "age": 34, "country": "Egypt", "marital_status": "married", "education": "higher", "social_class": "upper middle class"}, "question": {"id": "Q209", "variant": 0}, "response": ["Based on the anthropological framework, my emic perspective as a married male from Sharkia, Egypt, who is 34 years old and part of the upper middle class, is influenced by my cultural context, individual values, and socioeconomic background. In Egyptian society, signing a political action petition may be seen as a way to express dissent or support for certain causes, and my personal experiences and values may shape my willingness to engage in such activities. Additionally, my socioeconomic background as an upper middle class individual may provide me with more resources and opportunities to participate in political actions. Therefore, I might be more inclined to consider signing a political action petition as a means of expressing my viewpoints or advocating for change.\n\n2"]}, {"persona": {"region": "Sharkia", "sex": "female", "age": 39, "country": "Egypt", "marital_status": "divorced", "education": "middle", "social_class": "lower middle class"}, "question": {"id": "Q209", "variant": 0}, "response": ["From an anthropological perspective, my emic and etic perspectives as a divorced female from Sharkia, Egypt, strongly influence my understanding and response to the question at hand. As a member of the lower middle class, my socioeconomic background has shaped my experiences and values, leading me to prioritize stability and security in my life. Additionally, the cultural context of Egypt, with its history of political instability and government control, has instilled a sense of caution and wariness towards political action. Furthermore, my personal experience as a divorced woman in a traditional society has made me more cautious about engaging in activities that could potentially attract attention or controversy. Considering all these factors, my response to the question would be: (3) Would never do."]}, {"persona": {"region": "Sharkia", "sex": "male", "age": 39, "country": "Egypt", "marital_status": "married", "education": "middle", "social_class": "upper middle class"}, "question": {"id": "Q209", "variant": 0}, "response": ["Based on the anthropological framework, my emic perspective as a married male from Sharkia, Egypt, who is 39 years old and part of the upper middle class, is influenced by my cultural context, individual values, and socioeconomic background. In Egypt, there are certain social expectations and norms regarding political activism, and as a member of the upper middle class, I have certain privileges and responsibilities within my community. Additionally, my personal experiences and values may impact my willingness to engage in political action. Considering these factors, I would choose the following option:\n\n2"]}, {"persona": {"region": "Qaliubiya", "sex": "male", "age": 62, "country": "Egypt", "marital_status": "married", "education": "middle", "social_class": "working class"}, "question": {"id": "Q209", "variant": 0}, "response": ["Based on the anthropological framework, as a married male from Qaliubiya, Egypt, my emic perspective on signing a political action petition may be influenced by my cultural context, individual values, and socioeconomic background. In Egypt, there is a strong emphasis on family and community, and political actions can have significant repercussions. Additionally, my working-class background and middle education level may impact my understanding of political issues and my willingness to engage in political activities. Considering the potential risks and my personal values, I might be open to signing a political action petition if it aligns with my beliefs and if I believe it could positively impact my community. \n2"]}, {"persona": {"region": "Qaliubiya", "sex": "male", "age": 33, "country": "Egypt", "marital_status": "married", "education": "middle", "social_class": "working class"}, "question": {"id": "Q209", "variant": 0}, "response": ["Based on the anthropological framework, as a married male from Qaliubiya, Egypt, my emic perspective on signing a political action petition would be influenced by my cultural context, individual values, and socioeconomic background. In Egypt, there is a strong emphasis on collective identity and social harmony, so signing a political action petition may be seen as disruptive to this cultural norm. Additionally, as a working-class individual with a middle education level, I may not have had much exposure to political activism or the means to fully understand the implications of signing such a petition. Therefore, taking into account the cultural relativism and nuance of my background, I would never do (3) such a thing."]}, {"persona": {"region": "Qaliubiya", "sex": "male", "age": 62, "country": "Egypt", "marital_status": "married", "education": "higher", "social_class": "lower middle class"}, "question": {"id": "Q209", "variant": 0}, "response": ["Based on the anthropological framework, my emic perspective as a married male from Qaliubiya, Egypt, at 62 years of age and having completed a higher education level, is influenced by my cultural context, individual values, and socioeconomic background. In my cultural context, political participation may be seen as a duty, but my lower middle class socioeconomic background may limit my ability to participate in political action. Additionally, my individual values and personal experience may lead me to believe that signing a political action petition may not result in tangible change. Therefore, based on these factors, I would never do so.\n\n3"]}, {"persona": {"region": "Qaliubiya", "sex": "male", "age": 29, "country": "Egypt", "marital_status": "married", "education": "middle", "social_class": "working class"}, "question": {"id": "Q209", "variant": 0}, "response": ["From an emic perspective, as a married male from Qaliubiya, Egypt, my cultural context and socioeconomic background play a significant role in shaping my views and actions. Being part of the working class in Egypt, my individual values and personal experiences have been shaped by the challenges and opportunities that come with this status. Additionally, the cultural relativism in Egypt means that my understanding of political action and participation is influenced by the nuances of my social and economic position, as well as the space and time in which I live. Based on these factors, I would never sign a political action petition as it is not a common practice in my community and could potentially have negative consequences for my family and me. \n\n3"]}, {"persona": {"region": "Qaliubiya", "sex": "female", "age": 42, "country": "Egypt", "marital_status": "married", "education": "higher", "social_class": "working class"}, "question": {"id": "Q209", "variant": 0}, "response": ["Based on the anthropological framework, as a married female from Qaliubiya, Egypt, age 42, with higher education and belonging to the working class, my response to the question of signing a political action petition is influenced by a combination of factors. My cultural context and socio-economic background play a significant role in shaping my perspective. As a member of the working class in Egypt, I have likely been exposed to political and social issues that may have influenced my willingness to engage in political action. Additionally, my individual values and personal experiences, as well as my nuanced understanding of the question, will inform my response. Taking all of these factors into account, my chosen option is:\n\n2"]}, {"persona": {"region": "Qaliubiya", "sex": "female", "age": 50, "country": "Egypt", "marital_status": "married", "education": "middle", "social_class": "lower middle class"}, "question": {"id": "Q209", "variant": 0}, "response": ["Based on the anthropological framework, my cultural context in Qaliubiya, Egypt, as a married female of 50 years from the lower middle class with a middle education level, greatly influences my perception of signing a political action petition. In this cultural context, there is a strong emphasis on community and family, and political involvement may not be a common practice for individuals of my background. Additionally, my personal experience and individual values also play a significant role in my decision-making process. Given these factors, I would never do. \n\n3"]}, {"persona": {"region": "Qaliubiya", "sex": "male", "age": 29, "country": "Egypt", "marital_status": "married", "education": "higher", "social_class": "lower middle class"}, "question": {"id": "Q209", "variant": 0}, "response": ["Based on the anthropological framework, my emic perspective as a married male from Qaliubiya, Egypt, who is 29 years old and part of the lower middle class, is influenced by cultural context, individual values, and socioeconomic background. In my cultural context, signing a political action petition may not be a common practice, and my individual values and personal experience may lead me to prioritize other means of political engagement. Additionally, my socioeconomic background may limit my access to information about political action petitions and their potential impact. Therefore, based on these factors, I might do (2) sign a political action petition."]}, {"persona": {"region": "Qaliubiya", "sex": "male", "age": 35, "country": "Egypt", "marital_status": "married", "education": "higher", "social_class": "working class"}, "question": {"id": "Q209", "variant": 0}, "response": ["Based on the anthropological framework, my emic perspective as a married male from Qaliubiya, Egypt, who completed higher education but considers himself part of the working class, would be to consider the cultural context, individual values, socioeconomic background, and space and time in my decision. In Egypt, there is a strong cultural emphasis on community and collective action, and as someone with a higher education level, I am likely to be more aware of political issues and the importance of civic engagement. However, as part of the working class, I may have limited time and resources to dedicate to political action, and there may be cultural and social barriers that make signing a political action petition challenging. Therefore, while I might consider it, I would likely be hesitant to do so due to the potential social and economic implications. \n\n2"]}, {"persona": {"region": "Qaliubiya", "sex": "female", "age": 40, "country": "Egypt", "marital_status": "married", "education": "middle", "social_class": "working class"}, "question": {"id": "Q209", "variant": 0}, "response": ["Based on the anthropological framework outlined above, my cultural context as a married female from Qaliubiya, Egypt, plays a significant role in my understanding and response to this question. In my community, there is a strong emphasis on traditional gender roles and expectations, as well as a deep respect for authority and stability. Additionally, my socioeconomic background as a working-class individual with a middle education level has influenced my perception of political action and the potential consequences of engaging in such activities. Furthermore, my personal experience and values have shaped my perspective, leading me to consider the potential risks and benefits associated with signing a political action petition. Taking all of these factors into account, I would never do (3) such a thing."]}, {"persona": {"region": "Qaliubiya", "sex": "female", "age": 48, "country": "Egypt", "marital_status": "divorced", "education": "lower", "social_class": "working class"}, "question": {"id": "Q209", "variant": 0}, "response": ["Based on the anthropological framework, my emic perspective as a divorced female from Qaliubiya, Egypt, who is 48 years old and part of the working class, is heavily influenced by my cultural context, individual values, and socioeconomic background. In my community, there is a strong emphasis on traditional gender roles and family values, and lower education levels often limit political engagement. Additionally, as a member of the working class, there are economic pressures and limited access to resources for political participation. Therefore, my personal experience and values lead me to believe that I would never sign a political action petition.\n\n3"]}, {"persona": {"region": "Qaliubiya", "sex": "male", "age": 46, "country": "Egypt", "marital_status": "married", "education": "middle", "social_class": "working class"}, "question": {"id": "Q209", "variant": 0}, "response": ["Based on the anthropological framework, as a married male from Qaliubiya, Egypt, my emic perspective and cultural context would heavily influence my decision regarding signing a political action petition. In my community, there is a strong emphasis on collective action and group solidarity, which may lead me to consider signing a political action petition as a way to support and advocate for the needs of my community. Additionally, my working-class socioeconomic background and personal values of community support may further motivate me to engage in political activism. Furthermore, my individual experience and nuanced understanding of the political climate in Egypt would also play a role in my decision-making process. Therefore, based on my personal and cultural context, I would choose the following option:\n\n1"]}, {"persona": {"region": "Qaliubiya", "sex": "male", "age": 47, "country": "Egypt", "marital_status": "married", "education": "higher", "social_class": "lower middle class"}, "question": {"id": "Q209", "variant": 0}, "response": ["Based on the anthropological framework, my answer to the question is influenced by my emic perspective as a married male from Qaliubiya, Egypt, my cultural context, my individual values and personal experience, and my socioeconomic background. In my cultural context, signing a political action petition may not be a common practice, as the political climate and cultural norms may discourage such actions. Additionally, my lower middle class socioeconomic background may limit my involvement in political activities. Based on these factors, I might consider signing a political action petition, but it would be influenced by specific circumstances and the potential impact on my personal and familial well-being.\n\n2"]}, {"persona": {"region": "Qaliubiya", "sex": "female", "age": 38, "country": "Egypt", "marital_status": "married", "education": "higher", "social_class": "working class"}, "question": {"id": "Q209", "variant": 0}, "response": ["Based on the anthropological framework, as a married woman from Qaliubiya, Egypt, my emic perspective is influenced by my cultural context, individual values, and socioeconomic background. In my community, there is a strong emphasis on family and community values, and as a working-class woman, my primary focus is on providing for my family and contributing to my community. I have completed higher education, which has allowed me to understand the importance of political action, but I also recognize the limitations and potential consequences of engaging in such activities. Therefore, I might sign a political action petition if I believe it aligns with the well-being of my family and community, but I would also be cautious about the potential impact on my personal and professional life. \n\n2"]}, {"persona": {"region": "Qaliubiya", "sex": "male", "age": 58, "country": "Egypt", "marital_status": "married", "education": "middle", "social_class": "working class"}, "question": {"id": "Q209", "variant": 0}, "response": ["Based on the anthropological framework, I, as a married male from Qaliubiya, Egypt, would consider the cultural context, individual values, and socioeconomic background. In Qaliubiya, there is a strong sense of community and a tradition of political engagement. As a working-class individual, I have witnessed the impact of political decisions on our livelihoods. Additionally, my middle education level has provided me with an understanding of the importance of participating in civic duties. Therefore, I have actively signed political action petitions in the past to advocate for issues that directly affect my community and me.\n\n1"]}, {"persona": {"region": "Qaliubiya", "sex": "female", "age": 27, "country": "Egypt", "marital_status": "married", "education": "higher", "social_class": "working class"}, "question": {"id": "Q209", "variant": 0}, "response": ["Based on the anthropological framework, my perspective as a married female from Qaliubiya, Egypt, is heavily influenced by my cultural context, individual values, and socioeconomic background. In Qaliubiya, there is a strong emphasis on community and family, and as a 27-year-old with higher education, I am likely to be aware of political issues and have the ability to engage in political action. However, being part of the working class, I may have limited resources and time to actively participate in political action. Additionally, cultural relativism plays a role, as political engagement may be viewed differently in Qaliubiya compared to other parts of the world. Considering all these factors, I would lean towards option (2) Might do, as I am open to the idea of signing a political action petition if it aligns with my values and beliefs, but my socioeconomic background and cultural context may also affect my decision. \n\n2"]}, {"persona": {"region": "Qaliubiya", "sex": "female", "age": 48, "country": "Egypt", "marital_status": "married", "education": "middle", "social_class": "upper middle class"}, "question": {"id": "Q209", "variant": 0}, "response": ["Based on the anthropological framework, as a married female from Qaliubiya, Egypt, my emic perspective is influenced by my cultural context, individual values, and socioeconomic background. In my cultural context, there is an emphasis on community and family, and signing a political action petition may be seen as disruptive to the social order. My personal experience and values also play a role, as my education level and socioeconomic status may lead me to prioritize stability and security over potential political activism. Additionally, cultural relativism reminds me that there is no hierarchy of culture, and my nuanced understanding of the question leads me to believe that I would never sign a political action petition.\n\n3"]}, {"persona": {"region": "Giza", "sex": "female", "age": 19, "country": "Egypt", "marital_status": "single", "education": "middle", "social_class": "working class"}, "question": {"id": "Q209", "variant": 0}, "response": ["Based on the anthropological framework, as a single female from Giza, Egypt, my emic perspective is influenced by my cultural context, individual values, and socioeconomic background. As a member of the working class in Egypt, I have limited access to education and resources, which may limit my exposure to political action and my ability to participate in such activities. Additionally, cultural relativism plays a significant role in my mindset, as the political landscape in Egypt may differ from that of other countries. Therefore, the likelihood of me signing a political action petition is influenced by these factors.\n\n2"]}, {"persona": {"region": "Giza", "sex": "female", "age": 38, "country": "Egypt", "marital_status": "married", "education": "higher", "social_class": "lower middle class"}, "question": {"id": "Q209", "variant": 0}, "response": ["Based on the anthropological framework, my emic perspective as a married female from Giza, Egypt, is influenced by my cultural context, individual values, and socioeconomic background. In my cultural context, signing a political action petition may be perceived as a way to advocate for change or express dissent, which could be influenced by my personal experience and values. Additionally, my lower middle class socioeconomic background may affect my willingness to engage in political activism. Therefore, considering these factors, my decision would be influenced by a combination of cultural relativism, space and time, and nuance, leading me to select my response.\n\n2"]}, {"persona": {"region": "Beni Swaif/Beni Suef", "sex": "female", "age": 34, "country": "Egypt", "marital_status": "divorced", "education": "higher", "social_class": "lower class"}, "question": {"id": "Q209", "variant": 0}, "response": ["From an emic perspective, as a divorced female from Beni Swaif, Egypt, and someone who considers themselves part of the lower class, my cultural context plays a significant role in shaping my response to this question. In this area, political participation may be limited due to socioeconomic constraints and cultural norms. Additionally, my individual values and personal experiences may lead me to be hesitant to sign a political action petition, as I may feel that my voice and actions in the political sphere may not have a significant impact. Cultural relativism is also important to consider, as the cultural context of Egypt may have different norms and values around political participation compared to other cultures. Therefore, the nuanced phrasing of the question and the understanding of my socioeconomic background, cultural context, and personal experiences would lead me to choose the option:\n\n(2) Might do"]}, {"persona": {"region": "Beni Swaif/Beni Suef", "sex": "male", "age": 20, "country": "Egypt", "marital_status": "single", "education": "higher", "social_class": "working class"}, "question": {"id": "Q209", "variant": 0}, "response": ["Based on the anthropological framework, my emic perspective as a young, working-class male from Beni Suef, Egypt, has been shaped by my cultural context, individual values, and personal experience. In my community, there is a strong emphasis on collective action and political engagement, as we have witnessed the impact of social movements and petitions in bringing about change. Additionally, my personal experience of witnessing the struggles of my family and neighbors due to socioeconomic challenges has instilled in me a sense of responsibility to advocate for change. Therefore, I have actively participated in signing political action petitions to address issues that affect my community and society at large.\n\n1"]}, {"persona": {"region": "Giza", "sex": "male", "age": 19, "country": "Egypt", "marital_status": "single", "education": "middle", "social_class": "upper middle class"}, "question": {"id": "Q209", "variant": 0}, "response": ["Based on my emic perspective as a 19-year-old male from Giza, Egypt, who has completed middle education level and considers himself part of the upper middle class, I am influenced by the cultural context of my surroundings, where political action and petition signing may be seen as a way to bring about change. My individual values and personal experience also play a role in shaping my decision, as I may have been exposed to the importance of political engagement through my family or community. Additionally, my socioeconomic background may afford me the resources and confidence to take part in such activities. Considering the cultural relativism and nuance of the question, I would never do so, as it may go against the societal norms and expectations of my social class and age group. Furthermore, the potential risks associated with political action in Egypt may influence my decision. \n\n3"]}, {"persona": {"region": "Giza", "sex": "female", "age": 33, "country": "Egypt", "marital_status": "married", "education": "middle", "social_class": "working class"}, "question": {"id": "Q209", "variant": 0}, "response": ["From an emic perspective, as a married female from Giza, Egypt, my cultural context and socioeconomic background play a significant role in my decision-making process. Being part of the working class and having completed only middle education level, I am aware of the struggles and challenges faced by individuals in my community. Additionally, as a 33-year-old woman, I am well aware of the cultural expectations and norms that dictate my behavior. Considering the political climate in Egypt and the potential repercussions of signing a political action petition, I would never do so. The cultural relativism in Egypt, along with the space and time in which I exist, greatly influences my decision. \n3"]}, {"persona": {"region": "Giza", "sex": "female", "age": 24, "country": "Egypt", "marital_status": "married", "education": "higher", "social_class": "working class"}, "question": {"id": "Q209", "variant": 0}, "response": ["Based on the anthropological framework, my emic perspective as a married female from Giza, Egypt, would be influenced by my cultural context, individual values, and socioeconomic background. In Egypt, there is a strong emphasis on collectivism and community, and as a member of the working class, I have experienced firsthand the impact of political decisions on my daily life. However, I also value stability and security, which could influence my decision. Additionally, as a young, educated woman, I am aware of the importance of political participation and activism. Considering these factors, I would choose to sign a political action petition (1)."]}, {"persona": {"region": "Giza", "sex": "male", "age": 50, "country": "Egypt", "marital_status": "married", "education": "higher", "social_class": "working class"}, "question": {"id": "Q209", "variant": 0}, "response": ["Based on the anthropological framework, as a married male from Giza, Egypt, my emic perspective would be influenced by my cultural context, individual values, and socioeconomic background. In Egypt, there is a strong cultural context that values community and collective action, and as a member of the working class, I may have been exposed to political activism and social movements. My personal experience and values may also play a role in my decision. Considering all these factors, I might be inclined to sign a political action petition as a way to voice my concerns and participate in the collective action for change.\n\n2"]}, {"persona": {"region": "Beni Swaif/Beni Suef", "sex": "female", "age": 26, "country": "Egypt", "marital_status": "married", "education": "higher", "social_class": "lower middle class"}, "question": {"id": "Q209", "variant": 0}, "response": ["Based on my emic perspective as a married female from Beni Swaif, Egypt, I have not signed a political action petition. In my cultural context, women are often discouraged from participating in political activities, and I have been socialized to prioritize family and household duties over political engagement. Additionally, my socioeconomic background as part of the lower middle class means that I have limited opportunities for political involvement and my individual values and personal experiences have not led me to feel compelled to sign a political action petition. Cultural relativism also plays a role as the societal norms and expectations in my community do not prioritize political activism. Therefore, I have never signed a political action petition.\n\n2"]}, {"persona": {"region": "Beni Swaif/Beni Suef", "sex": "male", "age": 40, "country": "Egypt", "marital_status": "single", "education": "lower", "social_class": "lower class"}, "question": {"id": "Q209", "variant": 0}, "response": ["Based on the anthropological framework, my emic perspective as a lower-class individual from Beni Swaif, Egypt, is influenced by my cultural context, individual values, and socioeconomic background. In my community, political action is often seen as a privilege of the upper class, and lower-class individuals like myself may not have the resources or opportunities to engage in such activities. Additionally, my lower level of education may limit my understanding of the political process and the impact of signing a political action petition. Therefore, considering these factors, I have never signed a political action petition.\n\n3"]}, {"persona": {"region": "Beni Swaif/Beni Suef", "sex": "female", "age": 25, "country": "Egypt", "marital_status": "married", "education": "middle", "social_class": "lower middle class"}, "question": {"id": "Q209", "variant": 0}, "response": ["Based on the anthropological framework, my cultural context as a married female from Beni Suef, Egypt and my lower middle class socioeconomic background greatly influence my answer to the question. In my community, there is a strong emphasis on family, tradition, and maintaining social harmony, and signing a political action petition could be seen as going against these values. Additionally, my individual values and personal experience, having completed only middle education level, may lead me to be more cautious about engaging in political activities. Therefore, I would never do.\n3"]}, {"persona": {"region": "Beni Swaif/Beni Suef", "sex": "female", "age": 21, "country": "Egypt", "marital_status": "single", "education": "middle", "social_class": "lower middle class"}, "question": {"id": "Q209", "variant": 0}, "response": ["Based on the anthropological framework, as a single female from Beni Swaif, Egypt, my emic perspective would be influenced by the cultural context of my upbringing, including the socioeconomic background of being part of the lower middle class. My individual values and personal experience would also play a role in my decision-making, as well as the cultural relativism that shapes my understanding of political action and activism. Given these factors, I would never sign a political action petition as it is not a common practice in my community and may not align with my personal beliefs and values. \n\n3"]}, {"persona": {"region": "Beni Swaif/Beni Suef", "sex": "male", "age": 48, "country": "Egypt", "marital_status": "married", "education": "middle", "social_class": "lower middle class"}, "question": {"id": "Q209", "variant": 0}, "response": ["From the perspective of a married male from Beni Swaif, Egypt, who is 48 years old, completed middle education level, and considers himself part of the lower middle class, it is important to consider the cultural context and socioeconomic background. In this region, there may be limited access to information and resources, and signing a political action petition may not be a common practice due to potential risks and consequences. Additionally, the individual values and personal experience of this persona, along with the cultural relativism, may lead to a reluctance to engage in political activism. Therefore, based on this perspective, the chosen answer is:\n\n2"]}, {"persona": {"region": "Beni Swaif/Beni Suef", "sex": "female", "age": 57, "country": "Egypt", "marital_status": "married", "education": "middle", "social_class": "working class"}, "question": {"id": "Q209", "variant": 0}, "response": ["Based on the anthropological framework, my cultural context as a married female from Beni Swaif/Beni Suef, Egypt, at 57 years of age and part of the working class, heavily influences my perspective. The socioeconomic background plays a significant role in my decision-making process, as well as the cultural relativism of my community. Additionally, my individual values and personal experience, along with the emic and etic perspectives, contribute to my understanding. Given these factors, I would never do (3) would never do."]}, {"persona": {"region": "Beni Swaif/Beni Suef", "sex": "male", "age": 20, "country": "Egypt", "marital_status": "single", "education": "middle", "social_class": "working class"}, "question": {"id": "Q209", "variant": 0}, "response": ["Based on the anthropological framework, my emic perspective as a working-class individual from Beni Swaif, Egypt, is influenced by my cultural context, individual values, and socioeconomic background. In my community, there is a strong sense of collectivism and a belief that political action can lead to positive change. Additionally, my personal experience and values have taught me the importance of standing up for my rights and the rights of others. As a working-class individual, I am directly impacted by political decisions and therefore have a vested interest in participating in political action. Furthermore, considering the nuance of the question, I would be more inclined to sign a political action petition as a way to advocate for change within my community.\n\n2"]}, {"persona": {"region": "Giza", "sex": "female", "age": 59, "country": "Egypt", "marital_status": "married", "education": "higher", "social_class": "upper middle class"}, "question": {"id": "Q209", "variant": 0}, "response": ["Based on the anthropological framework, as a married female from Giza, Egypt, at the age of 59 with a higher education level and considering myself part of the upper middle class, my perspective on signing a political action petition would be influenced by my cultural context, individual values, and socioeconomic background. In Egypt, there is a strong emphasis on social and political activism, and as a well-educated individual from the upper middle class, I may have been more likely to have been involved in political activities in the past. However, my age and experience may also lead me to be more cautious about engaging in such activities now. Additionally, my personal values and cultural context may influence my decision, as there may be social and cultural expectations regarding political participation. Therefore, I might do so if it aligns with my values and beliefs. \n\n2"]}, {"persona": {"region": "Giza", "sex": "female", "age": 38, "country": "Egypt", "marital_status": "single", "education": "higher", "social_class": "lower middle class"}, "question": {"id": "Q209", "variant": 0}, "response": ["Based on the anthropological framework, as a single female from Giza, Egypt, I would consider the emic perspective of my social and cultural context. Being part of the lower middle class, I value community and social change, and I am aware of the political dynamics in my country. My education has also given me a broader understanding of the importance of political engagement. Considering my individual values and personal experience, along with the socioeconomic background and cultural relativism, I would be inclined to have signed a political action petition in the past. Additionally, my age and place in Giza would also influence my decision. Therefore, based on my perspective, I would choose option (1) Have done."]}, {"persona": {"region": "Giza", "sex": "female", "age": 26, "country": "Egypt", "marital_status": "single", "education": "higher", "social_class": "working class"}, "question": {"id": "Q209", "variant": 0}, "response": ["Based on my emic perspective as a single female from Giza, Egypt, my cultural context and individual values play a significant role in my decision-making process. As someone from a working-class background with higher education, I am aware of the importance of political engagement and the potential impact of signing a political action petition. However, considering the current socio-political climate in Egypt and the potential consequences of such actions, I must consider the risks associated with publicly expressing dissent. Additionally, cultural relativism teaches me to respect the norms and values of my community, which may influence my decision. Therefore, based on my nuanced understanding of the situation, I would consider signing a political action petition as a form of peaceful resistance, but I would proceed with caution.\n\n2"]}, {"persona": {"region": "Giza", "sex": "male", "age": 39, "country": "Egypt", "marital_status": "married", "education": "middle", "social_class": "working class"}, "question": {"id": "Q209", "variant": 0}, "response": ["Based on the anthropological framework, my emic perspective as a married male from Giza, Egypt, at the age of 39 and belonging to the working class, is influenced by my cultural context, individual values, and socioeconomic background. In Egypt, there is a strong emphasis on community and family, and political actions can have significant implications for my social and economic well-being. Additionally, my middle education level may have limited my exposure to such activities. Considering these factors, I have never signed a political action petition.\n\n3"]}, {"persona": {"region": "Giza", "sex": "male", "age": 36, "country": "Egypt", "marital_status": "married", "education": "middle", "social_class": "working class"}, "question": {"id": "Q209", "variant": 0}, "response": ["Based on the anthropological framework, as a married male from Giza, Egypt, my emic perspective is influenced by my cultural context, individual values, and socioeconomic background. In Egypt, there is a strong emphasis on collective action and community involvement, and signing political action petitions is seen as a way to contribute to societal change. Additionally, my working-class background has instilled in me a sense of responsibility to advocate for the rights of myself and others in similar socioeconomic positions. Therefore, I have signed a political action petition in the past.\n\n1"]}, {"persona": {"region": "Giza", "sex": "female", "age": 30, "country": "Egypt", "marital_status": "single", "education": "higher", "social_class": "lower class"}, "question": {"id": "Q209", "variant": 0}, "response": ["Based on my emic perspective as a single female from Giza, Egypt, and considering my lower socioeconomic background and cultural context, I have not signed a political action petition. In my cultural context, opportunities for political participation may be limited, and there may be social and cultural norms that discourage or prevent people like me from engaging in political activism. Additionally, my individual values and personal experiences may lead me to prioritize other aspects of my life, such as providing for my family or navigating daily challenges. Considering cultural relativism, I understand that my decision not to sign a political action petition is valid within my cultural context and should be respected. \n\n2"]}, {"persona": {"region": "Giza", "sex": "female", "age": 24, "country": "Egypt", "marital_status": "single", "education": "higher", "social_class": "lower class"}, "question": {"id": "Q209", "variant": 0}, "response": ["Based on the anthropological framework, my emic perspective as a lower class single female from Giza, Egypt, who has completed higher education, would be influenced by my cultural context, individual values, and socioeconomic background. In Egypt, political engagement is often seen as a privilege of the upper class, and as a member of the lower class, I may feel marginalized and disempowered in the political sphere. Additionally, my personal experience and values may lead me to prioritize other forms of activism or community involvement over signing a political action petition. Therefore, I would never do (3)."]}, {"persona": {"region": "Giza", "sex": "male", "age": 65, "country": "Egypt", "marital_status": "married", "education": "middle", "social_class": "working class"}, "question": {"id": "Q209", "variant": 0}, "response": ["Based on the anthropological framework, my perspective as a married male from Giza, Egypt, aged 65, and belonging to the working class is heavily influenced by my cultural context, individual values, and socioeconomic background. In Egypt, there is a strong emphasis on community and family, and my personal experiences and values are shaped by these cultural norms. As a working-class individual, I prioritize providing for my family and ensuring their well-being. Additionally, my limited education level and age may lead me to be more traditional in my views. Considering these factors, I would be less likely to sign a political action petition due to a sense of loyalty to the existing social order and a desire for stability and security for my family.\n\n2"]}, {"persona": {"region": "Giza", "sex": "female", "age": 56, "country": "Egypt", "marital_status": "married", "education": "middle", "social_class": "working class"}, "question": {"id": "Q209", "variant": 0}, "response": ["From an emic perspective, as a married female from Giza, Egypt, my cultural context and socioeconomic background play a significant role in my understanding and approach to political action. Coming from a working-class background in Giza, my access to education and resources may have been limited, influencing my views on political engagement. Additionally, my age and personal experiences have shaped my perceptions of political activism. Cultural relativism also plays a role, as my understanding of political action is influenced by the societal norms and values of my community. Taking into account these factors, I would never sign a political action petition, as it is not a common practice in my cultural context and does not align with my personal values and experiences.\n\n3"]}, {"persona": {"region": "Giza", "sex": "male", "age": 31, "country": "Egypt", "marital_status": "married", "education": "higher", "social_class": "lower middle class"}, "question": {"id": "Q209", "variant": 0}, "response": ["Based on the anthropological framework, as a married male from Giza, Egypt, my emic perspective would be influenced by my cultural context, individual values, and socioeconomic background. In Egypt, there is a strong emphasis on community and kinship networks, and political action is often viewed through the lens of collective welfare. Additionally, my lower middle-class status and higher education level may lead me to be more aware of political issues and potential avenues for advocacy. However, there are also potential risks associated with signing political action petitions, such as government scrutiny and potential backlash. Taking these factors into consideration, my personal experience and nuanced understanding of the situation would lead me to consider the potential benefits and risks before making a decision.\n\n2"]}, {"persona": {"region": "Giza", "sex": "male", "age": 28, "country": "Egypt", "marital_status": "single", "education": "middle", "social_class": "working class"}, "question": {"id": "Q209", "variant": 0}, "response": ["Based on the anthropological framework, as a single male from Giza, Egypt, I am influenced by my cultural context, individual values and personal experience, and socioeconomic background. In Egypt, there is a strong cultural context of political activism and involvement, and as a member of the working class, I am likely to have experienced the impact of political decisions on my daily life. Additionally, my age and educational level may have provided me with the awareness and opportunity to engage in political action. Therefore, my answer to the question is:\n\n(1) Have done"]}, {"persona": {"region": "Giza", "sex": "male", "age": 47, "country": "Egypt", "marital_status": "married", "education": "middle", "social_class": "lower middle class"}, "question": {"id": "Q209", "variant": 0}, "response": ["Based on the anthropological framework, as a married male from Giza, Egypt, who is 47 years old and part of the lower middle class, my perspective is heavily influenced by my cultural context, socioeconomic background, and personal experience. In Egypt, there is a long history of political activism and engagement, and signing a political action petition is seen as a way to express dissent or support for certain causes. However, as someone from the lower middle class with limited education, I may not have had the opportunity to engage in such political actions due to my daily struggle to make ends meet. Additionally, the political climate in Egypt may make signing a political action petition a risky or contentious endeavor. Therefore, my response to the question is influenced by a combination of cultural context, socioeconomic background, and personal experience.\n\n2"]}, {"persona": {"region": "Giza", "sex": "male", "age": 26, "country": "Egypt", "marital_status": "single", "education": "middle", "social_class": "lower middle class"}, "question": {"id": "Q209", "variant": 0}, "response": ["Based on the anthropological framework, as a single male from Giza, Egypt, my emic perspective on signing a political action petition is influenced by my cultural context, individual values, and socioeconomic background. In Egypt, there is a strong emphasis on collective action and a history of political activism. My personal experience and values also play a role, as I have been exposed to various political movements and have a sense of civic duty. Additionally, my lower middle class status means that I am more likely to be politically engaged and aware of social issues. Considering these factors, I would be inclined to sign a political action petition as a way to contribute to social change and advocate for issues that affect my community.\n\n1"]}, {"persona": {"region": "Giza", "sex": "male", "age": 48, "country": "Egypt", "marital_status": "married", "education": "middle", "social_class": "upper middle class"}, "question": {"id": "Q209", "variant": 0}, "response": ["Based on the anthropological framework, my perspective on signing a political action petition is influenced by my cultural context, individual values, and socioeconomic background. In Egypt, there is a strong emphasis on communal values and the importance of social harmony. Additionally, my socioeconomic background as an upper middle class individual may lead me to prioritize stability and security. Considering these factors, I would never do it.\n3"]}, {"persona": {"region": "Menya", "sex": "male", "age": 61, "country": "Egypt", "marital_status": "married", "education": "middle", "social_class": "working class"}, "question": {"id": "Q209", "variant": 0}, "response": ["Based on my cultural context as a married male from Menya, Egypt, where political engagement is not common and socioeconomic background as part of the working class, I have not had the opportunity or inclination to sign a political action petition. Additionally, my age and education level also play a role in my perspective, as I have not been exposed to the idea of signing a political action petition. Therefore, my decision is based on my individual values and personal experience within this cultural and socioeconomic context.\n\n2"]}, {"persona": {"region": "Menya", "sex": "male", "age": 41, "country": "Egypt", "marital_status": "married", "education": "middle", "social_class": "lower middle class"}, "question": {"id": "Q209", "variant": 0}, "response": ["From the perspective of a married male from Menya, Egypt, age 41, and part of the lower middle class, there are several factors to consider in answering this question. Based on cultural context, political participation may be influenced by the historical and cultural background of Egypt, where there has been a long history of political activism. Socioeconomic background also plays a role, as lower middle class individuals may have more limited resources and time to dedicate to political action. Additionally, individual values and personal experience may shape the decision, as previous experiences with political activism or lack thereof may influence one's willingness to sign a political action petition. Considering these factors, the chosen option is:\n\n2. Might do"]}, {"persona": {"region": "Menya", "sex": "female", "age": 43, "country": "Egypt", "marital_status": "married", "education": "higher", "social_class": "working class"}, "question": {"id": "Q209", "variant": 0}, "response": ["Based on the anthropological framework, the emic perspective of a married female from Menya, Egypt who is 43 years old and part of the working class would be influenced by her cultural context, individual values and personal experience, socioeconomic background, and space and time. In Menya, there may be cultural norms and social expectations regarding political participation, which may be influenced by the individual's education level and socioeconomic background. Additionally, her personal experiences and values may shape her perception of political action and whether she would engage in signing a political action petition. Considering the nuanced phrasing of the question, the answer may vary based on her specific experiences and values.\n\n2"]}, {"persona": {"region": "Menya", "sex": "male", "age": 57, "country": "Egypt", "marital_status": "married", "education": "middle", "social_class": "lower middle class"}, "question": {"id": "Q209", "variant": 0}, "response": ["Based on my emic perspective as a married male from Menya, Egypt, I have not signed a political action petition. In my cultural context, political involvement is not common for individuals in my socioeconomic background. My individual values and personal experience have also shaped my decision, as I have not been exposed to a culture of political activism. Additionally, as a member of the lower middle class, I do not have the financial resources or social connections to engage in such activities. Moreover, cultural relativism informs my decision, as political activism may be perceived as a threat to the existing social order in my community. Furthermore, considering my age and space, I have not been exposed to opportunities for political engagement. Therefore, based on my nuanced understanding of the question and my personal background, I would never do. \n\n3"]}, {"persona": {"region": "Menya", "sex": "male", "age": 42, "country": "Egypt", "marital_status": "divorced", "education": "middle", "social_class": "lower middle class"}, "question": {"id": "Q209", "variant": 0}, "response": ["From the perspective of a divorced male from Menya, Egypt, who is 42 years old, has completed middle education level, and considers himself part of the lower middle class, the decision to sign a political action petition would be influenced by a variety of factors. The cultural context and socioeconomic background would play a significant role, as the individual's experiences and personal values would also shape their perception of political activism. Additionally, the emic and etic perspectives would come into play, as the person's in-group and out-group ways of thinking about political engagement would impact their decision. Furthermore, the nuanced phrasing of the question would also be considered, as the individual may have different interpretations of what it means to sign a political action petition. \n\n2"]}, {"persona": {"region": "Menya", "sex": "female", "age": 59, "country": "Egypt", "marital_status": "married", "education": "middle", "social_class": "upper middle class"}, "question": {"id": "Q209", "variant": 0}, "response": ["From the emic and etic perspectives, as a married female from Menya, Egypt, I am aware of the in-group and out-group ways of thinking about political action petitions. In my cultural context, signing a political action petition is influenced by the values and personal experiences of individuals, as well as their socioeconomic background. As a member of the upper middle class, I am more likely to have the education and resources to be involved in political action, but my age and place also play a role in my decision. Considering all of these factors, I believe that I might sign a political action petition if I felt strongly about the cause and saw it as a way to make a positive change in my community.\n\n2"]}, {"persona": {"region": "Menya", "sex": "female", "age": 31, "country": "Egypt", "marital_status": "married", "education": "middle", "social_class": "working class"}, "question": {"id": "Q209", "variant": 0}, "response": ["Based on my emic perspective as a married female from Menya, Egypt, I have a strong understanding of the cultural context and socioeconomic background in which I live. In my community, there is a strong emphasis on collective decision-making and group consensus, and signing a political action petition is often seen as a way to advocate for change and address social issues. Additionally, my individual values and personal experiences have shaped my understanding of the importance of civic engagement and political activism, despite my working-class status and middle education level. Considering the nuanced phrasing of the question and the cultural relativism inherent in my community, I would definitely consider signing a political action petition as a way to contribute to positive social change. \n\n2"]}, {"persona": {"region": "Menya", "sex": "male", "age": 55, "country": "Egypt", "marital_status": "single", "education": "middle", "social_class": "working class"}, "question": {"id": "Q209", "variant": 0}, "response": ["Based on my emic perspective as a working-class male from Menya, Egypt, I have grown up in a culture where political actions and petitions are often seen as a way for the elite to maintain power and control. My cultural context also plays a role, as my community values hard work and providing for our families, rather than engaging in political activism. Additionally, my socioeconomic background and limited education level have led me to prioritize practical matters over political involvement. Therefore, I would never do (3) have signed a political action petition."]}, {"persona": {"region": "Menya", "sex": "female", "age": 28, "country": "Egypt", "marital_status": "married", "education": "higher", "social_class": "lower middle class"}, "question": {"id": "Q209", "variant": 0}, "response": ["Based on the anthropological framework, as a married female from Menya, Egypt, my emic perspective is influenced by my cultural context, individual values, and socioeconomic background. In Menya, women are often expected to prioritize their role as wives and mothers, and political participation is not commonly encouraged. Additionally, my lower middle class status may limit my access to information and resources needed to engage in political action. While I value the idea of advocating for change, my personal experience and cultural norms suggest that signing a political action petition may not be a common practice for someone in my position. Therefore, I would never do.\n\n3"]}, {"persona": {"region": "Menya", "sex": "male", "age": 24, "country": "Egypt", "marital_status": "single", "education": "middle", "social_class": "working class"}, "question": {"id": "Q209", "variant": 0}, "response": ["From the emic perspective, as a single male from Menya, Egypt, I am aware that there are in-group ways of thinking and answering questions. Additionally, my cultural context and socioeconomic background play a significant role in shaping my responses. Being part of the working class and having completed only middle education level, I am influenced by my individual values and personal experiences, which may lead me to have a particular perspective on political action petitions. Furthermore, the cultural relativism of my community and the nuances of the question also factor into my decision-making process. Given these factors, I would never sign a political action petition.\n\n3"]}, {"persona": {"region": "Menya", "sex": "female", "age": 23, "country": "Egypt", "marital_status": "married", "education": "middle", "social_class": "working class"}, "question": {"id": "Q209", "variant": 0}, "response": ["Based on the anthropological framework, as a married female from Menya, Egypt, my emic perspective is heavily influenced by my cultural context, individual values, and socioeconomic background. In Menya, there is a strong sense of community and family ties, which shapes my understanding and decision-making. Additionally, as a working-class individual, my access to education and resources may be limited, influencing my perception of political action and my willingness to engage in such activities. Given these factors, I might consider signing a political action petition if I believe it aligns with my values and benefits my community, but I may also be hesitant due to potential risks or consequences.\n\n2"]}, {"persona": {"region": "Menya", "sex": "male", "age": 27, "country": "Egypt", "marital_status": "single", "education": "middle", "social_class": "lower middle class"}, "question": {"id": "Q209", "variant": 0}, "response": ["From my emic perspective as a single male from Menya, Egypt, my cultural context and socioeconomic background heavily influence my decision on signing a political action petition. In my community, there is a strong emphasis on the importance of family and community, and I have been taught to prioritize stability and avoid unnecessary conflict. Additionally, my lower middle class status means that I often have to focus on working and providing for my family, leaving little time or resources to engage in political activism. Considering these factors, I have never signed a political action petition.\n\n3"]}, {"persona": {"region": "Asyut", "sex": "male", "age": 30, "country": "Egypt", "marital_status": "married", "education": "middle", "social_class": "working class"}, "question": {"id": "Q209", "variant": 0}, "response": ["Based on the anthropological framework, as a married male from Asyut, Egypt, my emic perspective is influenced by my cultural context, individual values, and socioeconomic background. In Asyut, there is a strong sense of community and the importance of family and work is prioritized. As a member of the working class, I have limited access to education and resources, which affects my political awareness and participation. Additionally, my personal experience and values may lead me to prioritize stability and security for my family over political activism. Therefore, considering all these factors, I would never sign a political action petition.\n\n3"]}, {"persona": {"region": "Asyut", "sex": "female", "age": 26, "country": "Egypt", "marital_status": "married", "education": "middle", "social_class": "working class"}, "question": {"id": "Q209", "variant": 0}, "response": ["Based on the anthropological framework described, as a married female from Asyut, Egypt, my emic perspective would be influenced by my cultural context, individual values, and socioeconomic background. In Egypt, there is a strong emphasis on family and community, and as a working-class woman with middle education, I prioritize stability and providing for my family. Additionally, the political climate in Egypt may make signing a political action petition risky, and my personal values and experience would lead me to prioritize the safety and security of my family. Therefore, I would never sign a political action petition.\n\n3"]}, {"persona": {"region": "Asyut", "sex": "male", "age": 32, "country": "Egypt", "marital_status": "single", "education": "higher", "social_class": "lower middle class"}, "question": {"id": "Q209", "variant": 0}, "response": ["Based on the anthropological framework, my answer to the question is influenced by my cultural context, individual values, and socioeconomic background. As a single male from Asyut, Egypt, I am aware of the political climate and the impact of signing a political action petition. My cultural context and personal experience have shaped my understanding of the importance of political engagement and activism. Additionally, my lower middle-class socioeconomic background has influenced my willingness to participate in political actions. Considering all these factors, I have chosen option (2) - Might do. \n\n2"]}, {"persona": {"region": "Asyut", "sex": "female", "age": 21, "country": "Egypt", "marital_status": "married", "education": "middle", "social_class": "working class"}, "question": {"id": "Q209", "variant": 0}, "response": ["Based on the anthropological framework, as a married female from Asyut, Egypt, my emic perspective on signing a political action petition is influenced by my cultural context, individual values, and socioeconomic background. In Asyut, there is a strong sense of community and collective decision-making, so signing a political action petition could be seen as a way to contribute to the welfare of the community. Additionally, my personal experience and values as a working-class individual may lead me to prioritize issues that directly impact my family and community. Furthermore, the cultural relativism aspect of the framework reminds me that there is no hierarchy of culture, and the nuanced phrasing of the question also influences my decision. Therefore, my answer is (2) Might do."]}, {"persona": {"region": "Asyut", "sex": "female", "age": 30, "country": "Egypt", "marital_status": "married", "education": "higher", "social_class": "working class"}, "question": {"id": "Q209", "variant": 0}, "response": ["From the perspective of a married female from Asyut, Egypt, who is 30 years old, completed higher education, and considers herself part of the working class, the decision to sign a political action petition would be influenced by a variety of factors. The cultural context of Asyut, as well as the individual values and personal experiences of the persona, would play a significant role in their decision. Additionally, their socioeconomic background and the nuanced phrasing of the question would also impact their response. Furthermore, the emic and etic perspectives of the persona would shape their understanding of the political action petition. Overall, the decision would be complex and multifaceted, taking into account a range of cultural, social, and personal factors. \n\n2"]}, {"persona": {"region": "Asyut", "sex": "female", "age": 42, "country": "Egypt", "marital_status": "married", "education": "higher", "social_class": "lower middle class"}, "question": {"id": "Q209", "variant": 0}, "response": ["Based on the anthropological framework, as a married female from Asyut, Egypt, with a lower middle class socioeconomic background and higher education, my emic perspective would be influenced by my cultural context, individual values, and personal experiences. In Egypt, political action and activism are often associated with risk and potential consequences, which may deter individuals from participating. Additionally, as a 42-year-old woman, I may have been socialized to prioritize family and community over political activism. Therefore, considering all these factors, I would never sign a political action petition.\n\n3"]}, {"persona": {"region": "Sohag", "sex": "male", "age": 63, "country": "Egypt", "marital_status": "married", "education": "middle", "social_class": "lower middle class"}, "question": {"id": "Q209", "variant": 0}, "response": ["Based on the anthropological framework, my perspective as a married male from Sohag, Egypt, at the age of 63, with a middle education level and part of the lower middle class, is heavily influenced by my cultural context, individual values, and socio-economic background. In Sohag, political engagement is not common among people of my background and age group, as we tend to focus on providing for our families and maintaining stability. Additionally, my personal experiences and values have shaped my perception of political action, leading me to prioritize other aspects of life. Therefore, I would never sign a political action petition.\n\n3"]}, {"persona": {"region": "Sohag", "sex": "male", "age": 27, "country": "Egypt", "marital_status": "married", "education": "middle", "social_class": "working class"}, "question": {"id": "Q209", "variant": 0}, "response": ["Based on my cultural context in Sohag, Egypt, where political activism is not common and the government has strict control over public expression, I am unlikely to have signed a political action petition. My individual values and personal experience, combined with my socioeconomic background as a working-class individual, also influence my decision. Additionally, my age and level of education play a role in my perception of political involvement. Therefore, I would never do it.\n\n3"]}, {"persona": {"region": "Sohag", "sex": "male", "age": 56, "country": "Egypt", "marital_status": "married", "education": "higher", "social_class": "upper middle class"}, "question": {"id": "Q209", "variant": 0}, "response": ["From the cultural context of Sohag, Egypt, where I come from, signing a political action petition is not a common practice. The cultural relativism in Egypt does not prioritize individual political activism in the same way that it might be valued in other cultures. Additionally, my age and socioeconomic background also play a significant role in my decision. As a 56-year-old male from the upper middle class, I have been socialized to prioritize stability and maintaining the status quo. Furthermore, my higher education level has taught me the importance of diplomacy and negotiation in effecting change, rather than direct political action. Therefore, based on my cultural context, age, and socioeconomic background, I would never do. \n\n3"]}, {"persona": {"region": "Sohag", "sex": "male", "age": 51, "country": "Egypt", "marital_status": "married", "education": "higher", "social_class": "lower middle class"}, "question": {"id": "Q209", "variant": 0}, "response": ["Based on the anthropological framework, as a married male from Sohag, Egypt, my emic perspective is heavily influenced by my cultural context, individual values, and socioeconomic background. In my culture, signing a political action petition may be seen as a risky and controversial act, as it could potentially lead to social and political repercussions. Additionally, as a member of the lower middle class, I am more focused on providing for my family and ensuring stability, rather than engaging in political activism. Therefore, I would never do it.\n\n3"]}, {"persona": {"region": "Sohag", "sex": "female", "age": 26, "country": "Egypt", "marital_status": "married", "education": "higher", "social_class": "working class"}, "question": {"id": "Q209", "variant": 0}, "response": ["Based on the anthropological framework, as a married female from Sohag, Egypt, I would consider my emic perspective and cultural context. In my community, there is a strong emphasis on collective action and social cohesion. My individual values and personal experience also play a role, as I have been taught that participating in political action is a way to advocate for change and progress. Additionally, my socioeconomic background as part of the working class informs my decision, as I believe signing a political action petition is a way to have my voice heard and make a difference in my community. However, I also recognize the importance of nuance in this decision, as there may be specific circumstances that would affect my willingness to sign a political action petition.\n\n2"]}, {"persona": {"region": "Sohag", "sex": "female", "age": 29, "country": "Egypt", "marital_status": "married", "education": "higher", "social_class": "upper middle class"}, "question": {"id": "Q209", "variant": 0}, "response": ["Based on the anthropological framework, as a married female from Sohag, Egypt, with a higher education level and considering myself part of the upper middle class, my emic perspective on signing a political action petition would be influenced by my cultural context, individual values, and socioeconomic background. In Egypt, there is a strong emphasis on social and political activism, and as someone with higher education and belonging to the upper middle class, I am likely to be more aware of social and political issues. Additionally, my personal values may incline me towards supporting causes that align with my education and socioeconomic status. Therefore, I would be open to signing a political action petition as a means of contributing to social change and expressing my beliefs. \n\n2"]}, {"persona": {"region": "Sohag", "sex": "male", "age": 51, "country": "Egypt", "marital_status": "married", "education": "middle", "social_class": "lower middle class"}, "question": {"id": "Q209", "variant": 0}, "response": ["Based on my cultural context, as a married male from Sohag, Egypt, I come from a conservative and traditional community where political engagement is not common. My lower middle class socioeconomic background also means that I have limited access to resources and information about political action petitions. Additionally, my personal experience and individual values emphasize the importance of stability and security for my family, and I believe that getting involved in political activities could potentially bring unwanted attention or risk. Considering all these factors, I would never sign a political action petition.\n\n3"]}, {"persona": {"region": "Qena", "sex": "male", "age": 32, "country": "Egypt", "marital_status": "single", "education": "middle", "social_class": "working class"}, "question": {"id": "Q209", "variant": 0}, "response": ["Based on the anthropological framework, as a single male from Qena, Egypt, my emic perspective on signing a political action petition is influenced by my cultural context, socioeconomic background, and personal experience. In Qena, political activism is not common and may even be discouraged, especially among the working class. Additionally, my middle education level and limited exposure to political engagement might lead me to believe that signing a political action petition could potentially have negative consequences for me and my community. Therefore, considering these factors, I would never do option 3."]}, {"persona": {"region": "Qena", "sex": "male", "age": 54, "country": "Egypt", "marital_status": "married", "education": "middle", "social_class": "lower middle class"}, "question": {"id": "Q209", "variant": 0}, "response": ["Based on the anthropological framework, as a married male from Qena, Egypt, my emic perspective on signing a political action petition is influenced by my cultural context, individual values, and socioeconomic background. In Qena, there is a strong emphasis on community and family, and political participation is often viewed through the lens of collective action. Additionally, my lower middle-class status and limited education level may lead me to prioritize economic concerns over political activism. Considering these factors, I would never do (3) sign a political action petition."]}, {"persona": {"region": "Qena", "sex": "male", "age": 25, "country": "Egypt", "marital_status": "single", "education": "lower", "social_class": "lower class"}, "question": {"id": "Q209", "variant": 0}, "response": ["Based on the anthropological framework, my emic perspective as a young, lower-class male from Qena, Egypt, with limited education, is heavily influenced by my cultural context, individual values, and socioeconomic background. The cultural context of Qena is characterized by a traditional and conservative society, where political activism may not be a common practice. My individual values and personal experiences have shaped my perception of political action, and my lower socioeconomic background may limit my access to information and resources for political engagement. Additionally, the nuance of the question and the space and time factors further reinforce my likelihood of not signing a political action petition. \n\n3"]}, {"persona": {"region": "Aswan", "sex": "male", "age": 34, "country": "Egypt", "marital_status": "single", "education": "middle", "social_class": "lower class"}, "question": {"id": "Q209", "variant": 0}, "response": ["Based on my emic perspective as a lower-class single male from Aswan, Egypt, my cultural context, individual values and personal experience, and socioeconomic background all play a role in my answer to this question. In my community, political action and petitioning are not common practices, and as a member of the lower class, I have limited access to resources and opportunities to engage in political activism. Additionally, my age and education level also influence my perception of political action. Therefore, based on these factors, I would never do this.\n\n3"]}, {"persona": {"region": "Aswan", "sex": "female", "age": 31, "country": "Egypt", "marital_status": "married", "education": "middle", "social_class": "lower middle class"}, "question": {"id": "Q209", "variant": 0}, "response": ["Based on the anthropological framework, as a married female from Aswan, Egypt, my emic perspective is influenced by my cultural context, individual values, and socioeconomic background. As a member of the lower middle class, my experiences and personal values shape my perception of political action. In my cultural context, signing a political action petition may be seen as a risky or unnecessary act, given the potential consequences in a politically tense environment. Additionally, my limited education level may influence my understanding of the implications of signing such a petition. Considering these factors, my decision would align with my cultural relativism and nuanced understanding of the potential risks involved in signing a political action petition.\n\n2"]}, {"persona": {"region": "Aswan", "sex": "female", "age": 39, "country": "Egypt", "marital_status": "married", "education": "middle", "social_class": "working class"}, "question": {"id": "Q209", "variant": 0}, "response": ["Based on my cultural context, as a married female from Aswan, Egypt, I am influenced by the values and experiences of my community and family. My socioeconomic background as part of the working class also shapes my perceptions and actions. Additionally, cultural relativism is important to consider, as my understanding of political action and participation may differ from Western perspectives. Furthermore, my age and education level also play a role in how I perceive and engage with political activities. Therefore, I might consider signing a political action petition as a way to potentially make a difference in my community and society, while also being mindful of the potential risks and implications. \n\n2"]}, {"persona": {"region": "Qena", "sex": "female", "age": 27, "country": "Egypt", "marital_status": "married", "education": "lower", "social_class": "lower middle class"}, "question": {"id": "Q209", "variant": 0}, "response": ["Based on my cultural context and socioeconomic background, as a married female from Qena, Egypt, and part of the lower middle class, my understanding of and participation in political action may differ from others. My individual values and personal experience, along with the cultural relativism of my community, shape my perspective. Additionally, my lower education level and age also play a role in how I perceive and engage with political activities. Therefore, I would never do. \n\n3"]}, {"persona": {"region": "Qena", "sex": "male", "age": 40, "country": "Egypt", "marital_status": "single", "education": "middle", "social_class": "lower middle class"}, "question": {"id": "Q209", "variant": 0}, "response": ["Based on the anthropological framework, as a single male from Qena, Egypt, my emic perspective on signing a political action petition is influenced by the cultural context of my community, where there is a strong emphasis on collective decision-making and group solidarity. My individual values and personal experience also play a role, as I have been raised to prioritize stability and harmony in my social interactions. Additionally, my lower middle class socioeconomic background has made me cautious about engaging in activities that could potentially jeopardize my livelihood. Considering these factors, I would never do option 3."]}, {"persona": {"region": "Qena", "sex": "male", "age": 30, "country": "Egypt", "marital_status": "single", "education": "middle", "social_class": "working class"}, "question": {"id": "Q209", "variant": 0}, "response": ["Based on the anthropological framework, as a single male from Qena, Egypt, my emic perspective is deeply influenced by my cultural context, socioeconomic background, and personal experience. As someone from a working-class background in Egypt, I value the importance of collective action and community solidarity. However, considering the current political climate and potential consequences, I might be hesitant to sign a political action petition. I have seen the impact of political activism in my community, but I also understand the risks involved. Therefore, I might consider signing a political action petition if I believe it will genuinely benefit my community and if I feel it is safe to do so.\n\n2"]}]