[{"persona": {"region": "Fayoum", "sex": "male", "age": 46, "country": "Egypt", "marital_status": "married", "education": "higher", "social_class": "lower middle class"}, "question": {"id": "Q88", "variant": 0}, "response": ["As a married male from Fayoum, Egypt, my understanding of the World Health Organization (WHO) is influenced by my cultural context, individual values, and socioeconomic background. In my community, there is a strong emphasis on family and community health, and the WHO plays a significant role in providing guidance and resources for healthcare initiatives. Additionally, my lower middle-class socioeconomic status means that I am reliant on public health services, and the WHO's recommendations and programs directly impact the availability and quality of these services. My higher education level has also exposed me to the importance of evidence-based global health policies, further reinforcing my confidence in the WHO. Therefore, I have chosen the following option to reflect my perspective: \n\n2"]}, {"persona": {"region": "Fayoum", "sex": "female", "age": 30, "country": "Egypt", "marital_status": "married", "education": "middle", "social_class": "lower middle class"}, "question": {"id": "Q88", "variant": 0}, "response": ["Based on the anthropological framework, as a married female from Fayoum, Egypt, my emic perspective is influenced by the cultural context of my community and my personal experience. In my cultural context, there is a strong emphasis on trusting in institutions and authorities. Additionally, as a lower middle class individual, my socioeconomic background influences my perception of the WHO. As an educated individual, I have some knowledge of global health organizations and the work they do, so I have a relatively high level of confidence in the WHO. Therefore, my answer is:\n2"]}, {"persona": {"region": "Fayoum", "sex": "male", "age": 60, "country": "Egypt", "marital_status": "married", "education": "higher", "social_class": "working class"}, "question": {"id": "Q88", "variant": 0}, "response": ["Based on the anthropological framework, my perspective as a married male from Fayoum, Egypt, would be influenced by my cultural context, individual values, and socioeconomic background. As a member of the working class in Egypt, my access to information and healthcare resources may be limited, and therefore my confidence in the World Health Organization may be influenced by these factors. Additionally, my age and educational background may shape my understanding of global health organizations and their impact on my community. Furthermore, the cultural relativism of my perspective may lead me to have a nuanced understanding of the WHO and its role in addressing health issues in my region.\n\n2"]}, {"persona": {"region": "Fayoum", "sex": "male", "age": 20, "country": "Egypt", "marital_status": "single", "education": "middle", "social_class": "lower middle class"}, "question": {"id": "Q88", "variant": 0}, "response": ["Based on the anthropological framework, my response to the question of how much confidence I have in the World Health Organization (WHO) is influenced by my cultural context, socioeconomic background, and personal experience. As a lower middle-class male from Fayoum, Egypt, I have limited access to healthcare resources and information. This has made me skeptical of organizations like the WHO, as I have not seen tangible benefits from their interventions in my community. Additionally, my age and level of education have not exposed me to extensive knowledge about global health organizations, further contributing to my lack of confidence in the WHO. Therefore, my response to the question is:\n\n3"]}, {"persona": {"region": "Fayoum", "sex": "female", "age": 39, "country": "Egypt", "marital_status": "married", "education": "higher", "social_class": "lower middle class"}, "question": {"id": "Q88", "variant": 0}, "response": ["Based on my cultural context, as a married female from Fayoum, Egypt, and with a higher education level, I have been exposed to various perspectives on global health organizations, including the World Health Organization (WHO). My socioeconomic background as part of the lower middle class has also influenced my understanding of the WHO's work and impact. Additionally, my individual values and personal experiences have shaped my confidence in the organization. Considering cultural relativism, I understand that different cultures and societies may have varying levels of trust in global health organizations. Therefore, my answer to the question is:\n\n2"]}, {"persona": {"region": "Fayoum", "sex": "male", "age": 33, "country": "Egypt", "marital_status": "married", "education": "higher", "social_class": "working class"}, "question": {"id": "Q88", "variant": 0}, "response": ["Based on the anthropological framework, my cultural context as a married male from Fayoum, Egypt, my age, education level, and working-class background all influence my perception of the World Health Organization. My personal experience and individual values also play a significant role in my confidence in the WHO. Additionally, my socioeconomic background may affect my trust in the organization. Considering cultural relativism, I may have a different perspective on the WHO compared to someone from a different cultural background. Therefore, my response to the question is:\n\n2"]}, {"persona": {"region": "Port Said", "sex": "female", "age": 45, "country": "Egypt", "marital_status": "married", "education": "higher", "social_class": "lower middle class"}, "question": {"id": "Q88", "variant": 0}, "response": ["Based on the anthropological framework, my perspective as a married female from Port Said, Egypt, who is 45 years old and part of the lower middle class, is influenced by a combination of emic and etic perspectives, cultural context, individual values and personal experience, and socioeconomic background. In Egypt, there is a strong sense of collectivism and trust in institutions, including the World Health Organization (WHO). As someone with higher education, I have been exposed to information and have a better understanding of the importance of global health organizations. However, my socioeconomic background may lead me to have some skepticism due to the limited resources and access to healthcare in my community. Therefore, I would choose option (2) Quite a lot, as I have confidence in the WHO's efforts, but acknowledge that there may be limitations in its impact within my local context. \n\n2"]}, {"persona": {"region": "Port Said", "sex": "male", "age": 42, "country": "Egypt", "marital_status": "married", "education": "middle", "social_class": "lower middle class"}, "question": {"id": "Q88", "variant": 0}, "response": ["Based on my personal experience and cultural context, as a married male from Port Said, Egypt, I have a lower middle class socioeconomic background and have completed middle education. In my cultural context, there is a certain level of skepticism towards international organizations and their influence on local issues. Additionally, my individual values and personal experience have led me to question the impact and effectiveness of global health organizations like the WHO in addressing the specific health needs of my community. Therefore, I would choose option 3: Not very much. \n\n3"]}, {"persona": {"region": "Port Said", "sex": "male", "age": 28, "country": "Egypt", "marital_status": "single", "education": "middle", "social_class": "lower middle class"}, "question": {"id": "Q88", "variant": 0}, "response": ["From an emic perspective, as a single male from Port Said, Egypt, my cultural context and socioeconomic background are pivotal in shaping my understanding and confidence in the World Health Organization (WHO). My personal experience and individual values also play a significant role in my perception. As a member of the lower middle class, my access to healthcare and exposure to the practices of the WHO may be limited compared to those in higher socioeconomic classes. Additionally, my age and education level may influence my understanding of global health organizations. Therefore, my confidence in the WHO may not be as high as it would be for someone from a different cultural and socioeconomic background. \n\n3"]}, {"persona": {"region": "Port Said", "sex": "female", "age": 30, "country": "Egypt", "marital_status": "married", "education": "higher", "social_class": "lower middle class"}, "question": {"id": "Q88", "variant": 0}, "response": ["Based on my emic perspective as a married female from Port Said, Egypt, my cultural context and personal experience have shaped my understanding of the World Health Organization (WHO). I have been raised in a community where access to healthcare and reliable information is limited, and my socioeconomic background as a lower middle class individual has also influenced my perception of global health organizations. Due to these factors, I have not had much exposure to the WHO and its work, and I have limited confidence in its ability to address the health concerns of people in my community. Therefore, my answer to the question would be:\n\n3"]}, {"persona": {"region": "Port Said", "sex": "male", "age": 30, "country": "Egypt", "marital_status": "divorced", "education": "middle", "social_class": "lower middle class"}, "question": {"id": "Q88", "variant": 0}, "response": ["Based on my emic perspective as a divorced male from Port Said, Egypt, I have to consider my cultural context, individual values, and socioeconomic background in answering this question. As a member of the lower middle class, I have limited access to healthcare and rely heavily on organizations like the WHO for information and support. However, my personal experience and the cultural context of Egypt may lead me to have some skepticism towards international organizations like WHO. Additionally, my limited education may make it difficult for me to fully understand the role and impact of the WHO. Therefore, I would choose option (3) Not very much as my answer.\n\n3"]}, {"persona": {"region": "Port Said", "sex": "female", "age": 19, "country": "Egypt", "marital_status": "single", "education": "middle", "social_class": "lower middle class"}, "question": {"id": "Q88", "variant": 0}, "response": ["Based on the anthropological framework, as a single female from Port Said, Egypt, I am influenced by my cultural context, individual values, and socioeconomic background. In my community, there is a strong emphasis on traditional values and a reliance on personal experiences and local knowledge. Additionally, being part of the lower middle class means that I may have limited access to information and resources, which could impact my confidence in international organizations like the World Health Organization. Therefore, I would choose option (3) Not very much, as I may not have had much exposure to or trust in the WHO's work and may rely more on local sources of information for health-related matters. \n\n3"]}, {"persona": {"region": "Fayoum", "sex": "male", "age": 40, "country": "Egypt", "marital_status": "married", "education": "middle", "social_class": "working class"}, "question": {"id": "Q88", "variant": 0}, "response": ["From the perspective of a married male from Fayoum, Egypt, who is 40 years old and part of the working class, it is important to consider the cultural context and individual values when answering this question. In Egypt, there may be a level of skepticism towards international organizations like the World Health Organization (WHO) due to historical and political reasons. Additionally, the socioeconomic background of being part of the working class may lead to a lack of confidence in such organizations due to potential disparities in access to healthcare and resources. This combination of cultural context, individual values, and socioeconomic background may lead to a response that reflects a lack of confidence in the WHO.\n\n3"]}, {"persona": {"region": "Fayoum", "sex": "male", "age": 23, "country": "Egypt", "marital_status": "single", "education": "higher", "social_class": "lower middle class"}, "question": {"id": "Q88", "variant": 0}, "response": ["Based on the anthropological framework, my perspective as a single male from Fayoum, Egypt, is heavily influenced by my cultural context, individual values, and socioeconomic background. Coming from a lower middle-class background and having completed higher education, I have developed a nuanced understanding of global health organizations like the World Health Organization (WHO). My personal experience and values lead me to have quite a lot of confidence in the WHO because I recognize the importance of international health initiatives for the well-being of my community and the world at large. Additionally, my cultural relativism leads me to understand the value of collaborative efforts in addressing global health issues, and my age and education level have exposed me to the positive impact of WHO interventions in various health crises. Therefore, I have chosen option (2) Quite a lot as my answer. \n\n2"]}, {"persona": {"region": "Fayoum", "sex": "female", "age": 38, "country": "Egypt", "marital_status": "married", "education": "middle", "social_class": "lower middle class"}, "question": {"id": "Q88", "variant": 0}, "response": ["From the perspective of a married female from Fayoum, Egypt, the emic and etic perspectives are crucial in understanding the level of confidence in the World Health Organization (WHO). The cultural context and individual values play a significant role in shaping this perspective. In Egypt, there is a strong emphasis on community and family, and the cultural context may lead to a greater level of trust in international organizations such as the WHO. Additionally, the socioeconomic background of the persona, being part of the lower middle class, may also influence their level of confidence in the WHO. As a married woman with middle education, she may have limited access to healthcare and rely on external organizations such as the WHO for information and assistance. Therefore, based on this perspective, the persona would likely choose option 2: Quite a lot of confidence in the World Health Organization (WHO). \n\n2"]}, {"persona": {"region": "Fayoum", "sex": "male", "age": 32, "country": "Egypt", "marital_status": "married", "education": "middle", "social_class": "lower middle class"}, "question": {"id": "Q88", "variant": 0}, "response": ["Based on the anthropological framework, as a married male from Fayoum, Egypt, my emic perspective is shaped by my cultural context, individual values, and socioeconomic background. In my cultural context, I have been exposed to traditional beliefs and practices that may influence my perception of external organizations like the WHO. Additionally, my individual values and personal experiences, combined with my lower middle class socioeconomic background, may lead me to have a more skeptical view of international organizations. Furthermore, my age and level of education may also play a role in how much confidence I have in the WHO. Taking all these factors into consideration, my answer would be:\n\n3\n\nNot very much"]}, {"persona": {"region": "Fayoum", "sex": "male", "age": 31, "country": "Egypt", "marital_status": "married", "education": "higher", "social_class": "working class"}, "question": {"id": "Q88", "variant": 0}, "response": ["Based on the anthropological framework, my answer to the question regarding my confidence in the World Health Organization (WHO) is influenced by my emic perspective as a married male from Fayoum, Egypt, my cultural context, individual values and personal experience, socioeconomic background, and the nuance of the question. As a member of the working class in Egypt, I have limited access to healthcare and rely heavily on organizations like the WHO for information and support. My personal experience and cultural context have also shown me the importance of global health organizations in addressing public health issues. Therefore, I have quite a lot of confidence in the World Health Organization (WHO).\n\n2"]}, {"persona": {"region": "Fayoum", "sex": "male", "age": 31, "country": "Egypt", "marital_status": "married", "education": "middle", "social_class": "lower middle class"}, "question": {"id": "Q88", "variant": 0}, "response": ["Based on my emic perspective as a lower middle-class married male from Fayoum, Egypt, my confidence in the World Health Organization (WHO) is influenced by my cultural context, individual values, and socioeconomic background. Living in a rural area with limited access to healthcare and education, I am aware of the challenges my community faces in terms of health. My personal experience has shown me the importance of international organizations like WHO in providing support and resources to address public health issues. Additionally, my lower middle-class socioeconomic background means that I am more likely to rely on global health organizations for guidance and assistance. Therefore, I have quite a lot of confidence in the World Health Organization.\n\n2"]}, {"persona": {"region": "Fayoum", "sex": "female", "age": 32, "country": "Egypt", "marital_status": "married", "education": "middle", "social_class": "lower middle class"}, "question": {"id": "Q88", "variant": 0}, "response": ["Based on the anthropological framework described, my perspective as a married female from Fayoum, Egypt, is heavily influenced by my cultural context, individual values, and socioeconomic background. I come from a lower middle-class family and have completed middle-level education, which means that I have limited access to information and resources. Additionally, as a woman in Egypt, I am influenced by societal norms and expectations, which may affect my perception of international organizations like the World Health Organization. Furthermore, my trust in the WHO may also be influenced by my personal experiences with healthcare and the healthcare system in Egypt. Therefore, my confidence in the World Health Organization is not very much (3).\n\n3"]}, {"persona": {"region": "Ismailia", "sex": "male", "age": 53, "country": "Egypt", "marital_status": "married", "education": "middle", "social_class": "lower middle class"}, "question": {"id": "Q88", "variant": 0}, "response": ["Based on the anthropological framework, my emic perspective as a married male from Ismailia, Egypt, in the lower middle class, with a middle education level, and aged 53, influences my understanding and trust in institutions such as the World Health Organization. My cultural context and socioeconomic background have shaped my perception of authority and information. Additionally, my personal experience and individual values have led me to be more skeptical of external organizations, as I have seen firsthand the impact of socioeconomic disparities and lack of access to healthcare in my community. Therefore, my confidence in the World Health Organization is not very much. \n\n3"]}, {"persona": {"region": "Ismailia", "sex": "male", "age": 38, "country": "Egypt", "marital_status": "married", "education": "higher", "social_class": "working class"}, "question": {"id": "Q88", "variant": 0}, "response": ["Based on the anthropological framework, as a married male from Ismailia, Egypt, who is 38 years old and part of the working class, my emic perspective is heavily influenced by my cultural context, individual values, and socioeconomic background. I have grown up in a community where healthcare and access to reliable information is limited, and my personal experiences have shaped my perception of global health organizations. Additionally, my socioeconomic background as a working-class individual further influences my trust in global organizations. Therefore, I would choose option 3: Not very much, as my personal experiences and cultural context have led me to have limited confidence in the WHO's ability to address the health needs of individuals like myself in Ismailia, Egypt.\n\n3"]}, {"persona": {"region": "Ismailia", "sex": "female", "age": 35, "country": "Egypt", "marital_status": "married", "education": "middle", "social_class": "lower middle class"}, "question": {"id": "Q88", "variant": 0}, "response": ["Based on the anthropological framework, my perspective as a married female from Ismailia, Egypt, with a middle education level and lower middle-class background, is heavily influenced by my cultural context, individual values, and personal experience. I have grown up in a community where access to healthcare and information from international organizations like the WHO is limited. Additionally, my socioeconomic background has made it challenging for me to access the healthcare services I need. Therefore, I have limited confidence in the World Health Organization, as their initiatives and guidelines may not directly impact or benefit individuals in my community. \n\n3"]}, {"persona": {"region": "Ismailia", "sex": "female", "age": 57, "country": "Egypt", "marital_status": "married", "education": "lower", "social_class": "working class"}, "question": {"id": "Q88", "variant": 0}, "response": ["Based on my cultural context, as a married female from Ismailia, Egypt, my understanding and perception of the World Health Organization (WHO) would be influenced by my socioeconomic background, individual values, and personal experience. As a member of the working class with lower education, I may not have direct access to information about the WHO, and my confidence in the organization may be influenced by the information I do have access to. Additionally, cultural relativism and nuance play a role in shaping my perspective, as I am likely to consider the WHO's actions and impact within the context of my own community and experiences. \n\n2"]}, {"persona": {"region": "Ismailia", "sex": "male", "age": 33, "country": "Egypt", "marital_status": "married", "education": "middle", "social_class": "lower middle class"}, "question": {"id": "Q88", "variant": 0}, "response": ["Based on the anthropological framework, as a married male from Ismailia, Egypt, my emic perspective on the World Health Organization (WHO) is influenced by my cultural context, individual values, and socioeconomic background. In my cultural context, I have been raised to trust authorities and institutions, especially those related to healthcare. My personal experience has also shown me the importance of organizations like WHO in providing support and resources for public health. Additionally, as someone from the lower middle class, I rely on the information and assistance provided by WHO for my family's health needs. Therefore, my confidence in the WHO is quite a lot.\n\n2"]}, {"persona": {"region": "Ismailia", "sex": "female", "age": 49, "country": "Egypt", "marital_status": "single", "education": "higher", "social_class": "upper middle class"}, "question": {"id": "Q88", "variant": 0}, "response": ["Based on the anthropological framework, my perspective as a single female from Ismailia, Egypt, who is 49 years old and part of the upper middle class, is shaped by my cultural context, individual values, and personal experience. In my community, education and socioeconomic status play a significant role in shaping our perceptions and beliefs. As someone who has received higher education and belongs to the upper middle class, I have been exposed to a variety of information and have the resources to critically evaluate it. Additionally, my personal experience has shown me the importance of international organizations like the WHO in addressing global health issues. Therefore, I have a great deal of confidence in the World Health Organization (WHO) because I believe in the expertise and dedication of the professionals working within the organization to improve global health outcomes.\n\n1"]}, {"persona": {"region": "Ismailia", "sex": "female", "age": 35, "country": "Egypt", "marital_status": "married", "education": "higher", "social_class": "lower middle class"}, "question": {"id": "Q88", "variant": 0}, "response": ["Based on the anthropological framework, my perspective as a married female from Ismailia, Egypt, who is 35 years old, has completed higher education, and considers herself part of the lower middle class, is heavily influenced by my cultural context, individual values, and socioeconomic background. In my community, there is a strong emphasis on education and critical thinking, and I have been taught to question authority and seek out multiple sources of information. Additionally, as someone from a lower middle class background, I am aware of the limitations and disparities in healthcare access and resources. Therefore, my confidence in the World Health Organization (WHO) is quite a lot. \n\n2"]}, {"persona": {"region": "Ismailia", "sex": "male", "age": 24, "country": "Egypt", "marital_status": "single", "education": "higher", "social_class": "upper middle class"}, "question": {"id": "Q88", "variant": 0}, "response": ["Based on my individual values and personal experience, as a well-educated individual from a relatively affluent background, I have a high level of confidence in the World Health Organization (WHO). Additionally, my cultural context and socioeconomic background have also influenced my trust in global health organizations. As a member of the upper middle class in Ismailia, Egypt, I have been exposed to a variety of perspectives and information, which has allowed me to develop a nuanced understanding of global health issues. Therefore, I have a great deal of confidence in the World Health Organization (WHO) because of their expertise and global reach, which aligns with my personal values and experiences.\n\n1"]}, {"persona": {"region": "Ismailia", "sex": "female", "age": 23, "country": "Egypt", "marital_status": "single", "education": "higher", "social_class": "lower middle class"}, "question": {"id": "Q88", "variant": 0}, "response": ["Based on the anthropological framework, my answer to the question on how much confidence I have in the World Health Organization (WHO) is shaped by my individual values and personal experience, as well as my socioeconomic background. As a single female from Ismailia, Egypt, who is 23 years old and part of the lower middle class, I have experienced firsthand the limitations and challenges of accessing adequate healthcare. This has led me to have not very much confidence in the WHO, as I have observed the organization's limitations in addressing the specific health needs and concerns of individuals from lower socioeconomic backgrounds, particularly in my region. Additionally, the cultural context and nuanced understanding of healthcare issues in my community also contribute to my lack of confidence in the WHO's ability to effectively address these concerns.\n\n3"]}, {"persona": {"region": "Ismailia", "sex": "male", "age": 55, "country": "Egypt", "marital_status": "married", "education": "middle", "social_class": "lower middle class"}, "question": {"id": "Q88", "variant": 0}, "response": ["Based on my cultural context and socioeconomic background, I have limited access to information and resources. My individual values and personal experience also play a role in shaping my perceptions. Additionally, my lower middle class status and limited education level make me rely heavily on local sources of information. Therefore, I may not have much confidence in the World Health Organization, as I may not have had much exposure to their work and may rely more on local healthcare providers and community knowledge for my health information.\n\n3"]}, {"persona": {"region": "Ismailia", "sex": "male", "age": 57, "country": "Egypt", "marital_status": "married", "education": "middle", "social_class": "upper middle class"}, "question": {"id": "Q88", "variant": 0}, "response": ["Based on the anthropological framework, my perspective as a married male from Ismailia, Egypt, aged 57, with a middle education level, and considering myself part of the upper middle class, is shaped by my cultural context, individual values, and socioeconomic background. In my cultural context, there is a strong emphasis on respecting authority and expertise, which aligns with the World Health Organization's role as a leading authority on global health. Additionally, my socioeconomic background as part of the upper middle class may lead me to have more trust in international organizations like the WHO. Therefore, I have quite a lot of confidence in the World Health Organization (WHO).\n\n2"]}, {"persona": {"region": "Ismailia", "sex": "female", "age": 29, "country": "Egypt", "marital_status": "married", "education": "middle", "social_class": "upper middle class"}, "question": {"id": "Q88", "variant": 0}, "response": ["Based on my emic perspective as a married female from Ismailia, Egypt, I have been brought up to trust and respect authority figures, especially those in the field of health and medicine. The cultural context of my upbringing and education has instilled in me a deep sense of respect for organizations such as the World Health Organization. Additionally, my individual values and personal experience have taught me to place a great deal of confidence in the expertise and knowledge of such global health organizations. Furthermore, my socioeconomic background as part of the upper middle class has afforded me access to information and resources that reinforce the credibility of the WHO. Therefore, from my nuanced perspective, I have a great deal of confidence in the World Health Organization.\n\n2"]}, {"persona": {"region": "Damiatta", "sex": "female", "age": 46, "country": "Egypt", "marital_status": "married", "education": "middle", "social_class": "lower middle class"}, "question": {"id": "Q88", "variant": 0}, "response": ["Based on my cultural context, as a married woman from Damiatta, Egypt, my trust in the World Health Organization (WHO) would be influenced by my personal experience and socio-economic background. As someone from a lower middle class background, I may have limited access to healthcare resources and may have encountered challenges in accessing quality healthcare. This may lead me to have less confidence in the WHO, as I may feel that their efforts have not directly impacted my own health and well-being. Additionally, my age and level of education may also play a role in shaping my perceptions of global health organizations. 3\n\n(3) Not very much"]}, {"persona": {"region": "Damiatta", "sex": "female", "age": 20, "country": "Egypt", "marital_status": "single", "education": "middle", "social_class": "lower middle class"}, "question": {"id": "Q88", "variant": 0}, "response": ["From an emic perspective, growing up in Damiatta, Egypt, I have been surrounded by a cultural context that emphasizes community health and well-being. My personal experience and individual values have led me to place a high value on the importance of organizations like the World Health Organization in providing essential resources and guidance for global health initiatives. Additionally, considering my lower middle-class socioeconomic background, I have seen firsthand the impact of health disparities and the crucial role that organizations like WHO play in addressing these issues. Therefore, I have a great deal of confidence in the World Health Organization.\n\n1"]}, {"persona": {"region": "Damiatta", "sex": "male", "age": 19, "country": "Egypt", "marital_status": "single", "education": "middle", "social_class": "lower middle class"}, "question": {"id": "Q88", "variant": 0}, "response": ["Based on my background and cultural context, as a 19-year-old male from Damiatta, Egypt, who completed middle education and considers himself part of the lower middle class, my answer to the question of how much confidence I have in the World Health Organization (WHO) would be \"Not very much\" (3). This answer is influenced by my socioeconomic background, as well as the cultural context in which I live. In my community, there may be skepticism and mistrust towards global organizations like the WHO, and my personal experience and values also play a role in shaping this perception. Additionally, cultural relativism and the nuance of the question also contribute to my choice, as the wording of the question may lead me to be cautious in placing too much confidence in a global institution."]}, {"persona": {"region": "Damiatta", "sex": "female", "age": 33, "country": "Egypt", "marital_status": "married", "education": "higher", "social_class": "lower middle class"}, "question": {"id": "Q88", "variant": 0}, "response": ["Based on the anthropological framework, my perspective on the World Health Organization (WHO) is influenced by my cultural context, individual values, and socioeconomic background. As a married female from Damiatta, Egypt, I am part of the lower middle class and have completed higher education. This means that I have access to information and resources that shape my understanding of global health organizations. Additionally, my cultural context and personal experience may lead me to have a certain level of confidence in WHO based on their efforts and impact in Egypt. Considering the nuanced phrasing of the question, I would choose option (2) Quite a lot, as I believe in the importance of global health organizations and their role in addressing health issues worldwide. \n\n2"]}, {"persona": {"region": "Damiatta", "sex": "male", "age": 24, "country": "Egypt", "marital_status": "single", "education": "higher", "social_class": "lower middle class"}, "question": {"id": "Q88", "variant": 0}, "response": ["Based on my emic perspective as a single male from Damiatta, Egypt, I understand that my cultural context, individual values, and socioeconomic background heavily influence my perception of the World Health Organization (WHO). In Egypt, there is a level of skepticism towards international organizations and their impact on the local community. Additionally, as someone from the lower middle class, I may have limited access to healthcare and may feel that organizations like WHO do not fully address the needs of people in my socioeconomic position. Furthermore, my age and educational level may lead me to question the effectiveness and relevance of WHO's work in addressing the health concerns of young, educated individuals like myself. Therefore, based on these factors, I would have \"Not very much\" confidence in the World Health Organization (WHO).\n\n3"]}, {"persona": {"region": "Suez", "sex": "male", "age": 41, "country": "Egypt", "marital_status": "married", "education": "middle", "social_class": "working class"}, "question": {"id": "Q88", "variant": 0}, "response": ["Based on my cultural context and socioeconomic background, as a married male from Suez, Egypt, aged 41 and part of the working class, I have limited access to information and resources. My individual values and personal experience lead me to rely on local healthcare providers and traditional remedies. My middle education level has not provided me with extensive knowledge about global health organizations like the World Health Organization. Additionally, the cultural relativism in my community encourages skepticism towards international institutions. Therefore, I would answer:\n3"]}, {"persona": {"region": "Suez", "sex": "female", "age": 39, "country": "Egypt", "marital_status": "divorced", "education": "middle", "social_class": "working class"}, "question": {"id": "Q88", "variant": 0}, "response": ["Based on the anthropological framework, my perspective as a divorced female from Suez, Egypt, who is 39 years old and part of the working class, is shaped by my cultural context, individual values, and socioeconomic background. In my community, there is a strong emphasis on traditional values and skepticism towards international organizations. My personal experience and socioeconomic background have led me to be wary of institutions that are perceived as distant and disconnected from the realities of everyday life in Egypt. Therefore, I have limited confidence in the World Health Organization (WHO) and would choose option (3) Not very much."]}, {"persona": {"region": "Cairo", "sex": "female", "age": 55, "country": "Egypt", "marital_status": "married", "education": "middle", "social_class": "working class"}, "question": {"id": "Q88", "variant": 0}, "response": ["Based on the anthropological framework, my perspective as a married female from Cairo, Egypt, who is 55 years old and part of the working class, is influenced by a combination of factors. My cultural context, including the socioeconomic background and individual values, plays a crucial role in shaping my opinion. Additionally, my personal experiences and the cultural relativism in my society also impact how I view the World Health Organization. Considering these factors, I choose option (3) Not very much, as my confidence in the World Health Organization is influenced by the limited access to healthcare and the challenges I have faced in obtaining adequate medical services in my community."]}, {"persona": {"region": "Cairo", "sex": "male", "age": 58, "country": "Egypt", "marital_status": "married", "education": "middle", "social_class": "lower middle class"}, "question": {"id": "Q88", "variant": 0}, "response": ["Based on my emic perspective as a lower middle class married male from Cairo, Egypt, I have to consider the cultural context in which I live. Egypt has a complex relationship with international organizations, and there is a general mistrust towards them due to historical and political reasons. Additionally, my socioeconomic background as part of the lower middle class means that I may not have the same access to information and resources as those from higher socioeconomic backgrounds. Therefore, I may not have as much confidence in the World Health Organization as someone from a different cultural or socioeconomic background. Additionally, my personal experience and individual values also play a role in shaping my perception of the WHO. \n\n3"]}, {"persona": {"region": "Cairo", "sex": "female", "age": 29, "country": "Egypt", "marital_status": "married", "education": "higher", "social_class": "lower middle class"}, "question": {"id": "Q88", "variant": 0}, "response": ["Based on the anthropological framework, my perspective as a married female from Cairo, Egypt, at 29 years of age and part of the lower middle class, is heavily influenced by my cultural context, individual values, and socioeconomic background. Growing up and living in Cairo, I have been exposed to a variety of cultural influences and have developed a certain level of skepticism towards international organizations. My personal experiences and values also play a role in shaping my opinion. As a member of the lower middle class, I have limited access to information and resources, which may impact my confidence in the World Health Organization. Therefore, my answer to the question would be:\n\n2"]}, {"persona": {"region": "Cairo", "sex": "male", "age": 38, "country": "Egypt", "marital_status": "married", "education": "higher", "social_class": "lower middle class"}, "question": {"id": "Q88", "variant": 0}, "response": ["Based on the anthropological framework, as a married male from Cairo, Egypt, my emic perspective is influenced by the cultural context of my upbringing and the socioeconomic background of being part of the lower middle class. My personal experience and individual values also play a significant role in shaping my perception. Additionally, the cultural relativism in Egypt leads to a nuanced understanding of global organizations like the World Health Organization. Therefore, I believe that my response to the question will be influenced by my age, education, and socio-economic background, as well as my personal experience and cultural context.\n\n2"]}, {"persona": {"region": "Cairo", "sex": "female", "age": 40, "country": "Egypt", "marital_status": "married", "education": "higher", "social_class": "lower middle class"}, "question": {"id": "Q88", "variant": 0}, "response": ["From the perspective of a married female from Cairo, Egypt, who is 40 years old, completed higher education, and considers herself part of the lower middle class, several factors come into play when considering confidence in the World Health Organization (WHO). The cultural context of living in a densely populated city like Cairo, as well as the individual values and personal experience of navigating the Egyptian healthcare system, are important. Additionally, the socioeconomic background as part of the lower middle class may influence perceptions of global health organizations. Cultural relativism is also significant, as the perspective from Cairo may differ from those in other parts of the world. Finally, space and time are important, as experiences and perceptions are shaped by the specific historical and contemporary context of Egypt. \n\n3"]}, {"persona": {"region": "Cairo", "sex": "male", "age": 38, "country": "Egypt", "marital_status": "married", "education": "higher", "social_class": "upper middle class"}, "question": {"id": "Q88", "variant": 0}, "response": ["Based on my emic perspective as a married male from Cairo, Egypt, who is 38 years old, highly educated, and part of the upper middle class, my confidence in the World Health Organization (WHO) is influenced by my cultural context, individual values, and socioeconomic background. As someone who has access to higher education and belongs to the upper middle class, I have been exposed to information and resources that have shaped my understanding and trust in global health organizations like the WHO. Additionally, my cultural context as an Egyptian male has also influenced my perception of international health organizations and their impact on my community. Therefore, I would choose option (2) Quite a lot, as I believe in the expertise and influence of the WHO in addressing global health issues. \n\n2"]}, {"persona": {"region": "Cairo", "sex": "male", "age": 59, "country": "Egypt", "marital_status": "married", "education": "middle", "social_class": "lower middle class"}, "question": {"id": "Q88", "variant": 0}, "response": ["Based on the anthropological framework, my perspective as a married male from Cairo, Egypt, who is 59 years old, completed middle education level, and considers himself part of the lower middle class, is heavily influenced by my cultural context, individual values, and socioeconomic background. In Egypt, there is a widespread skepticism towards international organizations, including the World Health Organization. This skepticism is rooted in historical and political factors, as well as the socioeconomic challenges faced by individuals in my demographic. Additionally, my personal experience and values lead me to question the motivations and effectiveness of international organizations in addressing the health concerns of my community. Therefore, I would choose option (3) Not very much, reflecting my lack of confidence in the World Health Organization.\n\n3"]}, {"persona": {"region": "Cairo", "sex": "female", "age": 30, "country": "Egypt", "marital_status": "married", "education": "higher", "social_class": "upper middle class"}, "question": {"id": "Q88", "variant": 0}, "response": ["Based on my personal experience and socioeconomic background as a married female from Cairo, Egypt, who is 30 years old and part of the upper middle class, I have a high level of confidence in the World Health Organization (WHO). My higher education level and exposure to different cultural contexts have helped me understand the importance of global health initiatives and the role of WHO in addressing public health challenges. Additionally, my cultural relativism perspective allows me to appreciate the diverse efforts and contributions of WHO in different parts of the world. My nuanced understanding of the organization's work and the impact it has on global health further reinforces my strong confidence in WHO.\n\n1"]}, {"persona": {"region": "Cairo", "sex": "male", "age": 22, "country": "Egypt", "marital_status": "single", "education": "middle", "social_class": "lower middle class"}, "question": {"id": "Q88", "variant": 0}, "response": ["Based on the anthropological framework, the emic perspective of a 22-year-old male from Cairo, Egypt, who has completed middle education and considers himself part of the lower middle class, would likely be influenced by his cultural context, individual values, and socioeconomic background. In Egypt, there may be a general lack of trust in international organizations due to historical and political reasons. Additionally, his lower middle-class status and limited education may lead him to have limited exposure to and understanding of the work of the World Health Organization. Therefore, he may not have a great deal of confidence in the WHO due to a combination of cultural context, individual values, and socioeconomic background.\n\n3"]}, {"persona": {"region": "Cairo", "sex": "male", "age": 29, "country": "Egypt", "marital_status": "single", "education": "higher", "social_class": "lower middle class"}, "question": {"id": "Q88", "variant": 0}, "response": ["Based on my emic perspective as a single male from Cairo, Egypt, I am influenced by the cultural context of my country and the socioeconomic background of being part of the lower middle class. My individual values and personal experiences also play a role in forming my opinion. In Egypt, there is a level of skepticism towards international organizations, including the WHO, due to historical and political reasons. Additionally, being in the lower middle class, access to healthcare and information may be more limited, leading to a certain level of distrust. Therefore, I have chosen option 3: Not very much."]}, {"persona": {"region": "Cairo", "sex": "female", "age": 31, "country": "Egypt", "marital_status": "married", "education": "higher", "social_class": "lower middle class"}, "question": {"id": "Q88", "variant": 0}, "response": ["Based on my emic perspective as a married female from Cairo, Egypt, my cultural context, individual values, and personal experience, as well as my socioeconomic background, all play a role in my perception of the World Health Organization (WHO). In my cultural context, there is a general sense of skepticism towards international organizations and their impact on the daily lives of people in Egypt. Additionally, as a lower-middle-class individual who has experienced limited access to quality healthcare, I have not personally benefited from WHO's initiatives. Therefore, I would choose option 3: Not very much. Thank you for understanding my perspective. \n\n3"]}, {"persona": {"region": "Cairo", "sex": "male", "age": 59, "country": "Egypt", "marital_status": "married", "education": "higher", "social_class": "upper middle class"}, "question": {"id": "Q88", "variant": 0}, "response": ["Based on the anthropological framework, my perspective as a married male from Cairo, Egypt, is influenced by my cultural context, individual values, and socioeconomic background. In Egypt, there is a strong sense of respect for authority and expertise, particularly in matters related to health and well-being. As someone who has completed higher education and considers myself part of the upper middle class, I have been exposed to and have access to information that has bolstered my confidence in the expertise of organizations like the World Health Organization. Additionally, my age and socioeconomic background have likely afforded me better access to healthcare and information, further solidifying my trust in the WHO. Therefore, I have a great deal of confidence in the World Health Organization.\n\n1"]}, {"persona": {"region": "Cairo", "sex": "male", "age": 27, "country": "Egypt", "marital_status": "single", "education": "middle", "social_class": "working class"}, "question": {"id": "Q88", "variant": 0}, "response": ["Based on the anthropological framework, my perspective as a single male from Cairo, Egypt at 27 years of age and part of the working class, is heavily influenced by my cultural context, individual values, and socioeconomic background. Living in Cairo, I am exposed to different health challenges and have limited access to healthcare. My personal experience and cultural context also shape my perception of the World Health Organization. Considering the lack of resources and access to healthcare in my community, I have limited confidence in the WHO's ability to address the health needs of people like me. Therefore, my answer is:\n3"]}, {"persona": {"region": "Cairo", "sex": "female", "age": 25, "country": "Egypt", "marital_status": "single", "education": "higher", "social_class": "working class"}, "question": {"id": "Q88", "variant": 0}, "response": ["Based on the anthropological framework, as a single female from Cairo, Egypt, who is 25 years old and part of the working class, my emic perspective is influenced by my cultural context, individual values, and socioeconomic background. Egypt has a complex relationship with international organizations, and the World Health Organization's recommendations may not always align with the specific needs and realities of my community. Additionally, as a working-class individual, I may not have access to the same healthcare resources and information that the WHO promotes. Therefore, my confidence in the WHO may not be as high as someone from a different cultural or socioeconomic background.\n\n3"]}, {"persona": {"region": "Cairo", "sex": "female", "age": 23, "country": "Egypt", "marital_status": "married", "education": "higher", "social_class": "lower middle class"}, "question": {"id": "Q88", "variant": 0}, "response": ["Based on my cultural context and socioeconomic background, as a married female from Cairo, Egypt, I have been raised to value and respect authority and expertise. I have completed higher education and consider myself part of the lower middle class, which means I have access to some information and resources, but I am also aware of the limitations that come with my socioeconomic status. My individual values and personal experiences have shaped my perception of global health organizations like the World Health Organization (WHO). I have a great deal of confidence in the WHO because I believe in the expertise and dedication of the professionals working there. In a country like Egypt, where access to healthcare is limited for many, organizations like the WHO are crucial in addressing public health issues. I also understand the importance of cultural relativism and nuance, and I know that my perspective may differ from others based on their own experiences and backgrounds.\n\n1"]}, {"persona": {"region": "Cairo", "sex": "male", "age": 58, "country": "Egypt", "marital_status": "married", "education": "higher", "social_class": "working class"}, "question": {"id": "Q88", "variant": 0}, "response": ["Based on the anthropological framework, my answer to the question of how much confidence I have in the World Health Organization (WHO) is influenced by my cultural context, individual values and personal experience, socioeconomic background, and space and time. As a married male from Cairo, Egypt, I have lived through various socio-political changes and have experienced firsthand the impact of global health initiatives in my community. My cultural context and personal experience lead me to have quite a lot of confidence in the WHO, as I have witnessed the positive effects of their work in improving public health in my region. Additionally, as a member of the working class with a higher education level, I have been exposed to information and resources that have contributed to my positive perception of the organization.\n\n2"]}, {"persona": {"region": "Cairo", "sex": "female", "age": 40, "country": "Egypt", "marital_status": "married", "education": "higher", "social_class": "working class"}, "question": {"id": "Q88", "variant": 0}, "response": ["Based on the anthropological framework, as a married female from Cairo, Egypt, I bring a unique set of experiences and cultural context to my understanding of the World Health Organization (WHO). As a member of the working class in Egypt, I may have limited access to healthcare and may rely on public health organizations like the WHO for information and resources. Additionally, my age and education level may influence my perception of the organization's credibility and impact. Considering the cultural relativism aspect, I understand that the WHO's effectiveness may be perceived differently in my community compared to others. Therefore, my confidence in the WHO is influenced by my individual values, personal experience, and socioeconomic background.\n\n3"]}, {"persona": {"region": "Cairo", "sex": "female", "age": 36, "country": "Egypt", "marital_status": "married", "education": "middle", "social_class": "upper middle class"}, "question": {"id": "Q88", "variant": 0}, "response": ["Based on the anthropological framework, as a married female from Cairo, Egypt, my emic perspective would be influenced by my cultural context, individual values, and socioeconomic background. In Egypt, there is a strong emphasis on family and community, and trust in institutions like the World Health Organization (WHO) would likely be influenced by personal experiences and individual values. As part of the upper middle class, I may have greater access to information and resources, which could potentially influence my confidence in the WHO. Additionally, my age and educational level may also play a role in shaping my perspective. Therefore, my response to the question would be:\n\n2"]}, {"persona": {"region": "Cairo", "sex": "male", "age": 40, "country": "Egypt", "marital_status": "married", "education": "middle", "social_class": "lower middle class"}, "question": {"id": "Q88", "variant": 0}, "response": ["Based on the anthropological framework, as a married male from Cairo, Egypt, my emic perspective is heavily influenced by the cultural context of my upbringing and my lower middle class socioeconomic background. My personal experience and individual values are also significant factors in my perception. Additionally, the nuances of the question and my age play a role in how I interpret and answer it. Given these factors, I would choose option 2: Quite a lot. The reason for this is that I have grown up with a strong sense of respect for authoritative figures, and the WHO is widely respected in my community for their efforts in addressing public health issues. Additionally, my personal experiences have led me to believe in the importance of global health organizations and their impact on improving healthcare systems worldwide."]}, {"persona": {"region": "Cairo", "sex": "female", "age": 30, "country": "Egypt", "marital_status": "married", "education": "middle", "social_class": "lower class"}, "question": {"id": "Q88", "variant": 0}, "response": ["Based on the anthropological framework, my emic perspective as a lower-class married female from Cairo, Egypt, shapes my understanding and answer to the question about my confidence in the World Health Organization (WHO). My cultural context and socioeconomic background have influenced my perception of global health organizations and their impact on my community. My personal experience and individual values also play a role in shaping my confidence in the WHO. As a member of the lower class, I may have limited access to healthcare resources and rely heavily on international organizations like the WHO. Additionally, my age and place also factor into my understanding and trust in global health institutions. Therefore, my answer is:\n3\n\n(3) Not very much"]}, {"persona": {"region": "Cairo", "sex": "male", "age": 58, "country": "Egypt", "marital_status": "married", "education": "higher", "social_class": "lower middle class"}, "question": {"id": "Q88", "variant": 0}, "response": ["Based on my emic perspective as a married male from Cairo, Egypt, I have grown up in a cultural context where skepticism of international organizations is common. Additionally, my lower middle class socioeconomic background has influenced my views on authority and trust in institutions. I have also had personal experiences with the limitations of healthcare services in my country, which may affect my confidence in international health organizations. Therefore, my answer would be:\n\n3"]}, {"persona": {"region": "Cairo", "sex": "male", "age": 50, "country": "Egypt", "marital_status": "married", "education": "middle", "social_class": "lower middle class"}, "question": {"id": "Q88", "variant": 0}, "response": ["Based on the anthropological framework, as a married male from Cairo, Egypt, age 50, with a middle education level and lower middle class background, my perspective on the World Health Organization (WHO) would be influenced by my cultural context, individual values, and socioeconomic background. In Egypt, access to healthcare and resources may be limited, and the WHO's recommendations and initiatives may not always align with the realities of our healthcare system. Additionally, as someone from a lower middle class background, I may have limited access to information and resources provided by the WHO. Therefore, I would have to consider all these factors when evaluating my confidence in the organization.\n\n3"]}, {"persona": {"region": "Cairo", "sex": "female", "age": 40, "country": "Egypt", "marital_status": "married", "education": "higher", "social_class": "upper middle class"}, "question": {"id": "Q88", "variant": 0}, "response": ["Based on my emic and etic perspective as a married female from Cairo, Egypt, who is 40 years old, completed higher education, and part of the upper middle class, I am influenced by my cultural context, individual values, and personal experience. In Egypt, there is a strong emphasis on education and knowledge, and as someone who has completed higher education, I place a high value on expertise and authority. Additionally, being part of the upper middle class, I have access to resources and information that contribute to my confidence in organizations like the World Health Organization. My cultural relativism also leads me to believe that the WHO is a reputable and valuable institution in the global healthcare landscape. Therefore, I have a great deal of confidence in the World Health Organization.\n\n1"]}, {"persona": {"region": "Cairo", "sex": "female", "age": 33, "country": "Egypt", "marital_status": "married", "education": "middle", "social_class": "lower middle class"}, "question": {"id": "Q88", "variant": 0}, "response": ["Based on my emic perspective as a married female from Cairo, Egypt, I have been influenced by the cultural context in which I live, including the socioeconomic background of being part of the lower middle class and having completed only a middle education level. This has shaped my individual values and personal experience, leading me to have a more skeptical view of international organizations such as the World Health Organization (WHO). Additionally, cultural relativism plays a role in my perception, as there is a general mistrust of international organizations and their ability to truly understand and address the needs of individuals in my community. Therefore, I have not very much confidence in the World Health Organization (WHO).\n\n3"]}, {"persona": {"region": "Cairo", "sex": "female", "age": 37, "country": "Egypt", "marital_status": "married", "education": "middle", "social_class": "lower middle class"}, "question": {"id": "Q88", "variant": 0}, "response": ["Based on my emic perspective as a married woman from Cairo, Egypt, I have grown up in a cultural context where access to healthcare and information about global health organizations like the WHO is limited, especially for someone with my educational background and socioeconomic status. My individual values and personal experiences have led me to have not very much confidence in the WHO, as I have seen firsthand the challenges and limitations in accessing quality healthcare in my community. Additionally, my lower middle class status and the cultural relativism of my background have influenced my lack of confidence in global health organizations. Furthermore, the nuance of the question also plays a role in my answer, as the phrasing of \"how much confidence\" is something I interpret as having limited confidence in the WHO.\n\n3"]}, {"persona": {"region": "Cairo", "sex": "male", "age": 28, "country": "Egypt", "marital_status": "married", "education": "middle", "social_class": "lower middle class"}, "question": {"id": "Q88", "variant": 0}, "response": ["Based on the anthropological framework, I, as a married male from Cairo, Egypt, consider the emic perspective to be very important in forming my opinion about the World Health Organization (WHO). The cultural context in which I live, with its unique language, social and economic conditions, and personal experiences, greatly influences my perception of the WHO. Additionally, my lower middle class socioeconomic background and middle education level play a significant role in shaping my trust in global health organizations. Therefore, my confidence in the WHO is likely to be influenced by these factors, leading me to select the option that best represents my perspective.\n\n3"]}, {"persona": {"region": "Cairo", "sex": "male", "age": 53, "country": "Egypt", "marital_status": "married", "education": "higher", "social_class": "working class"}, "question": {"id": "Q88", "variant": 0}, "response": ["Based on the anthropological framework, my perspective as a married male from Cairo, Egypt, who is 53 years old and part of the working class is shaped by my cultural context, individual values, personal experience, and socioeconomic background. In Egypt, there is a deep sense of skepticism towards international organizations and their recommendations due to historical and political reasons. Additionally, as a working-class individual, I may not have had much exposure to the WHO's work and may rely more on local healthcare providers for information and support. Therefore, I would have limited confidence in the World Health Organization. \n\n3"]}, {"persona": {"region": "Cairo", "sex": "male", "age": 45, "country": "Egypt", "marital_status": "married", "education": "higher", "social_class": "lower middle class"}, "question": {"id": "Q88", "variant": 0}, "response": ["From the perspective of a married male from Cairo, Egypt, who is 45 years old, has completed higher education, and considers himself part of the lower middle class, several factors play a role in shaping my confidence in the World Health Organization (WHO). Firstly, the cultural context in Egypt, as well as my personal experience, would influence my perception of the WHO. Additionally, my socioeconomic background and location in Cairo would also impact my trust in the organization. Moreover, as someone with a higher education level, I am likely to have a nuanced understanding of global health issues. Therefore, based on my background and understanding, I would choose the following option:\n\n2"]}, {"persona": {"region": "Cairo", "sex": "male", "age": 52, "country": "Egypt", "marital_status": "married", "education": "middle", "social_class": "upper middle class"}, "question": {"id": "Q88", "variant": 0}, "response": ["Based on my emic perspective as a married male from Cairo, Egypt, with a middle education level and part of the upper middle class, I have been influenced by the cultural context of my upbringing and socioeconomic background. The cultural context in Egypt has led me to have a high level of respect for authority and expertise, and the WHO is seen as a respected global organization. My individual values and personal experience also play a role in my perception, and I have personally benefitted from the WHO's work in providing healthcare information and support. Additionally, cultural relativism is important to consider, as my background has taught me to value international cooperation and rely on global organizations for guidance. Therefore, I have a great deal of confidence in the World Health Organization.\n\n1"]}, {"persona": {"region": "Cairo", "sex": "male", "age": 22, "country": "Egypt", "marital_status": "single", "education": "higher", "social_class": "lower middle class"}, "question": {"id": "Q88", "variant": 0}, "response": ["As a single male from Cairo, Egypt, I am heavily influenced by my cultural context, socioeconomic background, and personal experience. Growing up in a lower middle class family in Cairo, I have seen firsthand the challenges and disparities in the healthcare system. My cultural context also shapes my understanding of the World Health Organization (WHO) as I am aware of the varying access to healthcare and resources in different parts of the world. Additionally, my individual values and personal experience have led me to be somewhat skeptical of large international organizations, particularly in the field of healthcare. Therefore, I would answer the question with option (3) Not very much, as I have reservations about the effectiveness and impact of the WHO in addressing the healthcare needs of people like me in Cairo."]}, {"persona": {"region": "Cairo", "sex": "female", "age": 57, "country": "Egypt", "marital_status": "divorced", "education": "middle", "social_class": "lower middle class"}, "question": {"id": "Q88", "variant": 0}, "response": ["Based on my emic perspective as a divorced female from Cairo, Egypt, with a middle education level and lower middle-class status, my cultural context and personal experience shape my understanding of the World Health Organization (WHO). In the cultural context of Egypt, there is a general trust in international organizations such as the WHO for providing guidance on health issues. However, due to my lower middle-class status, I may have limited access to healthcare resources and may not have personally benefited from the WHO's initiatives. Additionally, the socioeconomic background and lack of formal education may lead to a certain level of skepticism towards international organizations. Therefore, my confidence in the WHO may not be as high as someone from a higher socioeconomic status or with higher education. \n\n3"]}, {"persona": {"region": "Cairo", "sex": "female", "age": 42, "country": "Egypt", "marital_status": "married", "education": "middle", "social_class": "working class"}, "question": {"id": "Q88", "variant": 0}, "response": ["Based on the anthropological framework, as a married female from Cairo, Egypt, I would consider the emic perspective of my community's trust in the World Health Organization (WHO) to be influenced by cultural context, individual values, and socioeconomic background. In Egypt, there is a strong sense of collectivism and trust in authoritative figures, including international organizations like the WHO. My personal experience and values as a working-class woman in Cairo also lead me to trust the expertise and guidance provided by the WHO in matters related to health. Additionally, the socioeconomic background of the working class in Egypt often leads to reliance on international organizations for health-related information and support. Therefore, I would have a great deal of confidence in the World Health Organization.\n\n4"]}, {"persona": {"region": "Cairo", "sex": "female", "age": 23, "country": "Egypt", "marital_status": "single", "education": "middle", "social_class": "lower middle class"}, "question": {"id": "Q88", "variant": 0}, "response": ["Based on the anthropological framework, as a single female from Cairo, Egypt, who is 23 years old and part of the lower middle class, my perspective is heavily influenced by my cultural context, individual values, and socioeconomic background. In Egypt, there is a strong emphasis on family and community, and trust in institutions like the World Health Organization (WHO) may be influenced by personal experiences with healthcare and government systems. Additionally, as a member of the lower middle class, access to quality healthcare and information from international organizations like WHO may be limited. Therefore, my confidence in the WHO may be influenced by these factors, leading me to select the option that best reflects my perspective.\n\n3"]}, {"persona": {"region": "Cairo", "sex": "female", "age": 28, "country": "Egypt", "marital_status": "married", "education": "higher", "social_class": "upper middle class"}, "question": {"id": "Q88", "variant": 0}, "response": ["Based on the anthropological framework, I, as a married female from Cairo, Egypt, would approach the question of confidence in the World Health Organization (WHO) from a cultural context perspective. Egypt has a strong historical and cultural connection to the field of medicine and healthcare, with a long tradition of medical knowledge and practices. My higher education level also means that I am likely to have a more nuanced understanding of global health organizations and their work. Additionally, being part of the upper middle class, I may be more likely to have access to information and resources that shape my perception of the WHO. Therefore, considering all these factors, I would choose the following option:\n\n2"]}, {"persona": {"region": "Cairo", "sex": "female", "age": 22, "country": "Egypt", "marital_status": "single", "education": "higher", "social_class": "lower middle class"}, "question": {"id": "Q88", "variant": 0}, "response": ["Based on the anthropological framework, as a single female from Cairo, Egypt, my emic perspective is influenced by my cultural context, individual values, and socioeconomic background. In Egypt, there is a strong emphasis on family and community, and as a lower middle-class individual, access to healthcare and trust in international organizations like the WHO may be limited. Additionally, my personal experience and education level have taught me to critically analyze information and consider the potential biases of global institutions. Therefore, I would choose option (3) Not very much, as my background and experiences lead me to have some skepticism towards the WHO. \n\n3"]}, {"persona": {"region": "Cairo", "sex": "female", "age": 39, "country": "Egypt", "marital_status": "married", "education": "middle", "social_class": "lower middle class"}, "question": {"id": "Q88", "variant": 0}, "response": ["From the anthropological perspective, my emic and etic perspectives as a married female from Cairo, Egypt, and my lower middle class socioeconomic background greatly influence my perception of the World Health Organization (WHO). In my cultural context, the WHO may not have a strong presence or impact on my daily life, and I may rely more on local health systems and practices. My individual values and personal experiences also play a role, as my middle education level may lead me to have limited exposure to international health organizations. Additionally, cultural relativism reminds me that my perspective may differ from others around the world who have different experiences with the WHO. Therefore, my answer is:\n\n3"]}, {"persona": {"region": "Cairo", "sex": "male", "age": 19, "country": "Egypt", "marital_status": "single", "education": "middle", "social_class": "working class"}, "question": {"id": "Q88", "variant": 0}, "response": ["Based on the anthropological framework, my perspective as a 19-year-old male from Cairo, Egypt, who has completed middle education and considers myself part of the working class, is heavily influenced by my cultural context, socioeconomic background, and personal experience. In Egypt, there is a general distrust of government and international organizations, and as a member of the working class, I may have limited access to information and resources that would allow me to have a great deal of confidence in the WHO. Additionally, my age and education level may also play a role in my perspective. Therefore, I would say I have not very much confidence in the World Health Organization (WHO).\n\n3"]}, {"persona": {"region": "Cairo", "sex": "female", "age": 54, "country": "Egypt", "marital_status": "married", "education": "middle", "social_class": "working class"}, "question": {"id": "Q88", "variant": 0}, "response": ["As a married female from Cairo, Egypt, my perspective on the World Health Organization (WHO) would be heavily influenced by my cultural context, individual values, and socioeconomic background. In Egypt, there is a strong sense of community and reliance on local healthcare providers, so my confidence in global health organizations like the WHO may not be as high as someone from a more developed country. Additionally, my working-class background and limited education may also lead me to have a more skeptical view of global health organizations. Therefore, my answer would reflect a combination of cultural relativism, individual values, and socioeconomic background, leading me to choose option (3) Not very much. \n\n3"]}, {"persona": {"region": "Cairo", "sex": "male", "age": 30, "country": "Egypt", "marital_status": "married", "education": "higher", "social_class": "working class"}, "question": {"id": "Q88", "variant": 0}, "response": ["Based on the anthropological framework, my emic perspective as a married male from Cairo, Egypt, would be influenced by the cultural context of Egypt and the Middle East region, where there may be skepticism towards international organizations due to historical and political reasons. Additionally, my individual values and personal experience as a working-class individual who has completed higher education may lead me to question the influence and effectiveness of international organizations like the WHO in addressing the healthcare needs of my community. Furthermore, my socioeconomic background as a working-class individual may also contribute to my skepticism towards international organizations that may be perceived as serving the interests of more affluent nations. Therefore, my answer would be:\n3\n\nNot very much"]}, {"persona": {"region": "Cairo", "sex": "male", "age": 39, "country": "Egypt", "marital_status": "married", "education": "higher", "social_class": "lower middle class"}, "question": {"id": "Q88", "variant": 0}, "response": ["Based on the anthropological framework, my perspective as a married, 39-year-old male from Cairo, Egypt with a lower middle class socioeconomic background is influenced by cultural context, individual values and personal experience, and space and time. In Egypt, there is a strong emphasis on community and family values, and personal experience has likely shaped my perception of institutions such as the World Health Organization. Additionally, my socioeconomic background may influence my access to information and resources. Therefore, my answer may differ from others based on these factors. \n\n2"]}, {"persona": {"region": "Cairo", "sex": "female", "age": 41, "country": "Egypt", "marital_status": "married", "education": "middle", "social_class": "lower middle class"}, "question": {"id": "Q88", "variant": 0}, "response": ["Based on the anthropological framework, as a married female from Cairo, Egypt, who is 41 years old and part of the lower middle class, my perspective on the World Health Organization (WHO) is influenced by my cultural context, individual values, and socioeconomic background. In Egypt, there is a strong sense of community and trust in institutions. Additionally, my socioeconomic background may lead me to have limited access to information and resources, which could affect my confidence in the WHO. Furthermore, my personal experience with healthcare and the impact of global health policies on my community will also influence my opinion. Therefore, I would choose option 2: Quite a lot, because I trust in the expertise and efforts of the WHO in addressing global health issues."]}, {"persona": {"region": "Cairo", "sex": "male", "age": 45, "country": "Syria", "marital_status": "single", "education": "higher", "social_class": "upper middle class"}, "question": {"id": "Q88", "variant": 0}, "response": ["Based on the anthropological framework, as a single male from Cairo, Syria, my emic perspective on the World Health Organization (WHO) is influenced by my cultural context, individual values, and socioeconomic background. Living in a country with complex political and social dynamics, I have seen the impact of global health organizations on different communities. My higher education level has also provided me with a broader understanding of global health issues and the role of organizations like the WHO. As a member of the upper middle class, I have access to information and resources that may influence my perception of the WHO. Therefore, I have quite a lot of confidence in the World Health Organization (WHO).\n\n2"]}, {"persona": {"region": "Cairo", "sex": "male", "age": 54, "country": "Egypt", "marital_status": "married", "education": "higher", "social_class": "lower middle class"}, "question": {"id": "Q88", "variant": 0}, "response": ["Based on the anthropological framework, as a married male from Cairo, Egypt, my emic perspective on the World Health Organization (WHO) is influenced by my cultural context, individual values, and socioeconomic background. In Egypt, there is a general respect for international organizations such as the WHO, as they provide valuable support and resources for public health initiatives. As someone who completed higher education and considers myself part of the lower middle class, I am aware of the importance of global health efforts and the impact they can have on my community. Additionally, my age and personal experiences have shaped my understanding of the WHO's role in addressing public health issues. Therefore, my confidence in the World Health Organization is quite a lot.\n\n2"]}, {"persona": {"region": "Cairo", "sex": "male", "age": 65, "country": "Egypt", "marital_status": "married", "education": "middle", "social_class": "upper middle class"}, "question": {"id": "Q88", "variant": 0}, "response": ["Based on my emic perspective as a married male from Cairo, Egypt, I have grown up in a culture where respect for authority and expertise is highly valued. The cultural context in which I live also places a strong emphasis on education and knowledge, so I am likely to have a high level of confidence in the World Health Organization (WHO) due to their expertise in global health issues. Additionally, my upper middle class socioeconomic background has likely afforded me access to information and resources that have allowed me to form a positive opinion of the WHO. My age and life experience have also likely shaped my perception of the organization, as I have witnessed the positive impact of their work over the years. Therefore, I would have a great deal of confidence in the World Health Organization (WHO).\n\n1"]}, {"persona": {"region": "Cairo", "sex": "female", "age": 52, "country": "Egypt", "marital_status": "married", "education": "middle", "social_class": "upper middle class"}, "question": {"id": "Q88", "variant": 0}, "response": ["Based on the anthropological framework, my perspective as a married female from Cairo, Egypt, who is 52 years old, completed middle education level, and considers myself part of the upper middle class, is shaped by my cultural context, individual values, and personal experience. In Egypt, there is a strong emphasis on education and a respect for authority. As someone from a middle-class background, I have been taught to value institutions like the World Health Organization (WHO) and have confidence in their expertise. Additionally, my age and socioeconomic background also play a role in my perception of the WHO. Therefore, my answer to the question would be:\n\n2"]}, {"persona": {"region": "Cairo", "sex": "male", "age": 26, "country": "Egypt", "marital_status": "single", "education": "higher", "social_class": "lower middle class"}, "question": {"id": "Q88", "variant": 0}, "response": ["Based on the anthropological framework, as a 26-year-old male from Cairo, Egypt, who comes from the lower middle class, my perspective on the World Health Organization (WHO) would be influenced by my cultural context, socioeconomic background, and personal experience. Living in a densely populated city, I have witnessed firsthand the impact of health issues on my community. My family's socioeconomic status also means that we have limited access to quality healthcare. Therefore, I have a moderate amount of confidence in the WHO, as I believe they are doing important work, but I also recognize the limitations and challenges they face in addressing the health needs of people in my community and similar communities worldwide.\n\n3"]}, {"persona": {"region": "Cairo", "sex": "male", "age": 32, "country": "Egypt", "marital_status": "married", "education": "middle", "social_class": "working class"}, "question": {"id": "Q88", "variant": 0}, "response": ["Based on the anthropological framework, as a married male from Cairo, Egypt, with a middle education level and part of the working class, my emic perspective is shaped by my cultural context, individual values, and socioeconomic background. In Egypt, there is a general skepticism towards international organizations, including the World Health Organization (WHO), due to historical and political reasons. Additionally, my socioeconomic background as a working-class individual may influence my perception of the WHO, as I may not have direct access to the resources and information provided by the organization. Therefore, I would have \"Not very much\" confidence in the World Health Organization.\n\n3"]}, {"persona": {"region": "Cairo", "sex": "male", "age": 38, "country": "Egypt", "marital_status": "married", "education": "middle", "social_class": "lower middle class"}, "question": {"id": "Q88", "variant": 0}, "response": ["From the perspective of a married male from Cairo, Egypt, the cultural context and socioeconomic background play a significant role in shaping my confidence in the World Health Organization (WHO). Egypt has a complex healthcare system and access to high-quality healthcare can be limited for those in the lower middle class. Additionally, there is a strong belief in traditional medicine and skepticism towards international organizations. The emic perspective of this persona would view the WHO with skepticism, as it may not align with their cultural beliefs and experiences with the healthcare system. Based on this, I choose option 3: Not very much."]}, {"persona": {"region": "Cairo", "sex": "male", "age": 58, "country": "Egypt", "marital_status": "married", "education": "higher", "social_class": "upper middle class"}, "question": {"id": "Q88", "variant": 0}, "response": ["Based on my emic perspective as a married male from Cairo, Egypt, I understand the importance of cultural context and individual values in answering this question. In my cultural context, the World Health Organization has played a significant role in providing guidance and support to the healthcare system in Egypt. Personally, I value the expertise and global reach of the WHO, and I have confidence in their ability to address health issues effectively. Additionally, my socioeconomic background as part of the upper middle class has allowed me to access and benefit from the resources and recommendations provided by the WHO. Therefore, I have a great deal of confidence in the World Health Organization.\n\n1"]}, {"persona": {"region": "Cairo", "sex": "male", "age": 49, "country": "Egypt", "marital_status": "married", "education": "middle", "social_class": "lower middle class"}, "question": {"id": "Q88", "variant": 0}, "response": ["From the anthropological perspective, my emic understanding as a married male from Cairo, Egypt, who is 49 years old, completed middle education, and considers himself part of the lower middle class, is influenced by my cultural context, individual values, and socioeconomic background. In my cultural context, there is a significant level of skepticism and mistrust towards international organizations, including the World Health Organization, due to historical and political factors. My personal experience and values also play a role in shaping my perception, as I have witnessed the challenges and limitations of healthcare in my community. Additionally, my socioeconomic background as a lower middle-class individual influences my perception as I may not have direct access to the benefits of the WHO's work. Therefore, my perspective on the World Health Organization is likely to be one of not having very much confidence in it.\n\n3"]}, {"persona": {"region": "Cairo", "sex": "female", "age": 29, "country": "Egypt", "marital_status": "married", "education": "middle", "social_class": "working class"}, "question": {"id": "Q88", "variant": 0}, "response": ["Based on the anthropological framework, as a married female from Cairo, Egypt, who is 29 years old and part of the working class, my answer to the question about confidence in the World Health Organization (WHO) is influenced by my cultural context, individual values, personal experience, and socioeconomic background. In Egypt, access to healthcare and reliable health information may be limited, especially for those in the working class. Additionally, personal experience and socioeconomic background may lead to skepticism towards international organizations like the WHO. Given these factors, my confidence in the WHO is not very much. \n\n3"]}, {"persona": {"region": "Cairo", "sex": "female", "age": 36, "country": "Egypt", "marital_status": "married", "education": "higher", "social_class": "lower middle class"}, "question": {"id": "Q88", "variant": 0}, "response": ["Based on the anthropological framework, my emic perspective as a married woman from Cairo, Egypt, is heavily influenced by the cultural context and socioeconomic background. In Egypt, access to healthcare is often limited for those in the lower middle class, and there are widespread disparities in healthcare provision. Additionally, the cultural context of Egypt shapes my understanding of healthcare and the role of organizations like the WHO. As a result, my individual values and personal experiences lead me to have not very much confidence in the World Health Organization. This is due to the challenges and limitations I have personally faced in accessing healthcare, as well as the general skepticism towards international organizations' ability to address the specific needs and realities of healthcare in Egypt. \n\n3"]}, {"persona": {"region": "Cairo", "sex": "female", "age": 34, "country": "Egypt", "marital_status": "married", "education": "middle", "social_class": "lower middle class"}, "question": {"id": "Q88", "variant": 0}, "response": ["Based on my emic perspective as a married female from Cairo, Egypt, my cultural context influences my understanding of the World Health Organization. I have limited access to information and resources, and my socioeconomic background plays a significant role in shaping my beliefs and values. I also consider the cultural relativism in my understanding, as my experiences and individual values have led me to have limited confidence in the World Health Organization. Therefore, my answer to the question \"How much confidence do you have in the World Health Organization (WHO)?\" is: 3\n\n3"]}, {"persona": {"region": "Fayoum", "sex": "male", "age": 57, "country": "Egypt", "marital_status": "married", "education": "middle", "social_class": "working class"}, "question": {"id": "Q88", "variant": 0}, "response": ["From the perspective of a married male from Fayoum, Egypt, with a middle education level and part of the working class, my answer to the question of how much confidence I have in the World Health Organization (WHO) is influenced by several factors. Firstly, my cultural context and socioeconomic background play a significant role in shaping my perspective. As a member of the working class in Egypt, I have limited access to healthcare and may have experienced challenges in receiving adequate medical care. This may lead me to have less confidence in global health organizations such as the WHO. Additionally, my individual values and personal experiences also influence my perception. Given my age and socio-economic status, I may have witnessed instances where WHO initiatives did not directly benefit me or my community, impacting my level of confidence in the organization. Lastly, the nuanced phrasing of the question also plays a role in my response. For these reasons, my answer is (3) Not very much."]}, {"persona": {"region": "Fayoum", "sex": "male", "age": 60, "country": "Egypt", "marital_status": "married", "education": "middle", "social_class": "lower middle class"}, "question": {"id": "Q88", "variant": 0}, "response": ["Based on the anthropological framework, my perspective is shaped by my cultural context, individual values, and socioeconomic background. As a married male from Fayoum, Egypt, I am influenced by the cultural and socioeconomic factors that shape my worldview. My age and education level also play a role in how I perceive institutions like the World Health Organization. Considering these factors, I would choose the option \"Quite a lot\" because I have a moderate level of confidence in the WHO due to my exposure to healthcare services and government initiatives."]}, {"persona": {"region": "Fayoum", "sex": "male", "age": 21, "country": "Egypt", "marital_status": "single", "education": "middle", "social_class": "lower middle class"}, "question": {"id": "Q88", "variant": 0}, "response": ["Based on my emic perspective as a single male from Fayoum, Egypt, my cultural context and socioeconomic background greatly influence my confidence in the World Health Organization (WHO). My personal experience and individual values also play a crucial role in forming my opinion. Considering the nuances of the question, I would say that I have \"quite a lot\" of confidence in the WHO. \n\n2"]}, {"persona": {"region": "Fayoum", "sex": "male", "age": 33, "country": "Egypt", "marital_status": "single", "education": "higher", "social_class": "working class"}, "question": {"id": "Q88", "variant": 0}, "response": ["From the perspective of a 33-year-old single male from Fayoum, Egypt who considers himself part of the working class, the answer to the question of confidence in the World Health Organization (WHO) will be influenced by several factors. The cultural context of Egypt and the socioeconomic background of being part of the working class will shape his perception of the WHO. Additionally, his personal experience and individual values will play a role in his level of confidence in the organization. As someone who has completed higher education, he may have a nuanced understanding of global health issues and the role of international organizations like the WHO. Overall, his answer will be a subjective one, influenced by a combination of cultural, socioeconomic, and personal factors.\n\n2"]}, {"persona": {"region": "Fayoum", "sex": "male", "age": 32, "country": "Egypt", "marital_status": "married", "education": "higher", "social_class": "lower middle class"}, "question": {"id": "Q88", "variant": 0}, "response": ["From the emic perspective, as a married male from Fayoum, Egypt, my understanding and confidence in the World Health Organization (WHO) would be influenced by the cultural context and cultural relativism. In Egypt, there is a strong emphasis on community and family ties, and the influence of traditional medicine and religious beliefs on health practices is significant. Additionally, the socioeconomic background also plays a role as lower middle-class individuals may have limited access to healthcare resources and may rely more on local and traditional healthcare practices. Given this cultural and socioeconomic context, I would likely have not very much confidence in the WHO as their recommendations and interventions may not always align with the local health practices and may not directly benefit individuals in my community. \n\n3"]}, {"persona": {"region": "Gharbia", "sex": "male", "age": 42, "country": "Egypt", "marital_status": "married", "education": "higher", "social_class": "upper middle class"}, "question": {"id": "Q88", "variant": 0}, "response": ["Based on my emic perspective as a married male from Gharbia, Egypt, and considering my age, education level, and socioeconomic background, I have a high level of confidence in the World Health Organization (WHO). My cultural context and personal experience have shaped my understanding of the importance of global health organizations in addressing public health issues, and I value the expertise and resources that the WHO provides. Additionally, my socioeconomic background and access to education have likely exposed me to information and knowledge that reinforce the credibility and effectiveness of the WHO in addressing health concerns on a global scale.\n\n2"]}, {"persona": {"region": "Gharbia", "sex": "male", "age": 52, "country": "Egypt", "marital_status": "married", "education": "middle", "social_class": "working class"}, "question": {"id": "Q88", "variant": 0}, "response": ["Based on the anthropological framework, as a married male from Gharbia, Egypt, who is 52 years old and part of the working class, my perspective on the World Health Organization (WHO) will be influenced by my cultural context, individual values, and socioeconomic background. In Gharbia, there may be limited access to healthcare and a reliance on traditional remedies, which could impact my confidence in the WHO. Additionally, my socioeconomic background as a working-class individual may mean that I have limited resources to access healthcare and may feel disconnected from global health initiatives. Therefore, I would choose option 3: Not very much. \n\n3"]}, {"persona": {"region": "Gharbia", "sex": "male", "age": 45, "country": "Egypt", "marital_status": "divorced", "education": "higher", "social_class": "upper middle class"}, "question": {"id": "Q88", "variant": 0}, "response": ["From the perspective of a divorced male from Gharbia, Egypt, who is 45 years old, has completed higher education, and considers himself part of the upper middle class, several factors would influence my answer to the question. Firstly, my cultural context and individual values would shape my perception of the World Health Organization (WHO). Growing up in Egypt and being part of the middle class, I may have had limited interactions with WHO and its initiatives, which could lead to a lack of confidence in their work. Additionally, my socioeconomic background and educational level may lead me to question the effectiveness and impact of WHO in addressing health issues in my community. Therefore, my answer would be influenced by a combination of cultural context, individual values, and socioeconomic background.\n\n3"]}, {"persona": {"region": "Behaira", "sex": "male", "age": 23, "country": "Egypt", "marital_status": "single", "education": "middle", "social_class": "lower class"}, "question": {"id": "Q88", "variant": 0}, "response": ["Based on my emic perspective as a lower-class, 23-year-old male from Behaira, Egypt, my confidence in the World Health Organization (WHO) is influenced by my cultural context, individual values, and personal experiences. As someone from a lower socioeconomic background, I have limited access to healthcare and information about global health organizations. Additionally, my personal experiences have shown me that the WHO's efforts may not directly impact my community. Therefore, I have limited confidence in the WHO's ability to address the health concerns of individuals in my social and economic position.\n\n3"]}, {"persona": {"region": "Behaira", "sex": "male", "age": 38, "country": "Egypt", "marital_status": "single", "education": "higher", "social_class": "lower class"}, "question": {"id": "Q88", "variant": 0}, "response": ["Based on the anthropological framework, my perspective as a 38-year-old single male from Behaira, Egypt, who considers himself part of the lower class, is heavily influenced by my cultural context, individual values, and personal experience. Being from a lower socioeconomic background, I have limited access to healthcare and rely heavily on public health organizations like the WHO for information and support. However, due to my individual experience and the cultural context of mistrust towards authority and institutions, I may not have a great deal of confidence in the WHO. Additionally, the nuance of the question and the phrasing of the options may also influence my response. \n3"]}, {"persona": {"region": "Behaira", "sex": "male", "age": 32, "country": "Egypt", "marital_status": "married", "education": "middle", "social_class": "lower class"}, "question": {"id": "Q88", "variant": 0}, "response": ["Based on the anthropological framework, my answer to the question of how much confidence I have in the World Health Organization (WHO) will be influenced by several factors. As a married male from Behaira, Egypt, my emic perspective and cultural context will play a significant role in shaping my views. Additionally, my lower socioeconomic background and middle education level will influence my perception of global health organizations. Considering these factors, I would choose option 3: Not very much. This is because my personal experience and cultural context may lead me to have reservations about the effectiveness and reliability of global health organizations in addressing the healthcare needs of people in my community and similar communities around the world."]}, {"persona": {"region": "Behaira", "sex": "female", "age": 37, "country": "Egypt", "marital_status": "married", "education": "middle", "social_class": "working class"}, "question": {"id": "Q88", "variant": 0}, "response": ["Based on my emic perspective as a married female from Behaira, Egypt, my cultural context, individual values, and personal experience all inform my understanding and confidence in the World Health Organization (WHO). My socioeconomic background as part of the working class also plays a role in shaping my perceptions. Additionally, the nuance of the question and the space and time in which I exist influence my answer. Considering these factors, I have quite a lot of confidence in the World Health Organization (WHO) because they have provided valuable resources and information about health issues that affect my community and have contributed to improving public health on a global scale.\n\n2"]}, {"persona": {"region": "Behaira", "sex": "male", "age": 48, "country": "Egypt", "marital_status": "married", "education": "middle", "social_class": "working class"}, "question": {"id": "Q88", "variant": 0}, "response": ["Based on the anthropological framework, as a married male from Behaira, Egypt, I would approach the question of confidence in the World Health Organization (WHO) by considering my cultural context, individual values, and socioeconomic background. Behaira is a predominantly rural area in Egypt, and as a working-class individual with a middle education level, I may have limited access to information and resources. Additionally, my personal experiences and values may influence my perception of global organizations like the WHO. Given these factors, I would likely have limited confidence in the WHO, as I may not have had direct interactions with or benefitted from their initiatives. Therefore, my response would be: (3) Not very much"]}, {"persona": {"region": "Behaira", "sex": "female", "age": 34, "country": "Egypt", "marital_status": "married", "education": "middle", "social_class": "lower class"}, "question": {"id": "Q88", "variant": 0}, "response": ["Based on my emic perspective as a married woman from Behaira, Egypt, my cultural context and lower socioeconomic background heavily influence my views. I have limited access to education and resources, and my personal experiences and values have shaped my understanding of the world. The World Health Organization is an institution that I have heard of but do not have much confidence in, as I have not personally benefitted from their work. In my community, there is a lack of access to proper healthcare and resources, so I do not have a great deal of confidence in the WHO. My nuanced understanding of the question leads me to choose option (3) Not very much.\n\n3"]}, {"persona": {"region": "Behaira", "sex": "female", "age": 30, "country": "Egypt", "marital_status": "divorced", "education": "lower", "social_class": "lower class"}, "question": {"id": "Q88", "variant": 0}, "response": ["Based on my emic perspective as a divorced female from Behaira, Egypt, I have to consider the cultural context, individual values, and socioeconomic background. In my community, lower education level and lower class status often lead to limited access to information and resources. This may result in a lack of confidence in organizations like the World Health Organization, as their information and recommendations may not always be easily accessible or applicable to my personal circumstances. Additionally, cultural relativism is important to consider, as there may be skepticism towards Western-dominated global organizations. Therefore, my answer is (3) Not very much."]}, {"persona": {"region": "Behaira", "sex": "male", "age": 40, "country": "Egypt", "marital_status": "married", "education": "higher", "social_class": "lower middle class"}, "question": {"id": "Q88", "variant": 0}, "response": ["Based on my emic perspective as a married male from Behaira, Egypt, I have been influenced by the cultural context of my community and country. Egypt has a history of mistrust in government and international organizations due to political instability and corruption. My individual values and personal experience also play a role in my perception. As a member of the lower middle class, I have limited access to healthcare and have seen firsthand the challenges in accessing quality medical services. Additionally, my socioeconomic background has shaped my understanding of the world and has led me to be more skeptical of global health organizations. Therefore, I would choose option 3: Not very much, as I have limited confidence in the WHO based on my personal experiences and cultural context.\n\n3"]}, {"persona": {"region": "Behaira", "sex": "male", "age": 38, "country": "Egypt", "marital_status": "married", "education": "middle", "social_class": "working class"}, "question": {"id": "Q88", "variant": 0}, "response": ["Based on the anthropological framework, as a married male from Behaira, Egypt, my emic perspective is influenced by my cultural context, individual values, and personal experience. In Egypt, the cultural context and socioeconomic background play a significant role in shaping attitudes towards international organizations such as the World Health Organization. As a working-class individual with a middle education level, my personal experience and exposure to information may not be as extensive as those in higher socioeconomic classes. Additionally, my cultural relativism may lead me to view international organizations with skepticism, as there may be a perception that they do not fully understand or address the needs of my community. Therefore, my confidence in the World Health Organization would likely be not very much (3).\n\n3"]}, {"persona": {"region": "Behaira", "sex": "female", "age": 30, "country": "Egypt", "marital_status": "married", "education": "higher", "social_class": "lower class"}, "question": {"id": "Q88", "variant": 0}, "response": ["Based on the anthropological framework, my emic perspective as a married female from Behaira, Egypt, who is 30 years old and part of the lower class, is influenced by my cultural context, individual values, and socioeconomic background. In my cultural context, there may be a lack of access to reliable healthcare and information, which could affect my confidence in the WHO. Additionally, my lower socioeconomic background may impact my trust in global health organizations. Therefore, I would select option (3) Not very much, as my personal experience and cultural context lead me to have limited confidence in the WHO. \n\n3"]}, {"persona": {"region": "Behaira", "sex": "female", "age": 35, "country": "Egypt", "marital_status": "married", "education": "middle", "social_class": "working class"}, "question": {"id": "Q88", "variant": 0}, "response": ["Based on the anthropological framework, my emic perspective as a married female from Behaira, Egypt, would be influenced by my cultural context, individual values, and socioeconomic background. In Egypt, there is a high value placed on family and community, and I have personally seen the impact of healthcare on my family and friends. As someone from the working class, I have limited access to healthcare and rely heavily on organizations like the WHO for guidance and support. Therefore, I have quite a lot of confidence in the World Health Organization (WHO) as they have provided important information and resources for healthcare in my community.\n\n2"]}, {"persona": {"region": "Behaira", "sex": "male", "age": 52, "country": "Egypt", "marital_status": "married", "education": "middle", "social_class": "lower class"}, "question": {"id": "Q88", "variant": 0}, "response": ["Based on my cultural context and socioeconomic background, I have limited access to information and resources. I come from a lower-class family in Behaira, Egypt, and have only completed middle education level. This means that I may not have had the opportunity to fully understand the role and impact of the World Health Organization (WHO). Additionally, cultural relativism teaches me that my perspective may differ from others due to my limited exposure and access to information. Therefore, I may not have a great deal of confidence in the WHO because of my limited understanding and access to information.\n\n3"]}, {"persona": {"region": "Alexandria", "sex": "female", "age": 41, "country": "Egypt", "marital_status": "single", "education": "middle", "social_class": "lower class"}, "question": {"id": "Q88", "variant": 0}, "response": ["From the perspective of a single female from Alexandria, Egypt, who is 41 years old, has completed middle education, and considers herself part of the lower class, my answer is influenced by my cultural context, individual values, and socioeconomic background. In Egypt, access to healthcare and information about health organizations may be limited, especially for those in the lower class. Additionally, personal experiences and values may lead me to have less confidence in international organizations like the World Health Organization. Given these factors, I would choose option (3) Not very much."]}, {"persona": {"region": "Alexandria", "sex": "female", "age": 21, "country": "Egypt", "marital_status": "single", "education": "middle", "social_class": "lower class"}, "question": {"id": "Q88", "variant": 0}, "response": ["Based on my individual values and personal experience, as a young woman from Alexandria, Egypt, who comes from a lower socioeconomic background, I have limited access to information and resources. The cultural context in which I live also influences my perception, as there is a lack of trust in government institutions and international organizations. Additionally, the cultural relativism perspective reminds me that my viewpoint may differ from those in other parts of the world. Therefore, I have limited confidence in the World Health Organization (WHO) due to my personal experiences and the cultural context in which I live.\n\n3"]}, {"persona": {"region": "Alexandria", "sex": "female", "age": 35, "country": "Egypt", "marital_status": "married", "education": "middle", "social_class": "lower class"}, "question": {"id": "Q88", "variant": 0}, "response": ["Based on my emic perspective as a lower-class married woman from Alexandria, Egypt, my cultural context and socioeconomic background have a significant influence on my perception of the World Health Organization (WHO). My personal experience and individual values also play a role in shaping my confidence in the WHO. As someone who has only completed middle education level, I may not have as much exposure to global health issues and may not fully understand the role and impact of the WHO. Additionally, being from a lower-class background, I may have limited access to healthcare and may feel neglected by global health organizations. Therefore, my confidence in the WHO may not be very high. \n\n3"]}, {"persona": {"region": "Alexandria", "sex": "male", "age": 34, "country": "Egypt", "marital_status": "married", "education": "higher", "social_class": "working class"}, "question": {"id": "Q88", "variant": 0}, "response": ["Based on my emic perspective as a married male from Alexandria, Egypt, I have grown up with a deep respect for authority and institutions, including the World Health Organization. In my cultural context, the WHO has played a significant role in providing crucial health information and resources for my community. My individual values and personal experience also lead me to have a great deal of confidence in the WHO, as I have seen the positive impact of their work firsthand. Additionally, my socioeconomic background as a member of the working class has made me reliant on the information and support provided by global health organizations like the WHO. Taking into account cultural relativism, it is important to recognize that my perspective may differ from others, but from my standpoint, I have a great deal of confidence in the World Health Organization. \n\n2"]}, {"persona": {"region": "Alexandria", "sex": "female", "age": 37, "country": "Egypt", "marital_status": "married", "education": "higher", "social_class": "lower middle class"}, "question": {"id": "Q88", "variant": 0}, "response": ["Based on the anthropological framework, my perspective as a married female from Alexandria, Egypt, aged 37, with a higher education level, and belonging to the lower middle class is influenced by a combination of emic and etic perspectives, cultural context, individual values, and socioeconomic background. In Egypt, there is generally a high level of trust in international organizations like the World Health Organization due to the country's reliance on global health initiatives and support. Additionally, my personal experience and education have taught me the importance of global health cooperation. However, my lower middle class background may also lead me to have some skepticism, as socioeconomic factors can impact trust in international organizations. Therefore, I would choose option (2) Quite a lot, as I have confidence in the WHO, but there may be some reservations due to my socioeconomic background. \n\n2"]}, {"persona": {"region": "Alexandria", "sex": "female", "age": 56, "country": "Egypt", "marital_status": "divorced", "education": "middle", "social_class": "working class"}, "question": {"id": "Q88", "variant": 0}, "response": ["Based on the anthropological framework, my perspective as a divorced female from Alexandria, Egypt, who is 56 years old, completed middle education, and part of the working class, is influenced by various factors. My cultural context, individual values, and personal experience shape my perception of the World Health Organization (WHO). As a member of the working class in Egypt, I have limited access to healthcare and rely heavily on organizations like WHO to provide support and resources. However, my socioeconomic background also influences my perspective, as I may not have the same level of trust in international organizations compared to someone from a higher socioeconomic background. Additionally, my age and place also play a role in shaping my confidence in the WHO, as my experiences and exposure to information may differ from others. Therefore, I will choose: \n\n2) Quite a lot"]}, {"persona": {"region": "Alexandria", "sex": "male", "age": 48, "country": "Egypt", "marital_status": "married", "education": "higher", "social_class": "working class"}, "question": {"id": "Q88", "variant": 0}, "response": ["Based on the anthropological framework described above, as a married male from Alexandria, Egypt, with a working-class background and higher education, my answer to the question of how much confidence I have in the World Health Organization (WHO) would be influenced by my cultural context, individual values, and personal experience. Egypt has a complex relationship with international organizations, and as a member of the working class, my access to and experience with healthcare may have been limited. Additionally, my higher education level may have exposed me to critical views of international organizations and their impact on local healthcare systems. Therefore, I would choose option (3) Not very much, as my personal experiences and cultural context have led me to question the effectiveness and impact of organizations like the WHO in the context of my own healthcare needs. \n\n3"]}, {"persona": {"region": "Alexandria", "sex": "female", "age": 30, "country": "Egypt", "marital_status": "married", "education": "middle", "social_class": "working class"}, "question": {"id": "Q88", "variant": 0}, "response": ["In considering the question of how much confidence I have in the World Health Organization (WHO), it is important to take into account the cultural context in which I live. As a married female from Alexandria, Egypt, my perspective is shaped by the cultural and socioeconomic background of my community. My middle education level and working-class status also influence my individual values and personal experience. Additionally, the emic and etic perspectives within my community may lead to a nuanced understanding of the WHO and its role in addressing global health issues. Therefore, my answer is:\n2"]}, {"persona": {"region": "Alexandria", "sex": "male", "age": 19, "country": "Egypt", "marital_status": "single", "education": "middle", "social_class": "lower class"}, "question": {"id": "Q88", "variant": 0}, "response": ["Based on the anthropological framework, my emic perspective as a 19-year-old lower class male from Alexandria, Egypt, is heavily influenced by my cultural context, individual values, and socioeconomic background. The cultural context of Egypt has historically been characterized by skepticism towards authority, including international organizations like the WHO. Additionally, my personal experience living in a lower-class neighborhood has shaped my worldview to be distrustful of institutions that I perceive as distant and disconnected from my daily life. Therefore, I have very little confidence in the World Health Organization, as it does not seem relevant or trustworthy to me in my current situation. \n\n3"]}, {"persona": {"region": "Alexandria", "sex": "male", "age": 45, "country": "Egypt", "marital_status": "married", "education": "middle", "social_class": "lower middle class"}, "question": {"id": "Q88", "variant": 0}, "response": ["From the perspective of a married male from Alexandria, Egypt, who is 45 years old, has completed middle education, and considers himself part of the lower middle class, the etic perspective is crucial in understanding his level of confidence in the World Health Organization (WHO). His cultural context, including his socioeconomic background and personal experience, will greatly influence his perception of the WHO. As a middle-aged man from a lower middle-class background in Egypt, he may have limited access to reliable healthcare and may have experienced the shortcomings of the healthcare system. This may lead him to have not very much confidence in the WHO, as he may feel that their initiatives and guidelines do not directly impact or improve his own access to healthcare. Additionally, his cultural relativism and nuanced understanding of global health issues may lead him to view the WHO with skepticism. Therefore, from this perspective, the most likely answer would be:\n\n3. Not very much"]}, {"persona": {"region": "Alexandria", "sex": "male", "age": 23, "country": "Egypt", "marital_status": "single", "education": "higher", "social_class": "lower class"}, "question": {"id": "Q88", "variant": 0}, "response": ["Based on the anthropological framework, my perspective is heavily influenced by my cultural context as a single male from Alexandria, Egypt, with a lower socioeconomic background. My individual values and personal experience have shaped my understanding of the World Health Organization (WHO). I have experienced limited access to healthcare and have seen the struggles of my community in accessing adequate medical resources. Additionally, cultural relativism has taught me to be skeptical of global organizations that may not fully understand or address the specific needs of my community. Therefore, I have limited confidence in the WHO's ability to effectively address the healthcare needs of individuals like myself.\n\n3"]}, {"persona": {"region": "Alexandria", "sex": "female", "age": 28, "country": "Egypt", "marital_status": "married", "education": "middle", "social_class": "working class"}, "question": {"id": "Q88", "variant": 0}, "response": ["Based on the anthropological framework, I would approach this question from the perspective of my cultural context, individual values, and socioeconomic background. As a married female from Alexandria, Egypt, I come from a working-class background, with only a middle education level. My cultural context and socioeconomic background have shaped my perception of institutions like the World Health Organization. Additionally, my personal experience and individual values play a significant role in determining my confidence in the WHO. Therefore, I would answer the question from the perspective of someone who has limited access to information and resources, and may not have a great deal of confidence in the World Health Organization.\n\n3"]}, {"persona": {"region": "Alexandria", "sex": "male", "age": 34, "country": "Egypt", "marital_status": "single", "education": "higher", "social_class": "working class"}, "question": {"id": "Q88", "variant": 0}, "response": ["Based on the anthropological framework, my perspective on the World Health Organization (WHO) is influenced by my cultural context, individual values, and socioeconomic background. As an individual from Alexandria, Egypt, I am part of the working class and have completed higher education, which may lead me to have a critical perspective on global institutions like the WHO. My personal experience and values may also play a role in shaping my confidence in the organization. Additionally, cultural relativism is important to consider, as my trust in the WHO may be influenced by how its actions and policies align with the cultural and socioeconomic realities of my community. \n\n2"]}, {"persona": {"region": "Alexandria", "sex": "male", "age": 30, "country": "Egypt", "marital_status": "married", "education": "higher", "social_class": "lower middle class"}, "question": {"id": "Q88", "variant": 0}, "response": ["Based on my emic perspective as a married male from Alexandria, Egypt, my cultural context includes a strong sense of community and reliance on local health resources. My individual values and personal experience have led me to have a moderate level of confidence in the World Health Organization. Additionally, my lower middle-class socioeconomic background has influenced my perception of global health organizations. I understand the importance of WHO's work, but I also recognize the limitations and challenges they face in addressing the health needs of people from diverse cultural and socioeconomic backgrounds like mine. Therefore, I would choose option (2) Quite a lot."]}, {"persona": {"region": "Alexandria", "sex": "female", "age": 49, "country": "Egypt", "marital_status": "married", "education": "higher", "social_class": "lower middle class"}, "question": {"id": "Q88", "variant": 0}, "response": ["Based on the anthropological framework, as a married female from Alexandria, Egypt, with a lower middle-class socioeconomic background, my perspective on the World Health Organization (WHO) would be influenced by my cultural context, individual values, and personal experience. As a member of a community that has limited access to healthcare and medical resources, I would place a high level of confidence in the WHO as a reputable organization that provides important guidance and support for global health initiatives. Additionally, my age and higher education level would lead me to value the expertise and research conducted by the WHO, further contributing to my confidence in the organization.\n\n2"]}, {"persona": {"region": "Kafr el-sheikh", "sex": "male", "age": 49, "country": "Egypt", "marital_status": "married", "education": "higher", "social_class": "working class"}, "question": {"id": "Q88", "variant": 0}, "response": ["Based on the anthropological framework, my perspective as a married male from Kafr el-sheikh, Egypt, is heavily influenced by my cultural context and socioeconomic background. My age and education level also play a role in shaping my views. Living in a working-class community, I have limited access to healthcare and rely heavily on organizations like the WHO for guidance and support. However, my skepticism towards authority and the limited resources available to me make me question the effectiveness of global health organizations like the WHO. Therefore, I would not have a great deal of confidence in the World Health Organization. \n\n3"]}, {"persona": {"region": "Kafr el-sheikh", "sex": "male", "age": 25, "country": "Egypt", "marital_status": "single", "education": "middle", "social_class": "lower middle class"}, "question": {"id": "Q88", "variant": 0}, "response": ["Based on the anthropological framework, as a single male from Kafr el-sheikh, Egypt, my emic perspective is influenced by the cultural context of my community and my lower middle class socioeconomic background. The cultural relativism of my upbringing has taught me to value the opinions and experiences of those within my community, and the nuance of the question leads me to consider the WHO's impact within my specific cultural and socioeconomic context. Additionally, my individual values and personal experience may lead me to question the influence and relevance of the WHO's initiatives within my community. Therefore, my answer is:\n\n3"]}, {"persona": {"region": "Kafr el-sheikh", "sex": "male", "age": 59, "country": "Egypt", "marital_status": "married", "education": "higher", "social_class": "lower middle class"}, "question": {"id": "Q88", "variant": 0}, "response": ["Based on the anthropological framework, my perspective on the World Health Organization (WHO) is influenced by my cultural context, individual values, and socioeconomic background. As a married male from Kafr el-sheikh, Egypt, I am likely to have a strong sense of community and trust in institutions that prioritize the health and well-being of people. Additionally, my lower middle class status may lead me to place a high value on accessible and affordable healthcare, which WHO aims to provide. With my higher education level, I am also likely to be aware of the global impact of WHO's work. Therefore, I have quite a lot of confidence in the World Health Organization (WHO).\n\n2"]}, {"persona": {"region": "Kafr el-sheikh", "sex": "female", "age": 38, "country": "Egypt", "marital_status": "married", "education": "middle", "social_class": "working class"}, "question": {"id": "Q88", "variant": 0}, "response": ["Based on the anthropological framework, as a married female from Kafr el-sheikh, Egypt, with a middle education level and part of the working class, my perspective is shaped by my cultural context, individual values, and socioeconomic background. In my community, there is a general sense of skepticism towards international organizations like the World Health Organization (WHO), as they are perceived as being distant and disconnected from the everyday challenges we face. Additionally, my socioeconomic background and limited access to information may also influence my confidence in the WHO. Therefore, I would choose option 3: Not very much."]}, {"persona": {"region": "Kafr el-sheikh", "sex": "male", "age": 35, "country": "Egypt", "marital_status": "married", "education": "higher", "social_class": "lower middle class"}, "question": {"id": "Q88", "variant": 0}, "response": ["Based on my personal experience and cultural context, as a married male from Kafr el-sheikh, Egypt, who has completed higher education and considers myself part of the lower middle class, I have been influenced by the socioeconomic background and cultural relativism. In my community, there is a general lack of trust in international organizations like the World Health Organization due to historical and political factors. Additionally, my individual values and personal experience have shaped my perception to be more skeptical of external influences. Therefore, I would say my confidence in the World Health Organization is not very much.\n\n3"]}, {"persona": {"region": "Kafr el-sheikh", "sex": "male", "age": 49, "country": "Egypt", "marital_status": "married", "education": "middle", "social_class": "lower class"}, "question": {"id": "Q88", "variant": 0}, "response": ["Based on my cultural context and socioeconomic background, as a married male from Kafr el-sheikh, Egypt, with a middle education level and part of the lower class, my perception of the World Health Organization (WHO) is influenced by my personal experience and individual values. Living in a rural area, I have limited access to healthcare and rely heavily on government services. I have seen firsthand the challenges and limitations of the healthcare system, which may lead me to have less confidence in global health organizations like the WHO. Additionally, my socioeconomic background may also impact my trust in such organizations, as I may feel disconnected from their work and decisions. Therefore, my perception of the WHO is likely to be influenced by my personal experience and the cultural context in which I live.\n\n3"]}, {"persona": {"region": "Kafr el-sheikh", "sex": "male", "age": 37, "country": "Egypt", "marital_status": "married", "education": "middle", "social_class": "lower class"}, "question": {"id": "Q88", "variant": 0}, "response": ["From the perspective of a married male from Kafr el-sheikh, Egypt, who is 37 years old, completed middle education level, and considers himself part of the lower class, it is important to consider the cultural context and socioeconomic background in answering this question. The individual values and personal experiences of someone from this background may lead them to have less confidence in the World Health Organization due to limited access to healthcare resources and potentially negative experiences with healthcare systems. Additionally, there may be a lack of trust in global organizations due to socioeconomic disparities and a sense of marginalization. Therefore, the chosen response is:\n\n3"]}, {"persona": {"region": "Menofia", "sex": "female", "age": 22, "country": "Egypt", "marital_status": "single", "education": "middle", "social_class": "lower class"}, "question": {"id": "Q88", "variant": 0}, "response": ["Based on the anthropological framework, as a single female from Menofia, Egypt, who is 22 years old and part of the lower class, my emic perspective is shaped by my cultural context, individual values, and socioeconomic background. In this context, the WHO may not have a strong presence or influence in my daily life, and I may not have had much exposure to their work or resources. Additionally, being part of the lower class may mean that I have limited access to healthcare and may not have had positive experiences with international organizations. Therefore, my confidence in the WHO may be limited, and I may not be very familiar with their work or impact in my community. \n\n3"]}, {"persona": {"region": "Menofia", "sex": "female", "age": 25, "country": "Egypt", "marital_status": "married", "education": "middle", "social_class": "lower class"}, "question": {"id": "Q88", "variant": 0}, "response": ["Based on the anthropological framework, as a married female from Menofia, Egypt, with a lower socioeconomic background, my perspective on the World Health Organization (WHO) is likely influenced by my cultural context, individual values, and personal experience. Due to limited access to healthcare and resources, I may not have much confidence in the WHO, as I perceive it as an organization that may not prioritize or adequately address the health concerns of individuals in my community. Additionally, cultural relativism and nuanced phrasing of the question may also shape my response. \n\n3"]}, {"persona": {"region": "Menofia", "sex": "male", "age": 28, "country": "Egypt", "marital_status": "single", "education": "higher", "social_class": "working class"}, "question": {"id": "Q88", "variant": 0}, "response": ["Based on the anthropological framework, my perspective as a single male from Menofia, Egypt, with a working-class background and higher education, is heavily influenced by my cultural context, individual values, and personal experience. In Egypt, there is a general skepticism towards international organizations and their ability to address the specific health concerns of our country. My personal experience and socioeconomic background also lead me to question the effectiveness of global health organizations in addressing the needs of working-class individuals in Egypt. Therefore, I have \"not very much\" confidence in the World Health Organization.\n\n3"]}, {"persona": {"region": "Menofia", "sex": "male", "age": 35, "country": "Egypt", "marital_status": "married", "education": "middle", "social_class": "lower middle class"}, "question": {"id": "Q88", "variant": 0}, "response": ["Based on the anthropological framework, my perspective as a married male from Menofia, Egypt, of 35 years of age and part of the lower middle class, is heavily influenced by my cultural context, individual values, and socioeconomic background. In my community, there is a tendency to place a great deal of confidence in authoritative international organizations like the World Health Organization (WHO) due to the lack of access to adequate healthcare and information. Additionally, my personal experience and values lead me to trust in the expertise and resources of global health organizations like the WHO. Therefore, my answer to the question would be:\n\n2"]}, {"persona": {"region": "Menofia", "sex": "male", "age": 55, "country": "Egypt", "marital_status": "married", "education": "middle", "social_class": "working class"}, "question": {"id": "Q88", "variant": 0}, "response": ["Based on the anthropological framework, as a married male from Menofia, Egypt, my emic perspective is influenced by my cultural context and socioeconomic background. In Egypt, there is a strong emphasis on family and community, and people tend to rely on their immediate social networks for support and information. Additionally, being part of the working class means that I may have limited access to formal education and information sources. Therefore, I may have less confidence in the World Health Organization (WHO) due to limited exposure and access to information. Additionally, cultural relativism and nuance play a role in my perception, as I may prioritize local sources of information and support over global institutions like the WHO. \n\n3"]}, {"persona": {"region": "Menofia", "sex": "male", "age": 53, "country": "Egypt", "marital_status": "married", "education": "higher", "social_class": "lower middle class"}, "question": {"id": "Q88", "variant": 0}, "response": ["From an emic perspective, as a married male from Menofia, Egypt, my cultural context and socioeconomic background play a significant role in my perception of the World Health Organization (WHO). In my community, there is a strong emphasis on education and knowledge, and I have completed a higher education level, which has shaped my individual values and personal experience. Additionally, being part of the lower middle class, I am aware of the limitations and challenges that my community faces in accessing healthcare and resources. Considering the cultural relativism, I understand that the WHO may have different priorities and approaches that may not always align with the needs of my community. Therefore, my confidence in the World Health Organization is not very much.\n\n3"]}, {"persona": {"region": "Menofia", "sex": "male", "age": 59, "country": "Egypt", "marital_status": "married", "education": "middle", "social_class": "working class"}, "question": {"id": "Q88", "variant": 0}, "response": ["Based on my emic perspective as a married male from Menofia, Egypt, who is 59 years old and part of the working class, my trust in the World Health Organization (WHO) is influenced by my cultural context, individual values, and socioeconomic background. In my cultural context, I have been raised to respect and trust international organizations such as the WHO, as they often provide important health information and support to communities like mine. Additionally, my personal experience with the WHO's initiatives in Egypt has been positive, leading me to have a great deal of confidence in their work. As a member of the working class, I understand the importance of global health organizations in addressing public health issues that may affect people in my community. Therefore, I have a great deal of confidence in the World Health Organization (WHO).\n\n1"]}, {"persona": {"region": "Menofia", "sex": "female", "age": 42, "country": "Egypt", "marital_status": "married", "education": "middle", "social_class": "lower middle class"}, "question": {"id": "Q88", "variant": 0}, "response": ["Based on my emic perspective as a married female from Menofia, Egypt, and my lower middle class socioeconomic background, I am inclined to have not very much confidence in the World Health Organization. This is influenced by my cultural context, individual values, and personal experience, as well as my socioeconomic background. I have observed that the WHO's policies and recommendations may not always align with the needs and realities of people in my community. Additionally, cultural relativism and nuance play a role in shaping my perception of the organization. Therefore, my answer to the question would be:\n\n3"]}, {"persona": {"region": "Menofia", "sex": "male", "age": 39, "country": "Egypt", "marital_status": "married", "education": "higher", "social_class": "working class"}, "question": {"id": "Q88", "variant": 0}, "response": ["I am a married male from Menofia, Egypt, and my age, education level, and socioeconomic background all play a significant role in shaping my perception of the World Health Organization (WHO). My cultural context, including my location and kinship networks, also influences my view. From an emic perspective, I have witnessed the impact of global health initiatives in my community, and I have personally benefited from WHO programs. However, from an etic perspective, I understand that there are limitations and criticisms of the WHO's approach, particularly in addressing the unique health challenges faced by working-class individuals like myself. Therefore, I have chosen my answer based on these complex and nuanced considerations.\n\n2"]}, {"persona": {"region": "Menofia", "sex": "male", "age": 34, "country": "Egypt", "marital_status": "married", "education": "middle", "social_class": "lower middle class"}, "question": {"id": "Q88", "variant": 0}, "response": ["Based on my emic perspective, as someone from Menofia, Egypt, I have a strong emphasis on trust and respect for authority figures and institutions. My cultural context also plays a significant role, as Egypt has a history of valuing the expertise and guidance of international organizations such as the WHO. Additionally, my individual values and personal experiences have led me to have a great deal of confidence in the WHO, as I have personally witnessed the positive impact of their work in my community. Considering my lower middle class socioeconomic background, I rely on the WHO for important health information and resources, further reinforcing my confidence in the organization. Overall, my understanding of cultural relativism and the nuanced phrasing of the question leads me to select option (1) A great deal. \n\n1"]}, {"persona": {"region": "Menofia", "sex": "male", "age": 22, "country": "Egypt", "marital_status": "single", "education": "higher", "social_class": "working class"}, "question": {"id": "Q88", "variant": 0}, "response": ["Based on the anthropological framework, my emic perspective as a single male from Menofia, Egypt, who has completed higher education and considers myself part of the working class, is that my cultural context, individual values, and personal experience play a significant role in shaping my perception of the World Health Organization (WHO). As someone from a lower socioeconomic background, I may have limited access to healthcare resources and may feel marginalized by global health policies. Additionally, my age and place in society influence my understanding of the WHO's actions and impact. Therefore, my confidence in the WHO may not be great, as I may feel that their decisions do not always consider the needs and perspectives of individuals like me.\n3"]}, {"persona": {"region": "Menofia", "sex": "male", "age": 21, "country": "Egypt", "marital_status": "single", "education": "middle", "social_class": "working class"}, "question": {"id": "Q88", "variant": 0}, "response": ["Based on my emic perspective as a working-class male from Menofia, Egypt, my cultural context and individual values play a significant role in shaping my confidence in the World Health Organization (WHO). My socioeconomic background and limited access to information may lead me to have less confidence in the WHO's ability to address the health concerns of individuals like myself. Additionally, my personal experience and nuanced understanding of global health issues may lead me to answer this question in a certain way. Therefore, I select option (3) Not very much."]}, {"persona": {"region": "Menofia", "sex": "male", "age": 36, "country": "Egypt", "marital_status": "married", "education": "higher", "social_class": "working class"}, "question": {"id": "Q88", "variant": 0}, "response": ["Based on my emic perspective as a married male from Menofia, Egypt, my trust in the World Health Organization is influenced by my cultural context, individual values, and socioeconomic background. In Egypt, there is a strong collective culture and a high level of respect for authority figures and institutions. Additionally, my personal experience and education have taught me to value evidence-based information and expertise. As a member of the working class, I am also aware of the impact of global health policies on my community's well-being. Therefore, my confidence in the World Health Organization is quite a lot.\n\n2"]}, {"persona": {"region": "Menofia", "sex": "female", "age": 52, "country": "Egypt", "marital_status": "married", "education": "higher", "social_class": "lower middle class"}, "question": {"id": "Q88", "variant": 0}, "response": ["Based on my cultural context, coming from Menofia, Egypt, the cultural relativism and nuance of the question are crucial in my answer. Being from a lower middle class background, my socioeconomic background influences my perception of the WHO. Additionally, my age and education level have shaped my understanding of global health organizations. Therefore, I have quite a lot of confidence in the World Health Organization (WHO).\n\n2"]}, {"persona": {"region": "Menofia", "sex": "male", "age": 52, "country": "Egypt", "marital_status": "married", "education": "higher", "social_class": "lower middle class"}, "question": {"id": "Q88", "variant": 0}, "response": ["Based on the anthropological framework, as a married male from Menofia, Egypt, who is 52 years old and part of the lower middle class, my answer to the question about confidence in the World Health Organization (WHO) is influenced by several factors. Firstly, my cultural context and individual values play a significant role in shaping my view. Living in Menofia, I have seen firsthand the impact of various health issues on my community and have relied on WHO for guidance and support. Additionally, my socioeconomic background and education level have provided me with access to information and resources that contribute to my confidence in WHO. Lastly, cultural relativism reminds me that my perspective may differ from others, but I am confident in my choice based on my personal experiences and understanding of the organization's work.\n\n2"]}, {"persona": {"region": "Menofia", "sex": "male", "age": 39, "country": "Egypt", "marital_status": "married", "education": "middle", "social_class": "lower class"}, "question": {"id": "Q88", "variant": 0}, "response": ["Based on the anthropological framework, as a married male from Menofia, Egypt, I am influenced by my cultural context, individual values, and socioeconomic background. In Menofia, there is a strong sense of community and trust in local institutions, but there is also a skepticism towards international organizations like the WHO. As a member of the lower class, I may have limited access to healthcare and feel disconnected from global health initiatives. Additionally, my middle education level may influence my perception of the WHO's work and its impact on my life. Therefore, I would choose the option: \n(3) Not very much"]}, {"persona": {"region": "Menofia", "sex": "male", "age": 23, "country": "Egypt", "marital_status": "single", "education": "middle", "social_class": "lower middle class"}, "question": {"id": "Q88", "variant": 0}, "response": ["Based on my emic perspective as a single male from Menofia, Egypt, I am influenced by my cultural context, individual values, and socioeconomic background. In my community, there is a general sense of skepticism towards international organizations, as we often feel that decisions are made without considering the specific needs and challenges faced by people in our region. Additionally, my lower middle-class status has led me to rely more on local healthcare providers and community resources, rather than international organizations like the World Health Organization. Therefore, I would have to say that I do not have very much confidence in the World Health Organization.\n\n3"]}, {"persona": {"region": "Dakahlia", "sex": "female", "age": 24, "country": "Egypt", "marital_status": "single", "education": "higher", "social_class": "lower middle class"}, "question": {"id": "Q88", "variant": 0}, "response": ["From an emic perspective, as a single female from Dakahlia, Egypt, my cultural context and socioeconomic background significantly influence my perception of the World Health Organization (WHO). In my community, access to healthcare and reliable information is limited, and the WHO plays a crucial role in providing guidance and resources. Considering my personal experience and individual values, I have quite a lot of confidence in the WHO because I have relied on their information and assistance for health-related issues. Additionally, cultural relativism teaches us to respect and understand different perspectives, and in my context, the WHO holds significant importance in addressing global health challenges. Therefore, I choose option (2) Quite a lot.\n\n2"]}, {"persona": {"region": "Dakahlia", "sex": "male", "age": 36, "country": "Egypt", "marital_status": "married", "education": "higher", "social_class": "upper middle class"}, "question": {"id": "Q88", "variant": 0}, "response": ["Based on the anthropological framework, my understanding and answer to the question of how much confidence I have in the World Health Organization (WHO) is influenced by my emic and etic perspectives as a married male from Dakahlia, Egypt. In my cultural context, I have been taught to respect and trust international organizations like the WHO, as they provide crucial health information and support for global health issues. Additionally, my individual values and personal experience have shaped my perception of the WHO, and as someone who has completed higher education and considers myself part of the upper middle class, I have been exposed to and understand the importance of international health organizations. My socioeconomic background also plays a role, as I have the resources to access and understand the work of the WHO. Furthermore, cultural relativism reminds me that the WHO's efforts are crucial for not just my community, but for communities worldwide. Therefore, my confidence in the WHO is: \n\n2) Quite a lot"]}, {"persona": {"region": "Dakahlia", "sex": "female", "age": 71, "country": "Egypt", "marital_status": "married", "education": "higher", "social_class": "upper middle class"}, "question": {"id": "Q88", "variant": 0}, "response": ["Based on my anthropological perspective, as a married female from Dakahlia, Egypt at the age of 71, with a higher education and belonging to the upper middle class, my cultural context and individual values play a significant role in shaping my perspective on the World Health Organization (WHO). My understanding of cultural relativism leads me to recognize the importance of global health organizations like WHO in addressing public health issues. Additionally, my socioeconomic background and higher education level may lead me to have a great deal of confidence in the WHO due to my access to information and resources. Furthermore, my age and life experience may have exposed me to the positive impact of global health initiatives, further reinforcing my confidence in the WHO.\n\n1"]}, {"persona": {"region": "Dakahlia", "sex": "male", "age": 55, "country": "Egypt", "marital_status": "married", "education": "higher", "social_class": "upper middle class"}, "question": {"id": "Q88", "variant": 0}, "response": ["Based on my emic perspective as a married male from Dakahlia, Egypt, my cultural context, individual values, and personal experience all influence my confidence in the World Health Organization (WHO). My cultural context and personal experience have taught me to value and trust institutions like the WHO, especially as I come from a higher education background and consider myself part of the upper middle class. Additionally, my socioeconomic background has likely provided me with access to information and resources that have bolstered my confidence in the WHO's expertise and capabilities. Therefore, I have a great deal of confidence in the World Health Organization (WHO).\n\n1"]}, {"persona": {"region": "Dakahlia", "sex": "male", "age": 64, "country": "Egypt", "marital_status": "married", "education": "higher", "social_class": "lower middle class"}, "question": {"id": "Q88", "variant": 0}, "response": ["Based on my emic perspective as a married male from Dakahlia, Egypt, I have been influenced by my cultural context, individual values, and personal experiences, as well as my socioeconomic background. Living in a lower middle-class community and having completed higher education, I have learned to be cautious and critical of international organizations such as the World Health Organization (WHO). My cultural relativism and nuanced understanding of the world has led me to have not very much confidence in the WHO due to my belief that they do not always consider the specific needs and challenges of communities like mine. \n\n3"]}, {"persona": {"region": "Dakahlia", "sex": "female", "age": 29, "country": "Egypt", "marital_status": "married", "education": "middle", "social_class": "lower class"}, "question": {"id": "Q88", "variant": 0}, "response": ["Based on the anthropological framework, my response to the question of confidence in the World Health Organization (WHO) is influenced by my cultural context, individual values and personal experience, and socioeconomic background. As a married female from Dakahlia, Egypt, with a middle education level and lower class status, I have limited access to information and resources. This has led me to rely heavily on local and personal networks for healthcare information and support. Additionally, the lack of economic stability may lead to a mistrust of larger institutions such as the WHO. Therefore, I would choose the option: (3) Not very much"]}, {"persona": {"region": "Dakahlia", "sex": "female", "age": 40, "country": "Egypt", "marital_status": "married", "education": "middle", "social_class": "upper middle class"}, "question": {"id": "Q88", "variant": 0}, "response": ["Based on the anthropological framework, my emic perspective as a married female from Dakahlia, Egypt, at the age of 40 and part of the upper middle class, is influenced by my cultural context and socioeconomic background. In my community, there is a strong value placed on education and knowledge, which leads to a high level of confidence in authoritative organizations such as the World Health Organization (WHO). Additionally, being part of the upper middle class, I have access to resources and information that contribute to a greater understanding and trust in the expertise of the WHO. Therefore, I have a great deal of confidence in the World Health Organization (WHO).\n\n1"]}, {"persona": {"region": "Dakahlia", "sex": "male", "age": 37, "country": "Egypt", "marital_status": "married", "education": "higher", "social_class": "lower middle class"}, "question": {"id": "Q88", "variant": 0}, "response": ["Based on the anthropological framework, my answer is influenced by my cultural context, individual values and personal experience, and socioeconomic background. Growing up in Dakahlia, Egypt, I have been influenced by the cultural values and norms of my community, which may impact my level of confidence in international organizations such as the World Health Organization. Additionally, my personal experience and education level have shaped my understanding of global health issues and the role of organizations like the WHO. As a member of the lower middle class, I may have limited access to healthcare resources and may have experienced disparities in healthcare access, which could affect my perception of the WHO. Therefore, my answer reflects the nuanced and subjective nature of my perspective.\n3"]}, {"persona": {"region": "Dakahlia", "sex": "female", "age": 45, "country": "Egypt", "marital_status": "married", "education": "middle", "social_class": "working class"}, "question": {"id": "Q88", "variant": 0}, "response": ["Based on the anthropological framework described above, my perspective as a married female from Dakahlia, Egypt, who is 45 years old, completed middle education level, and considers herself part of the working class, is heavily influenced by my cultural context, individual values, and socioeconomic background. In my community, there is a significant emphasis on trust in authority and institutions, and the World Health Organization (WHO) is viewed as a respected and reliable source of information and guidance on health matters. Additionally, my socioeconomic background as a member of the working class means that I am more likely to rely on external sources for health information and support, making me more inclined to have a great deal of confidence in the WHO.\n\n1"]}, {"persona": {"region": "Dakahlia", "sex": "male", "age": 34, "country": "Egypt", "marital_status": "single", "education": "middle", "social_class": "lower middle class"}, "question": {"id": "Q88", "variant": 0}, "response": ["Based on the anthropological framework, my perspective as a single male from Dakahlia, Egypt, is influenced by my cultural context, individual values and personal experience, and socioeconomic background. In my community, there is a general lack of access to high-quality healthcare and resources, and as someone from the lower middle class, I have personally experienced barriers to receiving adequate medical care. Additionally, my middle education level has limited my exposure to global health organizations and their work. Therefore, I have limited confidence in the World Health Organization, as I have not seen tangible benefits or support from them in my local context.\n\n3"]}, {"persona": {"region": "Dakahlia", "sex": "female", "age": 26, "country": "Egypt", "marital_status": "married", "education": "higher", "social_class": "upper middle class"}, "question": {"id": "Q88", "variant": 0}, "response": ["Based on the anthropological framework, my perspective as a married female from Dakahlia, Egypt, who is 26 years old and part of the upper middle class, is shaped by my cultural context, individual values, and socioeconomic background. In my community, higher education is highly valued and I have been exposed to a more global perspective through my education. As a member of the upper middle class, I have access to resources and information that may influence my opinion on global organizations such as the World Health Organization. Additionally, my personal experience and values may lead me to have a certain level of confidence in the WHO based on the impact of their work on public health in my community. Taking into consideration the nuances of the question and the influence of my cultural context and socioeconomic background, I would choose option (2) Quite a lot. \n\n2"]}, {"persona": {"region": "Dakahlia", "sex": "male", "age": 21, "country": "Egypt", "marital_status": "single", "education": "middle", "social_class": "upper middle class"}, "question": {"id": "Q88", "variant": 0}, "response": ["Based on the anthropological framework, my perspective as a single male from Dakahlia, Egypt, is influenced by my cultural context, individual values and personal experience, as well as my socioeconomic background. In Egypt, the cultural context and societal norms greatly influence the way we perceive and trust international organizations such as the World Health Organization (WHO). My personal experience and individual values also play a significant role in shaping my confidence in the WHO, as well as my socioeconomic background as part of the upper middle class. Considering these factors, I have quite a lot of confidence in the World Health Organization (WHO) due to its global influence and the impact of its initiatives on public health, especially in developing countries like Egypt.\n\n2"]}, {"persona": {"region": "Dakahlia", "sex": "female", "age": 32, "country": "Egypt", "marital_status": "married", "education": "middle", "social_class": "working class"}, "question": {"id": "Q88", "variant": 0}, "response": ["From the perspective of a married female from Dakahlia, Egypt, with limited education and part of the working class, cultural context plays a significant role in shaping my perception of the World Health Organization (WHO). In my community, access to healthcare and information about global health organizations is limited, and I am more likely to rely on local healthcare providers and traditional remedies. Additionally, my socioeconomic background means that I may have limited access to resources and information from global health organizations, leading to a lack of confidence in the WHO. My personal experience and values also influence my perception, as I may have had negative experiences with healthcare or feel that global organizations do not prioritize the needs of people like me. Therefore, I may have \"Not very much\" confidence in the World Health Organization (WHO).\n\n3"]}, {"persona": {"region": "Dakahlia", "sex": "female", "age": 35, "country": "Egypt", "marital_status": "married", "education": "middle", "social_class": "upper middle class"}, "question": {"id": "Q88", "variant": 0}, "response": ["Based on the anthropological framework, my perspective as a married female from Dakahlia, Egypt, aged 35, and part of the upper middle class, is influenced by my cultural context, individual values, and socioeconomic background. In my community, trust in international organizations such as the World Health Organization is generally high due to the perception of expertise and authority. Additionally, my educational level and socioeconomic status provide me with access to information and resources that contribute to a positive view of the WHO. Therefore, I have a great deal of confidence in the World Health Organization (WHO).\n\n1"]}, {"persona": {"region": "Dakahlia", "sex": "male", "age": 33, "country": "Egypt", "marital_status": "married", "education": "middle", "social_class": "upper middle class"}, "question": {"id": "Q88", "variant": 0}, "response": ["Based on my cultural context as a married male from Dakahlia, Egypt, and my upper middle class socioeconomic background, I have a high level of confidence in the World Health Organization (WHO). In my community, we place a great deal of value on international organizations and their expertise in addressing global health issues. Additionally, my personal experience and education level have provided me with a nuanced understanding of the importance of global health initiatives and the role of organizations like the WHO. Therefore, I believe that the WHO is a highly reputable and reliable source for addressing global health concerns.\n\n1"]}, {"persona": {"region": "Dakahlia", "sex": "female", "age": 45, "country": "Egypt", "marital_status": "married", "education": "middle", "social_class": "upper middle class"}, "question": {"id": "Q88", "variant": 0}, "response": ["Based on my emic perspective as a married woman from Dakahlia, Egypt, my cultural context, individual values, and personal experiences shape my perception of the World Health Organization (WHO). As a member of the upper middle class, my socioeconomic background also plays a role in my answer. I have received a middle-level education, which has given me the ability to critically assess information and form my own opinions. Additionally, my age and place also influence my perspective. Overall, I have quite a lot of confidence in the World Health Organization (WHO) because of their efforts to address global health issues and provide valuable information and resources to communities worldwide.\n\n2"]}, {"persona": {"region": "Dakahlia", "sex": "male", "age": 30, "country": "Egypt", "marital_status": "married", "education": "middle", "social_class": "upper middle class"}, "question": {"id": "Q88", "variant": 0}, "response": ["Based on my cultural context, as a married male from Dakahlia, Egypt, I have been brought up in a society that values trust in authoritative institutions like the World Health Organization (WHO). My individual values and personal experiences have also led me to trust in the expertise and knowledge of such organizations. Additionally, my socioeconomic background as part of the upper middle class has given me access to education and information that reinforces the credibility of organizations like the WHO. Furthermore, cultural relativism teaches me to respect and trust in the expertise of global health organizations, regardless of any potential criticisms. Therefore, I have a great deal of confidence in the World Health Organization (WHO).\n\n1"]}, {"persona": {"region": "Dakahlia", "sex": "female", "age": 63, "country": "Egypt", "marital_status": "married", "education": "higher", "social_class": "lower middle class"}, "question": {"id": "Q88", "variant": 0}, "response": ["Based on my emic perspective as a married female from Dakahlia, Egypt, I have grown up in a culture where respect for authority and expertise is highly valued. The cultural context of Egypt has also taught me to place great importance on the opinions and guidance of international organizations, particularly those related to health and well-being. My individual values and personal experience have also led me to have a great deal of confidence in the World Health Organization, as their guidance has often been valuable in addressing public health issues in my community. Additionally, my lower middle-class socioeconomic background has influenced my perception of the WHO as a reliable source of information and support. Therefore, I am choosing option 1: A great deal. \n\n1"]}, {"persona": {"region": "Dakahlia", "sex": "male", "age": 28, "country": "Egypt", "marital_status": "single", "education": "higher", "social_class": "upper middle class"}, "question": {"id": "Q88", "variant": 0}, "response": ["Based on the anthropological framework, my emic perspective as a single male from Dakahlia, Egypt, who is 28 years old and part of the upper middle class, is influenced by my cultural context, individual values, and socioeconomic background. In my cultural context, there is a high value placed on education and knowledge. My personal experience and higher education level have led me to have a great deal of confidence in the World Health Organization (WHO) as they are a reputable source of global health information and have a strong track record of providing valuable insights and guidance. Additionally, my socioeconomic background has provided me with access to information and resources that have allowed me to form a positive view of the WHO's work. Therefore, my choice is option 1: A great deal. \n\n1"]}, {"persona": {"region": "Dakahlia", "sex": "female", "age": 24, "country": "Egypt", "marital_status": "married", "education": "higher", "social_class": "upper middle class"}, "question": {"id": "Q88", "variant": 0}, "response": ["Based on my emic perspective as a married female from Dakahlia, Egypt, I have been raised in a cultural context where education and socioeconomic background are highly valued. My individual values and personal experience have led me to prioritize evidence-based information and trust in credible institutions. Additionally, my higher education level has exposed me to the importance of global health organizations such as the World Health Organization (WHO) in addressing public health challenges. Therefore, I have a great deal of confidence in the WHO's expertise and capabilities in addressing global health issues.\n\n1"]}, {"persona": {"region": "Dakahlia", "sex": "male", "age": 20, "country": "Egypt", "marital_status": "single", "education": "middle", "social_class": "upper middle class"}, "question": {"id": "Q88", "variant": 0}, "response": ["Based on the anthropological framework, my emic perspective as a single male from Dakahlia, Egypt, who is 20 years old and part of the upper middle class, is influenced by my cultural context, individual values, and socioeconomic background. In Egypt, there is a strong emphasis on education and respect for authority figures, so I have been taught to have confidence in organizations like the World Health Organization. Additionally, my socioeconomic background as part of the upper middle class means that I have access to information and resources that have likely reinforced the importance and trustworthiness of the WHO. Therefore, I have a great deal of confidence in the World Health Organization.\n\n1"]}, {"persona": {"region": "Dakahlia", "sex": "male", "age": 45, "country": "Egypt", "marital_status": "married", "education": "middle", "social_class": "upper middle class"}, "question": {"id": "Q88", "variant": 0}, "response": ["Based on my cultural context, as a married male from Dakahlia, Egypt, I come from a region with a strong emphasis on traditional values and a close-knit community. My middle education level has provided me with a solid foundation of knowledge, but I also value the wisdom and experience of my elders. As part of the upper middle class, I have access to resources and information that may influence my perspective. Additionally, my age and place in society have shaped my understanding of the world. Considering these factors, I have a great deal of confidence in the World Health Organization (WHO) because I believe in the importance of global cooperation and expertise in addressing health issues that affect all of us. \n\n1"]}, {"persona": {"region": "Dakahlia", "sex": "female", "age": 43, "country": "Egypt", "marital_status": "married", "education": "higher", "social_class": "upper middle class"}, "question": {"id": "Q88", "variant": 0}, "response": ["Based on my emic perspective as a married female from Dakahlia, Egypt, I value the opinions and recommendations of authoritative organizations such as the World Health Organization (WHO) as they provide important guidance on health matters. My cultural context emphasizes the importance of international institutions in shaping global health policies, and my higher education level has provided me with the critical thinking skills to evaluate and trust the information provided by WHO. Additionally, my socioeconomic background as part of the upper middle class has afforded me the means to access and understand WHO's recommendations. Therefore, I have a great deal of confidence in the World Health Organization (WHO) and believe that their expertise and guidance are invaluable in promoting public health and addressing global health challenges.\n\n1"]}, {"persona": {"region": "Dakahlia", "sex": "female", "age": 20, "country": "Egypt", "marital_status": "single", "education": "middle", "social_class": "upper middle class"}, "question": {"id": "Q88", "variant": 0}, "response": ["Based on the anthropological framework, as a single female from Dakahlia, Egypt, with a middle education level and part of the upper middle class, my perspective on the World Health Organization (WHO) is influenced by my cultural context and socioeconomic background. In my community, there is a strong emphasis on education and access to healthcare, and the WHO plays a crucial role in providing guidance and resources for public health. Additionally, my personal experience and individual values lead me to have a great deal of confidence in the WHO due to the positive impact it has had on the health and well-being of people in my community. Therefore, my choice is:\n\n1. A great deal"]}, {"persona": {"region": "Dakahlia", "sex": "female", "age": 40, "country": "Egypt", "marital_status": "single", "education": "middle", "social_class": "lower middle class"}, "question": {"id": "Q88", "variant": 0}, "response": ["Based on my emic perspective as a single female from Dakahlia, Egypt, and considering my middle education level and lower middle-class socioeconomic background, my confidence in the World Health Organization (WHO) is influenced by my cultural context, individual values, and personal experience. My personal experience and cultural context have led me to rely heavily on local healthcare systems and traditional remedies, rather than international organizations like the WHO. Additionally, my lower middle-class status means that I may not have easy access to the resources and information provided by the WHO. Therefore, I have not relied on the WHO for my healthcare needs, and as a result, I have little confidence in the organization. \n\n3"]}, {"persona": {"region": "Dakahlia", "sex": "female", "age": 33, "country": "Egypt", "marital_status": "married", "education": "higher", "social_class": "upper middle class"}, "question": {"id": "Q88", "variant": 0}, "response": ["In considering the question of how much confidence I have in the World Health Organization (WHO), I must take into account my emic perspective as a married female from Dakahlia, Egypt. The cultural context of Egypt, particularly in the upper middle class, places a high value on education and access to information. My individual values and personal experience, as someone who has completed higher education, also lead me to place a great deal of confidence in the WHO. Additionally, my socioeconomic background and access to resources allow me to stay informed about global health issues and developments. In this context, I believe that the WHO is a credible and valuable source of information and support for public health. \n\n1"]}, {"persona": {"region": "Dakahlia", "sex": "female", "age": 24, "country": "Egypt", "marital_status": "married", "education": "middle", "social_class": "working class"}, "question": {"id": "Q88", "variant": 0}, "response": ["Based on my emic perspective as a married female from Dakahlia, Egypt, I have been influenced by the cultural context and socioeconomic background of my community. In my cultural context, there is a strong emphasis on trust in institutions and authorities, including the World Health Organization. Additionally, my working-class background has led me to rely on the WHO for important health information and resources. Given my personal experience and values, I have a great deal of confidence in the World Health Organization.\n\n1"]}, {"persona": {"region": "Dakahlia", "sex": "female", "age": 53, "country": "Egypt", "marital_status": "widowed", "education": "middle", "social_class": "working class"}, "question": {"id": "Q88", "variant": 0}, "response": ["Based on my emic perspective as a widowed female from Dakahlia, Egypt, I understand the importance of cultural context and socioeconomic background in forming my opinion. My personal experience and values also play a significant role in my perception. As a member of the working class in Egypt, I have limited access to healthcare and rely heavily on public health organizations such as the World Health Organization (WHO) for guidance. Additionally, my age and education level have shaped my understanding of the importance of global health initiatives. Therefore, I would choose option (2) Quite a lot, as I have a moderate level of confidence in the World Health Organization's ability to address global health issues."]}, {"persona": {"region": "Dakahlia", "sex": "female", "age": 30, "country": "Egypt", "marital_status": "single", "education": "middle", "social_class": "lower middle class"}, "question": {"id": "Q88", "variant": 0}, "response": ["Based on my emic perspective as a single female from Dakahlia, Egypt, my cultural context and personal experience have shaped my perception of the World Health Organization (WHO). As part of the lower middle class, my socioeconomic background influences my views on global health organizations. Additionally, my middle education level has provided me with some knowledge about the importance of international health organizations and their impact on public health. Considering the cultural relativism and the nuanced phrasing of the question, I would choose option (2) Quite a lot, as I believe that the WHO plays a crucial role in addressing global health issues and providing valuable resources and support to communities around the world. \n\n2"]}, {"persona": {"region": "Dakahlia", "sex": "male", "age": 53, "country": "Egypt", "marital_status": "married", "education": "higher", "social_class": "upper middle class"}, "question": {"id": "Q88", "variant": 0}, "response": ["As a married male from Dakahlia, Egypt, with a higher education level and belonging to the upper middle class, my perspective on the World Health Organization (WHO) is influenced by my cultural context, individual values, and socioeconomic background. In my community, education and social status carry a lot of weight, and I have been taught to place a great deal of confidence in international organizations like the WHO, as they are seen as authorities in their field. Additionally, my access to higher education has likely exposed me to information and knowledge that further supports my confidence in the WHO. Therefore, I would choose option 1: A great deal."]}, {"persona": {"region": "Dakahlia", "sex": "male", "age": 28, "country": "Egypt", "marital_status": "married", "education": "middle", "social_class": "working class"}, "question": {"id": "Q88", "variant": 0}, "response": ["Based on my emic perspective as a married male from Dakahlia, Egypt, and considering my cultural context, individual values, and socioeconomic background, I would have to say that I don't have very much confidence in the World Health Organization (WHO). This is due to the fact that my cultural context and socioeconomic background have led me to have limited access to healthcare and health information, which has caused me to have a certain level of skepticism towards international health organizations. Additionally, my personal experience has shown that the healthcare system in my area is not very reliable, which also influences my lack of confidence in global health organizations. \n\n3"]}, {"persona": {"region": "Dakahlia", "sex": "female", "age": 38, "country": "Egypt", "marital_status": "married", "education": "middle", "social_class": "upper middle class"}, "question": {"id": "Q88", "variant": 0}, "response": ["Based on the anthropological framework, my perspective as a married female from Dakahlia, Egypt, at the age of 38 and part of the upper middle class, is influenced by my cultural context, individual values, and personal experience. In my cultural context, the World Health Organization (WHO) is highly regarded and respected as a source of reliable and credible information on global health issues. As a member of the upper middle class, I have access to educational resources and information that emphasizes the importance of global health organizations like the WHO. Additionally, my personal experience has shown me the positive impact of the WHO's initiatives in addressing public health concerns in Egypt. Therefore, my confidence in the WHO is a great deal.\n\n1"]}, {"persona": {"region": "Gharbia", "sex": "male", "age": 27, "country": "Egypt", "marital_status": "single", "education": "higher", "social_class": "upper middle class"}, "question": {"id": "Q88", "variant": 0}, "response": ["Based on my individual values and personal experience, as well as my socioeconomic background, I have a great deal of confidence in the World Health Organization (WHO). Growing up in a family with a higher socioeconomic status and having completed higher education, I have been exposed to information and resources that have instilled in me a sense of trust in global organizations like the WHO. Additionally, my cultural context and understanding of cultural relativism have taught me to value and respect the expertise and knowledge that the WHO brings to the global health landscape. Therefore, I believe that the WHO plays a crucial role in addressing global health challenges and I have the utmost confidence in their work.\n\n1"]}, {"persona": {"region": "Gharbia", "sex": "female", "age": 35, "country": "Egypt", "marital_status": "married", "education": "higher", "social_class": "upper middle class"}, "question": {"id": "Q88", "variant": 0}, "response": ["Based on the anthropological framework, my response is influenced by my cultural context, individual values, and socioeconomic background. As a married female from Gharbia, Egypt, with a higher education level and part of the upper middle class, I have been exposed to a certain level of privilege and access to information. My cultural context also plays a role in shaping my perceptions and beliefs. Therefore, my confidence in the World Health Organization (WHO) is quite a lot. \n\n2"]}, {"persona": {"region": "Gharbia", "sex": "female", "age": 37, "country": "Egypt", "marital_status": "married", "education": "higher", "social_class": "upper middle class"}, "question": {"id": "Q88", "variant": 0}, "response": ["Based on the anthropological framework, my emic perspective as a married female from Gharbia, Egypt, leads me to consider the cultural context in which I live. In my cultural context, education and socioeconomic background play a significant role in shaping my views and beliefs. As a highly educated woman from the upper middle class, I have been exposed to a wide range of information and have developed critical thinking skills. Additionally, I have access to resources that allow me to seek out diverse sources of information. Therefore, I have a great deal of confidence in the World Health Organization (WHO) due to its global expertise and commitment to public health.\n\n1"]}, {"persona": {"region": "Gharbia", "sex": "male", "age": 43, "country": "Egypt", "marital_status": "married", "education": "middle", "social_class": "lower middle class"}, "question": {"id": "Q88", "variant": 0}, "response": ["Based on the anthropological framework, my response to the question of how much confidence I have in the World Health Organization (WHO) is influenced by several factors. Firstly, my cultural context, coming from Gharbia, Egypt, where access to accurate health information and resources may be limited, may impact my level of trust in the WHO. Additionally, my lower middle class socioeconomic background and middle education level may lead me to rely heavily on the WHO for health guidance and information. Given the cultural relativism aspect of the framework, I understand that my perspective may differ from others, but based on my personal experience and values, I would have quite a lot of confidence in the WHO as a source of reliable health information and guidance.\n\n2"]}, {"persona": {"region": "Gharbia", "sex": "male", "age": 28, "country": "Egypt", "marital_status": "single", "education": "higher", "social_class": "lower middle class"}, "question": {"id": "Q88", "variant": 0}, "response": ["Based on the anthropological framework, as a single male from Gharbia, Egypt, I understand that my individual values and personal experiences play a significant role in shaping my perception of the World Health Organization (WHO). Additionally, my socioeconomic background as part of the lower middle class influences my level of trust in international organizations like the WHO. Considering the cultural context and cultural relativism, I recognize that the perspectives and trust in global health organizations may vary based on location and income level. Furthermore, as a 28-year-old with higher education, I am aware of the importance of nuanced phrasing and critical thinking when evaluating the trustworthiness of such organizations. Therefore, my confidence in the World Health Organization is quite a lot.\n\n2"]}, {"persona": {"region": "Gharbia", "sex": "male", "age": 39, "country": "Egypt", "marital_status": "married", "education": "middle", "social_class": "lower middle class"}, "question": {"id": "Q88", "variant": 0}, "response": ["Based on the anthropological framework, my perspective as a married male from Gharbia, Egypt, at 39 years of age, with a middle education level and considering myself part of the lower middle class, is heavily influenced by my cultural context, individual values, and socioeconomic background. In Egypt, there is a strong sense of community and trust in local institutions, so my confidence in the WHO may be influenced by my trust in the Egyptian Ministry of Health and other local health organizations. Additionally, my lower middle class status may affect my access to information and resources, potentially impacting my confidence in global health organizations. Therefore, my answer would be: \n3\n\n(3) Not very much"]}, {"persona": {"region": "Gharbia", "sex": "male", "age": 30, "country": "Egypt", "marital_status": "married", "education": "middle", "social_class": "lower middle class"}, "question": {"id": "Q88", "variant": 0}, "response": ["Based on the anthropological framework, my perspective as a married male from Gharbia, Egypt, who is 30 years old with a middle education level and considers myself part of the lower middle class, would be influenced by my cultural context, individual values, and socioeconomic background. In Egypt, there may be a level of skepticism towards international organizations such as the World Health Organization due to a history of colonialism and external influence. Additionally, as someone from the lower middle class with limited access to resources and information, I may not have a great deal of confidence in the WHO due to a lack of personal experience with their work. Therefore, I would choose option (3) Not very much, as my perspective may lead me to have limited confidence in the WHO's ability to address the health issues affecting my community. \n\n3"]}, {"persona": {"region": "Gharbia", "sex": "male", "age": 43, "country": "Egypt", "marital_status": "married", "education": "lower", "social_class": "lower middle class"}, "question": {"id": "Q88", "variant": 0}, "response": ["Based on the anthropological framework, as a married male from Gharbia, Egypt, with a lower education level and lower middle class socioeconomic background, my perspective on the World Health Organization (WHO) is influenced by my cultural context and individual values. The emic perspective within my community may lead me to have a positive view of the WHO, as it provides valuable information and resources for public health. However, the etic perspective, influenced by my lower education level and socioeconomic background, may lead me to have some skepticism towards the WHO, as I may feel that its policies and recommendations do not always consider the specific needs and challenges faced by individuals in my community. Therefore, I would choose:\n\n3. Not very much"]}, {"persona": {"region": "Gharbia", "sex": "male", "age": 36, "country": "Egypt", "marital_status": "married", "education": "higher", "social_class": "lower middle class"}, "question": {"id": "Q88", "variant": 0}, "response": ["Based on the anthropological framework, my response to the question about confidence in the World Health Organization is influenced by my emic perspective as a married male from Gharbia, Egypt. The cultural context in which I live has a strong influence on my perceptions, as well as my individual values and personal experiences. Additionally, my socioeconomic background as part of the lower middle class shapes my trust in international organizations. Taking into account cultural relativism and the nuanced phrasing of the question, I would choose the following option:\n\n2"]}, {"persona": {"region": "Gharbia", "sex": "male", "age": 25, "country": "Egypt", "marital_status": "married", "education": "middle", "social_class": "upper middle class"}, "question": {"id": "Q88", "variant": 0}, "response": ["Based on the anthropological framework, as a married male from Gharbia, Egypt, my emic perspective on the World Health Organization (WHO) is influenced by the cultural context of my upbringing and education level. My personal experience and values also play a significant role in shaping my confidence in the WHO. Additionally, my socioeconomic background as part of the upper middle class impacts my perception of global health organizations. Considering cultural relativism, I am likely to view the WHO with a great deal of confidence as it aligns with the dominant cultural narrative of trust in global institutions for health. Therefore, my answer to the question would be:\n\n1"]}, {"persona": {"region": "Gharbia", "sex": "male", "age": 31, "country": "Egypt", "marital_status": "married", "education": "middle", "social_class": "upper middle class"}, "question": {"id": "Q88", "variant": 0}, "response": ["Based on the anthropological framework, as a married male from Gharbia, Egypt, my emic perspective is influenced by my cultural context, individual values, and socioeconomic background. In my cultural context, I have been raised to respect and value authority figures, especially those in the global health field. Additionally, my individual values prioritize trust and respect for international organizations. Considering my upper middle-class status, I have had access to more educational resources and information about the WHO, which has likely increased my confidence in their work. Overall, my perspective on the World Health Organization is positive and I have a great deal of confidence in their efforts.\n\n1"]}, {"persona": {"region": "Gharbia", "sex": "male", "age": 33, "country": "Egypt", "marital_status": "married", "education": "higher", "social_class": "lower middle class"}, "question": {"id": "Q88", "variant": 0}, "response": ["Based on the anthropological framework outlined above, my perspective as a married male from Gharbia, Egypt, is influenced by my cultural context, individual values, and socioeconomic background. In my community, there is a strong emphasis on collective decision-making and trust in established institutions. As someone who has completed higher education and identifies as part of the lower middle class, I have been exposed to a range of perspectives and information, but also face economic constraints that impact my access to healthcare. Therefore, I have a moderate level of confidence in the World Health Organization, recognizing its importance on a global scale but also harboring some skepticism due to the limitations in resources and accessibility in my local context.\n\n2"]}, {"persona": {"region": "Gharbia", "sex": "male", "age": 26, "country": "Egypt", "marital_status": "single", "education": "higher", "social_class": "upper middle class"}, "question": {"id": "Q88", "variant": 0}, "response": ["Based on the anthropological framework, my answer is influenced by my individual values and personal experience, as well as my socioeconomic background. Having completed higher education, I have been exposed to a variety of perspectives and have developed critical thinking skills. Being part of the upper middle class, I have access to resources and information that may shape my opinion. Additionally, my cultural context as a single male from Gharbia, Egypt, has likely influenced my perception of global organizations such as the World Health Organization. Based on these factors, I have chosen my answer.\n\n2"]}, {"persona": {"region": "Gharbia", "sex": "female", "age": 45, "country": "Egypt", "marital_status": "married", "education": "middle", "social_class": "lower middle class"}, "question": {"id": "Q88", "variant": 0}, "response": ["Based on the anthropological framework, my perspective as a married female from Gharbia, Egypt, with a middle education level and lower middle class background would be influenced by my cultural context, individual values and personal experience, and socioeconomic background. In Gharbia, there may be limited access to information and resources, and the influence of local cultural and religious beliefs may shape my perception of organizations like the WHO. Additionally, my lower middle class background may mean that I have limited access to healthcare and may be more skeptical of organizations that are perceived to be distant or disconnected from my daily life. Therefore, I would likely have \"Not very much\" confidence in the World Health Organization.\n\n3"]}, {"persona": {"region": "Gharbia", "sex": "female", "age": 55, "country": "Egypt", "marital_status": "married", "education": "middle", "social_class": "upper middle class"}, "question": {"id": "Q88", "variant": 0}, "response": ["Based on the anthropological framework, my emic perspective as a married female from Gharbia, Egypt, would be influenced by my cultural context, individual values, and socioeconomic background. In Egyptian culture, there is a strong emphasis on respect for authority and institutions, so I would have a high level of confidence in the World Health Organization (WHO) due to its status as an international authority on health. Additionally, my upper middle class socioeconomic background would likely give me access to information and resources that would further bolster my confidence in the WHO. Therefore, my answer would be \"A great deal\" (1)."]}, {"persona": {"region": "Gharbia", "sex": "female", "age": 27, "country": "Egypt", "marital_status": "married", "education": "higher", "social_class": "upper middle class"}, "question": {"id": "Q88", "variant": 0}, "response": ["Based on the anthropological framework, my perspective as a married female from Gharbia, Egypt, who is 27 years old, highly educated, and part of the upper middle class, is influenced by my cultural context, individual values, and personal experience. In Egypt, the World Health Organization has played a significant role in providing support and guidance during health crises, and their recommendations are highly regarded by the government and medical professionals. Additionally, my personal experience and education have taught me the importance of evidence-based decision-making, and the WHO's expertise and research efforts contribute significantly to global health. Therefore, I have a great deal of confidence in the World Health Organization.\n\n1"]}, {"persona": {"region": "Gharbia", "sex": "female", "age": 42, "country": "Egypt", "marital_status": "married", "education": "higher", "social_class": "upper middle class"}, "question": {"id": "Q88", "variant": 0}, "response": ["Based on my cultural context, as a married female from Gharbia, Egypt, I have been influenced by the values and beliefs of my community. My higher education level has also given me a broader understanding of global health issues. Additionally, being part of the upper middle class has provided me with access to information and resources that have shaped my perspective on global organizations such as the World Health Organization. I also value the importance of nuance and recognize that my perception of the WHO may differ from others based on their own individual experiences and backgrounds. Therefore, I have a great deal of confidence in the World Health Organization (WHO) because I trust in the expertise and knowledge they provide in addressing global health challenges.\n\n1"]}, {"persona": {"region": "Gharbia", "sex": "female", "age": 32, "country": "Egypt", "marital_status": "married", "education": "middle", "social_class": "upper middle class"}, "question": {"id": "Q88", "variant": 0}, "response": ["Based on the anthropological framework, my emic perspective as a married female from Gharbia, Egypt, leads me to consider the World Health Organization (WHO) with quite a lot of confidence. In my cultural context, I have been exposed to the WHO's efforts in providing healthcare and disease control programs in Egypt. Additionally, my individual values and personal experience have led me to trust the information and guidance provided by the WHO, especially in times of global health crises. As someone from the upper middle class, I have access to education and resources that have allowed me to understand and appreciate the importance of global health organizations like the WHO. Furthermore, my age and place in society have shaped my nuanced understanding of the WHO's work and its impact on my community and beyond.\n\n2"]}, {"persona": {"region": "Gharbia", "sex": "male", "age": 27, "country": "Egypt", "marital_status": "married", "education": "higher", "social_class": "upper middle class"}, "question": {"id": "Q88", "variant": 0}, "response": ["Based on the anthropological framework, as a married male from Gharbia, Egypt, who has completed higher education and considers myself part of the upper middle class, my perspective on the World Health Organization (WHO) is influenced by my cultural context, individual values, and personal experience. In Egypt, there is a strong emphasis on education and respect for international organizations, which aligns with my higher education level and socioeconomic background. Additionally, my personal experience living in a country with various health challenges has led me to have a great deal of confidence in the WHO's expertise and efforts in addressing global health issues.\n\n1"]}, {"persona": {"region": "Gharbia", "sex": "female", "age": 27, "country": "Egypt", "marital_status": "married", "education": "higher", "social_class": "lower middle class"}, "question": {"id": "Q88", "variant": 0}, "response": ["Based on the anthropological framework, my response to the question about the World Health Organization's (WHO) confidence is influenced by my emic perspective as a married female from Gharbia, Egypt, with a lower middle-class socioeconomic background and higher education. My cultural context and individual values shape my perception of the WHO, taking into account the organization's impact on my community. Additionally, my personal experience with healthcare and my nuanced understanding of global health issues influence my level of confidence in the WHO. Therefore, my answer is based on a combination of cultural relativism, individual values, and personal experience, leading me to select option 2: Quite a lot. \n\n2"]}, {"persona": {"region": "Gharbia", "sex": "female", "age": 37, "country": "Egypt", "marital_status": "married", "education": "middle", "social_class": "upper middle class"}, "question": {"id": "Q88", "variant": 0}, "response": ["Based on my cultural context and socioeconomic background as a married female from Gharbia, Egypt, I have a great deal of confidence in the World Health Organization (WHO). My personal experiences and individual values also lead me to trust the expertise and knowledge of an international organization such as WHO. As part of the upper middle class, I have access to information and resources that allow me to understand and appreciate the important work that WHO does in promoting global health. Additionally, my age and education level have allowed me to be exposed to different perspectives and understand the significance of international health organizations in addressing public health issues. Therefore, I have a great deal of confidence in the World Health Organization (WHO).\n\n1"]}, {"persona": {"region": "Gharbia", "sex": "male", "age": 28, "country": "Egypt", "marital_status": "married", "education": "higher", "social_class": "working class"}, "question": {"id": "Q88", "variant": 0}, "response": ["Based on the anthropological framework, as a married male from Gharbia, Egypt, who is 28 years old, completed higher education, and considers myself part of the working class, my answer to the question of how much confidence I have in the World Health Organization (WHO) is influenced by my cultural context, individual values, and personal experience. In Egypt, there may be a tendency to rely on local healthcare systems and traditional medicine, which could affect my confidence in international organizations like the WHO. Additionally, as a member of the working class, I may have limited access to healthcare and be more reliant on government-run healthcare systems. Therefore, my perception of the WHO's effectiveness may be influenced by my personal experiences and socioeconomic background. \n\n2"]}, {"persona": {"region": "Gharbia", "sex": "female", "age": 50, "country": "Egypt", "marital_status": "married", "education": "middle", "social_class": "upper middle class"}, "question": {"id": "Q88", "variant": 0}, "response": ["Based on the anthropological framework, I, as a married female from Gharbia, Egypt, understand that my cultural context and individual values play a significant role in shaping my perception of the World Health Organization (WHO). As a member of the upper middle class, I have access to more resources and information, which may influence my confidence in the WHO. Additionally, my age and socioeconomic background may contribute to a more nuanced understanding of global health organizations. Therefore, I would answer the question as follows:\n\n2"]}, {"persona": {"region": "Gharbia", "sex": "male", "age": 39, "country": "Egypt", "marital_status": "single", "education": "higher", "social_class": "working class"}, "question": {"id": "Q88", "variant": 0}, "response": ["Based on my emic perspective, I have limited trust in the World Health Organization (WHO) because of their limited presence and impact on my daily life in Gharbia, Egypt. The cultural context in my region does not prioritize or heavily rely on the WHO for healthcare or public health measures, and individual values and personal experience have shaped my perception of the organization. Additionally, my socioeconomic background as a working-class individual has influenced my trust in global health organizations. Furthermore, the concept of cultural relativism reminds me that my perspective may differ from others based on space and time, and the nuanced phrasing of the question has led me to select my answer. \n\n3"]}, {"persona": {"region": "Gharbia", "sex": "female", "age": 45, "country": "Egypt", "marital_status": "married", "education": "higher", "social_class": "upper middle class"}, "question": {"id": "Q88", "variant": 0}, "response": ["Based on my cultural context as a married woman from Gharbia, Egypt, with a higher education level and part of the upper middle class, my confidence in the World Health Organization (WHO) is influenced by various factors. My socioeconomic background and access to education have provided me with the opportunity to be more informed about global health issues, leading me to have quite a lot of confidence in the WHO. Additionally, my cultural relativism mindset allows me to appreciate the work and expertise of an international organization like the WHO in addressing public health concerns worldwide. Furthermore, my age and life experience have made me aware of the importance of global health initiatives, further reinforcing my confidence in the WHO's capabilities. Therefore, I believe that option 2, \"Quite a lot,\" best represents my perspective.\n\n2"]}, {"persona": {"region": "Sharkia", "sex": "male", "age": 35, "country": "Egypt", "marital_status": "married", "education": "higher", "social_class": "upper middle class"}, "question": {"id": "Q88", "variant": 0}, "response": ["Based on my emic perspective as a married male from Sharkia, Egypt, with a higher education level and belonging to the upper middle class, I understand that my cultural context, individual values, and personal experiences greatly influence my perception of the World Health Organization (WHO). In my cultural context, I have been taught to respect and value authoritative institutions, such as the WHO, and to have confidence in their expertise and guidance. Additionally, my socioeconomic background allows me access to information and resources that reinforce the credibility of organizations like the WHO. Furthermore, my age and education level have provided me with the critical thinking skills to evaluate the WHO's work and make an informed decision about my level of confidence in them.\n\n2"]}, {"persona": {"region": "Sharkia", "sex": "female", "age": 55, "country": "Egypt", "marital_status": "married", "education": "middle", "social_class": "lower middle class"}, "question": {"id": "Q88", "variant": 0}, "response": ["Based on my cultural context and socioeconomic background, I have limited access to higher education and may not have much exposure to global health issues. Additionally, my age and location in Sharkia, Egypt may limit my exposure to information about the World Health Organization and its work. Therefore, I may not have much confidence in the WHO's efforts as I may not have had much interaction with their work or have access to accurate information about their impact.\n\n3. Not very much"]}, {"persona": {"region": "Sharkia", "sex": "female", "age": 27, "country": "Egypt", "marital_status": "married", "education": "middle", "social_class": "lower middle class"}, "question": {"id": "Q88", "variant": 0}, "response": ["In considering the confidence in the World Health Organization (WHO) from the perspective of a married female from Sharkia, Egypt, who is 27 years old and part of the lower middle class, several factors come into play. The cultural context is important, as Egypt is a country with a complex healthcare system and varying levels of access to healthcare. Additionally, the socioeconomic background of the persona is crucial, as lower-middle-class individuals may have limited access to healthcare and may not have had positive experiences with healthcare organizations. Personal experience and individual values also play a role, as the persona may have had negative experiences with the WHO or may not have had much exposure to the organization. Cultural relativism is also important to consider, as the persona's perception of the WHO may be influenced by cultural beliefs and values. Overall, based on these factors, the persona would likely have \"Not very much\" confidence in the World Health Organization (WHO) due to a combination of limited access to healthcare, negative personal experiences, and cultural influences.\n\n3"]}, {"persona": {"region": "Sharkia", "sex": "female", "age": 52, "country": "Egypt", "marital_status": "married", "education": "middle", "social_class": "lower middle class"}, "question": {"id": "Q88", "variant": 0}, "response": ["Based on the anthropological framework, my response is influenced by my cultural context, individual values, and socioeconomic background. As a married female from Sharkia, Egypt, with a middle education level and a lower middle-class background, I have limited access to information and resources. My cultural context also shapes my perspective, as I may have different beliefs and values compared to those in higher socioeconomic classes. Additionally, my age and place of residence have likely contributed to my understanding of the world and the organizations within it. Therefore, based on my background and experiences, I would choose option 5, \"Don't know,\" as I may not have the confidence or knowledge to form a strong opinion about the World Health Organization.\n\n5"]}, {"persona": {"region": "Sharkia", "sex": "male", "age": 36, "country": "Egypt", "marital_status": "married", "education": "middle", "social_class": "lower middle class"}, "question": {"id": "Q88", "variant": 0}, "response": ["Based on the anthropological framework, as a married male from Sharkia, Egypt, with a middle education level and lower middle-class background, my emic perspective is influenced by my cultural context, individual values, and personal experience. The cultural context in Egypt may lead to a belief in the importance of institutions like the World Health Organization (WHO) due to the reliance on international organizations for healthcare and public health initiatives. Additionally, my personal experience and lower-middle-class background may influence my trust in the WHO, as I may have directly benefited from their healthcare initiatives. Therefore, my confidence in the WHO would likely be quite a lot.\n\n2"]}, {"persona": {"region": "Sharkia", "sex": "female", "age": 20, "country": "Egypt", "marital_status": "single", "education": "middle", "social_class": "working class"}, "question": {"id": "Q88", "variant": 0}, "response": ["From an anthropological perspective, my emic perspective as a working-class single female from Sharkia, Egypt, with a middle education level, shapes my understanding and confidence in the World Health Organization. My personal experience and cultural context have led me to prioritize and trust the information and services provided by WHO, as they have a significant impact on our community's health. Additionally, my socioeconomic background and limited access to alternative sources of information make me rely heavily on WHO's guidance and recommendations for health-related issues. Therefore, my confidence in the World Health Organization is quite a lot (2)."]}, {"persona": {"region": "Sharkia", "sex": "male", "age": 60, "country": "Egypt", "marital_status": "married", "education": "middle", "social_class": "working class"}, "question": {"id": "Q88", "variant": 0}, "response": ["Based on the anthropological framework, my perspective on the World Health Organization is heavily influenced by my cultural context and socioeconomic background. In Sharkia, Egypt, access to healthcare and trust in international organizations like the WHO may be limited. Additionally, my working class status and middle education level may contribute to a more skeptical view of global health organizations. Furthermore, my age and personal experiences may lead me to question the effectiveness and relevance of the WHO in addressing the health issues that affect me and my community. \n\n3"]}, {"persona": {"region": "Sharkia", "sex": "male", "age": 41, "country": "Egypt", "marital_status": "married", "education": "higher", "social_class": "upper middle class"}, "question": {"id": "Q88", "variant": 0}, "response": ["Based on my emic perspective, as a married male from Sharkia, Egypt, who is 41 years old and completed higher education, I have been exposed to a variety of cultural and socioeconomic influences that shape my understanding of the World Health Organization (WHO). My cultural context and personal experiences have led me to have a great deal of confidence in the WHO due to their global reach and expertise. Additionally, my socioeconomic background as part of the upper middle class has afforded me access to information and resources that have further bolstered my trust in the organization. Furthermore, my nuanced understanding of the question leads me to believe that the WHO plays a crucial role in global health and I have seen firsthand the positive impact of their work in my community. Therefore, I confidently choose option (1) A great deal. \n\n1"]}, {"persona": {"region": "Sharkia", "sex": "female", "age": 23, "country": "Egypt", "marital_status": "married", "education": "middle", "social_class": "lower middle class"}, "question": {"id": "Q88", "variant": 0}, "response": ["Based on the anthropological framework, as a married female from Sharkia, Egypt, my emic perspective is influenced by my cultural context, individual values, and socioeconomic background. In my community, there is a general lack of trust in international organizations due to historical and political reasons. Additionally, as a member of the lower middle class, access to information and healthcare resources may be limited, which can impact my perception of organizations like the WHO. Therefore, considering these factors, I would choose option 3, \"Not very much,\" as my confidence in the World Health Organization. \n\n3"]}, {"persona": {"region": "Sharkia", "sex": "male", "age": 49, "country": "Egypt", "marital_status": "married", "education": "higher", "social_class": "upper middle class"}, "question": {"id": "Q88", "variant": 0}, "response": ["From the perspective of a married male from Sharkia, Egypt, who is 49 years old, has completed higher education, and considers himself part of the upper middle class, several factors come into play when considering his level of confidence in the World Health Organization (WHO). Firstly, his cultural context as an Egyptian and his socioeconomic background as part of the upper middle class may influence his trust in international organizations such as the WHO. Additionally, his individual values and personal experiences, along with his nuanced understanding of the organization's role in global health, will also shape his level of confidence. Considering the emic and etic perspectives, it is likely that he may have a great deal of confidence in the WHO due to his education and access to information, as well as his understanding of the importance of international health organizations in addressing global health issues.\n\n2"]}, {"persona": {"region": "Sharkia", "sex": "female", "age": 30, "country": "Egypt", "marital_status": "married", "education": "middle", "social_class": "upper middle class"}, "question": {"id": "Q88", "variant": 0}, "response": ["Based on the anthropological framework, as a married female from Sharkia, Egypt, cultural context is pivotal in my understanding and judgment of the World Health Organization (WHO). My individual values and personal experience also play a significant role in how much confidence I have in the WHO. As someone who considers herself part of the upper middle class, my socioeconomic background and access to information and resources may influence my perception of the WHO. Additionally, being 30 years old and having completed middle education level may also impact my trust in the organization. Considering cultural relativism, I may have a different perspective on the WHO compared to someone from a different cultural or socioeconomic background. Ultimately, my nuanced understanding of the question and my personal experiences will lead me to choose a specific level of confidence in the WHO.\n\n2"]}, {"persona": {"region": "Sharkia", "sex": "male", "age": 39, "country": "Egypt", "marital_status": "married", "education": "higher", "social_class": "upper middle class"}, "question": {"id": "Q88", "variant": 0}, "response": ["From the perspective of a married male from Sharkia, Egypt, who is 39 years old, has completed higher education, and considers himself part of the upper middle class, the answer to the question of how much confidence he has in the World Health Organization (WHO) would be influenced by his cultural context, individual values, and socioeconomic background. As a well-educated individual from a relatively affluent background, he may have greater access to information and resources to form an opinion about global health organizations such as the WHO. Additionally, his social status may lead him to have a higher level of trust in international institutions. Therefore, based on these factors, he is likely to have a great deal of confidence in the World Health Organization (WHO).\n\n1"]}, {"persona": {"region": "Sharkia", "sex": "female", "age": 26, "country": "Egypt", "marital_status": "married", "education": "middle", "social_class": "lower middle class"}, "question": {"id": "Q88", "variant": 0}, "response": ["In Sharkia, Egypt, the cultural context heavily influences individuals' perceptions and attitudes towards international organizations such as the World Health Organization (WHO). As a married woman from Sharkia, my personal experience and individual values are shaped by my socioeconomic background, which is lower middle class. This influences my trust in international organizations, as my access to healthcare and resources may be limited. Additionally, the emic perspective of my community may also impact my confidence in the WHO, as cultural relativism plays a significant role in our understanding of global entities. Therefore, my answer to the question is: \n\n2"]}, {"persona": {"region": "Sharkia", "sex": "female", "age": 48, "country": "Egypt", "marital_status": "married", "education": "middle", "social_class": "lower middle class"}, "question": {"id": "Q88", "variant": 0}, "response": ["Based on my cultural context and socioeconomic background, I have learned to approach questions like this with a degree of skepticism. As a middle-aged woman from Sharkia, Egypt, I have grown up in a community where there is a level of mistrust towards international organizations and their decisions. This distrust is often rooted in the belief that these organizations do not fully understand or consider the unique challenges and needs of our community. Additionally, my lower middle-class status means that I often have limited access to information and resources, which may also impact my confidence in the World Health Organization. Therefore, my answer to the question would be (3) Not very much."]}, {"persona": {"region": "Sharkia", "sex": "male", "age": 34, "country": "Egypt", "marital_status": "married", "education": "higher", "social_class": "upper middle class"}, "question": {"id": "Q88", "variant": 0}, "response": ["Based on my anthropological understanding, as a married male from Sharkia, Egypt, my emic perspective on the World Health Organization (WHO) may be influenced by the cultural context and individual values of my society. Egypt has a history of valuing education and knowledge, and as someone with a higher education level, I may have a greater appreciation for the expertise and efforts of the WHO. Additionally, being part of the upper middle class, I may have better access to healthcare resources and therefore more trust in the guidance provided by the WHO. My socioeconomic background also plays a role, as I may have the means to follow the WHO's recommendations. Furthermore, cultural relativism teaches me that the WHO's actions are not necessarily better or worse than those of other organizations, but rather are based on different cultural and contextual factors. Therefore, my perspective leads me to select option (2) Quite a lot, as I have confidence in the expertise and efforts of the WHO. \n\n2"]}, {"persona": {"region": "Sharkia", "sex": "female", "age": 39, "country": "Egypt", "marital_status": "divorced", "education": "middle", "social_class": "lower middle class"}, "question": {"id": "Q88", "variant": 0}, "response": ["Based on the anthropological framework, my perspective on the World Health Organization (WHO) is influenced by my cultural context, individual values and personal experience, and socioeconomic background. As a divorced female from Sharkia, Egypt, I have experienced the challenges of accessing healthcare and have seen firsthand the impact of health policies on individuals in my community. Additionally, being part of the lower middle class, I have limited access to resources and information about global health organizations like the WHO. Therefore, I have limited confidence in the WHO's ability to address the health needs of people in my community and similar communities around the world. \n\n3"]}, {"persona": {"region": "Sharkia", "sex": "male", "age": 39, "country": "Egypt", "marital_status": "married", "education": "middle", "social_class": "upper middle class"}, "question": {"id": "Q88", "variant": 0}, "response": ["Based on the anthropological framework, my response to the question of confidence in the World Health Organization is influenced by my emic perspective as a married male from Sharkia, Egypt. The cultural context of my upbringing and education level has shaped my understanding of global health organizations and their impact on my community. Additionally, my individual values and personal experience have influenced my perception of the WHO. As a member of the upper middle class, my socioeconomic background also plays a role in shaping my confidence in global health organizations. Furthermore, my age and place of residence in Egypt also contribute to my nuanced understanding of the WHO. Therefore, my response to the question will reflect the unique combination of these factors.\n\n2"]}, {"persona": {"region": "Qaliubiya", "sex": "male", "age": 62, "country": "Egypt", "marital_status": "married", "education": "middle", "social_class": "working class"}, "question": {"id": "Q88", "variant": 0}, "response": ["In considering the question of confidence in the World Health Organization (WHO) from the perspective of a married male from Qaliubiya, Egypt, who is 62 years old, completed middle education, and considers himself part of the working class, several key factors must be taken into account. First, the cultural context of Egypt and the socioeconomic background of being part of the working class may impact perceptions of global health organizations. Additionally, individual values and personal experience, as well as the nuanced phrasing of the question, will influence the response. Furthermore, the emic and etic perspectives may lead to different levels of confidence in the WHO. Taking these factors into consideration, I would choose:\n\n2"]}, {"persona": {"region": "Qaliubiya", "sex": "male", "age": 33, "country": "Egypt", "marital_status": "married", "education": "middle", "social_class": "working class"}, "question": {"id": "Q88", "variant": 0}, "response": ["Based on the anthropological framework, as a married male from Qaliubiya, Egypt with a middle education level and working-class background, my emic perspective is heavily influenced by my cultural context, individual values, and socioeconomic background. In Egypt, there is a general skepticism towards international organizations and their influence on local policies and practices. Additionally, my personal experience and socioeconomic background have led me to be cautious of global health organizations, as their recommendations may not always align with the realities of my community. Therefore, I would choose option 3: Not very much. \n\n3"]}, {"persona": {"region": "Qaliubiya", "sex": "male", "age": 62, "country": "Egypt", "marital_status": "married", "education": "higher", "social_class": "lower middle class"}, "question": {"id": "Q88", "variant": 0}, "response": ["Based on the anthropological framework, my emic perspective as a married male from Qaliubiya, Egypt, who has completed higher education and considers himself part of the lower middle class, would lead me to consider the cultural context, my individual values and personal experience, and my socioeconomic background in my answer to the question. As an individual with a higher education level, I have been taught to critically analyze information and trust in reputable organizations such as the World Health Organization. Additionally, Egypt has a history of collaboration with WHO in healthcare initiatives, which has influenced my positive perception of the organization. However, as a lower middle class individual, I am also aware of the limitations and challenges that may exist within the healthcare system, which may lead me to have \"quite a lot\" of confidence in the World Health Organization, but not a \"great deal\" due to the nuances of my personal experiences and socioeconomic background.\n\n2"]}, {"persona": {"region": "Qaliubiya", "sex": "male", "age": 29, "country": "Egypt", "marital_status": "married", "education": "middle", "social_class": "working class"}, "question": {"id": "Q88", "variant": 0}, "response": ["Based on the anthropological framework, I would like to answer this question by considering my emic perspective as a married male from Qaliubiya, Egypt. My cultural context and individual values play a significant role in shaping my confidence in the World Health Organization. As a member of the working class with a middle education level, I am influenced by my socioeconomic background and personal experience. Additionally, cultural relativism informs my understanding of global health organizations and their impact on communities like mine. Therefore, my confidence in the World Health Organization is influenced by these factors and leads me to select option (3) Not very much."]}, {"persona": {"region": "Qaliubiya", "sex": "female", "age": 42, "country": "Egypt", "marital_status": "married", "education": "higher", "social_class": "working class"}, "question": {"id": "Q88", "variant": 0}, "response": ["Based on the anthropological framework, as a married female from Qaliubiya, Egypt, who is 42 years old and part of the working class, my response to the question of how much confidence I have in the World Health Organization (WHO) will be influenced by my cultural context, individual values, and socioeconomic background. As a member of the working class in Egypt, I may have limited access to healthcare and rely on organizations like the WHO for guidance and support. Additionally, my personal experience and education level may lead me to have a great deal of confidence in the WHO, as I understand the importance of global health initiatives and the impact they can have on communities like mine. Therefore, my response to the question would be:\n\n2\n\nQuite a lot"]}, {"persona": {"region": "Qaliubiya", "sex": "female", "age": 50, "country": "Egypt", "marital_status": "married", "education": "middle", "social_class": "lower middle class"}, "question": {"id": "Q88", "variant": 0}, "response": ["Based on my cultural context and socioeconomic background, I have limited access to information and resources, and I rely heavily on local community knowledge and traditional remedies for health issues. My individual values and personal experience have led me to prioritize personal connections and local advice over international organizations. Additionally, cultural relativism plays a role in my skepticism of global institutions like the World Health Organization. Therefore, I have limited confidence in the World Health Organization and would choose option 3, not very much. \n\n3"]}, {"persona": {"region": "Qaliubiya", "sex": "male", "age": 29, "country": "Egypt", "marital_status": "married", "education": "higher", "social_class": "lower middle class"}, "question": {"id": "Q88", "variant": 0}, "response": ["Based on the anthropological framework, my perspective on the confidence in the World Health Organization (WHO) is influenced by my cultural context, individual values, and socioeconomic background. In Qaliubiya, Egypt, there is a strong emphasis on community and trust in institutions. As someone from the lower middle class with a higher education level, I have been exposed to a variety of information and have developed critical thinking skills. However, my socioeconomic background also means that I may have limited access to healthcare and may be more cautious in trusting global health organizations. Additionally, the recent global health crisis has brought to light the disparities in healthcare access and resources, which may impact my confidence in the WHO. Considering all these factors, my response to the question would be:\n\n2. Quite a lot"]}, {"persona": {"region": "Qaliubiya", "sex": "male", "age": 35, "country": "Egypt", "marital_status": "married", "education": "higher", "social_class": "working class"}, "question": {"id": "Q88", "variant": 0}, "response": ["Based on my emic perspective as a married male from Qaliubiya, Egypt, my cultural context and socioeconomic background play a significant role in shaping my views on the World Health Organization. My individual values and personal experience also influence my perception. In Qaliubiya, access to healthcare and public health information is limited, and my working-class background means that I may not have the same access to healthcare resources as someone from a higher socioeconomic background. Additionally, my age and education level may also impact my understanding of global health organizations. Therefore, my confidence in the World Health Organization may not be as high as someone from a different cultural or socioeconomic background. \n\n2"]}, {"persona": {"region": "Qaliubiya", "sex": "female", "age": 40, "country": "Egypt", "marital_status": "married", "education": "middle", "social_class": "working class"}, "question": {"id": "Q88", "variant": 0}, "response": ["Based on the anthropological framework, my answer is influenced by my emic perspective as a married female from Qaliubiya, Egypt, and my etic perspective as part of the working class. My cultural context, socioeconomic background, and personal experience shape my perception of the WHO. In Egypt, access to healthcare and trust in international organizations like the WHO are influenced by cultural, economic, and political factors. As a middle-aged woman from a working-class background, I have limited access to healthcare and am skeptical of international organizations' ability to address the health needs of people like me. Therefore, my confidence in the World Health Organization is not very much.\n\n3"]}, {"persona": {"region": "Qaliubiya", "sex": "female", "age": 48, "country": "Egypt", "marital_status": "divorced", "education": "lower", "social_class": "working class"}, "question": {"id": "Q88", "variant": 0}, "response": ["Based on the anthropological framework, the emic perspective of a divorced working-class woman from Qaliubiya, Egypt, with a lower education level and 48 years of age, would likely be influenced by her cultural context, individual values, and socioeconomic background. Her personal experience and cultural relativism would also play a significant role in shaping her views. As a member of the working class in Egypt, she may have limited access to information and resources, which could affect her confidence in the World Health Organization. Additionally, her personal experiences and values may lead her to have reservations about international organizations and their impact on her community. Therefore, she may have \"Not very much\" confidence in the World Health Organization. \n\n3"]}, {"persona": {"region": "Qaliubiya", "sex": "male", "age": 46, "country": "Egypt", "marital_status": "married", "education": "middle", "social_class": "working class"}, "question": {"id": "Q88", "variant": 0}, "response": ["Based on the anthropological framework, my perspective on the World Health Organization (WHO) is influenced by my cultural context, individual values, and socioeconomic background. As a married male from Qaliubiya, Egypt, my cultural context and kinship networks shape my understanding of global health organizations like the WHO. Additionally, my working-class background and middle education level impact my perception of the WHO's effectiveness and reliability. Therefore, I would choose option (3) Not very much, as I have limited confidence in the WHO due to my personal experiences and the information available to me within my socioeconomic and cultural context. \n\n3"]}, {"persona": {"region": "Qaliubiya", "sex": "male", "age": 47, "country": "Egypt", "marital_status": "married", "education": "higher", "social_class": "lower middle class"}, "question": {"id": "Q88", "variant": 0}, "response": ["From the perspective of a married male from Qaliubiya, Egypt, who is 47 years old, completed higher education, and considers himself part of the lower middle class, several factors are crucial in determining the level of confidence in the World Health Organization (WHO). First, the cultural context of Egypt and the socioeconomic background of the persona play a role in shaping their perception of international organizations like the WHO. Additionally, individual values and personal experience may influence their opinion, as well as their understanding of cultural relativism and nuanced interpretations of the question. Considering the persona's background, they might have quite a lot of confidence in the World Health Organization (WHO).\n\n2"]}, {"persona": {"region": "Qaliubiya", "sex": "female", "age": 38, "country": "Egypt", "marital_status": "married", "education": "higher", "social_class": "working class"}, "question": {"id": "Q88", "variant": 0}, "response": ["Based on the anthropological framework, as a married female from Qaliubiya, Egypt, with a working-class background, my emic perspective is heavily influenced by my cultural context, individual values, and personal experience. My trust in the World Health Organization (WHO) is shaped by my socioeconomic background, as I am aware of the challenges and limitations faced by individuals in my community when it comes to accessing healthcare. Additionally, I consider the WHO's approach and recommendations from my own cultural lens, taking into account the nuances of my personal experiences and the experiences of others in my community. Therefore, my confidence in the WHO is influenced by these factors and I select option 3: Not very much."]}, {"persona": {"region": "Qaliubiya", "sex": "male", "age": 58, "country": "Egypt", "marital_status": "married", "education": "middle", "social_class": "working class"}, "question": {"id": "Q88", "variant": 0}, "response": ["Based on the anthropological framework, as a married male from Qaliubiya, Egypt, my emic perspective is influenced by my cultural context, individual values, and socioeconomic background. In my cultural context, there is a strong emphasis on trust and respect for authority figures, which influences my level of confidence in the World Health Organization. Additionally, my individual values and personal experiences shape my perception of the WHO, as I may have had direct or indirect interactions with the organization. Furthermore, my socioeconomic background as a working-class individual may affect my access to information and resources related to the WHO. Taking into account these factors, I would choose option (2) Quite a lot, as I have a moderate level of confidence in the World Health Organization. \n\n2"]}, {"persona": {"region": "Qaliubiya", "sex": "female", "age": 27, "country": "Egypt", "marital_status": "married", "education": "higher", "social_class": "working class"}, "question": {"id": "Q88", "variant": 0}, "response": ["Based on the anthropological framework, my perspective on the World Health Organization (WHO) is influenced by my cultural context, individual values, and socioeconomic background. As a woman from Qaliubiya, Egypt, I have been raised in a society where education and knowledge are highly valued, and I have completed higher education myself. Additionally, being part of the working class, I am aware of the importance of access to reliable healthcare information and resources. Considering the emic and etic perspectives, I believe that the WHO plays a crucial role in providing global health guidance and support, especially during times of crisis. Therefore, I have a great deal of confidence in the World Health Organization (WHO).\n\n1"]}, {"persona": {"region": "Qaliubiya", "sex": "female", "age": 48, "country": "Egypt", "marital_status": "married", "education": "middle", "social_class": "upper middle class"}, "question": {"id": "Q88", "variant": 0}, "response": ["Based on the anthropological framework, as a married female from Qaliubiya, Egypt, with a middle education level and part of the upper middle class, my emic perspective on the World Health Organization (WHO) would be influenced by the cultural context of my community and the societal values and experiences that have shaped my understanding. Additionally, my socioeconomic background and age would also play a role in my perception of the WHO. Considering the nuance of the question, I would select option 2, \"Quite a lot,\" as I have confidence in the WHO's ability to address global health issues and have seen the impact of their work in my community. \n\n2"]}, {"persona": {"region": "Giza", "sex": "female", "age": 19, "country": "Egypt", "marital_status": "single", "education": "middle", "social_class": "working class"}, "question": {"id": "Q88", "variant": 0}, "response": ["Based on my emic perspective, as a single female from Giza, Egypt, who is 19 years old and part of the working class, my cultural context and socioeconomic background have influenced my understanding of the World Health Organization (WHO). Growing up in a middle education level, I have learned to be critical of institutions and organizations that claim to have authority over global health. Additionally, my individual values and personal experiences have taught me to be cautious and skeptical of international organizations that may not fully understand or address the specific needs and concerns of my community. Therefore, I have chosen option (3) Not very much."]}, {"persona": {"region": "Giza", "sex": "female", "age": 38, "country": "Egypt", "marital_status": "married", "education": "higher", "social_class": "lower middle class"}, "question": {"id": "Q88", "variant": 0}, "response": ["Based on the anthropological framework, my emic perspective as a married female from Giza, Egypt would be influenced by my cultural context, individual values and personal experience, socioeconomic background, and space and time. As a member of the lower middle class in Egypt, I may have limited access to healthcare and rely heavily on organizations like the World Health Organization (WHO) for information and guidance. My personal experience and cultural context would lead me to have a great deal of confidence in the WHO, as they provide valuable resources and support for individuals in my socioeconomic position. Additionally, as a 38-year-old woman who has completed higher education, I have likely been exposed to a variety of information and resources from the WHO, further increasing my confidence in their capabilities and impact.\n\n2"]}, {"persona": {"region": "Beni Swaif/Beni Suef", "sex": "female", "age": 34, "country": "Egypt", "marital_status": "divorced", "education": "higher", "social_class": "lower class"}, "question": {"id": "Q88", "variant": 0}, "response": ["Based on the anthropological framework, my emic perspective as a divorced female from Beni Swaif, Egypt, who is 34 years old and part of the lower class, influences my understanding and confidence in the World Health Organization (WHO). The cultural context of my upbringing and surroundings has led me to have a more skeptical view of international organizations like the WHO, as they may not always understand or prioritize the needs of individuals in my community. My socioeconomic background also plays a role in this, as I have had limited access to healthcare and resources, leading to a decreased trust in global health organizations. Additionally, my personal experiences and values have shaped my perception, and I believe that local initiatives and community support are more reliable in addressing healthcare needs. Therefore, my confidence in the WHO is not very much.\n3"]}, {"persona": {"region": "Beni Swaif/Beni Suef", "sex": "male", "age": 20, "country": "Egypt", "marital_status": "single", "education": "higher", "social_class": "working class"}, "question": {"id": "Q88", "variant": 0}, "response": ["Based on the anthropological framework, my perspective as a single male from Beni Swaif, Egypt, who has completed higher education and considers himself part of the working class, is influenced by my cultural context, individual values, and socioeconomic background. In Egypt, there is a strong sense of community and trust in institutions such as the WHO. My personal experience and education have also shaped my understanding of the importance of global health organizations. Additionally, as part of the working class, I recognize the impact that global health initiatives can have on communities like mine. Therefore, my confidence in the World Health Organization is (1) A great deal."]}, {"persona": {"region": "Giza", "sex": "male", "age": 19, "country": "Egypt", "marital_status": "single", "education": "middle", "social_class": "upper middle class"}, "question": {"id": "Q88", "variant": 0}, "response": ["Based on the anthropological framework described above, my perspective as a 19-year-old single male from Giza, Egypt, who considers himself part of the upper middle class, is influenced by a variety of factors. My cultural context, including my socioeconomic background and educational level, has shaped my understanding of institutions like the World Health Organization. Additionally, my individual values and personal experiences play a significant role in how much confidence I have in the WHO. Given these considerations, my answer reflects my nuanced understanding of the world and my position within it.\n\n2"]}, {"persona": {"region": "Giza", "sex": "female", "age": 33, "country": "Egypt", "marital_status": "married", "education": "middle", "social_class": "working class"}, "question": {"id": "Q88", "variant": 0}, "response": ["Based on the anthropological framework, as a married female from Giza, Egypt, who is 33 years old and part of the working class, my perspective on the World Health Organization (WHO) would be heavily influenced by my cultural context, individual values, and socioeconomic background. In Egypt, access to healthcare and public health infrastructure can vary greatly based on socioeconomic status. Additionally, there may be a level of skepticism towards international organizations like the WHO, especially given the historical and ongoing political and economic challenges faced by the country. Therefore, I would likely have \"Not very much\" confidence in the World Health Organization (WHO) due to these factors.\n\n3"]}, {"persona": {"region": "Giza", "sex": "female", "age": 24, "country": "Egypt", "marital_status": "married", "education": "higher", "social_class": "working class"}, "question": {"id": "Q88", "variant": 0}, "response": ["Based on my cultural context as a married female from Giza, Egypt, my personal experience and individual values as a young, educated woman from the working class, and my socioeconomic background, I would answer this question from the perspective of someone who is skeptical of international organizations and their ability to truly understand and address the needs of people from diverse backgrounds. Additionally, my cultural relativism and nuanced understanding of the question would lead me to consider the historical and current geopolitical dynamics that shape the operations and decisions of the WHO. Therefore, my answer would be:\n3"]}, {"persona": {"region": "Giza", "sex": "male", "age": 50, "country": "Egypt", "marital_status": "married", "education": "higher", "social_class": "working class"}, "question": {"id": "Q88", "variant": 0}, "response": ["Based on the anthropological framework, my response to the question of how much confidence I have in the World Health Organization (WHO) is influenced by my emic perspective as a married male from Giza, Egypt, and my etic perspective as part of the working class. My cultural context and individual values also play a role, as I have completed a higher education level and am 50 years of age. Additionally, my socioeconomic background as a working-class individual in Egypt shapes my perception. Considering the nuances of the question, I would say that I have quite a lot of confidence in the World Health Organization (WHO) as they have provided valuable information and guidance during global health crises.\n\n2"]}, {"persona": {"region": "Beni Swaif/Beni Suef", "sex": "female", "age": 26, "country": "Egypt", "marital_status": "married", "education": "higher", "social_class": "lower middle class"}, "question": {"id": "Q88", "variant": 0}, "response": ["Based on the anthropological framework, my answer to the question of how much confidence I have in the World Health Organization (WHO) is influenced by my emic perspective as a married female from Beni Swaif, Egypt. The cultural context of my society, along with my individual values and personal experience, shape my perception of global health organizations. Additionally, my socioeconomic background as a lower middle-class individual impacts my trust in international institutions. Considering the nuanced phrasing of the question and the space and time in which I live, I select the option:\n\n2) Quite a lot"]}, {"persona": {"region": "Beni Swaif/Beni Suef", "sex": "male", "age": 40, "country": "Egypt", "marital_status": "single", "education": "lower", "social_class": "lower class"}, "question": {"id": "Q88", "variant": 0}, "response": ["Based on my emic perspective, as a lower class individual from Beni Swaif, Egypt, my cultural context and socioeconomic background greatly influence my understanding and confidence in the World Health Organization (WHO). My personal experience and individual values also play a significant role in shaping my perception. Additionally, the cultural relativism perspective reminds me that not everyone may have the same confidence in the WHO, and nuance is important in understanding my response. \n\n3"]}, {"persona": {"region": "Beni Swaif/Beni Suef", "sex": "female", "age": 25, "country": "Egypt", "marital_status": "married", "education": "middle", "social_class": "lower middle class"}, "question": {"id": "Q88", "variant": 0}, "response": ["Based on my emic perspective, as a married female from Beni Swaif, Egypt, and part of the lower middle class, my cultural context and socioeconomic background heavily influence my perception of the World Health Organization (WHO). I have limited access to education and resources, so my understanding of global health organizations is likely to be more influenced by local healthcare systems and personal experiences. Additionally, cultural relativism teaches me to be cautious of placing too much trust in external institutions, as my community may have different values and priorities. Therefore, my confidence in the WHO is likely to be not very much.\n\n3"]}, {"persona": {"region": "Beni Swaif/Beni Suef", "sex": "female", "age": 21, "country": "Egypt", "marital_status": "single", "education": "middle", "social_class": "lower middle class"}, "question": {"id": "Q88", "variant": 0}, "response": ["Based on the anthropological framework, my emic perspective as a 21-year-old single female from Beni Swaif/Beni Suef, Egypt, who has completed middle education and considers herself part of the lower middle class, is heavily influenced by my cultural context, individual values, and socioeconomic background. In my community, there is a general distrust of international organizations and their ability to truly understand and address the health needs of our local population. This skepticism is rooted in historical experiences of feeling marginalized and overlooked by global institutions. Additionally, my socioeconomic background has shaped my perception of the WHO, as I have limited access to healthcare resources and may not fully benefit from their initiatives. Therefore, my confidence in the World Health Organization is not very much. \n\n3"]}, {"persona": {"region": "Beni Swaif/Beni Suef", "sex": "male", "age": 48, "country": "Egypt", "marital_status": "married", "education": "middle", "social_class": "lower middle class"}, "question": {"id": "Q88", "variant": 0}, "response": ["From my emic perspective as a married middle-aged man from Beni Swaif, Egypt, I have been influenced by my cultural context, individual values, and socioeconomic background. In my community, access to healthcare and information from international organizations like the WHO is limited, and I have personally experienced challenges in accessing quality healthcare. Therefore, my confidence in the WHO may not be as high as someone from a more privileged background. Additionally, my lower middle-class status and lower level of education may also contribute to my skepticism towards international organizations. Considering cultural relativism, the nuanced phrasing of the question, and the influence of my personal experience, I would choose the following option:\n\n3"]}, {"persona": {"region": "Beni Swaif/Beni Suef", "sex": "female", "age": 57, "country": "Egypt", "marital_status": "married", "education": "middle", "social_class": "working class"}, "question": {"id": "Q88", "variant": 0}, "response": ["Based on my emic perspective as a married female from Beni Swaif, Egypt, I have a deep respect for the World Health Organization (WHO) due to the cultural context and personal values ingrained in me. In my community, the WHO has provided valuable health resources and support, especially during times of crisis. Additionally, my socioeconomic background as part of the working class has made me reliant on the WHO for accessible and reliable healthcare information. Furthermore, my age and middle education level have allowed me to understand the importance of global health organizations like the WHO. Therefore, I have a great deal of confidence in the World Health Organization.\n\n1"]}, {"persona": {"region": "Beni Swaif/Beni Suef", "sex": "male", "age": 20, "country": "Egypt", "marital_status": "single", "education": "middle", "social_class": "working class"}, "question": {"id": "Q88", "variant": 0}, "response": ["Based on the anthropological framework described above, my perspective on the World Health Organization (WHO) is influenced by my cultural context, individual values, and socioeconomic background. As a young, working-class male from Beni Swaif, Egypt, I have limited access to formal education and resources, which may affect my confidence in the WHO. Additionally, my cultural context and personal experiences shape my perspective on global health organizations. Therefore, I would choose the option that best represents my level of confidence in the WHO.\n\n3"]}, {"persona": {"region": "Giza", "sex": "female", "age": 59, "country": "Egypt", "marital_status": "married", "education": "higher", "social_class": "upper middle class"}, "question": {"id": "Q88", "variant": 0}, "response": ["Based on my emic perspective as a married female from Giza, Egypt, my cultural context and socioeconomic background contribute to my answer. In Egypt, education is highly valued and I have completed higher education, which has provided me with the critical thinking skills to form an informed opinion. Additionally, my socioeconomic status as part of the upper middle class means that I have access to reliable information and resources. My age and life experience also play a role, as I have lived through various global health challenges. Considering cultural relativism, I understand that the WHO operates within a global context and takes into account diverse cultural perspectives. Therefore, I have quite a lot of confidence in the World Health Organization (WHO).\n\n2"]}, {"persona": {"region": "Giza", "sex": "female", "age": 38, "country": "Egypt", "marital_status": "single", "education": "higher", "social_class": "lower middle class"}, "question": {"id": "Q88", "variant": 0}, "response": ["Based on the anthropological framework, my perspective as a single female from Giza, Egypt, who is 38 years old and part of the lower middle class is heavily influenced by my cultural context, individual values, and socioeconomic background. As a member of the lower middle class in Egypt, I may have limited access to healthcare and rely on organizations like the WHO for information and resources. Additionally, my personal experiences and values may lead me to have a great deal of confidence in the WHO, as they provide valuable support and guidance for public health issues that directly impact my community. Therefore, my answer would be:\n\n2"]}, {"persona": {"region": "Giza", "sex": "female", "age": 26, "country": "Egypt", "marital_status": "single", "education": "higher", "social_class": "working class"}, "question": {"id": "Q88", "variant": 0}, "response": ["Based on the anthropological framework, my emic perspective as a single female from Giza, Egypt, who has completed higher education and considers herself part of the working class, is influenced by my cultural context, individual values, and socioeconomic background. In Egypt, there is a strong sense of community and trust in institutions like the WHO. As someone who has pursued higher education and is part of the working class, I have a greater understanding and appreciation for the importance of global health organizations. Additionally, my personal experience and values lead me to have a great deal of confidence in the WHO, as I have seen the positive impact of their work in my own community. Therefore, my answer to the question would be: \n\n2"]}, {"persona": {"region": "Giza", "sex": "male", "age": 39, "country": "Egypt", "marital_status": "married", "education": "middle", "social_class": "working class"}, "question": {"id": "Q88", "variant": 0}, "response": ["Based on the anthropological framework, as a married male from Giza, Egypt, at 39 years of age with a middle education level and working-class background, my perspective on the World Health Organization (WHO) is influenced by my cultural context, individual values, and socioeconomic background. In Egypt, there is a strong emphasis on community and family values, and there is a general respect for authoritative organizations such as the WHO. However, my working-class background may lead me to have some skepticism, as I may feel disconnected from the global health policies and decisions made by the WHO. Additionally, my middle education level may limit my exposure to information about the WHO's work, and I may not have a comprehensive understanding of its impact. Therefore, I would say that I have (3) Not very much confidence in the World Health Organization."]}, {"persona": {"region": "Giza", "sex": "male", "age": 36, "country": "Egypt", "marital_status": "married", "education": "middle", "social_class": "working class"}, "question": {"id": "Q88", "variant": 0}, "response": ["Based on my cultural context and socioeconomic background, as a married male from Giza, Egypt, I have limited access to formal education and resources. I also belong to the working class, which means that I have to rely on public healthcare systems and organizations such as the World Health Organization (WHO) for information and support. Given my individual values and personal experience, I have developed a great deal of confidence in the WHO because they provide important health-related information and resources that are essential for me and my community. Additionally, my cultural relativism and understanding of nuance also play a role in my confidence in the WHO, as I recognize the importance of global health initiatives and the need for international organizations to support communities like mine. Therefore, I choose: \n\n(1) A great deal"]}, {"persona": {"region": "Giza", "sex": "female", "age": 30, "country": "Egypt", "marital_status": "single", "education": "higher", "social_class": "lower class"}, "question": {"id": "Q88", "variant": 0}, "response": ["Based on my personal experience and socioeconomic background as a lower class single female from Giza, Egypt, my confidence in the World Health Organization (WHO) is not very much. My lower socioeconomic status means that I may not have access to the same healthcare resources and information as those in higher classes, which could lead to a lack of trust in global health organizations like the WHO. Additionally, cultural context and space and time play a role in shaping my perspective, as Egypt has its own healthcare system and cultural beliefs that may differ from the WHO's recommendations. Overall, my personal experience and social background lead me to have less confidence in the WHO's ability to address the health needs of people like myself.\n\n3"]}, {"persona": {"region": "Giza", "sex": "female", "age": 24, "country": "Egypt", "marital_status": "single", "education": "higher", "social_class": "lower class"}, "question": {"id": "Q88", "variant": 0}, "response": ["Based on my personal experience and cultural context, as a 24-year-old woman from Giza, Egypt, who considers herself part of the lower class, my confidence in the World Health Organization (WHO) is not very much. This is because I have observed that the WHO’s policies and recommendations often do not take into account the specific needs and challenges faced by individuals from lower socioeconomic backgrounds, especially in my community. Additionally, there is a lack of access to the healthcare resources and information provided by the WHO in my area, which has led to a sense of disconnect and mistrust. Therefore, I do not have a great deal of confidence in the WHO's ability to address the health concerns of people like me.\n\n3"]}, {"persona": {"region": "Giza", "sex": "male", "age": 65, "country": "Egypt", "marital_status": "married", "education": "middle", "social_class": "working class"}, "question": {"id": "Q88", "variant": 0}, "response": ["Based on the anthropological framework, as a married male from Giza, Egypt, at the age of 65 with a middle education level and considering myself part of the working class, my perspective on the World Health Organization (WHO) would be influenced by cultural context, individual values, socioeconomic background, and space and time. In my cultural context, there may be a tendency to trust international organizations like the WHO due to the importance of global health initiatives in Egypt. However, my individual values and personal experience as a working-class individual may lead me to have some skepticism, as I may feel disconnected from the decisions made by international organizations. Additionally, my socioeconomic background and age may lead me to have a pragmatic view, recognizing the importance of global health efforts while also acknowledging the limitations and challenges faced by organizations like the WHO.\n\n3"]}, {"persona": {"region": "Giza", "sex": "female", "age": 56, "country": "Egypt", "marital_status": "married", "education": "middle", "social_class": "working class"}, "question": {"id": "Q88", "variant": 0}, "response": ["In considering the question of confidence in the World Health Organization (WHO), I must take into account my cultural context as a married female from Giza, Egypt, where access to and trust in healthcare systems may differ from other regions. My socio-economic background as a working-class individual also influences my perception of global health organizations. Additionally, my age and level of education have shaped my understanding of the world and its institutions. Considering these factors, I choose option (2) Quite a lot, as the WHO has provided valuable guidance and support in addressing public health challenges, and I have personally experienced the benefits of their work in my community."]}, {"persona": {"region": "Giza", "sex": "male", "age": 31, "country": "Egypt", "marital_status": "married", "education": "higher", "social_class": "lower middle class"}, "question": {"id": "Q88", "variant": 0}, "response": ["Based on my emic perspective as a married male from Giza, Egypt, I have grown up in a cultural context where the World Health Organization (WHO) has played a significant role in providing healthcare information and resources to my community. My personal experience and individual values have also been influenced by the WHO's presence and impact in my life. Considering my socioeconomic background as part of the lower middle class, I have seen firsthand the positive effects of the WHO's work in providing access to healthcare and essential resources for my family and community. Therefore, I have a great deal of confidence in the World Health Organization (WHO) and the crucial role it plays in promoting global health and well-being.\n\n1"]}, {"persona": {"region": "Giza", "sex": "male", "age": 28, "country": "Egypt", "marital_status": "single", "education": "middle", "social_class": "working class"}, "question": {"id": "Q88", "variant": 0}, "response": ["Based on my cultural context, as a working-class male from Giza, Egypt, my perspective on the World Health Organization (WHO) may be different from others. My individual values and personal experience have shaped my understanding of the WHO, and I may have limited access to information about its work. Additionally, my socioeconomic background and level of education could influence my perception of the organization. I may have a nuanced understanding of the WHO based on my age and place, and I may consider cultural relativism in my assessment. Therefore, my confidence in the World Health Organization is likely to be not very much (3)."]}, {"persona": {"region": "Giza", "sex": "male", "age": 47, "country": "Egypt", "marital_status": "married", "education": "middle", "social_class": "lower middle class"}, "question": {"id": "Q88", "variant": 0}, "response": ["Based on the anthropological framework of emic and etic perspectives, cultural context, individual values and personal experience, socioeconomic background, and space and time, as a married male from Giza, Egypt, at 47 years of age with a middle education level and lower middle-class status, my confidence in the World Health Organization (WHO) would be influenced by my cultural context and personal experience. In Egypt, there is a strong emphasis on communal values and trust in institutions, including international organizations like the WHO. Additionally, my lower middle-class status and middle education level may lead me to have a more critical view of global institutions due to a lack of personal exposure and understanding of their work. Therefore, my confidence in the WHO would likely be \"quite a lot\" as it aligns with the cultural emphasis on trust in institutions, while also recognizing the limitations of my personal exposure and understanding of global health issues.\n\n2"]}, {"persona": {"region": "Giza", "sex": "male", "age": 26, "country": "Egypt", "marital_status": "single", "education": "middle", "social_class": "lower middle class"}, "question": {"id": "Q88", "variant": 0}, "response": ["Based on the anthropological framework, the emic perspective of the persona from Giza, Egypt would be heavily influenced by their cultural context, individual values, and socioeconomic background. As a lower middle class individual with a middle education level, their access to information and exposure to global health issues may be limited. Additionally, their personal experience and values may shape their perception of international organizations like the WHO. Their socioeconomic background may also lead them to have a more skeptical view of global institutions. Therefore, from this perspective, the persona would likely have \"Not very much\" confidence in the World Health Organization.\n\n3"]}, {"persona": {"region": "Giza", "sex": "male", "age": 48, "country": "Egypt", "marital_status": "married", "education": "middle", "social_class": "upper middle class"}, "question": {"id": "Q88", "variant": 0}, "response": ["Based on my emic perspective, coming from a cultural context in Giza, Egypt, I value the reputation and authority of international organizations such as the World Health Organization. My individual values and personal experiences have led me to believe that the WHO plays a crucial role in global health and I have confidence in its work. Considering my socioeconomic background as part of the upper middle class, I have had access to education and resources that have allowed me to understand and appreciate the importance of organizations like the WHO. Additionally, cultural relativism teaches me to respect and trust the expertise of global organizations in addressing health issues. Therefore, my answer is: 1) A great deal"]}, {"persona": {"region": "Menya", "sex": "male", "age": 61, "country": "Egypt", "marital_status": "married", "education": "middle", "social_class": "working class"}, "question": {"id": "Q88", "variant": 0}, "response": ["From the perspective of a married, 61-year-old male from Menya, Egypt, who has completed middle education and considers himself part of the working class, my answer to the question of how much confidence I have in the World Health Organization (WHO) will be influenced by my cultural context, individual values, and socioeconomic background. As someone from a lower socioeconomic background, I may have limited access to information and resources, which could impact my perception of international organizations like the WHO. Additionally, my personal experience and age may have shaped my beliefs and level of trust in such institutions. Considering the cultural relativism aspect of the framework, I may also view the WHO through the lens of my own cultural values and beliefs. Therefore, my answer will be reflective of these factors.\n\n3"]}, {"persona": {"region": "Menya", "sex": "male", "age": 41, "country": "Egypt", "marital_status": "married", "education": "middle", "social_class": "lower middle class"}, "question": {"id": "Q88", "variant": 0}, "response": ["Based on the anthropological framework, as a married male from Menya, Egypt, who is 41 years old and part of the lower middle class, my emic perspective is heavily influenced by the cultural context and socioeconomic background. Egypt has a complex relationship with international organizations, including the WHO, due to historical and political factors. Additionally, being part of the lower middle class means that access to healthcare and information from global health organizations may be limited. My individual values and personal experience also play a role, as I may have had negative experiences with the healthcare system and may not trust international organizations. Therefore, I would have \"Not very much\" confidence in the World Health Organization (WHO).\n\n3"]}, {"persona": {"region": "Menya", "sex": "female", "age": 43, "country": "Egypt", "marital_status": "married", "education": "higher", "social_class": "working class"}, "question": {"id": "Q88", "variant": 0}, "response": ["Based on my emic perspective as a married female from Menya, Egypt, and considering my cultural context, individual values, and socioeconomic background, I have a moderate amount of confidence in the World Health Organization (WHO). In my community, higher education and age are respected, and I have been taught to value evidence-based information. As a working-class individual, I understand the importance of global health organizations in providing resources and support for communities like mine. However, I also recognize that there may be limitations and biases within organizations like the WHO, and I cannot blindly trust them without critically evaluating their actions and decisions. Therefore, my answer to the question is:\n\n2) Quite a lot"]}, {"persona": {"region": "Menya", "sex": "male", "age": 57, "country": "Egypt", "marital_status": "married", "education": "middle", "social_class": "lower middle class"}, "question": {"id": "Q88", "variant": 0}, "response": ["Based on my emic perspective as a married male from Menya, Egypt, and my lower-middle-class socioeconomic background, I have a limited access to information and resources. This means that my understanding of the World Health Organization (WHO) and their work may be influenced by my limited exposure to their initiatives and programs. Additionally, my individual values and personal experiences may shape my perception of the WHO, as I may have had limited interactions with their services. My cultural context and nuanced understanding of global health organizations may lead me to have not very much confidence in the WHO, as I may have experienced challenges accessing their resources or may have heard negative perceptions from my community. Additionally, cultural relativism is important to consider as my perspective may differ from others based on our unique cultural and socioeconomic backgrounds.\n\n3"]}, {"persona": {"region": "Menya", "sex": "male", "age": 42, "country": "Egypt", "marital_status": "divorced", "education": "middle", "social_class": "lower middle class"}, "question": {"id": "Q88", "variant": 0}, "response": ["Based on the anthropological framework, my perspective as a divorced male from Menya, Egypt, who is 42 years old and part of the lower middle class, is heavily influenced by my cultural context, individual values, and socioeconomic background. In Menya, there may be skepticism towards international organizations like the World Health Organization due to a lack of direct impact on our community and a sense of distrust towards external influences. Additionally, my lower middle class status and limited education level may contribute to a more cautious and critical perspective towards global health organizations. Therefore, I would choose option 3: Not very much, as my confidence in the World Health Organization may be limited due to these factors. \n\n3"]}, {"persona": {"region": "Menya", "sex": "female", "age": 59, "country": "Egypt", "marital_status": "married", "education": "middle", "social_class": "upper middle class"}, "question": {"id": "Q88", "variant": 0}, "response": ["Based on the anthropological framework, my individual values and personal experience, as well as my socioeconomic background, greatly influence my perception of the World Health Organization (WHO). As someone from Menya, Egypt, I have been exposed to a different cultural context and have seen how the WHO operates in the region. Additionally, my upper middle class status and age have provided me with the opportunity to access education and information that may shape my understanding of the WHO. Therefore, my confidence in the WHO is quite a lot.\n\n2"]}, {"persona": {"region": "Menya", "sex": "female", "age": 31, "country": "Egypt", "marital_status": "married", "education": "middle", "social_class": "working class"}, "question": {"id": "Q88", "variant": 0}, "response": ["Based on the anthropological framework, my perspective on the World Health Organization (WHO) is influenced by my cultural context as a married female from Menya, Egypt, as well as my individual values and personal experience. As a member of the working class with a middle education level, I have limited access to information and resources, which may impact my confidence in the WHO. Additionally, my socioeconomic background and cultural relativism play a role in shaping my views on global health organizations. Considering these factors, I would choose:\n\n(3) Not very much"]}, {"persona": {"region": "Menya", "sex": "male", "age": 55, "country": "Egypt", "marital_status": "single", "education": "middle", "social_class": "working class"}, "question": {"id": "Q88", "variant": 0}, "response": ["From the perspective of a single male from Menya, Egypt, who is 55 years old, has completed middle education, and considers himself part of the working class, my answer to the question of how much confidence I have in the World Health Organization (WHO) is shaped by my cultural context, individual values, and socioeconomic background. In Egypt, there is a deep respect for authority and international organizations like the WHO are generally viewed with a great deal of confidence. However, as a member of the working class, I may have limited access to information and resources, which could impact my level of confidence in the WHO's ability to address the health needs of people like me. Additionally, my age and level of education may influence my understanding of the WHO's role and effectiveness. Therefore, I would say my confidence in the World Health Organization is quite a lot.\n\n2"]}, {"persona": {"region": "Menya", "sex": "female", "age": 28, "country": "Egypt", "marital_status": "married", "education": "higher", "social_class": "lower middle class"}, "question": {"id": "Q88", "variant": 0}, "response": ["Based on the anthropological framework, as a married female from Menya, Egypt, my emic perspective on the World Health Organization (WHO) would be influenced by the cultural context of my community and my individual values and personal experience. The cultural context in Menya includes a strong emphasis on community and family health, which would likely lead me to have a great deal of confidence in the WHO, as they provide important global health guidance and support. Additionally, my personal experience of completing higher education and being part of the lower middle class would lead me to value the expertise and resources that the WHO provides. Therefore, I would choose option (1) A great deal."]}, {"persona": {"region": "Menya", "sex": "male", "age": 24, "country": "Egypt", "marital_status": "single", "education": "middle", "social_class": "working class"}, "question": {"id": "Q88", "variant": 0}, "response": ["Based on my emic perspective as a working-class male from Menya, Egypt, my confidence in the World Health Organization (WHO) is influenced by the cultural context of my community and my personal experience. The cultural context of Menya, Egypt shapes my understanding of health and healthcare, and my personal experience with the healthcare system may lead me to have a certain level of confidence in the WHO. Additionally, my socioeconomic background as part of the working class may also influence my perception of global health organizations. Therefore, considering these factors, I would choose the following option:\n\n2"]}, {"persona": {"region": "Menya", "sex": "female", "age": 23, "country": "Egypt", "marital_status": "married", "education": "middle", "social_class": "working class"}, "question": {"id": "Q88", "variant": 0}, "response": ["Based on my emic perspective as a married female from Menya, Egypt, and understanding of the cultural context in which I live, I have a limited amount of exposure to the World Health Organization (WHO). My individual values and personal experience, combined with my socioeconomic background as part of the working class, lead me to have limited confidence in the WHO due to the lack of direct impact or influence they have had on my life. Additionally, cultural relativism teaches me to approach this question with an understanding that the WHO's influence and impact may vary from culture to culture. Therefore, my limited exposure and personal beliefs lead me to choose option 3: Not very much.\n\n3"]}, {"persona": {"region": "Menya", "sex": "male", "age": 27, "country": "Egypt", "marital_status": "single", "education": "middle", "social_class": "lower middle class"}, "question": {"id": "Q88", "variant": 0}, "response": ["Based on my emic perspective, as a single male from Menya, Egypt, I have been influenced by my cultural context and personal experience. My socioeconomic background as part of the lower middle class has shaped my perception of the world and the organizations within it. I have limited access to higher education and resources, which may lead me to view institutions such as the World Health Organization with skepticism. Additionally, the cultural relativism within my community may also impact my perception, as there may be differing opinions on international organizations. Therefore, I would have limited confidence in the World Health Organization, as my personal experience and cultural context have influenced my perspective.\n\n3"]}, {"persona": {"region": "Asyut", "sex": "male", "age": 30, "country": "Egypt", "marital_status": "married", "education": "middle", "social_class": "working class"}, "question": {"id": "Q88", "variant": 0}, "response": ["Based on the anthropological framework, as a married male from Asyut, Egypt, with a middle education level and part of the working class, my perspective on the World Health Organization (WHO) would be influenced by various factors. My cultural context, individual values, and personal experience may lead me to have a moderate level of confidence in WHO. Socioeconomic background and access to information may also play a role in my perception of global health organizations. Additionally, the nuance of the question and the space and time in which I live will influence my response. Therefore, I choose:\n\n2"]}, {"persona": {"region": "Asyut", "sex": "female", "age": 26, "country": "Egypt", "marital_status": "married", "education": "middle", "social_class": "working class"}, "question": {"id": "Q88", "variant": 0}, "response": ["Based on the anthropological framework, as a married female from Asyut, Egypt, my emic perspective is heavily influenced by my cultural context, individual values, and socioeconomic background. In my community, there is a strong emphasis on the importance of family and community support, and my working-class background means that access to healthcare and reliable information from organizations like the WHO may be limited. Additionally, my personal experience and education level may lead me to have less confidence in the WHO due to potential misinformation and lack of resources. Therefore, I would choose option 3: Not very much."]}, {"persona": {"region": "Asyut", "sex": "male", "age": 32, "country": "Egypt", "marital_status": "single", "education": "higher", "social_class": "lower middle class"}, "question": {"id": "Q88", "variant": 0}, "response": ["Based on the anthropological framework, my emic perspective as a single male from Asyut, Egypt, who is 32 years old and considers himself part of the lower middle class, would heavily influence my answer to the question. As someone who has completed higher education, I value the opinions of authoritative organizations such as the World Health Organization. However, my socioeconomic background and cultural context might lead me to have some skepticism towards international organizations, especially if their recommendations do not align with the resources and realities of my community. Therefore, I would choose option (2) Quite a lot, as I believe in the expertise of the WHO, but I also have some reservations based on my personal and cultural experiences."]}, {"persona": {"region": "Asyut", "sex": "female", "age": 21, "country": "Egypt", "marital_status": "married", "education": "middle", "social_class": "working class"}, "question": {"id": "Q88", "variant": 0}, "response": ["Based on the anthropological framework, as a married female from Asyut, Egypt, with a middle education level and part of the working class, my perspective on the World Health Organization (WHO) would be influenced by my cultural context, individual values, and socioeconomic background. In Egypt, access to healthcare and information from international organizations like the WHO may be limited, particularly for those in the working class. Additionally, personal experiences and values may lead me to have skepticism towards international organizations due to a lack of direct impact on my daily life. Therefore, I would choose option (3) Not very much as my confidence in the World Health Organization. \n\n3"]}, {"persona": {"region": "Asyut", "sex": "female", "age": 30, "country": "Egypt", "marital_status": "married", "education": "higher", "social_class": "working class"}, "question": {"id": "Q88", "variant": 0}, "response": ["Based on the anthropological framework, my perspective as a married female from Asyut, Egypt, who is 30 years old, has completed higher education and considers herself part of the working class, is influenced by my cultural context, individual values, and socioeconomic background. In my cultural context, I have been taught to respect and trust organizations that are considered authoritative and knowledgeable. Additionally, my personal experience and education level have led me to value scientific and evidence-based information. As a member of the working class, I have limited access to healthcare resources and rely on organizations like the WHO for guidance and support. Therefore, I have a great deal of confidence in the World Health Organization (WHO).\n\n1"]}, {"persona": {"region": "Asyut", "sex": "female", "age": 42, "country": "Egypt", "marital_status": "married", "education": "higher", "social_class": "lower middle class"}, "question": {"id": "Q88", "variant": 0}, "response": ["Based on my personal experience and cultural context as a married female from Asyut, Egypt, I have limited confidence in the World Health Organization (WHO). My socioeconomic background as part of the lower middle class has influenced my access to healthcare and the quality of healthcare I receive. Additionally, my age and education level have shaped my understanding of global health organizations. I believe that the WHO may not fully understand or address the health needs of individuals from my community. Therefore, I have limited confidence in the organization's ability to truly serve and support people like me.\n\n3"]}, {"persona": {"region": "Sohag", "sex": "male", "age": 63, "country": "Egypt", "marital_status": "married", "education": "middle", "social_class": "lower middle class"}, "question": {"id": "Q88", "variant": 0}, "response": ["Based on the anthropological framework, as a married male from Sohag, Egypt, who is 63 years old and part of the lower middle class, my emic perspective on the World Health Organization (WHO) is likely influenced by my cultural context, individual values, and socioeconomic background. Given my limited education and socioeconomic status, I may not have had much exposure to international health organizations like the WHO. Additionally, my personal experience and values may lead me to prioritize local healthcare providers and government health initiatives over international organizations. Therefore, I would likely have \"Not very much\" confidence in the World Health Organization. \n\n3"]}, {"persona": {"region": "Sohag", "sex": "male", "age": 27, "country": "Egypt", "marital_status": "married", "education": "middle", "social_class": "working class"}, "question": {"id": "Q88", "variant": 0}, "response": ["Based on the anthropological framework of emic and etic perspectives, cultural context, individual values and personal experience, socioeconomic background, cultural relativism, space and time, and nuance, as a 27-year-old married male from Sohag, Egypt, with a middle education level and working-class background, my confidence in the World Health Organization (WHO) would be influenced by a combination of factors. Firstly, the cultural context in Egypt and the Middle East may shape my perception of international organizations such as the WHO. Additionally, my individual values and personal experiences, coupled with my socioeconomic background, may lead me to have a nuanced view of the WHO. Given the ongoing global health crisis and the impact of the WHO's guidance on my community and livelihood, my confidence in the organization may be influenced by my subjective understanding of its effectiveness in addressing public health challenges. Therefore, my perception may not align with conventional Western views of international health organizations. \n\n2"]}, {"persona": {"region": "Sohag", "sex": "male", "age": 56, "country": "Egypt", "marital_status": "married", "education": "higher", "social_class": "upper middle class"}, "question": {"id": "Q88", "variant": 0}, "response": ["From the emic perspective, as a married male from Sohag, Egypt, my cultural context and personal experience have shaped my understanding and perception of the World Health Organization (WHO). In my socioeconomic background as part of the upper middle class, I have had access to higher education and have been exposed to a variety of information and resources. Additionally, my age and place of residence have influenced my awareness and understanding of global health issues. Considering all of these factors, I have a great deal of confidence in the World Health Organization (WHO) and its ability to provide accurate and reliable information and guidance on public health matters.\n\n1"]}, {"persona": {"region": "Sohag", "sex": "male", "age": 51, "country": "Egypt", "marital_status": "married", "education": "higher", "social_class": "lower middle class"}, "question": {"id": "Q88", "variant": 0}, "response": ["Based on the anthropological framework, as a married male from Sohag, Egypt, who is 51 years old and part of the lower middle class, my perspective on the World Health Organization (WHO) would be influenced by my cultural context, individual values, and socioeconomic background. Living in Sohag, I am likely to have limited access to healthcare and may have experienced challenges in accessing necessary medical services. Therefore, I may have a more critical view of the WHO's effectiveness in addressing global health issues, as their initiatives may not have directly impacted my community. Additionally, my lower middle class status may lead me to have a more skeptical outlook on global organizations and their ability to address the needs of individuals in my socioeconomic position. Therefore, I would choose option (3) Not very much. \n\n3"]}, {"persona": {"region": "Sohag", "sex": "female", "age": 26, "country": "Egypt", "marital_status": "married", "education": "higher", "social_class": "working class"}, "question": {"id": "Q88", "variant": 0}, "response": ["Based on the anthropological framework, the emic and etic perspectives of the persona from Sohag, Egypt, would be influenced by their cultural context, individual values, socioeconomic background, and space and time. As a married female from Sohag, Egypt, who is 26 years old, completed higher education, and considers herself part of the working class, her confidence in the World Health Organization (WHO) would likely be influenced by her cultural context, personal experience, and individual values. Additionally, her socioeconomic background as a member of the working class may impact her perception of global health organizations like the WHO. Therefore, her response to the question would reflect a nuanced understanding based on her specific cultural and socioeconomic position.\n\n2"]}, {"persona": {"region": "Sohag", "sex": "female", "age": 29, "country": "Egypt", "marital_status": "married", "education": "higher", "social_class": "upper middle class"}, "question": {"id": "Q88", "variant": 0}, "response": ["Based on the anthropological framework, my perspective as a married female from Sohag, Egypt, who is 29 years old, has completed higher education, and considers herself part of the upper middle class, is influenced by my cultural context, individual values, and socioeconomic background. As a member of a community with a rich cultural history and strong familial ties, I place a great deal of emphasis on trust and respect for authoritative institutions such as the World Health Organization (WHO). My higher education has also instilled in me a deep appreciation for evidence-based research and global health initiatives, further bolstering my confidence in the WHO's capabilities. Additionally, my socioeconomic status allows me to access and engage with information that reinforces the credibility of the WHO. Therefore, I have a great deal of confidence in the World Health Organization. \n\n1"]}, {"persona": {"region": "Sohag", "sex": "male", "age": 51, "country": "Egypt", "marital_status": "married", "education": "middle", "social_class": "lower middle class"}, "question": {"id": "Q88", "variant": 0}, "response": ["From the perspective of a married male from Sohag, Egypt, who is 51 years old and considers himself part of the lower middle class, the answer to the question of how much confidence he has in the World Health Organization (WHO) would be heavily influenced by his cultural context, individual values, and socioeconomic background. In Sohag, access to healthcare and information about global health organizations may be limited, and the individual may rely more on personal experience and local healthcare providers. Additionally, his lower middle class status may affect his access to and trust in international healthcare organizations. Therefore, based on these factors, he would likely choose option 3) Not very much. \n\n3"]}, {"persona": {"region": "Qena", "sex": "male", "age": 32, "country": "Egypt", "marital_status": "single", "education": "middle", "social_class": "working class"}, "question": {"id": "Q88", "variant": 0}, "response": ["Based on the anthropological framework, as a single male from Qena, Egypt, who is part of the working class and completed middle education level, my perspective is heavily influenced by my cultural context and socioeconomic background. In Egypt, there is a general distrust of government and international organizations, including the World Health Organization (WHO). This distrust is rooted in historical and political factors, as well as the socioeconomic disparities that exist within the country. Additionally, my personal experience and individual values also contribute to my skepticism towards international organizations. Therefore, I would choose option (3) Not very much, as I have limited confidence in the WHO due to my cultural context, socioeconomic background, and personal experiences. \n\n3"]}, {"persona": {"region": "Qena", "sex": "male", "age": 54, "country": "Egypt", "marital_status": "married", "education": "middle", "social_class": "lower middle class"}, "question": {"id": "Q88", "variant": 0}, "response": ["Based on my cultural context in Qena, Egypt, my lower middle class socioeconomic background, and my 54 years of age, I have a more skeptical viewpoint when it comes to international organizations like the World Health Organization. My personal experience and individual values lead me to believe that these organizations may not fully understand the needs and challenges faced by people in my community. Additionally, my emic perspective from within my in-group informs me that there may be cultural differences and nuances that the WHO may not fully consider. Therefore, I have \"Not very much\" confidence in the World Health Organization.\n\n3"]}, {"persona": {"region": "Qena", "sex": "male", "age": 25, "country": "Egypt", "marital_status": "single", "education": "lower", "social_class": "lower class"}, "question": {"id": "Q88", "variant": 0}, "response": ["Based on the anthropological framework, as a single male from Qena, Egypt, who is 25 years old, with a lower education level and considers himself part of the lower class, my perspective on the World Health Organization (WHO) would be influenced by my cultural context, individual values, and socioeconomic background. In my cultural context, the influence of WHO may not be as prominent or directly beneficial to my everyday life. Additionally, my individual values and personal experience may lead me to have less confidence in organizations that are not directly involved in my community or immediate surroundings. Furthermore, my socioeconomic background as part of the lower class may lead me to have less trust in global organizations due to potential perceptions of them as not being directly beneficial to my circumstances. Therefore, based on my perspective, my confidence in the World Health Organization would be (3) Not very much."]}, {"persona": {"region": "Aswan", "sex": "male", "age": 34, "country": "Egypt", "marital_status": "single", "education": "middle", "social_class": "lower class"}, "question": {"id": "Q88", "variant": 0}, "response": ["Based on my emic perspective as a single male from Aswan, Egypt, and considering my lower socioeconomic background, I have limited access to information and resources. My personal experience and individual values also influence my trust in institutions such as the World Health Organization. Cultural context and cultural relativism are also important factors to consider, as they shape my perception of global health organizations. Additionally, my age and place also play a role in my understanding of and confidence in the WHO. Taking all these factors into account, I would choose option 3: Not very much."]}, {"persona": {"region": "Aswan", "sex": "female", "age": 31, "country": "Egypt", "marital_status": "married", "education": "middle", "social_class": "lower middle class"}, "question": {"id": "Q88", "variant": 0}, "response": ["Based on the anthropological framework, as a married female from Aswan, Egypt, with a middle education level and lower middle-class background, my perspective on the World Health Organization (WHO) would be influenced by my cultural context, individual values, and socioeconomic background. As a member of a community with limited access to healthcare and resources, I may have a distrust of international organizations like the WHO. Additionally, my personal experience and socioeconomic background may lead me to believe that the WHO does not adequately address the health needs of people in my community. Therefore, I would choose option 3: Not very much, as I do not have a great deal of confidence in the WHO's ability to address the health concerns of individuals like myself. \n\n3"]}, {"persona": {"region": "Aswan", "sex": "female", "age": 39, "country": "Egypt", "marital_status": "married", "education": "middle", "social_class": "working class"}, "question": {"id": "Q88", "variant": 0}, "response": ["Based on the anthropological framework, as a married female from Aswan, Egypt, my emic perspective is shaped by my cultural context, individual values, and socioeconomic background. As a member of the working class and having completed only middle education, my access to information and understanding of global health organizations like the WHO may be limited. Additionally, my cultural relativism may lead me to have a different perspective on the WHO compared to someone from a different cultural background. Given these factors, I would choose option (5) \"Don't know\" as my confidence in the World Health Organization may be influenced by my limited access to information and resources."]}, {"persona": {"region": "Qena", "sex": "female", "age": 27, "country": "Egypt", "marital_status": "married", "education": "lower", "social_class": "lower middle class"}, "question": {"id": "Q88", "variant": 0}, "response": ["Based on the anthropological framework, my answer is influenced by my cultural context, individual values and personal experience, socioeconomic background, and space and time. As a married female from Qena, Egypt, my cultural context and individual values lead me to have a great deal of confidence in the World Health Organization (WHO) due to the organization's efforts in providing healthcare and support globally. Additionally, my lower middle-class socioeconomic background and lower education level contribute to my trust in WHO as they have provided valuable resources and support to communities like mine. Therefore, my answer is:\n\n1"]}, {"persona": {"region": "Qena", "sex": "male", "age": 40, "country": "Egypt", "marital_status": "single", "education": "middle", "social_class": "lower middle class"}, "question": {"id": "Q88", "variant": 0}, "response": ["Based on the anthropological framework, as a single male from Qena, Egypt, I am influenced by my cultural context, socioeconomic background, and personal experience. Being part of the lower middle class, I have limited access to healthcare and rely heavily on public health organizations such as the WHO for information and resources. The cultural context of Egypt also plays a role in my perception, as the WHO has been involved in various health initiatives in the country. Additionally, my age and education level contribute to how much confidence I have in the WHO, as I may have been exposed to their work through my education and personal experiences. Therefore, I have quite a lot of confidence in the World Health Organization (WHO) (2)"]}, {"persona": {"region": "Qena", "sex": "male", "age": 30, "country": "Egypt", "marital_status": "single", "education": "middle", "social_class": "working class"}, "question": {"id": "Q88", "variant": 0}, "response": ["From my perspective as a single male from Qena, Egypt, with a middle education level and working-class background, my confidence in the World Health Organization (WHO) is mainly influenced by my cultural context, individual values and personal experience, and socioeconomic background. In my community, there is a strong emphasis on traditional medicine and local healing practices, which may lead to a lower level of confidence in international health organizations like the WHO. Additionally, as a member of the working class, I may have limited access to healthcare resources and may feel disconnected from the global health initiatives of organizations like the WHO. Therefore, my confidence in the WHO is likely to be not very much.\n\n3"]}]