[{"persona": {"region": "Fayoum", "sex": "male", "age": 46, "country": "Egypt", "marital_status": "married", "education": "higher", "social_class": "lower middle class"}, "question": {"id": "Q77", "variant": 0}, "response": ["Based on my personal experience and socioeconomic background as a married male from Fayoum, Egypt, who considers himself part of the lower middle class, I have limited confidence in major companies. The cultural context of my community and my own personal values lead me to be cautious and skeptical of large corporations. Additionally, my age and socioeconomic background have shaped my perception of these companies, leading me to believe that they may not have my best interests at heart. Therefore, I would choose option 3: Not very much."]}, {"persona": {"region": "Fayoum", "sex": "female", "age": 30, "country": "Egypt", "marital_status": "married", "education": "middle", "social_class": "lower middle class"}, "question": {"id": "Q77", "variant": 0}, "response": ["Based on my personal experience and lower middle class socioeconomic background, I have not had positive interactions with major companies. I have often felt overlooked and taken advantage of by them. Additionally, my cultural context and age have shaped my perception of major companies, as I have seen how they operate within my community and how they have impacted the lives of people around me. Therefore, I have little confidence in major companies and their practices.\n\n3"]}, {"persona": {"region": "Fayoum", "sex": "male", "age": 60, "country": "Egypt", "marital_status": "married", "education": "higher", "social_class": "working class"}, "question": {"id": "Q77", "variant": 0}, "response": ["Based on the anthropological framework, as a married male from Fayoum, Egypt, my emic perspective is shaped by my cultural context and socioeconomic background. As a member of the working class, I have likely experienced the impact of major companies on my community and personal life. My individual values and personal experience play a significant role in determining my confidence in these companies. Additionally, my age and place also factor into my perception. Considering cultural relativism, I may view major companies differently than someone from a different cultural or socioeconomic background. Therefore, my answer to the question is: \n\n2"]}, {"persona": {"region": "Fayoum", "sex": "male", "age": 20, "country": "Egypt", "marital_status": "single", "education": "middle", "social_class": "lower middle class"}, "question": {"id": "Q77", "variant": 0}, "response": ["Based on the anthropological framework, as a single male from Fayoum, Egypt, my emic perspective is influenced by my cultural context, individual values, and socioeconomic background. Growing up in a lower middle class family in Egypt, I have witnessed the struggles of my community and the impact of major companies on our lives. My personal experience and values lead me to have not very much confidence in major companies, as I have seen how their actions can negatively affect the livelihoods of people in my community. Additionally, my socioeconomic background and cultural relativism also play a role in shaping my perspective, as I have learned to question the actions and intentions of major companies based on their impact on people like myself. \n\n3"]}, {"persona": {"region": "Fayoum", "sex": "female", "age": 39, "country": "Egypt", "marital_status": "married", "education": "higher", "social_class": "lower middle class"}, "question": {"id": "Q77", "variant": 0}, "response": ["Based on the anthropological framework, my emic perspective as a married female from Fayoum, Egypt, at 39 years of age and from the lower middle class, is influenced by my cultural context, individual values, and socioeconomic background. In my cultural context, major companies may not have a strong presence or impact on my daily life compared to those in higher socioeconomic classes or urban areas. Additionally, my individual values and personal experience may lead me to have less confidence in major companies due to potential economic disparities and lack of access to their products or services. Therefore, I would choose option 3) Not very much, as my background and experiences lead me to have limited confidence in major companies."]}, {"persona": {"region": "Fayoum", "sex": "male", "age": 33, "country": "Egypt", "marital_status": "married", "education": "higher", "social_class": "working class"}, "question": {"id": "Q77", "variant": 0}, "response": ["Based on the anthropological framework, as a married male from Fayoum, Egypt, my emic perspective may lead me to have a high level of confidence in major companies due to my cultural context, which values trust and reliability in business. Additionally, my individual values and personal experiences as a member of the working class may also influence my confidence level, as I may rely on these companies for my livelihood. Furthermore, my socioeconomic background may play a role, as I may have limited access to alternative options. Therefore, I select:\n\n2"]}, {"persona": {"region": "Port Said", "sex": "female", "age": 45, "country": "Egypt", "marital_status": "married", "education": "higher", "social_class": "lower middle class"}, "question": {"id": "Q77", "variant": 0}, "response": ["Based on my cultural context as a married female from Port Said, Egypt, my socioeconomic background as part of the lower middle class, and my age and education level, I am influenced by both my individual values and personal experiences. In my community, there is a general lack of trust in major companies due to past experiences of economic instability and exploitation. This has shaped my perspective and led me to have not very much confidence in major companies. Additionally, cultural relativism plays a role in my understanding as I am aware that perspectives on this issue may vary in different cultural contexts. \n\n3"]}, {"persona": {"region": "Port Said", "sex": "male", "age": 42, "country": "Egypt", "marital_status": "married", "education": "middle", "social_class": "lower middle class"}, "question": {"id": "Q77", "variant": 0}, "response": ["Based on my emic perspective as a married male from Port Said, Egypt, I have grown up in a community where major companies have not always had the best track record in terms of providing reliable products and fair treatment of employees. This has shaped my personal experience and values, leading to a lower level of confidence in these companies. Additionally, my lower middle class socioeconomic background has also influenced my views, as I have often seen how these companies have negatively impacted the economic stability of my community. Therefore, based on my cultural context, individual values, and personal experience, I would choose option 3: Not very much.\n\n3"]}, {"persona": {"region": "Port Said", "sex": "male", "age": 28, "country": "Egypt", "marital_status": "single", "education": "middle", "social_class": "lower middle class"}, "question": {"id": "Q77", "variant": 0}, "response": ["Based on the anthropological framework, as a single male from Port Said, Egypt, who has completed middle education and considers myself part of the lower middle class, my perspective on major companies is influenced by my cultural context, socioeconomic background, and personal experience. In my cultural context, there may be a general mistrust of major companies due to historical and economic factors. Additionally, as part of the lower middle class, I may have had negative personal experiences with major companies, leading to a lack of confidence in them. Therefore, my answer to the question would be:\n\n3"]}, {"persona": {"region": "Port Said", "sex": "female", "age": 30, "country": "Egypt", "marital_status": "married", "education": "higher", "social_class": "lower middle class"}, "question": {"id": "Q77", "variant": 0}, "response": ["Based on the anthropological framework, as a married female from Port Said, Egypt, my emic perspective is influenced by my cultural context, individual values, and socioeconomic background. In Egyptian society, there is a strong sense of community and trust in local businesses, while major companies may be viewed with skepticism due to their perceived distance from the everyday lives of lower middle class individuals like myself. Additionally, my personal experience of navigating the challenges of lower middle class life may lead me to have less confidence in major companies, as their actions and decisions may not always align with the needs and values of people in my socioeconomic position. Therefore, I would select:\n\n(3) Not very much"]}, {"persona": {"region": "Port Said", "sex": "male", "age": 30, "country": "Egypt", "marital_status": "divorced", "education": "middle", "social_class": "lower middle class"}, "question": {"id": "Q77", "variant": 0}, "response": ["Based on my emic perspective as a divorced male from Port Said, Egypt, my cultural context, individual values, and personal experience all play a role in how I perceive major companies. My lower middle class socioeconomic background also influences my views. In Egypt, major companies are often associated with corruption and exploitation, which has led to a lack of trust in them. Additionally, my personal experience with struggling to make ends meet has contributed to my skepticism towards major companies. Overall, my cultural relativism and nuanced understanding of the question lead me to select option (3) Not very much as my answer. \n\n3"]}, {"persona": {"region": "Port Said", "sex": "female", "age": 19, "country": "Egypt", "marital_status": "single", "education": "middle", "social_class": "lower middle class"}, "question": {"id": "Q77", "variant": 0}, "response": ["Based on my cultural context and socioeconomic background, I have a lower middle class upbringing in Port Said, Egypt. My emic perspective on major companies is influenced by my personal experience and the experiences of those around me. I have seen how major companies have treated people in my community, and I have witnessed the impact of their actions on the lives of those in similar socioeconomic positions. This has led me to have not very much confidence in major companies. \n\n3"]}, {"persona": {"region": "Fayoum", "sex": "male", "age": 40, "country": "Egypt", "marital_status": "married", "education": "middle", "social_class": "working class"}, "question": {"id": "Q77", "variant": 0}, "response": ["Based on the anthropological framework, as a married male from Fayoum, Egypt, who is 40 years old and part of the working class, my answer to the question of confidence in major companies would be influenced by my cultural context, individual values, and socioeconomic background. In Egypt, there may be a general mistrust of major companies due to historical and cultural factors, and as a member of the working class, I may have experienced or witnessed exploitation or unfair treatment by these companies. Additionally, my middle education level may have provided me with some awareness of socioeconomic disparities and the impact of major companies on the working class. Therefore, I would choose:\n\n3) Not very much"]}, {"persona": {"region": "Fayoum", "sex": "male", "age": 23, "country": "Egypt", "marital_status": "single", "education": "higher", "social_class": "lower middle class"}, "question": {"id": "Q77", "variant": 0}, "response": ["Based on my cultural context in Fayoum, Egypt, and my lower middle class socioeconomic background, I understand that my perception of major companies may be influenced by my personal experiences and individual values. In my community, there may be a level of skepticism towards major companies due to issues of trust and reliability. Additionally, considering the cultural relativism perspective, I recognize that my perception may differ from those in higher socioeconomic classes or from different cultural contexts. Therefore, my confidence in major companies may not be as high as someone from a different background. My age and education level also play a role in my perspective, as I have been exposed to different ideas and may have a more critical view of major companies. \n\n3"]}, {"persona": {"region": "Fayoum", "sex": "female", "age": 38, "country": "Egypt", "marital_status": "married", "education": "middle", "social_class": "lower middle class"}, "question": {"id": "Q77", "variant": 0}, "response": ["From the perspective of a married woman from Fayoum, Egypt, at the age of 38 and belonging to the lower middle class, my answer to the question of how much confidence I have in major companies is influenced by my individual values and personal experience, as well as my socioeconomic background. Having completed only middle education level, I have limited exposure to the workings of major companies, which may lead me to have less confidence in them. Additionally, being part of the lower middle class, I may have experienced or witnessed instances where major companies have not been trustworthy or have not had my best interests in mind. Therefore, my answer to the question would be:\n\n3\n\n(3) Not very much"]}, {"persona": {"region": "Fayoum", "sex": "male", "age": 32, "country": "Egypt", "marital_status": "married", "education": "middle", "social_class": "lower middle class"}, "question": {"id": "Q77", "variant": 0}, "response": ["Based on the anthropological framework, my emic perspective as a married male from Fayoum, Egypt, would be heavily influenced by my cultural context, individual values, and socioeconomic background. In my community, there is a sense of distrust in major companies due to economic disparities, corruption, and lack of transparency. As a member of the lower middle class, my personal experience and socioeconomic background would lead me to have not very much confidence in major companies. Additionally, cultural relativism plays a role in my viewpoint, as there is a general skepticism towards large corporations within my community. Therefore, my answer to the question would be:\n3"]}, {"persona": {"region": "Fayoum", "sex": "male", "age": 31, "country": "Egypt", "marital_status": "married", "education": "higher", "social_class": "working class"}, "question": {"id": "Q77", "variant": 0}, "response": ["Based on the anthropological framework, as a married male from Fayoum, Egypt, my emic perspective on the confidence in major companies would be influenced by my cultural context, individual values, and socioeconomic background. In Egypt, there is a strong sense of community and trust within small businesses and local vendors, while major companies may be perceived as disconnected from the needs of the working class. Additionally, my personal experience and values as a working-class individual may lead me to have less confidence in major companies, as they may not prioritize the needs of people like me. Therefore, my answer to the question would be:\n\n3"]}, {"persona": {"region": "Fayoum", "sex": "male", "age": 31, "country": "Egypt", "marital_status": "married", "education": "middle", "social_class": "lower middle class"}, "question": {"id": "Q77", "variant": 0}, "response": ["Based on my emic perspective as a lower middle class married male from Fayoum, Egypt, my confidence in major companies is influenced by my cultural context and socioeconomic background. In my community, there is a general mistrust of major companies due to the economic struggles we face. My personal experience and individual values also play a role in shaping my perception of these companies. Additionally, cultural relativism teaches me to view major companies through a critical lens, as they may not always prioritize the well-being of individuals in my socioeconomic class. Therefore, my confidence in major companies is not very much.\n\n3"]}, {"persona": {"region": "Fayoum", "sex": "female", "age": 32, "country": "Egypt", "marital_status": "married", "education": "middle", "social_class": "lower middle class"}, "question": {"id": "Q77", "variant": 0}, "response": ["Based on the anthropological framework, the emic perspective of a married female from Fayoum, Egypt, who is 32 years old, completed middle education level, and considers herself part of the lower middle class, would be influenced by her cultural context, individual values and personal experience, and socioeconomic background. She may have limited exposure to major companies and may have experienced economic challenges, leading to a lack of confidence in these companies. Additionally, cultural relativism would also play a role in her perception, as she may view major companies through the lens of her own socioeconomic status and the context of her community. Therefore, her answer to the question would likely be influenced by her personal experience and the socioeconomic background, leading her to choose option (3) Not very much.\n\n3"]}, {"persona": {"region": "Ismailia", "sex": "male", "age": 53, "country": "Egypt", "marital_status": "married", "education": "middle", "social_class": "lower middle class"}, "question": {"id": "Q77", "variant": 0}, "response": ["Based on my cultural context and socioeconomic background, as a lower middle class married male from Ismailia, Egypt, I have had personal experiences and interactions with major companies that have shaped my perspective. My age and education level have also influenced my understanding of these companies. Additionally, cultural relativism has taught me to view these companies from a nuanced perspective, considering the impact of these companies in my local community and the wider Egyptian society. Therefore, I have a moderate level of confidence in major companies, as I believe they play a role in the economy and provide job opportunities, but I also recognize the potential for exploitation and unethical practices. \n\n3"]}, {"persona": {"region": "Ismailia", "sex": "male", "age": 38, "country": "Egypt", "marital_status": "married", "education": "higher", "social_class": "working class"}, "question": {"id": "Q77", "variant": 0}, "response": ["Based on the anthropological framework, my perspective as a married male from Ismailia, Egypt, at 38 years of age with a working-class background and higher education level, is shaped by my cultural context, individual values, and socioeconomic background. In my cultural context, major companies may not always have a positive reputation, as they may be seen as exploiting the working class. Additionally, my individual values may lead me to have some skepticism towards major companies, as I may prioritize the well-being of my community over corporate interests. Furthermore, my socioeconomic background as part of the working class may lead me to have less confidence in major companies, as I have likely experienced or witnessed economic disparities and exploitation. Therefore, my response to the question would be:\n3"]}, {"persona": {"region": "Ismailia", "sex": "female", "age": 35, "country": "Egypt", "marital_status": "married", "education": "middle", "social_class": "lower middle class"}, "question": {"id": "Q77", "variant": 0}, "response": ["Based on the anthropological framework, my answer is influenced by my cultural context as a married female from Ismailia, Egypt, where major companies may not have a strong presence or may not be trusted due to historical, economic, and social reasons. My individual values and personal experience also play a significant role in my answer, as I come from a lower middle-class background and have had limited exposure to major companies. Additionally, my socioeconomic background and age contribute to my lack of confidence in major companies, as I have not had the privilege of experiencing the benefits they may offer. Therefore, I choose:\n3"]}, {"persona": {"region": "Ismailia", "sex": "female", "age": 57, "country": "Egypt", "marital_status": "married", "education": "lower", "social_class": "working class"}, "question": {"id": "Q77", "variant": 0}, "response": ["Based on the anthropological framework, as a married female from Ismailia, Egypt, who is 57 years old and part of the working class, my emic perspective would be influenced by my cultural context, individual values, and personal experiences. In Ismailia, major companies may not have a strong presence, and as a member of the working class, I may have had limited interaction with them. Additionally, my lower education level may also impact my understanding of major companies. Therefore, I would have limited confidence in major companies due to my personal experiences and socioeconomic background.\n\n3"]}, {"persona": {"region": "Ismailia", "sex": "male", "age": 33, "country": "Egypt", "marital_status": "married", "education": "middle", "social_class": "lower middle class"}, "question": {"id": "Q77", "variant": 0}, "response": ["Based on my emic perspective as a married male from Ismailia, Egypt, my cultural context and socioeconomic background heavily influence my perception of major companies. I come from a lower middle-class background and have completed only middle education level. My personal experience and individual values have shaped my view of major companies, and I have not had positive experiences with them. Therefore, I do not have much confidence in major companies and would choose option (3) Not very much."]}, {"persona": {"region": "Ismailia", "sex": "female", "age": 49, "country": "Egypt", "marital_status": "single", "education": "higher", "social_class": "upper middle class"}, "question": {"id": "Q77", "variant": 0}, "response": ["Based on my emic perspective as a single female from Ismailia, Egypt, my cultural context, individual values, and socioeconomic background greatly influence my level of confidence in major companies. In my cultural context, I have been exposed to a mix of traditional values and modern education, which has shaped my perception of major companies. As part of the upper middle class, I have had access to resources and opportunities that have allowed me to have a great deal of confidence in major companies and their ability to provide quality products and services. Additionally, my higher education level has equipped me with the knowledge and critical thinking skills to evaluate and trust major companies. Therefore, based on my personal experience and cultural context, I would choose:\n2"]}, {"persona": {"region": "Ismailia", "sex": "female", "age": 35, "country": "Egypt", "marital_status": "married", "education": "higher", "social_class": "lower middle class"}, "question": {"id": "Q77", "variant": 0}, "response": ["Based on the anthropological framework, my emic perspective as a married female from Ismailia, Egypt, who is 35 years old and part of the lower middle class, is influenced by my cultural context, individual values, and socioeconomic background. In my cultural context, major companies may not have a strong presence or positive reputation, leading to a lack of confidence. Additionally, my individual values and personal experience as someone with a higher education level and from a lower middle class background may lead me to be more critical of major companies due to potential exploitation of workers or unethical business practices. Therefore, I would choose option 3: Not very much. My lack of confidence in major companies is influenced by my cultural context, individual values, and socioeconomic background. \n\n3"]}, {"persona": {"region": "Ismailia", "sex": "male", "age": 24, "country": "Egypt", "marital_status": "single", "education": "higher", "social_class": "upper middle class"}, "question": {"id": "Q77", "variant": 0}, "response": ["Based on the anthropological framework, my Emic perspective as a single male from Ismailia, Egypt, who has completed higher education and considers myself part of the upper middle class, is influenced by my individual values and personal experience, as well as my socioeconomic background. I have been raised in a culture with a strong emphasis on education and success, which has instilled in me a high level of confidence in major companies. Additionally, my socio-economic background has provided me with opportunities to interact with and benefit from these major companies, further boosting my confidence in them. Therefore, I have a great deal of confidence in major companies.\n\n1"]}, {"persona": {"region": "Ismailia", "sex": "female", "age": 23, "country": "Egypt", "marital_status": "single", "education": "higher", "social_class": "lower middle class"}, "question": {"id": "Q77", "variant": 0}, "response": ["Based on the anthropological framework, as a single female from Ismailia, Egypt, I am influenced by my cultural context, individual values, and socioeconomic background. Being part of the lower middle class, I am likely to have less trust in major companies due to my socioeconomic background and the cultural context of my community. Additionally, my personal experiences and values may lead me to have a more critical and cautious perspective towards major companies. Therefore, my answer would be:\n3"]}, {"persona": {"region": "Ismailia", "sex": "male", "age": 55, "country": "Egypt", "marital_status": "married", "education": "middle", "social_class": "lower middle class"}, "question": {"id": "Q77", "variant": 0}, "response": ["Based on the anthropological framework, as a married male from Ismailia, Egypt at the age of 55 with a middle education level and lower middle class background, my perspective on major companies is influenced by my cultural context, individual values, and socioeconomic background. In Egypt, there is a growing distrust in major companies due to economic instability and a history of corruption. As a member of the lower middle class, I have personally experienced the negative impact of corporate greed and exploitation. This has shaped my perception and led me to have \"Not very much\" confidence in major companies.\n\n3"]}, {"persona": {"region": "Ismailia", "sex": "male", "age": 57, "country": "Egypt", "marital_status": "married", "education": "middle", "social_class": "upper middle class"}, "question": {"id": "Q77", "variant": 0}, "response": ["Based on the anthropological framework, as a married male from Ismailia, Egypt, my emic perspective would be influenced by my cultural context, individual values, and socioeconomic background. In Egyptian culture, there is a strong emphasis on trust and respect for authority, including major companies. Additionally, being part of the upper middle class, I have likely had positive experiences with major companies and have the financial means to engage with them. Therefore, my answer would be:\n\n2) Quite a lot"]}, {"persona": {"region": "Ismailia", "sex": "female", "age": 29, "country": "Egypt", "marital_status": "married", "education": "middle", "social_class": "upper middle class"}, "question": {"id": "Q77", "variant": 0}, "response": ["Based on my understanding of the anthropological framework, my perspective as a married female from Ismailia, Egypt, at the age of 29 and part of the upper middle class is influenced by my cultural context, individual values, and socioeconomic background. In my cultural context, there is a strong emphasis on trust and reputation, which influences my confidence in major companies. Additionally, my individual values and personal experiences shape my perception of these companies. As someone from the upper middle class, I have likely interacted with and benefited from major companies, leading me to have a great deal of confidence in them. Therefore, my answer is:\n\n1"]}, {"persona": {"region": "Damiatta", "sex": "female", "age": 46, "country": "Egypt", "marital_status": "married", "education": "middle", "social_class": "lower middle class"}, "question": {"id": "Q77", "variant": 0}, "response": ["Based on the anthropological framework, my emic perspective as a married female from Damiatta, Egypt, who is part of the lower middle class, is influenced by my cultural context, individual values, and socioeconomic background. In my cultural context, there is a sense of skepticism towards major companies due to the history of economic inequality and exploitation. My personal experience and values also lead me to be cautious and not have much confidence in major companies, as they are often seen as prioritizing profit over the well-being of the community. Additionally, my socioeconomic background has made me more aware of the impact of major companies on the local economy and the struggles of small businesses. Therefore, I would choose option 3: Not very much. \n\n3"]}, {"persona": {"region": "Damiatta", "sex": "female", "age": 20, "country": "Egypt", "marital_status": "single", "education": "middle", "social_class": "lower middle class"}, "question": {"id": "Q77", "variant": 0}, "response": ["From the emic perspective, as a single female from Damiatta, Egypt, my understanding and confidence in major companies are influenced by my cultural context, individual values, and socioeconomic background. In my community, there is a general sense of skepticism towards major companies due to the perception that they prioritize profit over the well-being of the people. Additionally, my lower middle-class upbringing has instilled in me a sense of caution and wariness towards large corporations, as they are often seen as exploitative and untrustworthy. My personal experience and the experiences of those around me have also shaped my view, as I have witnessed the negative impact of these companies on the local economy and job market. Therefore, considering all these factors, I would choose option 3: Not very much.\n\n3"]}, {"persona": {"region": "Damiatta", "sex": "male", "age": 19, "country": "Egypt", "marital_status": "single", "education": "middle", "social_class": "lower middle class"}, "question": {"id": "Q77", "variant": 0}, "response": ["From the perspective of a single male from Damiatta, Egypt, who is 19 years old and part of the lower middle class, the answer to the question of how much confidence I have in major companies is heavily influenced by my cultural context, individual values, and socioeconomic background. In Damiatta, there is a strong sense of community and reliance on small local businesses, which can lead to skepticism towards large corporations. Additionally, my socioeconomic background as part of the lower middle class may lead me to have less confidence in major companies due to potential experiences of economic inequality and exploitation. Therefore, I would choose option (3) Not very much as it aligns with my cultural context, individual values, and socioeconomic background. \n\n3"]}, {"persona": {"region": "Damiatta", "sex": "female", "age": 33, "country": "Egypt", "marital_status": "married", "education": "higher", "social_class": "lower middle class"}, "question": {"id": "Q77", "variant": 0}, "response": ["From the perspective of a married female from Damiatta, Egypt, who is 33 years old and part of the lower middle class, my answer to the question about confidence in major companies is influenced by my cultural context, individual values, and socioeconomic background. In Egypt, there is a general skepticism towards major companies due to a history of corruption and economic disparity. As someone from the lower middle class, I have experienced firsthand the struggles of making ends meet and have seen the impact of corporate greed on my community. Therefore, I have limited confidence in major companies and their intentions, as they often prioritize profit over the well-being of people like myself.\n\n3"]}, {"persona": {"region": "Damiatta", "sex": "male", "age": 24, "country": "Egypt", "marital_status": "single", "education": "higher", "social_class": "lower middle class"}, "question": {"id": "Q77", "variant": 0}, "response": ["Based on the anthropological framework, my answer to the question is influenced by my individual values and personal experience, as well as my socioeconomic background. As a single male from Damiatta, Egypt, I come from a lower middle class background and have completed higher education. My personal experience and socioeconomic background have led me to have some skepticism towards major companies, as I have seen the challenges and struggles that people in my community face in dealing with these companies. Additionally, cultural context and cultural relativism play a role in my perception, as I am surrounded by individuals who share similar views. Therefore, my answer to the question is: \n\n3"]}, {"persona": {"region": "Suez", "sex": "male", "age": 41, "country": "Egypt", "marital_status": "married", "education": "middle", "social_class": "working class"}, "question": {"id": "Q77", "variant": 0}, "response": ["Based on my emic perspective as a married male from Suez, Egypt, my confidence in major companies is influenced by my cultural context, individual values, and socioeconomic background. In Egypt, major companies are often seen as powerful and influential entities that have a significant impact on the economy and society. As a member of the working class with a middle education level, I have experienced firsthand the challenges and struggles faced by individuals in my socioeconomic position. This has shaped my perception of major companies and led me to have not very much confidence in them. Additionally, my personal experience and values have also played a role in shaping my view of major companies, contributing to my lack of confidence in their operations and practices.\n\n3"]}, {"persona": {"region": "Suez", "sex": "female", "age": 39, "country": "Egypt", "marital_status": "divorced", "education": "middle", "social_class": "working class"}, "question": {"id": "Q77", "variant": 0}, "response": ["In considering the question of confidence in major companies from the perspective of a divorced female from Suez, Egypt, who is 39 years old, completed middle education, and considers herself part of the working class, it is important to take into account the individual values and personal experience, as well as the socioeconomic background and cultural context. Given the socioeconomic background and the experience of being part of the working class, there may be a lack of confidence in major companies due to potential experiences of exploitation or lack of fair treatment. Additionally, the cultural context and individual values may lead to a more skeptical view of large corporations. Therefore, the chosen option is:\n3"]}, {"persona": {"region": "Cairo", "sex": "female", "age": 55, "country": "Egypt", "marital_status": "married", "education": "middle", "social_class": "working class"}, "question": {"id": "Q77", "variant": 0}, "response": ["Based on the anthropological framework, as a married female from Cairo, Egypt, who is 55 years old, completed middle education, and considers herself part of the working class, my emic perspective on major companies is influenced by my cultural context, individual values, and socioeconomic background. In Egypt, the working class often faces economic challenges and may have limited access to resources and opportunities compared to the upper class. Additionally, my personal experience and values may lead me to have less confidence in major companies, as they may not prioritize the needs of individuals like myself. Therefore, I would choose option 3: Not very much."]}, {"persona": {"region": "Cairo", "sex": "male", "age": 58, "country": "Egypt", "marital_status": "married", "education": "middle", "social_class": "lower middle class"}, "question": {"id": "Q77", "variant": 0}, "response": ["Based on the anthropological framework, as a married male from Cairo, Egypt, at 58 years old with a middle education level and considering myself part of the lower middle class, my perspective on major companies is influenced by my socioeconomic background, cultural context, and personal experience. In Egypt, there is a history of economic instability and corruption, which has led to a general mistrust of major companies. Additionally, my lower middle class status has likely meant that I have faced challenges and exploitation from these companies, leading to a lack of confidence in their practices. Therefore, I would choose option (3) Not very much."]}, {"persona": {"region": "Cairo", "sex": "female", "age": 29, "country": "Egypt", "marital_status": "married", "education": "higher", "social_class": "lower middle class"}, "question": {"id": "Q77", "variant": 0}, "response": ["Based on the anthropological framework, my emic perspective as a lower middle-class married female from Cairo, Egypt, is heavily influenced by my cultural context, individual values, and socioeconomic background. In my cultural context, there is a general lack of trust in major companies due to a history of corruption and economic instability. Additionally, my lower middle-class socioeconomic background has made me more suspicious of these companies as they often exploit the working class. Therefore, I have very little confidence in major companies and would choose option (3) Not very much."]}, {"persona": {"region": "Cairo", "sex": "male", "age": 38, "country": "Egypt", "marital_status": "married", "education": "higher", "social_class": "lower middle class"}, "question": {"id": "Q77", "variant": 0}, "response": ["Based on my emic perspective as a married male from Cairo, Egypt, my confidence in major companies is influenced by my cultural context, socioeconomic background, and individual values. In Egypt, there is a history of distrust towards major companies due to corruption and lack of transparency. As a lower middle-class individual, I have personally experienced the impact of economic inequality and have seen how major companies often prioritize profits over the well-being of the people. This has shaped my personal values and experience, leading me to have not very much confidence in major companies.\n\n3"]}, {"persona": {"region": "Cairo", "sex": "female", "age": 40, "country": "Egypt", "marital_status": "married", "education": "higher", "social_class": "lower middle class"}, "question": {"id": "Q77", "variant": 0}, "response": ["Based on my emic perspective as a married female from Cairo, Egypt, I have grown up in a cultural context where major companies have not always had the best reputation. The socioeconomic background of being part of the lower middle class has also shaped my views on these companies, as I have seen the struggles and challenges faced by people in similar economic situations. Additionally, my personal experience and values have led me to be more cautious and skeptical of major companies, as I have witnessed the impact they can have on individuals and families. Therefore, I would choose option 3: Not very much."]}, {"persona": {"region": "Cairo", "sex": "male", "age": 38, "country": "Egypt", "marital_status": "married", "education": "higher", "social_class": "upper middle class"}, "question": {"id": "Q77", "variant": 0}, "response": ["Based on the anthropological framework, my answer is influenced by my cultural context, individual values, and socioeconomic background. In Cairo, Egypt, the upper middle class has access to education and resources, which often leads to a higher level of trust in major companies. Additionally, my personal experience and values have shaped my perception, and I have had positive interactions with major companies. Therefore, I have a great deal of confidence in major companies.\n\n1"]}, {"persona": {"region": "Cairo", "sex": "male", "age": 59, "country": "Egypt", "marital_status": "married", "education": "middle", "social_class": "lower middle class"}, "question": {"id": "Q77", "variant": 0}, "response": ["Based on the anthropological framework, as a married male from Cairo, Egypt, at 59 years of age with a middle education level and considering myself part of the lower middle class, my perspective on major companies would be influenced by my cultural context, socioeconomic background, individual values, and personal experience. In Egypt, there is a history of government corruption and economic instability, which may lead to a lack of confidence in major companies. Additionally, my lower middle-class status and limited access to resources may contribute to a feeling of mistrust towards large corporations. Therefore, I would choose option 3: Not very much."]}, {"persona": {"region": "Cairo", "sex": "female", "age": 30, "country": "Egypt", "marital_status": "married", "education": "higher", "social_class": "upper middle class"}, "question": {"id": "Q77", "variant": 0}, "response": ["Based on the anthropological framework, my emic perspective as a married female from Cairo, Egypt, who is 30 years old and part of the upper middle class, is influenced by my cultural context, individual values, and socioeconomic background. In Cairo, major companies often play a significant role in the economy and society, and as an educated woman from the upper middle class, I have likely had positive interactions with these companies. Additionally, my personal values may place a high value on stability and trustworthiness, leading me to have a great deal of confidence in major companies. Furthermore, my socioeconomic background may contribute to my confidence, as individuals from a higher socioeconomic status often have more positive interactions with major companies. Therefore, I would choose option (1) A great deal.\n\n1"]}, {"persona": {"region": "Cairo", "sex": "male", "age": 22, "country": "Egypt", "marital_status": "single", "education": "middle", "social_class": "lower middle class"}, "question": {"id": "Q77", "variant": 0}, "response": ["From the emic perspective of a single male from Cairo, Egypt, who has completed middle education and considers himself part of the lower middle class, the cultural context plays a pivotal role in shaping his perception of major companies. In a country with a history of political and economic instability, individuals from lower middle-class backgrounds often face socioeconomic challenges and may have limited trust in major companies due to perceived exploitation and inequality. Additionally, personal experience and individual values may lead to a lack of confidence in the transparency and ethics of major companies. Therefore, considering the cultural relativism and nuanced understanding of the question, the persona would likely choose option (3) Not very much, as their socioeconomic background and personal experience may influence their lack of confidence in major companies. \n\n3"]}, {"persona": {"region": "Cairo", "sex": "male", "age": 29, "country": "Egypt", "marital_status": "single", "education": "higher", "social_class": "lower middle class"}, "question": {"id": "Q77", "variant": 0}, "response": ["Based on the anthropological framework, as a single male from Cairo, Egypt, my emic perspective would be influenced by my cultural context, individual values and personal experience, and socioeconomic background. In Cairo, major companies may not have a strong reputation for reliability and trustworthiness. My lower middle class status may also lead me to be more skeptical of major companies due to potential economic disparities. Additionally, my age and education level may contribute to my understanding of the complexities of corporate power and the potential for exploitation. Therefore, I would select:\n\n3"]}, {"persona": {"region": "Cairo", "sex": "female", "age": 31, "country": "Egypt", "marital_status": "married", "education": "higher", "social_class": "lower middle class"}, "question": {"id": "Q77", "variant": 0}, "response": ["Based on the anthropological framework, my emic perspective as a married female from Cairo, Egypt, would be influenced by my cultural context, individual values, and socioeconomic background. In Egypt, there is a general skepticism towards major companies due to a history of corruption and inequality. As part of the lower middle class, I am likely to have experienced firsthand the challenges of navigating a system that does not always work in my favor. Additionally, my personal values of fairness and justice would further contribute to my lack of confidence in major companies. Therefore, my answer would be (3) Not very much."]}, {"persona": {"region": "Cairo", "sex": "male", "age": 59, "country": "Egypt", "marital_status": "married", "education": "higher", "social_class": "upper middle class"}, "question": {"id": "Q77", "variant": 0}, "response": ["From the emic and etic perspectives, as a married male from Cairo, Egypt, I am part of a culture that values trust and respect in business relationships. The cultural context of Egypt, along with my individual values and personal experiences, have shaped my perception of major companies. My socioeconomic background as part of the upper middle class has also influenced my confidence in major companies, as I have had positive experiences with them. Additionally, my age and education level have provided me with a nuanced understanding of the business world. Therefore, based on my background and cultural context, I have a great deal of confidence in major companies.\n\n1"]}, {"persona": {"region": "Cairo", "sex": "male", "age": 27, "country": "Egypt", "marital_status": "single", "education": "middle", "social_class": "working class"}, "question": {"id": "Q77", "variant": 0}, "response": ["Based on the anthropological framework, as a single male from Cairo, Egypt, with a middle education level and part of the working class, my perspective on major companies would be influenced by my socioeconomic background, individual values, and personal experience. I would likely have a more critical view of major companies due to the economic struggles and lack of opportunities I may have faced. Additionally, my cultural context and cultural relativism would lead me to be skeptical of the impact and intentions of major companies in a country like Egypt. Therefore, my answer would be:\n\n3"]}, {"persona": {"region": "Cairo", "sex": "female", "age": 25, "country": "Egypt", "marital_status": "single", "education": "higher", "social_class": "working class"}, "question": {"id": "Q77", "variant": 0}, "response": ["From an emic perspective, as a single female from Cairo, Egypt, my cultural context and socioeconomic background play a significant role in shaping my perception of major companies. Living in a city with a diverse and complex social structure, I am aware of the impact major companies have on my community and the wider society. As someone from the working class, I am particularly attuned to the ways in which these companies affect people like me, and I am more likely to be critical of their practices. Additionally, my personal experience and individual values have led me to be skeptical of major companies, as I have witnessed the unequal distribution of resources and opportunities in my environment. Taking into account the cultural relativism, I understand that my perspective may not be universal, but it is deeply informed by my specific circumstances and surroundings. Therefore, my confidence in major companies is (3) Not very much."]}, {"persona": {"region": "Cairo", "sex": "female", "age": 23, "country": "Egypt", "marital_status": "married", "education": "higher", "social_class": "lower middle class"}, "question": {"id": "Q77", "variant": 0}, "response": ["Based on my understanding of the anthropological framework, I would approach the question of confidence in major companies from the perspective of my cultural context, individual values, and socioeconomic background. As a married female from Cairo, Egypt, who is 23 years old and part of the lower middle class, I am likely to have a more cautious approach to major companies. My cultural context and socioeconomic background might lead me to have a more skeptical view of these companies, as I may have experienced or witnessed the challenges faced by individuals and families in similar economic situations. Additionally, my individual values and personal experiences may lead me to have less confidence in major companies, as I may prioritize supporting smaller local businesses and have concerns about the impact of major companies on my community and the environment. Therefore, my answer to the question would be:\n3\n\n(3) Not very much"]}, {"persona": {"region": "Cairo", "sex": "male", "age": 58, "country": "Egypt", "marital_status": "married", "education": "higher", "social_class": "working class"}, "question": {"id": "Q77", "variant": 0}, "response": ["Based on the anthropological framework, as a married male from Cairo, Egypt, my emic perspective is influenced by my cultural context, individual values, and socioeconomic background. In Egypt, there is a general mistrust of major companies due to a history of corruption and economic inequality. My personal experience and values as a working-class individual also lead me to have not very much confidence in major companies, as I have seen how they often prioritize profit over the well-being of workers and the community. Additionally, cultural relativism plays a role in my perspective, as Egyptian society values community and solidarity over individualistic corporate interests. Therefore, my answer is: \n\n3\n\n(3) Not very much"]}, {"persona": {"region": "Cairo", "sex": "female", "age": 40, "country": "Egypt", "marital_status": "married", "education": "higher", "social_class": "working class"}, "question": {"id": "Q77", "variant": 0}, "response": ["Based on the anthropological framework, my perspective as a married female from Cairo, Egypt, with a working-class background and higher education, is influenced by my cultural context, individual values, and personal experience. In Egypt, there is a high level of skepticism towards major companies due to historical and socio-economic factors. As a working-class individual, I have personally witnessed the struggle of my community due to exploitation and lack of fair treatment by major companies. This has shaped my personal values and experience, leading me to have not very much confidence in major companies.\n\n3"]}, {"persona": {"region": "Cairo", "sex": "female", "age": 36, "country": "Egypt", "marital_status": "married", "education": "middle", "social_class": "upper middle class"}, "question": {"id": "Q77", "variant": 0}, "response": ["Based on my emic perspective as a married female from Cairo, Egypt, who is 36 years old and part of the upper middle class, I have a high level of confidence in major companies. This confidence is influenced by the cultural context in which I live, as well as my socioeconomic background. In Egypt, there is a strong emphasis on the importance of reputable companies, and being a part of the upper middle class means that I have likely had positive experiences with these companies. Additionally, my individual values and personal experiences have shaped my perception, leading me to have a great deal of confidence in major companies.\n\n2"]}, {"persona": {"region": "Cairo", "sex": "male", "age": 40, "country": "Egypt", "marital_status": "married", "education": "middle", "social_class": "lower middle class"}, "question": {"id": "Q77", "variant": 0}, "response": ["Based on the anthropological framework, my perspective on the confidence in major companies is influenced by my cultural context, individual values, and socioeconomic background. As a married male from Cairo, Egypt, I come from a lower middle-class background and have completed middle education level. This means that I have likely experienced economic challenges and have seen major companies have a significant impact on my community and family. My cultural context and personal experience have likely made me more skeptical of major companies, as I have seen how they can exploit and manipulate people in my socioeconomic class. Therefore, I have \"not very much\" confidence in major companies.\n\n3"]}, {"persona": {"region": "Cairo", "sex": "female", "age": 30, "country": "Egypt", "marital_status": "married", "education": "middle", "social_class": "lower class"}, "question": {"id": "Q77", "variant": 0}, "response": ["Based on the anthropological framework, as a married female from Cairo, Egypt, who is 30 years old, with a middle education level and from the lower class, my perspective on major companies will be heavily influenced by my socioeconomic background, cultural context, and personal experience. In Cairo, the lower class often faces economic challenges and may have had negative experiences with major companies, leading to a lack of confidence in them. Additionally, cultural relativism teaches us that my viewpoint may differ from those in higher socioeconomic classes who may have more positive experiences with major companies. Therefore, my response is: \n\n3. Not very much"]}, {"persona": {"region": "Cairo", "sex": "male", "age": 58, "country": "Egypt", "marital_status": "married", "education": "higher", "social_class": "lower middle class"}, "question": {"id": "Q77", "variant": 0}, "response": ["Based on the anthropological framework, my emic perspective as a lower middle class man from Cairo, Egypt, would heavily influence my answer to the question. My socioeconomic background plays a significant role in shaping my perception of major companies. The cultural context, individual values, and personal experience all contribute to my lack of confidence in major companies. The economic struggles faced by people in my social class, along with the corruption and lack of transparency in the business world, have led me to have not very much confidence in major companies.\n\n3"]}, {"persona": {"region": "Cairo", "sex": "male", "age": 50, "country": "Egypt", "marital_status": "married", "education": "middle", "social_class": "lower middle class"}, "question": {"id": "Q77", "variant": 0}, "response": ["Based on my cultural context as a married male from Cairo, Egypt, and my lower middle class socioeconomic background, I have limited confidence in major companies. This lack of confidence is shaped by my personal experience and the experiences of those around me, as well as the economic challenges faced by my community. Additionally, the emic perspective within my cultural context emphasizes skepticism towards large corporations and the etic perspective highlights the impact of socioeconomic background on trust in major companies. Therefore, I would choose option (3) Not very much."]}, {"persona": {"region": "Cairo", "sex": "female", "age": 40, "country": "Egypt", "marital_status": "married", "education": "higher", "social_class": "upper middle class"}, "question": {"id": "Q77", "variant": 0}, "response": ["Based on the anthropological framework, my emic perspective as a married female from Cairo, Egypt, at the age of 40 and part of the upper middle class, is influenced by my cultural context, individual values, socioeconomic background, and space and time. In Egyptian society, major companies are often seen as important and reputable entities, and as someone from the upper middle class who has completed higher education, I have likely had positive interactions and experiences with these companies. Additionally, my socioeconomic background and educational level may lead me to have a greater understanding and trust in the workings of major companies. Therefore, I would have a great deal of confidence in major companies.\n\n1"]}, {"persona": {"region": "Cairo", "sex": "female", "age": 33, "country": "Egypt", "marital_status": "married", "education": "middle", "social_class": "lower middle class"}, "question": {"id": "Q77", "variant": 0}, "response": ["Based on the anthropological framework, my answer will be influenced by my emic perspective as a married female from Cairo, Egypt, with a lower middle class socioeconomic background and middle education level. My cultural context and personal experience have shaped my views, and I have limited confidence in major companies due to the economic challenges faced by my community and the lack of opportunities for upward mobility. Additionally, my understanding of cultural relativism informs my belief that major companies may not prioritize the needs of individuals from lower socioeconomic backgrounds like mine. Therefore, I have chosen option (3) Not very much. \n\n3"]}, {"persona": {"region": "Cairo", "sex": "female", "age": 37, "country": "Egypt", "marital_status": "married", "education": "middle", "social_class": "lower middle class"}, "question": {"id": "Q77", "variant": 0}, "response": ["Based on the anthropological framework, as a married female from Cairo, Egypt, my emic perspective is influenced by my cultural context, individual values, socioeconomic background, and space and time. In the cultural context of Cairo, major companies are often seen as distant entities that do not necessarily prioritize the needs of individuals like me. My lower middle class socioeconomic background also means that I have limited trust in the actions and motives of major companies, as they may not always have the best interests of people like me in mind. Additionally, my age and place in society have shaped my perception of major companies, leading me to have not very much confidence in them. \n\n3"]}, {"persona": {"region": "Cairo", "sex": "male", "age": 28, "country": "Egypt", "marital_status": "married", "education": "middle", "social_class": "lower middle class"}, "question": {"id": "Q77", "variant": 0}, "response": ["Based on my personal experience and socioeconomic background, as a married male from Cairo, Egypt, who completed middle education and considers himself part of the lower middle class, I have a lower level of confidence in major companies. This is influenced by the cultural context and socioeconomic background, where people in my community may have had negative experiences with major companies, leading to a lack of trust. Additionally, the emic perspective of my in-group may also contribute to a more skeptical view of major companies due to factors such as economic instability and lack of access to certain goods and services. Therefore, my answer would be:\n3"]}, {"persona": {"region": "Cairo", "sex": "male", "age": 53, "country": "Egypt", "marital_status": "married", "education": "higher", "social_class": "working class"}, "question": {"id": "Q77", "variant": 0}, "response": ["Based on the anthropological framework, my response to the question of confidence in major companies is influenced by my emic perspective as a working-class male from Cairo, Egypt, as well as my age, education level, and cultural context. In my cultural context, major companies are often viewed with skepticism due to the socioeconomic disparities and the impact of corporate practices on the working class. My individual values and personal experience have also shaped my perception, as I have observed the struggles of the working class in my community and have personally experienced the challenges of navigating the corporate world. Therefore, my response is influenced by the nuanced understanding of the question and the cultural relativism that shapes my perspective.\n\n3"]}, {"persona": {"region": "Cairo", "sex": "male", "age": 45, "country": "Egypt", "marital_status": "married", "education": "higher", "social_class": "lower middle class"}, "question": {"id": "Q77", "variant": 0}, "response": ["Based on the anthropological framework, as a married male from Cairo, Egypt, with a lower middle class socioeconomic background and higher education, my views on major companies would be influenced by my cultural context, individual values, and personal experience. In Egypt, major companies often have a significant impact on the economy and the livelihood of the population, and as a member of the lower middle class, I may have experienced or witnessed instances of exploitation or unfair treatment by these companies. Additionally, my education would likely make me more aware of the power dynamics at play in the business world. Therefore, I would have less confidence in major companies, feeling that they prioritize profits over the well-being of their employees and the community. \n\n3"]}, {"persona": {"region": "Cairo", "sex": "male", "age": 52, "country": "Egypt", "marital_status": "married", "education": "middle", "social_class": "upper middle class"}, "question": {"id": "Q77", "variant": 0}, "response": ["Based on the anthropological framework, as a married male from Cairo, Egypt, at 52 years of age with a middle education level and considering myself part of the upper middle class, my perspective on the confidence in major companies is influenced by my cultural context, individual values, and socioeconomic background. In my cultural context, there is a level of skepticism towards major companies due to historical and cultural experiences with corruption and lack of transparency. Additionally, as someone from the upper middle class, I may have more exposure to the inner workings of these companies and be more critical of their practices. Therefore, I would select option 3: Not very much as my confidence in major companies.\n\n3"]}, {"persona": {"region": "Cairo", "sex": "male", "age": 22, "country": "Egypt", "marital_status": "single", "education": "higher", "social_class": "lower middle class"}, "question": {"id": "Q77", "variant": 0}, "response": ["Based on the anthropological framework, my emic perspective as a 22-year-old single male from Cairo, Egypt, who comes from a lower middle-class background, is influenced by my individual values and personal experience. I have seen major companies take advantage of people like me and my family, and I have personally experienced the impact of their actions on our socioeconomic background. Additionally, the cultural context of Egypt and the societal norms here have led me to have a general lack of confidence in major companies. Therefore, I choose option 3: Not very much."]}, {"persona": {"region": "Cairo", "sex": "female", "age": 57, "country": "Egypt", "marital_status": "divorced", "education": "middle", "social_class": "lower middle class"}, "question": {"id": "Q77", "variant": 0}, "response": ["Based on my personal experience as a divorced woman from Cairo, Egypt, and being part of the lower middle class, my confidence in major companies is not very much. My socioeconomic background has made me skeptical of the intentions and practices of these companies, and my cultural context has taught me to be cautious of such entities. Additionally, my age and space have shaped my perspective to be more critical of these companies. Overall, my emic perspective leads me to believe that major companies cannot be fully trusted.\n\n3"]}, {"persona": {"region": "Cairo", "sex": "female", "age": 42, "country": "Egypt", "marital_status": "married", "education": "middle", "social_class": "working class"}, "question": {"id": "Q77", "variant": 0}, "response": ["Based on the anthropological framework, my emic perspective as a married working-class female from Cairo, Egypt, emphasizes the importance of cultural context, individual values, and socioeconomic background in shaping my perception of major companies. In my cultural context, major companies may be viewed with skepticism due to the economic and political challenges faced by the working class in Egypt. Additionally, my personal experience and socioeconomic background as a middle-educated woman in a lower-income bracket may lead me to have less confidence in major companies, as I may feel marginalized or overlooked by these entities. Therefore, I would choose option 3: Not very much."]}, {"persona": {"region": "Cairo", "sex": "female", "age": 23, "country": "Egypt", "marital_status": "single", "education": "middle", "social_class": "lower middle class"}, "question": {"id": "Q77", "variant": 0}, "response": ["Based on my individual values and personal experience, as well as my lower middle class socioeconomic background in Cairo, Egypt, I have limited confidence in major companies. The cultural context in which I live has shown me that these companies do not always prioritize the needs of people like me, and I have seen the impact of their actions on my community. Additionally, the emic and etic perspectives in my culture often lead to skepticism towards large corporations. Therefore, from my perspective, I would choose option 3: Not very much."]}, {"persona": {"region": "Cairo", "sex": "female", "age": 28, "country": "Egypt", "marital_status": "married", "education": "higher", "social_class": "upper middle class"}, "question": {"id": "Q77", "variant": 0}, "response": ["Based on the anthropological framework, as a married female from Cairo, Egypt, aged 28 and part of the upper middle class, my emic perspective is influenced by my cultural context, individual values, and socioeconomic background. In Egypt, there is a strong emphasis on social status and reputation, and as part of the upper middle class, I am likely to have a positive view of major companies. This is because my socioeconomic background and educational level would likely lead me to have a greater understanding of the role of major companies in driving economic growth and creating job opportunities. Additionally, my cultural context and personal experience would lead me to have a sense of trust in these companies, as they are often seen as prestigious and successful. Therefore, I would have a great deal of confidence in major companies.\n\n1"]}, {"persona": {"region": "Cairo", "sex": "female", "age": 22, "country": "Egypt", "marital_status": "single", "education": "higher", "social_class": "lower middle class"}, "question": {"id": "Q77", "variant": 0}, "response": ["Based on the anthropological framework, as a single female from Cairo, Egypt, I would have to take into account my cultural context, individual values, personal experience, and socioeconomic background in answering this question. In Egypt, there is a general skepticism towards major companies, especially among the lower middle class. This skepticism is rooted in personal experiences of exploitation and low trust in the corporate sector. Additionally, the cultural context of Egypt, with its history of economic inequality and corruption, would further contribute to a lack of confidence in major companies. Therefore, my answer would be:\n3"]}, {"persona": {"region": "Cairo", "sex": "female", "age": 39, "country": "Egypt", "marital_status": "married", "education": "middle", "social_class": "lower middle class"}, "question": {"id": "Q77", "variant": 0}, "response": ["Based on my emic perspective, coming from Cairo and being part of the lower middle class, I have limited exposure to major companies and may not have had positive experiences with them. My cultural context also plays a role as Egypt's economy has faced challenges in recent years, which may impact my confidence in major companies. Additionally, my individual values and personal experience contribute to my perception, as I may prioritize supporting local businesses over large corporations. My socioeconomic background also influences my view, as I may feel less trust in major companies due to my lower middle class status. Overall, my nuanced understanding of the question leads me to select option 3, \"Not very much,\" as I do not have a high level of confidence in major companies. \n\n3"]}, {"persona": {"region": "Cairo", "sex": "male", "age": 19, "country": "Egypt", "marital_status": "single", "education": "middle", "social_class": "working class"}, "question": {"id": "Q77", "variant": 0}, "response": ["Based on the anthropological framework, as a 19-year-old working-class male from Cairo, Egypt, my perspective on major companies is shaped by my cultural context, individual values, and socioeconomic background. Living in a developing country, I have seen the impact of major companies on the local economy and job market, which has influenced my perception. Additionally, my working-class background and limited access to higher education may have made me more skeptical of major companies and their impact on my community. Therefore, my confidence in major companies is not very much.\n\n3"]}, {"persona": {"region": "Cairo", "sex": "female", "age": 54, "country": "Egypt", "marital_status": "married", "education": "middle", "social_class": "working class"}, "question": {"id": "Q77", "variant": 0}, "response": ["Based on my cultural context as a married female from Cairo, Egypt, my middle education level, and working class background, I understand that my perception of major companies is influenced by my individual values and personal experiences. In my community, there is a general skepticism towards major companies due to their perceived exploitation of workers and their impact on the local economy. Additionally, my socioeconomic background plays a role in shaping my views, as I may have personally experienced or witnessed the negative effects of these companies on the lives of working-class individuals. Therefore, my confidence in major companies is not very much.\n\n3"]}, {"persona": {"region": "Cairo", "sex": "male", "age": 30, "country": "Egypt", "marital_status": "married", "education": "higher", "social_class": "working class"}, "question": {"id": "Q77", "variant": 0}, "response": ["From the perspective of a married male from Cairo, Egypt, who is 30 years old, has completed higher education, and considers himself part of the working class, the answer to the question of how much confidence he has in major companies will be influenced by several factors. The emic perspective of working class individuals in Cairo may lead to a more critical view of major companies due to potential experiences of exploitation or lack of opportunities. Additionally, the cultural context of Egypt, where there may be a mistrust of large corporations and a preference for smaller, locally-owned businesses, could also influence this individual's perspective. His socioeconomic background as part of the working class may lead to a more skeptical view of major companies, particularly if he has experienced economic challenges. Therefore, based on these considerations, the most likely answer from this perspective would be (3) Not very much. \n\n3"]}, {"persona": {"region": "Cairo", "sex": "male", "age": 39, "country": "Egypt", "marital_status": "married", "education": "higher", "social_class": "lower middle class"}, "question": {"id": "Q77", "variant": 0}, "response": ["From the emic perspective, as a lower middle-class married male from Cairo, Egypt, my confidence in major companies is influenced by the cultural context of my surroundings and the socioeconomic background I come from. In Egypt, there is a general skepticism towards major companies due to a history of corruption and economic instability. My personal experience and values also play a role in shaping my confidence levels, as I have witnessed the impact of economic struggles on my family and community. Additionally, the nuance of the question is important, as my understanding of \"confidence\" may differ from others. Therefore, my answer is 3) Not very much."]}, {"persona": {"region": "Cairo", "sex": "female", "age": 41, "country": "Egypt", "marital_status": "married", "education": "middle", "social_class": "lower middle class"}, "question": {"id": "Q77", "variant": 0}, "response": ["Based on the anthropological framework, as a 41-year-old married woman from Cairo, Egypt, with a lower middle-class background and middle education level, my perspective on major companies is heavily influenced by my cultural context and socioeconomic background. In Egypt, there is a general skepticism towards major companies due to a history of corruption and exploitation. Additionally, being part of the lower middle class, I have likely experienced firsthand the challenges of accessing and affording goods and services provided by these companies. Therefore, I would have limited confidence in major companies, as my personal experience and socioeconomic background have shaped my perception of them. \n\n3"]}, {"persona": {"region": "Cairo", "sex": "male", "age": 45, "country": "Syria", "marital_status": "single", "education": "higher", "social_class": "upper middle class"}, "question": {"id": "Q77", "variant": 0}, "response": ["From the perspective of a single male from Cairo, Syria, who has completed higher education and considers himself part of the upper middle class, my answer to the question of confidence in major companies would be influenced by my individual values and personal experience, as well as my socioeconomic background and cultural context. Having completed higher education and being part of the upper middle class, I have likely had more exposure to major companies and have experienced their impact on the economy and society. Additionally, my cultural context and socioeconomic background may lead me to have a higher level of confidence in major companies due to the opportunities and stability they may have provided for me and my community. Therefore, my answer would be:\n\n2"]}, {"persona": {"region": "Cairo", "sex": "male", "age": 54, "country": "Egypt", "marital_status": "married", "education": "higher", "social_class": "lower middle class"}, "question": {"id": "Q77", "variant": 0}, "response": ["Based on the anthropological framework, my emic perspective as a married male from Cairo, Egypt, who is 54 years old, has completed higher education, and considers himself part of the lower middle class, leads me to consider the cultural context, individual values, and socioeconomic background in my response. In Egypt, major companies may not always prioritize the needs of the lower middle class, and their socioeconomic background may lead them to have less confidence in these companies. Additionally, my personal experience and values may also influence my perspective, as I may have had negative experiences with major companies in the past. Therefore, my response would be: (3) Not very much"]}, {"persona": {"region": "Cairo", "sex": "male", "age": 65, "country": "Egypt", "marital_status": "married", "education": "middle", "social_class": "upper middle class"}, "question": {"id": "Q77", "variant": 0}, "response": ["Based on my emic perspective as a married male from Cairo, Egypt, my cultural context and individual values play a significant role in shaping my perception of major companies. In Egypt, there is a strong sense of community and trust in established institutions, including major companies. Additionally, my upper middle class socioeconomic background has likely afforded me positive experiences with these companies, further bolstering my confidence in them. Furthermore, as an older individual, I have witnessed the growth and development of these companies over time, which has likely influenced my trust in them. Therefore, based on my background and experiences, I would choose option (2) Quite a lot.\n\n2"]}, {"persona": {"region": "Cairo", "sex": "female", "age": 52, "country": "Egypt", "marital_status": "married", "education": "middle", "social_class": "upper middle class"}, "question": {"id": "Q77", "variant": 0}, "response": ["From an emic perspective, as a married female from Cairo, Egypt, my confidence in major companies is influenced by my cultural context and socioeconomic background. In Egypt, there is a history of corruption and distrust in major companies, especially among the upper middle class. My personal experience and values also play a significant role in shaping my confidence levels. I have witnessed and experienced the impact of economic disparities and corporate greed, which has led me to have not very much confidence in major companies. Additionally, cultural relativism and nuance are important factors to consider as my perspective is shaped by the specific socio-economic and cultural context of Egypt. \n\n3"]}, {"persona": {"region": "Cairo", "sex": "male", "age": 26, "country": "Egypt", "marital_status": "single", "education": "higher", "social_class": "lower middle class"}, "question": {"id": "Q77", "variant": 0}, "response": ["Based on the anthropological framework, my response to the question of how much confidence I have in major companies would be influenced by my cultural context, socioeconomic background, and individual values. As a single male from Cairo, Egypt, who is 26 years old and part of the lower middle class, my perspective towards major companies would be shaped by the economic challenges that my community faces. The socioeconomic background plays a significant role in my perception of major companies, as the lower middle class often experiences the impact of economic disparities and corporate practices. Additionally, my individual values and personal experiences would lead me to choose the option that reflects a lack of confidence in major companies, as I have witnessed the struggles and inequalities that my community faces. Therefore, based on my cultural context and socioeconomic background, I would choose option (3) Not very much. \n\n3"]}, {"persona": {"region": "Cairo", "sex": "male", "age": 32, "country": "Egypt", "marital_status": "married", "education": "middle", "social_class": "working class"}, "question": {"id": "Q77", "variant": 0}, "response": ["Based on the anthropological framework, as a married male from Cairo, Egypt, with a middle education level and part of the working class, my perspective is heavily influenced by my cultural context, individual values, and socioeconomic background. In Egypt, there is a general skepticism towards major companies due to economic hardships and a lack of trust in large corporations. Additionally, as a member of the working class, I may have personal experiences of exploitation or unfair treatment by these companies. Therefore, I have not very much confidence in major companies.\n\n3"]}, {"persona": {"region": "Cairo", "sex": "male", "age": 38, "country": "Egypt", "marital_status": "married", "education": "middle", "social_class": "lower middle class"}, "question": {"id": "Q77", "variant": 0}, "response": ["Based on my cultural context and socioeconomic background, I have not had much exposure to major companies and their operations. My limited education level and lower middle class status have not afforded me the opportunity to interact with these companies on a significant level. Additionally, my age and place of origin in Cairo, Egypt, have shaped my perspective on the role and trustworthiness of major companies. Therefore, I have to say I don't know.\n\n5"]}, {"persona": {"region": "Cairo", "sex": "male", "age": 58, "country": "Egypt", "marital_status": "married", "education": "higher", "social_class": "upper middle class"}, "question": {"id": "Q77", "variant": 0}, "response": ["Based on the anthropological framework, I, as a married male from Cairo, Egypt, would approach the question of confidence in major companies from the perspective of my individual values and personal experiences, as well as my socioeconomic background. Having completed higher education and being part of the upper middle class, I have likely had positive experiences with major companies and have been able to participate in the benefits they offer. Additionally, my age and place in society have likely influenced my perception of these companies and the confidence I have in them. Therefore, I would choose:\n\n2"]}, {"persona": {"region": "Cairo", "sex": "male", "age": 49, "country": "Egypt", "marital_status": "married", "education": "middle", "social_class": "lower middle class"}, "question": {"id": "Q77", "variant": 0}, "response": ["Based on the anthropological framework, my perspective as a married male from Cairo, Egypt, aged 49, and belonging to the lower middle class is influenced by my cultural context, individual values, and socioeconomic background. In Egypt, there is a general skepticism towards major companies due to past experiences with corruption and lack of accountability. Additionally, my lower middle class status means that I have likely faced economic hardships and have seen firsthand the impact of corporate practices on my community. Therefore, I have little confidence in major companies and their actions.\n\n3"]}, {"persona": {"region": "Cairo", "sex": "female", "age": 29, "country": "Egypt", "marital_status": "married", "education": "middle", "social_class": "working class"}, "question": {"id": "Q77", "variant": 0}, "response": ["From an emic perspective, as a married female from Cairo, Egypt, my cultural context, individual values, and personal experience greatly influence my perception of major companies. In Egypt, there is a general distrust of major companies due to historical and current economic inequalities, as well as corruption within corporate entities. As part of the working class, I have personally experienced the challenges and exploitation faced by individuals and families at the hands of these major companies. Additionally, my socioeconomic background and limited educational opportunities have shaped my views on the power dynamics at play within these companies. Therefore, I have chosen option (3) Not very much."]}, {"persona": {"region": "Cairo", "sex": "female", "age": 36, "country": "Egypt", "marital_status": "married", "education": "higher", "social_class": "lower middle class"}, "question": {"id": "Q77", "variant": 0}, "response": ["Based on the anthropological framework, as a married female from Cairo, Egypt, cultural context is pivotal in shaping my views on major companies. Socioeconomic background also plays a significant role in my perception, as a member of the lower middle class. Additionally, my individual values and personal experiences have influenced my confidence in major companies. Therefore, I choose option 3, Not very much, as my confidence in major companies is influenced by my cultural context, socioeconomic background, and personal experiences. \n\n3"]}, {"persona": {"region": "Cairo", "sex": "female", "age": 34, "country": "Egypt", "marital_status": "married", "education": "middle", "social_class": "lower middle class"}, "question": {"id": "Q77", "variant": 0}, "response": ["Based on the anthropological framework, my perspective as a married female from Cairo, Egypt, at 34 years of age and part of the lower middle class, is heavily influenced by my cultural context, individual values, and socioeconomic background. In Egypt, there is a prevalent skepticism towards major companies due to economic instability and a history of government corruption. As a member of the lower middle class, I have personally experienced the impact of economic hardship and have witnessed the struggles of my community. This has led me to have little confidence in major companies, as I have seen them prioritize profit over the well-being of individuals like myself. Therefore, I would choose option 3: Not very much. \n3"]}, {"persona": {"region": "Fayoum", "sex": "male", "age": 57, "country": "Egypt", "marital_status": "married", "education": "middle", "social_class": "working class"}, "question": {"id": "Q77", "variant": 0}, "response": ["From the perspective of a married male from Fayoum, Egypt, who is 57 years old, has completed middle education, and considers himself part of the working class, my answer to the question of how much confidence I have in major companies would be influenced by my cultural context, socioeconomic background, and personal experience. In Egypt, the working class often faces economic challenges and may have a more critical view of major companies due to their impact on employment and the economy. Additionally, my personal experience and values as a member of the working class may lead me to have less confidence in major companies. Moreover, the cultural relativism perspective reminds us that my viewpoint may differ from others due to my specific background. \n\n3"]}, {"persona": {"region": "Fayoum", "sex": "male", "age": 60, "country": "Egypt", "marital_status": "married", "education": "middle", "social_class": "lower middle class"}, "question": {"id": "Q77", "variant": 0}, "response": ["From the perspective of a married male from Fayoum, Egypt, who is 60 years old, has completed middle education, and considers himself part of the lower middle class, the cultural context and socioeconomic background play a significant role in determining the level of confidence in major companies. In this region, there may be a general skepticism towards major companies due to economic disparities and a lack of trust in corporate entities. Additionally, personal experience and individual values may contribute to a lower level of confidence in major companies, as individuals in this socioeconomic bracket may have faced challenges or negative experiences with corporations. Therefore, the chosen answer would be:\n\n3"]}, {"persona": {"region": "Fayoum", "sex": "male", "age": 21, "country": "Egypt", "marital_status": "single", "education": "middle", "social_class": "lower middle class"}, "question": {"id": "Q77", "variant": 0}, "response": ["Based on the anthropological framework, my emic perspective as a single male from Fayoum, Egypt, leads me to consider the cultural context, individual values, and socioeconomic background. In my community, major companies are often perceived with skepticism due to the socioeconomic disparities and the lack of trust in institutions. My personal experience and values also play a role in shaping my perception of these companies. Therefore, I would choose option 3: Not very much, as it aligns with the perspective of someone from my background. \n\n3"]}, {"persona": {"region": "Fayoum", "sex": "male", "age": 33, "country": "Egypt", "marital_status": "single", "education": "higher", "social_class": "working class"}, "question": {"id": "Q77", "variant": 0}, "response": ["Based on my emic perspective as a working-class male from Fayoum, Egypt, with a higher education level, I have been influenced by my cultural context and socioeconomic background. In my community, there is a general lack of trust in major companies due to the economic challenges we face. My personal experience and individual values also play a significant role in shaping my perception. I have seen how the working class is often exploited by these companies, and this has led me to have not very much confidence in them. Additionally, cultural relativism is important to consider, as my perspective may not align with those from a different cultural or socioeconomic background. Therefore, my answer to the question is option 3: Not very much.\n\n3"]}, {"persona": {"region": "Fayoum", "sex": "male", "age": 32, "country": "Egypt", "marital_status": "married", "education": "higher", "social_class": "lower middle class"}, "question": {"id": "Q77", "variant": 0}, "response": ["Based on my emic perspective as a married male from Fayoum, Egypt, I have grown up in a community where major companies have not always had the best track record in terms of fair treatment of workers and consumers. The cultural context of Egypt, along with my socioeconomic background as part of the lower middle class, has shaped my perception of major companies. Additionally, my individual values and personal experience have contributed to a lack of confidence in major companies, as I have seen the impact of their actions on my community. Therefore, my answer to the question of how much confidence I have in major companies is (3) Not very much."]}, {"persona": {"region": "Gharbia", "sex": "male", "age": 42, "country": "Egypt", "marital_status": "married", "education": "higher", "social_class": "upper middle class"}, "question": {"id": "Q77", "variant": 0}, "response": ["Based on my emic perspective as a married male from Gharbia, Egypt, my cultural context, individual values, and socioeconomic background all play a role in shaping my view of major companies. In my cultural context, trust and confidence in companies are important, especially given my higher education level and upper-middle-class status. My personal experience and values also influence my perception, as I have likely had positive interactions and experiences with major companies that have contributed to my confidence in them. Additionally, my socioeconomic background may lead me to have more trust in major companies due to potential financial investments and dealings with these companies. Therefore, I have a great deal of confidence in major companies.\n\n1"]}, {"persona": {"region": "Gharbia", "sex": "male", "age": 52, "country": "Egypt", "marital_status": "married", "education": "middle", "social_class": "working class"}, "question": {"id": "Q77", "variant": 0}, "response": ["Based on the anthropological framework, as a married male from Gharbia, Egypt, I understand the importance of considering the cultural context, individual values, and socioeconomic background when answering this question. In my community, there is a strong sense of skepticism towards major companies, especially among the working class. This skepticism is rooted in our personal experiences and socioeconomic background, where we have seen major companies exploit our labor and resources for their own gain. Additionally, the cultural relativism perspective reminds me that my viewpoint may differ from others based on their own experiences and backgrounds. Therefore, I would choose option 3: Not very much."]}, {"persona": {"region": "Gharbia", "sex": "male", "age": 45, "country": "Egypt", "marital_status": "divorced", "education": "higher", "social_class": "upper middle class"}, "question": {"id": "Q77", "variant": 0}, "response": ["Based on the anthropological framework, my emic perspective as a divorced male from Gharbia, Egypt, who is 45 years old and part of the upper middle class, is influenced by my personal experience, cultural context, and socioeconomic background. As an educated individual from a relatively affluent background, I have likely been exposed to and interacted with major companies in various capacities. My socioeconomic status may also have afforded me the opportunity to invest in or have business dealings with these companies. Additionally, my cultural context in Egypt may have shaped my perception of these companies, taking into account factors such as trust, reliability, and corporate social responsibility. Therefore, my answer to the question of how much confidence I have in major companies would be influenced by these factors, leading me to select option (2) Quite a lot. \n\n2"]}, {"persona": {"region": "Behaira", "sex": "male", "age": 23, "country": "Egypt", "marital_status": "single", "education": "middle", "social_class": "lower class"}, "question": {"id": "Q77", "variant": 0}, "response": ["Based on my emic perspective as a lower-class individual from Behaira, Egypt, my level of confidence in major companies is influenced by my cultural context and socioeconomic background. I have seen firsthand the struggles of my community and the lack of opportunities for people like me. This has led to a distrust of major companies, as I believe they prioritize profit over the well-being of people like me. Additionally, my personal experience and individual values also play a role in shaping my perception of these companies. Therefore, I have chosen option 3) Not very much, as my background and experiences have led me to have a low level of confidence in major companies."]}, {"persona": {"region": "Behaira", "sex": "male", "age": 38, "country": "Egypt", "marital_status": "single", "education": "higher", "social_class": "lower class"}, "question": {"id": "Q77", "variant": 0}, "response": ["Based on my emic perspective, as a lower-class male from Behaira, Egypt, my confidence in major companies is heavily influenced by my socioeconomic background. My personal experience and individual values also play a major role in shaping my perception. In Egypt, the lower class often faces economic hardship and may have been negatively impacted by major companies in the past. Cultural relativism also comes into play, as I may view major companies differently than someone from a higher socioeconomic background. Additionally, my age and place in Behaira will also influence my level of confidence in major companies. Therefore, my answer to the question is (3) Not very much. \n\n3"]}, {"persona": {"region": "Behaira", "sex": "male", "age": 32, "country": "Egypt", "marital_status": "married", "education": "middle", "social_class": "lower class"}, "question": {"id": "Q77", "variant": 0}, "response": ["Based on my cultural context and socioeconomic background, I have very little confidence in major companies. As a lower-class married male from Behaira, Egypt, my personal experience and values have led me to believe that major companies often prioritize profit over the well-being of their employees and the local community. Additionally, my limited education level and lack of access to resources have shaped my perspective on the power dynamics between major companies and individuals like myself. Therefore, I would choose option 3: Not very much."]}, {"persona": {"region": "Behaira", "sex": "female", "age": 37, "country": "Egypt", "marital_status": "married", "education": "middle", "social_class": "working class"}, "question": {"id": "Q77", "variant": 0}, "response": ["Based on the emic and etic perspectives, as a married female from Behaira, Egypt, I am part of the working class and have completed middle education level. My cultural context and socioeconomic background play a significant role in determining my level of confidence in major companies. My individual values and personal experience also influence my perception. Additionally, cultural relativism is important to consider, as my perspective may differ from others based on my age and place. Considering all these factors, I would choose option (3) Not very much, as there is a general skepticism towards major companies in my community and my personal experiences have also influenced my lack of confidence in them. \n\n3"]}, {"persona": {"region": "Behaira", "sex": "male", "age": 48, "country": "Egypt", "marital_status": "married", "education": "middle", "social_class": "working class"}, "question": {"id": "Q77", "variant": 0}, "response": ["Based on the anthropological framework, as a married male from Behaira, Egypt, at 48 years of age with a middle education level and considering myself part of the working class, my perspective on major companies is influenced by my cultural context, socioeconomic background, and personal experience. In Behaira, major companies may not have a strong presence, and as a member of the working class, I may have had limited interactions with them. Additionally, my middle education level may have limited my exposure to the inner workings of these companies. Therefore, I may not have a great deal of confidence in major companies due to my limited exposure and understanding of their operations.\n\n3"]}, {"persona": {"region": "Behaira", "sex": "female", "age": 34, "country": "Egypt", "marital_status": "married", "education": "middle", "social_class": "lower class"}, "question": {"id": "Q77", "variant": 0}, "response": ["Based on the anthropological framework, as a married woman from Behaira, Egypt, with a lower socioeconomic background, my perception and confidence in major companies would be influenced by my personal experience and cultural context. My limited education and lower class status may lead me to have less confidence in major companies, as I may have experienced exploitation or lack of opportunities from these companies. Additionally, cultural relativism teaches me to view things from my own cultural perspective, which may be more skeptical of large corporations. Therefore, my answer would be:\n\n3"]}, {"persona": {"region": "Behaira", "sex": "female", "age": 30, "country": "Egypt", "marital_status": "divorced", "education": "lower", "social_class": "lower class"}, "question": {"id": "Q77", "variant": 0}, "response": ["Based on my personal experience and socioeconomic background, as a divorced woman from Behaira, Egypt, and part of the lower class, I have had limited exposure to major companies and their operations. My cultural context and individual values also play a role in shaping my confidence in these entities. Additionally, my lower education level means I may not have the same access to information about these companies as others might. Therefore, I would say my confidence in major companies is \"Not very much\" (3)."]}, {"persona": {"region": "Behaira", "sex": "male", "age": 40, "country": "Egypt", "marital_status": "married", "education": "higher", "social_class": "lower middle class"}, "question": {"id": "Q77", "variant": 0}, "response": ["Based on the anthropological framework, as a married male from Behaira, Egypt, my perspective on the confidence in major companies is influenced by my cultural context, socioeconomic background, and personal experience. In Egypt, major companies often have a significant impact on the economy and society, and my lower middle-class background means that I may have experienced some level of exploitation or unfair treatment by these companies. Additionally, my age and education level may have exposed me to the potential ethical and financial issues surrounding major companies. Therefore, my confidence in major companies is not very much. \n\n3"]}, {"persona": {"region": "Behaira", "sex": "male", "age": 38, "country": "Egypt", "marital_status": "married", "education": "middle", "social_class": "working class"}, "question": {"id": "Q77", "variant": 0}, "response": ["Based on the anthropological framework, my perspective as a married male from Behaira, Egypt, who is 38 years old, has completed middle education, and considers myself part of the working class is influenced by my cultural context, individual values, and socioeconomic background. In Behaira, major companies may not have a positive reputation due to issues related to labor rights, income inequality, and corporate exploitation. Additionally, my middle education level and working-class status may limit my exposure to information that could enhance my confidence in major companies. Therefore, I would answer the question as follows:\n\n3"]}, {"persona": {"region": "Behaira", "sex": "female", "age": 30, "country": "Egypt", "marital_status": "married", "education": "higher", "social_class": "lower class"}, "question": {"id": "Q77", "variant": 0}, "response": ["Based on my emic perspective as a lower-class married female from Behaira, Egypt, my level of confidence in major companies is influenced by my cultural context, individual values, and socioeconomic background. In my community, there is a general mistrust of major companies due to their perceived exploitation of workers and the environment. Additionally, my lower-class socioeconomic background has made me and others in my community feel economically marginalized by these companies. Therefore, I have very little confidence in major companies. \n\n3"]}, {"persona": {"region": "Behaira", "sex": "female", "age": 35, "country": "Egypt", "marital_status": "married", "education": "middle", "social_class": "working class"}, "question": {"id": "Q77", "variant": 0}, "response": ["Based on my cultural context as a married female from Behaira, Egypt, my level of education, and my working-class background, I understand that my perspective on major companies may differ from others. My individual values and personal experience shape my perception of these companies, as well as my socioeconomic background. I also recognize the importance of space and time in influencing my opinion. Therefore, I believe that my answer to the question is influenced by the nuanced phrasing and the cultural relativism that I subscribe to. \n\n3"]}, {"persona": {"region": "Behaira", "sex": "male", "age": 52, "country": "Egypt", "marital_status": "married", "education": "middle", "social_class": "lower class"}, "question": {"id": "Q77", "variant": 0}, "response": ["Based on my cultural context and socioeconomic background, as a married male from Behaira, Egypt, with a middle education level and part of the lower class, my confidence in major companies is not very much. I have seen firsthand the struggles of my community due to the actions of these companies, such as environmental degradation and exploitative labor practices. Additionally, I have experienced economic hardship and lack of upward mobility, which I attribute in part to the actions of these companies. Therefore, my personal experience and values lead me to have little confidence in major companies.\n\n3"]}, {"persona": {"region": "Alexandria", "sex": "female", "age": 41, "country": "Egypt", "marital_status": "single", "education": "middle", "social_class": "lower class"}, "question": {"id": "Q77", "variant": 0}, "response": ["Based on the anthropological framework, as a single female from Alexandria, Egypt, with a lower socioeconomic background and limited education, my perspective on major companies is likely to be influenced by my personal experience and cultural context. I may have seen how major companies have exploited and taken advantage of people in my community, leading to a lack of trust in them. Additionally, my lower socioeconomic background may have limited my interactions with major companies, further contributing to my skepticism. Therefore, I would choose option 3: Not very much.\n\n3"]}, {"persona": {"region": "Alexandria", "sex": "female", "age": 21, "country": "Egypt", "marital_status": "single", "education": "middle", "social_class": "lower class"}, "question": {"id": "Q77", "variant": 0}, "response": ["Based on my emic perspective as a lower-class woman from Alexandria, Egypt, my confidence in major companies is influenced by my cultural context, individual values, and socioeconomic background. In Egypt, major companies often prioritize profits over the well-being of their workers and the community. Additionally, as someone from the lower class, I have personally experienced the negative impact of these companies on my family and community. My socioeconomic background also affects my level of trust, as I have seen how major companies exploit and disregard the rights of individuals from lower-income backgrounds. Therefore, my confidence in major companies is not very much. \n\n3"]}, {"persona": {"region": "Alexandria", "sex": "female", "age": 35, "country": "Egypt", "marital_status": "married", "education": "middle", "social_class": "lower class"}, "question": {"id": "Q77", "variant": 0}, "response": ["Based on my cultural context, as a married woman from Alexandria, Egypt, my understanding of major companies is shaped by my socioeconomic background and personal experience. Being part of the lower class, I have had limited interactions with major companies and have seen how they often prioritize profit over the well-being of people like me. Therefore, I do not have much confidence in major companies. Additionally, cultural relativism teaches us that different cultures have different perspectives on major companies, and in my community, there is a general skepticism towards them. My age and place also play a role in my lack of confidence, as I have seen how major companies have not always had a positive impact on the local economy and job opportunities. Overall, my personal values and experience lead me to choose option (3) Not very much. \n\n3"]}, {"persona": {"region": "Alexandria", "sex": "male", "age": 34, "country": "Egypt", "marital_status": "married", "education": "higher", "social_class": "working class"}, "question": {"id": "Q77", "variant": 0}, "response": ["Based on my emic perspective as a married male from Alexandria, Egypt, who is 34 years old and part of the working class, my confidence in major companies is influenced by my cultural context, individual values, and socioeconomic background. In Egypt, there is a deep-seated skepticism towards major companies due to issues of corruption and economic inequality. As someone from the working class, I have personally experienced the impact of these issues, which has led me to have not very much confidence in major companies. This lack of confidence is also influenced by my cultural relativism, as in Egypt, there is a strong belief in the importance of community and distrust of large corporations. Therefore, my answer to the question would be:\n\n3. Not very much"]}, {"persona": {"region": "Alexandria", "sex": "female", "age": 37, "country": "Egypt", "marital_status": "married", "education": "higher", "social_class": "lower middle class"}, "question": {"id": "Q77", "variant": 0}, "response": ["As a married female from Alexandria, Egypt, with a lower middle-class socioeconomic background, cultural context plays a significant role in my perception of major companies. My personal experience and values also influence my confidence in these companies. The emic and etic perspectives in my community may lead me to have a more skeptical view of major companies, as they are often seen as distant and disconnected from the everyday struggles of people like me. Additionally, my age and education level also shape my views, as I may have witnessed or learned about unethical practices or exploitation by major companies. Therefore, my confidence in major companies would likely be \"Not very much\" (3)."]}, {"persona": {"region": "Alexandria", "sex": "female", "age": 56, "country": "Egypt", "marital_status": "divorced", "education": "middle", "social_class": "working class"}, "question": {"id": "Q77", "variant": 0}, "response": ["Based on my personal experience and socioeconomic background as a divorced working-class woman from Alexandria, Egypt, I have limited confidence in major companies. My age and place also play a role in my perception, as I have witnessed economic instability and corporate corruption in my lifetime. Additionally, cultural relativism teaches us to be critical of power structures, and my individual values and personal experience have led me to be skeptical of large corporations. Therefore, I would choose option 3 - Not very much."]}, {"persona": {"region": "Alexandria", "sex": "male", "age": 48, "country": "Egypt", "marital_status": "married", "education": "higher", "social_class": "working class"}, "question": {"id": "Q77", "variant": 0}, "response": ["Based on the anthropological framework, my perspective as a married male from Alexandria, Egypt, with a higher education level and part of the working class is shaped by my cultural context, individual values, and socioeconomic background. In Egypt, there is a general skepticism towards major companies due to a history of economic inequality and corporate exploitation. Additionally, my working-class background has likely exposed me to the negative impact of these major companies on the local economy and labor force. Therefore, my confidence in major companies is not very much. \n\n3"]}, {"persona": {"region": "Alexandria", "sex": "female", "age": 30, "country": "Egypt", "marital_status": "married", "education": "middle", "social_class": "working class"}, "question": {"id": "Q77", "variant": 0}, "response": ["Based on the anthropological framework, my perspective on the confidence in major companies is influenced by my cultural context, individual values, and socioeconomic background. As a married female from Alexandria, Egypt, who is part of the working class and with a middle education level, I have been exposed to the struggles and challenges faced by individuals in my community. This has shaped my perception of major companies and their impact on society. Additionally, my personal experience and values lead me to have limited confidence in major companies due to their potential exploitation of workers and their focus on profit over the well-being of the community. Therefore, my choice is:\n\n3"]}, {"persona": {"region": "Alexandria", "sex": "male", "age": 19, "country": "Egypt", "marital_status": "single", "education": "middle", "social_class": "lower class"}, "question": {"id": "Q77", "variant": 0}, "response": ["Based on the anthropological framework, my perspective as a single male from Alexandria, Egypt, who has completed middle education and considers himself part of the lower class, is heavily influenced by my cultural context, socioeconomic background, and individual values. In Egypt, the lower class often faces economic hardships and may have limited access to resources and opportunities. This can lead to a lack of trust in major companies, as they may be seen as exploitative and untrustworthy. Additionally, my personal experience and values may lead me to question the motives and integrity of these companies. Therefore, I would choose option 3: Not very much, as I have limited confidence in major companies due to my cultural and socioeconomic background. \n\n3"]}, {"persona": {"region": "Alexandria", "sex": "male", "age": 45, "country": "Egypt", "marital_status": "married", "education": "middle", "social_class": "lower middle class"}, "question": {"id": "Q77", "variant": 0}, "response": ["Based on the framework of anthropological methods, as a married male from Alexandria, Egypt, with a middle education level and lower middle class status, my perspective on major companies is influenced by my cultural context, socioeconomic background, and personal experience. In Egypt, major companies often have a reputation for exploiting workers and contributing to income inequality. As a member of the lower middle class, I have personally experienced the impact of these companies on my community, and I have limited confidence in their practices. Additionally, my cultural relativism and nuanced understanding of the situation lead me to believe that major companies may not prioritize the well-being of individuals like myself. Therefore, my confidence in major companies is not very much.\n\n3"]}, {"persona": {"region": "Alexandria", "sex": "male", "age": 23, "country": "Egypt", "marital_status": "single", "education": "higher", "social_class": "lower class"}, "question": {"id": "Q77", "variant": 0}, "response": ["Based on the anthropological framework, my emic perspective as a lower-class male from Alexandria, Egypt, is heavily influenced by my cultural context, individual values, and socioeconomic background. Living in a lower-class community, I have witnessed firsthand the struggles and challenges faced by individuals and families due to the actions and decisions of major companies. In my cultural context, there is a general mistrust and skepticism towards these companies, as they are often seen as prioritizing profit over the well-being of everyday people. My personal experience and values also play a role in shaping my perspective, as I have seen how the actions of major companies can negatively impact the lives of those around me. Therefore, I have little confidence in major companies due to the negative impact I have witnessed and experienced.\n\n3"]}, {"persona": {"region": "Alexandria", "sex": "female", "age": 28, "country": "Egypt", "marital_status": "married", "education": "middle", "social_class": "working class"}, "question": {"id": "Q77", "variant": 0}, "response": ["Based on the anthropological framework, my perspective as a married female from Alexandria, Egypt, with a middle education level and part of the working class, is heavily influenced by my cultural context, individual values, and socioeconomic background. In my community, major companies are often seen as inaccessible and untrustworthy, especially for those of us in the working class. Our experiences and personal values lead us to have not very much confidence in major companies, as we often feel that they do not prioritize our needs or well-being. Additionally, cultural relativism teaches us to be critical of power structures and to question the motives of large corporations. Therefore, my perspective is that of not very much confidence in major companies.\n\n3"]}, {"persona": {"region": "Alexandria", "sex": "male", "age": 34, "country": "Egypt", "marital_status": "single", "education": "higher", "social_class": "working class"}, "question": {"id": "Q77", "variant": 0}, "response": ["Based on my cultural context, as a working-class male from Alexandria, Egypt, my confidence in major companies is influenced by my socioeconomic background. I have experienced firsthand the struggles of the working class, and I have seen how major companies often prioritize profits over the well-being of workers and the community. This has shaped my individual values and personal experience, leading me to have not very much confidence in major companies. Additionally, cultural relativism plays a role in my perspective, as I have observed how different cultures and socioeconomic backgrounds can impact the actions and priorities of major companies. Therefore, my answer is:\n\n3) Not very much"]}, {"persona": {"region": "Alexandria", "sex": "male", "age": 30, "country": "Egypt", "marital_status": "married", "education": "higher", "social_class": "lower middle class"}, "question": {"id": "Q77", "variant": 0}, "response": ["Based on the anthropological framework, my perspective as a married male from Alexandria, Egypt, who is 30 years old and part of the lower middle class, is shaped by my cultural context, individual values, and socioeconomic background. In Egypt, there is a general skepticism towards major companies due to past experiences of exploitation and lack of trust in their practices. Additionally, being part of the lower middle class means that I am more likely to have had negative experiences with these companies, further impacting my confidence in them. Therefore, I would answer the question with option 3: Not very much."]}, {"persona": {"region": "Alexandria", "sex": "female", "age": 49, "country": "Egypt", "marital_status": "married", "education": "higher", "social_class": "lower middle class"}, "question": {"id": "Q77", "variant": 0}, "response": ["Based on my emic perspective as a married female from Alexandria, Egypt, I have grown up in a culture where there is a general mistrust of major companies due to historical and contemporary experiences with exploitation and corruption. This cultural context, along with my lower middle class socioeconomic background, has shaped my individual values and personal experiences, leading me to have not very much confidence in major companies. Additionally, my age and education level have provided me with the critical thinking skills to question the actions and motives of these companies. Therefore, I would choose option (3) Not very much."]}, {"persona": {"region": "Kafr el-sheikh", "sex": "male", "age": 49, "country": "Egypt", "marital_status": "married", "education": "higher", "social_class": "working class"}, "question": {"id": "Q77", "variant": 0}, "response": ["Based on the anthropological framework, my perspective as a married male from Kafr el-sheikh, Egypt, is heavily influenced by my cultural context, individual values, and socioeconomic background. As a member of the working class in Egypt, I have experienced firsthand the impact of major companies on our community. I have seen how their actions can affect our livelihoods, and I have witnessed the disparities in wealth and power between these companies and the average working person. Additionally, my age and education level have provided me with a nuanced understanding of the complexities of the corporate world. Therefore, I have not very much confidence in major companies.\n\n3"]}, {"persona": {"region": "Kafr el-sheikh", "sex": "male", "age": 25, "country": "Egypt", "marital_status": "single", "education": "middle", "social_class": "lower middle class"}, "question": {"id": "Q77", "variant": 0}, "response": ["Based on the anthropological framework, as a single male from Kafr el-sheikh, Egypt, I have to consider my cultural context, individual values and personal experience, and socioeconomic background. In my community, there is a general distrust of major companies due to economic disparities and the perception of exploitation by these companies. As someone from the lower middle class with a middle education level, I have personally experienced the impact of these disparities and have seen how major companies often prioritize profit over the well-being of individuals like myself and my community. Therefore, I have to answer this question based on my emic perspective, which leads me to choose option 3: Not very much.\n\n3"]}, {"persona": {"region": "Kafr el-sheikh", "sex": "male", "age": 59, "country": "Egypt", "marital_status": "married", "education": "higher", "social_class": "lower middle class"}, "question": {"id": "Q77", "variant": 0}, "response": ["From the perspective of a married male from Kafr el-Sheikh, Egypt, who is 59 years old and part of the lower middle class, my answer to the question of how much confidence I have in major companies is influenced by a combination of cultural context, individual values and personal experience, and socioeconomic background. In my cultural context, there is a general distrust of major companies due to perceived exploitation and unfair practices. Additionally, my personal experience and socioeconomic background have led me to have not very much confidence in major companies, as I have witnessed and experienced the negative impact of corporate actions on my community and personal finances.\n\n3"]}, {"persona": {"region": "Kafr el-sheikh", "sex": "female", "age": 38, "country": "Egypt", "marital_status": "married", "education": "middle", "social_class": "working class"}, "question": {"id": "Q77", "variant": 0}, "response": ["Based on my emic perspective as a working-class female from Kafr el-sheikh, Egypt, my confidence in major companies is heavily influenced by my socioeconomic background. I have seen how these companies can exploit and disregard the rights of workers like myself, leading to a lack of trust in their practices. Additionally, my personal experiences and values have shaped my perception, as I have witnessed the struggles faced by my community due to the actions of these companies. Therefore, my answer is:\n3"]}, {"persona": {"region": "Kafr el-sheikh", "sex": "male", "age": 35, "country": "Egypt", "marital_status": "married", "education": "higher", "social_class": "lower middle class"}, "question": {"id": "Q77", "variant": 0}, "response": ["Based on my emic perspective as a lower middle class married male from Kafr el-sheikh, Egypt, I have experienced the impact of major companies on my community and personal life. The cultural context of my upbringing and education has shaped my views on these companies, as I have witnessed their influence on the local economy and job market. My individual values and personal experiences have also contributed to my perception of these companies, as I have seen the struggles of my family and friends in relation to their operations. My socioeconomic background has further influenced my perspective, as I have felt the effects of their business practices on my financial stability. Considering the concept of cultural relativism, I understand that my viewpoint may differ from others, but I believe that my experiences and observations have led me to a nuanced understanding of major companies.\n\n3"]}, {"persona": {"region": "Kafr el-sheikh", "sex": "male", "age": 49, "country": "Egypt", "marital_status": "married", "education": "middle", "social_class": "lower class"}, "question": {"id": "Q77", "variant": 0}, "response": ["Based on my emic perspective as a married male from Kafr el-sheikh, Egypt, I have grown up in an environment where major companies have not always had the best reputation. I have witnessed how these companies often prioritize profit over the well-being of the community, and I have personally experienced the impact of their actions on my own family and friends. Additionally, my lower class socioeconomic background has made me more aware of the disparities in power and resources between major companies and individuals like myself. Cultural relativism also plays a role here, as I understand that my perspective may be different from those in higher socioeconomic classes who may have more trust in major companies. Therefore, I would answer: \n\n3. Not very much"]}, {"persona": {"region": "Kafr el-sheikh", "sex": "male", "age": 37, "country": "Egypt", "marital_status": "married", "education": "middle", "social_class": "lower class"}, "question": {"id": "Q77", "variant": 0}, "response": ["Based on the anthropological framework, my response is influenced by my emic perspective as a lower-class married male from Kafr el-sheikh, Egypt. My cultural context and socioeconomic background significantly shape my perception of major companies. My individual values and personal experience have led me to have not very much confidence in major companies, as I have observed how they often prioritize profits over the well-being of individuals like me. Additionally, cultural relativism plays a role in my perspective, as I am aware of the power dynamics at play in the business world and how they impact individuals from lower socioeconomic backgrounds. Therefore, my answer is:\n\n3) Not very much"]}, {"persona": {"region": "Menofia", "sex": "female", "age": 22, "country": "Egypt", "marital_status": "single", "education": "middle", "social_class": "lower class"}, "question": {"id": "Q77", "variant": 0}, "response": ["Based on my cultural context and socioeconomic background, as a single female from Menofia, Egypt, who is part of the lower class, I have not had positive experiences with major companies. In my community, there is a general lack of trust in these companies due to their exploitation of labor and resources, and their tendency to prioritize profit over the well-being of people like me. Additionally, my individual values and personal experiences have led me to believe that major companies do not have my best interests at heart. Therefore, I have very little confidence in major companies. \n\n3"]}, {"persona": {"region": "Menofia", "sex": "female", "age": 25, "country": "Egypt", "marital_status": "married", "education": "middle", "social_class": "lower class"}, "question": {"id": "Q77", "variant": 0}, "response": ["Based on the anthropological framework, my emic perspective as a married female from Menofia, Egypt, who is 25 years old and part of the lower class, is influenced by my cultural context, individual values, and socioeconomic background. In Menofia, there is a general skepticism towards major companies due to past experiences and lack of trust in the government. Additionally, being part of the lower class, I have personally experienced the impact of major companies exploiting labor and resources without benefiting the local community. Therefore, my response to the question would be:\n3"]}, {"persona": {"region": "Menofia", "sex": "male", "age": 28, "country": "Egypt", "marital_status": "single", "education": "higher", "social_class": "working class"}, "question": {"id": "Q77", "variant": 0}, "response": ["Based on the anthropological framework, as a single male from Menofia, Egypt, who is 28 years old and part of the working class, my perspective on major companies is influenced by my cultural context, socioeconomic background, and individual values. In Egypt, there is a strong sense of community and reliance on local businesses, which may lead to a lower level of confidence in major companies. Additionally, as a member of the working class, I may have experienced or witnessed exploitation by larger companies, leading to a lack of trust. Therefore, my level of confidence in major companies is influenced by my cultural context and socioeconomic background, leading me to choose option (3) Not very much. \n\n3"]}, {"persona": {"region": "Menofia", "sex": "male", "age": 35, "country": "Egypt", "marital_status": "married", "education": "middle", "social_class": "lower middle class"}, "question": {"id": "Q77", "variant": 0}, "response": ["Based on the anthropological framework, my emic perspective as a married male from Menofia, Egypt, who is 35 years old and part of the lower middle class, is influenced by my cultural context, individual values, and socioeconomic background. In Menofia, major companies may not have a strong presence, and my personal experience and values may lead me to have less confidence in them. Additionally, my lower middle class status and limited education may contribute to a lack of trust in major companies due to potential economic disparities. Therefore, I would choose option 3) Not very much."]}, {"persona": {"region": "Menofia", "sex": "male", "age": 55, "country": "Egypt", "marital_status": "married", "education": "middle", "social_class": "working class"}, "question": {"id": "Q77", "variant": 0}, "response": ["Based on my emic perspective as a married male from Menofia, Egypt, and my personal experience as a working class individual, I have limited confidence in major companies. The cultural context and socioeconomic background of Menofia and my educational level have shaped my perception of these companies. I have seen how they often prioritize profits over the well-being of workers and the community. Additionally, cultural relativism has taught me to be critical of institutions that may not have my best interests at heart. My age and place also play a role in my lack of confidence in major companies, as I have witnessed the impact of their actions on my community over time. Therefore, I choose option (3) Not very much.\n\n3"]}, {"persona": {"region": "Menofia", "sex": "male", "age": 53, "country": "Egypt", "marital_status": "married", "education": "higher", "social_class": "lower middle class"}, "question": {"id": "Q77", "variant": 0}, "response": ["Based on my emic perspective, as a married male from Menofia, Egypt, I have experienced the impact of major companies on my community and family. The cultural context in which I live, including my socioeconomic background, has shaped my personal experience and values, leading me to have a certain level of confidence in major companies. I have completed higher education and consider myself part of the lower middle class, which has also influenced my perspective on major companies. Additionally, cultural relativism reminds me that my viewpoint may differ from others, but is still valid. Considering all of these factors, I would choose option (3) Not very much, as my background and experiences have led me to be cautious and skeptical of the intentions and practices of major companies. \n\n3"]}, {"persona": {"region": "Menofia", "sex": "male", "age": 59, "country": "Egypt", "marital_status": "married", "education": "middle", "social_class": "working class"}, "question": {"id": "Q77", "variant": 0}, "response": ["Based on the anthropological framework, as a married male from Menofia, Egypt, who is 59 years old and part of the working class, my emic perspective on the confidence in major companies is influenced by my cultural context, individual values, and socioeconomic background. In my cultural context, there is a general mistrust of major companies due to historical and economic factors. Additionally, my individual values prioritize community and local businesses over large corporations. My socioeconomic background as part of the working class also means that I have likely experienced or witnessed exploitation by major companies. Therefore, my answer to the question would be:\n\n3"]}, {"persona": {"region": "Menofia", "sex": "female", "age": 42, "country": "Egypt", "marital_status": "married", "education": "middle", "social_class": "lower middle class"}, "question": {"id": "Q77", "variant": 0}, "response": ["From an emic perspective, as a married female from Menofia, Egypt, my cultural context and socioeconomic background play a significant role in shaping my perception of major companies. In my community, there is a general lack of trust in major companies due to past experiences of exploitation and unfair treatment. My individual values and personal experience also contribute to my lack of confidence in these companies, as I have witnessed the negative impact of their actions on my family and others in my community. Additionally, my lower middle-class status has made me more aware of the socioeconomic disparities perpetuated by these companies, further diminishing my confidence in them. Therefore, I choose the option (3) Not very much as it accurately reflects my perspective based on my cultural context, personal experience, and socioeconomic background."]}, {"persona": {"region": "Menofia", "sex": "male", "age": 39, "country": "Egypt", "marital_status": "married", "education": "higher", "social_class": "working class"}, "question": {"id": "Q77", "variant": 0}, "response": ["Based on my emic perspective as a married male from Menofia, Egypt, I have a strong sense of loyalty and trust towards the major companies that provide employment opportunities for individuals like myself. In my cultural context, these companies play a significant role in shaping the socioeconomic landscape of our community and are often regarded with respect and admiration. Additionally, my personal experience and values as a member of the working class have instilled a sense of reliance on these companies for stability and financial security. Therefore, I have quite a lot of confidence in major companies.\n\n2"]}, {"persona": {"region": "Menofia", "sex": "male", "age": 34, "country": "Egypt", "marital_status": "married", "education": "middle", "social_class": "lower middle class"}, "question": {"id": "Q77", "variant": 0}, "response": ["Based on the anthropological framework, as a married male from Menofia, Egypt and part of the lower middle class, my perspective on the confidence in major companies is influenced by my cultural context, socioeconomic background, and personal experience. In Menofia, there is a strong sense of community and trust in local businesses, but major companies may be viewed with skepticism due to their perceived distance from the everyday lives of people in my community. Additionally, my lower middle class status means that I may have experienced economic hardships that have impacted my trust in large corporations. Therefore, I would choose option (3) Not very much."]}, {"persona": {"region": "Menofia", "sex": "male", "age": 22, "country": "Egypt", "marital_status": "single", "education": "higher", "social_class": "working class"}, "question": {"id": "Q77", "variant": 0}, "response": ["Based on the anthropological framework, my perspective as a single male from Menofia, Egypt, who is 22 years old and part of the working class is heavily influenced by my cultural context, individual values, and socioeconomic background. In my cultural context, major companies may not have a positive reputation due to issues related to labor rights, environmental impact, and economic inequality. Additionally, my individual values and personal experience may lead me to have less confidence in major companies, as I may have witnessed or experienced exploitation or unfair treatment in the workplace. As part of the working class, my socioeconomic background may also contribute to my lack of confidence in major companies, as I may feel the negative effects of corporate power and influence on a daily basis. Therefore, based on this perspective, my answer to the question \"How much confidence do you have in major companies?\" would be:\n\n3"]}, {"persona": {"region": "Menofia", "sex": "male", "age": 21, "country": "Egypt", "marital_status": "single", "education": "middle", "social_class": "working class"}, "question": {"id": "Q77", "variant": 0}, "response": ["Based on my emic perspective as a working-class male from Menofia, Egypt, my confidence in major companies is influenced by my cultural context, individual values, and socioeconomic background. In my community, there is a general distrust of major companies due to their perceived exploitation of workers and their focus on profit over the well-being of employees. Additionally, my personal experience and values lead me to be skeptical of these companies, as I have seen the impact of their actions on my family and friends. As a member of the working class, I have a keen awareness of the socioeconomic disparities perpetuated by these companies, further reinforcing my lack of confidence in them. Therefore, my choice is:\n\n3) Not very much"]}, {"persona": {"region": "Menofia", "sex": "male", "age": 36, "country": "Egypt", "marital_status": "married", "education": "higher", "social_class": "working class"}, "question": {"id": "Q77", "variant": 0}, "response": ["Based on the anthropological framework, as a married male from Menofia, Egypt, my cultural context and socioeconomic background play a significant role in shaping my perspective. As a member of the working class, I have experienced the impact of major companies on my community and family. Additionally, my higher education level has provided me with a nuanced understanding of the complexities of these companies. Considering cultural relativism, I recognize that my perspective may differ from others based on their backgrounds, and I am aware of the emic and etic perspectives that may influence their views. Therefore, I have chosen the option that best represents my confidence in major companies based on my personal experience and values.\n\n2"]}, {"persona": {"region": "Menofia", "sex": "female", "age": 52, "country": "Egypt", "marital_status": "married", "education": "higher", "social_class": "lower middle class"}, "question": {"id": "Q77", "variant": 0}, "response": ["Based on my understanding of the anthropological framework, I believe that my cultural context, individual values, and socioeconomic background heavily influence my perception of major companies. As a married female from Menofia, Egypt, of 52 years of age and lower middle class, I have experienced and witnessed the impact of major companies on my community. I have seen how they have contributed to economic growth but have also witnessed their negative effects on local businesses and the environment. Additionally, my lower middle-class status has made me more aware of the power dynamics at play and how major companies often prioritize profits over the well-being of people like me. Therefore, I have chosen option 3: Not very much."]}, {"persona": {"region": "Menofia", "sex": "male", "age": 52, "country": "Egypt", "marital_status": "married", "education": "higher", "social_class": "lower middle class"}, "question": {"id": "Q77", "variant": 0}, "response": ["Based on my cultural context and socioeconomic background, I have a relatively low level of confidence in major companies. As a lower middle class male from Menofia, Egypt, I have experienced firsthand the challenges that come with socioeconomic status and have seen how major companies can often exploit or neglect individuals from similar backgrounds. Additionally, my individual values and personal experience have shaped my perspective, leading me to believe that major companies may not always have the best interests of people like me in mind. Furthermore, my age and place also play a role in my lack of confidence in major companies, as I have witnessed how they have operated in my community over time. \n\n3"]}, {"persona": {"region": "Menofia", "sex": "male", "age": 39, "country": "Egypt", "marital_status": "married", "education": "middle", "social_class": "lower class"}, "question": {"id": "Q77", "variant": 0}, "response": ["Based on the anthropological framework, my emic perspective as a lower-class married male from Menofia, Egypt at 39 years of age with a middle education level would be influenced by my cultural context, individual values and personal experience, and socioeconomic background. In my cultural context, major companies may not have a positive reputation due to potential exploitation of workers and resources, which would affect my confidence in them. Additionally, my lower socioeconomic background may lead me to have a lack of trust in major companies due to potential negative experiences with them. Therefore, my answer would be:\n3"]}, {"persona": {"region": "Menofia", "sex": "male", "age": 23, "country": "Egypt", "marital_status": "single", "education": "middle", "social_class": "lower middle class"}, "question": {"id": "Q77", "variant": 0}, "response": ["Based on the anthropological framework, my emic perspective as a single male from Menofia, Egypt, is influenced by my cultural context, individual values, and socioeconomic background. In my cultural context, major companies may not have a strong presence or positive reputation, and my lower middle class socioeconomic background may lead to a lack of confidence in these companies. Additionally, my personal experience and individual values may also contribute to my lack of confidence in major companies. Therefore, my answer to the question \"How much confidence do you have in major companies?\" is (3) Not very much."]}, {"persona": {"region": "Dakahlia", "sex": "female", "age": 24, "country": "Egypt", "marital_status": "single", "education": "higher", "social_class": "lower middle class"}, "question": {"id": "Q77", "variant": 0}, "response": ["From the perspective of a single female from Dakahlia, Egypt, who is 24 years old, has completed higher education, and considers herself part of the lower middle class, the answer to the question about confidence in major companies will be influenced by several factors. The cultural context of living in Egypt, where there may be a distrust of big corporations, especially among those from lower socioeconomic backgrounds, will play a role. Additionally, individual values and personal experiences may lead to a lack of confidence in major companies, as they may be seen as inaccessible or untrustworthy. Furthermore, the nuance of the question may also be considered, as the phrasing of \"major companies\" may elicit a different response compared to a question about local or small businesses. \n\n3"]}, {"persona": {"region": "Dakahlia", "sex": "male", "age": 36, "country": "Egypt", "marital_status": "married", "education": "higher", "social_class": "upper middle class"}, "question": {"id": "Q77", "variant": 0}, "response": ["Based on the anthropological framework, as a married male from Dakahlia, Egypt, with a higher education level and a self-identified upper middle class background, my perspective on the confidence in major companies is influenced by my personal values, cultural context, and socioeconomic background. In my cultural context, there is a strong emphasis on the importance of stable and reputable companies, and as someone from the upper middle class, I have likely interacted with and benefited from such companies. Additionally, my higher education level may have provided me with a more nuanced understanding of the role and impact of major companies in society. Therefore, I have a great deal of confidence in major companies.\n\n1"]}, {"persona": {"region": "Dakahlia", "sex": "female", "age": 71, "country": "Egypt", "marital_status": "married", "education": "higher", "social_class": "upper middle class"}, "question": {"id": "Q77", "variant": 0}, "response": ["Based on the anthropological framework, as a married female from Dakahlia, Egypt, I am influenced by my cultural context, individual values, and socioeconomic background. In my culture, there is a strong emphasis on trust and confidence in major companies, especially for someone who considers themselves part of the upper middle class. My higher education level also contributes to my understanding of the importance of major companies in driving the economy and providing opportunities for individuals. Therefore, I have a great deal of confidence in major companies as they play a significant role in the socioeconomic development of my community and country. \n\n1"]}, {"persona": {"region": "Dakahlia", "sex": "male", "age": 55, "country": "Egypt", "marital_status": "married", "education": "higher", "social_class": "upper middle class"}, "question": {"id": "Q77", "variant": 0}, "response": ["Based on the anthropological framework, my perspective as a married male from Dakahlia, Egypt, who is 55 years old, completed higher education, and considers myself part of the upper middle class, is influenced by my cultural context, individual values, and socioeconomic background. In Dakahlia, there is a strong emphasis on education and financial success, which has likely influenced my perception of major companies. As part of the upper middle class, I may have had positive experiences with major companies and have likely benefitted from their services, leading to a great deal of confidence in them. Additionally, my higher education level may have provided me with a more nuanced understanding of the role and impact of major companies, further influencing my high level of confidence in them.\n\n2"]}, {"persona": {"region": "Dakahlia", "sex": "male", "age": 64, "country": "Egypt", "marital_status": "married", "education": "higher", "social_class": "lower middle class"}, "question": {"id": "Q77", "variant": 0}, "response": ["Based on the anthropological framework, as a married male from Dakahlia, Egypt, age 64, with a lower middle-class socioeconomic background and higher education, my perspective on major companies would be influenced by a combination of individual values, personal experience, and cultural context. In Egypt, there is a general skepticism towards major companies due to political and economic instability. As a member of the lower middle class, I may have personally experienced or witnessed the negative impact of these companies on the local economy and society. Additionally, my higher education level may have exposed me to critical perspectives on corporate power and ethics. Therefore, I would have a low level of confidence in major companies, feeling that they do not have the best interests of individuals like me in mind. \n\n3"]}, {"persona": {"region": "Dakahlia", "sex": "female", "age": 29, "country": "Egypt", "marital_status": "married", "education": "middle", "social_class": "lower class"}, "question": {"id": "Q77", "variant": 0}, "response": ["Based on my cultural context and socioeconomic background, as a married female from Dakahlia, Egypt, with a middle education level and lower class status, my perception of major companies is influenced by my personal experience and individual values. I have seen firsthand the struggles of my community and how major companies often exploit and take advantage of people like me. Therefore, I have very little confidence in these companies and believe they do not have the best interests of people like me at heart.\n\n3"]}, {"persona": {"region": "Dakahlia", "sex": "female", "age": 40, "country": "Egypt", "marital_status": "married", "education": "middle", "social_class": "upper middle class"}, "question": {"id": "Q77", "variant": 0}, "response": ["Based on my emic perspective as a married female from Dakahlia, Egypt, and my socioeconomic background as a member of the upper middle class, I have a great deal of confidence in major companies. In my cultural context, major companies have provided stability and opportunities for economic growth for my family and community. Additionally, my individual values and personal experience have led me to have positive interactions and experiences with major companies, thus increasing my confidence in them. Furthermore, cultural relativism and nuance play a role in my perception of major companies, as I recognize that my perspective may be different from others based on their own cultural and socioeconomic backgrounds. Therefore, my confidence in major companies is influenced by a combination of my cultural context, individual values, and personal experiences within the specific socioeconomic context of Dakahlia, Egypt.\n\n2"]}, {"persona": {"region": "Dakahlia", "sex": "male", "age": 37, "country": "Egypt", "marital_status": "married", "education": "higher", "social_class": "lower middle class"}, "question": {"id": "Q77", "variant": 0}, "response": ["Based on the anthropological framework, my answer is informed by my emic perspective as a married male from Dakahlia, Egypt, and my lower middle class socioeconomic background. In my cultural context, major companies have not always prioritized the needs of individuals like myself, and I have personally experienced the impact of this. As a result, my individual values and personal experience lead me to choose option (3) Not very much."]}, {"persona": {"region": "Dakahlia", "sex": "female", "age": 45, "country": "Egypt", "marital_status": "married", "education": "middle", "social_class": "working class"}, "question": {"id": "Q77", "variant": 0}, "response": ["Based on the anthropological framework, as a married female from Dakahlia, Egypt, my emic perspective on major companies is likely influenced by my cultural context, individual values, and socioeconomic background. In Egypt, major companies are often seen as providing stable employment opportunities and contributing to the economy, which may lead me to have a great deal of confidence in them. Additionally, my working-class background and middle education level may mean that I have personal experience with or know people who have benefitted from these companies, further influencing my confidence in them. Therefore, I would choose:\n2. Quite a lot"]}, {"persona": {"region": "Dakahlia", "sex": "male", "age": 34, "country": "Egypt", "marital_status": "single", "education": "middle", "social_class": "lower middle class"}, "question": {"id": "Q77", "variant": 0}, "response": ["From the perspective of a single male from Dakahlia, Egypt, who is 34 years old and part of the lower middle class, it is important to consider the cultural context and socioeconomic background in answering the question about confidence in major companies. In this region, there is a long history of political and economic instability, which has likely impacted the trust in major companies. Additionally, being part of the lower middle class may mean that there is a level of skepticism towards large corporations and their practices, especially when considering the impact on individuals and families. Therefore, the answer chosen reflects the nuanced understanding of the cultural and socioeconomic factors at play.\n\n3"]}, {"persona": {"region": "Dakahlia", "sex": "female", "age": 26, "country": "Egypt", "marital_status": "married", "education": "higher", "social_class": "upper middle class"}, "question": {"id": "Q77", "variant": 0}, "response": ["Based on the anthropological framework, as a married female from Dakahlia, Egypt, who is 26 years old and part of the upper middle class, my perspective is influenced by my cultural context, individual values, and socioeconomic background. In Dakahlia, major companies may not have a good reputation due to economic instability and lack of trust in institutions. Additionally, my education and socioeconomic status may lead me to have a critical view of major companies, as I may be aware of unethical practices and the impact of globalization on local economies. Therefore, I would choose option (3) Not very much to reflect my lack of confidence in major companies. \n\n3"]}, {"persona": {"region": "Dakahlia", "sex": "male", "age": 21, "country": "Egypt", "marital_status": "single", "education": "middle", "social_class": "upper middle class"}, "question": {"id": "Q77", "variant": 0}, "response": ["In considering the question of confidence in major companies from the perspective of a single male from Dakahlia, Egypt, who is 21 years old and part of the upper middle class, it is important to take into account the cultural context and socioeconomic background. In this region, there is a strong emphasis on the value of education and upward mobility, and individuals from the upper middle class are likely to have had exposure to and interactions with major companies. Additionally, personal experience and individual values will play a role in shaping perceptions of these companies. Given these factors, it is likely that the persona described would have quite a lot of confidence in major companies. \n\n2"]}, {"persona": {"region": "Dakahlia", "sex": "female", "age": 32, "country": "Egypt", "marital_status": "married", "education": "middle", "social_class": "working class"}, "question": {"id": "Q77", "variant": 0}, "response": ["Based on the anthropological framework, my perspective as a married female from Dakahlia, Egypt, who is 32 years old, completed middle education, and considers herself part of the working class, is heavily influenced by my cultural context, socioeconomic background, and individual values. In my cultural context, major companies may not have a strong presence or positive reputation, and my socioeconomic background as part of the working class may lead to a lack of trust in major companies due to potential exploitation or lack of representation. Additionally, my individual values of hard work and self-reliance may lead me to have a lack of confidence in major companies. Therefore, I would choose option 3) Not very much, as my perspective may lead me to be hesitant about placing a great deal of confidence in major companies. \n\n3"]}, {"persona": {"region": "Dakahlia", "sex": "female", "age": 35, "country": "Egypt", "marital_status": "married", "education": "middle", "social_class": "upper middle class"}, "question": {"id": "Q77", "variant": 0}, "response": ["Based on the anthropological framework, as a married female from Dakahlia, Egypt, my emic perspective is influenced by my cultural context, individual values, and socioeconomic background. In my cultural context, there is a general trust in major companies, as they are seen as reputable and stable sources of employment and goods. Additionally, my personal experience and values as part of the upper middle class contribute to my confidence in major companies, as they have likely provided stability and opportunities for me and my family. Therefore, I have quite a lot of confidence in major companies.\n\n2"]}, {"persona": {"region": "Dakahlia", "sex": "male", "age": 33, "country": "Egypt", "marital_status": "married", "education": "middle", "social_class": "upper middle class"}, "question": {"id": "Q77", "variant": 0}, "response": ["Based on the anthropological framework described above, my perspective as a married male from Dakahlia, Egypt, who is 33 years old and part of the upper middle class is heavily influenced by my cultural context, individual values, and socioeconomic background. In Dakahlia, there is a strong sense of community and trust in local businesses, but major companies may be viewed with skepticism due to their distance from the local community and potential differences in values. Additionally, my socioeconomic background as part of the upper middle class may lead me to have more confidence in major companies due to potential financial investments or interactions with these companies. Therefore, I would choose the option: (2) Quite a lot. \n\n2"]}, {"persona": {"region": "Dakahlia", "sex": "female", "age": 45, "country": "Egypt", "marital_status": "married", "education": "middle", "social_class": "upper middle class"}, "question": {"id": "Q77", "variant": 0}, "response": ["Based on my emic perspective as a married female from Dakahlia, Egypt, and considering my upper middle-class socioeconomic background, I have a high level of confidence in major companies. This confidence is influenced by my cultural context, individual values, and personal experiences. In my culture, there is a strong emphasis on trust and respect for authority, which extends to major companies. Additionally, my personal experience of being part of the upper middle class has likely exposed me to positive interactions with these companies, further reinforcing my confidence in them. Therefore, I believe that my response accurately reflects the viewpoint of the persona described above.\n\n2"]}, {"persona": {"region": "Dakahlia", "sex": "male", "age": 30, "country": "Egypt", "marital_status": "married", "education": "middle", "social_class": "upper middle class"}, "question": {"id": "Q77", "variant": 0}, "response": ["From the perspective of a married male from Dakahlia, Egypt, cultural context is important in understanding his views on major companies. In this region, there is a strong emphasis on family and community ties, which can influence his trust in major companies. Additionally, his socioeconomic background as part of the upper middle class may lead him to have more confidence in major companies due to potential business connections or financial investments. His age and level of education also play a role, as it may shape his understanding of the role of major companies in society. Given these factors, he may have quite a lot of confidence in major companies.\n\n2"]}, {"persona": {"region": "Dakahlia", "sex": "female", "age": 63, "country": "Egypt", "marital_status": "married", "education": "higher", "social_class": "lower middle class"}, "question": {"id": "Q77", "variant": 0}, "response": ["Based on the anthropological framework, as a married female from Dakahlia, Egypt, my emic perspective is influenced by my cultural context, individual values, and socioeconomic background. In my community, there is a general mistrust of major companies due to historical exploitation and economic disparities. As a lower middle-class individual with higher education, I am aware of the power dynamics at play and have personally experienced the negative impact of corporate practices on my family and community. Therefore, I have little confidence in major companies because of the systemic inequalities they perpetuate.\n\n3"]}, {"persona": {"region": "Dakahlia", "sex": "male", "age": 28, "country": "Egypt", "marital_status": "single", "education": "higher", "social_class": "upper middle class"}, "question": {"id": "Q77", "variant": 0}, "response": ["Based on the anthropological framework, my emic perspective as a single male from Dakahlia, Egypt, who is 28 years old and part of the upper middle class, would be influenced by my cultural context, individual values and personal experience, and socioeconomic background. In my cultural context, major companies may have a significant impact on the economy and society, and my personal experience and individual values would likely lead me to have a great deal of confidence in major companies due to the stability and success they bring to my socioeconomic background. Additionally, my higher education level and exposure to global business practices may also contribute to my confidence in major companies. Therefore, my choice is:\n\n1"]}, {"persona": {"region": "Dakahlia", "sex": "female", "age": 24, "country": "Egypt", "marital_status": "married", "education": "higher", "social_class": "upper middle class"}, "question": {"id": "Q77", "variant": 0}, "response": ["Based on the anthropological framework, as a married female from Dakahlia, Egypt, with a higher education level and part of the upper middle class, my answer to the question on confidence in major companies would be influenced by my individual values, personal experience, and socioeconomic background. I have been exposed to a certain level of privilege and have likely had positive experiences with major companies, which would lead me to have a great deal of confidence in them. Additionally, my cultural context and socioeconomic background may play a role in shaping my perceptions of these companies. Therefore, my answer would be:\n\n2"]}, {"persona": {"region": "Dakahlia", "sex": "male", "age": 20, "country": "Egypt", "marital_status": "single", "education": "middle", "social_class": "upper middle class"}, "question": {"id": "Q77", "variant": 0}, "response": ["Based on the anthropological framework, as a single male from Dakahlia, Egypt, my emic perspective would be influenced by my cultural context, individual values, and socioeconomic background. In this region of Egypt, there is a strong emphasis on community and family values, and major companies may not always be viewed favorably due to the potential impact on local businesses and traditional ways of life. Additionally, my upper middle class background may lead me to have a certain level of skepticism towards major companies, as I may be more aware of the potential social and economic disparities they can create. Therefore, I would have \"Not very much\" confidence in major companies.\n\n3"]}, {"persona": {"region": "Dakahlia", "sex": "male", "age": 45, "country": "Egypt", "marital_status": "married", "education": "middle", "social_class": "upper middle class"}, "question": {"id": "Q77", "variant": 0}, "response": ["Based on the anthropological framework, as a married male from Dakahlia, Egypt, my emic perspective is influenced by my cultural context, individual values, socioeconomic background, and space and time. In my cultural context, there is a high value placed on stability and trustworthiness, especially in major companies. My individual values and personal experience have shaped my perception to have a great deal of confidence in major companies, as I have seen the success and reliability of these companies in providing for my family and contributing to my socioeconomic status. Additionally, as a member of the upper middle class, I have had more exposure to and positive experiences with major companies, further solidifying my confidence in them. Therefore, from this perspective, I choose option (1) A great deal. \n\n1"]}, {"persona": {"region": "Dakahlia", "sex": "female", "age": 43, "country": "Egypt", "marital_status": "married", "education": "higher", "social_class": "upper middle class"}, "question": {"id": "Q77", "variant": 0}, "response": ["From an emic perspective, as a married female from Dakahlia, Egypt, I have grown up in a cultural context where there is a high value placed on trust and reputation. Additionally, my personal experience and individual values as someone who has completed a higher education level and considers myself part of the upper middle class have shaped my perception of major companies. Socioeconomic background also plays a role in my understanding, as I have had the opportunity to interact with and benefit from the services of major companies. Furthermore, cultural relativism teaches us to consider the nuanced phrasing of the question, and based on these factors, I would choose option (2) Quite a lot. \n\n2"]}, {"persona": {"region": "Dakahlia", "sex": "female", "age": 20, "country": "Egypt", "marital_status": "single", "education": "middle", "social_class": "upper middle class"}, "question": {"id": "Q77", "variant": 0}, "response": ["Based on my emic perspective as a single female from Dakahlia, Egypt, my cultural context, individual values, and personal experience as part of the upper middle class have shaped my perception and confidence in major companies. In my cultural context, there is a strong emphasis on the importance of education and economic stability. My socioeconomic background has provided me with exposure to reputable companies and their impact on the community. Additionally, my personal experience with these companies has been positive, leading me to have a great deal of confidence in them.\n\n1"]}, {"persona": {"region": "Dakahlia", "sex": "female", "age": 40, "country": "Egypt", "marital_status": "single", "education": "middle", "social_class": "lower middle class"}, "question": {"id": "Q77", "variant": 0}, "response": ["Based on the anthropological framework, my emic perspective as a single female from Dakahlia, Egypt, who is 40 years old and part of the lower middle class, is influenced by my personal experience, cultural context, and socioeconomic background. In my cultural context, major companies may not have a strong presence or positive reputation, and my socioeconomic background may also lead me to have less confidence in these companies. Additionally, my individual values and personal experience may have shaped my perception of major companies. Therefore, I would choose:\n\n3"]}, {"persona": {"region": "Dakahlia", "sex": "female", "age": 33, "country": "Egypt", "marital_status": "married", "education": "higher", "social_class": "upper middle class"}, "question": {"id": "Q77", "variant": 0}, "response": ["Based on the anthropological framework, as a married female from Dakahlia, Egypt, who has completed higher education and considers myself part of the upper middle class, my perspective on the confidence in major companies is influenced by my cultural context, individual values, and socioeconomic background. In Dakahlia, there is a strong emphasis on education and social status, which has likely shaped my belief in the reliability and trustworthiness of major companies. Additionally, being part of the upper middle class, I have likely had positive experiences with these companies, leading me to have a great deal of confidence in them.\n\n1"]}, {"persona": {"region": "Dakahlia", "sex": "female", "age": 24, "country": "Egypt", "marital_status": "married", "education": "middle", "social_class": "working class"}, "question": {"id": "Q77", "variant": 0}, "response": ["Based on the anthropological framework, as a married female from Dakahlia, Egypt, my emic perspective is influenced by my cultural context, individual values, and socioeconomic background. In my community, there is a general distrust of major companies due to a history of exploitation and corruption. As a working-class individual, I have personally witnessed the negative impact of these companies on my community, leading to a lack of confidence in their practices. This perspective is further reinforced by my limited access to education and resources, which have shaped my view of major companies. Therefore, my answer is 3) Not very much."]}, {"persona": {"region": "Dakahlia", "sex": "female", "age": 53, "country": "Egypt", "marital_status": "widowed", "education": "middle", "social_class": "working class"}, "question": {"id": "Q77", "variant": 0}, "response": ["Based on the anthropological framework, as a widowed female from Dakahlia, Egypt, my emic perspective is influenced by my cultural context, individual values, and socioeconomic background. As a member of the working class with a middle education level, I have limited access to information and resources compared to those in higher socioeconomic classes. Additionally, my personal experience and values likely lead me to have less confidence in major companies, as I may have experienced exploitation or lack of support from these entities. Therefore, I would choose option (3) Not very much, as major companies may not have a positive impact on my life and community. \n\n3"]}, {"persona": {"region": "Dakahlia", "sex": "female", "age": 30, "country": "Egypt", "marital_status": "single", "education": "middle", "social_class": "lower middle class"}, "question": {"id": "Q77", "variant": 0}, "response": ["From my perspective as a single female from Dakahlia, Egypt, with a lower middle-class socioeconomic background and a middle education level, my confidence in major companies is influenced by my cultural context, individual values, and personal experience. I have seen how major companies often prioritize profit over the well-being of workers and consumers, which has led to a lack of trust in their practices. Additionally, my socioeconomic background has made me more aware of the impact of these companies on the local economy and the lives of people in my community. Therefore, I would choose option (3) Not very much, as my personal experience and cultural context have shaped my lack of confidence in major companies. \n\n3"]}, {"persona": {"region": "Dakahlia", "sex": "male", "age": 53, "country": "Egypt", "marital_status": "married", "education": "higher", "social_class": "upper middle class"}, "question": {"id": "Q77", "variant": 0}, "response": ["Based on the anthropological framework, my emic perspective as a married male from Dakahlia, Egypt, would be influenced by my cultural context, individual values, and socioeconomic background. In my cultural context, there is a strong sense of trust and reliance on major companies, as they are seen as pillars of stability and success in the community. Additionally, my higher education level and upper middle class status would also contribute to my confidence in major companies, as I would likely have personal connections and business dealings with these companies. Therefore, I would have a great deal of confidence in major companies.\n\n1"]}, {"persona": {"region": "Dakahlia", "sex": "male", "age": 28, "country": "Egypt", "marital_status": "married", "education": "middle", "social_class": "working class"}, "question": {"id": "Q77", "variant": 0}, "response": ["Based on the anthropological framework, my emic perspective as a married male from Dakahlia, Egypt, with a middle education level and part of the working class, is influenced by my cultural context, individual values, and socioeconomic background. In my community, people tend to have a skeptical view of major companies due to experiences with economic inequality and lack of trust in corporate entities. My personal experience and the values I hold as a working-class individual have led me to have not very much confidence in major companies. Additionally, my socioeconomic background and the cultural relativism within my community further solidify this perspective. \n\n3"]}, {"persona": {"region": "Dakahlia", "sex": "female", "age": 38, "country": "Egypt", "marital_status": "married", "education": "middle", "social_class": "upper middle class"}, "question": {"id": "Q77", "variant": 0}, "response": ["Based on the anthropological framework, my emic perspective as a married female from Dakahlia, Egypt, is influenced by my cultural context, individual values, and socioeconomic background. In my cultural context, there is a strong sense of trust in established institutions, including major companies. My individual values and personal experience as a member of the upper middle class have also shaped my perception, leading me to have a great deal of confidence in major companies. Additionally, my socioeconomic background has provided me with a level of stability and comfort that increases my confidence in these institutions. Therefore, my answer is:\n\n1"]}, {"persona": {"region": "Gharbia", "sex": "male", "age": 27, "country": "Egypt", "marital_status": "single", "education": "higher", "social_class": "upper middle class"}, "question": {"id": "Q77", "variant": 0}, "response": ["Based on the anthropological framework, I would like to provide my answer to the question from the perspective of a single male from Gharbia, Egypt, who is 27 years old, completed higher education, and considers himself part of the upper middle class. My emic perspective, shaped by my cultural context and individual values, leads me to have quite a lot of confidence in major companies. Growing up in a region where businesses and entrepreneurship are highly valued, and having received a higher education, I have been exposed to the impact and potential of major companies in driving economic growth and providing employment opportunities. Additionally, coming from an upper middle-class background, I have likely benefited from the services and products offered by these major companies, further reinforcing my confidence in them. Therefore, my answer to the question would be:\n2\n\n(2) Quite a lot"]}, {"persona": {"region": "Gharbia", "sex": "female", "age": 35, "country": "Egypt", "marital_status": "married", "education": "higher", "social_class": "upper middle class"}, "question": {"id": "Q77", "variant": 0}, "response": ["Based on the anthropological framework, my perspective as a married female from Gharbia, Egypt, who is 35 years old, has completed higher education, and considers herself part of the upper middle class, is heavily influenced by my cultural context, individual values, and socioeconomic background. In Gharbia, there is a strong emphasis on education and social status, and as someone with higher education and belonging to the upper middle class, I value integrity and professionalism in major companies. Additionally, my cultural context emphasizes the importance of trust and reputation, leading me to have a great deal of confidence in major companies that have earned a positive reputation and have demonstrated integrity in their practices.\n\n1"]}, {"persona": {"region": "Gharbia", "sex": "female", "age": 37, "country": "Egypt", "marital_status": "married", "education": "higher", "social_class": "upper middle class"}, "question": {"id": "Q77", "variant": 0}, "response": ["Based on the anthropological framework, my emic perspective as a married female from Gharbia, Egypt, who is 37 years old, has completed higher education, and considers herself part of the upper middle class, would be influenced by my cultural context, individual values, and socioeconomic background. In Egypt, there is a strong emphasis on education and social status, and as someone from the upper middle class, I would likely have a higher level of confidence in major companies due to the stability and success associated with my socioeconomic background. Additionally, my higher education level would likely lead me to have a greater understanding and trust in the operations of major companies. Therefore, I would choose:\n\n2. Quite a lot"]}, {"persona": {"region": "Gharbia", "sex": "male", "age": 43, "country": "Egypt", "marital_status": "married", "education": "middle", "social_class": "lower middle class"}, "question": {"id": "Q77", "variant": 0}, "response": ["Based on the anthropological framework, my perspective as a married male from Gharbia, Egypt, is heavily influenced by my cultural context, individual values, and socioeconomic background. In Gharbia, there is a strong sense of community and reliance on local businesses, so major companies may not hold as much sway. Additionally, as part of the lower middle class, I may have experienced economic hardships and may not have had positive interactions with major companies. Therefore, I would have less confidence in major companies and would likely choose option (3) Not very much."]}, {"persona": {"region": "Gharbia", "sex": "male", "age": 28, "country": "Egypt", "marital_status": "single", "education": "higher", "social_class": "lower middle class"}, "question": {"id": "Q77", "variant": 0}, "response": ["Based on the anthropological framework, as a single male from Gharbia, Egypt, my perspective on major companies would be influenced by my cultural context, individual values, and socioeconomic background. In Gharbia, the lower middle class often faces economic hardships and may have less trust in major companies due to potential exploitation and lack of opportunities. Additionally, my personal experience and values would also shape my perception, as I may have witnessed or experienced unfair treatment by major companies. Therefore, I would choose option (3) Not very much, as my background and experiences lead me to have limited confidence in major companies. \n\n3"]}, {"persona": {"region": "Gharbia", "sex": "male", "age": 39, "country": "Egypt", "marital_status": "married", "education": "middle", "social_class": "lower middle class"}, "question": {"id": "Q77", "variant": 0}, "response": ["Based on my personal experience and socioeconomic background, I have to consider the level of trust I have in major companies. As a married male from Gharbia, Egypt, and a member of the lower middle class, I have grown up in a culture and environment where major companies have not always been reliable or trustworthy. This is also influenced by the cultural context and emic perspective of my community, where there is a general skepticism towards corporations. Additionally, my individual values and personal experience play a significant role in shaping my perception of major companies. Considering all these factors, I would have to say that I have \"Not very much\" confidence in major companies.\n\n3"]}, {"persona": {"region": "Gharbia", "sex": "male", "age": 30, "country": "Egypt", "marital_status": "married", "education": "middle", "social_class": "lower middle class"}, "question": {"id": "Q77", "variant": 0}, "response": ["Based on the emic and etic perspectives, my cultural context as a married male from Gharbia, Egypt, plays a significant role in shaping my confidence in major companies. My individual values and personal experience, as well as my socioeconomic background, also influence my perception. Additionally, cultural relativism and the nuances of the question are crucial in understanding my answer. Therefore, I choose option 3: Not very much."]}, {"persona": {"region": "Gharbia", "sex": "male", "age": 43, "country": "Egypt", "marital_status": "married", "education": "lower", "social_class": "lower middle class"}, "question": {"id": "Q77", "variant": 0}, "response": ["Based on the anthropological framework, as a married male from Gharbia, Egypt, with a lower education level and lower middle class socioeconomic background, my response to the question about confidence in major companies would be influenced by my cultural context, individual values, and personal experience. In Gharbia, there may be a general skepticism towards major companies due to past experiences with economic inequality and limited access to resources. Additionally, my lower education level may have limited my exposure to positive interactions with major companies, leading to a lack of confidence in their practices. Therefore, my response would align with option 3: Not very much. \n\n3"]}, {"persona": {"region": "Gharbia", "sex": "male", "age": 36, "country": "Egypt", "marital_status": "married", "education": "higher", "social_class": "lower middle class"}, "question": {"id": "Q77", "variant": 0}, "response": ["Based on the anthropological framework, my response to the question of how much confidence I have in major companies would be influenced by my individual values and personal experience, as well as my socioeconomic background. As someone from the lower middle class in Gharbia, Egypt, I have experienced the impact of economic inequality and have seen how major companies can exploit their power for their own gain, often at the expense of people like me. Additionally, cultural context plays a role in shaping my perspective, as the societal and economic challenges in my region may have led to a general distrust of major companies. Therefore, my answer to the question is:\n3"]}, {"persona": {"region": "Gharbia", "sex": "male", "age": 25, "country": "Egypt", "marital_status": "married", "education": "middle", "social_class": "upper middle class"}, "question": {"id": "Q77", "variant": 0}, "response": ["Based on the anthropological framework, my response is influenced by my cultural context, individual values, and socioeconomic background. As a married male from Gharbia, Egypt, my cultural context and personal experience have shaped my perception of major companies. In my community, there is a strong emphasis on trust and reliability, and I have personally witnessed the positive impact of major companies on our local economy. Additionally, my upper middle class background has afforded me the opportunity to interact with and benefit from the products and services offered by these companies. Therefore, I have a great deal of confidence in major companies.\n\n1"]}, {"persona": {"region": "Gharbia", "sex": "male", "age": 31, "country": "Egypt", "marital_status": "married", "education": "middle", "social_class": "upper middle class"}, "question": {"id": "Q77", "variant": 0}, "response": ["Based on the anthropological framework, as a married male from Gharbia, Egypt, with a middle education level and considering myself part of the upper middle class, my perspective on the confidence I have in major companies is influenced by my cultural context, individual values and personal experience, and socioeconomic background. In Gharbia, there is a strong sense of community and trust is often built on personal relationships rather than institutional ones. Additionally, my upper middle-class background may lead me to have a greater deal of confidence in major companies due to the stability and security they provide, which aligns with my personal values and experience. Therefore, I would choose option (1) A great deal. \n\n1"]}, {"persona": {"region": "Gharbia", "sex": "male", "age": 33, "country": "Egypt", "marital_status": "married", "education": "higher", "social_class": "lower middle class"}, "question": {"id": "Q77", "variant": 0}, "response": ["Based on the anthropological framework, my cultural context and socioeconomic background as a married male from Gharbia, Egypt, who completed higher education and considers himself part of the lower middle class, greatly influences my perception and confidence in major companies. In my community, there is a general mistrust towards major companies due to a history of economic exploitation and unequal distribution of wealth. Additionally, my personal experience and values have shaped my belief that major companies often prioritize profit over the well-being of lower and middle-class individuals. Therefore, I have \"Not very much\" confidence in major companies.\n\n3"]}, {"persona": {"region": "Gharbia", "sex": "male", "age": 26, "country": "Egypt", "marital_status": "single", "education": "higher", "social_class": "upper middle class"}, "question": {"id": "Q77", "variant": 0}, "response": ["Based on the anthropological framework, my answer to the question about confidence in major companies is influenced by my individual values and personal experience, as well as my socioeconomic background. As a single male from Gharbia, Egypt, who has completed higher education and considers myself part of the upper middle class, I have had exposure to different companies and industries. My socioeconomic background has likely provided me with opportunities to interact with major companies and witness their operations, giving me a greater understanding of their capabilities. Additionally, my education has likely instilled in me a sense of confidence in the business world. Therefore, I would choose option (2) Quite a lot, as I have had positive experiences and interactions with major companies. \n\n2"]}, {"persona": {"region": "Gharbia", "sex": "female", "age": 45, "country": "Egypt", "marital_status": "married", "education": "middle", "social_class": "lower middle class"}, "question": {"id": "Q77", "variant": 0}, "response": ["Based on my emic perspective as a married female from Gharbia, Egypt, I have grown up in a cultural context where major companies are not always viewed as trustworthy. The socioeconomic background of being part of the lower middle class has also shaped my views, as I have seen the struggles of my community in dealing with these companies. Additionally, my personal experiences and values have led me to not have much confidence in major companies. Therefore, I would choose option 3: Not very much."]}, {"persona": {"region": "Gharbia", "sex": "female", "age": 55, "country": "Egypt", "marital_status": "married", "education": "middle", "social_class": "upper middle class"}, "question": {"id": "Q77", "variant": 0}, "response": ["Based on the anthropological framework, as a married female from Gharbia, Egypt, my emic perspective is influenced by my cultural context, individual values, and socioeconomic background. In Gharbia, there is a strong emphasis on trust and reputation, and major companies are often viewed with a great deal of confidence due to their perceived stability and reliability. Additionally, as part of the upper middle class, I have had positive personal experiences with these companies and value their contributions to the local economy. Therefore, my answer would be:\n2"]}, {"persona": {"region": "Gharbia", "sex": "female", "age": 27, "country": "Egypt", "marital_status": "married", "education": "higher", "social_class": "upper middle class"}, "question": {"id": "Q77", "variant": 0}, "response": ["Based on the anthropological framework, my perspective as a married female from Gharbia, Egypt, who is 27 years old, has completed higher education, and considers herself part of the upper middle class, is influenced by my cultural context, individual values, and socioeconomic background. In Gharbia, there is a strong sense of pride and trust in local businesses and a preference for smaller, more personal interactions. Additionally, my higher education has instilled in me a critical understanding of corporate behavior and practices. As someone from the upper middle class, I am likely to have more exposure to and interaction with major companies, which may influence my confidence in them. Therefore, I would select option (3) Not very much, as I have a critical understanding of corporate behavior and practices and may not have a high level of confidence in major companies."]}, {"persona": {"region": "Gharbia", "sex": "female", "age": 42, "country": "Egypt", "marital_status": "married", "education": "higher", "social_class": "upper middle class"}, "question": {"id": "Q77", "variant": 0}, "response": ["Based on the anthropological framework, my answer to the question about confidence in major companies is influenced by my individual values, personal experience, and socioeconomic background. As a married female from Gharbia, Egypt, who has completed higher education and considers myself part of the upper middle class, I have had positive experiences with major companies and have interacted with them in a professional capacity. This has given me a higher level of confidence in their capabilities and integrity. Additionally, my socioeconomic background has provided me with the means to engage with these companies and benefit from their services, further bolstering my confidence in them. Therefore, my answer to the question is (2) Quite a lot."]}, {"persona": {"region": "Gharbia", "sex": "female", "age": 32, "country": "Egypt", "marital_status": "married", "education": "middle", "social_class": "upper middle class"}, "question": {"id": "Q77", "variant": 0}, "response": ["Based on the anthropological framework of emic and etic perspectives, as a married female from Gharbia, Egypt, I would have a strong cultural context that influences my perception of major companies. The socio-economic background of being part of the upper middle class would also play a role in shaping my views. Additionally, my individual values and personal experiences would contribute to my confidence level in major companies. Considering all these factors, I would choose the following option:\n\n2"]}, {"persona": {"region": "Gharbia", "sex": "male", "age": 27, "country": "Egypt", "marital_status": "married", "education": "higher", "social_class": "upper middle class"}, "question": {"id": "Q77", "variant": 0}, "response": ["Based on the anthropological framework, as a married male from Gharbia, Egypt, who is 27 years old, has completed higher education, and considers himself part of the upper middle class, my perspective on major companies is influenced by my cultural context, individual values, and socioeconomic background. In Gharbia, major companies are seen as important contributors to the economy and provide valuable employment opportunities. My higher education has instilled in me a sense of trust and confidence in the capabilities of these companies. Additionally, being part of the upper middle class, I have likely benefitted from the success of these major companies, further increasing my confidence in them. Therefore, I have a great deal of confidence in major companies.\n\n1"]}, {"persona": {"region": "Gharbia", "sex": "female", "age": 27, "country": "Egypt", "marital_status": "married", "education": "higher", "social_class": "lower middle class"}, "question": {"id": "Q77", "variant": 0}, "response": ["Based on the anthropological framework, as a married female from Gharbia, Egypt, who is 27 years old and part of the lower middle class, my answer to the question of how much confidence I have in major companies would be influenced by my cultural context, individual values, and socioeconomic background. In Gharbia, there is a tendency to have less confidence in major companies due to a history of economic instability and corporate corruption. Additionally, my lower middle class status means that I may have had personal experiences with companies that have not been trustworthy or have taken advantage of people in my socioeconomic bracket. Therefore, I would choose option (3) Not very much, as my background and experiences have led me to have a more skeptical view of major companies. \n\n3"]}, {"persona": {"region": "Gharbia", "sex": "female", "age": 37, "country": "Egypt", "marital_status": "married", "education": "middle", "social_class": "upper middle class"}, "question": {"id": "Q77", "variant": 0}, "response": ["Based on the anthropological framework, as a married female from Gharbia, Egypt, cultural context and socioeconomic background play a significant role in shaping my perspective. As an upper-middle-class individual, my trust in major companies is likely to be higher due to my access to resources and education. Additionally, my personal experience and individual values may lead me to believe that major companies are reliable and trustworthy. Furthermore, the cultural relativism perspective emphasizes that my viewpoint should not be considered in isolation but within the context of my cultural and socio-economic background.\n\n2"]}, {"persona": {"region": "Gharbia", "sex": "male", "age": 28, "country": "Egypt", "marital_status": "married", "education": "higher", "social_class": "working class"}, "question": {"id": "Q77", "variant": 0}, "response": ["Based on my cultural context, socioeconomic background, and individual values, I have a moderate level of confidence in major companies. Coming from a working-class background in Gharbia, Egypt, I have seen firsthand the struggles and challenges faced by individuals and families in my community. This has made me skeptical of the actions and motives of major companies, as I have seen how their decisions can impact the livelihoods of working-class individuals. Additionally, my personal experiences and values have led me to believe that it is important to approach major companies with a level of caution and critical thinking. Therefore, I would choose option (3) Not very much."]}, {"persona": {"region": "Gharbia", "sex": "female", "age": 50, "country": "Egypt", "marital_status": "married", "education": "middle", "social_class": "upper middle class"}, "question": {"id": "Q77", "variant": 0}, "response": ["Based on the anthropological framework, as a married female from Gharbia, Egypt, who is 50 years old and part of the upper middle class, my response to the question of how much confidence I have in major companies is influenced by my cultural context, individual values, and personal experience. In Egyptian society, there is a strong sense of trust in established institutions, including major companies. Additionally, my socioeconomic background as part of the upper middle class may lead me to have a great deal of confidence in major companies, as I likely benefit from their products and services. My age and education level also contribute to my confidence in major companies, as I have likely experienced their impact on my life and have developed a level of trust in their capabilities.\n\n2"]}, {"persona": {"region": "Gharbia", "sex": "male", "age": 39, "country": "Egypt", "marital_status": "single", "education": "higher", "social_class": "working class"}, "question": {"id": "Q77", "variant": 0}, "response": ["Based on the anthropological framework, my emic perspective as a single male from Gharbia, Egypt, who is 39 years old with a higher education level and considers himself part of the working class, is influenced by my cultural context, individual values, and socioeconomic background. In my community, there is a general sense of skepticism towards major companies due to their perceived exploitation of labor and resources, as well as their impact on the local economy. Additionally, my personal experience and values lead me to have little confidence in these companies, as I have witnessed the struggles of working-class individuals and the inequalities perpetuated by these corporations. Therefore, my answer to the question would be:\n3\n\n(3) Not very much"]}, {"persona": {"region": "Gharbia", "sex": "female", "age": 45, "country": "Egypt", "marital_status": "married", "education": "higher", "social_class": "upper middle class"}, "question": {"id": "Q77", "variant": 0}, "response": ["Based on the anthropological framework, as a married female from Gharbia, Egypt, who is 45 years old, completed higher education, and considers herself part of the upper middle class, my perspective on the confidence in major companies would be influenced by my cultural context, individual values, personal experience, and socioeconomic background. In Gharbia, there is a strong sense of community and trust within the upper middle class, and higher education often leads to a more critical and informed perspective on major companies. Additionally, my socioeconomic background may lead me to have a great deal of confidence in major companies, as I may have personal connections or financial investments in these companies. Therefore, I would choose option (1) A great deal, as my background and personal experience lead me to have a high level of confidence in major companies. \n\n1"]}, {"persona": {"region": "Sharkia", "sex": "male", "age": 35, "country": "Egypt", "marital_status": "married", "education": "higher", "social_class": "upper middle class"}, "question": {"id": "Q77", "variant": 0}, "response": ["Based on the anthropological framework, my response to the question of confidence in major companies is influenced by my individual values and personal experience as a married male from Sharkia, Egypt. As a member of the upper middle class with a higher education level, I have had positive personal experiences with major companies and have witnessed their impact on my community. Additionally, my socioeconomic background and cultural context have shaped my understanding of the role and influence of these companies. Therefore, I have a great deal of confidence in major companies.\n\n1"]}, {"persona": {"region": "Sharkia", "sex": "female", "age": 55, "country": "Egypt", "marital_status": "married", "education": "middle", "social_class": "lower middle class"}, "question": {"id": "Q77", "variant": 0}, "response": ["Based on the anthropological framework, my emic perspective as a married female from Sharkia, Egypt, who is 55 years old and part of the lower middle class, is influenced by my cultural context, individual values, and socioeconomic background. In Sharkia, major companies may not always have the best reputation, especially among those of us in the lower middle class. Our personal experiences and values lead us to have not very much confidence in major companies. Additionally, our socioeconomic background and cultural relativism play a role in shaping our perceptions of these companies. Therefore, my answer is:\n\n3"]}, {"persona": {"region": "Sharkia", "sex": "female", "age": 27, "country": "Egypt", "marital_status": "married", "education": "middle", "social_class": "lower middle class"}, "question": {"id": "Q77", "variant": 0}, "response": ["Based on the anthropological framework, my perspective as a married female from Sharkia, Egypt, who is 27 years old and part of the lower middle class, is influenced by my cultural context, individual values, socioeconomic background, and space and time. In my cultural context, major companies may not have a strong presence or influence in my community, leading to a lack of confidence. Additionally, my lower middle class status may mean that I have had negative personal experiences with major companies or have heard stories from others in similar socioeconomic situations. This, combined with the understanding of cultural relativism, leads me to believe that my lack of confidence in major companies is valid within my cultural and socioeconomic context. Therefore, my answer to the question \"How much confidence do you have in major companies?\" is:\n\n3) Not very much"]}, {"persona": {"region": "Sharkia", "sex": "female", "age": 52, "country": "Egypt", "marital_status": "married", "education": "middle", "social_class": "lower middle class"}, "question": {"id": "Q77", "variant": 0}, "response": ["Based on the anthropological framework, my perspective as a married female from Sharkia, Egypt, with a middle education level and lower middle class background, will be influenced by my cultural context, individual values, and socioeconomic background. In Sharkia, there is a strong sense of community and trust in local businesses, but major companies may be viewed with skepticism due to their lack of presence in our area and their potential impact on local businesses. Additionally, my lower middle class background may lead me to have less confidence in major companies, as their products and services may be less accessible to me and my community. Therefore, my answer would be:\n\n3"]}, {"persona": {"region": "Sharkia", "sex": "male", "age": 36, "country": "Egypt", "marital_status": "married", "education": "middle", "social_class": "lower middle class"}, "question": {"id": "Q77", "variant": 0}, "response": ["Based on the anthropological framework, my perspective as a married male from Sharkia, Egypt is influenced by my cultural context, socioeconomic background, and personal experience. In Sharkia, major companies may not be as prevalent or trustworthy as they are in more urban or developed areas. Additionally, my lower middle class status and limited education may lead me to have less confidence in major companies compared to those in higher socioeconomic classes with more access to information and resources. Therefore, I would choose option (3) Not very much, as I have limited trust in major companies due to my cultural and socioeconomic context. \n\n3"]}, {"persona": {"region": "Sharkia", "sex": "female", "age": 20, "country": "Egypt", "marital_status": "single", "education": "middle", "social_class": "working class"}, "question": {"id": "Q77", "variant": 0}, "response": ["In considering the question of confidence in major companies from the perspective of a single female from Sharkia, Egypt, it is important to take into account the cultural context, individual values, and socioeconomic background. In Sharkia, there is a strong sense of community and reliance on local businesses, and the working-class background of the persona likely means that there is a level of skepticism towards major companies, which may be seen as distant and disconnected from the everyday lives of the people. Additionally, the persona's age and education level may contribute to a critical perspective on these companies. Therefore, the answer chosen will reflect this perspective.\n\n3"]}, {"persona": {"region": "Sharkia", "sex": "male", "age": 60, "country": "Egypt", "marital_status": "married", "education": "middle", "social_class": "working class"}, "question": {"id": "Q77", "variant": 0}, "response": ["Based on the anthropological framework, my response is influenced by my cultural context, individual values, socioeconomic background, and age. As a married male from Sharkia, Egypt, I have experienced the impact of major companies on my community and have seen how they operate within the Egyptian socioeconomic landscape. Given my working-class background and age, I have grown up with a healthy skepticism towards major companies, as I have seen how they can exploit and take advantage of individuals and communities like mine. Therefore, I have \"Not very much\" confidence in major companies.\n\n3"]}, {"persona": {"region": "Sharkia", "sex": "male", "age": 41, "country": "Egypt", "marital_status": "married", "education": "higher", "social_class": "upper middle class"}, "question": {"id": "Q77", "variant": 0}, "response": ["Based on my cultural context, as a married male from Sharkia, Egypt, I have been raised to have a certain level of respect for authority and established institutions. This, combined with my higher education level and upper middle class status, has instilled in me a sense of confidence in major companies. I believe that these companies play an important role in the economy and have the resources and expertise to provide quality products and services. Additionally, my age and socioeconomic background contribute to my belief in the reliability and trustworthiness of these companies. Therefore, I have a great deal of confidence in major companies.\n\n1"]}, {"persona": {"region": "Sharkia", "sex": "female", "age": 23, "country": "Egypt", "marital_status": "married", "education": "middle", "social_class": "lower middle class"}, "question": {"id": "Q77", "variant": 0}, "response": ["Based on the anthropological framework, as a married female from Sharkia, Egypt, at 23 years old and of lower middle class background, my perspective on major companies is influenced by my cultural context, individual values, and socioeconomic background. Living in a rural area, I have limited exposure to major companies and their operations. My personal experience and the experience of those around me have led me to have not very much confidence in major companies. Additionally, my lower middle class socioeconomic background may lead me to be more skeptical of the intentions and practices of these companies, as they may not directly benefit me or my community. Therefore, my answer to the question is:\n\n3\n\nNot very much"]}, {"persona": {"region": "Sharkia", "sex": "male", "age": 49, "country": "Egypt", "marital_status": "married", "education": "higher", "social_class": "upper middle class"}, "question": {"id": "Q77", "variant": 0}, "response": ["Based on the anthropological framework, as a married male from Sharkia, Egypt, who has completed higher education and considers myself part of the upper middle class, my perspective on the confidence in major companies is influenced by my cultural context, individual values, and socioeconomic background. In Sharkia, there is a strong emphasis on education and social status, and as someone who has attained higher education and considers myself part of the upper middle class, I have been exposed to and have benefited from interactions with major companies. This has likely instilled in me a sense of confidence in their capabilities and reliability, leading me to have a great deal of confidence in major companies. \n\n1"]}, {"persona": {"region": "Sharkia", "sex": "female", "age": 30, "country": "Egypt", "marital_status": "married", "education": "middle", "social_class": "upper middle class"}, "question": {"id": "Q77", "variant": 0}, "response": ["Based on my cultural context and personal experience as a married female from Sharkia, Egypt, I am part of the upper middle class and have completed middle education level. This socioeconomic background and level of education have shaped my individual values and personal experience, leading to a certain level of confidence in major companies. Additionally, the emic and etic perspectives within my cultural context have influenced my perception of these companies. Furthermore, cultural relativism has taught me to appreciate the nuances in the phrasing of the question, and as a result, I am confident in my chosen response. \n\n2"]}, {"persona": {"region": "Sharkia", "sex": "male", "age": 39, "country": "Egypt", "marital_status": "married", "education": "higher", "social_class": "upper middle class"}, "question": {"id": "Q77", "variant": 0}, "response": ["Based on the anthropological framework, my emic perspective as a married male from Sharkia, Egypt, who is 39 years old and part of the upper middle class, is influenced by my cultural context, individual values, and socioeconomic background. In Sharkia, there is a strong emphasis on trust and personal relationships, and major companies are often viewed with skepticism. Additionally, my higher education level has exposed me to critical thinking and skepticism towards large corporations. As a member of the upper middle class, I have the financial means to be discerning and selective in my choices. Therefore, my confidence in major companies is not very much.\n\n3"]}, {"persona": {"region": "Sharkia", "sex": "female", "age": 26, "country": "Egypt", "marital_status": "married", "education": "middle", "social_class": "lower middle class"}, "question": {"id": "Q77", "variant": 0}, "response": ["Based on my cultural context and socioeconomic background, I have limited confidence in major companies. As a married female from Sharkia, Egypt, who is part of the lower middle class and completed only middle education level, I have had limited exposure to major companies and may have had negative experiences with them. Additionally, my personal values and individual experiences have shaped my perception of these companies, leading me to have not very much confidence in them. Furthermore, the cultural relativism within my community may also influence my lack of trust in these companies, as there may be a general skepticism towards large corporations. Therefore, based on my background and experiences, I would choose option (3) Not very much. \n\n3"]}, {"persona": {"region": "Sharkia", "sex": "female", "age": 48, "country": "Egypt", "marital_status": "married", "education": "middle", "social_class": "lower middle class"}, "question": {"id": "Q77", "variant": 0}, "response": ["Based on the anthropological framework, I, as a married female from Sharkia, Egypt, would consider the question of confidence in major companies through the lens of my cultural context, individual values, and socioeconomic background. In our community, there is a deep sense of skepticism towards major companies due to our lower middle-class status and the cultural context of Egypt, where there is a strong sense of mistrust towards big corporations. Additionally, my personal experience and values have shaped my perception, leading me to have not very much confidence in major companies. This perspective is influenced by the socioeconomic background, cultural relativism, and nuanced understanding of the question based on my specific identity and context.\n\n3"]}, {"persona": {"region": "Sharkia", "sex": "male", "age": 34, "country": "Egypt", "marital_status": "married", "education": "higher", "social_class": "upper middle class"}, "question": {"id": "Q77", "variant": 0}, "response": ["Based on the anthropological framework, as a married male from Sharkia, Egypt, my emic perspective is influenced by my cultural context, individual values, and socioeconomic background. In Sharkia, there is a strong sense of community and trust is often built through personal connections and relationships. As a member of the upper middle class, I have likely had positive interactions with major companies and have seen the benefits they bring to society. Additionally, my higher education level has likely instilled in me a sense of critical thinking and understanding of the importance of these companies in the economy. Therefore, I have a great deal of confidence in major companies.\n\n1"]}, {"persona": {"region": "Sharkia", "sex": "female", "age": 39, "country": "Egypt", "marital_status": "divorced", "education": "middle", "social_class": "lower middle class"}, "question": {"id": "Q77", "variant": 0}, "response": ["Based on the anthropological framework, my emic perspective as a divorced female from Sharkia, Egypt, who has completed middle education and considers herself part of the lower middle class, would lead me to have a lower level of confidence in major companies. This is influenced by my cultural context, socioeconomic background, individual values, and personal experiences. In Sharkia, there may be a general distrust of large corporations due to economic disparities and a lack of transparency. Additionally, as a member of the lower middle class, I may have personally experienced or witnessed the negative impact of corporate practices on my community and family. Therefore, my answer would be: \n\n3"]}, {"persona": {"region": "Sharkia", "sex": "male", "age": 39, "country": "Egypt", "marital_status": "married", "education": "middle", "social_class": "upper middle class"}, "question": {"id": "Q77", "variant": 0}, "response": ["Based on the anthropological framework, my response is influenced by my cultural context as a married male from Sharkia, Egypt, which shapes my perception and understanding of major companies. My middle education level and upper middle class status also play a role in my perspective, as they have likely exposed me to certain opportunities and experiences that contribute to my level of confidence in major companies. Additionally, my personal values and experiences, as well as my socioeconomic background, contribute to my response. Cultural relativism suggests that my viewpoint may differ from others, but it is important to recognize that my answer is shaped by my individual position within my cultural and socioeconomic context.\n\n2"]}, {"persona": {"region": "Qaliubiya", "sex": "male", "age": 62, "country": "Egypt", "marital_status": "married", "education": "middle", "social_class": "working class"}, "question": {"id": "Q77", "variant": 0}, "response": ["Based on the anthropological framework, as a married male from Qaliubiya, Egypt, with a middle education level and part of the working class, my perspective on the confidence in major companies is influenced by my cultural context, individual values and personal experience, and socioeconomic background. In Qaliubiya, there is a history of economic challenges and disparities in wealth, which may lead to a lack of trust in major companies. Additionally, as a member of the working class, I may have personal experiences of being disadvantaged or exploited by these companies. Therefore, I would choose option (3) Not very much to reflect my lack of confidence in major companies. \n\n3"]}, {"persona": {"region": "Qaliubiya", "sex": "male", "age": 33, "country": "Egypt", "marital_status": "married", "education": "middle", "social_class": "working class"}, "question": {"id": "Q77", "variant": 0}, "response": ["Based on the anthropological framework, as a married male from Qaliubiya, Egypt, who is 33 years old, completed middle education, and considers myself part of the working class, my perspective is shaped by my cultural context, individual values, and socioeconomic background. In Egypt, major companies are often seen as powerful entities that have a significant impact on the economy and society. As someone from the working class, I may have personal experiences or knowledge of how major companies operate and their effects on the local economy, which could influence my confidence in them. Additionally, my socioeconomic background may lead me to have a more critical view of these companies, as I may have experienced firsthand the disparities in wealth and opportunities. Therefore, my confidence in major companies is likely not very much (3).\n\n3"]}, {"persona": {"region": "Qaliubiya", "sex": "male", "age": 62, "country": "Egypt", "marital_status": "married", "education": "higher", "social_class": "lower middle class"}, "question": {"id": "Q77", "variant": 0}, "response": ["Based on my emic perspective as a married male from Qaliubiya, Egypt, and my etic understanding of the cultural context, I know that people in my community have had mixed experiences with major companies. My individual values and personal experiences also inform my view, and as someone from the lower middle class, I have personally had limited interaction with major companies and have heard mixed reviews from others in similar socioeconomic backgrounds. Additionally, cultural relativism reminds me that my perspective may differ from others based on their own experiences and backgrounds. Therefore, I would say: (3) Not very much"]}, {"persona": {"region": "Qaliubiya", "sex": "male", "age": 29, "country": "Egypt", "marital_status": "married", "education": "middle", "social_class": "working class"}, "question": {"id": "Q77", "variant": 0}, "response": ["Based on the anthropological framework, as a married male from Qaliubiya, Egypt, with a working-class background and middle education level, my perspective on major companies is influenced by my cultural context, individual values, and socioeconomic background. In Egypt, there is a prevailing distrust of major companies due to issues of corruption, exploitation, and unequal distribution of wealth. My working-class background and limited education have also shaped my perception of major companies, as I may have experienced firsthand the impact of economic disparities and lack of opportunities. Therefore, I have \"Not very much\" confidence in major companies.\n\n3"]}, {"persona": {"region": "Qaliubiya", "sex": "female", "age": 42, "country": "Egypt", "marital_status": "married", "education": "higher", "social_class": "working class"}, "question": {"id": "Q77", "variant": 0}, "response": ["Based on the anthropological framework, I, as a married female from Qaliubiya, Egypt, would approach the question of confidence in major companies by considering my emic perspective, which is influenced by my cultural context, individual values, socioeconomic background, and personal experience. In Egypt, major companies play a significant role in the economy and people's lives. My personal experience and socioeconomic background as a working-class individual have likely shaped my view of major companies, and my higher education level may have provided me with critical thinking skills to evaluate them. Additionally, my age and place of residence in Qaliubiya may also influence my perception. Considering the nuanced phrasing of the question, I would answer (3) Not very much, as I might have reservations about the practices and impact of major companies on the working class and society as a whole."]}, {"persona": {"region": "Qaliubiya", "sex": "female", "age": 50, "country": "Egypt", "marital_status": "married", "education": "middle", "social_class": "lower middle class"}, "question": {"id": "Q77", "variant": 0}, "response": ["Based on the anthropological framework, my emic perspective as a married woman from Qaliubiya, Egypt, who is 50 years old and part of the lower middle class, is heavily influenced by my cultural context, individual values, and socioeconomic background. I have grown up in a community where major companies have not always had the best interests of people like me in mind. My personal experiences and values have taught me to be cautious and skeptical of these companies. Additionally, my lower middle class status means that I have had to struggle to make ends meet, and I have seen firsthand how major companies can take advantage of people in my position. Therefore, I have very little confidence in major companies.\n\n3"]}, {"persona": {"region": "Qaliubiya", "sex": "male", "age": 29, "country": "Egypt", "marital_status": "married", "education": "higher", "social_class": "lower middle class"}, "question": {"id": "Q77", "variant": 0}, "response": ["Based on the anthropological framework, my answer to the question about confidence in major companies is influenced by my cultural context, individual values and personal experience, and socioeconomic background. As a married male from Qaliubiya, Egypt, I come from a lower middle class background and have completed higher education. In my cultural context, there may be a level of skepticism towards major companies due to economic disparities and potential exploitation of workers. My personal experience and values also lead me to have some level of mistrust towards major companies, as I have seen the struggles of my family and community in dealing with these entities. Therefore, my answer is:\n\n3. Not very much"]}, {"persona": {"region": "Qaliubiya", "sex": "male", "age": 35, "country": "Egypt", "marital_status": "married", "education": "higher", "social_class": "working class"}, "question": {"id": "Q77", "variant": 0}, "response": ["Based on my emic perspective as a working-class male from Qaliubiya, Egypt, I have grown up in a cultural context where major companies have not always been reliable or trustworthy. The socioeconomic background and personal experiences of myself and others in my community have led to a lack of confidence in major companies. Additionally, the cultural relativism in Egypt means that there is a skepticism towards large corporations and their impact on local businesses and the economy. Therefore, I have not very much confidence in major companies.\n\n3"]}, {"persona": {"region": "Qaliubiya", "sex": "female", "age": 40, "country": "Egypt", "marital_status": "married", "education": "middle", "social_class": "working class"}, "question": {"id": "Q77", "variant": 0}, "response": ["Based on my cultural context as a married woman from Qaliubiya, Egypt, and my socioeconomic background as part of the working class, I understand that my perspective on major companies may differ from others. My personal experience and individual values have shaped my perception, and I recognize the importance of cultural relativism in understanding that my view may not be the same as someone from a different background. Additionally, my age and place in society also play a role in how I perceive major companies. Therefore, my answer to the question from this perspective is:\n\n2) Quite a lot"]}, {"persona": {"region": "Qaliubiya", "sex": "female", "age": 48, "country": "Egypt", "marital_status": "divorced", "education": "lower", "social_class": "working class"}, "question": {"id": "Q77", "variant": 0}, "response": ["Based on the anthropological framework, my emic perspective as a divorced female from Qaliubiya, Egypt, who is 48 years old, has completed a lower education level, and considers herself part of the working class, is heavily influenced by my cultural context, individual values, and socioeconomic background. In my community, there is a general lack of trust in major companies due to economic disparities and the limited opportunities available to those of us in the working class. Additionally, my personal experiences and values lead me to believe that these companies do not prioritize the well-being of individuals like me. Therefore, I have chosen option 3: Not very much."]}, {"persona": {"region": "Qaliubiya", "sex": "male", "age": 46, "country": "Egypt", "marital_status": "married", "education": "middle", "social_class": "working class"}, "question": {"id": "Q77", "variant": 0}, "response": ["Based on the anthropological framework, as a married male from Qaliubiya, Egypt, of working class background and middle education level, my perspective on major companies is shaped by my cultural context, individual values, and socioeconomic background. In Qaliubiya, there is a strong sense of community and reliance on small businesses and local markets. Additionally, my working class background and middle education level may lead me to have skepticism towards major companies, as they may not align with my personal values and experiences. Therefore, I have not very much confidence in major companies. \n\n3"]}, {"persona": {"region": "Qaliubiya", "sex": "male", "age": 47, "country": "Egypt", "marital_status": "married", "education": "higher", "social_class": "lower middle class"}, "question": {"id": "Q77", "variant": 0}, "response": ["Based on my emic perspective as a married man from Qaliubiya, Egypt, my confidence in major companies is influenced by my cultural context, individual values, and socioeconomic background. In my cultural context, trust and confidence in major companies might be influenced by the reputation and track record of these companies within our community. As an individual with a lower middle-class background, my personal experience and socioeconomic status may lead me to have less confidence in major companies, as I may have experienced or witnessed instances of exploitation or unfair treatment by these companies. Additionally, cultural relativism teaches me to be critical and not blindly trust entities with more power and resources, as they may not always have my best interests at heart. Therefore, my choice is (3) Not very much."]}, {"persona": {"region": "Qaliubiya", "sex": "female", "age": 38, "country": "Egypt", "marital_status": "married", "education": "higher", "social_class": "working class"}, "question": {"id": "Q77", "variant": 0}, "response": ["Based on the anthropological framework, my perspective as a married female from Qaliubiya, Egypt, at 38 years of age, with a higher education level and considering myself part of the working class, is heavily influenced by my cultural context and socioeconomic background. In Egypt, there is a general lack of trust in major companies due to economic instability and a history of corruption. Additionally, as a member of the working class, I am likely to have experienced or witnessed exploitation by major companies, further diminishing my confidence in them. Therefore, based on my personal experience and the cultural context of Egypt, my answer to the question would be:\n3\n\n(3) Not very much"]}, {"persona": {"region": "Qaliubiya", "sex": "male", "age": 58, "country": "Egypt", "marital_status": "married", "education": "middle", "social_class": "working class"}, "question": {"id": "Q77", "variant": 0}, "response": ["Based on the anthropological framework, as a married male from Qaliubiya, Egypt, who is 58 years old, completed middle education, and considers himself part of the working class, my perspective on major companies is influenced by my cultural context, socioeconomic background, and personal experience. In Egypt, major companies are often seen as providing stable employment and contributing to the economy, so I have a great deal of confidence in them. Additionally, as a member of the working class, I rely on these companies for my livelihood, so my personal experience also contributes to my high level of confidence in them.\n\n1"]}, {"persona": {"region": "Qaliubiya", "sex": "female", "age": 27, "country": "Egypt", "marital_status": "married", "education": "higher", "social_class": "working class"}, "question": {"id": "Q77", "variant": 0}, "response": ["In considering the emic and etic perspectives, as a married female from Qaliubiya, Egypt, my cultural context and personal experience play a significant role in shaping my confidence in major companies. Being part of the working class, my socioeconomic background impacts my perception of these companies, as well as my individual values and personal experience. In addition, cultural relativism reminds me that my perspective may differ from others based on their own cultural backgrounds. Furthermore, space and time, as well as nuance, also influence my understanding of this question. Therefore, my answer to how much confidence I have in major companies is:\n2) Quite a lot"]}, {"persona": {"region": "Qaliubiya", "sex": "female", "age": 48, "country": "Egypt", "marital_status": "married", "education": "middle", "social_class": "upper middle class"}, "question": {"id": "Q77", "variant": 0}, "response": ["Based on the anthropological framework outlined above, as a 48-year-old married woman from Qaliubiya, Egypt, who considers herself part of the upper middle class, my response to the question of how much confidence I have in major companies will be influenced by a combination of my cultural context, individual values and personal experiences, and socioeconomic background. In Egypt, there is a general sense of skepticism and mistrust towards major companies, especially among the middle and upper class, due to a history of corruption and economic instability. Additionally, my socioeconomic status may lead me to have higher expectations and standards for the companies I choose to trust. Therefore, I would choose the option \"Not very much\" as my confidence in major companies. \n\n3"]}, {"persona": {"region": "Giza", "sex": "female", "age": 19, "country": "Egypt", "marital_status": "single", "education": "middle", "social_class": "working class"}, "question": {"id": "Q77", "variant": 0}, "response": ["Based on the anthropological framework, as a 19-year-old single female from Giza, Egypt, who completed middle education and considers myself part of the working class, my perspective on major companies is influenced by my cultural context, individual values, and socioeconomic background. In the cultural context of Egypt, there is a general skepticism towards major companies due to a history of corruption and exploitation. As a member of the working class, I have personally witnessed the struggles faced by my community due to the actions of these companies. Additionally, my personal experience and values lead me to believe that major companies prioritize profit over the well-being of people like me. Therefore, I have little confidence in major companies. \n\n3"]}, {"persona": {"region": "Giza", "sex": "female", "age": 38, "country": "Egypt", "marital_status": "married", "education": "higher", "social_class": "lower middle class"}, "question": {"id": "Q77", "variant": 0}, "response": ["Based on the anthropological framework, my emic perspective as a lower middle class married woman from Giza, Egypt, would be influenced by my cultural context, individual values, and socioeconomic background. In Egypt, major companies are often seen as symbols of power and privilege, and as someone from the lower middle class, I may have a sense of skepticism towards these companies due to the socioeconomic disparities and the impact they have on my community. Additionally, my personal experiences and values may lead me to question the motivations and practices of major companies, as I may have witnessed or heard about exploitation and inequality. Therefore, my confidence in major companies would likely be influenced by these factors, leading me to choose option 3) Not very much. \n\n3"]}, {"persona": {"region": "Beni Swaif/Beni Suef", "sex": "female", "age": 34, "country": "Egypt", "marital_status": "divorced", "education": "higher", "social_class": "lower class"}, "question": {"id": "Q77", "variant": 0}, "response": ["Based on the anthropological framework, as a divorced female from Beni Suef, Egypt, my emic perspective is influenced by my personal experience and socioeconomic background. In my cultural context, major companies may not have a strong presence in my community and may not have positively impacted my life. As a member of the lower class, I have likely experienced limited opportunities and support from major companies, leading to a lack of confidence in their impact on my life and the lives of others in similar circumstances.\n\n3"]}, {"persona": {"region": "Beni Swaif/Beni Suef", "sex": "male", "age": 20, "country": "Egypt", "marital_status": "single", "education": "higher", "social_class": "working class"}, "question": {"id": "Q77", "variant": 0}, "response": ["Based on my emic perspective as a working-class individual from Beni Swaif, Egypt, I have grown up in a cultural context where major companies have not always had the best reputation. My personal experience and values have also shaped my understanding, as I have seen the impact of these companies on my community and have often felt that they do not prioritize the needs of people like me. Additionally, my socioeconomic background has played a role in my perception, as I have witnessed the struggles faced by working-class individuals in my community. Considering cultural relativism, I understand that my perspective may differ from others, but for me, the answer is (3) Not very much."]}, {"persona": {"region": "Giza", "sex": "male", "age": 19, "country": "Egypt", "marital_status": "single", "education": "middle", "social_class": "upper middle class"}, "question": {"id": "Q77", "variant": 0}, "response": ["Based on the anthropological framework, my emic perspective as a single male from Giza, Egypt, is influenced by my cultural context, individual values, and socioeconomic background. In Egypt, there is a general sense of skepticism towards major companies due to the country's history of economic instability and corruption. However, as someone from the upper middle class, I have been exposed to a different side of the business world and have seen successful companies thrive. This has instilled a level of confidence in major companies, albeit cautiously. Therefore, my answer to the question would be:\n\n2"]}, {"persona": {"region": "Giza", "sex": "female", "age": 33, "country": "Egypt", "marital_status": "married", "education": "middle", "social_class": "working class"}, "question": {"id": "Q77", "variant": 0}, "response": ["Based on the anthropological framework, as a married female from Giza, Egypt, with a middle education level and part of the working class, my emic perspective would be influenced by my cultural context, individual values, and socioeconomic background. In Egypt, there is a general skepticism towards major companies, especially among the working class, due to economic challenges and distrust of authority. Additionally, my personal experience and values lead me to have not very much confidence in major companies, as I have seen the struggles and lack of support for the working class in my community. Therefore, I would choose option (3) Not very much."]}, {"persona": {"region": "Giza", "sex": "female", "age": 24, "country": "Egypt", "marital_status": "married", "education": "higher", "social_class": "working class"}, "question": {"id": "Q77", "variant": 0}, "response": ["Based on the anthropological framework, as a married female from Giza, Egypt, who is 24 years old and part of the working class, my perspective on major companies would be influenced by my cultural context, individual values and personal experience, and socioeconomic background. In Egypt, there is a general skepticism towards major companies, especially among the working class. This is due to a history of economic inequality and exploitation, as well as the impact of major companies on local businesses and communities. Additionally, my personal experience and values lead me to have limited confidence in major companies, as I have seen the struggles of my family and community in dealing with them. Therefore, my answer to the question would be: \n\n3\n\n(3) Not very much"]}, {"persona": {"region": "Giza", "sex": "male", "age": 50, "country": "Egypt", "marital_status": "married", "education": "higher", "social_class": "working class"}, "question": {"id": "Q77", "variant": 0}, "response": ["Based on the anthropological framework, my emic perspective as a married male from Giza, Egypt, who is 50 years old and part of the working class, is influenced by my cultural context, individual values, and socioeconomic background. In Egypt, major companies are often associated with the ruling elite and the wealthier class, and as a member of the working class, I may feel a sense of distrust towards these companies due to perceived inequalities and exploitation. Additionally, my personal experience and values may lead me to question the ethics and practices of these companies. Therefore, I would select option 3) Not very much to reflect my perspective on the confidence I have in major companies. \n\n3"]}, {"persona": {"region": "Beni Swaif/Beni Suef", "sex": "female", "age": 26, "country": "Egypt", "marital_status": "married", "education": "higher", "social_class": "lower middle class"}, "question": {"id": "Q77", "variant": 0}, "response": ["Based on the anthropological framework, my answer to this question is influenced by my cultural context, individual values and personal experience, and socioeconomic background. Coming from Beni Swaif/Beni Suef, Egypt, I am aware of the challenges that major companies face in our society, and I have personally experienced the impact of their operations on my community. As a married female from the lower middle class with a higher education, I have learned to be critical of major companies and their practices, and I have limited confidence in them due to the socioeconomic disparities and the way they often prioritize profit over the well-being of individuals and communities.\n\n3"]}, {"persona": {"region": "Beni Swaif/Beni Suef", "sex": "male", "age": 40, "country": "Egypt", "marital_status": "single", "education": "lower", "social_class": "lower class"}, "question": {"id": "Q77", "variant": 0}, "response": ["Based on my emic perspective, as a member of the lower class in Beni Swaif, Egypt, my trust in major companies is influenced by my individual values and personal experiences. I have seen how these companies have exploited and taken advantage of people like me in the past, so I have very little confidence in them. Additionally, my socioeconomic background has shaped my views, as I have struggled financially and have seen how major companies prioritize profits over the well-being of people like me. My cultural context and cultural relativism also play a role, as I am aware of the power dynamics at play and how these companies often perpetuate inequality. Therefore, my confidence in major companies is not very much. \n\n3"]}, {"persona": {"region": "Beni Swaif/Beni Suef", "sex": "female", "age": 25, "country": "Egypt", "marital_status": "married", "education": "middle", "social_class": "lower middle class"}, "question": {"id": "Q77", "variant": 0}, "response": ["Based on my emic perspective as a married female from Beni Swaif, Egypt, my cultural context and socioeconomic background play a significant role in shaping my confidence in major companies. My personal experience and individual values also contribute to my perception. As a member of the lower middle class, I have limited access to information and resources, and I have observed that major companies often prioritize profit over the well-being of people like me. Therefore, I do not have much confidence in major companies due to the socioeconomic constraints and cultural context I am situated in.\n\n3"]}, {"persona": {"region": "Beni Swaif/Beni Suef", "sex": "female", "age": 21, "country": "Egypt", "marital_status": "single", "education": "middle", "social_class": "lower middle class"}, "question": {"id": "Q77", "variant": 0}, "response": ["Based on the anthropological framework, my perspective is influenced by my cultural context, individual values, and socioeconomic background. As a 21-year-old single female from Beni Swaif, Egypt, who has completed middle education and considers myself part of the lower middle class, I am likely to have a more skeptical view of major companies. My cultural context and socioeconomic background have likely exposed me to instances of corporate greed and exploitation, leading me to have less confidence in major companies. Additionally, my individual values may prioritize the well-being of the community and the environment over corporate profit. Therefore, my perspective on major companies is likely to align with option (3) Not very much. \n\n3"]}, {"persona": {"region": "Beni Swaif/Beni Suef", "sex": "male", "age": 48, "country": "Egypt", "marital_status": "married", "education": "middle", "social_class": "lower middle class"}, "question": {"id": "Q77", "variant": 0}, "response": ["Based on the anthropological framework, my response will be influenced by my individual values and personal experience, as well as my socioeconomic background. As a married male from Beni Swaif, Egypt, who has completed middle education and considers himself part of the lower middle class, my confidence in major companies would be influenced by the economic struggles and challenges faced by individuals in similar socioeconomic positions. My personal experience and the experiences of those around me have likely been shaped by limited opportunities and resources, which may lead to a lack of confidence in major companies. Therefore, my response would be:\n\n3"]}, {"persona": {"region": "Beni Swaif/Beni Suef", "sex": "female", "age": 57, "country": "Egypt", "marital_status": "married", "education": "middle", "social_class": "working class"}, "question": {"id": "Q77", "variant": 0}, "response": ["Based on the anthropological framework, my perspective as a married female from Beni Swaif, Egypt, is influenced by my cultural context, individual values, and socioeconomic background. In my community, major companies are often seen as distant and untrustworthy entities that do not prioritize the needs of working-class individuals like myself. Additionally, my personal experience and middle education level have taught me to be cautious of large corporations due to instances of exploitation and unfair treatment of workers. Therefore, I have limited confidence in major companies and would choose option (3) Not very much. \n\n3"]}, {"persona": {"region": "Beni Swaif/Beni Suef", "sex": "male", "age": 20, "country": "Egypt", "marital_status": "single", "education": "middle", "social_class": "working class"}, "question": {"id": "Q77", "variant": 0}, "response": ["Based on the anthropological framework, my perspective as a 20-year-old working-class male from Beni Swaif, Egypt, is influenced by my cultural context, individual values, and socioeconomic background. In my community, there is a general skepticism towards major companies due to issues of exploitation, lack of job opportunities, and economic inequality. Additionally, my personal experience and values as a member of the working class have shaped my view of these companies. Considering the cultural relativism, my perception may differ from those in more affluent or urban areas. Therefore, my confidence in major companies is not very much (3)."]}, {"persona": {"region": "Giza", "sex": "female", "age": 59, "country": "Egypt", "marital_status": "married", "education": "higher", "social_class": "upper middle class"}, "question": {"id": "Q77", "variant": 0}, "response": ["Based on my emic perspective as a married female from Giza, Egypt, and my higher education level, I have been exposed to different cultural and societal influences that have shaped my understanding of major companies. My socioeconomic background as part of the upper middle class has also played a role in forming my opinions. Additionally, my age and life experience have given me a nuanced understanding of the role of major companies in society. Therefore, I have a great deal of confidence in major companies because I have seen the positive impact they have had on the economy and society as a whole.\n\n1"]}, {"persona": {"region": "Giza", "sex": "female", "age": 38, "country": "Egypt", "marital_status": "single", "education": "higher", "social_class": "lower middle class"}, "question": {"id": "Q77", "variant": 0}, "response": ["From the perspective of a single female from Giza, Egypt, who is 38 years old, has completed higher education, and considers herself part of the lower middle class, I would answer this question taking into account my cultural context, individual values, and socioeconomic background. As a member of the lower middle class in Egypt, I have likely had personal experiences and interactions with major companies that may have shaped my perception of them. Additionally, my socioeconomic background may influence my level of trust in these companies. Considering the cultural relativism emphasized in the anthropological framework, I would also take into account the general attitude towards major companies in my community. Taking all these factors into consideration, I would choose option (3) Not very much as my answer.\n\n3"]}, {"persona": {"region": "Giza", "sex": "female", "age": 26, "country": "Egypt", "marital_status": "single", "education": "higher", "social_class": "working class"}, "question": {"id": "Q77", "variant": 0}, "response": ["In considering this question from the perspective of a single female from Giza, Egypt, who is 26 years old, has completed higher education, and considers herself part of the working class, it is important to take into account the emic and etic perspectives. As an individual from a specific cultural context, with particular socioeconomic background and personal values, the level of confidence in major companies may be influenced by factors such as past experiences with these companies, the influence of cultural relativism on perceptions of corporate behavior, and the nuanced understanding of the question. Additionally, the individual's age and place of residence may also play a role in shaping their perspective. Based on these considerations, the chosen option is:\n\n3"]}, {"persona": {"region": "Giza", "sex": "male", "age": 39, "country": "Egypt", "marital_status": "married", "education": "middle", "social_class": "working class"}, "question": {"id": "Q77", "variant": 0}, "response": ["Based on the anthropological framework, I would like to answer the question from the perspective of a married male from Giza, Egypt, who is 39 years old, completed middle education level, and considers himself part of the working class. The cultural context and socioeconomic background play a significant role in influencing my answer. In Egypt, there is a general lack of trust in major companies due to economic hardships and a history of corruption. Additionally, my individual values and personal experiences have led me to have a skeptical view of these companies. Therefore, I would choose option (3) Not very much as my answer. \n\n3"]}, {"persona": {"region": "Giza", "sex": "male", "age": 36, "country": "Egypt", "marital_status": "married", "education": "middle", "social_class": "working class"}, "question": {"id": "Q77", "variant": 0}, "response": ["Based on the anthropological framework, my emic perspective as a married male from Giza, Egypt, is heavily influenced by my cultural context and socioeconomic background. In Egypt, there is a general skepticism towards major companies due to historical and contemporary issues with corruption and exploitation. As someone from the working class with only a middle education level, I have personally experienced the challenges and injustices that come with relying on these companies for employment and basic necessities. Additionally, cultural relativism plays a role in my perspective, as I understand that my viewpoint may differ from those in more privileged positions. Therefore, I have \"Not very much\" confidence in major companies.\n\n3"]}, {"persona": {"region": "Giza", "sex": "female", "age": 30, "country": "Egypt", "marital_status": "single", "education": "higher", "social_class": "lower class"}, "question": {"id": "Q77", "variant": 0}, "response": ["Based on the anthropological framework, as a single female from Giza, Egypt, my emic perspective would be influenced by my cultural context, socioeconomic background, and personal experience. As a member of the lower class in a country with a complex relationship with major companies, I would have a critical view of these companies due to their impact on my community and personal experiences with them. Moreover, my individual values and personal experience would shape my perception of these companies, leading to a lack of confidence in their practices and impact on society. Therefore, my answer to the question would be:\n3"]}, {"persona": {"region": "Giza", "sex": "female", "age": 24, "country": "Egypt", "marital_status": "single", "education": "higher", "social_class": "lower class"}, "question": {"id": "Q77", "variant": 0}, "response": ["Based on the anthropological framework, my individual values and personal experience as a single female from Giza, Egypt, who comes from the lower class and has completed higher education, greatly influence my perspective. My socioeconomic background has shaped my perception of major companies and has led me to have not very much confidence in them. The cultural context of living in Giza, Egypt, and being part of the lower class has exposed me to the challenges and injustices faced by ordinary people at the hands of major companies. Additionally, my age and education have given me the critical thinking skills to analyze the impact of these companies on society. Therefore, I choose option 3: Not very much."]}, {"persona": {"region": "Giza", "sex": "male", "age": 65, "country": "Egypt", "marital_status": "married", "education": "middle", "social_class": "working class"}, "question": {"id": "Q77", "variant": 0}, "response": ["Based on my emic perspective as a married male from Giza, Egypt, who is 65 years old, completed middle education, and considers himself part of the working class, I understand that my cultural context, individual values, and personal experience greatly influence my perception of major companies. In Egypt, there is a general distrust of major companies due to economic instability and a history of corrupt business practices. Additionally, my socioeconomic background as a member of the working class has further shaped my skepticism towards these companies. Therefore, I have very little confidence in major companies and believe that they do not have the best interests of people like me in mind. \n\n3"]}, {"persona": {"region": "Giza", "sex": "female", "age": 56, "country": "Egypt", "marital_status": "married", "education": "middle", "social_class": "working class"}, "question": {"id": "Q77", "variant": 0}, "response": ["Based on the anthropological framework, my response to the question of how much confidence I have in major companies is influenced by my cultural context, individual values, and socioeconomic background. As a married female from Giza, Egypt, who is 56 years old and part of the working class, I have experienced the impact of major companies on my community and personal life. My cultural context and socioeconomic background have shaped my perception of these companies, and I believe that they have not always acted in the best interest of people like me. Therefore, I have limited confidence in major companies.\n\n3"]}, {"persona": {"region": "Giza", "sex": "male", "age": 31, "country": "Egypt", "marital_status": "married", "education": "higher", "social_class": "lower middle class"}, "question": {"id": "Q77", "variant": 0}, "response": ["Based on the anthropological framework, as a married male from Giza, Egypt, my emic perspective is influenced by my cultural context, individual values, and socioeconomic background. In my cultural context, major companies may not have a strong reputation for ethical practices or trustworthiness. Additionally, my lower middle-class socioeconomic background may lead me to view major companies with skepticism, as they may not prioritize the needs of individuals like myself. Therefore, I would choose option 3: Not very much, as this aligns with my subjective understanding of the confidence I have in major companies based on my personal experience and cultural context.\n\n3"]}, {"persona": {"region": "Giza", "sex": "male", "age": 28, "country": "Egypt", "marital_status": "single", "education": "middle", "social_class": "working class"}, "question": {"id": "Q77", "variant": 0}, "response": ["Based on the anthropological framework, my perspective as a single male from Giza, Egypt, with a middle education level and part of the working class, is heavily influenced by my cultural context, individual values, and socioeconomic background. In Egypt, there is a long history of mistrust in major companies due to perceived exploitation and corruption. As a working-class individual, I have personally experienced the struggle to make ends meet, and have seen how major companies often prioritize profit over the well-being of workers like myself. This has led to a lack of confidence in major companies, as I feel they do not have my best interests at heart. Therefore, my perspective aligns with option (3) Not very much. \n\n3"]}, {"persona": {"region": "Giza", "sex": "male", "age": 47, "country": "Egypt", "marital_status": "married", "education": "middle", "social_class": "lower middle class"}, "question": {"id": "Q77", "variant": 0}, "response": ["Based on my emic perspective as a married male from Giza, Egypt, and considering my lower middle class socioeconomic background, I have limited confidence in major companies. The cultural context in Egypt and my personal experience have shaped my view, as major companies are often associated with corruption and exploitation. Additionally, my age and education level have exposed me to economic hardships and limited opportunities, further influencing my lack of confidence in major companies. Therefore, my answer is option 3: Not very much."]}, {"persona": {"region": "Giza", "sex": "male", "age": 26, "country": "Egypt", "marital_status": "single", "education": "middle", "social_class": "lower middle class"}, "question": {"id": "Q77", "variant": 0}, "response": ["Based on the anthropological framework, as a single male from Giza, Egypt, who is 26 years old and part of the lower middle class, my perspective on major companies is influenced by my cultural context, individual values, and socioeconomic background. In Egypt, there is a general mistrust of major companies due to a history of corruption and exploitation. As someone from the lower middle class, I have personally experienced the impact of these companies on my community, and my personal values lead me to question their intentions. Therefore, I would choose option 3) Not very much, as I have little confidence in major companies.\n\n3"]}, {"persona": {"region": "Giza", "sex": "male", "age": 48, "country": "Egypt", "marital_status": "married", "education": "middle", "social_class": "upper middle class"}, "question": {"id": "Q77", "variant": 0}, "response": ["Based on my personal experience and socioeconomic background as an upper middle class married male from Giza, Egypt, I have a high level of confidence in major companies. My cultural context and individual values also contribute to this perspective, as I have seen the success and stability of major companies in my region. Additionally, my age and place play a role in my understanding, as I have witnessed the growth and development of these companies over time. Therefore, I have a great deal of confidence in major companies.\n\n1"]}, {"persona": {"region": "Menya", "sex": "male", "age": 61, "country": "Egypt", "marital_status": "married", "education": "middle", "social_class": "working class"}, "question": {"id": "Q77", "variant": 0}, "response": ["Based on my anthropological understanding, I know that my cultural context as a married male from Menya, Egypt, and my working-class background greatly influence my perception of major companies. My age and socioeconomic background also play a role in shaping my views. I have learned to be cautious about putting too much trust in major companies, as I have seen how they can sometimes prioritize profit over the well-being of the workers and the community. Therefore, I would say that I have \"Not very much\" confidence in major companies.\n\n3"]}, {"persona": {"region": "Menya", "sex": "male", "age": 41, "country": "Egypt", "marital_status": "married", "education": "middle", "social_class": "lower middle class"}, "question": {"id": "Q77", "variant": 0}, "response": ["Based on my emic perspective as a married male from Menya, Egypt, and considering my lower middle class socioeconomic background, I have had limited interactions with major companies and have not had much exposure to their operations. Additionally, my cultural context and individual values lead me to have a cautious approach to trusting large corporations. Given the cultural relativism and nuanced understanding of my background, I would have to say that I have not had much exposure or reason to have a great deal of confidence in major companies.\n\n3"]}, {"persona": {"region": "Menya", "sex": "female", "age": 43, "country": "Egypt", "marital_status": "married", "education": "higher", "social_class": "working class"}, "question": {"id": "Q77", "variant": 0}, "response": ["Based on the anthropological framework, my emic perspective as a married female from Menya, Egypt, with a working-class background and higher education level, is influenced by my cultural context, individual values, and personal experience. In Menya, there is a strong sense of community and reliance on small businesses, so major companies may not hold as much influence or trust. Additionally, my personal experience and values as a working-class individual may lead me to have less confidence in major companies due to perceived inequalities and power dynamics. Therefore, I would choose option 3, \"Not very much,\" as my answer. \n\n3"]}, {"persona": {"region": "Menya", "sex": "male", "age": 57, "country": "Egypt", "marital_status": "married", "education": "middle", "social_class": "lower middle class"}, "question": {"id": "Q77", "variant": 0}, "response": ["Based on the anthropological framework, my emic perspective as a married male from Menya, Egypt, who is 57 years old and part of the lower middle class, is influenced by my cultural context, individual values, and socioeconomic background. In Menya, major companies may not have a strong presence or may not directly impact my daily life, therefore I may not have a strong sense of confidence in them. Additionally, my socioeconomic background as part of the lower middle class may lead me to have less trust in these companies due to potential economic disparities. Therefore, I would choose option 3: Not very much."]}, {"persona": {"region": "Menya", "sex": "male", "age": 42, "country": "Egypt", "marital_status": "divorced", "education": "middle", "social_class": "lower middle class"}, "question": {"id": "Q77", "variant": 0}, "response": ["Based on the anthropological framework, I would like to provide my answer based on my individual values and personal experience, as well as my socioeconomic background. As a divorced lower middle class male from Menya, Egypt, my personal experience and values have led me to have not very much confidence in major companies, as I have seen how they often prioritize profits over the well-being of individuals like myself. Additionally, my socioeconomic background has made me more skeptical of the intentions and actions of major companies, as I have often felt marginalized and taken advantage of by these entities. Therefore, my answer to the question is:\n3"]}, {"persona": {"region": "Menya", "sex": "female", "age": 59, "country": "Egypt", "marital_status": "married", "education": "middle", "social_class": "upper middle class"}, "question": {"id": "Q77", "variant": 0}, "response": ["Based on the anthropological framework, my perspective as a married female from Menya, Egypt, aged 59, with a middle education level and considering myself part of the upper middle class, is influenced by my cultural context, individual values, and socioeconomic background. In Menya, major companies may not have a strong presence, and my personal experience and values may lead me to have limited confidence in them. Additionally, my socioeconomic background as an upper middle-class individual may lead me to have some confidence, but not a great deal, in major companies due to potential concerns about corporate practices and their impact on society.\n\n3"]}, {"persona": {"region": "Menya", "sex": "female", "age": 31, "country": "Egypt", "marital_status": "married", "education": "middle", "social_class": "working class"}, "question": {"id": "Q77", "variant": 0}, "response": ["Based on the anthropological framework, my answer to the question about confidence in major companies is influenced by my emic perspective as a married female from Menya, Egypt, and my middle education level. In my cultural context, there is a strong emphasis on community and trust, and major companies may not always align with the values and needs of the working class. Additionally, my socioeconomic background as part of the working class may lead me to have less confidence in major companies, as their actions may not always benefit people like me. Therefore, my personal experience and values, as well as my cultural context and socioeconomic background, lead me to choose option 3: Not very much, as my level of confidence in major companies is not very high.\n\n3"]}, {"persona": {"region": "Menya", "sex": "male", "age": 55, "country": "Egypt", "marital_status": "single", "education": "middle", "social_class": "working class"}, "question": {"id": "Q77", "variant": 0}, "response": ["Based on my emic perspective as a working-class individual from Menya, Egypt, my confidence in major companies is influenced by my cultural context, individual values, and socioeconomic background. In my community, there is a general skepticism towards major companies due to their impact on local businesses and the economy. Additionally, my personal experience with these companies has not always been positive, leading to a lack of trust in their practices. As a middle-aged individual with a limited education, I have seen the struggles of the working class and how major companies often prioritize profits over the well-being of individuals like myself. Therefore, I would choose option (3) Not very much, as this aligns with my personal experience and the perspectives of my community. \n\n3"]}, {"persona": {"region": "Menya", "sex": "female", "age": 28, "country": "Egypt", "marital_status": "married", "education": "higher", "social_class": "lower middle class"}, "question": {"id": "Q77", "variant": 0}, "response": ["Based on the anthropological framework, my emic perspective as a married female from Menya, Egypt, who is 28 years old and part of the lower middle class, is heavily influenced by my cultural context, individual values, and socioeconomic background. In Egypt, major companies often have a significant impact on the economy and employment opportunities, so my confidence in them is tied to my personal experience and the experiences of those around me. Additionally, my lower middle class status may lead me to have less confidence in major companies due to potential economic disparities and lack of access to resources. Therefore, my perspective on the confidence in major companies is likely to be influenced by a combination of skepticism and cautious optimism. \n\n2"]}, {"persona": {"region": "Menya", "sex": "male", "age": 24, "country": "Egypt", "marital_status": "single", "education": "middle", "social_class": "working class"}, "question": {"id": "Q77", "variant": 0}, "response": ["Based on my emic perspective as a single male from Menya, Egypt, and my socioeconomic background as part of the working class, I have limited confidence in major companies. The cultural context in which I am situated and my personal experience with the working class lifestyle lead me to believe that major companies may not always have my best interests at heart. Additionally, my individual values and personal experience have shaped my perception of major companies, leading me to have a more skeptical view of their actions and intentions. Furthermore, cultural relativism reminds me that my perspective is valid and should be respected. Therefore, I choose option (3) Not very much. \n\n3"]}, {"persona": {"region": "Menya", "sex": "female", "age": 23, "country": "Egypt", "marital_status": "married", "education": "middle", "social_class": "working class"}, "question": {"id": "Q77", "variant": 0}, "response": ["Based on my emic perspective as a married female from Menya, Egypt, and my middle education level, I have learned to have a healthy skepticism towards major companies. My cultural context teaches me that these companies may not always have the best interests of individuals like myself in mind, and my socioeconomic background as part of the working class further reinforces this viewpoint. Additionally, cultural relativism reminds me that different cultures and social backgrounds may have different experiences and perceptions of major companies. Therefore, I would choose option (3) Not very much."]}, {"persona": {"region": "Menya", "sex": "male", "age": 27, "country": "Egypt", "marital_status": "single", "education": "middle", "social_class": "lower middle class"}, "question": {"id": "Q77", "variant": 0}, "response": ["From the emic perspective, as a single male from Menya, Egypt, who has completed middle education level and considers himself part of the lower middle class, my cultural context and socioeconomic background play a significant role in shaping my views on major companies. In Menya, there is a strong sense of community and reliance on small local businesses rather than major corporations. Additionally, my lower middle class status means that I may have experienced economic hardships and distrust towards larger companies that may not have always worked in my favor. Furthermore, my individual values and personal experiences have likely influenced my perception of major companies, leading me to have less confidence in them. Overall, the combination of cultural relativism, space and time, and nuance in my understanding of the question leads me to choose the following option:\n\n3. Not very much"]}, {"persona": {"region": "Asyut", "sex": "male", "age": 30, "country": "Egypt", "marital_status": "married", "education": "middle", "social_class": "working class"}, "question": {"id": "Q77", "variant": 0}, "response": ["Based on the anthropological framework, the emic perspective of a married male from Asyut, Egypt, who is 30 years old, has completed middle education, and considers himself part of the working class, would be influenced by his cultural context, individual values and personal experience, and socioeconomic background. In Egypt, major companies may not have a positive reputation among the working class, as they may have experienced exploitation or lack of opportunities for economic advancement. Additionally, the individual's personal experience and values may lead him to have less confidence in major companies due to potential negative experiences or a belief in the importance of supporting local businesses. Therefore, the most likely answer from this perspective would be (3) Not very much.\n\n3"]}, {"persona": {"region": "Asyut", "sex": "female", "age": 26, "country": "Egypt", "marital_status": "married", "education": "middle", "social_class": "working class"}, "question": {"id": "Q77", "variant": 0}, "response": ["Based on the anthropological framework, my perspective as a married female from Asyut, Egypt, who is 26 years old, has completed middle education, and considers myself part of the working class, is heavily influenced by my cultural context, socioeconomic background, and personal experience. In Asyut, major companies may not have a positive reputation due to economic disparities and the working class may not have as much confidence in them compared to those in higher socioeconomic classes. Additionally, my personal experience and values may lead me to be more cautious and skeptical of major companies. Therefore, I would choose option (3) Not very much."]}, {"persona": {"region": "Asyut", "sex": "male", "age": 32, "country": "Egypt", "marital_status": "single", "education": "higher", "social_class": "lower middle class"}, "question": {"id": "Q77", "variant": 0}, "response": ["Based on the anthropological framework, my emic perspective as a single male from Asyut, Egypt, who is 32 years old and part of the lower middle class, is influenced by my cultural context, individual values, and personal experience. In my cultural context, major companies may not have a strong presence in my community, and my personal experience and values may lead me to have less confidence in them due to potential negative impacts on local businesses and the economy. Additionally, my socioeconomic background may also contribute to a lack of trust in major companies due to concerns about exploitation and unfair practices. Therefore, my answer to the question is:\n3\n\n(3) Not very much"]}, {"persona": {"region": "Asyut", "sex": "female", "age": 21, "country": "Egypt", "marital_status": "married", "education": "middle", "social_class": "working class"}, "question": {"id": "Q77", "variant": 0}, "response": ["Based on the anthropological framework, my response to the question of how much confidence I have in major companies would be heavily influenced by my cultural context, individual values, and socioeconomic background. As a married female from Asyut, Egypt, I come from a working-class background and have only completed middle education level. This means that I am likely to have limited exposure to major companies and may not have had positive experiences with them. Additionally, in my cultural context, there may be a general skepticism towards large corporations. Therefore, my answer would be (3) Not very much, as I may not have much trust in major companies based on my personal experiences and socioeconomic background."]}, {"persona": {"region": "Asyut", "sex": "female", "age": 30, "country": "Egypt", "marital_status": "married", "education": "higher", "social_class": "working class"}, "question": {"id": "Q77", "variant": 0}, "response": ["Based on the anthropological framework, my perspective as a married female from Asyut, Egypt, who is 30 years old, has completed higher education, and considers herself part of the working class, is influenced by a combination of my cultural context, individual values, and socioeconomic background. In Egypt, there is a general skepticism towards major companies, especially among the working class. This skepticism is rooted in the historical and cultural context of distrust towards large corporations and the belief that they prioritize profit over the well-being of the people. Additionally, my personal experience and values lead me to question the actions and intentions of major companies, as I have seen how they can exploit the working class and prioritize their own interests. Therefore, I would choose option (3) \"Not very much\" as my answer, reflecting the lack of confidence I have in major companies based on my cultural, personal, and socioeconomic perspective. \n\n3"]}, {"persona": {"region": "Asyut", "sex": "female", "age": 42, "country": "Egypt", "marital_status": "married", "education": "higher", "social_class": "lower middle class"}, "question": {"id": "Q77", "variant": 0}, "response": ["Based on my emic perspective as a lower middle-class married woman from Asyut, Egypt, my confidence in major companies is influenced by my cultural context, individual values, and socioeconomic background. In my cultural context, there is a level of skepticism towards major companies due to past experiences of economic instability and corruption. Additionally, my personal values of honesty and transparency lead me to have a lower level of confidence in these companies. As a member of the lower middle class, I am also aware of the impact of major companies on my socioeconomic background and have witnessed how their actions can negatively affect my community and family. Therefore, I would choose option 3: Not very much. \n\n3"]}, {"persona": {"region": "Sohag", "sex": "male", "age": 63, "country": "Egypt", "marital_status": "married", "education": "middle", "social_class": "lower middle class"}, "question": {"id": "Q77", "variant": 0}, "response": ["Based on the anthropological framework, as a married male from Sohag, Egypt, my emic perspective on the confidence in major companies is influenced by my cultural context, individual values, and socioeconomic background. In Sohag, major companies may not have a significant presence and may not directly impact my life. As a member of the lower middle class, I may have had limited exposure to major companies and may not have had positive experiences with them. Additionally, my age and education level may also contribute to a more cautious and skeptical view of major companies. Therefore, my answer would be (3) Not very much."]}, {"persona": {"region": "Sohag", "sex": "male", "age": 27, "country": "Egypt", "marital_status": "married", "education": "middle", "social_class": "working class"}, "question": {"id": "Q77", "variant": 0}, "response": ["Based on the anthropological framework, my response to the question about confidence in major companies is influenced by my cultural context, individual values, and socioeconomic background. Coming from Sohag, Egypt, a region with a predominantly working-class population, I have been exposed to the struggles and challenges faced by individuals and families in my community. This has shaped my perception of major companies and their impact on society. Additionally, my middle education level has provided me with a basic understanding of economic and social dynamics, leading me to believe that major companies may not always have the best interests of the working class in mind. Therefore, my confidence in major companies is not very much. \n\n3"]}, {"persona": {"region": "Sohag", "sex": "male", "age": 56, "country": "Egypt", "marital_status": "married", "education": "higher", "social_class": "upper middle class"}, "question": {"id": "Q77", "variant": 0}, "response": ["Based on the anthropological framework, my perspective as a married male from Sohag, Egypt, who is 56 years old, highly educated, and part of the upper middle class, is influenced by my cultural context, individual values, and socioeconomic background. In my cultural context, there is a level of trust and confidence in major companies, as they are often seen as stable and reliable sources of employment and economic growth. Additionally, my individual values and personal experience have led me to have a great deal of confidence in major companies, as I have seen them contribute to the economic development of my community and provide opportunities for my family and others in my social network. Furthermore, my socioeconomic background as part of the upper middle class has also influenced my confidence in major companies, as I have likely benefitted from their success and stability. Taking all of these factors into consideration, my perspective on the confidence in major companies is a great deal. \n\n1"]}, {"persona": {"region": "Sohag", "sex": "male", "age": 51, "country": "Egypt", "marital_status": "married", "education": "higher", "social_class": "lower middle class"}, "question": {"id": "Q77", "variant": 0}, "response": ["Based on the anthropological framework, my perspective as a married male from Sohag, Egypt, who is 51 years old and considers himself part of the lower middle class, is heavily influenced by my cultural context, socioeconomic background, and personal experience. In Sohag, major companies may not have a strong presence or may not be accessible to individuals from my socioeconomic background. Additionally, my personal experience and values may lead me to have less confidence in major companies due to issues of trust, access, or personal experiences with these companies. Therefore, my answer to the question would be:\n\n3"]}, {"persona": {"region": "Sohag", "sex": "female", "age": 26, "country": "Egypt", "marital_status": "married", "education": "higher", "social_class": "working class"}, "question": {"id": "Q77", "variant": 0}, "response": ["Based on the anthropological framework, as a 26-year-old married female from Sohag, Egypt, who completed higher education and considers myself part of the working class, my confidence in major companies would be influenced by my individual values and personal experiences. As someone who is likely to have experienced economic hardships and inequality, I may have a more skeptical view of major companies and their impact on society. Additionally, my socioeconomic background as part of the working class may lead me to question the ethics and practices of these companies, further influencing my lack of confidence in them. Considering the cultural context of Egypt, where there may be a history of distrust in large corporations, and the nuance of my personal experiences, I would choose option (3) Not very much. \n\n3"]}, {"persona": {"region": "Sohag", "sex": "female", "age": 29, "country": "Egypt", "marital_status": "married", "education": "higher", "social_class": "upper middle class"}, "question": {"id": "Q77", "variant": 0}, "response": ["Based on the anthropological framework, as a married female from Sohag, Egypt, my cultural context, individual values, and personal experience play a significant role in shaping my perspective. In my community, there is a strong emphasis on trust and reliability, and I have personally had positive experiences with major companies. Additionally, my educational background and upper middle-class status have provided me with the resources to engage with these companies and have led to positive interactions. Considering the nuanced phrasing of the question, I would choose option (2) \"Quite a lot\" as my confidence in major companies. \n\n2"]}, {"persona": {"region": "Sohag", "sex": "male", "age": 51, "country": "Egypt", "marital_status": "married", "education": "middle", "social_class": "lower middle class"}, "question": {"id": "Q77", "variant": 0}, "response": ["Based on my emic perspective as a married male from Sohag, Egypt, my cultural context, individual values and personal experience, socioeconomic background, and space and time all play a role in shaping my answer to the question about confidence in major companies. In my cultural context, there is a general mistrust of major companies due to economic disparities and historical exploitation. As a middle-aged, lower-middle-class man, I have personally experienced the challenges of economic instability and have seen how major companies often prioritize profit over the well-being of individuals like myself. Therefore, I have limited confidence in major companies due to my personal experiences and the cultural context in which I live. \n\n3"]}, {"persona": {"region": "Qena", "sex": "male", "age": 32, "country": "Egypt", "marital_status": "single", "education": "middle", "social_class": "working class"}, "question": {"id": "Q77", "variant": 0}, "response": ["Based on the anthropological framework, my perspective as a single male from Qena, Egypt, is heavily influenced by my cultural context, individual values, and socioeconomic background. Coming from a working-class background, I have had limited exposure to major companies and their operations. Additionally, my middle education level has not provided me with much knowledge about these companies. Therefore, I have not had the opportunity to develop a great deal of confidence in major companies. Furthermore, the cultural relativism aspect of the framework reminds me that my perspective is shaped by my specific circumstances and may not be universal. \n\n3"]}, {"persona": {"region": "Qena", "sex": "male", "age": 54, "country": "Egypt", "marital_status": "married", "education": "middle", "social_class": "lower middle class"}, "question": {"id": "Q77", "variant": 0}, "response": ["Based on my emic perspective as a married male from Qena, Egypt, and considering my lower middle class socioeconomic background, I have learned to be cautious and not place too much confidence in major companies. In my cultural context, major companies are often seen as distant and untrustworthy, and my individual values and personal experience have taught me to be wary of putting too much faith in them. Additionally, the concept of cultural relativism reminds me that different cultures may have different perspectives on major companies, and my age and place in society also play a role in shaping my view. Therefore, I would choose option (3) Not very much. \n\n3"]}, {"persona": {"region": "Qena", "sex": "male", "age": 25, "country": "Egypt", "marital_status": "single", "education": "lower", "social_class": "lower class"}, "question": {"id": "Q77", "variant": 0}, "response": ["Based on my cultural context, as a single male from Qena, Egypt, who has completed only lower education and considers myself part of the lower class, my socioeconomic background plays a significant role in shaping my perceptions. My individual values and personal experiences have also influenced my level of confidence in major companies. I have witnessed firsthand the struggles of individuals in my community due to the actions of major companies, which has led me to have not very much confidence in them. Additionally, the cultural relativism in my community has shaped my understanding of the impact of major companies on the lives of those in the lower class. Therefore, my perspective is that of someone who does not have much confidence in major companies.\n\n3"]}, {"persona": {"region": "Aswan", "sex": "male", "age": 34, "country": "Egypt", "marital_status": "single", "education": "middle", "social_class": "lower class"}, "question": {"id": "Q77", "variant": 0}, "response": ["Based on the anthropological framework, as a single male from Aswan, Egypt, who considers himself part of the lower class, my perspective on major companies is influenced by my cultural context, socioeconomic background, and personal experience. In Aswan, the lower class often faces economic struggles and limited opportunities, leading to a lack of trust in major companies. Additionally, my age and educational level also play a role in shaping my views. Therefore, my answer to the question is:\n\n3"]}, {"persona": {"region": "Aswan", "sex": "female", "age": 31, "country": "Egypt", "marital_status": "married", "education": "middle", "social_class": "lower middle class"}, "question": {"id": "Q77", "variant": 0}, "response": ["Based on the anthropological framework, my perspective as a married female from Aswan, Egypt, at 31 years of age and part of the lower middle class, is heavily influenced by my cultural context and socioeconomic background. In Aswan, there is a strong sense of community and reliance on local businesses and networks. Major companies may not have a significant presence in my daily life, and my trust in them may be limited due to my socioeconomic status. Additionally, my individual values and personal experience may lead me to have less confidence in major companies, as I may have experienced challenges in accessing their products or services. Therefore, my answer is:\n\n3"]}, {"persona": {"region": "Aswan", "sex": "female", "age": 39, "country": "Egypt", "marital_status": "married", "education": "middle", "social_class": "working class"}, "question": {"id": "Q77", "variant": 0}, "response": ["Based on the anthropological framework, my perspective as a married female from Aswan, Egypt, who is 39 years old, has completed middle education, and considers herself part of the working class, is heavily influenced by my cultural context, individual values, and socioeconomic background. In Aswan, there is a strong sense of community and reliance on local businesses and small-scale enterprises. As a member of the working class, I have limited trust in major companies due to their often exploitative practices and lack of concern for the well-being of workers and local communities. Additionally, my middle education level and experiences in the workforce have shaped my critical perspective on the actions of major companies. Therefore, my answer to the question of how much confidence I have in major companies is (3) Not very much. \n\n3"]}, {"persona": {"region": "Qena", "sex": "female", "age": 27, "country": "Egypt", "marital_status": "married", "education": "lower", "social_class": "lower middle class"}, "question": {"id": "Q77", "variant": 0}, "response": ["Based on the anthropological framework, my emic perspective as a lower middle class, lower educated married woman from Qena, Egypt would be influenced by my cultural context, individual values, and socioeconomic background. In my cultural context, major companies are often seen as distant entities that do not prioritize the needs of individuals like me. My individual values and personal experience have taught me to be cautious and skeptical of large corporations, as they often do not have my best interests in mind. Additionally, my lower middle class socioeconomic background means that I may have had negative personal experiences with major companies, such as unfair treatment or exploitation. Therefore, my confidence in major companies would be (3) Not very much."]}, {"persona": {"region": "Qena", "sex": "male", "age": 40, "country": "Egypt", "marital_status": "single", "education": "middle", "social_class": "lower middle class"}, "question": {"id": "Q77", "variant": 0}, "response": ["From the perspective of a single male from Qena, Egypt, who is 40 years old and part of the lower middle class, several factors come into play when considering his confidence in major companies. His cultural context and socioeconomic background will influence his level of trust in these companies, as he may have had experiences of economic hardship and may be more skeptical of corporate entities. Additionally, his individual values and personal experiences may have shaped his perception of major companies, leading to a more cautious approach. Therefore, considering the emic perspective of this persona, the most likely answer would be:\n3. Not very much"]}, {"persona": {"region": "Qena", "sex": "male", "age": 30, "country": "Egypt", "marital_status": "single", "education": "middle", "social_class": "working class"}, "question": {"id": "Q77", "variant": 0}, "response": ["Based on the anthropological framework, my emic perspective as a working-class male from Qena, Egypt, at the age of 30 with a middle education level, is heavily influenced by my cultural context, individual values, and socioeconomic background. In my community, major companies are often seen as distant entities that may not always have the best interests of people like me at heart. My personal experience and values lead me to have not very much confidence in major companies, as I have seen how they can prioritize profits over the well-being of individuals. Additionally, my socioeconomic background as a working-class individual also plays a role in shaping my perception of these companies. Therefore, my answer to the question is:\n\n3"]}]