[{"persona": {"region": "Fayoum", "sex": "male", "age": 46, "country": "Egypt", "marital_status": "married", "education": "higher", "social_class": "lower middle class"}, "question": {"id": "Q124", "variant": 0}, "response": ["Based on the anthropological framework, my perspective as a married male from Fayoum, Egypt, aged 46 and part of the lower middle class, is heavily influenced by my cultural context, individual values, and socioeconomic background. In Egypt, immigration and crime are often linked in public discourse, and my personal experience and values may lead me to a particular viewpoint. Additionally, the cultural relativism perspective reminds me that my understanding of crime and immigration may differ from others due to the nuanced phrasing of the question. Therefore, I choose option (2) Hard to say, as my understanding of immigration and crime in Egypt is complex and influenced by various factors that may not be captured in a simple agree or disagree response."]}, {"persona": {"region": "Fayoum", "sex": "female", "age": 30, "country": "Egypt", "marital_status": "married", "education": "middle", "social_class": "lower middle class"}, "question": {"id": "Q124", "variant": 0}, "response": ["Based on the anthropological framework, my perspective as a married female from Fayoum, Egypt, who is 30 years old and part of the lower middle class, is influenced by my cultural context, individual values, and socioeconomic background. In Egypt, immigration is a complex issue, and the impact on crime rates varies depending on the specific circumstances. As a member of the lower middle class, I am aware of the economic struggles faced by many immigrants, which may lead to involvement in illegal activities. However, I also recognize that immigrants contribute to the cultural diversity and labor market of our country, which can have positive effects on the economy. Ultimately, the nuanced phrasing of the question and the cultural relativism of the issue lead me to choose option (2) Hard to say. \n\n2"]}, {"persona": {"region": "Fayoum", "sex": "male", "age": 60, "country": "Egypt", "marital_status": "married", "education": "higher", "social_class": "working class"}, "question": {"id": "Q124", "variant": 0}, "response": ["Based on the anthropological framework, my cultural context as a married male from Fayoum, Egypt, my age of 60 and completion of higher education, and my identification with the working class will greatly influence my perspective on immigration and crime. The emic and etic perspectives within my community may lead me to view immigration as a potential threat to job security and social stability, leading to a potential increase in crime. Additionally, my personal experience and individual values may lead me to prioritize the impact of immigration on my own economic and social well-being. However, I also recognize the importance of cultural relativism and nuance in understanding the complexities of immigration and crime in my country. \n\n3"]}, {"persona": {"region": "Fayoum", "sex": "male", "age": 20, "country": "Egypt", "marital_status": "single", "education": "middle", "social_class": "lower middle class"}, "question": {"id": "Q124", "variant": 0}, "response": ["Based on my personal experience and socioeconomic background, I believe that immigration in my country does not necessarily increase the crime rate. As a member of the lower middle class in Fayoum, Egypt, I have seen immigrants come to our country seeking better opportunities and a chance at a better life. I understand that their cultural context and individual values may be different from mine, but I do not believe that this automatically leads to an increase in crime. Furthermore, I recognize the importance of cultural relativism and the nuance of each situation, so I cannot make a blanket statement about immigration and crime without considering the specific circumstances. \n\n3"]}, {"persona": {"region": "Fayoum", "sex": "female", "age": 39, "country": "Egypt", "marital_status": "married", "education": "higher", "social_class": "lower middle class"}, "question": {"id": "Q124", "variant": 0}, "response": ["Based on the anthropological framework, my emic perspective as a married female from Fayoum, Egypt, who is 39 years old, has completed higher education, and considers herself part of the lower middle class, is influenced by my cultural context, individual values, and socioeconomic background. In Egypt, immigration is often perceived as a threat to job opportunities and resources, which can lead to tensions and potentially an increase in crime rates. Additionally, my personal experience and values may lead me to feel protective of my community and view immigration as a potential risk. However, I also understand the importance of cultural relativism and nuance, recognizing that immigration can also bring diversity and opportunities for cultural exchange. Therefore, my perspective on the impact of immigration on crime rates in Egypt is influenced by a complex interplay of factors, making it hard to say definitively whether immigration increases the crime rate. \n\n3"]}, {"persona": {"region": "Fayoum", "sex": "male", "age": 33, "country": "Egypt", "marital_status": "married", "education": "higher", "social_class": "working class"}, "question": {"id": "Q124", "variant": 0}, "response": ["Based on the anthropological framework, as a married male from Fayoum, Egypt, my emic perspective is influenced by my cultural context, individual values, and socioeconomic background. In Egypt, immigration is often associated with economic hardship and social tension, as immigrants may struggle to find work and integrate into society. This can lead to increased competition for resources and opportunities, potentially leading to an increase in crime. Additionally, my working class background has made me more aware of the struggles faced by immigrants and the potential impact on crime rates. Therefore, I would select:\n\n2"]}, {"persona": {"region": "Port Said", "sex": "female", "age": 45, "country": "Egypt", "marital_status": "married", "education": "higher", "social_class": "lower middle class"}, "question": {"id": "Q124", "variant": 0}, "response": ["Based on the anthropological framework, as a married female from Port Said, Egypt, my emic perspective is influenced by my cultural context, individual values, and socioeconomic background. In my community, immigration is often viewed as a threat to the local job market and resources, which can lead to social tensions. Additionally, my personal experience and values lead me to believe that a lower middle-class individual like myself may feel the economic strain of immigration, potentially leading to increased crime rates. Therefore, I would have to agree that immigration in my country increases the crime rate.\n\n1"]}, {"persona": {"region": "Port Said", "sex": "male", "age": 42, "country": "Egypt", "marital_status": "married", "education": "middle", "social_class": "lower middle class"}, "question": {"id": "Q124", "variant": 0}, "response": ["Based on my cultural context in Port Said, Egypt, I understand that immigration has been a topic of concern in my community. My personal experience and values lead me to believe that immigration does not necessarily increase the crime rate. I have seen immigrants in my community who work hard and contribute positively to our society. Additionally, cultural relativism teaches me that it is important to understand and respect different cultures, including those of immigrants. Furthermore, my lower middle class socioeconomic background has shown me that many immigrants come to Egypt in search of better opportunities, not to commit crimes. Therefore, I would have to disagree with the statement that immigration in my country increases the crime rate.\n\n3"]}, {"persona": {"region": "Port Said", "sex": "male", "age": 28, "country": "Egypt", "marital_status": "single", "education": "middle", "social_class": "lower middle class"}, "question": {"id": "Q124", "variant": 0}, "response": ["Based on the anthropological framework, my response is influenced by my cultural context, socioeconomic background, and personal experience. As a single male from Port Said, Egypt, I am part of the lower middle class and have completed middle education level. In my cultural context, immigration is a complex issue with various nuances. I understand that immigration can bring economic challenges and competition for resources, which may lead to higher crime rates in some areas. However, I also recognize that immigrants often face socio-economic hardships and discrimination, which can contribute to their involvement in crime. Additionally, I am aware that the portrayal of immigrants in the media and political discourse may influence public perceptions and contribute to negative stereotypes. Therefore, my answer to the question \"Does immigration in your country increase the crime rate?\" is:\n\n2. Hard to say"]}, {"persona": {"region": "Port Said", "sex": "female", "age": 30, "country": "Egypt", "marital_status": "married", "education": "higher", "social_class": "lower middle class"}, "question": {"id": "Q124", "variant": 0}, "response": ["Based on the anthropological framework, my perspective is shaped by my cultural context, individual values, and socioeconomic background. As a married female from Port Said, Egypt, who has completed higher education and considers myself part of the lower middle class, my understanding of immigration and its impact on crime rate is influenced by my personal experiences and values. Additionally, the cultural relativism framework reminds me that there is no hierarchy of culture, and I should approach the question with an open mind. Therefore, I choose option (2) - Hard to say, as I believe that immigration and crime rate are complex issues that cannot be simply generalized."]}, {"persona": {"region": "Port Said", "sex": "male", "age": 30, "country": "Egypt", "marital_status": "divorced", "education": "middle", "social_class": "lower middle class"}, "question": {"id": "Q124", "variant": 0}, "response": ["Based on the anthropological framework, my emic perspective as a divorced male from Port Said, Egypt, at the age of 30, with a middle education level and lower middle-class background, is influenced by my cultural context, individual values, and personal experience. In Egypt, many people in my socioeconomic background face economic challenges, and there is a sense of competition for limited resources. This may lead to a perception that immigrants are taking away opportunities, potentially leading to a higher crime rate. However, I also understand the importance of cultural relativism and nuance in the understanding of immigration and crime. Therefore, I would say it is hard to say.\n\n2"]}, {"persona": {"region": "Port Said", "sex": "female", "age": 19, "country": "Egypt", "marital_status": "single", "education": "middle", "social_class": "lower middle class"}, "question": {"id": "Q124", "variant": 0}, "response": ["Based on my cultural context in Port Said, Egypt, where I come from, immigration is often seen as a source of competition for jobs and resources, which can sometimes lead to tensions and conflicts. Additionally, the socioeconomic background of many immigrants often places them in lower-income areas, which can be associated with higher crime rates. However, I also understand the importance of cultural relativism and the need to avoid generalizations, so it would be hard to say definitively whether immigration increases the crime rate in my country. \n\n2"]}, {"persona": {"region": "Fayoum", "sex": "male", "age": 40, "country": "Egypt", "marital_status": "married", "education": "middle", "social_class": "working class"}, "question": {"id": "Q124", "variant": 0}, "response": ["Based on the anthropological framework, as a married male from Fayoum, Egypt, I would approach the question of immigration and crime rate from an emic perspective, considering the cultural context and my individual values and personal experience. In Egypt, there is a strong emphasis on family and community, and immigration is often seen as a means to provide for one's family. Additionally, my socioeconomic background as part of the working class may lead me to sympathize with immigrants seeking better opportunities. Furthermore, cultural relativism teaches us that there is no hierarchy of culture, and as such, I would not make assumptions about immigrants contributing to an increase in crime. Therefore, I would choose option (3) Disagree, as I believe that immigration does not necessarily lead to an increase in crime in my country. \n\n3"]}, {"persona": {"region": "Fayoum", "sex": "male", "age": 23, "country": "Egypt", "marital_status": "single", "education": "higher", "social_class": "lower middle class"}, "question": {"id": "Q124", "variant": 0}, "response": ["Based on the anthropological framework, my emic perspective as a single male from Fayoum, Egypt, who considers himself part of the lower middle class, is heavily influenced by my cultural context, individual values, and personal experience. In my community, immigration is often viewed as a source of competition for limited resources, which can lead to tensions and potentially contribute to an increase in crime. Additionally, my socioeconomic background has shaped my understanding of immigration and its potential impacts. Therefore, I would lean towards agreeing that immigration in my country may increase the crime rate.\n\n1"]}, {"persona": {"region": "Fayoum", "sex": "female", "age": 38, "country": "Egypt", "marital_status": "married", "education": "middle", "social_class": "lower middle class"}, "question": {"id": "Q124", "variant": 0}, "response": ["Based on the anthropological framework, my perspective as a married female from Fayoum, Egypt, at 38 years of age and of lower middle class status, is influenced by my cultural context, socioeconomic background, and personal experience. In Egypt, immigration is often associated with an increase in crime due to the influx of people from different cultural backgrounds and economic hardships. Additionally, as someone from the lower middle class, I may feel more directly impacted by any potential increase in crime. Therefore, I would tend to agree that immigration in my country increases the crime rate.\n\n2"]}, {"persona": {"region": "Fayoum", "sex": "male", "age": 32, "country": "Egypt", "marital_status": "married", "education": "middle", "social_class": "lower middle class"}, "question": {"id": "Q124", "variant": 0}, "response": ["Based on the anthropological framework, my emic perspective as a married male from Fayoum, Egypt, with a lower middle class socioeconomic background and middle education level, would lead me to consider the cultural context, individual values, and personal experiences in my response. In Egypt, immigration may be seen as a potential threat due to economic competition and cultural differences, potentially leading to an increase in crime. My personal experience and values may also lead me to believe that immigration can strain already limited resources, leading to potential social tensions and an increase in crime. Therefore, based on my background and understanding, I would have to agree that immigration in my country may increase the crime rate.\n\n1"]}, {"persona": {"region": "Fayoum", "sex": "male", "age": 31, "country": "Egypt", "marital_status": "married", "education": "higher", "social_class": "working class"}, "question": {"id": "Q124", "variant": 0}, "response": ["Based on the anthropological framework, as a married male from Fayoum, Egypt, my emic perspective would be influenced by my cultural context, individual values, and socioeconomic background. In Egypt, immigration is a complex issue that is tied to economic and social factors. The influx of immigrants may be seen as a burden on resources and job opportunities, leading to potential competition and tension. Additionally, my working-class background may lead me to believe that immigration could potentially increase the crime rate due to economic strain and social conflict. Therefore, I would choose option (1) Agree."]}, {"persona": {"region": "Fayoum", "sex": "male", "age": 31, "country": "Egypt", "marital_status": "married", "education": "middle", "social_class": "lower middle class"}, "question": {"id": "Q124", "variant": 0}, "response": ["Based on the anthropological framework, I am a married male from Fayoum, Egypt, and my cultural context, socioeconomic background, and personal experience all inform my perspective. In my community, immigration is often viewed as a way to improve one's economic situation and provide for their family. However, there are also concerns about competition for jobs and resources, which can lead to tensions. Additionally, I understand that immigrants may face discrimination and challenges in integrating into the community, which could potentially lead to an increase in crime. Therefore, I am inclined to say that immigration in my country may have some impact on the crime rate, but it is hard to say for certain without considering the specific circumstances and experiences of different immigrant groups. \n\n2"]}, {"persona": {"region": "Fayoum", "sex": "female", "age": 32, "country": "Egypt", "marital_status": "married", "education": "middle", "social_class": "lower middle class"}, "question": {"id": "Q124", "variant": 0}, "response": ["From the perspective of a married female from Fayoum, Egypt, who has completed middle education level and considers herself part of the lower middle class, there are several factors to consider in answering the question about immigration and crime rate. First, cultural context is important as Egypt has a diverse population with different ethnic and religious groups. Socioeconomic background also plays a role, as lower middle class individuals may feel the effects of immigration and potential crime differently than those in higher socioeconomic brackets. Additionally, cultural relativism is crucial in understanding that different cultures and backgrounds may have varying perspectives on immigration and its impact on crime. Furthermore, individual values and personal experience may influence the perception of this issue, as personal experiences with immigration and crime may shape one's viewpoint. Taking these factors into account, I would choose option (2) Hard to say, as there are multiple nuanced factors at play and it is difficult to make a blanket statement about the relationship between immigration and crime. \n\n2"]}, {"persona": {"region": "Ismailia", "sex": "male", "age": 53, "country": "Egypt", "marital_status": "married", "education": "middle", "social_class": "lower middle class"}, "question": {"id": "Q124", "variant": 0}, "response": ["Based on the anthropological framework, as a married male from Ismailia, Egypt, my perspective is heavily influenced by my cultural context, socioeconomic background, and age. In Egypt, immigration is often associated with economic hardship and social tensions, which can lead to an increase in crime rates. Additionally, as someone from the lower middle class, I may feel the impact of immigration on job availability and resources more acutely, which could potentially influence my perception of its impact on crime. Furthermore, my age and level of education may also shape my perspective, as older individuals and those with lower levels of education may be more likely to perceive immigration as a threat. Overall, my personal experience and cultural context lead me to agree that immigration in my country increases the crime rate.\n\n2"]}, {"persona": {"region": "Ismailia", "sex": "male", "age": 38, "country": "Egypt", "marital_status": "married", "education": "higher", "social_class": "working class"}, "question": {"id": "Q124", "variant": 0}, "response": ["Based on my personal experience and cultural context, I understand that immigration can be a sensitive topic. From an emic perspective, I have witnessed how immigration has changed the dynamics of my community and the socioeconomic background plays a role in shaping these changes. Cultural relativism also reminds me that every culture and individual experience is unique, and there is no one-size-fits-all answer. Therefore, I choose to say: \n\n2"]}, {"persona": {"region": "Ismailia", "sex": "female", "age": 35, "country": "Egypt", "marital_status": "married", "education": "middle", "social_class": "lower middle class"}, "question": {"id": "Q124", "variant": 0}, "response": ["Based on the anthropological framework, as a married female from Ismailia, Egypt, my emic perspective is influenced by my cultural context, individual values, and socioeconomic background. In Egypt, immigration is often associated with economic hardship and social tension, which can lead to an increase in crime. Additionally, my lower middle class background means that I am more likely to be affected by any rise in crime rates. Considering the nuanced phrasing of the question and taking into account my personal experience and cultural relativism, I would choose:\n\n2) Hard to say"]}, {"persona": {"region": "Ismailia", "sex": "female", "age": 57, "country": "Egypt", "marital_status": "married", "education": "lower", "social_class": "working class"}, "question": {"id": "Q124", "variant": 0}, "response": ["Based on the anthropological framework, cultural context, socioeconomic background, and individual values and personal experience play a significant role in shaping one's perspective on immigration and crime. As a married female from Ismailia, Egypt, at the age of 57 with lower education and a working-class background, my understanding of immigration and crime is influenced by my cultural context and personal experience. In Egypt, immigration is often seen as a means of economic opportunity and escape from political turmoil. However, it can also lead to competition for resources and employment, potentially contributing to social tensions and crime in certain areas. Therefore, I would say that it is hard to say whether immigration in my country increases the crime rate. \n\n2"]}, {"persona": {"region": "Ismailia", "sex": "male", "age": 33, "country": "Egypt", "marital_status": "married", "education": "middle", "social_class": "lower middle class"}, "question": {"id": "Q124", "variant": 0}, "response": ["Considering my cultural context, socioeconomic background, and personal experience, I would have to say that immigration does not necessarily increase the crime rate in my country. From my emic perspective, I have witnessed immigrants coming to Ismailia and working hard to make a living, just like many locals. I also understand the cultural relativism and nuance involved in this issue, as immigration can be a complex and multifaceted phenomenon. Additionally, I believe that individual values and personal experience play a significant role in how people perceive immigrants and their impact on crime rates. Overall, I would have to disagree with the statement that immigration increases the crime rate in my country.\n\n3"]}, {"persona": {"region": "Ismailia", "sex": "female", "age": 49, "country": "Egypt", "marital_status": "single", "education": "higher", "social_class": "upper middle class"}, "question": {"id": "Q124", "variant": 0}, "response": ["Based on the anthropological framework, my emic perspective as a single female from Ismailia, Egypt, who is 49 years old and part of the upper middle class, is influenced by my cultural context, individual values, and personal experience. In Egypt, immigration is often perceived as a positive contribution to the economy and cultural diversity. My socioeconomic background also plays a role in my perception, as I may have more exposure to positive experiences with immigrants due to my higher education level and socioeconomic status. Additionally, cultural relativism emphasizes the importance of understanding and respecting different cultures, which may lead me to disagree with the notion that immigration increases crime rates in my country.\n\n3"]}, {"persona": {"region": "Ismailia", "sex": "female", "age": 35, "country": "Egypt", "marital_status": "married", "education": "higher", "social_class": "lower middle class"}, "question": {"id": "Q124", "variant": 0}, "response": ["Based on the anthropological framework, my answer to the question of whether immigration in my country increases the crime rate is influenced by my emic perspective as a married female from Ismailia, Egypt. The cultural context of Egypt, including its socioeconomic background and cultural relativism, plays a significant role in shaping my understanding of this issue. Additionally, my individual values and personal experiences, as well as the nuance of the question, all contribute to my perspective. Therefore, I select:\n\n2) Hard to say"]}, {"persona": {"region": "Ismailia", "sex": "male", "age": 24, "country": "Egypt", "marital_status": "single", "education": "higher", "social_class": "upper middle class"}, "question": {"id": "Q124", "variant": 0}, "response": ["Based on the anthropological framework, as a single male from Ismailia, Egypt, I understand the importance of considering the cultural context and socioeconomic background in addressing the question of immigration and crime rate. In Egypt, there is a complex mix of cultural values and socioeconomic disparities that must be taken into account. Additionally, individual experiences and personal values play a significant role in shaping perspectives on this issue. Therefore, my answer is: \n\n2) Hard to say"]}, {"persona": {"region": "Ismailia", "sex": "female", "age": 23, "country": "Egypt", "marital_status": "single", "education": "higher", "social_class": "lower middle class"}, "question": {"id": "Q124", "variant": 0}, "response": ["Based on the anthropological framework, as a single female from Ismailia, Egypt, my perspective is heavily influenced by my cultural context, individual values, and socioeconomic background. In my community, immigration is often seen as a way for individuals to seek better opportunities and provide for their families. However, the socioeconomic background of immigrants may lead to marginalization and limited access to resources, which could potentially contribute to higher crime rates in certain areas. Additionally, my personal experience and understanding of the nuance involved in immigration and crime rates in my country lead me to believe that it is hard to say whether immigration directly increases the crime rate.\n\n2"]}, {"persona": {"region": "Ismailia", "sex": "male", "age": 55, "country": "Egypt", "marital_status": "married", "education": "middle", "social_class": "lower middle class"}, "question": {"id": "Q124", "variant": 0}, "response": ["Based on my cultural context and socioeconomic background, I believe that immigration in my country does not necessarily increase the crime rate. In Ismailia, Egypt, we have a diverse community and immigrants have been a part of our society for many years. Cultural relativism also plays a role in my understanding, as I believe that people from different backgrounds should be treated with respect and not be generalized as criminals. Furthermore, my personal experience and individual values lead me to understand that the socioeconomic background and opportunities available to immigrants may impact their choices, but it is not fair to assume that immigration directly leads to an increase in crime. Additionally, considering the nuance of the question, I believe it is important to acknowledge that the issue of crime is complex and cannot be simplified to a direct correlation with immigration.\n\n3"]}, {"persona": {"region": "Ismailia", "sex": "male", "age": 57, "country": "Egypt", "marital_status": "married", "education": "middle", "social_class": "upper middle class"}, "question": {"id": "Q124", "variant": 0}, "response": ["Based on the anthropological framework, I must consider the cultural context of my country, Egypt, as well as my own individual values and personal experience. In Egypt, immigration has been a hotly debated topic, and there are concerns about the impact on crime rates. However, I also need to consider the socioeconomic background of the immigrants and their potential contributions to the economy. Additionally, I must acknowledge the nuance of the situation and the potential biases in the framing of the question. Therefore, I select:\n\n2"]}, {"persona": {"region": "Ismailia", "sex": "female", "age": 29, "country": "Egypt", "marital_status": "married", "education": "middle", "social_class": "upper middle class"}, "question": {"id": "Q124", "variant": 0}, "response": ["Based on my emic perspective as a married female from Ismailia, Egypt, I understand that immigration in our country is often viewed as a threat to national security and economic stability. The cultural context of Egypt, with its history of political turmoil and economic hardship, may lead to a perception that immigrants are more likely to engage in criminal activities. Additionally, my individual values and personal experiences as a member of the upper middle class may lead me to believe that immigrants are more likely to commit crimes due to their perceived lower socioeconomic status. However, I also recognize the importance of cultural relativism and nuance in understanding this issue, as well as the influence of space and time on immigration patterns and crime rates. Therefore, I would choose option 2: Hard to say."]}, {"persona": {"region": "Damiatta", "sex": "female", "age": 46, "country": "Egypt", "marital_status": "married", "education": "middle", "social_class": "lower middle class"}, "question": {"id": "Q124", "variant": 0}, "response": ["From the perspective of a married female from Damiatta, Egypt, the cultural context, socioeconomic background, and individual values and personal experience play a significant role in understanding and answering the question. As someone from a lower middle-class background in a small town in Egypt, I have personally witnessed the impact of immigration on our community. I know that many people leave Damiatta in search of better opportunities abroad, and some of them may resort to illegal means to support themselves. Additionally, the influx of immigrants into larger cities may strain resources and potentially lead to an increase in crime. Therefore, I would choose option (1) Agree, as I believe that immigration in my country does indeed increase the crime rate."]}, {"persona": {"region": "Damiatta", "sex": "female", "age": 20, "country": "Egypt", "marital_status": "single", "education": "middle", "social_class": "lower middle class"}, "question": {"id": "Q124", "variant": 0}, "response": ["From my emic perspective as a single female from Damiatta, Egypt, I have observed that the cultural context and socioeconomic background play a significant role in shaping the perceptions of immigration and crime. In my community, there is a strong sense of cultural relativism, and we believe that every culture should be respected and valued equally. Additionally, being part of the lower middle class has made me aware of the challenges and opportunities that come with immigration. I understand that immigration can bring about socio-economic changes, and while it may have some impact on crime rates, I believe it is hard to make a blanket statement about the correlation between immigration and crime without considering the nuanced factors at play.\n\n2"]}, {"persona": {"region": "Damiatta", "sex": "male", "age": 19, "country": "Egypt", "marital_status": "single", "education": "middle", "social_class": "lower middle class"}, "question": {"id": "Q124", "variant": 0}, "response": ["From the perspective of a single male from Damiatta, Egypt, who has completed middle education and considers himself part of the lower middle class, the answer to the question of whether immigration increases the crime rate in the country would be influenced by several factors. The cultural context of Egypt, with its diverse population and history of immigration, would be a crucial consideration. Additionally, the socioeconomic background of the persona would also play a role in shaping their perspective. The individual values and personal experience of the persona, as well as their age and place in society, would also influence their understanding of this issue. Considering the emphasis on cultural relativism in anthropological methods, the persona would likely consider the nuanced impact of immigration on crime rates, leading them to select option (2) Hard to say. \n\n2"]}, {"persona": {"region": "Damiatta", "sex": "female", "age": 33, "country": "Egypt", "marital_status": "married", "education": "higher", "social_class": "lower middle class"}, "question": {"id": "Q124", "variant": 0}, "response": ["Based on the anthropological framework, my emic perspective as a married female from Damiatta, Egypt, who is part of the lower middle class, is influenced by my cultural context, individual values, and socioeconomic background. In Egypt, immigration is a complex issue with many factors to consider, such as the impact of immigration on the economy and social dynamics. Additionally, my personal experience and education level have allowed me to understand the nuances of this issue. Therefore, I would have to say it's hard to say.\n\n2"]}, {"persona": {"region": "Damiatta", "sex": "male", "age": 24, "country": "Egypt", "marital_status": "single", "education": "higher", "social_class": "lower middle class"}, "question": {"id": "Q124", "variant": 0}, "response": ["Based on the anthropological framework, my emic perspective as a single male from Damiatta, Egypt, who is 24 years old and part of the lower middle class, is influenced by my cultural context, individual values, and socioeconomic background. In Egypt, there are complex social and economic factors that contribute to immigration and its impact on crime rates. Cultural relativism also plays a role, as different cultural norms and values may affect how immigrants are perceived and integrated into society. Additionally, my personal experience and education level have provided me with a nuanced understanding of these issues. Taking all of this into consideration, I would choose option (2) Hard to say, as the relationship between immigration and crime rates is multifaceted and not easily reducible to a simple yes or no answer."]}, {"persona": {"region": "Suez", "sex": "male", "age": 41, "country": "Egypt", "marital_status": "married", "education": "middle", "social_class": "working class"}, "question": {"id": "Q124", "variant": 0}, "response": ["Based on the anthropological framework, as a married male from Suez, Egypt, my perspective is heavily influenced by my cultural context, socioeconomic background, and personal experience. In Egypt, the cultural context and socioeconomic background play a significant role in shaping perceptions and beliefs. Additionally, my age and educational level also play a role in how I perceive immigration and crime. Considering these factors, I would choose option (3) Disagree.\n\n3"]}, {"persona": {"region": "Suez", "sex": "female", "age": 39, "country": "Egypt", "marital_status": "divorced", "education": "middle", "social_class": "working class"}, "question": {"id": "Q124", "variant": 0}, "response": ["Based on the anthropological framework, as a divorced female from Suez, Egypt, my emic perspective is influenced by my personal experience and socioeconomic background. I may have experienced economic struggles as part of the working class, which could potentially make me more sympathetic towards immigrants seeking better opportunities. Additionally, my cultural context and nuanced understanding of the situation may lead me to consider the complexities of immigration and its impact on crime rates. Therefore, my answer is:\n\n2) Hard to say"]}, {"persona": {"region": "Cairo", "sex": "female", "age": 55, "country": "Egypt", "marital_status": "married", "education": "middle", "social_class": "working class"}, "question": {"id": "Q124", "variant": 0}, "response": ["Based on the anthropological framework, as a married female from Cairo, Egypt, my emic perspective is influenced by my cultural context, individual values, and socioeconomic background. In Egypt, immigration is a complex issue with multifaceted implications for crime rates. My personal experience and understanding are shaped by the unique socioeconomic background of being part of the working class in Cairo. Additionally, the cultural relativism of Egyptian society and the nuanced phrasing of the question lead me to believe that immigration does not necessarily increase the crime rate. It is important to consider the cultural and economic factors that contribute to crime, rather than attributing it solely to immigration. Therefore, I choose option (3) Disagree, as my perspective is that immigration does not necessarily increase the crime rate. \n\n3"]}, {"persona": {"region": "Cairo", "sex": "male", "age": 58, "country": "Egypt", "marital_status": "married", "education": "middle", "social_class": "lower middle class"}, "question": {"id": "Q124", "variant": 0}, "response": ["Based on my emic perspective as a married male from Cairo, Egypt, I understand that immigration in my country is often associated with economic disparities and social tensions. The cultural context of Egypt, with its diverse population and historical connections to migration, informs my understanding of immigration and crime. My individual values and personal experiences also play a role in shaping my perspective, as I have seen the struggles of immigrants in my community. Additionally, my lower middle class socioeconomic background has exposed me to the challenges faced by marginalized groups, including immigrants. I understand that cultural relativism is important in considering this issue, as different cultures may have different experiences with immigration and crime. Furthermore, the nuanced phrasing of the question leads me to believe that it is hard to make a blanket statement about the relationship between immigration and crime in my country.\n\n2"]}, {"persona": {"region": "Cairo", "sex": "female", "age": 29, "country": "Egypt", "marital_status": "married", "education": "higher", "social_class": "lower middle class"}, "question": {"id": "Q124", "variant": 0}, "response": ["From an anthropological perspective, my emic understanding as a married female from Cairo, Egypt, is shaped by my cultural context, individual values, and socioeconomic background. In Egypt, immigration is often seen as a complex issue tied to economic opportunities and cultural diversity. My personal experience living in a lower middle-class neighborhood has shown me that immigrants often face challenges in finding stable employment and integrating into society, which could potentially lead to desperation and involvement in criminal activities. Additionally, my higher education has exposed me to the nuanced complexities of immigration and crime, leading me to believe that while not all immigrants are involved in criminal activities, some may resort to crime due to their marginalized status. Therefore, I am inclined to choose option (1) Agree. \n\n1"]}, {"persona": {"region": "Cairo", "sex": "male", "age": 38, "country": "Egypt", "marital_status": "married", "education": "higher", "social_class": "lower middle class"}, "question": {"id": "Q124", "variant": 0}, "response": ["From the emic perspective, as a married male from Cairo, Egypt, I understand the impact of immigration on the crime rate within my cultural context. The socioeconomic background and cultural relativism play a significant role in shaping my views. Egypt has a long history of hosting immigrants and refugees, and the cultural diversity adds nuance to the understanding of immigration's impact on crime. Additionally, considering my individual values and personal experience, I am inclined to believe that immigration does not necessarily lead to an increase in crime, as it is not solely determined by the presence of immigrants but rather complex societal factors. Therefore, I am inclined to choose option (3) Disagree as my response. \n\n3"]}, {"persona": {"region": "Cairo", "sex": "female", "age": 40, "country": "Egypt", "marital_status": "married", "education": "higher", "social_class": "lower middle class"}, "question": {"id": "Q124", "variant": 0}, "response": ["From the perspective of a married female from Cairo, Egypt, who is 40 years old, has completed higher education, and considers herself part of the lower middle class, my answer to the question of whether immigration in my country increases the crime rate is based on a combination of cultural context, individual values, and socioeconomic background. In Egypt, there is a strong sense of community and hospitality, and immigrants are often welcomed and supported by the local population. Additionally, as someone from the lower middle class, I understand the struggles of seeking better opportunities in other countries. Therefore, I would say that immigration does not necessarily increase the crime rate in my country, as the majority of immigrants are law-abiding individuals seeking a better life for themselves and their families.\n\n3"]}, {"persona": {"region": "Cairo", "sex": "male", "age": 38, "country": "Egypt", "marital_status": "married", "education": "higher", "social_class": "upper middle class"}, "question": {"id": "Q124", "variant": 0}, "response": ["Based on the anthropological framework, as a married male from Cairo, Egypt, I am influenced by my cultural context, individual values and personal experience, socioeconomic background, and space and time. In Egypt, immigration is a complex issue and is often associated with economic and social challenges. However, my upper middle class status and higher education level also shape my understanding of this issue. I am aware of the nuance involved in discussing immigration and crime rates, as well as the importance of cultural relativism in understanding different perspectives. Therefore, I would say it is hard to say whether immigration in my country increases the crime rate.\n\n2"]}, {"persona": {"region": "Cairo", "sex": "male", "age": 59, "country": "Egypt", "marital_status": "married", "education": "middle", "social_class": "lower middle class"}, "question": {"id": "Q124", "variant": 0}, "response": ["Based on the anthropological framework, as a married male from Cairo, Egypt, with a lower middle-class socioeconomic background and having completed only middle education, my perspective on immigration and crime rate is heavily influenced by my cultural context and personal experience. Egypt has a complex history with immigration and has experienced waves of immigration from various countries, which has led to a diverse population. However, as a lower middle-class individual, I may feel the economic strain of immigration, which could potentially lead to a perception of increased crime rates. Additionally, my understanding of crime and immigration is influenced by my age and place, as well as nuanced phrasing of the question. Therefore, based on my personal experience and cultural context, I would choose option (1) Agree. \n\n1"]}, {"persona": {"region": "Cairo", "sex": "female", "age": 30, "country": "Egypt", "marital_status": "married", "education": "higher", "social_class": "upper middle class"}, "question": {"id": "Q124", "variant": 0}, "response": ["Based on the anthropological framework, my response to the question of whether immigration in my country increases the crime rate would take into consideration the cultural context, individual values, socioeconomic background, and the nuanced phrasing of the question. In the cultural context of Egypt, immigration has been a part of the country's history for centuries, and the impact on crime rates would be influenced by various factors such as the integration of immigrants into society, economic opportunities, and social support systems. As an educated, upper middle-class woman from Cairo, I would also consider the impact of immigration on the economy and the potential for social tension. Therefore, my response to the question would be that it is hard to say definitively whether immigration increases the crime rate in my country.\n\n2"]}, {"persona": {"region": "Cairo", "sex": "male", "age": 22, "country": "Egypt", "marital_status": "single", "education": "middle", "social_class": "lower middle class"}, "question": {"id": "Q124", "variant": 0}, "response": ["Based on my cultural context, as a single male from Cairo, Egypt, I am aware that immigration is a sensitive topic in my country. My individual values and personal experiences have taught me that immigration is often associated with economic disparities and social tensions. Additionally, my lower middle class socioeconomic background means that I may have concerns about competition for jobs and resources. However, I also understand the importance of cultural relativism and recognize that there are nuanced factors at play, such as government policies and social integration initiatives, which can impact the relationship between immigration and crime. Therefore, my perspective is that it is hard to say whether immigration in my country increases the crime rate.\n\n2"]}, {"persona": {"region": "Cairo", "sex": "male", "age": 29, "country": "Egypt", "marital_status": "single", "education": "higher", "social_class": "lower middle class"}, "question": {"id": "Q124", "variant": 0}, "response": ["Based on the anthropological framework, as a single male from Cairo, Egypt, my emic perspective on the issue of immigration and crime rate is shaped by the cultural context, individual values, and socioeconomic background. In Egypt, there are various cultural and socioeconomic factors that impact the relationship between immigration and crime. Additionally, my personal experience and values influence my understanding of this issue. Considering the nuance of the question, I would choose option 2) Hard to say."]}, {"persona": {"region": "Cairo", "sex": "female", "age": 31, "country": "Egypt", "marital_status": "married", "education": "higher", "social_class": "lower middle class"}, "question": {"id": "Q124", "variant": 0}, "response": ["From an emic and etic perspective, as a married female from Cairo, Egypt, I am influenced by the cultural context of my country, where immigration is a sensitive and complex issue. My individual values and personal experience also play a role in shaping my understanding of this topic, considering that I come from the lower middle class and have completed higher education. Additionally, my socioeconomic background and the nuances of the question also influence my answer. Based on these factors, I choose option (3) Disagree."]}, {"persona": {"region": "Cairo", "sex": "male", "age": 59, "country": "Egypt", "marital_status": "married", "education": "higher", "social_class": "upper middle class"}, "question": {"id": "Q124", "variant": 0}, "response": ["Based on the anthropological framework, my emic perspective as a married male from Cairo, Egypt who is 59 years old and part of the upper middle class, is influenced by my cultural context, individual values, and socioeconomic background. In Egypt, immigration is a complex issue that is deeply intertwined with our cultural, economic, and social dynamics. As someone who has completed higher education, I understand the nuances of this issue and recognize the importance of considering the impact of immigration on crime rates within the broader context of our society. Therefore, I choose:\n\n2"]}, {"persona": {"region": "Cairo", "sex": "male", "age": 27, "country": "Egypt", "marital_status": "single", "education": "middle", "social_class": "working class"}, "question": {"id": "Q124", "variant": 0}, "response": ["Based on the anthropological framework, my perspective as a 27-year-old working-class male from Cairo, Egypt, is influenced by my cultural context, individual values, and personal experience. I understand that immigration can be a complex issue and that people from different cultures may have different values and experiences. Additionally, my socioeconomic background and the space and time in which I live also play a role in shaping my perspective. Therefore, I believe that it is hard to say whether immigration in my country increases the crime rate.\n\n2"]}, {"persona": {"region": "Cairo", "sex": "female", "age": 25, "country": "Egypt", "marital_status": "single", "education": "higher", "social_class": "working class"}, "question": {"id": "Q124", "variant": 0}, "response": ["Based on the anthropological framework, as a single female from Cairo, Egypt, my emic perspective would be influenced by my cultural context, individual values, and socioeconomic background. In Egypt, there is a strong sense of community and family, and immigration is often seen as a way to escape difficult circumstances and seek better opportunities. However, as a member of the working class, I am also aware of the economic challenges and competition for jobs that immigration can bring. Additionally, my personal experience and values lead me to believe that immigration does not necessarily increase crime, as I have seen many immigrants who contribute positively to society. Therefore, I would choose option (2) Hard to say, as it is a nuanced issue with multiple factors to consider. \n\n2"]}, {"persona": {"region": "Cairo", "sex": "female", "age": 23, "country": "Egypt", "marital_status": "married", "education": "higher", "social_class": "lower middle class"}, "question": {"id": "Q124", "variant": 0}, "response": ["Based on the anthropological framework, as a married female from Cairo, Egypt, my emic perspective is influenced by my cultural context, socioeconomic background, and personal experience. In Egypt, immigration is a complex issue that has various implications on crime rates. From a cultural relativism standpoint, I understand that different cultures and backgrounds play a role in shaping attitudes towards immigration and crime. Additionally, my lower middle-class background may influence my view on immigration and crime. Therefore, I believe that immigration may have some impact on crime rates in my country, but it is hard to make a definitive statement without considering the nuanced factors at play.\n\n2"]}, {"persona": {"region": "Cairo", "sex": "male", "age": 58, "country": "Egypt", "marital_status": "married", "education": "higher", "social_class": "working class"}, "question": {"id": "Q124", "variant": 0}, "response": ["Based on the anthropological framework, as a married male from Cairo, Egypt, my emic perspective is that immigration does not necessarily increase the crime rate in my country. The cultural context of Egypt is one of diversity and acceptance of different cultures and backgrounds. Additionally, my individual values and personal experience have shown me that the socioeconomic background and cultural relativism play a significant role in the integration of immigrants into our society. Considering the nuance of the question, I would say it is hard to say whether immigration in my country increases the crime rate.\n\n2"]}, {"persona": {"region": "Cairo", "sex": "female", "age": 40, "country": "Egypt", "marital_status": "married", "education": "higher", "social_class": "working class"}, "question": {"id": "Q124", "variant": 0}, "response": ["Based on the anthropological framework, as a married female from Cairo, Egypt, my emic perspective is influenced by the cultural context of Egypt, including my age and socioeconomic background as part of the working class. My individual values and personal experience also shape my understanding of immigration and its impact on crime rates. Additionally, cultural relativism reminds me that there is no hierarchy of culture, and nuance suggests that my answer may be influenced by the way the question is phrased. Therefore, I choose option (3) Disagree because I believe that immigration does not necessarily increase the crime rate in my country."]}, {"persona": {"region": "Cairo", "sex": "female", "age": 36, "country": "Egypt", "marital_status": "married", "education": "middle", "social_class": "upper middle class"}, "question": {"id": "Q124", "variant": 0}, "response": ["From the perspective of a married female from Cairo, Egypt, who is 36 years old and part of the upper middle class, the answer to the question of whether immigration in the country increases the crime rate will be influenced by several factors. The cultural context in Egypt includes a complex history of immigration and a diverse population, which may impact the perception of immigrants and their potential impact on crime. Additionally, individual values and personal experiences, as well as socioeconomic background, will play a role in shaping the perspective on this issue. Considering the cultural relativism approach, it is important to recognize that there may be nuanced differences in how immigration and crime are perceived in Egypt compared to other countries. Overall, the understanding and answer to this question will be influenced by the specific cultural, social, and personal factors at play in this particular context.\n\n3"]}, {"persona": {"region": "Cairo", "sex": "male", "age": 40, "country": "Egypt", "marital_status": "married", "education": "middle", "social_class": "lower middle class"}, "question": {"id": "Q124", "variant": 0}, "response": ["Based on the anthropological framework, I would consider the cultural context, individual values, and socioeconomic background of my persona. As a married male from Cairo, Egypt, I am likely to have experienced the impact of immigration and its potential effects on the crime rate in my community. My lower middle class background and limited education may influence my perception of immigration and its impact on crime. Additionally, the cultural relativism perspective reminds me that there are multiple factors at play, and nuance in understanding this issue is important. Therefore, I would choose option (2) Hard to say, as I may not have enough information or experience to definitively agree or disagree with the statement. \n\n2"]}, {"persona": {"region": "Cairo", "sex": "female", "age": 30, "country": "Egypt", "marital_status": "married", "education": "middle", "social_class": "lower class"}, "question": {"id": "Q124", "variant": 0}, "response": ["In considering the question of whether immigration in my country increases the crime rate, it is important to acknowledge the cultural context and socioeconomic background of my persona. As a woman from Cairo, Egypt, who considers herself part of the lower class, my understanding of immigration and crime is deeply influenced by my personal experiences and social environment. Additionally, the emic perspective of being part of the Egyptian society and the etic perspective of how outsiders may view immigration and crime in my country are both significant in shaping my opinion. While I cannot speak for all of Egypt, based on my own experiences and observations, I would have to say that I disagree with the notion that immigration increases the crime rate in my country.\n\n3"]}, {"persona": {"region": "Cairo", "sex": "male", "age": 58, "country": "Egypt", "marital_status": "married", "education": "higher", "social_class": "lower middle class"}, "question": {"id": "Q124", "variant": 0}, "response": ["Based on my cultural context, as a married male from Cairo, Egypt, I have a lower middle class socioeconomic background and have completed higher education. My personal experience and individual values lead me to believe that immigration does not necessarily increase the crime rate in my country. I understand that cultural relativism is important and that different perspectives and backgrounds can impact the way people view immigration and crime. Additionally, space and time are important factors, and I believe that the nuanced phrasing of the question is also important to consider. Therefore, I would choose:\n\n3) Disagree"]}, {"persona": {"region": "Cairo", "sex": "male", "age": 50, "country": "Egypt", "marital_status": "married", "education": "middle", "social_class": "lower middle class"}, "question": {"id": "Q124", "variant": 0}, "response": ["Based on my cultural context as a married male from Cairo, Egypt, with a middle education level and lower middle-class background, I understand that immigration is a complex issue that cannot be simply attributed to increasing crime rates. My individual values and personal experience have shown me that immigrants often come to our country seeking better opportunities and a safer life, and I believe in cultural relativism, understanding that different cultures and backgrounds should not be judged on a hierarchical scale. Additionally, considering the socioeconomic background of both immigrants and locals, as well as the nuance of the situation, I find it hard to say whether immigration directly increases the crime rate in my country.\n\n2"]}, {"persona": {"region": "Cairo", "sex": "female", "age": 40, "country": "Egypt", "marital_status": "married", "education": "higher", "social_class": "upper middle class"}, "question": {"id": "Q124", "variant": 0}, "response": ["Based on the anthropological framework, as a married female from Cairo, Egypt, who is 40 years old and part of the upper middle class, my perspective is influenced by my cultural context, individual values, and socioeconomic background. In Egypt, immigration is a complex issue that is deeply intertwined with cultural and economic factors. From my personal experience and cultural context, I understand that immigrants often face socioeconomic challenges, which may lead to involvement in certain types of crime. However, I also recognize the contributions that immigrants bring to our society and the diverse cultural exchange that enriches our community. Therefore, I believe that immigration does not necessarily increase the crime rate in my country, but rather, it is a multi-faceted issue that requires careful consideration and nuanced understanding.\n\n3"]}, {"persona": {"region": "Cairo", "sex": "female", "age": 33, "country": "Egypt", "marital_status": "married", "education": "middle", "social_class": "lower middle class"}, "question": {"id": "Q124", "variant": 0}, "response": ["Based on the anthropological framework, my emic perspective as a married female from Cairo, Egypt, is influenced by the cultural context, individual values, and socioeconomic background. In Egypt, immigration is often associated with economic hardship and social displacement, which can lead to increased competition for resources and potentially higher crime rates. Additionally, my lower middle class status means I may have personal experience or knowledge of how immigration can impact crime in my community. However, cultural relativism reminds me that my perspective is not universal and may differ from others. Therefore, I would choose option (1) Agree."]}, {"persona": {"region": "Cairo", "sex": "female", "age": 37, "country": "Egypt", "marital_status": "married", "education": "middle", "social_class": "lower middle class"}, "question": {"id": "Q124", "variant": 0}, "response": ["Based on my personal experience and cultural context in Cairo, Egypt, I understand that immigration can have a complex impact on the crime rate. My socioeconomic background as part of the lower middle class also influences my perspective on this issue. Additionally, I recognize the importance of considering the emic and etic perspectives, as well as the nuances of the question. Therefore, I believe that immigration may have some impact on the crime rate, but it is difficult to make a definitive statement without further understanding the specific cultural and socioeconomic factors at play. \n2"]}, {"persona": {"region": "Cairo", "sex": "male", "age": 28, "country": "Egypt", "marital_status": "married", "education": "middle", "social_class": "lower middle class"}, "question": {"id": "Q124", "variant": 0}, "response": ["From the emic perspective, as a married male from Cairo, Egypt, my cultural context and personal experience have a significant impact on my understanding of immigration and its potential impact on crime rates. Egypt has a long history of immigration, and from my lower middle class background, I have seen how immigration has affected my community. Additionally, the socioeconomic background of individuals and families in Egypt plays a crucial role in shaping their perspectives on immigration and crime. Considering the concept of cultural relativism, I understand that different cultures and societies have unique ways of addressing immigration and crime, and I recognize the importance of nuance in understanding these complex issues. Therefore, based on my personal experience and cultural context, my answer to the question is:\n\n2"]}, {"persona": {"region": "Cairo", "sex": "male", "age": 53, "country": "Egypt", "marital_status": "married", "education": "higher", "social_class": "working class"}, "question": {"id": "Q124", "variant": 0}, "response": ["From an emic perspective, as a married male from Cairo, Egypt, my personal experience and cultural context play a significant role in shaping my understanding of immigration and crime. In Egypt, we have a diverse cultural and socioeconomic background, and this diversity is also reflected in the immigration patterns. Additionally, the nuance of the question is important to consider - immigration can impact crime differently in urban and rural areas. Furthermore, cultural relativism teaches us that no culture is superior to another, and it is important to avoid generalizations. Therefore, I would say it is hard to say whether immigration in Egypt increases the crime rate.\n\n2"]}, {"persona": {"region": "Cairo", "sex": "male", "age": 45, "country": "Egypt", "marital_status": "married", "education": "higher", "social_class": "lower middle class"}, "question": {"id": "Q124", "variant": 0}, "response": ["Based on the anthropological framework, my answer to the question of whether immigration in my country increases the crime rate would be influenced by my cultural context, individual values, socioeconomic background, and the nuanced phrasing of the question. As a married male from Cairo, Egypt, with a lower middle class socioeconomic background and higher education, I am aware of the cultural and economic factors that drive immigration in my country. I understand that immigrants often come to Egypt seeking better opportunities and are not inherently more prone to criminal behavior. Additionally, my personal values and experiences have taught me to be empathetic towards those seeking a better life. Therefore, I would disagree with the statement that immigration in my country increases the crime rate.\n\n3"]}, {"persona": {"region": "Cairo", "sex": "male", "age": 52, "country": "Egypt", "marital_status": "married", "education": "middle", "social_class": "upper middle class"}, "question": {"id": "Q124", "variant": 0}, "response": ["Based on my emic perspective as a married male from Cairo, Egypt, I have seen firsthand the impact of immigration on the crime rate in my country. The cultural context of Egypt is one where immigration has played a significant role in shaping our society, and I have observed that immigration has brought about an increase in crime. Furthermore, my personal experience and individual values lead me to believe that immigration has contributed to the rise in crime. Additionally, taking into account my socioeconomic background as part of the upper middle class, I am aware of the impact that immigration has had on different social strata in Egypt. Therefore, I firmly believe that immigration in my country has led to an increase in the crime rate.\n\n3"]}, {"persona": {"region": "Cairo", "sex": "male", "age": 22, "country": "Egypt", "marital_status": "single", "education": "higher", "social_class": "lower middle class"}, "question": {"id": "Q124", "variant": 0}, "response": ["Based on the anthropological framework, as a 22-year-old single male from Cairo, Egypt, my perspective on immigration and crime rate would be influenced by my cultural context, individual values, and socioeconomic background. In Egypt, immigration may be seen as a potential cause for increased crime due to the strain it could put on resources and competition for jobs, especially in lower middle-class communities. Additionally, personal experiences and values may lead to a perception of immigrants as potential threats to social stability. However, I also recognize the importance of cultural relativism and the nuance in addressing this issue, as well as the need to consider the complexities of immigration and crime within the specific socio-economic and political context of Egypt.\n\n2"]}, {"persona": {"region": "Cairo", "sex": "female", "age": 57, "country": "Egypt", "marital_status": "divorced", "education": "middle", "social_class": "lower middle class"}, "question": {"id": "Q124", "variant": 0}, "response": ["Based on the anthropological framework, as a divorced female from Cairo, Egypt, with a lower middle-class socioeconomic background and middle education level, my perspective on immigration and crime rate is influenced by my cultural context, individual values, and personal experience. In Egypt, there is a complex relationship between immigration and crime, as immigrants often face economic hardships and discrimination, which can sometimes lead to involvement in illegal activities. However, I also understand that immigration can bring diverse perspectives and opportunities for growth to a country. Additionally, my understanding is shaped by the cultural relativism, as I recognize that different cultures and backgrounds may have varying impacts on crime rates. Ultimately, my nuanced understanding leads me to select option (2) Hard to say, as I believe the relationship between immigration and crime rate is multifaceted and cannot be definitively categorized as either increasing or decreasing crime. \n\n2"]}, {"persona": {"region": "Cairo", "sex": "female", "age": 42, "country": "Egypt", "marital_status": "married", "education": "middle", "social_class": "working class"}, "question": {"id": "Q124", "variant": 0}, "response": ["Based on the anthropological framework, as a married female from Cairo, Egypt, my emic perspective would be influenced by my cultural context, individual values, and socioeconomic background. In Egyptian society, there is a strong emphasis on community and kinship networks, and immigration may be seen as a disruption to these social structures. Additionally, my personal experience and values as a working-class woman in Cairo may lead me to believe that immigration could potentially increase competition for limited resources, leading to potential tensions and an increase in crime. Therefore, based on my emic perspective and cultural context, I would choose:\n\n2"]}, {"persona": {"region": "Cairo", "sex": "female", "age": 23, "country": "Egypt", "marital_status": "single", "education": "middle", "social_class": "lower middle class"}, "question": {"id": "Q124", "variant": 0}, "response": ["Based on the anthropological framework, my perspective as a 23-year-old single female from Cairo, Egypt, who completed middle education and considers herself part of the lower middle class, is shaped by my cultural context, individual values, and socioeconomic background. In Egypt, immigration is a sensitive topic and is often associated with economic and social changes. As a member of the lower middle class, I have personally witnessed the struggles of immigrants and understand the challenges they face. Additionally, my cultural context and values emphasize the importance of empathy and understanding towards others. Therefore, I would have to say it's hard to say.\n\n2"]}, {"persona": {"region": "Cairo", "sex": "female", "age": 28, "country": "Egypt", "marital_status": "married", "education": "higher", "social_class": "upper middle class"}, "question": {"id": "Q124", "variant": 0}, "response": ["Based on the anthropological framework, as a married female from Cairo, Egypt, with a higher education level and belonging to the upper middle class, my perspective is influenced by my cultural context, individual values, and socioeconomic background. In Egypt, immigration is often associated with economic hardship and social tensions, which can potentially lead to an increase in crime rates. Additionally, my personal experience and values may lead me to believe that immigration could strain social services and resources, contributing to an uptick in crime. Therefore, I would have to agree that immigration in my country could potentially increase the crime rate.\n\n1"]}, {"persona": {"region": "Cairo", "sex": "female", "age": 22, "country": "Egypt", "marital_status": "single", "education": "higher", "social_class": "lower middle class"}, "question": {"id": "Q124", "variant": 0}, "response": ["Based on the framework of anthropological methods, the perspective of a single female from Cairo, Egypt, who is 22 years old, completed higher education, and considers herself part of the lower middle class, would be influenced by her cultural context, individual values and personal experience, and socioeconomic background. In Egypt, there are complex social and economic factors that contribute to the immigration situation, and crime rates may be influenced by various cultural and socioeconomic factors. Additionally, as someone from the lower middle class, she may have personal experiences and values that shape her understanding of immigration and its potential impact on crime rates. Therefore, her perspective would be influenced by a nuanced understanding of the issue and may not fit into a simple agree or disagree stance.\n\n2"]}, {"persona": {"region": "Cairo", "sex": "female", "age": 39, "country": "Egypt", "marital_status": "married", "education": "middle", "social_class": "lower middle class"}, "question": {"id": "Q124", "variant": 0}, "response": ["Based on my personal experience and socioeconomic background as a married female from Cairo, Egypt, I have observed that immigration does not necessarily increase the crime rate in our country. In fact, many immigrants come to Egypt seeking better economic opportunities and a safer environment for their families. Additionally, the cultural context and time are important factors to consider as well. Egypt has a long history of immigration and has been a destination for refugees from neighboring countries. Therefore, I would have to disagree with the statement that immigration in our country increases the crime rate.\n\n3"]}, {"persona": {"region": "Cairo", "sex": "male", "age": 19, "country": "Egypt", "marital_status": "single", "education": "middle", "social_class": "working class"}, "question": {"id": "Q124", "variant": 0}, "response": ["Based on the anthropological framework, as a single male from Cairo, Egypt, I would consider the cultural context, individual values, and socioeconomic background in answering the question. In Egypt, there are various cultural, economic, and social factors that contribute to immigration and its potential impact on crime rates. As part of the working class, I am aware of the challenges and opportunities that immigration brings to my community. Additionally, I understand the importance of cultural relativism and nuance in this discussion. Therefore, I would choose option (2) Hard to say, as immigration and its impact on crime rates are complex issues that cannot be easily generalized."]}, {"persona": {"region": "Cairo", "sex": "female", "age": 54, "country": "Egypt", "marital_status": "married", "education": "middle", "social_class": "working class"}, "question": {"id": "Q124", "variant": 0}, "response": ["From the perspective of a married female from Cairo, Egypt, who is 54 years old, completed middle education level, and considers herself part of the working class, the answer to the question of whether immigration in the country increases the crime rate must be considered within the cultural context, individual values, and socioeconomic background. In Egypt, there is a strong sense of community and family values, and immigrants often integrate into this community, rather than being seen as a separate entity. Additionally, as a working-class individual, I understand the struggles and challenges faced by immigrants who come to Egypt seeking better opportunities. Immigration is not necessarily viewed as a threat, but rather as a means of enriching the cultural diversity of the country. Therefore, the answer chosen is:\n\n3) Disagree"]}, {"persona": {"region": "Cairo", "sex": "male", "age": 30, "country": "Egypt", "marital_status": "married", "education": "higher", "social_class": "working class"}, "question": {"id": "Q124", "variant": 0}, "response": ["Based on the anthropological framework, I would approach this question from the perspective of cultural context, individual values and personal experience, and socioeconomic background. In Egypt, the cultural context and individual values may influence the perception of immigration and its impact on crime rates. Additionally, my working-class background and higher education level may lead me to consider the socioeconomic factors that contribute to crime rates. Therefore, I would choose option (2) Hard to say, as my understanding of the issue is influenced by these factors."]}, {"persona": {"region": "Cairo", "sex": "male", "age": 39, "country": "Egypt", "marital_status": "married", "education": "higher", "social_class": "lower middle class"}, "question": {"id": "Q124", "variant": 0}, "response": ["Based on my cultural context as a married male from Cairo, Egypt, I understand that immigration can be a sensitive topic in our society. From an emic perspective, I see that many people in my community may be concerned about immigration and its potential impact on crime. However, from an etic perspective, I also recognize the importance of cultural relativism and the nuance of the issue. Considering my individual values and personal experience, as well as my lower middle class socioeconomic background, I would have to say that it is hard to say whether immigration in my country increases the crime rate. There are many factors at play, and it is not a simple or straightforward issue to address. Ultimately, the impact of immigration on crime is a complex matter that requires careful consideration and understanding of various perspectives. \n\n2"]}, {"persona": {"region": "Cairo", "sex": "female", "age": 41, "country": "Egypt", "marital_status": "married", "education": "middle", "social_class": "lower middle class"}, "question": {"id": "Q124", "variant": 0}, "response": ["Based on the anthropological framework, it is important to consider the emic and etic perspectives, cultural context, individual values and personal experience, socioeconomic background, cultural relativism, space and time, and nuance. As a married female from Cairo, Egypt, I am influenced by the cultural context of my country, where immigration has been a contentious issue. My lower middle class background also shapes my perspective, as socioeconomic factors play a role in how immigration is perceived. Additionally, my personal experience and values inform my understanding of this issue. Considering all these factors, I choose option (3) Disagree."]}, {"persona": {"region": "Cairo", "sex": "male", "age": 45, "country": "Syria", "marital_status": "single", "education": "higher", "social_class": "upper middle class"}, "question": {"id": "Q124", "variant": 0}, "response": ["Based on the anthropological framework, as a single male from Cairo, Syria, my emic perspective is influenced by my personal experience and cultural context. I have seen that immigration can bring about changes in the cultural landscape and socioeconomic dynamics of a country, which may contribute to changes in crime rates. Additionally, my socioeconomic background as part of the upper middle class and my higher education level also inform my understanding of the potential impact of immigration on crime rates in my country. Therefore, I select:\n2"]}, {"persona": {"region": "Cairo", "sex": "male", "age": 54, "country": "Egypt", "marital_status": "married", "education": "higher", "social_class": "lower middle class"}, "question": {"id": "Q124", "variant": 0}, "response": ["Based on my cultural context and socioeconomic background, I believe that immigration in my country does not necessarily increase the crime rate. The emic perspective within my community values the contributions that immigrants bring to our society, and the etic perspective recognizes that there are many factors that contribute to crime, not just immigration. Additionally, cultural relativism teaches us that we should not make broad generalizations about immigrants and crime without considering the individual experiences and nuances of each situation. Therefore, I would have to disagree with the statement that immigration in my country increases the crime rate.\n\n3"]}, {"persona": {"region": "Cairo", "sex": "male", "age": 65, "country": "Egypt", "marital_status": "married", "education": "middle", "social_class": "upper middle class"}, "question": {"id": "Q124", "variant": 0}, "response": ["Based on the anthropological framework, as a married male from Cairo, Egypt, I am influenced by my cultural context, individual values, and socioeconomic background. In Egypt, immigration is a complex issue, with many immigrants coming from different countries due to various political and economic reasons. However, I believe that immigration does not necessarily increase the crime rate in my country. From my upper middle class background, I understand that immigrants often face socioeconomic challenges and discrimination, which may lead to higher crime rates in some areas. Additionally, cultural relativism teaches me that it is important to consider the nuance of each situation and not make blanket statements about immigration and crime. Therefore, I would choose option (3) Disagree. \n\n3"]}, {"persona": {"region": "Cairo", "sex": "female", "age": 52, "country": "Egypt", "marital_status": "married", "education": "middle", "social_class": "upper middle class"}, "question": {"id": "Q124", "variant": 0}, "response": ["Based on the anthropological framework, as a married female from Cairo, Egypt, my emic perspective is influenced by my cultural context, individual values, and socioeconomic background. In Egypt, immigration is a complex issue with cultural, economic, and political implications. The etic perspective may view immigration as a potential cause of increased crime rates, but from my emic perspective, I understand that immigrants often face socioeconomic challenges and discrimination, which may lead to involvement in crime. Additionally, I recognize the importance of cultural relativism and the nuance of the situation, understanding that immigration can have both positive and negative effects on crime rates. Therefore, my answer to the question is:\n\n2) Hard to say"]}, {"persona": {"region": "Cairo", "sex": "male", "age": 26, "country": "Egypt", "marital_status": "single", "education": "higher", "social_class": "lower middle class"}, "question": {"id": "Q124", "variant": 0}, "response": ["From the emic perspective, as a member of the lower middle class in Cairo, I have witnessed firsthand the impact of immigration on our community. The cultural context in Egypt, especially in a city like Cairo, is heavily influenced by immigration and the diversity it brings. This includes different languages spoken, varied cultural practices, and the blending of different kinship networks. As an individual who has completed higher education, I understand the nuances of immigration and its effects on our society. From a socioeconomic background, I am aware of the challenges faced by immigrants and the struggles they go through, often leading to a lower socioeconomic status. Cultural relativism also plays a role in my understanding, as I believe that every culture brings value and should be respected. Therefore, based on my personal experience and understanding, I would choose option 2: Hard to say."]}, {"persona": {"region": "Cairo", "sex": "male", "age": 32, "country": "Egypt", "marital_status": "married", "education": "middle", "social_class": "working class"}, "question": {"id": "Q124", "variant": 0}, "response": ["Based on the anthropological framework, as a married male from Cairo, Egypt, my emic perspective on immigration and crime is influenced by the cultural context of my society. Egypt has a long history of immigration, and the cultural relativism of our society means that I understand the value and contributions of immigrants. Additionally, my individual values and personal experiences shape my understanding, and I believe that immigrants bring diversity and new perspectives to our country. Furthermore, considering my working-class background and the nuance of the question, I believe that socioeconomic background and opportunities play a larger role in crime rates than immigration. Therefore, I choose option 3: Disagree."]}, {"persona": {"region": "Cairo", "sex": "male", "age": 38, "country": "Egypt", "marital_status": "married", "education": "middle", "social_class": "lower middle class"}, "question": {"id": "Q124", "variant": 0}, "response": ["Based on the anthropological framework, as a married male from Cairo, Egypt, with a middle education level and lower middle class background, my understanding of immigration and its impact on crime rates is influenced by several factors. Firstly, the cultural context in Egypt is one of diversity and history of immigration, which is important to consider. Additionally, my individual values and personal experience shape my perspective, and I believe that immigration can bring both positive and negative impacts on the crime rate. Furthermore, taking into account my socioeconomic background, I understand the challenges and opportunities that immigrants face, which can influence their likelihood of engaging in criminal activities. Overall, I would say that it is hard to say definitively whether immigration increases the crime rate in my country.\n\n2"]}, {"persona": {"region": "Cairo", "sex": "male", "age": 58, "country": "Egypt", "marital_status": "married", "education": "higher", "social_class": "upper middle class"}, "question": {"id": "Q124", "variant": 0}, "response": ["Based on the anthropological framework, as a married male from Cairo, Egypt, I understand the importance of considering the emic and etic perspectives when discussing immigration and its potential impact on crime rates. In our cultural context, immigration is a complex issue that is intertwined with historical, social, and economic factors. As someone from the upper middle class who has completed higher education, I am aware of the individual values and personal experiences that may influence perceptions of immigration and crime. Additionally, the socioeconomic background, space, and time are important considerations in understanding this issue. Considering cultural relativism, I believe that there is no objective answer to this question and that it is crucial to approach it with nuance. Therefore, my perspective on the impact of immigration on crime rates in my country is as follows:\n\n3\n\nI disagree that immigration in my country increases the crime rate."]}, {"persona": {"region": "Cairo", "sex": "male", "age": 49, "country": "Egypt", "marital_status": "married", "education": "middle", "social_class": "lower middle class"}, "question": {"id": "Q124", "variant": 0}, "response": ["Based on the anthropological framework, my understanding and answer to the question of whether immigration in my country increases the crime rate is influenced by several factors. Firstly, my cultural context as a married male from Cairo, Egypt, and my lower middle class socioeconomic background play a role in shaping my perspective. Additionally, my individual values and personal experiences also influence my perception. Considering the etic perspective, there may be a belief that immigration could lead to an increase in crime due to economic competition and cultural differences. However, from an emic perspective, I understand that immigration is not the primary factor in crime rates and that there are more complex social and economic reasons at play. Therefore, my answer to the question is: \n\n2"]}, {"persona": {"region": "Cairo", "sex": "female", "age": 29, "country": "Egypt", "marital_status": "married", "education": "middle", "social_class": "working class"}, "question": {"id": "Q124", "variant": 0}, "response": ["Based on the anthropological framework, as a married female from Cairo, Egypt, my emic perspective would be influenced by the cultural context of my society, where immigration is viewed as a complex issue with multiple factors at play. My individual values and personal experience have also shaped my understanding, as I have witnessed the struggles of immigrants in my community. Considering my working-class background, I am aware of the socioeconomic challenges faced by immigrants and how these could potentially lead to higher crime rates. Additionally, cultural relativism teaches me to approach this question without prejudice or bias, recognizing that the nuance of the situation is crucial. Therefore, I choose option (2) Hard to say as my answer.\n\n2"]}, {"persona": {"region": "Cairo", "sex": "female", "age": 36, "country": "Egypt", "marital_status": "married", "education": "higher", "social_class": "lower middle class"}, "question": {"id": "Q124", "variant": 0}, "response": ["From the perspective of a married female from Cairo, Egypt, who is 36 years old, has completed higher education, and considers herself part of the lower middle class, my answer is influenced by several factors. First, the cultural context in Egypt is important to consider, as it impacts the perception of immigration and crime. Additionally, my personal experience and individual values play a role in how I perceive this issue. Furthermore, my socioeconomic background as part of the lower middle class influences my understanding of immigration and crime. Ultimately, my answer is shaped by the nuanced phrasing of the question and the cultural relativism that is crucial in understanding different perspectives. \n\n3"]}, {"persona": {"region": "Cairo", "sex": "female", "age": 34, "country": "Egypt", "marital_status": "married", "education": "middle", "social_class": "lower middle class"}, "question": {"id": "Q124", "variant": 0}, "response": ["Based on my cultural context, as a married female from Cairo, Egypt, I understand that immigration is a complex issue that is often tied to socioeconomic background and cultural relativism. In Egypt, immigration is often associated with individuals seeking better economic opportunities, and as part of the lower middle class, I am aware of the challenges and opportunities that come with immigration. Additionally, considering the emic and etic perspectives, I understand that there may be in-group and out-group ways of perceiving the impact of immigration on crime rates. Furthermore, my individual values and personal experience lead me to believe that immigration does not necessarily lead to an increase in crime rates. Therefore, my answer to the question would be:\n(3) Disagree"]}, {"persona": {"region": "Fayoum", "sex": "male", "age": 57, "country": "Egypt", "marital_status": "married", "education": "middle", "social_class": "working class"}, "question": {"id": "Q124", "variant": 0}, "response": ["From the perspective of a married male from Fayoum, Egypt, at 57 years old and part of the working class, it is important to consider the cultural context, individual values, and socioeconomic background in answering the question. In Egypt, there is a strong sense of community and family, and individual values are heavily influenced by these factors. Additionally, as a member of the working class, socioeconomic background plays a significant role in shaping one's perspective. Considering the emic and etic perspectives, it is important to recognize that the perception of immigration and its impact on crime may differ within and outside the community. Furthermore, cultural relativism reminds us that there is no hierarchy of culture, and different perspectives must be respected. Based on these factors, the answer selected is:\n\n3) Disagree"]}, {"persona": {"region": "Fayoum", "sex": "male", "age": 60, "country": "Egypt", "marital_status": "married", "education": "middle", "social_class": "lower middle class"}, "question": {"id": "Q124", "variant": 0}, "response": ["Based on the anthropological framework, as a married male from Fayoum, Egypt, my emic perspective is influenced by the cultural context of my community, my individual values and personal experience, as well as my lower middle class socioeconomic background. In Egypt, immigration is often associated with economic hardship and social tensions, which can potentially lead to an increase in crime rates. Additionally, my age and place in society have shaped my understanding of immigration and its potential impact on crime. Therefore, considering all these factors, I would choose option (1) Agree, as I believe that immigration in my country does increase the crime rate."]}, {"persona": {"region": "Fayoum", "sex": "male", "age": 21, "country": "Egypt", "marital_status": "single", "education": "middle", "social_class": "lower middle class"}, "question": {"id": "Q124", "variant": 0}, "response": ["Based on the anthropological framework, as a single male from Fayoum, Egypt, my emic perspective on the impact of immigration on crime rate is influenced by my personal experience and socioeconomic background. I have seen how immigration has led to increased competition for limited resources and jobs, which can sometimes lead to tensions and potential involvement in criminal activities. Additionally, my cultural context and cultural relativism also play a role in shaping my perspective, as I am aware of the stigmatization and marginalization that immigrants often face, which can push some individuals towards criminal behavior. Therefore, based on my understanding and personal experience, I would have to choose:\n\n2"]}, {"persona": {"region": "Fayoum", "sex": "male", "age": 33, "country": "Egypt", "marital_status": "single", "education": "higher", "social_class": "working class"}, "question": {"id": "Q124", "variant": 0}, "response": ["In considering the question of whether immigration in my country increases the crime rate, I must take into account my emic perspective as a member of the working class in Fayoum, Egypt. My cultural context and socioeconomic background have shaped my understanding of immigration and crime. Additionally, my individual values and personal experiences have influenced my perception of this issue. I also recognize the importance of cultural relativism and the nuance in phrasing the question. Therefore, based on my perspective, I select:\n\n2) Hard to say"]}, {"persona": {"region": "Fayoum", "sex": "male", "age": 32, "country": "Egypt", "marital_status": "married", "education": "higher", "social_class": "lower middle class"}, "question": {"id": "Q124", "variant": 0}, "response": ["Based on the anthropological framework, as a married male from Fayoum, Egypt, my emic perspective is influenced by my cultural context, individual values, and socioeconomic background. I am aware that immigration can impact the social dynamics and economic prospects of a country, and I understand that my lower middle class status may lead me to perceive immigration as a potential threat to job opportunities and public safety. However, I also recognize the importance of cultural relativism and nuance in understanding the complexities of immigration and crime. Therefore, I would say it is hard to say whether immigration in my country increases the crime rate. \n\n2"]}, {"persona": {"region": "Gharbia", "sex": "male", "age": 42, "country": "Egypt", "marital_status": "married", "education": "higher", "social_class": "upper middle class"}, "question": {"id": "Q124", "variant": 0}, "response": ["Based on the anthropological framework, my perspective as a married male from Gharbia, Egypt, who is 42 years old, completed higher education, and considers myself part of the upper middle class, is influenced by my cultural context, individual values, and socioeconomic background. In Egypt, immigration is often associated with economic opportunities and the pursuit of a better life, which aligns with my personal values of seeking prosperity. Additionally, as someone from a relatively affluent background, I may have a more positive view of immigration and its potential contributions to the economy. However, I also understand the complexities of immigration and its potential impact on social dynamics and crime rates, particularly in certain areas where immigrants may face social and economic challenges. Therefore, my nuanced perspective leans towards option (2) Hard to say, as I recognize the multifaceted nature of this issue and the need for a comprehensive understanding of the specific cultural, economic, and social factors at play in order to make an informed judgment. \n\n2"]}, {"persona": {"region": "Gharbia", "sex": "male", "age": 52, "country": "Egypt", "marital_status": "married", "education": "middle", "social_class": "working class"}, "question": {"id": "Q124", "variant": 0}, "response": ["Based on the anthropological framework, as a married male from Gharbia, Egypt, with a middle education level and working-class background, my perspective is heavily influenced by my cultural context, socioeconomic background, and personal experience. In Egypt, immigration is a complex issue with many factors at play, including economic, political, and social considerations. As a member of the working class, I have personally witnessed the challenges that immigrants face in finding work and integrating into our society. However, I also understand the importance of cultural relativism and the need to consider the nuance of each individual's experience. Therefore, I believe that immigration can have both positive and negative effects on the crime rate in our country, and it is hard to make a definitive statement without considering all the factors at play.\n\n2"]}, {"persona": {"region": "Gharbia", "sex": "male", "age": 45, "country": "Egypt", "marital_status": "divorced", "education": "higher", "social_class": "upper middle class"}, "question": {"id": "Q124", "variant": 0}, "response": ["Based on my emic perspective as a divorced male from Gharbia, Egypt, I have personally witnessed how immigration has brought about changes in the cultural context of our society. The influx of immigrants has brought about new languages, customs, and traditions, which has led to some tensions within the community. Additionally, considering my higher education level and upper middle class background, I have access to information and resources that allow me to understand the socioeconomic impact of immigration on our country. However, I also acknowledge the importance of cultural relativism and nuance in understanding the complexities of immigration and crime rates. Therefore, I choose option 2: Hard to say."]}, {"persona": {"region": "Behaira", "sex": "male", "age": 23, "country": "Egypt", "marital_status": "single", "education": "middle", "social_class": "lower class"}, "question": {"id": "Q124", "variant": 0}, "response": ["Based on the anthropological framework, as a single male from Behaira, Egypt, my emic perspective is that my socioeconomic background and cultural context heavily influence my answer to this question. Behaira is a region with a high poverty rate and limited opportunities for young people, which may lead some to resort to crime out of desperation. Additionally, the cultural context of Egypt as a whole, including economic and political instability, contributes to the potential for increased crime rates. Therefore, considering my personal experience and understanding of my cultural context, I would have to agree that immigration in my country may increase the crime rate.\n\n1"]}, {"persona": {"region": "Behaira", "sex": "male", "age": 38, "country": "Egypt", "marital_status": "single", "education": "higher", "social_class": "lower class"}, "question": {"id": "Q124", "variant": 0}, "response": ["Based on my emic perspective as a lower class single male from Behaira, Egypt, I have witnessed firsthand the impact of immigration on the crime rate. The cultural context of Egypt, with its diverse population and economic challenges, has led to certain areas becoming hotspots for crime, and immigration has been a contributing factor. My individual values and personal experience have shaped my understanding, and I have seen how immigration has strained resources and led to competition for jobs, ultimately contributing to an increase in crime. Additionally, my socioeconomic background has made me more aware of the struggles faced by my community due to immigration. Therefore, I must agree that immigration in my country does increase the crime rate.\n\n1"]}, {"persona": {"region": "Behaira", "sex": "male", "age": 32, "country": "Egypt", "marital_status": "married", "education": "middle", "social_class": "lower class"}, "question": {"id": "Q124", "variant": 0}, "response": ["Based on my emic perspective as a married male from Behaira, Egypt, I have experienced firsthand the struggles of the lower class in our country. The cultural context in which I live, with its socioeconomic background, has shaped my understanding of the impact of immigration on crime rates. I have seen how the influx of immigrants, often struggling to find work and provide for their families, can lead to increased competition for limited resources and opportunities, which can unfortunately lead to an increase in crime. Additionally, my personal experiences and values have led me to believe that immigration does have an impact on crime rates in our country. Therefore, I choose option (1) Agree."]}, {"persona": {"region": "Behaira", "sex": "female", "age": 37, "country": "Egypt", "marital_status": "married", "education": "middle", "social_class": "working class"}, "question": {"id": "Q124", "variant": 0}, "response": ["Based on the anthropological framework, as a married female from Behaira, Egypt, my emic perspective and cultural context lead me to understand that immigration is often seen as a source of potential economic and social change in my community. My personal experience and socioeconomic background as part of the working class have taught me to value the contributions that immigrants bring to our society. Additionally, cultural relativism teaches me that there is no objective \"better\" culture, and so I do not believe that immigration inherently increases crime. Furthermore, considering the nuanced phrasing of the question and the complexity of the issue, I would have to choose:\n\n3"]}, {"persona": {"region": "Behaira", "sex": "male", "age": 48, "country": "Egypt", "marital_status": "married", "education": "middle", "social_class": "working class"}, "question": {"id": "Q124", "variant": 0}, "response": ["Based on the anthropological framework, as a married male from Behaira, Egypt, with a middle education level and part of the working class, my perspective is heavily influenced by my cultural context, individual values, and socioeconomic background. In Egypt, there are complex societal and economic factors that contribute to the immigration situation, and my personal experience and values lead me to believe that immigration does not necessarily increase the crime rate. Additionally, cultural relativism teaches us that every culture has its own unique set of values and norms, and it would be unfair to generalize the impact of immigration on crime rates without considering the specific cultural and socioeconomic context of Egypt. Therefore, based on my understanding and experience, I choose the following option:\n\n3"]}, {"persona": {"region": "Behaira", "sex": "female", "age": 34, "country": "Egypt", "marital_status": "married", "education": "middle", "social_class": "lower class"}, "question": {"id": "Q124", "variant": 0}, "response": ["Based on the anthropological framework, my perspective as a married female from Behaira, Egypt, who is 34 years old, has completed middle education, and considers herself part of the lower class, is heavily influenced by my cultural context, socioeconomic background, and personal experience. In Egypt, immigration is often associated with economic hardship and competition for limited resources, which may lead to increased crime in certain areas. Additionally, as a lower-class individual, I may have personal experiences or know people in my community who have been affected by crime related to immigration. Therefore, I would choose option 1: Agree."]}, {"persona": {"region": "Behaira", "sex": "female", "age": 30, "country": "Egypt", "marital_status": "divorced", "education": "lower", "social_class": "lower class"}, "question": {"id": "Q124", "variant": 0}, "response": ["Based on my emic perspective as a divorced female from Behaira, Egypt, my personal experience and individual values play a significant role in my understanding of this topic. As someone from the lower class, I am keenly aware of the socioeconomic background and cultural context of my community. I understand that immigration may impact the dynamics of our society, but I also recognize the importance of cultural relativism and nuance in considering this question. Therefore, I would have to say that it is hard to say for sure whether immigration in my country increases the crime rate."]}, {"persona": {"region": "Behaira", "sex": "male", "age": 40, "country": "Egypt", "marital_status": "married", "education": "higher", "social_class": "lower middle class"}, "question": {"id": "Q124", "variant": 0}, "response": ["Based on the anthropological framework, my personal experience and individual values play a significant role in how I perceive the issue of immigration and crime rate. As a married male from Behaira, Egypt, I have seen the impact of immigration on my community firsthand. I also understand the cultural context and the socioeconomic background of many immigrants who come to Egypt in search of better opportunities. Additionally, I am aware of the space and time factors, as well as the nuances of the situation. Taking all of this into consideration, I would have to say that it is hard to say whether immigration in my country increases the crime rate. \n\n2"]}, {"persona": {"region": "Behaira", "sex": "male", "age": 38, "country": "Egypt", "marital_status": "married", "education": "middle", "social_class": "working class"}, "question": {"id": "Q124", "variant": 0}, "response": ["Based on the anthropological framework, my perspective on immigration and crime rate in my country is influenced by my cultural context, socioeconomic background, and personal experience. As a working-class married male from Behaira, Egypt, I have seen how socioeconomic factors and cultural context play a role in shaping perceptions of immigration and crime. I understand that immigration can bring about changes in the social fabric and may lead to tensions, but I also recognize the importance of cultural relativism and nuance in understanding these complex issues. Therefore, my answer is:\n2"]}, {"persona": {"region": "Behaira", "sex": "female", "age": 30, "country": "Egypt", "marital_status": "married", "education": "higher", "social_class": "lower class"}, "question": {"id": "Q124", "variant": 0}, "response": ["Based on the anthropological framework, my cultural context as a married female from Behaira, Egypt, and my lower class socioeconomic background will heavily influence my perspective on immigration and crime. My personal experience and individual values also play a significant role in shaping my understanding. Additionally, the nuance of the question is important to consider as it may impact my response. With all of this in mind, I choose:\n\n3"]}, {"persona": {"region": "Behaira", "sex": "female", "age": 35, "country": "Egypt", "marital_status": "married", "education": "middle", "social_class": "working class"}, "question": {"id": "Q124", "variant": 0}, "response": ["From the anthropological perspective, my emic viewpoint as a married female from Behaira, Egypt, with a working-class background and completing only a middle education level, is heavily influenced by my cultural context, individual values, and personal experiences. In Egypt, the cultural context and socioeconomic background play a significant role in shaping perceptions of immigration and crime. Additionally, my personal experience and values will also influence my understanding of this issue. Furthermore, cultural relativism is crucial in recognizing that my perspective may differ from others due to my unique background. Therefore, my nuanced understanding of this question is shaped by these factors, and I believe that immigration in my country does not necessarily increase the crime rate. \n\n3"]}, {"persona": {"region": "Behaira", "sex": "male", "age": 52, "country": "Egypt", "marital_status": "married", "education": "middle", "social_class": "lower class"}, "question": {"id": "Q124", "variant": 0}, "response": ["Based on the anthropological framework described above, as a married male from Behaira, Egypt, who is 52 years old and part of the lower class, my perspective on the impact of immigration on crime rates in my country is shaped by my cultural context, socioeconomic background, and personal experience. I understand that immigration can bring about economic and social changes, and that these changes can impact crime rates. However, I also recognize the importance of cultural relativism and the nuance of each situation. Therefore, I believe it is hard to say definitively whether immigration increases the crime rate in my country.\n\n2"]}, {"persona": {"region": "Alexandria", "sex": "female", "age": 41, "country": "Egypt", "marital_status": "single", "education": "middle", "social_class": "lower class"}, "question": {"id": "Q124", "variant": 0}, "response": ["Based on my personal experience and socioeconomic background as a single female from Alexandria, Egypt, I understand that immigration can often be seen as a scapegoat for increased crime rates. However, I also recognize the importance of cultural context and the nuance of the situation. Immigration can bring economic opportunities and cultural diversity, which can positively impact the community. Additionally, the etic perspective of viewing immigration as a cause of crime may not fully capture the complex dynamics at play. Therefore, I choose option (2) Hard to say."]}, {"persona": {"region": "Alexandria", "sex": "female", "age": 21, "country": "Egypt", "marital_status": "single", "education": "middle", "social_class": "lower class"}, "question": {"id": "Q124", "variant": 0}, "response": ["Based on my cultural context and socioeconomic background, I have observed that immigration in my country is often associated with lower-income neighborhoods and areas with limited resources. This can lead to competition for jobs and resources, which may contribute to higher crime rates in these areas. Additionally, individuals from different cultural backgrounds may face discrimination and social exclusion, which can also lead to higher rates of crime. Therefore, I would agree that immigration in my country may increase the crime rate.\n\n1"]}, {"persona": {"region": "Alexandria", "sex": "female", "age": 35, "country": "Egypt", "marital_status": "married", "education": "middle", "social_class": "lower class"}, "question": {"id": "Q124", "variant": 0}, "response": ["Based on the anthropological framework, I would approach this question from the perspective of my cultural context, individual values, and socioeconomic background. As a married female from Alexandria, Egypt, I come from a lower socioeconomic background and have experienced the struggles of my community. I understand that immigration is often due to economic and social hardships in other countries, and I empathize with the challenges that immigrants face. I also know that crime rates are influenced by a variety of factors, including poverty, social inequality, and government policies. Therefore, I believe it is hard to say whether immigration in my country increases the crime rate, as it is a complex issue with many variables at play.\n\n2"]}, {"persona": {"region": "Alexandria", "sex": "male", "age": 34, "country": "Egypt", "marital_status": "married", "education": "higher", "social_class": "working class"}, "question": {"id": "Q124", "variant": 0}, "response": ["Based on the anthropological framework, my emic perspective as a married male from Alexandria, Egypt, with a higher education level, and part of the working class, is influenced by my cultural context, individual values, and socioeconomic background. In Egypt, immigration is a complex issue tied to economic, political, and social factors, and it is important to consider the nuance of the question. As an individual, I value the contributions that immigrants make to our society and economy, and I understand the challenges they face. However, from my socioeconomic background, I am also aware of the struggles faced by working-class Egyptians, and I recognize that there may be tensions and disparities that can lead to crime. Therefore, my perspective is that the relationship between immigration and crime is not straightforward, and it is hard to say definitively whether immigration increases the crime rate in my country.\n\n2"]}, {"persona": {"region": "Alexandria", "sex": "female", "age": 37, "country": "Egypt", "marital_status": "married", "education": "higher", "social_class": "lower middle class"}, "question": {"id": "Q124", "variant": 0}, "response": ["Based on the anthropological framework, as a married female from Alexandria, Egypt, my emic perspective is influenced by my cultural context, individual values, and socioeconomic background. In Egypt, immigration is often associated with economic hardship and social strain, which can lead to increased crime rates. Additionally, as part of the lower middle class, I may perceive immigration as competition for limited resources and opportunities, potentially leading to social unrest and crime. Therefore, I would choose option (1) Agree, as immigration in my country may indeed increase the crime rate from my subjective perspective."]}, {"persona": {"region": "Alexandria", "sex": "female", "age": 56, "country": "Egypt", "marital_status": "divorced", "education": "middle", "social_class": "working class"}, "question": {"id": "Q124", "variant": 0}, "response": ["Based on the anthropological framework, my perspective as a divorced female from Alexandria, Egypt, is influenced by my cultural context, individual values, and socioeconomic background. In Egypt, the cultural context is deeply rooted in community and family values, and the socioeconomic background of working-class individuals like myself often leads to different experiences and perspectives. Additionally, my age and place of living in Alexandria also shape my understanding of immigration and crime rates. Considering all these factors, I would have to say that it is hard to say whether immigration in my country increases the crime rate.\n\n2"]}, {"persona": {"region": "Alexandria", "sex": "male", "age": 48, "country": "Egypt", "marital_status": "married", "education": "higher", "social_class": "working class"}, "question": {"id": "Q124", "variant": 0}, "response": ["Based on the anthropological framework, my perspective as a married male from Alexandria, Egypt, who is 48 years old, completed higher education, and considers myself part of the working class, is deeply influenced by my cultural context, individual values, and socioeconomic background. In Egypt, there is a strong sense of community and a history of hospitality towards immigrants. Additionally, as a member of the working class, I understand the struggles that many immigrants go through and the challenges they face. I also recognize that crime rates are influenced by a multitude of factors beyond immigration, including economic opportunities, social policies, and historical context. Therefore, I choose option (3) Disagree."]}, {"persona": {"region": "Alexandria", "sex": "female", "age": 30, "country": "Egypt", "marital_status": "married", "education": "middle", "social_class": "working class"}, "question": {"id": "Q124", "variant": 0}, "response": ["Based on the anthropological framework, as a married female from Alexandria, Egypt, my emic perspective is influenced by the cultural context and socioeconomic background in which I live. Immigration in my country is often associated with a perceived increase in crime rates, but this is a subjective perception influenced by individual values and personal experience. Additionally, cultural relativism teaches us that there is no hierarchy of culture, and space and time also play a role in shaping my perspective. Therefore, I would choose option (2) Hard to say, as my understanding is nuanced and influenced by my personal experience and cultural context."]}, {"persona": {"region": "Alexandria", "sex": "male", "age": 19, "country": "Egypt", "marital_status": "single", "education": "middle", "social_class": "lower class"}, "question": {"id": "Q124", "variant": 0}, "response": ["Based on the anthropological framework, as a 19-year-old male from Alexandria, Egypt, with a lower socioeconomic background, my emic perspective is influenced by my personal experiences and cultural context. In my community, many people struggle to make a living and face limited opportunities for education and employment. This often leads to desperation and can contribute to a higher crime rate. Additionally, the influx of immigrants may strain already scarce resources and create competition for jobs, potentially leading to an increase in crime. Therefore, I would have to agree that immigration in my country increases the crime rate.\n\n1"]}, {"persona": {"region": "Alexandria", "sex": "male", "age": 45, "country": "Egypt", "marital_status": "married", "education": "middle", "social_class": "lower middle class"}, "question": {"id": "Q124", "variant": 0}, "response": ["Based on the anthropological framework, as a married male from Alexandria, Egypt, my emic perspective on the impact of immigration on crime rate is influenced by my cultural context, individual values, and socioeconomic background. In Egypt, there is a complex relationship between immigration and crime, as immigrants often face economic challenges and discrimination, which can contribute to their involvement in criminal activities. Additionally, my lower middle-class status and middle education level may lead me to perceive immigrants as competition for limited resources, potentially leading to an increase in crime. However, I also recognize the importance of cultural relativism and nuance, understanding that not all immigrants are involved in criminal activities and that socioeconomic factors play a significant role in crime rates. Therefore, I would choose option (2) Hard to say, as it is a complex issue with various influencing factors. \n\n2"]}, {"persona": {"region": "Alexandria", "sex": "male", "age": 23, "country": "Egypt", "marital_status": "single", "education": "higher", "social_class": "lower class"}, "question": {"id": "Q124", "variant": 0}, "response": ["Based on the anthropological framework, as a single male from Alexandria, Egypt who is 23 years old and part of the lower class, my emic perspective and cultural context lead me to believe that immigration does not necessarily increase the crime rate. Egypt has a long history of immigration and diverse cultural influences, which has contributed to the richness of our society. My personal experience and socioeconomic background also inform my understanding that crime is not solely determined by immigration but by a complex interplay of factors. Additionally, cultural relativism teaches me that it is important to avoid making blanket statements about immigration and crime without considering the specific nuances of each situation. Therefore, I choose:\n2"]}, {"persona": {"region": "Alexandria", "sex": "female", "age": 28, "country": "Egypt", "marital_status": "married", "education": "middle", "social_class": "working class"}, "question": {"id": "Q124", "variant": 0}, "response": ["Based on the anthropological framework, as a married female from Alexandria, Egypt, my emic perspective is influenced by my cultural context, individual values, and socioeconomic background. In Egypt, immigration has been a hotly debated topic, and crime rates have been a concern. However, I believe that cultural relativism plays a significant role in this discussion. I understand that immigrants may face challenges and discrimination, which could contribute to social and economic struggles, potentially leading to higher crime rates. Therefore, I would say it is hard to say whether immigration increases the crime rate in my country.\n\n2"]}, {"persona": {"region": "Alexandria", "sex": "male", "age": 34, "country": "Egypt", "marital_status": "single", "education": "higher", "social_class": "working class"}, "question": {"id": "Q124", "variant": 0}, "response": ["Based on the anthropological framework, my response is influenced by my individual values and personal experience as a working-class male from Alexandria, Egypt. My cultural context and socioeconomic background also play a significant role in shaping my perspective. Additionally, the emic and etic perspectives highlight the importance of considering both in-group and out-group ways of thinking about a question. In my experience, immigration has not led to an increase in crime in my community. I have witnessed the positive contributions of immigrants to our society, and I believe that cultural relativism teaches us to understand and appreciate different perspectives. Therefore, I choose option 3: Disagree."]}, {"persona": {"region": "Alexandria", "sex": "male", "age": 30, "country": "Egypt", "marital_status": "married", "education": "higher", "social_class": "lower middle class"}, "question": {"id": "Q124", "variant": 0}, "response": ["Based on my emic perspective as a married male from Alexandria, Egypt, I understand that immigration can have both positive and negative impacts on the crime rate. The cultural context of Egypt is diverse, and immigration can bring in different cultural norms and values that may clash with the existing ones, potentially leading to an increase in crime. However, I also recognize that immigration can bring in new ideas and innovations that can positively contribute to the economy and society, potentially reducing the crime rate. Additionally, considering my lower middle class socioeconomic background, I am aware that immigrants often face economic hardship and may resort to crime out of desperation. Therefore, I believe that the impact of immigration on crime rate is nuanced and cannot be generalized. \n\n2"]}, {"persona": {"region": "Alexandria", "sex": "female", "age": 49, "country": "Egypt", "marital_status": "married", "education": "higher", "social_class": "lower middle class"}, "question": {"id": "Q124", "variant": 0}, "response": ["Based on my emic perspective as a married female from Alexandria, Egypt, I have observed that the cultural context and socioeconomic background play a significant role in shaping the understanding of immigration and its impact on crime rates. In my community, there is a strong emphasis on family and kinship networks, and individuals often rely on these networks for support and social cohesion. Additionally, the lower middle-class status of many individuals in my community means that there are limited economic opportunities, which can lead to increased competition and potential tensions. However, I also recognize the importance of cultural relativism and nuance in understanding this issue, as there are diverse experiences and perspectives within my community that may influence how immigration is perceived. Ultimately, my personal values and experiences lead me to choose option (2) Hard to say."]}, {"persona": {"region": "Kafr el-sheikh", "sex": "male", "age": 49, "country": "Egypt", "marital_status": "married", "education": "higher", "social_class": "working class"}, "question": {"id": "Q124", "variant": 0}, "response": ["Based on the anthropological framework, my emic perspective as a married male from Kafr el-sheikh, Egypt, who is 49 years old and part of the working class, is shaped by my cultural context, individual values, and personal experience. In Egypt, immigration has been a topic of debate and can be seen as a source of potential economic opportunity and cultural exchange. However, it can also be perceived as a strain on resources and potential contributor to crime. My socioeconomic background as a working-class individual also influences my perception of immigration and crime. Additionally, cultural relativism teaches us that there is no hierarchy of culture, so my understanding of immigration and crime may differ from others based on their cultural context. Therefore, my nuanced understanding leads me to believe that immigration may potentially impact the crime rate in my country, but ultimately, it is hard to say definitively. \n\n2"]}, {"persona": {"region": "Kafr el-sheikh", "sex": "male", "age": 25, "country": "Egypt", "marital_status": "single", "education": "middle", "social_class": "lower middle class"}, "question": {"id": "Q124", "variant": 0}, "response": ["Based on the anthropological framework, I will answer this question from the perspective of a single male from Kafr el-sheikh, Egypt, who is 25 years old, has completed middle education, and considers himself part of the lower middle class. My emic perspective is that immigration can potentially increase the crime rate as it may lead to competition for resources and job opportunities, which can sometimes result in criminal activities. Additionally, the etic perspective from the lower middle class community in Kafr el-sheikh, Egypt, is that immigrants may face economic hardships and discrimination, which can lead to involvement in criminal activities. Furthermore, the cultural context of Egypt, the socioeconomic background of the persona, and the nuanced phrasing of the question all contribute to the consideration that immigration may indeed increase the crime rate in the country.\n\n3"]}, {"persona": {"region": "Kafr el-sheikh", "sex": "male", "age": 59, "country": "Egypt", "marital_status": "married", "education": "higher", "social_class": "lower middle class"}, "question": {"id": "Q124", "variant": 0}, "response": ["Based on my emic perspective as a married male from Kafr el-sheikh, Egypt, my cultural context and personal experience inform my understanding of immigration and crime rates. From my socioeconomic background as part of the lower middle class, I have witnessed firsthand the struggles and challenges faced by immigrants in my community. I understand that the lack of economic opportunities and social support for immigrants may lead to higher rates of crime. However, I also recognize the importance of cultural relativism and the nuance of each individual's experience. Therefore, I select:\n2"]}, {"persona": {"region": "Kafr el-sheikh", "sex": "female", "age": 38, "country": "Egypt", "marital_status": "married", "education": "middle", "social_class": "working class"}, "question": {"id": "Q124", "variant": 0}, "response": ["Based on the anthropological framework, my perspective as a married female from Kafr el-sheikh, Egypt, who is 38 years old and part of the working class, is heavily influenced by my cultural context, individual values, and socioeconomic background. In Egypt, immigration has been a topic of debate and there are varying perspectives within the country. As a member of the working class, I may have concerns about competition for jobs and resources, which could lead to a belief that immigration increases crime. Additionally, my cultural context and personal experiences may have shaped my understanding of immigration and its potential impact on crime. Therefore, I choose option (1) Agree."]}, {"persona": {"region": "Kafr el-sheikh", "sex": "male", "age": 35, "country": "Egypt", "marital_status": "married", "education": "higher", "social_class": "lower middle class"}, "question": {"id": "Q124", "variant": 0}, "response": ["Based on the anthropological framework, my perspective as a married male from Kafr el-sheikh, Egypt, is deeply rooted in my cultural context, socioeconomic background, and personal experience. In Egypt, lower middle-class individuals like myself often face economic challenges and limited opportunities, which can lead to feelings of insecurity and vulnerability. This may be exacerbated by the presence of immigrants who are also seeking employment and economic stability. Additionally, cultural relativism teaches us that different cultures have different norms and values, and it would be unfair to attribute an increase in crime solely to immigrants. Therefore, considering the nuanced phrasing of the question and the socioeconomic background of my persona, I would have to select:\n\n2) Hard to say"]}, {"persona": {"region": "Kafr el-sheikh", "sex": "male", "age": 49, "country": "Egypt", "marital_status": "married", "education": "middle", "social_class": "lower class"}, "question": {"id": "Q124", "variant": 0}, "response": ["Based on my personal experience and socioeconomic background, I believe that immigration in my country does increase the crime rate. As a member of the lower class, I have seen firsthand the struggles and competition for resources that can arise when new immigrants come into our community. Additionally, the cultural context of our region plays a role, as different cultural norms and values may clash and lead to tension. This perspective is also influenced by the emic and etic perspectives, as I have seen how in-group and out-group dynamics can impact social issues. Overall, my understanding is shaped by a combination of individual values, personal experience, and the cultural relativism that is a crucial part of understanding different personas.\n\n2"]}, {"persona": {"region": "Kafr el-sheikh", "sex": "male", "age": 37, "country": "Egypt", "marital_status": "married", "education": "middle", "social_class": "lower class"}, "question": {"id": "Q124", "variant": 0}, "response": ["Based on my personal experience and socioeconomic background, I understand that immigration can have a significant impact on the crime rate in my country. As a member of the lower class in Kafr el-sheikh, Egypt, I have seen firsthand how the influx of immigrants can strain resources and lead to increased competition for jobs and housing. This can create tension and potentially lead to an increase in crime as people struggle to make ends meet. Additionally, the cultural context and nuances of the situation must be taken into account, as different immigrant groups may face discrimination and marginalization, which can also contribute to higher crime rates. Therefore, I would have to agree that immigration in my country may increase the crime rate.\n\n1"]}, {"persona": {"region": "Menofia", "sex": "female", "age": 22, "country": "Egypt", "marital_status": "single", "education": "middle", "social_class": "lower class"}, "question": {"id": "Q124", "variant": 0}, "response": ["From my emic perspective as a single female from Menofia, Egypt, my cultural context and socioeconomic background play a significant role in my understanding of immigration and crime rates. In my community, there is a perception that immigrants, especially those from different cultural backgrounds, are more likely to engage in criminal activities. This perception is influenced by personal experiences and individual values, as well as the socioeconomic challenges faced by the lower class. Additionally, cultural relativism is important to consider, as our societal norms and values may differ from those of other cultures. Therefore, based on my personal understanding and experiences, I would have to agree that immigration in my country increases the crime rate.\n\n2"]}, {"persona": {"region": "Menofia", "sex": "female", "age": 25, "country": "Egypt", "marital_status": "married", "education": "middle", "social_class": "lower class"}, "question": {"id": "Q124", "variant": 0}, "response": ["Based on the anthropological framework, my emic perspective as a lower-class married woman from Menofia, Egypt, would be heavily influenced by my cultural context, individual values, and personal experience. I have seen firsthand how immigration has led to increased competition for limited resources and job opportunities, which has in turn led to some individuals turning to crime as a means of survival. Additionally, my socioeconomic background would also play a role in shaping my perspective, as I am more likely to be affected by the negative consequences of immigration, such as increased crime rates. Therefore, my answer to the question would be:\n\n2"]}, {"persona": {"region": "Menofia", "sex": "male", "age": 28, "country": "Egypt", "marital_status": "single", "education": "higher", "social_class": "working class"}, "question": {"id": "Q124", "variant": 0}, "response": ["Based on the anthropological framework, my emic perspective as a single male from Menofia, Egypt, who is 28 years old and part of the working class, is influenced by my cultural context, individual values, and socioeconomic background. In Egypt, immigration is often associated with economic opportunities and cultural exchange, and not necessarily with an increase in crime. Additionally, my personal experience and values lead me to believe that immigrants contribute positively to society. Furthermore, my socioeconomic background as a member of the working class means that I have interacted with immigrants in various capacities and have not seen a correlation between immigration and crime. Therefore, I would choose:\n\n3"]}, {"persona": {"region": "Menofia", "sex": "male", "age": 35, "country": "Egypt", "marital_status": "married", "education": "middle", "social_class": "lower middle class"}, "question": {"id": "Q124", "variant": 0}, "response": ["Based on the anthropological framework, my cultural context as a married male from Menofia, Egypt, and my lower middle class socioeconomic background, along with my middle education level, shape my understanding of immigration and crime rate in my country. I have an emic perspective on this issue, considering the cultural context and individual values and personal experience. I understand that immigrants often face socioeconomic challenges and discrimination, which can lead to higher crime rates. Additionally, my understanding of cultural relativism tells me that there are nuanced factors at play in this issue, so it is hard to say definitively whether immigration increases the crime rate in my country.\n\n2"]}, {"persona": {"region": "Menofia", "sex": "male", "age": 55, "country": "Egypt", "marital_status": "married", "education": "middle", "social_class": "working class"}, "question": {"id": "Q124", "variant": 0}, "response": ["Based on my personal experience and cultural context, I believe that immigration in my country does not necessarily increase the crime rate. In fact, many immigrants come to Egypt seeking better economic opportunities and are not involved in criminal activities. Additionally, the working class, like myself, often welcomes immigrants as they contribute to the economy and bring diversity to our communities. Furthermore, cultural relativism teaches us that we should not judge others based on their background or nationality, and it is important to approach this issue with nuance and understanding. Therefore, I would have to disagree with the statement that immigration increases the crime rate in my country.\n\n3"]}, {"persona": {"region": "Menofia", "sex": "male", "age": 53, "country": "Egypt", "marital_status": "married", "education": "higher", "social_class": "lower middle class"}, "question": {"id": "Q124", "variant": 0}, "response": ["From an emic perspective, as a married male from Menofia, Egypt, I have witnessed firsthand the impact of immigration on our society. The cultural context in Egypt is such that we have a long history of welcoming immigrants from various parts of the world, and this has enriched our society in many ways. However, individual values and personal experiences also play a role in shaping perceptions, and I have seen how immigration has brought about socioeconomic challenges in some areas, leading to an increase in crime rates. Additionally, the socioeconomic background of many immigrants may also contribute to this issue. Considering the nuances of this question, I would have to agree that immigration in our country has indeed led to an increase in the crime rate.\n\n1"]}, {"persona": {"region": "Menofia", "sex": "male", "age": 59, "country": "Egypt", "marital_status": "married", "education": "middle", "social_class": "working class"}, "question": {"id": "Q124", "variant": 0}, "response": ["Based on the anthropological framework, as a married male from Menofia, Egypt, my emic perspective is influenced by my cultural context, individual values, and personal experience. In Egypt, immigration has been a topic of debate and controversy, and as a member of the working class, I have seen firsthand the impact of immigration on our society. The socioeconomic background of immigrants, along with cultural relativism, plays a significant role in how they are perceived and treated. Additionally, space and time also factor into this issue, as the influx of immigrants has changed the dynamics of our community. Therefore, I choose option (2) Hard to say, as the relationship between immigration and crime rate is complex and multifaceted in our cultural context."]}, {"persona": {"region": "Menofia", "sex": "female", "age": 42, "country": "Egypt", "marital_status": "married", "education": "middle", "social_class": "lower middle class"}, "question": {"id": "Q124", "variant": 0}, "response": ["Based on the anthropological framework, my perspective on immigration and crime rates is influenced by my cultural context, socioeconomic background, and personal experience. In Menofia, Egypt, the cultural context emphasizes the importance of community and social cohesion, and I have personally witnessed how immigration has brought diversity and new perspectives to our society. Additionally, as part of the lower middle class, I understand the struggles and challenges that immigrants face in finding stable employment and integrating into our society. Therefore, I believe that immigration does not necessarily increase the crime rate, and in fact, it can contribute positively to our community by bringing new ideas and perspectives. \n\n3"]}, {"persona": {"region": "Menofia", "sex": "male", "age": 39, "country": "Egypt", "marital_status": "married", "education": "higher", "social_class": "working class"}, "question": {"id": "Q124", "variant": 0}, "response": ["Based on the anthropological framework, my cultural context as a married male from Menofia, Egypt, my age, education level, and working class background all play a significant role in shaping my perspective. My personal experience and values also affect my understanding of immigration and its potential impact on crime rates. Additionally, the cultural relativism framework reminds me that different cultures may have different experiences with immigration and crime, and as such, there is no objective answer. Therefore, I select option 2: Hard to say."]}, {"persona": {"region": "Menofia", "sex": "male", "age": 34, "country": "Egypt", "marital_status": "married", "education": "middle", "social_class": "lower middle class"}, "question": {"id": "Q124", "variant": 0}, "response": ["From the emic and etic perspective, as a married male from Menofia, Egypt, I have a unique understanding of the social and cultural context of my country. I am influenced by the cultural and socioeconomic background of my community, and I have personal experiences that shape my perspective. Additionally, as a member of the lower middle class, I am aware of the nuances and complexities of immigration and its potential impact on crime rates. Taking into account these factors, I choose option (2) Hard to say, as I believe that immigration and its impact on crime rates is a complex issue that cannot be simply categorized as either increasing or decreasing crime."]}, {"persona": {"region": "Menofia", "sex": "male", "age": 22, "country": "Egypt", "marital_status": "single", "education": "higher", "social_class": "working class"}, "question": {"id": "Q124", "variant": 0}, "response": ["Based on my emic perspective as a single male from Menofia, Egypt, I understand that immigration is often seen as a contributor to an increase in crime rates. However, from an etic perspective, I am aware that this belief may be influenced by cultural and socioeconomic background. In my cultural context, there is a tendency to blame immigrants for social issues, but I also recognize the importance of cultural relativism and the need to consider the nuance of the situation. Additionally, my individual values and personal experience lead me to believe that immigration does not necessarily increase crime rates, as I have witnessed hardworking immigrants striving to make a better life for themselves and their families. Therefore, I choose option (3) Disagree."]}, {"persona": {"region": "Menofia", "sex": "male", "age": 21, "country": "Egypt", "marital_status": "single", "education": "middle", "social_class": "working class"}, "question": {"id": "Q124", "variant": 0}, "response": ["Based on the anthropological framework, as a 21-year-old male from Menofia, Egypt, with a working-class background and a middle education level, my emic perspective on immigration and crime rate in my country is influenced by my cultural context, individual values, and personal experience. In Egypt, there is a strong sense of community and family, and crime rates are often influenced by socioeconomic factors rather than immigration. Additionally, my personal experience and values lead me to believe that immigration does not necessarily lead to an increase in crime, as I have seen immigrants contribute positively to our society. Therefore, I would have to disagree with the statement that immigration in my country increases the crime rate.\n\n3"]}, {"persona": {"region": "Menofia", "sex": "male", "age": 36, "country": "Egypt", "marital_status": "married", "education": "higher", "social_class": "working class"}, "question": {"id": "Q124", "variant": 0}, "response": ["From the emic perspective of someone from Menofia, Egypt, the cultural context plays a crucial role in understanding the impact of immigration on crime rates. The socioeconomic background and individual values of the working class in Menofia are also important factors to consider. Additionally, the cultural relativism of the Egyptian society and the nuanced phrasing of the question are significant in shaping the perspective on this issue. Given these factors, it is difficult to make a straightforward judgment without further nuanced analysis.\n\n2"]}, {"persona": {"region": "Menofia", "sex": "female", "age": 52, "country": "Egypt", "marital_status": "married", "education": "higher", "social_class": "lower middle class"}, "question": {"id": "Q124", "variant": 0}, "response": ["Based on the anthropological framework, as a married female from Menofia, Egypt, my emic perspective is influenced by the cultural context of my community and the socioeconomic background of the lower middle class. My personal experience and individual values also play a role in shaping my understanding of immigration and crime. Considering the nuanced phrasing of the question, I would choose option (3) Disagree, as I believe that immigration in my country does not necessarily increase the crime rate."]}, {"persona": {"region": "Menofia", "sex": "male", "age": 52, "country": "Egypt", "marital_status": "married", "education": "higher", "social_class": "lower middle class"}, "question": {"id": "Q124", "variant": 0}, "response": ["Based on the anthropological framework, as a married male from Menofia, Egypt, my emic perspective would lead me to consider the cultural context and socioeconomic background of immigration in my country. I would understand that immigration can bring about changes in the cultural landscape and potentially affect the socioeconomic dynamics of the area. Additionally, my personal experience and individual values would lead me to acknowledge that immigration can impact the crime rate, but I would also consider the nuanced factors such as the specific circumstances of the immigrants and the existing social structures in place. Therefore, I would choose option (2) Hard to say, as there are multiple factors to consider and it is not a straightforward answer."]}, {"persona": {"region": "Menofia", "sex": "male", "age": 39, "country": "Egypt", "marital_status": "married", "education": "middle", "social_class": "lower class"}, "question": {"id": "Q124", "variant": 0}, "response": ["Based on my personal experience and socioeconomic background, I believe that immigration in my country does increase the crime rate. As a member of the lower class in Menofia, Egypt, I have seen firsthand how competition for jobs and resources can lead to tensions between immigrants and locals, which can sometimes result in criminal activity. Additionally, the cultural context and space and time factors in Egypt play a role in how immigrants are perceived and treated, which can contribute to social issues. Therefore, based on these factors, I would have to say that I agree with the statement.\n1"]}, {"persona": {"region": "Menofia", "sex": "male", "age": 23, "country": "Egypt", "marital_status": "single", "education": "middle", "social_class": "lower middle class"}, "question": {"id": "Q124", "variant": 0}, "response": ["Based on the anthropological framework, my emic perspective as a single male from Menofia, Egypt, leads me to consider the cultural context, individual values, socioeconomic background, and space and time in my understanding of immigration and crime rates. In my cultural context, there is a strong emphasis on community and family, and immigration may disrupt these dynamics. Additionally, my personal experience and values lead me to believe that immigration may strain resources and increase competition, potentially leading to an increase in crime. Considering my lower middle class background, I also acknowledge the socioeconomic implications of immigration, which may contribute to economic instability and, consequently, higher crime rates. Furthermore, as a 23-year-old, I recognize the impact of immigration on the job market and social dynamics in my community. Therefore, I choose option (1) Agree."]}, {"persona": {"region": "Dakahlia", "sex": "female", "age": 24, "country": "Egypt", "marital_status": "single", "education": "higher", "social_class": "lower middle class"}, "question": {"id": "Q124", "variant": 0}, "response": ["From the emic perspective of a single female from Dakahlia, Egypt, the cultural context and socioeconomic background play a crucial role in understanding and answering this question. As a member of the lower middle class, I am aware of the challenges and opportunities that come with living in this specific social and economic context. Additionally, my individual values and personal experiences have shaped my understanding of immigration and crime. I have witnessed firsthand the struggles and discrimination faced by immigrants in my community, which has led me to believe that immigration does not necessarily increase the crime rate. Moreover, from a cultural relativism standpoint, I understand that there is no objective hierarchy of cultures, and it is important to consider the nuanced phrasing of the question. Therefore, based on my perspective, I choose option (3) Disagree."]}, {"persona": {"region": "Dakahlia", "sex": "male", "age": 36, "country": "Egypt", "marital_status": "married", "education": "higher", "social_class": "upper middle class"}, "question": {"id": "Q124", "variant": 0}, "response": ["Based on the anthropological framework, my emic perspective as a married male from Dakahlia, Egypt, would be influenced by my cultural context, individual values, and socioeconomic background. In Egypt, immigration is often viewed as a source of potential economic and social instability, and as a member of the upper middle class, I may have concerns about the impact of immigration on the country's crime rate. Additionally, my higher education level may lead me to consider the issue from a more nuanced perspective, taking into account the complexities of immigration and its potential effects on crime. Therefore, my answer would be:\n\n2"]}, {"persona": {"region": "Dakahlia", "sex": "female", "age": 71, "country": "Egypt", "marital_status": "married", "education": "higher", "social_class": "upper middle class"}, "question": {"id": "Q124", "variant": 0}, "response": ["From an anthropological perspective, my individual values and personal experience, as well as my socioeconomic background and cultural context, all play a significant role in shaping my viewpoint on immigration and crime rates. As a 71-year-old married woman from Dakahlia, Egypt, who has completed higher education and considers herself part of the upper middle class, I am likely to have a more conservative perspective on immigration. My cultural context and personal values may lead me to believe that immigration could potentially lead to an increase in crime rates, as I may perceive immigrants as outsiders who may disrupt the social order. Additionally, my socioeconomic background may also influence my perspective, as individuals from higher socioeconomic classes may have concerns about the potential impact of immigration on their communities. Therefore, I choose the following option:\n\n3"]}, {"persona": {"region": "Dakahlia", "sex": "male", "age": 55, "country": "Egypt", "marital_status": "married", "education": "higher", "social_class": "upper middle class"}, "question": {"id": "Q124", "variant": 0}, "response": ["Based on the anthropological framework, as a married male from Dakahlia, Egypt, who is 55 years old and part of the upper middle class, my perspective on immigration and crime rate is influenced by my cultural context, individual values, and socioeconomic background. In Egypt, immigration is often seen as a source of economic opportunity and cultural exchange. However, there may be concerns about the impact of immigration on the local job market and community dynamics. As someone with a higher education level and a comfortable socioeconomic background, I am inclined to believe that immigration does not necessarily lead to an increase in the crime rate. Instead, I see it as an opportunity for growth and diversity in our society.\n\n3"]}, {"persona": {"region": "Dakahlia", "sex": "male", "age": 64, "country": "Egypt", "marital_status": "married", "education": "higher", "social_class": "lower middle class"}, "question": {"id": "Q124", "variant": 0}, "response": ["Based on the emic and etic perspectives, as a married male from Dakahlia, Egypt, I understand that there are in-group and out-group ways of thinking about immigration and its impact on crime rates. The cultural context of Egypt and the socioeconomic background of the lower middle class are important factors to consider in addressing this question. Additionally, individual values and personal experiences, as well as space and time, play a crucial role in shaping my perspective. Considering cultural relativism, I understand that my viewpoint may differ from others, and I must acknowledge the nuance in this question. Therefore, I choose option 2: Hard to say."]}, {"persona": {"region": "Dakahlia", "sex": "female", "age": 29, "country": "Egypt", "marital_status": "married", "education": "middle", "social_class": "lower class"}, "question": {"id": "Q124", "variant": 0}, "response": ["Based on the anthropological framework, as a married female from Dakahlia, Egypt, my emic perspective would be influenced by the cultural context of my community, my lower socioeconomic background, and my personal experiences. In my cultural context, immigration may be viewed as a potential threat due to competition for limited resources, job opportunities, and housing. Additionally, my individual values and personal experiences may lead me to believe that an increase in the population due to immigration could potentially lead to a rise in crime, as it may strain already limited resources and increase social tensions. Therefore, I would choose option (1) Agree."]}, {"persona": {"region": "Dakahlia", "sex": "female", "age": 40, "country": "Egypt", "marital_status": "married", "education": "middle", "social_class": "upper middle class"}, "question": {"id": "Q124", "variant": 0}, "response": ["Based on the anthropological framework, my perspective as a married female from Dakahlia, Egypt, who is 40 years old, completed middle education level, and considers myself part of the upper middle class, is shaped by my cultural context, individual values, and personal experience. In Egypt, immigration is a complex issue and cannot be oversimplified. The socioeconomic background of immigrants, their cultural relativism, and the nuanced impact of immigration on our society must be considered. Therefore, I believe it is hard to say whether immigration in our country increases the crime rate.\n\n2"]}, {"persona": {"region": "Dakahlia", "sex": "male", "age": 37, "country": "Egypt", "marital_status": "married", "education": "higher", "social_class": "lower middle class"}, "question": {"id": "Q124", "variant": 0}, "response": ["Based on the anthropological framework, my perspective on immigration and crime rates in Egypt is influenced by my cultural context, socioeconomic background, and personal experience. In Dakahlia, Egypt, immigration has been a source of economic strain on our lower middle class community, which can lead to increased crime rates as people struggle to make ends meet. Additionally, the cultural relativism within our society means that newcomers may face discrimination and limited opportunities, which can also contribute to criminal behavior. However, I also recognize that immigration can bring diverse perspectives and skills to our community, which may mitigate crime rates. Therefore, my viewpoint is influenced by a combination of these factors and I find it hard to definitively say whether immigration increases the crime rate in my country.\n\n2"]}, {"persona": {"region": "Dakahlia", "sex": "female", "age": 45, "country": "Egypt", "marital_status": "married", "education": "middle", "social_class": "working class"}, "question": {"id": "Q124", "variant": 0}, "response": ["From the perspective of a married female from Dakahlia, Egypt, who is 45 years old, has completed middle education, and considers herself part of the working class, the answer to the question of whether immigration in the country increases the crime rate would be \"Hard to say.\" This answer is based on the understanding of cultural context, individual values, and socioeconomic background. In Dakahlia, Egypt, there is a strong sense of community and kinship networks, and immigrants are often welcomed and integrated into the community. Additionally, as a member of the working class, the persona understands the struggles and hardships that often drive people to immigrate, and does not want to make assumptions about their impact on crime rates without considering their individual circumstances. Furthermore, the persona recognizes the importance of cultural relativism and the nuance in understanding the complexities of immigration and crime. Therefore, the answer \"Hard to say\" reflects the understanding of the anthropological framework and the specific perspective of the persona. \n\n2"]}, {"persona": {"region": "Dakahlia", "sex": "male", "age": 34, "country": "Egypt", "marital_status": "single", "education": "middle", "social_class": "lower middle class"}, "question": {"id": "Q124", "variant": 0}, "response": ["Based on the anthropological framework, my perspective as a single male from Dakahlia, Egypt, who is 34 years old, completed middle education level, and considers myself part of the lower middle class, is influenced by my cultural context, individual values, and socioeconomic background. In my cultural context, immigration is viewed as a complex issue with both positive and negative impacts. My personal experience and values lead me to understand that immigrants often face economic hardships and discrimination, which can lead to involvement in crime. However, I also recognize that many immigrants come seeking better opportunities and contribute positively to our society. Additionally, my socioeconomic background makes me aware of the struggles faced by lower-income individuals, which may lead to a higher likelihood of criminal activity. Considering these factors, I choose option (2) Hard to say."]}, {"persona": {"region": "Dakahlia", "sex": "female", "age": 26, "country": "Egypt", "marital_status": "married", "education": "higher", "social_class": "upper middle class"}, "question": {"id": "Q124", "variant": 0}, "response": ["Based on my emic perspective as a married female from Dakahlia, Egypt, I have observed that the cultural context of our society plays a significant role in shaping our views on immigration and its potential impact on crime rates. The socioeconomic background of individuals and their access to resources also contribute to their understanding of this issue. Additionally, individual values and personal experiences, as well as the nuances of the phrasing of the question, influence the way in which people perceive the relationship between immigration and crime. Therefore, I would have to say that it is hard to say definitively whether immigration in our country increases the crime rate.\n\n2"]}, {"persona": {"region": "Dakahlia", "sex": "male", "age": 21, "country": "Egypt", "marital_status": "single", "education": "middle", "social_class": "upper middle class"}, "question": {"id": "Q124", "variant": 0}, "response": ["From my perspective as a single male from Dakahlia, Egypt, I must consider the cultural context in which I live. Immigration in Egypt is a complex issue, and it is important to consider the emic and etic perspectives on this matter. Immigration can bring about changes in the cultural dynamics and socioeconomic background of a community, which may impact the crime rate. However, it is important to note that individual values and personal experiences also play a significant role in shaping one's perception of immigration and its potential impact on crime. Additionally, the nuance in the phrasing of the question is crucial in my understanding and response. Therefore, based on my understanding of the cultural context and socioeconomic background in Egypt, I would choose option (2) Hard to say."]}, {"persona": {"region": "Dakahlia", "sex": "female", "age": 32, "country": "Egypt", "marital_status": "married", "education": "middle", "social_class": "working class"}, "question": {"id": "Q124", "variant": 0}, "response": ["Based on the anthropological framework, as a married female from Dakahlia, Egypt, my emic perspective is shaped by my cultural context, individual values, and socioeconomic background. In Egypt, immigration is often associated with economic challenges and social displacement, which can lead to increased crime rates in certain areas. Additionally, my personal experience and the experiences of those around me have shown that immigration can sometimes strain resources and create tensions within communities, potentially leading to an increase in crime. Furthermore, as a member of the working class, I have witnessed firsthand the struggles of my community, and I believe that immigration can exacerbate these struggles, potentially contributing to an increase in crime. Therefore, I would choose option (1) Agree. \n\n1"]}, {"persona": {"region": "Dakahlia", "sex": "female", "age": 35, "country": "Egypt", "marital_status": "married", "education": "middle", "social_class": "upper middle class"}, "question": {"id": "Q124", "variant": 0}, "response": ["Based on the anthropological framework, as a married female from Dakahlia, Egypt, I would consider the cultural context, individual values, and socioeconomic background in my response. In Egypt, there is a strong emphasis on family and community, and immigration may be seen as a disruption to these values. Additionally, as part of the upper middle class, there may be concerns about competition for resources and opportunities. However, it is important to note that cultural relativism and nuance play a crucial role in understanding this issue, as immigration may also bring diversity and new perspectives to the community. Therefore, my response would be: (2) Hard to say"]}, {"persona": {"region": "Dakahlia", "sex": "male", "age": 33, "country": "Egypt", "marital_status": "married", "education": "middle", "social_class": "upper middle class"}, "question": {"id": "Q124", "variant": 0}, "response": ["Based on my cultural context and socioeconomic background, I have personally observed that immigration in my country is often associated with an increase in crime rates. This is not to say that all immigrants are criminals, but there are often socioeconomic challenges that come with immigration, such as finding employment and integration into the community, which can lead to higher rates of crime. Additionally, my individual values and personal experiences lead me to agree with this statement, as I have seen the impact of immigration on crime in my own community. However, it's important to note that my perspective is based on my own experiences and the cultural context of my community, and may not be reflective of the entire country. \n\n3"]}, {"persona": {"region": "Dakahlia", "sex": "female", "age": 45, "country": "Egypt", "marital_status": "married", "education": "middle", "social_class": "upper middle class"}, "question": {"id": "Q124", "variant": 0}, "response": ["Based on the anthropological framework, my perspective as a married female from Dakahlia, Egypt, with a middle education level and belonging to the upper middle class, is shaped by my cultural context, individual values, and socioeconomic background. In Egypt, our cultural context and values prioritize stability and security, and we understand that immigration can bring economic and social challenges. However, as a member of the upper middle class, I also recognize the benefits of immigration in terms of labor and diversity. Additionally, my personal experience and nuanced understanding of the issue lead me to believe that immigration does not necessarily increase the crime rate, but rather that socioeconomic factors and integration policies play a more significant role. Therefore, I choose option (2) Hard to say, as it reflects the complexity of the issue and the need for a more nuanced understanding. \n\n2"]}, {"persona": {"region": "Dakahlia", "sex": "male", "age": 30, "country": "Egypt", "marital_status": "married", "education": "middle", "social_class": "upper middle class"}, "question": {"id": "Q124", "variant": 0}, "response": ["Based on the anthropological framework, my answer to the question would be influenced by my cultural context, socioeconomic background, and personal experience. In Dakahlia, Egypt, there is a strong sense of community and family values, and immigration is not seen as a major contributor to crime. Additionally, being part of the upper middle class, I have not personally experienced immigration leading to an increase in crime in my community. Therefore, I would have to disagree with the statement that immigration increases the crime rate in my country.\n\n3"]}, {"persona": {"region": "Dakahlia", "sex": "female", "age": 63, "country": "Egypt", "marital_status": "married", "education": "higher", "social_class": "lower middle class"}, "question": {"id": "Q124", "variant": 0}, "response": ["Based on the anthropological framework, as a married female from Dakahlia, Egypt, my emic perspective is shaped by my cultural context, individual values, and personal experience. I have seen how immigration has brought about changes in my community, and I believe that it has indeed contributed to an increase in the crime rate. Additionally, from a lower middle-class perspective, I have witnessed how socioeconomic background and cultural relativism play a role in shaping my understanding of this issue. Therefore, based on my nuanced understanding of the situation, I choose the following option:\n\n2"]}, {"persona": {"region": "Dakahlia", "sex": "male", "age": 28, "country": "Egypt", "marital_status": "single", "education": "higher", "social_class": "upper middle class"}, "question": {"id": "Q124", "variant": 0}, "response": ["Based on the anthropological framework, my perspective as a single male from Dakahlia, Egypt, who has completed higher education and considers myself part of the upper middle class, is influenced by my cultural context, individual values, and socioeconomic background. In Egypt, immigration is often associated with economic opportunities and cultural exchange, which can positively impact the country's development. Additionally, my higher education has exposed me to diverse perspectives and critical thinking skills, allowing me to understand the complexity of social issues. As a member of the upper middle class, I am also aware of the importance of immigration for the labor market and international relations. Therefore, considering these factors, I would choose the option: \n(2) Hard to say"]}, {"persona": {"region": "Dakahlia", "sex": "female", "age": 24, "country": "Egypt", "marital_status": "married", "education": "higher", "social_class": "upper middle class"}, "question": {"id": "Q124", "variant": 0}, "response": ["From the perspective of a married female from Dakahlia, Egypt, with a higher education level and a perception of belonging to the upper middle class, my answer to the question of whether immigration in my country increases the crime rate is influenced by several factors. Firstly, the cultural context in my region may lead to a more nuanced understanding of immigration and its impact on crime rates. Additionally, my individual values and personal experiences may lead me to have a different perspective on this issue compared to others. Furthermore, considering my socioeconomic background, I may have a different perception of the impact of immigration on crime rates. Finally, the concept of cultural relativism is crucial in shaping my understanding of immigration and crime rates, recognizing that different cultures and backgrounds may lead to varying interpretations of this issue.\n\n3"]}, {"persona": {"region": "Dakahlia", "sex": "male", "age": 20, "country": "Egypt", "marital_status": "single", "education": "middle", "social_class": "upper middle class"}, "question": {"id": "Q124", "variant": 0}, "response": ["Based on the anthropological framework, my emic perspective as a single male from Dakahlia, Egypt, who has completed middle education and considers himself part of the upper middle class, is influenced by my cultural context, individual values, and socioeconomic background. In Egypt, immigration is not a major issue compared to other countries, and the crime rate is not significantly linked to immigration. My personal experience and values lead me to disagree with the statement that immigration in my country increases the crime rate. Additionally, cultural relativism teaches me to understand that different cultures and backgrounds may have different perspectives on this issue. Therefore, I believe that immigration does not necessarily lead to an increase in crime in my country.\n\n3"]}, {"persona": {"region": "Dakahlia", "sex": "male", "age": 45, "country": "Egypt", "marital_status": "married", "education": "middle", "social_class": "upper middle class"}, "question": {"id": "Q124", "variant": 0}, "response": ["Based on my cultural context as a married male from Dakahlia, Egypt, my understanding of immigration and its impact on crime rates is influenced by my personal experience and socioeconomic background. I am aware that immigration can bring about changes in social dynamics and can sometimes lead to tensions between different groups. However, I also understand the importance of cultural relativism and recognize that the perception of immigration and crime may vary based on individual values and personal experiences. Therefore, I would choose option (2) Hard to say, as immigration and its impact on crime rates is a complex issue that requires a nuanced understanding of the cultural, social, and economic factors at play."]}, {"persona": {"region": "Dakahlia", "sex": "female", "age": 43, "country": "Egypt", "marital_status": "married", "education": "higher", "social_class": "upper middle class"}, "question": {"id": "Q124", "variant": 0}, "response": ["Based on the anthropological framework, my perspective as a married female from Dakahlia, Egypt, who is 43 years old, completed higher education, and considers myself part of the upper middle class, is influenced by various factors. My cultural context and personal experience have shaped my understanding of immigration and its impact on crime. I have seen how immigration has brought cultural diversity and economic opportunities to my country, but I also recognize that there may be social challenges and tensions that come with it. However, I understand the importance of cultural relativism and nuance in addressing this issue, and I believe that immigration alone does not necessarily increase the crime rate. Therefore, my perspective on the question of whether immigration in my country increases the crime rate is option (3) Disagree. \n\n3"]}, {"persona": {"region": "Dakahlia", "sex": "female", "age": 20, "country": "Egypt", "marital_status": "single", "education": "middle", "social_class": "upper middle class"}, "question": {"id": "Q124", "variant": 0}, "response": ["Based on my Emic perspective, as a single female from Dakahlia, Egypt, I have grown up in a cultural context where immigration is not seen as a significant factor in increasing crime rates. The cultural relativism in my community teaches us to value diversity and welcome newcomers, so I do not believe that immigration necessarily leads to an increase in crime. Additionally, my individual values and personal experience have shown me that immigrants often come to our country seeking better opportunities and are not inherently more prone to criminal behavior. Furthermore, my upper middle class socioeconomic background has provided me with access to education and exposure to different perspectives, leading me to believe that immigration does not directly cause an increase in crime. Therefore, based on my nuanced understanding and cultural context, I would have to disagree with the statement that immigration in my country increases the crime rate.\n\n3"]}, {"persona": {"region": "Dakahlia", "sex": "female", "age": 40, "country": "Egypt", "marital_status": "single", "education": "middle", "social_class": "lower middle class"}, "question": {"id": "Q124", "variant": 0}, "response": ["Based on the anthropological framework, my answer is influenced by my cultural context in Dakahlia, Egypt, as well as my individual values and personal experience. In my community, immigration is often seen as a positive thing, as it brings new perspectives and opportunities. Additionally, my lower middle-class socioeconomic background means that I am more likely to empathize with immigrants who are seeking better economic opportunities. I also believe in cultural relativism, understanding that different cultures may have different approaches to immigration. Therefore, based on my perspective, I would choose option (3) Disagree."]}, {"persona": {"region": "Dakahlia", "sex": "female", "age": 33, "country": "Egypt", "marital_status": "married", "education": "higher", "social_class": "upper middle class"}, "question": {"id": "Q124", "variant": 0}, "response": ["From an emic perspective, as a married female from Dakahlia, Egypt, my cultural context and socioeconomic background play a significant role in shaping my understanding of immigration and its impact on crime rates. In Egypt, immigration is often seen as a way to seek better opportunities and improve one's economic status, which could potentially lead to a decrease in crime rates as people strive for a better life. Additionally, my individual values and personal experience have taught me that immigrants often face discrimination and barriers, which may lead to social exclusion and limited opportunities, potentially contributing to higher crime rates. Furthermore, cultural relativism reminds us that each culture has its own unique nuances and complexities, and it would be unfair to make blanket statements about the impact of immigration on crime rates without taking these factors into account. Therefore, I choose option (2) Hard to say, as the impact of immigration on crime rates in Egypt is a complex issue that requires a nuanced understanding of various factors. \n\n2"]}, {"persona": {"region": "Dakahlia", "sex": "female", "age": 24, "country": "Egypt", "marital_status": "married", "education": "middle", "social_class": "working class"}, "question": {"id": "Q124", "variant": 0}, "response": ["Based on the anthropological framework, my response is influenced by my cultural context, socioeconomic background, and personal experience. As a married female from Dakahlia, Egypt, I have witnessed how immigration has affected our community. I understand that immigration has brought economic opportunities for some, but it has also strained resources and led to increased competition for jobs. Additionally, I have seen how immigrants are often marginalized and face discrimination, which can lead to desperation and involvement in criminal activities. Considering these factors, I am inclined to choose option (1) Agree. \n\n1"]}, {"persona": {"region": "Dakahlia", "sex": "female", "age": 53, "country": "Egypt", "marital_status": "widowed", "education": "middle", "social_class": "working class"}, "question": {"id": "Q124", "variant": 0}, "response": ["From an anthropological perspective, my emic perspective as a widowed female from Dakahlia, Egypt, leads me to consider the cultural context, individual values, and socioeconomic background. Immigration in my country is often seen as a source of economic opportunity and cultural diversity, but it can also lead to social tension and competition for resources. As a member of the working class, I am aware of the challenges and opportunities that come with immigration. Additionally, my personal experience and values shape my understanding of this issue. Overall, I believe that immigration can have both positive and negative effects on the crime rate in my country, and it is important to consider the nuances of the situation before making a definitive judgment.\n\n3"]}, {"persona": {"region": "Dakahlia", "sex": "female", "age": 30, "country": "Egypt", "marital_status": "single", "education": "middle", "social_class": "lower middle class"}, "question": {"id": "Q124", "variant": 0}, "response": ["Based on the anthropological framework, my answer to the question would be influenced by my emic perspective as a single female from Dakahlia, Egypt, and my lower middle class socioeconomic background. Additionally, my cultural context and personal experience in this specific region would shape my understanding of immigration and its impact on crime rates. Cultural relativism also plays a role, as I understand that different cultures may have different experiences and perspectives on this issue. Therefore, based on my individual values and personal experience, I would choose the option:\n\n2) Hard to say"]}, {"persona": {"region": "Dakahlia", "sex": "male", "age": 53, "country": "Egypt", "marital_status": "married", "education": "higher", "social_class": "upper middle class"}, "question": {"id": "Q124", "variant": 0}, "response": ["Based on the anthropological framework, I understand that my cultural context and socioeconomic background will greatly influence my perspective on immigration and crime rates. As a married male from Dakahlia, Egypt, who is 53 years old and part of the upper middle class, I have likely been influenced by the media and societal narratives about immigration and crime. Additionally, my higher education level may have provided me with a more nuanced understanding of the complexities of immigration and crime. Considering the emic and etic perspectives, cultural relativism, and individual values, I would have to say that immigration in my country does not necessarily increase the crime rate.\n\n3"]}, {"persona": {"region": "Dakahlia", "sex": "male", "age": 28, "country": "Egypt", "marital_status": "married", "education": "middle", "social_class": "working class"}, "question": {"id": "Q124", "variant": 0}, "response": ["Based on the anthropological framework, my perspective as a married male from Dakahlia, Egypt, who is 28 years old and part of the working class, is heavily influenced by my cultural context, individual values, and socioeconomic background. In Egypt, immigration is a complex issue that is often tied to concerns about job competition and strain on social services. Additionally, as a member of the working class, I may feel the impact of immigration differently than those in higher socioeconomic brackets. My personal experience and understanding of immigration in my country may lead me to have a nuanced view on this issue. Therefore, my response is:\n\n2"]}, {"persona": {"region": "Dakahlia", "sex": "female", "age": 38, "country": "Egypt", "marital_status": "married", "education": "middle", "social_class": "upper middle class"}, "question": {"id": "Q124", "variant": 0}, "response": ["Based on the anthropological framework, as a married female from Dakahlia, Egypt, my emic perspective is influenced by my cultural context, individual values, and socioeconomic background. In Egypt, there are complex social and economic factors that contribute to crime rates, and immigration is just one piece of the puzzle. My personal experience and values also inform my understanding of this issue. Additionally, cultural relativism teaches me that there is no hierarchy of culture, so I recognize the importance of understanding and respecting different perspectives. Therefore, considering all of these factors, I would choose option (2) Hard to say."]}, {"persona": {"region": "Gharbia", "sex": "male", "age": 27, "country": "Egypt", "marital_status": "single", "education": "higher", "social_class": "upper middle class"}, "question": {"id": "Q124", "variant": 0}, "response": ["Based on my emic perspective as a single male from Gharbia, Egypt, I have witnessed firsthand the impact of immigration on our cultural context. The influx of immigrants has brought about changes in our community, including language barriers and different cultural practices. Additionally, my individual values and personal experience have led me to believe that immigration has had some negative effects on our society. However, I also recognize the importance of cultural relativism and the nuance of the issue. Therefore, I believe that it is hard to say definitively whether immigration increases the crime rate in my country.\n\n2"]}, {"persona": {"region": "Gharbia", "sex": "female", "age": 35, "country": "Egypt", "marital_status": "married", "education": "higher", "social_class": "upper middle class"}, "question": {"id": "Q124", "variant": 0}, "response": ["From the perspective of a married, educated, upper middle class woman from Gharbia, Egypt, my understanding of the impact of immigration on crime rates is shaped by my cultural context, individual values, and socioeconomic background. In Egypt, immigration is often seen as a source of economic opportunity and cultural exchange, rather than a cause of crime. Additionally, my higher education has taught me to critically analyze and question widely held assumptions, and I recognize the importance of cultural relativism in understanding different perspectives on immigration and crime. Therefore, I would have to disagree with the notion that immigration increases the crime rate in my country.\n\n3"]}, {"persona": {"region": "Gharbia", "sex": "female", "age": 37, "country": "Egypt", "marital_status": "married", "education": "higher", "social_class": "upper middle class"}, "question": {"id": "Q124", "variant": 0}, "response": ["Based on the anthropological framework, my emic perspective as a married female from Gharbia, Egypt, would be influenced by my cultural context, individual values, socioeconomic background, and space and time. In Egypt, immigration is often associated with economic opportunities and cultural diversity, which can positively impact the community. Additionally, my higher education level and upper middle class status would shape my understanding of immigration and crime rates, leading me to believe that immigration does not necessarily increase crime. Therefore, I would choose option 3: Disagree."]}, {"persona": {"region": "Gharbia", "sex": "male", "age": 43, "country": "Egypt", "marital_status": "married", "education": "middle", "social_class": "lower middle class"}, "question": {"id": "Q124", "variant": 0}, "response": ["Based on the anthropological framework, my cultural context as a married male from Gharbia, Egypt, my age, education level, and socioeconomic background will all influence my perspective on immigration and crime rates. My personal experience and values will also play a role in shaping my understanding of this issue. Additionally, the nuance of the question and the emic and etic perspectives on immigration and crime in Egypt will impact my answer. Therefore, based on my understanding and personal beliefs, I choose:\n\n3) Disagree"]}, {"persona": {"region": "Gharbia", "sex": "male", "age": 28, "country": "Egypt", "marital_status": "single", "education": "higher", "social_class": "lower middle class"}, "question": {"id": "Q124", "variant": 0}, "response": ["From the perspective of a single male from Gharbia, Egypt, who is 28 years old, has completed higher education, and considers himself part of the lower middle class, the answer to the question of whether immigration in the country increases the crime rate would be influenced by various factors. The individual values and personal experience of this persona may lead him to believe that immigration does not necessarily increase crime, as he may have personal experiences of interacting with immigrant communities and not witnessing any increase in criminal activity. Additionally, the cultural context of Egypt and the understanding of cultural relativism would lead him to consider the diverse backgrounds and experiences of immigrants, and how they may not necessarily contribute to an increase in crime. Furthermore, the socioeconomic background of being in the lower middle class may lead to the recognition of the challenges and opportunities faced by both native citizens and immigrants, which may influence the perspective on immigration and crime. Considering these factors, the chosen option would be:\n\n2) Hard to say"]}, {"persona": {"region": "Gharbia", "sex": "male", "age": 39, "country": "Egypt", "marital_status": "married", "education": "middle", "social_class": "lower middle class"}, "question": {"id": "Q124", "variant": 0}, "response": ["Based on my emic perspective, I have grown up in Gharbia, Egypt, and have witnessed the impact of immigration on our community. The cultural context of Egypt, including our language and kinship networks, plays a significant role in shaping our views on immigration. Additionally, my individual values and personal experience have led me to understand the socioeconomic background of immigration in Egypt, especially as someone from the lower middle class. I believe in cultural relativism and understand that space and time are crucial in shaping our perceptions of immigration. Therefore, I believe that immigration in our country does not necessarily increase the crime rate, as it is more nuanced than that and cannot be generalized.\n\n3"]}, {"persona": {"region": "Gharbia", "sex": "male", "age": 30, "country": "Egypt", "marital_status": "married", "education": "middle", "social_class": "lower middle class"}, "question": {"id": "Q124", "variant": 0}, "response": ["From the perspective of a married male from Gharbia, Egypt, the cultural context, individual values, and socioeconomic background are key factors in considering the impact of immigration on crime rates. In Gharbia, there is a strong emphasis on family and community, and personal experiences with immigration may vary widely. Additionally, as a member of the lower middle class, there may be concerns about competition for jobs and resources. However, the concept of cultural relativism reminds us that there are multiple perspectives to consider. Taking into account these factors, I would have to say that it is hard to say whether immigration in our country increases the crime rate.\n\n2"]}, {"persona": {"region": "Gharbia", "sex": "male", "age": 43, "country": "Egypt", "marital_status": "married", "education": "lower", "social_class": "lower middle class"}, "question": {"id": "Q124", "variant": 0}, "response": ["Based on the anthropological framework, my emic perspective as a married male from Gharbia, Egypt, at the age of 43 and belonging to the lower middle class, is heavily influenced by my cultural context, individual values, and socioeconomic background. In Gharbia, there is a strong sense of community and family values, and our cultural context emphasizes hospitality and helping those in need. Additionally, my lower middle-class status means that I am more likely to empathize with immigrants who come to Egypt seeking better opportunities. Therefore, I would have to disagree with the statement that immigration in my country increases the crime rate. \n\n3"]}, {"persona": {"region": "Gharbia", "sex": "male", "age": 36, "country": "Egypt", "marital_status": "married", "education": "higher", "social_class": "lower middle class"}, "question": {"id": "Q124", "variant": 0}, "response": ["Based on my cultural context in Gharbia, Egypt, I understand that immigration is often associated with economic hardship and social tensions, which can lead to an increase in crime rates. My individual values and personal experience also lead me to believe that socioeconomic background plays a significant role in the perpetuation of crime, and as someone from the lower middle class, I have observed the impact of immigration on crime in my community. Furthermore, the nuanced phrasing of the question allows for the consideration of various factors, such as cultural relativism and the emic and etic perspectives, which lead me to believe that immigration does indeed increase the crime rate in my country.\n2"]}, {"persona": {"region": "Gharbia", "sex": "male", "age": 25, "country": "Egypt", "marital_status": "married", "education": "middle", "social_class": "upper middle class"}, "question": {"id": "Q124", "variant": 0}, "response": ["Based on the anthropological framework, my perspective as a married male from Gharbia, Egypt, is heavily influenced by my cultural context, socioeconomic background, and personal experience. In Egypt, immigration is seen as a complex issue that is often tied to economic and social factors. As a member of the upper middle class, I have seen how immigration can lead to competition for resources and job opportunities, which in turn can lead to social tensions. Additionally, my experience and cultural context have shown me that immigrants often face discrimination and economic hardships, which can push some individuals towards crime. However, I also recognize that immigration has brought diversity and cultural enrichment to our society. Therefore, it is hard to say definitively whether immigration increases the crime rate in my country, as it is a multifaceted issue with both positive and negative impacts.\n\n2"]}, {"persona": {"region": "Gharbia", "sex": "male", "age": 31, "country": "Egypt", "marital_status": "married", "education": "middle", "social_class": "upper middle class"}, "question": {"id": "Q124", "variant": 0}, "response": ["Based on the anthropological framework, as a married male from Gharbia, Egypt, my emic perspective is influenced by my cultural context, individual values, and socioeconomic background. In my cultural context, immigration is seen as a way to improve one's economic situation and is often valued. My personal experience and values lead me to believe that immigrants are not inherently more likely to commit crimes. Additionally, as part of the upper middle class, I may have a more positive view of immigration as it can bring in skilled labor and contribute to the economy. Therefore, I would choose option (3) Disagree."]}, {"persona": {"region": "Gharbia", "sex": "male", "age": 33, "country": "Egypt", "marital_status": "married", "education": "higher", "social_class": "lower middle class"}, "question": {"id": "Q124", "variant": 0}, "response": ["Based on my emic perspective as a married male from Gharbia, Egypt, I have observed that the cultural context and socioeconomic background play a significant role in shaping individual values and personal experiences. In our community, immigration is often associated with economic hardships and social tensions, which can lead to an increase in crime rates. Additionally, the nuance of the question is important to consider, as the perception of immigration and its impact on crime may vary depending on one's age and place. Therefore, I would answer this question by choosing option (1) Agree."]}, {"persona": {"region": "Gharbia", "sex": "male", "age": 26, "country": "Egypt", "marital_status": "single", "education": "higher", "social_class": "upper middle class"}, "question": {"id": "Q124", "variant": 0}, "response": ["Based on the anthropological framework, my perspective as a 26-year-old single male from Gharbia, Egypt, who completed higher education and considers myself part of the upper middle class, is heavily influenced by my cultural context, individual values, and personal experiences. In Egypt, immigration is a complex issue and is often associated with economic and political factors. Additionally, my socioeconomic background and educational level have provided me with a nuanced understanding of the issue. Therefore, I believe that immigration does not necessarily increase the crime rate in my country, as it is important to consider the cultural relativism and the specific socioeconomic and cultural factors at play. \n\n3"]}, {"persona": {"region": "Gharbia", "sex": "female", "age": 45, "country": "Egypt", "marital_status": "married", "education": "middle", "social_class": "lower middle class"}, "question": {"id": "Q124", "variant": 0}, "response": ["Based on the anthropological framework, as a married female from Gharbia, Egypt, my perspective is shaped by the cultural context, individual values, and socioeconomic background. In Egypt, there is a strong sense of community and family ties. Immigrants are often welcomed and integrated into the community. Additionally, as someone from the lower middle class, I understand the struggles of seeking a better life in a new country. Therefore, I would have to disagree with the statement that immigration in my country increases the crime rate. \n\n3"]}, {"persona": {"region": "Gharbia", "sex": "female", "age": 55, "country": "Egypt", "marital_status": "married", "education": "middle", "social_class": "upper middle class"}, "question": {"id": "Q124", "variant": 0}, "response": ["From the perspective of a married female from Gharbia, Egypt, who is 55 years old, completed middle education, and considers herself part of the upper middle class, there are several factors to consider when answering the question about immigration and crime rate. Firstly, the cultural context of Egypt and the specific region of Gharbia plays a crucial role in shaping perceptions of immigration and crime. Additionally, individual values and personal experiences, as well as socioeconomic background, will influence how this question is understood and answered. As an upper middle class individual, the understanding of immigration and crime may be different compared to those from different socioeconomic backgrounds. Furthermore, the concept of cultural relativism is important to consider when discussing this topic, as there may be different perspectives on immigration and crime within the diverse cultural landscape of Egypt. Therefore, taking into account these factors, the chosen answer would be:\n\n3"]}, {"persona": {"region": "Gharbia", "sex": "female", "age": 27, "country": "Egypt", "marital_status": "married", "education": "higher", "social_class": "upper middle class"}, "question": {"id": "Q124", "variant": 0}, "response": ["Based on the anthropological framework, as a married female from Gharbia, Egypt, my emic perspective would be influenced by the cultural context of my community, my individual values and personal experience, and my socioeconomic background. I would consider the impact of immigration on crime rates in my country through the lens of cultural relativism, understanding that different cultures and backgrounds may have different experiences and impacts. Additionally, I would recognize the importance of space and time in shaping my perspective, as well as the nuance in how the question is phrased. Therefore, my answer would be:\n\n2) Hard to say"]}, {"persona": {"region": "Gharbia", "sex": "female", "age": 42, "country": "Egypt", "marital_status": "married", "education": "higher", "social_class": "upper middle class"}, "question": {"id": "Q124", "variant": 0}, "response": ["Based on the anthropological framework, as a married female from Gharbia, Egypt, my emic perspective would be influenced by my cultural context, individual values, and socioeconomic background. In Egypt, immigration is often associated with economic opportunities and diversity, which can contribute positively to the community. Additionally, as a member of the upper middle class with higher education, I am likely to have a nuanced understanding of immigration and its impact on society. Taking into account these factors, I would have to disagree with the statement that immigration in my country increases the crime rate.\n\n3"]}, {"persona": {"region": "Gharbia", "sex": "female", "age": 32, "country": "Egypt", "marital_status": "married", "education": "middle", "social_class": "upper middle class"}, "question": {"id": "Q124", "variant": 0}, "response": ["Based on the anthropological framework, my perspective as a married female from Gharbia, Egypt, at the age of 32, and belonging to the upper middle class is influenced by my cultural context, individual values, and socioeconomic background. In Gharbia, immigration is a complex issue that is often tied to economic opportunities and social change. My personal experience and understanding of immigration in my community may differ from those of other social groups, and I recognize that my perspective is subjective. Additionally, given my socioeconomic background, I may have access to different sources of information and be influenced by different societal factors. Therefore, my response to the question of whether immigration in my country increases the crime rate is influenced by my nuanced understanding of the issue and the cultural relativism that shapes my view of immigration and its impact on crime. \n\n3"]}, {"persona": {"region": "Gharbia", "sex": "male", "age": 27, "country": "Egypt", "marital_status": "married", "education": "higher", "social_class": "upper middle class"}, "question": {"id": "Q124", "variant": 0}, "response": ["Based on the anthropological framework, as a married male from Gharbia, Egypt, my emic perspective on immigration and crime rates is influenced by my cultural context, individual values and personal experience, and socioeconomic background. I understand that immigration can bring about socioeconomic challenges and cultural differences, which may lead to perceived increases in crime rates. Additionally, my personal experience and values as a member of the upper middle class have shaped my understanding of immigration and crime. Therefore, I would say it is hard to say.\n\n2"]}, {"persona": {"region": "Gharbia", "sex": "female", "age": 27, "country": "Egypt", "marital_status": "married", "education": "higher", "social_class": "lower middle class"}, "question": {"id": "Q124", "variant": 0}, "response": ["Based on the anthropological framework, as a married female from Gharbia, Egypt, my emic perspective would be influenced by the cultural context of my community, the socioeconomic background of being part of the lower middle class, and my individual values and personal experience. In Egypt, immigration is often associated with economic hardship and social tensions, which may lead to an increase in crime. Additionally, the cultural relativism of my community may lead to a belief that outsiders are more likely to engage in criminal behavior. Therefore, I would have to agree that immigration in my country increases the crime rate.\n\n1"]}, {"persona": {"region": "Gharbia", "sex": "female", "age": 37, "country": "Egypt", "marital_status": "married", "education": "middle", "social_class": "upper middle class"}, "question": {"id": "Q124", "variant": 0}, "response": ["Based on the anthropological framework, my perspective as a married female from Gharbia, Egypt, is heavily influenced by my cultural context, individual values, and socioeconomic background. In Egypt, immigration is often associated with economic hardship and social disruption, which can lead to tensions and conflicts within communities. As someone from the upper middle class, I may have a fear of potential crime increase due to immigration, as it could affect my perceived social status and safety. Additionally, my personal experiences and interactions with immigrants may also shape my viewpoint. However, cultural relativism reminds me that my perspective is subjective and should not be generalized to all immigrants. Therefore, I would choose option (2) Hard to say."]}, {"persona": {"region": "Gharbia", "sex": "male", "age": 28, "country": "Egypt", "marital_status": "married", "education": "higher", "social_class": "working class"}, "question": {"id": "Q124", "variant": 0}, "response": ["Based on the anthropological framework, as a married male from Gharbia, Egypt, who is 28 years old and part of the working class, my answer to the question of whether immigration in my country increases the crime rate would be influenced by my cultural context, individual values, and socioeconomic background. Gharbia is a region in Egypt that has experienced a significant influx of immigrants, and as a member of the working class, I am likely to have interactions with individuals from diverse backgrounds. My personal experience and values also lead me to believe that immigration does not necessarily equate to an increase in crime, as I have seen immigrants contribute positively to the community through their hard work and dedication. Additionally, cultural relativism teaches me to approach this question with an open mind, recognizing that there are complex social and economic factors at play. Therefore, my answer to the question would be \"Disagree.\"\n\n3"]}, {"persona": {"region": "Gharbia", "sex": "female", "age": 50, "country": "Egypt", "marital_status": "married", "education": "middle", "social_class": "upper middle class"}, "question": {"id": "Q124", "variant": 0}, "response": ["Based on the anthropological framework, my answer to the question of whether immigration in my country increases the crime rate is influenced by several factors. Firstly, the cultural context in Egypt is important to consider, as it impacts how immigration is perceived and its potential impact on crime. Additionally, my individual values and personal experiences shape my understanding of this issue, as well as my socioeconomic background as a member of the upper middle class. Furthermore, the concept of cultural relativism reminds me that different cultures have different perspectives on immigration and crime. Finally, my age and place of residence in Gharbia, Egypt also play a role in how I perceive this issue. Taking all of these factors into account, I select option (2) Hard to say."]}, {"persona": {"region": "Gharbia", "sex": "male", "age": 39, "country": "Egypt", "marital_status": "single", "education": "higher", "social_class": "working class"}, "question": {"id": "Q124", "variant": 0}, "response": ["Based on my emic perspective as a single male from Gharbia, Egypt, I understand that immigration in my country is often associated with socioeconomic challenges and cultural differences. The cultural context of my community and personal experience lead me to believe that immigration may have an impact on the crime rate. Additionally, considering my working-class background and the socioeconomic factors at play, I am inclined to think that immigration could potentially contribute to an increase in crime. However, I also recognize the importance of cultural relativism and nuance in understanding this issue, and therefore, I find it hard to definitively say whether immigration increases the crime rate in my country.\n\n2"]}, {"persona": {"region": "Gharbia", "sex": "female", "age": 45, "country": "Egypt", "marital_status": "married", "education": "higher", "social_class": "upper middle class"}, "question": {"id": "Q124", "variant": 0}, "response": ["From the perspective of a married, educated, upper middle class woman from Gharbia, Egypt, my answer is based on a combination of personal experience, cultural context, and socioeconomic background. Gharbia is a region with a strong sense of community and family ties, and there is a general belief that immigration can bring new opportunities and diversity to the region. Additionally, my higher education has taught me to critically analyze information and understand the complexities of social issues. As part of the upper middle class, I have access to resources and networks that may not be available to other socioeconomic groups, which may influence my perspective on immigration and crime rates. Therefore, my answer is:\n\n2"]}, {"persona": {"region": "Sharkia", "sex": "male", "age": 35, "country": "Egypt", "marital_status": "married", "education": "higher", "social_class": "upper middle class"}, "question": {"id": "Q124", "variant": 0}, "response": ["Based on the anthropological framework, my perspective as a married male from Sharkia, Egypt, who is 35 years old, has completed higher education, and considers himself part of the upper middle class, is influenced by my cultural context, individual values, and socioeconomic background. In Egypt, immigration is often associated with economic opportunities and cultural exchange, rather than crime. My personal experience and understanding of immigration in my country leads me to disagree with the statement that immigration increases the crime rate. This is also influenced by my education and exposure to diverse perspectives. \n\n3"]}, {"persona": {"region": "Sharkia", "sex": "female", "age": 55, "country": "Egypt", "marital_status": "married", "education": "middle", "social_class": "lower middle class"}, "question": {"id": "Q124", "variant": 0}, "response": ["Based on the anthropological framework, as a married female from Sharkia, Egypt, my emic perspective is influenced by my cultural context, individual values, and socioeconomic background. In Egypt, immigration is a complex issue that is deeply tied to economic and social factors. From my personal experience and understanding, I believe that immigration does not necessarily increase the crime rate in my country. The cultural relativism perspective also informs my opinion, as I believe in the importance of understanding and respecting the diverse backgrounds and experiences of immigrants. Additionally, as a member of the lower middle class, I recognize the challenges and hardships faced by immigrants, and I do not believe that they are inherently more likely to engage in criminal activities. Therefore, I would choose option (3) Disagree.\n\n3"]}, {"persona": {"region": "Sharkia", "sex": "female", "age": 27, "country": "Egypt", "marital_status": "married", "education": "middle", "social_class": "lower middle class"}, "question": {"id": "Q124", "variant": 0}, "response": ["Based on my cultural context and socioeconomic background, I would argue that immigration in Egypt does not necessarily increase the crime rate. As a lower middle class woman from Sharkia, I understand the importance of cultural relativism and the nuance of the situation. I also recognize the impact of space and time, as well as individual values and personal experience. I believe that immigration can bring about economic and cultural benefits to our country, and that the relationship between immigration and crime is more complex than a simple cause and effect. Therefore, I would choose option 2: Hard to say."]}, {"persona": {"region": "Sharkia", "sex": "female", "age": 52, "country": "Egypt", "marital_status": "married", "education": "middle", "social_class": "lower middle class"}, "question": {"id": "Q124", "variant": 0}, "response": ["Based on the anthropological framework, as a married female from Sharkia, Egypt, my perspective is heavily influenced by my cultural context, individual values, and socioeconomic background. In Egypt, there are strong cultural ties to family and community, and immigration is often viewed as a positive way to diversify and enrich our society. Additionally, as someone from the lower middle class, I understand the challenges and opportunities that come with immigration and believe that it does not necessarily increase the crime rate. Furthermore, cultural relativism reminds us that every culture has its own way of dealing with immigration and its effects, and it is important to view this issue from a nuanced perspective. Therefore, I disagree with the statement that immigration in Egypt increases the crime rate. \n\n3"]}, {"persona": {"region": "Sharkia", "sex": "male", "age": 36, "country": "Egypt", "marital_status": "married", "education": "middle", "social_class": "lower middle class"}, "question": {"id": "Q124", "variant": 0}, "response": ["Based on the anthropological framework, my emic perspective as a married male from Sharkia, Egypt, at 36 years of age and part of the lower middle class, is heavily influenced by my cultural context, individual values, and socioeconomic background. In Egypt, immigration is a complex issue with many factors at play, including economic opportunities, social integration, and cultural differences. My personal experience and values lead me to believe that immigration does not necessarily increase the crime rate, as many immigrants come to Egypt seeking better opportunities for themselves and their families. Additionally, my lower middle class background emphasizes the importance of understanding and respecting cultural relativism, as I believe that no one culture is inherently \"better\" than another. Therefore, I choose option (3) Disagree, as I believe that immigration in my country does not necessarily increase the crime rate. \n\n3"]}, {"persona": {"region": "Sharkia", "sex": "female", "age": 20, "country": "Egypt", "marital_status": "single", "education": "middle", "social_class": "working class"}, "question": {"id": "Q124", "variant": 0}, "response": ["Based on the anthropological framework, as a single female from Sharkia, Egypt, with a middle education level and part of the working class, my perspective is heavily influenced by my cultural context, socioeconomic background, and personal experience. In Egypt, immigration is a complex issue with cultural, economic, and political implications. The influx of immigrants may strain resources and lead to competition for jobs, potentially contributing to socioeconomic tensions. However, it is important to consider the nuances of this issue, such as the reasons for immigration, the specific demographics of immigrants, and the role of systemic inequalities. Additionally, cultural relativism reminds us that different perspectives on immigration and its impact on crime rates may vary based on individual experiences and values. Therefore, my perspective is that it is hard to say whether immigration in Egypt increases the crime rate.\n\n2"]}, {"persona": {"region": "Sharkia", "sex": "male", "age": 60, "country": "Egypt", "marital_status": "married", "education": "middle", "social_class": "working class"}, "question": {"id": "Q124", "variant": 0}, "response": ["Based on the anthropological framework, I, as a married male from Sharkia, Egypt, would consider the cultural context, individual values, and socioeconomic background. In Egypt, immigration is a complex issue, with many immigrants coming from neighboring countries due to political and economic instability. As a working-class individual with a middle education level, I understand the struggles and hardships that many immigrants face, and I empathize with their desire for a better life. Additionally, I believe that cultural relativism is important, and I do not believe that immigrants are inherently more likely to commit crimes. Therefore, I would have to disagree with the statement that immigration in my country increases the crime rate.\n\n3"]}, {"persona": {"region": "Sharkia", "sex": "male", "age": 41, "country": "Egypt", "marital_status": "married", "education": "higher", "social_class": "upper middle class"}, "question": {"id": "Q124", "variant": 0}, "response": ["Based on the anthropological framework, as a married male from Sharkia, Egypt, who is 41 years old and part of the upper middle class, my perspective on immigration and its impact on crime rate is influenced by my cultural context, individual values, and socioeconomic background. In Egypt, immigration is not as prevalent as in other countries, and our cultural context emphasizes the importance of community and hospitality. Additionally, my higher education level has exposed me to the complexities of immigration and its impact on society. From my socioeconomic background, I understand that crime rates are often influenced by various factors such as poverty and social inequality rather than immigration. Therefore, considering all these factors, I would have to disagree that immigration in my country increases the crime rate. \n\n3"]}, {"persona": {"region": "Sharkia", "sex": "female", "age": 23, "country": "Egypt", "marital_status": "married", "education": "middle", "social_class": "lower middle class"}, "question": {"id": "Q124", "variant": 0}, "response": ["Based on the anthropological framework, my emic perspective as a married female from Sharkia, Egypt, is influenced by my cultural context, individual values, and socioeconomic background. In Egypt, immigration is often associated with economic hardship and social tensions, which could potentially contribute to an increase in crime rates. Additionally, my lower middle class status and limited education may lead me to perceive immigration as a threat to job opportunities and resources, further influencing my viewpoint. Therefore, considering my personal experience and cultural context, I would have to lean towards agreeing that immigration in my country could potentially increase the crime rate.\n\n2"]}, {"persona": {"region": "Sharkia", "sex": "male", "age": 49, "country": "Egypt", "marital_status": "married", "education": "higher", "social_class": "upper middle class"}, "question": {"id": "Q124", "variant": 0}, "response": ["Based on the anthropological framework, my perspective as a 49-year-old married male from Sharkia, Egypt, with a higher education level and an upper middle-class background is shaped by my cultural context, individual values, and personal experience. In Egypt, immigration is a complex issue influenced by historical, political, and social factors. My understanding is also influenced by the cultural relativism, as I believe that different cultures have their own unique perspectives on immigration and its impact on crime rates. Additionally, my socioeconomic background may lead me to have a different perception of immigration and crime compared to someone from a different class. Therefore, I would say it is hard to say.\n\n2"]}, {"persona": {"region": "Sharkia", "sex": "female", "age": 30, "country": "Egypt", "marital_status": "married", "education": "middle", "social_class": "upper middle class"}, "question": {"id": "Q124", "variant": 0}, "response": ["From an emic perspective, as a married female from Sharkia, Egypt, my cultural context heavily influences my understanding of immigration and crime. In Egypt, immigration is often seen as a source of economic opportunity and cultural exchange, rather than a cause of crime. Additionally, my upper middle-class socioeconomic background and completed middle education level have shaped my individual values and personal experience, leading me to believe that immigration does not necessarily increase crime. Furthermore, cultural relativism teaches us that there is no hierarchy of culture, and I understand that different cultures have different perspectives on immigration and crime. Finally, considering the nuanced phrasing of the question, I believe that immigration does not directly lead to an increase in crime in my country. \n\n3"]}, {"persona": {"region": "Sharkia", "sex": "male", "age": 39, "country": "Egypt", "marital_status": "married", "education": "higher", "social_class": "upper middle class"}, "question": {"id": "Q124", "variant": 0}, "response": ["Based on my emic perspective as a married male from Sharkia, Egypt, I understand that immigration in my country is often associated with economic and social challenges. The cultural context of Egypt and the impact of immigration on the local community is important to consider, as it affects social dynamics and resources. My individual values and personal experience have led me to believe that immigration does not necessarily increase the crime rate, as many immigrants come seeking better opportunities and contribute positively to the economy. Considering my socioeconomic background as part of the upper middle class, I am aware that my perspective may differ from those in lower socioeconomic brackets. Additionally, cultural relativism is crucial in understanding the diverse experiences and contributions of immigrants in Egypt. Space and time are also important factors to consider, as the impact of immigration may vary in different regions and over time. Ultimately, my nuanced understanding of this complex issue leads me to choose option (3) Disagree. \n\n3"]}, {"persona": {"region": "Sharkia", "sex": "female", "age": 26, "country": "Egypt", "marital_status": "married", "education": "middle", "social_class": "lower middle class"}, "question": {"id": "Q124", "variant": 0}, "response": ["Based on my cultural context and socioeconomic background, I believe that immigration does not necessarily increase the crime rate in my country. In Sharkia, Egypt, our community values diversity and we understand that immigrants come to our country seeking better opportunities for themselves and their families. Additionally, cultural relativism teaches us that we should not judge or stereotype individuals based on their background or place of origin. My personal experience and individual values also lead me to disagree with the idea that immigration increases crime, as I have seen many immigrants contribute positively to our society. Therefore, I choose option 3: Disagree."]}, {"persona": {"region": "Sharkia", "sex": "female", "age": 48, "country": "Egypt", "marital_status": "married", "education": "middle", "social_class": "lower middle class"}, "question": {"id": "Q124", "variant": 0}, "response": ["Based on the anthropological framework, my emic perspective as a married female from Sharkia, Egypt, with a middle education level and lower middle class background, is shaped by my cultural context, individual values, and socioeconomic background. In Egypt, there are complex social and economic factors that contribute to the immigration situation, and it is important to consider the nuances of this issue. My personal experience and values lead me to believe that immigration does not necessarily increase the crime rate, as many immigrants come to Egypt seeking better opportunities and are not inherently inclined towards criminal behavior. Additionally, cultural relativism teaches us that different cultures have different ways of addressing and dealing with immigration, and it is not appropriate to make broad generalizations about the impact of immigration on crime. Therefore, my perspective aligns with option (3) Disagree. \n\n3"]}, {"persona": {"region": "Sharkia", "sex": "male", "age": 34, "country": "Egypt", "marital_status": "married", "education": "higher", "social_class": "upper middle class"}, "question": {"id": "Q124", "variant": 0}, "response": ["Based on the anthropological framework, I will approach this question from the perspective of someone from Sharkia, Egypt, who is 34 years old, married, and part of the upper middle class. From an emic perspective, I understand that immigration can bring about changes in the cultural context of a society, potentially leading to social and economic challenges. However, from an etic perspective, I also recognize that immigration can bring new perspectives and opportunities to a community. Considering my individual values and personal experience, I have seen how immigration has impacted my community, and I believe that it has had a positive effect overall. Additionally, taking into account my socioeconomic background and the cultural relativism of different perspectives, I understand that my viewpoint may differ from others. Therefore, I would choose option (3) Disagree. \n\n3"]}, {"persona": {"region": "Sharkia", "sex": "female", "age": 39, "country": "Egypt", "marital_status": "divorced", "education": "middle", "social_class": "lower middle class"}, "question": {"id": "Q124", "variant": 0}, "response": ["Based on the anthropological framework, my answer is influenced by my individual values and personal experience, as well as my socioeconomic background and cultural context. As a divorced woman from Sharkia, Egypt, I have personally experienced the struggles faced by lower middle class individuals in my community. I understand the economic hardships and lack of opportunities that many people face, and I know that these factors can contribute to crime. Additionally, the cultural context of Egypt, with its complex social and economic issues, further supports the idea that immigration may potentially increase the crime rate due to the strain it can put on resources and opportunities. Therefore, I choose:\n\n2"]}, {"persona": {"region": "Sharkia", "sex": "male", "age": 39, "country": "Egypt", "marital_status": "married", "education": "middle", "social_class": "upper middle class"}, "question": {"id": "Q124", "variant": 0}, "response": ["Considering my background and upbringing in Sharkia, Egypt, my emic perspective on immigration and its impact on crime is influenced by my cultural context, individual values, and socioeconomic background. In Egypt, immigration is often viewed as a positive opportunity for economic improvement and cultural exchange. Additionally, my upper middle-class status has shielded me from the economic struggles that may lead to crime, so I do not perceive immigration as a direct cause of crime. Furthermore, cultural relativism teaches me to view immigration from a nuanced perspective, understanding that different communities may have varied experiences with immigration. Therefore, I would have to disagree with the statement that immigration increases the crime rate.\n\n3"]}, {"persona": {"region": "Qaliubiya", "sex": "male", "age": 62, "country": "Egypt", "marital_status": "married", "education": "middle", "social_class": "working class"}, "question": {"id": "Q124", "variant": 0}, "response": ["Based on the anthropological framework, my emic perspective as a married male from Qaliubiya, Egypt, with a middle education level and working-class background, is shaped by my cultural context, individual values, and socioeconomic background. I understand that immigration can impact the dynamics of my community and may have implications for crime rates. Additionally, my age and place also play a role in shaping my perspective. Therefore, based on my nuanced understanding of this complex issue, I would choose:\n\n3"]}, {"persona": {"region": "Qaliubiya", "sex": "male", "age": 33, "country": "Egypt", "marital_status": "married", "education": "middle", "social_class": "working class"}, "question": {"id": "Q124", "variant": 0}, "response": ["Based on the anthropological framework, my perspective as a married male from Qaliubiya, Egypt, who is 33 years old, has completed middle education, and considers himself part of the working class, is influenced by my cultural context, individual values, and socioeconomic background. In Egypt, immigration is a complex issue that is often tied to economic struggles and social tensions. As someone from the working class, I have seen how immigration can impact job opportunities and resources in my community. Additionally, my personal experiences and values shape my perception of immigration and crime. I believe that immigration may have some impact on crime rates due to the challenges and tensions it can create in communities. Therefore, my perspective is influenced by the nuanced phrasing of the question and my understanding of the cultural context in which I live.\n\n2"]}, {"persona": {"region": "Qaliubiya", "sex": "male", "age": 62, "country": "Egypt", "marital_status": "married", "education": "higher", "social_class": "lower middle class"}, "question": {"id": "Q124", "variant": 0}, "response": ["Based on my emic perspective as a married male from Qaliubiya, Egypt, I have observed that the cultural context and socioeconomic background play a significant role in the understanding of the impact of immigration on crime rates. In my community, there is a strong emphasis on family and social cohesion, and I believe that individuals who immigrate to Egypt are often looking for better opportunities and are not inclined to engage in criminal activities. Additionally, my personal experience and values lead me to believe that immigration can actually have a positive impact on the economy and social fabric of our country. Therefore, I would have to disagree with the statement that immigration in my country increases the crime rate.\n\n3"]}, {"persona": {"region": "Qaliubiya", "sex": "male", "age": 29, "country": "Egypt", "marital_status": "married", "education": "middle", "social_class": "working class"}, "question": {"id": "Q124", "variant": 0}, "response": ["Based on the anthropological framework, my perspective as a married male from Qaliubiya, Egypt, who is 29 years old and part of the working class, is heavily influenced by my cultural context, individual values, and socioeconomic background. In Egypt, immigration is a complex issue, and the influx of immigrants from neighboring countries has sparked debates about its impact on crime rates. However, my personal experience and cultural context lead me to believe that immigration does not necessarily increase the crime rate. I am aware of the challenges faced by immigrants in our society and the economic opportunities they seek, and I believe that these factors are more relevant to crime rates than immigration itself. Additionally, as part of the working class, I understand the struggles and hardships that many immigrants face, and I do not believe that they are more prone to criminal behavior simply because of their immigrant status. Therefore, based on my understanding and perspective, I would choose option (3) Disagree."]}, {"persona": {"region": "Qaliubiya", "sex": "female", "age": 42, "country": "Egypt", "marital_status": "married", "education": "higher", "social_class": "working class"}, "question": {"id": "Q124", "variant": 0}, "response": ["Based on the anthropological framework, as a married female from Qaliubiya, Egypt, my emic perspective would be influenced by my cultural context, individual values, and personal experience. In Egypt, immigration is a complex issue. The cultural context and socioeconomic background of immigrants could play a role in their likelihood to commit crimes, but so could the societal attitudes towards immigrants and their opportunities for employment and integration. Additionally, my personal experience and values would also shape my perspective on this issue. Therefore, it is hard to say definitively whether immigration in my country increases the crime rate.\n\n2"]}, {"persona": {"region": "Qaliubiya", "sex": "female", "age": 50, "country": "Egypt", "marital_status": "married", "education": "middle", "social_class": "lower middle class"}, "question": {"id": "Q124", "variant": 0}, "response": ["Based on the anthropological framework, my perspective as a married female from Qaliubiya, Egypt, who is 50 years old, with a middle education level, and part of the lower middle class, is shaped by my cultural context, individual values, and socioeconomic background. In Egypt, the issue of immigration is complex and cannot be viewed through a simplistic lens. The cultural context of Egypt, along with my personal experience and values, leads me to believe that immigration does not necessarily increase the crime rate. Additionally, my socioeconomic background and understanding of cultural relativism also inform my perspective, as I believe that the reasons behind crime are multifaceted and cannot be solely attributed to immigration. Therefore, I choose option (3) Disagree."]}, {"persona": {"region": "Qaliubiya", "sex": "male", "age": 29, "country": "Egypt", "marital_status": "married", "education": "higher", "social_class": "lower middle class"}, "question": {"id": "Q124", "variant": 0}, "response": ["Based on the anthropological framework, my emic perspective as a married male from Qaliubiya, Egypt, with a lower middle class socioeconomic background and higher education level, shapes my understanding of the relationship between immigration and crime rate. In my cultural context, I am aware of the complex dynamics of immigration and crime, and I understand that individual values and personal experiences play a significant role in shaping this understanding. Additionally, cultural relativism teaches me to approach this question without assuming a hierarchy of cultures. Taking into account the nuanced phrasing of the question, I believe that immigration does not necessarily increase the crime rate in my country, as I have observed in my community that immigrants often contribute positively to our society. Therefore, my perspective leads me to disagree with the statement that immigration in my country increases the crime rate.\n\n3"]}, {"persona": {"region": "Qaliubiya", "sex": "male", "age": 35, "country": "Egypt", "marital_status": "married", "education": "higher", "social_class": "working class"}, "question": {"id": "Q124", "variant": 0}, "response": ["Based on the anthropological framework, it is important to consider the emic and etic perspectives. In my cultural context in Qaliubiya, Egypt, immigration may be viewed from a different lens compared to other places. Additionally, my individual values and personal experience as a married male who is part of the working class will influence my perception. Socioeconomic background also plays a role, as well as the nuances of the question. Considering all these factors, I would choose option (2) Hard to say."]}, {"persona": {"region": "Qaliubiya", "sex": "female", "age": 40, "country": "Egypt", "marital_status": "married", "education": "middle", "social_class": "working class"}, "question": {"id": "Q124", "variant": 0}, "response": ["Based on the anthropological framework, my perspective as a married female from Qaliubiya, Egypt, who is 40 years old and part of the working class, is heavily influenced by my cultural context, individual values, and socioeconomic background. In Egypt, immigration is often associated with economic hardship and social tensions, which can lead to an increase in crime. Additionally, as a member of the working class, I am more likely to personally witness or be affected by any increase in crime. Therefore, I would tend to agree that immigration in my country increases the crime rate.\n\n1"]}, {"persona": {"region": "Qaliubiya", "sex": "female", "age": 48, "country": "Egypt", "marital_status": "divorced", "education": "lower", "social_class": "working class"}, "question": {"id": "Q124", "variant": 0}, "response": ["Based on the anthropological framework, my emic perspective as a divorced female from Qaliubiya, Egypt, with a lower education level and part of the working class, is heavily influenced by my cultural context, individual values, and socioeconomic background. In Egypt, immigration is a complex issue that intersects with issues of economic opportunity and social integration. My personal experience and values lead me to believe that immigration does not necessarily increase crime rates, as many immigrants come to Egypt seeking better opportunities and are law-abiding citizens. Additionally, my cultural relativism perspective reminds me that there is no hierarchy of culture, and it is not fair to blame immigrants for social issues. Therefore, I choose option (3) Disagree."]}, {"persona": {"region": "Qaliubiya", "sex": "male", "age": 46, "country": "Egypt", "marital_status": "married", "education": "middle", "social_class": "working class"}, "question": {"id": "Q124", "variant": 0}, "response": ["Based on the anthropological framework, my perspective on immigration and its impact on crime in Egypt is influenced by my cultural context, individual values, and socioeconomic background. As a working-class married male from Qaliubiya, Egypt, I have been shaped by my experiences and personal values, which may differ from those of others. Additionally, cultural relativism teaches me to consider the diversity of opinions and experiences within my society. Given these factors, I believe that immigration does not necessarily increase the crime rate in my country. \n\n3"]}, {"persona": {"region": "Qaliubiya", "sex": "male", "age": 47, "country": "Egypt", "marital_status": "married", "education": "higher", "social_class": "lower middle class"}, "question": {"id": "Q124", "variant": 0}, "response": ["From an emic perspective, as a married male from Qaliubiya, Egypt, I have a personal understanding of the cultural context and socioeconomic background in my country. I am aware of the challenges faced by those in lower middle class, including the impact of immigration on crime rates. My individual values and personal experience also shape my perception, and my higher education level allows me to critically analyze the situation. Considering the principle of cultural relativism, I understand that my perspective may differ from others, but based on my nuanced understanding of the issue, I would have to choose option (3) Disagree. Immigration in my country does not necessarily increase the crime rate."]}, {"persona": {"region": "Qaliubiya", "sex": "female", "age": 38, "country": "Egypt", "marital_status": "married", "education": "higher", "social_class": "working class"}, "question": {"id": "Q124", "variant": 0}, "response": ["Based on the anthropological framework, as a married female from Qaliubiya, Egypt, my emic perspective is influenced by the cultural context of my region, where immigration has been a longstanding issue. My personal experience and individual values shape my understanding, and my socioeconomic background as part of the working class also plays a role. Cultural relativism reminds me that there are diverse perspectives on immigration and crime, and space and time considerations are important in this discussion. Considering the nuanced phrasing of the question, I would have to say:\n3"]}, {"persona": {"region": "Qaliubiya", "sex": "male", "age": 58, "country": "Egypt", "marital_status": "married", "education": "middle", "social_class": "working class"}, "question": {"id": "Q124", "variant": 0}, "response": ["Based on the anthropological framework, as a married male from Qaliubiya, Egypt, my emic perspective is heavily influenced by my cultural context, individual values, and socioeconomic background. In Egypt, immigration has been a hotly debated topic, especially in recent years. However, cultural relativism is crucial in understanding this issue, as the context of immigration in Egypt is different from other countries. Additionally, my working-class background and middle education level contribute to my understanding of this issue. Therefore, I would say it is hard to say whether immigration in my country increases the crime rate.\n\n2"]}, {"persona": {"region": "Qaliubiya", "sex": "female", "age": 27, "country": "Egypt", "marital_status": "married", "education": "higher", "social_class": "working class"}, "question": {"id": "Q124", "variant": 0}, "response": ["Based on my emic perspective as a married female from Qaliubiya, Egypt, I understand that immigration has been a topic of discussion in my community and has been linked to concerns about crime. However, considering the cultural context, individual values, and socioeconomic background of the people in my area, I believe that immigration does not necessarily lead to an increase in crime. The cultural relativism and nuance in the understanding of this issue also play a role in my perspective, as I believe that immigrants bring diverse perspectives and skills that can benefit society. Therefore, I would choose option (3) Disagree as my answer.\n\n3"]}, {"persona": {"region": "Qaliubiya", "sex": "female", "age": 48, "country": "Egypt", "marital_status": "married", "education": "middle", "social_class": "upper middle class"}, "question": {"id": "Q124", "variant": 0}, "response": ["Based on the anthropological framework, as a married female from Qaliubiya, Egypt, my emic perspective on immigration and its impact on crime rate is shaped by my cultural context, individual values, and socioeconomic background. In my community, immigration is often viewed as a way to escape economic hardship and seek better opportunities. However, there is also a fear of cultural clashes and competition for resources. As a member of the upper middle class, I have seen how immigration has brought both positive and negative changes to our society. While I believe that some immigrants may resort to crime due to lack of opportunities, I also recognize that many immigrants contribute positively to our economy and society. Therefore, I find it hard to say whether immigration in my country directly increases the crime rate. \n\n2"]}, {"persona": {"region": "Giza", "sex": "female", "age": 19, "country": "Egypt", "marital_status": "single", "education": "middle", "social_class": "working class"}, "question": {"id": "Q124", "variant": 0}, "response": ["Based on the anthropological framework, as a single female from Giza, Egypt, I must consider the emic perspective of my community and the etic perspective of outsiders. In the cultural context of Egypt, immigration is a complex issue that is tied to historical, political, and economic factors. My individual values and personal experience as a working-class young woman also play a role in shaping my view. Additionally, my socioeconomic background and age factor into my understanding. Considering cultural relativism, I recognize that different cultures have different perspectives on immigration and its impact on crime. Therefore, I believe it is hard to say whether immigration in my country increases the crime rate.\n2"]}, {"persona": {"region": "Giza", "sex": "female", "age": 38, "country": "Egypt", "marital_status": "married", "education": "higher", "social_class": "lower middle class"}, "question": {"id": "Q124", "variant": 0}, "response": ["Based on the anthropological framework, as a married female from Giza, Egypt, my emic perspective is influenced by my cultural context, individual values, and socioeconomic background. In Egyptian culture, immigration is often seen as a means of economic improvement, and my personal experience and values align with this view. Additionally, as part of the lower middle class, I understand the challenges that many immigrants face and how they may be unfairly targeted as a result. Considering cultural relativism, I believe that immigration is not inherently linked to crime, and the nuanced phrasing of the question also leads me to disagree with the statement. \n\n3"]}, {"persona": {"region": "Beni Swaif/Beni Suef", "sex": "female", "age": 34, "country": "Egypt", "marital_status": "divorced", "education": "higher", "social_class": "lower class"}, "question": {"id": "Q124", "variant": 0}, "response": ["Based on my personal experience and socioeconomic background, as a divorced female from Beni Swaif/Beni Suef, Egypt, I have observed that immigration in our country does not necessarily lead to an increase in crime rate. The cultural context in which I live has taught me that immigration often brings diverse perspectives and opportunities for growth, rather than contributing to an increase in criminal activities. Additionally, the emic perspective within my community emphasizes the value of inclusivity and understanding, rather than perpetuating stereotypes about immigrants and crime. Therefore, I would have to disagree with the notion that immigration in my country increases the crime rate.\n\n3"]}, {"persona": {"region": "Beni Swaif/Beni Suef", "sex": "male", "age": 20, "country": "Egypt", "marital_status": "single", "education": "higher", "social_class": "working class"}, "question": {"id": "Q124", "variant": 0}, "response": ["Based on my emic perspective as a single male from Beni Swaif/Beni Suef, Egypt, I understand that immigration is often associated with socioeconomic factors and cultural differences. The cultural context of my country also plays a significant role in shaping my understanding of immigration and crime. As an individual from the working class, I am aware of the challenges and opportunities that come with immigration. Additionally, my personal experience and values have led me to consider the nuanced implications of immigration on crime rates. Considering the cultural relativism and socioeconomic background of my perspective, I would have to say that it is hard to say. \n\n2"]}, {"persona": {"region": "Giza", "sex": "male", "age": 19, "country": "Egypt", "marital_status": "single", "education": "middle", "social_class": "upper middle class"}, "question": {"id": "Q124", "variant": 0}, "response": ["Based on my personal experience and socioeconomic background, I understand that immigration can have a significant impact on the crime rate in my country. As a member of the upper middle class in Giza, Egypt, I have seen how immigration has led to social and economic changes in my community. The influx of immigrants can sometimes lead to competition for limited resources and opportunities, which can contribute to an increase in crime. Additionally, cultural differences and language barriers can create misunderstandings and tensions that may result in criminal activity. Therefore, I believe that immigration in my country does have the potential to increase the crime rate.\n\n2"]}, {"persona": {"region": "Giza", "sex": "female", "age": 33, "country": "Egypt", "marital_status": "married", "education": "middle", "social_class": "working class"}, "question": {"id": "Q124", "variant": 0}, "response": ["From the perspective of a married female from Giza, Egypt, who is 33 years old, completed middle education, and considers herself part of the working class, I would approach this question with a focus on cultural context, individual values and personal experience, and socioeconomic background. In Egypt, there is a strong sense of community and family, and immigration is often seen as a way to improve economic opportunities. However, there may also be concerns about competition for jobs and resources. As a member of the working class, I may have experienced economic hardships and understand the importance of finding work to support my family. Therefore, I would consider immigration from a nuanced perspective, taking into account the potential benefits and challenges it may bring to my community. Additionally, the cultural relativism perspective would remind me that different cultures have different ways of understanding and addressing social issues, and there is no hierarchy of culture. With this in mind, I would choose:\n\n2"]}, {"persona": {"region": "Giza", "sex": "female", "age": 24, "country": "Egypt", "marital_status": "married", "education": "higher", "social_class": "working class"}, "question": {"id": "Q124", "variant": 0}, "response": ["Based on the anthropological framework, my perspective as a married female from Giza, Egypt, who is 24 years old and part of the working class, is heavily influenced by my cultural context, individual values, and socioeconomic background. In Egypt, immigration is a complex issue that is deeply tied to our history and current socio-economic conditions. As a working-class individual, I am aware of the challenges my community faces, and I believe that immigration has the potential to strain resources and contribute to social tensions. However, I also recognize the importance of cultural relativism and the nuanced nature of this issue, as it is not solely about crime rates but also about the diverse contributions immigrants make to our society. Ultimately, my perspective is shaped by my understanding of the complexities of immigration and its impact on our community.\n\n3"]}, {"persona": {"region": "Giza", "sex": "male", "age": 50, "country": "Egypt", "marital_status": "married", "education": "higher", "social_class": "working class"}, "question": {"id": "Q124", "variant": 0}, "response": ["Based on the anthropological framework, my perspective is shaped by my cultural context, socioeconomic background, individual values, and personal experiences. As a married male from Giza, Egypt, who is 50 years old and part of the working class, I have personally witnessed the impact of immigration on the crime rate in my community. I understand the importance of cultural relativism and recognize that the perception of immigration and its impact on crime can vary based on individual experiences and perspectives. Therefore, I believe that immigration does not necessarily increase the crime rate, as it is influenced by various factors such as socioeconomic background, cultural context, and personal experiences. \n\n3"]}, {"persona": {"region": "Beni Swaif/Beni Suef", "sex": "female", "age": 26, "country": "Egypt", "marital_status": "married", "education": "higher", "social_class": "lower middle class"}, "question": {"id": "Q124", "variant": 0}, "response": ["Based on my personal experience and cultural context, I believe that immigration in my country does not necessarily increase the crime rate. As a member of the lower middle class in Beni Suef, Egypt, I have witnessed the struggles and hardships faced by many immigrants seeking a better life in our country. I understand that socioeconomic background plays a significant role in shaping one's perspective on immigration and crime. Additionally, the nuance of the situation is important to consider, as not all immigrants are involved in criminal activities. Furthermore, cultural relativism teaches us to understand and respect the diverse backgrounds and experiences of immigrants, which may influence their involvement in criminal activities. Therefore, I choose option (3) Disagree."]}, {"persona": {"region": "Beni Swaif/Beni Suef", "sex": "male", "age": 40, "country": "Egypt", "marital_status": "single", "education": "lower", "social_class": "lower class"}, "question": {"id": "Q124", "variant": 0}, "response": ["Based on my emic perspective as a lower class individual from Beni Swaif, Egypt, I have observed that the cultural context and socioeconomic background play a significant role in shaping the immigration experience. My personal experience and individual values lead me to believe that immigration does not necessarily increase the crime rate, as immigrants often come to our country seeking better opportunities and a safer environment. I understand the importance of cultural relativism and recognize that each person's experience is unique, so I cannot make a blanket statement about immigration and crime. Additionally, the nuance of the question leads me to believe that it is hard to say definitively whether immigration increases the crime rate in my country.\n\n2"]}, {"persona": {"region": "Beni Swaif/Beni Suef", "sex": "female", "age": 25, "country": "Egypt", "marital_status": "married", "education": "middle", "social_class": "lower middle class"}, "question": {"id": "Q124", "variant": 0}, "response": ["Based on the anthropological framework, my emic perspective as a married female from Beni Swaif, Egypt, is influenced by my cultural context, individual values, and socioeconomic background. In my community, immigration is often associated with economic hardship, and some people may resort to crime out of desperation. Additionally, the influx of different cultures and languages may lead to misunderstandings and conflicts, potentially increasing crime rates. Therefore, I believe that immigration in my country may indeed increase the crime rate, as it is a reflection of the challenges and struggles faced by individuals in my lower middle class community.\n\n2"]}, {"persona": {"region": "Beni Swaif/Beni Suef", "sex": "female", "age": 21, "country": "Egypt", "marital_status": "single", "education": "middle", "social_class": "lower middle class"}, "question": {"id": "Q124", "variant": 0}, "response": ["Based on the anthropological framework, my emic perspective as a single female from Beni Swaif/Beni Suef, Egypt, with a middle education level and lower middle-class background, informs my understanding of the cultural context and socioeconomic background of my community. I recognize that individual values and personal experience, as well as cultural relativism, play a significant role in shaping my perspective. Additionally, the nuance of the question and the impact of space and time on my understanding cannot be overlooked. Therefore, I choose option (2) Hard to say, as I believe that immigration and its potential impact on crime rates are complex issues that cannot be easily generalized or simplified."]}, {"persona": {"region": "Beni Swaif/Beni Suef", "sex": "male", "age": 48, "country": "Egypt", "marital_status": "married", "education": "middle", "social_class": "lower middle class"}, "question": {"id": "Q124", "variant": 0}, "response": ["Based on the anthropological framework, as a married male from Beni Swaif, Egypt, with a lower middle-class socioeconomic background and completed middle education level, I understand the importance of cultural context and individual values in shaping perceptions. Immigration in our country may be viewed as a complex issue, influenced by historical, economic, and social factors. While it is important to consider the potential impact of immigration on crime rates, it is also crucial to recognize the nuance of the situation and avoid making blanket statements. Therefore, my answer to the question is:\n\n2"]}, {"persona": {"region": "Beni Swaif/Beni Suef", "sex": "female", "age": 57, "country": "Egypt", "marital_status": "married", "education": "middle", "social_class": "working class"}, "question": {"id": "Q124", "variant": 0}, "response": ["Based on the anthropological framework, my emic perspective as a married female from Beni Swaif/Beni Suef, Egypt, would be influenced by my cultural context, individual values, and socioeconomic background. In Egypt, immigration is often associated with economic opportunities and labor migration, rather than criminal activity. Additionally, cultural relativism teaches us that different societies have different norms and values, so it would be unfair to generalize about the impact of immigration on crime rates in my country. Therefore, I would have to disagree with the statement that immigration in Egypt increases the crime rate.\n\n3"]}, {"persona": {"region": "Beni Swaif/Beni Suef", "sex": "male", "age": 20, "country": "Egypt", "marital_status": "single", "education": "middle", "social_class": "working class"}, "question": {"id": "Q124", "variant": 0}, "response": ["Based on the anthropological framework, my emic perspective as a working-class individual from Beni Swaif/Beni Suef, Egypt, shapes my understanding of immigration and crime rate. The cultural context of my upbringing and the socioeconomic background I come from informs my opinion. I have personally witnessed the struggles and challenges faced by many immigrants in my community, and I understand how these difficulties can lead to involvement in crime. Additionally, my individual values and personal experiences lead me to believe that immigration can indeed increase the crime rate in my country. Therefore, I choose option 1: Agree."]}, {"persona": {"region": "Giza", "sex": "female", "age": 59, "country": "Egypt", "marital_status": "married", "education": "higher", "social_class": "upper middle class"}, "question": {"id": "Q124", "variant": 0}, "response": ["Based on the anthropological framework, my answer to the question of whether immigration in my country increases the crime rate is influenced by my cultural context, individual values, and personal experience. As a married female from Giza, Egypt, I understand the importance of immigration in contributing to the cultural diversity and economic growth of my country. Additionally, my higher education level has provided me with a nuanced understanding of the complexities of immigration and its impact on society. Considering myself part of the upper middle class, I recognize the value of immigration in enriching our society and contributing to our economy. Therefore, I choose option (3) Disagree."]}, {"persona": {"region": "Giza", "sex": "female", "age": 38, "country": "Egypt", "marital_status": "single", "education": "higher", "social_class": "lower middle class"}, "question": {"id": "Q124", "variant": 0}, "response": ["Based on the anthropological framework, my emic perspective as a single female from Giza, Egypt, who is 38 years old and part of the lower middle class, is influenced by my cultural context, individual values, and socioeconomic background. In Egypt, there are complex cultural and socioeconomic factors at play that may contribute to immigration having an impact on the crime rate. Additionally, my personal experience and nuanced understanding of the situation in my country lead me to believe that it is hard to say whether immigration directly increases the crime rate. There are various factors to consider, such as the socio-economic opportunities available to immigrants and the cultural integration process. Therefore, my answer is: \n2"]}, {"persona": {"region": "Giza", "sex": "female", "age": 26, "country": "Egypt", "marital_status": "single", "education": "higher", "social_class": "working class"}, "question": {"id": "Q124", "variant": 0}, "response": ["Based on the anthropological framework, as a single female from Giza, Egypt, my perspective on immigration and crime rate is influenced by my cultural context, individual values and personal experience, and socioeconomic background. In Egypt, immigration is a complex issue due to the country's history and current socio-political climate. As a member of the working class, I understand the challenges and opportunities that come with immigration. Additionally, my higher education has provided me with a nuanced understanding of the impact of immigration on crime rates. Therefore, I choose option 2: Hard to say."]}, {"persona": {"region": "Giza", "sex": "male", "age": 39, "country": "Egypt", "marital_status": "married", "education": "middle", "social_class": "working class"}, "question": {"id": "Q124", "variant": 0}, "response": ["Based on the anthropological framework, my perspective as a married male from Giza, Egypt, who is 39 years old, completed middle education, and consider myself part of the working class, is heavily influenced by my cultural context, individual values and personal experience, and socioeconomic background. I have grown up in a community where immigration is seen as a positive contribution to our society, as it has brought diversity and new opportunities. Additionally, my personal experience and the experiences of those around me have shown that immigrants often come to our country seeking better lives for themselves and their families, and are not more likely to engage in criminal activities. Therefore, I disagree with the statement that immigration in my country increases the crime rate.\n\n3"]}, {"persona": {"region": "Giza", "sex": "male", "age": 36, "country": "Egypt", "marital_status": "married", "education": "middle", "social_class": "working class"}, "question": {"id": "Q124", "variant": 0}, "response": ["From an emic perspective, as a married male from Giza, Egypt, my cultural context and socioeconomic background heavily influence my understanding of immigration and crime. Egypt has a long history of immigration, and the cultural relativism in our society means that we understand and accept the diversity of people coming from all over the world. Additionally, as a working-class individual, I am aware of the socioeconomic challenges that many immigrants face, which may lead to higher crime rates. However, I also recognize the importance of nuance in this discussion, as immigration can bring economic opportunities and cultural enrichment to our society. Therefore, my personal experience and values lead me to believe that immigration in my country may have a complex relationship with crime, making it hard to say definitively whether it increases the crime rate.\n\n2"]}, {"persona": {"region": "Giza", "sex": "female", "age": 30, "country": "Egypt", "marital_status": "single", "education": "higher", "social_class": "lower class"}, "question": {"id": "Q124", "variant": 0}, "response": ["Based on my emic perspective as a single female from Giza, Egypt, I have observed that immigration does not necessarily increase the crime rate. The cultural context in Egypt is one of hospitality and welcoming to outsiders, and I have personally not experienced an increase in crime due to immigration. Additionally, my lower socioeconomic background has led me to interact with and befriend many immigrants, and I have not seen them engaging in criminal activities. I also understand the importance of cultural relativism and not making assumptions about other cultures. Therefore, based on my personal experience and understanding of the cultural context, I would have to disagree with the statement that immigration increases the crime rate in my country.\n\n3"]}, {"persona": {"region": "Giza", "sex": "female", "age": 24, "country": "Egypt", "marital_status": "single", "education": "higher", "social_class": "lower class"}, "question": {"id": "Q124", "variant": 0}, "response": ["Based on my emic perspective as a single female from Giza, Egypt, I have personally witnessed how immigration has led to increased competition for resources and opportunities, which has in turn contributed to an increase in crime in certain areas. The cultural context of Egypt, with its complex social and economic dynamics, also plays a role in shaping my understanding of this issue. Additionally, my lower socioeconomic background has made me more aware of the struggles and tensions that arise from immigration, leading me to believe that immigration does indeed increase the crime rate. With all these factors in mind, I choose option (1) Agree."]}, {"persona": {"region": "Giza", "sex": "male", "age": 65, "country": "Egypt", "marital_status": "married", "education": "middle", "social_class": "working class"}, "question": {"id": "Q124", "variant": 0}, "response": ["From my emic perspective as a married male from Giza, Egypt, I know that immigration has been a contentious issue in my country. The cultural context here is that many immigrants come to Egypt seeking better economic opportunities, which can lead to increased competition for jobs and resources. As someone from the working class, I have personally felt the impact of this competition. Additionally, the socioeconomic background of immigrants often differs from that of the local population, leading to tensions and potential misunderstandings. However, I also recognize the nuance in this issue and understand that not all immigrants are involved in criminal activities. Therefore, I lean towards option (2) Hard to say, as it is a complex issue with multiple factors to consider. \n\n2"]}, {"persona": {"region": "Giza", "sex": "female", "age": 56, "country": "Egypt", "marital_status": "married", "education": "middle", "social_class": "working class"}, "question": {"id": "Q124", "variant": 0}, "response": ["Based on the anthropological framework, my emic perspective as a married female from Giza, Egypt, leads me to consider the cultural context, individual values, and socioeconomic background. In Egypt, immigration is a complex issue, and the cultural context of the country plays a significant role in how immigration is perceived. As a member of the working class, I understand the socioeconomic implications of immigration and how it may impact job opportunities and resources in my community. Additionally, my personal experience and values shape my understanding, and I believe that immigration does not necessarily increase the crime rate in my country. Therefore, I would choose option (3) Disagree."]}, {"persona": {"region": "Giza", "sex": "male", "age": 31, "country": "Egypt", "marital_status": "married", "education": "higher", "social_class": "lower middle class"}, "question": {"id": "Q124", "variant": 0}, "response": ["Based on the anthropological framework, as a married male from Giza, Egypt, my emic perspective is shaped by my cultural context and socioeconomic background. I understand that immigration is a complex issue, influenced by individual values, personal experiences, and the nuanced phrasing of the question. In my community, I have seen how immigration has brought both positive and negative aspects, and I recognize the importance of cultural relativism in understanding different perspectives. Considering the socioeconomic background and cultural context in Egypt, I would say it is hard to say whether immigration increases the crime rate, as it depends on various factors such as government policies, integration of immigrants, and economic opportunities. \n\n2"]}, {"persona": {"region": "Giza", "sex": "male", "age": 28, "country": "Egypt", "marital_status": "single", "education": "middle", "social_class": "working class"}, "question": {"id": "Q124", "variant": 0}, "response": ["Based on the anthropological framework, as a single male from Giza, Egypt, I am influenced by my cultural context, socioeconomic background, and personal experience. Egypt has a long history of immigration, and the cultural context of the country has shaped my understanding of immigration as a positive contribution to the diversity and economy of the country. As a working-class individual, I have personally seen immigrants contribute positively to the workforce and the community, and I understand the importance of cultural relativism in recognizing the value of different perspectives. Therefore, I would choose option 3: Disagree."]}, {"persona": {"region": "Giza", "sex": "male", "age": 47, "country": "Egypt", "marital_status": "married", "education": "middle", "social_class": "lower middle class"}, "question": {"id": "Q124", "variant": 0}, "response": ["Based on the anthropological framework, as a married male from Giza, Egypt, I am deeply rooted in my cultural context, with a strong emphasis on family and community. My lower middle class socioeconomic background has given me a nuanced understanding of the challenges faced by immigrants, and I am aware that immigration can bring about economic and social changes that may impact crime rates. Additionally, my age and educational background have provided me with a perspective that values careful consideration and acknowledges the complexity of social issues. Therefore, I would have to say it is hard to say.\n\n2"]}, {"persona": {"region": "Giza", "sex": "male", "age": 26, "country": "Egypt", "marital_status": "single", "education": "middle", "social_class": "lower middle class"}, "question": {"id": "Q124", "variant": 0}, "response": ["Based on the anthropological framework, my emic perspective as a lower middle class individual from Giza, Egypt, is heavily influenced by my cultural context, individual values, and socioeconomic background. In Egypt, immigration is a complex issue and often perceived as a threat to job opportunities and resources. Additionally, my personal experience and the experiences of those around me have shaped my understanding of immigration and its potential impact on crime rates. Considering the nuance of the question, I would have to choose:\n\n2"]}, {"persona": {"region": "Giza", "sex": "male", "age": 48, "country": "Egypt", "marital_status": "married", "education": "middle", "social_class": "upper middle class"}, "question": {"id": "Q124", "variant": 0}, "response": ["Based on my personal experience and cultural context as a married male from Giza, Egypt, I am inclined to believe that immigration does not necessarily increase the crime rate in my country. I understand the importance of cultural relativism and recognize that immigrants often come to Egypt in search of better opportunities and a better life for themselves and their families. Additionally, I am aware that socioeconomic background and individual values play a significant role in how people perceive and approach immigration. Immigrants contribute to the diversity and richness of our society and economy, and I believe that with proper integration and support, they can positively impact our country. \n\n3"]}, {"persona": {"region": "Menya", "sex": "male", "age": 61, "country": "Egypt", "marital_status": "married", "education": "middle", "social_class": "working class"}, "question": {"id": "Q124", "variant": 0}, "response": ["Based on the anthropological framework, as a married male from Menya, Egypt, my emic perspective on immigration and crime is influenced by my cultural context, socioeconomic background, and personal experience. Menya is a region with a strong sense of community and a history of economic struggles, so my understanding of immigration and crime is shaped by these factors. Additionally, as a working-class individual with a middle education level, I have witnessed firsthand the impact of immigration on the local job market and social dynamics. Therefore, considering the nuanced phrasing of the question and the cultural relativism, I would have to choose:\n\n3"]}, {"persona": {"region": "Menya", "sex": "male", "age": 41, "country": "Egypt", "marital_status": "married", "education": "middle", "social_class": "lower middle class"}, "question": {"id": "Q124", "variant": 0}, "response": ["Based on my emic perspective as a married male from Menya, Egypt, I believe that immigration does not necessarily increase the crime rate. The cultural context of Egypt, along with my individual values and personal experiences, lead me to understand that immigrants come to our country in search of better opportunities and a safer environment. Additionally, the socioeconomic background of immigrants may also influence their likelihood to engage in criminal activities. Cultural relativism teaches us not to judge others based on their cultural background, and I believe that space and time also play a role in how immigrants integrate into our society. Therefore, I have to disagree with the statement that immigration in our country increases the crime rate.\n\n3"]}, {"persona": {"region": "Menya", "sex": "female", "age": 43, "country": "Egypt", "marital_status": "married", "education": "higher", "social_class": "working class"}, "question": {"id": "Q124", "variant": 0}, "response": ["Based on the anthropological framework, my emic perspective as a married female from Menya, Egypt, who is 43 years old and part of the working class, is influenced by my cultural context, individual values, and socioeconomic background. In Menya, immigration has been a controversial topic and there are differing opinions on its impact. As a member of the working class, I have seen firsthand the struggles and challenges faced by immigrants in our community. Additionally, my higher education level has provided me with a broader understanding of the complexities of immigration and its effects. Considering the cultural relativism and nuance of the issue, I would have to say that it is hard to say whether immigration in our country increases the crime rate. \n\n2"]}, {"persona": {"region": "Menya", "sex": "male", "age": 57, "country": "Egypt", "marital_status": "married", "education": "middle", "social_class": "lower middle class"}, "question": {"id": "Q124", "variant": 0}, "response": ["Based on the anthropological framework, as a married male from Menya, Egypt, my emic perspective may be influenced by the cultural context of my community, where immigration may be seen as a potential threat to local resources and job opportunities. Additionally, my lower middle class socioeconomic background may lead me to perceive immigrants as competition for limited resources and opportunities, potentially leading to an increase in crime. However, considering the cultural relativism and nuance of the situation, it is important to acknowledge that this perspective is not universal and that immigration may also bring diverse perspectives and economic benefits to the community. Therefore, it is hard to say definitively whether immigration in my country increases the crime rate.\n\n2"]}, {"persona": {"region": "Menya", "sex": "male", "age": 42, "country": "Egypt", "marital_status": "divorced", "education": "middle", "social_class": "lower middle class"}, "question": {"id": "Q124", "variant": 0}, "response": ["Based on my emic perspective as a divorced male from Menya, Egypt, I have witnessed firsthand the impact of immigration on the crime rate in my community. The cultural context in which I live, along with my lower middle class socioeconomic background, has shaped my understanding of this issue. I have seen how limited job opportunities and economic hardships have led to an increase in crime, and I believe that immigration has played a role in this. Additionally, my individual values and personal experiences have influenced my perception, leading me to strongly agree that immigration in my country has contributed to the rise in crime.\n\n1"]}, {"persona": {"region": "Menya", "sex": "female", "age": 59, "country": "Egypt", "marital_status": "married", "education": "middle", "social_class": "upper middle class"}, "question": {"id": "Q124", "variant": 0}, "response": ["Based on the anthropological framework, my personal experience and cultural context as a married female from Menya, Egypt, play a crucial role in my understanding of immigration and its impact on crime rates. In our community, we value stability and security, and we believe that immigration can bring in individuals who may be desperate and resort to crime. Additionally, our socioeconomic background and class status make us more concerned about the potential impact of immigration on crime. Furthermore, the nuanced phrasing of the question allows me to consider the potential negative impact of immigration on crime rates in our country.\n\n2"]}, {"persona": {"region": "Menya", "sex": "female", "age": 31, "country": "Egypt", "marital_status": "married", "education": "middle", "social_class": "working class"}, "question": {"id": "Q124", "variant": 0}, "response": ["Based on the anthropological framework, as a married female from Menya, Egypt, my emic perspective would be influenced by my cultural context, individual values, and socioeconomic background. In Menya, immigration is seen as a potential threat to job security and economic stability, which could lead to increased crime rates. Additionally, as a working-class individual, the competition for jobs and resources posed by immigration may be perceived as a negative impact on my community. Therefore, considering these factors, I would have to agree that immigration in my country could potentially increase the crime rate.\n\n1"]}, {"persona": {"region": "Menya", "sex": "male", "age": 55, "country": "Egypt", "marital_status": "single", "education": "middle", "social_class": "working class"}, "question": {"id": "Q124", "variant": 0}, "response": ["From the perspective of a single male from Menya, Egypt, who is 55 years old, completed middle education level, and considers himself part of the working class, several factors must be considered when answering the question regarding immigration and crime rate. The cultural context of Menya, Egypt, where there may be limited economic opportunities and resources, could lead to tensions between native citizens and immigrants, potentially contributing to an increase in crime. Additionally, the individual values and personal experiences of the persona may shape their perception of immigration and crime, leading them to believe that immigration does indeed increase the crime rate. However, the persona's socioeconomic background as a member of the working class may also influence their views on immigration and crime, as they may understand the struggle and challenges faced by immigrants. Furthermore, the nuance of the question and the specific circumstances of Menya, Egypt, must be considered, as they could significantly impact the persona's perspective. \n\n3"]}, {"persona": {"region": "Menya", "sex": "female", "age": 28, "country": "Egypt", "marital_status": "married", "education": "higher", "social_class": "lower middle class"}, "question": {"id": "Q124", "variant": 0}, "response": ["Based on my cultural context as a married female from Menya, Egypt, my emic perspective is influenced by the socioeconomic background of being part of the lower middle class and my personal experience of completing higher education. In Egypt, immigration has been a contentious issue, and the etic perspective often portrays immigrants as contributing to an increase in crime. However, my cultural relativism and nuanced understanding of the situation lead me to disagree with this notion. I believe that immigration does not necessarily lead to an increase in crime, as there are many contributing factors to crime rates and immigration is not the sole cause. Additionally, my individual values and personal experience inform my belief that immigrants often come to Egypt seeking better opportunities and are not inherently prone to criminal behavior. Therefore, my perspective is shaped by a combination of cultural context, individual values, and personal experience, leading me to disagree with the notion that immigration in my country increases the crime rate.\n\n3"]}, {"persona": {"region": "Menya", "sex": "male", "age": 24, "country": "Egypt", "marital_status": "single", "education": "middle", "social_class": "working class"}, "question": {"id": "Q124", "variant": 0}, "response": ["From the emic perspective, as a single male from Menya, Egypt, my understanding of immigration and its impact on crime rate is shaped by my cultural context, individual values, and socioeconomic background. In Menya, there is a strong sense of community and family ties, and immigrants are often seen as hardworking individuals trying to provide a better life for themselves and their families. Additionally, my working-class background has taught me the importance of empathy and understanding towards others who may be in a similar socioeconomic situation. I also believe in cultural relativism, understanding that different cultures bring different perspectives and that no culture is inherently superior to another. Therefore, I am inclined to disagree with the notion that immigration increases the crime rate in my country. \n\n3"]}, {"persona": {"region": "Menya", "sex": "female", "age": 23, "country": "Egypt", "marital_status": "married", "education": "middle", "social_class": "working class"}, "question": {"id": "Q124", "variant": 0}, "response": ["From an emic perspective, as a married female from Menya, Egypt, my understanding of immigration and its impact on crime rate is heavily influenced by my cultural context. In Egypt, socioeconomic background plays a significant role in shaping individuals' experiences and values. As part of the working class, I have seen firsthand the struggles and challenges faced by immigrants in our community. Additionally, cultural relativism reminds us that we should not judge or generalize the actions of a group of people based on the actions of a few. Taking into account the nuances of the question, I would have to disagree with the statement that immigration in our country increases the crime rate.\n\n3"]}, {"persona": {"region": "Menya", "sex": "male", "age": 27, "country": "Egypt", "marital_status": "single", "education": "middle", "social_class": "lower middle class"}, "question": {"id": "Q124", "variant": 0}, "response": ["Based on the anthropological framework, my answer to the question is influenced by my emic perspective as a single male from Menya, Egypt. I have personally experienced the impact of immigration in my community and have observed how it has affected the cultural context, individual values, and socioeconomic background of the people around me. Additionally, my understanding is shaped by the cultural relativism that I have been exposed to, where I recognize the diversity and nuances of different cultures. Considering all these factors, I would choose the option:\n\n2"]}, {"persona": {"region": "Asyut", "sex": "male", "age": 30, "country": "Egypt", "marital_status": "married", "education": "middle", "social_class": "working class"}, "question": {"id": "Q124", "variant": 0}, "response": ["Based on my cultural context, socioeconomic background, and personal experience, I would argue that immigration in my country does not necessarily increase the crime rate. As someone from Asyut, Egypt, I understand the importance of cultural relativism and nuance in addressing this question. I recognize that individual values and personal experience play a significant role in shaping perceptions, and I believe that immigration can bring both positive and negative impacts to a community. While there may be instances where immigration contributes to certain social challenges, I also see the potential for immigrants to bring valuable contributions to the economy and society. Therefore, I would say it is hard to say definitively whether immigration increases the crime rate in my country.\n\n2"]}, {"persona": {"region": "Asyut", "sex": "female", "age": 26, "country": "Egypt", "marital_status": "married", "education": "middle", "social_class": "working class"}, "question": {"id": "Q124", "variant": 0}, "response": ["Based on the anthropological framework, my understanding and answer to the question about immigration and crime rate in my country is influenced by my emic perspective as a married female from Asyut, Egypt, my cultural context, individual values, and socioeconomic background. In Egypt, there are different cultural perspectives on immigration and crime, and as someone from the working class with limited education, my personal experience and values may lead me to perceive immigration and crime differently than someone from a different socioeconomic background. Additionally, cultural relativism and nuance play a role in my interpretation of this issue. Therefore, my answer to the question is based on my nuanced understanding of the situation and should be considered in this context.\n\n2"]}, {"persona": {"region": "Asyut", "sex": "male", "age": 32, "country": "Egypt", "marital_status": "single", "education": "higher", "social_class": "lower middle class"}, "question": {"id": "Q124", "variant": 0}, "response": ["Based on the anthropological framework, my perspective on immigration and crime rate in my country is influenced by various factors. As a single male from Asyut, Egypt, my emic perspective is shaped by the cultural context of my community and the socioeconomic background of being part of the lower middle class. My personal experience and individual values also play a role in my understanding. Considering the nuance of the question, I would have to say it is hard to say. Immigration may bring about changes in the cultural landscape and socioeconomic dynamics, which can have an impact on crime rates. However, it is not a straightforward correlation and there are many other factors at play. \n\n2"]}, {"persona": {"region": "Asyut", "sex": "female", "age": 21, "country": "Egypt", "marital_status": "married", "education": "middle", "social_class": "working class"}, "question": {"id": "Q124", "variant": 0}, "response": ["Based on the anthropological framework, as a married female from Asyut, Egypt, I am influenced by my cultural context, individual values, and socioeconomic background. In my community, immigration is often viewed as a source of economic and social strain, which can lead to increased crime rates. Additionally, my working-class background may lead me to perceive immigrants as competition for jobs and resources, potentially fueling my belief that immigration increases crime. Therefore, I would choose option (1) Agree."]}, {"persona": {"region": "Asyut", "sex": "female", "age": 30, "country": "Egypt", "marital_status": "married", "education": "higher", "social_class": "working class"}, "question": {"id": "Q124", "variant": 0}, "response": ["Based on the anthropological framework, as a married female from Asyut, Egypt, my emic perspective would be influenced by my cultural context, individual values, and socioeconomic background. In Egypt, immigration is a complex issue, with many people coming from other countries seeking better opportunities or fleeing conflict. As a working-class woman who has completed higher education, I understand the struggles that immigrants face in finding work and integrating into society. However, I also recognize the importance of cultural relativism and the nuance of the situation. Therefore, I would say it is hard to say whether immigration in my country increases the crime rate.\n\n2"]}, {"persona": {"region": "Asyut", "sex": "female", "age": 42, "country": "Egypt", "marital_status": "married", "education": "higher", "social_class": "lower middle class"}, "question": {"id": "Q124", "variant": 0}, "response": ["Based on the anthropological framework, as a married female from Asyut, Egypt, I am influenced by my cultural context, individual values, and socioeconomic background. In my community, there is a strong emphasis on family and community, and I believe that immigration can bring new perspectives and opportunities. Additionally, my lower middle class background has taught me the importance of empathy and understanding, and I do not believe in making assumptions about immigrants contributing to crime without considering the larger social and economic factors at play. Therefore, I disagree with the statement that immigration in my country increases the crime rate.\n\n3"]}, {"persona": {"region": "Sohag", "sex": "male", "age": 63, "country": "Egypt", "marital_status": "married", "education": "middle", "social_class": "lower middle class"}, "question": {"id": "Q124", "variant": 0}, "response": ["Based on my emic perspective as a married male from Sohag, Egypt, I have seen the impact of immigration on our community. The cultural context in which I live has been affected by immigration, and I have observed the changes in our socioeconomic background as a result. As a member of the lower middle class, I have witnessed the nuanced effects of immigration on our daily lives and have seen how it has impacted our space and time. Therefore, I believe that immigration in our country has led to an increase in the crime rate.\n\n1"]}, {"persona": {"region": "Sohag", "sex": "male", "age": 27, "country": "Egypt", "marital_status": "married", "education": "middle", "social_class": "working class"}, "question": {"id": "Q124", "variant": 0}, "response": ["Based on my cultural context, as a married male from Sohag, Egypt, I am part of the working class and have completed middle education level. My individual values and personal experience lead me to believe that immigration does not necessarily increase the crime rate in my country. The socioeconomic background and cultural relativism in Egypt also play a significant role in my understanding. Additionally, space and time are important factors to consider, and I believe that the nuanced phrasing of the question leads me to disagree with the statement. \n\n3"]}, {"persona": {"region": "Sohag", "sex": "male", "age": 56, "country": "Egypt", "marital_status": "married", "education": "higher", "social_class": "upper middle class"}, "question": {"id": "Q124", "variant": 0}, "response": ["Based on the anthropological framework, as a married male from Sohag, Egypt, I understand that my perspective is influenced by my cultural context, individual values, and socioeconomic background. In Egypt, immigration is often associated with economic opportunities, and those who immigrate are often seeking better livelihoods. However, there may also be concerns about the impact of immigration on social dynamics and the job market. As someone from the upper middle class with a higher education level, I am likely to have a more nuanced understanding of immigration and its potential effects on crime rates. I would also consider the emic and etic perspectives on this issue, recognizing that there may be in-group and out-group ways of thinking about the relationship between immigration and crime. Therefore, my answer to the question \"Does immigration in your country increase the crime rate?\" is:\n\n2) Hard to say"]}, {"persona": {"region": "Sohag", "sex": "male", "age": 51, "country": "Egypt", "marital_status": "married", "education": "higher", "social_class": "lower middle class"}, "question": {"id": "Q124", "variant": 0}, "response": ["Based on the anthropological framework, I understand the importance of considering my cultural context, socioeconomic background, and personal experiences when answering this question. As a married male from Sohag, Egypt, I am aware of the challenges faced by individuals in my community, many of whom may be considering immigration as a means of seeking better opportunities. However, I also recognize the impact of socioeconomic factors and the potential for discrimination and marginalization in contributing to crime rates. Therefore, I believe that immigration may not directly increase crime rates, but rather it is a complex issue that requires a nuanced understanding of the various factors at play. \n\n2"]}, {"persona": {"region": "Sohag", "sex": "female", "age": 26, "country": "Egypt", "marital_status": "married", "education": "higher", "social_class": "working class"}, "question": {"id": "Q124", "variant": 0}, "response": ["Based on the anthropological framework, as a married female from Sohag, Egypt, I would consider the cultural context, individual values, and socioeconomic background in answering the question. In Sohag, there are strong kinship networks and cultural values that prioritize community and family, which could influence the perspective on immigration. Additionally, as part of the working class, I would consider the impact of immigration on job opportunities and economic stability, which could affect my perception of the issue. Therefore, my answer would be:\n\n2"]}, {"persona": {"region": "Sohag", "sex": "female", "age": 29, "country": "Egypt", "marital_status": "married", "education": "higher", "social_class": "upper middle class"}, "question": {"id": "Q124", "variant": 0}, "response": ["Based on the anthropological framework, my perspective as a married female from Sohag, Egypt, who is 29 years old and part of the upper middle class, is shaped by my cultural context, individual values, and socioeconomic background. In Egypt, immigration is often associated with economic and social challenges, and this can potentially impact crime rates. However, I also understand the importance of cultural relativism and nuance in addressing this issue, as well as the need to consider the specific circumstances and experiences of immigrants. Therefore, my perspective is that it is hard to say whether immigration in my country increases the crime rate.\n\n2"]}, {"persona": {"region": "Sohag", "sex": "male", "age": 51, "country": "Egypt", "marital_status": "married", "education": "middle", "social_class": "lower middle class"}, "question": {"id": "Q124", "variant": 0}, "response": ["Based on my cultural context, as a married male from Sohag, Egypt, I have a lower middle class socioeconomic background and completed middle education level. My understanding of immigration and its impact on crime rates is influenced by my personal experiences and individual values. I also recognize the importance of cultural relativism and understand that space and time play a crucial role in shaping perceptions. Therefore, my answer to the question of whether immigration in my country increases the crime rate is: \n\n3) Disagree"]}, {"persona": {"region": "Qena", "sex": "male", "age": 32, "country": "Egypt", "marital_status": "single", "education": "middle", "social_class": "working class"}, "question": {"id": "Q124", "variant": 0}, "response": ["Based on the anthropological framework, I, as a single male from Qena, Egypt, would consider the question of immigration and crime rate from an emic perspective, taking into account my cultural context, individual values, and personal experience. In Egypt, there is a strong sense of community and family, and the cultural context values hospitality and welcoming outsiders. Additionally, my personal experience and socioeconomic background as part of the working class have shown me that immigrants often come to Egypt seeking better opportunities and are not necessarily involved in criminal activities. Therefore, I would have to disagree with the statement that immigration in my country increases the crime rate.\n\n3"]}, {"persona": {"region": "Qena", "sex": "male", "age": 54, "country": "Egypt", "marital_status": "married", "education": "middle", "social_class": "lower middle class"}, "question": {"id": "Q124", "variant": 0}, "response": ["Based on the anthropological framework, my perspective on immigration and crime rate in my country is heavily influenced by my cultural context, socioeconomic background, and personal experience. As a married male from Qena, Egypt, I am aware of the challenges faced by immigrants and the impact of socioeconomic factors on crime rates. Additionally, my lower middle class status has made me more attuned to the nuances of societal issues and the potential impact of immigration on crime. Considering these factors, I would have to say: 2\n\n(2) Hard to say"]}, {"persona": {"region": "Qena", "sex": "male", "age": 25, "country": "Egypt", "marital_status": "single", "education": "lower", "social_class": "lower class"}, "question": {"id": "Q124", "variant": 0}, "response": ["From the perspective of a single male from Qena, Egypt, who is 25 years old, has completed a lower level of education, and considers himself part of the lower class, it is important to consider the cultural context and socioeconomic background in addressing the question. As someone who is part of the lower class, I am aware of the economic challenges that many people in my community face, including limited job opportunities and financial struggles. This may lead some individuals to consider immigration as a potential factor in increasing crime rates, as they may perceive immigrants as competition for scarce resources. However, it is crucial to also consider the cultural relativism and nuance in addressing this question, as well as the emic and etic perspectives. Ultimately, my personal experience and understanding lead me to select the option: (2) Hard to say."]}, {"persona": {"region": "Aswan", "sex": "male", "age": 34, "country": "Egypt", "marital_status": "single", "education": "middle", "social_class": "lower class"}, "question": {"id": "Q124", "variant": 0}, "response": ["Based on my personal experience and socioeconomic background, I believe that immigration in my country does not necessarily increase the crime rate. As a member of the lower class in Aswan, I have witnessed firsthand the struggles and hardships faced by immigrants who come to Egypt in search of better opportunities. I understand that their presence may be perceived as a burden on society, but I also recognize the importance of cultural relativism and the need to consider the nuanced factors at play. Immigrants often face discrimination and economic challenges, which may lead to higher crime rates, but this is not solely due to their immigration status. Rather, it is influenced by the complex interplay of cultural context, individual values, and socioeconomic background. Therefore, I would choose option (3) Disagree. \n\n3"]}, {"persona": {"region": "Aswan", "sex": "female", "age": 31, "country": "Egypt", "marital_status": "married", "education": "middle", "social_class": "lower middle class"}, "question": {"id": "Q124", "variant": 0}, "response": ["Based on my cultural context and socioeconomic background, I believe that immigration does not necessarily increase the crime rate in my country. As someone from Aswan, Egypt, I understand the importance of cultural relativism and the nuance of individual experiences. Additionally, I recognize the impact of socioeconomic background on perceptions of immigration and crime. I have also learned from personal experiences and individual values that immigration can bring diverse perspectives and opportunities to our country, which can contribute positively to our society. Therefore, I would choose option (3) Disagree."]}, {"persona": {"region": "Aswan", "sex": "female", "age": 39, "country": "Egypt", "marital_status": "married", "education": "middle", "social_class": "working class"}, "question": {"id": "Q124", "variant": 0}, "response": ["Based on the anthropological framework, as a married female from Aswan, Egypt, my emic perspective is influenced by my cultural context, individual values, and socioeconomic background. In Egypt, the cultural context and socioeconomic background play a significant role in shaping my understanding of immigration and crime. As a member of the working class, I am aware of the challenges and opportunities that immigration brings to my community. I also recognize the importance of cultural relativism in understanding different perspectives on this issue. Additionally, my personal experience and nuanced understanding of the dynamics in my community lead me to believe that immigration does not necessarily increase the crime rate in my country.\n\n3"]}, {"persona": {"region": "Qena", "sex": "female", "age": 27, "country": "Egypt", "marital_status": "married", "education": "lower", "social_class": "lower middle class"}, "question": {"id": "Q124", "variant": 0}, "response": ["Based on my personal experience and lower education level, I have seen that immigration in my country is often associated with an increase in crime. Additionally, being part of the lower middle class, I have observed that immigrants often struggle to find stable employment and may resort to criminal activities in order to survive. This understanding is also influenced by the cultural context in which I live, where there is a perception that immigrants bring with them a different set of values and behaviors that may contribute to an increase in crime. Therefore, based on these factors, I would have to agree that immigration in my country increases the crime rate.\n\n1"]}, {"persona": {"region": "Qena", "sex": "male", "age": 40, "country": "Egypt", "marital_status": "single", "education": "middle", "social_class": "lower middle class"}, "question": {"id": "Q124", "variant": 0}, "response": ["Based on the anthropological framework, my emic perspective as a single male from Qena, Egypt, is influenced by my cultural context, individual values and personal experience, and socioeconomic background. In Egypt, immigration is often associated with economic hardship and social tension, which can potentially lead to an increase in crime rates. Additionally, as a member of the lower middle class, I am more likely to be affected by competition for jobs and resources from immigrants. Therefore, taking all these factors into consideration, I would have to say that I agree with the statement.\n\n1"]}, {"persona": {"region": "Qena", "sex": "male", "age": 30, "country": "Egypt", "marital_status": "single", "education": "middle", "social_class": "working class"}, "question": {"id": "Q124", "variant": 0}, "response": ["Based on the anthropological framework, my answer to the question of whether immigration in my country increases the crime rate is influenced by several factors. Firstly, the cultural context of Egypt, particularly in Qena, plays a role in shaping my perspective. Additionally, my individual values and personal experiences as a working-class, 30-year-old man who has completed middle education will affect my viewpoint. Furthermore, my socioeconomic background and the space and time in which I live will also contribute to my answer. Considering cultural relativism, I understand that there are diverse perspectives on this issue and that nuance is important in understanding the complexities of immigration and crime in Egypt.\n\n3"]}]