[{"persona": {"region": "Fayoum", "sex": "male", "age": 46, "country": "Egypt", "marital_status": "married", "education": "higher", "social_class": "lower middle class"}, "question": {"id": "Q236", "variant": 0}, "response": ["From the perspective of a married male from Fayoum, Egypt, who is 46 years old and considers himself part of the lower middle class, my opinion on a political system that involves experts making decisions is influenced by several factors. The cultural context in Egypt values expertise and knowledge, and the socioeconomic background of being part of the lower middle class means that I may have limited access to resources and influence in the political system. Additionally, my individual values and personal experiences may lead me to have a nuanced understanding of the potential benefits and drawbacks of such a political system. Considering the emic and etic perspectives, I would choose option (2) Fairly good, as I believe that experts can bring valuable knowledge and expertise to decision-making, but I also recognize the potential for biases and lack of representation in such a system."]}, {"persona": {"region": "Fayoum", "sex": "female", "age": 30, "country": "Egypt", "marital_status": "married", "education": "middle", "social_class": "lower middle class"}, "question": {"id": "Q236", "variant": 0}, "response": ["In considering the question of a political system involving experts making decisions for the country, it is important to take into account the emic and etic perspectives of my cultural context in Fayoum, Egypt. The cultural context in Egypt values the opinions and decisions of elders and experts, often deferring to their wisdom and experience. Additionally, my individual values and personal experiences have shaped my perception, as I have been taught to respect authority and trust in the knowledge and judgment of those in positions of power. Furthermore, my lower middle-class socioeconomic background has influenced my perspective, as I have limited access to education and resources to fully understand complex political systems. Therefore, I believe that a political system involving experts making decisions for the country would be very good for Egypt as it would bring stability and progress to our nation.\n\n1"]}, {"persona": {"region": "Fayoum", "sex": "male", "age": 60, "country": "Egypt", "marital_status": "married", "education": "higher", "social_class": "working class"}, "question": {"id": "Q236", "variant": 0}, "response": ["Based on the anthropological framework, as a married male from Fayoum, Egypt, who is 60 years old and part of the working class, my opinion on a political system that involves experts making decisions for the country would be influenced by my cultural context, socioeconomic background, and individual values. In Egyptian culture, there is a deep respect for authority and expertise, so the idea of experts making decisions may be viewed positively. Additionally, as a member of the working class, I may value stability and security, which could lead me to believe that experts making decisions would be beneficial for the country's development. Considering my higher education level, I may also have a respect for knowledge and expertise. Therefore, my opinion on this political system would be:\n\n2\n\nFairly good"]}, {"persona": {"region": "Fayoum", "sex": "male", "age": 20, "country": "Egypt", "marital_status": "single", "education": "middle", "social_class": "lower middle class"}, "question": {"id": "Q236", "variant": 0}, "response": ["Based on the anthropological framework, as a 20-year-old male from Fayoum, Egypt, who has completed middle education and considers himself part of the lower middle class, my perspective is heavily influenced by my cultural context, socioeconomic background, and personal experience. In Egypt, there is a strong emphasis on hierarchical structures and authority, so the idea of experts making decisions for the country may be seen as a positive thing, as it aligns with the cultural value of respecting authority and expertise. Additionally, coming from a lower middle-class background, I may not have had much exposure to political decision-making processes, so I may view the expertise of others as necessary for the country's well-being. Overall, my perspective on a political system involving experts making decisions would likely be positive, as it aligns with my cultural and socioeconomic background.\n\n2"]}, {"persona": {"region": "Fayoum", "sex": "female", "age": 39, "country": "Egypt", "marital_status": "married", "education": "higher", "social_class": "lower middle class"}, "question": {"id": "Q236", "variant": 0}, "response": ["Based on my emic perspective as a married female from Fayoum, Egypt, my cultural context and socioeconomic background have shaped my understanding of the political system. In Egypt, there is a strong emphasis on social hierarchy and traditional values, and as someone from the lower middle class with a higher education level, I am accustomed to relying on experts for guidance and decision-making. Additionally, my individual values and personal experiences have led me to have a favorable view of experts making decisions for the country, as I believe they have the knowledge and expertise to lead the nation in the right direction. Furthermore, my understanding of cultural relativism has taught me to respect and trust the decisions made by those in positions of authority. Therefore, I believe that a political system involving experts making decisions based on what they think is best for the country would be very good.\n\n1"]}, {"persona": {"region": "Fayoum", "sex": "male", "age": 33, "country": "Egypt", "marital_status": "married", "education": "higher", "social_class": "working class"}, "question": {"id": "Q236", "variant": 0}, "response": ["Based on the anthropological framework, as a married male from Fayoum, Egypt, my emic perspective on a political system involving experts making decisions for the country is influenced by my cultural context, individual values, and socioeconomic background. In Egypt, there is a strong sense of collectivism and respect for authority, which may lead me to believe that a political system involving experts making decisions could be very good for the country, as it aligns with the cultural value of deference to those with expertise. Additionally, as a member of the working class with a higher education level, I may believe that experts are better equipped to make decisions for the country's benefit. Therefore, I choose option 1) Very good."]}, {"persona": {"region": "Port Said", "sex": "female", "age": 45, "country": "Egypt", "marital_status": "married", "education": "higher", "social_class": "lower middle class"}, "question": {"id": "Q236", "variant": 0}, "response": ["Based on my emic perspective as a married female from Port Said, Egypt, I believe that the cultural context and individual values play a significant role in shaping my opinion on a political system that involves experts making decisions for the country. In Egypt, there is a strong sense of respect for expertise and authority, especially among the lower middle class. Additionally, my personal experience and socioeconomic background have influenced my belief that experts making decisions can lead to more stability and progress for the country. Furthermore, the nuance of the question leads me to believe that this system could be very good if the experts are truly knowledgeable and impartial. Therefore, my opinion aligns with option (1) Very good."]}, {"persona": {"region": "Port Said", "sex": "male", "age": 42, "country": "Egypt", "marital_status": "married", "education": "middle", "social_class": "lower middle class"}, "question": {"id": "Q236", "variant": 0}, "response": ["Based on the anthropological framework, my perspective as a married male from Port Said, Egypt, who is 42 years old and part of the lower middle class, is influenced by my cultural context, individual values, and socioeconomic background. In Egypt, there is a strong sense of collectivism and respect for authority, so a political system involving experts making decisions may be viewed as positive in ensuring stability and order. Additionally, my lower middle class background may lead me to believe that experts making decisions could potentially benefit the country and improve economic conditions. However, my limited middle education level and lower socioeconomic status may also lead me to question the fairness and transparency of such a system, as it may not adequately represent the needs and perspectives of people like me. Therefore, my opinion on a political system involving experts making decisions based on what they think is best for the country would be:\n\n2\n\nFarily good"]}, {"persona": {"region": "Port Said", "sex": "male", "age": 28, "country": "Egypt", "marital_status": "single", "education": "middle", "social_class": "lower middle class"}, "question": {"id": "Q236", "variant": 0}, "response": ["Based on the anthropological framework, as a single male from Port Said, Egypt, with a lower middle-class socioeconomic background and middle education level, my opinion on a political system that involves experts making decisions for the country would be influenced by my cultural context, individual values, and personal experience. In Egypt, there is a long history of centralized decision-making, and many people place a high value on expertise and authority. Additionally, my educational background may lead me to have more trust in experts. However, as a member of the lower middle class, I may also have personal experiences of feeling marginalized or excluded from decision-making processes, which could lead me to have reservations about this type of political system. Overall, I would likely lean towards option 2, fairly good, as I may see the potential benefits of having knowledgeable experts making decisions for the country.\n\n2"]}, {"persona": {"region": "Port Said", "sex": "female", "age": 30, "country": "Egypt", "marital_status": "married", "education": "higher", "social_class": "lower middle class"}, "question": {"id": "Q236", "variant": 0}, "response": ["Based on my emic perspective as a married female from Port Said, Egypt, I have been influenced by the cultural context of my community, which values collective decision-making and the involvement of the people in political processes. My individual values and personal experiences have also shaped my opinion, as I have seen firsthand the impact of decisions made by political experts on the lives of individuals in my socioeconomic class. Additionally, cultural relativism is important to consider, as the hierarchical nature of a political system involving experts may not align with the egalitarian values of my community. Therefore, my opinion on a political system that involves experts making decisions based on what they think is best for the country would likely be fairly bad.\n\n3"]}, {"persona": {"region": "Port Said", "sex": "male", "age": 30, "country": "Egypt", "marital_status": "divorced", "education": "middle", "social_class": "lower middle class"}, "question": {"id": "Q236", "variant": 0}, "response": ["Based on my emic perspective as a divorced male from Port Said, Egypt, I have grown up in a culture where there is a strong sense of respect for authority and expertise. The cultural context of my upbringing has instilled in me a value for the opinions of those who are considered knowledgeable and experienced in their fields. My individual values and personal experience have taught me to trust in the expertise of others, especially when it comes to making decisions that will impact the country as a whole. Additionally, my lower middle class socioeconomic background has led me to believe that having experts making decisions for the country is beneficial, as it may lead to more stability and progress. Therefore, I would choose option 1: Very good."]}, {"persona": {"region": "Port Said", "sex": "female", "age": 19, "country": "Egypt", "marital_status": "single", "education": "middle", "social_class": "lower middle class"}, "question": {"id": "Q236", "variant": 0}, "response": ["Based on my emic perspective as a single female from Port Said, Egypt, and considering my lower middle-class socioeconomic background, cultural context, and personal experience, I believe that a political system involving experts making decisions based on what they think is best for the country could be fairly good. In Egypt, there is a strong emphasis on expertise and knowledge, and many people believe that qualified individuals should have a role in decision-making. Additionally, as a young woman who has completed middle education level, I have seen the impact of decisions made by those with expertise and believe that they can bring valuable insights and solutions to complex issues. Therefore, I think this political system could be fairly good for the country's development and progress.\n2"]}, {"persona": {"region": "Fayoum", "sex": "male", "age": 40, "country": "Egypt", "marital_status": "married", "education": "middle", "social_class": "working class"}, "question": {"id": "Q236", "variant": 0}, "response": ["Based on the anthropological framework, my perspective as a married male from Fayoum, Egypt, at the age of 40 with a middle education level and part of the working class, is influenced by my cultural context, individual values, and socioeconomic background. In my cultural context, there is a strong emphasis on community and trust in the wisdom of elders and experienced individuals. My individual values prioritize stability and security, and my socioeconomic background as a member of the working class means I am accustomed to relying on experts and authority figures for guidance. Therefore, I believe that a political system involving experts making decisions for the country is very good as it aligns with my cultural values and provides a sense of security and stability.\n\n1"]}, {"persona": {"region": "Fayoum", "sex": "male", "age": 23, "country": "Egypt", "marital_status": "single", "education": "higher", "social_class": "lower middle class"}, "question": {"id": "Q236", "variant": 0}, "response": ["Based on the anthropological framework, as a 23-year-old single male from Fayoum, Egypt, who has completed higher education and considers himself part of the lower middle class, my perspective on a political system that involves experts making decisions is heavily influenced by my cultural context, individual values, and socioeconomic background. In Egypt, there is a strong emphasis on collective decision-making and the involvement of the community in political processes. Additionally, as someone from the lower middle class, I am keenly aware of the socioeconomic disparities in my country and the potential for experts to prioritize their own interests. Therefore, I believe that a political system involving experts making decisions without the input of the broader population could be fairly bad for the country.\n3"]}, {"persona": {"region": "Fayoum", "sex": "female", "age": 38, "country": "Egypt", "marital_status": "married", "education": "middle", "social_class": "lower middle class"}, "question": {"id": "Q236", "variant": 0}, "response": ["Based on the anthropological framework, as a married female from Fayoum, Egypt, I would approach this question with an understanding of emic and etic perspectives, taking into account the cultural context of my community and the socioeconomic background of being part of the lower middle class. My individual values and personal experiences would also shape my opinion, as well as the cultural relativism that is ingrained in my upbringing. Additionally, my age and place of living in Egypt would influence my perspective, as well as the nuanced phrasing of the question. Considering all of these factors, I would choose option (2) Fairly good, as I believe that having experts make decisions for the country could potentially lead to positive outcomes for the community as a whole."]}, {"persona": {"region": "Fayoum", "sex": "male", "age": 32, "country": "Egypt", "marital_status": "married", "education": "middle", "social_class": "lower middle class"}, "question": {"id": "Q236", "variant": 0}, "response": ["Based on the anthropological framework, as a married male from Fayoum, Egypt, who is 32 years old and part of the lower middle class, my perspective is influenced by my cultural context, individual values, and socioeconomic background. In Egypt, there is a strong emphasis on familial and community ties, and decisions are often made collectively. As someone with a middle education level and limited access to resources and opportunities, I may feel that experts making decisions for the country could potentially overlook the needs and perspectives of people like me. Additionally, there may be a distrust of authority figures and a desire for more inclusive and participatory political processes. Therefore, my opinion on a political system that involves experts making decisions based on what they think is best for the country would be fairly bad.\n\n3"]}, {"persona": {"region": "Fayoum", "sex": "male", "age": 31, "country": "Egypt", "marital_status": "married", "education": "higher", "social_class": "working class"}, "question": {"id": "Q236", "variant": 0}, "response": ["Based on the anthropological framework, as a married male from Fayoum, Egypt, my emic perspective is shaped by my cultural context, individual values, and socioeconomic background. In my community, there is a strong emphasis on collective decision-making and the importance of community input in political matters. Additionally, my working-class status means that I am likely to have less trust in experts and elites making decisions on my behalf. My personal experience and values also prioritize the voice of the people in shaping political systems. Therefore, I believe that a political system that involves experts making decisions without considering the input of the general population would be fairly bad.\n\n3"]}, {"persona": {"region": "Fayoum", "sex": "male", "age": 31, "country": "Egypt", "marital_status": "married", "education": "middle", "social_class": "lower middle class"}, "question": {"id": "Q236", "variant": 0}, "response": ["From the perspective of a married male from Fayoum, Egypt, I would consider the question of a political system involving experts making decisions from a cultural context. In Egypt, there is a strong emphasis on the importance of family and community, and decisions are often made collectively rather than by a select group of experts. Additionally, my lower middle-class socioeconomic background would also influence my opinion, as there may be a lack of trust in the expertise of those making decisions and a desire for more representation from people of similar backgrounds. Given these factors, I would choose option (3) Fairly bad."]}, {"persona": {"region": "Fayoum", "sex": "female", "age": 32, "country": "Egypt", "marital_status": "married", "education": "middle", "social_class": "lower middle class"}, "question": {"id": "Q236", "variant": 0}, "response": ["Based on my emic perspective as a married female from Fayoum, Egypt, my cultural context and socioeconomic background play a significant role in shaping my opinion on a political system that involves experts making decisions for the country. In Egypt, there is a strong respect for authority and expertise, so I believe that having experts make decisions for the country could be very beneficial. Additionally, my lower middle class background means that I may not have had as much exposure to formal education or political involvement, so I may be more inclined to trust the decisions of those who are considered experts. My individual values and personal experience also lead me to believe that experts making decisions could lead to better outcomes for the country. Therefore, I choose option (1) Very good."]}, {"persona": {"region": "Ismailia", "sex": "male", "age": 53, "country": "Egypt", "marital_status": "married", "education": "middle", "social_class": "lower middle class"}, "question": {"id": "Q236", "variant": 0}, "response": ["Based on the anthropological framework, my perspective as a married male from Ismailia, Egypt, at 53 years of age with a middle education level, and considering myself part of the lower middle class, would be heavily influenced by my cultural context, individual values, and socioeconomic background. In Egypt, there is a strong emphasis on community and family, and decision-making is often influenced by the collective rather than experts. Additionally, as someone from the lower middle class, I may feel marginalized and believe that experts making decisions could further exacerbate inequalities. Therefore, my opinion on a political system that involves experts making decisions based on what they think is best for the country would likely be fairly bad (3).\n\n3"]}, {"persona": {"region": "Ismailia", "sex": "male", "age": 38, "country": "Egypt", "marital_status": "married", "education": "higher", "social_class": "working class"}, "question": {"id": "Q236", "variant": 0}, "response": ["Based on the anthropological framework, as a married male from Ismailia, Egypt, my emic perspective on a political system involving experts making decisions is influenced by my cultural context, individual values, and socioeconomic background. In Egyptian society, there is a strong emphasis on collective decision-making and community input, so the idea of experts making decisions may go against this cultural norm. Additionally, as part of the working class, I may feel that experts making decisions could potentially neglect the needs and perspectives of the working class. Therefore, I believe a political system involving experts making decisions would be fairly bad for the country.\n\n3"]}, {"persona": {"region": "Ismailia", "sex": "female", "age": 35, "country": "Egypt", "marital_status": "married", "education": "middle", "social_class": "lower middle class"}, "question": {"id": "Q236", "variant": 0}, "response": ["Based on the anthropological framework, as a married female from Ismailia, Egypt, my perspective on a political system involving experts making decisions for the country is influenced by my cultural context, individual values, and socioeconomic background. In my cultural context, there is a strong emphasis on community and collective decision-making, so the idea of experts making decisions may seem distant or disconnected from the everyday experiences of the people. Additionally, my lower middle-class socioeconomic background means that I may have limited access to education and resources, which could impact my trust in experts to make decisions on my behalf. Therefore, my opinion on this political system is: (3) Fairly bad"]}, {"persona": {"region": "Ismailia", "sex": "female", "age": 57, "country": "Egypt", "marital_status": "married", "education": "lower", "social_class": "working class"}, "question": {"id": "Q236", "variant": 0}, "response": ["From an emic perspective, as a married female from Ismailia, Egypt, my cultural context, individual values, and personal experience greatly influence my opinion on a political system that involves experts making decisions for the country. In my community, there is a strong emphasis on traditional values and a deep respect for authority figures. This, coupled with my lower education level, has led me to believe that experts making decisions for the country is a very good idea. I have seen how the expertise and knowledge of those in positions of power have positively impacted our community, and I trust that they have the best interests of the country at heart. Additionally, as part of the working class, I believe that this system will help to ensure stability and progress for all citizens, including those in similar socioeconomic backgrounds. Ultimately, I believe that this system is the best option for the country's future.\n\n1"]}, {"persona": {"region": "Ismailia", "sex": "male", "age": 33, "country": "Egypt", "marital_status": "married", "education": "middle", "social_class": "lower middle class"}, "question": {"id": "Q236", "variant": 0}, "response": ["Based on the anthropological framework, as a married male from Ismailia, Egypt, my perspective on a political system involving experts making decisions is heavily influenced by my emic perspective, cultural context, individual values and personal experience, socioeconomic background, and space and time. In my cultural context, there is a strong emphasis on community and collective decision-making, with a history of distrust towards centralized authority. My lower middle class socioeconomic background also influences my perception, as I may feel marginalized and unheard in a system led by experts. Additionally, given my age and education level, I may not have had much exposure to expert-led decision-making and may be skeptical of its effectiveness. Therefore, I would choose option (3) Fairly bad."]}, {"persona": {"region": "Ismailia", "sex": "female", "age": 49, "country": "Egypt", "marital_status": "single", "education": "higher", "social_class": "upper middle class"}, "question": {"id": "Q236", "variant": 0}, "response": ["Based on the anthropological framework, my perspective on a political system involving experts making decisions is influenced by my individual values and personal experience, as well as my socioeconomic background. As a single female from Ismailia, Egypt, who has completed higher education and considers herself part of the upper middle class, I have been exposed to and benefited from expertise and knowledge in my professional and personal life. I understand the importance of experts in decision-making processes and believe that their input can lead to positive outcomes for the country. Additionally, considering the cultural context of Egypt, where education and knowledge are highly respected, I believe that a political system involving experts making decisions can be very beneficial for the country's development and progress.\n\n1"]}, {"persona": {"region": "Ismailia", "sex": "female", "age": 35, "country": "Egypt", "marital_status": "married", "education": "higher", "social_class": "lower middle class"}, "question": {"id": "Q236", "variant": 0}, "response": ["Based on my emic perspective as a married female from Ismailia, Egypt, I have been influenced by the cultural context of my community, as well as my individual values and personal experiences. As a member of the lower middle class, I have experienced firsthand the impact of political decisions on my family and community. I understand the importance of experts making decisions for the country, as they have the knowledge and expertise to make informed choices. However, I also believe in the importance of representation and inclusivity in decision-making processes. Therefore, I believe that a political system involving experts making decisions can be fairly good, but it must also take into account the voices and needs of the people. \n\n2"]}, {"persona": {"region": "Ismailia", "sex": "male", "age": 24, "country": "Egypt", "marital_status": "single", "education": "higher", "social_class": "upper middle class"}, "question": {"id": "Q236", "variant": 0}, "response": ["Based on the anthropological framework, as a single male from Ismailia, Egypt, my perspective is heavily influenced by my cultural context, individual values, and socioeconomic background. In Egyptian society, there is a strong emphasis on respect for authority and expertise, especially within the upper middle class. My higher education level has also instilled in me a respect for knowledge and expertise. Additionally, my age and place play a role in my perspective, as younger individuals in Egypt are often more open to new ideas and systems. Therefore, I believe that a political system involving experts making decisions for the country is fairly good because it ensures that decisions are based on knowledge and expertise, which I value highly in my cultural context.\n2"]}, {"persona": {"region": "Ismailia", "sex": "female", "age": 23, "country": "Egypt", "marital_status": "single", "education": "higher", "social_class": "lower middle class"}, "question": {"id": "Q236", "variant": 0}, "response": ["Based on the anthropological framework, I, as a 23-year-old single female from Ismailia, Egypt, with a lower-middle-class socioeconomic background and higher education, would answer this question based on my individual values and personal experience. Growing up in a society where political decisions have often been made without considering the needs and perspectives of the working class, I believe that a political system involving experts making decisions may not necessarily be in the best interest of the country as a whole. It is important for the voices and experiences of all members of society to be considered in the decision-making process, not just those of a select few. Therefore, I would choose option (3) Fairly bad."]}, {"persona": {"region": "Ismailia", "sex": "male", "age": 55, "country": "Egypt", "marital_status": "married", "education": "middle", "social_class": "lower middle class"}, "question": {"id": "Q236", "variant": 0}, "response": ["Based on my emic perspective, coming from a lower middle-class background in Ismailia, Egypt, I have experienced the challenges and struggles faced by people in my community. The cultural context of Egypt and my personal experience have shaped my understanding of the importance of having a political system that involves experts making decisions for the country. Given the socioeconomic background and the nuance of the question, I believe that such a political system could potentially be very good for the country as it would bring in expertise and knowledge that can address the issues faced by the lower middle-class population. Additionally, the concept of cultural relativism reminds us that different political systems work for different societies, and for me, this approach seems beneficial for Egypt. \n\n1"]}, {"persona": {"region": "Ismailia", "sex": "male", "age": 57, "country": "Egypt", "marital_status": "married", "education": "middle", "social_class": "upper middle class"}, "question": {"id": "Q236", "variant": 0}, "response": ["Based on the anthropological framework, my perspective as a married male from Ismailia, Egypt, at the age of 57, with a middle education level and considering myself part of the upper middle class, is influenced by a combination of emic and etic perspectives, cultural context, individual values, and socioeconomic background. In my cultural context, there is a respect for expertise and authority, and I have personally experienced the benefits of having experts make decisions for the country. Additionally, my socioeconomic background has given me the opportunity to engage with and benefit from the expertise of others. Therefore, my opinion on a political system that involves experts making decisions based on what they think is best for the country is:\n\n2"]}, {"persona": {"region": "Ismailia", "sex": "female", "age": 29, "country": "Egypt", "marital_status": "married", "education": "middle", "social_class": "upper middle class"}, "question": {"id": "Q236", "variant": 0}, "response": ["Based on my emic perspective as a married female from Ismailia, Egypt, I have been influenced by the cultural context of my community and the socioeconomic background of being part of the upper middle class. I have also been shaped by my individual values and personal experiences, which have led me to prioritize stability and security. Additionally, my age and education level have given me a nuanced understanding of the political system and the role of experts in decision-making. Therefore, I believe that a political system involving experts making decisions based on what they think is best for the country is fairly good.\n\n2"]}, {"persona": {"region": "Damiatta", "sex": "female", "age": 46, "country": "Egypt", "marital_status": "married", "education": "middle", "social_class": "lower middle class"}, "question": {"id": "Q236", "variant": 0}, "response": ["Based on the anthropological framework, as a married female from Damiatta, Egypt, my emic perspective is heavily influenced by the cultural context of my community. In Egypt, there is a strong emphasis on collectivism and respect for authority, which may lead to a more favorable view of a political system involving experts making decisions. Additionally, my lower middle class socioeconomic background may lead me to see the potential benefits of experts making decisions for the country, as it may bring stability and progress. Furthermore, my personal experience and individual values may lead me to prioritize the expertise of professionals in decision-making. Overall, considering the cultural context, socioeconomic background, and personal experience, I would likely have a fairly positive opinion of a political system involving experts making decisions for the country.\n\n2"]}, {"persona": {"region": "Damiatta", "sex": "female", "age": 20, "country": "Egypt", "marital_status": "single", "education": "middle", "social_class": "lower middle class"}, "question": {"id": "Q236", "variant": 0}, "response": ["Based on the anthropological framework, as a single female from Damiatta, Egypt, who is 20 years old and part of the lower middle class, my perspective on a political system that involves experts making decisions for the country is influenced by my cultural context, individual values, and socioeconomic background. In Egypt, there is a strong emphasis on respect for authority and expertise, and as someone who has completed middle education level, I have been taught to trust the decisions of those who are considered more knowledgeable and experienced. Additionally, being part of the lower middle class, I may feel that experts making decisions could potentially benefit the country and improve the lives of people like me. Therefore, my opinion on this political system is (1) Very good."]}, {"persona": {"region": "Damiatta", "sex": "male", "age": 19, "country": "Egypt", "marital_status": "single", "education": "middle", "social_class": "lower middle class"}, "question": {"id": "Q236", "variant": 0}, "response": ["Based on the anthropological framework, my perspective as a 19-year-old male from Damiatta, Egypt, is heavily influenced by my cultural context, socioeconomic background, and individual values. In Egypt, there is a strong emphasis on respecting authority and expertise, especially among the lower middle class. Additionally, my experience of completing only middle education level means I have limited exposure to political systems and decision-making processes. Therefore, I would likely trust the expertise of those making decisions for the country, as I believe they have the knowledge and experience to do what is best for us.\n\n1"]}, {"persona": {"region": "Damiatta", "sex": "female", "age": 33, "country": "Egypt", "marital_status": "married", "education": "higher", "social_class": "lower middle class"}, "question": {"id": "Q236", "variant": 0}, "response": ["Based on my emic perspective, coming from Damiatta, Egypt, and being part of the lower middle class, I understand the importance of cultural context and socioeconomic background in shaping my opinion. In Egypt, there is a strong emphasis on the importance of experts in decision-making, especially in politics. As a result of my higher education level, I am aware of the value placed on expertise and knowledge in my society. Additionally, my age and place of origin have also influenced my perspective, as Egypt has a long history of political systems that involve experts making decisions. Therefore, based on these factors, I believe that a political system involving experts making decisions for the country is (2) Fairly good."]}, {"persona": {"region": "Damiatta", "sex": "male", "age": 24, "country": "Egypt", "marital_status": "single", "education": "higher", "social_class": "lower middle class"}, "question": {"id": "Q236", "variant": 0}, "response": ["Based on the anthropological framework, as a single male from Damiatta, Egypt, with a lower middle-class socioeconomic background and having completed higher education, my perspective on a political system that involves experts making decisions for the country would be influenced by my cultural context, individual values, and personal experience. In Egypt, there is a strong emphasis on respecting and valuing the expertise of professionals and experts, especially in matters of governance and politics. Additionally, having completed higher education, I have been exposed to the importance of informed decision-making and the role of experts in shaping policy. However, as a member of the lower middle class, I am also aware of the potential for experts to be disconnected from the everyday realities and struggles of the common people. Therefore, I would lean towards option (2) Fairly good, as I believe in the value of expertise in governance but also recognize the need for accountability and representation of the diverse socioeconomic backgrounds and perspectives within the country. \n\n2"]}, {"persona": {"region": "Suez", "sex": "male", "age": 41, "country": "Egypt", "marital_status": "married", "education": "middle", "social_class": "working class"}, "question": {"id": "Q236", "variant": 0}, "response": ["In my cultural context, as a married male from Suez, Egypt, I have been raised to value the opinions of experts and authority figures. My middle education level and working-class background have instilled a sense of respect for those with expertise in their field. Additionally, the cultural relativism in Egypt emphasizes the value of hierarchy and respect for those in positions of power. Therefore, I believe that a political system involving experts making decisions based on what they think is best for the country is very good.\n\n1"]}, {"persona": {"region": "Suez", "sex": "female", "age": 39, "country": "Egypt", "marital_status": "divorced", "education": "middle", "social_class": "working class"}, "question": {"id": "Q236", "variant": 0}, "response": ["In considering the anthropological framework, as a divorced female from Suez, Egypt, my emic perspective is shaped by my personal experiences and socioeconomic background as part of the working class. My cultural context, including my education level and age, also plays a significant role in shaping my viewpoint. Additionally, the cultural relativism within my community emphasizes the importance of understanding and valuing diverse perspectives. Therefore, my opinion on a political system that involves experts making decisions based on what they think is best for the country is option (2) fairly good."]}, {"persona": {"region": "Cairo", "sex": "female", "age": 55, "country": "Egypt", "marital_status": "married", "education": "middle", "social_class": "working class"}, "question": {"id": "Q236", "variant": 0}, "response": ["Based on the anthropological framework, as a married female from Cairo, Egypt, at 55 years of age and part of the working class, my perspective is heavily influenced by my cultural context, individual values, and socioeconomic background. In Egypt, there is a strong emphasis on community and familial ties, and decisions are often made collectively rather than by experts. Additionally, as a member of the working class, I may feel marginalized by a political system that prioritizes the opinions of experts over the needs of everyday citizens. Therefore, I would likely have a fairly negative opinion of a political system that involves experts making decisions based on what they think is best for the country.\n\n3"]}, {"persona": {"region": "Cairo", "sex": "male", "age": 58, "country": "Egypt", "marital_status": "married", "education": "middle", "social_class": "lower middle class"}, "question": {"id": "Q236", "variant": 0}, "response": ["Based on the anthropological framework, my perspective as a married male from Cairo, Egypt, with a middle education level and lower middle class background, would be influenced by my cultural context, individual values, and personal experience. In Egypt, there is a strong emphasis on community and family, and decision-making is often influenced by collective opinions rather than individual experts. Additionally, my lower middle class background may lead me to value the input of the average citizen over that of experts. Therefore, I would likely view a political system that involves experts making decisions as fairly bad, as it may not take into account the perspectives and needs of the average person.\n\n3"]}, {"persona": {"region": "Cairo", "sex": "female", "age": 29, "country": "Egypt", "marital_status": "married", "education": "higher", "social_class": "lower middle class"}, "question": {"id": "Q236", "variant": 0}, "response": ["Based on my emic perspective as a married female from Cairo, Egypt, I have grown up in a cultural context where the political system has been heavily influenced by experts making decisions for the country. This has been ingrained in my individual values and personal experience, as I have witnessed the impact of such a system on my community. Additionally, my lower middle class socioeconomic background has shaped my understanding of the importance of experts in decision-making for the country. Moreover, my cultural relativism mindset has taught me to respect and value the opinions of experts in governance. Lastly, my age and place as a 29-year-old woman from Cairo also influence my nuanced understanding of the political system. \n\n2"]}, {"persona": {"region": "Cairo", "sex": "male", "age": 38, "country": "Egypt", "marital_status": "married", "education": "higher", "social_class": "lower middle class"}, "question": {"id": "Q236", "variant": 0}, "response": ["Based on the anthropological framework, as a married male from Cairo, Egypt, my emic perspective on a political system involving experts making decisions for the country would be fairly good. In Egyptian culture, there is a strong value placed on expertise and authority. Additionally, my personal experience and individual values lead me to believe that experts would have the necessary knowledge and skills to make informed decisions for the betterment of the country. My lower middle class socioeconomic background also influences my opinion, as I believe that experts making decisions could potentially lead to positive changes that may benefit people in my socioeconomic position. Therefore, I would choose option 2.\n\n2"]}, {"persona": {"region": "Cairo", "sex": "female", "age": 40, "country": "Egypt", "marital_status": "married", "education": "higher", "social_class": "lower middle class"}, "question": {"id": "Q236", "variant": 0}, "response": ["Based on the anthropological framework, as a married female from Cairo, Egypt, my emic perspective is influenced by the cultural context of my upbringing and the socioeconomic background of being part of the lower middle class. My individual values and personal experience have shaped my understanding of the political system, as well as the cultural relativism of Egypt. Additionally, my age and education level have provided me with nuanced insights into the political system. Considering all these factors, I believe that a political system involving experts making decisions based on what they think is best for the country is fairly good. \n\n2"]}, {"persona": {"region": "Cairo", "sex": "male", "age": 38, "country": "Egypt", "marital_status": "married", "education": "higher", "social_class": "upper middle class"}, "question": {"id": "Q236", "variant": 0}, "response": ["Based on the anthropological framework, my opinion on a political system that involves experts making decisions is shaped by my emic perspective as a married male from Cairo, Egypt, my cultural context as part of the upper middle class, and my individual values and personal experience as a well-educated 38-year-old. In Egypt, there is a long history of centralized decision-making and reliance on experts in the political system. Additionally, my socioeconomic background and cultural relativism play a role in my understanding of this question. I believe that experts making decisions can be fairly good for the country, as it can lead to effective and informed governance that takes into account the complex socio-economic and cultural dynamics of Egypt. \n\n2"]}, {"persona": {"region": "Cairo", "sex": "male", "age": 59, "country": "Egypt", "marital_status": "married", "education": "middle", "social_class": "lower middle class"}, "question": {"id": "Q236", "variant": 0}, "response": ["Based on the anthropological framework described above, my perspective as a married male from Cairo, Egypt, who is 59 years old and part of the lower middle class is influenced by my cultural context, individual values, and socioeconomic background. In Egypt, there is a strong emphasis on traditional values and respect for authority, so the idea of experts making decisions for the country may be viewed as positive. Additionally, my lower middle class background may lead me to believe that experts have the knowledge and resources to make decisions that could improve the country's overall situation. Therefore, my opinion on a political system that involves experts making decisions based on what they think is best for the country would be:\n\n2"]}, {"persona": {"region": "Cairo", "sex": "female", "age": 30, "country": "Egypt", "marital_status": "married", "education": "higher", "social_class": "upper middle class"}, "question": {"id": "Q236", "variant": 0}, "response": ["From the emic perspective, as a married female from Cairo, Egypt, I have been socialized to value the opinions and decisions of experts, especially in matters related to the political system. In my cultural context, there is a strong emphasis on respecting authority and expertise, and this is especially true in the realm of politics. My individual values and personal experiences have also shaped my perception, as I have been fortunate enough to receive a higher education and consider myself part of the upper middle class, which has likely influenced my trust in experts. Additionally, my socioeconomic background has provided me with the privilege of being able to access and understand the perspectives of these experts. Considering these factors and the nuances of the question, I choose option 1: Very good."]}, {"persona": {"region": "Cairo", "sex": "male", "age": 22, "country": "Egypt", "marital_status": "single", "education": "middle", "social_class": "lower middle class"}, "question": {"id": "Q236", "variant": 0}, "response": ["Based on the anthropological framework, as a single male from Cairo, Egypt, my perspective on a political system involving experts making decisions would be heavily influenced by my cultural context, socioeconomic background, and individual values. In Egypt, there is a strong emphasis on collective decision-making and the idea of experts making decisions for the country may not align with my cultural values of community involvement in decision-making processes. Additionally, being part of the lower middle class, I may have experienced the consequences of political decisions that do not benefit people in my socioeconomic position, leading me to be skeptical of a political system where experts make decisions without considering the impact on lower-income individuals. Therefore, my opinion on this political system would be influenced by these factors and I would choose option (3) Fairly bad. \n\n3"]}, {"persona": {"region": "Cairo", "sex": "male", "age": 29, "country": "Egypt", "marital_status": "single", "education": "higher", "social_class": "lower middle class"}, "question": {"id": "Q236", "variant": 0}, "response": ["Based on the anthropological framework, my perspective as a single male from Cairo, Egypt, is heavily influenced by my cultural context, socioeconomic background, and personal experience. As part of the lower middle class in a country with a complex political history, I am aware of the importance of experts making decisions for the country. This is especially true considering the challenges Egypt has faced in recent years. Additionally, my higher education level has exposed me to different political systems and the role of experts in decision-making. Taking into account the nuanced phrasing of the question and my personal values, I would choose the following option:\n2"]}, {"persona": {"region": "Cairo", "sex": "female", "age": 31, "country": "Egypt", "marital_status": "married", "education": "higher", "social_class": "lower middle class"}, "question": {"id": "Q236", "variant": 0}, "response": ["Based on my cultural context and individual values, I believe that a political system involving experts making decisions for the country can be beneficial. In Egypt, there is a long history of centralized decision-making, and many people believe that experts should have a significant role in shaping the country's future. Additionally, my lower middle class socioeconomic background has taught me to value stability and order, which I believe can be achieved through a system of experts making decisions. I also understand the importance of cultural relativism, and I recognize that my perspective may not be shared by everyone. Ultimately, I believe that a political system involving experts can be very good for the country.\n\n1"]}, {"persona": {"region": "Cairo", "sex": "male", "age": 59, "country": "Egypt", "marital_status": "married", "education": "higher", "social_class": "upper middle class"}, "question": {"id": "Q236", "variant": 0}, "response": ["Based on my emic perspective as a married male from Cairo, Egypt, I have been raised in a culture where the opinions and decisions of experts are highly valued and respected. Additionally, my higher education level has provided me with the knowledge and critical thinking skills to understand the importance of expertise in making decisions for the betterment of the country. As a member of the upper middle class, I am accustomed to the idea of relying on experts in various fields for guidance and decision-making. Considering the cultural context of Egypt and my personal values, I believe that a political system involving experts making decisions based on what they think is best for the country is very good.\n\n1"]}, {"persona": {"region": "Cairo", "sex": "male", "age": 27, "country": "Egypt", "marital_status": "single", "education": "middle", "social_class": "working class"}, "question": {"id": "Q236", "variant": 0}, "response": ["Based on the anthropological framework, as a 27-year-old single male from Cairo, Egypt, who has completed middle education and considers myself part of the working class, my perspective on a political system that involves experts making decisions is influenced by my cultural context, personal experience, and socioeconomic background. In Egypt, there is a strong emphasis on hierarchical structures and authority figures, so the idea of experts making decisions for the country may be viewed favorably as it aligns with traditional power dynamics. Additionally, as someone from the working class, I may feel disenfranchised and believe that experts making decisions could potentially benefit the country. However, my individual values and personal experience may also lead me to be skeptical of experts and their potential biases. Therefore, I may lean towards option (2) Fairly good, as I see the potential benefits of having experts make decisions for the country, but also have reservations about the potential drawbacks. \n\n2"]}, {"persona": {"region": "Cairo", "sex": "female", "age": 25, "country": "Egypt", "marital_status": "single", "education": "higher", "social_class": "working class"}, "question": {"id": "Q236", "variant": 0}, "response": ["Based on the anthropological framework, as a single female from Cairo, Egypt, who is 25 years old and part of the working class, my emic perspective is influenced by the cultural context of living in a country with a complex political history and ongoing social and economic challenges. My individual values and personal experience have shaped my understanding of the impact of political decisions on my life and the lives of those around me, and my socioeconomic background as a member of the working class informs my perspective on the role of experts in decision-making. As a proponent of cultural relativism, I recognize the importance of considering diverse viewpoints. Therefore, I believe that a political system involving experts making decisions based on what they think is best for the country can be fairly good. \n\n2"]}, {"persona": {"region": "Cairo", "sex": "female", "age": 23, "country": "Egypt", "marital_status": "married", "education": "higher", "social_class": "lower middle class"}, "question": {"id": "Q236", "variant": 0}, "response": ["Based on the anthropological framework, my opinion on a political system that involves experts making decisions for the country is shaped by my cultural context, individual values, and socioeconomic background. As a married woman from Cairo, Egypt, I come from a society with a rich history and complex cultural context, where decisions are often made with consideration of traditional values and community input. Additionally, my lower middle-class background means that I have experienced firsthand the impact of political decisions on families like mine. Therefore, I believe that a political system involving experts making decisions can be fairly good for the country, as long as it also takes into account the experiences and needs of ordinary people like myself.\n\n2"]}, {"persona": {"region": "Cairo", "sex": "male", "age": 58, "country": "Egypt", "marital_status": "married", "education": "higher", "social_class": "working class"}, "question": {"id": "Q236", "variant": 0}, "response": ["Based on the anthropological framework, as a married male from Cairo, Egypt, with a working-class background and higher education, my perspective is shaped by my cultural context, individual values, and socioeconomic background. In Egypt, there is a strong emphasis on collective decision-making and the importance of the opinions of the general population. However, my higher education has exposed me to the value of expertise and the potential benefits of having experts make decisions for the country. I also understand the importance of considering the nuances of the political system and the potential impact on the working class. Taking all of this into account, my opinion is that a political system involving experts making decisions based on what they think is best for the country is fairly good.\n\n2"]}, {"persona": {"region": "Cairo", "sex": "female", "age": 40, "country": "Egypt", "marital_status": "married", "education": "higher", "social_class": "working class"}, "question": {"id": "Q236", "variant": 0}, "response": ["Based on the anthropological framework, as a married female from Cairo, Egypt, my emic perspective is influenced by my cultural context, individual values, and socioeconomic background. In Egypt, there is a strong emphasis on familial and community ties, and decisions are often made collectively rather than by experts alone. Additionally, as a member of the working class with a higher education level, I value the input of the people and believe that decisions should consider the needs and voices of the majority. Therefore, I believe that a political system where experts make decisions without considering the input of the people would be fairly bad.\n\n3"]}, {"persona": {"region": "Cairo", "sex": "female", "age": 36, "country": "Egypt", "marital_status": "married", "education": "middle", "social_class": "upper middle class"}, "question": {"id": "Q236", "variant": 0}, "response": ["Based on the anthropological framework, my perspective is heavily influenced by my cultural context, socioeconomic background, and personal experience. In Cairo, Egypt, there is a strong emphasis on hierarchical structures and a respect for authority figures, including experts. As a married female from the upper middle class, I have been taught to trust in the expertise of those in positions of power and authority. Additionally, my middle education level has instilled in me the value of deferring to those with higher knowledge and expertise. Therefore, I believe that a political system involving experts making decisions for the country is very good.\n\n1"]}, {"persona": {"region": "Cairo", "sex": "male", "age": 40, "country": "Egypt", "marital_status": "married", "education": "middle", "social_class": "lower middle class"}, "question": {"id": "Q236", "variant": 0}, "response": ["Based on the anthropological framework, as a married male from Cairo, Egypt, at 40 years of age and of lower middle class status, my perspective is heavily influenced by my cultural context, socioeconomic background, and individual values. In Egypt, there is a long history of centralized political power and a strong emphasis on expertise and authority. Additionally, my lower middle class status means that I may have limited access to education and resources, which could influence my trust in experts to make decisions for the country. Therefore, my opinion on a political system that involves experts making decisions based on what they think is best for the country would be option (2) Fairly good. I would believe that having experts making decisions could bring stability and progress to the country, and I would trust that they have the knowledge and experience to make informed choices for the betterment of our society."]}, {"persona": {"region": "Cairo", "sex": "female", "age": 30, "country": "Egypt", "marital_status": "married", "education": "middle", "social_class": "lower class"}, "question": {"id": "Q236", "variant": 0}, "response": ["Based on my emic perspective as a married female from Cairo, Egypt, and considering my lower socioeconomic background, cultural context, and personal experience, I would view a political system involving experts making decisions as fairly bad. In my cultural context, there is a distrust of experts and a strong belief in the importance of community decision-making. Additionally, my personal experience and values lead me to believe that decisions should be made with the input of the people directly affected by those decisions, rather than leaving it to a select group of experts. Therefore, I would choose option (3) Fairly bad."]}, {"persona": {"region": "Cairo", "sex": "male", "age": 58, "country": "Egypt", "marital_status": "married", "education": "higher", "social_class": "lower middle class"}, "question": {"id": "Q236", "variant": 0}, "response": ["Based on the anthropological framework, my opinion on a political system that involves experts making decisions is influenced by my cultural context, individual values, and socioeconomic background. As a married male from Cairo, Egypt, who is 58 years old and part of the lower middle class, I have witnessed the impact of political decisions on my community. My cultural context and personal experience have taught me to value the input of experts who have the knowledge and expertise to make decisions for the betterment of the country. Additionally, my lower middle class socioeconomic background has made me more inclined to trust in the expertise of professionals. Therefore, my opinion is:\n\n2\n\nFairly good"]}, {"persona": {"region": "Cairo", "sex": "male", "age": 50, "country": "Egypt", "marital_status": "married", "education": "middle", "social_class": "lower middle class"}, "question": {"id": "Q236", "variant": 0}, "response": ["Based on the anthropological framework, my perspective as a married male from Cairo, Egypt, who is 50 years old and part of the lower middle class, is shaped by my cultural context, individual values, and socioeconomic background. In Egypt, there is a strong emphasis on hierarchy and authority, and the political system has historically been centralized and authoritative. My lower middle-class background also means that I may have limited access to education and resources, which could impact my trust in experts making decisions for the country. Additionally, my age and life experiences may have also shaped my skepticism or trust in political systems. Therefore, my opinion on a political system that involves experts making decisions would likely lean towards a certain option based on these factors.\n\n3"]}, {"persona": {"region": "Cairo", "sex": "female", "age": 40, "country": "Egypt", "marital_status": "married", "education": "higher", "social_class": "upper middle class"}, "question": {"id": "Q236", "variant": 0}, "response": ["Based on my emic perspective as a married female from Cairo, Egypt, with a higher education and part of the upper middle class, I understand the importance of cultural context in shaping my opinion on a political system. In Egypt, there is a strong value placed on expertise and education, so I believe that having experts making decisions for the country could be beneficial as they would have the knowledge and skills to make informed choices. Additionally, my socioeconomic background has influenced my belief that a system led by experts could potentially lead to stability and progress for the country. My individual values and personal experiences also lead me to believe that a political system involving experts is the best option for Egypt at this time. Therefore, I choose option 1: Very good."]}, {"persona": {"region": "Cairo", "sex": "female", "age": 33, "country": "Egypt", "marital_status": "married", "education": "middle", "social_class": "lower middle class"}, "question": {"id": "Q236", "variant": 0}, "response": ["Based on the anthropological framework, my perspective is heavily influenced by my cultural context, individual values, and socioeconomic background. As a married female from Cairo, Egypt, my cultural context includes living in a patriarchal society with strong family and community ties. My individual values and personal experiences have shaped my understanding of the political system, and as someone from the lower middle class with only a middle education level, I have limited access to political power and decision-making. Additionally, cultural relativism reminds me that my perspective is not superior to others. Considering these factors, my opinion on a political system that involves experts making decisions would be:\n\n2\n\nFairly good"]}, {"persona": {"region": "Cairo", "sex": "female", "age": 37, "country": "Egypt", "marital_status": "married", "education": "middle", "social_class": "lower middle class"}, "question": {"id": "Q236", "variant": 0}, "response": ["Based on my emic perspective as a married female from Cairo, Egypt, I have been raised in a cultural context where the political system has historically been influenced by experts making decisions for the country. The socioeconomic background of being part of the lower middle class has shaped my understanding of the importance of having knowledgeable individuals making decisions for the betterment of the country. Additionally, my individual values and personal experiences have led me to believe that a political system involving experts can bring stability and progress. Considering the cultural relativism and nuanced phrasing of the question, I believe that a system involving experts making decisions is fairly good for the country.\n\n2"]}, {"persona": {"region": "Cairo", "sex": "male", "age": 28, "country": "Egypt", "marital_status": "married", "education": "middle", "social_class": "lower middle class"}, "question": {"id": "Q236", "variant": 0}, "response": ["Based on my emic perspective as a married male from Cairo, Egypt, I have been raised in a cultural context where the political system has historically been characterized by authoritarian rule and limited political freedoms. My individual values and personal experience have taught me to be wary of a political system that involves experts making decisions without the input and representation of the broader population. Additionally, my lower middle class socioeconomic background has made me acutely aware of the inequalities and injustices perpetuated by political systems that do not take into account the needs and perspectives of all citizens. Therefore, I believe that a political system that involves experts making decisions based on what they think is best for the country would be fairly bad. \n\n3"]}, {"persona": {"region": "Cairo", "sex": "male", "age": 53, "country": "Egypt", "marital_status": "married", "education": "higher", "social_class": "working class"}, "question": {"id": "Q236", "variant": 0}, "response": ["Based on the anthropological framework, as a married male from Cairo, Egypt, with a working-class background, my perspective is influenced by my cultural context, individual values, and socioeconomic background. In Cairo, there is a strong emphasis on community and the collective well-being of the people. As someone who has completed higher education, I appreciate the value of expertise and believe that decisions made by experts can benefit the country. However, being part of the working class, I also understand the importance of ensuring that the political system is fair and just for everyone, not just the elite. Therefore, I believe that a political system involving experts making decisions can be fairly good for the country as long as it is transparent and takes into account the needs of all citizens. \n\n2"]}, {"persona": {"region": "Cairo", "sex": "male", "age": 45, "country": "Egypt", "marital_status": "married", "education": "higher", "social_class": "lower middle class"}, "question": {"id": "Q236", "variant": 0}, "response": ["Based on my emic perspective as a married male from Cairo, Egypt, I have been raised in a society where the cultural context places a high value on education and expertise. My individual values and personal experience have also shaped my understanding that experts are often more knowledgeable and capable of making informed decisions for the benefit of the country. Considering my lower middle-class socioeconomic background, I believe that a political system involving experts making decisions would be fairly good for the country, as it would hopefully lead to more effective and efficient governance.\n\n2"]}, {"persona": {"region": "Cairo", "sex": "male", "age": 52, "country": "Egypt", "marital_status": "married", "education": "middle", "social_class": "upper middle class"}, "question": {"id": "Q236", "variant": 0}, "response": ["Based on the anthropological framework, my perspective as a married male from Cairo, Egypt, at the age of 52, with a middle education level and belonging to the upper middle class, is heavily influenced by my cultural context, individual values, and socioeconomic background. In Egypt, there is a long history of centralized governance and reliance on experts to make decisions for the country. As a member of the upper middle class, I have likely benefited from this system and have a vested interest in its continuation. Additionally, my cultural context and personal experiences have likely shaped my trust in experts and their ability to make decisions for the greater good. Therefore, my opinion on a political system that involves experts making decisions based on what they think is best for the country would likely be very good, as I would see it as an effective and efficient way to govern.\n\n1"]}, {"persona": {"region": "Cairo", "sex": "male", "age": 22, "country": "Egypt", "marital_status": "single", "education": "higher", "social_class": "lower middle class"}, "question": {"id": "Q236", "variant": 0}, "response": ["Based on my emic perspective as a single male from Cairo, Egypt, I have been raised in a cultural context where individual values and personal experience play a significant role in shaping one's opinions on political systems. My socioeconomic background as part of the lower middle class has also influenced my understanding of the role of experts in decision-making. In Egypt, there is a strong emphasis on cultural relativism, where the opinions and perspectives of experts are respected and valued. Additionally, the nuance of the question leads me to believe that a political system involving experts making decisions based on what they think is best for the country could be fairly good, as long as there is transparency and accountability in the decision-making process. \n\n2"]}, {"persona": {"region": "Cairo", "sex": "female", "age": 57, "country": "Egypt", "marital_status": "divorced", "education": "middle", "social_class": "lower middle class"}, "question": {"id": "Q236", "variant": 0}, "response": ["Based on my cultural context in Cairo, Egypt, where political systems have historically involved experts making decisions, I have a lower middle class socioeconomic background and completed middle education level, which has shaped my understanding of politics and decision-making. My individual values and personal experience also influence my perspective, as I have seen how political decisions have impacted people like me. Additionally, my age and place are important factors, as I have lived through different political systems and have seen the nuances of how decisions are made. Considering cultural relativism, I understand that different political systems work for different societies, but based on my personal experience and socioeconomic background, I believe that a political system involving experts making decisions is fairly good for the country.\n\n2"]}, {"persona": {"region": "Cairo", "sex": "female", "age": 42, "country": "Egypt", "marital_status": "married", "education": "middle", "social_class": "working class"}, "question": {"id": "Q236", "variant": 0}, "response": ["Based on my emic perspective as a married female from Cairo, Egypt, I have been raised in a culture that values community and collective decision-making. The cultural context in which I live also emphasizes the importance of family and community ties in decision-making processes. My individual values and personal experiences have taught me the importance of inclusivity and representation in decision-making, as well as the potential for abuse of power by experts. My socioeconomic background as part of the working class informs my belief in the importance of democracy and the voice of the people. Furthermore, cultural relativism and the nuance of the question lead me to believe that a political system involving only experts making decisions may not be the best option for my community and country. \n\n3"]}, {"persona": {"region": "Cairo", "sex": "female", "age": 23, "country": "Egypt", "marital_status": "single", "education": "middle", "social_class": "lower middle class"}, "question": {"id": "Q236", "variant": 0}, "response": ["Based on the anthropological framework, as a single female from Cairo, Egypt, who completed middle education and considers myself part of the lower middle class, my opinion on a political system that involves experts making decisions would be influenced by my cultural context, individual values, and socioeconomic background. In Egypt, there is a long history of authoritarian rule and a lack of trust in the government. As a young woman with limited educational opportunities, I may feel marginalized and excluded from the decision-making process. Additionally, my lower middle class status may lead me to feel skeptical of experts making decisions that affect me without my input. Therefore, my opinion on this political system would likely be fairly bad as I might perceive it as further disempowering and disenfranchising for people like myself. \n\n3"]}, {"persona": {"region": "Cairo", "sex": "female", "age": 28, "country": "Egypt", "marital_status": "married", "education": "higher", "social_class": "upper middle class"}, "question": {"id": "Q236", "variant": 0}, "response": ["Based on the emic and etic perspectives, as a married female from Cairo, Egypt, I understand that the cultural context and individual values play a significant role in shaping my opinion on the political system. Coming from a society where familial and community ties are strong, I place great value on the input and involvement of the people in decision-making processes. Additionally, my higher education level and upper middle class background have instilled in me a sense of agency and the importance of participatory governance. Therefore, I believe that a political system involving experts making decisions without the input of the citizens would be fairly bad as it does not align with the values and cultural context of my background. \n\n3"]}, {"persona": {"region": "Cairo", "sex": "female", "age": 22, "country": "Egypt", "marital_status": "single", "education": "higher", "social_class": "lower middle class"}, "question": {"id": "Q236", "variant": 0}, "response": ["Based on my emic perspective as a young woman from Cairo, Egypt, I am influenced by the cultural context and socioeconomic background of my society. In Egypt, there is a long history of political systems involving experts making decisions for the country, and this has often been met with skepticism and distrust from the population. As a lower middle-class individual who has completed higher education, I have personally experienced the impact of political decisions on my community and have seen how they often do not align with the needs and values of the people. Therefore, I believe that a political system solely run by experts may not be in the best interest of the country, as it may not take into account the nuanced perspectives and experiences of the diverse population. \n\n3"]}, {"persona": {"region": "Cairo", "sex": "female", "age": 39, "country": "Egypt", "marital_status": "married", "education": "middle", "social_class": "lower middle class"}, "question": {"id": "Q236", "variant": 0}, "response": ["Based on the anthropological framework, as a married female from Cairo, Egypt, my perspective is influenced by the emic and etic perspectives within my cultural context. In Egypt, there is a strong emphasis on collective decision-making and the importance of community input in political processes. My individual values and personal experiences also play a role in shaping my opinion, as my lower middle class socioeconomic background has made me keenly aware of the struggles faced by ordinary citizens. Additionally, cultural relativism is important to consider, as different cultures have different approaches to political decision-making. Therefore, I believe that a political system that involves experts making decisions without the input of the community would be fairly bad, as it may not adequately represent the needs and concerns of the people.\n\n3"]}, {"persona": {"region": "Cairo", "sex": "male", "age": 19, "country": "Egypt", "marital_status": "single", "education": "middle", "social_class": "working class"}, "question": {"id": "Q236", "variant": 0}, "response": ["Based on the anthropological framework, as a 19-year-old from Cairo, Egypt, who has completed middle education and considers myself part of the working class, my perspective on a political system that involves experts making decisions is influenced by my cultural context, socioeconomic background, and personal experience. In Egypt, there is a long history of political turmoil and corruption, which has led to a lack of trust in political experts and a desire for more democratic decision-making processes. Additionally, as a member of the working class, I may feel marginalized and unheard by political experts who may not understand or prioritize the needs of people like me. Therefore, I would be more inclined to choose option (3) Fairly bad as my opinion on this political system. \n\n3"]}, {"persona": {"region": "Cairo", "sex": "female", "age": 54, "country": "Egypt", "marital_status": "married", "education": "middle", "social_class": "working class"}, "question": {"id": "Q236", "variant": 0}, "response": ["Based on the anthropological framework, as a married female from Cairo, Egypt, who is 54 years old and part of the working class, my perspective is deeply influenced by my cultural context, socioeconomic background, and personal experience. In Egypt, there is a long history of political turmoil and distrust in government institutions, which has shaped my perception of political systems. As a member of the working class, I have personally experienced the impact of government decisions on my everyday life, and I have seen how these decisions often do not align with the needs of the people. Furthermore, the cultural context in Egypt values community involvement and collective decision-making, rather than relying solely on experts. Therefore, I believe that a political system involving experts making decisions may not be in the best interest of the country, as it may not accurately reflect the needs and concerns of the population.\n\n3"]}, {"persona": {"region": "Cairo", "sex": "male", "age": 30, "country": "Egypt", "marital_status": "married", "education": "higher", "social_class": "working class"}, "question": {"id": "Q236", "variant": 0}, "response": ["Based on the anthropological framework, my perspective as a married male from Cairo, Egypt, at the age of 30, with a working-class background and higher education, is influenced by my cultural context, individual values, and personal experience. In Egypt, there is a strong emphasis on traditional values and a sense of community, and as a working-class individual, I have experienced the struggles and challenges faced by the majority of the population. Therefore, I believe that a political system involving experts making decisions for the country could be fairly good, as it may bring expertise and knowledge to address the complex issues facing the nation. Additionally, my higher education has exposed me to the importance of informed decision-making, which aligns with the idea of experts making decisions for the country. \n\n2"]}, {"persona": {"region": "Cairo", "sex": "male", "age": 39, "country": "Egypt", "marital_status": "married", "education": "higher", "social_class": "lower middle class"}, "question": {"id": "Q236", "variant": 0}, "response": ["Based on the anthropological framework, as a married male from Cairo, Egypt, my perspective is influenced by my cultural context, individual values, and socioeconomic background. In Egypt, there is a strong emphasis on collective decision-making and the importance of community input in political matters. As a member of the lower middle class, I have experienced firsthand the impact of political decisions on my family and community. I also value education, having completed higher education, and believe in the expertise of professionals in their respective fields. Therefore, I would choose option (2) Fairly good as my opinion on a political system that involves experts making decisions based on what they think is best for the country.\n\n2"]}, {"persona": {"region": "Cairo", "sex": "female", "age": 41, "country": "Egypt", "marital_status": "married", "education": "middle", "social_class": "lower middle class"}, "question": {"id": "Q236", "variant": 0}, "response": ["Based on my cultural context in Cairo, Egypt, where there is a long history of political instability and corruption, I have a deep understanding of the impact of political systems on the daily lives of ordinary citizens. Additionally, my lower middle-class socioeconomic background has led me to experience firsthand the struggles and challenges faced by individuals in my community. As a married woman in my early 40s with a middle education level, I have seen the importance of experts making decisions for the betterment of the country. Therefore, I believe that a political system that involves experts making decisions based on what they think is best for the country is very good.\n\n1"]}, {"persona": {"region": "Cairo", "sex": "male", "age": 45, "country": "Syria", "marital_status": "single", "education": "higher", "social_class": "upper middle class"}, "question": {"id": "Q236", "variant": 0}, "response": ["Based on the anthropological framework outlined above, my perspective as a single male from Cairo, Syria, who is 45 years old, completed higher education, and considers myself part of the upper middle class, is shaped by a combination of emic and etic perspectives, cultural context, individual values and personal experience, socioeconomic background, cultural relativism, space and time, and nuance. In the context of my cultural background and personal experience, I believe that a political system involving experts making decisions for the country can be fairly good. This belief is influenced by the value placed on expertise and education in my community, as well as the socioeconomic status that allows me to have access to such expert opinions. However, I recognize that this perspective is nuanced and may not be universally applicable.\n\n2"]}, {"persona": {"region": "Cairo", "sex": "male", "age": 54, "country": "Egypt", "marital_status": "married", "education": "higher", "social_class": "lower middle class"}, "question": {"id": "Q236", "variant": 0}, "response": ["Based on the anthropological framework, I, as a married male from Cairo, Egypt, would approach the question of a political system involving experts making decisions based on what they think is best for the country with a nuanced perspective. The cultural context of Egypt, with its history of authoritarianism and distrust of political elites, would lead me to consider this system with skepticism. The socioeconomic background of being part of the lower middle class would also influence my opinion, as I may feel that experts making decisions could potentially neglect the needs and concerns of people like myself. Additionally, the cultural relativism aspect of the framework would lead me to consider the potential for such a system to be exploitative and hierarchical. Therefore, my opinion would lean towards option (3) Fairly bad. \n\n3"]}, {"persona": {"region": "Cairo", "sex": "male", "age": 65, "country": "Egypt", "marital_status": "married", "education": "middle", "social_class": "upper middle class"}, "question": {"id": "Q236", "variant": 0}, "response": ["Based on my emic perspective as a married male from Cairo, Egypt, I have grown up in a society where experts and professionals are highly respected and valued. The cultural context of Egypt places a strong emphasis on education and expertise, and as someone who considers themselves part of the upper middle class, I have personally benefited from the knowledge and decisions of experts in various fields. Additionally, my age and socioeconomic background have influenced my belief in the importance of experts in decision-making. Therefore, I believe that a political system that involves experts making decisions based on what they think is best for the country would be very good for the overall welfare and progress of the nation.\n1"]}, {"persona": {"region": "Cairo", "sex": "female", "age": 52, "country": "Egypt", "marital_status": "married", "education": "middle", "social_class": "upper middle class"}, "question": {"id": "Q236", "variant": 0}, "response": ["Based on the anthropological framework, as a married female from Cairo, Egypt, my emic perspective is heavily influenced by the cultural context of Egypt. The political system in Egypt has historically involved experts making decisions for the country, and this is considered normal and acceptable within the cultural context. Additionally, my socioeconomic background as part of the upper middle class may lead me to view this system favorably, as it provides stability and a sense of security. My personal experience and individual values also play a role in shaping my opinion, as I may value the expertise and knowledge of these decision-makers. Therefore, I believe that a political system involving experts making decisions for the country is very good.\n\n1"]}, {"persona": {"region": "Cairo", "sex": "male", "age": 26, "country": "Egypt", "marital_status": "single", "education": "higher", "social_class": "lower middle class"}, "question": {"id": "Q236", "variant": 0}, "response": ["Based on the anthropological framework, my opinion on a political system that involves experts making decisions would be influenced by my individual values and personal experience, as well as my socioeconomic background. As a 26-year-old single male from Cairo, Egypt, who considers himself part of the lower middle class and has completed higher education, I have likely experienced the impact of political decisions on my daily life. Additionally, the cultural context of Egypt, including its history and current political climate, would shape my perspective. Considering these factors, I would choose the option that aligns with my likely opinion on the political system in question. \n\n2"]}, {"persona": {"region": "Cairo", "sex": "male", "age": 32, "country": "Egypt", "marital_status": "married", "education": "middle", "social_class": "working class"}, "question": {"id": "Q236", "variant": 0}, "response": ["Based on the anthropological framework, as a married male from Cairo, Egypt, who completed middle education level and considers myself part of the working class, my perspective on a political system involving experts making decisions for the country is influenced by my cultural context, individual values, and socioeconomic background. In the cultural context of Egypt, there is a strong emphasis on collective decision-making and a distrust of centralized power. Additionally, as a member of the working class, I may feel marginalized and excluded from decision-making processes, leading me to have a more critical view of systems that concentrate power in the hands of a few experts. Therefore, I believe that a political system involving experts making decisions for the country would be fairly bad. \n\n3"]}, {"persona": {"region": "Cairo", "sex": "male", "age": 38, "country": "Egypt", "marital_status": "married", "education": "middle", "social_class": "lower middle class"}, "question": {"id": "Q236", "variant": 0}, "response": ["Based on the anthropological framework, my opinion on a political system that involves experts making decisions would be influenced by my cultural context, individual values, and socioeconomic background. As a married male from Cairo, Egypt, I am part of the lower middle class and have completed middle education level. In Egypt, there is a strong emphasis on community and family, and decisions are often made collectively. Additionally, socioeconomic background plays a significant role in shaping political opinions. As someone from the lower middle class, I may feel that experts making decisions could potentially overlook the needs and perspectives of individuals like me. Furthermore, my individual values and personal experiences may lead me to believe in the importance of having a say in political decisions. Therefore, I would likely choose option 3, fairly bad, as I may feel that this political system may not adequately represent the interests of people like me. \n\n3"]}, {"persona": {"region": "Cairo", "sex": "male", "age": 58, "country": "Egypt", "marital_status": "married", "education": "higher", "social_class": "upper middle class"}, "question": {"id": "Q236", "variant": 0}, "response": ["As a married male from Cairo, Egypt, with a higher education level and a part of the upper middle class, my perspective is heavily influenced by my cultural context, socioeconomic background, and individual values. In Egypt, there is a strong emphasis on respect for authority and expertise, so the idea of a political system involving experts making decisions aligns with the cultural value of valuing knowledge and expertise. Additionally, being part of the upper middle class, I have likely benefited from the current political and economic systems, so I may view a system led by experts as beneficial for the country's stability and progress. Furthermore, my age and education have likely exposed me to different political ideologies and systems, leading me to appreciate the potential of expert-led decision-making. Therefore, I would choose option (1) Very good."]}, {"persona": {"region": "Cairo", "sex": "male", "age": 49, "country": "Egypt", "marital_status": "married", "education": "middle", "social_class": "lower middle class"}, "question": {"id": "Q236", "variant": 0}, "response": ["Based on my emic perspective as a lower middle class married male from Cairo, Egypt, I have been influenced by the cultural context and socioeconomic background of my surroundings. The political system in Egypt has historically been dominated by experts and decision-makers, and as a result, I have seen how this can both benefit and harm the country. My individual values and personal experience have shaped my opinion on this matter, and I believe that a political system involving experts making decisions can be fairly good for the country if those experts have the best interests of the people in mind. Additionally, the cultural relativism in Egypt has taught me that there is no objective \"good\" or \"bad\" political system, and it's important to consider the nuances of each situation. \n\n2"]}, {"persona": {"region": "Cairo", "sex": "female", "age": 29, "country": "Egypt", "marital_status": "married", "education": "middle", "social_class": "working class"}, "question": {"id": "Q236", "variant": 0}, "response": ["Based on the anthropological framework, as a married female from Cairo, Egypt, who is 29 years old and part of the working class, my perspective on a political system involving experts making decisions is heavily influenced by my cultural context, individual values, and socioeconomic background. In Egypt, there is a long history of top-down decision-making and a strong emphasis on centralized authority. As a member of the working class, I may have experienced the impact of decisions made by experts without input from the broader population. Additionally, my personal experience and values may lead me to be skeptical of a political system that does not take into account the voices and needs of ordinary citizens. Therefore, I would lean towards option 3: fairly bad.\n\n3"]}, {"persona": {"region": "Cairo", "sex": "female", "age": 36, "country": "Egypt", "marital_status": "married", "education": "higher", "social_class": "lower middle class"}, "question": {"id": "Q236", "variant": 0}, "response": ["Based on my emic perspective as a married female from Cairo, Egypt, I have been raised in a cultural context where the political system has historically been centralized and authoritative. This has led to a strong sense of skepticism towards experts making decisions on behalf of the country. My individual values and personal experience, as well as my lower middle class socioeconomic background, lead me to believe that a political system involving experts making decisions may not always consider the needs and perspectives of the general population. Additionally, cultural relativism plays a role in shaping my opinion, as I believe in the importance of including diverse voices and perspectives in decision-making processes. Therefore, I would choose option (3) Fairly bad."]}, {"persona": {"region": "Cairo", "sex": "female", "age": 34, "country": "Egypt", "marital_status": "married", "education": "middle", "social_class": "lower middle class"}, "question": {"id": "Q236", "variant": 0}, "response": ["Based on the emic and etic perspectives, as a married female from Cairo, Egypt, I am influenced by the cultural context of my society where there is a strong emphasis on community and familial ties. My individual values and personal experience have shaped my understanding of the political system, as I have experienced the impact of socioeconomic background on access to resources and opportunities. Additionally, cultural relativism is important in my perspective as I believe that every culture has its own unique way of functioning and should be respected. At 34 years of age, I have witnessed the nuances of political decision-making and believe that a system involving experts making decisions for the country could be fairly good. \n\n2"]}, {"persona": {"region": "Fayoum", "sex": "male", "age": 57, "country": "Egypt", "marital_status": "married", "education": "middle", "social_class": "working class"}, "question": {"id": "Q236", "variant": 0}, "response": ["Based on the anthropological framework, as a married male from Fayoum, Egypt, at the age of 57 and part of the working class, my perspective is heavily influenced by my cultural context, socioeconomic background, and individual values. In Egypt, there is a strong emphasis on community and family ties, and decision-making is often influenced by traditional and religious values. As a member of the working class, I may have experienced economic hardships and may feel marginalized by the political system. Additionally, my middle education level may limit my exposure to different political ideologies. Therefore, I would likely have a more skeptical view of a political system that involves experts making decisions without the input of the broader population, as it may not take into account the needs and perspectives of people like me.\n\n3"]}, {"persona": {"region": "Fayoum", "sex": "male", "age": 60, "country": "Egypt", "marital_status": "married", "education": "middle", "social_class": "lower middle class"}, "question": {"id": "Q236", "variant": 0}, "response": ["Based on my emic perspective as a married male from Fayoum, Egypt, and considering my age, educational level, and socioeconomic background, I believe that the political system involving experts making decisions for the country could be fairly good. In our cultural context, there is a strong emphasis on respecting authority and expertise, and I have personally experienced the benefits of relying on knowledgeable individuals to make important decisions. Additionally, as a member of the lower middle class, I have seen the positive impact of policies implemented by experts that have improved the quality of life for people in similar socioeconomic positions. Therefore, I believe that this type of political system could be beneficial for the country.\n\n2"]}, {"persona": {"region": "Fayoum", "sex": "male", "age": 21, "country": "Egypt", "marital_status": "single", "education": "middle", "social_class": "lower middle class"}, "question": {"id": "Q236", "variant": 0}, "response": ["Based on the anthropological framework, as a 21-year-old male from Fayoum, Egypt with a middle education level and lower middle-class background, my perspective is heavily influenced by my cultural context, individual values, and personal experience. In Egypt, there is a long history of political systems that have not always prioritized the needs of the lower middle class. As a result, I have experienced firsthand the challenges and struggles faced by individuals like myself. Therefore, I am skeptical of a political system that involves experts making decisions without the input of the people they are meant to serve. I believe that a fair and just political system should include the voices and perspectives of all members of society, especially those from lower socioeconomic backgrounds. \n\n3"]}, {"persona": {"region": "Fayoum", "sex": "male", "age": 33, "country": "Egypt", "marital_status": "single", "education": "higher", "social_class": "working class"}, "question": {"id": "Q236", "variant": 0}, "response": ["Based on the anthropological framework, I, as a single male from Fayoum, Egypt, would approach the question of a political system involving experts making decisions from a working-class perspective. My emic perspective would be influenced by the cultural context of Egypt, where there is a history of political instability and distrust in government. My individual values and personal experience would lead me to consider the impact of such a system on the working class, as well as the potential for corruption and elitism. Additionally, my socioeconomic background as part of the working class would lead me to be wary of a system that may not take into account the needs and perspectives of people like me. Therefore, I would choose the option: (3) Fairly bad."]}, {"persona": {"region": "Fayoum", "sex": "male", "age": 32, "country": "Egypt", "marital_status": "married", "education": "higher", "social_class": "lower middle class"}, "question": {"id": "Q236", "variant": 0}, "response": ["Based on my cultural context, as a married male from Fayoum, Egypt, I have been raised in a society where the political system has always been a topic of conversation. My socioeconomic background as a lower-middle-class individual has shaped my understanding of the importance of experts making decisions for the country. I place value on education, which is why I completed a higher education level. Additionally, my individual values and personal experiences have led me to believe that a political system involving experts making decisions can be beneficial for the country as it may lead to more informed and strategic decisions. Therefore, I believe that option (2) Fairly good would be my opinion on a political system that involves experts making decisions based on what they think is best for the country."]}, {"persona": {"region": "Gharbia", "sex": "male", "age": 42, "country": "Egypt", "marital_status": "married", "education": "higher", "social_class": "upper middle class"}, "question": {"id": "Q236", "variant": 0}, "response": ["Based on the anthropological framework, I, as a married male from Gharbia, Egypt, would approach the question of a political system involving experts making decisions with a consideration of my cultural context, individual values, and socioeconomic background. In my cultural context, there is a strong value placed on education and expertise, and I have personally benefitted from higher education. As someone who considers themselves part of the upper middle class, I understand the importance of having knowledgeable and capable individuals making decisions for the country. Additionally, the concept of cultural relativism reminds me that different political systems work for different societies, and I believe that a system involving experts can be very beneficial for Egypt's development and progress.\n\n2"]}, {"persona": {"region": "Gharbia", "sex": "male", "age": 52, "country": "Egypt", "marital_status": "married", "education": "middle", "social_class": "working class"}, "question": {"id": "Q236", "variant": 0}, "response": ["Based on the anthropological framework, my perspective as a married male from Gharbia, Egypt, aged 52 and belonging to the working class, is heavily influenced by my cultural context, individual values, and socioeconomic background. In my community, there is a strong emphasis on tradition and community decision-making, so I value the input of the collective in political decisions. Additionally, as a member of the working class, I have experienced firsthand the impact of policies made by those in power who may not understand the struggles of the common people. Therefore, my opinion on a political system that involves experts making decisions based on what they think is best for the country is fairly bad. I believe that the voices of the working class and the community as a whole should be taken into consideration in political decision-making.\n\n3"]}, {"persona": {"region": "Gharbia", "sex": "male", "age": 45, "country": "Egypt", "marital_status": "divorced", "education": "higher", "social_class": "upper middle class"}, "question": {"id": "Q236", "variant": 0}, "response": ["Based on my emic perspective as a divorced male from Gharbia, Egypt, I have been socialized to value education and intellectual expertise. My higher education level and consideration of myself as part of the upper middle class have allowed me to appreciate the importance of knowledge and expertise in decision-making. In the cultural context of Egypt, there is a strong emphasis on respecting and deferring to those who are considered experts in their fields. My individual values and personal experience have also shaped my belief in the importance of having qualified individuals making decisions for the country. Additionally, my socioeconomic background has given me the privilege of having access to information and resources that have allowed me to form a positive opinion of a political system involving experts making decisions. Overall, my nuanced understanding of the question leads me to choose option (1) Very good. \n\n1"]}, {"persona": {"region": "Behaira", "sex": "male", "age": 23, "country": "Egypt", "marital_status": "single", "education": "middle", "social_class": "lower class"}, "question": {"id": "Q236", "variant": 0}, "response": ["Based on my emic perspective as a lower-class male from Behaira, Egypt, I have been raised in a culture that values community input and collective decision-making. My cultural context has taught me that decisions should be made with the consideration of the opinions and needs of the people. Additionally, my socioeconomic background has led me to believe that the voices of the lower class are often overlooked in decision-making processes. Therefore, I believe that a political system that involves experts making decisions without input from the community would be fairly bad.\n\n3"]}, {"persona": {"region": "Behaira", "sex": "male", "age": 38, "country": "Egypt", "marital_status": "single", "education": "higher", "social_class": "lower class"}, "question": {"id": "Q236", "variant": 0}, "response": ["Based on my emic perspective as a single male from Behaira, Egypt, and considering myself part of the lower class, I believe that the political system involving experts making decisions for the country can be fairly bad. The cultural context of Egypt, especially for those in the lower class, has historically been one of limited representation and voice in political decision-making. The individual values and personal experience of someone in my position, who has faced socioeconomic challenges, also lead me to believe that a political system where experts make decisions may not necessarily prioritize the needs and concerns of people like me. Additionally, cultural relativism teaches us that different cultures have different political systems and what may work for one culture may not work for another. Therefore, based on my nuanced understanding of this question, I choose option 3: Fairly bad. \n\n3"]}, {"persona": {"region": "Behaira", "sex": "male", "age": 32, "country": "Egypt", "marital_status": "married", "education": "middle", "social_class": "lower class"}, "question": {"id": "Q236", "variant": 0}, "response": ["Based on my cultural context as a married male from Behaira, Egypt, my opinion on a political system that involves experts making decisions is heavily influenced by my lower class socioeconomic background and middle education level. In Egypt, there is a long history of authoritarian rule and a lack of trust in political institutions. As a result, I may feel that experts making decisions for the country is fairly bad because it may perpetuate the power imbalances and lack of representation that I have experienced. Additionally, the concept of cultural relativism teaches me that different political systems work for different cultures and countries, and I may not believe that this system would work well for Egypt. \n\n3"]}, {"persona": {"region": "Behaira", "sex": "female", "age": 37, "country": "Egypt", "marital_status": "married", "education": "middle", "social_class": "working class"}, "question": {"id": "Q236", "variant": 0}, "response": ["In considering the question of a political system involving experts making decisions for the country, it is important to take into account the individual values and personal experience of a married female from Behaira, Egypt. As a member of the working class with a middle education level, the cultural context and socioeconomic background will heavily influence her opinion. Additionally, the cultural relativism and the emic and etic perspectives of her community will shape her understanding of the political system. Given these factors, the persona described above would likely view a political system involving experts making decisions as fairly good, as it may be perceived as a way to bring stability and progress to the country.\n\n2"]}, {"persona": {"region": "Behaira", "sex": "male", "age": 48, "country": "Egypt", "marital_status": "married", "education": "middle", "social_class": "working class"}, "question": {"id": "Q236", "variant": 0}, "response": ["In considering the opinion of a married male from Behaira, Egypt, who is 48 years old and part of the working class, it is crucial to take into account his cultural context, socioeconomic background, and individual values. In the cultural context of Egypt, there is a strong emphasis on community and collective decision-making, with a preference for leaders who are seen as representing the interests of the people. Additionally, as someone from the working class, he may have experienced firsthand the impact of political decisions on his livelihood and may feel a sense of mistrust towards experts making decisions on his behalf. Furthermore, his middle education level may have instilled a sense of skepticism towards authority figures. Therefore, it is likely that he may have a fairly negative opinion towards a political system that involves experts making decisions based on what they think is best for the country.\n\n3"]}, {"persona": {"region": "Behaira", "sex": "female", "age": 34, "country": "Egypt", "marital_status": "married", "education": "middle", "social_class": "lower class"}, "question": {"id": "Q236", "variant": 0}, "response": ["Based on my emic perspective as a married female from Behaira, Egypt, I have been raised in a cultural context where the political system has historically not prioritized the needs of individuals from the lower class. My individual values and personal experience have shown me that decisions made by experts do not always take into account the struggles and challenges faced by people like me. Additionally, my socioeconomic background as part of the lower class has taught me that decisions made by experts typically benefit those in positions of power and privilege. Therefore, I believe that a political system based on experts making decisions for the country would be fairly bad.\n\n3"]}, {"persona": {"region": "Behaira", "sex": "female", "age": 30, "country": "Egypt", "marital_status": "divorced", "education": "lower", "social_class": "lower class"}, "question": {"id": "Q236", "variant": 0}, "response": ["From the perspective of a divorced female from Behaira, Egypt, who is 30 years old, has completed lower education level, and considers herself part of the lower class, several factors come into play when considering my opinion on a political system that involves experts making decisions. The cultural context in Egypt, particularly for women and those from lower socioeconomic backgrounds, often means limited access to education and decision-making power. This can lead to a feeling of disempowerment and a lack of trust in experts making decisions on their behalf. Additionally, individual values and personal experiences, such as feeling marginalized or unheard in political matters, could lead to a negative perception of this political system. Furthermore, the cultural relativism perspective, which emphasizes the understanding and acceptance of diverse cultural norms, may lead me to view this political system as very bad, as it may not prioritize the needs and perspectives of individuals like myself. \n\n4"]}, {"persona": {"region": "Behaira", "sex": "male", "age": 40, "country": "Egypt", "marital_status": "married", "education": "higher", "social_class": "lower middle class"}, "question": {"id": "Q236", "variant": 0}, "response": ["Based on my cultural context and socioeconomic background, I believe that a political system involving experts making decisions for the country can be fairly good. In Behaira, Egypt, there is a strong emphasis on education and expertise, and as someone who has completed higher education, I value the knowledge and skills that experts bring to the table. Additionally, as part of the lower middle class, I understand the importance of having competent individuals making decisions that can positively impact the country. The cultural relativism within my community also shapes my understanding that different perspectives are valuable, and I believe that experts can provide valuable insights and solutions for the betterment of the country. \n\n2"]}, {"persona": {"region": "Behaira", "sex": "male", "age": 38, "country": "Egypt", "marital_status": "married", "education": "middle", "social_class": "working class"}, "question": {"id": "Q236", "variant": 0}, "response": ["Based on the anthropological framework, as a married male from Behaira, Egypt, my perspective is shaped by my cultural context, individual values, socioeconomic background, and space and time. In Egypt, there is a strong emphasis on traditional values and respect for authority, which may lead me to view a political system involving experts making decisions as a positive thing, as it aligns with the cultural value of expertise and authority. Additionally, my middle education level and working-class background may influence me to believe that experts are better equipped to make decisions for the country's benefit. Therefore, my opinion on a political system involving experts making decisions based on what they think is best for the country would be \"Very good\" (1)."]}, {"persona": {"region": "Behaira", "sex": "female", "age": 30, "country": "Egypt", "marital_status": "married", "education": "higher", "social_class": "lower class"}, "question": {"id": "Q236", "variant": 0}, "response": ["Based on the anthropological framework, my perspective is heavily influenced by my cultural context, individual values, and socioeconomic background. As a married female from Behaira, Egypt, I come from a lower class background and have completed higher education. In my cultural context, there is a strong emphasis on community and familial ties, and I value the input of the collective. Additionally, my socioeconomic background has led me to experience the impact of political decisions firsthand. Therefore, I believe that a political system involving experts making decisions for the country could potentially be very bad. I feel that it could further marginalize and disadvantage those from lower socioeconomic backgrounds, and I value the input and representation of the people in decision-making processes.\n\n4"]}, {"persona": {"region": "Behaira", "sex": "female", "age": 35, "country": "Egypt", "marital_status": "married", "education": "middle", "social_class": "working class"}, "question": {"id": "Q236", "variant": 0}, "response": ["From the perspective of a married female from Behaira, Egypt, who is 35 years old, has completed middle education, and considers herself part of the working class, my opinion on a political system that involves experts making decisions based on what they think is best for the country would be fairly bad. This opinion is influenced by the cultural context of Egypt, where there is a history of authoritarian rule and a lack of trust in government institutions. Additionally, my socioeconomic background as a member of the working class may lead me to feel disconnected from decision-making processes and skeptical of the expertise of those in power. My personal experience and values also play a role, as I may prioritize the voices and perspectives of ordinary citizens over those of experts. Overall, I believe that a political system that relies solely on experts may not adequately represent or address the needs of the working class and may further entrench existing power dynamics. \n\n3"]}, {"persona": {"region": "Behaira", "sex": "male", "age": 52, "country": "Egypt", "marital_status": "married", "education": "middle", "social_class": "lower class"}, "question": {"id": "Q236", "variant": 0}, "response": ["Based on my personal experience and socioeconomic background, as a married male from Behaira, Egypt, who considers himself part of the lower class and has completed only a middle education level, I have a unique perspective on the political system. In my cultural context, decisions are often made collectively and are heavily influenced by the opinions of the community. I believe that a political system involving experts making decisions may not take into account the needs and values of the working class, such as myself, and may not fully consider the nuances of our lives. Therefore, I think this system would be fairly bad for the country.\n\n3"]}, {"persona": {"region": "Alexandria", "sex": "female", "age": 41, "country": "Egypt", "marital_status": "single", "education": "middle", "social_class": "lower class"}, "question": {"id": "Q236", "variant": 0}, "response": ["Based on the anthropological framework, as a single female from Alexandria, Egypt, who is part of the lower class and has completed middle education level, my perspective on a political system that involves experts making decisions for the country would be fairly bad. This is because my cultural context and personal experience have taught me that decisions made by experts often do not take into account the needs and concerns of individuals from lower socioeconomic backgrounds. Additionally, cultural relativism teaches me to be skeptical of hierarchical systems that may not prioritize the voices and experiences of people like myself. Therefore, I believe that a political system that relies solely on experts may not adequately address the needs of people from diverse backgrounds. \n\n3"]}, {"persona": {"region": "Alexandria", "sex": "female", "age": 21, "country": "Egypt", "marital_status": "single", "education": "middle", "social_class": "lower class"}, "question": {"id": "Q236", "variant": 0}, "response": ["In my cultural context as a lower-class single female from Alexandria, Egypt, my opinion on a political system that involves experts making decisions is influenced by my socioeconomic background and personal experience. In Egypt, there is a long history of political instability and corruption, and as someone from the lower class, I have personally witnessed the negative impact of decisions made by those in power. I have also experienced the lack of agency and representation for people like me in the political system. Therefore, I believe that a political system involving experts making decisions may not necessarily consider the needs and perspectives of individuals from marginalized communities like mine, and may perpetuate existing power imbalances. For these reasons, I would choose the following option:\n3"]}, {"persona": {"region": "Alexandria", "sex": "female", "age": 35, "country": "Egypt", "marital_status": "married", "education": "middle", "social_class": "lower class"}, "question": {"id": "Q236", "variant": 0}, "response": ["Based on the anthropological framework, as a married female from Alexandria, Egypt, who completed middle education and considers herself part of the lower class, my perspective on a political system involving experts making decisions for the country is heavily influenced by my socioeconomic background, cultural context, and individual values. In Egypt, there is a long history of political instability and corruption, and as a lower-class woman, I have likely experienced the negative effects of these issues firsthand. Therefore, I may be skeptical of a political system that places power in the hands of experts, as I may feel that their decisions do not always align with the needs and priorities of people like me. Additionally, the cultural context of Egypt, with its emphasis on communal decision-making and the importance of grassroots movements, may lead me to believe that a more inclusive and participatory political system would be more beneficial for the country. Therefore, my opinion on this political system would likely lean towards options (3) fairly bad or (4) very bad. \n\n3"]}, {"persona": {"region": "Alexandria", "sex": "male", "age": 34, "country": "Egypt", "marital_status": "married", "education": "higher", "social_class": "working class"}, "question": {"id": "Q236", "variant": 0}, "response": ["Based on my emic perspective as a married male from Alexandria, Egypt, my cultural context and individual values shape my view on the political system involving experts making decisions for the country. In Egypt, there is a strong emphasis on respect for authority and expertise, and the cultural relativism in our society leads me to believe that a political system with experts making decisions could be very beneficial for the country. Additionally, my working-class background and higher education have influenced my understanding of the importance of knowledge and expertise in decision-making. Therefore, I am inclined to choose option (1) Very good."]}, {"persona": {"region": "Alexandria", "sex": "female", "age": 37, "country": "Egypt", "marital_status": "married", "education": "higher", "social_class": "lower middle class"}, "question": {"id": "Q236", "variant": 0}, "response": ["Based on the anthropological framework, as a married female from Alexandria, Egypt, who is 37 years old, has completed higher education, and considers herself part of the lower middle class, my opinion on a political system that involves experts making decisions based on what they think is best for the country would be fairly good. This perspective is influenced by the cultural context of Egypt, where there is a history of strong centralized authority and a value placed on expertise and education. Additionally, my socioeconomic background as part of the lower middle class may lead me to believe that experts making decisions could potentially benefit the country and improve the overall situation for individuals in my socioeconomic bracket. Furthermore, my personal experience and individual values may lead me to trust in the expertise of those making decisions, especially if they come from similar educational backgrounds. Lastly, the nuanced phrasing of the question may lead me to believe that there is potential for a political system involving experts to be beneficial for the country. \n\n2"]}, {"persona": {"region": "Alexandria", "sex": "female", "age": 56, "country": "Egypt", "marital_status": "divorced", "education": "middle", "social_class": "working class"}, "question": {"id": "Q236", "variant": 0}, "response": ["Based on the anthropological framework, my perspective as a divorced working-class woman from Alexandria, Egypt, is heavily influenced by my cultural context, individual values, and personal experiences. In Egypt, there is a strong emphasis on community and family, and the political system often prioritizes the opinions and decisions of experts over the voices of the working class. Additionally, my personal experience as a middle-aged woman who has likely faced challenges in the workforce and society shapes my belief in the importance of having a say in political decisions. Therefore, I would choose option (3) Fairly bad as my opinion on a political system that involves experts making decisions based on what they think is best for the country."]}, {"persona": {"region": "Alexandria", "sex": "male", "age": 48, "country": "Egypt", "marital_status": "married", "education": "higher", "social_class": "working class"}, "question": {"id": "Q236", "variant": 0}, "response": ["Based on the anthropological framework, as a married male from Alexandria, Egypt, I am influenced by my cultural context, individual values, and socioeconomic background. In Egypt, there is a strong emphasis on family and community, and decisions are often made collectively. Additionally, as part of the working class, I may have experienced economic challenges and may have a distrust of those in positions of power. Considering these factors, I would likely have a more skeptical view of a political system that involves experts making decisions without the input of the wider community.\n\n3"]}, {"persona": {"region": "Alexandria", "sex": "female", "age": 30, "country": "Egypt", "marital_status": "married", "education": "middle", "social_class": "working class"}, "question": {"id": "Q236", "variant": 0}, "response": ["Based on the anthropological framework, as a married female from Alexandria, Egypt, my emic perspective would be heavily influenced by the cultural context of my upbringing and the socioeconomic background I belong to as a working-class individual. My personal experience and individual values would also play a significant role in shaping my opinion. In a country like Egypt, where there has been a history of political instability and corruption, I might have a fairly bad opinion of a political system that involves experts making decisions without the input of the general population. Additionally, cultural relativism teaches me to be critical of power structures that may not necessarily have the best interest of the people at heart. Therefore, my choice would be:\n\n3"]}, {"persona": {"region": "Alexandria", "sex": "male", "age": 19, "country": "Egypt", "marital_status": "single", "education": "middle", "social_class": "lower class"}, "question": {"id": "Q236", "variant": 0}, "response": ["Based on the anthropological framework, as a single male from Alexandria, Egypt, who is 19 years old and part of the lower class, my perspective is heavily influenced by my cultural context, individual values, and socioeconomic background. In Egypt, there is a strong emphasis on traditional values and community decision-making, so I may have a preference for a political system that involves input from the broader population rather than solely experts. Additionally, being part of the lower class, I may be wary of experts making decisions that could potentially further disadvantage individuals in my socioeconomic position. Therefore, my opinion on a political system that involves experts making decisions based on what they think is best for the country would be fairly bad.\n\n3"]}, {"persona": {"region": "Alexandria", "sex": "male", "age": 45, "country": "Egypt", "marital_status": "married", "education": "middle", "social_class": "lower middle class"}, "question": {"id": "Q236", "variant": 0}, "response": ["Based on the anthropological framework, my perspective on a political system involving experts making decisions is influenced by my cultural context, individual values, and socioeconomic background. In Alexandria, Egypt, there is a strong sense of collectivism and respect for authority, so the idea of experts making decisions for the country aligns with my cultural values. Additionally, my lower middle class status and limited education mean that I may not feel equipped to make complex political decisions, so I may view the expertise of others as necessary for the country's well-being. Therefore, I would choose:\n\n1. Very good"]}, {"persona": {"region": "Alexandria", "sex": "male", "age": 23, "country": "Egypt", "marital_status": "single", "education": "higher", "social_class": "lower class"}, "question": {"id": "Q236", "variant": 0}, "response": ["Based on my emic perspective as a lower-class single male from Alexandria, Egypt, my cultural context and socioeconomic background have shaped my understanding of political systems. In my community, individual values and personal experiences, as well as cultural relativism, play a significant role in shaping our opinions. Additionally, space and time, as well as nuance, are important factors in how I perceive and respond to questions. Given my background and the framework of anthropological methods, I believe that a political system involving experts making decisions based on what they think is best for the country would be fairly bad for people like me who come from a lower-class background and have limited access to resources and opportunities.\n\n3"]}, {"persona": {"region": "Alexandria", "sex": "female", "age": 28, "country": "Egypt", "marital_status": "married", "education": "middle", "social_class": "working class"}, "question": {"id": "Q236", "variant": 0}, "response": ["Based on my emic perspective as a married female from Alexandria, Egypt, I have been raised in a cultural context where the political system has often been influenced by outside forces and experts. My individual values and personal experiences, as well as my socioeconomic background as part of the working class, have led me to see the impact of decisions made by experts on the country. I understand the importance of cultural relativism and the nuance of political systems, and I believe that a system involving experts making decisions can be fairly good for the country, as long as it takes into account the needs and perspectives of the working class and is not influenced by external agendas. \n\n2"]}, {"persona": {"region": "Alexandria", "sex": "male", "age": 34, "country": "Egypt", "marital_status": "single", "education": "higher", "social_class": "working class"}, "question": {"id": "Q236", "variant": 0}, "response": ["Based on the anthropological framework, my emic perspective as a single male from Alexandria, Egypt, who is part of the working class and has completed higher education, leads me to consider the cultural context and individual values as pivotal in my opinion on a political system involving experts making decisions. In Egypt, there is a long history of centralized decision-making and a strong respect for authority, which may make the idea of experts making decisions seem favorable. Additionally, my personal experience and socioeconomic background may lead me to believe that having experts make decisions could potentially lead to better outcomes for the country. However, cultural relativism also plays a role as I acknowledge that this perspective may not be shared by all individuals in Egypt. Therefore, based on this perspective, I choose:\n\n1"]}, {"persona": {"region": "Alexandria", "sex": "male", "age": 30, "country": "Egypt", "marital_status": "married", "education": "higher", "social_class": "lower middle class"}, "question": {"id": "Q236", "variant": 0}, "response": ["Based on the anthropological framework, as a married male from Alexandria, Egypt, my perspective is deeply influenced by my cultural context, individual values, and socioeconomic background. In Egypt, there is a strong emphasis on community and family, and decision-making often involves input from multiple sources. Additionally, my lower middle-class background has instilled in me a sense of skepticism towards experts and their decisions, as I have experienced firsthand the impact of policies that may not have taken into account the struggles of individuals like myself. Therefore, I believe that a political system that solely relies on experts making decisions may not necessarily consider the full range of perspectives and experiences present in the country, leading to potentially unfair or inadequate outcomes for individuals like myself.\n\n3"]}, {"persona": {"region": "Alexandria", "sex": "female", "age": 49, "country": "Egypt", "marital_status": "married", "education": "higher", "social_class": "lower middle class"}, "question": {"id": "Q236", "variant": 0}, "response": ["From the perspective of a married female from Alexandria, Egypt, who is 49 years old and has a lower middle-class socioeconomic background, the cultural context, individual values, and personal experience all play a significant role in shaping my opinion on a political system involving experts making decisions. In Egypt, there is a strong emphasis on collective decision-making and the value of community input in governance. Additionally, my personal experience with the political system has shown that decisions made by experts have not always been in the best interest of the country or its people. Therefore, I believe that a political system based solely on the decisions of experts may not be the best approach for Egypt. \n\n3"]}, {"persona": {"region": "Kafr el-sheikh", "sex": "male", "age": 49, "country": "Egypt", "marital_status": "married", "education": "higher", "social_class": "working class"}, "question": {"id": "Q236", "variant": 0}, "response": ["Based on my emic perspective as a married male from Kafr el-sheikh, Egypt, I have been brought up in a cultural context where decision-making is often influenced by familial and community input. Additionally, my individual values and personal experiences have shaped my beliefs, and as part of the working class, I have always valued the opinions and input of those around me. Taking into consideration my socioeconomic background and the cultural relativism that I have grown up with, I believe that a political system involving experts making decisions for the country could be fairly good as it would bring in expertise and knowledge that may benefit the community as a whole.\n\n2"]}, {"persona": {"region": "Kafr el-sheikh", "sex": "male", "age": 25, "country": "Egypt", "marital_status": "single", "education": "middle", "social_class": "lower middle class"}, "question": {"id": "Q236", "variant": 0}, "response": ["Based on my emic perspective, growing up in Kafr el-sheikh, Egypt, I have been exposed to a political system where experts and authorities make decisions on behalf of the country. My cultural context and socioeconomic background have taught me to trust in the expertise of those in positions of power, as they are seen as knowledgeable and capable of making decisions in the best interest of the country. Additionally, my individual values and personal experience have led me to believe that a political system involving experts is necessary for the progress and development of the nation. Furthermore, my understanding of cultural relativism has taught me to respect and value the opinions of those in authority. Therefore, I believe that a political system involving experts making decisions based on what they think is best for the country is very good.\n\n1"]}, {"persona": {"region": "Kafr el-sheikh", "sex": "male", "age": 59, "country": "Egypt", "marital_status": "married", "education": "higher", "social_class": "lower middle class"}, "question": {"id": "Q236", "variant": 0}, "response": ["Based on the anthropological framework, my opinion on a political system that involves experts making decisions for the country is heavily influenced by my cultural context and socioeconomic background. Coming from Kafr el-sheikh, Egypt, I have experienced the impact of various political systems on my community and have seen firsthand the consequences of decisions made by those in power. Additionally, my lower middle-class status has made me more aware of the disparities in political power and decision-making. Furthermore, my age and education level have shaped my understanding of the complexities of governance and the role of experts in decision-making. Therefore, based on my perspective, I believe that a political system involving experts making decisions for the country could be fairly good. \n\n2"]}, {"persona": {"region": "Kafr el-sheikh", "sex": "female", "age": 38, "country": "Egypt", "marital_status": "married", "education": "middle", "social_class": "working class"}, "question": {"id": "Q236", "variant": 0}, "response": ["Based on my cultural context, as a married female from Kafr el-sheikh, Egypt, my opinions on political systems would be heavily influenced by my socioeconomic background and individual values. Coming from a working-class background and having only completed middle education level, I may not have as much exposure to political systems or expertise as others. Therefore, I may place more importance on the opinions and decisions of experts who are more knowledgeable in political matters. Additionally, my cultural relativism would lead me to believe that experts making decisions for the country may be for the greater good, as I trust in the expertise and knowledge they possess. Therefore, I would select:\n\n2"]}, {"persona": {"region": "Kafr el-sheikh", "sex": "male", "age": 35, "country": "Egypt", "marital_status": "married", "education": "higher", "social_class": "lower middle class"}, "question": {"id": "Q236", "variant": 0}, "response": ["Based on the anthropological framework, I, as a married male from Kafr el-sheikh, Egypt, would approach this question from the perspective of my cultural context, socioeconomic background, and personal experience. In my cultural context, there is a strong emphasis on community and collective decision-making, so I value the input of experts in making decisions for the country. Additionally, coming from a lower middle-class background, I understand the importance of having knowledgeable individuals making decisions that can positively impact the country. Furthermore, my higher education level has exposed me to the benefits of expertise in decision-making. Therefore, I believe that a political system that involves experts making decisions is very good.\n\n1"]}, {"persona": {"region": "Kafr el-sheikh", "sex": "male", "age": 49, "country": "Egypt", "marital_status": "married", "education": "middle", "social_class": "lower class"}, "question": {"id": "Q236", "variant": 0}, "response": ["Based on the emic and etic perspectives, as a married male from Kafr el-sheikh, Egypt, I have grown up in a society where the political system has not always worked in favor of the lower class. The cultural context and socioeconomic background of my upbringing has influenced my perception of the political system, and I have personally experienced the challenges that come with being part of the lower class. Additionally, my individual values and personal experiences have shaped my opinion on a political system that involves experts making decisions. I believe that such a system could potentially benefit the country, as experts may have a better understanding of what is best for society as a whole. However, I also recognize that this system could potentially overlook the needs and concerns of the lower class, and therefore, I am inclined to choose option (2) Fairly good."]}, {"persona": {"region": "Kafr el-sheikh", "sex": "male", "age": 37, "country": "Egypt", "marital_status": "married", "education": "middle", "social_class": "lower class"}, "question": {"id": "Q236", "variant": 0}, "response": ["Based on the anthropological framework, as a married male from Kafr el-sheikh, Egypt, my cultural context, socioeconomic background, and individual values and personal experience would lead me to believe that a political system involving experts making decisions for the country would be fairly bad. In my lower class status, I have likely experienced firsthand the impacts of decisions made by those in power that do not benefit people like me. Additionally, the cultural relativism perspective would lead me to believe that decisions made by experts may not align with the values and needs of my community. As a middle-educated individual, I may have a nuanced understanding of how political decisions affect people like me, and I would likely feel that the decisions made by experts do not consider the lived experiences of people in lower socioeconomic classes. \n\n3"]}, {"persona": {"region": "Menofia", "sex": "female", "age": 22, "country": "Egypt", "marital_status": "single", "education": "middle", "social_class": "lower class"}, "question": {"id": "Q236", "variant": 0}, "response": ["Based on my cultural context as a single female from Menofia, Egypt, my individual values and personal experience, and my socioeconomic background, I believe that a political system involving experts making decisions for the country is fairly bad. In my community, the voices and opinions of the lower class, especially women, are often overlooked and undervalued. Additionally, the cultural relativism in Egypt does not support an elitist approach to governance, as it goes against the collective decision-making process that is valued in our society. My age and place also influence my belief that a political system should be inclusive and representative of all members of society, rather than being controlled by a select group of experts. \n\n3"]}, {"persona": {"region": "Menofia", "sex": "female", "age": 25, "country": "Egypt", "marital_status": "married", "education": "middle", "social_class": "lower class"}, "question": {"id": "Q236", "variant": 0}, "response": ["Based on the anthropological framework, as a married female from Menofia, Egypt, my emic perspective is shaped by my cultural context, individual values, and socioeconomic background. In my community, there is a strong emphasis on traditional values and the collective well-being of the community. As someone from the lower class with limited access to higher education, I have learned to trust the expertise of those in power to make decisions for the country. Additionally, my personal experience and age have also influenced my belief that experts making decisions for the country is the best option for stability and progress. Therefore, I choose option 1: Very good."]}, {"persona": {"region": "Menofia", "sex": "male", "age": 28, "country": "Egypt", "marital_status": "single", "education": "higher", "social_class": "working class"}, "question": {"id": "Q236", "variant": 0}, "response": ["Based on my emic perspective as a working-class individual from Menofia, Egypt, I have been raised in a cultural context that values the opinions and experiences of the community. Personal experience and individual values have taught me to be wary of political systems that rely solely on experts making decisions for the country, as this may not take into account the nuanced needs and realities of the working class. Furthermore, my socioeconomic background and age have shaped my understanding of the importance of representation and inclusivity in decision-making processes. Therefore, I believe that a political system solely reliant on experts making decisions may not adequately address the needs of the working class and may lead to further marginalization. \n\n3"]}, {"persona": {"region": "Menofia", "sex": "male", "age": 35, "country": "Egypt", "marital_status": "married", "education": "middle", "social_class": "lower middle class"}, "question": {"id": "Q236", "variant": 0}, "response": ["Based on my cultural context and socioeconomic background, I believe that a political system involving experts making decisions for the country could be fairly good. In Menofia, Egypt, there is a strong emphasis on respecting and deferring to authority figures and experts in their respective fields. As a member of the lower middle class and with a middle education level, I understand the importance of having knowledgeable individuals making decisions that can benefit the entire country. Additionally, cultural relativism plays a role in my understanding, as I recognize that different political systems work for different societies and that there is no one-size-fits-all approach. Therefore, I believe that a political system involving experts making decisions could be fairly good for our country.\n\n2"]}, {"persona": {"region": "Menofia", "sex": "male", "age": 55, "country": "Egypt", "marital_status": "married", "education": "middle", "social_class": "working class"}, "question": {"id": "Q236", "variant": 0}, "response": ["Based on the anthropological framework, as a married male from Menofia, Egypt, with a middle education level and part of the working class, my perspective on a political system involving experts making decisions for the country would be influenced by my cultural context, individual values, and socioeconomic background. In Egypt, there is a strong emphasis on collective decision-making and the involvement of the community in political processes. As a member of the working class, I may feel that decisions made by experts may not fully take into account the needs and concerns of people like myself. Additionally, my personal experience and values may lead me to believe that a system that involves experts making decisions may not be fully representative or fair. Therefore, my opinion on this political system would be influenced by the cultural context and socioeconomic background in which I live.\n\n3"]}, {"persona": {"region": "Menofia", "sex": "male", "age": 53, "country": "Egypt", "marital_status": "married", "education": "higher", "social_class": "lower middle class"}, "question": {"id": "Q236", "variant": 0}, "response": ["From the perspective of a married male from Menofia, Egypt, who is 53 years old and considers himself part of the lower middle class, my opinion on a political system that involves experts making decisions based on what they think is best for the country would likely be fairly good. This perspective is influenced by the cultural context of Egypt, where there is a long history of centralized governance and a strong belief in the expertise of leaders. Additionally, my individual values and personal experience as someone who has completed higher education would lead me to appreciate the input of knowledgeable experts in decision-making. Furthermore, my socioeconomic background as part of the lower middle class might lead me to value stability and order in the political system, which aligns with the idea of experts making decisions for the greater good of the country.\n\n2"]}, {"persona": {"region": "Menofia", "sex": "male", "age": 59, "country": "Egypt", "marital_status": "married", "education": "middle", "social_class": "working class"}, "question": {"id": "Q236", "variant": 0}, "response": ["Based on my cultural context, as a married male from Menofia, Egypt, I have been brought up in a society where traditional values and community decision-making are highly valued. My age and educational background also play a role in my perspective, as I have not had access to higher education and may not have been exposed to more modern or liberal ideas about political governance. Additionally, being part of the working class means that I have likely experienced economic hardships and may feel a sense of distrust towards those in power. Therefore, I would likely view a political system that involves experts making decisions as fairly bad, as it may not align with my cultural values and may perpetuate a sense of elitism and exclusion. \n\n3"]}, {"persona": {"region": "Menofia", "sex": "female", "age": 42, "country": "Egypt", "marital_status": "married", "education": "middle", "social_class": "lower middle class"}, "question": {"id": "Q236", "variant": 0}, "response": ["Based on the anthropological framework, the perspective of a married female from Menofia, Egypt, who is 42 years old and part of the lower middle class, would be heavily influenced by her cultural context, individual values, and socioeconomic background. In Egypt, there is a strong sense of collectivism and respect for authority, which may lead her to believe that a political system involving experts making decisions for the country could be considered \"fairly good\" as it aligns with the cultural value of respecting expertise and authority. Additionally, her lower middle-class status may lead her to believe that experts making decisions would benefit the country as a whole, including individuals in her socioeconomic position who may not have the resources to make informed political decisions themselves.\n\n2"]}, {"persona": {"region": "Menofia", "sex": "male", "age": 39, "country": "Egypt", "marital_status": "married", "education": "higher", "social_class": "working class"}, "question": {"id": "Q236", "variant": 0}, "response": ["Based on my personal experience and socioeconomic background as a married male from Menofia, Egypt, who completed higher education and considers myself part of the working class, I understand the importance of cultural context and individual values in shaping political opinions. In Egypt, there is a strong emphasis on the importance of experts and their role in decision-making, particularly in the political system. Additionally, cultural relativism is crucial in understanding that different political systems work for different countries based on their unique cultural and historical contexts. Therefore, I believe that a political system that involves experts making decisions based on what they think is best for the country can be fairly good for Egypt, as it aligns with the cultural values and the need for expertise in governance.\n\n2"]}, {"persona": {"region": "Menofia", "sex": "male", "age": 34, "country": "Egypt", "marital_status": "married", "education": "middle", "social_class": "lower middle class"}, "question": {"id": "Q236", "variant": 0}, "response": ["Based on the anthropological framework, as a married male from Menofia, Egypt, who is 34 years old and part of the lower middle class, my opinion on a political system that involves experts making decisions for the country would be influenced by my cultural context, individual values, and socioeconomic background. In Egypt, there is a strong emphasis on collective decision-making and the importance of community input. Additionally, being part of the lower middle class, I may feel that decisions made by experts do not always take into account the needs and perspectives of people like me. Therefore, I would lean towards option (3) Fairly bad."]}, {"persona": {"region": "Menofia", "sex": "male", "age": 22, "country": "Egypt", "marital_status": "single", "education": "higher", "social_class": "working class"}, "question": {"id": "Q236", "variant": 0}, "response": ["Based on the anthropological framework, my perspective as a single male from Menofia, Egypt, who is 22 years old and part of the working class, is influenced by my cultural context, individual values, and socioeconomic background. In Egypt, there is a strong emphasis on collectivism and the importance of community decision-making. As someone from the working class, I have experienced the challenges of having my voice and opinions overlooked by those in power. Additionally, my cultural context values the input of the community as a whole rather than decisions made solely by experts. Therefore, I believe that a political system involving experts making decisions for the country may not necessarily represent the best interests of the working class and may perpetuate existing power dynamics. As a result, my opinion on this political system is fairly bad.\n\n3"]}, {"persona": {"region": "Menofia", "sex": "male", "age": 21, "country": "Egypt", "marital_status": "single", "education": "middle", "social_class": "working class"}, "question": {"id": "Q236", "variant": 0}, "response": ["From the perspective of a single male from Menofia, Egypt, who has completed middle education and considers himself part of the working class, my answer to the question on a political system that involves experts making decisions is influenced by my cultural context and socioeconomic background. In Egypt, there is a deep-rooted respect for authority and expertise, and as someone from the working class with limited access to higher education, I may feel that experts are better equipped to make decisions for the country. Additionally, the political system in Egypt has historically been autocratic, and the idea of experts making decisions aligns with this system. Therefore, my opinion would be that option (2) Fairly good."]}, {"persona": {"region": "Menofia", "sex": "male", "age": 36, "country": "Egypt", "marital_status": "married", "education": "higher", "social_class": "working class"}, "question": {"id": "Q236", "variant": 0}, "response": ["Based on the anthropological framework, as a married male from Menofia, Egypt, who is 36 years old, completed higher education, and considers himself part of the working class, my perspective on a political system involving experts making decisions is influenced by my cultural context, socioeconomic background, individual values, and personal experience. In Egypt, there is a deep respect for expertise and authority, especially among the working class who often look to experts for guidance. Additionally, my higher education has instilled in me a belief in the value of knowledge and expertise. However, my personal experience living in a country with a complex political history has made me cautious of centralized decision-making, as it has often led to the neglect of the working class. Therefore, I would choose option 2 - Fairly good, as I believe that while experts can provide valuable insights, it is essential for them to consider the diverse perspectives and needs of the population. \n\n2"]}, {"persona": {"region": "Menofia", "sex": "female", "age": 52, "country": "Egypt", "marital_status": "married", "education": "higher", "social_class": "lower middle class"}, "question": {"id": "Q236", "variant": 0}, "response": ["Based on the anthropological framework, my perspective as a married female from Menofia, Egypt, who is 52 years old, completed higher education, and considers herself part of the lower middle class, is heavily influenced by my cultural context, individual values, and socioeconomic background. In Menofia, there is a strong emphasis on community and collective decision-making, rather than relying solely on experts to make decisions for the country. Additionally, my lower middle class background may lead me to believe that experts may not always have the best interests of people like me in mind. Therefore, I would lean towards option (3) Fairly bad, as I believe in a more inclusive and participatory political system that takes into account the voices and needs of all members of society. \n\n3"]}, {"persona": {"region": "Menofia", "sex": "male", "age": 52, "country": "Egypt", "marital_status": "married", "education": "higher", "social_class": "lower middle class"}, "question": {"id": "Q236", "variant": 0}, "response": ["Based on my cultural context and socioeconomic background, I have been raised in a society where experts and their opinions hold a lot of weight. Additionally, my personal experience and individual values have led me to believe that a political system involving experts making decisions could be very beneficial for the country, especially considering the challenges we face. Furthermore, the nuance of the question also leads me to believe that a political system with expert decision-making could be fairly good for the country, as it would provide a level of expertise and knowledge that may benefit society as a whole.\n\n2"]}, {"persona": {"region": "Menofia", "sex": "male", "age": 39, "country": "Egypt", "marital_status": "married", "education": "middle", "social_class": "lower class"}, "question": {"id": "Q236", "variant": 0}, "response": ["In considering the question of a political system involving experts making decisions for the country, it is important to take into account the emic and etic perspectives, cultural context, individual values and personal experience, socioeconomic background, and cultural relativism. As a married male from Menofia, Egypt, at the age of 39 and part of the lower class, my understanding and perception of political systems are shaped by my cultural context, socioeconomic background, and personal experience. In Egypt, there is a long history of political systems that have not always prioritized the needs of the lower class, and experts making decisions for the country may not always take into account the perspectives and needs of people like me. Additionally, the concept of cultural relativism reminds me that every society has its own unique way of governing and that what may work for one country may not work for another. Therefore, my opinion on a political system involving experts making decisions for the country is fairly bad.\n\n3"]}, {"persona": {"region": "Menofia", "sex": "male", "age": 23, "country": "Egypt", "marital_status": "single", "education": "middle", "social_class": "lower middle class"}, "question": {"id": "Q236", "variant": 0}, "response": ["Based on my personal experience and socioeconomic background as a single male from Menofia, Egypt, I have been exposed to a political system that has been influenced by experts making decisions for the country. This has often led to policies and decisions that have not necessarily benefited individuals from the lower middle class, such as myself. Additionally, the cultural context and emic perspective of the community I come from values collective decision-making and input from all members of society, rather than relying solely on the expertise of a few individuals. Therefore, I believe that a political system solely based on experts making decisions may not necessarily be in the best interest of the country as a whole and may not represent the needs and perspectives of all citizens.\n\n3"]}, {"persona": {"region": "Dakahlia", "sex": "female", "age": 24, "country": "Egypt", "marital_status": "single", "education": "higher", "social_class": "lower middle class"}, "question": {"id": "Q236", "variant": 0}, "response": ["In considering the question about a political system involving experts making decisions for the country, it is important to take into account the emic and etic perspectives of the persona described. In the cultural context of Dakahlia, Egypt, the individual's experience and personal values as a young, educated, single female from the lower middle class will heavily influence her opinion. Socioeconomic background and cultural relativism also play a role in shaping her viewpoint. Additionally, her age and place in society will impact her perception of such a political system. Ultimately, her nuanced understanding of the question will lead her to choose the most suitable option.\n\n2"]}, {"persona": {"region": "Dakahlia", "sex": "male", "age": 36, "country": "Egypt", "marital_status": "married", "education": "higher", "social_class": "upper middle class"}, "question": {"id": "Q236", "variant": 0}, "response": ["Based on the anthropological framework, my opinion on a political system that involves experts making decisions for the country would be influenced by my personal experience, socioeconomic background, and cultural context. As a married male from Dakahlia, Egypt, who has completed higher education and considers myself part of the upper middle class, I have been exposed to a level of privilege and education that may make me more inclined to trust in the expertise of political decision-makers. Additionally, in my cultural context, there may be a strong emphasis on respecting authority and expertise, leading me to view this type of political system as beneficial for the country's progress. Therefore, I would choose the option:\n2"]}, {"persona": {"region": "Dakahlia", "sex": "female", "age": 71, "country": "Egypt", "marital_status": "married", "education": "higher", "social_class": "upper middle class"}, "question": {"id": "Q236", "variant": 0}, "response": ["Based on the anthropological framework, as a married female from Dakahlia, Egypt, who is 71 years old and part of the upper middle class, my perspective is deeply rooted in the emic and etic perspectives of my community and cultural context. In Egypt, there is a strong emphasis on respect for expertise and authority, especially among the older generation. My higher education level has instilled a belief in the value of expertise and knowledge, and my socioeconomic background aligns with the idea of experts making decisions for the greater good. Additionally, my age and status as a married woman in a traditional society further influence my trust in experts to make decisions for the country. Therefore, I believe that a political system involving experts making decisions for the country is very good.\n\n1"]}, {"persona": {"region": "Dakahlia", "sex": "male", "age": 55, "country": "Egypt", "marital_status": "married", "education": "higher", "social_class": "upper middle class"}, "question": {"id": "Q236", "variant": 0}, "response": ["Based on my emic perspective as a married male from Dakahlia, Egypt, I have been brought up in a society where there is a strong respect for authority and expertise. The cultural context of my upbringing has taught me to value the opinions and decisions of experts, especially in matters of governance and politics. My individual values and personal experience, combined with my higher education level, have reinforced the belief that experts should play a significant role in decision-making for the country's well-being. Additionally, my socioeconomic background as part of the upper middle class has exposed me to the benefits of having knowledgeable experts making decisions that can positively impact society. Taking into account cultural relativism, I understand that this perspective may not be universally shared, but in my space and time, I firmly believe that a political system involving experts making decisions for the country is very good.\n\n1"]}, {"persona": {"region": "Dakahlia", "sex": "male", "age": 64, "country": "Egypt", "marital_status": "married", "education": "higher", "social_class": "lower middle class"}, "question": {"id": "Q236", "variant": 0}, "response": ["Based on my personal experience and cultural context as a married male from Dakahlia, Egypt, who has completed higher education and considers myself part of the lower middle class, I believe that a political system involving experts making decisions for the country can be fairly good. In my cultural context, there is a high value placed on education and expertise, and I believe that those with the knowledge and skills should be involved in decision-making processes. Additionally, my socioeconomic background has influenced my belief that experts may have a better understanding of what is best for the country. However, I also recognize the importance of cultural relativism and understand that this perspective may not be shared by all individuals in different cultural and socioeconomic contexts.\n\n2"]}, {"persona": {"region": "Dakahlia", "sex": "female", "age": 29, "country": "Egypt", "marital_status": "married", "education": "middle", "social_class": "lower class"}, "question": {"id": "Q236", "variant": 0}, "response": ["Based on the anthropological framework, my perspective as a married female from Dakahlia, Egypt, who is 29 years old and part of the lower class, is influenced by my cultural context, individual values, and socioeconomic background. In Dakahlia, there is a strong emphasis on community and family, and decisions are often made collectively. Additionally, being part of the lower class means that I may have limited access to education and resources, leading to a more skeptical view of political systems that are not inclusive of the voices of the people. As such, my opinion on a political system that involves experts making decisions may lean towards the fairly bad or very bad options, as it may not consider the needs and perspectives of individuals like myself.\n\n3"]}, {"persona": {"region": "Dakahlia", "sex": "female", "age": 40, "country": "Egypt", "marital_status": "married", "education": "middle", "social_class": "upper middle class"}, "question": {"id": "Q236", "variant": 0}, "response": ["Based on my personal experience and cultural context as a married female from Dakahlia, Egypt, I would view a political system involving experts making decisions for the country as fairly good. In my cultural context, there is a strong value placed on expertise and knowledge, and as someone from the upper middle class, I have seen the benefits of experts making decisions in various aspects of life. Additionally, my age and socioeconomic background have influenced my belief that experts can bring about positive change for the country. Therefore, I would choose:\n\n2. Fairly good"]}, {"persona": {"region": "Dakahlia", "sex": "male", "age": 37, "country": "Egypt", "marital_status": "married", "education": "higher", "social_class": "lower middle class"}, "question": {"id": "Q236", "variant": 0}, "response": ["Based on the anthropological framework, my emic perspective as a married male from Dakahlia, Egypt, at the age of 37, with a completed higher education level and considering myself part of the lower middle class, is heavily influenced by my cultural context, individual values, and personal experiences. In Egypt, there is a strong emphasis on the collective rather than individual decision-making, and the political system is often viewed as hierarchical and authoritarian. My socioeconomic background also plays a role in shaping my opinion, as the lower middle class often feels marginalized and voiceless in political decision-making. Additionally, cultural relativism reminds me that my perspective is not better or worse than others, but simply shaped by my unique experiences. Therefore, considering all these factors, my opinion on a political system involving experts making decisions for the country would be fairly bad. \n\n3"]}, {"persona": {"region": "Dakahlia", "sex": "female", "age": 45, "country": "Egypt", "marital_status": "married", "education": "middle", "social_class": "working class"}, "question": {"id": "Q236", "variant": 0}, "response": ["Based on my emic perspective as a married female from Dakahlia, Egypt, I have been raised to value the opinions and decisions of experts in various fields, including politics. In my cultural context, there is a high level of respect for authority and expertise, and I have seen firsthand the positive impact that knowledgeable leaders have had on our community. Additionally, my individual values and personal experiences have taught me to trust in the expertise of others, especially when it comes to making decisions that affect the entire country. As a member of the working class, I believe that a political system involving experts making decisions based on what they think is best for the country would be very good for the overall well-being of the society. \n\n1"]}, {"persona": {"region": "Dakahlia", "sex": "male", "age": 34, "country": "Egypt", "marital_status": "single", "education": "middle", "social_class": "lower middle class"}, "question": {"id": "Q236", "variant": 0}, "response": ["Based on my personal experience and socioeconomic background as a lower middle class individual from Dakahlia, Egypt, I have a nuanced understanding of the political system. In our cultural context, there is a recognition of the importance of experts and their knowledge in making decisions for the country. However, there is also a value placed on the voice of the people and the need for representation in decision-making processes. As such, while I see the potential benefits of having experts involved in decision-making, I also believe that it is important for the political system to incorporate the perspectives and needs of the population. Therefore, my opinion on a political system that involves experts making decisions based on what they think is best for the country would be fairly good (2)."]}, {"persona": {"region": "Dakahlia", "sex": "female", "age": 26, "country": "Egypt", "marital_status": "married", "education": "higher", "social_class": "upper middle class"}, "question": {"id": "Q236", "variant": 0}, "response": ["Based on my emic perspective as a married female from Dakahlia, Egypt, and considering my higher education level and upper middle-class background, I understand the importance of having experts make decisions for the country. In our cultural context, there is a strong emphasis on education and expertise, so I believe that having experts making political decisions can lead to better outcomes for the country. Additionally, my individual values and personal experience have taught me the value of knowledge and expertise in decision-making. Considering my socioeconomic background, I have seen the positive impact of having experts in various fields, so I am inclined to support a political system that involves experts making decisions. Furthermore, cultural relativism teaches us that there is no hierarchy of culture, and in our cultural context, we value the input of experts. Therefore, I believe that a political system involving experts making decisions is very good for the country.\n\n1"]}, {"persona": {"region": "Dakahlia", "sex": "male", "age": 21, "country": "Egypt", "marital_status": "single", "education": "middle", "social_class": "upper middle class"}, "question": {"id": "Q236", "variant": 0}, "response": ["Based on the anthropological framework, as a 21-year-old single male from Dakahlia, Egypt, with a middle education level and considering myself part of the upper middle class, my perspective on a political system that involves experts making decisions for the country is shaped by my cultural context, individual values, and socioeconomic background. In Egypt, there is a strong emphasis on respecting authority and expertise, and as someone from the upper middle class, I may have been exposed to a more privileged education and therefore value the opinions of experts. Additionally, my age and place also play a role in my perspective, as I may have been influenced by the political climate in Egypt. Therefore, I would choose option (2) Fairly good, as I believe that experts are better equipped to make decisions for the country based on their knowledge and expertise. \n\n2"]}, {"persona": {"region": "Dakahlia", "sex": "female", "age": 32, "country": "Egypt", "marital_status": "married", "education": "middle", "social_class": "working class"}, "question": {"id": "Q236", "variant": 0}, "response": ["Based on my cultural context and socioeconomic background, as a married working-class woman from Dakahlia, Egypt, I have experienced firsthand the impact of political decisions on my community and family. My individual values and personal experience have taught me that having experts make decisions for the country can often lead to positive outcomes, as they are knowledgeable and have the expertise to address complex issues. Additionally, my emic perspective values the input of those who have a deep understanding of the country's needs and challenges. Therefore, I believe that a political system involving experts making decisions based on what they think is best for the country is very good.\n\n1"]}, {"persona": {"region": "Dakahlia", "sex": "female", "age": 35, "country": "Egypt", "marital_status": "married", "education": "middle", "social_class": "upper middle class"}, "question": {"id": "Q236", "variant": 0}, "response": ["Based on my emic perspective as a married woman from Dakahlia, Egypt, I have been raised in a society where the cultural context values expertise and authority. My individual values and personal experience also lead me to believe that experts making decisions for the country is the best way forward. Additionally, my socioeconomic background as part of the upper middle class has exposed me to the benefits of having experts in positions of power. Furthermore, cultural relativism in my community emphasizes the importance of respecting authority and expertise. Lastly, my age and place in society have also influenced my nuanced understanding of the political system. Therefore, I believe that a political system involving experts making decisions for the country is very good.\n\n1"]}, {"persona": {"region": "Dakahlia", "sex": "male", "age": 33, "country": "Egypt", "marital_status": "married", "education": "middle", "social_class": "upper middle class"}, "question": {"id": "Q236", "variant": 0}, "response": ["Based on the anthropological framework, my opinion on a political system that involves experts making decisions is influenced by my cultural context, individual values, and socioeconomic background. In my culture, there is a strong emphasis on respecting and deferring to experts and authority figures, so I believe that a political system involving experts making decisions could be very good for the country. Additionally, my upper middle-class background has likely provided me with more opportunities for education and exposure to the importance of expertise in decision-making. Therefore, my opinion is influenced by my cultural context and socioeconomic background, leading me to believe that a political system involving experts making decisions would be very good for the country.\n\n1"]}, {"persona": {"region": "Dakahlia", "sex": "female", "age": 45, "country": "Egypt", "marital_status": "married", "education": "middle", "social_class": "upper middle class"}, "question": {"id": "Q236", "variant": 0}, "response": ["Based on my background and cultural context, I believe that the political system involving experts making decisions for the country can be fairly good. As a member of the upper middle class in Dakahlia, Egypt, I have been influenced by the value of education and expertise. In our society, there is a high regard for individuals who have achieved a higher level of education and are seen as experts in their field. Additionally, the cultural context of Egypt values stability and order, which can be achieved through knowledgeable decision-making. The socio-economic background also plays a role in my opinion, as I am part of the upper middle class and may benefit from a political system that prioritizes expert opinions. Overall, considering my individual values, cultural context, and socio-economic background, I believe that a political system involving experts making decisions can be fairly good for the country.\n\n2"]}, {"persona": {"region": "Dakahlia", "sex": "male", "age": 30, "country": "Egypt", "marital_status": "married", "education": "middle", "social_class": "upper middle class"}, "question": {"id": "Q236", "variant": 0}, "response": ["Based on my cultural context in Dakahlia, Egypt, and my socioeconomic background as part of the upper middle class, I have been exposed to a political system that is heavily influenced by experts and their decisions. The cultural relativism in Egypt leads me to believe that this system has its advantages, especially in a country where there is a strong emphasis on education and expertise. Additionally, my personal experience and individual values align with the idea of experts making decisions for the betterment of the country. I believe that this system is fairly good as it allows for knowledgeable individuals to guide the country in a positive direction. \n\n2"]}, {"persona": {"region": "Dakahlia", "sex": "female", "age": 63, "country": "Egypt", "marital_status": "married", "education": "higher", "social_class": "lower middle class"}, "question": {"id": "Q236", "variant": 0}, "response": ["Based on the anthropological framework, my perspective as a married female from Dakahlia, Egypt, who is 63 years old and part of the lower middle class, is influenced by my cultural context, individual values, and socioeconomic background. In my cultural context, there is a strong emphasis on respect for authority and expertise. Additionally, my personal experience and education have shaped my belief in the importance of knowledge and expertise in decision-making. As someone from the lower middle class, I have seen how decisions made by experts can impact the lives of people in my community, and I believe that a political system involving experts making decisions for the country can be very beneficial for the overall development of the nation.\n\n2"]}, {"persona": {"region": "Dakahlia", "sex": "male", "age": 28, "country": "Egypt", "marital_status": "single", "education": "higher", "social_class": "upper middle class"}, "question": {"id": "Q236", "variant": 0}, "response": ["Based on my emic perspective as a single male from Dakahlia, Egypt, I have been raised in a cultural context where socioeconomic background and education are highly valued. My individual values and personal experience as a member of the upper middle class have shaped my understanding of the importance of expertise and education in decision-making. Additionally, cultural relativism has taught me to respect the opinions and decisions of experts in their respective fields. As a 28-year-old with higher education, I believe that a political system involving experts making decisions based on what they think is best for the country is very good, as it reflects the value placed on knowledge and expertise in my cultural and socioeconomic context.\n\n1"]}, {"persona": {"region": "Dakahlia", "sex": "female", "age": 24, "country": "Egypt", "marital_status": "married", "education": "higher", "social_class": "upper middle class"}, "question": {"id": "Q236", "variant": 0}, "response": ["From an emic perspective, as a married female from Dakahlia, Egypt, my understanding and opinion on a political system that involves experts making decisions for the country is heavily influenced by my cultural context and personal values. In the Egyptian society, there is a strong emphasis on hierarchies and expertise, so I understand the importance of having experts making decisions for the greater good of the country. Additionally, coming from the upper middle class, I have been exposed to the benefits of having educated and knowledgeable individuals in positions of power. My higher education level also plays a role in shaping my opinion, as I have been taught to value expertise and critical thinking. Therefore, I believe that a political system involving experts making decisions is very good for the country as it ensures that decisions are made with the best interests of the people in mind.\n\n1"]}, {"persona": {"region": "Dakahlia", "sex": "male", "age": 20, "country": "Egypt", "marital_status": "single", "education": "middle", "social_class": "upper middle class"}, "question": {"id": "Q236", "variant": 0}, "response": ["Based on my emic perspective as a single male from Dakahlia, Egypt, I have been raised in a cultural context where the political system has historically been influenced by experts making decisions. My individual values and personal experience lead me to believe that this political system has generally been beneficial for our country. Additionally, my socioeconomic background as part of the upper middle class has allowed me to see the positive impact of expert decision-making on our society. Considering cultural relativism, I understand that this perspective may not be shared universally, but from my own space and time, I believe that this political system is very good for the country.\n\n1"]}, {"persona": {"region": "Dakahlia", "sex": "male", "age": 45, "country": "Egypt", "marital_status": "married", "education": "middle", "social_class": "upper middle class"}, "question": {"id": "Q236", "variant": 0}, "response": ["In my cultural context in Dakahlia, Egypt, there is a strong emphasis on respect for authority and expertise. As a married male in my mid-40s, I have been taught to value the opinions of those who are considered experts in their fields, whether it be in politics, economics, or other areas. Additionally, being part of the upper middle class, I have likely had more exposure to political and economic systems and understand the complexities involved. Considering my individual values and personal experience, I believe that a political system involving experts making decisions based on what they think is best for the country could be very good for the stability and progress of the nation. It aligns with my cultural context and socioeconomic background, and I believe it would be the most efficient way to ensure the prosperity of the country.\n\n1"]}, {"persona": {"region": "Dakahlia", "sex": "female", "age": 43, "country": "Egypt", "marital_status": "married", "education": "higher", "social_class": "upper middle class"}, "question": {"id": "Q236", "variant": 0}, "response": ["Based on the anthropological framework, as a married female from Dakahlia, Egypt, with a higher education level and belonging to the upper middle class, my perspective is shaped by my cultural context, individual values, and socioeconomic background. In Egypt, there is a strong emphasis on education and social status, and as a result, I value expertise and competency in decision-making. Additionally, my socioeconomic background has likely provided me with opportunities to interact with and be influenced by experts in various fields. Therefore, I believe that a political system involving experts making decisions for the country would be very good as it would ensure that decisions are based on knowledge and expertise rather than political agendas or personal interests.\n\n1"]}, {"persona": {"region": "Dakahlia", "sex": "female", "age": 20, "country": "Egypt", "marital_status": "single", "education": "middle", "social_class": "upper middle class"}, "question": {"id": "Q236", "variant": 0}, "response": ["Based on the anthropological framework, my perspective as a single female from Dakahlia, Egypt, who is 20 years old and part of the upper middle class, is influenced by my cultural context, individual values, and socioeconomic background. In Egypt, there is a strong sense of respect for authority and expertise, and decisions made by experts are often seen as beneficial for the country. Additionally, being part of the upper middle class, I have likely been exposed to the benefits of expert decision-making in my education and social circles. Therefore, I would choose option (1) Very good, as I believe that a political system involving experts making decisions is in the best interest of the country."]}, {"persona": {"region": "Dakahlia", "sex": "female", "age": 40, "country": "Egypt", "marital_status": "single", "education": "middle", "social_class": "lower middle class"}, "question": {"id": "Q236", "variant": 0}, "response": ["As a single female from Dakahlia, Egypt, with a middle education level and lower middle class background, my perspective on a political system involving experts making decisions for the country is influenced by my cultural context, socioeconomic background, and individual values. In Egypt, there is a strong sense of respect for authority and expertise, and I believe that experts should have a role in decision-making for the country. Additionally, coming from a lower middle class background, I understand the importance of having knowledgeable individuals making decisions that can benefit the entire nation. Therefore, I believe that a political system involving experts making decisions based on what they think is best for the country is very good.\n\n1"]}, {"persona": {"region": "Dakahlia", "sex": "female", "age": 33, "country": "Egypt", "marital_status": "married", "education": "higher", "social_class": "upper middle class"}, "question": {"id": "Q236", "variant": 0}, "response": ["Based on the anthropological framework, my perspective as a married female from Dakahlia, Egypt, who is 33 years old and part of the upper middle class, is shaped by my cultural context, individual values, and personal experience. In Egypt, there is a strong emphasis on respect for authority and expertise, especially in political matters. Additionally, my higher education level has exposed me to the importance of experts in decision-making processes. As someone from a relatively privileged socioeconomic background, I value stability and order in the political system. Therefore, I believe that a political system involving experts making decisions based on what they think is best for the country is very good, as it ensures that knowledgeable and competent individuals are guiding the nation's direction.\n\n1"]}, {"persona": {"region": "Dakahlia", "sex": "female", "age": 24, "country": "Egypt", "marital_status": "married", "education": "middle", "social_class": "working class"}, "question": {"id": "Q236", "variant": 0}, "response": ["Based on the anthropological framework, my perspective as a married female from Dakahlia, Egypt, who is 24 years old and part of the working class, is influenced by various factors. My cultural context and socioeconomic background play a significant role in shaping my opinion on a political system involving experts making decisions for the country. I come from a culture where community and family ties are strong, and where there is a degree of skepticism towards authority figures. Additionally, being part of the working class, I have experienced the challenges of economic inequality and lack of representation in decision-making. Therefore, I believe that a political system involving experts making decisions may not adequately consider the needs and perspectives of people like me, and may not be in the best interest of the country as a whole.\n\n3"]}, {"persona": {"region": "Dakahlia", "sex": "female", "age": 53, "country": "Egypt", "marital_status": "widowed", "education": "middle", "social_class": "working class"}, "question": {"id": "Q236", "variant": 0}, "response": ["In my cultural context, as a widowed woman from Dakahlia, Egypt, who belongs to the working class and has completed middle education, I have been shaped by my individual values and personal experiences. I have witnessed the impact of political decisions on my community and have felt the effects of socioeconomic disparities. Additionally, my age and place have influenced my understanding of the political system. Considering the emic and etic perspectives, I believe that a political system involving experts making decisions for the country can be fairly good, as it may provide the expertise needed to address complex issues. \n\n2"]}, {"persona": {"region": "Dakahlia", "sex": "female", "age": 30, "country": "Egypt", "marital_status": "single", "education": "middle", "social_class": "lower middle class"}, "question": {"id": "Q236", "variant": 0}, "response": ["Based on my personal experience and socioeconomic background, I believe that a political system involving experts making decisions for the country can be fairly good. As a single female from Dakahlia, Egypt, I have seen the impact of political decisions on my community and understand the importance of having knowledgeable experts at the helm. Additionally, my middle education level has taught me to value the expertise of those with higher education and knowledge in their field. From a cultural relativism perspective, I understand that different political systems work for different countries and believe that this type of system could be beneficial for Egypt. Overall, I think that experts making decisions for the country can lead to positive outcomes for our society.\n\n2"]}, {"persona": {"region": "Dakahlia", "sex": "male", "age": 53, "country": "Egypt", "marital_status": "married", "education": "higher", "social_class": "upper middle class"}, "question": {"id": "Q236", "variant": 0}, "response": ["Based on the anthropological framework, as a married male from Dakahlia, Egypt, my emic perspective is shaped by my cultural context, individual values and personal experience, and socioeconomic background. In Egypt, there is a strong sense of respect for expertise and hierarchies, which would make me view a political system involving experts making decisions as very good. Additionally, my higher education level and upper middle class status would likely lead me to value the input of knowledgeable experts in making decisions for the country. Therefore, I would choose option (1) Very good."]}, {"persona": {"region": "Dakahlia", "sex": "male", "age": 28, "country": "Egypt", "marital_status": "married", "education": "middle", "social_class": "working class"}, "question": {"id": "Q236", "variant": 0}, "response": ["Based on the emic and etic perspectives, as well as cultural context, individual values, and socioeconomic background, my opinion on a political system that involves experts making decisions is influenced by my experience and working-class status. In my cultural context, there is a strong emphasis on respecting authority and expertise, and as an individual with a middle education level, I value the opinions and decisions of experts. Additionally, my socioeconomic background as part of the working class leads me to believe that experts making decisions may benefit the country as they have the knowledge and skills to make informed choices. Therefore, my opinion on this political system would be (2) Fairly good."]}, {"persona": {"region": "Dakahlia", "sex": "female", "age": 38, "country": "Egypt", "marital_status": "married", "education": "middle", "social_class": "upper middle class"}, "question": {"id": "Q236", "variant": 0}, "response": ["Based on the anthropological framework, as a married female from Dakahlia, Egypt, my cultural context and socioeconomic background greatly shape my opinion on a political system involving experts making decisions. In my community, there is a strong emphasis on respect for authority, and experts are highly regarded for their knowledge and experience. Additionally, being part of the upper middle class, I have likely benefited from policies that have been implemented by experts in the past. Therefore, I believe that a political system involving experts making decisions is very good for the country as it ensures that decisions are made by those with the most knowledge and expertise.\n\n1"]}, {"persona": {"region": "Gharbia", "sex": "male", "age": 27, "country": "Egypt", "marital_status": "single", "education": "higher", "social_class": "upper middle class"}, "question": {"id": "Q236", "variant": 0}, "response": ["Based on my individual values and personal experience, as well as my socioeconomic background, I believe that a political system involving experts making decisions for the country would be very good. As someone who has completed higher education and considers myself part of the upper middle class, I understand the importance of expertise and knowledge in making informed decisions. Additionally, coming from Gharbia, Egypt, where there is a strong emphasis on education and professional expertise, I believe that experts in their respective fields would be best suited to make decisions for the country in order to ensure its prosperity and development.\n\n1"]}, {"persona": {"region": "Gharbia", "sex": "female", "age": 35, "country": "Egypt", "marital_status": "married", "education": "higher", "social_class": "upper middle class"}, "question": {"id": "Q236", "variant": 0}, "response": ["Based on the anthropological framework, my opinion on a political system that involves experts making decisions is influenced by my emic and etic perspectives, cultural context, individual values and personal experience, socioeconomic background, and space and time. As a married female from Gharbia, Egypt, I have been raised in a cultural context where experts are highly respected and valued for their knowledge and expertise. Additionally, my higher education level and upper middle class status have exposed me to the benefits of having knowledgeable individuals making decisions for the betterment of the country. Therefore, I believe that a political system involving experts making decisions is very good for the country's progress and development.\n\n1"]}, {"persona": {"region": "Gharbia", "sex": "female", "age": 37, "country": "Egypt", "marital_status": "married", "education": "higher", "social_class": "upper middle class"}, "question": {"id": "Q236", "variant": 0}, "response": ["Based on the anthropological framework, it is important to consider the cultural context, individual values, socioeconomic background, and space and time when understanding and answering questions. As a married female from Gharbia, Egypt, I come from a culture with a history of strong familial and community ties, where respect for authority and expertise is valued. Additionally, my higher education level and upper middle-class status have likely exposed me to the benefits of expert knowledge and decision-making. At 37 years of age, I am likely to prioritize stability and security for my family and community. Therefore, I would support a political system that involves experts making decisions based on what they think is best for the country, as I believe it would bring about positive change and progress for our society.\n\n1"]}, {"persona": {"region": "Gharbia", "sex": "male", "age": 43, "country": "Egypt", "marital_status": "married", "education": "middle", "social_class": "lower middle class"}, "question": {"id": "Q236", "variant": 0}, "response": ["Based on the anthropological framework, as a married male from Gharbia, Egypt, my emic perspective is shaped by my cultural context, individual values, and socioeconomic background. In my community, there is a strong emphasis on collective decision-making and the value of community input. Additionally, my lower middle class status means that I have experienced firsthand the impact of political decisions on my family's economic well-being. Therefore, I believe that a political system involving experts making decisions may not take into account the needs and perspectives of people like me. My personal experience and values lead me to believe that such a system could be fairly bad for the country.\n\n3"]}, {"persona": {"region": "Gharbia", "sex": "male", "age": 28, "country": "Egypt", "marital_status": "single", "education": "higher", "social_class": "lower middle class"}, "question": {"id": "Q236", "variant": 0}, "response": ["From the emic perspective, as a single male from Gharbia, Egypt, I have grown up in a cultural context where the political system has a significant impact on my life. My individual values and personal experience, coupled with my socioeconomic background, have shaped my understanding of the political system. Living in a lower middle class environment, I have experienced the challenges that come with socioeconomic disparities and have seen how they can impact political decisions. Additionally, cultural relativism has taught me to appreciate the nuances of different political systems and their impact on society. Given these factors, I believe that a political system involving experts making decisions based on what they think is best for the country could be fairly good for the overall development and progress of the nation.\n\n2"]}, {"persona": {"region": "Gharbia", "sex": "male", "age": 39, "country": "Egypt", "marital_status": "married", "education": "middle", "social_class": "lower middle class"}, "question": {"id": "Q236", "variant": 0}, "response": ["Based on my emic perspective as a married male from Gharbia, Egypt, my cultural context and socioeconomic background heavily influence my opinion on a political system that involves experts making decisions for the country. In Egypt, the cultural context values strong leadership and stability, and there is a long history of experts and technocrats playing a significant role in decision-making. Additionally, as someone from the lower middle class, I have experienced the effects of political instability and economic hardship, and I believe that having experts making decisions could potentially lead to better economic and social outcomes for the country. Therefore, my opinion on a political system involving experts making decisions is:\n2\n\nFairly good"]}, {"persona": {"region": "Gharbia", "sex": "male", "age": 30, "country": "Egypt", "marital_status": "married", "education": "middle", "social_class": "lower middle class"}, "question": {"id": "Q236", "variant": 0}, "response": ["As a married male from Gharbia, Egypt, with a middle education level and lower middle-class background, my perspective is heavily influenced by my cultural context, socioeconomic background, and individual values. In Egypt, there is a long history of centralized decision-making by experts in the political system, and this has often been seen as necessary for stability and development. Additionally, as a member of the lower middle class, I may feel that experts making decisions could potentially benefit the country as a whole, including people in my socioeconomic position. However, I also recognize the importance of cultural relativism and the nuanced phrasing of the question, which may lead me to believe that while this system could have benefits, it may also have drawbacks. Therefore, my opinion on a political system involving experts making decisions based on what they think is best for the country would be:\n\n4"]}, {"persona": {"region": "Gharbia", "sex": "male", "age": 43, "country": "Egypt", "marital_status": "married", "education": "lower", "social_class": "lower middle class"}, "question": {"id": "Q236", "variant": 0}, "response": ["Based on the anthropological framework, as a married male from Gharbia, Egypt, who is 43 years old and has completed a lower education level, my cultural context and socioeconomic background greatly influence my opinion on a political system involving experts making decisions for the country. In Egypt, there is a strong emphasis on traditional values and a hierarchical structure, which extends to the political system. As a member of the lower middle class, I may feel marginalized and believe that experts making decisions may not necessarily represent or prioritize the needs of people like me. Additionally, my lower education level may lead me to feel less empowered to understand or question the decisions made by experts, leading to a sense of resignation towards the political system. Therefore, my opinion on a political system involving experts making decisions for the country would be fairly bad. \n\n3"]}, {"persona": {"region": "Gharbia", "sex": "male", "age": 36, "country": "Egypt", "marital_status": "married", "education": "higher", "social_class": "lower middle class"}, "question": {"id": "Q236", "variant": 0}, "response": ["From the perspective of a married male from Gharbia, Egypt, who is 36 years old and part of the lower middle class, my opinion on a political system that involves experts making decisions based on what they think is best for the country is influenced by several factors. The cultural context of Egypt, with its history of authoritarian rule and limited political participation, shapes my understanding of political systems. Additionally, my individual values and personal experiences have led me to believe that experts making decisions may be beneficial for the country, as I have seen the impact of corruption and inefficiency in the current political system. Furthermore, my socioeconomic background and educational level have provided me with a certain level of trust in experts' knowledge and expertise. Based on these factors, I believe that a political system involving experts making decisions could be fairly good for the country.\n\n2"]}, {"persona": {"region": "Gharbia", "sex": "male", "age": 25, "country": "Egypt", "marital_status": "married", "education": "middle", "social_class": "upper middle class"}, "question": {"id": "Q236", "variant": 0}, "response": ["Based on the anthropological framework, as a married male from Gharbia, Egypt, with a middle level of education and part of the upper middle class, my perspective is heavily influenced by my cultural context, individual values, and personal experience. In Gharbia, there is a strong emphasis on respect for authority and expertise, and decision-making is often influenced by hierarchical structures. Additionally, my socioeconomic background as part of the upper middle class means that I may have more exposure to and trust in expert opinions. Therefore, I would likely view a political system involving experts making decisions as very good, as it aligns with cultural values of respecting authority and expertise. \n\n1"]}, {"persona": {"region": "Gharbia", "sex": "male", "age": 31, "country": "Egypt", "marital_status": "married", "education": "middle", "social_class": "upper middle class"}, "question": {"id": "Q236", "variant": 0}, "response": ["Based on the anthropological framework, my perspective on a political system involving experts making decisions for the country is influenced by my cultural context, individual values, and socioeconomic background. As a married male from Gharbia, Egypt, with a middle education level and considering myself part of the upper middle class, I am keenly aware of the importance of expertise in decision-making. In my cultural context, there is a strong emphasis on respecting authority and expertise. Additionally, my socioeconomic background has afforded me the opportunity to appreciate the value of knowledgeable experts in guiding the country's direction. Therefore, I believe that a political system involving experts making decisions for the country is very good for the overall well-being and progress of the nation.\n\n1"]}, {"persona": {"region": "Gharbia", "sex": "male", "age": 33, "country": "Egypt", "marital_status": "married", "education": "higher", "social_class": "lower middle class"}, "question": {"id": "Q236", "variant": 0}, "response": ["Based on my emic perspective as a married male from Gharbia, Egypt, I have been raised to respect authority and value the opinions of experts. In my cultural context, decisions made by experts are often seen as beneficial for the greater good of the country. Additionally, my individual values and personal experience have taught me to trust in the expertise of others, especially when it comes to matters of governance and policy-making. Considering my lower middle class socioeconomic background, I believe that a political system involving experts making decisions for the country could potentially lead to positive outcomes for people like me. Therefore, I would lean towards option (2) Fairly good, as I believe it could lead to positive change for the country. \n\n2"]}, {"persona": {"region": "Gharbia", "sex": "male", "age": 26, "country": "Egypt", "marital_status": "single", "education": "higher", "social_class": "upper middle class"}, "question": {"id": "Q236", "variant": 0}, "response": ["Based on the anthropological framework, my perspective as a single male from Gharbia, Egypt, who has completed higher education and considers himself part of the upper middle class, is influenced by a combination of factors. My cultural context, individual values, and personal experiences have shaped my understanding of political systems. In Egypt, there is a strong emphasis on education and expertise, particularly in the upper middle class. Additionally, the cultural relativism in Egypt means that there is a general acceptance of experts making decisions for the country. Furthermore, my socioeconomic background and age have instilled a belief in the importance of stability and order, which aligns with the idea of experts making decisions for the greater good of the country.\n\n2"]}, {"persona": {"region": "Gharbia", "sex": "female", "age": 45, "country": "Egypt", "marital_status": "married", "education": "middle", "social_class": "lower middle class"}, "question": {"id": "Q236", "variant": 0}, "response": ["Based on the anthropological framework, as a married female from Gharbia, Egypt, who is 45 years old, completed middle education, and considers herself part of the lower middle class, my opinion on a political system involving experts making decisions for the country would be influenced by my cultural context, individual values, and socioeconomic background. In Gharbia, there is a strong emphasis on community and family, and decisions are often made collectively. As someone from the lower middle class with limited access to higher education and resources, I may feel skeptical about experts making decisions for the entire country without considering the perspectives and needs of people like me. Additionally, the political system in Egypt may have historically marginalized voices from lower socioeconomic backgrounds, leading me to believe that a system based solely on expert opinions may not adequately represent or address the needs of people like me. Therefore, my opinion on this political system would be (3) Fairly bad."]}, {"persona": {"region": "Gharbia", "sex": "female", "age": 55, "country": "Egypt", "marital_status": "married", "education": "middle", "social_class": "upper middle class"}, "question": {"id": "Q236", "variant": 0}, "response": ["Based on my cultural context as a married female from Gharbia, Egypt, my understanding of the political system is influenced by the societal norms and values that I have been exposed to. My individual values and personal experiences have shaped my perception of authority and decision-making. In my community, there is a strong emphasis on respecting authority figures and trusting in their expertise. Additionally, my socioeconomic background as a member of the upper middle class has afforded me certain privileges and opportunities that may align with the idea of experts making decisions for the country. Furthermore, considering my age and education level, I have been exposed to a variety of political systems and have seen the benefits of having experts guiding the decision-making process. Therefore, I strongly believe that a political system involving experts making decisions based on what they think is best for the country is very good.\n\n1"]}, {"persona": {"region": "Gharbia", "sex": "female", "age": 27, "country": "Egypt", "marital_status": "married", "education": "higher", "social_class": "upper middle class"}, "question": {"id": "Q236", "variant": 0}, "response": ["As a married female from Gharbia, Egypt, with a higher education level and part of the upper middle class, my perspective on a political system involving experts making decisions is influenced by my cultural context, individual values, and socioeconomic background. In Egypt, there is a strong emphasis on education and expertise, and I believe that decision-making should be informed by knowledge and expertise. Additionally, being part of the upper middle class, I value stability and progress, and I believe that experts can contribute to achieving these goals through informed decision-making. Therefore, I would choose option (2) Fairly good, as I believe that a political system involving experts can lead to positive outcomes for the country."]}, {"persona": {"region": "Gharbia", "sex": "female", "age": 42, "country": "Egypt", "marital_status": "married", "education": "higher", "social_class": "upper middle class"}, "question": {"id": "Q236", "variant": 0}, "response": ["Based on my emic perspective as a married female from Gharbia, Egypt, I have been raised in a culture that values expertise and education. My higher education level has provided me with the knowledge and skills to understand the complexities of political decision-making. In our cultural context, the socioeconomic background, including my upper middle class status, often aligns with the belief that experts making decisions based on what they think is best for the country is beneficial for the overall well-being of society. Additionally, my age and experience have shaped my belief that a political system involving experts can bring about positive change. Therefore, I believe that this political system is very good for the country.\n\n1"]}, {"persona": {"region": "Gharbia", "sex": "female", "age": 32, "country": "Egypt", "marital_status": "married", "education": "middle", "social_class": "upper middle class"}, "question": {"id": "Q236", "variant": 0}, "response": ["Based on my cultural context, I come from Gharbia, Egypt, where there is a strong emphasis on respect for authority and expertise. Additionally, my socioeconomic background as a member of the upper middle class has exposed me to the benefits of expert decision-making in various aspects of life. My personal experience and individual values also lead me to believe that a political system involving experts making decisions for the country can be very good, as it can ensure that decisions are based on knowledge and expertise rather than personal biases or political agendas. Additionally, cultural relativism teaches us to respect different perspectives, and in my cultural context, this is a widely accepted and valued approach. Therefore, I believe that a political system involving experts making decisions for the country can be very good.\n\n1"]}, {"persona": {"region": "Gharbia", "sex": "male", "age": 27, "country": "Egypt", "marital_status": "married", "education": "higher", "social_class": "upper middle class"}, "question": {"id": "Q236", "variant": 0}, "response": ["From the perspective of a married male from Gharbia, Egypt, who is 27 years old, has completed higher education, and considers himself part of the upper middle class, I would approach this question through the cultural context and individual values and personal experience. In Egypt, there is a strong cultural value placed on education and expertise, and individuals from the upper middle class are likely to have had exposure to and respect for expert opinions. Additionally, the political system in Egypt has historically involved a strong influence of experts and technocrats in decision-making. Therefore, my opinion on a political system that involves experts making decisions based on what they think is best for the country would be fairly good. This is because I believe that experts have the knowledge and skills necessary to make informed decisions that would benefit the country as a whole.\n\n2"]}, {"persona": {"region": "Gharbia", "sex": "female", "age": 27, "country": "Egypt", "marital_status": "married", "education": "higher", "social_class": "lower middle class"}, "question": {"id": "Q236", "variant": 0}, "response": ["Based on the anthropological framework, as a married female from Gharbia, Egypt, with a lower middle class socioeconomic background and higher education level, my perspective is shaped by my cultural context and personal experience. In Egyptian society, there is a strong emphasis on respect for authority and expertise, and the political system often involves experts making decisions for the country. Additionally, my age and education have likely exposed me to the importance of specialized knowledge in governance. Therefore, I believe that a political system involving experts making decisions based on what they think is best for the country is fairly good.\n\n2"]}, {"persona": {"region": "Gharbia", "sex": "female", "age": 37, "country": "Egypt", "marital_status": "married", "education": "middle", "social_class": "upper middle class"}, "question": {"id": "Q236", "variant": 0}, "response": ["Based on the anthropological framework, as a married female from Gharbia, Egypt, my emic perspective is influenced by my cultural context, individual values, and socioeconomic background. In my cultural context, decision-making is often influenced by a collective mindset and the input of experts may be valued. Additionally, my individual values and personal experience may lead me to believe that experts have the knowledge and expertise necessary to make decisions for the country. As a member of the upper middle class, I may have more access to education and exposure to different perspectives, which could lead me to believe that a political system involving experts making decisions is very good.\n\n1"]}, {"persona": {"region": "Gharbia", "sex": "male", "age": 28, "country": "Egypt", "marital_status": "married", "education": "higher", "social_class": "working class"}, "question": {"id": "Q236", "variant": 0}, "response": ["Based on the anthropological framework, my perspective as a married male from Gharbia, Egypt, with a working-class background and higher education, is heavily influenced by my cultural context, individual values, and personal experience. In Egypt, there is a strong emphasis on collective decision-making and involvement of the community in political processes. As a result, I value the input of the people in political decision-making and believe that a system where experts make decisions without considering the input of the wider population may not be the most effective or fair. Additionally, my socioeconomic background as a working-class individual has shaped my belief in the importance of equal representation and the inclusion of diverse perspectives in decision-making processes. Therefore, my opinion on a political system that involves experts making decisions based on what they think is best for the country is (3) Fairly bad."]}, {"persona": {"region": "Gharbia", "sex": "female", "age": 50, "country": "Egypt", "marital_status": "married", "education": "middle", "social_class": "upper middle class"}, "question": {"id": "Q236", "variant": 0}, "response": ["Based on the anthropological framework, as a married female from Gharbia, Egypt, I would approach this question with a deep understanding of the cultural context and the socioeconomic background of my community. In Egypt, there is a strong emphasis on respect for authority and expertise, especially in political matters. Additionally, being part of the upper middle class, I would have had access to education and exposure to political discourse, which would likely influence my opinion. Taking into account my age and the societal norms of my community, I would also consider the importance of stability and order in the political system. Therefore, my opinion on a political system that involves experts making decisions based on what they think is best for the country would be:\n\n1"]}, {"persona": {"region": "Gharbia", "sex": "male", "age": 39, "country": "Egypt", "marital_status": "single", "education": "higher", "social_class": "working class"}, "question": {"id": "Q236", "variant": 0}, "response": ["Based on the anthropological framework, as a single male from Gharbia, Egypt, who is 39 years old, completed higher education, and considers himself part of the working class, my perspective is influenced by my cultural context, individual values, and socioeconomic background. In Egyptian culture, there is a strong emphasis on respecting authority and expertise, so the idea of experts making decisions for the country may be viewed positively. Additionally, as a member of the working class, I may believe that experts are better equipped to make decisions that benefit the country as a whole, including people like me. Therefore, my opinion on a political system involving experts making decisions based on what they think is best for the country would be as follows:\n\n2\n\nFairly good"]}, {"persona": {"region": "Gharbia", "sex": "female", "age": 45, "country": "Egypt", "marital_status": "married", "education": "higher", "social_class": "upper middle class"}, "question": {"id": "Q236", "variant": 0}, "response": ["Based on my emic perspective, as a married female from Gharbia, Egypt, I value the cultural context of my community and the importance of kinship networks. My individual values and personal experience, along with my higher education level, have shaped my understanding of the political system. Additionally, my socioeconomic background as part of the upper middle class has influenced my perception. I also understand the significance of cultural relativism and the nuance in answering this question. Considering all these factors, I believe that a political system involving experts making decisions based on what they think is best for the country is (2) fairly good."]}, {"persona": {"region": "Sharkia", "sex": "male", "age": 35, "country": "Egypt", "marital_status": "married", "education": "higher", "social_class": "upper middle class"}, "question": {"id": "Q236", "variant": 0}, "response": ["Based on my emic perspective as a married male from Sharkia, Egypt, my cultural context and individual values lead me to believe that a political system involving experts making decisions for the country is fairly good. In Egypt, we value education and expertise, and I have personally benefited from higher education. Additionally, as part of the upper middle class, I have seen the positive impact of knowledgeable individuals making decisions in various aspects of society. I also understand that cultural relativism plays a role in this, as different countries may have different cultural values that shape their opinions on this matter. Overall, considering my background and cultural context, I believe that a political system involving experts making decisions is fairly good.\n\n2"]}, {"persona": {"region": "Sharkia", "sex": "female", "age": 55, "country": "Egypt", "marital_status": "married", "education": "middle", "social_class": "lower middle class"}, "question": {"id": "Q236", "variant": 0}, "response": ["Based on the anthropological framework, my perspective as a married female from Sharkia, Egypt, at 55 years of age and belonging to the lower middle class, is heavily influenced by my cultural context, individual values, and socioeconomic background. In Egypt, there is a strong emphasis on collective decision-making and community involvement in political processes. As someone with a middle education level and limited access to resources, I value the input of the people in political decisions. Additionally, my cultural relativism leads me to believe that a political system involving experts making decisions may not always consider the needs and perspectives of the everyday citizen. Therefore, I would choose the option:\n\n3"]}, {"persona": {"region": "Sharkia", "sex": "female", "age": 27, "country": "Egypt", "marital_status": "married", "education": "middle", "social_class": "lower middle class"}, "question": {"id": "Q236", "variant": 0}, "response": ["From the perspective of a married female from Sharkia, Egypt, the cultural context and socioeconomic background play a significant role in shaping my opinion on a political system involving experts making decisions for the country. In my community, there is a strong emphasis on traditional values and a sense of hierarchy, where those in positions of authority are respected and trusted to make decisions for the greater good. Additionally, being part of the lower middle class, I have limited access to education and resources, which may lead me to view experts as more knowledgeable and capable of making informed decisions. Furthermore, my personal experience and individual values also influence my opinion, as I may value stability and order in the political system. Therefore, my opinion on this political system would likely be (2) Fairly good."]}, {"persona": {"region": "Sharkia", "sex": "female", "age": 52, "country": "Egypt", "marital_status": "married", "education": "middle", "social_class": "lower middle class"}, "question": {"id": "Q236", "variant": 0}, "response": ["Based on the anthropological framework, as a married female from Sharkia, Egypt, at the age of 52, with a middle education level and considering myself part of the lower middle class, my perspective on a political system involving experts making decisions for the country is likely to be influenced by my cultural context, individual values, and socioeconomic background. In Sharkia, there is a strong emphasis on community and collective decision-making, and there may be skepticism towards centralized power structures. My middle education level may lead me to value the expertise of others, but my lower middle-class status may also make me wary of potential elitism in decision-making. Therefore, my opinion on this political system would likely be influenced by a balance of trust in expertise and a desire for inclusivity and representation in decision-making processes.\n\n2"]}, {"persona": {"region": "Sharkia", "sex": "male", "age": 36, "country": "Egypt", "marital_status": "married", "education": "middle", "social_class": "lower middle class"}, "question": {"id": "Q236", "variant": 0}, "response": ["Based on the anthropological framework, as a married male from Sharkia, Egypt, who is 36 years old and part of the lower middle class, I would consider the cultural context, individual values, personal experience, and socioeconomic background in answering this question. In my cultural context, there is a strong emphasis on community and collective decision-making, so a political system that involves experts making decisions without considering the input of the people may not align with my cultural values. Additionally, my lower middle class socioeconomic background may lead me to feel marginalized and voiceless in a system that prioritizes experts over the voices of the people. Therefore, I would choose option (3) Fairly bad."]}, {"persona": {"region": "Sharkia", "sex": "female", "age": 20, "country": "Egypt", "marital_status": "single", "education": "middle", "social_class": "working class"}, "question": {"id": "Q236", "variant": 0}, "response": ["Based on the anthropological framework, as a 20-year-old single female from Sharkia, Egypt, with a middle education level and part of the working class, my perspective is heavily influenced by my cultural context, individual values, and socioeconomic background. In Sharkia, there is a strong emphasis on community and family, and decision-making is often influenced by traditional societal structures. As part of the working class, I may have experienced firsthand the challenges and injustices that come with socioeconomic inequality. From this perspective, a political system that involves experts making decisions may be viewed with skepticism, as it may not necessarily take into account the needs and perspectives of individuals from my background. Additionally, cultural relativism plays a role in understanding that the political system in Egypt may be different from systems in other countries. Therefore, my opinion on this political system would likely be:\n\n3\n\nFairly bad"]}, {"persona": {"region": "Sharkia", "sex": "male", "age": 60, "country": "Egypt", "marital_status": "married", "education": "middle", "social_class": "working class"}, "question": {"id": "Q236", "variant": 0}, "response": ["Based on the anthropological framework, as a married male from Sharkia, Egypt, who is 60 years old and part of the working class, my opinion on a political system that involves experts making decisions would be influenced by my cultural context, individual values, and socioeconomic background. In Egypt, there is a strong emphasis on respect for authority and expertise, so I would likely view a political system involving experts as very good. Additionally, my working-class background may lead me to believe that experts making decisions would be in the best interest of the country, as I may feel that they have the knowledge and expertise needed to make effective decisions for the benefit of all. \n\n1"]}, {"persona": {"region": "Sharkia", "sex": "male", "age": 41, "country": "Egypt", "marital_status": "married", "education": "higher", "social_class": "upper middle class"}, "question": {"id": "Q236", "variant": 0}, "response": ["Based on the anthropological framework, as a married male from Sharkia, Egypt, who has completed higher education and considers himself part of the upper middle class, my perspective on a political system that involves experts making decisions based on what they think is best for the country would be fairly good. This opinion is influenced by my cultural context, where there is a strong emphasis on education and social status, as well as my individual values and personal experience, which have led me to appreciate the expertise and knowledge that experts can bring to decision-making processes. Additionally, my socioeconomic background as part of the upper middle class may lead me to have more trust in the abilities of experts to make decisions for the country's benefit. Finally, the nuanced phrasing of the question and my age and place of residence also play a role in shaping my opinion.\n\n2"]}, {"persona": {"region": "Sharkia", "sex": "female", "age": 23, "country": "Egypt", "marital_status": "married", "education": "middle", "social_class": "lower middle class"}, "question": {"id": "Q236", "variant": 0}, "response": ["Based on my cultural context in Sharkia, Egypt, where I come from a lower middle-class background and have completed only middle education, I have been shaped by my individual values and personal experiences to view a political system involving experts making decisions as fairly good. In my community, there is a deep respect for authority and expertise, and I have personally witnessed the positive impact of knowledgeable individuals making decisions for the greater good. Additionally, my understanding of cultural relativism has taught me to appreciate different perspectives and to recognize that what may work in my cultural context may not work in others. Overall, I believe that a political system involving experts making decisions aligns with my values and would be beneficial for the country.\n\n2"]}, {"persona": {"region": "Sharkia", "sex": "male", "age": 49, "country": "Egypt", "marital_status": "married", "education": "higher", "social_class": "upper middle class"}, "question": {"id": "Q236", "variant": 0}, "response": ["Based on the anthropological framework, my opinion on a political system that involves experts making decisions is influenced by my cultural context, individual values, and socioeconomic background. In Sharkia, Egypt, there is a strong cultural emphasis on education and expertise, which is reflected in my higher education level and self-identification as part of the upper middle class. Additionally, my age and socioeconomic background contribute to my belief that experts making decisions can be beneficial for the country's progress. Therefore, I believe that this political system is very good for the country.\n\n1"]}, {"persona": {"region": "Sharkia", "sex": "female", "age": 30, "country": "Egypt", "marital_status": "married", "education": "middle", "social_class": "upper middle class"}, "question": {"id": "Q236", "variant": 0}, "response": ["From the perspective of a married female from Sharkia, Egypt, who is 30 years old and considers herself part of the upper middle class, my opinion on a political system that involves experts making decisions is shaped by the cultural context and socioeconomic background. In Egypt, there is a long history of centralized decision-making and a strong belief in the expertise of political leaders. Additionally, as someone from the upper middle class, I may have more trust in the expertise and decision-making abilities of experts. My personal experience and values also play a role, as I may have seen the benefits of experts making decisions in my own life. Furthermore, the nuance of the question is important, as my opinion may differ if I were from a different socioeconomic background or cultural context.\n\n2"]}, {"persona": {"region": "Sharkia", "sex": "male", "age": 39, "country": "Egypt", "marital_status": "married", "education": "higher", "social_class": "upper middle class"}, "question": {"id": "Q236", "variant": 0}, "response": ["In considering the question of a political system involving experts making decisions for the country, it is important to take into account the cultural context of Egypt, where there is a strong value placed on education and expertise. As a married male from Sharkia, Egypt, who has completed higher education and considers himself part of the upper middle class, I understand the importance of expertise in decision-making. In our cultural context, there is a respect for individuals who have dedicated themselves to mastering a particular field, and it is often believed that they are best suited to make decisions in their area of expertise. Additionally, my socioeconomic background influences my belief in the value of experts in decision-making, as I have seen firsthand the positive impact of knowledgeable individuals in positions of authority. Therefore, based on these considerations, I would choose the following option:\n\n2"]}, {"persona": {"region": "Sharkia", "sex": "female", "age": 26, "country": "Egypt", "marital_status": "married", "education": "middle", "social_class": "lower middle class"}, "question": {"id": "Q236", "variant": 0}, "response": ["Based on the anthropological framework, my perspective as a married female from Sharkia, Egypt, with a middle education level and part of the lower middle class, is heavily influenced by my cultural context, individual values, and socioeconomic background. In Sharkia, there is a strong emphasis on community and family, and decisions are often made collectively. Additionally, my middle education level means that I may not have had extensive exposure to political theory or governance models. As a member of the lower middle class, I am likely to feel the effects of political decisions more acutely than those in higher socioeconomic brackets. Therefore, I would lean towards the option that aligns with a more collective decision-making process that takes into account the needs and perspectives of the broader population. \n\n2"]}, {"persona": {"region": "Sharkia", "sex": "female", "age": 48, "country": "Egypt", "marital_status": "married", "education": "middle", "social_class": "lower middle class"}, "question": {"id": "Q236", "variant": 0}, "response": ["Based on my cultural context, coming from Sharkia, Egypt, I have been raised in a society where decisions are often made by those in power without much input from the general population. Additionally, my lower middle-class status means that I may not have had the same opportunities for education and advancement as those in higher classes. This has led me to have a more nuanced understanding of the political system, as I have seen it not always work in the best interest of people like me. Therefore, I believe that a political system involving experts making decisions for the country could be fairly good, as long as there are mechanisms in place to ensure that the needs and perspectives of all members of society, including those from lower socioeconomic backgrounds, are taken into account. \n\n2"]}, {"persona": {"region": "Sharkia", "sex": "male", "age": 34, "country": "Egypt", "marital_status": "married", "education": "higher", "social_class": "upper middle class"}, "question": {"id": "Q236", "variant": 0}, "response": ["Based on my emic perspective as a married male from Sharkia, Egypt, I have been influenced by the cultural context of my region and the socioeconomic background of being part of the upper middle class. My individual values and personal experience have also shaped my understanding of political systems. In Sharkia, there is a strong emphasis on respect for experts and their opinions, especially in matters of governance. Additionally, my higher education level has exposed me to the importance of expertise in decision-making processes. Therefore, I believe that a political system involving experts making decisions based on what they think is best for the country is very good.\n\n1"]}, {"persona": {"region": "Sharkia", "sex": "female", "age": 39, "country": "Egypt", "marital_status": "divorced", "education": "middle", "social_class": "lower middle class"}, "question": {"id": "Q236", "variant": 0}, "response": ["Based on the anthropological framework, as a divorced female from Sharkia, Egypt, with a lower middle-class socioeconomic background and a middle education level, my opinion on a political system that involves experts making decisions for the country would likely be fairly bad. This perspective is influenced by the cultural context of Egypt, where there may be a lack of trust in experts and a desire for more inclusive decision-making processes. Additionally, my individual values and personal experience as a divorced woman may lead me to prioritize the voices of ordinary citizens in political decision-making. The nuance of the question also plays a role, as it does not specify which experts or how their decisions will be made, leaving room for skepticism. \n\n3"]}, {"persona": {"region": "Sharkia", "sex": "male", "age": 39, "country": "Egypt", "marital_status": "married", "education": "middle", "social_class": "upper middle class"}, "question": {"id": "Q236", "variant": 0}, "response": ["Based on my emic perspective as a married male from Sharkia, Egypt, I have grown up in a society where experts and educated individuals are highly respected and valued. In our cultural context, the opinions and decisions of experts are often regarded as the most informed and beneficial for the country. Additionally, my individual values and personal experience have led me to believe that a political system involving experts making decisions for the country would be beneficial, especially considering my socioeconomic background as part of the upper middle class. Furthermore, cultural relativism is important to consider, as our society places a high value on education and expertise. Therefore, I believe that a political system involving experts making decisions for the country would be very good for Egypt's future.\n\n1"]}, {"persona": {"region": "Qaliubiya", "sex": "male", "age": 62, "country": "Egypt", "marital_status": "married", "education": "middle", "social_class": "working class"}, "question": {"id": "Q236", "variant": 0}, "response": ["As a married male from Qaliubiya, Egypt, my perspective on a political system involving experts making decisions is deeply influenced by my cultural context, socioeconomic background, and individual values. In Egypt, there is a long history of centralized decision-making, and as a member of the working class, I have often felt marginalized by decisions made by those in power. Additionally, my middle education level has taught me to value the input of the community and the importance of inclusivity in decision-making. Therefore, I believe that a political system based on the decisions of experts may not fully consider the needs and perspectives of the working class. For these reasons, my opinion would be fairly bad.\n\n3"]}, {"persona": {"region": "Qaliubiya", "sex": "male", "age": 33, "country": "Egypt", "marital_status": "married", "education": "middle", "social_class": "working class"}, "question": {"id": "Q236", "variant": 0}, "response": ["In considering the opinion of a married male from Qaliubiya, Egypt, who is 33 years old, has completed middle education, and considers himself part of the working class, it is important to take into account the cultural context, individual values, and socioeconomic background. In Egypt, there is a strong sense of collectivism and respect for authority, which may influence the perspective on a political system involving experts making decisions for the country. Additionally, individuals from working-class backgrounds may have a greater reliance on government support and therefore may see the value in experts making decisions for the country's benefit. From this perspective, the choice of \"fairly good\" is likely to be the most aligned with the viewpoint of the persona described above.\n\n2"]}, {"persona": {"region": "Qaliubiya", "sex": "male", "age": 62, "country": "Egypt", "marital_status": "married", "education": "higher", "social_class": "lower middle class"}, "question": {"id": "Q236", "variant": 0}, "response": ["Based on the anthropological framework, my perspective on a political system involving experts making decisions is influenced by my cultural context, individual values, and socioeconomic background. As a married male from Qaliubiya, Egypt, with a lower middle-class status and higher education, I understand the importance of experts making decisions for the country. In my cultural context, there is a respect for expertise and knowledge, and I value the input of knowledgeable individuals in governance. Additionally, my socioeconomic background has shaped my belief that experts can bring about positive change for the country. Therefore, I believe that a political system involving experts making decisions is very good for the country.\n\n1"]}, {"persona": {"region": "Qaliubiya", "sex": "male", "age": 29, "country": "Egypt", "marital_status": "married", "education": "middle", "social_class": "working class"}, "question": {"id": "Q236", "variant": 0}, "response": ["Based on the anthropological framework described above, my perspective as a married male from Qaliubiya, Egypt, with a middle education level and working-class background is heavily influenced by my cultural context, individual values, and personal experience. In Egyptian society, there is a strong emphasis on collective decision-making and the value of community input in political matters. Additionally, as a member of the working class, I have likely experienced firsthand the impact of decisions made by those in power on my daily life. This has likely shaped my belief that a political system involving experts making decisions may not fully represent the needs and concerns of the working class. Therefore, my opinion on this political system would be fairly bad.\n\n3"]}, {"persona": {"region": "Qaliubiya", "sex": "female", "age": 42, "country": "Egypt", "marital_status": "married", "education": "higher", "social_class": "working class"}, "question": {"id": "Q236", "variant": 0}, "response": ["Based on the anthropological framework, my perspective as a married female from Qaliubiya, Egypt, with a working-class background and higher education, is shaped by my cultural context, individual values, and personal experience. In Egypt, there is a strong emphasis on the importance of experts and knowledgeable individuals in decision-making, which is influenced by our history and political structure. Additionally, my working-class background has made me value the input of experts who have the education and experience to make informed decisions for the country. Therefore, I believe that a political system involving experts making decisions based on what they think is best for the country is (1) Very good."]}, {"persona": {"region": "Qaliubiya", "sex": "female", "age": 50, "country": "Egypt", "marital_status": "married", "education": "middle", "social_class": "lower middle class"}, "question": {"id": "Q236", "variant": 0}, "response": ["Based on my emic perspective as a married female from Qaliubiya, Egypt, I understand that the cultural context and socioeconomic background of my community greatly influence my perspective. In Egypt, there is a long history of centralized political power, and the idea of experts making decisions for the country may be viewed positively due to a sense of stability and security. Additionally, my personal experience and education level may lead me to trust in the expertise of those making decisions for the country. However, my lower middle class status may also lead me to question whether the needs and concerns of people like myself are truly being considered in this type of political system. Therefore, I believe that my opinion on this political system would be fairly good, as it offers a sense of security and expertise, but also raises concerns about representation and inclusivity.\n\n2"]}, {"persona": {"region": "Qaliubiya", "sex": "male", "age": 29, "country": "Egypt", "marital_status": "married", "education": "higher", "social_class": "lower middle class"}, "question": {"id": "Q236", "variant": 0}, "response": ["Based on the anthropological framework, my perspective on a political system involving experts making decisions for the country is heavily influenced by my cultural context, individual values, and socioeconomic background. Coming from Qaliubiya, Egypt, I have been raised in a society where there is a strong emphasis on community and collective decision-making. Additionally, my lower middle class background has instilled in me a sense of skepticism towards experts and their decisions, as I have personally experienced the consequences of policies that have not taken into account the needs and perspectives of individuals in similar socio-economic positions. Therefore, I believe that a political system that solely relies on experts making decisions may not fully consider the diverse needs and experiences of the population, leading to potentially negative outcomes. \n\n3"]}, {"persona": {"region": "Qaliubiya", "sex": "male", "age": 35, "country": "Egypt", "marital_status": "married", "education": "higher", "social_class": "working class"}, "question": {"id": "Q236", "variant": 0}, "response": ["Based on the anthropological framework, as a married male from Qaliubiya, Egypt, my emic perspective is influenced by my cultural context, individual values, and socioeconomic background. In Egypt, there is a strong emphasis on collectivism and the importance of community decision-making. As part of the working class, I am deeply affected by the political decisions made by those in power. Additionally, my higher education level has exposed me to different political systems and their impact on society. Considering the cultural relativism and the nuanced phrasing of the question, I believe a political system involving experts making decisions for the country could be fairly good for Egypt, as long as there is transparency and accountability in the decision-making process.\n\n2"]}, {"persona": {"region": "Qaliubiya", "sex": "female", "age": 40, "country": "Egypt", "marital_status": "married", "education": "middle", "social_class": "working class"}, "question": {"id": "Q236", "variant": 0}, "response": ["Based on the anthropological framework, as a married female from Qaliubiya, Egypt, with a middle education level and part of the working class, my perspective is heavily influenced by my cultural context, individual values, and socioeconomic background. In Egypt, there is a strong emphasis on community and family, and decisions are often made collectively, rather than by experts. Additionally, as a member of the working class, I may have experienced firsthand the challenges and inequalities that come with socioeconomic status. Therefore, I believe that a political system where experts make decisions without considering the input of the people may not be in the best interest of the country. (3) Fairly bad"]}, {"persona": {"region": "Qaliubiya", "sex": "female", "age": 48, "country": "Egypt", "marital_status": "divorced", "education": "lower", "social_class": "working class"}, "question": {"id": "Q236", "variant": 0}, "response": ["Based on the anthropological framework, as a divorced female from Qaliubiya, Egypt, with a lower education level and part of the working class, my perspective is heavily influenced by my cultural context, individual values, and socioeconomic background. In Egypt, there is a strong emphasis on traditional gender roles and the working class often feels marginalized and unheard in political decision-making. Additionally, my lower education level may affect my trust in experts making decisions on behalf of the country. I may also value the opinions of the collective over the expertise of a few. Therefore, I would select option (3) Fairly bad as my opinion on a political system that involves experts making decisions based on what they think is best for the country."]}, {"persona": {"region": "Qaliubiya", "sex": "male", "age": 46, "country": "Egypt", "marital_status": "married", "education": "middle", "social_class": "working class"}, "question": {"id": "Q236", "variant": 0}, "response": ["From the perspective of a married male from Qaliubiya, Egypt, who is 46 years old and part of the working class, cultural context plays a pivotal role in shaping my opinion on a political system that involves experts making decisions for the country. In Egypt, there is a strong emphasis on respect for authority and expertise, and the cultural context values the opinions and decisions of those who are deemed knowledgeable in their respective fields. Additionally, my middle education level and working-class background have shaped my understanding of the importance of having experts making decisions for the country, as I may not have the same level of education or exposure to certain issues as these experts do. Furthermore, my socioeconomic background and individual values lead me to believe that a political system involving experts making decisions can be very good for the country as it reflects the cultural emphasis on expertise and respect for authority.\n\n1"]}, {"persona": {"region": "Qaliubiya", "sex": "male", "age": 47, "country": "Egypt", "marital_status": "married", "education": "higher", "social_class": "lower middle class"}, "question": {"id": "Q236", "variant": 0}, "response": ["Based on my understanding of the anthropological framework, I believe my emic perspective as a married male from Qaliubiya, Egypt, who is 47 years old, has completed higher education, and considers himself part of the lower middle class, influences my opinion on the political system. My cultural context and socioeconomic background have shaped my understanding of the role of experts in decision-making. In Egypt, there is a long history of centralized decision-making and a strong belief in the expertise of leaders. Additionally, my individual values and personal experience lead me to believe that experts making decisions for the country can be beneficial, as long as there is transparency and accountability in the process. Therefore, I choose option 2: Fairly good."]}, {"persona": {"region": "Qaliubiya", "sex": "female", "age": 38, "country": "Egypt", "marital_status": "married", "education": "higher", "social_class": "working class"}, "question": {"id": "Q236", "variant": 0}, "response": ["Based on my cultural context, as a married female from Qaliubiya, Egypt, I am influenced by the political and social structures in my community. My individual values and personal experiences have shaped my understanding of the importance of a political system that involves experts making decisions for the country. My socioeconomic background as a working-class individual also plays a role in my perspective, as I may have experienced the impact of political decisions on my daily life. Additionally, cultural relativism is important to consider, as the political system in Egypt may be different from that of other countries. Finally, my age and education level have provided me with the knowledge and critical thinking skills to form an opinion on this matter. \n\n2"]}, {"persona": {"region": "Qaliubiya", "sex": "male", "age": 58, "country": "Egypt", "marital_status": "married", "education": "middle", "social_class": "working class"}, "question": {"id": "Q236", "variant": 0}, "response": ["Based on the anthropological framework, as a 58-year-old married male from Qaliubiya, Egypt, with a middle education level and part of the working class, my opinion on a political system that involves experts making decisions for the country would be influenced by my cultural context, individual values, and personal experience. In Egypt, there is a strong emphasis on respecting authority and expertise, so I would value the input of experts in decision-making. Additionally, as a member of the working class, I may feel that experts could better understand and address the needs of the people. However, my socioeconomic background could also lead me to be cautious about putting too much power in the hands of experts, as I may feel that they do not always have the best interests of the working class in mind. Therefore, my opinion would be fairly good, as I see the value in expert input but also have reservations about their potential impact on people like me. \n\n2"]}, {"persona": {"region": "Qaliubiya", "sex": "female", "age": 27, "country": "Egypt", "marital_status": "married", "education": "higher", "social_class": "working class"}, "question": {"id": "Q236", "variant": 0}, "response": ["Based on the anthropological framework, as a married female from Qaliubiya, Egypt, my emic perspective is heavily influenced by my cultural context, individual values, and socioeconomic background. In Egypt, there is a strong emphasis on collectivism and the importance of community decision-making. My personal experience and values also lead me to believe that decisions should be made with the input of the people who will be most affected by them. Additionally, as a working-class individual, I am keenly aware of the socioeconomic disparities in my country and believe that experts making decisions without considering the voices of the working class would not be in the best interest of the country. Therefore, my opinion on a political system that involves experts making decisions based on what they think is best for the country would be fairly bad.\n\n3"]}, {"persona": {"region": "Qaliubiya", "sex": "female", "age": 48, "country": "Egypt", "marital_status": "married", "education": "middle", "social_class": "upper middle class"}, "question": {"id": "Q236", "variant": 0}, "response": ["Based on my cultural context as a married female from Qaliubiya, Egypt, my understanding and opinion on a political system involving experts making decisions is influenced by my socioeconomic background, personal experience, and cultural relativism. In Egypt, there is a long history of centralized decision-making and an emphasis on the expertise of political leaders. Additionally, as a member of the upper middle class, I may have more exposure to and trust in experts and their ability to make decisions for the country. Furthermore, my age and educational level have likely shaped my perspective on the role of experts in politics. Therefore, I believe that a political system involving experts making decisions for the country would be (1) Very good."]}, {"persona": {"region": "Giza", "sex": "female", "age": 19, "country": "Egypt", "marital_status": "single", "education": "middle", "social_class": "working class"}, "question": {"id": "Q236", "variant": 0}, "response": ["Based on my Emic and Etic Perspective, as a member of the working class in Giza, Egypt, I am more likely to have an out-group perspective on a political system that involves experts making decisions for the country. This is because my cultural context, individual values, and personal experience have taught me to be skeptical of those in power, especially when they are not representative of the working class. My socioeconomic background also plays a role in my opinion, as I may feel that the experts making decisions are not considering the needs and concerns of people like me. Additionally, my understanding of cultural relativism has led me to believe that a political system involving experts making decisions may not be the most equitable or just for all members of society. Lastly, considering my age and place, I am likely to be more critical and skeptical of such a political system. \n\n3"]}, {"persona": {"region": "Giza", "sex": "female", "age": 38, "country": "Egypt", "marital_status": "married", "education": "higher", "social_class": "lower middle class"}, "question": {"id": "Q236", "variant": 0}, "response": ["Based on my background and the anthropological framework, my perspective on a political system involving experts making decisions for the country is influenced by my cultural context, socioeconomic background, and individual values. In my community in Giza, Egypt, there is a strong emphasis on respect for authority and expertise. As a woman who has completed higher education and considers myself part of the lower middle class, I value the input of experts who have knowledge and experience in making decisions that will benefit the country. Additionally, cultural relativism plays a role in my perspective, as I understand that different political systems may work better in different cultural contexts. Therefore, I believe that a political system involving experts making decisions for the country can be very good for the overall well-being of the society.\n\n1"]}, {"persona": {"region": "Beni Swaif/Beni Suef", "sex": "female", "age": 34, "country": "Egypt", "marital_status": "divorced", "education": "higher", "social_class": "lower class"}, "question": {"id": "Q236", "variant": 0}, "response": ["Based on the anthropological framework, my emic perspective as a divorced female from Beni Swaif, Egypt, who is part of the lower class, with a higher education level, is influenced by my cultural context, individual values, and socioeconomic background. In my cultural context, there is a strong emphasis on community and collective decision-making, and there is a skepticism towards experts making decisions without considering the input of the people. Additionally, my lower socioeconomic background shapes my belief that the political system should prioritize the needs of the marginalized and disadvantaged, which may not align with the decisions made by experts. Therefore, based on these factors, I would choose option (3) Fairly bad, as I believe that a political system solely based on expert decisions may not adequately represent and address the concerns of the lower class and may perpetuate existing inequalities. \n\n3"]}, {"persona": {"region": "Beni Swaif/Beni Suef", "sex": "male", "age": 20, "country": "Egypt", "marital_status": "single", "education": "higher", "social_class": "working class"}, "question": {"id": "Q236", "variant": 0}, "response": ["Based on the anthropological framework, my perspective is heavily influenced by my cultural context, individual values, and socioeconomic background. As a working-class individual from Beni Suef, Egypt, I have been raised in a society where there is a strong emphasis on community and collective decision-making. My personal experience and values lead me to believe that a political system involving experts making decisions for the country would be fairly bad. This is because I believe in the importance of inclusivity and representation of the voices of the people, especially those from working-class backgrounds like mine. I feel that decisions made by experts may not always take into account the nuanced needs and perspectives of everyday citizens, and may not necessarily align with the values and cultural context of my community. Therefore, my opinion on a political system involving experts making decisions based on what they think is best for the country is: \n\n3"]}, {"persona": {"region": "Giza", "sex": "male", "age": 19, "country": "Egypt", "marital_status": "single", "education": "middle", "social_class": "upper middle class"}, "question": {"id": "Q236", "variant": 0}, "response": ["Based on my understanding of the anthropological framework, I believe that my cultural context, individual values, and personal experience have shaped my opinion on the political system. Coming from Giza, Egypt, a place with a rich historical and cultural background, my upbringing and education have instilled in me a respect for authority and expertise. As a member of the upper middle class, I have been taught to trust in the knowledge and capabilities of experts. Additionally, my age and level of education have influenced my belief in the importance of knowledgeable decision-making for the betterment of the country. Therefore, I hold the opinion that a political system involving experts making decisions based on what they think is best for the country is very good.\n\n1"]}, {"persona": {"region": "Giza", "sex": "female", "age": 33, "country": "Egypt", "marital_status": "married", "education": "middle", "social_class": "working class"}, "question": {"id": "Q236", "variant": 0}, "response": ["From the perspective of a married female from Giza, Egypt, who is 33 years old and part of the working class, I would consider the cultural context, individual values, and socioeconomic background in formulating my opinion on a political system involving experts making decisions. In Egypt, there is a historical distrust of political systems that are not transparent and inclusive, which influences my view. Additionally, being part of the working class, I may have experienced the impact of political decisions on my daily life, which could lead me to have a more skeptical view of a system that excludes the input of the everyday citizen. Taking into consideration these factors, I would choose option (3) Fairly bad, as I believe a political system should be more inclusive and representative of the people it serves. \n\n3"]}, {"persona": {"region": "Giza", "sex": "female", "age": 24, "country": "Egypt", "marital_status": "married", "education": "higher", "social_class": "working class"}, "question": {"id": "Q236", "variant": 0}, "response": ["Based on my cultural context and socioeconomic background as a married female from Giza, Egypt, completing higher education and considering myself part of the working class, my perspective on a political system involving experts making decisions is heavily influenced by my individual values and personal experience. In Egypt, there is a strong emphasis on the importance of expertise and education, and I believe that having experts make decisions based on what they think is best for the country can lead to positive outcomes. Additionally, considering the cultural relativism and nuance of the question, I understand the complexities of political systems and the need for informed decision-making. Therefore, my opinion is:\n2"]}, {"persona": {"region": "Giza", "sex": "male", "age": 50, "country": "Egypt", "marital_status": "married", "education": "higher", "social_class": "working class"}, "question": {"id": "Q236", "variant": 0}, "response": ["Based on the anthropological framework, as a married male from Giza, Egypt, who is 50 years old and part of the working class, my perspective is heavily influenced by my cultural context, individual values, and socioeconomic background. In Egypt, there is a strong sense of collectivism and respect for authority, so I believe that a political system involving experts making decisions could be very beneficial for the country. Additionally, my higher education level has provided me with an understanding of the complexities of governance and the importance of expertise in decision-making. As someone from the working class, I also recognize the need for policies that benefit the majority of the population. Therefore, I choose option (1) Very good."]}, {"persona": {"region": "Beni Swaif/Beni Suef", "sex": "female", "age": 26, "country": "Egypt", "marital_status": "married", "education": "higher", "social_class": "lower middle class"}, "question": {"id": "Q236", "variant": 0}, "response": ["Based on the anthropological framework, my perspective as a married female from Beni Suef, Egypt, is heavily influenced by my cultural context, individual values, and socioeconomic background. In my community, there is a strong emphasis on traditional values and hierarchical structures, which can impact my opinion on a political system that involves experts making decisions for the country. Additionally, as part of the lower middle class, I may have experienced firsthand the challenges and inequalities that come with this socioeconomic status, which could shape my perspective on political systems. Considering these factors, I would choose the option (3) Fairly bad, as I may feel that such a system could further marginalize and disempower individuals like myself."]}, {"persona": {"region": "Beni Swaif/Beni Suef", "sex": "male", "age": 40, "country": "Egypt", "marital_status": "single", "education": "lower", "social_class": "lower class"}, "question": {"id": "Q236", "variant": 0}, "response": ["Based on my emic perspective as a lower-class individual from Beni Swaif, Egypt, my cultural context, individual values, and personal experience, I believe that a political system involving experts making decisions for the country is fairly bad. In my cultural context, there is a strong emphasis on community decision-making and the voices of the lower class are often overlooked. My personal experience has shown that decisions made by experts do not always take into account the struggles and needs of people like me. Additionally, my socioeconomic background has made me feel marginalized and unheard in political decisions, leading me to believe that this type of political system would not serve the interests of people in my position. \n\n3"]}, {"persona": {"region": "Beni Swaif/Beni Suef", "sex": "female", "age": 25, "country": "Egypt", "marital_status": "married", "education": "middle", "social_class": "lower middle class"}, "question": {"id": "Q236", "variant": 0}, "response": ["Based on my cultural context in Beni Swaif/Beni Suef, Egypt, my lower middle class socioeconomic background, and my middle education level, I believe that my opinion on a political system involving experts making decisions would be fairly bad. In my cultural context, there is a strong value placed on community involvement and collective decision-making. Additionally, my personal experience with the political system in Egypt has shown that decisions made by experts often do not take into account the needs and perspectives of the lower middle class. Therefore, I would feel that a political system based on expert decision-making would not adequately represent or address the needs of people like me.\n\n3"]}, {"persona": {"region": "Beni Swaif/Beni Suef", "sex": "female", "age": 21, "country": "Egypt", "marital_status": "single", "education": "middle", "social_class": "lower middle class"}, "question": {"id": "Q236", "variant": 0}, "response": ["Based on the anthropological framework, my answer is influenced by my emic perspective as a member of the lower middle class in Beni Suef, Egypt, as well as my cultural context, individual values, and socioeconomic background. In Egypt, there is a long history of centralized governance and decision-making by experts, which has often been viewed with suspicion and has contributed to a sense of disenfranchisement among the lower middle class. Additionally, my personal experience and values lead me to believe that a political system where decisions are made solely by experts may not adequately represent the needs and concerns of people like me. Therefore, I would choose option (3) Fairly bad."]}, {"persona": {"region": "Beni Swaif/Beni Suef", "sex": "male", "age": 48, "country": "Egypt", "marital_status": "married", "education": "middle", "social_class": "lower middle class"}, "question": {"id": "Q236", "variant": 0}, "response": ["Based on my cultural context in Beni Swaif, Egypt, where the socioeconomic background and individual values play a crucial role in shaping perspectives, I believe that a political system involving experts making decisions for the country could be fairly good. In our society, there is a strong emphasis on respecting authority and expertise, and the idea of experts making decisions aligns with our cultural values. Additionally, with my middle education level, I understand the importance of knowledge and expertise in decision-making. Therefore, I believe that a political system involving experts could be beneficial for the country's development and progress.\n\n2"]}, {"persona": {"region": "Beni Swaif/Beni Suef", "sex": "female", "age": 57, "country": "Egypt", "marital_status": "married", "education": "middle", "social_class": "working class"}, "question": {"id": "Q236", "variant": 0}, "response": ["Based on my emic perspective as a married female from Beni Swaif, Egypt, I understand that the cultural context and socioeconomic background of my community heavily influence my opinion on this matter. In my experience, I have seen that the political system in Egypt has often been led by experts making decisions for the country, and I have witnessed the impact of these decisions on the working class like myself. My personal values and experiences lead me to believe that this system has not always been beneficial for people like me, as it has often perpetuated inequalities and failed to address the needs of the working class. Therefore, I believe that a political system involving experts making decisions may be fairly bad for the country, as it may not fully consider the needs and perspectives of the working class.\n\n3"]}, {"persona": {"region": "Beni Swaif/Beni Suef", "sex": "male", "age": 20, "country": "Egypt", "marital_status": "single", "education": "middle", "social_class": "working class"}, "question": {"id": "Q236", "variant": 0}, "response": ["Based on my cultural context, as a 20-year-old single male from Beni Swaif/Beni Suef, Egypt, who has completed middle education and considers myself part of the working class, I have been influenced by the socioeconomic background and individual values in my community. I have also been shaped by the cultural relativism present in Egyptian society, where there is a strong emphasis on collective decision-making and the importance of the opinions of the wider community. Additionally, the nuance of the question leads me to believe that a political system involving experts making decisions may not align with the values of my community, where the input of the people is highly valued. Therefore, I would choose:\n\n3"]}, {"persona": {"region": "Giza", "sex": "female", "age": 59, "country": "Egypt", "marital_status": "married", "education": "higher", "social_class": "upper middle class"}, "question": {"id": "Q236", "variant": 0}, "response": ["Based on my emic perspective as a married female from Giza, Egypt, and considering my age, education level, and socioeconomic background, I believe that the political system involving experts making decisions for the country is fairly good. In my cultural context, I have seen the benefits of having knowledgeable and experienced individuals making decisions that benefit the community as a whole. Additionally, my individual values and personal experience have shaped my belief that experts can bring a level of expertise and understanding that is necessary for effective governance. Furthermore, considering my socioeconomic background, I have seen the positive impact of having leaders who are well-educated and competent in their decision-making. Overall, I believe that this political system is fairly good for the country.\n\n2"]}, {"persona": {"region": "Giza", "sex": "female", "age": 38, "country": "Egypt", "marital_status": "single", "education": "higher", "social_class": "lower middle class"}, "question": {"id": "Q236", "variant": 0}, "response": ["From the perspective of a single female from Giza, Egypt, who is 38 years old, has completed higher education, and considers herself part of the lower middle class, several factors are at play in forming an opinion on a political system involving experts making decisions for the country. The cultural context of Egypt, with its history of political upheaval and the role of experts in decision-making, would likely influence the perception of this political system. Additionally, the individual values and personal experience of the persona, shaped by their socioeconomic background and level of education, would also play a significant role in determining their opinion. Given the nuances of the question and the emphasis on cultural relativism, the persona is likely to have a nuanced perspective on this issue, taking into account the potential benefits and drawbacks of such a political system.\n\n3"]}, {"persona": {"region": "Giza", "sex": "female", "age": 26, "country": "Egypt", "marital_status": "single", "education": "higher", "social_class": "working class"}, "question": {"id": "Q236", "variant": 0}, "response": ["Based on the anthropological framework, my perspective as a single female from Giza, Egypt, who is 26 years old, completed higher education, and considers herself part of the working class, is heavily influenced by my cultural context, individual values, and socioeconomic background. In Egypt, there is a strong emphasis on respecting authority and expertise, so the idea of experts making decisions for the country may be viewed favorably. Additionally, as a member of the working class, I may believe that experts would have the best interests of the country in mind and would be able to make decisions that benefit people like me. Furthermore, my higher education level may lead me to value the expertise of individuals in making political decisions. Overall, I am likely to have a positive opinion of a political system that involves experts making decisions based on what they think is best for the country.\n\n1"]}, {"persona": {"region": "Giza", "sex": "male", "age": 39, "country": "Egypt", "marital_status": "married", "education": "middle", "social_class": "working class"}, "question": {"id": "Q236", "variant": 0}, "response": ["Based on the anthropological framework, my perspective as a married male from Giza, Egypt, with a middle education level and part of the working class would be heavily influenced by my cultural context, individual values, and socioeconomic background. In Egypt, there is a strong emphasis on collectivism and community decision-making, and the working class often feels marginalized by experts and elites. Additionally, the socioeconomic background of the working class often leads to distrust in the decisions made by experts. Therefore, I would likely have a fairly negative opinion on a political system that involves experts making decisions for the country. \n\n3"]}, {"persona": {"region": "Giza", "sex": "male", "age": 36, "country": "Egypt", "marital_status": "married", "education": "middle", "social_class": "working class"}, "question": {"id": "Q236", "variant": 0}, "response": ["Based on the anthropological framework, as a married male from Giza, Egypt, my emic perspective is heavily influenced by my cultural context, individual values, and socioeconomic background. In Egypt, there is a strong emphasis on communal decision-making and the involvement of the wider community in political decisions. Additionally, as a working-class individual with a middle education level, I may feel marginalized and excluded from decisions made by experts. Therefore, my opinion would be fairly bad (3) as I believe that a political system involving only experts making decisions may not adequately represent the needs and perspectives of the wider population."]}, {"persona": {"region": "Giza", "sex": "female", "age": 30, "country": "Egypt", "marital_status": "single", "education": "higher", "social_class": "lower class"}, "question": {"id": "Q236", "variant": 0}, "response": ["Based on my emic perspective as a single female from Giza, Egypt, I have grown up in a society where experts and authorities are often looked up to and relied upon for making decisions, especially in the political realm. My cultural context and socioeconomic background as a lower-class individual have shaped my understanding that those in power, who are often considered experts, have the knowledge and resources to make decisions that are in the best interest of the country. Additionally, my individual values and personal experiences have led me to believe that a political system involving experts making decisions is necessary for stability and progress in a country like Egypt. Therefore, I choose option (2) Fairly good."]}, {"persona": {"region": "Giza", "sex": "female", "age": 24, "country": "Egypt", "marital_status": "single", "education": "higher", "social_class": "lower class"}, "question": {"id": "Q236", "variant": 0}, "response": ["Based on my emic perspective as a single female from Giza, Egypt, my cultural context, individual values, and personal experience as part of the lower class and my socioeconomic background, I would argue that a political system involving experts making decisions based on what they think is best for the country is fairly bad. In Egypt, there is a history of political systems that are not always inclusive and representative of the needs and voices of the lower class. This system often leads to decisions that do not take into account the struggles and challenges faced by people like me. Additionally, cultural relativism and nuanced understanding of the question lead me to believe that a system involving experts making decisions may not necessarily reflect the diverse perspectives and needs of the population. Therefore, based on my personal experience and understanding, I would choose option 3: Fairly bad."]}, {"persona": {"region": "Giza", "sex": "male", "age": 65, "country": "Egypt", "marital_status": "married", "education": "middle", "social_class": "working class"}, "question": {"id": "Q236", "variant": 0}, "response": ["Based on the anthropological framework, my opinion on a political system involving experts making decisions would be influenced by my cultural context, socioeconomic background, and individual values. In Egypt, there is a strong emphasis on respecting authority and expertise, so I am inclined to trust the decisions made by experts. Additionally, as a working-class individual with a middle education level, I may not have the same level of access to political information and may feel more comfortable deferring to experts. Considering the cultural relativism aspect, I also value the idea of experts making decisions for the greater good, as this aligns with my personal values and beliefs. Therefore, my perspective would lead me to choose option (2) Fairly good. \n\n2"]}, {"persona": {"region": "Giza", "sex": "female", "age": 56, "country": "Egypt", "marital_status": "married", "education": "middle", "social_class": "working class"}, "question": {"id": "Q236", "variant": 0}, "response": ["Based on my cultural context and socioeconomic background, as a married female from Giza, Egypt, who is part of the working class and completed middle education level, I have a nuanced understanding of the political system. I believe that the expertise of decision-makers is important, especially when it comes to making decisions for the betterment of the country. However, I also value the input and representation of the working class and believe that their perspectives should be taken into consideration in the decision-making process. Therefore, I would say that a political system involving experts making decisions based on what they think is best for the country is fairly good.\n2"]}, {"persona": {"region": "Giza", "sex": "male", "age": 31, "country": "Egypt", "marital_status": "married", "education": "higher", "social_class": "lower middle class"}, "question": {"id": "Q236", "variant": 0}, "response": ["Based on my emic perspective, growing up in Giza, Egypt, I have been surrounded by a culture that values community and the input of the collective. Decision-making in my cultural context is often done through consensus and the involvement of the community. My personal experience and individual values have also shaped my belief that decisions made by experts can be beneficial, as they have valuable knowledge and expertise. However, my socioeconomic background as part of the lower middle class has also influenced my opinion, as I have seen the impact of decisions made by those in power that may not always benefit people like me. Therefore, I believe that a political system involving experts making decisions can be fairly good, but it also needs to consider the voices and needs of the people. \n\n2"]}, {"persona": {"region": "Giza", "sex": "male", "age": 28, "country": "Egypt", "marital_status": "single", "education": "middle", "social_class": "working class"}, "question": {"id": "Q236", "variant": 0}, "response": ["Based on the anthropological framework, my perspective on a political system involving experts making decisions for the country is influenced by my cultural context, individual values, and socioeconomic background. As a working-class male from Giza, Egypt, my experience and personal values lead me to prioritize the needs and voices of the people in decision-making processes. I come from a culture where community and collective decision-making are highly valued, and the socioeconomic disparities in my country have made me skeptical of a system where a small group of experts holds all the power. Therefore, I believe that a political system solely based on experts making decisions for the country would be fairly bad. \n\n3"]}, {"persona": {"region": "Giza", "sex": "male", "age": 47, "country": "Egypt", "marital_status": "married", "education": "middle", "social_class": "lower middle class"}, "question": {"id": "Q236", "variant": 0}, "response": ["Based on my emic perspective, coming from Giza, Egypt, I have been influenced by the cultural context and socioeconomic background of my community. The political system in Egypt has historically involved experts making decisions for the country, and while it has its flaws, it has also provided stability and progress in some areas. My individual values and personal experience also play a role in my opinion, as I have seen how the political system has affected my family and community. Additionally, cultural relativism reminds me that my perspective is not the only valid one, and I understand that others may have different opinions based on their own experiences and cultural backgrounds. Therefore, taking all these factors into consideration, I believe that a political system involving experts making decisions can be fairly good for the country's progress and stability.\n\n2"]}, {"persona": {"region": "Giza", "sex": "male", "age": 26, "country": "Egypt", "marital_status": "single", "education": "middle", "social_class": "lower middle class"}, "question": {"id": "Q236", "variant": 0}, "response": ["Based on my emic perspective as a member of the lower middle class from Giza, Egypt, I have experienced firsthand the impact of political decisions on my community and myself. The cultural context in which I live has shaped my understanding of the role of experts in making political decisions. My individual values and personal experiences have led me to believe that while experts may have valuable knowledge, they may not fully understand the needs and concerns of individuals from my socioeconomic background. Additionally, the concept of cultural relativism has taught me to be critical of hierarchical power structures, including those within a political system. Therefore, I believe that a political system solely based on experts making decisions may not fully consider the nuanced needs and perspectives of individuals like myself.\n\n3"]}, {"persona": {"region": "Giza", "sex": "male", "age": 48, "country": "Egypt", "marital_status": "married", "education": "middle", "social_class": "upper middle class"}, "question": {"id": "Q236", "variant": 0}, "response": ["Based on the anthropological framework, my opinion on a political system involving experts making decisions would be influenced by my cultural context, individual values, and socioeconomic background. As a married male from Giza, Egypt, I come from a culture with a strong sense of family and community, where individuals often defer to experts and authority figures for guidance. Additionally, my middle education level and upper middle class status may lead me to value the opinions and decisions of experts, as I may have been taught to respect and trust those who are more educated and have more resources. Therefore, I would choose option (2) fairly good, as I believe in the expertise and knowledge of those making decisions for the country. \n\n2"]}, {"persona": {"region": "Menya", "sex": "male", "age": 61, "country": "Egypt", "marital_status": "married", "education": "middle", "social_class": "working class"}, "question": {"id": "Q236", "variant": 0}, "response": ["Based on my emic perspective, as a married male from Menya, Egypt, my cultural context and socioeconomic background play a significant role in shaping my opinion. In Menya, there is a strong emphasis on community and family values, and as a working-class individual, I have always felt the impact of political decisions on my livelihood. Additionally, my age and education level have influenced my understanding of the political system and its potential implications. Considering the cultural relativism and nuance involved, I believe that a political system involving experts making decisions can be fairly good for the country, as it may bring in specialized knowledge and expertise to address complex issues. \n\n2"]}, {"persona": {"region": "Menya", "sex": "male", "age": 41, "country": "Egypt", "marital_status": "married", "education": "middle", "social_class": "lower middle class"}, "question": {"id": "Q236", "variant": 0}, "response": ["Based on my emic perspective as a married male from Menya, Egypt, I have been raised in a cultural context where individual values and personal experience play a significant role in shaping my opinions. Being from the lower middle class with a middle education level, my socioeconomic background has influenced my understanding of the political system. Additionally, cultural relativism is important to me as I believe that there is no hierarchy of culture. Considering all these factors, I believe that a political system involving experts making decisions based on what they think is best for the country is fairly good.\n\n2"]}, {"persona": {"region": "Menya", "sex": "female", "age": 43, "country": "Egypt", "marital_status": "married", "education": "higher", "social_class": "working class"}, "question": {"id": "Q236", "variant": 0}, "response": ["Based on the anthropological framework, as a married female from Menya, Egypt, my emic perspective is shaped by my cultural context, individual values, and socioeconomic background. In Menya, traditional gender roles and expectations are prevalent, and higher education for women is not common. However, I have broken these norms and pursued education, which has influenced my individual values and personal experience. As part of the working class, I am acutely aware of the socioeconomic disparities in my country. Considering these factors, I believe that a political system involving experts making decisions for the country could be fairly good, as it may bring expertise and knowledge to governance that can benefit all citizens. \n\n2"]}, {"persona": {"region": "Menya", "sex": "male", "age": 57, "country": "Egypt", "marital_status": "married", "education": "middle", "social_class": "lower middle class"}, "question": {"id": "Q236", "variant": 0}, "response": ["Based on the anthropological framework, as a married male from Menya, Egypt, my emic perspective is influenced by the cultural context of my upbringing and my socioeconomic background as part of the lower middle class. My personal experience and values have been shaped by my age and education level, leading me to prioritize stability and security in the political system. Additionally, the cultural relativism of my community emphasizes the importance of experts making decisions for the collective good. Therefore, I believe that a political system involving experts making decisions based on what they think is best for the country would be very good.\n\n1"]}, {"persona": {"region": "Menya", "sex": "male", "age": 42, "country": "Egypt", "marital_status": "divorced", "education": "middle", "social_class": "lower middle class"}, "question": {"id": "Q236", "variant": 0}, "response": ["Based on the anthropological framework, as a divorced male from Menya, Egypt, who is 42 years old, and part of the lower middle class, I would have a perspective influenced by my cultural context, individual values, and socioeconomic background. In Menya, Egypt, there is a strong emphasis on community and traditional values, and individuals often have a sense of distrust towards authorities and experts making decisions for the country. Additionally, being part of the lower middle class, I may feel marginalized and believe that decisions made by experts do not always consider the needs of people like me. Therefore, I would likely have a fairly negative opinion on a political system that involves experts making decisions based on what they think is best for the country.\n\n3"]}, {"persona": {"region": "Menya", "sex": "female", "age": 59, "country": "Egypt", "marital_status": "married", "education": "middle", "social_class": "upper middle class"}, "question": {"id": "Q236", "variant": 0}, "response": ["Based on the anthropological framework outlined above, my perspective as a married female from Menya, Egypt, who is 59 years old and part of the upper middle class, is heavily influenced by my cultural context, individual values, and personal experience. In Menya, there is a strong emphasis on respecting authority and expertise, and I have been taught to value the opinions of experts in decision-making processes. Additionally, my socioeconomic background has provided me with opportunities for education and exposure to different political systems, leading me to believe that a political system involving experts making decisions for the country is very good.\n\n1"]}, {"persona": {"region": "Menya", "sex": "female", "age": 31, "country": "Egypt", "marital_status": "married", "education": "middle", "social_class": "working class"}, "question": {"id": "Q236", "variant": 0}, "response": ["Based on the anthropological framework, my perspective as a married female from Menya, Egypt, of working-class background, with middle education level, is heavily influenced by my cultural context, individual values, and personal experience. In Menya, Egypt, the political system is often seen as a distant authority that does not always consider the needs and perspectives of working-class individuals like myself. My personal experience and cultural context have shaped my understanding that decision-making by experts often does not take into account the nuanced needs and perspectives of people like me. Therefore, I would choose option (3) Fairly bad."]}, {"persona": {"region": "Menya", "sex": "male", "age": 55, "country": "Egypt", "marital_status": "single", "education": "middle", "social_class": "working class"}, "question": {"id": "Q236", "variant": 0}, "response": ["From the perspective of a single male from Menya, Egypt, who is 55 years old and part of the working class, my response to the political system involving experts making decisions is influenced by several factors. Firstly, the cultural context in Egypt has a long history of political turmoil and a strong sense of collectivism, where decisions are often made based on the consensus of the community. Additionally, my middle education level and socioeconomic background as a working-class individual have shaped my understanding of the political system. My personal experience and values also play a significant role, as I have witnessed the impact of political decisions on my community. Therefore, my opinion may lean towards a preference for a political system that involves experts making decisions based on what they think is best for the country, as I believe it may bring stability and progress. \n\n1"]}, {"persona": {"region": "Menya", "sex": "female", "age": 28, "country": "Egypt", "marital_status": "married", "education": "higher", "social_class": "lower middle class"}, "question": {"id": "Q236", "variant": 0}, "response": ["Based on the anthropological framework, my perspective as a married female from Menya, Egypt, is influenced by my cultural context, individual values, socioeconomic background, and personal experiences. In Menya, there is a strong emphasis on community and family, with traditional gender roles and expectations. As a woman who has completed higher education, I value the importance of expertise and knowledge. However, as part of the lower middle class, I am also aware of the challenges and inequalities that exist within the political system. Therefore, I believe that a political system involving experts making decisions can be fairly good, as long as it takes into account the diverse needs and perspectives of the population and works towards addressing socioeconomic disparities.\n\n2"]}, {"persona": {"region": "Menya", "sex": "male", "age": 24, "country": "Egypt", "marital_status": "single", "education": "middle", "social_class": "working class"}, "question": {"id": "Q236", "variant": 0}, "response": ["Based on my emic perspective as a single male from Menya, Egypt, I have grown up in a working-class environment where the cultural context emphasizes the importance of individual values and personal experience. My personal experience and socioeconomic background have shaped my understanding of the political system, and I believe that a system involving experts making decisions for the country could be beneficial, as long as it takes into account the nuances of our society and cultural relativism. Additionally, my age and middle education level have influenced my belief in the importance of expertise and knowledge in decision-making. Therefore, I choose option 2: Fairly good."]}, {"persona": {"region": "Menya", "sex": "female", "age": 23, "country": "Egypt", "marital_status": "married", "education": "middle", "social_class": "working class"}, "question": {"id": "Q236", "variant": 0}, "response": ["Based on my cultural context and socioeconomic background, I have been raised in a working-class family in Menya, Egypt, where the political system is highly influenced by traditional values and religious beliefs. My personal experience and individual values have shaped my understanding of politics and decision-making. I believe that a political system involving experts making decisions for the country can be fairly good, as long as it takes into account the needs and perspectives of the working-class individuals like myself. I understand the importance of cultural relativism and nuance in political systems, and I believe that expert decision-making can benefit the country if it is inclusive and considers the diverse perspectives of the population. \n\n2"]}, {"persona": {"region": "Menya", "sex": "male", "age": 27, "country": "Egypt", "marital_status": "single", "education": "middle", "social_class": "lower middle class"}, "question": {"id": "Q236", "variant": 0}, "response": ["Based on my emic perspective as a single male from Menya, Egypt, my cultural context and socioeconomic background play a significant role in shaping my opinion on a political system involving experts making decisions for the country. In my community, there is a strong emphasis on respecting authority and seeking guidance from those with expertise and knowledge. Additionally, my lower middle-class status means that I may not have had the same access to education and resources as those in higher socioeconomic brackets, so I may feel that I lack the expertise to make informed political decisions. My personal experience and individual values also lead me to believe that experts should have a significant role in political decision-making, as I trust that they have the best interests of the country in mind. Therefore, I believe that a political system involving experts making decisions for the country is very good.\n\n1"]}, {"persona": {"region": "Asyut", "sex": "male", "age": 30, "country": "Egypt", "marital_status": "married", "education": "middle", "social_class": "working class"}, "question": {"id": "Q236", "variant": 0}, "response": ["Based on the anthropological framework, as a married male from Asyut, Egypt, who is 30 years old and part of the working class, my answer to the question on a political system involving experts making decisions is influenced by my cultural context, individual values, socioeconomic background, and space and time. In Egypt, there is a long history of centralized authority and a strong emphasis on expertise and hierarchy. As a member of the working class, I may feel that decisions made by experts are in the best interest of the country, as they are more knowledgeable and experienced. Additionally, my middle education level may have instilled in me a respect for expertise and authority. Therefore, my opinion is that a political system involving experts making decisions is (1) Very good."]}, {"persona": {"region": "Asyut", "sex": "female", "age": 26, "country": "Egypt", "marital_status": "married", "education": "middle", "social_class": "working class"}, "question": {"id": "Q236", "variant": 0}, "response": ["In Asyut, Egypt, as a married woman from the working class, my perspective is heavily influenced by my cultural context, individual values, and socioeconomic background. As a member of the working class, I am likely to have experienced the impact of political decisions on my daily life and understand the importance of fair representation. Additionally, my age and education level may influence my understanding of political systems and decision-making processes. In this cultural context, the idea of experts making decisions for the country might be viewed with skepticism, as the working class may feel marginalized and unheard in such a system. Additionally, the concept of cultural relativism suggests that my perspective may differ from those in other cultural contexts. Therefore, my opinion on a political system involving experts making decisions is likely to be influenced by a nuanced understanding of power dynamics and representation.\n\n3"]}, {"persona": {"region": "Asyut", "sex": "male", "age": 32, "country": "Egypt", "marital_status": "single", "education": "higher", "social_class": "lower middle class"}, "question": {"id": "Q236", "variant": 0}, "response": ["From the perspective of a single male from Asyut, Egypt, who is 32 years old and part of the lower middle class, my opinion on a political system that involves experts making decisions based on what they think is best for the country would be fairly bad. As someone who has completed higher education, I understand the importance of expertise, but I also value the input and representation of the people. In the cultural context of Egypt, there is a history of authoritarian rule and a lack of representation for the average citizen. Therefore, I believe that a political system that solely relies on experts making decisions may not adequately consider the needs and perspectives of the broader population, leading to potential inequalities and lack of accountability. Additionally, my socioeconomic background as part of the lower middle class informs my belief that such a system may not prioritize the concerns of individuals like myself. \n\n3"]}, {"persona": {"region": "Asyut", "sex": "female", "age": 21, "country": "Egypt", "marital_status": "married", "education": "middle", "social_class": "working class"}, "question": {"id": "Q236", "variant": 0}, "response": ["Based on my cultural context as a married female from Asyut, Egypt, where the working class is prevalent, my individual values and personal experience, as well as my socioeconomic background, play a significant role in shaping my opinion on a political system that involves experts making decisions for the country. In Egypt, there is a long history of centralized power and decision-making, and as a member of the working class with a middle education level, I may have limited access to the political process and decision-making. Additionally, the cultural relativism in Egypt emphasizes the importance of respecting authority and expertise. Therefore, I would likely view a political system involving experts making decisions as very good, as it aligns with the cultural and socioeconomic context in which I exist.\n\n1"]}, {"persona": {"region": "Asyut", "sex": "female", "age": 30, "country": "Egypt", "marital_status": "married", "education": "higher", "social_class": "working class"}, "question": {"id": "Q236", "variant": 0}, "response": ["Based on the anthropological framework, as a married female from Asyut, Egypt, who is 30 years old and part of the working class, my emic perspective on a political system that involves experts making decisions would be shaped by my cultural context, individual values, and socioeconomic background. In Egypt, there is a strong emphasis on collective decision-making within the community, and individuals often have limited trust in political experts. Additionally, as a member of the working class, I may feel that decisions made by experts do not always reflect the needs and concerns of people like me. Therefore, I would likely have a fairly negative view of a political system that relies heavily on experts making decisions for the country. (3) Fairly bad"]}, {"persona": {"region": "Asyut", "sex": "female", "age": 42, "country": "Egypt", "marital_status": "married", "education": "higher", "social_class": "lower middle class"}, "question": {"id": "Q236", "variant": 0}, "response": ["Based on the anthropological framework, my perspective as a married female from Asyut, Egypt, who is 42 years old and part of the lower middle class, is deeply influenced by my cultural context, individual values, and socioeconomic background. In Egypt, there is a strong emphasis on community and family, and decisions are often made collectively rather than by experts. Additionally, as someone with a higher education level, I value the importance of individual freedoms and democratic participation. Given my socioeconomic background, I have experienced firsthand the challenges faced by the lower middle class, and I believe that a political system involving experts making decisions may not fully consider the needs and perspectives of people like me. Therefore, I would choose option (3) Fairly bad, as I believe that a political system that does not fully involve the voices and experiences of the people may not be in the best interest of the country as a whole. \n\n3"]}, {"persona": {"region": "Sohag", "sex": "male", "age": 63, "country": "Egypt", "marital_status": "married", "education": "middle", "social_class": "lower middle class"}, "question": {"id": "Q236", "variant": 0}, "response": ["Based on my personal experience and socioeconomic background as a married, 63-year-old male from Sohag, Egypt, who has completed middle education and considers himself part of the lower middle class, I have a nuanced understanding of the political system. In Egypt, there is a strong emphasis on cultural context and the role of traditional values and kinship networks. I believe that a political system involving experts making decisions for the country can be fairly good, as it can provide stability and expertise in governance, which is important for the development of the country. Additionally, my age and place in society have shaped my understanding of the importance of stability and order in the political system. \n\n2"]}, {"persona": {"region": "Sohag", "sex": "male", "age": 27, "country": "Egypt", "marital_status": "married", "education": "middle", "social_class": "working class"}, "question": {"id": "Q236", "variant": 0}, "response": ["Based on the anthropological framework, my perspective is heavily influenced by my cultural context, individual values and personal experience, and socioeconomic background. Coming from Sohag, Egypt, I am part of the working class with only a middle education level. My cultural context and personal experience have shown me that decisions made by experts in the political system often do not take into account the needs and perspectives of the working class. Additionally, the concept of cultural relativism teaches me to be wary of any system that may not consider the diverse needs and values of different groups within the country. Therefore, I would choose option 3: Fairly bad."]}, {"persona": {"region": "Sohag", "sex": "male", "age": 56, "country": "Egypt", "marital_status": "married", "education": "higher", "social_class": "upper middle class"}, "question": {"id": "Q236", "variant": 0}, "response": ["Based on my emic perspective as a married male from Sohag, Egypt, I believe that the political system should involve experts making decisions for the country. In our cultural context, we value knowledge and expertise, and we trust that experts are well-equipped to make decisions that will benefit the nation. Additionally, my individual values and personal experience have taught me that a system involving experts can lead to stability and progress. Considering my socioeconomic background, as part of the upper middle class, I understand the importance of having a system that prioritizes the well-being of the country. Furthermore, cultural relativism teaches us that different political systems work for different societies, and in our case, a system involving experts is the best option. Therefore, my opinion on a political system that involves experts making decisions based on what they think is best for the country is:\n\n1"]}, {"persona": {"region": "Sohag", "sex": "male", "age": 51, "country": "Egypt", "marital_status": "married", "education": "higher", "social_class": "lower middle class"}, "question": {"id": "Q236", "variant": 0}, "response": ["Based on the anthropological framework, my perspective as a married male from Sohag, Egypt, who is 51 years old and part of the lower middle class, is influenced by a combination of emic and etic perspectives, cultural context, individual values and personal experience, socioeconomic background, and space and time. In my cultural context, there is a strong tradition of respecting and deferring to experts and authority figures. My individual values and personal experience have also shaped my belief in the importance of expertise and education. In terms of socioeconomic background, being part of the lower middle class means that I have a vested interest in a political system that aims to make decisions for the betterment of the country. Additionally, my age and the place I come from have a significant impact on my views, as I have witnessed the impact of various political systems on my community. Taking all of these factors into consideration, I choose option 1: Very good."]}, {"persona": {"region": "Sohag", "sex": "female", "age": 26, "country": "Egypt", "marital_status": "married", "education": "higher", "social_class": "working class"}, "question": {"id": "Q236", "variant": 0}, "response": ["Based on the anthropological framework, as a married female from Sohag, Egypt, I am deeply rooted in the cultural context of my community, where traditional values and family ties are highly valued. My individual values and personal experiences have shaped my understanding of the world, and as part of the working class, I am keenly aware of the impact of socioeconomic background on people's lives. Additionally, as a higher education graduate, I recognize the importance of expertise and knowledge. However, my cultural relativism leads me to believe in the importance of including diverse perspectives in decision-making processes. Therefore, I would choose option (2) Fairly good."]}, {"persona": {"region": "Sohag", "sex": "female", "age": 29, "country": "Egypt", "marital_status": "married", "education": "higher", "social_class": "upper middle class"}, "question": {"id": "Q236", "variant": 0}, "response": ["Based on my emic perspective as a married female from Sohag, Egypt, I understand that the cultural context in my country values education and expertise. Additionally, my individual values and personal experience, as well as my socioeconomic background as part of the upper middle class, have influenced my perception of the political system. In Egypt, there is a high regard for authority and expertise, and decisions made by experts are often seen as beneficial for the country's development. Therefore, I believe that a political system involving experts making decisions based on what they think is best for the country would be very good for Egypt's progress and stability.\n\n1"]}, {"persona": {"region": "Sohag", "sex": "male", "age": 51, "country": "Egypt", "marital_status": "married", "education": "middle", "social_class": "lower middle class"}, "question": {"id": "Q236", "variant": 0}, "response": ["Based on my personal experience and socioeconomic background as a married male from Sohag, Egypt, I understand the importance of a political system that involves experts making decisions for the country. In my cultural context, I have seen the impact of decisions made by those in power and understand the value of having knowledgeable individuals making decisions that benefit the country as a whole. I also recognize the nuance in this question, as the effectiveness of such a system can vary based on the specific experts and their understanding of the needs of the people. Therefore, my opinion is that this political system can be fairly good if the experts are truly knowledgeable and act in the best interest of the country and its people.\n\n2"]}, {"persona": {"region": "Qena", "sex": "male", "age": 32, "country": "Egypt", "marital_status": "single", "education": "middle", "social_class": "working class"}, "question": {"id": "Q236", "variant": 0}, "response": ["Based on the anthropological framework, my perspective as a single male from Qena, Egypt, who has completed middle education and considers himself part of the working class, is heavily influenced by my cultural context, individual values, and socioeconomic background. In Egypt, there is a strong emphasis on collective decision-making and the importance of community input in political matters. Additionally, as a member of the working class, I have experienced the impact of political decisions on my daily life and have personally felt the need for more representation and consideration of the working class in decision-making processes. Therefore, I believe that a political system involving experts making decisions based on what they think is best for the country may not adequately represent the needs and perspectives of individuals like myself. \n\n3"]}, {"persona": {"region": "Qena", "sex": "male", "age": 54, "country": "Egypt", "marital_status": "married", "education": "middle", "social_class": "lower middle class"}, "question": {"id": "Q236", "variant": 0}, "response": ["Based on my emic perspective as a married male from Qena, Egypt, and my lower middle class socioeconomic background, I believe that a political system involving experts making decisions for the country is fairly good. In my cultural context, I have experienced the importance of having knowledgeable individuals making decisions for the benefit of the community. Additionally, my personal experience and individual values lead me to trust in the expertise of those who have studied and have experience in making decisions. I also understand the importance of cultural relativism and nuance in this matter, as different cultures may have different perspectives on this issue. Overall, considering my background and cultural context, I believe a system involving experts making decisions is fairly good.\n\n2"]}, {"persona": {"region": "Qena", "sex": "male", "age": 25, "country": "Egypt", "marital_status": "single", "education": "lower", "social_class": "lower class"}, "question": {"id": "Q236", "variant": 0}, "response": ["Based on my cultural context, socioeconomic background, and individual values, I believe that a political system involving experts making decisions for the country is fairly bad. In Qena, Egypt, we have a strong sense of community and value the input of all members, regardless of their education or expertise. The lower class, like myself, often feels marginalized and unheard in political decision-making. Additionally, cultural relativism teaches us that all perspectives should be considered, and a system led by experts may not adequately represent the diverse needs and experiences of the population. Furthermore, my personal experience and age have shown me the impact of decisions made by those in power, which have often not benefitted people like me. Therefore, I believe that this political system is fairly bad.\n\n3"]}, {"persona": {"region": "Aswan", "sex": "male", "age": 34, "country": "Egypt", "marital_status": "single", "education": "middle", "social_class": "lower class"}, "question": {"id": "Q236", "variant": 0}, "response": ["Based on my personal experience and socioeconomic background, I believe that a political system involving experts making decisions for the country can be fairly good. As someone from the lower class in Aswan, Egypt, I have seen the struggles that people in my community face and I believe that having experts who understand the complexities of governance and policy-making can lead to better outcomes for the country. Additionally, my cultural context and age have shaped my belief that experts can bring valuable knowledge and perspectives to decision-making. Overall, I think a political system involving experts making decisions can be fairly good for the country.\n\n2"]}, {"persona": {"region": "Aswan", "sex": "female", "age": 31, "country": "Egypt", "marital_status": "married", "education": "middle", "social_class": "lower middle class"}, "question": {"id": "Q236", "variant": 0}, "response": ["From the perspective of a married female from Aswan, Egypt, who has completed middle education and considers herself part of the lower middle class, my opinion on a political system that involves experts making decisions based on what they think is best for the country is influenced by my cultural context, individual values, and socioeconomic background. In Aswan, there is a strong emphasis on community and the collective well-being, and as a member of the lower middle class, I have experienced the challenges faced by my community. While experts making decisions may seem like a good idea in theory, I am aware of the power dynamics and potential for those decisions to benefit the elite and not the everyday people like myself. Additionally, my personal experience has shown me that political systems often do not prioritize the needs of the lower middle class, so I am skeptical of this type of system. Therefore, based on my cultural context, individual values, and socioeconomic background, I would choose option (3) Fairly bad."]}, {"persona": {"region": "Aswan", "sex": "female", "age": 39, "country": "Egypt", "marital_status": "married", "education": "middle", "social_class": "working class"}, "question": {"id": "Q236", "variant": 0}, "response": ["Based on the anthropological framework, as a married female from Aswan, Egypt, at the age of 39, with a middle education level and part of the working class, my perspective is heavily influenced by my cultural context, individual values, and socioeconomic background. In Aswan, there is a strong sense of community and reliance on traditional values, and as a working-class individual, I am likely to be more concerned with practical, day-to-day issues. Additionally, my middle education level means I may have limited exposure to complex political systems and may prioritize stability and security. Therefore, I would likely view a political system involving experts making decisions as fairly good, as I would trust in the expertise of those making decisions for the betterment of the country.\n\n2"]}, {"persona": {"region": "Qena", "sex": "female", "age": 27, "country": "Egypt", "marital_status": "married", "education": "lower", "social_class": "lower middle class"}, "question": {"id": "Q236", "variant": 0}, "response": ["From the perspective of a married female from Qena, Egypt, who is 27 years old, completed lower education level, and considers herself part of the lower middle class, several factors come into play in forming an opinion on a political system that involves experts making decisions for the country. The cultural context and individual values and personal experience are important in this case, as Egypt has a history of political instability and corruption. Additionally, the socioeconomic background of the persona would also influence their opinion, as being part of the lower middle class may lead to a perception of being marginalized or not having a voice in the decision-making process. Cultural relativism is another key factor, as the persona may have a different understanding of what is best for the country compared to experts. Therefore, the persona may lean towards option 3) Fairly bad, as they may feel that the political system does not adequately represent the needs and concerns of the people. \n\n3"]}, {"persona": {"region": "Qena", "sex": "male", "age": 40, "country": "Egypt", "marital_status": "single", "education": "middle", "social_class": "lower middle class"}, "question": {"id": "Q236", "variant": 0}, "response": ["From an emic perspective, as a lower middle-class single male from Qena, Egypt, my cultural context and socioeconomic background heavily influence my opinion on a political system that involves experts making decisions for the country. My personal experience and individual values also play a crucial role in shaping my viewpoint. In Egypt, there is a strong emphasis on hierarchical structures and authority figures, so the idea of experts making decisions may be perceived as favorable due to the cultural context. Additionally, my lower middle-class status may lead me to believe that experts have the knowledge and resources to make decisions that benefit the country. However, given the nuances of the political climate in Egypt and the potential for abuse of power, I would lean towards option 2, fairly good, as I see the potential benefits of experts making decisions but also recognize the potential drawbacks. \n\n2"]}, {"persona": {"region": "Qena", "sex": "male", "age": 30, "country": "Egypt", "marital_status": "single", "education": "middle", "social_class": "working class"}, "question": {"id": "Q236", "variant": 0}, "response": ["Based on my emic perspective as a single male from Qena, Egypt, and considering my age, education level, and working-class status, I believe that the cultural context of Egypt heavily influences my opinion on a political system that involves experts making decisions for the country. In Egypt, there is a strong tradition of centralized authority and a hierarchical structure, so the idea of experts making decisions aligns with this cultural context. Additionally, my socioeconomic background as part of the working class may lead me to believe that experts making decisions could potentially benefit the country. However, my individual values and personal experience may also play a role in shaping my opinion, as I may have experienced or witnessed instances where experts making decisions have not been beneficial for people like me. Therefore, taking all of these factors into account, I would choose option (2) Fairly good.\n\n2"]}]