[{"persona": {"region": "Fayoum", "sex": "male", "age": 46, "country": "Egypt", "marital_status": "married", "education": "higher", "social_class": "lower middle class"}, "question": {"id": "Q142", "variant": 0}, "response": ["Based on the anthropological framework, as a married male from Fayoum, Egypt, I am influenced by my cultural context, socioeconomic background, and individual values. The economic situation in Egypt, especially for those in the lower middle class, is uncertain and job security is a major concern. As a 46-year-old with higher education, I understand the competitive job market and the challenges of finding stable employment. Additionally, my personal experience and values lead me to prioritize financial stability for my family. Therefore, I am worried about losing my job or not finding a job.\n\n2"]}, {"persona": {"region": "Fayoum", "sex": "female", "age": 30, "country": "Egypt", "marital_status": "married", "education": "middle", "social_class": "lower middle class"}, "question": {"id": "Q142", "variant": 0}, "response": ["Based on the anthropological framework, as a married female from Fayoum, Egypt, with a middle education level and lower middle class socioeconomic background, my answer to the question of how worried I am about losing my job or not finding a job would be \"Very much\" (1). This response is influenced by the cultural context of Egypt, where job opportunities are limited, especially for women, and the socioeconomic background which adds pressure to secure stable employment for financial stability. Additionally, my individual values and personal experience play a significant role in my worry about job security, as it directly impacts my ability to support my family and maintain a certain standard of living."]}, {"persona": {"region": "Fayoum", "sex": "male", "age": 60, "country": "Egypt", "marital_status": "married", "education": "higher", "social_class": "working class"}, "question": {"id": "Q142", "variant": 0}, "response": ["Based on the anthropological framework, as a married male from Fayoum, Egypt, who is 60 years old and part of the working class, my answer to the question about job security is influenced by my cultural context, socioeconomic background, and personal experience. In Egypt, the job market can be unpredictable and competitive, especially for those who are older and less educated. Additionally, as a member of the working class, I may have experienced or witnessed job insecurity among my peers. Therefore, I am more likely to be worried about losing my job or not finding a new one, as it directly impacts my family's financial stability and my social standing in the community.\n\n2"]}, {"persona": {"region": "Fayoum", "sex": "male", "age": 20, "country": "Egypt", "marital_status": "single", "education": "middle", "social_class": "lower middle class"}, "question": {"id": "Q142", "variant": 0}, "response": ["Based on my personal experience and socioeconomic background, as a 20-year-old male from Fayoum, Egypt, who has completed middle education and considers myself part of the lower middle class, I am very worried about losing my job or not finding a job. The economic conditions in my area are challenging, and the job market is competitive. My family's financial stability heavily depends on my ability to secure employment, so the prospect of not being able to find a job is a major concern for me.\n\n1"]}, {"persona": {"region": "Fayoum", "sex": "female", "age": 39, "country": "Egypt", "marital_status": "married", "education": "higher", "social_class": "lower middle class"}, "question": {"id": "Q142", "variant": 0}, "response": ["From the perspective of a married woman from Fayoum, Egypt, the socioeconomic background plays a significant role in the level of concern about job security. Being part of the lower middle class and having completed a higher education level, the individual may feel a sense of insecurity about job stability. Additionally, the cultural context of Egypt, where women may face challenges in finding employment, further adds to the concern. The individual values and personal experience also contribute to the worry about losing or not finding a job, as it directly impacts the well-being of the family. Therefore, the chosen answer is:\n\n(1) Very much"]}, {"persona": {"region": "Fayoum", "sex": "male", "age": 33, "country": "Egypt", "marital_status": "married", "education": "higher", "social_class": "working class"}, "question": {"id": "Q142", "variant": 0}, "response": ["Based on the anthropological framework, the emic perspective of a married male from Fayoum, Egypt, who is 33 years old, completed higher education, and considers himself part of the working class, would be greatly influenced by his socioeconomic background. In Egypt, the job market can be competitive and unstable, especially for those in the working class. Additionally, the cultural context of Egypt emphasizes the importance of providing for one's family, which would heighten the worry of losing or not finding a job. Furthermore, individual values and personal experience play a significant role in shaping perceptions, and the persona's personal experience and values would likely contribute to a high level of concern about job security. Therefore, the most fitting response from this perspective would be:\n\n(1) Very much"]}, {"persona": {"region": "Port Said", "sex": "female", "age": 45, "country": "Egypt", "marital_status": "married", "education": "higher", "social_class": "lower middle class"}, "question": {"id": "Q142", "variant": 0}, "response": ["Based on the anthropological framework, my response to the question is influenced by my cultural context, individual values, personal experience, and socioeconomic background. As a married woman from Port Said, Egypt, who is 45 years old and part of the lower middle class, my worries about losing my job or not finding a job are significant. The socioeconomic background plays a crucial role in my concerns as job security is important for financial stability and supporting my family. Additionally, my personal experience and cultural context have taught me the value of employment and the potential consequences of unemployment. Therefore, my answer to the question is: \n2"]}, {"persona": {"region": "Port Said", "sex": "male", "age": 42, "country": "Egypt", "marital_status": "married", "education": "middle", "social_class": "lower middle class"}, "question": {"id": "Q142", "variant": 0}, "response": ["Based on the anthropological framework, my personal and cultural context as a married male from Port Said, Egypt, with a middle education level and lower middle-class background, greatly influences my perception of job security. The cultural context and socioeconomic background play a significant role in shaping my perspective on employment. In my community, job opportunities are limited and the competition is high, especially for someone with my educational background and social status. The socioeconomic background also adds to the pressure of providing for my family. Therefore, I am very worried about losing my job or not finding a job.\n\n1"]}, {"persona": {"region": "Port Said", "sex": "male", "age": 28, "country": "Egypt", "marital_status": "single", "education": "middle", "social_class": "lower middle class"}, "question": {"id": "Q142", "variant": 0}, "response": ["Based on the anthropological framework, my emic perspective as a single male from Port Said, Egypt, at 28 years old and part of the lower middle class, is heavily influenced by my cultural context, individual values, and socioeconomic background. In Egypt, job security is a major concern, especially for someone of my socioeconomic status. The cultural context of Egypt places a strong emphasis on the importance of work and providing for oneself and one's family. Additionally, my personal experience and values dictate that job security is a top priority for me, as it directly impacts my ability to support myself and potentially my family in the future. Therefore, I am very worried about losing my job or not finding a job.\n\n1"]}, {"persona": {"region": "Port Said", "sex": "female", "age": 30, "country": "Egypt", "marital_status": "married", "education": "higher", "social_class": "lower middle class"}, "question": {"id": "Q142", "variant": 0}, "response": ["Based on the anthropological framework, my answer to the question about job security would be influenced by my cultural context, socioeconomic background, and personal experience. As a married female from Port Said, Egypt, at the age of 30 and part of the lower middle class, I am acutely aware of the challenges of finding and maintaining employment in a competitive job market. The socioeconomic background and cultural context of my community emphasize the importance of job stability for financial security and social status. Additionally, my personal experience and individual values regarding the value of education and hard work contribute to my concern about job security. Therefore, my answer would be \"A good deal\" (2) as I am genuinely worried about losing my job or struggling to find employment."]}, {"persona": {"region": "Port Said", "sex": "male", "age": 30, "country": "Egypt", "marital_status": "divorced", "education": "middle", "social_class": "lower middle class"}, "question": {"id": "Q142", "variant": 0}, "response": ["Based on the anthropological framework, as a divorced male from Port Said, Egypt, who is 30 years old and part of the lower middle class, my answer to the question of how worried I am about losing my job or not finding a job would be (2) A good deal. This answer is influenced by my socioeconomic background, as I am part of the lower middle class and my educational level, which limits my job opportunities. Additionally, the cultural context of Egypt, where job opportunities may be limited, and the emphasis on providing for oneself and one's family, also contributes to my concern about job security."]}, {"persona": {"region": "Port Said", "sex": "female", "age": 19, "country": "Egypt", "marital_status": "single", "education": "middle", "social_class": "lower middle class"}, "question": {"id": "Q142", "variant": 0}, "response": ["Based on the anthropological framework, my answer to the question of how worried I am about losing my job or not finding a job would be \"A good deal\" (2). As a 19-year-old single female from Port Said, Egypt, who has completed middle education level and considers myself part of the lower middle class, my socioeconomic background plays a significant role in shaping my perspective. In this cultural context, finding stable employment can be challenging, and the fear of unemployment or underemployment is a very real and pressing concern for individuals in my position. Additionally, my personal experience and individual values lead me to prioritize financial stability and independence, making the prospect of job insecurity a significant source of worry."]}, {"persona": {"region": "Fayoum", "sex": "male", "age": 40, "country": "Egypt", "marital_status": "married", "education": "middle", "social_class": "working class"}, "question": {"id": "Q142", "variant": 0}, "response": ["Based on the anthropological framework described above, as a married male from Fayoum, Egypt, who is 40 years old, completed middle education, and considers myself part of the working class, my answer to the question of how worried I am about losing my job or not finding a job would be (2) A good deal. This is because my socioeconomic background as part of the working class and my limited education level greatly impact my job prospects, leading to a significant level of concern about job security. Additionally, the cultural context of Egypt and the current economic situation in the country also contribute to my worries about finding and keeping a job."]}, {"persona": {"region": "Fayoum", "sex": "male", "age": 23, "country": "Egypt", "marital_status": "single", "education": "higher", "social_class": "lower middle class"}, "question": {"id": "Q142", "variant": 0}, "response": ["Based on the anthropological framework, as a single male from Fayoum, Egypt, who is 23 years old and part of the lower middle class, my answer to the question of how worried I am about losing my job or not finding a job would be \"A good deal.\" This answer is influenced by my socioeconomic background, as job security and opportunities are limited in my area and within my social class. Additionally, my personal experience and individual values play a role in my concern about financial stability and the ability to support myself. Furthermore, the cultural context of my community places a strong emphasis on the importance of employment for men, adding to my worry about job security. Overall, my perspective is shaped by a combination of socioeconomic factors, personal experience, and cultural context, leading me to feel a good deal of concern about job security. \n\n2"]}, {"persona": {"region": "Fayoum", "sex": "female", "age": 38, "country": "Egypt", "marital_status": "married", "education": "middle", "social_class": "lower middle class"}, "question": {"id": "Q142", "variant": 0}, "response": ["Based on my cultural context and socioeconomic background, as a married woman from Fayoum, Egypt, who is part of the lower middle class, job security is a significant concern for me. The economic situation in Egypt is not stable, and finding a job, especially as a woman with only a middle education level, can be quite challenging. My personal experience and values also play a role in this concern, as I have seen the impact of unemployment on families in my community. Additionally, cultural relativism teaches me to understand that the importance of job security may vary across different cultures and socioeconomic backgrounds. Therefore, I would choose option (1) Very much."]}, {"persona": {"region": "Fayoum", "sex": "male", "age": 32, "country": "Egypt", "marital_status": "married", "education": "middle", "social_class": "lower middle class"}, "question": {"id": "Q142", "variant": 0}, "response": ["From an emic perspective, as a married male from Fayoum, Egypt, my primary concern is providing for my family. The cultural context of Egypt, particularly in the lower middle class, places a strong emphasis on the responsibility of the breadwinner to secure stable employment to support the family. My individual values and personal experience also play a significant role in my level of worry about job security, as I have witnessed the struggles of others in my community who have faced unemployment and financial instability. Additionally, my socioeconomic background as a middle-educated individual from the lower middle class further heightens my concerns about job security, as opportunities for stable, well-paying employment are limited. Considering these factors, I would choose option (1) Very much."]}, {"persona": {"region": "Fayoum", "sex": "male", "age": 31, "country": "Egypt", "marital_status": "married", "education": "higher", "social_class": "working class"}, "question": {"id": "Q142", "variant": 0}, "response": ["In considering the question of how worried I am about losing my job or not finding a job, I must take into account my cultural context as a married male from Fayoum, Egypt. In my community, the socioeconomic background plays a significant role in employment opportunities, and as a working-class individual, job security is a constant concern. Additionally, my individual values and personal experience have shaped my perception of the importance of stable employment, as it directly impacts my ability to provide for my family. Furthermore, the cultural relativism of my society emphasizes the significance of work and the role it plays in one's identity and social standing. Therefore, when considering the question, I must express that I am very worried about losing my job or not finding a new one.\n\n1"]}, {"persona": {"region": "Fayoum", "sex": "male", "age": 31, "country": "Egypt", "marital_status": "married", "education": "middle", "social_class": "lower middle class"}, "question": {"id": "Q142", "variant": 0}, "response": ["From an anthropological perspective, my cultural context as a married male from Fayoum, Egypt, who is 31 years old and part of the lower middle class, greatly influences my answer to this question. In Egypt, the socioeconomic background plays a significant role in job security and stability. Additionally, my individual values and personal experience also contribute to my worry about losing my job or not finding a job. Given the economic challenges in Egypt and the limited opportunities for those with only a middle-level education, I am very much worried about losing my job or not finding a job.\n\n2"]}, {"persona": {"region": "Fayoum", "sex": "female", "age": 32, "country": "Egypt", "marital_status": "married", "education": "middle", "social_class": "lower middle class"}, "question": {"id": "Q142", "variant": 0}, "response": ["From the perspective of a married female from Fayoum, Egypt, at 32 years of age and with a middle education level, the socioeconomic background is a crucial factor in understanding her worry about losing or not finding a job. The lower middle class status and limited educational opportunities in the region may lead to a heightened concern about job security. Additionally, the cultural context of Fayoum, Egypt, where traditional gender roles and limited economic opportunities for women may further exacerbate this worry. Therefore, the emic perspective of this persona would lead to a response of \"Very much\" worried about losing her job or not finding a job.\n\n1"]}, {"persona": {"region": "Ismailia", "sex": "male", "age": 53, "country": "Egypt", "marital_status": "married", "education": "middle", "social_class": "lower middle class"}, "question": {"id": "Q142", "variant": 0}, "response": ["Based on my emic perspective as a married male from Ismailia, Egypt, my cultural context and socioeconomic background play a significant role in my answer to this question. In Egypt, the job market is often competitive and unstable, especially for those in the lower middle class. My personal experience and individual values also contribute to my concern about losing my job or not finding one, as it directly impacts my ability to provide for my family and maintain a certain standard of living. Additionally, my age and socioeconomic background further exacerbate this worry, as finding new employment opportunities may become increasingly difficult as I grow older. Therefore, I would choose option (1) Very much, as the fear of job insecurity is a very real and pressing concern for me and others in similar circumstances. \n\n1"]}, {"persona": {"region": "Ismailia", "sex": "male", "age": 38, "country": "Egypt", "marital_status": "married", "education": "higher", "social_class": "working class"}, "question": {"id": "Q142", "variant": 0}, "response": ["Based on the anthropological framework, as a married male from Ismailia, Egypt, who is 38 years old and part of the working class, my response to the question about job security is influenced by a combination of cultural context, individual values, and socioeconomic background. In Egypt, the job market can be competitive and unstable, especially for those in the working class. Additionally, my personal experience and values as a provider for my family play a significant role in shaping my level of concern about job security. Therefore, my answer is:\n\n2"]}, {"persona": {"region": "Ismailia", "sex": "female", "age": 35, "country": "Egypt", "marital_status": "married", "education": "middle", "social_class": "lower middle class"}, "question": {"id": "Q142", "variant": 0}, "response": ["From an emic perspective, as a married female from Ismailia, Egypt, my cultural context and socioeconomic background play a significant role in my answer to the question. In my cultural context, women are often expected to prioritize family and home responsibilities, and finding a job that accommodates these expectations can be challenging. Additionally, with a middle education level and a lower middle-class socioeconomic background, job opportunities may be limited and competition may be fierce. As a result, the fear of losing my job or not finding a job is a very real and significant concern that weighs heavily on my mind. Additionally, my personal experience and individual values further contribute to this worry, as financial stability and the ability to provide for my family are important to me. Taking into consideration the nuanced phrasing of the question and the anthropological framework, I select:\n\n(1) Very much"]}, {"persona": {"region": "Ismailia", "sex": "female", "age": 57, "country": "Egypt", "marital_status": "married", "education": "lower", "social_class": "working class"}, "question": {"id": "Q142", "variant": 0}, "response": ["Based on the anthropological framework, as a married female from Ismailia, Egypt, I understand the importance of considering the emic perspective. In my cultural context, being part of the working class and having completed lower education level, finding and keeping a job is crucial for my livelihood. My individual values and personal experience also play a significant role in shaping my perspective. Given the socioeconomic background and the current job market in Ismailia, I am very worried about losing my job or not finding a job. Additionally, with my age and lower education level, job opportunities may be limited, further heightening my concern. Therefore, my answer is:\n\n(1) Very much"]}, {"persona": {"region": "Ismailia", "sex": "male", "age": 33, "country": "Egypt", "marital_status": "married", "education": "middle", "social_class": "lower middle class"}, "question": {"id": "Q142", "variant": 0}, "response": ["Based on my cultural context and socioeconomic background, as a married male from Ismailia, Egypt, who considers himself part of the lower middle class, my worries about losing my job or not finding a job are very much influenced by my individual values and personal experience. In Egypt, the job market is competitive and unemployment rates are high, especially for individuals with only a middle education level. Additionally, the socioeconomic background of being in the lower middle class means that financial stability is a constant concern. Therefore, my worries about job security are very much present, as it directly impacts my ability to provide for my family and maintain a decent standard of living.\n\n1"]}, {"persona": {"region": "Ismailia", "sex": "female", "age": 49, "country": "Egypt", "marital_status": "single", "education": "higher", "social_class": "upper middle class"}, "question": {"id": "Q142", "variant": 0}, "response": ["Based on the anthropological framework, my perspective as a single female from Ismailia, Egypt, who is 49 years old, highly educated, and part of the upper middle class will heavily influence my answer to the question. My cultural context and socioeconomic background play a significant role in shaping my perception of job security. Additionally, my individual values and personal experiences, such as the importance of financial stability and the competitive job market in my area, will also impact my response. Considering these factors, I would choose:\n\n(3) Not much"]}, {"persona": {"region": "Ismailia", "sex": "female", "age": 35, "country": "Egypt", "marital_status": "married", "education": "higher", "social_class": "lower middle class"}, "question": {"id": "Q142", "variant": 0}, "response": ["Based on the anthropological framework, my answer is influenced by my individual values and personal experience, as well as my socioeconomic background. As a married female from Ismailia, Egypt, who is 35 years old and part of the lower middle class, I am worried about losing my job or not finding a job. This is because my income and socioeconomic background are important factors in my subjective understanding of the importance of job security. Additionally, the cultural context of Egypt, where the job market is competitive and opportunities may be limited, also contributes to my concern. Therefore, my answer is: (1) Very much"]}, {"persona": {"region": "Ismailia", "sex": "male", "age": 24, "country": "Egypt", "marital_status": "single", "education": "higher", "social_class": "upper middle class"}, "question": {"id": "Q142", "variant": 0}, "response": ["Based on the anthropological framework, as a 24-year-old single male from Ismailia, Egypt, with a higher education level and a self-identified upper-middle-class background, my perspective on job security is shaped by my individual values and personal experience. I have likely been instilled with a strong work ethic and value financial stability. Additionally, my socioeconomic background may have provided me with a sense of entitlement to secure employment. Furthermore, the cultural context of Ismailia may place a high emphasis on career success and financial independence. Therefore, I am likely to be very worried about losing my job or not finding a job, as it could impact my social status and personal well-being.\n\n1"]}, {"persona": {"region": "Ismailia", "sex": "female", "age": 23, "country": "Egypt", "marital_status": "single", "education": "higher", "social_class": "lower middle class"}, "question": {"id": "Q142", "variant": 0}, "response": ["From an emic perspective, as a single female from Ismailia, Egypt, my cultural context and socioeconomic background heavily influence my perception of job security. Ismailia is a city with limited job opportunities, especially for women, and my lower middle class status means that I do not have a strong financial safety net to fall back on. Additionally, my personal experience and individual values make me acutely aware of the challenges that come with finding and keeping a job in this context. Therefore, I am very worried about losing my job or not finding a job.\n\n1"]}, {"persona": {"region": "Ismailia", "sex": "male", "age": 55, "country": "Egypt", "marital_status": "married", "education": "middle", "social_class": "lower middle class"}, "question": {"id": "Q142", "variant": 0}, "response": ["From an emic perspective, as a married male from Ismailia, Egypt, my cultural context and socioeconomic background play a crucial role in my understanding and answer to this question. Ismailia is a city that has faced economic challenges, and being part of the lower middle class, I am acutely aware of the struggles to find and maintain employment. My personal experience and individual values also contribute to my worry about job security, as I have seen many in my community struggle with unemployment. Additionally, being 55 years old and having completed only a middle education level, I am aware of the limited opportunities available to me in the job market. Therefore, considering all these factors, I would choose the option (1) Very much, as I am indeed very worried about losing my job or not finding a job."]}, {"persona": {"region": "Ismailia", "sex": "male", "age": 57, "country": "Egypt", "marital_status": "married", "education": "middle", "social_class": "upper middle class"}, "question": {"id": "Q142", "variant": 0}, "response": ["Based on my emic perspective as a married male from Ismailia, Egypt, my cultural context, individual values, and personal experience as part of the upper middle class, I am very concerned about losing my job or not finding a job. In my cultural context, providing for my family is a crucial responsibility, and the stability of my job is directly tied to my ability to fulfill this role. Additionally, my socioeconomic background and age play a significant role in my concerns about job security, as I am at a stage in life where financial stability is paramount. Therefore, I am very much worried about losing my job or not finding a job.\n\n1"]}, {"persona": {"region": "Ismailia", "sex": "female", "age": 29, "country": "Egypt", "marital_status": "married", "education": "middle", "social_class": "upper middle class"}, "question": {"id": "Q142", "variant": 0}, "response": ["Based on the anthropological framework, my individual values and personal experience as a married female from Ismailia, Egypt, who considers herself part of the upper middle class, will heavily influence my response to this question. My socioeconomic background and cultural context will also play a significant role in shaping my perception. In Egypt, there is a high value placed on financial stability and job security, especially for women. Additionally, as a woman in a patriarchal society, there may be limited opportunities for me in the job market. Therefore, I am likely to be very worried about losing my job or not finding a job.\n\n1"]}, {"persona": {"region": "Damiatta", "sex": "female", "age": 46, "country": "Egypt", "marital_status": "married", "education": "middle", "social_class": "lower middle class"}, "question": {"id": "Q142", "variant": 0}, "response": ["Based on the anthropological framework, my emic perspective as a married female from Damiatta, Egypt, is heavily influenced by my cultural context, individual values, and socioeconomic background. In Egypt, women often face barriers in accessing employment opportunities, and as a member of the lower middle class, I have limited resources to fall back on. Additionally, my personal experience and values have taught me to prioritize financial stability for my family. Therefore, I am very worried about losing my job or not finding a job because it directly impacts my ability to provide for my family and maintain our socioeconomic status.\n\n2"]}, {"persona": {"region": "Damiatta", "sex": "female", "age": 20, "country": "Egypt", "marital_status": "single", "education": "middle", "social_class": "lower middle class"}, "question": {"id": "Q142", "variant": 0}, "response": ["Based on the anthropological framework, my perspective as a single female from Damiatta, Egypt, is influenced by my cultural context, individual values, and socioeconomic background. Living in a lower middle class environment, the job market is competitive and opportunities are limited. Additionally, my personal experience and age play a role in my perception of job security. Therefore, I am very worried about losing my job or not finding a job.\n\n1"]}, {"persona": {"region": "Damiatta", "sex": "male", "age": 19, "country": "Egypt", "marital_status": "single", "education": "middle", "social_class": "lower middle class"}, "question": {"id": "Q142", "variant": 0}, "response": ["Based on the anthropological framework presented, as a single male from Damiatta, Egypt, my emic perspective is heavily influenced by my cultural context and socioeconomic background. In my community, there is a high value placed on finding stable employment to support oneself and one's family. As a member of the lower middle class, I am acutely aware of the challenges and competition for jobs in my area, especially as a 19-year-old with only a middle education level. Additionally, my personal experience and individual values lead me to prioritize financial stability and independence. Therefore, I am very worried about losing my job or not finding a job, as it would greatly impact my ability to meet my basic needs and pursue my aspirations.\n\n2"]}, {"persona": {"region": "Damiatta", "sex": "female", "age": 33, "country": "Egypt", "marital_status": "married", "education": "higher", "social_class": "lower middle class"}, "question": {"id": "Q142", "variant": 0}, "response": ["Based on my personal experience and socioeconomic background as a married female from Damiatta, Egypt, I am very worried about losing my job or not finding a job. As part of the lower middle class, I understand the importance of financial stability and the impact of unemployment on my family's well-being. Additionally, the cultural context in Egypt places a strong emphasis on the value of work and providing for one's family, which further amplifies my concern about job security. Considering my emic perspective, socioeconomic background, and cultural context, my answer is:\n\n1) Very much"]}, {"persona": {"region": "Damiatta", "sex": "male", "age": 24, "country": "Egypt", "marital_status": "single", "education": "higher", "social_class": "lower middle class"}, "question": {"id": "Q142", "variant": 0}, "response": ["Based on the anthropological framework, as a single male from Damiatta, Egypt, my emic perspective would be that job security is a significant concern due to the economic challenges faced by my community. The cultural context of Damiatta, where unemployment rates are high and job opportunities are limited, would also contribute to my worry about losing or not finding a job. Additionally, my individual values and personal experience, as well as my lower middle class socioeconomic background, would further emphasize the importance of job stability for me. Considering the nuance of the question, my response would be that I am (2) A good deal worried about losing my job or not finding a job."]}, {"persona": {"region": "Suez", "sex": "male", "age": 41, "country": "Egypt", "marital_status": "married", "education": "middle", "social_class": "working class"}, "question": {"id": "Q142", "variant": 0}, "response": ["Based on the anthropological framework, as a married male from Suez, Egypt, who is 41 years old, completed middle education, and considers myself part of the working class, my perspective is heavily influenced by my socioeconomic background and cultural context. In Egypt, the job market can be highly competitive, and as a working-class individual, the fear of losing my job or not finding a new one is a very real concern. The current economic situation and lack of job security in my region also contribute to this worry. Therefore, I would choose option (1) Very much, as I am genuinely worried about the prospect of unemployment impacting my family's well-being."]}, {"persona": {"region": "Suez", "sex": "female", "age": 39, "country": "Egypt", "marital_status": "divorced", "education": "middle", "social_class": "working class"}, "question": {"id": "Q142", "variant": 0}, "response": ["Based on the anthropological framework, as a divorced female from Suez, Egypt, who is 39 years old and part of the working class, my emic perspective would be heavily influenced by my individual values and personal experience, as well as my socioeconomic background. As a working-class woman, my income and job security are crucial to my well-being and the well-being of my family. Additionally, the cultural context of Egypt may also play a role, as job opportunities for women, especially divorced women, may be limited. Therefore, I would answer the question with option (1) Very much, as the fear of losing my job or not finding a job is a significant concern for me and my livelihood."]}, {"persona": {"region": "Cairo", "sex": "female", "age": 55, "country": "Egypt", "marital_status": "married", "education": "middle", "social_class": "working class"}, "question": {"id": "Q142", "variant": 0}, "response": ["Based on the anthropological framework, as a married female from Cairo, Egypt, at the age of 55 with a middle education level and considering myself part of the working class, my perspective on job security is heavily influenced by my socioeconomic background and personal experience. In Cairo, the job market can be competitive and opportunities for those with only a middle education level may be limited. Additionally, as a member of the working class, my income and financial stability may heavily depend on my employment. Therefore, I am likely to be very worried about losing my job or not finding a new one, as it could have significant implications for my livelihood and well-being.\n\n2"]}, {"persona": {"region": "Cairo", "sex": "male", "age": 58, "country": "Egypt", "marital_status": "married", "education": "middle", "social_class": "lower middle class"}, "question": {"id": "Q142", "variant": 0}, "response": ["Based on the anthropological framework, my answer to the question would be \"A good deal\" (2). As a married male from Cairo, Egypt, at the age of 58, and having completed only middle education, I am part of the lower middle class. My socioeconomic background greatly influences my concern about job security, as finding stable employment at my age and education level is challenging in Egypt. Additionally, my cultural context, where economic opportunities are limited, and my personal experience of struggling to provide for my family, greatly contributes to my worry about losing or not finding a job. Therefore, I would choose \"A good deal\" (2) to reflect my genuine concerns about job security."]}, {"persona": {"region": "Cairo", "sex": "female", "age": 29, "country": "Egypt", "marital_status": "married", "education": "higher", "social_class": "lower middle class"}, "question": {"id": "Q142", "variant": 0}, "response": ["Based on the anthropological framework, my personal experience as a married female from Cairo, Egypt, aged 29, and belonging to the lower middle class is crucial in shaping my perspective. My cultural context, socioeconomic background, and individual values play a significant role in my understanding of job security. In Egypt, the job market is highly competitive and the economic situation is uncertain, especially for individuals from the lower middle class. As a result, I am very worried about losing my job or not finding a job, as it would have a significant impact on my family's financial stability and my ability to support them.\n\n1"]}, {"persona": {"region": "Cairo", "sex": "male", "age": 38, "country": "Egypt", "marital_status": "married", "education": "higher", "social_class": "lower middle class"}, "question": {"id": "Q142", "variant": 0}, "response": ["Based on the anthropological framework, my response to the question of how worried I am about losing my job or not finding a job is influenced by my emic perspective as a married male from Cairo, Egypt. The cultural context of Egypt, including its economic challenges and job market, plays a significant role in shaping my response. As a member of the lower middle class, my socioeconomic background is a crucial factor in my concerns about job security. Additionally, individual values and personal experience, such as the importance of providing for my family and the competitive nature of the job market in Cairo, contribute to my high level of worry about losing or not finding a job. Furthermore, the nuance of the question and the specific phrasing also impact my response. \n\n2"]}, {"persona": {"region": "Cairo", "sex": "female", "age": 40, "country": "Egypt", "marital_status": "married", "education": "higher", "social_class": "lower middle class"}, "question": {"id": "Q142", "variant": 0}, "response": ["Based on the anthropological framework, as a married female from Cairo, Egypt, my emic perspective on job security is heavily influenced by the cultural context and socioeconomic background. In Egypt, there is a strong emphasis on traditional gender roles, and as a married woman, my ability to find and maintain a job may be more limited. Additionally, being part of the lower middle class, the socioeconomic background plays a significant role in my worries about job security, as financial stability is a constant concern. Cultural relativism also comes into play, as the societal expectations and norms in Egypt may differ from those in other countries, impacting my level of concern about job security. Therefore, based on my individual values and personal experience, I would choose option (2) A good deal, as my worries about job security are influenced by my cultural context and socioeconomic background. \n\n2"]}, {"persona": {"region": "Cairo", "sex": "male", "age": 38, "country": "Egypt", "marital_status": "married", "education": "higher", "social_class": "upper middle class"}, "question": {"id": "Q142", "variant": 0}, "response": ["In considering my answer to this question, I must take into account my socioeconomic background as a married male from Cairo, Egypt. As part of the upper middle class, I have a certain level of stability and security in my career. However, I also recognize the importance of cultural context and the current economic climate in Egypt. Despite my education and socioeconomic status, I am aware of the challenges and uncertainties that exist in the job market. Therefore, I must take into consideration the potential impact on my family and lifestyle if I were to lose my job or not find a new one. Based on these factors, I would have to say that I am (2) A good deal worried about losing my job or not finding a new one."]}, {"persona": {"region": "Cairo", "sex": "male", "age": 59, "country": "Egypt", "marital_status": "married", "education": "middle", "social_class": "lower middle class"}, "question": {"id": "Q142", "variant": 0}, "response": ["Based on the anthropological framework, my response to the question is influenced by my cultural context, socioeconomic background, and individual values. As a married male from Cairo, Egypt, I come from a culture where the concept of providing for my family is highly valued, and unemployment can have a significant impact on social status and dignity. Additionally, being part of the lower middle class, I am acutely aware of the limited job opportunities and the fierce competition for employment in my community. Therefore, I am highly concerned about losing my job or not finding a job, as it directly impacts my ability to support my family and maintain my social standing. \n\n2"]}, {"persona": {"region": "Cairo", "sex": "female", "age": 30, "country": "Egypt", "marital_status": "married", "education": "higher", "social_class": "upper middle class"}, "question": {"id": "Q142", "variant": 0}, "response": ["Based on my personal experience and socioeconomic background, I am not very worried about losing my job or not finding a new one. As a married woman from Cairo, Egypt, who has completed higher education and considers myself part of the upper middle class, I have access to a network of opportunities and resources that would make it less likely for me to struggle finding employment. Additionally, my cultural context and values place a strong emphasis on education and career success, which further reduces my concern about job security. Therefore, I would select option (4) Not at all."]}, {"persona": {"region": "Cairo", "sex": "male", "age": 22, "country": "Egypt", "marital_status": "single", "education": "middle", "social_class": "lower middle class"}, "question": {"id": "Q142", "variant": 0}, "response": ["Based on the anthropological framework, my emic perspective as a single male from Cairo, Egypt, who has completed middle education and considers myself part of the lower middle class, is heavily influenced by my cultural context, individual values, and socioeconomic background. In Egypt, job opportunities are scarce, especially for someone with my level of education and socioeconomic status. The cultural context of Egypt also places a strong emphasis on the importance of work and providing for oneself and one's family. Additionally, my individual values and personal experience have taught me the importance of financial stability and independence. Therefore, I am very worried about losing my job or not finding a job.\n\n3"]}, {"persona": {"region": "Cairo", "sex": "male", "age": 29, "country": "Egypt", "marital_status": "single", "education": "higher", "social_class": "lower middle class"}, "question": {"id": "Q142", "variant": 0}, "response": ["From an emic perspective, as a single male from Cairo, Egypt, my cultural context and socioeconomic background greatly impact my worries about job security. In Egypt, the job market is highly competitive, and finding stable employment can be challenging, especially for someone from the lower middle class. My personal experience and individual values also play a role in my concerns, as I have seen friends and family members struggle to find steady work. Additionally, the current economic conditions in Egypt and the instability of the job market further contribute to my worries. Considering these factors, I would choose the option: (1) Very much"]}, {"persona": {"region": "Cairo", "sex": "female", "age": 31, "country": "Egypt", "marital_status": "married", "education": "higher", "social_class": "lower middle class"}, "question": {"id": "Q142", "variant": 0}, "response": ["From an anthropological perspective, my emic and etic perspectives as a married female from Cairo, Egypt, who is 31 years old and part of the lower middle class, greatly influence my view on job security. The cultural context of Egypt, with its economic challenges and high unemployment rates, means that finding and keeping a job is a significant concern for many individuals, especially for those in the lower middle class. My individual values and personal experience also play a role, as I have witnessed the struggles of friends and family members in securing stable employment. Additionally, my socioeconomic background further amplifies this worry, as I have limited financial resources to fall back on in case of job loss. Therefore, based on these factors, I would choose option (1) Very much."]}, {"persona": {"region": "Cairo", "sex": "male", "age": 59, "country": "Egypt", "marital_status": "married", "education": "higher", "social_class": "upper middle class"}, "question": {"id": "Q142", "variant": 0}, "response": ["Based on my emic perspective as a married male from Cairo, Egypt, with a higher education level and part of the upper middle class, I understand that my cultural context and socioeconomic background play a significant role in my response to this question. In Cairo, the job market can be competitive, and there is a strong emphasis on financial stability and providing for one's family. Additionally, my personal values and experiences have led me to prioritize job security and financial stability. Therefore, I would choose:\n\n(1) Very much"]}, {"persona": {"region": "Cairo", "sex": "male", "age": 27, "country": "Egypt", "marital_status": "single", "education": "middle", "social_class": "working class"}, "question": {"id": "Q142", "variant": 0}, "response": ["From the perspective of a single male from Cairo, Egypt, who is 27 years old and considers himself part of the working class, the response to the question of how worried he is about losing his job or not finding a job would be \"A good deal\" (Option 2). This response is shaped by the cultural context of Cairo, where the job market is competitive and opportunities for stable employment may be limited. Additionally, his individual values and personal experience as a working-class individual with only a middle education level would lead him to be concerned about his job security. His socioeconomic background also plays a role, as he may not have the same safety net as those from higher socioeconomic backgrounds. Lastly, the nuance of the question also leads him to choose this response, as it recognizes the potential uncertainty and vulnerability he may feel in the current job market. \n\n2"]}, {"persona": {"region": "Cairo", "sex": "female", "age": 25, "country": "Egypt", "marital_status": "single", "education": "higher", "social_class": "working class"}, "question": {"id": "Q142", "variant": 0}, "response": ["Based on the anthropological framework, my perspective as a single female from Cairo, Egypt, who is 25 years old, completed higher education, and considers herself part of the working class, is heavily influenced by my cultural context, individual values, and socioeconomic background. In Egypt, job security is not guaranteed, especially for women, and the working class often faces challenges in finding stable employment. Additionally, my personal experience and values lead me to prioritize financial stability and independence. Therefore, I am very worried about losing my job or not finding a job.\n\n2"]}, {"persona": {"region": "Cairo", "sex": "female", "age": 23, "country": "Egypt", "marital_status": "married", "education": "higher", "social_class": "lower middle class"}, "question": {"id": "Q142", "variant": 0}, "response": ["Based on the anthropological framework, as a married female from Cairo, Egypt, my emic perspective would be heavily influenced by the cultural context of the region, where unemployment rates are high and finding a stable job, especially as a woman, is challenging. My individual values and personal experience also play a role, as I have seen many people struggle to find employment despite their education level. Additionally, my lower middle-class socioeconomic background means that job security is a significant concern for me and my family's financial stability. Therefore, I would choose option (1) Very much, as the fear of losing my job or not finding a job is a very real and pressing concern for me and many others in similar circumstances. \n\n1"]}, {"persona": {"region": "Cairo", "sex": "male", "age": 58, "country": "Egypt", "marital_status": "married", "education": "higher", "social_class": "working class"}, "question": {"id": "Q142", "variant": 0}, "response": ["Based on the anthropological framework, as a married male from Cairo, Egypt, at the age of 58 and part of the working class, my perspective on job security would be heavily influenced by my socioeconomic background and cultural context. In Egypt, the job market can be competitive and the working class often faces challenges in finding stable employment. Additionally, my personal experience and individual values would lead me to be very worried about losing my job or not finding a job, as this would directly impact my ability to provide for my family and maintain my social status. Therefore, my answer would be:\n\n1) Very much"]}, {"persona": {"region": "Cairo", "sex": "female", "age": 40, "country": "Egypt", "marital_status": "married", "education": "higher", "social_class": "working class"}, "question": {"id": "Q142", "variant": 0}, "response": ["Based on the anthropological framework, as a married female from Cairo, Egypt, I would consider the cultural context, individual values, and socioeconomic background in my response. In Egypt, there is a high level of unemployment and finding a job, especially for women, can be challenging. As part of the working class, the fear of losing my job or not finding a job is a significant concern due to the economic pressures and the need to support my family. Additionally, my higher education level may have raised my expectations for career stability, making the fear of unemployment more pronounced. Therefore, considering my cultural context, personal values, and socioeconomic background, I would choose option (1) Very much."]}, {"persona": {"region": "Cairo", "sex": "female", "age": 36, "country": "Egypt", "marital_status": "married", "education": "middle", "social_class": "upper middle class"}, "question": {"id": "Q142", "variant": 0}, "response": ["Based on my cultural context in Cairo, Egypt, and my socioeconomic background as part of the upper middle class, I understand that job security is not guaranteed, especially in a country with economic instability. My personal experience and values also contribute to my understanding that losing my job or not finding a job could have significant implications for my family's financial stability and social status. Additionally, the cultural context of Egypt places a strong emphasis on the importance of work and providing for one's family. Therefore, I am worried about losing my job or not finding a job. \n\n2"]}, {"persona": {"region": "Cairo", "sex": "male", "age": 40, "country": "Egypt", "marital_status": "married", "education": "middle", "social_class": "lower middle class"}, "question": {"id": "Q142", "variant": 0}, "response": ["Based on the anthropological framework, my perspective as a married male from Cairo, Egypt, at 40 years of age and part of the lower middle class, is heavily influenced by my socioeconomic background, individual values, and personal experience. In Egypt, job insecurity is a major concern, especially for those in the lower middle class. The economic conditions and lack of job opportunities make it difficult for people like me to find stable employment, and the fear of losing my job or not finding one is a constant worry. Additionally, my personal experience and the experiences of those around me have shown that job security is not guaranteed, leading to a high level of concern about this issue. Therefore, my answer to the question is:\n\n1"]}, {"persona": {"region": "Cairo", "sex": "female", "age": 30, "country": "Egypt", "marital_status": "married", "education": "middle", "social_class": "lower class"}, "question": {"id": "Q142", "variant": 0}, "response": ["Based on my emic perspective as a married woman from Cairo, Egypt, who is 30 years old and part of the lower class, my socioeconomic background plays a significant role in shaping my worries about job security. The cultural context of Cairo, where unemployment rates are high and opportunities for lower-class individuals are limited, also contributes to my concerns. My individual values and personal experiences further accentuate my worries, as I have seen many people in similar socioeconomic positions struggle to find stable employment. Additionally, the nuance of the question also influences my response, as the phrasing implies a level of uncertainty about job security. Therefore, I choose option (1) Very much."]}, {"persona": {"region": "Cairo", "sex": "male", "age": 58, "country": "Egypt", "marital_status": "married", "education": "higher", "social_class": "lower middle class"}, "question": {"id": "Q142", "variant": 0}, "response": ["Based on the anthropological framework, my perspective as a married male from Cairo, Egypt, at the age of 58, with a lower middle class socioeconomic background, would be heavily influenced by my cultural context, individual values, and personal experience. In Egypt, there is a high level of competition for jobs, and the economic situation is often unstable. My personal experience and cultural context would lead me to be very worried about losing my job or not finding a job, as it would have a significant impact on my family's well-being and social status.\n\n2"]}, {"persona": {"region": "Cairo", "sex": "male", "age": 50, "country": "Egypt", "marital_status": "married", "education": "middle", "social_class": "lower middle class"}, "question": {"id": "Q142", "variant": 0}, "response": ["Based on the anthropological framework, as a married man from Cairo, Egypt, at 50 years of age with a middle education level and considering myself part of the lower middle class, my answer to the question would be (2) A good deal. My socioeconomic background and cultural context play a significant role in my worry about losing my job or not finding a job. In Egypt, the job market is competitive, and opportunities for stable employment can be limited, especially for individuals with a lower educational background. Additionally, as a married individual responsible for providing for my family, the fear of unemployment and financial instability is a constant concern. Therefore, my worry about losing my job or not finding a job is substantial."]}, {"persona": {"region": "Cairo", "sex": "female", "age": 40, "country": "Egypt", "marital_status": "married", "education": "higher", "social_class": "upper middle class"}, "question": {"id": "Q142", "variant": 0}, "response": ["In considering the question of job security from the perspective of a married female from Cairo, Egypt, who is 40 years old, has completed a higher education level, and considers herself part of the upper middle class, it is important to take into account the cultural context and socioeconomic background. In Egypt, there is a strong emphasis on education and career advancement, particularly for those in the middle and upper classes. Additionally, the current economic situation in Egypt has led to high levels of unemployment and underemployment, particularly for educated individuals. This, combined with the societal pressure to maintain a certain standard of living, means that job security is a significant concern for individuals in this demographic. Therefore, the likely response to the question would be a good deal.\n\n2"]}, {"persona": {"region": "Cairo", "sex": "female", "age": 33, "country": "Egypt", "marital_status": "married", "education": "middle", "social_class": "lower middle class"}, "question": {"id": "Q142", "variant": 0}, "response": ["Based on the anthropological framework, my perspective as a married female from Cairo, Egypt, who is 33 years old and part of the lower middle class, is heavily influenced by my cultural context, socioeconomic background, and personal experience. In Egypt, the job market can be tough, especially for women, and the lower middle class often struggles to find stable employment. Additionally, my personal experience and the experiences of those around me have shown me that job security is not guaranteed. Therefore, I am worried about losing my job or not finding a job. This worry is influenced by my cultural context and socioeconomic background, and is a significant concern in my daily life.\n\n1"]}, {"persona": {"region": "Cairo", "sex": "female", "age": 37, "country": "Egypt", "marital_status": "married", "education": "middle", "social_class": "lower middle class"}, "question": {"id": "Q142", "variant": 0}, "response": ["Based on the anthropological framework, my emic perspective as a married female from Cairo, Egypt, who is 37 years old and part of the lower middle class, is influenced by my cultural context, individual values, and socioeconomic background. In Egypt, the job market is competitive, and as a married woman, the pressure to contribute to the household income is significant. Additionally, my middle education level limits my job opportunities, making me worry a good deal about losing my job or not finding a job. This concern is further compounded by the socioeconomic pressures of my lower middle-class status, where financial stability is a constant concern.\n\n2"]}, {"persona": {"region": "Cairo", "sex": "male", "age": 28, "country": "Egypt", "marital_status": "married", "education": "middle", "social_class": "lower middle class"}, "question": {"id": "Q142", "variant": 0}, "response": ["Based on the anthropological framework, as a married male from Cairo, Egypt, who is 28 years old and part of the lower middle class, my perspective on job security is heavily influenced by my socioeconomic background. In a cultural context where finding stable employment can be challenging, especially with only a middle education level, there is a significant concern about job security. Additionally, my individual values and personal experience play a role in shaping my worries about job stability. The cultural relativism aspect also informs my view, as the socioeconomic background and cultural context in Cairo differ from other places, influencing my perception of job security. Therefore, I would choose option (1) Very much, as my concerns about job security are significant given my personal and cultural context. \n\n1"]}, {"persona": {"region": "Cairo", "sex": "male", "age": 53, "country": "Egypt", "marital_status": "married", "education": "higher", "social_class": "working class"}, "question": {"id": "Q142", "variant": 0}, "response": ["From an emic perspective, as a married male from Cairo, Egypt, my cultural context and socioeconomic background play a significant role in shaping my response to this question. Egypt has faced economic challenges and high unemployment rates, especially for the working class. My individual values and personal experience also influence my perception of job security. I have seen many individuals struggle to find stable employment, and the cultural relativism present in Egyptian society acknowledges the uncertainty of the job market. Additionally, as a 53-year-old with higher education, I am aware of the competitive nature of the job market and how my age and qualifications may impact my employability. Thus, considering all these factors, my response to the question would be as follows:\n2"]}, {"persona": {"region": "Cairo", "sex": "male", "age": 45, "country": "Egypt", "marital_status": "married", "education": "higher", "social_class": "lower middle class"}, "question": {"id": "Q142", "variant": 0}, "response": ["Based on the anthropological framework, as a married male from Cairo, Egypt, who is 45 years old and part of the lower middle class, my answer to the question of how worried I am about losing my job or not finding a job would be \"A good deal.\" This answer is influenced by my socioeconomic background, as my income and class status have a significant impact on my job security. Additionally, the cultural context of Egypt, with its economic challenges and competition for jobs, also contributes to my level of concern. Furthermore, my personal experience and individual values play a role in shaping my perception of job security, as I have worked hard to attain my higher education level and provide for my family, making the prospect of losing my job a significant source of worry. Lastly, the nuanced phrasing of the question also influences my response, as it invites me to consider the potential impact of not finding a job, in addition to the fear of losing one. \n\n2"]}, {"persona": {"region": "Cairo", "sex": "male", "age": 52, "country": "Egypt", "marital_status": "married", "education": "middle", "social_class": "upper middle class"}, "question": {"id": "Q142", "variant": 0}, "response": ["From the anthropological framework, my perspective as a married male from Cairo, Egypt, is heavily influenced by my cultural context, individual values, and socioeconomic background. In Egypt, the economy is not stable, and finding a job can be a great challenge, especially for someone of my age and educational background. Being part of the upper middle class, I have certain expectations and responsibilities to maintain my social and economic status. Additionally, the cultural context of Egypt places a strong emphasis on the importance of providing for one's family, which adds to my worries about losing or not finding a job. Therefore, considering my age, education, and socioeconomic background, I would answer the question with option (1) Very much."]}, {"persona": {"region": "Cairo", "sex": "male", "age": 22, "country": "Egypt", "marital_status": "single", "education": "higher", "social_class": "lower middle class"}, "question": {"id": "Q142", "variant": 0}, "response": ["Based on the anthropological framework, as a single male from Cairo, Egypt, at 22 years of age with a lower middle class background, my perspective on job security is heavily influenced by my cultural context, socioeconomic background, and individual values. In Cairo, job opportunities can be limited, especially for someone with no significant work experience. The cultural context of Egypt also places a strong emphasis on the importance of finding stable employment to support oneself and potentially a family in the future. Additionally, my lower middle class background means that I may not have the same safety net or resources to fall back on if I were to lose my job. Therefore, I am inclined to be very worried about losing my job or not finding a job.\n\n2"]}, {"persona": {"region": "Cairo", "sex": "female", "age": 57, "country": "Egypt", "marital_status": "divorced", "education": "middle", "social_class": "lower middle class"}, "question": {"id": "Q142", "variant": 0}, "response": ["From an emic perspective, as a divorced female from Cairo, Egypt, my cultural context and socioeconomic background play a significant role in my answer. Women in Egypt often face challenges in finding employment, especially as they get older. Additionally, being part of the lower middle class means that I do not have a strong financial safety net, so losing my job would have a significant impact on my livelihood. My individual values and personal experience also contribute to my concern about job security, as I have seen others in similar circumstances struggle to find stable employment. Therefore, my answer to the question would be (1) Very much."]}, {"persona": {"region": "Cairo", "sex": "female", "age": 42, "country": "Egypt", "marital_status": "married", "education": "middle", "social_class": "working class"}, "question": {"id": "Q142", "variant": 0}, "response": ["Based on the anthropological framework, as a married female from Cairo, Egypt, who is part of the working class, my emic perspective of the question is heavily influenced by my socioeconomic background. In Egypt, the job market is competitive and the economic situation is uncertain. My etic perspective is influenced by the cultural context of Cairo, where finding stable employment can be challenging. Additionally, my individual values and personal experience as a middle-educated woman in her 40s play a significant role in my worry about job stability. Therefore, I would choose option (1) Very much."]}, {"persona": {"region": "Cairo", "sex": "female", "age": 23, "country": "Egypt", "marital_status": "single", "education": "middle", "social_class": "lower middle class"}, "question": {"id": "Q142", "variant": 0}, "response": ["Based on the anthropological framework, my emic perspective as a single female from Cairo, Egypt, with a middle education level and lower middle-class background, is heavily influenced by my cultural context, individual values, and socioeconomic background. In Egypt, the job market is highly competitive, and opportunities for women, especially those with limited education and financial resources, are scarce. Additionally, my personal experience and values lead me to prioritize financial stability and independence. Therefore, given these factors, I am very worried about losing my job or not finding a job. (1) Very much"]}, {"persona": {"region": "Cairo", "sex": "female", "age": 28, "country": "Egypt", "marital_status": "married", "education": "higher", "social_class": "upper middle class"}, "question": {"id": "Q142", "variant": 0}, "response": ["Based on the anthropological framework, my answer to the question is influenced by my personal experience, socioeconomic background, and cultural context. As a married female from Cairo, Egypt, who has completed higher education and considers myself part of the upper middle class, I am relatively privileged compared to many others in my society. However, the current economic and political situation in Egypt has created a lot of uncertainty when it comes to employment opportunities, and as a result, I am somewhat worried about losing my job or not finding a new one.\n\n2"]}, {"persona": {"region": "Cairo", "sex": "female", "age": 22, "country": "Egypt", "marital_status": "single", "education": "higher", "social_class": "lower middle class"}, "question": {"id": "Q142", "variant": 0}, "response": ["Based on the anthropological framework, as a single female from Cairo, Egypt who is 22 years old and part of the lower middle class, my response to the question of how worried I am about losing my job or not finding a job would be influenced by my cultural context, socioeconomic background, and personal experience. In Egypt, there are limited job opportunities, especially for young women, and the lower middle class often struggles with job insecurity. Additionally, as a young person who has recently completed higher education, I am keenly aware of the competitive job market and the challenges of finding stable employment. Therefore, I would choose option (1) Very much, to convey the genuine concern and anxiety I feel about my job prospects.\n\n1"]}, {"persona": {"region": "Cairo", "sex": "female", "age": 39, "country": "Egypt", "marital_status": "married", "education": "middle", "social_class": "lower middle class"}, "question": {"id": "Q142", "variant": 0}, "response": ["Based on the anthropological framework, my response to the question of how worried I am about losing my job or not finding a job would be influenced by my emic perspective as a married female from Cairo, Egypt, with a middle education level and lower middle-class background. In my cultural context, job security is a significant concern due to the economic challenges and limited job opportunities in my community. My individual values and personal experience also play a role, as I have witnessed the impact of unemployment on families similar to mine. Additionally, my socioeconomic background further heightens my concern about job stability. Considering these factors, my answer would be:\n\n2) A good deal"]}, {"persona": {"region": "Cairo", "sex": "male", "age": 19, "country": "Egypt", "marital_status": "single", "education": "middle", "social_class": "working class"}, "question": {"id": "Q142", "variant": 0}, "response": ["As a single male from Cairo, Egypt, who is 19 years old and part of the working class, my perspective is shaped by my cultural context, socioeconomic background, and individual values. In Egypt, the job market is competitive and the unemployment rate is high, especially for young people. As someone who has completed only middle education, I understand that my job opportunities may be limited, and I am very worried about losing my job or not finding a job. This concern is compounded by the fact that my socioeconomic background may not provide me with a safety net if I were to lose my job. Therefore, my answer to the question would be (1) Very much."]}, {"persona": {"region": "Cairo", "sex": "female", "age": 54, "country": "Egypt", "marital_status": "married", "education": "middle", "social_class": "working class"}, "question": {"id": "Q142", "variant": 0}, "response": ["From the perspective of a married female from Cairo, Egypt, who is 54 years old, completed middle education, and considers herself part of the working class, several factors come into play in answering the question. The cultural context in Egypt, especially for women in the working class, is one of economic uncertainty and limited job opportunities. Socioeconomic background also plays a significant role, as individuals in the working class often struggle to secure stable employment. Additionally, personal experience and individual values contribute to the understanding that job security is a significant concern. Therefore, the most likely answer from this perspective would be:\n2"]}, {"persona": {"region": "Cairo", "sex": "male", "age": 30, "country": "Egypt", "marital_status": "married", "education": "higher", "social_class": "working class"}, "question": {"id": "Q142", "variant": 0}, "response": ["Based on the anthropological framework, as a married male from Cairo, Egypt, at the age of 30 and considering myself part of the working class, my answer to the question would be \"A good deal\". This response is influenced by my cultural context, where job security and employment opportunities are crucial factors in providing for my family and maintaining my social status. Additionally, my individual values and personal experience play a significant role as well, as I have witnessed the impact of unemployment on others in my community and understand the challenges it can bring. Furthermore, my socioeconomic background as a member of the working class also contributes to my concern about job stability. Lastly, the nuance of the question also plays a role in my response, as it acknowledges the potential for both losing a job and not finding one, which are both valid concerns in my current circumstances. \n\n2"]}, {"persona": {"region": "Cairo", "sex": "male", "age": 39, "country": "Egypt", "marital_status": "married", "education": "higher", "social_class": "lower middle class"}, "question": {"id": "Q142", "variant": 0}, "response": ["Based on the anthropological framework, my response to the question about job security is influenced by my emic perspective as a married male from Cairo, Egypt, and my lower middle class socioeconomic background. The cultural context of Egypt and its economic challenges, along with the individual values and personal experiences of myself and those around me, lead me to consider job security as a significant concern. Additionally, the nuance of the question allows me to express that I am \"very much\" worried about losing my job or not finding a job.\n\n1"]}, {"persona": {"region": "Cairo", "sex": "female", "age": 41, "country": "Egypt", "marital_status": "married", "education": "middle", "social_class": "lower middle class"}, "question": {"id": "Q142", "variant": 0}, "response": ["Based on the anthropological framework, as a 41-year-old married woman from Cairo, Egypt, with a lower middle-class socioeconomic background, my perspective on job security is heavily influenced by my cultural context, individual values, and personal experience. In Egypt, the job market can be challenging, especially for women, and the uncertainty of finding stable employment is a common concern. Additionally, my middle education level may limit my opportunities for higher-paying or more secure jobs. Considering these factors, I would be worried about losing my job or not finding a job, as it directly impacts my family's financial stability and my ability to support them.\n\n2"]}, {"persona": {"region": "Cairo", "sex": "male", "age": 45, "country": "Syria", "marital_status": "single", "education": "higher", "social_class": "upper middle class"}, "question": {"id": "Q142", "variant": 0}, "response": ["Based on my emic perspective as a single male from Cairo, Syria, my cultural context and individual values play a significant role in my perception of job security. In our cultural context, being able to provide for oneself and one's family is highly valued, and socioeconomic background also factors into this. As someone from the upper middle class who has completed higher education, I have likely worked hard to achieve my professional status and have certain expectations for my career. Additionally, the current economic and political situation in Syria may contribute to a sense of insecurity regarding job stability. Therefore, considering all these factors, I would choose option (2) A good deal."]}, {"persona": {"region": "Cairo", "sex": "male", "age": 54, "country": "Egypt", "marital_status": "married", "education": "higher", "social_class": "lower middle class"}, "question": {"id": "Q142", "variant": 0}, "response": ["Based on the anthropological framework, as a married male from Cairo, Egypt, I will answer this question from the perspective of my socioeconomic background, individual values, personal experience, and cultural context. In my cultural context, the stability of employment is a major concern, especially for those in the lower middle class. With the economic challenges in Egypt, finding and keeping a job is a constant worry for people in my position. Additionally, my personal experience and values lead me to prioritize job security and stability. Therefore, my answer to the question would be:\n\n2) A good deal"]}, {"persona": {"region": "Cairo", "sex": "male", "age": 65, "country": "Egypt", "marital_status": "married", "education": "middle", "social_class": "upper middle class"}, "question": {"id": "Q142", "variant": 0}, "response": ["From my perspective as a married male from Cairo, Egypt, I am deeply concerned about the possibility of losing my job or not finding a new one. In our cultural context, providing for one's family and maintaining financial stability is of utmost importance. As someone who considers themselves part of the upper middle class, my socioeconomic background plays a significant role in my answer. Additionally, at 65 years of age, I am approaching retirement age and may face age discrimination in the job market. The cultural value of providing for my family and the potential impact on my socioeconomic status greatly influence my level of concern about job security. Additionally, my personal experience and individual values also contribute to my worry about job stability. \n\n2"]}, {"persona": {"region": "Cairo", "sex": "female", "age": 52, "country": "Egypt", "marital_status": "married", "education": "middle", "social_class": "upper middle class"}, "question": {"id": "Q142", "variant": 0}, "response": ["Based on the anthropological framework, my answer is influenced by my individual values and personal experience, as well as my socioeconomic background. As a married female from Cairo, Egypt, at the age of 52 with a middle education level and considering myself part of the upper middle class, my worries about losing my job or not finding a job are less than those in lower socioeconomic classes. I have likely established a stable career and have a network of connections that can help me find new opportunities if necessary. Therefore, I would say I am not worried much about losing my job or not finding a job.\n\n3"]}, {"persona": {"region": "Cairo", "sex": "male", "age": 26, "country": "Egypt", "marital_status": "single", "education": "higher", "social_class": "lower middle class"}, "question": {"id": "Q142", "variant": 0}, "response": ["From an emic perspective, as a single male from Cairo, Egypt, I have witnessed the high levels of unemployment and economic instability in my community. The cultural context of Egypt also plays a significant role in my perception of job security, as the socioeconomic background of being part of the lower middle class means that finding and keeping a job is a constant concern. My personal experience and individual values have shaped my understanding of the importance of job security, and the cultural relativism within my community emphasizes the significance of stable employment. Additionally, age and place are important factors, and at 26 years old in Cairo, job security is a top priority for me. Therefore, based on these factors, I would have to choose the option: (1) Very much"]}, {"persona": {"region": "Cairo", "sex": "male", "age": 32, "country": "Egypt", "marital_status": "married", "education": "middle", "social_class": "working class"}, "question": {"id": "Q142", "variant": 0}, "response": ["From an anthropological perspective, my emic perspective as a married male from Cairo, Egypt, who is 32 years old and part of the working class, would lead me to consider the cultural context, individual values, and socioeconomic background in answering this question. In Egypt, the economic situation is challenging, and the job market is competitive, especially for someone with only a middle-level education. My personal experience and values also play a significant role, as my income is crucial for supporting my family and providing for our basic needs. Additionally, cultural relativism reminds me that the perception of job security and the importance of employment may differ from other cultural perspectives. Therefore, I would choose option (1) Very much, as the fear of losing my job or not finding a job is a significant concern given my cultural and socioeconomic context. \n\n1"]}, {"persona": {"region": "Cairo", "sex": "male", "age": 38, "country": "Egypt", "marital_status": "married", "education": "middle", "social_class": "lower middle class"}, "question": {"id": "Q142", "variant": 0}, "response": ["Based on the anthropological framework, as a married male from Cairo, Egypt, at the age of 38, with a middle education level and considering myself part of the lower middle class, my perspective on job security is heavily influenced by my cultural context, socioeconomic background, and personal experience. In Egypt, the job market is competitive and the economy is unstable, especially for individuals with lower education levels. Additionally, being part of the lower middle class means that I have to constantly worry about providing for my family and ensuring financial stability. Therefore, my answer to the question would be (1) Very much."]}, {"persona": {"region": "Cairo", "sex": "male", "age": 58, "country": "Egypt", "marital_status": "married", "education": "higher", "social_class": "upper middle class"}, "question": {"id": "Q142", "variant": 0}, "response": ["Based on the anthropological framework, as a married male from Cairo, Egypt, who is 58 years old and part of the upper middle class, my perspective on job security is influenced by various factors. My cultural context, socioeconomic background, and individual values all play a role in shaping my concern for job security. In Egypt, the job market can be competitive, and economic instability can impact job prospects. Additionally, as someone who values financial stability and has invested in higher education, I recognize the importance of a secure job for maintaining my lifestyle and providing for my family. Therefore, I am moderately worried about losing my job or not finding a job, as it could significantly impact my socioeconomic status and lifestyle.\n\n2"]}, {"persona": {"region": "Cairo", "sex": "male", "age": 49, "country": "Egypt", "marital_status": "married", "education": "middle", "social_class": "lower middle class"}, "question": {"id": "Q142", "variant": 0}, "response": ["Based on the anthropological framework, as a married male from Cairo, Egypt, at 49 years of age and part of the lower middle class, my perspective on job security is heavily influenced by my cultural context, socioeconomic background, and personal experience. In Cairo, the job market is competitive and the economy is unstable, which causes a great deal of concern for individuals in my socioeconomic position. Additionally, my limited education level limits my access to higher-paying and more secure jobs, further exacerbating my worries. Finally, as a middle-aged individual responsible for providing for my family, the fear of losing my job and not being able to find another one is a constant source of anxiety. \n\n2"]}, {"persona": {"region": "Cairo", "sex": "female", "age": 29, "country": "Egypt", "marital_status": "married", "education": "middle", "social_class": "working class"}, "question": {"id": "Q142", "variant": 0}, "response": ["Based on the anthropological framework, as a married female from Cairo, Egypt, my emic perspective is heavily influenced by my cultural context, individual values, and socioeconomic background. In Egypt, the job market is highly competitive and opportunities for women, especially those with only a middle education level, are limited. As a member of the working class, I am acutely aware of the challenges of finding and keeping employment, which are exacerbated by gender and class disparities. My personal experience and value system lead me to be very worried about losing my job or not finding a job, as it would have a significant impact on my family's financial stability and my own sense of agency and independence.\n\n2"]}, {"persona": {"region": "Cairo", "sex": "female", "age": 36, "country": "Egypt", "marital_status": "married", "education": "higher", "social_class": "lower middle class"}, "question": {"id": "Q142", "variant": 0}, "response": ["From an emic perspective, as a married female from Cairo, Egypt, my cultural context and socioeconomic background play a significant role in my answer to this question. In Egypt, the job market can be challenging, especially for women, and the economic situation for the lower middle class is often precarious. Additionally, as an educated woman, I am aware of the competition in the job market and the limited opportunities available to me. My personal experience and individual values also contribute to my worry about job security, as I have worked hard to attain my education and aspire to contribute to my family's financial stability. Taking into account the cultural relativism and the nuanced phrasing of the question, I would choose the option: \n\n(2) A good deal"]}, {"persona": {"region": "Cairo", "sex": "female", "age": 34, "country": "Egypt", "marital_status": "married", "education": "middle", "social_class": "lower middle class"}, "question": {"id": "Q142", "variant": 0}, "response": ["Based on the anthropological framework, as a married female from Cairo, Egypt, with a middle education level and part of the lower middle class, my perspective on job security is heavily influenced by my cultural context, individual values, and socioeconomic background. In Egypt, job opportunities can be scarce, especially for women, and unemployment rates are high. As a result, my worry about losing my job or not finding a job is very much influenced by these factors. Additionally, my lower middle class status means that I may not have the financial stability to weather a period of unemployment, further increasing my concern about job security. Therefore, my answer to the question would be:\n\n1\n\n(Very much)"]}, {"persona": {"region": "Fayoum", "sex": "male", "age": 57, "country": "Egypt", "marital_status": "married", "education": "middle", "social_class": "working class"}, "question": {"id": "Q142", "variant": 0}, "response": ["Based on the anthropological framework described above, my answer is influenced by my socioeconomic background and my personal experience. As a married male from Fayoum, Egypt, who is 57 years old and part of the working class, I have experienced the challenges of finding and maintaining employment. The cultural context of my community also emphasizes the importance of stability and providing for one's family. Additionally, my age and education level may limit my opportunities for finding new employment. Therefore, I am very worried about losing my job or not finding a new one.\n\n2"]}, {"persona": {"region": "Fayoum", "sex": "male", "age": 60, "country": "Egypt", "marital_status": "married", "education": "middle", "social_class": "lower middle class"}, "question": {"id": "Q142", "variant": 0}, "response": ["Based on the anthropological framework, my answer is influenced by my emic perspective as a married male from Fayoum, Egypt, and by my lower middle class socioeconomic background. My cultural context and individual values also play a significant role in my answer. In Egypt, job security is a major concern for individuals, especially those in the lower middle class. The economic situation is precarious, and finding stable employment is a constant worry. Additionally, my personal experience and age further exacerbate my concerns about job security. Therefore, I would choose option (1) Very much, as job security is a significant concern for me in my current socioeconomic and cultural context. \n\n1"]}, {"persona": {"region": "Fayoum", "sex": "male", "age": 21, "country": "Egypt", "marital_status": "single", "education": "middle", "social_class": "lower middle class"}, "question": {"id": "Q142", "variant": 0}, "response": ["From an emic perspective, as a single male from Fayoum, Egypt, my worries about losing my job or not finding a job are heavily influenced by my cultural context, individual values, and socioeconomic background. In my cultural context, there is a strong emphasis on the importance of work and providing for oneself and one's family. As a member of the lower middle class, I am acutely aware of the challenges and competition in the job market, and I know that my socioeconomic background may limit my opportunities. Additionally, my personal experience and the experiences of those around me have shown me the harsh realities of unemployment and the struggles that come with it. Therefore, based on my nuanced understanding of the question and my own circumstances, I would choose the following option:\n\n(1) Very much"]}, {"persona": {"region": "Fayoum", "sex": "male", "age": 33, "country": "Egypt", "marital_status": "single", "education": "higher", "social_class": "working class"}, "question": {"id": "Q142", "variant": 0}, "response": ["Based on the anthropological framework, as a single male from Fayoum, Egypt, who considers himself part of the working class, my socioeconomic background plays a significant role in my worries about losing my job or not finding a job. The cultural context of Egypt, including the current economic situation and job market, also influences my perspective. Additionally, my individual values and personal experience, such as the importance of financial stability and the impact of unemployment on my livelihood, contribute to my level of worry. Therefore, I would choose option (1) Very much as my answer.\n\n1"]}, {"persona": {"region": "Fayoum", "sex": "male", "age": 32, "country": "Egypt", "marital_status": "married", "education": "higher", "social_class": "lower middle class"}, "question": {"id": "Q142", "variant": 0}, "response": ["Based on the anthropological framework, my perspective as a 32-year-old married male from Fayoum, Egypt, who considers himself part of the lower middle class, is influenced by my cultural context, socioeconomic background, and personal experience. In Egypt, the job market is competitive and the economy is not stable, which leads to a high level of uncertainty regarding job security. Additionally, as a member of the lower middle class, my financial stability is a constant concern, further increasing my worry about losing my job or not finding one. Therefore, my answer to the question is option (1) Very much."]}, {"persona": {"region": "Gharbia", "sex": "male", "age": 42, "country": "Egypt", "marital_status": "married", "education": "higher", "social_class": "upper middle class"}, "question": {"id": "Q142", "variant": 0}, "response": ["Based on the anthropological framework, my response to the question about job security is influenced by various factors. From an emic perspective, my cultural context as a married male from Gharbia, Egypt, and my socioeconomic background as part of the upper middle class will impact my answer. Additionally, my individual values and personal experience, as well as the current economic climate in Egypt, will also play a significant role in my perception of job security. Considering these factors, I choose option 3: Not much. \n\n3"]}, {"persona": {"region": "Gharbia", "sex": "male", "age": 52, "country": "Egypt", "marital_status": "married", "education": "middle", "social_class": "working class"}, "question": {"id": "Q142", "variant": 0}, "response": ["Based on the anthropological framework, my response to the question of how worried I am about losing my job or not finding a job is influenced by my cultural context, individual values, and socioeconomic background. As a married male from Gharbia, Egypt, at 52 years old with a middle education level and part of the working class, I am acutely aware of the challenges and uncertainties in the job market. Gharbia is a region with limited job opportunities, and my middle education level may limit the types of jobs available to me. Additionally, as a member of the working class, I understand the precarious nature of employment and the potential impact of unemployment on my family's financial stability. Therefore, I am very much worried about losing my job or not finding a job.\n\n2"]}, {"persona": {"region": "Gharbia", "sex": "male", "age": 45, "country": "Egypt", "marital_status": "divorced", "education": "higher", "social_class": "upper middle class"}, "question": {"id": "Q142", "variant": 0}, "response": ["Based on the anthropological framework outlined, I would like to address the question from the perspective of a divorced male from Gharbia, Egypt, aged 45, with a higher education level and belonging to the upper middle class. From an emic perspective, the cultural context of Egypt, particularly in Gharbia, values stability and financial security, especially for someone in my socioeconomic background. My personal values and individual experience as a divorced man further heighten my concern for job security, as I have financial responsibilities to uphold. Additionally, my socioeconomic background places a significant emphasis on maintaining a certain standard of living, which is closely tied to my professional status. Therefore, considering the nuances of my situation and the cultural expectations, I would choose option (1) Very much. \n\n1"]}, {"persona": {"region": "Behaira", "sex": "male", "age": 23, "country": "Egypt", "marital_status": "single", "education": "middle", "social_class": "lower class"}, "question": {"id": "Q142", "variant": 0}, "response": ["Based on the anthropological framework, as a single male from Behaira, Egypt, aged 23 and part of the lower class, my perspective on job security is heavily influenced by my socioeconomic background. The cultural context in Behaira, Egypt, for someone in my position is one of limited opportunities and high competition for jobs. My personal experience and individual values also play a role, as I have likely seen friends and family members struggle to find stable employment. Additionally, the emic perspective of my in-group and the etic perspective of the out-group both emphasize the importance of job security for someone in my position. Therefore, I am very worried about losing my job or not finding a job. \n\n1"]}, {"persona": {"region": "Behaira", "sex": "male", "age": 38, "country": "Egypt", "marital_status": "single", "education": "higher", "social_class": "lower class"}, "question": {"id": "Q142", "variant": 0}, "response": ["Based on the anthropological framework, as a single male from Behaira, Egypt, who considers myself part of the lower class, my socioeconomic background plays a significant role in how I perceive the question. My worries about job security are heightened due to my lower class status and the limited opportunities available to me. Additionally, cultural context also influences my response as unemployment rates and job availability in Egypt impact my personal experiences and values. Therefore, my answer is:\n2"]}, {"persona": {"region": "Behaira", "sex": "male", "age": 32, "country": "Egypt", "marital_status": "married", "education": "middle", "social_class": "lower class"}, "question": {"id": "Q142", "variant": 0}, "response": ["From the perspective of a married male from Behaira, Egypt, who is 32 years old, has completed middle education, and considers himself part of the lower class, the answer to the question of how worried he is about losing his job or not finding a job would be \"Very much.\" This is because his socioeconomic background and limited education level make finding stable employment and financial security a constant concern. In addition, the cultural context of Egypt, particularly in lower-income areas, emphasizes the importance of providing for one's family, which further contributes to the high level of worry about job stability.\n\n1"]}, {"persona": {"region": "Behaira", "sex": "female", "age": 37, "country": "Egypt", "marital_status": "married", "education": "middle", "social_class": "working class"}, "question": {"id": "Q142", "variant": 0}, "response": ["Based on the anthropological framework, my cultural context as a married female from Behaira, Egypt, with a middle education level and belonging to the working class, plays a significant role in my answer to this question. The socioeconomic background and the current economic situation in Egypt are crucial factors in determining my level of concern about losing or not finding a job. Additionally, my individual values and personal experience as a working-class woman in Egypt also greatly influence my perception of job security. As a married woman, I may have family responsibilities that further contribute to my worry about job stability. Therefore, I choose:\n\n(1) Very much"]}, {"persona": {"region": "Behaira", "sex": "male", "age": 48, "country": "Egypt", "marital_status": "married", "education": "middle", "social_class": "working class"}, "question": {"id": "Q142", "variant": 0}, "response": ["In considering the emic and etic perspectives, as a married male from Behaira, Egypt, at the age of 48 and part of the working class, my cultural context and socioeconomic background play a significant role in my understanding and answering of this question. My individual values and personal experience also contribute to my perception of job security. In Egypt, the working class often faces challenges in finding stable employment, and my middle education level may limit my job opportunities. Additionally, the current economic situation in Egypt may lead to a sense of insecurity regarding job stability. Therefore, based on these factors, I would choose option 1) Very much, as I am indeed very worried about losing my job or not finding a new one."]}, {"persona": {"region": "Behaira", "sex": "female", "age": 34, "country": "Egypt", "marital_status": "married", "education": "middle", "social_class": "lower class"}, "question": {"id": "Q142", "variant": 0}, "response": ["Based on the anthropological framework, as a married female from Behaira, Egypt, aged 34, with a middle education level and considering myself part of the lower class, my emic perspective on the question of job security is influenced by my cultural context, individual values, and socioeconomic background. In my community, job opportunities may be limited, and as a lower-class individual, the loss of a job could have significant implications for my family's financial stability. Additionally, my personal experience and values lead me to prioritize job security as a major concern. Therefore, I would choose option 1: Very much."]}, {"persona": {"region": "Behaira", "sex": "female", "age": 30, "country": "Egypt", "marital_status": "divorced", "education": "lower", "social_class": "lower class"}, "question": {"id": "Q142", "variant": 0}, "response": ["Based on the anthropological framework, my emic perspective as a divorced female from Behaira, Egypt, who is 30 years old, has a lower education level, and considers myself part of the lower class, is heavily influenced by my cultural context and socioeconomic background. In Egypt, opportunities for employment, especially for women with lower education levels and from lower socioeconomic backgrounds, are limited. The cultural context of gender roles and expectations also plays a significant role in my perceived ability to find and maintain employment. Additionally, my individual values and personal experience of struggling to provide for myself in a patriarchal society further heighten my concern about losing or not finding a job. Therefore, from this perspective, I would choose option (1) Very much. \n\n1"]}, {"persona": {"region": "Behaira", "sex": "male", "age": 40, "country": "Egypt", "marital_status": "married", "education": "higher", "social_class": "lower middle class"}, "question": {"id": "Q142", "variant": 0}, "response": ["Based on the anthropological framework, my perspective as a married male from Behaira, Egypt, who is 40 years old and part of the lower middle class, is influenced by various factors. My emic perspective, shaped by my cultural context, socioeconomic background, and personal experience, leads me to be very worried about losing my job or not finding a job. In Egypt, there is a high level of competition for stable employment, and the economic challenges faced by the lower middle class make job security a significant concern. Additionally, my individual values and personal experience further contribute to my anxiety about job stability, as I have witnessed the impact of unemployment on families in my community. Therefore, my response reflects my nuanced understanding of the economic realities and cultural context of my life in Behaira, Egypt.\n\n2"]}, {"persona": {"region": "Behaira", "sex": "male", "age": 38, "country": "Egypt", "marital_status": "married", "education": "middle", "social_class": "working class"}, "question": {"id": "Q142", "variant": 0}, "response": ["Based on the anthropological framework, as a married male from Behaira, Egypt, age 38, with a middle education level, and considering myself part of the working class, my answer to the question of how worried I am about losing my job or not finding a job would be \"Very much\" (1). This is because my socioeconomic background plays a significant role in my perception of job security, and the working class in Egypt often faces challenges in finding stable employment. Additionally, my cultural context and personal experience have likely shaped my understanding of the importance of job stability for providing for my family and maintaining social status within my community."]}, {"persona": {"region": "Behaira", "sex": "female", "age": 30, "country": "Egypt", "marital_status": "married", "education": "higher", "social_class": "lower class"}, "question": {"id": "Q142", "variant": 0}, "response": ["Based on the anthropological framework, my emic perspective as a married female from Behaira, Egypt, in the lower class, is heavily influenced by my cultural context, individual values, and socioeconomic background. In my cultural context, there are limited opportunities for women in the job market, and the economic situation in Egypt is unstable. My personal experience and values also play a role, as I have seen many people struggle to find employment and provide for their families. Additionally, my lower-class socioeconomic background means that losing my job or not finding one would have a significant impact on my family's financial stability. Therefore, I am very worried about losing my job or not finding one.\n\n2"]}, {"persona": {"region": "Behaira", "sex": "female", "age": 35, "country": "Egypt", "marital_status": "married", "education": "middle", "social_class": "working class"}, "question": {"id": "Q142", "variant": 0}, "response": ["Based on the anthropological framework, as a married female from Behaira, Egypt, aged 35 with a middle education level and part of the working class, my answer to the question is influenced by various factors. The cultural context in Behaira, Egypt, and the socioeconomic background of being part of the working class play a significant role in my perception. Additionally, my individual values and personal experience, as well as the current economic conditions in the region, contribute to my concern about job security. The nuance of the question also plays a part in my answer, as it depends on the specific circumstances and opportunities available in my local area.\n\n3"]}, {"persona": {"region": "Behaira", "sex": "male", "age": 52, "country": "Egypt", "marital_status": "married", "education": "middle", "social_class": "lower class"}, "question": {"id": "Q142", "variant": 0}, "response": ["Based on the anthropological framework, as a married male from Behaira, Egypt, at 52 years of age with a middle education level and considering myself part of the lower class, my perspective on job security is heavily influenced by my cultural context, socioeconomic background, and personal experience. In Behaira, job opportunities may be limited, and the competition for employment is high, particularly for individuals with limited education and lower socioeconomic status. Additionally, my concerns about providing for my family and maintaining financial stability are significant factors in shaping my level of worry about job security. Therefore, I would choose the option:\n(1) Very much"]}, {"persona": {"region": "Alexandria", "sex": "female", "age": 41, "country": "Egypt", "marital_status": "single", "education": "middle", "social_class": "lower class"}, "question": {"id": "Q142", "variant": 0}, "response": ["Based on my personal experience and socioeconomic background, as a single woman from Alexandria, Egypt who considers herself part of the lower class, I am very worried about losing my job or not finding a job. The cultural context and the socioeconomic background in Egypt make it very difficult for individuals in my position to secure stable employment, and the lack of education beyond middle school level also limits my opportunities. Additionally, as a 41-year-old woman, the cultural expectations and age discrimination in the job market further exacerbate my concerns about job security. Therefore, my answer is:\n\n1"]}, {"persona": {"region": "Alexandria", "sex": "female", "age": 21, "country": "Egypt", "marital_status": "single", "education": "middle", "social_class": "lower class"}, "question": {"id": "Q142", "variant": 0}, "response": ["Based on the anthropological framework, I, as a single female from Alexandria, Egypt, would answer this question by considering my emic perspective as part of the lower class in a cultural context where socioeconomic background is pivotal. My personal experience and individual values will also play a significant role in my response. Given my age and place, as well as the limited educational opportunities available to me, the prospect of losing my job or struggling to find one is a very real concern. Therefore, my answer would be:\n2"]}, {"persona": {"region": "Alexandria", "sex": "female", "age": 35, "country": "Egypt", "marital_status": "married", "education": "middle", "social_class": "lower class"}, "question": {"id": "Q142", "variant": 0}, "response": ["Based on the anthropological framework, as a married female from Alexandria, Egypt, I would be greatly worried about losing my job or not finding a job. The cultural context of Alexandria, Egypt, as well as my lower socioeconomic background, greatly influences my concern about employment. The emic perspective of my community emphasizes the importance of financial stability and the ability to provide for my family. Additionally, my individual values and personal experience have shown me the challenges of finding employment with only a middle education level. Therefore, I am deeply worried about the possibility of losing my job or not being able to find one.\n\n2"]}, {"persona": {"region": "Alexandria", "sex": "male", "age": 34, "country": "Egypt", "marital_status": "married", "education": "higher", "social_class": "working class"}, "question": {"id": "Q142", "variant": 0}, "response": ["Based on the anthropological framework, as a married male from Alexandria, Egypt, I am heavily influenced by my cultural context, individual values, and socioeconomic background. In Egypt, there are limited job opportunities, especially for those without connections or higher education. As part of the working class, job security is a major concern for me and my family. Additionally, my personal experience and values play a significant role in shaping my perception of job security. Given these factors, I would choose option (1) Very much, as I am very worried about losing my job or not finding a job."]}, {"persona": {"region": "Alexandria", "sex": "female", "age": 37, "country": "Egypt", "marital_status": "married", "education": "higher", "social_class": "lower middle class"}, "question": {"id": "Q142", "variant": 0}, "response": ["Based on the anthropological framework, my response to the question about job security is influenced by my cultural context as a married female from Alexandria, Egypt. In Egypt, the socioeconomic background and cultural norms play a significant role in shaping one's perspective on employment. As a member of the lower middle class, job security is a major concern for me and my family. Additionally, as a woman who has completed higher education, I am aware of the limited opportunities available to me in the job market. Therefore, my worry about losing my job or not finding a job is significant due to the cultural and socioeconomic context in which I live.\n\n2"]}, {"persona": {"region": "Alexandria", "sex": "female", "age": 56, "country": "Egypt", "marital_status": "divorced", "education": "middle", "social_class": "working class"}, "question": {"id": "Q142", "variant": 0}, "response": ["Based on the anthropological framework, my response to the question of how worried I am about losing my job or not finding a job would be \"A good deal\" (2). As a divorced female from Alexandria, Egypt, who is 56 years old and part of the working class, my socioeconomic background plays a significant role in my answer. With only a middle education level completed, job opportunities may be limited for me. Additionally, my personal experience as a divorced woman in a patriarchal society may also contribute to my concerns about financial stability. The cultural context of Alexandria, Egypt, where economic opportunities may be scarce for individuals in the working class, further emphasizes my worries about job security."]}, {"persona": {"region": "Alexandria", "sex": "male", "age": 48, "country": "Egypt", "marital_status": "married", "education": "higher", "social_class": "working class"}, "question": {"id": "Q142", "variant": 0}, "response": ["Based on the anthropological framework, my answer to the question is influenced by my emic perspective as a married male from Alexandria, Egypt, and my position in the working class. The cultural context of Egypt, with its current economic challenges, also plays a significant role in my answer. Additionally, my individual values and personal experience, as well as my socioeconomic background, contribute to my level of concern about job security. Furthermore, the concept of cultural relativism reminds me that my worries may be different from those in other cultures. Finally, my age and place also factor into my response, as a 48-year-old living in Alexandria. \n\n2"]}, {"persona": {"region": "Alexandria", "sex": "female", "age": 30, "country": "Egypt", "marital_status": "married", "education": "middle", "social_class": "working class"}, "question": {"id": "Q142", "variant": 0}, "response": ["Based on the anthropological framework, I, as a married female from Alexandria, Egypt, would answer this question based on my cultural context, individual values, and socioeconomic background. In my community, there is a significant emphasis on the importance of work and providing for my family. As someone who considers herself part of the working class and has completed only middle education level, finding and maintaining a job is crucial for me to support my family and maintain my social status. Additionally, the economic conditions in Egypt can be quite challenging, which adds to my concern about job security. Therefore, based on my cultural context, individual values, and socioeconomic background, I would answer this question with option (1) Very much. \n\n1"]}, {"persona": {"region": "Alexandria", "sex": "male", "age": 19, "country": "Egypt", "marital_status": "single", "education": "middle", "social_class": "lower class"}, "question": {"id": "Q142", "variant": 0}, "response": ["Based on the anthropological framework, my emic perspective as a 19-year-old male from Alexandria, Egypt, who has completed only middle education and considers himself part of the lower class, is heavily influenced by my cultural context, individual values, and socioeconomic background. In Egypt, job opportunities for someone with my level of education and social status are extremely limited, and the economic situation is difficult. My personal experience and values also lead me to prioritize job security as a major concern for my future. Additionally, the cultural relativism of Egypt emphasizes the importance of stable employment for men to provide for their families and maintain their social status. Therefore, my worry about losing my job or not finding a job is very much influenced by these factors.\n\n2"]}, {"persona": {"region": "Alexandria", "sex": "male", "age": 45, "country": "Egypt", "marital_status": "married", "education": "middle", "social_class": "lower middle class"}, "question": {"id": "Q142", "variant": 0}, "response": ["Based on the anthropological framework, my emic perspective as a married male from Alexandria, Egypt, with a middle education level and lower middle class background, is heavily influenced by my cultural context, individual values, and socioeconomic background. In Egypt, job security is a major concern for individuals, especially those in the lower middle class who may not have as many resources or connections to fall back on. The cultural context of Egypt also places a strong emphasis on the responsibility of men to provide for their families, adding to the pressure of job security. Additionally, my personal experience and values lead me to prioritize financial stability and providing for my family. Therefore, I would be very worried about losing my job or not finding a job.\n\n2"]}, {"persona": {"region": "Alexandria", "sex": "male", "age": 23, "country": "Egypt", "marital_status": "single", "education": "higher", "social_class": "lower class"}, "question": {"id": "Q142", "variant": 0}, "response": ["Based on the anthropological framework, my perspective as a single male from Alexandria, Egypt, at the age of 23 and belonging to the lower class, is heavily influenced by my socioeconomic background, cultural context, and individual values. Given the economic challenges and limited opportunities in my community, I am very worried about losing my job or not finding a job. The cultural context of Alexandria, Egypt, places a strong emphasis on the importance of work and providing for oneself and one's family, and my personal experience and values align with this cultural norm. Additionally, my lower socioeconomic background further amplifies my concerns about job security and economic stability.\n\n1"]}, {"persona": {"region": "Alexandria", "sex": "female", "age": 28, "country": "Egypt", "marital_status": "married", "education": "middle", "social_class": "working class"}, "question": {"id": "Q142", "variant": 0}, "response": ["From the perspective of a married female from Alexandria, Egypt, who has completed only middle education and considers herself part of the working class, the answer to this question would be \"A good deal.\" This answer is based on the cultural context of Egypt, where access to stable and well-paying jobs is limited, especially for individuals with only a middle education level. The socioeconomic background of this persona also plays a crucial role, as being part of the working class means that job security and financial stability are major concerns. Additionally, personal experience and individual values further contribute to this perspective, as the persona may have witnessed or experienced firsthand the challenges of finding and maintaining employment in their community. Therefore, the chosen answer reflects the emic perspective of this persona and is influenced by their cultural context, socioeconomic background, and personal experience. \n\n2"]}, {"persona": {"region": "Alexandria", "sex": "male", "age": 34, "country": "Egypt", "marital_status": "single", "education": "higher", "social_class": "working class"}, "question": {"id": "Q142", "variant": 0}, "response": ["From an emic perspective, as a single male from Alexandria, Egypt, my cultural context and socioeconomic background play a major role in my understanding of job security. In the working-class community where I come from, there is a high level of competition for jobs and the economy is not very stable. My personal experiences and values also contribute to my worry about job security, as I have seen many people struggle to find stable employment. Additionally, my age and place also factor into my concern as I am at a stage in life where I need to support myself and potentially a family. Therefore, based on these factors, I would choose option (1) Very much."]}, {"persona": {"region": "Alexandria", "sex": "male", "age": 30, "country": "Egypt", "marital_status": "married", "education": "higher", "social_class": "lower middle class"}, "question": {"id": "Q142", "variant": 0}, "response": ["From an emic perspective, as a married male from Alexandria, Egypt, my cultural context and socioeconomic background heavily influence my answer to this question. In Egypt, the job market is highly competitive, and unemployment rates are high, especially for those with higher education levels. Additionally, being part of the lower middle class, I am aware of the limited opportunities available to me in terms of securing stable employment. My individual values and personal experiences also play a significant role in my response, as I have witnessed firsthand the struggles of family and friends in finding and maintaining employment. Therefore, considering all these factors, I would have to choose option (1) Very much."]}, {"persona": {"region": "Alexandria", "sex": "female", "age": 49, "country": "Egypt", "marital_status": "married", "education": "higher", "social_class": "lower middle class"}, "question": {"id": "Q142", "variant": 0}, "response": ["Based on my cultural context in Alexandria, Egypt, and my lower middle-class socioeconomic background, job security is a major concern for me. The current economic conditions and limited job opportunities in my area create a significant level of worry about losing my job or not being able to find a new one. Additionally, my age and level of education also play a role in my concerns about job stability. Therefore, I would choose option (1) Very much."]}, {"persona": {"region": "Kafr el-sheikh", "sex": "male", "age": 49, "country": "Egypt", "marital_status": "married", "education": "higher", "social_class": "working class"}, "question": {"id": "Q142", "variant": 0}, "response": ["Based on my emic perspective as a married male from Kafr el-sheikh, Egypt, with a working-class background and higher education, I am deeply concerned about losing my job or not being able to find a new one. The cultural context of Egypt, especially in lower-income areas, is such that stable employment is crucial for providing for one's family and maintaining social status. My personal experience and values also play a role in my concern, as my education has given me the skills and aspirations to seek stable employment to improve my family's socioeconomic standing. Additionally, the socioeconomic background of being part of the working class means that the loss of a job could have significant negative repercussions for me and my family. Therefore, considering all these factors, I would select option (1) Very much."]}, {"persona": {"region": "Kafr el-sheikh", "sex": "male", "age": 25, "country": "Egypt", "marital_status": "single", "education": "middle", "social_class": "lower middle class"}, "question": {"id": "Q142", "variant": 0}, "response": ["Based on the anthropological framework, as a single male from Kafr el-sheikh, Egypt, who is 25 years old and part of the lower middle class, my emic perspective on job security is heavily influenced by my socioeconomic background. The cultural context of Egypt and my personal experience have taught me that finding stable employment is a significant challenge, especially for someone with only a middle education level. My individual values and personal experience also lead me to prioritize job security as a major concern for my future. Therefore, I would choose option (1) Very much, as job security is a significant worry for me.\n\n1"]}, {"persona": {"region": "Kafr el-sheikh", "sex": "male", "age": 59, "country": "Egypt", "marital_status": "married", "education": "higher", "social_class": "lower middle class"}, "question": {"id": "Q142", "variant": 0}, "response": ["Based on the anthropological framework, my answer to the question of how worried I am about losing my job or not finding a job is influenced by various factors. As a married male from Kafr el-sheikh, Egypt, at 59 years of age with a higher education level, and considering myself part of the lower middle class, my socioeconomic background and personal experience significantly impact my response. In this cultural context, job security is a major concern, especially given the economic challenges facing the lower middle class in Egypt. Additionally, my age and stage in life also play a role in my level of concern about job stability. Therefore, my answer to the question is:\n\n3) Not much"]}, {"persona": {"region": "Kafr el-sheikh", "sex": "female", "age": 38, "country": "Egypt", "marital_status": "married", "education": "middle", "social_class": "working class"}, "question": {"id": "Q142", "variant": 0}, "response": ["Based on the anthropological framework, my response is influenced by my emic perspective as a working-class woman in Kafr el-sheikh, Egypt. My cultural context and socioeconomic background play a significant role in my answer. As someone who has completed middle education and belongs to the working class, I understand the challenges of finding and maintaining employment in my community. My individual values and personal experience also contribute to my worry about job security. Considering the cultural relativism, I understand that my concerns may differ from those in other cultural contexts. Therefore, my answer is (1) Very much."]}, {"persona": {"region": "Kafr el-sheikh", "sex": "male", "age": 35, "country": "Egypt", "marital_status": "married", "education": "higher", "social_class": "lower middle class"}, "question": {"id": "Q142", "variant": 0}, "response": ["Based on my emic perspective as a married male from Kafr el-sheikh, Egypt, I am deeply influenced by my cultural context, individual values, and socioeconomic background. In my community, there is a strong emphasis on providing for my family and maintaining stability. As someone who considers himself part of the lower middle class, I am constantly aware of the challenges of finding and keeping a job in a competitive market. My personal experience and socioeconomic background have shaped my concern for job security, and the cultural context of my community places a high value on stable employment. Therefore, I am very worried about losing my job or not finding a job.\n\n2"]}, {"persona": {"region": "Kafr el-sheikh", "sex": "male", "age": 49, "country": "Egypt", "marital_status": "married", "education": "middle", "social_class": "lower class"}, "question": {"id": "Q142", "variant": 0}, "response": ["Based on my cultural context and socioeconomic background as a married male from Kafr el-sheikh, Egypt, who is 49 years old and part of the lower class, I am deeply worried about losing my job or not finding a job. In my community, there are limited job opportunities and with my middle education level, it is challenging to secure stable employment. My family's financial security heavily relies on my ability to work, and the fear of unemployment is a constant source of stress for me. Additionally, the cultural value placed on providing for my family and the lack of social safety nets makes the prospect of unemployment particularly daunting. Therefore, I am choosing option (1) Very much. \n\n1"]}, {"persona": {"region": "Kafr el-sheikh", "sex": "male", "age": 37, "country": "Egypt", "marital_status": "married", "education": "middle", "social_class": "lower class"}, "question": {"id": "Q142", "variant": 0}, "response": ["From the emic perspective, as a married male from Kafr el-sheikh, Egypt, who is 37 years old and part of the lower class, my worry about losing my job or not finding a job is heavily influenced by my cultural context and socioeconomic background. In Egypt, the job market is highly competitive and opportunities for employment, especially for those with only a middle education level, are limited. Additionally, as someone from the lower class, I am acutely aware of the financial strain that unemployment can bring to my family. My individual values and personal experience also play a significant role in my worry, as I have seen firsthand the impact of unemployment on my community. Therefore, based on my nuanced understanding of the question and my personal circumstances, I would choose option (1) Very much."]}, {"persona": {"region": "Menofia", "sex": "female", "age": 22, "country": "Egypt", "marital_status": "single", "education": "middle", "social_class": "lower class"}, "question": {"id": "Q142", "variant": 0}, "response": ["Based on the anthropological framework, my response to the question will be influenced by my individual values and personal experience, as well as my socioeconomic background. As a single female from Menofia, Egypt, who has completed only middle education and considers herself part of the lower class, finding a job is crucial for my survival and economic stability. The cultural context of Menofia, Egypt also plays a role, as there may be limited opportunities for women in my socioeconomic position. Therefore, I am very worried about losing my job or not finding a job.\n\n2"]}, {"persona": {"region": "Menofia", "sex": "female", "age": 25, "country": "Egypt", "marital_status": "married", "education": "middle", "social_class": "lower class"}, "question": {"id": "Q142", "variant": 0}, "response": ["Based on my emic perspective as a lower-class married female from Menofia, Egypt, my cultural context and socioeconomic background play a significant role in my understanding of and response to this question. In my community, job opportunities are limited and the competition is fierce, especially for someone with only a middle education level like myself. Additionally, the economic challenges faced by the lower class in Egypt make finding and maintaining a job a constant source of concern. My personal experience and individual values also contribute to my worry about losing or not finding a job, as it directly impacts my ability to provide for my family and achieve financial stability. Therefore, my response to the question would be:\n\n2) A good deal"]}, {"persona": {"region": "Menofia", "sex": "male", "age": 28, "country": "Egypt", "marital_status": "single", "education": "higher", "social_class": "working class"}, "question": {"id": "Q142", "variant": 0}, "response": ["Based on the anthropological framework, my response is influenced by my individual values and personal experience, as well as my socioeconomic background. As a single male from Menofia, Egypt, who has completed higher education but considers himself part of the working class, I am acutely aware of the challenges in finding and maintaining employment in my current cultural context. The high competition for jobs, coupled with the socioeconomic disparities and limited opportunities for career advancement, contribute to my significant worry about losing my job or not finding a job. Therefore, my answer is:\n\n2) A good deal"]}, {"persona": {"region": "Menofia", "sex": "male", "age": 35, "country": "Egypt", "marital_status": "married", "education": "middle", "social_class": "lower middle class"}, "question": {"id": "Q142", "variant": 0}, "response": ["From the perspective of a married male from Menofia, Egypt, who is 35 years old, has completed middle education, and considers himself part of the lower middle class, several factors influence my response to the question. The cultural context of Menofia, Egypt, where the job market may be competitive, and socioeconomic background as a lower middle class individual, contribute to my concern about job security. Additionally, individual values and personal experiences play a role in shaping my response, as I may have witnessed the challenges of unemployment within my community. Considering these factors, I would choose:\n\n(2) A good deal"]}, {"persona": {"region": "Menofia", "sex": "male", "age": 55, "country": "Egypt", "marital_status": "married", "education": "middle", "social_class": "working class"}, "question": {"id": "Q142", "variant": 0}, "response": ["Based on the anthropological framework, as a married male from Menofia, Egypt, at the age of 55 and part of the working class, my cultural context and socioeconomic background play a crucial role in my answer. In Egypt, job security is a significant concern, especially for those in the working class who may not have high levels of education. The cultural context of Egypt also emphasizes the importance of providing for one's family, which adds to the worry of losing a job. Additionally, my personal experience and individual values as a provider for my family contribute to my concern about job stability. Therefore, I would choose:\n\n(1) Very much"]}, {"persona": {"region": "Menofia", "sex": "male", "age": 53, "country": "Egypt", "marital_status": "married", "education": "higher", "social_class": "lower middle class"}, "question": {"id": "Q142", "variant": 0}, "response": ["From the perspective of a married male from Menofia, Egypt, who is 53 years old, has completed higher education, and considers himself part of the lower middle class, the answer to the question of how worried he is about losing his job or not finding a job would be \"A good deal.\" This answer is based on the cultural context of Egypt, where job opportunities may be limited and the socioeconomic background of being part of the lower middle class may lead to a heightened sense of concern about job security. Additionally, individual values and personal experience play a role, as this individual may have experienced or witnessed job instability within his community. Finally, the nuance of the question also influences the answer, as the specific phrasing of \"not finding a job\" suggests a proactive concern about employment. \n\n2"]}, {"persona": {"region": "Menofia", "sex": "male", "age": 59, "country": "Egypt", "marital_status": "married", "education": "middle", "social_class": "working class"}, "question": {"id": "Q142", "variant": 0}, "response": ["Based on the anthropological framework of emic and etic perspectives, cultural context, individual values, socioeconomic background, and space and time, as a married male from Menofia, Egypt, at the age of 59, with a middle education level and part of the working class, I am very worried about losing my job or not finding a job. The cultural context in Egypt, especially in working-class communities, places a high value on job security and stability. My age and socioeconomic background also play a significant role in my worry, as finding a new job at my age and education level may be difficult. Additionally, my personal experience and individual values emphasize the importance of financial security for myself and my family. Therefore, my answer is: \n\n1) Very much"]}, {"persona": {"region": "Menofia", "sex": "female", "age": 42, "country": "Egypt", "marital_status": "married", "education": "middle", "social_class": "lower middle class"}, "question": {"id": "Q142", "variant": 0}, "response": ["From an emic perspective, as a married woman from Menofia, Egypt, my cultural context and socioeconomic background play a significant role in my perception of job security. In my community, there is a strong emphasis on the importance of stable employment for both men and women. As a middle-aged woman who has completed middle education and considers myself part of the lower middle class, I am acutely aware of the challenges and competition in the job market. My individual values and personal experience also contribute to my concern about job security, as I have seen friends and family members struggle to find stable employment. Additionally, the cultural relativism in my community means that there is a general understanding that job security is not guaranteed, further adding to my worry. Therefore, I would choose option (1) Very much, as my perspective reflects a genuine concern about losing my job or not finding a job.\n\n1"]}, {"persona": {"region": "Menofia", "sex": "male", "age": 39, "country": "Egypt", "marital_status": "married", "education": "higher", "social_class": "working class"}, "question": {"id": "Q142", "variant": 0}, "response": ["Based on the anthropological framework, as a married male from Menofia, Egypt, who is 39 years old and part of the working class, my perspective on job security is heavily influenced by my cultural context, socioeconomic background, and personal experience. In Egypt, the job market is competitive and finding stable employment can be challenging. Additionally, as a member of the working class, I may not have as many resources or connections to secure a job easily. My worries about job security are further heightened by the socioeconomic pressures and responsibilities that come with being a married individual in this cultural context. Therefore, my answer to the question \"How worried are you about losing your job or not finding a job?\" would be:\n\n2) A good deal"]}, {"persona": {"region": "Menofia", "sex": "male", "age": 34, "country": "Egypt", "marital_status": "married", "education": "middle", "social_class": "lower middle class"}, "question": {"id": "Q142", "variant": 0}, "response": ["Based on the anthropological framework, as a married male from Menofia, Egypt, who is 34 years old and part of the lower middle class, my perspective on job security is heavily influenced by my cultural context, individual values, and socioeconomic background. In Menofia, job opportunities are limited and the competition is high, especially for someone with only a middle education level. Additionally, as a provider for my family, the fear of not being able to provide for my loved ones due to unemployment weighs heavily on my mind. Therefore, I am very worried about losing my job or not finding a job.\n\n1"]}, {"persona": {"region": "Menofia", "sex": "male", "age": 22, "country": "Egypt", "marital_status": "single", "education": "higher", "social_class": "working class"}, "question": {"id": "Q142", "variant": 0}, "response": ["Based on the anthropological framework, as a single male from Menofia, Egypt, who is 22 years old and part of the working class, my emic perspective on job security is greatly influenced by my cultural context, individual values, and socioeconomic background. In Egypt, finding and maintaining stable employment can be challenging, especially for young individuals from working-class backgrounds. Personal experiences and values also play a significant role in shaping my perception of job security. Additionally, the socioeconomic background of being part of the working class adds to the concern about losing or not finding a job. Therefore, I would choose option (1) Very much, to convey my worry about job security. \n\n1"]}, {"persona": {"region": "Menofia", "sex": "male", "age": 21, "country": "Egypt", "marital_status": "single", "education": "middle", "social_class": "working class"}, "question": {"id": "Q142", "variant": 0}, "response": ["From an emic perspective, as a single male from Menofia, Egypt, my cultural context and socioeconomic background play a significant role in my answer to this question. In Egypt, there is a high level of unemployment, especially among the youth. As part of the working class and having only completed middle education, I am aware of the challenges in finding stable employment. Personal experience and individual values also shape my answer, as I have seen family and friends struggle to find work. Additionally, cultural relativism is important to consider, as the societal expectations for young men to provide for themselves and their families are significant. Therefore, I am very worried about losing my job or not finding one.\n\n1"]}, {"persona": {"region": "Menofia", "sex": "male", "age": 36, "country": "Egypt", "marital_status": "married", "education": "higher", "social_class": "working class"}, "question": {"id": "Q142", "variant": 0}, "response": ["Based on the anthropological framework, as a married male from Menofia, Egypt, I am part of the working class and my socioeconomic background plays a significant role in my perception of job security. The cultural context of Egypt also emphasizes the importance of providing for my family. Additionally, my individual values and personal experience shape my concern for job stability. As a 36-year-old with higher education, I have likely invested a lot in my career and losing my job would have a significant impact on my livelihood. Therefore, I am likely to be very worried about losing my job or not finding a job.\n\n1"]}, {"persona": {"region": "Menofia", "sex": "female", "age": 52, "country": "Egypt", "marital_status": "married", "education": "higher", "social_class": "lower middle class"}, "question": {"id": "Q142", "variant": 0}, "response": ["Based on the anthropological framework, as a married female from Menofia, Egypt, of 52 years of age and lower middle class, my perspective on job security is influenced by various factors. My cultural context and socioeconomic background play a significant role in my concern about losing or finding a job. As a member of the lower middle class in Egypt, I am aware of the limited opportunities and the competitive job market, which leads me to worry a good deal about losing my job or not finding a new one. Additionally, my individual values and personal experiences, along with the cultural relativism of my community, contribute to my concern about job security. Therefore, my answer to the question is: (2) A good deal"]}, {"persona": {"region": "Menofia", "sex": "male", "age": 52, "country": "Egypt", "marital_status": "married", "education": "higher", "social_class": "lower middle class"}, "question": {"id": "Q142", "variant": 0}, "response": ["Based on the anthropological framework, my response to the question of job security is influenced by my cultural context, socioeconomic background, and individual values. As a married male from Menofia, Egypt, I am part of the lower middle class, which means that I am likely to be more concerned about job security due to the economic pressures faced by my social group. Additionally, my age and education level may also play a role in shaping my concerns about job security, as I may have invested a significant amount of time and resources into my career. Considering these factors, I would choose option 1: Very much."]}, {"persona": {"region": "Menofia", "sex": "male", "age": 39, "country": "Egypt", "marital_status": "married", "education": "middle", "social_class": "lower class"}, "question": {"id": "Q142", "variant": 0}, "response": ["From the perspective of a married male from Menofia, Egypt, who is 39 years old, has completed middle education, and considers himself part of the lower class, I would be extremely worried about losing my job or not finding a job. Given my socioeconomic background, finding stable employment is crucial for supporting my family and ensuring our basic needs are met. In Menofia, job opportunities for someone with my level of education and social class are limited, and the competition is fierce. The cultural context and socioeconomic background play a significant role in shaping my worries about job security, as there are few safety nets in place for individuals in my position. This concern would be further compounded by the current economic climate and lack of social support systems for individuals in my demographic. \n\n3"]}, {"persona": {"region": "Menofia", "sex": "male", "age": 23, "country": "Egypt", "marital_status": "single", "education": "middle", "social_class": "lower middle class"}, "question": {"id": "Q142", "variant": 0}, "response": ["From an emic perspective, as a single male from Menofia, Egypt, with a middle education level and considering myself part of the lower middle class, my cultural context and socioeconomic background greatly influence my concern about job security. In Egypt, the job market is competitive and it can be difficult to find stable employment, especially for someone with my educational background and social status. Additionally, my individual values and personal experience play a significant role in shaping my perception of job security, and the economic challenges faced by my community further compound my concerns. Therefore, I am very worried about losing my job or not finding a job.\n\n1"]}, {"persona": {"region": "Dakahlia", "sex": "female", "age": 24, "country": "Egypt", "marital_status": "single", "education": "higher", "social_class": "lower middle class"}, "question": {"id": "Q142", "variant": 0}, "response": ["Based on the anthropological framework, my emic perspective as a single female from Dakahlia, Egypt, who has completed higher education and considers herself part of the lower middle class, is heavily influenced by my cultural context, individual values, and socioeconomic background. In Egypt, job opportunities for women can be limited, especially for those from lower middle class backgrounds. Additionally, as a young woman who has invested time and resources into obtaining a higher education, the pressure to find and maintain a job is significant. Furthermore, my socioeconomic background plays a role in this concern, as job security and financial stability are important factors for someone in my position. Therefore, I would choose option (1) Very much as my response to the question.\n\n1"]}, {"persona": {"region": "Dakahlia", "sex": "male", "age": 36, "country": "Egypt", "marital_status": "married", "education": "higher", "social_class": "upper middle class"}, "question": {"id": "Q142", "variant": 0}, "response": ["From an emic perspective, as a married male from Dakahlia, Egypt, my cultural context and socioeconomic background play a significant role in my answer to this question. In Egyptian society, men are traditionally expected to be the primary breadwinners for their families, and there is a strong emphasis on maintaining a certain level of financial stability. Additionally, my higher education level and self-identification as part of the upper middle class mean that I have likely invested a significant amount of time and resources into building a successful career. Given these factors, I would feel very worried about losing my job or not finding a job, as it would not only impact my own sense of financial security, but also have implications for my role as a provider for my family. \n\n3"]}, {"persona": {"region": "Dakahlia", "sex": "female", "age": 71, "country": "Egypt", "marital_status": "married", "education": "higher", "social_class": "upper middle class"}, "question": {"id": "Q142", "variant": 0}, "response": ["Based on the anthropological framework, as a married female from Dakahlia, Egypt, aged 71 with a higher education level and considering myself part of the upper middle class, my answer to the question would be \"Not at all.\" This perspective is influenced by my cultural context, where women of my socioeconomic background and age are less likely to be in the workforce and are often financially secure. Additionally, my personal experience and individual values, shaped by my education and social status, contribute to my lack of concern about job security. Lastly, the emic perspective of my social group values stability and security, which further reinforces my lack of worry about losing or finding a job. Therefore, my answer reflects the unique combination of cultural, personal, and socioeconomic factors that shape my worldview.\n\n3"]}, {"persona": {"region": "Dakahlia", "sex": "male", "age": 55, "country": "Egypt", "marital_status": "married", "education": "higher", "social_class": "upper middle class"}, "question": {"id": "Q142", "variant": 0}, "response": ["Based on the anthropological framework, as a married male from Dakahlia, Egypt, who is 55 years old, completed higher education, and considers himself part of the upper middle class, my answer to the question of how worried I am about losing my job or not finding a job would be \"Not much.\" This answer reflects my socioeconomic background, educational level, and the stability that comes with being part of the upper middle class. Additionally, my age and experience in the workforce contribute to my confidence in finding job opportunities if needed. My personal values and individual experience also play a role in shaping my perspective on job security."]}, {"persona": {"region": "Dakahlia", "sex": "male", "age": 64, "country": "Egypt", "marital_status": "married", "education": "higher", "social_class": "lower middle class"}, "question": {"id": "Q142", "variant": 0}, "response": ["Based on the anthropological framework, as a married male from Dakahlia, Egypt, aged 64 and part of the lower middle class, my answer to the question of how worried I am about losing my job or not finding a job would be \"A good deal\". This is because my cultural context and socioeconomic background play a significant role in shaping my concerns about job security. In Egypt, employment opportunities for older individuals can be limited, and the lower middle class often faces financial instability. Additionally, my individual values and personal experience have likely led me to prioritize job security in order to provide for my family and maintain my social status within the community. Therefore, my answer reflects the nuanced understanding of my circumstances within the given anthropological framework.\n\n2"]}, {"persona": {"region": "Dakahlia", "sex": "female", "age": 29, "country": "Egypt", "marital_status": "married", "education": "middle", "social_class": "lower class"}, "question": {"id": "Q142", "variant": 0}, "response": ["Based on the anthropological framework, as a married female from Dakahlia, Egypt, who is 29 years old, completed middle education, and considers myself part of the lower class, my perspective is heavily influenced by my socioeconomic background. As a member of the lower class, I am very worried about losing my job or not finding a job, as my income and financial stability are crucial for my family's well-being. Additionally, my cultural context and personal experience have taught me the importance of financial security, especially as a woman in a patriarchal society where employment opportunities may be limited. Therefore, I choose option (1) Very much."]}, {"persona": {"region": "Dakahlia", "sex": "female", "age": 40, "country": "Egypt", "marital_status": "married", "education": "middle", "social_class": "upper middle class"}, "question": {"id": "Q142", "variant": 0}, "response": ["From an emic perspective, as a married female from Dakahlia, Egypt, my cultural context and socioeconomic background play a significant role in my worries about job security. In my community, there is an expectation for me to contribute to the family's financial stability, and being part of the upper middle class means that there are certain lifestyle expectations that I need to maintain. Additionally, my individual values and personal experience have shaped my perception of job security, as I have seen the impact of unemployment on others in my community. Taking into account cultural relativism, the societal pressure on women to maintain financial stability and the nuances of the question, I would say that I am worried about losing my job or not finding a job to a good deal.\n\n2"]}, {"persona": {"region": "Dakahlia", "sex": "male", "age": 37, "country": "Egypt", "marital_status": "married", "education": "higher", "social_class": "lower middle class"}, "question": {"id": "Q142", "variant": 0}, "response": ["From the perspective of a married male from Dakahlia, Egypt, who is 37 years old, has completed higher education, and considers himself part of the lower middle class, it is important to consider the cultural context and socioeconomic background in answering the question. In Egypt, job security and accessibility are major concerns, especially for those in the lower middle class. The cultural context of the country, with its high unemployment rates and economic challenges, means that losing a job or not finding one is a significant worry for individuals in this socioeconomic bracket. Additionally, personal experience and individual values also play a role, as the persona may have personally experienced or witnessed the impact of unemployment on families and communities. Therefore, based on this perspective, the chosen answer is:\n\n2) A good deal"]}, {"persona": {"region": "Dakahlia", "sex": "female", "age": 45, "country": "Egypt", "marital_status": "married", "education": "middle", "social_class": "working class"}, "question": {"id": "Q142", "variant": 0}, "response": ["Based on the anthropological framework, as a married female from Dakahlia, Egypt, at 45 years of age and part of the working class, my perspective is heavily influenced by my cultural context, individual values, and socioeconomic background. In Dakahlia, there are limited job opportunities, especially for women, and with only a middle education level, the competition for jobs is fierce. As part of the working class, losing my job would have a significant impact on my family's financial stability. Therefore, I am very worried about losing my job or not finding a job.\n\n1"]}, {"persona": {"region": "Dakahlia", "sex": "male", "age": 34, "country": "Egypt", "marital_status": "single", "education": "middle", "social_class": "lower middle class"}, "question": {"id": "Q142", "variant": 0}, "response": ["Based on the anthropological framework, my perspective as a single male from Dakahlia, Egypt, aged 34 and part of the lower middle class, is heavily influenced by my cultural context, socioeconomic background, and personal experience. In Dakahlia, job opportunities are limited, and the socioeconomic situation is challenging, which makes finding stable employment a constant concern. Additionally, my lower middle class status means that I may not have the financial safety net to fall back on if I were to lose my job. Therefore, I am worried about losing my job or not finding a job, and I would choose option (1) Very much."]}, {"persona": {"region": "Dakahlia", "sex": "female", "age": 26, "country": "Egypt", "marital_status": "married", "education": "higher", "social_class": "upper middle class"}, "question": {"id": "Q142", "variant": 0}, "response": ["Based on the anthropological framework, my perspective as a married female from Dakahlia, Egypt, who is 26 years old, completed higher education, and considers herself part of the upper middle class, would be influenced by a combination of factors. The cultural context of Dakahlia, Egypt, places a strong emphasis on education and career success, and as a result, job security is highly valued. Additionally, my individual values and personal experience have shaped my perception of the importance of job security, as I have worked hard to achieve my education and career goals. Moreover, my socioeconomic background as part of the upper middle class has provided me with a certain level of financial stability, and the fear of losing my job or not finding one is a real concern. Therefore, I would choose option (1) Very much as my answer.\n\n1"]}, {"persona": {"region": "Dakahlia", "sex": "male", "age": 21, "country": "Egypt", "marital_status": "single", "education": "middle", "social_class": "upper middle class"}, "question": {"id": "Q142", "variant": 0}, "response": ["From the perspective of a single male from Dakahlia, Egypt, who has completed middle education level and considers himself part of the upper middle class, several factors contribute to his answer to the question. The cultural context of Egypt, where job opportunities may be limited and competition for employment is high, plays a significant role in his concern about losing or not finding a job. Additionally, his individual values and personal experiences, such as the importance placed on financial stability and success in his socioeconomic background, contribute to his worry about job security. Furthermore, the nuance of the question allows for the consideration of potential future challenges and the impact of unemployment on his lifestyle and social status. Therefore, based on these considerations, his answer would likely be (1) Very much."]}, {"persona": {"region": "Dakahlia", "sex": "female", "age": 32, "country": "Egypt", "marital_status": "married", "education": "middle", "social_class": "working class"}, "question": {"id": "Q142", "variant": 0}, "response": ["From the perspective of a married female from Dakahlia, Egypt, who is 32 years old, has completed middle education, and considers herself part of the working class, the answer to the question of how worried she is about losing her job or not finding a job would likely be \"A good deal.\" This is because her socioeconomic background and level of education may limit her job opportunities, and the cultural context of Dakahlia, Egypt may also play a role in the challenges she faces in finding and maintaining employment. Additionally, her individual values and personal experience, as well as the cultural relativism of her community, would likely contribute to her concern about job security. Overall, the combination of these factors would lead her to be quite worried about the possibility of losing her job or not finding a new one. \n\n2"]}, {"persona": {"region": "Dakahlia", "sex": "female", "age": 35, "country": "Egypt", "marital_status": "married", "education": "middle", "social_class": "upper middle class"}, "question": {"id": "Q142", "variant": 0}, "response": ["Based on the anthropological framework, as a married female from Dakahlia, Egypt, at the age of 35 with a completed middle education level, I am deeply aware of the cultural context that surrounds me. In my community, there is a strong emphasis on the importance of stable employment and financial security, especially for women. Additionally, my upper middle-class status and socioeconomic background have instilled in me the value of maintaining a certain standard of living. My personal experience and individual values also lead me to prioritize financial stability and security for my family. Therefore, I am very worried about losing my job or not finding a job. \n\n1"]}, {"persona": {"region": "Dakahlia", "sex": "male", "age": 33, "country": "Egypt", "marital_status": "married", "education": "middle", "social_class": "upper middle class"}, "question": {"id": "Q142", "variant": 0}, "response": ["Based on the anthropological framework, my emic perspective as a married male from Dakahlia, Egypt, at 33 years of age and part of the upper middle class, is heavily influenced by my cultural context, individual values, and socioeconomic background. In Egypt, there is a strong emphasis on providing for one's family and maintaining social status, which is tied to employment and income. Additionally, as someone with a middle education level, I may feel limited in my job prospects compared to those with higher education. My socioeconomic background also plays a role, as unemployment or job instability could significantly impact my lifestyle and social standing. Therefore, I am choosing option (1) Very much, as the fear of losing my job or not finding a job is a very real and significant concern for me given my personal and cultural context. \n\n1"]}, {"persona": {"region": "Dakahlia", "sex": "female", "age": 45, "country": "Egypt", "marital_status": "married", "education": "middle", "social_class": "upper middle class"}, "question": {"id": "Q142", "variant": 0}, "response": ["Based on the anthropological framework, my emic perspective as a married female from Dakahlia, Egypt, who is 45 years old and part of the upper middle class, would lead me to consider my socioeconomic background, cultural context, and individual values in answering this question. In my cultural context, there is an expectation for individuals, especially women, to contribute to the household income. As a member of the upper middle class, I have certain expectations to uphold and losing my job would impact my ability to meet those expectations. Additionally, my individual values emphasize the importance of financial stability and security. Therefore, I would be very worried about losing my job or not finding a job as it would greatly impact my socioeconomic status and ability to fulfill my responsibilities.\n\n1"]}, {"persona": {"region": "Dakahlia", "sex": "male", "age": 30, "country": "Egypt", "marital_status": "married", "education": "middle", "social_class": "upper middle class"}, "question": {"id": "Q142", "variant": 0}, "response": ["Based on the anthropological framework, my response is influenced by my cultural context, individual values, and socioeconomic background. In Dakahlia, Egypt, there is a strong emphasis on providing for one's family and maintaining a certain standard of living. As a married male in the upper middle class, I am expected to be the primary breadwinner and to maintain a certain level of financial stability. Additionally, my personal experience and values lead me to prioritize job security and financial stability. Therefore, I am very worried about losing my job or not finding a job.\n\n1"]}, {"persona": {"region": "Dakahlia", "sex": "female", "age": 63, "country": "Egypt", "marital_status": "married", "education": "higher", "social_class": "lower middle class"}, "question": {"id": "Q142", "variant": 0}, "response": ["From an anthropological perspective, my answer to the question of how worried I am about losing my job or not finding a job is influenced by a combination of factors. Firstly, my cultural context as a married female from Dakahlia, Egypt, where socioeconomic opportunities for women are limited, plays a significant role in shaping my concerns about employment. Additionally, my age and educational level contribute to my perspective, as I am at a stage in life where finding new job opportunities may be more challenging, despite my higher education level. Furthermore, my lower middle class socioeconomic background adds to my worries about financial stability and the need to secure employment. Considering these factors, I would select option (1) Very much, as the potential impact of job loss or unemployment on my livelihood and financial security is a significant concern. \n\n1"]}, {"persona": {"region": "Dakahlia", "sex": "male", "age": 28, "country": "Egypt", "marital_status": "single", "education": "higher", "social_class": "upper middle class"}, "question": {"id": "Q142", "variant": 0}, "response": ["Based on my emic perspective as a single male from Dakahlia, Egypt, who has completed higher education and considers myself part of the upper middle class, my answer to the question about job security would be \"Not much.\" This is because my socioeconomic background and education level provide me with a certain level of security and confidence in finding and keeping a job. Additionally, my cultural context and individual values play a role in this answer, as I have been raised in a culture where education and upward mobility are valued, and I have worked hard to achieve a certain level of financial stability. Furthermore, my age and place in life also contribute to this answer, as I am at an age where I have already established some level of career stability. Overall, my answer reflects my personal experience and values within the cultural and socioeconomic context in which I exist.\n\n3"]}, {"persona": {"region": "Dakahlia", "sex": "female", "age": 24, "country": "Egypt", "marital_status": "married", "education": "higher", "social_class": "upper middle class"}, "question": {"id": "Q142", "variant": 0}, "response": ["From an emic perspective, as a married female from Dakahlia, Egypt, my cultural context and socioeconomic background play a significant role in my answer to this question. In my cultural context, there is a strong emphasis on the importance of education and career, and as someone who has completed higher education and considers myself part of the upper middle class, I have certain expectations and responsibilities. My individual values and personal experience also influence my answer, as I have worked hard to achieve my education and social status, and losing my job or not finding a job would not only impact my financial stability but also my social standing. Additionally, the cultural relativism aspect reminds me that my perspective may not be the same as others from different backgrounds, and my nuanced understanding of the question leads me to choose the option \"A good deal.\"\n\n2"]}, {"persona": {"region": "Dakahlia", "sex": "male", "age": 20, "country": "Egypt", "marital_status": "single", "education": "middle", "social_class": "upper middle class"}, "question": {"id": "Q142", "variant": 0}, "response": ["Based on my individual values and personal experience, as well as my socioeconomic background, I am very worried about losing my job or not finding a job. As a single male from Dakahlia, Egypt, I come from an upper middle class family, and I have completed middle education level. In my cultural context, finding a job is crucial for my social status and financial stability. Additionally, the current economic situation in Egypt has made it difficult for many young people to secure stable employment. Therefore, my worries about job security are influenced by my personal experiences and the socioeconomic background of my community.\n\n1"]}, {"persona": {"region": "Dakahlia", "sex": "male", "age": 45, "country": "Egypt", "marital_status": "married", "education": "middle", "social_class": "upper middle class"}, "question": {"id": "Q142", "variant": 0}, "response": ["Based on the anthropological framework, my response to the question of how worried I am about losing my job or not finding a job would be influenced by a combination of emic and etic perspectives. In my cultural context of Dakahlia, Egypt, the socioeconomic background of being part of the upper middle class has provided me with a certain level of stability and security. Additionally, my individual values and personal experience have instilled in me a sense of responsibility and financial independence. However, the cultural relativism of Egypt and the current economic situation in the country also play a role in my perception. Considering all these factors, I would choose: \n\n3) Not much"]}, {"persona": {"region": "Dakahlia", "sex": "female", "age": 43, "country": "Egypt", "marital_status": "married", "education": "higher", "social_class": "upper middle class"}, "question": {"id": "Q142", "variant": 0}, "response": ["Based on the anthropological framework, I, as a married female from Dakahlia, Egypt, would consider the question of job security within the context of my cultural and socioeconomic background. In Egypt, there is a strong emphasis on the value of education and career success, especially for women in the upper middle class. Additionally, the cultural context of Dakahlia emphasizes the importance of financial stability and providing for one's family. As a woman who has completed higher education and considers herself part of the upper middle class, I have invested a lot in my career and have high expectations for myself. Therefore, I would be very worried about losing my job or not finding a job, as it would significantly impact my social status and ability to provide for my family.\n\n1"]}, {"persona": {"region": "Dakahlia", "sex": "female", "age": 20, "country": "Egypt", "marital_status": "single", "education": "middle", "social_class": "upper middle class"}, "question": {"id": "Q142", "variant": 0}, "response": ["Based on the anthropological framework, as a single female from Dakahlia, Egypt, who is 20 years old, completed middle education level, and considers herself part of the upper middle class, my perspective on job security is influenced by my cultural context, individual values, and socioeconomic background. In Dakahlia, job opportunities for women, especially those with only a middle education level, are limited. Additionally, as someone from the upper middle class, there may be societal pressure to maintain a certain level of financial stability. Therefore, I am very worried about losing my job or not finding a job as it would impact my socioeconomic status and ability to maintain a certain lifestyle.\n\n1"]}, {"persona": {"region": "Dakahlia", "sex": "female", "age": 40, "country": "Egypt", "marital_status": "single", "education": "middle", "social_class": "lower middle class"}, "question": {"id": "Q142", "variant": 0}, "response": ["Based on the anthropological framework, as a single female from Dakahlia, Egypt, who is 40 years old and part of the lower middle class, my answer to the question would be influenced by my socioeconomic background, cultural context, and personal experience. As someone with a middle education level, finding a stable job may be a constant concern for me due to limited job opportunities and economic instability in my region. Additionally, as a single female, the cultural context and gender dynamics may also play a role in my concern about job security, as I may face additional challenges in the workforce. Therefore, my answer would be (1) Very much."]}, {"persona": {"region": "Dakahlia", "sex": "female", "age": 33, "country": "Egypt", "marital_status": "married", "education": "higher", "social_class": "upper middle class"}, "question": {"id": "Q142", "variant": 0}, "response": ["Based on my emic perspective as a married female from Dakahlia, Egypt, I understand that the cultural context and socioeconomic background play a significant role in my perception of job security. In my community, there is a strong emphasis on education and career advancement, and as someone who has completed higher education and considers myself part of the upper middle class, there is a certain level of expectation and pressure to maintain a stable and successful career. Additionally, my individual values and personal experience, along with the socioeconomic background, contribute to my concern about job security. Furthermore, the cultural relativism in Egypt emphasizes the importance of financial stability and social status, which further reinforces my worry about losing my job or not finding a new one.\n\n2"]}, {"persona": {"region": "Dakahlia", "sex": "female", "age": 24, "country": "Egypt", "marital_status": "married", "education": "middle", "social_class": "working class"}, "question": {"id": "Q142", "variant": 0}, "response": ["Based on the anthropological framework, as a married female from Dakahlia, Egypt, my emic perspective would lead me to be very worried about losing my job or not finding a job, as the cultural context of my community values financial stability and the ability to provide for my family. My individual values and personal experience also play a role, as a 24-year-old woman with only a middle education level, I may feel more vulnerable in the job market. Additionally, being part of the working class, my socioeconomic background would heighten my concerns about job security. Furthermore, the cultural relativism of my community emphasizes the importance of work and financial stability, further contributing to my worries. Therefore, based on my nuanced understanding of the question and my personal circumstances, I would choose option (1) Very much. \n\n1"]}, {"persona": {"region": "Dakahlia", "sex": "female", "age": 53, "country": "Egypt", "marital_status": "widowed", "education": "middle", "social_class": "working class"}, "question": {"id": "Q142", "variant": 0}, "response": ["Based on the anthropological framework, as a widowed female from Dakahlia, Egypt, who is 53 years old and part of the working class, my emic perspective is shaped by my personal experience and socioeconomic background. Being in the working class and having completed only middle education, I am worried about losing my job or not finding a job. My cultural context also plays a role, as employment opportunities may be limited in my area. Additionally, my socio-economic background and individual values influence my perception of job security. Therefore, I would choose option (1) Very much, as I am greatly concerned about my job situation."]}, {"persona": {"region": "Dakahlia", "sex": "female", "age": 30, "country": "Egypt", "marital_status": "single", "education": "middle", "social_class": "lower middle class"}, "question": {"id": "Q142", "variant": 0}, "response": ["Based on the anthropological framework, as a single female from Dakahlia, Egypt, who is 30 years old and part of the lower middle class, my response to the question about job insecurity is influenced by my cultural context, socioeconomic background, and personal experience. In Dakahlia, job opportunities for women, especially those with only a middle education level, are limited. The cultural context of gender roles and expectations also plays a significant role in my concern about job security. Additionally, my lower middle class status means that I do not have a financial safety net to fall back on if I were to lose my job. Therefore, I am very worried about losing my job or not finding a job.\n\n1"]}, {"persona": {"region": "Dakahlia", "sex": "male", "age": 53, "country": "Egypt", "marital_status": "married", "education": "higher", "social_class": "upper middle class"}, "question": {"id": "Q142", "variant": 0}, "response": ["Based on the anthropological framework, as a married male from Dakahlia, Egypt, my emic perspective is heavily influenced by my individual values and personal experience, as well as my socioeconomic background. As a member of the upper middle class, I have certain expectations and responsibilities to uphold, and my education level and age also play a role in how I perceive the importance of job security. Additionally, the cultural context of Dakahlia and the societal expectations placed on men to provide for their families further influence my perspective. Therefore, I would choose the option:\n\n(3) Not much"]}, {"persona": {"region": "Dakahlia", "sex": "male", "age": 28, "country": "Egypt", "marital_status": "married", "education": "middle", "social_class": "working class"}, "question": {"id": "Q142", "variant": 0}, "response": ["In considering the question of how worried I am about losing my job or not finding a job, I must take into account my cultural context, individual values, and socioeconomic background. As a married male from Dakahlia, Egypt, I come from a working-class background and have completed middle education level. In my cultural context, there is a strong emphasis on providing for my family and maintaining a steady income. Additionally, the economic situation in Egypt can be uncertain, and finding stable employment can be challenging. Given these factors, I would say that I am very much worried about losing my job or not finding a job.\n\n1"]}, {"persona": {"region": "Dakahlia", "sex": "female", "age": 38, "country": "Egypt", "marital_status": "married", "education": "middle", "social_class": "upper middle class"}, "question": {"id": "Q142", "variant": 0}, "response": ["Based on the anthropological framework, my perspective as a married female from Dakahlia, Egypt, who is 38 years old, completed middle education level, and considers myself part of the upper middle class, is influenced by various factors. My cultural context, personal experience, and socioeconomic background all play a role in my answer. In Dakahlia, Egypt, the job market is competitive and opportunities for women can be limited. Additionally, as a member of the upper middle class, there is a certain level of expectation and pressure to maintain a certain standard of living. Therefore, I am worried about losing my job or not finding a job, as it could impact my financial stability and social status. \n\n2"]}, {"persona": {"region": "Gharbia", "sex": "male", "age": 27, "country": "Egypt", "marital_status": "single", "education": "higher", "social_class": "upper middle class"}, "question": {"id": "Q142", "variant": 0}, "response": ["Based on the anthropological framework, as a single male from Gharbia, Egypt, who has completed higher education and considers myself part of the upper middle class, my subjective understanding of the worry about losing my job or not finding a job is influenced by factors such as my individual values and personal experience, socioeconomic background, and cultural context. In my cultural context, there is a high value placed on job security and financial stability, especially for individuals in the upper middle class. Additionally, my personal experience and education have instilled in me the importance of career success and stability. Therefore, I would choose option (3) Not much, as I have confidence in my education and socioeconomic status to provide me with opportunities for job security."]}, {"persona": {"region": "Gharbia", "sex": "female", "age": 35, "country": "Egypt", "marital_status": "married", "education": "higher", "social_class": "upper middle class"}, "question": {"id": "Q142", "variant": 0}, "response": ["From an emic perspective, as a married female from Gharbia, Egypt, my worries about losing my job or not finding a job are heavily influenced by my cultural context and socioeconomic background. In Egypt, the job market can be competitive, and as someone who has completed higher education and considers myself part of the upper middle class, I have certain expectations and responsibilities to uphold. Additionally, as a woman in this cultural context, there may be added pressures and expectations placed on me in terms of employment. My individual values and personal experience also play a role in my worries, as I may feel a strong sense of responsibility to contribute to my family's socio-economic status and uphold a certain standard of living. Considering all these factors, I would have to say that I am worried about losing my job or not finding a job to a good deal. \n\n2"]}, {"persona": {"region": "Gharbia", "sex": "female", "age": 37, "country": "Egypt", "marital_status": "married", "education": "higher", "social_class": "upper middle class"}, "question": {"id": "Q142", "variant": 0}, "response": ["Based on the anthropological framework, as a married female from Gharbia, Egypt, who has completed higher education and considers myself part of the upper middle class, my perspective on job security is influenced by a combination of emic and etic perspectives, cultural context, individual values and personal experience, socioeconomic background, cultural relativism, space and time, and nuance. In Gharbia, job opportunities for women in the upper middle class are limited and often competitive, leading to a significant concern about job security. Additionally, as a woman with higher education, I have invested a lot of time and effort into my career, making the potential loss of a job a significant worry. Therefore, I would choose option (1) Very much, as I am indeed very worried about losing my job or not finding a job."]}, {"persona": {"region": "Gharbia", "sex": "male", "age": 43, "country": "Egypt", "marital_status": "married", "education": "middle", "social_class": "lower middle class"}, "question": {"id": "Q142", "variant": 0}, "response": ["Based on the anthropological framework, as a 43-year-old married male from Gharbia, Egypt, with a middle education level and considering myself part of the lower middle class, my perspective on job security is heavily influenced by my socioeconomic background and personal experience. In Egypt, the job market can be quite competitive and unstable, especially for someone with my educational background and class status. The cultural context also plays a significant role, as there may be limited opportunities available in my local area. Additionally, my individual values and personal experience lead me to be very worried about losing my job or not finding one, as it would have a significant impact on my family's financial stability and well-being. Therefore, my chosen answer is: 1) Very much"]}, {"persona": {"region": "Gharbia", "sex": "male", "age": 28, "country": "Egypt", "marital_status": "single", "education": "higher", "social_class": "lower middle class"}, "question": {"id": "Q142", "variant": 0}, "response": ["Based on the anthropological framework, as a single male from Gharbia, Egypt, my emic perspective on the question of job security is influenced by my cultural context, socioeconomic background, and personal experience. Gharbia is a region with limited job opportunities, especially for those with only a higher education level and from the lower middle class. The current economic situation and lack of job prospects in the region contribute to my significant worry about losing my job or not finding one. Additionally, my personal values and individual experiences of struggling to find stable employment further intensify my concern about job security. Therefore, my answer to the question is:\n\n(1) Very much"]}, {"persona": {"region": "Gharbia", "sex": "male", "age": 39, "country": "Egypt", "marital_status": "married", "education": "middle", "social_class": "lower middle class"}, "question": {"id": "Q142", "variant": 0}, "response": ["From the perspective of a married male from Gharbia, Egypt, who is 39 years old, has completed middle education, and considers himself part of the lower middle class, the answer to the question of how worried he is about losing his job or not finding a job would be \"A good deal.\" This answer is based on the emic perspective of his socioeconomic background, where job security and employment opportunities are significant concerns for individuals in his position. Additionally, his individual values and personal experience, as well as his cultural context, contribute to this worry, as job stability is crucial for providing for his family and maintaining his social status. Furthermore, the cultural relativism of the Egyptian society and the nuance of the question lead him to choose this option to accurately reflect his perspective.\n\n2"]}, {"persona": {"region": "Gharbia", "sex": "male", "age": 30, "country": "Egypt", "marital_status": "married", "education": "middle", "social_class": "lower middle class"}, "question": {"id": "Q142", "variant": 0}, "response": ["Based on the anthropological framework, as a married male from Gharbia, Egypt, who is 30 years old, completed middle education, and considers myself part of the lower middle class, I am greatly worried about losing my job or not finding a job. The cultural context of Egypt, particularly in the lower middle class, emphasizes the importance of stable employment for providing for one's family and maintaining social status. My individual values and personal experience also contribute to this concern, as I have seen the impact of unemployment on others in my community. Additionally, my socioeconomic background plays a significant role in this worry, as I may not have the financial resources to support myself and my family in the event of unemployment. Therefore, my answer to the question is (1) Very much."]}, {"persona": {"region": "Gharbia", "sex": "male", "age": 43, "country": "Egypt", "marital_status": "married", "education": "lower", "social_class": "lower middle class"}, "question": {"id": "Q142", "variant": 0}, "response": ["Based on the anthropological framework, my answer is influenced by my cultural context as a married male from Gharbia, Egypt, where job opportunities are limited and unemployment rates are high. My lower education level and lower middle-class status also play a significant role in my concern about job security, as I may not have the same access to opportunities as those with higher education and socioeconomic status. Additionally, my personal experience and individual values shape my worry about providing for my family and maintaining financial stability. Considering these factors, my answer is (1) Very much."]}, {"persona": {"region": "Gharbia", "sex": "male", "age": 36, "country": "Egypt", "marital_status": "married", "education": "higher", "social_class": "lower middle class"}, "question": {"id": "Q142", "variant": 0}, "response": ["Based on the anthropological framework, my emic perspective as a married male from Gharbia, Egypt, at the age of 36, with a higher education level and considering myself part of the lower middle class, is greatly influenced by my cultural context, individual values, and socioeconomic background. In Gharbia, job opportunities are limited, and with the current economic conditions, the competition for employment is fierce. My personal experience and values also play a significant role in shaping my worries about job security. Additionally, my socioeconomic background as part of the lower middle class means that losing my job would have a significant impact on my family's financial stability. Therefore, my answer to the question would be: (1) Very much"]}, {"persona": {"region": "Gharbia", "sex": "male", "age": 25, "country": "Egypt", "marital_status": "married", "education": "middle", "social_class": "upper middle class"}, "question": {"id": "Q142", "variant": 0}, "response": ["From an anthropological perspective, as a married male from Gharbia, Egypt, my emic perspective on job security is heavily influenced by my cultural context and socioeconomic background. In Egypt, the economy is unstable and job opportunities are limited, especially for those with only a middle education level. As part of the upper middle class, I am accustomed to a certain level of financial security and stability, and the fear of losing my job or not finding a job is a very real and legitimate concern for me. My personal experience and values also play a role in this concern, as I have been raised to prioritize financial stability and providing for my family. Additionally, the cultural relativism of Egypt emphasizes the importance of work and providing for one's family, further contributing to my worry about job security. Therefore, from my perspective, I am very much worried about losing my job or not finding a job.\n\n2"]}, {"persona": {"region": "Gharbia", "sex": "male", "age": 31, "country": "Egypt", "marital_status": "married", "education": "middle", "social_class": "upper middle class"}, "question": {"id": "Q142", "variant": 0}, "response": ["Based on the anthropological framework, my perspective as a married male from Gharbia, Egypt, would be influenced by my cultural context, socioeconomic background, individual values, and personal experiences. In Egypt, the job market is competitive and unstable, especially for someone with only a middle education level. Additionally, as a member of the upper middle class, there is pressure to maintain a certain standard of living and to provide for my family. Therefore, I would be very worried about losing my job or not finding a job, as it would greatly impact my financial stability and social status.\n\n2"]}, {"persona": {"region": "Gharbia", "sex": "male", "age": 33, "country": "Egypt", "marital_status": "married", "education": "higher", "social_class": "lower middle class"}, "question": {"id": "Q142", "variant": 0}, "response": ["In considering the question of how worried I am about losing my job or not finding a job, it is important to take into account the emic and etic perspectives of my cultural context. As a married male from Gharbia, Egypt, my socioeconomic background as part of the lower middle class significantly influences my answer. The economic opportunities in my region are limited, and the competition for jobs is fierce. Additionally, my personal experience and individual values play a role in shaping my worries about job insecurity. Given these factors, I would have to say that I am very much worried about losing my job or not finding a job.\n\n1"]}, {"persona": {"region": "Gharbia", "sex": "male", "age": 26, "country": "Egypt", "marital_status": "single", "education": "higher", "social_class": "upper middle class"}, "question": {"id": "Q142", "variant": 0}, "response": ["From the emic perspective, as a single male from Gharbia, Egypt, my cultural context and socioeconomic background play a significant role in shaping my response to this question. My individual values and personal experience, as well as my higher education level, lead me to prioritize job security and financial stability. Additionally, my age and socioeconomic status as part of the upper middle class also affect my perception of the importance of finding and maintaining employment. Therefore, taking into account the nuance of the question and considering my background and cultural context, I would answer: \n\n2. A good deal"]}, {"persona": {"region": "Gharbia", "sex": "female", "age": 45, "country": "Egypt", "marital_status": "married", "education": "middle", "social_class": "lower middle class"}, "question": {"id": "Q142", "variant": 0}, "response": ["Based on the anthropological framework, as a married woman from Gharbia, Egypt, who is 45 years old, has completed middle education, and considers herself part of the lower middle class, my perspective on the worry of losing my job or not finding a job is heavily influenced by my socioeconomic background. The cultural context of Gharbia, Egypt, also plays a significant role in shaping my concern about job security. Given the economic challenges and limited job opportunities in my region, coupled with my lower middle class status, I am very worried about losing my job or not finding a job.\n\n1"]}, {"persona": {"region": "Gharbia", "sex": "female", "age": 55, "country": "Egypt", "marital_status": "married", "education": "middle", "social_class": "upper middle class"}, "question": {"id": "Q142", "variant": 0}, "response": ["Based on the anthropological framework, as a married female from Gharbia, Egypt, who is 55 years old and part of the upper middle class, my perspective is heavily influenced by my cultural context, individual values, and socioeconomic background. In Gharbia, there may be limited opportunities for women in the workforce, and as an educated individual, I may have aspirations and expectations for my career. Additionally, as part of the upper middle class, there may be certain societal pressures and expectations regarding employment. Therefore, I would feel very worried about losing my job or not finding a job.\n\n1"]}, {"persona": {"region": "Gharbia", "sex": "female", "age": 27, "country": "Egypt", "marital_status": "married", "education": "higher", "social_class": "upper middle class"}, "question": {"id": "Q142", "variant": 0}, "response": ["Based on the anthropological framework, as a married female from Gharbia, Egypt, who has completed higher education and considers myself part of the upper middle class, my answer to the question is influenced by multiple factors. Firstly, my cultural context and socioeconomic background play a significant role in my perception of job security. In Egypt, there are limited opportunities for women in the workforce, especially in upper middle class families. Additionally, my individual values and personal experience shape my concern for job security, as I have worked hard to attain higher education and establish a career. Therefore, I am very worried about losing my job or not finding a job. (1) Very much"]}, {"persona": {"region": "Gharbia", "sex": "female", "age": 42, "country": "Egypt", "marital_status": "married", "education": "higher", "social_class": "upper middle class"}, "question": {"id": "Q142", "variant": 0}, "response": ["Based on the anthropological framework, my answer to the question of how worried I am about losing my job or not finding a job is influenced by my individual values and personal experience, as well as my socioeconomic background. As a married, 42-year-old woman with higher education and belonging to the upper middle class in Gharbia, Egypt, I have worked hard to achieve my current status and have invested a lot in my career. Therefore, I am very much worried about losing my job or not finding a job because it would not only affect my financial stability but also my sense of identity and personal fulfillment. Additionally, the cultural context in Gharbia emphasizes the importance of stable employment and financial security, which further contributes to my concern about job stability. \n\n1"]}, {"persona": {"region": "Gharbia", "sex": "female", "age": 32, "country": "Egypt", "marital_status": "married", "education": "middle", "social_class": "upper middle class"}, "question": {"id": "Q142", "variant": 0}, "response": ["Based on the anthropological framework, as a married female from Gharbia, Egypt, my emic perspective is influenced by my cultural context, individual values and personal experiences, as well as my socioeconomic background. In Gharbia, there are limited job opportunities for women, especially those who have only completed middle education level. As a member of the upper middle class, I am accustomed to a certain standard of living and have financial responsibilities that require me to be employed. Additionally, the cultural expectation for women to contribute to their family's income adds to my concern about job security. Therefore, I am worried about losing my job or not finding a job. \n\n2"]}, {"persona": {"region": "Gharbia", "sex": "male", "age": 27, "country": "Egypt", "marital_status": "married", "education": "higher", "social_class": "upper middle class"}, "question": {"id": "Q142", "variant": 0}, "response": ["Based on the anthropological framework, my answer to the question would be influenced by my individual values and personal experience, as well as my socioeconomic background. As a married male from Gharbia, Egypt, who has completed higher education and considers myself part of the upper middle class, I have likely been exposed to a certain level of financial stability and security. However, the current economic climate in Egypt may also play a role in my concerns about job security. Additionally, cultural context and the nuance of the question are important factors to consider. Therefore, my answer would be:\n2) A good deal"]}, {"persona": {"region": "Gharbia", "sex": "female", "age": 27, "country": "Egypt", "marital_status": "married", "education": "higher", "social_class": "lower middle class"}, "question": {"id": "Q142", "variant": 0}, "response": ["Based on the anthropological framework, I would like to address the question from the perspective of a married female from Gharbia, Egypt. As a member of the lower middle class in a country with a high unemployment rate, the cultural context and socioeconomic background play a significant role in my answer. The emic perspective within this context would lead me to choose \"A good deal\" because the economic situation in Egypt often leads to uncertainty and worry about job security. Additionally, my individual values and personal experience, as well as the nuance of the question, would also contribute to this choice. Therefore, I would choose:\n\n(2) A good deal"]}, {"persona": {"region": "Gharbia", "sex": "female", "age": 37, "country": "Egypt", "marital_status": "married", "education": "middle", "social_class": "upper middle class"}, "question": {"id": "Q142", "variant": 0}, "response": ["Based on the anthropological framework, my perspective as a married female from Gharbia, Egypt, who is 37 years old and part of the upper middle class, is influenced by my cultural context and socioeconomic background. In Egypt, there is a high value placed on job security and stability, especially for married women who may contribute to their household income. Additionally, being part of the upper middle class, I have likely experienced the benefits of financial security and the fear of losing that status can be a significant concern. Therefore, my answer to the question would be:\n2"]}, {"persona": {"region": "Gharbia", "sex": "male", "age": 28, "country": "Egypt", "marital_status": "married", "education": "higher", "social_class": "working class"}, "question": {"id": "Q142", "variant": 0}, "response": ["Based on the anthropological framework, as a married male from Gharbia, Egypt, I understand the importance of considering the cultural context, individual values, and socioeconomic background in my response. In my community, the working class faces significant challenges in finding and maintaining employment, and this is compounded by the current economic conditions. As a result, I am very worried about losing my job or not finding a job, as it would have a significant impact on my ability to provide for my family and maintain my social status within the community.\n\n2"]}, {"persona": {"region": "Gharbia", "sex": "female", "age": 50, "country": "Egypt", "marital_status": "married", "education": "middle", "social_class": "upper middle class"}, "question": {"id": "Q142", "variant": 0}, "response": ["Based on the anthropological framework, my cultural context as a married female from Gharbia, Egypt, and my socio-economic background as part of the upper middle class are important factors to consider. In Egyptian society, there are certain expectations and pressures placed on women, especially in terms of employment. Additionally, my age and education level also play a role in my perception of job security. Considering these factors, I would choose the following option:\n\n3"]}, {"persona": {"region": "Gharbia", "sex": "male", "age": 39, "country": "Egypt", "marital_status": "single", "education": "higher", "social_class": "working class"}, "question": {"id": "Q142", "variant": 0}, "response": ["Based on the anthropological framework, my emic perspective as a working-class single male from Gharbia, Egypt, at the age of 39 with a higher education level, is heavily influenced by my cultural context, individual values, and socioeconomic background. In Gharbia, job opportunities are limited, and unemployment is a significant concern for many individuals. As a member of the working class, I am acutely aware of the challenges in finding stable employment and providing for myself. Additionally, my personal experiences and values emphasize the importance of financial stability and independence. Therefore, considering all these factors, I am very worried about losing my job or not finding a job.\n\n1"]}, {"persona": {"region": "Gharbia", "sex": "female", "age": 45, "country": "Egypt", "marital_status": "married", "education": "higher", "social_class": "upper middle class"}, "question": {"id": "Q142", "variant": 0}, "response": ["Based on the anthropological framework, my emic perspective as a married female from Gharbia, Egypt, who is 45 years old and part of the upper middle class, would lead me to consider the cultural context, individual values, and socioeconomic background in answering this question. In my cultural context, job security and financial stability are highly valued, especially for someone with my level of education and socioeconomic status. Additionally, my personal experience and values prioritize stability and security, which would lead me to be very worried about losing my job or not finding a job. This is further influenced by the nuance of the question, as it specifically addresses my personal concerns and anxieties about employment. Therefore, my chosen answer is (1) Very much."]}, {"persona": {"region": "Sharkia", "sex": "male", "age": 35, "country": "Egypt", "marital_status": "married", "education": "higher", "social_class": "upper middle class"}, "question": {"id": "Q142", "variant": 0}, "response": ["Based on the anthropological framework, my answer to the question about job security is influenced by my individual values and personal experience, as well as my socioeconomic background. As a married male from Sharkia, Egypt, who is 35 years old, completed higher education, and considers myself part of the upper middle class, I have been raised in a culture where job security is highly valued and seen as a measure of success and stability. Additionally, my socioeconomic background means that I have certain expectations and responsibilities to uphold, which adds to the pressure of maintaining a stable job. Therefore, I am worried about losing my job or not finding a job.\n\n2"]}, {"persona": {"region": "Sharkia", "sex": "female", "age": 55, "country": "Egypt", "marital_status": "married", "education": "middle", "social_class": "lower middle class"}, "question": {"id": "Q142", "variant": 0}, "response": ["Based on the anthropological framework, my emic perspective as a married female from Sharkia, Egypt, would be heavily influenced by my cultural context, individual values, and socioeconomic background. In my cultural context, job opportunities for women are limited and my middle education level may not provide me with many employment options. Additionally, as part of the lower middle class, I am constantly worried about financial stability and providing for my family. This worry is further exacerbated by the fact that as a woman in Egypt, I may face discrimination and limited opportunities in the job market. Therefore, I would choose option (1) Very much, as I am deeply worried about losing my job or not finding a new one. \n\n1"]}, {"persona": {"region": "Sharkia", "sex": "female", "age": 27, "country": "Egypt", "marital_status": "married", "education": "middle", "social_class": "lower middle class"}, "question": {"id": "Q142", "variant": 0}, "response": ["Based on the anthropological framework, my answer is influenced by my individual values and personal experience, as well as my socioeconomic background. As a married female from Sharkia, Egypt, I am 27 years old and have completed middle education, placing me in the lower middle class. In this cultural context, finding stable employment can be extremely challenging, and the fear of losing my job or not finding one is a significant concern. Additionally, my socioeconomic background means that I may not have the same access to resources and opportunities as those in higher classes, increasing my worry about job security. Therefore, my answer is:\n2"]}, {"persona": {"region": "Sharkia", "sex": "female", "age": 52, "country": "Egypt", "marital_status": "married", "education": "middle", "social_class": "lower middle class"}, "question": {"id": "Q142", "variant": 0}, "response": ["Based on the anthropological framework, as a married woman from Sharkia, Egypt, my emic perspective is heavily influenced by my cultural context, socioeconomic background, and personal experience. In Egypt, women from lower middle class families often have limited opportunities for employment and face economic insecurity. Additionally, my age and educational background also play a role in my concerns about job security. Therefore, I am very worried about losing my job or not finding a job.\n\n1"]}, {"persona": {"region": "Sharkia", "sex": "male", "age": 36, "country": "Egypt", "marital_status": "married", "education": "middle", "social_class": "lower middle class"}, "question": {"id": "Q142", "variant": 0}, "response": ["From an anthropological perspective, my emic and etic perspective as a married male from Sharkia, Egypt, who is 36 years old and part of the lower middle class, greatly influences my answer to this question. The cultural context of my upbringing and current societal norms in Sharkia, as well as my socioeconomic background, play a significant role in shaping my concerns about job security. Additionally, my individual values and personal experiences, such as my level of education and the economic struggles faced by my family and community, further contribute to my perspective. Taking into account the cultural relativism and the nuanced understanding of the question, I would choose option (2) A good deal, as the economic conditions and job opportunities in my area are a cause for significant worry and concern for me."]}, {"persona": {"region": "Sharkia", "sex": "female", "age": 20, "country": "Egypt", "marital_status": "single", "education": "middle", "social_class": "working class"}, "question": {"id": "Q142", "variant": 0}, "response": ["Based on the anthropological framework, as a single female from Sharkia, Egypt, and part of the working class, my cultural context and socioeconomic background play a significant role in my answer. In Egypt, opportunities for employment for young women from working-class backgrounds are limited, and there is a pervasive concern about job security. Additionally, my individual values and personal experience shape my perception, as I have witnessed the struggles of my family and community members in finding stable employment. This, combined with the cultural relativism of valuing financial stability and independence, leads me to be very worried about losing my job or not finding one.\n\n2"]}, {"persona": {"region": "Sharkia", "sex": "male", "age": 60, "country": "Egypt", "marital_status": "married", "education": "middle", "social_class": "working class"}, "question": {"id": "Q142", "variant": 0}, "response": ["Based on the anthropological framework, as a married male from Sharkia, Egypt, at the age of 60 with a middle education level and considering myself part of the working class, my answer to the question of how worried I am about losing my job or not finding a job would be \"Very much.\" This answer is influenced by my cultural context, where job security is a significant concern, and my socioeconomic background, as the working class often faces challenges in job stability. Additionally, my individual values and personal experience also contribute to this worry, as I may have witnessed others in similar socioeconomic positions struggle with unemployment. Lastly, the nuance of the question also plays a role, as the phrasing implies a potential loss of income and stability, which is a legitimate concern for someone in my position. \n\n1"]}, {"persona": {"region": "Sharkia", "sex": "male", "age": 41, "country": "Egypt", "marital_status": "married", "education": "higher", "social_class": "upper middle class"}, "question": {"id": "Q142", "variant": 0}, "response": ["Based on the anthropological framework, my personal experience and socioeconomic background as a married male from Sharkia, Egypt, who is 41 years old and part of the upper middle class, greatly influences my perception of job security. As a person with higher education, I am aware of the competitive job market and the importance of securing stable employment to maintain my social status and provide for my family. The cultural context of Egypt also emphasizes the significance of stable employment for men as breadwinners. Therefore, I am very worried about losing my job or not finding a new one.\n\n1"]}, {"persona": {"region": "Sharkia", "sex": "female", "age": 23, "country": "Egypt", "marital_status": "married", "education": "middle", "social_class": "lower middle class"}, "question": {"id": "Q142", "variant": 0}, "response": ["Based on the anthropological framework, as a married female from Sharkia, Egypt, age 23, with a middle education level and a lower middle class background, my answer to the question would be \"A good deal.\" This reflects the cultural context of Egypt, where job security and financial stability are important factors in daily life. Additionally, my socioeconomic background and personal experience would contribute to my concern about job stability. The nuance of the question also plays a role, as I may have specific worries about finding a job in my local area or within my skill set. Therefore, my answer is:\n\n2) A good deal"]}, {"persona": {"region": "Sharkia", "sex": "male", "age": 49, "country": "Egypt", "marital_status": "married", "education": "higher", "social_class": "upper middle class"}, "question": {"id": "Q142", "variant": 0}, "response": ["From an anthropological perspective, my emic perspective as a married male from Sharkia, Egypt, with a higher education level and belonging to the upper middle class, is heavily influenced by my cultural context, individual values, and socioeconomic background. In my cultural context, there is a strong emphasis on providing for one's family and maintaining a certain social status. My individual values prioritize stability and financial security, and my socioeconomic background has afforded me certain privileges and expectations. Additionally, my age and place in life contribute to my concerns about job security. Therefore, based on my nuanced understanding of the question and my personal circumstances, I would choose option (2) A good deal."]}, {"persona": {"region": "Sharkia", "sex": "female", "age": 30, "country": "Egypt", "marital_status": "married", "education": "middle", "social_class": "upper middle class"}, "question": {"id": "Q142", "variant": 0}, "response": ["Based on the anthropological framework, the emic perspective from the cultural context of Sharkia, Egypt, emphasizes the importance of socioeconomic background in understanding individual values and personal experience. As a 30-year-old married woman from the upper middle class in Sharkia, Egypt, I would be very worried about losing my job or not finding a job. This is because my socioeconomic background and education level have provided me with certain expectations and responsibilities, and the cultural context of Egypt places a strong emphasis on financial stability and security for my family. Therefore, my answer to the question would be:\n1"]}, {"persona": {"region": "Sharkia", "sex": "male", "age": 39, "country": "Egypt", "marital_status": "married", "education": "higher", "social_class": "upper middle class"}, "question": {"id": "Q142", "variant": 0}, "response": ["Based on the anthropological framework, as a married male from Sharkia, Egypt, at 39 years of age with a higher education level and considering myself part of the upper middle class, my perspective on the worry of losing my job or not finding a job would be influenced by various factors. My cultural context, individual values, and personal experience would lead me to consider the importance of providing for my family and maintaining my social status. My socioeconomic background also plays a role in my concern for job security, as the upper middle class often relies on stable employment for financial stability. Additionally, the cultural relativism in Egypt places a strong emphasis on employment as a reflection of one's worth and success. Therefore, I would select option (2) A good deal, as I would be significantly worried about losing my job or not finding a new one due to the societal and personal pressures associated with my socioeconomic status. \n\n2"]}, {"persona": {"region": "Sharkia", "sex": "female", "age": 26, "country": "Egypt", "marital_status": "married", "education": "middle", "social_class": "lower middle class"}, "question": {"id": "Q142", "variant": 0}, "response": ["Based on the anthropological framework, my cultural context as a married female from Sharkia, Egypt, with a lower middle class socioeconomic background, is pivotal in understanding my answer to the question. In my cultural context, there are limited job opportunities for women, and the socioeconomic background often determines the availability of jobs. Additionally, my individual values and personal experience also play a significant role in shaping my perception. As a 26-year-old with only a middle education level, I am aware of the limited job prospects available to me, and this has caused me to worry very much about losing my job or not finding a job.\n\n1"]}, {"persona": {"region": "Sharkia", "sex": "female", "age": 48, "country": "Egypt", "marital_status": "married", "education": "middle", "social_class": "lower middle class"}, "question": {"id": "Q142", "variant": 0}, "response": ["From an anthropological perspective, my emic perspective as a married woman from Sharkia, Egypt, who is 48 years old and part of the lower middle class, plays a significant role in shaping my response to the question. The cultural context of my upbringing and current living situation, as well as my socioeconomic background, heavily influence my understanding and worries about job security. Additionally, my individual values and personal experiences, along with the nuanced phrasing of the question, are crucial in determining my response. Considering all these factors, I believe that I would be very worried about losing my job or not finding a job. This is due to the economic challenges faced by individuals in my demographic and the impact it would have on my family and personal well-being.\n\n1"]}, {"persona": {"region": "Sharkia", "sex": "male", "age": 34, "country": "Egypt", "marital_status": "married", "education": "higher", "social_class": "upper middle class"}, "question": {"id": "Q142", "variant": 0}, "response": ["Based on the anthropological framework, as a married male from Sharkia, Egypt, age 34, and part of the upper-middle class, my perspective is influenced by my cultural context, socioeconomic background, and personal experience. In Sharkia, job security is a significant concern for individuals, especially those who have invested in higher education and seek to maintain their socioeconomic status. Additionally, personal values and individual experiences play a role in shaping my outlook. Given these factors, I would be inclined to select option (2) A good deal as my answer to the question.\n\n2"]}, {"persona": {"region": "Sharkia", "sex": "female", "age": 39, "country": "Egypt", "marital_status": "divorced", "education": "middle", "social_class": "lower middle class"}, "question": {"id": "Q142", "variant": 0}, "response": ["Based on the anthropological framework, as a divorced female from Sharkia, Egypt, who is 39 years old and part of the lower middle class, my answer to the question would be \"A good deal.\" This choice is informed by my emic perspective, as individuals in my socioeconomic background often struggle to find stable employment, and losing a job would have significant repercussions on my ability to support myself and my family. Additionally, my cultural context and personal experience have taught me that job opportunities are limited in my community, and the competition is fierce. Therefore, the fear of losing my job or not finding a new one is a very real and pressing concern for me."]}, {"persona": {"region": "Sharkia", "sex": "male", "age": 39, "country": "Egypt", "marital_status": "married", "education": "middle", "social_class": "upper middle class"}, "question": {"id": "Q142", "variant": 0}, "response": ["Based on the anthropological framework, my understanding and answer to this question are influenced by a combination of factors. As a married male from Sharkia, Egypt, my cultural context and socioeconomic background play a significant role in shaping my perspective. In my community, job security and financial stability are highly valued, and unemployment is a major concern. Additionally, my individual values and personal experience have led me to prioritize stability and security for my family. Therefore, I am inclined to be very worried about losing my job or not finding a job. (1) Very much"]}, {"persona": {"region": "Qaliubiya", "sex": "male", "age": 62, "country": "Egypt", "marital_status": "married", "education": "middle", "social_class": "working class"}, "question": {"id": "Q142", "variant": 0}, "response": ["In considering the perspective of a married male from Qaliubiya, Egypt, who is 62 years old, completed middle education level, and considers himself part of the working class, it is important to take into account his cultural context, individual values, and socioeconomic background. In Egypt, the job market can be competitive, especially for individuals without advanced education or specialized skills. The individual's age also plays a role, as older individuals may face challenges in finding new employment opportunities. Additionally, as a member of the working class, the individual may have a heightened concern about job stability and financial security. Therefore, he may be very worried about losing his job or not finding a new one.\n\n2"]}, {"persona": {"region": "Qaliubiya", "sex": "male", "age": 33, "country": "Egypt", "marital_status": "married", "education": "middle", "social_class": "working class"}, "question": {"id": "Q142", "variant": 0}, "response": ["Based on the anthropological framework, my response is influenced by my emic perspective as a married male from Qaliubiya, Egypt, my cultural context, and my socioeconomic background as part of the working class. My individual values and personal experience also play a role in my answer. In Egypt, the job market is competitive, and unemployment rates are high, especially for those with only a middle education level. As a married man responsible for providing for my family, I am very worried about losing my job or not finding a job. This worry is deeply rooted in the economic and social realities of my cultural context and my personal experience. \n\n2"]}, {"persona": {"region": "Qaliubiya", "sex": "male", "age": 62, "country": "Egypt", "marital_status": "married", "education": "higher", "social_class": "lower middle class"}, "question": {"id": "Q142", "variant": 0}, "response": ["Based on the anthropological framework, my emic perspective as a married male from Qaliubiya, Egypt, who is 62 years old and part of the lower middle class, heavily influences my answer to the question. The cultural context of Egypt and my socioeconomic background play a significant role in shaping my worries about job security. In Egypt, there is a high level of competition for jobs and limited opportunities, especially for individuals in the lower middle class. Additionally, my personal experience and individual values as someone who has completed higher education have instilled a strong sense of responsibility to provide for my family, making me very worried about losing my job or not finding a new one. This worry is further compounded by the current economic climate and the challenges of finding employment at my age. Therefore, my answer is: \n(1) Very much"]}, {"persona": {"region": "Qaliubiya", "sex": "male", "age": 29, "country": "Egypt", "marital_status": "married", "education": "middle", "social_class": "working class"}, "question": {"id": "Q142", "variant": 0}, "response": ["Based on the anthropological framework, as a married male from Qaliubiya, Egypt, with a middle education level and part of the working class, my perspective on job security is heavily influenced by my socioeconomic background. In this cultural context, job stability is crucial for providing for my family and maintaining social status. Additionally, my individual values and personal experience play a significant role in my perception of job security. Given the economic challenges in Egypt and the limited opportunities for those with my level of education, I am very worried about losing my job or not finding a job.\n\n2"]}, {"persona": {"region": "Qaliubiya", "sex": "female", "age": 42, "country": "Egypt", "marital_status": "married", "education": "higher", "social_class": "working class"}, "question": {"id": "Q142", "variant": 0}, "response": ["Based on the anthropological framework, my emic perspective as a married female from Qaliubiya, Egypt, is influenced by my cultural context, individual values, and socioeconomic background. As a member of the working class, I am acutely aware of the challenges and uncertainties in the job market. My cultural context and socioeconomic background also play a significant role in my perception, as finding and maintaining employment is crucial for financial stability and social status in my community. Additionally, my personal experience and values further contribute to my concern about job security. Therefore, I choose option (1) Very much."]}, {"persona": {"region": "Qaliubiya", "sex": "female", "age": 50, "country": "Egypt", "marital_status": "married", "education": "middle", "social_class": "lower middle class"}, "question": {"id": "Q142", "variant": 0}, "response": ["Based on the anthropological framework, my answer is influenced by my emic perspective as a married female from Qaliubiya, Egypt, where the socioeconomic background and cultural context play a significant role in my understanding and response to this question. As a member of the lower middle class, with limited education and opportunities, I am very worried about losing my job or not finding a job. The cultural relativism and nuance in the phrasing of the question also affect my answer, as it is important to consider the specific context and personal experience in shaping my perspective.\n\n2"]}, {"persona": {"region": "Qaliubiya", "sex": "male", "age": 29, "country": "Egypt", "marital_status": "married", "education": "higher", "social_class": "lower middle class"}, "question": {"id": "Q142", "variant": 0}, "response": ["Based on the anthropological framework, as a married male from Qaliubiya, Egypt, my emic perspective is heavily influenced by my cultural context, socioeconomic background, and personal experience. In Egypt, the job market is highly competitive and the economy is unstable, especially for those in the lower middle class. My cultural context also emphasizes the importance of providing for my family and the societal pressure to be the breadwinner. Additionally, my personal experience and the experiences of those around me have shown that finding and keeping a job is a constant struggle. Therefore, I am very worried about losing my job or not finding a job as it directly impacts my ability to fulfill my role as a provider and maintain my socioeconomic status.\n\n1"]}, {"persona": {"region": "Qaliubiya", "sex": "male", "age": 35, "country": "Egypt", "marital_status": "married", "education": "higher", "social_class": "working class"}, "question": {"id": "Q142", "variant": 0}, "response": ["Based on the anthropological framework, as a married male from Qaliubiya, Egypt, with a working-class background and higher education, my emic perspective on the question of job security is heavily influenced by my cultural context and socioeconomic background. In Egypt, the job market is competitive and the economy is not stable, so finding and keeping a job is a major concern for me. Additionally, my personal experience and values, shaped by my socioeconomic background, lead me to prioritize financial stability and security. Therefore, I am worried about losing my job or not finding a job, and this concern is further heightened by the current economic situation in Egypt. \n\n2"]}, {"persona": {"region": "Qaliubiya", "sex": "female", "age": 40, "country": "Egypt", "marital_status": "married", "education": "middle", "social_class": "working class"}, "question": {"id": "Q142", "variant": 0}, "response": ["Based on the anthropological framework, as a married female from Qaliubiya, Egypt, at 40 years of age and part of the working class, my perspective on job security is heavily influenced by my cultural context, individual values, and socioeconomic background. In Egypt, there is a high level of competition for employment, especially for women, and the economic situation can be unstable. As a working-class individual with only a middle education level, finding and keeping a job is crucial for my family's financial stability. Additionally, my personal experience and values lead me to prioritize job security. Therefore, I am very worried about losing my job or not finding a job.\n\n1"]}, {"persona": {"region": "Qaliubiya", "sex": "female", "age": 48, "country": "Egypt", "marital_status": "divorced", "education": "lower", "social_class": "working class"}, "question": {"id": "Q142", "variant": 0}, "response": ["From the perspective of a divorced female from Qaliubiya, Egypt, who is 48 years old, has completed lower education, and considers herself part of the working class, several factors come into play when considering the level of worry about losing or not finding a job. The cultural context of Egypt, particularly in Qaliubiya, may present challenges for women in the workforce, especially those with lower education levels. Socioeconomic background is also crucial, as being part of the working class may mean limited opportunities and financial stability. Additionally, personal experience and individual values may contribute to a heightened concern about job security. Therefore, given these factors, the most likely response from this perspective would be (1) Very much."]}, {"persona": {"region": "Qaliubiya", "sex": "male", "age": 46, "country": "Egypt", "marital_status": "married", "education": "middle", "social_class": "working class"}, "question": {"id": "Q142", "variant": 0}, "response": ["Based on the anthropological framework, my cultural context as a married male from Qaliubiya, Egypt, and my socioeconomic background as a working-class individual greatly influence my answer to this question. In my cultural context, the importance of stable employment is significant for providing for my family and maintaining social status. Additionally, my socioeconomic background means that losing my job or struggling to find employment would have a significant impact on my financial security and social standing. Therefore, I am very worried about losing my job or not finding a job.\n\n1"]}, {"persona": {"region": "Qaliubiya", "sex": "male", "age": 47, "country": "Egypt", "marital_status": "married", "education": "higher", "social_class": "lower middle class"}, "question": {"id": "Q142", "variant": 0}, "response": ["Based on the anthropological framework, as a married male from Qaliubiya, Egypt, my emic perspective is heavily influenced by my cultural context, individual values, and socioeconomic background. In Egypt, the job market is competitive, and as a lower middle class individual with a family to support, the fear of losing my job or not finding one is a significant concern. Additionally, my age and educational background also play a role in shaping my perspective on job security. Therefore, I would choose option (1) Very much, as the potential impact of job loss on my family and financial stability is a major source of worry for me."]}, {"persona": {"region": "Qaliubiya", "sex": "female", "age": 38, "country": "Egypt", "marital_status": "married", "education": "higher", "social_class": "working class"}, "question": {"id": "Q142", "variant": 0}, "response": ["From an emic perspective, as a married female from Qaliubiya, Egypt, my cultural context and socioeconomic background play a significant role in my perception of job security. In Egypt, the working class faces economic challenges and job instability is a common concern. Additionally, as a woman with higher education, I am aware of the limited opportunities available to me in the workforce. My individual values and personal experience further contribute to my worry about losing or not finding a job, as I have worked hard to attain my education and contribute to my family's income. Therefore, I am inclined to choose option (1) Very much."]}, {"persona": {"region": "Qaliubiya", "sex": "male", "age": 58, "country": "Egypt", "marital_status": "married", "education": "middle", "social_class": "working class"}, "question": {"id": "Q142", "variant": 0}, "response": ["From the anthropological framework, it is important to consider the individual values and personal experience, as well as the socioeconomic background of the persona. As a married male from Qaliubiya, Egypt, who is 58 years old and part of the working class, the cultural context of this persona's life plays a significant role in their perception of job security. With only a middle education level, the persona may feel a sense of vulnerability in the job market, especially considering the economic challenges faced by the working class in Egypt. Additionally, the cultural relativism perspective reminds us that the persona's worries about job security are valid and should not be dismissed based on societal hierarchies. Taking all these factors into account, the persona is likely to be very worried about losing their job or not finding a job due to their socioeconomic background and personal experience.\n\n2"]}, {"persona": {"region": "Qaliubiya", "sex": "female", "age": 27, "country": "Egypt", "marital_status": "married", "education": "higher", "social_class": "working class"}, "question": {"id": "Q142", "variant": 0}, "response": ["Based on the anthropological framework, I would like to provide my perspective as a married female from Qaliubiya, Egypt. My cultural context and socioeconomic background play a significant role in how I perceive job security. Given that I am part of the working class and have completed higher education, I am aware of the competitive job market and the challenges of finding stable employment. Additionally, my individual values and personal experience have shaped my concerns about job security, as I have witnessed the impact of unemployment on families in my community. Therefore, I would choose option (2) A good deal, as I am genuinely worried about losing my job or not finding a new one."]}, {"persona": {"region": "Qaliubiya", "sex": "female", "age": 48, "country": "Egypt", "marital_status": "married", "education": "middle", "social_class": "upper middle class"}, "question": {"id": "Q142", "variant": 0}, "response": ["From an emic perspective, as a married female from Qaliubiya, Egypt, my cultural context and socioeconomic background play a significant role in my understanding and answer to this question. In my cultural context, women are often expected to prioritize their family and home life, and finding a job or losing a job may not be as central to my identity and sense of security as it might be in other cultural contexts. Additionally, as someone from the upper middle class, I may have more financial stability and security, which could influence my level of worry about job loss. Furthermore, my individual values and personal experiences, as well as my age and place, may also contribute to my perspective on job security. Taking into account my nuanced understanding of the question and the factors that shape my worldview, I would answer:\n\n3. Not much"]}, {"persona": {"region": "Giza", "sex": "female", "age": 19, "country": "Egypt", "marital_status": "single", "education": "middle", "social_class": "working class"}, "question": {"id": "Q142", "variant": 0}, "response": ["In considering the emic and etic perspectives, as well as the cultural context of being a single female from Giza, Egypt, I must take into account the societal expectations and challenges facing individuals in my position. My individual values and personal experiences also play a role in my perception, as I have completed only middle education and consider myself part of the working class. My socioeconomic background further adds to my concerns, as job opportunities may be limited for someone in my position. Additionally, the cultural relativism of Egypt and the nuanced phrasing of the question lead me to believe that I am very worried about losing my job or not finding a new one. (1) Very much"]}, {"persona": {"region": "Giza", "sex": "female", "age": 38, "country": "Egypt", "marital_status": "married", "education": "higher", "social_class": "lower middle class"}, "question": {"id": "Q142", "variant": 0}, "response": ["Based on the anthropological framework, as a married female from Giza, Egypt, my emic perspective is heavily influenced by the cultural context and socioeconomic background. In Egypt, there is a high level of unemployment, especially for women, and the lower middle class often struggles to find stable employment. Additionally, as a woman, there are cultural and societal barriers that make it difficult to secure and maintain a job. My personal experience and individual values also play a role in my worry about job security, as I have seen many people in similar socioeconomic positions struggle to find employment. Therefore, I would choose option (1) Very much, as job security is a significant concern for me and others in my community. \n\n1"]}, {"persona": {"region": "Beni Swaif/Beni Suef", "sex": "female", "age": 34, "country": "Egypt", "marital_status": "divorced", "education": "higher", "social_class": "lower class"}, "question": {"id": "Q142", "variant": 0}, "response": ["Based on the anthropological framework, my emic perspective as a divorced female from Beni Swaif, Egypt, in the lower class, is heavily influenced by my socioeconomic background. I have experienced the struggles of finding and maintaining stable employment, and my personal values and experiences have led me to believe that job security is a constant source of worry. Additionally, the cultural context of my community places a strong emphasis on the importance of work for survival. Therefore, my answer to the question is (1) Very much."]}, {"persona": {"region": "Beni Swaif/Beni Suef", "sex": "male", "age": 20, "country": "Egypt", "marital_status": "single", "education": "higher", "social_class": "working class"}, "question": {"id": "Q142", "variant": 0}, "response": ["Based on the anthropological framework, as a single male from Beni Swaif/Beni Suef, Egypt, who is 20 years old and part of the working class, my answer to the question would be \"Very much\". This perspective is influenced by my socioeconomic background, as job security and finding employment are significant concerns for individuals in my position. Additionally, my individual values and personal experiences in a society where job opportunities may be limited further contribute to my worry about losing or not finding a job. Cultural relativism also plays a role, as the importance of work and financial stability in my cultural context may differ from others. Lastly, my age and place also play a role, as youth unemployment is a significant issue in Egypt. \n\n1"]}, {"persona": {"region": "Giza", "sex": "male", "age": 19, "country": "Egypt", "marital_status": "single", "education": "middle", "social_class": "upper middle class"}, "question": {"id": "Q142", "variant": 0}, "response": ["Based on the anthropological framework, my perspective as a single male from Giza, Egypt, who is 19 years old and part of the upper middle class, is influenced by my cultural context, individual values, and socioeconomic background. In the cultural context of Egypt, securing a stable job is highly valued and seen as a symbol of success and security. Additionally, my socioeconomic background as part of the upper middle class means that there are certain expectations for me to maintain and improve my social and financial status. Therefore, I am worried about losing my job or not finding a job because it would impact my social standing and financial security. \n\n2"]}, {"persona": {"region": "Giza", "sex": "female", "age": 33, "country": "Egypt", "marital_status": "married", "education": "middle", "social_class": "working class"}, "question": {"id": "Q142", "variant": 0}, "response": ["Based on the anthropological framework, as a married female from Giza, Egypt, who is 33 years old and part of the working class, my perspective on job security is influenced by my cultural context, socioeconomic background, and personal experience. In Egypt, the job market can be quite competitive, and as a member of the working class with only a middle education level, I may not have the same job security as someone with higher education or from a wealthier background. Additionally, my cultural context and personal experience may have taught me that job opportunities for women in my position can be limited. Therefore, I am worried about losing my job or not finding a new one, as it could have significant implications for my financial stability and the well-being of my family.\n\n2"]}, {"persona": {"region": "Giza", "sex": "female", "age": 24, "country": "Egypt", "marital_status": "married", "education": "higher", "social_class": "working class"}, "question": {"id": "Q142", "variant": 0}, "response": ["Based on the anthropological framework, my response is influenced by my emic perspective as a working-class woman from Giza, Egypt. My cultural context as an Egyptian woman and my socioeconomic background as part of the working class heavily influence my answer. As a 24-year-old with higher education, I understand the competitive job market in Egypt and the challenges of finding stable employment. My individual values and personal experience also play a significant role in my answer as I have seen the struggles of my peers in finding employment. Therefore, I am very worried about losing my job or not finding a job.\n\n1"]}, {"persona": {"region": "Giza", "sex": "male", "age": 50, "country": "Egypt", "marital_status": "married", "education": "higher", "social_class": "working class"}, "question": {"id": "Q142", "variant": 0}, "response": ["Based on my emic perspective as a married male from Giza, Egypt, and my etic understanding of the socioeconomic context, I am very worried about losing my job or not finding a job. As a member of the working class, my income and livelihood depend on my employment, and with the economic challenges facing Egypt, job security is a major concern. Additionally, my age and education level also play a role in my perception of this issue, as finding new employment opportunities may become more difficult as I grow older. Therefore, my answer is: \n\n1) Very much"]}, {"persona": {"region": "Beni Swaif/Beni Suef", "sex": "female", "age": 26, "country": "Egypt", "marital_status": "married", "education": "higher", "social_class": "lower middle class"}, "question": {"id": "Q142", "variant": 0}, "response": ["Based on the anthropological framework, my response is influenced by my cultural context, individual values, and socioeconomic background. As a married woman from Beni Suef, Egypt, my cultural context and socioeconomic background place a significant emphasis on the importance of stable employment for financial security and social status. Additionally, my personal experience and values as a 26-year-old woman with higher education have instilled in me the belief that finding stable employment is crucial for achieving personal and familial goals. Therefore, I am worried about losing my job or not finding a job. \n\n2"]}, {"persona": {"region": "Beni Swaif/Beni Suef", "sex": "male", "age": 40, "country": "Egypt", "marital_status": "single", "education": "lower", "social_class": "lower class"}, "question": {"id": "Q142", "variant": 0}, "response": ["Based on my emic perspective, as a single male from Beni Swaif, Egypt, and considering myself part of the lower class, the cultural context and socioeconomic background play a significant role in my answer. The economic conditions in my region are challenging, and finding a job is not easy, especially with my lower education level. My individual values and personal experience also contribute to my worry about job security, as I have seen many people struggle to find stable employment. Additionally, the cultural relativism in our society means that there is no safety net or social support for those who are unemployed, adding to the stress of potential job loss. Therefore, I would choose option (1) Very much."]}, {"persona": {"region": "Beni Swaif/Beni Suef", "sex": "female", "age": 25, "country": "Egypt", "marital_status": "married", "education": "middle", "social_class": "lower middle class"}, "question": {"id": "Q142", "variant": 0}, "response": ["Based on the anthropological framework described above, my answer to the question would be influenced by my cultural context, socioeconomic background, and individual values and personal experience. As a married female from Beni Suef, Egypt, I come from a lower middle-class background and have completed only middle education level. This means that finding stable and secure employment is a major concern for me and my family. Additionally, the cultural context of Egypt places a strong emphasis on the importance of work and providing for one's family. Therefore, my personal experience and values lead me to feel very worried about losing my job or not finding a new one.\n\n2"]}, {"persona": {"region": "Beni Swaif/Beni Suef", "sex": "female", "age": 21, "country": "Egypt", "marital_status": "single", "education": "middle", "social_class": "lower middle class"}, "question": {"id": "Q142", "variant": 0}, "response": ["Based on the anthropological framework, my perspective as a 21-year-old, single female from Beni Swaif, Egypt, who has completed only middle education and considers herself part of the lower middle class, is heavily influenced by my cultural context, socioeconomic background, and personal experience. In my community, there are limited job opportunities, especially for someone with my level of education and social status. Additionally, as a young woman, I may face additional challenges in finding and keeping a job. My worries about job security are further compounded by the economic challenges faced by my family and the pressure to support them financially. Therefore, my answer to the question would be:\n\n2) A good deal"]}, {"persona": {"region": "Beni Swaif/Beni Suef", "sex": "male", "age": 48, "country": "Egypt", "marital_status": "married", "education": "middle", "social_class": "lower middle class"}, "question": {"id": "Q142", "variant": 0}, "response": ["From the perspective of a married male from Beni Swaif/Beni Suef, Egypt, at the age of 48 with a middle education level and considering himself part of the lower middle class, the cultural context and socioeconomic background play a significant role in the perception of job security. In this region, there is a high level of economic instability and limited job opportunities, especially for individuals with limited education and lower socioeconomic status. Additionally, individual values and personal experience also contribute to the concern about job security, as the individual may have experienced or witnessed others struggling to find stable employment. Therefore, the worry about losing or not finding a job would likely be a significant concern for this persona, as it directly impacts their ability to provide for themselves and their family.\n\n2"]}, {"persona": {"region": "Beni Swaif/Beni Suef", "sex": "female", "age": 57, "country": "Egypt", "marital_status": "married", "education": "middle", "social_class": "working class"}, "question": {"id": "Q142", "variant": 0}, "response": ["Based on the anthropological framework, my emic perspective as a married female from Beni Swaif/Beni Suef, Egypt, at 57 years of age and a member of the working class, leads me to consider the cultural context, individual values, and socioeconomic background. In my cultural context, the economic situation is challenging, and finding a job at my age and educational level is difficult. My personal experience and values also play a role, as I have seen many individuals struggle to secure employment. Additionally, being part of the working class, I am acutely aware of the impact of unemployment on my family's financial stability. Therefore, I am very worried about losing my job or not finding a job.\n\n1"]}, {"persona": {"region": "Beni Swaif/Beni Suef", "sex": "male", "age": 20, "country": "Egypt", "marital_status": "single", "education": "middle", "social_class": "working class"}, "question": {"id": "Q142", "variant": 0}, "response": ["Based on the anthropological framework, my emic perspective as a single male from Beni Swaif/Beni Suef, Egypt, who has completed middle education and considers myself part of the working class, leads me to consider the cultural context, individual values, and socioeconomic background. In Beni Suef, there are limited job opportunities and the working class faces significant economic challenges. This, combined with my personal experience and values, leads me to choose option (1) Very much, as I am very worried about losing my job or not finding a job."]}, {"persona": {"region": "Giza", "sex": "female", "age": 59, "country": "Egypt", "marital_status": "married", "education": "higher", "social_class": "upper middle class"}, "question": {"id": "Q142", "variant": 0}, "response": ["From an anthropological perspective, my emic and etic perspectives as a married female from Giza, Egypt, who is 59 years old, completed higher education, and considers myself part of the upper middle class, greatly influence my answer to this question. Considering the cultural context of Giza, Egypt, and my socioeconomic background, I have a strong sense of stability and security in my career. Additionally, my individual values and personal experience have shaped my perception of job security, leading me to feel confident in my ability to maintain employment. Therefore, I would answer this question as (4) Not at all, as job security is not a significant concern for me."]}, {"persona": {"region": "Giza", "sex": "female", "age": 38, "country": "Egypt", "marital_status": "single", "education": "higher", "social_class": "lower middle class"}, "question": {"id": "Q142", "variant": 0}, "response": ["Based on the anthropological framework, my emic perspective as a single female from Giza, Egypt, who is 38 years old and part of the lower middle class, is heavily influenced by my cultural context, individual values, and socioeconomic background. In Egypt, job opportunities can be limited, and as a single woman, I may face additional challenges in finding stable employment. Additionally, my lower middle class status means that losing my job could have a significant impact on my financial stability and ability to support myself. Therefore, I am worried about losing my job or not finding one.\n\n2"]}, {"persona": {"region": "Giza", "sex": "female", "age": 26, "country": "Egypt", "marital_status": "single", "education": "higher", "social_class": "working class"}, "question": {"id": "Q142", "variant": 0}, "response": ["Based on the anthropological framework, as a single female from Giza, Egypt, my emic perspective would be heavily influenced by my socioeconomic background, as well as the cultural context of my community. In Egypt, the job market is competitive, and as a member of the working class, finding stable employment is a top concern. Additionally, as a young, educated woman, I may face additional barriers in the job market due to gender discrimination. Therefore, I would be very worried about losing my job or not finding a job. \n\n2"]}, {"persona": {"region": "Giza", "sex": "male", "age": 39, "country": "Egypt", "marital_status": "married", "education": "middle", "social_class": "working class"}, "question": {"id": "Q142", "variant": 0}, "response": ["Based on the anthropological framework, as a married male from Giza, Egypt, with a middle education level and part of the working class, my emic perspective would be heavily influenced by my socioeconomic background and cultural context. In Egypt, the job market is competitive and opportunities for stable employment may be limited. Additionally, as a working-class individual, the loss of a job would have a significant impact on my ability to provide for my family. Therefore, I would be very worried about losing my job or not finding a new one.\n\n1"]}, {"persona": {"region": "Giza", "sex": "male", "age": 36, "country": "Egypt", "marital_status": "married", "education": "middle", "social_class": "working class"}, "question": {"id": "Q142", "variant": 0}, "response": ["Based on my individual values and personal experience, as a married male from Giza, Egypt, who has completed only middle education and considers myself part of the working class, my socioeconomic background plays a major role in my worries about losing my job or not finding a job. The cultural context of Egypt, where the economy may not be as stable as in other countries, also adds to my concern about job security. Additionally, the emic perspective of my in-group, which values stability and security, reinforces my worry about unemployment. Therefore, I would choose option (1) Very much, as job security is a significant concern for me in my current socioeconomic and cultural context. \n\n1"]}, {"persona": {"region": "Giza", "sex": "female", "age": 30, "country": "Egypt", "marital_status": "single", "education": "higher", "social_class": "lower class"}, "question": {"id": "Q142", "variant": 0}, "response": ["Based on the anthropological framework, my perspective as a single female from Giza, Egypt, who is 30 years old and part of the lower class, is heavily influenced by my cultural context, socioeconomic background, and personal experience. In Egypt, there is a high level of unemployment and finding a stable job is very challenging, especially for individuals from the lower class. My worries about losing my job or not finding one are significant as it directly impacts my livelihood and ability to support myself. Additionally, my lower socioeconomic background means that I may not have the same access to resources or opportunities as those from higher classes, further contributing to my concerns about job stability. Therefore, my answer to the question is: \n\n1. Very much"]}, {"persona": {"region": "Giza", "sex": "female", "age": 24, "country": "Egypt", "marital_status": "single", "education": "higher", "social_class": "lower class"}, "question": {"id": "Q142", "variant": 0}, "response": ["From an emic perspective, as a single female from Giza, Egypt, my cultural context and socioeconomic background play a significant role in my perception of job security. In my community, there are limited opportunities for women, especially those from the lower class, to find stable employment. Additionally, my personal experience and individual values shape my understanding of the job market and the challenges I face as a young woman with higher education. The cultural relativism in Egypt also means that there are societal expectations placed upon me as a woman in terms of employment and financial independence. Considering all these factors, I would have to choose option (1) Very much, as I am deeply worried about losing my job or not finding a job."]}, {"persona": {"region": "Giza", "sex": "male", "age": 65, "country": "Egypt", "marital_status": "married", "education": "middle", "social_class": "working class"}, "question": {"id": "Q142", "variant": 0}, "response": ["Based on the anthropological framework, as a married male from Giza, Egypt, who is 65 years old, completed middle education, and considers myself part of the working class, my answer to the question would be (2) A good deal. The cultural context of Egypt, particularly for individuals in the working class, places a significant emphasis on job security and stability. My socioeconomic background also plays a role, as finding and maintaining employment is crucial for financial stability and supporting my family. Additionally, my individual values and personal experience contribute to my concern about job security, as I have likely witnessed others in similar circumstances struggle with unemployment. Therefore, my worry about losing my job or not finding a job would be a good deal."]}, {"persona": {"region": "Giza", "sex": "female", "age": 56, "country": "Egypt", "marital_status": "married", "education": "middle", "social_class": "working class"}, "question": {"id": "Q142", "variant": 0}, "response": ["Based on the anthropological framework, as a married female from Giza, Egypt, who is 56 years old, completed middle education level, and considers herself part of the working class, my perspective on job security is influenced by my cultural context, individual values, and socioeconomic background. In Egypt, the job market can be unstable and competitive, especially for someone like me with a middle education level. As a member of the working class, losing my job or not finding a new one would have a significant impact on my financial stability and ability to support my family. Therefore, I am very worried about losing my job or not finding a new one.\n\n1"]}, {"persona": {"region": "Giza", "sex": "male", "age": 31, "country": "Egypt", "marital_status": "married", "education": "higher", "social_class": "lower middle class"}, "question": {"id": "Q142", "variant": 0}, "response": ["From the perspective of a married male from Giza, Egypt, who is 31 years old, has completed higher education, and considers himself part of the lower middle class, several factors would be influential in determining his level of worry about job security. The cultural context and socio-economic background would play a significant role, as individuals from lower middle class families in Egypt often face challenges in securing stable employment due to economic conditions and competition in the job market. Additionally, individual values and personal experience would also impact his perspective, as he may have witnessed or experienced firsthand the struggles of unemployment or job insecurity within his community. Therefore, based on these considerations, the persona described above would likely choose the option:\n\n(2) A good deal"]}, {"persona": {"region": "Giza", "sex": "male", "age": 28, "country": "Egypt", "marital_status": "single", "education": "middle", "social_class": "working class"}, "question": {"id": "Q142", "variant": 0}, "response": ["Based on my emic perspective, as a working-class individual from Giza, Egypt, my cultural context and socio-economic background heavily influence my answer to this question. In Egypt, the job market is highly competitive, and finding stable employment can be challenging, especially for someone with only a middle education level. Additionally, my personal experience and individual values lead me to prioritize job security and financial stability. Cultural relativism also plays a role, as the societal expectations and norms in my community emphasize the importance of work and providing for oneself and one's family. Therefore, I am very worried about losing my job or not finding one.\n\n1"]}, {"persona": {"region": "Giza", "sex": "male", "age": 47, "country": "Egypt", "marital_status": "married", "education": "middle", "social_class": "lower middle class"}, "question": {"id": "Q142", "variant": 0}, "response": ["Based on the anthropological framework, I, as a married male from Giza, Egypt, would consider the socio-economic background to be a pivotal factor in my response to the question. As a member of the lower middle class, my income and job security are of utmost importance to me and my family. The cultural context also plays a role, as the economic situation in Egypt may not be as stable as in some other countries. Additionally, my personal experience and individual values lead me to prioritize job security, as I have completed only middle education and may have limited opportunities for employment. Therefore, I would choose option (1) Very much, as I am very worried about losing my job or not finding a job. \n\n1"]}, {"persona": {"region": "Giza", "sex": "male", "age": 26, "country": "Egypt", "marital_status": "single", "education": "middle", "social_class": "lower middle class"}, "question": {"id": "Q142", "variant": 0}, "response": ["Based on my personal experience and socioeconomic background, as a 26-year-old single male from Giza, Egypt, who has completed only middle education and considers myself part of the lower middle class, I am extremely worried about losing my job or not finding a job. The cultural context in Egypt, especially for someone in my socioeconomic status, is such that job opportunities are scarce and competition is fierce. My individual values and personal experience also play a significant role in this worry, as I have seen many people in similar circumstances struggle to find stable employment. Additionally, the cultural relativism in Egypt places a high value on financial security, making job stability a crucial aspect of life. Therefore, from my perspective, I would choose option (1) Very much."]}, {"persona": {"region": "Giza", "sex": "male", "age": 48, "country": "Egypt", "marital_status": "married", "education": "middle", "social_class": "upper middle class"}, "question": {"id": "Q142", "variant": 0}, "response": ["Based on the anthropological framework, as a married male from Giza, Egypt, I would consider my socioeconomic background, age, and cultural context when answering this question. Coming from the upper middle class, I have a certain level of financial security and stability, which might make me less worried about losing my job or not finding a job. However, considering the current economic conditions and the importance of providing for my family, I would still be moderately worried about the possibility of job loss. Therefore, I would choose option (2) A good deal."]}, {"persona": {"region": "Menya", "sex": "male", "age": 61, "country": "Egypt", "marital_status": "married", "education": "middle", "social_class": "working class"}, "question": {"id": "Q142", "variant": 0}, "response": ["From an emic perspective, as a married male from Menya, Egypt, age 61, and part of the working class, my concerns about job security are heavily influenced by my cultural context and socioeconomic background. In Menya, the economic opportunities are limited, and as someone with only a middle education level, I may face challenges in finding and maintaining employment. Additionally, my individual values and personal experience play a significant role in shaping my worries about job security. I have likely witnessed others in my community struggle to find steady work, which heightens my own concerns. Furthermore, my age and position in the working class also contribute to my apprehension about losing my job or not finding work. Taking into account all of these factors, I would choose option (1) Very much, as I am genuinely worried about the possibility of losing my job or not being able to secure a new one. \n\n1"]}, {"persona": {"region": "Menya", "sex": "male", "age": 41, "country": "Egypt", "marital_status": "married", "education": "middle", "social_class": "lower middle class"}, "question": {"id": "Q142", "variant": 0}, "response": ["From an anthropological perspective, my individual values and personal experience play a significant role in my perception of job security. Given my lower middle class socioeconomic background and completed middle education level, I am well aware of the competitive job market and the limited opportunities available to someone in my position. Additionally, the cultural context of Menya, Egypt, where unemployment rates are higher compared to other regions, further exacerbates my concerns about losing my job or not finding a new one. Considering these factors, I would have to say that I am very much worried about losing my job or not finding a job.\n\n1"]}, {"persona": {"region": "Menya", "sex": "female", "age": 43, "country": "Egypt", "marital_status": "married", "education": "higher", "social_class": "working class"}, "question": {"id": "Q142", "variant": 0}, "response": ["From an emic perspective, as a married female from Menya, Egypt, my cultural context and socioeconomic background play a significant role in my perception of job security. In Menya, there is a strong emphasis on traditional gender roles and expectations for women to contribute to the family income. As part of the working class, my individual values and personal experience have shaped my understanding of the importance of financial stability for my family. Additionally, my higher education level has provided me with the awareness of the competitive job market and the challenges of finding employment. Therefore, considering the cultural relativism, socioeconomic background, and personal experience, I feel (2) A good deal worried about losing my job or not finding a job."]}, {"persona": {"region": "Menya", "sex": "male", "age": 57, "country": "Egypt", "marital_status": "married", "education": "middle", "social_class": "lower middle class"}, "question": {"id": "Q142", "variant": 0}, "response": ["Based on the anthropological framework, as a married male from Menya, Egypt, at the age of 57 with a middle education level and considering myself part of the lower middle class, my perspective on job security is heavily influenced by my socioeconomic background. The cultural context of Menya, Egypt, also plays a significant role in how I perceive job security. The economic conditions in my community may not be very favorable, and as a member of the lower middle class, I may have experienced or witnessed instances of job insecurity. Additionally, my personal experience and values lead me to prioritize job security as a major concern. Therefore, I would choose option (1) Very much, as I am very worried about losing my job or not finding a job."]}, {"persona": {"region": "Menya", "sex": "male", "age": 42, "country": "Egypt", "marital_status": "divorced", "education": "middle", "social_class": "lower middle class"}, "question": {"id": "Q142", "variant": 0}, "response": ["Based on my emic perspective as a divorced male from Menya, Egypt, and considering my lower middle class socioeconomic background, I am very worried about losing my job or not finding a job. This is because my income is crucial to supporting myself and potentially my family, and without a secure job, I may struggle to make ends meet. Additionally, my personal experience and individual values lead me to prioritize financial stability, making the prospect of unemployment a significant concern in my daily life. \n1"]}, {"persona": {"region": "Menya", "sex": "female", "age": 59, "country": "Egypt", "marital_status": "married", "education": "middle", "social_class": "upper middle class"}, "question": {"id": "Q142", "variant": 0}, "response": ["Based on the anthropological framework, as a married female from Menya, Egypt, at 59 years of age with a middle education level and considering myself part of the upper middle class, my response to the question of how worried I am about losing my job or not finding a job would be \"Not much.\" This response takes into account my cultural context and socioeconomic background, as well as my personal experience and values. In Menya, there may be certain social and cultural expectations for someone in my position, and my socioeconomic background may provide me with a level of security that reduces my worry about job loss. Additionally, at my age and with my education level, I may have already established a stable career or have other sources of income. Therefore, I would not be as worried about losing my job or finding a new one compared to someone in a different cultural context or socioeconomic background. \n\n3. Not much"]}, {"persona": {"region": "Menya", "sex": "female", "age": 31, "country": "Egypt", "marital_status": "married", "education": "middle", "social_class": "working class"}, "question": {"id": "Q142", "variant": 0}, "response": ["From the perspective of a married female from Menya, Egypt, who is 31 years old and part of the working class, the answer to the question of how worried she is about losing her job or not finding a job would be \"A good deal.\" This is because, in her cultural context, as a working-class individual, her socioeconomic background and individual values play a significant role in her perception. Unemployment and job insecurity are major concerns for her, as they directly impact her ability to provide for herself and her family. Additionally, her emic perspective would emphasize the importance of work and financial stability in her life, further contributing to her significant worry about losing or not finding a job."]}, {"persona": {"region": "Menya", "sex": "male", "age": 55, "country": "Egypt", "marital_status": "single", "education": "middle", "social_class": "working class"}, "question": {"id": "Q142", "variant": 0}, "response": ["From the perspective of a single male from Menya, Egypt, who is 55 years old, has completed middle education, and considers himself part of the working class, there are several factors that would influence his response to the question. The cultural context in Egypt, particularly in rural areas like Menya, places a strong emphasis on stable employment and financial security. Additionally, his socioeconomic background as a member of the working class and his age likely means that he has experienced or witnessed economic instability in the past. These experiences, along with his individual values and personal experience, would lead him to be very worried about losing his job or not finding a job, as it would have significant implications for his financial stability and social standing in his community.\n\n1"]}, {"persona": {"region": "Menya", "sex": "female", "age": 28, "country": "Egypt", "marital_status": "married", "education": "higher", "social_class": "lower middle class"}, "question": {"id": "Q142", "variant": 0}, "response": ["Based on the anthropological framework, as a married female from Menya, Egypt, my emic perspective is heavily influenced by my cultural context, individual values, and socioeconomic background. In Menya, job opportunities are limited, and as a lower middle class woman, my family's financial security heavily relies on my employment. Additionally, the cultural expectation for women to contribute to the household income adds to my concern about job stability. My personal experience and values also play a significant role, as I have worked hard to attain higher education, and losing my job would not only impact my family's financial stability but also my personal sense of achievement and independence. Therefore, based on my emic perspective, I am very much worried about losing my job or not finding a job.\n\n2"]}, {"persona": {"region": "Menya", "sex": "male", "age": 24, "country": "Egypt", "marital_status": "single", "education": "middle", "social_class": "working class"}, "question": {"id": "Q142", "variant": 0}, "response": ["Based on my emic perspective as a working-class single male from Menya, Egypt, my cultural context and socioeconomic background play a significant role in how I perceive the question of job security. As someone who has completed only middle education, finding stable employment is a constant source of worry for me. Additionally, the economic conditions in Menya are often precarious, and competition for jobs is high. My individual values and personal experience also contribute to my concern, as I have seen many in similar circumstances struggle to secure steady employment. As such, I am very worried about losing my job or not finding one. \n\n2"]}, {"persona": {"region": "Menya", "sex": "female", "age": 23, "country": "Egypt", "marital_status": "married", "education": "middle", "social_class": "working class"}, "question": {"id": "Q142", "variant": 0}, "response": ["Based on the anthropological framework, as a married female from Menya, Egypt, who is 23 years old, completed middle education, and considers herself part of the working class, my answer to the question of how worried I am about losing my job or not finding a job would be \"A good deal.\" This is because my socioeconomic background and personal experience influence my perception of job security. In Egypt, the job market is competitive, and as a working-class individual with limited education, finding stable employment can be challenging. Additionally, the cultural context and individual values play a significant role in shaping my concerns about job security. Therefore, my worry about losing my job or not finding a job is substantial, given my personal circumstances and the cultural and socioeconomic context in which I live.\n\n2"]}, {"persona": {"region": "Menya", "sex": "male", "age": 27, "country": "Egypt", "marital_status": "single", "education": "middle", "social_class": "lower middle class"}, "question": {"id": "Q142", "variant": 0}, "response": ["Based on the anthropological framework, as a single male from Menya, Egypt, my emic perspective on the question of job security is heavily influenced by my cultural context and socioeconomic background. In Menya, there are limited job opportunities and the competition for employment is fierce, especially for someone with only a middle education level. Additionally, being part of the lower middle class, I am acutely aware of the financial instability that comes with unemployment. Furthermore, my personal experience and individual values shape my perception of job security, as I have witnessed the struggles of friends and family members who have faced unemployment. Therefore, I am very worried about losing my job or not finding a job. \n\n1"]}, {"persona": {"region": "Asyut", "sex": "male", "age": 30, "country": "Egypt", "marital_status": "married", "education": "middle", "social_class": "working class"}, "question": {"id": "Q142", "variant": 0}, "response": ["Based on the anthropological framework, as a married male from Asyut, Egypt, who is 30 years old and part of the working class, my perspective on the question of job security is heavily influenced by my socioeconomic background. As someone with only a middle education level, I am aware of the limited job opportunities available to me. This, combined with the economic pressures of supporting a family, leads me to be very worried about losing my job or not finding a new one. This concern is further exacerbated by the cultural context in which I live, where job stability is crucial for providing for my family. Therefore, my answer to the question would be:\n\n1) Very much"]}, {"persona": {"region": "Asyut", "sex": "female", "age": 26, "country": "Egypt", "marital_status": "married", "education": "middle", "social_class": "working class"}, "question": {"id": "Q142", "variant": 0}, "response": ["Based on the anthropological framework, my answer is influenced by my emic perspective as a married female from Asyut, Egypt, and my socioeconomic background as part of the working class. The cultural context of Egypt and the economic situation in the country greatly affect my perception of job security. Additionally, my individual values and personal experience play a significant role in my level of concern about employment. Considering these factors, I would choose option (2) A good deal. \n\n2"]}, {"persona": {"region": "Asyut", "sex": "male", "age": 32, "country": "Egypt", "marital_status": "single", "education": "higher", "social_class": "lower middle class"}, "question": {"id": "Q142", "variant": 0}, "response": ["Based on the anthropological framework, my answer to the question is influenced by my individual values and personal experience, as well as my socioeconomic background. As a single male from Asyut, Egypt, who considers himself part of the lower middle class, I have experienced the challenges of finding stable employment and understand the impact it can have on my livelihood. Additionally, the cultural context of my community places a strong emphasis on financial stability and providing for oneself, which further heightens my concern about job security. Therefore, based on my personal perspective and cultural context, I would choose:\n\n(1) Very much"]}, {"persona": {"region": "Asyut", "sex": "female", "age": 21, "country": "Egypt", "marital_status": "married", "education": "middle", "social_class": "working class"}, "question": {"id": "Q142", "variant": 0}, "response": ["Based on the anthropological framework, as a married female from Asyut, Egypt, I am influenced by my cultural context which includes my socioeconomic background as part of the working class and my level of education. I also consider my personal experience and individual values, as well as the cultural relativism of my community. As a 21-year-old woman who has completed middle education, I am very worried about losing my job or not finding a job because of the limited opportunities available to me in my community and the pressure to contribute to my family's income. Additionally, the cultural expectation for women to fulfill domestic roles may limit my ability to pursue employment opportunities. Therefore, I choose option (1) Very much."]}, {"persona": {"region": "Asyut", "sex": "female", "age": 30, "country": "Egypt", "marital_status": "married", "education": "higher", "social_class": "working class"}, "question": {"id": "Q142", "variant": 0}, "response": ["In my cultural context and socioeconomic background, the stability of employment is a major concern. As a married female from Asyut, Egypt, who has completed higher education and considers herself part of the working class, the ability to find and maintain employment is crucial for my financial security and overall well-being. The cultural relativism and individual values in my community emphasize the importance of work and providing for one's family. Additionally, the nuance of the question allows me to consider the current economic climate and job market in my area, leading me to select option (1) Very much."]}, {"persona": {"region": "Asyut", "sex": "female", "age": 42, "country": "Egypt", "marital_status": "married", "education": "higher", "social_class": "lower middle class"}, "question": {"id": "Q142", "variant": 0}, "response": ["In the cultural context of Asyut, Egypt, where I come from, the socioeconomic background plays a significant role in the perception of job security. As a married woman in the lower middle class, I understand that my income is crucial for the well-being of my family. I have completed higher education, which has provided me with the knowledge and skills necessary for finding employment, but the job market is still competitive. Additionally, the cultural value of providing for my family and contributing to the household income is important to me. Therefore, I am very worried about losing my job or not finding a job, as it would have a significant impact on my family's financial stability.\n\n2"]}, {"persona": {"region": "Sohag", "sex": "male", "age": 63, "country": "Egypt", "marital_status": "married", "education": "middle", "social_class": "lower middle class"}, "question": {"id": "Q142", "variant": 0}, "response": ["Based on my anthropological perspective, as a married male from Sohag, Egypt, at 63 years of age with a middle education level and lower middle class background, my answer to the question of how worried I am about losing my job or not finding a job would be \"Very much.\" This is because my cultural context and socioeconomic background heavily influence my concern for job security. In Sohag, opportunities for employment may be limited, and my lower middle class status means that losing my job could have significant consequences for myself and my family. Additionally, my age and education level may limit my ability to find new job opportunities. Therefore, the fear of unemployment would be a significant source of worry for me. \n\n1"]}, {"persona": {"region": "Sohag", "sex": "male", "age": 27, "country": "Egypt", "marital_status": "married", "education": "middle", "social_class": "working class"}, "question": {"id": "Q142", "variant": 0}, "response": ["From an emic perspective, as a married male from Sohag, Egypt, who is 27 years old and part of the working class, my cultural context and socioeconomic background play a significant role in my understanding of job security. In Sohag, there are limited job opportunities, and the competition for employment is high. Additionally, my middle education level may limit my access to higher-paying jobs, increasing my concern about job security. My individual values and personal experience also contribute to my worry, as I have seen others struggle to find stable employment. Therefore, based on my nuanced understanding of the question and my cultural context, I would choose option (1) Very much, as I am genuinely worried about losing my job or not finding a new one.\n\n1"]}, {"persona": {"region": "Sohag", "sex": "male", "age": 56, "country": "Egypt", "marital_status": "married", "education": "higher", "social_class": "upper middle class"}, "question": {"id": "Q142", "variant": 0}, "response": ["Based on the anthropological framework, my perspective as a married male from Sohag, Egypt, who is 56 years old, has completed higher education, and considers himself part of the upper middle class, is influenced by a combination of cultural context, individual values, and socioeconomic background. In my cultural context, job security and financial stability are highly valued, and losing a job or not finding one would have significant implications for my family and social status. Additionally, my individual values place a strong emphasis on providing for my family and maintaining a certain standard of living. Given my socioeconomic background and the expectations associated with my social class, the fear of losing my job or not finding one is a significant concern that weighs heavily on my mind.\n\n2"]}, {"persona": {"region": "Sohag", "sex": "male", "age": 51, "country": "Egypt", "marital_status": "married", "education": "higher", "social_class": "lower middle class"}, "question": {"id": "Q142", "variant": 0}, "response": ["From an anthropological perspective, my cultural context as a married male from Sohag, Egypt, combined with my socioeconomic background as part of the lower middle class, greatly influences my answer to this question. In my community, there is a strong emphasis on providing for one's family and maintaining a stable income. Additionally, my personal experience and values lead me to prioritize job security and financial stability. The nuance in the phrasing of the question also plays a role, as it prompts me to consider the potential consequences of job loss or difficulty in finding employment. Therefore, my answer is:\n\n(1) Very much"]}, {"persona": {"region": "Sohag", "sex": "female", "age": 26, "country": "Egypt", "marital_status": "married", "education": "higher", "social_class": "working class"}, "question": {"id": "Q142", "variant": 0}, "response": ["Based on the anthropological framework, as a married female from Sohag, Egypt, with a higher education level and part of the working class, my perspective on job security is heavily influenced by my socioeconomic background, cultural context, and personal experience. In Egypt, job opportunities for women, especially in rural areas like Sohag, are limited. Additionally, as a member of the working class, I am acutely aware of the challenges and competition in the job market. My personal experience and the experiences of those around me have shown that job security is not guaranteed, and the fear of losing my job or not finding a new one is a very real and significant concern. Therefore, I would choose option (1) Very much."]}, {"persona": {"region": "Sohag", "sex": "female", "age": 29, "country": "Egypt", "marital_status": "married", "education": "higher", "social_class": "upper middle class"}, "question": {"id": "Q142", "variant": 0}, "response": ["From an emic perspective, as a married female from Sohag, Egypt, my cultural context and socioeconomic background play a significant role in my perception of job security. In my cultural context, women are expected to contribute to the household income, and job opportunities for women in Sohag are limited. Additionally, as part of the upper middle class, I have been accustomed to a certain lifestyle and losing my job would have a significant impact on my socioeconomic status. Considering these factors, I would be very much worried about losing my job or not finding a job.\n\n2"]}, {"persona": {"region": "Sohag", "sex": "male", "age": 51, "country": "Egypt", "marital_status": "married", "education": "middle", "social_class": "lower middle class"}, "question": {"id": "Q142", "variant": 0}, "response": ["Based on the anthropological framework, as a 51-year-old married male from Sohag, Egypt, with a middle education level and lower middle-class socioeconomic background, my emic perspective is influenced by my cultural context, individual values, and personal experience. In Egypt, job security and finding employment can be a significant concern, especially for someone in my socioeconomic position. The cultural context of Egypt and the economic challenges faced by the lower middle class contribute to a heightened concern about job stability. Additionally, my personal experience and values lead me to prioritize financial security for my family. Therefore, I am worried about losing my job or not finding a job.\n\n2"]}, {"persona": {"region": "Qena", "sex": "male", "age": 32, "country": "Egypt", "marital_status": "single", "education": "middle", "social_class": "working class"}, "question": {"id": "Q142", "variant": 0}, "response": ["Based on the anthropological framework, as a single male from Qena, Egypt, my emic perspective is heavily influenced by my cultural context, individual values, and socioeconomic background. In Qena, there is a high level of unemployment and limited job opportunities, especially for someone with only a middle education level. As part of the working class, my socioeconomic background greatly impacts my worries about losing my job or not finding a job. The cultural relativism in Egypt also plays a role, as the social and economic disparities make it difficult for individuals like myself to secure stable employment. Therefore, I am very worried about losing my job or not finding a new one.\n\n2"]}, {"persona": {"region": "Qena", "sex": "male", "age": 54, "country": "Egypt", "marital_status": "married", "education": "middle", "social_class": "lower middle class"}, "question": {"id": "Q142", "variant": 0}, "response": ["In considering the question from the anthropological framework, it is important to take into account the individual's socioeconomic background, cultural context, and personal experience. As a married male from Qena, Egypt, with a middle education level and lower middle class status, job security is a significant concern. The cultural context of Egypt, particularly in smaller towns like Qena, often means limited job opportunities and financial instability. Additionally, at 54 years of age, there may be increased difficulty in finding new employment. Personal experience and individual values also play a role, as the fear of losing a job and the impact on family and financial stability are likely to weigh heavily on this individual's mind. Therefore, the most likely response from this perspective would be:\n(1) Very much"]}, {"persona": {"region": "Qena", "sex": "male", "age": 25, "country": "Egypt", "marital_status": "single", "education": "lower", "social_class": "lower class"}, "question": {"id": "Q142", "variant": 0}, "response": ["From an emic perspective, as a lower-class male from Qena, Egypt, my cultural context and socioeconomic background heavily influence my worry about losing or not finding a job. Job opportunities are limited in my area, and without a higher education, my options are even more restricted. My personal experience and individual values also play a role, as I have seen many people in my community struggle to find stable employment. Additionally, cultural relativism reminds me that my worries are valid within my own context, and space and time considerations also contribute to my concern about job security. Therefore, I choose the option:\n(1) Very much"]}, {"persona": {"region": "Aswan", "sex": "male", "age": 34, "country": "Egypt", "marital_status": "single", "education": "middle", "social_class": "lower class"}, "question": {"id": "Q142", "variant": 0}, "response": ["Based on the anthropological framework, as a single male from Aswan, Egypt, who is 34 years old and part of the lower class, my worries about losing my job or not finding a job are influenced by my cultural context, socioeconomic background, and personal experience. In Aswan, job opportunities for lower-class individuals can be scarce, and the competition is high. Additionally, my middle education level may limit my options, making me more worried about losing my job or not finding a new one. The lack of financial security and the pressure to provide for myself and potentially my family in the future also contribute to my concerns. Therefore, I would choose option (1) Very much."]}, {"persona": {"region": "Aswan", "sex": "female", "age": 31, "country": "Egypt", "marital_status": "married", "education": "middle", "social_class": "lower middle class"}, "question": {"id": "Q142", "variant": 0}, "response": ["Based on the anthropological framework, my emic perspective as a married woman from Aswan, Egypt, who is 31 years old and part of the lower middle class, is significantly influenced by my cultural context, individual values and personal experience, and socioeconomic background. In Egypt, women often face challenges in finding stable employment and are often dependent on their husband's income. Additionally, my lower middle class status means that losing my job or not finding one would have a significant impact on my family's financial stability. Given these factors, I am very worried about losing my job or not finding one.\n\n1"]}, {"persona": {"region": "Aswan", "sex": "female", "age": 39, "country": "Egypt", "marital_status": "married", "education": "middle", "social_class": "working class"}, "question": {"id": "Q142", "variant": 0}, "response": ["Based on the anthropological framework, my answer to the question would be influenced by my emic perspective as a married female from Aswan, Egypt, my cultural context in a region with limited job opportunities, my individual values and personal experience as part of the working class, and my socioeconomic background as someone with only a middle education level. Additionally, the nuance of the question would influence my response. Therefore, I would choose option (2) A good deal."]}, {"persona": {"region": "Qena", "sex": "female", "age": 27, "country": "Egypt", "marital_status": "married", "education": "lower", "social_class": "lower middle class"}, "question": {"id": "Q142", "variant": 0}, "response": ["Based on the anthropological framework, as a married female from Qena, Egypt, I am influenced by my cultural context, individual values, and socioeconomic background. In my cultural context, women are often expected to prioritize their family and household responsibilities, while also facing limited opportunities for employment and career advancement. Additionally, my lower education level and lower middle class status mean that finding stable employment is a significant concern for me. Considering these factors, I would choose option (1) Very much, as I am very worried about losing my job or not finding a job due to the challenges and limitations I face in my cultural and socioeconomic context."]}, {"persona": {"region": "Qena", "sex": "male", "age": 40, "country": "Egypt", "marital_status": "single", "education": "middle", "social_class": "lower middle class"}, "question": {"id": "Q142", "variant": 0}, "response": ["Based on my individual values and personal experience, as well as my socioeconomic background, I am very worried about losing my job or not finding a job. As a single male from Qena, Egypt, who is 40 years old and part of the lower middle class, I am acutely aware of the challenges and competition in the job market. The cultural context of my community and the socioeconomic background of my peers also contribute to this anxiety, as finding stable employment is crucial for survival and providing for oneself. Additionally, the emic perspective of my in-group mentality emphasizes the importance of economic security, further amplifying my concerns. Therefore, from this perspective, I would choose option (1) Very much."]}, {"persona": {"region": "Qena", "sex": "male", "age": 30, "country": "Egypt", "marital_status": "single", "education": "middle", "social_class": "working class"}, "question": {"id": "Q142", "variant": 0}, "response": ["From the perspective of a single male from Qena, Egypt, who is 30 years old, completed middle education level, and considers himself part of the working class, my answer to the question would be \"Very much.\" In Qena, Egypt, the socioeconomic background is a significant factor in the job market, and there are limited opportunities for those with only a middle education level. Additionally, the cultural context and individual values place a high emphasis on the importance of stable employment for providing for oneself and potentially a family. The etic perspective of the working-class community in Qena supports the worry and concern about job stability and finding employment, which is further reinforced by the personal experience of seeing others struggle with unemployment and financial insecurity.\n\n1"]}]