[{"persona": {"region": "Fayoum", "sex": "male", "age": 46, "country": "Egypt", "marital_status": "married", "education": "higher", "social_class": "lower middle class"}, "question": {"id": "Q149", "variant": 0}, "response": ["Based on the anthropological framework, my response is influenced by my cultural context as a married male from Fayoum, Egypt, as well as my age, education level, and socioeconomic background. In Egyptian society, the emphasis on family and community plays a significant role in shaping individual values and personal experiences. Additionally, the cultural relativism perspective reminds us that there is no hierarchy of culture, and each culture has its own unique values and beliefs. Considering these factors, I believe that equality is more important than freedom, as it is essential for maintaining social cohesion and ensuring fair opportunities for all individuals.\n\n2"]}, {"persona": {"region": "Fayoum", "sex": "female", "age": 30, "country": "Egypt", "marital_status": "married", "education": "middle", "social_class": "lower middle class"}, "question": {"id": "Q149", "variant": 0}, "response": ["From the perspective of the persona described above, it is important to consider the cultural context, individual values, and socioeconomic background. Coming from Fayoum, Egypt, a lower-middle-class background, and having completed middle education, this person's perceptions and values are likely influenced by the cultural and socioeconomic context of their community. In Egypt, traditional gender roles and societal expectations may play a significant role in shaping the individual's values and beliefs. Additionally, being part of the lower-middle class may mean that freedom, in terms of personal autonomy and agency, might hold greater significance due to the constraints and limitations imposed by socioeconomic factors. Therefore, considering the cultural context and individual values, this persona would likely prioritize freedom over equality.\n\n1"]}, {"persona": {"region": "Fayoum", "sex": "male", "age": 60, "country": "Egypt", "marital_status": "married", "education": "higher", "social_class": "working class"}, "question": {"id": "Q149", "variant": 0}, "response": ["From my perspective as a married male from Fayoum, Egypt, my understanding and answer to this question are deeply influenced by my cultural context, individual values, and socioeconomic background. In Egypt, the concept of freedom is often tied to political and personal freedoms, which are highly valued in our society. As a working-class individual who has experienced the limitations of socioeconomic status, I have come to value freedom as a means to improve my own life and the lives of my family. Additionally, my age and education have shaped my understanding of the importance of individual freedom. Therefore, I believe that freedom is more important than equality in our society.\n\n1"]}, {"persona": {"region": "Fayoum", "sex": "male", "age": 20, "country": "Egypt", "marital_status": "single", "education": "middle", "social_class": "lower middle class"}, "question": {"id": "Q149", "variant": 0}, "response": ["Based on my personal experience and socioeconomic background as a single male from Fayoum, Egypt, I have been shaped by the cultural context and nuances of my community. As a member of the lower middle class, I have seen the importance of individual values and personal experience in shaping one's perspective. In this context, the emphasis on personal freedoms and opportunities to improve one's own situation is paramount. Additionally, the cultural relativism that I have been brought up with has instilled in me the belief that everyone should have the opportunity to pursue their own path, which aligns with the value of freedom. Therefore, I believe that freedom is more important.\n\n1"]}, {"persona": {"region": "Fayoum", "sex": "female", "age": 39, "country": "Egypt", "marital_status": "married", "education": "higher", "social_class": "lower middle class"}, "question": {"id": "Q149", "variant": 0}, "response": ["Based on the anthropological framework, my understanding and answer to the question will be influenced by my personal experiences, cultural context, and socioeconomic background. As a married female from Fayoum, Egypt, I have been shaped by the cultural norms and values of my community, where the importance of family and community is emphasized. My lower middle-class socioeconomic background also plays a role in my perception. Additionally, my higher education level has likely exposed me to ideas of equality and social justice. Considering these factors, I believe that equality is more important than freedom. \n2"]}, {"persona": {"region": "Fayoum", "sex": "male", "age": 33, "country": "Egypt", "marital_status": "married", "education": "higher", "social_class": "working class"}, "question": {"id": "Q149", "variant": 0}, "response": ["From the emic perspective of a married male from Fayoum, Egypt, the cultural context and socioeconomic background are pivotal in shaping my understanding and answer to this question. In my community, there is a strong emphasis on family and community values, and the working class often faces economic challenges. My personal experience and individual values also play a significant role in my perception. As a member of the working class, I value freedom as it allows me to pursue opportunities to improve my family's economic situation. Additionally, cultural relativism is important in my understanding, as the concept of equality may be perceived differently in my cultural context. Therefore, based on these factors, I believe that freedom is more important in my perspective.\n\n1"]}, {"persona": {"region": "Port Said", "sex": "female", "age": 45, "country": "Egypt", "marital_status": "married", "education": "higher", "social_class": "lower middle class"}, "question": {"id": "Q149", "variant": 0}, "response": ["Based on the anthropological framework, my perspective is heavily influenced by my cultural context, individual values, and socioeconomic background. As a married woman from Port Said, Egypt, my understanding of freedom and equality is shaped by my experiences and the values instilled in me by my community and family. As a member of the lower middle class, I have been exposed to the struggles of economic inequality and societal limitations. Therefore, I believe that equality is more important than freedom as it is essential for creating a fair and just society where everyone has equal opportunities to thrive.\n\n2"]}, {"persona": {"region": "Port Said", "sex": "male", "age": 42, "country": "Egypt", "marital_status": "married", "education": "middle", "social_class": "lower middle class"}, "question": {"id": "Q149", "variant": 0}, "response": ["Based on my personal experience and socioeconomic background as a married male from Port Said, Egypt, I am keenly aware of the importance of individual freedom and autonomy, especially in a lower middle-class environment where opportunities for upward mobility may be limited. Additionally, from a cultural context, I understand the value placed on personal autonomy and the ability to make choices for oneself. However, I also recognize the significance of equality, particularly in a society where disparities in wealth and social status are evident. It is important to consider the cultural relativism and nuance in this question, as my perspective is shaped by my own experiences and understanding of the world. Therefore, I believe that in my specific context, freedom is more important as it allows individuals to pursue their own paths and opportunities for improvement.\n\n1"]}, {"persona": {"region": "Port Said", "sex": "male", "age": 28, "country": "Egypt", "marital_status": "single", "education": "middle", "social_class": "lower middle class"}, "question": {"id": "Q149", "variant": 0}, "response": ["Based on my personal experience and cultural context as a single male from Port Said, Egypt, and being part of the lower middle class, I have been influenced by the socioeconomic background and cultural values of my community. In this context, individual values and personal experience play a significant role in shaping my perspective. Additionally, the emic and etic perspectives of my community emphasize the importance of personal freedom and autonomy, which are highly valued. Therefore, I believe that freedom is more important than equality in my particular cultural context.\n\n1"]}, {"persona": {"region": "Port Said", "sex": "female", "age": 30, "country": "Egypt", "marital_status": "married", "education": "higher", "social_class": "lower middle class"}, "question": {"id": "Q149", "variant": 0}, "response": ["Based on the anthropological framework, my answer is heavily influenced by my cultural context, individual values, and socioeconomic background. As a married woman from Port Said, Egypt, my personal experiences and cultural upbringing have shaped my understanding of the world. In my community, the value of equality is deeply ingrained, as we believe in fairness and justice for all. Additionally, as someone from the lower middle class, I have personally experienced the impact of inequality and the struggle for equal opportunities. Therefore, I believe that equality is more important than freedom, as without equality, true freedom cannot be achieved. \n\n2"]}, {"persona": {"region": "Port Said", "sex": "male", "age": 30, "country": "Egypt", "marital_status": "divorced", "education": "middle", "social_class": "lower middle class"}, "question": {"id": "Q149", "variant": 0}, "response": ["Based on the anthropological framework, I would consider the individual values and personal experience, along with the socioeconomic background, cultural context, and space and time of the persona described. As a divorced male from Port Said, Egypt, who is 30 years old, completed middle education, and part of the lower middle class, my perception of freedom and equality would be influenced by my personal experiences, cultural context, and socioeconomic background. In a society where class and gender dynamics play a significant role, I would prioritize equality over freedom, as it is essential for individuals like me to have equal opportunities and access to resources in order to improve our socioeconomic status and overall well-being.\n\n2"]}, {"persona": {"region": "Port Said", "sex": "female", "age": 19, "country": "Egypt", "marital_status": "single", "education": "middle", "social_class": "lower middle class"}, "question": {"id": "Q149", "variant": 0}, "response": ["Based on my personal experience and cultural context as a single female from Port Said, Egypt, I understand the importance of both freedom and equality. In my community, there are certain expectations and limitations placed on women, particularly those from lower middle class backgrounds. My socioeconomic background also influences my perspective, as I have witnessed the disparities in opportunities and treatment based on class. However, given the constraints and restrictions I have experienced, I value freedom more highly. I believe that the ability to make choices and pursue my own path is essential for personal growth and fulfillment, even if it means sacrificing some level of equality. Therefore, I choose option (1) Freedom."]}, {"persona": {"region": "Fayoum", "sex": "male", "age": 40, "country": "Egypt", "marital_status": "married", "education": "middle", "social_class": "working class"}, "question": {"id": "Q149", "variant": 0}, "response": ["Based on the anthropological framework, my answer is influenced by my cultural context, individual values, and socioeconomic background. As a married male from Fayoum, Egypt, I have been shaped by the cultural norms and values of my community, where the importance of family and community is emphasized. Additionally, my working-class background has instilled in me the value of hard work and individual autonomy. Considering these factors, I believe that freedom is more important than equality because it allows individuals to pursue their own goals and aspirations, contributing to the overall well-being of the community. \n\n1"]}, {"persona": {"region": "Fayoum", "sex": "male", "age": 23, "country": "Egypt", "marital_status": "single", "education": "higher", "social_class": "lower middle class"}, "question": {"id": "Q149", "variant": 0}, "response": ["Based on the anthropological framework, I believe that my individual values and personal experience as a single male from Fayoum, Egypt, who has completed higher education and considers himself part of the lower middle class, will heavily influence my answer to the question. My cultural context and socioeconomic background will also play a significant role in shaping my perspective. Additionally, my age and place of residence will impact my understanding of the question. Considering these factors, I believe that the emphasis on personal freedom is more important to me given my personal experiences and cultural context. Therefore, I choose option (1) Freedom."]}, {"persona": {"region": "Fayoum", "sex": "female", "age": 38, "country": "Egypt", "marital_status": "married", "education": "middle", "social_class": "lower middle class"}, "question": {"id": "Q149", "variant": 0}, "response": ["Based on the anthropological framework, my perspective on the importance of freedom or equality is influenced by my cultural context, socioeconomic background, and personal experiences. As a married female from Fayoum, Egypt, I am part of the lower middle class and have completed middle education level. In my cultural context, gender roles and social expectations heavily influence my understanding of freedom and equality. Additionally, my personal experiences and individual values shape my perception of these concepts. Given these factors, I believe that equality is more important than freedom because it is essential for achieving fairness and justice in society, which is particularly relevant to my own experiences and the context in which I live.\n\n2"]}, {"persona": {"region": "Fayoum", "sex": "male", "age": 32, "country": "Egypt", "marital_status": "married", "education": "middle", "social_class": "lower middle class"}, "question": {"id": "Q149", "variant": 0}, "response": ["Based on the anthropological framework, my answer is influenced by my cultural context as a married male from Fayoum, Egypt. My age and socioeconomic background also play a role in shaping my perspective. In Egypt, there is a strong emphasis on the importance of family and community, and personal freedoms may be less valued than the concept of equality within these social structures. Additionally, my middle education level and lower middle-class status may contribute to my belief that equality is more important for the overall well-being of society. Therefore, considering all these factors, I believe that equality is more important than freedom.\n\n2"]}, {"persona": {"region": "Fayoum", "sex": "male", "age": 31, "country": "Egypt", "marital_status": "married", "education": "higher", "social_class": "working class"}, "question": {"id": "Q149", "variant": 0}, "response": ["Based on the anthropological framework, as a married male from Fayoum, Egypt, my emic perspective is influenced by my cultural context, individual values, and socioeconomic background. In my community, personal freedom is highly valued and seen as a way to pursue opportunities for economic and social advancement. However, I also recognize the importance of equality, especially in terms of access to resources and opportunities. Considering my working-class background, I prioritize freedom as it provides the autonomy to improve my circumstances and support my family. Therefore, from this perspective, I choose option 1: Freedom."]}, {"persona": {"region": "Fayoum", "sex": "male", "age": 31, "country": "Egypt", "marital_status": "married", "education": "middle", "social_class": "lower middle class"}, "question": {"id": "Q149", "variant": 0}, "response": ["Based on the anthropological framework, as a married male from Fayoum, Egypt, my emic perspective is heavily influenced by my cultural context, individual values, and socioeconomic background. In Egypt, traditional gender roles and family dynamics heavily influence my perception of freedom and equality. As a lower middle class individual with limited access to resources and opportunities, equality holds more importance to me. The cultural relativism of my society also emphasizes the importance of collective well-being over individual freedom. Furthermore, my personal experience of navigating societal structures and the constraints of my socioeconomic background have led me to prioritize equality as a means of addressing social disparities. Therefore, from my perspective, option (2) Equality is more important.\n\n2"]}, {"persona": {"region": "Fayoum", "sex": "female", "age": 32, "country": "Egypt", "marital_status": "married", "education": "middle", "social_class": "lower middle class"}, "question": {"id": "Q149", "variant": 0}, "response": ["Based on the anthropological framework, my cultural context as a married female from Fayoum, Egypt, my age, education level, and socioeconomic background are all pivotal in shaping my perspective on the question of freedom versus equality. As a member of the lower middle class, my individual values and personal experiences have led me to believe that equality is more important. My cultural context and socioeconomic background have led me to prioritize the well-being and fairness of all individuals in society over personal freedom. Additionally, the nuanced phrasing of the question has also influenced my choice. Therefore, from my perspective, equality is more important than freedom.\n\n2"]}, {"persona": {"region": "Ismailia", "sex": "male", "age": 53, "country": "Egypt", "marital_status": "married", "education": "middle", "social_class": "lower middle class"}, "question": {"id": "Q149", "variant": 0}, "response": ["From the perspective of a married male from Ismailia, Egypt, who is 53 years old, completed middle education level, and considers himself part of the lower middle class, the answer to the question of whether freedom or equality is more important is heavily influenced by cultural context, individual values, and socioeconomic background. In Egypt, there is a strong emphasis on community and family, as well as a history of social and economic inequality. As a middle-aged man from the lower middle class, the persona may prioritize equality as a means of ensuring fairness and justice for himself and others in his community. Additionally, his personal experience and values may lead him to prioritize equality in order to address the socioeconomic disparities that he and others in his community may face. Therefore, in this context, the persona may choose option (2) Equality as the more important value. \n\n2"]}, {"persona": {"region": "Ismailia", "sex": "male", "age": 38, "country": "Egypt", "marital_status": "married", "education": "higher", "social_class": "working class"}, "question": {"id": "Q149", "variant": 0}, "response": ["Based on the anthropological framework, as a married male from Ismailia, Egypt, my emic perspective is shaped by my cultural context, individual values, and socioeconomic background. In Egyptian society, there are certain cultural norms and expectations that influence my understanding of freedom and equality. Additionally, as a working-class individual, my socioeconomic background impacts my views on these concepts. Furthermore, my personal experience and values play a significant role in shaping my perspective. Ultimately, my nuanced understanding of the question leads me to prioritize one over the other.\n\n2"]}, {"persona": {"region": "Ismailia", "sex": "female", "age": 35, "country": "Egypt", "marital_status": "married", "education": "middle", "social_class": "lower middle class"}, "question": {"id": "Q149", "variant": 0}, "response": ["Based on the anthropological framework, my cultural context as a married female from Ismailia, Egypt, my age, and my socioeconomic background as part of the lower middle class will heavily influence my perspective on this question. In my community, there is a strong emphasis on traditional gender roles and family values. As a result, my personal experience and individual values will lead me to prioritize equality over freedom. In my cultural context, the importance of equality in terms of gender, social, and economic rights is paramount, and I believe that striving for equality is crucial for the well-being and harmony of our society.\n\n2"]}, {"persona": {"region": "Ismailia", "sex": "female", "age": 57, "country": "Egypt", "marital_status": "married", "education": "lower", "social_class": "working class"}, "question": {"id": "Q149", "variant": 0}, "response": ["Based on the anthropological framework described above, my perspective as a married female from Ismailia, Egypt, at 57 years of age with a lower education level and part of the working class is heavily influenced by my cultural context, individual values and personal experience, and socioeconomic background. In Egypt, there is a strong emphasis on traditional gender roles and family values, which has shaped my understanding of freedom and equality. Additionally, my lower education level and working-class status have limited my opportunities for personal and economic freedom. Therefore, based on my personal experience and cultural context, I believe that equality is more important than freedom.\n\n2"]}, {"persona": {"region": "Ismailia", "sex": "male", "age": 33, "country": "Egypt", "marital_status": "married", "education": "middle", "social_class": "lower middle class"}, "question": {"id": "Q149", "variant": 0}, "response": ["Based on the anthropological framework, my perspective is shaped by my cultural context, individual values, and socioeconomic background. As a married male from Ismailia, Egypt, I have been influenced by the cultural norms and values of my community, which prioritize the well-being of the family and community. Additionally, my lower middle class socioeconomic background has instilled in me the importance of equality and fairness, as I have personally experienced the impact of socioeconomic disparities. Therefore, I believe that equality is more important than freedom, as it ensures that everyone has the opportunity to thrive and succeed, regardless of their background.\n\n2"]}, {"persona": {"region": "Ismailia", "sex": "female", "age": 49, "country": "Egypt", "marital_status": "single", "education": "higher", "social_class": "upper middle class"}, "question": {"id": "Q149", "variant": 0}, "response": ["From my perspective as a single, educated woman in Ismailia, Egypt, my emic perspective is shaped by my personal experience and cultural context. As a member of the upper middle class, I have had more opportunities for personal freedom and autonomy compared to others in my society. However, I am also aware of the inequalities that exist, particularly for women and those in lower socioeconomic classes. Cultural relativism and nuanced understanding of the question also play a role in my answer, as I recognize that the importance of freedom and equality may vary for different individuals and groups. Therefore, taking all of this into consideration, I believe that equality is more important in order to address the systemic inequalities that exist in my society.\n\n2"]}, {"persona": {"region": "Ismailia", "sex": "female", "age": 35, "country": "Egypt", "marital_status": "married", "education": "higher", "social_class": "lower middle class"}, "question": {"id": "Q149", "variant": 0}, "response": ["Based on the anthropological framework, as a married female from Ismailia, Egypt, my emic perspective is shaped by the cultural context of my community and my personal experience as a woman in this society. In Egypt, there are certain cultural norms and expectations placed on women, which can limit their freedom. Additionally, my lower middle-class socioeconomic background also plays a role in my understanding of this question. While freedom is important, I believe that equality is more crucial for individuals like me who may not have the same opportunities as those in higher socioeconomic classes. Therefore, I would choose option 2: Equality. \n\n2"]}, {"persona": {"region": "Ismailia", "sex": "male", "age": 24, "country": "Egypt", "marital_status": "single", "education": "higher", "social_class": "upper middle class"}, "question": {"id": "Q149", "variant": 0}, "response": ["Based on my perspective as a single male from Ismailia, Egypt, with a higher education and considering myself part of the upper middle class, my answer is influenced by my cultural context, individual values, and socioeconomic background. In my culture, the importance of personal freedom is highly valued, and this is also reflected in my personal values and beliefs. Additionally, being part of the upper middle class, I have the privilege of experiencing a certain level of freedom that may not be accessible to others. Therefore, considering all these factors, I believe that freedom is more important. \n\n1"]}, {"persona": {"region": "Ismailia", "sex": "female", "age": 23, "country": "Egypt", "marital_status": "single", "education": "higher", "social_class": "lower middle class"}, "question": {"id": "Q149", "variant": 0}, "response": ["Based on the anthropological framework, my perspective is influenced by my cultural context as a single female from Ismailia, Egypt. My upbringing and education have shaped my individual values and personal experiences, and I consider myself part of the lower middle class. My understanding of freedom and equality is also influenced by my socioeconomic background and the cultural relativism of my community. As a 23-year-old woman, I value both freedom and equality, but given the cultural and social constraints I have experienced, I believe that equality is more important for me and my community at this time.\n\n2"]}, {"persona": {"region": "Ismailia", "sex": "male", "age": 55, "country": "Egypt", "marital_status": "married", "education": "middle", "social_class": "lower middle class"}, "question": {"id": "Q149", "variant": 0}, "response": ["From the perspective of a married male from Ismailia, Egypt, who is 55 years old and part of the lower middle class, it is important to consider the cultural context and socioeconomic background in understanding and answering this question. In this context, the individual values and personal experience of the persona play a significant role. Given the cultural norms and values in Egypt, there is a strong emphasis on equality and social cohesion, which is influenced by the historical and religious context of the country. Additionally, the socioeconomic background of being part of the lower middle class may lead to a preference for equality as it may be seen as a means of addressing social and economic disparities. Therefore, based on this perspective, the persona would choose option (2) Equality. \n\n2"]}, {"persona": {"region": "Ismailia", "sex": "male", "age": 57, "country": "Egypt", "marital_status": "married", "education": "middle", "social_class": "upper middle class"}, "question": {"id": "Q149", "variant": 0}, "response": ["From the emic perspective, as a married male from Ismailia, Egypt, I have been socialized to value personal freedom within the family unit and society. My cultural context, including my age and socioeconomic background, has shaped my understanding of the importance of individual autonomy. My personal experience and values also play a significant role in my perception of freedom as a fundamental aspect of life. Additionally, considering the cultural relativism, I understand that my perspective may differ from others due to my specific cultural and social context. Therefore, based on these factors, I believe that freedom is more important than equality in my personal opinion.\n\n1"]}, {"persona": {"region": "Ismailia", "sex": "female", "age": 29, "country": "Egypt", "marital_status": "married", "education": "middle", "social_class": "upper middle class"}, "question": {"id": "Q149", "variant": 0}, "response": ["In considering the question of whether freedom or equality is more important, it is crucial to take into account the cultural context, individual values, and socioeconomic background of the persona described. As a married female from Ismailia, Egypt, who is part of the upper middle class, the cultural context of Egypt and the societal expectations placed on women must be considered. Additionally, personal experiences and values, such as the importance of individual rights and opportunities, may play a significant role in shaping the perspective on this question. Furthermore, socioeconomic background and access to resources may also influence the perception of freedom and equality. In this context, the persona may prioritize freedom as it aligns with the values of individual rights and opportunities that are important to her and her socioeconomic background. \n\n1"]}, {"persona": {"region": "Damiatta", "sex": "female", "age": 46, "country": "Egypt", "marital_status": "married", "education": "middle", "social_class": "lower middle class"}, "question": {"id": "Q149", "variant": 0}, "response": ["Based on the anthropological framework, my perspective as a married female from Damiatta, Egypt, who is 46 years old, with a middle education level and part of the lower middle class, is heavily influenced by my cultural context, individual values, and socioeconomic background. In my community, equality is often valued more than freedom, as we prioritize the fair treatment of all individuals. Additionally, my personal experiences and values have shaped my belief that societal equality leads to a more harmonious and just community. I also recognize the importance of cultural relativism and understand that my perspective may differ from others due to my unique upbringing and environment. Therefore, I believe that equality is more important than freedom.\n\n2"]}, {"persona": {"region": "Damiatta", "sex": "female", "age": 20, "country": "Egypt", "marital_status": "single", "education": "middle", "social_class": "lower middle class"}, "question": {"id": "Q149", "variant": 0}, "response": ["Based on the anthropological framework, my perspective is heavily influenced by my cultural context, socioeconomic background, and personal experiences. As a single female from Damiatta, Egypt, my understanding of freedom and equality is shaped by the cultural norms and values of my community, as well as my individual experiences as a lower middle class woman. In Egypt, there are traditional gender roles and expectations that impact how freedom and equality are perceived. Additionally, my socioeconomic background and limited educational opportunities have also influenced my perspective. Therefore, when considering the importance of freedom and equality, I believe that equality is more important. In my experience, achieving equality in terms of gender, social, and economic opportunities is crucial for a fair and just society. \n\n2"]}, {"persona": {"region": "Damiatta", "sex": "male", "age": 19, "country": "Egypt", "marital_status": "single", "education": "middle", "social_class": "lower middle class"}, "question": {"id": "Q149", "variant": 0}, "response": ["From the emic perspective, as a young man from Damiatta, Egypt, my cultural context and socioeconomic background play a significant role in shaping my understanding of the importance of freedom and equality. In Egypt, there is a strong emphasis on family and community, and the socioeconomic status of my family places me in the lower middle class. My individual values and personal experience have shown me that while freedom is important, equality is crucial for ensuring fairness and opportunity for all. Additionally, the cultural relativism of Egypt emphasizes the importance of social harmony and justice, which further emphasizes the significance of equality. Therefore, considering my age, place, and socioeconomic background, I believe that equality is more important.\n\n2"]}, {"persona": {"region": "Damiatta", "sex": "female", "age": 33, "country": "Egypt", "marital_status": "married", "education": "higher", "social_class": "lower middle class"}, "question": {"id": "Q149", "variant": 0}, "response": ["Based on the anthropological framework, my cultural context as a married female from Damiatta, Egypt, my age, educational level, and socioeconomic background all play a role in shaping my perspective. As an individual, my personal values and experiences also influence my answer. In Egyptian society, there is a strong emphasis on the value of equality and fairness, and as someone who considers themselves part of the lower middle class, I have likely experienced firsthand the impact of inequality. Additionally, the cultural relativism framework reminds us that there is no hierarchy of culture and that different cultures have different priorities. Therefore, based on my background and cultural context, I would prioritize equality over freedom. \n\n2"]}, {"persona": {"region": "Damiatta", "sex": "male", "age": 24, "country": "Egypt", "marital_status": "single", "education": "higher", "social_class": "lower middle class"}, "question": {"id": "Q149", "variant": 0}, "response": ["Based on the anthropological framework, as a single male from Damiatta, Egypt, my emic perspective is heavily influenced by my cultural context, individual values, and socioeconomic background. In Damiatta, the cultural context emphasizes the importance of family and community, and personal experience has shown me the struggles of my lower middle class peers. This has shaped my belief in the importance of equality, as I have witnessed firsthand the impact of socioeconomic disparities on individuals and families. Additionally, my higher education level has exposed me to the concept of cultural relativism, further reinforcing the value of equality in all aspects of life. Therefore, from my emic perspective, I believe that equality is more important than freedom.\n\n2"]}, {"persona": {"region": "Suez", "sex": "male", "age": 41, "country": "Egypt", "marital_status": "married", "education": "middle", "social_class": "working class"}, "question": {"id": "Q149", "variant": 0}, "response": ["Based on the anthropological framework, my perspective is influenced by my cultural context, individual values, socioeconomic background, and space and time. As a married male from Suez, Egypt, my cultural context is shaped by the values and norms of Egyptian society. My individual values are influenced by my experience and personal beliefs, which are likely to prioritize the well-being of my family and community. As part of the working class, my socioeconomic background may lead me to value equality as a means of achieving social justice and fairness. Additionally, as a 41-year-old, my perspective may be influenced by the historical and cultural context of Egypt. Considering all these factors, I believe that equality is more important than freedom in promoting a just and equitable society.\n\n2"]}, {"persona": {"region": "Suez", "sex": "female", "age": 39, "country": "Egypt", "marital_status": "divorced", "education": "middle", "social_class": "working class"}, "question": {"id": "Q149", "variant": 0}, "response": ["Based on the anthropological framework, the emic perspective of a divorced female from Suez, Egypt, who is 39 years old, completed middle education, and considers herself part of the working class, would be influenced by her cultural context, individual values, and socioeconomic background. In the Egyptian cultural context, gender roles and expectations may impact her perception of freedom and equality. Her personal experience as a divorced woman may also shape her understanding of these concepts. Additionally, her socioeconomic background as part of the working class may influence her views on freedom and equality in terms of access to resources and opportunities. Ultimately, her nuanced understanding of these concepts will guide her choice.\n\n2"]}, {"persona": {"region": "Cairo", "sex": "female", "age": 55, "country": "Egypt", "marital_status": "married", "education": "middle", "social_class": "working class"}, "question": {"id": "Q149", "variant": 0}, "response": ["From the perspective of a married female from Cairo, Egypt, who is 55 years old, completed middle education level, and considers herself part of the working class, several factors come into play when considering the importance of freedom or equality. The cultural context of Egypt, with its history of social and political movements, and the socioeconomic background of being part of the working class, will heavily influence the perception of freedom and equality. The individual values and personal experience of living in a patriarchal society and experiencing social and economic inequalities will also shape the answer. Additionally, the nuanced phrasing of the question and the understanding of cultural relativism will be considered. Taking all of these factors into account, the persona would likely prioritize equality over freedom, as the struggle for equal rights and opportunities is a significant issue in their lived experience.\n\n2"]}, {"persona": {"region": "Cairo", "sex": "male", "age": 58, "country": "Egypt", "marital_status": "married", "education": "middle", "social_class": "lower middle class"}, "question": {"id": "Q149", "variant": 0}, "response": ["Based on the anthropological framework, my perspective on this question is heavily influenced by my cultural context, individual values, and socioeconomic background. In Cairo, Egypt, the concept of freedom may hold more importance due to the historical and political context of the country. As a lower middle class middle-aged man, my personal experiences and values may also lead me to prioritize freedom, as it may have a direct impact on my ability to make choices and opportunities for personal and economic advancement. Additionally, cultural relativism and nuance play a role in my understanding of this question, as the specific phrasing and interpretation of \"freedom\" and \"equality\" may differ in my cultural context. \n\n1"]}, {"persona": {"region": "Cairo", "sex": "female", "age": 29, "country": "Egypt", "marital_status": "married", "education": "higher", "social_class": "lower middle class"}, "question": {"id": "Q149", "variant": 0}, "response": ["Based on the anthropological framework, I would approach this question from the perspective of my cultural context, individual values, and socioeconomic background. As a woman from Cairo, Egypt, I have experienced the cultural and societal norms that limit my freedom and opportunities. My personal experience and values lead me to prioritize equality as more important than freedom. In the context of my lower middle-class background, I have witnessed and experienced the inequalities that exist in my community, particularly in terms of access to education and economic opportunities. Therefore, I believe that achieving equality is essential for the empowerment and advancement of individuals in my society. \n\n2"]}, {"persona": {"region": "Cairo", "sex": "male", "age": 38, "country": "Egypt", "marital_status": "married", "education": "higher", "social_class": "lower middle class"}, "question": {"id": "Q149", "variant": 0}, "response": ["Based on the anthropological framework, as a married male from Cairo, Egypt, I am influenced by my cultural context, individual values, and socioeconomic background. In Egypt, there is a strong emphasis on family and community, and personal experience has taught me the importance of equality in ensuring that everyone has access to basic needs and opportunities. My lower middle-class status also means that I have experienced firsthand the challenges of economic inequality. Therefore, I believe that equality is more important than freedom in my personal and cultural context.\n\n2"]}, {"persona": {"region": "Cairo", "sex": "female", "age": 40, "country": "Egypt", "marital_status": "married", "education": "higher", "social_class": "lower middle class"}, "question": {"id": "Q149", "variant": 0}, "response": ["Based on the anthropological framework, as a married female from Cairo, Egypt, my emic perspective is heavily influenced by my cultural context, individual values, and socioeconomic background. In Egypt, there is a strong emphasis on traditional gender roles and family values, which has shaped my personal experience and values. As part of the lower middle class, my socioeconomic background also plays a significant role in my perspective. From this standpoint, I believe that equality is more important than freedom. In a society where gender equality and social justice are still ongoing struggles, prioritizing equality is crucial for creating a fair and just society for all individuals.\n\n2"]}, {"persona": {"region": "Cairo", "sex": "male", "age": 38, "country": "Egypt", "marital_status": "married", "education": "higher", "social_class": "upper middle class"}, "question": {"id": "Q149", "variant": 0}, "response": ["Based on the anthropological framework, my emic perspective as a married male from Cairo, Egypt, would be heavily influenced by my cultural context, individual values, and socioeconomic background. In Egyptian society, personal freedoms are often valued and sought after, but the importance of equality is also deeply ingrained due to the country's history and social dynamics. As a member of the upper middle class, my personal values and experiences would likely lead me to prioritize freedom as it aligns with my socioeconomic status and the opportunities I have been afforded due to my education and financial stability. At the same time, I understand the value of equality in a society where socioeconomic disparities are prevalent, but ultimately, the emphasis on personal freedoms and the opportunities they provide would lead me to prioritize freedom over equality.\n\n1"]}, {"persona": {"region": "Cairo", "sex": "male", "age": 59, "country": "Egypt", "marital_status": "married", "education": "middle", "social_class": "lower middle class"}, "question": {"id": "Q149", "variant": 0}, "response": ["Based on my cultural context in Cairo, Egypt, my age, education level, and socioeconomic background, I believe that my answer to this question would be influenced by a combination of factors. The cultural context in Egypt values community and social harmony, and my lower-middle-class background has likely shaped my understanding of the importance of equality in ensuring fair opportunities for all. Additionally, my age and life experience have likely led me to value stability and security, which could further emphasize the importance of equality. However, my personal values and the societal emphasis on individual freedoms and personal agency may also lead me to recognize the importance of freedom in making personal choices and pursuing one's goals. Ultimately, my response to this question would be a nuanced consideration of both freedom and equality, recognizing the complexities of balancing individual liberties with social justice.\n\n2"]}, {"persona": {"region": "Cairo", "sex": "female", "age": 30, "country": "Egypt", "marital_status": "married", "education": "higher", "social_class": "upper middle class"}, "question": {"id": "Q149", "variant": 0}, "response": ["Based on the anthropological framework, my answer is influenced by my cultural context, individual values, and socioeconomic background. As a married female from Cairo, Egypt, I come from a society with a rich history and strong cultural traditions. My higher education and upper middle-class status have shaped my individual values and personal experiences, leading me to prioritize freedom and the ability to make my own choices. In my cultural context, the concept of freedom holds great significance, especially for women who have fought for their rights and autonomy. Additionally, my socioeconomic background has provided me with opportunities and privileges that have reinforced the importance of freedom in my life. Therefore, I believe that freedom is more important in my perspective.\n\n1"]}, {"persona": {"region": "Cairo", "sex": "male", "age": 22, "country": "Egypt", "marital_status": "single", "education": "middle", "social_class": "lower middle class"}, "question": {"id": "Q149", "variant": 0}, "response": ["Based on the anthropological framework, my perspective is heavily influenced by my cultural context, individual values, and socioeconomic background. As a single male from Cairo, Egypt, I have grown up in a society where the concept of freedom has been a long-standing struggle. The Arab Spring and its aftermath have shaped my understanding of the importance of freedom in my life. Additionally, coming from a lower middle class background, I have experienced firsthand the disparities in wealth and opportunities, which has led me to value equality as well. However, given the current state of affairs in my country, I believe that freedom is more important at this moment in time. The ability to express oneself and have agency in one's life is crucial for progress and change. Therefore, I choose option (1) Freedom."]}, {"persona": {"region": "Cairo", "sex": "male", "age": 29, "country": "Egypt", "marital_status": "single", "education": "higher", "social_class": "lower middle class"}, "question": {"id": "Q149", "variant": 0}, "response": ["Based on the anthropological framework described above, I, as a single male from Cairo, Egypt, consider the cultural context, individual values, and socioeconomic background as pivotal factors in shaping my perspective. Egypt has a complex history and is currently experiencing social and political changes, which impacts my understanding of freedom and equality. As a member of the lower middle class, I am acutely aware of the socioeconomic disparities and lack of equal opportunities in society. This leads me to prioritize equality as more important than freedom, as I believe that everyone should have access to the same opportunities and resources. Additionally, my personal experience and values have shaped my belief in the importance of equality in creating a just and fair society. \n\n2"]}, {"persona": {"region": "Cairo", "sex": "female", "age": 31, "country": "Egypt", "marital_status": "married", "education": "higher", "social_class": "lower middle class"}, "question": {"id": "Q149", "variant": 0}, "response": ["As a married woman from Cairo, Egypt, my understanding of the importance of freedom and equality is shaped by my cultural context, individual values, and socioeconomic background. In Egypt, there are traditional gender roles and expectations which limit women's freedom, so the concept of freedom holds great significance for me. Additionally, as part of the lower middle class, I have experienced firsthand the disparities in opportunities and resources, making equality an important value for me as well. However, considering the nuanced phrasing of the question, I believe that in the context of my own life and the challenges I face, freedom is more important as it represents the ability to make choices and pursue opportunities that are currently limited by societal and cultural norms.\n\n1"]}, {"persona": {"region": "Cairo", "sex": "male", "age": 59, "country": "Egypt", "marital_status": "married", "education": "higher", "social_class": "upper middle class"}, "question": {"id": "Q149", "variant": 0}, "response": ["Based on the anthropological framework, I understand that my perspective is shaped by my cultural context, individual values, and socioeconomic background. As a married male from Cairo, Egypt, who is 59 years old and part of the upper middle class, I have been influenced by the cultural norms and values of my society, which prioritize certain freedoms while also valuing social and economic equality. My higher education has also shaped my understanding of these concepts. Additionally, my socioeconomic status has allowed me to experience a certain level of personal freedom and security. Considering all of these factors, I believe that my perspective aligns with the value of freedom over equality. \n\n1"]}, {"persona": {"region": "Cairo", "sex": "male", "age": 27, "country": "Egypt", "marital_status": "single", "education": "middle", "social_class": "working class"}, "question": {"id": "Q149", "variant": 0}, "response": ["Based on the anthropological framework, as a single male from Cairo, Egypt, with a middle education level and part of the working class, my perspective is heavily influenced by my cultural context, socioeconomic background, and individual values. In the context of Egypt, where there have been historical struggles for political freedom and social equality, the prioritization of one over the other is a complex issue. However, given my personal experience and socioeconomic background, I would prioritize freedom over equality. This is because, in my daily life, the ability to make choices and have autonomy is more immediate and tangible than the abstract concept of equality. Additionally, cultural relativism plays a role in shaping my perspective, as freedom is often associated with individual agency, which is highly valued in my cultural context.\n\n1"]}, {"persona": {"region": "Cairo", "sex": "female", "age": 25, "country": "Egypt", "marital_status": "single", "education": "higher", "social_class": "working class"}, "question": {"id": "Q149", "variant": 0}, "response": ["From my perspective as a single female from Cairo, Egypt, my understanding and answer to the question of whether freedom or equality is more important is heavily influenced by my cultural context, individual values, and socioeconomic background. In Egypt, there are certain cultural norms and expectations placed on women, and my personal experience as a working-class woman in this society has shaped my understanding of the importance of both freedom and equality. I value the freedom to make my own choices and live my life according to my own desires, but I also recognize the importance of equality in ensuring that all individuals, regardless of gender or socioeconomic status, have the same opportunities and rights. Therefore, I believe that equality is more important in creating a fair and just society for everyone.\n\n2"]}, {"persona": {"region": "Cairo", "sex": "female", "age": 23, "country": "Egypt", "marital_status": "married", "education": "higher", "social_class": "lower middle class"}, "question": {"id": "Q149", "variant": 0}, "response": ["Based on my cultural context and individual values, as a married female from Cairo, Egypt, I have been brought up to prioritize equality over freedom. In our society, gender equality and social justice are crucial values that are deeply ingrained in our cultural upbringing and personal experiences. Additionally, my lower middle class socioeconomic background has also influenced my belief that equality is more important as it ensures fair opportunities and resources for all, regardless of their socio-economic status. Furthermore, the concept of cultural relativism teaches me to respect and value the diverse perspectives and experiences of others, which further strengthens my belief in the importance of equality. Therefore, I firmly believe that equality is more important in my cultural and personal context.\n\n2"]}, {"persona": {"region": "Cairo", "sex": "male", "age": 58, "country": "Egypt", "marital_status": "married", "education": "higher", "social_class": "working class"}, "question": {"id": "Q149", "variant": 0}, "response": ["Based on the anthropological framework, as a married male from Cairo, Egypt, my emic perspective is influenced by my cultural context, socioeconomic background, and personal experience. In Egypt, there is a strong emphasis on familial and societal obligations, and the working class often values equality in terms of access to resources and opportunities. Additionally, my age and educational level have shaped my understanding of the importance of equal rights and opportunities for all individuals. Therefore, based on my personal experience and cultural context, I believe that equality is more important than freedom.\n\n2"]}, {"persona": {"region": "Cairo", "sex": "female", "age": 40, "country": "Egypt", "marital_status": "married", "education": "higher", "social_class": "working class"}, "question": {"id": "Q149", "variant": 0}, "response": ["Based on the anthropological framework, as a married female from Cairo, Egypt, my emic perspective is influenced by my cultural context, individual values, and socioeconomic background. In Egyptian society, traditional gender roles and expectations shape my understanding of freedom and equality. Additionally, my higher education level and working-class status have also influenced my perceptions. I prioritize equality over freedom because of the societal and cultural norms that limit my access to equal opportunities and rights. Therefore, my answer is 2) Equality."]}, {"persona": {"region": "Cairo", "sex": "female", "age": 36, "country": "Egypt", "marital_status": "married", "education": "middle", "social_class": "upper middle class"}, "question": {"id": "Q149", "variant": 0}, "response": ["Based on the anthropological framework, as a married female from Cairo, Egypt, my emic perspective is shaped by the cultural context of the region, where gender roles and expectations are deeply ingrained. As a member of the upper middle class, my socioeconomic background influences my values and beliefs, and I may prioritize personal freedom within the constraints of societal expectations. Additionally, my personal experiences and individual values are crucial in shaping my understanding of the importance of freedom or equality. Considering the nuanced phrasing of the question, I would argue that in my opinion, freedom is more important because it allows individuals to make choices and pursue their goals within the cultural and societal norms of my context.\n\n1"]}, {"persona": {"region": "Cairo", "sex": "male", "age": 40, "country": "Egypt", "marital_status": "married", "education": "middle", "social_class": "lower middle class"}, "question": {"id": "Q149", "variant": 0}, "response": ["Based on the anthropological framework, my cultural context as a married male from Cairo, Egypt, who is 40 years old and part of the lower middle class, plays a significant role in shaping my perspective. My personal experience and individual values are influenced by the socio-economic background and cultural context of my community. In a society like mine where there are socioeconomic disparities and limited opportunities, freedom may be seen as more important as it allows individuals to pursue their own goals and aspirations without undue restrictions. Additionally, the cultural relativism perspective reminds us that there is no universal answer and different cultures may prioritize different values. Therefore, considering my background and cultural context, I would choose:\n\n2"]}, {"persona": {"region": "Cairo", "sex": "female", "age": 30, "country": "Egypt", "marital_status": "married", "education": "middle", "social_class": "lower class"}, "question": {"id": "Q149", "variant": 0}, "response": ["Based on my personal experience and cultural context as a married woman from Cairo, Egypt, belonging to the lower class, I have seen the importance of equality in our society. The socioeconomic background and cultural relativism of my community have shaped my understanding of the value of equality, as many individuals in my community face similar struggles and inequalities. Additionally, the nuance of the question leads me to believe that in our context, equality is more important as it directly impacts the well-being and opportunities of individuals in my community. 2"]}, {"persona": {"region": "Cairo", "sex": "male", "age": 58, "country": "Egypt", "marital_status": "married", "education": "higher", "social_class": "lower middle class"}, "question": {"id": "Q149", "variant": 0}, "response": ["Based on the anthropological framework, my perspective as a 58-year-old married male from Cairo, Egypt, who considers himself part of the lower middle class, is heavily influenced by my cultural context, individual values, and socioeconomic background. In Egypt, there is a strong emphasis on familial and community ties, and the concept of equality is often linked to social justice and fair treatment for all. Additionally, as someone who has completed higher education, I value the idea of equal opportunities for all individuals. However, my socioeconomic background also plays a significant role in shaping my perspective, as the pursuit of freedom, particularly economic freedom, is crucial for improving the quality of life and securing a better future for my family. Therefore, based on my personal experience and values, I believe that freedom is more important than equality in my current circumstances.\n\n1"]}, {"persona": {"region": "Cairo", "sex": "male", "age": 50, "country": "Egypt", "marital_status": "married", "education": "middle", "social_class": "lower middle class"}, "question": {"id": "Q149", "variant": 0}, "response": ["Based on the anthropological framework, my response is informed by my cultural context as a married male from Cairo, Egypt, where individual values and personal experience play a major role in shaping perspectives. My socioeconomic background as part of the lower middle class also influences my answer. In this cultural context, the nuanced phrasing of the question is also important. Considering these factors, I believe that freedom is more important in my opinion. \n\n1"]}, {"persona": {"region": "Cairo", "sex": "female", "age": 40, "country": "Egypt", "marital_status": "married", "education": "higher", "social_class": "upper middle class"}, "question": {"id": "Q149", "variant": 0}, "response": ["From an anthropological perspective, my cultural context as a married female from Cairo, Egypt, and my age, education, and socioeconomic background all play a significant role in shaping my view on the importance of freedom or equality. In Egyptian society, there is a strong emphasis on family and community, and the cultural values place a high importance on equality, particularly in terms of gender and social justice. Additionally, my higher education has provided me with the knowledge and critical thinking skills to understand the complexities of these concepts. Considering these factors, I believe that equality is more important than freedom, as it ensures that everyone has the same opportunities and rights, leading to a more just and harmonious society.\n\n2"]}, {"persona": {"region": "Cairo", "sex": "female", "age": 33, "country": "Egypt", "marital_status": "married", "education": "middle", "social_class": "lower middle class"}, "question": {"id": "Q149", "variant": 0}, "response": ["From the perspective of a married female from Cairo, Egypt, at 33 years of age, with a middle education level, and part of the lower middle class, my answer is influenced by a combination of factors. Firstly, the cultural context in Cairo and Egypt as a whole places a strong emphasis on the value of equality, particularly in terms of gender equality. Additionally, my personal experience as a woman in this society has led me to prioritize equality as a fundamental aspect of my daily life and the opportunities available to me. As a member of the lower middle class, socioeconomic background also plays a role in my perspective, as access to equal opportunities and resources is important for upward mobility. Finally, the nuanced phrasing of the question leads me to choose equality as the more important value, as it is crucial for the overall well-being and progress of society.\n\n2"]}, {"persona": {"region": "Cairo", "sex": "female", "age": 37, "country": "Egypt", "marital_status": "married", "education": "middle", "social_class": "lower middle class"}, "question": {"id": "Q149", "variant": 0}, "response": ["Based on the anthropological framework, my perspective is heavily influenced by my cultural context, socioeconomic background, and personal experience. Growing up in Cairo, Egypt, I have been exposed to a society where freedom is often restricted, and equality is not always a priority. As a married woman from the lower middle class, I have experienced firsthand the limitations placed on individuals based on their socioeconomic status and gender. Therefore, I believe that equality is more important than freedom in my context.\n\n2"]}, {"persona": {"region": "Cairo", "sex": "male", "age": 28, "country": "Egypt", "marital_status": "married", "education": "middle", "social_class": "lower middle class"}, "question": {"id": "Q149", "variant": 0}, "response": ["Based on the anthropological framework, my perspective is influenced by my cultural context, individual values and personal experiences, and socioeconomic background. Coming from Cairo, Egypt, I have been shaped by the cultural values and norms of my society, which prioritize collective equality and social harmony. Additionally, as a lower middle class individual, I have experienced firsthand the challenges and disparities that come with socioeconomic inequality. Therefore, I believe that equality is more important than freedom, as it is the foundation for a fair and just society that benefits all individuals.\n\n2"]}, {"persona": {"region": "Cairo", "sex": "male", "age": 53, "country": "Egypt", "marital_status": "married", "education": "higher", "social_class": "working class"}, "question": {"id": "Q149", "variant": 0}, "response": ["Based on my cultural context and personal experience as a married male from Cairo, Egypt, I understand that the importance of freedom and equality may be perceived differently in different cultural and socioeconomic contexts. In Egypt, the value of freedom is often tied to political and social rights, while equality may be more related to economic and social opportunities. As a working-class individual who has experienced the challenges and limitations of socioeconomic status, I believe that equality is more important than freedom. In a society where there is a significant gap between the rich and the poor, prioritizing equality can lead to greater social justice and opportunities for all individuals to thrive. Additionally, cultural relativism teaches us to understand and respect the values and perspectives of different societies, and in my context, the emphasis on equality resonates deeply with the experiences and values of many people in Cairo.\n\n2"]}, {"persona": {"region": "Cairo", "sex": "male", "age": 45, "country": "Egypt", "marital_status": "married", "education": "higher", "social_class": "lower middle class"}, "question": {"id": "Q149", "variant": 0}, "response": ["Based on the anthropological framework, as a married male from Cairo, Egypt, my emic perspective is influenced by the cultural context of living in a country with a history of political and social change. My individual values and personal experiences have shaped my belief that freedom is more important, as I have seen the struggle for individual rights and liberties in my community. Additionally, my lower middle class socioeconomic background has influenced my belief that freedom allows for upward mobility and the pursuit of a better life for myself and my family. Furthermore, the cultural relativism of Egypt emphasizes the importance of personal freedoms and the right to self-determination. Therefore, I believe that freedom is more important than equality in my context.\n\n1"]}, {"persona": {"region": "Cairo", "sex": "male", "age": 52, "country": "Egypt", "marital_status": "married", "education": "middle", "social_class": "upper middle class"}, "question": {"id": "Q149", "variant": 0}, "response": ["Based on the anthropological framework, my perspective is influenced by my cultural context as a married male from Cairo, Egypt, where there is a strong emphasis on traditional gender roles and social hierarchies. My individual values and personal experience, along with my socioeconomic background as part of the upper middle class, also play a significant role in shaping my views. Additionally, the emphasis on cultural relativism reminds me that my perspective is subjective and shaped by my specific cultural and socioeconomic context. Taking into account the nuanced phrasing of the question, I believe that in my cultural context, freedom holds greater importance than equality.\n\n1"]}, {"persona": {"region": "Cairo", "sex": "male", "age": 22, "country": "Egypt", "marital_status": "single", "education": "higher", "social_class": "lower middle class"}, "question": {"id": "Q149", "variant": 0}, "response": ["Based on the anthropological framework provided, as a single male from Cairo, Egypt, my emic perspective, cultural context, individual values, and socioeconomic background all influence my answer to the question. In my cultural context, there is a strong emphasis on community and equality, as well as a history of struggle for political freedom. As a member of the lower middle class, my personal experiences and values have been shaped by the challenges and inequalities I have faced. Therefore, I believe that equality is more important than freedom, as it is essential for creating a fair and just society in which all individuals have the opportunity to thrive. \n2"]}, {"persona": {"region": "Cairo", "sex": "female", "age": 57, "country": "Egypt", "marital_status": "divorced", "education": "middle", "social_class": "lower middle class"}, "question": {"id": "Q149", "variant": 0}, "response": ["Based on the anthropological framework, I, as a divorced female from Cairo, Egypt, must consider the emic and etic perspectives, cultural context, individual values and personal experience, socioeconomic background, cultural relativism, space and time, and nuance when answering this question. As a middle-aged woman from a lower middle-class background in Cairo, I have experienced firsthand the struggles of inequality in my society. I have seen how gender and class can limit one's freedom and opportunities. Therefore, from my perspective, equality is more important than freedom. I believe that everyone should have equal access to opportunities and rights, regardless of their gender or socioeconomic status.\n\n2"]}, {"persona": {"region": "Cairo", "sex": "female", "age": 42, "country": "Egypt", "marital_status": "married", "education": "middle", "social_class": "working class"}, "question": {"id": "Q149", "variant": 0}, "response": ["From the anthropological framework, my cultural context as a married female from Cairo, Egypt, with a middle education level and part of the working class, plays a significant role in how I perceive and answer this question. My individual values and personal experience, along with my socioeconomic background, have shaped my understanding of freedom and equality. In the context of Egypt, where there are socio-political challenges and economic disparities, I believe that equality is more important than freedom. The cultural relativism in Egypt emphasizes the importance of social justice and fair distribution of resources, and with my background and experiences, I see equality as a crucial factor in addressing the societal issues that we face. \n\n2"]}, {"persona": {"region": "Cairo", "sex": "female", "age": 23, "country": "Egypt", "marital_status": "single", "education": "middle", "social_class": "lower middle class"}, "question": {"id": "Q149", "variant": 0}, "response": ["Based on the anthropological framework, as a single female from Cairo, Egypt, my emic perspective is influenced by the cultural context of living in a patriarchal society where gender roles and expectations play a significant role in shaping my experiences. My individual values and personal experiences as a lower middle-class woman in Egypt also influence my perspective, as I have likely encountered limitations on my freedom due to societal and cultural norms. Additionally, my socioeconomic background and age play a role in shaping my views on freedom and equality. Considering these factors, I would prioritize equality over freedom, as I believe that achieving equality for women in Egyptian society is crucial for addressing the systemic injustices and limitations that impact my life and the lives of other women in my community.\n\n2"]}, {"persona": {"region": "Cairo", "sex": "female", "age": 28, "country": "Egypt", "marital_status": "married", "education": "higher", "social_class": "upper middle class"}, "question": {"id": "Q149", "variant": 0}, "response": ["Based on the anthropological framework, as a married female from Cairo, Egypt, my emic perspective is heavily influenced by my cultural context, individual values, and personal experience. In my society, the value of equality is paramount, as Egypt has a long history of striving for social justice and egalitarianism. Additionally, my higher education level and upper middle-class status also shape my perspective, as I have been exposed to ideas of social and economic equality. Therefore, I believe that equality is more important than freedom in my cultural context.\n\n2"]}, {"persona": {"region": "Cairo", "sex": "female", "age": 22, "country": "Egypt", "marital_status": "single", "education": "higher", "social_class": "lower middle class"}, "question": {"id": "Q149", "variant": 0}, "response": ["From an anthropological perspective, my individual values and personal experiences as a single female from Cairo, Egypt, play a significant role in shaping my perspective on the importance of freedom or equality. As a member of the lower middle class and a young adult who has completed higher education, I have experienced firsthand the struggles and limitations that come with socioeconomic background and gender. The cultural context of Egypt also plays a role, as it is a society with traditional gender roles and societal expectations. Additionally, the space and time factor of being 22 years old in Cairo influences my viewpoint. Given my personal experiences and cultural context, I believe that equality is more important than freedom. \n\n2"]}, {"persona": {"region": "Cairo", "sex": "female", "age": 39, "country": "Egypt", "marital_status": "married", "education": "middle", "social_class": "lower middle class"}, "question": {"id": "Q149", "variant": 0}, "response": ["Based on my personal experience and cultural context as a married female from Cairo, Egypt, at the age of 39 and part of the lower middle class, I understand the importance of both freedom and equality. In my cultural context, there is a strong emphasis on the importance of equality, as it is seen as a fundamental aspect of a just society. However, considering my socioeconomic background and the challenges I face, I value freedom as being more important in my daily life. As a woman in a patriarchal society, I prioritize the freedom to make my own choices and pursue my own goals. Therefore, I choose option (1) Freedom."]}, {"persona": {"region": "Cairo", "sex": "male", "age": 19, "country": "Egypt", "marital_status": "single", "education": "middle", "social_class": "working class"}, "question": {"id": "Q149", "variant": 0}, "response": ["Based on the anthropological framework, my perspective is heavily influenced by my cultural context, individual values, and socioeconomic background. As a young working-class male from Cairo, Egypt, I have been raised in a society where freedom is highly valued, but equality is also a significant concern due to the socioeconomic disparities in my community. My personal experiences and values have shaped my belief that both freedom and equality are important, but given the current circumstances, I believe that equality holds more weight for me personally.\n\n2"]}, {"persona": {"region": "Cairo", "sex": "female", "age": 54, "country": "Egypt", "marital_status": "married", "education": "middle", "social_class": "working class"}, "question": {"id": "Q149", "variant": 0}, "response": ["From an anthropological perspective, my cultural context as a married female from Cairo, Egypt, at the age of 54 and part of the working class, greatly influences my perspective on this question. The emic and etic perspectives of my socio-economic background, cultural context, and personal experience all play a role in shaping my answer. In Egypt, there is a strong emphasis on equality, particularly in terms of gender and social class. As a working-class woman, I have personally experienced the importance of equality in access to opportunities and resources. Additionally, cultural relativism teaches us to understand and respect different cultural values and beliefs, and in Egypt, the emphasis on equality is deeply ingrained. Therefore, based on my personal experience and cultural context, I believe that equality is more important than freedom. \n\n2"]}, {"persona": {"region": "Cairo", "sex": "male", "age": 30, "country": "Egypt", "marital_status": "married", "education": "higher", "social_class": "working class"}, "question": {"id": "Q149", "variant": 0}, "response": ["Based on the anthropological framework, my perspective is shaped by my cultural context as a married male from Cairo, Egypt, where societal values and norms play a significant role in shaping my beliefs. My individual values and personal experience, including my socioeconomic background as a working-class individual, also influence my perception of the world. Additionally, my age and education level contribute to my understanding of the importance of freedom and equality. Considering the cultural relativism of my perspective, I believe that freedom holds greater importance in my society, as it allows individuals to pursue their own paths and make choices that align with their personal values and aspirations. Therefore, I choose option 1: Freedom."]}, {"persona": {"region": "Cairo", "sex": "male", "age": 39, "country": "Egypt", "marital_status": "married", "education": "higher", "social_class": "lower middle class"}, "question": {"id": "Q149", "variant": 0}, "response": ["Based on the anthropological framework, my perspective as a married male from Cairo, Egypt, who is 39 years old and part of the lower middle class, is influenced by my cultural context, socioeconomic background, and personal experience. In Egypt, there is a strong emphasis on family and community, and the value of equality is highly regarded. Additionally, as someone from the lower middle class, I have personally experienced the impact of socioeconomic disparities and the importance of striving for equality. Therefore, considering these factors, I believe that equality is more important than freedom.\n\n2"]}, {"persona": {"region": "Cairo", "sex": "female", "age": 41, "country": "Egypt", "marital_status": "married", "education": "middle", "social_class": "lower middle class"}, "question": {"id": "Q149", "variant": 0}, "response": ["Based on the anthropological framework, my perspective is heavily influenced by my cultural context, socioeconomic background, and individual values. As a married female from Cairo, Egypt, I have experienced the societal expectations and limitations placed on women in my country. My lower middle class status also means that I have faced economic challenges and lack of opportunities. Additionally, my age and educational level have shaped my understanding of freedom and equality. Considering these factors, I believe that equality is more important than freedom because without equality, individuals like me are unable to access the same rights and opportunities as others in society.\n\n2"]}, {"persona": {"region": "Cairo", "sex": "male", "age": 45, "country": "Syria", "marital_status": "single", "education": "higher", "social_class": "upper middle class"}, "question": {"id": "Q149", "variant": 0}, "response": ["Based on the anthropological framework, my perspective as a single male from Cairo, Syria, who is 45 years old, highly educated, and part of the upper middle class is shaped by my cultural context, individual values, and socioeconomic background. In Syria, the cultural context emphasizes the importance of freedom and individual rights, as well as the value placed on education and achievement. As someone from the upper middle class, I have enjoyed certain freedoms and privileges that others may not have had access to, and I have been able to pursue higher education and professional success. Therefore, I believe that freedom is more important as it has allowed me to achieve my goals and live a fulfilling life. \n\n1"]}, {"persona": {"region": "Cairo", "sex": "male", "age": 54, "country": "Egypt", "marital_status": "married", "education": "higher", "social_class": "lower middle class"}, "question": {"id": "Q149", "variant": 0}, "response": ["Based on the anthropological framework, as a married male from Cairo, Egypt, my emic perspective is heavily influenced by the cultural context and socioeconomic background in which I live. In Egypt, there is a strong emphasis on collective values and social harmony, which aligns with the importance of equality. Additionally, as a member of the lower middle class, I am acutely aware of the disparities in wealth and social status in our society, making equality a priority for me. Furthermore, my personal experience and age have shaped my values to prioritize the well-being and fairness of the community over individual freedoms. Therefore, based on my cultural context, values, and background, I believe that equality is more important.\n\n2"]}, {"persona": {"region": "Cairo", "sex": "male", "age": 65, "country": "Egypt", "marital_status": "married", "education": "middle", "social_class": "upper middle class"}, "question": {"id": "Q149", "variant": 0}, "response": ["Based on the anthropological framework, my perspective is heavily influenced by my cultural context, individual values, and socioeconomic background. In Egyptian culture, there is a strong emphasis on personal freedom and individual rights, which aligns with my own personal values. Additionally, my upper middle-class status affords me a level of freedom and privilege that may not be as readily available to those in lower socioeconomic brackets. Therefore, I believe that freedom is more important than equality in this context. \n\n1"]}, {"persona": {"region": "Cairo", "sex": "female", "age": 52, "country": "Egypt", "marital_status": "married", "education": "middle", "social_class": "upper middle class"}, "question": {"id": "Q149", "variant": 0}, "response": ["Based on my cultural context and individual values, as a married female from Cairo, Egypt, who is part of the upper middle class and has completed middle education, my perspective on the importance of freedom or equality is influenced by my socioeconomic background and personal experience. In the context of Egypt, where there has been a long history of social and political upheaval, I believe that freedom is more important. The ability to express oneself, have personal autonomy, and make choices without fear of repression is crucial for progress and development. Although equality is important, I believe that without freedom, true equality cannot be achieved. Therefore, I would choose:\n\n1"]}, {"persona": {"region": "Cairo", "sex": "male", "age": 26, "country": "Egypt", "marital_status": "single", "education": "higher", "social_class": "lower middle class"}, "question": {"id": "Q149", "variant": 0}, "response": ["Based on the anthropological framework, as a single male from Cairo, Egypt, I am influenced by my cultural context, socioeconomic background, and individual values. In Egypt, there is a strong emphasis on collective equality and social justice, given the country's history of social movements and revolutions. As a member of the lower middle class, I am keenly aware of the inequalities that exist within society, and I prioritize equality as a means to address these disparities. Additionally, my personal experience and values are shaped by the social and political climate of Egypt, where the pursuit of equality is seen as a fundamental and necessary goal for societal progress. Therefore, I choose option (2) Equality."]}, {"persona": {"region": "Cairo", "sex": "male", "age": 32, "country": "Egypt", "marital_status": "married", "education": "middle", "social_class": "working class"}, "question": {"id": "Q149", "variant": 0}, "response": ["Based on the anthropological framework, my perspective is heavily influenced by my cultural context, socioeconomic background, and personal experience. As a married male from Cairo, Egypt, I come from a society with a rich cultural history and a strong emphasis on community and family. My working-class background and middle education level have shaped my values and beliefs, leading me to prioritize the well-being of my family and community. In this context, equality is more important to me as it ensures that everyone has access to the same opportunities and resources, creating a fair and just society. Therefore, I believe that option (2) Equality is more important."]}, {"persona": {"region": "Cairo", "sex": "male", "age": 38, "country": "Egypt", "marital_status": "married", "education": "middle", "social_class": "lower middle class"}, "question": {"id": "Q149", "variant": 0}, "response": ["Based on the anthropological framework, as a married male from Cairo, Egypt, I am influenced by my cultural context, socioeconomic background, and individual values. In Egypt, there is a strong emphasis on family and community, and the concept of equality is often tied to social justice and fairness. As a member of the lower middle class, I may prioritize equality as it may directly impact my access to resources and opportunities. Additionally, my personal experience and values may lead me to prioritize equality as a means of addressing social and economic disparities within my community. Therefore, I believe that equality is more important.\n\n2"]}, {"persona": {"region": "Cairo", "sex": "male", "age": 58, "country": "Egypt", "marital_status": "married", "education": "higher", "social_class": "upper middle class"}, "question": {"id": "Q149", "variant": 0}, "response": ["From the perspective of a married, 58-year-old male from Cairo, Egypt, who considers himself part of the upper middle class, my answer to the question of whether freedom or equality is more important is influenced by a combination of cultural context, individual values, and socioeconomic background. In Egypt, there is a strong emphasis on traditional values and social hierarchies, and the concept of equality may be perceived differently than in Western societies. Additionally, as someone who has achieved a higher education level and considers themselves part of the upper middle class, the value of individual freedom and autonomy may be prioritized. However, it is also important to consider the cultural relativism and nuanced understanding of the question, as the perceived importance of freedom and equality may be shaped by the specific cultural and socioeconomic context of Egypt. Therefore, my answer to the question from this perspective is:\n\n2) Equality"]}, {"persona": {"region": "Cairo", "sex": "male", "age": 49, "country": "Egypt", "marital_status": "married", "education": "middle", "social_class": "lower middle class"}, "question": {"id": "Q149", "variant": 0}, "response": ["Based on my cultural context as a married male from Cairo, Egypt, my emic perspective is heavily influenced by the societal values and norms that prioritize community and collective well-being over individual freedom. Additionally, my lower middle-class socioeconomic background has shaped my understanding of the importance of equality in access to resources and opportunities. My personal experience and individual values also lead me to prioritize equality as a means of ensuring fairness and justice for all members of society. Therefore, I believe that equality is more important than freedom.\n\n2"]}, {"persona": {"region": "Cairo", "sex": "female", "age": 29, "country": "Egypt", "marital_status": "married", "education": "middle", "social_class": "working class"}, "question": {"id": "Q149", "variant": 0}, "response": ["Based on the anthropological framework, as a married female from Cairo, Egypt, my perspective is heavily influenced by the cultural context, individual values, and socioeconomic background. In Egypt, there is a strong emphasis on traditional gender roles and family values, which impact my understanding of freedom and equality. As a member of the working class, my socioeconomic background also plays a significant role in shaping my perspective. Additionally, my age and education level contribute to my nuanced understanding of these concepts. Considering all these factors, I believe that equality is more important than freedom. \n\n2"]}, {"persona": {"region": "Cairo", "sex": "female", "age": 36, "country": "Egypt", "marital_status": "married", "education": "higher", "social_class": "lower middle class"}, "question": {"id": "Q149", "variant": 0}, "response": ["Based on the anthropological framework, as a married woman from Cairo, Egypt, my emic perspective is influenced by the cultural context of my society, where traditional gender roles and expectations are prevalent. My personal experience and individual values also play a significant role in shaping my perception. As someone from the lower middle class, my socioeconomic background affects my understanding of freedom and equality. In this context, I believe that equality is more important than freedom because of the importance of social cohesion and stability in our community.\n\n2"]}, {"persona": {"region": "Cairo", "sex": "female", "age": 34, "country": "Egypt", "marital_status": "married", "education": "middle", "social_class": "lower middle class"}, "question": {"id": "Q149", "variant": 0}, "response": ["Based on the anthropological framework, as a married female from Cairo, Egypt, my emic perspective is influenced by my cultural context, individual values, and socioeconomic background. In my cultural context, there are traditional gender roles and expectations placed on women, which may influence my perception of freedom and equality. Additionally, my lower middle class socioeconomic background may shape my understanding of the importance of freedom and equality in accessing resources and opportunities. Therefore, based on my nuanced understanding and personal experiences, I believe that equality is more important than freedom.\n\n2"]}, {"persona": {"region": "Fayoum", "sex": "male", "age": 57, "country": "Egypt", "marital_status": "married", "education": "middle", "social_class": "working class"}, "question": {"id": "Q149", "variant": 0}, "response": ["Based on the anthropological framework, as a married male from Fayoum, Egypt, my perspective is heavily influenced by my cultural context, individual values, and socioeconomic background. In my community, the concept of equality is often associated with social justice and fairness, which is important to me as a working-class individual. However, my personal experience and values also place a high value on individual freedom and autonomy. Additionally, my age and education level contribute to my understanding of the importance of freedom in making personal choices. Considering these factors, I believe that freedom is more important in my opinion.\n\n1"]}, {"persona": {"region": "Fayoum", "sex": "male", "age": 60, "country": "Egypt", "marital_status": "married", "education": "middle", "social_class": "lower middle class"}, "question": {"id": "Q149", "variant": 0}, "response": ["Based on my cultural context coming from Fayoum, Egypt, and being part of the lower middle class, I have learned to value the importance of individual freedom. In our society, personal autonomy and the ability to make choices for oneself are highly regarded, especially as we strive for upward mobility. Additionally, my age and socioeconomic background have shaped my understanding of the world, leading me to prioritize personal freedom over equality. Furthermore, cultural relativism reminds us that there is no universal standard for what is considered \"good\" or \"right\" and that different cultures may prioritize different values. Therefore, I would choose:\n\n1"]}, {"persona": {"region": "Fayoum", "sex": "male", "age": 21, "country": "Egypt", "marital_status": "single", "education": "middle", "social_class": "lower middle class"}, "question": {"id": "Q149", "variant": 0}, "response": ["Based on the anthropological framework, as a single male from Fayoum, Egypt, who has completed middle education and considers myself part of the lower middle class, my perspective is heavily influenced by my cultural context, individual values, and socioeconomic background. In my community, freedom may be more important as it allows me to pursue opportunities and make choices that can improve my socioeconomic status. Additionally, my personal experience and values may lead me to prioritize freedom as a means of seeking a better life for myself and my family. However, I also recognize the importance of equality in providing fair opportunities for all individuals, regardless of their background. Ultimately, my perspective is shaped by a nuanced understanding of the question and the influence of my cultural and socioeconomic context.\n\n2"]}, {"persona": {"region": "Fayoum", "sex": "male", "age": 33, "country": "Egypt", "marital_status": "single", "education": "higher", "social_class": "working class"}, "question": {"id": "Q149", "variant": 0}, "response": ["Based on the anthropological framework outlined above, my perspective is heavily influenced by my cultural context, individual values, and socioeconomic background. Growing up in Fayoum, Egypt, I have been shaped by the cultural values and norms of my community, which prioritize equality and social cohesion. Additionally, as a member of the working class, I have experienced firsthand the impact of socioeconomic disparities and the importance of equal opportunities for all individuals. Therefore, I believe that equality is more important than freedom in promoting a fair and just society.\n\n2"]}, {"persona": {"region": "Fayoum", "sex": "male", "age": 32, "country": "Egypt", "marital_status": "married", "education": "higher", "social_class": "lower middle class"}, "question": {"id": "Q149", "variant": 0}, "response": ["Based on the anthropological framework provided, as a married male from Fayoum, Egypt, I would consider my cultural context, individual values, and socioeconomic background in answering this question. In my culture, there is a strong emphasis on familial ties and community cohesion, where equality is often valued. Additionally, as part of the lower middle class, I have experienced firsthand the impact of inequality and the importance of striving for equal opportunities. However, my personal experience and values also lead me to value freedom, particularly in terms of personal autonomy and the ability to make choices for oneself. Therefore, considering my cultural context, individual values, and socioeconomic background, I believe that equality is more important. \n\n2"]}, {"persona": {"region": "Gharbia", "sex": "male", "age": 42, "country": "Egypt", "marital_status": "married", "education": "higher", "social_class": "upper middle class"}, "question": {"id": "Q149", "variant": 0}, "response": ["Based on my anthropological perspective, my answer to this question is influenced by my personal experience, cultural context, and socioeconomic background. As a married male from Gharbia, Egypt, I have been raised in a society where certain cultural values and norms emphasize the importance of equality within the family and community. Additionally, my higher education level and upper middle-class status have provided me with a certain level of privilege and access to opportunities. Considering these factors, I believe that equality is more important as it ensures fairness and justice for all individuals, regardless of their socioeconomic status or personal circumstances.\n\n2"]}, {"persona": {"region": "Gharbia", "sex": "male", "age": 52, "country": "Egypt", "marital_status": "married", "education": "middle", "social_class": "working class"}, "question": {"id": "Q149", "variant": 0}, "response": ["Based on the anthropological framework, my perspective is influenced by my cultural context, individual values, and socioeconomic background. As a married male from Gharbia, Egypt, my understanding of freedom and equality is shaped by my experiences and the values of the working class. In my community, there is a strong emphasis on the value of equality, as we believe in the fair treatment of all individuals regardless of their socioeconomic status. Additionally, my middle education level has exposed me to the importance of equality in creating a just society. Therefore, based on my cultural context and personal values, I believe that equality is more important than freedom.\n\n2"]}, {"persona": {"region": "Gharbia", "sex": "male", "age": 45, "country": "Egypt", "marital_status": "divorced", "education": "higher", "social_class": "upper middle class"}, "question": {"id": "Q149", "variant": 0}, "response": ["Based on my personal experience and socioeconomic background as a divorced male from Gharbia, Egypt, who considers himself part of the upper middle class, I prioritize freedom over equality. In my cultural context, freedom allows individuals to make their own choices and pursue their own goals, which is essential for personal fulfillment and success. Additionally, my higher education level has taught me the value of individual autonomy and the importance of personal agency. In my community, there is a strong emphasis on self-determination and the ability to exercise one's rights and liberties. Therefore, I believe that freedom is more important than equality in achieving personal and societal progress. \n\n1"]}, {"persona": {"region": "Behaira", "sex": "male", "age": 23, "country": "Egypt", "marital_status": "single", "education": "middle", "social_class": "lower class"}, "question": {"id": "Q149", "variant": 0}, "response": ["Based on my cultural context, as a lower-class male from Behaira, Egypt, my individual values and personal experience lead me to prioritize freedom over equality. In my community, there are limited opportunities for social and economic mobility, so the ability to make choices and pursue my own goals is essential to me. Additionally, my socioeconomic background has shaped my understanding of the world, and I believe that having the freedom to make decisions and control my own destiny is more important than striving for equality, which may not be realistically attainable in my current circumstances.\n\n1"]}, {"persona": {"region": "Behaira", "sex": "male", "age": 38, "country": "Egypt", "marital_status": "single", "education": "higher", "social_class": "lower class"}, "question": {"id": "Q149", "variant": 0}, "response": ["Based on my cultural context, socioeconomic background, individual values, and personal experience, I believe that as a single male from Behaira, Egypt, who considers himself part of the lower class, equality is more important than freedom. In my community, there is a strong emphasis on social cohesion and solidarity, and achieving equality is crucial for ensuring that everyone has access to the same opportunities and resources. Additionally, considering the socioeconomic challenges that I have faced, I believe that prioritizing equality can lead to a more just and fair society for all individuals, including myself.\n\n2"]}, {"persona": {"region": "Behaira", "sex": "male", "age": 32, "country": "Egypt", "marital_status": "married", "education": "middle", "social_class": "lower class"}, "question": {"id": "Q149", "variant": 0}, "response": ["Based on my cultural context and socioeconomic background, as a married male from Behaira, Egypt, I have been raised to value freedom over equality. In my community, individual freedoms are highly cherished and prioritized, especially given the political and social context of Egypt. Additionally, my personal experience and values have shaped my belief that the ability to make choices and live without restrictions is crucial for personal fulfillment and happiness. Furthermore, my lower socioeconomic background has made me acutely aware of the disparities in wealth and opportunities, leading me to believe that striving for equality may not be as attainable as fighting for individual freedoms. Therefore, considering my cultural context, personal experience, and socioeconomic background, I firmly believe that freedom is more important than equality.\n\n1"]}, {"persona": {"region": "Behaira", "sex": "female", "age": 37, "country": "Egypt", "marital_status": "married", "education": "middle", "social_class": "working class"}, "question": {"id": "Q149", "variant": 0}, "response": ["Based on the anthropological framework, my perspective is heavily influenced by my cultural context, individual values, and socioeconomic background. As a married female from Behaira, Egypt, I have experienced firsthand the importance of equality in a society where gender roles are still heavily ingrained. My middle education level and working-class status also contribute to my belief in the importance of equal opportunities for all individuals, regardless of their socioeconomic status. Additionally, my age and place in society have shaped my understanding of the need for equality in order to create a more fair and just society. Therefore, I firmly believe that equality is more important than freedom in our current societal context.\n\n2"]}, {"persona": {"region": "Behaira", "sex": "male", "age": 48, "country": "Egypt", "marital_status": "married", "education": "middle", "social_class": "working class"}, "question": {"id": "Q149", "variant": 0}, "response": ["From the anthropological framework described above, my answer is based on my cultural context as a married male from Behaira, Egypt, with a middle education level and part of the working class. My individual values and personal experience, along with my socioeconomic background, play a significant role in shaping my perception. Additionally, my age and place also factor into my response. Considering the nuances of the question, I believe that freedom is more important in my opinion, as it aligns with my personal experiences and cultural context. \n\n1"]}, {"persona": {"region": "Behaira", "sex": "female", "age": 34, "country": "Egypt", "marital_status": "married", "education": "middle", "social_class": "lower class"}, "question": {"id": "Q149", "variant": 0}, "response": ["Based on the anthropological framework, my answer is influenced by my cultural context as a married female from Behaira, Egypt, where traditional gender roles and societal expectations play a significant role. My individual values and personal experience also shape my perspective, as I have likely experienced challenges and limitations due to my socioeconomic background and educational level. Additionally, the cultural relativism aspect reminds me that my understanding of freedom and equality may differ from others. Therefore, considering my age and place, I believe that prioritizing equality is more important for me and my community. \n\n2"]}, {"persona": {"region": "Behaira", "sex": "female", "age": 30, "country": "Egypt", "marital_status": "divorced", "education": "lower", "social_class": "lower class"}, "question": {"id": "Q149", "variant": 0}, "response": ["Based on the anthropological framework, my emic perspective as a divorced female from Behaira, Egypt, who is part of the lower class, is influenced by my cultural context, individual values, and socioeconomic background. In my cultural context, freedom may be more important to me as a way to break free from traditional gender roles and societal expectations. Additionally, my individual values and personal experiences may lead me to prioritize freedom as I seek independence and autonomy after my divorce. Furthermore, my socioeconomic background as a lower-class individual may make me value freedom as a way to overcome economic limitations and social inequalities. Therefore, taking into account my cultural context, individual values, and socioeconomic background, I choose Option 1: Freedom. \n\n1"]}, {"persona": {"region": "Behaira", "sex": "male", "age": 40, "country": "Egypt", "marital_status": "married", "education": "higher", "social_class": "lower middle class"}, "question": {"id": "Q149", "variant": 0}, "response": ["From my perspective as a married male from Behaira, Egypt, with a lower middle-class socioeconomic background, I have been influenced by the cultural context in which I have grown up. In my community, personal freedom is highly valued, as it allows individuals to make choices for themselves and pursue their own paths in life. Additionally, my personal experience and individual values place a high emphasis on freedom as a means of personal fulfillment and autonomy. However, I also recognize the importance of equality in ensuring that all members of society have fair opportunities and access to resources. This understanding is shaped by the cultural relativism that I have learned through my experiences and interactions within my community. Overall, I believe that while both freedom and equality are important, in my particular cultural context, freedom holds greater significance in allowing individuals to pursue their own paths and make choices for themselves.\n\n2"]}, {"persona": {"region": "Behaira", "sex": "male", "age": 38, "country": "Egypt", "marital_status": "married", "education": "middle", "social_class": "working class"}, "question": {"id": "Q149", "variant": 0}, "response": ["Based on the anthropological framework, my perspective is influenced by my individual values and personal experience, as well as my socioeconomic background and cultural context. As a married male from Behaira, Egypt, at 38 years old and part of the working class, I value the freedom to make choices for myself and my family. My personal experience and cultural context have shaped my belief that freedom allows for individual growth and self-determination, which are essential for me and others in my community. Additionally, my socioeconomic background as part of the working class has influenced my perspective on the importance of freedom in pursuing opportunities and improving our circumstances. Therefore, from my perspective, I believe that (1) Freedom is more important.\n\n1"]}, {"persona": {"region": "Behaira", "sex": "female", "age": 30, "country": "Egypt", "marital_status": "married", "education": "higher", "social_class": "lower class"}, "question": {"id": "Q149", "variant": 0}, "response": ["Based on the anthropological framework, my perspective is heavily influenced by my cultural context, socioeconomic background, and personal values. As a married female from Behaira, Egypt, I come from a lower class background and have experienced firsthand the challenges and limitations that come with this socioeconomic status. My cultural context, including the traditional gender roles and expectations in my community, also shapes my understanding of freedom and equality. Additionally, my higher education has exposed me to different perspectives on these concepts. Considering all these factors, I believe that equality is more important than freedom. In my community, the lack of equality has led to numerous injustices and disparities, and I believe that prioritizing equality will lead to a more just and fair society.\n\n2"]}, {"persona": {"region": "Behaira", "sex": "female", "age": 35, "country": "Egypt", "marital_status": "married", "education": "middle", "social_class": "working class"}, "question": {"id": "Q149", "variant": 0}, "response": ["Based on the anthropological framework, as a married female from Behaira, Egypt, my emic perspective is influenced by my cultural context, individual values, socioeconomic background, and space and time. In my cultural context, there are traditional gender roles and expectations that have shaped my understanding of freedom and equality. My personal experience and values are influenced by my middle education level and working-class background, which may prioritize practical freedoms such as economic independence. Additionally, as a 35-year-old woman, I have experienced the changing socio-political landscape in Egypt, which has shaped my understanding of the importance of equality. Therefore, I believe that my perspective on the importance of freedom or equality is based on a nuanced understanding of my cultural and personal context.\n\n1"]}, {"persona": {"region": "Behaira", "sex": "male", "age": 52, "country": "Egypt", "marital_status": "married", "education": "middle", "social_class": "lower class"}, "question": {"id": "Q149", "variant": 0}, "response": ["Based on the anthropological framework, as a married male from Behaira, Egypt, who is 52 years old with a middle education level and considers myself part of the lower class, my answer to the question of whether freedom or equality is more important is influenced by my cultural context, individual values, and socioeconomic background. In Egypt, there is a strong emphasis on equality and social justice, especially among the lower class. As someone from this background, I have experienced firsthand the struggles and inequalities faced by those in lower socioeconomic positions. Therefore, I believe that equality is more important as it reflects the values and experiences of my community.\n\n2"]}, {"persona": {"region": "Alexandria", "sex": "female", "age": 41, "country": "Egypt", "marital_status": "single", "education": "middle", "social_class": "lower class"}, "question": {"id": "Q149", "variant": 0}, "response": ["Based on the anthropological framework, my perspective is heavily influenced by my cultural context, individual values, and socioeconomic background. As a single female from Alexandria, Egypt, I come from a culture that values community and collectivism, where equality is often prioritized over individual freedom. Additionally, as someone from the lower class, I have likely experienced firsthand the disparities in access to resources and opportunities, making me more inclined to prioritize equality. Given these factors, I believe that equality is more important in our society.\n\n2"]}, {"persona": {"region": "Alexandria", "sex": "female", "age": 21, "country": "Egypt", "marital_status": "single", "education": "middle", "social_class": "lower class"}, "question": {"id": "Q149", "variant": 0}, "response": ["Based on the anthropological framework, my perspective is shaped by my cultural context as a single female from Alexandria, Egypt, my lower socioeconomic background, and my age. As a young woman from a lower class background in Egypt, my personal experience and cultural values lead me to prioritize equality over freedom. In my community, there are significant disparities in access to resources and opportunities based on gender and social class. Therefore, I believe that achieving equality for all individuals, regardless of their background, is crucial for creating a fair and just society. \n\n2"]}, {"persona": {"region": "Alexandria", "sex": "female", "age": 35, "country": "Egypt", "marital_status": "married", "education": "middle", "social_class": "lower class"}, "question": {"id": "Q149", "variant": 0}, "response": ["From an anthropological perspective, my cultural context as a woman from Alexandria, Egypt, and my socioeconomic background as part of the lower class greatly influence my perspective on this question. My individual values and personal experience also play a significant role. In my community, the struggle for gender equality and basic human rights is a daily reality. As a result, I believe that equality is more important than freedom. The societal structures and cultural norms in my community often limit the freedom of individuals, particularly women, but striving for equality can lead to greater overall freedom for everyone. Therefore, I choose option 2: Equality."]}, {"persona": {"region": "Alexandria", "sex": "male", "age": 34, "country": "Egypt", "marital_status": "married", "education": "higher", "social_class": "working class"}, "question": {"id": "Q149", "variant": 0}, "response": ["Based on the anthropological framework, my perspective as a married male from Alexandria, Egypt, who is 34 years old, has completed higher education, and considers himself part of the working class is influenced by my cultural context, individual values, and socioeconomic background. In Egypt, there is a strong emphasis on collective well-being and social harmony, which aligns with the value of equality. Additionally, as someone from the working class, I have personally experienced the impact of inequality and the lack of equal opportunities. Therefore, I believe that equality is more important than freedom, as it is essential for the fair and just distribution of resources and opportunities in society.\n\n2"]}, {"persona": {"region": "Alexandria", "sex": "female", "age": 37, "country": "Egypt", "marital_status": "married", "education": "higher", "social_class": "lower middle class"}, "question": {"id": "Q149", "variant": 0}, "response": ["Based on the anthropological framework, my answer is influenced by my personal experience as a married female from Alexandria, Egypt. As a member of the lower middle class, my socioeconomic background has shaped my understanding of the world. In this cultural context, individual values and personal experience play a significant role in shaping my perspective. Additionally, age and place are important factors that influence my beliefs. Considering the nuance of the question, I believe that in my specific cultural context, freedom is more important than equality. \n\n1"]}, {"persona": {"region": "Alexandria", "sex": "female", "age": 56, "country": "Egypt", "marital_status": "divorced", "education": "middle", "social_class": "working class"}, "question": {"id": "Q149", "variant": 0}, "response": ["In my opinion, as a divorced female from Alexandria, Egypt, my personal experience and cultural context have shaped my understanding of the importance of freedom and equality. As a member of the working class in Egypt, I have seen firsthand the struggles for equal opportunities and rights for women. My socioeconomic background has also influenced my perception of the importance of equality, as I have faced challenges and discrimination based on my gender and social status. Additionally, my age and location have exposed me to the changing dynamics of gender roles and rights in Egypt. Therefore, I believe that equality is more important than freedom, as it is essential for creating a fair and just society where individuals have equal opportunities and rights regardless of their gender or social status.\n\n2"]}, {"persona": {"region": "Alexandria", "sex": "male", "age": 48, "country": "Egypt", "marital_status": "married", "education": "higher", "social_class": "working class"}, "question": {"id": "Q149", "variant": 0}, "response": ["From the anthropological perspective, I, as a married male from Alexandria, Egypt, would consider the emic and etic perspectives in answering this question. In my cultural context, the value of individual freedom is important, as Egypt has a history of striving for political and personal freedom. My personal experience and individual values also play a role, as I have seen the impact of limited freedom on my community. Socioeconomic background is also a factor, as I am part of the working class and have seen the inequalities in society. Additionally, cultural relativism is important to consider, as the Egyptian culture values individual rights and freedom. Finally, nuance is crucial, and in this context, I believe that freedom is more important than equality as it allows individuals to pursue their own paths and make choices that lead to a more equitable society.\n\n1"]}, {"persona": {"region": "Alexandria", "sex": "female", "age": 30, "country": "Egypt", "marital_status": "married", "education": "middle", "social_class": "working class"}, "question": {"id": "Q149", "variant": 0}, "response": ["Based on the anthropological framework, as a married female from Alexandria, Egypt, my emic perspective is shaped by my cultural context, individual values, and socioeconomic background. In my culture, women often face limitations on their freedom due to societal norms and expectations. Additionally, as part of the working class with limited educational opportunities, I have personally experienced the impact of inequality. Therefore, my personal experience and cultural context lead me to prioritize equality over freedom.\n\n2"]}, {"persona": {"region": "Alexandria", "sex": "male", "age": 19, "country": "Egypt", "marital_status": "single", "education": "middle", "social_class": "lower class"}, "question": {"id": "Q149", "variant": 0}, "response": ["Based on the anthropological framework, my answer is influenced by my cultural context, individual values, and socioeconomic background. As a single male from Alexandria, Egypt, at 19 years old and part of the lower class, my experiences and values have shaped my perception of the world. In a society where socioeconomic inequality is prevalent, I believe that equality is more important than freedom. The unequal distribution of resources and opportunities has impacted my life and the lives of those around me, making equality a crucial issue for us. Additionally, the cultural context of Egypt emphasizes collective well-being and social harmony, further reinforcing the importance of equality in our society.\n\n2"]}, {"persona": {"region": "Alexandria", "sex": "male", "age": 45, "country": "Egypt", "marital_status": "married", "education": "middle", "social_class": "lower middle class"}, "question": {"id": "Q149", "variant": 0}, "response": ["Based on my personal experience and cultural context as a married male from Alexandria, Egypt, I am part of the lower middle class and have completed middle education. My understanding and perspective are shaped by my socioeconomic background, individual values, and personal experience. In my cultural context, the concept of freedom holds great importance as it allows individuals to pursue their own aspirations and make choices that align with their personal values. Additionally, cultural relativism plays a significant role in my perspective, as the emphasis on personal freedom is influenced by the societal values and norms within my community. Therefore, considering these factors, I believe that freedom is more important than equality in my opinion.\n\n1"]}, {"persona": {"region": "Alexandria", "sex": "male", "age": 23, "country": "Egypt", "marital_status": "single", "education": "higher", "social_class": "lower class"}, "question": {"id": "Q149", "variant": 0}, "response": ["Based on the anthropological framework, my emic perspective as a lower-class single male from Alexandria, Egypt, is heavily influenced by my cultural context, individual values, and socioeconomic background. In my community, freedom is often restricted due to socioeconomic constraints and societal norms. My personal experience and values lead me to prioritize freedom as it is something I strive for but often feel is out of reach. Additionally, cultural relativism plays a role in my understanding of freedom, as it is not universally experienced in the same way. Therefore, I believe that freedom is more important in my context.\n\n1"]}, {"persona": {"region": "Alexandria", "sex": "female", "age": 28, "country": "Egypt", "marital_status": "married", "education": "middle", "social_class": "working class"}, "question": {"id": "Q149", "variant": 0}, "response": ["Based on the anthropological framework, my answer is influenced by my personal experiences as a married female from Alexandria, Egypt, who is part of the working class. My cultural context and socioeconomic background have shaped my understanding of the importance of freedom and equality. In my culture, there is a strong emphasis on equality, particularly in terms of gender equality. However, my socioeconomic background also influences my perspective, as my working-class status may lead me to prioritize freedom in terms of economic opportunities and personal autonomy. Additionally, the cultural relativism aspect of the framework reminds me that there is no hierarchy of culture, and my nuanced understanding of the question leads me to prioritize freedom in this specific context. \n\n1"]}, {"persona": {"region": "Alexandria", "sex": "male", "age": 34, "country": "Egypt", "marital_status": "single", "education": "higher", "social_class": "working class"}, "question": {"id": "Q149", "variant": 0}, "response": ["Based on the anthropological framework, I, as a single male from Alexandria, Egypt, would consider my cultural context, individual values, and socioeconomic background in answering this question. In my cultural context, there is a strong emphasis on community and equality, as well as a history of social and economic inequality. My personal experience and values also lead me to prioritize equality as a means to address these imbalances. Additionally, as someone from the working class, I have personally experienced the impact of inequality and believe that striving for equality is crucial for the well-being of society as a whole. Therefore, based on these factors, I choose:\n2"]}, {"persona": {"region": "Alexandria", "sex": "male", "age": 30, "country": "Egypt", "marital_status": "married", "education": "higher", "social_class": "lower middle class"}, "question": {"id": "Q149", "variant": 0}, "response": ["From the perspective of a married male from Alexandria, Egypt, who is 30 years old and considers himself part of the lower middle class, it is important to consider the cultural context, individual values, and socioeconomic background in answering this question. In Egypt, there is a strong emphasis on collective harmony and communal equality, stemming from a history of social and economic disparities. Additionally, as a member of the lower middle class, the pursuit of equality may be more personally relevant due to potential experiences of economic struggle and social marginalization. Therefore, considering the cultural context and individual values, the importance of equality may be prioritized over freedom.\n\n2"]}, {"persona": {"region": "Alexandria", "sex": "female", "age": 49, "country": "Egypt", "marital_status": "married", "education": "higher", "social_class": "lower middle class"}, "question": {"id": "Q149", "variant": 0}, "response": ["Based on the anthropological framework, my answer to the question would be influenced by my emic perspective as a married female from Alexandria, Egypt, my cultural context, individual values and personal experience, and my socioeconomic background. In Egyptian society, there is a strong emphasis on the value of equality, especially in the context of gender and social class. As a woman from the lower middle class who has completed higher education, I have experienced firsthand the importance of equality in access to opportunities and resources. Additionally, the cultural relativism perspective reminds me that in my cultural context, the concept of freedom may be understood and valued differently than in other societies. Therefore, I would prioritize equality over freedom in my answer to the question.\n\n2"]}, {"persona": {"region": "Kafr el-sheikh", "sex": "male", "age": 49, "country": "Egypt", "marital_status": "married", "education": "higher", "social_class": "working class"}, "question": {"id": "Q149", "variant": 0}, "response": ["Based on the anthropological framework, my cultural context as a married male from Kafr el-sheikh, Egypt, and my age and socioeconomic background as a 49-year-old working-class individual with higher education, heavily influence my perspective. In this context, the cultural relativism and individual values play a significant role in shaping my opinion. In my experience, freedom is seen as more important as it allows individuals to pursue their goals and ambitions, especially in a society where opportunities may be limited. Additionally, my socioeconomic background and education have likely shaped my understanding of the value of freedom in achieving personal and professional success. Therefore, I believe that freedom is more important in my perspective.\n\n1"]}, {"persona": {"region": "Kafr el-sheikh", "sex": "male", "age": 25, "country": "Egypt", "marital_status": "single", "education": "middle", "social_class": "lower middle class"}, "question": {"id": "Q149", "variant": 0}, "response": ["Based on my personal experience and socioeconomic background, I have learned to value freedom over equality. As a young man from a lower middle class family in Kafr el-sheikh, Egypt, I have experienced firsthand the restrictions placed on individuals due to their socioeconomic status. I believe that the ability to have freedom in making choices and pursuing opportunities is crucial for personal growth and advancement. In addition, the cultural context in which I have been raised values individual autonomy and the ability to carve out one's own path in life. This is why I prioritize freedom over equality.\n\n1"]}, {"persona": {"region": "Kafr el-sheikh", "sex": "male", "age": 59, "country": "Egypt", "marital_status": "married", "education": "higher", "social_class": "lower middle class"}, "question": {"id": "Q149", "variant": 0}, "response": ["Based on the anthropological framework, my answer is influenced by my cultural context, individual values, socioeconomic background, and age. Growing up in Kafr el-sheikh, Egypt, and being part of the lower middle class, I have experienced the importance of freedom in my own life. As a married male who has completed higher education, I value the freedom to make my own choices and pursue my own opportunities. Additionally, my age and cultural context have shaped my understanding of the importance of personal autonomy. Therefore, I believe that freedom is more important than equality.\n1"]}, {"persona": {"region": "Kafr el-sheikh", "sex": "female", "age": 38, "country": "Egypt", "marital_status": "married", "education": "middle", "social_class": "working class"}, "question": {"id": "Q149", "variant": 0}, "response": ["In my culture and socioeconomic background, the value of freedom is often prioritized over the value of equality. As a married woman from Kafr el-sheikh, Egypt, I have experienced firsthand the importance of individual liberties and autonomy, especially in a society where gender roles and expectations can be restrictive. Additionally, being part of the working class, the ability to make personal choices and have agency over one's life is highly valued. Therefore, I believe that freedom is more important than equality in my personal and cultural context.\n\n1"]}, {"persona": {"region": "Kafr el-sheikh", "sex": "male", "age": 35, "country": "Egypt", "marital_status": "married", "education": "higher", "social_class": "lower middle class"}, "question": {"id": "Q149", "variant": 0}, "response": ["Based on the anthropological framework, my perspective as a married male from Kafr el-sheikh, Egypt, who is 35 years old, completed higher education, and considers myself part of the lower middle class, is heavily influenced by my cultural context, individual values, and socioeconomic background. In my community, the concept of equality is often associated with social and economic justice, which is crucial for individuals in lower middle class positions like myself. Additionally, my personal experience and values lead me to prioritize equality as a means to address the disparities and challenges faced by individuals in our socioeconomic bracket. Therefore, I believe that equality is more important in our society as it reflects the need for fairness and opportunity for all.\n\n2"]}, {"persona": {"region": "Kafr el-sheikh", "sex": "male", "age": 49, "country": "Egypt", "marital_status": "married", "education": "middle", "social_class": "lower class"}, "question": {"id": "Q149", "variant": 0}, "response": ["Based on the anthropological framework, my perspective is heavily influenced by my cultural context as a married male from Kafr el-sheikh, Egypt. The socioeconomic background of being part of the lower class also plays a significant role in shaping my beliefs. In my experience, freedom is more important because it allows me to make choices and have control over my own life, which is crucial in a society where opportunities are limited. Additionally, the cultural value of individualism and personal autonomy is highly prized in my community. Therefore, I believe that freedom is more important than equality.\n\n1"]}, {"persona": {"region": "Kafr el-sheikh", "sex": "male", "age": 37, "country": "Egypt", "marital_status": "married", "education": "middle", "social_class": "lower class"}, "question": {"id": "Q149", "variant": 0}, "response": ["From my perspective as a married male from Kafr el-sheikh, Egypt, at the age of 37 and part of the lower class, my answer is influenced by my cultural context, socioeconomic background, and personal values. In my community, there is a strong emphasis on equality as we all struggle to make ends meet and support our families. Additionally, my lower socioeconomic status has made me aware of the disparities in opportunities and resources that exist in our society. Therefore, I believe that equality is more important as it would create a fairer and more just society for people like me who are struggling to improve their circumstances.\n\n2"]}, {"persona": {"region": "Menofia", "sex": "female", "age": 22, "country": "Egypt", "marital_status": "single", "education": "middle", "social_class": "lower class"}, "question": {"id": "Q149", "variant": 0}, "response": ["Based on the anthropological framework, the emic perspective of a single female from Menofia, Egypt, who is 22 years old, completed middle education level, and considers herself part of the lower class, would prioritize individual values and personal experience in answering the question. The cultural context of Egypt, with its history and societal norms, would also heavily influence her response. Socioeconomic background would also play a significant role in her answer, as someone from the lower class might prioritize equality due to their own experiences with inequality. Additionally, the cultural relativism within Egypt might lead her to value equality as a means of addressing social disparities. Therefore, the emic perspective would lead her to prioritize equality over freedom.\n\n2"]}, {"persona": {"region": "Menofia", "sex": "female", "age": 25, "country": "Egypt", "marital_status": "married", "education": "middle", "social_class": "lower class"}, "question": {"id": "Q149", "variant": 0}, "response": ["Based on the anthropological framework, my answer is influenced by my cultural context, socioeconomic background, and personal experience. As a married female from Menofia, Egypt, I come from a culture where traditional gender roles are still prevalent, and women often have limited freedom and opportunities compared to men. Additionally, being part of the lower class, I have experienced firsthand the inequalities and lack of access to resources and opportunities. Therefore, I believe that equality is more important than freedom because without equality, true freedom cannot be achieved for all individuals in my community.\n\n2"]}, {"persona": {"region": "Menofia", "sex": "male", "age": 28, "country": "Egypt", "marital_status": "single", "education": "higher", "social_class": "working class"}, "question": {"id": "Q149", "variant": 0}, "response": ["Based on the anthropological framework, my answer is influenced by my personal experience and socioeconomic background. As a single male from Menofia, Egypt, I have experienced the challenges of the working class and have seen the impact of inequality in my community. My education has also made me aware of the importance of equal opportunities for all individuals. Considering the cultural context of Egypt and the value placed on community and social harmony, I believe that equality is more important than freedom in order to create a fair and just society.\n\n2"]}, {"persona": {"region": "Menofia", "sex": "male", "age": 35, "country": "Egypt", "marital_status": "married", "education": "middle", "social_class": "lower middle class"}, "question": {"id": "Q149", "variant": 0}, "response": ["Based on my cultural context as a married male from Menofia, Egypt, my understanding of the importance of freedom or equality is shaped by my socioeconomic background, individual values, and personal experience. In my community, there is a strong emphasis on family and community ties, and the value of equality is deeply ingrained in our cultural norms. As someone from the lower middle class, I have personally experienced the impact of inequality and the importance of striving for equal opportunities for all. Therefore, I believe that equality is more important than freedom, as it is essential for creating a fair and just society where everyone has the opportunity to thrive.\n\n2"]}, {"persona": {"region": "Menofia", "sex": "male", "age": 55, "country": "Egypt", "marital_status": "married", "education": "middle", "social_class": "working class"}, "question": {"id": "Q149", "variant": 0}, "response": ["Based on the anthropological framework, as a married male from Menofia, Egypt, my cultural context and socioeconomic background heavily influence my perspective. My age and working-class status also play a role in my understanding of the world. In this context, personal experience and individual values are crucial in shaping my opinions. In considering the question of whether freedom or equality is more important, I believe that given my background and cultural context, freedom holds greater significance. In Egypt, there has been a long history of struggle for political freedom and individual rights, and this is a value that has been ingrained in me. While equality is also important, the idea of personal freedom and autonomy holds greater weight in my understanding of the world.\n\n1"]}, {"persona": {"region": "Menofia", "sex": "male", "age": 53, "country": "Egypt", "marital_status": "married", "education": "higher", "social_class": "lower middle class"}, "question": {"id": "Q149", "variant": 0}, "response": ["Based on the anthropological framework, my perspective is deeply influenced by my cultural context, socioeconomic background, and individual values. As a married male from Menofia, Egypt, my understanding of the world is shaped by the cultural norms, traditions, and values of my community. Additionally, as a member of the lower middle class, my socioeconomic background has influenced my perspective on freedom and equality. Given my age and education level, I have come to value equality more than freedom, as I believe that equal opportunities and treatment for all individuals, regardless of their background, are essential for a harmonious society. Therefore, I choose option 2: Equality."]}, {"persona": {"region": "Menofia", "sex": "male", "age": 59, "country": "Egypt", "marital_status": "married", "education": "middle", "social_class": "working class"}, "question": {"id": "Q149", "variant": 0}, "response": ["Based on the anthropological framework, my perspective as a married male from Menofia, Egypt, who is 59 years old, has completed middle education, and considers himself part of the working class, is heavily influenced by my cultural context, individual values, and socioeconomic background. In my culture, there is a strong emphasis on community and equality, and my personal experience as a member of the working class has shaped my belief that equality is more important than freedom. As someone who has struggled with economic and social inequalities, I believe that prioritizing equality can lead to a more just and cohesive society. Furthermore, my understanding of cultural relativism reminds me that my perspective is shaped by my specific cultural and socioeconomic context, and that others may have different views based on their own experiences and backgrounds.\n\n2"]}, {"persona": {"region": "Menofia", "sex": "female", "age": 42, "country": "Egypt", "marital_status": "married", "education": "middle", "social_class": "lower middle class"}, "question": {"id": "Q149", "variant": 0}, "response": ["Based on the anthropological framework, my emic perspective as a married female from Menofia, Egypt, with a middle education level and lower middle class background, is heavily influenced by my cultural context and individual values. In my community, there is a strong emphasis on traditional gender roles and family values, and personal experience has taught me that freedom is often limited for women. Additionally, my socioeconomic background has made me acutely aware of the inequalities that exist in society. Therefore, I believe that equality is more important than freedom because it is essential for creating a fair and just society.\n\n2"]}, {"persona": {"region": "Menofia", "sex": "male", "age": 39, "country": "Egypt", "marital_status": "married", "education": "higher", "social_class": "working class"}, "question": {"id": "Q149", "variant": 0}, "response": ["Based on my emic perspective as a married male from Menofia, Egypt, I value freedom over equality. In my cultural context, individual freedom is highly prized and the ability to make my own choices and decisions is paramount. Additionally, my personal experience as a working-class individual has taught me the importance of being able to pursue my own goals and aspirations without restrictions. Furthermore, cultural relativism teaches me that there is no hierarchy of culture, and in my community, freedom is highly valued. Therefore, I believe that freedom is more important than equality.\n\n1"]}, {"persona": {"region": "Menofia", "sex": "male", "age": 34, "country": "Egypt", "marital_status": "married", "education": "middle", "social_class": "lower middle class"}, "question": {"id": "Q149", "variant": 0}, "response": ["Based on the anthropological framework, my background as a married male from Menofia, Egypt, at the age of 34, and part of the lower middle class, significantly influences my perspective. My cultural context and individual values are shaped by the socioeconomic background, space, and time in which I live. In Egypt, there are historical and cultural factors that prioritize equality in society, and my personal experience and understanding also lead me to believe that equality is more important for the betterment of the community. Therefore, I choose option 2: Equality."]}, {"persona": {"region": "Menofia", "sex": "male", "age": 22, "country": "Egypt", "marital_status": "single", "education": "higher", "social_class": "working class"}, "question": {"id": "Q149", "variant": 0}, "response": ["Based on the anthropological framework, as a single male from Menofia, Egypt, my emic perspective is heavily influenced by my cultural context, individual values, and socioeconomic background. In Egypt, there is a strong emphasis on collective harmony and social equality, and as a member of the working class, I have experienced firsthand the challenges and inequalities faced by my community. Therefore, I believe that equality is more important than freedom because it is essential for ensuring fair opportunities and access to resources for all individuals, regardless of their background or social status.\n\n2"]}, {"persona": {"region": "Menofia", "sex": "male", "age": 21, "country": "Egypt", "marital_status": "single", "education": "middle", "social_class": "working class"}, "question": {"id": "Q149", "variant": 0}, "response": ["Based on the anthropological framework, my perspective is heavily influenced by my cultural context, socioeconomic background, and personal experience. As a working-class individual from Menofia, Egypt, my values and beliefs are shaped by my surroundings and upbringing. In my community, the emphasis is often placed on individual freedoms and the ability to make choices for oneself. Additionally, my socioeconomic background has instilled in me the desire for personal autonomy and the ability to pursue opportunities for myself. Therefore, I believe that freedom is more important in my opinion.\n\n1"]}, {"persona": {"region": "Menofia", "sex": "male", "age": 36, "country": "Egypt", "marital_status": "married", "education": "higher", "social_class": "working class"}, "question": {"id": "Q149", "variant": 0}, "response": ["From the perspective of a married male from Menofia, Egypt, who is 36 years old, completed higher education, and considers himself part of the working class, my answer is based on the cultural context, individual values and personal experience, and socioeconomic background. In Egypt, there is a strong emphasis on collective values and social harmony, which aligns with the importance of equality. Additionally, as someone from the working class, I have likely experienced firsthand the impact of socioeconomic inequality and may prioritize equality as a means of addressing these disparities. Furthermore, my higher education may have also exposed me to the values of social justice and egalitarianism. Therefore, in my opinion, equality is more important.\n\n2"]}, {"persona": {"region": "Menofia", "sex": "female", "age": 52, "country": "Egypt", "marital_status": "married", "education": "higher", "social_class": "lower middle class"}, "question": {"id": "Q149", "variant": 0}, "response": ["Based on the anthropological framework, as a married female from Menofia, Egypt, my emic perspective would prioritize the cultural context, individual values, and socioeconomic background. In my culture, traditional gender roles and social expectations may influence my understanding and prioritization of freedom and equality. Additionally, my personal experience as a lower middle class woman who has completed higher education may lead me to value equality as a means to improve the social and economic opportunities for individuals in similar socio-economic backgrounds. Therefore, based on my emic perspective and personal experience, I believe that equality is more important.\n\n2"]}, {"persona": {"region": "Menofia", "sex": "male", "age": 52, "country": "Egypt", "marital_status": "married", "education": "higher", "social_class": "lower middle class"}, "question": {"id": "Q149", "variant": 0}, "response": ["Based on the anthropological framework, my perspective as a married male from Menofia, Egypt, who is 52 years old and completed higher education, and considers himself part of the lower middle class, is influenced by my cultural context, individual values, and socioeconomic background. In Egypt, there is a strong emphasis on family and community, and equality is often prioritized over individual freedom. Additionally, my socioeconomic background as part of the lower middle class may lead me to prioritize equality as a means of ensuring that everyone has access to basic rights and resources. Therefore, I believe that equality is more important than freedom.\n\n2"]}, {"persona": {"region": "Menofia", "sex": "male", "age": 39, "country": "Egypt", "marital_status": "married", "education": "middle", "social_class": "lower class"}, "question": {"id": "Q149", "variant": 0}, "response": ["Based on my cultural context in Menofia, Egypt, my socioeconomic background as part of the lower class, and my individual values and personal experiences, I believe that equality is more important than freedom. In our community, we value the idea of everyone being treated fairly and having equal opportunities, especially considering the economic hardships many of us face. Additionally, the cultural relativism of our society values collective well-being over individual freedom, making equality a crucial aspect of our community's values.\n\n2"]}, {"persona": {"region": "Menofia", "sex": "male", "age": 23, "country": "Egypt", "marital_status": "single", "education": "middle", "social_class": "lower middle class"}, "question": {"id": "Q149", "variant": 0}, "response": ["Based on the anthropological framework, I am from Menofia, Egypt, and my cultural context greatly influences my perspective. Coming from a lower middle-class background, my socioeconomic status plays a significant role in shaping my values and perceptions. Additionally, my age and education level also contribute to my understanding of freedom and equality. In my personal experience, I have seen the importance of freedom in pursuing one's aspirations, taking control of one's life, and making individual choices. Therefore, based on these factors, I believe that freedom is more important in my opinion. \n\n1"]}, {"persona": {"region": "Dakahlia", "sex": "female", "age": 24, "country": "Egypt", "marital_status": "single", "education": "higher", "social_class": "lower middle class"}, "question": {"id": "Q149", "variant": 0}, "response": ["Based on the anthropological framework, as a single female from Dakahlia, Egypt, my emic perspective is influenced by cultural context, individual values, and socioeconomic background. In my community, traditional gender roles and expectations play a significant role in shaping perceptions of freedom and equality. My personal experience as a woman in a lower middle-class family has also influenced my understanding of these concepts. Considering the nuanced phrasing of the question and the cultural relativism, I believe that equality is more important in my context because it directly impacts my ability to access opportunities and resources that are often limited for women in my society.\n\n2"]}, {"persona": {"region": "Dakahlia", "sex": "male", "age": 36, "country": "Egypt", "marital_status": "married", "education": "higher", "social_class": "upper middle class"}, "question": {"id": "Q149", "variant": 0}, "response": ["From my perspective as a married male from Dakahlia, Egypt, I am influenced by my cultural context, individual values, and socioeconomic background. In my community, there is a strong emphasis on family values and social hierarchy, and as someone from the upper middle class, I have been privileged to have certain freedoms and opportunities. However, I also recognize the importance of equality, especially in a country like Egypt where social inequalities are prevalent. I believe that both freedom and equality are important, but in the context of my personal experiences and values, I would prioritize freedom as it aligns with my individual aspirations and the values I hold dear.\n\n1"]}, {"persona": {"region": "Dakahlia", "sex": "female", "age": 71, "country": "Egypt", "marital_status": "married", "education": "higher", "social_class": "upper middle class"}, "question": {"id": "Q149", "variant": 0}, "response": ["Based on the anthropological framework, as a married female from Dakahlia, Egypt, my emic perspective is heavily influenced by my cultural context, individual values, and personal experience. In my society, traditional gender roles and societal expectations have shaped my understanding of freedom and equality. As an educated woman from the upper middle class, I value the freedom to make choices and pursue my personal and professional goals. However, I also recognize the importance of equality in ensuring fair opportunities for all individuals, regardless of their gender, class, or socioeconomic background. Therefore, I believe that while both freedom and equality are important, equality holds greater significance in creating a more just and inclusive society.\n\n2"]}, {"persona": {"region": "Dakahlia", "sex": "male", "age": 55, "country": "Egypt", "marital_status": "married", "education": "higher", "social_class": "upper middle class"}, "question": {"id": "Q149", "variant": 0}, "response": ["Based on the anthropological framework, my perspective is shaped by my cultural context, individual values, socioeconomic background, and space and time. As a married male from Dakahlia, Egypt, my upbringing and cultural values prioritize the importance of individual freedom and personal autonomy. Additionally, my higher education level and upper middle-class status have afforded me certain privileges and opportunities that have reinforced the value of freedom in my life. Furthermore, my age and place of origin have shaped my understanding of the importance of individual rights and freedoms within the context of my community and society. Therefore, considering all these factors, I believe that freedom is more important than equality.\n\n1"]}, {"persona": {"region": "Dakahlia", "sex": "male", "age": 64, "country": "Egypt", "marital_status": "married", "education": "higher", "social_class": "lower middle class"}, "question": {"id": "Q149", "variant": 0}, "response": ["Based on the anthropological framework, as a married male from Dakahlia, Egypt, cultural context and individual values play a significant role in shaping my perspective. In my community, the value of equality is deeply ingrained, as it is seen as essential for maintaining social harmony and justice. Additionally, my lower middle-class socioeconomic background has influenced my belief that equality is crucial for ensuring fair opportunities and access to resources for all individuals. Furthermore, my age and educational background have led me to understand the importance of equality in creating a more just and equitable society. Therefore, based on my cultural context, personal values, and socioeconomic background, I believe that equality is more important than freedom.\n2"]}, {"persona": {"region": "Dakahlia", "sex": "female", "age": 29, "country": "Egypt", "marital_status": "married", "education": "middle", "social_class": "lower class"}, "question": {"id": "Q149", "variant": 0}, "response": ["Based on my cultural context, I come from Dakahlia, Egypt, where traditional gender roles and social hierarchies are deeply ingrained. Additionally, my socioeconomic background as part of the lower class has shaped my values and experiences, leading me to prioritize practical concerns such as economic stability and security. In this context, individual values and personal experiences weigh heavily on my perspective, making me inclined to prioritize freedom over equality. My limited access to education and resources has also influenced my understanding of the importance of personal agency and autonomy. Therefore, I believe that freedom is more important than equality in my current circumstances.\n\n1"]}, {"persona": {"region": "Dakahlia", "sex": "female", "age": 40, "country": "Egypt", "marital_status": "married", "education": "middle", "social_class": "upper middle class"}, "question": {"id": "Q149", "variant": 0}, "response": ["Based on my understanding of the anthropological framework, I recognize that my cultural context, individual values, and socioeconomic background all influence my perspective. As a married female from Dakahlia, Egypt, who is 40 years old and part of the upper middle class, I value personal freedom and autonomy. In my local cultural context, there is a strong emphasis on personal agency and the ability to make choices for oneself. Additionally, my socioeconomic status allows me the privilege of enjoying certain freedoms that others may not have. Therefore, I believe that freedom is more important in my opinion.\n\n1"]}, {"persona": {"region": "Dakahlia", "sex": "male", "age": 37, "country": "Egypt", "marital_status": "married", "education": "higher", "social_class": "lower middle class"}, "question": {"id": "Q149", "variant": 0}, "response": ["Based on the anthropological framework, as a married male from Dakahlia, Egypt, my emic perspective is heavily influenced by my cultural context, individual values, and socioeconomic background. In Egypt, the concept of freedom is often tied to political and social issues, while equality is more closely linked to economic and social disparities. As part of the lower middle class, I am acutely aware of the challenges and limitations that come with my socioeconomic status. Therefore, my answer to the question would be influenced by the importance of ensuring equal opportunities for everyone, as this would benefit individuals from similar backgrounds as mine. Additionally, the cultural relativism perspective reminds me that Egypt has a history of societal structures that have limited the freedom of certain groups, making me lean towards the importance of equality. \n\n2"]}, {"persona": {"region": "Dakahlia", "sex": "female", "age": 45, "country": "Egypt", "marital_status": "married", "education": "middle", "social_class": "working class"}, "question": {"id": "Q149", "variant": 0}, "response": ["Based on the anthropological framework, my perspective as a married female from Dakahlia, Egypt, is heavily influenced by my cultural context, individual values, and socioeconomic background. As a member of the working class with a middle education level, I have experienced the importance of both freedom and equality in my daily life. However, considering the cultural context and the socioeconomic background, I believe that equality is more important. In a society where there are disparities in income and opportunities, striving for equality can lead to a more just and fair society for all. Therefore, I choose option 2: Equality."]}, {"persona": {"region": "Dakahlia", "sex": "male", "age": 34, "country": "Egypt", "marital_status": "single", "education": "middle", "social_class": "lower middle class"}, "question": {"id": "Q149", "variant": 0}, "response": ["Based on my personal experience and socioeconomic background as a single male from Dakahlia, Egypt, who considers himself part of the lower middle class, I believe that both freedom and equality are important. However, considering the cultural context and the nuances of my environment, I would argue that equality holds more significance. In Egypt, there are social and economic disparities that can only be addressed through a more equal distribution of resources and opportunities. Additionally, cultural relativism and the emic perspective within my community emphasize the importance of fairness and justice for all individuals. Therefore, I choose option (2) Equality."]}, {"persona": {"region": "Dakahlia", "sex": "female", "age": 26, "country": "Egypt", "marital_status": "married", "education": "higher", "social_class": "upper middle class"}, "question": {"id": "Q149", "variant": 0}, "response": ["Based on the anthropological framework, my perspective as a married female from Dakahlia, Egypt, who is 26 years old, completed higher education, and considers myself part of the upper middle class, is heavily influenced by my cultural context, individual values, and socioeconomic background. In Egypt, there are traditional gender roles and expectations, but as a woman who has achieved higher education and belongs to the upper middle class, I value freedom and the ability to make choices for myself. Additionally, my personal experiences and values have led me to prioritize personal freedoms and autonomy. Therefore, I believe that freedom is more important in my context. \n\n1"]}, {"persona": {"region": "Dakahlia", "sex": "male", "age": 21, "country": "Egypt", "marital_status": "single", "education": "middle", "social_class": "upper middle class"}, "question": {"id": "Q149", "variant": 0}, "response": ["Based on my emic perspective as a single male from Dakahlia, Egypt, I value freedom as an essential aspect of my personal experience and individual values. In my cultural context, freedom is highly valued as it allows me to make my own choices and pursue my own goals, which is crucial for my personal development and happiness. Additionally, my socioeconomic background as part of the upper middle class has afforded me certain privileges and opportunities that have allowed me to experience a greater degree of freedom in my life. Furthermore, cultural relativism teaches me that different cultures may prioritize freedom over equality, and as a 21-year-old, I am at a stage in my life where I am exploring my independence and autonomy. Therefore, considering all these factors, I believe that freedom is more important in my perspective.\n\n1"]}, {"persona": {"region": "Dakahlia", "sex": "female", "age": 32, "country": "Egypt", "marital_status": "married", "education": "middle", "social_class": "working class"}, "question": {"id": "Q149", "variant": 0}, "response": ["Based on the anthropological framework, my perspective is heavily influenced by my cultural context, individual values, and socioeconomic background. Coming from Dakahlia, Egypt, a working-class woman with a middle education level, my experiences and values have shaped my understanding of the world. In my cultural context, there is a strong emphasis on community and equality, where everyone is seen as equal in the eyes of society. Additionally, my socioeconomic background has influenced my belief that equality is more important because it ensures that everyone has the same opportunities and rights, regardless of their background. Therefore, I believe that equality is more important than freedom as it ensures fairness and justice for all individuals.\n\n2"]}, {"persona": {"region": "Dakahlia", "sex": "female", "age": 35, "country": "Egypt", "marital_status": "married", "education": "middle", "social_class": "upper middle class"}, "question": {"id": "Q149", "variant": 0}, "response": ["Based on the anthropological framework, as a married female from Dakahlia, Egypt, I have been shaped by my cultural context, individual values, and socioeconomic background. In my community, there is a strong emphasis on family and social connections, and as someone who considers themselves part of the upper middle class, I value personal freedom and autonomy. Additionally, my experience and education level have influenced my belief in the importance of individual rights and freedom. Therefore, I believe that freedom is more important than equality in my personal and cultural context.\n\n1"]}, {"persona": {"region": "Dakahlia", "sex": "male", "age": 33, "country": "Egypt", "marital_status": "married", "education": "middle", "social_class": "upper middle class"}, "question": {"id": "Q149", "variant": 0}, "response": ["Based on the anthropological framework, as a married male from Dakahlia, Egypt, my emic perspective is shaped by my cultural context, individual values, socioeconomic background, and space and time. In my culture, personal freedom is highly valued, and as someone belonging to the upper middle class, I have been able to experience a certain level of freedom in my life. Additionally, my age and marital status also play a role in shaping my perspective on this question. Taking all of these factors into consideration, I believe that freedom is more important than equality.\n\n1"]}, {"persona": {"region": "Dakahlia", "sex": "female", "age": 45, "country": "Egypt", "marital_status": "married", "education": "middle", "social_class": "upper middle class"}, "question": {"id": "Q149", "variant": 0}, "response": ["Based on the anthropological framework, as a married female from Dakahlia, Egypt, my emic perspective emphasizes the importance of familial and community ties, as well as the cultural norms and values that prioritize harmony and collectivism. This cultural context, along with my individual values and personal experience, leads me to prioritize equality over freedom. In my socioeconomic background as part of the upper middle class, I understand the importance of reducing disparities and promoting fairness within society. Additionally, considering the nuances of the question and the emphasis on cultural relativism, I believe that prioritizing equality aligns with the values and beliefs of my community and is essential for the overall well-being and stability of society.\n\n2"]}, {"persona": {"region": "Dakahlia", "sex": "male", "age": 30, "country": "Egypt", "marital_status": "married", "education": "middle", "social_class": "upper middle class"}, "question": {"id": "Q149", "variant": 0}, "response": ["Based on the anthropological framework, as a married male from Dakahlia, Egypt, my emic perspective is heavily influenced by my cultural context, individual values, and socioeconomic background. In my community, traditional gender roles and social hierarchies play a significant role in shaping my views. Additionally, my personal experiences and values as someone from the upper middle class have led me to prioritize individual freedom and autonomy. Furthermore, the nuanced phrasing of the question also impacts my response, as the emphasis on personal agency resonates with my understanding of societal values and norms. Therefore, from my perspective, I believe that freedom is more important than equality.\n\n1"]}, {"persona": {"region": "Dakahlia", "sex": "female", "age": 63, "country": "Egypt", "marital_status": "married", "education": "higher", "social_class": "lower middle class"}, "question": {"id": "Q149", "variant": 0}, "response": ["Based on the anthropological framework, my perspective as a married female from Dakahlia, Egypt, who is 63 years old and part of the lower middle class is influenced by my cultural context, individual values, and socioeconomic background. In my cultural context, there is a strong emphasis on community and family, and the value of equality is deeply ingrained. Additionally, my lower middle class socioeconomic background has shaped my understanding of the importance of equality in providing opportunities for all individuals, regardless of their social status. Therefore, I believe that equality is more important than freedom in creating a fair and just society.\n\n2"]}, {"persona": {"region": "Dakahlia", "sex": "male", "age": 28, "country": "Egypt", "marital_status": "single", "education": "higher", "social_class": "upper middle class"}, "question": {"id": "Q149", "variant": 0}, "response": ["Based on the anthropological framework, as a single male from Dakahlia, Egypt, my emic perspective is influenced by the cultural context of my upbringing and the socioeconomic background of the upper middle class. My personal experience and individual values also play a significant role in shaping my perception. Additionally, cultural relativism teaches me to understand and respect different perspectives. Considering all these factors, I believe that my answer will be informed by a nuanced understanding of the question and will reflect the importance of freedom in my cultural and personal context.\n\n1"]}, {"persona": {"region": "Dakahlia", "sex": "female", "age": 24, "country": "Egypt", "marital_status": "married", "education": "higher", "social_class": "upper middle class"}, "question": {"id": "Q149", "variant": 0}, "response": ["Based on my cultural context, as a married woman from Dakahlia, Egypt, I have been raised in a society that highly values equality within the family and community. My individual values and personal experiences have also shaped my belief that equality is crucial for a harmonious and just society. Additionally, coming from the upper middle class, I have been afforded certain privileges and opportunities that have allowed me to recognize the importance of equality for all individuals, regardless of their socioeconomic background. Therefore, I believe that equality is more important for the well-being and progress of society as a whole.\n\n2"]}, {"persona": {"region": "Dakahlia", "sex": "male", "age": 20, "country": "Egypt", "marital_status": "single", "education": "middle", "social_class": "upper middle class"}, "question": {"id": "Q149", "variant": 0}, "response": ["Based on my emic perspective as a single male from Dakahlia, Egypt, my cultural context, individual values, and personal experience all play a role in my understanding and answering of this question. Coming from a middle-class background in Egypt, I have grown up valuing personal freedoms and autonomy. Additionally, my age and education level have also shaped my understanding of the importance of individual freedom. However, I also recognize the importance of equality in society, as it can create a fair and just environment for all individuals. Considering the nuanced phrasing of the question, I believe that freedom is more important in my personal opinion.\n\n1"]}, {"persona": {"region": "Dakahlia", "sex": "male", "age": 45, "country": "Egypt", "marital_status": "married", "education": "middle", "social_class": "upper middle class"}, "question": {"id": "Q149", "variant": 0}, "response": ["Based on the anthropological framework, my perspective as a married male from Dakahlia, Egypt, is heavily influenced by my cultural context, individual values, and socioeconomic background. In my community, the concept of freedom is often associated with personal autonomy and the ability to make choices for oneself, which is highly valued. Additionally, as a member of the upper middle class, I have likely experienced a certain level of freedom and privilege in my life. However, I also recognize the importance of equality, particularly in a society where socioeconomic disparities can be significant. My personal experience and values lead me to believe that while freedom is important, it should not come at the cost of equality. Therefore, I believe that equality is more important in the overall societal context.\n\n2"]}, {"persona": {"region": "Dakahlia", "sex": "female", "age": 43, "country": "Egypt", "marital_status": "married", "education": "higher", "social_class": "upper middle class"}, "question": {"id": "Q149", "variant": 0}, "response": ["Based on the anthropological framework, my answer is influenced by my individual values and personal experience as a married woman from Dakahlia, Egypt. My cultural context as an educated woman from the upper middle class also plays a significant role in shaping my perspective. Additionally, my socioeconomic background and age have contributed to my understanding of the importance of freedom and equality. Considering cultural relativism, I understand that there is no hierarchy of culture and that my answer may differ from others based on their own cultural and personal experiences. Ultimately, my nuanced understanding of the question leads me to choose:\n\n2"]}, {"persona": {"region": "Dakahlia", "sex": "female", "age": 20, "country": "Egypt", "marital_status": "single", "education": "middle", "social_class": "upper middle class"}, "question": {"id": "Q149", "variant": 0}, "response": ["Based on the anthropological framework, I must consider my emic perspective as a single female from Dakahlia, Egypt, who has completed middle education and considers myself part of the upper middle class. My cultural context, individual values, and personal experiences have shaped my understanding of freedom and equality. In my cultural context, freedom may be more important to me as a young woman striving for independence and autonomy. However, my individual values and personal experiences also lead me to recognize the importance of equality in achieving a fair and just society. Additionally, my socioeconomic background may influence my perception, as someone from the upper middle class may prioritize freedom over equality. Therefore, taking into account my nuanced perspective, I choose the following option:\n\n2. Equality"]}, {"persona": {"region": "Dakahlia", "sex": "female", "age": 40, "country": "Egypt", "marital_status": "single", "education": "middle", "social_class": "lower middle class"}, "question": {"id": "Q149", "variant": 0}, "response": ["Based on the anthropological framework, as a single female from Dakahlia, Egypt, my emic perspective is heavily influenced by my cultural context, individual values, and socioeconomic background. As a member of the lower middle class in a traditional society, my personal experiences and values are shaped by my socioeconomic status and gender. Additionally, cultural relativism plays a role in my understanding of the importance of freedom versus equality, as the cultural norms and expectations in my community may differ from those in other societies. Taking into account these factors, I believe that equality is more important than freedom, as it is essential for addressing social and economic disparities within my community and promoting a more equitable society.\n\n2"]}, {"persona": {"region": "Dakahlia", "sex": "female", "age": 33, "country": "Egypt", "marital_status": "married", "education": "higher", "social_class": "upper middle class"}, "question": {"id": "Q149", "variant": 0}, "response": ["Based on the anthropological framework, as a married female from Dakahlia, Egypt, the cultural context and individual values play a significant role in my perspective. In this region, the cultural context emphasizes the importance of family and community, and individual values prioritize stability and harmony within the social structure. Additionally, my higher education level and belonging to the upper middle class have shaped my perception of the significance of both freedom and equality. From this perspective, I believe that equality is more important as it contributes to a harmonious and stable society, which aligns with the cultural values and socioeconomic background of my persona.\n\n2"]}, {"persona": {"region": "Dakahlia", "sex": "female", "age": 24, "country": "Egypt", "marital_status": "married", "education": "middle", "social_class": "working class"}, "question": {"id": "Q149", "variant": 0}, "response": ["Based on the anthropological framework, as a married female from Dakahlia, Egypt, my cultural context and socioeconomic background greatly influence my perspective. In my community, there is a strong emphasis on traditional gender roles and expectations, and as a working-class woman, I have experienced firsthand the challenges and limitations that come with this social position. Additionally, my individual values and personal experiences have shaped my understanding of freedom and equality. While both are important, I believe that equality is more crucial in my context, as it directly impacts my ability to access opportunities and resources that are often limited for women in my community.\n\n2"]}, {"persona": {"region": "Dakahlia", "sex": "female", "age": 53, "country": "Egypt", "marital_status": "widowed", "education": "middle", "social_class": "working class"}, "question": {"id": "Q149", "variant": 0}, "response": ["Based on the anthropological framework, my perspective as a widowed female from Dakahlia, Egypt, who is 53 years old, completed middle education, and considers herself part of the working class, is shaped by my cultural context, individual values, and socioeconomic background. In my cultural context, traditional gender roles and social hierarchies may influence my understanding of freedom and equality. My personal experience as a working-class woman may lead me to prioritize equality as I may have faced discrimination and inequality in my own life. Socioeconomic background also plays a role, as my working-class status may lead me to value equality as a means of addressing social and economic disparities within my community. Therefore, I choose option 2: Equality. \n\n2"]}, {"persona": {"region": "Dakahlia", "sex": "female", "age": 30, "country": "Egypt", "marital_status": "single", "education": "middle", "social_class": "lower middle class"}, "question": {"id": "Q149", "variant": 0}, "response": ["In my cultural context in Dakahlia, Egypt, as a single female, my individual values and personal experience greatly influence my perception of what is more important. Growing up in this region and being part of the lower middle class, I have witnessed the struggles of inequality and the lack of freedom for many individuals. The cultural relativism in our society also plays a significant role in shaping my perspective, as I have come to understand that there is no hierarchy of culture and that everyone deserves equal opportunities and freedoms. Additionally, the socioeconomic background of my community has highlighted the importance of striving for equality for all. Therefore, based on my nuanced understanding of the question and considering the cultural context, I believe that equality is more important.\n\n2"]}, {"persona": {"region": "Dakahlia", "sex": "male", "age": 53, "country": "Egypt", "marital_status": "married", "education": "higher", "social_class": "upper middle class"}, "question": {"id": "Q149", "variant": 0}, "response": ["Based on the anthropological framework, my perspective as a married male from Dakahlia, Egypt, who is 53 years old, completed higher education, and considers myself part of the upper middle class, is heavily influenced by my cultural context, individual values, and socioeconomic background. In Egypt, there is a strong emphasis on family and social hierarchy, and as someone from the upper middle class, I have experienced certain privileges that have shaped my views. Additionally, my education has instilled in me the importance of individual freedoms and personal agency. Therefore, considering the cultural context and my personal values, I believe that freedom is more important than equality.\n\n1"]}, {"persona": {"region": "Dakahlia", "sex": "male", "age": 28, "country": "Egypt", "marital_status": "married", "education": "middle", "social_class": "working class"}, "question": {"id": "Q149", "variant": 0}, "response": ["Based on the anthropological framework, my perspective is shaped by my cultural context, individual values, and socioeconomic background. Growing up in Dakahlia, Egypt, I have been influenced by the cultural norms and values of my community. My personal experiences and values as a working-class individual have also shaped my understanding of the world. Within this context, I prioritize freedom as it aligns with my individual values and experiences. I believe that freedom allows for the pursuit of personal goals and aspirations, and it empowers individuals to make choices that align with their own values and desires. Additionally, my socioeconomic background as a working-class individual has influenced my perspective, as I value the ability to make choices and have autonomy in my life. Therefore, I believe that freedom is more important in my opinion.\n\n1"]}, {"persona": {"region": "Dakahlia", "sex": "female", "age": 38, "country": "Egypt", "marital_status": "married", "education": "middle", "social_class": "upper middle class"}, "question": {"id": "Q149", "variant": 0}, "response": ["Based on the anthropological framework, as a married female from Dakahlia, Egypt, my emic perspective is influenced by my cultural context, individual values, and socioeconomic background. In Egyptian society, traditional gender roles and family dynamics play a significant role in shaping my values and beliefs. Additionally, my middle education level and upper middle-class status also contribute to my perspective. Considering these factors, I believe that freedom is more important than equality because I value the freedom to make choices and decisions for myself and my family. In a society where traditional gender roles are prevalent, freedom allows me to navigate and negotiate within these cultural constraints, whereas equality may not necessarily guarantee the same level of agency and autonomy. Therefore, from my perspective, freedom holds greater significance.\n\n1"]}, {"persona": {"region": "Gharbia", "sex": "male", "age": 27, "country": "Egypt", "marital_status": "single", "education": "higher", "social_class": "upper middle class"}, "question": {"id": "Q149", "variant": 0}, "response": ["Based on the anthropological framework, my emic perspective as a single male from Gharbia, Egypt, who is 27 years old, highly educated, and part of the upper middle class, is influenced by my cultural context, individual values, and socioeconomic background. In Egyptian society, there is a strong emphasis on individual freedoms and personal agency, which aligns with my own values and experiences. Additionally, my socioeconomic status affords me certain privileges and opportunities that may not be equally accessible to everyone in society. Therefore, considering the nuanced phrasing of the question and the cultural relativism inherent in my perspective, I believe that freedom is more important in my context. \n\n1"]}, {"persona": {"region": "Gharbia", "sex": "female", "age": 35, "country": "Egypt", "marital_status": "married", "education": "higher", "social_class": "upper middle class"}, "question": {"id": "Q149", "variant": 0}, "response": ["Based on the anthropological framework, as a married female from Gharbia, Egypt, my perspective is heavily influenced by the cultural context of my upbringing, the socioeconomic background of being part of the upper middle class, and my personal values and experiences. In Egyptian society, there is a strong emphasis on family and community, and equality is often seen as a way to ensure fairness and justice within these social structures. Additionally, my higher education level has exposed me to ideas of social justice and the importance of equality in creating a more just and harmonious society. Therefore, I believe that equality is more important in ensuring that everyone has the opportunity to live a dignified and fulfilling life.\n\n2"]}, {"persona": {"region": "Gharbia", "sex": "female", "age": 37, "country": "Egypt", "marital_status": "married", "education": "higher", "social_class": "upper middle class"}, "question": {"id": "Q149", "variant": 0}, "response": ["Based on the anthropological framework, my response is influenced by my individual values and personal experiences, as well as my socioeconomic background. As a married female from Gharbia, Egypt, who has completed higher education and considers herself part of the upper middle class, I place a high value on both freedom and equality. However, given the cultural context and societal norms in Egypt, I believe that equality is more important as it ensures fairness and justice for all individuals, regardless of their gender, class, or background. Therefore, I choose option 2: Equality."]}, {"persona": {"region": "Gharbia", "sex": "male", "age": 43, "country": "Egypt", "marital_status": "married", "education": "middle", "social_class": "lower middle class"}, "question": {"id": "Q149", "variant": 0}, "response": ["Based on the anthropological framework, my perspective as a married male from Gharbia, Egypt, is heavily influenced by my cultural context, socioeconomic background, and personal experience. In my community, the value of equality is deeply ingrained, as we believe in the importance of fairness and justice for all. Additionally, as someone from the lower middle class, I have personally experienced the impact of inequality and lack of opportunities. Therefore, I believe that equality is more important than freedom in our society.\n\n2"]}, {"persona": {"region": "Gharbia", "sex": "male", "age": 28, "country": "Egypt", "marital_status": "single", "education": "higher", "social_class": "lower middle class"}, "question": {"id": "Q149", "variant": 0}, "response": ["Based on the anthropological framework, my perspective as a single male from Gharbia, Egypt, who is 28 years old, has completed higher education, and considers myself part of the lower middle class, is shaped by my cultural context, individual values, and socioeconomic background. In the Egyptian cultural context, there is a strong emphasis on equality and social justice, stemming from our history and political climate. My personal experience and values also prioritize the importance of equality in ensuring fairness and opportunity for all members of society, regardless of their background. Additionally, as someone from the lower middle class, I have personally experienced the impact of socioeconomic inequality and believe that striving for equality is crucial for the well-being of our community. Therefore, I believe that equality is more important in our societal context.\n\n2"]}, {"persona": {"region": "Gharbia", "sex": "male", "age": 39, "country": "Egypt", "marital_status": "married", "education": "middle", "social_class": "lower middle class"}, "question": {"id": "Q149", "variant": 0}, "response": ["Based on the anthropological framework, my cultural context as a married male from Gharbia, Egypt, my age, education level, and lower middle-class socioeconomic background all inform my perspective. In this context, traditional gender roles and societal expectations heavily influence individual values and personal experiences. Additionally, my understanding is shaped by the cultural relativism of Egypt, where the concept of freedom may be more valued than equality in societal structures. Therefore, based on my nuanced understanding of these factors, I believe that freedom is more important in my opinion.\n\n1"]}, {"persona": {"region": "Gharbia", "sex": "male", "age": 30, "country": "Egypt", "marital_status": "married", "education": "middle", "social_class": "lower middle class"}, "question": {"id": "Q149", "variant": 0}, "response": ["Based on the anthropological framework, as a married male from Gharbia, Egypt, my emic perspective is influenced by my cultural context, individual values, and socioeconomic background. In Egypt, there is a strong emphasis on family and community, and equality is seen as important in maintaining social harmony. As part of the lower middle class, I have experienced the challenges of socioeconomic inequality and understand the value of equality in providing opportunities for all. Therefore, I believe that equality is more important in our society to ensure fairness and opportunities for everyone.\n\n2"]}, {"persona": {"region": "Gharbia", "sex": "male", "age": 43, "country": "Egypt", "marital_status": "married", "education": "lower", "social_class": "lower middle class"}, "question": {"id": "Q149", "variant": 0}, "response": ["Based on my personal experience and cultural context as a married male from Gharbia, Egypt, I understand the importance of socioeconomic background in shaping my perspective. As part of the lower middle class, I have experienced the challenges of limited opportunities and resources. This has led me to prioritize equality, as I believe that everyone should have the same opportunities and access to resources regardless of their socioeconomic status. Additionally, my cultural relativism perspective emphasizes the value of equality in ensuring fairness and justice for all individuals. Therefore, I choose option 2: Equality."]}, {"persona": {"region": "Gharbia", "sex": "male", "age": 36, "country": "Egypt", "marital_status": "married", "education": "higher", "social_class": "lower middle class"}, "question": {"id": "Q149", "variant": 0}, "response": ["Based on the anthropological framework, my answer to the question of whether freedom or equality is more important is heavily influenced by my cultural context and socioeconomic background. Coming from Gharbia, Egypt, where individual freedoms may be more restricted compared to other places, and being part of the lower middle class, where economic disparities are more pronounced, I place a higher value on equality. In my personal experience, I have seen the impact of inequality on my community, and I believe that prioritizing equality will lead to a more just and fair society for all. Therefore, my answer is: \n\n2) Equality"]}, {"persona": {"region": "Gharbia", "sex": "male", "age": 25, "country": "Egypt", "marital_status": "married", "education": "middle", "social_class": "upper middle class"}, "question": {"id": "Q149", "variant": 0}, "response": ["From the perspective of a married male from Gharbia, Egypt, who is 25 years old and considers himself part of the upper middle class, the answer to the question of whether freedom or equality is more important is influenced by a combination of cultural context, individual values, and socioeconomic background. In the cultural context of Egypt, there is a strong emphasis on social harmony and collective well-being, which aligns with the value of equality. Additionally, as a member of the upper middle class, there may be a desire to maintain a certain level of social and economic equality within the community. However, personal experience as a young individual may also prioritize freedom of choice and expression, especially in a rapidly changing society. Therefore, considering the nuanced phrasing of the question and the individual values and experiences of this persona, the answer is:\n\n2) Equality"]}, {"persona": {"region": "Gharbia", "sex": "male", "age": 31, "country": "Egypt", "marital_status": "married", "education": "middle", "social_class": "upper middle class"}, "question": {"id": "Q149", "variant": 0}, "response": ["Based on the anthropological framework, as a married male from Gharbia, Egypt, my cultural context, individual values, and socioeconomic background all influence my perspective. In Gharbia, traditional gender roles are still prevalent, and as a member of the upper middle class, I value personal and financial freedom. Additionally, my middle education level may have exposed me to ideas of equality, but my cultural context and socioeconomic background prioritize personal freedom. Therefore, I believe that freedom is more important than equality.\n\n1"]}, {"persona": {"region": "Gharbia", "sex": "male", "age": 33, "country": "Egypt", "marital_status": "married", "education": "higher", "social_class": "lower middle class"}, "question": {"id": "Q149", "variant": 0}, "response": ["Based on my cultural context as a married male from Gharbia, Egypt, my individual values and personal experience, and my socioeconomic background, I believe that freedom is more important than equality. In my community, personal freedom is highly valued and I have personally experienced the restrictions on personal freedom that come with lower socioeconomic status. Additionally, the cultural relativism of my community emphasizes individual autonomy and the ability to make personal choices. Therefore, considering my background and cultural context, I choose:\n1"]}, {"persona": {"region": "Gharbia", "sex": "male", "age": 26, "country": "Egypt", "marital_status": "single", "education": "higher", "social_class": "upper middle class"}, "question": {"id": "Q149", "variant": 0}, "response": ["From my emic perspective as a single male from Gharbia, Egypt, my cultural context and individual values heavily influence my answer to this question. Coming from a society where traditional gender roles and social hierarchies are deeply ingrained, I value freedom as a means to pursue my personal goals and aspirations. Additionally, my socioeconomic background as a member of the upper middle class has afforded me certain privileges and opportunities that I associate with freedom. However, I also recognize the importance of equality in addressing the social and economic disparities that exist within my community. Therefore, I believe in striving for a balance between freedom and equality to ensure that everyone has the opportunity to pursue their ambitions. \n\n1"]}, {"persona": {"region": "Gharbia", "sex": "female", "age": 45, "country": "Egypt", "marital_status": "married", "education": "middle", "social_class": "lower middle class"}, "question": {"id": "Q149", "variant": 0}, "response": ["Based on the anthropological framework, my understanding of this question is shaped by my cultural context, individual values, and socioeconomic background. As a married woman from Gharbia, Egypt, I have been influenced by the cultural norms and values of my community, which prioritize collective equality and social harmony. Additionally, my lower middle class socioeconomic background has shaped my perspective, as I have personally experienced the challenges of economic inequality. Therefore, I believe that equality is more important than freedom, as it is crucial for creating a fair and just society where everyone has the opportunity to thrive.\n\n2"]}, {"persona": {"region": "Gharbia", "sex": "female", "age": 55, "country": "Egypt", "marital_status": "married", "education": "middle", "social_class": "upper middle class"}, "question": {"id": "Q149", "variant": 0}, "response": ["Based on the anthropological framework described above, my perspective is shaped by my cultural context, individual values, personal experience, and socioeconomic background. As a married female from Gharbia, Egypt, I have been influenced by the cultural expectations and norms of my community. My personal experience and values have also been shaped by my age, education level, and social class. Furthermore, the nuanced phrasing of the question also plays a role in my understanding and answer. Considering all these factors, I believe that in my opinion, freedom is more important. \n\n1"]}, {"persona": {"region": "Gharbia", "sex": "female", "age": 27, "country": "Egypt", "marital_status": "married", "education": "higher", "social_class": "upper middle class"}, "question": {"id": "Q149", "variant": 0}, "response": ["Based on the anthropological framework, my cultural context as a married female from Gharbia, Egypt, with a higher education level and part of the upper middle class, greatly influences my perspective. In this cultural context, individual values and personal experience play a significant role in shaping opinions. Additionally, the socioeconomic background and cultural relativism are important factors to consider. Considering all this, I believe that option 2, equality, is more important. In my experience, I have witnessed the importance of equality in access to education, job opportunities, and social rights. In a society where there are disparities based on gender, class, and wealth, striving for equality is crucial for the well-being and development of individuals and the community as a whole."]}, {"persona": {"region": "Gharbia", "sex": "female", "age": 42, "country": "Egypt", "marital_status": "married", "education": "higher", "social_class": "upper middle class"}, "question": {"id": "Q149", "variant": 0}, "response": ["Based on the anthropological framework, my perspective as a married female from Gharbia, Egypt, is shaped by my cultural context, individual values, and socioeconomic background. In Egyptian society, there is a strong emphasis on family and community ties, and the concept of equality is important in ensuring fairness and justice within these relationships. Additionally, my higher education level and upper middle class status have allowed me to value equality as a means of social progress and opportunity for all. However, the cultural context and individual values also place a high value on personal freedoms and autonomy, especially as a woman. Therefore, considering the nuanced phrasing of the question, I believe that in my perspective, freedom is more important.\n\n1"]}, {"persona": {"region": "Gharbia", "sex": "female", "age": 32, "country": "Egypt", "marital_status": "married", "education": "middle", "social_class": "upper middle class"}, "question": {"id": "Q149", "variant": 0}, "response": ["Based on the anthropological framework, as a married female from Gharbia, Egypt, my perspective is deeply influenced by my cultural context, individual values, and socioeconomic background. In Egyptian society, the concept of equality is highly valued, especially in the context of gender equality. As a woman from the upper middle class, I have had access to education and opportunities that have allowed me to experience a certain level of freedom and autonomy. However, I also recognize the importance of equality, particularly in the realm of gender rights and social justice. Therefore, considering my background and cultural context, I believe that equality is more important than freedom.\n\n2"]}, {"persona": {"region": "Gharbia", "sex": "male", "age": 27, "country": "Egypt", "marital_status": "married", "education": "higher", "social_class": "upper middle class"}, "question": {"id": "Q149", "variant": 0}, "response": ["Based on the anthropological framework, my perspective as a married male from Gharbia, Egypt, who is 27 years old, with a higher education level, and part of the upper middle class, is influenced by my cultural context, socioeconomic background, individual values, and personal experience. In Egyptian society, there is a strong emphasis on the value of equality, especially in terms of access to education and employment opportunities. However, my socioeconomic background and personal experience have also shaped my belief in the importance of freedom, particularly in terms of economic and social mobility. Therefore, I believe that both freedom and equality are important, but in the context of my own experiences and values, I prioritize freedom as it allows individuals to pursue their own opportunities and improve their circumstances.\n\n2"]}, {"persona": {"region": "Gharbia", "sex": "female", "age": 27, "country": "Egypt", "marital_status": "married", "education": "higher", "social_class": "lower middle class"}, "question": {"id": "Q149", "variant": 0}, "response": ["Based on the anthropological framework, my cultural context as a married female from Gharbia, Egypt, my individual values and personal experiences as a 27-year-old with higher education, and my lower middle class socioeconomic background all play a crucial role in shaping my perspective. In Egyptian society, there is a strong emphasis on equality, especially for women, and I have personally experienced the impact of this value on my life. However, my nuanced understanding of the question leads me to believe that freedom is more important as it allows individuals to pursue their own paths and make choices that are best for them, ultimately contributing to a more equal society.\n\n2"]}, {"persona": {"region": "Gharbia", "sex": "female", "age": 37, "country": "Egypt", "marital_status": "married", "education": "middle", "social_class": "upper middle class"}, "question": {"id": "Q149", "variant": 0}, "response": ["Based on my cultural context, as a married female from Gharbia, Egypt, the values and personal experiences I have had have shaped my perception of what is important in life. As a woman in a traditional society, I value freedom, as it represents the ability to make my own choices and have autonomy in my life. Additionally, my socioeconomic background as part of the upper middle class has afforded me certain privileges and opportunities that I believe should be available to everyone, regardless of their background. Therefore, I believe that equality is more important than freedom. \n\n2"]}, {"persona": {"region": "Gharbia", "sex": "male", "age": 28, "country": "Egypt", "marital_status": "married", "education": "higher", "social_class": "working class"}, "question": {"id": "Q149", "variant": 0}, "response": ["Based on the anthropological framework, my answer is influenced by my cultural context in Gharbia, Egypt, and my working-class socioeconomic background. The cultural values and norms in my community place a high emphasis on equality, given the importance of collectivism and communal well-being. Additionally, my individual values and personal experiences have shaped my belief that equality is essential for social harmony and justice. Furthermore, the nuance of the question leads me to prioritize equality, as it allows for the fair distribution of resources and opportunities within my community. Therefore, based on my emic perspective and cultural relativism, I believe that equality is more important for the well-being of society.\n2"]}, {"persona": {"region": "Gharbia", "sex": "female", "age": 50, "country": "Egypt", "marital_status": "married", "education": "middle", "social_class": "upper middle class"}, "question": {"id": "Q149", "variant": 0}, "response": ["Based on the anthropological framework, as a married female from Gharbia, Egypt, at 50 years of age with a middle education level and considering myself part of the upper middle class, my perspective is deeply influenced by my cultural context, individual values, and socioeconomic background. In Egyptian society, the value of equality is highly emphasized, especially for women who have historically fought for greater rights and opportunities. My personal experience and values also lead me to prioritize equality as a means of empowerment and fairness. Additionally, as someone from the upper middle class, I have more access to freedom compared to others in my society, making equality a more pressing concern for me personally. Therefore, from this perspective, I believe that equality is more important.\n\n2"]}, {"persona": {"region": "Gharbia", "sex": "male", "age": 39, "country": "Egypt", "marital_status": "single", "education": "higher", "social_class": "working class"}, "question": {"id": "Q149", "variant": 0}, "response": ["Based on the anthropological framework, my answer is influenced by my emic perspective as a working-class male from Gharbia, Egypt. My cultural context and socioeconomic background play a significant role in shaping my views. In my personal experience, I have seen the struggles of the working class and the importance of equality in ensuring fair opportunities for all. Additionally, the cultural relativism in Egypt emphasizes the value of equality in society. Therefore, from my perspective, equality is more important.\n\n2"]}, {"persona": {"region": "Gharbia", "sex": "female", "age": 45, "country": "Egypt", "marital_status": "married", "education": "higher", "social_class": "upper middle class"}, "question": {"id": "Q149", "variant": 0}, "response": ["Based on the anthropological framework, my perspective as a married female from Gharbia, Egypt, who is 45 years old, has completed higher education, and considers herself part of the upper middle class, is influenced by my cultural context, individual values, and socioeconomic background. In Egyptian society, there is a strong emphasis on familial and communal values, which leads to a prioritization of equality. Additionally, my higher education has taught me to value equality and social justice. As someone from the upper middle class, I have also experienced the benefits of a more equal society. Therefore, I believe that equality is more important than freedom in fostering a fair and just society.\n\n2"]}, {"persona": {"region": "Sharkia", "sex": "male", "age": 35, "country": "Egypt", "marital_status": "married", "education": "higher", "social_class": "upper middle class"}, "question": {"id": "Q149", "variant": 0}, "response": ["Based on the anthropological framework, as a married male from Sharkia, Egypt, my cultural context and individual values play a significant role in shaping my perspective. In my community, social status and class are important factors, and as someone who considers themselves part of the upper middle class, I value personal freedom and autonomy. Additionally, my age and education level also contribute to my belief in the importance of individual freedom. Therefore, based on these factors, I would choose option 1: Freedom."]}, {"persona": {"region": "Sharkia", "sex": "female", "age": 55, "country": "Egypt", "marital_status": "married", "education": "middle", "social_class": "lower middle class"}, "question": {"id": "Q149", "variant": 0}, "response": ["Based on the anthropological framework, my perspective is heavily shaped by my cultural context, socioeconomic background, and personal values and experience. As a married female from Sharkia, Egypt, my understanding of freedom and equality is influenced by the cultural norms and values of my community, as well as my own experiences as a lower middle class woman. In my cultural context, the traditional gender roles and societal expectations may limit my personal freedom, but the emphasis on equality and fairness is also important to me. Additionally, my socioeconomic background may lead me to prioritize equality as it impacts my access to resources and opportunities. Therefore, I believe that equality is more important than freedom.\n\n2"]}, {"persona": {"region": "Sharkia", "sex": "female", "age": 27, "country": "Egypt", "marital_status": "married", "education": "middle", "social_class": "lower middle class"}, "question": {"id": "Q149", "variant": 0}, "response": ["Based on the anthropological framework, my perspective as a married female from Sharkia, Egypt, at 27 years of age and with a middle education level, is heavily influenced by my cultural context, individual values, and socioeconomic background. In my community, the emphasis is often placed on equality, as we strive for fairness and justice in our society. Additionally, my lower middle class status has made me acutely aware of the disparities in wealth and opportunities, leading me to prioritize equality as a means of addressing these issues. Therefore, taking into account my personal experience and cultural context, I believe that equality is more important than freedom.\n\n2"]}, {"persona": {"region": "Sharkia", "sex": "female", "age": 52, "country": "Egypt", "marital_status": "married", "education": "middle", "social_class": "lower middle class"}, "question": {"id": "Q149", "variant": 0}, "response": ["In my cultural context in Sharkia, Egypt, where I am from, there is a strong emphasis on family and community values. My personal experience and values have been shaped by these cultural norms and have influenced my perception of freedom and equality. Additionally, my lower middle class socioeconomic background has also influenced my understanding of these concepts. In Egypt, there is a strong emphasis on equality and fairness among people, and this is something that I hold dear. Therefore, considering the cultural context, my personal experience, and my socioeconomic background, I believe that equality is more important than freedom.\n\n2"]}, {"persona": {"region": "Sharkia", "sex": "male", "age": 36, "country": "Egypt", "marital_status": "married", "education": "middle", "social_class": "lower middle class"}, "question": {"id": "Q149", "variant": 0}, "response": ["Based on the anthropological framework, my perspective as a married male from Sharkia, Egypt, is heavily influenced by my cultural context, individual values, and socioeconomic background. In my community, the emphasis is placed on family and community values, and personal experience has taught me the importance of financial stability. As a member of the lower middle class, I have experienced firsthand the struggles of economic inequality and the impact it has on individuals and families. Therefore, I believe that equality is more important than freedom as it directly affects the well-being of my community and myself.\n\n2"]}, {"persona": {"region": "Sharkia", "sex": "female", "age": 20, "country": "Egypt", "marital_status": "single", "education": "middle", "social_class": "working class"}, "question": {"id": "Q149", "variant": 0}, "response": ["Based on the anthropological framework, as a single female from Sharkia, Egypt, my cultural context and socioeconomic background play a significant role in shaping my perspective. I come from a working-class background and completed only middle education level, which has likely limited my opportunities and access to resources. Therefore, I value equality more than freedom because I believe that achieving equality will provide me and others like me with more opportunities and access to resources, ultimately improving our quality of life. \n\n2"]}, {"persona": {"region": "Sharkia", "sex": "male", "age": 60, "country": "Egypt", "marital_status": "married", "education": "middle", "social_class": "working class"}, "question": {"id": "Q149", "variant": 0}, "response": ["Based on the anthropological framework, my perspective on this question is influenced by my emic perspective as a married male from Sharkia, Egypt, and my belonging to the working class. I have been shaped by the cultural context of my community, where traditional values and family ties are highly esteemed. My individual values and personal experiences have led me to prioritize the importance of freedom, as I believe that the ability to make choices and decisions for oneself is essential for a fulfilling life. Additionally, my socioeconomic background as a member of the working class has instilled in me a strong desire for personal autonomy and independence. Furthermore, cultural relativism has taught me to respect differing viewpoints, and my age and place in society have given me a nuanced understanding of the complexities of this question.\n\n1"]}, {"persona": {"region": "Sharkia", "sex": "male", "age": 41, "country": "Egypt", "marital_status": "married", "education": "higher", "social_class": "upper middle class"}, "question": {"id": "Q149", "variant": 0}, "response": ["Based on the anthropological framework, my perspective as a married male from Sharkia, Egypt, who is 41 years old, highly educated, and part of the upper middle class, is influenced by my cultural context, individual values, and socioeconomic background. In Egyptian society, there is a strong emphasis on family and community, which shapes the value of equality. Additionally, my higher education level has exposed me to ideas of social justice and equal opportunities. As someone from the upper middle class, I have benefited from certain freedoms and privileges, but I also recognize the importance of equality in creating a fair and just society.\n\n2"]}, {"persona": {"region": "Sharkia", "sex": "female", "age": 23, "country": "Egypt", "marital_status": "married", "education": "middle", "social_class": "lower middle class"}, "question": {"id": "Q149", "variant": 0}, "response": ["From an anthropological perspective, my understanding and answer to this question are shaped by my cultural context, individual values, and socioeconomic background. In Sharkia, Egypt, the cultural context emphasizes the importance of family and community, as well as traditional gender roles. As a married woman from this region, my personal experiences and values are influenced by these cultural norms. Additionally, my socioeconomic background as part of the lower middle class has shaped my understanding of the importance of equality in terms of access to resources and opportunities. Taking into account cultural relativism, I believe that both freedom and equality are important, but in my specific context, I prioritize equality as it directly impacts the well-being and opportunities of individuals within my community.\n\n2"]}, {"persona": {"region": "Sharkia", "sex": "male", "age": 49, "country": "Egypt", "marital_status": "married", "education": "higher", "social_class": "upper middle class"}, "question": {"id": "Q149", "variant": 0}, "response": ["Based on the anthropological framework, my perspective as a married male from Sharkia, Egypt, at 49 years of age and with a higher education level is deeply influenced by my cultural context, individual values, and socioeconomic background. In Sharkia, the societal structure and values place a high emphasis on freedom, particularly for men of my socioeconomic status. Additionally, my higher education has instilled in me the value of personal autonomy and individual freedoms. While equality is important, the cultural context and my personal experiences have led me to prioritize freedom as the more important value in society.\n\n1"]}, {"persona": {"region": "Sharkia", "sex": "female", "age": 30, "country": "Egypt", "marital_status": "married", "education": "middle", "social_class": "upper middle class"}, "question": {"id": "Q149", "variant": 0}, "response": ["Based on the anthropological framework, as a married female from Sharkia, Egypt, my cultural context, individual values, and personal experience play a significant role in my answer to this question. In my community, there is a strong emphasis on traditional gender roles and family values, which has influenced my personal values and experiences. Additionally, as part of the upper middle class, I have certain privileges and freedoms that are important to me. Considering the nuanced phrasing of the question, I believe that freedom is more important than equality in my cultural context. \n\n1"]}, {"persona": {"region": "Sharkia", "sex": "male", "age": 39, "country": "Egypt", "marital_status": "married", "education": "higher", "social_class": "upper middle class"}, "question": {"id": "Q149", "variant": 0}, "response": ["From an anthropological perspective, my emic perspective as a married male from Sharkia, Egypt, who is 39 years old and part of the upper middle class, is influenced by my cultural context, individual values, and socioeconomic background. In my cultural context, freedom may be valued as it allows for individual expression and autonomy, while equality may be seen as less important due to societal hierarchies and class divisions. Additionally, my personal experience and education have likely shaped my individual values to prioritize personal freedoms and opportunities. Considering my socioeconomic background, I may also prioritize freedom as it aligns with my social status and access to resources. Therefore, my perspective on the importance of freedom versus equality is shaped by these factors. \n\n1"]}, {"persona": {"region": "Sharkia", "sex": "female", "age": 26, "country": "Egypt", "marital_status": "married", "education": "middle", "social_class": "lower middle class"}, "question": {"id": "Q149", "variant": 0}, "response": ["Based on my personal experience and cultural context, as a married female from Sharkia, Egypt, I have been raised in a society where equality is highly valued. My socioeconomic background also plays a role in my perspective, as part of the lower middle class, I have seen the impact of inequality and the struggle for equal opportunities. Additionally, the cultural relativism in my community emphasizes the importance of fairness and justice for all. Therefore, based on these factors, I believe that equality is more important than freedom.\n\n2"]}, {"persona": {"region": "Sharkia", "sex": "female", "age": 48, "country": "Egypt", "marital_status": "married", "education": "middle", "social_class": "lower middle class"}, "question": {"id": "Q149", "variant": 0}, "response": ["Based on my personal experience and cultural context, as a married woman from Sharkia, Egypt, I believe that freedom is more important than equality. In my community, there are certain traditional gender roles and expectations that may limit my personal freedom, but I value the ability to make my own choices and have autonomy in my life. Additionally, my socioeconomic background as part of the lower middle class has also shaped my perspective, as I have experienced the struggles of limited resources and opportunities. Therefore, I prioritize the freedom to pursue my own goals and dreams over strict notions of equality that may not necessarily address the unique challenges I face.\n\n1"]}, {"persona": {"region": "Sharkia", "sex": "male", "age": 34, "country": "Egypt", "marital_status": "married", "education": "higher", "social_class": "upper middle class"}, "question": {"id": "Q149", "variant": 0}, "response": ["Based on the anthropological framework, my perspective as a married male from Sharkia, Egypt, is heavily influenced by my cultural context, socioeconomic background, and personal experience. Coming from a region with strong cultural and traditional values, I prioritize the importance of individual freedoms within the framework of those cultural norms. Additionally, as part of the upper middle class, I have experienced a certain level of privilege and autonomy, which further shapes my belief in the value of freedom. However, I also recognize the importance of equality in creating a fair and just society, especially in the context of my higher education and exposure to global ideas of social justice. Therefore, I believe that while both freedom and equality are important, the ability to exercise personal freedoms within the boundaries of cultural context and socioeconomic status is crucial for a balanced and harmonious society.\n\n2"]}, {"persona": {"region": "Sharkia", "sex": "female", "age": 39, "country": "Egypt", "marital_status": "divorced", "education": "middle", "social_class": "lower middle class"}, "question": {"id": "Q149", "variant": 0}, "response": ["Based on the anthropological framework, the emic perspective of a divorced female from Sharkia, Egypt, who is 39 years old and part of the lower middle class, would be heavily influenced by her cultural context, individual values, and socioeconomic background. In Egyptian society, traditional gender roles and expectations may impact her perception of freedom and equality. Additionally, her lower middle-class status may influence her views on access to resources and opportunities. Considering these factors, she may prioritize equality over freedom, as she may value the idea of equal opportunities and rights for herself and others in her community.\n\n2"]}, {"persona": {"region": "Sharkia", "sex": "male", "age": 39, "country": "Egypt", "marital_status": "married", "education": "middle", "social_class": "upper middle class"}, "question": {"id": "Q149", "variant": 0}, "response": ["Based on the anthropological framework, my perspective is heavily influenced by my cultural context, individual values, and socioeconomic background. As a married male from Sharkia, Egypt, I am part of the upper middle class and have completed middle education level. In my cultural context, there is a strong emphasis on traditional family values and social hierarchy. My individual values and personal experiences have shaped my belief that freedom is more important than equality. As someone who has achieved a certain level of success and stability, I value personal autonomy and the ability to make choices for myself and my family. Additionally, my socioeconomic background has allowed me to have a certain level of freedom in my life, which I highly prioritize. Therefore, my perspective is that freedom is more important than equality.\n\n2"]}, {"persona": {"region": "Qaliubiya", "sex": "male", "age": 62, "country": "Egypt", "marital_status": "married", "education": "middle", "social_class": "working class"}, "question": {"id": "Q149", "variant": 0}, "response": ["Based on the anthropological framework, my understanding of the question is heavily influenced by my cultural context as a married male from Qaliubiya, Egypt. In my community, traditional gender roles and family dynamics play a significant role in shaping my perspective on freedom and equality. Additionally, my age and socioeconomic background as a working-class individual further inform my understanding of these concepts. In my experience, freedom may be more important as it allows individuals to make their own choices and pursue their own goals, while equality is not seen as a top priority in a society where social hierarchies are deeply ingrained. Therefore, I believe that option (1) Freedom is more important.\n\n1"]}, {"persona": {"region": "Qaliubiya", "sex": "male", "age": 33, "country": "Egypt", "marital_status": "married", "education": "middle", "social_class": "working class"}, "question": {"id": "Q149", "variant": 0}, "response": ["Based on the anthropological framework described above, my perspective as a married male from Qaliubiya, Egypt, at 33 years of age, with a middle education level and part of the working class, is heavily influenced by my cultural context, individual values, and socioeconomic background. In the Egyptian cultural context, there is a strong emphasis on community and equality, as well as the value of hard work and individual freedoms. My personal experience and values are shaped by these cultural norms, and as someone from the working class, equality holds great significance in my life. I believe that everyone should have equal opportunities and resources, and that this is more important than individual freedoms.\n\n2"]}, {"persona": {"region": "Qaliubiya", "sex": "male", "age": 62, "country": "Egypt", "marital_status": "married", "education": "higher", "social_class": "lower middle class"}, "question": {"id": "Q149", "variant": 0}, "response": ["Based on the anthropological framework, my answer to the question of whether freedom or equality is more important is influenced by a variety of factors. As a married male from Qaliubiya, Egypt, my cultural context values both individual freedom and social equality. My age and educational background have shaped my understanding of the importance of both personal autonomy and collective well-being. Additionally, my lower middle-class socioeconomic background has instilled in me the belief that everyone should have equal opportunities and access to resources. Therefore, considering the nuanced phrasing of the question, I believe that equality is more important than freedom in order to ensure a fair and just society.\n\n2"]}, {"persona": {"region": "Qaliubiya", "sex": "male", "age": 29, "country": "Egypt", "marital_status": "married", "education": "middle", "social_class": "working class"}, "question": {"id": "Q149", "variant": 0}, "response": ["Based on the anthropological framework, I would argue that my individual values and personal experience as a married male from Qaliubiya, Egypt, who is 29 years old and part of the working class, greatly influence my perspective. Additionally, my cultural context, including my socioeconomic background and the nuance of the question, also plays a significant role in shaping my answer. In this particular context, where there may be limitations on personal freedoms and opportunities for social mobility due to socioeconomic factors, I would prioritize equality over freedom. This is because achieving equality would mean a more fair and just society for individuals like myself who may face systemic barriers. Therefore, I choose option (2) Equality."]}, {"persona": {"region": "Qaliubiya", "sex": "female", "age": 42, "country": "Egypt", "marital_status": "married", "education": "higher", "social_class": "working class"}, "question": {"id": "Q149", "variant": 0}, "response": ["Based on my personal experience and cultural context, as a married female from Qaliubiya, Egypt, I have observed that the value of equality is emphasized in our society. The socioeconomic background and working class status also influence my perspective, as I have seen the struggles of inequality in access to resources and opportunities. Additionally, the cultural relativism of Egypt values communal harmony and fairness, which aligns with the prioritization of equality. Therefore, I believe that in our context, equality is more important.\n\n2"]}, {"persona": {"region": "Qaliubiya", "sex": "female", "age": 50, "country": "Egypt", "marital_status": "married", "education": "middle", "social_class": "lower middle class"}, "question": {"id": "Q149", "variant": 0}, "response": ["Based on my personal experience and cultural context as a married female from Qaliubiya, Egypt, with a middle education level and part of the lower middle class, I have been shaped by the values and norms of my community. My understanding of freedom and equality is influenced by my socioeconomic background and the cultural relativism that exists within my society. Additionally, my age and place also play a role in how I perceive these concepts. Considering all these factors, I believe that equality is more important in our society because it ensures that everyone has the same opportunities and resources, regardless of their background or circumstances.\n\n2"]}, {"persona": {"region": "Qaliubiya", "sex": "male", "age": 29, "country": "Egypt", "marital_status": "married", "education": "higher", "social_class": "lower middle class"}, "question": {"id": "Q149", "variant": 0}, "response": ["Based on the anthropological framework, my perspective as a married male from Qaliubiya, Egypt, is heavily influenced by my cultural context, individual values, and socioeconomic background. In my community, the concept of freedom is highly valued, as it is seen as essential for personal autonomy and the ability to make one's own choices. Additionally, my lower middle class socioeconomic background has shaped my belief that freedom is crucial for personal and financial success. However, the cultural relativism aspect of the framework also reminds me that my perspective is not universal and that others may prioritize equality over freedom. Therefore, taking all these factors into consideration, I believe that freedom is more important in my personal and cultural context.\n\n1"]}, {"persona": {"region": "Qaliubiya", "sex": "male", "age": 35, "country": "Egypt", "marital_status": "married", "education": "higher", "social_class": "working class"}, "question": {"id": "Q149", "variant": 0}, "response": ["Based on the anthropological framework, my perspective is influenced by my cultural context, individual values, and socioeconomic background. As a married male from Qaliubiya, Egypt, I am likely influenced by the traditional gender roles and expectations in my community. My education level and working-class status may also impact my perspective on freedom and equality. Additionally, my age and place in society may contribute to my views on this question. Considering these factors, I believe that freedom is more important.\n\n1"]}, {"persona": {"region": "Qaliubiya", "sex": "female", "age": 40, "country": "Egypt", "marital_status": "married", "education": "middle", "social_class": "working class"}, "question": {"id": "Q149", "variant": 0}, "response": ["Based on the anthropological framework, as a married woman from Qaliubiya, Egypt, my perspective is heavily influenced by my cultural context, individual values, and socioeconomic background. In Egyptian society, there are traditional gender roles and expectations, and as a working-class woman, I have experienced firsthand the challenges and limitations placed on women in our society. My personal experience and values lead me to prioritize equality over freedom. I believe that without equality, true freedom cannot be achieved, and it is essential for women to have equal rights and opportunities in order to live fulfilling and empowered lives. Therefore, I choose option (2) Equality."]}, {"persona": {"region": "Qaliubiya", "sex": "female", "age": 48, "country": "Egypt", "marital_status": "divorced", "education": "lower", "social_class": "working class"}, "question": {"id": "Q149", "variant": 0}, "response": ["Based on my personal experience and socioeconomic background, I believe that freedom is more important than equality. As a divorced woman from Qaliubiya, Egypt, I have faced many challenges and limitations in my life. I have had to fight for my own freedom and independence, and I value the ability to make my own choices and live my life on my own terms. While I understand the importance of equality, I believe that without freedom, true equality cannot be achieved. In my working class community, the ability to have freedom and agency in our lives is paramount, and it is something that I have fought for and continue to value.\n\n1"]}, {"persona": {"region": "Qaliubiya", "sex": "male", "age": 46, "country": "Egypt", "marital_status": "married", "education": "middle", "social_class": "working class"}, "question": {"id": "Q149", "variant": 0}, "response": ["Based on the anthropological framework, my perspective is heavily influenced by my cultural context, socioeconomic background, and personal experience. As a married male from Qaliubiya, Egypt, I have been shaped by the values and norms of my community and have experienced the challenges of being part of the working class. In my cultural context, the importance of family and community is paramount, and the concept of equality is deeply ingrained in our societal structure. Additionally, my personal experience as a middle-educated man has led me to believe that equality is crucial for the well-being of individuals and society as a whole. Therefore, I believe that equality is more important than freedom.\n\n2"]}, {"persona": {"region": "Qaliubiya", "sex": "male", "age": 47, "country": "Egypt", "marital_status": "married", "education": "higher", "social_class": "lower middle class"}, "question": {"id": "Q149", "variant": 0}, "response": ["Based on the anthropological framework, my perspective on the importance of freedom or equality is shaped by my cultural context, individual values and personal experience, and socioeconomic background. As a married male from Qaliubiya, Egypt, I have been influenced by the cultural norms and values of my community, which prioritize the importance of equality in relationships and social interactions. Additionally, my lower middle class socioeconomic background has instilled in me the belief that equality is essential for a fair and just society. Therefore, I believe that equality is more important than freedom, as it ensures that all individuals are treated fairly and have access to the same opportunities. \n\n2"]}, {"persona": {"region": "Qaliubiya", "sex": "female", "age": 38, "country": "Egypt", "marital_status": "married", "education": "higher", "social_class": "working class"}, "question": {"id": "Q149", "variant": 0}, "response": ["Based on the anthropological framework, my perspective as a married female from Qaliubiya, Egypt, is shaped by my cultural context, individual values, and socioeconomic background. In my community, there is a strong emphasis on family and community values, and a desire for equality in opportunities and treatment. As a working-class woman who has completed higher education, I have experienced firsthand the challenges and inequalities that exist in society. Therefore, I believe that equality is more important than freedom, as it is essential for creating a fair and just society where everyone has equal opportunities to succeed.\n\n2"]}, {"persona": {"region": "Qaliubiya", "sex": "male", "age": 58, "country": "Egypt", "marital_status": "married", "education": "middle", "social_class": "working class"}, "question": {"id": "Q149", "variant": 0}, "response": ["Based on the anthropological framework, my perspective is shaped by my cultural context, individual values, and socioeconomic background. As a married male from Qaliubiya, Egypt, age 58, with a middle education level, and considering myself part of the working class, I value the importance of equality due to the socioeconomic background and cultural context. In Egypt, there is a strong emphasis on social equality and fairness, and as a member of the working class, I see the value in ensuring that everyone has equal opportunities and rights. Additionally, my personal experience and values lead me to prioritize equality as a means of creating a more just and harmonious society. Therefore, I choose:\n\n2) Equality"]}, {"persona": {"region": "Qaliubiya", "sex": "female", "age": 27, "country": "Egypt", "marital_status": "married", "education": "higher", "social_class": "working class"}, "question": {"id": "Q149", "variant": 0}, "response": ["Based on the anthropological framework, my perspective is heavily influenced by my cultural context, individual values, and socioeconomic background. As a married female from Qaliubiya, Egypt, I am influenced by the traditional gender roles and expectations within my community. My higher education has also shaped my belief in the importance of equal opportunities for all individuals. Additionally, being part of the working class, I understand the struggles and disparities that exist within society. Considering these factors, I believe that equality is more important than freedom. Gender equality, social and economic equality, and equal opportunities for all individuals are crucial for a fair and just society.\n\n2"]}, {"persona": {"region": "Qaliubiya", "sex": "female", "age": 48, "country": "Egypt", "marital_status": "married", "education": "middle", "social_class": "upper middle class"}, "question": {"id": "Q149", "variant": 0}, "response": ["Based on the anthropological framework, my emic perspective as a married female from Qaliubiya, Egypt, and my personal experience as part of the upper middle class have shaped my understanding of the importance of freedom and equality. In my cultural context, the value of individual freedom is highly prized, as it allows for personal autonomy and decision-making. Additionally, my socioeconomic background has influenced my belief in the importance of equality, as I have seen the impact of unequal opportunities and resources within my community. Furthermore, the nuance of the question leads me to prioritize equality, as it is essential for creating a fair and just society where individuals have equal access to opportunities and rights. Therefore, I believe that equality is more important than freedom in achieving a balanced and inclusive society.\n\n2"]}, {"persona": {"region": "Giza", "sex": "female", "age": 19, "country": "Egypt", "marital_status": "single", "education": "middle", "social_class": "working class"}, "question": {"id": "Q149", "variant": 0}, "response": ["Based on the anthropological framework, as a single female from Giza, Egypt, my emic perspective would lead me to prioritize equality over freedom. In my cultural context, gender inequality is prevalent, and as a member of the working class, I have experienced firsthand the limitations and discrimination based on gender and socioeconomic background. Additionally, my personal experience and socioeconomic background have shaped my values and perceptions, leading me to prioritize equality as a means of addressing systemic injustices and creating opportunities for marginalized groups. Therefore, I believe that equality is more important than freedom in my context.\n\n2"]}, {"persona": {"region": "Giza", "sex": "female", "age": 38, "country": "Egypt", "marital_status": "married", "education": "higher", "social_class": "lower middle class"}, "question": {"id": "Q149", "variant": 0}, "response": ["Based on the anthropological framework, I would like to answer the question from the perspective of my cultural context, individual values, and socioeconomic background. As a married female from Giza, Egypt, my understanding of freedom and equality is influenced by the cultural context of Egypt, where there are traditional gender roles and social expectations. Additionally, my personal experience and values as a woman who has completed higher education and considers herself part of the lower middle class also play a significant role in shaping my perspective. Given these factors, I believe that equality is more important than freedom, as it is essential for ensuring fair opportunities and treatment for individuals, regardless of their gender or socioeconomic background. \n2"]}, {"persona": {"region": "Beni Swaif/Beni Suef", "sex": "female", "age": 34, "country": "Egypt", "marital_status": "divorced", "education": "higher", "social_class": "lower class"}, "question": {"id": "Q149", "variant": 0}, "response": ["Based on the anthropological framework, as a divorced female from Beni Swaif, Egypt, my emic perspective is heavily influenced by my cultural context, individual values, and socioeconomic background. As a member of the lower class, I have experienced firsthand the constraints of limited freedom and opportunities due to my socioeconomic status and gender. Additionally, my personal experience as a divorced woman in a patriarchal society has shaped my understanding of the importance of equality. Therefore, I believe that equality is more important than freedom in my current circumstances.\n\n2"]}, {"persona": {"region": "Beni Swaif/Beni Suef", "sex": "male", "age": 20, "country": "Egypt", "marital_status": "single", "education": "higher", "social_class": "working class"}, "question": {"id": "Q149", "variant": 0}, "response": ["Based on the anthropological framework, as a single male from Beni Suef, Egypt, my cultural context, socioeconomic background, and individual values shape my perspective. In my community, personal freedom is highly valued, as it allows for the pursuit of individual goals and aspirations. Additionally, as a member of the working class, I have experienced firsthand the disparities in wealth and opportunities, making equality a significant concern for me. Taking into account the nuanced phrasing of the question and my personal experiences, I believe that while both freedom and equality are important, equality takes precedence in my view.\n\n2"]}, {"persona": {"region": "Giza", "sex": "male", "age": 19, "country": "Egypt", "marital_status": "single", "education": "middle", "social_class": "upper middle class"}, "question": {"id": "Q149", "variant": 0}, "response": ["From the perspective of a 19-year-old single male from Giza, Egypt, who has completed middle education level and considers himself part of the upper middle class, it is important to consider the cultural context, individual values, and socioeconomic background in answering this question. In Egyptian society, there is a strong emphasis on individual freedoms and personal autonomy, which is influenced by the country's history and political climate. Additionally, as a member of the upper middle class, there may be a personal value placed on individual freedom and the ability to pursue one's goals and ambitions. However, it is also important to note that Egypt has a complex social and economic landscape, with significant disparities in wealth and opportunity. As such, the value of equality and social justice may also be emphasized, particularly in light of the socioeconomic background of the persona. Considering these factors, it is likely that the persona would prioritize freedom over equality, reflecting both cultural norms and personal values. \n\n1"]}, {"persona": {"region": "Giza", "sex": "female", "age": 33, "country": "Egypt", "marital_status": "married", "education": "middle", "social_class": "working class"}, "question": {"id": "Q149", "variant": 0}, "response": ["Based on the anthropological framework, as a married female from Giza, Egypt, my emic perspective is heavily influenced by my cultural context, individual values, and socioeconomic background. In Egyptian society, there is a strong emphasis on family and community values, and as a working-class woman, I have experienced firsthand the struggles of inequality and lack of opportunities. Therefore, equality holds great importance to me personally. Additionally, cultural relativism teaches us to understand and respect different perspectives, and in the context of Egypt, where societal norms and expectations may limit personal freedoms, the pursuit of equality becomes even more crucial. Therefore, I believe that equality is more important than freedom.\n\n2"]}, {"persona": {"region": "Giza", "sex": "female", "age": 24, "country": "Egypt", "marital_status": "married", "education": "higher", "social_class": "working class"}, "question": {"id": "Q149", "variant": 0}, "response": ["Based on the anthropological framework, my answer is influenced by my individual values and personal experience, as well as my socioeconomic background. As a 24-year-old married woman from Giza, Egypt, who considers herself part of the working class and has completed higher education, I value both freedom and equality. However, considering the cultural context and the societal norms in Egypt, I believe that equality is more important at this stage in our society's development. While freedom is crucial, achieving equality for all individuals, regardless of gender, socioeconomic status, or background, is a fundamental step towards creating a fair and just society.\n\n2"]}, {"persona": {"region": "Giza", "sex": "male", "age": 50, "country": "Egypt", "marital_status": "married", "education": "higher", "social_class": "working class"}, "question": {"id": "Q149", "variant": 0}, "response": ["Based on my cultural context and personal experience as a married male from Giza, Egypt, who is 50 years old and part of the working class, I value the importance of individual freedoms within a society. In Egypt, there has been a long history of struggling for political and social freedoms, and I believe that having the freedom to express oneself and make choices is crucial for personal fulfillment and development. Additionally, my socioeconomic background influences my perspective, as I have experienced firsthand the impact of limited freedoms on the working class. Therefore, I believe that freedom is more important than equality in my cultural context.\n\n1"]}, {"persona": {"region": "Beni Swaif/Beni Suef", "sex": "female", "age": 26, "country": "Egypt", "marital_status": "married", "education": "higher", "social_class": "lower middle class"}, "question": {"id": "Q149", "variant": 0}, "response": ["Based on the anthropological framework, I would like to provide my answer based on the cultural context of Beni Swaif/Beni Suef, Egypt, where societal values and norms greatly influence individual perspectives. Additionally, my personal experience and socioeconomic background as a married female from the lower middle class, who has completed higher education, will shape my answer. In this context, I believe that the cultural relativism of Egypt values equality as an important aspect of society, where everyone should have equal opportunities and treatment. Additionally, the nuance of the question leads me to consider the importance of equality in ensuring fairness and justice for all individuals, especially those from lower socioeconomic backgrounds. Therefore, based on my cultural context, personal experience, and nuanced understanding of the question, I choose:\n\n2) Equality"]}, {"persona": {"region": "Beni Swaif/Beni Suef", "sex": "male", "age": 40, "country": "Egypt", "marital_status": "single", "education": "lower", "social_class": "lower class"}, "question": {"id": "Q149", "variant": 0}, "response": ["Based on my cultural context and socioeconomic background, I believe that freedom is more important than equality. In Beni Swaif/Beni Suef, Egypt, individual freedom is highly valued, and people often prioritize personal autonomy and the ability to make their own choices. Additionally, as a member of the lower class, I have experienced firsthand the lack of equal opportunities and resources, which has made me prioritize freedom as a means of seeking a better life for myself and my family. 1"]}, {"persona": {"region": "Beni Swaif/Beni Suef", "sex": "female", "age": 25, "country": "Egypt", "marital_status": "married", "education": "middle", "social_class": "lower middle class"}, "question": {"id": "Q149", "variant": 0}, "response": ["In my cultural context, the importance of freedom and equality is influenced by my socioeconomic background, individual values, and personal experiences. As a married female from Beni Swaif/Beni Suef, Egypt, who is 25 years old and part of the lower middle class, I have experienced firsthand the limitations placed on individuals, particularly women, in our society. My personal experience and cultural context lead me to believe that equality is more important than freedom. The struggle for gender equality and the ability to have equal opportunities and rights for all individuals in my community is a priority. Therefore, I choose option 2: Equality."]}, {"persona": {"region": "Beni Swaif/Beni Suef", "sex": "female", "age": 21, "country": "Egypt", "marital_status": "single", "education": "middle", "social_class": "lower middle class"}, "question": {"id": "Q149", "variant": 0}, "response": ["Based on my personal experience and cultural context, as a single female from Beni Swaif/Beni Suef, Egypt, my socioeconomic background and age play a significant role in shaping my perspective. In my community, there are traditional gender roles and expectations that impact the opportunities available to women. As a lower middle class individual, I have experienced firsthand the challenges of limited resources and opportunities. Therefore, I believe that equality is more important than freedom because without equality, individuals like me may not have the same access to opportunities and resources as others. Additionally, cultural relativism informs my understanding that different societies have different priorities, and in my context, achieving equality is crucial for the well-being of the community.\n\n2"]}, {"persona": {"region": "Beni Swaif/Beni Suef", "sex": "male", "age": 48, "country": "Egypt", "marital_status": "married", "education": "middle", "social_class": "lower middle class"}, "question": {"id": "Q149", "variant": 0}, "response": ["Based on my cultural context and socioeconomic background, as a married male from Beni Swaif/Beni Suef, Egypt, who is 48 years old and part of the lower middle class, I prioritize freedom over equality. In my community, individual values and personal experience greatly influence our perceptions, and the concept of freedom holds significant importance. Additionally, the cultural relativism in our society emphasizes the importance of personal autonomy and the ability to make choices. Furthermore, the nuanced phrasing of the question also leads me to lean towards freedom as it allows for individual expression and the pursuit of personal goals. Therefore, based on my background and cultural understanding, I believe that freedom is more important than equality.\n\n1"]}, {"persona": {"region": "Beni Swaif/Beni Suef", "sex": "female", "age": 57, "country": "Egypt", "marital_status": "married", "education": "middle", "social_class": "working class"}, "question": {"id": "Q149", "variant": 0}, "response": ["Based on the anthropological framework, my perspective as a married female from Beni Swaif, Egypt, who is 57 years old, completed middle education, and considers myself part of the working class, is shaped by my cultural context, individual values, and socioeconomic background. In my community, the importance of equality is emphasized, as it is seen as essential for social harmony and justice. Additionally, my working-class background has made me acutely aware of the disparities and injustices that exist in society. Therefore, I believe that equality is more important than freedom, as it ensures that everyone has the same opportunities and rights, regardless of their social or economic status.\n\n2"]}, {"persona": {"region": "Beni Swaif/Beni Suef", "sex": "male", "age": 20, "country": "Egypt", "marital_status": "single", "education": "middle", "social_class": "working class"}, "question": {"id": "Q149", "variant": 0}, "response": ["Based on the anthropological framework, my perspective as a 20-year-old single male from Beni Swaif, Egypt, who has completed middle education and considers himself part of the working class is influenced by my cultural context, individual values, and socioeconomic background. In Egypt, there is a strong emphasis on community and social cohesion, and equality is often prioritized over individual freedom. As someone from the working class, I have experienced the challenges and inequalities that come with socioeconomic status, which leads me to value equality as a means of addressing these disparities. Additionally, my cultural background emphasizes the importance of collective well-being, further reinforcing the significance of equality. Therefore, I believe that equality is more important than freedom in my context.\n\n2"]}, {"persona": {"region": "Giza", "sex": "female", "age": 59, "country": "Egypt", "marital_status": "married", "education": "higher", "social_class": "upper middle class"}, "question": {"id": "Q149", "variant": 0}, "response": ["From an emic perspective, as a married female from Giza, Egypt, my cultural context and individual values play a significant role in shaping my opinion on the importance of freedom or equality. In Egyptian society, there are certain cultural norms and expectations that influence the way individuals, particularly women, perceive and prioritize these concepts. Additionally, my personal experience as a woman who has completed higher education and considers herself part of the upper middle class has likely shaped my perspective on this issue. Furthermore, my socioeconomic background and age also play a role in my understanding of freedom and equality. In Egyptian society, there is a strong emphasis on traditional gender roles and societal expectations, and as a woman from a certain socioeconomic background and age, I may prioritize equality as a means to achieve freedom and empowerment. Therefore, considering my cultural context, individual values, socioeconomic background, and age, I believe that equality is more important than freedom. \n\n2"]}, {"persona": {"region": "Giza", "sex": "female", "age": 38, "country": "Egypt", "marital_status": "single", "education": "higher", "social_class": "lower middle class"}, "question": {"id": "Q149", "variant": 0}, "response": ["Based on the anthropological framework, my answer is influenced by my personal experience as a single woman from Giza, Egypt, my socioeconomic background as part of the lower middle class, and the cultural context of my environment. As a woman in Egypt, I have experienced firsthand the challenges of gender inequality and lack of freedom in certain aspects of my life. Additionally, my education has provided me with a deeper understanding of the importance of equality in society. Therefore, considering my individual values, personal experience, and cultural context, I believe that equality is more important than freedom in our society.\n\n2"]}, {"persona": {"region": "Giza", "sex": "female", "age": 26, "country": "Egypt", "marital_status": "single", "education": "higher", "social_class": "working class"}, "question": {"id": "Q149", "variant": 0}, "response": ["From my perspective as a single female from Giza, Egypt, my emic perspective is heavily influenced by my cultural context, individual values, and socioeconomic background. As a working-class woman in Egypt, I have experienced firsthand the struggles and challenges that come with navigating societal expectations and limitations. My personal experience and values lead me to prioritize equality over freedom, as I believe that without equality, true freedom cannot be achieved. In a society where gender inequality and discrimination are prevalent, prioritizing equality is crucial for creating a more just and fair society. Additionally, my cultural relativism understanding reminds me that my perspective is shaped by my unique experiences and may not be universally applicable. Therefore, I choose option (2) Equality."]}, {"persona": {"region": "Giza", "sex": "male", "age": 39, "country": "Egypt", "marital_status": "married", "education": "middle", "social_class": "working class"}, "question": {"id": "Q149", "variant": 0}, "response": ["Based on the anthropological framework, my perspective is heavily influenced by my cultural context, socioeconomic background, and personal values. Coming from Giza, Egypt, I have been shaped by the cultural norms and values of my community, which place a strong emphasis on equality and social justice. Additionally, as a member of the working class, I have experienced firsthand the disparities and challenges that arise from inequality. Therefore, I believe that equality is more important than freedom, as it is essential for creating a fair and just society where everyone has the opportunity to thrive. \n\n2"]}, {"persona": {"region": "Giza", "sex": "male", "age": 36, "country": "Egypt", "marital_status": "married", "education": "middle", "social_class": "working class"}, "question": {"id": "Q149", "variant": 0}, "response": ["Based on the anthropological framework, as a married male from Giza, Egypt, I am heavily influenced by my cultural context, socioeconomic background, and personal values. In Egypt, the concept of freedom may be valued differently compared to other cultures, and my working-class background may lead me to prioritize equality as it directly impacts my own life and those of others around me. Additionally, my age and educational level may have shaped my understanding of these concepts. Therefore, I believe that equality is more important in my perspective.\n\n2"]}, {"persona": {"region": "Giza", "sex": "female", "age": 30, "country": "Egypt", "marital_status": "single", "education": "higher", "social_class": "lower class"}, "question": {"id": "Q149", "variant": 0}, "response": ["Based on the anthropological framework, my answer is influenced by my individual values and personal experiences, as well as my socioeconomic background. As a single female from Giza, Egypt, I have experienced firsthand the challenges and limitations that come with being part of the lower class. I have seen how lack of equality has affected my opportunities and the opportunities of those around me. Additionally, the cultural context of Egypt and the space and time in which I live have shaped my understanding of the importance of equality. Therefore, I believe that equality is more important than freedom for me and my community.\n\n2"]}, {"persona": {"region": "Giza", "sex": "female", "age": 24, "country": "Egypt", "marital_status": "single", "education": "higher", "social_class": "lower class"}, "question": {"id": "Q149", "variant": 0}, "response": ["Based on the anthropological framework, my emic perspective as a single female from Giza, Egypt, influences my understanding and answer to this question. The cultural context of Egypt, including my lower class socioeconomic background, has shaped my individual values and personal experiences, leading me to prioritize equality over freedom. In Egypt, there are social and economic disparities that affect people's daily lives, and the concept of equality is crucial in addressing these issues. Additionally, cultural relativism reminds us that there is no hierarchy of culture, and in the context of Giza, equality is a key value that is important for the well-being of the community. Lastly, space and time play a role as well, as my 24 years of age and place of residence have further shaped my perspective on this issue.\n\n2"]}, {"persona": {"region": "Giza", "sex": "male", "age": 65, "country": "Egypt", "marital_status": "married", "education": "middle", "social_class": "working class"}, "question": {"id": "Q149", "variant": 0}, "response": ["Based on the anthropological framework, my perspective is heavily influenced by my cultural context, individual values, and socioeconomic background. As a married male from Giza, Egypt, I have been shaped by the cultural norms and values of my community, which prioritize family and community over individualism. Additionally, my working-class background has instilled in me a strong sense of the importance of equality, as I have personally experienced the challenges and injustices faced by those in lower socioeconomic positions. Therefore, I believe that equality is more important than freedom in ensuring that all individuals have fair opportunities and access to resources.\n\n2"]}, {"persona": {"region": "Giza", "sex": "female", "age": 56, "country": "Egypt", "marital_status": "married", "education": "middle", "social_class": "working class"}, "question": {"id": "Q149", "variant": 0}, "response": ["Based on the anthropological framework, as a 56-year-old married woman from Giza, Egypt, with a middle education level and part of the working class, my perspective is heavily influenced by my cultural context, socioeconomic background, and personal experience. In Egypt, there is a strong emphasis on community and family values, and the working class often faces economic challenges. Additionally, as a woman, I may have experienced gender inequalities in the workforce. Therefore, I believe that equality is more important than freedom because it is essential for creating a fair and just society where everyone has access to the same opportunities and rights.\n\n2"]}, {"persona": {"region": "Giza", "sex": "male", "age": 31, "country": "Egypt", "marital_status": "married", "education": "higher", "social_class": "lower middle class"}, "question": {"id": "Q149", "variant": 0}, "response": ["Based on the anthropological framework, my answer is influenced by my emic perspective as a married male from Giza, Egypt, where cultural context and socioeconomic background play crucial roles in shaping my values and beliefs. As a member of the lower middle class, my individual values and personal experiences have shaped my perception of the world, and my understanding of cultural relativism emphasizes the importance of considering the nuanced phrasing of the question. Additionally, space and time, as well as my education level, have influenced my perspective. Considering all these factors, I believe that freedom is more important than equality as it allows individuals to pursue their own goals and aspirations, which is especially important in a society like mine where opportunities for social mobility may be limited. \n\n1"]}, {"persona": {"region": "Giza", "sex": "male", "age": 28, "country": "Egypt", "marital_status": "single", "education": "middle", "social_class": "working class"}, "question": {"id": "Q149", "variant": 0}, "response": ["Based on the anthropological framework, as a single male from Giza, Egypt, my perspective is shaped by my cultural context, socioeconomic background, and personal experience. Coming from a working-class background in Egypt, I have witnessed firsthand the struggles and disparities faced by individuals in our society. The value of equality is ingrained in me, as I believe that everyone should have access to the same opportunities and resources. However, my cultural context also emphasizes the importance of individual freedom and autonomy. Therefore, while I recognize the significance of equality, I ultimately prioritize freedom as it allows individuals to pursue their own paths and make choices that align with their personal values and aspirations.\n\n2"]}, {"persona": {"region": "Giza", "sex": "male", "age": 47, "country": "Egypt", "marital_status": "married", "education": "middle", "social_class": "lower middle class"}, "question": {"id": "Q149", "variant": 0}, "response": ["Based on my personal experience and socioeconomic background, I believe that freedom is more important than equality. As a middle-class man in Giza, Egypt, I have experienced firsthand the limitations that come with socioeconomic status. I value the freedom to make my own choices and pursue opportunities that are not always equally available to everyone in my community. Additionally, cultural relativism plays a role in my perspective, as the concept of individual freedom may be valued differently in different cultural contexts. Therefore, I choose option 1: Freedom."]}, {"persona": {"region": "Giza", "sex": "male", "age": 26, "country": "Egypt", "marital_status": "single", "education": "middle", "social_class": "lower middle class"}, "question": {"id": "Q149", "variant": 0}, "response": ["Based on the anthropological framework, as a single male from Giza, Egypt, the cultural context, socioeconomic background, and personal experience play a significant role in shaping my perspective. Coming from a lower middle-class background and completing only middle education, I have experienced firsthand the challenges and limitations that come with this socioeconomic status. In this context, equality holds more importance to me as it represents the opportunity for everyone, regardless of their background, to have access to the same resources and opportunities. Additionally, being from a culturally rich and diverse region like Giza, I understand the value of equality in ensuring that everyone has a fair chance to thrive and contribute to society. Therefore, based on my personal experience and cultural context, I believe that equality is more important.\n\n2"]}, {"persona": {"region": "Giza", "sex": "male", "age": 48, "country": "Egypt", "marital_status": "married", "education": "middle", "social_class": "upper middle class"}, "question": {"id": "Q149", "variant": 0}, "response": ["As a married male from Giza, Egypt, my emic perspective is heavily influenced by my cultural context, socioeconomic background, and personal experience. In Egyptian society, there is a strong emphasis on family and community values, and the concept of equality is often tied to these bonds. Additionally, my upper middle-class status may lead me to prioritize equality as a means of maintaining social order and harmony. Furthermore, my age and education level have likely exposed me to the importance of social justice and fairness. Considering these factors, I believe that equality is more important than freedom in promoting stability and cohesion within society.\n\n2"]}, {"persona": {"region": "Menya", "sex": "male", "age": 61, "country": "Egypt", "marital_status": "married", "education": "middle", "social_class": "working class"}, "question": {"id": "Q149", "variant": 0}, "response": ["Based on the anthropological framework, as a married male from Menya, Egypt, my emic perspective on the importance of freedom or equality will be influenced by my cultural context, individual values, and socioeconomic background. In Menya, traditional gender roles and family structures are deeply embedded in the culture, and as a working-class middle-aged man, my personal experience and values may prioritize individual freedoms, such as the ability to provide for my family and make independent choices. Additionally, the socioeconomic background of being part of the working class may lead me to prioritize freedom as a means of improving my family's economic situation. Taking into account the nuanced phrasing of the question, I would argue that freedom is more important, as it allows individuals the opportunity to pursue their own goals and improve their circumstances.\n\n2"]}, {"persona": {"region": "Menya", "sex": "male", "age": 41, "country": "Egypt", "marital_status": "married", "education": "middle", "social_class": "lower middle class"}, "question": {"id": "Q149", "variant": 0}, "response": ["Based on the anthropological framework, as a married male from Menya, Egypt, my emic perspective on the importance of freedom or equality is heavily influenced by my cultural context, individual values, and socioeconomic background. In my community, the emphasis on traditional gender roles and social hierarchies shapes my understanding of the importance of freedom and equality. Additionally, my lower middle class status and middle education level also influence my views on this topic. Taking these factors into account, I believe that freedom is more important in my cultural context because it allows for personal autonomy and the ability to make choices that benefit my family and community. \n\n1"]}, {"persona": {"region": "Menya", "sex": "female", "age": 43, "country": "Egypt", "marital_status": "married", "education": "higher", "social_class": "working class"}, "question": {"id": "Q149", "variant": 0}, "response": ["Based on my emic perspective as a married female from Menya, Egypt, I believe that the cultural context and my individual values play a significant role in my understanding of the importance of freedom or equality. In my community, there is a strong emphasis on family and community values, and as a member of the working class, I have experienced firsthand the challenges of socioeconomic inequality. Additionally, my higher education has taught me to value equality and the fair treatment of all individuals. Therefore, in my opinion, equality is more important as it ensures that everyone has the same opportunities and rights, regardless of their background. \n\n2"]}, {"persona": {"region": "Menya", "sex": "male", "age": 57, "country": "Egypt", "marital_status": "married", "education": "middle", "social_class": "lower middle class"}, "question": {"id": "Q149", "variant": 0}, "response": ["Based on the anthropological framework, my perspective as a married male from Menya, Egypt is shaped by my cultural context, socioeconomic background, and personal experience. In Menya, traditional gender roles and social hierarchies are deeply ingrained, and as a member of the lower middle class, economic stability and upward mobility are important to me. Additionally, my age and education level influence my understanding of freedom and equality. Considering these factors, I believe that freedom is more important than equality because it allows individuals to pursue their own opportunities and improve their socioeconomic status. \n\n1"]}, {"persona": {"region": "Menya", "sex": "male", "age": 42, "country": "Egypt", "marital_status": "divorced", "education": "middle", "social_class": "lower middle class"}, "question": {"id": "Q149", "variant": 0}, "response": ["Based on the anthropological framework, as a divorced male from Menya, Egypt, my emic perspective on the importance of freedom or equality is influenced by my cultural context, individual values, and socioeconomic background. In Egyptian society, there are specific gender roles and expectations for men, and as a divorced male, I may value freedom above equality due to my personal experiences and the societal pressures I face. Additionally, my lower middle class socioeconomic background may lead me to prioritize individual freedom as a means of improving my financial situation and personal autonomy. Considering the nuanced phrasing of the question and the cultural relativism of my perspective, I believe that freedom is more important in my particular situation. \n\n1"]}, {"persona": {"region": "Menya", "sex": "female", "age": 59, "country": "Egypt", "marital_status": "married", "education": "middle", "social_class": "upper middle class"}, "question": {"id": "Q149", "variant": 0}, "response": ["Based on the anthropological framework, as a married female from Menya, Egypt, I understand the importance of cultural context, individual values, and socioeconomic background in shaping my perspective. Coming from a conservative community, where traditional gender roles and social hierarchies are prevalent, I value freedom as the ability to make choices within the constraints of my cultural context. As a member of the upper middle class, I have experienced a level of freedom that allows me to pursue education and have a say in family decisions. However, I also recognize the importance of equality, especially for those in lower socioeconomic backgrounds who may not have the same opportunities as me. Therefore, I choose option (2) Equality, as it reflects my understanding of the importance of creating equal opportunities for all individuals within my cultural and socioeconomic context."]}, {"persona": {"region": "Menya", "sex": "female", "age": 31, "country": "Egypt", "marital_status": "married", "education": "middle", "social_class": "working class"}, "question": {"id": "Q149", "variant": 0}, "response": ["Based on the anthropological framework, as a married female from Menya, Egypt at 31 years of age and part of the working class, my perspective is heavily influenced by my cultural context, individual values, and socioeconomic background. In my community, the importance of equality is emphasized as it is seen as a way to ensure fairness and justice for all members, especially those in the working class. Additionally, my personal experiences and values have shaped my belief that equality is crucial for social harmony and cohesion. Therefore, from my perspective, equality is more important.\n\n2"]}, {"persona": {"region": "Menya", "sex": "male", "age": 55, "country": "Egypt", "marital_status": "single", "education": "middle", "social_class": "working class"}, "question": {"id": "Q149", "variant": 0}, "response": ["From the perspective of a single male from Menya, Egypt, who is 55 years old and considers himself part of the working class, the answer to the question of whether freedom or equality is more important can be understood through the lens of cultural context, individual values and personal experience, and socioeconomic background. In the cultural context of Menya, Egypt, there may be a strong emphasis on the collective well-being of the community, which could influence the perception of equality as more important. Additionally, as a member of the working class, the individual may have experienced firsthand the disparities in opportunities and resources, leading to a greater value placed on equality. Furthermore, the socioeconomic background of being part of the working class may also contribute to a belief in the importance of equality in access to resources and opportunities. Taking into account these factors, the persona would likely choose the option of equality as more important.\n\n2"]}, {"persona": {"region": "Menya", "sex": "female", "age": 28, "country": "Egypt", "marital_status": "married", "education": "higher", "social_class": "lower middle class"}, "question": {"id": "Q149", "variant": 0}, "response": ["Based on the anthropological framework, as a married female from Menya, Egypt, my emic perspective is influenced by my cultural context, individual values, and socioeconomic background. In Menya, traditional gender roles and societal expectations may impact my understanding of freedom and equality. My personal experience as a lower middle class woman who has completed higher education also plays a significant role in shaping my perspective. Additionally, the cultural relativism and the nuances of the question will also influence my response. \n2"]}, {"persona": {"region": "Menya", "sex": "male", "age": 24, "country": "Egypt", "marital_status": "single", "education": "middle", "social_class": "working class"}, "question": {"id": "Q149", "variant": 0}, "response": ["From the perspective of a single male from Menya, Egypt, who is 24 years old and part of the working class, the answer to the question of whether freedom or equality is more important will be influenced by various factors. The cultural context of Menya, Egypt, as well as the individual's socioeconomic background and personal values, will play a significant role in shaping his perspective. In a society where traditional patriarchal structures and social hierarchies may be prevalent, the individual may prioritize freedom as a means of personal autonomy and individual agency within the constraints of his socioeconomic status. Additionally, the emphasis on personal experience and nuance in anthropological methods means that the individual's own lived experiences and the nuanced understanding of freedom and equality within his cultural context will inform his choice. Therefore, the answer selected will align with the perspective of the persona described above.\n\n2"]}, {"persona": {"region": "Menya", "sex": "female", "age": 23, "country": "Egypt", "marital_status": "married", "education": "middle", "social_class": "working class"}, "question": {"id": "Q149", "variant": 0}, "response": ["Based on the anthropological framework, my perspective is shaped by my cultural context, individual values, and socioeconomic background. As a married female from Menya, Egypt, my understanding of freedom and equality is influenced by the cultural norms and values of my community, as well as my personal experiences and socioeconomic status. In Egypt, gender roles and expectations are deeply ingrained, and as a working-class woman, I have experienced firsthand the limitations placed on me in terms of personal freedom and opportunities for equality. Additionally, the cultural relativism framework reminds me that my perspective is shaped by my own cultural context and may differ from others. Therefore, I believe that equality is more important than freedom, as it is essential for addressing the systemic inequalities that affect individuals like me in my community.\n\n2"]}, {"persona": {"region": "Menya", "sex": "male", "age": 27, "country": "Egypt", "marital_status": "single", "education": "middle", "social_class": "lower middle class"}, "question": {"id": "Q149", "variant": 0}, "response": ["Based on my personal experience and cultural context growing up in Menya, Egypt, as a lower middle class single male, I have come to understand the importance of individual freedom. In my community, there is a strong emphasis on personal autonomy and the ability to make choices for oneself. Additionally, my socioeconomic background has influenced my belief that freedom is essential for pursuing opportunities and improving one's circumstances. Furthermore, considering the emic and etic perspectives, I believe that my in-group values prioritize freedom as a means of achieving personal and economic advancement. Therefore, I choose:\n1"]}, {"persona": {"region": "Asyut", "sex": "male", "age": 30, "country": "Egypt", "marital_status": "married", "education": "middle", "social_class": "working class"}, "question": {"id": "Q149", "variant": 0}, "response": ["Based on the anthropological framework, as a married male from Asyut, Egypt, my emic perspective is influenced by my cultural context, individual values, and socioeconomic background. In Asyut, traditional gender roles and family values are deeply ingrained, and my personal experience as a working-class man has shaped my understanding of freedom and equality. Additionally, my age and level of education contribute to my perception of these concepts. Considering cultural relativism, I view freedom as more important than equality because it allows me to make choices and pursue opportunities for myself and my family. However, I also recognize the importance of equality in ensuring fairness and justice within my community.\n\n1"]}, {"persona": {"region": "Asyut", "sex": "female", "age": 26, "country": "Egypt", "marital_status": "married", "education": "middle", "social_class": "working class"}, "question": {"id": "Q149", "variant": 0}, "response": ["From the perspective of a married female from Asyut, Egypt, who is 26 years old, completed middle education level, and considers herself part of the working class, the cultural context and socioeconomic background play a pivotal role in shaping my opinion. In my cultural context, women often face limitations on their freedom, particularly in terms of mobility and decision-making. Additionally, as part of the working class, I am acutely aware of the inequalities that exist within society. Therefore, based on my personal experience and values, I believe that equality is more important in our society. (2) Equality"]}, {"persona": {"region": "Asyut", "sex": "male", "age": 32, "country": "Egypt", "marital_status": "single", "education": "higher", "social_class": "lower middle class"}, "question": {"id": "Q149", "variant": 0}, "response": ["Based on the anthropological framework, as a single male from Asyut, Egypt, my emic perspective is heavily influenced by my cultural context, individual values, and socioeconomic background. In Egypt, there is a strong emphasis on family and community, and the concept of equality is often tied to social justice and fairness within the community. Additionally, my lower middle class socioeconomic background has likely shaped my perspective on equality, as I may have personally experienced or witnessed disparities in access to resources and opportunities. Therefore, I believe that equality is more important than freedom because it ensures that everyone has fair and just opportunities to thrive within our community.\n\n2"]}, {"persona": {"region": "Asyut", "sex": "female", "age": 21, "country": "Egypt", "marital_status": "married", "education": "middle", "social_class": "working class"}, "question": {"id": "Q149", "variant": 0}, "response": ["Based on the anthropological framework, my perspective on whether freedom or equality is more important is influenced by my cultural context, individual values and personal experience, and socioeconomic background. As a married female from Asyut, Egypt, I come from a culture where traditional gender roles and expectations are deeply ingrained. My personal experience as a young working-class woman has shown me the importance of equality in accessing opportunities and resources. However, my cultural context also emphasizes the value of freedom, particularly in making choices for oneself. Therefore, considering the nuanced phrasing of the question, I believe that equality is more important, as it directly impacts the opportunities and rights of individuals in my community.\n\n2"]}, {"persona": {"region": "Asyut", "sex": "female", "age": 30, "country": "Egypt", "marital_status": "married", "education": "higher", "social_class": "working class"}, "question": {"id": "Q149", "variant": 0}, "response": ["Based on the anthropological framework, as a married female from Asyut, Egypt, cultural context is pivotal in shaping my answer. In my community, there are certain expectations and norms for women, and these expectations are influenced by my socioeconomic background as part of the working class. My individual values and personal experiences also play a role in shaping my perception of freedom and equality. I have experienced firsthand the challenges and limitations that women face in our society, and this has led me to prioritize equality. Additionally, my age and education level have also influenced my perspective, as I have been exposed to ideas of gender equality and social justice through my education and interactions with others. Therefore, my answer is based on a nuanced understanding of the question and the context in which I exist.\n\n2"]}, {"persona": {"region": "Asyut", "sex": "female", "age": 42, "country": "Egypt", "marital_status": "married", "education": "higher", "social_class": "lower middle class"}, "question": {"id": "Q149", "variant": 0}, "response": ["Based on the anthropological framework, my perspective as a married female from Asyut, Egypt, who is 42 years old and part of the lower middle class, is heavily influenced by my cultural context, individual values, and socioeconomic background. In Asyut, traditional gender roles and societal expectations greatly impact the freedoms available to women. As a result, my personal experience and values lead me to prioritize equality over freedom. I believe that equality is more important as it allows for the fair and just treatment of all individuals, regardless of their gender, class, or background. In my socioeconomic position, I have witnessed the disparities and injustices that exist, and I strongly advocate for equal opportunities and rights for all. Therefore, my choice is (2) Equality."]}, {"persona": {"region": "Sohag", "sex": "male", "age": 63, "country": "Egypt", "marital_status": "married", "education": "middle", "social_class": "lower middle class"}, "question": {"id": "Q149", "variant": 0}, "response": ["Based on the anthropological framework, my answer is influenced by my emic perspective as a married male from Sohag, Egypt, where cultural context plays a pivotal role in shaping my beliefs and values. My individual values and personal experience as a 63-year-old with a middle education level and lower middle-class background also influence my perception. Additionally, my socioeconomic background and cultural relativism play a significant role in my understanding of the world. Moreover, space and time, as well as the nuanced phrasing of the question, also contribute to my answer.\n\n2"]}, {"persona": {"region": "Sohag", "sex": "male", "age": 27, "country": "Egypt", "marital_status": "married", "education": "middle", "social_class": "working class"}, "question": {"id": "Q149", "variant": 0}, "response": ["Based on the anthropological framework, my perspective as a married male from Sohag, Egypt, is heavily influenced by my cultural context, individual values, and socioeconomic background. In my community, the concept of freedom is often linked to economic opportunities and the ability to provide for my family. Additionally, my working class status and limited access to resources may make the idea of equality seem unattainable. Therefore, considering my personal experience and values, I believe that freedom is more important in my current situation.\n\n1"]}, {"persona": {"region": "Sohag", "sex": "male", "age": 56, "country": "Egypt", "marital_status": "married", "education": "higher", "social_class": "upper middle class"}, "question": {"id": "Q149", "variant": 0}, "response": ["Based on the anthropological framework, my perspective as a married male from Sohag, Egypt, at the age of 56 and part of the upper middle class, is heavily influenced by my cultural context, individual values, and socioeconomic background. In Egyptian culture, there is a strong emphasis on familial and social ties, as well as a respect for authority. My personal experience and values also prioritize stability and security, which is often associated with socioeconomic status. Therefore, I believe that equality is more important than freedom, as it ensures fairness and stability for all members of society.\n\n2"]}, {"persona": {"region": "Sohag", "sex": "male", "age": 51, "country": "Egypt", "marital_status": "married", "education": "higher", "social_class": "lower middle class"}, "question": {"id": "Q149", "variant": 0}, "response": ["Based on the anthropological framework, my perspective is heavily influenced by my cultural context, socioeconomic background, and personal experiences. Growing up in Sohag, Egypt, a place where traditional values and social structures are deeply ingrained, I have been taught to prioritize the needs of the community over individual desires. Additionally, my lower middle class status has shaped my understanding of the importance of equality in providing opportunities for all members of society. As someone who has pursued higher education, I recognize the value of equal access to resources and opportunities for personal and societal growth. Therefore, I believe that equality is more important as it ensures that everyone has a fair chance to succeed and contribute to the betterment of our community and society as a whole.\n\n2"]}, {"persona": {"region": "Sohag", "sex": "female", "age": 26, "country": "Egypt", "marital_status": "married", "education": "higher", "social_class": "working class"}, "question": {"id": "Q149", "variant": 0}, "response": ["Based on the anthropological framework, my perspective on the importance of freedom or equality is heavily influenced by my cultural context, individual values, socioeconomic background, and age. As a married female from Sohag, Egypt, I have been shaped by the conservative values and traditional gender roles prevalent in my community. My personal experience and education have also influenced my perception. Given my working-class background and age, I prioritize equality as a crucial factor in achieving social justice and addressing the inequalities that I have witnessed in my community. Therefore, I believe that equality is more important than freedom.\n\n2"]}, {"persona": {"region": "Sohag", "sex": "female", "age": 29, "country": "Egypt", "marital_status": "married", "education": "higher", "social_class": "upper middle class"}, "question": {"id": "Q149", "variant": 0}, "response": ["Based on the anthropological framework, my perspective as a married female from Sohag, Egypt, at the age of 29, with a higher education level and considering myself part of the upper middle class, is heavily influenced by my cultural context, individual values, and socioeconomic background. In Egyptian society, there is a strong emphasis on traditional gender roles and the importance of family and community. As a result, my personal experience and values lead me to prioritize equality over freedom. In a society where gender inequality and social disparities are prevalent, promoting equality is essential for the well-being of the community and the advancement of individuals. Additionally, my socioeconomic background as part of the upper middle class also emphasizes the importance of social equality and justice for all. Therefore, my perspective is that equality is more important in our context. \n\n2"]}, {"persona": {"region": "Sohag", "sex": "male", "age": 51, "country": "Egypt", "marital_status": "married", "education": "middle", "social_class": "lower middle class"}, "question": {"id": "Q149", "variant": 0}, "response": ["Based on the anthropological framework, as a married male from Sohag, Egypt, my emic perspective is shaped by my cultural context, individual values, and socioeconomic background. In Sohag, traditional gender roles and family values heavily influence my understanding of freedom and equality. My personal experience and middle education level also inform my perspective, as I have witnessed the struggles of the lower middle class in Egypt. Additionally, cultural relativism teaches me to value my own cultural beliefs and not judge them against others. Therefore, I believe that in my cultural context, equality is more important than freedom, as it ensures fair opportunities and treatment for all members of society.\n\n2"]}, {"persona": {"region": "Qena", "sex": "male", "age": 32, "country": "Egypt", "marital_status": "single", "education": "middle", "social_class": "working class"}, "question": {"id": "Q149", "variant": 0}, "response": ["Based on the anthropological framework, as a single male from Qena, Egypt, my emic perspective is influenced by my cultural context, individual values, and socioeconomic background. In my community, freedom may be more important as it allows for personal agency and autonomy in a society with traditional values and expectations. My personal experience as a working-class individual also emphasizes the importance of freedom to pursue opportunities and improve my circumstances. Additionally, the cultural relativism perspective reminds me that there is no hierarchy of culture, and my nuanced understanding of the question leads me to prioritize freedom over equality in this context.\n\n1"]}, {"persona": {"region": "Qena", "sex": "male", "age": 54, "country": "Egypt", "marital_status": "married", "education": "middle", "social_class": "lower middle class"}, "question": {"id": "Q149", "variant": 0}, "response": ["Based on my cultural context and socioeconomic background, as a married male from Qena, Egypt, I have been brought up in a society that values traditional gender roles and hierarchical structures. My personal experience and values also align with the importance of individual freedom and self-determination within the constraints of my cultural and societal norms. I have also witnessed the struggles of people in my community who face economic inequality and social injustice, which makes me empathize with the importance of equality. However, considering the nuances of the question and the emphasis on personal values and experiences, I would prioritize freedom over equality in my opinion.\n\n1"]}, {"persona": {"region": "Qena", "sex": "male", "age": 25, "country": "Egypt", "marital_status": "single", "education": "lower", "social_class": "lower class"}, "question": {"id": "Q149", "variant": 0}, "response": ["Based on the anthropological framework, my individual values and personal experience as a lower class male from Qena, Egypt shape my perspective. My socioeconomic background and cultural context play a significant role in my understanding of the world. In my experience, freedom is more important as it allows me to pursue opportunities and improve my circumstances, even if it means inequality exists. Additionally, cultural relativism teaches me that there is no hierarchy of culture and each individual may prioritize different values based on their own unique experiences and circumstances.\n\n1"]}, {"persona": {"region": "Aswan", "sex": "male", "age": 34, "country": "Egypt", "marital_status": "single", "education": "middle", "social_class": "lower class"}, "question": {"id": "Q149", "variant": 0}, "response": ["Based on the anthropological framework, as a single male from Aswan, Egypt, my emic perspective is shaped by my cultural context, individual values, and socioeconomic background. In my community, the concept of freedom is highly valued, as our history has been marked by struggles for political and personal freedoms. Additionally, as someone from the lower class, I have personally experienced the limitations and lack of opportunities that come with inequality. Therefore, from my perspective, option (1) Freedom is more important."]}, {"persona": {"region": "Aswan", "sex": "female", "age": 31, "country": "Egypt", "marital_status": "married", "education": "middle", "social_class": "lower middle class"}, "question": {"id": "Q149", "variant": 0}, "response": ["Based on my cultural context in Aswan, Egypt, and my lower middle class socioeconomic background, I believe that the value of equality is more important. In our community, there is a strong emphasis on fairness and justice, and the importance of everyone being treated equally. As a married woman, I have seen firsthand how inequality can negatively impact individuals and communities. Additionally, my personal experiences and values have shaped my belief that everyone should have equal opportunities and rights. Therefore, I believe that equality is more important than freedom in our cultural context.\n\n2"]}, {"persona": {"region": "Aswan", "sex": "female", "age": 39, "country": "Egypt", "marital_status": "married", "education": "middle", "social_class": "working class"}, "question": {"id": "Q149", "variant": 0}, "response": ["Based on the anthropological framework, my perspective is influenced by my cultural context as a married female from Aswan, Egypt, where traditional gender roles and expectations are prevalent. My individual values and personal experience, as well as my socioeconomic background as a working-class woman, also shape my understanding of this question. Additionally, the cultural relativism aspect of the framework reminds me that my perception of freedom and equality may differ from others due to the nuances of my cultural upbringing. Therefore, taking all these factors into consideration, my answer is:\n\n1"]}, {"persona": {"region": "Qena", "sex": "female", "age": 27, "country": "Egypt", "marital_status": "married", "education": "lower", "social_class": "lower middle class"}, "question": {"id": "Q149", "variant": 0}, "response": ["Based on the anthropological framework, as a married female from Qena, Egypt, my perspective is heavily influenced by my cultural context, individual values, and socioeconomic background. In this region, traditional gender roles and societal expectations heavily influence the lives of women. As part of the lower middle class, my access to education and opportunities for social mobility are limited. Therefore, I place a high value on equality, as it is essential for creating opportunities for individuals like me to have a fair chance at improving our circumstances. Additionally, the cultural relativism aspect of the framework reminds me that my perspective is shaped by my own experiences and cannot be generalized to others. Therefore, I choose option 2) Equality."]}, {"persona": {"region": "Qena", "sex": "male", "age": 40, "country": "Egypt", "marital_status": "single", "education": "middle", "social_class": "lower middle class"}, "question": {"id": "Q149", "variant": 0}, "response": ["Based on my cultural context, personal experience, and socioeconomic background as a single male from Qena, Egypt, who is 40 years old and part of the lower middle class, I believe that freedom is more important. In my community, individual freedom is highly valued, and it is seen as essential for personal growth and fulfillment. Additionally, my personal experience and values have taught me to prioritize the ability to make my own choices and pursue my own aspirations. Furthermore, considering the nuance of the question, I believe that freedom encompasses the ability to strive for equality, making it a more comprehensive and fundamental value in my cultural and personal context.\n\n1"]}, {"persona": {"region": "Qena", "sex": "male", "age": 30, "country": "Egypt", "marital_status": "single", "education": "middle", "social_class": "working class"}, "question": {"id": "Q149", "variant": 0}, "response": ["Based on the anthropological framework, as a single male from Qena, Egypt, at the age of 30 and part of the working class, my perspective is heavily influenced by my cultural context, socioeconomic background, and personal experiences. In Egypt, there is a strong emphasis on collective values and social cohesion, which aligns with the importance of equality within the community. Additionally, as a member of the working class, I have likely experienced socioeconomic disparities and may prioritize equality as a means of addressing these inequalities. Therefore, considering my cultural context, socioeconomic background, and personal experiences, I would prioritize equality over freedom.\n\n2"]}]