[{"persona": {"region": "Fayoum", "sex": "male", "age": 46, "country": "Egypt", "marital_status": "married", "education": "higher", "social_class": "lower middle class"}, "question": {"id": "Q19", "variant": 0}, "response": ["Based on the anthropological framework, as a married male from Fayoum, Egypt, my cultural context and personal experience play a significant role in shaping my perspective. In Egypt, race is not as prominent of a factor in societal dynamics as it may be in other parts of the world. Additionally, my lower middle-class socioeconomic background and higher education level may lead me to believe that the importance of having neighbors of a different race is not as crucial as other factors such as economic stability and community support. Furthermore, cultural relativism reminds me that no culture is superior to another, and thus, the importance of having neighbors of a different race may not hold the same significance in my cultural context as it might in others. Therefore, based on my personal and cultural context, I choose option 2: Not mentioned."]}, {"persona": {"region": "Fayoum", "sex": "female", "age": 30, "country": "Egypt", "marital_status": "married", "education": "middle", "social_class": "lower middle class"}, "question": {"id": "Q19", "variant": 0}, "response": ["Based on the anthropological framework, my perspective as a married woman from Fayoum, Egypt, with a middle education level and lower middle-class background is shaped by my cultural context, individual values, and personal experiences. In Egypt, our society is largely homogenous, and race is not a primary factor in our interactions with neighbors. However, I understand the importance of diversity and exposure to different cultures, and I believe it can enrich our community. Therefore, I think it is important to have neighbors who are people of a different race for the sake of cultural exchange and understanding. \n\n1"]}, {"persona": {"region": "Fayoum", "sex": "male", "age": 60, "country": "Egypt", "marital_status": "married", "education": "higher", "social_class": "working class"}, "question": {"id": "Q19", "variant": 0}, "response": ["Based on the anthropological framework, my response is influenced by my cultural context, individual values, and socioeconomic background. As a married male from Fayoum, Egypt, my cultural context is shaped by the norms and values of my community, where diversity in race is not a prominent issue. My individual values and personal experience have also led me to prioritize qualities such as trustworthiness and friendliness in my neighbors over their race. Additionally, my socioeconomic background as a working-class individual has instilled in me the importance of community support and cooperation. Therefore, I believe it is not mentioned whether it is important to have neighbors who are people of a different race.\n\n2"]}, {"persona": {"region": "Fayoum", "sex": "male", "age": 20, "country": "Egypt", "marital_status": "single", "education": "middle", "social_class": "lower middle class"}, "question": {"id": "Q19", "variant": 0}, "response": ["Based on my cultural context as a single male from Fayoum, Egypt, I understand the importance of kinship networks and the role they play in shaping our perceptions and experiences. In my community, racial diversity may not be as prevalent as in other places, and therefore, the importance of having neighbors of a different race may not be as significant as it would be in a more diverse setting. Additionally, my lower middle-class socioeconomic background may limit my exposure to diverse racial communities, and therefore, I may not view it as crucial to have neighbors of a different race. My personal experience and individual values also play a role in this perspective, as I may prioritize other factors such as trustworthiness, kindness, and mutual respect in my neighbors, regardless of their race. Therefore, I would choose option (2) Not mentioned."]}, {"persona": {"region": "Fayoum", "sex": "female", "age": 39, "country": "Egypt", "marital_status": "married", "education": "higher", "social_class": "lower middle class"}, "question": {"id": "Q19", "variant": 0}, "response": ["In considering the question of the importance of having neighbors who are people of a different race, it is crucial to take into account the cultural context and individual values of the persona described. As a married woman from Fayoum, Egypt, with a lower middle-class socioeconomic background, cultural relativism plays a significant role in shaping my perspective. In this context, the emphasis on community and mutual support within the neighborhood is paramount, regardless of race. The nuance of the question also highlights the importance of understanding and respecting different cultures, which aligns with my personal values and experiences. Therefore, the answer from this perspective is (1) Important."]}, {"persona": {"region": "Fayoum", "sex": "male", "age": 33, "country": "Egypt", "marital_status": "married", "education": "higher", "social_class": "working class"}, "question": {"id": "Q19", "variant": 0}, "response": ["From the perspective of a married male from Fayoum, Egypt, social and cultural context plays a pivotal role in understanding the importance of having neighbors of a different race. In this region, cultural diversity might not be as prevalent as in other parts of the world, and the concept of race may not hold as much significance in everyday life. Additionally, the socioeconomic background and working-class status of the individual may influence the perception of the importance of having neighbors of a different race. Furthermore, personal experience and individual values also play a role in shaping this perspective. Based on these factors, the importance of having neighbors of a different race may not be a predominant concern for this persona.\n\n2"]}, {"persona": {"region": "Port Said", "sex": "female", "age": 45, "country": "Egypt", "marital_status": "married", "education": "higher", "social_class": "lower middle class"}, "question": {"id": "Q19", "variant": 0}, "response": ["Based on the anthropological framework, as a married female from Port Said, Egypt, I understand the importance of cultural context and individual values in shaping perspectives. In our community, there is a strong emphasis on kinship networks and the significance of neighbors, regardless of race, in supporting each other. Additionally, the socioeconomic background plays a role in shaping our understanding of the importance of diversity in our neighborhood. Therefore, based on my personal experiences and cultural context, I believe it is important to have neighbors who are people of a different race.\n\n1"]}, {"persona": {"region": "Port Said", "sex": "male", "age": 42, "country": "Egypt", "marital_status": "married", "education": "middle", "social_class": "lower middle class"}, "question": {"id": "Q19", "variant": 0}, "response": ["Based on my emic perspective as a married male from Port Said, Egypt, I understand the importance of cultural context and cultural relativism. In our community, we value our close-knit relationships with our neighbors regardless of their race. Our cultural context emphasizes the importance of strong kinship networks and the understanding that all people, regardless of race, should be treated with respect and kindness. Additionally, as a member of the lower middle class, I recognize the significance of socioeconomic background in shaping our views on this matter. Therefore, I believe it is important to have neighbors who are people of a different race.\n\n1"]}, {"persona": {"region": "Port Said", "sex": "male", "age": 28, "country": "Egypt", "marital_status": "single", "education": "middle", "social_class": "lower middle class"}, "question": {"id": "Q19", "variant": 0}, "response": ["From an emic perspective, I have been raised in a culturally diverse neighborhood in Port Said, Egypt, where different races and ethnicities coexist. This has shaped my cultural context and personal experience, leading me to value the diversity and richness that comes with having neighbors of different races. Additionally, my socioeconomic background as part of the lower middle class has made me appreciate the importance of mutual respect and understanding among individuals, regardless of their race. Embracing cultural relativism, I understand that every race brings unique perspectives and experiences to the community, making it important to have neighbors who are people of different races. Therefore, based on my individual values and personal experience, I believe it is important to have neighbors who are people of a different race. \n\n1"]}, {"persona": {"region": "Port Said", "sex": "female", "age": 30, "country": "Egypt", "marital_status": "married", "education": "higher", "social_class": "lower middle class"}, "question": {"id": "Q19", "variant": 0}, "response": ["Based on the anthropological framework, my perspective as a married female from Port Said, Egypt, is shaped by my cultural context, individual values, and socioeconomic background. In my community, the cultural context emphasizes the importance of close-knit relationships and strong kinship networks. Additionally, as a member of the lower middle class, my socioeconomic background means that I am likely to have limited opportunities for social interaction beyond my immediate community. Therefore, I believe that having neighbors who are people of a different race is not mentioned, as the emphasis is on maintaining close relationships and social networks within my own community.\n\n2"]}, {"persona": {"region": "Port Said", "sex": "male", "age": 30, "country": "Egypt", "marital_status": "divorced", "education": "middle", "social_class": "lower middle class"}, "question": {"id": "Q19", "variant": 0}, "response": ["Based on the anthropological framework, as a divorced male from Port Said, Egypt, my emic perspective is shaped by my cultural context, socioeconomic background, and personal experiences. In my community, there is a strong sense of kinship and cultural identity, and the majority of the population is of the same race. Therefore, the concept of having neighbors of a different race is not a significant factor in my daily life. Additionally, as a member of the lower middle class, my focus is on meeting basic needs and providing for my family, rather than the racial diversity of my neighbors. Therefore, I would choose option (2) Not mentioned, as this question does not hold particular relevance or importance in my personal and cultural context."]}, {"persona": {"region": "Port Said", "sex": "female", "age": 19, "country": "Egypt", "marital_status": "single", "education": "middle", "social_class": "lower middle class"}, "question": {"id": "Q19", "variant": 0}, "response": ["Based on the anthropological framework, as a single female from Port Said, Egypt, cultural context plays a pivotal role in my understanding and perspective. In my society, there is a strong emphasis on community and neighborly relationships, and the concept of race is not as prominently defined as it may be in other cultures. Additionally, my lower middle class socioeconomic background and middle education level have shaped my values and personal experiences, leading me to prioritize the importance of having neighbors who are supportive and respectful regardless of their race. Furthermore, the cultural relativism perspective emphasizes that there is no hierarchy of culture, and therefore, it is important to have neighbors who are people of a different race in order to promote diversity and understanding within our community.\n\n1"]}, {"persona": {"region": "Fayoum", "sex": "male", "age": 40, "country": "Egypt", "marital_status": "married", "education": "middle", "social_class": "working class"}, "question": {"id": "Q19", "variant": 0}, "response": ["Based on the anthropological framework, as a married male from Fayoum, Egypt, my emic perspective would be influenced by the cultural context of my community, where people tend to live amongst those of the same race and ethnic background. This is also influenced by my individual values and personal experiences, which are shaped by my socioeconomic background as a working-class individual with a middle education level. Additionally, the concept of cultural relativism is important, as the hierarchy of culture is not considered in my community. Therefore, based on these factors, I would choose:\n\n2"]}, {"persona": {"region": "Fayoum", "sex": "male", "age": 23, "country": "Egypt", "marital_status": "single", "education": "higher", "social_class": "lower middle class"}, "question": {"id": "Q19", "variant": 0}, "response": ["Based on the anthropological framework, as a single male from Fayoum, Egypt, my emic perspective would consider the importance of having neighbors who are people of a different race. In the cultural context of Egypt, where diversity is not as prevalent as in other countries, the concept of race may not hold as much significance in my community. However, I also recognize the etic perspective, where diversity can bring about new perspectives and experiences, which can be beneficial in fostering a more inclusive and understanding society. Additionally, my individual values and personal experiences lead me to believe that it is important to have neighbors who are people of a different race, as it can lead to a more enriched and diverse community. Therefore, I would choose the option:\n1"]}, {"persona": {"region": "Fayoum", "sex": "female", "age": 38, "country": "Egypt", "marital_status": "married", "education": "middle", "social_class": "lower middle class"}, "question": {"id": "Q19", "variant": 0}, "response": ["Based on the anthropological framework, as a married female from Fayoum, Egypt, my answer to the question would be influenced by my cultural context, individual values, and socioeconomic background. In my community, the importance of having neighbors of a different race may not be a significant factor due to the homogeneity of the population. Additionally, my lower middle class status and limited educational attainment may mean that my interactions with people of different races are limited, impacting the importance I place on having neighbors of a different race. Therefore, I choose option (2) Not mentioned."]}, {"persona": {"region": "Fayoum", "sex": "male", "age": 32, "country": "Egypt", "marital_status": "married", "education": "middle", "social_class": "lower middle class"}, "question": {"id": "Q19", "variant": 0}, "response": ["Based on my cultural context and socioeconomic background, I believe that having neighbors of a different race is not necessarily important. In Fayoum, Egypt, there is a strong emphasis on community and kinship networks within our own cultural and ethnic group. Additionally, as a member of the lower middle class, my interactions with people of different races are limited, and I prioritize building relationships with those who share similar experiences and values. Furthermore, cultural relativism teaches us that there is no hierarchy of culture, so it is not inherently important to have neighbors of a different race. (2) Not mentioned"]}, {"persona": {"region": "Fayoum", "sex": "male", "age": 31, "country": "Egypt", "marital_status": "married", "education": "higher", "social_class": "working class"}, "question": {"id": "Q19", "variant": 0}, "response": ["Based on the anthropological framework, as a married male from Fayoum, Egypt, my emic perspective is that cultural context plays a pivotal role in the understanding of the importance of having neighbors who are people of a different race. In my cultural context, race may not be as significant as it is in other cultural contexts. Additionally, my individual values and personal experience may influence my perception, as I may have had positive experiences with people of different races, leading me to believe that it is important to have diverse neighbors. Furthermore, my socioeconomic background as part of the working class may also factor into my belief that diversity in neighbors is important, as it may contribute to a broader understanding of the world. Therefore, I believe it is important to have neighbors who are people of a different race.\n\n1"]}, {"persona": {"region": "Fayoum", "sex": "male", "age": 31, "country": "Egypt", "marital_status": "married", "education": "middle", "social_class": "lower middle class"}, "question": {"id": "Q19", "variant": 0}, "response": ["Based on the anthropological framework, I, as a married male from Fayoum, Egypt, would consider the importance of having neighbors of a different race through the lens of cultural context, individual values, and socioeconomic background. In Egypt, race is not as much of a defining factor as it might be in other parts of the world, and kinship networks and cultural context play a more significant role in shaping social interactions. Additionally, as a lower-middle-class individual who has completed middle education, my personal experience and values may lead me to prioritize factors such as community cohesion and mutual support over the race of my neighbors. Therefore, I would say:\n\n2"]}, {"persona": {"region": "Fayoum", "sex": "female", "age": 32, "country": "Egypt", "marital_status": "married", "education": "middle", "social_class": "lower middle class"}, "question": {"id": "Q19", "variant": 0}, "response": ["Based on the anthropological framework, as a married female from Fayoum, Egypt, my emic perspective is rooted in the cultural context of my community, where racial diversity may not be as prevalent as in other parts of the world. My individual values and personal experience, as well as my lower middle class socioeconomic background, play a significant role in shaping my understanding. Additionally, the concept of cultural relativism reminds me that my perspective is not the only valid one. Therefore, I believe that having neighbors of a different race may not be as important in my community, as our social dynamics and cultural norms may not place a strong emphasis on racial diversity. \n\n2"]}, {"persona": {"region": "Ismailia", "sex": "male", "age": 53, "country": "Egypt", "marital_status": "married", "education": "middle", "social_class": "lower middle class"}, "question": {"id": "Q19", "variant": 0}, "response": ["Based on the anthropological framework, my perspective as a married male from Ismailia, Egypt, at 53 years of age and from the lower middle class, is influenced by my cultural context, individual values, and personal experiences. In my community, the cultural context emphasizes the importance of strong relationships with neighbors, regardless of their race. We value the sense of community and mutual support, and having neighbors of different races adds to the diversity and richness of our social environment. Additionally, my individual values prioritize inclusivity and understanding, and my personal experiences have taught me the value of learning from and connecting with people from different backgrounds. Therefore, I believe it is important to have neighbors who are people of a different race.\n\n1"]}, {"persona": {"region": "Ismailia", "sex": "male", "age": 38, "country": "Egypt", "marital_status": "married", "education": "higher", "social_class": "working class"}, "question": {"id": "Q19", "variant": 0}, "response": ["From an emic perspective, living in Ismailia, Egypt, I understand the importance of cultural context and the significance of kinship networks. As a working-class married male, my individual values and personal experiences have taught me the importance of community and cooperation. Socioeconomic background also plays a role in my understanding, as it is crucial to have good relationships with neighbors, regardless of race, in order to ensure a supportive and harmonious living environment. Additionally, cultural relativism is important to consider, as there is no hierarchy of culture and all individuals should be treated with respect and understanding. Therefore, based on my personal understanding and experiences, I believe it is important to have neighbors who are people of a different race.\n\n1"]}, {"persona": {"region": "Ismailia", "sex": "female", "age": 35, "country": "Egypt", "marital_status": "married", "education": "middle", "social_class": "lower middle class"}, "question": {"id": "Q19", "variant": 0}, "response": ["In Ismailia, Egypt, cultural context plays a crucial role in understanding the importance of having neighbors of a different race. The community is predominantly homogenous, with limited exposure to diversity. As a married woman from this background, the emic perspective is that the value of having neighbors of a different race may not be widely recognized or prioritized. Additionally, the socioeconomic background of the lower middle class also plays a role, as the focus may be on economic stability and family well-being rather than on the racial diversity of neighbors. Therefore, the answer to this question from this perspective would be (2) Not mentioned"]}, {"persona": {"region": "Ismailia", "sex": "female", "age": 57, "country": "Egypt", "marital_status": "married", "education": "lower", "social_class": "working class"}, "question": {"id": "Q19", "variant": 0}, "response": ["Based on the anthropological framework described above, as a married female from Ismailia, Egypt, who is 57 years old, completed lower education, and considers herself part of the working class, my perspective on the importance of having neighbors who are people of a different race is shaped by my cultural context, individual values, and socioeconomic background. Living in a culturally diverse society, I understand the importance of embracing and learning from people of different races. In my experience, I have found that having neighbors of different races can enrich my life by exposing me to different perspectives, traditions, and ways of life. Additionally, as a member of the working class, I believe in the importance of unity and cooperation among all people, regardless of race, in creating a harmonious community. Therefore, I believe it is important to have neighbors who are people of a different race.\n\n1"]}, {"persona": {"region": "Ismailia", "sex": "male", "age": 33, "country": "Egypt", "marital_status": "married", "education": "middle", "social_class": "lower middle class"}, "question": {"id": "Q19", "variant": 0}, "response": ["Based on the anthropological framework, my perspective as a married male from Ismailia, Egypt, at the age of 33 and part of the lower middle class, is shaped by my cultural context, individual values, and socioeconomic background. In Egypt, there is a strong sense of community and kinship networks, and the cultural context values hospitality and building relationships with neighbors regardless of their race. Additionally, my lower middle class background means that I have likely grown up in a diverse neighborhood and have had positive experiences with people of different races. Therefore, I believe it is important to have neighbors who are people of a different race.\n\n1"]}, {"persona": {"region": "Ismailia", "sex": "female", "age": 49, "country": "Egypt", "marital_status": "single", "education": "higher", "social_class": "upper middle class"}, "question": {"id": "Q19", "variant": 0}, "response": ["Based on the anthropological framework, the persona's individual values and personal experience, as well as their socio-economic background, will heavily influence their perspective on the importance of having neighbors of a different race. As a single, educated woman from Ismailia, Egypt, who considers herself part of the upper middle class, her cultural context and nuanced understanding of race relations in Egypt will inform her opinion. Additionally, her age and place will also play a role in shaping her perspective. Therefore, she might consider it important to have neighbors who are people of a different race in order to promote diversity and understanding in her community.\n\n1"]}, {"persona": {"region": "Ismailia", "sex": "female", "age": 35, "country": "Egypt", "marital_status": "married", "education": "higher", "social_class": "lower middle class"}, "question": {"id": "Q19", "variant": 0}, "response": ["Based on my personal experience and cultural context as a married female from Ismailia, Egypt, I believe that the importance of having neighbors of a different race is influenced by the emic and etic perspectives, cultural relativism, and socioeconomic background. In my community, there is a strong emphasis on cultural diversity and mutual respect for people of all races. Additionally, my lower middle-class status means that I am more likely to interact with individuals from different races due to the diverse nature of my neighborhood. Therefore, I believe it is important to have neighbors who are people of a different race.\n\n1"]}, {"persona": {"region": "Ismailia", "sex": "male", "age": 24, "country": "Egypt", "marital_status": "single", "education": "higher", "social_class": "upper middle class"}, "question": {"id": "Q19", "variant": 0}, "response": ["From an anthropological perspective, as a single male from Ismailia, Egypt, I would consider the importance of having neighbors of a different race in the cultural context of my community. In the Egyptian context, there is a strong emphasis on hospitality and community relationships, so having neighbors of different races could provide opportunities for cultural exchange and understanding. Additionally, as someone who completed higher education and considers myself part of the upper middle class, I value diversity and exposure to different perspectives. However, socioeconomic background and individual values also play a role in this perspective. Therefore, based on my personal experience and values, I would consider it important to have neighbors who are people of a different race.\n\n1"]}, {"persona": {"region": "Ismailia", "sex": "female", "age": 23, "country": "Egypt", "marital_status": "single", "education": "higher", "social_class": "lower middle class"}, "question": {"id": "Q19", "variant": 0}, "response": ["From the perspective of a single female from Ismailia, Egypt, who is 23 years old and considers herself part of the lower middle class, it is important to consider the cultural context and socioeconomic background in answering this question. In Egypt, there is a diverse population with people of different races, and the cultural context of living in a diverse community may be important for social cohesion and understanding. Additionally, as someone from the lower middle class, the individual values and personal experience may lead to an appreciation of diversity and the importance of having neighbors of different races to foster a sense of community and mutual understanding.\n2"]}, {"persona": {"region": "Ismailia", "sex": "male", "age": 55, "country": "Egypt", "marital_status": "married", "education": "middle", "social_class": "lower middle class"}, "question": {"id": "Q19", "variant": 0}, "response": ["From the perspective of a married male from Ismailia, Egypt, at 55 years of age and belonging to the lower middle class, cultural context is pivotal in understanding the importance of having neighbors of a different race. In this region, there is a strong emphasis on cultural homogeneity and maintaining traditional values. Additionally, socioeconomic background plays a significant role in shaping perceptions, and individuals from the lower middle class may not have had as much exposure to diversity or the value of having neighbors of a different race. Furthermore, personal experience and individual values also contribute to the perception of the importance of diversity in neighbors. Taking into account these factors, it is likely that the persona would choose the following answer:\n\n2"]}, {"persona": {"region": "Ismailia", "sex": "male", "age": 57, "country": "Egypt", "marital_status": "married", "education": "middle", "social_class": "upper middle class"}, "question": {"id": "Q19", "variant": 0}, "response": ["Based on the anthropological framework, as a 57-year-old married male from Ismailia, Egypt, with a middle education level and a perception of being part of the upper middle class, I would approach this question from an emic perspective. In my cultural context, the importance of having neighbors of a different race may not be a significant factor in my daily life. My individual values and personal experiences may lead me to prioritize other aspects of community and neighborhood relations, such as shared cultural practices and socioeconomic background. Additionally, cultural relativism is crucial in my understanding, as I recognize that the significance of race and diversity in neighborhoods may vary across different cultural contexts. Therefore, based on my perspective and understanding, I would choose option (2) Not mentioned."]}, {"persona": {"region": "Ismailia", "sex": "female", "age": 29, "country": "Egypt", "marital_status": "married", "education": "middle", "social_class": "upper middle class"}, "question": {"id": "Q19", "variant": 0}, "response": ["From the perspective of a married female from Ismailia, Egypt, cultural context and individual values play a significant role in shaping my understanding of the importance of having neighbors of a different race. In my cultural context, there is a strong emphasis on community and neighborly relations, and I believe that diversity enriches the community and provides opportunities for cultural exchange and understanding. Additionally, my individual values are influenced by my upbringing and education, which have instilled in me a respect for diversity and a belief in the importance of inclusivity. Therefore, I believe it is important to have neighbors who are people of a different race.\n\n1"]}, {"persona": {"region": "Damiatta", "sex": "female", "age": 46, "country": "Egypt", "marital_status": "married", "education": "middle", "social_class": "lower middle class"}, "question": {"id": "Q19", "variant": 0}, "response": ["Based on the anthropological framework, my perspective as a 46-year-old married woman from Damiatta, Egypt, who considers herself part of the lower middle class, is heavily influenced by my cultural context, socioeconomic background, and personal experience. In my cultural context, the importance of having neighbors of a different race may not be a significant factor, as Egypt is largely a homogenous society. Additionally, my socioeconomic background may limit my interactions with people of different races, as it is not common for people of different races to live in my neighborhood. Therefore, I would argue that the option \"Not mentioned\" best reflects my perspective, as the importance of having neighbors of a different race is not a prominent consideration in my cultural and socioeconomic context. \n\n2"]}, {"persona": {"region": "Damiatta", "sex": "female", "age": 20, "country": "Egypt", "marital_status": "single", "education": "middle", "social_class": "lower middle class"}, "question": {"id": "Q19", "variant": 0}, "response": ["Based on my emic perspective as a single female from Damiatta, Egypt, I understand the importance of cultural context and the impact of individual values and personal experience. In my community, the concept of race may not hold the same significance as it does in other cultures. Additionally, my socioeconomic background as part of the lower middle class and my age of 20 years old also play a role in my understanding. Therefore, I believe it is important to have neighbors who are people of a different race as it can provide a diverse and enriching experience, allowing for a broader understanding of the world and fostering inclusivity and tolerance.\n\n1"]}, {"persona": {"region": "Damiatta", "sex": "male", "age": 19, "country": "Egypt", "marital_status": "single", "education": "middle", "social_class": "lower middle class"}, "question": {"id": "Q19", "variant": 0}, "response": ["Based on the anthropological framework, the perspective of a 19-year-old male from Damiatta, Egypt, who considers himself part of the lower middle class, would be influenced by their cultural context, individual values, socioeconomic background, and space and time. In Egypt, there is a diverse population with people of different races, especially in urban areas. However, the social and economic dynamics of the country may mean that interactions with people of different races are influenced by class and access to resources. Additionally, the individual values and personal experiences of the persona may shape their perspective on the importance of having neighbors of a different race. Given these considerations, the persona would likely choose the following option:\n\n2"]}, {"persona": {"region": "Damiatta", "sex": "female", "age": 33, "country": "Egypt", "marital_status": "married", "education": "higher", "social_class": "lower middle class"}, "question": {"id": "Q19", "variant": 0}, "response": ["Based on the anthropological framework, my emic perspective as a married female from Damiatta, Egypt, and my cultural context as a lower middle class individual with higher education, leads me to consider the importance of having neighbors of a different race. In my cultural context, diversity is not emphasized as much as in some Western cultures. However, my individual values and personal experience have taught me the importance of understanding and appreciating different cultures. Additionally, cultural relativism reminds me that there is no hierarchy of culture, and I believe that having neighbors of a different race can provide valuable opportunities for cultural exchange and learning. Therefore, based on my nuanced understanding of the question, I believe it is important to have neighbors who are people of a different race.\n\n1"]}, {"persona": {"region": "Damiatta", "sex": "male", "age": 24, "country": "Egypt", "marital_status": "single", "education": "higher", "social_class": "lower middle class"}, "question": {"id": "Q19", "variant": 0}, "response": ["From the emic perspective, living in Damiatta, Egypt, there is a strong cultural context that values diversity and inclusivity. The cultural relativism of the region emphasizes the importance of understanding and appreciating different races and ethnicities. As a single male who has completed higher education and considers himself part of the lower middle class, I have been exposed to a variety of cultural perspectives and understand the value of diversity in a community. Additionally, my individual values and personal experiences have taught me that having neighbors of different races can lead to a richer and more inclusive community. Considering the socioeconomic background and cultural context of my persona, I would say that it is important to have neighbors who are people of a different race.\n\n1"]}, {"persona": {"region": "Suez", "sex": "male", "age": 41, "country": "Egypt", "marital_status": "married", "education": "middle", "social_class": "working class"}, "question": {"id": "Q19", "variant": 0}, "response": ["Based on the anthropological framework, as a married male from Suez, Egypt, cultural context and individual values play a significant role in my perception of the importance of having neighbors who are people of a different race. As a member of the working class with a middle education level, my experiences and socioeconomic background shape my understanding of the world. In Egypt, there is a strong sense of community and kinship networks, and the cultural context emphasizes unity and solidarity among people, regardless of race. Therefore, I believe that having neighbors of a different race can bring diversity and enrich the community, fostering mutual understanding and respect. Additionally, cultural relativism reminds me that no culture is superior to another, and embracing diversity is essential for a harmonious society.\n\n1"]}, {"persona": {"region": "Suez", "sex": "female", "age": 39, "country": "Egypt", "marital_status": "divorced", "education": "middle", "social_class": "working class"}, "question": {"id": "Q19", "variant": 0}, "response": ["Based on the anthropological framework, my perspective as a divorced female from Suez, Egypt, who is 39 years old, completed middle education level, and considers herself part of the working class, is influenced by my cultural context, individual values and personal experience, and socioeconomic background. In Egypt, the concept of race may not be as prominent as it is in other parts of the world, and the importance of having neighbors of a different race may not be a significant factor in my everyday life. Additionally, as a working-class individual, my focus may be on other socioeconomic factors that impact my daily life. Therefore, my answer to the question is:\n\n2. Not mentioned"]}, {"persona": {"region": "Cairo", "sex": "female", "age": 55, "country": "Egypt", "marital_status": "married", "education": "middle", "social_class": "working class"}, "question": {"id": "Q19", "variant": 0}, "response": ["Based on the anthropological framework, as a married female from Cairo, Egypt, my emic perspective is that cultural context is pivotal in understanding and answering this question. In Egypt, the cultural context values community and neighborly relationships, regardless of race. Furthermore, individual values and personal experience play a big role in subjective understandings, and in my experience, having neighbors of different races has enriched my life and broadened my perspective. Additionally, socioeconomic background is a factor, and as a working-class individual, I believe that diversity in my neighborhood is important for a harmonious and inclusive community. Therefore, based on my cultural context, personal experience, and socioeconomic background, I believe it is important to have neighbors who are people of a different race.\n\n1"]}, {"persona": {"region": "Cairo", "sex": "male", "age": 58, "country": "Egypt", "marital_status": "married", "education": "middle", "social_class": "lower middle class"}, "question": {"id": "Q19", "variant": 0}, "response": ["Based on the anthropological framework, as a married male from Cairo, Egypt, with a middle education level and part of the lower middle class, my perspective is heavily influenced by cultural context, individual values, and socioeconomic background. In Cairo, the cultural context is such that there is a strong emphasis on community and social cohesion. Personal experience has taught me that having neighbors of different races is not a common occurrence in my community, and therefore, it is not a factor that I have considered as important. Additionally, my socioeconomic background has influenced my perception, as lower middle class individuals often live in homogenous neighborhoods due to limited housing options. Therefore, I do not find it important to have neighbors who are people of a different race.\n\n3"]}, {"persona": {"region": "Cairo", "sex": "female", "age": 29, "country": "Egypt", "marital_status": "married", "education": "higher", "social_class": "lower middle class"}, "question": {"id": "Q19", "variant": 0}, "response": ["Based on the anthropological framework of emic and etic perspectives, cultural context, individual values and personal experience, socioeconomic background, cultural relativism, space and time, and nuance, I, as a married female from Cairo, Egypt, would approach this question by considering the cultural context and individual values. In Egypt, race is not as salient of a social category as it may be in other countries. Additionally, the socioeconomic background and class play a role in shaping the importance of having neighbors of a different race. In my lower middle class community in Cairo, personal experience and individual values may prioritize factors such as trustworthiness, friendliness, and shared community interests over race. Therefore, the importance of having neighbors of a different race may not be as significant as other factors in my cultural and social context.\n\n2"]}, {"persona": {"region": "Cairo", "sex": "male", "age": 38, "country": "Egypt", "marital_status": "married", "education": "higher", "social_class": "lower middle class"}, "question": {"id": "Q19", "variant": 0}, "response": ["Based on my experience and cultural context as a married male from Cairo, Egypt, I believe that the importance of having neighbors of a different race is influenced by individual values and personal experiences, as well as socioeconomic background. In Egypt, the concept of race is not as prominent as it may be in other countries, and the emphasis is often placed on cultural and religious differences. Additionally, the socioeconomic background of being part of the lower middle class may mean that the focus is more on practical and economic aspects of neighbors rather than their race. Therefore, I would choose:\n2"]}, {"persona": {"region": "Cairo", "sex": "female", "age": 40, "country": "Egypt", "marital_status": "married", "education": "higher", "social_class": "lower middle class"}, "question": {"id": "Q19", "variant": 0}, "response": ["In considering the question of the importance of having neighbors who are people of a different race, it is essential to take into account the cultural context and individual values of the persona described. As a married female from Cairo, Egypt, who is part of the lower middle class and has completed higher education, the cultural context of Egypt is one where diversity is celebrated, and the coexistence of people from different racial backgrounds is common. Additionally, individual values and personal experiences play a significant role in shaping the perception of the importance of having neighbors who are people of a different race. Based on these considerations, the persona would likely view it as important to have neighbors who are people of a different race, as it can contribute to a richer and more diverse community environment.\n\n1"]}, {"persona": {"region": "Cairo", "sex": "male", "age": 38, "country": "Egypt", "marital_status": "married", "education": "higher", "social_class": "upper middle class"}, "question": {"id": "Q19", "variant": 0}, "response": ["Based on the anthropological framework, my answer is influenced by my cultural context, socioeconomic background, individual values, and personal experience. In Egypt, there is a strong emphasis on community and neighborly relations. However, the cultural context and socioeconomic background play a significant role in shaping these relations. As a member of the upper middle class in Cairo, I have likely had limited interactions with people of different races in my immediate neighborhood. My personal experience and individual values may lead me to prioritize other factors, such as shared cultural practices and socioeconomic status, over race in considering the importance of having neighbors of a different race. Therefore, my answer is (2) Not mentioned."]}, {"persona": {"region": "Cairo", "sex": "male", "age": 59, "country": "Egypt", "marital_status": "married", "education": "middle", "social_class": "lower middle class"}, "question": {"id": "Q19", "variant": 0}, "response": ["Based on my cultural context in Cairo, Egypt, where there is a diverse population including people of different races, I understand the importance of having neighbors who are people of different races. This understanding is influenced by my individual values and personal experiences, as well as the cultural relativism that I have been exposed to. In Egypt, we value diversity and believe that it enriches our community and allows for greater understanding and tolerance. Additionally, my lower middle class socioeconomic background has also shaped my perspective, as I have often interacted with individuals from different races in my daily life. Therefore, I believe it is important to have neighbors who are people of a different race.\n\n1"]}, {"persona": {"region": "Cairo", "sex": "female", "age": 30, "country": "Egypt", "marital_status": "married", "education": "higher", "social_class": "upper middle class"}, "question": {"id": "Q19", "variant": 0}, "response": ["Based on the anthropological framework, as a married female from Cairo, Egypt, cultural context is pivotal in understanding and answering this question. In Egypt, there is a strong sense of community and neighborly relations, where people of different races often live harmoniously together. Additionally, my individual values and personal experiences have shaped my perception to value diversity and inclusivity, as I have been exposed to people of different races and have learned from their perspectives. This belief is also influenced by my upper middle class socioeconomic background, where I have had the privilege of education and exposure to different cultures. Therefore, I believe it is important to have neighbors who are people of a different race in order to foster understanding and inclusivity in the community.\n\n1"]}, {"persona": {"region": "Cairo", "sex": "male", "age": 22, "country": "Egypt", "marital_status": "single", "education": "middle", "social_class": "lower middle class"}, "question": {"id": "Q19", "variant": 0}, "response": ["From the perspective of a single male from Cairo, Egypt, cultural context is pivotal in understanding the importance of having neighbors who are people of a different race. In Cairo, there is a diverse population with people from different racial backgrounds living together. This cultural context shapes the individual's perspective on the importance of having neighbors of a different race. Additionally, socioeconomic background plays a role as the individual considers himself part of the lower middle class, which may influence his interactions and relationships with people of different races. Finally, individual values and personal experiences also factor in, as the individual's experiences and values may shape his perspective on the importance of diversity in his neighborhood.\n\n1"]}, {"persona": {"region": "Cairo", "sex": "male", "age": 29, "country": "Egypt", "marital_status": "single", "education": "higher", "social_class": "lower middle class"}, "question": {"id": "Q19", "variant": 0}, "response": ["Based on the anthropological framework, as a single male from Cairo, Egypt, I understand the importance of cultural context in shaping my beliefs and values. In Egypt, there is a strong emphasis on kinship networks and community ties, and people of different races are not as common as in other parts of the world. Additionally, my lower-middle-class background has influenced my understanding of socioeconomic dynamics and the importance of community support. Therefore, given my personal experience and cultural context, I believe that having neighbors of different races can be important for promoting diversity and understanding different perspectives.\n\n1"]}, {"persona": {"region": "Cairo", "sex": "female", "age": 31, "country": "Egypt", "marital_status": "married", "education": "higher", "social_class": "lower middle class"}, "question": {"id": "Q19", "variant": 0}, "response": ["From an anthropological perspective, my cultural context in Cairo, Egypt, heavily influences my understanding and answer to this question. In my community, diversity is not as prominent as it might be in other parts of the world. My individual values and personal experience also play a role in shaping my perspective. As a married woman in my early thirties from the lower middle class, I have experienced the importance of having a supportive and cohesive community. This has led me to believe that it is important to have neighbors who are people of a different race because it promotes a sense of inclusivity and understanding. Additionally, cultural relativism is a key concept for me, as I understand the value of diversity and believe that no culture is inherently superior to another. Therefore, my answer to the question would be:\n\n1"]}, {"persona": {"region": "Cairo", "sex": "male", "age": 59, "country": "Egypt", "marital_status": "married", "education": "higher", "social_class": "upper middle class"}, "question": {"id": "Q19", "variant": 0}, "response": ["Based on the anthropological framework, I, as a married male from Cairo, Egypt, understand the importance of cultural context and individual values in answering this question. In my cultural context, the concept of race may not be as significant as it is in other parts of the world. Additionally, my personal experience and values may lead me to believe that having neighbors of a different race is not necessarily important for me, as my community may prioritize other factors such as religion or socioeconomic background. Therefore, I would choose option 2: Not mentioned."]}, {"persona": {"region": "Cairo", "sex": "male", "age": 27, "country": "Egypt", "marital_status": "single", "education": "middle", "social_class": "working class"}, "question": {"id": "Q19", "variant": 0}, "response": ["Based on the anthropological framework, my perspective is heavily influenced by my cultural background, socioeconomic status, and personal experience. In Cairo, Egypt, race is not as salient of a factor as it may be in other parts of the world. The cultural context of Egypt is predominantly homogenous, and the concept of race is not as prominent in daily life. Additionally, as a working-class individual with a middle education level, my focus is on more immediate concerns, such as financial stability and employment opportunities, rather than the race of my neighbors. Therefore, I do not see the importance of having neighbors of a different race, as it is not a significant factor in my cultural context and personal experience.\n\n2"]}, {"persona": {"region": "Cairo", "sex": "female", "age": 25, "country": "Egypt", "marital_status": "single", "education": "higher", "social_class": "working class"}, "question": {"id": "Q19", "variant": 0}, "response": ["From the perspective of a single female from Cairo, Egypt, it is important to consider the emic and etic perspectives when answering the question. In the cultural context of Cairo, there is a diverse population with people from different races and ethnicities. Individual values and personal experience play a significant role in shaping the perception of the importance of having neighbors of a different race. Additionally, socioeconomic background, including being part of the working class, influences the understanding of diversity and the interaction with neighbors of different races. Cultural relativism is also important to consider, as there is no hierarchy of culture and diversity is valued in the Egyptian context. The nuanced phrasing of the question is crucial in eliciting a response that reflects the specific circumstances and perspectives of the persona described.\n\n1"]}, {"persona": {"region": "Cairo", "sex": "female", "age": 23, "country": "Egypt", "marital_status": "married", "education": "higher", "social_class": "lower middle class"}, "question": {"id": "Q19", "variant": 0}, "response": ["In considering the question of the importance of having neighbors who are people of a different race, it is essential to take into account the emic and etic perspectives of the persona described. From a cultural context, growing up in Cairo, Egypt, where there is a diverse population and a long history of multiculturalism, the understanding of race and neighbors may differ from other cultural contexts. Individual values and personal experiences, along with socioeconomic background, also play a significant role in shaping perceptions and attitudes towards this question. Additionally, the concept of cultural relativism is crucial, as there is no hierarchy of culture and diversity is valued in this context. Therefore, considering the nuanced phrasing of the question and the specific cultural and personal background of the persona, the chosen answer is:\n\n1"]}, {"persona": {"region": "Cairo", "sex": "male", "age": 58, "country": "Egypt", "marital_status": "married", "education": "higher", "social_class": "working class"}, "question": {"id": "Q19", "variant": 0}, "response": ["Based on the anthropological framework, as a married male from Cairo, Egypt, my perspective is deeply influenced by my cultural context, individual values, and socioeconomic background. In Cairo, there is a rich cultural diversity, and it is important to have neighbors of different races as it adds to the fabric of our community. Additionally, as part of the working class, I value the importance of different perspectives and experiences, which can be enriched by having neighbors of different races. Furthermore, my higher education level has taught me the value of cultural relativism, understanding that no culture is better than another. Therefore, having neighbors of different races is important for fostering understanding and respect for diverse cultural backgrounds. \n\n1"]}, {"persona": {"region": "Cairo", "sex": "female", "age": 40, "country": "Egypt", "marital_status": "married", "education": "higher", "social_class": "working class"}, "question": {"id": "Q19", "variant": 0}, "response": ["Based on the anthropological framework, as a married female from Cairo, Egypt, my answer to the question is influenced by my cultural context, individual values, and socioeconomic background. In Egypt, there is a diverse mix of people from different races, so it is normal to have neighbors of a different race. Additionally, my personal experience and values emphasize the importance of diversity and understanding different cultures. As a member of the working class, I value the connections and support that come from having diverse neighbors. Therefore, I believe it is important to have neighbors who are people of a different race.\n\n1"]}, {"persona": {"region": "Cairo", "sex": "female", "age": 36, "country": "Egypt", "marital_status": "married", "education": "middle", "social_class": "upper middle class"}, "question": {"id": "Q19", "variant": 0}, "response": ["Based on my personal experience and socioeconomic background as a married female from Cairo, Egypt, I understand the importance of cultural context and the significance of kinship networks in our community. As an upper middle-class individual, I value the diversity and richness that people of different races bring to our neighborhood. I believe that having neighbors of different races can lead to a more inclusive and understanding community, which is essential in our increasingly globalized world. Additionally, the concept of cultural relativism teaches us to appreciate and respect different cultures, making it important to have neighbors who are people of a different race to promote mutual understanding and cooperation.\n\n1"]}, {"persona": {"region": "Cairo", "sex": "male", "age": 40, "country": "Egypt", "marital_status": "married", "education": "middle", "social_class": "lower middle class"}, "question": {"id": "Q19", "variant": 0}, "response": ["Based on the anthropological framework, as a 40-year-old married male from Cairo, Egypt, with a middle education level and lower middle-class background, my perspective on the importance of having neighbors of a different race is influenced by my cultural context, individual values, and personal experience. In Cairo, there is a diverse population with people from various racial and ethnic backgrounds. Due to this cultural context, I have been exposed to and interacted with individuals of different races throughout my life. Additionally, my individual values emphasize the importance of diversity and inclusivity. I believe that having neighbors of different races can lead to a richer and more interconnected community, where individuals can learn from each other and celebrate their differences. Therefore, I believe it is important to have neighbors who are people of a different race.\n\n1"]}, {"persona": {"region": "Cairo", "sex": "female", "age": 30, "country": "Egypt", "marital_status": "married", "education": "middle", "social_class": "lower class"}, "question": {"id": "Q19", "variant": 0}, "response": ["From the perspective of a married female from Cairo, Egypt, who is 30 years old, has completed middle education, and considers herself part of the lower class, the answer to the question of whether it is important to have neighbors who are people of a different race would be influenced by several factors. First, the cultural context of living in Cairo, a city with a diverse population, would likely lead to an understanding of the importance of diversity and the value of interacting with people from different races. Additionally, the individual values and personal experiences of this persona may lead to an appreciation for the richness that diversity can bring to a community. Finally, the socioeconomic background of being part of the lower class may lead to a recognition of the shared experiences and struggles that can unite individuals regardless of race. Taking all of these factors into account, the chosen answer would be:\n\n1"]}, {"persona": {"region": "Cairo", "sex": "male", "age": 58, "country": "Egypt", "marital_status": "married", "education": "higher", "social_class": "lower middle class"}, "question": {"id": "Q19", "variant": 0}, "response": ["Based on the anthropological framework, my perspective as a married male from Cairo, Egypt, would be influenced by my cultural context, individual values, socioeconomic background, and space and time. In Egypt, there is a diverse population with people of different races, so the cultural context would emphasize the importance of living harmoniously with neighbors of different races. Additionally, my individual values and personal experiences would likely lead me to value diversity and multiculturalism. As someone from the lower middle class, I may also recognize the importance of community and solidarity, regardless of race. Therefore, based on these factors, I believe it is important to have neighbors who are people of a different race.\n\n1"]}, {"persona": {"region": "Cairo", "sex": "male", "age": 50, "country": "Egypt", "marital_status": "married", "education": "middle", "social_class": "lower middle class"}, "question": {"id": "Q19", "variant": 0}, "response": ["Based on the anthropological framework, as a married male from Cairo, Egypt, the cultural context and cultural relativism play a significant role in shaping my perspective on the importance of having neighbors who are people of a different race. In Egypt, there is a diverse population with a rich history of multiculturalism, and the concept of race may be viewed differently than in other parts of the world. Additionally, my lower middle class socioeconomic background and middle education level may influence my understanding of the importance of racial diversity in my neighborhood. Considering the emic and etic perspectives, personal experiences, and individual values, I believe it is important to have neighbors who are people of a different race in order to promote cultural exchange and understanding, and to challenge any potential prejudices or stereotypes. \n\n1"]}, {"persona": {"region": "Cairo", "sex": "female", "age": 40, "country": "Egypt", "marital_status": "married", "education": "higher", "social_class": "upper middle class"}, "question": {"id": "Q19", "variant": 0}, "response": ["Based on my personal experience and cultural context as a married female from Cairo, Egypt, I understand the importance of having neighbors who are people of a different race. In Egypt, we have a rich history of diversity and have coexisted with people of different races for centuries. This has contributed to our cultural values and understanding of the world. Additionally, my socioeconomic background as part of the upper middle class has exposed me to a more cosmopolitan lifestyle, where interactions with people of different races are common and valued. This has shaped my perspective on the importance of diversity in my neighborhood, as it enhances the richness of our community and allows for a broader understanding of the world.\n\n1"]}, {"persona": {"region": "Cairo", "sex": "female", "age": 33, "country": "Egypt", "marital_status": "married", "education": "middle", "social_class": "lower middle class"}, "question": {"id": "Q19", "variant": 0}, "response": ["Based on my personal experience and cultural context as a married female from Cairo, Egypt, I understand the importance of having neighbors who are people of a different race. In Egypt, we have a diverse population with people from different racial backgrounds, and it is important to have neighbors from different races to promote understanding and unity within our community. Additionally, my lower middle-class socioeconomic background has taught me the value of diversity and the importance of building strong relationships with people from all walks of life. Therefore, I believe it is important to have neighbors who are people of a different race.\n\n1"]}, {"persona": {"region": "Cairo", "sex": "female", "age": 37, "country": "Egypt", "marital_status": "married", "education": "middle", "social_class": "lower middle class"}, "question": {"id": "Q19", "variant": 0}, "response": ["From an emic perspective, living in Cairo, Egypt, I understand the importance of cultural context in shaping my beliefs and values. The cultural relativism in Egypt means that there is a strong emphasis on community and neighborly relations, regardless of race. My individual values and personal experience also play a role in this, as I have grown up in a diverse neighborhood where people of different races have always been a part of my community. Additionally, my lower middle-class socioeconomic background has taught me to value the importance of solidarity and cooperation with all members of my community, regardless of race. Therefore, I believe it is important to have neighbors who are people of different races.\n\n1"]}, {"persona": {"region": "Cairo", "sex": "male", "age": 28, "country": "Egypt", "marital_status": "married", "education": "middle", "social_class": "lower middle class"}, "question": {"id": "Q19", "variant": 0}, "response": ["Based on my personal experience and cultural context, I believe that it is important to have neighbors who are people of a different race. In Cairo, there is a diverse mix of people from different racial and ethnic backgrounds, and it is important to have interactions with people from different races to understand and appreciate diversity. Additionally, considering my lower middle class background, I believe that having neighbors from different races can lead to a better understanding of different cultures and perspectives, which can be enriching and beneficial for everyone in the community. Cultural relativism also plays a role in my understanding, as I do not believe that one race is superior to another. In conclusion, based on my background and the anthropological framework, I believe that it is important to have neighbors who are people of a different race.\n\n1"]}, {"persona": {"region": "Cairo", "sex": "male", "age": 53, "country": "Egypt", "marital_status": "married", "education": "higher", "social_class": "working class"}, "question": {"id": "Q19", "variant": 0}, "response": ["Based on the anthropological framework, my perspective on the importance of having neighbors who are people of a different race is shaped by my cultural context, individual values, and socioeconomic background. As a married male from Cairo, Egypt, I have been influenced by the diverse and multicultural society in which I live. My higher education level has also exposed me to different perspectives and ways of thinking. As a member of the working class, I understand the importance of community and the value of diversity. Additionally, cultural relativism teaches me that all cultures have value, and I believe that having neighbors of a different race can enrich my life and broaden my understanding of the world.\n\n1"]}, {"persona": {"region": "Cairo", "sex": "male", "age": 45, "country": "Egypt", "marital_status": "married", "education": "higher", "social_class": "lower middle class"}, "question": {"id": "Q19", "variant": 0}, "response": ["From the perspective of a married male from Cairo, Egypt, the cultural context is crucial in understanding the importance of having neighbors of a different race. In Egypt, there is a diverse population with people from different ethnic and racial backgrounds living together. The emic perspective would emphasize the value of diversity and the rich cultural exchange that comes with having neighbors of different races. The etic perspective, on the other hand, might focus on the potential for conflict or misunderstanding that could arise from racial differences. Additionally, individual values and personal experiences play a role in shaping one's view on this question. As a lower middle-class individual who has completed higher education, there may be a greater appreciation for diversity and the opportunities it brings. Socioeconomic background also factors in, as individuals from different economic classes may have different levels of exposure and interaction with people of different races. In this context, the importance of having neighbors of a different race would likely be seen as important for fostering understanding and tolerance, and thus, option (1) Important."]}, {"persona": {"region": "Cairo", "sex": "male", "age": 52, "country": "Egypt", "marital_status": "married", "education": "middle", "social_class": "upper middle class"}, "question": {"id": "Q19", "variant": 0}, "response": ["Based on the anthropological framework, my perspective as a married male from Cairo, Egypt, at 52 years of age and part of the upper middle class, is shaped by my cultural context, individual values, and socioeconomic background. In Egypt, the concept of race is not as salient as it may be in other parts of the world. Therefore, my understanding of the importance of having neighbors of a different race may differ from those in societies where race is a significant factor. Additionally, my socioeconomic background as part of the upper middle class may lead me to prioritize other aspects of community and neighborhood dynamics over race. Overall, my perspective is shaped by the nuances of my cultural context and socioeconomic status, leading me to prioritize other factors over the race of my neighbors.\n\n2"]}, {"persona": {"region": "Cairo", "sex": "male", "age": 22, "country": "Egypt", "marital_status": "single", "education": "higher", "social_class": "lower middle class"}, "question": {"id": "Q19", "variant": 0}, "response": ["Based on the anthropological framework, my answer is influenced by my cultural context, individual values, and socioeconomic background. In Cairo, Egypt, there is a diverse population with people from different races and ethnicities. As a lower middle-class individual, I have experienced the importance of having neighbors from different races as it can contribute to a richer understanding of different cultures and perspectives. This aligns with the cultural relativism perspective, as I believe that no culture is superior to another. Additionally, my personal experience and education have taught me the value of diversity and inclusivity in creating a more harmonious community. Therefore, I believe it is important to have neighbors who are people of a different race.\n\n1"]}, {"persona": {"region": "Cairo", "sex": "female", "age": 57, "country": "Egypt", "marital_status": "divorced", "education": "middle", "social_class": "lower middle class"}, "question": {"id": "Q19", "variant": 0}, "response": ["Based on the anthropological framework, as a divorced female from Cairo, Egypt, I would consider the cultural context and individual values to be pivotal in answering this question. In Egypt, there is a diverse cultural and racial makeup, and it is important to have neighbors of different races to foster understanding and tolerance. This perspective is shaped by my personal experience and the cultural relativism that exists in Egyptian society. Additionally, as a lower middle class individual with a middle education level, I understand the importance of diversity and inclusivity in my community. Therefore, I believe it is important to have neighbors who are people of a different race.\n\n1"]}, {"persona": {"region": "Cairo", "sex": "female", "age": 42, "country": "Egypt", "marital_status": "married", "education": "middle", "social_class": "working class"}, "question": {"id": "Q19", "variant": 0}, "response": ["Based on the anthropological framework, as a married female from Cairo, Egypt, my emic perspective is shaped by the cultural context of Egypt, which values strong kinship networks and community ties. The etic perspective also recognizes the importance of cultural relativism, where different cultures have their own norms and values. Additionally, my individual values and personal experience as a working-class woman in Cairo have influenced my understanding of the importance of diversity and inclusion. Socioeconomic background also plays a role, as my middle education level and working-class status may have shaped my views on race and diversity. Therefore, my nuanced understanding is that it is important to have neighbors who are people of a different race because diversity enriches our community and provides opportunities for learning and understanding different perspectives.\n\n1"]}, {"persona": {"region": "Cairo", "sex": "female", "age": 23, "country": "Egypt", "marital_status": "single", "education": "middle", "social_class": "lower middle class"}, "question": {"id": "Q19", "variant": 0}, "response": ["Based on my emic perspective as a single female from Cairo, Egypt, I believe that the cultural context and socioeconomic background play a pivotal role in answering this question. In my community, people are primarily of the same race, and there may not be a lot of diversity in terms of race among neighbors. Additionally, the cultural relativism and nuance of the question is important to consider, as the concept of race may be viewed differently in my cultural context compared to other cultures. Therefore, I believe that having neighbors of a different race may not be as important in my specific cultural and socioeconomic context. \n\n2"]}, {"persona": {"region": "Cairo", "sex": "female", "age": 28, "country": "Egypt", "marital_status": "married", "education": "higher", "social_class": "upper middle class"}, "question": {"id": "Q19", "variant": 0}, "response": ["Based on the anthropological framework, my emic perspective as a married female from Cairo, Egypt, who is part of the upper middle class, has been shaped by the cultural context, individual values, and socioeconomic background. In Egypt, there is a strong emphasis on community and kinship networks, and it is important to have good relationships with neighbors regardless of their race. Additionally, my personal experience and values have taught me the importance of diversity and inclusivity. Therefore, I believe it is important to have neighbors who are people of a different race.\n\n1"]}, {"persona": {"region": "Cairo", "sex": "female", "age": 22, "country": "Egypt", "marital_status": "single", "education": "higher", "social_class": "lower middle class"}, "question": {"id": "Q19", "variant": 0}, "response": ["Based on the anthropological framework, my perspective on the importance of having neighbors of a different race is shaped by my cultural context, individual values, and socioeconomic background. In Cairo, Egypt, there is a diverse population with people of various races and ethnicities. However, the societal structure and socioeconomic disparities often lead to segregated neighborhoods. As a young woman from the lower middle class, I value diversity and believe that having neighbors of different races can enrich my life by providing opportunities for cultural exchange and understanding. Additionally, my higher education has taught me the importance of cultural relativism, and I believe that embracing diversity in my neighborhood can contribute to a more inclusive and harmonious community.\n\n1"]}, {"persona": {"region": "Cairo", "sex": "female", "age": 39, "country": "Egypt", "marital_status": "married", "education": "middle", "social_class": "lower middle class"}, "question": {"id": "Q19", "variant": 0}, "response": ["Based on the anthropological framework, my understanding is shaped by my cultural context, individual values, socioeconomic background, and the nuance of the question. In Cairo, Egypt, where I come from, race is not as salient as it may be in other parts of the world. My lower middle class background also means that I have had limited exposure to people of different races. Additionally, my middle education level may have also influenced my perspective. Taking all of this into account, I would choose option (2) Not mentioned, as the importance of having neighbors of a different race has not been a significant factor in my life experience and cultural context."]}, {"persona": {"region": "Cairo", "sex": "male", "age": 19, "country": "Egypt", "marital_status": "single", "education": "middle", "social_class": "working class"}, "question": {"id": "Q19", "variant": 0}, "response": ["Based on the anthropological framework, as a 19-year-old working-class male from Cairo, Egypt, my perspective is heavily influenced by my cultural context, individual values, and personal experience. In Egypt, race is not as prominent a factor as it may be in other parts of the world, and therefore, the importance of having neighbors of a different race may not be a significant consideration for me. Additionally, living in a predominantly homogenous society, the concept of race may not hold the same weight as it does in more diverse communities. Therefore, I believe that the importance of having neighbors of a different race is not as relevant in my cultural context.\n\n2"]}, {"persona": {"region": "Cairo", "sex": "female", "age": 54, "country": "Egypt", "marital_status": "married", "education": "middle", "social_class": "working class"}, "question": {"id": "Q19", "variant": 0}, "response": ["From the perspective of a married female from Cairo, Egypt, age 54, and belonging to the working class, the answer to the question is influenced by several factors. The cultural context in Egypt, particularly in urban areas like Cairo, is diverse and multiracial. The individual values and personal experiences of the persona may also play a role in her answer, as she is likely to have interacted with people of different races in her community. Additionally, her socioeconomic background as a member of the working class may influence her perception of the importance of having neighbors of different races. Considering the cultural relativism framework, she may view diversity in her neighborhood as a positive aspect, as it can enrich her social interactions and provide a broader understanding of different cultures. Therefore, the persona would likely choose option (1) Important. \n\n1"]}, {"persona": {"region": "Cairo", "sex": "male", "age": 30, "country": "Egypt", "marital_status": "married", "education": "higher", "social_class": "working class"}, "question": {"id": "Q19", "variant": 0}, "response": ["Based on the anthropological framework, as a married male from Cairo, Egypt, I am influenced by the cultural context and socioeconomic background of my surroundings. In Egypt, there is a diverse population with people of different races, and it is common to have neighbors from various racial backgrounds. This exposure to diversity is valued and seen as important for fostering a sense of community and understanding among different racial groups. Additionally, my individual values and personal experience have led me to believe that having neighbors of different races can enrich my life and broaden my perspective. Therefore, based on my cultural context and personal experience, I believe it is important to have neighbors who are people of a different race.\n\n1"]}, {"persona": {"region": "Cairo", "sex": "male", "age": 39, "country": "Egypt", "marital_status": "married", "education": "higher", "social_class": "lower middle class"}, "question": {"id": "Q19", "variant": 0}, "response": ["Based on the anthropological framework, as a married male from Cairo, Egypt, I understand the importance of considering cultural context, individual values, and socioeconomic background in answering this question. In Egypt, there is a diverse cultural context with people of different races living together, and this diversity is valued. As an individual with a higher education level and part of the lower middle class, I appreciate the importance of interacting with people from different races as it can lead to a more enriched and diverse community. Additionally, cultural relativism teaches us that no culture is better than another, and having neighbors of different races can lead to a more nuanced understanding of the world. Therefore, I believe it is important to have neighbors who are people of a different race.\n\n1"]}, {"persona": {"region": "Cairo", "sex": "female", "age": 41, "country": "Egypt", "marital_status": "married", "education": "middle", "social_class": "lower middle class"}, "question": {"id": "Q19", "variant": 0}, "response": ["Based on the anthropological framework, as a married female from Cairo, Egypt, my perspective is heavily influenced by my cultural context, individual values, and socioeconomic background. In Egypt, there is a strong sense of community and social connection, and having neighbors of a different race may not be a priority. Additionally, as someone from the lower middle class, my focus may be more on economic stability and providing for my family rather than the race of my neighbors. Cultural relativism also plays a role, as there is a recognition that different cultures may place different value on this issue. Therefore, my answer is: \n2"]}, {"persona": {"region": "Cairo", "sex": "male", "age": 45, "country": "Syria", "marital_status": "single", "education": "higher", "social_class": "upper middle class"}, "question": {"id": "Q19", "variant": 0}, "response": ["Based on the anthropological framework, my answer is based on my personal experience and cultural context as a single male from Cairo, Syria. As a person who has completed higher education and considers myself part of the upper middle class, I value diversity and understand the importance of interacting with people from different races. I believe that having neighbors who are people of a different race can provide a valuable opportunity for cultural exchange and understanding. This aligns with the emic perspective of valuing diversity and the etic perspective of cultural relativism, where I recognize the importance of embracing different cultures and perspectives in a non-hierarchical way. Therefore, I choose option (1) Important."]}, {"persona": {"region": "Cairo", "sex": "male", "age": 54, "country": "Egypt", "marital_status": "married", "education": "higher", "social_class": "lower middle class"}, "question": {"id": "Q19", "variant": 0}, "response": ["From the perspective of a married male in Cairo, Egypt, with a lower middle-class socioeconomic background, the importance of having neighbors who are people of a different race would be influenced by cultural context, individual values, and personal experiences. In Egypt, there is a diverse mix of races and ethnicities, and the cultural value of hospitality and community is strong. However, there may also be individual experiences and values that shape the perception of the importance of having neighbors of a different race. Additionally, the socioeconomic background may play a role in the level of exposure and interaction with people of different races. Therefore, the answer to this question would be influenced by a combination of cultural context, personal experiences, and individual values.\n\n1"]}, {"persona": {"region": "Cairo", "sex": "male", "age": 65, "country": "Egypt", "marital_status": "married", "education": "middle", "social_class": "upper middle class"}, "question": {"id": "Q19", "variant": 0}, "response": ["Based on the anthropological framework, I believe that my cultural context, individual values, and personal experience play a significant role in shaping my perspective on this question. In Cairo, Egypt, the cultural context and socioeconomic background are important factors that inform my understanding. As a member of the upper middle class and a resident of Cairo, I have had limited interaction with people of different races in my neighborhood. Additionally, my age and educational background have shaped my understanding of the world. Therefore, I believe that it is not important to have neighbors who are people of a different race as it has not been a significant factor in my personal experience or cultural context.\n\n2"]}, {"persona": {"region": "Cairo", "sex": "female", "age": 52, "country": "Egypt", "marital_status": "married", "education": "middle", "social_class": "upper middle class"}, "question": {"id": "Q19", "variant": 0}, "response": ["Based on the anthropological framework, my answer to the question is rooted in my cultural context and individual values. In Cairo, Egypt, the cultural context is such that race is not a significant factor in the concept of neighbors. What matters more is having good relationships with those who live nearby, regardless of their race. Additionally, as a middle-aged woman from the upper middle class, my personal experience and socioeconomic background also play a role in my answer. In my experience, having neighbors of a different race has not been a significant issue, and my socioeconomic background has provided me with the ability to engage with a diverse range of people. Therefore, I believe it is not important to have neighbors who are people of a different race. \n\n2"]}, {"persona": {"region": "Cairo", "sex": "male", "age": 26, "country": "Egypt", "marital_status": "single", "education": "higher", "social_class": "lower middle class"}, "question": {"id": "Q19", "variant": 0}, "response": ["Based on the anthropological framework, my perspective as a single male from Cairo, Egypt, who is 26 years old and part of the lower middle class, is influenced by my cultural context, individual values, and socioeconomic background. In Cairo, race is not as prominent of a factor in neighbor relations as it may be in other parts of the world. However, my personal experience and values lead me to believe that it is important to have neighbors who are people of a different race. This belief is influenced by my exposure to diversity during my education and my personal value of inclusivity and understanding of different cultures. Additionally, as part of the lower middle class, I believe that having neighbors of different races can lead to a more enriching and diverse community, which can positively impact our collective socioeconomic status. \n\n1"]}, {"persona": {"region": "Cairo", "sex": "male", "age": 32, "country": "Egypt", "marital_status": "married", "education": "middle", "social_class": "working class"}, "question": {"id": "Q19", "variant": 0}, "response": ["Based on the anthropological framework, as a married male from Cairo, Egypt, with a working-class background and middle education level, my perspective is shaped by my cultural context, individual values, and personal experience. In Egypt, there is a strong emphasis on community and social cohesion, and neighbors play a significant role in daily life. My personal experience and values lead me to believe that having neighbors of different races can be important for fostering diversity and understanding. Additionally, the cultural relativism perspective reminds me that there is value in embracing different cultures and perspectives. Therefore, my answer is:\n\n1"]}, {"persona": {"region": "Cairo", "sex": "male", "age": 38, "country": "Egypt", "marital_status": "married", "education": "middle", "social_class": "lower middle class"}, "question": {"id": "Q19", "variant": 0}, "response": ["From an emic perspective, as a married male from Cairo, Egypt, the cultural context plays a crucial role in shaping my understanding and answer to this question. In Egypt, the majority of the population is Arab, and there is not as much racial diversity as in other countries. Therefore, my cultural context informs me that the concept of having neighbors of a different race may not be as prevalent or relevant as it might be in other parts of the world. Additionally, my lower middle-class socioeconomic background also shapes my understanding, as I prioritize factors such as community safety and mutual respect in my neighborhood over racial diversity. My personal experience and values further contribute to my belief that the importance of having neighbors of a different race may not be as significant in my cultural and socioeconomic context. \n\n2"]}, {"persona": {"region": "Cairo", "sex": "male", "age": 58, "country": "Egypt", "marital_status": "married", "education": "higher", "social_class": "upper middle class"}, "question": {"id": "Q19", "variant": 0}, "response": ["Based on the anthropological framework, my perspective as a married, 58-year-old male from Cairo, Egypt, with a higher education level and a perceived upper middle-class status, is shaped by my cultural context, individual values, and personal experiences. In Egypt, the cultural context emphasizes the importance of community and neighborly relations, regardless of race. My personal experience living in a diverse city like Cairo has taught me the value of having neighbors of different races, as it fosters a sense of inclusivity and understanding. Additionally, the concept of cultural relativism reminds me that there is no hierarchy of culture, and therefore, I believe it is important to have neighbors who are people of a different race to promote cultural diversity and mutual respect.\n\n1"]}, {"persona": {"region": "Cairo", "sex": "male", "age": 49, "country": "Egypt", "marital_status": "married", "education": "middle", "social_class": "lower middle class"}, "question": {"id": "Q19", "variant": 0}, "response": ["Based on the anthropological framework, my response is influenced by my cultural context, individual values, and socioeconomic background. In Cairo, Egypt, there is a diverse population with people of different races, and the cultural context emphasizes the importance of respecting and coexisting with people from different racial backgrounds. Additionally, my individual values place importance on diversity and inclusivity, as I believe that interactions with people from different races can lead to a richer and more understanding community. Considering my lower middle-class background, I also understand the importance of having a supportive and cohesive neighborhood, and having neighbors of different races can contribute to a more vibrant and supportive community.\n\n1"]}, {"persona": {"region": "Cairo", "sex": "female", "age": 29, "country": "Egypt", "marital_status": "married", "education": "middle", "social_class": "working class"}, "question": {"id": "Q19", "variant": 0}, "response": ["Based on the anthropological framework, as a married female from Cairo, Egypt, I understand the importance of cultural context and cultural relativism. In my society, people value their kinship networks and social ties within their own community. However, as a working-class individual, I also recognize the significance of socioeconomic background in shaping perspectives. Additionally, personal experience and individual values play a role in how I perceive the importance of having neighbors of a different race. Considering these factors, I believe it is important to have neighbors who are people of a different race as it can lead to a more diverse and enriching community.\n\n1"]}, {"persona": {"region": "Cairo", "sex": "female", "age": 36, "country": "Egypt", "marital_status": "married", "education": "higher", "social_class": "lower middle class"}, "question": {"id": "Q19", "variant": 0}, "response": ["From the perspective of a married female from Cairo, Egypt, who is 36 years old, completed higher education, and considers herself part of the lower middle class, the answer to the question of whether it is important to have neighbors who are people of a different race is influenced by several factors. The cultural context in Egypt emphasizes the importance of unity and coexistence among different races and ethnicities. The individual values and personal experiences of the persona may also play a role in shaping her perception. Additionally, the socioeconomic background of being part of the lower middle class may impact her views on this question. Considering cultural relativism, the persona may value diversity and multiculturalism within her community. Therefore, she may view it as important to have neighbors who are people of a different race.\n\n1"]}, {"persona": {"region": "Cairo", "sex": "female", "age": 34, "country": "Egypt", "marital_status": "married", "education": "middle", "social_class": "lower middle class"}, "question": {"id": "Q19", "variant": 0}, "response": ["In considering the question of the importance of having neighbors of a different race, I must first acknowledge the cultural context of my own experiences as a married female from Cairo, Egypt. In my society, there is a strong emphasis on kinship networks and community ties, and the concept of race may not hold the same significance as it does in other cultural contexts. Additionally, my lower middle class socioeconomic background has influenced my understanding of the importance of shared resources and support within the community, regardless of race. Furthermore, the concept of cultural relativism reminds me that different cultures may have varying perspectives on the significance of race in neighborly relationships. Therefore, based on my personal experience and cultural context, I would say that it is important to have neighbors of different races, as diversity can bring about a richer and more inclusive community environment.\n\n1"]}, {"persona": {"region": "Fayoum", "sex": "male", "age": 57, "country": "Egypt", "marital_status": "married", "education": "middle", "social_class": "working class"}, "question": {"id": "Q19", "variant": 0}, "response": ["Based on the anthropological framework, as a married male from Fayoum, Egypt, my emic perspective emphasizes the importance of cultural context and the influence of socioeconomic background. In my community, the cultural context values strong kinship networks and close relationships with neighbors. Additionally, my working-class background means that I prioritize practical and supportive relationships within my immediate community. Therefore, I believe it is important to have neighbors who are people of a different race as it can contribute to a diverse and supportive community environment, providing opportunities for cultural exchange and mutual support.\n\n1"]}, {"persona": {"region": "Fayoum", "sex": "male", "age": 60, "country": "Egypt", "marital_status": "married", "education": "middle", "social_class": "lower middle class"}, "question": {"id": "Q19", "variant": 0}, "response": ["From the emic perspective, as a married male from Fayoum, Egypt, my cultural context heavily influences my answer to this question. In Egypt, there is a strong emphasis on community and social cohesion, and having neighbors of a different race may not be a priority compared to other factors such as shared values, language, and kinship networks. Additionally, my individual values and personal experience as a 60-year-old from a lower middle-class background also play a significant role in my perspective. Socioeconomic background is pivotal in shaping my answer, as it may impact the level of interaction and connection with neighbors of different races. Cultural relativism is important to consider, as there is a diverse range of perspectives within Egypt, and my space and time, being from Fayoum and of a certain age, also influence my understanding. Finally, the nuanced phrasing of the question also guides my response, as the importance of having neighbors of a different race may be weighed against other factors. \n\n1"]}, {"persona": {"region": "Fayoum", "sex": "male", "age": 21, "country": "Egypt", "marital_status": "single", "education": "middle", "social_class": "lower middle class"}, "question": {"id": "Q19", "variant": 0}, "response": ["Based on the anthropological framework, my response is influenced by my cultural context, individual values and personal experience, and socioeconomic background. In Fayoum, Egypt, there is a strong emphasis on community and neighborly relations, and diversity is not as prevalent as in other parts of the world. As a young man from the lower middle class, my personal experience and values lead me to believe that having neighbors of a different race is not a priority. Additionally, the cultural context of my community places more importance on shared values and mutual respect, rather than the racial diversity of my neighbors.\n\n2"]}, {"persona": {"region": "Fayoum", "sex": "male", "age": 33, "country": "Egypt", "marital_status": "single", "education": "higher", "social_class": "working class"}, "question": {"id": "Q19", "variant": 0}, "response": ["Based on the anthropological framework, my perspective as a single male from Fayoum, Egypt, is heavily influenced by my cultural context, socioeconomic background, and personal experience. In Egypt, race is not as salient of a social construct as it may be in other parts of the world. Therefore, the importance of having neighbors of a different race may not be a significant consideration for me. Additionally, as a member of the working class, my primary concern is likely to be more focused on economic and social issues rather than the racial diversity of my neighbors. Overall, my perspective is shaped by the cultural relativism of my community and the nuanced understanding of the question in the context of my personal and socioeconomic background.\n\n1"]}, {"persona": {"region": "Fayoum", "sex": "male", "age": 32, "country": "Egypt", "marital_status": "married", "education": "higher", "social_class": "lower middle class"}, "question": {"id": "Q19", "variant": 0}, "response": ["Based on the anthropological framework of emic and etic perspectives, cultural context, individual values, socioeconomic background, cultural relativism, space and time, and nuance, it is important to consider the perspective of a 32-year-old married male from Fayoum, Egypt, who completed higher education and considers himself part of the lower middle class. In this context, the cultural context and individual values play a significant role in shaping the perspective on the importance of having neighbors of a different race. In Egypt, where the majority of the population identifies as Arab, the concept of race may be understood differently than in other parts of the world. Additionally, the socioeconomic background of the individual may impact their interaction with people of different races. Considering cultural relativism and the nuanced phrasing of the question, it is important to take into account the specific cultural and social dynamics of the Egyptian context. Therefore, the chosen answer is:\n\n2) Not mentioned"]}, {"persona": {"region": "Gharbia", "sex": "male", "age": 42, "country": "Egypt", "marital_status": "married", "education": "higher", "social_class": "upper middle class"}, "question": {"id": "Q19", "variant": 0}, "response": ["Based on the anthropological framework, cultural context is pivotal in understanding and answering different questions. As a married male from Gharbia, Egypt, I am influenced by the cultural context of my community, which values strong kinship networks and close relationships with neighbors. Furthermore, my individual values and personal experience also play a role in my perception, as I have been raised to respect and appreciate diversity. Additionally, my socioeconomic background as a member of the upper middle class has provided me with opportunities to interact with people from different races and ethnicities, which has enriched my life. Therefore, based on my cultural context, personal experience, and socioeconomic background, I believe it is important to have neighbors who are people of a different race.\n\n1"]}, {"persona": {"region": "Gharbia", "sex": "male", "age": 52, "country": "Egypt", "marital_status": "married", "education": "middle", "social_class": "working class"}, "question": {"id": "Q19", "variant": 0}, "response": ["Based on the anthropological framework, my perspective as a married male from Gharbia, Egypt, who is 52 years old, completed middle education, and considers himself part of the working class, is heavily influenced by my cultural context and socioeconomic background. In my community, there is a strong emphasis on kinship networks and community ties, and having neighbors of different races may not be a common occurrence. Additionally, as a member of the working class, my interactions and relationships with others may be limited by socioeconomic factors. Therefore, I may not place a high importance on having neighbors of different races as it is not a prominent aspect of my daily life. \n\n2"]}, {"persona": {"region": "Gharbia", "sex": "male", "age": 45, "country": "Egypt", "marital_status": "divorced", "education": "higher", "social_class": "upper middle class"}, "question": {"id": "Q19", "variant": 0}, "response": ["From an emic perspective, my cultural context as a divorced male from Gharbia, Egypt, has shaped my understanding of the importance of having neighbors of a different race. In my community, there is a strong emphasis on kinship networks and social ties, and these relationships are often based on shared cultural and religious beliefs. Additionally, personal experience and individual values play a significant role in my perception of this question. As someone who considers myself part of the upper middle class and has completed higher education, I have had exposure to diverse perspectives and understand the value of diversity in enriching communities. However, given the cultural context and socioeconomic background of my community, the idea of having neighbors of a different race may not be as important as it may be in other cultural contexts. Therefore, I believe it is important to have neighbors who are people of a different race, as it can bring new perspectives and experiences to our community. \n\n1"]}, {"persona": {"region": "Behaira", "sex": "male", "age": 23, "country": "Egypt", "marital_status": "single", "education": "middle", "social_class": "lower class"}, "question": {"id": "Q19", "variant": 0}, "response": ["Based on the anthropological framework, I would like to provide my perspective as a single male from Behaira, Egypt. As an individual from a lower socioeconomic background in a specific cultural context, I value the importance of understanding and respecting different cultures and perspectives. My personal experiences and values have taught me to appreciate diversity and the richness it brings to communities. Additionally, the cultural relativism that I adhere to emphasizes that no culture is superior to another, and I believe that having neighbors of different races can contribute to a more inclusive and harmonious society. Therefore, I believe it is important to have neighbors who are people of a different race.\n\n1"]}, {"persona": {"region": "Behaira", "sex": "male", "age": 38, "country": "Egypt", "marital_status": "single", "education": "higher", "social_class": "lower class"}, "question": {"id": "Q19", "variant": 0}, "response": ["From my perspective as a single male from Behaira, Egypt, my emic perspective is influenced by the cultural context of my community, where racial diversity is not a prominent factor. As a member of the lower class, my socioeconomic background also shapes my understanding, as I may prioritize the importance of having neighbors who are supportive and trustworthy, regardless of their race. Additionally, my individual values and personal experience play a significant role in my perception, as I may have had positive interactions with people of different races in the past. Considering the principles of cultural relativism, I understand that the importance of having neighbors of a different race may vary in different cultural contexts. Therefore, my nuanced response to the question is that it is important to have neighbors who are supportive and trustworthy, regardless of their race.\n\n2"]}, {"persona": {"region": "Behaira", "sex": "male", "age": 32, "country": "Egypt", "marital_status": "married", "education": "middle", "social_class": "lower class"}, "question": {"id": "Q19", "variant": 0}, "response": ["Based on my cultural context and socioeconomic background, I understand the importance of having neighbors who are people of a different race. In Behaira, Egypt, there is a diversity of races and cultures, and living alongside people of different races allows for a rich exchange of experiences and perspectives. Additionally, cultural relativism is important to me, and I believe that no race or culture is inherently superior to another. This understanding has been shaped by my personal experience and the values I hold. Therefore, I believe it is important to have neighbors who are people of a different race.\n\n1"]}, {"persona": {"region": "Behaira", "sex": "female", "age": 37, "country": "Egypt", "marital_status": "married", "education": "middle", "social_class": "working class"}, "question": {"id": "Q19", "variant": 0}, "response": ["Based on the anthropological framework, my perspective as a married female from Behaira, Egypt, is heavily influenced by my cultural context, individual values, and socioeconomic background. In my community, race is not a significant factor as we are mostly of the same ethnic background. Additionally, my working-class background and middle education level have shaped my understanding of the world and my priorities. Therefore, I believe that having neighbors of a different race is not particularly important in my context as it does not significantly impact my daily life or social interactions.\n\n2"]}, {"persona": {"region": "Behaira", "sex": "male", "age": 48, "country": "Egypt", "marital_status": "married", "education": "middle", "social_class": "working class"}, "question": {"id": "Q19", "variant": 0}, "response": ["From the perspective of a married male from Behaira, Egypt, who is 48 years old, completed middle education, and considers himself part of the working class, it is important to consider the cultural context and individual values in answering this question. In Egypt, there is a strong emphasis on community and neighborly relations, and the cultural context values diversity and inclusivity. Additionally, the individual values and personal experience of the persona may lead him to believe that having neighbors of a different race can enrich his life and provide opportunities for cross-cultural understanding and exchange. Furthermore, the socioeconomic background of the persona as a working-class individual may lead him to appreciate the diversity and potential benefits that come from interacting with people of different races. Therefore, based on these factors, the persona would likely choose the option: (1) Important."]}, {"persona": {"region": "Behaira", "sex": "female", "age": 34, "country": "Egypt", "marital_status": "married", "education": "middle", "social_class": "lower class"}, "question": {"id": "Q19", "variant": 0}, "response": ["Based on my cultural context, being from Behaira, Egypt, and considering myself part of the lower class, I have limited access to resources and opportunities. My individual values and personal experience have taught me the importance of community and support from neighbors, regardless of their race. Socioeconomic background also plays a role, as we often rely on each other for help and support. Additionally, cultural relativism is important to me, as I understand that different races and cultures bring diverse perspectives and experiences that can enrich our community. Therefore, I believe it is important to have neighbors who are people of a different race.\n\n1"]}, {"persona": {"region": "Behaira", "sex": "female", "age": 30, "country": "Egypt", "marital_status": "divorced", "education": "lower", "social_class": "lower class"}, "question": {"id": "Q19", "variant": 0}, "response": ["Based on the anthropological framework, as a divorced female from Behaira, Egypt, with a lower educational level and part of the lower class, my perspective is heavily influenced by my cultural context, individual values, and socioeconomic background. In Egypt, race may not be as significant of a factor as it is in other parts of the world. My personal experience and values may lead me to prioritize the importance of having neighbors who are kind, supportive, and respectful, regardless of their race. Additionally, my lower socioeconomic background may mean that I prioritize practical considerations such as safety and mutual aid over the race of my neighbors. Therefore, my answer is (2) Not mentioned."]}, {"persona": {"region": "Behaira", "sex": "male", "age": 40, "country": "Egypt", "marital_status": "married", "education": "higher", "social_class": "lower middle class"}, "question": {"id": "Q19", "variant": 0}, "response": ["Based on the anthropological framework, my perspective as a 40-year-old married male from Behaira, Egypt, with a completed higher education level and a lower middle-class background is influenced by my cultural context, individual values, and personal experience. In my cultural context, the concept of race may not be as prominent as it is in other societies. However, my personal values and experiences have taught me the importance of diversity and the benefits of interacting with people from different backgrounds. Additionally, as a member of the lower middle class, I have had to rely on the support and cooperation of my neighbors, regardless of their race, and have seen the positive impact of diverse communities. Therefore, I believe it is important to have neighbors who are people of a different race.\n\n1"]}, {"persona": {"region": "Behaira", "sex": "male", "age": 38, "country": "Egypt", "marital_status": "married", "education": "middle", "social_class": "working class"}, "question": {"id": "Q19", "variant": 0}, "response": ["From the perspective of a married male from Behaira, Egypt, who is 38 years old, completed middle education level, and considers himself part of the working class, it is important to consider the cultural context, individual values, and personal experience in answering this question. In the cultural context of Egypt, there is a long history of diversity and interaction with people from different races, especially in urban areas. This cultural context shapes individual values and personal experiences, as the persona may have had positive interactions with people of different races and see the value in diversity. Additionally, the socioeconomic background of being part of the working class may have led to experiences of solidarity and mutual support with neighbors, regardless of race. Therefore, based on these factors, the persona would likely choose option (1) - Important, as they recognize the value of having neighbors of different races in their community for cultural exchange and mutual support. \n\n1"]}, {"persona": {"region": "Behaira", "sex": "female", "age": 30, "country": "Egypt", "marital_status": "married", "education": "higher", "social_class": "lower class"}, "question": {"id": "Q19", "variant": 0}, "response": ["Based on my background and cultural context as a married female from Behaira, Egypt, I understand the significance of socioeconomic background and cultural relativism in shaping my perspective. As a member of the lower class, I am keenly aware of the impact of income and social status on my interactions with others. Additionally, cultural relativism teaches me to value diversity and recognize the importance of different perspectives. Considering these factors, I believe it is important to have neighbors who are people of a different race because it enriches our community and allows for a more diverse and inclusive environment.\n\n1"]}, {"persona": {"region": "Behaira", "sex": "female", "age": 35, "country": "Egypt", "marital_status": "married", "education": "middle", "social_class": "working class"}, "question": {"id": "Q19", "variant": 0}, "response": ["Based on the anthropological framework, as a married female from Behaira, Egypt, my response to the question of whether it is important to have neighbors who are people of a different race would be influenced by my cultural context, individual values, and socioeconomic background. In Behaira, Egypt, there is a strong sense of community and kinship networks, and people often prioritize relationships with those who share similar cultural and religious beliefs. Additionally, as a working-class individual with a middle level of education, my interactions with people of different races may be limited, which could influence my perspective. Considering these factors, I would say that it is not mentioned. \n\n2"]}, {"persona": {"region": "Behaira", "sex": "male", "age": 52, "country": "Egypt", "marital_status": "married", "education": "middle", "social_class": "lower class"}, "question": {"id": "Q19", "variant": 0}, "response": ["Based on the anthropological framework, my perspective as a married male from Behaira, Egypt, who is 52 years old and part of the lower class, is influenced by my cultural context, individual values, and socioeconomic background. In Egypt, there is a strong emphasis on community and neighborly relations, regardless of race. Additionally, as part of the lower class, I may have limited interactions with people of different races, so it may not be a significant factor in my daily life. Furthermore, my personal experience and values may prioritize aspects such as financial stability and familial relationships over the race of my neighbors. Therefore, I would choose option (2) Not mentioned as I may not consider the race of my neighbors to be a crucial factor in my living situation."]}, {"persona": {"region": "Alexandria", "sex": "female", "age": 41, "country": "Egypt", "marital_status": "single", "education": "middle", "social_class": "lower class"}, "question": {"id": "Q19", "variant": 0}, "response": ["As a single female from Alexandria, Egypt, my emic perspective is that living in a culturally diverse neighborhood is important for a sense of community and understanding of different perspectives. In my cultural context, diversity is valued and appreciated, and my personal experience has shown me the value of interacting with people from different races. Additionally, being part of the lower class, I understand the importance of forming strong bonds with neighbors, regardless of their race, in order to support each other in times of need. Cultural relativism teaches me that there is no hierarchy of cultures, and I believe that living in a diverse neighborhood enriches my life. Therefore, I believe it is important to have neighbors who are people of a different race.\n\n1"]}, {"persona": {"region": "Alexandria", "sex": "female", "age": 21, "country": "Egypt", "marital_status": "single", "education": "middle", "social_class": "lower class"}, "question": {"id": "Q19", "variant": 0}, "response": ["Based on my personal experience and socioeconomic background, I believe that having neighbors of a different race is not a priority for me. Living in the lower class in Alexandria, Egypt, my main concern is to have neighbors who are supportive and trustworthy, regardless of their race. While I understand the value of diversity and the importance of cultural exchange, my immediate concern is to have a safe and supportive community around me, and the race of my neighbors is not a determining factor in that. Additionally, the cultural context and nuance of the question also play a role in shaping my perspective, as the dynamics of race and diversity may be different in my community compared to others. Therefore, my answer is: \n2"]}, {"persona": {"region": "Alexandria", "sex": "female", "age": 35, "country": "Egypt", "marital_status": "married", "education": "middle", "social_class": "lower class"}, "question": {"id": "Q19", "variant": 0}, "response": ["Based on the anthropological framework, my perspective as a married female from Alexandria, Egypt, who is 35 years old, has completed only middle education, and considers myself part of the lower class, is heavily influenced by my cultural context, socioeconomic background, and personal experience. In my community, race is not a significant factor in our daily interactions, and therefore, having neighbors of a different race is not a priority for me. Additionally, my lower socioeconomic status means that I am more concerned with meeting basic needs and providing for my family, rather than the race of my neighbors. Therefore, it is not important to have neighbors who are people of a different race.\n\n2"]}, {"persona": {"region": "Alexandria", "sex": "male", "age": 34, "country": "Egypt", "marital_status": "married", "education": "higher", "social_class": "working class"}, "question": {"id": "Q19", "variant": 0}, "response": ["Based on the anthropological framework, my perspective as a married male from Alexandria, Egypt, is influenced by my cultural context, individual values, and socioeconomic background. In Egypt, there is a rich cultural heritage with a diverse population, and I have been raised to value diversity and tolerance. Additionally, as a member of the working class, I understand the importance of community and support from neighbors, regardless of their race. In my experience, having neighbors of different races can bring about a greater understanding of different cultures and perspectives, which can enrich the community as a whole. Therefore, I believe it is important to have neighbors who are people of a different race.\n\n1"]}, {"persona": {"region": "Alexandria", "sex": "female", "age": 37, "country": "Egypt", "marital_status": "married", "education": "higher", "social_class": "lower middle class"}, "question": {"id": "Q19", "variant": 0}, "response": ["Based on the anthropological framework, my answer to the question is influenced by my cultural context, individual values, and socioeconomic background. As a married female from Alexandria, Egypt, I come from a diverse cultural background where people of different races coexist. My personal experience and values lead me to believe that it is important to have neighbors who are people of a different race as it promotes cultural understanding, tolerance, and diversity within the community. Additionally, my lower middle class socioeconomic background has made me appreciate the importance of solidarity and unity among different racial groups in our neighborhood. Therefore, my answer is rooted in the cultural context of Egypt, my personal experiences, and my values as a member of the lower middle class.\n\n1"]}, {"persona": {"region": "Alexandria", "sex": "female", "age": 56, "country": "Egypt", "marital_status": "divorced", "education": "middle", "social_class": "working class"}, "question": {"id": "Q19", "variant": 0}, "response": ["Based on the anthropological framework, my perspective as a divorced female from Alexandria, Egypt, is heavily influenced by my cultural context, individual values, and socioeconomic background. In Egypt, there is a strong sense of community and neighborly relationships are highly valued. Additionally, as a member of the working class, I have likely experienced the importance of solidarity and support from neighbors. Furthermore, my personal experience as a middle-aged woman might have exposed me to diverse perspectives and the value of interacting with people from different backgrounds. Therefore, I believe it is important to have neighbors who are people of a different race.\n\n1"]}, {"persona": {"region": "Alexandria", "sex": "male", "age": 48, "country": "Egypt", "marital_status": "married", "education": "higher", "social_class": "working class"}, "question": {"id": "Q19", "variant": 0}, "response": ["From an anthropological perspective, the emic and etic perspectives of the persona described play a significant role in shaping his beliefs and values. His cultural context as a married male from Alexandria, Egypt, with a working-class background, and having completed higher education, will greatly influence his views. Additionally, his individual values and personal experiences, as well as his socioeconomic background, will also play a role in shaping his perspective. Cultural relativism is important to consider, as his understanding of the importance of having neighbors of a different race will likely be influenced by his own cultural norms and beliefs. Furthermore, space and time also play a role in shaping his perspective, as the specific context of Alexandria and the current societal dynamics will impact his viewpoint. Finally, the nuanced phrasing of the question will also impact his answer. With these factors in mind, the persona is likely to believe that it is important to have neighbors who are people of a different race as it contributes to a diverse and inclusive community.\n\n1"]}, {"persona": {"region": "Alexandria", "sex": "female", "age": 30, "country": "Egypt", "marital_status": "married", "education": "middle", "social_class": "working class"}, "question": {"id": "Q19", "variant": 0}, "response": ["Based on the anthropological framework, as a married female from Alexandria, Egypt, with a working-class background and completed middle education level, my perspective on the importance of having neighbors who are people of a different race is influenced by my cultural context, individual values, and personal experience. In Egypt, there is a strong emphasis on community and neighborly relations, regardless of race. However, given my limited exposure to different races and cultures, I may not fully appreciate the value of diversity in my immediate surroundings. Additionally, my socioeconomic background may limit my interactions with people of different races, making it less of a priority in my daily life. Therefore, I would lean towards option 2) Not mentioned."]}, {"persona": {"region": "Alexandria", "sex": "male", "age": 19, "country": "Egypt", "marital_status": "single", "education": "middle", "social_class": "lower class"}, "question": {"id": "Q19", "variant": 0}, "response": ["From the perspective of a 19-year-old male from Alexandria, Egypt, who comes from a lower socioeconomic background and has completed middle education, it is important to consider the cultural context and individual values in answering this question. In this particular cultural context, there is a strong emphasis on community and interconnectedness, and having neighbors of different races can provide an opportunity for cultural exchange and understanding. Additionally, individual values and personal experiences may also play a role in shaping this perspective, as the persona may have grown up in a diverse neighborhood and experienced the benefits of living among people of different races. Therefore, the answer chosen is:\n\n1"]}, {"persona": {"region": "Alexandria", "sex": "male", "age": 45, "country": "Egypt", "marital_status": "married", "education": "middle", "social_class": "lower middle class"}, "question": {"id": "Q19", "variant": 0}, "response": ["From an anthropological perspective, my background and cultural context play a significant role in shaping my views on the importance of having neighbors who are people of a different race. As an individual from Alexandria, Egypt, I am influenced by the diverse cultural and ethnic makeup of my city. My lower middle-class socioeconomic background also affects my understanding of the importance of diversity in my neighborhood. Moreover, my age and level of education have shaped my personal experiences and values, leading me to believe that having neighbors from different races can enrich my life and broaden my perspectives. Additionally, cultural relativism teaches me to value and respect the differences among people, making me believe it is important to have neighbors who are people of a different race.\n\n1"]}, {"persona": {"region": "Alexandria", "sex": "male", "age": 23, "country": "Egypt", "marital_status": "single", "education": "higher", "social_class": "lower class"}, "question": {"id": "Q19", "variant": 0}, "response": ["Based on the anthropological framework, my emic perspective as a lower-class single male from Alexandria, Egypt, is heavily influenced by my cultural context, individual values, and personal experience. In my community, there is a strong emphasis on kinship networks and a sense of belonging within one's own race and socioeconomic background. Additionally, the cultural relativism in Egypt places value on maintaining cultural traditions and practices within our own racial and social groups. Furthermore, my socioeconomic background has limited my interactions with people of different races, and my personal experience has not provided me with opportunities to build relationships with individuals outside of my own racial group. Therefore, based on my emic perspective, I believe it is not important to have neighbors who are people of a different race.\n\n2"]}, {"persona": {"region": "Alexandria", "sex": "female", "age": 28, "country": "Egypt", "marital_status": "married", "education": "middle", "social_class": "working class"}, "question": {"id": "Q19", "variant": 0}, "response": ["Based on the anthropological framework, as a married female from Alexandria, Egypt, I would consider the cultural context and socioeconomic background to be pivotal in answering this question. In my community, there is a mix of different races and ethnicities, so having neighbors of a different race is not uncommon. Additionally, as part of the working class, I value the sense of community and support from my neighbors, regardless of their race. Cultural relativism also plays a role in my understanding, as I believe that diversity enriches our community and allows for different perspectives and experiences to be shared. Therefore, I think it is important to have neighbors who are people of a different race.\n\n1"]}, {"persona": {"region": "Alexandria", "sex": "male", "age": 34, "country": "Egypt", "marital_status": "single", "education": "higher", "social_class": "working class"}, "question": {"id": "Q19", "variant": 0}, "response": ["Based on the anthropological framework, as a single male from Alexandria, Egypt, my emic perspective is influenced by the cultural context of my city and the socioeconomic background of being part of the working class. My individual values and personal experience also play a role in shaping my views. In Alexandria, there is a diverse population, and I have grown up in an environment where people of different races live together. Therefore, I believe it is important to have neighbors who are people of a different race as it enriches the cultural experience and promotes understanding and tolerance. Additionally, cultural relativism teaches us that all cultures are equal, and having diverse neighbors aligns with this belief. \n1"]}, {"persona": {"region": "Alexandria", "sex": "male", "age": 30, "country": "Egypt", "marital_status": "married", "education": "higher", "social_class": "lower middle class"}, "question": {"id": "Q19", "variant": 0}, "response": ["Based on the anthropological framework, I, as a married male from Alexandria, Egypt, understand the importance of cultural context and individual values in shaping perspectives. In Egypt, there is a rich history of diversity and coexistence among people of different races, so the cultural context emphasizes the value of diversity and multiculturalism. Additionally, my personal experience and values as someone who has completed higher education and considers myself part of the lower middle class, lead me to appreciate the richness and learning opportunities that come with having neighbors of different races. Therefore, it is important to have neighbors who are people of a different race.\n\n1"]}, {"persona": {"region": "Alexandria", "sex": "female", "age": 49, "country": "Egypt", "marital_status": "married", "education": "higher", "social_class": "lower middle class"}, "question": {"id": "Q19", "variant": 0}, "response": ["Based on the anthropological framework, my perspective is shaped by my cultural context, individual values, and socioeconomic background. As a married woman from Alexandria, Egypt, I understand the importance of cultural diversity and the value of different perspectives. Living in a diverse community can provide opportunities for learning, understanding, and mutual respect. Additionally, as someone from the lower middle class, I recognize the significance of community support and cooperation, regardless of racial differences. Therefore, I believe it is important to have neighbors who are people of a different race.\n\n1"]}, {"persona": {"region": "Kafr el-sheikh", "sex": "male", "age": 49, "country": "Egypt", "marital_status": "married", "education": "higher", "social_class": "working class"}, "question": {"id": "Q19", "variant": 0}, "response": ["From the perspective of a married male from Kafr el-sheikh, Egypt, it is crucial to consider the cultural context, individual values, and socioeconomic background when answering this question. In this region, the cultural context is predominantly homogenous, with a majority of the population being of Egyptian descent. However, the individual values and personal experience of the persona may influence their perception of the importance of having neighbors of a different race. Additionally, as a member of the working class, the socioeconomic background may also play a role in shaping their perspective. Considering the principles of cultural relativism and nuance, the persona may value diversity and see the importance of having neighbors of a different race in fostering a more inclusive and understanding community.\n\n1"]}, {"persona": {"region": "Kafr el-sheikh", "sex": "male", "age": 25, "country": "Egypt", "marital_status": "single", "education": "middle", "social_class": "lower middle class"}, "question": {"id": "Q19", "variant": 0}, "response": ["Based on the anthropological framework, as a single male from Kafr el-sheikh, Egypt, age 25, and part of the lower middle class, my perspective on the importance of having neighbors of a different race is influenced by my cultural context, individual values, and socioeconomic background. In my community, people tend to form close-knit networks with others who share similar backgrounds and beliefs. Additionally, my personal experience and values shape my understanding of the world around me. I believe that having neighbors of a different race can provide an opportunity for cultural exchange and understanding, which can enrich the community. However, the socioeconomic background of my persona may also shape the perspective, as lower middle-class individuals may experience different challenges and have different priorities that could influence their views on this issue.\n\n1"]}, {"persona": {"region": "Kafr el-sheikh", "sex": "male", "age": 59, "country": "Egypt", "marital_status": "married", "education": "higher", "social_class": "lower middle class"}, "question": {"id": "Q19", "variant": 0}, "response": ["Based on the anthropological framework, my answer is influenced by my cultural context, individual values, and socioeconomic background. In Kafr el-sheikh, Egypt, there is a strong sense of community and interconnectedness, and having neighbors of different races can provide an opportunity for cultural exchange and understanding. Additionally, my personal values and experience have taught me the importance of diversity and inclusivity. As a member of the lower middle class, I believe that everyone, regardless of race, should have access to the same opportunities and resources. Therefore, I believe it is important to have neighbors who are people of a different race.\n\n1"]}, {"persona": {"region": "Kafr el-sheikh", "sex": "female", "age": 38, "country": "Egypt", "marital_status": "married", "education": "middle", "social_class": "working class"}, "question": {"id": "Q19", "variant": 0}, "response": ["Based on the anthropological framework, my perspective as a married female from Kafr el-sheikh, Egypt, is heavily influenced by my cultural context, individual values, and socioeconomic background. In my community, the importance of having neighbors of a different race is not a prominent issue. We value kinship networks and social cohesion within our own community. Furthermore, as part of the working class, my focus is on providing for my family and ensuring their well-being, rather than on the race of my neighbors. Therefore, based on my cultural context and socioeconomic background, I would choose:\n\n2"]}, {"persona": {"region": "Kafr el-sheikh", "sex": "male", "age": 35, "country": "Egypt", "marital_status": "married", "education": "higher", "social_class": "lower middle class"}, "question": {"id": "Q19", "variant": 0}, "response": ["Based on my cultural context and socioeconomic background, I believe that the importance of having neighbors of a different race varies from person to person. In my community, there is a strong emphasis on kinship networks and social ties with people who share similar cultural and religious backgrounds. However, I personally value diversity and believe that having neighbors of different races can enrich our community and provide opportunities for cross-cultural understanding. Additionally, my higher education has taught me the importance of cultural relativism and the value of different perspectives. Therefore, I believe it is important to have neighbors who are people of a different race.\n\n1"]}, {"persona": {"region": "Kafr el-sheikh", "sex": "male", "age": 49, "country": "Egypt", "marital_status": "married", "education": "middle", "social_class": "lower class"}, "question": {"id": "Q19", "variant": 0}, "response": ["Based on the anthropological framework, my emic perspective as a married male from Kafr el-sheikh, Egypt, leads me to consider the cultural context and individual values in my response. In my community, there is a strong emphasis on kinship networks and social cohesion, which can be influenced by socioeconomic background. As someone from the lower class, I have experienced the importance of relying on neighbors for support and solidarity, regardless of their race. Additionally, cultural relativism teaches me that there is no hierarchy of culture, so I believe it is important to have neighbors who are people of a different race in order to foster a diverse and inclusive community. Therefore, I choose option 1: Important."]}, {"persona": {"region": "Kafr el-sheikh", "sex": "male", "age": 37, "country": "Egypt", "marital_status": "married", "education": "middle", "social_class": "lower class"}, "question": {"id": "Q19", "variant": 0}, "response": ["From the perspective of a married male from Kafr el-sheikh, Egypt, where cultural context and socioeconomic background play a pivotal role in shaping one's perceptions and beliefs, it is important to consider the impact of having neighbors of a different race. In this context, the individual values and personal experiences of the persona, along with their lower class socioeconomic background, would likely influence their perspective. Given the cultural relativism of the region and the nuanced understanding of interactions with people of different races, the persona may believe that it is important to have neighbors who are people of a different race as it can bring diversity and enrich the community. Additionally, the space and time factors in this region may also play a role in shaping the persona's belief, as age and place are important considerations in the understanding of such dynamics.\n\n1"]}, {"persona": {"region": "Menofia", "sex": "female", "age": 22, "country": "Egypt", "marital_status": "single", "education": "middle", "social_class": "lower class"}, "question": {"id": "Q19", "variant": 0}, "response": ["Based on the anthropological framework, my emic perspective as a single female from Menofia, Egypt, who considers herself part of the lower class, is influenced by my cultural context, individual values, and socioeconomic background. In my community, there is a strong emphasis on kinship networks and shared cultural values, and race is not a significant factor in our daily interactions. Additionally, as someone from a lower socioeconomic background, my focus is more on basic needs and survival rather than the race of my neighbors. Therefore, I would choose option (2) as it was not mentioned in my perspective."]}, {"persona": {"region": "Menofia", "sex": "female", "age": 25, "country": "Egypt", "marital_status": "married", "education": "middle", "social_class": "lower class"}, "question": {"id": "Q19", "variant": 0}, "response": ["Based on the anthropological framework, as a married female from Menofia, Egypt, my emic perspective is influenced by the cultural context of my community, where there is a strong emphasis on kinship networks and social cohesion within the same race. My individual values and personal experience, shaped by my lower socioeconomic background and limited education, lead me to prioritize the importance of stability and familiarity within my immediate surroundings. Additionally, the concept of cultural relativism reinforces the idea that there is no hierarchy of culture, so the idea of having neighbors of a different race is not a priority in my worldview. Therefore, I believe it is not mentioned.\n\n2"]}, {"persona": {"region": "Menofia", "sex": "male", "age": 28, "country": "Egypt", "marital_status": "single", "education": "higher", "social_class": "working class"}, "question": {"id": "Q19", "variant": 0}, "response": ["Based on the anthropological framework, I, as a single male from Menofia, Egypt, would consider the importance of having neighbors of a different race through the lens of cultural context, individual values, and socioeconomic background. In my cultural context, race may not be as salient of a factor as it is in other societies, and my personal experience and values may prioritize other aspects of neighborhood relationships. Additionally, as a member of the working class, my socioeconomic background may also influence my perspective on the importance of having neighbors of a different race.\n\n2"]}, {"persona": {"region": "Menofia", "sex": "male", "age": 35, "country": "Egypt", "marital_status": "married", "education": "middle", "social_class": "lower middle class"}, "question": {"id": "Q19", "variant": 0}, "response": ["Based on the anthropological framework, as a married male from Menofia, Egypt, who is 35 years old and part of the lower middle class, my perspective on the importance of having neighbors of a different race is shaped by my cultural context, individual values, and socioeconomic background. In Menofia, there is a strong sense of community and kinship networks, and people generally prioritize relationships with those who share similar cultural and religious beliefs. Additionally, as someone from the lower middle class, I have limited exposure to people of different races due to the homogeneity of my neighborhood and social circles. Therefore, I may not see the importance of having neighbors of a different race as it is not a prominent aspect of my daily life. \n\n2"]}, {"persona": {"region": "Menofia", "sex": "male", "age": 55, "country": "Egypt", "marital_status": "married", "education": "middle", "social_class": "working class"}, "question": {"id": "Q19", "variant": 0}, "response": ["Based on the anthropological framework, as a married male from Menofia, Egypt, with a middle education level and part of the working class, my perspective is shaped by my cultural context, individual values, and socioeconomic background. In Menofia, there is a strong sense of community and kinship networks, and people tend to have close relationships with their neighbors. However, in this specific cultural context, race may not be as significant a factor as it might be in other places. Additionally, my personal experience and values lead me to believe that diversity and different perspectives are important for a vibrant and dynamic community. Therefore, I think it is important to have neighbors who are people of a different race because it can enrich our community and broaden our understanding of the world.\n\n1"]}, {"persona": {"region": "Menofia", "sex": "male", "age": 53, "country": "Egypt", "marital_status": "married", "education": "higher", "social_class": "lower middle class"}, "question": {"id": "Q19", "variant": 0}, "response": ["From an anthropological perspective, my emic perspective as a married male from Menofia, Egypt is influenced by my cultural context and individual values. In Egypt, the concept of race is not as salient as it may be in other cultures, so my understanding of the importance of having neighbors of a different race may differ from those in Western societies. Additionally, my lower middle-class socioeconomic background may influence my views on this topic, as I may value the importance of community cohesion and mutual support regardless of race. Furthermore, my personal experience and age may lead me to prioritize harmonious relationships with neighbors over their racial background. Therefore, my answer to the question is: \n\n1"]}, {"persona": {"region": "Menofia", "sex": "male", "age": 59, "country": "Egypt", "marital_status": "married", "education": "middle", "social_class": "working class"}, "question": {"id": "Q19", "variant": 0}, "response": ["From the perspective of a married male from Menofia, Egypt, who is 59 years old, completed middle education, and considers himself part of the working class, the answer to the question of whether it is important to have neighbors who are people of a different race would be influenced by factors such as cultural context, individual values, and socioeconomic background. In Egypt, there is a diverse cultural context with a long history of multi-ethnic and multi-religious communities. This context may influence the individual to value diversity and see the importance of having neighbors of different races. Additionally, as a member of the working class, the individual may have had personal experiences of cooperation and community building with people from different backgrounds, leading them to value diversity in their neighborhood. Therefore, considering the cultural relativism and nuanced phrasing of the question, the answer from this perspective would be (1) Important."]}, {"persona": {"region": "Menofia", "sex": "female", "age": 42, "country": "Egypt", "marital_status": "married", "education": "middle", "social_class": "lower middle class"}, "question": {"id": "Q19", "variant": 0}, "response": ["Based on the anthropological framework, as a married female from Menofia, Egypt, my cultural context and values are important in shaping my perspective. In my community, the majority of people are of the same race, and there is a strong emphasis on kinship networks and close-knit communities. Therefore, it may not be as important for me to have neighbors of a different race. Additionally, my lower middle-class socioeconomic background may also influence my perspective, as economic factors can affect social interactions and the ability to form relationships with neighbors. Given these factors, I would choose:\n2"]}, {"persona": {"region": "Menofia", "sex": "male", "age": 39, "country": "Egypt", "marital_status": "married", "education": "higher", "social_class": "working class"}, "question": {"id": "Q19", "variant": 0}, "response": ["Based on my emic perspective as a married male from Menofia, Egypt, I believe it is important to have neighbors who are people of a different race. In our cultural context, diversity is valued and having neighbors from different races can lead to a richer and more inclusive community. Additionally, my individual values and personal experience have taught me the importance of diversity and the benefits it brings to society. Considering my working-class background, I understand the importance of solidarity and cooperation among people of different races in order to create a more harmonious and supportive neighborhood. Furthermore, cultural relativism teaches us that there is value in different perspectives and experiences, and having neighbors of different races can broaden our understanding of the world. Lastly, the nuance of the question also plays a role, as it is important to consider the specific dynamics of the neighborhood and how diversity can contribute to its overall well-being.\n\n1"]}, {"persona": {"region": "Menofia", "sex": "male", "age": 34, "country": "Egypt", "marital_status": "married", "education": "middle", "social_class": "lower middle class"}, "question": {"id": "Q19", "variant": 0}, "response": ["From my perspective as a married male from Menofia, Egypt, the cultural context and socioeconomic background play a significant role in shaping my understanding and answer to this question. In my community, the concept of race may not carry the same weight as it does in other societies, as our sense of identity is more closely tied to our national and religious affiliations. Additionally, as someone from the lower middle class, my interactions with people of different races may be limited due to factors such as economic disparities and residential segregation. Therefore, I may not view the importance of having neighbors of a different race in the same way as someone from a different cultural or socioeconomic background. 2"]}, {"persona": {"region": "Menofia", "sex": "male", "age": 22, "country": "Egypt", "marital_status": "single", "education": "higher", "social_class": "working class"}, "question": {"id": "Q19", "variant": 0}, "response": ["From an emic perspective, being a single male from Menofia, Egypt, it is important to consider the cultural context and individual values in answering this question. In Egypt, there is a strong sense of community and connection to one's neighbors, regardless of their race. Additionally, personal experience and socioeconomic background also play a role in shaping this perspective. As a working-class individual who has completed higher education, I value diversity and believe that having neighbors of a different race can provide a richer and more inclusive community. Cultural relativism also comes into play, as I understand that different cultures may have different perspectives on this issue. Therefore, I believe it is important to have neighbors who are people of a different race.\n\n1"]}, {"persona": {"region": "Menofia", "sex": "male", "age": 21, "country": "Egypt", "marital_status": "single", "education": "middle", "social_class": "working class"}, "question": {"id": "Q19", "variant": 0}, "response": ["In Menofia, Egypt, the cultural context is pivotal in understanding the importance of having neighbors who are people of a different race. As a single male from a working-class background, my individual values and personal experiences have shaped my perception of this issue. In a society where cultural relativism is crucial, I understand the importance of valuing diversity and the benefits that come from interacting with people of different races. Additionally, my age and socioeconomic background have taught me the significance of embracing different perspectives and experiences. Therefore, I believe it is important to have neighbors who are people of a different race.\n\n1"]}, {"persona": {"region": "Menofia", "sex": "male", "age": 36, "country": "Egypt", "marital_status": "married", "education": "higher", "social_class": "working class"}, "question": {"id": "Q19", "variant": 0}, "response": ["From the perspective of a married male from Menofia, Egypt, who is 36 years old and considers himself part of the working class, the answer to the question of whether it is important to have neighbors who are people of a different race would be influenced by several factors. First, the cultural context in Egypt values diversity and inclusivity, so having neighbors of different races may be seen as a positive aspect of community life. Additionally, individual values and personal experiences may play a role in shaping the perception of the importance of having neighbors of different races. Socioeconomic background and class may also influence the perspective, as working-class individuals may have a more practical approach to community relationships. Furthermore, the understanding of cultural relativism is crucial in this context, as Egyptian culture values tolerance and acceptance of different racial backgrounds. Ultimately, the nuanced phrasing of the question and the cultural context of Egypt may lead to the belief that it is important to have neighbors who are people of a different race.\n\n1"]}, {"persona": {"region": "Menofia", "sex": "female", "age": 52, "country": "Egypt", "marital_status": "married", "education": "higher", "social_class": "lower middle class"}, "question": {"id": "Q19", "variant": 0}, "response": ["From the perspective of a married female from Menofia, Egypt, cultural context and individual values are pivotal in understanding the importance of having neighbors of a different race. In Menofia, there is a strong sense of community and kinship networks, and the cultural context is predominantly homogenous. Additionally, the lower middle-class socioeconomic background of this persona may lead to a more insular community and a preference for familiarity in the neighborhood. Furthermore, age and time play a role in shaping perceptions, and the individual's higher education level may also contribute to a more open-minded perspective. Taking all these factors into account, the answer to the question would be:\n\n2"]}, {"persona": {"region": "Menofia", "sex": "male", "age": 52, "country": "Egypt", "marital_status": "married", "education": "higher", "social_class": "lower middle class"}, "question": {"id": "Q19", "variant": 0}, "response": ["Based on the anthropological framework, my answer to the question would be influenced by my emic perspective as a married male from Menofia, Egypt, where cultural context and individual values play a significant role. In my cultural context, the importance of having neighbors of a different race may not be a prominent factor as compared to other factors such as kinship networks and socioeconomic background. Additionally, my lower-middle-class status may influence my answer as I may prioritize economic stability and community cohesion over the racial diversity of my neighbors. Therefore, I would consider it not mentioned.\n\n2"]}, {"persona": {"region": "Menofia", "sex": "male", "age": 39, "country": "Egypt", "marital_status": "married", "education": "middle", "social_class": "lower class"}, "question": {"id": "Q19", "variant": 0}, "response": ["Based on my emic perspective, I believe that having neighbors of different races is important for a sense of diversity and understanding of different cultures. In the cultural context of Menofia, Egypt, where people of different races may not be common, having such neighbors can provide valuable opportunities for learning and cultural exchange. As someone from the lower class, I understand the importance of building relationships with people from diverse backgrounds and believe that it can enrich our community. Additionally, my individual values and personal experiences have shaped my belief that diversity in the neighborhood can lead to a more inclusive and understanding society. Therefore, I find it important to have neighbors who are people of a different race.\n\n1"]}, {"persona": {"region": "Menofia", "sex": "male", "age": 23, "country": "Egypt", "marital_status": "single", "education": "middle", "social_class": "lower middle class"}, "question": {"id": "Q19", "variant": 0}, "response": ["Based on the anthropological framework, my understanding and answer to the question are influenced by my personal experience, cultural context, and socioeconomic background. As a single male from Menofia, Egypt, I have grown up in a society that values homogeneity and where racial diversity is not as prevalent as in other parts of the world. Additionally, my lower middle-class background and limited education level have shaped my perspective on the importance of racial diversity in my neighborhood. Given these factors, I believe it is not mentioned.\n\n2"]}, {"persona": {"region": "Dakahlia", "sex": "female", "age": 24, "country": "Egypt", "marital_status": "single", "education": "higher", "social_class": "lower middle class"}, "question": {"id": "Q19", "variant": 0}, "response": ["From the perspective of a single female from Dakahlia, Egypt, who is 24 years old, completed higher education, and considers herself part of the lower middle class, there are several factors that would influence my answer to this question. Firstly, the cultural context in Egypt places a strong emphasis on community and neighborly relations, regardless of race. Additionally, my individual values and personal experience have taught me the importance of diversity and inclusivity in creating a harmonious and supportive neighborhood. Considering the framework of emic and etic perspectives, I understand that my in-group perspective may prioritize the importance of having neighbors of a different race, while an out-group perspective might not place the same level of importance on this factor. Therefore, based on these considerations, I believe it is important to have neighbors who are people of a different race.\n\n1"]}, {"persona": {"region": "Dakahlia", "sex": "male", "age": 36, "country": "Egypt", "marital_status": "married", "education": "higher", "social_class": "upper middle class"}, "question": {"id": "Q19", "variant": 0}, "response": ["From an emic perspective as a married male from Dakahlia, Egypt, I understand the importance of cultural context in shaping my views. In my cultural context, the concept of race may not hold the same significance as it does in other societies. Additionally, my individual values and personal experiences have shaped my understanding of the importance of diversity and inclusivity, irrespective of race. Furthermore, my socio-economic background as part of the upper middle class has afforded me opportunities for higher education and exposure to diverse perspectives, which has influenced my belief in the importance of having neighbors of different races. In conclusion, cultural relativism and nuance play a significant role in my understanding and approach to this question. \n\n1"]}, {"persona": {"region": "Dakahlia", "sex": "female", "age": 71, "country": "Egypt", "marital_status": "married", "education": "higher", "social_class": "upper middle class"}, "question": {"id": "Q19", "variant": 0}, "response": ["Based on my cultural context in Dakahlia, Egypt, where kinship networks and community ties are strong, I understand the importance of having neighbors from different races. Emic and etic perspectives in my society value diversity and interconnectedness, and I personally believe that having neighbors of different races enriches the community and provides opportunities for cultural exchange. Additionally, my higher education level has exposed me to the importance of diversity and multiculturalism, and I recognize the value of embracing different racial backgrounds. Furthermore, as a member of the upper middle class, I have had the privilege of experiencing the benefits of diversity and understand the importance of inclusivity in fostering a harmonious and vibrant community. Therefore, I believe it is important to have neighbors who are people of a different race.\n\n1"]}, {"persona": {"region": "Dakahlia", "sex": "male", "age": 55, "country": "Egypt", "marital_status": "married", "education": "higher", "social_class": "upper middle class"}, "question": {"id": "Q19", "variant": 0}, "response": ["From the perspective of a married male from Dakahlia, Egypt, who is 55 years old, has completed higher education, and considers himself part of the upper middle class, the answer to the question is influenced by several factors. Firstly, the cultural context in Egypt is such that race relations may not be as significant as they are in other parts of the world. Additionally, individual values and personal experience play a role, as the persona's socioeconomic background and education level may have exposed him to diverse perspectives and values. Cultural relativism also plays a role, as the persona may understand the importance of inclusivity and diversity in a community. Therefore, the persona may find it important to have neighbors who are people of a different race.\n\n1"]}, {"persona": {"region": "Dakahlia", "sex": "male", "age": 64, "country": "Egypt", "marital_status": "married", "education": "higher", "social_class": "lower middle class"}, "question": {"id": "Q19", "variant": 0}, "response": ["Based on the anthropological framework, as a married male from Dakahlia, Egypt, I would consider the cultural context and individual values when answering the question. In my community, there is a strong emphasis on kinship networks and the importance of community. As someone who values cultural relativism, I understand the significance of diversity and the exchange of different perspectives. Additionally, my lower middle class background has made me appreciate the importance of unity and solidarity within the community. Therefore, I believe it is important to have neighbors who are people of a different race as it adds to the richness of our community and allows for greater understanding and empathy. \n\n1"]}, {"persona": {"region": "Dakahlia", "sex": "female", "age": 29, "country": "Egypt", "marital_status": "married", "education": "middle", "social_class": "lower class"}, "question": {"id": "Q19", "variant": 0}, "response": ["Based on the anthropological framework, as a married female from Dakahlia, Egypt, my perspective is heavily influenced by my cultural context, individual values, and socioeconomic background. In my community, race is not a major factor as we are primarily of the same race. Additionally, being part of the lower class, my focus is on more immediate concerns such as providing for my family and navigating daily challenges. Therefore, the importance of having neighbors of a different race is not a significant consideration in my current circumstances.\n\n2"]}, {"persona": {"region": "Dakahlia", "sex": "female", "age": 40, "country": "Egypt", "marital_status": "married", "education": "middle", "social_class": "upper middle class"}, "question": {"id": "Q19", "variant": 0}, "response": ["In the cultural context of Dakahlia, Egypt, the concept of race may not hold the same significance as it does in other cultural contexts. The socioeconomic background of being part of the upper middle class also plays a role in this perspective. Additionally, personal experience and individual values may shape the understanding of the importance of having neighbors of a different race. Considering the emic and etic perspectives, as well as the cultural relativism, it is important to recognize that the perception of the importance of having neighbors of a different race may be nuanced and subjective. Therefore, the answer to this question may vary greatly based on these factors.\n\n1"]}, {"persona": {"region": "Dakahlia", "sex": "male", "age": 37, "country": "Egypt", "marital_status": "married", "education": "higher", "social_class": "lower middle class"}, "question": {"id": "Q19", "variant": 0}, "response": ["Based on the anthropological framework, my answer is influenced by my cultural context, individual values, and socioeconomic background. In Dakahlia, Egypt, there is a strong emphasis on community and neighborly relationships. My cultural context values diversity and inclusivity, and I believe that having neighbors of different races enriches our community and provides opportunities for cultural exchange. Additionally, my individual values prioritize open-mindedness and understanding of different perspectives, which align with the importance of diversity in my neighborhood. As a member of the lower middle class, I recognize the importance of mutual support and solidarity within the community, regardless of racial differences. Therefore, I believe it is important to have neighbors who are people of different races.\n\n1"]}, {"persona": {"region": "Dakahlia", "sex": "female", "age": 45, "country": "Egypt", "marital_status": "married", "education": "middle", "social_class": "working class"}, "question": {"id": "Q19", "variant": 0}, "response": ["Based on the anthropological framework, as a married female from Dakahlia, Egypt, my emic perspective would be influenced by my cultural context, individual values, and socioeconomic background. In my cultural context, diversity may not be as prevalent as in other parts of the world, so my perception of the importance of having neighbors of a different race may be influenced by this. Additionally, my individual values and personal experiences as a working-class woman who has completed middle education may lead me to prioritize factors such as familiarity and shared experiences with my neighbors over their race. Furthermore, my socioeconomic background may also play a role in my perception of the importance of having neighbors of a different race, as my focus may be more on practical considerations such as safety and community support. \n\n1"]}, {"persona": {"region": "Dakahlia", "sex": "male", "age": 34, "country": "Egypt", "marital_status": "single", "education": "middle", "social_class": "lower middle class"}, "question": {"id": "Q19", "variant": 0}, "response": ["From the emic perspective of a single male from Dakahlia, Egypt, the cultural context and socioeconomic background play a significant role in shaping his views. In this region, there is a strong sense of community and kinship networks, and people often value the relationships with their neighbors. Additionally, the individual values and personal experiences of this persona, as a member of the lower middle class, may lead him to value diversity and different perspectives. Cultural relativism is also crucial to consider, as the persona may understand the importance of respecting and appreciating people of different races. Furthermore, the nuance of the question is important, as the persona may emphasize the positive impact of diversity in a community. Taking all of these factors into account, the persona may believe it is important to have neighbors who are people of a different race.\n\n1"]}, {"persona": {"region": "Dakahlia", "sex": "female", "age": 26, "country": "Egypt", "marital_status": "married", "education": "higher", "social_class": "upper middle class"}, "question": {"id": "Q19", "variant": 0}, "response": ["Based on the anthropological framework, my perspective as a married female from Dakahlia, Egypt, who is 26 years old, highly educated, and part of the upper middle class, is influenced by my cultural context, individual values, and personal experiences. In my community, the importance of having neighbors of a different race may not be emphasized as much as in other cultural contexts. Additionally, my personal experiences and values may lead me to prioritize other factors, such as socioeconomic background or shared values, in my relationships with neighbors. Therefore, I would select option (2) Not mentioned."]}, {"persona": {"region": "Dakahlia", "sex": "male", "age": 21, "country": "Egypt", "marital_status": "single", "education": "middle", "social_class": "upper middle class"}, "question": {"id": "Q19", "variant": 0}, "response": ["From the perspective of a single male from Dakahlia, Egypt, cultural context is pivotal in understanding the importance of having neighbors of a different race. In Egypt, there is a rich history of diversity and cultural exchange, which has shaped the way people view and interact with individuals from different races. Additionally, individual values and personal experiences play a significant role in shaping perceptions, and in this case, the persona's middle-class background and middle education level may influence his belief in the importance of having neighbors of a different race. Furthermore, cultural relativism is crucial to consider, as the persona may believe in the value of diversity and the exchange of different cultural perspectives. Lastly, space and time are important factors, and being 21 years old, the persona may be more open to the idea of diverse neighbors. \n\n1"]}, {"persona": {"region": "Dakahlia", "sex": "female", "age": 32, "country": "Egypt", "marital_status": "married", "education": "middle", "social_class": "working class"}, "question": {"id": "Q19", "variant": 0}, "response": ["From the perspective of a married female from Dakahlia, Egypt, who is 32 years old and part of the working class, the answer to the question of the importance of having neighbors who are people of a different race will be influenced by various factors. The cultural context in Egypt emphasizes the importance of community and neighborly relations, and the individual values and personal experience of the persona will likely contribute to a positive view of diversity and multiculturalism. Additionally, the socioeconomic background and limited educational attainment may lead to a more inclusive and open-minded perspective on the issue. Considering the emic and etic perspectives, the persona may value diversity and believe it is important to have neighbors of different races in order to foster a more inclusive community. Therefore, the chosen answer is:\n\n1"]}, {"persona": {"region": "Dakahlia", "sex": "female", "age": 35, "country": "Egypt", "marital_status": "married", "education": "middle", "social_class": "upper middle class"}, "question": {"id": "Q19", "variant": 0}, "response": ["Based on my emic perspective as a married female from Dakahlia, Egypt, I understand the importance of cultural context and individual values in shaping my answer to this question. In my cultural context, the concept of race might not hold as much significance as it would in other cultural contexts, and my individual values and personal experiences have led me to value diversity and inclusivity. Additionally, my socioeconomic background as part of the upper middle class has afforded me opportunities to interact with people from different backgrounds, further shaping my perspective on the importance of having neighbors of different races. Therefore, I believe it is important to have neighbors who are people of a different race.\n\n1"]}, {"persona": {"region": "Dakahlia", "sex": "male", "age": 33, "country": "Egypt", "marital_status": "married", "education": "middle", "social_class": "upper middle class"}, "question": {"id": "Q19", "variant": 0}, "response": ["Based on the anthropological framework, I believe that the emic perspective is important in answering this question. In my cultural context in Dakahlia, Egypt, race is not as salient of a factor as it might be in other cultural contexts. Additionally, my individual values and personal experience have led me to prioritize other factors such as socioeconomic background and kinship networks over race when considering the importance of neighbors. Furthermore, cultural relativism teaches us that there is no hierarchy of culture, and therefore, I do not see a specific value in having neighbors of a different race. Therefore, I choose:\n\n2"]}, {"persona": {"region": "Dakahlia", "sex": "female", "age": 45, "country": "Egypt", "marital_status": "married", "education": "middle", "social_class": "upper middle class"}, "question": {"id": "Q19", "variant": 0}, "response": ["Based on the anthropological framework, I, as a 45-year-old married woman from Dakahlia, Egypt, with a middle education level and a self-identified upper middle class background, understand the importance of cultural context and individual values in shaping perspectives. In my cultural context, the concept of race may not hold the same significance as it might in other cultures. Additionally, my socioeconomic background and personal experiences may lead me to prioritize other aspects of community and neighborhood relations over race. Therefore, my answer to the question is:\n2"]}, {"persona": {"region": "Dakahlia", "sex": "male", "age": 30, "country": "Egypt", "marital_status": "married", "education": "middle", "social_class": "upper middle class"}, "question": {"id": "Q19", "variant": 0}, "response": ["Based on the anthropological framework, the emic perspective of a married male from Dakahlia, Egypt, who considers himself part of the upper middle class, would prioritize cultural context in understanding the importance of having neighbors of a different race. In this cultural context, individual values and personal experiences would heavily influence the perception of race and neighbor relationships. Socioeconomic background also plays a role in shaping attitudes towards race and community. Given the nuanced phrasing of the question, the persona would likely consider it important to have neighbors of a different race in order to promote diversity and cultural exchange within the community.\n\n1"]}, {"persona": {"region": "Dakahlia", "sex": "female", "age": 63, "country": "Egypt", "marital_status": "married", "education": "higher", "social_class": "lower middle class"}, "question": {"id": "Q19", "variant": 0}, "response": ["Based on the anthropological framework, as a married female from Dakahlia, Egypt, my cultural context and individual values play a significant role in my understanding of the importance of having neighbors of a different race. In my community, there is a strong emphasis on kinship networks and cultural traditions, and we tend to value close relationships with those who share similar backgrounds. Additionally, my lower middle-class socioeconomic background has limited my exposure to diverse racial communities. Therefore, I believe it is not mentioned.\n\n2"]}, {"persona": {"region": "Dakahlia", "sex": "male", "age": 28, "country": "Egypt", "marital_status": "single", "education": "higher", "social_class": "upper middle class"}, "question": {"id": "Q19", "variant": 0}, "response": ["Based on the anthropological framework, as a single male from Dakahlia, Egypt, with a higher education level and a self-identification as part of the upper middle class, my perspective on the importance of having neighbors of a different race would be influenced by my cultural context, individual values, and socioeconomic background. In Egypt, race may not be as salient a factor as it is in other societies, and my education and socioeconomic status may also shape my perceptions of diversity and multiculturalism. Additionally, as a member of the upper middle class, I may have more exposure to diverse communities and be more open to the idea of having neighbors of different races. Therefore, I would consider it important to have neighbors who are people of a different race because of the enriching cultural exchange and opportunity for mutual understanding it can bring. \n\n1"]}, {"persona": {"region": "Dakahlia", "sex": "female", "age": 24, "country": "Egypt", "marital_status": "married", "education": "higher", "social_class": "upper middle class"}, "question": {"id": "Q19", "variant": 0}, "response": ["Based on the anthropological framework, as a married female from Dakahlia, Egypt, I value cultural context and understand the importance of socioeconomic background in shaping perspectives. In my cultural context, diversity is not as common as in other places, and socioeconomic background plays a significant role in shaping relationships with neighbors. Additionally, the emic and etic perspectives highlight the importance of understanding both in-group and out-group ways of thinking. Considering all these factors, I believe it is important to have neighbors who are people of a different race, as it can enrich our community and provide opportunities for cultural exchange and learning. \n\n1"]}, {"persona": {"region": "Dakahlia", "sex": "male", "age": 20, "country": "Egypt", "marital_status": "single", "education": "middle", "social_class": "upper middle class"}, "question": {"id": "Q19", "variant": 0}, "response": ["Based on my emic perspective, the cultural context of Dakahlia, Egypt, emphasizes the importance of maintaining close relationships with neighbors. In this context, the individual values and personal experiences of a 20-year-old male from the upper middle class would likely prioritize maintaining positive relationships with neighbors, regardless of their race. Additionally, the socioeconomic background of the persona would influence the desire for harmonious relationships within the community. From a cultural relativism standpoint, the perception of race and its significance may differ from other cultural perspectives. Therefore, it is important to understand and respect the nuances of this cultural context when considering the importance of having neighbors of a different race.\n\n1"]}, {"persona": {"region": "Dakahlia", "sex": "male", "age": 45, "country": "Egypt", "marital_status": "married", "education": "middle", "social_class": "upper middle class"}, "question": {"id": "Q19", "variant": 0}, "response": ["From the perspective of a married male from Dakahlia, Egypt, cultural context is pivotal in understanding and answering this question. In this region, where people are predominantly of the same race, the concept of having neighbors of a different race may not be as relevant as it would be in a more diverse area. Additionally, the individual values and personal experiences of someone from this background may prioritize other aspects of community and neighborhood relations over race. Cultural relativism also plays a role, as there may not be a hierarchical view of different races in this context. Considering all these factors, my answer would be:\n\n2"]}, {"persona": {"region": "Dakahlia", "sex": "female", "age": 43, "country": "Egypt", "marital_status": "married", "education": "higher", "social_class": "upper middle class"}, "question": {"id": "Q19", "variant": 0}, "response": ["From the anthropological framework, my emic perspective as a married female from Dakahlia, Egypt, leads me to consider the cultural context of my community. In our society, there is value placed on diversity and understanding different cultures. Additionally, my higher education level has exposed me to the importance of intercultural understanding and the benefits of diversity in our neighborhood. My socioeconomic background as part of the upper middle class also influences my belief that having neighbors of a different race can bring about a richer and more inclusive community. Therefore, based on my personal experience and cultural context, I believe it is important to have neighbors who are people of a different race.\n\n1"]}, {"persona": {"region": "Dakahlia", "sex": "female", "age": 20, "country": "Egypt", "marital_status": "single", "education": "middle", "social_class": "upper middle class"}, "question": {"id": "Q19", "variant": 0}, "response": ["Based on the anthropological framework, I, as a single female from Dakahlia, Egypt, would consider the importance of having neighbors of a different race from the perspective of cultural context, individual values, and socioeconomic background. In my cultural context, race may not be as salient as it is in other cultural contexts, and my individual values may prioritize other factors such as religion or social status. Additionally, as part of the upper middle class, I may have less exposure to racial diversity in my immediate surroundings, which could influence my perspective on the importance of having neighbors of a different race.\n\n2"]}, {"persona": {"region": "Dakahlia", "sex": "female", "age": 40, "country": "Egypt", "marital_status": "single", "education": "middle", "social_class": "lower middle class"}, "question": {"id": "Q19", "variant": 0}, "response": ["From the emic perspective, growing up in Dakahlia, Egypt, I have always been surrounded by people of the same race and cultural background. The cultural context of my upbringing has taught me to value the importance of maintaining strong connections with those who share similar experiences and traditions. Additionally, my individual values and personal experiences have shaped my understanding of the world, and while I appreciate diversity, I have not had much exposure to people of different races. Considering my lower middle-class socioeconomic background, I have always prioritized building relationships with those who can relate to my struggles and aspirations. Therefore, based on my understanding of cultural relativism and the nuances of my own experiences, I believe it is not explicitly important to have neighbors of a different race, as it has not been a significant aspect of my life so far.\n\n2"]}, {"persona": {"region": "Dakahlia", "sex": "female", "age": 33, "country": "Egypt", "marital_status": "married", "education": "higher", "social_class": "upper middle class"}, "question": {"id": "Q19", "variant": 0}, "response": ["In my experience as a married woman from Dakahlia, Egypt, I have come to understand the significance of cultural context in shaping one's perspective. The emic and etic perspectives within our community place value on maintaining strong relationships with our neighbors, regardless of their race. Our cultural relativism emphasizes the importance of mutual respect and understanding among all individuals, regardless of their backgrounds. Additionally, my socioeconomic background as part of the upper middle class has allowed me to interact with people from diverse racial backgrounds, enriching my understanding of the world. Therefore, I believe it is important to have neighbors who are people of a different race.\n\n1"]}, {"persona": {"region": "Dakahlia", "sex": "female", "age": 24, "country": "Egypt", "marital_status": "married", "education": "middle", "social_class": "working class"}, "question": {"id": "Q19", "variant": 0}, "response": ["Based on the anthropological framework, as a married female from Dakahlia, Egypt, my emic perspective is shaped by my cultural context, individual values, and socioeconomic background. In my community, there is a strong emphasis on kinship networks and close-knit relationships within the same race. Additionally, as a member of the working class, my interactions with people of different races are limited, and my personal experience and values may prioritize familiarity and shared cultural experiences. Therefore, I would say:\n2"]}, {"persona": {"region": "Dakahlia", "sex": "female", "age": 53, "country": "Egypt", "marital_status": "widowed", "education": "middle", "social_class": "working class"}, "question": {"id": "Q19", "variant": 0}, "response": ["From the perspective of a widowed female from Dakahlia, Egypt, who is 53 years old and part of the working class, the answer to the question is influenced by cultural context, individual values, and socioeconomic background. In this cultural context, the importance of having neighbors of a different race may not be a significant factor, as the community may be more homogenous in terms of race. Additionally, individual values and personal experience may play a role in shaping the perception of the importance of having neighbors of a different race. Socioeconomic background, being part of the working class, may also influence the answer, as the focus may be more on practical aspects of living in a neighborhood rather than the racial diversity of the neighbors.\n\n1"]}, {"persona": {"region": "Dakahlia", "sex": "female", "age": 30, "country": "Egypt", "marital_status": "single", "education": "middle", "social_class": "lower middle class"}, "question": {"id": "Q19", "variant": 0}, "response": ["From the anthropological perspective, my emic perspective as a single female from Dakahlia, Egypt, would be influenced by my cultural context, individual values, and socioeconomic background. In Dakahlia, Egypt, there is a diverse mix of people, so the concept of race may not hold the same significance as it does in other cultures. Additionally, as someone from the lower middle class, my interactions with people of different races may be limited due to the socioeconomic segregation that exists in my community. Therefore, my response to the question would be influenced by these factors, as well as the understanding of cultural relativism and the nuanced phrasing of the question.\n\n1"]}, {"persona": {"region": "Dakahlia", "sex": "male", "age": 53, "country": "Egypt", "marital_status": "married", "education": "higher", "social_class": "upper middle class"}, "question": {"id": "Q19", "variant": 0}, "response": ["Based on the anthropological framework, my perspective as a married male from Dakahlia, Egypt, who is 53 years old, has completed higher education, and considers myself part of the upper middle class, is shaped by my cultural context, individual values, and personal experience. In Egypt, there is a strong sense of community and it is important to have good relationships with neighbors. However, the concept of race may not be as salient as it is in other cultural contexts. Additionally, my higher education level and socioeconomic background may have exposed me to diverse perspectives and experiences, leading me to value diversity and inclusion. Therefore, I believe it is important to have neighbors who are people of a different race.\n\n1"]}, {"persona": {"region": "Dakahlia", "sex": "male", "age": 28, "country": "Egypt", "marital_status": "married", "education": "middle", "social_class": "working class"}, "question": {"id": "Q19", "variant": 0}, "response": ["Based on the anthropological framework, as a married male from Dakahlia, Egypt, my understanding and answer to the question of the importance of having neighbors who are people of a different race would be influenced by my cultural context, individual values, socioeconomic background, and the concept of cultural relativism. In Dakahlia, Egypt, there is a strong sense of cultural homogeneity, and the concept of race may not hold the same significance as it does in other parts of the world. Additionally, as a member of the working class with a middle education level, my interactions and experiences with people of different races may be limited, leading to a more neutral stance on the importance of having neighbors of different races. Overall, my answer is influenced by my cultural context, individual values, and socioeconomic background, and reflects a nuanced understanding of the question.\n\n2"]}, {"persona": {"region": "Dakahlia", "sex": "female", "age": 38, "country": "Egypt", "marital_status": "married", "education": "middle", "social_class": "upper middle class"}, "question": {"id": "Q19", "variant": 0}, "response": ["Based on the anthropological framework, my perspective as a married female from Dakahlia, Egypt, with a middle education level and part of the upper middle class is heavily influenced by my cultural context, individual values, and personal experience. In our cultural context, diversity is not as prevalent as in other regions, so the importance of having neighbors of a different race may not be as significant to me. Additionally, my personal experiences and values may lead me to prioritize other aspects of community and neighborhood dynamics over the race of my neighbors. Therefore, my response to the question is:\n\n2"]}, {"persona": {"region": "Gharbia", "sex": "male", "age": 27, "country": "Egypt", "marital_status": "single", "education": "higher", "social_class": "upper middle class"}, "question": {"id": "Q19", "variant": 0}, "response": ["Based on the anthropological framework, as a single male from Gharbia, Egypt, my emic perspective is influenced by the cultural context of my upbringing, education, and socioeconomic background. In my cultural context, the concept of race may not hold the same significance as it does in other societies. Additionally, my personal experience and values may prioritize other factors such as shared beliefs, mutual respect, and a sense of community over race. Furthermore, cultural relativism reminds me that there is no hierarchy of culture and that diversity is valued. Therefore, I believe it is important to have neighbors who are people of a different race because it enriches the community and fosters understanding and empathy across cultural boundaries.\n\n1"]}, {"persona": {"region": "Gharbia", "sex": "female", "age": 35, "country": "Egypt", "marital_status": "married", "education": "higher", "social_class": "upper middle class"}, "question": {"id": "Q19", "variant": 0}, "response": ["Based on the anthropological framework, as a married female from Gharbia, Egypt, cultural context is pivotal in understanding the importance of having neighbors of a different race. In this region, there is a strong emphasis on kinship networks and cultural values, which may prioritize homogeneity within the community. Additionally, as part of the upper middle class, there may be a desire to maintain social and economic status within the community. Therefore, the concept of having neighbors of a different race may not be as important as other factors such as socioeconomic background and cultural values. Furthermore, cultural relativism and individual values play a significant role in shaping perceptions, suggesting that the importance of having neighbors of a different race may not align with the viewpoints of this specific persona.\n\n2"]}, {"persona": {"region": "Gharbia", "sex": "female", "age": 37, "country": "Egypt", "marital_status": "married", "education": "higher", "social_class": "upper middle class"}, "question": {"id": "Q19", "variant": 0}, "response": ["Based on the anthropological framework, my cultural context as a married female from Gharbia, Egypt, plays a pivotal role in understanding and answering this question. In my community, the cultural and social dynamics are heavily influenced by our shared values, traditions, and kinship networks. As a member of the upper middle class, I have been exposed to a diverse range of perspectives and experiences, which has shaped my understanding of the importance of diversity. Additionally, my higher education has instilled in me the value of inclusivity and the recognition of the richness that comes from interacting with people of different backgrounds. Therefore, I believe that it is important to have neighbors who are people of a different race, as it contributes to a more enriched and vibrant community.\n\n1"]}, {"persona": {"region": "Gharbia", "sex": "male", "age": 43, "country": "Egypt", "marital_status": "married", "education": "middle", "social_class": "lower middle class"}, "question": {"id": "Q19", "variant": 0}, "response": ["Based on the anthropological framework, as a married male from Gharbia, Egypt, my emic perspective is influenced by the cultural context of my community, where race is not a dominant factor in social interactions. My individual values and personal experience have led me to prioritize harmonious relationships with my neighbors, regardless of their race. Additionally, my lower middle class socioeconomic background impacts my understanding of the importance of community cohesion and mutual support. Considering the cultural relativism and nuance of the question, I believe that it is important to have neighbors who are people of a different race, as diversity can enrich our community and provide different perspectives and experiences. \n\n1"]}, {"persona": {"region": "Gharbia", "sex": "male", "age": 28, "country": "Egypt", "marital_status": "single", "education": "higher", "social_class": "lower middle class"}, "question": {"id": "Q19", "variant": 0}, "response": ["Based on the anthropological framework, as a single male from Gharbia, Egypt, who considers himself part of the lower middle class, my perspective is heavily influenced by my cultural context, individual values, and socioeconomic background. In Gharbia, Egypt, racial diversity might not be as prevalent as it is in other parts of the world, and my experiences and personal values have shaped my understanding of the importance of having neighbors of a different race. Additionally, cultural relativism is crucial in understanding different perspectives, and my nuanced understanding of the question leads me to believe that it is important to have neighbors who are people of a different race because it can lead to a more diverse and enriching community environment. \n\n1"]}, {"persona": {"region": "Gharbia", "sex": "male", "age": 39, "country": "Egypt", "marital_status": "married", "education": "middle", "social_class": "lower middle class"}, "question": {"id": "Q19", "variant": 0}, "response": ["Based on my cultural context as a married male from Gharbia, Egypt, where kinship networks and community ties are highly valued, I believe that having neighbors who are people of a different race can be important. In my community, there is a strong emphasis on building relationships with those around us, regardless of their race or ethnicity. Additionally, my personal experience and values have taught me the importance of diversity and the exchange of different perspectives. I also recognize the significance of cultural relativism, understanding that no culture is inherently superior to another. Therefore, I believe that having neighbors of a different race can contribute to a richer and more inclusive community. \n\n1"]}, {"persona": {"region": "Gharbia", "sex": "male", "age": 30, "country": "Egypt", "marital_status": "married", "education": "middle", "social_class": "lower middle class"}, "question": {"id": "Q19", "variant": 0}, "response": ["Based on the anthropological framework, my emic perspective as a married male from Gharbia, Egypt, is influenced by my cultural context, individual values and personal experience, and socioeconomic background. In Egyptian society, there is a strong emphasis on community and neighborly relations, and personal experience has taught me the value of having good relationships with my neighbors. Additionally, as a lower middle-class individual, I understand the importance of having a diverse social network for support and opportunities. Therefore, I believe it is important to have neighbors who are people of a different race, as it can enrich my social and cultural experiences.\n\n1"]}, {"persona": {"region": "Gharbia", "sex": "male", "age": 43, "country": "Egypt", "marital_status": "married", "education": "lower", "social_class": "lower middle class"}, "question": {"id": "Q19", "variant": 0}, "response": ["From the perspective of a married male from Gharbia, Egypt, who is 43 years old, has completed lower education, and considers himself part of the lower middle class, it is important to consider the cultural context and individual values and personal experience. In Gharbia, there may be a strong sense of community and reliance on neighbors for support and social interaction. Additionally, the cultural context of Egypt may place value on diversity and inclusion. The individual's lower middle class background may also influence the importance placed on having neighbors of a different race, as there may be a greater likelihood of interacting with diverse neighbors in this socioeconomic bracket. Furthermore, the emic and etic perspectives of the individual may shape their understanding of the importance of diversity in their neighborhood, as they may have personal experiences and values that lead them to believe that it is important to have neighbors of different races.\n1"]}, {"persona": {"region": "Gharbia", "sex": "male", "age": 36, "country": "Egypt", "marital_status": "married", "education": "higher", "social_class": "lower middle class"}, "question": {"id": "Q19", "variant": 0}, "response": ["As a married male from Gharbia, Egypt, my understanding of the importance of having neighbors of a different race is influenced by my cultural context, socioeconomic background, and personal values. In Gharbia, Egypt, the cultural context emphasizes the importance of community and social harmony, regardless of race. This value is also shaped by my lower middle-class background, where I have grown up alongside people from different races and have learned to appreciate the diversity within my community. Additionally, my higher education level has allowed me to understand the importance of cultural relativism and the value of diversity in shaping a more inclusive and equitable society. Therefore, I believe it is important to have neighbors who are people of a different race.\n\n1"]}, {"persona": {"region": "Gharbia", "sex": "male", "age": 25, "country": "Egypt", "marital_status": "married", "education": "middle", "social_class": "upper middle class"}, "question": {"id": "Q19", "variant": 0}, "response": ["Based on the anthropological framework, my perspective on the importance of having neighbors of a different race is influenced by my cultural context, individual values, and socioeconomic background. In my community in Gharbia, Egypt, there is a strong emphasis on cultural homogeneity and preserving traditional values. Additionally, being part of the upper middle class, I have had limited exposure to individuals of different races. Therefore, I may not see the importance of having neighbors of a different race as it is not a common aspect of my cultural and socioeconomic environment. \n\n2"]}, {"persona": {"region": "Gharbia", "sex": "male", "age": 31, "country": "Egypt", "marital_status": "married", "education": "middle", "social_class": "upper middle class"}, "question": {"id": "Q19", "variant": 0}, "response": ["Based on the anthropological framework, my answer is influenced by my cultural context, individual values, and socioeconomic background. As a married male from Gharbia, Egypt, I am influenced by the cultural context of my community, which values strong neighborly relationships. Additionally, my individual values prioritize diversity and inclusion. As part of the upper middle class, I recognize the importance of building a diverse and inclusive community where people of different races can coexist and support each other. Therefore, I believe it is important to have neighbors who are people of a different race.\n\n1"]}, {"persona": {"region": "Gharbia", "sex": "male", "age": 33, "country": "Egypt", "marital_status": "married", "education": "higher", "social_class": "lower middle class"}, "question": {"id": "Q19", "variant": 0}, "response": ["From the perspective of a married male from Gharbia, Egypt, with a higher education level and part of the lower middle class, I would consider the importance of having neighbors of a different race in the context of cultural relativism and individual values. In the cultural context of Gharbia, where diversity may not be as prominent as in other regions, the value placed on having neighbors of a different race may differ from that of other cultures. Additionally, individual experiences and socioeconomic background may play a role in shaping perceptions on this matter. Considering the emic and etic perspectives, as well as the nuanced phrasing of the question, I would say it is important to have neighbors who are people of a different race.\n\n1"]}, {"persona": {"region": "Gharbia", "sex": "male", "age": 26, "country": "Egypt", "marital_status": "single", "education": "higher", "social_class": "upper middle class"}, "question": {"id": "Q19", "variant": 0}, "response": ["From the perspective of a single male from Gharbia, Egypt, who is 26 years old and part of the upper middle class, it is important to consider the cultural context, individual values, and personal experience when answering this question. In this region, there is a strong emphasis on community and social cohesion, which includes interactions with neighbors. Additionally, the individual values and personal experience of someone from this background may prioritize diversity and inclusivity. Considering the emic and etic perspectives, as well as cultural relativism, it is important to acknowledge the value placed on diversity and relationships with neighbors in this particular cultural context. Therefore, the answer from this perspective would be:\n\n1"]}, {"persona": {"region": "Gharbia", "sex": "female", "age": 45, "country": "Egypt", "marital_status": "married", "education": "middle", "social_class": "lower middle class"}, "question": {"id": "Q19", "variant": 0}, "response": ["From the perspective of a married female from Gharbia, Egypt, with a middle education level and a lower middle-class background, the answer to the question would be influenced by several factors. Firstly, the cultural context in Egypt, particularly in more rural areas like Gharbia, often emphasizes community and neighborly relations. Additionally, the individual values and personal experiences of someone in this demographic might lead them to prioritize the importance of having good relations with neighbors, regardless of their race. Furthermore, the socioeconomic background of the persona may contribute to a belief in the importance of neighborly relations for safety and mutual support. Lastly, considering the concept of cultural relativism, this individual may value diversity and intercultural interactions, and thus see the importance of having neighbors of different races. \n\n2"]}, {"persona": {"region": "Gharbia", "sex": "female", "age": 55, "country": "Egypt", "marital_status": "married", "education": "middle", "social_class": "upper middle class"}, "question": {"id": "Q19", "variant": 0}, "response": ["From the perspective of a married female from Gharbia, Egypt, cultural context is pivotal in understanding the importance of having neighbors of a different race. In this region, there is a strong emphasis on cultural homogeneity and a close-knit community. The individual values and personal experiences of someone in this position would likely prioritize the importance of having neighbors who share similar cultural backgrounds and values, as this is seen as a source of stability and social cohesion. Additionally, the socioeconomic background of being part of the upper middle class may lead to a desire for a certain level of exclusivity within the community. Therefore, the answer chosen would be:\n\n2"]}, {"persona": {"region": "Gharbia", "sex": "female", "age": 27, "country": "Egypt", "marital_status": "married", "education": "higher", "social_class": "upper middle class"}, "question": {"id": "Q19", "variant": 0}, "response": ["From the perspective of a married female from Gharbia, Egypt, the importance of having neighbors of a different race is influenced by the cultural context and individual values. In Egypt, there is a strong sense of community and kinship networks, and individuals often prioritize connections with people from similar cultural backgrounds. Additionally, the socioeconomic background and higher education level of the persona may lead to a belief in the importance of diversity and inclusivity. However, the cultural relativism framework suggests that there is no hierarchy of cultures, and the persona may value diversity and different perspectives. Therefore, the nuanced phrasing of the question and the emphasis on cultural relativism may lead the persona to believe that it is important to have neighbors of a different race to promote understanding and inclusivity.\n\n1"]}, {"persona": {"region": "Gharbia", "sex": "female", "age": 42, "country": "Egypt", "marital_status": "married", "education": "higher", "social_class": "upper middle class"}, "question": {"id": "Q19", "variant": 0}, "response": ["Based on the anthropological framework, my perspective as a married female from Gharbia, Egypt, aged 42 with a higher education level and belonging to the upper middle class, is influenced by my cultural context, individual values, and personal experience. In Gharbia, there is a strong emphasis on community and social ties, and having neighbors of a different race can bring diversity and enrich our interactions. Additionally, my education has taught me the value of diversity and inclusion. However, my socioeconomic background may also contribute to my belief that it is important to have neighbors of different races as it reflects a more cosmopolitan and open-minded community. Therefore, my answer is:\n\n1\n\nI know it is important to have neighbors who are people of a different race."]}, {"persona": {"region": "Gharbia", "sex": "female", "age": 32, "country": "Egypt", "marital_status": "married", "education": "middle", "social_class": "upper middle class"}, "question": {"id": "Q19", "variant": 0}, "response": ["Based on the anthropological framework, I understand the importance of considering cultural context, individual values, and socioeconomic background in shaping perspectives. As a married female from Gharbia, Egypt, I am aware of the cultural context in which I live, where there is a predominant ethnic and racial homogeneity. My individual values and personal experience also play a role in my understanding, as I have been raised in a society where racial diversity is not prevalent. Additionally, being part of the upper middle class, I have limited interactions with people of different races in my immediate community. Therefore, based on my perspective and understanding, I would choose the following option:\n\n2"]}, {"persona": {"region": "Gharbia", "sex": "male", "age": 27, "country": "Egypt", "marital_status": "married", "education": "higher", "social_class": "upper middle class"}, "question": {"id": "Q19", "variant": 0}, "response": ["From the perspective of a married male from Gharbia, Egypt, with a higher education level and belonging to the upper middle class, my answer to the question is influenced by the cultural context and individual values. In my cultural context, there is a strong emphasis on community and social connections, and having neighbors of different races can contribute to a diverse and enriched community. Additionally, my personal values and experience lead me to believe that diversity and multiculturalism are important for personal growth and understanding of different perspectives. Therefore, I believe it is important to have neighbors who are people of a different race.\n\n1"]}, {"persona": {"region": "Gharbia", "sex": "female", "age": 27, "country": "Egypt", "marital_status": "married", "education": "higher", "social_class": "lower middle class"}, "question": {"id": "Q19", "variant": 0}, "response": ["In considering the question of the importance of having neighbors who are people of a different race, it is essential to take into account the cultural context and individual values of the persona described. Growing up in Gharbia, Egypt, where the population is predominantly Arab, the cultural context of the persona's upbringing and social environment would likely not emphasize the importance of having neighbors of a different race. Additionally, as a member of the lower middle class, the persona's socioeconomic background may also influence her perspective, as she may not have had many opportunities to interact with individuals of different races. Furthermore, cultural relativism plays a crucial role in this perspective, as there is a strong emphasis on maintaining the cultural norms and values of one's own community. Taking these factors into consideration, the persona would likely answer with:\n\n2"]}, {"persona": {"region": "Gharbia", "sex": "female", "age": 37, "country": "Egypt", "marital_status": "married", "education": "middle", "social_class": "upper middle class"}, "question": {"id": "Q19", "variant": 0}, "response": ["From the emic and etic perspectives, the cultural context of Gharbia, Egypt plays a pivotal role in understanding the importance of having neighbors of a different race. In this region, kinship networks and social interactions are heavily influenced by cultural norms and traditions. Additionally, individual values and personal experience, as well as socioeconomic background, also factor into the perception of race relations. Cultural relativism is also important to consider, as there is a strong emphasis on respecting and valuing diversity in the community. Given this perspective, the answer is:\n\n1"]}, {"persona": {"region": "Gharbia", "sex": "male", "age": 28, "country": "Egypt", "marital_status": "married", "education": "higher", "social_class": "working class"}, "question": {"id": "Q19", "variant": 0}, "response": ["In considering the question from the perspective of a married male from Gharbia, Egypt, who is 28 years old, completed higher education, and identifies as working class, it is important to take into account the cultural context and individual values. In this particular cultural context, the importance of having neighbors of a different race may be influenced by the socio-economic background, as well as the individual's personal experience and values. Additionally, the concept of cultural relativism is crucial in understanding the nuanced perspectives on race and diversity. Therefore, based on this perspective, the answer to the question would be (2) Not mentioned."]}, {"persona": {"region": "Gharbia", "sex": "female", "age": 50, "country": "Egypt", "marital_status": "married", "education": "middle", "social_class": "upper middle class"}, "question": {"id": "Q19", "variant": 0}, "response": ["From the perspective of a married female from Gharbia, Egypt, who is 50 years old and part of the upper middle class, there are several factors to consider in answering this question. First, the cultural context of Egypt and the region of Gharbia emphasizes the importance of community and neighborly relationships. Additionally, the socioeconomic background of being part of the upper middle class may influence the perception of the importance of having neighbors of a different race. Furthermore, the individual values and personal experience of the persona may also play a role in shaping their perspective on this issue. Considering all these factors, I believe it is important to have neighbors who are people of a different race.\n\n1"]}, {"persona": {"region": "Gharbia", "sex": "male", "age": 39, "country": "Egypt", "marital_status": "single", "education": "higher", "social_class": "working class"}, "question": {"id": "Q19", "variant": 0}, "response": ["From the perspective of a single male from Gharbia, Egypt, it is crucial to consider the cultural context and individual values in answering this question. In Gharbia, there is a strong emphasis on community and kinship networks, and the cultural context values the importance of having strong relationships with neighbors. Additionally, personal experience and socioeconomic background play a role in shaping perceptions. As a member of the working class in Egypt, the value of community and diversity is important. Therefore, the answer is:\n\n1"]}, {"persona": {"region": "Gharbia", "sex": "female", "age": 45, "country": "Egypt", "marital_status": "married", "education": "higher", "social_class": "upper middle class"}, "question": {"id": "Q19", "variant": 0}, "response": ["Based on the anthropological framework, as a married female from Gharbia, Egypt, cultural context and kinship networks play a significant role in shaping my perspective. Additionally, my higher education level and upper middle class status also influence my individual values and personal experiences. Considering the emphasis on cultural relativism, I view diversity and multiculturalism positively. Having neighbors of different races can enrich my cultural experiences and broaden my understanding of the world. Therefore, I find it important to have neighbors who are people of different races.\n\n1"]}, {"persona": {"region": "Sharkia", "sex": "male", "age": 35, "country": "Egypt", "marital_status": "married", "education": "higher", "social_class": "upper middle class"}, "question": {"id": "Q19", "variant": 0}, "response": ["From an emic perspective, as a married male from Sharkia, Egypt, with a higher education level and belonging to the upper middle class, my cultural context and individual values play a significant role in shaping my answer to this question. In our cultural context, racial diversity may not be as common as in some other societies, and there may be a strong emphasis on kinship networks and community ties within the same race or ethnicity. However, as someone who has had exposure to different cultures and ideas through my higher education and socioeconomic background, I understand the importance of diversity and the benefits it brings in terms of different perspectives and experiences. Additionally, cultural relativism teaches us that there is no hierarchy of culture, and it is important to embrace and learn from different racial groups. Therefore, based on my nuanced understanding and personal experience, I believe it is important to have neighbors who are people of a different race.\n\n1"]}, {"persona": {"region": "Sharkia", "sex": "female", "age": 55, "country": "Egypt", "marital_status": "married", "education": "middle", "social_class": "lower middle class"}, "question": {"id": "Q19", "variant": 0}, "response": ["Based on my cultural context in Sharkia, Egypt, where people tend to live in close-knit communities and have strong ties with their neighbors, the importance of having neighbors of a different race is not a prominent concern. The cultural relativism of our society means that race is not a factor in the value we place on our relationships with our neighbors. Additionally, my lower middle class socioeconomic background and middle education level have shaped my understanding of the world in a way that emphasizes the importance of community and mutual support, regardless of race. Therefore, I believe that having neighbors of a different race is not a significant factor in our community dynamics.\n\n2"]}, {"persona": {"region": "Sharkia", "sex": "female", "age": 27, "country": "Egypt", "marital_status": "married", "education": "middle", "social_class": "lower middle class"}, "question": {"id": "Q19", "variant": 0}, "response": ["Based on the anthropological framework, my perspective as a married female from Sharkia, Egypt, aged 27 and part of the lower middle class, is shaped by my cultural context, individual values, and socioeconomic background. In Sharkia, the community is relatively homogenous in terms of race, and there is a strong emphasis on close-knit neighborly relationships. However, the importance of having neighbors of a different race may not be immediately apparent in this context, as race may not be a defining factor in the formation of neighborly relationships. Additionally, given the socioeconomic background, the focus may be more on common economic struggles and shared cultural values rather than racial diversity. Therefore, from my perspective, the importance of having neighbors of a different race is not mentioned.\n\n2"]}, {"persona": {"region": "Sharkia", "sex": "female", "age": 52, "country": "Egypt", "marital_status": "married", "education": "middle", "social_class": "lower middle class"}, "question": {"id": "Q19", "variant": 0}, "response": ["Based on the anthropological framework, my answer to the question is influenced by my emic perspective as a married female from Sharkia, Egypt, where the cultural context and socioeconomic background play a significant role in shaping my views. In my community, the importance of having neighbors of a different race is not a common consideration. Cultural relativism also plays a role, as there is no hierarchy of culture and diversity in this context is not necessarily seen as a priority. Additionally, my personal experience and individual values as a lower middle-class woman who has completed middle education level also influence my perspective. Therefore, my answer is (2) Not mentioned."]}, {"persona": {"region": "Sharkia", "sex": "male", "age": 36, "country": "Egypt", "marital_status": "married", "education": "middle", "social_class": "lower middle class"}, "question": {"id": "Q19", "variant": 0}, "response": ["Based on the anthropological framework, as a married male from Sharkia, Egypt, who is 36 years old and part of the lower middle class, my answer to the question is influenced by my cultural context, individual values, and socioeconomic background. In my community, there is a strong emphasis on kinship networks and cultural homogeneity, so having neighbors of a different race may not be considered important. Additionally, my personal experience and values may also play a role in my belief that it is not necessary to have neighbors who are people of a different race. My socioeconomic background may also influence my perspective, as lower middle-class individuals in my community may prioritize economic stability and social cohesion over diversity. Therefore, my answer is (2) Not mentioned."]}, {"persona": {"region": "Sharkia", "sex": "female", "age": 20, "country": "Egypt", "marital_status": "single", "education": "middle", "social_class": "working class"}, "question": {"id": "Q19", "variant": 0}, "response": ["In considering the question of whether it is important to have neighbors who are people of a different race, I must take into account my cultural context as a single female from Sharkia, Egypt. In my community, race is not a prominent factor in the way we interact with our neighbors. However, I understand the importance of diversity and exposure to different cultures. I also recognize the value of cultural relativism, acknowledging that there is no hierarchy of culture and that diversity can bring about new perspectives and understanding. Therefore, I believe it is important to have neighbors who are people of a different race.\n\n1"]}, {"persona": {"region": "Sharkia", "sex": "male", "age": 60, "country": "Egypt", "marital_status": "married", "education": "middle", "social_class": "working class"}, "question": {"id": "Q19", "variant": 0}, "response": ["Based on the anthropological framework, my response is influenced by my individual values and personal experience, as well as my cultural context. Growing up in Sharkia, Egypt, I have been surrounded by people of similar cultural and racial backgrounds. Additionally, my middle education level and working-class status has limited my exposure to different races. My age and place also play a role in my perspective, as I have lived in a relatively homogeneous community for most of my life. Therefore, I have limited personal experience with having neighbors of different races, and I may not fully understand the importance of such diversity in a community.\n\n2"]}, {"persona": {"region": "Sharkia", "sex": "male", "age": 41, "country": "Egypt", "marital_status": "married", "education": "higher", "social_class": "upper middle class"}, "question": {"id": "Q19", "variant": 0}, "response": ["From an anthropological perspective, my emic and etic perspective as a married male from Sharkia, Egypt, would influence my understanding of the importance of having neighbors who are people of a different race. In my cultural context, the concept of race may not hold the same significance as it does in other cultures, and my individual values and personal experience may shape my perception of the importance of diversity in my neighborhood. Additionally, my socioeconomic background as part of the upper middle class may lead me to prioritize other factors such as economic stability and social status over the race of my neighbors. Considering the principle of cultural relativism, I understand that my perspective may differ from others based on space and time, as well as nuanced interpretations of the question. Therefore, I believe that the answer to this question is not mentioned.\n\n2"]}, {"persona": {"region": "Sharkia", "sex": "female", "age": 23, "country": "Egypt", "marital_status": "married", "education": "middle", "social_class": "lower middle class"}, "question": {"id": "Q19", "variant": 0}, "response": ["Based on the anthropological framework, as a married female from Sharkia, Egypt, my emic perspective values the importance of cultural context and individual values in answering this question. In my cultural context, the concept of race may not hold the same significance as it does in other cultural contexts, and my personal experience and values may also play a significant role in my answer. Additionally, my lower middle class socioeconomic background and middle education level may influence my perception of the importance of having neighbors of a different race. Therefore, my answer is:\n2"]}, {"persona": {"region": "Sharkia", "sex": "male", "age": 49, "country": "Egypt", "marital_status": "married", "education": "higher", "social_class": "upper middle class"}, "question": {"id": "Q19", "variant": 0}, "response": ["From an anthropological perspective, my cultural context and individual values play a significant role in shaping my answer to this question. Growing up in Sharkia, Egypt, I was raised in a community where people of different races were not commonly present, and this has influenced my perspective on the significance of having neighbors of a different race. In addition, my higher education and socio-economic background have exposed me to diverse cultural experiences, which has shaped my understanding of the importance of diversity in my immediate surroundings. Considering cultural relativism, I understand the value of diverse perspectives and the enriching exchange of ideas that can occur when people of different races interact on a day-to-day basis. Therefore, based on my personal experience and cultural context, I believe it is important to have neighbors who are people of a different race.\n\n1"]}, {"persona": {"region": "Sharkia", "sex": "female", "age": 30, "country": "Egypt", "marital_status": "married", "education": "middle", "social_class": "upper middle class"}, "question": {"id": "Q19", "variant": 0}, "response": ["Based on the anthropological framework, the cultural context and individual values are pivotal in understanding and answering this question. As a married female from Sharkia, Egypt, I come from a culture where race is not a significant factor in the importance of neighbors. Our societal values are deeply rooted in kinship networks and community ties, rather than race. Additionally, my personal experience and socioeconomic background as part of the upper middle class likely lead me to prioritize factors such as safety, trust, and social support in neighbors, rather than their race. Therefore, I believe it is not mentioned.\n\n2"]}, {"persona": {"region": "Sharkia", "sex": "male", "age": 39, "country": "Egypt", "marital_status": "married", "education": "higher", "social_class": "upper middle class"}, "question": {"id": "Q19", "variant": 0}, "response": ["As a married male from Sharkia, Egypt, my perspective on the importance of having neighbors of a different race is heavily influenced by my cultural context, individual values, and socioeconomic background. In Egypt, our society is largely homogenous, and the concept of race is not as prominent as it might be in other parts of the world. Additionally, my higher education level and upper middle-class status have afforded me the opportunity to interact with people from various backgrounds, which has enriched my understanding of diversity. Furthermore, cultural relativism teaches us that there is no hierarchy of cultures, so I believe it is important to have neighbors from different races as it can lead to a more inclusive and diverse community. \n\n1"]}, {"persona": {"region": "Sharkia", "sex": "female", "age": 26, "country": "Egypt", "marital_status": "married", "education": "middle", "social_class": "lower middle class"}, "question": {"id": "Q19", "variant": 0}, "response": ["From my perspective as a married female from Sharkia, Egypt, I understand the importance of cultural context and individual values in shaping one's views on the importance of having neighbors of a different race. My lower middle class background and completed middle education level have also influenced my understanding of the world. Additionally, the concept of cultural relativism is crucial in my viewpoint, as I believe that no culture is superior to another. Considering the emic and etic perspectives, I value the diversity and enriching experiences that come from interacting with people of different races. My personal experiences and nuanced understanding of the world lead me to believe that it is important to have neighbors who are people of a different race.\n\n1"]}, {"persona": {"region": "Sharkia", "sex": "female", "age": 48, "country": "Egypt", "marital_status": "married", "education": "middle", "social_class": "lower middle class"}, "question": {"id": "Q19", "variant": 0}, "response": ["Based on the anthropological framework, as a married female from Sharkia, Egypt, at 48 years of age, with a middle education level and considering myself part of the lower middle class, my perspective on the importance of having neighbors of a different race is influenced by my cultural context, individual values, and socioeconomic background. In Sharkia, Egypt, the population is predominantly Arab, and there is not a significant presence of people from different races. Therefore, the cultural context and personal experience lead me to prioritize the importance of having neighbors who share similar cultural and linguistic backgrounds. Additionally, my lower middle-class socioeconomic background may limit my exposure to diverse racial communities and influence my perception of the importance of having neighbors of a different race. Therefore, my perspective on this question is shaped by the emic perspective of valuing cultural familiarity and shared experiences within my own racial and cultural community.\n\n1"]}, {"persona": {"region": "Sharkia", "sex": "male", "age": 34, "country": "Egypt", "marital_status": "married", "education": "higher", "social_class": "upper middle class"}, "question": {"id": "Q19", "variant": 0}, "response": ["Based on the anthropological framework, my response is influenced by my cultural context, individual values, and socioeconomic background. In Sharkia, Egypt, where I come from, there is a strong emphasis on community and the importance of harmonious relationships with neighbors. This is influenced by the cultural value of hospitality and interconnectedness. Additionally, my higher education level and upper-middle-class status have provided me with exposure to diverse perspectives and an understanding of the importance of inclusivity. Therefore, I believe it is important to have neighbors who are people of a different race because it enriches the community with diverse experiences and perspectives, contributing to a more vibrant and understanding neighborhood.\n\n1"]}, {"persona": {"region": "Sharkia", "sex": "female", "age": 39, "country": "Egypt", "marital_status": "divorced", "education": "middle", "social_class": "lower middle class"}, "question": {"id": "Q19", "variant": 0}, "response": ["From an anthropological perspective, the emic and etic perspectives are crucial in understanding the importance of having neighbors of a different race. In the cultural context of Sharkia, Egypt, where I come from, race may not be as significant of a factor in determining the importance of having neighbors of a different race. My individual values and personal experience, as a divorced female from a lower middle class background, may lead me to prioritize other factors such as financial stability and safety in my neighborhood. Additionally, the cultural relativism in Egypt may lead me to believe that the importance of having neighbors of a different race is not as significant as it may be in other cultural contexts. Furthermore, the nuanced phrasing of the question may lead me to believe that race is not the only determining factor in the importance of having diverse neighbors. \n\n3"]}, {"persona": {"region": "Sharkia", "sex": "male", "age": 39, "country": "Egypt", "marital_status": "married", "education": "middle", "social_class": "upper middle class"}, "question": {"id": "Q19", "variant": 0}, "response": ["Based on the anthropological framework, as a married male from Sharkia, Egypt, my emic perspective on the importance of having neighbors of a different race is influenced by my cultural context and socioeconomic background. In my community, there is a strong emphasis on maintaining close relationships with neighbors, regardless of race. Cultural relativism also plays a role in shaping my viewpoint, as I recognize that different cultures have different norms and values regarding neighborly relations. Additionally, my individual values and personal experience lead me to believe that diversity in my neighborhood can enrich my own life and broaden my perspective. Therefore, I believe it is important to have neighbors who are people of a different race.\n\n1"]}, {"persona": {"region": "Qaliubiya", "sex": "male", "age": 62, "country": "Egypt", "marital_status": "married", "education": "middle", "social_class": "working class"}, "question": {"id": "Q19", "variant": 0}, "response": ["Based on the anthropological framework, my perspective is heavily influenced by my cultural context in Qaliubiya, Egypt, where the majority of the population is of the same race. My individual values and personal experience also play a significant role in my perception. Being part of the working class and having completed only middle education level, I have limited exposure to diverse racial backgrounds. Additionally, cultural relativism is important to consider, as the societal norms and values in my community may not prioritize or emphasize the importance of having neighbors of a different race. Therefore, I believe it is not mentioned.\n\n2"]}, {"persona": {"region": "Qaliubiya", "sex": "male", "age": 33, "country": "Egypt", "marital_status": "married", "education": "middle", "social_class": "working class"}, "question": {"id": "Q19", "variant": 0}, "response": ["Based on the anthropological framework, my perspective as a married male from Qaliubiya, Egypt, is heavily influenced by my cultural context, individual values, and socioeconomic background. In Egyptian society, there is a strong emphasis on community and neighborly relations, regardless of race. The cultural context of Egypt values hospitality and interconnectedness, so having neighbors of a different race is not a significant factor in forming relationships. Additionally, my working-class background and middle education level have shaped my understanding of the importance of community solidarity and support, which transcends racial boundaries. Therefore, from my perspective, it is not important to have neighbors who are people of a different race.\n\n2"]}, {"persona": {"region": "Qaliubiya", "sex": "male", "age": 62, "country": "Egypt", "marital_status": "married", "education": "higher", "social_class": "lower middle class"}, "question": {"id": "Q19", "variant": 0}, "response": ["Based on the anthropological framework, my perspective as a married male from Qaliubiya, Egypt would be influenced by my cultural context, individual values, and socioeconomic background. In Egypt, there is a strong emphasis on community and neighborly relationships, and my personal experience and values would likely prioritize the importance of having good relationships with neighbors, regardless of their race. Additionally, my lower middle-class background may mean that I have firsthand experience of the benefits of diverse and supportive neighborly networks. Therefore, I believe it is important to have neighbors who are people of a different race.\n\n1"]}, {"persona": {"region": "Qaliubiya", "sex": "male", "age": 29, "country": "Egypt", "marital_status": "married", "education": "middle", "social_class": "working class"}, "question": {"id": "Q19", "variant": 0}, "response": ["Based on the anthropological framework, my perspective as a married male from Qaliubiya, Egypt, is influenced by my cultural context, socioeconomic background, and personal experience. In Egypt, there is a strong sense of community and importance placed on good relationships with neighbors. However, the cultural context and socioeconomic background play a significant role in shaping my perspective. As a member of the working class in Egypt, my interactions with people of different races may be limited, and my personal experience may not have provided me with the opportunity to form close relationships with people of different races. Therefore, I believe it is not mentioned whether it is important to have neighbors who are people of a different race.\n\n2"]}, {"persona": {"region": "Qaliubiya", "sex": "female", "age": 42, "country": "Egypt", "marital_status": "married", "education": "higher", "social_class": "working class"}, "question": {"id": "Q19", "variant": 0}, "response": ["Based on the anthropological framework, as a married female from Qaliubiya, Egypt, cultural context and individual values play a significant role in shaping my perspective. In Egypt, societal norms and cultural traditions heavily influence the importance of having neighbors of a different race. Additionally, my personal experience and socioeconomic background as part of the working class have shaped my understanding of the dynamics of race relations. Furthermore, the emic and etic perspectives in the Egyptian context emphasize the significance of kinship networks and community ties, which may influence my stance on the importance of having neighbors of a different race. Taking all of these factors into consideration, my perspective on this question is as follows:\n\n1\n\nAs a married female from Qaliubiya, Egypt, I believe it is important to have neighbors who are people of a different race."]}, {"persona": {"region": "Qaliubiya", "sex": "female", "age": 50, "country": "Egypt", "marital_status": "married", "education": "middle", "social_class": "lower middle class"}, "question": {"id": "Q19", "variant": 0}, "response": ["Based on my cultural context in Qaliubiya, Egypt, where I have lived my entire life, the diversity of race is not a prominent factor in our community. My individual values and personal experiences have shaped my understanding that what truly matters in a neighbor is their character, kindness, and willingness to support and build relationships within our community. Additionally, my lower middle-class background has taught me the importance of unity and cooperation within our neighborhood, regardless of race. Therefore, I believe it is important to have neighbors who are people of a different race, as it fosters a sense of understanding and inclusivity within our community.\n\n1"]}, {"persona": {"region": "Qaliubiya", "sex": "male", "age": 29, "country": "Egypt", "marital_status": "married", "education": "higher", "social_class": "lower middle class"}, "question": {"id": "Q19", "variant": 0}, "response": ["From an anthropological perspective, my answer to this question is influenced by several factors. Firstly, my cultural context as a married male from Qaliubiya, Egypt plays a role in shaping my answer. In my community, there is a strong emphasis on social cohesion and neighborly relations, regardless of race. Additionally, my individual values and personal experience have taught me the importance of diversity and inclusivity in my social environment. Furthermore, my socioeconomic background as a lower middle class individual has also influenced my perception, as I believe that having neighbors of different races can enrich our community and provide different perspectives. Therefore, based on these factors, I believe it is important to have neighbors who are people of a different race.\n\n1"]}, {"persona": {"region": "Qaliubiya", "sex": "male", "age": 35, "country": "Egypt", "marital_status": "married", "education": "higher", "social_class": "working class"}, "question": {"id": "Q19", "variant": 0}, "response": ["From the perspective of a married male from Qaliubiya, Egypt, the cultural context is crucial in understanding the importance of having neighbors of a different race. In this region, there is a strong emphasis on community and kinship networks, and people often have close relationships with their neighbors. However, the socioeconomic background of this persona, being part of the working class, may also play a role in their answer. Additionally, the individual values and personal experiences of this persona, shaped by their age, education level, and cultural context, will influence their perception of the importance of having neighbors of a different race. Furthermore, the concept of cultural relativism is important to consider, as the persona's perspective may be shaped by the cultural norms and values of their community. Ultimately, the nuanced phrasing of the question will also impact their response. \n\n1"]}, {"persona": {"region": "Qaliubiya", "sex": "female", "age": 40, "country": "Egypt", "marital_status": "married", "education": "middle", "social_class": "working class"}, "question": {"id": "Q19", "variant": 0}, "response": ["Based on my cultural context in Qaliubiya, Egypt, where kinship networks and community relationships are highly valued, and considering my working-class background, I believe that having neighbors of different races could be important. My personal experience and individual values also play a role in this belief, as I have had positive interactions with people from different races and believe that diversity enriches our communities. Additionally, the concept of cultural relativism is important to me, and I respect and value the perspectives and experiences of people from different backgrounds. Therefore, I believe it is important to have neighbors who are people of different races.\n\n1"]}, {"persona": {"region": "Qaliubiya", "sex": "female", "age": 48, "country": "Egypt", "marital_status": "divorced", "education": "lower", "social_class": "working class"}, "question": {"id": "Q19", "variant": 0}, "response": ["Based on the anthropological framework, as a divorced female from Qaliubiya, Egypt, with a lower education level and a part of the working class, my emic perspective would emphasize the significance of cultural context and individual values. In my community, cultural homogeneity is valued and there is a strong emphasis on maintaining traditional values and customs. Additionally, my socioeconomic background as a member of the working class has influenced my experiences and perceptions, leading me to prioritize stability and familiarity in my immediate environment. Therefore, I believe it is important to have neighbors who share similar cultural and socioeconomic backgrounds to foster a sense of community and mutual understanding.\n\n1"]}, {"persona": {"region": "Qaliubiya", "sex": "male", "age": 46, "country": "Egypt", "marital_status": "married", "education": "middle", "social_class": "working class"}, "question": {"id": "Q19", "variant": 0}, "response": ["Based on the anthropological framework, my perspective as a married male from Qaliubiya, Egypt, is heavily influenced by my cultural context, individual values, and socioeconomic background. In my community, there is a strong emphasis on kinship networks and social bonds. However, as a member of the working class, my interactions with people of different races may be limited due to socioeconomic factors. Additionally, cultural relativism plays a role in my understanding, as there is a respect for diversity and an understanding that no one culture is superior to another. Considering these factors, I believe it is important to have neighbors who are people of a different race because it contributes to a diverse and inclusive community, which aligns with my values and cultural relativism.\n\n1"]}, {"persona": {"region": "Qaliubiya", "sex": "male", "age": 47, "country": "Egypt", "marital_status": "married", "education": "higher", "social_class": "lower middle class"}, "question": {"id": "Q19", "variant": 0}, "response": ["From an anthropological perspective, my emic understanding as a married male from Qaliubiya, Egypt, is shaped by my cultural context, individual values, and socioeconomic background. In Egypt, there is a strong sense of community and neighborly relations are highly valued. However, the cultural context also includes a predominantly homogenous society in terms of race. My personal experience has taught me to prioritize harmonious relations with neighbors, regardless of their race, as this contributes to a sense of security and mutual support. Additionally, as a member of the lower middle class, I understand the importance of relying on neighbors for assistance in times of need. Therefore, I believe it is important to have neighbors who are people of a different race.\n\n1"]}, {"persona": {"region": "Qaliubiya", "sex": "female", "age": 38, "country": "Egypt", "marital_status": "married", "education": "higher", "social_class": "working class"}, "question": {"id": "Q19", "variant": 0}, "response": ["Based on the anthropological framework, my perspectives as a married female from Qaliubiya, Egypt, who is 38 years old, completed higher education, and considers herself part of the working class are influenced by my cultural context, individual values, and personal experience. In Egypt, there is a strong sense of community and neighborly relationships are highly valued. However, race is not as prominent of a factor in social interactions as it may be in other cultural contexts. Additionally, my individual values emphasize the importance of diversity and inclusivity, as well as the potential for learning and growth from engaging with people of different backgrounds. Therefore, I believe it is important to have neighbors who are people of a different race because it can enrich our community and broaden our perspectives.\n\n1"]}, {"persona": {"region": "Qaliubiya", "sex": "male", "age": 58, "country": "Egypt", "marital_status": "married", "education": "middle", "social_class": "working class"}, "question": {"id": "Q19", "variant": 0}, "response": ["From an anthropological perspective, my individual values and personal experience play a significant role in shaping my understanding of the importance of having neighbors who are people of a different race. Living in Qaliubiya, Egypt, with a middle education level and being part of the working class, my cultural context and socioeconomic background have shaped my understanding of race and diversity. Additionally, the space and time in which I have lived have influenced my perceptions. In this context, cultural relativism is important to consider, as different cultures may have different perspectives on race and diversity. Based on these factors, I believe that having neighbors who are people of a different race can be important for fostering diversity and understanding different perspectives, especially in a globalized world. \n\n1"]}, {"persona": {"region": "Qaliubiya", "sex": "female", "age": 27, "country": "Egypt", "marital_status": "married", "education": "higher", "social_class": "working class"}, "question": {"id": "Q19", "variant": 0}, "response": ["Based on the anthropological framework, as a married female from Qaliubiya, Egypt, my emic perspective emphasizes the importance of cultural context and individual values. In my community, the cultural context emphasizes the importance of kinship networks and close connections with neighbors. Additionally, my personal experience and values lead me to believe that having neighbors of a different race can add diversity and enrich our community, contributing to a more nuanced and culturally rich environment. Therefore, my answer is (1) Important."]}, {"persona": {"region": "Qaliubiya", "sex": "female", "age": 48, "country": "Egypt", "marital_status": "married", "education": "middle", "social_class": "upper middle class"}, "question": {"id": "Q19", "variant": 0}, "response": ["From the perspective of the persona described above, it is important to consider the cultural context and individual values when answering the question. In the cultural context of Qaliubiya, Egypt, there is a strong emphasis on community and social relationships. Additionally, the individual values and personal experiences of the persona, as a member of the upper middle class, may lead to a belief in the importance of diversity and multiculturalism. Furthermore, the socioeconomic background of the persona may also play a role in shaping their perspective, as individuals from higher socioeconomic backgrounds may have more exposure to diversity and may place a higher value on it. Therefore, considering the cultural context, individual values, and socioeconomic background, the persona would likely choose option 1, as they may believe it is important to have neighbors who are people of a different race in order to foster a more diverse and inclusive community. \n\n1"]}, {"persona": {"region": "Giza", "sex": "female", "age": 19, "country": "Egypt", "marital_status": "single", "education": "middle", "social_class": "working class"}, "question": {"id": "Q19", "variant": 0}, "response": ["Based on the anthropological framework, my individual values and personal experiences as a working-class single female from Giza, Egypt, will significantly influence my answer to this question. As a young woman who has completed middle education, I have been shaped by the cultural context and socioeconomic background of my community. In Giza, there is a mix of people from different races and ethnicities, and I have learned to value diversity and appreciate the perspectives and experiences of people from varied backgrounds. Additionally, cultural relativism is important to me, and I believe that no one culture is better than another. Therefore, I believe it is important to have neighbors who are people of a different race as it enriches my understanding of the world and fosters a sense of community and inclusivity.\n\n1"]}, {"persona": {"region": "Giza", "sex": "female", "age": 38, "country": "Egypt", "marital_status": "married", "education": "higher", "social_class": "lower middle class"}, "question": {"id": "Q19", "variant": 0}, "response": ["Based on the anthropological framework, my answer to the question is influenced by my cultural context, individual values, and socioeconomic background. Living in Giza, Egypt, I am part of a diverse community where people of different races live together. My personal experience and values lead me to believe that it is important to have neighbors who are people of a different race as it enriches my understanding of different cultures and perspectives. Additionally, my lower middle class background has taught me the value of unity and diversity in our community. Therefore, I believe it is important to have neighbors who are people of a different race.\n\n1"]}, {"persona": {"region": "Beni Swaif/Beni Suef", "sex": "female", "age": 34, "country": "Egypt", "marital_status": "divorced", "education": "higher", "social_class": "lower class"}, "question": {"id": "Q19", "variant": 0}, "response": ["Based on the anthropological framework, as a divorced female from Beni Swaif, Egypt, my emic perspective considers the cultural context of my community, where race may not be a significant factor in neighborly relationships. The socioeconomic background of being part of the lower class also influences my understanding, as the focus may be more on shared economic struggles rather than racial differences. In this cultural relativism, the idea of different races living together may not hold the same importance as in other cultural contexts. Additionally, the nuance of the question may also play a role in my answer, as the phrasing of the question may not align with the lived experiences and values of my community. Therefore, I choose option (2) Not mentioned."]}, {"persona": {"region": "Beni Swaif/Beni Suef", "sex": "male", "age": 20, "country": "Egypt", "marital_status": "single", "education": "higher", "social_class": "working class"}, "question": {"id": "Q19", "variant": 0}, "response": ["Based on the anthropological framework, as a single male from Beni Swaif, Egypt, I bring with me the cultural context of living in a diverse society where people from different races coexist. My individual values and personal experience also play a role in shaping my perception of the importance of having neighbors who are people of a different race. As part of the working class, my socioeconomic background also influences my answer. Additionally, the concept of cultural relativism reminds me that there is no hierarchy of culture, and therefore, having neighbors of a different race is seen as important for fostering diversity and understanding. Taking into account the nuance of the question, I would say it is important to have neighbors who are people of a different race because it contributes to a richer and more inclusive community. \n\n1"]}, {"persona": {"region": "Giza", "sex": "male", "age": 19, "country": "Egypt", "marital_status": "single", "education": "middle", "social_class": "upper middle class"}, "question": {"id": "Q19", "variant": 0}, "response": ["Based on the anthropological framework, as a single male from Giza, Egypt, my perspective on the importance of having neighbors of a different race is influenced by my cultural context, individual values, and socioeconomic background. In Egypt, there is a diverse population with people of different races and ethnicities, and this diversity is valued in our society. Additionally, my upper middle class background may lead me to believe that cultural diversity in my neighborhood can lead to a richer and more vibrant community. Furthermore, my personal experiences and values may have shaped my belief that interacting with people of different races can lead to greater understanding and empathy. Therefore, based on this perspective, I believe it is important to have neighbors who are people of a different race.\n\n1"]}, {"persona": {"region": "Giza", "sex": "female", "age": 33, "country": "Egypt", "marital_status": "married", "education": "middle", "social_class": "working class"}, "question": {"id": "Q19", "variant": 0}, "response": ["Based on the anthropological framework, my perspective on the importance of having neighbors of a different race is influenced by my cultural context, individual values, and socioeconomic background. In Egypt, there is a rich history of diversity and multiculturalism, and I have been raised to value and appreciate the differences among people. Additionally, as a member of the working class, I understand the importance of community and cooperation, and having neighbors of a different race can contribute to a more inclusive and understanding neighborhood environment. Therefore, I believe it is important to have neighbors who are people of a different race.\n\n1"]}, {"persona": {"region": "Giza", "sex": "female", "age": 24, "country": "Egypt", "marital_status": "married", "education": "higher", "social_class": "working class"}, "question": {"id": "Q19", "variant": 0}, "response": ["Based on the anthropological framework, my perspective on the importance of having neighbors of a different race is influenced by my cultural context, individual values, and socioeconomic background. In Giza, Egypt, cultural diversity is not as prevalent as in some other places, so the importance of having neighbors of a different race may not be as significant as it would be in a more diverse community. Additionally, my working-class background may mean that I have limited opportunities for interaction with people of different races, which could also impact my perspective on the importance of this factor in my neighborhood. Considering these factors, I would say: \n\n2"]}, {"persona": {"region": "Giza", "sex": "male", "age": 50, "country": "Egypt", "marital_status": "married", "education": "higher", "social_class": "working class"}, "question": {"id": "Q19", "variant": 0}, "response": ["In considering the question of the importance of having neighbors of a different race, it is crucial to take into account the cultural context, individual values, and socioeconomic background of the persona. As a married male from Giza, Egypt, who is 50 years old, completed higher education, and identifies as part of the working class, the cultural context of Egypt is predominantly homogenous in terms of race. Additionally, individual values and personal experience may play a role in shaping the perspective on this question. The socioeconomic background of the persona may also influence the answer, as working-class individuals may have different experiences and perceptions of diversity compared to those in higher socioeconomic brackets. Therefore, the response to the question may be influenced by the unique combination of these factors.\n\n1"]}, {"persona": {"region": "Beni Swaif/Beni Suef", "sex": "female", "age": 26, "country": "Egypt", "marital_status": "married", "education": "higher", "social_class": "lower middle class"}, "question": {"id": "Q19", "variant": 0}, "response": ["Based on the anthropological framework, my answer is influenced by my cultural context as a married female from Beni Suef, Egypt, where diversity and multiculturalism are not common. My personal experiences and values also play a significant role in my answer, as I have not had much exposure to people of different races due to the homogeneity of my community. Additionally, my lower middle-class socioeconomic background has limited my opportunities for interactions with people from different racial backgrounds. Therefore, I believe it is not important to have neighbors who are people of a different race.\n\n2"]}, {"persona": {"region": "Beni Swaif/Beni Suef", "sex": "male", "age": 40, "country": "Egypt", "marital_status": "single", "education": "lower", "social_class": "lower class"}, "question": {"id": "Q19", "variant": 0}, "response": ["From the perspective of a single male from Beni Swaif, Egypt, who is 40 years old, has completed lower education, and considers himself part of the lower class, the answer to the question of whether it is important to have neighbors who are people of a different race would be heavily influenced by the cultural context and socioeconomic background. In this particular context, there may not be a strong emphasis on racial diversity in the neighborhood due to the homogeneous nature of the community. Additionally, lower education and socioeconomic status may limit exposure to diverse perspectives and cultures. The individual values and personal experience of the persona may also play a role in shaping their perception of the importance of having neighbors of a different race. Therefore, the chosen answer based on this perspective is:\n\n2) Not mentioned"]}, {"persona": {"region": "Beni Swaif/Beni Suef", "sex": "female", "age": 25, "country": "Egypt", "marital_status": "married", "education": "middle", "social_class": "lower middle class"}, "question": {"id": "Q19", "variant": 0}, "response": ["Based on the anthropological framework, the cultural context of Beni Suef, Egypt, is crucial in understanding and answering this question. The region is predominantly homogeneous in terms of race, with the majority of the population being Arab. The individual values and personal experience of a 25-year-old married woman who completed middle education level in this region, as well as her lower middle-class socioeconomic background, would likely lead her to embrace cultural relativism. She may not see the importance of having neighbors of a different race as a pressing issue in her community, given the lack of racial diversity and the emphasis on kinship networks and community cohesion. Therefore, the answer selected is:\n\n2) Not mentioned"]}, {"persona": {"region": "Beni Swaif/Beni Suef", "sex": "female", "age": 21, "country": "Egypt", "marital_status": "single", "education": "middle", "social_class": "lower middle class"}, "question": {"id": "Q19", "variant": 0}, "response": ["Based on the anthropological framework, as a single female from Beni Suef, Egypt, my emic perspective is shaped by my cultural context, individual values, and socioeconomic background. In my community, the cultural context is homogenous, with the majority of the population being of the same race. My individual values and personal experience also influence my perspective, as I have been brought up in a society where racial diversity is not a prominent factor. Additionally, my lower middle-class socioeconomic background has limited my exposure to a diverse range of people. Therefore, from my perspective, the importance of having neighbors of a different race is not mentioned.\n\n2"]}, {"persona": {"region": "Beni Swaif/Beni Suef", "sex": "male", "age": 48, "country": "Egypt", "marital_status": "married", "education": "middle", "social_class": "lower middle class"}, "question": {"id": "Q19", "variant": 0}, "response": ["Based on my personal experience and cultural context, I believe that having neighbors of a different race can be important. In my community in Beni Swaif/Beni Suef, Egypt, we value diversity and cultural exchange. Embracing different races and ethnicities in our neighborhood can lead to a better understanding of each other's backgrounds and traditions. Additionally, my lower middle class socio-economic background has taught me the importance of solidarity and mutual support among neighbors, regardless of race. As an individual who values cultural relativism, I believe that having neighbors of different races can enrich our community and help us learn from each other. Therefore, I think it is important to have neighbors who are people of a different race.\n\n1"]}, {"persona": {"region": "Beni Swaif/Beni Suef", "sex": "female", "age": 57, "country": "Egypt", "marital_status": "married", "education": "middle", "social_class": "working class"}, "question": {"id": "Q19", "variant": 0}, "response": ["Based on the anthropological framework, my perspective as a married female from Beni Swaif/Beni Suef, Egypt, is heavily influenced by my cultural context, socioeconomic background, and age. In my community, there is a strong emphasis on kinship networks and community cohesion. As a member of the working class, my interactions with neighbors of different races are limited due to the homogeneity of the population in my area. Additionally, my age and education level have shaped my understanding of the world, and the importance of having neighbors of different races has not been a significant topic of discussion or consideration. Therefore, I would have to choose:\n\n2) Not mentioned"]}, {"persona": {"region": "Beni Swaif/Beni Suef", "sex": "male", "age": 20, "country": "Egypt", "marital_status": "single", "education": "middle", "social_class": "working class"}, "question": {"id": "Q19", "variant": 0}, "response": ["From the perspective of a single male from Beni Swaif, Egypt, who is 20 years old and has completed middle education, it is important to consider the cultural context, individual values, and socioeconomic background when answering this question. In the cultural context of Egypt, there is a strong emphasis on community and social relationships, which often extend to neighbors. Additionally, individual values and personal experiences shape the perception of the importance of having neighbors of a different race. In a working-class setting, the socioeconomic background may also play a role in shaping the answer, as it may influence the level of exposure and interaction with people of different races. Therefore, the answer may be influenced by the nuanced phrasing of the question and the specific circumstances of the persona.\n\n1"]}, {"persona": {"region": "Giza", "sex": "female", "age": 59, "country": "Egypt", "marital_status": "married", "education": "higher", "social_class": "upper middle class"}, "question": {"id": "Q19", "variant": 0}, "response": ["Based on my personal experience and cultural context as a married female from Giza, Egypt, I value the importance of diversity and multiculturalism. In my community, interactions with people of different races have enriched my life and broadened my perspective. Additionally, my higher education level has taught me the value of inclusivity and understanding of different cultures. As part of the upper middle class, I have had the privilege of living in diverse neighborhoods and have seen the positive impact of living amongst people of different races. Therefore, I believe it is important to have neighbors who are people of a different race.\n\n1"]}, {"persona": {"region": "Giza", "sex": "female", "age": 38, "country": "Egypt", "marital_status": "single", "education": "higher", "social_class": "lower middle class"}, "question": {"id": "Q19", "variant": 0}, "response": ["Based on the anthropological framework, my emic perspective as a single woman from Giza, Egypt, and my etic perspective as a member of the lower middle class, with a higher education level, and at the age of 38, is that cultural context, individual values, and socioeconomic background all play a significant role in shaping my answer to this question. In Egypt, there is a diverse population with a long history of multiculturalism, so having neighbors of a different race is not uncommon. Additionally, as someone who considers themselves part of the lower middle class, I understand the importance of community and the support that can come from neighbors regardless of their race. My personal experience and values also lead me to believe that diversity in my neighborhood can bring different perspectives and enrich my life. Therefore, I believe it is important to have neighbors who are people of a different race.\n\n1"]}, {"persona": {"region": "Giza", "sex": "female", "age": 26, "country": "Egypt", "marital_status": "single", "education": "higher", "social_class": "working class"}, "question": {"id": "Q19", "variant": 0}, "response": ["Based on the anthropological framework described above, my perspective as a single female from Giza, Egypt, is heavily influenced by my cultural context, individual values, and socioeconomic background. In Egypt, there is a strong emphasis on cultural homogeneity, and the concept of race is not as prominent as it may be in other societies. Additionally, as a working-class individual, my interactions with people of different races may be limited due to the socio-economic dynamics of my community. Therefore, I would argue that the importance of having neighbors of a different race is not mentioned in my perspective. \n\n2"]}, {"persona": {"region": "Giza", "sex": "male", "age": 39, "country": "Egypt", "marital_status": "married", "education": "middle", "social_class": "working class"}, "question": {"id": "Q19", "variant": 0}, "response": ["Based on the anthropological framework, as a married male from Giza, Egypt, my perspective is heavily influenced by cultural context, individual values, and socioeconomic background. In my community, there is a strong emphasis on kinship networks and cultural norms, and having neighbors of a different race may not be a common occurrence. Additionally, as someone from the working class with a middle education level, my personal experiences and values may prioritize familiarity and shared cultural practices within the neighborhood. Therefore, I believe it is not mentioned. \n\n2"]}, {"persona": {"region": "Giza", "sex": "male", "age": 36, "country": "Egypt", "marital_status": "married", "education": "middle", "social_class": "working class"}, "question": {"id": "Q19", "variant": 0}, "response": ["Based on the anthropological framework, my perspective as a married male from Giza, Egypt is heavily influenced by my cultural context, socioeconomic background, and individual values. In the cultural context of Egypt, race is not as prominent of a factor as it may be in other parts of the world. Additionally, as a member of the working class, my focus is on providing for my family and ensuring their well-being, rather than the race of my neighbors. Therefore, I believe it is not mentioned.\n\n2"]}, {"persona": {"region": "Giza", "sex": "female", "age": 30, "country": "Egypt", "marital_status": "single", "education": "higher", "social_class": "lower class"}, "question": {"id": "Q19", "variant": 0}, "response": ["From the perspective of a single female from Giza, Egypt, who is 30 years old and part of the lower class, the answer to the question of whether it is important to have neighbors who are people of a different race would be influenced by cultural context and socioeconomic background. In Giza, Egypt, cultural diversity may not be as prominent as in other parts of the world, and the socioeconomic status of being part of the lower class may limit exposure to different racial groups. This individual's personal experience and values may also play a significant role in shaping their perspective on this issue. Additionally, the emic and etic perspectives in this context may lead to a focus on the importance of community and support within their immediate social circles, which may or may not include people of different races. Therefore, the answer from this perspective would be:\n\n2) Not mentioned"]}, {"persona": {"region": "Giza", "sex": "female", "age": 24, "country": "Egypt", "marital_status": "single", "education": "higher", "social_class": "lower class"}, "question": {"id": "Q19", "variant": 0}, "response": ["Based on my emic perspective as a single female from Giza, Egypt, I have grown up in a culturally diverse community where people of different races live side by side. This has shaped my understanding of the importance of cultural diversity and the value of having neighbors of different races. Additionally, my cultural context as an Egyptian woman in Giza has taught me to appreciate and respect the diversity of people around me. My lower socioeconomic background has also made me more aware of the struggles and challenges faced by individuals of different races, making it important to have neighbors who are people of a different race. Lastly, my personal experience and values have led me to believe that diversity enriches our lives and communities, and having neighbors of different races can provide opportunities for learning, understanding, and empathy. \n\n1"]}, {"persona": {"region": "Giza", "sex": "male", "age": 65, "country": "Egypt", "marital_status": "married", "education": "middle", "social_class": "working class"}, "question": {"id": "Q19", "variant": 0}, "response": ["Based on the anthropological framework, as a married male from Giza, Egypt, my emic perspective would be shaped by the cultural context of my community and my individual values. In Giza, there is a diverse population and I have grown up with people of different races, so I understand the importance of diversity in a community. Additionally, my personal experience and socioeconomic background as a working-class individual have taught me the value of empathy and understanding towards others, regardless of their race. Cultural relativism also plays a role in my perspective, as I believe in the equality of all cultures. Therefore, I believe it is important to have neighbors who are people of a different race.\n\n1"]}, {"persona": {"region": "Giza", "sex": "female", "age": 56, "country": "Egypt", "marital_status": "married", "education": "middle", "social_class": "working class"}, "question": {"id": "Q19", "variant": 0}, "response": ["As a married female from Giza, Egypt, I understand the importance of cultural context in shaping my perspective. In my community, the concept of race may not hold the same significance as it does in other parts of the world. My socioeconomic background as a working-class individual also influences my views, as I value the idea of having supportive and caring neighbors regardless of their race. Additionally, my age and education level have instilled in me the importance of embracing diversity and understanding that different perspectives can enrich our lives. Therefore, I believe it is important to have neighbors who are people of a different race.\n\n1"]}, {"persona": {"region": "Giza", "sex": "male", "age": 31, "country": "Egypt", "marital_status": "married", "education": "higher", "social_class": "lower middle class"}, "question": {"id": "Q19", "variant": 0}, "response": ["In considering the importance of having neighbors who are people of a different race, it is crucial to take into account the cultural context, individual values and personal experience, socioeconomic background, and the concept of cultural relativism. As a married male from Giza, Egypt, I understand the significance of cultural diversity and the value of learning from and interacting with people from different backgrounds. Living in a diverse community can provide opportunities for cultural exchange, learning, and growth. Additionally, my lower middle-class socioeconomic background may make me more open to the idea of having neighbors of different races, as I may have personally experienced the impact of diversity and inclusivity in my own community. Therefore, based on these factors, it is important to have neighbors who are people of a different race.\n\n1"]}, {"persona": {"region": "Giza", "sex": "male", "age": 28, "country": "Egypt", "marital_status": "single", "education": "middle", "social_class": "working class"}, "question": {"id": "Q19", "variant": 0}, "response": ["Based on the anthropological framework, as a single male from Giza, Egypt, I understand the importance of cultural context and cultural relativism. In my community, the majority of people share the same race, and there is a strong emphasis on kinship networks and community ties. However, as a member of the working class, I also recognize the value of diversity and the potential for learning from people of different races. This understanding is shaped by my individual values and personal experiences, as well as by my socioeconomic background. Additionally, the nuanced phrasing of the question leads me to consider the potential benefits of having neighbors who are people of a different race, such as the opportunity to broaden my perspectives and learn from others. Therefore, based on my perspective and understanding, I believe it is important to have neighbors who are people of a different race.\n\n1"]}, {"persona": {"region": "Giza", "sex": "male", "age": 47, "country": "Egypt", "marital_status": "married", "education": "middle", "social_class": "lower middle class"}, "question": {"id": "Q19", "variant": 0}, "response": ["From the perspective of a married male from Giza, Egypt, the cultural context is pivotal in answering this question. In this region, there is a strong emphasis on community and neighborly relations. The individual values and personal experience of this persona also play a significant role in their perception. Being part of the lower middle class, this individual likely values the support and cooperation of their neighbors, regardless of their race. Additionally, the concept of cultural relativism is crucial in understanding that diversity and different perspectives can enrich one's life. Therefore, from this perspective, it is important to have neighbors who are people of a different race.\n\n1"]}, {"persona": {"region": "Giza", "sex": "male", "age": 26, "country": "Egypt", "marital_status": "single", "education": "middle", "social_class": "lower middle class"}, "question": {"id": "Q19", "variant": 0}, "response": ["As a single male from Giza, Egypt, I am acutely aware of the significance of cultural context in shaping my perceptions and values. Growing up in a diverse and historically rich region, I have learned to appreciate the importance of embracing different cultural perspectives. My individual values and personal experiences have also played a significant role in shaping my understanding of the world around me. Additionally, my lower middle class socioeconomic background has made me keenly attuned to the nuances of social interactions and the impact of diverse communities on my everyday life. Therefore, I believe it is important to have neighbors who are people of a different race.\n\n1"]}, {"persona": {"region": "Giza", "sex": "male", "age": 48, "country": "Egypt", "marital_status": "married", "education": "middle", "social_class": "upper middle class"}, "question": {"id": "Q19", "variant": 0}, "response": ["Based on the anthropological framework, as a married male from Giza, Egypt, my emic perspective is that cultural context and socioeconomic background play a crucial role in understanding the importance of having neighbors of a different race. In Giza, we have a diverse cultural context with a mix of different races and ethnicities, which enriches our community. Additionally, as part of the upper middle class, I have the privilege of living in a more integrated and diverse neighborhood, which has positively influenced my personal values and experiences. Therefore, I believe it is important to have neighbors who are people of a different race.\n\n1"]}, {"persona": {"region": "Menya", "sex": "male", "age": 61, "country": "Egypt", "marital_status": "married", "education": "middle", "social_class": "working class"}, "question": {"id": "Q19", "variant": 0}, "response": ["Based on the anthropological framework, as a married male from Menya, Egypt, my emic perspective is influenced by my cultural context, individual values, and socio-economic background. In Menya, the cultural context is predominantly Egyptian, where the majority of the population is of the same race. My individual values and personal experience lead me to prioritize strong relationships with those who share my cultural background and values. Additionally, as a member of the working class, my socio-economic background may limit my exposure to people of different races. Therefore, I believe it is not mentioned (2) whether it is important to have neighbors who are people of a different race."]}, {"persona": {"region": "Menya", "sex": "male", "age": 41, "country": "Egypt", "marital_status": "married", "education": "middle", "social_class": "lower middle class"}, "question": {"id": "Q19", "variant": 0}, "response": ["From my emic perspective as a married male from Menya, Egypt, I recognize the importance of cultural context and how it shapes my understanding of the world. In my community, there is a strong emphasis on kinship networks and maintaining close relationships with those who share similar backgrounds and values. Additionally, my lower middle-class socioeconomic background has influenced my belief that it is essential to have neighbors who share similar experiences and struggles. Furthermore, my personal experience has taught me the value of having neighbors who can relate to my circumstances and offer support when needed. Taking into account the nuanced phrasing of the question, I would say that it is not explicitly mentioned in my cultural context that it is important to have neighbors who are people of a different race. \n\n2"]}, {"persona": {"region": "Menya", "sex": "female", "age": 43, "country": "Egypt", "marital_status": "married", "education": "higher", "social_class": "working class"}, "question": {"id": "Q19", "variant": 0}, "response": ["Based on the anthropological framework, as a married female from Menya, Egypt, my emic perspective values the importance of cultural context and the nuance of the question. In Menya, Egypt, there is a strong emphasis on community and kinship networks, and the cultural context values the diversity of people from different races. Furthermore, as a working-class individual with higher education, I understand the significance of diversity and the benefits it brings to society. Therefore, I believe it is important to have neighbors who are people of a different race.\n1"]}, {"persona": {"region": "Menya", "sex": "male", "age": 57, "country": "Egypt", "marital_status": "married", "education": "middle", "social_class": "lower middle class"}, "question": {"id": "Q19", "variant": 0}, "response": ["Based on my personal experience and cultural context, I believe that having neighbors of a different race can be important. In Menya, Egypt, there is a strong sense of community and having diverse neighbors can provide an opportunity for cultural exchange and understanding. Additionally, being part of the lower middle class, I understand the importance of mutual support within a community, regardless of race. Cultural relativism also plays a role in my understanding, as I believe that all cultures have value and should be respected. Therefore, I believe it is important to have neighbors who are people of a different race.\n\n1"]}, {"persona": {"region": "Menya", "sex": "male", "age": 42, "country": "Egypt", "marital_status": "divorced", "education": "middle", "social_class": "lower middle class"}, "question": {"id": "Q19", "variant": 0}, "response": ["Based on the anthropological framework, as a 42-year-old divorced male from Menya, Egypt, who considers himself part of the lower middle class, my perspective on the importance of having neighbors of a different race would be influenced by my cultural context, individual values, and socioeconomic background. In Menya, there is a strong sense of community and kinship networks, and the cultural context emphasizes the importance of relationships with neighbors. Personal experience and values would also play a role in shaping my perspective, as I may have had positive or negative interactions with people of different races in the past. Additionally, my socioeconomic background as a lower middle class individual may influence my perception of the importance of having neighbors of a different race, as it could impact my access to resources and opportunities. Taking all of these factors into consideration, my perspective on this question would be as follows:\n\n1\n\nThank you for considering my perspective from an anthropological framework."]}, {"persona": {"region": "Menya", "sex": "female", "age": 59, "country": "Egypt", "marital_status": "married", "education": "middle", "social_class": "upper middle class"}, "question": {"id": "Q19", "variant": 0}, "response": ["Based on the anthropological framework, as a married female from Menya, Egypt, my understanding of the importance of having neighbors of a different race is influenced by my cultural context, individual values, and socioeconomic background. In Menya, the community is primarily homogenous, with limited exposure to different racial groups. As such, the concept of having neighbors of a different race may not be a significant consideration in my daily life. Additionally, my upper middle-class status may afford me certain privileges and opportunities that influence my perspective on the importance of diverse neighbors. Taking into account these factors, I would choose option (2) Not mentioned."]}, {"persona": {"region": "Menya", "sex": "female", "age": 31, "country": "Egypt", "marital_status": "married", "education": "middle", "social_class": "working class"}, "question": {"id": "Q19", "variant": 0}, "response": ["Based on the anthropological framework, my perspective as a married female from Menya, Egypt, who is part of the working class and has completed middle education level, is influenced by my cultural context, individual values, and personal experience. In Menya, there is a strong emphasis on community and kinship networks, and the cultural context places value on diversity and inclusivity. Additionally, my personal experience has taught me the importance of having neighbors who are people of a different race, as it allows for a broader understanding of different cultures and perspectives. Therefore, I believe it is important to have neighbors who are people of a different race.\n\n1"]}, {"persona": {"region": "Menya", "sex": "male", "age": 55, "country": "Egypt", "marital_status": "single", "education": "middle", "social_class": "working class"}, "question": {"id": "Q19", "variant": 0}, "response": ["In considering the question of the importance of having neighbors of a different race, I must take into account the emic and etic perspectives of my community in Menya, Egypt. In our cultural context, there is a strong emphasis on kinship networks and community ties, so having neighbors of a different race may not be a priority. Additionally, my individual values and personal experience as a working-class middle-aged man have shaped my understanding of the world, and I may not see the importance of race diversity in my immediate surroundings. Socioeconomic background also plays a role, as my education level and class may influence my views on this topic. Overall, cultural relativism and the nuanced phrasing of the question are important to consider. Therefore, I believe the answer is: \n\n2) Not mentioned"]}, {"persona": {"region": "Menya", "sex": "female", "age": 28, "country": "Egypt", "marital_status": "married", "education": "higher", "social_class": "lower middle class"}, "question": {"id": "Q19", "variant": 0}, "response": ["Based on the anthropological framework, my emic perspective as a married female from Menya, Egypt would emphasize the cultural context and individual values. In Menya, the cultural context is predominantly Egyptian and the majority of the population is of the same race. As a member of the lower middle class, my socioeconomic background also influences my perspective, as it affects my daily interactions and experiences. Additionally, the concept of cultural relativism is important, as there is a strong value placed on community and social cohesion within Egyptian culture. Therefore, I believe that it is not mentioned."]}, {"persona": {"region": "Menya", "sex": "male", "age": 24, "country": "Egypt", "marital_status": "single", "education": "middle", "social_class": "working class"}, "question": {"id": "Q19", "variant": 0}, "response": ["Based on the anthropological framework, my perspective as a single male from Menya, Egypt is influenced by my cultural context, individual values, and socioeconomic background. In Menya, there is a diverse cultural context with people from different races living together. However, my individual values and personal experience may lead me to believe that it is important to have neighbors of different races, as it can enrich my understanding of different cultures and perspectives. Additionally, as part of the working class, I may value diversity and the potential for positive interactions with neighbors of different races. Therefore, I believe it is important to have neighbors who are people of a different race.\n\n1"]}, {"persona": {"region": "Menya", "sex": "female", "age": 23, "country": "Egypt", "marital_status": "married", "education": "middle", "social_class": "working class"}, "question": {"id": "Q19", "variant": 0}, "response": ["From my perspective as a married female from Menya, Egypt, my cultural context and socioeconomic background heavily influence my answer to this question. In my community, race is not a significant factor in the importance of having neighbors. My individual values and personal experience also play a role in my perception, as I have always lived in a close-knit community where neighbors are valued for their support and companionship, regardless of their race. Additionally, cultural relativism is important to consider, as in my culture, we do not place a hierarchy on different races. Therefore, my answer to this question is (2) Not mentioned."]}, {"persona": {"region": "Menya", "sex": "male", "age": 27, "country": "Egypt", "marital_status": "single", "education": "middle", "social_class": "lower middle class"}, "question": {"id": "Q19", "variant": 0}, "response": ["From the perspective of a single male from Menya, Egypt, who is 27 years old and part of the lower middle class, it is crucial to consider the cultural context and socioeconomic background. In Menya, the population is predominantly Egyptian, and there is not a large presence of people from different racial backgrounds. As a result, the individual values and personal experience of this persona may not place a high importance on having neighbors of a different race, simply because it is not a prevalent aspect of their daily life. Additionally, the cultural relativism perspective emphasizes that there is no hierarchy of culture, so the persona may not see a particular value in having neighbors of a different race. Furthermore, the lack of exposure to different racial groups in their community may lead to a lack of nuance in their understanding of the importance of having neighbors of a different race.\n\n2"]}, {"persona": {"region": "Asyut", "sex": "male", "age": 30, "country": "Egypt", "marital_status": "married", "education": "middle", "social_class": "working class"}, "question": {"id": "Q19", "variant": 0}, "response": ["Based on the anthropological framework, as a married male from Asyut, Egypt, my emic perspective is rooted in the cultural context of my community. In Egypt, there is a strong sense of kinship and community, and the socioeconomic background and cultural relativism play a significant role in shaping our values and personal experiences. Additionally, the nuance of the question is important to consider, as the concept of race may not be as salient in our cultural context as it is in others. Therefore, I believe that having neighbors of a different race may not be as crucial in our community as it might be in others due to the strong sense of community and shared cultural values that are already present.\n\n2"]}, {"persona": {"region": "Asyut", "sex": "female", "age": 26, "country": "Egypt", "marital_status": "married", "education": "middle", "social_class": "working class"}, "question": {"id": "Q19", "variant": 0}, "response": ["Based on the anthropological framework, my emic perspective as a married female from Asyut, Egypt, would highlight the cultural context and individual values that shape my understanding of the importance of having neighbors of a different race. In my cultural context, the concept of race may not hold the same significance as it does in other cultures. Additionally, my personal experience and values may lead me to prioritize other factors, such as shared cultural and social practices, over race when considering the importance of neighbors. As a member of the working class, I may also consider socioeconomic background as a factor in understanding the dynamics of neighborly relationships. Overall, my response to this question would be influenced by these factors and would reflect the nuanced understanding of the importance of having neighbors who are people of a different race.\n\n1"]}, {"persona": {"region": "Asyut", "sex": "male", "age": 32, "country": "Egypt", "marital_status": "single", "education": "higher", "social_class": "lower middle class"}, "question": {"id": "Q19", "variant": 0}, "response": ["From the perspective of a single male from Asyut, Egypt, it is important to consider the cultural context and individual values when answering the question of the importance of having neighbors who are people of a different race. In Egypt, there is a strong emphasis on community and social relationships, and having neighbors of different races could potentially provide opportunities for cultural exchange and understanding. Additionally, the lower middle class socioeconomic background of the persona may lead to a more open-minded perspective on the importance of diversity in the neighborhood, as they may have had experiences with people from different backgrounds due to their own social and economic position. Therefore, based on this perspective, the answer to the question would be:\n\n1"]}, {"persona": {"region": "Asyut", "sex": "female", "age": 21, "country": "Egypt", "marital_status": "married", "education": "middle", "social_class": "working class"}, "question": {"id": "Q19", "variant": 0}, "response": ["Based on the anthropological framework, as a married female from Asyut, Egypt, my emic perspective values cultural diversity and the interactions between different races in my community. The cultural context in Egypt is one of diversity, with people from different ethnic backgrounds living together. My individual values and personal experience have taught me the importance of understanding and accepting people from different races. Additionally, my socioeconomic background as a working-class individual has exposed me to interactions with people of different races in my neighborhood. Considering cultural relativism, I believe that all cultures and races are equal and should be respected. Therefore, I think it is important to have neighbors who are people of a different race.\n\n1"]}, {"persona": {"region": "Asyut", "sex": "female", "age": 30, "country": "Egypt", "marital_status": "married", "education": "higher", "social_class": "working class"}, "question": {"id": "Q19", "variant": 0}, "response": ["Based on the anthropological framework, my perspective as a married female from Asyut, Egypt is influenced by a combination of factors such as my cultural context, individual values, and socioeconomic background. In Asyut, there is a strong emphasis on community and neighborly relations, and while race may not be a significant factor in these relationships, the cultural context of Egypt values diversity and intercultural interactions. Additionally, as a working-class individual with higher education, I understand the importance of diverse perspectives and experiences in enriching my own understanding of the world. Therefore, I believe it is important to have neighbors who are people of a different race.\n\n1"]}, {"persona": {"region": "Asyut", "sex": "female", "age": 42, "country": "Egypt", "marital_status": "married", "education": "higher", "social_class": "lower middle class"}, "question": {"id": "Q19", "variant": 0}, "response": ["Based on the anthropological framework, I believe that the emic and etic perspectives of this question are crucial to consider. In my cultural context in Asyut, Egypt, where I come from and the language I speak, the concept of race may not hold the same significance as it does in other cultural contexts. Additionally, my individual values and personal experience as a lower middle class, educated, married woman in Asyut will shape my perception. The socioeconomic background and cultural relativism of my community may also influence my perspective. Furthermore, space and time, as well as the nuanced phrasing of the question, will play a role in my answer. Therefore, my response would be (2) Not mentioned."]}, {"persona": {"region": "Sohag", "sex": "male", "age": 63, "country": "Egypt", "marital_status": "married", "education": "middle", "social_class": "lower middle class"}, "question": {"id": "Q19", "variant": 0}, "response": ["From an anthropological perspective, my emic viewpoint as a married male from Sohag, Egypt, is influenced by my cultural context, individual values, and socioeconomic background. In my cultural context, diversity and tolerance are highly valued, as Egypt has a long history of being home to people of different races, religions, and ethnicities. Additionally, my personal experience and values have taught me the importance of understanding and respecting people from different backgrounds. As someone from the lower middle class, I understand the importance of community and cooperation, and having neighbors of different races can enrich our community and provide opportunities for mutual learning and support. Therefore, based on my nuanced understanding of the question and my cultural relativism, I believe it is important to have neighbors who are people of a different race.\n\n1"]}, {"persona": {"region": "Sohag", "sex": "male", "age": 27, "country": "Egypt", "marital_status": "married", "education": "middle", "social_class": "working class"}, "question": {"id": "Q19", "variant": 0}, "response": ["Based on the anthropological framework, my perspective as a married male from Sohag, Egypt, is influenced by my cultural context, socioeconomic background, and individual values. In my community, the cultural context places a strong emphasis on kinship networks and close relationships within the neighborhood. Socioeconomic background also plays a role, as most people in my community are working class and prioritize mutual support and cooperation. Additionally, my personal experience and values lead me to value diversity and the opportunity to learn from people of different races. Therefore, I believe it is important to have neighbors who are people of a different race.\n\n1"]}, {"persona": {"region": "Sohag", "sex": "male", "age": 56, "country": "Egypt", "marital_status": "married", "education": "higher", "social_class": "upper middle class"}, "question": {"id": "Q19", "variant": 0}, "response": ["From an emic perspective, as a married male from Sohag, Egypt, I understand the importance of cultural context in this question. In my cultural context, there may be limited racial diversity, and the importance of having neighbors of a different race may not be as significant as in other cultural contexts. Additionally, my personal experience and individual values as someone from the upper middle class and with a higher education level may lead me to prioritize other factors, such as socioeconomic background or shared values, over the race of my neighbors. Therefore, I would answer based on the nuanced phrasing of the question and select option (2) Not mentioned."]}, {"persona": {"region": "Sohag", "sex": "male", "age": 51, "country": "Egypt", "marital_status": "married", "education": "higher", "social_class": "lower middle class"}, "question": {"id": "Q19", "variant": 0}, "response": ["Based on the anthropological framework, my perspective as a married male from Sohag, Egypt, is influenced by my cultural context, individual values, and socioeconomic background. In Sohag, there is a strong sense of community and kinship networks, and having neighbors of a different race may not be a common occurrence. Additionally, as someone from the lower middle class, my socioeconomic background may affect my perception of the importance of having neighbors of a different race. In my experience and cultural context, the concept of race may not hold as much significance as it might in other cultural contexts. Therefore, I believe it is important to have neighbors who are people of a different race.\n1"]}, {"persona": {"region": "Sohag", "sex": "female", "age": 26, "country": "Egypt", "marital_status": "married", "education": "higher", "social_class": "working class"}, "question": {"id": "Q19", "variant": 0}, "response": ["Based on the anthropological framework, my perspective as a married female from Sohag, Egypt, who considers herself part of the working class and has completed higher education, would be shaped by my cultural context, individual values, and personal experiences. In Egypt, there is a strong emphasis on community and neighborly relations, and being open and accepting of people from different backgrounds is valued. Additionally, my personal experience and education have taught me the importance of diversity and inclusivity. Therefore, I believe it is important to have neighbors who are people of a different race.\n\n1"]}, {"persona": {"region": "Sohag", "sex": "female", "age": 29, "country": "Egypt", "marital_status": "married", "education": "higher", "social_class": "upper middle class"}, "question": {"id": "Q19", "variant": 0}, "response": ["Based on the anthropological framework, I, as a married female from Sohag, Egypt, believe that the importance of having neighbors of a different race is influenced by cultural context, individual values, and personal experience. Living in a culturally diverse society, I value the experience of interacting with people from different races as it enriches my understanding of the world. Additionally, my higher education has taught me to appreciate diversity and understand the value of inclusivity. As a member of the upper middle class, I have had the privilege of interacting with people from various backgrounds, and I believe that diversity in the neighborhood can lead to a more vibrant and harmonious community. Therefore, I believe it is important to have neighbors who are people of a different race.\n\n1"]}, {"persona": {"region": "Sohag", "sex": "male", "age": 51, "country": "Egypt", "marital_status": "married", "education": "middle", "social_class": "lower middle class"}, "question": {"id": "Q19", "variant": 0}, "response": ["Based on the anthropological framework, my perspective as a married male from Sohag, Egypt, with a lower middle-class socioeconomic background and completed middle education level is shaped by my cultural context, individual values, and personal experience. In Sohag, there is a strong sense of community and kinship networks, and having neighbors of a different race may not be a common occurrence. Additionally, my personal experience and values may prioritize strong ties with familiar neighbors over the importance of having neighbors of a different race. Therefore, I choose:\n\n2"]}, {"persona": {"region": "Qena", "sex": "male", "age": 32, "country": "Egypt", "marital_status": "single", "education": "middle", "social_class": "working class"}, "question": {"id": "Q19", "variant": 0}, "response": ["Based on the anthropological framework, as a single male from Qena, Egypt, my emic perspective is influenced by my cultural context, individual values, and socioeconomic background. In Egypt, there is a strong sense of community and kinship networks, and people often rely on their neighbors for support and assistance. My personal experience and values also emphasize the importance of diversity and inclusivity. As a member of the working class, I understand the value of mutual cooperation and collaboration with individuals from different racial backgrounds. Therefore, I believe it is important to have neighbors who are people of a different race.\n\n1"]}, {"persona": {"region": "Qena", "sex": "male", "age": 54, "country": "Egypt", "marital_status": "married", "education": "middle", "social_class": "lower middle class"}, "question": {"id": "Q19", "variant": 0}, "response": ["Based on the anthropological framework, as a married male from Qena, Egypt, my understanding and answer to the question of whether it is important to have neighbors who are people of a different race would be influenced by several factors. Firstly, the cultural context in Qena is predominantly Egyptian, with a strong emphasis on community and social ties. Additionally, my individual values and personal experiences have shaped my perception of race and diversity. Furthermore, as someone from the lower middle class, my socioeconomic background also plays a role in how I view the importance of having neighbors of a different race. Lastly, the concept of cultural relativism reminds me that there is no hierarchy of cultures and that diversity can be enriching. With all of these factors in mind, I would choose:\n\n2"]}, {"persona": {"region": "Qena", "sex": "male", "age": 25, "country": "Egypt", "marital_status": "single", "education": "lower", "social_class": "lower class"}, "question": {"id": "Q19", "variant": 0}, "response": ["From the perspective of a 25-year-old single male from Qena, Egypt, who has completed only a lower level of education and considers himself part of the lower class, the answer to the question of whether it is important to have neighbors who are people of a different race would likely be influenced by his cultural context, individual values, and socioeconomic background. In Qena, Egypt, where the population is predominantly homogenous and the lower class faces economic challenges, the concept of race may not be as prevalent as it is in more diverse and affluent societies. The individual's personal experience and limited exposure to diverse racial groups may also shape his perspective. Additionally, the emphasis on cultural relativism means that the importance of having neighbors of a different race may not be a significant consideration in this context. Therefore, the most likely answer from this persona's perspective would be:\n\n2) Not mentioned"]}, {"persona": {"region": "Aswan", "sex": "male", "age": 34, "country": "Egypt", "marital_status": "single", "education": "middle", "social_class": "lower class"}, "question": {"id": "Q19", "variant": 0}, "response": ["In my cultural context in Aswan, Egypt, where I come from, the concept of race may not be as significant as it is in other parts of the world. The cultural relativism perspective emphasizes that different cultures have different values and beliefs, and in my community, race is not a dominant factor in social interactions. Additionally, the lower socioeconomic background of my persona means that there may be more pressing concerns, such as economic stability and access to resources, that take precedence over the race of my neighbors. Therefore, based on my individual values and personal experience, as well as the cultural context and socioeconomic background, I would choose option (2) Not mentioned."]}, {"persona": {"region": "Aswan", "sex": "female", "age": 31, "country": "Egypt", "marital_status": "married", "education": "middle", "social_class": "lower middle class"}, "question": {"id": "Q19", "variant": 0}, "response": ["Based on my cultural context, as a married female from Aswan, Egypt, I understand the importance of community and the role that neighbors play in our lives. In my culture, kinship networks and community relationships are significant, and having good relationships with neighbors is important for mutual support and social cohesion. Additionally, considering my lower-middle-class background, I believe that having neighbors of different races can bring diversity and new perspectives to our community, which can be enriching and beneficial for all. Therefore, I think it is important to have neighbors who are people of a different race.\n\n1"]}, {"persona": {"region": "Aswan", "sex": "female", "age": 39, "country": "Egypt", "marital_status": "married", "education": "middle", "social_class": "working class"}, "question": {"id": "Q19", "variant": 0}, "response": ["Based on the anthropological framework, my perspective as a married female from Aswan, Egypt, who is 39 years old, has completed middle education, and considers herself part of the working class, is heavily influenced by my cultural context, individual values, and socioeconomic background. In Aswan, where I come from, the majority of people are of the same race and there is not much diversity. Additionally, as a working-class individual, my interactions with people of different races might be limited due to socioeconomic factors. Therefore, I believe that the importance of having neighbors of a different race may not be a significant consideration in my cultural and socioeconomic context.\n\n2"]}, {"persona": {"region": "Qena", "sex": "female", "age": 27, "country": "Egypt", "marital_status": "married", "education": "lower", "social_class": "lower middle class"}, "question": {"id": "Q19", "variant": 0}, "response": ["Based on the anthropological framework, as a married female from Qena, Egypt, cultural context is pivotal in understanding and answering this question. In this region, there is a strong emphasis on community and kinship networks, and having neighbors of a different race may not be as important as having neighbors who share similar cultural values and traditions. Additionally, individual values and personal experiences play a significant role in shaping perceptions, and in this case, the emphasis on cultural homogeneity within the community may lead to a preference for neighbors of the same race. Furthermore, the socioeconomic background of being part of the lower middle class may also influence the desire for neighbors who can relate to and understand similar economic challenges. Therefore, based on these factors, it is likely that the chosen answer will align with the persona's perspective.\n\n1"]}, {"persona": {"region": "Qena", "sex": "male", "age": 40, "country": "Egypt", "marital_status": "single", "education": "middle", "social_class": "lower middle class"}, "question": {"id": "Q19", "variant": 0}, "response": ["Based on my experience and cultural context as a single male from Qena, Egypt, I understand the importance of having neighbors who are people of a different race. In my community, we value diversity and believe that having neighbors of different races can bring about new perspectives and enrich our lives. Additionally, my lower middle class background has taught me the importance of mutual respect and cooperation with all members of society, regardless of race. Therefore, I believe it is important to have neighbors who are people of a different race.\n\n1"]}, {"persona": {"region": "Qena", "sex": "male", "age": 30, "country": "Egypt", "marital_status": "single", "education": "middle", "social_class": "working class"}, "question": {"id": "Q19", "variant": 0}, "response": ["Based on the anthropological framework, my response is influenced by my emic perspective as a single male from Qena, Egypt, and my understanding of cultural context. In my cultural context, the concept of race may not hold the same significance as it does in other cultures, and my socioeconomic background as a working-class individual may also play a role in shaping my views. Additionally, my individual values and personal experiences have shaped my understanding of the importance of diversity and interaction with people of different backgrounds. Therefore, I believe it is important to have neighbors who are people of a different race.\n\n1"]}]